R: 65 05 01 09 06 a1 01 05 07 19 e0 29 e7 15 00 25 01 75 01 95 08 81 02 75 08 95 01 81 01 05 08 75 01 95 05 19 01 29 05 91 02 75 03 95 01 91 01 05 07 19 00 2a ff 00 15 00 26 ff 00 75 08 95 06 81 00 c0
N: Genius Gila Gaming Mouse
P: usb-0000:04:00.0-1/input1
I: 3 0458 0138
E: 0.000000 8 00 00 22 00 00 00 00 00
E: 0.002039 8 00 00 00 00 00 00 00 00
E: 0.003987 8 00 00 20 00 00 00 00 00
E: 0.005988 8 00 00 00 00 00 00 00 00
E: 0.007987 8 00 00 1f 00 00 00 00 00
E: 0.010036 8 00 00 00 00 00 00 00 00
E: 0.012056 8 00 00 1e 00 00 00 00 00
E: 0.014011 8 00 00 00 00 00 00 00 00
E: 0.015987 8 00 00 00 00 00 00 00 00
E: 0.018010 8 00 00 00 00 00 00 00 00
E: 0.020005 8 00 00 00 00 00 00 00 00
E: 0.021992 8 00 00 00 00 00 00 00 00
E: 0.493993 8 00 00 1d 00 00 00 00 00
E: 0.495988 8 00 00 00 00 00 00 00 00
E: 0.498027 8 00 00 00 00 00 00 00 00
E: 3.443963 8 00 00 1d 00 00 00 00 00
E: 3.445958 8 00 00 00 00 00 00 00 00
E: 3.447945 8 00 00 00 00 00 00 00 00
