R: 225 05 01 09 06 a1 01 85 01 05 07 19 e0 29 e7 15 00 25 01 75 01 95 08 81 02 75 08 95 01 81 01 75 01 95 05 05 08 19 01 29 05 91 02 75 03 95 01 91 01 75 08 95 06 15 00 26 ff 00 05 07 19 00 2a ff 00 81 00 c0 05 0c 09 01 a1 01 85 47 05 01 09 06 a1 02 05 06 09 20 15 00 26 ff 00 75 08 95 01 81 02 c0 c0 05 0c 09 01 a1 01 85 11 15 00 25 01 75 01 95 03 81 01 75 01 95 01 05 0c 09 b8 81 02 06 ff 00 09 03 81 02 75 01 95 03 81 01 05 0c 85 12 15 00 25 01 75 01 95 01 09 cd 81 02 09 b3 81 02 09 b4 81 02 09 b5 81 02 09 b6 81 02 81 01 81 01 81 01 85 13 15 00 25 01 75 01 95 01 06 01 ff 09 0a 81 02 06 01 ff 09 0c 81 22 75 01 95 06 81 01 85 09 09 0b 75 08 95 01 b1 02 75 08 95 02 b1 01 c0 00
N: Apple Wireless Keyboard
P: 00:19:0e:11:03:8f
I: 5 05ac 0256
E: 0.000000 9 01 00 00 28 00 00 00 00 00
E: 0.017557 9 01 00 00 00 00 00 00 00 00
E: 3.554934 9 01 00 00 04 00 00 00 00 00
# a
E: 3.583653 9 01 00 00 04 16 00 00 00 00
# s
E: 3.743679 9 01 00 00 04 16 07 00 00 00
# d
E: 3.832422 9 01 00 00 07 16 00 00 00 00
E: 3.833795 9 01 00 00 07 00 00 00 00 00
E: 3.883670 9 01 00 00 00 00 00 00 00 00
E: 3.907433 9 01 00 00 0d 00 00 00 00 00
# j
E: 4.042443 9 01 00 00 0d 04 00 00 00 00
# a
E: 4.076149 9 01 00 00 0d 04 0b 00 00 00
# h
E: 4.079900 9 01 00 00 0b 04 00 00 00 00
E: 4.104774 9 01 00 00 0b 04 16 00 00 00
# s
E: 4.207373 9 01 00 00 16 04 00 00 00 00
E: 4.208704 9 01 00 00 16 04 07 00 00 00
# d
E: 4.242437 9 01 00 00 07 04 00 00 00 00
E: 4.254823 9 01 00 00 07 00 00 00 00 00
E: 4.317327 9 01 00 00 07 0d 00 00 00 00
# j
E: 4.332397 9 01 00 00 07 0d 0e 00 00 00
# k
E: 4.333668 9 01 00 00 0e 0d 00 00 00 00
E: 4.433671 9 01 00 00 0d 00 00 00 00 00
E: 4.435049 9 01 00 00 0d 0b 00 00 00 00
# h
E: 4.436174 9 01 00 00 0d 0b 04 00 00 00
# a
E: 4.437379 9 01 00 00 16 0b 04 00 00 00
# s
E: 4.493691 9 01 00 00 16 0b 04 07 00 00
# d
E: 4.494897 9 01 00 00 16 07 04 00 00 00
E: 4.547423 9 01 00 00 16 07 04 0e 00 00
# k
E: 4.548668 9 01 00 00 16 07 04 0e 0d 00
# j
E: 4.564925 9 01 00 00 0d 07 04 0e 00 00
E: 4.566174 9 01 00 00 0d 07 0e 00 00 00
E: 4.604808 9 01 00 00 0d 0e 00 00 00 00
E: 4.667350 9 01 00 00 0d 0e 0b 00 00 00
# h
E: 4.672382 9 01 00 00 0d 0b 00 00 00 00
E: 4.673678 9 01 00 00 0d 0b 04 00 00 00
# a
E: 4.675046 9 01 00 00 04 0b 00 00 00 00
E: 4.677394 9 01 00 00 04 0b 16 00 00 00
# s
E: 4.729800 9 01 00 00 04 0b 16 07 00 00
# d
E: 4.739932 9 01 00 00 04 07 16 00 00 00
E: 4.751152 9 01 00 00 04 07 16 0e 00 00
# k
E: 4.761176 9 01 00 00 04 07 16 0e 0d 00
# j
E: 4.792346 9 01 00 00 04 07 0d 0e 00 00
E: 4.797423 9 01 00 00 0e 07 0d 00 00 00
E: 4.823653 9 01 00 00 0e 0d 00 00 00 00
E: 4.907428 9 01 00 00 0e 0d 0b 00 00 00
# h
E: 4.908672 9 01 00 00 0b 0d 00 00 00 00
E: 4.909816 9 01 00 00 0b 00 00 00 00 00
E: 4.954806 9 01 00 00 00 00 00 00 00 00
E: 4.959943 9 01 00 00 16 00 00 00 00 00
# s
E: 4.969890 9 01 00 00 16 04 00 00 00 00
# a
E: 4.971147 9 01 00 00 16 04 07 00 00 00
# d
E: 5.079799 9 01 00 00 07 04 00 00 00 00
E: 5.084900 9 01 00 00 07 00 00 00 00 00
E: 5.086179 9 01 00 00 00 00 00 00 00 00
