R: 131 05 01 09 02 a1 01 85 01 09 01 a1 00 05 09 19 01 29 05 15 00 25 01 95 05 75 01 81 02 95 01 75 03 81 01 05 01 09 30 09 31 09 38 15 81 25 7f 75 08 95 03 81 06 c0 c0 05 01 09 80 a1 01 85 02 19 81 29 83 15 00 25 01 95 03 75 01 81 02 95 01 75 05 81 01 c0 05 0c 09 01 a1 01 85 03 19 00 2a ff 7f 15 00 26 ff 7f 95 01 75 10 81 00 c0 06 00 ff 09 01 a1 01 85 06 15 00 26 ff 00 09 30 95 02 75 08 81 02 c0
N: Imperator
P: usb-0000:00:14.0-4/input1
I: 3 0458 4018
E: 0.000000 3 03 cd 00
E: 0.128005 3 03 00 00
E: 0.654997 3 03 b6 00
E: 0.783988 3 03 00 00
E: 1.154988 3 03 b5 00
E: 1.282977 3 03 00 00
E: 1.612955 3 03 ea 00
E: 1.751972 3 03 00 00
E: 2.113976 3 03 e9 00
E: 2.252984 3 03 00 00
E: 3.015988 3 03 b7 00
E: 3.160976 3 03 00 00
E: 4.056948 3 06 f1 00
E: 4.059932 5 01 00 00 00 00
E: 4.675944 3 06 f2 00
E: 4.676926 5 01 00 00 00 00
E: 5.345940 3 06 f3 00
E: 5.347926 5 01 00 00 00 00
E: 6.533971 3 03 e2 00
E: 6.676992 3 03 00 00
