R: 62 05 01 09 06 a1 01 05 07 19 e0 29 e7 15 00 25 01 75 01 95 08 81 02 95 01 75 08 81 01 95 03 75 01 05 08 19 01 29 03 91 02 95 05 75 01 91 01 95 06 75 08 26 ff 00 05 07 19 00 29 fe 81 00 c0
N: Imperator
P: usb-0000:00:14.0-4/input0
I: 3 0458 4018
E: 0.000001 8 00 00 00 00 00 00 00 00
E: 0.842003 8 00 00 00 00 00 00 00 00
E: 2.358984 8 00 00 00 00 00 00 00 00
E: 6.310994 8 00 00 c0 00 00 00 00 00
E: 6.360007 8 00 00 00 00 00 00 00 00
E: 6.409046 8 00 00 00 00 00 00 00 00
E: 7.112010 8 00 00 c1 00 00 00 00 00
E: 7.161003 8 00 00 00 00 00 00 00 00
E: 7.209985 8 00 00 00 00 00 00 00 00
E: 7.824986 8 00 00 c2 00 00 00 00 00
E: 7.873983 8 00 00 00 00 00 00 00 00
E: 7.922987 8 00 00 00 00 00 00 00 00
E: 8.629993 8 00 00 c3 00 00 00 00 00
E: 8.678999 8 00 00 00 00 00 00 00 00
E: 8.727978 8 00 00 00 00 00 00 00 00
E: 9.378980 8 00 00 c4 00 00 00 00 00
E: 9.427991 8 00 00 00 00 00 00 00 00
E: 9.476974 8 00 00 00 00 00 00 00 00
E: 10.217976 8 00 00 c5 00 00 00 00 00
E: 10.266990 8 00 00 00 00 00 00 00 00
E: 10.315973 8 00 00 00 00 00 00 00 00
E: 23.036938 8 00 00 c0 00 00 00 00 00
E: 23.085937 8 00 00 00 00 00 00 00 00
E: 23.134909 8 00 00 00 00 00 00 00 00
E: 24.742939 8 00 00 c1 00 00 00 00 00
E: 24.791936 8 00 00 00 00 00 00 00 00
E: 24.840978 8 00 00 00 00 00 00 00 00
E: 26.211921 8 00 00 c2 00 00 00 00 00
E: 26.260933 8 00 00 00 00 00 00 00 00
E: 26.309969 8 00 00 00 00 00 00 00 00
E: 27.449927 8 00 00 c3 00 00 00 00 00
E: 27.498930 8 00 00 00 00 00 00 00 00
E: 27.547962 8 00 00 00 00 00 00 00 00
E: 28.508928 8 00 00 c4 00 00 00 00 00
E: 28.557956 8 00 00 00 00 00 00 00 00
E: 28.606914 8 00 00 00 00 00 00 00 00
E: 29.471909 8 00 00 c5 00 00 00 00 00
E: 29.520881 8 00 00 00 00 00 00 00 00
E: 29.569956 8 00 00 00 00 00 00 00 00
E: 63.259810 8 00 00 65 00 00 00 00 00
E: 63.343850 8 00 00 00 00 00 00 00 00
E: 71.879783 8 00 00 65 00 00 00 00 00
E: 71.969819 8 00 00 00 00 00 00 00 00
