R: 261 05 01 09 06 a1 01 85 01 75 01 95 08 05 07 19 e0 29 e7 15 00 25 01 81 02 95 01 75 08 81 03 95 05 75 01 05 08 19 01 29 05 91 02 95 01 75 03 91 03 95 06 75 08 15 00 26 ff 00 05 07 19 00 29 ff 81 00 c0 05 0c 09 01 a1 01 85 02 15 00 25 01 75 01 95 12 09 cd 09 ea 09 e9 0a 23 02 09 b5 09 b6 0a 25 02 0a 24 02 0a 8a 01 0a 2a 02 0a 26 02 0a 94 01 09 b7 0a 27 02 0a 92 01 09 e2 0a 83 01 0a 21 02 81 02 95 01 75 06 81 03 c0 05 0c 09 01 a1 01 85 03 05 01 09 06 a1 02 05 06 09 20 15 00 26 ff 00 75 08 95 01 81 02 c0 c0 05 01 09 80 a1 01 85 04 15 00 25 01 75 01 95 02 09 82 09 83 81 02 95 01 75 06 81 03 c0 05 0c 09 01 a1 01 85 05 05 01 09 06 a1 02 06 00 ff 25 01 75 01 95 02 0a 03 fe 0a 04 fe 81 02 95 06 81 03 c0 c0 05 0c 09 01 a1 01 85 ff 05 06 95 01 75 02 19 24 29 26 81 02 75 06 81 01 c0 00
N: ION iCade Game Controller
P: 5c:ac:4c:c6:7d:b7
I: 5 15e4 0132
E: 0.000001 9 01 00 00 1a 00 00 00 00 00
E: 0.001078 9 01 00 00 00 00 00 00 00 00
E: 0.238660 9 01 00 00 08 00 00 00 00 00
E: 0.239881 9 01 00 00 00 00 00 00 00 00
E: 1.063888 9 01 00 00 04 00 00 00 00 00
E: 1.064975 9 01 00 00 00 00 00 00 00 00
E: 1.276411 9 01 00 00 14 00 00 00 00 00
E: 1.277546 9 01 00 00 00 00 00 00 00 00
E: 1.613952 9 01 00 00 1b 00 00 00 00 00
E: 1.615063 9 01 00 00 00 00 00 00 00 00
E: 1.888992 9 01 00 00 1d 00 00 00 00 00
E: 1.890123 9 01 00 00 00 00 00 00 00 00
E: 2.264035 9 01 00 00 07 00 00 00 00 00
E: 2.265124 9 01 00 00 00 00 00 00 00 00
E: 2.514070 9 01 00 00 06 00 00 00 00 00
E: 2.515212 9 01 00 00 00 00 00 00 00 00
E: 3.014149 9 01 00 00 1c 00 00 00 00 00
E: 3.015390 9 01 00 00 00 00 00 00 00 00
E: 3.114144 9 01 00 00 17 00 00 00 00 00
E: 3.115387 9 01 00 00 00 00 00 00 00 00
E: 3.376704 9 01 00 00 0b 00 00 00 00 00
E: 3.377923 9 01 00 00 00 00 00 00 00 00
E: 3.539207 9 01 00 00 15 00 00 00 00 00
E: 3.540403 9 01 00 00 00 00 00 00 00 00
E: 3.801731 9 01 00 00 18 00 00 00 00 00
E: 3.802997 9 01 00 00 00 00 00 00 00 00
E: 3.964277 9 01 00 00 09 00 00 00 00 00
E: 3.965499 9 01 00 00 00 00 00 00 00 00
E: 4.276838 9 01 00 00 0d 00 00 00 00 00
E: 4.278040 9 01 00 00 00 00 00 00 00 00
E: 4.439311 9 01 00 00 11 00 00 00 00 00
E: 4.440614 9 01 00 00 00 00 00 00 00 00
E: 4.726868 9 01 00 00 0c 00 00 00 00 00
E: 4.728097 9 01 00 00 00 00 00 00 00 00
E: 4.876871 9 01 00 00 10 00 00 00 00 00
E: 4.878116 9 01 00 00 00 00 00 00 00 00
E: 5.164433 9 01 00 00 0e 00 00 00 00 00
E: 5.165652 9 01 00 00 00 00 00 00 00 00
E: 5.314432 9 01 00 00 13 00 00 00 00 00
E: 5.315670 9 01 00 00 00 00 00 00 00 00
E: 5.589462 9 01 00 00 12 00 00 00 00 00
E: 5.590729 9 01 00 00 00 00 00 00 00 00
E: 5.714473 9 01 00 00 0a 00 00 00 00 00
E: 5.715722 9 01 00 00 00 00 00 00 00 00
E: 6.077058 9 01 00 00 0f 00 00 00 00 00
E: 6.078235 9 01 00 00 00 00 00 00 00 00
E: 6.227034 9 01 00 00 19 00 00 00 00 00
E: 6.228284 9 01 00 00 00 00 00 00 00 00
