R: 401 05 03 09 05 a1 01 06 00 ff 09 01 a1 02 05 01 85 01 09 3b 15 00 26 ff 00 75 08 95 01 81 03 09 3b 15 00 27 ff ff 00 00 75 10 95 01 81 03 09 3b 15 00 27 ff ff 00 00 75 10 95 01 81 03 09 3b 15 00 27 ff ff 00 00 75 10 95 01 81 03 09 3b 15 00 26 ff 00 75 08 95 10 81 03 09 3b 15 00 26 ff 00 75 08 95 10 81 03 09 3b 15 00 26 ff 00 75 08 95 10 81 03 09 3b 15 00 27 ff ff 00 00 75 10 95 03 81 03 85 02 09 3b 15 00 27 ff ff 00 00 75 10 95 01 b1 03 09 3b 15 00 26 ff 00 75 08 95 04 b1 03 85 03 09 3b 15 00 27 ff ff 00 00 75 10 95 01 b1 03 09 3b 15 00 26 ff 00 75 08 95 42 b1 03 85 04 09 3b 15 00 27 ff ff 00 00 75 10 95 01 b1 03 09 3b 15 00 26 ff 00 75 08 95 05 b1 03 85 05 09 3b 15 00 27 ff ff 00 00 75 10 95 01 b1 03 09 3b 15 00 26 ff 00 75 08 95 03 b1 03 85 06 09 3b 15 00 27 ff ff 00 00 75 10 95 01 b1 03 09 3b 15 00 26 ff 00 75 08 95 01 b1 03 85 07 09 3b 15 00 27 ff ff 00 00 75 10 95 01 b1 03 09 3b 15 00 26 ff 00 75 08 95 02 b1 03 85 08 09 3b 15 00 27 ff ff 00 00 75 10 95 01 b1 03 09 3b 15 00 26 ff 00 75 08 95 02 b1 03 85 09 09 3b 15 00 27 ff ff 00 00 75 10 95 01 b1 03 09 3b 15 00 26 ff 00 75 08 95 35 b1 03 85 0a 09 3b 15 00 27 ff ff 00 00 75 10 95 01 b1 03 09 3b 15 00 26 ff 00 75 08 95 0c b1 03 c0 c0
N: Oculus VR, Inc. Tracker DK
P: usb-0000:00:1a.0-1.2/input0
I: 3 2833 0001
