R: 78 05 01 09 04 a1 01 a1 02 75 08 95 02 15 00 26 ff 00 35 00 46 ff 00 09 30 09 31 81 02 75 01 95 14 25 01 45 01 05 09 19 01 29 14 81 02 06 00 ff 75 01 95 04 25 01 45 01 09 01 81 02 c0 a1 02 75 08 95 07 46 ff 00 26 ff 00 09 02 91 02 c0 c0
N: Namtai Wbuzz
P: usb-0000:00:1a.0-1.1/input0
I: 3 054c 1000
E: 0.000000 5 00 00 00 80 f0
E: 0.239981 5 00 00 00 00 f0
E: 0.935986 5 00 00 00 00 f1
E: 1.127987 5 00 00 00 00 f0
E: 1.383989 5 00 00 00 00 f2
E: 1.567988 5 00 00 00 00 f0
E: 1.848000 5 00 00 00 00 f4
E: 2.039995 5 00 00 00 00 f0
E: 2.295956 5 00 00 00 00 f8
E: 2.496017 5 00 00 00 00 f0
E: 3.312006 5 00 00 01 00 f0
E: 3.552040 5 00 00 00 00 f0
E: 4.104014 5 00 00 02 00 f0
E: 4.272012 5 00 00 00 00 f0
E: 4.568015 5 00 00 04 00 f0
E: 4.728017 5 00 00 00 00 f0
E: 5.056025 5 00 00 08 00 f0
E: 5.183968 5 00 00 00 00 f0
E: 5.480057 5 00 00 10 00 f0
E: 5.688030 5 00 00 00 00 f0
E: 6.408064 5 00 00 00 04 f0
E: 6.624041 5 00 00 00 00 f0
E: 7.000038 5 00 00 00 08 f0
E: 7.208011 5 00 00 00 00 f0
E: 7.448020 5 00 00 00 10 f0
E: 7.624048 5 00 00 00 00 f0
E: 7.920046 5 00 00 00 20 f0
E: 8.120055 5 00 00 00 00 f0
E: 8.408066 5 00 00 00 40 f0
E: 8.624052 5 00 00 00 00 f0
E: 9.336008 5 00 00 20 00 f0
E: 9.567994 5 00 00 00 00 f0
E: 10.168067 5 00 00 40 00 f0
E: 10.376104 5 00 00 00 00 f0
E: 10.840077 5 00 00 80 00 f0
E: 11.040073 5 00 00 00 00 f0
E: 11.448100 5 00 00 00 01 f0
E: 11.680111 5 00 00 00 00 f0
E: 12.072084 5 00 00 00 02 f0
E: 12.304084 5 00 00 00 00 f0
E: 14.208104 5 00 00 00 80 f0
E: 14.376105 5 00 00 00 00 f0
