R: 728 05 01 09 01 a1 01 85 01 09 01 a1 00 05 09 09 01 95 01 75 01 15 00 25 01 81 02 95 07 75 01 81 03 95 01 75 08 81 03 05 01 09 30 09 31 15 00 26 ff 7f 35 00 46 00 00 95 02 75 10 81 02 c0 a1 02 15 00 26 ff 00 09 01 95 39 75 08 81 03 c0 c0 05 0d 09 0e a1 01 85 11 09 23 a1 02 09 52 09 53 15 00 25 0a 75 08 95 02 b1 02 c0 c0 09 04 a1 01 85 13 05 0d 09 22 a1 02 09 42 15 00 25 01 75 01 95 01 81 02 09 32 81 02 09 47 81 02 95 05 81 03 75 08 09 51 95 01 81 02 05 01 26 ff 7f 75 10 55 0e 65 33 09 30 35 00 46 51 07 81 02 09 31 46 96 04 81 02 05 0d 75 10 95 01 09 48 81 02 09 49 81 02 c0 05 0d 09 22 a1 02 09 42 15 00 25 01 75 01 95 01 81 02 09 32 81 02 09 47 81 02 95 05 81 03 75 08 09 51 95 01 81 02 05 01 26 ff 7f 75 10 55 0e 65 33 09 30 35 00 46 51 07 81 02 09 31 46 96 04 81 02 05 0d 75 10 95 01 09 48 81 02 09 49 81 02 c0 05 0d 09 22 a1 02 09 42 15 00 25 01 75 01 95 01 81 02 09 32 81 02 09 47 81 02 95 05 81 03 75 08 09 51 95 01 81 02 05 01 26 ff 7f 75 10 55 0e 65 33 09 30 35 00 46 51 07 81 02 09 31 46 96 04 81 02 05 0d 75 10 95 01 09 48 81 02 09 49 81 02 c0 05 0d 09 22 a1 02 09 42 15 00 25 01 75 01 95 01 81 02 09 32 81 02 09 47 81 02 95 05 81 03 75 08 09 51 95 01 81 02 05 01 26 ff 7f 75 10 55 0e 65 33 09 30 35 00 46 51 07 81 02 09 31 46 96 04 81 02 05 0d 75 10 95 01 09 48 81 02 09 49 81 02 c0 05 0d 09 22 a1 02 09 42 15 00 25 01 75 01 95 01 81 02 09 32 81 02 09 47 81 02 95 05 81 03 75 08 09 51 95 01 81 02 05 01 26 ff 7f 75 10 55 0e 65 33 09 30 35 00 46 51 07 81 02 09 31 46 96 04 81 02 05 0d 75 10 95 01 09 48 81 02 09 49 81 02 c0 05 0d 09 22 a1 02 09 42 15 00 25 01 75 01 95 01 81 02 09 32 81 02 09 47 81 02 95 05 81 03 75 08 09 51 95 01 81 02 05 01 26 ff 7f 75 10 55 0e 65 33 09 30 35 00 46 51 07 81 02 09 31 46 96 04 81 02 05 0d 75 10 95 01 09 48 81 02 09 49 81 02 c0 05 0d 09 54 95 01 75 08 15 00 25 3c 81 02 06 00 ff 09 01 15 00 26 ff 00 75 08 95 02 81 03 05 0d 85 12 09 55 95 01 75 08 15 00 25 3c b1 02 06 00 ff 15 00 26 ff 00 85 03 09 01 75 08 95 07 b1 02 85 04 09 01 75 08 95 17 b1 02 85 05 09 01 75 08 95 47 b1 02 85 06 09 01 75 08 95 07 b1 02 85 73 09 01 75 08 95 07 b1 02 85 08 09 01 75 08 95 07 b1 02 85 09 09 01 75 08 95 3f b1 02 85 0f 09 01 75 08 96 07 02 b1 02 c0
N: 3M 3M MicroTouch USB controller
I: 3 0596 0502
