R: 187 05 0d 09 04 a1 01 85 01 09 22 a1 02 09 42 15 00 25 01 75 01 95 01 81 02 09 32 81 02 95 06 81 03 75 08 09 51 95 01 81 02 05 01 26 ff 0f 75 10 55 0e 65 33 09 30 35 00 46 6d 03 81 02 46 ec 01 09 31 81 02 c0 a1 02 05 0d 09 42 15 00 25 01 75 01 95 01 81 02 09 32 81 02 95 06 81 03 75 08 09 51 95 01 81 02 05 01 26 ff 0f 75 10 55 0e 65 33 09 30 35 00 46 6d 03 81 02 46 ec 01 09 31 81 02 c0 05 0d 09 54 95 01 75 08 15 00 25 02 81 02 85 02 09 55 b1 02 c0 06 00 ff 09 01 a1 01 85 a6 95 22 75 08 26 ff 00 15 00 09 01 81 02 85 a5 95 06 75 08 26 ff 00 15 00 09 01 91 02 c0
N: Multi Touch Panel with Controller
I: 3 2087 0a02
