R: 601 05 01 09 02 a1 01 85 01 09 01 a1 00 05 09 19 01 29 03 15 00 25 01 95 03 75 01 81 02 95 01 75 05 81 01 05 01 09 30 09 31 15 81 25 7f 75 08 95 02 81 06 c0 c0 05 0d 09 04 a1 01 85 02 09 22 09 53 95 01 75 08 81 02 a1 02 05 0d 09 42 15 00 25 01 75 01 95 01 81 02 09 32 81 02 09 47 81 02 95 05 81 03 75 08 09 51 95 01 81 02 15 00 25 20 09 48 81 02 09 49 81 02 05 01 15 00 26 d0 07 75 10 55 00 65 00 09 30 15 00 26 d0 07 35 00 45 00 81 02 09 31 45 00 81 02 c0 a1 02 05 0d 09 42 15 00 25 01 75 01 95 01 81 02 09 32 81 02 09 47 81 02 95 05 81 03 75 08 09 51 95 01 81 02 15 00 25 20 09 48 81 02 09 49 81 02 05 01 15 00 26 d0 07 75 10 55 00 65 00 09 30 15 00 26 d0 07 35 00 45 00 81 02 09 31 45 00 81 02 c0 a1 02 05 0d 09 42 15 00 25 01 75 01 95 01 81 02 09 32 81 02 09 47 81 02 95 05 81 03 75 08 09 51 95 01 81 02 15 00 25 20 09 48 81 02 09 49 81 02 05 01 15 00 26 d0 07 75 10 55 00 65 00 09 30 15 00 26 d0 07 35 00 45 00 81 02 09 31 45 00 81 02 c0 a1 02 05 0d 09 42 15 00 25 01 75 01 95 01 81 02 09 32 81 02 09 47 81 02 95 05 81 03 75 08 09 51 95 01 81 02 15 00 25 20 09 48 81 02 09 49 81 02 05 01 15 00 26 d0 07 75 10 55 00 65 00 09 30 15 00 26 d0 07 35 00 45 00 81 02 09 31 45 00 81 02 c0 a1 02 05 0d 09 42 15 00 25 01 75 01 95 01 81 02 09 32 81 02 09 47 81 02 95 05 81 03 75 08 09 51 95 01 81 02 15 00 25 20 09 48 81 02 09 49 81 02 05 01 15 00 26 d0 07 75 10 55 00 65 00 09 30 15 00 26 d0 07 35 00 45 00 81 02 09 31 45 00 81 02 c0 a1 02 05 0d 09 42 15 00 25 01 75 01 95 01 81 02 09 32 81 02 09 47 81 02 95 05 81 03 75 08 09 51 95 01 81 02 15 00 25 20 09 48 81 02 09 49 81 02 05 01 15 00 26 d0 07 75 10 55 00 65 00 09 30 15 00 26 d0 07 35 00 45 00 81 02 09 31 45 00 81 02 c0 05 0d 09 54 95 01 75 08 15 00 25 0a 81 02 09 55 b1 02 c0 09 0e a1 01 85 03 09 23 a1 02 09 52 09 53 15 00 25 0a 75 08 95 02 b1 02 c0 c0
N: Cypress Semiconductor CYTMA14-100-001A
I: 3 04b4 c001
