R: 225 05 01 09 02 a1 01 85 01 09 01 a1 00 05 09 19 01 29 03 15 00 25 01 95 03 75 01 81 02 95 01 75 05 81 01 05 01 09 30 09 31 15 00 26 ff 0f 35 00 46 ff 0f 75 10 95 02 81 02 c0 c0 05 0d 09 04 a1 01 85 02 09 22 a1 02 09 42 15 00 25 01 75 01 95 01 81 02 09 32 81 02 95 06 81 03 75 08 09 51 95 01 81 02 05 01 26 ff 0f 75 10 55 00 65 00 09 30 35 00 46 00 00 81 02 09 31 81 02 c0 a1 02 05 0d 09 42 15 00 25 01 75 01 95 01 81 02 09 32 81 02 95 06 81 03 75 08 09 51 95 01 81 02 05 01 26 ff 0f 75 10 55 00 65 00 09 30 35 00 46 00 00 81 02 09 31 81 02 c0 05 0d 09 54 95 01 75 08 81 02 85 03 09 55 25 02 b1 02 c0 09 0e a1 01 85 04 09 23 a1 02 09 52 09 53 15 00 25 0a 75 08 95 02 b1 02 c0 c0 65 05 01 09 06 a1 01 05 07 19 e0 29 e7 15 00 25 01 75 01 95 08 81 02 95 01 75 08 81 01 95 05 75 01 05 08 19 01 29 05 91 02 95 03 75 01 91 01 95 06 75 08 15 00 26 ff 00 05 07 19 00 2a ff 00 81 00 c0 52 06 a0 ff 09 01 a1 01 09 02 a1 00 06 a1 ff 09 03 09 04 15 80 25 7f 35 00 45 ff 75 08 95 08 81 02 09 05 09 06 15 80 25 7f 35 00 45 ff 75 08 95 08 91 02 c0 c0
N: AtomTouch MultiTouch AtomTouch MultiTouch
I: 3 03fc 05d8
