R: 273 05 0d 09 04 a1 01 85 01 09 22 a1 02 09 42 15 00 25 01 75 01 95 01 81 02 09 32 81 02 95 06 81 03 75 08 09 51 95 01 81 02 05 01 26 ff 0f 75 10 55 0e 65 33 09 30 35 00 46 ff 0f 81 02 46 ff 0f 09 31 81 02 c0 a1 02 05 0d 09 42 15 00 25 01 75 01 95 01 81 02 09 32 81 02 95 06 81 03 75 08 09 51 95 01 81 02 05 01 26 ff 0f 75 10 55 00 65 00 09 30 35 00 46 ff 0f 81 02 46 ff 0f 09 31 81 02 c0 05 0d 09 54 25 10 95 01 75 08 81 02 85 08 09 55 25 02 b1 02 c0 09 0e a1 01 85 07 09 22 a1 00 09 52 09 53 15 00 25 0a 75 08 95 02 b1 02 c0 06 00 ff 09 55 85 80 15 00 26 ff 00 75 08 95 01 b1 82 c0 05 01 09 02 a1 01 85 54 09 01 a1 00 05 09 19 01 29 02 15 00 25 01 75 01 95 02 81 02 95 06 81 03 05 01 09 30 15 00 26 ff 0f 75 10 95 01 81 02 09 31 75 10 95 01 81 02 09 3b 16 00 00 26 00 01 36 00 00 46 00 01 66 00 00 75 10 95 01 81 62 c0 c0
N: Elo TouchSystems Elo TouchSystems 2515 IntelliTouch Plus USB Touchmonitor
I: 3 04e7 0022
