R: 2271 05 0d 09 04 a1 01 85 05 09 22 a1 02 05 0d 15 00 25 01 75 01 95 01 09 42 81 02 09 32 81 02 95 06 81 03 75 08 95 01 25 7f 09 51 81 02 05 01 65 11 55 0e 75 10 35 00 26 a6 2b 46 48 1b 09 30 81 02 26 90 18 46 59 0f 09 31 81 02 05 0d 65 11 55 0f 75 08 25 7f 45 7f 09 48 81 02 09 49 81 02 65 00 55 00 75 10 26 00 04 46 00 04 09 30 81 02 c0 05 0d 09 22 65 00 55 00 a1 02 05 0d 15 00 25 01 75 01 95 01 09 42 81 02 09 32 81 02 95 06 81 03 75 08 95 01 25 7f 09 51 81 02 05 01 65 11 55 0e 75 10 35 00 26 a6 2b 46 48 1b 09 30 81 02 26 90 18 46 59 0f 09 31 81 02 05 0d 65 11 55 0f 75 08 25 7f 45 7f 09 48 81 02 09 49 81 02 65 00 55 00 75 10 26 00 04 46 00 04 09 30 81 02 c0 05 0d 09 22 65 00 55 00 a1 02 05 0d 15 00 25 01 75 01 95 01 09 42 81 02 09 32 81 02 95 06 81 03 75 08 95 01 25 7f 09 51 81 02 05 01 65 11 55 0e 75 10 35 00 26 a6 2b 46 48 1b 09 30 81 02 26 90 18 46 59 0f 09 31 81 02 05 0d 65 11 55 0f 75 08 25 7f 45 7f 09 48 81 02 09 49 81 02 65 00 55 00 75 10 26 00 04 46 00 04 09 30 81 02 c0 05 0d 09 22 65 00 55 00 a1 02 05 0d 15 00 25 01 75 01 95 01 09 42 81 02 09 32 81 02 95 06 81 03 75 08 95 01 25 7f 09 51 81 02 05 01 65 11 55 0e 75 10 35 00 26 a6 2b 46 48 1b 09 30 81 02 26 90 18 46 59 0f 09 31 81 02 05 0d 65 11 55 0f 75 08 25 7f 45 7f 09 48 81 02 09 49 81 02 65 00 55 00 75 10 26 00 04 46 00 04 09 30 81 02 c0 05 0d 09 22 65 00 55 00 a1 02 05 0d 15 00 25 01 75 01 95 01 09 42 81 02 09 32 81 02 95 06 81 03 75 08 95 01 25 7f 09 51 81 02 05 01 65 11 55 0e 75 10 35 00 26 a6 2b 46 48 1b 09 30 81 02 26 90 18 46 59 0f 09 31 81 02 05 0d 65 11 55 0f 75 08 25 7f 45 7f 09 48 81 02 09 49 81 02 65 00 55 00 75 10 26 00 04 46 00 04 09 30 81 02 c0 05 0d 09 22 65 00 55 00 a1 02 05 0d 15 00 25 01 75 01 95 01 09 42 81 02 09 32 81 02 95 06 81 03 75 08 95 01 25 7f 09 51 81 02 05 01 65 11 55 0e 75 10 35 00 26 a6 2b 46 48 1b 09 30 81 02 26 90 18 46 59 0f 09 31 81 02 05 0d 65 11 55 0f 75 08 25 7f 45 7f 09 48 81 02 09 49 81 02 65 00 55 00 75 10 26 00 04 46 00 04 09 30 81 02 c0 05 0d 09 22 65 00 55 00 a1 02 05 0d 15 00 25 01 75 01 95 01 09 42 81 02 09 32 81 02 95 06 81 03 75 08 95 01 25 7f 09 51 81 02 05 01 65 11 55 0e 75 10 35 00 26 a6 2b 46 48 1b 09 30 81 02 26 90 18 46 59 0f 09 31 81 02 05 0d 65 11 55 0f 75 08 25 7f 45 7f 09 48 81 02 09 49 81 02 65 00 55 00 75 10 26 00 04 46 00 04 09 30 81 02 c0 05 0d 09 22 65 00 55 00 a1 02 05 0d 15 00 25 01 75 01 95 01 09 42 81 02 09 32 81 02 95 06 81 03 75 08 95 01 25 7f 09 51 81 02 05 01 65 11 55 0e 75 10 35 00 26 a6 2b 46 48 1b 09 30 81 02 26 90 18 46 59 0f 09 31 81 02 05 0d 65 11 55 0f 75 08 25 7f 45 7f 09 48 81 02 09 49 81 02 65 00 55 00 75 10 26 00 04 46 00 04 09 30 81 02 c0 05 0d 09 22 65 00 55 00 a1 02 05 0d 15 00 25 01 75 01 95 01 09 42 81 02 09 32 81 02 95 06 81 03 75 08 95 01 25 7f 09 51 81 02 05 01 65 11 55 0e 75 10 35 00 26 a6 2b 46 48 1b 09 30 81 02 26 90 18 46 59 0f 09 31 81 02 05 0d 65 11 55 0f 75 08 25 7f 45 7f 09 48 81 02 09 49 81 02 65 00 55 00 75 10 26 00 04 46 00 04 09 30 81 02 c0 05 0d 09 22 65 00 55 00 a1 02 05 0d 15 00 25 01 75 01 95 01 09 42 81 02 09 32 81 02 95 06 81 03 75 08 95 01 25 7f 09 51 81 02 05 01 65 11 55 0e 75 10 35 00 26 a6 2b 46 48 1b 09 30 81 02 26 90 18 46 59 0f 09 31 81 02 05 0d 65 11 55 0f 75 08 25 7f 45 7f 09 48 81 02 09 49 81 02 65 00 55 00 75 10 26 00 04 46 00 04 09 30 81 02 c0 05 0d 09 22 65 00 55 00 a1 02 05 0d 15 00 25 01 75 01 95 01 09 42 81 02 09 32 81 02 95 06 81 03 75 08 95 01 25 7f 09 51 81 02 05 01 65 11 55 0e 75 10 35 00 26 a6 2b 46 48 1b 09 30 81 02 26 90 18 46 59 0f 09 31 81 02 05 0d 65 11 55 0f 75 08 25 7f 45 7f 09 48 81 02 09 49 81 02 65 00 55 00 75 10 26 00 04 46 00 04 09 30 81 02 c0 05 0d 09 22 65 00 55 00 a1 02 05 0d 15 00 25 01 75 01 95 01 09 42 81 02 09 32 81 02 95 06 81 03 75 08 95 01 25 7f 09 51 81 02 05 01 65 11 55 0e 75 10 35 00 26 a6 2b 46 48 1b 09 30 81 02 26 90 18 46 59 0f 09 31 81 02 05 0d 65 11 55 0f 75 08 25 7f 45 7f 09 48 81 02 09 49 81 02 65 00 55 00 75 10 26 00 04 46 00 04 09 30 81 02 c0 05 0d 09 22 65 00 55 00 a1 02 05 0d 15 00 25 01 75 01 95 01 09 42 81 02 09 32 81 02 95 06 81 03 75 08 95 01 25 7f 09 51 81 02 05 01 65 11 55 0e 75 10 35 00 26 a6 2b 46 48 1b 09 30 81 02 26 90 18 46 59 0f 09 31 81 02 05 0d 65 11 55 0f 75 08 25 7f 45 7f 09 48 81 02 09 49 81 02 65 00 55 00 75 10 26 00 04 46 00 04 09 30 81 02 c0 05 0d 09 22 65 00 55 00 a1 02 05 0d 15 00 25 01 75 01 95 01 09 42 81 02 09 32 81 02 95 06 81 03 75 08 95 01 25 7f 09 51 81 02 05 01 65 11 55 0e 75 10 35 00 26 a6 2b 46 48 1b 09 30 81 02 26 90 18 46 59 0f 09 31 81 02 05 0d 65 11 55 0f 75 08 25 7f 45 7f 09 48 81 02 09 49 81 02 65 00 55 00 75 10 26 00 04 46 00 04 09 30 81 02 c0 05 0d 09 22 65 00 55 00 a1 02 05 0d 15 00 25 01 75 01 95 01 09 42 81 02 09 32 81 02 95 06 81 03 75 08 95 01 25 7f 09 51 81 02 05 01 65 11 55 0e 75 10 35 00 26 a6 2b 46 48 1b 09 30 81 02 26 90 18 46 59 0f 09 31 81 02 05 0d 65 11 55 0f 75 08 25 7f 45 7f 09 48 81 02 09 49 81 02 65 00 55 00 75 10 26 00 04 46 00 04 09 30 81 02 c0 05 0d 09 22 65 00 55 00 a1 02 05 0d 15 00 25 01 75 01 95 01 09 42 81 02 09 32 81 02 95 06 81 03 75 08 95 01 25 7f 09 51 81 02 05 01 65 11 55 0e 75 10 35 00 26 a6 2b 46 48 1b 09 30 81 02 26 90 18 46 59 0f 09 31 81 02 05 0d 65 11 55 0f 75 08 25 7f 45 7f 09 48 81 02 09 49 81 02 65 00 55 00 75 10 26 00 04 46 00 04 09 30 81 02 c0 05 0d 09 22 65 00 55 00 a1 02 05 0d 15 00 25 01 75 01 95 01 09 42 81 02 09 32 81 02 95 06 81 03 75 08 95 01 25 7f 09 51 81 02 05 01 65 11 55 0e 75 10 35 00 26 a6 2b 46 48 1b 09 30 81 02 26 90 18 46 59 0f 09 31 81 02 05 0d 65 11 55 0f 75 08 25 7f 45 7f 09 48 81 02 09 49 81 02 65 00 55 00 75 10 26 00 04 46 00 04 09 30 81 02 c0 05 0d 09 22 65 00 55 00 a1 02 05 0d 15 00 25 01 75 01 95 01 09 42 81 02 09 32 81 02 95 06 81 03 75 08 95 01 25 7f 09 51 81 02 05 01 65 11 55 0e 75 10 35 00 26 a6 2b 46 48 1b 09 30 81 02 26 90 18 46 59 0f 09 31 81 02 05 0d 65 11 55 0f 75 08 25 7f 45 7f 09 48 81 02 09 49 81 02 65 00 55 00 75 10 26 00 04 46 00 04 09 30 81 02 c0 05 0d 09 22 65 00 55 00 a1 02 05 0d 15 00 25 01 75 01 95 01 09 42 81 02 09 32 81 02 95 06 81 03 75 08 95 01 25 7f 09 51 81 02 05 01 65 11 55 0e 75 10 35 00 26 a6 2b 46 48 1b 09 30 81 02 26 90 18 46 59 0f 09 31 81 02 05 0d 65 11 55 0f 75 08 25 7f 45 7f 09 48 81 02 09 49 81 02 65 00 55 00 75 10 26 00 04 46 00 04 09 30 81 02 c0 05 0d 09 22 65 00 55 00 a1 02 05 0d 15 00 25 01 75 01 95 01 09 42 81 02 09 32 81 02 95 06 81 03 75 08 95 01 25 7f 09 51 81 02 05 01 65 11 55 0e 75 10 35 00 26 a6 2b 46 48 1b 09 30 81 02 26 90 18 46 59 0f 09 31 81 02 05 0d 65 11 55 0f 75 08 25 7f 45 7f 09 48 81 02 09 49 81 02 65 00 55 00 75 10 26 00 04 46 00 04 09 30 81 02 c0 65 00 55 00 05 0d 55 0c 66 01 10 75 20 95 01 27 ff ff ff 7f 45 00 09 56 81 02 75 08 95 01 15 00 25 28 09 54 81 02 09 55 85 06 25 28 b1 02 c0 65 00 55 00 45 00 09 0e a1 01 85 03 09 23 a1 02 09 52 15 02 25 02 75 08 95 01 b1 02 09 53 15 00 25 0a 75 08 95 01 b1 02 c0 c0
N: FlatFrog FlatFrog Multitouch 3200
I: 3 25b5 0002
