R: 173 05 0d 09 04 a1 01 85 01 09 22 a1 02 09 42 09 32 15 00 25 01 75 01 95 02 81 02 95 06 81 03 09 51 75 08 95 01 81 02 05 01 09 30 09 31 15 00 26 ff 7f 75 10 95 02 81 02 c0 05 0d a1 02 09 42 09 32 15 00 25 01 75 01 95 02 81 02 95 06 81 03 09 51 75 08 95 01 81 02 05 01 09 30 09 31 15 00 26 ff 7f 75 10 95 02 81 02 c0 05 0d 09 54 15 00 25 02 95 01 75 08 81 02 85 02 09 55 b1 02 c0 06 00 ff 09 00 a1 01 19 00 29 ff 15 00 25 ff 75 08 85 52 09 01 95 03 81 02 85 54 09 02 91 02 85 56 09 03 95 11 81 02 85 57 09 04 95 ab 81 02 c0
N: GeneralTouch Technology Co., Ltd Touchscreen Sensing Win7-TwoFinger
I: 3 0dfc 0001
