R: 669 05 0d 09 04 a1 01 85 01 09 22 a1 02 09 42 15 00 25 01 75 01 95 01 81 02 09 32 81 02 09 47 81 02 95 05 81 03 75 08 09 51 95 01 81 02 05 01 26 ff 7f 75 10 55 0f 65 11 09 30 35 00 46 df 00 81 02 09 31 46 7e 00 81 02 c0 a1 02 05 0d 09 42 15 00 25 01 75 01 95 01 81 02 09 32 81 02 09 47 81 02 95 05 81 03 75 08 09 51 95 01 81 02 05 01 26 ff 7f 75 10 55 0f 65 11 09 30 35 00 46 df 00 81 02 09 31 46 7e 00 81 02 c0 a1 02 05 0d 09 42 15 00 25 01 75 01 95 01 81 02 09 32 81 02 09 47 81 02 95 05 81 03 75 08 09 51 95 01 81 02 05 01 26 ff 7f 75 10 55 0f 65 11 09 30 35 00 46 df 00 81 02 09 31 46 7e 00 81 02 c0 a1 02 05 0d 09 42 15 00 25 01 75 01 95 01 81 02 09 32 81 02 09 47 81 02 95 05 81 03 75 08 09 51 95 01 81 02 05 01 26 ff 7f 75 10 55 0f 65 11 09 30 35 00 46 df 00 81 02 09 31 46 7e 00 81 02 c0 a1 02 05 0d 09 42 15 00 25 01 75 01 95 01 81 02 09 32 81 02 09 47 81 02 95 05 81 03 75 08 09 51 95 01 81 02 05 01 26 ff 7f 75 10 55 0f 65 11 09 30 35 00 46 df 00 81 02 09 31 46 7e 00 81 02 c0 a1 02 05 0d 09 42 15 00 25 01 75 01 95 01 81 02 09 32 81 02 09 47 81 02 95 05 81 03 75 08 09 51 95 01 81 02 05 01 26 ff 7f 75 10 55 0f 65 11 09 30 35 00 46 df 00 81 02 09 31 46 7e 00 81 02 c0 a1 02 05 0d 09 42 15 00 25 01 75 01 95 01 81 02 09 32 81 02 09 47 81 02 95 05 81 03 75 08 09 51 95 01 81 02 05 01 26 ff 7f 75 10 55 0f 65 11 09 30 35 00 46 df 00 81 02 09 31 46 7e 00 81 02 c0 a1 02 05 0d 09 42 15 00 25 01 75 01 95 01 81 02 09 32 81 02 09 47 81 02 95 05 81 03 75 08 09 51 95 01 81 02 05 01 26 ff 7f 75 10 55 0f 65 11 09 30 35 00 46 df 00 81 02 09 31 46 7e 00 81 02 c0 a1 02 05 0d 09 42 15 00 25 01 75 01 95 01 81 02 09 32 81 02 09 47 81 02 95 05 81 03 75 08 09 51 95 01 81 02 05 01 26 ff 7f 75 10 55 0f 65 11 09 30 35 00 46 df 00 81 02 09 31 46 7e 00 81 02 c0 a1 02 05 0d 09 42 15 00 25 01 75 01 95 01 81 02 09 32 81 02 09 47 81 02 95 05 81 03 75 08 09 51 95 01 81 02 05 01 26 ff 7f 75 10 55 0f 65 11 09 30 35 00 46 df 00 81 02 09 31 46 7e 00 81 02 c0 05 0d 09 54 95 01 75 08 15 00 25 05 81 02 85 02 09 55 b1 02 c0 38 06 00 ff 09 01 a1 01 19 00 29 ff 15 00 25 ff 95 40 75 08 81 02 09 01 19 00 29 ff 15 00 25 ff 95 40 75 08 91 02 c0
N: GOODIX  Goodix_GT81X_USB
I: 3 0416 0152
