R: 224 05 0d 09 04 a1 01 85 01 09 22 a1 02 09 42 15 00 25 01 75 01 95 01 81 02 09 32 81 02 95 06 81 03 75 08 09 51 95 01 81 02 05 01 26 ff 0f 75 10 55 0e 65 33 09 30 35 00 46 b5 04 81 02 46 8a 03 09 31 81 02 c0 a1 02 05 0d 09 42 15 00 25 01 75 01 95 01 81 02 09 32 81 02 95 06 81 03 75 08 09 51 95 01 81 02 05 01 26 ff 0f 75 10 55 0e 65 33 09 30 35 00 46 b5 04 81 02 46 8a 03 09 31 81 02 c0 05 0d 09 54 95 01 75 08 81 02 85 02 09 55 25 02 b1 02 c0 09 0e a1 01 85 03 09 22 a1 00 09 52 09 53 15 00 25 0a 75 08 95 02 b1 02 c0 c0 05 01 09 02 a1 01 85 04 09 01 a1 00 05 09 19 01 29 02 15 00 25 01 75 01 95 02 81 02 95 06 81 03 05 01 09 30 09 31 75 10 95 02 15 00 26 ff 0f 81 02 c0 c0
N: GoodTouch 
I: 3 1aad 000f
