R: 281 05 0d 09 04 a1 01 85 0a 09 22 a1 00 09 42 09 32 15 00 25 01 95 02 75 01 81 02 95 06 81 03 05 01 26 ff 1f 75 10 95 01 55 0d 65 33 09 31 35 00 46 61 13 81 02 09 30 46 73 22 81 02 05 0d 75 08 95 01 09 30 26 ff 00 81 02 09 51 81 02 85 0c 09 55 25 02 95 01 b1 02 c0 06 00 ff 85 02 09 01 75 08 95 07 b1 02 85 03 09 02 75 08 95 07 b1 02 85 04 09 03 75 08 95 07 b1 02 85 05 09 04 75 08 95 07 b1 02 85 06 09 05 75 08 96 27 00 b1 02 85 07 09 06 75 08 96 27 00 b1 02 85 08 09 07 75 08 95 07 b1 02 85 09 09 08 75 08 95 07 b1 02 85 0b 09 09 75 08 96 07 00 b1 02 85 0d 09 0a 75 08 96 27 00 b1 02 c0 09 0e a1 01 85 0e 09 52 09 53 95 07 b1 02 c0 05 01 09 02 a1 01 85 01 09 01 a1 00 05 09 19 01 29 02 15 00 25 01 75 01 95 02 81 02 75 06 95 01 81 01 05 01 09 31 09 30 15 00 27 ff 1f 00 00 75 10 95 02 81 02 c0 09 01 a1 02 15 00 26 ff 00 95 02 75 08 81 03 c0 c0
N: IDEACOM  IDC 6650
I: 3 1cb6 6650
