R: 384 05 0d 09 04 a1 01 85 02 09 20 a1 00 09 42 09 32 15 00 25 01 95 02 75 01 81 02 95 06 75 01 81 03 05 01 95 08 75 01 81 01 09 30 75 10 95 01 a4 66 00 00 16 00 00 26 80 13 36 00 00 46 80 13 81 02 09 31 16 00 00 26 00 0b 36 00 00 46 00 0b 81 02 b4 c0 c0 05 01 09 01 a1 01 85 01 09 01 a1 00 05 09 19 01 29 01 15 00 25 01 95 01 75 01 81 02 95 01 75 07 81 01 95 08 75 01 81 01 05 01 09 30 75 10 95 01 66 00 00 16 00 00 26 80 13 36 00 00 46 80 13 81 02 09 31 16 00 00 26 00 0b 36 00 00 46 00 0b 81 02 c0 c0 06 00 ff 09 01 a1 01 09 01 85 03 15 00 26 ff 00 75 08 95 3f 81 02 06 00 ff 09 01 15 00 26 ff 00 75 08 95 3f 91 02 c0 05 0d 09 04 a1 01 85 04 09 22 a1 02 09 42 15 00 25 01 75 01 95 01 81 02 09 32 81 02 95 06 81 03 75 08 09 51 95 01 81 02 05 01 75 10 66 00 00 09 30 26 80 13 35 00 46 80 13 81 02 09 31 26 00 0b 46 00 0b 81 02 c0 a1 02 05 0d 09 42 15 00 25 01 75 01 95 01 81 02 09 32 81 02 95 06 81 03 75 08 09 51 95 01 81 02 05 01 75 10 66 00 00 09 30 26 80 13 35 00 46 80 13 81 02 09 31 26 00 0b 46 00 0b 81 02 c0 05 0d 09 54 95 01 75 08 15 00 25 08 81 02 09 55 b1 02 c0 05 0d 09 0e a1 01 85 05 09 22 a1 00 09 52 09 53 15 00 25 0a 75 08 95 02 b1 02 c0 c0
N: ILITEK ILITEK Multi-Touch
I: 3 222a 0001
