R: 435 05 0d 09 04 a1 01 85 0a 09 22 a1 02 05 0d 09 42 15 00 25 01 75 01 95 01 81 02 09 32 81 02 09 47 81 02 95 05 81 03 75 08 09 51 95 01 81 02 05 01 15 00 26 ff 7f 75 10 09 30 81 02 09 31 81 02 05 0d 09 48 09 49 95 02 81 02 c0 a1 02 05 0d 09 42 15 00 25 01 75 01 95 01 81 02 09 32 81 02 09 47 81 02 95 05 81 03 75 08 09 51 95 01 81 02 05 01 15 00 26 ff 7f 75 10 09 30 81 02 09 31 81 02 05 0d 09 48 09 49 95 02 81 02 c0 a1 02 05 0d 09 42 15 00 25 01 75 01 95 01 81 02 09 32 81 02 09 47 81 02 95 05 81 03 75 08 09 51 95 01 81 02 05 01 15 00 26 ff 7f 75 10 09 30 81 02 09 31 81 02 05 0d 09 48 09 49 95 02 81 02 c0 a1 02 05 0d 09 42 15 00 25 01 75 01 95 01 81 02 09 32 81 02 09 47 81 02 95 05 81 03 75 08 09 51 95 01 81 02 05 01 15 00 26 ff 7f 75 10 09 30 81 02 09 31 81 02 05 0d 09 48 09 49 95 02 81 02 c0 a1 02 05 0d 09 42 15 00 25 01 75 01 95 01 81 02 09 32 81 02 09 47 81 02 95 05 81 03 75 08 09 51 95 01 81 02 05 01 15 00 26 ff 7f 75 10 09 30 81 02 09 31 81 02 05 0d 09 48 09 49 95 02 81 02 c0 a1 02 05 0d 09 42 15 00 25 01 75 01 95 01 81 02 09 32 81 02 09 47 81 02 95 05 81 03 75 08 09 51 95 01 81 02 05 01 15 00 26 ff 7f 75 10 09 30 81 02 09 31 81 02 05 0d 09 48 09 49 95 02 81 02 c0 05 0d 09 54 95 01 75 08 81 02 09 55 25 06 b1 02 c0 09 0e a1 01 85 0c 09 23 a1 02 09 52 15 00 25 06 75 08 95 01 b1 02 c0 c0
N: IRM Touch IRM MultiTouch Screen
I: 3 23c9 5666
