R: 324 05 01 09 02 a1 01 85 10 09 01 a1 00 05 09 19 01 29 02 15 00 25 01 95 02 75 01 81 02 95 06 81 03 05 01 09 30 09 31 15 00 26 ff 7f 75 10 95 02 81 02 c0 c0 05 0d 09 04 a1 01 85 30 09 22 a1 02 09 42 15 00 25 01 75 01 95 01 81 02 09 32 81 02 09 47 81 02 95 05 81 03 09 51 75 08 95 01 81 02 05 01 09 30 26 ff 7f 55 0f 65 11 35 00 46 51 02 75 10 95 01 81 02 09 31 35 00 46 73 01 81 02 c0 a1 02 05 0d 09 42 15 00 25 01 75 01 95 01 81 02 09 32 81 02 09 47 81 02 95 05 81 03 09 51 75 08 95 01 81 02 05 01 09 30 26 ff 7f 55 0f 65 11 35 00 46 51 02 75 10 95 01 81 02 09 31 35 00 46 73 01 81 02 c0 05 0d 09 54 15 00 26 02 00 75 08 95 01 81 02 85 03 09 55 15 00 26 ff 00 75 08 95 01 b1 02 c0 05 0d 09 0e a1 01 85 02 09 52 09 53 15 00 26 ff 00 75 08 95 02 b1 02 c0 05 0d 09 02 a1 01 85 20 09 20 a1 00 09 42 15 00 25 01 75 01 95 01 81 02 95 07 81 03 05 01 09 30 26 ff 7f 55 0f 65 11 35 00 46 51 02 75 10 95 01 81 02 09 31 35 00 46 73 01 81 02 85 01 06 00 ff 09 01 75 08 95 01 b1 02 c0 c0
N: Beijing IRTOUCHSYSTEMS Co.,LtD IRTOUCH InfraRed USB TouchScreen
I: 3 6615 0070
