R: 297 05 0d 09 04 a1 01 09 22 a1 02 09 42 15 00 25 01 75 01 95 01 81 02 95 03 81 03 09 32 09 47 95 02 81 02 95 02 81 03 09 51 75 08 95 01 81 02 05 01 26 ff 7f 65 11 55 0e 46 b0 0e 75 10 95 01 09 30 81 02 09 31 46 c2 0b 81 02 c0 a1 02 05 0d 09 42 15 00 25 01 75 01 95 01 81 02 95 03 81 03 09 32 09 47 95 02 81 02 95 02 81 03 09 51 75 08 95 01 81 02 05 01 26 ff 7f 65 11 55 0e 46 b0 0e 75 10 95 01 09 30 81 02 09 31 46 c2 0b 81 02 c0 a1 02 05 0d 09 42 15 00 25 01 75 01 95 01 81 02 95 03 81 03 09 32 09 47 95 02 81 02 95 02 81 03 09 51 75 08 95 01 81 02 05 01 26 ff 7f 65 11 55 0e 46 b0 0e 75 10 95 01 09 30 81 02 09 31 46 c2 0b 81 02 c0 a1 02 05 0d 09 42 15 00 25 01 75 01 95 01 81 02 95 03 81 03 09 32 09 47 95 02 81 02 95 02 81 03 09 51 75 08 95 01 81 02 05 01 26 ff 7f 65 11 55 0e 46 b0 0e 75 10 95 01 09 30 81 02 09 31 46 c2 0b 81 02 c0 05 0d 09 54 75 08 95 01 15 00 25 08 81 02 09 55 b1 02 c0
N: LUMIO Inc LUMIO CrystalTouch ver 02.03.24.00.
I: 3 202e 0006
