R: 911 05 0d 09 04 a1 01 85 01 09 22 a1 02 09 42 15 00 25 01 95 01 75 01 81 02 09 32 81 02 09 47 81 02 75 05 09 51 25 0a 81 02 09 30 26 ff 00 75 08 81 02 26 94 0d 05 01 75 10 55 0d 65 33 09 30 35 00 46 82 49 81 02 09 31 46 5e 29 81 02 c0 09 22 a1 02 05 0d 35 00 45 00 55 00 65 00 09 42 25 01 75 01 81 02 09 32 81 02 09 47 81 02 75 05 09 51 25 0a 81 02 09 30 26 ff 00 75 08 81 02 26 94 0d 05 01 75 10 55 0d 65 33 09 30 46 82 49 81 02 09 31 46 5e 29 81 02 c0 09 22 a1 02 05 0d 35 00 45 00 55 00 65 00 09 42 25 01 75 01 81 02 09 32 81 02 09 47 81 02 75 05 09 51 25 0a 81 02 09 30 26 ff 00 75 08 81 02 26 94 0d 05 01 75 10 55 0d 65 33 09 30 46 82 49 81 02 09 31 46 5e 29 81 02 c0 09 22 a1 02 05 0d 35 00 45 00 55 00 65 00 09 42 25 01 75 01 81 02 09 32 81 02 09 47 81 02 75 05 09 51 25 0a 81 02 09 30 26 ff 00 75 08 81 02 26 94 0d 05 01 75 10 55 0d 65 33 09 30 46 82 49 81 02 09 31 46 5e 29 81 02 c0 09 22 a1 02 05 0d 35 00 45 00 55 00 65 00 09 42 25 01 75 01 81 02 09 32 81 02 09 47 81 02 75 05 09 51 25 0a 81 02 09 30 26 ff 00 75 08 81 02 26 94 0d 05 01 75 10 55 0d 65 33 09 30 46 82 49 81 02 09 31 46 5e 29 81 02 c0 09 22 a1 02 05 0d 35 00 45 00 55 00 65 00 09 42 25 01 75 01 81 02 09 32 81 02 09 47 81 02 75 05 09 51 25 0a 81 02 09 30 26 ff 00 75 08 81 02 26 94 0d 05 01 75 10 55 0d 65 33 09 30 46 82 49 81 02 09 31 46 5e 29 81 02 c0 09 22 a1 02 05 0d 35 00 45 00 55 00 65 00 09 42 25 01 75 01 81 02 09 32 81 02 09 47 81 02 75 05 09 51 25 0a 81 02 09 30 26 ff 00 75 08 81 02 26 94 0d 05 01 75 10 55 0d 65 33 09 30 46 82 49 81 02 09 31 46 5e 29 81 02 c0 09 22 a1 02 05 0d 35 00 45 00 55 00 65 00 09 42 25 01 75 01 81 02 09 32 81 02 09 47 81 02 75 05 09 51 25 0a 81 02 09 30 26 ff 00 75 08 81 02 26 94 0d 05 01 75 10 55 0d 65 33 09 30 46 82 49 81 02 09 31 46 5e 29 81 02 c0 09 22 a1 02 05 0d 35 00 45 00 55 00 65 00 09 42 25 01 75 01 81 02 09 32 81 02 09 47 81 02 75 05 09 51 25 0a 81 02 09 30 26 ff 00 75 08 81 02 26 94 0d 05 01 75 10 55 0d 65 33 09 30 46 82 49 81 02 09 31 46 5e 29 81 02 c0 09 22 a1 02 05 0d 35 00 45 00 55 00 65 00 09 42 25 01 75 01 81 02 09 32 81 02 09 47 81 02 75 05 09 51 25 0a 81 02 09 30 26 ff 00 75 08 81 02 26 94 0d 05 01 75 10 55 0d 65 33 09 30 46 82 49 81 02 09 31 46 5e 29 81 02 c0 35 00 45 00 55 00 65 00 05 0d 09 54 75 08 25 0a 81 02 85 08 09 55 b1 02 c0 09 0e a1 01 85 07 09 22 a1 00 09 52 25 0a b1 02 c0 05 0c 09 01 a1 01 85 06 09 01 26 ff 00 95 08 b1 02 c0 05 0c 09 01 a1 01 85 09 09 01 26 ff 00 95 07 b1 02 c0 c0 05 01 09 02 a1 01 85 03 09 01 a1 00 05 09 19 01 29 02 25 01 75 01 95 02 81 02 95 06 81 03 26 94 0d 05 01 75 10 95 01 55 0d 65 33 09 30 46 82 49 81 02 09 31 46 5e 29 81 02 c0 c0 06 ff 01 09 01 a1 01 26 ff 00 35 00 45 00 55 00 65 00 85 05 75 08 95 3f 09 00 81 02 85 05 75 08 95 3f 09 00 91 02 c0
N: MosArt, Inc. MosArt 21.5
I: 3 062a 710a
