R: 942 05 0d 09 02 a1 01 85 01 09 20 35 00 a1 00 09 32 09 42 09 44 09 3c 09 45 15 00 25 01 75 01 95 05 81 02 95 03 81 03 05 01 09 30 75 10 95 01 a4 55 0e 65 11 46 32 0a 26 80 25 81 02 09 31 46 63 06 26 20 1c 81 02 b4 05 0d 09 30 26 00 01 81 02 81 03 c0 85 0c 06 00 ff 09 05 75 20 b1 02 85 0b 06 00 ff 09 04 75 10 b1 02 85 0d 06 00 ff 09 06 b1 02 85 0e 06 00 ff 09 07 b1 02 85 0f 06 00 ff 09 08 b1 02 85 10 06 00 ff 09 09 b1 02 85 11 06 00 ff 09 0a b1 02 85 12 06 00 ff 09 0b 75 20 b1 02 85 13 06 00 ff 09 0c b1 02 c0 05 0d 09 04 a1 01 85 03 06 00 ff 09 01 75 10 95 01 15 00 27 ff ff 00 00 81 02 05 0d 09 22 a1 02 09 42 15 00 25 01 75 01 95 01 81 02 09 32 81 02 09 47 81 02 95 05 81 03 75 10 09 51 27 ff ff 00 00 95 01 81 02 05 01 09 30 75 10 95 01 a4 55 0e 65 11 46 32 0a 26 80 25 81 02 09 31 46 63 06 26 20 1c 81 02 05 0d 09 48 26 80 25 81 02 09 49 26 20 1c 81 02 b4 06 00 ff 09 02 75 08 95 04 15 00 26 ff 00 81 02 c0 05 0d a1 02 09 42 15 00 25 01 75 01 95 01 81 02 09 32 81 02 09 47 81 02 95 05 81 03 75 10 09 51 27 ff ff 00 00 95 01 81 02 05 01 09 30 75 10 95 01 a4 55 0e 65 11 46 32 0a 26 80 25 81 02 09 31 46 63 06 26 20 1c 81 02 05 0d 09 48 26 80 25 81 02 09 49 26 20 1c 81 02 b4 06 00 ff 09 02 75 08 95 04 15 00 26 ff 00 81 02 c0 05 0d a1 02 09 42 15 00 25 01 75 01 95 01 81 02 09 32 81 02 09 47 81 02 95 05 81 03 75 10 09 51 27 ff ff 00 00 95 01 81 02 05 01 09 30 75 10 95 01 a4 55 0e 65 11 46 32 0a 26 80 25 81 02 09 31 46 63 06 26 20 1c 81 02 05 0d 09 48 26 80 25 81 02 09 49 26 20 1c 81 02 b4 06 00 ff 09 02 75 08 95 04 15 00 26 ff 00 81 02 c0 05 0d a1 02 09 42 15 00 25 01 75 01 95 01 81 02 09 32 81 02 09 47 81 02 95 05 81 03 75 10 09 51 27 ff ff 00 00 95 01 81 02 05 01 09 30 75 10 95 01 a4 55 0e 65 11 46 32 0a 26 80 25 81 02 09 31 46 63 06 26 20 1c 81 02 05 0d 09 48 26 80 25 81 02 09 49 26 20 1c 81 02 b4 06 00 ff 09 02 75 08 95 04 15 00 26 ff 00 81 02 c0 05 0d a1 02 09 42 15 00 25 01 75 01 95 01 81 02 09 32 81 02 09 47 81 02 95 05 81 03 75 10 09 51 27 ff ff 00 00 95 01 81 02 05 01 09 30 75 10 95 01 a4 55 0e 65 11 46 32 0a 26 80 25 81 02 09 31 46 63 06 26 20 1c 81 02 05 0d 09 48 26 80 25 81 02 09 49 26 20 1c 81 02 b4 06 00 ff 09 02 75 08 95 04 26 ff 00 81 02 c0 05 0d a1 02 09 42 15 00 25 01 75 01 95 01 81 02 09 32 81 02 09 47 81 02 95 05 81 03 75 10 09 51 27 ff ff 00 00 95 01 81 02 05 01 09 30 75 10 95 01 a4 55 0e 65 11 46 32 0a 26 80 25 81 02 09 31 46 63 06 26 20 1c 81 02 05 0d 09 48 26 80 25 81 02 09 49 26 20 1c 81 02 b4 06 00 ff 09 02 75 08 95 04 26 ff 00 81 02 c0 05 0d 09 54 95 01 75 08 81 02 85 04 09 55 25 0b b1 02 85 0a 06 00 ff 09 03 15 00 b1 02 c0 05 0d 09 04 a1 01 85 02 09 04 a1 00 09 32 09 42 09 47 15 00 25 01 75 01 95 03 81 02 95 05 81 03 05 01 09 30 75 10 95 01 a4 55 0e 65 11 46 32 0a 26 80 25 81 02 09 31 46 63 06 26 20 1c 81 02 05 0d 09 48 26 80 25 81 02 09 49 26 20 1c 81 02 b4 c0 c0
N: N-trig DuoSense
I: 3 1b96 0001
