R: 344 05 0d 09 04 a1 01 85 01 09 22 a1 02 09 42 15 00 25 01 75 01 95 01 81 02 09 32 81 02 95 06 81 03 75 08 09 51 95 01 81 02 05 01 26 ff 3f 75 10 55 0e 65 11 09 30 35 00 46 1e 19 81 02 26 ff 3f 09 31 35 00 46 be 0f 81 02 26 ff 3f c0 a1 02 05 0d 09 42 15 00 25 01 75 01 95 01 81 02 09 32 81 02 95 06 81 03 75 08 09 51 95 01 81 02 05 01 26 ff 3f 75 10 55 0e 65 11 09 30 35 00 46 1e 19 81 02 26 ff 3f 09 31 35 00 46 be 0f 81 02 26 ff 3f c0 05 0d 09 54 95 01 75 08 25 02 81 02 85 02 09 55 25 02 b1 02 c0 09 0e a1 01 85 03 09 23 a1 02 09 52 09 53 15 00 25 0a 75 08 95 02 b1 02 c0 c0 05 01 09 02 a1 01 09 01 a1 00 85 04 05 09 95 03 75 01 19 01 29 03 15 00 25 01 81 02 95 01 75 05 81 01 05 01 75 10 95 02 09 30 09 31 15 00 26 ff 7f 81 02 c0 c0 05 0d 09 02 a1 01 85 05 09 20 a1 00 09 42 09 32 15 00 25 01 75 01 95 02 81 02 95 0e 81 03 05 01 26 ff 3f 75 10 95 01 55 0e 65 11 09 30 35 00 46 1e 19 81 02 26 ff 3f 09 31 35 00 46 be 0f 81 02 26 ff 3f c0 c0 06 00 ff 09 01 a1 01 85 06 19 01 29 40 15 00 26 ff 00 75 08 95 40 81 00 19 01 29 40 91 00 c0
N: Nexio Touch Device.   HID Multi-Touch
I: 3 1870 0100
