R: 198 05 0d 09 04 a1 01 85 01 09 22 a1 02 09 42 15 00 25 01 75 01 95 01 81 02 09 32 81 02 09 47 81 02 95 05 81 03 09 51 75 08 95 01 81 02 05 01 35 00 55 0e 65 33 75 10 95 01 09 30 26 ff 4b 46 70 03 81 02 09 31 26 ff 2b 46 f1 01 81 02 46 00 00 c0 a1 02 05 0d 09 42 15 00 25 01 75 01 95 01 81 02 09 32 81 02 09 47 81 02 95 05 81 03 09 51 75 08 95 01 81 02 05 01 35 00 55 0e 65 33 75 10 95 01 09 30 26 ff 4b 46 70 03 81 02 09 31 26 ff 2b 46 f1 01 81 02 46 00 00 c0 05 0d 09 54 75 08 95 01 81 02 05 0d 85 02 09 55 25 02 75 08 95 01 b1 02 c0 05 0d 09 0e a1 01 85 03 09 53 15 00 25 02 75 08 95 01 b1 02 c0
N: HolyMap PixCir Multi-Touch
I: 3 20b3 0a18
