R: 210 05 0d 09 04 a1 01 85 01 09 22 a1 02 09 42 15 00 25 01 75 01 95 01 81 02 09 32 81 02 09 47 81 02 95 05 81 03 75 08 09 51 95 01 81 02 05 01 75 10 55 0e 65 11 09 30 35 00 46 e3 13 26 7f 07 81 02 09 31 46 2f 0b 26 37 04 81 02 c0 a1 02 05 0d 09 42 15 00 25 01 75 01 95 01 81 02 09 32 81 02 09 47 81 02 95 05 81 03 75 08 09 51 95 01 81 02 05 01 75 10 55 0e 65 11 09 30 35 00 46 e3 13 26 7f 07 81 02 46 2f 0b 26 37 04 09 31 81 02 c0 05 0d 09 54 15 00 26 ff 00 95 01 75 08 81 02 09 55 25 02 95 01 85 02 b1 02 06 00 ff 09 01 26 ff 00 75 08 95 2f 85 03 b1 02 09 01 96 ff 03 85 04 b1 02 09 01 95 0b 85 05 b1 02 09 01 96 ff 03 85 06 b1 02 c0
N: Acer                         T230H                       
I: 3 0408 3000
