R: 631 05 0d 09 04 a1 01 85 01 09 54 95 01 75 08 81 02 09 22 a1 02 09 51 75 06 95 01 81 02 09 42 09 32 15 00 25 01 75 01 95 02 81 02 05 01 26 90 04 75 0c 95 01 55 0f 65 11 a4 09 30 46 e1 00 81 02 26 50 03 09 31 45 7d 81 02 05 0d 75 08 95 02 09 48 09 49 81 02 c0 a1 02 09 51 75 06 95 01 81 02 09 42 09 32 15 00 25 01 75 01 95 02 81 02 b4 a4 09 30 46 e1 00 81 02 26 50 03 09 31 45 7d 81 02 05 0d 75 08 95 02 09 48 09 49 81 02 c0 a1 02 09 51 75 06 95 01 81 02 09 42 09 32 15 00 25 01 75 01 95 02 81 02 b4 a4 09 30 46 e1 00 81 02 26 50 03 09 31 45 7d 81 02 05 0d 75 08 95 02 09 48 09 49 81 02 c0 a1 02 09 51 75 06 95 01 81 02 09 42 09 32 15 00 25 01 75 01 95 02 81 02 b4 a4 09 30 46 e1 00 81 02 26 50 03 09 31 45 7d 81 02 05 0d 75 08 95 02 09 48 09 49 81 02 c0 a1 02 09 51 75 06 95 01 81 02 09 42 09 32 15 00 25 01 75 01 95 02 81 02 b4 a4 09 30 46 e1 00 81 02 26 50 03 09 31 45 7d 81 02 05 0d 75 08 95 02 09 48 09 49 81 02 c0 a1 02 09 51 75 06 95 01 81 02 09 42 09 32 15 00 25 01 75 01 95 02 81 02 b4 a4 09 30 46 e1 00 81 02 26 50 03 09 31 45 7d 81 02 05 0d 75 08 95 02 09 48 09 49 81 02 c0 a1 02 09 51 75 06 95 01 81 02 09 42 09 32 15 00 25 01 75 01 95 02 81 02 b4 a4 09 30 46 e1 00 81 02 26 50 03 09 31 45 7d 81 02 05 0d 75 08 95 02 09 48 09 49 81 02 c0 a1 02 09 51 75 06 95 01 81 02 09 42 09 32 15 00 25 01 75 01 95 02 81 02 b4 a4 09 30 46 e1 00 81 02 26 50 03 09 31 45 7d 81 02 05 0d 75 08 95 02 09 48 09 49 81 02 c0 a1 02 09 51 75 06 95 01 81 02 09 42 09 32 15 00 25 01 75 01 95 02 81 02 b4 a4 09 30 46 e1 00 81 02 26 50 03 09 31 45 7d 81 02 05 0d 75 08 95 02 09 48 09 49 81 02 c0 a1 02 09 51 75 06 95 01 81 02 09 42 09 32 15 00 25 01 75 01 95 02 81 02 b4 09 30 46 e1 00 81 02 26 50 03 09 31 45 7d 81 02 05 0d 75 08 95 04 09 48 09 49 81 02 c0 85 02 09 55 26 ff 00 75 08 95 01 b1 02 09 04 15 00 25 ff 75 08 95 07 91 02 c0 09 0e a1 01 85 03 09 23 a1 00 09 52 09 53 15 00 25 0a 75 08 95 02 b1 02 c0 c0
N: Sitronix Technology Corp., LTD. ST9RM01 10P MultiTouch
I: 3 1403 5001
