R: 982 05 0d 09 04 a1 01 85 03 05 0d 09 54 95 01 75 08 81 02 06 00 ff 75 02 09 01 81 01 75 0e 09 02 81 02 05 0d 09 22 a1 02 05 01 16 00 00 26 ff 07 75 0b 55 00 65 00 09 30 81 02 05 0d 25 1f 75 05 09 48 81 02 05 01 16 00 00 26 ff 07 75 0b 55 00 65 00 09 31 81 02 05 0d 25 1f 75 05 09 49 81 02 75 08 09 51 95 01 81 02 09 30 75 05 81 02 09 42 15 00 25 01 75 01 95 01 81 02 09 47 81 02 09 32 81 02 c0 a1 02 05 01 16 00 00 26 ff 07 75 0b 55 00 65 00 09 30 81 02 05 0d 25 1f 75 05 09 48 81 02 05 01 16 00 00 26 ff 07 75 0b 55 00 65 00 09 31 81 02 05 0d 25 1f 75 05 09 49 81 02 75 08 09 51 95 01 81 02 09 30 75 05 81 02 09 42 15 00 25 01 75 01 95 01 81 02 09 47 81 02 09 32 81 02 c0 a1 02 05 01 16 00 00 26 ff 07 75 0b 55 00 65 00 09 30 81 02 05 0d 25 1f 75 05 09 48 81 02 05 01 16 00 00 26 ff 07 75 0b 55 00 65 00 09 31 81 02 05 0d 25 1f 75 05 09 49 81 02 75 08 09 51 95 01 81 02 09 30 75 05 81 02 09 42 15 00 25 01 75 01 95 01 81 02 09 47 81 02 09 32 81 02 c0 a1 02 05 01 16 00 00 26 ff 07 75 0b 55 00 65 00 09 30 81 02 05 0d 25 1f 75 05 09 48 81 02 05 01 16 00 00 26 ff 07 75 0b 55 00 65 00 09 31 81 02 05 0d 25 1f 75 05 09 49 81 02 75 08 09 51 95 01 81 02 09 30 75 05 81 02 09 42 15 00 25 01 75 01 95 01 81 02 09 47 81 02 09 32 81 02 c0 a1 02 05 01 16 00 00 26 ff 07 75 0b 55 00 65 00 09 30 81 02 05 0d 25 1f 75 05 09 48 81 02 05 01 16 00 00 26 ff 07 75 0b 55 00 65 00 09 31 81 02 05 0d 25 1f 75 05 09 49 81 02 75 08 09 51 95 01 81 02 09 30 75 05 81 02 09 42 15 00 25 01 75 01 95 01 81 02 09 47 81 02 09 32 81 02 c0 a1 02 05 01 16 00 00 26 ff 07 75 0b 55 00 65 00 09 30 81 02 05 0d 25 1f 75 05 09 48 81 02 05 01 16 00 00 26 ff 07 75 0b 55 00 65 00 09 31 81 02 05 0d 25 1f 75 05 09 49 81 02 75 08 09 51 95 01 81 02 09 30 75 05 81 02 09 42 15 00 25 01 75 01 95 01 81 02 09 47 81 02 09 32 81 02 c0 a1 02 05 01 16 00 00 26 ff 07 75 0b 55 00 65 00 09 30 81 02 05 0d 25 1f 75 05 09 48 81 02 05 01 16 00 00 26 ff 07 75 0b 55 00 65 00 09 31 81 02 05 0d 25 1f 75 05 09 49 81 02 75 08 09 51 95 01 81 02 09 30 75 05 81 02 09 42 15 00 25 01 75 01 95 01 81 02 09 47 81 02 09 32 81 02 c0 a1 02 05 01 16 00 00 26 ff 07 75 0b 55 00 65 00 09 30 81 02 05 0d 25 1f 75 05 09 48 81 02 05 01 16 00 00 26 ff 07 75 0b 55 00 65 00 09 31 81 02 05 0d 25 1f 75 05 09 49 81 02 75 08 09 51 95 01 81 02 09 30 75 05 81 02 09 42 15 00 25 01 75 01 95 01 81 02 09 47 81 02 09 32 81 02 c0 a1 02 05 01 16 00 00 26 ff 07 75 0b 55 00 65 00 09 30 81 02 05 0d 25 1f 75 05 09 48 81 02 05 01 16 00 00 26 ff 07 75 0b 55 00 65 00 09 31 81 02 05 0d 25 1f 75 05 09 49 81 02 75 08 09 51 95 01 81 02 09 30 75 05 81 02 09 42 15 00 25 01 75 01 95 01 81 02 09 47 81 02 09 32 81 02 c0 a1 02 05 01 16 00 00 26 ff 07 75 0b 55 00 65 00 09 30 81 02 05 0d 25 1f 75 05 09 48 81 02 05 01 16 00 00 26 ff 07 75 0b 55 00 65 00 09 31 81 02 05 0d 25 1f 75 05 09 49 81 02 75 08 09 51 95 01 81 02 09 30 75 05 81 02 09 42 15 00 25 01 75 01 95 01 81 02 09 47 81 02 09 32 81 02 c0 85 08 05 0d 09 55 95 01 75 08 25 0a b1 02 c0
N: Stantum MTP USB Controller
P: usb-0000:00:1d.0-1.2/input0
I: 3 1f87 0002
