R: 52 05 01 09 02 a1 01 09 01 a1 00 95 03 75 01 05 09 19 01 29 03 15 00 25 01 81 02 95 01 75 05 81 01 75 08 95 03 05 01 09 30 09 31 09 38 15 81 25 7f 81 06 c0 c0 47 05 01 09 06 a1 01 05 07 19 e0 29 e7 15 00 25 01 75 01 95 08 81 02 95 01 75 08 81 01 95 06 75 08 15 00 26 ff 00 05 07 19 00 2a ff 00 81 00 c0 141 05 0d 09 04 a1 01 85 04 09 22 a1 02 09 42 15 00 25 01 75 01 95 01 81 02 09 32 81 02 95 06 81 03 75 08 09 51 95 01 81 02 05 01 26 ff 04 75 10 55 00 65 00 09 30 35 00 46 ff 04 81 02 09 31 46 ff 04 81 02 c0 05 0d 09 54 95 01 75 08 15 00 25 0a 81 02 09 55 b1 02 c0 05 0c 09 01 a1 01 85 03 a1 02 09 b5 15 00 25 01 75 01 95 01 81 02 09 b6 81 02 09 b7 81 02 09 cd 81 02 09 e2 81 02 09 e9 81 02 09 ea 81 02 05 01 09 82 81 02 c0 c0
N: ACER INCORPORATED. Wireless KB/Touch Pad
I: 3 1784 0016
