R: 240 05 0d 09 04 a1 01 85 0e 09 22 a1 02 09 42 15 00 25 01 75 01 95 01 81 02 09 32 81 02 09 47 81 02 95 05 81 03 75 08 09 51 95 01 81 02 05 01 75 10 55 0e 65 11 09 30 35 00 46 5d 14 26 ff 7f 81 02 09 31 46 74 0b 26 ff 7f 81 02 c0 a1 02 05 0d 09 42 15 00 25 01 75 01 95 01 81 02 09 32 81 02 09 47 81 02 95 05 81 03 75 08 09 51 95 01 81 02 05 01 26 ff 7f 75 10 55 0e 65 11 09 30 35 00 46 5d 14 26 ff 7f 81 02 09 31 46 74 0b 26 ff 7f 81 02 c0 a1 02 05 0d 09 42 15 00 25 01 75 01 95 01 81 02 09 32 81 02 09 47 81 02 95 05 81 03 75 08 09 51 95 01 81 02 05 01 26 ff 7f 75 10 55 0e 65 11 09 30 35 00 46 5d 14 26 ff 7f 81 02 09 31 46 74 0b 26 ff 7f 81 02 c0 05 0d 09 54 95 01 75 08 15 00 25 08 81 02 09 55 25 05 95 01 85 02 b1 02 c0
N: Touch TP236
I: 3 1d45 200d
