R: 267 05 0d 09 04 a1 01 09 22 a1 02 05 0d 09 42 15 00 25 01 75 01 95 01 81 02 09 32 81 02 95 06 81 03 75 08 09 51 95 01 81 02 05 01 26 ff 7f 75 10 55 00 65 00 09 30 35 00 46 00 00 81 02 09 31 46 00 00 81 02 c0 a1 02 05 0d 09 42 15 00 25 01 75 01 95 01 81 02 09 32 81 02 95 06 81 03 75 08 09 51 95 01 81 02 05 01 26 ff 7f 75 10 55 00 65 00 09 30 35 00 46 00 00 81 02 09 31 46 00 00 81 02 c0 a1 02 05 0d 09 42 15 00 25 01 75 01 95 01 81 02 09 32 81 02 95 06 81 03 75 08 09 51 95 01 81 02 05 01 26 ff 7f 75 10 55 00 65 00 09 30 35 00 46 00 00 81 02 09 31 46 00 00 81 02 c0 a1 02 05 0d 09 42 15 00 25 01 75 01 95 01 81 02 09 32 81 02 95 06 81 03 75 08 09 51 95 01 81 02 05 01 26 ff 7f 75 10 55 00 65 00 09 30 35 00 46 00 00 81 02 09 31 46 00 00 81 02 c0 05 0d 09 54 95 01 75 08 15 00 25 08 81 02 09 55 b1 02 c0
N: Touch International Multi-Touch
I: 3 1e5e 0313
