R: 219 05 0d 09 04 a1 01 85 01 09 22 a1 02 09 42 15 00 25 01 75 01 95 01 81 02 09 32 95 01 81 02 95 06 81 01 05 01 26 00 10 75 10 95 01 65 00 09 30 81 02 09 31 46 00 10 81 02 05 0d 09 51 26 ff 00 75 08 95 01 81 02 c0 85 02 09 55 15 00 25 08 75 08 95 01 b1 02 c0 05 0d 09 0e a1 01 85 03 a1 02 09 23 09 52 09 53 15 00 25 08 75 08 95 02 b1 02 c0 c0 05 01 09 02 a1 01 09 01 a1 00 85 04 05 09 19 01 29 02 15 00 25 01 95 02 75 01 81 02 95 01 75 06 81 01 05 01 09 30 09 31 15 00 26 00 10 35 00 46 00 10 65 00 75 10 95 02 81 62 c0 c0 06 00 ff 09 01 a1 01 85 05 09 00 15 00 26 ff 00 75 08 95 3f b1 02 c0 06 00 ff 09 01 a1 01 85 06 09 00 15 00 26 ff 00 75 08 95 3f 81 02 c0
N: Zytronic Displays Limited Zytronic Touchscreen Controller
I: 3 14c8 0005
