R: 177 05 0d 09 04 a1 01 85 01 09 22 a1 02 09 42 15 00 25 01 75 01 95 01 81 02 09 32 81 02 09 47 81 02 95 05 81 03 09 51 75 08 95 01 81 02 05 01 35 00 55 0e 65 33 75 10 95 01 09 30 26 ff 4d 46 70 03 81 02 09 31 26 ff 2b 46 f1 01 81 02 46 00 00 c0 a1 02 05 0d 09 42 15 00 25 01 75 01 95 01 81 02 09 32 81 02 09 47 81 02 95 05 81 03 09 51 75 08 95 01 81 02 05 01 35 00 55 0e 65 33 75 10 95 01 09 30 26 ff 4d 46 70 03 81 02 09 31 26 ff 2b 46 f1 01 81 02 46 00 00 c0 05 0d 09 54 75 08 95 01 81 02 05 0d 85 02 09 55 25 02 75 08 95 01 b1 02 c0
N: NAS      10.1 
I: 3 2101 1011
E: 0.000000 14 01 ff 01 1f 1b 5a 09 fc 02 c0 19 fb 08 02
E: 0.008000 14 01 ff 01 21 1b 58 09 fc 02 c0 19 fb 08 02
E: 0.016000 14 01 ff 01 25 1b 59 09 fc 02 c0 19 fb 08 02
E: 0.024000 14 01 ff 01 27 1b 5b 09 fc 02 c0 19 fb 08 02
E: 0.032000 14 01 ff 01 26 1b 5c 09 fc 02 c0 19 fb 08 02
E: 0.040000 14 01 ff 01 26 1b 5c 09 fc 02 c0 19 fb 08 02
E: 0.048000 14 01 ff 01 24 1b 5d 09 fc 02 c0 19 fb 08 02
E: 0.056000 14 01 ff 01 22 1b 5d 09 fc 02 c0 19 fb 08 02
E: 0.064000 14 01 ff 01 21 1b 5e 09 fc 02 c0 19 fb 08 02
E: 0.072000 14 01 ff 01 20 1b 5f 09 fc 02 c0 19 fb 08 02
E: 0.080000 14 01 ff 01 1c 1b 62 09 fc 02 c0 19 fb 08 02
E: 0.088000 14 01 ff 01 19 1b 68 09 fc 02 c0 19 fb 08 02
E: 0.096000 14 01 ff 01 0e 1b 74 09 fc 02 c0 19 fb 08 02
E: 0.104000 14 01 ff 01 03 1b 86 09 fc 02 c0 19 fb 08 02
E: 0.112000 14 01 ff 01 f3 1a ac 09 fc 02 c0 19 fb 08 02
E: 0.120000 14 01 ff 01 e0 1a dd 09 fc 02 c0 19 fb 08 02
E: 0.128000 14 01 ff 01 ca 1a 16 0a fc 02 c0 19 fb 08 02
E: 0.136000 14 01 ff 01 ab 1a 75 0a fc 02 c0 19 fb 08 02
E: 0.144000 14 01 ff 01 8d 1a d9 0a fc 02 c0 19 fb 08 02
E: 0.152000 14 01 ff 01 6c 1a 42 0b fc 02 c0 19 fb 08 02
E: 0.160000 14 01 ff 01 44 1a e7 0b fc 02 c0 19 fb 08 02
E: 0.168000 14 01 ff 01 20 1a 83 0c fc 02 c0 19 fb 08 02
E: 0.176000 14 01 ff 01 01 1a 1e 0d fc 02 c0 19 fb 08 02
E: 0.184000 14 01 ff 01 e9 19 d0 0d fc 02 c0 19 fb 08 02
E: 0.192000 14 01 ff 01 d7 19 78 0e fc 02 c0 19 fb 08 02
E: 0.200000 14 01 ff 01 cd 19 1b 0f fc 02 c0 19 fb 08 02
E: 0.208000 14 01 ff 01 c8 19 da 0f fc 02 c0 19 fb 08 02
E: 0.216000 14 01 ff 01 ce 19 89 10 fc 02 c0 19 fb 08 02
E: 0.224000 14 01 ff 01 dd 19 39 11 fc 02 c0 19 fb 08 02
E: 0.232000 14 01 ff 01 ee 19 ff 11 fc 02 c0 19 fb 08 02
E: 0.240000 14 01 ff 01 07 1a b3 12 fc 02 c0 19 fb 08 02
E: 0.248000 14 01 ff 01 23 1a 70 13 fc 02 c0 19 fb 08 02
E: 0.256000 14 01 ff 01 3b 1a 2b 14 fc 02 c0 19 fb 08 02
E: 0.264000 14 01 ff 01 55 1a d6 14 fc 02 c0 19 fb 08 02
E: 0.272000 14 01 ff 01 73 1a 86 15 fc 02 c0 19 fb 08 02
E: 0.280000 14 01 ff 01 90 1a 30 16 fc 02 c0 19 fb 08 02
E: 0.288000 14 01 ff 01 a7 1a b0 16 fc 02 c0 19 fb 08 02
E: 0.296000 14 01 ff 01 cd 1a 60 17 fc 02 c0 19 fb 08 02
E: 0.304000 14 01 ff 01 e9 1a 0a 18 fc 02 c0 19 fb 08 02
E: 0.312000 14 01 ff 01 05 1b 88 18 fc 02 c0 19 fb 08 02
E: 0.320000 14 01 ff 01 21 1b 08 19 fc 02 c0 19 fb 08 02
E: 0.328000 14 01 ff 01 42 1b b8 19 fc 02 c0 19 fb 08 02
E: 0.336000 14 01 ff 01 62 1b 5b 1a fc 02 c0 19 fb 08 02
E: 0.344000 14 01 ff 01 7c 1b cb 1a fc 02 c0 19 fb 08 02
E: 0.352000 14 01 ff 01 95 1b 3a 1b fc 02 c0 19 fb 08 02
E: 0.360000 14 01 ff 01 ad 1b b9 1b fc 02 c0 19 fb 08 02
E: 0.368000 14 01 ff 01 c2 1b 35 1c fc 02 c0 19 fb 08 02
E: 0.376000 14 01 ff 01 db 1b a7 1c fc 02 c0 19 fb 08 02
E: 0.384000 14 01 ff 01 f4 1b 0f 1d fc 02 c0 19 fb 08 02
E: 0.392000 14 01 ff 01 09 1c 75 1d fc 02 c0 19 fb 08 02
E: 0.400000 14 01 ff 01 1d 1c df 1d fc 02 c0 19 fb 08 02
E: 0.408000 14 01 ff 01 2d 1c 3c 1e fc 02 c0 19 fb 08 02
E: 0.416000 14 01 ff 01 3b 1c 90 1e fc 02 c0 19 fb 08 02
E: 0.424000 14 01 ff 01 45 1c c6 1e fc 02 c0 19 fb 08 02
E: 0.432000 14 01 ff 01 4a 1c e4 1e fc 02 c0 19 fb 08 02
E: 0.440000 14 01 ff 01 4f 1c 00 1f fc 02 c0 19 fb 08 02
E: 0.448000 14 01 ff 01 53 1c 19 1f fc 02 c0 19 fb 08 02
E: 0.456000 14 01 ff 01 57 1c 2f 1f fc 02 c0 19 fb 08 02
E: 0.464000 14 01 ff 01 5b 1c 40 1f fc 02 c0 19 fb 08 02
E: 0.472000 14 01 ff 01 5d 1c 4f 1f fc 02 c0 19 fb 08 02
E: 0.480000 14 01 ff 01 5f 1c 59 1f fc 02 c0 19 fb 08 02
E: 0.488000 14 01 ff 01 60 1c 5f 1f fc 02 c0 19 fb 08 02
E: 0.496000 14 01 ff 01 61 1c 5d 1f fc 02 c0 19 fb 08 02
E: 0.504000 14 01 ff 01 62 1c 53 1f fc 02 c0 19 fb 08 02
E: 0.512000 14 01 ff 01 62 1c 3e 1f fc 02 c0 19 fb 08 02
E: 0.520000 14 01 ff 01 63 1c 21 1f fc 02 c0 19 fb 08 02
E: 0.528000 14 01 ff 01 62 1c eb 1e fc 02 c0 19 fb 08 02
E: 0.536000 14 01 ff 01 61 1c b2 1e fc 02 c0 19 fb 08 02
E: 0.544000 14 01 ff 01 62 1c 70 1e fc 02 c0 19 fb 08 02
E: 0.552000 14 01 ff 01 64 1c 03 1e fc 02 c0 19 fb 08 02
E: 0.560000 14 01 ff 01 65 1c 90 1d fc 02 c0 19 fb 08 02
E: 0.568000 14 01 ff 01 64 1c 1d 1d fc 02 c0 19 fb 08 02
E: 0.576000 14 01 ff 01 60 1c ac 1c fc 02 c0 19 fb 08 02
E: 0.584000 14 01 ff 01 5c 1c 28 1c fc 02 c0 19 fb 08 02
E: 0.592000 14 01 ff 01 53 1c a4 1b fc 02 c0 19 fb 08 02
E: 0.600000 14 01 ff 01 45 1c 26 1b fc 02 c0 19 fb 08 02
E: 0.608000 14 01 ff 01 37 1c a7 1a fc 02 c0 19 fb 08 02
E: 0.616000 14 01 ff 01 24 1c f3 19 fc 02 c0 19 fb 08 02
E: 0.624000 14 01 ff 01 10 1c 74 19 fc 02 c0 19 fb 08 02
E: 0.632000 14 01 ff 01 fa 1b f8 18 fc 02 c0 19 fb 08 02
E: 0.640000 14 01 ff 01 e1 1b 52 18 fc 02 c0 19 fb 08 02
E: 0.648000 14 01 ff 01 d0 1b d4 17 fc 02 c0 19 fb 08 02
E: 0.656000 14 01 ff 01 bc 1b 58 17 fc 02 c0 19 fb 08 02
E: 0.664000 14 01 ff 01 a8 1b e5 16 fc 02 c0 19 fb 08 02
E: 0.672000 14 01 ff 01 93 1b 6a 16 fc 02 c0 19 fb 08 02
E: 0.680000 14 01 ff 01 78 1b c4 15 fc 02 c0 19 fb 08 02
E: 0.688000 14 01 ff 01 62 1b 4c 15 fc 02 c0 19 fb 08 02
E: 0.696000 14 01 ff 01 51 1b ce 14 fc 02 c0 19 fb 08 02
E: 0.704000 14 01 ff 01 34 1b 25 14 fc 02 c0 19 fb 08 02
E: 0.712000 14 01 ff 01 22 1b a7 13 fc 02 c0 19 fb 08 02
E: 0.720000 14 01 ff 01 11 1b 2c 13 fc 02 c0 19 fb 08 02
E: 0.728000 14 01 ff 01 02 1b b3 12 fc 02 c0 19 fb 08 02
E: 0.736000 14 01 ff 01 f4 1a 2e 12 fc 02 c0 19 fb 08 02
E: 0.744000 14 01 ff 01 e6 1a af 11 fc 02 c0 19 fb 08 02
E: 0.752000 14 01 ff 01 d6 1a 36 11 fc 02 c0 19 fb 08 02
E: 0.760000 14 01 ff 01 c9 1a bb 10 fc 02 c0 19 fb 08 02
E: 0.768000 14 01 ff 01 bf 1a 35 10 fc 02 c0 19 fb 08 02
E: 0.776000 14 01 ff 01 b2 1a b4 0f fc 02 c0 19 fb 08 02
E: 0.784000 14 01 ff 01 a2 1a 38 0f fc 02 c0 19 fb 08 02
E: 0.792000 14 01 ff 01 95 1a bb 0e fc 02 c0 19 fb 08 02
E: 0.800000 14 01 ff 01 8c 1a 3a 0e fc 02 c0 19 fb 08 02
E: 0.808000 14 01 ff 01 81 1a bd 0d fc 02 c0 19 fb 08 02
E: 0.816000 14 01 ff 01 76 1a 4d 0d fc 02 c0 19 fb 08 02
E: 0.824000 14 01 ff 01 6c 1a e7 0c fc 02 c0 19 fb 08 02
E: 0.832000 14 01 ff 01 66 1a a1 0c fc 02 c0 19 fb 08 02
E: 0.840000 14 01 ff 01 60 1a 3b 0c fc 02 c0 19 fb 08 02
E: 0.848000 14 01 ff 01 5b 1a d1 0b fc 02 c0 19 fb 08 02
E: 0.856000 14 01 ff 01 59 1a 8b 0b fc 02 c0 19 fb 08 02
E: 0.864000 14 01 ff 01 55 1a 4a 0b fc 02 c0 19 fb 08 02
E: 0.872000 14 01 ff 01 50 1a 0d 0b fc 02 c0 19 fb 08 02
E: 0.880000 14 01 ff 01 4b 1a d8 0a fc 02 c0 19 fb 08 02
E: 0.888000 14 01 ff 01 48 1a b9 0a fc 02 c0 19 fb 08 02
E: 0.896000 14 01 ff 01 45 1a 9d 0a fc 02 c0 19 fb 08 02
E: 0.904000 14 01 ff 01 42 1a 84 0a fc 02 c0 19 fb 08 02
E: 0.912000 14 01 ff 01 40 1a 6d 0a fc 02 c0 19 fb 08 02
E: 0.920000 14 01 ff 01 3e 1a 5a 0a fc 02 c0 19 fb 08 02
E: 0.928000 14 01 ff 01 3c 1a 48 0a fc 02 c0 19 fb 08 02
E: 0.936000 14 01 ff 01 3a 1a 38 0a fc 02 c0 19 fb 08 02
E: 0.944000 14 01 ff 01 38 1a 2a 0a fc 02 c0 19 fb 08 02
E: 0.952000 14 01 ff 01 37 1a 1e 0a fc 02 c0 19 fb 08 02
E: 0.960000 14 01 ff 01 35 1a 14 0a fc 02 c0 19 fb 08 02
E: 0.968000 14 01 ff 01 34 1a 0c 0a fc 02 c0 19 fb 08 02
E: 0.976000 14 01 ff 01 33 1a 04 0a fc 02 c0 19 fb 08 02
E: 0.984000 14 01 ff 01 32 1a fd 09 fc 02 c0 19 fb 08 02
E: 0.992000 14 01 ff 01 31 1a f8 09 fc 02 c0 19 fb 08 02
E: 1.000000 14 01 ff 01 2f 1a f3 09 fc 02 c0 19 fb 08 02
E: 1.008000 14 01 ff 01 2e 1a ef 09 fc 02 c0 19 fb 08 02
E: 1.016000 14 01 ff 01 2d 1a eb 09 fc 02 c0 19 fb 08 02
E: 1.024000 14 01 ff 01 2d 1a e8 09 fc 02 c0 19 fb 08 02
E: 1.032000 14 01 ff 01 2d 1a e6 09 fc 02 c0 19 fb 08 02
E: 1.040000 14 01 ff 01 2d 1a e3 09 fc 02 c0 19 fb 08 02
E: 1.048000 14 01 ff 01 2d 1a e2 09 fc 02 c0 19 fb 08 02
E: 1.056000 14 01 ff 01 2c 1a e0 09 fc 02 c0 19 fb 08 02
E: 1.064000 14 01 ff 01 2c 1a de 09 fc 02 c0 19 fb 08 02
E: 1.072000 14 01 ff 01 2b 1a dd 09 fc 02 c0 19 fb 08 02
E: 1.080000 14 01 ff 01 2b 1a dc 09 fc 02 c0 19 fb 08 02
E: 1.088000 14 01 ff 01 2a 1a db 09 fc 02 c0 19 fb 08 02
E: 1.096000 14 01 ff 01 2a 1a db 09 fc 02 c0 19 fb 08 02
E: 1.104000 14 01 ff 01 2a 1a db 09 fc 02 c0 19 fb 08 02
E: 1.112000 14 01 ff 01 2a 1a db 09 fc 02 c0 19 fb 08 02
E: 1.120000 14 01 ff 01 29 1a db 09 fc 02 c0 19 fb 08 02
E: 1.128000 14 01 ff 01 29 1a db 09 fc 02 c0 19 fb 08 02
E: 1.136000 14 01 ff 01 2a 1a db 09 fc 02 c0 19 fb 08 02
E: 1.144000 14 01 ff 01 2b 1a da 09 fc 02 c0 19 fb 08 02
E: 1.152000 14 01 ff 01 2b 1a da 09 fc 02 c0 19 fb 08 02
E: 1.160000 14 01 ff 01 2c 1a da 09 fc 02 c0 19 fb 08 02
E: 1.168000 14 01 ff 01 2d 1a da 09 fc 02 c0 19 fb 08 02
E: 1.176000 14 01 ff 01 2e 1a da 09 fc 02 c0 19 fb 08 02
E: 1.184000 14 01 ff 01 2f 1a da 09 fc 02 c0 19 fb 08 02
E: 1.192000 14 01 ff 01 32 1a db 09 fc 02 c0 19 fb 08 02
E: 1.200000 14 01 ff 01 37 1a da 09 fc 02 c0 19 fb 08 02
E: 1.208000 14 01 ff 01 32 1a dc 09 fc 02 c0 19 fb 08 02
E: 1.216000 14 01 fe 01 32 1a dc 09 fc 02 c0 19 fb 08 02
E: 11.224000 14 01 fc 01 32 1a dc 09 fc 02 c0 19 fb 08 02
E: 11.232000 14 01 ff 01 f3 19 dc 08 fc 02 c0 19 fb 08 02
E: 11.240000 14 01 ff 01 f3 19 e0 08 fc 02 c0 19 fb 08 02
E: 11.248000 14 01 ff 01 f3 19 e1 08 fc 02 c0 19 fb 08 02
E: 11.256000 14 01 ff 01 f1 19 e2 08 fc 02 c0 19 fb 08 02
E: 11.264000 14 01 ff 01 f0 19 e4 08 fc 02 c0 19 fb 08 02
E: 11.272000 14 01 ff 01 ef 19 e5 08 fc 02 c0 19 fb 08 02
E: 11.280000 14 01 ff 01 ef 19 e7 08 fc 02 c0 19 fb 08 02
E: 11.288000 14 01 ff 01 ef 19 e8 08 fc 02 c0 19 fb 08 02
E: 11.296000 14 01 ff 01 ef 19 e8 08 fc 02 c0 19 fb 08 02
E: 11.304000 14 01 ff 01 ef 19 e8 08 fc 02 c0 19 fb 08 02
E: 11.312000 14 01 ff 01 ef 19 ea 08 fc 02 c0 19 fb 08 02
E: 11.320000 14 01 ff 01 ef 19 e9 08 fc 02 c0 19 fb 08 02
E: 11.328000 14 01 ff 01 ef 19 ed 08 fc 02 c0 19 fb 08 02
E: 11.336000 14 01 ff 01 ef 19 eb 08 fc 02 c0 19 fb 08 02
E: 11.344000 14 01 ff 01 ef 19 e9 08 fc 02 c0 19 fb 08 02
E: 11.352000 14 01 ff 01 ef 19 e7 08 fc 02 c0 19 fb 08 02
E: 11.360000 14 01 ff 01 ef 19 e8 08 fc 02 c0 19 fb 08 02
E: 11.368000 14 01 ff 01 ef 19 e9 08 fc 02 c0 19 fb 08 02
E: 11.376000 14 01 ff 01 ef 19 ed 08 fc 02 c0 19 fb 08 02
E: 11.384000 14 01 ff 01 ef 19 ef 08 fc 02 c0 19 fb 08 02
E: 11.392000 14 01 ff 01 ef 19 ed 08 fc 02 c0 19 fb 08 02
E: 11.400000 14 01 ff 01 ef 19 ed 08 fc 02 c0 19 fb 08 02
E: 11.408000 14 01 ff 01 ef 19 f4 08 fc 02 c0 19 fb 08 02
E: 11.416000 14 01 ff 01 ef 19 f8 08 fc 02 c0 19 fb 08 02
E: 11.424000 14 01 ff 01 ef 19 f4 08 fc 02 c0 19 fb 08 02
E: 11.432000 14 01 ff 01 ee 19 f2 08 fc 02 c0 19 fb 08 02
E: 11.440000 14 01 ff 01 ee 19 f6 08 fc 02 c0 19 fb 08 02
E: 11.448000 14 01 ff 01 ee 19 f9 08 fc 02 c0 19 fb 08 02
E: 11.456000 14 01 ff 01 ed 19 fd 08 fc 02 c0 19 fb 08 02
E: 11.464000 14 01 ff 01 ec 19 fd 08 fc 02 c0 19 fb 08 02
E: 11.472000 14 01 ff 01 eb 19 fc 08 fc 02 c0 19 fb 08 02
E: 11.480000 14 01 ff 01 ea 19 fe 08 fc 02 c0 19 fb 08 02
E: 11.488000 14 01 ff 01 e9 19 00 09 fc 02 c0 19 fb 08 02
E: 11.496000 14 01 ff 01 e9 19 00 09 fc 02 c0 19 fb 08 02
E: 11.504000 14 01 ff 01 ee 19 cc 08 ff 02 3b 3a 58 08 02
E: 11.512000 14 01 ff 01 ee 19 cc 08 ff 02 3b 3a 58 08 02
E: 11.520000 14 01 ff 01 ee 19 ca 08 ff 02 74 3a 37 08 02
E: 11.528000 14 01 ff 01 ee 19 ca 08 ff 02 74 3a 37 08 02
E: 11.536000 14 01 ff 01 ed 19 d2 08 ff 02 a4 3a 2b 08 02
E: 11.544000 14 01 ff 01 ed 19 d2 08 ff 02 a4 3a 2b 08 02
E: 11.552000 14 01 ff 01 ed 19 dd 08 ff 02 ca 3a 11 08 02
E: 11.560000 14 01 ff 01 ed 19 dd 08 ff 02 ca 3a 11 08 02
E: 11.568000 14 01 ff 01 ed 19 e2 08 ff 02 de 3a 0c 08 02
E: 11.576000 14 01 ff 01 ed 19 e2 08 ff 02 de 3a 0c 08 02
E: 11.584000 14 01 ff 01 ed 19 e5 08 ff 02 ef 3a fd 07 02
E: 11.592000 14 01 ff 01 ed 19 e5 08 ff 02 ef 3a fd 07 02
E: 11.600000 14 01 ff 01 ed 19 ec 08 ff 02 fd 3a f2 07 02
E: 11.608000 14 01 ff 01 ed 19 ec 08 ff 02 fd 3a f2 07 02
E: 11.616000 14 01 ff 01 ed 19 f0 08 ff 02 09 3b f4 07 02
E: 11.624000 14 01 ff 01 ed 19 f0 08 ff 02 09 3b f4 07 02
E: 11.632000 14 01 ff 01 ec 19 f2 08 ff 02 14 3b eb 07 02
E: 11.640000 14 01 ff 01 ec 19 f2 08 ff 02 14 3b eb 07 02
E: 11.648000 14 01 ff 01 ea 19 f4 08 ff 02 1d 3b db 07 02
E: 11.656000 14 01 ff 01 ea 19 f4 08 ff 02 1d 3b db 07 02
E: 11.664000 14 01 ff 01 e7 19 f1 08 ff 02 26 3b d9 07 02
E: 11.672000 14 01 ff 01 e7 19 f1 08 ff 02 26 3b d9 07 02
E: 11.680000 14 01 ff 01 e3 19 f6 08 ff 02 2d 3b d6 07 02
E: 11.688000 14 01 ff 01 e3 19 f6 08 ff 02 2d 3b d6 07 02
E: 11.696000 14 01 ff 01 dd 19 f6 08 ff 02 34 3b d3 07 02
E: 11.704000 14 01 ff 01 dd 19 f6 08 ff 02 34 3b d3 07 02
E: 11.712000 14 01 ff 01 d1 19 09 09 ff 02 3b 3b d5 07 02
E: 11.720000 14 01 ff 01 d1 19 09 09 ff 02 3b 3b d5 07 02
E: 11.728000 14 01 ff 01 c4 19 1b 09 ff 02 42 3b c9 07 02
E: 11.736000 14 01 ff 01 c4 19 1b 09 ff 02 42 3b c9 07 02
E: 11.744000 14 01 ff 01 b2 19 31 09 ff 02 48 3b c5 07 02
E: 11.752000 14 01 ff 01 b2 19 31 09 ff 02 48 3b c5 07 02
E: 11.760000 14 01 ff 01 b2 19 31 09 ff 02 4e 3b cc 07 02
E: 11.768000 14 01 ff 01 b2 19 31 09 ff 02 4e 3b cc 07 02
E: 11.776000 14 01 ff 01 f1 18 2c 0a ff 02 57 3b c0 07 02
E: 11.784000 14 01 ff 01 f1 18 2c 0a ff 02 57 3b c0 07 02
E: 11.792000 14 01 ff 01 9e 18 a7 0a ff 02 5f 3b c4 07 02
E: 11.800000 14 01 ff 01 9e 18 a7 0a ff 02 5f 3b c4 07 02
E: 11.808000 14 01 ff 01 4d 18 3b 0b ff 02 64 3b bd 07 02
E: 11.816000 14 01 ff 01 4d 18 3b 0b ff 02 64 3b bd 07 02
E: 11.824000 14 01 ff 01 03 18 d9 0b ff 02 68 3b d2 07 02
E: 11.832000 14 01 ff 01 03 18 d9 0b ff 02 68 3b d2 07 02
E: 11.840000 14 01 ff 01 b8 17 95 0c ff 02 6a 3b d9 07 02
E: 11.848000 14 01 ff 01 b8 17 95 0c ff 02 6a 3b d9 07 02
E: 11.856000 14 01 ff 01 76 17 59 0d ff 02 6c 3b d1 07 02
E: 11.864000 14 01 ff 01 34 17 e8 0d ff 02 6d 3b d3 07 02
E: 11.872000 14 01 ff 01 06 17 57 0e ff 02 70 3b d6 07 02
E: 11.880000 14 01 ff 01 e4 16 c1 0e ff 02 72 3b d9 07 02
E: 11.888000 14 01 ff 01 c8 16 27 0f ff 02 74 3b de 07 02
E: 11.896000 14 01 ff 01 b3 16 92 0f ff 02 76 3b e2 07 02
E: 11.904000 14 01 ff 01 a3 16 10 10 ff 02 75 3b e5 07 02
E: 11.912000 14 01 ff 01 9c 16 8c 10 ff 02 76 3b e7 07 02
E: 11.920000 14 01 ff 01 99 16 04 11 ff 02 75 3b e8 07 02
E: 11.928000 14 01 ff 01 a3 16 b7 11 ff 02 76 3b e9 07 02
E: 11.936000 14 01 ff 01 b0 16 67 12 ff 02 78 3b ec 07 02
E: 11.944000 14 01 ff 01 c3 16 0d 13 ff 02 77 3b ec 07 02
E: 11.952000 14 01 ff 01 e9 16 cf 13 ff 02 78 3b ee 07 02
E: 11.960000 14 01 ff 01 0e 17 86 14 ff 02 79 3b f0 07 02
E: 11.968000 14 01 ff 01 3b 17 41 15 ff 02 79 3b f0 07 02
E: 11.976000 14 01 ff 01 73 17 10 16 ff 02 77 3b f0 07 02
E: 11.984000 14 01 ff 01 b7 17 cd 16 ff 02 77 3b f0 07 02
E: 11.992000 14 01 ff 01 0e 18 d7 17 ff 02 79 3b f0 07 02
E: 12.000000 14 01 ff 01 54 18 95 18 ff 02 7a 3b f0 07 02
E: 12.008000 14 01 ff 01 a0 18 6d 19 ff 02 7a 3b f0 07 02
E: 12.016000 14 01 ff 01 03 19 65 1a ff 02 7b 3b f0 07 02
E: 12.024000 14 01 ff 01 62 19 1a 1b ff 02 7a 3b f2 07 02
E: 12.032000 14 01 ff 01 dc 19 15 1c ff 02 79 3b f3 07 02
E: 12.040000 14 01 ff 01 3d 1a c6 1c ff 02 79 3b f4 07 02
E: 12.048000 14 01 ff 01 a6 1a 88 1d ff 02 7a 3b f3 07 02
E: 12.056000 14 01 ff 01 3a 1b 61 1e ff 02 7b 3b f2 07 02
E: 12.064000 14 01 ff 01 bc 1b f5 1e ff 02 7b 3b f3 07 02
E: 12.072000 14 01 ff 01 44 1c 84 1f ff 02 7a 3b f4 07 02
E: 12.080000 14 01 ff 01 de 1c 14 20 ff 02 7a 3b f4 07 02
E: 12.088000 14 01 ff 01 83 1d 88 20 ff 02 7a 3b f4 07 02
E: 12.096000 14 01 ff 01 19 1e e1 20 ff 02 7a 3b f6 07 02
E: 12.104000 14 01 ff 01 91 1e 18 21 ff 02 7a 3b f5 07 02
E: 12.112000 14 01 ff 01 0b 1f 40 21 ff 02 79 3b f5 07 02
E: 12.120000 14 01 ff 01 85 1f 55 21 ff 02 7a 3b f5 07 02
E: 12.128000 14 01 ff 01 fb 1f 47 21 ff 02 7b 3b f5 07 02
E: 12.136000 14 01 ff 01 6f 20 19 21 ff 02 7b 3b f5 07 02
E: 12.144000 14 01 ff 01 e4 20 de 20 ff 02 7b 3b f6 07 02
E: 12.152000 14 01 ff 01 50 21 9e 20 ff 02 7b 3b f6 07 02
E: 12.160000 14 01 ff 01 b6 21 56 20 ff 02 79 3b f6 07 02
E: 12.168000 14 01 ff 01 35 22 d9 1f ff 02 7a 3b f6 07 02
E: 12.176000 14 01 ff 01 8e 22 6a 1f ff 02 7a 3b f6 07 02
E: 12.184000 14 01 ff 01 fa 22 d0 1e ff 02 79 3b f6 07 02
E: 12.192000 14 01 ff 01 58 23 08 1e ff 02 7a 3b f6 07 02
E: 12.200000 14 01 ff 01 a2 23 51 1d ff 02 7a 3b f6 07 02
E: 12.208000 14 01 ff 01 dd 23 87 1c ff 02 7a 3b f6 07 02
E: 12.216000 14 01 ff 01 0c 24 cc 1b ff 02 7a 3b f6 07 02
E: 12.224000 14 01 ff 01 28 24 42 1b ff 02 79 3b f6 07 02
E: 12.232000 14 01 ff 01 43 24 70 1a ff 02 7a 3b f6 07 02
E: 12.240000 14 01 ff 01 51 24 a7 19 ff 02 79 3b f6 07 02
E: 12.248000 14 01 ff 01 54 24 d6 18 ff 02 7c 3b f6 07 02
E: 12.256000 14 01 ff 01 49 24 ff 17 ff 02 7c 3b f5 07 02
E: 12.264000 14 01 ff 01 31 24 33 17 ff 02 79 3b f5 07 02
E: 12.272000 14 01 ff 01 0f 24 4f 16 ff 02 79 3b f5 07 02
E: 12.280000 14 01 ff 01 e5 23 83 15 ff 02 7a 3b f5 07 02
E: 12.288000 14 01 ff 01 b6 23 b1 14 ff 02 7a 3b f5 07 02
E: 12.296000 14 01 ff 01 7f 23 e1 13 ff 02 7a 3b f5 07 02
E: 12.304000 14 01 ff 01 3f 23 26 13 ff 02 79 3b f5 07 02
E: 12.312000 14 01 ff 01 f8 22 58 12 ff 02 7a 3b f5 07 02
E: 12.320000 14 01 ff 01 b2 22 9d 11 ff 02 7a 3b f4 07 02
E: 12.328000 14 01 ff 01 6d 22 f3 10 ff 02 7a 3b f0 07 02
E: 12.336000 14 01 ff 01 6d 22 f3 10 ff 02 7a 3b f0 07 02
E: 12.344000 14 01 ff 01 1d 22 d8 0f ff 02 7b 3b ed 07 02
E: 12.352000 14 01 ff 01 1d 22 d8 0f ff 02 7b 3b ed 07 02
E: 12.360000 14 01 ff 01 b6 21 ac 0e ff 02 7b 3b e5 07 02
E: 12.368000 14 01 ff 01 b6 21 ac 0e ff 02 7b 3b e5 07 02
E: 12.376000 14 01 ff 01 4b 21 f7 0d ff 02 7b 3b d9 07 02
E: 12.384000 14 01 ff 01 4b 21 f7 0d ff 02 7b 3b d9 07 02
E: 12.392000 14 01 ff 01 cc 20 43 0d ff 02 7b 3b e8 07 02
E: 12.400000 14 01 ff 01 cc 20 43 0d ff 02 7b 3b e8 07 02
E: 12.408000 14 01 ff 01 38 20 b0 0c ff 02 7a 3b e5 07 02
E: 12.416000 14 01 ff 01 38 20 b0 0c ff 02 7a 3b e5 07 02
E: 12.424000 14 01 ff 01 76 1f e4 0b ff 02 7b 3b f0 07 02
E: 12.432000 14 01 ff 01 76 1f e4 0b ff 02 7b 3b f0 07 02
E: 12.440000 14 01 ff 01 d1 1e 58 0b ff 02 7b 3b ea 07 02
E: 12.448000 14 01 ff 01 d1 1e 58 0b ff 02 7b 3b ea 07 02
E: 12.456000 14 01 ff 01 f4 1d b5 0a ff 02 7b 3b 00 08 02
E: 12.464000 14 01 ff 01 f4 1d b5 0a ff 02 7b 3b 00 08 02
E: 12.472000 14 01 ff 01 49 1d 65 0a ff 02 7c 3b fd 07 02
E: 12.480000 14 01 ff 01 49 1d 65 0a ff 02 7c 3b fd 07 02
E: 12.488000 14 01 ff 01 b3 1c 13 0a ff 02 7d 3b 02 08 02
E: 12.496000 14 01 ff 01 b3 1c 13 0a ff 02 7d 3b 02 08 02
E: 12.504000 14 01 ff 01 51 1c de 09 ff 02 7c 3b ed 07 02
E: 12.512000 14 01 ff 01 51 1c de 09 ff 02 7c 3b ed 07 02
E: 12.520000 14 01 ff 01 19 1c e0 09 ff 02 7d 3b f2 07 02
E: 12.528000 14 01 ff 01 19 1c e0 09 ff 02 7d 3b f2 07 02
E: 12.536000 14 01 ff 01 e8 1b d7 09 ff 02 7d 3b ec 07 02
E: 12.544000 14 01 ff 01 e8 1b d7 09 ff 02 7d 3b ec 07 02
E: 12.552000 14 01 ff 01 c0 1b d4 09 ff 02 7d 3b ee 07 02
E: 12.560000 14 01 ff 01 c0 1b d4 09 ff 02 7d 3b ee 07 02
E: 12.568000 14 01 ff 01 ab 1b cb 09 ff 02 7d 3b f5 07 02
E: 12.576000 14 01 ff 01 ab 1b cb 09 ff 02 7d 3b f5 07 02
E: 12.584000 14 01 ff 01 9b 1b c0 09 ff 02 7d 3b f4 07 02
E: 12.592000 14 01 ff 01 9b 1b c0 09 ff 02 7d 3b f4 07 02
E: 12.600000 14 01 ff 01 8c 1b bc 09 ff 02 7d 3b ec 07 02
E: 12.608000 14 01 ff 01 8c 1b bc 09 ff 02 7d 3b ec 07 02
E: 12.616000 14 01 ff 01 7f 1b ba 09 ff 02 7c 3b ef 07 02
E: 12.624000 14 01 ff 01 7f 1b ba 09 ff 02 7c 3b ef 07 02
E: 12.632000 14 01 ff 01 72 1b b1 09 ff 02 7c 3b ed 07 02
E: 12.640000 14 01 ff 01 72 1b b1 09 ff 02 7c 3b ed 07 02
E: 12.648000 14 01 ff 01 6a 1b 9d 09 ff 02 7c 3b e5 07 02
E: 12.656000 14 01 ff 01 6a 1b 9d 09 ff 02 7c 3b e5 07 02
E: 12.664000 14 01 ff 01 62 1b 9b 09 ff 02 7c 3b e3 07 02
E: 12.672000 14 01 ff 01 62 1b 9b 09 ff 02 7c 3b e3 07 02
E: 12.680000 14 01 ff 01 5c 1b 9b 09 ff 02 7b 3b ec 07 02
E: 12.688000 14 01 ff 01 5c 1b 9b 09 ff 02 7b 3b ec 07 02
E: 12.696000 14 01 ff 01 57 1b 89 09 ff 02 7b 3b ea 07 02
E: 12.704000 14 01 ff 01 57 1b 89 09 ff 02 7b 3b ea 07 02
E: 12.712000 14 01 ff 01 54 1b 92 09 ff 02 7b 3b ec 07 02
E: 12.720000 14 01 ff 02 81 3b f8 07 fe 01 54 1b 92 09 02
E: 12.728000 14 01 ff 02 81 3b f8 07 fc 01 54 1b 92 09 02
E: 12.736000 14 01 ff 02 81 3b f8 07 fc 01 54 1b 92 09 02
E: 12.744000 14 01 ff 02 81 3b f7 07 fc 01 54 1b 92 09 02
E: 12.752000 14 01 ff 02 81 3b f6 07 fc 01 54 1b 92 09 02
E: 12.760000 14 01 ff 02 81 3b f5 07 fc 01 54 1b 92 09 02
E: 12.768000 14 01 ff 02 81 3b f5 07 fc 01 54 1b 92 09 02
E: 12.776000 14 01 ff 02 81 3b f5 07 fc 01 54 1b 92 09 02
E: 12.784000 14 01 ff 02 81 3b f5 07 fc 01 54 1b 92 09 02
E: 12.792000 14 01 ff 02 81 3b f5 07 fc 01 54 1b 92 09 02
E: 12.800000 14 01 ff 02 81 3b f4 07 fc 01 54 1b 92 09 02
E: 12.808000 14 01 ff 02 81 3b f4 07 fc 01 54 1b 92 09 02
E: 12.816000 14 01 ff 02 81 3b f4 07 fc 01 54 1b 92 09 02
E: 12.824000 14 01 ff 02 80 3b f4 07 fc 01 54 1b 92 09 02
E: 12.832000 14 01 ff 02 80 3b f4 07 fc 01 54 1b 92 09 02
E: 12.840000 14 01 ff 02 80 3b f4 07 fc 01 54 1b 92 09 02
E: 12.848000 14 01 ff 02 80 3b f4 07 fc 01 54 1b 92 09 02
E: 12.856000 14 01 ff 02 80 3b f4 07 fc 01 54 1b 92 09 02
E: 12.864000 14 01 ff 02 80 3b f4 07 fc 01 54 1b 92 09 02
E: 12.872000 14 01 ff 02 80 3b f3 07 fc 01 54 1b 92 09 02
E: 12.880000 14 01 ff 02 80 3b f2 07 fc 01 54 1b 92 09 02
E: 12.888000 14 01 ff 02 80 3b f2 07 fc 01 54 1b 92 09 02
E: 12.896000 14 01 ff 02 80 3b f1 07 fc 01 54 1b 92 09 02
E: 12.904000 14 01 ff 02 80 3b f1 07 fc 01 54 1b 92 09 02
E: 12.912000 14 01 ff 02 80 3b f1 07 fc 01 54 1b 92 09 02
E: 12.920000 14 01 ff 02 80 3b f1 07 fc 01 54 1b 92 09 02
E: 12.928000 14 01 ff 02 80 3b f1 07 fc 01 54 1b 92 09 02
E: 12.936000 14 01 ff 02 80 3b f1 07 fc 01 54 1b 92 09 02
E: 12.944000 14 01 ff 02 80 3b f1 07 fc 01 54 1b 92 09 02
E: 12.952000 14 01 ff 02 7f 3b f1 07 fc 01 54 1b 92 09 02
E: 12.960000 14 01 ff 02 7f 3b f1 07 fc 01 54 1b 92 09 02
E: 12.968000 14 01 ff 02 7f 3b f1 07 fc 01 54 1b 92 09 02
E: 12.976000 14 01 ff 02 7f 3b f1 07 fc 01 54 1b 92 09 02
E: 12.984000 14 01 ff 02 7f 3b f1 07 fc 01 54 1b 92 09 02
E: 12.992000 14 01 ff 02 7f 3b f1 07 fc 01 54 1b 92 09 02
E: 13.000000 14 01 ff 02 7f 3b f1 07 fc 01 54 1b 92 09 02
E: 13.008000 14 01 ff 02 7f 3b f1 07 fc 01 54 1b 92 09 02
E: 13.016000 14 01 ff 02 7f 3b f1 07 fc 01 54 1b 92 09 02
E: 13.024000 14 01 ff 02 7f 3b f1 07 fc 01 54 1b 92 09 02
E: 13.032000 14 01 ff 02 7f 3b f1 07 fc 01 54 1b 92 09 02
E: 13.040000 14 01 ff 02 7f 3b f1 07 fc 01 54 1b 92 09 02
E: 13.048000 14 01 ff 02 7f 3b f2 07 fc 01 54 1b 92 09 02
E: 13.056000 14 01 ff 02 7f 3b f2 07 fc 01 54 1b 92 09 02
E: 13.064000 14 01 ff 02 7f 3b f2 07 fc 01 54 1b 92 09 02
E: 13.072000 14 01 ff 02 7f 3b f2 07 fc 01 54 1b 92 09 02
E: 13.080000 14 01 ff 02 7f 3b f1 07 fc 01 54 1b 92 09 02
E: 13.088000 14 01 ff 02 7f 3b f1 07 fc 01 54 1b 92 09 02
E: 13.096000 14 01 ff 02 7e 3b f1 07 fc 01 54 1b 92 09 02
E: 13.104000 14 01 ff 02 7e 3b f1 07 fc 01 54 1b 92 09 02
E: 13.112000 14 01 ff 02 7e 3b f1 07 fc 01 54 1b 92 09 02
E: 13.120000 14 01 ff 02 7d 3b f1 07 fc 01 54 1b 92 09 02
E: 13.128000 14 01 ff 02 7d 3b f1 07 fc 01 54 1b 92 09 02
E: 13.136000 14 01 ff 02 7d 3b f1 07 fc 01 54 1b 92 09 02
E: 13.144000 14 01 ff 02 7d 3b f1 07 fc 01 54 1b 92 09 02
E: 13.152000 14 01 ff 02 7d 3b f1 07 fc 01 54 1b 92 09 02
E: 13.160000 14 01 ff 02 7d 3b f1 07 fc 01 54 1b 92 09 02
E: 13.168000 14 01 ff 02 7c 3b f1 07 fc 01 54 1b 92 09 02
E: 13.176000 14 01 ff 02 7c 3b f1 07 fc 01 54 1b 92 09 02
E: 13.184000 14 01 ff 02 7c 3b f1 07 fc 01 54 1b 92 09 02
E: 13.192000 14 01 ff 02 7b 3b f1 07 fc 01 54 1b 92 09 02
E: 13.200000 14 01 ff 02 7b 3b f1 07 fc 01 54 1b 92 09 02
E: 13.208000 14 01 ff 02 7b 3b f1 07 fc 01 54 1b 92 09 02
E: 13.216000 14 01 ff 02 7b 3b f2 07 fc 01 54 1b 92 09 02
E: 13.224000 14 01 ff 02 7b 3b f2 07 fc 01 54 1b 92 09 02
E: 13.232000 14 01 ff 02 7a 3b f2 07 fc 01 54 1b 92 09 02
E: 13.240000 14 01 ff 02 79 3b f2 07 fc 01 54 1b 92 09 02
E: 13.248000 14 01 ff 02 79 3b f3 07 fc 01 54 1b 92 09 02
E: 13.256000 14 01 ff 02 79 3b f3 07 fc 01 54 1b 92 09 02
E: 13.264000 14 01 ff 02 79 3b f3 07 fc 01 54 1b 92 09 02
E: 13.272000 14 01 ff 02 79 3b f4 07 fc 01 54 1b 92 09 02
E: 13.280000 14 01 ff 02 79 3b f4 07 fc 01 54 1b 92 09 02
E: 13.288000 14 01 ff 02 7a 3b f4 07 fc 01 54 1b 92 09 02
E: 13.296000 14 01 ff 02 7a 3b f4 07 fc 01 54 1b 92 09 02
E: 13.304000 14 01 ff 02 79 3b f2 07 fc 01 54 1b 92 09 02
E: 13.312000 14 01 ff 02 73 3b ee 07 fc 01 54 1b 92 09 02
E: 13.320000 14 01 fe 02 73 3b ee 07 fc 01 54 1b 92 09 02
E: 13.328000 14 01 fc 02 73 3b ee 07 fc 01 54 1b 92 09 02
