R: 303 05 0d 09 04 a1 01 85 01 09 22 a1 02 09 42 15 00 25 01 95 01 75 01 81 02 09 32 81 02 09 47 81 02 75 05 81 03 09 30 26 ff 00 75 08 81 02 09 51 25 02 81 02 26 96 0d 05 01 75 10 55 0d 65 33 09 30 35 00 46 fd 1d 81 02 09 31 46 60 11 81 02 c0 09 22 a1 02 05 0d 35 00 45 00 55 00 65 00 09 42 25 01 75 01 81 02 09 32 81 02 09 47 81 02 75 05 81 03 09 30 26 ff 00 75 08 81 02 09 51 25 02 81 02 26 96 0d 05 01 75 10 55 0d 65 33 09 30 46 fd 1d 81 02 09 31 46 60 11 81 02 c0 35 00 45 00 55 00 65 00 05 0d 09 54 75 08 25 02 81 02 85 08 09 55 b1 02 c0 09 0e a1 01 85 07 09 22 a1 00 09 52 25 0a b1 02 c0 05 0c 09 01 a1 01 85 06 09 01 26 ff 00 95 08 b1 02 c0 c0 05 01 09 02 a1 01 85 03 09 01 a1 00 05 09 19 01 29 02 25 01 75 01 95 02 81 02 95 06 81 03 26 96 0d 05 01 75 10 95 01 55 0d 65 33 09 30 46 fd 1d 81 02 09 31 46 60 11 81 02 c0 c0 06 ff 01 09 01 a1 01 26 ff 00 35 00 45 00 55 00 65 00 85 05 75 08 95 3f 09 00 81 02 c0
N: AsusTek, Inc. MultiTouch
P: usb-0000:00:1d.2-1/input0
I: 3 0486 0185
E: 0.000003 16 01 07 0c 01 ca 01 04 07 00 00 00 00 00 00 00 01
E: 0.007850 16 01 07 0c 01 d2 01 02 07 00 00 00 00 00 00 00 01
E: 0.015734 16 01 07 0c 01 dc 01 00 07 00 00 00 00 00 00 00 01
E: 0.023732 16 01 07 0c 01 eb 01 ff 06 00 00 00 00 00 00 00 01
E: 0.031737 16 01 07 0c 01 fd 01 fd 06 00 00 00 00 00 00 00 01
E: 0.039738 16 01 07 0c 01 13 02 fc 06 00 00 00 00 00 00 00 01
E: 0.047739 16 01 07 0c 01 26 02 fe 06 00 00 00 00 00 00 00 01
E: 0.055663 16 01 07 0c 01 36 02 02 07 00 00 00 00 00 00 00 01
E: 0.063758 16 01 07 0c 01 47 02 06 07 00 00 00 00 00 00 00 01
E: 0.071737 16 01 07 0c 01 63 02 0b 07 00 00 00 00 00 00 00 01
E: 0.079754 16 01 07 0b 01 82 02 10 07 00 00 00 00 00 00 00 01
E: 0.087781 16 01 07 05 01 a2 02 16 07 00 00 00 00 00 00 00 01
E: 0.095744 16 01 07 03 01 c3 02 1d 07 00 00 00 00 00 00 00 01
E: 0.103771 16 01 07 03 01 de 02 22 07 00 00 00 00 00 00 00 01
E: 0.111914 16 01 07 03 01 fa 02 27 07 00 00 00 00 00 00 00 01
E: 0.119782 16 01 07 04 01 17 03 2c 07 00 00 00 00 00 00 00 01
E: 0.127850 16 01 07 04 01 40 03 32 07 00 00 00 00 00 00 00 01
E: 0.135893 16 01 07 04 01 60 03 37 07 00 00 00 00 00 00 00 01
E: 0.143785 16 01 07 05 01 81 03 3e 07 00 00 00 00 00 00 00 01
E: 0.151805 16 01 07 05 01 a5 03 45 07 00 00 00 00 00 00 00 01
E: 0.159824 16 01 07 06 01 cb 03 4c 07 00 00 00 00 00 00 00 01
E: 0.167799 16 01 07 06 01 e6 03 52 07 00 00 00 00 00 00 00 01
E: 0.175807 16 01 07 06 01 0e 04 5a 07 00 00 00 00 00 00 00 01
E: 0.183796 16 01 07 06 01 39 04 63 07 00 00 00 00 00 00 00 01
E: 0.193076 16 01 07 06 01 57 04 67 07 00 00 00 00 00 00 00 01
E: 0.199815 16 01 07 08 01 85 04 6d 07 00 00 00 00 00 00 00 01
E: 0.207825 16 01 07 07 01 a6 04 72 07 00 00 00 00 00 00 00 01
E: 0.216998 16 01 07 08 01 d8 04 77 07 00 00 00 00 00 00 00 01
E: 0.223851 16 01 07 0a 01 fa 04 79 07 00 00 00 00 00 00 00 01
E: 0.231843 16 01 07 0a 01 1f 05 7b 07 00 00 00 00 00 00 00 01
E: 0.239860 16 01 07 0a 01 56 05 7e 07 00 00 00 00 00 00 00 01
E: 0.248026 16 01 07 0a 01 8e 05 7f 07 00 00 00 00 00 00 00 01
E: 0.255820 16 01 07 0c 01 b6 05 7f 07 00 00 00 00 00 00 00 01
E: 0.263641 16 01 07 0c 01 de 05 7f 07 00 00 00 00 00 00 00 01
E: 0.271660 16 01 07 0e 01 08 06 80 07 00 00 00 00 00 00 00 01
E: 0.279644 16 01 07 12 01 49 06 80 07 00 00 00 00 00 00 00 01
E: 0.287657 16 01 07 18 01 8a 06 7f 07 00 00 00 00 00 00 00 01
E: 0.295646 16 01 07 1b 01 b7 06 7f 07 00 00 00 00 00 00 00 01
E: 0.303428 16 01 07 1e 01 e4 06 7e 07 00 00 00 00 00 00 00 01
E: 0.311877 16 01 07 23 01 12 07 7d 07 00 00 00 00 00 00 00 01
E: 0.319867 16 01 07 2c 01 56 07 7c 07 00 00 00 00 00 00 00 01
E: 0.327666 16 01 07 34 01 9c 07 79 07 00 00 00 00 00 00 00 01
E: 0.335666 16 01 07 39 01 ca 07 78 07 00 00 00 00 00 00 00 01
E: 0.343672 16 01 07 3f 01 f9 07 77 07 00 00 00 00 00 00 00 01
E: 0.351691 16 01 07 46 01 27 08 76 07 00 00 00 00 00 00 00 01
E: 0.359679 16 01 07 51 01 6a 08 75 07 00 00 00 00 00 00 00 01
E: 0.367913 16 01 07 58 01 ad 08 74 07 00 00 00 00 00 00 00 01
E: 0.375910 16 01 07 5c 01 d9 08 73 07 00 00 00 00 00 00 00 01
E: 0.383963 16 01 07 5e 01 04 09 72 07 00 00 00 00 00 00 00 01
E: 0.391963 16 01 07 62 01 2e 09 72 07 00 00 00 00 00 00 00 01
E: 0.399932 16 01 07 6b 01 6d 09 71 07 00 00 00 00 00 00 00 01
E: 0.407894 16 01 07 70 01 96 09 71 07 00 00 00 00 00 00 00 01
E: 0.415888 16 01 07 79 01 cf 09 71 07 00 00 00 00 00 00 00 01
E: 0.423909 16 01 07 7f 01 06 0a 71 07 00 00 00 00 00 00 00 01
E: 0.431790 16 01 07 83 01 39 0a 71 07 00 00 00 00 00 00 00 01
E: 0.439945 16 01 07 83 01 59 0a 72 07 00 00 00 00 00 00 00 01
E: 0.447925 16 01 07 7f 01 79 0a 73 07 00 00 00 00 00 00 00 01
E: 0.455722 16 01 07 7d 01 88 0a 73 07 00 00 00 00 00 00 00 01
E: 0.463741 16 01 07 79 01 b1 0a 76 07 00 00 00 00 00 00 00 01
E: 0.471956 16 01 07 72 01 d5 0a 78 07 00 00 00 00 00 00 00 01
E: 0.479932 16 01 07 6d 01 eb 0a 7b 07 00 00 00 00 00 00 00 01
E: 0.487741 16 01 07 60 01 12 0b 82 07 00 00 00 00 00 00 00 01
E: 0.495758 16 01 07 55 01 33 0b 88 07 00 00 00 00 00 00 00 01
E: 0.503976 16 01 07 47 01 4f 0b 8f 07 00 00 00 00 00 00 00 01
E: 0.511763 16 01 07 3a 01 63 0b 96 07 00 00 00 00 00 00 00 01
E: 0.519780 16 01 07 32 01 76 0b 9b 07 00 00 00 00 00 00 00 01
E: 0.527788 16 01 07 26 01 85 0b a0 07 00 00 00 00 00 00 00 01
E: 0.535798 16 01 07 17 01 94 0b a4 07 00 00 00 00 00 00 00 01
E: 0.543847 16 01 07 0c 01 9d 0b a8 07 00 00 00 00 00 00 00 01
E: 0.551410 16 01 07 03 01 a5 0b ab 07 00 00 00 00 00 00 00 01
E: 0.559835 16 01 07 00 01 ab 0b ad 07 00 00 00 00 00 00 00 01
E: 0.567771 16 01 04 00 01 ab 0b ad 07 00 00 00 00 00 00 00 01
E: 2.257000 16 01 07 00 01 64 01 5e 01 00 00 00 00 00 00 00 01
E: 2.264886 16 01 07 00 01 65 01 5e 01 00 00 00 00 00 00 00 01
E: 2.272760 16 01 07 00 01 65 01 60 01 00 00 00 00 00 00 00 01
E: 2.280802 16 01 07 00 01 65 01 67 01 00 00 00 00 00 00 00 01
E: 2.288756 16 01 07 00 01 6a 01 72 01 00 00 00 00 00 00 00 01
E: 2.296893 16 01 07 00 01 6e 01 81 01 00 00 00 00 00 00 00 01
E: 2.305117 16 01 07 00 01 6f 01 8d 01 00 00 00 00 00 00 00 01
E: 2.314457 16 01 07 00 01 73 01 9d 01 00 00 00 00 00 00 00 01
E: 2.320811 16 01 07 00 01 74 01 a9 01 00 00 00 00 00 00 00 01
E: 2.329530 16 01 07 00 01 77 01 b5 01 00 00 00 00 00 00 00 01
E: 2.339205 16 01 07 00 01 78 01 c0 01 00 00 00 00 00 00 00 01
E: 2.344825 16 01 07 00 01 76 01 c0 01 00 00 00 00 00 00 00 01
E: 2.352823 16 01 07 00 01 76 01 c8 01 00 00 00 00 00 00 00 01
E: 2.360860 16 01 07 00 01 75 01 cf 01 00 00 00 00 00 00 00 01
E: 2.368825 16 01 07 00 01 76 01 d6 01 00 00 00 00 00 00 00 01
E: 2.376832 16 01 07 00 01 77 01 de 01 00 00 00 00 00 00 00 01
E: 2.384851 16 01 07 00 01 74 01 df 01 00 00 00 00 00 00 00 01
E: 2.392847 16 01 07 00 01 75 01 e4 01 00 00 00 00 00 00 00 01
E: 2.400813 16 01 07 00 01 77 01 e8 01 00 00 00 00 00 00 00 01
E: 2.408842 16 01 07 00 01 77 01 ea 01 00 00 00 00 00 00 00 01
E: 2.416858 16 01 07 00 01 77 01 eb 01 00 00 00 00 00 00 00 01
E: 2.425803 16 01 07 00 01 77 01 ec 01 00 00 00 00 00 00 00 01
E: 2.432954 16 01 07 00 01 78 01 eb 01 00 00 00 00 00 00 00 01
E: 2.440853 16 01 07 01 01 79 01 eb 01 00 00 00 00 00 00 00 01
E: 2.449568 16 01 07 01 01 7a 01 eb 01 00 00 00 00 00 00 00 01
E: 2.456884 16 01 07 01 01 7c 01 eb 01 00 00 00 00 00 00 00 01
E: 2.464860 16 01 07 01 01 7d 01 ea 01 00 00 00 00 00 00 00 01
E: 2.472877 16 01 07 01 01 7d 01 e9 01 00 00 00 00 00 00 00 01
E: 2.480823 16 01 07 01 01 7d 01 e9 01 00 00 00 00 00 00 00 01
E: 2.488864 16 01 07 02 01 7d 01 e9 01 00 00 00 00 00 00 00 01
E: 2.496875 16 01 07 05 01 7d 01 e8 01 00 00 00 00 00 00 00 01
E: 2.504763 16 01 07 08 01 7c 01 e8 01 00 00 00 00 00 00 00 01
E: 2.512823 16 01 07 0b 01 7c 01 e7 01 00 00 00 00 00 00 00 01
E: 2.520916 16 01 07 11 01 7b 01 e7 01 00 00 00 00 00 00 00 01
E: 2.528889 16 01 07 15 01 7b 01 e7 01 00 00 00 00 00 00 00 01
E: 2.536699 16 01 07 1b 01 7a 01 e6 01 00 00 00 00 00 00 00 01
E: 2.545004 16 01 07 1f 01 79 01 e6 01 00 00 00 00 00 00 00 01
E: 2.552977 16 01 07 24 01 79 01 e6 01 00 00 00 00 00 00 00 01
E: 2.560989 16 01 07 2a 01 79 01 e7 01 00 00 00 00 00 00 00 01
E: 2.568744 16 01 07 30 01 79 01 e6 01 00 00 00 00 00 00 00 01
E: 2.576959 16 01 07 37 01 79 01 e6 01 00 00 00 00 00 00 00 01
E: 2.584814 16 01 07 3e 01 79 01 e6 01 00 00 00 00 00 00 00 01
E: 2.592777 16 01 07 45 01 7a 01 e6 01 00 00 00 00 00 00 00 01
E: 2.600722 16 01 07 4b 01 7a 01 e6 01 00 00 00 00 00 00 00 01
E: 2.608746 16 01 07 50 01 79 01 e6 01 00 00 00 00 00 00 00 01
E: 2.616996 16 01 07 52 01 79 01 e6 01 00 00 00 00 00 00 00 01
E: 2.624722 16 01 07 55 01 7a 01 e6 01 00 00 00 00 00 00 00 01
E: 2.632792 16 01 07 57 01 7a 01 e5 01 00 00 00 00 00 00 00 01
E: 2.640800 16 01 07 5a 01 7a 01 e6 01 00 00 00 00 00 00 00 01
E: 2.648753 16 01 07 5c 01 79 01 e5 01 00 00 00 00 00 00 00 01
E: 2.656766 16 01 07 60 01 79 01 e5 01 00 00 00 00 00 00 00 01
E: 2.665025 16 01 07 60 01 79 01 e5 01 00 00 00 00 00 00 00 01
E: 2.673001 16 01 07 60 01 7a 01 e5 01 00 00 00 00 00 00 00 01
E: 2.680755 16 01 07 60 01 7a 01 e5 01 00 00 00 00 00 00 00 01
E: 2.688817 16 01 07 60 01 79 01 e5 01 00 00 00 00 00 00 00 01
E: 2.696767 16 01 07 5f 01 7a 01 e5 01 00 00 00 00 00 00 00 01
E: 2.704790 16 01 07 5f 01 7a 01 e5 01 00 00 00 00 00 00 00 01
E: 2.713206 16 01 07 5f 01 7a 01 e4 01 00 00 00 00 00 00 00 01
E: 2.720802 16 01 07 61 01 7a 01 e4 01 00 00 00 00 00 00 00 01
E: 2.728988 16 01 07 63 01 79 01 e4 01 00 00 00 00 00 00 00 01
E: 2.737080 16 01 07 65 01 7a 01 e3 01 00 00 00 00 00 00 00 01
E: 2.744845 16 01 07 68 01 79 01 e3 01 00 00 00 00 00 00 00 01
E: 2.752799 16 01 07 6a 01 79 01 e3 01 00 00 00 00 00 00 00 01
E: 2.761220 16 01 07 6d 01 78 01 e3 01 00 00 00 00 00 00 00 01
E: 2.768829 16 01 07 72 01 78 01 e3 01 00 00 00 00 00 00 00 01
E: 2.777269 16 01 07 77 01 77 01 e3 01 00 00 00 00 00 00 00 01
E: 2.785368 16 01 07 7a 01 77 01 e2 01 00 00 00 00 00 00 00 01
E: 2.793226 16 01 07 7d 01 76 01 e2 01 00 00 00 00 00 00 00 01
E: 2.801067 16 01 07 83 01 76 01 e2 01 00 00 00 00 00 00 00 01
E: 2.809081 16 01 07 83 01 76 01 e2 01 00 00 00 00 00 00 00 01
E: 2.816884 16 01 07 86 01 75 01 e2 01 00 00 00 00 00 00 00 01
E: 2.825248 16 01 07 8c 01 75 01 e2 01 00 00 00 00 00 00 00 01
E: 2.833104 16 01 07 8f 01 75 01 e3 01 00 00 00 00 00 00 00 01
E: 2.841055 16 01 07 92 01 75 01 e4 01 00 00 00 00 00 00 00 01
E: 2.849028 16 01 07 96 01 74 01 e5 01 00 00 00 00 00 00 00 01
E: 2.857038 16 01 07 9b 01 74 01 e5 01 00 00 00 00 00 00 00 01
E: 2.865037 16 01 07 9f 01 73 01 e6 01 00 00 00 00 00 00 00 01
E: 2.873044 16 01 07 a3 01 73 01 e6 01 00 00 00 00 00 00 00 01
E: 2.880855 16 01 07 a5 01 72 01 e7 01 00 00 00 00 00 00 00 01
E: 2.888856 16 01 07 ab 01 72 01 e7 01 00 00 00 00 00 00 00 01
E: 2.896861 16 01 07 ad 01 72 01 e7 01 00 00 00 00 00 00 00 01
E: 2.904896 16 01 07 af 01 72 01 e7 01 00 00 00 00 00 00 00 01
E: 2.912875 16 01 07 b5 01 72 01 e7 01 00 00 00 00 00 00 00 01
E: 2.920939 16 01 07 b6 01 72 01 e7 01 00 00 00 00 00 00 00 01
E: 2.929171 16 01 07 b8 01 72 01 e7 01 00 00 00 00 00 00 00 01
E: 2.937120 16 01 07 b9 01 72 01 e9 01 00 00 00 00 00 00 00 01
E: 2.945159 16 01 07 bb 01 72 01 e9 01 00 00 00 00 00 00 00 01
E: 2.953316 16 01 07 bc 01 72 01 e9 01 00 00 00 00 00 00 00 01
E: 2.960946 16 01 07 be 01 72 01 e9 01 00 00 00 00 00 00 00 01
E: 2.969224 16 01 07 bc 01 74 01 ed 01 00 00 00 00 00 00 00 01
E: 2.977284 16 01 07 bc 01 75 01 ef 01 00 00 00 00 00 00 00 01
E: 2.985198 16 01 07 be 01 75 01 f2 01 00 00 00 00 00 00 00 01
E: 2.993171 16 01 07 be 01 77 01 f8 01 00 00 00 00 00 00 00 01
E: 3.001179 16 01 07 bd 01 77 01 fc 01 00 00 00 00 00 00 00 01
E: 3.008914 16 01 07 be 01 78 01 01 02 00 00 00 00 00 00 00 01
E: 3.016918 16 01 07 be 01 79 01 04 02 00 00 00 00 00 00 00 01
E: 3.025138 16 01 07 bd 01 7a 01 08 02 00 00 00 00 00 00 00 01
E: 3.032930 16 01 07 bd 01 7b 01 0d 02 00 00 00 00 00 00 00 01
E: 3.041026 16 01 07 bd 01 7b 01 0f 02 00 00 00 00 00 00 00 01
E: 3.049018 16 01 07 bd 01 7b 01 10 02 00 00 00 00 00 00 00 01
E: 3.057031 16 01 07 be 01 7b 01 12 02 00 00 00 00 00 00 00 01
E: 3.064982 16 01 07 be 01 7b 01 13 02 00 00 00 00 00 00 00 01
E: 3.072966 16 01 07 be 01 7d 01 15 02 00 00 00 00 00 00 00 01
E: 3.081239 16 01 07 be 01 7d 01 15 02 00 00 00 00 00 00 00 01
E: 3.089007 16 01 07 bf 01 7d 01 17 02 00 00 00 00 00 00 00 01
E: 3.097012 16 01 07 bf 01 7d 01 19 02 00 00 00 00 00 00 00 01
E: 3.104975 16 01 07 c0 01 7d 01 19 02 00 00 00 00 00 00 00 01
E: 3.112970 16 01 07 c1 01 7d 01 19 02 00 00 00 00 00 00 00 01
E: 3.120974 16 01 07 c0 01 7d 01 19 02 00 00 00 00 00 00 00 01
E: 3.128990 16 01 07 bb 01 7d 01 17 02 00 00 00 00 00 00 00 01
E: 3.137372 16 01 07 b2 01 7d 01 17 02 00 00 00 00 00 00 00 01
E: 3.145262 16 01 07 aa 01 7d 01 17 02 00 00 00 00 00 00 00 01
E: 3.153090 16 01 07 a3 01 7d 01 17 02 00 00 00 00 00 00 00 01
E: 3.160997 16 01 07 a0 01 7d 01 17 02 07 2c 02 33 0a b0 03 02
E: 3.168973 16 01 07 94 01 7f 01 17 02 07 36 02 37 0a a9 03 02
E: 3.177355 16 01 07 8d 01 7f 01 19 02 07 39 02 3a 0a a4 03 02
E: 3.185030 16 01 07 85 01 7f 01 1a 02 07 3d 02 3c 0a a0 03 02
E: 3.193021 16 01 07 7e 01 7f 01 1c 02 07 40 02 3f 0a 9b 03 02
E: 3.201058 16 01 07 77 01 7f 01 1f 02 07 42 02 42 0a 95 03 02
E: 3.209007 16 01 07 6f 01 7f 01 21 02 07 44 02 42 0a 96 03 02
E: 3.217022 16 01 07 68 01 80 01 22 02 07 45 02 43 0a 97 03 02
E: 3.225472 16 01 07 60 01 81 01 25 02 07 46 02 44 0a 98 03 02
E: 3.233008 16 01 07 59 01 83 01 28 02 07 46 02 45 0a 9a 03 02
E: 3.241047 16 01 07 52 01 84 01 2e 02 07 46 02 46 0a 9b 03 02
E: 3.249077 16 01 07 4e 01 84 01 31 02 07 46 02 46 0a 9c 03 02
E: 3.257032 16 01 07 4a 01 84 01 33 02 07 46 02 47 0a 9d 03 02
E: 3.265046 16 01 07 46 01 85 01 35 02 07 46 02 47 0a 9e 03 02
E: 3.273482 16 01 07 3e 01 85 01 39 02 07 46 02 48 0a a0 03 02
E: 3.281064 16 01 07 3a 01 86 01 3b 02 07 46 02 48 0a a0 03 02
E: 3.289508 16 01 07 37 01 86 01 3c 02 07 46 02 49 0a a0 03 02
E: 3.297398 16 01 07 34 01 87 01 3d 02 07 46 02 49 0a a1 03 02
E: 3.305422 16 01 07 2f 01 87 01 3d 02 07 46 02 4a 0a a1 03 02
E: 3.313343 16 01 07 2c 01 88 01 3e 02 07 46 02 4b 0a a2 03 02
E: 3.321278 16 01 07 2a 01 88 01 3e 02 07 46 02 4b 0a a3 03 02
E: 3.329119 16 01 07 27 01 88 01 3f 02 07 46 02 4b 0a a4 03 02
E: 3.337614 16 01 07 21 01 88 01 40 02 07 46 02 4d 0a a7 03 02
E: 3.345512 16 01 07 1f 01 88 01 42 02 07 46 02 4d 0a a8 03 02
E: 3.353375 16 01 07 1c 01 88 01 43 02 07 44 02 4d 0a a8 03 02
E: 3.361385 16 01 07 19 01 88 01 43 02 07 41 02 4e 0a aa 03 02
E: 3.369360 16 01 07 15 01 88 01 47 02 07 39 02 4f 0a ab 03 02
E: 3.377079 16 01 07 15 01 88 01 48 02 07 35 02 4f 0a ac 03 02
E: 3.385113 16 01 07 17 01 86 01 48 02 07 32 02 4f 0a ad 03 02
E: 3.393377 16 01 07 19 01 86 01 46 02 07 2e 02 50 0a ae 03 02
E: 3.401411 16 01 07 1b 01 86 01 46 02 07 2b 02 50 0a ae 03 02
E: 3.409375 16 01 07 1f 01 85 01 45 02 07 25 02 50 0a b0 03 02
E: 3.417406 16 01 07 21 01 85 01 45 02 07 22 02 50 0a b1 03 02
E: 3.425388 16 01 07 22 01 85 01 43 02 07 1f 02 50 0a b3 03 02
E: 3.433132 16 01 07 24 01 84 01 43 02 07 1d 02 50 0a b4 03 02
E: 3.441157 16 01 07 28 01 84 01 43 02 07 19 02 50 0a b7 03 02
E: 3.449427 16 01 07 2a 01 84 01 43 02 07 18 02 50 0a b9 03 02
E: 3.457530 16 01 07 2c 01 84 01 43 02 07 18 02 50 0a ba 03 02
E: 3.465409 16 01 07 2e 01 84 01 43 02 07 19 02 50 0a bc 03 02
E: 3.473115 16 01 07 34 01 84 01 43 02 07 19 02 4f 0a bf 03 02
E: 3.481183 16 01 07 36 01 83 01 45 02 07 1b 02 4f 0a c0 03 02
E: 3.489728 16 01 07 39 01 83 01 45 02 07 1b 02 4f 0a c1 03 02
E: 3.497585 16 01 07 3c 01 83 01 45 02 07 1d 02 4f 0a c3 03 02
E: 3.505447 16 01 07 42 01 83 01 45 02 07 1f 02 4f 0a c5 03 02
E: 3.513459 16 01 07 45 01 83 01 45 02 07 20 02 4f 0a c7 03 02
E: 3.521442 16 01 07 47 01 83 01 45 02 07 23 02 4f 0a c8 03 02
E: 3.529207 16 01 07 4c 01 83 01 45 02 07 24 02 4f 0a c9 03 02
E: 3.537172 16 01 07 50 01 83 01 45 02 07 26 02 4e 0a cb 03 02
E: 3.545507 16 01 07 56 01 81 01 44 02 07 2b 02 4e 0a ce 03 02
E: 3.553465 16 01 07 5a 01 81 01 43 02 07 2e 02 4e 0a cf 03 02
E: 3.561444 16 01 07 5d 01 81 01 43 02 07 30 02 4d 0a d1 03 02
E: 3.569412 16 01 07 60 01 81 01 43 02 07 32 02 4d 0a d2 03 02
E: 3.577217 16 01 07 67 01 81 01 43 02 07 37 02 4d 0a d3 03 02
E: 3.585211 16 01 07 6c 01 81 01 43 02 07 3a 02 4c 0a d4 03 02
E: 3.593572 16 01 07 6f 01 81 01 43 02 07 3c 02 4c 0a d5 03 02
E: 3.601455 16 01 07 73 01 81 01 43 02 07 3f 02 4c 0a d5 03 02
E: 3.609441 16 01 07 7b 01 81 01 43 02 07 43 02 4c 0a d7 03 02
E: 3.617447 16 01 07 7d 01 7f 01 42 02 07 46 02 4c 0a d8 03 02
E: 3.625361 16 01 07 80 01 7f 01 42 02 07 49 02 4c 0a d8 03 02
E: 3.633237 16 01 07 82 01 7f 01 42 02 07 4b 02 4b 0a d9 03 02
E: 3.641599 16 01 07 87 01 7f 01 42 02 07 50 02 4b 0a da 03 02
E: 3.649611 16 01 07 8a 01 7f 01 42 02 07 53 02 4b 0a db 03 02
E: 3.657562 16 01 07 8c 01 7f 01 42 02 07 55 02 4b 0a db 03 02
E: 3.665216 16 01 07 8f 01 7f 01 42 02 07 57 02 4b 0a dc 03 02
E: 3.673218 16 01 07 93 01 7f 01 42 02 07 5c 02 4b 0a dd 03 02
E: 3.681549 16 01 07 95 01 7f 01 42 02 07 5e 02 4b 0a dd 03 02
E: 3.689282 16 01 07 97 01 7f 01 42 02 07 60 02 4b 0a dd 03 02
E: 3.697285 16 01 07 9a 01 7e 01 40 02 07 63 02 4b 0a de 03 02
E: 3.705291 16 01 07 9c 01 7e 01 40 02 07 65 02 4b 0a de 03 02
E: 3.713256 16 01 07 a1 01 7e 01 40 02 07 69 02 4b 0a df 03 02
E: 3.721258 16 01 07 a2 01 7e 01 40 02 07 6c 02 4b 0a df 03 02
E: 3.729641 16 01 07 a4 01 7e 01 40 02 07 6e 02 4b 0a e0 03 02
E: 3.737507 16 01 07 a6 01 7e 01 40 02 07 70 02 4b 0a e0 03 02
E: 3.745470 16 01 07 aa 01 7e 01 40 02 07 73 02 4b 0a e1 03 02
E: 3.753546 16 01 07 ad 01 7e 01 40 02 07 74 02 4b 0a e1 03 02
E: 3.761632 16 01 07 af 01 7c 01 40 02 07 75 02 4b 0a e1 03 02
E: 3.769513 16 01 07 b1 01 7c 01 40 02 07 76 02 4b 0a e1 03 02
E: 3.777280 16 01 07 b4 01 7c 01 40 02 07 77 02 4b 0a e1 03 02
E: 3.785309 16 01 07 b5 01 7c 01 40 02 07 77 02 4b 0a e2 03 02
E: 3.793756 16 01 07 b7 01 7c 01 40 02 07 78 02 4b 0a e2 03 02
E: 3.801334 16 01 07 b8 01 7c 01 40 02 07 78 02 4b 0a e2 03 02
E: 3.809342 16 01 07 bb 01 7a 01 40 02 07 7a 02 4b 0a e2 03 02
E: 3.817302 16 01 07 bd 01 7a 01 40 02 07 7a 02 4b 0a e2 03 02
E: 3.825524 16 01 07 be 01 7a 01 40 02 07 7b 02 4b 0a e2 03 02
E: 3.833512 16 01 07 bf 01 7a 01 40 02 07 7b 02 4b 0a e3 03 02
E: 3.841363 16 01 07 c1 01 7a 01 40 02 07 7b 02 4b 0a e3 03 02
E: 3.849370 16 01 07 c2 01 7a 01 40 02 07 7c 02 4b 0a e3 03 02
E: 3.857361 16 01 07 c2 01 7a 01 40 02 07 7c 02 4b 0a e3 03 02
E: 3.865302 16 01 07 c4 01 7a 01 40 02 07 7d 02 4b 0a e3 03 02
E: 3.873335 16 01 07 c5 01 78 01 41 02 07 7d 02 4b 0a e3 03 02
E: 3.881783 16 01 07 c7 01 78 01 41 02 07 7e 02 4b 0a e3 03 02
E: 3.889375 16 01 07 c5 01 78 01 41 02 07 7e 02 4b 0a e3 03 02
E: 3.897384 16 01 07 c5 01 78 01 41 02 07 7e 02 4b 0a e3 03 02
E: 3.905563 16 01 07 c6 01 78 01 41 02 07 7e 02 4b 0a e3 03 02
E: 3.913543 16 01 07 c6 01 78 01 41 02 07 80 02 4b 0a e4 03 02
E: 3.921507 16 01 07 c7 01 78 01 41 02 07 7f 02 4b 0a e4 03 02
E: 3.929352 16 01 07 c7 01 78 01 41 02 07 7f 02 4b 0a e4 03 02
E: 3.937537 16 01 07 c6 01 78 01 41 02 07 7f 02 4b 0a e4 03 02
E: 3.945427 16 01 07 c7 01 78 01 41 02 07 7f 02 4b 0a e4 03 02
E: 3.953409 16 01 07 c7 01 78 01 41 02 07 7f 02 4b 0a e4 03 02
E: 3.961356 16 01 07 c7 01 78 01 41 02 07 7f 02 4b 0a e4 03 02
E: 3.969380 16 01 07 c7 01 76 01 41 02 07 7f 02 4b 0a e4 03 02
E: 3.977763 16 01 07 c8 01 76 01 41 02 07 7f 02 4c 0a e5 03 02
E: 3.985450 16 01 07 ca 01 76 01 41 02 07 7f 02 4d 0a e6 03 02
E: 3.993431 16 01 07 ca 01 76 01 41 02 07 7e 02 4d 0a e7 03 02
E: 4.001628 16 01 07 cb 01 76 01 41 02 07 7d 02 4e 0a e8 03 02
E: 4.009646 16 01 07 cb 01 76 01 41 02 07 7c 02 4f 0a e8 03 02
E: 4.017581 16 01 07 cb 01 76 01 41 02 07 79 02 50 0a e9 03 02
E: 4.025608 16 01 07 cb 01 76 01 41 02 07 78 02 51 0a e9 03 02
E: 4.033791 16 01 07 cb 01 74 01 42 02 07 73 02 51 0a ea 03 02
E: 4.041403 16 01 07 cb 01 74 01 42 02 07 6e 02 52 0a eb 03 02
E: 4.049379 16 01 07 cb 01 74 01 42 02 07 6a 02 52 0a ed 03 02
E: 4.057391 16 01 07 ca 01 74 01 42 02 07 65 02 53 0a ee 03 02
E: 4.065574 16 01 07 ca 01 74 01 42 02 07 62 02 54 0a ee 03 02
E: 4.073440 16 01 07 c9 01 74 01 42 02 07 5f 02 54 0a ef 03 02
E: 4.081601 16 01 07 c5 01 74 01 42 02 07 5c 02 54 0a f0 03 02
E: 4.089568 16 01 07 c4 01 72 01 42 02 07 56 02 53 0a f1 03 02
E: 4.097599 16 01 07 c2 01 72 01 42 02 07 51 02 51 0a f3 03 02
E: 4.105589 16 01 07 c1 01 72 01 42 02 07 4b 02 4f 0a f7 03 02
E: 4.113598 16 01 07 c3 01 72 01 42 02 07 45 02 4d 0a fa 03 02
E: 4.121454 16 01 07 c3 01 72 01 42 02 07 40 02 4b 0a fe 03 02
E: 4.129455 16 01 07 c3 01 72 01 42 02 07 3b 02 49 0a 02 04 02
E: 4.137716 16 01 07 c0 01 72 01 42 02 07 38 02 47 0a 05 04 02
E: 4.145710 16 01 07 bd 01 72 01 42 02 07 35 02 45 0a 09 04 02
E: 4.153686 16 01 07 b8 01 71 01 44 02 07 30 02 42 0a 0d 04 02
E: 4.161709 16 01 07 b3 01 71 01 44 02 07 2b 02 40 0a 12 04 02
E: 4.169695 16 01 07 a6 01 72 01 47 02 07 24 02 3d 0a 19 04 02
E: 4.177482 16 01 07 9e 01 73 01 4a 02 07 20 02 3b 0a 20 04 02
E: 4.185660 16 01 07 95 01 74 01 4e 02 07 1c 02 3a 0a 27 04 02
E: 4.193676 16 01 07 8d 01 75 01 51 02 07 1c 02 39 0a 2d 04 02
E: 4.201675 16 01 07 85 01 75 01 55 02 07 1a 02 39 0a 34 04 02
E: 4.209650 16 01 07 7e 01 77 01 5a 02 07 17 02 39 0a 3a 04 02
E: 4.217663 16 01 07 72 01 78 01 63 02 07 15 02 3a 0a 45 04 02
E: 4.225478 16 01 07 67 01 79 01 6c 02 07 15 02 3a 0a 52 04 02
E: 4.233592 16 01 07 60 01 79 01 72 02 07 14 02 38 0a 5a 04 02
E: 4.241596 16 01 07 5b 01 79 01 7b 02 07 12 02 35 0a 6b 04 02
E: 4.249483 16 01 07 5a 01 78 01 82 02 07 10 02 33 0a 78 04 02
E: 4.257496 16 01 07 5b 01 78 01 88 02 07 0d 02 32 0a 84 04 02
E: 4.265512 16 01 07 5c 01 77 01 90 02 07 0a 02 30 0a 90 04 02
E: 4.273703 16 01 07 5d 01 77 01 96 02 07 0a 02 2e 0a 9c 04 02
E: 4.281708 16 01 07 5d 01 76 01 a2 02 07 0a 02 2c 0a ae 04 02
E: 4.289692 16 01 07 5d 01 74 01 aa 02 07 0a 02 2c 0a bf 04 02
E: 4.297693 16 01 07 5c 01 73 01 b3 02 07 09 02 2d 0a cf 04 02
E: 4.305499 16 01 07 5e 01 72 01 b9 02 07 08 02 2d 0a da 04 02
E: 4.313521 16 01 07 61 01 71 01 c2 02 07 05 02 2e 0a eb 04 02
E: 4.321525 16 01 07 6a 01 70 01 cb 02 07 07 02 33 0a f7 04 02
E: 4.329532 16 01 07 71 01 6f 01 d0 02 07 0a 02 36 0a 00 05 02
E: 4.337730 16 01 07 7d 01 6e 01 d6 02 07 0a 02 3c 0a 0d 05 02
E: 4.345703 16 01 07 89 01 6c 01 da 02 07 0b 02 42 0a 19 05 02
E: 4.353722 16 01 07 91 01 6b 01 dc 02 07 0b 02 46 0a 21 05 02
E: 4.361544 16 01 07 9c 01 69 01 e1 02 07 0e 02 49 0a 2e 05 02
E: 4.369560 16 01 07 a8 01 67 01 e4 02 07 10 02 4c 0a 3c 05 02
E: 4.377552 16 01 07 b0 01 66 01 e6 02 07 10 02 4e 0a 46 05 02
E: 4.385547 16 01 07 ba 01 65 01 e9 02 07 10 02 52 0a 55 05 02
E: 4.393551 16 01 07 c1 01 63 01 eb 02 07 10 02 56 0a 63 05 02
E: 4.401559 16 01 07 c3 01 62 01 ee 02 07 10 02 59 0a 6c 05 02
E: 4.409562 16 01 07 c5 01 61 01 f1 02 07 10 02 5d 0a 78 05 02
E: 4.417580 16 01 07 c5 01 61 01 f4 02 07 12 02 61 0a 84 05 02
E: 4.425771 16 01 07 c5 01 60 01 f8 02 07 16 02 64 0a 92 05 02
E: 4.433765 16 01 07 c4 01 5f 01 fb 02 07 19 02 67 0a 9b 05 02
E: 4.441840 16 01 07 c4 01 5d 01 fe 02 07 1c 02 6b 0a a7 05 02
E: 4.449787 16 01 07 c3 01 5c 01 02 03 07 1c 02 71 0a b1 05 02
E: 4.457783 16 01 07 c1 01 5a 01 05 03 07 1c 02 74 0a b7 05 02
E: 4.465762 16 01 07 be 01 57 01 09 03 07 1c 02 78 0a c3 05 02
E: 4.473762 16 01 07 bd 01 55 01 0a 03 07 1a 02 7a 0a cc 05 02
E: 4.481770 16 01 07 bb 01 54 01 0b 03 07 18 02 7a 0a d0 05 02
E: 4.489764 16 01 07 ba 01 52 01 11 03 07 17 02 7d 0a d9 05 02
E: 4.497601 16 01 07 b8 01 50 01 14 03 07 17 02 7d 0a de 05 02
E: 4.505616 16 01 07 b7 01 4e 01 1a 03 07 17 02 7f 0a e8 05 02
E: 4.513628 16 01 07 b8 01 4d 01 1d 03 07 16 02 81 0a ec 05 02
E: 4.521604 16 01 07 b5 01 4b 01 22 03 07 14 02 84 0a f6 05 02
E: 4.529631 16 01 07 b2 01 48 01 28 03 07 11 02 89 0a 00 06 02
E: 4.537621 16 01 07 ae 01 46 01 2e 03 07 0e 02 8e 0a 0b 06 02
E: 4.545852 16 01 07 aa 01 43 01 36 03 07 0c 02 94 0a 15 06 02
E: 4.553848 16 01 07 a5 01 41 01 3e 03 07 0c 02 9a 0a 1f 06 02
E: 4.561689 16 01 07 9c 01 3d 01 4c 03 07 0d 02 a4 0a 2f 06 02
E: 4.569695 16 01 07 94 01 3a 01 56 03 07 0d 02 ac 0a 3b 06 02
E: 4.577705 16 01 07 8c 01 37 01 61 03 07 0d 02 b6 0a 45 06 02
E: 4.585705 16 01 07 84 01 34 01 6a 03 07 0d 02 c0 0a 4e 06 02
E: 4.593714 16 01 07 7c 01 30 01 72 03 07 0d 02 ca 0a 5a 06 02
E: 4.601635 16 01 07 77 01 2e 01 77 03 07 0d 02 d0 0a 5f 06 02
E: 4.609653 16 01 07 6f 01 28 01 82 03 07 0c 02 dc 0a 6b 06 02
E: 4.617661 16 01 07 68 01 22 01 8c 03 07 09 02 e9 0a 75 06 02
E: 4.625974 16 01 07 61 01 1c 01 95 03 07 07 02 f6 0a 7f 06 02
E: 4.633876 16 01 07 5b 01 16 01 a1 03 07 04 02 02 0b 8a 06 02
E: 4.641845 16 01 07 53 01 0f 01 ab 03 07 01 02 0d 0b 97 06 02
E: 4.649677 16 01 07 4c 01 07 01 b3 03 07 01 02 18 0b a5 06 02
E: 4.657788 16 01 07 4b 01 03 01 b8 03 07 01 02 1d 0b ac 06 02
E: 4.665704 16 01 07 47 01 fa 00 c1 03 07 01 02 27 0b b9 06 02
E: 4.673699 16 01 07 46 01 f1 00 cb 03 07 01 02 32 0b c5 06 02
E: 4.681685 16 01 07 44 01 e9 00 d6 03 07 01 02 3c 0b d3 06 02
E: 4.689680 16 01 07 43 01 e0 00 e0 03 07 01 02 46 0b e3 06 02
E: 4.697693 16 01 07 3d 01 d7 00 ec 03 07 01 02 4f 0b f0 06 02
E: 4.705696 16 01 07 3c 01 d0 00 f7 03 07 01 02 57 0b fd 06 02
E: 4.713736 16 01 07 37 01 c8 00 04 04 07 01 02 5c 0b 0c 07 02
E: 4.721704 16 01 07 34 01 c4 00 0b 04 07 01 02 61 0b 14 07 02
E: 4.729926 16 01 07 32 01 bd 00 1a 04 07 01 02 69 0b 22 07 02
E: 4.737721 16 01 07 33 01 b0 00 31 04 07 01 02 74 0b 38 07 02
E: 4.745731 16 01 07 2f 01 aa 00 43 04 07 01 02 7d 0b 46 07 02
E: 4.753916 16 01 07 2b 01 a4 00 56 04 07 01 02 86 0b 53 07 02
E: 4.761729 16 01 07 2f 01 9d 00 70 04 07 01 02 93 0b 68 07 02
E: 4.769747 16 01 07 33 01 96 00 8b 04 07 01 02 9f 0b 7c 07 02
E: 4.777724 16 01 07 36 01 92 00 9e 04 07 01 02 a8 0b 87 07 02
E: 4.785738 16 01 07 3a 01 8d 00 ba 04 07 05 02 b5 0b 9a 07 02
E: 4.793737 16 01 07 41 01 89 00 d6 04 07 06 02 c2 0b ac 07 02
E: 4.801741 16 01 07 46 01 88 00 e8 04 07 06 02 c8 0b b8 07 02
E: 4.809750 16 01 07 4c 01 86 00 04 05 07 06 02 d0 0b c8 07 02
E: 4.817764 16 01 07 4e 01 87 00 20 05 07 06 02 d7 0b d6 07 02
E: 4.825768 16 01 07 4f 01 88 00 3b 05 07 06 02 dd 0b e5 07 02
E: 4.833969 16 01 07 4e 01 89 00 4f 05 07 06 02 e0 0b ee 07 02
E: 4.841768 16 01 07 4a 01 8b 00 67 05 07 07 02 e3 0b f7 07 02
E: 4.849977 16 01 07 46 01 8f 00 7e 05 07 0b 02 e6 0b 02 08 02
E: 4.857972 16 01 07 40 01 93 00 95 05 07 0f 02 e8 0b 0c 08 02
E: 4.865792 16 01 07 3d 01 97 00 ac 05 07 0f 02 e6 0b 15 08 02
E: 4.873804 16 01 07 3a 01 9b 00 c4 05 07 0f 02 e4 0b 1e 08 02
E: 4.882093 16 01 07 38 01 9d 00 d0 05 07 0f 02 e2 0b 22 08 02
E: 4.889986 16 01 07 3b 01 a3 00 eb 05 07 0f 02 e1 0b 2b 08 02
E: 4.897996 16 01 07 3d 01 ab 00 05 06 07 0f 02 dd 0b 37 08 02
E: 4.906020 16 01 07 3f 01 b2 00 20 06 07 0f 02 d9 0b 42 08 02
E: 4.914078 16 01 07 41 01 bf 00 49 06 07 0f 02 cc 0b 54 08 02
E: 4.921996 16 01 07 43 01 c8 00 66 06 07 0f 02 c4 0b 60 08 02
E: 4.929994 16 01 07 40 01 d1 00 82 06 07 10 02 bb 0b 6c 08 02
E: 4.937985 16 01 07 3f 01 e0 00 a8 06 07 12 02 ab 0b 7e 08 02
E: 4.945991 16 01 07 3c 01 ef 00 cd 06 07 18 02 98 0b 90 08 02
E: 4.953996 16 01 07 3f 01 fa 00 e7 06 07 1b 02 8d 0b 9c 08 02
E: 4.961991 16 01 07 3f 01 0c 01 0f 07 07 1a 02 78 0b af 08 02
E: 4.970899 16 01 07 3e 01 17 01 27 07 07 1b 02 67 0b bc 08 02
E: 4.977840 16 01 07 3c 01 23 01 3f 07 07 20 02 57 0b c8 08 02
E: 4.986040 16 01 07 38 01 30 01 58 07 07 25 02 46 0b d5 08 02
E: 4.994009 16 01 07 37 01 44 01 7d 07 07 2d 02 2e 0b e8 08 02
E: 5.001837 16 01 07 3a 01 52 01 95 07 07 33 02 1a 0b f5 08 02
E: 5.009849 16 01 07 39 01 69 01 b9 07 07 3d 02 fd 0a 08 09 02
E: 5.018099 16 01 07 38 01 79 01 d1 07 07 44 02 e8 0a 16 09 02
E: 5.025853 16 01 07 38 01 93 01 f7 07 07 49 02 ca 0a 29 09 02
E: 5.033851 16 01 07 38 01 ac 01 19 08 07 4e 02 ac 0a 3d 09 02
E: 5.041853 16 01 07 38 01 bd 01 2f 08 07 53 02 98 0a 4a 09 02
E: 5.049861 16 01 07 3a 01 cf 01 45 08 07 56 02 85 0a 56 09 02
E: 5.057860 16 01 07 3b 01 e7 01 65 08 07 5c 02 68 0a 66 09 02
E: 5.065864 16 01 07 38 01 f8 01 78 08 07 62 02 56 0a 70 09 02
E: 5.073851 16 01 07 35 01 08 02 8a 08 07 67 02 43 0a 79 09 02
E: 5.081881 16 01 07 33 01 18 02 9b 08 07 6b 02 30 0a 80 09 02
E: 5.089879 16 01 07 31 01 28 02 aa 08 07 71 02 1e 0a 86 09 02
E: 5.098003 16 01 07 35 01 3f 02 be 08 07 78 02 02 0a 8a 09 02
E: 5.106003 16 01 07 36 01 4e 02 c9 08 07 7b 02 ef 09 8b 09 02
E: 5.113994 16 01 07 35 01 65 02 dc 08 07 7d 02 d3 09 89 09 02
E: 5.121905 16 01 07 2f 01 7b 02 ec 08 07 80 02 b7 09 84 09 02
E: 5.130044 16 01 07 2a 01 91 02 f7 08 07 84 02 9c 09 7b 09 02
E: 5.138110 16 01 07 26 01 a7 02 00 09 07 83 02 82 09 70 09 02
E: 5.146095 16 01 07 27 01 b6 02 05 09 07 7f 02 70 09 68 09 02
E: 5.154084 16 01 07 27 01 c4 02 09 09 07 7a 02 5f 09 5f 09 02
E: 5.162092 16 01 07 25 01 cb 02 0b 09 07 77 02 56 09 5a 09 02
E: 5.170082 16 01 07 20 01 db 02 0f 09 07 72 02 45 09 50 09 02
E: 5.178091 16 01 07 20 01 ea 02 11 09 07 6f 02 34 09 43 09 02
E: 5.186100 16 01 07 20 01 01 03 14 09 07 6c 02 1e 09 2e 09 02
E: 5.195364 16 01 07 20 01 10 03 15 09 07 6b 02 0f 09 20 09 02
E: 5.202149 16 01 07 20 01 1e 03 16 09 07 6c 02 01 09 11 09 02
E: 5.210126 16 01 07 20 01 34 03 16 09 07 6b 02 ed 08 f8 08 02
E: 5.218115 16 01 07 1e 01 43 03 17 09 07 6c 02 df 08 e6 08 02
E: 5.225944 16 01 07 19 01 50 03 17 09 07 6c 02 d2 08 d3 08 02
E: 5.233955 16 01 07 16 01 57 03 15 09 07 6c 02 cb 08 c8 08 02
E: 5.241940 16 01 07 15 01 5d 03 14 09 07 69 02 c5 08 bd 08 02
E: 5.250188 16 01 07 13 01 64 03 12 09 07 66 02 bf 08 b2 08 02
E: 5.258152 16 01 07 12 01 6b 03 10 09 07 65 02 b9 08 a6 08 02
E: 5.266343 16 01 07 0f 01 79 03 0b 09 07 63 02 ad 08 8c 08 02
E: 5.274208 16 01 07 0d 01 83 03 03 09 07 63 02 a2 08 71 08 02
E: 5.282210 16 01 07 0d 01 8e 03 fc 08 07 62 02 98 08 57 08 02
E: 5.290212 16 01 07 0a 01 9d 03 ef 08 07 62 02 8a 08 2f 08 02
E: 5.297972 16 01 07 07 01 a5 03 e3 08 07 64 02 81 08 12 08 02
E: 5.305974 16 01 07 06 01 af 03 ce 08 07 65 02 75 08 e5 07 02
E: 5.313966 16 01 07 06 01 b5 03 be 08 07 66 02 6f 08 c8 07 02
E: 5.321983 16 01 07 04 01 b9 03 ad 08 07 65 02 69 08 ab 07 02
E: 5.329975 16 01 07 03 01 be 03 9a 08 07 62 02 64 08 8f 07 02
E: 5.337997 16 01 07 03 01 bf 03 91 08 07 5f 02 62 08 81 07 02
E: 5.345994 16 01 07 03 01 c1 03 87 08 07 5d 02 60 08 72 07 02
E: 5.354245 16 01 07 03 01 c2 03 71 08 07 5b 02 5f 08 52 07 02
E: 5.362019 16 01 07 03 01 c2 03 5a 08 07 5b 02 5e 08 33 07 02
E: 5.370135 16 01 07 03 01 bf 03 36 08 07 5b 02 5f 08 06 07 02
E: 5.378030 16 01 07 03 01 bb 03 1e 08 07 59 02 60 08 ea 06 02
E: 5.386152 16 01 07 03 01 b7 03 06 08 07 54 02 62 08 cf 06 02
E: 5.394071 16 01 07 03 01 b1 03 e2 07 07 4c 02 67 08 a6 06 02
E: 5.402038 16 01 07 03 01 aa 03 c9 07 07 46 02 6c 08 8c 06 02
E: 5.410048 16 01 07 03 01 a4 03 ad 07 07 3f 02 71 08 72 06 02
E: 5.418036 16 01 07 03 01 9d 03 92 07 07 3b 02 77 08 59 06 02
E: 5.426019 16 01 07 03 01 93 03 78 07 07 35 02 7f 08 3f 06 02
E: 5.434040 16 01 07 03 01 84 03 4f 07 07 31 02 8b 08 1c 06 02
E: 5.442031 16 01 07 03 01 7f 03 42 07 07 31 02 8f 08 12 06 02
E: 5.450044 16 01 07 03 01 74 03 28 07 07 30 02 97 08 ff 05 02
E: 5.458050 16 01 07 03 01 68 03 10 07 07 2d 02 a0 08 ef 05 02
E: 5.466041 16 01 07 03 01 5b 03 f9 06 07 28 02 a9 08 dd 05 02
E: 5.474044 16 01 07 03 01 4c 03 df 06 07 23 02 b4 08 ca 05 02
E: 5.482068 16 01 07 02 01 3d 03 c8 06 07 1e 02 c0 08 b7 05 02
E: 5.490073 16 01 07 01 01 2e 03 b1 06 07 18 02 cc 08 a4 05 02
E: 5.498086 16 01 07 00 01 15 03 8d 06 07 0f 02 de 08 88 05 02
E: 5.506064 16 01 07 00 01 03 03 76 06 07 09 02 ec 08 77 05 02
E: 5.514080 16 01 07 00 01 f2 02 60 06 07 03 02 fa 08 66 05 02
E: 5.522347 16 01 07 01 01 e9 02 55 06 07 01 02 01 09 5f 05 02
E: 5.530337 16 01 07 04 01 d7 02 43 06 07 00 02 11 09 52 05 02
E: 5.538190 16 01 07 05 01 c5 02 33 06 07 00 02 22 09 45 05 02
E: 5.546119 16 01 07 06 01 b3 02 27 06 07 02 02 33 09 39 05 02
E: 5.554107 16 01 07 09 01 98 02 15 06 07 02 02 50 09 24 05 02
E: 5.562092 16 01 07 09 01 87 02 09 06 07 02 02 62 09 1c 05 02
E: 5.570094 16 01 07 09 01 76 02 02 06 07 02 02 74 09 17 05 02
E: 5.578102 16 01 07 09 01 71 02 ff 05 07 02 02 7c 09 18 05 02
E: 5.588662 16 01 07 09 01 68 02 f9 05 07 02 02 8e 09 1a 05 02
E: 5.594092 16 01 07 09 01 5e 02 f8 05 07 02 02 aa 09 1c 05 02
E: 5.602116 16 01 07 09 01 5b 02 f8 05 07 02 02 b3 09 1e 05 02
E: 5.610109 16 01 07 09 01 57 02 f9 05 07 02 02 c6 09 1f 05 02
E: 5.618123 16 01 07 09 01 53 02 fb 05 07 02 02 e1 09 23 05 02
E: 5.626152 16 01 07 09 01 52 02 fd 05 07 02 02 f3 09 26 05 02
E: 5.634142 16 01 07 02 02 fb 09 29 05 04 09 01 52 02 fd 05 02
E: 5.642325 16 01 07 02 02 15 0a 32 05 00 00 00 00 00 00 00 01
E: 5.650284 16 01 07 02 02 2f 0a 3d 05 00 00 00 00 00 00 00 01
E: 5.658336 16 01 07 02 02 41 0a 44 05 00 00 00 00 00 00 00 01
E: 5.666314 16 01 07 05 02 5a 0a 4b 05 00 00 00 00 00 00 00 01
E: 5.674163 16 01 07 06 02 6b 0a 50 05 00 00 00 00 00 00 00 01
E: 5.682185 16 01 07 09 02 7c 0a 58 05 00 00 00 00 00 00 00 01
E: 5.690551 16 01 07 09 02 84 0a 5c 05 07 06 01 34 01 06 07 02
E: 5.698374 16 01 07 09 02 9c 0a 6b 05 07 08 01 31 01 2b 07 02
E: 5.706380 16 01 07 09 02 aa 0a 77 05 07 08 01 2e 01 45 07 02
E: 5.714362 16 01 07 0a 02 c0 0a 85 05 07 09 01 2c 01 73 07 02
E: 5.722382 16 01 07 09 02 d1 0a 97 05 07 10 01 2a 01 99 07 02
E: 5.730348 16 01 07 09 02 db 0a a5 05 07 14 01 28 01 b3 07 02
E: 5.738352 16 01 07 09 02 e5 0a b4 05 07 14 01 28 01 d0 07 02
E: 5.746350 16 01 07 09 02 e9 0a bb 05 07 15 01 27 01 dd 07 02
E: 5.754351 16 01 07 09 02 f9 0a d0 05 07 17 01 2a 01 05 08 02
E: 5.762351 16 01 07 09 02 01 0b de 05 07 1e 01 2a 01 1d 08 02
E: 5.770356 16 01 07 0c 02 0c 0b f2 05 07 29 01 2f 01 44 08 02
E: 5.778362 16 01 07 12 02 16 0b 06 06 07 31 01 34 01 65 08 02
E: 5.786367 16 01 07 16 02 1d 0b 11 06 07 35 01 3a 01 7d 08 02
E: 5.794432 16 01 07 1e 02 26 0b 25 06 07 3f 01 42 01 a0 08 02
E: 5.802275 16 01 07 22 02 2b 0b 32 06 07 41 01 4a 01 be 08 02
E: 5.810228 16 01 07 24 02 2f 0b 35 06 07 41 01 4e 01 ce 08 02
E: 5.818213 16 01 07 29 02 33 0b 40 06 07 41 01 57 01 ef 08 02
E: 5.826217 16 01 07 2e 02 37 0b 4a 06 07 41 01 62 01 0d 09 02
E: 5.834235 16 01 07 36 02 3c 0b 57 06 07 45 01 73 01 3d 09 02
E: 5.842240 16 01 07 3b 02 3d 0b 60 06 07 48 01 82 01 5a 09 02
E: 5.850651 16 01 07 41 02 3f 0b 6d 06 07 50 01 99 01 87 09 02
E: 5.858330 16 01 07 48 02 40 0b 79 06 07 58 01 b2 01 b6 09 02
E: 5.866453 16 01 07 50 02 40 0b 81 06 07 5c 01 c2 01 d4 09 02
E: 5.874474 16 01 07 5b 02 3f 0b 8c 06 07 64 01 dc 01 01 0a 02
E: 5.882583 16 01 07 5e 02 3f 0b 90 06 07 67 01 e5 01 0f 0a 02
E: 5.890480 16 01 07 62 02 3e 0b 97 06 07 66 01 f8 01 2c 0a 02
E: 5.898436 16 01 07 65 02 3e 0b 9b 06 07 64 01 02 02 39 0a 02
E: 5.906452 16 01 07 6b 02 3c 0b a2 06 07 61 01 15 02 53 0a 02
E: 5.914448 16 01 07 71 02 39 0b a8 06 07 5e 01 29 02 6c 0a 02
E: 5.922307 16 01 07 77 02 36 0b af 06 07 60 01 3c 02 83 0a 02
E: 5.930320 16 01 07 7d 02 33 0b b6 06 07 61 01 50 02 99 0a 02
E: 5.938337 16 01 07 84 02 2f 0b bd 06 07 5f 01 63 02 ae 0a 02
E: 5.946304 16 01 07 8f 02 27 0b c8 06 07 54 01 82 02 ca 0a 02
E: 5.954534 16 01 07 91 02 24 0b cb 06 07 51 01 8d 02 d2 0a 02
E: 5.962325 16 01 07 91 02 1d 0b d1 06 07 49 01 a2 02 e0 0a 02
E: 5.970448 16 01 07 8e 02 16 0b d6 06 07 47 01 b8 02 ed 0a 02
E: 5.978328 16 01 07 8c 02 13 0b d9 06 07 47 01 c3 02 f2 0a 02
E: 5.986351 16 01 07 8a 02 0f 0b db 06 07 45 01 ce 02 f6 0a 02
E: 5.994318 16 01 07 86 02 06 0b e0 06 07 45 01 e5 02 fc 0a 02
E: 6.002330 16 01 07 81 02 fc 0a e4 06 07 46 01 fb 02 ff 0a 02
E: 6.010710 16 01 07 7b 02 ee 0a e9 06 07 52 01 1b 03 00 0b 02
E: 6.018380 16 01 07 74 02 e0 0a ed 06 07 58 01 3a 03 fd 0a 02
E: 6.026699 16 01 07 6e 02 d6 0a ef 06 07 59 01 4e 03 f6 0a 02
E: 6.034736 16 01 07 69 02 cc 0a f1 06 07 58 01 62 03 eb 0a 02
E: 6.042596 16 01 07 63 02 c2 0a f2 06 07 54 01 75 03 de 0a 02
E: 6.050541 16 01 07 5a 02 b4 0a f3 06 07 4d 01 90 03 c6 0a 02
E: 6.058650 16 01 07 4f 02 a5 0a f3 06 07 4d 01 ab 03 a9 0a 02
E: 6.067564 16 01 07 4a 02 9c 0a f4 06 07 4d 01 bc 03 94 0a 02
E: 6.074338 16 01 07 43 02 90 0a f5 06 07 47 01 d4 03 70 0a 02
E: 6.082825 16 01 07 41 02 88 0a f5 06 07 47 01 e1 03 54 0a 02
E: 6.090713 16 01 07 3e 02 80 0a f4 06 07 46 01 ee 03 34 0a 02
E: 6.098716 16 01 07 38 02 75 0a f4 06 07 45 01 01 04 01 0a 02
E: 6.106685 16 01 07 30 02 6c 0a f4 06 07 41 01 11 04 ca 09 02
E: 6.114788 16 01 07 2b 02 66 0a f4 06 07 41 01 1a 04 a1 09 02
E: 6.122391 16 01 07 28 02 63 0a f4 06 07 41 01 1e 04 8c 09 02
E: 6.130650 16 01 07 23 02 5b 0a f5 06 07 41 01 27 04 48 09 02
E: 6.138655 16 01 07 24 02 53 0a f5 06 07 40 01 2e 04 04 09 02
E: 6.146607 16 01 07 2a 02 4b 0a f4 06 07 3d 01 30 04 bc 08 02
E: 6.154711 16 01 07 2d 02 47 0a f3 06 07 3a 01 31 04 89 08 02
E: 6.162640 16 01 07 34 02 41 0a f3 06 07 31 01 30 04 3c 08 02
E: 6.171341 16 01 07 3c 02 3c 0a f2 06 07 24 01 2a 04 f0 07 02
E: 6.178449 16 01 07 45 02 36 0a f0 06 07 1b 01 21 04 aa 07 02
E: 6.186497 16 01 07 4f 02 31 0a ee 06 07 14 01 1c 04 6c 07 02
E: 6.194770 16 01 07 59 02 2d 0a ec 06 07 13 01 11 04 2d 07 02
E: 6.202919 16 01 07 63 02 29 0a e9 06 07 11 01 04 04 f3 06 02
E: 6.210724 16 01 07 6f 02 25 0a e6 06 07 05 01 f4 03 ac 06 02
E: 6.218456 16 01 07 74 02 22 0a e4 06 07 01 01 e8 03 82 06 02
E: 6.226471 16 01 07 7b 02 20 0a e3 06 07 00 01 da 03 53 06 02
E: 6.234555 16 01 07 83 02 1e 0a e2 06 07 00 01 d1 03 2b 06 02
E: 6.242461 16 01 07 88 02 1d 0a e1 06 04 00 01 d1 03 2b 06 02
E: 6.250422 16 01 07 96 02 1a 0a de 06 00 00 00 00 00 00 00 01
E: 6.258450 16 01 07 a0 02 17 0a db 06 00 00 00 00 00 00 00 01
E: 6.266452 16 01 07 a6 02 13 0a d7 06 00 00 00 00 00 00 00 01
E: 6.274475 16 01 07 ae 02 0f 0a d1 06 00 00 00 00 00 00 00 01
E: 6.282587 16 01 07 b5 02 0b 0a cb 06 00 00 00 00 00 00 00 01
E: 6.321068 16 01 07 b5 02 07 0a c3 06 00 00 00 00 00 00 00 01
E: 6.322181 16 01 07 b2 02 04 0a bd 06 00 00 00 00 00 00 00 01
E: 6.322279 16 01 07 aa 02 02 0a b6 06 00 00 00 00 00 00 00 01
E: 6.322359 16 01 07 a2 02 00 0a ae 06 00 00 00 00 00 00 00 01
E: 6.322448 16 01 07 9b 02 ff 09 a3 06 00 00 00 00 00 00 00 01
E: 6.333882 16 01 07 97 02 fe 09 9c 06 00 00 00 00 00 00 00 01
E: 6.338556 16 01 07 93 02 fd 09 90 06 00 00 00 00 00 00 00 01
E: 6.346491 16 01 07 8f 02 fb 09 83 06 00 00 00 00 00 00 00 01
E: 6.354868 16 01 07 8d 02 f9 09 76 06 00 00 00 00 00 00 00 01
E: 6.362865 16 01 07 8c 02 f9 09 69 06 00 00 00 00 00 00 00 01
E: 6.370855 16 01 07 88 02 f9 09 60 06 00 00 00 00 00 00 00 01
E: 6.378533 16 01 07 82 02 f8 09 53 06 00 00 00 00 00 00 00 01
E: 6.386508 16 01 07 7c 02 f8 09 48 06 00 00 00 00 00 00 00 01
E: 6.394522 16 01 07 77 02 f9 09 3d 06 00 00 00 00 00 00 00 01
E: 6.402791 16 01 07 73 02 f9 09 32 06 00 00 00 00 00 00 00 01
E: 6.410592 16 01 07 70 02 fb 09 26 06 00 00 00 00 00 00 00 01
E: 6.418550 16 01 07 6c 02 00 0a 15 06 00 00 00 00 00 00 00 01
E: 6.426904 16 01 07 6c 02 06 0a 04 06 00 00 00 00 00 00 00 01
E: 6.434538 16 01 07 72 02 0d 0a f3 05 00 00 00 00 00 00 00 01
E: 6.442721 16 01 07 7c 02 14 0a e3 05 00 00 00 00 00 00 00 01
E: 6.450775 16 01 07 84 02 1c 0a d3 05 00 00 00 00 00 00 00 01
E: 6.458775 16 01 07 8c 02 24 0a c7 05 00 00 00 00 00 00 00 01
E: 6.466793 16 01 07 92 02 2a 0a bd 05 00 00 00 00 00 00 00 01
E: 6.474925 16 01 07 97 02 31 0a b3 05 00 00 00 00 00 00 00 01
E: 6.483392 16 01 07 99 02 38 0a a9 05 00 00 00 00 00 00 00 01
E: 6.490599 16 01 07 9d 02 40 0a a0 05 00 00 00 00 00 00 00 01
E: 6.499071 16 01 07 9f 02 47 0a 97 05 00 00 00 00 00 00 00 01
E: 6.506895 16 01 07 9f 02 4e 0a 8e 05 00 00 00 00 00 00 00 01
E: 6.515158 16 01 07 9e 02 56 0a 84 05 00 00 00 00 00 00 00 01
E: 6.522848 16 01 07 9e 02 5e 0a 7a 05 00 00 00 00 00 00 00 01
E: 6.530603 16 01 07 9f 02 64 0a 73 05 00 00 00 00 00 00 00 01
E: 6.538942 16 01 07 9d 02 6c 0a 6a 05 00 00 00 00 00 00 00 01
E: 6.546813 16 01 07 98 02 72 0a 63 05 00 00 00 00 00 00 00 01
E: 6.554624 16 01 07 8b 02 7b 0a 59 05 00 00 00 00 00 00 00 01
E: 6.562572 16 01 07 83 02 7e 0a 54 05 00 00 00 00 00 00 00 01
E: 6.570957 16 01 07 7c 02 82 0a 51 05 00 00 00 00 00 00 00 01
E: 6.579039 16 01 07 75 02 85 0a 4d 05 00 00 00 00 00 00 00 01
E: 6.586882 16 01 07 6f 02 8a 0a 46 05 00 00 00 00 00 00 00 01
E: 6.594958 16 01 07 6a 02 8f 0a 40 05 00 00 00 00 00 00 00 01
E: 6.602633 16 01 07 68 02 98 0a 35 05 00 00 00 00 00 00 00 01
E: 6.610580 16 01 07 68 02 9d 0a 2e 05 00 00 00 00 00 00 00 01
E: 6.618601 16 01 07 65 02 a6 0a 23 05 00 00 00 00 00 00 00 01
E: 6.626833 16 01 07 64 02 af 0a 18 05 00 00 00 00 00 00 00 01
E: 6.634804 16 01 07 63 02 ba 0a 0a 05 00 00 00 00 00 00 00 01
E: 6.642782 16 01 07 63 02 c9 0a f4 04 00 00 00 00 00 00 00 01
E: 6.650625 16 01 07 66 02 db 0a de 04 00 00 00 00 00 00 00 01
E: 6.658638 16 01 07 69 02 ea 0a ca 04 00 00 00 00 00 00 00 01
E: 6.666588 16 01 07 6d 02 f9 0a b5 04 00 00 00 00 00 00 00 01
E: 6.674804 16 01 07 73 02 06 0b a1 04 00 00 00 00 00 00 00 01
E: 6.682619 16 01 07 80 02 11 0b 90 04 00 00 00 00 00 00 00 01
E: 6.690947 16 01 07 91 02 1b 0b 80 04 00 00 00 00 00 00 00 01
E: 6.698991 16 01 07 a2 02 21 0b 72 04 00 00 00 00 00 00 00 01
E: 6.706939 16 01 07 af 02 26 0b 66 04 00 00 00 00 00 00 00 01
E: 6.714795 16 01 07 b6 02 2a 0b 5d 04 00 00 00 00 00 00 00 01
E: 6.722870 16 01 07 bb 02 2e 0b 51 04 00 00 00 00 00 00 00 01
E: 6.730560 16 01 07 c1 02 32 0b 45 04 00 00 00 00 00 00 00 01
E: 6.738812 16 01 07 c7 02 34 0b 3a 04 00 00 00 00 00 00 00 01
E: 6.746973 16 01 07 cb 02 35 0b 2f 04 00 00 00 00 00 00 00 01
E: 6.754841 16 01 07 cc 02 37 0b 26 04 00 00 00 00 00 00 00 01
E: 6.762780 16 01 07 ca 02 38 0b 1f 04 00 00 00 00 00 00 00 01
E: 6.770592 16 01 07 c8 02 38 0b 18 04 00 00 00 00 00 00 00 01
E: 6.778959 16 01 07 c7 02 38 0b 12 04 00 00 00 00 00 00 00 01
E: 6.786600 16 01 07 c0 02 38 0b 0b 04 00 00 00 00 00 00 00 01
E: 6.794605 16 01 07 bd 02 38 0b 04 04 00 00 00 00 00 00 00 01
E: 6.802605 16 01 07 b8 02 37 0b f9 03 00 00 00 00 00 00 00 01
E: 6.810648 16 01 07 b3 02 35 0b ec 03 00 00 00 00 00 00 00 01
E: 6.818633 16 01 07 af 02 32 0b df 03 00 00 00 00 00 00 00 01
E: 6.826591 16 01 07 ad 02 2d 0b d2 03 00 00 00 00 00 00 00 01
E: 6.835092 16 01 07 ab 02 29 0b c9 03 00 00 00 00 00 00 00 01
E: 6.842600 16 01 07 a6 02 22 0b b5 03 00 00 00 00 00 00 00 01
E: 6.850795 16 01 07 a2 02 19 0b a1 03 00 00 00 00 00 00 00 01
E: 6.858834 16 01 07 9e 02 11 0b 97 03 00 00 00 00 00 00 00 01
E: 6.866820 16 01 07 99 02 09 0b 8a 03 00 00 00 00 00 00 00 01
E: 6.874871 16 01 07 94 02 00 0b 7f 03 00 00 00 00 00 00 00 01
E: 6.882797 16 01 07 8e 02 f8 0a 74 03 00 00 00 00 00 00 00 01
E: 6.890603 16 01 07 8b 02 f0 0a 68 03 00 00 00 00 00 00 00 01
E: 6.898689 16 01 07 8b 02 e8 0a 5c 03 00 00 00 00 00 00 00 01
E: 6.908199 16 01 07 8d 02 dc 0a 53 03 00 00 00 00 00 00 00 01
E: 6.914584 16 01 07 92 02 d1 0a 49 03 00 00 00 00 00 00 00 01
E: 6.922572 16 01 07 9d 02 c3 0a 3a 03 00 00 00 00 00 00 00 01
E: 6.930593 16 01 07 a5 02 b9 0a 31 03 00 00 00 00 00 00 00 01
E: 6.938624 16 01 07 ae 02 ab 0a 24 03 00 00 00 00 00 00 00 01
E: 6.946914 16 01 07 b1 02 9d 0a 18 03 00 00 00 00 00 00 00 01
E: 6.954826 16 01 07 b6 02 8e 0a 0e 03 00 00 00 00 00 00 00 01
E: 6.962631 16 01 07 ba 02 80 0a 03 03 00 00 00 00 00 00 00 01
E: 6.970584 16 01 07 bb 02 6f 0a f9 02 00 00 00 00 00 00 00 01
E: 6.978960 16 01 07 c0 02 5e 0a f0 02 00 00 00 00 00 00 00 01
E: 6.986878 16 01 07 c2 02 4b 0a ea 02 00 00 00 00 00 00 00 01
E: 6.994903 16 01 07 c2 02 3c 0a e5 02 00 00 00 00 00 00 00 01
E: 7.002951 16 01 07 bc 02 2d 0a e1 02 00 00 00 00 00 00 00 01
E: 7.010622 16 01 07 b6 02 1c 0a df 02 00 00 00 00 00 00 00 01
E: 7.018629 16 01 07 ae 02 0b 0a de 02 00 00 00 00 00 00 00 01
E: 7.026587 16 01 07 a4 02 f4 09 dd 02 00 00 00 00 00 00 00 01
E: 7.034795 16 01 07 97 02 de 09 df 02 00 00 00 00 00 00 00 01
E: 7.042603 16 01 07 8b 02 c9 09 e2 02 00 00 00 00 00 00 00 01
E: 7.051001 16 01 07 7d 02 b1 09 e6 02 00 00 00 00 00 00 00 01
E: 7.058640 16 01 07 71 02 9b 09 ea 02 00 00 00 00 00 00 00 01
E: 7.066644 16 01 07 6b 02 8c 09 ed 02 00 00 00 00 00 00 00 01
E: 7.074567 16 01 07 63 02 78 09 f6 02 00 00 00 00 00 00 00 01
E: 7.082589 16 01 07 5d 02 62 09 ff 02 00 00 00 00 00 00 00 01
E: 7.091068 16 01 07 53 02 4d 09 08 03 00 00 00 00 00 00 00 01
E: 7.098804 16 01 07 4b 02 3c 09 15 03 00 00 00 00 00 00 00 01
E: 7.106659 16 01 07 46 02 29 09 25 03 00 00 00 00 00 00 00 01
E: 7.114648 16 01 07 44 02 1b 09 35 03 00 00 00 00 00 00 00 01
E: 7.122796 16 01 07 3d 02 0c 09 4b 03 00 00 00 00 00 00 00 01
E: 7.130832 16 01 07 36 02 fc 08 64 03 00 00 00 00 00 00 00 01
E: 7.138958 16 01 07 32 02 f1 08 78 03 00 00 00 00 00 00 00 01
E: 7.146605 16 01 07 2c 02 e7 08 8e 03 00 00 00 00 00 00 00 01
E: 7.154588 16 01 07 29 02 dd 08 aa 03 00 00 00 00 00 00 00 01
E: 7.162846 16 01 07 26 02 d6 08 c2 03 00 00 00 00 00 00 00 01
E: 7.170880 16 01 07 25 02 d2 08 d6 03 00 00 00 00 00 00 00 01
E: 7.178826 16 01 07 21 02 cd 08 ed 03 00 00 00 00 00 00 00 01
E: 7.186693 16 01 07 1d 02 ca 08 0c 04 00 00 00 00 00 00 00 01
E: 7.195529 16 01 07 1b 02 ca 08 2a 04 00 00 00 00 00 00 00 01
E: 7.202622 16 01 07 16 02 cb 08 48 04 00 00 00 00 00 00 00 01
E: 7.210636 16 01 07 12 02 cc 08 68 04 00 00 00 00 00 00 00 01
E: 7.218637 16 01 07 17 02 cf 08 87 04 00 00 00 00 00 00 00 01
E: 7.226589 16 01 07 20 02 d4 08 a7 04 00 00 00 00 00 00 00 01
E: 7.234849 16 01 07 29 02 db 08 c5 04 00 00 00 00 00 00 00 01
E: 7.242614 16 01 07 34 02 e4 08 e2 04 00 00 00 00 00 00 00 01
E: 7.250887 16 01 07 3f 02 ed 08 00 05 00 00 00 00 00 00 00 01
E: 7.258936 16 01 07 48 02 f9 08 1b 05 00 00 00 00 00 00 00 01
E: 7.266911 16 01 07 50 02 04 09 36 05 00 00 00 00 00 00 00 01
E: 7.274758 16 01 07 52 02 11 09 52 05 00 00 00 00 00 00 00 01
E: 7.282793 16 01 07 54 02 1e 09 6e 05 00 00 00 00 00 00 00 01
E: 7.292277 16 01 07 53 02 2e 09 89 05 00 00 00 00 00 00 00 01
E: 7.298890 16 01 07 50 02 3d 09 a3 05 00 00 00 00 00 00 00 01
E: 7.306938 16 01 07 50 02 4c 09 c0 05 00 00 00 00 00 00 00 01
E: 7.314643 16 01 07 50 02 5a 09 d4 05 00 00 00 00 00 00 00 01
E: 7.322637 16 01 07 4c 02 6f 09 ef 05 00 00 00 00 00 00 00 01
E: 7.330848 16 01 07 4a 02 83 09 09 06 00 00 00 00 00 00 00 01
E: 7.338849 16 01 07 47 02 97 09 24 06 00 00 00 00 00 00 00 01
E: 7.346595 16 01 07 48 02 ad 09 40 06 00 00 00 00 00 00 00 01
E: 7.354980 16 01 07 45 02 c4 09 5b 06 00 00 00 00 00 00 00 01
E: 7.362612 16 01 07 46 02 da 09 75 06 00 00 00 00 00 00 00 01
E: 7.370624 16 01 07 45 02 ef 09 90 06 00 00 00 00 00 00 00 01
E: 7.378579 16 01 07 49 02 04 0a aa 06 00 00 00 00 00 00 00 01
E: 7.386943 16 01 07 4c 02 18 0a c4 06 00 00 00 00 00 00 00 01
E: 7.394912 16 01 07 4d 02 2d 0a dd 06 00 00 00 00 00 00 00 01
E: 7.402888 16 01 07 4d 02 3e 0a f6 06 00 00 00 00 00 00 00 01
E: 7.410941 16 01 07 4d 02 47 0a 02 07 00 00 00 00 00 00 00 01
E: 7.418617 16 01 07 4d 02 53 0a 16 07 00 00 00 00 00 00 00 01
E: 7.426554 16 01 07 4d 02 5f 0a 2b 07 00 00 00 00 00 00 00 01
E: 7.434579 16 01 07 4c 02 70 0a 47 07 00 00 00 00 00 00 00 01
E: 7.442943 16 01 07 4e 02 82 0a 61 07 00 00 00 00 00 00 00 01
E: 7.450593 16 01 07 4d 02 92 0a 7d 07 00 00 00 00 00 00 00 01
E: 7.458742 16 01 07 4c 02 a4 0a 99 07 00 00 00 00 00 00 00 01
E: 7.466823 16 01 07 4d 02 b0 0a ae 07 00 00 00 00 00 00 00 01
E: 7.474913 16 01 07 4b 02 c1 0a ca 07 00 00 00 00 00 00 00 01
E: 7.482828 16 01 07 47 02 cf 0a e8 07 00 00 00 00 00 00 00 01
E: 7.490864 16 01 07 3d 02 da 0a 0a 08 00 00 00 00 00 00 00 01
E: 7.498602 16 01 07 35 02 e6 0a 42 08 00 00 00 00 00 00 00 01
E: 7.506960 16 01 07 34 02 ef 0a 75 08 00 00 00 00 00 00 00 01
E: 7.514805 16 01 07 34 02 f5 0a a3 08 00 00 00 00 00 00 00 01
E: 7.522777 16 01 07 34 02 fa 0a cb 08 00 00 00 00 00 00 00 01
E: 7.530883 16 01 04 34 02 fa 0a cb 08 00 00 00 00 00 00 00 01
