R: 84 05 0d 09 04 a1 01 85 01 09 22 a1 00 09 42 15 00 25 01 75 01 95 01 81 02 09 32 81 02 09 37 81 02 25 1f 75 05 09 51 81 02 05 01 55 0e 65 11 35 00 75 10 46 56 0a 26 ff 0f 09 30 81 02 46 b2 05 26 ff 0f 09 31 81 02 05 0d 75 08 85 02 09 55 25 10 b1 02 c0 c0
N: Atmel Atmel maXTouch Digitizer
I: 3 03eb 211c
# 1. Drag _one_ finger on the screen from one corner to the opposite, and release it.
E: 0.000000 6 01 0f 09 00 ff 0f
E: 0.046856 6 01 0f 0a 00 fe 0f
E: 0.057006 6 01 0f 0c 00 fe 0f
E: 0.065970 6 01 0f 0e 00 fd 0f
E: 0.074972 6 01 0f 11 00 fb 0f
E: 0.084824 6 01 0f 17 00 f7 0f
E: 0.093881 6 01 0f 23 00 ef 0f
E: 0.103836 6 01 0f 3a 00 dc 0f
E: 0.112882 6 01 0f 5b 00 be 0f
E: 0.122822 6 01 0f 86 00 97 0f
E: 0.131882 6 01 0f aa 00 73 0f
E: 0.141884 6 01 0f cc 00 50 0f
E: 0.150877 6 01 0f ef 00 2d 0f
E: 0.160892 6 01 0f 0e 01 0b 0f
E: 0.169806 6 01 0f 32 01 e9 0e
E: 0.178800 6 01 0f 55 01 c5 0e
E: 0.188833 6 01 0f 80 01 9a 0e
E: 0.197880 6 01 0f a8 01 70 0e
E: 0.208111 6 01 0f ca 01 50 0e
E: 0.216891 6 01 0f f5 01 22 0e
E: 0.226851 6 01 0f 21 02 f7 0d
E: 0.235903 6 01 0f 4e 02 ce 0d
E: 0.244889 6 01 0f 7a 02 a8 0d
E: 0.254907 6 01 0f a7 02 80 0d
E: 0.263793 6 01 0f de 02 44 0d
E: 0.273871 6 01 0f 11 03 12 0d
E: 0.282905 6 01 0f 3a 03 ea 0c
E: 0.291909 6 01 0f 75 03 b2 0c
E: 0.301996 6 01 0f ab 03 7c 0c
E: 0.310855 6 01 0f db 03 48 0c
E: 0.320879 6 01 0f 0f 04 11 0c
E: 0.329826 6 01 0f 40 04 d7 0b
E: 0.339863 6 01 0f 78 04 9f 0b
E: 0.348817 6 01 0f ae 04 67 0b
E: 0.358867 6 01 0f e5 04 31 0b
E: 0.367940 6 01 0f 19 05 f7 0a
E: 0.377911 6 01 0f 4e 05 bd 0a
E: 0.386979 6 01 0f 81 05 86 0a
E: 0.395903 6 01 0f b7 05 4f 0a
E: 0.405920 6 01 0f ec 05 1a 0a
E: 0.414879 6 01 0f 20 06 e6 09
E: 0.424941 6 01 0f 57 06 af 09
E: 0.433921 6 01 0f 8c 06 73 09
E: 0.442861 6 01 0f c4 06 3f 09
E: 0.452880 6 01 0f fb 06 05 09
E: 0.461941 6 01 0f 3e 07 c0 08
E: 0.471829 6 01 0f 6c 07 94 08
E: 0.480931 6 01 0f 93 07 69 08
E: 0.490953 6 01 0f d2 07 31 08
E: 0.499890 6 01 0f 07 08 fb 07
E: 0.508971 6 01 0f 3b 08 c7 07
E: 0.518844 6 01 0f 70 08 8f 07
E: 0.528852 6 01 0f 99 08 6b 07
E: 0.537967 6 01 0f d2 08 36 07
E: 0.546883 6 01 0f 07 09 04 07
E: 0.556948 6 01 0f 31 09 dd 06
E: 0.565919 6 01 0f 6a 09 a3 06
E: 0.575905 6 01 0f 9f 09 6a 06
E: 0.584887 6 01 0f d3 09 3b 06
E: 0.593964 6 01 0f fa 09 17 06
E: 0.603865 6 01 0f 25 0a eb 05
E: 0.612943 6 01 0f 5e 0a b3 05
E: 0.623094 6 01 0f 87 0a 8e 05
E: 0.631946 6 01 0f b0 0a 63 05
E: 0.641945 6 01 0f e8 0a 2d 05
E: 0.650914 6 01 0f 0f 0b 08 05
E: 0.659961 6 01 0f 3b 0b e0 04
E: 0.669909 6 01 0f 65 0b b5 04
E: 0.678871 6 01 0f 9b 0b 7d 04
E: 0.688953 6 01 0f c2 0b 5b 04
E: 0.697954 6 01 0f ea 0b 36 04
E: 0.706972 6 01 0f 14 0c 0c 04
E: 0.716908 6 01 0f 3f 0c e1 03
E: 0.726914 6 01 0f 68 0c bc 03
E: 0.735959 6 01 0f 92 0c 90 03
E: 0.744923 6 01 0f bd 0c 64 03
E: 0.754968 6 01 0f e9 0c 3d 03
E: 0.763962 6 01 0f 15 0d 17 03
E: 0.773988 6 01 0f 3f 0d f0 02
E: 0.782911 6 01 0f 67 0d c8 02
E: 0.791935 6 01 0f 8d 0d a1 02
E: 0.801868 6 01 0f b0 0d 82 02
E: 0.811010 6 01 0f d3 0d 62 02
E: 0.820889 6 01 0f f6 0d 3f 02
E: 0.829956 6 01 0f 19 0e 1d 02
E: 0.838988 6 01 0f 3c 0e fd 01
E: 0.848907 6 01 0f 5c 0e de 01
E: 0.857979 6 01 0f 7c 0e bc 01
E: 0.867919 6 01 0f 95 0e a1 01
E: 0.876921 6 01 0f af 0e 83 01
E: 0.886925 6 01 0f c9 0e 67 01
E: 0.895962 6 01 0f e4 0e 4a 01
E: 0.904952 6 01 0f ff 0e 2e 01
E: 0.914982 6 01 0f 1a 0f 0f 01
E: 0.923994 6 01 0f 34 0f f1 00
E: 0.933930 6 01 0f 4e 0f d5 00
E: 0.942928 6 01 0f 67 0f bb 00
E: 0.952926 6 01 0f 79 0f a7 00
E: 0.961926 6 01 0f 8a 0f 90 00
E: 0.970992 6 01 0f 98 0f 7c 00
E: 0.980973 6 01 0f a5 0f 69 00
E: 0.989937 6 01 0f b8 0f 50 00
E: 0.999915 6 01 0f c7 0f 3d 00
E: 1.008989 6 01 0f d5 0f 2e 00
E: 1.017930 6 01 0f de 0f 23 00
E: 1.028017 6 01 0f e3 0f 1e 00
E: 1.036941 6 01 0f e7 0f 1b 00
E: 1.046969 6 01 0f e9 0f 18 00
E: 1.074011 6 01 0e ff 0f 00 00
# 2. Land one finger,
   - land a second finger far enough from the first
   - move your two fingers
   - release the *first* finger
   - release the second finger
E: 5.201373 6 01 0f a8 0b ae 02
E: 5.352468 6 01 0f a8 0b af 02
E: 5.361473 6 01 0f a7 0b af 02
E: 5.503431 6 01 17 fe 0d 2d 02
E: 5.599388 6 01 17 fe 0d 2c 02
E: 5.647507 6 01 17 fe 0d 2b 02
E: 5.724508 6 01 17 fd 0d 2b 02
E: 5.753391 6 01 0f a7 0b b0 02
E: 5.772472 6 01 17 fd 0d 2c 02
E: 5.773417 6 01 0f a7 0b b1 02
E: 5.782515 6 01 17 fd 0d 2d 02
E: 5.783411 6 01 0f a8 0b b2 02
E: 5.791517 6 01 17 fd 0d 2e 02
E: 5.792419 6 01 0f a8 0b b3 02
E: 5.801471 6 01 17 fd 0d 30 02
E: 5.802452 6 01 0f a8 0b b5 02
E: 5.810386 6 01 17 fd 0d 33 02
E: 5.811410 6 01 0f a8 0b b7 02
E: 5.820441 6 01 17 fd 0d 37 02
E: 5.821417 6 01 0f a8 0b bb 02
E: 5.830493 6 01 17 fc 0d 3d 02
E: 5.831427 6 01 0f a9 0b bf 02
E: 5.839437 6 01 17 fb 0d 46 02
E: 5.840373 6 01 0f a9 0b c4 02
E: 5.849514 6 01 17 f9 0d 51 02
E: 5.850447 6 01 0f a9 0b cb 02
E: 5.859440 6 01 17 f8 0d 5d 02
E: 5.860414 6 01 0f a9 0b d5 02
E: 5.868416 6 01 17 f6 0d 69 02
E: 5.869361 6 01 0f a9 0b e1 02
E: 5.878554 6 01 17 f5 0d 76 02
E: 5.879405 6 01 0f a9 0b ed 02
E: 5.888444 6 01 17 f3 0d 86 02
E: 5.889402 6 01 0f a8 0b fb 02
E: 5.897404 6 01 17 f2 0d 97 02
E: 5.898411 6 01 0f a8 0b 0d 03
E: 5.907448 6 01 17 f1 0d a9 02
E: 5.908414 6 01 0f a7 0b 1f 03
E: 5.917397 6 01 17 f0 0d bf 02
E: 5.918312 6 01 0f a7 0b 32 03
E: 5.926414 6 01 17 ef 0d d4 02
E: 5.927405 6 01 0f a7 0b 49 03
E: 5.936384 6 01 17 ee 0d e9 02
E: 5.937310 6 01 0f a7 0b 5e 03
E: 5.945386 6 01 17 ed 0d fc 02
E: 5.946315 6 01 0f a6 0b 74 03
E: 5.955413 6 01 17 ec 0d 0c 03
E: 5.956400 6 01 0f a5 0b 8b 03
E: 5.965484 6 01 17 ec 0d 1c 03
E: 5.966401 6 01 0f a4 0b a0 03
E: 5.974415 6 01 17 eb 0d 2d 03
E: 5.975402 6 01 0f a4 0b b5 03
E: 5.984374 6 01 17 eb 0d 43 03
E: 5.985327 6 01 0f a4 0b cb 03
E: 5.994410 6 01 17 ea 0d 5a 03
E: 5.995401 6 01 0f a4 0b e1 03
E: 6.003315 6 01 17 e9 0d 72 03
E: 6.004405 6 01 0f a4 0b f7 03
E: 6.013393 6 01 17 e9 0d 87 03
E: 6.014406 6 01 0f a3 0b 13 04
E: 6.023371 6 01 17 e8 0d 9c 03
E: 6.024400 6 01 0f a2 0b 2c 04
E: 6.032413 6 01 17 e8 0d b1 03
E: 6.033406 6 01 0f a1 0b 41 04
E: 6.042389 6 01 17 e7 0d c6 03
E: 6.043323 6 01 0f a1 0b 56 04
E: 6.052428 6 01 17 e7 0d dd 03
E: 6.053409 6 01 0f a2 0b 6b 04
E: 6.061415 6 01 17 e6 0d f8 03
E: 6.062550 6 01 0f a2 0b 81 04
E: 6.071384 6 01 17 e5 0d 13 04
E: 6.072323 6 01 0f a3 0b 97 04
E: 6.081416 6 01 17 e5 0d 28 04
E: 6.082416 6 01 0f a2 0b b3 04
E: 6.090425 6 01 17 e4 0d 3b 04
E: 6.091412 6 01 0f a1 0b cc 04
E: 6.100436 6 01 17 e4 0d 50 04
E: 6.101325 6 01 0f a1 0b df 04
E: 6.110389 6 01 17 e4 0d 63 04
E: 6.111412 6 01 0f a0 0b f3 04
E: 6.119321 6 01 17 e4 0d 74 04
E: 6.120377 6 01 0f a0 0b 03 05
E: 6.129423 6 01 17 e4 0d 85 04
E: 6.130421 6 01 0f a1 0b 18 05
E: 6.139433 6 01 17 e4 0d 9c 04
E: 6.140461 6 01 0f a2 0b 2d 05
E: 6.148460 6 01 17 e4 0d b2 04
E: 6.149420 6 01 0f a2 0b 41 05
E: 6.158383 6 01 17 e3 0d c6 04
E: 6.159418 6 01 0f a1 0b 56 05
E: 6.167395 6 01 17 e3 0d d6 04
E: 6.168301 6 01 0f a1 0b 67 05
E: 6.177439 6 01 17 e3 0d e6 04
E: 6.178420 6 01 0f a0 0b 77 05
E: 6.187431 6 01 17 e4 0d f6 04
E: 6.188367 6 01 0f a1 0b 88 05
E: 6.196409 6 01 17 e3 0d 07 05
E: 6.197334 6 01 0f a1 0b 99 05
E: 6.206406 6 01 17 e4 0d 19 05
E: 6.207439 6 01 0f a1 0b aa 05
E: 6.216426 6 01 17 e4 0d 2f 05
E: 6.217389 6 01 0f a2 0b c0 05
E: 6.225401 6 01 17 e4 0d 46 05
E: 6.226338 6 01 0f a2 0b d5 05
E: 6.235444 6 01 17 e4 0d 5b 05
E: 6.236402 6 01 0f a2 0b ea 05
E: 6.245432 6 01 17 e4 0d 6f 05
E: 6.246431 6 01 0f a2 0b ff 05
E: 6.254404 6 01 17 e5 0d 7e 05
E: 6.255427 6 01 0f a2 0b 0f 06
E: 6.264434 6 01 17 e5 0d 8e 05
E: 6.265427 6 01 0f a2 0b 1e 06
E: 6.274409 6 01 17 e6 0d 9e 05
E: 6.275428 6 01 0f a2 0b 2f 06
E: 6.283436 6 01 17 e6 0d ad 05
E: 6.284363 6 01 0f a3 0b 40 06
E: 6.293429 6 01 17 e7 0d be 05
E: 6.294376 6 01 0f a4 0b 50 06
E: 6.303443 6 01 17 e7 0d cf 05
E: 6.304384 6 01 0f a5 0b 61 06
E: 6.312437 6 01 17 e7 0d e0 05
E: 6.313361 6 01 0f a6 0b 71 06
E: 6.322451 6 01 17 e8 0d ef 05
E: 6.323434 6 01 0f a7 0b 7f 06
E: 6.331378 6 01 17 e8 0d fe 05
E: 6.332434 6 01 0f a8 0b 8d 06
E: 6.341382 6 01 17 e8 0d 09 06
E: 6.342435 6 01 0f a8 0b 98 06
E: 6.351364 6 01 17 e9 0d 13 06
E: 6.352338 6 01 0f a8 0b a3 06
E: 6.360415 6 01 17 e9 0d 1b 06
E: 6.361436 6 01 0f a9 0b ac 06
E: 6.370450 6 01 17 ea 0d 22 06
E: 6.371370 6 01 0f a9 0b b4 06
E: 6.380447 6 01 17 ea 0d 28 06
E: 6.381369 6 01 0f a9 0b bb 06
E: 6.389450 6 01 17 ea 0d 2d 06
E: 6.390440 6 01 0f aa 0b c1 06
E: 6.399406 6 01 17 eb 0d 31 06
E: 6.400412 6 01 0f aa 0b c6 06
E: 6.408469 6 01 17 eb 0d 35 06
E: 6.409441 6 01 0f aa 0b ca 06
E: 6.418680 6 01 17 eb 0d 38 06
E: 6.419421 6 01 0f aa 0b ce 06
E: 6.428456 6 01 17 ec 0d 3b 06
E: 6.429445 6 01 0f ab 0b d1 06
E: 6.438461 6 01 17 ec 0d 3e 06
E: 6.439429 6 01 0f ab 0b d3 06
E: 6.447411 6 01 17 ec 0d 40 06
E: 6.448443 6 01 0f ab 0b d6 06
E: 6.457438 6 01 17 ec 0d 42 06
E: 6.458444 6 01 0f ab 0b d8 06
E: 6.467387 6 01 17 ed 0d 44 06
E: 6.468423 6 01 0f ab 0b da 06
E: 6.476453 6 01 17 ed 0d 45 06
E: 6.477447 6 01 0f ac 0b db 06
E: 6.486427 6 01 17 ed 0d 47 06
E: 6.487379 6 01 0f ac 0b dd 06
E: 6.495454 6 01 17 ed 0d 48 06
E: 6.496448 6 01 0f ac 0b de 06
E: 6.505432 6 01 17 ed 0d 49 06
E: 6.506449 6 01 0f ac 0b df 06
E: 6.515452 6 01 17 ed 0d 4a 06
E: 6.516450 6 01 0f ac 0b e1 06
E: 6.524470 6 01 17 ee 0d 4b 06
E: 6.534426 6 01 0f ad 0b e2 06
E: 6.536419 6 01 17 ee 0d 4c 06
E: 6.544422 6 01 17 ee 0d 4d 06
E: 6.553457 6 01 17 ee 0d 4e 06
E: 6.562443 6 01 0e be 0b f6 06
E: 6.564433 6 01 17 ee 0d 4f 06
E: 6.572398 6 01 17 ee 0d 50 06
E: 6.581454 6 01 17 ee 0d 51 06
E: 6.591456 6 01 17 ee 0d 53 06
E: 6.600416 6 01 17 ef 0d 54 06
E: 6.609472 6 01 17 ef 0d 55 06
E: 6.619458 6 01 17 ef 0d 57 06
E: 6.628470 6 01 17 f0 0d 58 06
E: 6.638460 6 01 17 f0 0d 59 06
E: 6.647460 6 01 17 f0 0d 5b 06
E: 6.657434 6 01 17 f1 0d 5c 06
E: 6.666468 6 01 17 f1 0d 5d 06
E: 6.675500 6 01 17 f1 0d 5e 06
E: 6.685594 6 01 17 f2 0d 5e 06
E: 6.694596 6 01 17 f2 0d 5f 06
E: 6.704597 6 01 17 f2 0d 60 06
E: 6.722694 6 01 17 f2 0d 61 06
E: 6.732548 6 01 17 f3 0d 61 06
E: 6.741605 6 01 17 f3 0d 62 06
E: 6.760528 6 01 17 f3 0d 63 06
E: 6.779594 6 01 17 f4 0d 63 06
E: 6.788604 6 01 17 f4 0d 64 06
E: 6.826581 6 01 17 f4 0d 65 06
E: 6.854497 6 01 17 f5 0d 65 06
E: 6.873512 6 01 17 f5 0d 66 06
E: 6.892482 6 01 17 f5 0d 67 06
E: 6.919420 6 01 16 ff 0d 8b 06
# 3. Finally, move your ten fingers on the screen and release them.
E: 11.146998 6 01 0f 6e 0c 95 02
E: 11.148890 6 01 17 fb 0e 09 04
E: 11.188015 6 01 1f a8 0d 4f 02
E: 11.189909 6 01 27 52 0c 66 07
E: 11.190776 6 01 0f 6d 0c 95 02
E: 11.200982 6 01 17 fb 0e 08 04
E: 11.202913 6 01 2f 6c 02 fb 05
E: 11.204851 6 01 37 ce 03 65 04
E: 11.206912 6 01 3f 59 05 e2 04
E: 11.208921 6 01 47 b3 06 7d 07
E: 11.213889 6 01 2f 6b 02 fb 05
E: 11.215893 6 01 37 cd 03 65 04
E: 11.217997 6 01 47 b2 06 7d 07
E: 11.226912 6 01 0f 6d 0c 94 02
E: 11.229078 6 01 27 52 0c 65 07
E: 11.239950 6 01 17 fb 0e 07 04
E: 11.241925 6 01 27 52 0c 64 07
E: 11.253036 6 01 17 fa 0e 07 04
E: 11.266028 6 01 27 52 0c 62 07
E: 11.267849 6 01 2f 6b 02 fa 05
E: 11.269965 6 01 3f 59 05 e1 04
E: 11.272024 6 01 47 b2 06 7c 07
E: 11.272961 6 01 0f 6d 0c 93 02
E: 11.274844 6 01 17 fa 0e 06 04
E: 11.278865 6 01 1f a8 0d 4e 02
E: 11.280928 6 01 27 51 0c 60 07
E: 11.281900 6 01 17 fa 0e 05 04
E: 11.291998 6 01 27 50 0c 5d 07
E: 11.293936 6 01 2f 6c 02 fa 05
E: 11.295847 6 01 47 b2 06 7b 07
E: 11.296865 6 01 0f 6d 0c 92 02
E: 11.298848 6 01 17 fa 0e 04 04
E: 11.304848 6 01 1f a7 0d 4e 02
E: 11.307018 6 01 27 4e 0c 58 07
E: 11.308936 6 01 2f 6c 02 f9 05
E: 11.310824 6 01 47 b2 06 7a 07
E: 11.311906 6 01 17 f9 0e 03 04
E: 11.317956 6 01 27 4c 0c 52 07
E: 11.319904 6 01 37 ce 03 64 04
E: 11.321876 6 01 3f 59 05 e0 04
E: 11.323959 6 01 47 b3 06 78 07
E: 11.324901 6 01 0f 6d 0c 91 02
E: 11.326986 6 01 17 f9 0e 02 04
E: 11.329906 6 01 1f a7 0d 4d 02
E: 11.331904 6 01 27 4a 0c 4b 07
E: 11.333904 6 01 2f 6c 02 f7 05
E: 11.335904 6 01 3f 5a 05 df 04
E: 11.337904 6 01 47 b3 06 74 07
E: 11.338789 6 01 0f 6d 0c 90 02
E: 11.340902 6 01 17 f8 0e 01 04
E: 11.352877 6 01 1f a7 0d 4c 02
E: 11.354908 6 01 27 46 0c 41 07
E: 11.356907 6 01 2f 6d 02 f5 05
E: 11.358932 6 01 37 ce 03 62 04
E: 11.360907 6 01 3f 5a 05 de 04
E: 11.362907 6 01 47 b4 06 6e 07
E: 11.363797 6 01 0f 6d 0c 8f 02
E: 11.365909 6 01 17 f5 0e fb 03
E: 11.367908 6 01 1f a6 0d 4b 02
E: 11.369907 6 01 27 42 0c 36 07
E: 11.371909 6 01 2f 6f 02 f1 05
E: 11.373907 6 01 37 cf 03 60 04
E: 11.375855 6 01 3f 5b 05 dc 04
E: 11.377804 6 01 47 b5 06 63 07
E: 11.378833 6 01 0f 6c 0c 89 02
E: 11.380909 6 01 17 f2 0e f6 03
E: 11.382861 6 01 1f a5 0d 48 02
E: 11.384912 6 01 27 3c 0c 28 07
E: 11.386792 6 01 2f 71 02 ed 05
E: 11.388804 6 01 37 d0 03 5b 04
E: 11.390846 6 01 3f 5c 05 d7 04
E: 11.392910 6 01 47 b9 06 43 07
E: 11.393910 6 01 0f 6b 0c 85 02
E: 11.395846 6 01 17 ef 0e f0 03
E: 11.397915 6 01 1f a4 0d 44 02
E: 11.399849 6 01 27 35 0c 16 07
E: 11.400863 6 01 2f 75 02 e6 05
E: 11.402843 6 01 37 d3 03 53 04
E: 11.404911 6 01 3f 5d 05 d1 04
E: 11.413922 6 01 47 c0 06 24 07
E: 11.414912 6 01 0f 68 0c 7b 02
E: 11.416847 6 01 17 ea 0e e7 03
E: 11.418870 6 01 1f a1 0d 3d 02
E: 11.420856 6 01 27 2b 0c fe 06
E: 11.422846 6 01 2f 79 02 dc 05
E: 11.424978 6 01 37 d7 03 44 04
E: 11.426914 6 01 3f 67 05 b4 04
E: 11.428934 6 01 47 c8 06 05 07
E: 11.429915 6 01 0f 63 0c 6e 02
E: 11.431913 6 01 17 e4 0e de 03
E: 11.433911 6 01 1f 9c 0d 34 02
E: 11.435915 6 01 27 23 0c e7 06
E: 11.437947 6 01 2f 86 02 c6 05
E: 11.439817 6 01 37 e7 03 12 04
E: 11.441854 6 01 3f 6e 05 9e 04
E: 11.443829 6 01 47 cf 06 e8 06
E: 11.444915 6 01 0f 5d 0c 5d 02
E: 11.446843 6 01 17 dc 0e d1 03
E: 11.448946 6 01 1f 8f 0d 1b 02
E: 11.450868 6 01 27 14 0c c6 06
E: 11.452859 6 01 2f 8d 02 b9 05
E: 11.454817 6 01 37 f0 03 f7 03
E: 11.456919 6 01 3f 76 05 88 04
E: 11.458914 6 01 47 d5 06 ce 06
E: 11.459912 6 01 0f 52 0c 47 02
E: 11.461916 6 01 17 c7 0e b6 03
E: 11.463912 6 01 1f 86 0d 0b 02
E: 11.465914 6 01 27 0d 0c ba 06
E: 11.467926 6 01 2f 95 02 ab 05
E: 11.469917 6 01 37 f8 03 df 03
E: 11.471817 6 01 3f 7e 05 72 04
E: 11.473929 6 01 47 da 06 b5 06
E: 11.474761 6 01 0f 40 0c 20 02
E: 11.476910 6 01 17 bd 0e a9 03
E: 11.478936 6 01 1f 7d 0d fc 01
E: 11.480922 6 01 27 02 0c ad 06
E: 11.482857 6 01 2f 9b 02 a1 05
E: 11.485019 6 01 37 01 04 c7 03
E: 11.486876 6 01 3f 88 05 55 04
E: 11.487879 6 01 47 e8 06 8b 06
E: 11.488880 6 01 0f 37 0c 0f 02
E: 11.490860 6 01 17 b1 0e 98 03
E: 11.492879 6 01 1f 71 0d eb 01
E: 11.494849 6 01 27 f9 0b a0 06
E: 11.497047 6 01 2f a3 02 93 05
E: 11.498926 6 01 37 08 04 b6 03
E: 11.500806 6 01 3f 9a 05 28 04
E: 11.502886 6 01 47 ee 06 77 06
E: 11.503942 6 01 0f 2d 0c fe 01
E: 11.506053 6 01 17 a5 0e 87 03
E: 11.507978 6 01 1f 67 0d db 01
E: 11.510041 6 01 27 ef 0b 95 06
E: 11.511960 6 01 2f ab 02 86 05
E: 11.513859 6 01 37 18 04 92 03
E: 11.515857 6 01 3f a2 05 17 04
E: 11.517825 6 01 47 f5 06 65 06
E: 11.518810 6 01 0f 22 0c ee 01
E: 11.520873 6 01 17 99 0e 77 03
E: 11.523036 6 01 1f 5c 0d ca 01
E: 11.524824 6 01 27 e6 0b 8b 06
E: 11.526806 6 01 2f bd 02 6c 05
E: 11.528851 6 01 37 1f 04 84 03
E: 11.531110 6 01 3f aa 05 08 04
E: 11.532859 6 01 47 fb 06 57 06
E: 11.533850 6 01 0f 17 0c e0 01
E: 11.535821 6 01 17 8e 0e 68 03
E: 11.537927 6 01 1f 51 0d bb 01
E: 11.540050 6 01 27 de 0b 82 06
E: 11.549058 6 01 2f c8 02 5f 05
E: 11.550881 6 01 37 29 04 73 03
E: 11.552873 6 01 3f b5 05 f8 03
E: 11.554850 6 01 47 03 07 43 06
E: 11.555847 6 01 0f 09 0c d2 01
E: 11.558032 6 01 17 7f 0e 5b 03
E: 11.559897 6 01 1f 42 0d ab 01
E: 11.560947 6 01 27 c2 0b 68 06
E: 11.562886 6 01 2f d5 02 4f 05
E: 11.565057 6 01 37 31 04 66 03
E: 11.566914 6 01 3f be 05 ed 03
E: 11.568898 6 01 47 0b 07 35 06
E: 11.569866 6 01 0f fa 0b c6 01
E: 11.572053 6 01 17 70 0e 4e 03
E: 11.573967 6 01 1f 26 0d 91 01
E: 11.575958 6 01 27 b7 0b 5e 06
E: 11.577869 6 01 2f e1 02 40 05
E: 11.579853 6 01 37 3a 04 58 03
E: 11.581851 6 01 3f c7 05 e1 03
E: 11.583867 6 01 47 14 07 28 06
E: 11.584867 6 01 0f ef 0b bc 01
E: 11.586847 6 01 17 55 0e 3e 03
E: 11.588995 6 01 1f 1b 0d 89 01
E: 11.591005 6 01 27 ab 0b 56 06
E: 11.593282 6 01 2f ea 02 35 05
E: 11.594859 6 01 37 43 04 4d 03
E: 11.595880 6 01 3f d0 05 d8 03
E: 11.597814 6 01 47 1c 07 1b 06
E: 11.598952 6 01 0f e3 0b b5 01
E: 11.608929 6 01 17 48 0e 37 03
E: 11.610801 6 01 1f 0e 0d 81 01
E: 11.612939 6 01 27 a1 0b 51 06
E: 11.614887 6 01 2f f4 02 2b 05
E: 11.616833 6 01 37 4e 04 41 03
E: 11.618929 6 01 3f db 05 cc 03
E: 11.620857 6 01 47 30 07 02 06
E: 11.622014 6 01 0f ca 0b a8 01
E: 11.623935 6 01 17 3e 0e 33 03
E: 11.626060 6 01 1f 04 0d 7d 01
E: 11.627968 6 01 27 97 0b 4e 06
E: 11.629832 6 01 2f fc 02 23 05
E: 11.632058 6 01 37 63 04 2e 03
E: 11.633888 6 01 3f ee 05 b9 03
E: 11.635877 6 01 47 39 07 f9 05
E: 11.636841 6 01 0f bf 0b a5 01
E: 11.638937 6 01 17 36 0e 31 03
E: 11.640878 6 01 1f f9 0c 79 01
E: 11.642863 6 01 27 90 0b 4e 06
E: 11.643866 6 01 2f 0d 03 16 05
E: 11.645869 6 01 37 6a 04 28 03
E: 11.647901 6 01 3f f6 05 b3 03
E: 11.649870 6 01 47 41 07 f1 05
E: 11.650809 6 01 0f b7 0b a4 01
E: 11.652960 6 01 17 2d 0e 2f 03
E: 11.654817 6 01 1f f1 0c 77 01
E: 11.656949 6 01 27 84 0b 50 06
E: 11.658935 6 01 2f 16 03 0e 05
E: 11.660860 6 01 37 71 04 24 03
E: 11.662935 6 01 3f fc 05 af 03
E: 11.664936 6 01 47 49 07 eb 05
E: 11.665932 6 01 0f af 0b a3 01
E: 11.667953 6 01 17 1e 0e 2d 03
E: 11.669940 6 01 1f e1 0c 77 01
E: 11.671936 6 01 27 7e 0b 52 06
E: 11.673880 6 01 2f 1e 03 0a 05
E: 11.675860 6 01 37 78 04 20 03
E: 11.678019 6 01 3f 02 06 ab 03
E: 11.678935 6 01 47 54 07 e4 05
E: 11.679933 6 01 0f 9d 0b a4 01
E: 11.681938 6 01 17 16 0e 2e 03
E: 11.683816 6 01 1f d8 0c 78 01
E: 11.685944 6 01 27 77 0b 54 06
E: 11.687851 6 01 2f 25 03 07 05
E: 11.689937 6 01 37 7d 04 1d 03
E: 11.691936 6 01 3f 0d 06 a5 03
E: 11.693939 6 01 47 59 07 e2 05
E: 11.694884 6 01 0f 94 0b a5 01
E: 11.696935 6 01 17 0d 0e 2f 03
E: 11.698939 6 01 1f d0 0c 7c 01
E: 11.700904 6 01 27 70 0b 59 06
E: 11.702994 6 01 2f 2c 03 05 05
E: 11.704867 6 01 37 82 04 1b 03
E: 11.713949 6 01 3f 13 06 a4 03
E: 11.715943 6 01 47 5d 07 e2 05
E: 11.717015 6 01 0f 85 0b ad 01
E: 11.718876 6 01 17 02 0e 34 03
E: 11.720939 6 01 1f c2 0c 85 01
E: 11.722941 6 01 27 62 0b 62 06
E: 11.724941 6 01 2f 33 03 04 05
E: 11.725940 6 01 37 8c 04 19 03
E: 11.727893 6 01 3f 17 06 a4 03
E: 11.729885 6 01 47 61 07 e2 05
E: 11.730939 6 01 0f 73 0b b7 01
E: 11.732881 6 01 17 f2 0d 41 03
E: 11.734917 6 01 1f b1 0c 91 01
E: 11.736884 6 01 27 50 0b 74 06
E: 11.739098 6 01 2f 3d 03 03 05
E: 11.740905 6 01 37 91 04 19 03
E: 11.742947 6 01 3f 1c 06 a3 03
E: 11.744942 6 01 47 66 07 e3 05
E: 11.745946 6 01 0f 60 0b c6 01
E: 11.747943 6 01 17 e0 0d 50 03
E: 11.748941 6 01 1f 8c 0c b3 01
E: 11.750937 6 01 27 2f 0b 9c 06
E: 11.752926 6 01 2f 42 03 04 05
E: 11.754879 6 01 37 95 04 1b 03
E: 11.756943 6 01 3f 1f 06 a4 03
E: 11.758944 6 01 47 6b 07 e5 05
E: 11.759900 6 01 0f 4c 0b d7 01
E: 11.760939 6 01 17 bd 0d 76 03
E: 11.762857 6 01 1f 75 0c ca 01
E: 11.764944 6 01 27 1e 0b ba 06
E: 11.766882 6 01 2f 45 03 04 05
E: 11.768875 6 01 37 9b 04 1e 03
E: 11.770983 6 01 3f 23 06 a4 03
E: 11.772945 6 01 47 71 07 e9 05
E: 11.773942 6 01 0f 21 0b 07 02
E: 11.775872 6 01 17 ad 0d 87 03
E: 11.777824 6 01 1f 62 0c e2 01
E: 11.779939 6 01 27 12 0b ce 06
E: 11.781842 6 01 2f 4a 03 06 05
E: 11.783892 6 01 37 a1 04 22 03
E: 11.785940 6 01 3f 2b 06 a8 03
E: 11.787944 6 01 47 7f 07 f6 05
E: 11.788946 6 01 0f 10 0b 21 02
E: 11.790872 6 01 17 9f 0d 9a 03
E: 11.792951 6 01 1f 53 0c ff 01
E: 11.794890 6 01 27 08 0b e3 06
E: 11.796947 6 01 2f 4e 03 08 05
E: 11.798915 6 01 37 af 04 37 03
E: 11.800843 6 01 3f 31 06 ad 03
E: 11.802950 6 01 47 88 07 02 06
E: 11.803891 6 01 0f 06 0b 35 02
E: 11.805889 6 01 17 91 0d ad 03
E: 11.807946 6 01 1f 44 0c 1c 02
E: 11.809949 6 01 27 00 0b f9 06
E: 11.811948 6 01 2f 53 03 0e 05
E: 11.820961 6 01 37 bb 04 51 03
E: 11.822926 6 01 3f 39 06 b7 03
E: 11.824886 6 01 47 94 07 19 06
E: 11.825951 6 01 0f f5 0a 5a 02
E: 11.827954 6 01 17 80 0d d3 03
E: 11.829950 6 01 1f 36 0c 3f 02
E: 11.831887 6 01 27 f7 0a 17 07
E: 11.833888 6 01 2f 64 03 2b 05
E: 11.835890 6 01 37 c7 04 6e 03
E: 11.837822 6 01 3f 44 06 cc 03
E: 11.839941 6 01 47 a0 07 35 06
E: 11.841095 6 01 0f e5 0a 84 02
E: 11.842944 6 01 17 6e 0d fd 03
E: 11.844947 6 01 1f 2a 0c 5f 02
E: 11.846905 6 01 27 e9 0a 62 07
E: 11.848952 6 01 2f 6f 03 41 05
E: 11.850960 6 01 37 d4 04 92 03
E: 11.852989 6 01 3f 52 06 ea 03
E: 11.854952 6 01 47 ad 07 5b 06
E: 11.855948 6 01 0f db 0a a3 02
E: 11.857894 6 01 17 64 0d 19 04
E: 11.859913 6 01 1f 17 0c a4 02
E: 11.861915 6 01 27 e5 0a 7b 07
E: 11.863923 6 01 2f 78 03 56 05
E: 11.865954 6 01 37 db 04 b3 03
E: 11.867960 6 01 3f 60 06 12 04
E: 11.868894 6 01 47 b7 07 7e 06
E: 11.869889 6 01 0f d2 0a c2 02
E: 11.871955 6 01 17 5e 0d 2c 04
E: 11.881902 6 01 1f 11 0c c7 02
E: 11.883907 6 01 27 e4 0a 9b 07
E: 11.885956 6 01 2f 81 03 76 05
E: 11.887957 6 01 37 e4 04 ec 03
E: 11.889900 6 01 3f 6c 06 46 04
E: 11.891957 6 01 47 c0 07 b1 06
E: 11.892953 6 01 0f ca 0a e6 02
E: 11.894899 6 01 17 57 0d 59 04
E: 11.896892 6 01 1f 0e 0c e1 02
E: 11.898889 6 01 27 e3 0a b9 07
E: 11.900845 6 01 2f 8b 03 a0 05
E: 11.902911 6 01 37 e9 04 1b 04
E: 11.904965 6 01 3f 74 06 76 04
E: 11.906958 6 01 47 c5 07 e2 06
E: 11.907954 6 01 0f c5 0a 1b 03
E: 11.909891 6 01 17 55 0d 73 04
E: 11.911891 6 01 1f 0b 0c fa 02
E: 11.913962 6 01 27 e4 0a d8 07
E: 11.915957 6 01 2f 92 03 d0 05
E: 11.917967 6 01 37 ea 04 3d 04
E: 11.919960 6 01 3f 77 06 99 04
E: 11.921958 6 01 47 c8 07 20 07
E: 11.922898 6 01 0f c3 0a 33 03
E: 11.924960 6 01 17 53 0d 8a 04
E: 11.927005 6 01 1f 09 0c 12 03
E: 11.928959 6 01 27 e6 0a f0 07
E: 11.930874 6 01 2f 95 03 f1 05
E: 11.932892 6 01 37 ea 04 5a 04
E: 11.934840 6 01 3f 78 06 d9 04
E: 11.936850 6 01 47 c7 07 3f 07
E: 11.937849 6 01 0f c2 0a 4c 03
E: 11.939894 6 01 17 52 0d a2 04
E: 11.941897 6 01 1f 08 0c 2d 03
E: 11.943928 6 01 27 e8 0a 06 08
E: 11.945924 6 01 2f 96 03 0c 06
E: 11.947889 6 01 37 e6 04 99 04
E: 11.949965 6 01 3f 75 06 f8 04
E: 11.951844 6 01 47 c6 07 60 07
E: 11.952882 6 01 0f c2 0a 67 03
E: 11.954902 6 01 17 53 0d b4 04
E: 11.956964 6 01 1f 08 0c 47 03
E: 11.958963 6 01 27 eb 0a 1e 08
E: 11.961161 6 01 2f 94 03 45 06
E: 11.962961 6 01 37 e2 04 c3 04
E: 11.964959 6 01 3f 71 06 18 05
E: 11.966901 6 01 47 c3 07 81 07
E: 11.967946 6 01 0f c4 0a 81 03
E: 11.969963 6 01 17 53 0d c2 04
E: 11.971960 6 01 1f 09 0c 61 03
E: 11.973964 6 01 27 f6 0a 4d 08
E: 11.975956 6 01 2f 91 03 64 06
E: 11.977897 6 01 37 db 04 e8 04
E: 11.979884 6 01 3f 6b 06 3f 05
E: 11.982063 6 01 47 bd 07 ac 07
E: 11.982895 6 01 0f c6 0a 9a 03
E: 11.984978 6 01 17 55 0d d2 04
E: 11.986967 6 01 1f 0e 0c 8f 03
E: 11.988907 6 01 27 fd 0a 62 08
E: 11.990881 6 01 2f 8e 03 81 06
E: 11.992964 6 01 37 d4 04 0b 05
E: 11.994962 6 01 3f 65 06 63 05
E: 11.996966 6 01 47 b6 07 d4 07
E: 11.997904 6 01 0f c8 0a b1 03
E: 11.999864 6 01 17 5b 0d f9 04
E: 12.001903 6 01 1f 10 0c a2 03
E: 12.003909 6 01 27 04 0b 77 08
E: 12.005967 6 01 2f 8a 03 9c 06
E: 12.007918 6 01 37 cb 04 2e 05
E: 12.009966 6 01 3f 5e 06 88 05
E: 12.011966 6 01 47 a5 07 1d 08
E: 12.012966 6 01 0f d2 0a df 03
E: 12.014967 6 01 17 60 0d 0d 05
E: 12.016868 6 01 1f 14 0c bb 03
E: 12.018914 6 01 27 10 0b 92 08
E: 12.020938 6 01 2f 85 03 b3 06
E: 12.022884 6 01 37 c2 04 50 05
E: 12.024939 6 01 3f 56 06 ad 05
E: 12.033920 6 01 47 91 07 58 08
E: 12.034947 6 01 0f da 0a fc 03
E: 12.036916 6 01 17 68 0d 26 05
E: 12.038904 6 01 1f 1a 0c da 03
E: 12.040850 6 01 27 1f 0b b2 08
E: 12.042971 6 01 2f 7b 03 de 06
E: 12.044969 6 01 37 b5 04 75 05
E: 12.046968 6 01 3f 37 06 04 06
E: 12.048896 6 01 47 84 07 7e 08
E: 12.049903 6 01 0f e2 0a 16 04
E: 12.051904 6 01 17 73 0d 40 05
E: 12.053975 6 01 1f 21 0c f6 03
E: 12.055974 6 01 27 29 0b c6 08
E: 12.057974 6 01 2f 72 03 02 07
E: 12.059974 6 01 37 a6 04 a0 05
E: 12.069949 6 01 3f 22 06 2c 06
E: 12.071871 6 01 47 75 07 a3 08
E: 12.072894 6 01 0f f1 0a 39 04
E: 12.074973 6 01 17 84 0d 60 05
E: 12.076972 6 01 1f 2a 0c 11 04
E: 12.078972 6 01 27 34 0b db 08
E: 12.080971 6 01 2f 5f 03 2e 07
E: 12.082936 6 01 37 82 04 ef 05
E: 12.084924 6 01 3f 11 06 50 06
E: 12.086912 6 01 47 64 07 c7 08
E: 12.087973 6 01 0f ff 0a 57 04
E: 12.089898 6 01 17 8e 0d 76 05
E: 12.091970 6 01 1f 37 0c 30 04
E: 12.093930 6 01 27 41 0b ef 08
E: 12.095976 6 01 2f 43 03 61 07
E: 12.097976 6 01 37 73 04 06 06
E: 12.099864 6 01 3f 05 06 68 06
E: 12.101909 6 01 47 58 07 e0 08
E: 12.102934 6 01 0f 0a 0b 6c 04
E: 12.104861 6 01 17 9a 0d 89 05
E: 12.106977 6 01 1f 42 0c 45 04
E: 12.108977 6 01 27 5d 0b 14 09
E: 12.110914 6 01 2f 37 03 72 07
E: 12.112980 6 01 37 64 04 1e 06
E: 12.114929 6 01 3f fa 05 7a 06
E: 12.116862 6 01 47 4d 07 f3 08
E: 12.117859 6 01 0f 16 0b 7f 04
E: 12.119920 6 01 17 a7 0d 9d 05
E: 12.120921 6 01 1f 5b 0c 6e 04
E: 12.122923 6 01 27 6c 0b 23 09
E: 12.124980 6 01 2f 2b 03 88 07
E: 12.126865 6 01 37 58 04 31 06
E: 12.128978 6 01 3f ef 05 88 06
E: 12.130978 6 01 47 41 07 04 09
E: 12.131912 6 01 0f 25 0b 90 04
E: 12.133888 6 01 17 b6 0d af 05
E: 12.135981 6 01 1f 68 0c 82 04
E: 12.137940 6 01 27 7c 0b 33 09
E: 12.139977 6 01 2f 1f 03 9c 07
E: 12.141976 6 01 37 4a 04 41 06
E: 12.143972 6 01 3f e4 05 96 06
E: 12.145978 6 01 47 36 07 12 09
E: 12.146920 6 01 0f 35 0b a2 04
E: 12.148859 6 01 17 c6 0d c1 05
E: 12.165954 6 01 1f 84 0c 9c 04
E: 12.167954 6 01 27 92 0b 42 09
E: 12.170035 6 01 2f 04 03 b8 07
E: 12.171987 6 01 37 30 04 5c 06
E: 12.173986 6 01 3f ce 05 a7 06
E: 12.175988 6 01 47 22 07 25 09
E: 12.176986 6 01 0f 52 0b b9 04
E: 12.178911 6 01 17 e3 0d da 05
E: 12.180943 6 01 1f 9d 0c af 04
E: 12.182871 6 01 27 a6 0b 4e 09
E: 12.184983 6 01 2f ee 02 cd 07
E: 12.186934 6 01 37 1a 04 6f 06
E: 12.188988 6 01 3f bb 05 b4 06
E: 12.190929 6 01 47 0f 07 35 09
E: 12.191979 6 01 0f 6d 0b ca 04
E: 12.192975 6 01 17 13 0e fc 05
E: 12.194951 6 01 1f b4 0c c0 04
E: 12.196983 6 01 27 bf 0b 5a 09
E: 12.198983 6 01 2f df 02 d9 07
E: 12.200951 6 01 37 0b 04 7a 06
E: 12.202944 6 01 3f ab 05 be 06
E: 12.204910 6 01 47 fd 06 42 09
E: 12.205985 6 01 0f 88 0b d6 04
E: 12.207933 6 01 17 26 0e 05 06
E: 12.209984 6 01 1f c5 0c ca 04
E: 12.211869 6 01 27 d3 0b 62 09
E: 12.213929 6 01 2f d2 02 e1 07
E: 12.216000 6 01 37 fd 03 81 06
E: 12.217991 6 01 3f 9b 05 c4 06
E: 12.219914 6 01 47 ed 06 4b 09
E: 12.220981 6 01 0f 97 0b dc 04
E: 12.228996 6 01 17 3a 0e 0b 06
E: 12.230989 6 01 1f d8 0c d0 04
E: 12.232945 6 01 27 e7 0b 64 09
E: 12.234974 6 01 2f c6 02 e7 07
E: 12.237045 6 01 37 ef 03 85 06
E: 12.238987 6 01 3f 8b 05 c7 06
E: 12.240988 6 01 47 db 06 50 09
E: 12.241987 6 01 0f c2 0b e5 04
E: 12.243909 6 01 17 4b 0e 0f 06
E: 12.245991 6 01 1f ed 0c d4 04
E: 12.247988 6 01 27 f7 0b 63 09
E: 12.249939 6 01 2f ba 02 ee 07
E: 12.251869 6 01 37 e3 03 86 06
E: 12.253988 6 01 3f 7b 05 c9 06
E: 12.255089 6 01 47 c0 06 52 09
E: 12.255991 6 01 0f d4 0b e5 04
E: 12.257989 6 01 17 5b 0e 11 06
E: 12.259991 6 01 1f fe 0c d6 04
E: 12.261988 6 01 27 08 0c 60 09
E: 12.263990 6 01 2f af 02 f1 07
E: 12.265882 6 01 37 d9 03 87 06
E: 12.267996 6 01 3f 64 05 c9 06
E: 12.269914 6 01 47 b6 06 52 09
E: 12.270955 6 01 0f e6 0b e4 04
E: 12.272933 6 01 17 6b 0e 12 06
E: 12.274991 6 01 1f 0c 0d d7 04
E: 12.276993 6 01 27 1a 0c 5c 09
E: 12.278993 6 01 2f a6 02 f2 07
E: 12.280991 6 01 37 c3 03 84 06
E: 12.282927 6 01 3f 5a 05 c7 06
E: 12.285001 6 01 47 ac 06 50 09
E: 12.285931 6 01 0f f8 0b e0 04
E: 12.287994 6 01 17 7a 0e 11 06
E: 12.289993 6 01 1f 1b 0d d5 04
E: 12.291992 6 01 27 2b 0c 54 09
E: 12.294051 6 01 2f 96 02 f2 07
E: 12.295993 6 01 37 b5 03 80 06
E: 12.297993 6 01 3f 50 05 c4 06
E: 12.299943 6 01 47 a1 06 4d 09
E: 12.300997 6 01 0f 0e 0c d8 04
E: 12.302950 6 01 17 89 0e 0f 06
E: 12.304994 6 01 1f 2e 0d d0 04
E: 12.306968 6 01 27 51 0c 37 09
E: 12.308935 6 01 2f 8e 02 f1 07
E: 12.310919 6 01 37 a8 03 7a 06
E: 12.312994 6 01 3f 45 05 c0 06
E: 12.314994 6 01 47 93 06 48 09
E: 12.316103 6 01 0f 24 0c ce 04
E: 12.317896 6 01 17 98 0e 0c 06
E: 12.319998 6 01 1f 46 0d c8 04
E: 12.329996 6 01 27 6a 0c 1a 09
E: 12.332030 6 01 2f 85 02 ee 07
E: 12.334005 6 01 37 98 03 70 06
E: 12.335991 6 01 3f 35 05 b7 06
E: 12.337992 6 01 47 83 06 3f 09
E: 12.338996 6 01 0f 46 0c b7 04
E: 12.340992 6 01 17 ab 0e 03 06
E: 12.342995 6 01 1f 61 0d b9 04
E: 12.352011 6 01 27 8b 0c f5 08
E: 12.354020 6 01 2f 7b 02 e9 07
E: 12.355939 6 01 37 85 03 61 06
E: 12.357919 6 01 3f 21 05 a6 06
E: 12.359999 6 01 47 71 06 2f 09
E: 12.360945 6 01 0f 72 0c 91 04
E: 12.362943 6 01 17 c8 0e f2 05
E: 12.364999 6 01 1f ab 0d 80 04
E: 12.366937 6 01 27 a8 0c cd 08
E: 12.368928 6 01 2f 6e 02 e0 07
E: 12.370922 6 01 37 72 03 51 06
E: 12.372941 6 01 3f 0e 05 93 06
E: 12.374930 6 01 47 5e 06 1a 09
E: 12.375934 6 01 0f 9e 0c 61 04
E: 12.377972 6 01 17 04 0f c2 05
E: 12.379914 6 01 1f c6 0d 69 04
E: 12.381922 6 01 27 b8 0c ab 08
E: 12.383879 6 01 2f 60 02 d2 07
E: 12.386001 6 01 37 61 03 43 06
E: 12.388011 6 01 3f fe 04 80 06
E: 12.389000 6 01 47 42 06 f1 08
E: 12.389999 6 01 0f ad 0c 4a 04
E: 12.392001 6 01 17 16 0f b1 05
E: 12.393910 6 01 1f da 0d 57 04
E: 12.395930 6 01 27 c3 0c 91 08
E: 12.397940 6 01 2f 50 02 c4 07
E: 12.399944 6 01 37 56 03 37 06
E: 12.401889 6 01 3f e4 04 5c 06
E: 12.404003 6 01 47 37 06 dd 08
E: 12.405001 6 01 0f bd 0c 2f 04
E: 12.407003 6 01 17 22 0f a4 05
E: 12.408993 6 01 1f e6 0d 48 04
E: 12.411004 6 01 27 cb 0c 7e 08
E: 12.413003 6 01 2f 43 02 b6 07
E: 12.414916 6 01 37 44 03 19 06
E: 12.416882 6 01 3f dc 04 4b 06
E: 12.418941 6 01 47 2f 06 cc 08
E: 12.419918 6 01 0f cc 0c 13 04
E: 12.421948 6 01 17 2c 0f 96 05
E: 12.423971 6 01 1f f2 0d 35 04
E: 12.425930 6 01 27 d3 0c 68 08
E: 12.428001 6 01 2f 38 02 a8 07
E: 12.437014 6 01 37 3c 03 04 06
E: 12.438972 6 01 3f d2 04 32 06
E: 12.441006 6 01 47 25 06 af 08
E: 12.442004 6 01 0f dd 0c f3 03
E: 12.443932 6 01 17 36 0f 83 05
E: 12.445946 6 01 1f ff 0d 1c 04
E: 12.448006 6 01 27 dc 0c 3f 08
E: 12.449973 6 01 2f 24 02 86 07
E: 12.451897 6 01 37 33 03 e9 05
E: 12.454006 6 01 3f c6 04 0b 06
E: 12.455977 6 01 47 19 06 86 08
E: 12.456977 6 01 0f ec 0c d5 03
E: 12.459007 6 01 17 3f 0f 6a 05
E: 12.461006 6 01 1f 0e 0e 00 04
E: 12.463006 6 01 27 e3 0c 18 08
E: 12.465008 6 01 2f 1c 02 72 07
E: 12.466884 6 01 37 2c 03 d4 05
E: 12.468879 6 01 3f bf 04 f2 05
E: 12.470946 6 01 47 0e 06 58 08
E: 12.472006 6 01 0f fa 0c b6 03
E: 12.473936 6 01 17 48 0f 51 05
E: 12.476054 6 01 1f 17 0e ed 03
E: 12.477963 6 01 27 ea 0c f4 07
E: 12.486022 6 01 2f 15 02 4e 07
E: 12.487945 6 01 37 28 03 bd 05
E: 12.489976 6 01 3f ba 04 d7 05
E: 12.492011 6 01 47 07 06 29 08
E: 12.493010 6 01 0f 07 0d 87 03
E: 12.494956 6 01 17 50 0f 39 05
E: 12.496978 6 01 1f 29 0e c4 03
E: 12.498979 6 01 27 f8 0c ac 07
E: 12.500955 6 01 2f 0f 02 28 07
E: 12.502946 6 01 37 23 03 9b 05
E: 12.504934 6 01 3f b6 04 ba 05
E: 12.506950 6 01 47 02 06 03 08
E: 12.507978 6 01 0f 0f 0d 6a 03
E: 12.510015 6 01 17 5a 0f 18 05
E: 12.512010 6 01 1f 30 0e b4 03
E: 12.514012 6 01 27 fc 0c 9b 07
E: 12.516213 6 01 2f 0b 02 10 07
E: 12.517973 6 01 37 1d 03 74 05
E: 12.519988 6 01 3f b2 04 9b 05
E: 12.521966 6 01 47 fb 05 c4 07
E: 12.523017 6 01 0f 18 0d 45 03
E: 12.525019 6 01 17 5d 0f 0e 05
E: 12.527017 6 01 1f 34 0e a8 03
E: 12.528976 6 01 27 fe 0c 8f 07
E: 12.531016 6 01 2f 09 02 01 07
E: 12.532995 6 01 37 1b 03 5a 05
E: 12.534953 6 01 3f ad 04 61 05
E: 12.537015 6 01 47 f9 05 b0 07
E: 12.537938 6 01 0f 1a 0d 3c 03
E: 12.539937 6 01 17 5f 0f 08 05
E: 12.542019 6 01 1f 38 0e 9e 03
E: 12.543957 6 01 27 00 0d 88 07
E: 12.546016 6 01 2f 08 02 ec 06
E: 12.548016 6 01 37 18 03 36 05
E: 12.549906 6 01 3f ac 04 4c 05
E: 12.551906 6 01 47 f9 05 9d 07
E: 12.553012 6 01 0f 1c 0d 35 03
E: 12.554952 6 01 17 60 0f 04 05
E: 12.557017 6 01 1f 3b 0e 97 03
E: 12.559017 6 01 27 01 0d 7f 07
E: 12.561015 6 01 2f 09 02 e4 06
E: 12.562977 6 01 37 18 03 2a 05
E: 12.565020 6 01 3f ac 04 3d 05
E: 12.566966 6 01 47 f9 05 8c 07
E: 12.567969 6 01 0f 1c 0d 31 03
E: 12.569976 6 01 17 61 0f 01 05
E: 12.571964 6 01 1f 3d 0e 91 03
E: 12.580916 6 01 27 02 0d 7d 07
E: 12.582913 6 01 2f 0a 02 d8 06
E: 12.584995 6 01 37 19 03 1a 05
E: 12.587033 6 01 3f ad 04 2e 05
E: 12.589032 6 01 47 fb 05 78 07
E: 12.590130 6 01 0f 1d 0d 2d 03
E: 12.591901 6 01 17 61 0f fe 04
E: 12.592929 6 01 1f 3f 0e 89 03
E: 12.594941 6 01 27 02 0d 7b 07
E: 12.596911 6 01 2f 0d 02 c5 06
E: 12.598925 6 01 37 1a 03 0c 05
E: 12.600877 6 01 3f af 04 21 05
E: 12.602905 6 01 47 fc 05 62 07
E: 12.603890 6 01 0f 1e 0d 29 03
E: 12.606021 6 01 17 62 0f fa 04
E: 12.607929 6 01 1f 40 0e 85 03
E: 12.609913 6 01 27 02 0d 79 07
E: 12.611932 6 01 2f 11 02 ae 06
E: 12.613930 6 01 37 1d 03 fc 04
E: 12.615957 6 01 3f b1 04 17 05
E: 12.617946 6 01 47 01 06 3a 07
E: 12.618935 6 01 0f 1e 0d 23 03
E: 12.620910 6 01 17 62 0f f8 04
E: 12.622946 6 01 1f 41 0e 82 03
E: 12.624929 6 01 27 02 0d 77 07
E: 12.626912 6 01 2f 17 02 96 06
E: 12.627884 6 01 37 26 03 cd 04
E: 12.629915 6 01 3f b7 04 fa 04
E: 12.631911 6 01 47 04 06 27 07
E: 12.632888 6 01 0f 1f 0d 20 03
E: 12.634910 6 01 17 62 0f f6 04
E: 12.636907 6 01 1f 41 0e 7f 03
E: 12.639079 6 01 27 01 0d 75 07
E: 12.639963 6 01 2f 24 02 6b 06
E: 12.641900 6 01 37 2d 03 b7 04
E: 12.643946 6 01 3f bc 04 e6 04
E: 12.645899 6 01 47 09 06 16 07
E: 12.646932 6 01 0f 1f 0d 1e 03
E: 12.649205 6 01 17 62 0f f5 04
E: 12.650974 6 01 1f 42 0e 7c 03
E: 12.652965 6 01 27 ff 0c 6f 07
E: 12.654980 6 01 2f 2b 02 58 06
E: 12.657012 6 01 37 33 03 a2 04
E: 12.658981 6 01 3f c3 04 ce 04
E: 12.660952 6 01 47 0f 06 05 07
E: 12.661972 6 01 0f 1f 0d 1b 03
E: 12.663971 6 01 17 62 0f f4 04
E: 12.665975 6 01 1f 42 0e 76 03
E: 12.668040 6 01 27 fe 0c 6c 07
E: 12.669974 6 01 2f 33 02 43 06
E: 12.671936 6 01 37 3b 03 8d 04
E: 12.673964 6 01 3f cb 04 b9 04
E: 12.675962 6 01 47 17 06 f1 06
E: 12.676962 6 01 0f 1f 0d 18 03
E: 12.678953 6 01 17 62 0f f2 04
E: 12.688047 6 01 1f 42 0e 73 03
E: 12.689965 6 01 27 fb 0c 67 07
E: 12.691950 6 01 2f 40 02 17 06
E: 12.694030 6 01 37 47 03 72 04
E: 12.696030 6 01 3f d8 04 a1 04
E: 12.698030 6 01 47 20 06 da 06
E: 12.699029 6 01 0f 1e 0d 15 03
E: 12.699963 6 01 17 60 0f ef 04
E: 12.701971 6 01 1f 42 0e 70 03
E: 12.703972 6 01 27 f7 0c 61 07
E: 12.706026 6 01 2f 4c 02 f3 05
E: 12.708029 6 01 37 59 03 41 04
E: 12.709965 6 01 3f e5 04 88 04
E: 12.711975 6 01 47 3b 06 9e 06
E: 12.713027 6 01 0f 1c 0d 0d 03
E: 12.715032 6 01 17 5f 0f ee 04
E: 12.716968 6 01 1f 42 0e 6e 03
E: 12.718955 6 01 27 f3 0c 5b 07
E: 12.721031 6 01 2f 5c 02 c7 05
E: 12.722926 6 01 37 68 03 17 04
E: 12.724983 6 01 3f 01 05 58 04
E: 12.727032 6 01 47 4a 06 84 06
E: 12.728030 6 01 0f 1a 0d 08 03
E: 12.729958 6 01 17 5e 0f ec 04
E: 12.731968 6 01 1f 42 0e 6b 03
E: 12.733940 6 01 27 ef 0c 55 07
E: 12.735038 6 01 2f 77 02 a2 05
E: 12.737033 6 01 37 82 03 ee 03
E: 12.739033 6 01 3f 0d 05 42 04
E: 12.741032 6 01 47 56 06 73 06
E: 12.741943 6 01 0f 18 0d 03 03
E: 12.744034 6 01 17 5d 0f e9 04
E: 12.746034 6 01 1f 41 0e 67 03
E: 12.748010 6 01 27 de 0c 44 07
E: 12.749968 6 01 2f 82 02 96 05
E: 12.751964 6 01 37 90 03 dc 03
E: 12.753974 6 01 3f 19 05 2d 04
E: 12.756035 6 01 47 64 06 62 06
E: 12.757067 6 01 0f 14 0d fa 02
E: 12.759035 6 01 17 5a 0f e5 04
E: 12.761034 6 01 1f 3d 0e 5f 03
E: 12.762974 6 01 27 d4 0c 3b 07
E: 12.764965 6 01 2f 8d 02 84 05
E: 12.766968 6 01 37 9e 03 ca 03
E: 12.769036 6 01 3f 28 05 19 04
E: 12.771031 6 01 47 70 06 55 06
E: 12.772033 6 01 0f 0f 0d ef 02
E: 12.773979 6 01 17 57 0f e1 04
E: 12.776006 6 01 1f 3b 0e 5a 03
E: 12.778034 6 01 27 c8 0c 2f 07
E: 12.780036 6 01 2f 9b 02 6f 05
E: 12.782036 6 01 37 af 03 b9 03
E: 12.783985 6 01 3f 3d 05 01 04
E: 12.785972 6 01 47 7c 06 48 06
E: 12.787035 6 01 0f 08 0d e1 02
E: 12.788937 6 01 17 47 0f cb 04
E: 12.791039 6 01 1f 36 0e 52 03
E: 12.793038 6 01 27 bc 0c 23 07
E: 12.794978 6 01 2f b0 02 53 05
E: 12.796933 6 01 37 c0 03 a6 03
E: 12.799039 6 01 3f 4d 05 f3 03
E: 12.800980 6 01 47 8a 06 3c 06
E: 12.801972 6 01 0f fe 0c d1 02
E: 12.811044 6 01 17 33 0f b7 04
E: 12.813039 6 01 1f 2d 0e 49 03
E: 12.814983 6 01 27 a9 0c 0c 07
E: 12.817021 6 01 2f cf 02 33 05
E: 12.819039 6 01 37 df 03 85 03
E: 12.820038 6 01 3f 61 05 e4 03
E: 12.822039 6 01 47 a0 06 2c 06
E: 12.822967 6 01 0f ef 0c be 02
E: 12.832978 6 01 17 16 0f 9c 04
E: 12.834990 6 01 1f 1e 0e 3b 03
E: 12.837041 6 01 27 92 0c ef 06
E: 12.839003 6 01 2f e7 02 20 05
E: 12.841041 6 01 37 fd 03 69 03
E: 12.843042 6 01 3f 7e 05 d2 03
E: 12.843976 6 01 47 b8 06 1d 06
E: 12.844962 6 01 0f c0 0c 8c 02
E: 12.846984 6 01 17 fe 0e 88 04
E: 12.849044 6 01 1f 0c 0e 2c 03
E: 12.850988 6 01 27 7d 0c db 06
E: 12.852980 6 01 2f fc 02 10 05
E: 12.854963 6 01 37 13 04 5a 03
E: 12.856040 6 01 3f a4 05 c3 03
E: 12.858000 6 01 47 e0 06 06 06
E: 12.859048 6 01 0f b0 0c 80 02
E: 12.861044 6 01 17 ec 0e 7c 04
E: 12.863044 6 01 1f fb 0d 20 03
E: 12.864962 6 01 27 6a 0c cf 06
E: 12.866994 6 01 2f 0c 03 07 05
E: 12.868944 6 01 37 23 04 51 03
E: 12.870977 6 01 3f b5 05 bd 03
E: 12.872985 6 01 47 f0 06 ff 05
E: 12.873982 6 01 0f a3 0c 77 02
E: 12.875988 6 01 17 dd 0e 74 04
E: 12.878045 6 01 1f ea 0d 14 03
E: 12.879043 6 01 27 5e 0c c4 06
E: 12.880978 6 01 2f 1c 03 00 05
E: 12.882974 6 01 37 30 04 4a 03
E: 12.902032 6 01 3f c7 05 bc 03
E: 12.904050 6 01 47 05 07 fb 05
E: 12.905074 6 01 0f 8f 0c 6e 02
E: 12.907191 6 01 17 c6 0e 69 04
E: 12.909048 6 01 1f d1 0d 06 03
E: 12.910938 6 01 27 4c 0c ba 06
E: 12.913051 6 01 2f 30 03 fa 04
E: 12.915048 6 01 37 41 04 47 03
E: 12.924058 6 01 3f db 05 bb 03
E: 12.926049 6 01 47 18 07 fb 05
E: 12.926985 6 01 0f 79 0c 67 02
E: 12.929017 6 01 17 b2 0e 62 04
E: 12.931130 6 01 1f af 0d f8 02
E: 12.932944 6 01 27 3c 0c b8 06
E: 12.935021 6 01 2f 41 03 f8 04
E: 12.937000 6 01 37 60 04 44 03
E: 12.939055 6 01 3f e9 05 bc 03
E: 12.941055 6 01 47 29 07 fc 05
E: 12.942011 6 01 0f 63 0c 63 02
E: 12.944055 6 01 17 9f 0e 5d 04
E: 12.946265 6 01 1f 99 0d f1 02
E: 12.948052 6 01 27 2c 0c b7 06
E: 12.950006 6 01 2f 58 03 f7 04
E: 12.952050 6 01 37 6e 04 45 03
E: 12.954003 6 01 3f f8 05 be 03
E: 12.955986 6 01 47 37 07 fe 05
E: 12.957010 6 01 0f 4f 0c 60 02
E: 12.959052 6 01 17 8e 0e 5b 04
E: 12.961053 6 01 1f 87 0d ed 02
E: 12.963052 6 01 27 14 0c b7 06
E: 12.964994 6 01 2f 63 03 f8 04
E: 12.967020 6 01 37 79 04 46 03
E: 12.968985 6 01 3f 05 06 c0 03
E: 12.970968 6 01 47 43 07 01 06
E: 12.972051 6 01 0f 3f 0c 60 02
E: 12.974000 6 01 17 7d 0e 59 04
E: 12.976058 6 01 1f 79 0d ec 02
E: 12.985001 6 01 27 06 0c bc 06
E: 12.987004 6 01 2f 6e 03 fa 04
E: 12.989053 6 01 37 86 04 4c 03
E: 12.991057 6 01 3f 12 06 c5 03
E: 12.993093 6 01 47 50 07 06 06
E: 12.994052 6 01 0f 30 0c 61 02
E: 12.996053 6 01 17 6f 0e 59 04
E: 12.998024 6 01 1f 5b 0d ed 02
E: 13.000050 6 01 27 f5 0b c3 06
E: 13.002057 6 01 2f 78 03 fc 04
E: 13.004057 6 01 37 95 04 55 03
E: 13.005947 6 01 3f 1e 06 cc 03
E: 13.008079 6 01 47 66 07 13 06
E: 13.009050 6 01 0f 0c 0c 6c 02
E: 13.011049 6 01 17 56 0e 59 04
E: 13.013057 6 01 1f 4d 0d f0 02
E: 13.015058 6 01 27 e5 0b ca 06
E: 13.017017 6 01 2f 82 03 fe 04
E: 13.019002 6 01 37 a1 04 5f 03
E: 13.020995 6 01 3f 31 06 dc 03
E: 13.023034 6 01 47 6f 07 1b 06
E: 13.024057 6 01 0f fc 0b 73 02
E: 13.026061 6 01 17 4b 0e 5b 04
E: 13.028064 6 01 1f 3f 0d f3 02
E: 13.030061 6 01 27 d7 0b d3 06
E: 13.032058 6 01 2f 8a 03 01 05
E: 13.034009 6 01 37 ac 04 6a 03
E: 13.036003 6 01 3f 3b 06 e9 03
E: 13.038058 6 01 47 77 07 23 06
E: 13.039000 6 01 0f e9 0b 7c 02
E: 13.041057 6 01 17 41 0e 5e 04
E: 13.042989 6 01 1f 31 0d f7 02
E: 13.045061 6 01 27 ca 0b dc 06
E: 13.047061 6 01 2f 92 03 05 05
E: 13.049003 6 01 37 bf 04 80 03
E: 13.051073 6 01 3f 43 06 f6 03
E: 13.053063 6 01 47 7f 07 2c 06
E: 13.054061 6 01 0f d7 0b 87 02
E: 13.056062 6 01 17 37 0e 60 04
E: 13.057998 6 01 1f 21 0d fd 02
E: 13.059994 6 01 27 bc 0b ec 06
E: 13.062068 6 01 2f a1 03 12 05
E: 13.064063 6 01 37 c6 04 8a 03
E: 13.065969 6 01 3f 4b 06 03 04
E: 13.067931 6 01 47 86 07 36 06
E: 13.068925 6 01 0f c8 0b 92 02
E: 13.071075 6 01 17 2d 0e 64 04
E: 13.073063 6 01 1f 16 0d 03 03
E: 13.075059 6 01 27 a1 0b 08 07
E: 13.077063 6 01 2f a8 03 1c 05
E: 13.079098 6 01 37 cb 04 94 03
E: 13.081061 6 01 3f 52 06 11 04
E: 13.082997 6 01 47 8d 07 40 06
E: 13.084000 6 01 0f bd 0b 9c 02
E: 13.086070 6 01 17 23 0e 67 04
E: 13.087064 6 01 1f 00 0d 0f 03
E: 13.089064 6 01 27 98 0b 12 07
E: 13.091069 6 01 2f b0 03 25 05
E: 13.093065 6 01 37 d1 04 9e 03
E: 13.095062 6 01 3f 58 06 1b 04
E: 13.097065 6 01 47 93 07 4b 06
E: 13.098065 6 01 0f b3 0b a5 02
E: 13.100018 6 01 17 0e 0e 70 04
E: 13.101964 6 01 1f f7 0c 15 03
E: 13.104071 6 01 27 91 0b 18 07
E: 13.106067 6 01 2f b7 03 30 05
E: 13.108067 6 01 37 d5 04 a6 03
E: 13.110064 6 01 3f 5d 06 28 04
E: 13.112067 6 01 47 99 07 56 06
E: 13.112998 6 01 0f ac 0b ad 02
E: 13.122953 6 01 17 06 0e 75 04
E: 13.125073 6 01 1f ee 0c 1b 03
E: 13.127066 6 01 27 8c 0b 1c 07
E: 13.129069 6 01 2f bd 03 3b 05
E: 13.131168 6 01 37 d9 04 b0 03
E: 13.133000 6 01 3f 62 06 33 04
E: 13.135072 6 01 47 9e 07 60 06
E: 13.136021 6 01 0f a0 0b b8 02
E: 13.138066 6 01 17 ff 0d 79 04
E: 13.140068 6 01 1f e7 0c 1f 03
E: 13.142069 6 01 27 88 0b 1f 07
E: 13.144067 6 01 2f c1 03 42 05
E: 13.146010 6 01 37 dc 04 b9 03
E: 13.148015 6 01 3f 66 06 3f 04
E: 13.149069 6 01 47 a7 07 73 06
E: 13.149946 6 01 0f 9c 0b bc 02
E: 13.152107 6 01 17 f9 0d 7e 04
E: 13.153984 6 01 1f e2 0c 23 03
E: 13.156012 6 01 27 85 0b 22 07
E: 13.158007 6 01 2f c5 03 49 05
E: 13.160070 6 01 37 e0 04 c6 03
E: 13.162073 6 01 3f 6d 06 52 04
E: 13.164070 6 01 47 aa 07 7a 06
E: 13.164987 6 01 0f 99 0b bf 02
E: 13.167049 6 01 17 f4 0d 82 04
E: 13.169014 6 01 1f de 0c 27 03
E: 13.170986 6 01 27 82 0b 24 07
E: 13.173068 6 01 2f c8 03 4e 05
E: 13.175071 6 01 37 e5 04 d7 03
E: 13.177167 6 01 3f 6f 06 58 04
E: 13.179152 6 01 47 ac 07 80 06
E: 13.180072 6 01 0f 97 0b c2 02
E: 13.182000 6 01 17 ef 0d 85 04
E: 13.184079 6 01 1f da 0c 2a 03
E: 13.186075 6 01 27 80 0b 25 07
E: 13.188071 6 01 2f ca 03 54 05
E: 13.190074 6 01 37 e7 04 de 03
E: 13.192028 6 01 3f 71 06 5e 04
E: 13.194014 6 01 47 ae 07 84 06
E: 13.195066 6 01 0f 94 0b c4 02
E: 13.197030 6 01 17 eb 0d 88 04
E: 13.199072 6 01 1f d6 0c 2c 03
E: 13.201083 6 01 27 7e 0b 26 07
E: 13.203076 6 01 2f cf 03 5d 05
E: 13.205070 6 01 37 e9 04 e5 03
E: 13.207076 6 01 3f 73 06 63 04
E: 13.209023 6 01 47 b0 07 88 06
E: 13.210074 6 01 0f 93 0b c6 02
E: 13.212083 6 01 17 e9 0d 8a 04
E: 13.214075 6 01 1f d4 0c 2e 03
E: 13.216011 6 01 27 7c 0b 28 07
E: 13.218080 6 01 2f d0 03 60 05
E: 13.219953 6 01 37 ea 04 eb 03
E: 13.222010 6 01 3f 74 06 66 04
E: 13.224005 6 01 47 b2 07 8c 06
E: 13.225075 6 01 0f 91 0b c7 02
E: 13.227000 6 01 17 e6 0d 8c 04
E: 13.227995 6 01 1f d0 0c 30 03
E: 13.230009 6 01 27 7a 0b 28 07
E: 13.232079 6 01 2f d2 03 63 05
E: 13.234084 6 01 37 ec 04 f0 03
E: 13.236079 6 01 3f 75 06 6a 04
E: 13.238077 6 01 47 b3 07 8e 06
E: 13.239000 6 01 0f 8f 0b c9 02
E: 13.241024 6 01 17 e2 0d 8e 04
E: 13.243076 6 01 1f ce 0c 31 03
E: 13.245015 6 01 27 79 0b 29 07
E: 13.247078 6 01 2f d3 03 66 05
E: 13.249078 6 01 37 ee 04 f5 03
E: 13.251023 6 01 3f 76 06 6c 04
E: 13.253080 6 01 47 b4 07 91 06
E: 13.254015 6 01 0f 8d 0b ca 02
E: 13.256057 6 01 17 e1 0d 8f 04
E: 13.258072 6 01 1f cd 0c 31 03
E: 13.260072 6 01 27 78 0b 2a 07
E: 13.262033 6 01 2f d4 03 68 05
E: 13.264036 6 01 37 ef 04 f9 03
E: 13.265960 6 01 3f 77 06 6f 04
E: 13.268082 6 01 47 b6 07 95 06
E: 13.269081 6 01 0f 8c 0b cb 02
E: 13.271008 6 01 17 df 0d 8f 04
E: 13.273011 6 01 1f cc 0c 32 03
E: 13.274969 6 01 27 77 0b 2a 07
E: 13.277018 6 01 2f d6 03 6a 05
E: 13.279024 6 01 37 f1 04 fd 03
E: 13.281080 6 01 3f 78 06 72 04
E: 13.282972 6 01 47 b7 07 96 06
E: 13.284078 6 01 0f 8b 0b cc 02
E: 13.286010 6 01 17 de 0d 90 04
E: 13.288015 6 01 1f cb 0c 32 03
E: 13.290079 6 01 27 76 0b 2a 07
E: 13.292005 6 01 2f d7 03 6b 05
E: 13.294019 6 01 37 f3 04 01 04
E: 13.302102 6 01 47 b7 07 98 06
E: 13.303019 6 01 0f 8b 0b cd 02
E: 13.305028 6 01 17 dd 0d 90 04
E: 13.307021 6 01 1f ca 0c 32 03
E: 13.309082 6 01 2f d8 03 6c 05
E: 13.313086 6 01 0f 89 0b cc 02
E: 13.315023 6 01 27 75 0b 29 07
E: 13.323094 6 01 36 08 05 30 04
E: 13.325084 6 01 3e 84 06 8f 04
E: 13.326023 6 01 17 dc 0d 8f 04
E: 13.332081 6 01 1e b6 0c 28 03
E: 13.334075 6 01 2e f3 03 81 05
E: 13.336073 6 01 46 bd 07 bd 06
E: 13.341256 6 01 0e 6d 0b bf 02
E: 13.342986 6 01 26 66 0b 20 07
E: 13.350069 6 01 16 d0 0d 89 04
# Thank you.
