R: 177 05 0d 09 04 a1 01 85 01 09 22 a1 02 09 42 15 00 25 01 75 01 95 01 81 02 09 32 81 02 09 47 81 02 95 05 81 03 09 51 75 08 95 01 81 02 05 01 35 00 55 0e 65 33 75 10 95 01 09 30 26 ff 4b 46 70 03 81 02 09 31 26 ff 2b 46 f1 01 81 02 46 00 00 c0 a1 02 05 0d 09 42 15 00 25 01 75 01 95 01 81 02 09 32 81 02 09 47 81 02 95 05 81 03 09 51 75 08 95 01 81 02 05 01 35 00 55 0e 65 33 75 10 95 01 09 30 26 ff 4b 46 70 03 81 02 09 31 26 ff 2b 46 f1 01 81 02 46 00 00 c0 05 0d 09 54 75 08 95 01 81 02 05 0d 85 02 09 55 25 02 75 08 95 01 b1 02 c0
N: CDT   10.1 
I: 3 03eb 201c
E: 667.847329 14 01 07 01 87 0e 3e 11 04 02 cf 43 02 02 02
E: 667.855308 14 01 07 01 85 0e 3e 11 04 02 cf 43 02 02 02
E: 667.867304 14 01 07 01 80 0e 3d 11 04 02 cf 43 02 02 02
E: 667.875338 14 01 07 01 79 0e 3c 11 04 02 cf 43 02 02 02
E: 667.883325 14 01 07 01 73 0e 39 11 04 02 cf 43 02 02 02
E: 667.891303 14 01 07 01 6d 0e 37 11 04 02 cf 43 02 02 02
E: 667.899304 14 01 07 01 67 0e 32 11 04 02 cf 43 02 02 02
E: 667.911296 14 01 07 01 62 0e 2b 11 04 02 cf 43 02 02 02
E: 667.919281 14 01 07 01 5e 0e 25 11 04 02 cf 43 02 02 02
E: 667.927325 14 01 07 01 5a 0e 1d 11 04 02 cf 43 02 02 02
E: 667.935222 14 01 07 01 57 0e 15 11 04 02 cf 43 02 02 02
E: 667.943215 14 01 07 01 56 0e 08 11 04 02 cf 43 02 02 02
E: 667.951221 14 01 07 01 57 0e f3 10 04 02 cf 43 02 02 02
E: 667.963261 14 01 07 01 5b 0e d6 10 04 02 cf 43 02 02 02
E: 667.971509 14 01 07 01 61 0e b3 10 04 02 cf 43 02 02 02
E: 667.979502 14 01 07 01 6e 0e 78 10 04 02 cf 43 02 02 02
E: 667.987202 14 01 07 01 83 0e 39 10 04 02 cf 43 02 02 02
E: 667.995202 14 01 07 01 9b 0e f2 0f 04 02 cf 43 02 02 02
E: 668.007298 14 01 07 01 c4 0e 8e 0f 04 02 cf 43 02 02 02
E: 668.015217 14 01 07 01 f3 0e 27 0f 04 02 cf 43 02 02 02
E: 668.023305 14 01 07 01 21 0f c0 0e 04 02 cf 43 02 02 02
E: 668.035300 14 01 07 01 57 0f 5b 0e 04 02 cf 43 02 02 02
E: 668.043217 14 01 07 01 97 0f ed 0d 04 02 cf 43 02 02 02
E: 668.051382 14 01 07 01 db 0f 84 0d 04 02 cf 43 02 02 02
E: 668.059326 14 01 07 01 28 10 18 0d 04 02 cf 43 02 02 02
E: 668.067223 14 01 07 01 7d 10 b1 0c 04 02 cf 43 02 02 02
E: 668.075316 14 01 07 01 d3 10 4d 0c 04 02 cf 43 02 02 02
E: 668.087235 14 01 07 01 31 11 e3 0b 04 02 cf 43 02 02 02
E: 668.095216 14 01 07 01 ab 11 62 0b 04 02 cf 43 02 02 02
E: 668.103264 14 01 07 01 27 12 e9 0a 04 02 cf 43 02 02 02
E: 668.111321 14 01 07 01 87 12 91 0a 04 02 cf 43 02 02 02
E: 668.119322 14 01 07 01 ed 12 3c 0a 04 02 cf 43 02 02 02
E: 668.131319 14 01 07 01 57 13 df 09 04 02 cf 43 02 02 02
E: 668.139221 14 01 07 01 e3 13 73 09 04 02 cf 43 02 02 02
E: 668.147251 14 01 07 01 4f 14 26 09 04 02 cf 43 02 02 02
E: 668.155317 14 01 07 01 bb 14 d9 08 04 02 cf 43 02 02 02
E: 668.163221 14 01 07 01 29 15 91 08 04 02 cf 43 02 02 02
E: 668.175312 14 01 07 01 9c 15 52 08 04 02 cf 43 02 02 02
E: 668.183350 14 01 07 01 14 16 14 08 04 02 cf 43 02 02 02
E: 668.191427 14 01 07 01 8a 16 d4 07 04 02 cf 43 02 02 02
E: 668.199516 14 01 07 01 00 17 90 07 04 02 cf 43 02 02 02
E: 668.207317 14 01 07 01 7b 17 4f 07 04 02 cf 43 02 02 02
E: 668.215247 14 01 07 01 fa 17 13 07 04 02 cf 43 02 02 02
E: 668.227283 14 01 07 01 75 18 d8 06 04 02 cf 43 02 02 02
E: 668.235323 14 01 07 01 ee 18 a2 06 04 02 cf 43 02 02 02
E: 668.243327 14 01 07 01 6a 19 67 06 04 02 cf 43 02 02 02
E: 668.251300 14 01 07 01 0d 1a 24 06 04 02 cf 43 02 02 02
E: 668.259303 14 01 07 01 84 1a f5 05 04 02 cf 43 02 02 02
E: 668.271252 14 01 07 01 fc 1a d0 05 04 02 cf 43 02 02 02
E: 668.279322 14 01 07 01 79 1b a6 05 04 02 cf 43 02 02 02
E: 668.287332 14 01 07 01 19 1c 7b 05 04 02 cf 43 02 02 02
E: 668.295223 14 01 07 01 8e 1c 57 05 04 02 cf 43 02 02 02
E: 668.303335 14 01 07 01 04 1d 3a 05 04 02 cf 43 02 02 02
E: 668.315214 14 01 07 01 7e 1d 22 05 04 02 cf 43 02 02 02
E: 668.323222 14 01 07 01 f8 1d 0e 05 04 02 cf 43 02 02 02
E: 668.331216 14 01 07 01 6f 1e fd 04 04 02 cf 43 02 02 02
E: 668.339242 14 01 07 01 e6 1e ed 04 04 02 cf 43 02 02 02
E: 668.347462 14 01 07 01 5b 1f e1 04 04 02 cf 43 02 02 02
E: 668.355342 14 01 07 01 d3 1f d7 04 04 02 cf 43 02 02 02
E: 668.367314 14 01 07 01 47 20 d0 04 04 02 cf 43 02 02 02
E: 668.375302 14 01 07 01 b7 20 cb 04 04 02 cf 43 02 02 02
E: 668.383208 14 01 07 01 26 21 cb 04 04 02 cf 43 02 02 02
E: 668.391215 14 01 07 01 98 21 cd 04 04 02 cf 43 02 02 02
E: 668.399382 14 01 07 01 0a 22 d2 04 04 02 cf 43 02 02 02
E: 668.411212 14 01 07 01 74 22 dc 04 04 02 cf 43 02 02 02
E: 668.419250 14 01 07 01 df 22 ee 04 04 02 cf 43 02 02 02
E: 668.427389 14 01 07 01 49 23 08 05 04 02 cf 43 02 02 02
E: 668.435303 14 01 07 01 b8 23 22 05 04 02 cf 43 02 02 02
E: 668.443217 14 01 07 01 27 24 37 05 04 02 cf 43 02 02 02
E: 668.454230 14 01 07 01 91 24 4f 05 04 02 cf 43 02 02 02
E: 668.463268 14 01 07 01 fc 24 69 05 04 02 cf 43 02 02 02
E: 668.471224 14 01 07 01 65 25 85 05 04 02 cf 43 02 02 02
E: 668.479323 14 01 07 01 d1 25 a4 05 04 02 cf 43 02 02 02
E: 668.487198 14 01 07 01 40 26 c8 05 04 02 cf 43 02 02 02
E: 668.495200 14 01 07 01 ae 26 ed 05 04 02 cf 43 02 02 02
E: 668.507509 14 01 07 01 18 27 14 06 04 02 cf 43 02 02 02
E: 668.515028 14 01 07 01 85 27 3a 06 04 02 cf 43 02 02 02
E: 668.523234 14 01 07 01 f5 27 67 06 04 02 cf 43 02 02 02
E: 668.531311 14 01 07 01 61 28 9c 06 04 02 cf 43 02 02 02
E: 668.539219 14 01 07 01 cb 28 d0 06 04 02 cf 43 02 02 02
E: 668.551208 14 01 07 01 34 29 02 07 04 02 cf 43 02 02 02
E: 668.559284 14 01 07 01 a0 29 2f 07 04 02 cf 43 02 02 02
E: 668.567198 14 01 07 01 10 2a 60 07 04 02 cf 43 02 02 02
E: 668.579319 14 01 07 01 78 2a 92 07 04 02 cf 43 02 02 02
E: 668.587343 14 01 07 01 e0 2a c8 07 04 02 cf 43 02 02 02
E: 668.595024 14 01 07 01 46 2b ff 07 04 02 cf 43 02 02 02
E: 668.603198 14 01 07 01 ab 2b 39 08 04 02 cf 43 02 02 02
E: 668.611316 14 01 07 01 0d 2c 77 08 04 02 cf 43 02 02 02
E: 668.623228 14 01 07 01 6d 2c b4 08 04 02 cf 43 02 02 02
E: 668.631225 14 01 07 01 c7 2c ec 08 04 02 cf 43 02 02 02
E: 668.639197 14 01 07 01 1c 2d 21 09 04 02 cf 43 02 02 02
E: 668.647469 14 01 07 01 6e 2d 56 09 04 02 cf 43 02 02 02
E: 668.655322 14 01 07 01 a6 2d 7d 09 04 02 cf 43 02 02 02
E: 668.663498 14 01 07 01 e1 2d a7 09 04 02 cf 43 02 02 02
E: 668.675309 14 01 07 01 32 2e e2 09 04 02 cf 43 02 02 02
E: 668.683203 14 01 07 01 67 2e 0c 0a 04 02 cf 43 02 02 02
E: 668.691204 14 01 07 01 ae 2e 4d 0a 04 02 cf 43 02 02 02
E: 668.699215 14 01 07 01 db 2e 7c 0a 04 02 cf 43 02 02 02
E: 668.707295 14 01 07 01 14 2f bd 0a 04 02 cf 43 02 02 02
E: 668.719206 14 01 07 01 3a 2f eb 0a 04 02 cf 43 02 02 02
E: 668.727332 14 01 07 01 6a 2f 2e 0b 04 02 cf 43 02 02 02
E: 668.735369 14 01 07 01 87 2f 60 0b 04 02 cf 43 02 02 02
E: 668.743016 14 01 07 01 a2 2f 92 0b 04 02 cf 43 02 02 02
E: 668.751292 14 01 07 01 ba 2f c5 0b 04 02 cf 43 02 02 02
E: 668.763306 14 01 07 01 d1 2f f9 0b 04 02 cf 43 02 02 02
E: 668.771248 14 01 07 01 e6 2f 2f 0c 04 02 cf 43 02 02 02
E: 668.779281 14 01 07 01 fa 2f 64 0c 04 02 cf 43 02 02 02
E: 668.787195 14 01 07 01 0c 30 96 0c 04 02 cf 43 02 02 02
E: 668.795244 14 01 07 01 1d 30 c6 0c 04 02 cf 43 02 02 02
E: 668.803200 14 01 07 01 2e 30 f5 0c 04 02 cf 43 02 02 02
E: 668.815013 14 01 07 01 3e 30 25 0d 04 02 cf 43 02 02 02
E: 668.823015 14 01 07 01 4f 30 56 0d 04 02 cf 43 02 02 02
E: 668.831211 14 01 07 01 5c 30 88 0d 04 02 cf 43 02 02 02
E: 668.839012 14 01 07 01 6b 30 bb 0d 04 02 cf 43 02 02 02
E: 668.847299 14 01 07 01 7b 30 f0 0d 04 02 cf 43 02 02 02
E: 668.859361 14 01 07 01 8b 30 29 0e 04 02 cf 43 02 02 02
E: 668.867194 14 01 07 01 9d 30 65 0e 04 02 cf 43 02 02 02
E: 668.875363 14 01 07 01 ab 30 9f 0e 04 02 cf 43 02 02 02
E: 668.887307 14 01 07 01 bd 30 f4 0e 04 02 cf 43 02 02 02
E: 668.895021 14 01 07 01 c7 30 4c 0f 04 02 cf 43 02 02 02
E: 668.903199 14 01 07 01 cc 30 a3 0f 04 02 cf 43 02 02 02
E: 668.911278 14 01 07 01 ce 30 01 10 04 02 cf 43 02 02 02
E: 668.923306 14 01 07 01 c8 30 60 10 04 02 cf 43 02 02 02
E: 668.931248 14 01 07 01 c2 30 b5 10 04 02 cf 43 02 02 02
E: 668.939213 14 01 07 01 c2 30 b5 10 04 02 cf 43 02 02 02
E: 668.959297 14 01 07 01 c2 30 b5 10 04 02 cf 43 02 02 02
E: 668.971200 14 01 07 01 a2 30 87 11 04 02 cf 43 02 02 02
E: 668.979451 14 01 07 01 86 30 2f 12 04 02 cf 43 02 02 02
E: 668.987466 14 01 07 01 6d 30 bc 12 04 02 cf 43 02 02 02
E: 668.995022 14 01 07 01 5d 30 22 13 04 02 cf 43 02 02 02
E: 669.007210 14 01 07 01 4e 30 83 13 04 02 cf 43 02 02 02
E: 669.015015 14 01 07 01 3f 30 ec 13 04 02 cf 43 02 02 02
E: 669.023293 14 01 07 01 31 30 4f 14 04 02 cf 43 02 02 02
E: 669.031085 14 01 07 01 24 30 ab 14 04 02 cf 43 02 02 02
E: 669.043018 14 01 07 01 1a 30 06 15 04 02 cf 43 02 02 02
E: 669.051189 14 01 07 01 10 30 63 15 04 02 cf 43 02 02 02
E: 669.059288 14 01 07 01 09 30 c0 15 04 02 cf 43 02 02 02
E: 669.067290 14 01 07 01 02 30 1f 16 04 02 cf 43 02 02 02
E: 669.079207 14 01 07 01 fe 2f 7b 16 04 02 cf 43 02 02 02
E: 669.087247 14 01 07 01 fb 2f d5 16 04 02 cf 43 02 02 02
E: 669.095303 14 01 07 01 fb 2f 31 17 04 02 cf 43 02 02 02
E: 669.103023 14 01 07 01 fc 2f 8e 17 04 02 cf 43 02 02 02
E: 669.115211 14 01 07 01 fc 2f ed 17 04 02 cf 43 02 02 02
E: 669.123189 14 01 07 01 ff 2f 4b 18 04 02 cf 43 02 02 02
E: 669.131303 14 01 07 01 04 30 a4 18 04 02 cf 43 02 02 02
E: 669.139176 14 01 07 01 09 30 fb 18 04 02 cf 43 02 02 02
E: 669.147282 14 01 07 01 0f 30 53 19 04 02 cf 43 02 02 02
E: 669.159443 14 01 07 01 16 30 ad 19 04 02 cf 43 02 02 02
E: 669.167211 14 01 07 01 1d 30 10 1a 04 02 cf 43 02 02 02
E: 669.175209 14 01 07 01 25 30 6e 1a 04 02 cf 43 02 02 02
E: 669.183493 14 01 07 01 2d 30 ca 1a 04 02 cf 43 02 02 02
E: 669.191284 14 01 07 01 35 30 29 1b 04 02 cf 43 02 02 02
E: 669.203011 14 01 07 01 3e 30 84 1b 04 02 cf 43 02 02 02
E: 669.211022 14 01 07 01 48 30 eb 1b 04 02 cf 43 02 02 02
E: 669.219012 14 01 07 01 57 30 50 1c 04 02 cf 43 02 02 02
E: 669.227298 14 01 07 01 65 30 b3 1c 04 02 cf 43 02 02 02
E: 669.235180 14 01 07 01 78 30 19 1d 04 02 cf 43 02 02 02
E: 669.243274 14 01 07 01 90 30 7d 1d 04 02 cf 43 02 02 02
E: 669.255012 14 01 07 01 af 30 e6 1d 04 02 cf 43 02 02 02
E: 669.263020 14 01 07 01 ce 30 49 1e 04 02 cf 43 02 02 02
E: 669.271204 14 01 07 01 f6 30 ab 1e 04 02 cf 43 02 02 02
E: 669.283374 14 01 07 01 20 31 0f 1f 04 02 cf 43 02 02 02
E: 669.291232 14 01 07 01 50 31 6f 1f 04 02 cf 43 02 02 02
E: 669.299018 14 01 07 01 84 31 d0 1f 04 02 cf 43 02 02 02
E: 669.307200 14 01 07 01 bc 31 32 20 04 02 cf 43 02 02 02
E: 669.319179 14 01 07 01 f7 31 85 20 04 02 cf 43 02 02 02
E: 669.327017 14 01 07 01 3d 32 d2 20 04 02 cf 43 02 02 02
E: 669.335279 14 01 07 01 8a 32 1a 21 04 02 cf 43 02 02 02
E: 669.347205 14 01 07 01 da 32 61 21 04 02 cf 43 02 02 02
E: 669.355011 14 01 07 01 36 33 a0 21 04 02 cf 43 02 02 02
E: 669.363269 14 01 07 01 94 33 d6 21 04 02 cf 43 02 02 02
E: 669.371299 14 01 07 01 fc 33 05 22 04 02 cf 43 02 02 02
E: 669.383187 14 01 07 01 66 34 2d 22 04 02 cf 43 02 02 02
E: 669.391304 14 01 07 01 d4 34 4a 22 04 02 cf 43 02 02 02
E: 669.399286 14 01 07 01 45 35 60 22 04 02 cf 43 02 02 02
E: 669.407024 14 01 07 01 b7 35 6f 22 04 02 cf 43 02 02 02
E: 669.415282 14 01 07 01 2c 36 75 22 04 02 cf 43 02 02 02
E: 669.427256 14 01 07 01 9f 36 72 22 04 02 cf 43 02 02 02
E: 669.435349 14 01 07 01 10 37 66 22 04 02 cf 43 02 02 02
E: 669.443337 14 01 07 01 81 37 4d 22 04 02 cf 43 02 02 02
E: 669.451265 14 01 07 01 f8 37 27 22 04 02 cf 43 02 02 02
E: 669.459257 14 01 07 01 66 38 fb 21 04 02 cf 43 02 02 02
E: 669.471241 14 01 07 01 d4 38 ca 21 04 02 cf 43 02 02 02
E: 669.479027 14 01 07 01 42 39 8d 21 04 02 cf 43 02 02 02
E: 669.487019 14 01 07 01 aa 39 4b 21 04 02 cf 43 02 02 02
E: 669.495028 14 01 07 01 10 3a 09 21 04 02 cf 43 02 02 02
E: 669.503262 14 01 07 01 76 3a bd 20 04 02 cf 43 02 02 02
E: 669.511181 14 01 07 01 d9 3a 6c 20 04 02 cf 43 02 02 02
E: 669.523012 14 01 07 01 40 3b 15 20 04 02 cf 43 02 02 02
E: 669.531286 14 01 07 01 c4 3b 98 1f 04 02 cf 43 02 02 02
E: 669.539197 14 01 07 01 14 3c 3c 1f 04 02 cf 43 02 02 02
E: 669.547195 14 01 07 01 73 3c d8 1e 04 02 cf 43 02 02 02
E: 669.555194 14 01 07 01 c7 3c 79 1e 04 02 cf 43 02 02 02
E: 669.567297 14 01 07 01 17 3d 19 1e 04 02 cf 43 02 02 02
E: 669.575180 14 01 07 01 61 3d be 1d 04 02 cf 43 02 02 02
E: 669.583189 14 01 07 01 a1 3d 68 1d 04 02 cf 43 02 02 02
E: 669.591220 14 01 07 01 d7 3d 12 1d 04 02 cf 43 02 02 02
E: 669.599013 14 01 07 01 11 3e b8 1c 04 02 cf 43 02 02 02
E: 669.611183 14 01 07 01 4e 3e 54 1c 04 02 cf 43 02 02 02
E: 669.619274 14 01 07 01 86 3e e5 1b 04 02 cf 43 02 02 02
E: 669.627344 14 01 07 01 cf 3e 3e 1b 04 02 cf 43 02 02 02
E: 669.635283 14 01 07 01 ff 3e bf 1a 04 02 cf 43 02 02 02
E: 669.647196 14 01 07 01 34 3f 1c 1a 04 02 cf 43 02 02 02
E: 669.655223 14 01 07 01 63 3f 7c 19 04 02 cf 43 02 02 02
E: 669.663325 14 01 07 01 8b 3f dc 18 04 02 cf 43 02 02 02
E: 669.671019 14 01 07 01 a9 3f 67 18 04 02 cf 43 02 02 02
E: 669.679261 14 01 07 01 c8 3f ed 17 04 02 cf 43 02 02 02
E: 669.691174 14 01 07 01 e1 3f 66 17 04 02 cf 43 02 02 02
E: 669.699291 14 01 07 01 09 40 b8 16 04 02 cf 43 02 02 02
E: 669.707024 14 01 07 01 24 40 34 16 04 02 cf 43 02 02 02
E: 669.715016 14 01 07 01 41 40 a5 15 04 02 cf 43 02 02 02
E: 669.723123 14 01 07 01 66 40 ec 14 04 02 cf 43 02 02 02
E: 669.735011 14 01 07 01 99 40 35 14 04 02 cf 43 02 02 02
E: 669.743205 14 01 07 01 b6 40 6d 13 04 02 cf 43 02 02 02
E: 669.751221 14 01 07 01 d4 40 b0 12 04 02 cf 43 02 02 02
E: 669.759220 14 01 07 01 ec 40 f7 11 04 02 cf 43 02 02 02
E: 669.767216 14 01 07 01 fc 40 3f 11 04 02 cf 43 02 02 02
E: 669.775238 14 01 07 01 05 41 b8 10 04 02 cf 43 02 02 02
E: 669.787016 14 01 07 01 0a 41 31 10 04 02 cf 43 02 02 02
E: 669.795017 14 01 07 01 09 41 7b 0f 04 02 cf 43 02 02 02
E: 669.803183 14 01 07 01 00 41 f2 0e 04 02 cf 43 02 02 02
E: 669.815010 14 01 07 01 f2 40 6a 0e 04 02 cf 43 02 02 02
E: 669.823221 14 01 07 01 cd 40 c5 0d 04 02 cf 43 02 02 02
E: 669.831291 14 01 07 01 a8 40 22 0d 04 02 cf 43 02 02 02
E: 669.839195 14 01 07 01 80 40 ac 0c 04 02 cf 43 02 02 02
E: 669.847231 14 01 07 01 51 40 33 0c 04 02 cf 43 02 02 02
E: 669.855217 14 01 07 01 1d 40 bf 0b 04 02 cf 43 02 02 02
E: 669.867011 14 01 07 01 df 3f 4c 0b 04 02 cf 43 02 02 02
E: 669.875185 14 01 07 01 9b 3f de 0a 04 02 cf 43 02 02 02
E: 669.883169 14 01 07 01 4f 3f 7b 0a 04 02 cf 43 02 02 02
E: 669.891339 14 01 07 01 fa 3e 20 0a 04 02 cf 43 02 02 02
E: 669.899176 14 01 07 01 9c 3e ca 09 04 02 cf 43 02 02 02
E: 669.911176 14 01 07 01 3b 3e 7d 09 04 02 cf 43 02 02 02
E: 669.919186 14 01 07 01 d8 3d 39 09 04 02 cf 43 02 02 02
E: 669.927397 14 01 07 01 75 3d fa 08 04 02 cf 43 02 02 02
E: 669.935272 14 01 07 01 13 3d c2 08 04 02 cf 43 02 02 02
E: 669.943011 14 01 07 01 b5 3c 92 08 04 02 cf 43 02 02 02
E: 669.954220 14 01 07 01 79 3c 73 08 04 02 cf 43 02 02 02
E: 669.963013 14 01 07 01 3d 3c 55 08 04 02 cf 43 02 02 02
E: 669.971194 14 01 07 01 05 3c 3c 08 04 02 cf 43 02 02 02
E: 669.979172 14 01 07 01 d1 3b 27 08 04 02 cf 43 02 02 02
E: 669.987207 14 01 07 01 a8 3b 17 08 04 02 cf 43 02 02 02
E: 669.995262 14 01 07 01 90 3b 10 08 04 02 cf 43 02 02 02
E: 670.007170 14 01 07 01 7c 3b 12 08 04 02 cf 43 02 02 02
E: 670.015030 14 01 07 01 57 3b 20 08 04 02 cf 43 02 02 02
E: 670.023273 14 01 06 01 57 3b 20 08 04 02 cf 43 02 02 02
E: 670.031265 14 01 04 01 57 3b 20 08 04 02 cf 43 02 02 02
E: 683.163042 14 01 07 01 fe 4b 8c 00 04 02 cf 43 02 02 02
E: 683.171054 14 01 07 01 fe 4b 86 00 04 02 cf 43 02 02 02
E: 683.179019 14 01 07 01 fe 4b 7f 00 04 02 cf 43 02 02 02
E: 683.191022 14 01 07 01 fe 4b 79 00 04 02 cf 43 02 02 02
E: 683.199016 14 01 07 01 fe 4b 6e 00 04 02 cf 43 02 02 02
E: 683.206929 14 01 07 01 fe 4b 6a 00 04 02 cf 43 02 02 02
E: 683.215092 14 01 07 01 fe 4b 64 00 04 02 cf 43 02 02 02
E: 683.222950 14 01 07 01 fe 4b 5f 00 04 02 cf 43 02 02 02
E: 683.234999 14 01 07 01 fe 4b 57 00 04 02 cf 43 02 02 02
E: 683.243205 14 01 07 01 fe 4b 55 00 04 02 cf 43 02 02 02
E: 683.251016 14 01 07 01 fe 4b 53 00 04 02 cf 43 02 02 02
E: 683.259052 14 01 07 01 fe 4b 4d 00 04 02 cf 43 02 02 02
E: 683.267024 14 01 07 01 fe 4b 49 00 04 02 cf 43 02 02 02
E: 683.278932 14 01 07 01 fe 4b 47 00 04 02 cf 43 02 02 02
E: 683.286954 14 01 07 01 fe 4b 47 00 04 02 cf 43 02 02 02
E: 683.295024 14 01 07 01 fe 4b 47 00 04 02 cf 43 02 02 02
E: 683.303019 14 01 07 01 fe 4b 47 00 04 02 cf 43 02 02 02
E: 683.310976 14 01 07 01 fe 4b 44 00 04 02 cf 43 02 02 02
E: 683.318962 14 01 07 01 fe 4b 44 00 04 02 cf 43 02 02 02
E: 683.331031 14 01 07 01 fe 4b 43 00 04 02 cf 43 02 02 02
E: 683.339056 14 01 07 01 fe 4b 43 00 04 02 cf 43 02 02 02
E: 683.346942 14 01 07 01 fe 4b 42 00 04 02 cf 43 02 02 02
E: 683.355093 14 01 07 01 fe 4b 42 00 04 02 cf 43 02 02 02
E: 683.363016 14 01 07 01 fe 4b 41 00 04 02 cf 43 02 02 02
E: 683.374939 14 01 07 01 fe 4b 40 00 04 02 cf 43 02 02 02
E: 683.383040 14 01 07 01 fe 4b 3f 00 04 02 cf 43 02 02 02
E: 683.391208 14 01 07 01 fe 4b 40 00 04 02 cf 43 02 02 02
E: 683.403050 14 01 07 01 fe 4b 41 00 04 02 cf 43 02 02 02
E: 683.410946 14 01 07 01 fe 4b 42 00 04 02 cf 43 02 02 02
E: 683.419019 14 01 07 01 fe 4b 42 00 04 02 cf 43 02 02 02
E: 683.427015 14 01 07 01 fe 4b 42 00 04 02 cf 43 02 02 02
E: 683.435019 14 01 07 01 fe 4b 42 00 04 02 cf 43 02 02 02
E: 683.442945 14 01 07 01 fe 4b 42 00 04 02 cf 43 02 02 02
E: 683.454225 14 01 07 01 fe 4b 42 00 04 02 cf 43 02 02 02
E: 683.462940 14 01 07 01 fe 4b 42 00 04 02 cf 43 02 02 02
E: 683.470942 14 01 07 01 fe 4b 42 00 04 02 cf 43 02 02 02
E: 683.479229 14 01 07 01 fe 4b 42 00 04 02 cf 43 02 02 02
E: 683.486923 14 01 07 01 fe 4b 42 00 04 02 cf 43 02 02 02
E: 683.498938 14 01 07 01 fe 4b 3f 00 04 02 cf 43 02 02 02
E: 683.507202 14 01 07 01 fe 4b 3e 00 04 02 cf 43 02 02 02
E: 683.514927 14 01 07 01 fe 4b 3d 00 04 02 cf 43 02 02 02
E: 683.522950 14 01 07 01 fe 4b 3e 00 04 02 cf 43 02 02 02
E: 683.530935 14 01 07 01 fe 4b 3d 00 04 02 cf 43 02 02 02
E: 683.543205 14 01 07 01 fe 4b 3e 00 04 02 cf 43 02 02 02
E: 683.550923 14 01 07 01 fe 4b 3f 00 04 02 cf 43 02 02 02
E: 683.558937 14 01 07 01 fe 4b 40 00 04 02 cf 43 02 02 02
E: 683.567024 14 01 07 01 fe 4b 3f 00 04 02 cf 43 02 02 02
E: 683.574926 14 01 07 01 fe 4b 40 00 04 02 cf 43 02 02 02
E: 683.587034 14 01 07 01 fe 4b 3c 00 04 02 cf 43 02 02 02
E: 683.595198 14 01 07 01 fe 4b 3d 00 04 02 cf 43 02 02 02
E: 683.603016 14 01 07 01 fe 4b 3a 00 04 02 cf 43 02 02 02
E: 683.611044 14 01 07 01 fe 4b 3b 00 04 02 cf 43 02 02 02
E: 683.619027 14 01 07 01 fe 4b 3c 00 04 02 cf 43 02 02 02
E: 683.630921 14 01 07 01 fe 4b 3d 00 04 02 cf 43 02 02 02
E: 683.638941 14 01 07 01 fe 4b 3e 00 04 02 cf 43 02 02 02
E: 683.646936 14 01 07 01 fe 4b 3a 00 04 02 cf 43 02 02 02
E: 683.655200 14 01 07 01 fe 4b 3a 00 04 02 cf 43 02 02 02
E: 683.670950 14 01 07 01 fe 4b 3a 00 04 02 cf 43 02 02 02
E: 683.678938 14 01 07 01 fe 4b 37 00 04 02 cf 43 02 02 02
E: 683.686912 14 01 07 01 fe 4b 39 00 04 02 cf 43 02 02 02
E: 683.694955 14 01 07 01 fe 4b 3b 00 04 02 cf 43 02 02 02
E: 683.707031 14 01 07 01 fe 4b 38 00 04 02 cf 43 02 02 02
E: 683.715015 14 01 07 01 fe 4b 35 00 04 02 cf 43 02 02 02
E: 683.723016 14 01 07 01 fe 4b 39 00 04 02 cf 43 02 02 02
E: 683.731069 14 01 07 01 fe 4b 3b 00 04 02 cf 43 02 02 02
E: 683.738941 14 01 07 01 fe 4b 38 00 04 02 cf 43 02 02 02
E: 683.750920 14 01 07 01 fe 4b 3b 00 04 02 cf 43 02 02 02
E: 683.758935 14 01 07 01 fe 4b 3c 00 04 02 cf 43 02 02 02
E: 683.766940 14 01 07 01 fe 4b 3d 00 04 02 cf 43 02 02 02
E: 683.775022 14 01 07 01 fe 4b 40 00 04 02 cf 43 02 02 02
E: 683.782945 14 01 07 01 fe 4b 3b 00 04 02 cf 43 02 02 02
E: 683.794932 14 01 07 01 fe 4b 3e 00 04 02 cf 43 02 02 02
E: 683.803026 14 01 07 01 fe 4b 3f 00 04 02 cf 43 02 02 02
E: 683.811224 14 01 07 01 fe 4b 40 00 04 02 cf 43 02 02 02
E: 683.819011 14 01 07 01 fe 4b 41 00 04 02 cf 43 02 02 02
E: 683.826931 14 01 07 01 fe 4b 43 00 04 02 cf 43 02 02 02
E: 683.835106 14 01 07 01 fe 4b 3d 00 04 02 cf 43 02 02 02
E: 683.846954 14 01 07 01 fe 4b 3e 00 04 02 cf 43 02 02 02
E: 683.854938 14 01 07 01 fe 4b 3d 00 04 02 cf 43 02 02 02
E: 683.863015 14 01 07 01 fe 4b 3e 00 04 02 cf 43 02 02 02
E: 683.871216 14 01 07 01 fe 4b 39 00 04 02 cf 43 02 02 02
E: 683.882938 14 01 07 01 fe 4b 39 00 04 02 cf 43 02 02 02
E: 683.891219 14 01 07 01 fe 4b 3c 00 04 02 cf 43 02 02 02
E: 683.899014 14 01 07 01 fe 4b 3c 00 04 02 cf 43 02 02 02
E: 683.906974 14 01 07 01 fe 4b 3d 00 04 02 cf 43 02 02 02
E: 683.919013 14 01 07 01 fe 4b 40 00 04 02 cf 43 02 02 02
E: 683.926907 14 01 07 01 fe 4b 3f 00 04 02 cf 43 02 02 02
E: 683.934924 14 01 07 01 fe 4b 41 00 04 02 cf 43 02 02 02
E: 683.942936 14 01 07 01 fe 4b 40 00 04 02 cf 43 02 02 02
E: 683.950912 14 01 07 01 fe 4b 40 00 04 02 cf 43 02 02 02
E: 683.967083 14 01 07 01 fe 4b 40 00 04 02 cf 43 02 02 02
E: 683.974967 14 01 07 01 fe 4b 41 00 04 02 cf 43 02 02 02
E: 683.987016 14 01 07 01 fe 4b 3c 00 04 02 cf 43 02 02 02
E: 683.995029 14 01 07 01 fe 4b 3d 00 04 02 cf 43 02 02 02
E: 684.002940 14 01 07 01 fe 4b 3e 00 04 02 cf 43 02 02 02
E: 684.010903 14 01 07 01 fe 4b 3a 00 04 02 cf 43 02 02 02
E: 684.023079 14 01 07 01 fe 4b 3b 00 04 02 cf 43 02 02 02
E: 684.030964 14 01 07 01 fe 4b 3c 00 04 02 cf 43 02 02 02
E: 684.039136 14 01 07 01 fe 4b 3f 00 04 02 cf 43 02 02 02
E: 684.047016 14 01 07 01 fe 4b 40 00 04 02 cf 43 02 02 02
E: 684.054914 14 01 07 01 fe 4b 3b 00 04 02 cf 43 02 02 02
E: 684.066925 14 01 07 01 fe 4b 39 00 04 02 cf 43 02 02 02
E: 684.074909 14 01 07 01 fe 4b 3c 00 04 02 cf 43 02 02 02
E: 684.083079 14 01 07 01 fe 4b 37 00 04 02 cf 43 02 02 02
E: 684.090934 14 01 07 01 fe 4b 33 00 04 02 cf 43 02 02 02
E: 684.098904 14 01 07 01 fe 4b 34 00 04 02 cf 43 02 02 02
E: 684.107031 14 01 07 01 fe 4b 35 00 04 02 cf 43 02 02 02
E: 684.118988 14 01 07 01 fe 4b 37 00 04 02 cf 43 02 02 02
E: 684.126924 14 01 07 01 fe 4b 39 00 04 02 cf 43 02 02 02
E: 684.135016 14 01 07 01 fe 4b 3b 00 04 02 cf 43 02 02 02
E: 684.146929 14 01 07 01 fe 4b 36 00 04 02 cf 43 02 02 02
E: 684.154926 14 01 07 01 fe 4b 33 00 04 02 cf 43 02 02 02
E: 684.163016 14 01 07 01 fe 4b 37 00 04 02 cf 43 02 02 02
E: 684.171016 14 01 07 01 fe 4b 3a 00 04 02 cf 43 02 02 02
E: 684.178908 14 01 07 01 fe 4b 3d 00 04 02 cf 43 02 02 02
E: 684.190908 14 01 07 01 fe 4b 3d 00 04 02 cf 43 02 02 02
E: 684.199024 14 01 07 01 fe 4b 40 00 04 02 cf 43 02 02 02
E: 684.206921 14 01 07 01 fe 4b 41 00 04 02 cf 43 02 02 02
E: 684.214929 14 01 07 01 fe 4b 42 00 04 02 cf 43 02 02 02
E: 684.223217 14 01 07 01 fe 4b 3c 00 04 02 cf 43 02 02 02
E: 684.235011 14 01 07 01 fe 4b 3d 00 04 02 cf 43 02 02 02
E: 684.242924 14 01 07 01 fe 4b 40 00 04 02 cf 43 02 02 02
E: 684.251008 14 01 07 01 fe 4b 3b 00 04 02 cf 43 02 02 02
E: 684.259008 14 01 07 01 fe 4b 3b 00 04 02 cf 43 02 02 02
E: 684.270940 14 01 07 01 fe 4b 38 00 04 02 cf 43 02 02 02
E: 684.279027 14 01 07 01 fe 4b 3a 00 04 02 cf 43 02 02 02
E: 684.287022 14 01 07 01 fe 4b 3d 00 04 02 cf 43 02 02 02
E: 684.294923 14 01 07 01 fe 4b 3e 00 04 02 cf 43 02 02 02
E: 684.302940 14 01 07 01 fe 4b 3f 00 04 02 cf 43 02 02 02
E: 684.315216 14 01 07 01 fe 4b 41 00 04 02 cf 43 02 02 02
E: 684.323198 14 01 07 01 fe 4b 43 00 04 02 cf 43 02 02 02
E: 684.331031 14 01 07 01 fe 4b 45 00 04 02 cf 43 02 02 02
E: 684.339026 14 01 07 01 fe 4b 45 00 04 02 cf 43 02 02 02
E: 684.347006 14 01 07 01 fe 4b 44 00 04 02 cf 43 02 02 02
E: 684.358931 14 01 07 01 fe 4b 46 00 04 02 cf 43 02 02 02
E: 684.367009 14 01 07 01 fe 4b 49 00 04 02 cf 43 02 02 02
E: 684.374897 14 01 07 01 fe 4b 4a 00 04 02 cf 43 02 02 02
E: 684.382917 14 01 07 01 fe 4b 4b 00 04 02 cf 43 02 02 02
E: 684.390924 14 01 07 01 fe 4b 49 00 04 02 cf 43 02 02 02
E: 684.403002 14 01 07 01 fe 4b 49 00 04 02 cf 43 02 02 02
E: 684.411043 14 01 07 01 fe 4b 49 00 04 02 cf 43 02 02 02
E: 684.418991 14 01 07 01 fe 4b 4a 00 04 02 cf 43 02 02 02
E: 684.427007 14 01 07 01 fe 4b 49 00 04 02 cf 43 02 02 02
E: 684.435008 14 01 07 01 fe 4b 4a 00 04 02 cf 43 02 02 02
E: 684.446927 14 01 07 01 fe 4b 49 00 04 02 cf 43 02 02 02
E: 684.454225 14 01 07 01 fe 4b 4a 00 04 02 cf 43 02 02 02
E: 684.463015 14 01 07 01 fe 4b 4b 00 04 02 cf 43 02 02 02
E: 684.471019 14 01 07 01 fe 4b 4a 00 04 02 cf 43 02 02 02
E: 684.479010 14 01 07 01 fe 4b 4b 00 04 02 cf 43 02 02 02
E: 684.487023 14 01 07 01 fe 4b 4a 00 04 02 cf 43 02 02 02
E: 684.498903 14 01 07 01 fe 4b 4b 00 04 02 cf 43 02 02 02
E: 684.506926 14 01 07 01 fe 4b 4a 00 04 02 cf 43 02 02 02
E: 684.514985 14 01 07 01 fe 4b 4b 00 04 02 cf 43 02 02 02
E: 684.523013 14 01 07 01 fe 4b 4a 00 04 02 cf 43 02 02 02
E: 684.530937 14 01 07 01 fe 4b 4b 00 04 02 cf 43 02 02 02
E: 684.542926 14 01 07 01 fe 4b 4a 00 04 02 cf 43 02 02 02
E: 684.551011 14 01 07 01 fe 4b 49 00 04 02 cf 43 02 02 02
E: 684.558906 14 01 07 01 fe 4b 4a 00 04 02 cf 43 02 02 02
E: 684.566915 14 01 07 01 fe 4b 43 00 04 02 cf 43 02 02 02
E: 684.575021 14 01 07 01 fe 4b 43 00 04 02 cf 43 02 02 02
E: 684.586911 14 01 07 01 fe 4b 43 00 04 02 cf 43 02 02 02
E: 684.594931 14 01 07 01 fe 4b 43 00 04 02 cf 43 02 02 02
E: 684.602990 14 01 07 01 fe 4b 45 00 04 02 cf 43 02 02 02
E: 684.611184 14 01 07 01 fe 4b 47 00 04 02 cf 43 02 02 02
E: 684.618920 14 01 07 01 fe 4b 47 00 04 02 cf 43 02 02 02
E: 684.630923 14 01 07 01 fe 4b 47 00 04 02 cf 43 02 02 02
E: 684.639009 14 01 07 01 fe 4b 48 00 04 02 cf 43 02 02 02
E: 684.647000 14 01 07 01 fe 4b 49 00 04 02 cf 43 02 02 02
E: 684.654926 14 01 07 01 fe 4b 4a 00 04 02 cf 43 02 02 02
E: 684.662917 14 01 07 01 fe 4b 43 00 04 02 cf 43 02 02 02
E: 684.675029 14 01 07 01 fe 4b 43 00 04 02 cf 43 02 02 02
E: 684.682915 14 01 07 01 fe 4b 42 00 04 02 cf 43 02 02 02
E: 684.690916 14 01 07 01 fe 4b 42 00 04 02 cf 43 02 02 02
E: 684.698939 14 01 07 01 fe 4b 42 00 04 02 cf 43 02 02 02
E: 684.707011 14 01 07 01 fe 4b 44 00 04 02 cf 43 02 02 02
E: 684.714921 14 01 07 01 fe 4b 46 00 04 02 cf 43 02 02 02
E: 684.726892 14 01 07 01 fe 4b 46 00 04 02 cf 43 02 02 02
E: 684.734901 14 01 07 01 fe 4b 47 00 04 02 cf 43 02 02 02
E: 684.742922 14 01 07 01 fe 4b 47 00 04 02 cf 43 02 02 02
E: 684.751010 14 01 07 01 fe 4b 47 00 04 02 cf 43 02 02 02
E: 684.759208 14 01 07 01 fe 4b 47 00 04 02 cf 43 02 02 02
E: 684.770992 14 01 07 01 fe 4b 47 00 04 02 cf 43 02 02 02
E: 684.778921 14 01 07 01 fe 4b 47 00 04 02 cf 43 02 02 02
E: 684.787017 14 01 07 01 fe 4b 47 00 04 02 cf 43 02 02 02
E: 684.795005 14 01 07 01 fe 4b 48 00 04 02 cf 43 02 02 02
E: 684.803005 14 01 07 01 fe 4b 4b 00 04 02 cf 43 02 02 02
E: 684.814897 14 01 07 01 fe 4b 4d 00 04 02 cf 43 02 02 02
E: 684.823178 14 01 07 01 fe 4b 4b 00 04 02 cf 43 02 02 02
E: 684.830907 14 01 07 01 fe 4b 4a 00 04 02 cf 43 02 02 02
E: 684.838914 14 01 07 01 fe 4b 4b 00 04 02 cf 43 02 02 02
E: 684.846896 14 01 07 01 fe 4b 4c 00 04 02 cf 43 02 02 02
E: 684.859007 14 01 07 01 fe 4b 4b 00 04 02 cf 43 02 02 02
E: 684.866905 14 01 07 01 fe 4b 4c 00 04 02 cf 43 02 02 02
E: 684.875178 14 01 07 01 fe 4b 4d 00 04 02 cf 43 02 02 02
E: 684.883005 14 01 07 01 fe 4b 4c 00 04 02 cf 43 02 02 02
E: 684.891040 14 01 07 01 fe 4b 4b 00 04 02 cf 43 02 02 02
E: 684.902989 14 01 07 01 fe 4b 4f 00 04 02 cf 43 02 02 02
E: 684.910887 14 01 07 01 fe 4b 48 00 04 02 cf 43 02 02 02
E: 684.918915 14 01 07 01 fe 4b 48 00 04 02 cf 43 02 02 02
E: 684.926910 14 01 07 01 fe 4b 49 00 04 02 cf 43 02 02 02
E: 684.943006 14 01 07 01 fe 4b 67 00 07 02 01 00 fe 2b 02
E: 684.959004 14 01 07 01 fe 4b 66 00 07 02 01 00 fe 2b 02
E: 684.970895 14 01 07 01 fe 4b 67 00 07 02 01 00 fe 2b 02
E: 684.987033 14 01 07 01 fe 4b 67 00 07 02 01 00 fe 2b 02
E: 685.003004 14 01 07 01 fe 4b 67 00 07 02 01 00 fe 2b 02
E: 685.014906 14 01 07 01 fe 4b 67 00 07 02 01 00 fe 2b 02
E: 685.031174 14 01 07 01 fe 4b 67 00 07 02 01 00 fe 2b 02
E: 685.039011 14 01 06 01 fe 4b 67 00 06 02 01 00 fe 2b 02
E: 685.055020 14 01 07 01 fe 4b 42 00 07 02 01 00 fe 2b 02
E: 685.067000 14 01 07 01 fe 4b 45 00 07 02 01 00 fe 2b 02
E: 685.082914 14 01 07 01 fe 4b 47 00 07 02 01 00 fe 2b 02
E: 685.094994 14 01 07 01 fe 4b 47 00 07 02 01 00 fe 2b 02
E: 685.111010 14 01 07 01 fe 4b 48 00 07 02 01 00 fe 2b 02
E: 685.127138 14 01 07 01 fe 4b 47 00 07 02 01 00 fe 2b 02
E: 685.139032 14 01 07 01 fe 4b 47 00 07 02 01 00 fe 2b 02
E: 685.155008 14 01 07 01 fe 4b 48 00 07 02 01 00 fe 2b 02
E: 685.171005 14 01 07 01 fe 4b 47 00 07 02 01 00 fe 2b 02
E: 685.183002 14 01 07 01 fe 4b 47 00 07 02 01 00 fe 2b 02
E: 685.198914 14 01 07 01 fe 4b 49 00 07 02 01 00 fe 2b 02
E: 685.214896 14 01 07 01 fe 4b 47 00 07 02 01 00 fe 2b 02
E: 685.226908 14 01 07 01 fe 4b 49 00 07 02 01 00 fe 2b 02
E: 685.243197 14 01 07 01 fe 4b 49 00 07 02 01 00 fe 2b 02
E: 685.254907 14 01 07 01 fe 4b 48 00 07 02 01 00 fe 2b 02
E: 685.270989 14 01 07 01 fe 4b 49 00 07 02 01 00 fe 2b 02
E: 685.286961 14 01 07 01 fe 4b 48 00 07 02 01 00 fe 2b 02
E: 685.298988 14 01 07 01 fe 4b 43 00 07 02 01 00 fe 2b 02
E: 685.314909 14 01 07 01 fe 4b 43 00 07 02 01 00 fe 2b 02
E: 685.331195 14 01 07 01 fe 4b 43 00 07 02 01 00 fe 2b 02
E: 685.342903 14 01 07 01 fe 4b 3d 00 07 02 01 00 fe 2b 02
E: 685.358987 14 01 07 01 fe 4b 3d 00 07 02 01 00 fe 2b 02
E: 685.371008 14 01 07 01 fe 4b 3a 00 07 02 01 00 fe 2b 02
E: 685.387015 14 01 07 01 fe 4b 33 00 07 02 01 00 fe 2b 02
E: 685.402937 14 01 07 01 fe 4b 2d 00 07 02 01 00 fe 2b 02
E: 685.415026 14 01 07 01 fe 4b 31 00 07 02 01 00 fe 2b 02
E: 685.430908 14 01 07 01 fe 4b 35 00 07 02 01 00 fe 2b 02
E: 685.447198 14 01 07 01 fe 4b 3a 00 07 02 01 00 fe 2b 02
E: 685.458983 14 01 07 01 fe 4b 3c 00 07 02 01 00 fe 2b 02
E: 685.475022 14 01 07 01 fe 4b 3d 00 07 02 01 00 fe 2b 02
E: 685.486971 14 01 07 01 fe 4b 3e 00 07 02 01 00 fe 2b 02
E: 685.502983 14 01 07 01 fe 4b 3f 00 07 02 01 00 fe 2b 02
E: 685.519029 14 01 07 01 fe 4b 41 00 07 02 01 00 fe 2b 02
E: 685.530899 14 01 07 01 fe 4b 43 00 07 02 01 00 fe 2b 02
E: 685.546980 14 01 07 01 fe 4b 46 00 07 02 01 00 fe 2b 02
E: 685.562907 14 01 07 01 fe 4b 47 00 07 02 01 00 fe 2b 02
E: 685.575048 14 01 07 01 fe 4b 4a 00 07 02 01 00 fe 2b 02
E: 685.591012 14 01 07 01 fe 4b 42 00 07 02 01 00 fe 2b 02
E: 685.606886 14 01 07 01 fe 4b 49 00 07 02 01 00 fe 2b 02
E: 685.618896 14 01 07 01 fe 4b 4d 00 07 02 01 00 fe 2b 02
E: 685.634880 14 01 07 01 fe 4b 4f 00 07 02 01 00 fe 2b 02
E: 685.646896 14 01 07 01 fe 4b 53 00 07 02 01 00 fe 2b 02
E: 685.662938 14 01 07 01 fe 4b 57 00 07 02 01 00 fe 2b 02
E: 685.678899 14 01 07 01 fe 4b 5b 00 07 02 01 00 fe 2b 02
E: 685.690914 14 01 07 01 fe 4b 5f 00 07 02 01 00 fe 2b 02
E: 685.706895 14 01 07 01 fe 4b 64 00 07 02 01 00 fe 2b 02
E: 685.722987 14 01 07 01 fe 4b 65 00 07 02 01 00 fe 2b 02
E: 685.734903 14 01 07 01 fe 4b 69 00 07 02 01 00 fe 2b 02
E: 685.750986 14 01 07 01 fe 4b 69 00 07 02 01 00 fe 2b 02
E: 685.762903 14 01 07 01 fe 4b 69 00 07 02 01 00 fe 2b 02
E: 685.778990 14 01 07 01 fe 4b 6e 00 07 02 01 00 fe 2b 02
E: 685.794895 14 01 07 01 fe 4b 71 00 07 02 01 00 fe 2b 02
E: 685.807188 14 01 07 01 fe 4b 7d 00 07 02 01 00 fe 2b 02
E: 685.822896 14 01 07 01 f9 4b 8a 00 07 02 01 00 fe 2b 02
E: 685.838995 14 01 07 01 eb 4b a4 00 07 02 04 00 fe 2b 02
E: 685.850895 14 01 07 01 d0 4b be 00 07 02 03 00 fe 2b 02
E: 685.866987 14 01 07 01 af 4b df 00 07 02 07 00 fe 2b 02
E: 685.882899 14 01 07 01 8d 4b 09 01 07 02 08 00 fe 2b 02
E: 685.894990 14 01 07 01 6a 4b 30 01 07 02 0b 00 fe 2b 02
E: 685.911009 14 01 07 01 49 4b 57 01 07 02 10 00 fe 2b 02
E: 685.922979 14 01 07 01 2b 4b 7a 01 07 02 16 00 fe 2b 02
E: 685.938903 14 01 07 01 0d 4b 95 01 07 02 1d 00 fe 2b 02
E: 685.954498 14 01 07 01 ef 4a af 01 07 02 28 00 fe 2b 02
E: 685.966929 14 01 07 01 db 4a be 01 07 02 34 00 fe 2b 02
E: 685.983184 14 01 07 01 c8 4a ce 01 07 02 40 00 fe 2b 02
E: 685.998930 14 01 07 01 a2 4a e5 01 07 02 56 00 fe 2b 02
E: 686.011147 14 01 07 01 8d 4a f3 01 07 02 63 00 fd 2b 02
E: 686.026984 14 01 07 01 6d 4a 0a 02 07 02 7c 00 fb 2b 02
E: 686.039006 14 01 07 01 4e 4a 27 02 07 02 97 00 f7 2b 02
E: 686.054897 14 01 07 01 32 4a 3e 02 07 02 b6 00 eb 2b 02
E: 686.071022 14 01 07 01 19 4a 50 02 07 02 cf 00 df 2b 02
E: 686.083029 14 01 07 01 0a 4a 5b 02 07 02 e3 00 d7 2b 02
E: 686.098891 14 01 07 01 fc 49 66 02 07 02 f8 00 ca 2b 02
E: 686.114891 14 01 07 01 e4 49 78 02 07 02 1e 01 b4 2b 02
E: 686.126931 14 01 07 01 cf 49 8d 02 07 02 48 01 99 2b 02
E: 686.142986 14 01 07 01 bb 49 9d 02 07 02 6d 01 7e 2b 02
E: 686.154986 14 01 07 01 a9 49 ac 02 07 02 91 01 5f 2b 02
E: 686.170980 14 01 07 01 9c 49 b8 02 07 02 a7 01 4a 2b 02
E: 686.187017 14 01 07 01 88 49 cd 02 07 02 c7 01 25 2b 02
E: 686.198972 14 01 07 01 76 49 dd 02 07 02 e6 01 ff 2a 02
E: 686.214884 14 01 07 01 61 49 ed 02 07 02 03 02 d7 2a 02
E: 686.226880 14 01 07 01 4b 49 ff 02 07 02 21 02 ae 2a 02
E: 686.238888 14 01 06 01 4b 49 ff 02 06 02 21 02 ae 2a 02
E: 686.250982 14 01 07 01 f3 48 52 03 07 02 e9 02 d0 29 02
E: 686.266976 14 01 07 01 f0 48 54 03 07 02 ea 02 cf 29 02
E: 686.282947 14 01 07 01 ea 48 57 03 07 02 f0 02 cc 29 02
E: 686.294958 14 01 07 01 e3 48 5b 03 07 02 f6 02 c7 29 02
E: 686.310957 14 01 07 01 db 48 62 03 07 02 ff 02 c1 29 02
E: 686.323012 14 01 07 01 d1 48 68 03 07 02 0a 03 b9 29 02
E: 686.338990 14 01 07 01 c6 48 6f 03 07 02 17 03 b0 29 02
E: 686.354891 14 01 07 01 bb 48 77 03 07 02 25 03 a6 29 02
E: 686.367000 14 01 07 01 af 48 81 03 07 02 33 03 9b 29 02
E: 686.383168 14 01 07 01 a4 48 89 03 07 02 43 03 8f 29 02
E: 686.398866 14 01 07 01 99 48 91 03 07 02 53 03 83 29 02
E: 686.410994 14 01 07 01 8c 48 98 03 07 02 63 03 78 29 02
E: 686.427004 14 01 07 01 80 48 a1 03 07 02 73 03 6a 29 02
E: 686.439030 14 01 07 01 72 48 ad 03 07 02 84 03 5c 29 02
E: 686.454399 14 01 07 01 63 48 b8 03 07 02 93 03 4c 29 02
E: 686.470862 14 01 07 01 54 48 c5 03 07 02 a2 03 3d 29 02
E: 686.482886 14 01 07 01 3c 48 df 03 07 02 bc 03 29 29 02
E: 686.499020 14 01 07 01 2d 48 ed 03 07 02 cb 03 20 29 02
E: 686.514882 14 01 07 01 1c 48 fa 03 07 02 da 03 14 29 02
E: 686.526963 14 01 07 01 0c 48 07 04 07 02 e7 03 0a 29 02
E: 686.542943 14 01 07 01 fc 47 16 04 07 02 f5 03 01 29 02
E: 686.554977 14 01 07 01 eb 47 24 04 07 02 03 04 f7 28 02
E: 686.570906 14 01 07 01 da 47 33 04 07 02 10 04 ec 28 02
E: 686.586987 14 01 07 01 c8 47 43 04 07 02 1d 04 df 28 02
E: 686.598917 14 01 07 01 ad 47 5c 04 07 02 32 04 cf 28 02
E: 686.614979 14 01 07 01 9c 47 6b 04 07 02 3e 04 c5 28 02
E: 686.630890 14 01 07 01 8b 47 7a 04 07 02 48 04 ba 28 02
E: 686.643013 14 01 07 01 7c 47 88 04 07 02 53 04 ac 28 02
E: 686.658939 14 01 07 01 6d 47 95 04 07 02 5d 04 9f 28 02
E: 686.671152 14 01 07 01 5d 47 a4 04 07 02 68 04 95 28 02
E: 686.687096 14 01 07 01 4d 47 b1 04 07 02 73 04 89 28 02
E: 686.703165 14 01 07 01 3a 47 c0 04 07 02 7e 04 7e 28 02
E: 686.714884 14 01 07 01 2a 47 cf 04 07 02 89 04 71 28 02
E: 686.731143 14 01 07 01 19 47 de 04 07 02 94 04 64 28 02
E: 686.746878 14 01 07 01 0a 47 ec 04 07 02 9f 04 57 28 02
E: 686.759144 14 01 07 01 fb 46 f9 04 07 02 a9 04 4c 28 02
E: 686.774880 14 01 07 01 ec 46 08 05 07 02 b2 04 40 28 02
E: 686.790977 14 01 07 01 de 46 16 05 07 02 b9 04 34 28 02
E: 686.802876 14 01 07 01 d1 46 21 05 07 02 c2 04 28 28 02
E: 686.819148 14 01 07 01 c5 46 2c 05 07 02 cb 04 1c 28 02
E: 686.830961 14 01 07 01 ba 46 37 05 07 02 d3 04 10 28 02
E: 686.846969 14 01 07 01 ae 46 42 05 07 02 db 04 05 28 02
E: 686.862873 14 01 07 01 a3 46 4c 05 07 02 e5 04 fa 27 02
E: 686.874961 14 01 07 01 98 46 56 05 07 02 ef 04 f0 27 02
E: 686.890984 14 01 07 01 8e 46 60 05 07 02 fb 04 e7 27 02
E: 686.907169 14 01 07 01 84 46 69 05 07 02 06 05 e0 27 02
E: 686.918890 14 01 07 01 7b 46 71 05 07 02 12 05 d6 27 02
E: 686.934976 14 01 07 01 72 46 79 05 07 02 1e 05 cc 27 02
E: 686.946919 14 01 07 01 6a 46 80 05 07 02 27 05 c3 27 02
E: 686.962926 14 01 07 01 60 46 87 05 07 02 32 05 bb 27 02
E: 686.978981 14 01 07 01 57 46 8d 05 07 02 3b 05 b3 27 02
E: 686.990876 14 01 07 01 4f 46 92 05 07 02 46 05 ac 27 02
E: 687.006871 14 01 07 01 49 46 97 05 07 02 4f 05 a5 27 02
E: 687.022963 14 01 07 01 43 46 9b 05 07 02 59 05 9e 27 02
E: 687.034874 14 01 07 01 3d 46 a0 05 07 02 62 05 98 27 02
E: 687.050982 14 01 07 01 39 46 a5 05 07 02 6b 05 92 27 02
E: 687.066997 14 01 07 01 33 46 a9 05 07 02 74 05 8c 27 02
E: 687.078879 14 01 07 01 2d 46 ad 05 07 02 7d 05 86 27 02
E: 687.094855 14 01 07 01 28 46 b0 05 07 02 86 05 80 27 02
E: 687.106904 14 01 07 01 21 46 b3 05 07 02 8e 05 7b 27 02
E: 687.122968 14 01 07 01 1c 46 b7 05 07 02 97 05 76 27 02
E: 687.138896 14 01 07 01 18 46 bb 05 07 02 a2 05 72 27 02
E: 687.150971 14 01 07 01 14 46 be 05 07 02 ad 05 6e 27 02
E: 687.166974 14 01 07 01 10 46 c2 05 07 02 b6 05 68 27 02
E: 687.182974 14 01 07 01 0c 46 c6 05 07 02 be 05 64 27 02
E: 687.194956 14 01 07 01 08 46 c9 05 07 02 c5 05 60 27 02
E: 687.210977 14 01 07 01 04 46 d1 05 07 02 cc 05 5c 27 02
E: 687.222874 14 01 07 01 ff 45 d8 05 07 02 d4 05 58 27 02
E: 687.239008 14 01 07 01 fb 45 dd 05 07 02 dc 05 54 27 02
E: 687.254905 14 01 07 01 f6 45 e2 05 07 02 e3 05 51 27 02
E: 687.266958 14 01 07 01 f1 45 e7 05 07 02 ec 05 4e 27 02
E: 687.282877 14 01 07 01 ec 45 eb 05 07 02 f5 05 4a 27 02
E: 687.298900 14 01 07 01 e7 45 ef 05 07 02 ff 05 47 27 02
E: 687.310915 14 01 07 01 e1 45 f2 05 07 02 08 06 44 27 02
E: 687.326860 14 01 07 01 dc 45 f5 05 07 02 10 06 41 27 02
E: 687.338872 14 01 07 01 d7 45 f8 05 07 02 17 06 3e 27 02
E: 687.354948 14 01 07 01 d2 45 fb 05 07 02 1f 06 3b 27 02
E: 687.370916 14 01 07 01 cd 45 fe 05 07 02 27 06 38 27 02
E: 687.382956 14 01 07 01 c8 45 02 06 07 02 2e 06 36 27 02
E: 687.398861 14 01 07 01 c3 45 05 06 07 02 33 06 34 27 02
E: 687.414953 14 01 07 01 be 45 09 06 07 02 38 06 33 27 02
E: 687.426866 14 01 07 01 b9 45 0c 06 07 02 3f 06 31 27 02
E: 687.442954 14 01 07 01 b5 45 0f 06 07 02 46 06 2f 27 02
E: 687.458970 14 01 07 01 b2 45 12 06 07 02 4c 06 2d 27 02
E: 687.471024 14 01 07 01 ae 45 17 06 07 02 52 06 2a 27 02
E: 687.486872 14 01 07 01 aa 45 1a 06 07 02 58 06 27 27 02
E: 687.499133 14 01 07 01 a7 45 1c 06 07 02 5e 06 24 27 02
E: 687.514925 14 01 07 01 a4 45 1f 06 07 02 64 06 22 27 02
E: 687.531034 14 01 07 01 a1 45 22 06 07 02 6a 06 1f 27 02
E: 687.542873 14 01 07 01 9f 45 24 06 07 02 70 06 1b 27 02
E: 687.558961 14 01 07 01 9c 45 26 06 07 02 77 06 17 27 02
E: 687.574910 14 01 07 01 99 45 28 06 07 02 7d 06 13 27 02
E: 687.586978 14 01 07 01 97 45 29 06 07 02 83 06 10 27 02
E: 687.603120 14 01 07 01 95 45 2b 06 07 02 87 06 0d 27 02
E: 687.614849 14 01 07 01 93 45 2c 06 07 02 8b 06 09 27 02
E: 687.630882 14 01 07 01 91 45 2d 06 07 02 90 06 06 27 02
E: 687.646965 14 01 07 01 90 45 2e 06 07 02 95 06 04 27 02
E: 687.658962 14 01 07 01 8f 45 2f 06 07 02 98 06 02 27 02
E: 687.674865 14 01 07 01 8e 45 30 06 07 02 9c 06 00 27 02
E: 687.691117 14 01 07 01 8c 45 31 06 07 02 a0 06 fd 26 02
E: 687.702860 14 01 07 01 8a 45 32 06 07 02 a4 06 fb 26 02
E: 687.718863 14 01 07 01 88 45 32 06 07 02 a8 06 f8 26 02
E: 687.734962 14 01 07 01 87 45 33 06 07 02 ab 06 f6 26 02
E: 687.746958 14 01 07 01 85 45 33 06 07 02 ae 06 f3 26 02
E: 687.762868 14 01 07 01 84 45 33 06 07 02 b0 06 f1 26 02
E: 687.775149 14 01 07 01 83 45 33 06 07 02 b3 06 f0 26 02
E: 687.790865 14 01 07 01 82 45 33 06 07 02 b5 06 ee 26 02
E: 687.806953 14 01 07 01 81 45 33 06 07 02 b7 06 ec 26 02
E: 687.818861 14 01 07 01 81 45 34 06 07 02 ba 06 ea 26 02
E: 687.834962 14 01 07 01 80 45 35 06 07 02 bb 06 e8 26 02
E: 687.850975 14 01 07 01 7f 45 36 06 07 02 bd 06 e7 26 02
E: 687.863147 14 01 07 01 7f 45 36 06 07 02 bf 06 e7 26 02
E: 687.878862 14 01 07 01 7e 45 36 06 07 02 c1 06 e6 26 02
E: 687.891023 14 01 07 01 7e 45 36 06 07 02 c2 06 e5 26 02
E: 687.907004 14 01 07 01 7d 45 36 06 07 02 c3 06 e4 26 02
E: 687.923033 14 01 07 01 7d 45 36 06 07 02 c4 06 e3 26 02
E: 687.934855 14 01 07 01 7d 45 35 06 07 02 c6 06 e2 26 02
E: 687.950953 14 01 07 01 7d 45 35 06 07 02 c7 06 e1 26 02
E: 687.966865 14 01 07 01 7d 45 35 06 07 02 c8 06 e1 26 02
E: 687.979154 14 01 07 01 7d 45 35 06 07 02 c9 06 e1 26 02
E: 687.994869 14 01 07 01 7c 45 35 06 07 02 ca 06 e0 26 02
E: 688.007027 14 01 07 01 7c 45 35 06 07 02 cb 06 df 26 02
E: 688.022868 14 01 07 01 7c 45 36 06 07 02 cb 06 df 26 02
E: 688.039023 14 01 07 01 7c 45 36 06 07 02 cd 06 df 26 02
E: 688.050969 14 01 07 01 7c 45 36 06 07 02 cc 06 df 26 02
E: 688.067009 14 01 07 01 7c 45 35 06 07 02 cd 06 df 26 02
E: 688.082860 14 01 07 01 7c 45 34 06 07 02 cd 06 de 26 02
E: 688.090952 14 01 06 01 7c 45 34 06 06 02 cd 06 de 26 02
E: 688.103124 14 01 07 01 89 45 30 06 07 02 e1 06 d4 26 02
E: 688.118851 14 01 07 01 87 45 30 06 07 02 dd 06 d4 26 02
E: 688.134835 14 01 07 01 85 45 30 06 07 02 dd 06 d5 26 02
E: 688.146920 14 01 07 01 84 45 31 06 07 02 dd 06 d5 26 02
E: 688.162940 14 01 07 01 83 45 31 06 07 02 db 06 d4 26 02
E: 688.178854 14 01 07 01 81 45 31 06 07 02 dc 06 d4 26 02
E: 688.190951 14 01 07 01 80 45 31 06 07 02 dc 06 d3 26 02
E: 688.206955 14 01 07 01 80 45 30 06 07 02 dd 06 d2 26 02
E: 688.218949 14 01 07 01 7f 45 30 06 07 02 de 06 d2 26 02
E: 688.234950 14 01 07 01 7f 45 30 06 07 02 de 06 d2 26 02
E: 688.251141 14 01 07 01 7e 45 30 06 07 02 db 06 d1 26 02
E: 688.262859 14 01 07 01 7c 45 30 06 07 02 d9 06 d1 26 02
E: 688.279147 14 01 07 01 7b 45 2f 06 07 02 da 06 d2 26 02
E: 688.294852 14 01 07 01 7b 45 2e 06 07 02 da 06 d1 26 02
E: 688.306947 14 01 07 01 7a 45 2f 06 07 02 db 06 d1 26 02
E: 688.322925 14 01 07 01 7a 45 2e 06 07 02 d9 06 d1 26 02
E: 688.334867 14 01 07 01 7a 45 2d 06 07 02 d8 06 d1 26 02
E: 688.350881 14 01 07 01 7b 45 2d 06 07 02 d8 06 d1 26 02
E: 688.367147 14 01 07 01 7b 45 2d 06 07 02 d7 06 d0 26 02
E: 688.378934 14 01 07 01 7b 45 2d 06 07 02 d5 06 d0 26 02
E: 688.394956 14 01 07 01 7b 45 2d 06 07 02 d6 06 cf 26 02
E: 688.410855 14 01 07 01 7b 45 2d 06 07 02 d4 06 cf 26 02
E: 688.422938 14 01 07 01 7b 45 2e 06 07 02 d6 06 cf 26 02
E: 688.438882 14 01 07 01 7b 45 2f 06 07 02 d6 06 d0 26 02
E: 688.450853 14 01 07 01 7b 45 30 06 07 02 d7 06 d1 26 02
E: 688.466854 14 01 07 01 7b 45 30 06 07 02 d6 06 d2 26 02
E: 688.482826 14 01 07 01 7b 45 30 06 07 02 d6 06 d3 26 02
E: 688.494940 14 01 07 01 7b 45 30 06 07 02 d5 06 d4 26 02
E: 688.510855 14 01 07 01 7a 45 30 06 07 02 d5 06 d6 26 02
E: 688.526931 14 01 07 01 79 45 2f 06 07 02 d4 06 d7 26 02
E: 688.538834 14 01 07 01 79 45 2e 06 07 02 d3 06 d7 26 02
E: 688.554933 14 01 07 01 79 45 2f 06 07 02 d3 06 d7 26 02
E: 688.566852 14 01 07 01 7a 45 2e 06 07 02 d2 06 d8 26 02
E: 688.582853 14 01 07 01 7a 45 2d 06 07 02 d1 06 d9 26 02
E: 688.598846 14 01 07 01 79 45 2c 06 07 02 d0 06 db 26 02
E: 688.611130 14 01 07 01 78 45 2c 06 07 02 ce 06 dc 26 02
E: 688.626848 14 01 07 01 78 45 2b 06 07 02 cd 06 dd 26 02
E: 688.643140 14 01 07 01 78 45 2b 06 07 02 cc 06 de 26 02
E: 688.655045 14 01 07 01 78 45 2b 06 07 02 cc 06 df 26 02
E: 688.670904 14 01 07 01 78 45 2c 06 07 02 cc 06 df 26 02
E: 688.686950 14 01 07 01 78 45 2c 06 07 02 cc 06 e0 26 02
E: 688.699067 14 01 07 01 78 45 2d 06 07 02 cc 06 e0 26 02
E: 688.714845 14 01 07 01 78 45 2e 06 07 02 cc 06 e0 26 02
E: 688.727112 14 01 07 01 78 45 2e 06 07 02 cb 06 e0 26 02
E: 688.742827 14 01 07 01 78 45 2f 06 07 02 cb 06 e0 26 02
E: 688.758938 14 01 07 01 78 45 30 06 07 02 cc 06 e0 26 02
E: 688.770949 14 01 07 01 78 45 30 06 07 02 cd 06 e0 26 02
E: 688.786937 14 01 07 01 78 45 30 06 07 02 cd 06 e1 26 02
E: 688.802829 14 01 07 01 78 45 30 06 07 02 cc 06 e1 26 02
E: 688.814845 14 01 07 01 77 45 30 06 07 02 cb 06 e1 26 02
E: 688.831016 14 01 07 01 76 45 30 06 07 02 ca 06 e2 26 02
E: 688.842940 14 01 07 01 76 45 30 06 07 02 c8 06 e1 26 02
E: 688.859076 14 01 07 01 75 45 30 06 07 02 c7 06 e1 26 02
E: 688.874849 14 01 07 01 74 45 2f 06 07 02 c6 06 e1 26 02
E: 688.886847 14 01 07 01 74 45 30 06 07 02 c4 06 e1 26 02
E: 688.902863 14 01 07 01 74 45 30 06 07 02 c4 06 e1 26 02
E: 688.918837 14 01 07 01 74 45 2f 06 07 02 c5 06 e1 26 02
E: 688.930987 14 01 07 01 73 45 2e 06 07 02 c4 06 e2 26 02
E: 688.946839 14 01 07 01 73 45 2e 06 07 02 c4 06 e2 26 02
E: 688.958826 14 01 07 01 73 45 2f 06 07 02 c4 06 e2 26 02
E: 688.974839 14 01 07 01 72 45 2f 06 07 02 c4 06 e2 26 02
E: 688.990936 14 01 07 01 72 45 2f 06 07 02 c4 06 e2 26 02
E: 689.002831 14 01 07 01 71 45 30 06 07 02 c4 06 e2 26 02
E: 689.018833 14 01 07 01 71 45 30 06 07 02 c5 06 e2 26 02
E: 689.034843 14 01 07 01 72 45 31 06 07 02 c5 06 e2 26 02
E: 689.046820 14 01 07 01 71 45 30 06 07 02 c5 06 e2 26 02
E: 689.062853 14 01 07 01 71 45 30 06 07 02 c5 06 e2 26 02
E: 689.078840 14 01 07 01 70 45 30 06 07 02 c5 06 e1 26 02
E: 689.090947 14 01 07 01 70 45 30 06 07 02 c6 06 e1 26 02
E: 689.107109 14 01 07 01 71 45 30 06 07 02 c4 06 e1 26 02
E: 689.114926 14 01 06 01 71 45 30 06 06 02 c4 06 e1 26 02
E: 689.131106 14 01 07 01 75 45 26 06 07 02 c1 06 dc 26 02
E: 689.142868 14 01 07 01 74 45 27 06 07 02 c2 06 dd 26 02
E: 689.159111 14 01 07 01 73 45 28 06 07 02 c1 06 dd 26 02
E: 689.171032 14 01 07 01 72 45 28 06 07 02 c2 06 dd 26 02
E: 689.186824 14 01 07 01 71 45 28 06 07 02 c2 06 dd 26 02
E: 689.202812 14 01 07 01 71 45 29 06 07 02 c1 06 dd 26 02
E: 689.214833 14 01 07 01 71 45 2a 06 07 02 c1 06 de 26 02
E: 689.231047 14 01 07 01 71 45 2b 06 07 02 c2 06 df 26 02
E: 689.246842 14 01 07 01 70 45 2c 06 07 02 c2 06 df 26 02
E: 689.259020 14 01 07 01 70 45 2c 06 07 02 c1 06 df 26 02
E: 689.274841 14 01 07 01 70 45 2c 06 07 02 c1 06 df 26 02
E: 689.286916 14 01 07 01 70 45 2d 06 07 02 c1 06 df 26 02
E: 689.302837 14 01 07 01 70 45 2d 06 07 02 c1 06 de 26 02
E: 689.318925 14 01 07 01 6f 45 2d 06 07 02 c3 06 de 26 02
E: 689.330832 14 01 07 01 6f 45 2e 06 07 02 c3 06 de 26 02
E: 689.346908 14 01 07 01 6f 45 2f 06 07 02 c3 06 df 26 02
E: 689.362831 14 01 07 01 6e 45 30 06 07 02 c4 06 df 26 02
E: 689.374926 14 01 07 01 6e 45 30 06 07 02 c4 06 df 26 02
E: 689.390830 14 01 07 01 6d 45 2f 06 07 02 c3 06 df 26 02
E: 689.406904 14 01 07 01 6d 45 2f 06 07 02 c4 06 df 26 02
E: 689.418837 14 01 07 01 6d 45 2f 06 07 02 c3 06 df 26 02
E: 689.434898 14 01 07 01 6d 45 2f 06 07 02 c4 06 df 26 02
E: 689.446869 14 01 07 01 6d 45 30 06 07 02 c4 06 df 26 02
E: 689.462925 14 01 07 01 6e 45 30 06 07 02 c4 06 df 26 02
E: 689.478949 14 01 07 01 6e 45 30 06 07 02 c3 06 df 26 02
E: 689.490918 14 01 07 01 6e 45 30 06 07 02 c2 06 df 26 02
E: 689.506882 14 01 07 01 6d 45 30 06 07 02 c2 06 df 26 02
E: 689.522853 14 01 07 01 6d 45 30 06 07 02 c3 06 df 26 02
E: 689.534945 14 01 07 01 6d 45 31 06 07 02 c3 06 df 26 02
E: 689.550805 14 01 07 01 6e 45 31 06 07 02 c3 06 df 26 02
E: 689.562951 14 01 07 01 6d 45 31 06 07 02 c3 06 df 26 02
E: 689.578827 14 01 07 01 6d 45 31 06 07 02 c4 06 df 26 02
E: 689.594842 14 01 07 01 6e 45 31 06 07 02 c3 06 df 26 02
E: 689.606875 14 01 07 01 6d 45 31 06 07 02 c5 06 df 26 02
E: 689.623136 14 01 07 01 6e 45 32 06 07 02 c4 06 df 26 02
E: 689.638833 14 01 07 01 6e 45 32 06 07 02 c4 06 df 26 02
E: 689.650899 14 01 07 01 6e 45 33 06 07 02 c4 06 df 26 02
E: 689.666827 14 01 07 01 6d 45 33 06 07 02 c5 06 de 26 02
E: 689.678932 14 01 07 01 6e 45 33 06 07 02 c4 06 dd 26 02
E: 689.694833 14 01 07 01 6e 45 34 06 07 02 c4 06 dd 26 02
E: 689.711030 14 01 07 01 6e 45 34 06 07 02 c5 06 dd 26 02
E: 689.722911 14 01 07 01 6f 45 35 06 07 02 c6 06 dd 26 02
E: 689.738930 14 01 07 01 6f 45 35 06 07 02 c5 06 dd 26 02
E: 689.754824 14 01 07 01 6f 45 35 06 07 02 c3 06 dd 26 02
E: 689.766811 14 01 07 01 6f 45 35 06 07 02 c2 06 dd 26 02
E: 689.782824 14 01 07 01 6f 45 35 06 07 02 c3 06 dd 26 02
E: 689.794818 14 01 07 01 6e 45 35 06 07 02 c2 06 dd 26 02
E: 689.810926 14 01 07 01 6e 45 35 06 07 02 c2 06 dd 26 02
E: 689.827032 14 01 07 01 6d 45 35 06 07 02 c3 06 dd 26 02
E: 689.838830 14 01 07 01 6d 45 35 06 07 02 c3 06 dd 26 02
E: 689.854812 14 01 07 01 6d 45 35 06 07 02 c4 06 dd 26 02
E: 689.870830 14 01 07 01 6d 45 35 06 07 02 c5 06 dc 26 02
E: 689.882926 14 01 07 01 6d 45 36 06 07 02 c6 06 dc 26 02
E: 689.898829 14 01 07 01 6e 45 36 06 07 02 c6 06 dc 26 02
E: 689.910906 14 01 07 01 6e 45 36 06 07 02 c7 06 dc 26 02
E: 689.926869 14 01 07 01 6d 45 36 06 07 02 c7 06 dc 26 02
E: 689.942907 14 01 07 01 6d 45 36 06 07 02 c7 06 dc 26 02
E: 689.954505 14 01 07 01 6e 45 36 06 07 02 c7 06 dc 26 02
E: 689.971105 14 01 07 01 6d 45 36 06 07 02 c8 06 dc 26 02
E: 689.986953 14 01 07 01 6d 45 36 06 07 02 c7 06 dc 26 02
E: 689.998918 14 01 07 01 6d 45 36 06 07 02 c6 06 dc 26 02
E: 690.014815 14 01 07 01 6d 45 36 06 07 02 c6 06 dc 26 02
E: 690.027116 14 01 07 01 6d 45 36 06 07 02 c6 06 dc 26 02
E: 690.042874 14 01 07 01 6c 45 36 06 07 02 c5 06 db 26 02
E: 690.058903 14 01 07 01 6d 45 36 06 07 02 c5 06 db 26 02
E: 690.070948 14 01 07 01 6d 45 36 06 07 02 c5 06 db 26 02
E: 690.086966 14 01 07 01 6d 45 36 06 07 02 c5 06 da 26 02
E: 690.102817 14 01 07 01 6c 45 36 06 07 02 c5 06 da 26 02
E: 690.114922 14 01 07 01 6b 45 36 06 07 02 c5 06 d9 26 02
E: 690.130925 14 01 07 01 6c 45 36 06 07 02 c5 06 d9 26 02
E: 690.146799 14 01 07 01 6b 45 35 06 07 02 c6 06 d9 26 02
E: 690.158958 14 01 07 01 6b 45 34 06 07 02 c6 06 da 26 02
E: 690.175081 14 01 07 01 6b 45 34 06 07 02 c7 06 da 26 02
E: 690.186866 14 01 07 01 6b 45 35 06 07 02 c6 06 db 26 02
E: 690.202816 14 01 07 01 6a 45 35 06 07 02 c5 06 db 26 02
E: 690.218806 14 01 07 01 69 45 35 06 07 02 c5 06 dc 26 02
E: 690.230821 14 01 07 01 6a 45 34 06 07 02 c6 06 db 26 02
E: 690.246798 14 01 07 01 69 45 34 06 07 02 c6 06 db 26 02
E: 690.262823 14 01 07 01 69 45 34 06 07 02 c7 06 db 26 02
E: 690.274800 14 01 07 01 69 45 34 06 07 02 c8 06 db 26 02
E: 690.290956 14 01 07 01 69 45 35 06 07 02 c9 06 dc 26 02
E: 690.302890 14 01 07 01 69 45 35 06 07 02 cb 06 dc 26 02
E: 690.318817 14 01 07 01 69 45 35 06 07 02 cb 06 dc 26 02
E: 690.334794 14 01 07 01 69 45 35 06 07 02 ca 06 dc 26 02
E: 690.346810 14 01 07 01 69 45 35 06 07 02 c9 06 dc 26 02
E: 690.363065 14 01 07 01 69 45 35 06 07 02 ca 06 dc 26 02
E: 690.378820 14 01 07 01 69 45 35 06 07 02 c9 06 dc 26 02
E: 690.390906 14 01 07 01 69 45 35 06 07 02 ca 06 dc 26 02
E: 690.407089 14 01 07 01 69 45 35 06 07 02 c8 06 db 26 02
E: 690.418897 14 01 07 01 69 45 36 06 07 02 c9 06 db 26 02
E: 690.434808 14 01 07 01 69 45 36 06 07 02 c9 06 db 26 02
E: 690.450915 14 01 07 01 6a 45 36 06 07 02 c9 06 db 26 02
E: 690.462789 14 01 07 01 69 45 36 06 07 02 ca 06 db 26 02
E: 690.479098 14 01 07 01 6a 45 36 06 07 02 c9 06 db 26 02
E: 690.494813 14 01 07 01 6b 45 37 06 07 02 ca 06 dc 26 02
E: 690.507016 14 01 07 01 6a 45 37 06 07 02 ca 06 dc 26 02
E: 690.522890 14 01 07 01 6a 45 37 06 07 02 ca 06 dc 26 02
E: 690.534792 14 01 07 01 69 45 36 06 07 02 c9 06 dc 26 02
E: 690.551002 14 01 07 01 69 45 36 06 07 02 c8 06 dc 26 02
E: 690.567076 14 01 07 01 6a 45 35 06 07 02 c7 06 dc 26 02
E: 690.578913 14 01 07 01 6a 45 34 06 07 02 c6 06 dc 26 02
E: 690.595075 14 01 07 01 6a 45 35 06 07 02 c6 06 dc 26 02
E: 690.610817 14 01 07 01 6a 45 35 06 07 02 c5 06 dc 26 02
E: 690.618815 14 01 06 01 6a 45 35 06 06 02 c5 06 dc 26 02
E: 690.630890 14 01 07 01 75 45 34 06 07 02 c9 06 d6 26 02
E: 690.642882 14 01 07 01 75 45 34 06 07 02 c9 06 d6 26 02
E: 690.658792 14 01 07 01 4a 11 2d 06 07 02 dc 06 d5 26 02
E: 690.670877 14 01 07 02 d5 06 d4 26 06 01 4a 11 2d 06 02
E: 690.678805 14 01 07 02 d5 06 d5 26 04 01 4a 11 2d 06 02
E: 690.686875 14 01 07 02 d3 06 d5 26 04 01 4a 11 2d 06 02
E: 690.694888 14 01 07 02 d1 06 d5 26 04 01 4a 11 2d 06 02
E: 690.702829 14 01 07 02 d0 06 d5 26 04 01 4a 11 2d 06 02
E: 690.714790 14 01 07 02 cf 06 d6 26 04 01 4a 11 2d 06 02
E: 690.722934 14 01 07 02 cd 06 d7 26 04 01 4a 11 2d 06 02
E: 690.730903 14 01 07 02 cd 06 d8 26 04 01 4a 11 2d 06 02
E: 690.738912 14 01 07 02 cc 06 d8 26 04 01 4a 11 2d 06 02
E: 690.746921 14 01 07 02 cd 06 d8 26 04 01 4a 11 2d 06 02
E: 690.758913 14 01 07 02 cd 06 d8 26 04 01 4a 11 2d 06 02
E: 690.766908 14 01 07 02 cc 06 d8 26 04 01 4a 11 2d 06 02
E: 690.774851 14 01 07 02 ca 06 d9 26 04 01 4a 11 2d 06 02
E: 690.782910 14 01 07 02 c9 06 d9 26 04 01 4a 11 2d 06 02
E: 690.794916 14 01 07 02 c8 06 d9 26 04 01 4a 11 2d 06 02
E: 690.802781 14 01 07 02 c7 06 da 26 04 01 4a 11 2d 06 02
E: 690.810868 14 01 07 02 c7 06 da 26 04 01 4a 11 2d 06 02
E: 690.822908 14 01 07 02 c6 06 d9 26 04 01 4a 11 2d 06 02
E: 690.830950 14 01 07 02 c5 06 d9 26 04 01 4a 11 2d 06 02
E: 690.838811 14 01 07 02 c4 06 d9 26 04 01 4a 11 2d 06 02
E: 690.846890 14 01 07 02 c4 06 d9 26 04 01 4a 11 2d 06 02
E: 690.854897 14 01 07 02 c3 06 da 26 04 01 4a 11 2d 06 02
E: 690.866802 14 01 07 02 c3 06 da 26 04 01 4a 11 2d 06 02
E: 690.875030 14 01 07 02 c3 06 da 26 04 01 4a 11 2d 06 02
E: 690.882882 14 01 07 02 c1 06 da 26 04 01 4a 11 2d 06 02
E: 690.894802 14 01 07 02 c0 06 da 26 04 01 4a 11 2d 06 02
E: 690.902782 14 01 07 02 c0 06 da 26 04 01 4a 11 2d 06 02
E: 690.910886 14 01 07 02 bf 06 da 26 04 01 4a 11 2d 06 02
E: 690.918880 14 01 07 02 be 06 da 26 04 01 4a 11 2d 06 02
E: 690.930804 14 01 07 02 bc 06 da 26 04 01 4a 11 2d 06 02
E: 690.938877 14 01 07 02 bc 06 da 26 04 01 4a 11 2d 06 02
E: 690.946904 14 01 07 02 bc 06 d9 26 04 01 4a 11 2d 06 02
E: 690.958813 14 01 07 02 bc 06 d9 26 04 01 4a 11 2d 06 02
E: 690.966999 14 01 07 02 bc 06 d9 26 04 01 4a 11 2d 06 02
E: 690.974896 14 01 07 02 bc 06 d9 26 04 01 4a 11 2d 06 02
E: 690.982806 14 01 07 02 bd 06 d9 26 04 01 4a 11 2d 06 02
E: 690.990807 14 01 07 02 bd 06 d9 26 04 01 4a 11 2d 06 02
E: 691.002882 14 01 07 02 bb 06 d9 26 04 01 4a 11 2d 06 02
E: 691.010799 14 01 07 02 bb 06 d9 26 04 01 4a 11 2d 06 02
E: 691.018795 14 01 07 02 bb 06 da 26 04 01 4a 11 2d 06 02
E: 691.027062 14 01 07 02 ba 06 da 26 04 01 4a 11 2d 06 02
E: 691.038892 14 01 07 02 b8 06 db 26 04 01 4a 11 2d 06 02
E: 691.046790 14 01 07 02 b8 06 db 26 04 01 4a 11 2d 06 02
E: 691.054971 14 01 07 02 b8 06 db 26 04 01 4a 11 2d 06 02
E: 691.062819 14 01 07 02 b8 06 db 26 04 01 4a 11 2d 06 02
E: 691.070816 14 01 07 02 b8 06 db 26 04 01 4a 11 2d 06 02
E: 691.082896 14 01 07 02 b8 06 db 26 04 01 4a 11 2d 06 02
E: 691.091057 14 01 07 02 b9 06 db 26 04 01 4a 11 2d 06 02
E: 691.098814 14 01 07 02 b9 06 dc 26 04 01 4a 11 2d 06 02
E: 691.110800 14 01 07 02 ba 06 db 26 04 01 4a 11 2d 06 02
E: 691.118822 14 01 07 02 b9 06 db 26 04 01 4a 11 2d 06 02
E: 691.130939 14 01 07 02 b9 06 db 26 04 01 4a 11 2d 06 02
E: 691.138797 14 01 07 02 b9 06 db 26 04 01 4a 11 2d 06 02
E: 691.150892 14 01 07 02 b9 06 db 26 04 01 4a 11 2d 06 02
E: 691.158834 14 01 07 02 b9 06 db 26 04 01 4a 11 2d 06 02
E: 691.166804 14 01 07 02 b9 06 db 26 04 01 4a 11 2d 06 02
E: 691.178883 14 01 07 02 b8 06 db 26 04 01 4a 11 2d 06 02
E: 691.186792 14 01 07 02 b8 06 dc 26 04 01 4a 11 2d 06 02
E: 691.194805 14 01 07 02 b7 06 dc 26 04 01 4a 11 2d 06 02
E: 691.202775 14 01 07 02 b6 06 dc 26 04 01 4a 11 2d 06 02
E: 691.210921 14 01 07 02 b6 06 db 26 04 01 4a 11 2d 06 02
E: 691.222800 14 01 07 02 b6 06 db 26 04 01 4a 11 2d 06 02
E: 691.231081 14 01 07 02 b6 06 db 26 04 01 4a 11 2d 06 02
E: 691.238878 14 01 07 02 b6 06 db 26 04 01 4a 11 2d 06 02
E: 691.246896 14 01 07 02 b7 06 db 26 04 01 4a 11 2d 06 02
E: 691.254821 14 01 07 02 b8 06 db 26 04 01 4a 11 2d 06 02
E: 691.266773 14 01 07 02 b9 06 db 26 04 01 4a 11 2d 06 02
E: 691.274838 14 01 07 02 bb 06 db 26 04 01 4a 11 2d 06 02
E: 691.282802 14 01 07 02 bc 06 db 26 04 01 4a 11 2d 06 02
E: 691.290888 14 01 07 02 be 06 dc 26 04 01 4a 11 2d 06 02
E: 691.298933 14 01 07 02 bf 06 dc 26 04 01 4a 11 2d 06 02
E: 691.306890 14 01 07 02 bf 06 dd 26 04 01 4a 11 2d 06 02
E: 691.318773 14 01 07 02 bf 06 df 26 04 01 4a 11 2d 06 02
E: 691.326941 14 01 07 02 c0 06 e3 26 04 01 4a 11 2d 06 02
E: 691.334979 14 01 07 02 be 06 e8 26 04 01 4a 11 2d 06 02
E: 691.342841 14 01 06 02 be 06 e8 26 04 01 4a 11 2d 06 02
E: 691.350891 14 01 04 02 be 06 e8 26 04 01 4a 11 2d 06 02
E: 693.730847 14 01 07 01 ef 3c 66 0f 04 02 4a 11 2d 06 02
E: 693.738847 14 01 07 01 ef 3c 62 0f 04 02 4a 11 2d 06 02
E: 693.746838 14 01 07 01 ec 3c 5c 0f 04 02 4a 11 2d 06 02
E: 693.758819 14 01 07 01 e8 3c 57 0f 04 02 4a 11 2d 06 02
E: 693.766821 14 01 07 01 e4 3c 54 0f 04 02 4a 11 2d 06 02
E: 693.774823 14 01 07 01 e0 3c 51 0f 04 02 4a 11 2d 06 02
E: 693.782847 14 01 07 01 dc 3c 4f 0f 04 02 4a 11 2d 06 02
E: 693.790844 14 01 07 01 d9 3c 4f 0f 04 02 4a 11 2d 06 02
E: 693.802844 14 01 07 01 d6 3c 4f 0f 04 02 4a 11 2d 06 02
E: 693.810850 14 01 07 01 d1 3c 50 0f 04 02 4a 11 2d 06 02
E: 693.818834 14 01 07 01 ce 3c 4f 0f 04 02 4a 11 2d 06 02
E: 693.826847 14 01 07 01 ca 3c 50 0f 04 02 4a 11 2d 06 02
E: 693.834833 14 01 07 01 c6 3c 52 0f 04 02 4a 11 2d 06 02
E: 693.846806 14 01 07 01 c2 3c 53 0f 04 02 4a 11 2d 06 02
E: 693.854840 14 01 07 01 be 3c 54 0f 04 02 4a 11 2d 06 02
E: 693.862848 14 01 07 01 b9 3c 57 0f 04 02 4a 11 2d 06 02
E: 693.870848 14 01 07 01 b5 3c 5a 0f 04 02 4a 11 2d 06 02
E: 693.878849 14 01 07 01 b1 3c 5d 0f 04 02 4a 11 2d 06 02
E: 693.890837 14 01 07 01 ac 3c 62 0f 04 02 4a 11 2d 06 02
E: 693.898838 14 01 07 01 a7 3c 67 0f 04 02 4a 11 2d 06 02
E: 693.906735 14 01 07 01 a2 3c 6e 0f 04 02 4a 11 2d 06 02
E: 693.914763 14 01 07 01 9d 3c 76 0f 04 02 4a 11 2d 06 02
E: 693.922832 14 01 07 01 98 3c 7f 0f 04 02 4a 11 2d 06 02
E: 693.934857 14 01 07 01 94 3c 8b 0f 04 02 4a 11 2d 06 02
E: 693.942779 14 01 07 01 8f 3c 9a 0f 04 02 4a 11 2d 06 02
E: 693.950773 14 01 07 01 8b 3c a8 0f 04 02 4a 11 2d 06 02
E: 693.958911 14 01 07 01 87 3c b8 0f 04 02 4a 11 2d 06 02
E: 693.966833 14 01 07 01 83 3c c8 0f 04 02 4a 11 2d 06 02
E: 693.978919 14 01 07 01 80 3c d9 0f 04 02 4a 11 2d 06 02
E: 693.986894 14 01 07 01 7d 3c ea 0f 04 02 4a 11 2d 06 02
E: 693.994729 14 01 07 01 7a 3c fa 0f 04 02 4a 11 2d 06 02
E: 694.002746 14 01 07 01 77 3c 0a 10 04 02 4a 11 2d 06 02
E: 694.010723 14 01 07 01 75 3c 1a 10 04 02 4a 11 2d 06 02
E: 694.022729 14 01 07 01 77 3c 29 10 04 02 4a 11 2d 06 02
E: 694.030730 14 01 07 01 76 3c 38 10 04 02 4a 11 2d 06 02
E: 694.038721 14 01 07 01 75 3c 46 10 04 02 4a 11 2d 06 02
E: 694.046725 14 01 07 01 75 3c 53 10 04 02 4a 11 2d 06 02
E: 694.054899 14 01 07 01 75 3c 60 10 04 02 4a 11 2d 06 02
E: 694.066853 14 01 07 01 76 3c 6b 10 04 02 4a 11 2d 06 02
E: 694.075021 14 01 07 01 76 3c 77 10 04 02 4a 11 2d 06 02
E: 694.083014 14 01 07 01 77 3c 81 10 04 02 4a 11 2d 06 02
E: 694.090827 14 01 07 01 78 3c 8b 10 04 02 4a 11 2d 06 02
E: 694.098719 14 01 07 01 7a 3c 95 10 04 02 4a 11 2d 06 02
E: 694.110816 14 01 07 01 7c 3c 9f 10 04 02 4a 11 2d 06 02
E: 694.118735 14 01 07 01 7d 3c a8 10 04 02 4a 11 2d 06 02
E: 694.126735 14 01 07 01 7f 3c b2 10 04 02 4a 11 2d 06 02
E: 694.134737 14 01 07 01 80 3c b9 10 04 02 4a 11 2d 06 02
E: 694.142849 14 01 07 01 82 3c c0 10 04 02 4a 11 2d 06 02
E: 694.150761 14 01 07 01 82 3c c0 10 04 02 4a 11 2d 06 02
E: 694.174753 14 01 07 01 82 3c c0 10 07 02 8d 35 88 19 02
E: 694.190838 14 01 07 01 bf 3c e5 10 07 02 91 35 8a 19 02
E: 694.198852 14 01 07 02 c5 35 a4 19 06 01 bf 3c e5 10 02
E: 694.206744 14 01 07 02 c5 35 a5 19 04 01 bf 3c e5 10 02
E: 694.214747 14 01 07 02 c6 35 a7 19 04 01 bf 3c e5 10 02
E: 694.226830 14 01 07 02 c8 35 aa 19 04 01 bf 3c e5 10 02
E: 694.234815 14 01 07 02 ca 35 ad 19 04 01 bf 3c e5 10 02
E: 694.242745 14 01 07 02 cd 35 b0 19 04 01 bf 3c e5 10 02
E: 694.250831 14 01 07 02 d0 35 b4 19 04 01 bf 3c e5 10 02
E: 694.258819 14 01 07 02 d3 35 b8 19 04 01 bf 3c e5 10 02
E: 694.270786 14 01 07 02 d5 35 bc 19 04 01 bf 3c e5 10 02
E: 694.278894 14 01 07 02 d6 35 c0 19 04 01 bf 3c e5 10 02
E: 694.286720 14 01 07 02 d8 35 c3 19 04 01 bf 3c e5 10 02
E: 694.294811 14 01 07 02 d9 35 c7 19 04 01 bf 3c e5 10 02
E: 694.302726 14 01 07 02 da 35 ca 19 04 01 bf 3c e5 10 02
E: 694.314723 14 01 07 02 db 35 cd 19 04 01 bf 3c e5 10 02
E: 694.322881 14 01 07 02 dc 35 d1 19 04 01 bf 3c e5 10 02
E: 694.330737 14 01 07 02 de 35 d5 19 04 01 bf 3c e5 10 02
E: 694.338763 14 01 07 02 e0 35 d9 19 04 01 bf 3c e5 10 02
E: 694.346819 14 01 07 02 e1 35 dd 19 04 01 bf 3c e5 10 02
E: 694.354752 14 01 07 02 e3 35 e2 19 04 01 bf 3c e5 10 02
E: 694.366821 14 01 07 02 e4 35 e7 19 04 01 bf 3c e5 10 02
E: 694.374827 14 01 07 02 e2 35 ed 19 04 01 bf 3c e5 10 02
E: 694.382829 14 01 07 02 e2 35 ed 19 04 01 bf 3c e5 10 02
E: 694.403033 14 01 07 02 e2 35 ed 19 07 01 f9 33 5a 14 02
E: 694.414722 14 01 07 02 e2 35 ed 19 07 01 f9 33 5a 14 02
E: 694.430835 14 01 07 02 1d 36 48 1a 07 01 f9 33 5a 14 02
E: 694.442734 14 01 07 01 33 34 38 15 06 02 1d 36 48 1a 02
E: 694.450746 14 01 07 01 31 34 39 15 04 02 1d 36 48 1a 02
E: 694.459007 14 01 07 01 2f 34 3a 15 04 02 1d 36 48 1a 02
E: 694.466824 14 01 07 01 2c 34 3b 15 04 02 1d 36 48 1a 02
E: 694.474720 14 01 07 01 29 34 3c 15 04 02 1d 36 48 1a 02
E: 694.486839 14 01 07 01 28 34 3d 15 04 02 1d 36 48 1a 02
E: 694.494811 14 01 07 01 28 34 3d 15 04 02 1d 36 48 1a 02
E: 694.514841 14 01 07 01 28 34 3d 15 07 02 93 2d b4 08 02
E: 694.526814 14 01 07 01 28 34 3d 15 07 02 93 2d b4 08 02
E: 694.542820 14 01 07 01 f1 33 4c 15 07 02 9a 2d b3 08 02
E: 694.554719 14 01 07 01 f1 33 4c 15 07 02 9a 2d b3 08 02
E: 694.570776 14 01 07 01 e5 33 53 15 07 02 a1 2d b1 08 02
E: 694.579002 14 01 07 01 e5 33 53 15 07 02 a1 2d b1 08 02
E: 694.598744 14 01 07 01 df 33 59 15 07 02 a3 2d b0 08 02
E: 694.606821 14 01 07 01 df 33 59 15 07 02 a3 2d b0 08 02
E: 694.626734 14 01 07 01 e1 33 5e 15 07 02 a5 2d ae 08 02
E: 694.634988 14 01 07 01 e1 33 5e 15 07 02 a5 2d ae 08 02
E: 694.654729 14 01 07 01 e1 33 5e 15 07 02 a5 2d ae 08 02
E: 694.667029 14 01 07 02 b9 2d c2 08 06 01 e1 33 5e 15 02
E: 694.674816 14 01 07 02 b8 2d c3 08 04 01 e1 33 5e 15 02
E: 694.682716 14 01 07 02 b7 2d c5 08 04 01 e1 33 5e 15 02
E: 694.694820 14 01 07 02 b6 2d c7 08 04 01 e1 33 5e 15 02
E: 694.702832 14 01 07 02 b4 2d c9 08 04 01 e1 33 5e 15 02
E: 694.710842 14 01 07 02 b1 2d cb 08 04 01 e1 33 5e 15 02
E: 694.718753 14 01 07 02 af 2d cf 08 04 01 e1 33 5e 15 02
E: 694.730876 14 01 07 02 ab 2d d3 08 04 01 e1 33 5e 15 02
E: 694.738824 14 01 07 02 a8 2d d6 08 04 01 e1 33 5e 15 02
E: 694.746742 14 01 07 02 a5 2d da 08 04 01 e1 33 5e 15 02
E: 694.754711 14 01 07 02 a2 2d dd 08 04 01 e1 33 5e 15 02
E: 694.766825 14 01 07 02 9f 2d e3 08 04 01 e1 33 5e 15 02
E: 694.774754 14 01 07 02 9c 2d e5 08 04 01 e1 33 5e 15 02
E: 694.782734 14 01 07 02 9c 2d e5 08 04 01 e1 33 5e 15 02
E: 694.802834 14 01 07 02 9c 2d e5 08 04 01 e1 33 5e 15 02
E: 694.810734 14 01 07 02 97 2d e7 08 04 01 e1 33 5e 15 02
E: 694.823020 14 01 07 02 92 2d e8 08 04 01 e1 33 5e 15 02
E: 694.830753 14 01 07 02 8d 2d ea 08 04 01 e1 33 5e 15 02
E: 694.838735 14 01 07 02 88 2d ec 08 04 01 e1 33 5e 15 02
E: 694.850996 14 01 07 02 83 2d f0 08 04 01 e1 33 5e 15 02
E: 694.858712 14 01 07 02 7e 2d f4 08 04 01 e1 33 5e 15 02
E: 694.870738 14 01 07 02 7e 2d f4 08 07 01 3d 43 1c 1a 02
E: 694.886795 14 01 07 02 58 2d 1b 09 07 01 3d 43 23 1a 02
E: 694.902730 14 01 07 02 55 2d 1d 09 07 01 3d 43 25 1a 02
E: 694.918777 14 01 07 02 52 2d 1e 09 07 01 3d 43 27 1a 02
E: 694.930833 14 01 07 02 4d 2d 1e 09 07 01 3e 43 2a 1a 02
E: 694.946712 14 01 07 02 48 2d 1c 09 07 01 3e 43 2d 1a 02
E: 694.962736 14 01 07 02 42 2d 18 09 07 01 3e 43 31 1a 02
E: 694.978725 14 01 07 02 3b 2d 14 09 07 01 3d 43 35 1a 02
E: 694.990828 14 01 07 02 32 2d 17 09 07 01 3d 43 39 1a 02
E: 695.002804 14 01 07 01 4d 43 5e 1a 06 02 32 2d 17 09 02
E: 695.010704 14 01 07 01 4f 43 61 1a 04 02 32 2d 17 09 02
E: 695.018816 14 01 07 01 57 43 65 1a 04 02 32 2d 17 09 02
E: 695.030711 14 01 06 01 57 43 65 1a 04 02 32 2d 17 09 02
E: 695.038728 14 01 04 01 57 43 65 1a 04 02 32 2d 17 09 02
E: 696.206813 14 01 04 01 57 43 65 1a 04 02 32 2d 17 09 02
E: 696.234963 14 01 07 01 51 32 d0 11 07 02 25 39 60 0c 02
E: 696.242814 14 01 07 01 51 32 d0 11 07 02 25 39 60 0c 02
E: 696.262805 14 01 07 01 5d 32 ea 11 07 02 2c 39 7b 0c 02
E: 696.270951 14 01 07 01 5d 32 ea 11 07 02 2c 39 7b 0c 02
E: 696.290713 14 01 07 01 79 32 01 12 07 02 35 39 97 0c 02
E: 696.302804 14 01 07 01 b7 32 60 12 07 02 57 39 c2 0c 02
E: 696.318960 14 01 07 01 03 33 d8 12 07 02 94 39 05 0d 02
E: 696.330826 14 01 07 01 4a 33 4a 13 07 02 d2 39 51 0d 02
E: 696.346751 14 01 07 01 7e 33 9d 13 07 02 00 3a 8e 0d 02
E: 696.354731 14 01 07 01 7e 33 9d 13 07 02 00 3a 8e 0d 02
E: 696.374688 14 01 07 01 e6 33 15 14 07 02 18 3a e8 0d 02
E: 696.390974 14 01 07 01 4a 34 d4 14 07 02 68 3a 8a 0e 02
E: 696.402956 14 01 07 01 9d 34 5c 15 07 02 be 3a 01 0f 02
E: 696.410720 14 01 07 01 9d 34 5c 15 07 02 be 3a 01 0f 02
E: 696.430826 14 01 07 01 51 35 10 16 07 02 15 3b ae 0f 02
E: 696.438710 14 01 06 01 51 35 10 16 06 02 15 3b ae 0f 02
E: 696.450791 14 01 04 01 51 35 10 16 04 02 15 3b ae 0f 02
E: 696.510794 14 01 04 01 51 35 10 16 04 02 15 3b ae 0f 02
E: 696.534701 14 01 07 01 eb 38 8c 1a 04 02 15 3b ae 0f 02
E: 696.542791 14 01 06 01 eb 38 8c 1a 04 02 15 3b ae 0f 02
E: 696.550792 14 01 04 01 eb 38 8c 1a 04 02 15 3b ae 0f 02
E: 696.790803 14 01 04 01 eb 38 8c 1a 04 02 15 3b ae 0f 02
E: 696.818870 14 01 07 01 b9 41 36 1c 07 02 0b 37 18 23 02
E: 696.826775 14 01 06 01 b9 41 36 1c 06 02 0b 37 18 23 02
E: 696.834820 14 01 04 01 b9 41 36 1c 04 02 0b 37 18 23 02
E: 696.946792 14 01 07 01 39 41 5e 20 07 02 bf 37 2c 28 02
E: 696.954418 14 01 07 01 39 41 5e 20 07 02 bf 37 2c 28 02
E: 696.974782 14 01 07 01 39 41 5e 20 07 02 bf 37 2c 28 02
E: 696.982747 14 01 06 01 39 41 5e 20 06 02 bf 37 2c 28 02
E: 696.990766 14 01 04 01 39 41 5e 20 04 02 bf 37 2c 28 02
E: 697.506795 14 01 07 01 d3 33 a8 1f 04 02 bf 37 2c 28 02
E: 697.514939 14 01 07 01 d4 33 a6 1f 04 02 bf 37 2c 28 02
E: 697.526672 14 01 07 01 d6 33 a6 1f 04 02 bf 37 2c 28 02
E: 697.534697 14 01 07 01 d6 33 a4 1f 04 02 bf 37 2c 28 02
E: 697.542832 14 01 07 01 d6 33 a2 1f 04 02 bf 37 2c 28 02
E: 697.554685 14 01 07 01 d6 33 9f 1f 04 02 bf 37 2c 28 02
E: 697.562785 14 01 07 01 d6 33 9c 1f 04 02 bf 37 2c 28 02
E: 697.570948 14 01 07 01 d6 33 99 1f 04 02 bf 37 2c 28 02
E: 697.578948 14 01 07 01 da 33 94 1f 04 02 bf 37 2c 28 02
E: 697.586779 14 01 07 01 e3 33 89 1f 04 02 bf 37 2c 28 02
E: 697.594699 14 01 07 01 e3 33 89 1f 04 02 bf 37 2c 28 02
E: 697.618706 14 01 07 01 e3 33 89 1f 07 02 45 04 54 22 02
E: 697.626680 14 01 07 01 e3 33 89 1f 07 02 45 04 54 22 02
E: 697.646719 14 01 07 01 86 34 e1 1d 07 02 46 04 57 22 02
E: 697.654779 14 01 07 01 86 34 e1 1d 07 02 46 04 57 22 02
E: 697.674677 14 01 07 01 dd 34 1a 1d 07 02 46 04 59 22 02
E: 697.690780 14 01 07 01 5a 35 5e 1c 07 02 46 04 61 22 02
E: 697.702675 14 01 07 01 d6 35 a1 1b 07 02 43 04 63 22 02
E: 697.718940 14 01 07 01 4e 36 e3 1a 07 02 41 04 61 22 02
E: 697.734762 14 01 07 01 ba 36 26 1a 07 02 3e 04 5b 22 02
E: 697.746718 14 01 07 01 20 37 64 19 07 02 3a 04 53 22 02
E: 697.762724 14 01 07 01 85 37 aa 18 07 02 37 04 4a 22 02
E: 697.778740 14 01 07 01 e1 37 f4 17 07 02 32 04 39 22 02
E: 697.790666 14 01 07 01 40 38 38 17 07 02 1b 04 0a 22 02
E: 697.806682 14 01 07 01 9b 38 7f 16 07 02 fe 03 d3 21 02
E: 697.822760 14 01 07 01 f1 38 cd 15 07 02 e3 03 9d 21 02
E: 697.834692 14 01 07 01 31 39 19 15 07 02 c8 03 6f 21 02
E: 697.850923 14 01 07 01 70 39 66 14 07 02 b6 03 3b 21 02
E: 697.866676 14 01 07 01 ae 39 b4 13 07 02 aa 03 10 21 02
E: 697.882905 14 01 07 01 e7 39 f7 12 07 02 a8 03 e9 20 02
E: 697.894672 14 01 07 01 1c 3a 2d 12 07 02 ad 03 b9 20 02
E: 697.910660 14 01 07 01 44 3a 52 11 07 02 c3 03 6b 20 02
E: 697.926673 14 01 07 01 5a 3a 7a 10 07 02 e9 03 1c 20 02
E: 697.938740 14 01 07 01 5f 3a a7 0f 07 02 13 04 c6 1f 02
E: 697.954242 14 01 07 01 4f 3a e8 0e 07 02 40 04 70 1f 02
E: 697.970768 14 01 07 01 29 3a 38 0e 07 02 6f 04 1c 1f 02
E: 697.982681 14 01 07 01 f4 39 9d 0d 07 02 9f 04 d1 1e 02
E: 697.998930 14 01 07 01 ad 39 12 0d 07 02 dc 04 90 1e 02
E: 698.014652 14 01 07 01 6f 39 b4 0c 07 02 0e 05 62 1e 02
E: 698.026657 14 01 07 01 2f 39 63 0c 07 02 41 05 3c 1e 02
E: 698.034765 14 01 07 01 2f 39 63 0c 07 02 41 05 3c 1e 02
E: 698.054958 14 01 07 01 13 39 43 0c 07 02 ca 0b 2e 1e 02
E: 698.066749 14 01 06 01 13 39 43 0c 06 02 ca 0b 2e 1e 02
E: 698.074677 14 01 04 01 13 39 43 0c 04 02 ca 0b 2e 1e 02
