R: 177 05 0d 09 04 a1 01 85 01 09 22 a1 02 09 42 15 00 25 01 75 01 95 01 81 02 09 32 81 02 09 47 81 02 95 05 81 03 09 51 75 08 95 01 81 02 05 01 35 00 55 0e 65 33 75 10 95 01 09 30 26 ff 49 46 f2 03 81 02 09 31 26 ff 29 46 39 02 81 02 46 00 00 c0 a1 02 05 0d 09 42 15 00 25 01 75 01 95 01 81 02 09 32 81 02 09 47 81 02 95 05 81 03 09 51 75 08 95 01 81 02 05 01 35 00 55 0e 65 33 75 10 95 01 09 30 26 ff 49 46 f2 03 81 02 09 31 26 ff 29 46 39 02 81 02 46 00 00 c0 05 0d 09 54 75 08 95 01 81 02 05 0d 85 02 09 55 25 02 75 08 95 01 b1 02 c0
N: Cando      11.6 
I: 3 2087 0b03
E: 3812.090096 14 01 07 01 56 08 27 07 04 02 b6 1d 0e 1c 02
E: 3812.098082 14 01 07 01 55 08 28 07 04 02 b6 1d 0e 1c 02
E: 3812.106091 14 01 07 01 54 08 2a 07 04 02 b6 1d 0e 1c 02
E: 3812.114091 14 01 07 01 51 08 2f 07 04 02 b6 1d 0e 1c 02
E: 3812.122077 14 01 07 01 4e 08 38 07 04 02 b6 1d 0e 1c 02
E: 3812.130073 14 01 07 01 4a 08 45 07 04 02 b6 1d 0e 1c 02
E: 3812.134052 14 01 07 01 46 08 56 07 04 02 b6 1d 0e 1c 02
E: 3812.142034 14 01 07 01 43 08 6b 07 04 02 b6 1d 0e 1c 02
E: 3812.150099 14 01 07 01 40 08 83 07 04 02 b6 1d 0e 1c 02
E: 3812.158096 14 01 07 01 3d 08 9d 07 04 02 b6 1d 0e 1c 02
E: 3812.166093 14 01 07 01 3b 08 b9 07 04 02 b6 1d 0e 1c 02
E: 3812.174014 14 01 07 01 39 08 d6 07 04 02 b6 1d 0e 1c 02
E: 3812.182016 14 01 07 01 37 08 f6 07 04 02 b6 1d 0e 1c 02
E: 3812.190059 14 01 07 01 36 08 1b 08 04 02 b6 1d 0e 1c 02
E: 3812.198074 14 01 07 01 35 08 41 08 04 02 b6 1d 0e 1c 02
E: 3812.206067 14 01 07 01 34 08 67 08 04 02 b6 1d 0e 1c 02
E: 3812.214053 14 01 07 01 33 08 8d 08 04 02 b6 1d 0e 1c 02
E: 3812.222066 14 01 07 01 32 08 b3 08 04 02 b6 1d 0e 1c 02
E: 3812.230057 14 01 07 01 31 08 d9 08 04 02 b6 1d 0e 1c 02
E: 3812.238093 14 01 07 01 30 08 fe 08 04 02 b6 1d 0e 1c 02
E: 3812.246069 14 01 07 01 2f 08 23 09 04 02 b6 1d 0e 1c 02
E: 3812.254061 14 01 07 01 2f 08 48 09 04 02 b6 1d 0e 1c 02
E: 3812.262029 14 01 07 01 2f 08 6c 09 04 02 b6 1d 0e 1c 02
E: 3812.270009 14 01 07 01 2f 08 8f 09 04 02 b6 1d 0e 1c 02
E: 3812.278000 14 01 07 01 2f 08 b1 09 04 02 b6 1d 0e 1c 02
E: 3812.286018 14 01 07 01 2f 08 d3 09 04 02 b6 1d 0e 1c 02
E: 3812.294014 14 01 07 01 2f 08 f6 09 04 02 b6 1d 0e 1c 02
E: 3812.302009 14 01 07 01 2f 08 1c 0a 04 02 b6 1d 0e 1c 02
E: 3812.310001 14 01 07 01 2f 08 42 0a 04 02 b6 1d 0e 1c 02
E: 3812.318007 14 01 07 01 2f 08 68 0a 04 02 b6 1d 0e 1c 02
E: 3812.326010 14 01 07 01 2f 08 8e 0a 04 02 b6 1d 0e 1c 02
E: 3812.333996 14 01 07 01 2f 08 b5 0a 04 02 b6 1d 0e 1c 02
E: 3812.342002 14 01 07 01 2f 08 dc 0a 04 02 b6 1d 0e 1c 02
E: 3812.350024 14 01 07 01 30 08 15 0b 04 02 b6 1d 0e 1c 02
E: 3812.358009 14 01 07 01 32 08 52 0b 04 02 b6 1d 0e 1c 02
E: 3812.365999 14 01 07 01 34 08 8a 0b 04 02 b6 1d 0e 1c 02
E: 3812.374026 14 01 07 01 36 08 bc 0b 04 02 b6 1d 0e 1c 02
E: 3812.382029 14 01 07 01 38 08 da 0b 04 02 b6 1d 0e 1c 02
E: 3812.390095 14 01 07 01 39 08 f7 0b 04 02 b6 1d 0e 1c 02
E: 3812.398070 14 01 07 01 3a 08 15 0c 04 02 b6 1d 0e 1c 02
E: 3812.402053 14 01 07 01 3c 08 47 0c 04 02 b6 1d 0e 1c 02
E: 3812.410084 14 01 07 01 3c 08 69 0c 04 02 b6 1d 0e 1c 02
E: 3812.418059 14 01 07 01 3d 08 99 0c 04 02 b6 1d 0e 1c 02
E: 3812.426053 14 01 07 01 3d 08 b9 0c 04 02 b6 1d 0e 1c 02
E: 3812.434062 14 01 07 01 3d 08 d8 0c 04 02 b6 1d 0e 1c 02
E: 3812.442071 14 01 07 01 3d 08 f6 0c 04 02 b6 1d 0e 1c 02
E: 3812.450059 14 01 07 01 3d 08 14 0d 04 02 b6 1d 0e 1c 02
E: 3812.458056 14 01 07 01 3c 08 33 0d 04 02 b6 1d 0e 1c 02
E: 3812.466075 14 01 07 01 3b 08 52 0d 04 02 b6 1d 0e 1c 02
E: 3812.474067 14 01 07 01 3b 08 72 0d 04 02 b6 1d 0e 1c 02
E: 3812.482062 14 01 07 01 3b 08 92 0d 04 02 b6 1d 0e 1c 02
E: 3812.490059 14 01 07 01 3b 08 b2 0d 04 02 b6 1d 0e 1c 02
E: 3812.498079 14 01 07 01 3b 08 d1 0d 04 02 b6 1d 0e 1c 02
E: 3812.506059 14 01 07 01 3b 08 f2 0d 04 02 b6 1d 0e 1c 02
E: 3812.514051 14 01 07 01 3b 08 17 0e 04 02 b6 1d 0e 1c 02
E: 3812.522061 14 01 07 01 3a 08 3d 0e 04 02 b6 1d 0e 1c 02
E: 3812.530078 14 01 07 01 39 08 63 0e 04 02 b6 1d 0e 1c 02
E: 3812.538060 14 01 07 01 38 08 89 0e 04 02 b6 1d 0e 1c 02
E: 3812.546054 14 01 07 01 36 08 ad 0e 04 02 b6 1d 0e 1c 02
E: 3812.554072 14 01 07 01 35 08 d1 0e 04 02 b6 1d 0e 1c 02
E: 3812.562080 14 01 07 01 34 08 f5 0e 04 02 b6 1d 0e 1c 02
E: 3812.570074 14 01 07 01 33 08 18 0f 04 02 b6 1d 0e 1c 02
E: 3812.578056 14 01 07 01 32 08 3a 0f 04 02 b6 1d 0e 1c 02
E: 3812.586058 14 01 07 01 32 08 5c 0f 04 02 b6 1d 0e 1c 02
E: 3812.594087 14 01 07 01 32 08 7d 0f 04 02 b6 1d 0e 1c 02
E: 3812.602072 14 01 07 01 33 08 ae 0f 04 02 b6 1d 0e 1c 02
E: 3812.610082 14 01 07 01 34 08 de 0f 04 02 b6 1d 0e 1c 02
E: 3812.618064 14 01 07 01 34 08 fc 0f 04 02 b6 1d 0e 1c 02
E: 3812.626082 14 01 07 01 34 08 18 10 04 02 b6 1d 0e 1c 02
E: 3812.634059 14 01 07 01 34 08 37 10 04 02 b6 1d 0e 1c 02
E: 3812.642001 14 01 07 01 34 08 56 10 04 02 b6 1d 0e 1c 02
E: 3812.650013 14 01 07 01 34 08 75 10 04 02 b6 1d 0e 1c 02
E: 3812.658082 14 01 07 01 34 08 94 10 04 02 b6 1d 0e 1c 02
E: 3812.666062 14 01 07 01 34 08 b3 10 04 02 b6 1d 0e 1c 02
E: 3812.674069 14 01 07 01 34 08 d2 10 04 02 b6 1d 0e 1c 02
E: 3812.678063 14 01 07 01 34 08 f0 10 04 02 b6 1d 0e 1c 02
E: 3812.686084 14 01 07 01 34 08 0e 11 04 02 b6 1d 0e 1c 02
E: 3812.694081 14 01 07 01 34 08 2c 11 04 02 b6 1d 0e 1c 02
E: 3812.702058 14 01 07 01 34 08 4a 11 04 02 b6 1d 0e 1c 02
E: 3812.710068 14 01 07 01 35 08 68 11 04 02 b6 1d 0e 1c 02
E: 3812.718064 14 01 07 01 37 08 86 11 04 02 b6 1d 0e 1c 02
E: 3812.726055 14 01 07 01 39 08 a3 11 04 02 b6 1d 0e 1c 02
E: 3812.734075 14 01 07 01 3a 08 bf 11 04 02 b6 1d 0e 1c 02
E: 3812.742066 14 01 07 01 3b 08 db 11 04 02 b6 1d 0e 1c 02
E: 3812.750051 14 01 07 01 3d 08 f8 11 04 02 b6 1d 0e 1c 02
E: 3812.758062 14 01 07 01 3f 08 16 12 04 02 b6 1d 0e 1c 02
E: 3812.766054 14 01 07 01 42 08 47 12 04 02 b6 1d 0e 1c 02
E: 3812.774075 14 01 07 01 44 08 7a 12 04 02 b6 1d 0e 1c 02
E: 3812.782050 14 01 07 01 46 08 99 12 04 02 b6 1d 0e 1c 02
E: 3812.790077 14 01 07 01 47 08 b6 12 04 02 b6 1d 0e 1c 02
E: 3812.798070 14 01 07 01 48 08 d2 12 04 02 b6 1d 0e 1c 02
E: 3812.806084 14 01 07 01 4a 08 ed 12 04 02 b6 1d 0e 1c 02
E: 3812.814056 14 01 07 01 4b 08 08 13 04 02 b6 1d 0e 1c 02
E: 3812.822079 14 01 07 01 4d 08 23 13 04 02 b6 1d 0e 1c 02
E: 3812.830069 14 01 07 01 4f 08 3e 13 04 02 b6 1d 0e 1c 02
E: 3812.838060 14 01 07 01 51 08 59 13 04 02 b6 1d 0e 1c 02
E: 3812.846057 14 01 07 01 53 08 74 13 04 02 b6 1d 0e 1c 02
E: 3812.854068 14 01 07 01 54 08 8f 13 04 02 b6 1d 0e 1c 02
E: 3812.862074 14 01 07 01 56 08 aa 13 04 02 b6 1d 0e 1c 02
E: 3812.870068 14 01 07 01 58 08 c5 13 04 02 b6 1d 0e 1c 02
E: 3812.878077 14 01 07 01 5b 08 df 13 04 02 b6 1d 0e 1c 02
E: 3812.886064 14 01 07 01 5e 08 f9 13 04 02 b6 1d 0e 1c 02
E: 3812.894087 14 01 07 01 61 08 13 14 04 02 b6 1d 0e 1c 02
E: 3812.902073 14 01 07 01 65 08 2f 14 04 02 b6 1d 0e 1c 02
E: 3812.910002 14 01 07 01 69 08 4e 14 04 02 b6 1d 0e 1c 02
E: 3812.918003 14 01 07 01 6d 08 6c 14 04 02 b6 1d 0e 1c 02
E: 3812.926016 14 01 07 01 72 08 8a 14 04 02 b6 1d 0e 1c 02
E: 3812.934063 14 01 07 01 76 08 a7 14 04 02 b6 1d 0e 1c 02
E: 3812.942052 14 01 07 01 7a 08 c4 14 04 02 b6 1d 0e 1c 02
E: 3812.950067 14 01 07 01 7f 08 e1 14 04 02 b6 1d 0e 1c 02
E: 3812.958056 14 01 07 01 84 08 fe 14 04 02 b6 1d 0e 1c 02
E: 3812.966053 14 01 07 01 8a 08 1b 15 04 02 b6 1d 0e 1c 02
E: 3812.974072 14 01 07 01 90 08 37 15 04 02 b6 1d 0e 1c 02
E: 3812.982074 14 01 07 01 97 08 53 15 04 02 b6 1d 0e 1c 02
E: 3812.990051 14 01 07 01 9c 08 70 15 04 02 b6 1d 0e 1c 02
E: 3812.998073 14 01 07 01 a2 08 8d 15 04 02 b6 1d 0e 1c 02
E: 3813.006019 14 01 07 01 a7 08 aa 15 04 02 b6 1d 0e 1c 02
E: 3813.009996 14 01 07 01 ad 08 c8 15 04 02 b6 1d 0e 1c 02
E: 3813.018048 14 01 07 01 b4 08 e6 15 04 02 b6 1d 0e 1c 02
E: 3813.026061 14 01 07 01 bd 08 17 16 04 02 b6 1d 0e 1c 02
E: 3813.034056 14 01 07 01 c6 08 4f 16 04 02 b6 1d 0e 1c 02
E: 3813.042078 14 01 07 01 cf 08 81 16 04 02 b6 1d 0e 1c 02
E: 3813.050049 14 01 07 01 db 08 b1 16 04 02 b6 1d 0e 1c 02
E: 3813.058063 14 01 07 01 e1 08 d0 16 04 02 b6 1d 0e 1c 02
E: 3813.066028 14 01 07 01 ea 08 ed 16 04 02 b6 1d 0e 1c 02
E: 3813.074076 14 01 07 01 f2 08 0b 17 04 02 b6 1d 0e 1c 02
E: 3813.082069 14 01 07 01 f8 08 2a 17 04 02 b6 1d 0e 1c 02
E: 3813.090062 14 01 07 01 03 09 5a 17 04 02 b6 1d 0e 1c 02
E: 3813.098074 14 01 07 01 11 09 92 17 04 02 b6 1d 0e 1c 02
E: 3813.106078 14 01 07 01 1f 09 c6 17 04 02 b6 1d 0e 1c 02
E: 3813.114056 14 01 07 01 2e 09 fb 17 04 02 b6 1d 0e 1c 02
E: 3813.122072 14 01 07 01 3c 09 31 18 04 02 b6 1d 0e 1c 02
E: 3813.130084 14 01 07 01 4a 09 64 18 04 02 b6 1d 0e 1c 02
E: 3813.138068 14 01 07 01 57 09 96 18 04 02 b6 1d 0e 1c 02
E: 3813.146058 14 01 07 01 65 09 c7 18 04 02 b6 1d 0e 1c 02
E: 3813.154058 14 01 07 01 6f 09 e6 18 04 02 b6 1d 0e 1c 02
E: 3813.162059 14 01 07 01 7c 09 16 19 04 02 b6 1d 0e 1c 02
E: 3813.170066 14 01 07 01 8b 09 4c 19 04 02 b6 1d 0e 1c 02
E: 3813.178073 14 01 07 01 9d 09 80 19 04 02 b6 1d 0e 1c 02
E: 3813.186026 14 01 07 01 af 09 b2 19 04 02 b6 1d 0e 1c 02
E: 3813.194016 14 01 07 01 c1 09 e2 19 04 02 b6 1d 0e 1c 02
E: 3813.202051 14 01 07 01 d4 09 15 1a 04 02 b6 1d 0e 1c 02
E: 3813.210054 14 01 07 01 e5 09 4b 1a 04 02 b6 1d 0e 1c 02
E: 3813.218056 14 01 07 01 f7 09 81 1a 04 02 b6 1d 0e 1c 02
E: 3813.226086 14 01 07 01 09 0a b4 1a 04 02 b6 1d 0e 1c 02
E: 3813.234064 14 01 07 01 19 0a e5 1a 04 02 b6 1d 0e 1c 02
E: 3813.242072 14 01 07 01 27 0a 17 1b 04 02 b6 1d 0e 1c 02
E: 3813.250064 14 01 07 01 30 0a 36 1b 04 02 b6 1d 0e 1c 02
E: 3813.258049 14 01 07 01 38 0a 54 1b 04 02 b6 1d 0e 1c 02
E: 3813.266073 14 01 07 01 40 0a 73 1b 04 02 b6 1d 0e 1c 02
E: 3813.270048 14 01 07 01 48 0a 92 1b 04 02 b6 1d 0e 1c 02
E: 3813.278068 14 01 07 01 50 0a b1 1b 04 02 b6 1d 0e 1c 02
E: 3813.286049 14 01 07 01 5c 0a e2 1b 04 02 b6 1d 0e 1c 02
E: 3813.294069 14 01 07 01 6b 0a 1b 1c 04 02 b6 1d 0e 1c 02
E: 3813.302051 14 01 07 01 78 0a 51 1c 04 02 b6 1d 0e 1c 02
E: 3813.310087 14 01 07 01 83 0a 84 1c 04 02 b6 1d 0e 1c 02
E: 3813.318052 14 01 07 01 8d 0a b4 1c 04 02 b6 1d 0e 1c 02
E: 3813.326059 14 01 07 01 93 0a d3 1c 04 02 b6 1d 0e 1c 02
E: 3813.334079 14 01 07 01 96 0a f1 1c 04 02 b6 1d 0e 1c 02
E: 3813.342055 14 01 07 01 99 0a 0f 1d 04 02 b6 1d 0e 1c 02
E: 3813.350051 14 01 07 01 9c 0a 2d 1d 04 02 b6 1d 0e 1c 02
E: 3813.358071 14 01 07 01 a1 0a 5d 1d 04 02 b6 1d 0e 1c 02
E: 3813.366083 14 01 07 01 a8 0a 93 1d 04 02 b6 1d 0e 1c 02
E: 3813.374068 14 01 07 01 ae 0a c6 1d 04 02 b6 1d 0e 1c 02
E: 3813.382052 14 01 07 01 b6 0a f8 1d 04 02 b6 1d 0e 1c 02
E: 3813.390066 14 01 07 01 bd 0a 2d 1e 04 02 b6 1d 0e 1c 02
E: 3813.398087 14 01 07 01 c3 0a 5f 1e 04 02 b6 1d 0e 1c 02
E: 3813.406074 14 01 07 01 c7 0a 7e 1e 04 02 b6 1d 0e 1c 02
E: 3813.414061 14 01 07 01 c9 0a 9b 1e 04 02 b6 1d 0e 1c 02
E: 3813.422059 14 01 07 01 cc 0a b7 1e 04 02 b6 1d 0e 1c 02
E: 3813.430063 14 01 07 01 ce 0a d4 1e 04 02 b6 1d 0e 1c 02
E: 3813.438049 14 01 07 01 d0 0a f1 1e 04 02 b6 1d 0e 1c 02
E: 3813.446076 14 01 07 01 d2 0a 0e 1f 04 02 b6 1d 0e 1c 02
E: 3813.454082 14 01 07 01 d3 0a 2b 1f 04 02 b6 1d 0e 1c 02
E: 3813.462073 14 01 07 01 d4 0a 48 1f 04 02 b6 1d 0e 1c 02
E: 3813.470056 14 01 07 01 d8 0a 66 1f 04 02 b6 1d 0e 1c 02
E: 3813.478071 14 01 07 01 da 0a 83 1f 04 02 b6 1d 0e 1c 02
E: 3813.486063 14 01 07 01 dc 0a a0 1f 04 02 b6 1d 0e 1c 02
E: 3813.494048 14 01 07 01 df 0a bd 1f 04 02 b6 1d 0e 1c 02
E: 3813.502070 14 01 07 01 e3 0a db 1f 04 02 b6 1d 0e 1c 02
E: 3813.510064 14 01 07 01 e6 0a f9 1f 04 02 b6 1d 0e 1c 02
E: 3813.518055 14 01 07 01 ed 0a 2b 20 04 02 b6 1d 0e 1c 02
E: 3813.526047 14 01 07 01 f5 0a 5f 20 04 02 b6 1d 0e 1c 02
E: 3813.534071 14 01 07 01 fa 0a 7d 20 04 02 b6 1d 0e 1c 02
E: 3813.542065 14 01 07 01 fe 0a 99 20 04 02 b6 1d 0e 1c 02
E: 3813.550081 14 01 07 01 04 0b b3 20 04 02 b6 1d 0e 1c 02
E: 3813.558054 14 01 07 01 08 0b cd 20 04 02 b6 1d 0e 1c 02
E: 3813.566053 14 01 07 01 0d 0b e6 20 04 02 b6 1d 0e 1c 02
E: 3813.574082 14 01 07 01 12 0b fe 20 04 02 b6 1d 0e 1c 02
E: 3813.578058 14 01 07 01 19 0b 15 21 04 02 b6 1d 0e 1c 02
E: 3813.586047 14 01 07 01 1f 0b 2c 21 04 02 b6 1d 0e 1c 02
E: 3813.594056 14 01 07 01 27 0b 44 21 04 02 b6 1d 0e 1c 02
E: 3813.602064 14 01 07 01 2e 0b 5b 21 04 02 b6 1d 0e 1c 02
E: 3813.610074 14 01 07 01 36 0b 72 21 04 02 b6 1d 0e 1c 02
E: 3813.618056 14 01 07 01 3f 0b 89 21 04 02 b6 1d 0e 1c 02
E: 3813.626069 14 01 07 01 49 0b 9f 21 04 02 b6 1d 0e 1c 02
E: 3813.634059 14 01 07 01 54 0b b5 21 04 02 b6 1d 0e 1c 02
E: 3813.642047 14 01 07 01 60 0b ca 21 04 02 b6 1d 0e 1c 02
E: 3813.650057 14 01 07 01 6d 0b df 21 04 02 b6 1d 0e 1c 02
E: 3813.658050 14 01 07 01 7e 0b f3 21 04 02 b6 1d 0e 1c 02
E: 3813.666073 14 01 07 01 90 0b 08 22 04 02 b6 1d 0e 1c 02
E: 3813.674075 14 01 07 01 a5 0b 1d 22 04 02 b6 1d 0e 1c 02
E: 3813.682074 14 01 07 01 bb 0b 33 22 04 02 b6 1d 0e 1c 02
E: 3813.690075 14 01 07 01 d2 0b 4a 22 04 02 b6 1d 0e 1c 02
E: 3813.698055 14 01 07 01 f2 0b 70 22 04 02 b6 1d 0e 1c 02
E: 3813.706048 14 01 07 01 14 0c 9b 22 04 02 b6 1d 0e 1c 02
E: 3813.714052 14 01 07 01 31 0c c2 22 04 02 b6 1d 0e 1c 02
E: 3813.722085 14 01 07 01 45 0c d9 22 04 02 b6 1d 0e 1c 02
E: 3813.730069 14 01 07 01 79 0c fa 22 04 02 b6 1d 0e 1c 02
E: 3813.738053 14 01 07 01 89 0c 0f 23 04 02 b6 1d 0e 1c 02
E: 3813.746051 14 01 07 01 b4 0c 2c 23 04 02 b6 1d 0e 1c 02
E: 3813.754059 14 01 07 01 c0 0c 3f 23 04 02 b6 1d 0e 1c 02
E: 3813.762045 14 01 07 01 d7 0c 51 23 04 02 b6 1d 0e 1c 02
E: 3813.770072 14 01 07 01 ed 0c 63 23 04 02 b6 1d 0e 1c 02
E: 3813.778073 14 01 07 01 01 0d 75 23 04 02 b6 1d 0e 1c 02
E: 3813.786062 14 01 07 01 14 0d 86 23 04 02 b6 1d 0e 1c 02
E: 3813.794046 14 01 07 01 26 0d 96 23 04 02 b6 1d 0e 1c 02
E: 3813.802072 14 01 07 01 36 0d a5 23 04 02 b6 1d 0e 1c 02
E: 3813.810017 14 01 07 01 45 0d b3 23 04 02 b6 1d 0e 1c 02
E: 3813.818008 14 01 07 01 54 0d c0 23 04 02 b6 1d 0e 1c 02
E: 3813.826069 14 01 07 01 62 0d cd 23 04 02 b6 1d 0e 1c 02
E: 3813.834070 14 01 07 01 70 0d d9 23 04 02 b6 1d 0e 1c 02
E: 3813.842068 14 01 07 01 7d 0d e4 23 04 02 b6 1d 0e 1c 02
E: 3813.850069 14 01 07 01 8a 0d ed 23 04 02 b6 1d 0e 1c 02
E: 3813.858059 14 01 07 01 98 0d f6 23 04 02 b6 1d 0e 1c 02
E: 3813.866051 14 01 07 01 a3 0d fe 23 04 02 b6 1d 0e 1c 02
E: 3813.874080 14 01 07 01 ad 0d 05 24 04 02 b6 1d 0e 1c 02
E: 3813.882073 14 01 07 01 b7 0d 0c 24 04 02 b6 1d 0e 1c 02
E: 3813.886056 14 01 07 01 c1 0d 12 24 04 02 b6 1d 0e 1c 02
E: 3813.894024 14 01 07 01 ca 0d 17 24 04 02 b6 1d 0e 1c 02
E: 3813.902015 14 01 07 01 d2 0d 1c 24 04 02 b6 1d 0e 1c 02
E: 3813.910045 14 01 07 01 db 0d 1f 24 04 02 b6 1d 0e 1c 02
E: 3813.918054 14 01 07 01 e4 0d 22 24 04 02 b6 1d 0e 1c 02
E: 3813.926076 14 01 07 01 ed 0d 25 24 04 02 b6 1d 0e 1c 02
E: 3813.934066 14 01 07 01 f6 0d 27 24 04 02 b6 1d 0e 1c 02
E: 3813.942071 14 01 07 01 00 0e 28 24 04 02 b6 1d 0e 1c 02
E: 3813.950074 14 01 07 01 0a 0e 28 24 04 02 b6 1d 0e 1c 02
E: 3813.958016 14 01 07 01 14 0e 27 24 04 02 b6 1d 0e 1c 02
E: 3813.966010 14 01 07 01 1e 0e 25 24 04 02 b6 1d 0e 1c 02
E: 3813.974050 14 01 07 01 28 0e 23 24 04 02 b6 1d 0e 1c 02
E: 3813.982074 14 01 07 01 32 0e 1f 24 04 02 b6 1d 0e 1c 02
E: 3813.990052 14 01 07 01 3c 0e 1b 24 04 02 b6 1d 0e 1c 02
E: 3813.998060 14 01 07 01 47 0e 15 24 04 02 b6 1d 0e 1c 02
E: 3814.006057 14 01 07 01 52 0e 0f 24 04 02 b6 1d 0e 1c 02
E: 3814.014048 14 01 07 01 5d 0e 08 24 04 02 b6 1d 0e 1c 02
E: 3814.022079 14 01 07 01 67 0e 00 24 04 02 b6 1d 0e 1c 02
E: 3814.030064 14 01 07 01 71 0e f7 23 04 02 b6 1d 0e 1c 02
E: 3814.038009 14 01 07 01 78 0e ee 23 04 02 b6 1d 0e 1c 02
E: 3814.046023 14 01 07 01 81 0e e4 23 04 02 b6 1d 0e 1c 02
E: 3814.054008 14 01 07 01 8e 0e d9 23 04 02 b6 1d 0e 1c 02
E: 3814.062057 14 01 07 01 a1 0e ce 23 04 02 b6 1d 0e 1c 02
E: 3814.070009 14 01 07 01 b6 0e c2 23 04 02 b6 1d 0e 1c 02
E: 3814.078005 14 01 07 01 cb 0e b6 23 04 02 b6 1d 0e 1c 02
E: 3814.086048 14 01 07 01 e0 0e a9 23 04 02 b6 1d 0e 1c 02
E: 3814.094051 14 01 07 01 f4 0e 9c 23 04 02 b6 1d 0e 1c 02
E: 3814.102058 14 01 07 01 07 0f 8e 23 04 02 b6 1d 0e 1c 02
E: 3814.110057 14 01 07 01 1a 0f 80 23 04 02 b6 1d 0e 1c 02
E: 3814.118044 14 01 07 01 2b 0f 70 23 04 02 b6 1d 0e 1c 02
E: 3814.126073 14 01 07 01 47 0f 56 23 04 02 b6 1d 0e 1c 02
E: 3814.134057 14 01 07 01 67 0f 38 23 04 02 b6 1d 0e 1c 02
E: 3814.142067 14 01 07 01 84 0f 1c 23 04 02 b6 1d 0e 1c 02
E: 3814.150051 14 01 07 01 95 0f 0d 23 04 02 b6 1d 0e 1c 02
E: 3814.158051 14 01 07 01 a6 0f fe 22 04 02 b6 1d 0e 1c 02
E: 3814.166062 14 01 07 01 b7 0f f0 22 04 02 b6 1d 0e 1c 02
E: 3814.174052 14 01 07 01 c8 0f e2 22 04 02 b6 1d 0e 1c 02
E: 3814.182065 14 01 07 01 d9 0f d5 22 04 02 b6 1d 0e 1c 02
E: 3814.186045 14 01 07 01 e9 0f c8 22 04 02 b6 1d 0e 1c 02
E: 3814.194067 14 01 07 01 f8 0f bb 22 04 02 b6 1d 0e 1c 02
E: 3814.202078 14 01 07 01 05 10 ae 22 04 02 b6 1d 0e 1c 02
E: 3814.210046 14 01 07 01 12 10 a2 22 04 02 b6 1d 0e 1c 02
E: 3814.218054 14 01 07 01 1d 10 96 22 04 02 b6 1d 0e 1c 02
E: 3814.226064 14 01 07 01 28 10 8a 22 04 02 b6 1d 0e 1c 02
E: 3814.234051 14 01 07 01 32 10 7f 22 04 02 b6 1d 0e 1c 02
E: 3814.242056 14 01 07 01 3b 10 73 22 04 02 b6 1d 0e 1c 02
E: 3814.250064 14 01 07 01 43 10 68 22 04 02 b6 1d 0e 1c 02
E: 3814.258070 14 01 07 01 4b 10 5c 22 04 02 b6 1d 0e 1c 02
E: 3814.266065 14 01 07 01 52 10 51 22 04 02 b6 1d 0e 1c 02
E: 3814.274058 14 01 07 01 59 10 46 22 04 02 b6 1d 0e 1c 02
E: 3814.282072 14 01 07 01 5f 10 3c 22 04 02 b6 1d 0e 1c 02
E: 3814.290061 14 01 07 01 65 10 32 22 04 02 b6 1d 0e 1c 02
E: 3814.298062 14 01 07 01 6b 10 29 22 04 02 b6 1d 0e 1c 02
E: 3814.306007 14 01 07 01 71 10 20 22 04 02 b6 1d 0e 1c 02
E: 3814.314021 14 01 07 01 77 10 17 22 04 02 b6 1d 0e 1c 02
E: 3814.322074 14 01 07 01 7c 10 0e 22 04 02 b6 1d 0e 1c 02
E: 3814.330048 14 01 07 01 81 10 05 22 04 02 b6 1d 0e 1c 02
E: 3814.338053 14 01 07 01 87 10 fc 21 04 02 b6 1d 0e 1c 02
E: 3814.346082 14 01 07 01 8c 10 f3 21 04 02 b6 1d 0e 1c 02
E: 3814.354054 14 01 07 01 91 10 ea 21 04 02 b6 1d 0e 1c 02
E: 3814.362063 14 01 07 01 96 10 e1 21 04 02 b6 1d 0e 1c 02
E: 3814.370052 14 01 07 01 9a 10 d9 21 04 02 b6 1d 0e 1c 02
E: 3814.378072 14 01 07 01 9e 10 d1 21 04 02 b6 1d 0e 1c 02
E: 3814.386054 14 01 07 01 a1 10 ca 21 04 02 b6 1d 0e 1c 02
E: 3814.394083 14 01 07 01 a4 10 c3 21 04 02 b6 1d 0e 1c 02
E: 3814.402070 14 01 07 01 a7 10 bd 21 04 02 b6 1d 0e 1c 02
E: 3814.410070 14 01 07 01 a9 10 b8 21 04 02 b6 1d 0e 1c 02
E: 3814.418044 14 01 07 01 ab 10 b2 21 04 02 b6 1d 0e 1c 02
E: 3814.426072 14 01 07 01 ad 10 ad 21 04 02 b6 1d 0e 1c 02
E: 3814.434014 14 01 07 01 ae 10 a8 21 04 02 b6 1d 0e 1c 02
E: 3814.442009 14 01 07 01 ac 10 a4 21 04 02 b6 1d 0e 1c 02
E: 3814.450047 14 01 07 01 a6 10 a0 21 04 02 b6 1d 0e 1c 02
E: 3814.458068 14 01 07 01 a6 10 a0 21 04 02 b6 1d 0e 1c 02
E: 3814.478082 14 01 07 01 a6 10 a0 21 07 02 f4 14 69 13 02
E: 3814.486048 14 01 07 01 a6 10 a0 21 07 02 f4 14 69 13 02
E: 3814.506067 14 01 07 01 98 10 80 21 07 02 f4 14 67 13 02
E: 3814.514050 14 01 07 01 98 10 80 21 07 02 f4 14 67 13 02
E: 3814.534065 14 01 07 01 9d 10 7f 21 07 02 f5 14 65 13 02
E: 3814.542010 14 01 07 01 9d 10 7f 21 07 02 f5 14 65 13 02
E: 3814.562071 14 01 07 01 a3 10 7e 21 07 02 00 15 61 13 02
E: 3814.570068 14 01 07 01 a3 10 7e 21 07 02 00 15 61 13 02
E: 3814.586061 14 01 07 01 a5 10 7d 21 07 02 13 15 58 13 02
E: 3814.594043 14 01 07 01 a5 10 7d 21 07 02 13 15 58 13 02
E: 3814.614025 14 01 07 01 b1 10 79 21 07 02 2e 15 3e 13 02
E: 3814.622061 14 01 07 01 b1 10 79 21 07 02 2e 15 3e 13 02
E: 3814.642085 14 01 07 01 b5 10 72 21 07 02 3e 15 27 13 02
E: 3814.650065 14 01 07 01 b5 10 72 21 07 02 3e 15 27 13 02
E: 3814.670069 14 01 07 01 c1 10 65 21 07 02 54 15 04 13 02
E: 3814.674042 14 01 07 01 c1 10 65 21 07 02 54 15 04 13 02
E: 3814.694050 14 01 07 01 cb 10 4b 21 07 02 6c 15 d5 12 02
E: 3814.702077 14 01 07 01 cb 10 4b 21 07 02 6c 15 d5 12 02
E: 3814.722056 14 01 07 01 cc 10 24 21 07 02 8d 15 95 12 02
E: 3814.730075 14 01 07 01 cc 10 24 21 07 02 8d 15 95 12 02
E: 3814.750062 14 01 07 01 e2 10 05 21 07 02 a5 15 67 12 02
E: 3814.758083 14 01 07 01 e2 10 05 21 07 02 a5 15 67 12 02
E: 3814.774063 14 01 07 01 ee 10 e2 20 07 02 b9 15 38 12 02
E: 3814.782044 14 01 07 01 ee 10 e2 20 07 02 b9 15 38 12 02
E: 3814.802083 14 01 07 01 05 11 ae 20 07 02 ce 15 f3 11 02
E: 3814.810069 14 01 07 01 05 11 ae 20 07 02 ce 15 f3 11 02
E: 3814.830051 14 01 07 01 1f 11 76 20 07 02 fd 15 9b 11 02
E: 3814.838054 14 01 07 01 1f 11 76 20 07 02 fd 15 9b 11 02
E: 3814.858060 14 01 07 01 3a 11 3a 20 07 02 20 16 4b 11 02
E: 3814.866045 14 01 07 01 3a 11 3a 20 07 02 20 16 4b 11 02
E: 3814.882061 14 01 07 01 54 11 e1 1f 07 02 51 16 e3 10 02
E: 3814.890043 14 01 07 01 54 11 e1 1f 07 02 51 16 e3 10 02
E: 3814.910083 14 01 07 01 71 11 7e 1f 07 02 72 16 7a 10 02
E: 3814.918061 14 01 07 01 71 11 7e 1f 07 02 72 16 7a 10 02
E: 3814.938079 14 01 07 01 93 11 11 1f 07 02 a4 16 01 10 02
E: 3814.946063 14 01 07 01 93 11 11 1f 07 02 a4 16 01 10 02
E: 3814.962073 14 01 07 01 b6 11 99 1e 07 02 d6 16 81 0f 02
E: 3814.970074 14 01 07 01 b6 11 99 1e 07 02 d6 16 81 0f 02
E: 3814.990052 14 01 07 01 d9 11 08 1e 07 02 0d 17 ff 0e 02
E: 3814.998078 14 01 07 01 d9 11 08 1e 07 02 0d 17 ff 0e 02
E: 3815.018060 14 01 07 01 fd 11 7d 1d 07 02 40 17 7e 0e 02
E: 3815.026058 14 01 07 01 fd 11 7d 1d 07 02 40 17 7e 0e 02
E: 3815.046054 14 01 07 01 28 12 fb 1c 07 02 68 17 f4 0d 02
E: 3815.050042 14 01 07 01 28 12 fb 1c 07 02 68 17 f4 0d 02
E: 3815.070062 14 01 07 01 4a 12 7d 1c 07 02 8d 17 76 0d 02
E: 3815.078050 14 01 07 01 4a 12 7d 1c 07 02 8d 17 76 0d 02
E: 3815.098059 14 01 07 01 5d 12 03 1c 07 02 b7 17 05 0d 02
E: 3815.106071 14 01 07 01 5d 12 03 1c 07 02 b7 17 05 0d 02
E: 3815.126066 14 01 07 01 7a 12 90 1b 07 02 e6 17 a0 0c 02
E: 3815.134057 14 01 07 01 7a 12 90 1b 07 02 e6 17 a0 0c 02
E: 3815.150071 14 01 07 01 9d 12 25 1b 07 02 0a 18 43 0c 02
E: 3815.158055 14 01 07 01 9d 12 25 1b 07 02 0a 18 43 0c 02
E: 3815.178079 14 01 07 01 b9 12 bc 1a 07 02 24 18 e9 0b 02
E: 3815.186053 14 01 07 01 b9 12 bc 1a 07 02 24 18 e9 0b 02
E: 3815.206081 14 01 07 01 d2 12 57 1a 07 02 3b 18 85 0b 02
E: 3815.214066 14 01 07 01 d2 12 57 1a 07 02 3b 18 85 0b 02
E: 3815.230073 14 01 07 01 ea 12 07 1a 07 02 5e 18 40 0b 02
E: 3815.238074 14 01 07 01 ea 12 07 1a 07 02 5e 18 40 0b 02
E: 3815.258060 14 01 07 01 0d 13 9a 19 07 02 8d 18 e8 0a 02
E: 3815.266081 14 01 07 01 0d 13 9a 19 07 02 8d 18 e8 0a 02
E: 3815.286080 14 01 07 01 35 13 35 19 07 02 bb 18 90 0a 02
E: 3815.294078 14 01 07 01 35 13 35 19 07 02 bb 18 90 0a 02
E: 3815.314059 14 01 07 01 47 13 e9 18 07 02 db 18 4d 0a 02
E: 3815.318040 14 01 07 01 47 13 e9 18 07 02 db 18 4d 0a 02
E: 3815.338067 14 01 07 01 60 13 9f 18 07 02 06 19 08 0a 02
E: 3815.346044 14 01 07 01 60 13 9f 18 07 02 06 19 08 0a 02
E: 3815.366093 14 01 07 01 82 13 43 18 07 02 2b 19 a0 09 02
E: 3815.374076 14 01 07 01 82 13 43 18 07 02 2b 19 a0 09 02
E: 3815.394260 14 01 07 01 91 13 f4 17 07 02 44 19 5c 09 02
E: 3815.398056 14 01 07 01 91 13 f4 17 07 02 44 19 5c 09 02
E: 3815.418073 14 01 07 01 b8 13 8a 17 07 02 67 19 04 09 02
E: 3815.426071 14 01 07 01 b8 13 8a 17 07 02 67 19 04 09 02
E: 3815.446080 14 01 07 01 d5 13 25 17 07 02 97 19 aa 08 02
E: 3815.454060 14 01 07 01 d5 13 25 17 07 02 97 19 aa 08 02
E: 3815.474076 14 01 07 01 00 14 c1 16 07 02 c4 19 52 08 02
E: 3815.478041 14 01 07 01 00 14 c1 16 07 02 c4 19 52 08 02
E: 3815.498070 14 01 07 01 15 14 72 16 07 02 e9 19 09 08 02
E: 3815.506065 14 01 07 01 15 14 72 16 07 02 e9 19 09 08 02
E: 3815.526046 14 01 07 01 2b 14 24 16 07 02 14 1a c0 07 02
E: 3815.534056 14 01 07 01 2b 14 24 16 07 02 14 1a c0 07 02
E: 3815.554058 14 01 07 01 44 14 bc 15 07 02 40 1a 6a 07 02
E: 3815.558039 14 01 07 01 44 14 bc 15 07 02 40 1a 6a 07 02
E: 3815.578075 14 01 07 01 61 14 74 15 07 02 6e 1a 31 07 02
E: 3815.594060 14 01 07 01 76 14 2f 15 07 02 ac 1a f3 06 02
E: 3815.606081 14 01 07 01 86 14 f1 14 07 02 dc 1a bd 06 02
E: 3815.617993 14 01 07 01 9d 14 bb 14 07 02 02 1b 8c 06 02
E: 3815.626005 14 01 07 01 9d 14 bb 14 07 02 02 1b 8c 06 02
E: 3815.646044 14 01 07 01 be 14 87 14 07 02 28 1b 60 06 02
E: 3815.654053 14 01 07 01 be 14 87 14 07 02 28 1b 60 06 02
E: 3815.674054 14 01 07 01 e7 14 4f 14 07 02 4f 1b 2f 06 02
E: 3815.677985 14 01 07 01 e7 14 4f 14 07 02 4f 1b 2f 06 02
E: 3815.698060 14 01 07 01 0d 15 16 14 07 02 79 1b fc 05 02
E: 3815.706041 14 01 07 01 0d 15 16 14 07 02 79 1b fc 05 02
E: 3815.726061 14 01 07 01 31 15 d9 13 07 02 ac 1b c6 05 02
E: 3815.734042 14 01 07 01 31 15 d9 13 07 02 ac 1b c6 05 02
E: 3815.750070 14 01 07 01 61 15 8f 13 07 02 d7 1b 92 05 02
E: 3815.758051 14 01 07 01 61 15 8f 13 07 02 d7 1b 92 05 02
E: 3815.778077 14 01 07 01 89 15 4e 13 07 02 12 1c 64 05 02
E: 3815.786038 14 01 07 01 89 15 4e 13 07 02 12 1c 64 05 02
E: 3815.806018 14 01 07 01 bd 15 11 13 07 02 4b 1c 3a 05 02
E: 3815.818042 14 01 07 01 e6 15 d9 12 07 02 8a 1c 14 05 02
E: 3815.830068 14 01 07 01 0b 16 a7 12 07 02 bc 1c f2 04 02
E: 3815.846069 14 01 07 01 27 16 85 12 07 02 e0 1c db 04 02
E: 3815.858052 14 01 07 01 4f 16 55 12 07 02 14 1d bb 04 02
E: 3815.870079 14 01 07 01 74 16 29 12 07 02 48 1d 9b 04 02
E: 3815.878042 14 01 07 01 74 16 29 12 07 02 48 1d 9b 04 02
E: 3815.898074 14 01 07 01 a5 16 01 12 07 02 82 1d 7e 04 02
E: 3815.906041 14 01 07 01 a5 16 01 12 07 02 82 1d 7e 04 02
E: 3815.926256 14 01 07 01 e3 16 d1 11 07 02 c1 1d 5e 04 02
E: 3815.934066 14 01 07 01 e3 16 d1 11 07 02 c1 1d 5e 04 02
E: 3815.950069 14 01 07 01 35 17 86 11 07 02 15 1e 32 04 02
E: 3815.966078 14 01 07 01 5d 17 4e 11 07 02 56 1e 17 04 02
E: 3815.978055 14 01 07 01 86 17 22 11 07 02 8b 1e 01 04 02
E: 3815.990069 14 01 07 01 b0 17 fe 10 07 02 bc 1e f1 03 02
E: 3816.006049 14 01 07 01 d0 17 e8 10 07 02 dc 1e e6 03 02
E: 3816.018079 14 01 07 01 ef 17 d5 10 07 02 fc 1e dd 03 02
E: 3816.030051 14 01 07 01 0e 18 c5 10 07 02 1e 1f d5 03 02
E: 3816.046055 14 01 07 01 2e 18 b6 10 07 02 40 1f ce 03 02
E: 3816.058041 14 01 07 01 4e 18 a7 10 07 02 64 1f c9 03 02
E: 3816.070052 14 01 07 01 6b 18 9a 10 07 02 8b 1f c6 03 02
E: 3816.078054 14 01 07 01 6b 18 9a 10 07 02 8b 1f c6 03 02
E: 3816.098056 14 01 07 01 8b 18 8e 10 07 02 b0 1f c3 03 02
E: 3816.106072 14 01 07 01 8b 18 8e 10 07 02 b0 1f c3 03 02
E: 3816.122047 14 01 07 01 bc 18 7d 10 07 02 f9 1f c0 03 02
E: 3816.130064 14 01 07 01 bc 18 7d 10 07 02 f9 1f c0 03 02
E: 3816.150055 14 01 07 01 df 18 72 10 07 02 24 20 c1 03 02
E: 3816.162055 14 01 07 01 fd 18 69 10 07 02 54 20 c8 03 02
E: 3816.178060 14 01 07 01 19 19 62 10 07 02 7d 20 d0 03 02
E: 3816.190070 14 01 07 01 33 19 5c 10 07 02 9f 20 d9 03 02
E: 3816.202057 14 01 07 01 42 19 59 10 07 02 b2 20 e1 03 02
E: 3816.218056 14 01 07 01 4f 19 56 10 07 02 c4 20 e9 03 02
E: 3816.230253 14 01 07 01 5c 19 53 10 07 02 d5 20 f1 03 02
E: 3816.242071 14 01 07 01 6a 19 51 10 07 02 e5 20 fa 03 02
E: 3816.258078 14 01 07 01 7a 19 4f 10 07 02 f6 20 04 04 02
E: 3816.270043 14 01 07 01 94 19 4c 10 07 02 10 21 13 04 02
E: 3816.282054 14 01 07 01 b4 19 49 10 07 02 2f 21 26 04 02
E: 3816.298052 14 01 07 01 d1 19 47 10 07 02 4f 21 3a 04 02
E: 3816.310053 14 01 07 01 ed 19 45 10 07 02 71 21 4d 04 02
E: 3816.322062 14 01 07 01 07 1a 46 10 07 02 93 21 61 04 02
E: 3816.338056 14 01 07 01 17 1a 47 10 07 02 aa 21 6e 04 02
E: 3816.350070 14 01 07 01 27 1a 48 10 07 02 bf 21 7a 04 02
E: 3816.362065 14 01 07 01 37 1a 4a 10 07 02 d4 21 87 04 02
E: 3816.378066 14 01 07 01 51 1a 4d 10 07 02 f4 21 a0 04 02
E: 3816.390069 14 01 07 01 6d 1a 52 10 07 02 17 22 bc 04 02
E: 3816.398066 14 01 07 01 6d 1a 52 10 07 02 17 22 bc 04 02
E: 3816.418055 14 01 07 01 87 1a 58 10 07 02 39 22 d6 04 02
E: 3816.422039 14 01 07 01 87 1a 58 10 07 02 39 22 d6 04 02
E: 3816.442076 14 01 07 01 a9 1a 61 10 07 02 61 22 f4 04 02
E: 3816.454063 14 01 07 01 cb 1a 70 10 07 02 86 22 14 05 02
E: 3816.470070 14 01 07 01 e6 1a 7d 10 07 02 aa 22 32 05 02
E: 3816.481986 14 01 07 01 fe 1a 8a 10 07 02 c8 22 4f 05 02
E: 3816.494012 14 01 07 01 16 1b 99 10 07 02 e5 22 6d 05 02
E: 3816.510068 14 01 07 01 2d 1b a9 10 07 02 00 23 8c 05 02
E: 3816.522057 14 01 07 01 43 1b c1 10 07 02 1a 23 ab 05 02
E: 3816.534062 14 01 07 01 50 1b d3 10 07 02 2a 23 c0 05 02
E: 3816.550073 14 01 07 01 5c 1b e4 10 07 02 38 23 d5 05 02
E: 3816.562051 14 01 07 01 68 1b f6 10 07 02 46 23 eb 05 02
E: 3816.574064 14 01 07 01 74 1b 09 11 07 02 53 23 02 06 02
E: 3816.590064 14 01 07 01 87 1b 28 11 07 02 66 23 29 06 02
E: 3816.602044 14 01 07 01 9b 1b 4e 11 07 02 7d 23 5d 06 02
E: 3816.614056 14 01 07 01 ae 1b 72 11 07 02 92 23 90 06 02
E: 3816.630065 14 01 07 01 bf 1b 95 11 07 02 a7 23 be 06 02
E: 3816.642061 14 01 07 01 d0 1b b6 11 07 02 bd 23 e9 06 02
E: 3816.654033 14 01 07 01 e1 1b d6 11 07 02 d5 23 0e 07 02
E: 3816.670058 14 01 07 01 ec 1b e9 11 07 02 e5 23 25 07 02
E: 3816.682033 14 01 07 01 f6 1b fc 11 07 02 f4 23 3b 07 02
E: 3816.694040 14 01 07 01 00 1c 0d 12 07 02 03 24 50 07 02
E: 3816.706074 14 01 07 01 09 1c 20 12 07 02 0f 24 65 07 02
E: 3816.722050 14 01 07 01 12 1c 36 12 07 02 1a 24 7b 07 02
E: 3816.734071 14 01 07 01 1e 1c 62 12 07 02 2a 24 98 07 02
E: 3816.742054 14 01 07 01 5e 1c 87 13 06 02 2a 24 98 07 02
E: 3816.750059 14 01 07 01 5f 1c 8a 13 04 02 2a 24 98 07 02
E: 3816.758057 14 01 07 01 60 1c 8e 13 04 02 2a 24 98 07 02
E: 3816.766048 14 01 07 01 62 1c 95 13 04 02 2a 24 98 07 02
E: 3816.774029 14 01 07 01 63 1c a0 13 04 02 2a 24 98 07 02
E: 3816.782038 14 01 07 01 65 1c ae 13 04 02 2a 24 98 07 02
E: 3816.790050 14 01 07 01 68 1c bf 13 04 02 2a 24 98 07 02
E: 3816.798039 14 01 07 01 6b 1c d3 13 04 02 2a 24 98 07 02
E: 3816.806036 14 01 07 01 6e 1c e8 13 04 02 2a 24 98 07 02
E: 3816.814055 14 01 07 01 71 1c fe 13 04 02 2a 24 98 07 02
E: 3816.822059 14 01 07 01 74 1c 17 14 04 02 2a 24 98 07 02
E: 3816.830061 14 01 07 01 77 1c 33 14 04 02 2a 24 98 07 02
E: 3816.838043 14 01 07 01 7a 1c 51 14 04 02 2a 24 98 07 02
E: 3816.846055 14 01 07 01 7d 1c 6f 14 04 02 2a 24 98 07 02
E: 3816.854064 14 01 07 01 7f 1c 8d 14 04 02 2a 24 98 07 02
E: 3816.862050 14 01 07 01 81 1c aa 14 04 02 2a 24 98 07 02
E: 3816.869996 14 01 07 01 82 1c c6 14 04 02 2a 24 98 07 02
E: 3816.877999 14 01 07 01 83 1c e2 14 04 02 2a 24 98 07 02
E: 3816.886006 14 01 07 01 83 1c fe 14 04 02 2a 24 98 07 02
E: 3816.894069 14 01 07 01 83 1c 1b 15 04 02 2a 24 98 07 02
E: 3816.902060 14 01 07 01 84 1c 38 15 04 02 2a 24 98 07 02
E: 3816.910253 14 01 07 01 85 1c 55 15 04 02 2a 24 98 07 02
E: 3816.918045 14 01 07 01 86 1c 73 15 04 02 2a 24 98 07 02
E: 3816.926045 14 01 07 01 87 1c 91 15 04 02 2a 24 98 07 02
E: 3816.934033 14 01 07 01 88 1c af 15 04 02 2a 24 98 07 02
E: 3816.938044 14 01 07 01 89 1c cd 15 04 02 2a 24 98 07 02
E: 3816.946039 14 01 07 01 8a 1c fd 15 04 02 2a 24 98 07 02
E: 3816.954047 14 01 07 01 8b 1c 38 16 04 02 2a 24 98 07 02
E: 3816.961993 14 01 07 01 8b 1c 5c 16 04 02 2a 24 98 07 02
E: 3816.969995 14 01 07 01 8b 1c 7d 16 04 02 2a 24 98 07 02
E: 3816.978050 14 01 07 01 8b 1c 9e 16 04 02 2a 24 98 07 02
E: 3816.986040 14 01 07 01 8a 1c be 16 04 02 2a 24 98 07 02
E: 3816.994051 14 01 07 01 89 1c de 16 04 02 2a 24 98 07 02
E: 3817.002047 14 01 07 01 89 1c fe 16 04 02 2a 24 98 07 02
E: 3817.010045 14 01 07 01 89 1c 1e 17 04 02 2a 24 98 07 02
E: 3817.018034 14 01 07 01 89 1c 3d 17 04 02 2a 24 98 07 02
E: 3817.026051 14 01 07 01 89 1c 5d 17 04 02 2a 24 98 07 02
E: 3817.034064 14 01 07 01 89 1c 7d 17 04 02 2a 24 98 07 02
E: 3817.042050 14 01 07 01 89 1c 9c 17 04 02 2a 24 98 07 02
E: 3817.050056 14 01 07 01 89 1c ba 17 04 02 2a 24 98 07 02
E: 3817.058047 14 01 07 01 89 1c d9 17 04 02 2a 24 98 07 02
E: 3817.066047 14 01 07 01 89 1c f9 17 04 02 2a 24 98 07 02
E: 3817.074047 14 01 07 01 89 1c 1c 18 04 02 2a 24 98 07 02
E: 3817.082037 14 01 07 01 88 1c 3e 18 04 02 2a 24 98 07 02
E: 3817.090066 14 01 07 01 88 1c 5f 18 04 02 2a 24 98 07 02
E: 3817.098040 14 01 07 01 87 1c 80 18 04 02 2a 24 98 07 02
E: 3817.106050 14 01 07 01 87 1c a0 18 04 02 2a 24 98 07 02
E: 3817.114050 14 01 07 01 86 1c bf 18 04 02 2a 24 98 07 02
E: 3817.122045 14 01 07 01 85 1c dd 18 04 02 2a 24 98 07 02
E: 3817.130031 14 01 07 01 85 1c fb 18 04 02 2a 24 98 07 02
E: 3817.138042 14 01 07 01 85 1c 19 19 04 02 2a 24 98 07 02
E: 3817.146032 14 01 07 01 85 1c 36 19 04 02 2a 24 98 07 02
E: 3817.154055 14 01 07 01 85 1c 53 19 04 02 2a 24 98 07 02
E: 3817.162057 14 01 07 01 85 1c 70 19 04 02 2a 24 98 07 02
E: 3817.169981 14 01 07 01 85 1c 8c 19 04 02 2a 24 98 07 02
E: 3817.178007 14 01 07 01 86 1c a7 19 04 02 2a 24 98 07 02
E: 3817.185994 14 01 07 01 86 1c c1 19 04 02 2a 24 98 07 02
E: 3817.193978 14 01 07 01 87 1c da 19 04 02 2a 24 98 07 02
E: 3817.202001 14 01 07 01 88 1c f3 19 04 02 2a 24 98 07 02
E: 3817.209998 14 01 07 01 89 1c 0c 1a 04 02 2a 24 98 07 02
E: 3817.218061 14 01 07 01 8a 1c 25 1a 04 02 2a 24 98 07 02
E: 3817.226043 14 01 07 01 8b 1c 3f 1a 04 02 2a 24 98 07 02
E: 3817.234053 14 01 07 01 8c 1c 5a 1a 04 02 2a 24 98 07 02
E: 3817.242065 14 01 07 01 8e 1c 74 1a 04 02 2a 24 98 07 02
E: 3817.246040 14 01 07 01 8f 1c 8c 1a 04 02 2a 24 98 07 02
E: 3817.254048 14 01 07 01 91 1c a4 1a 04 02 2a 24 98 07 02
E: 3817.262039 14 01 07 01 93 1c ba 1a 04 02 2a 24 98 07 02
E: 3817.270067 14 01 07 01 94 1c cf 1a 04 02 2a 24 98 07 02
E: 3817.278054 14 01 07 01 96 1c e4 1a 04 02 2a 24 98 07 02
E: 3817.286037 14 01 07 01 97 1c f8 1a 04 02 2a 24 98 07 02
E: 3817.294051 14 01 07 01 98 1c 0b 1b 04 02 2a 24 98 07 02
E: 3817.302044 14 01 07 01 99 1c 1d 1b 04 02 2a 24 98 07 02
E: 3817.310041 14 01 07 01 9a 1c 2e 1b 04 02 2a 24 98 07 02
E: 3817.318036 14 01 07 01 9b 1c 3f 1b 04 02 2a 24 98 07 02
E: 3817.326003 14 01 07 01 9c 1c 50 1b 04 02 2a 24 98 07 02
E: 3817.333985 14 01 07 01 9d 1c 60 1b 04 02 2a 24 98 07 02
E: 3817.342028 14 01 07 01 9e 1c 71 1b 04 02 2a 24 98 07 02
E: 3817.350034 14 01 07 01 9e 1c 82 1b 04 02 2a 24 98 07 02
E: 3817.358046 14 01 07 01 9e 1c 93 1b 04 02 2a 24 98 07 02
E: 3817.366049 14 01 07 01 9f 1c a4 1b 04 02 2a 24 98 07 02
E: 3817.374046 14 01 07 01 a0 1c b5 1b 04 02 2a 24 98 07 02
E: 3817.382048 14 01 07 01 a1 1c c6 1b 04 02 2a 24 98 07 02
E: 3817.390054 14 01 07 01 a2 1c d6 1b 04 02 2a 24 98 07 02
E: 3817.398040 14 01 07 01 a3 1c e6 1b 04 02 2a 24 98 07 02
E: 3817.406047 14 01 07 01 a3 1c f6 1b 04 02 2a 24 98 07 02
E: 3817.414035 14 01 07 01 a3 1c 06 1c 04 02 2a 24 98 07 02
E: 3817.422063 14 01 07 01 a3 1c 16 1c 04 02 2a 24 98 07 02
E: 3817.430053 14 01 07 01 a3 1c 25 1c 04 02 2a 24 98 07 02
E: 3817.438057 14 01 07 01 a2 1c 35 1c 04 02 2a 24 98 07 02
E: 3817.446051 14 01 07 01 a1 1c 46 1c 04 02 2a 24 98 07 02
E: 3817.454051 14 01 07 01 a0 1c 58 1c 04 02 2a 24 98 07 02
E: 3817.462039 14 01 07 01 9e 1c 6b 1c 04 02 2a 24 98 07 02
E: 3817.470038 14 01 07 01 9c 1c 80 1c 04 02 2a 24 98 07 02
E: 3817.478053 14 01 07 01 9a 1c 96 1c 04 02 2a 24 98 07 02
E: 3817.486038 14 01 07 01 97 1c ac 1c 04 02 2a 24 98 07 02
E: 3817.494046 14 01 07 01 94 1c c3 1c 04 02 2a 24 98 07 02
E: 3817.502032 14 01 07 01 91 1c da 1c 04 02 2a 24 98 07 02
E: 3817.510049 14 01 07 01 8e 1c f2 1c 04 02 2a 24 98 07 02
E: 3817.518029 14 01 07 01 8a 1c 0b 1d 04 02 2a 24 98 07 02
E: 3817.526035 14 01 07 01 86 1c 25 1d 04 02 2a 24 98 07 02
E: 3817.534037 14 01 07 01 82 1c 40 1d 04 02 2a 24 98 07 02
E: 3817.542039 14 01 07 01 7e 1c 5b 1d 04 02 2a 24 98 07 02
E: 3817.550036 14 01 07 01 7a 1c 77 1d 04 02 2a 24 98 07 02
E: 3817.558053 14 01 07 01 76 1c 93 1d 04 02 2a 24 98 07 02
E: 3817.561973 14 01 07 01 72 1c af 1d 04 02 2a 24 98 07 02
E: 3817.569998 14 01 07 01 6e 1c cc 1d 04 02 2a 24 98 07 02
E: 3817.578044 14 01 07 01 6b 1c e9 1d 04 02 2a 24 98 07 02
E: 3817.586053 14 01 07 01 68 1c 07 1e 04 02 2a 24 98 07 02
E: 3817.594037 14 01 07 01 65 1c 27 1e 04 02 2a 24 98 07 02
E: 3817.602063 14 01 07 01 62 1c 48 1e 04 02 2a 24 98 07 02
E: 3817.610052 14 01 07 01 5f 1c 69 1e 04 02 2a 24 98 07 02
E: 3817.618040 14 01 07 01 5d 1c 8a 1e 04 02 2a 24 98 07 02
E: 3817.626046 14 01 07 01 5b 1c a9 1e 04 02 2a 24 98 07 02
E: 3817.634035 14 01 07 01 59 1c c7 1e 04 02 2a 24 98 07 02
E: 3817.642040 14 01 07 01 57 1c e4 1e 04 02 2a 24 98 07 02
E: 3817.650050 14 01 07 01 55 1c 00 1f 04 02 2a 24 98 07 02
E: 3817.658053 14 01 07 01 54 1c 1c 1f 04 02 2a 24 98 07 02
E: 3817.666049 14 01 07 01 53 1c 38 1f 04 02 2a 24 98 07 02
E: 3817.674041 14 01 07 01 52 1c 54 1f 04 02 2a 24 98 07 02
E: 3817.682032 14 01 07 01 51 1c 70 1f 04 02 2a 24 98 07 02
E: 3817.690065 14 01 07 01 51 1c 8b 1f 04 02 2a 24 98 07 02
E: 3817.698048 14 01 07 01 51 1c a6 1f 04 02 2a 24 98 07 02
E: 3817.705995 14 01 07 01 51 1c c1 1f 04 02 2a 24 98 07 02
E: 3817.714006 14 01 07 01 51 1c dc 1f 04 02 2a 24 98 07 02
E: 3817.722058 14 01 07 01 52 1c f7 1f 04 02 2a 24 98 07 02
E: 3817.730035 14 01 07 01 52 1c 13 20 04 02 2a 24 98 07 02
E: 3817.738034 14 01 07 01 53 1c 32 20 04 02 2a 24 98 07 02
E: 3817.746044 14 01 07 01 54 1c 62 20 04 02 2a 24 98 07 02
E: 3817.754034 14 01 07 01 56 1c 93 20 04 02 2a 24 98 07 02
E: 3817.762032 14 01 07 01 57 1c b1 20 04 02 2a 24 98 07 02
E: 3817.770047 14 01 07 01 58 1c cc 20 04 02 2a 24 98 07 02
E: 3817.778042 14 01 07 01 59 1c e6 20 04 02 2a 24 98 07 02
E: 3817.786037 14 01 07 01 5a 1c fe 20 04 02 2a 24 98 07 02
E: 3817.794031 14 01 07 01 5b 1c 16 21 04 02 2a 24 98 07 02
E: 3817.802053 14 01 07 01 5c 1c 2d 21 04 02 2a 24 98 07 02
E: 3817.810045 14 01 07 01 5e 1c 44 21 04 02 2a 24 98 07 02
E: 3817.818028 14 01 07 01 5f 1c 5b 21 04 02 2a 24 98 07 02
E: 3817.826052 14 01 07 01 61 1c 71 21 04 02 2a 24 98 07 02
E: 3817.834004 14 01 07 01 63 1c 87 21 04 02 2a 24 98 07 02
E: 3817.841993 14 01 07 01 65 1c 9d 21 04 02 2a 24 98 07 02
E: 3817.845982 14 01 07 01 68 1c b2 21 04 02 2a 24 98 07 02
E: 3817.854030 14 01 07 01 6b 1c c7 21 04 02 2a 24 98 07 02
E: 3817.862045 14 01 07 01 6e 1c dc 21 04 02 2a 24 98 07 02
E: 3817.870034 14 01 07 01 71 1c f0 21 04 02 2a 24 98 07 02
E: 3817.878026 14 01 07 01 74 1c 04 22 04 02 2a 24 98 07 02
E: 3817.885974 14 01 07 01 77 1c 17 22 04 02 2a 24 98 07 02
E: 3817.893990 14 01 07 01 7a 1c 2b 22 04 02 2a 24 98 07 02
E: 3817.902046 14 01 07 01 7d 1c 3f 22 04 02 2a 24 98 07 02
E: 3817.910038 14 01 07 01 81 1c 53 22 04 02 2a 24 98 07 02
E: 3817.918031 14 01 07 01 85 1c 67 22 04 02 2a 24 98 07 02
E: 3817.926044 14 01 07 01 89 1c 7b 22 04 02 2a 24 98 07 02
E: 3817.934047 14 01 07 01 8d 1c 90 22 04 02 2a 24 98 07 02
E: 3817.942032 14 01 07 01 91 1c a4 22 04 02 2a 24 98 07 02
E: 3817.950001 14 01 07 01 95 1c b7 22 04 02 2a 24 98 07 02
E: 3817.958046 14 01 07 01 99 1c ca 22 04 02 2a 24 98 07 02
E: 3817.966055 14 01 07 01 9d 1c dc 22 04 02 2a 24 98 07 02
E: 3817.973977 14 01 07 01 a0 1c ef 22 04 02 2a 24 98 07 02
E: 3817.982000 14 01 07 01 a3 1c 02 23 04 02 2a 24 98 07 02
E: 3817.989992 14 01 07 01 a6 1c 15 23 04 02 2a 24 98 07 02
E: 3817.998038 14 01 07 01 a9 1c 29 23 04 02 2a 24 98 07 02
E: 3818.006029 14 01 07 01 ac 1c 3e 23 04 02 2a 24 98 07 02
E: 3818.014053 14 01 07 01 ae 1c 54 23 04 02 2a 24 98 07 02
E: 3818.022054 14 01 07 01 af 1c 6a 23 04 02 2a 24 98 07 02
E: 3818.030033 14 01 07 01 b0 1c 82 23 04 02 2a 24 98 07 02
E: 3818.038045 14 01 07 01 b1 1c 9a 23 04 02 2a 24 98 07 02
E: 3818.046038 14 01 07 01 b1 1c b2 23 04 02 2a 24 98 07 02
E: 3818.054024 14 01 07 01 b1 1c c8 23 04 02 2a 24 98 07 02
E: 3818.062057 14 01 07 01 b0 1c de 23 04 02 2a 24 98 07 02
E: 3818.070042 14 01 07 01 ae 1c f5 23 04 02 2a 24 98 07 02
E: 3818.078032 14 01 07 01 ab 1c 0c 24 04 02 2a 24 98 07 02
E: 3818.086026 14 01 07 01 a8 1c 23 24 04 02 2a 24 98 07 02
E: 3818.094031 14 01 07 01 a4 1c 3a 24 04 02 2a 24 98 07 02
E: 3818.102036 14 01 07 01 a0 1c 51 24 04 02 2a 24 98 07 02
E: 3818.110052 14 01 07 01 9c 1c 69 24 04 02 2a 24 98 07 02
E: 3818.118036 14 01 07 01 98 1c 7f 24 04 02 2a 24 98 07 02
E: 3818.126050 14 01 07 01 94 1c 93 24 04 02 2a 24 98 07 02
E: 3818.134038 14 01 07 01 90 1c a6 24 04 02 2a 24 98 07 02
E: 3818.142029 14 01 07 01 8d 1c b7 24 04 02 2a 24 98 07 02
E: 3818.150049 14 01 07 01 8a 1c c7 24 04 02 2a 24 98 07 02
E: 3818.154024 14 01 07 01 87 1c d5 24 04 02 2a 24 98 07 02
E: 3818.162065 14 01 07 01 84 1c e2 24 04 02 2a 24 98 07 02
E: 3818.170034 14 01 07 01 81 1c ee 24 04 02 2a 24 98 07 02
E: 3818.178032 14 01 07 01 7f 1c fa 24 04 02 2a 24 98 07 02
E: 3818.186046 14 01 07 01 7c 1c 05 25 04 02 2a 24 98 07 02
E: 3818.194055 14 01 07 01 79 1c 10 25 04 02 2a 24 98 07 02
E: 3818.202028 14 01 07 01 77 1c 1a 25 04 02 2a 24 98 07 02
E: 3818.210055 14 01 07 01 74 1c 24 25 04 02 2a 24 98 07 02
E: 3818.218038 14 01 07 01 72 1c 2d 25 04 02 2a 24 98 07 02
E: 3818.226058 14 01 07 01 6f 1c 35 25 04 02 2a 24 98 07 02
E: 3818.234038 14 01 07 01 6d 1c 3c 25 04 02 2a 24 98 07 02
E: 3818.242051 14 01 07 01 6b 1c 43 25 04 02 2a 24 98 07 02
E: 3818.249990 14 01 07 01 69 1c 49 25 04 02 2a 24 98 07 02
E: 3818.257992 14 01 07 01 68 1c 4e 25 04 02 2a 24 98 07 02
E: 3818.266035 14 01 07 01 67 1c 53 25 04 02 2a 24 98 07 02
E: 3818.274055 14 01 07 01 66 1c 57 25 04 02 2a 24 98 07 02
E: 3818.282033 14 01 07 01 65 1c 5a 25 04 02 2a 24 98 07 02
E: 3818.290036 14 01 07 01 66 1c 5c 25 04 02 2a 24 98 07 02
E: 3818.298040 14 01 07 01 5f 1c 5e 25 04 02 2a 24 98 07 02
E: 3818.306032 14 01 07 01 57 1c 61 25 04 02 2a 24 98 07 02
E: 3818.314063 14 01 06 01 57 1c 61 25 04 02 2a 24 98 07 02
E: 3818.322030 14 01 04 01 57 1c 61 25 04 02 2a 24 98 07 02
