R: 187 05 0d 09 04 a1 01 85 01 09 22 a1 02 09 42 15 00 25 01 75 01 95 01 81 02 09 32 81 02 95 06 81 03 75 08 09 51 95 01 81 02 05 01 26 ff 0f 75 10 55 0e 65 33 09 30 35 00 46 6d 03 81 02 46 ec 01 09 31 81 02 c0 a1 02 05 0d 09 42 15 00 25 01 75 01 95 01 81 02 09 32 81 02 95 06 81 03 75 08 09 51 95 01 81 02 05 01 26 ff 0f 75 10 55 0e 65 33 09 30 35 00 46 6d 03 81 02 46 ec 01 09 31 81 02 c0 05 0d 09 54 95 01 75 08 15 00 25 02 81 02 85 02 09 55 b1 02 c0 06 00 ff 09 01 a1 01 85 a6 95 22 75 08 26 ff 00 15 00 09 01 81 02 85 a5 95 06 75 08 26 ff 00 15 00 09 01 91 02 c0
N: Multi Touch Panel with Controller
I: 3 2087 0a02
E: 3041.740842 14 01 02 02 34 03 8b 04 00 03 25 0a 4d 0e 01
E: 3041.748834 14 01 03 02 34 03 8b 04 00 03 25 0a 4d 0e 01
E: 3041.756833 14 01 03 02 32 03 9d 04 00 03 25 0a 4d 0e 01
E: 3041.764835 14 01 03 02 32 03 9d 04 00 03 25 0a 4d 0e 01
E: 3041.772898 14 01 03 02 32 03 9d 04 00 03 25 0a 4d 0e 01
E: 3041.780749 14 01 03 02 32 03 9d 04 00 03 25 0a 4d 0e 01
E: 3041.788829 14 01 03 02 32 03 9d 04 00 03 25 0a 4d 0e 01
E: 3041.796770 14 01 03 02 32 03 9d 04 00 03 25 0a 4d 0e 01
E: 3041.804787 14 01 03 02 32 03 9d 04 00 03 25 0a 4d 0e 01
E: 3041.812831 14 01 03 02 32 03 9d 04 00 03 25 0a 4d 0e 01
E: 3041.820816 14 01 03 02 32 03 9d 04 00 03 25 0a 4d 0e 01
E: 3041.836772 14 01 03 02 36 03 a9 04 00 03 25 0a 4d 0e 01
E: 3041.844821 14 01 03 02 3a 03 b5 04 00 03 25 0a 4d 0e 01
E: 3041.852800 14 01 03 02 47 03 cd 04 00 03 25 0a 4d 0e 01
E: 3041.860814 14 01 03 02 54 03 e4 04 00 03 25 0a 4d 0e 01
E: 3041.868854 14 01 03 02 60 03 fa 04 00 03 25 0a 4d 0e 01
E: 3041.876749 14 01 03 02 66 03 03 05 00 03 25 0a 4d 0e 01
E: 3041.884787 14 01 03 02 75 03 17 05 00 03 25 0a 4d 0e 01
E: 3041.892789 14 01 03 02 83 03 2d 05 00 03 25 0a 4d 0e 01
E: 3041.900828 14 01 03 02 98 03 54 05 00 03 25 0a 4d 0e 01
E: 3041.916831 14 01 03 02 a6 03 6a 05 00 03 25 0a 4d 0e 01
E: 3041.924810 14 01 03 02 be 03 8c 05 00 03 25 0a 4d 0e 01
E: 3041.932833 14 01 03 02 d5 03 a9 05 00 03 25 0a 4d 0e 01
E: 3041.940771 14 01 03 02 ed 03 c9 05 00 03 25 0a 4d 0e 01
E: 3041.948864 14 01 03 02 f4 03 d1 05 00 03 25 0a 4d 0e 01
E: 3041.956806 14 01 03 02 0e 04 f3 05 00 03 25 0a 4d 0e 01
E: 3041.964808 14 01 03 02 28 04 1b 06 00 03 25 0a 4d 0e 01
E: 3041.972812 14 01 03 02 42 04 3e 06 00 03 25 0a 4d 0e 01
E: 3041.980811 14 01 03 02 5d 04 5f 06 00 03 25 0a 4d 0e 01
E: 3041.996776 14 01 03 02 75 04 80 06 00 03 25 0a 4d 0e 01
E: 3042.004797 14 01 03 02 85 04 90 06 00 03 25 0a 4d 0e 01
E: 3042.012800 14 01 03 02 a2 04 b2 06 00 03 25 0a 4d 0e 01
E: 3042.020823 14 01 03 02 be 04 db 06 00 03 25 0a 4d 0e 01
E: 3042.028738 14 01 03 02 d7 04 01 07 00 03 25 0a 4d 0e 01
E: 3042.036766 14 01 03 02 f0 04 23 07 00 03 25 0a 4d 0e 01
E: 3042.044842 14 01 03 02 09 05 46 07 00 03 25 0a 4d 0e 01
E: 3042.052798 14 01 03 02 22 05 63 07 00 03 25 0a 4d 0e 01
E: 3042.060792 14 01 03 02 3e 05 88 07 00 03 25 0a 4d 0e 01
E: 3042.076769 14 01 03 02 53 05 ac 07 00 03 25 0a 4d 0e 01
E: 3042.084819 14 01 03 02 60 05 c3 07 00 03 25 0a 4d 0e 01
E: 3042.092844 14 01 03 02 78 05 e7 07 00 03 25 0a 4d 0e 01
E: 3042.100849 14 01 03 02 8f 05 0c 08 00 03 25 0a 4d 0e 01
E: 3042.108797 14 01 03 02 a6 05 2b 08 00 03 25 0a 4d 0e 01
E: 3042.116816 14 01 03 02 ba 05 53 08 00 03 25 0a 4d 0e 01
E: 3042.124756 14 01 03 02 c6 05 6a 08 00 03 25 0a 4d 0e 01
E: 3042.132804 14 01 03 02 db 05 90 08 00 03 25 0a 4d 0e 01
E: 3042.140804 14 01 03 02 ef 05 b5 08 00 03 25 0a 4d 0e 01
E: 3042.156799 14 01 03 02 fd 05 cb 08 00 03 25 0a 4d 0e 01
E: 3042.164794 14 01 03 02 13 06 f2 08 00 03 25 0a 4d 0e 01
E: 3042.172822 14 01 03 02 20 06 0a 09 00 03 25 0a 4d 0e 01
E: 3042.180857 14 01 03 02 2b 06 23 09 00 03 25 0a 4d 0e 01
E: 3042.188751 14 01 03 02 40 06 49 09 00 03 25 0a 4d 0e 01
E: 3042.196825 14 01 03 02 4d 06 60 09 00 03 25 0a 4d 0e 01
E: 3042.204833 14 01 03 02 5a 06 77 09 00 03 25 0a 4d 0e 01
E: 3042.212920 14 01 03 02 68 06 8d 09 00 03 25 0a 4d 0e 01
E: 3042.220785 14 01 03 02 7d 06 b3 09 00 03 25 0a 4d 0e 01
E: 3042.228767 14 01 03 02 8a 06 ca 09 00 03 25 0a 4d 0e 01
E: 3042.244825 14 01 03 02 95 06 e2 09 00 03 25 0a 4d 0e 01
E: 3042.252799 14 01 03 02 a0 06 fa 09 00 03 25 0a 4d 0e 01
E: 3042.260813 14 01 03 02 ac 06 12 0a 00 03 25 0a 4d 0e 01
E: 3042.268783 14 01 03 02 b8 06 2a 0a 00 03 25 0a 4d 0e 01
E: 3042.276780 14 01 03 02 cc 06 50 0a 00 03 25 0a 4d 0e 01
E: 3042.284781 14 01 03 02 d8 06 66 0a 00 03 25 0a 4d 0e 01
E: 3042.292785 14 01 03 02 e5 06 7e 0a 00 03 25 0a 4d 0e 01
E: 3042.300808 14 01 03 02 fa 06 a3 0a 00 03 25 0a 4d 0e 01
E: 3042.308748 14 01 03 02 fe 06 ad 0a 00 03 25 0a 4d 0e 01
E: 3042.324783 14 01 03 02 0a 07 c6 0a 00 03 25 0a 4d 0e 01
E: 3042.332786 14 01 03 02 15 07 dc 0a 00 03 25 0a 4d 0e 01
E: 3042.340829 14 01 03 02 21 07 f4 0a 00 03 25 0a 4d 0e 01
E: 3042.348764 14 01 03 02 2e 07 0b 0b 00 03 25 0a 4d 0e 01
E: 3042.356751 14 01 03 02 3c 07 20 0b 00 03 25 0a 4d 0e 01
E: 3042.364819 14 01 03 02 4a 07 36 0b 00 03 25 0a 4d 0e 01
E: 3042.372919 14 01 03 02 57 07 4c 0b 00 03 25 0a 4d 0e 01
E: 3042.380929 14 01 03 02 63 07 63 0b 00 03 25 0a 4d 0e 01
E: 3042.388777 14 01 03 02 69 07 6d 0b 00 03 25 0a 4d 0e 01
E: 3042.404804 14 01 03 02 75 07 85 0b 00 03 25 0a 4d 0e 01
E: 3042.412794 14 01 03 02 82 07 9b 0b 00 03 25 0a 4d 0e 01
E: 3042.420753 14 01 03 02 90 07 b0 0b 00 03 25 0a 4d 0e 01
E: 3042.428813 14 01 03 02 9e 07 c4 0b 00 03 25 0a 4d 0e 01
E: 3042.436793 14 01 03 02 ab 07 d8 0b 00 03 25 0a 4d 0e 01
E: 3042.444798 14 01 03 02 b2 07 e0 0b 00 03 25 0a 4d 0e 01
E: 3042.452738 14 01 03 02 c1 07 f4 0b 00 03 25 0a 4d 0e 01
E: 3042.460742 14 01 03 02 cf 07 08 0c 00 03 25 0a 4d 0e 01
E: 3042.468759 14 01 03 02 d5 07 11 0c 00 03 25 0a 4d 0e 01
E: 3042.484798 14 01 03 02 e2 07 26 0c 00 03 25 0a 4d 0e 01
E: 3042.492815 14 01 03 02 f0 07 3b 0c 00 03 25 0a 4d 0e 01
E: 3042.500807 14 01 03 02 ff 07 4f 0c 00 03 25 0a 4d 0e 01
E: 3042.508776 14 01 03 02 0d 08 61 0c 00 03 25 0a 4d 0e 01
E: 3042.516848 14 01 03 02 1c 08 73 0c 00 03 25 0a 4d 0e 01
E: 3042.524784 14 01 03 02 2b 08 84 0c 00 03 25 0a 4d 0e 01
E: 3042.532785 14 01 03 02 2b 08 84 0c 00 03 25 0a 4d 0e 01
E: 3042.540792 14 01 03 02 3a 08 97 0c 00 03 25 0a 4d 0e 01
E: 3042.548808 14 01 03 02 40 08 a0 0c 00 03 25 0a 4d 0e 01
E: 3042.564806 14 01 03 02 47 08 a7 0c 00 03 25 0a 4d 0e 01
E: 3042.572727 14 01 03 02 56 08 bc 0c 00 03 25 0a 4d 0e 01
E: 3042.580830 14 01 03 02 65 08 cf 0c 00 03 25 0a 4d 0e 01
E: 3042.588831 14 01 03 02 72 08 e1 0c 00 03 25 0a 4d 0e 01
E: 3042.596763 14 01 03 02 79 08 e9 0c 00 03 25 0a 4d 0e 01
E: 3042.604777 14 01 03 02 80 08 f2 0c 00 03 25 0a 4d 0e 01
E: 3042.612778 14 01 03 02 8f 08 05 0d 00 03 25 0a 4d 0e 01
E: 3042.620817 14 01 03 02 9e 08 16 0d 00 03 25 0a 4d 0e 01
E: 3042.628721 14 01 03 02 9e 08 16 0d 00 03 25 0a 4d 0e 01
E: 3042.644742 14 01 03 02 a4 08 1e 0d 00 03 25 0a 4d 0e 01
E: 3042.652818 14 01 03 02 aa 08 27 0d 00 03 25 0a 4d 0e 01
E: 3042.660888 14 01 03 02 b0 08 30 0d 00 03 25 0a 4d 0e 01
E: 3042.668880 14 01 03 02 b7 08 39 0d 00 03 25 0a 4d 0e 01
E: 3042.676717 14 01 03 02 bd 08 43 0d 00 03 25 0a 4d 0e 01
E: 3042.684781 14 01 03 02 cb 08 58 0d 00 03 25 0a 4d 0e 01
E: 3042.692784 14 01 03 02 d2 08 60 0d 00 03 25 0a 4d 0e 01
E: 3042.700778 14 01 03 02 d9 08 69 0d 00 03 25 0a 4d 0e 01
E: 3042.708743 14 01 03 02 e0 08 70 0d 00 03 25 0a 4d 0e 01
E: 3042.716767 14 01 03 02 ef 08 81 0d 00 03 25 0a 4d 0e 01
E: 3042.732828 14 01 03 02 f5 08 89 0d 00 03 25 0a 4d 0e 01
E: 3042.740726 14 01 03 02 04 09 9b 0d 00 03 25 0a 4d 0e 01
E: 3042.748753 14 01 03 02 04 09 9b 0d 00 03 25 0a 4d 0e 01
E: 3042.756845 14 01 03 02 0a 09 a4 0d 00 03 25 0a 4d 0e 01
E: 3042.764804 14 01 03 02 10 09 ad 0d 00 03 25 0a 4d 0e 01
E: 3042.772773 14 01 03 02 16 09 b6 0d 00 03 25 0a 4d 0e 01
E: 3042.780774 14 01 03 02 1c 09 be 0d 00 03 25 0a 4d 0e 01
E: 3042.788736 14 01 03 02 1c 09 be 0d 00 03 25 0a 4d 0e 01
E: 3042.796740 14 01 03 02 22 09 c7 0d 00 03 25 0a 4d 0e 01
E: 3042.812799 14 01 03 02 29 09 d0 0d 00 03 25 0a 4d 0e 01
E: 3042.820768 14 01 03 02 2f 09 d8 0d 00 03 25 0a 4d 0e 01
E: 3042.828711 14 01 03 02 35 09 e0 0d 00 03 25 0a 4d 0e 01
E: 3042.836747 14 01 03 02 35 09 e0 0d 00 03 25 0a 4d 0e 01
E: 3042.844826 14 01 03 02 3c 09 e7 0d 00 03 25 0a 4d 0e 01
E: 3042.852771 14 01 03 02 43 09 ef 0d 00 03 25 0a 4d 0e 01
E: 3042.860710 14 01 03 02 4a 09 f6 0d 00 03 25 0a 4d 0e 01
E: 3042.868771 14 01 03 02 4a 09 f6 0d 00 03 25 0a 4d 0e 01
E: 3042.876783 14 01 03 02 50 09 fc 0d 00 03 25 0a 4d 0e 01
E: 3042.892747 14 01 03 02 57 09 03 0e 00 03 25 0a 4d 0e 01
E: 3042.900772 14 01 03 02 5e 09 0a 0e 00 03 25 0a 4d 0e 01
E: 3042.908795 14 01 03 02 65 09 11 0e 00 03 25 0a 4d 0e 01
E: 3042.916785 14 01 03 02 65 09 11 0e 00 03 25 0a 4d 0e 01
E: 3042.924794 14 01 03 02 6c 09 17 0e 00 03 25 0a 4d 0e 01
E: 3042.932764 14 01 03 02 6c 09 17 0e 00 03 25 0a 4d 0e 01
E: 3042.940757 14 01 03 02 72 09 1f 0e 00 03 25 0a 4d 0e 01
E: 3042.948800 14 01 03 02 72 09 1f 0e 00 03 25 0a 4d 0e 01
E: 3042.956737 14 01 03 02 78 09 27 0e 00 03 25 0a 4d 0e 01
E: 3042.972733 14 01 03 02 78 09 27 0e 00 03 25 0a 4d 0e 01
E: 3042.980733 14 01 03 02 7f 09 2f 0e 00 03 25 0a 4d 0e 01
E: 3042.988820 14 01 03 02 7f 09 2f 0e 00 03 25 0a 4d 0e 01
E: 3042.996724 14 01 03 02 85 09 37 0e 00 03 25 0a 4d 0e 01
E: 3043.004760 14 01 03 02 85 09 37 0e 00 03 25 0a 4d 0e 01
E: 3043.012760 14 01 03 02 8b 09 40 0e 00 03 25 0a 4d 0e 01
E: 3043.020771 14 01 03 02 91 09 49 0e 00 03 25 0a 4d 0e 01
E: 3043.028781 14 01 03 02 91 09 49 0e 00 03 25 0a 4d 0e 01
E: 3043.036789 14 01 03 02 97 09 53 0e 00 03 25 0a 4d 0e 01
E: 3043.052716 14 01 03 02 9c 09 5c 0e 00 03 25 0a 4d 0e 01
E: 3043.060789 14 01 03 02 9c 09 5c 0e 00 03 25 0a 4d 0e 01
E: 3043.068786 14 01 03 02 9c 09 5c 0e 00 03 25 0a 4d 0e 01
E: 3043.076770 14 01 03 02 a2 09 66 0e 00 03 25 0a 4d 0e 01
E: 3043.084779 14 01 03 02 a8 09 6f 0e 00 03 25 0a 4d 0e 01
E: 3043.092758 14 01 03 02 a8 09 6f 0e 00 03 25 0a 4d 0e 01
E: 3043.100770 14 01 03 02 a8 09 6f 0e 00 03 25 0a 4d 0e 01
E: 3043.108766 14 01 03 02 ad 09 79 0e 00 03 25 0a 4d 0e 01
E: 3043.116786 14 01 03 02 b2 09 83 0e 00 03 25 0a 4d 0e 01
E: 3043.132748 14 01 03 02 b2 09 83 0e 00 03 25 0a 4d 0e 01
E: 3043.148783 14 01 00 02 b2 09 83 0e 00 03 25 0a 4d 0e 01
E: 3044.828635 14 01 02 01 6f 04 e5 05 00 03 25 0a 4d 0e 01
E: 3044.836646 14 01 03 01 6f 04 e5 05 00 03 25 0a 4d 0e 01
E: 3044.844644 14 01 03 01 72 04 cc 05 00 03 25 0a 4d 0e 01
E: 3044.852686 14 01 03 01 72 04 cc 05 00 03 25 0a 4d 0e 01
E: 3044.860674 14 01 03 01 72 04 cc 05 00 03 25 0a 4d 0e 01
E: 3044.868699 14 01 03 01 72 04 cc 05 00 03 25 0a 4d 0e 01
E: 3044.876629 14 01 03 01 72 04 cc 05 00 03 25 0a 4d 0e 01
E: 3044.884682 14 01 03 01 72 04 cc 05 00 03 25 0a 4d 0e 01
E: 3044.892715 14 01 03 01 72 04 cc 05 00 03 25 0a 4d 0e 01
E: 3044.900687 14 01 03 01 72 04 cc 05 00 03 25 0a 4d 0e 01
E: 3044.908646 14 01 03 01 72 04 cc 05 00 03 25 0a 4d 0e 01
E: 3044.924800 14 01 03 01 72 04 cc 05 00 03 25 0a 4d 0e 01
E: 3044.932830 14 01 03 01 72 04 cc 05 00 03 25 0a 4d 0e 01
E: 3044.940805 14 01 03 01 72 04 cc 05 00 03 25 0a 4d 0e 01
E: 3044.948682 14 01 03 01 72 04 cc 05 00 03 25 0a 4d 0e 01
E: 3044.956626 14 01 03 01 73 04 cc 05 00 03 25 0a 4d 0e 01
E: 3044.964694 14 01 03 01 73 04 cc 05 00 03 25 0a 4d 0e 01
E: 3044.972691 14 01 03 01 74 04 cd 05 00 03 25 0a 4d 0e 01
E: 3044.980716 14 01 03 01 75 04 ce 05 00 03 25 0a 4d 0e 01
E: 3044.988679 14 01 03 01 75 04 cf 05 00 03 25 0a 4d 0e 01
E: 3045.004708 14 01 03 01 76 04 cf 05 00 03 25 0a 4d 0e 01
E: 3045.012678 14 01 03 01 76 04 cf 05 00 03 25 0a 4d 0e 01
E: 3045.020708 14 01 03 01 76 04 cf 05 00 03 25 0a 4d 0e 01
E: 3045.028668 14 01 03 01 76 04 cf 05 00 03 25 0a 4d 0e 01
E: 3045.036694 14 01 03 01 76 04 cf 05 00 03 25 0a 4d 0e 01
E: 3045.044712 14 01 03 01 76 04 cf 05 00 03 25 0a 4d 0e 01
E: 3045.052687 14 01 03 01 76 04 cf 05 00 03 25 0a 4d 0e 01
E: 3045.060640 14 01 03 01 76 04 cf 05 00 03 25 0a 4d 0e 01
E: 3045.068706 14 01 03 01 76 04 cf 05 00 03 25 0a 4d 0e 01
E: 3045.084676 14 01 03 01 76 04 cf 05 00 03 25 0a 4d 0e 01
E: 3045.092673 14 01 03 01 76 04 cf 05 00 03 25 0a 4d 0e 01
E: 3045.100674 14 01 03 01 76 04 cf 05 00 03 25 0a 4d 0e 01
E: 3045.108709 14 01 03 01 77 04 d0 05 00 03 25 0a 4d 0e 01
E: 3045.116690 14 01 03 01 78 04 d2 05 00 03 25 0a 4d 0e 01
E: 3045.124633 14 01 03 01 78 04 d2 05 00 03 25 0a 4d 0e 01
E: 3045.132623 14 01 03 01 78 04 d2 05 00 03 25 0a 4d 0e 01
E: 3045.140807 14 01 03 01 78 04 d2 05 00 03 25 0a 4d 0e 01
E: 3045.148773 14 01 03 01 78 04 d2 05 00 03 25 0a 4d 0e 01
E: 3045.164631 14 01 03 01 78 04 d2 05 00 03 25 0a 4d 0e 01
E: 3045.172685 14 01 03 01 78 04 d2 05 00 03 25 0a 4d 0e 01
E: 3045.180660 14 01 03 01 78 04 d2 05 00 03 25 0a 4d 0e 01
E: 3045.188693 14 01 03 01 78 04 d2 05 00 03 25 0a 4d 0e 01
E: 3045.196699 14 01 03 01 78 04 d2 05 00 03 25 0a 4d 0e 01
E: 3045.212612 14 01 03 01 78 04 d2 05 02 03 a3 05 76 04 02
E: 3045.220631 14 01 03 01 78 04 d2 05 03 03 a3 05 76 04 02
E: 3045.228711 14 01 03 01 78 04 d2 05 03 03 a6 05 76 04 02
E: 3045.236692 14 01 03 01 7a 04 d3 05 03 03 a6 05 76 04 02
E: 3045.252723 14 01 03 01 7b 04 d5 05 03 03 a6 05 76 04 02
E: 3045.260800 14 01 03 01 7c 04 d6 05 03 03 a6 05 76 04 02
E: 3045.276668 14 01 03 01 7d 04 d7 05 03 03 a6 05 76 04 02
E: 3045.284698 14 01 03 01 7e 04 d8 05 03 03 a6 05 76 04 02
E: 3045.300616 14 01 03 01 7f 04 d9 05 03 03 a6 05 76 04 02
E: 3045.308778 14 01 03 01 80 04 d9 05 03 03 a6 05 76 04 02
E: 3045.324724 14 01 03 01 81 04 da 05 03 03 a6 05 76 04 02
E: 3045.332678 14 01 03 01 82 04 db 05 03 03 a6 05 76 04 02
E: 3045.348665 14 01 03 01 82 04 db 05 03 03 a6 05 76 04 02
E: 3045.356685 14 01 03 01 83 04 db 05 03 03 a6 05 76 04 02
E: 3045.372682 14 01 03 01 84 04 db 05 03 03 a6 05 76 04 02
E: 3045.380671 14 01 03 01 84 04 db 05 03 03 a6 05 76 04 02
E: 3045.396684 14 01 03 01 85 04 db 05 03 03 a6 05 76 04 02
E: 3045.404724 14 01 03 01 85 04 db 05 03 03 a6 05 76 04 02
E: 3045.420718 14 01 03 01 85 04 db 05 03 03 a6 05 76 04 02
E: 3045.428667 14 01 03 01 86 04 db 05 03 03 a6 05 76 04 02
E: 3045.444710 14 01 03 01 86 04 db 05 03 03 a6 05 76 04 02
E: 3045.452671 14 01 03 01 86 04 db 05 03 03 a6 05 76 04 02
E: 3045.468679 14 01 03 01 86 04 db 05 03 03 a6 05 76 04 02
E: 3045.476674 14 01 03 01 86 04 db 05 03 03 a6 05 76 04 02
E: 3045.492603 14 01 03 01 86 04 db 05 03 03 a6 05 76 04 02
E: 3045.500642 14 01 03 01 86 04 db 05 03 03 a6 05 76 04 02
E: 3045.516699 14 01 03 01 86 04 db 05 03 03 a6 05 76 04 02
E: 3045.524614 14 01 03 01 86 04 db 05 03 03 a6 05 76 04 02
E: 3045.540615 14 01 03 01 86 04 db 05 03 03 a6 05 76 04 02
E: 3045.548622 14 01 03 01 86 04 db 05 03 03 a6 05 76 04 02
E: 3045.564653 14 01 03 01 86 04 db 05 03 03 a7 05 76 04 02
E: 3045.572610 14 01 03 01 86 04 db 05 03 03 a8 05 76 04 02
E: 3045.588684 14 01 03 01 86 04 db 05 03 03 a8 05 76 04 02
E: 3045.596683 14 01 03 01 86 04 db 05 03 03 a8 05 76 04 02
E: 3045.612661 14 01 03 01 86 04 db 05 03 03 a9 05 76 04 02
E: 3045.620677 14 01 03 01 86 04 db 05 03 03 a9 05 77 04 02
E: 3045.636661 14 01 03 01 86 04 db 05 03 03 aa 05 78 04 02
E: 3045.644654 14 01 03 01 86 04 db 05 03 03 aa 05 79 04 02
E: 3045.660716 14 01 03 01 86 04 db 05 03 03 aa 05 79 04 02
E: 3045.668679 14 01 03 01 86 04 db 05 03 03 ab 05 79 04 02
E: 3045.684676 14 01 03 01 86 04 db 05 03 03 ab 05 79 04 02
E: 3045.692631 14 01 03 01 86 04 db 05 03 03 ab 05 79 04 02
E: 3045.708671 14 01 03 01 86 04 db 05 03 03 ab 05 79 04 02
E: 3045.716633 14 01 03 01 86 04 db 05 03 03 ab 05 79 04 02
E: 3045.732614 14 01 03 01 86 04 db 05 03 03 ab 05 79 04 02
E: 3045.740678 14 01 03 01 86 04 db 05 03 03 ab 05 79 04 02
E: 3045.756593 14 01 03 01 86 04 db 05 03 03 ab 05 79 04 02
E: 3045.764784 14 01 03 01 86 04 db 05 03 03 ab 05 79 04 02
E: 3045.780687 14 01 03 01 86 04 db 05 03 03 ab 05 79 04 02
E: 3045.788710 14 01 03 01 86 04 db 05 03 03 ab 05 79 04 02
E: 3045.812614 14 01 03 01 86 04 db 05 03 03 ab 05 79 04 02
E: 3045.828644 14 01 03 01 86 04 db 05 03 03 ab 05 79 04 02
E: 3045.844665 14 01 03 01 86 04 db 05 03 03 ab 05 79 04 02
E: 3045.868600 14 01 03 01 86 04 db 05 03 03 ab 05 79 04 02
E: 3045.876665 14 01 03 01 86 04 db 05 03 03 ab 05 79 04 02
E: 3045.892649 14 01 03 01 97 04 09 06 03 03 ab 05 79 04 02
E: 3045.900626 14 01 03 01 9d 04 13 06 03 03 c3 05 b2 04 02
E: 3045.916664 14 01 03 01 b5 04 30 06 03 03 cf 05 cc 04 02
E: 3045.924688 14 01 03 01 bb 04 39 06 03 03 e5 05 f0 04 02
E: 3045.948600 14 01 03 01 c7 04 53 06 03 03 e5 05 f0 04 02
E: 3045.964698 14 01 00 01 c7 04 53 06 00 03 e5 05 f0 04 02
E: 3046.028604 14 01 02 02 6d 06 f6 05 02 04 43 05 36 07 02
E: 3046.036779 14 01 03 02 6d 06 f6 05 03 04 43 05 36 07 02
E: 3046.044581 14 01 03 02 6d 06 f6 05 03 04 43 05 36 07 02
E: 3046.060646 14 01 03 02 6d 06 f6 05 03 04 43 05 36 07 02
E: 3046.076578 14 01 03 02 6d 06 f6 05 03 04 43 05 36 07 02
E: 3046.092623 14 01 00 02 6d 06 f6 05 00 04 43 05 36 07 02
E: 3046.164665 14 01 02 01 fc 06 c3 06 02 03 c5 05 f0 07 02
E: 3046.172650 14 01 03 01 fc 06 c3 06 03 03 c5 05 f0 07 02
E: 3046.188793 14 01 03 01 fc 06 c3 06 03 03 c5 05 f0 07 02
E: 3046.204575 14 01 00 01 fc 06 c3 06 00 03 c5 05 f0 07 02
E: 3046.268620 14 01 02 02 5c 07 80 07 02 04 14 06 a1 08 02
E: 3046.276781 14 01 03 02 5c 07 80 07 03 04 14 06 a1 08 02
E: 3046.284775 14 01 03 02 5c 07 80 07 03 04 14 06 a1 08 02
E: 3046.292637 14 01 03 02 5c 07 80 07 03 04 14 06 a1 08 02
E: 3046.316631 14 01 03 02 5c 07 80 07 03 04 24 06 cf 08 02
E: 3046.324585 14 01 03 02 5c 07 80 07 03 04 24 06 cf 08 02
E: 3046.340621 14 01 03 02 5c 07 80 07 03 04 34 06 fb 08 02
E: 3046.348649 14 01 03 02 79 07 b5 07 03 04 34 06 fb 08 02
E: 3046.364663 14 01 03 02 91 07 dc 07 03 04 41 06 0f 09 02
E: 3046.372612 14 01 03 02 a0 07 ed 07 03 04 4f 06 22 09 02
E: 3046.388627 14 01 03 02 a8 07 f5 07 03 04 55 06 29 09 02
E: 3046.396634 14 01 03 02 b8 07 06 08 03 04 65 06 3c 09 02
E: 3046.412622 14 01 03 02 bf 07 0e 08 03 04 74 06 50 09 02
E: 3046.428647 14 01 00 02 bf 07 0e 08 00 04 74 06 50 09 02
E: 3046.476663 14 01 02 01 28 08 e7 08 02 03 d9 06 18 0a 02
E: 3046.484652 14 01 03 01 28 08 e7 08 03 03 d9 06 18 0a 02
E: 3046.492646 14 01 03 01 28 08 e7 08 03 03 d9 06 18 0a 02
E: 3046.500732 14 01 03 01 28 08 e7 08 03 03 d9 06 18 0a 02
E: 3046.516639 14 01 03 01 28 08 e7 08 03 03 d9 06 18 0a 02
E: 3046.524564 14 01 03 01 28 08 e7 08 03 03 d9 06 18 0a 02
E: 3046.548632 14 01 00 01 28 08 e7 08 00 03 d9 06 18 0a 02
E: 3046.596581 14 01 02 02 82 08 9b 09 02 04 3d 07 d5 0a 02
E: 3046.604697 14 01 03 02 82 08 9b 09 03 04 3d 07 d5 0a 02
E: 3046.612729 14 01 03 02 82 08 9b 09 03 04 3d 07 d5 0a 02
E: 3046.620619 14 01 03 02 82 08 9b 09 03 04 3d 07 d5 0a 02
E: 3046.636606 14 01 03 02 82 08 9b 09 03 04 3d 07 d5 0a 02
E: 3046.644605 14 01 03 02 8a 08 a0 09 03 04 3d 07 d5 0a 02
E: 3046.660667 14 01 03 02 8a 08 a0 09 03 04 3d 07 d5 0a 02
E: 3046.668586 14 01 03 02 93 08 a5 09 03 04 46 07 d7 0a 02
E: 3046.692619 14 01 03 02 a3 08 b6 09 03 04 65 07 16 0b 02
E: 3046.708572 14 01 03 02 aa 08 be 09 03 04 7f 07 4c 0b 02
E: 3046.724593 14 01 03 02 c7 08 de 09 03 04 90 07 58 0b 02
E: 3046.732623 14 01 03 02 d8 08 ee 09 03 04 98 07 5e 0b 02
E: 3046.748654 14 01 03 02 e9 08 ff 09 03 04 aa 07 6b 0b 02
E: 3046.756574 14 01 03 02 f9 08 0d 0a 03 04 bc 07 77 0b 02
E: 3046.772581 14 01 03 02 00 09 14 0a 03 04 bc 07 77 0b 02
E: 3046.780639 14 01 03 02 07 09 1a 0a 03 04 c3 07 7c 0b 02
E: 3046.796624 14 01 03 02 0e 09 21 0a 03 04 cb 07 83 0b 02
E: 3046.804610 14 01 03 02 15 09 29 0a 03 04 dc 07 90 0b 02
E: 3046.820632 14 01 03 02 1a 09 31 0a 03 04 dc 07 90 0b 02
E: 3046.828633 14 01 03 02 2a 09 43 0a 03 04 e5 07 93 0b 02
E: 3046.852619 14 01 03 02 42 09 60 0a 03 04 06 08 d8 0b 02
E: 3046.868569 14 01 03 02 5c 09 7e 0a 03 04 25 08 0f 0c 02
E: 3046.876601 14 01 03 02 5c 09 7e 0a 03 04 25 08 0f 0c 02
E: 3046.884601 14 01 03 02 75 09 9a 0a 03 04 35 08 1c 0c 02
E: 3046.892652 14 01 03 02 75 09 9a 0a 03 04 3d 08 23 0c 02
E: 3046.908615 14 01 03 02 7b 09 a3 0a 03 04 4d 08 30 0c 02
E: 3046.916655 14 01 03 02 81 09 ac 0a 03 04 55 08 36 0c 02
E: 3046.932643 14 01 03 02 88 09 b6 0a 03 04 66 08 43 0c 02
E: 3046.940613 14 01 03 02 96 09 c9 0a 03 04 6f 08 49 0c 02
E: 3046.956616 14 01 03 02 9d 09 d2 0a 03 04 78 08 4d 0c 02
E: 3046.964663 14 01 03 02 ac 09 e6 0a 03 04 8b 08 57 0c 02
E: 3046.980631 14 01 03 02 ba 09 f7 0a 03 04 8b 08 57 0c 02
E: 3046.988641 14 01 03 02 c1 09 fe 0a 03 04 94 08 5b 0c 02
E: 3047.004643 14 01 03 02 c8 09 06 0b 03 04 9d 08 61 0c 02
E: 3047.020622 14 01 03 02 e1 09 27 0b 03 04 b7 08 a6 0c 02
E: 3047.036609 14 01 03 02 e1 09 27 0b 03 04 d0 08 c2 0c 02
E: 3047.044622 14 01 03 02 e1 09 27 0b 03 04 d7 08 c9 0c 02
E: 3047.060610 14 01 03 02 e1 09 27 0b 03 04 e7 08 d9 0c 02
E: 3047.068560 14 01 03 02 e1 09 27 0b 03 04 ee 08 e0 0c 02
E: 3047.084594 14 01 03 02 e8 09 2e 0b 03 04 ee 08 e0 0c 02
E: 3047.092608 14 01 03 02 f0 09 34 0b 03 04 f5 08 e8 0c 02
E: 3047.108618 14 01 03 02 f0 09 34 0b 03 04 fc 08 ef 0c 02
E: 3047.116592 14 01 03 02 f0 09 34 0b 03 04 03 09 f6 0c 02
E: 3047.132650 14 01 03 02 01 0a 43 0b 03 04 0a 09 fc 0c 02
E: 3047.140597 14 01 03 02 01 0a 43 0b 03 04 10 09 03 0d 02
E: 3047.156556 14 01 03 02 08 0a 49 0b 03 04 10 09 03 0d 02
E: 3047.164664 14 01 03 02 08 0a 49 0b 03 04 18 09 09 0d 02
E: 3047.180600 14 01 03 02 08 0a 49 0b 03 04 18 09 09 0d 02
E: 3047.188629 14 01 03 02 08 0a 49 0b 03 04 18 09 09 0d 02
E: 3047.204598 14 01 03 02 08 0a 49 0b 03 04 18 09 09 0d 02
E: 3047.212621 14 01 03 02 08 0a 49 0b 03 04 18 09 09 0d 02
E: 3047.228534 14 01 03 02 08 0a 49 0b 03 04 1e 09 10 0d 02
E: 3047.236640 14 01 03 02 08 0a 49 0b 03 04 1e 09 10 0d 02
E: 3047.252614 14 01 03 02 08 0a 49 0b 03 04 1e 09 10 0d 02
E: 3047.260601 14 01 03 02 08 0a 49 0b 03 04 1e 09 10 0d 02
E: 3047.268531 14 01 03 02 11 0a 4c 0b 00 04 1e 09 10 0d 02
E: 3047.276619 14 01 03 02 11 0a 4c 0b 00 03 1e 09 10 0d 01
E: 3047.292586 14 01 03 02 11 0a 4c 0b 00 03 1e 09 10 0d 01
E: 3047.300650 14 01 03 02 11 0a 4c 0b 00 03 1e 09 10 0d 01
E: 3047.308608 14 01 03 02 11 0a 4c 0b 00 03 1e 09 10 0d 01
E: 3047.316613 14 01 03 02 11 0a 4c 0b 00 03 1e 09 10 0d 01
E: 3047.324610 14 01 03 02 11 0a 4c 0b 00 03 1e 09 10 0d 01
E: 3047.332584 14 01 03 02 11 0a 4c 0b 00 03 1e 09 10 0d 01
E: 3047.340597 14 01 03 02 11 0a 4c 0b 00 03 1e 09 10 0d 01
E: 3047.348611 14 01 03 02 11 0a 4c 0b 00 03 1e 09 10 0d 01
E: 3047.356626 14 01 03 02 11 0a 4c 0b 00 03 1e 09 10 0d 01
E: 3047.372598 14 01 03 02 19 0a 50 0b 00 03 1e 09 10 0d 01
E: 3047.380592 14 01 03 02 20 0a 54 0b 00 03 1e 09 10 0d 01
E: 3047.388641 14 01 03 02 27 0a 57 0b 00 03 1e 09 10 0d 01
E: 3047.396614 14 01 03 02 2d 0a 5a 0b 00 03 1e 09 10 0d 01
E: 3047.404544 14 01 03 02 32 0a 5d 0b 00 03 1e 09 10 0d 01
E: 3047.412588 14 01 03 02 38 0a 60 0b 00 03 1e 09 10 0d 01
E: 3047.420599 14 01 03 02 3c 0a 62 0b 00 03 1e 09 10 0d 01
E: 3047.428590 14 01 03 02 40 0a 64 0b 00 03 1e 09 10 0d 01
E: 3047.436569 14 01 03 02 40 0a 64 0b 00 03 1e 09 10 0d 01
E: 3047.452603 14 01 03 02 40 0a 64 0b 00 03 1e 09 10 0d 01
E: 3047.460584 14 01 03 02 40 0a 64 0b 00 03 1e 09 10 0d 01
E: 3047.468570 14 01 03 02 40 0a 64 0b 00 03 1e 09 10 0d 01
E: 3047.476623 14 01 03 02 40 0a 64 0b 00 03 1e 09 10 0d 01
E: 3047.484598 14 01 03 02 40 0a 64 0b 00 03 1e 09 10 0d 01
E: 3047.492598 14 01 03 02 40 0a 64 0b 00 03 1e 09 10 0d 01
E: 3047.500575 14 01 03 02 40 0a 64 0b 00 03 1e 09 10 0d 01
E: 3047.508545 14 01 03 02 40 0a 64 0b 00 03 1e 09 10 0d 01
E: 3047.516595 14 01 03 02 40 0a 64 0b 00 03 1e 09 10 0d 01
E: 3047.524538 14 01 03 02 40 0a 64 0b 00 03 1e 09 10 0d 01
E: 3047.540627 14 01 03 02 48 0a 69 0b 00 03 1e 09 10 0d 01
E: 3047.548578 14 01 03 02 48 0a 69 0b 00 03 1e 09 10 0d 01
E: 3047.556559 14 01 03 02 48 0a 69 0b 00 03 1e 09 10 0d 01
E: 3047.564560 14 01 03 02 48 0a 69 0b 00 03 1e 09 10 0d 01
E: 3047.572615 14 01 03 02 50 0a 6f 0b 00 03 1e 09 10 0d 01
E: 3047.580539 14 01 03 02 50 0a 6f 0b 00 03 1e 09 10 0d 01
E: 3047.588593 14 01 03 02 50 0a 6f 0b 00 03 1e 09 10 0d 01
E: 3047.596567 14 01 03 02 50 0a 6f 0b 00 03 1e 09 10 0d 01
E: 3047.604547 14 01 03 02 57 0a 75 0b 00 03 1e 09 10 0d 01
E: 3047.620623 14 01 03 02 57 0a 75 0b 00 03 1e 09 10 0d 01
E: 3047.628575 14 01 03 02 57 0a 75 0b 00 03 1e 09 10 0d 01
E: 3047.636633 14 01 03 02 57 0a 75 0b 00 03 1e 09 10 0d 01
E: 3047.644580 14 01 03 02 5f 0a 7b 0b 00 03 1e 09 10 0d 01
E: 3047.652588 14 01 03 02 66 0a 81 0b 00 03 1e 09 10 0d 01
E: 3047.660594 14 01 03 02 6d 0a 88 0b 00 03 1e 09 10 0d 01
E: 3047.668568 14 01 03 02 7c 0a 98 0b 00 03 1e 09 10 0d 01
E: 3047.676518 14 01 03 02 8a 0a ac 0b 00 03 1e 09 10 0d 01
E: 3047.684627 14 01 03 02 95 0a c5 0b 00 03 1e 09 10 0d 01
E: 3047.700599 14 01 03 02 ab 0a 12 0c 00 03 1e 09 10 0d 01
E: 3047.716610 14 01 00 02 ab 0a 12 0c 00 03 1e 09 10 0d 01
