R: 601 05 01 09 02 a1 01 85 01 09 01 a1 00 05 09 19 01 29 03 15 00 25 01 95 03 75 01 81 02 95 01 75 05 81 01 05 01 09 30 09 31 15 81 25 7f 75 08 95 02 81 06 c0 c0 05 0d 09 04 a1 01 85 02 09 22 09 53 95 01 75 08 81 02 a1 02 05 0d 09 42 15 00 25 01 75 01 95 01 81 02 09 32 81 02 09 47 81 02 95 05 81 03 75 08 09 51 95 01 81 02 15 00 25 20 09 48 81 02 09 49 81 02 05 01 15 00 26 d0 07 75 10 55 00 65 00 09 30 15 00 26 d0 07 35 00 45 00 81 02 09 31 45 00 81 02 c0 a1 02 05 0d 09 42 15 00 25 01 75 01 95 01 81 02 09 32 81 02 09 47 81 02 95 05 81 03 75 08 09 51 95 01 81 02 15 00 25 20 09 48 81 02 09 49 81 02 05 01 15 00 26 d0 07 75 10 55 00 65 00 09 30 15 00 26 d0 07 35 00 45 00 81 02 09 31 45 00 81 02 c0 a1 02 05 0d 09 42 15 00 25 01 75 01 95 01 81 02 09 32 81 02 09 47 81 02 95 05 81 03 75 08 09 51 95 01 81 02 15 00 25 20 09 48 81 02 09 49 81 02 05 01 15 00 26 d0 07 75 10 55 00 65 00 09 30 15 00 26 d0 07 35 00 45 00 81 02 09 31 45 00 81 02 c0 a1 02 05 0d 09 42 15 00 25 01 75 01 95 01 81 02 09 32 81 02 09 47 81 02 95 05 81 03 75 08 09 51 95 01 81 02 15 00 25 20 09 48 81 02 09 49 81 02 05 01 15 00 26 d0 07 75 10 55 00 65 00 09 30 15 00 26 d0 07 35 00 45 00 81 02 09 31 45 00 81 02 c0 a1 02 05 0d 09 42 15 00 25 01 75 01 95 01 81 02 09 32 81 02 09 47 81 02 95 05 81 03 75 08 09 51 95 01 81 02 15 00 25 20 09 48 81 02 09 49 81 02 05 01 15 00 26 d0 07 75 10 55 00 65 00 09 30 15 00 26 d0 07 35 00 45 00 81 02 09 31 45 00 81 02 c0 a1 02 05 0d 09 42 15 00 25 01 75 01 95 01 81 02 09 32 81 02 09 47 81 02 95 05 81 03 75 08 09 51 95 01 81 02 15 00 25 20 09 48 81 02 09 49 81 02 05 01 15 00 26 d0 07 75 10 55 00 65 00 09 30 15 00 26 d0 07 35 00 45 00 81 02 09 31 45 00 81 02 c0 05 0d 09 54 95 01 75 08 15 00 25 0a 81 02 09 55 b1 02 c0 09 0e a1 01 85 03 09 23 a1 02 09 52 09 53 15 00 25 0a 75 08 95 02 b1 02 c0 c0
N: Cypress Semiconductor CYTMA14-100-001A
I: 3 04b4 c001
# 1. Drag _one_ finger on the screen from one corner to the opposite, and release it.
E: 0.000000 51 02 00 07 00 05 05 f6 06 28 03 00 00 00 00 00 00 00 00 00 00 00 00 00 00 00 00 00 00 00 00 00 00 00 00 00 00 00 00 00 00 00 00 00 00 00 00 00 00 00 00 01
E: 0.019980 51 02 00 07 00 05 05 f6 06 28 03 00 00 00 00 00 00 00 00 00 00 00 00 00 00 00 00 00 00 00 00 00 00 00 00 00 00 00 00 00 00 00 00 00 00 00 00 00 00 00 00 01
E: 0.039977 51 02 00 07 00 05 05 f1 06 29 03 00 00 00 00 00 00 00 00 00 00 00 00 00 00 00 00 00 00 00 00 00 00 00 00 00 00 00 00 00 00 00 00 00 00 00 00 00 00 00 00 01
E: 0.060005 51 02 00 07 00 05 05 e4 06 2d 03 00 00 00 00 00 00 00 00 00 00 00 00 00 00 00 00 00 00 00 00 00 00 00 00 00 00 00 00 00 00 00 00 00 00 00 00 00 00 00 00 01
E: 0.080020 51 02 00 07 00 05 05 d6 06 32 03 00 00 00 00 00 00 00 00 00 00 00 00 00 00 00 00 00 00 00 00 00 00 00 00 00 00 00 00 00 00 00 00 00 00 00 00 00 00 00 00 01
E: 0.099951 51 02 00 07 00 05 05 c7 06 37 03 00 00 00 00 00 00 00 00 00 00 00 00 00 00 00 00 00 00 00 00 00 00 00 00 00 00 00 00 00 00 00 00 00 00 00 00 00 00 00 00 01
E: 0.119953 51 02 00 07 00 05 05 b3 06 3f 03 00 00 00 00 00 00 00 00 00 00 00 00 00 00 00 00 00 00 00 00 00 00 00 00 00 00 00 00 00 00 00 00 00 00 00 00 00 00 00 00 01
E: 0.139951 51 02 00 07 00 05 05 9c 06 4b 03 00 00 00 00 00 00 00 00 00 00 00 00 00 00 00 00 00 00 00 00 00 00 00 00 00 00 00 00 00 00 00 00 00 00 00 00 00 00 00 00 01
E: 0.159982 51 02 00 07 00 05 05 81 06 58 03 00 00 00 00 00 00 00 00 00 00 00 00 00 00 00 00 00 00 00 00 00 00 00 00 00 00 00 00 00 00 00 00 00 00 00 00 00 00 00 00 01
E: 0.179969 51 02 00 07 00 05 05 63 06 64 03 00 00 00 00 00 00 00 00 00 00 00 00 00 00 00 00 00 00 00 00 00 00 00 00 00 00 00 00 00 00 00 00 00 00 00 00 00 00 00 00 01
E: 0.199959 51 02 00 07 00 05 05 46 06 6e 03 00 00 00 00 00 00 00 00 00 00 00 00 00 00 00 00 00 00 00 00 00 00 00 00 00 00 00 00 00 00 00 00 00 00 00 00 00 00 00 00 01
E: 0.219942 51 02 00 07 00 05 05 26 06 75 03 00 00 00 00 00 00 00 00 00 00 00 00 00 00 00 00 00 00 00 00 00 00 00 00 00 00 00 00 00 00 00 00 00 00 00 00 00 00 00 00 01
E: 0.239954 51 02 00 07 00 05 05 04 06 7d 03 00 00 00 00 00 00 00 00 00 00 00 00 00 00 00 00 00 00 00 00 00 00 00 00 00 00 00 00 00 00 00 00 00 00 00 00 00 00 00 00 01
E: 0.259954 51 02 00 07 00 05 05 e0 05 85 03 00 00 00 00 00 00 00 00 00 00 00 00 00 00 00 00 00 00 00 00 00 00 00 00 00 00 00 00 00 00 00 00 00 00 00 00 00 00 00 00 01
E: 0.279952 51 02 00 07 00 05 05 b9 05 8e 03 00 00 00 00 00 00 00 00 00 00 00 00 00 00 00 00 00 00 00 00 00 00 00 00 00 00 00 00 00 00 00 00 00 00 00 00 00 00 00 00 01
E: 0.299952 51 02 00 07 00 05 05 91 05 98 03 00 00 00 00 00 00 00 00 00 00 00 00 00 00 00 00 00 00 00 00 00 00 00 00 00 00 00 00 00 00 00 00 00 00 00 00 00 00 00 00 01
E: 0.319986 51 02 00 07 00 05 05 67 05 a2 03 00 00 00 00 00 00 00 00 00 00 00 00 00 00 00 00 00 00 00 00 00 00 00 00 00 00 00 00 00 00 00 00 00 00 00 00 00 00 00 00 01
E: 0.339975 51 02 00 07 00 05 05 3e 05 a9 03 00 00 00 00 00 00 00 00 00 00 00 00 00 00 00 00 00 00 00 00 00 00 00 00 00 00 00 00 00 00 00 00 00 00 00 00 00 00 00 00 01
E: 0.359988 51 02 00 07 00 05 05 12 05 ad 03 00 00 00 00 00 00 00 00 00 00 00 00 00 00 00 00 00 00 00 00 00 00 00 00 00 00 00 00 00 00 00 00 00 00 00 00 00 00 00 00 01
E: 0.379996 51 02 00 07 00 05 05 e5 04 b2 03 00 00 00 00 00 00 00 00 00 00 00 00 00 00 00 00 00 00 00 00 00 00 00 00 00 00 00 00 00 00 00 00 00 00 00 00 00 00 00 00 01
E: 0.399957 51 02 00 07 00 05 05 ba 04 b6 03 00 00 00 00 00 00 00 00 00 00 00 00 00 00 00 00 00 00 00 00 00 00 00 00 00 00 00 00 00 00 00 00 00 00 00 00 00 00 00 00 01
E: 0.419986 51 02 00 07 00 05 05 8e 04 b9 03 00 00 00 00 00 00 00 00 00 00 00 00 00 00 00 00 00 00 00 00 00 00 00 00 00 00 00 00 00 00 00 00 00 00 00 00 00 00 00 00 01
E: 0.440002 51 02 00 07 00 05 05 62 04 bb 03 00 00 00 00 00 00 00 00 00 00 00 00 00 00 00 00 00 00 00 00 00 00 00 00 00 00 00 00 00 00 00 00 00 00 00 00 00 00 00 00 01
E: 0.459986 51 02 00 07 00 05 05 37 04 bf 03 00 00 00 00 00 00 00 00 00 00 00 00 00 00 00 00 00 00 00 00 00 00 00 00 00 00 00 00 00 00 00 00 00 00 00 00 00 00 00 00 01
E: 0.479955 51 02 00 07 00 05 05 0a 04 c2 03 00 00 00 00 00 00 00 00 00 00 00 00 00 00 00 00 00 00 00 00 00 00 00 00 00 00 00 00 00 00 00 00 00 00 00 00 00 00 00 00 01
E: 0.499953 51 02 00 07 00 05 05 dd 03 c5 03 00 00 00 00 00 00 00 00 00 00 00 00 00 00 00 00 00 00 00 00 00 00 00 00 00 00 00 00 00 00 00 00 00 00 00 00 00 00 00 00 01
E: 0.519829 51 02 00 07 00 05 05 b1 03 c7 03 00 00 00 00 00 00 00 00 00 00 00 00 00 00 00 00 00 00 00 00 00 00 00 00 00 00 00 00 00 00 00 00 00 00 00 00 00 00 00 00 01
E: 0.539961 51 02 00 07 00 05 05 85 03 cc 03 00 00 00 00 00 00 00 00 00 00 00 00 00 00 00 00 00 00 00 00 00 00 00 00 00 00 00 00 00 00 00 00 00 00 00 00 00 00 00 00 01
E: 0.559960 51 02 00 07 00 05 05 5a 03 d2 03 00 00 00 00 00 00 00 00 00 00 00 00 00 00 00 00 00 00 00 00 00 00 00 00 00 00 00 00 00 00 00 00 00 00 00 00 00 00 00 00 01
E: 0.579959 51 02 00 07 00 05 05 2e 03 d9 03 00 00 00 00 00 00 00 00 00 00 00 00 00 00 00 00 00 00 00 00 00 00 00 00 00 00 00 00 00 00 00 00 00 00 00 00 00 00 00 00 01
E: 0.599960 51 02 00 07 00 05 05 03 03 e0 03 00 00 00 00 00 00 00 00 00 00 00 00 00 00 00 00 00 00 00 00 00 00 00 00 00 00 00 00 00 00 00 00 00 00 00 00 00 00 00 00 01
E: 0.619957 51 02 00 07 00 05 05 d9 02 e6 03 00 00 00 00 00 00 00 00 00 00 00 00 00 00 00 00 00 00 00 00 00 00 00 00 00 00 00 00 00 00 00 00 00 00 00 00 00 00 00 00 01
E: 0.640037 51 02 00 07 00 05 05 af 02 ec 03 00 00 00 00 00 00 00 00 00 00 00 00 00 00 00 00 00 00 00 00 00 00 00 00 00 00 00 00 00 00 00 00 00 00 00 00 00 00 00 00 01
E: 0.659990 51 02 00 07 00 05 05 87 02 f3 03 00 00 00 00 00 00 00 00 00 00 00 00 00 00 00 00 00 00 00 00 00 00 00 00 00 00 00 00 00 00 00 00 00 00 00 00 00 00 00 00 01
E: 0.680011 51 02 00 07 00 05 05 5f 02 fb 03 00 00 00 00 00 00 00 00 00 00 00 00 00 00 00 00 00 00 00 00 00 00 00 00 00 00 00 00 00 00 00 00 00 00 00 00 00 00 00 00 01
E: 0.700001 51 02 00 07 00 05 05 39 02 04 04 00 00 00 00 00 00 00 00 00 00 00 00 00 00 00 00 00 00 00 00 00 00 00 00 00 00 00 00 00 00 00 00 00 00 00 00 00 00 00 00 01
E: 0.719997 51 02 00 07 00 05 05 15 02 0c 04 00 00 00 00 00 00 00 00 00 00 00 00 00 00 00 00 00 00 00 00 00 00 00 00 00 00 00 00 00 00 00 00 00 00 00 00 00 00 00 00 01
E: 0.740007 51 02 00 07 00 05 05 f2 01 15 04 00 00 00 00 00 00 00 00 00 00 00 00 00 00 00 00 00 00 00 00 00 00 00 00 00 00 00 00 00 00 00 00 00 00 00 00 00 00 00 00 01
E: 0.759958 51 02 00 07 00 05 05 cd 01 1f 04 00 00 00 00 00 00 00 00 00 00 00 00 00 00 00 00 00 00 00 00 00 00 00 00 00 00 00 00 00 00 00 00 00 00 00 00 00 00 00 00 01
E: 0.779956 51 02 00 07 00 05 05 aa 01 28 04 00 00 00 00 00 00 00 00 00 00 00 00 00 00 00 00 00 00 00 00 00 00 00 00 00 00 00 00 00 00 00 00 00 00 00 00 00 00 00 00 01
E: 0.799955 51 02 00 07 00 05 05 8b 01 30 04 00 00 00 00 00 00 00 00 00 00 00 00 00 00 00 00 00 00 00 00 00 00 00 00 00 00 00 00 00 00 00 00 00 00 00 00 00 00 00 00 01
E: 0.819995 51 02 00 07 00 05 05 6d 01 39 04 00 00 00 00 00 00 00 00 00 00 00 00 00 00 00 00 00 00 00 00 00 00 00 00 00 00 00 00 00 00 00 00 00 00 00 00 00 00 00 00 01
E: 0.840011 51 02 00 07 00 05 05 4a 01 40 04 00 00 00 00 00 00 00 00 00 00 00 00 00 00 00 00 00 00 00 00 00 00 00 00 00 00 00 00 00 00 00 00 00 00 00 00 00 00 00 00 01
E: 0.860001 51 02 00 07 00 05 05 28 01 42 04 00 00 00 00 00 00 00 00 00 00 00 00 00 00 00 00 00 00 00 00 00 00 00 00 00 00 00 00 00 00 00 00 00 00 00 00 00 00 00 00 01
E: 0.879992 51 02 00 07 00 05 05 0a 01 42 04 00 00 00 00 00 00 00 00 00 00 00 00 00 00 00 00 00 00 00 00 00 00 00 00 00 00 00 00 00 00 00 00 00 00 00 00 00 00 00 00 01
E: 0.900000 51 02 00 07 00 05 05 ef 00 3f 04 00 00 00 00 00 00 00 00 00 00 00 00 00 00 00 00 00 00 00 00 00 00 00 00 00 00 00 00 00 00 00 00 00 00 00 00 00 00 00 00 01
E: 0.919971 51 02 00 07 00 05 05 d8 00 38 04 00 00 00 00 00 00 00 00 00 00 00 00 00 00 00 00 00 00 00 00 00 00 00 00 00 00 00 00 00 00 00 00 00 00 00 00 00 00 00 00 01
E: 0.939998 51 02 00 07 00 05 05 c1 00 31 04 00 00 00 00 00 00 00 00 00 00 00 00 00 00 00 00 00 00 00 00 00 00 00 00 00 00 00 00 00 00 00 00 00 00 00 00 00 00 00 00 01
E: 0.959980 51 02 00 07 00 05 05 a9 00 28 04 00 00 00 00 00 00 00 00 00 00 00 00 00 00 00 00 00 00 00 00 00 00 00 00 00 00 00 00 00 00 00 00 00 00 00 00 00 00 00 00 01
E: 0.979958 51 02 00 07 00 05 05 91 00 20 04 00 00 00 00 00 00 00 00 00 00 00 00 00 00 00 00 00 00 00 00 00 00 00 00 00 00 00 00 00 00 00 00 00 00 00 00 00 00 00 00 01
E: 0.999961 51 02 00 07 00 05 05 7c 00 19 04 00 00 00 00 00 00 00 00 00 00 00 00 00 00 00 00 00 00 00 00 00 00 00 00 00 00 00 00 00 00 00 00 00 00 00 00 00 00 00 00 01
E: 1.019959 51 02 00 07 00 05 05 69 00 11 04 00 00 00 00 00 00 00 00 00 00 00 00 00 00 00 00 00 00 00 00 00 00 00 00 00 00 00 00 00 00 00 00 00 00 00 00 00 00 00 00 01
E: 1.039962 51 02 00 07 00 05 05 58 00 0b 04 00 00 00 00 00 00 00 00 00 00 00 00 00 00 00 00 00 00 00 00 00 00 00 00 00 00 00 00 00 00 00 00 00 00 00 00 00 00 00 00 01
E: 1.059964 51 02 00 07 00 05 05 49 00 07 04 00 00 00 00 00 00 00 00 00 00 00 00 00 00 00 00 00 00 00 00 00 00 00 00 00 00 00 00 00 00 00 00 00 00 00 00 00 00 00 00 01
E: 1.080015 51 02 00 07 00 05 05 3b 00 02 04 00 00 00 00 00 00 00 00 00 00 00 00 00 00 00 00 00 00 00 00 00 00 00 00 00 00 00 00 00 00 00 00 00 00 00 00 00 00 00 00 01
E: 1.100003 51 02 00 07 00 05 05 35 00 00 04 00 00 00 00 00 00 00 00 00 00 00 00 00 00 00 00 00 00 00 00 00 00 00 00 00 00 00 00 00 00 00 00 00 00 00 00 00 00 00 00 01
E: 1.119974 51 02 00 07 00 05 05 28 00 fb 03 00 00 00 00 00 00 00 00 00 00 00 00 00 00 00 00 00 00 00 00 00 00 00 00 00 00 00 00 00 00 00 00 00 00 00 00 00 00 00 00 01
E: 1.140007 51 02 00 07 00 05 05 24 00 fa 03 00 00 00 00 00 00 00 00 00 00 00 00 00 00 00 00 00 00 00 00 00 00 00 00 00 00 00 00 00 00 00 00 00 00 00 00 00 00 00 00 01
E: 1.159953 51 02 00 07 00 05 05 24 00 fa 03 00 00 00 00 00 00 00 00 00 00 00 00 00 00 00 00 00 00 00 00 00 00 00 00 00 00 00 00 00 00 00 00 00 00 00 00 00 00 00 00 01
E: 1.179957 51 02 00 07 00 05 05 1f 00 f7 03 00 00 00 00 00 00 00 00 00 00 00 00 00 00 00 00 00 00 00 00 00 00 00 00 00 00 00 00 00 00 00 00 00 00 00 00 00 00 00 00 01
E: 1.199952 51 02 00 07 00 05 05 1f 00 f7 03 00 00 00 00 00 00 00 00 00 00 00 00 00 00 00 00 00 00 00 00 00 00 00 00 00 00 00 00 00 00 00 00 00 00 00 00 00 00 00 00 01
E: 1.219952 51 02 00 07 00 05 05 1f 00 f7 03 00 00 00 00 00 00 00 00 00 00 00 00 00 00 00 00 00 00 00 00 00 00 00 00 00 00 00 00 00 00 00 00 00 00 00 00 00 00 00 00 01
E: 1.239962 51 02 00 07 00 05 05 1b 00 f5 03 00 00 00 00 00 00 00 00 00 00 00 00 00 00 00 00 00 00 00 00 00 00 00 00 00 00 00 00 00 00 00 00 00 00 00 00 00 00 00 00 01
E: 1.259994 51 02 00 07 00 05 05 1b 00 f5 03 00 00 00 00 00 00 00 00 00 00 00 00 00 00 00 00 00 00 00 00 00 00 00 00 00 00 00 00 00 00 00 00 00 00 00 00 00 00 00 00 01
E: 1.279983 51 02 00 07 00 05 05 1b 00 f5 03 00 00 00 00 00 00 00 00 00 00 00 00 00 00 00 00 00 00 00 00 00 00 00 00 00 00 00 00 00 00 00 00 00 00 00 00 00 00 00 00 01
E: 1.299953 51 02 00 07 00 05 05 1b 00 f5 03 00 00 00 00 00 00 00 00 00 00 00 00 00 00 00 00 00 00 00 00 00 00 00 00 00 00 00 00 00 00 00 00 00 00 00 00 00 00 00 00 01
E: 1.319954 51 02 00 07 00 05 05 1b 00 f5 03 00 00 00 00 00 00 00 00 00 00 00 00 00 00 00 00 00 00 00 00 00 00 00 00 00 00 00 00 00 00 00 00 00 00 00 00 00 00 00 00 01
E: 1.339957 51 02 00 07 00 05 05 1b 00 f5 03 00 00 00 00 00 00 00 00 00 00 00 00 00 00 00 00 00 00 00 00 00 00 00 00 00 00 00 00 00 00 00 00 00 00 00 00 00 00 00 00 01
E: 1.359951 51 02 00 07 00 05 05 1b 00 f5 03 00 00 00 00 00 00 00 00 00 00 00 00 00 00 00 00 00 00 00 00 00 00 00 00 00 00 00 00 00 00 00 00 00 00 00 00 00 00 00 00 01
E: 1.379959 51 02 00 07 00 05 05 1b 00 f5 03 00 00 00 00 00 00 00 00 00 00 00 00 00 00 00 00 00 00 00 00 00 00 00 00 00 00 00 00 00 00 00 00 00 00 00 00 00 00 00 00 01
E: 1.399953 51 02 00 07 00 05 05 1b 00 f5 03 00 00 00 00 00 00 00 00 00 00 00 00 00 00 00 00 00 00 00 00 00 00 00 00 00 00 00 00 00 00 00 00 00 00 00 00 00 00 00 00 01
E: 1.419963 51 02 00 07 00 05 05 1b 00 f5 03 00 00 00 00 00 00 00 00 00 00 00 00 00 00 00 00 00 00 00 00 00 00 00 00 00 00 00 00 00 00 00 00 00 00 00 00 00 00 00 00 01
E: 1.439954 51 02 00 07 00 05 05 1b 00 f5 03 00 00 00 00 00 00 00 00 00 00 00 00 00 00 00 00 00 00 00 00 00 00 00 00 00 00 00 00 00 00 00 00 00 00 00 00 00 00 00 00 01
E: 1.459950 51 02 00 07 00 05 05 1b 00 f5 03 00 00 00 00 00 00 00 00 00 00 00 00 00 00 00 00 00 00 00 00 00 00 00 00 00 00 00 00 00 00 00 00 00 00 00 00 00 00 00 00 01
E: 1.479957 51 02 00 07 00 05 05 1b 00 f5 03 00 00 00 00 00 00 00 00 00 00 00 00 00 00 00 00 00 00 00 00 00 00 00 00 00 00 00 00 00 00 00 00 00 00 00 00 00 00 00 00 01
E: 1.499961 51 02 00 00 00 05 05 1b 00 f5 03 00 00 00 00 00 00 00 00 00 00 00 00 00 00 00 00 00 00 00 00 00 00 00 00 00 00 00 00 00 00 00 00 00 00 00 00 00 00 00 00 01
# 2. Land one finger,
   - land a second finger far enough from the first
   - move your two fingers
   - release the *first* finger
   - release the second finger
E: 4.740050 51 02 00 07 00 05 05 61 07 90 02 00 00 00 00 00 00 00 00 00 00 00 00 00 00 00 00 00 00 00 00 00 00 00 00 00 00 00 00 00 00 00 00 00 00 00 00 00 00 00 00 01
E: 4.760069 51 02 00 07 00 05 05 5b 07 91 02 00 00 00 00 00 00 00 00 00 00 00 00 00 00 00 00 00 00 00 00 00 00 00 00 00 00 00 00 00 00 00 00 00 00 00 00 00 00 00 00 01
E: 4.780022 51 02 00 07 00 05 05 4c 07 93 02 00 00 00 00 00 00 00 00 00 00 00 00 00 00 00 00 00 00 00 00 00 00 00 00 00 00 00 00 00 00 00 00 00 00 00 00 00 00 00 00 01
E: 4.800030 51 02 00 07 00 05 05 46 07 94 02 00 00 00 00 00 00 00 00 00 00 00 00 00 00 00 00 00 00 00 00 00 00 00 00 00 00 00 00 00 00 00 00 00 00 00 00 00 00 00 00 01
E: 4.820017 51 02 00 07 00 05 05 40 07 94 02 00 00 00 00 00 00 00 00 00 00 00 00 00 00 00 00 00 00 00 00 00 00 00 00 00 00 00 00 00 00 00 00 00 00 00 00 00 00 00 00 01
E: 4.840000 51 02 00 07 00 05 05 3a 07 94 02 00 00 00 00 00 00 00 00 00 00 00 00 00 00 00 00 00 00 00 00 00 00 00 00 00 00 00 00 00 00 00 00 00 00 00 00 00 00 00 00 01
E: 4.860012 51 02 00 07 00 05 05 34 07 93 02 00 00 00 00 00 00 00 00 00 00 00 00 00 00 00 00 00 00 00 00 00 00 00 00 00 00 00 00 00 00 00 00 00 00 00 00 00 00 00 00 01
E: 4.880031 51 02 00 07 00 05 05 2e 07 92 02 00 00 00 00 00 00 00 00 00 00 00 00 00 00 00 00 00 00 00 00 00 00 00 00 00 00 00 00 00 00 00 00 00 00 00 00 00 00 00 00 01
E: 4.900017 51 02 00 07 00 05 05 29 07 92 02 00 00 00 00 00 00 00 00 00 00 00 00 00 00 00 00 00 00 00 00 00 00 00 00 00 00 00 00 00 00 00 00 00 00 00 00 00 00 00 00 01
E: 4.920030 51 02 00 07 00 05 05 24 07 92 02 00 00 00 00 00 00 00 00 00 00 00 00 00 00 00 00 00 00 00 00 00 00 00 00 00 00 00 00 00 00 00 00 00 00 00 00 00 00 00 00 01
E: 4.939989 51 02 00 07 00 05 05 1f 07 92 02 00 00 00 00 00 00 00 00 00 00 00 00 00 00 00 00 00 00 00 00 00 00 00 00 00 00 00 00 00 00 00 00 00 00 00 00 00 00 00 00 01
E: 4.959990 51 02 00 07 00 05 05 1a 07 92 02 00 00 00 00 00 00 00 00 00 00 00 00 00 00 00 00 00 00 00 00 00 00 00 00 00 00 00 00 00 00 00 00 00 00 00 00 00 00 00 00 01
E: 4.980030 51 02 00 07 00 05 05 15 07 91 02 00 00 00 00 00 00 00 00 00 00 00 00 00 00 00 00 00 00 00 00 00 00 00 00 00 00 00 00 00 00 00 00 00 00 00 00 00 00 00 00 01
E: 4.999991 51 02 00 07 00 05 05 10 07 91 02 00 00 00 00 00 00 00 00 00 00 00 00 00 00 00 00 00 00 00 00 00 00 00 00 00 00 00 00 00 00 00 00 00 00 00 00 00 00 00 00 01
E: 5.019886 51 02 00 07 00 05 05 0b 07 91 02 00 00 00 00 00 00 00 00 00 00 00 00 00 00 00 00 00 00 00 00 00 00 00 00 00 00 00 00 00 00 00 00 00 00 00 00 00 00 00 00 01
E: 5.039995 51 02 00 07 00 05 05 06 07 90 02 00 00 00 00 00 00 00 00 00 00 00 00 00 00 00 00 00 00 00 00 00 00 00 00 00 00 00 00 00 00 00 00 00 00 00 00 00 00 00 00 01
E: 5.060022 51 02 00 07 00 05 05 00 07 8f 02 00 00 00 00 00 00 00 00 00 00 00 00 00 00 00 00 00 00 00 00 00 00 00 00 00 00 00 00 00 00 00 00 00 00 00 00 00 00 00 00 01
E: 5.080007 51 02 00 07 00 05 05 fa 06 8e 02 00 00 00 00 00 00 00 00 00 00 00 00 00 00 00 00 00 00 00 00 00 00 00 00 00 00 00 00 00 00 00 00 00 00 00 00 00 00 00 00 01
E: 5.099992 51 02 00 07 00 05 05 f4 06 8d 02 00 00 00 00 00 00 00 00 00 00 00 00 00 00 00 00 00 00 00 00 00 00 00 00 00 00 00 00 00 00 00 00 00 00 00 00 00 00 00 00 01
E: 5.120003 51 02 00 07 00 05 05 ee 06 8b 02 00 00 00 00 00 00 00 00 00 00 00 00 00 00 00 00 00 00 00 00 00 00 00 00 00 00 00 00 00 00 00 00 00 00 00 00 00 00 00 00 01
E: 5.139992 51 02 00 07 00 05 05 e1 06 87 02 00 00 00 00 00 00 00 00 00 00 00 00 00 00 00 00 00 00 00 00 00 00 00 00 00 00 00 00 00 00 00 00 00 00 00 00 00 00 00 00 01
E: 5.160031 51 02 00 07 00 05 05 dc 06 86 02 00 00 00 00 00 00 00 00 00 00 00 00 00 00 00 00 00 00 00 00 00 00 00 00 00 00 00 00 00 00 00 00 00 00 00 00 00 00 00 00 01
E: 5.180043 51 02 00 07 00 05 05 d6 06 84 02 00 00 00 00 00 00 00 00 00 00 00 00 00 00 00 00 00 00 00 00 00 00 00 00 00 00 00 00 00 00 00 00 00 00 00 00 00 00 00 00 01
E: 5.200018 51 02 00 07 00 05 05 c8 06 7e 02 00 00 00 00 00 00 00 00 00 00 00 00 00 00 00 00 00 00 00 00 00 00 00 00 00 00 00 00 00 00 00 00 00 00 00 00 00 00 00 00 01
E: 5.220033 51 02 00 07 00 05 05 ba 06 78 02 00 00 00 00 00 00 00 00 00 00 00 00 00 00 00 00 00 00 00 00 00 00 00 00 00 00 00 00 00 00 00 00 00 00 00 00 00 00 00 00 01
E: 5.240049 51 02 00 07 00 05 05 ab 06 70 02 00 00 00 00 00 00 00 00 00 00 00 00 00 00 00 00 00 00 00 00 00 00 00 00 00 00 00 00 00 00 00 00 00 00 00 00 00 00 00 00 01
E: 5.259987 51 02 00 07 00 05 05 9d 06 67 02 00 00 00 00 00 00 00 00 00 00 00 00 00 00 00 00 00 00 00 00 00 00 00 00 00 00 00 00 00 00 00 00 00 00 00 00 00 00 00 00 01
E: 5.280022 51 02 00 07 00 05 05 8c 06 5e 02 00 00 00 00 00 00 00 00 00 00 00 00 00 00 00 00 00 00 00 00 00 00 00 00 00 00 00 00 00 00 00 00 00 00 00 00 00 00 00 00 01
E: 5.299995 51 02 00 07 00 05 05 7b 06 55 02 00 00 00 00 00 00 00 00 00 00 00 00 00 00 00 00 00 00 00 00 00 00 00 00 00 00 00 00 00 00 00 00 00 00 00 00 00 00 00 00 01
E: 5.319993 51 02 00 07 00 05 05 6e 06 4f 02 00 00 00 00 00 00 00 00 00 00 00 00 00 00 00 00 00 00 00 00 00 00 00 00 00 00 00 00 00 00 00 00 00 00 00 00 00 00 00 00 01
E: 5.340023 51 02 00 07 00 05 05 60 06 4a 02 00 00 00 00 00 00 00 00 00 00 00 00 00 00 00 00 00 00 00 00 00 00 00 00 00 00 00 00 00 00 00 00 00 00 00 00 00 00 00 00 01
E: 5.360034 51 02 00 07 00 05 05 51 06 47 02 00 00 00 00 00 00 00 00 00 00 00 00 00 00 00 00 00 00 00 00 00 00 00 00 00 00 00 00 00 00 00 00 00 00 00 00 00 00 00 00 01
E: 5.380042 51 02 00 07 00 05 05 42 06 45 02 00 00 00 00 00 00 00 00 00 00 00 00 00 00 00 00 00 00 00 00 00 00 00 00 00 00 00 00 00 00 00 00 00 00 00 00 00 00 00 00 01
E: 5.400031 51 02 00 07 00 05 05 31 06 42 02 00 00 00 00 00 00 00 00 00 00 00 00 00 00 00 00 00 00 00 00 00 00 00 00 00 00 00 00 00 00 00 00 00 00 00 00 00 00 00 00 01
E: 5.420033 51 02 00 07 00 05 05 21 06 3f 02 00 00 00 00 00 00 00 00 00 00 00 00 00 00 00 00 00 00 00 00 00 00 00 00 00 00 00 00 00 00 00 00 00 00 00 00 00 00 00 00 01
E: 5.440036 51 02 00 07 00 05 05 10 06 3c 02 00 00 00 00 00 00 00 00 00 00 00 00 00 00 00 00 00 00 00 00 00 00 00 00 00 00 00 00 00 00 00 00 00 00 00 00 00 00 00 00 01
E: 5.460006 51 02 00 07 00 05 05 00 06 39 02 00 00 00 00 00 00 00 00 00 00 00 00 00 00 00 00 00 00 00 00 00 00 00 00 00 00 00 00 00 00 00 00 00 00 00 00 00 00 00 00 01
E: 5.480047 51 02 00 07 00 05 05 f1 05 36 02 00 00 00 00 00 00 00 00 00 00 00 00 00 00 00 00 00 00 00 00 00 00 00 00 00 00 00 00 00 00 00 00 00 00 00 00 00 00 00 00 01
E: 5.500032 51 02 00 07 00 05 05 e2 05 34 02 00 00 00 00 00 00 00 00 00 00 00 00 00 00 00 00 00 00 00 00 00 00 00 00 00 00 00 00 00 00 00 00 00 00 00 00 00 00 00 00 01
E: 5.520039 51 02 00 07 00 05 05 d3 05 31 02 00 00 00 00 00 00 00 00 00 00 00 00 00 00 00 00 00 00 00 00 00 00 00 00 00 00 00 00 00 00 00 00 00 00 00 00 00 00 00 00 01
E: 5.540018 51 02 00 07 00 05 05 cc 05 30 02 00 00 00 00 00 00 00 00 00 00 00 00 00 00 00 00 00 00 00 00 00 00 00 00 00 00 00 00 00 00 00 00 00 00 00 00 00 00 00 00 01
E: 5.560039 51 02 00 07 00 05 05 b9 05 2f 02 00 00 00 00 00 00 00 00 00 00 00 00 00 00 00 00 00 00 00 00 00 00 00 00 00 00 00 00 00 00 00 00 00 00 00 00 00 00 00 00 01
E: 5.580041 51 02 00 07 00 05 05 a8 05 2d 02 00 00 00 00 00 00 00 00 00 00 00 00 00 00 00 00 00 00 00 00 00 00 00 00 00 00 00 00 00 00 00 00 00 00 00 00 00 00 00 00 01
E: 5.600041 51 02 00 07 00 05 05 a0 05 2c 02 00 00 00 00 00 00 00 00 00 00 00 00 00 00 00 00 00 00 00 00 00 00 00 00 00 00 00 00 00 00 00 00 00 00 00 00 00 00 00 00 01
E: 5.619856 51 02 00 07 00 05 05 8c 05 2c 02 00 00 00 00 00 00 00 00 00 00 00 00 00 00 00 00 00 00 00 00 00 00 00 00 00 00 00 00 00 00 00 00 00 00 00 00 00 00 00 00 01
E: 5.640033 51 02 00 07 00 05 05 79 05 2b 02 00 00 00 00 00 00 00 00 00 00 00 00 00 00 00 00 00 00 00 00 00 00 00 00 00 00 00 00 00 00 00 00 00 00 00 00 00 00 00 00 01
E: 5.664048 51 02 00 07 00 05 05 69 05 2c 02 07 01 05 05 39 05 28 05 00 00 00 00 00 00 00 00 00 00 00 00 00 00 00 00 00 00 00 00 00 00 00 00 00 00 00 00 00 00 00 00 02
E: 5.684049 51 02 00 07 00 05 05 57 05 2e 02 07 01 05 05 35 05 26 05 00 00 00 00 00 00 00 00 00 00 00 00 00 00 00 00 00 00 00 00 00 00 00 00 00 00 00 00 00 00 00 00 02
E: 5.704014 51 02 00 07 00 05 05 46 05 30 02 07 01 05 05 26 05 22 05 00 00 00 00 00 00 00 00 00 00 00 00 00 00 00 00 00 00 00 00 00 00 00 00 00 00 00 00 00 00 00 00 02
E: 5.724014 51 02 00 07 00 05 05 35 05 33 02 07 01 05 05 1f 05 21 05 00 00 00 00 00 00 00 00 00 00 00 00 00 00 00 00 00 00 00 00 00 00 00 00 00 00 00 00 00 00 00 00 02
E: 5.744019 51 02 00 07 00 05 05 23 05 37 02 07 01 05 05 0b 05 25 05 00 00 00 00 00 00 00 00 00 00 00 00 00 00 00 00 00 00 00 00 00 00 00 00 00 00 00 00 00 00 00 00 02
E: 5.764040 51 02 00 07 00 05 05 11 05 3d 02 07 01 05 05 fa 04 2a 05 00 00 00 00 00 00 00 00 00 00 00 00 00 00 00 00 00 00 00 00 00 00 00 00 00 00 00 00 00 00 00 00 02
E: 5.784045 51 02 00 07 00 05 05 fc 04 41 02 07 01 05 05 ea 04 2b 05 00 00 00 00 00 00 00 00 00 00 00 00 00 00 00 00 00 00 00 00 00 00 00 00 00 00 00 00 00 00 00 00 02
E: 5.804058 51 02 00 07 00 05 05 e9 04 43 02 07 01 05 05 d9 04 25 05 00 00 00 00 00 00 00 00 00 00 00 00 00 00 00 00 00 00 00 00 00 00 00 00 00 00 00 00 00 00 00 00 02
E: 5.824045 51 02 00 07 00 05 05 d5 04 45 02 07 01 05 05 c8 04 1c 05 00 00 00 00 00 00 00 00 00 00 00 00 00 00 00 00 00 00 00 00 00 00 00 00 00 00 00 00 00 00 00 00 02
E: 5.844035 51 02 00 07 00 05 05 c3 04 46 02 07 01 05 05 b9 04 0f 05 00 00 00 00 00 00 00 00 00 00 00 00 00 00 00 00 00 00 00 00 00 00 00 00 00 00 00 00 00 00 00 00 02
E: 5.864016 51 02 00 07 00 05 05 b2 04 47 02 07 01 05 05 aa 04 05 05 00 00 00 00 00 00 00 00 00 00 00 00 00 00 00 00 00 00 00 00 00 00 00 00 00 00 00 00 00 00 00 00 02
E: 5.884007 51 02 00 07 00 05 05 a1 04 49 02 07 01 05 05 9d 04 fb 04 00 00 00 00 00 00 00 00 00 00 00 00 00 00 00 00 00 00 00 00 00 00 00 00 00 00 00 00 00 00 00 00 02
E: 5.904050 51 02 00 07 00 05 05 93 04 4c 02 07 01 05 05 91 04 f4 04 00 00 00 00 00 00 00 00 00 00 00 00 00 00 00 00 00 00 00 00 00 00 00 00 00 00 00 00 00 00 00 00 02
E: 5.924044 51 02 00 07 00 05 05 8c 04 4d 02 07 01 05 05 86 04 ec 04 00 00 00 00 00 00 00 00 00 00 00 00 00 00 00 00 00 00 00 00 00 00 00 00 00 00 00 00 00 00 00 00 02
E: 5.944030 51 02 00 07 00 05 05 7c 04 50 02 07 01 05 05 7c 04 e5 04 00 00 00 00 00 00 00 00 00 00 00 00 00 00 00 00 00 00 00 00 00 00 00 00 00 00 00 00 00 00 00 00 02
E: 5.964051 51 02 00 07 00 05 05 76 04 51 02 07 01 05 05 77 04 e2 04 00 00 00 00 00 00 00 00 00 00 00 00 00 00 00 00 00 00 00 00 00 00 00 00 00 00 00 00 00 00 00 00 02
E: 5.984035 51 02 00 07 00 05 05 6f 04 52 02 07 01 05 05 6b 04 dc 04 00 00 00 00 00 00 00 00 00 00 00 00 00 00 00 00 00 00 00 00 00 00 00 00 00 00 00 00 00 00 00 00 02
E: 6.004026 51 02 00 07 00 05 05 61 04 56 02 07 01 05 05 66 04 d9 04 00 00 00 00 00 00 00 00 00 00 00 00 00 00 00 00 00 00 00 00 00 00 00 00 00 00 00 00 00 00 00 00 02
E: 6.024003 51 02 00 07 00 05 05 5b 04 57 02 07 01 05 05 61 04 d6 04 00 00 00 00 00 00 00 00 00 00 00 00 00 00 00 00 00 00 00 00 00 00 00 00 00 00 00 00 00 00 00 00 02
E: 6.044009 51 02 00 07 00 05 05 4e 04 5b 02 07 01 05 05 5c 04 d3 04 00 00 00 00 00 00 00 00 00 00 00 00 00 00 00 00 00 00 00 00 00 00 00 00 00 00 00 00 00 00 00 00 02
E: 6.063871 51 02 00 07 00 05 05 49 04 5d 02 07 01 05 05 57 04 d1 04 00 00 00 00 00 00 00 00 00 00 00 00 00 00 00 00 00 00 00 00 00 00 00 00 00 00 00 00 00 00 00 00 02
E: 6.084001 51 02 00 07 00 05 05 43 04 5f 02 07 01 05 05 51 04 cf 04 00 00 00 00 00 00 00 00 00 00 00 00 00 00 00 00 00 00 00 00 00 00 00 00 00 00 00 00 00 00 00 00 02
E: 6.104006 51 02 00 07 00 05 05 3d 04 60 02 07 01 05 05 4c 04 cd 04 00 00 00 00 00 00 00 00 00 00 00 00 00 00 00 00 00 00 00 00 00 00 00 00 00 00 00 00 00 00 00 00 02
E: 6.124001 51 02 00 07 00 05 05 30 04 64 02 07 01 05 05 46 04 ca 04 00 00 00 00 00 00 00 00 00 00 00 00 00 00 00 00 00 00 00 00 00 00 00 00 00 00 00 00 00 00 00 00 02
E: 6.144033 51 02 00 07 00 05 05 2a 04 65 02 07 01 05 05 40 04 c8 04 00 00 00 00 00 00 00 00 00 00 00 00 00 00 00 00 00 00 00 00 00 00 00 00 00 00 00 00 00 00 00 00 02
E: 6.164029 51 02 00 07 00 05 05 23 04 66 02 07 01 05 05 3b 04 c6 04 00 00 00 00 00 00 00 00 00 00 00 00 00 00 00 00 00 00 00 00 00 00 00 00 00 00 00 00 00 00 00 00 02
E: 6.184002 51 02 00 07 00 05 05 15 04 6c 02 07 01 05 05 35 04 c4 04 00 00 00 00 00 00 00 00 00 00 00 00 00 00 00 00 00 00 00 00 00 00 00 00 00 00 00 00 00 00 00 00 02
E: 6.204009 51 02 00 07 00 05 05 08 04 71 02 07 01 05 05 28 04 bf 04 00 00 00 00 00 00 00 00 00 00 00 00 00 00 00 00 00 00 00 00 00 00 00 00 00 00 00 00 00 00 00 00 02
E: 6.224015 51 02 00 07 00 05 05 fa 03 74 02 07 01 05 05 22 04 bc 04 00 00 00 00 00 00 00 00 00 00 00 00 00 00 00 00 00 00 00 00 00 00 00 00 00 00 00 00 00 00 00 00 02
E: 6.244001 51 02 00 07 00 05 05 f3 03 74 02 07 01 05 05 1c 04 ba 04 00 00 00 00 00 00 00 00 00 00 00 00 00 00 00 00 00 00 00 00 00 00 00 00 00 00 00 00 00 00 00 00 02
E: 6.264005 51 02 00 07 00 05 05 ec 03 75 02 07 01 05 05 0d 04 b5 04 00 00 00 00 00 00 00 00 00 00 00 00 00 00 00 00 00 00 00 00 00 00 00 00 00 00 00 00 00 00 00 00 02
E: 6.284004 51 02 00 07 00 05 05 da 03 76 02 07 01 05 05 06 04 b3 04 00 00 00 00 00 00 00 00 00 00 00 00 00 00 00 00 00 00 00 00 00 00 00 00 00 00 00 00 00 00 00 00 02
E: 6.304020 51 02 00 07 00 05 05 c9 03 77 02 07 01 05 05 f7 03 af 04 00 00 00 00 00 00 00 00 00 00 00 00 00 00 00 00 00 00 00 00 00 00 00 00 00 00 00 00 00 00 00 00 02
E: 6.324006 51 02 00 07 00 05 05 c2 03 77 02 07 01 05 05 f0 03 ad 04 00 00 00 00 00 00 00 00 00 00 00 00 00 00 00 00 00 00 00 00 00 00 00 00 00 00 00 00 00 00 00 00 02
E: 6.344007 51 02 00 07 00 05 05 ba 03 76 02 07 01 05 05 e2 03 a8 04 00 00 00 00 00 00 00 00 00 00 00 00 00 00 00 00 00 00 00 00 00 00 00 00 00 00 00 00 00 00 00 00 02
E: 6.364006 51 02 00 07 00 05 05 a6 03 75 02 07 01 05 05 d3 03 a5 04 00 00 00 00 00 00 00 00 00 00 00 00 00 00 00 00 00 00 00 00 00 00 00 00 00 00 00 00 00 00 00 00 02
E: 6.384004 51 02 00 07 00 05 05 9e 03 74 02 07 01 05 05 c4 03 a3 04 00 00 00 00 00 00 00 00 00 00 00 00 00 00 00 00 00 00 00 00 00 00 00 00 00 00 00 00 00 00 00 00 02
E: 6.404008 51 02 00 07 00 05 05 8d 03 73 02 07 01 05 05 be 03 a2 04 00 00 00 00 00 00 00 00 00 00 00 00 00 00 00 00 00 00 00 00 00 00 00 00 00 00 00 00 00 00 00 00 02
E: 6.424000 51 02 00 07 00 05 05 7c 03 73 02 07 01 05 05 b6 03 a2 04 00 00 00 00 00 00 00 00 00 00 00 00 00 00 00 00 00 00 00 00 00 00 00 00 00 00 00 00 00 00 00 00 02
E: 6.444004 51 02 00 07 00 05 05 74 03 73 02 07 01 05 05 a4 03 a2 04 00 00 00 00 00 00 00 00 00 00 00 00 00 00 00 00 00 00 00 00 00 00 00 00 00 00 00 00 00 00 00 00 02
E: 6.464006 51 02 00 07 00 05 05 63 03 74 02 07 01 05 05 96 03 a5 04 00 00 00 00 00 00 00 00 00 00 00 00 00 00 00 00 00 00 00 00 00 00 00 00 00 00 00 00 00 00 00 00 02
E: 6.484005 51 02 00 07 00 05 05 54 03 76 02 07 01 05 05 90 03 a5 04 00 00 00 00 00 00 00 00 00 00 00 00 00 00 00 00 00 00 00 00 00 00 00 00 00 00 00 00 00 00 00 00 02
E: 6.504006 51 02 00 07 00 05 05 45 03 7a 02 07 01 05 05 7f 03 a8 04 00 00 00 00 00 00 00 00 00 00 00 00 00 00 00 00 00 00 00 00 00 00 00 00 00 00 00 00 00 00 00 00 02
E: 6.524033 51 02 00 07 00 05 05 38 03 7e 02 07 01 05 05 6f 03 ab 04 00 00 00 00 00 00 00 00 00 00 00 00 00 00 00 00 00 00 00 00 00 00 00 00 00 00 00 00 00 00 00 00 02
E: 6.544053 51 02 00 07 00 05 05 28 03 83 02 07 01 05 05 69 03 ac 04 00 00 00 00 00 00 00 00 00 00 00 00 00 00 00 00 00 00 00 00 00 00 00 00 00 00 00 00 00 00 00 00 02
E: 6.564053 51 02 00 07 00 05 05 18 03 87 02 07 01 05 05 5b 03 b1 04 00 00 00 00 00 00 00 00 00 00 00 00 00 00 00 00 00 00 00 00 00 00 00 00 00 00 00 00 00 00 00 00 02
E: 6.584024 51 02 00 07 00 05 05 0b 03 8b 02 07 01 05 05 4d 03 b4 04 00 00 00 00 00 00 00 00 00 00 00 00 00 00 00 00 00 00 00 00 00 00 00 00 00 00 00 00 00 00 00 00 02
E: 6.604049 51 02 00 07 00 05 05 fd 02 90 02 07 01 05 05 46 03 b5 04 00 00 00 00 00 00 00 00 00 00 00 00 00 00 00 00 00 00 00 00 00 00 00 00 00 00 00 00 00 00 00 00 02
E: 6.624053 51 02 00 07 00 05 05 ee 02 95 02 07 01 05 05 39 03 b8 04 00 00 00 00 00 00 00 00 00 00 00 00 00 00 00 00 00 00 00 00 00 00 00 00 00 00 00 00 00 00 00 00 02
E: 6.644054 51 02 00 07 00 05 05 e2 02 9b 02 07 01 05 05 2a 03 bb 04 00 00 00 00 00 00 00 00 00 00 00 00 00 00 00 00 00 00 00 00 00 00 00 00 00 00 00 00 00 00 00 00 02
E: 6.664032 51 02 00 07 00 05 05 d4 02 a0 02 07 01 05 05 1a 03 be 04 00 00 00 00 00 00 00 00 00 00 00 00 00 00 00 00 00 00 00 00 00 00 00 00 00 00 00 00 00 00 00 00 02
E: 6.684055 51 02 00 07 00 05 05 c4 02 a6 02 07 01 05 05 0d 03 c2 04 00 00 00 00 00 00 00 00 00 00 00 00 00 00 00 00 00 00 00 00 00 00 00 00 00 00 00 00 00 00 00 00 02
E: 6.704067 51 02 00 07 00 05 05 b7 02 ab 02 07 01 05 05 fe 02 c5 04 00 00 00 00 00 00 00 00 00 00 00 00 00 00 00 00 00 00 00 00 00 00 00 00 00 00 00 00 00 00 00 00 02
E: 6.724035 51 02 00 07 00 05 05 a8 02 b0 02 07 01 05 05 f0 02 c8 04 00 00 00 00 00 00 00 00 00 00 00 00 00 00 00 00 00 00 00 00 00 00 00 00 00 00 00 00 00 00 00 00 02
E: 6.744007 51 02 00 07 00 05 05 98 02 b5 02 07 01 05 05 e9 02 c9 04 00 00 00 00 00 00 00 00 00 00 00 00 00 00 00 00 00 00 00 00 00 00 00 00 00 00 00 00 00 00 00 00 02
E: 6.764010 51 02 00 07 00 05 05 8b 02 ba 02 07 01 05 05 d9 02 cd 04 00 00 00 00 00 00 00 00 00 00 00 00 00 00 00 00 00 00 00 00 00 00 00 00 00 00 00 00 00 00 00 00 02
E: 6.784011 51 02 00 07 00 05 05 7c 02 c1 02 07 01 05 05 c8 02 d3 04 00 00 00 00 00 00 00 00 00 00 00 00 00 00 00 00 00 00 00 00 00 00 00 00 00 00 00 00 00 00 00 00 02
E: 6.804037 51 02 00 07 00 05 05 6d 02 c7 02 07 01 05 05 ba 02 d9 04 00 00 00 00 00 00 00 00 00 00 00 00 00 00 00 00 00 00 00 00 00 00 00 00 00 00 00 00 00 00 00 00 02
E: 6.824049 51 02 00 07 00 05 05 60 02 ce 02 07 01 05 05 ae 02 de 04 00 00 00 00 00 00 00 00 00 00 00 00 00 00 00 00 00 00 00 00 00 00 00 00 00 00 00 00 00 00 00 00 02
E: 6.844027 51 02 00 07 00 05 05 51 02 d6 02 07 01 05 05 a2 02 e3 04 00 00 00 00 00 00 00 00 00 00 00 00 00 00 00 00 00 00 00 00 00 00 00 00 00 00 00 00 00 00 00 00 02
E: 6.864018 51 02 00 07 00 05 05 40 02 de 02 07 01 05 05 9b 02 e4 04 00 00 00 00 00 00 00 00 00 00 00 00 00 00 00 00 00 00 00 00 00 00 00 00 00 00 00 00 00 00 00 00 02
E: 6.884051 51 02 00 07 00 05 05 30 02 ed 02 07 01 05 05 8d 02 ea 04 00 00 00 00 00 00 00 00 00 00 00 00 00 00 00 00 00 00 00 00 00 00 00 00 00 00 00 00 00 00 00 00 02
E: 6.900043 51 02 00 07 00 05 05 30 02 ed 02 07 01 05 05 81 02 ee 04 00 00 00 00 00 00 00 00 00 00 00 00 00 00 00 00 00 00 00 00 00 00 00 00 00 00 00 00 00 00 00 00 02
E: 6.920037 51 02 00 07 00 05 05 30 02 ed 02 07 01 05 05 76 02 f4 04 00 00 00 00 00 00 00 00 00 00 00 00 00 00 00 00 00 00 00 00 00 00 00 00 00 00 00 00 00 00 00 00 02
E: 6.940008 51 02 00 07 00 05 05 30 02 ed 02 07 01 05 05 71 02 f6 04 00 00 00 00 00 00 00 00 00 00 00 00 00 00 00 00 00 00 00 00 00 00 00 00 00 00 00 00 00 00 00 00 02
E: 6.960031 51 02 00 00 00 05 05 30 02 ed 02 07 01 05 05 66 02 fc 04 00 00 00 00 00 00 00 00 00 00 00 00 00 00 00 00 00 00 00 00 00 00 00 00 00 00 00 00 00 00 00 00 02
E: 6.980042 51 02 00 07 01 05 05 61 02 fe 04 00 00 00 00 00 00 00 00 00 00 00 00 00 00 00 00 00 00 00 00 00 00 00 00 00 00 00 00 00 00 00 00 00 00 00 00 00 00 00 00 01
E: 7.000007 51 02 00 07 01 05 05 5b 02 00 05 00 00 00 00 00 00 00 00 00 00 00 00 00 00 00 00 00 00 00 00 00 00 00 00 00 00 00 00 00 00 00 00 00 00 00 00 00 00 00 00 01
E: 7.020006 51 02 00 07 01 05 05 4d 02 05 05 00 00 00 00 00 00 00 00 00 00 00 00 00 00 00 00 00 00 00 00 00 00 00 00 00 00 00 00 00 00 00 00 00 00 00 00 00 00 00 00 01
E: 7.040038 51 02 00 07 01 05 05 3f 02 0a 05 00 00 00 00 00 00 00 00 00 00 00 00 00 00 00 00 00 00 00 00 00 00 00 00 00 00 00 00 00 00 00 00 00 00 00 00 00 00 00 00 01
E: 7.060040 51 02 00 07 01 05 05 33 02 10 05 00 00 00 00 00 00 00 00 00 00 00 00 00 00 00 00 00 00 00 00 00 00 00 00 00 00 00 00 00 00 00 00 00 00 00 00 00 00 00 00 01
E: 7.080010 51 02 00 07 01 05 05 2d 02 12 05 00 00 00 00 00 00 00 00 00 00 00 00 00 00 00 00 00 00 00 00 00 00 00 00 00 00 00 00 00 00 00 00 00 00 00 00 00 00 00 00 01
E: 7.100008 51 02 00 07 01 05 05 20 02 17 05 00 00 00 00 00 00 00 00 00 00 00 00 00 00 00 00 00 00 00 00 00 00 00 00 00 00 00 00 00 00 00 00 00 00 00 00 00 00 00 00 01
E: 7.120009 51 02 00 07 01 05 05 1a 02 18 05 00 00 00 00 00 00 00 00 00 00 00 00 00 00 00 00 00 00 00 00 00 00 00 00 00 00 00 00 00 00 00 00 00 00 00 00 00 00 00 00 01
E: 7.140006 51 02 00 07 01 05 05 14 02 19 05 00 00 00 00 00 00 00 00 00 00 00 00 00 00 00 00 00 00 00 00 00 00 00 00 00 00 00 00 00 00 00 00 00 00 00 00 00 00 00 00 01
E: 7.160008 51 02 00 07 01 05 05 07 02 1d 05 00 00 00 00 00 00 00 00 00 00 00 00 00 00 00 00 00 00 00 00 00 00 00 00 00 00 00 00 00 00 00 00 00 00 00 00 00 00 00 00 01
E: 7.180022 51 02 00 07 01 05 05 01 02 1e 05 00 00 00 00 00 00 00 00 00 00 00 00 00 00 00 00 00 00 00 00 00 00 00 00 00 00 00 00 00 00 00 00 00 00 00 00 00 00 00 00 01
E: 7.200003 51 02 00 07 01 05 05 fa 01 1e 05 00 00 00 00 00 00 00 00 00 00 00 00 00 00 00 00 00 00 00 00 00 00 00 00 00 00 00 00 00 00 00 00 00 00 00 00 00 00 00 00 01
E: 7.220005 51 02 00 07 01 05 05 f2 01 1e 05 00 00 00 00 00 00 00 00 00 00 00 00 00 00 00 00 00 00 00 00 00 00 00 00 00 00 00 00 00 00 00 00 00 00 00 00 00 00 00 00 01
E: 7.240009 51 02 00 07 01 05 05 eb 01 1d 05 00 00 00 00 00 00 00 00 00 00 00 00 00 00 00 00 00 00 00 00 00 00 00 00 00 00 00 00 00 00 00 00 00 00 00 00 00 00 00 00 01
E: 7.260009 51 02 00 07 01 05 05 e4 01 1c 05 00 00 00 00 00 00 00 00 00 00 00 00 00 00 00 00 00 00 00 00 00 00 00 00 00 00 00 00 00 00 00 00 00 00 00 00 00 00 00 00 01
E: 7.280009 51 02 00 07 01 05 05 dd 01 1b 05 00 00 00 00 00 00 00 00 00 00 00 00 00 00 00 00 00 00 00 00 00 00 00 00 00 00 00 00 00 00 00 00 00 00 00 00 00 00 00 00 01
E: 7.300008 51 02 00 07 01 05 05 cf 01 18 05 00 00 00 00 00 00 00 00 00 00 00 00 00 00 00 00 00 00 00 00 00 00 00 00 00 00 00 00 00 00 00 00 00 00 00 00 00 00 00 00 01
E: 7.320008 51 02 00 07 01 05 05 c9 01 15 05 00 00 00 00 00 00 00 00 00 00 00 00 00 00 00 00 00 00 00 00 00 00 00 00 00 00 00 00 00 00 00 00 00 00 00 00 00 00 00 00 01
E: 7.340009 51 02 00 07 01 05 05 bc 01 0e 05 00 00 00 00 00 00 00 00 00 00 00 00 00 00 00 00 00 00 00 00 00 00 00 00 00 00 00 00 00 00 00 00 00 00 00 00 00 00 00 00 01
E: 7.360009 51 02 00 07 01 05 05 b8 01 0a 05 00 00 00 00 00 00 00 00 00 00 00 00 00 00 00 00 00 00 00 00 00 00 00 00 00 00 00 00 00 00 00 00 00 00 00 00 00 00 00 00 01
E: 7.380010 51 02 00 07 01 05 05 b4 01 06 05 00 00 00 00 00 00 00 00 00 00 00 00 00 00 00 00 00 00 00 00 00 00 00 00 00 00 00 00 00 00 00 00 00 00 00 00 00 00 00 00 01
E: 7.400009 51 02 00 07 01 05 05 ae 01 fb 04 00 00 00 00 00 00 00 00 00 00 00 00 00 00 00 00 00 00 00 00 00 00 00 00 00 00 00 00 00 00 00 00 00 00 00 00 00 00 00 00 01
E: 7.420010 51 02 00 07 01 05 05 ab 01 f6 04 00 00 00 00 00 00 00 00 00 00 00 00 00 00 00 00 00 00 00 00 00 00 00 00 00 00 00 00 00 00 00 00 00 00 00 00 00 00 00 00 01
E: 7.440031 51 02 00 07 01 05 05 a9 01 f0 04 00 00 00 00 00 00 00 00 00 00 00 00 00 00 00 00 00 00 00 00 00 00 00 00 00 00 00 00 00 00 00 00 00 00 00 00 00 00 00 00 01
E: 7.460011 51 02 00 07 01 05 05 a7 01 ea 04 00 00 00 00 00 00 00 00 00 00 00 00 00 00 00 00 00 00 00 00 00 00 00 00 00 00 00 00 00 00 00 00 00 00 00 00 00 00 00 00 01
E: 7.480011 51 02 00 07 01 05 05 a5 01 e3 04 00 00 00 00 00 00 00 00 00 00 00 00 00 00 00 00 00 00 00 00 00 00 00 00 00 00 00 00 00 00 00 00 00 00 00 00 00 00 00 00 01
E: 7.500011 51 02 00 07 01 05 05 a1 01 d2 04 00 00 00 00 00 00 00 00 00 00 00 00 00 00 00 00 00 00 00 00 00 00 00 00 00 00 00 00 00 00 00 00 00 00 00 00 00 00 00 00 01
E: 7.520010 51 02 00 07 01 05 05 9e 01 c2 04 00 00 00 00 00 00 00 00 00 00 00 00 00 00 00 00 00 00 00 00 00 00 00 00 00 00 00 00 00 00 00 00 00 00 00 00 00 00 00 00 01
E: 7.540011 51 02 00 07 01 05 05 9c 01 bb 04 00 00 00 00 00 00 00 00 00 00 00 00 00 00 00 00 00 00 00 00 00 00 00 00 00 00 00 00 00 00 00 00 00 00 00 00 00 00 00 00 01
E: 7.560012 51 02 00 07 01 05 05 99 01 aa 04 00 00 00 00 00 00 00 00 00 00 00 00 00 00 00 00 00 00 00 00 00 00 00 00 00 00 00 00 00 00 00 00 00 00 00 00 00 00 00 00 01
E: 7.580014 51 02 00 07 01 05 05 97 01 9a 04 00 00 00 00 00 00 00 00 00 00 00 00 00 00 00 00 00 00 00 00 00 00 00 00 00 00 00 00 00 00 00 00 00 00 00 00 00 00 00 00 01
E: 7.600012 51 02 00 07 01 05 05 96 01 88 04 00 00 00 00 00 00 00 00 00 00 00 00 00 00 00 00 00 00 00 00 00 00 00 00 00 00 00 00 00 00 00 00 00 00 00 00 00 00 00 00 01
E: 7.620014 51 02 00 07 01 05 05 95 01 75 04 00 00 00 00 00 00 00 00 00 00 00 00 00 00 00 00 00 00 00 00 00 00 00 00 00 00 00 00 00 00 00 00 00 00 00 00 00 00 00 00 01
E: 7.640014 51 02 00 07 01 05 05 95 01 63 04 00 00 00 00 00 00 00 00 00 00 00 00 00 00 00 00 00 00 00 00 00 00 00 00 00 00 00 00 00 00 00 00 00 00 00 00 00 00 00 00 01
E: 7.660013 51 02 00 07 01 05 05 97 01 51 04 00 00 00 00 00 00 00 00 00 00 00 00 00 00 00 00 00 00 00 00 00 00 00 00 00 00 00 00 00 00 00 00 00 00 00 00 00 00 00 00 01
E: 7.680046 51 02 00 07 01 05 05 9b 01 3c 04 00 00 00 00 00 00 00 00 00 00 00 00 00 00 00 00 00 00 00 00 00 00 00 00 00 00 00 00 00 00 00 00 00 00 00 00 00 00 00 00 01
E: 7.700014 51 02 00 07 01 05 05 a1 01 23 04 00 00 00 00 00 00 00 00 00 00 00 00 00 00 00 00 00 00 00 00 00 00 00 00 00 00 00 00 00 00 00 00 00 00 00 00 00 00 00 00 01
E: 7.720013 51 02 00 07 01 05 05 aa 01 07 04 00 00 00 00 00 00 00 00 00 00 00 00 00 00 00 00 00 00 00 00 00 00 00 00 00 00 00 00 00 00 00 00 00 00 00 00 00 00 00 00 01
E: 7.740013 51 02 00 07 01 05 05 b7 01 e9 03 00 00 00 00 00 00 00 00 00 00 00 00 00 00 00 00 00 00 00 00 00 00 00 00 00 00 00 00 00 00 00 00 00 00 00 00 00 00 00 00 01
E: 7.760016 51 02 00 07 01 05 05 c6 01 cc 03 00 00 00 00 00 00 00 00 00 00 00 00 00 00 00 00 00 00 00 00 00 00 00 00 00 00 00 00 00 00 00 00 00 00 00 00 00 00 00 00 01
E: 7.780016 51 02 00 07 01 05 05 d6 01 af 03 00 00 00 00 00 00 00 00 00 00 00 00 00 00 00 00 00 00 00 00 00 00 00 00 00 00 00 00 00 00 00 00 00 00 00 00 00 00 00 00 01
E: 7.800013 51 02 00 07 01 05 05 e8 01 95 03 00 00 00 00 00 00 00 00 00 00 00 00 00 00 00 00 00 00 00 00 00 00 00 00 00 00 00 00 00 00 00 00 00 00 00 00 00 00 00 00 01
E: 7.820015 51 02 00 07 01 05 05 fb 01 80 03 00 00 00 00 00 00 00 00 00 00 00 00 00 00 00 00 00 00 00 00 00 00 00 00 00 00 00 00 00 00 00 00 00 00 00 00 00 00 00 00 01
E: 7.840013 51 02 00 07 01 05 05 11 02 6f 03 00 00 00 00 00 00 00 00 00 00 00 00 00 00 00 00 00 00 00 00 00 00 00 00 00 00 00 00 00 00 00 00 00 00 00 00 00 00 00 00 01
E: 7.860015 51 02 00 07 01 05 05 28 02 60 03 00 00 00 00 00 00 00 00 00 00 00 00 00 00 00 00 00 00 00 00 00 00 00 00 00 00 00 00 00 00 00 00 00 00 00 00 00 00 00 00 01
E: 7.880014 51 02 00 07 01 05 05 41 02 56 03 00 00 00 00 00 00 00 00 00 00 00 00 00 00 00 00 00 00 00 00 00 00 00 00 00 00 00 00 00 00 00 00 00 00 00 00 00 00 00 00 01
E: 7.900014 51 02 00 07 01 05 05 5b 02 4f 03 00 00 00 00 00 00 00 00 00 00 00 00 00 00 00 00 00 00 00 00 00 00 00 00 00 00 00 00 00 00 00 00 00 00 00 00 00 00 00 00 01
E: 7.920015 51 02 00 07 01 05 05 76 02 4c 03 00 00 00 00 00 00 00 00 00 00 00 00 00 00 00 00 00 00 00 00 00 00 00 00 00 00 00 00 00 00 00 00 00 00 00 00 00 00 00 00 01
E: 7.940014 51 02 00 07 01 05 05 92 02 4e 03 00 00 00 00 00 00 00 00 00 00 00 00 00 00 00 00 00 00 00 00 00 00 00 00 00 00 00 00 00 00 00 00 00 00 00 00 00 00 00 00 01
E: 7.960015 51 02 00 07 01 05 05 b0 02 54 03 00 00 00 00 00 00 00 00 00 00 00 00 00 00 00 00 00 00 00 00 00 00 00 00 00 00 00 00 00 00 00 00 00 00 00 00 00 00 00 00 01
E: 7.980015 51 02 00 07 01 05 05 cb 02 5d 03 00 00 00 00 00 00 00 00 00 00 00 00 00 00 00 00 00 00 00 00 00 00 00 00 00 00 00 00 00 00 00 00 00 00 00 00 00 00 00 00 01
E: 8.000013 51 02 00 07 01 05 05 e7 02 69 03 00 00 00 00 00 00 00 00 00 00 00 00 00 00 00 00 00 00 00 00 00 00 00 00 00 00 00 00 00 00 00 00 00 00 00 00 00 00 00 00 01
E: 8.020012 51 02 00 07 01 05 05 04 03 76 03 00 00 00 00 00 00 00 00 00 00 00 00 00 00 00 00 00 00 00 00 00 00 00 00 00 00 00 00 00 00 00 00 00 00 00 00 00 00 00 00 01
E: 8.040039 51 02 00 07 01 05 05 20 03 87 03 00 00 00 00 00 00 00 00 00 00 00 00 00 00 00 00 00 00 00 00 00 00 00 00 00 00 00 00 00 00 00 00 00 00 00 00 00 00 00 00 01
E: 8.060014 51 02 00 07 01 05 05 3d 03 99 03 00 00 00 00 00 00 00 00 00 00 00 00 00 00 00 00 00 00 00 00 00 00 00 00 00 00 00 00 00 00 00 00 00 00 00 00 00 00 00 00 01
E: 8.080018 51 02 00 07 01 05 05 58 03 a9 03 00 00 00 00 00 00 00 00 00 00 00 00 00 00 00 00 00 00 00 00 00 00 00 00 00 00 00 00 00 00 00 00 00 00 00 00 00 00 00 00 01
E: 8.100016 51 02 00 07 01 05 05 70 03 b5 03 00 00 00 00 00 00 00 00 00 00 00 00 00 00 00 00 00 00 00 00 00 00 00 00 00 00 00 00 00 00 00 00 00 00 00 00 00 00 00 00 01
E: 8.120017 51 02 00 07 01 05 05 88 03 bf 03 00 00 00 00 00 00 00 00 00 00 00 00 00 00 00 00 00 00 00 00 00 00 00 00 00 00 00 00 00 00 00 00 00 00 00 00 00 00 00 00 01
E: 8.140016 51 02 00 07 01 05 05 9e 03 c7 03 00 00 00 00 00 00 00 00 00 00 00 00 00 00 00 00 00 00 00 00 00 00 00 00 00 00 00 00 00 00 00 00 00 00 00 00 00 00 00 00 01
E: 8.160016 51 02 00 07 01 05 05 b8 03 d2 03 00 00 00 00 00 00 00 00 00 00 00 00 00 00 00 00 00 00 00 00 00 00 00 00 00 00 00 00 00 00 00 00 00 00 00 00 00 00 00 00 01
E: 8.180027 51 02 00 07 01 05 05 d9 03 e9 03 00 00 00 00 00 00 00 00 00 00 00 00 00 00 00 00 00 00 00 00 00 00 00 00 00 00 00 00 00 00 00 00 00 00 00 00 00 00 00 00 01
E: 8.200010 51 02 00 07 01 05 05 d9 03 e9 03 00 00 00 00 00 00 00 00 00 00 00 00 00 00 00 00 00 00 00 00 00 00 00 00 00 00 00 00 00 00 00 00 00 00 00 00 00 00 00 00 01
E: 8.220009 51 02 00 07 01 05 05 d9 03 e9 03 00 00 00 00 00 00 00 00 00 00 00 00 00 00 00 00 00 00 00 00 00 00 00 00 00 00 00 00 00 00 00 00 00 00 00 00 00 00 00 00 01
E: 8.240010 51 02 00 07 01 05 05 d9 03 e9 03 00 00 00 00 00 00 00 00 00 00 00 00 00 00 00 00 00 00 00 00 00 00 00 00 00 00 00 00 00 00 00 00 00 00 00 00 00 00 00 00 01
E: 8.260014 51 02 00 00 01 05 05 d9 03 e9 03 00 00 00 00 00 00 00 00 00 00 00 00 00 00 00 00 00 00 00 00 00 00 00 00 00 00 00 00 00 00 00 00 00 00 00 00 00 00 00 00 01
# 3. Finally, move your ten fingers on the screen and release them.
E: 11.360113 51 02 00 07 00 05 05 61 07 89 05 00 00 00 00 00 00 00 00 00 00 00 00 00 00 00 00 00 00 00 00 00 00 00 00 00 00 00 00 00 00 00 00 00 00 00 00 00 00 00 00 01
E: 11.380123 51 02 00 07 00 05 05 54 07 a3 05 00 00 00 00 00 00 00 00 00 00 00 00 00 00 00 00 00 00 00 00 00 00 00 00 00 00 00 00 00 00 00 00 00 00 00 00 00 00 00 00 01
E: 11.400067 51 02 00 07 00 05 05 45 07 c3 05 00 00 00 00 00 00 00 00 00 00 00 00 00 00 00 00 00 00 00 00 00 00 00 00 00 00 00 00 00 00 00 00 00 00 00 00 00 00 00 00 01
E: 11.420095 51 02 00 07 00 05 05 34 07 e0 05 00 00 00 00 00 00 00 00 00 00 00 00 00 00 00 00 00 00 00 00 00 00 00 00 00 00 00 00 00 00 00 00 00 00 00 00 00 00 00 00 01
E: 11.440047 51 02 00 07 00 05 05 27 07 f5 05 00 00 00 00 00 00 00 00 00 00 00 00 00 00 00 00 00 00 00 00 00 00 00 00 00 00 00 00 00 00 00 00 00 00 00 00 00 00 00 00 01
E: 11.460088 51 02 00 07 00 05 05 1f 07 01 06 00 00 00 00 00 00 00 00 00 00 00 00 00 00 00 00 00 00 00 00 00 00 00 00 00 00 00 00 00 00 00 00 00 00 00 00 00 00 00 00 01
E: 11.479934 51 02 00 07 00 05 05 1c 07 04 06 00 00 00 00 00 00 00 00 00 00 00 00 00 00 00 00 00 00 00 00 00 00 00 00 00 00 00 00 00 00 00 00 00 00 00 00 00 00 00 00 01
E: 11.500085 51 02 00 07 00 05 05 18 07 06 06 00 00 00 00 00 00 00 00 00 00 00 00 00 00 00 00 00 00 00 00 00 00 00 00 00 00 00 00 00 00 00 00 00 00 00 00 00 00 00 00 01
E: 11.520044 51 02 00 07 00 05 05 14 07 08 06 00 00 00 00 00 00 00 00 00 00 00 00 00 00 00 00 00 00 00 00 00 00 00 00 00 00 00 00 00 00 00 00 00 00 00 00 00 00 00 00 01
E: 11.540042 51 02 00 07 00 05 05 0f 07 0a 06 00 00 00 00 00 00 00 00 00 00 00 00 00 00 00 00 00 00 00 00 00 00 00 00 00 00 00 00 00 00 00 00 00 00 00 00 00 00 00 00 01
E: 11.560043 51 02 00 07 00 05 05 03 07 13 06 00 00 00 00 00 00 00 00 00 00 00 00 00 00 00 00 00 00 00 00 00 00 00 00 00 00 00 00 00 00 00 00 00 00 00 00 00 00 00 00 01
E: 11.580052 51 02 00 07 00 05 05 f7 06 1a 06 00 00 00 00 00 00 00 00 00 00 00 00 00 00 00 00 00 00 00 00 00 00 00 00 00 00 00 00 00 00 00 00 00 00 00 00 00 00 00 00 01
E: 11.600047 51 02 00 07 00 05 05 e9 06 20 06 00 00 00 00 00 00 00 00 00 00 00 00 00 00 00 00 00 00 00 00 00 00 00 00 00 00 00 00 00 00 00 00 00 00 00 00 00 00 00 00 01
E: 11.620043 51 02 00 07 00 05 05 da 06 26 06 00 00 00 00 00 00 00 00 00 00 00 00 00 00 00 00 00 00 00 00 00 00 00 00 00 00 00 00 00 00 00 00 00 00 00 00 00 00 00 00 01
E: 11.640044 51 02 00 07 00 05 05 cc 06 2c 06 00 00 00 00 00 00 00 00 00 00 00 00 00 00 00 00 00 00 00 00 00 00 00 00 00 00 00 00 00 00 00 00 00 00 00 00 00 00 00 00 01
E: 11.660043 51 02 00 07 00 05 05 ba 06 30 06 00 00 00 00 00 00 00 00 00 00 00 00 00 00 00 00 00 00 00 00 00 00 00 00 00 00 00 00 00 00 00 00 00 00 00 00 00 00 00 00 01
E: 11.680045 51 02 00 07 00 05 05 a7 06 35 06 00 00 00 00 00 00 00 00 00 00 00 00 00 00 00 00 00 00 00 00 00 00 00 00 00 00 00 00 00 00 00 00 00 00 00 00 00 00 00 00 01
E: 11.700040 51 02 00 07 00 05 05 94 06 3b 06 00 00 00 00 00 00 00 00 00 00 00 00 00 00 00 00 00 00 00 00 00 00 00 00 00 00 00 00 00 00 00 00 00 00 00 00 00 00 00 00 01
E: 11.720090 51 02 00 07 00 05 05 80 06 41 06 00 00 00 00 00 00 00 00 00 00 00 00 00 00 00 00 00 00 00 00 00 00 00 00 00 00 00 00 00 00 00 00 00 00 00 00 00 00 00 00 01
E: 11.740072 51 02 00 07 00 05 05 6f 06 48 06 00 00 00 00 00 00 00 00 00 00 00 00 00 00 00 00 00 00 00 00 00 00 00 00 00 00 00 00 00 00 00 00 00 00 00 00 00 00 00 00 01
E: 11.760046 51 02 00 07 00 05 05 5e 06 4e 06 00 00 00 00 00 00 00 00 00 00 00 00 00 00 00 00 00 00 00 00 00 00 00 00 00 00 00 00 00 00 00 00 00 00 00 00 00 00 00 00 01
E: 11.780074 51 02 00 07 00 05 05 4e 06 54 06 00 00 00 00 00 00 00 00 00 00 00 00 00 00 00 00 00 00 00 00 00 00 00 00 00 00 00 00 00 00 00 00 00 00 00 00 00 00 00 00 01
E: 11.800044 51 02 00 07 00 05 05 3f 06 59 06 00 00 00 00 00 00 00 00 00 00 00 00 00 00 00 00 00 00 00 00 00 00 00 00 00 00 00 00 00 00 00 00 00 00 00 00 00 00 00 00 01
E: 11.824048 51 02 00 07 00 05 05 2e 06 5e 06 07 01 05 05 5f 06 4c 01 00 00 00 00 00 00 00 00 00 00 00 00 00 00 00 00 00 00 00 00 00 00 00 00 00 00 00 00 00 00 00 00 02
E: 11.844048 51 02 00 07 00 05 05 20 06 62 06 07 01 05 05 5f 06 52 01 00 00 00 00 00 00 00 00 00 00 00 00 00 00 00 00 00 00 00 00 00 00 00 00 00 00 00 00 00 00 00 00 02
E: 11.864100 51 02 00 07 00 05 05 1b 06 64 06 07 01 05 05 60 06 64 01 00 00 00 00 00 00 00 00 00 00 00 00 00 00 00 00 00 00 00 00 00 00 00 00 00 00 00 00 00 00 00 00 02
E: 11.884044 51 02 00 07 00 05 05 16 06 66 06 07 01 05 05 63 06 72 01 00 00 00 00 00 00 00 00 00 00 00 00 00 00 00 00 00 00 00 00 00 00 00 00 00 00 00 00 00 00 00 00 02
E: 11.904073 51 02 00 07 00 05 05 11 06 68 06 07 01 05 05 68 06 7d 01 00 00 00 00 00 00 00 00 00 00 00 00 00 00 00 00 00 00 00 00 00 00 00 00 00 00 00 00 00 00 00 00 02
E: 11.924070 51 02 00 07 00 05 05 0d 06 6a 06 07 01 05 05 6b 06 81 01 00 00 00 00 00 00 00 00 00 00 00 00 00 00 00 00 00 00 00 00 00 00 00 00 00 00 00 00 00 00 00 00 02
E: 11.944052 51 02 00 07 00 05 05 0a 06 6c 06 07 01 05 05 78 06 8b 01 07 02 05 05 e8 04 49 06 00 00 00 00 00 00 00 00 00 00 00 00 00 00 00 00 00 00 00 00 00 00 00 00 03
E: 11.964079 51 02 00 07 00 05 05 0a 06 6c 06 07 01 05 05 85 06 92 01 07 02 05 05 e9 04 46 06 00 00 00 00 00 00 00 00 00 00 00 00 00 00 00 00 00 00 00 00 00 00 00 00 03
E: 11.984050 51 02 00 07 00 05 05 0a 06 6c 06 07 01 05 05 8a 06 94 01 07 02 05 05 ec 04 41 06 00 00 00 00 00 00 00 00 00 00 00 00 00 00 00 00 00 00 00 00 00 00 00 00 03
E: 12.004053 51 02 00 07 00 05 05 0a 06 6c 06 07 01 05 05 9a 06 99 01 07 02 05 05 f5 04 33 06 00 00 00 00 00 00 00 00 00 00 00 00 00 00 00 00 00 00 00 00 00 00 00 00 03
E: 12.024052 51 02 00 07 00 05 05 0a 06 6c 06 07 01 05 05 aa 06 9f 01 07 02 05 05 fd 04 27 06 00 00 00 00 00 00 00 00 00 00 00 00 00 00 00 00 00 00 00 00 00 00 00 00 03
E: 12.044054 51 02 00 07 00 05 05 0a 06 6c 06 07 01 05 05 b8 06 a3 01 07 02 05 05 04 05 1c 06 00 00 00 00 00 00 00 00 00 00 00 00 00 00 00 00 00 00 00 00 00 00 00 00 03
E: 12.064079 51 02 00 07 00 05 05 0a 06 6c 06 07 01 05 05 c6 06 a8 01 07 02 05 05 07 05 19 06 00 00 00 00 00 00 00 00 00 00 00 00 00 00 00 00 00 00 00 00 00 00 00 00 03
E: 12.084084 51 02 00 07 00 05 05 0a 06 6c 06 07 01 05 05 d3 06 ac 01 07 02 05 05 0b 05 16 06 00 00 00 00 00 00 00 00 00 00 00 00 00 00 00 00 00 00 00 00 00 00 00 00 03
E: 12.104091 51 02 00 07 00 05 05 0a 06 6c 06 07 01 05 05 d8 06 ae 01 07 02 05 05 0f 05 14 06 00 00 00 00 00 00 00 00 00 00 00 00 00 00 00 00 00 00 00 00 00 00 00 00 03
E: 12.124143 51 02 00 07 00 05 05 0c 06 6d 06 07 01 05 05 e4 06 b3 01 07 02 05 05 14 05 11 06 00 00 00 00 00 00 00 00 00 00 00 00 00 00 00 00 00 00 00 00 00 00 00 00 03
E: 12.144070 51 02 00 07 00 05 05 0c 06 6d 06 07 01 05 05 e9 06 b4 01 07 02 05 05 19 05 0e 06 00 00 00 00 00 00 00 00 00 00 00 00 00 00 00 00 00 00 00 00 00 00 00 00 03
E: 12.164085 51 02 00 07 00 05 05 0c 06 6d 06 07 01 05 05 f6 06 b9 01 07 02 05 05 24 05 08 06 00 00 00 00 00 00 00 00 00 00 00 00 00 00 00 00 00 00 00 00 00 00 00 00 03
E: 12.184057 51 02 00 07 00 05 05 0f 06 6e 06 07 01 05 05 fb 06 bb 01 07 02 05 05 27 05 06 06 00 00 00 00 00 00 00 00 00 00 00 00 00 00 00 00 00 00 00 00 00 00 00 00 03
E: 12.204056 51 02 00 07 00 05 05 13 06 6f 06 07 01 05 05 09 07 c0 01 07 02 05 05 2a 05 05 06 00 00 00 00 00 00 00 00 00 00 00 00 00 00 00 00 00 00 00 00 00 00 00 00 03
E: 12.224053 51 02 00 07 00 05 05 18 06 71 06 07 01 05 05 15 07 c6 01 07 02 05 05 2d 05 04 06 00 00 00 00 00 00 00 00 00 00 00 00 00 00 00 00 00 00 00 00 00 00 00 00 03
E: 12.244056 51 02 00 07 00 05 05 1d 06 73 06 07 01 05 05 20 07 ce 01 07 02 05 05 30 05 03 06 07 03 05 05 c8 04 85 04 00 00 00 00 00 00 00 00 00 00 00 00 00 00 00 00 04
E: 12.264062 51 02 00 07 00 05 05 22 06 75 06 07 01 05 05 2b 07 d7 01 07 02 05 05 34 05 02 06 07 03 05 05 c8 04 85 04 00 00 00 00 00 00 00 00 00 00 00 00 00 00 00 00 04
E: 12.284087 51 02 00 07 00 05 05 2e 06 79 06 07 01 05 05 35 07 e0 01 07 02 05 05 39 05 01 06 07 03 05 05 c8 04 85 04 00 00 00 00 00 00 00 00 00 00 00 00 00 00 00 00 04
E: 12.304086 51 02 00 07 00 05 05 32 06 7b 06 07 01 05 05 3e 07 ea 01 07 02 05 05 3f 05 01 06 07 03 05 05 cd 04 84 04 00 00 00 00 00 00 00 00 00 00 00 00 00 00 00 00 04
E: 12.324060 51 02 00 07 00 05 05 36 06 7d 06 07 01 05 05 46 07 f2 01 07 02 05 05 47 05 01 06 07 03 05 05 d2 04 83 04 07 04 05 05 1d 05 22 03 00 00 00 00 00 00 00 00 05
E: 12.344059 51 02 00 07 00 05 05 39 06 80 06 07 01 05 05 4d 07 ff 01 07 02 05 05 58 05 02 06 07 03 05 05 d8 04 82 04 07 04 05 05 20 05 21 03 00 00 00 00 00 00 00 00 05
E: 12.364059 51 02 00 07 00 05 05 3c 06 84 06 07 01 05 05 52 07 0c 02 07 02 05 05 66 05 05 06 07 03 05 05 e7 04 7f 04 07 04 05 05 25 05 21 03 00 00 00 00 00 00 00 00 05
E: 12.384062 51 02 00 07 00 05 05 3f 06 88 06 07 01 05 05 55 07 19 02 07 02 05 05 74 05 0b 06 07 03 05 05 ed 04 7e 04 07 04 05 05 2a 05 21 03 00 00 00 00 00 00 00 00 05
E: 12.404058 51 02 00 07 00 05 05 42 06 8c 06 07 01 05 05 55 07 1f 02 07 02 05 05 7e 05 11 06 07 03 05 05 f4 04 7d 04 07 04 05 05 2f 05 21 03 00 00 00 00 00 00 00 00 05
E: 12.424096 51 02 00 07 00 05 05 44 06 90 06 07 01 05 05 55 07 25 02 07 02 05 05 81 05 13 06 07 03 05 05 fa 04 7c 04 07 04 05 05 33 05 21 03 00 00 00 00 00 00 00 00 05
E: 12.444080 51 02 00 07 00 05 05 46 06 95 06 07 01 05 05 52 07 36 02 07 02 05 05 83 05 15 06 07 03 05 05 ff 04 7c 04 07 04 05 05 37 05 22 03 00 00 00 00 00 00 00 00 05
E: 12.464060 51 02 00 07 00 05 05 4a 06 a5 06 07 01 05 05 4e 07 46 02 07 02 05 05 85 05 17 06 07 03 05 05 02 05 7c 04 07 04 05 05 3a 05 23 03 00 00 00 00 00 00 00 00 05
E: 12.484059 51 02 00 07 00 05 05 4b 06 b5 06 07 01 05 05 49 07 54 02 07 02 05 05 85 05 17 06 07 03 05 05 05 05 7d 04 07 04 05 05 3c 05 24 03 00 00 00 00 00 00 00 00 05
E: 12.504077 51 02 00 07 00 05 05 4b 06 cb 06 07 01 05 05 41 07 62 02 07 02 05 05 86 05 1a 06 07 03 05 05 05 05 7d 04 07 04 05 05 3c 05 24 03 00 00 00 00 00 00 00 00 05
E: 12.524092 51 02 00 07 00 05 05 48 06 e6 06 07 01 05 05 37 07 70 02 07 02 05 05 86 05 1a 06 07 03 05 05 05 05 7d 04 07 04 05 05 3d 05 27 03 07 05 05 05 05 02 84 00 06
E: 12.544116 51 02 00 07 00 05 05 44 06 ff 06 07 01 05 05 2e 07 7c 02 07 02 05 05 84 05 1d 06 07 03 05 05 05 05 81 04 07 04 05 05 3d 05 2c 03 07 05 05 05 ff 01 91 00 06
E: 12.564055 51 02 00 07 00 05 05 3e 06 12 07 07 01 05 05 25 07 87 02 07 02 05 05 81 05 22 06 07 03 05 05 02 05 86 04 07 04 05 05 3c 05 32 03 07 05 05 05 f9 01 9f 00 07
E: 12.568100 51 02 00 07 06 05 05 1d 05 cb 01 00 00 00 00 00 00 00 00 00 00 00 00 00 00 00 00 00 00 00 00 00 00 00 00 00 00 00 00 00 00 00 00 00 00 00 00 00 00 00 00 00
E: 12.588067 51 02 00 07 00 05 05 37 06 25 07 07 01 05 05 1b 07 93 02 07 02 05 05 76 05 31 06 07 03 05 05 f6 04 97 04 07 04 05 05 38 05 4a 03 07 05 05 05 f2 01 ac 00 08
E: 12.592102 51 02 00 07 06 05 05 1d 05 cf 01 07 07 05 05 b0 01 b3 02 00 00 00 00 00 00 00 00 00 00 00 00 00 00 00 00 00 00 00 00 00 00 00 00 00 00 00 00 00 00 00 00 00
E: 12.608058 51 02 00 07 00 05 05 2e 06 36 07 07 01 05 05 10 07 9f 02 07 02 05 05 6c 05 41 06 07 03 05 05 eb 04 ac 04 07 04 05 05 2c 05 5f 03 07 05 05 05 eb 01 bb 00 08
E: 12.612101 51 02 00 07 06 05 05 1f 05 dd 01 07 07 05 05 ae 01 b9 02 00 00 00 00 00 00 00 00 00 00 00 00 00 00 00 00 00 00 00 00 00 00 00 00 00 00 00 00 00 00 00 00 00
E: 12.628054 51 02 00 07 00 05 05 24 06 44 07 07 01 05 05 03 07 aa 02 07 02 05 05 69 05 45 06 07 03 05 05 df 04 c4 04 07 04 05 05 20 05 80 03 07 05 05 05 e2 01 c8 00 08
E: 12.632073 51 02 00 07 06 05 05 20 05 e1 01 07 07 05 05 a9 01 c9 02 00 00 00 00 00 00 00 00 00 00 00 00 00 00 00 00 00 00 00 00 00 00 00 00 00 00 00 00 00 00 00 00 00
E: 12.652030 51 02 00 07 00 05 05 1b 06 4f 07 07 01 05 05 f7 06 b9 02 07 02 05 05 67 05 48 06 07 03 05 05 d2 04 d9 04 07 04 05 05 11 05 a4 03 07 05 05 05 d7 01 d7 00 08
E: 12.656070 51 02 00 07 06 05 05 21 05 e6 01 07 07 05 05 a2 01 d9 02 00 00 00 00 00 00 00 00 00 00 00 00 00 00 00 00 00 00 00 00 00 00 00 00 00 00 00 00 00 00 00 00 00
E: 12.672057 51 02 00 07 00 05 05 11 06 5b 07 07 01 05 05 ec 06 c7 02 07 02 05 05 65 05 4b 06 07 03 05 05 c6 04 e9 04 07 04 05 05 00 05 c3 03 07 05 05 05 cc 01 e6 00 08
E: 12.676098 51 02 00 07 06 05 05 22 05 eb 01 07 07 05 05 9b 01 ea 02 00 00 00 00 00 00 00 00 00 00 00 00 00 00 00 00 00 00 00 00 00 00 00 00 00 00 00 00 00 00 00 00 00
E: 12.692038 51 02 00 07 00 05 05 04 06 65 07 07 01 05 05 e1 06 d8 02 07 02 05 05 62 05 4e 06 07 03 05 05 ba 04 fa 04 07 04 05 05 f2 04 db 03 07 05 05 05 be 01 f1 00 09
E: 12.696103 51 02 00 07 06 05 05 23 05 f0 01 07 07 05 05 94 01 fe 02 07 08 05 05 11 02 d9 04 00 00 00 00 00 00 00 00 00 00 00 00 00 00 00 00 00 00 00 00 00 00 00 00 00
E: 12.716040 51 02 00 07 00 05 05 f7 05 6e 07 07 01 05 05 d4 06 e4 02 07 02 05 05 5a 05 58 06 07 03 05 05 ac 04 09 05 07 04 05 05 e3 04 ec 03 07 05 05 05 ae 01 fd 00 09
E: 12.720071 51 02 00 07 06 05 05 24 05 f5 01 07 07 05 05 8c 01 15 03 07 08 05 05 0f 02 df 04 00 00 00 00 00 00 00 00 00 00 00 00 00 00 00 00 00 00 00 00 00 00 00 00 00
E: 12.736033 51 02 00 07 00 05 05 ed 05 78 07 07 01 05 05 c5 06 ef 02 07 02 05 05 4e 05 64 06 07 03 05 05 9e 04 17 05 07 04 05 05 d1 04 f6 03 07 05 05 05 a0 01 0b 01 09
E: 12.740076 51 02 00 07 06 05 05 26 05 fa 01 07 07 05 05 85 01 33 03 07 08 05 05 08 02 ef 04 00 00 00 00 00 00 00 00 00 00 00 00 00 00 00 00 00 00 00 00 00 00 00 00 00
E: 12.760033 51 02 00 07 00 05 05 e8 05 7b 07 07 01 05 05 b5 06 f6 02 07 02 05 05 42 05 70 06 07 03 05 05 92 04 24 05 07 04 05 05 c1 04 01 04 07 05 05 05 92 01 17 01 09
E: 12.764072 51 02 00 07 06 05 05 28 05 ff 01 07 07 05 05 80 01 51 03 07 08 05 05 02 02 fc 04 00 00 00 00 00 00 00 00 00 00 00 00 00 00 00 00 00 00 00 00 00 00 00 00 00
E: 12.780073 51 02 00 07 00 05 05 dc 05 80 07 07 01 05 05 a3 06 fc 02 07 02 05 05 31 05 7c 06 07 03 05 05 83 04 2b 05 07 04 05 05 b0 04 0a 04 07 05 05 05 83 01 23 01 0a
E: 12.784109 51 02 00 07 06 05 05 2d 05 0b 02 07 07 05 05 7a 01 6a 03 07 08 05 05 fd 01 0a 05 07 09 05 05 bc 02 ec 05 00 00 00 00 00 00 00 00 00 00 00 00 00 00 00 00 00
E: 12.804054 51 02 00 07 00 05 05 d6 05 81 07 07 01 05 05 93 06 00 03 07 02 05 05 1e 05 88 06 07 03 05 05 73 04 31 05 07 04 05 05 a0 04 0f 04 07 05 05 05 75 01 35 01 0a
E: 12.808099 51 02 00 07 06 05 05 2f 05 10 02 07 07 05 05 73 01 8a 03 07 08 05 05 f7 01 1b 05 07 09 05 05 bb 02 f3 05 00 00 00 00 00 00 00 00 00 00 00 00 00 00 00 00 00
E: 12.824052 51 02 00 07 00 05 05 c7 05 84 07 07 01 05 05 80 06 00 03 07 02 05 05 08 05 92 06 07 03 05 05 65 04 34 05 07 04 05 05 98 04 0f 04 07 05 05 05 68 01 47 01 0a
E: 12.828086 51 02 00 07 06 05 05 34 05 1f 02 07 07 05 05 6c 01 a7 03 07 08 05 05 f0 01 2e 05 07 09 05 05 b7 02 0b 06 00 00 00 00 00 00 00 00 00 00 00 00 00 00 00 00 00
E: 12.848038 51 02 00 07 00 05 05 b9 05 89 07 07 01 05 05 79 06 01 03 07 02 05 05 f6 04 99 06 07 03 05 05 5e 04 33 05 07 04 05 05 87 04 0f 04 07 05 05 05 5d 01 5b 01 0a
E: 12.852069 51 02 00 07 06 05 05 38 05 2c 02 07 07 05 05 65 01 c5 03 07 08 05 05 e9 01 42 05 07 09 05 05 b3 02 1f 06 00 00 00 00 00 00 00 00 00 00 00 00 00 00 00 00 00
E: 12.868035 51 02 00 07 00 05 05 aa 05 8d 07 07 01 05 05 69 06 02 03 07 02 05 05 e6 04 9c 06 07 03 05 05 4d 04 33 05 07 04 05 05 78 04 0d 04 07 05 05 05 54 01 74 01 0a
E: 12.872073 51 02 00 07 06 05 05 39 05 31 02 07 07 05 05 5f 01 e5 03 07 08 05 05 e2 01 5a 05 07 09 05 05 b0 02 34 06 00 00 00 00 00 00 00 00 00 00 00 00 00 00 00 00 00
E: 12.892037 51 02 00 07 00 05 05 9b 05 92 07 07 01 05 05 62 06 02 03 07 02 05 05 d6 04 9a 06 07 03 05 05 47 04 32 05 07 04 05 05 6d 04 07 04 07 05 05 05 4a 01 91 01 0a
E: 12.896074 51 02 00 07 06 05 05 3a 05 36 02 07 07 05 05 5b 01 04 04 07 08 05 05 dd 01 74 05 07 09 05 05 ae 02 49 06 00 00 00 00 00 00 00 00 00 00 00 00 00 00 00 00 00
E: 12.912039 51 02 00 07 00 05 05 8b 05 96 07 07 01 05 05 5b 06 02 03 07 02 05 05 c8 04 97 06 07 03 05 05 39 04 2d 05 07 04 05 05 68 04 03 04 07 05 05 05 41 01 b5 01 0a
E: 12.916073 51 02 00 07 06 05 05 3a 05 3c 02 07 07 05 05 59 01 2d 04 07 08 05 05 db 01 92 05 07 09 05 05 ad 02 5d 06 00 00 00 00 00 00 00 00 00 00 00 00 00 00 00 00 00
E: 12.936037 51 02 00 07 00 05 05 78 05 97 07 07 01 05 05 4d 06 05 03 07 02 05 05 b9 04 8f 06 07 03 05 05 2c 04 27 05 07 04 05 05 5e 04 f9 03 07 05 05 05 3a 01 d7 01 0a
E: 12.940075 51 02 00 07 06 05 05 3a 05 41 02 07 07 05 05 58 01 52 04 07 08 05 05 db 01 b5 05 07 09 05 05 ad 02 6d 06 00 00 00 00 00 00 00 00 00 00 00 00 00 00 00 00 00
E: 12.956035 51 02 00 07 00 05 05 66 05 91 07 07 01 05 05 49 06 07 03 07 02 05 05 aa 04 87 06 07 03 05 05 21 04 20 05 07 04 05 05 57 04 ed 03 07 05 05 05 35 01 f0 01 0a
E: 12.960074 51 02 00 07 06 05 05 3a 05 45 02 07 07 05 05 58 01 72 04 07 08 05 05 de 01 d9 05 07 09 05 05 af 02 7e 06 00 00 00 00 00 00 00 00 00 00 00 00 00 00 00 00 00
E: 12.980036 51 02 00 07 00 05 05 54 05 80 07 07 01 05 05 45 06 09 03 07 02 05 05 9e 04 7f 06 07 03 05 05 1d 04 1c 05 07 04 05 05 55 04 e8 03 07 05 05 05 31 01 0e 02 0a
E: 12.984073 51 02 00 07 06 05 05 3a 05 45 02 07 07 05 05 59 01 8c 04 07 08 05 05 e3 01 fd 05 07 09 05 05 b2 02 8c 06 00 00 00 00 00 00 00 00 00 00 00 00 00 00 00 00 00
E: 13.000036 51 02 00 07 00 05 05 46 05 6d 07 07 01 05 05 3f 06 14 03 07 02 05 05 9a 04 7b 06 07 03 05 05 19 04 18 05 07 04 05 05 54 04 e4 03 07 05 05 05 2f 01 28 02 0a
E: 13.004075 51 02 00 07 06 05 05 3a 05 45 02 07 07 05 05 5b 01 9f 04 07 08 05 05 e9 01 17 06 07 09 05 05 b8 02 96 06 00 00 00 00 00 00 00 00 00 00 00 00 00 00 00 00 00
E: 13.024050 51 02 00 07 00 05 05 39 05 58 07 07 01 05 05 3b 06 27 03 07 02 05 05 94 04 6f 06 07 03 05 05 16 04 13 05 07 04 05 05 55 04 de 03 07 05 05 05 2e 01 40 02 0a
E: 13.028076 51 02 00 07 06 05 05 3a 05 45 02 07 07 05 05 5e 01 b3 04 07 08 05 05 f0 01 31 06 07 09 05 05 c5 02 a0 06 00 00 00 00 00 00 00 00 00 00 00 00 00 00 00 00 00
E: 13.044037 51 02 00 07 00 05 05 2c 05 3f 07 07 01 05 05 38 06 39 03 07 02 05 05 8f 04 5f 06 07 03 05 05 14 04 0c 05 07 04 05 05 5b 04 d1 03 07 05 05 05 2e 01 5f 02 0a
E: 13.048075 51 02 00 07 06 05 05 37 05 43 02 07 07 05 05 64 01 c6 04 07 08 05 05 f8 01 48 06 07 09 05 05 d5 02 a4 06 00 00 00 00 00 00 00 00 00 00 00 00 00 00 00 00 00
E: 13.068039 51 02 00 07 00 05 05 21 05 27 07 07 01 05 05 37 06 40 03 07 02 05 05 8c 04 49 06 07 03 05 05 13 04 fc 04 07 04 05 05 65 04 c4 03 07 05 05 05 2f 01 76 02 0a
E: 13.072088 51 02 00 07 06 05 05 34 05 40 02 07 07 05 05 6b 01 d7 04 07 08 05 05 01 02 58 06 07 09 05 05 e9 02 a1 06 00 00 00 00 00 00 00 00 00 00 00 00 00 00 00 00 00
E: 13.088048 51 02 00 07 00 05 05 19 05 14 07 07 01 05 05 37 06 51 03 07 02 05 05 89 04 38 06 07 03 05 05 16 04 ea 04 07 04 05 05 72 04 b7 03 07 05 05 05 33 01 91 02 0a
E: 13.092076 51 02 00 07 06 05 05 30 05 3d 02 07 07 05 05 73 01 e5 04 07 08 05 05 0a 02 63 06 07 09 05 05 fe 02 99 06 00 00 00 00 00 00 00 00 00 00 00 00 00 00 00 00 00
E: 13.112037 51 02 00 07 00 05 05 13 05 02 07 07 01 05 05 38 06 61 03 07 02 05 05 85 04 2a 06 07 03 05 05 1b 04 d5 04 07 04 05 05 7f 04 a4 03 07 05 05 05 3c 01 b3 02 0a
E: 13.116076 51 02 00 07 06 05 05 27 05 34 02 07 07 05 05 80 01 f6 04 07 08 05 05 18 02 6b 06 07 09 05 05 17 03 8a 06 00 00 00 00 00 00 00 00 00 00 00 00 00 00 00 00 00
E: 13.136066 51 02 00 07 00 05 05 10 05 ef 06 07 01 05 05 3c 06 72 03 07 02 05 05 82 04 19 06 07 03 05 05 22 04 c1 04 07 04 05 05 8b 04 93 03 07 05 05 05 45 01 d3 02 0a
E: 13.140077 51 02 00 07 06 05 05 1e 05 28 02 07 07 05 05 90 01 09 05 07 08 05 05 2a 02 70 06 07 09 05 05 30 03 78 06 00 00 00 00 00 00 00 00 00 00 00 00 00 00 00 00 00
E: 13.156051 51 02 00 07 00 05 05 0f 05 de 06 07 01 05 05 3e 06 80 03 07 02 05 05 81 04 12 06 07 03 05 05 29 04 b3 04 07 04 05 05 99 04 85 03 07 05 05 05 4a 01 f1 02 0a
E: 13.160097 51 02 00 07 06 05 05 11 05 18 02 07 07 05 05 9c 01 16 05 07 08 05 05 3f 02 70 06 07 09 05 05 47 03 5a 06 00 00 00 00 00 00 00 00 00 00 00 00 00 00 00 00 00
E: 13.180052 51 02 00 07 00 05 05 0f 05 d7 06 07 01 05 05 3f 06 84 03 07 02 05 05 83 04 ff 05 07 03 05 05 30 04 a3 04 07 04 05 05 a6 04 77 03 07 05 05 05 4e 01 08 03 0a
E: 13.184078 51 02 00 07 06 05 05 03 05 05 02 07 07 05 05 a0 01 19 05 07 08 05 05 52 02 6b 06 07 09 05 05 5e 03 39 06 00 00 00 00 00 00 00 00 00 00 00 00 00 00 00 00 00
E: 13.204081 51 02 00 07 00 05 05 10 05 d0 06 07 01 05 05 40 06 88 03 07 02 05 05 85 04 ee 05 07 03 05 05 38 04 90 04 07 04 05 05 b3 04 64 03 07 05 05 05 51 01 19 03 0a
E: 13.208077 51 02 00 07 06 05 05 f0 04 eb 01 07 07 05 05 a4 01 1a 05 07 08 05 05 65 02 5c 06 07 09 05 05 72 03 0c 06 00 00 00 00 00 00 00 00 00 00 00 00 00 00 00 00 00
E: 13.224057 51 02 00 07 00 05 05 11 05 ca 06 07 01 05 05 42 06 8d 03 07 02 05 05 8a 04 e1 05 07 03 05 05 42 04 7d 04 07 04 05 05 c5 04 4c 03 07 05 05 05 52 01 1e 03 0a
E: 13.228107 51 02 00 07 06 05 05 d9 04 d0 01 07 07 05 05 aa 01 19 05 07 08 05 05 73 02 46 06 07 09 05 05 83 03 d8 05 00 00 00 00 00 00 00 00 00 00 00 00 00 00 00 00 00
E: 13.248039 51 02 00 07 00 05 05 19 05 bf 06 07 01 05 05 44 06 91 03 07 02 05 05 91 04 d4 05 07 03 05 05 4e 04 6c 04 07 04 05 05 d5 04 3c 03 07 05 05 05 52 01 22 03 0a
E: 13.252076 51 02 00 07 06 05 05 c0 04 b4 01 07 07 05 05 b9 01 12 05 07 08 05 05 7d 02 30 06 07 09 05 05 90 03 a6 05 00 00 00 00 00 00 00 00 00 00 00 00 00 00 00 00 00
E: 13.272039 51 02 00 07 00 05 05 25 05 b9 06 07 01 05 05 45 06 95 03 07 02 05 05 9d 04 c0 05 07 03 05 05 58 04 5f 04 07 04 05 05 e2 04 2d 03 07 05 05 05 52 01 22 03 0a
E: 13.276078 51 02 00 07 06 05 05 a4 04 9f 01 07 07 05 05 c4 01 07 05 07 08 05 05 82 02 13 06 07 09 05 05 96 03 70 05 00 00 00 00 00 00 00 00 00 00 00 00 00 00 00 00 00
E: 13.292068 51 02 00 07 00 05 05 33 05 b6 06 07 01 05 05 45 06 95 03 07 02 05 05 aa 04 ad 05 07 03 05 05 65 04 4f 04 07 04 05 05 f3 04 23 03 07 05 05 05 52 01 22 03 0a
E: 13.296109 51 02 00 07 06 05 05 89 04 90 01 07 07 05 05 cb 01 fa 04 07 08 05 05 82 02 f6 05 07 09 05 05 96 03 39 05 00 00 00 00 00 00 00 00 00 00 00 00 00 00 00 00 00
E: 13.316072 51 02 00 07 00 05 05 47 05 b8 06 07 01 05 05 45 06 95 03 07 02 05 05 b9 04 9f 05 07 03 05 05 74 04 41 04 07 04 05 05 02 05 15 03 07 05 05 05 52 01 22 03 0a
E: 13.320076 51 02 00 07 06 05 05 6e 04 88 01 07 07 05 05 ce 01 eb 04 07 08 05 05 7f 02 db 05 07 09 05 05 93 03 0f 05 00 00 00 00 00 00 00 00 00 00 00 00 00 00 00 00 00
E: 13.340037 51 02 00 07 00 05 05 59 05 bb 06 07 01 05 05 45 06 95 03 07 02 05 05 ca 04 96 05 07 03 05 05 80 04 36 04 07 04 05 05 0e 05 09 03 07 05 05 05 52 01 22 03 0a
E: 13.344078 51 02 00 07 06 05 05 59 04 85 01 07 07 05 05 d0 01 d6 04 07 08 05 05 7a 02 c3 05 07 09 05 05 8e 03 eb 04 00 00 00 00 00 00 00 00 00 00 00 00 00 00 00 00 00
E: 13.360069 51 02 00 07 00 05 05 6b 05 c0 06 07 01 05 05 45 06 95 03 07 02 05 05 dc 04 92 05 07 03 05 05 84 04 33 04 07 04 05 05 17 05 00 03 07 05 05 05 52 01 22 03 0a
E: 13.364076 51 02 00 07 06 05 05 4a 04 88 01 07 07 05 05 d0 01 c2 04 07 08 05 05 74 02 ae 05 07 09 05 05 89 03 ce 04 00 00 00 00 00 00 00 00 00 00 00 00 00 00 00 00 00
E: 13.384043 51 02 00 07 00 05 05 7b 05 c7 06 07 01 05 05 45 06 95 03 07 02 05 05 ed 04 92 05 07 03 05 05 8a 04 32 04 07 04 05 05 1a 05 fd 02 07 05 05 05 4d 01 14 03 0a
E: 13.388077 51 02 00 07 06 05 05 39 04 92 01 07 07 05 05 cf 01 af 04 07 08 05 05 6d 02 9b 05 07 09 05 05 84 03 b9 04 00 00 00 00 00 00 00 00 00 00 00 00 00 00 00 00 00
E: 13.404064 51 02 00 07 00 05 05 8d 05 da 06 07 01 05 05 44 06 91 03 07 02 05 05 fc 04 96 05 07 03 05 05 99 04 36 04 07 04 05 05 1c 05 fb 02 07 05 05 05 42 01 f4 02 0a
E: 13.408077 51 02 00 07 06 05 05 2d 04 a3 01 07 07 05 05 cc 01 92 04 07 08 05 05 64 02 87 05 07 09 05 05 7b 03 a9 04 00 00 00 00 00 00 00 00 00 00 00 00 00 00 00 00 00
E: 13.428049 51 02 00 07 00 05 05 9c 05 e4 06 07 01 05 05 43 06 8b 03 07 02 05 05 09 05 9b 05 07 03 05 05 9e 04 38 04 07 04 05 05 1c 05 fb 02 07 05 05 05 42 01 f4 02 0a
E: 13.432102 51 02 00 07 06 05 05 24 04 b0 01 07 07 05 05 c5 01 73 04 07 08 05 05 5b 02 72 05 07 09 05 05 6f 03 a0 04 00 00 00 00 00 00 00 00 00 00 00 00 00 00 00 00 00
E: 13.448039 51 02 00 07 00 05 05 a9 05 ea 06 07 01 05 05 42 06 85 03 07 02 05 05 0e 05 9d 05 07 03 05 05 a8 04 3f 04 07 04 05 05 1c 05 fb 02 07 05 05 05 2e 01 b8 02 0a
E: 13.452074 51 02 00 07 06 05 05 17 04 c7 01 07 07 05 05 bc 01 53 04 07 08 05 05 4c 02 5c 05 07 09 05 05 60 03 9a 04 00 00 00 00 00 00 00 00 00 00 00 00 00 00 00 00 00
E: 13.472038 51 02 00 07 00 05 05 b6 05 ee 06 07 01 05 05 41 06 70 03 07 02 05 05 1c 05 a4 05 07 03 05 05 b0 04 48 04 07 04 05 05 1c 05 fb 02 07 05 05 05 1f 01 86 02 0a
E: 13.476080 51 02 00 07 06 05 05 f8 03 ed 01 07 07 05 05 b0 01 2f 04 07 08 05 05 33 02 3f 05 07 09 05 05 43 03 98 04 00 00 00 00 00 00 00 00 00 00 00 00 00 00 00 00 00
E: 13.492040 51 02 00 07 00 05 05 bc 05 ee 06 07 01 05 05 40 06 5d 03 07 02 05 05 29 05 ac 05 07 03 05 05 b3 04 4c 04 07 04 05 05 1c 05 fe 02 07 05 05 05 16 01 58 02 0a
E: 13.496078 51 02 00 07 06 05 05 d8 03 17 02 07 07 05 05 9d 01 04 04 07 08 05 05 14 02 1a 05 07 09 05 05 1e 03 98 04 00 00 00 00 00 00 00 00 00 00 00 00 00 00 00 00 00
E: 13.516068 51 02 00 07 00 05 05 ca 05 f0 06 07 01 05 05 3d 06 4b 03 07 02 05 05 36 05 b9 05 07 03 05 05 bd 04 5b 04 07 04 05 05 1a 05 0f 03 07 05 05 05 0e 01 29 02 0a
E: 13.520106 51 02 00 07 06 05 05 bc 03 38 02 07 07 05 05 8d 01 e0 03 07 08 05 05 f7 01 f9 04 07 09 05 05 fb 02 98 04 00 00 00 00 00 00 00 00 00 00 00 00 00 00 00 00 00
E: 13.536042 51 02 00 07 00 05 05 cf 05 f1 06 07 01 05 05 39 06 3b 03 07 02 05 05 42 05 c5 05 07 03 05 05 c5 04 6c 04 07 04 05 05 17 05 1d 03 07 05 05 05 0c 01 03 02 0a
E: 13.540079 51 02 00 07 06 05 05 a7 03 53 02 07 07 05 05 82 01 c3 03 07 08 05 05 e1 01 d7 04 07 09 05 05 dd 02 99 04 00 00 00 00 00 00 00 00 00 00 00 00 00 00 00 00 00
E: 13.560040 51 02 00 07 00 05 05 d4 05 f1 06 07 01 05 05 35 06 2d 03 07 02 05 05 4b 05 cc 05 07 03 05 05 ca 04 79 04 07 04 05 05 15 05 21 03 07 05 05 05 0e 01 df 01 0a
E: 13.564082 51 02 00 07 06 05 05 9a 03 6e 02 07 07 05 05 79 01 a6 03 07 08 05 05 cc 01 bd 04 07 09 05 05 c3 02 9b 04 00 00 00 00 00 00 00 00 00 00 00 00 00 00 00 00 00
E: 13.580041 51 02 00 07 00 05 05 d8 05 f1 06 07 01 05 05 30 06 1f 03 07 02 05 05 4f 05 cf 05 07 03 05 05 ce 04 89 04 07 04 05 05 10 05 2e 03 07 05 05 05 13 01 c3 01 0a
E: 13.584080 51 02 00 07 06 05 05 91 03 80 02 07 07 05 05 75 01 91 03 07 08 05 05 bc 01 a2 04 07 09 05 05 aa 02 9e 04 00 00 00 00 00 00 00 00 00 00 00 00 00 00 00 00 00
E: 13.604040 51 02 00 07 00 05 05 dc 05 f1 06 07 01 05 05 28 06 0b 03 07 02 05 05 52 05 d3 05 07 03 05 05 d1 04 9c 04 07 04 05 05 03 05 45 03 07 05 05 05 22 01 a8 01 0a
E: 13.608079 51 02 00 07 06 05 05 8c 03 90 02 07 07 05 05 71 01 81 03 07 08 05 05 b1 01 82 04 07 09 05 05 94 02 9e 04 00 00 00 00 00 00 00 00 00 00 00 00 00 00 00 00 00
E: 13.624040 51 02 00 07 00 05 05 dc 05 f1 06 07 01 05 05 20 06 fa 02 07 02 05 05 59 05 e1 05 07 03 05 05 d4 04 ae 04 07 04 05 05 f4 04 58 03 07 05 05 05 31 01 8c 01 0a
E: 13.628082 51 02 00 07 06 05 05 87 03 9f 02 07 07 05 05 71 01 67 03 07 08 05 05 a6 01 63 04 07 09 05 05 80 02 99 04 00 00 00 00 00 00 00 00 00 00 00 00 00 00 00 00 00
E: 13.648039 51 02 00 07 00 05 05 df 05 f1 06 07 01 05 05 1a 06 ed 02 07 02 05 05 5c 05 ef 05 07 03 05 05 d6 04 bd 04 07 04 05 05 e5 04 68 03 07 05 05 05 43 01 75 01 0a
E: 13.652076 51 02 00 07 06 05 05 84 03 a4 02 07 07 05 05 75 01 4a 03 07 08 05 05 a2 01 3f 04 07 09 05 05 71 02 90 04 00 00 00 00 00 00 00 00 00 00 00 00 00 00 00 00 00
E: 13.668064 51 02 00 07 00 05 05 df 05 f1 06 07 01 05 05 0d 06 e0 02 07 02 05 05 5c 05 f6 05 07 03 05 05 d5 04 d1 04 07 04 05 05 d2 04 73 03 07 05 05 05 54 01 64 01 0a
E: 13.672107 51 02 00 07 06 05 05 83 03 a9 02 07 07 05 05 87 01 ab 03 07 08 05 05 a2 01 3f 04 07 09 05 05 68 02 88 04 00 00 00 00 00 00 00 00 00 00 00 00 00 00 00 00 00
E: 13.692041 51 02 00 07 00 05 05 e2 05 f2 06 07 01 05 05 fb 05 d4 02 07 02 05 05 5c 05 0a 06 07 03 05 05 d0 04 e2 04 07 04 05 05 c2 04 7d 03 07 05 05 05 65 01 54 01 0a
E: 13.696097 51 02 00 07 06 05 05 83 03 ac 02 07 07 05 05 95 01 d3 03 07 08 05 05 a2 01 3f 04 07 09 05 05 65 02 85 04 00 00 00 00 00 00 00 00 00 00 00 00 00 00 00 00 00
E: 13.712042 51 02 00 07 00 05 05 e5 05 f3 06 07 01 05 05 ec 05 c6 02 07 02 05 05 5a 05 19 06 07 03 05 05 c9 04 f2 04 07 04 05 05 b2 04 8e 03 07 05 05 05 77 01 3e 01 0a
E: 13.716080 51 02 00 07 06 05 05 86 03 b0 02 07 07 05 05 9a 01 d3 03 07 08 05 05 a2 01 3f 04 07 09 05 05 61 02 80 04 00 00 00 00 00 00 00 00 00 00 00 00 00 00 00 00 00
E: 13.736041 51 02 00 07 00 05 05 e5 05 f3 06 07 01 05 05 e0 05 b8 02 07 02 05 05 58 05 1e 06 07 03 05 05 c2 04 fe 04 07 04 05 05 a3 04 9f 03 07 05 05 05 8c 01 29 01 0a
E: 13.740078 51 02 00 07 06 05 05 92 03 bf 02 07 07 05 05 a2 01 c9 03 00 08 05 05 a2 01 3f 04 07 09 05 05 56 02 6f 04 00 00 00 00 00 00 00 00 00 00 00 00 00 00 00 00 00
E: 13.756042 51 02 00 07 00 05 05 e5 05 f3 06 07 01 05 05 d6 05 aa 02 07 02 05 05 57 05 21 06 07 03 05 05 c0 04 00 05 07 04 05 05 99 04 aa 03 07 05 05 05 9e 01 1a 01 09
E: 13.760078 51 02 00 07 06 05 05 9c 03 d2 02 07 07 05 05 aa 01 bb 03 07 09 05 05 4f 02 63 04 00 00 00 00 00 00 00 00 00 00 00 00 00 00 00 00 00 00 00 00 00 00 00 00 00
E: 13.780034 51 02 00 07 00 05 05 e5 05 f3 06 07 01 05 05 d0 05 9e 02 07 02 05 05 57 05 21 06 07 03 05 05 c0 04 00 05 07 04 05 05 96 04 ac 03 07 05 05 05 b1 01 0e 01 09
E: 13.784105 51 02 00 07 06 05 05 ac 03 e4 02 07 07 05 05 b3 01 ae 03 07 09 05 05 4d 02 60 04 00 00 00 00 00 00 00 00 00 00 00 00 00 00 00 00 00 00 00 00 00 00 00 00 00
E: 13.800066 51 02 00 07 00 05 05 e8 05 f0 06 07 01 05 05 c7 05 8f 02 07 02 05 05 57 05 21 06 07 03 05 05 be 04 fd 04 07 04 05 05 96 04 ac 03 07 05 05 05 c2 01 04 01 09
E: 13.804044 51 02 00 07 06 05 05 bc 03 fd 02 07 07 05 05 b6 01 aa 03 07 09 05 05 4d 02 60 04 00 00 00 00 00 00 00 00 00 00 00 00 00 00 00 00 00 00 00 00 00 00 00 00 00
E: 13.824106 51 02 00 07 00 05 05 ef 05 e5 06 07 01 05 05 c9 05 79 02 07 02 05 05 57 05 1c 06 07 03 05 05 bc 04 eb 04 07 04 05 05 93 04 95 03 07 05 05 05 cc 01 fc 00 0a
E: 13.828087 51 02 00 07 06 05 05 c5 03 17 03 07 07 05 05 b6 01 aa 03 07 08 05 05 b6 01 98 02 07 09 05 05 4d 02 60 04 00 00 00 00 00 00 00 00 00 00 00 00 00 00 00 00 00
E: 13.844059 51 02 00 07 00 05 05 f2 05 d2 06 07 01 05 05 cf 05 5e 02 07 02 05 05 57 05 fc 05 07 03 05 05 bc 04 c4 04 07 04 05 05 98 04 67 03 07 05 05 05 ce 01 fa 00 0a
E: 13.848107 51 02 00 07 06 05 05 cc 03 3b 03 07 07 05 05 b8 01 ac 03 07 08 05 05 b6 01 98 02 07 09 05 05 4a 02 6e 04 00 00 00 00 00 00 00 00 00 00 00 00 00 00 00 00 00
E: 13.868096 51 02 00 07 00 05 05 f2 05 af 06 07 01 05 05 d8 05 3e 02 07 02 05 05 57 05 c9 05 07 03 05 05 bd 04 8b 04 07 04 05 05 a2 04 2f 03 07 05 05 05 ce 01 fa 00 0a
E: 13.872086 51 02 00 07 06 05 05 ce 03 66 03 07 07 05 05 b8 01 ac 03 07 08 05 05 b6 01 98 02 07 09 05 05 48 02 8f 04 00 00 00 00 00 00 00 00 00 00 00 00 00 00 00 00 00
E: 13.892078 51 02 00 07 00 05 05 f1 05 8d 06 07 01 05 05 e9 05 20 02 07 02 05 05 59 05 98 05 07 03 05 05 bf 04 53 04 07 04 05 05 ad 04 fa 02 07 05 05 05 ce 01 fa 00 0a
E: 13.896114 51 02 00 07 06 05 05 cb 03 95 03 07 07 05 05 b8 01 ac 03 07 08 05 05 b6 01 98 02 07 09 05 05 45 02 ba 04 00 00 00 00 00 00 00 00 00 00 00 00 00 00 00 00 00
E: 13.912055 51 02 00 07 00 05 05 f1 05 67 06 07 01 05 05 01 06 0a 02 07 02 05 05 5b 05 6c 05 07 03 05 05 c2 04 1a 04 07 04 05 05 bc 04 bc 02 07 05 05 05 ce 01 fa 00 0a
E: 13.916081 51 02 00 07 06 05 05 c3 03 cc 03 07 07 05 05 b2 01 b8 03 07 08 05 05 b3 01 9a 02 07 09 05 05 3d 02 e2 04 00 00 00 00 00 00 00 00 00 00 00 00 00 00 00 00 00
E: 13.936071 51 02 00 07 00 05 05 f1 05 4b 06 07 01 05 05 13 06 00 02 07 02 05 05 5c 05 48 05 07 03 05 05 c3 04 eb 03 07 04 05 05 c9 04 84 02 07 05 05 05 cc 01 f5 00 0a
E: 13.940108 51 02 00 07 06 05 05 ba 03 00 04 07 07 05 05 ab 01 d8 03 07 08 05 05 b0 01 9d 02 07 09 05 05 34 02 10 05 00 00 00 00 00 00 00 00 00 00 00 00 00 00 00 00 00
E: 13.960061 51 02 00 07 00 05 05 f1 05 43 06 07 01 05 05 21 06 03 02 07 02 05 05 5c 05 2f 05 07 03 05 05 c4 04 c6 03 07 04 05 05 d5 04 57 02 07 05 05 05 c9 01 f2 00 0a
E: 13.964080 51 02 00 07 06 05 05 b2 03 32 04 07 07 05 05 a1 01 f7 03 07 08 05 05 a6 01 a7 02 07 09 05 05 2b 02 40 05 00 00 00 00 00 00 00 00 00 00 00 00 00 00 00 00 00
E: 13.980069 51 02 00 07 00 05 05 f1 05 3d 06 07 01 05 05 2d 06 18 02 07 02 05 05 5b 05 27 05 07 03 05 05 c3 04 a2 03 07 04 05 05 e0 04 27 02 07 05 05 05 c6 01 ef 00 0a
E: 13.984112 51 02 00 07 06 05 05 ad 03 66 04 07 07 05 05 94 01 1e 04 07 08 05 05 9a 01 bb 02 07 09 05 05 21 02 6d 05 00 00 00 00 00 00 00 00 00 00 00 00 00 00 00 00 00
E: 14.004044 51 02 00 07 00 05 05 f0 05 38 06 07 01 05 05 3c 06 2e 02 07 02 05 05 58 05 17 05 07 03 05 05 c2 04 89 03 07 04 05 05 eb 04 04 02 07 05 05 05 c4 01 f1 00 0a
E: 14.008083 51 02 00 07 06 05 05 a9 03 9a 04 07 07 05 05 8a 01 42 04 07 08 05 05 8e 01 d0 02 07 09 05 05 18 02 9c 05 00 00 00 00 00 00 00 00 00 00 00 00 00 00 00 00 00
E: 14.024058 51 02 00 07 00 05 05 f0 05 38 06 07 01 05 05 46 06 41 02 07 02 05 05 57 05 11 05 07 03 05 05 c0 04 79 03 07 04 05 05 f4 04 ec 01 07 05 05 05 b3 01 0d 01 0a
E: 14.027941 51 02 00 07 06 05 05 a7 03 ca 04 07 07 05 05 82 01 6b 04 07 08 05 05 82 01 ef 02 07 09 05 05 10 02 c6 05 00 00 00 00 00 00 00 00 00 00 00 00 00 00 00 00 00
E: 14.048046 51 02 00 07 00 05 05 f0 05 38 06 07 01 05 05 4d 06 57 02 07 02 05 05 55 05 0b 05 07 03 05 05 bf 04 69 03 07 04 05 05 fb 04 dc 01 07 05 05 05 a3 01 29 01 0a
E: 14.052078 51 02 00 07 06 05 05 a6 03 f4 04 07 07 05 05 7c 01 8f 04 07 08 05 05 78 01 0f 03 07 09 05 05 0c 02 f3 05 00 00 00 00 00 00 00 00 00 00 00 00 00 00 00 00 00
E: 14.072064 51 02 00 07 00 05 05 f0 05 38 06 07 01 05 05 52 06 6e 02 07 02 05 05 4f 05 fe 04 07 03 05 05 bd 04 59 03 07 04 05 05 01 05 ce 01 07 05 05 05 97 01 53 01 0a
E: 14.076120 51 02 00 07 06 05 05 ab 03 1a 05 07 07 05 05 7a 01 c0 04 07 08 05 05 71 01 3f 03 07 09 05 05 0d 02 21 06 00 00 00 00 00 00 00 00 00 00 00 00 00 00 00 00 00
E: 14.092045 51 02 00 07 00 05 05 e6 05 40 06 07 01 05 05 55 06 87 02 07 02 05 05 47 05 f4 04 07 03 05 05 bc 04 52 03 07 04 05 05 03 05 c9 01 07 05 05 05 87 01 8f 01 0a
E: 14.096084 51 02 00 07 06 05 05 b8 03 36 05 07 07 05 05 7e 01 fd 04 07 08 05 05 70 01 76 03 07 09 05 05 18 02 53 06 00 00 00 00 00 00 00 00 00 00 00 00 00 00 00 00 00
E: 14.116068 51 02 00 07 00 05 05 dc 05 4d 06 07 01 05 05 58 06 a5 02 07 02 05 05 44 05 f0 04 07 03 05 05 bb 04 4c 03 07 04 05 05 05 05 c3 01 07 05 05 05 80 01 d4 01 0a
E: 14.120089 51 02 00 07 06 05 05 cc 03 49 05 07 07 05 05 8a 01 3b 05 07 08 05 05 73 01 af 03 07 09 05 05 2a 02 86 06 00 00 00 00 00 00 00 00 00 00 00 00 00 00 00 00 00
E: 14.136043 51 02 00 07 00 05 05 d3 05 59 06 07 01 05 05 5b 06 c1 02 07 02 05 05 41 05 ec 04 07 03 05 05 ba 04 47 03 07 04 05 05 07 05 bf 01 07 05 05 05 7e 01 18 02 0a
E: 14.140086 51 02 00 07 06 05 05 e2 03 4f 05 07 07 05 05 9a 01 74 05 07 08 05 05 79 01 e9 03 07 09 05 05 44 02 b1 06 00 00 00 00 00 00 00 00 00 00 00 00 00 00 00 00 00
E: 14.160068 51 02 00 07 00 05 05 cb 05 61 06 07 01 05 05 5d 06 e0 02 07 02 05 05 3d 05 ea 04 07 03 05 05 b9 04 42 03 07 04 05 05 09 05 bc 01 07 05 05 05 84 01 5e 02 0a
E: 14.164114 51 02 00 07 06 05 05 f8 03 4b 05 07 07 05 05 b2 01 ac 05 07 08 05 05 82 01 24 04 07 09 05 05 67 02 d9 06 00 00 00 00 00 00 00 00 00 00 00 00 00 00 00 00 00
E: 14.180074 51 02 00 07 00 05 05 c8 05 64 06 07 01 05 05 61 06 01 03 07 02 05 05 39 05 e7 04 07 03 05 05 b9 04 42 03 07 04 05 05 0c 05 ba 01 07 05 05 05 8f 01 a7 02 0a
E: 14.184082 51 02 00 07 06 05 05 0b 04 3a 05 07 07 05 05 d0 01 e7 05 07 08 05 05 94 01 64 04 07 09 05 05 95 02 f7 06 00 00 00 00 00 00 00 00 00 00 00 00 00 00 00 00 00
E: 14.204074 51 02 00 07 00 05 05 c5 05 67 06 07 01 05 05 6d 06 20 03 07 02 05 05 33 05 e4 04 07 03 05 05 b9 04 3e 03 07 04 05 05 10 05 b9 01 07 05 05 05 9f 01 ee 02 0a
E: 14.208113 51 02 00 07 06 05 05 1e 04 1f 05 07 07 05 05 f3 01 19 06 07 08 05 05 aa 01 a3 04 07 09 05 05 c8 02 08 07 00 00 00 00 00 00 00 00 00 00 00 00 00 00 00 00 00
E: 14.228071 51 02 00 07 00 05 05 c1 05 6a 06 07 01 05 05 76 06 3d 03 07 02 05 05 2c 05 e4 04 07 03 05 05 b9 04 39 03 07 04 05 05 16 05 b8 01 07 05 05 05 ac 01 22 03 0a
E: 14.232110 51 02 00 07 06 05 05 2c 04 f5 04 07 07 05 05 10 02 3c 06 07 08 05 05 bf 01 d1 04 07 09 05 05 f7 02 0a 07 00 00 00 00 00 00 00 00 00 00 00 00 00 00 00 00 00
E: 14.248078 51 02 00 07 00 05 05 bd 05 6c 06 07 01 05 05 7d 06 56 03 07 02 05 05 26 05 e3 04 07 03 05 05 b9 04 35 03 07 04 05 05 26 05 b5 01 07 05 05 05 b4 01 3f 03 0a
E: 14.252082 51 02 00 07 06 05 05 32 04 c1 04 07 07 05 05 28 02 51 06 07 08 05 05 cd 01 f0 04 07 09 05 05 20 03 ff 06 00 00 00 00 00 00 00 00 00 00 00 00 00 00 00 00 00
E: 14.272048 51 02 00 07 00 05 05 ba 05 6e 06 07 01 05 05 81 06 75 03 07 02 05 05 21 05 e1 04 07 03 05 05 bb 04 33 03 07 04 05 05 2d 05 b5 01 07 05 05 05 b9 01 4b 03 0a
E: 14.276085 51 02 00 07 06 05 05 32 04 87 04 07 07 05 05 3b 02 5a 06 07 08 05 05 d7 01 00 05 07 09 05 05 42 03 e2 06 00 00 00 00 00 00 00 00 00 00 00 00 00 00 00 00 00
E: 14.292046 51 02 00 07 00 05 05 b7 05 70 06 07 01 05 05 96 06 a9 03 07 02 05 05 1d 05 df 04 07 03 05 05 bd 04 31 03 07 04 05 05 3c 05 b8 01 07 05 05 05 b9 01 4b 03 0a
E: 14.296088 51 02 00 07 06 05 05 28 04 4b 04 07 07 05 05 49 02 57 06 07 08 05 05 da 01 03 05 07 09 05 05 62 03 ba 06 00 00 00 00 00 00 00 00 00 00 00 00 00 00 00 00 00
E: 14.316060 51 02 00 07 00 05 05 b5 05 73 06 07 01 05 05 b0 06 c0 03 07 02 05 05 1d 05 df 04 07 03 05 05 bd 04 31 03 07 04 05 05 48 05 bd 01 07 05 05 05 b9 01 4b 03 0a
E: 14.320084 51 02 00 07 06 05 05 1b 04 09 04 07 07 05 05 55 02 47 06 07 08 05 05 de 01 03 05 07 09 05 05 79 03 85 06 00 00 00 00 00 00 00 00 00 00 00 00 00 00 00 00 00
E: 14.336069 51 02 00 07 00 05 05 b3 05 75 06 07 01 05 05 bf 06 d1 03 07 02 05 05 1d 05 df 04 07 03 05 05 c1 04 30 03 07 04 05 05 4d 05 bf 01 07 05 05 05 ba 01 48 03 0a
E: 14.340114 51 02 00 07 06 05 05 10 04 c6 03 07 07 05 05 61 02 31 06 07 08 05 05 ea 01 fb 04 07 09 05 05 8d 03 4c 06 00 00 00 00 00 00 00 00 00 00 00 00 00 00 00 00 00
E: 14.360047 51 02 00 07 00 05 05 b3 05 75 06 07 01 05 05 c8 06 dc 03 07 02 05 05 1d 05 df 04 07 03 05 05 c5 04 2f 03 07 04 05 05 51 05 c1 01 07 05 05 05 bc 01 42 03 0a
E: 14.364084 51 02 00 07 06 05 05 fa 03 80 03 07 07 05 05 6a 02 0f 06 07 08 05 05 f4 01 ec 04 07 09 05 05 9a 03 0e 06 00 00 00 00 00 00 00 00 00 00 00 00 00 00 00 00 00
E: 14.384047 51 02 00 07 00 05 05 b3 05 75 06 07 01 05 05 ca 06 df 03 07 02 05 05 1d 05 df 04 07 03 05 05 c8 04 30 03 07 04 05 05 54 05 c2 01 07 05 05 05 c1 01 32 03 0a
E: 14.388084 51 02 00 07 06 05 05 e3 03 40 03 07 07 05 05 70 02 e8 05 07 08 05 05 fc 01 d2 04 07 09 05 05 9f 03 cd 05 00 00 00 00 00 00 00 00 00 00 00 00 00 00 00 00 00
E: 14.408048 51 02 00 07 00 05 05 b3 05 75 06 07 01 05 05 bb 06 e2 03 07 02 05 05 1d 05 df 04 07 03 05 05 ca 04 31 03 07 04 05 05 54 05 c2 01 07 05 05 05 c4 01 1d 03 0a
E: 14.412085 51 02 00 07 06 05 05 ca 03 0a 03 07 07 05 05 6f 02 ba 05 07 08 05 05 00 02 b3 04 07 09 05 05 9a 03 91 05 00 00 00 00 00 00 00 00 00 00 00 00 00 00 00 00 00
E: 14.428046 51 02 00 07 00 05 05 b3 05 79 06 07 01 05 05 a0 06 e7 03 07 02 05 05 1d 05 df 04 07 03 05 05 cd 04 34 03 07 04 05 05 54 05 c2 01 07 05 05 05 c5 01 01 03 0a
E: 14.432086 51 02 00 07 06 05 05 b2 03 de 02 07 07 05 05 67 02 84 05 07 08 05 05 05 02 89 04 07 09 05 05 8f 03 60 05 00 00 00 00 00 00 00 00 00 00 00 00 00 00 00 00 00
E: 14.452046 51 02 00 07 00 05 05 b8 05 86 06 07 01 05 05 90 06 e8 03 07 02 05 05 1d 05 df 04 07 03 05 05 d0 04 37 03 07 04 05 05 54 05 c2 01 07 05 05 05 c6 01 df 02 0a
E: 14.456088 51 02 00 07 06 05 05 a5 03 be 02 07 07 05 05 60 02 52 05 07 08 05 05 01 02 5d 04 07 09 05 05 84 03 34 05 00 00 00 00 00 00 00 00 00 00 00 00 00 00 00 00 00
E: 14.472047 51 02 00 07 00 05 05 c2 05 95 06 07 01 05 05 8a 06 e6 03 07 02 05 05 1d 05 df 04 07 03 05 05 d2 04 3a 03 07 04 05 05 50 05 bf 01 07 05 05 05 ca 01 bd 02 0a
E: 14.475940 51 02 00 07 06 05 05 a0 03 a6 02 07 07 05 05 5c 02 24 05 07 08 05 05 01 02 33 04 07 09 05 05 7a 03 14 05 00 00 00 00 00 00 00 00 00 00 00 00 00 00 00 00 00
E: 14.496106 51 02 00 07 00 05 05 d4 05 a7 06 07 01 05 05 7a 06 d5 03 07 02 05 05 20 05 e3 04 07 03 05 05 d9 04 47 03 07 04 05 05 4b 05 bd 01 07 05 05 05 d2 01 98 02 0a
E: 14.500118 51 02 00 07 06 05 05 a0 03 92 02 07 07 05 05 5b 02 f3 04 07 08 05 05 0a 02 09 04 07 09 05 05 73 03 f8 04 00 00 00 00 00 00 00 00 00 00 00 00 00 00 00 00 00
E: 14.516076 51 02 00 07 00 05 05 d4 05 a7 06 07 01 05 05 72 06 c1 03 07 02 05 05 2e 05 ef 04 07 03 05 05 de 04 59 03 07 04 05 05 3c 05 ca 01 07 05 05 05 e2 01 76 02 0a
E: 14.520089 51 02 00 07 06 05 05 a5 03 82 02 07 07 05 05 5d 02 c7 04 07 08 05 05 11 02 e2 03 07 09 05 05 6f 03 dc 04 00 00 00 00 00 00 00 00 00 00 00 00 00 00 00 00 00
E: 14.540074 51 02 00 07 00 05 05 d4 05 a7 06 07 01 05 05 72 06 c1 03 07 02 05 05 3d 05 ff 04 07 03 05 05 e2 04 6b 03 07 04 05 05 2c 05 d8 01 07 05 05 05 f4 01 5a 02 0a
E: 14.544119 51 02 00 07 06 05 05 b3 03 72 02 07 07 05 05 64 02 9d 04 07 08 05 05 1d 02 b2 03 07 09 05 05 6f 03 c4 04 00 00 00 00 00 00 00 00 00 00 00 00 00 00 00 00 00
E: 14.560051 51 02 00 07 00 05 05 d4 05 a7 06 07 01 05 05 72 06 c1 03 07 02 05 05 4c 05 06 05 07 03 05 05 e7 04 79 03 07 04 05 05 23 05 e0 01 07 05 05 05 09 02 3d 02 0a
E: 14.564087 51 02 00 07 06 05 05 c3 03 66 02 07 07 05 05 70 02 7d 04 07 08 05 05 2b 02 8e 03 07 09 05 05 72 03 b6 04 00 00 00 00 00 00 00 00 00 00 00 00 00 00 00 00 00
E: 14.580048 51 02 00 00 00 05 05 d4 05 a7 06 07 01 05 05 72 06 c1 03 07 02 05 05 52 05 04 05 07 03 05 05 ea 04 7b 03 07 04 05 05 23 05 e0 01 07 05 05 05 1e 02 22 02 0a
E: 14.584087 51 02 00 07 06 05 05 d9 03 5c 02 07 07 05 05 7a 02 65 04 07 08 05 05 3c 02 6e 03 07 09 05 05 74 03 b1 04 00 00 00 00 00 00 00 00 00 00 00 00 00 00 00 00 00
E: 14.600075 51 02 00 00 01 05 05 72 06 c1 03 07 02 05 05 60 05 fe 04 07 03 05 05 f6 04 82 03 07 04 05 05 20 05 e2 01 07 05 05 05 38 02 10 02 07 06 05 05 d9 03 5c 02 09
E: 14.604114 51 02 00 07 07 05 05 88 02 4e 04 07 08 05 05 53 02 52 03 07 09 05 05 7b 03 a3 04 00 00 00 00 00 00 00 00 00 00 00 00 00 00 00 00 00 00 00 00 00 00 00 00 00
E: 14.624071 51 02 00 07 02 05 05 6c 05 f8 04 07 03 05 05 fb 04 84 03 07 04 05 05 1d 05 e5 01 07 05 05 05 52 02 03 02 07 06 05 05 fc 03 4d 02 07 07 05 05 9a 02 35 04 08
E: 14.628115 51 02 00 07 08 05 05 6a 02 3f 03 07 09 05 05 84 03 92 04 00 00 00 00 00 00 00 00 00 00 00 00 00 00 00 00 00 00 00 00 00 00 00 00 00 00 00 00 00 00 00 00 00
E: 14.644050 51 02 00 07 02 05 05 79 05 f1 04 07 03 05 05 07 05 88 03 07 04 05 05 1b 05 ea 01 07 05 05 05 73 02 fb 01 07 06 05 05 fc 03 4d 02 07 07 05 05 b5 02 23 04 08
E: 14.648083 51 02 00 07 08 05 05 83 02 2e 03 07 09 05 05 9a 03 7c 04 00 00 00 00 00 00 00 00 00 00 00 00 00 00 00 00 00 00 00 00 00 00 00 00 00 00 00 00 00 00 00 00 00
E: 14.664048 51 02 00 07 02 05 05 89 05 e0 04 07 03 05 05 1a 05 88 03 07 04 05 05 1f 05 f9 01 07 05 05 05 9f 02 f6 01 07 06 05 05 fc 03 4d 02 07 07 05 05 d4 02 0e 04 08
E: 14.668085 51 02 00 07 08 05 05 a8 02 17 03 07 09 05 05 9a 03 7c 04 00 00 00 00 00 00 00 00 00 00 00 00 00 00 00 00 00 00 00 00 00 00 00 00 00 00 00 00 00 00 00 00 00
E: 14.684048 51 02 00 07 02 05 05 a6 05 c3 04 07 03 05 05 38 05 7f 03 07 04 05 05 2f 05 0b 02 07 05 05 05 d6 02 ec 01 07 06 05 05 fc 03 4d 02 07 07 05 05 07 03 ee 03 08
E: 14.688083 51 02 00 07 08 05 05 dd 02 fc 02 07 09 05 05 9a 03 7c 04 00 00 00 00 00 00 00 00 00 00 00 00 00 00 00 00 00 00 00 00 00 00 00 00 00 00 00 00 00 00 00 00 00
E: 14.700051 51 02 00 07 02 05 05 a6 05 c3 04 07 03 05 05 38 05 7f 03 07 04 05 05 2f 05 0b 02 07 05 05 05 d6 02 ec 01 00 06 05 05 fc 03 4d 02 07 07 05 05 07 03 ee 03 08
E: 14.704079 51 02 00 07 08 05 05 dd 02 fc 02 07 09 05 05 9a 03 7c 04 00 00 00 00 00 00 00 00 00 00 00 00 00 00 00 00 00 00 00 00 00 00 00 00 00 00 00 00 00 00 00 00 00
E: 14.720049 51 02 00 07 02 05 05 a6 05 c3 04 07 03 05 05 38 05 7f 03 07 04 05 05 2f 05 0b 02 07 05 05 05 d6 02 ec 01 07 07 05 05 07 03 ee 03 07 08 05 05 dd 02 fc 02 07
E: 14.724080 51 02 00 00 09 05 05 9a 03 7c 04 00 00 00 00 00 00 00 00 00 00 00 00 00 00 00 00 00 00 00 00 00 00 00 00 00 00 00 00 00 00 00 00 00 00 00 00 00 00 00 00 00
E: 14.740073 51 02 00 07 02 05 05 a6 05 c3 04 07 03 05 05 38 05 7f 03 07 04 05 05 2f 05 0b 02 07 05 05 05 d6 02 ec 01 07 07 05 05 07 03 ee 03 07 08 05 05 dd 02 fc 02 06
E: 14.760067 51 02 00 00 02 05 05 a6 05 c3 04 00 03 05 05 38 05 7f 03 00 04 05 05 2f 05 0b 02 00 05 05 05 d6 02 ec 01 00 07 05 05 07 03 ee 03 00 08 05 05 dd 02 fc 02 06
# Thank you.
