R: 601 05 01 09 02 a1 01 85 01 09 01 a1 00 05 09 19 01 29 03 15 00 25 01 95 03 75 01 81 02 95 01 75 05 81 01 05 01 09 30 09 31 15 81 25 7f 75 08 95 02 81 06 c0 c0 05 0d 09 04 a1 01 85 02 09 22 09 53 95 01 75 08 81 02 a1 02 05 0d 09 42 15 00 25 01 75 01 95 01 81 02 09 32 81 02 09 47 81 02 95 05 81 03 75 08 09 51 95 01 81 02 15 00 25 20 09 48 81 02 09 49 81 02 05 01 15 00 26 d0 07 75 10 55 00 65 00 09 30 15 00 26 d0 07 35 00 45 00 81 02 09 31 45 00 81 02 c0 a1 02 05 0d 09 42 15 00 25 01 75 01 95 01 81 02 09 32 81 02 09 47 81 02 95 05 81 03 75 08 09 51 95 01 81 02 15 00 25 20 09 48 81 02 09 49 81 02 05 01 15 00 26 d0 07 75 10 55 00 65 00 09 30 15 00 26 d0 07 35 00 45 00 81 02 09 31 45 00 81 02 c0 a1 02 05 0d 09 42 15 00 25 01 75 01 95 01 81 02 09 32 81 02 09 47 81 02 95 05 81 03 75 08 09 51 95 01 81 02 15 00 25 20 09 48 81 02 09 49 81 02 05 01 15 00 26 d0 07 75 10 55 00 65 00 09 30 15 00 26 d0 07 35 00 45 00 81 02 09 31 45 00 81 02 c0 a1 02 05 0d 09 42 15 00 25 01 75 01 95 01 81 02 09 32 81 02 09 47 81 02 95 05 81 03 75 08 09 51 95 01 81 02 15 00 25 20 09 48 81 02 09 49 81 02 05 01 15 00 26 d0 07 75 10 55 00 65 00 09 30 15 00 26 d0 07 35 00 45 00 81 02 09 31 45 00 81 02 c0 a1 02 05 0d 09 42 15 00 25 01 75 01 95 01 81 02 09 32 81 02 09 47 81 02 95 05 81 03 75 08 09 51 95 01 81 02 15 00 25 20 09 48 81 02 09 49 81 02 05 01 15 00 26 d0 07 75 10 55 00 65 00 09 30 15 00 26 d0 07 35 00 45 00 81 02 09 31 45 00 81 02 c0 a1 02 05 0d 09 42 15 00 25 01 75 01 95 01 81 02 09 32 81 02 09 47 81 02 95 05 81 03 75 08 09 51 95 01 81 02 15 00 25 20 09 48 81 02 09 49 81 02 05 01 15 00 26 d0 07 75 10 55 00 65 00 09 30 15 00 26 d0 07 35 00 45 00 81 02 09 31 45 00 81 02 c0 05 0d 09 54 95 01 75 08 15 00 25 0a 81 02 09 55 b1 02 c0 09 0e a1 01 85 03 09 23 a1 02 09 52 09 53 15 00 25 0a 75 08 95 02 b1 02 c0 c0
N: Cypress Semiconductor CYTMA14-100-001A
I: 3 04b4 c001
E: 8043.456691 51 02 00 07 00 05 05 98 02 4b 03 00 00 00 00 00 00 00 00 00 00 00 00 00 00 00 00 00 00 00 00 00 00 00 00 00 00 00 00 00 00 00 00 00 00 00 00 00 00 00 00 01
E: 8043.476671 51 02 00 07 00 05 05 98 02 4b 03 00 00 00 00 00 00 00 00 00 00 00 00 00 00 00 00 00 00 00 00 00 00 00 00 00 00 00 00 00 00 00 00 00 00 00 00 00 00 00 00 01
E: 8043.496629 51 02 00 07 00 05 05 9b 02 4c 03 00 00 00 00 00 00 00 00 00 00 00 00 00 00 00 00 00 00 00 00 00 00 00 00 00 00 00 00 00 00 00 00 00 00 00 00 00 00 00 00 01
E: 8043.516708 51 02 00 07 00 05 05 a8 02 55 03 00 00 00 00 00 00 00 00 00 00 00 00 00 00 00 00 00 00 00 00 00 00 00 00 00 00 00 00 00 00 00 00 00 00 00 00 00 00 00 00 01
E: 8043.536677 51 02 00 07 00 05 05 ba 02 61 03 00 00 00 00 00 00 00 00 00 00 00 00 00 00 00 00 00 00 00 00 00 00 00 00 00 00 00 00 00 00 00 00 00 00 00 00 00 00 00 00 01
E: 8043.556503 51 02 00 07 00 05 05 cd 02 6f 03 00 00 00 00 00 00 00 00 00 00 00 00 00 00 00 00 00 00 00 00 00 00 00 00 00 00 00 00 00 00 00 00 00 00 00 00 00 00 00 00 01
E: 8043.576639 51 02 00 07 00 05 05 e5 02 82 03 00 00 00 00 00 00 00 00 00 00 00 00 00 00 00 00 00 00 00 00 00 00 00 00 00 00 00 00 00 00 00 00 00 00 00 00 00 00 00 00 01
E: 8043.596600 51 02 00 07 00 05 05 fe 02 98 03 00 00 00 00 00 00 00 00 00 00 00 00 00 00 00 00 00 00 00 00 00 00 00 00 00 00 00 00 00 00 00 00 00 00 00 00 00 00 00 00 01
E: 8043.616574 51 02 00 07 00 05 05 1a 03 ac 03 00 00 00 00 00 00 00 00 00 00 00 00 00 00 00 00 00 00 00 00 00 00 00 00 00 00 00 00 00 00 00 00 00 00 00 00 00 00 00 00 01
E: 8043.636400 51 02 00 07 00 05 05 3a 03 c4 03 00 00 00 00 00 00 00 00 00 00 00 00 00 00 00 00 00 00 00 00 00 00 00 00 00 00 00 00 00 00 00 00 00 00 00 00 00 00 00 00 01
E: 8043.656505 51 02 00 07 00 05 05 5e 03 e1 03 00 00 00 00 00 00 00 00 00 00 00 00 00 00 00 00 00 00 00 00 00 00 00 00 00 00 00 00 00 00 00 00 00 00 00 00 00 00 00 00 01
E: 8043.676331 51 02 00 07 00 05 05 81 03 fe 03 00 00 00 00 00 00 00 00 00 00 00 00 00 00 00 00 00 00 00 00 00 00 00 00 00 00 00 00 00 00 00 00 00 00 00 00 00 00 00 00 01
E: 8043.696265 51 02 00 07 00 05 05 a2 03 21 04 00 00 00 00 00 00 00 00 00 00 00 00 00 00 00 00 00 00 00 00 00 00 00 00 00 00 00 00 00 00 00 00 00 00 00 00 00 00 00 00 01
E: 8043.716409 51 02 00 07 00 05 05 c4 03 41 04 00 00 00 00 00 00 00 00 00 00 00 00 00 00 00 00 00 00 00 00 00 00 00 00 00 00 00 00 00 00 00 00 00 00 00 00 00 00 00 00 01
E: 8043.736373 51 02 00 07 00 05 05 e6 03 60 04 00 00 00 00 00 00 00 00 00 00 00 00 00 00 00 00 00 00 00 00 00 00 00 00 00 00 00 00 00 00 00 00 00 00 00 00 00 00 00 00 01
E: 8043.756166 51 02 00 07 00 05 05 fe 03 7b 04 00 00 00 00 00 00 00 00 00 00 00 00 00 00 00 00 00 00 00 00 00 00 00 00 00 00 00 00 00 00 00 00 00 00 00 00 00 00 00 00 01
E: 8043.776296 51 02 00 07 00 05 05 10 04 8c 04 00 00 00 00 00 00 00 00 00 00 00 00 00 00 00 00 00 00 00 00 00 00 00 00 00 00 00 00 00 00 00 00 00 00 00 00 00 00 00 00 01
E: 8043.796264 51 02 00 07 00 05 05 1c 04 97 04 00 00 00 00 00 00 00 00 00 00 00 00 00 00 00 00 00 00 00 00 00 00 00 00 00 00 00 00 00 00 00 00 00 00 00 00 00 00 00 00 01
E: 8043.816235 51 02 00 07 00 05 05 1f 04 9a 04 00 00 00 00 00 00 00 00 00 00 00 00 00 00 00 00 00 00 00 00 00 00 00 00 00 00 00 00 00 00 00 00 00 00 00 00 00 00 00 00 01
E: 8043.836195 51 02 00 07 00 05 05 21 04 9c 04 00 00 00 00 00 00 00 00 00 00 00 00 00 00 00 00 00 00 00 00 00 00 00 00 00 00 00 00 00 00 00 00 00 00 00 00 00 00 00 00 01
E: 8043.856130 51 02 00 07 00 05 05 23 04 9e 04 00 00 00 00 00 00 00 00 00 00 00 00 00 00 00 00 00 00 00 00 00 00 00 00 00 00 00 00 00 00 00 00 00 00 00 00 00 00 00 00 01
E: 8043.876124 51 02 00 07 00 05 05 23 04 9e 04 00 00 00 00 00 00 00 00 00 00 00 00 00 00 00 00 00 00 00 00 00 00 00 00 00 00 00 00 00 00 00 00 00 00 00 00 00 00 00 00 01
E: 8043.896090 51 02 00 07 00 05 05 23 04 9e 04 00 00 00 00 00 00 00 00 00 00 00 00 00 00 00 00 00 00 00 00 00 00 00 00 00 00 00 00 00 00 00 00 00 00 00 00 00 00 00 00 01
E: 8043.915884 51 02 00 07 00 05 05 23 04 9e 04 00 00 00 00 00 00 00 00 00 00 00 00 00 00 00 00 00 00 00 00 00 00 00 00 00 00 00 00 00 00 00 00 00 00 00 00 00 00 00 00 01
E: 8043.935984 51 02 00 07 00 05 05 23 04 9e 04 00 00 00 00 00 00 00 00 00 00 00 00 00 00 00 00 00 00 00 00 00 00 00 00 00 00 00 00 00 00 00 00 00 00 00 00 00 00 00 00 01
E: 8043.955816 51 02 00 00 00 05 05 23 04 9e 04 00 00 00 00 00 00 00 00 00 00 00 00 00 00 00 00 00 00 00 00 00 00 00 00 00 00 00 00 00 00 00 00 00 00 00 00 00 00 00 00 01
E: 8045.593013 51 02 00 07 00 05 05 59 02 af 03 00 00 00 00 00 00 00 00 00 00 00 00 00 00 00 00 00 00 00 00 00 00 00 00 00 00 00 00 00 00 00 00 00 00 00 00 00 00 00 00 01
E: 8045.612920 51 02 00 07 00 05 05 59 02 af 03 00 00 00 00 00 00 00 00 00 00 00 00 00 00 00 00 00 00 00 00 00 00 00 00 00 00 00 00 00 00 00 00 00 00 00 00 00 00 00 00 01
E: 8045.632926 51 02 00 07 00 05 05 59 02 af 03 00 00 00 00 00 00 00 00 00 00 00 00 00 00 00 00 00 00 00 00 00 00 00 00 00 00 00 00 00 00 00 00 00 00 00 00 00 00 00 00 01
E: 8045.652892 51 02 00 07 00 05 05 59 02 af 03 00 00 00 00 00 00 00 00 00 00 00 00 00 00 00 00 00 00 00 00 00 00 00 00 00 00 00 00 00 00 00 00 00 00 00 00 00 00 00 00 01
E: 8045.672858 51 02 00 07 00 05 05 59 02 af 03 00 00 00 00 00 00 00 00 00 00 00 00 00 00 00 00 00 00 00 00 00 00 00 00 00 00 00 00 00 00 00 00 00 00 00 00 00 00 00 00 01
E: 8045.692998 51 02 00 07 00 05 05 5b 02 b1 03 00 00 00 00 00 00 00 00 00 00 00 00 00 00 00 00 00 00 00 00 00 00 00 00 00 00 00 00 00 00 00 00 00 00 00 00 00 00 00 00 01
E: 8045.712967 51 02 00 07 00 05 05 5e 02 b4 03 00 00 00 00 00 00 00 00 00 00 00 00 00 00 00 00 00 00 00 00 00 00 00 00 00 00 00 00 00 00 00 00 00 00 00 00 00 00 00 00 01
E: 8045.732951 51 02 00 07 00 05 05 66 02 bd 03 00 00 00 00 00 00 00 00 00 00 00 00 00 00 00 00 00 00 00 00 00 00 00 00 00 00 00 00 00 00 00 00 00 00 00 00 00 00 00 00 01
E: 8045.752723 51 02 00 07 00 05 05 6a 02 c0 03 00 00 00 00 00 00 00 00 00 00 00 00 00 00 00 00 00 00 00 00 00 00 00 00 00 00 00 00 00 00 00 00 00 00 00 00 00 00 00 00 01
E: 8045.772859 51 02 00 07 00 05 05 74 02 c7 03 00 00 00 00 00 00 00 00 00 00 00 00 00 00 00 00 00 00 00 00 00 00 00 00 00 00 00 00 00 00 00 00 00 00 00 00 00 00 00 00 01
E: 8045.792686 51 02 00 07 00 05 05 7d 02 ce 03 00 00 00 00 00 00 00 00 00 00 00 00 00 00 00 00 00 00 00 00 00 00 00 00 00 00 00 00 00 00 00 00 00 00 00 00 00 00 00 00 01
E: 8045.812615 51 02 00 07 00 05 05 82 02 d1 03 00 00 00 00 00 00 00 00 00 00 00 00 00 00 00 00 00 00 00 00 00 00 00 00 00 00 00 00 00 00 00 00 00 00 00 00 00 00 00 00 01
E: 8045.832580 51 02 00 07 00 05 05 8f 02 d9 03 00 00 00 00 00 00 00 00 00 00 00 00 00 00 00 00 00 00 00 00 00 00 00 00 00 00 00 00 00 00 00 00 00 00 00 00 00 00 00 00 01
E: 8045.852540 51 02 00 07 00 05 05 9a 02 e0 03 00 00 00 00 00 00 00 00 00 00 00 00 00 00 00 00 00 00 00 00 00 00 00 00 00 00 00 00 00 00 00 00 00 00 00 00 00 00 00 00 01
E: 8045.872690 51 02 00 07 00 05 05 9e 02 e3 03 07 01 05 05 43 03 95 02 00 00 00 00 00 00 00 00 00 00 00 00 00 00 00 00 00 00 00 00 00 00 00 00 00 00 00 00 00 00 00 00 02
E: 8045.892478 51 02 00 07 00 05 05 a8 02 ec 03 07 01 05 05 43 03 95 02 00 00 00 00 00 00 00 00 00 00 00 00 00 00 00 00 00 00 00 00 00 00 00 00 00 00 00 00 00 00 00 00 02
E: 8045.912449 51 02 00 07 00 05 05 b3 02 f6 03 07 01 05 05 46 03 96 02 00 00 00 00 00 00 00 00 00 00 00 00 00 00 00 00 00 00 00 00 00 00 00 00 00 00 00 00 00 00 00 00 02
E: 8045.932594 51 02 00 07 00 05 05 bf 02 00 04 07 01 05 05 50 03 9e 02 00 00 00 00 00 00 00 00 00 00 00 00 00 00 00 00 00 00 00 00 00 00 00 00 00 00 00 00 00 00 00 00 02
E: 8045.952376 51 02 00 07 00 05 05 ca 02 0a 04 07 01 05 05 5c 03 aa 02 00 00 00 00 00 00 00 00 00 00 00 00 00 00 00 00 00 00 00 00 00 00 00 00 00 00 00 00 00 00 00 00 02
E: 8045.972519 51 02 00 07 00 05 05 d5 02 16 04 07 01 05 05 69 03 ba 02 00 00 00 00 00 00 00 00 00 00 00 00 00 00 00 00 00 00 00 00 00 00 00 00 00 00 00 00 00 00 00 00 02
E: 8045.992480 51 02 00 07 00 05 05 e0 02 24 04 07 01 05 05 76 03 cc 02 00 00 00 00 00 00 00 00 00 00 00 00 00 00 00 00 00 00 00 00 00 00 00 00 00 00 00 00 00 00 00 00 02
E: 8046.012445 51 02 00 07 00 05 05 ee 02 35 04 07 01 05 05 81 03 dd 02 00 00 00 00 00 00 00 00 00 00 00 00 00 00 00 00 00 00 00 00 00 00 00 00 00 00 00 00 00 00 00 00 02
E: 8046.032422 51 02 00 07 00 05 05 fb 02 44 04 07 01 05 05 8d 03 ee 02 00 00 00 00 00 00 00 00 00 00 00 00 00 00 00 00 00 00 00 00 00 00 00 00 00 00 00 00 00 00 00 00 02
E: 8046.052207 51 02 00 07 00 05 05 09 03 54 04 07 01 05 05 9a 03 fc 02 00 00 00 00 00 00 00 00 00 00 00 00 00 00 00 00 00 00 00 00 00 00 00 00 00 00 00 00 00 00 00 00 02
E: 8046.072347 51 02 00 07 00 05 05 19 03 65 04 07 01 05 05 a6 03 0c 03 00 00 00 00 00 00 00 00 00 00 00 00 00 00 00 00 00 00 00 00 00 00 00 00 00 00 00 00 00 00 00 00 02
E: 8046.092313 51 02 00 07 00 05 05 28 03 79 04 07 01 05 05 b4 03 1b 03 00 00 00 00 00 00 00 00 00 00 00 00 00 00 00 00 00 00 00 00 00 00 00 00 00 00 00 00 00 00 00 00 02
E: 8046.112279 51 02 00 07 00 05 05 38 03 8d 04 07 01 05 05 c4 03 2b 03 00 00 00 00 00 00 00 00 00 00 00 00 00 00 00 00 00 00 00 00 00 00 00 00 00 00 00 00 00 00 00 00 02
E: 8046.132101 51 02 00 07 00 05 05 48 03 9f 04 07 01 05 05 d3 03 41 03 00 00 00 00 00 00 00 00 00 00 00 00 00 00 00 00 00 00 00 00 00 00 00 00 00 00 00 00 00 00 00 00 02
E: 8046.152176 51 02 00 07 00 05 05 56 03 b4 04 07 01 05 05 e3 03 56 03 00 00 00 00 00 00 00 00 00 00 00 00 00 00 00 00 00 00 00 00 00 00 00 00 00 00 00 00 00 00 00 00 02
E: 8046.172140 51 02 00 07 00 05 05 67 03 cb 04 07 01 05 05 f5 03 67 03 00 00 00 00 00 00 00 00 00 00 00 00 00 00 00 00 00 00 00 00 00 00 00 00 00 00 00 00 00 00 00 00 02
E: 8046.191979 51 02 00 07 00 05 05 78 03 df 04 07 01 05 05 04 04 7a 03 00 00 00 00 00 00 00 00 00 00 00 00 00 00 00 00 00 00 00 00 00 00 00 00 00 00 00 00 00 00 00 00 02
E: 8046.212111 51 02 00 07 00 05 05 88 03 f3 04 07 01 05 05 14 04 8e 03 00 00 00 00 00 00 00 00 00 00 00 00 00 00 00 00 00 00 00 00 00 00 00 00 00 00 00 00 00 00 00 00 02
E: 8046.232138 51 02 00 07 00 05 05 98 03 09 05 07 01 05 05 23 04 a2 03 00 00 00 00 00 00 00 00 00 00 00 00 00 00 00 00 00 00 00 00 00 00 00 00 00 00 00 00 00 00 00 00 02
E: 8046.251861 51 02 00 07 00 05 05 a6 03 1f 05 07 01 05 05 30 04 b5 03 00 00 00 00 00 00 00 00 00 00 00 00 00 00 00 00 00 00 00 00 00 00 00 00 00 00 00 00 00 00 00 00 02
E: 8046.271825 51 02 00 07 00 05 05 b5 03 30 05 07 01 05 05 3d 04 c8 03 00 00 00 00 00 00 00 00 00 00 00 00 00 00 00 00 00 00 00 00 00 00 00 00 00 00 00 00 00 00 00 00 02
E: 8046.291966 51 02 00 07 00 05 05 c5 03 41 05 07 01 05 05 4b 04 dc 03 00 00 00 00 00 00 00 00 00 00 00 00 00 00 00 00 00 00 00 00 00 00 00 00 00 00 00 00 00 00 00 00 02
E: 8046.311895 51 02 00 07 00 05 05 d4 03 53 05 07 01 05 05 58 04 ee 03 00 00 00 00 00 00 00 00 00 00 00 00 00 00 00 00 00 00 00 00 00 00 00 00 00 00 00 00 00 00 00 00 02
E: 8046.331907 51 02 00 07 00 05 05 e3 03 68 05 07 01 05 05 65 04 fd 03 00 00 00 00 00 00 00 00 00 00 00 00 00 00 00 00 00 00 00 00 00 00 00 00 00 00 00 00 00 00 00 00 02
E: 8046.351686 51 02 00 07 00 05 05 f2 03 79 05 07 01 05 05 73 04 0b 04 00 00 00 00 00 00 00 00 00 00 00 00 00 00 00 00 00 00 00 00 00 00 00 00 00 00 00 00 00 00 00 00 02
E: 8046.371826 51 02 00 07 00 05 05 ff 03 87 05 07 01 05 05 7e 04 19 04 00 00 00 00 00 00 00 00 00 00 00 00 00 00 00 00 00 00 00 00 00 00 00 00 00 00 00 00 00 00 00 00 02
E: 8046.391618 51 02 00 07 00 05 05 0a 04 97 05 07 01 05 05 88 04 28 04 00 00 00 00 00 00 00 00 00 00 00 00 00 00 00 00 00 00 00 00 00 00 00 00 00 00 00 00 00 00 00 00 02
E: 8046.411586 51 02 00 07 00 05 05 16 04 a4 05 07 01 05 05 91 04 38 04 00 00 00 00 00 00 00 00 00 00 00 00 00 00 00 00 00 00 00 00 00 00 00 00 00 00 00 00 00 00 00 00 02
E: 8046.431549 51 02 00 07 00 05 05 23 04 b1 05 07 01 05 05 99 04 46 04 00 00 00 00 00 00 00 00 00 00 00 00 00 00 00 00 00 00 00 00 00 00 00 00 00 00 00 00 00 00 00 00 02
E: 8046.451690 51 02 00 07 00 05 05 23 04 b1 05 07 01 05 05 a2 04 51 04 00 00 00 00 00 00 00 00 00 00 00 00 00 00 00 00 00 00 00 00 00 00 00 00 00 00 00 00 00 00 00 00 02
E: 8046.471484 51 02 00 07 00 05 05 23 04 b1 05 07 01 05 05 aa 04 5b 04 00 00 00 00 00 00 00 00 00 00 00 00 00 00 00 00 00 00 00 00 00 00 00 00 00 00 00 00 00 00 00 00 02
E: 8046.491445 51 02 00 07 00 05 05 23 04 b1 05 07 01 05 05 b1 04 65 04 00 00 00 00 00 00 00 00 00 00 00 00 00 00 00 00 00 00 00 00 00 00 00 00 00 00 00 00 00 00 00 00 02
E: 8046.511411 51 02 00 00 00 05 05 23 04 b1 05 07 01 05 05 ba 04 72 04 00 00 00 00 00 00 00 00 00 00 00 00 00 00 00 00 00 00 00 00 00 00 00 00 00 00 00 00 00 00 00 00 02
E: 8046.531621 51 02 00 07 01 05 05 c5 04 80 04 00 00 00 00 00 00 00 00 00 00 00 00 00 00 00 00 00 00 00 00 00 00 00 00 00 00 00 00 00 00 00 00 00 00 00 00 00 00 00 00 01
E: 8046.551343 51 02 00 07 01 05 05 d0 04 90 04 00 00 00 00 00 00 00 00 00 00 00 00 00 00 00 00 00 00 00 00 00 00 00 00 00 00 00 00 00 00 00 00 00 00 00 00 00 00 00 00 01
E: 8046.571308 51 02 00 07 01 05 05 da 04 9d 04 00 00 00 00 00 00 00 00 00 00 00 00 00 00 00 00 00 00 00 00 00 00 00 00 00 00 00 00 00 00 00 00 00 00 00 00 00 00 00 00 01
E: 8046.591445 51 02 00 07 01 05 05 e5 04 a9 04 00 00 00 00 00 00 00 00 00 00 00 00 00 00 00 00 00 00 00 00 00 00 00 00 00 00 00 00 00 00 00 00 00 00 00 00 00 00 00 00 01
E: 8046.611411 51 02 00 07 01 05 05 f0 04 b5 04 00 00 00 00 00 00 00 00 00 00 00 00 00 00 00 00 00 00 00 00 00 00 00 00 00 00 00 00 00 00 00 00 00 00 00 00 00 00 00 00 01
E: 8046.631233 51 02 00 07 01 05 05 fb 04 c1 04 00 00 00 00 00 00 00 00 00 00 00 00 00 00 00 00 00 00 00 00 00 00 00 00 00 00 00 00 00 00 00 00 00 00 00 00 00 00 00 00 01
E: 8046.651169 51 02 00 07 01 05 05 05 05 ce 04 00 00 00 00 00 00 00 00 00 00 00 00 00 00 00 00 00 00 00 00 00 00 00 00 00 00 00 00 00 00 00 00 00 00 00 00 00 00 00 00 01
E: 8046.671274 51 02 00 07 01 05 05 0e 05 d9 04 00 00 00 00 00 00 00 00 00 00 00 00 00 00 00 00 00 00 00 00 00 00 00 00 00 00 00 00 00 00 00 00 00 00 00 00 00 00 00 00 01
E: 8046.691135 51 02 00 07 01 05 05 17 05 e3 04 00 00 00 00 00 00 00 00 00 00 00 00 00 00 00 00 00 00 00 00 00 00 00 00 00 00 00 00 00 00 00 00 00 00 00 00 00 00 00 00 01
E: 8046.711216 51 02 00 07 01 05 05 21 05 ee 04 00 00 00 00 00 00 00 00 00 00 00 00 00 00 00 00 00 00 00 00 00 00 00 00 00 00 00 00 00 00 00 00 00 00 00 00 00 00 00 00 01
E: 8046.731071 51 02 00 07 01 05 05 2c 05 f8 04 00 00 00 00 00 00 00 00 00 00 00 00 00 00 00 00 00 00 00 00 00 00 00 00 00 00 00 00 00 00 00 00 00 00 00 00 00 00 00 00 01
E: 8046.751139 51 02 00 07 01 05 05 36 05 04 05 00 00 00 00 00 00 00 00 00 00 00 00 00 00 00 00 00 00 00 00 00 00 00 00 00 00 00 00 00 00 00 00 00 00 00 00 00 00 00 00 01
E: 8046.771110 51 02 00 07 01 05 05 42 05 10 05 00 00 00 00 00 00 00 00 00 00 00 00 00 00 00 00 00 00 00 00 00 00 00 00 00 00 00 00 00 00 00 00 00 00 00 00 00 00 00 00 01
E: 8046.791063 51 02 00 07 01 05 05 4f 05 1e 05 00 00 00 00 00 00 00 00 00 00 00 00 00 00 00 00 00 00 00 00 00 00 00 00 00 00 00 00 00 00 00 00 00 00 00 00 00 00 00 00 01
E: 8046.810898 51 02 00 07 01 05 05 5c 05 2b 05 00 00 00 00 00 00 00 00 00 00 00 00 00 00 00 00 00 00 00 00 00 00 00 00 00 00 00 00 00 00 00 00 00 00 00 00 00 00 00 00 01
E: 8046.831047 51 02 00 07 01 05 05 6a 05 36 05 00 00 00 00 00 00 00 00 00 00 00 00 00 00 00 00 00 00 00 00 00 00 00 00 00 00 00 00 00 00 00 00 00 00 00 00 00 00 00 00 01
E: 8046.850825 51 02 00 07 01 05 05 79 05 41 05 00 00 00 00 00 00 00 00 00 00 00 00 00 00 00 00 00 00 00 00 00 00 00 00 00 00 00 00 00 00 00 00 00 00 00 00 00 00 00 00 01
E: 8046.870794 51 02 00 07 01 05 05 85 05 4e 05 00 00 00 00 00 00 00 00 00 00 00 00 00 00 00 00 00 00 00 00 00 00 00 00 00 00 00 00 00 00 00 00 00 00 00 00 00 00 00 00 01
E: 8046.890756 51 02 00 07 01 05 05 93 05 5d 05 00 00 00 00 00 00 00 00 00 00 00 00 00 00 00 00 00 00 00 00 00 00 00 00 00 00 00 00 00 00 00 00 00 00 00 00 00 00 00 00 01
E: 8046.910893 51 02 00 07 01 05 05 a2 05 6c 05 00 00 00 00 00 00 00 00 00 00 00 00 00 00 00 00 00 00 00 00 00 00 00 00 00 00 00 00 00 00 00 00 00 00 00 00 00 00 00 00 01
E: 8046.930937 51 02 00 07 01 05 05 b1 05 79 05 00 00 00 00 00 00 00 00 00 00 00 00 00 00 00 00 00 00 00 00 00 00 00 00 00 00 00 00 00 00 00 00 00 00 00 00 00 00 00 00 01
E: 8046.950831 51 02 00 07 01 05 05 b1 05 79 05 00 00 00 00 00 00 00 00 00 00 00 00 00 00 00 00 00 00 00 00 00 00 00 00 00 00 00 00 00 00 00 00 00 00 00 00 00 00 00 00 01
E: 8046.970653 51 02 00 07 01 05 05 b1 05 79 05 00 00 00 00 00 00 00 00 00 00 00 00 00 00 00 00 00 00 00 00 00 00 00 00 00 00 00 00 00 00 00 00 00 00 00 00 00 00 00 00 01
E: 8046.990585 51 02 00 07 01 05 05 b1 05 79 05 00 00 00 00 00 00 00 00 00 00 00 00 00 00 00 00 00 00 00 00 00 00 00 00 00 00 00 00 00 00 00 00 00 00 00 00 00 00 00 00 01
E: 8047.010551 51 02 00 00 01 05 05 b1 05 79 05 00 00 00 00 00 00 00 00 00 00 00 00 00 00 00 00 00 00 00 00 00 00 00 00 00 00 00 00 00 00 00 00 00 00 00 00 00 00 00 00 01
