R: 81 05 0d 09 04 a1 01 85 01 09 22 a1 00 09 42 15 00 25 01 75 01 95 01 81 02 09 32 81 02 09 37 81 02 25 1f 75 05 09 51 81 02 05 01 55 0e 65 11 35 00 75 10 46 d0 07 26 ff 0f 09 30 81 02 46 40 06 09 31 81 02 05 0d 75 08 85 02 09 55 25 10 b1 02 c0 c0
N: DATA MODUL easyMaxTouch
I: 3 7374 1232
# 1. Drag _one_ finger on the screen from one corner to the opposite, and release it.
E: 0.000000 6 01 07 0c 00 10 00
E: 0.012715 6 01 07 0c 00 10 00
E: 0.024053 6 01 07 0c 00 10 00
E: 0.038838 6 01 07 0c 00 10 00
E: 0.051961 6 01 07 0c 00 10 00
E: 0.066744 6 01 07 0c 00 10 00
E: 0.082119 6 01 07 0c 00 10 00
E: 0.086997 6 01 07 0c 00 10 00
E: 0.132076 6 01 07 0c 00 10 00
E: 0.134031 6 01 07 0c 00 10 00
E: 0.148378 6 01 07 0c 00 10 00
E: 0.154531 6 01 07 0c 00 10 00
E: 0.200568 6 01 07 0c 00 10 00
E: 0.202654 6 01 07 0c 00 10 00
E: 0.204643 6 01 07 0c 00 10 00
E: 0.273609 6 01 07 28 00 34 00
E: 0.286525 6 01 07 28 00 34 00
E: 0.289009 6 01 07 40 00 50 00
E: 0.307772 6 01 07 60 00 78 00
E: 0.320628 6 01 07 60 00 78 00
E: 0.322584 6 01 07 88 00 a4 00
E: 0.339128 6 01 07 b4 00 d4 00
E: 0.354241 6 01 07 b4 00 d4 00
E: 0.357054 6 01 07 e0 00 08 01
E: 0.373946 6 01 07 08 01 34 01
E: 0.386797 6 01 07 08 01 34 01
E: 0.390823 6 01 07 30 01 5c 01
E: 0.408003 6 01 07 58 01 88 01
E: 0.420226 6 01 07 58 01 88 01
E: 0.424725 6 01 07 84 01 b0 01
E: 0.441273 6 01 07 a4 01 d4 01
E: 0.454531 6 01 07 a4 01 d4 01
E: 0.456571 6 01 07 c8 01 f4 01
E: 0.473514 6 01 07 f4 01 24 02
E: 0.488017 6 01 07 f4 01 24 02
E: 0.490686 6 01 07 24 02 54 02
E: 0.509878 6 01 07 5c 02 8c 02
E: 0.522485 6 01 07 5c 02 8c 02
E: 0.524914 6 01 07 88 02 b8 02
E: 0.541944 6 01 07 b8 02 e0 02
E: 0.556928 6 01 07 b8 02 e0 02
E: 0.558975 6 01 07 e8 02 08 03
E: 0.575650 6 01 07 24 03 40 03
E: 0.590891 6 01 07 24 03 40 03
E: 0.592932 6 01 07 60 03 74 03
E: 0.609738 6 01 07 94 03 ac 03
E: 0.622579 6 01 07 94 03 ac 03
E: 0.625631 6 01 07 c4 03 d4 03
E: 0.642131 6 01 07 f4 03 fc 03
E: 0.657103 6 01 07 f4 03 fc 03
E: 0.658729 6 01 07 24 04 28 04
E: 0.676886 6 01 07 5c 04 5c 04
E: 0.691899 6 01 07 5c 04 5c 04
E: 0.693823 6 01 07 94 04 90 04
E: 0.710418 6 01 07 cc 04 c4 04
E: 0.723748 6 01 07 cc 04 c4 04
E: 0.727869 6 01 07 fc 04 ec 04
E: 0.744093 6 01 07 34 05 24 05
E: 0.757398 6 01 07 34 05 24 05
E: 0.761875 6 01 07 70 05 5c 05
E: 0.778185 6 01 07 a8 05 90 05
E: 0.791801 6 01 07 a8 05 90 05
E: 0.794387 6 01 07 e0 05 c4 05
E: 0.811739 6 01 07 1c 06 fc 05
E: 0.825640 6 01 07 1c 06 fc 05
E: 0.828191 6 01 07 54 06 2c 06
E: 0.845808 6 01 07 80 06 54 06
E: 0.858621 6 01 07 80 06 54 06
E: 0.862728 6 01 07 bc 06 88 06
E: 0.879570 6 01 07 f4 06 c0 06
E: 0.893564 6 01 07 f4 06 c0 06
E: 0.896620 6 01 07 2c 07 f4 06
E: 0.914110 6 01 07 64 07 28 07
E: 0.927266 6 01 07 64 07 28 07
E: 0.930352 6 01 07 90 07 50 07
E: 0.946948 6 01 07 cc 07 84 07
E: 0.961674 6 01 07 cc 07 84 07
E: 0.964750 6 01 07 04 08 bc 07
E: 0.981613 6 01 07 3c 08 f4 07
E: 0.995206 6 01 07 3c 08 f4 07
E: 0.998253 6 01 07 78 08 28 08
E: 1.015012 6 01 07 b0 08 5c 08
E: 1.027857 6 01 07 b0 08 5c 08
E: 1.030857 6 01 07 e8 08 94 08
E: 1.047898 6 01 07 1c 09 c8 08
E: 1.062737 6 01 07 1c 09 c8 08
E: 1.065908 6 01 07 54 09 f8 08
E: 1.083253 6 01 07 8c 09 30 09
E: 1.096225 6 01 07 8c 09 30 09
E: 1.099206 6 01 07 c4 09 64 09
E: 1.116157 6 01 07 fc 09 9c 09
E: 1.131012 6 01 07 fc 09 9c 09
E: 1.134033 6 01 07 30 0a d8 09
E: 1.150764 6 01 07 68 0a 0c 0a
E: 1.163601 6 01 07 68 0a 0c 0a
E: 1.166681 6 01 07 a0 0a 44 0a
E: 1.184130 6 01 07 dc 0a 80 0a
E: 1.197067 6 01 07 dc 0a 80 0a
E: 1.200182 6 01 07 14 0b b4 0a
E: 1.216993 6 01 07 4c 0b f0 0a
E: 1.231857 6 01 07 4c 0b f0 0a
E: 1.237423 6 01 07 80 0b 2c 0b
E: 1.251459 6 01 07 b8 0b 68 0b
E: 1.264840 6 01 07 b8 0b 68 0b
E: 1.267812 6 01 07 ec 0b a4 0b
E: 1.284574 6 01 07 24 0c e0 0b
E: 1.297397 6 01 07 24 0c e0 0b
E: 1.301771 6 01 07 54 0c 1c 0c
E: 1.318703 6 01 07 88 0c 54 0c
E: 1.331707 6 01 07 88 0c 54 0c
E: 1.334619 6 01 07 bc 0c 90 0c
E: 1.351704 6 01 07 f0 0c c4 0c
E: 1.367123 6 01 07 f0 0c c4 0c
E: 1.370052 6 01 07 14 0d f4 0c
E: 1.386765 6 01 07 3c 0d 20 0d
E: 1.399605 6 01 07 3c 0d 20 0d
E: 1.402224 6 01 07 64 0d 50 0d
E: 1.419484 6 01 07 8c 0d 80 0d
E: 1.432328 6 01 07 8c 0d 80 0d
E: 1.436707 6 01 07 b4 0d ac 0d
E: 1.453148 6 01 07 d8 0d d8 0d
E: 1.466855 6 01 07 d8 0d d8 0d
E: 1.469783 6 01 07 f4 0d fc 0d
E: 1.486865 6 01 07 10 0e 20 0e
E: 1.501355 6 01 07 10 0e 20 0e
E: 1.503950 6 01 07 30 0e 44 0e
E: 1.521881 6 01 07 50 0e 6c 0e
E: 1.535056 6 01 07 50 0e 6c 0e
E: 1.538087 6 01 07 78 0e 9c 0e
E: 1.555007 6 01 07 94 0e c0 0e
E: 1.567351 6 01 07 94 0e c0 0e
E: 1.571379 6 01 07 b4 0e e4 0e
E: 1.588808 6 01 07 d0 0e 04 0f
E: 1.601207 6 01 07 d0 0e 04 0f
E: 1.604746 6 01 07 e8 0e 20 0f
E: 1.621009 6 01 07 00 0f 3c 0f
E: 1.634661 6 01 07 00 0f 3c 0f
E: 1.638087 6 01 07 1c 0f 58 0f
E: 1.655559 6 01 07 38 0f 74 0f
E: 1.669915 6 01 07 38 0f 74 0f
E: 1.673577 6 01 07 50 0f 8c 0f
E: 1.689877 6 01 07 68 0f 9c 0f
E: 1.703561 6 01 07 68 0f 9c 0f
E: 1.707002 6 01 07 7c 0f ac 0f
E: 1.723528 6 01 07 90 0f b8 0f
E: 1.736534 6 01 07 90 0f b8 0f
E: 1.739164 6 01 07 9c 0f c0 0f
E: 1.756808 6 01 07 a4 0f c4 0f
E: 1.769222 6 01 07 a4 0f c4 0f
E: 1.785009 6 01 07 a4 0f c4 0f
E: 1.797903 6 01 07 a4 0f c4 0f
E: 1.810657 6 01 07 a4 0f c4 0f
E: 1.814504 6 01 06 a4 0f c4 0f
# 2. Land one finger,
   - land a second finger far enough from the first
   - move your two fingers
   - release the *first* finger
   - release the second finger
E: 13.621104 6 01 07 a8 03 8c 04
E: 13.625499 6 01 07 a8 03 8c 04
E: 13.640313 6 01 07 a8 03 8c 04
E: 13.651994 6 01 07 a8 03 8c 04
E: 13.704402 6 01 07 a8 03 8c 04
E: 13.718013 6 01 07 a8 03 8c 04
E: 13.730329 6 01 07 a8 03 8c 04
E: 13.743846 6 01 07 a8 03 8c 04
E: 13.758494 6 01 07 a8 03 8c 04
E: 13.770797 6 01 07 a8 03 8c 04
E: 13.786019 6 01 07 a8 03 8c 04
E: 13.798818 6 01 07 a8 03 8c 04
E: 13.814283 6 01 07 a8 03 8c 04
E: 13.826916 6 01 07 a8 03 8c 04
E: 13.841791 6 01 07 a8 03 8c 04
E: 13.852941 6 01 07 a8 03 8c 04
E: 13.870499 6 01 07 a8 03 8c 04
E: 13.885298 6 01 07 a8 03 8c 04
E: 13.888445 6 01 07 a8 03 8c 04
E: 13.904564 6 01 07 b8 03 a4 04
E: 13.919412 6 01 07 b8 03 a4 04
E: 13.922476 6 01 07 c4 03 b4 04
E: 13.939277 6 01 07 d0 03 c4 04
E: 13.951702 6 01 07 d0 03 c4 04
E: 13.954770 6 01 07 dc 03 d8 04
E: 13.972309 6 01 07 f4 03 f8 04
E: 13.987413 6 01 07 f4 03 f8 04
E: 13.990532 6 01 07 10 04 18 05
E: 14.005464 6 01 07 2c 04 38 05
E: 14.020451 6 01 07 2c 04 38 05
E: 14.023529 6 01 07 44 04 58 05
E: 14.039877 6 01 07 5c 04 70 05
E: 14.053410 6 01 07 5c 04 70 05
E: 14.056456 6 01 07 6c 04 88 05
E: 14.072764 6 01 07 80 04 9c 05
E: 14.088369 6 01 07 80 04 9c 05
E: 14.091414 6 01 07 8c 04 ac 05
E: 14.108251 6 01 07 9c 04 c0 05
E: 14.120597 6 01 07 9c 04 c0 05
E: 14.123838 6 01 07 ac 04 d0 05
E: 14.141224 6 01 07 bc 04 e0 05
E: 14.156237 6 01 07 bc 04 e0 05
E: 14.159282 6 01 07 c4 04 ec 05
E: 14.174174 6 01 07 d0 04 f8 05
E: 14.189006 6 01 07 d0 04 f8 05
E: 14.192137 6 01 07 d8 04 04 06
E: 14.208852 6 01 07 e4 04 10 06
E: 14.222185 6 01 07 e4 04 10 06
E: 14.225276 6 01 07 f0 04 1c 06
E: 14.242267 6 01 07 f8 04 28 06
E: 14.257286 6 01 07 f8 04 28 06
E: 14.260351 6 01 07 04 05 34 06
E: 14.283250 6 01 07 1c 05 54 06
E: 14.293638 6 01 07 30 05 6c 06
E: 14.307271 6 01 07 40 05 80 06
E: 14.317753 6 01 07 48 05 88 06
E: 14.320913 6 01 0f fc 07 e8 06
E: 14.325836 6 01 07 50 05 90 06
E: 14.341220 6 01 07 50 05 90 06
E: 14.344278 6 01 07 54 05 94 06
E: 14.361222 6 01 07 58 05 9c 06
E: 14.364307 6 01 0f fc 07 e8 06
E: 14.377043 6 01 07 60 05 a4 06
E: 14.391968 6 01 07 60 05 a4 06
E: 14.395177 6 01 07 68 05 b0 06
E: 14.411537 6 01 07 74 05 bc 06
E: 14.426268 6 01 07 74 05 bc 06
E: 14.429317 6 01 07 80 05 cc 06
E: 14.444274 6 01 07 8c 05 dc 06
E: 14.459133 6 01 07 8c 05 dc 06
E: 14.462131 6 01 07 9c 05 f0 06
E: 14.464968 6 01 0f 14 08 08 07
E: 14.480049 6 01 07 b4 05 0c 07
E: 14.482991 6 01 0f 1c 08 14 07
E: 14.496072 6 01 07 c8 05 24 07
E: 14.499131 6 01 0f 2c 08 28 07
E: 14.513877 6 01 07 e0 05 40 07
E: 14.516819 6 01 0f 3c 08 44 07
E: 14.529843 6 01 07 f4 05 58 07
E: 14.532829 6 01 0f 50 08 60 07
E: 14.547617 6 01 07 04 06 70 07
E: 14.550540 6 01 0f 64 08 7c 07
E: 14.564217 6 01 07 1c 06 88 07
E: 14.567089 6 01 0f 74 08 98 07
E: 14.580168 6 01 07 30 06 9c 07
E: 14.583129 6 01 0f 8c 08 b8 07
E: 14.598022 6 01 07 40 06 b4 07
E: 14.601005 6 01 0f a0 08 d8 07
E: 14.613849 6 01 07 54 06 cc 07
E: 14.616885 6 01 0f b0 08 ec 07
E: 14.631802 6 01 07 68 06 e4 07
E: 14.634631 6 01 0f c0 08 04 08
E: 14.647756 6 01 07 7c 06 fc 07
E: 14.650402 6 01 0f d4 08 1c 08
E: 14.665518 6 01 07 90 06 10 08
E: 14.668939 6 01 0f e0 08 30 08
E: 14.681895 6 01 07 9c 06 20 08
E: 14.684875 6 01 0f ec 08 40 08
E: 14.700032 6 01 07 ac 06 34 08
E: 14.703027 6 01 0f fc 08 54 08
E: 14.715979 6 01 07 bc 06 44 08
E: 14.719029 6 01 0f 08 09 68 08
E: 14.732139 6 01 07 c8 06 58 08
E: 14.735114 6 01 0f 10 09 74 08
E: 14.750115 6 01 07 d0 06 64 08
E: 14.753115 6 01 0f 1c 09 84 08
E: 14.766045 6 01 07 dc 06 74 08
E: 14.769093 6 01 0f 24 09 94 08
E: 14.783651 6 01 07 e8 06 80 08
E: 14.786400 6 01 0f 30 09 a4 08
E: 14.799429 6 01 07 f4 06 90 08
E: 14.803140 6 01 0f 38 09 b0 08
E: 14.817839 6 01 07 00 07 9c 08
E: 14.820555 6 01 0f 44 09 c0 08
E: 14.833934 6 01 07 0c 07 a8 08
E: 14.836785 6 01 0f 4c 09 d0 08
E: 14.849723 6 01 07 18 07 b8 08
E: 14.852686 6 01 0f 58 09 e0 08
E: 14.867644 6 01 07 24 07 c8 08
E: 14.871477 6 01 0f 64 09 f0 08
E: 14.884065 6 01 07 34 07 d8 08
E: 14.886908 6 01 0f 70 09 04 09
E: 14.902034 6 01 07 40 07 ec 08
E: 14.904910 6 01 0f 7c 09 14 09
E: 14.917605 6 01 07 50 07 fc 08
E: 14.920517 6 01 0f 84 09 24 09
E: 14.935985 6 01 07 60 07 10 09
E: 14.938883 6 01 0f 94 09 38 09
E: 14.951430 6 01 07 6c 07 1c 09
E: 14.954852 6 01 0f a0 09 48 09
E: 14.969942 6 01 07 78 07 28 09
E: 14.972916 6 01 0f ac 09 5c 09
E: 14.985887 6 01 07 80 07 38 09
E: 14.988515 6 01 0f b8 09 6c 09
E: 15.002059 6 01 07 8c 07 44 09
E: 15.004988 6 01 0f c4 09 7c 09
E: 15.019626 6 01 07 98 07 54 09
E: 15.022317 6 01 0f cc 09 88 09
E: 15.035860 6 01 07 a8 07 64 09
E: 15.039188 6 01 0f d8 09 98 09
E: 15.053860 6 01 07 b8 07 78 09
E: 15.056980 6 01 0f e0 09 a8 09
E: 15.069936 6 01 07 c8 07 88 09
E: 15.072383 6 01 0f ec 09 b8 09
E: 15.087745 6 01 07 d4 07 94 09
E: 15.090382 6 01 0f f8 09 c4 09
E: 15.103790 6 01 07 e0 07 a0 09
E: 15.106428 6 01 0f 00 0a d4 09
E: 15.121630 6 01 07 f0 07 b0 09
E: 15.124670 6 01 0f 0c 0a e4 09
E: 15.137792 6 01 07 fc 07 bc 09
E: 15.140756 6 01 0f 18 0a f4 09
E: 15.153814 6 01 07 08 08 c8 09
E: 15.156690 6 01 0f 24 0a 00 0a
E: 15.171505 6 01 07 14 08 d8 09
E: 15.174990 6 01 0f 30 0a 14 0a
E: 15.187614 6 01 07 20 08 e4 09
E: 15.190499 6 01 0f 3c 0a 20 0a
E: 15.205779 6 01 07 2c 08 f0 09
E: 15.208956 6 01 0f 48 0a 30 0a
E: 15.221722 6 01 07 38 08 fc 09
E: 15.224537 6 01 0f 50 0a 3c 0a
E: 15.239438 6 01 07 44 08 0c 0a
E: 15.242912 6 01 0f 5c 0a 48 0a
E: 15.255620 6 01 07 50 08 18 0a
E: 15.258458 6 01 0f 68 0a 58 0a
E: 15.271576 6 01 07 5c 08 24 0a
E: 15.274327 6 01 0f 70 0a 64 0a
E: 15.289273 6 01 07 68 08 30 0a
E: 15.292979 6 01 0f 78 0a 70 0a
E: 15.305423 6 01 07 74 08 3c 0a
E: 15.309091 6 01 0f 84 0a 7c 0a
E: 15.323212 6 01 07 80 08 48 0a
E: 15.326734 6 01 0f 90 0a 8c 0a
E: 15.339838 6 01 07 90 08 54 0a
E: 15.342367 6 01 0f 9c 0a 98 0a
E: 15.357970 6 01 07 a0 08 60 0a
E: 15.361052 6 01 0f a8 0a a8 0a
E: 15.373392 6 01 07 b8 08 70 0a
E: 15.376371 6 01 0f b4 0a b8 0a
E: 15.391866 6 01 07 dc 08 80 0a
E: 15.394507 6 01 0f c4 0a cc 0a
E: 15.407957 6 01 07 10 09 8c 0a
E: 15.410742 6 01 0f d8 0a e8 0a
E: 15.423918 6 01 0f 04 0b 1c 0b
E: 15.435875 6 01 0f 20 0b 40 0b
E: 15.449390 6 01 0f 34 0b 58 0b
E: 15.459766 6 01 06 10 09 8c 0a
E: 15.462813 6 01 0f 44 0b 68 0b
E: 15.473889 6 01 0f 48 0b 70 0b
E: 15.490297 6 01 0f 50 0b 78 0b
E: 15.508384 6 01 0f 54 0b 80 0b
E: 15.523169 6 01 0f 5c 0b 88 0b
E: 15.540070 6 01 0f 64 0b 90 0b
E: 15.558702 6 01 0f 6c 0b 9c 0b
E: 15.574303 6 01 0f 78 0b a4 0b
E: 15.590590 6 01 0f 80 0b b0 0b
E: 15.610066 6 01 0f 88 0b bc 0b
E: 15.624950 6 01 0f 90 0b c8 0b
E: 15.641912 6 01 0f 98 0b d4 0b
E: 15.658307 6 01 0f a4 0b e0 0b
E: 15.676180 6 01 0f ac 0b ec 0b
E: 15.692799 6 01 0f b4 0b f4 0b
E: 15.709800 6 01 0f c0 0b 00 0c
E: 15.726540 6 01 0f c8 0b 0c 0c
E: 15.743821 6 01 0f d0 0b 14 0c
E: 15.760782 6 01 0f d8 0b 1c 0c
E: 15.777765 6 01 0f dc 0b 24 0c
E: 15.794531 6 01 0f e4 0b 2c 0c
E: 15.811745 6 01 0f e8 0b 34 0c
E: 15.828549 6 01 0f f0 0b 38 0c
E: 15.845734 6 01 0f f4 0b 40 0c
E: 15.862848 6 01 0f f8 0b 44 0c
E: 15.879767 6 01 0f fc 0b 4c 0c
E: 15.896571 6 01 0f 00 0c 50 0c
E: 15.913682 6 01 0f 04 0c 54 0c
E: 15.928589 6 01 0f 08 0c 58 0c
E: 15.945679 6 01 0f 10 0c 60 0c
E: 15.962581 6 01 0f 14 0c 64 0c
E: 15.979423 6 01 0f 1c 0c 6c 0c
E: 15.996311 6 01 0f 20 0c 74 0c
E: 16.013613 6 01 0f 28 0c 78 0c
E: 16.030569 6 01 0f 2c 0c 80 0c
E: 16.047566 6 01 0f 34 0c 84 0c
E: 16.064350 6 01 0f 38 0c 8c 0c
E: 16.081053 6 01 0f 3c 0c 90 0c
E: 16.097903 6 01 0f 40 0c 98 0c
E: 16.115372 6 01 0f 48 0c 9c 0c
E: 16.132549 6 01 0f 4c 0c a0 0c
E: 16.149133 6 01 0f 50 0c a4 0c
E: 16.165978 6 01 0f 54 0c a8 0c
E: 16.183032 6 01 0f 54 0c b0 0c
E: 16.200264 6 01 0f 58 0c b4 0c
E: 16.215395 6 01 0f 60 0c b8 0c
E: 16.231793 6 01 0f 64 0c bc 0c
E: 16.249550 6 01 0f 68 0c c0 0c
E: 16.266296 6 01 0f 6c 0c c4 0c
E: 16.283365 6 01 0f 70 0c cc 0c
E: 16.300292 6 01 0f 78 0c d0 0c
E: 16.317263 6 01 0f 80 0c d8 0c
E: 16.334156 6 01 0f 88 0c e0 0c
E: 16.350965 6 01 0f 90 0c ec 0c
E: 16.368382 6 01 0f 98 0c f4 0c
E: 16.385383 6 01 0f a0 0c 00 0d
E: 16.402272 6 01 0f b0 0c 0c 0d
E: 16.463486 6 01 0e b0 0c 0c 0d
# 3. Finally, move your ten fingers on the screen and release them.
E: 26.075077 6 01 07 98 09 60 09
E: 26.084355 6 01 07 98 09 60 09
E: 26.100737 6 01 07 98 09 60 09
E: 26.102929 6 01 0f 50 07 78 03
E: 26.106534 6 01 17 8c 07 68 0c
E: 26.109181 6 01 1f 0c 02 24 06
E: 26.111872 6 01 27 98 03 88 03
E: 26.113507 6 01 2f 60 05 74 02
E: 26.115542 6 01 37 c0 08 0c 04
E: 26.117324 6 01 3f b4 0a d4 01
E: 26.119278 6 01 47 68 0c 4c 02
E: 26.122084 6 01 4f a0 0e 14 04
E: 26.136407 6 01 1f 0c 02 24 06
E: 26.138386 6 01 27 98 03 88 03
E: 26.153580 6 01 07 98 09 60 09
E: 26.155860 6 01 2f 60 05 74 02
E: 26.170498 6 01 07 98 09 60 09
E: 26.173748 6 01 1f 0c 02 24 06
E: 26.174730 6 01 4f a0 0e 14 04
E: 26.203966 6 01 37 c0 08 0c 04
E: 26.248716 6 01 37 c0 08 0c 04
E: 26.250722 6 01 4f a0 0e 14 04
E: 26.253589 6 01 4f a0 0e 14 04
E: 26.272148 6 01 17 74 07 60 0c
E: 26.274305 6 01 3f b4 0a d4 01
E: 26.293559 6 01 07 98 09 60 09
E: 26.296574 6 01 17 68 07 60 0c
E: 26.298586 6 01 1f 0c 02 24 06
E: 26.300687 6 01 37 a0 08 04 04
E: 26.302558 6 01 3f 90 0a d0 01
E: 26.304644 6 01 4f 7c 0e 04 04
E: 26.306876 6 01 07 84 09 48 09
E: 26.308421 6 01 17 58 07 60 0c
E: 26.310531 6 01 1f 0c 02 24 06
E: 26.312755 6 01 37 8c 08 08 04
E: 26.314835 6 01 3f 7c 0a d4 01
E: 26.316718 6 01 47 44 0c 48 02
E: 26.318753 6 01 4f 6c 0e 00 04
E: 26.321700 6 01 07 80 09 44 09
E: 26.324523 6 01 0f 34 07 64 03
E: 26.326389 6 01 17 40 07 64 0c
E: 26.330561 6 01 2f 48 05 74 02
E: 26.332561 6 01 37 78 08 0c 04
E: 26.334450 6 01 3f 64 0a d8 01
E: 26.336480 6 01 47 34 0c 48 02
E: 26.338472 6 01 4f 54 0e 00 04
E: 26.340404 6 01 07 74 09 40 09
E: 26.342236 6 01 0f 28 07 60 03
E: 26.344625 6 01 17 28 07 68 0c
E: 26.347611 6 01 27 80 03 88 03
E: 26.349817 6 01 2f 40 05 74 02
E: 26.351799 6 01 37 5c 08 14 04
E: 26.353724 6 01 3f 40 0a e0 01
E: 26.355819 6 01 47 1c 0c 4c 02
E: 26.357753 6 01 4f 38 0e 00 04
E: 26.361697 6 01 07 64 09 40 09
E: 26.363581 6 01 0f 18 07 64 03
E: 26.366762 6 01 17 fc 06 7c 0c
E: 26.368723 6 01 1f f4 01 24 06
E: 26.371802 6 01 27 74 03 88 03
E: 26.374710 6 01 07 54 09 40 09
E: 26.376414 6 01 0f 08 07 68 03
E: 26.378620 6 01 17 d8 06 8c 0c
E: 26.381543 6 01 1f e8 01 34 06
E: 26.383400 6 01 27 64 03 90 03
E: 26.385487 6 01 2f 20 05 80 02
E: 26.387763 6 01 37 f4 07 48 04
E: 26.390824 6 01 3f d4 09 10 02
E: 26.392779 6 01 07 44 09 40 09
E: 26.394650 6 01 0f f4 06 6c 03
E: 26.396516 6 01 17 bc 06 98 0c
E: 26.398505 6 01 1f d8 01 40 06
E: 26.400413 6 01 27 54 03 9c 03
E: 26.402806 6 01 2f 08 05 88 02
E: 26.405713 6 01 37 c8 07 60 04
E: 26.407841 6 01 3f ac 09 28 02
E: 26.409842 6 01 07 34 09 40 09
E: 26.411795 6 01 0f e0 06 74 03
E: 26.413676 6 01 17 a0 06 a8 0c
E: 26.415604 6 01 1f c0 01 54 06
E: 26.418117 6 01 27 3c 03 b0 03
E: 26.420142 6 01 2f f0 04 9c 02
E: 26.422126 6 01 37 a8 07 7c 04
E: 26.424918 6 01 3f 84 09 44 02
E: 26.426698 6 01 47 68 0b 88 02
E: 26.428405 6 01 4f a0 0d 1c 04
E: 26.430636 6 01 07 20 09 4c 09
E: 26.432591 6 01 0f c0 06 90 03
E: 26.435862 6 01 17 8c 06 c0 0c
E: 26.437638 6 01 1f a0 01 80 06
E: 26.439700 6 01 27 18 03 d4 03
E: 26.441885 6 01 07 04 09 58 09
E: 26.444640 6 01 0f a4 06 a8 03
E: 26.446677 6 01 17 7c 06 d8 0c
E: 26.448468 6 01 1f 88 01 a4 06
E: 26.450458 6 01 27 00 03 f8 03
E: 26.452474 6 01 2f ac 04 dc 02
E: 26.454329 6 01 37 6c 07 c8 04
E: 26.456573 6 01 3f 48 09 88 02
E: 26.458563 6 01 07 f0 08 68 09
E: 26.460160 6 01 0f 88 06 c4 03
E: 26.462336 6 01 17 70 06 e8 0c
E: 26.465373 6 01 1f 74 01 c8 06
E: 26.467312 6 01 27 e8 02 18 04
E: 26.469619 6 01 2f 94 04 00 03
E: 26.471838 6 01 37 5c 07 e0 04
E: 26.473790 6 01 3f 38 09 a4 02
E: 26.475737 6 01 07 d8 08 80 09
E: 26.477744 6 01 0f 78 06 dc 03
E: 26.480649 6 01 17 68 06 fc 0c
E: 26.482599 6 01 1f 60 01 ec 06
E: 26.484380 6 01 27 d8 02 38 04
E: 26.486378 6 01 2f 84 04 20 03
E: 26.488422 6 01 37 50 07 f8 04
E: 26.490609 6 01 3f 2c 09 bc 02
E: 26.492687 6 01 07 c4 08 9c 09
E: 26.494586 6 01 0f 64 06 00 04
E: 26.496494 6 01 17 64 06 10 0d
E: 26.498503 6 01 1f 54 01 10 07
E: 26.501087 6 01 27 c8 02 5c 04
E: 26.503116 6 01 2f 74 04 44 03
E: 26.505169 6 01 37 44 07 18 05
E: 26.507390 6 01 3f 20 09 d8 02
E: 26.509425 6 01 07 b4 08 b8 09
E: 26.511220 6 01 0f 54 06 24 04
E: 26.513017 6 01 17 60 06 20 0d
E: 26.514997 6 01 1f 48 01 38 07
E: 26.518147 6 01 27 bc 02 7c 04
E: 26.519939 6 01 2f 68 04 68 03
E: 26.522182 6 01 37 40 07 34 05
E: 26.524250 6 01 3f 18 09 f0 02
E: 26.526310 6 01 07 a8 08 d8 09
E: 26.528020 6 01 0f 4c 06 44 04
E: 26.530219 6 01 17 5c 06 38 0d
E: 26.532437 6 01 1f 40 01 54 07
E: 26.535271 6 01 27 b4 02 9c 04
E: 26.537457 6 01 2f 5c 04 88 03
E: 26.539309 6 01 37 3c 07 50 05
E: 26.541455 6 01 3f 14 09 0c 03
E: 26.543580 6 01 07 a0 08 f8 09
E: 26.545319 6 01 0f 44 06 60 04
E: 26.547309 6 01 17 5c 06 48 0d
E: 26.549376 6 01 1f 3c 01 74 07
E: 26.552508 6 01 27 b0 02 bc 04
E: 26.554668 6 01 2f 58 04 a8 03
E: 26.556659 6 01 37 38 07 70 05
E: 26.558647 6 01 3f 0c 09 2c 03
E: 26.560658 6 01 07 98 08 18 0a
E: 26.562401 6 01 0f 40 06 7c 04
E: 26.564420 6 01 17 5c 06 5c 0d
E: 26.566568 6 01 1f 38 01 90 07
E: 26.573366 6 01 27 a8 02 d4 04
E: 26.574789 6 01 2f 54 04 c0 03
E: 26.576765 6 01 37 38 07 90 05
E: 26.578813 6 01 07 94 08 34 0a
E: 26.582204 6 01 0f 3c 06 98 04
E: 26.583877 6 01 17 60 06 70 0d
E: 26.587051 6 01 1f 34 01 a8 07
E: 26.589545 6 01 27 a8 02 ec 04
E: 26.593159 6 01 07 90 08 4c 0a
E: 26.595982 6 01 0f 3c 06 ac 04
E: 26.598441 6 01 17 60 06 80 0d
E: 26.600573 6 01 1f 34 01 c0 07
E: 26.603151 6 01 27 a8 02 00 05
E: 26.605156 6 01 2f 50 04 e8 03
E: 26.606558 6 01 37 38 07 d0 05
E: 26.608475 6 01 3f 08 09 9c 03
E: 26.610568 6 01 07 8c 08 64 0a
E: 26.612227 6 01 0f 3c 06 c0 04
E: 26.614778 6 01 17 68 06 98 0d
E: 26.616760 6 01 1f 34 01 d0 07
E: 26.619251 6 01 27 a8 02 18 05
E: 26.621628 6 01 2f 50 04 00 04
E: 26.623266 6 01 37 3c 07 f0 05
E: 26.625264 6 01 3f 08 09 bc 03
E: 26.627254 6 01 07 8c 08 78 0a
E: 26.630233 6 01 0f 3c 06 d0 04
E: 26.632397 6 01 17 6c 06 ac 0d
E: 26.634497 6 01 1f 34 01 e4 07
E: 26.636494 6 01 27 a8 02 28 05
E: 26.638492 6 01 2f 50 04 10 04
E: 26.640523 6 01 37 44 07 0c 06
E: 26.642596 6 01 3f 10 09 dc 03
E: 26.644661 6 01 07 90 08 90 0a
E: 26.646327 6 01 0f 40 06 e4 04
E: 26.648322 6 01 17 78 06 c8 0d
E: 26.650349 6 01 1f 34 01 f4 07
E: 26.653379 6 01 27 a8 02 3c 05
E: 26.655332 6 01 2f 54 04 24 04
E: 26.657615 6 01 37 4c 07 28 06
E: 26.659604 6 01 3f 14 09 f8 03
E: 26.661711 6 01 47 cc 0a 00 04
E: 26.663331 6 01 4f 08 0d 78 05
E: 26.666656 6 01 07 94 08 a8 0a
E: 26.669506 6 01 0f 44 06 fc 04
E: 26.671492 6 01 17 88 06 e0 0d
E: 26.673528 6 01 1f 38 01 08 08
E: 26.675594 6 01 27 b0 02 54 05
E: 26.677589 6 01 07 98 08 c0 0a
E: 26.680530 6 01 0f 48 06 14 05
E: 26.682666 6 01 17 98 06 f4 0d
E: 26.685651 6 01 1f 3c 01 18 08
E: 26.687711 6 01 27 b4 02 68 05
E: 26.689706 6 01 2f 60 04 50 04
E: 26.691762 6 01 37 68 07 68 06
E: 26.693764 6 01 3f 30 09 38 04
E: 26.695732 6 01 07 9c 08 d4 0a
E: 26.698568 6 01 0f 54 06 2c 05
E: 26.700594 6 01 17 a4 06 04 0e
E: 26.702705 6 01 1f 40 01 2c 08
E: 26.704778 6 01 27 b8 02 80 05
E: 26.706743 6 01 2f 68 04 6c 04
E: 26.708722 6 01 37 74 07 78 06
E: 26.710754 6 01 3f 3c 09 4c 04
E: 26.713132 6 01 07 a4 08 e4 0a
E: 26.714062 6 01 0f 5c 06 44 05
E: 26.717022 6 01 17 b4 06 14 0e
E: 26.718595 6 01 1f 48 01 3c 08
E: 26.721547 6 01 27 c4 02 98 05
E: 26.723593 6 01 2f 70 04 84 04
E: 26.725568 6 01 37 80 07 8c 06
E: 26.727576 6 01 07 ac 08 f4 0a
E: 26.729069 6 01 0f 68 06 58 05
E: 26.731312 6 01 17 c0 06 1c 0e
E: 26.733295 6 01 1f 50 01 4c 08
E: 26.735422 6 01 27 d0 02 ac 05
E: 26.737521 6 01 2f 7c 04 98 04
E: 26.739470 6 01 37 8c 07 94 06
E: 26.741486 6 01 3f 58 09 6c 04
E: 26.743485 6 01 47 04 0b 70 04
E: 26.745546 6 01 07 bc 08 0c 0b
E: 26.747594 6 01 0f 78 06 6c 05
E: 26.749596 6 01 17 cc 06 24 0e
E: 26.751543 6 01 1f 58 01 58 08
E: 26.754656 6 01 27 dc 02 c0 05
E: 26.756722 6 01 2f 88 04 ac 04
E: 26.758719 6 01 37 98 07 a0 06
E: 26.760676 6 01 3f 68 09 74 04
E: 26.762668 6 01 07 cc 08 1c 0b
E: 26.764440 6 01 0f 88 06 7c 05
E: 26.766883 6 01 17 d8 06 28 0e
E: 26.768435 6 01 1f 60 01 60 08
E: 26.771479 6 01 27 e8 02 d4 05
E: 26.773612 6 01 2f 9c 04 bc 04
E: 26.775697 6 01 37 a8 07 a8 06
E: 26.777739 6 01 3f 78 09 7c 04
E: 26.779665 6 01 07 dc 08 2c 0b
E: 26.781462 6 01 0f 94 06 84 05
E: 26.784395 6 01 17 e4 06 2c 0e
E: 26.786228 6 01 1f 70 01 68 08
E: 26.788200 6 01 27 f8 02 e0 05
E: 26.790190 6 01 2f ac 04 cc 04
E: 26.792158 6 01 37 b8 07 a8 06
E: 26.794228 6 01 3f 88 09 80 04
E: 26.796508 6 01 07 ec 08 34 0b
E: 26.798437 6 01 0f a4 06 8c 05
E: 26.800477 6 01 17 f0 06 2c 0e
E: 26.802469 6 01 1f 7c 01 70 08
E: 26.805628 6 01 27 08 03 e8 05
E: 26.807724 6 01 2f bc 04 d4 04
E: 26.809746 6 01 37 c8 07 ac 06
E: 26.811730 6 01 3f 98 09 84 04
E: 26.813729 6 01 07 fc 08 3c 0b
E: 26.815669 6 01 0f b8 06 94 05
E: 26.817646 6 01 17 fc 06 2c 0e
E: 26.819700 6 01 1f 8c 01 74 08
E: 26.822716 6 01 27 18 03 ec 05
E: 26.824726 6 01 2f cc 04 dc 04
E: 26.826694 6 01 37 d8 07 a8 06
E: 26.828665 6 01 3f a8 09 84 04
E: 26.830700 6 01 07 0c 09 40 0b
E: 26.833253 6 01 0f cc 06 98 05
E: 26.835295 6 01 17 08 07 28 0e
E: 26.837450 6 01 1f 98 01 74 08
E: 26.839427 6 01 27 28 03 f0 05
E: 26.841439 6 01 2f e0 04 e0 04
E: 26.843502 6 01 37 ec 07 a4 06
E: 26.845481 6 01 3f bc 09 80 04
E: 26.847529 6 01 07 1c 09 40 0b
E: 26.849550 6 01 0f e0 06 98 05
E: 26.851588 6 01 17 18 07 24 0e
E: 26.853564 6 01 1f a8 01 70 08
E: 26.856599 6 01 27 38 03 f0 05
E: 26.858527 6 01 2f f0 04 e0 04
E: 26.860583 6 01 37 00 08 9c 06
E: 26.862570 6 01 3f d0 09 7c 04
E: 26.864611 6 01 47 7c 0b a4 04
E: 26.866651 6 01 4f bc 0d 34 06
E: 26.868693 6 01 07 30 09 3c 0b
E: 26.870653 6 01 0f f8 06 94 05
E: 26.872660 6 01 17 28 07 20 0e
E: 26.874688 6 01 1f b8 01 68 08
E: 26.877676 6 01 27 48 03 ec 05
E: 26.879636 6 01 07 40 09 38 0b
E: 26.882667 6 01 0f 0c 07 90 05
E: 26.884714 6 01 17 34 07 18 0e
E: 26.887658 6 01 1f cc 01 60 08
E: 26.889669 6 01 27 5c 03 e4 05
E: 26.891617 6 01 2f 1c 05 d8 04
E: 26.893661 6 01 37 30 08 80 06
E: 26.895665 6 01 3f 08 0a 64 04
E: 26.897649 6 01 07 54 09 34 0b
E: 26.899669 6 01 0f 20 07 88 05
E: 26.901662 6 01 17 44 07 10 0e
E: 26.903617 6 01 1f e0 01 58 08
E: 26.906669 6 01 27 70 03 e0 05
E: 26.908648 6 01 2f 30 05 d0 04
E: 26.910652 6 01 37 4c 08 6c 06
E: 26.912684 6 01 3f 1c 0a 58 04
E: 26.914653 6 01 07 68 09 2c 0b
E: 26.916636 6 01 0f 38 07 7c 05
E: 26.918652 6 01 17 50 07 04 0e
E: 26.920664 6 01 1f f4 01 44 08
E: 26.923606 6 01 27 80 03 d4 05
E: 26.925642 6 01 2f 44 05 c8 04
E: 26.927703 6 01 37 64 08 58 06
E: 26.929659 6 01 3f 38 0a 44 04
E: 26.931700 6 01 07 78 09 24 0b
E: 26.933405 6 01 0f 4c 07 70 05
E: 26.935531 6 01 17 60 07 f8 0d
E: 26.937553 6 01 1f 04 02 30 08
E: 26.940643 6 01 27 90 03 cc 05
E: 26.942671 6 01 2f 54 05 c0 04
E: 26.944687 6 01 37 7c 08 44 06
E: 26.946636 6 01 3f 54 0a 30 04
E: 26.948654 6 01 07 90 09 14 0b
E: 26.950620 6 01 0f 68 07 5c 05
E: 26.952642 6 01 17 6c 07 e8 0d
E: 26.954634 6 01 1f 14 02 1c 08
E: 26.957649 6 01 27 a4 03 b8 05
E: 26.959652 6 01 2f 64 05 b4 04
E: 26.961667 6 01 37 90 08 28 06
E: 26.963625 6 01 3f 68 0a 1c 04
E: 26.965571 6 01 07 a4 09 00 0b
E: 26.967984 6 01 0f 7c 07 44 05
E: 26.970051 6 01 17 74 07 d8 0d
E: 26.972213 6 01 1f 28 02 04 08
E: 26.974275 6 01 27 b4 03 a8 05
E: 26.976193 6 01 2f 78 05 a4 04
E: 26.978179 6 01 37 a0 08 10 06
E: 26.980336 6 01 3f 7c 0a 04 04
E: 26.982320 6 01 07 b8 09 ec 0a
E: 26.984582 6 01 0f 8c 07 28 05
E: 26.986584 6 01 17 80 07 c0 0d
E: 26.988640 6 01 1f 38 02 e8 07
E: 26.991580 6 01 27 c4 03 94 05
E: 26.993661 6 01 2f 88 05 94 04
E: 26.995638 6 01 37 b0 08 f8 05
E: 26.997577 6 01 07 cc 09 d4 0a
E: 26.999573 6 01 0f 9c 07 10 05
E: 27.001612 6 01 17 88 07 a4 0d
E: 27.003669 6 01 1f 40 02 d4 07
E: 27.005653 6 01 27 d0 03 80 05
E: 27.007598 6 01 2f 94 05 80 04
E: 27.009557 6 01 37 b8 08 e0 05
E: 27.011605 6 01 3f 98 0a d8 03
E: 27.013612 6 01 47 2c 0c 44 04
E: 27.015615 6 01 07 d8 09 bc 0a
E: 27.018513 6 01 0f a4 07 f8 04
E: 27.020554 6 01 17 8c 07 8c 0d
E: 27.022642 6 01 1f 4c 02 bc 07
E: 27.024584 6 01 27 dc 03 74 05
E: 27.026570 6 01 2f a0 05 70 04
E: 27.028594 6 01 37 c0 08 c4 05
E: 27.030599 6 01 3f a4 0a c0 03
E: 27.032603 6 01 07 e0 09 a8 0a
E: 27.034321 6 01 0f ac 07 e0 04
E: 27.036045 6 01 17 90 07 74 0d
E: 27.038118 6 01 1f 50 02 a4 07
E: 27.041301 6 01 27 e4 03 64 05
E: 27.043369 6 01 2f a8 05 64 04
E: 27.045348 6 01 37 c8 08 ac 05
E: 27.047419 6 01 3f a8 0a ac 03
E: 27.049275 6 01 47 48 0c 20 04
E: 27.051598 6 01 4f 4c 0e f4 05
E: 27.053586 6 01 07 e4 09 88 0a
E: 27.055473 6 01 0f b0 07 c4 04
E: 27.058526 6 01 17 90 07 5c 0d
E: 27.060566 6 01 1f 58 02 88 07
E: 27.063657 6 01 27 e8 03 50 05
E: 27.065612 6 01 07 ec 09 70 0a
E: 27.068586 6 01 0f b4 07 b0 04
E: 27.070618 6 01 17 8c 07 44 0d
E: 27.073598 6 01 1f 58 02 74 07
E: 27.075583 6 01 27 ec 03 40 05
E: 27.077582 6 01 2f b0 05 3c 04
E: 27.079608 6 01 37 c8 08 7c 05
E: 27.081560 6 01 3f b0 0a 7c 03
E: 27.083538 6 01 07 ec 09 5c 0a
E: 27.085184 6 01 0f b4 07 9c 04
E: 27.087255 6 01 17 8c 07 2c 0d
E: 27.089412 6 01 1f 5c 02 60 07
E: 27.092567 6 01 27 f0 03 30 05
E: 27.094597 6 01 2f b4 05 28 04
E: 27.096570 6 01 37 c8 08 64 05
E: 27.098549 6 01 3f b0 0a 6c 03
E: 27.100513 6 01 07 f0 09 48 0a
E: 27.102341 6 01 0f b8 07 8c 04
E: 27.104406 6 01 17 88 07 18 0d
E: 27.106393 6 01 1f 5c 02 4c 07
E: 27.109447 6 01 27 f4 03 24 05
E: 27.111371 6 01 2f b4 05 18 04
E: 27.113464 6 01 37 c8 08 50 05
E: 27.115502 6 01 3f b0 0a 58 03
E: 27.117561 6 01 07 f0 09 38 0a
E: 27.119549 6 01 0f b8 07 7c 04
E: 27.121569 6 01 17 80 07 fc 0c
E: 27.123533 6 01 1f 5c 02 3c 07
E: 27.126516 6 01 27 f4 03 18 05
E: 27.128453 6 01 2f b4 05 08 04
E: 27.130425 6 01 37 c4 08 38 05
E: 27.132467 6 01 07 ec 09 24 0a
E: 27.134493 6 01 0f b4 07 64 04
E: 27.136504 6 01 17 7c 07 e0 0c
E: 27.138571 6 01 1f 5c 02 28 07
E: 27.140432 6 01 27 f8 03 0c 05
E: 27.142539 6 01 2f b4 05 f4 03
E: 27.144589 6 01 37 bc 08 24 05
E: 27.146545 6 01 3f ac 0a 34 03
E: 27.148564 6 01 47 5c 0c d4 03
E: 27.150488 6 01 07 ec 09 14 0a
E: 27.153292 6 01 0f b0 07 50 04
E: 27.155374 6 01 17 70 07 c4 0c
E: 27.157417 6 01 1f 5c 02 18 07
E: 27.159472 6 01 27 f4 03 00 05
E: 27.161563 6 01 2f b0 05 e0 03
E: 27.163533 6 01 37 b8 08 10 05
E: 27.165476 6 01 3f a4 0a 20 03
E: 27.167644 6 01 07 e4 09 fc 09
E: 27.169179 6 01 0f a8 07 38 04
E: 27.171285 6 01 17 64 07 ac 0c
E: 27.173302 6 01 1f 58 02 04 07
E: 27.176340 6 01 27 f0 03 f0 04
E: 27.178287 6 01 2f a8 05 cc 03
E: 27.180383 6 01 37 b0 08 f8 04
E: 27.182489 6 01 3f a0 0a 0c 03
E: 27.184529 6 01 07 e0 09 e4 09
E: 27.186468 6 01 0f a0 07 1c 04
E: 27.188485 6 01 17 58 07 98 0c
E: 27.190376 6 01 1f 50 02 f0 06
E: 27.193524 6 01 27 ec 03 dc 04
E: 27.195516 6 01 2f a0 05 b4 03
E: 27.197578 6 01 37 a0 08 dc 04
E: 27.199606 6 01 3f 94 0a f0 02
E: 27.201595 6 01 47 50 0c a0 03
E: 27.203314 6 01 4f 5c 0e 50 05
E: 27.205379 6 01 07 d0 09 bc 09
E: 27.207373 6 01 0f 90 07 f8 03
E: 27.209387 6 01 17 48 07 7c 0c
E: 27.212364 6 01 1f 44 02 d4 06
E: 27.214333 6 01 27 e4 03 c4 04
E: 27.217572 6 01 07 c0 09 98 09
E: 27.219503 6 01 0f 80 07 dc 03
E: 27.222562 6 01 17 38 07 68 0c
E: 27.224179 6 01 1f 38 02 c0 06
E: 27.226010 6 01 27 d8 03 ac 04
E: 27.228180 6 01 2f 88 05 80 03
E: 27.230305 6 01 37 7c 08 a8 04
E: 27.232237 6 01 3f 6c 0a b8 02
E: 27.234206 6 01 07 b4 09 7c 09
E: 27.235880 6 01 0f 74 07 c0 03
E: 27.237868 6 01 17 2c 07 58 0c
E: 27.240053 6 01 1f 30 02 b0 06
E: 27.243019 6 01 27 cc 03 98 04
E: 27.245143 6 01 2f 7c 05 6c 03
E: 27.247249 6 01 37 6c 08 98 04
E: 27.249228 6 01 3f 60 0a a4 02
E: 27.251226 6 01 07 a4 09 60 09
E: 27.253209 6 01 0f 64 07 a4 03
E: 27.255304 6 01 17 20 07 4c 0c
E: 27.257264 6 01 1f 24 02 a4 06
E: 27.260112 6 01 27 bc 03 84 04
E: 27.262032 6 01 2f 6c 05 58 03
E: 27.264068 6 01 37 60 08 88 04
E: 27.266171 6 01 3f 50 0a 94 02
E: 27.268118 6 01 07 98 09 4c 09
E: 27.270043 6 01 0f 50 07 90 03
E: 27.272130 6 01 17 14 07 40 0c
E: 27.274161 6 01 1f 1c 02 98 06
E: 27.276989 6 01 27 b4 03 74 04
E: 27.278924 6 01 2f 5c 05 48 03
E: 27.280996 6 01 37 50 08 80 04
E: 27.282964 6 01 3f 40 0a 88 02
E: 27.284973 6 01 47 14 0c 28 03
E: 27.287082 6 01 4f 30 0e cc 04
E: 27.289123 6 01 07 8c 09 3c 09
E: 27.290894 6 01 0f 3c 07 78 03
E: 27.294430 6 01 17 04 07 38 0c
E: 27.296400 6 01 1f 0c 02 8c 06
E: 27.299424 6 01 27 a4 03 68 04
E: 27.301456 6 01 07 7c 09 28 09
E: 27.304443 6 01 0f 28 07 6c 03
E: 27.306480 6 01 17 f8 06 30 0c
E: 27.308925 6 01 1f 00 02 88 06
E: 27.310989 6 01 27 94 03 60 04
E: 27.313032 6 01 2f 34 05 2c 03
E: 27.315087 6 01 37 34 08 70 04
E: 27.317258 6 01 3f 20 0a 70 02
E: 27.319220 6 01 07 6c 09 1c 09
E: 27.321081 6 01 0f 18 07 64 03
E: 27.323152 6 01 17 f0 06 2c 0c
E: 27.325022 6 01 1f f4 01 84 06
E: 27.328227 6 01 27 88 03 58 04
E: 27.330076 6 01 2f 20 05 24 03
E: 27.332273 6 01 37 24 08 6c 04
E: 27.334360 6 01 3f 14 0a 6c 02
E: 27.336458 6 01 07 60 09 14 09
E: 27.338416 6 01 0f 08 07 5c 03
E: 27.340296 6 01 17 e4 06 28 0c
E: 27.341975 6 01 1f e8 01 80 06
E: 27.345206 6 01 27 7c 03 54 04
E: 27.347302 6 01 2f 10 05 1c 03
E: 27.349382 6 01 37 18 08 6c 04
E: 27.351356 6 01 3f 04 0a 68 02
E: 27.353211 6 01 47 e0 0b f4 02
E: 27.355321 6 01 4f 04 0e 8c 04
E: 27.357459 6 01 07 50 09 0c 09
E: 27.359396 6 01 0f f4 06 58 03
E: 27.361435 6 01 17 dc 06 28 0c
E: 27.364537 6 01 1f d8 01 84 06
E: 27.366525 6 01 27 6c 03 50 04
E: 27.369470 6 01 07 44 09 04 09
E: 27.371363 6 01 0f e0 06 54 03
E: 27.374458 6 01 17 d8 06 28 0c
E: 27.376412 6 01 1f cc 01 84 06
E: 27.378380 6 01 27 5c 03 50 04
E: 27.380423 6 01 2f ec 04 1c 03
E: 27.382544 6 01 37 fc 07 74 04
E: 27.384506 6 01 3f ec 09 68 02
E: 27.386441 6 01 07 34 09 00 09
E: 27.388371 6 01 0f d0 06 54 03
E: 27.390499 6 01 17 d0 06 2c 0c
E: 27.392269 6 01 1f bc 01 8c 06
E: 27.394923 6 01 27 4c 03 50 04
E: 27.396947 6 01 2f dc 04 1c 03
E: 27.399139 6 01 37 ec 07 78 04
E: 27.401175 6 01 3f dc 09 6c 02
E: 27.403205 6 01 07 2c 09 00 09
E: 27.404998 6 01 0f c4 06 54 03
E: 27.407166 6 01 17 c8 06 2c 0c
E: 27.409187 6 01 1f ac 01 90 06
E: 27.412147 6 01 27 40 03 54 04
E: 27.414135 6 01 2f cc 04 1c 03
E: 27.416229 6 01 37 dc 07 80 04
E: 27.418308 6 01 3f d0 09 6c 02
E: 27.420271 6 01 47 b0 0b e8 02
E: 27.422380 6 01 4f dc 0d 78 04
E: 27.424376 6 01 07 1c 09 00 09
E: 27.425945 6 01 0f b4 06 58 03
E: 27.429361 6 01 17 c0 06 34 0c
E: 27.431360 6 01 1f 98 01 a0 06
E: 27.434472 6 01 27 2c 03 5c 04
E: 27.436330 6 01 07 14 09 00 09
E: 27.439152 6 01 0f a4 06 5c 03
E: 27.441164 6 01 17 b4 06 3c 0c
E: 27.444096 6 01 1f 84 01 b0 06
E: 27.446040 6 01 27 1c 03 64 04
E: 27.448054 6 01 2f a8 04 28 03
E: 27.450151 6 01 37 ac 07 ac 04
E: 27.452330 6 01 3f ac 09 88 02
E: 27.454212 6 01 07 08 09 00 09
E: 27.456142 6 01 0f 94 06 64 03
E: 27.458307 6 01 17 a8 06 48 0c
E: 27.460201 6 01 1f 70 01 c0 06
E: 27.463379 6 01 27 0c 03 6c 04
E: 27.465333 6 01 2f 98 04 30 03
E: 27.467525 6 01 37 94 07 c4 04
E: 27.469489 6 01 3f 94 09 98 02
E: 27.471405 6 01 07 00 09 04 09
E: 27.472958 6 01 0f 80 06 6c 03
E: 27.475252 6 01 17 9c 06 5c 0c
E: 27.477389 6 01 1f 60 01 d0 06
E: 27.480336 6 01 27 f8 02 78 04
E: 27.482476 6 01 2f 84 04 3c 03
E: 27.484494 6 01 37 78 07 e4 04
E: 27.486361 6 01 3f 7c 09 b0 02
E: 27.488453 6 01 07 f4 08 08 09
E: 27.490396 6 01 0f 70 06 74 03
E: 27.492457 6 01 17 8c 06 74 0c
E: 27.494440 6 01 1f 50 01 e4 06
E: 27.497407 6 01 27 e4 02 8c 04
E: 27.499496 6 01 2f 70 04 4c 03
E: 27.501220 6 01 37 64 07 08 05
E: 27.503138 6 01 3f 60 09 d0 02
E: 27.505073 6 01 07 e8 08 10 09
E: 27.506862 6 01 0f 60 06 80 03
E: 27.509425 6 01 17 80 06 8c 0c
E: 27.511335 6 01 1f 3c 01 00 07
E: 27.514245 6 01 27 cc 02 a4 04
E: 27.516248 6 01 2f 5c 04 5c 03
E: 27.518235 6 01 37 50 07 2c 05
E: 27.520248 6 01 07 dc 08 18 09
E: 27.522368 6 01 0f 4c 06 94 03
E: 27.524274 6 01 17 74 06 ac 0c
E: 27.525969 6 01 1f 2c 01 1c 07
E: 27.528058 6 01 27 bc 02 bc 04
E: 27.530092 6 01 2f 4c 04 6c 03
E: 27.532066 6 01 37 40 07 50 05
E: 27.533979 6 01 3f 34 09 18 03
E: 27.535997 6 01 47 34 0b 3c 03
E: 27.538107 6 01 07 cc 08 24 09
E: 27.540056 6 01 0f 38 06 a8 03
E: 27.542101 6 01 17 6c 06 d0 0c
E: 27.543887 6 01 1f 1c 01 38 07
E: 27.547325 6 01 27 a8 02 d4 04
E: 27.549482 6 01 2f 3c 04 84 03
E: 27.551451 6 01 37 34 07 7c 05
E: 27.553345 6 01 3f 24 09 40 03
E: 27.555367 6 01 07 c0 08 30 09
E: 27.557084 6 01 0f 24 06 c0 03
E: 27.559077 6 01 17 64 06 e8 0c
E: 27.560872 6 01 1f 0c 01 58 07
E: 27.563882 6 01 27 98 02 ec 04
E: 27.565923 6 01 2f 28 04 9c 03
E: 27.567724 6 01 37 28 07 a4 05
E: 27.569786 6 01 3f 18 09 68 03
E: 27.572054 6 01 07 b0 08 48 09
E: 27.573773 6 01 0f 14 06 dc 03
E: 27.575719 6 01 17 60 06 04 0d
E: 27.577666 6 01 1f 00 01 74 07
E: 27.580816 6 01 27 8c 02 0c 05
E: 27.586076 6 01 2f 18 04 bc 03
E: 27.588500 6 01 37 24 07 c8 05
E: 27.591244 6 01 3f 0c 09 90 03
E: 27.594578 6 01 07 9c 08 64 09
E: 27.596950 6 01 0f 04 06 f8 03
E: 27.599361 6 01 17 60 06 20 0d
E: 27.600972 6 01 1f f8 00 98 07
E: 27.603457 6 01 27 80 02 28 05
E: 27.605962 6 01 07 8c 08 84 09
E: 27.609063 6 01 0f f8 05 18 04
E: 27.611451 6 01 17 5c 06 34 0d
E: 27.614448 6 01 1f f0 00 bc 07
E: 27.616886 6 01 27 78 02 40 05
E: 27.618433 6 01 2f fc 03 f8 03
E: 27.621471 6 01 37 1c 07 08 06
E: 27.623890 6 01 07 7c 08 a4 09
E: 27.626576 6 01 0f ec 05 34 04
E: 27.628268 6 01 17 60 06 4c 0d
E: 27.630242 6 01 1f e8 00 e0 07
E: 27.631822 6 01 27 6c 02 60 05
E: 27.634284 6 01 2f f4 03 1c 04
E: 27.636204 6 01 37 1c 07 24 06
E: 27.637872 6 01 3f 00 09 f0 03
E: 27.640443 6 01 07 70 08 c8 09
E: 27.643369 6 01 0f e0 05 58 04
E: 27.645024 6 01 17 60 06 60 0d
E: 27.647064 6 01 1f e4 00 04 08
E: 27.649277 6 01 27 64 02 88 05
E: 27.651793 6 01 2f e8 03 40 04
E: 27.653761 6 01 37 1c 07 38 06
E: 27.655459 6 01 07 64 08 f4 09
E: 27.658298 6 01 0f d8 05 7c 04
E: 27.660383 6 01 17 64 06 74 0d
E: 27.662010 6 01 1f dc 00 2c 08
E: 27.664165 6 01 27 5c 02 a8 05
E: 27.666699 6 01 2f e4 03 64 04
E: 27.668706 6 01 37 20 07 4c 06
E: 27.670721 6 01 3f 00 09 18 04
E: 27.672783 6 01 07 5c 08 18 0a
E: 27.675719 6 01 0f d0 05 a0 04
E: 27.678317 6 01 17 68 06 88 0d
E: 27.680326 6 01 1f d8 00 54 08
E: 27.682912 6 01 27 58 02 d0 05
E: 27.684853 6 01 2f d8 03 94 04
E: 27.686890 6 01 37 24 07 64 06
E: 27.688427 6 01 3f 00 09 30 04
E: 27.691745 6 01 07 58 08 3c 0a
E: 27.693346 6 01 0f cc 05 c4 04
E: 27.695753 6 01 17 70 06 9c 0d
E: 27.697709 6 01 1f d8 00 7c 08
E: 27.699697 6 01 27 50 02 f8 05
E: 27.701602 6 01 2f d4 03 b4 04
E: 27.703204 6 01 37 28 07 78 06
E: 27.706315 6 01 3f 04 09 40 04
E: 27.708430 6 01 07 54 08 64 0a
E: 27.711289 6 01 0f c8 05 e8 04
E: 27.713423 6 01 17 74 06 b0 0d
E: 27.715400 6 01 1f d4 00 a4 08
E: 27.717392 6 01 27 4c 02 1c 06
E: 27.719898 6 01 2f d0 03 dc 04
E: 27.721879 6 01 37 2c 07 8c 06
E: 27.723935 6 01 07 50 08 88 0a
E: 27.725114 6 01 0f c8 05 08 05
E: 27.728812 6 01 17 78 06 c8 0d
E: 27.730353 6 01 1f d4 00 c4 08
E: 27.732384 6 01 27 4c 02 3c 06
E: 27.734410 6 01 2f d0 03 04 05
E: 27.737964 6 01 37 34 07 a0 06
E: 27.739423 6 01 3f 10 09 68 04
E: 27.741369 6 01 07 50 08 a8 0a
E: 27.744379 6 01 0f c8 05 24 05
E: 27.746879 6 01 17 80 06 d8 0d
E: 27.748879 6 01 1f d8 00 e4 08
E: 27.750405 6 01 27 4c 02 5c 06
E: 27.752890 6 01 2f d0 03 20 05
E: 27.754410 6 01 37 3c 07 b4 06
E: 27.756899 6 01 3f 14 09 7c 04
E: 27.758913 6 01 07 54 08 c4 0a
E: 27.761358 6 01 0f c8 05 44 05
E: 27.763410 6 01 17 88 06 ec 0d
E: 27.765852 6 01 1f d8 00 04 09
E: 27.767883 6 01 27 4c 02 7c 06
E: 27.769303 6 01 2f d4 03 40 05
E: 27.772406 6 01 37 40 07 c4 06
E: 27.774400 6 01 3f 1c 09 90 04
E: 27.776845 6 01 07 54 08 e4 0a
E: 27.778382 6 01 0f cc 05 68 05
E: 27.780791 6 01 17 8c 06 00 0e
E: 27.782388 6 01 1f dc 00 2c 09
E: 27.785887 6 01 27 50 02 9c 06
E: 27.787833 6 01 07 5c 08 00 0b
E: 27.790560 6 01 0f d0 05 84 05
E: 27.792353 6 01 17 94 06 14 0e
E: 27.795752 6 01 1f e4 00 48 09
E: 27.798301 6 01 27 54 02 b8 06
E: 27.800259 6 01 2f d8 03 7c 05
E: 27.802175 6 01 37 54 07 e4 06
E: 27.804231 6 01 3f 2c 09 b4 04
E: 27.806650 6 01 47 ec 0a b8 04
E: 27.808663 6 01 07 60 08 1c 0b
E: 27.811205 6 01 0f d4 05 a4 05
E: 27.813876 6 01 17 a0 06 28 0e
E: 27.816407 6 01 1f e8 00 64 09
E: 27.818393 6 01 27 58 02 d4 06
E: 27.819862 6 01 2f e0 03 98 05
E: 27.821932 6 01 37 5c 07 f4 06
E: 27.824523 6 01 07 68 08 34 0b
E: 27.827507 6 01 0f dc 05 bc 05
E: 27.829523 6 01 17 ac 06 40 0e
E: 27.831163 6 01 1f f4 00 78 09
E: 27.834298 6 01 27 5c 02 ec 06
E: 27.836321 6 01 2f e8 03 b4 05
E: 27.838303 6 01 37 68 07 04 07
E: 27.839890 6 01 3f 44 09 d8 04
E: 27.841882 6 01 07 70 08 50 0b
E: 27.844233 6 01 0f e4 05 d8 05
E: 27.846040 6 01 17 bc 06 54 0e
E: 27.848586 6 01 1f fc 00 90 09
E: 27.850583 6 01 27 68 02 08 07
E: 27.853091 6 01 2f f0 03 cc 05
E: 27.854720 6 01 37 74 07 14 07
E: 27.856806 6 01 3f 54 09 e8 04
E: 27.860031 6 01 07 7c 08 64 0b
E: 27.862778 6 01 0f f0 05 f0 05
E: 27.865614 6 01 17 c8 06 68 0e
E: 27.867373 6 01 1f 08 01 a4 09
E: 27.869820 6 01 27 70 02 1c 07
E: 27.871355 6 01 2f 00 04 e0 05
E: 27.873853 6 01 37 80 07 20 07
E: 27.875301 6 01 07 88 08 78 0b
E: 27.878766 6 01 0f fc 05 04 06
E: 27.881154 6 01 17 d0 06 74 0e
E: 27.883217 6 01 1f 10 01 b0 09
E: 27.885244 6 01 27 80 02 34 07
E: 27.887802 6 01 2f 0c 04 f4 05
E: 27.889334 6 01 37 90 07 2c 07
E: 27.891333 6 01 3f 74 09 08 05
E: 27.893292 6 01 07 94 08 88 0b
E: 27.896198 6 01 0f 08 06 1c 06
E: 27.898695 6 01 17 dc 06 80 0e
E: 27.900342 6 01 1f 1c 01 bc 09
E: 27.902361 6 01 27 8c 02 44 07
E: 27.904807 6 01 2f 1c 04 08 06
E: 27.906338 6 01 37 a0 07 34 07
E: 27.908773 6 01 07 a8 08 9c 0b
E: 27.911295 6 01 0f 20 06 34 06
E: 27.913788 6 01 17 ec 06 8c 0e
E: 27.915501 6 01 1f 28 01 c8 09
E: 27.917544 6 01 27 a0 02 54 07
E: 27.919484 6 01 2f 34 04 1c 06
E: 27.921003 6 01 37 b0 07 3c 07
E: 27.923600 6 01 3f 94 09 20 05
E: 27.925536 6 01 07 b8 08 a8 0b
E: 27.927257 6 01 0f 38 06 48 06
E: 27.930280 6 01 17 f8 06 98 0e
E: 27.933674 6 01 1f 38 01 d0 09
E: 27.935703 6 01 27 b4 02 64 07
E: 27.938223 6 01 2f 4c 04 30 06
E: 27.940800 6 01 37 c4 07 44 07
E: 27.942353 6 01 07 d0 08 b4 0b
E: 27.945406 6 01 0f 54 06 58 06
E: 27.948110 6 01 17 08 07 a0 0e
E: 27.950593 6 01 1f 44 01 d4 09
E: 27.953131 6 01 27 cc 02 70 07
E: 27.955096 6 01 2f 68 04 40 06
E: 27.956695 6 01 37 d4 07 4c 07
E: 27.960761 6 01 07 e4 08 c4 0b
E: 27.963760 6 01 0f 74 06 64 06
E: 27.965255 6 01 17 14 07 a8 0e
E: 27.967110 6 01 1f 58 01 d8 09
E: 27.969132 6 01 27 e4 02 78 07
E: 27.971221 6 01 2f 84 04 4c 06
E: 27.973203 6 01 37 e8 07 50 07
E: 27.975152 6 01 3f c4 09 30 05
E: 27.976812 6 01 07 00 09 cc 0b
E: 27.979266 6 01 0f 94 06 70 06
E: 27.981327 6 01 17 20 07 b0 0e
E: 27.983301 6 01 1f 68 01 d8 09
E: 27.986287 6 01 27 fc 02 80 07
E: 27.988287 6 01 2f a0 04 50 06
E: 27.990255 6 01 37 f8 07 50 07
E: 27.992285 6 01 3f d4 09 34 05
E: 27.994325 6 01 07 18 09 d4 0b
E: 27.997268 6 01 0f ac 06 74 06
E: 27.999179 6 01 17 2c 07 b4 0e
E: 28.001071 6 01 1f 7c 01 d8 09
E: 28.003110 6 01 27 18 03 84 07
E: 28.005082 6 01 2f bc 04 54 06
E: 28.008178 6 01 37 04 08 50 07
E: 28.010282 6 01 3f e4 09 34 05
E: 28.012457 6 01 07 34 09 d8 0b
E: 28.014238 6 01 0f cc 06 74 06
E: 28.016559 6 01 17 34 07 b8 0e
E: 28.018589 6 01 1f 94 01 d4 09
E: 28.022246 6 01 27 30 03 84 07
E: 28.024260 6 01 2f d8 04 54 06
E: 28.026206 6 01 37 10 08 50 07
E: 28.028228 6 01 07 48 09 d8 0b
E: 28.029966 6 01 0f e8 06 6c 06
E: 28.031995 6 01 17 40 07 bc 0e
E: 28.034100 6 01 1f ac 01 d0 09
E: 28.037118 6 01 27 4c 03 7c 07
E: 28.039071 6 01 2f f4 04 50 06
E: 28.041205 6 01 37 1c 08 4c 07
E: 28.043186 6 01 3f fc 09 34 05
E: 28.045223 6 01 47 b4 0b 74 05
E: 28.047267 6 01 4f 08 0e e0 06
E: 28.049270 6 01 07 68 09 d0 0b
E: 28.052040 6 01 0f 0c 07 60 06
E: 28.054027 6 01 17 44 07 b8 0e
E: 28.056099 6 01 1f d0 01 bc 09
E: 28.058136 6 01 27 68 03 70 07
E: 28.060253 6 01 07 84 09 c8 0b
E: 28.063218 6 01 0f 30 07 50 06
E: 28.065247 6 01 17 4c 07 b4 0e
E: 28.068242 6 01 1f ec 01 a4 09
E: 28.070216 6 01 27 80 03 68 07
E: 28.072278 6 01 2f 34 05 38 06
E: 28.074274 6 01 37 3c 08 38 07
E: 28.076203 6 01 3f 18 0a 24 05
E: 28.078258 6 01 07 9c 09 bc 0b
E: 28.081161 6 01 0f 4c 07 40 06
E: 28.083158 6 01 17 54 07 b4 0e
E: 28.085225 6 01 1f 0c 02 90 09
E: 28.087216 6 01 27 98 03 5c 07
E: 28.089154 6 01 2f 4c 05 28 06
E: 28.091234 6 01 37 4c 08 28 07
E: 28.093234 6 01 3f 28 0a 18 05
E: 28.095195 6 01 07 b0 09 ac 0b
E: 28.097997 6 01 0f 68 07 24 06
E: 28.100467 6 01 17 5c 07 ac 0e
E: 28.101866 6 01 1f 28 02 74 09
E: 28.103832 6 01 27 b4 03 4c 07
E: 28.105814 6 01 2f 68 05 14 06
E: 28.107856 6 01 37 60 08 14 07
E: 28.109821 6 01 3f 34 0a 08 05
E: 28.112973 6 01 07 c8 09 98 0b
E: 28.114996 6 01 0f 7c 07 10 06
E: 28.117131 6 01 17 60 07 a8 0e
E: 28.119090 6 01 1f 40 02 54 09
E: 28.121255 6 01 27 cc 03 34 07
E: 28.123228 6 01 2f 7c 05 fc 05
E: 28.125215 6 01 37 70 08 00 07
E: 28.128215 6 01 3f 48 0a f4 04
E: 28.130203 6 01 07 dc 09 80 0b
E: 28.133832 6 01 0f 94 07 f0 05
E: 28.136049 6 01 17 68 07 9c 0e
E: 28.138049 6 01 1f 54 02 34 09
E: 28.141105 6 01 27 e0 03 1c 07
E: 28.143138 6 01 2f 90 05 e4 05
E: 28.145217 6 01 07 ec 09 60 0b
E: 28.147133 6 01 0f a4 07 cc 05
E: 28.148963 6 01 17 74 07 8c 0e
E: 28.152018 6 01 1f 60 02 1c 09
E: 28.154172 6 01 27 f4 03 08 07
E: 28.156148 6 01 2f a4 05 bc 05
E: 28.158213 6 01 37 94 08 b8 06
E: 28.160235 6 01 3f 68 0a bc 04
E: 28.162172 6 01 07 fc 09 40 0b
E: 28.164935 6 01 0f b0 07 ac 05
E: 28.166964 6 01 17 7c 07 74 0e
E: 28.168938 6 01 1f 70 02 f8 08
E: 28.171930 6 01 27 04 04 f0 06
E: 28.174035 6 01 2f b0 05 a0 05
E: 28.176128 6 01 37 a4 08 94 06
E: 28.178082 6 01 3f 78 0a 9c 04
E: 28.180145 6 01 07 0c 0a 18 0b
E: 28.183157 6 01 0f bc 07 8c 05
E: 28.185201 6 01 17 88 07 58 0e
E: 28.188187 6 01 1f 7c 02 d0 08
E: 28.190256 6 01 27 14 04 d4 06
E: 28.192155 6 01 2f bc 05 7c 05
E: 28.194234 6 01 37 b0 08 64 06
E: 28.196087 6 01 07 18 0a f0 0a
E: 28.198275 6 01 0f c4 07 64 05
E: 28.200631 6 01 17 94 07 34 0e
E: 28.203132 6 01 1f 84 02 b0 08
E: 28.205093 6 01 27 20 04 b8 06
E: 28.207180 6 01 2f c8 05 50 05
E: 28.209142 6 01 37 bc 08 3c 06
E: 28.211035 6 01 3f 94 0a 4c 04
E: 28.213019 6 01 07 20 0a cc 0a
E: 28.214963 6 01 0f c8 07 40 05
E: 28.218145 6 01 17 9c 07 10 0e
E: 28.220133 6 01 1f 90 02 84 08
E: 28.222180 6 01 27 28 04 a0 06
E: 28.224392 6 01 2f cc 05 30 05
E: 28.226186 6 01 37 c4 08 1c 06
E: 28.228188 6 01 3f a0 0a 20 04
E: 28.230194 6 01 07 24 0a a8 0a
E: 28.233002 6 01 0f cc 07 18 05
E: 28.234912 6 01 17 a4 07 f0 0d
E: 28.236873 6 01 1f 94 02 5c 08
E: 28.238788 6 01 27 30 04 84 06
E: 28.240694 6 01 2f d0 05 0c 05
E: 28.242648 6 01 37 c4 08 f4 05
E: 28.244626 6 01 3f a4 0a 00 04
E: 28.247851 6 01 07 28 0a 80 0a
E: 28.249517 6 01 0f cc 07 f0 04
E: 28.251584 6 01 17 a4 07 d0 0d
E: 28.253495 6 01 1f 98 02 3c 08
E: 28.256194 6 01 27 34 04 68 06
E: 28.258211 6 01 2f d4 05 e4 04
E: 28.260128 6 01 37 c8 08 d8 05
E: 28.262179 6 01 3f a8 0a dc 03
E: 28.264169 6 01 07 2c 0a 5c 0a
E: 28.266103 6 01 0f d0 07 cc 04
E: 28.268137 6 01 17 a8 07 b4 0d
E: 28.270118 6 01 1f 9c 02 14 08
E: 28.273106 6 01 27 38 04 4c 06
E: 28.276089 6 01 2f d4 05 c4 04
E: 28.278128 6 01 37 c8 08 bc 05
E: 28.280526 6 01 3f a8 0a bc 03
E: 28.282114 6 01 47 64 0c 24 04
E: 28.284098 6 01 4f 94 0e a8 05
E: 28.286101 6 01 07 2c 0a 30 0a
E: 28.287857 6 01 0f cc 07 a0 04
E: 28.289830 6 01 17 a4 07 94 0d
E: 28.291953 6 01 1f 9c 02 d8 07
E: 28.295023 6 01 07 2c 0a 0c 0a
E: 28.297941 6 01 0f c8 07 78 04
E: 28.301120 6 01 17 a4 07 74 0d
E: 28.303085 6 01 27 3c 04 08 06
E: 28.306077 6 01 07 28 0a ec 09
E: 28.307985 6 01 0f c0 07 54 04
E: 28.310104 6 01 17 a4 07 60 0d
E: 28.312028 6 01 1f 98 02 c4 07
E: 28.314043 6 01 27 3c 04 ec 05
E: 28.317082 6 01 07 24 0a d4 09
E: 28.320021 6 01 0f bc 07 3c 04
E: 28.322094 6 01 17 a0 07 4c 0d
E: 28.324190 6 01 1f 98 02 b0 07
E: 28.326173 6 01 27 38 04 d8 05
E: 28.328137 6 01 2f c4 05 48 04
E: 28.330119 6 01 07 20 0a c0 09
E: 28.332118 6 01 0f b8 07 24 04
E: 28.334152 6 01 17 a0 07 3c 0d
E: 28.336126 6 01 1f 94 02 a0 07
E: 28.339019 6 01 27 38 04 c4 05
E: 28.341048 6 01 2f c0 05 30 04
E: 28.343040 6 01 37 b4 08 24 05
E: 28.344941 6 01 3f 90 0a 1c 03
E: 28.347024 6 01 07 1c 0a a4 09
E: 28.350283 6 01 0f b0 07 0c 04
E: 28.352962 6 01 17 9c 07 28 0d
E: 28.354913 6 01 1f 90 02 90 07
E: 28.356993 6 01 27 30 04 b0 05
E: 28.358839 6 01 2f b4 05 18 04
E: 28.360688 6 01 37 b0 08 14 05
E: 28.362636 6 01 3f 88 0a 04 03
E: 28.364778 6 01 07 10 0a 88 09
E: 28.367889 6 01 0f a8 07 f4 03
E: 28.369974 6 01 17 98 07 1c 0d
E: 28.371991 6 01 1f 8c 02 80 07
E: 28.374086 6 01 27 2c 04 9c 05
E: 28.376104 6 01 2f ac 05 08 04
E: 28.378096 6 01 37 a8 08 00 05
E: 28.380100 6 01 3f 80 0a e8 02
E: 28.382074 6 01 47 3c 0c 28 03
E: 28.384168 6 01 4f 84 0e 90 04
E: 28.386169 6 01 07 04 0a 70 09
E: 28.388048 6 01 0f 98 07 dc 03
E: 28.390046 6 01 17 94 07 08 0d
E: 28.393073 6 01 07 ec 09 44 09
E: 28.396049 6 01 0f 80 07 c0 03
E: 28.398115 6 01 17 90 07 f0 0c
E: 28.400039 6 01 07 e4 09 38 09
E: 28.403099 6 01 0f 74 07 b4 03
E: 28.405019 6 01 17 8c 07 e8 0c
E: 28.408036 6 01 07 dc 09 30 09
E: 28.409984 6 01 07 d4 09 28 09
E: 28.413059 6 01 0f 60 07 a4 03
E: 28.415074 6 01 17 88 07 d8 0c
E: 28.417082 6 01 1f 74 02 50 07
E: 28.419124 6 01 27 04 04 5c 05
E: 28.420986 6 01 2f 7c 05 c4 03
E: 28.423477 6 01 17 84 07 d4 0c
E: 28.426016 6 01 36 a8 08 00 05
E: 28.428052 6 01 17 84 07 d0 0c
E: 28.430104 6 01 3e 70 0a c0 02
E: 28.432033 6 01 46 3c 0c 28 03
E: 28.434119 6 01 4e 84 0e 90 04
E: 28.451047 6 01 1e 74 02 50 07
E: 28.453125 6 01 26 04 04 5c 05
E: 28.455048 6 01 2e 7c 05 c4 03
E: 28.464169 6 01 06 d4 09 28 09
E: 28.465992 6 01 0e 60 07 a4 03
E: 28.472134 6 01 16 84 07 d0 0c
# Thank you.
