R: 81 05 0d 09 04 a1 01 85 01 09 22 a1 00 09 42 15 00 25 01 75 01 95 01 81 02 09 32 81 02 09 37 81 02 25 1f 75 05 09 51 81 02 05 01 55 0e 65 11 35 00 75 10 46 d0 07 26 ff 0f 09 30 81 02 46 40 06 09 31 81 02 05 0d 75 08 85 02 09 55 25 10 b1 02 c0 c0
N: DATA MODUL easyMaxTouch
I: 3 7374 1252
# 1. Drag _one_ finger on the screen from one corner to the opposite, and release it.
E: 0.000000 6 01 07 00 00 0c 00
E: 0.009237 6 01 07 00 00 0c 00
E: 0.022079 6 01 07 00 00 0c 00
E: 0.036732 6 01 07 00 00 0c 00
E: 0.050314 6 01 07 00 00 0c 00
E: 0.064864 6 01 07 00 00 0c 00
E: 0.066805 6 01 07 00 00 0c 00
E: 0.146249 6 01 07 08 00 18 00
E: 0.158702 6 01 07 08 00 18 00
E: 0.163723 6 01 07 08 00 1c 00
E: 0.184702 6 01 07 10 00 28 00
E: 0.197011 6 01 07 10 00 28 00
E: 0.203940 6 01 07 1c 00 34 00
E: 0.223705 6 01 07 30 00 48 00
E: 0.238543 6 01 07 30 00 48 00
E: 0.243701 6 01 07 4c 00 64 00
E: 0.265183 6 01 07 68 00 84 00
E: 0.277588 6 01 07 68 00 84 00
E: 0.283667 6 01 07 84 00 9c 00
E: 0.303276 6 01 07 98 00 b0 00
E: 0.316221 6 01 07 98 00 b0 00
E: 0.322385 6 01 07 ac 00 c4 00
E: 0.342386 6 01 07 c4 00 dc 00
E: 0.357280 6 01 07 c4 00 dc 00
E: 0.362464 6 01 07 d8 00 f0 00
E: 0.383021 6 01 07 f0 00 04 01
E: 0.396389 6 01 07 f0 00 04 01
E: 0.402607 6 01 07 04 01 1c 01
E: 0.422158 6 01 07 24 01 38 01
E: 0.437732 6 01 07 24 01 38 01
E: 0.442710 6 01 07 40 01 54 01
E: 0.463568 6 01 07 5c 01 6c 01
E: 0.476575 6 01 07 5c 01 6c 01
E: 0.482565 6 01 07 78 01 88 01
E: 0.502560 6 01 07 94 01 a0 01
E: 0.515393 6 01 07 94 01 a0 01
E: 0.521547 6 01 07 b0 01 bc 01
E: 0.541590 6 01 07 cc 01 d8 01
E: 0.556182 6 01 07 cc 01 d8 01
E: 0.561527 6 01 07 e4 01 f4 01
E: 0.582380 6 01 07 04 02 10 02
E: 0.595431 6 01 07 04 02 10 02
E: 0.601508 6 01 07 20 02 2c 02
E: 0.621037 6 01 07 3c 02 48 02
E: 0.634555 6 01 07 3c 02 48 02
E: 0.640493 6 01 07 58 02 60 02
E: 0.660582 6 01 07 74 02 7c 02
E: 0.675533 6 01 07 74 02 7c 02
E: 0.681509 6 01 07 98 02 a0 02
E: 0.701222 6 01 07 b4 02 b8 02
E: 0.714456 6 01 07 b4 02 b8 02
E: 0.720496 6 01 07 d4 02 d0 02
E: 0.740431 6 01 07 ec 02 e4 02
E: 0.755407 6 01 07 ec 02 e4 02
E: 0.760424 6 01 07 08 03 00 03
E: 0.781166 6 01 07 24 03 18 03
E: 0.794507 6 01 07 24 03 18 03
E: 0.799258 6 01 07 44 03 34 03
E: 0.819988 6 01 07 5c 03 4c 03
E: 0.833452 6 01 07 5c 03 4c 03
E: 0.839562 6 01 07 78 03 6c 03
E: 0.859456 6 01 07 94 03 88 03
E: 0.874447 6 01 07 94 03 88 03
E: 0.879511 6 01 07 b0 03 a4 03
E: 0.899989 6 01 07 cc 03 c4 03
E: 0.912911 6 01 07 cc 03 c4 03
E: 0.919146 6 01 07 ec 03 e4 03
E: 0.939404 6 01 07 10 04 08 04
E: 0.952170 6 01 07 10 04 08 04
E: 0.961476 6 01 07 28 04 24 04
E: 0.978321 6 01 07 44 04 40 04
E: 0.993072 6 01 07 44 04 40 04
E: 0.997965 6 01 07 60 04 60 04
E: 1.019190 6 01 07 88 04 84 04
E: 1.032134 6 01 07 88 04 84 04
E: 1.038395 6 01 07 a4 04 a4 04
E: 1.058087 6 01 07 c0 04 bc 04
E: 1.073323 6 01 07 c0 04 bc 04
E: 1.078376 6 01 07 dc 04 d4 04
E: 1.099357 6 01 07 f8 04 f0 04
E: 1.110752 6 01 07 f8 04 f0 04
E: 1.119435 6 01 07 14 05 0c 05
E: 1.136779 6 01 07 30 05 24 05
E: 1.151511 6 01 07 30 05 24 05
E: 1.157921 6 01 07 50 05 3c 05
E: 1.177249 6 01 07 6c 05 58 05
E: 1.192810 6 01 07 6c 05 58 05
E: 1.196854 6 01 07 88 05 70 05
E: 1.217148 6 01 07 a8 05 88 05
E: 1.232444 6 01 07 a8 05 88 05
E: 1.236514 6 01 07 c8 05 a4 05
E: 1.257755 6 01 07 e8 05 c0 05
E: 1.271862 6 01 07 e8 05 c0 05
E: 1.277420 6 01 07 08 06 d4 05
E: 1.296709 6 01 07 28 06 ec 05
E: 1.311786 6 01 07 28 06 ec 05
E: 1.315430 6 01 07 44 06 08 06
E: 1.336804 6 01 07 60 06 20 06
E: 1.349230 6 01 07 60 06 20 06
E: 1.358583 6 01 07 80 06 38 06
E: 1.375549 6 01 07 9c 06 50 06
E: 1.390359 6 01 07 9c 06 50 06
E: 1.395265 6 01 07 bc 06 6c 06
E: 1.416137 6 01 07 d4 06 84 06
E: 1.429726 6 01 07 d4 06 84 06
E: 1.438688 6 01 07 f0 06 a0 06
E: 1.455609 6 01 07 0c 07 bc 06
E: 1.470048 6 01 07 0c 07 bc 06
E: 1.475516 6 01 07 20 07 d0 06
E: 1.494691 6 01 07 34 07 e4 06
E: 1.508602 6 01 07 34 07 e4 06
E: 1.515202 6 01 07 50 07 04 07
E: 1.535443 6 01 07 6c 07 20 07
E: 1.550413 6 01 07 6c 07 20 07
E: 1.554344 6 01 07 88 07 40 07
E: 1.575161 6 01 07 a0 07 58 07
E: 1.589499 6 01 07 a0 07 58 07
E: 1.594055 6 01 07 bc 07 74 07
E: 1.615487 6 01 07 d4 07 94 07
E: 1.628318 6 01 07 d4 07 94 07
E: 1.637112 6 01 07 ec 07 a8 07
E: 1.653889 6 01 07 00 08 c0 07
E: 1.667661 6 01 07 00 08 c0 07
E: 1.676609 6 01 07 1c 08 dc 07
E: 1.693590 6 01 07 38 08 f8 07
E: 1.707940 6 01 07 38 08 f8 07
E: 1.714146 6 01 07 58 08 14 08
E: 1.734127 6 01 07 74 08 2c 08
E: 1.748907 6 01 07 74 08 2c 08
E: 1.754109 6 01 07 8c 08 48 08
E: 1.775120 6 01 07 ac 08 60 08
E: 1.787455 6 01 07 ac 08 60 08
E: 1.793466 6 01 07 c8 08 78 08
E: 1.813928 6 01 07 e4 08 94 08
E: 1.826778 6 01 07 e4 08 94 08
E: 1.832821 6 01 07 00 09 ac 08
E: 1.852731 6 01 07 1c 09 c8 08
E: 1.868061 6 01 07 1c 09 c8 08
E: 1.874117 6 01 07 34 09 dc 08
E: 1.894042 6 01 07 58 09 f8 08
E: 1.906966 6 01 07 58 09 f8 08
E: 1.913038 6 01 07 74 09 14 09
E: 1.932679 6 01 07 94 09 2c 09
E: 1.946035 6 01 07 94 09 2c 09
E: 1.955086 6 01 07 b4 09 40 09
E: 1.971995 6 01 07 d0 09 5c 09
E: 1.987021 6 01 07 d0 09 5c 09
E: 1.992005 6 01 07 ec 09 74 09
E: 2.012604 6 01 07 04 0a 88 09
E: 2.026043 6 01 07 04 0a 88 09
E: 2.032009 6 01 07 1c 0a 9c 09
E: 2.051616 6 01 07 34 0a b0 09
E: 2.066485 6 01 07 34 0a b0 09
E: 2.071732 6 01 07 50 0a cc 09
E: 2.092473 6 01 07 6c 0a e8 09
E: 2.105810 6 01 07 6c 0a e8 09
E: 2.111944 6 01 07 84 0a f8 09
E: 2.130185 6 01 07 a0 0a 14 0a
E: 2.145044 6 01 07 a0 0a 14 0a
E: 2.150078 6 01 07 b8 0a 28 0a
E: 2.171007 6 01 07 cc 0a 40 0a
E: 2.186176 6 01 07 cc 0a 40 0a
E: 2.190320 6 01 07 e4 0a 54 0a
E: 2.210765 6 01 07 00 0b 70 0a
E: 2.224378 6 01 07 00 0b 70 0a
E: 2.230371 6 01 07 1c 0b 8c 0a
E: 2.250191 6 01 07 30 0b a4 0a
E: 2.263318 6 01 07 30 0b a4 0a
E: 2.271521 6 01 07 48 0b b8 0a
E: 2.290682 6 01 07 64 0b cc 0a
E: 2.303774 6 01 07 64 0b cc 0a
E: 2.308950 6 01 07 80 0b e4 0a
E: 2.329846 6 01 07 a0 0b 00 0b
E: 2.344771 6 01 07 a0 0b 00 0b
E: 2.348774 6 01 07 b4 0b 10 0b
E: 2.370112 6 01 07 c8 0b 28 0b
E: 2.385027 6 01 07 c8 0b 28 0b
E: 2.389985 6 01 07 dc 0b 3c 0b
E: 2.409027 6 01 07 f0 0b 54 0b
E: 2.423727 6 01 07 f0 0b 54 0b
E: 2.429607 6 01 07 08 0c 6c 0b
E: 2.449714 6 01 07 1c 0c 80 0b
E: 2.463373 6 01 07 1c 0c 80 0b
E: 2.469388 6 01 07 30 0c 98 0b
E: 2.488211 6 01 07 48 0c b0 0b
E: 2.501760 6 01 07 48 0c b0 0b
E: 2.508143 6 01 07 5c 0c c8 0b
E: 2.527884 6 01 07 70 0c e0 0b
E: 2.542460 6 01 07 70 0c e0 0b
E: 2.547536 6 01 07 88 0c f4 0b
E: 2.569163 6 01 07 a4 0c 14 0c
E: 2.581442 6 01 07 a4 0c 14 0c
E: 2.587980 6 01 07 b8 0c 28 0c
E: 2.607852 6 01 07 cc 0c 3c 0c
E: 2.620753 6 01 07 cc 0c 3c 0c
E: 2.629722 6 01 07 e0 0c 54 0c
E: 2.647283 6 01 07 f8 0c 6c 0c
E: 2.661454 6 01 07 f8 0c 6c 0c
E: 2.667592 6 01 07 0c 0d 80 0c
E: 2.687980 6 01 07 24 0d 98 0c
E: 2.700968 6 01 07 24 0d 98 0c
E: 2.706846 6 01 07 38 0d b0 0c
E: 2.726896 6 01 07 54 0d cc 0c
E: 2.740192 6 01 07 54 0d cc 0c
E: 2.748778 6 01 07 68 0d e0 0c
E: 2.768215 6 01 07 7c 0d f8 0c
E: 2.780306 6 01 07 7c 0d f8 0c
E: 2.786743 6 01 07 94 0d 0c 0d
E: 2.806709 6 01 07 a8 0d 20 0d
E: 2.822236 6 01 07 a8 0d 20 0d
E: 2.826165 6 01 07 bc 0d 38 0d
E: 2.847166 6 01 07 d0 0d 4c 0d
E: 2.859627 6 01 07 d0 0d 4c 0d
E: 2.868817 6 01 07 e8 0d 60 0d
E: 2.888172 6 01 07 fc 0d 78 0d
E: 2.900349 6 01 07 fc 0d 78 0d
E: 2.905153 6 01 07 08 0e 88 0d
E: 2.926676 6 01 07 1c 0e 9c 0d
E: 2.939898 6 01 07 1c 0e 9c 0d
E: 2.949007 6 01 07 2c 0e ac 0d
E: 2.965166 6 01 07 40 0e c4 0d
E: 2.978552 6 01 07 40 0e c4 0d
E: 2.985202 6 01 07 58 0e e0 0d
E: 3.006224 6 01 07 6c 0e f4 0d
E: 3.019574 6 01 07 6c 0e f4 0d
E: 3.025637 6 01 07 80 0e 08 0e
E: 3.045073 6 01 07 94 0e 1c 0e
E: 3.059656 6 01 07 94 0e 1c 0e
E: 3.065584 6 01 07 a8 0e 34 0e
E: 3.084906 6 01 07 bc 0e 4c 0e
E: 3.098628 6 01 07 bc 0e 4c 0e
E: 3.107349 6 01 07 cc 0e 60 0e
E: 3.124434 6 01 07 d8 0e 70 0e
E: 3.139533 6 01 07 d8 0e 70 0e
E: 3.143614 6 01 07 e8 0e 84 0e
E: 3.164382 6 01 07 00 0f 9c 0e
E: 3.177287 6 01 07 00 0f 9c 0e
E: 3.186502 6 01 07 0c 0f ac 0e
E: 3.205529 6 01 07 1c 0f bc 0e
E: 3.218499 6 01 07 1c 0f bc 0e
E: 3.224491 6 01 07 28 0f d0 0e
E: 3.244569 6 01 07 34 0f dc 0e
E: 3.257409 6 01 07 34 0f dc 0e
E: 3.266556 6 01 07 40 0f ec 0e
E: 3.285393 6 01 07 48 0f fc 0e
E: 3.296257 6 01 07 48 0f fc 0e
E: 3.305278 6 01 07 58 0f 08 0f
E: 3.322496 6 01 07 60 0f 18 0f
E: 3.337283 6 01 07 60 0f 18 0f
E: 3.342283 6 01 07 6c 0f 28 0f
E: 3.363603 6 01 07 78 0f 38 0f
E: 3.377952 6 01 07 78 0f 38 0f
E: 3.381984 6 01 07 84 0f 44 0f
E: 3.403483 6 01 07 90 0f 58 0f
E: 3.416441 6 01 07 90 0f 58 0f
E: 3.425054 6 01 07 9c 0f 64 0f
E: 3.441981 6 01 07 ac 0f 74 0f
E: 3.455470 6 01 07 ac 0f 74 0f
E: 3.464521 6 01 07 b4 0f 84 0f
E: 3.481495 6 01 07 c0 0f 94 0f
E: 3.496465 6 01 07 c0 0f 94 0f
E: 3.501398 6 01 07 cc 0f a4 0f
E: 3.522147 6 01 07 d4 0f b0 0f
E: 3.534935 6 01 07 d4 0f b0 0f
E: 3.544239 6 01 07 dc 0f b4 0f
E: 3.561380 6 01 07 e0 0f bc 0f
E: 3.575702 6 01 07 e0 0f bc 0f
E: 3.580947 6 01 07 e0 0f c0 0f
E: 3.641976 6 01 06 f8 0f e0 0f
# 2. Land one finger,
   - land a second finger far enough from the first
   - move your two fingers
   - release the *first* finger
   - release the second finger
E: 10.000242 6 01 07 04 02 ec 03
E: 10.002084 6 01 07 04 02 ec 03
E: 10.015210 6 01 07 04 02 ec 03
E: 10.027778 6 01 07 04 02 ec 03
E: 10.041581 6 01 07 04 02 ec 03
E: 10.059827 6 01 07 04 02 ec 03
E: 10.069561 6 01 07 04 02 ec 03
E: 10.083500 6 01 07 04 02 ec 03
E: 10.099172 6 01 07 04 02 ec 03
E: 10.111947 6 01 07 04 02 ec 03
E: 10.124262 6 01 07 04 02 ec 03
E: 10.139356 6 01 07 04 02 ec 03
E: 10.152317 6 01 07 04 02 ec 03
E: 10.158412 6 01 07 0c 02 f8 03
E: 10.178326 6 01 07 10 02 f8 03
E: 10.193410 6 01 07 10 02 f8 03
E: 10.198479 6 01 07 14 02 fc 03
E: 10.219000 6 01 07 14 02 00 04
E: 10.232455 6 01 07 14 02 00 04
E: 10.237387 6 01 07 18 02 04 04
E: 10.258104 6 01 07 20 02 0c 04
E: 10.271005 6 01 07 20 02 0c 04
E: 10.277365 6 01 07 24 02 14 04
E: 10.297333 6 01 07 30 02 20 04
E: 10.312003 6 01 07 30 02 20 04
E: 10.316960 6 01 07 38 02 28 04
E: 10.337793 6 01 07 44 02 38 04
E: 10.350735 6 01 07 44 02 38 04
E: 10.357083 6 01 07 4c 02 40 04
E: 10.377383 6 01 07 54 02 4c 04
E: 10.390245 6 01 07 54 02 4c 04
E: 10.396119 6 01 07 60 02 58 04
E: 10.417899 6 01 07 68 02 64 04
E: 10.431488 6 01 07 68 02 64 04
E: 10.436368 6 01 07 74 02 70 04
E: 10.456711 6 01 07 7c 02 78 04
E: 10.470347 6 01 07 7c 02 78 04
E: 10.476454 6 01 07 84 02 80 04
E: 10.495728 6 01 07 88 02 8c 04
E: 10.511414 6 01 07 88 02 8c 04
E: 10.516440 6 01 07 94 02 98 04
E: 10.537083 6 01 07 9c 02 a4 04
E: 10.550336 6 01 07 9c 02 a4 04
E: 10.562918 6 01 07 9c 02 a4 04
E: 10.565109 6 01 07 a8 02 b0 04
E: 10.573820 6 01 07 b0 02 b8 04
E: 10.582638 6 01 07 b8 02 c0 04
E: 10.594180 6 01 07 bc 02 c8 04
E: 10.603171 6 01 07 c4 02 d0 04
E: 10.605231 6 01 0f f8 03 ec 03
E: 10.616388 6 01 07 c8 02 d8 04
E: 10.630848 6 01 07 c8 02 d8 04
E: 10.635174 6 01 07 cc 02 dc 04
E: 10.655910 6 01 07 d8 02 e8 04
E: 10.669175 6 01 07 d8 02 e8 04
E: 10.675425 6 01 07 e0 02 f0 04
E: 10.696585 6 01 07 e8 02 fc 04
E: 10.698502 6 01 0f 00 04 f8 03
E: 10.716137 6 01 07 f0 02 04 05
E: 10.718147 6 01 0f 00 04 fc 03
E: 10.737110 6 01 07 f8 02 10 05
E: 10.739112 6 01 0f 04 04 04 04
E: 10.755842 6 01 07 00 03 18 05
E: 10.757901 6 01 0f 0c 04 10 04
E: 10.777084 6 01 07 0c 03 28 05
E: 10.779024 6 01 0f 18 04 20 04
E: 10.796203 6 01 07 18 03 34 05
E: 10.798269 6 01 0f 20 04 30 04
E: 10.816918 6 01 07 20 03 40 05
E: 10.818518 6 01 0f 2c 04 44 04
E: 10.835650 6 01 07 2c 03 4c 05
E: 10.837654 6 01 0f 38 04 54 04
E: 10.855190 6 01 07 34 03 58 05
E: 10.857198 6 01 0f 44 04 64 04
E: 10.875914 6 01 07 40 03 64 05
E: 10.877787 6 01 0f 50 04 74 04
E: 10.894515 6 01 07 50 03 70 05
E: 10.896468 6 01 0f 58 04 84 04
E: 10.915935 6 01 07 5c 03 80 05
E: 10.917705 6 01 0f 64 04 94 04
E: 10.935010 6 01 07 68 03 8c 05
E: 10.936481 6 01 0f 6c 04 a4 04
E: 10.956047 6 01 07 78 03 9c 05
E: 10.957933 6 01 0f 78 04 b8 04
E: 10.975091 6 01 07 84 03 ac 05
E: 10.977073 6 01 0f 84 04 c8 04
E: 10.994226 6 01 07 90 03 b8 05
E: 10.996184 6 01 0f 90 04 d8 04
E: 11.014820 6 01 07 a0 03 cc 05
E: 11.016780 6 01 0f 9c 04 e8 04
E: 11.033664 6 01 07 b0 03 dc 05
E: 11.035778 6 01 0f a8 04 f8 04
E: 11.054635 6 01 07 c0 03 ec 05
E: 11.056869 6 01 0f b8 04 08 05
E: 11.073877 6 01 07 d0 03 fc 05
E: 11.076135 6 01 0f c4 04 18 05
E: 11.094318 6 01 07 e0 03 10 06
E: 11.096940 6 01 0f d0 04 2c 05
E: 11.114148 6 01 07 ec 03 1c 06
E: 11.116111 6 01 0f e0 04 3c 05
E: 11.134493 6 01 07 f8 03 2c 06
E: 11.136532 6 01 0f ec 04 50 05
E: 11.153474 6 01 07 04 04 3c 06
E: 11.155254 6 01 0f f8 04 60 05
E: 11.172841 6 01 07 18 04 4c 06
E: 11.174861 6 01 0f 08 05 70 05
E: 11.193970 6 01 07 24 04 60 06
E: 11.195932 6 01 0f 18 05 84 05
E: 11.214821 6 01 07 34 04 70 06
E: 11.216484 6 01 0f 24 05 94 05
E: 11.233863 6 01 07 44 04 84 06
E: 11.235549 6 01 0f 34 05 a8 05
E: 11.252949 6 01 07 54 04 94 06
E: 11.255116 6 01 0f 40 05 bc 05
E: 11.273636 6 01 07 64 04 a4 06
E: 11.275509 6 01 0f 50 05 cc 05
E: 11.292592 6 01 07 70 04 b8 06
E: 11.294594 6 01 0f 60 05 dc 05
E: 11.311726 6 01 07 80 04 cc 06
E: 11.313734 6 01 0f 70 05 f0 05
E: 11.332460 6 01 07 90 04 dc 06
E: 11.334786 6 01 0f 7c 05 00 06
E: 11.352073 6 01 07 a0 04 ec 06
E: 11.353810 6 01 0f 8c 05 14 06
E: 11.372430 6 01 07 ac 04 f8 06
E: 11.374707 6 01 0f 9c 05 24 06
E: 11.391922 6 01 07 bc 04 0c 07
E: 11.393568 6 01 0f a8 05 30 06
E: 11.413114 6 01 07 cc 04 1c 07
E: 11.415052 6 01 0f b4 05 40 06
E: 11.431632 6 01 07 dc 04 2c 07
E: 11.433599 6 01 0f c4 05 54 06
E: 11.453024 6 01 07 e8 04 3c 07
E: 11.455055 6 01 0f d0 05 68 06
E: 11.472072 6 01 07 f8 04 50 07
E: 11.474088 6 01 0f e0 05 78 06
E: 11.492454 6 01 07 04 05 5c 07
E: 11.494602 6 01 0f f0 05 8c 06
E: 11.511550 6 01 07 14 05 70 07
E: 11.513714 6 01 0f 00 06 9c 06
E: 11.530522 6 01 07 24 05 84 07
E: 11.532479 6 01 0f 0c 06 ac 06
E: 11.551349 6 01 07 30 05 90 07
E: 11.553370 6 01 0f 18 06 bc 06
E: 11.570005 6 01 07 3c 05 a0 07
E: 11.572056 6 01 0f 24 06 cc 06
E: 11.591364 6 01 07 48 05 ac 07
E: 11.593665 6 01 0f 34 06 dc 06
E: 11.610971 6 01 07 54 05 bc 07
E: 11.612327 6 01 0f 40 06 ec 06
E: 11.631685 6 01 07 64 05 d0 07
E: 11.633916 6 01 0f 4c 06 fc 06
E: 11.650814 6 01 07 70 05 e0 07
E: 11.652450 6 01 0f 58 06 08 07
E: 11.669322 6 01 07 7c 05 ec 07
E: 11.671631 6 01 0f 68 06 1c 07
E: 11.690937 6 01 07 88 05 fc 07
E: 11.692724 6 01 0f 74 06 30 07
E: 11.709495 6 01 07 94 05 0c 08
E: 11.711850 6 01 0f 80 06 3c 07
E: 11.730303 6 01 07 a0 05 18 08
E: 11.732556 6 01 0f 8c 06 4c 07
E: 11.749539 6 01 07 ac 05 28 08
E: 11.751752 6 01 0f 98 06 5c 07
E: 11.770579 6 01 07 b8 05 38 08
E: 11.772836 6 01 0f a4 06 6c 07
E: 11.789865 6 01 07 c8 05 44 08
E: 11.791868 6 01 0f b4 06 7c 07
E: 11.810900 6 01 07 d4 05 50 08
E: 11.812730 6 01 0f bc 06 88 07
E: 11.829950 6 01 07 dc 05 5c 08
E: 11.831974 6 01 0f c8 06 94 07
E: 11.848470 6 01 07 e4 05 68 08
E: 11.850709 6 01 0f d0 06 a0 07
E: 11.868930 6 01 07 f0 05 74 08
E: 11.871245 6 01 0f dc 06 b0 07
E: 11.888298 6 01 07 fc 05 80 08
E: 11.890200 6 01 0f e8 06 bc 07
E: 11.909354 6 01 07 04 06 8c 08
E: 11.911327 6 01 0f f4 06 c8 07
E: 11.928311 6 01 07 0c 06 98 08
E: 11.930648 6 01 0f fc 06 d4 07
E: 11.949466 6 01 07 14 06 a0 08
E: 11.951392 6 01 0f 04 07 e4 07
E: 11.968485 6 01 07 1c 06 a8 08
E: 11.970747 6 01 0f 10 07 f4 07
E: 11.987854 6 01 0f 1c 07 00 08
E: 11.996470 6 01 0f 24 07 0c 08
E: 12.005298 6 01 0f 2c 07 18 08
E: 12.014827 6 01 0f 34 07 20 08
E: 12.023477 6 01 0f 3c 07 28 08
E: 12.032245 6 01 06 44 06 d0 08
E: 12.035194 6 01 0f 40 07 30 08
E: 12.046939 6 01 0f 44 07 38 08
E: 12.065498 6 01 0f 4c 07 40 08
E: 12.085798 6 01 0f 58 07 50 08
E: 12.105492 6 01 0f 64 07 5c 08
E: 12.126525 6 01 0f 74 07 6c 08
E: 12.145422 6 01 0f 84 07 80 08
E: 12.166256 6 01 0f 94 07 94 08
E: 12.185289 6 01 0f ac 07 ac 08
E: 12.206091 6 01 0f c0 07 c4 08
E: 12.225852 6 01 0f d4 07 dc 08
E: 12.244972 6 01 0f e8 07 f4 08
E: 12.265441 6 01 0f fc 07 08 09
E: 12.284395 6 01 0f 0c 08 18 09
E: 12.305309 6 01 0f 20 08 30 09
E: 12.324422 6 01 0f 34 08 44 09
E: 12.344947 6 01 0f 4c 08 5c 09
E: 12.363947 6 01 0f 5c 08 74 09
E: 12.383714 6 01 0f 70 08 8c 09
E: 12.404493 6 01 0f 84 08 a4 09
E: 12.423574 6 01 0f 94 08 b4 09
E: 12.442317 6 01 0f a4 08 c4 09
E: 12.463429 6 01 0f b8 08 d8 09
E: 12.482299 6 01 0f c4 08 e8 09
E: 12.503672 6 01 0f dc 08 00 0a
E: 12.524643 6 01 0f e8 08 10 0a
E: 12.541308 6 01 0f f8 08 24 0a
E: 12.561636 6 01 0f 10 09 38 0a
E: 12.581387 6 01 0f 20 09 54 0a
E: 12.602413 6 01 0f 38 09 68 0a
E: 12.621165 6 01 0f 48 09 84 0a
E: 12.642268 6 01 0f 68 09 a8 0a
E: 12.703160 6 01 0e 9c 09 e4 0a
# 3. Finally, move your ten fingers on the screen and release them.
E: 24.306234 6 01 07 24 0b 5c 02
E: 24.307785 6 01 07 24 0b 5c 02
E: 24.321776 6 01 07 24 0b 5c 02
E: 24.336563 6 01 07 24 0b 5c 02
E: 24.349554 6 01 07 24 0b 5c 02
E: 24.362429 6 01 07 24 0b 5c 02
E: 24.377266 6 01 07 24 0b 5c 02
E: 24.379946 6 01 0f c4 0c 38 03
E: 24.403315 6 01 17 c8 08 e4 07
E: 24.424711 6 01 17 c8 08 e4 07
E: 24.437725 6 01 17 c8 08 e4 07
E: 24.439338 6 01 1f 84 06 7c 03
E: 24.441634 6 01 27 f4 03 cc 04
E: 24.443301 6 01 2f 04 09 70 0b
E: 24.448331 6 01 0f c4 0c 38 03
E: 24.450723 6 01 37 30 05 54 03
E: 24.451829 6 01 3f 14 03 94 07
E: 24.461340 6 01 07 24 0b 50 02
E: 24.463694 6 01 47 b4 09 a0 02
E: 24.472127 6 01 07 1c 0b 50 02
E: 24.474357 6 01 4f cc 08 74 04
E: 24.518595 6 01 07 1c 0b 4c 02
E: 24.521717 6 01 0f c4 0c 38 03
E: 24.529887 6 01 07 18 0b 4c 02
E: 24.531981 6 01 0f bc 0c 2c 03
E: 24.549593 6 01 07 18 0b 48 02
E: 24.551227 6 01 17 c0 08 d8 07
E: 24.553618 6 01 2f f8 08 70 0b
E: 24.568313 6 01 07 14 0b 48 02
E: 24.570117 6 01 0f b8 0c 2c 03
E: 24.571757 6 01 17 bc 08 d4 07
E: 24.574206 6 01 2f f4 08 70 0b
E: 24.575790 6 01 4f cc 08 74 04
E: 24.587225 6 01 07 14 0b 44 02
E: 24.590232 6 01 0f b4 0c 28 03
E: 24.593359 6 01 1f 78 06 70 03
E: 24.595313 6 01 2f f0 08 70 0b
E: 24.596805 6 01 3f 08 03 94 07
E: 24.598990 6 01 4f c0 08 74 04
E: 24.608095 6 01 07 10 0b 40 02
E: 24.610512 6 01 0f b0 0c 28 03
E: 24.612157 6 01 17 b4 08 d0 07
E: 24.615084 6 01 1f 74 06 70 03
E: 24.616893 6 01 27 e8 03 c0 04
E: 24.619090 6 01 2f ec 08 70 0b
E: 24.621345 6 01 37 24 05 54 03
E: 24.622997 6 01 3f 04 03 94 07
E: 24.625299 6 01 47 a8 09 98 02
E: 24.627184 6 01 4f bc 08 6c 04
E: 24.629223 6 01 07 08 0b 40 02
E: 24.631255 6 01 0f ac 0c 28 03
E: 24.633673 6 01 17 ac 08 c8 07
E: 24.636194 6 01 1f 6c 06 6c 03
E: 24.638463 6 01 27 e4 03 c0 04
E: 24.640438 6 01 2f e4 08 68 0b
E: 24.642473 6 01 37 20 05 54 03
E: 24.644439 6 01 3f 00 03 94 07
E: 24.646032 6 01 47 a4 09 98 02
E: 24.648203 6 01 07 04 0b 3c 02
E: 24.650740 6 01 0f a8 0c 24 03
E: 24.652669 6 01 17 98 08 b8 07
E: 24.655237 6 01 1f 5c 06 68 03
E: 24.657236 6 01 27 dc 03 bc 04
E: 24.659613 6 01 2f dc 08 68 0b
E: 24.661622 6 01 37 1c 05 4c 03
E: 24.663152 6 01 3f f8 02 8c 07
E: 24.665663 6 01 47 a0 09 98 02
E: 24.667184 6 01 4f b4 08 68 04
E: 24.669194 6 01 07 fc 0a 38 02
E: 24.671241 6 01 0f 9c 0c 24 03
E: 24.673188 6 01 17 84 08 ac 07
E: 24.676229 6 01 1f 4c 06 60 03
E: 24.678189 6 01 27 d0 03 b4 04
E: 24.680714 6 01 2f d0 08 68 0b
E: 24.682654 6 01 37 10 05 4c 03
E: 24.684172 6 01 3f ec 02 8c 07
E: 24.686533 6 01 47 98 09 94 02
E: 24.688109 6 01 07 f0 0a 34 02
E: 24.690462 6 01 0f 94 0c 20 03
E: 24.692465 6 01 17 6c 08 9c 07
E: 24.695117 6 01 1f 30 06 5c 03
E: 24.697528 6 01 27 c4 03 b0 04
E: 24.699087 6 01 2f c4 08 64 0b
E: 24.701564 6 01 37 04 05 48 03
E: 24.703120 6 01 3f e0 02 8c 07
E: 24.705510 6 01 47 90 09 94 02
E: 24.707601 6 01 4f a0 08 64 04
E: 24.709164 6 01 07 e4 0a 34 02
E: 24.711340 6 01 0f 88 0c 20 03
E: 24.712917 6 01 17 58 08 90 07
E: 24.715954 6 01 1f 1c 06 54 03
E: 24.718002 6 01 27 b4 03 a8 04
E: 24.720187 6 01 2f b8 08 64 0b
E: 24.722316 6 01 37 f0 04 44 03
E: 24.724356 6 01 3f d4 02 90 07
E: 24.726394 6 01 47 88 09 94 02
E: 24.728026 6 01 4f 94 08 64 04
E: 24.730415 6 01 07 d8 0a 30 02
E: 24.732389 6 01 0f 7c 0c 1c 03
E: 24.734428 6 01 17 40 08 88 07
E: 24.736945 6 01 1f 04 06 50 03
E: 24.739140 6 01 27 a0 03 a8 04
E: 24.741706 6 01 2f a8 08 64 0b
E: 24.743157 6 01 37 d8 04 44 03
E: 24.745585 6 01 3f c0 02 94 07
E: 24.747484 6 01 47 78 09 90 02
E: 24.749152 6 01 07 c8 0a 2c 02
E: 24.751199 6 01 0f 68 0c 1c 03
E: 24.753192 6 01 17 30 08 80 07
E: 24.756137 6 01 1f ec 05 4c 03
E: 24.758184 6 01 27 90 03 a4 04
E: 24.760654 6 01 2f 98 08 64 0b
E: 24.762640 6 01 37 c4 04 40 03
E: 24.764604 6 01 3f a8 02 94 07
E: 24.766537 6 01 47 6c 09 90 02
E: 24.768134 6 01 07 bc 0a 2c 02
E: 24.770644 6 01 0f 58 0c 1c 03
E: 24.772663 6 01 17 1c 08 7c 07
E: 24.775176 6 01 1f d8 05 4c 03
E: 24.777573 6 01 27 84 03 a0 04
E: 24.779155 6 01 2f 88 08 68 0b
E: 24.781554 6 01 37 ac 04 44 03
E: 24.783672 6 01 3f 90 02 9c 07
E: 24.785601 6 01 47 60 09 94 02
E: 24.787642 6 01 07 b0 0a 2c 02
E: 24.789121 6 01 0f 4c 0c 1c 03
E: 24.791131 6 01 17 10 08 78 07
E: 24.793619 6 01 1f c4 05 4c 03
E: 24.796168 6 01 27 6c 03 a4 04
E: 24.798142 6 01 2f 78 08 68 0b
E: 24.800115 6 01 37 98 04 44 03
E: 24.802125 6 01 3f 74 02 a8 07
E: 24.804178 6 01 47 4c 09 94 02
E: 24.806609 6 01 4f 5c 08 68 04
E: 24.808118 6 01 07 a4 0a 2c 02
E: 24.810113 6 01 0f 40 0c 1c 03
E: 24.812231 6 01 17 00 08 74 07
E: 24.815597 6 01 1f b0 05 50 03
E: 24.817493 6 01 27 5c 03 a8 04
E: 24.819094 6 01 2f 68 08 6c 0b
E: 24.821563 6 01 37 80 04 48 03
E: 24.823238 6 01 3f 54 02 b8 07
E: 24.825112 6 01 47 38 09 98 02
E: 24.826706 6 01 07 94 0a 30 02
E: 24.828786 6 01 0f 30 0c 1c 03
E: 24.830891 6 01 17 f0 07 74 07
E: 24.833938 6 01 1f 98 05 54 03
E: 24.836383 6 01 27 4c 03 ac 04
E: 24.837846 6 01 2f 58 08 70 0b
E: 24.839991 6 01 37 60 04 50 03
E: 24.842512 6 01 3f 38 02 cc 07
E: 24.844054 6 01 47 28 09 9c 02
E: 24.846474 6 01 4f 38 08 74 04
E: 24.848086 6 01 07 88 0a 30 02
E: 24.850565 6 01 0f 20 0c 1c 03
E: 24.852510 6 01 17 e0 07 70 07
E: 24.855531 6 01 1f 7c 05 58 03
E: 24.857604 6 01 27 38 03 b0 04
E: 24.859058 6 01 2f 48 08 74 0b
E: 24.861045 6 01 37 44 04 58 03
E: 24.863418 6 01 3f 20 02 d8 07
E: 24.865458 6 01 47 14 09 a4 02
E: 24.867382 6 01 07 78 0a 34 02
E: 24.869031 6 01 0f 10 0c 20 03
E: 24.871177 6 01 17 d0 07 70 07
E: 24.873962 6 01 1f 60 05 60 03
E: 24.876596 6 01 27 28 03 b8 04
E: 24.878467 6 01 2f 3c 08 78 0b
E: 24.880434 6 01 37 24 04 68 03
E: 24.882071 6 01 3f 10 02 e4 07
E: 24.884123 6 01 47 04 09 a8 02
E: 24.886491 6 01 4f 10 08 80 04
E: 24.888090 6 01 07 68 0a 38 02
E: 24.890644 6 01 0f 08 0c 20 03
E: 24.892082 6 01 17 c0 07 70 07
E: 24.895593 6 01 1f 48 05 6c 03
E: 24.897578 6 01 27 14 03 c4 04
E: 24.899065 6 01 2f 30 08 80 0b
E: 24.901558 6 01 37 10 04 70 03
E: 24.903579 6 01 3f 00 02 f4 07
E: 24.905621 6 01 47 f4 08 ac 02
E: 24.907540 6 01 07 5c 0a 3c 02
E: 24.909061 6 01 0f fc 0b 20 03
E: 24.911071 6 01 17 b0 07 74 07
E: 24.914071 6 01 1f 30 05 74 03
E: 24.916539 6 01 27 fc 02 d4 04
E: 24.918641 6 01 2f 24 08 84 0b
E: 24.920543 6 01 37 f4 03 80 03
E: 24.921990 6 01 3f f0 01 08 08
E: 24.924158 6 01 47 e8 08 b4 02
E: 24.926579 6 01 4f f8 07 8c 04
E: 24.928241 6 01 07 50 0a 40 02
E: 24.930152 6 01 0f f0 0b 24 03
E: 24.932277 6 01 17 a0 07 74 07
E: 24.934931 6 01 1f 1c 05 84 03
E: 24.936900 6 01 27 ec 02 e4 04
E: 24.938468 6 01 2f 20 08 88 0b
E: 24.940977 6 01 37 e4 03 90 03
E: 24.942944 6 01 3f e0 01 1c 08
E: 24.944770 6 01 47 dc 08 bc 02
E: 24.946892 6 01 07 48 0a 40 02
E: 24.948501 6 01 0f e8 0b 24 03
E: 24.950519 6 01 17 90 07 78 07
E: 24.953554 6 01 1f 0c 05 90 03
E: 24.956052 6 01 27 d4 02 fc 04
E: 24.958098 6 01 2f 1c 08 8c 0b
E: 24.960531 6 01 37 d4 03 a0 03
E: 24.962614 6 01 3f d4 01 30 08
E: 24.964037 6 01 47 d4 08 c0 02
E: 24.966046 6 01 07 40 0a 44 02
E: 24.968600 6 01 0f e0 0b 28 03
E: 24.970508 6 01 17 84 07 80 07
E: 24.972532 6 01 1f fc 04 a0 03
E: 24.975469 6 01 27 c0 02 14 05
E: 24.978204 6 01 2f 14 08 90 0b
E: 24.980590 6 01 37 c4 03 b0 03
E: 24.982525 6 01 3f c4 01 50 08
E: 24.984026 6 01 47 cc 08 c8 02
E: 24.986005 6 01 07 38 0a 48 02
E: 24.988348 6 01 0f d8 0b 28 03
E: 24.989806 6 01 17 74 07 88 07
E: 24.992369 6 01 1f ec 04 b0 03
E: 24.994455 6 01 27 b0 02 30 05
E: 24.996886 6 01 2f 14 08 94 0b
E: 24.998494 6 01 37 b4 03 c4 03
E: 25.001134 6 01 3f bc 01 64 08
E: 25.003046 6 01 47 c4 08 d0 02
E: 25.004695 6 01 4f d8 07 ac 04
E: 25.007268 6 01 07 30 0a 50 02
E: 25.008784 6 01 0f d4 0b 2c 03
E: 25.010954 6 01 17 64 07 90 07
E: 25.014292 6 01 1f e0 04 c4 03
E: 25.016228 6 01 27 a0 02 4c 05
E: 25.018388 6 01 2f 10 08 98 0b
E: 25.019847 6 01 37 a8 03 d8 03
E: 25.022422 6 01 3f b4 01 7c 08
E: 25.024238 6 01 47 bc 08 d8 02
E: 25.026251 6 01 07 28 0a 54 02
E: 25.027870 6 01 0f cc 0b 2c 03
E: 25.029298 6 01 17 58 07 9c 07
E: 25.032334 6 01 1f d4 04 d4 03
E: 25.034332 6 01 27 98 02 60 05
E: 25.037606 6 01 2f 0c 08 9c 0b
E: 25.039008 6 01 37 9c 03 f0 03
E: 25.041363 6 01 3f ac 01 98 08
E: 25.043304 6 01 47 b8 08 e0 02
E: 25.044858 6 01 4f d0 07 bc 04
E: 25.047202 6 01 07 24 0a 5c 02
E: 25.048736 6 01 0f c8 0b 30 03
E: 25.050513 6 01 17 4c 07 a8 07
E: 25.053571 6 01 1f c8 04 e8 03
E: 25.055667 6 01 27 8c 02 78 05
E: 25.057870 6 01 2f 0c 08 a4 0b
E: 25.059289 6 01 37 8c 03 10 04
E: 25.062495 6 01 3f a4 01 b4 08
E: 25.064494 6 01 47 b4 08 e8 02
E: 25.065994 6 01 07 1c 0a 60 02
E: 25.068073 6 01 0f c4 0b 30 03
E: 25.069971 6 01 17 40 07 b4 07
E: 25.072995 6 01 1f c0 04 fc 03
E: 25.074896 6 01 27 84 02 94 05
E: 25.076918 6 01 2f 0c 08 a8 0b
E: 25.078979 6 01 37 80 03 30 04
E: 25.080911 6 01 3f 9c 01 d8 08
E: 25.082880 6 01 47 b0 08 f0 02
E: 25.084862 6 01 4f c8 07 d4 04
E: 25.086936 6 01 07 14 0a 68 02
E: 25.088929 6 01 0f bc 0b 34 03
E: 25.090979 6 01 17 34 07 c4 07
E: 25.093859 6 01 1f b8 04 10 04
E: 25.095897 6 01 27 80 02 ac 05
E: 25.097856 6 01 2f 0c 08 b0 0b
E: 25.099831 6 01 37 70 03 4c 04
E: 25.101759 6 01 3f 98 01 f0 08
E: 25.103682 6 01 47 a8 08 f8 02
E: 25.105733 6 01 07 10 0a 70 02
E: 25.107769 6 01 17 2c 07 d8 07
E: 25.109867 6 01 1f b0 04 24 04
E: 25.112974 6 01 27 78 02 c4 05
E: 25.115053 6 01 2f 0c 08 b8 0b
E: 25.116962 6 01 37 6c 03 64 04
E: 25.118971 6 01 3f 94 01 08 09
E: 25.120886 6 01 47 a8 08 00 03
E: 25.122828 6 01 4f c0 07 f0 04
E: 25.124977 6 01 07 0c 0a 78 02
E: 25.127967 6 01 0f b8 0b 38 03
E: 25.131017 6 01 17 24 07 e4 07
E: 25.132912 6 01 1f ac 04 38 04
E: 25.136007 6 01 27 70 02 e0 05
E: 25.137958 6 01 2f 0c 08 c0 0b
E: 25.139960 6 01 37 64 03 7c 04
E: 25.142029 6 01 3f 90 01 1c 09
E: 25.143991 6 01 47 a4 08 0c 03
E: 25.146007 6 01 07 04 0a 7c 02
E: 25.147963 6 01 0f b4 0b 3c 03
E: 25.149956 6 01 17 20 07 f4 07
E: 25.153007 6 01 1f a4 04 4c 04
E: 25.155005 6 01 27 70 02 f4 05
E: 25.156821 6 01 2f 0c 08 c8 0b
E: 25.158914 6 01 37 60 03 8c 04
E: 25.160866 6 01 3f 90 01 30 09
E: 25.162830 6 01 47 a0 08 14 03
E: 25.164883 6 01 07 00 0a 88 02
E: 25.166808 6 01 0f b0 0b 3c 03
E: 25.168943 6 01 17 1c 07 00 08
E: 25.170994 6 01 1f a4 04 5c 04
E: 25.173964 6 01 27 6c 02 0c 06
E: 25.175926 6 01 2f 0c 08 cc 0b
E: 25.177934 6 01 37 60 03 a0 04
E: 25.179949 6 01 3f 90 01 44 09
E: 25.181999 6 01 47 9c 08 24 03
E: 25.183926 6 01 4f bc 07 14 05
E: 25.185983 6 01 07 f8 09 94 02
E: 25.187942 6 01 0f ac 0b 40 03
E: 25.190024 6 01 17 18 07 0c 08
E: 25.192953 6 01 1f a0 04 70 04
E: 25.194983 6 01 27 68 02 24 06
E: 25.196974 6 01 2f 10 08 d4 0b
E: 25.198935 6 01 37 5c 03 b0 04
E: 25.200981 6 01 3f 94 01 54 09
E: 25.202981 6 01 47 9c 08 34 03
E: 25.204911 6 01 07 f4 09 a4 02
E: 25.206862 6 01 0f ac 0b 44 03
E: 25.208877 6 01 17 14 07 18 08
E: 25.211871 6 01 1f a0 04 80 04
E: 25.213922 6 01 27 68 02 3c 06
E: 25.215909 6 01 2f 14 08 dc 0b
E: 25.217930 6 01 37 5c 03 c4 04
E: 25.219899 6 01 3f 94 01 68 09
E: 25.221981 6 01 47 98 08 44 03
E: 25.223790 6 01 4f c0 07 2c 05
E: 25.225853 6 01 07 ec 09 b4 02
E: 25.227852 6 01 0f a8 0b 48 03
E: 25.229809 6 01 17 10 07 24 08
E: 25.232942 6 01 1f a0 04 90 04
E: 25.234984 6 01 27 68 02 50 06
E: 25.236870 6 01 2f 18 08 e8 0b
E: 25.238909 6 01 37 5c 03 d4 04
E: 25.240889 6 01 3f 98 01 7c 09
E: 25.242834 6 01 47 98 08 5c 03
E: 25.244966 6 01 07 e8 09 c8 02
E: 25.246902 6 01 0f a4 0b 4c 03
E: 25.248913 6 01 17 10 07 30 08
E: 25.251989 6 01 1f a0 04 a0 04
E: 25.253978 6 01 27 68 02 64 06
E: 25.255889 6 01 2f 1c 08 f8 0b
E: 25.257954 6 01 37 5c 03 ec 04
E: 25.259890 6 01 3f a0 01 94 09
E: 25.261943 6 01 47 98 08 74 03
E: 25.263930 6 01 4f c0 07 58 05
E: 25.265938 6 01 07 e0 09 dc 02
E: 25.267963 6 01 0f a4 0b 54 03
E: 25.269892 6 01 17 10 07 3c 08
E: 25.272977 6 01 1f a4 04 b8 04
E: 25.274954 6 01 27 68 02 80 06
E: 25.276887 6 01 2f 28 08 08 0c
E: 25.278891 6 01 37 60 03 04 05
E: 25.280888 6 01 3f a8 01 a8 09
E: 25.282972 6 01 47 98 08 88 03
E: 25.284858 6 01 07 e0 09 f8 02
E: 25.286892 6 01 0f a0 0b 60 03
E: 25.288793 6 01 17 10 07 48 08
E: 25.291783 6 01 1f a8 04 d0 04
E: 25.293877 6 01 27 6c 02 98 06
E: 25.295879 6 01 2f 30 08 20 0c
E: 25.297846 6 01 37 64 03 1c 05
E: 25.299901 6 01 3f ac 01 c0 09
E: 25.301882 6 01 47 98 08 a8 03
E: 25.303881 6 01 4f c8 07 9c 05
E: 25.305947 6 01 07 dc 09 14 03
E: 25.307919 6 01 0f 9c 0b 74 03
E: 25.309914 6 01 17 10 07 5c 08
E: 25.312882 6 01 1f ac 04 ec 04
E: 25.314868 6 01 27 70 02 b4 06
E: 25.316883 6 01 2f 3c 08 3c 0c
E: 25.318874 6 01 37 68 03 38 05
E: 25.320777 6 01 3f b4 01 dc 09
E: 25.322888 6 01 47 9c 08 cc 03
E: 25.324811 6 01 07 dc 09 2c 03
E: 25.326917 6 01 0f 9c 0b 84 03
E: 25.328853 6 01 17 14 07 70 08
E: 25.330878 6 01 1f b0 04 08 05
E: 25.333914 6 01 27 74 02 d4 06
E: 25.335843 6 01 2f 50 08 5c 0c
E: 25.337847 6 01 37 6c 03 54 05
E: 25.339906 6 01 3f c0 01 f4 09
E: 25.341859 6 01 47 a0 08 f4 03
E: 25.343952 6 01 07 dc 09 48 03
E: 25.345871 6 01 0f 9c 0b 9c 03
E: 25.347795 6 01 17 18 07 8c 08
E: 25.349844 6 01 1f b8 04 24 05
E: 25.352896 6 01 27 7c 02 f0 06
E: 25.354937 6 01 2f 5c 08 7c 0c
E: 25.356841 6 01 37 74 03 70 05
E: 25.358850 6 01 3f c8 01 0c 0a
E: 25.360836 6 01 47 a4 08 1c 04
E: 25.362858 6 01 4f e4 07 18 06
E: 25.364914 6 01 07 e0 09 64 03
E: 25.366895 6 01 0f 9c 0b b4 03
E: 25.368852 6 01 17 20 07 a8 08
E: 25.371849 6 01 1f c0 04 40 05
E: 25.373944 6 01 27 88 02 14 07
E: 25.375910 6 01 2f 68 08 98 0c
E: 25.377848 6 01 37 7c 03 88 05
E: 25.379846 6 01 3f d4 01 20 0a
E: 25.381850 6 01 47 ac 08 38 04
E: 25.383895 6 01 07 e0 09 7c 03
E: 25.385823 6 01 0f 9c 0b d0 03
E: 25.387893 6 01 17 28 07 c4 08
E: 25.390822 6 01 1f cc 04 58 05
E: 25.392834 6 01 27 90 02 2c 07
E: 25.394911 6 01 2f 74 08 a8 0c
E: 25.396769 6 01 37 88 03 ac 05
E: 25.398832 6 01 3f dc 01 38 0a
E: 25.400933 6 01 47 b0 08 50 04
E: 25.402828 6 01 4f f0 07 4c 06
E: 25.404920 6 01 07 e4 09 94 03
E: 25.407249 6 01 0f a0 0b e0 03
E: 25.408756 6 01 17 30 07 e0 08
E: 25.411741 6 01 1f d8 04 78 05
E: 25.413867 6 01 27 98 02 4c 07
E: 25.415782 6 01 2f 7c 08 b8 0c
E: 25.417823 6 01 37 90 03 c4 05
E: 25.419843 6 01 3f ec 01 50 0a
E: 25.421806 6 01 47 b4 08 64 04
E: 25.423820 6 01 07 e8 09 a8 03
E: 25.425865 6 01 0f a0 0b f4 03
E: 25.427934 6 01 17 38 07 f8 08
E: 25.432192 6 01 1f e4 04 94 05
E: 25.434155 6 01 27 a8 02 6c 07
E: 25.436133 6 01 2f 84 08 c8 0c
E: 25.437873 6 01 37 9c 03 dc 05
E: 25.439737 6 01 3f f8 01 64 0a
E: 25.441577 6 01 47 b8 08 78 04
E: 25.443668 6 01 07 ec 09 b8 03
E: 25.445698 6 01 0f a4 0b 08 04
E: 25.448025 6 01 17 48 07 18 09
E: 25.450794 6 01 1f f4 04 b0 05
E: 25.453266 6 01 27 b0 02 80 07
E: 25.455219 6 01 2f 8c 08 d8 0c
E: 25.457009 6 01 37 a8 03 f4 05
E: 25.459390 6 01 3f 08 02 80 0a
E: 25.461422 6 01 47 c0 08 8c 04
E: 25.463393 6 01 4f 04 08 84 06
E: 25.465255 6 01 07 f0 09 d0 03
E: 25.467019 6 01 0f ac 0b 1c 04
E: 25.469048 6 01 17 50 07 2c 09
E: 25.472085 6 01 1f 00 05 c4 05
E: 25.474045 6 01 27 bc 02 94 07
E: 25.476392 6 01 2f 98 08 e8 0c
E: 25.478329 6 01 37 b4 03 08 06
E: 25.479920 6 01 3f 14 02 94 0a
E: 25.481634 6 01 47 c4 08 a0 04
E: 25.483845 6 01 07 f8 09 e4 03
E: 25.485292 6 01 0f b4 0b 30 04
E: 25.487390 6 01 17 5c 07 40 09
E: 25.490707 6 01 1f 0c 05 d8 05
E: 25.492778 6 01 27 c8 02 ac 07
E: 25.494711 6 01 2f a4 08 fc 0c
E: 25.496325 6 01 37 c4 03 24 06
E: 25.499404 6 01 3f 20 02 a8 0a
E: 25.501290 6 01 47 d0 08 b4 04
E: 25.503397 6 01 4f 18 08 a8 06
E: 25.505116 6 01 07 00 0a f8 03
E: 25.506815 6 01 0f bc 0b 40 04
E: 25.509198 6 01 17 6c 07 54 09
E: 25.511785 6 01 1f 1c 05 e8 05
E: 25.513623 6 01 27 d4 02 c0 07
E: 25.515637 6 01 2f b0 08 0c 0d
E: 25.518423 6 01 37 d4 03 3c 06
E: 25.520784 6 01 3f 30 02 b8 0a
E: 25.522725 6 01 47 d8 08 c4 04
E: 25.524760 6 01 07 08 0a 08 04
E: 25.526506 6 01 0f c4 0b 54 04
E: 25.529366 6 01 17 78 07 68 09
E: 25.532018 6 01 1f 28 05 fc 05
E: 25.534344 6 01 27 e4 02 d4 07
E: 25.536142 6 01 2f c0 08 20 0d
E: 25.537845 6 01 37 e0 03 50 06
E: 25.539822 6 01 3f 40 02 c8 0a
E: 25.541559 6 01 47 e0 08 d8 04
E: 25.543588 6 01 07 10 0a 1c 04
E: 25.545913 6 01 0f d0 0b 64 04
E: 25.547780 6 01 17 84 07 7c 09
E: 25.550893 6 01 1f 38 05 10 06
E: 25.553323 6 01 27 f0 02 e8 07
E: 25.555005 6 01 2f d0 08 34 0d
E: 25.556982 6 01 37 f0 03 60 06
E: 25.559008 6 01 3f 50 02 d8 0a
E: 25.561230 6 01 47 ec 08 ec 04
E: 25.563297 6 01 07 1c 0a 2c 04
E: 25.564905 6 01 0f dc 0b 74 04
E: 25.567175 6 01 17 90 07 8c 09
E: 25.570007 6 01 1f 44 05 20 06
E: 25.572047 6 01 27 fc 02 f8 07
E: 25.574327 6 01 2f dc 08 48 0d
E: 25.576240 6 01 37 fc 03 6c 06
E: 25.577979 6 01 3f 5c 02 e8 0a
E: 25.579996 6 01 47 f8 08 00 05
E: 25.582057 6 01 4f 44 08 f8 06
E: 25.584401 6 01 07 24 0a 40 04
E: 25.586278 6 01 0f e8 0b 84 04
E: 25.588031 6 01 17 9c 07 98 09
E: 25.590946 6 01 1f 54 05 2c 06
E: 25.593300 6 01 27 08 03 08 08
E: 25.595247 6 01 2f f0 08 58 0d
E: 25.596971 6 01 37 08 04 7c 06
E: 25.599275 6 01 3f 68 02 f4 0a
E: 25.601261 6 01 47 08 09 14 05
E: 25.602978 6 01 07 34 0a 50 04
E: 25.605229 6 01 0f f4 0b 94 04
E: 25.607247 6 01 17 a8 07 a8 09
E: 25.610313 6 01 1f 60 05 38 06
E: 25.612346 6 01 27 14 03 14 08
E: 25.613974 6 01 2f 00 09 68 0d
E: 25.616318 6 01 37 14 04 8c 06
E: 25.617960 6 01 3f 78 02 00 0b
E: 25.620256 6 01 47 14 09 24 05
E: 25.622378 6 01 4f 60 08 14 07
E: 25.624361 6 01 07 40 0a 5c 04
E: 25.626251 6 01 0f 04 0c a0 04
E: 25.628054 6 01 17 b4 07 b0 09
E: 25.630971 6 01 1f 70 05 48 06
E: 25.632944 6 01 27 24 03 20 08
E: 25.635225 6 01 2f 14 09 74 0d
E: 25.636953 6 01 37 24 04 98 06
E: 25.638914 6 01 3f 84 02 08 0b
E: 25.641234 6 01 47 20 09 30 05
E: 25.642844 6 01 07 4c 0a 68 04
E: 25.644913 6 01 0f 14 0c ac 04
E: 25.647253 6 01 17 c0 07 b8 09
E: 25.650252 6 01 1f 7c 05 50 06
E: 25.652390 6 01 27 30 03 2c 08
E: 25.654337 6 01 2f 24 09 80 0d
E: 25.656258 6 01 37 30 04 a4 06
E: 25.657983 6 01 3f 90 02 10 0b
E: 25.660139 6 01 47 30 09 3c 05
E: 25.661948 6 01 4f 80 08 2c 07
E: 25.664308 6 01 07 5c 0a 74 04
E: 25.665938 6 01 0f 24 0c b4 04
E: 25.667831 6 01 17 cc 07 c0 09
E: 25.670880 6 01 1f 88 05 58 06
E: 25.673025 6 01 27 3c 03 34 08
E: 25.675315 6 01 2f 34 09 8c 0d
E: 25.677207 6 01 37 3c 04 ac 06
E: 25.679017 6 01 3f 98 02 14 0b
E: 25.680817 6 01 47 40 09 48 05
E: 25.682477 6 01 07 6c 0a 80 04
E: 25.684866 6 01 0f 34 0c bc 04
E: 25.686608 6 01 17 d8 07 c4 09
E: 25.689906 6 01 1f 98 05 60 06
E: 25.692233 6 01 27 48 03 3c 08
E: 25.694245 6 01 2f 44 09 90 0d
E: 25.696168 6 01 37 4c 04 b4 06
E: 25.697922 6 01 3f a8 02 18 0b
E: 25.699922 6 01 47 4c 09 50 05
E: 25.702285 6 01 07 7c 0a 88 04
E: 25.704307 6 01 0f 44 0c c4 04
E: 25.706237 6 01 17 e4 07 cc 09
E: 25.708916 6 01 1f a4 05 68 06
E: 25.711210 6 01 27 58 03 44 08
E: 25.712980 6 01 2f 54 09 98 0d
E: 25.715261 6 01 37 5c 04 b8 06
E: 25.717299 6 01 3f b4 02 1c 0b
E: 25.718922 6 01 47 5c 09 54 05
E: 25.721230 6 01 4f b0 08 44 07
E: 25.723289 6 01 07 88 0a 90 04
E: 25.725209 6 01 0f 54 0c cc 04
E: 25.727334 6 01 17 f0 07 d0 09
E: 25.730120 6 01 1f b4 05 6c 06
E: 25.731619 6 01 27 64 03 48 08
E: 25.733306 6 01 2f 60 09 9c 0d
E: 25.735655 6 01 37 6c 04 c0 06
E: 25.737698 6 01 3f c0 02 1c 0b
E: 25.739443 6 01 47 68 09 5c 05
E: 25.741890 6 01 07 98 0a 94 04
E: 25.743563 6 01 0f 64 0c d0 04
E: 25.745860 6 01 17 fc 07 d4 09
E: 25.748509 6 01 1f c8 05 74 06
E: 25.750809 6 01 27 78 03 50 08
E: 25.752979 6 01 2f 70 09 a0 0d
E: 25.754878 6 01 37 7c 04 c4 06
E: 25.756641 6 01 3f d0 02 20 0b
E: 25.758750 6 01 47 78 09 60 05
E: 25.761200 6 01 4f d0 08 50 07
E: 25.763100 6 01 07 a4 0a 98 04
E: 25.765138 6 01 0f 74 0c d4 04
E: 25.767132 6 01 17 0c 08 dc 09
E: 25.770214 6 01 1f d8 05 78 06
E: 25.771894 6 01 27 88 03 54 08
E: 25.773893 6 01 2f 80 09 a4 0d
E: 25.776303 6 01 37 90 04 cc 06
E: 25.777886 6 01 3f e0 02 20 0b
E: 25.780164 6 01 47 84 09 64 05
E: 25.781889 6 01 07 b0 0a 9c 04
E: 25.783889 6 01 0f 84 0c d4 04
E: 25.786274 6 01 17 20 08 e0 09
E: 25.788891 6 01 1f ec 05 78 06
E: 25.791294 6 01 27 94 03 54 08
E: 25.792884 6 01 2f 8c 09 a4 0d
E: 25.795256 6 01 37 a4 04 d0 06
E: 25.797188 6 01 3f f0 02 20 0b
E: 25.798884 6 01 47 94 09 64 05
E: 25.801230 6 01 4f ec 08 54 07
E: 25.802879 6 01 07 b8 0a 9c 04
E: 25.805234 6 01 0f 8c 0c d4 04
E: 25.807269 6 01 17 30 08 e0 09
E: 25.810197 6 01 1f 00 06 7c 06
E: 25.812276 6 01 27 a4 03 58 08
E: 25.813780 6 01 2f 98 09 a4 0d
E: 25.816144 6 01 37 b4 04 d0 06
E: 25.818052 6 01 3f 00 03 20 0b
E: 25.819819 6 01 47 a0 09 68 05
E: 25.821820 6 01 07 c4 0a 9c 04
E: 25.823871 6 01 0f 98 0c d4 04
E: 25.826271 6 01 17 40 08 e4 09
E: 25.828861 6 01 1f 14 06 7c 06
E: 25.831173 6 01 27 b0 03 58 08
E: 25.832976 6 01 2f a4 09 a4 0d
E: 25.834869 6 01 37 c4 04 d0 06
E: 25.836873 6 01 3f 14 03 1c 0b
E: 25.838589 6 01 47 ac 09 68 05
E: 25.840676 6 01 07 d0 0a 9c 04
E: 25.842780 6 01 0f a8 0c d4 04
E: 25.845147 6 01 17 4c 08 e4 09
E: 25.847280 6 01 1f 20 06 7c 06
E: 25.850212 6 01 27 c0 03 58 08
E: 25.852250 6 01 2f b0 09 a4 0d
E: 25.853815 6 01 37 d4 04 d0 06
E: 25.856184 6 01 3f 28 03 18 0b
E: 25.858177 6 01 47 bc 09 64 05
E: 25.860106 6 01 4f 14 09 50 07
E: 25.862275 6 01 07 dc 0a 9c 04
E: 25.863843 6 01 0f b8 0c d0 04
E: 25.866153 6 01 17 58 08 e0 09
E: 25.868432 6 01 1f 30 06 7c 06
E: 25.870813 6 01 27 d0 03 54 08
E: 25.872795 6 01 2f c0 09 a0 0d
E: 25.874523 6 01 37 e0 04 d0 06
E: 25.876995 6 01 3f 3c 03 14 0b
E: 25.878735 6 01 47 c8 09 64 05
E: 25.881155 6 01 07 e4 0a 9c 04
E: 25.883077 6 01 0f c8 0c cc 04
E: 25.884831 6 01 17 64 08 e0 09
E: 25.887886 6 01 1f 40 06 78 06
E: 25.889838 6 01 27 dc 03 54 08
E: 25.892279 6 01 2f d0 09 9c 0d
E: 25.894210 6 01 37 f0 04 cc 06
E: 25.896158 6 01 3f 4c 03 10 0b
E: 25.898197 6 01 47 d8 09 60 05
E: 25.899819 6 01 4f 30 09 48 07
E: 25.902151 6 01 07 f0 0a 98 04
E: 25.903867 6 01 0f d8 0c c4 04
E: 25.906123 6 01 17 70 08 dc 09
E: 25.908467 6 01 1f 4c 06 78 06
E: 25.910883 6 01 27 ec 03 4c 08
E: 25.912865 6 01 2f dc 09 98 0d
E: 25.914452 6 01 37 fc 04 cc 06
E: 25.916708 6 01 3f 58 03 08 0b
E: 25.918485 6 01 47 e4 09 5c 05
E: 25.920845 6 01 4f 40 09 40 07
E: 25.922921 6 01 07 00 0b 94 04
E: 25.924524 6 01 0f e8 0c c0 04
E: 25.926877 6 01 17 7c 08 d4 09
E: 25.929585 6 01 1f 5c 06 70 06
E: 25.931958 6 01 27 f8 03 48 08
E: 25.933947 6 01 2f ec 09 94 0d
E: 25.935668 6 01 37 08 05 c8 06
E: 25.938108 6 01 3f 68 03 00 0b
E: 25.939810 6 01 47 f4 09 54 05
E: 25.942233 6 01 07 14 0b 8c 04
E: 25.944148 6 01 0f f8 0c b8 04
E: 25.945860 6 01 17 8c 08 cc 09
E: 25.948544 6 01 1f 68 06 68 06
E: 25.950619 6 01 27 04 04 44 08
E: 25.952655 6 01 2f fc 09 8c 0d
E: 25.954319 6 01 37 14 05 c0 06
E: 25.956772 6 01 3f 74 03 f4 0a
E: 25.958516 6 01 47 04 0a 4c 05
E: 25.960905 6 01 07 20 0b 84 04
E: 25.962886 6 01 0f 04 0d b0 04
E: 25.964456 6 01 17 9c 08 c4 09
E: 25.968136 6 01 1f 78 06 60 06
E: 25.969783 6 01 27 14 04 3c 08
E: 25.972187 6 01 2f 0c 0a 80 0d
E: 25.974187 6 01 37 24 05 b8 06
E: 25.975784 6 01 3f 80 03 ec 0a
E: 25.977772 6 01 47 18 0a 40 05
E: 25.979522 6 01 4f 74 09 20 07
E: 25.981979 6 01 07 34 0b 78 04
E: 25.983945 6 01 0f 18 0d a4 04
E: 25.985859 6 01 17 ac 08 b4 09
E: 25.988591 6 01 1f 88 06 50 06
E: 25.990990 6 01 27 20 04 30 08
E: 25.992877 6 01 2f 18 0a 78 0d
E: 25.994485 6 01 37 34 05 b0 06
E: 25.996574 6 01 3f 90 03 dc 0a
E: 25.998556 6 01 47 24 0a 30 05
E: 26.000588 6 01 07 44 0b 6c 04
E: 26.002659 6 01 0f 24 0d 98 04
E: 26.004299 6 01 17 bc 08 a8 09
E: 26.007883 6 01 1f 98 06 44 06
E: 26.009766 6 01 27 34 04 20 08
E: 26.011776 6 01 2f 24 0a 6c 0d
E: 26.014164 6 01 37 44 05 a0 06
E: 26.016138 6 01 3f a0 03 cc 0a
E: 26.018127 6 01 47 34 0a 24 05
E: 26.019640 6 01 07 50 0b 5c 04
E: 26.021631 6 01 0f 34 0d 8c 04
E: 26.023319 6 01 17 cc 08 94 09
E: 26.026317 6 01 1f ac 06 34 06
E: 26.028452 6 01 27 44 04 10 08
E: 26.031012 6 01 2f 30 0a 60 0d
E: 26.032791 6 01 37 58 05 8c 06
E: 26.034523 6 01 3f b0 03 b8 0a
E: 26.037013 6 01 47 40 0a 18 05
E: 26.038883 6 01 4f 9c 09 f4 06
E: 26.041319 6 01 07 60 0b 50 04
E: 26.043041 6 01 0f 40 0d 7c 04
E: 26.044383 6 01 17 dc 08 80 09
E: 26.047737 6 01 1f bc 06 20 06
E: 26.049758 6 01 27 5c 04 f4 07
E: 26.052155 6 01 2f 40 0a 50 0d
E: 26.054134 6 01 37 70 05 74 06
E: 26.056625 6 01 3f c4 03 9c 0a
E: 26.058754 6 01 47 4c 0a 0c 05
E: 26.061202 6 01 07 68 0b 48 04
E: 26.063125 6 01 0f 50 0d 70 04
E: 26.064805 6 01 17 f0 08 64 09
E: 26.067913 6 01 1f d4 06 04 06
E: 26.069745 6 01 27 70 04 d8 07
E: 26.072168 6 01 2f 4c 0a 44 0d
E: 26.074190 6 01 37 90 05 50 06
E: 26.076114 6 01 3f d8 03 74 0a
E: 26.077936 6 01 47 5c 0a fc 04
E: 26.079544 6 01 07 74 0b 38 04
E: 26.081900 6 01 0f 60 0d 64 04
E: 26.083942 6 01 17 04 09 4c 09
E: 26.086550 6 01 1f ec 06 e0 05
E: 26.088737 6 01 27 80 04 bc 07
E: 26.091172 6 01 2f 54 0a 34 0d
E: 26.092736 6 01 37 a8 05 30 06
E: 26.094790 6 01 3f ec 03 54 0a
E: 26.097084 6 01 47 68 0a ec 04
E: 26.098735 6 01 4f c0 09 c4 06
E: 26.101127 6 01 07 84 0b 2c 04
E: 26.103196 6 01 0f 6c 0d 54 04
E: 26.104677 6 01 17 18 09 34 09
E: 26.107720 6 01 1f 04 07 c4 05
E: 26.109729 6 01 27 98 04 9c 07
E: 26.112121 6 01 2f 60 0a 24 0d
E: 26.114062 6 01 37 bc 05 10 06
E: 26.115713 6 01 3f 04 04 2c 0a
E: 26.118139 6 01 47 74 0a d8 04
E: 26.119712 6 01 4f cc 09 b4 06
E: 26.122169 6 01 07 8c 0b 1c 04
E: 26.123673 6 01 0f 7c 0d 48 04
E: 26.125666 6 01 17 28 09 1c 09
E: 26.128282 6 01 1f 1c 07 a4 05
E: 26.130494 6 01 27 b0 04 78 07
E: 26.132937 6 01 2f 6c 0a 14 0d
E: 26.134448 6 01 37 cc 05 f8 05
E: 26.136450 6 01 3f 14 04 0c 0a
E: 26.139148 6 01 47 84 0a c4 04
E: 26.140716 6 01 07 98 0b 0c 04
E: 26.143129 6 01 0f 88 0d 3c 04
E: 26.145050 6 01 17 3c 09 fc 08
E: 26.147771 6 01 1f 2c 07 88 05
E: 26.149726 6 01 27 bc 04 60 07
E: 26.152085 6 01 2f 74 0a 00 0d
E: 26.153973 6 01 37 dc 05 dc 05
E: 26.155747 6 01 3f 24 04 f0 09
E: 26.158046 6 01 47 94 0a b4 04
E: 26.159828 6 01 07 a8 0b 00 04
E: 26.161952 6 01 0f 90 0d 34 04
E: 26.163851 6 01 17 4c 09 e0 08
E: 26.166928 6 01 1f 3c 07 70 05
E: 26.168508 6 01 27 cc 04 44 07
E: 26.170198 6 01 2f 80 0a f0 0c
E: 26.172541 6 01 37 f0 05 c0 05
E: 26.174582 6 01 3f 34 04 d4 09
E: 26.176596 6 01 47 a4 0a a0 04
E: 26.178280 6 01 07 b8 0b f0 03
E: 26.180420 6 01 0f 9c 0d 28 04
E: 26.182595 6 01 17 5c 09 c8 08
E: 26.185258 6 01 1f 54 07 4c 05
E: 26.187605 6 01 27 e0 04 20 07
E: 26.189389 6 01 2f 8c 0a dc 0c
E: 26.191501 6 01 37 04 06 a0 05
E: 26.193905 6 01 3f 40 04 b4 09
E: 26.195534 6 01 47 b4 0a 8c 04
E: 26.197924 6 01 4f 08 0a 5c 06
E: 26.199959 6 01 07 cc 0b dc 03
E: 26.201677 6 01 0f a8 0d 1c 04
E: 26.204093 6 01 17 70 09 ac 08
E: 26.207099 6 01 1f 6c 07 2c 05
E: 26.209078 6 01 27 f8 04 fc 06
E: 26.210721 6 01 2f 9c 0a c8 0c
E: 26.212677 6 01 37 1c 06 80 05
E: 26.215126 6 01 3f 58 04 90 09
E: 26.217004 6 01 47 c4 0a 7c 04
E: 26.218674 6 01 07 e0 0b c4 03
E: 26.220419 6 01 0f b4 0d 10 04
E: 26.222317 6 01 17 84 09 94 08
E: 26.225365 6 01 1f 7c 07 18 05
E: 26.227807 6 01 27 08 05 e0 06
E: 26.229840 6 01 2f a8 0a b4 0c
E: 26.231629 6 01 37 2c 06 68 05
E: 26.233534 6 01 3f 6c 04 6c 09
E: 26.235210 6 01 47 d4 0a 68 04
E: 26.237673 6 01 4f 28 0a 3c 06
E: 26.239352 6 01 07 f0 0b b8 03
E: 26.241817 6 01 0f c4 0d 04 04
E: 26.243040 6 01 17 94 09 80 08
E: 26.246795 6 01 1f 90 07 00 05
E: 26.248329 6 01 27 18 05 c4 06
E: 26.250338 6 01 2f b8 0a a4 0c
E: 26.252481 6 01 37 40 06 50 05
E: 26.254382 6 01 3f 78 04 50 09
E: 26.256514 6 01 47 e4 0a 5c 04
E: 26.259178 6 01 07 00 0c a8 03
E: 26.260675 6 01 0f d4 0d fc 03
E: 26.262941 6 01 17 a4 09 70 08
E: 26.265319 6 01 1f a4 07 e8 04
E: 26.267302 6 01 27 2c 05 ac 06
E: 26.269601 6 01 2f c4 0a 90 0c
E: 26.271645 6 01 37 50 06 38 05
E: 26.273419 6 01 3f 8c 04 34 09
E: 26.274946 6 01 47 f4 0a 4c 04
E: 26.277973 6 01 4f 44 0a 20 06
E: 26.279425 6 01 07 10 0c a0 03
E: 26.281002 6 01 0f e0 0d f4 03
E: 26.283438 6 01 17 b4 09 60 08
E: 26.286436 6 01 1f b8 07 d4 04
E: 26.288458 6 01 27 44 05 8c 06
E: 26.290118 6 01 2f d0 0a 84 0c
E: 26.292474 6 01 37 64 06 20 05
E: 26.295038 6 01 3f 9c 04 1c 09
E: 26.296793 6 01 47 04 0b 40 04
E: 26.298155 6 01 07 1c 0c 98 03
E: 26.300149 6 01 0f ec 0d ec 03
E: 26.302144 6 01 17 c4 09 50 08
E: 26.305206 6 01 1f d0 07 c0 04
E: 26.307459 6 01 27 54 05 74 06
E: 26.309267 6 01 2f dc 0a 78 0c
E: 26.312191 6 01 37 78 06 0c 05
E: 26.314074 6 01 3f ac 04 00 09
E: 26.315687 6 01 47 10 0b 38 04
E: 26.317531 6 01 4f 60 0a 04 06
E: 26.319763 6 01 07 28 0c 94 03
E: 26.321411 6 01 0f fc 0d e8 03
E: 26.323444 6 01 17 d0 09 44 08
E: 26.326194 6 01 1f e0 07 b4 04
E: 26.328531 6 01 27 68 05 60 06
E: 26.330860 6 01 2f e4 0a 6c 0c
E: 26.332095 6 01 37 88 06 fc 04
E: 26.334289 6 01 3f c0 04 e8 08
E: 26.336018 6 01 47 20 0b 2c 04
E: 26.338617 6 01 07 34 0c 90 03
E: 26.341019 6 01 0f 08 0e e4 03
E: 26.342588 6 01 17 e0 09 38 08
E: 26.345618 6 01 1f f4 07 a8 04
E: 26.347600 6 01 27 78 05 50 06
E: 26.350011 6 01 2f f0 0a 64 0c
E: 26.351674 6 01 37 98 06 ec 04
E: 26.353985 6 01 3f d0 04 d0 08
E: 26.355611 6 01 47 2c 0b 24 04
E: 26.357631 6 01 07 3c 0c 8c 03
E: 26.359305 6 01 0f 14 0e e0 03
E: 26.361383 6 01 17 ec 09 30 08
E: 26.364433 6 01 1f 00 08 9c 04
E: 26.366431 6 01 27 84 05 40 06
E: 26.368469 6 01 2f f8 0a 5c 0c
E: 26.370571 6 01 37 a8 06 dc 04
E: 26.373061 6 01 3f dc 04 c0 08
E: 26.374993 6 01 47 3c 0b 1c 04
E: 26.376254 6 01 4f 8c 0a e4 05
E: 26.378231 6 01 07 48 0c 88 03
E: 26.380561 6 01 0f 20 0e dc 03
E: 26.382668 6 01 17 fc 09 28 08
E: 26.385315 6 01 1f 10 08 94 04
E: 26.387359 6 01 27 98 05 34 06
E: 26.389917 6 01 2f 00 0b 54 0c
E: 26.391932 6 01 37 b8 06 d4 04
E: 26.393403 6 01 3f ec 04 b0 08
E: 26.395836 6 01 47 48 0b 18 04
E: 26.397381 6 01 07 50 0c 84 03
E: 26.399646 6 01 0f 28 0e d8 03
E: 26.401709 6 01 17 08 0a 24 08
E: 26.404389 6 01 1f 20 08 90 04
E: 26.406416 6 01 27 a4 05 28 06
E: 26.408420 6 01 2f 08 0b 50 0c
E: 26.409857 6 01 37 c8 06 c8 04
E: 26.411890 6 01 3f fc 04 a0 08
E: 26.414216 6 01 47 50 0b 14 04
E: 26.416033 6 01 4f a0 0a d8 05
E: 26.418310 6 01 07 60 0c 80 03
E: 26.420386 6 01 0f 34 0e d8 03
E: 26.421990 6 01 17 14 0a 20 08
E: 26.424925 6 01 1f 2c 08 8c 04
E: 26.427084 6 01 27 b4 05 20 06
E: 26.429037 6 01 2f 14 0b 48 0c
E: 26.431450 6 01 37 d8 06 c0 04
E: 26.433067 6 01 3f 08 05 94 08
E: 26.435497 6 01 47 60 0b 10 04
E: 26.437119 6 01 07 6c 0c 80 03
E: 26.439204 6 01 0f 40 0e d8 03
E: 26.441414 6 01 17 1c 0a 1c 08
E: 26.446659 6 01 1f 38 08 88 04
E: 26.448594 6 01 27 c4 05 14 06
E: 26.450610 6 01 2f 20 0b 44 0c
E: 26.452613 6 01 37 ec 06 b8 04
E: 26.455031 6 01 3f 14 05 88 08
E: 26.456760 6 01 47 6c 0b 08 04
E: 26.458446 6 01 07 78 0c 7c 03
E: 26.460061 6 01 0f 4c 0e d8 03
E: 26.462093 6 01 17 28 0a 20 08
E: 26.465155 6 01 1f 48 08 84 04
E: 26.467083 6 01 27 d4 05 0c 06
E: 26.469575 6 01 2f 28 0b 3c 0c
E: 26.471653 6 01 37 fc 06 b4 04
E: 26.473381 6 01 3f 24 05 84 08
E: 26.475764 6 01 47 78 0b 08 04
E: 26.477370 6 01 07 88 0c 7c 03
E: 26.479887 6 01 0f 58 0e d8 03
E: 26.481936 6 01 17 30 0a 20 08
E: 26.484577 6 01 1f 54 08 84 04
E: 26.487014 6 01 27 e4 05 04 06
E: 26.488792 6 01 2f 30 0b 38 0c
E: 26.490558 6 01 37 0c 07 b0 04
E: 26.492129 6 01 3f 30 05 7c 08
E: 26.494585 6 01 47 84 0b 04 04
E: 26.496212 6 01 07 98 0c 78 03
E: 26.498535 6 01 0f 64 0e d8 03
E: 26.500295 6 01 17 3c 0a 20 08
E: 26.503755 6 01 1f 60 08 84 04
E: 26.505789 6 01 27 f4 05 00 06
E: 26.507465 6 01 2f 38 0b 34 0c
E: 26.509654 6 01 37 18 07 b0 04
E: 26.511320 6 01 3f 3c 05 74 08
E: 26.513756 6 01 47 94 0b 00 04
E: 26.515682 6 01 4f e0 0a c4 05
E: 26.517366 6 01 07 a4 0c 78 03
E: 26.518992 6 01 0f 70 0e d8 03
E: 26.522070 6 01 17 48 0a 28 08
E: 26.524559 6 01 1f 70 08 84 04
E: 26.527004 6 01 27 04 06 fc 05
E: 26.528548 6 01 2f 44 0b 30 0c
E: 26.530553 6 01 37 24 07 b0 04
E: 26.532547 6 01 3f 4c 05 70 08
E: 26.534955 6 01 47 a0 0b fc 03
E: 26.536879 6 01 07 b0 0c 78 03
E: 26.538552 6 01 0f 80 0e dc 03
E: 26.541015 6 01 17 5c 0a 2c 08
E: 26.543181 6 01 1f 80 08 88 04
E: 26.545586 6 01 27 10 06 fc 05
E: 26.547263 6 01 2f 4c 0b 30 0c
E: 26.548920 6 01 37 34 07 ac 04
E: 26.551389 6 01 3f 58 05 6c 08
E: 26.553003 6 01 47 ac 0b fc 03
E: 26.555505 6 01 4f f4 0a c4 05
E: 26.557432 6 01 07 bc 0c 7c 03
E: 26.559081 6 01 0f 90 0e e0 03
E: 26.561447 6 01 17 70 0a 38 08
E: 26.564478 6 01 1f 98 08 8c 04
E: 26.566590 6 01 27 20 06 f8 05
E: 26.568146 6 01 2f 58 0b 2c 0c
E: 26.570608 6 01 37 44 07 b0 04
E: 26.572531 6 01 3f 64 05 68 08
E: 26.574626 6 01 47 b8 0b fc 03
E: 26.576661 6 01 07 cc 0c 7c 03
E: 26.578324 6 01 0f a4 0e e4 03
E: 26.580678 6 01 17 84 0a 40 08
E: 26.583212 6 01 1f a8 08 90 04
E: 26.585531 6 01 27 30 06 f8 05
E: 26.587563 6 01 2f 60 0b 2c 0c
E: 26.589218 6 01 37 54 07 b0 04
E: 26.591694 6 01 3f 70 05 64 08
E: 26.593213 6 01 47 c8 0b 00 04
E: 26.596311 6 01 4f 0c 0b c4 05
E: 26.598370 6 01 07 dc 0c 80 03
E: 26.600818 6 01 0f b4 0e ec 03
E: 26.602509 6 01 17 98 0a 50 08
E: 26.604519 6 01 1f c0 08 98 04
E: 26.607560 6 01 27 40 06 f8 05
E: 26.609899 6 01 2f 6c 0b 2c 0c
E: 26.611896 6 01 37 6c 07 b4 04
E: 26.613503 6 01 3f 80 05 64 08
E: 26.615864 6 01 47 d8 0b 04 04
E: 26.617884 6 01 07 f0 0c 84 03
E: 26.619925 6 01 0f c8 0e f4 03
E: 26.621946 6 01 17 ac 0a 60 08
E: 26.624562 6 01 1f dc 08 a4 04
E: 26.626945 6 01 27 50 06 f8 05
E: 26.628381 6 01 2f 78 0b 2c 0c
E: 26.630635 6 01 37 80 07 bc 04
E: 26.632665 6 01 3f 8c 05 64 08
E: 26.634235 6 01 47 ec 0b 08 04
E: 26.636139 6 01 07 04 0d 8c 03
E: 26.638542 6 01 0f dc 0e 00 04
E: 26.640201 6 01 17 c0 0a 70 08
E: 26.643184 6 01 1f f0 08 b0 04
E: 26.645408 6 01 27 64 06 fc 05
E: 26.647765 6 01 2f 80 0b 2c 0c
E: 26.649632 6 01 37 94 07 c8 04
E: 26.651344 6 01 3f 98 05 64 08
E: 26.653756 6 01 47 00 0c 10 04
E: 26.655440 6 01 07 1c 0d 9c 03
E: 26.657971 6 01 0f ec 0e 0c 04
E: 26.659459 6 01 17 d0 0a 80 08
E: 26.662487 6 01 1f 04 09 c0 04
E: 26.664529 6 01 27 78 06 00 06
E: 26.666855 6 01 2f 8c 0b 30 0c
E: 26.668659 6 01 37 b0 07 d0 04
E: 26.670568 6 01 3f a4 05 64 08
E: 26.672665 6 01 47 14 0c 18 04
E: 26.674251 6 01 4f 4c 0b d0 05
E: 26.676669 6 01 07 34 0d a8 03
E: 26.678364 6 01 0f fc 0e 18 04
E: 26.680795 6 01 17 e0 0a 94 08
E: 26.683446 6 01 1f 20 09 d4 04
E: 26.685466 6 01 27 88 06 04 06
E: 26.687823 6 01 2f 9c 0b 38 0c
E: 26.689479 6 01 37 c4 07 dc 04
E: 26.691962 6 01 3f b4 05 64 08
E: 26.693889 6 01 47 24 0c 20 04
E: 26.695519 6 01 07 44 0d b4 03
E: 26.697517 6 01 0f 0c 0f 28 04
E: 26.699235 6 01 17 ec 0a a8 08
E: 26.702285 6 01 1f 34 09 e8 04
E: 26.704271 6 01 27 a0 06 0c 06
E: 26.706326 6 01 2f ac 0b 40 0c
E: 26.708459 6 01 37 dc 07 e8 04
E: 26.710844 6 01 3f c0 05 6c 08
E: 26.712867 6 01 47 38 0c 2c 04
E: 26.714423 6 01 4f 78 0b e8 05
E: 26.716516 6 01 07 54 0d c0 03
E: 26.718465 6 01 0f 1c 0f 38 04
E: 26.720938 6 01 17 00 0b c4 08
E: 26.723863 6 01 1f 44 09 f8 04
E: 26.725906 6 01 27 b4 06 14 06
E: 26.727801 6 01 2f bc 0b 48 0c
E: 26.729462 6 01 37 f0 07 f4 04
E: 26.731954 6 01 3f d4 05 70 08
E: 26.733476 6 01 47 44 0c 38 04
E: 26.735868 6 01 07 60 0d cc 03
E: 26.737855 6 01 0f 28 0f 4c 04
E: 26.739452 6 01 17 10 0b dc 08
E: 26.742503 6 01 1f 58 09 10 05
E: 26.744490 6 01 27 c8 06 20 06
E: 26.746549 6 01 2f cc 0b 54 0c
E: 26.748145 6 01 37 08 08 0c 05
E: 26.750631 6 01 3f e8 05 7c 08
E: 26.752565 6 01 47 58 0c 48 04
E: 26.754193 6 01 4f 94 0b 00 06
E: 26.756525 6 01 07 70 0d e0 03
E: 26.758243 6 01 0f 34 0f 5c 04
E: 26.760074 6 01 17 20 0b f8 08
E: 26.763057 6 01 1f 68 09 24 05
E: 26.765551 6 01 27 dc 06 2c 06
E: 26.767511 6 01 2f d8 0b 64 0c
E: 26.769116 6 01 37 1c 08 24 05
E: 26.771210 6 01 3f 00 06 88 08
E: 26.773667 6 01 47 68 0c 5c 04
E: 26.775575 6 01 07 7c 0d ec 03
E: 26.777696 6 01 0f 40 0f 6c 04
E: 26.779195 6 01 17 28 0b 10 09
E: 26.782299 6 01 1f 78 09 34 05
E: 26.784450 6 01 27 f8 06 40 06
E: 26.786846 6 01 2f e8 0b 70 0c
E: 26.788425 6 01 37 2c 08 34 05
E: 26.790855 6 01 3f 14 06 94 08
E: 26.792848 6 01 47 74 0c 6c 04
E: 26.794484 6 01 07 88 0d 00 04
E: 26.796821 6 01 0f 48 0f 7c 04
E: 26.798407 6 01 17 38 0b 2c 09
E: 26.800842 6 01 1f 88 09 50 05
E: 26.803448 6 01 27 08 07 50 06
E: 26.805740 6 01 2f f4 0b 80 0c
E: 26.807886 6 01 37 3c 08 44 05
E: 26.809413 6 01 3f 24 06 a0 08
E: 26.811896 6 01 47 80 0c 78 04
E: 26.813641 6 01 4f c0 0b 34 06
E: 26.815543 6 01 07 94 0d 10 04
E: 26.817591 6 01 0f 4c 0f 90 04
E: 26.819331 6 01 17 44 0b 44 09
E: 26.822377 6 01 1f 98 09 6c 05
E: 26.824827 6 01 27 1c 07 60 06
E: 26.826754 6 01 2f fc 0b 90 0c
E: 26.828383 6 01 37 48 08 58 05
E: 26.830406 6 01 3f 34 06 ac 08
E: 26.832855 6 01 47 8c 0c 8c 04
E: 26.834403 6 01 07 9c 0d 20 04
E: 26.836761 6 01 0f 54 0f a4 04
E: 26.838501 6 01 17 4c 0b 5c 09
E: 26.841414 6 01 1f a4 09 80 05
E: 26.843907 6 01 27 28 07 6c 06
E: 26.845454 6 01 2f 08 0c a4 0c
E: 26.847830 6 01 37 54 08 6c 05
E: 26.849832 6 01 3f 40 06 b8 08
E: 26.851896 6 01 47 94 0c a0 04
E: 26.853845 6 01 4f d4 0b 54 06
E: 26.855449 6 01 07 a4 0d 34 04
E: 26.857861 6 01 0f 58 0f b8 04
E: 26.859382 6 01 17 50 0b 74 09
E: 26.862389 6 01 1f b0 09 94 05
E: 26.864819 6 01 27 34 07 7c 06
E: 26.866908 6 01 2f 10 0c b4 0c
E: 26.868560 6 01 37 64 08 80 05
E: 26.870459 6 01 3f 4c 06 c8 08
E: 26.872465 6 01 47 9c 0c b0 04
E: 26.874402 6 01 07 ac 0d 48 04
E: 26.876014 6 01 0f 5c 0f d0 04
E: 26.878212 6 01 17 58 0b 8c 09
E: 26.881268 6 01 1f b8 09 ac 05
E: 26.883767 6 01 27 40 07 8c 06
E: 26.885728 6 01 2f 14 0c c4 0c
E: 26.887660 6 01 37 6c 08 94 05
E: 26.889367 6 01 3f 58 06 d8 08
E: 26.891379 6 01 47 a0 0c c4 04
E: 26.893838 6 01 4f e0 0b 80 06
E: 26.895821 6 01 07 b4 0d 5c 04
E: 26.897828 6 01 0f 5c 0f e4 04
E: 26.899362 6 01 17 60 0b a4 09
E: 26.902806 6 01 1f c4 09 c4 05
E: 26.904843 6 01 27 48 07 9c 06
E: 26.906422 6 01 2f 18 0c d4 0c
E: 26.908360 6 01 37 78 08 a8 05
E: 26.910808 6 01 3f 60 06 e4 08
E: 26.912827 6 01 47 a8 0c dc 04
E: 26.914362 6 01 4f e4 0b 94 06
E: 26.916410 6 01 07 b8 0d 74 04
E: 26.918764 6 01 0f 5c 0f f8 04
E: 26.920741 6 01 17 64 0b c0 09
E: 26.923273 6 01 1f cc 09 d8 05
E: 26.925372 6 01 27 54 07 ac 06
E: 26.927382 6 01 2f 1c 0c e4 0c
E: 26.928959 6 01 37 80 08 c0 05
E: 26.931009 6 01 3f 68 06 f0 08
E: 26.933436 6 01 47 ac 0c f0 04
E: 26.935581 6 01 07 bc 0d 88 04
E: 26.937651 6 01 0f 58 0f 14 05
E: 26.939288 6 01 17 68 0b d4 09
E: 26.942287 6 01 1f d0 09 ec 05
E: 26.944803 6 01 27 5c 07 b8 06
E: 26.946340 6 01 2f 20 0c f8 0c
E: 26.948340 6 01 37 88 08 d0 05
E: 26.950345 6 01 3f 70 06 fc 08
E: 26.952344 6 01 47 ac 0c 04 05
E: 26.954816 6 01 07 bc 0d 9c 04
E: 26.956385 6 01 0f 44 0f 38 05
E: 26.958345 6 01 17 6c 0b ec 09
E: 26.961308 6 01 1f d8 09 04 06
E: 26.963774 6 01 27 64 07 c8 06
E: 26.965811 6 01 2f 20 0c 08 0d
E: 26.967332 6 01 37 90 08 e4 05
E: 26.969339 6 01 3f 74 06 0c 09
E: 26.971378 6 01 47 ac 0c 18 05
E: 26.973809 6 01 4f e8 0b d8 06
E: 26.975850 6 01 07 bc 0d b0 04
E: 26.977749 6 01 17 6c 0b 00 0a
E: 26.979646 6 01 1f dc 09 18 06
E: 26.981255 6 01 27 6c 07 d8 06
E: 26.984526 6 01 07 bc 0d c4 04
E: 26.986070 6 01 17 70 0b 14 0a
E: 26.989165 6 01 1f e4 09 2c 06
E: 26.991203 6 01 27 74 07 ec 06
E: 26.994698 6 01 2f 20 0c 28 0d
E: 26.996295 6 01 37 9c 08 08 06
E: 26.998606 6 01 3f 84 06 2c 09
E: 27.000556 6 01 47 a8 0c 50 05
E: 27.002675 6 01 4f e4 0b 0c 07
E: 27.006097 6 01 07 b8 0d dc 04
E: 27.008615 6 01 0f 1c 0f 84 05
E: 27.010907 6 01 17 74 0b 24 0a
E: 27.014318 6 01 1f e8 09 40 06
E: 27.016851 6 01 27 7c 07 f8 06
E: 27.018899 6 01 07 b8 0d f4 04
E: 27.020589 6 01 0f 0c 0f b4 05
E: 27.023595 6 01 17 74 0b 34 0a
E: 27.026063 6 01 1f ec 09 50 06
E: 27.029313 6 01 27 80 07 04 07
E: 27.031846 6 01 2f 1c 0c 50 0d
E: 27.033840 6 01 07 b0 0d 0c 05
E: 27.035295 6 01 0f fc 0e d0 05
E: 27.037294 6 01 17 74 0b 40 0a
E: 27.040311 6 01 1f f4 09 60 06
E: 27.042367 6 01 27 88 07 10 07
E: 27.044682 6 01 2f 18 0c 64 0d
E: 27.046201 6 01 37 b0 08 3c 06
E: 27.048567 6 01 3f 94 06 4c 09
E: 27.050486 6 01 47 94 0c b0 05
E: 27.052039 6 01 4f d4 0b 64 07
E: 27.054504 6 01 07 ac 0d 24 05
E: 27.056502 6 01 0f f0 0e e8 05
E: 27.058210 6 01 17 78 0b 50 0a
E: 27.060703 6 01 1f f8 09 70 06
E: 27.063121 6 01 27 8c 07 1c 07
E: 27.065183 6 01 2f 14 0c 80 0d
E: 27.066613 6 01 37 b4 08 48 06
E: 27.068702 6 01 3f 98 06 58 09
E: 27.071153 6 01 47 88 0c d4 05
E: 27.073202 6 01 07 a4 0d 44 05
E: 27.075117 6 01 0f e8 0e f8 05
E: 27.076768 6 01 17 78 0b 60 0a
E: 27.080282 6 01 1f fc 09 80 06
E: 27.082329 6 01 27 90 07 28 07
E: 27.084269 6 01 2f 0c 0c a0 0d
E: 27.085964 6 01 37 b8 08 54 06
E: 27.088069 6 01 3f a0 06 64 09
E: 27.090547 6 01 47 7c 0c f8 05
E: 27.092553 6 01 4f c0 0b b0 07
E: 27.094601 6 01 07 98 0d 68 05
E: 27.096096 6 01 0f dc 0e 10 06
E: 27.098196 6 01 17 7c 0b 70 0a
E: 27.101145 6 01 1f 00 0a 94 06
E: 27.103184 6 01 27 94 07 34 07
E: 27.105615 6 01 2f 08 0c bc 0d
E: 27.107253 6 01 37 bc 08 60 06
E: 27.109736 6 01 3f a4 06 70 09
E: 27.111271 6 01 47 70 0c 18 06
E: 27.113335 6 01 07 8c 0d 84 05
E: 27.115777 6 01 0f d4 0e 24 06
E: 27.117699 6 01 17 7c 0b 7c 0a
E: 27.120182 6 01 1f 04 0a a0 06
E: 27.122732 6 01 27 9c 07 44 07
E: 27.124703 6 01 2f 00 0c d4 0d
E: 27.126410 6 01 37 c0 08 74 06
E: 27.127950 6 01 3f a8 06 7c 09
E: 27.129988 6 01 47 64 0c 38 06
E: 27.132081 6 01 07 84 0d 9c 05
E: 27.134432 6 01 0f c8 0e 34 06
E: 27.136664 6 01 17 7c 0b 8c 0a
E: 27.138202 6 01 1f 08 0a b4 06
E: 27.141734 6 01 27 a4 07 54 07
E: 27.143213 6 01 2f 00 0c e8 0d
E: 27.145599 6 01 37 c8 08 84 06
E: 27.147199 6 01 3f ac 06 88 09
E: 27.149562 6 01 47 60 0c 4c 06
E: 27.151684 6 01 4f a4 0b 08 08
E: 27.153682 6 01 07 7c 0d b0 05
E: 27.155596 6 01 0f c0 0e 44 06
E: 27.157402 6 01 17 7c 0b 9c 0a
E: 27.160434 6 01 1f 0c 0a c4 06
E: 27.162449 6 01 27 a8 07 60 07
E: 27.163947 6 01 2f f8 0b fc 0d
E: 27.166507 6 01 37 cc 08 94 06
E: 27.168064 6 01 3f b0 06 94 09
E: 27.170460 6 01 47 58 0c 5c 06
E: 27.172504 6 01 07 74 0d c0 05
E: 27.174015 6 01 0f b8 0e 50 06
E: 27.176409 6 01 17 80 0b ac 0a
E: 27.179000 6 01 1f 10 0a d8 06
E: 27.181454 6 01 27 ac 07 6c 07
E: 27.183469 6 01 2f f8 0b 0c 0e
E: 27.185406 6 01 37 d0 08 a0 06
E: 27.187439 6 01 3f b4 06 a0 09
E: 27.188996 6 01 47 50 0c 6c 06
E: 27.191742 6 01 4f 98 0b 30 08
E: 27.192933 6 01 07 6c 0d d4 05
E: 27.195281 6 01 0f b4 0e 60 06
E: 27.197383 6 01 17 80 0b bc 0a
E: 27.200320 6 01 1f 14 0a e8 06
E: 27.202356 6 01 27 b0 07 78 07
E: 27.203922 6 01 2f f4 0b 18 0e
E: 27.206431 6 01 37 d4 08 ac 06
E: 27.208407 6 01 3f bc 06 ac 09
E: 27.210370 6 01 47 48 0c 80 06
E: 27.212599 6 01 07 68 0d e8 05
E: 27.214029 6 01 0f ac 0e 6c 06
E: 27.216064 6 01 17 80 0b cc 0a
E: 27.219150 6 01 1f 18 0a f4 06
E: 27.221658 6 01 27 b8 07 88 07
E: 27.223635 6 01 2f f4 0b 28 0e
E: 27.225571 6 01 37 d8 08 bc 06
E: 27.227011 6 01 3f c0 06 b4 09
E: 27.229117 6 01 47 44 0c 94 06
E: 27.231612 6 01 4f 8c 0b 5c 08
E: 27.233608 6 01 07 60 0d fc 05
E: 27.235526 6 01 0f a8 0e 7c 06
E: 27.237649 6 01 17 84 0b e0 0a
E: 27.240204 6 01 1f 1c 0a 08 07
E: 27.242772 6 01 27 bc 07 98 07
E: 27.244266 6 01 2f f0 0b 34 0e
E: 27.246691 6 01 37 e0 08 d0 06
E: 27.248191 6 01 3f c4 06 c4 09
E: 27.250187 6 01 47 40 0c a8 06
E: 27.252664 6 01 07 58 0d 10 06
E: 27.254248 6 01 0f a0 0e 8c 06
E: 27.256705 6 01 17 84 0b f4 0a
E: 27.259023 6 01 1f 20 0a 18 07
E: 27.261151 6 01 27 c0 07 a8 07
E: 27.263524 6 01 2f f0 0b 44 0e
E: 27.265531 6 01 37 e4 08 e4 06
E: 27.267459 6 01 3f c8 06 d0 09
E: 27.269099 6 01 47 3c 0c b8 06
E: 27.271760 6 01 4f 84 0b 84 08
E: 27.273699 6 01 07 50 0d 24 06
E: 27.275724 6 01 0f 9c 0e 9c 06
E: 27.277564 6 01 17 88 0b 08 0b
E: 27.280186 6 01 1f 24 0a 2c 07
E: 27.282697 6 01 27 c8 07 b8 07
E: 27.284223 6 01 2f f0 0b 54 0e
E: 27.286351 6 01 37 ec 08 f8 06
E: 27.288766 6 01 3f d0 06 e4 09
E: 27.290091 6 01 47 38 0c d0 06
E: 27.292602 6 01 07 4c 0d 3c 06
E: 27.294051 6 01 0f 98 0e b0 06
E: 27.296099 6 01 17 88 0b 1c 0b
E: 27.298750 6 01 1f 2c 0a 44 07
E: 27.300820 6 01 27 d0 07 c8 07
E: 27.303345 6 01 2f f0 0b 64 0e
E: 27.305393 6 01 37 f4 08 0c 07
E: 27.307286 6 01 3f d4 06 f0 09
E: 27.308916 6 01 47 34 0c e8 06
E: 27.311021 6 01 4f 7c 0b b4 08
E: 27.313594 6 01 07 48 0d 50 06
E: 27.315145 6 01 0f 90 0e c0 06
E: 27.317723 6 01 17 8c 0b 30 0b
E: 27.320009 6 01 1f 30 0a 5c 07
E: 27.322669 6 01 27 d8 07 e0 07
E: 27.324591 6 01 2f f0 0b 74 0e
E: 27.326093 6 01 37 f8 08 24 07
E: 27.328279 6 01 3f dc 06 04 0a
E: 27.329731 6 01 47 2c 0c fc 06
E: 27.331796 6 01 07 44 0d 68 06
E: 27.334363 6 01 0f 8c 0e d4 06
E: 27.335790 6 01 17 90 0b 4c 0b
E: 27.339632 6 01 1f 38 0a 78 07
E: 27.341349 6 01 27 e0 07 f4 07
E: 27.343250 6 01 2f f0 0b 84 0e
E: 27.344834 6 01 37 00 09 3c 07
E: 27.347294 6 01 3f e0 06 14 0a
E: 27.348866 6 01 47 2c 0c 14 07
E: 27.350771 6 01 07 3c 0d 7c 06
E: 27.353312 6 01 0f 8c 0e e8 06
E: 27.355148 6 01 17 94 0b 64 0b
E: 27.357853 6 01 1f 40 0a 94 07
E: 27.359947 6 01 27 e8 07 0c 08
E: 27.362122 6 01 2f f0 0b 98 0e
E: 27.364086 6 01 37 08 09 54 07
E: 27.366088 6 01 3f ec 06 2c 0a
E: 27.368141 6 01 47 28 0c 2c 07
E: 27.370192 6 01 4f 74 0b f4 08
E: 27.372189 6 01 07 3c 0d 90 06
E: 27.374137 6 01 0f 88 0e f8 06
E: 27.376173 6 01 17 98 0b 80 0b
E: 27.379149 6 01 1f 48 0a ac 07
E: 27.381189 6 01 27 f4 07 24 08
E: 27.383122 6 01 2f f0 0b a8 0e
E: 27.385176 6 01 37 10 09 6c 07
E: 27.387156 6 01 3f f4 06 40 0a
E: 27.389121 6 01 47 28 0c 40 07
E: 27.391120 6 01 07 38 0d a8 06
E: 27.393104 6 01 0f 84 0e 0c 07
E: 27.395011 6 01 17 9c 0b 98 0b
E: 27.397901 6 01 1f 50 0a c4 07
E: 27.400027 6 01 27 fc 07 3c 08
E: 27.402019 6 01 2f f4 0b bc 0e
E: 27.404121 6 01 37 1c 09 84 07
E: 27.406169 6 01 3f fc 06 58 0a
E: 27.408121 6 01 47 24 0c 54 07
E: 27.410192 6 01 4f 74 0b 20 09
E: 27.412112 6 01 07 34 0d c0 06
E: 27.414151 6 01 0f 84 0e 20 07
E: 27.416101 6 01 17 a0 0b b0 0b
E: 27.419007 6 01 1f 54 0a e0 07
E: 27.420924 6 01 27 04 08 54 08
E: 27.422956 6 01 2f f4 0b d4 0e
E: 27.424927 6 01 37 24 09 9c 07
E: 27.426969 6 01 3f 08 07 6c 0a
E: 27.428953 6 01 47 24 0c 68 07
E: 27.431028 6 01 07 34 0d d8 06
E: 27.432798 6 01 0f 84 0e 34 07
E: 27.434908 6 01 17 a4 0b c8 0b
E: 27.437983 6 01 1f 5c 0a f8 07
E: 27.440107 6 01 27 0c 08 68 08
E: 27.442182 6 01 2f f8 0b e8 0e
E: 27.444122 6 01 37 28 09 b4 07
E: 27.446076 6 01 3f 10 07 80 0a
E: 27.448091 6 01 47 24 0c 80 07
E: 27.450155 6 01 07 30 0d f4 06
E: 27.452119 6 01 0f 80 0e 48 07
E: 27.454143 6 01 17 a8 0b dc 0b
E: 27.458225 6 01 1f 64 0a 10 08
E: 27.460900 6 01 27 14 08 7c 08
E: 27.462701 6 01 2f 00 0c 00 0f
E: 27.465544 6 01 37 30 09 c8 07
E: 27.467599 6 01 3f 14 07 94 0a
E: 27.469631 6 01 47 28 0c 9c 07
E: 27.471307 6 01 07 30 0d 10 07
E: 27.473572 6 01 0f 80 0e 60 07
E: 27.475441 6 01 17 a8 0b f4 0b
E: 27.477489 6 01 1f 6c 0a 24 08
E: 27.479404 6 01 27 1c 08 90 08
E: 27.481217 6 01 2f 04 0c 1c 0f
E: 27.483139 6 01 37 34 09 e0 07
E: 27.484898 6 01 3f 20 07 ac 0a
E: 27.486662 6 01 47 28 0c b8 07
E: 27.488735 6 01 07 30 0d 28 07
E: 27.491209 6 01 0f 80 0e 7c 07
E: 27.493854 6 01 17 b0 0b 08 0c
E: 27.497105 6 01 1f 70 0a 38 08
E: 27.498780 6 01 27 24 08 a4 08
E: 27.500818 6 01 2f 0c 0c 34 0f
E: 27.502872 6 01 37 3c 09 f4 07
E: 27.505233 6 01 3f 24 07 c0 0a
E: 27.507158 6 01 47 28 0c d4 07
E: 27.509012 6 01 4f 7c 0b ac 09
E: 27.511275 6 01 07 30 0d 40 07
E: 27.513203 6 01 0f 80 0e 94 07
E: 27.515588 6 01 17 b0 0b 18 0c
E: 27.517629 6 01 1f 74 0a 4c 08
E: 27.520571 6 01 27 28 08 b8 08
E: 27.522617 6 01 2f 14 0c 48 0f
E: 27.524537 6 01 37 40 09 08 08
E: 27.526249 6 01 3f 2c 07 d4 0a
E: 27.528196 6 01 47 28 0c ec 07
E: 27.530205 6 01 07 30 0d 58 07
E: 27.532646 6 01 0f 84 0e a8 07
E: 27.534625 6 01 17 b4 0b 2c 0c
E: 27.537574 6 01 1f 78 0a 60 08
E: 27.539212 6 01 27 30 08 cc 08
E: 27.541263 6 01 2f 18 0c 58 0f
E: 27.543607 6 01 37 48 09 1c 08
E: 27.545629 6 01 3f 34 07 e8 0a
E: 27.547265 6 01 47 28 0c 04 08
E: 27.548894 6 01 4f 84 0b e4 09
E: 27.550999 6 01 07 30 0d 74 07
E: 27.552828 6 01 0f 84 0e bc 07
E: 27.554465 6 01 17 b8 0b 3c 0c
E: 27.556832 6 01 1f 7c 0a 70 08
E: 27.560337 6 01 27 38 08 e4 08
E: 27.562325 6 01 2f 1c 0c 64 0f
E: 27.564419 6 01 37 4c 09 30 08
E: 27.566465 6 01 3f 3c 07 fc 0a
E: 27.568143 6 01 47 2c 0c 20 08
E: 27.570159 6 01 07 30 0d 90 07
E: 27.572201 6 01 0f 84 0e d4 07
E: 27.574553 6 01 17 bc 0b 4c 0c
E: 27.576235 6 01 07 34 0d ac 07
E: 27.578478 6 01 27 48 08 18 09
E: 27.580250 6 01 2f 24 0c 78 0f
E: 27.582225 6 01 3f 48 07 14 0b
E: 27.584546 6 01 47 30 0c 44 08
E: 27.586648 6 01 4f 8c 0b 00 0a
E: 27.588075 6 01 27 50 08 2c 09
E: 27.611515 6 01 1e 8c 0a c0 08
E: 27.613002 6 01 36 64 09 80 08
E: 27.614933 6 01 4e 98 0b 4c 0a
E: 27.619865 6 01 0e 84 0e 3c 08
E: 27.622558 6 01 16 d0 0b 94 0c
E: 27.624546 6 01 2e 38 0c c4 0f
E: 27.626961 6 01 3e 68 07 5c 0b
E: 27.629921 6 01 46 38 0c ac 08
E: 27.632080 6 01 06 34 0d 10 08
E: 27.635586 6 01 26 6c 08 74 09
# Thank you.
