R: 248 05 0d 09 04 a1 01 85 01 09 22 a1 02 09 42 15 00 25 01 75 01 95 01 81 02 09 32 81 02 09 47 81 02 95 05 81 03 75 08 09 51 95 01 81 02 05 01 26 ff 7f 75 10 55 00 65 00 09 30 35 00 46 00 00 81 02 09 31 46 00 00 81 02 c0 a1 02 05 0d 09 42 15 00 25 01 75 01 95 01 81 02 09 32 81 02 09 47 81 02 95 05 81 03 75 08 09 51 95 01 81 02 05 01 26 ff 7f 75 10 55 00 65 00 09 30 35 00 46 00 00 81 02 09 31 46 00 00 81 02 c0 05 0d 09 54 95 01 75 08 15 00 25 08 81 02 09 55 b1 02 c0 09 0e a1 01 85 02 09 23 a1 02 09 52 09 53 15 00 25 0a 75 08 95 02 b1 02 c0 c0 05 01 09 02 a1 01 85 03 09 01 a1 00 05 09 19 01 29 03 15 00 25 01 95 03 75 01 81 02 95 01 75 05 81 01 05 01 09 30 09 31 15 00 26 ff 7f 75 10 95 02 81 02 05 01 09 38 15 81 25 7f 75 08 95 01 81 06 c0 c0
N: Touch Screen E4  S1.1
I: 3 2219 044c
# 1. Drag _one_ finger on the screen from one corner to the opposite, and release it.
E: 0.000000 14 01 07 2d 5a 01 91 7f ff ff ff ff ff ff 01
E: 0.011892 14 01 07 2d 58 01 b7 7f ff ff ff ff ff ff 01
E: 0.024887 14 01 07 2d 58 01 bb 7f ff ff ff ff ff ff 01
E: 0.037998 14 01 07 2d 58 01 c1 7f ff ff ff ff ff ff 01
E: 0.049860 14 01 07 2d 59 01 c7 7f ff ff ff ff ff ff 01
E: 0.062940 14 01 07 2d 5d 01 d5 7f ff ff ff ff ff ff 01
E: 0.074884 14 01 07 2d 63 01 e0 7f ff ff ff ff ff ff 01
E: 0.087851 14 01 07 2d 6a 01 e8 7f ff ff ff ff ff ff 01
E: 0.099934 14 01 07 2d 6d 01 ee 7f ff ff ff ff ff ff 01
E: 0.112907 14 01 07 2d 6f 01 f3 7f ff ff ff ff ff ff 01
E: 0.124859 14 01 07 2d 6f 01 f6 7f ff ff ff ff ff ff 01
E: 0.137859 14 01 07 2d 6d 01 f8 7f ff ff ff ff ff ff 01
E: 0.149840 14 01 07 2d 6a 01 f9 7f ff ff ff ff ff ff 01
E: 0.162857 14 01 07 2d 66 01 fa 7f ff ff ff ff ff ff 01
E: 0.174858 14 01 07 2d 63 01 fc 7f ff ff ff ff ff ff 01
E: 0.187928 14 01 07 2d 60 01 f7 7f ff ff ff ff ff ff 01
E: 0.199910 14 01 07 2d 5c 01 f9 7f ff ff ff ff ff ff 01
E: 0.212914 14 01 07 2d 5a 01 fb 7f ff ff ff ff ff ff 01
E: 0.224833 14 01 07 2d 58 01 fc 7f ff ff ff ff ff ff 01
E: 0.237860 14 01 07 2d 56 01 f9 7f ff ff ff ff ff ff 01
E: 0.250824 14 01 07 2d 54 01 f5 7f ff ff ff ff ff ff 01
E: 0.262900 14 01 07 2d 54 01 f8 7f ff ff ff ff ff ff 01
E: 0.275891 14 01 07 2d 53 01 fa 7f ff ff ff ff ff ff 01
E: 0.287898 14 01 07 2d 53 01 f7 7f ff ff ff ff ff ff 01
E: 0.300890 14 01 07 2d 52 01 f4 7f ff ff ff ff ff ff 01
E: 0.312846 14 01 07 2d 53 01 f6 7f ff ff ff ff ff ff 01
E: 0.325887 14 01 07 2d 55 01 f8 7f ff ff ff ff ff ff 01
E: 0.337885 14 01 07 2d 54 01 f6 7f ff ff ff ff ff ff 01
E: 0.350886 14 01 07 2d 55 01 f7 7f ff ff ff ff ff ff 01
E: 0.362885 14 01 07 2d 56 01 f9 7f ff ff ff ff ff ff 01
E: 0.375887 14 01 07 2d 57 01 fb 7f ff ff ff ff ff ff 01
E: 0.387886 14 01 07 2d 57 01 fc 7f ff ff ff ff ff ff 01
E: 0.400886 14 01 07 2d 58 01 fc 7f ff ff ff ff ff ff 01
E: 0.413886 14 01 07 2d 59 01 fc 7f ff ff ff ff ff ff 01
E: 0.425886 14 01 07 2d 5c 01 f3 7f ff ff ff ff ff ff 01
E: 0.438886 14 01 07 2d 60 01 db 7f ff ff ff ff ff ff 01
E: 0.450886 14 01 07 2d 69 01 b9 7f ff ff ff ff ff ff 01
E: 0.462887 14 01 07 2d 79 01 8c 7f ff ff ff ff ff ff 01
E: 0.475886 14 01 07 2d 8d 01 59 7f ff ff ff ff ff ff 01
E: 0.487887 14 01 07 2d a7 01 18 7f ff ff ff ff ff ff 01
E: 0.500887 14 01 07 2d ca 01 cc 7e ff ff ff ff ff ff 01
E: 0.512986 14 01 07 2d f3 01 87 7e ff ff ff ff ff ff 01
E: 0.524986 14 01 07 2d 29 02 2a 7e ff ff ff ff ff ff 01
E: 0.537887 14 01 07 2d 6b 02 c2 7d ff ff ff ff ff ff 01
E: 0.550000 14 01 07 2d b1 02 63 7d ff ff ff ff ff ff 01
E: 0.562995 14 01 07 2d 07 03 f1 7c ff ff ff ff ff ff 01
E: 0.574901 14 01 07 2d 69 03 72 7c ff ff ff ff ff ff 01
E: 0.586995 14 01 07 2d db 03 e1 7b ff ff ff ff ff ff 01
E: 0.599900 14 01 07 2d 52 04 4b 7b ff ff ff ff ff ff 01
E: 0.611982 14 01 07 2d d4 04 b4 7a ff ff ff ff ff ff 01
E: 0.624999 14 01 07 2d 67 05 16 7a ff ff ff ff ff ff 01
E: 0.637001 14 01 07 2d 02 06 74 79 ff ff ff ff ff ff 01
E: 0.648988 14 01 07 2d a4 06 cd 78 ff ff ff ff ff ff 01
E: 0.661984 14 01 07 2d 4d 07 21 78 ff ff ff ff ff ff 01
E: 0.673999 14 01 07 2d 08 08 70 77 ff ff ff ff ff ff 01
E: 0.686999 14 01 07 2d c6 08 c3 76 ff ff ff ff ff ff 01
E: 0.698999 14 01 07 2d 98 09 fc 75 ff ff ff ff ff ff 01
E: 0.711001 14 01 07 2d 63 0a 41 75 ff ff ff ff ff ff 01
E: 0.723987 14 01 07 2d 3d 0b 87 74 ff ff ff ff ff ff 01
E: 0.736000 14 01 07 2d 1e 0c d1 73 ff ff ff ff ff ff 01
E: 0.749004 14 01 07 2d 0c 0d 08 73 ff ff ff ff ff ff 01
E: 0.761001 14 01 07 2d f4 0d 48 72 ff ff ff ff ff ff 01
E: 0.773002 14 01 07 2d e8 0e 98 71 ff ff ff ff ff ff 01
E: 0.786000 14 01 07 2d ed 0f c9 70 ff ff ff ff ff ff 01
E: 0.798002 14 01 07 2d e5 10 ff 6f ff ff ff ff ff ff 01
E: 0.810001 14 01 07 2d e3 11 50 6f ff ff ff ff ff ff 01
E: 0.822995 14 01 07 2d fe 12 89 6e ff ff ff ff ff ff 01
E: 0.835002 14 01 07 2d 0d 14 b9 6d ff ff ff ff ff ff 01
E: 0.846999 14 01 07 2d 23 15 e2 6c ff ff ff ff ff ff 01
E: 0.859903 14 01 07 2d 36 16 0f 6c ff ff ff ff ff ff 01
E: 0.872011 14 01 07 2d 5a 17 2d 6b ff ff ff ff ff ff 01
E: 0.885002 14 01 07 2d 6c 18 6e 6a ff ff ff ff ff ff 01
E: 0.897003 14 01 07 2d 9f 19 8c 69 ff ff ff ff ff ff 01
E: 0.909001 14 01 07 2d ad 1a db 68 ff ff ff ff ff ff 01
E: 0.922009 14 01 07 2d e9 1b 0f 68 ff ff ff ff ff ff 01
E: 0.934000 14 01 07 2d 10 1d 4d 67 ff ff ff ff ff ff 01
E: 0.946003 14 01 07 2d 3d 1e 8f 66 ff ff ff ff ff ff 01
E: 0.959000 14 01 07 2d 69 1f cd 65 ff ff ff ff ff ff 01
E: 0.971002 14 01 07 2d 95 20 0e 65 ff ff ff ff ff ff 01
E: 0.984000 14 01 07 2d cd 21 48 64 ff ff ff ff ff ff 01
E: 0.996006 14 01 07 2d f6 22 95 63 ff ff ff ff ff ff 01
E: 1.008000 14 01 07 2d 2e 24 d4 62 ff ff ff ff ff ff 01
E: 1.021004 14 01 07 2d 56 25 29 62 ff ff ff ff ff ff 01
E: 1.033003 14 01 07 2d 99 26 6b 61 ff ff ff ff ff ff 01
E: 1.045001 14 01 07 2d b7 27 c1 60 ff ff ff ff ff ff 01
E: 1.058002 14 01 07 2d e6 28 0c 60 ff ff ff ff ff ff 01
E: 1.070005 14 01 07 2d 07 2a 5d 5f ff ff ff ff ff ff 01
E: 1.083003 14 01 07 2d 37 2b a9 5e ff ff ff ff ff ff 01
E: 1.095004 14 01 07 2d 5d 2c fe 5d ff ff ff ff ff ff 01
E: 1.107001 14 01 07 2d 84 2d 4a 5d ff ff ff ff ff ff 01
E: 1.120002 14 01 07 2d a2 2e 9d 5c ff ff ff ff ff ff 01
E: 1.132005 14 01 07 2d cc 2f f1 5b ff ff ff ff ff ff 01
E: 1.143997 14 01 07 2d e2 30 47 5b ff ff ff ff ff ff 01
E: 1.156998 14 01 07 2d 07 32 89 5a ff ff ff ff ff ff 01
E: 1.169010 14 01 07 2d 16 33 dc 59 ff ff ff ff ff ff 01
E: 1.182004 14 01 07 2d 41 34 24 59 ff ff ff ff ff ff 01
E: 1.194000 14 01 07 2d 57 35 73 58 ff ff ff ff ff ff 01
E: 1.205960 14 01 07 2d 80 36 b9 57 ff ff ff ff ff ff 01
E: 1.219002 14 01 07 2d 92 37 0e 57 ff ff ff ff ff ff 01
E: 1.231004 14 01 07 2d b0 38 64 56 ff ff ff ff ff ff 01
E: 1.242992 14 01 07 2d c3 39 c4 55 ff ff ff ff ff ff 01
E: 1.255991 14 01 07 2d d7 3a 25 55 ff ff ff ff ff ff 01
E: 1.267991 14 01 07 2d e0 3b 77 54 ff ff ff ff ff ff 01
E: 1.280994 14 01 07 2d db 3c cd 53 ff ff ff ff ff ff 01
E: 1.292966 14 01 07 2d e5 3d 1a 53 ff ff ff ff ff ff 01
E: 1.304993 14 01 07 2d d5 3e 6f 52 ff ff ff ff ff ff 01
E: 1.317995 14 01 07 2d bb 3f c1 51 ff ff ff ff ff ff 01
E: 1.329995 14 01 07 2d af 40 03 51 ff ff ff ff ff ff 01
E: 1.341988 14 01 07 2d 8f 41 54 50 ff ff ff ff ff ff 01
E: 1.354995 14 01 07 2d 81 42 94 4f ff ff ff ff ff ff 01
E: 1.366995 14 01 07 2d 61 43 da 4e ff ff ff ff ff ff 01
E: 1.379991 14 01 07 2d 39 44 25 4e ff ff ff ff ff ff 01
E: 1.391993 14 01 07 2d 1d 45 6c 4d ff ff ff ff ff ff 01
E: 1.403994 14 01 07 2d 00 46 b3 4c ff ff ff ff ff ff 01
E: 1.416993 14 01 07 2d e3 46 f0 4b ff ff ff ff ff ff 01
E: 1.428993 14 01 07 2d c1 47 36 4b ff ff ff ff ff ff 01
E: 1.440995 14 01 07 2d 96 48 8a 4a ff ff ff ff ff ff 01
E: 1.453998 14 01 07 2d 80 49 cb 49 ff ff ff ff ff ff 01
E: 1.465988 14 01 07 2d 6c 4a 05 49 ff ff ff ff ff ff 01
E: 1.478999 14 01 07 2d 4c 4b 49 48 ff ff ff ff ff ff 01
E: 1.490997 14 01 07 2d 31 4c 86 47 ff ff ff ff ff ff 01
E: 1.502991 14 01 07 2d 1e 4d bb 46 ff ff ff ff ff ff 01
E: 1.515995 14 01 07 2d 0e 4e ed 45 ff ff ff ff ff ff 01
E: 1.527996 14 01 07 2d f7 4e 23 45 ff ff ff ff ff ff 01
E: 1.540989 14 01 07 2d e1 4f 51 44 ff ff ff ff ff ff 01
E: 1.552995 14 01 07 2d cf 50 7f 43 ff ff ff ff ff ff 01
E: 1.564997 14 01 07 2d bd 51 a8 42 ff ff ff ff ff ff 01
E: 1.577996 14 01 07 2d a8 52 ca 41 ff ff ff ff ff ff 01
E: 1.589995 14 01 07 2d 8c 53 f2 40 ff ff ff ff ff ff 01
E: 1.601996 14 01 07 2d 7b 54 06 40 ff ff ff ff ff ff 01
E: 1.614995 14 01 07 2d 63 55 1a 3f ff ff ff ff ff ff 01
E: 1.626994 14 01 07 2d 43 56 2e 3e ff ff ff ff ff ff 01
E: 1.639997 14 01 07 2d 26 57 3d 3d ff ff ff ff ff ff 01
E: 1.651996 14 01 07 2d 09 58 4a 3c ff ff ff ff ff ff 01
E: 1.664004 14 01 07 2d f1 58 53 3b ff ff ff ff ff ff 01
E: 1.676993 14 01 07 2d c0 59 70 3a ff ff ff ff ff ff 01
E: 1.688985 14 01 07 2d a0 5a 73 39 ff ff ff ff ff ff 01
E: 1.700995 14 01 07 2d 9c 5b 66 38 ff ff ff ff ff ff 01
E: 1.713996 14 01 07 2d 6a 5c 88 37 ff ff ff ff ff ff 01
E: 1.725994 14 01 07 2d 4a 5d 94 36 ff ff ff ff ff ff 01
E: 1.738972 14 01 07 2d 12 5e ad 35 ff ff ff ff ff ff 01
E: 1.750993 14 01 07 2d df 5e b7 34 ff ff ff ff ff ff 01
E: 1.762997 14 01 07 2d a7 5f cc 33 ff ff ff ff ff ff 01
E: 1.776009 14 01 07 2d 71 60 e3 32 ff ff ff ff ff ff 01
E: 1.787991 14 01 07 2d 35 61 f6 31 ff ff ff ff ff ff 01
E: 1.800008 14 01 07 2d f6 61 fa 30 ff ff ff ff ff ff 01
E: 1.812997 14 01 07 2d b4 62 01 30 ff ff ff ff ff ff 01
E: 1.824982 14 01 07 2d 75 63 11 2f ff ff ff ff ff ff 01
E: 1.838006 14 01 07 2d 38 64 0f 2e ff ff ff ff ff ff 01
E: 1.850006 14 01 07 2d f2 64 17 2d ff ff ff ff ff ff 01
E: 1.861995 14 01 07 2d b8 65 06 2c ff ff ff ff ff ff 01
E: 1.874994 14 01 07 2d 63 66 30 2b ff ff ff ff ff ff 01
E: 1.887007 14 01 07 2d 2b 67 2e 2a ff ff ff ff ff ff 01
E: 1.899006 14 01 07 2d e2 67 3e 29 ff ff ff ff ff ff 01
E: 1.912008 14 01 07 2d 9e 68 40 28 ff ff ff ff ff ff 01
E: 1.924016 14 01 07 2d 51 69 62 27 ff ff ff ff ff ff 01
E: 1.936997 14 01 07 2d 18 6a 6d 26 ff ff ff ff ff ff 01
E: 1.949004 14 01 07 2d cf 6a 8b 25 ff ff ff ff ff ff 01
E: 1.961005 14 01 07 2d 89 6b a2 24 ff ff ff ff ff ff 01
E: 1.973937 14 01 07 2d 44 6c b7 23 ff ff ff ff ff ff 01
E: 1.986008 14 01 07 2d f7 6c d2 22 ff ff ff ff ff ff 01
E: 1.998005 14 01 07 2d a4 6d f3 21 ff ff ff ff ff ff 01
E: 2.011006 14 01 07 2d 57 6e f2 20 ff ff ff ff ff ff 01
E: 2.022996 14 01 07 2d f8 6e 04 20 ff ff ff ff ff ff 01
E: 2.036002 14 01 07 2d 98 6f 1d 1f ff ff ff ff ff ff 01
E: 2.048009 14 01 07 2d 32 70 45 1e ff ff ff ff ff ff 01
E: 2.060008 14 01 07 2d d1 70 4e 1d ff ff ff ff ff ff 01
E: 2.072994 14 01 07 2d 5f 71 6c 1c ff ff ff ff ff ff 01
E: 2.085005 14 01 07 2d e7 71 99 1b ff ff ff ff ff ff 01
E: 2.097007 14 01 07 2d 74 72 b8 1a ff ff ff ff ff ff 01
E: 2.110006 14 01 07 2d f5 72 e2 19 ff ff ff ff ff ff 01
E: 2.122018 14 01 07 2d 7c 73 ff 18 ff ff ff ff ff ff 01
E: 2.135006 14 01 07 2d fe 73 2f 18 ff ff ff ff ff ff 01
E: 2.146867 14 01 07 2d 7d 74 59 17 ff ff ff ff ff ff 01
E: 2.158999 14 01 07 2d 01 75 78 16 ff ff ff ff ff ff 01
E: 2.171996 14 01 07 2d 85 75 87 15 ff ff ff ff ff ff 01
E: 2.184011 14 01 07 2d fa 75 bb 14 ff ff ff ff ff ff 01
E: 2.196009 14 01 07 2d 7c 76 d7 13 ff ff ff ff ff ff 01
E: 2.209012 14 01 07 2d f5 76 f1 12 ff ff ff ff ff ff 01
E: 2.221008 14 01 07 2d 64 77 19 12 ff ff ff ff ff ff 01
E: 2.234008 14 01 07 2d cc 77 4a 11 ff ff ff ff ff ff 01
E: 2.246008 14 01 07 2d 2f 78 7f 10 ff ff ff ff ff ff 01
E: 2.258010 14 01 07 2d 91 78 a7 0f ff ff ff ff ff ff 01
E: 2.271008 14 01 07 2d ea 78 d1 0e ff ff ff ff ff ff 01
E: 2.282978 14 01 07 2d 45 79 fe 0d ff ff ff ff ff ff 01
E: 2.295998 14 01 07 2d 9e 79 50 0d ff ff ff ff ff ff 01
E: 2.307999 14 01 07 2d f6 79 99 0c ff ff ff ff ff ff 01
E: 2.320006 14 01 07 2d 4b 7a ce 0b ff ff ff ff ff ff 01
E: 2.333000 14 01 07 2d 99 7a 1e 0b ff ff ff ff ff ff 01
E: 2.345005 14 01 07 2d e4 7a 78 0a ff ff ff ff ff ff 01
E: 2.357009 14 01 07 2d 2b 7b db 09 ff ff ff ff ff ff 01
E: 2.370009 14 01 07 2d 77 7b 36 09 ff ff ff ff ff ff 01
E: 2.381993 14 01 07 2d c2 7b 95 08 ff ff ff ff ff ff 01
E: 2.394006 14 01 07 2d 0e 7c ff 07 ff ff ff ff ff ff 01
E: 2.407009 14 01 07 2d 53 7c 7a 07 ff ff ff ff ff ff 01
E: 2.419009 14 01 07 2d 9f 7c d5 06 ff ff ff ff ff ff 01
E: 2.432009 14 01 07 2d e0 7c 4c 06 ff ff ff ff ff ff 01
E: 2.443996 14 01 07 2d 1d 7d d7 05 ff ff ff ff ff ff 01
E: 2.456002 14 01 07 2d 53 7d 6d 05 ff ff ff ff ff ff 01
E: 2.469009 14 01 07 2d 86 7d 0d 05 ff ff ff ff ff ff 01
E: 2.481007 14 01 07 2d b9 7d a9 04 ff ff ff ff ff ff 01
E: 2.493010 14 01 07 2d ec 7d 4b 04 ff ff ff ff ff ff 01
E: 2.505992 14 01 07 2d 18 7e 04 04 ff ff ff ff ff ff 01
E: 2.518010 14 01 07 2d 3e 7e c4 03 ff ff ff ff ff ff 01
E: 2.531009 14 01 07 2d 5e 7e 82 03 ff ff ff ff ff ff 01
E: 2.543008 14 01 07 2d 75 7e 52 03 ff ff ff ff ff ff 01
E: 2.555008 14 01 07 2d 85 7e 32 03 ff ff ff ff ff ff 01
E: 2.568009 14 01 07 2d 8f 7e 1b 03 ff ff ff ff ff ff 01
E: 2.580011 14 01 07 2d 98 7e fd 02 ff ff ff ff ff ff 01
E: 2.592009 14 01 07 2d 9d 7e ed 02 ff ff ff ff ff ff 01
E: 2.604999 14 01 07 2d a1 7e e2 02 ff ff ff ff ff ff 01
E: 2.617011 14 01 07 2d a2 7e dc 02 ff ff ff ff ff ff 01
E: 2.630011 14 01 07 2d a2 7e d1 02 ff ff ff ff ff ff 01
E: 2.642011 14 01 07 2d a4 7e cd 02 ff ff ff ff ff ff 01
E: 2.653996 14 01 07 2d a6 7e cb 02 ff ff ff ff ff ff 01
E: 2.666988 14 01 07 2d a6 7e cb 02 ff ff ff ff ff ff 01
E: 2.679010 14 01 07 2d a5 7e cb 02 ff ff ff ff ff ff 01
E: 2.691025 14 01 07 2d a6 7e ca 02 ff ff ff ff ff ff 01
E: 2.703997 14 01 07 2d a7 7e c9 02 ff ff ff ff ff ff 01
E: 2.716013 14 01 07 2d a8 7e c8 02 ff ff ff ff ff ff 01
E: 2.727998 14 01 07 2d a9 7e cd 02 ff ff ff ff ff ff 01
E: 2.740987 14 01 07 2d a9 7e cd 02 ff ff ff ff ff ff 01
E: 2.753012 14 01 07 2d ab 7e ca 02 ff ff ff ff ff ff 01
E: 2.766013 14 01 07 2d ad 7e c7 02 ff ff ff ff ff ff 01
E: 2.778002 14 01 07 2d ae 7e cb 02 ff ff ff ff ff ff 01
E: 2.790012 14 01 07 2d af 7e c9 02 ff ff ff ff ff ff 01
E: 2.803011 14 01 07 2d b0 7e c7 02 ff ff ff ff ff ff 01
E: 2.815010 14 01 07 2d b2 7e c3 02 ff ff ff ff ff ff 01
E: 2.828011 14 01 07 2d b2 7e c2 02 ff ff ff ff ff ff 01
E: 2.839995 14 01 07 2d b2 7e c1 02 ff ff ff ff ff ff 01
E: 2.852011 14 01 07 2d b2 7e c0 02 ff ff ff ff ff ff 01
E: 2.864990 14 01 07 2d b2 7e c0 02 ff ff ff ff ff ff 01
E: 2.877013 14 01 07 2d b2 7e bf 02 ff ff ff ff ff ff 01
E: 2.888969 14 01 07 2d b2 7e bf 02 ff ff ff ff ff ff 01
E: 2.902012 14 01 07 2d b1 7e bf 02 ff ff ff ff ff ff 01
E: 2.914012 14 01 07 2d b2 7e c5 02 ff ff ff ff ff ff 01
E: 2.927012 14 01 07 2d b2 7e cb 02 ff ff ff ff ff ff 01
E: 2.938976 14 01 07 2d b2 7e c9 02 ff ff ff ff ff ff 01
E: 2.951014 14 01 07 2d b2 7e cd 02 ff ff ff ff ff ff 01
E: 2.964013 14 01 07 2d b3 7e cf 02 ff ff ff ff ff ff 01
E: 2.976013 14 01 07 2d b5 7e d1 02 ff ff ff ff ff ff 01
E: 2.987997 14 01 07 2d b6 7e d2 02 ff ff ff ff ff ff 01
E: 3.001012 14 01 07 2d b7 7e d3 02 ff ff ff ff ff ff 01
E: 3.013013 14 01 07 2d b7 7e cd 02 ff ff ff ff ff ff 01
E: 3.026015 14 01 07 2d b8 7e ce 02 ff ff ff ff ff ff 01
E: 3.038013 14 01 07 2d b8 7e cf 02 ff ff ff ff ff ff 01
E: 3.050011 14 01 07 2d b8 7e cb 02 ff ff ff ff ff ff 01
E: 3.063013 14 01 07 2d b8 7e c6 02 ff ff ff ff ff ff 01
E: 3.075011 14 01 07 2d b8 7e c8 02 ff ff ff ff ff ff 01
E: 3.086977 14 01 07 2d b9 7e cb 02 ff ff ff ff ff ff 01
E: 3.100013 14 01 07 2d b9 7e ce 02 ff ff ff ff ff ff 01
E: 3.112012 14 01 07 2d b9 7e cf 02 ff ff ff ff ff ff 01
E: 3.124998 14 01 07 2d b9 7e d1 02 ff ff ff ff ff ff 01
E: 3.136994 14 01 07 2d b9 7e d2 02 ff ff ff ff ff ff 01
E: 3.149017 14 01 07 2d b9 7e d3 02 ff ff ff ff ff ff 01
E: 3.161990 14 01 07 2d b9 7e d3 02 ff ff ff ff ff ff 01
E: 3.174015 14 01 07 2d b9 7e d4 02 ff ff ff ff ff ff 01
E: 3.185992 14 01 07 2d b9 7e d4 02 ff ff ff ff ff ff 01
E: 3.199014 14 01 07 2d b9 7e ce 02 ff ff ff ff ff ff 01
E: 3.211015 14 01 07 2d b9 7e c8 02 ff ff ff ff ff ff 01
E: 3.224015 14 01 07 2d b9 7e ca 02 ff ff ff ff ff ff 01
E: 3.236006 14 01 07 2d b9 7e cc 02 ff ff ff ff ff ff 01
E: 3.248005 14 01 07 2d b7 7e d0 02 ff ff ff ff ff ff 01
E: 3.261001 14 01 07 2d b6 7e cd 02 ff ff ff ff ff ff 01
E: 3.273016 14 01 07 2d b6 7e c8 02 ff ff ff ff ff ff 01
E: 3.286019 14 01 07 2d b7 7e ca 02 ff ff ff ff ff ff 01
E: 3.298012 14 01 07 2d b7 7e cc 02 ff ff ff ff ff ff 01
E: 3.310012 14 01 07 2d b8 7e c9 02 ff ff ff ff ff ff 01
E: 3.323002 14 01 07 2d b8 7e ca 02 ff ff ff ff ff ff 01
E: 3.335017 14 01 07 2d b8 7e cd 02 ff ff ff ff ff ff 01
E: 3.347013 14 01 07 2d b8 7e cf 02 ff ff ff ff ff ff 01
E: 3.360014 14 01 07 2d b8 7e cb 02 ff ff ff ff ff ff 01
E: 3.372005 14 01 07 2d b8 7e c6 02 ff ff ff ff ff ff 01
E: 3.384012 14 01 07 2d b9 7e c8 02 ff ff ff ff ff ff 01
E: 3.397016 14 01 07 2d b9 7e cb 02 ff ff ff ff ff ff 01
E: 3.409015 14 01 07 2d b9 7e c8 02 ff ff ff ff ff ff 01
E: 3.422003 14 01 07 2d b9 7e c4 02 ff ff ff ff ff ff 01
E: 3.434002 14 01 07 2d b9 7e c6 02 ff ff ff ff ff ff 01
E: 3.446016 14 01 07 2d b9 7e ca 02 ff ff ff ff ff ff 01
E: 3.459015 14 01 07 2d b7 7e c8 02 ff ff ff ff ff ff 01
E: 3.471017 14 01 07 2d b6 7e c6 02 ff ff ff ff ff ff 01
E: 3.483016 14 01 07 2d b6 7e c3 02 ff ff ff ff ff ff 01
E: 3.496014 14 01 07 2d b8 7e be 02 ff ff ff ff ff ff 01
E: 3.508016 14 01 07 2d ba 7e bb 02 ff ff ff ff ff ff 01
E: 3.521017 14 01 07 2d bd 7e b7 02 ff ff ff ff ff ff 01
E: 3.533015 14 01 07 2d c1 7e b2 02 ff ff ff ff ff ff 01
E: 3.545017 14 01 07 2d c4 7e b4 02 ff ff ff ff ff ff 01
E: 3.558017 14 01 07 2d c7 7e c4 02 ff ff ff ff ff ff 01
E: 3.569999 14 01 07 2d d0 7e be 02 ff ff ff ff ff ff 01
E: 3.582015 14 01 04 2d d0 7e be 02 ff ff ff ff ff ff 01
# 2. Land one finger,
   - land a second finger far enough from the first
   - move your two fingers
   - release the *first* finger
   - release the second finger
E: 11.087035 14 01 07 2e 54 02 9e 37 ff ff ff ff ff ff 01
E: 11.099982 14 01 07 2e 54 02 9e 37 ff ff ff ff ff ff 01
E: 11.111914 14 01 07 2e 54 02 9e 37 ff ff ff ff ff ff 01
E: 11.124981 14 01 07 2e 54 02 9e 37 ff ff ff ff ff ff 01
E: 11.136952 14 01 07 2e 54 02 9e 37 ff ff ff ff ff ff 01
E: 11.148947 14 01 07 2e 54 02 9e 37 ff ff ff ff ff ff 01
E: 11.160957 14 01 07 2e 51 02 c0 37 ff ff ff ff ff ff 01
E: 11.173952 14 01 07 2e 50 02 c3 37 ff ff ff ff ff ff 01
E: 11.185952 14 01 07 2e 4e 02 c5 37 ff ff ff ff ff ff 01
E: 11.198916 14 01 07 2e 4c 02 c6 37 ff ff ff ff ff ff 01
E: 11.210936 14 01 07 2e 49 02 c5 37 ff ff ff ff ff ff 01
E: 11.222957 14 01 07 2e 47 02 c0 37 ff ff ff ff ff ff 01
E: 11.235954 14 01 07 2e 45 02 bb 37 ff ff ff ff ff ff 01
E: 11.247954 14 01 07 2e 45 02 b8 37 ff ff ff ff ff ff 01
E: 11.259954 14 01 07 2e 45 02 b5 37 ff ff ff ff ff ff 01
E: 11.272954 14 01 07 2e 46 02 af 37 ff ff ff ff ff ff 01
E: 11.284950 14 01 07 2e 48 02 a9 37 ff ff ff ff ff ff 01
E: 11.297950 14 01 07 2e 49 02 aa 37 ff ff ff ff ff ff 01
E: 11.309951 14 01 07 2e 4a 02 ac 37 ff ff ff ff ff ff 01
E: 11.321953 14 01 07 2e 4c 02 aa 37 ff ff ff ff ff ff 01
E: 11.334951 14 01 07 2e 4e 02 a7 37 ff ff ff ff ff ff 01
E: 11.346950 14 01 07 2e 4f 02 a4 37 ff ff ff ff ff ff 01
E: 11.358934 14 01 07 2e 50 02 a3 37 ff ff ff ff ff ff 01
E: 11.371954 14 01 07 2e 50 02 a1 37 ff ff ff ff ff ff 01
E: 11.383951 14 01 07 2e 51 02 a0 37 ff ff ff ff ff ff 01
E: 11.395951 14 01 07 2e 51 02 9f 37 ff ff ff ff ff ff 01
E: 11.408950 14 01 07 2e 50 02 9e 37 ff ff ff ff ff ff 01
E: 11.420929 14 01 07 2e 4f 02 9d 37 ff ff ff ff ff ff 01
E: 11.434068 14 01 07 2e 4f 02 9c 37 ff ff ff ff ff ff 01
E: 11.446045 14 01 07 2e 4f 02 9c 37 ff ff ff ff ff ff 01
E: 11.458044 14 01 07 2e 4f 02 9c 37 ff ff ff ff ff ff 01
E: 11.471045 14 01 07 2e 4f 02 9c 37 ff ff ff ff ff ff 01
E: 11.483065 14 01 07 2e 4f 02 96 37 ff ff ff ff ff ff 01
E: 11.495066 14 01 07 2e 50 02 92 37 ff ff ff ff ff ff 01
E: 11.508059 14 01 07 2e 51 02 93 37 ff ff ff ff ff ff 01
E: 11.519948 14 01 07 2e 51 02 95 37 ff ff ff ff ff ff 01
E: 11.533067 14 01 07 2e 50 02 92 37 ff ff ff ff ff ff 01
E: 11.545059 14 01 07 2e 51 02 8f 37 ff ff ff ff ff ff 01
E: 11.557060 14 01 07 2e 51 02 91 37 ff ff ff ff ff ff 01
E: 11.570055 14 01 07 2e 50 02 93 37 ff ff ff ff ff ff 01
E: 11.582060 14 01 07 2e 50 02 90 37 ff ff ff ff ff ff 01
E: 11.595061 14 01 07 2e 51 02 92 37 ff ff ff ff ff ff 01
E: 11.607059 14 01 07 2e 51 02 95 37 ff ff ff ff ff ff 01
E: 11.619061 14 01 07 2e 51 02 97 37 ff ff ff ff ff ff 01
E: 11.632068 14 01 07 2e 50 02 98 37 ff ff ff ff ff ff 01
E: 11.644068 14 01 07 2e 51 02 99 37 ff ff ff ff ff ff 01
E: 11.655952 14 01 07 2e 51 02 9a 37 ff ff ff ff ff ff 01
E: 11.669070 14 01 07 2e 51 02 9b 37 ff ff ff ff ff ff 01
E: 11.681046 14 01 07 2e 51 02 9b 37 ff ff ff ff ff ff 01
E: 11.693934 14 01 07 2e 51 02 9b 37 ff ff ff ff ff ff 01
E: 11.706063 14 01 07 2e 50 02 9b 37 ff ff ff ff ff ff 01
E: 11.718069 14 01 07 2e 51 02 9c 37 ff ff ff ff ff ff 01
E: 11.731048 14 01 07 2e 51 02 9c 37 ff ff ff ff ff ff 01
E: 11.743069 14 01 07 2e 52 02 9d 37 ff ff ff ff ff ff 01
E: 11.754960 14 01 07 2e 54 02 9e 37 ff ff ff ff ff ff 01
E: 11.768064 14 01 07 2e 55 02 9f 37 ff ff ff ff ff ff 01
E: 11.780067 14 01 07 2e 56 02 9f 37 ff ff ff ff ff ff 01
E: 11.793068 14 01 07 2e 57 02 a0 37 ff ff ff ff ff ff 01
E: 11.805068 14 01 07 2e 59 02 a1 37 ff ff ff ff ff ff 01
E: 11.817069 14 01 07 2e 5a 02 a7 37 ff ff ff ff ff ff 01
E: 11.830067 14 01 07 2e 5b 02 ad 37 ff ff ff ff ff ff 01
E: 11.842068 14 01 07 2e 5d 02 ad 37 ff ff ff ff ff ff 01
E: 11.854070 14 01 07 2e 5f 02 ac 37 ff ff ff ff ff ff 01
E: 11.867069 14 01 07 2e 61 02 ac 37 ff ff ff ff ff ff 01
E: 11.879069 14 01 07 2e 63 02 ab 37 ff ff ff ff ff ff 01
E: 11.892075 14 01 07 2e 65 02 ab 37 ff ff ff ff ff ff 01
E: 11.904071 14 01 07 2e 67 02 ac 37 ff ff ff ff ff ff 01
E: 11.916071 14 01 07 2e 69 02 ad 37 ff ff ff ff ff ff 01
E: 11.929070 14 01 07 2e 6c 02 ae 37 ff ff ff ff ff ff 01
E: 11.941064 14 01 07 2e 6e 02 af 37 ff ff ff ff ff ff 01
E: 11.952961 14 01 07 2e 6f 02 af 37 ff ff ff ff ff ff 01
E: 11.966070 14 01 07 2e 71 02 b0 37 ff ff ff ff ff ff 01
E: 11.978070 14 01 07 2e 72 02 b1 37 ff ff ff ff ff ff 01
E: 11.990070 14 01 07 2e 73 02 b1 37 ff ff ff ff ff ff 01
E: 12.002964 14 01 07 2e 72 02 ab 37 ff ff ff ff ff ff 01
E: 12.015062 14 01 07 2e 72 02 a6 37 ff ff ff ff ff ff 01
E: 12.028059 14 01 07 2e 72 02 a2 37 ff ff ff ff ff ff 01
E: 12.039952 14 01 07 2e 70 02 9e 37 ff ff ff ff ff ff 01
E: 12.052071 14 01 07 2e 6e 02 9b 37 ff ff ff ff ff ff 01
E: 12.065069 14 01 07 2e 6c 02 98 37 ff ff ff ff ff ff 01
E: 12.077067 14 01 07 2e 6a 02 95 37 ff ff ff ff ff ff 01
E: 12.089052 14 01 07 2e 68 02 93 37 ff ff ff ff ff ff 01
E: 12.102071 14 01 07 2e 66 02 92 37 ff ff ff ff ff ff 01
E: 12.114071 14 01 07 2e 65 02 91 37 ff ff ff ff ff ff 01
E: 12.127069 14 01 07 2e 65 02 90 37 ff ff ff ff ff ff 01
E: 12.139049 14 01 07 2e 64 02 8f 37 ff ff ff ff ff ff 01
E: 12.151051 14 01 07 2e 63 02 8f 37 ff ff ff ff ff ff 01
E: 12.164071 14 01 07 2e 63 02 8a 37 ff ff ff ff ff ff 01
E: 12.176070 14 01 07 2e 63 02 84 37 ff ff ff ff ff ff 01
E: 12.187961 14 01 07 2e 63 02 85 37 ff ff ff ff ff ff 01
E: 12.201073 14 01 07 2e 61 02 86 37 ff ff ff ff ff ff 01
E: 12.213072 14 01 07 2e 5f 02 82 37 ff ff ff ff ff ff 01
E: 12.225072 14 01 07 2e 5f 02 7e 37 ff ff ff ff ff ff 01
E: 12.237967 14 01 07 2e 5f 02 80 37 ff ff ff ff ff ff 01
E: 12.250062 14 01 07 2e 5f 02 83 37 ff ff ff ff ff ff 01
E: 12.263062 14 01 07 2e 60 02 81 37 ff ff ff ff ff ff 01
E: 12.275062 14 01 07 2e 62 02 7f 37 ff ff ff ff ff ff 01
E: 12.286951 14 01 07 2e 64 02 82 37 ff ff ff ff ff ff 01
E: 12.300073 14 01 07 2e 66 02 87 37 ff ff ff ff ff ff 01
E: 12.312072 14 01 07 2e 68 02 85 37 ff ff ff ff ff ff 01
E: 12.324068 14 01 07 2e 6a 02 84 37 ff ff ff ff ff ff 01
E: 12.336953 14 01 07 2e 6c 02 87 37 ff ff ff ff ff ff 01
E: 12.349063 14 01 07 2e 6d 02 8b 37 ff ff ff ff ff ff 01
E: 12.362059 14 01 07 2e 6f 02 89 37 ff ff ff ff ff ff 01
E: 12.373982 14 01 07 2e 70 02 87 37 ff ff ff ff ff ff 01
E: 12.386071 14 01 07 2e 70 02 89 37 ff ff ff ff ff ff 01
E: 12.399069 14 01 07 2e 70 02 8d 37 ff ff ff ff ff ff 01
E: 12.411073 14 01 07 2e 71 02 8a 37 ff ff ff ff ff ff 01
E: 12.424073 14 01 07 2e 71 02 88 37 ff ff ff ff ff ff 01
E: 12.435957 14 01 07 2e 71 02 85 37 ff ff ff ff ff ff 01
E: 12.448063 14 01 07 2e 72 02 83 37 ff ff ff ff ff ff 01
E: 12.461069 14 01 07 2e 71 02 82 37 ff ff ff ff ff ff 01
E: 12.473036 14 01 07 2e 70 02 80 37 ff ff ff ff ff ff 01
E: 12.485070 14 01 07 2e 70 02 7f 37 ff ff ff ff ff ff 01
E: 12.498050 14 01 07 2e 70 02 7f 37 ff ff ff ff ff ff 01
E: 12.510057 14 01 07 2e 71 02 7f 37 ff ff ff ff ff ff 01
E: 12.523046 14 01 07 2e 71 02 7f 37 ff ff ff ff ff ff 01
E: 12.535071 14 01 07 2e 72 02 7f 37 ff ff ff ff ff ff 01
E: 12.547072 14 01 07 2e 73 02 7f 37 ff ff ff ff ff ff 01
E: 12.560073 14 01 07 2e 74 02 80 37 ff ff ff ff ff ff 01
E: 12.572016 14 01 07 2e 75 02 80 37 ff ff ff ff ff ff 01
E: 12.584052 14 01 07 2e 75 02 80 37 ff ff ff ff ff ff 01
E: 12.596940 14 01 07 2e 75 02 81 37 ff ff ff ff ff ff 01
E: 12.609074 14 01 07 2e 75 02 80 37 ff ff ff ff ff ff 01
E: 12.622084 14 01 07 2e 74 02 80 37 ff ff ff ff ff ff 01
E: 12.634069 14 01 07 2e 74 02 7f 37 ff ff ff ff ff ff 01
E: 12.646069 14 01 07 2e 74 02 80 37 ff ff ff ff ff ff 01
E: 12.659067 14 01 07 2e 74 02 7f 37 ff ff ff ff ff ff 01
E: 12.670960 14 01 07 2e 74 02 80 37 ff ff ff ff ff ff 01
E: 12.683076 14 01 07 2e 74 02 7b 37 ff ff ff ff ff ff 01
E: 12.696068 14 01 07 2e 75 02 76 37 ff ff ff ff ff ff 01
E: 12.708073 14 01 07 2e 75 02 77 37 ff ff ff ff ff ff 01
E: 12.719952 14 01 07 2e 74 02 74 37 ff ff ff ff ff ff 01
E: 12.733076 14 01 07 2e 74 02 70 37 ff ff ff ff ff ff 01
E: 12.745075 14 01 07 2e 74 02 6e 37 ff ff ff ff ff ff 01
E: 12.758077 14 01 07 2e 74 02 6c 37 ff ff ff ff ff ff 01
E: 12.770032 14 01 07 2e 74 02 6a 37 ff ff ff ff ff ff 01
E: 12.782075 14 01 07 2e 74 02 69 37 ff ff ff ff ff ff 01
E: 12.795075 14 01 07 2e 74 02 68 37 ff ff ff ff ff ff 01
E: 12.807074 14 01 07 2e 75 02 68 37 ff ff ff ff ff ff 01
E: 12.819054 14 01 07 2e 75 02 68 37 ff ff ff ff ff ff 01
E: 12.832078 14 01 07 2e 76 02 69 37 ff ff ff ff ff ff 01
E: 12.844076 14 01 07 2e 77 02 69 37 ff ff ff ff ff ff 01
E: 12.857075 14 01 07 2e 78 02 6a 37 ff ff ff ff ff ff 01
E: 12.869075 14 01 07 2e 79 02 6a 37 ff ff ff ff ff ff 01
E: 12.881055 14 01 07 2e 79 02 6a 37 ff ff ff ff ff ff 01
E: 12.894087 14 01 07 2e 7a 02 6a 37 ff ff ff ff ff ff 01
E: 12.906068 14 01 07 2e 7a 02 6b 37 ff ff ff ff ff ff 01
E: 12.918075 14 01 07 2e 7a 02 6a 37 ff ff ff ff ff ff 01
E: 12.931055 14 01 07 2e 7a 02 6a 37 ff ff ff ff ff ff 01
E: 12.943076 14 01 07 2e 7b 02 6b 37 ff ff ff ff ff ff 01
E: 12.956046 14 01 07 2e 7b 02 6b 37 ff ff ff ff ff ff 01
E: 12.968055 14 01 07 2e 7b 02 6b 37 ff ff ff ff ff ff 01
E: 12.980054 14 01 07 2e 7b 02 6b 37 ff ff ff ff ff ff 01
E: 12.993054 14 01 07 2e 7b 02 6b 37 ff ff ff ff ff ff 01
E: 13.005075 14 01 07 2e 7c 02 6b 37 ff ff ff ff ff ff 01
E: 13.017074 14 01 07 2e 7c 02 71 37 ff ff ff ff ff ff 01
E: 13.030076 14 01 07 2e 7c 02 76 37 ff ff ff ff ff ff 01
E: 13.042076 14 01 07 2e 7c 02 74 37 ff ff ff ff ff ff 01
E: 13.054072 14 01 07 2e 7c 02 72 37 ff ff ff ff ff ff 01
E: 13.066954 14 01 07 2e 7c 02 75 37 ff ff ff ff ff ff 01
E: 13.079076 14 01 07 2e 7b 02 79 37 ff ff ff ff ff ff 01
E: 13.092078 14 01 07 2e 7b 02 7c 37 ff ff ff ff ff ff 01
E: 13.104074 14 01 07 2e 7b 02 7e 37 ff ff ff ff ff ff 01
E: 13.116076 14 01 07 2e 7b 02 7f 37 ff ff ff ff ff ff 01
E: 13.129077 14 01 07 2e 7b 02 80 37 ff ff ff ff ff ff 01
E: 13.141079 14 01 07 2e 7b 02 82 37 ff ff ff ff ff ff 01
E: 13.152991 14 01 07 2e 7c 02 83 37 ff ff ff ff ff ff 01
E: 13.166077 14 01 07 2e 7d 02 84 37 ff ff ff ff ff ff 01
E: 13.178055 14 01 07 2e 7d 02 84 37 ff ff ff ff ff ff 01
E: 13.191080 14 01 07 2e 7e 02 85 37 ff ff ff ff ff ff 01
E: 13.203016 14 01 07 2e 7e 02 85 37 ff ff ff ff ff ff 01
E: 13.215056 14 01 07 2e 7e 02 85 37 ff ff ff ff ff ff 01
E: 13.228033 14 01 07 2e 7e 02 85 37 ff ff ff ff ff ff 01
E: 13.240078 14 01 07 2e 7e 02 8b 37 ff ff ff ff ff ff 01
E: 13.252073 14 01 07 2e 7d 02 8a 37 ff ff ff ff ff ff 01
E: 13.265079 14 01 07 2e 7d 02 89 37 ff ff ff ff ff ff 01
E: 13.277078 14 01 07 2e 7d 02 8d 37 ff ff ff ff ff ff 01
E: 13.290079 14 01 07 2e 7d 02 91 37 ff ff ff ff ff ff 01
E: 13.302078 14 01 07 2e 7e 02 90 37 ff ff ff ff ff ff 01
E: 13.314079 14 01 07 2e 7e 02 8e 37 ff ff ff ff ff ff 01
E: 13.327079 14 01 07 2e 7e 02 90 37 ff ff ff ff ff ff 01
E: 13.339059 14 01 07 2e 7e 02 94 37 ff ff ff ff ff ff 01
E: 13.350970 14 01 07 2e 7e 02 92 37 ff ff ff ff ff ff 01
E: 13.364075 14 01 07 2e 7e 02 8f 37 ff ff ff ff ff ff 01
E: 13.376063 14 01 07 2e 7f 02 8d 37 ff ff ff ff ff ff 01
E: 13.388075 14 01 07 2e 7f 02 90 37 ff ff ff ff ff ff 01
E: 13.401079 14 01 07 2e 7f 02 8f 37 ff ff ff ff ff ff 01
E: 13.413077 14 01 07 2e 7f 02 8d 37 ff ff ff ff ff ff 01
E: 13.426078 14 01 07 2e 7f 02 8b 37 ff ff ff ff ff ff 01
E: 13.438077 14 01 07 2e 7f 02 8a 37 ff ff ff ff ff ff 01
E: 13.449973 14 01 07 2e 7f 02 89 37 ff ff ff ff ff ff 01
E: 13.463068 14 01 07 2e 7f 02 88 37 ff ff ff ff ff ff 01
E: 13.475056 14 01 07 2e 7f 02 88 37 ff ff ff ff ff ff 01
E: 13.487078 14 01 07 2e 7f 02 87 37 ff ff ff ff ff ff 01
E: 13.499960 14 01 07 2e 7e 02 8c 37 ff ff ff ff ff ff 01
E: 13.512075 14 01 07 2e 7e 02 8b 37 ff ff ff ff ff ff 01
E: 13.525078 14 01 07 2e 7f 02 8b 37 ff ff ff ff ff ff 01
E: 13.537073 14 01 07 2e 7f 02 8a 37 ff ff ff ff ff ff 01
E: 13.549080 14 01 07 2e 7f 02 89 37 ff ff ff ff ff ff 01
E: 13.562080 14 01 07 2e 7f 02 88 37 ff ff ff ff ff ff 01
E: 13.574078 14 01 07 2e 7f 02 87 37 ff ff ff ff ff ff 01
E: 13.586079 14 01 07 2e 80 02 87 37 ff ff ff ff ff ff 01
E: 13.599057 14 01 07 2e 80 02 87 37 ff ff ff ff ff ff 01
E: 13.611078 14 01 07 2e 80 02 82 37 ff ff ff ff ff ff 01
E: 13.624078 14 01 07 2e 80 02 7d 37 ff ff ff ff ff ff 01
E: 13.636082 14 01 07 2e 80 02 79 37 ff ff ff ff ff ff 01
E: 13.647948 14 01 07 2e 80 02 7b 37 ff ff ff ff ff ff 01
E: 13.661081 14 01 07 2e 80 02 7e 37 ff ff ff ff ff ff 01
E: 13.673081 14 01 07 2e 80 02 7b 37 ff ff ff ff ff ff 01
E: 13.685078 14 01 07 2e 81 02 78 37 ff ff ff ff ff ff 01
E: 13.698080 14 01 07 2e 81 02 7b 37 ff ff ff ff ff ff 01
E: 13.710014 14 01 07 2e 80 02 7d 37 ff ff ff ff ff ff 01
E: 13.722980 14 01 07 2e 80 02 7b 37 ff ff ff ff ff ff 01
E: 13.734981 14 01 07 2e 80 02 78 37 ff ff ff ff ff ff 01
E: 13.746982 14 01 07 2e 80 02 7a 37 ff ff ff ff ff ff 01
E: 13.759980 14 01 07 2e 7f 02 7d 37 ff ff ff ff ff ff 01
E: 13.771982 14 01 07 2e 7f 02 7a 37 ff ff ff ff ff ff 01
E: 13.783980 14 01 07 2e 80 02 77 37 ff ff ff ff ff ff 01
E: 13.796981 14 01 07 2e 7f 02 7a 37 ff ff ff ff ff ff 01
E: 13.808981 14 01 07 2e 7f 02 7d 37 ff ff ff ff ff ff 01
E: 13.821982 14 01 07 2e 7f 02 7a 37 ff ff ff ff ff ff 01
E: 13.833952 14 01 07 2e 7f 02 77 37 ff ff ff ff ff ff 01
E: 13.845971 14 01 07 2e 7f 02 7a 37 ff ff ff ff ff ff 01
E: 13.858968 14 01 07 2e 7e 02 7c 37 ff ff ff ff ff ff 01
E: 13.870901 14 01 07 2e 7e 02 7e 37 ff ff ff ff ff ff 01
E: 13.882981 14 01 07 2e 7e 02 80 37 ff ff ff ff ff ff 01
E: 13.895981 14 01 07 2e 7e 02 82 37 ff ff ff ff ff ff 01
E: 13.907981 14 01 07 2e 7e 02 83 37 ff ff ff ff ff ff 01
E: 13.920981 14 01 07 2e 7e 02 84 37 ff ff ff ff ff ff 01
E: 13.932963 14 01 07 2e 7e 02 84 37 ff ff ff ff ff ff 01
E: 13.944982 14 01 07 2e 7e 02 85 37 ff ff ff ff ff ff 01
E: 13.957963 14 01 07 2e 7e 02 85 37 ff ff ff ff ff ff 01
E: 13.969982 14 01 07 2e 7f 02 85 37 ff ff ff ff ff ff 01
E: 13.981963 14 01 07 2e 7f 02 85 37 ff ff ff ff ff ff 01
E: 13.995081 14 01 07 2e 7f 02 86 37 ff ff ff ff ff ff 01
E: 14.007060 14 01 07 2e 7f 02 86 37 ff ff ff ff ff ff 01
E: 14.019059 14 01 07 2e 7f 02 86 37 ff ff ff ff ff ff 01
E: 14.032062 14 01 07 2e 7f 02 86 37 ff ff ff ff ff ff 01
E: 14.044061 14 01 07 2e 7f 02 86 37 ff ff ff ff ff ff 01
E: 14.057053 14 01 07 2e 7f 02 86 37 ff ff ff ff ff ff 01
E: 14.069055 14 01 07 2e 7f 02 86 37 ff ff ff ff ff ff 01
E: 14.081081 14 01 07 2e 7f 02 81 37 ff ff ff ff ff ff 01
E: 14.094084 14 01 07 2e 80 02 7c 37 ff ff ff ff ff ff 01
E: 14.106075 14 01 07 2e 80 02 78 37 ff ff ff ff ff ff 01
E: 14.118081 14 01 07 2e 7f 02 7a 37 ff ff ff ff ff ff 01
E: 14.130976 14 01 07 2e 7f 02 7d 37 ff ff ff ff ff ff 01
E: 14.143085 14 01 07 2e 7f 02 7a 37 ff ff ff ff ff ff 01
E: 14.156046 14 01 07 2e 7f 02 77 37 ff ff ff ff ff ff 01
E: 14.168081 14 01 07 2e 7f 02 79 37 ff ff ff ff ff ff 01
E: 14.180082 14 01 07 2e 7f 02 7c 37 ff ff ff ff ff ff 01
E: 14.193084 14 01 07 2e 7f 02 7a 37 ff ff ff ff ff ff 01
E: 14.205081 14 01 07 2e 7f 02 77 37 ff ff ff ff ff ff 01
E: 14.217077 14 01 07 2e 7f 02 79 37 ff ff ff ff ff ff 01
E: 14.229978 14 01 07 2e 7f 02 7c 37 ff ff ff ff ff ff 01
E: 14.242085 14 01 07 2e 7f 02 7a 37 ff ff ff ff ff ff 01
E: 14.255082 14 01 07 2e 7f 02 77 37 ff ff ff ff ff ff 01
E: 14.267085 14 01 07 2e 7f 02 7a 37 ff ff ff ff ff ff 01
E: 14.278977 14 01 07 2e 7f 02 7c 37 ff ff ff ff ff ff 01
E: 14.292086 14 01 07 2e 7f 02 7a 37 ff ff ff ff ff ff 01
E: 14.304078 14 01 07 2e 7f 02 77 37 ff ff ff ff ff ff 01
E: 14.317084 14 01 07 2e 7f 02 7a 37 ff ff ff ff ff ff 01
E: 14.329076 14 01 07 2e 7f 02 7c 37 ff ff ff ff ff ff 01
E: 14.341086 14 01 07 2e 7f 02 7a 37 ff ff ff ff ff ff 01
E: 14.354084 14 01 07 2e 7f 02 77 37 ff ff ff ff ff ff 01
E: 14.366077 14 01 07 2e 80 02 75 37 ff ff ff ff ff ff 01
E: 14.378084 14 01 07 2e 7f 02 78 37 ff ff ff ff ff ff 01
E: 14.391084 14 01 07 2e 7f 02 7b 37 ff ff ff ff ff ff 01
E: 14.403089 14 01 07 2e 7f 02 7e 37 ff ff ff ff ff ff 01
E: 14.416067 14 01 07 2e 7f 02 7b 37 ff ff ff ff ff ff 01
E: 14.428083 14 01 07 2e 7f 02 7d 37 ff ff ff ff ff ff 01
E: 14.440083 14 01 07 2e 7f 02 7f 37 ff ff ff ff ff ff 01
E: 14.452981 14 01 07 2e 7f 02 81 37 ff ff ff ff ff ff 01
E: 14.465090 14 01 07 2e 7f 02 82 37 ff ff ff ff ff ff 01
E: 14.477084 14 01 07 2e 7f 02 83 37 ff ff ff ff ff ff 01
E: 14.490079 14 01 07 2e 7f 02 84 37 ff ff ff ff ff ff 01
E: 14.501966 14 01 07 2e 7f 02 84 37 ff ff ff ff ff ff 01
E: 14.514085 14 01 07 2e 7f 02 85 37 ff ff ff ff ff ff 01
E: 14.527061 14 01 07 2e 7f 02 85 37 ff ff ff ff ff ff 01
E: 14.539044 14 01 07 2e 7f 02 85 37 ff ff ff ff ff ff 01
E: 14.551058 14 01 07 2e 7f 02 85 37 ff ff ff ff ff ff 01
E: 14.564078 14 01 07 2e 7f 02 86 37 ff ff ff ff ff ff 01
E: 14.576062 14 01 07 2e 7f 02 86 37 ff ff ff ff ff ff 01
E: 14.589045 14 01 07 2e 7f 02 86 37 ff ff ff ff ff ff 01
E: 14.601063 14 01 07 2e 7f 02 86 37 ff ff ff ff ff ff 01
E: 14.613064 14 01 07 2e 7f 02 86 37 ff ff ff ff ff ff 01
E: 14.626063 14 01 07 2e 7f 02 86 37 ff ff ff ff ff ff 01
E: 14.638068 14 01 07 2e 7f 02 86 37 ff ff ff ff ff ff 01
E: 14.650065 14 01 07 2e 7f 02 86 37 ff ff ff ff ff ff 01
E: 14.662999 14 01 07 2e 7f 02 86 37 ff ff ff ff ff ff 01
E: 14.674967 14 01 07 2e 7f 02 86 37 ff ff ff ff ff ff 01
E: 14.687974 14 01 07 2e 80 02 87 37 ff ff ff ff ff ff 01
E: 14.699973 14 01 07 2e 81 02 87 37 ff ff ff ff ff ff 01
E: 14.711966 14 01 07 2e 81 02 87 37 ff ff ff ff ff ff 01
E: 14.724967 14 01 07 2e 81 02 87 37 ff ff ff ff ff ff 01
E: 14.736973 14 01 07 2e 81 02 88 37 ff ff ff ff ff ff 01
E: 14.749972 14 01 07 2e 81 02 8c 37 ff ff ff ff ff ff 01
E: 14.761972 14 01 07 2e 80 02 8c 37 ff ff ff ff ff ff 01
E: 14.773971 14 01 07 2e 80 02 8b 37 ff ff ff ff ff ff 01
E: 14.786972 14 01 07 2e 81 02 8a 37 ff ff ff ff ff ff 01
E: 14.798973 14 01 07 2e 80 02 8e 37 ff ff ff ff ff ff 01
E: 14.810973 14 01 07 2e 80 02 8d 37 ff ff ff ff ff ff 01
E: 14.823972 14 01 07 2e 80 02 8c 37 ff ff ff ff ff ff 01
E: 14.835973 14 01 07 2e 81 02 8b 37 ff ff ff ff ff ff 01
E: 14.848972 14 01 07 2e 81 02 8a 37 ff ff ff ff ff ff 01
E: 14.860973 14 01 07 2e 80 02 89 37 ff ff ff ff ff ff 01
E: 14.872972 14 01 07 2e 80 02 88 37 ff ff ff ff ff ff 01
E: 14.885968 14 01 07 2e 80 02 88 37 ff ff ff ff ff ff 01
E: 14.897973 14 01 07 2e 81 02 88 37 ff ff ff ff ff ff 01
E: 14.909972 14 01 07 2e 80 02 88 37 ff ff ff ff ff ff 01
E: 14.922973 14 01 07 2e 80 02 87 37 ff ff ff ff ff ff 01
E: 14.934968 14 01 07 2e 80 02 87 37 ff ff ff ff ff ff 01
E: 14.948090 14 01 07 2e 81 02 88 37 ff ff ff ff ff ff 01
E: 14.960088 14 01 07 2e 81 02 87 37 ff ff ff ff ff ff 01
E: 14.972079 14 01 07 2e 81 02 87 37 ff ff ff ff ff ff 01
E: 14.985088 14 01 07 2e 81 02 88 37 ff ff ff ff ff ff 01
E: 14.997071 14 01 07 2e 82 02 88 37 ff ff ff ff ff ff 01
E: 15.009066 14 01 07 2e 82 02 88 37 ff ff ff ff ff ff 01
E: 15.022098 14 01 07 2e 81 02 88 37 ff ff ff ff ff ff 01
E: 15.034069 14 01 07 2e 81 02 88 37 ff ff ff ff ff ff 01
E: 15.046087 14 01 07 2e 82 02 88 37 ff ff ff ff ff ff 01
E: 15.059088 14 01 07 2e 81 02 87 37 ff ff ff ff ff ff 01
E: 15.071065 14 01 07 2e 81 02 87 37 ff ff ff ff ff ff 01
E: 15.084067 14 01 07 2e 81 02 87 37 ff ff ff ff ff ff 01
E: 15.096090 14 01 07 2e 81 02 88 37 ff ff ff ff ff ff 01
E: 15.108091 14 01 07 2e 81 02 87 37 ff ff ff ff ff ff 01
E: 15.121092 14 01 07 2e 80 02 8c 37 ff ff ff ff ff ff 01
E: 15.133068 14 01 07 2e 80 02 8c 37 ff ff ff ff ff ff 01
E: 15.145090 14 01 07 2e 80 02 8b 37 ff ff ff ff ff ff 01
E: 15.158090 14 01 07 2e 80 02 8f 37 ff ff ff ff ff ff 01
E: 15.170085 14 01 07 2e 80 02 8e 37 ff ff ff ff ff ff 01
E: 15.183091 14 01 07 2e 80 02 8c 37 ff ff ff ff ff ff 01
E: 15.195088 14 01 07 2e 80 02 8b 37 ff ff ff ff ff ff 01
E: 15.206981 14 01 07 2e 81 02 8a 37 ff ff ff ff ff ff 01
E: 15.220092 14 01 07 2e 80 02 89 37 ff ff ff ff ff ff 01
E: 15.232089 14 01 07 2e 80 02 88 37 ff ff ff ff ff ff 01
E: 15.245068 14 01 07 2e 80 02 88 37 ff ff ff ff ff ff 01
E: 15.257090 14 01 07 2e 81 02 88 37 ff ff ff ff ff ff 01
E: 15.268962 14 01 07 2e 81 02 88 37 ff ff ff ff ff ff 01
E: 15.282070 14 01 07 2e 81 02 88 37 ff ff ff ff ff ff 01
E: 15.294061 14 01 07 2e 81 02 88 37 ff ff ff ff ff ff 01
E: 15.306076 14 01 07 2e 82 02 88 37 ff ff ff ff ff ff 01
E: 15.319089 14 01 07 2e 81 02 88 37 ff ff ff ff ff ff 01
E: 15.331091 14 01 07 2e 80 02 87 37 ff ff ff ff ff ff 01
E: 15.343971 14 01 07 2e 81 02 87 37 ff ff ff ff ff ff 01
E: 15.356086 14 01 07 2e 81 02 88 37 ff ff ff ff ff ff 01
E: 15.368093 14 01 07 2e 82 02 88 37 ff ff ff ff ff ff 01
E: 15.381089 14 01 07 2e 81 02 87 37 ff ff ff ff ff ff 01
E: 15.393090 14 01 07 2e 80 02 87 37 ff ff ff ff ff ff 01
E: 15.405089 14 01 07 2e 81 02 87 37 ff ff ff ff ff ff 01
E: 15.417970 14 01 07 2e 81 02 88 37 ff ff ff ff ff ff 01
E: 15.430090 14 01 07 2e 82 02 88 37 ff ff ff ff ff ff 01
E: 15.442069 14 01 07 2e 82 02 88 37 ff ff ff ff ff ff 01
E: 15.455068 14 01 07 2e 82 02 88 37 ff ff ff ff ff ff 01
E: 15.467070 14 01 07 2e 82 02 88 37 ff ff ff ff ff ff 01
E: 15.480070 14 01 07 2e 82 02 88 37 ff ff ff ff ff ff 01
E: 15.492099 14 01 07 2e 81 02 87 37 ff ff ff ff ff ff 01
E: 15.504072 14 01 07 2e 81 02 87 37 ff ff ff ff ff ff 01
E: 15.517095 14 01 07 2e 81 02 88 37 ff ff ff ff ff ff 01
E: 15.529090 14 01 07 2e 81 02 87 37 ff ff ff ff ff ff 01
E: 15.541086 14 01 07 2e 80 02 87 37 ff ff ff ff ff ff 01
E: 15.554094 14 01 07 2e 81 02 87 37 ff ff ff ff ff ff 01
E: 15.566070 14 01 07 2e 81 02 87 37 ff ff ff ff ff ff 01
E: 15.579070 14 01 07 2e 81 02 87 37 ff ff ff ff ff ff 01
E: 15.591092 14 01 07 2e 80 02 87 37 ff ff ff ff ff ff 01
E: 15.603093 14 01 07 2e 81 02 87 37 ff ff ff ff ff ff 01
E: 15.616068 14 01 07 2e 81 02 87 37 ff ff ff ff ff ff 01
E: 15.628026 14 01 07 2e 81 02 88 37 ff ff ff ff ff ff 01
E: 15.640082 14 01 07 2e 81 02 87 37 ff ff ff ff ff ff 01
E: 15.652996 14 01 07 2e 80 02 87 37 ff ff ff ff ff ff 01
E: 15.665081 14 01 07 2e 81 02 87 37 ff ff ff ff ff ff 01
E: 15.677073 14 01 07 2e 81 02 87 37 ff ff ff ff ff ff 01
E: 15.690047 14 01 07 2e 81 02 87 37 ff ff ff ff ff ff 01
E: 15.702083 14 01 07 2e 80 02 87 37 ff ff ff ff ff ff 01
E: 15.715094 14 01 07 2e 81 02 87 37 ff ff ff ff ff ff 01
E: 15.727072 14 01 07 2e 81 02 87 37 ff ff ff ff ff ff 01
E: 15.739052 14 01 07 2e 81 02 87 37 ff ff ff ff ff ff 01
E: 15.752073 14 01 07 2e 81 02 87 37 ff ff ff ff ff ff 01
E: 15.764093 14 01 07 2e 81 02 88 37 ff ff ff ff ff ff 01
E: 15.777093 14 01 07 2e 82 02 88 37 ff ff ff ff ff ff 01
E: 15.789071 14 01 07 2e 81 02 87 37 ff ff ff ff ff ff 01
E: 15.801092 14 01 07 2e 81 02 88 37 ff ff ff ff ff ff 01
E: 15.814089 14 01 07 2e 82 02 88 37 ff ff ff ff ff ff 01
E: 15.826073 14 01 07 2e 82 02 88 37 ff ff ff ff ff ff 01
E: 15.838073 14 01 07 2e 82 02 88 37 ff ff ff ff ff ff 01
E: 15.851073 14 01 07 2e 82 02 88 37 ff ff ff ff ff ff 01
E: 15.863071 14 01 07 2e 82 02 88 37 ff ff ff ff ff ff 01
E: 15.876073 14 01 07 2e 82 02 88 37 ff ff ff ff ff ff 01
E: 15.888070 14 01 07 2e 82 02 88 37 ff ff ff ff ff ff 01
E: 15.900095 14 01 07 2e 81 02 88 37 ff ff ff ff ff ff 01
E: 15.913092 14 01 07 2e 81 02 87 37 ff ff ff ff ff ff 01
E: 15.925074 14 01 07 2e 81 02 87 37 ff ff ff ff ff ff 01
E: 15.937096 14 01 07 2e 81 02 88 37 ff ff ff ff ff ff 01
E: 15.950094 14 01 07 2e 82 02 88 37 ff ff ff ff ff ff 01
E: 15.962072 14 01 07 2e 82 02 88 37 ff ff ff ff ff ff 01
E: 15.974072 14 01 07 2e 82 02 88 37 ff ff ff ff ff ff 01
E: 15.987072 14 01 07 2e 82 02 88 37 ff ff ff ff ff ff 01
E: 15.999072 14 01 07 2e 82 02 88 37 ff ff ff ff ff ff 01
E: 16.012096 14 01 07 2e 81 02 87 37 ff ff ff ff ff ff 01
E: 16.024070 14 01 07 2e 81 02 87 37 ff ff ff ff ff ff 01
E: 16.036094 14 01 07 2e 81 02 88 37 ff ff ff ff ff ff 01
E: 16.049097 14 01 07 2e 82 02 88 37 ff ff ff ff ff ff 01
E: 16.061088 14 01 07 2e 81 02 87 37 ff ff ff ff ff ff 01
E: 16.073089 14 01 07 2e 81 02 88 37 ff ff ff ff ff ff 01
E: 16.085989 14 01 07 2e 82 02 88 37 ff ff ff ff ff ff 01
E: 16.098076 14 01 07 2e 82 02 88 37 ff ff ff ff ff ff 01
E: 16.111096 14 01 07 2e 81 02 88 37 ff ff ff ff ff ff 01
E: 16.123096 14 01 07 2e 81 02 87 37 ff ff ff ff ff ff 01
E: 16.135073 14 01 07 2e 81 02 87 37 ff ff ff ff ff ff 01
E: 16.148058 14 01 07 2e 80 02 87 37 ff ff ff ff ff ff 01
E: 16.160096 14 01 07 2e 80 02 8c 37 ff ff ff ff ff ff 01
E: 16.171988 14 01 07 2e 7f 02 8b 37 ff ff ff ff ff ff 01
E: 16.185092 14 01 07 2e 7f 02 8a 37 ff ff ff ff ff ff 01
E: 16.197097 14 01 07 2e 7f 02 8e 37 ff ff ff ff ff ff 01
E: 16.210098 14 01 07 2e 7d 02 92 37 ff ff ff ff ff ff 01
E: 16.221992 14 01 07 2e 7d 02 90 37 ff ff ff ff ff ff 01
E: 16.234086 14 01 07 2e 7e 02 8e 37 ff ff ff ff ff ff 01
E: 16.247083 14 01 07 2e 7e 02 91 37 ff ff ff ff ff ff 01
E: 16.258946 14 01 07 2e 7e 02 94 37 ff ff ff ff ff ff 01
E: 16.270953 14 01 07 2e 7e 02 92 37 ff ff ff ff ff ff 01
E: 16.283952 14 01 07 2e 7e 02 8f 37 ff ff ff ff ff ff 01
E: 16.296099 14 01 07 2e 7f 02 92 37 ff ff ff ff ff ff 01
E: 16.309098 14 01 07 2e 7f 02 95 37 ff ff ff ff ff ff 01
E: 16.320994 14 01 07 2e 7e 02 97 37 ff ff ff ff ff ff 01
E: 16.333087 14 01 07 2e 7f 02 95 37 ff ff ff ff ff ff 01
E: 16.346087 14 01 07 2e 80 02 92 37 ff ff ff ff ff ff 01
E: 16.358087 14 01 07 2e 80 02 94 37 ff ff ff ff ff ff 01
E: 16.371098 14 01 07 2e 80 02 97 37 ff ff ff ff ff ff 01
E: 16.383099 14 01 07 2e 7f 02 94 37 ff ff ff ff ff ff 01
E: 16.395097 14 01 07 2e 80 02 91 37 ff ff ff ff ff ff 01
E: 16.406980 14 01 07 2e 80 02 93 37 ff ff ff ff ff ff 01
E: 16.420099 14 01 07 2e 80 02 96 37 ff ff ff ff ff ff 01
E: 16.432097 14 01 07 2e 7f 02 93 37 ff ff ff ff ff ff 01
E: 16.445090 14 01 07 2e 80 02 91 37 ff ff ff ff ff ff 01
E: 16.456987 14 01 07 2e 80 02 93 37 ff ff ff ff ff ff 01
E: 16.470100 14 01 07 2e 80 02 96 37 ff ff ff ff ff ff 01
E: 16.482090 14 01 07 2e 7f 02 93 37 ff ff ff ff ff ff 01
E: 16.493943 14 01 07 2e 80 02 95 37 ff ff ff ff ff ff 01
E: 16.505958 14 01 07 2e 80 02 98 37 ff ff ff ff ff ff 01
E: 16.518959 14 01 07 2e 80 02 9a 37 ff ff ff ff ff ff 01
E: 16.531098 14 01 07 2e 7f 02 9b 37 ff ff ff ff ff ff 01
E: 16.544098 14 01 07 2e 7f 02 9c 37 ff ff ff ff ff ff 01
E: 16.555988 14 01 07 2e 80 02 98 37 ff ff ff ff ff ff 01
E: 16.568099 14 01 07 2e 80 02 99 37 ff ff ff ff ff ff 01
E: 16.581095 14 01 07 2e 7f 02 9a 37 ff ff ff ff ff ff 01
E: 16.593100 14 01 07 2e 7f 02 9b 37 ff ff ff ff ff ff 01
E: 16.606086 14 01 07 2e 7f 02 9c 37 ff ff ff ff ff ff 01
E: 16.618085 14 01 07 2e 80 02 9d 37 ff ff ff ff ff ff 01
E: 16.630088 14 01 07 2e 7f 02 9e 37 ff ff ff ff ff ff 01
E: 16.642988 14 01 07 2e 7f 02 99 37 ff ff ff ff ff ff 01
E: 16.655089 14 01 07 2e 7f 02 94 37 ff ff ff ff ff ff 01
E: 16.666997 14 01 07 2e 7e 02 95 37 ff ff ff ff ff ff 01
E: 16.680101 14 01 07 2e 7e 02 97 37 ff ff ff ff ff ff 01
E: 16.692102 14 01 07 2e 7e 02 94 37 ff ff ff ff ff ff 01
E: 16.705100 14 01 07 2e 7e 02 91 37 ff ff ff ff ff ff 01
E: 16.716999 14 01 07 2e 7e 02 93 37 ff ff ff ff ff ff 01
E: 16.729091 14 01 07 2e 7e 02 95 37 ff ff ff ff ff ff 01
E: 16.742090 14 01 07 2e 7e 02 93 37 ff ff ff ff ff ff 01
E: 16.753950 14 01 07 2e 7f 02 90 37 ff ff ff ff ff ff 01
E: 16.765957 14 01 07 2e 80 02 93 37 ff ff ff ff ff ff 01
E: 16.778955 14 01 07 2e 7f 02 96 37 ff ff ff ff ff ff 01
E: 16.790954 14 01 07 2e 7f 02 93 37 ff ff ff ff ff ff 01
E: 16.803939 14 01 07 2e 80 02 90 37 ff ff ff ff ff ff 01
E: 16.815936 14 01 07 2e 80 02 8e 37 ff ff ff ff ff ff 01
E: 16.827922 14 01 07 2e 80 02 91 37 ff ff ff ff ff ff 01
E: 16.840910 14 01 07 2e 7f 02 94 37 ff ff ff ff ff ff 01
E: 16.853102 14 01 07 2e 7f 02 97 37 ff ff ff ff ff ff 01
E: 16.866101 14 01 07 2e 7f 02 94 37 ff ff ff ff ff ff 01
E: 16.877999 14 01 07 2e 80 02 96 37 ff ff ff ff ff ff 01
E: 16.890090 14 01 07 2e 7f 02 98 37 ff ff ff ff ff ff 01
E: 16.903092 14 01 07 2e 7f 02 95 37 ff ff ff ff ff ff 01
E: 16.914942 14 01 07 2e 80 02 97 37 ff ff ff ff ff ff 01
E: 16.927093 14 01 07 2e 7d 02 97 37 ff ff ff ff ff ff 01
E: 16.940091 14 01 07 2e 7e 02 99 37 ff ff ff ff ff ff 01
E: 16.954988 14 01 07 2e 78 02 79 37 ff ff ff ff ff ff 01
E: 16.968093 14 01 07 2e 73 02 5d 37 07 2f d6 7c f2 35 02
E: 16.980093 14 01 07 2e 6f 02 49 37 07 2f d6 7c f2 35 02
E: 16.992995 14 01 07 2e 6b 02 3a 37 07 2f d6 7c f2 35 02
E: 17.004959 14 01 07 2e 6a 02 30 37 07 2f d6 7c f2 35 02
E: 17.017958 14 01 07 2e 69 02 29 37 07 2f d6 7c f2 35 02
E: 17.029957 14 01 07 2e 68 02 24 37 07 2f d6 7c f2 35 02
E: 17.042942 14 01 07 2e 66 02 20 37 07 2f d6 7c f2 35 02
E: 17.054923 14 01 07 2e 66 02 1d 37 07 2f d9 7c 18 36 02
E: 17.066945 14 01 07 2e 66 02 1b 37 07 2f dd 7c 1d 36 02
E: 17.080103 14 01 07 2e 65 02 19 37 07 2f e1 7c 1f 36 02
E: 17.092104 14 01 07 2e 65 02 16 37 07 2f e4 7c 23 36 02
E: 17.104996 14 01 07 2e 65 02 14 37 07 2f e7 7c 21 36 02
E: 17.117094 14 01 07 2e 66 02 13 37 07 2f ea 7c 21 36 02
E: 17.129087 14 01 07 2e 67 02 12 37 07 2f ec 7c 21 36 02
E: 17.141943 14 01 07 2e 66 02 10 37 07 2f ed 7c 20 36 02
E: 17.153960 14 01 07 2e 66 02 0e 37 07 2f ed 7c 1f 36 02
E: 17.166959 14 01 07 2e 66 02 0e 37 07 2f ef 7c 1d 36 02
E: 17.179104 14 01 07 2e 66 02 0c 37 07 2f f0 7c 1e 36 02
E: 17.191105 14 01 07 2e 65 02 0c 37 07 2f f0 7c 1e 36 02
E: 17.204106 14 01 07 2e 64 02 0a 37 07 2f f0 7c 1e 36 02
E: 17.215995 14 01 07 2e 64 02 08 37 07 2f f0 7c 1c 36 02
E: 17.228964 14 01 07 2e 64 02 07 37 07 2f f1 7c 1c 36 02
E: 17.240960 14 01 07 2e 63 02 06 37 07 2f f1 7c 1e 36 02
E: 17.253961 14 01 07 2e 62 02 05 37 07 2f f2 7c 1d 36 02
E: 17.265959 14 01 07 2e 62 02 03 37 07 2f f2 7c 1c 36 02
E: 17.278106 14 01 07 2e 64 02 02 37 07 2f f3 7c 1e 36 02
E: 17.291103 14 01 07 2e 63 02 02 37 07 2f f4 7c 1f 36 02
E: 17.303105 14 01 07 2e 62 02 02 37 07 2f f3 7c 1f 36 02
E: 17.315989 14 01 07 2e 63 02 01 37 07 2f f3 7c 1e 36 02
E: 17.327961 14 01 07 2e 64 02 00 37 07 2f f3 7c 1e 36 02
E: 17.340981 14 01 07 2e 64 02 fe 36 07 2f f3 7c 20 36 02
E: 17.352959 14 01 07 2e 63 02 fc 36 07 2f f3 7c 20 36 02
E: 17.366111 14 01 07 2e 63 02 fa 36 07 2f f2 7c 1e 36 02
E: 17.378108 14 01 07 2e 62 02 f8 36 07 2f f3 7c 1f 36 02
E: 17.391105 14 01 07 2e 62 02 f7 36 07 2f f4 7c 20 36 02
E: 17.402996 14 01 07 2e 61 02 f7 36 07 2f f4 7c 20 36 02
E: 17.415107 14 01 07 2e 62 02 f5 36 07 2f f5 7c 1e 36 02
E: 17.428106 14 01 07 2e 62 02 f5 36 07 2f f6 7c 1f 36 02
E: 17.440108 14 01 07 2e 61 02 f6 36 07 2f f6 7c 21 36 02
E: 17.452947 14 01 07 2e 61 02 f6 36 07 2f f5 7c 1f 36 02
E: 17.465107 14 01 07 2e 60 02 f6 36 07 2f f5 7c 1c 36 02
E: 17.478104 14 01 07 2e 60 02 f5 36 07 2f f5 7c 1c 36 02
E: 17.490105 14 01 07 2e 5f 02 f5 36 07 2f f6 7c 1a 36 02
E: 17.501946 14 01 07 2e 60 02 f6 36 07 2f f6 7c 19 36 02
E: 17.514961 14 01 07 2e 60 02 f7 36 07 2f f7 7c 18 36 02
E: 17.526961 14 01 07 2e 60 02 f6 36 07 2f f8 7c 17 36 02
E: 17.539975 14 01 07 2e 5f 02 f8 36 07 2f f9 7c 16 36 02
E: 17.551960 14 01 07 2e 5e 02 fb 36 07 2f f9 7c 16 36 02
E: 17.565110 14 01 07 2e 5e 02 fd 36 07 2f f8 7c 16 36 02
E: 17.577109 14 01 07 2e 5f 02 ff 36 07 2f fa 7c 16 36 02
E: 17.588995 14 01 07 2e 5f 02 02 37 07 2f fb 7c 16 36 02
E: 17.602107 14 01 07 2e 5e 02 04 37 07 2f fb 7c 17 36 02
E: 17.614105 14 01 07 2e 5d 02 05 37 07 2f fb 7c 16 36 02
E: 17.626992 14 01 07 2e 5e 02 04 37 07 2f fc 7c 15 36 02
E: 17.639104 14 01 07 2e 5f 02 02 37 07 2f fd 7c 15 36 02
E: 17.651003 14 01 07 2e 5e 02 02 37 07 2f fd 7c 17 36 02
E: 17.664104 14 01 07 2e 5d 02 00 37 07 2f fc 7c 17 36 02
E: 17.676105 14 01 07 2e 5d 02 fc 36 07 2f fc 7c 15 36 02
E: 17.688945 14 01 07 2e 5e 02 fd 36 07 2f fc 7c 14 36 02
E: 17.701123 14 01 07 2e 5e 02 ff 36 07 2f fc 7c 17 36 02
E: 17.713026 14 01 07 2e 5d 02 ff 36 07 2f fa 7c 17 36 02
E: 17.725999 14 01 07 2e 5e 02 ff 36 07 2f fa 7c 15 36 02
E: 17.737975 14 01 07 2e 60 02 00 37 07 2f fc 7c 15 36 02
E: 17.750998 14 01 07 2e 5f 02 01 37 07 2f fb 7c 16 36 02
E: 17.762998 14 01 07 2e 5f 02 01 37 07 2f fa 7c 15 36 02
E: 17.775997 14 01 07 2e 5f 02 03 37 07 2f fa 7c 13 36 02
E: 17.787999 14 01 07 2e 60 02 05 37 07 2f fb 7c 13 36 02
E: 17.800997 14 01 07 2e 60 02 06 37 07 2f fb 7c 16 36 02
E: 17.812997 14 01 07 2e 60 02 07 37 07 2f f9 7c 16 36 02
E: 17.825940 14 01 07 2e 60 02 08 37 07 2f f9 7c 15 36 02
E: 17.837999 14 01 07 2e 61 02 0a 37 07 2f f9 7c 16 36 02
E: 17.849997 14 01 07 2e 61 02 0a 37 07 2f fa 7c 15 36 02
E: 17.862998 14 01 07 2e 61 02 0a 37 07 2f f9 7c 15 36 02
E: 17.874997 14 01 07 2e 62 02 0a 37 07 2f f8 7c 15 36 02
E: 17.887975 14 01 07 2e 63 02 0c 37 07 2f f8 7c 17 36 02
E: 17.899998 14 01 07 2e 63 02 0f 37 07 2f f9 7c 16 36 02
E: 17.912997 14 01 07 2e 62 02 0f 37 07 2f f8 7c 16 36 02
E: 17.924977 14 01 07 2e 63 02 11 37 07 2f f8 7c 15 36 02
E: 17.937998 14 01 07 2e 65 02 11 37 07 2f f9 7c 14 36 02
E: 17.949965 14 01 07 2e 65 02 0f 37 07 2f fa 7c 13 36 02
E: 17.961981 14 01 07 2e 65 02 0e 37 07 2f fa 7c 13 36 02
E: 17.974999 14 01 07 2e 66 02 0d 37 07 2f f9 7c 13 36 02
E: 17.986999 14 01 07 2e 67 02 0d 37 07 2f fb 7c 14 36 02
E: 17.999936 14 01 07 2e 67 02 0c 37 07 2f fc 7c 14 36 02
E: 18.012106 14 01 07 2e 68 02 0a 37 07 2f fa 7c 14 36 02
E: 18.025107 14 01 07 2e 69 02 0b 37 07 2f fa 7c 14 36 02
E: 18.036997 14 01 07 2e 6b 02 0b 37 07 2f fb 7c 14 36 02
E: 18.050102 14 01 07 2e 6d 02 0c 37 07 2f fc 7c 15 36 02
E: 18.062097 14 01 07 2e 6f 02 0b 37 07 2f fb 7c 14 36 02
E: 18.074950 14 01 07 2e 71 02 0c 37 07 2f fa 7c 13 36 02
E: 18.086966 14 01 07 2e 73 02 0d 37 07 2f fb 7c 14 36 02
E: 18.098964 14 01 07 2e 76 02 10 37 07 2f fc 7c 14 36 02
E: 18.111964 14 01 07 2e 78 02 11 37 07 2f fb 7c 14 36 02
E: 18.123949 14 01 07 2e 79 02 13 37 07 2f f9 7c 14 36 02
E: 18.136930 14 01 07 2e 7b 02 16 37 07 2f f9 7c 11 36 02
E: 18.149096 14 01 07 2e 7e 02 18 37 07 2f f9 7c 12 36 02
E: 18.161099 14 01 07 2e 80 02 1d 37 07 2f f9 7c 13 36 02
E: 18.173992 14 01 07 2e 81 02 21 37 07 2f f8 7c 14 36 02
E: 18.186099 14 01 07 2e 83 02 27 37 07 2f f8 7c 13 36 02
E: 18.198992 14 01 07 2e 86 02 2e 37 07 2f f8 7c 13 36 02
E: 18.210974 14 01 07 2e 89 02 35 37 07 2f f6 7c 15 36 02
E: 18.222973 14 01 07 2e 8d 02 37 37 07 2f f4 7c 16 36 02
E: 18.235971 14 01 07 2e 94 02 3b 37 07 2f f2 7c 14 36 02
E: 18.247949 14 01 07 2e 9d 02 42 37 07 2f f0 7c 14 36 02
E: 18.260919 14 01 07 2e a8 02 4a 37 07 2f ed 7c 16 36 02
E: 18.272918 14 01 07 2e b4 02 54 37 07 2f e7 7c 16 36 02
E: 18.285926 14 01 07 2e c2 02 5e 37 07 2f e0 7c 16 36 02
E: 18.298111 14 01 07 2e d2 02 68 37 07 2f d6 7c 13 36 02
E: 18.310109 14 01 07 2e e5 02 76 37 07 2f cc 7c 0f 36 02
E: 18.323001 14 01 07 2e fb 02 84 37 07 2f bf 7c 0a 36 02
E: 18.335095 14 01 07 2e 15 03 91 37 07 2f af 7c 07 36 02
E: 18.348101 14 01 07 2e 33 03 a1 37 07 2f 9f 7c 06 36 02
E: 18.359953 14 01 07 2e 53 03 b3 37 07 2f 8d 7c 05 36 02
E: 18.372969 14 01 07 2e 79 03 cb 37 07 2f 77 7c 03 36 02
E: 18.385111 14 01 07 2e a5 03 eb 37 07 2f 5f 7c 00 36 02
E: 18.398108 14 01 07 2e d6 03 0f 38 07 2f 45 7c fe 35 02
E: 18.410109 14 01 07 2e 0a 04 31 38 07 2f 28 7c fe 35 02
E: 18.422000 14 01 07 2e 42 04 53 38 07 2f 07 7c fa 35 02
E: 18.435100 14 01 07 2e 83 04 7c 38 07 2f e1 7b f8 35 02
E: 18.446997 14 01 07 2e c9 04 a7 38 07 2f bc 7b f5 35 02
E: 18.459972 14 01 07 2e 11 05 d2 38 07 2f 94 7b f3 35 02
E: 18.472100 14 01 07 2e 5f 05 01 39 07 2f 66 7b ea 35 02
E: 18.484998 14 01 07 2e b8 05 36 39 07 2f 33 7b e2 35 02
E: 18.497113 14 01 07 2e 18 06 66 39 07 2f fc 7a d5 35 02
E: 18.510110 14 01 07 2e 7d 06 9b 39 07 2f c1 7a c6 35 02
E: 18.522005 14 01 07 2e e5 06 cd 39 07 2f 80 7a b6 35 02
E: 18.535109 14 01 07 2e 54 07 fd 39 07 2f 3b 7a a3 35 02
E: 18.547102 14 01 07 2e c6 07 29 3a 07 2f f2 79 8d 35 02
E: 18.559954 14 01 07 2e 3c 08 59 3a 07 2f a2 79 70 35 02
E: 18.571969 14 01 07 2e ba 08 8c 3a 07 2f 4a 79 4e 35 02
E: 18.583967 14 01 07 2e 3e 09 bf 3a 07 2f ef 78 2a 35 02
E: 18.596959 14 01 07 2e c8 09 ef 3a 07 2f 93 78 05 35 02
E: 18.609103 14 01 07 2e 55 0a 1c 3b 07 2f 34 78 de 34 02
E: 18.621994 14 01 07 2e e7 0a 4f 3b 07 2f d0 77 b4 34 02
E: 18.634101 14 01 07 2e 7d 0b 83 3b 07 2f 6a 77 89 34 02
E: 18.646953 14 01 07 2e 1b 0c bb 3b 07 2f 05 77 59 34 02
E: 18.659036 14 01 07 2e bb 0c ef 3b 07 2f 9d 76 27 34 02
E: 18.671969 14 01 07 2e 5e 0d 2a 3c 07 2f 32 76 f4 33 02
E: 18.683969 14 01 07 2e fd 0d 61 3c 07 2f bf 75 ba 33 02
E: 18.696968 14 01 07 2e a6 0e 97 3c 07 2f 4c 75 7d 33 02
E: 18.708953 14 01 07 2e 55 0f d4 3c 07 2f d5 74 40 33 02
E: 18.720922 14 01 07 2e 03 10 10 3d 07 2f 59 74 fe 32 02
E: 18.733930 14 01 07 2e b6 10 4d 3d 07 2f d9 73 b9 32 02
E: 18.746002 14 01 07 2e 76 11 89 3d 07 2f 5a 73 74 32 02
E: 18.759000 14 01 07 2e 3b 12 c5 3d 07 2f d6 72 2f 32 02
E: 18.771000 14 01 07 2e 02 13 00 3e 07 2f 4b 72 e7 31 02
E: 18.784002 14 01 07 2e cd 13 36 3e 07 2f bf 71 a1 31 02
E: 18.795973 14 01 07 2e 9c 14 68 3e 07 2f 31 71 56 31 02
E: 18.807969 14 01 07 2e 6b 15 9c 3e 07 2f a3 70 16 31 02
E: 18.820969 14 01 07 2e 3a 16 d4 3e 07 2f 0d 70 d7 30 02
E: 18.832954 14 01 07 2e 0d 17 09 3f 07 2f 73 6f 95 30 02
E: 18.845933 14 01 07 2e e5 17 41 3f 07 2f d6 6e 4d 30 02
E: 18.857961 14 01 07 2e c2 18 79 3f 07 2f 37 6e 05 30 02
E: 18.870006 14 01 07 2e 98 19 b1 3f 07 2f 96 6d c2 2f 02
E: 18.883002 14 01 07 2e 72 1a e9 3f 07 2f ee 6c 7b 2f 02
E: 18.894986 14 01 07 2e 50 1b 1f 40 07 2f 45 6c 31 2f 02
E: 18.907969 14 01 07 2e 38 1c 54 40 07 2f 9a 6b ea 2e 02
E: 18.920003 14 01 07 2e 1b 1d 86 40 07 2f e7 6a 9d 2e 02
E: 18.933003 14 01 07 2e 06 1e b8 40 07 2f 33 6a 4b 2e 02
E: 18.944984 14 01 07 2e ee 1e e8 40 07 2f 7e 69 f6 2d 02
E: 18.958115 14 01 07 2e e0 1f 20 41 07 2f c7 68 a2 2d 02
E: 18.970107 14 01 07 2e d4 20 55 41 07 2f 0e 68 53 2d 02
E: 18.982955 14 01 07 2e b5 21 95 41 07 2f 48 67 fe 2c 02
E: 18.994971 14 01 07 2e d9 22 cd 41 07 2f 84 66 a5 2c 02
E: 19.006969 14 01 07 2e e6 23 0d 42 07 2f bd 65 50 2c 02
E: 19.019984 14 01 07 2e df 24 4b 42 07 2f dd 64 03 2c 02
E: 19.031968 14 01 07 2e 12 26 86 42 07 2f 06 64 b9 2b 02
E: 19.045117 14 01 07 2e 05 27 bf 42 07 2f 30 63 6d 2b 02
E: 19.057113 14 01 07 2e 2b 28 04 43 07 2f 57 62 20 2b 02
E: 19.070010 14 01 07 2e 2c 29 40 43 07 2f 7c 61 db 2a 02
E: 19.082105 14 01 07 2e 3b 2a 82 43 07 2f 95 60 93 2a 02
E: 19.094103 14 01 07 2e 35 2b b5 43 07 2f b4 5f 4e 2a 02
E: 19.106956 14 01 07 2e 42 2c ed 43 07 2f d5 5e 0b 2a 02
E: 19.118972 14 01 07 2e 36 2d 20 44 07 2f f1 5d cb 29 02
E: 19.131971 14 01 07 2e 23 2e 52 44 07 2f 09 5d 8c 29 02
E: 19.143970 14 01 07 2e 0f 2f 83 44 07 2f 23 5c 51 29 02
E: 19.155954 14 01 07 2e 1b 30 c2 44 07 2f 47 5b 19 29 02
E: 19.168924 14 01 07 2e f6 30 f5 44 07 2f 6e 5a e7 28 02
E: 19.180935 14 01 07 2e cd 31 27 45 07 2f 8f 59 b9 28 02
E: 19.193926 14 01 07 2e a4 32 51 45 07 2f ab 58 8f 28 02
E: 19.206013 14 01 07 2e 77 33 73 45 07 2f d4 57 64 28 02
E: 19.218116 14 01 07 2e 45 34 93 45 07 2f d5 56 2c 28 02
E: 19.229999 14 01 07 2e 6b 35 ea 45 07 2f 1c 56 11 28 02
E: 19.242116 14 01 07 2e bd 35 df 45 07 2f 19 55 e8 27 02
E: 19.254999 14 01 07 2e 87 36 ea 45 07 2f 92 54 e8 27 02
E: 19.267979 14 01 07 2e 30 37 f3 45 07 2f a8 53 eb 27 02
E: 19.281116 14 01 07 2e 07 38 18 46 07 2f b0 52 c7 27 02
E: 19.293116 14 01 07 2e b6 38 38 46 07 2f d5 51 a9 27 02
E: 19.305958 14 01 07 2e 74 39 5d 46 07 2f fa 50 8c 27 02
E: 19.318115 14 01 07 2e 30 3a 82 46 07 2f 1d 50 7a 27 02
E: 19.331106 14 01 07 2e e6 3a aa 46 07 2f 34 4f 70 27 02
E: 19.343107 14 01 07 2e 9d 3b d8 46 07 2f 49 4e 6d 27 02
E: 19.355107 14 01 07 2e 52 3c 07 47 07 2f 62 4d 6b 27 02
E: 19.368114 14 01 07 2e 05 3d 33 47 07 2f 7e 4c 6e 27 02
E: 19.380106 14 01 07 2e aa 3d 5b 47 07 2f 9f 4b 72 27 02
E: 19.393117 14 01 07 2e 51 3e 80 47 07 2f b6 4a 7b 27 02
E: 19.405116 14 01 07 2e f4 3e 9f 47 07 2f d5 49 88 27 02
E: 19.417117 14 01 07 2e 8f 3f b7 47 07 2f f7 48 96 27 02
E: 19.430120 14 01 07 2e 2a 40 c8 47 07 2f 16 48 a7 27 02
E: 19.442108 14 01 07 2e bb 40 d1 47 07 2f 2d 47 b8 27 02
E: 19.455106 14 01 07 2e 50 41 d6 47 07 2f 51 46 ca 27 02
E: 19.467116 14 01 07 2e e6 41 d9 47 07 2f 73 45 e0 27 02
E: 19.479117 14 01 07 2e 73 42 d8 47 07 2f 95 44 f4 27 02
E: 19.492116 14 01 07 2e fd 42 d2 47 07 2f b4 43 02 28 02
E: 19.504118 14 01 07 2e 8a 43 c4 47 07 2f e0 42 13 28 02
E: 19.517109 14 01 07 2e 10 44 b2 47 07 2f 0b 42 2a 28 02
E: 19.529108 14 01 07 2e 90 44 9a 47 07 2f 35 41 42 28 02
E: 19.542107 14 01 07 2e 0c 45 7f 47 07 2f 5f 40 58 28 02
E: 19.554115 14 01 07 2e 82 45 63 47 07 2f 8d 3f 70 28 02
E: 19.567108 14 01 07 2e 02 46 46 47 07 2f cb 3e 90 28 02
E: 19.579112 14 01 07 2e 78 46 30 47 07 2f fe 3d b6 28 02
E: 19.591108 14 01 07 2e eb 46 1c 47 07 2f 26 3d df 28 02
E: 19.604108 14 01 07 2e 5f 47 06 47 07 2f 51 3c 06 29 02
E: 19.616116 14 01 07 2e e3 47 ed 46 07 2f 7b 3b 33 29 02
E: 19.629117 14 01 07 2e 59 48 da 46 07 2f af 3a 65 29 02
E: 19.641108 14 01 07 2e d0 48 cc 46 07 2f da 39 9a 29 02
E: 19.654128 14 01 07 2e 42 49 be 46 07 2f 11 39 cd 29 02
E: 19.666119 14 01 07 2e b4 49 b7 46 07 2f 3d 38 0e 2a 02
E: 19.679108 14 01 07 2e 2e 4a af 46 07 2f 81 37 49 2a 02
E: 19.690110 14 01 07 2e b1 4a 9d 46 07 2f 82 36 a6 2a 02
E: 19.703025 14 01 07 2e 12 4b 9c 46 07 2f c8 35 f3 2a 02
E: 19.715109 14 01 07 2e 7b 4b 9d 46 07 2f 43 35 20 2b 02
E: 19.727107 14 01 07 2e cb 4b ad 46 07 2f 7c 34 6d 2b 02
E: 19.740107 14 01 07 2e 76 4c 8b 46 07 2f 82 33 ef 2b 02
E: 19.753115 14 01 07 2e cb 4c 88 46 07 2f d9 32 43 2c 02
E: 19.765120 14 01 07 2e 06 4d a0 46 07 2f 25 32 a3 2c 02
E: 19.778118 14 01 07 2e 71 4d 9f 46 07 2f 81 31 fd 2c 02
E: 19.791110 14 01 07 2e ca 4d 9f 46 07 2f 91 30 95 2d 02
E: 19.803119 14 01 07 2e 19 4e 9c 46 07 2f ec 2f 05 2e 02
E: 19.816118 14 01 07 2e 6d 4e 91 46 07 2f 41 2f 79 2e 02
E: 19.828118 14 01 07 2e ba 4e 88 46 07 2f 9d 2e f1 2e 02
E: 19.840106 14 01 07 2e fb 4e 84 46 07 2f 0c 2e 5c 2f 02
E: 19.853118 14 01 07 2e 38 4f 81 46 07 2f 82 2d c0 2f 02
E: 19.865119 14 01 07 2e 76 4f 7d 46 07 2f 09 2d 19 30 02
E: 19.878119 14 01 07 2e ae 4f 7c 46 07 2f 9b 2c 67 30 02
E: 19.890121 14 01 07 2e de 4f 7e 46 07 2f 31 2c ae 30 02
E: 19.903116 14 01 07 2e 07 50 80 46 07 2f cf 2b e8 30 02
E: 19.915119 14 01 07 2e 2f 50 7f 46 07 2f 75 2b 1d 31 02
E: 19.927110 14 01 07 2e 54 50 80 46 07 2f 20 2b 4b 31 02
E: 19.940120 14 01 07 2e 72 50 7e 46 07 2f d2 2a 73 31 02
E: 19.952120 14 01 07 2e 8a 50 7b 46 07 2f 86 2a 9b 31 02
E: 19.965109 14 01 07 2e a1 50 75 46 07 2f 42 2a c1 31 02
E: 19.977118 14 01 07 2e b8 50 6f 46 07 2f 03 2a e4 31 02
E: 19.990110 14 01 07 2e cb 50 68 46 07 2f c3 29 0a 32 02
E: 20.002110 14 01 07 2e d9 50 62 46 07 2f 88 29 2d 32 02
E: 20.015121 14 01 07 2e e5 50 5a 46 07 2f 52 29 51 32 02
E: 20.027118 14 01 07 2e ef 50 56 46 07 2f 24 29 74 32 02
E: 20.039109 14 01 07 2e f5 50 54 46 07 2f fc 28 97 32 02
E: 20.052120 14 01 07 2e f7 50 50 46 07 2f d9 28 b4 32 02
E: 20.064117 14 01 07 2e f8 50 50 46 07 2f be 28 cc 32 02
E: 20.077119 14 01 07 2e f9 50 50 46 07 2f aa 28 de 32 02
E: 20.089109 14 01 07 2e f8 50 51 46 07 2f 9b 28 eb 32 02
E: 20.102107 14 01 07 2e f6 50 53 46 07 2f 90 28 f5 32 02
E: 20.114119 14 01 07 2e f2 50 55 46 07 2f 87 28 fc 32 02
E: 20.126120 14 01 07 2e ef 50 57 46 07 2f 81 28 00 33 02
E: 20.139110 14 01 07 2e ec 50 5a 46 07 2f 7d 28 04 33 02
E: 20.151090 14 01 07 2e e7 50 5d 46 07 2f 7b 28 06 33 02
E: 20.164111 14 01 07 2e e4 50 5f 46 07 2f 79 28 08 33 02
E: 20.176108 14 01 07 2e e2 50 60 46 07 2f 77 28 08 33 02
E: 20.189109 14 01 07 2e e1 50 60 46 07 2f 78 28 0a 33 02
E: 20.201112 14 01 07 2e df 50 5f 46 07 2f 77 28 0b 33 02
E: 20.213111 14 01 07 2e de 50 5d 46 07 2f 76 28 0c 33 02
E: 20.226112 14 01 07 2e de 50 5c 46 07 2f 76 28 0d 33 02
E: 20.238113 14 01 07 2e de 50 5a 46 07 2f 78 28 0e 33 02
E: 20.251112 14 01 07 2e de 50 59 46 07 2f 78 28 0e 33 02
E: 20.263112 14 01 07 2e df 50 57 46 07 2f 76 28 0d 33 02
E: 20.276114 14 01 07 2e e0 50 56 46 07 2f 77 28 0e 33 02
E: 20.288109 14 01 07 2e e1 50 54 46 07 2f 78 28 0f 33 02
E: 20.300124 14 01 07 2e e2 50 53 46 07 2f 78 28 0e 33 02
E: 20.313120 14 01 07 2e e3 50 4f 46 07 2f 77 28 0e 33 02
E: 20.325112 14 01 07 2e e5 50 4c 46 07 2f 78 28 0f 33 02
E: 20.338112 14 01 07 2e e6 50 48 46 07 2f 7a 28 0f 33 02
E: 20.350113 14 01 07 2e e7 50 47 46 07 2f 7b 28 11 33 02
E: 20.363113 14 01 07 2e e6 50 45 46 07 2f 7a 28 12 33 02
E: 20.375110 14 01 07 2e e7 50 43 46 07 2f 7b 28 12 33 02
E: 20.388114 14 01 07 2e e9 50 42 46 07 2f 7c 28 12 33 02
E: 20.400114 14 01 07 2e e8 50 41 46 07 2f 7c 28 12 33 02
E: 20.412114 14 01 07 2e e7 50 41 46 07 2f 7c 28 13 33 02
E: 20.425110 14 01 07 2e e7 50 3d 46 07 2f 7c 28 12 33 02
E: 20.437113 14 01 07 2e e8 50 3c 46 07 2f 7e 28 11 33 02
E: 20.450114 14 01 07 2e e7 50 3a 46 07 2f 7f 28 0e 33 02
E: 20.462106 14 01 07 2e e5 50 38 46 07 2f 7f 28 0c 33 02
E: 20.475112 14 01 07 2e e4 50 37 46 07 2f 80 28 0b 33 02
E: 20.487111 14 01 07 2e e3 50 36 46 07 2f 82 28 0a 33 02
E: 20.499113 14 01 07 2e e2 50 33 46 07 2f 85 28 09 33 02
E: 20.512114 14 01 07 2e dc 50 2d 46 07 2f 85 28 07 33 02
E: 20.524114 14 01 07 2e d2 50 27 46 07 2f 86 28 05 33 02
E: 20.537114 14 01 07 2e c5 50 21 46 07 2f 8a 28 03 33 02
E: 20.549108 14 01 07 2e b2 50 1b 46 07 2f 8e 28 02 33 02
E: 20.562113 14 01 07 2e 97 50 13 46 07 2f 96 28 03 33 02
E: 20.574111 14 01 07 2e 75 50 09 46 07 2f a2 28 05 33 02
E: 20.586114 14 01 07 2e 4c 50 fe 45 07 2f b4 28 07 33 02
E: 20.599114 14 01 07 2e 1f 50 f3 45 07 2f cb 28 09 33 02
E: 20.611118 14 01 07 2e eb 4f e7 45 07 2f e6 28 0a 33 02
E: 20.624123 14 01 07 2e b2 4f dd 45 07 2f 05 29 0a 33 02
E: 20.636124 14 01 07 2e 6c 4f d7 45 07 2f 2a 29 0b 33 02
E: 20.649116 14 01 07 2e 22 4f d3 45 07 2f 56 29 0c 33 02
E: 20.661120 14 01 07 2e cb 4e d2 45 07 2f 87 29 10 33 02
E: 20.673120 14 01 07 2e 6a 4e d0 45 07 2f bf 29 10 33 02
E: 20.686117 14 01 07 2e 06 4e cc 45 07 2f 02 2a 09 33 02
E: 20.698123 14 01 07 2e 9c 4d c8 45 07 2f 4d 2a 01 33 02
E: 20.711125 14 01 07 2e 20 4d c3 45 07 2f 9e 2a f6 32 02
E: 20.723123 14 01 07 2e 9b 4c b9 45 07 2f f9 2a e8 32 02
E: 20.736123 14 01 07 2e 11 4c ac 45 07 2f 5f 2b d3 32 02
E: 20.748124 14 01 07 2e 7b 4b a0 45 07 2f ce 2b bf 32 02
E: 20.760121 14 01 07 2e d3 4a 92 45 07 2f 42 2c a9 32 02
E: 20.773124 14 01 07 2e 22 4a 86 45 07 2f b7 2c 8e 32 02
E: 20.785122 14 01 07 2e 6c 49 78 45 07 2f 39 2d 71 32 02
E: 20.798123 14 01 07 2e b2 48 65 45 07 2f c8 2d 52 32 02
E: 20.810114 14 01 07 2e ef 47 4d 45 07 2f 57 2e 35 32 02
E: 20.822122 14 01 07 2e db 46 51 45 07 2f ef 2e 17 32 02
E: 20.834123 14 01 07 2e d8 45 66 45 07 2f 06 30 b2 31 02
E: 20.846126 14 01 07 2e 3e 45 46 45 07 2f 78 30 9f 31 02
E: 20.858123 14 01 07 2e 91 44 02 45 07 2f dc 30 ab 31 02
E: 20.871122 14 01 07 2e fd 43 a3 44 07 2f 40 31 c6 31 02
E: 20.884120 14 01 07 2e bd 43 ce 43 07 2f 3a 32 99 31 02
E: 20.897123 14 01 07 2e ab 43 ae 42 07 2f f0 32 7a 31 02
E: 20.910123 14 01 07 2e a5 43 c0 41 07 2f b4 33 58 31 02
E: 20.922123 14 01 07 2e 7b 43 04 41 07 2f 6a 34 39 31 02
E: 20.935125 14 01 07 2e 54 43 1e 40 07 2f 32 35 19 31 02
E: 20.947125 14 01 07 2e 34 43 2a 3f 07 2f 02 36 f2 30 02
E: 20.960124 14 01 07 2e 19 43 2e 3e 07 2f bb 36 d2 30 02
E: 20.972122 14 01 07 2e 39 3d 3e 42 07 2f 8e 37 a9 30 02
E: 20.984121 14 01 07 2e 80 3b 35 43 07 2f 60 38 7c 30 02
E: 20.997124 14 01 07 2e 78 3a 8b 43 07 2f 3e 39 49 30 02
E: 21.009124 14 01 07 2e 4e 39 c3 43 07 2f 18 3a 18 30 02
E: 21.021117 14 01 07 2e 3d 38 dc 43 07 2f f3 3a e4 2f 02
E: 21.034117 14 01 07 2e 2e 37 e6 43 07 2f ce 3b ad 2f 02
E: 21.046118 14 01 07 2e 35 36 e8 43 07 2f bd 3c 70 2f 02
E: 21.059116 14 01 07 2e 29 35 e5 43 07 2f a9 3d 33 2f 02
E: 21.071116 14 01 07 2e 17 34 e3 43 07 2f 88 3e f9 2e 02
E: 21.083117 14 01 07 2e df 32 c4 43 07 2f bc 3f d8 2e 02
E: 21.095117 14 01 07 2e f9 31 bb 43 07 2f 64 40 97 2e 02
E: 21.108118 14 01 07 2e 06 31 c5 43 07 2f 25 41 1c 2e 02
E: 21.121117 14 01 07 2e ca 2f b7 43 07 2f 36 42 da 2d 02
E: 21.133116 14 01 07 2e b3 2e a3 43 07 2f 81 43 cb 2d 02
E: 21.145126 14 01 07 2e 4e 2d 62 43 07 2f 50 44 a6 2d 02
E: 21.158127 14 01 07 2e 7a 2c 51 43 07 2f 46 45 63 2d 02
E: 21.170127 14 01 07 2e 8f 2b 62 43 07 2f 22 46 21 2d 02
E: 21.183123 14 01 07 2e 51 2a 53 43 07 2f fc 46 ce 2c 02
E: 21.195127 14 01 07 2e 4e 29 46 43 07 2f d8 47 73 2c 02
E: 21.209113 14 01 07 2e 23 28 44 43 07 2f ed 48 3f 2c 02
E: 21.221114 14 01 07 2e 1c 27 3e 43 07 2f db 49 13 2c 02
E: 21.234117 14 01 07 2e 07 26 2b 43 07 2f d1 4a e2 2b 02
E: 21.246118 14 01 07 2e fb 24 15 43 07 2f c6 4b b1 2b 02
E: 21.258121 14 01 07 2e f5 23 02 43 07 2f bb 4c 80 2b 02
E: 21.271117 14 01 07 2e ee 22 e8 42 07 2f a9 4d 4f 2b 02
E: 21.283107 14 01 07 2e ed 21 ce 42 07 2f 93 4e 22 2b 02
E: 21.296120 14 01 07 2e fd 20 b1 42 07 2f 83 4f f6 2a 02
E: 21.308128 14 01 07 2e 1a 20 98 42 07 2f 76 50 d3 2a 02
E: 21.321129 14 01 07 2e 34 1f 86 42 07 2f 5c 51 b0 2a 02
E: 21.333129 14 01 07 2e 4e 1e 71 42 07 2f 4d 52 91 2a 02
E: 21.345127 14 01 07 2e 6f 1d 62 42 07 2f 4b 53 72 2a 02
E: 21.358120 14 01 07 2e 96 1c 56 42 07 2f 3b 54 55 2a 02
E: 21.370128 14 01 07 2e ba 1b 48 42 07 2f 2e 55 38 2a 02
E: 21.382127 14 01 07 2e ed 1a 39 42 07 2f 23 56 21 2a 02
E: 21.395120 14 01 07 2e 27 1a 29 42 07 2f 1d 57 0e 2a 02
E: 21.407120 14 01 07 2e 65 19 14 42 07 2f 13 58 fd 29 02
E: 21.420131 14 01 07 2e 9c 18 02 42 07 2f 0c 59 ec 29 02
E: 21.432121 14 01 07 2e d2 17 ec 41 07 2f fc 59 de 29 02
E: 21.445130 14 01 07 2e 09 17 db 41 07 2f f8 5a d3 29 02
E: 21.457116 14 01 07 2e 48 16 cd 41 07 2f ee 5b ce 29 02
E: 21.469128 14 01 07 2e 8f 15 bb 41 07 2f e7 5c cf 29 02
E: 21.482131 14 01 07 2e dc 14 a4 41 07 2f d9 5d d2 29 02
E: 21.494119 14 01 07 2e 38 14 8b 41 07 2f cf 5e d9 29 02
E: 21.507120 14 01 07 2e 9b 13 72 41 07 2f ca 5f eb 29 02
E: 21.519127 14 01 07 2e 02 13 5a 41 07 2f c4 60 fe 29 02
E: 21.532131 14 01 07 2e 66 12 44 41 07 2f b7 61 1c 2a 02
E: 21.544130 14 01 07 2e d2 11 32 41 07 2f a3 62 42 2a 02
E: 21.557119 14 01 07 2e 44 11 1c 41 07 2f 91 63 69 2a 02
E: 21.569117 14 01 07 2e bc 10 0a 41 07 2f 7f 64 9d 2a 02
E: 21.581130 14 01 07 2e 37 10 f4 40 07 2f 60 65 d5 2a 02
E: 21.594127 14 01 07 2e ba 0f de 40 07 2f 30 66 21 2b 02
E: 21.606129 14 01 07 2e 44 0f ca 40 07 2f 0a 67 6d 2b 02
E: 21.619129 14 01 07 2e d5 0e b4 40 07 2f df 67 b5 2b 02
E: 21.631126 14 01 07 2e 67 0e a1 40 07 2f b1 68 ff 2b 02
E: 21.643131 14 01 07 2e fc 0d 8c 40 07 2f 81 69 42 2c 02
E: 21.656068 14 01 07 2e 99 0d 78 40 07 2f 50 6a 84 2c 02
E: 21.668131 14 01 07 2e 3b 0d 66 40 07 2f 1d 6b cc 2c 02
E: 21.681122 14 01 07 2e dc 0c 59 40 07 2f e1 6b 16 2d 02
E: 21.693121 14 01 07 2e 81 0c 4d 40 07 2f a1 6c 61 2d 02
E: 21.706056 14 01 07 2e 2b 0c 42 40 07 2f 5a 6d aa 2d 02
E: 21.718022 14 01 07 2e d8 0b 37 40 07 2f 11 6e f1 2d 02
E: 21.731022 14 01 07 2e 89 0b 2c 40 07 2f be 6e 39 2e 02
E: 21.743022 14 01 07 2e 42 0b 24 40 07 2f 64 6f 7b 2e 02
E: 21.755022 14 01 07 2e 00 0b 1e 40 07 2f 08 70 be 2e 02
E: 21.768022 14 01 07 2e c1 0a 17 40 07 2f a4 70 fa 2e 02
E: 21.780023 14 01 07 2e 83 0a 0d 40 07 2f 3a 71 31 2f 02
E: 21.793022 14 01 07 2e 48 0a 08 40 07 2f c8 71 69 2f 02
E: 21.805023 14 01 07 2e 11 0a 02 40 07 2f 55 72 9d 2f 02
E: 21.818022 14 01 07 2e e1 09 03 40 07 2f e4 72 d8 2f 02
E: 21.830023 14 01 07 2e b2 09 02 40 07 2f 68 73 0f 30 02
E: 21.843023 14 01 07 2e 87 09 01 40 07 2f e7 73 3c 30 02
E: 21.855022 14 01 07 2e 5f 09 03 40 07 2f 65 74 6a 30 02
E: 21.867022 14 01 07 2e 3c 09 05 40 07 2f e0 74 94 30 02
E: 21.880023 14 01 07 2e 18 09 05 40 07 2f 57 75 bc 30 02
E: 21.892022 14 01 07 2e f5 08 09 40 07 2f c9 75 df 30 02
E: 21.905022 14 01 07 2e d5 08 0c 40 07 2f 39 76 06 31 02
E: 21.917022 14 01 07 2e b6 08 10 40 07 2f a6 76 26 31 02
E: 21.930023 14 01 07 2e 97 08 17 40 07 2f 0d 77 44 31 02
E: 21.942022 14 01 07 2e 77 08 1c 40 07 2f 71 77 61 31 02
E: 21.954023 14 01 07 2e 56 08 25 40 07 2f d1 77 7d 31 02
E: 21.967023 14 01 07 2e 36 08 2e 40 07 2f 32 78 97 31 02
E: 21.979022 14 01 07 2e 15 08 39 40 07 2f 92 78 b1 31 02
E: 21.991022 14 01 07 2e f3 07 41 40 07 2f ee 78 cb 31 02
E: 22.004124 14 01 07 2e d2 07 4a 40 07 2f 45 79 dd 31 02
E: 22.016133 14 01 07 2e b3 07 54 40 07 2f 99 79 ed 31 02
E: 22.029131 14 01 07 2e 98 07 59 40 07 2f e6 79 fa 31 02
E: 22.041131 14 01 07 2e 81 07 5a 40 07 2f 2c 7a 05 32 02
E: 22.054131 14 01 07 2e 6d 07 59 40 07 2f 6a 7a 0a 32 02
E: 22.066132 14 01 07 2e 5d 07 59 40 07 2f a8 7a 07 32 02
E: 22.079133 14 01 07 2e 4e 07 56 40 07 2f e0 7a 01 32 02
E: 22.091132 14 01 07 2e 3f 07 51 40 07 2f 15 7b f7 31 02
E: 22.103142 14 01 07 2e 30 07 4b 40 07 2f 44 7b ef 31 02
E: 22.116124 14 01 07 2e 1e 07 44 40 07 2f 71 7b e2 31 02
E: 22.128119 14 01 07 2e 0d 07 42 40 07 2f 99 7b dd 31 02
E: 22.141135 14 01 07 2e fd 06 3d 40 07 2f be 7b db 31 02
E: 22.153037 14 01 07 2e f0 06 39 40 07 2f e0 7b d8 31 02
E: 22.166134 14 01 07 2e e7 06 33 40 07 2f 02 7c d6 31 02
E: 22.178133 14 01 07 2e e1 06 2e 40 07 2f 2a 7c d9 31 02
E: 22.191124 14 01 07 2e dc 06 2b 40 07 2f 46 7c e2 31 02
E: 22.203129 14 01 07 2e d7 06 26 40 07 2f 72 7c f2 31 02
E: 22.216133 14 01 07 2e d5 06 23 40 07 2f a2 7c 03 32 02
E: 22.228133 14 01 07 2e d3 06 22 40 07 2f c3 7c 1a 32 02
E: 22.240131 14 01 07 2e d2 06 20 40 07 2f ed 7c 32 32 02
E: 22.253129 14 01 07 2e d0 06 1d 40 07 2f 0e 7d 42 32 02
E: 22.265131 14 01 07 2e d0 06 1e 40 07 2f 2b 7d 50 32 02
E: 22.278134 14 01 07 2e d1 06 1f 40 07 2f 42 7d 5d 32 02
E: 22.290131 14 01 07 2e d1 06 23 40 07 2f 53 7d 68 32 02
E: 22.303128 14 01 07 2e d2 06 27 40 07 2f 5e 7d 6e 32 02
E: 22.315134 14 01 07 2e d2 06 2c 40 07 2f 66 7d 71 32 02
E: 22.327131 14 01 07 2e d4 06 31 40 07 2f 6d 7d 71 32 02
E: 22.340135 14 01 07 2e d5 06 35 40 07 2f 69 7d 75 32 02
E: 22.352135 14 01 07 2e d4 06 39 40 07 2f 6c 7d 76 32 02
E: 22.364122 14 01 07 2e d6 06 3b 40 07 2f 6f 7d 77 32 02
E: 22.377133 14 01 07 2e d8 06 3c 40 07 2f 73 7d 7a 32 02
E: 22.389125 14 01 07 2e da 06 3f 40 07 2f 6f 7d 7c 32 02
E: 22.402126 14 01 07 2e d9 06 3f 40 07 2f 70 7d 7d 32 02
E: 22.414123 14 01 07 2e d9 06 3d 40 07 2f 73 7d 7d 32 02
E: 22.427126 14 01 07 2e da 06 3d 40 07 2f 6f 7d 7f 32 02
E: 22.439125 14 01 07 2e da 06 3c 40 07 2f 6b 7d 7f 32 02
E: 22.452134 14 01 07 2e d9 06 3b 40 07 2f 67 7d 82 32 02
E: 22.464126 14 01 07 2e d9 06 3a 40 07 2f 6b 7d 82 32 02
E: 22.476127 14 01 07 2e da 06 37 40 07 2f 71 7d 80 32 02
E: 22.489135 14 01 07 2e da 06 34 40 07 2f 76 7d 7d 32 02
E: 22.501135 14 01 07 2e d9 06 32 40 07 2f 7a 7d 7b 32 02
E: 22.514136 14 01 07 2e d8 06 30 40 07 2f 7d 7d 7a 32 02
E: 22.526130 14 01 07 2e d8 06 2f 40 07 2f 7f 7d 79 32 02
E: 22.539124 14 01 07 2e d8 06 2e 40 07 2f 81 7d 78 32 02
E: 22.551137 14 01 07 2e d7 06 2e 40 07 2f 82 7d 78 32 02
E: 22.563127 14 01 07 2e d5 06 2d 40 07 2f 83 7d 77 32 02
E: 22.576127 14 01 07 2e d4 06 2b 40 07 2f 84 7d 77 32 02
E: 22.588127 14 01 07 2e d4 06 28 40 07 2f 84 7d 77 32 02
E: 22.601135 14 01 07 2e d3 06 28 40 07 2f 84 7d 78 32 02
E: 22.613130 14 01 07 2e d1 06 29 40 07 2f 84 7d 77 32 02
E: 22.626123 14 01 07 2e d1 06 27 40 07 2f 84 7d 77 32 02
E: 22.638138 14 01 07 2e d0 06 26 40 07 2f 85 7d 78 32 02
E: 22.651138 14 01 07 2e cf 06 26 40 07 2f 7d 7d 7c 32 02
E: 22.663061 14 01 07 2e cd 06 25 40 07 2f 7e 7d 7d 32 02
E: 22.676027 14 01 07 2e cd 06 24 40 07 2f 80 7d 7c 32 02
E: 22.688027 14 01 07 2e cd 06 23 40 07 2f 82 7d 7c 32 02
E: 22.701028 14 01 07 2e cd 06 24 40 07 2f 7c 7d 80 32 02
E: 22.713027 14 01 07 2e cc 06 21 40 07 2f 7d 7d 81 32 02
E: 22.725028 14 01 07 2e cc 06 21 40 07 2f 7f 7d 80 32 02
E: 22.738027 14 01 07 2e cc 06 20 40 07 2f 82 7d 7e 32 02
E: 22.750027 14 01 07 2e cb 06 20 40 07 2f 84 7d 7d 32 02
E: 22.763028 14 01 07 2e c9 06 1d 40 07 2f 85 7d 7d 32 02
E: 22.775027 14 01 07 2e c8 06 1a 40 07 2f 85 7d 7d 32 02
E: 22.787029 14 01 07 2e c6 06 17 40 07 2f 86 7d 7d 32 02
E: 22.800030 14 01 07 2e c5 06 14 40 07 2f 86 7d 7d 32 02
E: 22.812030 14 01 07 2e c3 06 10 40 07 2f 87 7d 7d 32 02
E: 22.825030 14 01 07 2e c1 06 0f 40 07 2f 87 7d 7c 32 02
E: 22.837028 14 01 07 2e c0 06 0d 40 07 2f 87 7d 7c 32 02
E: 22.849029 14 01 07 2e bf 06 0d 40 07 2f 7e 7d 7e 32 02
E: 22.862030 14 01 07 2e bd 06 0a 40 07 2f 7e 7d 7e 32 02
E: 22.874030 14 01 07 2e bd 06 08 40 07 2f 80 7d 7c 32 02
E: 22.887029 14 01 07 2e bc 06 08 40 07 2f 81 7d 7b 32 02
E: 22.899028 14 01 07 2e bb 06 07 40 07 2f 83 7d 7b 32 02
E: 22.912030 14 01 07 2e b9 06 06 40 07 2f 84 7d 7a 32 02
E: 22.924028 14 01 07 2e b8 06 05 40 07 2f 84 7d 79 32 02
E: 22.937028 14 01 07 2e b7 06 02 40 07 2f 85 7d 79 32 02
E: 22.949031 14 01 07 2e b7 06 00 40 07 2f 85 7d 79 32 02
E: 22.961027 14 01 07 2e b7 06 01 40 07 2f 85 7d 78 32 02
E: 22.974131 14 01 07 2e b5 06 01 40 07 2f 85 7d 77 32 02
E: 22.986139 14 01 07 2e b4 06 00 40 07 2f 85 7d 78 32 02
E: 22.999139 14 01 07 2e b3 06 ff 3f 07 2f 7d 7d 7b 32 02
E: 23.011123 14 01 07 2e af 06 fd 3f 07 2f 76 7d 80 32 02
E: 23.024129 14 01 07 2e a8 06 fa 3f 07 2f 77 7d 7e 32 02
E: 23.036131 14 01 07 2e a0 06 f3 3f 07 2f 7b 7d 7d 32 02
E: 23.048129 14 01 07 2e 98 06 ee 3f 07 2f 76 7d 7f 32 02
E: 23.061137 14 01 07 2e 8c 06 e7 3f 07 2f 71 7d 83 32 02
E: 23.073140 14 01 07 2e 7d 06 df 3f 07 2f 73 7d 83 32 02
E: 23.086130 14 01 07 2e 6d 06 d6 3f 07 2f 78 7d 82 32 02
E: 23.098130 14 01 07 2e 5e 06 cb 3f 07 2f 74 7d 83 32 02
E: 23.110138 14 01 07 2e 4a 06 bf 3f 07 2f 6f 7d 86 32 02
E: 23.123127 14 01 07 2e 34 06 b3 3f 07 2f 73 7d 84 32 02
E: 23.135130 14 01 07 2e 1f 06 a5 3f 07 2f 77 7d 83 32 02
E: 23.148128 14 01 07 2e 0a 06 97 3f 07 2f 73 7d 85 32 02
E: 23.160140 14 01 07 2e f3 05 87 3f 07 2f 6f 7d 87 32 02
E: 23.173131 14 01 07 2e dc 05 7a 3f 07 2f 73 7d 85 32 02
E: 23.185124 14 01 07 2e c9 05 6f 3f 07 2f 77 7d 81 32 02
E: 23.198138 14 01 07 2e b7 05 63 3f 07 2f 73 7d 83 32 02
E: 23.210130 14 01 07 2e a8 05 5e 3f 07 2f 6f 7d 88 32 02
E: 23.223140 14 01 07 2e 98 05 53 3f 07 2f 72 7d 88 32 02
E: 23.235141 14 01 07 2e 89 05 4b 3f 07 2f 75 7d 86 32 02
E: 23.247130 14 01 07 2e 7d 05 44 3f 07 2f 72 7d 86 32 02
E: 23.260133 14 01 07 2e 72 05 3f 3f 07 2f 6d 7d 89 32 02
E: 23.272138 14 01 07 2e 69 05 39 3f 07 2f 70 7d 88 32 02
E: 23.285125 14 01 07 2e 62 05 36 3f 07 2f 74 7d 86 32 02
E: 23.297128 14 01 07 2e 5d 05 35 3f 07 2f 71 7d 86 32 02
E: 23.310132 14 01 07 2e 57 05 34 3f 07 2f 6c 7d 88 32 02
E: 23.322139 14 01 07 2e 53 05 34 3f 07 2f 6f 7d 88 32 02
E: 23.334139 14 01 07 2e 52 05 34 3f 07 2f 73 7d 86 32 02
E: 23.347144 14 01 07 2e 52 05 34 3f 07 2f 70 7d 86 32 02
E: 23.359143 14 01 07 2e 53 05 34 3f 07 2f 6c 7d 88 32 02
E: 23.372137 14 01 07 2e 53 05 35 3f 07 2f 70 7d 87 32 02
E: 23.384140 14 01 07 2e 54 05 36 3f 07 2f 75 7d 86 32 02
E: 23.396141 14 01 07 2e 56 05 39 3f 07 2f 71 7d 87 32 02
E: 23.409131 14 01 07 2e 59 05 3c 3f 07 2f 6e 7d 89 32 02
E: 23.421140 14 01 07 2e 5b 05 3f 3f 07 2f 72 7d 8b 32 02
E: 23.434140 14 01 07 2e 5d 05 40 3f 07 2f 76 7d 8a 32 02
E: 23.446141 14 01 07 2e 61 05 44 3f 07 2f 7a 7d 86 32 02
E: 23.459142 14 01 07 2e 64 05 46 3f 07 2f 76 7d 87 32 02
E: 23.471132 14 01 07 2e 65 05 49 3f 07 2f 79 7d 89 32 02
E: 23.484133 14 01 07 2e 68 05 4b 3f 07 2f 7b 7d 89 32 02
E: 23.496142 14 01 07 2e 6a 05 4c 3f 07 2f 7e 7d 87 32 02
E: 23.509139 14 01 07 2e 6c 05 4e 3f 07 2f 79 7d 88 32 02
E: 23.521130 14 01 07 2e 6e 05 4f 3f 07 2f 73 7d 8a 32 02
E: 23.533142 14 01 07 2e 6f 05 4f 3f 07 2f 76 7d 88 32 02
E: 23.546143 14 01 07 2e 71 05 50 3f 07 2f 7b 7d 84 32 02
E: 23.558133 14 01 07 2e 72 05 50 3f 07 2f 77 7d 85 32 02
E: 23.571139 14 01 07 2e 73 05 50 3f 07 2f 72 7d 87 32 02
E: 23.583134 14 01 07 2e 73 05 53 3f 07 2f 75 7d 85 32 02
E: 23.596136 14 01 07 2e 75 05 55 3f 07 2f 7a 7d 82 32 02
E: 23.608143 14 01 07 2e 76 05 57 3f 07 2f 77 7d 83 32 02
E: 23.621142 14 01 07 2e 77 05 57 3f 07 2f 72 7d 84 32 02
E: 23.633130 14 01 07 2e 77 05 56 3f 07 2f 76 7d 81 32 02
E: 23.646143 14 01 07 2e 78 05 58 3f 07 2f 7a 7d 7e 32 02
E: 23.658138 14 01 07 2e 79 05 5a 3f 07 2f 77 7d 80 32 02
E: 23.670140 14 01 07 2e 79 05 59 3f 07 2f 72 7d 83 32 02
E: 23.683127 14 01 07 2e 78 05 57 3f 07 2f 76 7d 81 32 02
E: 23.695006 14 01 07 2e 77 05 55 3f 07 2f 7b 7d 7f 32 02
E: 23.707138 14 01 07 2e 77 05 54 3f 07 2f 78 7d 81 32 02
E: 23.720136 14 01 07 2e 76 05 52 3f 07 2f 7c 7d 7e 32 02
E: 23.732135 14 01 07 2e 75 05 4f 3f 07 2f 7f 7d 7c 32 02
E: 23.745135 14 01 07 2e 75 05 4d 3f 07 2f 82 7d 7c 32 02
E: 23.757134 14 01 07 2e 76 05 4b 3f 07 2f 7d 7d 7e 32 02
E: 23.770120 14 01 07 2e 75 05 48 3f 07 2f 76 7d 81 32 02
E: 23.782135 14 01 07 2e 73 05 47 3f 07 2f 79 7d 7e 32 02
E: 23.795136 14 01 07 2e 72 05 43 3f 07 2f 7c 7d 7b 32 02
E: 23.807136 14 01 07 2e 71 05 3f 3f 07 2f 78 7d 7d 32 02
E: 23.819137 14 01 07 2e 6f 05 3c 3f 07 2f 73 7d 80 32 02
E: 23.832130 14 01 07 2e 6c 05 39 3f 07 2f 77 7d 7f 32 02
E: 23.844137 14 01 07 2e 6a 05 2c 3f 07 2f 7b 7d 7d 32 02
E: 23.855136 14 01 04 2e 6a 05 2c 3f 07 2f 78 7d 80 32 02
E: 23.867140 14 01 07 2f 73 7d 84 32 ff ff ff ff ff ff 01
E: 23.879139 14 01 07 2f 70 7d 86 32 ff ff ff ff ff ff 01
E: 23.892152 14 01 07 2f 74 7d 83 32 ff ff ff ff ff ff 01
E: 23.904139 14 01 07 2f 7a 7d 80 32 ff ff ff ff ff ff 01
E: 23.916139 14 01 07 2f 78 7d 81 32 ff ff ff ff ff ff 01
E: 23.929139 14 01 07 2f 74 7d 82 32 ff ff ff ff ff ff 01
E: 23.941140 14 01 07 2f 78 7d 80 32 ff ff ff ff ff ff 01
E: 23.954137 14 01 07 2f 7d 7d 7d 32 ff ff ff ff ff ff 01
E: 23.966138 14 01 07 2f 7a 7d 80 32 ff ff ff ff ff ff 01
E: 23.978138 14 01 07 2f 76 7d 83 32 ff ff ff ff ff ff 01
E: 23.991137 14 01 07 2f 79 7d 82 32 ff ff ff ff ff ff 01
E: 24.003137 14 01 07 2f 7e 7d 7f 32 ff ff ff ff ff ff 01
E: 24.015138 14 01 07 2f 7a 7d 81 32 ff ff ff ff ff ff 01
E: 24.028142 14 01 07 2f 75 7d 84 32 ff ff ff ff ff ff 01
E: 24.040139 14 01 07 2f 79 7d 82 32 ff ff ff ff ff ff 01
E: 24.052141 14 01 07 2f 7d 7d 81 32 ff ff ff ff ff ff 01
E: 24.065140 14 01 07 2f 79 7d 83 32 ff ff ff ff ff ff 01
E: 24.077141 14 01 07 2f 74 7d 86 32 ff ff ff ff ff ff 01
E: 24.090138 14 01 07 2f 78 7d 84 32 ff ff ff ff ff ff 01
E: 24.102142 14 01 07 2f 7c 7d 82 32 ff ff ff ff ff ff 01
E: 24.114138 14 01 07 2f 78 7d 83 32 ff ff ff ff ff ff 01
E: 24.127137 14 01 07 2f 73 7d 85 32 ff ff ff ff ff ff 01
E: 24.139137 14 01 07 2f 6f 7d 88 32 ff ff ff ff ff ff 01
E: 24.151130 14 01 07 2f 72 7d 87 32 ff ff ff ff ff ff 01
E: 24.164135 14 01 07 2f 78 7d 84 32 ff ff ff ff ff ff 01
E: 24.176141 14 01 07 2f 76 7d 86 32 ff ff ff ff ff ff 01
E: 24.189140 14 01 07 2f 71 7d 87 32 ff ff ff ff ff ff 01
E: 24.201139 14 01 07 2f 73 7d 87 32 ff ff ff ff ff ff 01
E: 24.213140 14 01 07 2f 78 7d 84 32 ff ff ff ff ff ff 01
E: 24.226140 14 01 07 2f 75 7d 84 32 ff ff ff ff ff ff 01
E: 24.238140 14 01 07 2f 71 7d 87 32 ff ff ff ff ff ff 01
E: 24.251140 14 01 07 2f 74 7d 88 32 ff ff ff ff ff ff 01
E: 24.263140 14 01 07 2f 79 7d 84 32 ff ff ff ff ff ff 01
E: 24.275137 14 01 07 2f 76 7d 85 32 ff ff ff ff ff ff 01
E: 24.288144 14 01 07 2f 71 7d 87 32 ff ff ff ff ff ff 01
E: 24.300138 14 01 07 2f 74 7d 85 32 ff ff ff ff ff ff 01
E: 24.313143 14 01 07 2f 79 7d 82 32 ff ff ff ff ff ff 01
E: 24.325139 14 01 07 2f 76 7d 83 32 ff ff ff ff ff ff 01
E: 24.337138 14 01 07 2f 71 7d 86 32 ff ff ff ff ff ff 01
E: 24.349141 14 01 07 2f 74 7d 86 32 ff ff ff ff ff ff 01
E: 24.362142 14 01 07 2f 78 7d 84 32 ff ff ff ff ff ff 01
E: 24.374039 14 01 07 2f 7c 7d 82 32 ff ff ff ff ff ff 01
E: 24.387151 14 01 07 2f 78 7d 84 32 ff ff ff ff ff ff 01
E: 24.399149 14 01 07 2f 72 7d 87 32 ff ff ff ff ff ff 01
E: 24.412149 14 01 07 2f 75 7d 85 32 ff ff ff ff ff ff 01
E: 24.424150 14 01 07 2f 7a 7d 82 32 ff ff ff ff ff ff 01
E: 24.436148 14 01 07 2f 77 7d 83 32 ff ff ff ff ff ff 01
E: 24.448145 14 01 07 2f 79 7d 86 32 ff ff ff ff ff ff 01
E: 24.461149 14 01 07 2f 7d 7d 84 32 ff ff ff ff ff ff 01
E: 24.473151 14 01 07 2f 80 7d 81 32 ff ff ff ff ff ff 01
E: 24.486149 14 01 07 2f 7b 7d 82 32 ff ff ff ff ff ff 01
E: 24.498149 14 01 07 2f 74 7d 85 32 ff ff ff ff ff ff 01
E: 24.510145 14 01 07 2f 77 7d 83 32 ff ff ff ff ff ff 01
E: 24.523148 14 01 07 2f 7a 7d 82 32 ff ff ff ff ff ff 01
E: 24.535146 14 01 07 2f 77 7d 84 32 ff ff ff ff ff ff 01
E: 24.548150 14 01 07 2f 71 7d 86 32 ff ff ff ff ff ff 01
E: 24.560147 14 01 07 2f 75 7d 84 32 ff ff ff ff ff ff 01
E: 24.572149 14 01 07 2f 79 7d 83 32 ff ff ff ff ff ff 01
E: 24.585149 14 01 07 2f 76 7d 85 32 ff ff ff ff ff ff 01
E: 24.597033 14 01 07 2f 72 7d 87 32 ff ff ff ff ff ff 01
E: 24.610149 14 01 07 2f 76 7d 84 32 ff ff ff ff ff ff 01
E: 24.622149 14 01 07 2f 7a 7d 83 32 ff ff ff ff ff ff 01
E: 24.634137 14 01 07 2f 7e 7d 80 32 ff ff ff ff ff ff 01
E: 24.647075 14 01 07 2f 79 7d 82 32 ff ff ff ff ff ff 01
E: 24.659150 14 01 07 2f 74 7d 85 32 ff ff ff ff ff ff 01
E: 24.671150 14 01 07 2f 77 7d 84 32 ff ff ff ff ff ff 01
E: 24.684150 14 01 07 2f 7a 7d 82 32 ff ff ff ff ff ff 01
E: 24.696151 14 01 07 2f 76 7d 84 32 ff ff ff ff ff ff 01
E: 24.709147 14 01 07 2f 71 7d 87 32 ff ff ff ff ff ff 01
E: 24.721152 14 01 07 2f 74 7d 85 32 ff ff ff ff ff ff 01
E: 24.733151 14 01 07 2f 7a 7d 86 32 ff ff ff ff ff ff 01
E: 24.746148 14 01 07 2f 76 7d 8e 32 ff ff ff ff ff ff 01
E: 24.758152 14 01 07 2f 82 7d 8a 32 ff ff ff ff ff ff 01
E: 24.769150 14 01 04 2f 82 7d 8a 32 ff ff ff ff ff ff 01
# 3. Finally, move your ten fingers on the screen and release them.
E: 32.773212 14 01 07 30 dd 6f 96 13 07 31 80 71 7a 19 02
E: 32.791064 14 01 07 30 dd 6f 96 13 07 31 80 71 7a 19 02
E: 32.792115 14 01 07 32 0f 6b 8b 12 07 33 18 6c ce 17 02
E: 32.810145 14 01 07 30 dd 6f 96 13 07 31 80 71 7a 19 02
E: 32.811100 14 01 07 32 0f 6b 8b 12 07 33 18 6c ce 17 02
E: 32.831099 14 01 04 30 dd 6f 96 13 04 31 80 71 7a 19 02
E: 32.832050 14 01 04 32 0f 6b 8b 12 04 33 18 6c ce 17 02
E: 32.851091 14 01 07 34 b6 38 26 47 ff ff ff ff ff ff 01
E: 32.870075 14 01 07 34 b6 38 26 47 ff ff ff ff ff ff 01
E: 32.890042 14 01 07 34 b6 38 26 47 ff ff ff ff ff ff 01
E: 32.910093 14 01 07 34 b6 38 26 47 ff ff ff ff ff ff 01
E: 32.930091 14 01 07 34 b6 38 26 47 ff ff ff ff ff ff 01
E: 32.950099 14 01 07 34 b6 38 26 47 07 35 e9 37 12 4b 02
E: 32.970090 14 01 07 34 b6 38 26 47 07 35 e9 37 12 4b 02
E: 32.991098 14 01 07 34 de 38 2b 47 07 35 e9 37 12 4b 02
E: 33.011098 14 01 07 34 f1 38 1d 47 07 35 e9 37 12 4b 02
E: 33.012099 14 01 07 36 bb 3a 4d 48 07 37 5a 36 de 49 02
E: 33.033098 14 01 07 34 02 39 14 47 07 35 e9 37 12 4b 02
E: 33.034092 14 01 07 36 bb 3a 4d 48 07 37 5a 36 de 49 02
E: 33.055099 14 01 07 34 0d 39 0e 47 07 35 e9 37 12 4b 02
E: 33.056021 14 01 07 36 bb 3a 4d 48 07 37 5a 36 de 49 02
E: 33.077197 14 01 07 34 1a 39 09 47 07 35 e9 37 12 4b 02
E: 33.078138 14 01 07 36 bb 3a 4d 48 07 37 5a 36 de 49 02
E: 33.099210 14 01 07 34 21 39 07 47 07 35 e9 37 12 4b 02
E: 33.100138 14 01 07 36 bb 3a 4d 48 07 37 5a 36 de 49 02
E: 33.121212 14 01 07 34 25 39 08 47 07 35 e9 37 12 4b 02
E: 33.122075 14 01 07 36 bb 3a 4d 48 07 37 5a 36 de 49 02
E: 33.143205 14 01 07 34 27 39 0c 47 07 35 e9 37 12 4b 02
E: 33.144137 14 01 07 36 bb 3a 4d 48 07 37 5a 36 de 49 02
E: 33.165211 14 01 07 34 2d 39 14 47 07 35 e9 37 12 4b 02
E: 33.166138 14 01 07 36 bb 3a 4d 48 07 37 5a 36 de 49 02
E: 33.187210 14 01 07 34 3a 39 26 47 07 35 0a 38 38 4b 02
E: 33.188087 14 01 07 36 d4 3a 79 48 07 37 78 36 01 4a 02
E: 33.209207 14 01 07 34 4c 39 46 47 07 35 16 38 5b 4b 02
E: 33.210160 14 01 07 36 e5 3a 99 48 07 37 84 36 24 4a 02
E: 33.231203 14 01 07 34 60 39 71 47 07 35 28 38 8f 4b 02
E: 33.232161 14 01 07 36 f7 3a c3 48 07 37 90 36 54 4a 02
E: 33.253205 14 01 07 34 72 39 a6 47 07 35 2f 38 cc 4b 02
E: 33.254157 14 01 07 36 29 3b 1b 49 07 37 97 36 93 4a 02
E: 33.275204 14 01 04 34 72 39 a6 47 07 35 c5 39 69 4d 02
E: 33.276162 14 01 07 36 37 3b 53 49 07 37 86 37 da 4b 02
E: 33.297206 14 01 07 35 16 3a bb 4d 07 36 45 3b 9a 49 02
E: 33.298210 14 01 07 37 c0 37 3a 4c ff ff ff ff ff ff 01
E: 33.319200 14 01 07 35 99 3a 5b 4e 04 36 45 3b 9a 49 02
E: 33.320205 14 01 04 37 c0 37 3a 4c ff ff ff ff ff ff 01
E: 33.340206 14 01 07 35 bb 3a c6 4e ff ff ff ff ff ff 01
E: 33.360204 14 01 07 35 b0 3a 83 4f ff ff ff ff ff ff 01
E: 33.380204 14 01 04 35 b0 3a 83 4f ff ff ff ff ff ff 01
E: 33.464207 14 01 07 38 b4 5f 46 2a 07 39 30 62 d2 2c 02
E: 33.465042 14 01 07 3a 58 65 0f 31 ff ff ff ff ff ff 01
E: 33.487099 14 01 07 38 49 5e aa 2c 07 39 cf 60 2e 2f 02
E: 33.488075 14 01 07 3a d7 63 6c 33 ff ff ff ff ff ff 01
E: 33.511070 14 01 07 38 a7 5c 51 2f 07 39 18 5f 29 32 02
E: 33.512065 14 01 07 3a 28 62 29 36 07 3b 11 60 e8 39 02
E: 33.535075 14 01 07 38 c2 5a af 32 07 39 32 5d 71 35 02
E: 33.536048 14 01 07 3a 3a 60 6c 39 07 3b 5e 5e c6 3c 02
E: 33.558165 14 01 07 38 77 58 c0 36 04 39 32 5d 71 35 02
E: 33.559092 14 01 04 3a 3a 60 6c 39 07 3b 80 5c ef 3f 02
E: 33.581061 14 01 07 38 ee 55 40 3b 07 3b 53 5a 09 43 02
E: 33.603113 14 01 07 38 b8 53 85 3f 07 3b 7f 58 d4 46 02
E: 33.626089 14 01 07 38 04 52 ad 43 07 3b b4 56 7e 4a 02
E: 33.627063 14 01 07 3c 7d 53 ca 46 ff ff ff ff ff ff 01
E: 33.651142 14 01 07 38 09 50 28 48 07 3b e2 54 22 4e 02
E: 33.652049 14 01 07 3c b4 51 75 4a ff ff ff ff ff ff 01
E: 33.676136 14 01 07 38 f9 4d 9b 4c 07 3b f8 52 fe 51 02
E: 33.677051 14 01 07 3c b2 4f 87 4e ff ff ff ff ff ff 01
E: 33.702133 14 01 07 38 55 4c bb 50 07 3b 5e 53 f2 57 02
E: 33.703044 14 01 07 3c 5e 50 d0 54 ff ff ff ff ff ff 01
E: 33.726125 14 01 07 38 4c 4c 6f 53 07 3b 9c 52 02 5c 02
E: 33.727053 14 01 07 3c 78 50 29 56 07 3d 74 3a 96 5f 02
E: 33.748120 14 01 07 38 19 4c 75 57 07 3b 67 51 de 5f 02
E: 33.749025 14 01 07 3c 7d 4f 91 5a 07 3d f3 3b 45 63 02
E: 33.768100 14 01 07 38 13 4b 04 5a 07 3b 96 50 b6 62 02
E: 33.769099 14 01 07 3c ac 4e f6 5d 07 3d 8a 3d 17 67 02
E: 33.788098 14 01 07 38 e8 49 ab 5c 07 3b 5f 50 09 64 02
E: 33.789098 14 01 07 3c 34 4e f3 5f 07 3d 2f 3d 46 67 02
E: 33.808034 14 01 07 38 cd 49 ab 5d 07 3b 04 50 51 66 02
E: 33.809098 14 01 07 3c db 4d 1b 62 07 3d 78 3c 36 69 02
E: 33.828108 14 01 07 38 ac 49 c4 5f 07 3b e6 4f 32 67 02
E: 33.829098 14 01 07 3c ac 4d d1 62 07 3d 5a 3c 46 6a 02
E: 33.848098 14 01 07 38 a3 49 6a 60 07 3b bc 4f 77 68 02
E: 33.849097 14 01 07 3c 6b 4d 02 64 07 3d 45 3c 67 6b 02
E: 33.868097 14 01 07 38 8d 49 40 61 07 3b ac 4f 1f 69 02
E: 33.869098 14 01 07 3c 62 4d 0e 65 07 3d 43 3c e8 6b 02
E: 33.888037 14 01 07 38 7f 49 b2 61 07 3b a1 4f 98 69 02
E: 33.889096 14 01 07 3c 5c 4d 87 65 07 3d 46 3c 39 6c 02
E: 33.908097 14 01 07 38 a9 49 3f 62 07 3b 9c 4f e1 69 02
E: 33.909098 14 01 07 3c 58 4d d2 65 07 3d 4a 3c 6c 6c 02
E: 33.928098 14 01 07 38 c6 49 88 62 07 3b 9a 4f 0f 6a 02
E: 33.929098 14 01 07 3c 56 4d 03 66 07 3d 4d 3c 8f 6c 02
E: 33.948098 14 01 07 38 b9 49 92 62 07 3b 97 4f 2e 6a 02
E: 33.949098 14 01 07 3c 55 4d 25 66 07 3d 50 3c a7 6c 02
E: 33.968098 14 01 07 38 a6 49 93 62 07 3b 94 4f 43 6a 02
E: 33.969098 14 01 07 3c 54 4d 3c 66 07 3d 51 3c b9 6c 02
E: 33.988099 14 01 07 38 95 49 93 62 07 3b 92 4f 52 6a 02
E: 33.989098 14 01 07 3c 53 4d 4d 66 07 3d 53 3c c6 6c 02
E: 34.008098 14 01 07 38 88 49 91 62 07 3b 91 4f 5d 6a 02
E: 34.009099 14 01 07 3c 52 4d 59 66 07 3d 55 3c ce 6c 02
E: 34.028097 14 01 07 38 7f 49 91 62 07 3b 90 4f 65 6a 02
E: 34.029209 14 01 07 3c 52 4d 62 66 07 3d 55 3c d4 6c 02
E: 34.050210 14 01 07 38 79 49 92 62 07 3b 99 4f 83 6a 02
E: 34.051211 14 01 07 3c 46 4d 17 66 07 3d 33 3c 60 6c 02
E: 34.072216 14 01 07 38 75 49 94 62 07 3b a0 4f 9b 6a 02
E: 34.073207 14 01 07 3c 3c 4d d8 65 07 3d 1e 3c 12 6c 02
E: 34.094212 14 01 07 38 73 49 94 62 07 3b a6 4f ac 6a 02
E: 34.095215 14 01 07 3c 38 4d af 65 07 3d 11 3c e2 6b 02
E: 34.117205 14 01 07 38 71 49 95 62 07 3b aa 4f b9 6a 02
E: 34.118214 14 01 07 3c 36 4d 94 65 07 3d 09 3c c1 6b 02
E: 34.139190 14 01 07 38 6f 49 96 62 07 3b ad 4f c4 6a 02
E: 34.140206 14 01 07 3c 34 4d 82 65 07 3d 04 3c aa 6b 02
E: 34.161198 14 01 07 38 6e 49 98 62 07 3b ad 4f c9 6a 02
E: 34.162158 14 01 07 3c 30 4d 74 65 07 3d 01 3c 98 6b 02
E: 34.183200 14 01 07 38 6c 49 99 62 07 3b ae 4f cd 6a 02
E: 34.184128 14 01 07 3c 2c 4d 69 65 07 3d ff 3b 8a 6b 02
E: 34.205198 14 01 07 38 6c 49 99 62 07 3b af 4f d0 6a 02
E: 34.206211 14 01 07 3c 2a 4d 61 65 07 3d fe 3b 80 6b 02
E: 34.227200 14 01 07 38 6c 49 98 62 07 3b b1 4f d3 6a 02
E: 34.228129 14 01 07 3c 2b 4d 5a 65 07 3d fd 3b 79 6b 02
E: 34.249183 14 01 07 38 6b 49 99 62 07 3b b0 4f d6 6a 02
E: 34.250156 14 01 07 3c 29 4d 56 65 07 3d fc 3b 74 6b 02
E: 34.271204 14 01 07 38 6b 49 9a 62 07 3b b0 4f d6 6a 02
E: 34.272183 14 01 07 3c 28 4d 54 65 07 3d fb 3b 71 6b 02
E: 34.293200 14 01 07 38 96 49 c6 62 07 3b ae 4f d6 6a 02
E: 34.294132 14 01 07 3c 26 4d 52 65 07 3d fb 3b 6e 6b 02
E: 34.315212 14 01 07 38 93 49 c2 62 07 3b ae 4f d6 6a 02
E: 34.316173 14 01 07 3c 27 4d 51 65 07 3d fb 3b 6c 6b 02
E: 34.337198 14 01 07 38 89 49 ba 62 07 3b af 4f d8 6a 02
E: 34.338128 14 01 07 3c 28 4d 51 65 07 3d fa 3b 6c 6b 02
E: 34.359195 14 01 07 38 81 49 b2 62 07 3b af 4f d9 6a 02
E: 34.360171 14 01 07 3c 27 4d 52 65 07 3d fa 3b 6d 6b 02
E: 34.381202 14 01 07 38 a1 49 d2 62 07 3b ae 4f da 6a 02
E: 34.382147 14 01 07 3c 26 4d 52 65 07 3d fa 3b 6c 6b 02
E: 34.403196 14 01 07 38 99 49 ce 62 07 3b ac 4f dc 6a 02
E: 34.404127 14 01 07 3c 24 4d 53 65 07 3d fa 3b 6c 6b 02
E: 34.425201 14 01 07 38 8d 49 c2 62 07 3b ad 4f dd 6a 02
E: 34.426128 14 01 07 3c 25 4d 54 65 07 3d f9 3b 6d 6b 02
E: 34.447195 14 01 07 38 83 49 b8 62 07 3b ae 4f de 6a 02
E: 34.448135 14 01 07 3c 26 4d 54 65 07 3d f9 3b 6d 6b 02
E: 34.469202 14 01 07 38 7b 49 b2 62 07 3b ae 4f de 6a 02
E: 34.470128 14 01 07 3c 27 4d 55 65 07 3d f9 3b 6e 6b 02
E: 34.491205 14 01 07 38 75 49 ae 62 07 3b ad 4f df 6a 02
E: 34.492126 14 01 07 3c 25 4d 55 65 07 3d f9 3b 6c 6b 02
E: 34.513224 14 01 07 38 70 49 ac 62 07 3b ac 4f df 6a 02
E: 34.514125 14 01 07 3c 23 4d 56 65 07 3d f9 3b 6d 6b 02
E: 34.535200 14 01 07 38 6e 49 a9 62 07 3b ad 4f e0 6a 02
E: 34.536131 14 01 07 3c 24 4d 56 65 07 3d fb 3b 6d 6b 02
E: 34.557198 14 01 07 38 6c 49 a6 62 07 3b ae 4f e0 6a 02
E: 34.558166 14 01 07 3c 26 4d 56 65 07 3d fa 3b 6e 6b 02
E: 34.579204 14 01 07 38 6b 49 a4 62 07 3b ad 4f e0 6a 02
E: 34.580126 14 01 07 3c 25 4d 57 65 07 3d fa 3b 70 6b 02
E: 34.601203 14 01 07 38 69 49 a4 62 07 3b ad 4f e0 6a 02
E: 34.602143 14 01 07 3c 25 4d 59 65 07 3d f9 3b 70 6b 02
E: 34.623201 14 01 07 38 67 49 a5 62 07 3b ab 4f e1 6a 02
E: 34.624151 14 01 07 3c 25 4d 59 65 07 3d f9 3b 70 6b 02
E: 34.645200 14 01 07 38 67 49 a5 62 07 3b ab 4f e2 6a 02
E: 34.646206 14 01 07 3c 26 4d 59 65 07 3d fb 3b 70 6b 02
E: 34.667204 14 01 07 38 66 49 a5 62 07 3b ab 4f e3 6a 02
E: 34.668128 14 01 07 3c 26 4d 5a 65 07 3d fc 3b 70 6b 02
E: 34.689178 14 01 07 38 65 49 a6 62 07 3b aa 4f e3 6a 02
E: 34.690161 14 01 07 3c 26 4d 5c 65 07 3d fb 3b 71 6b 02
E: 34.711199 14 01 07 38 64 49 a6 62 07 3b a9 4f e2 6a 02
E: 34.712165 14 01 07 3c 26 4d 5c 65 07 3d fa 3b 72 6b 02
E: 34.733205 14 01 07 38 64 49 a6 62 07 3b a7 4f e0 6a 02
E: 34.734207 14 01 07 3c 26 4d 5c 65 07 3d f9 3b 72 6b 02
E: 34.755194 14 01 07 38 65 49 a4 62 07 3b a8 4f de 6a 02
E: 34.756138 14 01 07 3c 27 4d 5b 65 07 3d fb 3b 71 6b 02
E: 34.777204 14 01 07 38 66 49 a3 62 07 3b a8 4f da 6a 02
E: 34.778171 14 01 07 3c 39 4d 5f 65 07 3d fc 3b 6e 6b 02
E: 34.799212 14 01 07 38 60 49 96 62 07 3b 9f 4f c2 6a 02
E: 34.800172 14 01 07 3c 38 4d 84 65 07 3d fc 3b 5c 6b 02
E: 34.821212 14 01 07 38 78 49 9a 62 07 3b 99 4f a0 6a 02
E: 34.822186 14 01 07 3c 38 4d 9b 65 07 3d f0 39 b6 6c 02
E: 34.834215 14 01 07 38 97 49 9f 62 07 3b 96 4f 87 6a 02
E: 34.835182 14 01 07 3c 58 4d 7a 65 07 3d 56 39 c4 6d 02
E: 34.843204 14 01 04 38 97 49 9f 62 04 3b 96 4f 87 6a 02
E: 34.844085 14 01 04 3c 58 4d 7a 65 04 3d 56 39 c4 6d 02
# Thank you.
