R: 322 05 0d 09 04 a1 01 85 04 09 22 a1 00 09 42 15 00 25 01 75 01 95 01 81 02 09 32 15 00 25 01 81 02 09 51 75 05 95 01 16 00 00 26 10 00 81 02 09 47 75 01 95 01 15 00 25 01 81 02 05 01 09 30 75 10 95 01 55 0d 65 33 35 00 46 ae 17 26 ff 7f 81 02 09 31 75 10 95 01 55 0d 65 33 35 00 46 c3 0e 26 ff 7f 81 02 05 0d 09 55 25 08 75 08 95 01 b1 02 c0 c0 05 01 09 01 a1 01 85 01 09 01 a1 00 05 09 19 01 29 02 15 00 25 01 95 02 75 01 81 02 95 01 75 06 81 01 05 01 09 30 09 31 16 00 00 26 ff 0f 36 00 00 46 ff 0f 66 00 00 75 10 95 02 81 02 c0 c0 06 00 ff 09 01 a1 01 09 01 15 00 26 ff 00 85 03 75 08 95 3f 81 02 06 00 ff 09 01 15 00 26 ff 00 75 08 95 3f 91 02 c0 05 0d 09 04 a1 01 85 02 09 20 a1 00 09 42 09 32 15 00 25 01 95 02 75 01 81 02 95 06 75 01 81 03 05 01 09 30 75 10 95 01 a4 55 0d 65 33 36 00 00 46 ae 17 16 00 00 26 ff 0f 81 02 09 31 16 00 00 26 ff 0f 36 00 00 46 c3 0e 81 02 b4 c0 c0 05 0d 09 0e a1 01 85 05 09 22 a1 00 09 52 09 53 15 00 25 0a 75 08 95 02 b1 02 c0 c0
N: eGalax_eMPIA Technology Inc. PCAP MultiTouch Controller
I: 3 0eef 7337
Please follow these 3 steps:
1. Drag _one_ finger on the screen from one corner to the opposite, and release it.
# 1. Drag _one_ finger on the screen from one corner to the opposite, and release it.
E: 0.000000 6 04 83 00 00 f0 7f
E: 0.004875 6 04 83 00 00 f0 7f
E: 0.008929 6 04 83 00 00 f0 7f
E: 0.013876 6 04 83 00 00 f0 7f
E: 0.017838 6 04 83 00 00 f0 7f
E: 0.022804 6 04 83 00 00 f0 7f
E: 0.026799 6 04 83 00 00 f0 7f
E: 0.031801 6 04 83 00 00 f0 7f
E: 0.035849 6 04 83 40 00 f0 7f
E: 0.040859 6 04 83 40 00 f0 7f
E: 0.044977 6 04 83 00 00 f0 7f
E: 0.049855 6 04 83 00 00 f0 7f
E: 0.053857 6 04 83 90 00 f0 7f
E: 0.058856 6 04 83 90 00 f0 7f
E: 0.062815 6 04 83 90 00 f0 7f
E: 0.067804 6 04 83 90 00 f0 7f
E: 0.072237 6 04 83 90 00 f0 7f
E: 0.076808 6 04 83 90 00 f0 7f
E: 0.080852 6 04 83 a0 00 b0 7f
E: 0.085905 6 04 83 b0 00 f0 7f
E: 0.089874 6 04 83 b0 00 f0 7f
E: 0.094866 6 04 83 d0 00 f0 7f
E: 0.098907 6 04 83 00 01 50 7f
E: 0.124925 6 04 83 40 01 50 7f
E: 0.129911 6 04 83 90 01 40 7f
E: 0.134100 6 04 83 e0 01 30 7f
E: 0.138905 6 04 83 40 02 10 7f
E: 0.142911 6 04 83 a0 02 e0 7e
E: 0.147922 6 04 83 00 03 c0 7e
E: 0.153037 6 04 83 30 03 a0 7e
E: 0.156905 6 04 83 80 03 70 7e
E: 0.161649 6 04 83 b0 03 50 7e
E: 0.165810 6 04 83 e0 03 40 7e
E: 0.169789 6 04 83 20 04 20 7e
E: 0.173784 6 04 83 60 04 f0 7d
E: 0.178782 6 04 83 b0 04 c0 7d
E: 0.182776 6 04 83 e0 04 a0 7d
E: 0.187784 6 04 83 10 05 80 7d
E: 0.191781 6 04 83 40 05 50 7d
E: 0.196780 6 04 83 80 05 00 7d
E: 0.200783 6 04 83 a0 05 d0 7c
E: 0.205780 6 04 83 d0 05 a0 7c
E: 0.209785 6 04 83 00 06 60 7c
E: 0.214781 6 04 83 40 06 10 7c
E: 0.218786 6 04 83 80 06 b0 7b
E: 0.223785 6 04 83 c0 06 40 7b
E: 0.227785 6 04 83 f0 06 e0 7a
E: 0.232782 6 04 83 00 07 c0 7a
E: 0.236782 6 04 83 20 07 80 7a
E: 0.241781 6 04 83 40 07 30 7a
E: 0.245780 6 04 83 60 07 00 7a
E: 0.250782 6 04 83 70 07 d0 79
E: 0.254781 6 04 83 90 07 70 79
E: 0.259786 6 04 83 b0 07 10 79
E: 0.263790 6 04 83 d0 07 c0 78
E: 0.268785 6 04 83 e0 07 90 78
E: 0.272780 6 04 83 00 08 40 78
E: 0.277783 6 04 83 10 08 00 78
E: 0.281781 6 04 83 30 08 a0 77
E: 0.286774 6 04 83 40 08 60 77
E: 0.290789 6 04 83 50 08 30 77
E: 0.295790 6 04 83 70 08 d0 76
E: 0.299779 6 04 83 80 08 90 76
E: 0.304778 6 04 83 90 08 60 76
E: 0.308780 6 04 83 b0 08 00 76
E: 0.313779 6 04 83 d0 08 c0 75
E: 0.317790 6 04 83 e0 08 90 75
E: 0.322795 6 04 83 f0 08 70 75
E: 0.326799 6 04 83 00 09 50 75
E: 0.331784 6 04 83 20 09 00 75
E: 0.335778 6 04 83 40 09 d0 74
E: 0.340809 6 04 83 50 09 a0 74
E: 0.344781 6 04 83 60 09 80 74
E: 0.349779 6 04 83 90 09 40 74
E: 0.353782 6 04 83 b0 09 10 74
E: 0.358781 6 04 83 c0 09 f0 73
E: 0.362782 6 04 83 d0 09 d0 73
E: 0.367750 6 04 83 d0 09 d0 73
E: 0.371746 6 04 83 10 0a 80 73
E: 0.375779 6 04 83 30 0a 50 73
E: 0.380777 6 04 83 70 0a 10 73
E: 0.384781 6 04 83 a0 0a e0 72
E: 0.389776 6 04 83 d0 0a c0 72
E: 0.393784 6 04 83 20 0b 80 72
E: 0.398784 6 04 83 50 0b 50 72
E: 0.402785 6 04 83 80 0b 30 72
E: 0.407783 6 04 83 a0 0b 10 72
E: 0.411755 6 04 83 a0 0b 10 72
E: 0.416752 6 04 83 f0 0b d0 71
E: 0.420786 6 04 83 20 0c b0 71
E: 0.425781 6 04 83 40 0c 90 71
E: 0.429756 6 04 83 40 0c 90 71
E: 0.434752 6 04 83 80 0c 40 71
E: 0.438784 6 04 83 b0 0c 10 71
E: 0.443778 6 04 83 d0 0c f0 70
E: 0.447787 6 04 83 00 0d b0 70
E: 0.452782 6 04 83 30 0d 80 70
E: 0.456785 6 04 83 50 0d 60 70
E: 0.461754 6 04 83 50 0d 60 70
E: 0.465750 6 04 83 70 0d 40 70
E: 0.470750 6 04 83 70 0d 40 70
E: 0.474745 6 04 83 b0 0d 00 70
E: 0.479781 6 04 83 d0 0d e0 6f
E: 0.483780 6 04 83 e0 0d c0 6f
E: 0.488759 6 04 83 e0 0d c0 6f
E: 0.492750 6 04 83 20 0e 80 6f
E: 0.497787 6 04 83 50 0e 40 6f
E: 0.501783 6 04 83 80 0e 10 6f
E: 0.506783 6 04 83 a0 0e f0 6e
E: 0.510785 6 04 83 d0 0e b0 6e
E: 0.515774 6 04 83 f0 0e 80 6e
E: 0.519786 6 04 83 10 0f 60 6e
E: 0.524803 6 04 83 30 0f 10 6e
E: 0.528786 6 04 83 50 0f e0 6d
E: 0.533781 6 04 83 60 0f b0 6d
E: 0.537790 6 04 83 70 0f 90 6d
E: 0.542750 6 04 83 70 0f 90 6d
E: 0.546752 6 04 83 a0 0f 30 6d
E: 0.551779 6 04 83 c0 0f 00 6d
E: 0.555783 6 04 83 d0 0f d0 6c
E: 0.560783 6 04 83 00 10 80 6c
E: 0.564782 6 04 83 20 10 40 6c
E: 0.569781 6 04 83 60 10 e0 6b
E: 0.573785 6 04 83 90 10 a0 6b
E: 0.578786 6 04 83 b0 10 70 6b
E: 0.582788 6 04 83 f0 10 10 6b
E: 0.587787 6 04 83 20 11 d0 6a
E: 0.591784 6 04 83 50 11 a0 6a
E: 0.596787 6 04 83 a0 11 50 6a
E: 0.600779 6 04 83 e0 11 10 6a
E: 0.605781 6 04 83 10 12 e0 69
E: 0.609781 6 04 83 50 12 a0 69
E: 0.614777 6 04 83 80 12 70 69
E: 0.618781 6 04 83 d0 12 20 69
E: 0.623780 6 04 83 10 13 e0 68
E: 0.627787 6 04 83 40 13 b0 68
E: 0.632780 6 04 83 80 13 60 68
E: 0.636785 6 04 83 b0 13 30 68
E: 0.640787 6 04 83 e0 13 00 68
E: 0.645786 6 04 83 00 14 e0 67
E: 0.649783 6 04 83 40 14 a0 67
E: 0.654781 6 04 83 70 14 70 67
E: 0.658785 6 04 83 90 14 50 67
E: 0.663782 6 04 83 e0 14 00 67
E: 0.667790 6 04 83 20 15 d0 66
E: 0.672783 6 04 83 80 15 80 66
E: 0.676786 6 04 83 c0 15 40 66
E: 0.681784 6 04 83 20 16 d0 65
E: 0.685784 6 04 83 a0 16 50 65
E: 0.690780 6 04 83 00 17 f0 64
E: 0.694779 6 04 83 70 17 70 64
E: 0.699781 6 04 83 c0 17 10 64
E: 0.703782 6 04 83 00 18 d0 63
E: 0.708785 6 04 83 50 18 70 63
E: 0.712786 6 04 83 b0 18 00 63
E: 0.716785 6 04 83 00 19 b0 62
E: 0.721796 6 04 83 50 19 50 62
E: 0.725782 6 04 83 90 19 00 62
E: 0.730781 6 04 83 c0 19 d0 61
E: 0.734779 6 04 83 10 1a 70 61
E: 0.739785 6 04 83 70 1a 00 61
E: 0.743786 6 04 83 b0 1a b0 60
E: 0.748789 6 04 83 e0 1a 70 60
E: 0.752782 6 04 83 30 1b 20 60
E: 0.757788 6 04 83 90 1b b0 5f
E: 0.761778 6 04 83 e0 1b 60 5f
E: 0.766781 6 04 83 40 1c 00 5f
E: 0.770783 6 04 83 b0 1c a0 5e
E: 0.775784 6 04 83 00 1d 50 5e
E: 0.779785 6 04 83 40 1d 10 5e
E: 0.784780 6 04 83 a0 1d c0 5d
E: 0.788784 6 04 83 e0 1d 80 5d
E: 0.793782 6 04 83 10 1e 50 5d
E: 0.797789 6 04 83 60 1e 10 5d
E: 0.801782 6 04 83 a0 1e e0 5c
E: 0.806782 6 04 83 d0 1e c0 5c
E: 0.810782 6 04 83 20 1f 80 5c
E: 0.815781 6 04 83 60 1f 50 5c
E: 0.819787 6 04 83 b0 1f 10 5c
E: 0.824801 6 04 83 10 20 b0 5b
E: 0.828799 6 04 83 50 20 60 5b
E: 0.833786 6 04 83 a0 20 f0 5a
E: 0.837794 6 04 83 e0 20 a0 5a
E: 0.842784 6 04 83 10 21 60 5a
E: 0.846779 6 04 83 50 21 10 5a
E: 0.851780 6 04 83 80 21 d0 59
E: 0.855784 6 04 83 d0 21 80 59
E: 0.860782 6 04 83 00 22 40 59
E: 0.864784 6 04 83 30 22 10 59
E: 0.869785 6 04 83 70 22 d0 58
E: 0.873784 6 04 83 a0 22 a0 58
E: 0.878787 6 04 83 f0 22 60 58
E: 0.882782 6 04 83 20 23 30 58
E: 0.887786 6 04 83 70 23 e0 57
E: 0.891784 6 04 83 b0 23 b0 57
E: 0.895780 6 04 83 00 24 60 57
E: 0.900783 6 04 83 30 24 30 57
E: 0.904783 6 04 83 60 24 00 57
E: 0.909781 6 04 83 a0 24 c0 56
E: 0.913779 6 04 83 d0 24 90 56
E: 0.918788 6 04 83 f0 24 70 56
E: 0.922782 6 04 83 10 25 50 56
E: 0.927785 6 04 83 40 25 20 56
E: 0.932779 6 04 83 60 25 f0 55
E: 0.937785 6 04 83 a0 25 b0 55
E: 0.940782 6 04 83 d0 25 80 55
E: 0.946787 6 04 83 f0 25 60 55
E: 0.949781 6 04 83 20 26 20 55
E: 0.955796 6 04 83 40 26 f0 54
E: 0.959783 6 04 83 60 26 d0 54
E: 0.964783 6 04 83 70 26 b0 54
E: 0.968783 6 04 83 a0 26 70 54
E: 0.972780 6 04 83 c0 26 40 54
E: 0.977785 6 04 83 00 27 f0 53
E: 0.980780 6 04 83 40 27 a0 53
E: 0.986793 6 04 83 70 27 60 53
E: 0.989786 6 04 83 a0 27 30 53
E: 0.995794 6 04 83 e0 27 f0 52
E: 0.999782 6 04 83 20 28 a0 52
E: 1.004781 6 04 83 50 28 60 52
E: 1.008782 6 04 83 70 28 30 52
E: 1.012784 6 04 83 90 28 10 52
E: 1.017788 6 04 83 c0 28 e0 51
E: 1.021783 6 04 83 f0 28 b0 51
E: 1.026780 6 04 83 30 29 80 51
E: 1.031785 6 04 83 80 29 30 51
E: 1.035783 6 04 83 c0 29 f0 50
E: 1.040782 6 04 83 10 2a a0 50
E: 1.044779 6 04 83 50 2a 60 50
E: 1.049782 6 04 83 80 2a 30 50
E: 1.053784 6 04 83 c0 2a e0 4f
E: 1.058783 6 04 83 f0 2a b0 4f
E: 1.062781 6 04 83 10 2b 80 4f
E: 1.067783 6 04 83 30 2b 60 4f
E: 1.071784 6 04 83 60 2b 20 4f
E: 1.075782 6 04 83 90 2b f0 4e
E: 1.080779 6 04 83 d0 2b b0 4e
E: 1.084783 6 04 83 00 2c 80 4e
E: 1.089781 6 04 83 20 2c 60 4e
E: 1.093786 6 04 83 60 2c 20 4e
E: 1.098789 6 04 83 90 2c f0 4d
E: 1.102787 6 04 83 d0 2c a0 4d
E: 1.107784 6 04 83 20 2d 40 4d
E: 1.111782 6 04 83 70 2d e0 4c
E: 1.116780 6 04 83 b0 2d a0 4c
E: 1.120784 6 04 83 e0 2d 70 4c
E: 1.125780 6 04 83 00 2e 40 4c
E: 1.129781 6 04 83 40 2e 00 4c
E: 1.134777 6 04 83 90 2e b0 4b
E: 1.138784 6 04 83 c0 2e 70 4b
E: 1.143783 6 04 83 f0 2e 40 4b
E: 1.147784 6 04 83 40 2f 00 4b
E: 1.152782 6 04 83 70 2f d0 4a
E: 1.156921 6 04 83 a0 2f b0 4a
E: 1.160783 6 04 83 e0 2f 70 4a
E: 1.165785 6 04 83 10 30 40 4a
E: 1.169786 6 04 83 60 30 00 4a
E: 1.174781 6 04 83 a0 30 d0 49
E: 1.178787 6 04 83 d0 30 b0 49
E: 1.183777 6 04 83 10 31 80 49
E: 1.187784 6 04 83 40 31 50 49
E: 1.192781 6 04 83 70 31 30 49
E: 1.196782 6 04 83 90 31 20 49
E: 1.201751 6 04 83 90 31 20 49
E: 1.205752 6 04 83 b0 31 00 49
E: 1.210752 6 04 83 b0 31 00 49
E: 1.214750 6 04 83 f0 31 d0 48
E: 1.219780 6 04 83 10 32 b0 48
E: 1.223783 6 04 83 30 32 a0 48
E: 1.228756 6 04 83 30 32 a0 48
E: 1.232765 6 04 83 70 32 50 48
E: 1.237787 6 04 83 c0 32 f0 47
E: 1.241782 6 04 83 00 33 a0 47
E: 1.245784 6 04 83 30 33 70 47
E: 1.250782 6 04 83 70 33 10 47
E: 1.254784 6 04 83 a0 33 d0 46
E: 1.259785 6 04 83 c0 33 a0 46
E: 1.263783 6 04 83 00 34 50 46
E: 1.268785 6 04 83 30 34 10 46
E: 1.272780 6 04 83 70 34 c0 45
E: 1.277789 6 04 83 a0 34 90 45
E: 1.281783 6 04 83 c0 34 60 45
E: 1.286779 6 04 83 e0 34 40 45
E: 1.290784 6 04 83 10 35 00 45
E: 1.295783 6 04 83 30 35 d0 44
E: 1.299780 6 04 83 70 35 80 44
E: 1.304786 6 04 83 a0 35 50 44
E: 1.308783 6 04 83 f0 35 10 44
E: 1.313781 6 04 83 30 36 e0 43
E: 1.317784 6 04 83 80 36 90 43
E: 1.322781 6 04 83 c0 36 60 43
E: 1.326786 6 04 83 00 37 10 43
E: 1.330807 6 04 83 30 37 e0 42
E: 1.335788 6 04 83 50 37 b0 42
E: 1.339789 6 04 83 70 37 90 42
E: 1.344781 6 04 83 a0 37 50 42
E: 1.348786 6 04 83 c0 37 20 42
E: 1.353790 6 04 83 e0 37 00 42
E: 1.357787 6 04 83 10 38 c0 41
E: 1.362784 6 04 83 30 38 90 41
E: 1.366783 6 04 83 50 38 70 41
E: 1.371785 6 04 83 90 38 30 41
E: 1.375781 6 04 83 c0 38 00 41
E: 1.380782 6 04 83 e0 38 d0 40
E: 1.384780 6 04 83 20 39 90 40
E: 1.389783 6 04 83 70 39 30 40
E: 1.393782 6 04 83 a0 39 f0 3f
E: 1.398785 6 04 83 d0 39 c0 3f
E: 1.402780 6 04 83 10 3a 70 3f
E: 1.406787 6 04 83 40 3a 30 3f
E: 1.411783 6 04 83 90 3a e0 3e
E: 1.415784 6 04 83 f0 3a 70 3e
E: 1.420782 6 04 83 60 3b f0 3d
E: 1.424780 6 04 83 c0 3b 90 3d
E: 1.429779 6 04 83 20 3c 20 3d
E: 1.433779 6 04 83 70 3c c0 3c
E: 1.438785 6 04 83 d0 3c 60 3c
E: 1.442783 6 04 83 10 3d 10 3c
E: 1.447781 6 04 83 60 3d b0 3b
E: 1.451781 6 04 83 a0 3d 70 3b
E: 1.456788 6 04 83 f0 3d 20 3b
E: 1.460784 6 04 83 40 3e c0 3a
E: 1.465778 6 04 83 80 3e 70 3a
E: 1.469785 6 04 83 d0 3e 10 3a
E: 1.474776 6 04 83 00 3f d0 39
E: 1.478789 6 04 83 50 3f 70 39
E: 1.483781 6 04 83 a0 3f 00 39
E: 1.487785 6 04 83 e0 3f b0 38
E: 1.491784 6 04 83 30 40 50 38
E: 1.496783 6 04 83 70 40 10 38
E: 1.500778 6 04 83 c0 40 b0 37
E: 1.505780 6 04 83 00 41 70 37
E: 1.509785 6 04 83 50 41 20 37
E: 1.514781 6 04 83 c0 41 c0 36
E: 1.518786 6 04 83 10 42 80 36
E: 1.523783 6 04 83 50 42 50 36
E: 1.527788 6 04 83 a0 42 10 36
E: 1.532798 6 04 83 e0 42 e0 35
E: 1.536787 6 04 83 10 43 b0 35
E: 1.541783 6 04 83 50 43 70 35
E: 1.545786 6 04 83 80 43 40 35
E: 1.550781 6 04 83 c0 43 00 35
E: 1.554782 6 04 83 f0 43 d0 34
E: 1.559784 6 04 83 30 44 80 34
E: 1.563786 6 04 83 60 44 50 34
E: 1.568787 6 04 83 90 44 20 34
E: 1.572785 6 04 83 d0 44 d0 33
E: 1.576784 6 04 83 20 45 60 33
E: 1.581783 6 04 83 60 45 10 33
E: 1.585780 6 04 83 b0 45 b0 32
E: 1.590780 6 04 83 10 46 40 32
E: 1.594783 6 04 83 80 46 c0 31
E: 1.599778 6 04 83 00 47 50 31
E: 1.603782 6 04 83 80 47 e0 30
E: 1.608788 6 04 83 10 48 60 30
E: 1.612784 6 04 83 70 48 00 30
E: 1.617785 6 04 83 e0 48 a0 2f
E: 1.621786 6 04 83 30 49 60 2f
E: 1.626780 6 04 83 90 49 10 2f
E: 1.630786 6 04 83 e0 49 d0 2e
E: 1.635777 6 04 83 40 4a 80 2e
E: 1.639782 6 04 83 80 4a 40 2e
E: 1.644782 6 04 83 d0 4a f0 2d
E: 1.648784 6 04 83 10 4b b0 2d
E: 1.652780 6 04 83 70 4b 60 2d
E: 1.657783 6 04 83 e0 4b 00 2d
E: 1.661784 6 04 83 60 4c a0 2c
E: 1.666783 6 04 83 f0 4c 40 2c
E: 1.670782 6 04 83 50 4d 00 2c
E: 1.675784 6 04 83 d0 4d b0 2b
E: 1.679782 6 04 83 30 4e 70 2b
E: 1.684779 6 04 83 a0 4e 20 2b
E: 1.688780 6 04 83 20 4f c0 2a
E: 1.693783 6 04 83 a0 4f 50 2a
E: 1.697789 6 04 83 00 50 00 2a
E: 1.702783 6 04 83 60 50 90 29
E: 1.706787 6 04 83 d0 50 20 29
E: 1.711787 6 04 83 20 51 d0 28
E: 1.715782 6 04 83 60 51 90 28
E: 1.720782 6 04 83 b0 51 40 28
E: 1.724781 6 04 83 20 52 e0 27
E: 1.729783 6 04 83 70 52 a0 27
E: 1.733776 6 04 83 d0 52 40 27
E: 1.737789 6 04 83 50 53 e0 26
E: 1.742777 6 04 83 d0 53 70 26
E: 1.746786 6 04 83 30 54 20 26
E: 1.751778 6 04 83 a0 54 d0 25
E: 1.755782 6 04 83 00 55 90 25
E: 1.760779 6 04 83 60 55 40 25
E: 1.764780 6 04 83 b0 55 00 25
E: 1.769779 6 04 83 10 56 b0 24
E: 1.773783 6 04 83 50 56 70 24
E: 1.778785 6 04 83 a0 56 10 24
E: 1.782806 6 04 83 e0 56 d0 23
E: 1.787782 6 04 83 30 57 80 23
E: 1.791789 6 04 83 70 57 40 23
E: 1.796783 6 04 83 c0 57 f0 22
E: 1.800777 6 04 83 00 58 b0 22
E: 1.805782 6 04 83 30 58 80 22
E: 1.809779 6 04 83 80 58 30 22
E: 1.814781 6 04 83 e0 58 d0 21
E: 1.818783 6 04 83 60 59 80 21
E: 1.823785 6 04 83 c0 59 40 21
E: 1.827789 6 04 83 30 5a f0 20
E: 1.831795 6 04 83 80 5a c0 20
E: 1.836791 6 04 83 c0 5a 90 20
E: 1.840785 6 04 83 f0 5a 70 20
E: 1.845785 6 04 83 40 5b 30 20
E: 1.849779 6 04 83 a0 5b d0 1f
E: 1.854782 6 04 83 e0 5b 80 1f
E: 1.858785 6 04 83 10 5c 50 1f
E: 1.863785 6 04 83 50 5c 00 1f
E: 1.867784 6 04 83 80 5c c0 1e
E: 1.872777 6 04 83 b0 5c 90 1e
E: 1.876785 6 04 83 d0 5c 70 1e
E: 1.881782 6 04 83 00 5d 30 1e
E: 1.885783 6 04 83 20 5d 00 1e
E: 1.890781 6 04 83 40 5d e0 1d
E: 1.894777 6 04 83 70 5d a0 1d
E: 1.899777 6 04 83 b0 5d 50 1d
E: 1.903781 6 04 83 e0 5d 20 1d
E: 1.908786 6 04 83 00 5e f0 1c
E: 1.912784 6 04 83 10 5e d0 1c
E: 1.917751 6 04 83 10 5e d0 1c
E: 1.921743 6 04 83 40 5e 90 1c
E: 1.926783 6 04 83 60 5e 70 1c
E: 1.930783 6 04 83 70 5e 50 1c
E: 1.934785 6 04 83 a0 5e 10 1c
E: 1.939776 6 04 83 c0 5e e0 1b
E: 1.943784 6 04 83 00 5f a0 1b
E: 1.948786 6 04 83 60 5f 40 1b
E: 1.952784 6 04 83 d0 5f e0 1a
E: 1.957781 6 04 83 20 60 90 1a
E: 1.961782 6 04 83 90 60 30 1a
E: 1.966778 6 04 83 e0 60 f0 19
E: 1.970786 6 04 83 40 61 a0 19
E: 1.975779 6 04 83 90 61 60 19
E: 1.979782 6 04 83 f0 61 10 19
E: 1.984778 6 04 83 30 62 d0 18
E: 1.988782 6 04 83 90 62 80 18
E: 1.993781 6 04 83 e0 62 40 18
E: 1.997782 6 04 83 40 63 e0 17
E: 2.002782 6 04 83 80 63 a0 17
E: 2.006786 6 04 83 e0 63 50 17
E: 2.011781 6 04 83 20 64 10 17
E: 2.015783 6 04 83 50 64 e0 16
E: 2.020784 6 04 83 c0 64 90 16
E: 2.024783 6 04 83 50 65 40 16
E: 2.029781 6 04 83 c0 65 00 16
E: 2.033782 6 04 83 40 66 c0 15
E: 2.038783 6 04 83 a0 66 90 15
E: 2.042785 6 04 83 f0 66 60 15
E: 2.047780 6 04 83 50 67 20 15
E: 2.051784 6 04 83 a0 67 f0 14
E: 2.056781 6 04 83 00 68 a0 14
E: 2.060783 6 04 83 40 68 60 14
E: 2.065785 6 04 83 90 68 10 14
E: 2.069785 6 04 83 d0 68 d0 13
E: 2.073776 6 04 83 00 69 a0 13
E: 2.078785 6 04 83 20 69 80 13
E: 2.082805 6 04 83 40 69 70 13
E: 2.087785 6 04 83 80 69 30 13
E: 2.091783 6 04 83 b0 69 00 13
E: 2.096783 6 04 83 d0 69 e0 12
E: 2.100779 6 04 83 10 6a a0 12
E: 2.105780 6 04 83 40 6a 70 12
E: 2.109783 6 04 83 80 6a 20 12
E: 2.114783 6 04 83 d0 6a c0 11
E: 2.118782 6 04 83 20 6b 60 11
E: 2.123781 6 04 83 90 6b 00 11
E: 2.127790 6 04 83 20 6c b0 10
E: 2.132777 6 04 83 80 6c 70 10
E: 2.136786 6 04 83 d0 6c 40 10
E: 2.141780 6 04 83 40 6d 00 10
E: 2.145784 6 04 83 90 6d d0 0f
E: 2.150777 6 04 83 f0 6d 80 0f
E: 2.154780 6 04 83 40 6e 50 0f
E: 2.159782 6 04 83 70 6e 20 0f
E: 2.163778 6 04 83 c0 6e e0 0e
E: 2.168783 6 04 83 00 6f b0 0e
E: 2.172781 6 04 83 50 6f 60 0e
E: 2.177786 6 04 83 b0 6f f0 0d
E: 2.181783 6 04 83 f0 6f a0 0d
E: 2.185777 6 04 83 40 70 30 0d
E: 2.190776 6 04 83 80 70 e0 0c
E: 2.194787 6 04 83 f0 70 60 0c
E: 2.199835 6 04 83 90 71 d0 0b
E: 2.203788 6 04 83 30 72 40 0b
E: 2.208791 6 04 83 d0 72 a0 0a
E: 2.212789 6 04 83 60 73 f0 09
E: 2.217786 6 04 83 e0 73 40 09
E: 2.221787 6 04 83 30 74 d0 08
E: 2.226784 6 04 83 80 74 60 08
E: 2.230781 6 04 83 c0 74 10 08
E: 2.235812 6 04 83 10 75 80 07
E: 2.239810 6 04 83 60 75 d0 06
E: 2.244791 6 04 83 a0 75 50 06
E: 2.248790 6 04 83 d0 75 f0 05
E: 2.253785 6 04 83 10 76 70 05
E: 2.257791 6 04 83 50 76 e0 04
E: 2.262775 6 04 83 80 76 70 04
E: 2.266787 6 04 83 c0 76 e0 03
E: 2.271785 6 04 83 f0 76 80 03
E: 2.275784 6 04 83 10 77 30 03
E: 2.280789 6 04 83 20 77 f0 02
E: 2.284784 6 04 83 30 77 c0 02
E: 2.288784 6 04 83 50 77 70 02
E: 2.293783 6 04 83 70 77 30 02
E: 2.297790 6 04 83 80 77 00 02
E: 2.302821 6 04 83 f0 77 b0 01
E: 2.306807 6 04 83 90 78 60 01
E: 2.311809 6 04 83 40 79 10 01
E: 2.315798 6 04 83 00 7a d0 00
E: 2.320791 6 04 83 a0 7a a0 00
E: 2.324789 6 04 83 30 7b 70 00
E: 2.329783 6 04 83 90 7b 50 00
E: 2.333788 6 04 83 e0 7b 00 00
E: 2.338798 6 04 83 10 7c 00 00
E: 2.342782 6 04 83 60 7c 00 00
E: 2.347779 6 04 83 90 7c 00 00
E: 2.351775 6 04 83 b0 7c 00 00
E: 2.356781 6 04 83 d0 7c 00 00
E: 2.360779 6 04 83 f0 7c 00 00
E: 2.365780 6 04 83 10 7d 00 00
E: 2.369779 6 04 83 30 7d 00 00
E: 2.374777 6 04 83 50 7d 00 00
E: 2.378755 6 04 83 50 7d 00 00
E: 2.384105 6 04 83 70 7d 00 00
E: 2.387747 6 04 83 70 7d 00 00
E: 2.392109 6 04 83 90 7d 00 00
E: 2.396742 6 04 83 90 7d 00 00
E: 2.401104 6 04 83 b0 7d 00 00
E: 2.405745 6 04 83 b0 7d 00 00
E: 2.409721 6 04 83 b0 7d 00 00
E: 2.414715 6 04 83 b0 7d 00 00
E: 2.418716 6 04 83 b0 7d 00 00
E: 2.423720 6 04 83 b0 7d 00 00
E: 2.449131 6 04 83 30 7e 00 00
E: 2.451307 6 04 82 30 7e 00 00
2. Land one finger,
   - land a second finger far enough from the first
   - move your two fingers
   - release the *first* finger
   - release the second finger
# 2. Land one finger,
   - land a second finger far enough from the first
   - move your two fingers
   - release the *first* finger
   - release the second finger
E: 12.923905 6 04 83 c0 1a 80 3f
E: 12.929025 6 04 83 c0 1a 80 3f
E: 12.933109 6 04 83 c0 1a 80 3f
E: 12.937854 6 04 83 c0 1a 80 3f
E: 12.941829 6 04 83 c0 1a 80 3f
E: 12.946860 6 04 83 c0 1a 80 3f
E: 12.951145 6 04 83 c0 1a 80 3f
E: 12.954817 6 04 83 c0 1a 80 3f
E: 12.959812 6 04 83 c0 1a 80 3f
E: 12.963800 6 04 83 c0 1a 80 3f
E: 12.968813 6 04 83 c0 1a 80 3f
E: 12.972923 6 04 83 c0 1a 80 3f
E: 12.977802 6 04 83 c0 1a 80 3f
E: 12.981919 6 04 83 c0 1a 80 3f
E: 12.986802 6 04 83 c0 1a 80 3f
E: 12.991227 6 04 83 c0 1a 80 3f
E: 12.995807 6 04 83 c0 1a 80 3f
E: 12.999801 6 04 83 c0 1a 80 3f
E: 13.004802 6 04 83 c0 1a 80 3f
E: 13.008804 6 04 83 c0 1a 80 3f
E: 13.013806 6 04 83 c0 1a 80 3f
E: 13.018031 6 04 83 c0 1a 80 3f
E: 13.022979 6 04 83 c0 1a 80 3f
E: 13.026800 6 04 83 c0 1a 80 3f
E: 13.031798 6 04 83 c0 1a 80 3f
E: 13.035715 6 04 83 c0 1a 80 3f
E: 13.040713 6 04 83 c0 1a 80 3f
E: 13.044710 6 04 83 c0 1a 80 3f
E: 13.048769 6 04 83 c0 1a 80 3f
E: 13.053712 6 04 83 c0 1a 80 3f
E: 13.057709 6 04 83 c0 1a 80 3f
E: 13.062711 6 04 83 c0 1a 80 3f
E: 13.066711 6 04 83 c0 1a 80 3f
E: 13.071710 6 04 83 c0 1a 80 3f
E: 13.075708 6 04 83 c0 1a 80 3f
E: 13.080706 6 04 83 c0 1a 80 3f
E: 13.084773 6 04 83 c0 1a 80 3f
E: 13.089710 6 04 83 c0 1a 80 3f
E: 13.093708 6 04 83 c0 1a 80 3f
E: 13.098712 6 04 83 c0 1a 80 3f
E: 13.102710 6 04 83 c0 1a 80 3f
E: 13.107760 6 04 83 c0 1a 80 3f
E: 13.111705 6 04 83 c0 1a 80 3f
E: 13.119043 6 04 83 a0 1a 80 3f
E: 13.120736 6 04 83 a0 1a 80 3f
E: 13.125715 6 04 83 a0 1a 80 3f
E: 13.131279 6 04 83 80 1a 80 3f
E: 13.133742 6 04 83 80 1a 80 3f
E: 13.140209 6 04 83 60 1a 80 3f
E: 13.143375 6 04 83 60 1a 80 3f
E: 13.148073 6 04 83 60 1a 80 3f
E: 13.151815 6 04 83 60 1a 80 3f
E: 13.156797 6 04 83 60 1a 80 3f
E: 13.160807 6 04 83 60 1a 80 3f
E: 13.165801 6 04 83 60 1a 80 3f
E: 13.169802 6 04 83 60 1a 80 3f
E: 13.174798 6 04 83 60 1a 80 3f
E: 13.178798 6 04 83 60 1a 80 3f
E: 13.183918 6 04 83 60 1a 80 3f
E: 13.187918 6 04 83 60 1a 80 3f
E: 13.192917 6 04 83 60 1a 80 3f
E: 13.196812 6 04 83 60 1a 80 3f
E: 13.201840 6 04 83 60 1a 80 3f
E: 13.205810 6 04 83 60 1a 80 3f
E: 13.210922 6 04 83 60 1a 80 3f
E: 13.214807 6 04 83 60 1a 80 3f
E: 13.218801 6 04 83 60 1a 80 3f
E: 13.223914 6 04 83 60 1a 80 3f
E: 13.227915 6 04 83 60 1a 80 3f
E: 13.232799 6 04 83 60 1a 80 3f
E: 13.236799 6 04 83 60 1a 80 3f
E: 13.242065 6 04 83 60 1a 80 3f
E: 13.245808 6 04 83 60 1a 80 3f
E: 13.250800 6 04 83 60 1a 80 3f
E: 13.254806 6 04 83 60 1a 80 3f
E: 13.259709 6 04 83 60 1a 80 3f
E: 13.263769 6 04 83 60 1a 80 3f
E: 13.268710 6 04 83 60 1a 80 3f
E: 13.272824 6 04 83 60 1a 80 3f
E: 13.277713 6 04 83 60 1a 80 3f
E: 13.281704 6 04 83 60 1a 80 3f
E: 13.286707 6 04 83 60 1a 80 3f
E: 13.290769 6 04 83 60 1a 80 3f
E: 13.295710 6 04 83 60 1a 80 3f
E: 13.299709 6 04 83 60 1a 80 3f
E: 13.303708 6 04 83 60 1a 80 3f
E: 13.308709 6 04 83 60 1a 80 3f
E: 13.312710 6 04 83 60 1a 80 3f
E: 13.317709 6 04 83 60 1a 80 3f
E: 13.321709 6 04 83 60 1a 80 3f
E: 13.326714 6 04 83 60 1a 80 3f
E: 13.333794 6 04 83 40 1a 90 3f
E: 13.335759 6 04 83 40 1a 90 3f
E: 13.341715 6 04 83 30 1a b0 3f
E: 13.344734 6 04 83 30 1a b0 3f
E: 13.348716 6 04 83 30 1a b0 3f
E: 13.353711 6 04 83 30 1a b0 3f
E: 13.357716 6 04 83 30 1a b0 3f
E: 13.362715 6 04 83 30 1a b0 3f
E: 13.367085 6 04 83 30 1a b0 3f
E: 13.371803 6 04 83 30 1a b0 3f
E: 13.378870 6 04 83 20 1a d0 3f
E: 13.380839 6 04 83 20 1a d0 3f
E: 13.384826 6 04 83 20 1a d0 3f
E: 13.388804 6 04 83 20 1a d0 3f
E: 13.394641 6 04 83 20 1a f0 3f
E: 13.399188 6 04 83 20 1a f0 3f
E: 13.402836 6 04 83 20 1a f0 3f
E: 13.406805 6 04 83 20 1a f0 3f
E: 13.411809 6 04 83 20 1a f0 3f
E: 13.415800 6 04 83 20 1a f0 3f
E: 13.420802 6 04 83 20 1a f0 3f
E: 13.424820 6 04 83 20 1a f0 3f
E: 13.429804 6 04 83 20 1a f0 3f
E: 13.433941 6 04 83 20 1a f0 3f
E: 13.438803 6 04 83 20 1a f0 3f
E: 13.442798 6 04 83 20 1a f0 3f
E: 13.447797 6 04 83 20 1a f0 3f
E: 13.454608 6 04 83 20 1a f0 3f
E: 13.457029 6 04 83 20 1a f0 3f
E: 13.460922 6 04 83 20 1a f0 3f
E: 13.465808 6 04 83 20 1a f0 3f
E: 13.469799 6 04 83 20 1a f0 3f
E: 13.474753 6 04 83 20 1a 10 40
E: 13.478749 6 04 83 20 1a 10 40
E: 13.483172 6 04 83 10 1a 30 40
E: 13.487741 6 04 83 10 1a 30 40
E: 13.491933 6 04 83 10 1a 30 40
E: 13.496758 6 04 83 10 1a 30 40
E: 13.500707 6 04 83 10 1a 30 40
E: 13.505708 6 04 83 10 1a 30 40
E: 13.509706 6 04 83 10 1a 30 40
E: 13.514709 6 04 83 10 1a 30 40
E: 13.519179 6 04 83 10 1a 50 40
E: 13.523737 6 04 83 10 1a 50 40
E: 13.527772 6 04 83 10 1a 50 40
E: 13.532708 6 04 83 10 1a 50 40
E: 13.536720 6 04 83 10 1a 50 40
E: 13.541710 6 04 83 10 1a 50 40
E: 13.545711 6 04 83 10 1a 50 40
E: 13.549707 6 04 83 10 1a 50 40
E: 13.554711 6 04 83 10 1a 50 40
E: 13.558702 6 04 83 10 1a 50 40
E: 13.563708 6 04 83 10 1a 50 40
E: 13.567708 6 04 83 10 1a 50 40
E: 13.572789 6 04 83 10 1a 50 40
E: 13.576816 6 04 83 10 1a 50 40
E: 13.581706 6 04 83 10 1a 50 40
E: 13.585855 6 04 83 10 1a 50 40
E: 13.590803 6 04 83 10 1a 50 40
E: 13.594795 6 04 83 10 1a 50 40
E: 13.599798 6 04 83 10 1a 50 40
E: 13.603794 6 04 83 10 1a 50 40
E: 13.608797 6 04 83 10 1a 50 40
E: 13.612782 6 04 83 10 1a 50 40
E: 13.618179 6 04 83 10 1a 50 40
E: 13.621796 6 04 83 10 1a 50 40
E: 13.626793 6 04 83 10 1a 50 40
E: 13.630910 6 04 83 10 1a 50 40
E: 13.636224 6 04 83 10 1a 50 40
E: 13.639802 6 04 83 10 1a 50 40
E: 13.643791 6 04 83 10 1a 50 40
E: 13.648799 6 04 83 10 1a 50 40
E: 13.652802 6 04 83 10 1a 50 40
E: 13.657789 6 04 83 10 1a 50 40
E: 13.661800 6 04 83 10 1a 50 40
E: 13.666794 6 04 83 10 1a 50 40
E: 13.674625 6 04 83 10 1a 70 40
E: 13.675783 6 04 83 10 1a 70 40
E: 13.681805 6 04 83 10 1a 70 40
E: 13.686788 6 04 83 10 1a 70 40
E: 13.692759 6 04 83 00 1a a0 40
E: 13.695390 6 04 87 90 54 a0 35
E: 13.698730 6 04 83 00 1a a0 40
E: 13.700693 6 04 87 90 54 a0 35
E: 13.704688 6 04 87 90 54 a0 35
E: 13.706702 6 04 83 00 1a a0 40
E: 13.710682 6 04 83 00 1a a0 40
E: 13.712698 6 04 87 a0 54 70 35
E: 13.716690 6 04 87 c0 54 40 35
E: 13.718705 6 04 83 00 1a c0 40
E: 13.722725 6 04 83 00 1a c0 40
E: 13.724415 6 04 87 f0 54 20 35
E: 13.727692 6 04 87 10 55 10 35
E: 13.729688 6 04 83 00 1a c0 40
E: 13.733695 6 04 83 00 1a c0 40
E: 13.735690 6 04 87 10 55 10 35
E: 13.739710 6 04 87 30 55 f0 34
E: 13.741680 6 04 83 00 1a c0 40
E: 13.745699 6 04 83 00 1a c0 40
E: 13.747685 6 04 87 50 55 d0 34
E: 13.751713 6 04 87 50 55 d0 34
E: 13.753674 6 04 83 00 1a c0 40
E: 13.757693 6 04 83 00 1a c0 40
E: 13.759685 6 04 87 70 55 b0 34
E: 13.763696 6 04 87 90 55 b0 34
E: 13.765685 6 04 83 00 1a c0 40
E: 13.769695 6 04 83 00 1a c0 40
E: 13.771679 6 04 87 b0 55 b0 34
E: 13.774681 6 04 87 b0 55 b0 34
E: 13.776685 6 04 83 00 1a c0 40
E: 13.780706 6 04 83 00 1a c0 40
E: 13.782677 6 04 87 b0 55 b0 34
E: 13.786691 6 04 87 b0 55 b0 34
E: 13.788684 6 04 83 00 1a c0 40
E: 13.792702 6 04 83 00 1a c0 40
E: 13.794679 6 04 87 b0 55 b0 34
E: 13.798688 6 04 87 b0 55 b0 34
E: 13.800675 6 04 83 00 1a e0 40
E: 13.804796 6 04 83 00 1a e0 40
E: 13.807715 6 04 87 d0 55 b0 34
E: 13.810749 6 04 87 d0 55 b0 34
E: 13.813439 6 04 83 00 1a e0 40
E: 13.816747 6 04 83 00 1a e0 40
E: 13.819470 6 04 87 d0 55 b0 34
E: 13.822149 6 04 87 d0 55 b0 34
E: 13.824512 6 04 83 00 1a e0 40
E: 13.827767 6 04 83 00 1a e0 40
E: 13.829777 6 04 87 d0 55 b0 34
E: 13.833756 6 04 87 d0 55 b0 34
E: 13.835784 6 04 83 00 1a e0 40
E: 13.839764 6 04 83 00 1a e0 40
E: 13.841784 6 04 87 d0 55 b0 34
E: 13.845754 6 04 87 d0 55 b0 34
E: 13.847786 6 04 83 00 1a e0 40
E: 13.851783 6 04 83 00 1a e0 40
E: 13.853777 6 04 87 d0 55 b0 34
E: 13.857770 6 04 87 d0 55 b0 34
E: 13.859780 6 04 83 00 1a 00 41
E: 13.863802 6 04 83 00 1a 00 41
E: 13.866920 6 04 87 d0 55 b0 34
E: 13.869667 6 04 87 d0 55 b0 34
E: 13.872580 6 04 83 00 1a 20 41
E: 13.875750 6 04 83 00 1a 20 41
E: 13.878644 6 04 87 d0 55 b0 34
E: 13.881140 6 04 87 d0 55 b0 34
E: 13.882784 6 04 83 00 1a 20 41
E: 13.886757 6 04 83 00 1a 20 41
E: 13.888785 6 04 87 d0 55 b0 34
E: 13.892752 6 04 87 d0 55 b0 34
E: 13.894799 6 04 83 00 1a 20 41
E: 13.898777 6 04 83 00 1a 20 41
E: 13.900765 6 04 87 d0 55 b0 34
E: 13.904775 6 04 87 d0 55 b0 34
E: 13.906778 6 04 83 00 1a 40 41
E: 13.910796 6 04 83 00 1a 40 41
E: 13.912835 6 04 87 d0 55 b0 34
E: 13.915695 6 04 87 f0 55 d0 34
E: 13.917694 6 04 83 00 1a 40 41
E: 13.921675 6 04 83 00 1a 40 41
E: 13.923696 6 04 87 f0 55 d0 34
E: 13.927711 6 04 87 f0 55 d0 34
E: 13.929720 6 04 83 00 1a 40 41
E: 13.933709 6 04 83 00 1a 40 41
E: 13.935748 6 04 87 f0 55 f0 34
E: 13.939723 6 04 87 f0 55 f0 34
E: 13.941724 6 04 83 00 1a 40 41
E: 13.945714 6 04 83 00 1a 40 41
E: 13.947769 6 04 87 f0 55 f0 34
E: 13.951793 6 04 87 f0 55 f0 34
E: 13.953742 6 04 83 00 1a 70 41
E: 13.957776 6 04 83 00 1a 70 41
E: 13.959743 6 04 87 f0 55 f0 34
E: 13.962791 6 04 87 f0 55 f0 34
E: 13.964711 6 04 83 00 1a 70 41
E: 13.968741 6 04 83 00 1a 90 41
E: 13.970771 6 04 87 f0 55 f0 34
E: 13.974725 6 04 87 f0 55 f0 34
E: 13.976728 6 04 83 00 1a 90 41
E: 13.980868 6 04 83 00 1a 70 41
E: 13.982768 6 04 87 f0 55 f0 34
E: 13.986723 6 04 87 f0 55 f0 34
E: 13.988709 6 04 83 00 1a 70 41
E: 13.992803 6 04 83 00 1a 70 41
E: 13.994742 6 04 87 00 56 10 35
E: 13.998801 6 04 87 00 56 10 35
E: 14.000710 6 04 83 00 1a 70 41
E: 14.004716 6 04 83 00 1a 70 41
E: 14.006724 6 04 87 00 56 10 35
E: 14.009803 6 04 87 00 56 10 35
E: 14.011712 6 04 83 00 1a 70 41
E: 14.015708 6 04 83 00 1a 70 41
E: 14.017722 6 04 87 00 56 10 35
E: 14.021709 6 04 87 00 56 10 35
E: 14.023784 6 04 83 00 1a 70 41
E: 14.027801 6 04 83 00 1a 70 41
E: 14.029862 6 04 87 00 56 10 35
E: 14.033800 6 04 87 00 56 10 35
E: 14.036051 6 04 83 00 1a 70 41
E: 14.040147 6 04 83 00 1a 70 41
E: 14.042041 6 04 87 00 56 10 35
E: 14.045802 6 04 87 00 56 10 35
E: 14.047934 6 04 83 00 1a 70 41
E: 14.051873 6 04 83 00 1a 50 41
E: 14.056321 6 04 87 00 56 10 35
E: 14.059732 6 04 87 00 56 10 35
E: 14.061429 6 04 83 00 1a 50 41
E: 14.063395 6 04 83 00 1a 30 41
E: 14.066517 6 04 87 00 56 10 35
E: 14.068835 6 04 87 00 56 10 35
E: 14.071144 6 04 83 00 1a 30 41
E: 14.074795 6 04 83 00 1a 30 41
E: 14.076924 6 04 87 00 56 10 35
E: 14.080804 6 04 87 00 56 10 35
E: 14.082952 6 04 83 00 1a 30 41
E: 14.087804 6 04 83 00 1a 30 41
E: 14.089793 6 04 87 00 56 10 35
E: 14.092805 6 04 87 00 56 10 35
E: 14.094922 6 04 83 00 1a 30 41
E: 14.099907 6 04 83 00 1a 30 41
E: 14.101946 6 04 87 00 56 10 35
E: 14.104795 6 04 87 00 56 10 35
E: 14.106828 6 04 83 00 1a 30 41
E: 14.109800 6 04 83 00 1a 30 41
E: 14.111799 6 04 87 00 56 10 35
E: 14.116798 6 04 87 00 56 10 35
E: 14.119123 6 04 83 00 1a 30 41
E: 14.122818 6 04 83 00 1a 30 41
E: 14.125063 6 04 87 00 56 10 35
E: 14.128999 6 04 87 20 56 20 35
E: 14.130926 6 04 83 00 1a 30 41
E: 14.133807 6 04 83 00 1a 30 41
E: 14.135701 6 04 87 20 56 20 35
E: 14.140789 6 04 87 20 56 20 35
E: 14.142687 6 04 83 00 1a 30 41
E: 14.146699 6 04 83 00 1a 30 41
E: 14.148687 6 04 87 20 56 20 35
E: 14.151703 6 04 87 20 56 20 35
E: 14.153688 6 04 83 00 1a 30 41
E: 14.156691 6 04 83 00 1a 30 41
E: 14.158686 6 04 87 20 56 20 35
E: 14.163689 6 04 87 20 56 20 35
E: 14.165684 6 04 83 00 1a 30 41
E: 14.169695 6 04 83 00 1a 30 41
E: 14.171684 6 04 87 20 56 20 35
E: 14.175711 6 04 87 20 56 40 35
E: 14.177684 6 04 83 00 1a 30 41
E: 14.180686 6 04 83 00 1a 30 41
E: 14.182685 6 04 87 20 56 40 35
E: 14.187688 6 04 87 20 56 40 35
E: 14.189690 6 04 83 00 1a 30 41
E: 14.193711 6 04 83 00 1a 30 41
E: 14.195756 6 04 87 20 56 40 35
E: 14.198738 6 04 87 20 56 40 35
E: 14.200685 6 04 83 00 1a 30 41
E: 14.204686 6 04 83 00 1a 30 41
E: 14.206699 6 04 87 20 56 40 35
E: 14.210841 6 04 87 20 56 40 35
E: 14.212695 6 04 83 00 1a 30 41
E: 14.216695 6 04 83 00 1a 30 41
E: 14.218721 6 04 87 40 56 20 35
E: 14.222766 6 04 87 40 56 20 35
E: 14.224730 6 04 83 00 1a 30 41
E: 14.228747 6 04 83 00 1a 30 41
E: 14.230737 6 04 87 40 56 20 35
E: 14.234688 6 04 87 40 56 20 35
E: 14.236694 6 04 83 00 1a 30 41
E: 14.240859 6 04 83 00 1a 30 41
E: 14.242719 6 04 87 60 56 10 35
E: 14.245800 6 04 87 60 56 10 35
E: 14.247793 6 04 83 00 1a 30 41
E: 14.252007 6 04 83 00 1a 30 41
E: 14.253820 6 04 87 60 56 10 35
E: 14.257912 6 04 87 60 56 10 35
E: 14.259812 6 04 83 00 1a 30 41
E: 14.263906 6 04 83 00 1a 30 41
E: 14.265811 6 04 87 60 56 10 35
E: 14.269794 6 04 87 60 56 10 35
E: 14.272173 6 04 83 00 1a 30 41
E: 14.275797 6 04 83 00 1a 30 41
E: 14.277818 6 04 87 60 56 10 35
E: 14.281894 6 04 87 60 56 10 35
E: 14.283941 6 04 83 00 1a 30 41
E: 14.286911 6 04 83 00 1a 30 41
E: 14.288792 6 04 87 60 56 10 35
E: 14.292812 6 04 87 60 56 10 35
E: 14.294801 6 04 83 00 1a 30 41
E: 14.298818 6 04 83 00 1a 30 41
E: 14.300821 6 04 87 60 56 30 35
E: 14.304872 6 04 87 60 56 30 35
E: 14.306813 6 04 83 00 1a 30 41
E: 14.310792 6 04 83 00 1a 30 41
E: 14.312808 6 04 87 60 56 30 35
E: 14.316791 6 04 87 60 56 30 35
E: 14.318821 6 04 83 00 1a 30 41
E: 14.322913 6 04 83 00 1a 30 41
E: 14.324788 6 04 87 60 56 30 35
E: 14.328861 6 04 87 60 56 50 35
E: 14.330787 6 04 83 00 1a 30 41
E: 14.333795 6 04 83 00 1a 30 41
E: 14.335908 6 04 87 60 56 50 35
E: 14.339820 6 04 87 60 56 50 35
E: 14.342446 6 04 83 00 1a 30 41
E: 14.345819 6 04 83 00 1a 30 41
E: 14.347797 6 04 87 60 56 50 35
E: 14.351848 6 04 87 60 56 50 35
E: 14.353795 6 04 83 00 1a 30 41
E: 14.357722 6 04 83 00 1a 30 41
E: 14.359896 6 04 87 60 56 50 35
E: 14.363716 6 04 87 60 56 50 35
E: 14.365707 6 04 83 00 1a 30 41
E: 14.369725 6 04 83 00 1a 30 41
E: 14.371792 6 04 87 60 56 50 35
E: 14.375719 6 04 87 60 56 50 35
E: 14.377701 6 04 83 00 1a 30 41
E: 14.380885 6 04 83 00 1a 30 41
E: 14.382703 6 04 87 60 56 50 35
E: 14.386716 6 04 87 60 56 50 35
E: 14.388765 6 04 83 00 1a 30 41
E: 14.392712 6 04 83 00 1a 30 41
E: 14.394704 6 04 87 60 56 50 35
E: 14.398938 6 04 87 60 56 50 35
E: 14.400704 6 04 83 00 1a 30 41
E: 14.404707 6 04 83 00 1a 30 41
E: 14.406714 6 04 87 60 56 50 35
E: 14.410887 6 04 87 60 56 50 35
E: 14.412710 6 04 83 00 1a 30 41
E: 14.416712 6 04 83 00 1a 30 41
E: 14.418723 6 04 87 60 56 50 35
E: 14.422704 6 04 87 60 56 50 35
E: 14.424703 6 04 83 00 1a 30 41
E: 14.427960 6 04 83 00 1a 30 41
E: 14.429711 6 04 87 60 56 50 35
E: 14.433805 6 04 87 60 56 50 35
E: 14.435714 6 04 83 00 1a 30 41
E: 14.439777 6 04 83 00 1a 30 41
E: 14.441764 6 04 87 60 56 50 35
E: 14.445723 6 04 87 60 56 50 35
E: 14.447771 6 04 83 00 1a 30 41
E: 14.451803 6 04 83 00 1a 30 41
E: 14.453701 6 04 87 60 56 50 35
E: 14.457868 6 04 87 60 56 50 35
E: 14.461175 6 04 83 00 1a 30 41
E: 14.463741 6 04 83 00 1a 30 41
E: 14.465806 6 04 87 60 56 50 35
E: 14.469834 6 04 87 60 56 50 35
E: 14.471787 6 04 83 00 1a 30 41
E: 14.474793 6 04 83 00 1a 30 41
E: 14.476796 6 04 87 60 56 50 35
E: 14.480933 6 04 87 60 56 50 35
E: 14.482782 6 04 83 00 1a 30 41
E: 14.486811 6 04 83 00 1a 30 41
E: 14.488792 6 04 87 60 56 50 35
E: 14.493783 6 04 87 70 56 80 35
E: 14.495259 6 04 83 00 1a 30 41
E: 14.498821 6 04 83 00 1a 30 41
E: 14.501236 6 04 87 80 56 c0 35
E: 14.505082 6 04 87 80 56 f0 35
E: 14.506925 6 04 83 00 1a 30 41
E: 14.510790 6 04 83 00 1a 30 41
E: 14.512929 6 04 87 80 56 f0 35
E: 14.517098 6 04 87 80 56 10 36
E: 14.518832 6 04 83 00 1a 30 41
E: 14.522219 6 04 83 00 1a 30 41
E: 14.523922 6 04 87 80 56 10 36
E: 14.527920 6 04 87 80 56 10 36
E: 14.530601 6 04 83 00 1a 50 41
E: 14.533852 6 04 83 00 1a 50 41
E: 14.537457 6 04 87 80 56 10 36
E: 14.541220 6 04 87 80 56 30 36
E: 14.544564 6 04 83 00 1a 50 41
E: 14.545810 6 04 83 00 1a 50 41
E: 14.548893 6 04 87 80 56 30 36
E: 14.551828 6 04 87 80 56 30 36
E: 14.554763 6 04 83 00 1a 50 41
E: 14.558086 6 04 83 00 1a 50 41
E: 14.560810 6 04 87 90 56 70 36
E: 14.564097 6 04 87 90 56 90 36
E: 14.565772 6 04 83 00 1a 50 41
E: 14.568809 6 04 83 00 1a 50 41
E: 14.570787 6 04 87 90 56 90 36
E: 14.575186 6 04 87 90 56 b0 36
E: 14.576703 6 04 83 00 1a 50 41
E: 14.581042 6 04 83 00 1a 70 41
E: 14.582758 6 04 87 90 56 b0 36
E: 14.586696 6 04 87 90 56 b0 36
E: 14.588750 6 04 83 00 1a 70 41
E: 14.593168 6 04 83 00 1a 90 41
E: 14.595083 6 04 87 90 56 d0 36
E: 14.598765 6 04 87 90 56 d0 36
E: 14.600692 6 04 83 00 1a 90 41
E: 14.604692 6 04 83 00 1a 90 41
E: 14.606844 6 04 87 a0 56 f0 36
E: 14.610816 6 04 87 a0 56 10 37
E: 14.613260 6 04 83 00 1a c0 41
E: 14.615774 6 04 83 00 1a c0 41
E: 14.617696 6 04 87 a0 56 10 37
E: 14.621694 6 04 87 a0 56 10 37
E: 14.624178 6 04 83 00 1a e0 41
E: 14.627719 6 04 83 00 1a e0 41
E: 14.629757 6 04 87 a0 56 10 37
E: 14.633691 6 04 87 a0 56 10 37
E: 14.635708 6 04 83 00 1a e0 41
E: 14.639694 6 04 83 00 1a e0 41
E: 14.641883 6 04 87 b0 56 60 37
E: 14.645849 6 04 87 c0 56 b0 37
E: 14.648052 6 04 83 f0 19 00 42
E: 14.651805 6 04 83 f0 19 00 42
E: 14.653887 6 04 87 c0 56 e0 37
E: 14.656881 6 04 87 c0 56 00 38
E: 14.658692 6 04 83 f0 19 00 42
E: 14.663026 6 04 83 f0 19 20 42
E: 14.664959 6 04 87 c0 56 20 38
E: 14.668843 6 04 87 d0 56 90 38
E: 14.670744 6 04 83 f0 19 20 42
E: 14.675030 6 04 83 e0 19 40 42
E: 14.676911 6 04 87 e0 56 f0 38
E: 14.680951 6 04 87 00 57 60 39
E: 14.683041 6 04 83 d0 19 60 42
E: 14.686736 6 04 83 d0 19 60 42
E: 14.688935 6 04 87 20 57 00 3a
E: 14.692938 6 04 87 40 57 a0 3a
E: 14.694710 6 04 83 d0 19 60 42
E: 14.698791 6 04 83 d0 19 60 42
E: 14.700879 6 04 87 60 57 40 3b
E: 14.703929 6 04 87 70 57 a0 3b
E: 14.705711 6 04 83 d0 19 60 42
E: 14.709816 6 04 83 d0 19 60 42
E: 14.711929 6 04 87 80 57 20 3c
E: 14.715880 6 04 87 a0 57 a0 3c
E: 14.717768 6 04 83 d0 19 60 42
E: 14.721724 6 04 83 d0 19 60 42
E: 14.723921 6 04 87 c0 57 20 3d
E: 14.727873 6 04 87 e0 57 a0 3d
E: 14.729769 6 04 83 d0 19 60 42
E: 14.733724 6 04 83 d0 19 60 42
E: 14.735874 6 04 87 f0 57 e0 3d
E: 14.739018 6 04 87 00 58 50 3e
E: 14.741222 6 04 83 c0 19 80 42
E: 14.744742 6 04 83 c0 19 80 42
E: 14.747013 6 04 87 20 58 d0 3e
E: 14.750871 6 04 87 20 58 00 3f
E: 14.752797 6 04 83 c0 19 80 42
E: 14.756717 6 04 83 c0 19 80 42
E: 14.758946 6 04 87 30 58 30 3f
E: 14.762939 6 04 87 50 58 90 3f
E: 14.764829 6 04 83 a0 19 b0 42
E: 14.768753 6 04 83 a0 19 b0 42
E: 14.771102 6 04 87 70 58 f0 3f
E: 14.774939 6 04 87 90 58 40 40
E: 14.776965 6 04 83 90 19 d0 42
E: 14.780722 6 04 83 90 19 d0 42
E: 14.782690 6 04 87 a0 58 70 40
E: 14.785696 6 04 87 a0 58 90 40
E: 14.787688 6 04 83 70 19 e0 42
E: 14.791731 6 04 83 70 19 e0 42
E: 14.793717 6 04 87 c0 58 e0 40
E: 14.797713 6 04 87 e0 58 50 41
E: 14.799714 6 04 83 50 19 30 43
E: 14.803742 6 04 83 20 19 60 43
E: 14.805755 6 04 87 10 59 e0 41
E: 14.809719 6 04 87 20 59 30 42
E: 14.811700 6 04 83 e0 18 80 43
E: 14.815739 6 04 83 90 18 80 43
E: 14.817763 6 04 87 50 59 c0 42
E: 14.821723 6 04 87 80 59 50 43
E: 14.823702 6 04 83 50 18 80 43
E: 14.826746 6 04 83 10 18 b0 43
E: 14.828757 6 04 87 b0 59 f0 43
E: 14.832717 6 04 87 d0 59 90 44
E: 14.834701 6 04 83 d0 17 00 44
E: 14.838740 6 04 83 90 17 60 44
E: 14.840753 6 04 87 f0 59 10 45
E: 14.844718 6 04 87 20 5a 30 45
E: 14.846711 6 04 83 60 17 a0 44
E: 14.850752 6 04 83 30 17 d0 44
E: 14.852731 6 04 87 70 5a 40 45
E: 14.856721 6 04 87 c0 5a 40 45
E: 14.858690 6 04 83 00 17 20 45
E: 14.862746 6 04 83 d0 16 60 45
E: 14.864728 6 04 87 10 5b 60 45
E: 14.868720 6 04 87 60 5b a0 45
E: 14.870689 6 04 83 90 16 b0 45
E: 14.873728 6 04 83 50 16 10 46
E: 14.875730 6 04 87 a0 5b 10 46
E: 14.879716 6 04 87 e0 5b 90 46
E: 14.881696 6 04 83 10 16 70 46
E: 14.885746 6 04 83 e0 15 a0 46
E: 14.887728 6 04 87 20 5c 10 47
E: 14.891716 6 04 87 40 5c 50 47
E: 14.893692 6 04 83 b0 15 e0 46
E: 14.897744 6 04 83 70 15 30 47
E: 14.899727 6 04 87 60 5c a0 47
E: 14.903716 6 04 87 80 5c 10 48
E: 14.905696 6 04 83 30 15 90 47
E: 14.909748 6 04 83 e0 14 f0 47
E: 14.911727 6 04 87 a0 5c 70 48
E: 14.914700 6 04 87 b0 5c b0 48
E: 14.916690 6 04 83 a0 14 40 48
E: 14.920751 6 04 83 60 14 b0 48
E: 14.922751 6 04 87 d0 5c 00 49
E: 14.926720 6 04 87 00 5d 60 49
E: 14.928689 6 04 83 00 14 30 49
E: 14.932747 6 04 83 80 13 b0 49
E: 14.934732 6 04 87 30 5d e0 49
E: 14.938774 6 04 87 60 5d 80 4a
E: 14.940743 6 04 83 00 13 30 4a
E: 14.944792 6 04 83 80 12 b0 4a
E: 14.946788 6 04 87 80 5d d0 4a
E: 14.950781 6 04 87 b0 5d 50 4b
E: 14.952743 6 04 83 20 12 10 4b
E: 14.956799 6 04 83 c0 11 70 4b
E: 14.958778 6 04 87 d0 5d b0 4b
E: 14.961770 6 04 87 00 5e 30 4c
E: 14.964235 6 04 83 60 11 c0 4b
E: 14.967808 6 04 83 00 11 40 4c
E: 14.969786 6 04 87 30 5e e0 4c
E: 14.973781 6 04 87 60 5e b0 4d
E: 14.975744 6 04 83 b0 10 a0 4c
E: 14.979796 6 04 83 60 10 20 4d
E: 14.981779 6 04 87 80 5e 50 4e
E: 14.985770 6 04 87 a0 5e f0 4e
E: 14.987733 6 04 83 10 10 b0 4d
E: 14.991786 6 04 83 c0 0f 50 4e
E: 14.993776 6 04 87 d0 5e 80 4f
E: 14.997761 6 04 87 00 5f 10 50
E: 14.999730 6 04 83 70 0f f0 4e
E: 15.003793 6 04 83 30 0f 70 4f
E: 15.005787 6 04 87 30 5f a0 50
E: 15.009764 6 04 87 50 5f 30 51
E: 15.011741 6 04 83 f0 0e f0 4f
E: 15.014778 6 04 83 b0 0e 70 50
E: 15.016786 6 04 87 70 5f a0 51
E: 15.020764 6 04 87 90 5f 20 52
E: 15.022823 6 04 83 70 0e f0 50
E: 15.026797 6 04 83 10 0e 70 51
E: 15.028783 6 04 87 c0 5f a0 52
E: 15.032769 6 04 87 f0 5f 20 53
E: 15.034741 6 04 83 a0 0d e0 51
E: 15.038796 6 04 83 20 0d 30 52
E: 15.040781 6 04 87 30 60 80 53
E: 15.044750 6 04 87 80 60 c0 53
E: 15.046838 6 04 83 a0 0c 80 52
E: 15.050783 6 04 83 30 0c d0 52
E: 15.052794 6 04 87 e0 60 f0 53
E: 15.055749 6 04 87 40 61 10 54
E: 15.057742 6 04 83 d0 0b 10 53
E: 15.061782 6 04 83 90 0b 40 53
E: 15.063796 6 04 87 80 61 20 54
E: 15.067753 6 04 87 b0 61 30 54
E: 15.069751 6 04 83 40 0b 70 53
E: 15.073776 6 04 83 00 0b a0 53
E: 15.075797 6 04 87 f0 61 50 54
E: 15.079749 6 04 87 40 62 90 54
E: 15.081838 6 04 83 c0 0a e0 53
E: 15.085779 6 04 83 90 0a 10 54
E: 15.087798 6 04 87 90 62 e0 54
E: 15.091746 6 04 87 e0 62 60 55
E: 15.093839 6 04 83 50 0a 50 54
E: 15.097786 6 04 83 20 0a 80 54
E: 15.099797 6 04 87 20 63 00 56
E: 15.102750 6 04 87 60 63 b0 56
E: 15.104739 6 04 83 e0 09 d0 54
E: 15.108779 6 04 83 90 09 30 55
E: 15.110792 6 04 87 a0 63 70 57
E: 15.114753 6 04 87 e0 63 30 58
E: 15.116748 6 04 83 60 09 80 55
E: 15.120776 6 04 83 20 09 e0 55
E: 15.122786 6 04 87 20 64 e0 58
E: 15.126755 6 04 87 60 64 90 59
E: 15.128815 6 04 83 f0 08 20 56
E: 15.132772 6 04 83 c0 08 70 56
E: 15.134755 6 04 87 90 64 40 5a
E: 15.138768 6 04 87 c0 64 e0 5a
E: 15.140734 6 04 83 a0 08 90 56
E: 15.144772 6 04 83 80 08 b0 56
E: 15.146791 6 04 87 e0 64 40 5b
E: 15.149827 6 04 87 10 65 d0 5b
E: 15.151735 6 04 83 60 08 d0 56
E: 15.155776 6 04 83 40 08 f0 56
E: 15.158001 6 04 87 40 65 60 5c
E: 15.161747 6 04 87 70 65 e0 5c
E: 15.163832 6 04 83 20 08 f0 56
E: 15.167760 6 04 83 20 08 f0 56
E: 15.169760 6 04 87 a0 65 70 5d
E: 15.173737 6 04 87 c0 65 c0 5d
E: 15.175752 6 04 83 00 08 f0 56
E: 15.179783 6 04 83 e0 07 10 57
E: 15.181789 6 04 87 00 66 30 5e
E: 15.185764 6 04 87 50 66 b0 5e
E: 15.187844 6 04 83 c0 07 50 57
E: 15.191779 6 04 83 a0 07 b0 57
E: 15.193798 6 04 87 b0 66 20 5f
E: 15.196751 6 04 87 10 67 a0 5f
E: 15.198742 6 04 83 90 07 00 58
E: 15.202776 6 04 83 70 07 70 58
E: 15.204783 6 04 87 70 67 60 60
E: 15.208763 6 04 87 d0 67 20 61
E: 15.210825 6 04 83 60 07 e0 58
E: 15.214779 6 04 83 50 07 30 59
E: 15.216796 6 04 87 20 68 f0 61
E: 15.220751 6 04 87 70 68 b0 62
E: 15.222839 6 04 83 40 07 b0 59
E: 15.226780 6 04 83 30 07 f0 59
E: 15.228795 6 04 87 b0 68 70 63
E: 15.232749 6 04 87 e0 68 00 64
E: 15.234720 6 04 83 30 07 f0 59
E: 15.238748 6 04 83 10 07 00 5a
E: 15.240781 6 04 87 00 69 70 64
E: 15.243753 6 04 87 20 69 c0 64
E: 15.245789 6 04 83 10 07 00 5a
E: 15.249753 6 04 83 f0 06 20 5a
E: 15.251779 6 04 87 40 69 20 65
E: 15.255768 6 04 87 60 69 60 65
E: 15.257912 6 04 83 e0 06 50 5a
E: 15.261771 6 04 83 e0 06 50 5a
E: 15.263843 6 04 87 80 69 b0 65
E: 15.267752 6 04 87 a0 69 f0 65
E: 15.269739 6 04 83 e0 06 70 5a
E: 15.273802 6 04 83 d0 06 a0 5a
E: 15.276199 6 04 87 b0 69 20 66
E: 15.279847 6 04 87 d0 69 60 66
E: 15.281774 6 04 83 d0 06 a0 5a
E: 15.284711 6 04 83 d0 06 a0 5a
E: 15.286469 6 04 87 f0 69 b0 66
E: 15.290811 6 04 87 00 6a e0 66
E: 15.292723 6 04 83 d0 06 c0 5a
E: 15.296756 6 04 83 d0 06 c0 5a
E: 15.298749 6 04 87 10 6a 00 67
E: 15.302756 6 04 87 20 6a 50 67
E: 15.304746 6 04 83 d0 06 a0 5a
E: 15.308791 6 04 83 d0 06 70 5a
E: 15.310979 6 04 87 30 6a 80 67
E: 15.313708 6 04 87 40 6a a0 67
E: 15.315707 6 04 83 d0 06 30 5a
E: 15.319746 6 04 83 d0 06 10 5a
E: 15.321710 6 04 87 50 6a d0 67
E: 15.325725 6 04 87 50 6a d0 67
E: 15.327694 6 04 83 d0 06 10 5a
E: 15.331698 6 04 83 d0 06 10 5a
E: 15.333690 6 04 87 50 6a d0 67
E: 15.337697 6 04 87 50 6a d0 67
E: 15.339687 6 04 83 d0 06 10 5a
E: 15.342681 6 04 83 d0 06 10 5a
E: 15.344681 6 04 87 50 6a d0 67
E: 15.348692 6 04 87 50 6a d0 67
E: 15.350701 6 04 83 d0 06 50 5a
E: 15.354739 6 04 83 d0 06 80 5a
E: 15.356718 6 04 87 50 6a d0 67
E: 15.360726 6 04 87 50 6a d0 67
E: 15.362707 6 04 83 d0 06 a0 5a
E: 15.365729 6 04 83 d0 06 a0 5a
E: 15.367696 6 04 87 50 6a d0 67
E: 15.371700 6 04 87 50 6a d0 67
E: 15.373684 6 04 83 d0 06 a0 5a
E: 15.377697 6 04 83 d0 06 c0 5a
E: 15.379736 6 04 87 70 6a e0 67
E: 15.382707 6 04 87 70 6a e0 67
E: 15.384688 6 04 83 d0 06 c0 5a
E: 15.388702 6 04 83 d0 06 c0 5a
E: 15.390680 6 04 87 70 6a e0 67
E: 15.394678 6 04 87 70 6a e0 67
E: 15.396691 6 04 83 d0 06 a0 5a
E: 15.400732 6 04 83 d0 06 a0 5a
E: 15.402704 6 04 87 70 6a c0 67
E: 15.405695 6 04 87 70 6a c0 67
E: 15.407697 6 04 83 d0 06 80 5a
E: 15.411741 6 04 83 d0 06 80 5a
E: 15.413689 6 04 87 70 6a c0 67
E: 15.417706 6 04 87 70 6a c0 67
E: 15.419685 6 04 83 d0 06 80 5a
E: 15.423700 6 04 83 d0 06 80 5a
E: 15.425687 6 04 87 70 6a c0 67
E: 15.429701 6 04 87 70 6a c0 67
E: 15.431682 6 04 83 d0 06 80 5a
E: 15.436076 6 04 83 d0 06 b0 5a
E: 15.437713 6 04 87 70 6a c0 67
E: 15.441718 6 04 87 70 6a c0 67
E: 15.443686 6 04 83 d0 06 b0 5a
E: 15.447715 6 04 83 d0 06 d0 5a
E: 15.449718 6 04 87 70 6a c0 67
E: 15.452706 6 04 87 70 6a c0 67
E: 15.454686 6 04 83 d0 06 d0 5a
E: 15.458695 6 04 83 d0 06 d0 5a
E: 15.460693 6 04 87 70 6a c0 67
E: 15.464685 6 04 87 70 6a c0 67
E: 15.467307 6 04 83 d0 06 d0 5a
E: 15.470700 6 04 83 d0 06 d0 5a
E: 15.472702 6 04 87 70 6a c0 67
E: 15.476685 6 04 87 70 6a c0 67
E: 15.478705 6 04 83 d0 06 d0 5a
E: 15.482703 6 04 83 d0 06 b0 5a
E: 15.484725 6 04 87 70 6a c0 67
E: 15.488731 6 04 87 70 6a c0 67
E: 15.490692 6 04 83 d0 06 b0 5a
E: 15.494710 6 04 83 d0 06 90 5a
E: 15.497142 6 04 87 70 6a c0 67
E: 15.499691 6 04 87 70 6a c0 67
E: 15.501697 6 04 83 d0 06 40 5a
E: 15.505728 6 04 83 d0 06 10 5a
E: 15.507748 6 04 87 70 6a c0 67
E: 15.511691 6 04 87 70 6a c0 67
E: 15.513690 6 04 83 d0 06 f0 59
E: 15.517736 6 04 83 d0 06 d0 59
E: 15.519744 6 04 87 70 6a c0 67
E: 15.523693 6 04 87 70 6a c0 67
E: 15.525704 6 04 83 d0 06 d0 59
E: 15.529684 6 04 83 d0 06 b0 59
E: 15.532060 6 04 87 70 6a c0 67
E: 15.535697 6 04 87 70 6a a0 67
E: 15.537710 6 04 83 d0 06 b0 59
E: 15.541686 6 04 83 d0 06 b0 59
E: 15.543700 6 04 87 70 6a 80 67
E: 15.546689 6 04 87 70 6a 80 67
E: 15.548690 6 04 83 d0 06 b0 59
E: 15.552698 6 04 83 d0 06 d0 59
E: 15.554732 6 04 87 70 6a 60 67
E: 15.558711 6 04 87 70 6a 60 67
E: 15.560691 6 04 83 d0 06 d0 59
E: 15.564786 6 04 83 d0 06 f0 59
E: 15.567762 6 04 87 70 6a 30 67
E: 15.570803 6 04 87 70 6a 30 67
E: 15.572765 6 04 83 d0 06 f0 59
E: 15.576776 6 04 83 d0 06 10 5a
E: 15.579357 6 04 87 70 6a 10 67
E: 15.582804 6 04 87 70 6a 10 67
E: 15.584767 6 04 83 d0 06 40 5a
E: 15.588836 6 04 83 d0 06 40 5a
E: 15.591125 6 04 87 70 6a f0 66
E: 15.593756 6 04 87 70 6a f0 66
E: 15.595764 6 04 83 d0 06 40 5a
E: 15.600519 6 04 83 d0 06 60 5a
E: 15.603382 6 04 87 70 6a f0 66
E: 15.605793 6 04 87 70 6a f0 66
E: 15.607758 6 04 83 d0 06 60 5a
E: 15.611780 6 04 83 d0 06 60 5a
E: 15.613752 6 04 87 70 6a f0 66
E: 15.617791 6 04 87 70 6a f0 66
E: 15.619753 6 04 83 d0 06 60 5a
E: 15.623772 6 04 83 d0 06 60 5a
E: 15.625768 6 04 87 70 6a f0 66
E: 15.629779 6 04 87 70 6a f0 66
E: 15.631754 6 04 83 d0 06 60 5a
E: 15.635785 6 04 83 d0 06 60 5a
E: 15.637754 6 04 87 70 6a f0 66
E: 15.640756 6 04 87 70 6a f0 66
E: 15.642752 6 04 83 d0 06 60 5a
E: 15.646794 6 04 83 d0 06 60 5a
E: 15.648752 6 04 87 70 6a f0 66
E: 15.652799 6 04 87 70 6a f0 66
E: 15.655554 6 04 83 d0 06 80 5a
E: 15.658811 6 04 83 d0 06 80 5a
E: 15.660760 6 04 87 70 6a f0 66
E: 15.664760 6 04 87 70 6a f0 66
E: 15.666779 6 04 83 d0 06 80 5a
E: 15.670752 6 04 83 d0 06 80 5a
E: 15.672778 6 04 87 70 6a f0 66
E: 15.676681 6 04 87 70 6a f0 66
E: 15.678761 6 04 83 d0 06 80 5a
E: 15.681681 6 04 83 d0 06 80 5a
E: 15.683679 6 04 87 70 6a f0 66
E: 15.687688 6 04 87 70 6a f0 66
E: 15.689703 6 04 83 d0 06 80 5a
E: 15.693681 6 04 83 d0 06 80 5a
E: 15.695687 6 04 87 70 6a f0 66
E: 15.699686 6 04 87 70 6a f0 66
E: 15.701685 6 04 83 d0 06 80 5a
E: 15.705695 6 04 83 d0 06 80 5a
E: 15.707702 6 04 87 70 6a f0 66
E: 15.711690 6 04 87 70 6a f0 66
E: 15.713691 6 04 83 d0 06 80 5a
E: 15.717686 6 04 83 d0 06 80 5a
E: 15.719692 6 04 87 70 6a f0 66
E: 15.722679 6 04 87 70 6a f0 66
E: 15.724679 6 04 83 d0 06 80 5a
E: 15.728677 6 04 83 d0 06 80 5a
E: 15.730700 6 04 87 70 6a f0 66
E: 15.734680 6 04 87 70 6a f0 66
E: 15.736690 6 04 83 d0 06 80 5a
E: 15.740681 6 04 83 d0 06 80 5a
E: 15.742704 6 04 87 70 6a f0 66
E: 15.745690 6 04 87 70 6a f0 66
E: 15.750678 6 04 87 70 6a f0 66
E: 15.754695 6 04 87 70 6a f0 66
E: 15.759896 6 04 87 70 6a d0 66
E: 15.763687 6 04 87 70 6a d0 66
E: 15.768841 6 04 87 70 6a b0 66
E: 15.771096 6 04 83 00 07 30 5a
E: 15.774439 6 04 82 00 07 30 5a
E: 15.774809 6 04 87 70 6a b0 66
E: 15.777781 6 04 87 70 6a 90 66
E: 15.781726 6 04 87 70 6a 90 66
E: 15.786856 6 04 87 70 6a 70 66
E: 15.790810 6 04 87 70 6a 70 66
E: 15.795799 6 04 87 70 6a 70 66
E: 15.799801 6 04 87 70 6a 70 66
E: 15.804807 6 04 87 70 6a 70 66
E: 15.808930 6 04 87 70 6a 70 66
E: 15.813797 6 04 87 70 6a 70 66
E: 15.817921 6 04 87 70 6a 70 66
E: 15.821917 6 04 87 70 6a 70 66
E: 15.826799 6 04 87 70 6a 70 66
E: 15.830800 6 04 87 70 6a 70 66
E: 15.835799 6 04 87 70 6a 70 66
E: 15.839919 6 04 87 70 6a 70 66
E: 15.844803 6 04 87 70 6a 70 66
E: 15.848918 6 04 87 70 6a 70 66
E: 15.853796 6 04 87 70 6a 70 66
E: 15.857915 6 04 87 70 6a 70 66
E: 15.862801 6 04 87 70 6a 70 66
E: 15.866801 6 04 87 70 6a 70 66
E: 15.871798 6 04 87 70 6a 70 66
E: 15.875809 6 04 87 70 6a 70 66
E: 15.880799 6 04 87 70 6a 70 66
E: 15.884799 6 04 87 70 6a 70 66
E: 15.889796 6 04 87 70 6a 70 66
E: 15.893799 6 04 87 70 6a 70 66
E: 15.898773 6 04 87 70 6a 70 66
E: 15.902713 6 04 87 70 6a 70 66
E: 15.907712 6 04 87 70 6a 70 66
E: 15.911769 6 04 87 70 6a 70 66
E: 15.916706 6 04 87 70 6a 70 66
E: 15.920704 6 04 87 70 6a 70 66
E: 15.924707 6 04 87 70 6a 70 66
E: 15.929708 6 04 87 70 6a 70 66
E: 15.933708 6 04 87 70 6a 70 66
E: 15.938708 6 04 87 70 6a 70 66
E: 15.942706 6 04 87 70 6a 70 66
E: 15.947712 6 04 87 70 6a 70 66
E: 15.951770 6 04 87 70 6a 70 66
E: 15.956710 6 04 87 70 6a 70 66
E: 15.960797 6 04 87 70 6a 70 66
E: 15.965709 6 04 87 70 6a 70 66
E: 15.969743 6 04 87 70 6a 70 66
E: 15.974723 6 04 87 70 6a 70 66
E: 15.978710 6 04 87 70 6a 70 66
E: 15.983707 6 04 87 70 6a 70 66
E: 15.987709 6 04 87 70 6a 70 66
E: 15.992709 6 04 87 70 6a 70 66
E: 15.996712 6 04 87 70 6a 70 66
E: 16.001708 6 04 87 70 6a 70 66
E: 16.005805 6 04 87 70 6a 70 66
E: 16.009802 6 04 87 70 6a 70 66
E: 16.014805 6 04 87 70 6a 70 66
E: 16.018831 6 04 87 70 6a 70 66
E: 16.023919 6 04 87 70 6a 70 66
E: 16.027917 6 04 87 70 6a 70 66
E: 16.032799 6 04 87 70 6a 70 66
E: 16.036811 6 04 87 70 6a 70 66
E: 16.041798 6 04 87 70 6a 70 66
E: 16.045806 6 04 87 70 6a 70 66
E: 16.050800 6 04 87 70 6a 70 66
E: 16.054861 6 04 87 70 6a 70 66
E: 16.059799 6 04 87 70 6a 70 66
E: 16.063917 6 04 87 70 6a 70 66
E: 16.068827 6 04 87 70 6a 70 66
E: 16.072968 6 04 87 60 6a 50 66
E: 16.077802 6 04 87 60 6a 50 66
E: 16.081800 6 04 87 60 6a 50 66
E: 16.086815 6 04 87 60 6a 50 66
E: 16.090802 6 04 87 60 6a 50 66
E: 16.095805 6 04 87 60 6a 50 66
E: 16.099949 6 04 87 60 6a 50 66
E: 16.104803 6 04 87 60 6a 50 66
E: 16.108916 6 04 87 60 6a 50 66
E: 16.112805 6 04 87 60 6a 50 66
E: 16.117806 6 04 87 60 6a 50 66
E: 16.121710 6 04 87 60 6a 50 66
E: 16.126706 6 04 87 60 6a 50 66
E: 16.130710 6 04 87 60 6a 50 66
E: 16.135711 6 04 87 60 6a 50 66
E: 16.139768 6 04 87 60 6a 50 66
E: 16.144708 6 04 87 60 6a 50 66
E: 16.148825 6 04 87 60 6a 50 66
E: 16.153708 6 04 87 60 6a 50 66
E: 16.157707 6 04 87 60 6a 50 66
E: 16.162707 6 04 87 60 6a 50 66
E: 16.166763 6 04 87 60 6a 50 66
E: 16.171708 6 04 87 60 6a 50 66
E: 16.175715 6 04 87 60 6a 50 66
E: 16.180768 6 04 87 60 6a 50 66
E: 16.184704 6 04 87 60 6a 50 66
E: 16.189707 6 04 87 60 6a 50 66
E: 16.193708 6 04 87 60 6a 50 66
E: 16.198709 6 04 87 60 6a 50 66
E: 16.202709 6 04 87 60 6a 50 66
E: 16.206710 6 04 87 60 6a 50 66
E: 16.211822 6 04 87 60 6a 50 66
E: 16.215712 6 04 87 60 6a 50 66
E: 16.220708 6 04 87 60 6a 50 66
E: 16.224812 6 04 87 60 6a 50 66
E: 16.229798 6 04 87 60 6a 50 66
E: 16.233806 6 04 87 60 6a 50 66
E: 16.239089 6 04 87 60 6a 50 66
E: 16.242842 6 04 87 50 6a 30 66
E: 16.247918 6 04 87 50 6a 30 66
E: 16.251804 6 04 87 50 6a 30 66
E: 16.256801 6 04 87 50 6a 30 66
E: 16.260919 6 04 87 50 6a 30 66
E: 16.265801 6 04 87 50 6a 30 66
E: 16.269804 6 04 87 50 6a 30 66
E: 16.274830 6 04 87 50 6a 30 66
E: 16.278808 6 04 87 50 6a 30 66
E: 16.283926 6 04 87 50 6a 30 66
E: 16.287805 6 04 87 50 6a 30 66
E: 16.292803 6 04 87 50 6a 30 66
E: 16.296922 6 04 87 50 6a 30 66
E: 16.301790 6 04 87 50 6a 30 66
E: 16.305924 6 04 87 50 6a 30 66
E: 16.309804 6 04 87 50 6a 30 66
E: 16.314809 6 04 87 50 6a 30 66
E: 16.318837 6 04 87 50 6a 30 66
E: 16.323815 6 04 87 50 6a 30 66
E: 16.327801 6 04 87 50 6a 30 66
E: 16.332794 6 04 87 50 6a 30 66
E: 16.336716 6 04 87 50 6a 30 66
E: 16.341712 6 04 87 50 6a 30 66
E: 16.345710 6 04 87 50 6a 30 66
E: 16.350711 6 04 87 50 6a 30 66
E: 16.354732 6 04 87 40 6a 10 66
E: 16.359714 6 04 87 40 6a 10 66
E: 16.363801 6 04 87 40 6a 10 66
E: 16.368710 6 04 87 40 6a 10 66
E: 16.372712 6 04 87 40 6a 10 66
E: 16.377760 6 04 87 40 6a 10 66
E: 16.381710 6 04 87 40 6a 10 66
E: 16.386717 6 04 87 40 6a 10 66
E: 16.390830 6 04 87 40 6a 10 66
E: 16.395728 6 04 87 40 6a f0 65
E: 16.399713 6 04 87 40 6a f0 65
E: 16.403730 6 04 87 30 6a d0 65
E: 16.408710 6 04 87 30 6a d0 65
E: 16.412731 6 04 87 30 6a b0 65
E: 16.417715 6 04 87 30 6a b0 65
E: 16.421710 6 04 87 30 6a b0 65
E: 16.426708 6 04 87 30 6a b0 65
E: 16.430707 6 04 87 30 6a b0 65
E: 16.435717 6 04 87 30 6a b0 65
E: 16.439709 6 04 87 30 6a b0 65
E: 16.444804 6 04 87 30 6a b0 65
E: 16.448806 6 04 87 30 6a b0 65
E: 16.453804 6 04 87 30 6a b0 65
E: 16.457794 6 04 87 30 6a b0 65
E: 16.462798 6 04 87 30 6a b0 65
E: 16.466918 6 04 87 30 6a b0 65
E: 16.471832 6 04 87 30 6a b0 65
E: 16.496886 6 04 87 30 6a e0 65
E: 16.498993 6 04 86 30 6a e0 65
3. Finally, move your ten fingers on the screen and release them.
# 3. Finally, move your ten fingers on the screen and release them.
E: 22.272921 6 04 83 10 6c 70 5e
E: 22.278911 6 04 83 10 6c 70 5e
E: 22.287963 6 04 83 20 6c 30 5e
E: 22.289900 6 04 87 a0 6b 30 2f
E: 22.296913 6 04 87 a0 6b 10 2f
E: 22.306860 6 04 87 50 6b d0 2e
E: 22.319857 6 04 83 20 6c f0 5d
E: 22.332911 6 04 87 10 6b a0 2e
E: 22.334863 6 04 83 30 6c 90 5d
E: 22.336899 6 04 8b b0 48 00 6e
E: 22.343889 6 04 87 f0 6a 80 2e
E: 22.353865 6 04 83 20 6c 40 5d
E: 22.366910 6 04 87 d0 6a 70 2e
E: 22.368857 6 04 83 20 6c 10 5d
E: 22.376901 6 04 83 f0 6b d0 5c
E: 22.389753 6 04 87 d0 6a 70 2e
E: 22.391844 6 04 83 d0 6b a0 5c
E: 22.398784 6 04 83 c0 6b 70 5c
E: 22.400762 6 04 8b b0 48 00 6e
E: 22.402746 6 04 8a b0 48 00 6e
E: 22.408755 6 04 83 90 6b 70 5c
E: 22.418811 6 04 83 70 6b 70 5c
E: 22.427784 6 04 83 40 6b 70 5c
E: 22.440790 6 04 87 b0 6a 50 2e
E: 22.442724 6 04 83 40 6b 70 5c
E: 22.444749 6 04 8b e0 51 80 2e
E: 22.450750 6 04 8b 80 51 70 2e
E: 22.452733 6 04 83 30 6b 90 5c
E: 22.463792 6 04 8b 40 51 70 2e
E: 22.465726 6 04 87 b0 6a 50 2e
E: 22.467790 6 04 83 30 6b 90 5c
E: 22.469748 6 04 8f 30 16 b0 69
E: 22.476737 6 04 87 90 6a 40 2e
E: 22.478733 6 04 83 50 6b a0 5c
E: 22.480753 6 04 8f 30 16 b0 69
E: 22.482764 6 04 8b 10 51 60 2e
E: 22.489720 6 04 8f 30 16 b0 69
E: 22.491713 6 04 8b 10 51 60 2e
E: 22.493708 6 04 87 90 6a 40 2e
E: 22.496791 6 04 83 90 6b b0 5c
E: 22.499896 6 04 8b b0 50 50 2e
E: 22.502031 6 04 83 90 6b b0 5c
E: 22.504132 6 04 8f 20 16 90 69
E: 22.509862 6 04 8b 30 50 40 2e
E: 22.511913 6 04 83 90 6b b0 5c
E: 22.513798 6 04 8f 20 16 90 69
E: 22.518825 6 04 83 50 6b 90 5c
E: 22.522100 6 04 8f 20 16 70 69
E: 22.523275 6 04 8b a0 4f 30 2e
E: 22.531862 6 04 8f 20 16 70 69
E: 22.533866 6 04 8b 70 4f 20 2e
E: 22.537818 6 04 87 70 6a 30 2e
E: 22.541617 6 04 83 30 6b 80 5c
E: 22.545077 6 04 8b 70 4f 20 2e
E: 22.547685 6 04 87 70 6a 30 2e
E: 22.551038 6 04 83 10 6b 70 5c
E: 22.552682 6 04 8f 20 16 70 69
E: 22.557874 6 04 8b b0 4f 00 2e
E: 22.559930 6 04 87 70 6a 30 2e
E: 22.561814 6 04 83 10 6b 70 5c
E: 22.563989 6 04 8f 20 16 70 69
E: 22.567977 6 04 83 f0 6a 70 5c
E: 22.570411 6 04 8f 20 16 70 69
E: 22.571988 6 04 8b b0 4f 00 2e
E: 22.580834 6 04 8f 20 16 70 69
E: 22.582807 6 04 8b b0 4f 00 2e
E: 22.584812 6 04 87 70 6a 30 2e
E: 22.586842 6 04 83 f0 6a 70 5c
E: 22.590845 6 04 8b a0 4f 20 2e
E: 22.593130 6 04 87 50 6a 30 2e
E: 22.594974 6 04 8f 10 16 40 69
E: 22.600877 6 04 8b 60 4f 50 2e
E: 22.602807 6 04 87 50 6a 30 2e
E: 22.604813 6 04 8f 10 16 40 69
E: 22.613698 6 04 87 50 6a 30 2e
E: 22.615786 6 04 83 f0 6a 70 5c
E: 22.617803 6 04 8f 10 16 20 69
E: 22.619723 6 04 8b 50 4f 70 2e
E: 22.622761 6 04 8f 10 16 00 69
E: 22.624709 6 04 8b 30 4f 90 2e
E: 22.626708 6 04 83 e0 6a a0 5c
E: 22.635766 6 04 8b 40 4f b0 2e
E: 22.637706 6 04 87 50 6a 30 2e
E: 22.639876 6 04 83 f0 6a e0 5c
E: 22.641774 6 04 8f 00 16 e0 68
E: 22.645878 6 04 8b 30 4f d0 2e
E: 22.647732 6 04 83 e0 6a 30 5d
E: 22.649927 6 04 8f f0 15 b0 68
E: 22.658705 6 04 87 50 6a 30 2e
E: 22.660747 6 04 8f f0 15 b0 68
E: 22.662846 6 04 8b 50 4f 00 2f
E: 22.671828 6 04 8f e0 15 80 68
E: 22.673816 6 04 8b 90 4f 30 2f
E: 22.675692 6 04 87 50 6a 30 2e
E: 22.681899 6 04 8b 90 4f 90 2f
E: 22.683739 6 04 87 50 6a 30 2e
E: 22.685687 6 04 8f e0 15 80 68
E: 22.690813 6 04 8b 60 4f 00 30
E: 22.692741 6 04 87 50 6a 30 2e
E: 22.694862 6 04 8f e0 15 60 68
E: 22.702703 6 04 87 50 6a 30 2e
E: 22.704698 6 04 8f e0 15 60 68
E: 22.706832 6 04 8b 70 4f 80 30
E: 22.711812 6 04 8f e0 15 30 68
E: 22.713870 6 04 8b 60 4f 00 31
E: 22.716317 6 04 87 40 6a 70 2e
E: 22.718246 6 04 83 70 6a e0 5d
E: 22.720284 6 04 82 70 6a e0 5d
E: 22.723803 6 04 8b 80 4f 70 31
E: 22.725805 6 04 87 30 6a e0 2e
E: 22.727726 6 04 8f d0 15 10 68
E: 22.736752 6 04 8b 90 4f c0 31
E: 22.738726 6 04 87 30 6a 30 2f
E: 22.740793 6 04 8f d0 15 f0 67
E: 22.742734 6 04 83 70 39 d0 32
E: 22.745790 6 04 87 20 6a 90 2f
E: 22.747713 6 04 8f d0 15 f0 67
E: 22.749731 6 04 83 10 39 d0 32
E: 22.751796 6 04 8b 80 4f 10 32
E: 22.757743 6 04 8f d0 15 d0 67
E: 22.759794 6 04 83 d0 38 d0 32
E: 22.761797 6 04 8b 70 4f 40 32
E: 22.763744 6 04 87 10 6a f0 2f
E: 22.769739 6 04 83 a0 38 d0 32
E: 22.771729 6 04 8b 90 4f 90 32
E: 22.773730 6 04 87 10 6a 60 30
E: 22.775808 6 04 8f d0 15 a0 67
E: 22.781768 6 04 8b a0 4f d0 32
E: 22.783733 6 04 87 10 6a b0 30
E: 22.785804 6 04 8f d0 15 80 67
E: 22.787745 6 04 83 80 38 d0 32
E: 22.794735 6 04 87 20 6a 20 31
E: 22.796712 6 04 8f d0 15 80 67
E: 22.798863 6 04 83 60 38 d0 32
E: 22.800840 6 04 8b b0 4f 00 33
E: 22.803732 6 04 8f d0 15 60 67
E: 22.805792 6 04 83 e0 37 d0 32
E: 22.807727 6 04 8b a0 4f 30 33
E: 22.809791 6 04 87 20 6a 80 31
E: 22.812727 6 04 83 30 37 e0 32
E: 22.814728 6 04 87 20 6a c0 31
E: 22.816730 6 04 8f d0 15 40 67
E: 22.824850 6 04 87 20 6a 20 32
E: 22.826834 6 04 8f d0 15 20 67
E: 22.829048 6 04 83 c0 36 f0 32
E: 22.836881 6 04 87 20 6a 80 32
E: 22.838837 6 04 8f c0 15 e0 66
E: 22.840890 6 04 83 70 36 00 33
E: 22.842863 6 04 8b b0 4f 80 33
E: 22.845846 6 04 8f c0 15 c0 66
E: 22.847968 6 04 83 00 36 10 33
E: 22.849975 6 04 87 20 6a c0 32
E: 22.854845 6 04 83 70 35 30 33
E: 22.856970 6 04 8f b0 15 80 66
E: 22.867848 6 04 8b e0 4f d0 33
E: 22.869842 6 04 87 20 6a f0 32
E: 22.871969 6 04 8f a0 15 30 66
E: 22.873871 6 04 83 20 35 50 33
E: 22.879869 6 04 87 10 6a 40 33
E: 22.881832 6 04 8f a0 15 f0 65
E: 22.883833 6 04 83 00 35 60 33
E: 22.891850 6 04 8f 90 15 60 65
E: 22.893804 6 04 83 00 35 60 33
E: 22.895832 6 04 8b 30 50 30 34
E: 22.897865 6 04 87 10 6a 80 33
E: 22.900975 6 04 83 a0 34 90 33
E: 22.902830 6 04 87 f0 69 e0 33
E: 22.904850 6 04 8f 80 15 c0 64
E: 22.909837 6 04 87 d0 69 70 34
E: 22.911842 6 04 8f 70 15 40 64
E: 22.913833 6 04 83 20 34 b0 33
E: 22.918848 6 04 87 a0 69 10 35
E: 22.920855 6 04 8f 50 15 c0 63
E: 22.923075 6 04 83 80 33 c0 33
E: 22.926836 6 04 87 70 69 b0 35
E: 22.928862 6 04 83 f0 32 e0 33
E: 22.936757 6 04 87 50 69 30 36
E: 22.938800 6 04 83 a0 32 00 34
E: 22.940792 6 04 8b 90 50 b0 34
E: 22.944731 6 04 83 50 32 10 34
E: 22.946811 6 04 87 30 69 e0 36
E: 22.952811 6 04 87 10 69 70 37
E: 22.954733 6 04 83 00 32 20 34
E: 22.960742 6 04 87 f0 68 20 38
E: 22.962793 6 04 83 c0 31 20 34
E: 22.968743 6 04 83 70 31 30 34
E: 22.970736 6 04 87 d0 68 e0 38
E: 22.972799 6 04 8f f0 14 c0 62
E: 22.974728 6 04 8e f0 14 c0 62
E: 22.976794 6 04 87 b0 68 90 39
E: 22.978805 6 04 83 40 31 30 34
E: 22.986758 6 04 87 90 68 40 3a
E: 22.988730 6 04 83 20 31 40 34
E: 22.990729 6 04 8b 60 51 10 36
E: 22.992741 6 04 8a 60 51 10 36
E: 22.996733 6 04 83 30 31 60 34
E: 22.998806 6 04 87 80 68 c0 3a
E: 23.000794 6 04 8b 00 6a a0 5e
E: 23.007733 6 04 87 50 68 20 3b
E: 23.009794 6 04 8b 10 6a 80 5e
E: 23.011768 6 04 83 30 31 60 34
E: 23.015734 6 04 87 00 68 90 3b
E: 23.017719 6 04 8b 10 6a 80 5e
E: 23.024734 6 04 87 c0 67 e0 3b
E: 23.026729 6 04 8b 30 6a 60 5e
E: 23.033733 6 04 87 60 67 50 3c
E: 23.035740 6 04 8b 30 6a 60 5e
E: 23.041763 6 04 87 20 67 a0 3c
E: 23.043734 6 04 8b 40 6a 40 5e
E: 23.048841 6 04 87 00 67 20 3d
E: 23.055847 6 04 8b 20 6a 10 5e
E: 23.059282 6 04 83 30 31 70 34
E: 23.063174 6 04 82 30 31 70 34
E: 23.066596 6 04 87 f0 66 c0 3d
E: 23.070853 6 04 87 00 67 70 3e
E: 23.078845 6 04 87 00 67 f0 3e
E: 23.085857 6 04 87 00 67 30 3f
E: 23.096858 6 04 87 e0 66 90 3f
E: 23.098979 6 04 8b 00 6a f0 5d
E: 23.106850 6 04 87 b0 66 80 3f
E: 23.122844 6 04 87 90 66 90 3f
E: 23.133839 6 04 87 60 66 e0 3f
E: 23.135853 6 04 8b 00 6a f0 5d
E: 23.138016 6 04 83 a0 2d 90 34
E: 23.140038 6 04 8f 00 4f 50 6b
E: 23.146811 6 04 8f 00 4f 50 6b
E: 23.154857 6 04 83 60 2d 90 34
E: 23.156801 6 04 87 50 66 80 40
E: 23.163727 6 04 87 20 66 c0 40
E: 23.172732 6 04 8b b0 69 c0 5d
E: 23.174724 6 04 83 00 2d a0 34
E: 23.181734 6 04 8f 10 4f d0 6a
E: 23.189725 6 04 83 80 2c b0 34
E: 23.198733 6 04 8f 30 4f f0 69
E: 23.207735 6 04 83 00 2c c0 34
E: 23.216733 6 04 83 c0 2b c0 34
E: 23.218797 6 04 87 40 65 c0 3f
E: 23.220727 6 04 86 40 65 c0 3f
E: 23.225745 6 04 83 70 2b d0 34
E: 23.227807 6 04 8b c0 68 a0 5d
E: 23.229727 6 04 8a c0 68 a0 5d
E: 23.235746 6 04 83 30 2b d0 34
E: 23.244733 6 04 83 f0 2a d0 34
E: 23.253738 6 04 83 b0 2a d0 34
E: 23.255795 6 04 8f a0 4f 90 67
E: 23.257727 6 04 8e a0 4f 90 67
E: 23.263743 6 04 83 90 2a d0 34
E: 23.265841 6 04 87 50 19 b0 25
E: 23.272854 6 04 83 30 2a 60 34
E: 23.290856 6 04 83 b0 29 a0 33
E: 23.310858 6 04 83 10 29 30 33
E: 23.318858 6 04 87 20 19 a0 25
E: 23.328859 6 04 83 50 28 c0 32
E: 23.338852 6 04 87 d0 18 c0 25
E: 23.348855 6 04 83 70 27 60 32
E: 23.359853 6 04 87 70 18 30 26
E: 23.369858 6 04 83 80 26 10 32
E: 23.389859 6 04 83 80 25 d0 31
E: 23.400848 6 04 87 a0 17 f0 26
E: 23.410852 6 04 87 80 16 20 28
E: 23.413060 6 04 83 80 24 a0 31
E: 23.415026 6 04 8b c0 53 00 62
E: 23.421844 6 04 83 60 23 70 31
E: 23.430851 6 04 8b f0 53 f0 61
E: 23.432851 6 04 87 50 15 90 29
E: 23.435255 6 04 83 50 22 50 31
E: 23.438845 6 04 83 f0 20 30 31
E: 23.450845 6 04 8b 30 54 e0 61
E: 23.452834 6 04 87 30 14 c0 2a
E: 23.468962 6 04 83 a0 1f 20 31
E: 23.470846 6 04 8b a0 54 d0 61
E: 23.477126 6 04 83 30 1e 60 32
E: 23.486886 6 04 8b 40 55 c0 61
E: 23.488991 6 04 87 d0 13 f0 2b
E: 23.493838 6 04 87 00 14 60 2d
E: 23.503854 6 04 87 f0 13 a0 2e
E: 23.511842 6 04 83 c0 1c 90 34
E: 23.520854 6 04 87 a0 13 a0 2f
E: 23.528849 6 04 8b 80 56 e0 61
E: 23.531120 6 04 83 70 1b d0 36
E: 23.538865 6 04 8b 80 57 50 61
E: 23.540981 6 04 87 70 13 60 30
E: 23.546882 6 04 83 40 1a d0 38
E: 23.548804 6 04 8b 00 58 40 60
E: 23.555848 6 04 8b f0 58 f0 5e
E: 23.557936 6 04 87 a0 13 f0 30
E: 23.564834 6 04 8b 30 5a f0 5d
E: 23.567035 6 04 83 70 19 60 3a
E: 23.573845 6 04 87 b0 13 60 31
E: 23.575796 6 04 8b a0 5b f0 5c
E: 23.581856 6 04 8b 00 5d 60 5c
E: 23.583952 6 04 83 00 19 70 3b
E: 23.591837 6 04 8b 40 5e c0 5b
E: 23.594028 6 04 87 10 14 d0 31
E: 23.598733 6 04 83 d0 18 30 3c
E: 23.600727 6 04 8b 40 5f 80 5b
E: 23.605725 6 04 8b 00 60 90 5b
E: 23.607725 6 04 83 b0 18 c0 3c
E: 23.612727 6 04 8b 80 60 d0 5b
E: 23.614730 6 04 83 b0 18 20 3d
E: 23.619730 6 04 83 b0 18 50 3d
E: 23.621722 6 04 8b c0 60 f0 5b
E: 23.627732 6 04 8b 10 61 20 5c
E: 23.629726 6 04 83 d0 18 80 3d
E: 23.634726 6 04 8b 50 61 40 5c
E: 23.636728 6 04 83 00 19 90 3d
E: 23.638729 6 04 87 20 16 d0 32
E: 23.640735 6 04 86 20 16 d0 32
E: 23.642726 6 04 83 20 19 a0 3d
E: 23.644728 6 04 8b 60 61 f0 5b
E: 23.647794 6 04 8b d0 60 90 5b
E: 23.649769 6 04 83 20 19 a0 3d
E: 23.673727 6 04 83 70 19 f0 3d
E: 23.675726 6 04 82 70 19 f0 3d
E: 23.677790 6 04 8b d0 5d 40 5b
E: 23.679733 6 04 8a d0 5d 40 5b
