R: 322 05 0d 09 04 a1 01 85 04 09 22 a1 00 09 42 15 00 25 01 75 01 95 01 81 02 09 32 15 00 25 01 81 02 09 51 75 05 95 01 16 00 00 26 10 00 81 02 09 47 75 01 95 01 15 00 25 01 81 02 05 01 09 30 75 10 95 01 55 0d 65 33 35 00 46 c1 20 26 ff 7f 81 02 09 31 75 10 95 01 55 0d 65 33 35 00 46 c2 18 26 ff 7f 81 02 05 0d 09 55 25 08 75 08 95 01 b1 02 c0 c0 05 01 09 01 a1 01 85 01 09 01 a1 00 05 09 19 01 29 02 15 00 25 01 95 02 75 01 81 02 95 01 75 06 81 01 05 01 09 30 09 31 16 00 00 26 ff 0f 36 00 00 46 ff 0f 66 00 00 75 10 95 02 81 02 c0 c0 06 00 ff 09 01 a1 01 09 01 15 00 26 ff 00 85 03 75 08 95 3f 81 02 06 00 ff 09 01 15 00 26 ff 00 75 08 95 3f 91 02 c0 05 0d 09 04 a1 01 85 02 09 20 a1 00 09 42 09 32 15 00 25 01 95 02 75 01 81 02 95 06 75 01 81 03 05 01 09 30 75 10 95 01 a4 55 0d 65 33 36 00 00 46 c1 20 16 00 00 26 ff 0f 81 02 09 31 16 00 00 26 ff 0f 36 00 00 46 c2 18 81 02 b4 c0 c0 05 0d 09 0e a1 01 85 05 09 22 a1 00 09 52 09 53 15 00 25 0a 75 08 95 02 b1 02 c0 c0
N: eGalax_eMPIA Technology Inc. PCAP MultiTouch Controller
I: 3 0eef 7336
# 1. Drag _one_ finger on the screen from one corner to the opposite, and release it.
E: 0.000000 6 04 83 f0 0f f0 0f
E: 0.009886 6 04 83 f0 0f f0 0f
E: 0.019879 6 04 83 f0 0f f0 0f
E: 0.029882 6 04 83 f0 0f f0 0f
E: 0.039882 6 04 83 f0 0f f0 0f
E: 0.049882 6 04 83 f0 0f f0 0f
E: 0.059882 6 04 83 f0 0f f0 0f
E: 0.069882 6 04 83 f0 0f f0 0f
E: 0.079883 6 04 83 f0 0f f0 0f
E: 0.089879 6 04 83 f0 0f f0 0f
E: 0.099882 6 04 83 f0 0f f0 0f
E: 0.109882 6 04 83 f0 0f f0 0f
E: 0.120881 6 04 83 f0 0f f0 0f
E: 0.130882 6 04 83 f0 0f f0 0f
E: 0.140882 6 04 83 f0 0f f0 0f
E: 0.150882 6 04 83 f0 0f f0 0f
E: 0.160882 6 04 83 f0 0f f0 0f
E: 0.170879 6 04 83 f0 0f f0 0f
E: 0.180883 6 04 83 f0 0f f0 0f
E: 0.190883 6 04 83 f0 0f f0 0f
E: 0.200882 6 04 83 f0 0f f0 0f
E: 0.211880 6 04 83 f0 0f f0 0f
E: 0.221879 6 04 83 f0 0f f0 0f
E: 0.231882 6 04 83 f0 0f f0 0f
E: 0.242881 6 04 83 f0 0f f0 0f
E: 0.252882 6 04 83 f0 0f f0 0f
E: 0.262881 6 04 83 f0 0f f0 0f
E: 0.272877 6 04 83 f0 0f f0 0f
E: 0.282880 6 04 83 f0 0f f0 0f
E: 0.292881 6 04 83 f0 0f f0 0f
E: 0.302880 6 04 83 f0 0f f0 0f
E: 0.312883 6 04 83 f0 0f f0 0f
E: 0.322881 6 04 83 f0 0f f0 0f
E: 0.332881 6 04 83 f0 0f f0 0f
E: 0.342881 6 04 83 f0 0f f0 0f
E: 0.352881 6 04 83 f0 0f f0 0f
E: 0.363882 6 04 83 f0 0f f0 0f
E: 0.373880 6 04 83 f0 0f f0 0f
E: 0.383882 6 04 83 f0 0f f0 0f
E: 0.393881 6 04 83 f0 0f f0 0f
E: 0.403882 6 04 83 f0 0f f0 0f
E: 0.413881 6 04 83 f0 0f f0 0f
E: 0.423880 6 04 83 f0 0f f0 0f
E: 0.433881 6 04 83 f0 0f f0 0f
E: 0.443881 6 04 83 f0 0f f0 0f
E: 0.453881 6 04 83 f0 0f f0 0f
E: 0.463881 6 04 83 f0 0f f0 0f
E: 0.475892 6 04 83 00 10 30 10
E: 0.485889 6 04 83 20 10 90 10
E: 0.495889 6 04 83 40 10 e0 10
E: 0.505890 6 04 83 50 10 20 11
E: 0.515890 6 04 83 90 10 80 11
E: 0.525889 6 04 83 c0 10 c0 11
E: 0.535890 6 04 83 e0 10 f0 11
E: 0.545889 6 04 83 00 11 20 12
E: 0.555890 6 04 83 40 11 70 12
E: 0.565889 6 04 83 a0 11 d0 12
E: 0.575891 6 04 83 00 12 30 13
E: 0.585889 6 04 83 60 12 90 13
E: 0.595890 6 04 83 a0 12 d0 13
E: 0.605888 6 04 83 d0 12 00 14
E: 0.615890 6 04 83 00 13 30 14
E: 0.626889 6 04 83 20 13 50 14
E: 0.636881 6 04 83 20 13 50 14
E: 0.646890 6 04 83 40 13 70 14
E: 0.656881 6 04 83 40 13 70 14
E: 0.666889 6 04 83 60 13 90 14
E: 0.676890 6 04 83 90 13 d0 14
E: 0.686887 6 04 83 b0 13 00 15
E: 0.696890 6 04 83 f0 13 50 15
E: 0.706890 6 04 83 20 14 90 15
E: 0.716889 6 04 83 40 14 c0 15
E: 0.727890 6 04 83 80 14 30 16
E: 0.737890 6 04 83 e0 14 c0 16
E: 0.747889 6 04 83 20 15 20 17
E: 0.757890 6 04 83 80 15 a0 17
E: 0.767888 6 04 83 d0 15 00 18
E: 0.777891 6 04 83 00 16 40 18
E: 0.788889 6 04 83 50 16 a0 18
E: 0.798890 6 04 83 90 16 f0 18
E: 0.808890 6 04 83 c0 16 20 19
E: 0.818887 6 04 83 10 17 80 19
E: 0.828890 6 04 83 50 17 c0 19
E: 0.838890 6 04 83 b0 17 20 1a
E: 0.848889 6 04 83 f0 17 70 1a
E: 0.858890 6 04 83 50 18 e0 1a
E: 0.868889 6 04 83 d0 18 60 1b
E: 0.878890 6 04 83 30 19 c0 1b
E: 0.888890 6 04 83 b0 19 40 1c
E: 0.898889 6 04 83 40 1a e0 1c
E: 0.908890 6 04 83 b0 1a 50 1d
E: 0.918890 6 04 83 00 1b a0 1d
E: 0.928889 6 04 83 60 1b 10 1e
E: 0.938890 6 04 83 b0 1b 60 1e
E: 0.948890 6 04 83 10 1c d0 1e
E: 0.959891 6 04 83 60 1c 20 1f
E: 0.969889 6 04 83 c0 1c 90 1f
E: 0.980891 6 04 83 40 1d 10 20
E: 0.990889 6 04 83 d0 1d 90 20
E: 1.000890 6 04 83 40 1e f0 20
E: 1.010890 6 04 83 c0 1e 70 21
E: 1.020886 6 04 83 20 1f d0 21
E: 1.030888 6 04 83 a0 1f 50 22
E: 1.040889 6 04 83 20 20 e0 22
E: 1.050889 6 04 83 80 20 50 23
E: 1.060890 6 04 83 f0 20 d0 23
E: 1.070887 6 04 83 50 21 30 24
E: 1.080890 6 04 83 d0 21 b0 24
E: 1.090889 6 04 83 60 22 30 25
E: 1.100890 6 04 83 d0 22 90 25
E: 1.110888 6 04 83 60 23 10 26
E: 1.120890 6 04 83 f0 23 a0 26
E: 1.131888 6 04 83 60 24 00 27
E: 1.141888 6 04 83 e0 24 80 27
E: 1.151890 6 04 83 60 25 20 28
E: 1.161889 6 04 83 f0 25 d0 28
E: 1.171888 6 04 83 90 26 80 29
E: 1.181889 6 04 83 00 27 00 2a
E: 1.191889 6 04 83 90 27 90 2a
E: 1.201890 6 04 83 00 28 f0 2a
E: 1.211890 6 04 83 80 28 70 2b
E: 1.221885 6 04 83 e0 28 d0 2b
E: 1.231889 6 04 83 60 29 40 2c
E: 1.242890 6 04 83 f0 29 d0 2c
E: 1.252890 6 04 83 50 2a 40 2d
E: 1.262889 6 04 83 e0 2a c0 2d
E: 1.272887 6 04 83 80 2b 60 2e
E: 1.282890 6 04 83 20 2c 10 2f
E: 1.292890 6 04 83 a0 2c 90 2f
E: 1.303889 6 04 83 30 2d 20 30
E: 1.313889 6 04 83 90 2d 90 30
E: 1.323890 6 04 83 10 2e 10 31
E: 1.333889 6 04 83 70 2e 70 31
E: 1.343889 6 04 83 e0 2e f0 31
E: 1.353889 6 04 83 70 2f 80 32
E: 1.363890 6 04 83 10 30 10 33
E: 1.373887 6 04 83 80 30 80 33
E: 1.383888 6 04 83 10 31 00 34
E: 1.393890 6 04 83 a0 31 90 34
E: 1.403890 6 04 83 30 32 30 35
E: 1.413889 6 04 83 a0 32 b0 35
E: 1.423889 6 04 83 10 33 30 36
E: 1.433889 6 04 83 60 33 90 36
E: 1.443890 6 04 83 a0 33 e0 36
E: 1.453889 6 04 83 10 34 50 37
E: 1.463890 6 04 83 a0 34 c0 37
E: 1.474891 6 04 83 10 35 20 38
E: 1.484889 6 04 83 90 35 90 38
E: 1.495890 6 04 83 20 36 10 39
E: 1.505889 6 04 83 90 36 70 39
E: 1.515889 6 04 83 e0 36 c0 39
E: 1.525890 6 04 83 40 37 30 3a
E: 1.535890 6 04 83 b0 37 c0 3a
E: 1.545889 6 04 83 20 38 60 3b
E: 1.555889 6 04 83 80 38 d0 3b
E: 1.565889 6 04 83 f0 38 50 3c
E: 1.575890 6 04 83 80 39 e0 3c
E: 1.585889 6 04 83 f0 39 40 3d
E: 1.595889 6 04 83 70 3a b0 3d
E: 1.605889 6 04 83 d0 3a 00 3e
E: 1.615880 6 04 83 40 3b 70 3e
E: 1.625889 6 04 83 90 3b c0 3e
E: 1.635889 6 04 83 00 3c 30 3f
E: 1.646889 6 04 83 50 3c 90 3f
E: 1.656888 6 04 83 d0 3c 00 40
E: 1.666889 6 04 83 70 3d a0 40
E: 1.676890 6 04 83 10 3e 50 41
E: 1.686888 6 04 83 b0 3e 00 42
E: 1.696890 6 04 83 30 3f 80 42
E: 1.706889 6 04 83 b0 3f 10 43
E: 1.716889 6 04 83 40 40 a0 43
E: 1.726889 6 04 83 a0 40 10 44
E: 1.736889 6 04 83 20 41 90 44
E: 1.747889 6 04 83 b0 41 20 45
E: 1.757889 6 04 83 60 42 c0 45
E: 1.767890 6 04 83 10 43 70 46
E: 1.777890 6 04 83 c0 43 30 47
E: 1.787889 6 04 83 70 44 f0 47
E: 1.797889 6 04 83 40 45 a0 48
E: 1.807889 6 04 83 10 46 50 49
E: 1.818885 6 04 83 b0 46 d0 49
E: 1.828889 6 04 83 60 47 60 4a
E: 1.838888 6 04 83 20 48 00 4b
E: 1.848889 6 04 83 b0 48 80 4b
E: 1.858889 6 04 83 50 49 10 4c
E: 1.868889 6 04 83 00 4a c0 4c
E: 1.878890 6 04 83 c0 4a 70 4d
E: 1.888889 6 04 83 80 4b 30 4e
E: 1.898889 6 04 83 10 4c c0 4e
E: 1.908889 6 04 83 80 4c 20 4f
E: 1.918890 6 04 83 00 4d a0 4f
E: 1.928887 6 04 83 60 4d 00 50
E: 1.938889 6 04 83 e0 4d 70 50
E: 1.948889 6 04 83 40 4e c0 50
E: 1.958889 6 04 83 b0 4e 30 51
E: 1.968889 6 04 83 40 4f c0 51
E: 1.978890 6 04 83 e0 4f 50 52
E: 1.989890 6 04 83 50 50 c0 52
E: 1.999892 6 04 83 e0 50 40 53
E: 2.010887 6 04 83 40 51 a0 53
E: 2.020885 6 04 83 c0 51 20 54
E: 2.030889 6 04 83 20 52 80 54
E: 2.040890 6 04 83 60 52 d0 54
E: 2.050890 6 04 83 c0 52 40 55
E: 2.060889 6 04 83 00 53 90 55
E: 2.070887 6 04 83 30 53 d0 55
E: 2.080890 6 04 83 80 53 30 56
E: 2.090891 6 04 83 c0 53 70 56
E: 2.100889 6 04 83 10 54 d0 56
E: 2.110890 6 04 83 80 54 30 57
E: 2.120887 6 04 83 e0 54 80 57
E: 2.130890 6 04 83 20 55 b0 57
E: 2.140888 6 04 83 80 55 00 58
E: 2.150890 6 04 83 d0 55 40 58
E: 2.161889 6 04 83 30 56 a0 58
E: 2.171887 6 04 83 80 56 e0 58
E: 2.181887 6 04 83 c0 56 10 59
E: 2.191890 6 04 83 f0 56 30 59
E: 2.201890 6 04 83 40 57 90 59
E: 2.211889 6 04 83 a0 57 10 5a
E: 2.221885 6 04 83 e0 57 70 5a
E: 2.231889 6 04 83 10 58 b0 5a
E: 2.241889 6 04 83 30 58 e0 5a
E: 2.252891 6 04 83 70 58 40 5b
E: 2.262889 6 04 83 a0 58 80 5b
E: 2.272888 6 04 83 00 59 e0 5b
E: 2.282891 6 04 83 50 59 20 5c
E: 2.292890 6 04 83 c0 59 70 5c
E: 2.302890 6 04 83 10 5a b0 5c
E: 2.312890 6 04 83 50 5a e0 5c
E: 2.322888 6 04 83 80 5a 00 5d
E: 2.333890 6 04 83 d0 5a 40 5d
E: 2.343890 6 04 83 10 5b 70 5d
E: 2.353889 6 04 83 40 5b 90 5d
E: 2.363890 6 04 83 a0 5b e0 5d
E: 2.373887 6 04 83 10 5c 50 5e
E: 2.383890 6 04 83 60 5c a0 5e
E: 2.393889 6 04 83 d0 5c 10 5f
E: 2.403889 6 04 83 60 5d 90 5f
E: 2.413889 6 04 83 f0 5d 20 60
E: 2.423888 6 04 83 60 5e 90 60
E: 2.433888 6 04 83 b0 5e e0 60
E: 2.443889 6 04 83 f0 5e 20 61
E: 2.453889 6 04 83 50 5f 80 61
E: 2.463889 6 04 83 90 5f c0 61
E: 2.473887 6 04 83 c0 5f f0 61
E: 2.483890 6 04 83 f0 5f 10 62
E: 2.493889 6 04 83 10 60 30 62
E: 2.503890 6 04 83 50 60 70 62
E: 2.515889 6 04 83 80 60 a0 62
E: 2.525889 6 04 83 b0 60 c0 62
E: 2.535889 6 04 83 00 61 10 63
E: 2.545889 6 04 83 30 61 40 63
E: 2.555890 6 04 83 90 61 90 63
E: 2.565889 6 04 83 10 62 f0 63
E: 2.575891 6 04 83 70 62 30 64
E: 2.585889 6 04 83 f0 62 90 64
E: 2.595890 6 04 83 50 63 e0 64
E: 2.605890 6 04 83 90 63 10 65
E: 2.615890 6 04 83 f0 63 70 65
E: 2.625887 6 04 83 60 64 f0 65
E: 2.635891 6 04 83 b0 64 50 66
E: 2.645889 6 04 83 f0 64 a0 66
E: 2.655890 6 04 83 20 65 d0 66
E: 2.665889 6 04 83 70 65 30 67
E: 2.675891 6 04 83 a0 65 70 67
E: 2.686889 6 04 83 d0 65 a0 67
E: 2.696889 6 04 83 f0 65 d0 67
E: 2.706890 6 04 83 40 66 20 68
E: 2.716890 6 04 83 70 66 60 68
E: 2.726889 6 04 83 d0 66 b0 68
E: 2.736889 6 04 83 20 67 f0 68
E: 2.746889 6 04 83 50 67 20 69
E: 2.756889 6 04 83 b0 67 60 69
E: 2.767889 6 04 83 f0 67 90 69
E: 2.777890 6 04 83 20 68 c0 69
E: 2.787889 6 04 83 50 68 e0 69
E: 2.797889 6 04 83 70 68 f0 69
E: 2.807881 6 04 83 70 68 f0 69
E: 2.817889 6 04 83 c0 68 40 6a
E: 2.827889 6 04 83 f0 68 70 6a
E: 2.837889 6 04 83 40 69 b0 6a
E: 2.847889 6 04 83 80 69 e0 6a
E: 2.857889 6 04 83 b0 69 10 6b
E: 2.868890 6 04 83 d0 69 30 6b
E: 2.878882 6 04 83 d0 69 30 6b
E: 2.888889 6 04 83 f0 69 50 6b
E: 2.898891 6 04 83 30 6a 90 6b
E: 2.908889 6 04 83 60 6a c0 6b
E: 2.918889 6 04 83 a0 6a 20 6c
E: 2.928889 6 04 83 d0 6a 60 6c
E: 2.938890 6 04 83 f0 6a 90 6c
E: 2.948889 6 04 83 30 6b f0 6c
E: 2.958889 6 04 83 60 6b 30 6d
E: 2.968889 6 04 83 80 6b 60 6d
E: 2.978891 6 04 83 a0 6b 80 6d
E: 2.988889 6 04 83 b0 6b a0 6d
E: 2.998889 6 04 83 f0 6b e0 6d
E: 3.008890 6 04 83 20 6c 10 6e
E: 3.019883 6 04 83 40 6c 30 6e
E: 3.029888 6 04 83 60 6c 50 6e
E: 3.040880 6 04 83 60 6c 50 6e
E: 3.050887 6 04 83 80 6c 70 6e
E: 3.060880 6 04 83 80 6c 70 6e
E: 3.070886 6 04 83 d0 6c b0 6e
E: 3.080889 6 04 83 00 6d d0 6e
E: 3.090887 6 04 83 20 6d e0 6e
E: 3.100880 6 04 83 20 6d e0 6e
E: 3.110887 6 04 83 40 6d 00 6f
E: 3.120879 6 04 83 40 6d 00 6f
E: 3.130887 6 04 83 60 6d 10 6f
E: 3.140880 6 04 83 60 6d 10 6f
E: 3.150877 6 04 83 60 6d 10 6f
E: 3.160881 6 04 83 60 6d 10 6f
E: 3.170888 6 04 83 60 6d 10 6f
E: 3.180883 6 04 83 60 6d 10 6f
E: 3.190882 6 04 83 60 6d 10 6f
E: 3.200882 6 04 83 60 6d 10 6f
E: 3.210889 6 04 83 a0 6d 40 6f
E: 3.220886 6 04 83 d0 6d 60 6f
E: 3.231889 6 04 83 f0 6d 70 6f
E: 3.241881 6 04 83 f0 6d 70 6f
E: 3.251890 6 04 83 10 6e 90 6f
E: 3.261881 6 04 83 10 6e 90 6f
E: 3.272886 6 04 83 30 6e a0 6f
E: 3.282882 6 04 83 30 6e a0 6f
E: 3.292881 6 04 83 30 6e a0 6f
E: 3.302881 6 04 83 30 6e a0 6f
E: 3.312881 6 04 83 30 6e a0 6f
E: 3.322880 6 04 83 30 6e a0 6f
E: 3.332882 6 04 83 30 6e a0 6f
E: 3.342882 6 04 83 30 6e a0 6f
E: 3.352881 6 04 83 30 6e a0 6f
E: 3.362881 6 04 83 30 6e a0 6f
E: 3.372879 6 04 83 30 6e a0 6f
E: 3.382882 6 04 83 30 6e a0 6f
E: 3.392881 6 04 83 30 6e a0 6f
E: 3.402881 6 04 83 30 6e a0 6f
E: 3.413882 6 04 83 30 6e a0 6f
E: 3.423880 6 04 83 30 6e a0 6f
E: 3.433881 6 04 83 30 6e a0 6f
E: 3.443881 6 04 83 30 6e a0 6f
E: 3.453881 6 04 83 30 6e a0 6f
E: 3.463881 6 04 83 30 6e a0 6f
E: 3.473879 6 04 83 30 6e a0 6f
E: 3.483882 6 04 83 30 6e a0 6f
E: 3.493882 6 04 83 30 6e a0 6f
E: 3.503889 6 04 83 70 6e c0 6f
E: 3.513889 6 04 83 a0 6e e0 6f
E: 3.523889 6 04 83 c0 6e f0 6f
E: 3.534888 6 04 83 e0 6e 00 70
E: 3.544881 6 04 83 e0 6e 00 70
E: 3.554889 6 04 83 00 6f 20 70
E: 3.564881 6 04 83 00 6f 20 70
E: 3.574883 6 04 83 00 6f 20 70
E: 3.584881 6 04 83 00 6f 20 70
E: 3.595881 6 04 83 00 6f 20 70
E: 3.605881 6 04 83 00 6f 20 70
E: 3.615881 6 04 83 00 6f 20 70
E: 3.625880 6 04 83 00 6f 20 70
E: 3.635881 6 04 83 00 6f 20 70
E: 3.645880 6 04 83 00 6f 20 70
E: 3.655882 6 04 83 00 6f 20 70
E: 3.665881 6 04 83 00 6f 20 70
E: 3.675883 6 04 83 00 6f 20 70
E: 3.685881 6 04 83 00 6f 20 70
E: 3.695881 6 04 83 00 6f 20 70
E: 3.705881 6 04 83 00 6f 20 70
E: 3.715882 6 04 83 00 6f 20 70
E: 3.725879 6 04 83 00 6f 20 70
E: 3.735882 6 04 83 00 6f 20 70
E: 3.745881 6 04 83 00 6f 20 70
E: 3.755882 6 04 83 00 6f 20 70
E: 3.765882 6 04 83 00 6f 20 70
E: 3.776882 6 04 83 00 6f 20 70
E: 3.787882 6 04 83 00 6f 20 70
E: 3.797882 6 04 83 00 6f 20 70
E: 3.807889 6 04 83 60 6f 40 70
E: 3.866889 6 04 83 c0 70 90 70
E: 3.868877 6 04 82 c0 70 90 70
# 2. Land one finger,
   - land a second finger far enough from the first
   - move your two fingers
   - release the *first* finger
   - release the second finger
E: 12.725909 6 04 83 e0 25 e0 32
E: 12.735884 6 04 83 e0 25 e0 32
E: 12.745883 6 04 83 e0 25 e0 32
E: 12.755883 6 04 83 e0 25 e0 32
E: 12.765883 6 04 83 e0 25 e0 32
E: 12.775884 6 04 83 e0 25 e0 32
E: 12.785882 6 04 83 e0 25 e0 32
E: 12.795883 6 04 83 e0 25 e0 32
E: 12.805883 6 04 83 e0 25 e0 32
E: 12.815883 6 04 83 e0 25 e0 32
E: 12.825883 6 04 83 e0 25 e0 32
E: 12.835884 6 04 83 e0 25 e0 32
E: 12.845883 6 04 83 e0 25 e0 32
E: 12.856883 6 04 83 e0 25 e0 32
E: 12.866883 6 04 83 e0 25 e0 32
E: 12.876884 6 04 83 e0 25 e0 32
E: 12.886883 6 04 83 e0 25 e0 32
E: 12.896883 6 04 83 e0 25 e0 32
E: 12.906882 6 04 83 e0 25 e0 32
E: 12.916883 6 04 83 e0 25 e0 32
E: 12.926883 6 04 83 e0 25 e0 32
E: 12.936883 6 04 83 e0 25 e0 32
E: 12.946882 6 04 83 e0 25 e0 32
E: 12.957883 6 04 83 e0 25 e0 32
E: 12.967882 6 04 83 e0 25 e0 32
E: 12.977883 6 04 83 e0 25 e0 32
E: 12.987883 6 04 83 e0 25 e0 32
E: 12.997882 6 04 83 e0 25 e0 32
E: 13.007883 6 04 83 e0 25 e0 32
E: 13.018878 6 04 83 e0 25 e0 32
E: 13.028881 6 04 83 e0 25 e0 32
E: 13.038881 6 04 83 e0 25 e0 32
E: 13.048882 6 04 83 e0 25 e0 32
E: 13.058881 6 04 83 e0 25 e0 32
E: 13.068886 6 04 83 e0 25 c0 32
E: 13.078883 6 04 83 e0 25 c0 32
E: 13.088881 6 04 83 e0 25 c0 32
E: 13.098882 6 04 83 e0 25 c0 32
E: 13.108884 6 04 83 e0 25 c0 32
E: 13.118881 6 04 83 e0 25 c0 32
E: 13.128882 6 04 83 e0 25 c0 32
E: 13.138881 6 04 83 e0 25 c0 32
E: 13.148882 6 04 83 e0 25 c0 32
E: 13.158891 6 04 83 e0 25 c0 32
E: 13.168883 6 04 83 e0 25 c0 32
E: 13.179884 6 04 83 e0 25 c0 32
E: 13.189883 6 04 83 e0 25 c0 32
E: 13.199883 6 04 83 e0 25 c0 32
E: 13.209882 6 04 83 e0 25 c0 32
E: 13.220880 6 04 83 e0 25 c0 32
E: 13.230883 6 04 83 e0 25 c0 32
E: 13.240883 6 04 83 e0 25 c0 32
E: 13.250882 6 04 83 e0 25 c0 32
E: 13.260883 6 04 83 e0 25 c0 32
E: 13.270880 6 04 83 e0 25 c0 32
E: 13.280884 6 04 83 e0 25 c0 32
E: 13.290882 6 04 83 e0 25 c0 32
E: 13.300882 6 04 83 e0 25 c0 32
E: 13.310883 6 04 83 e0 25 c0 32
E: 13.320882 6 04 83 e0 25 c0 32
E: 13.330882 6 04 83 e0 25 c0 32
E: 13.341883 6 04 83 e0 25 c0 32
E: 13.351883 6 04 83 e0 25 c0 32
E: 13.361882 6 04 83 e0 25 c0 32
E: 13.371881 6 04 83 e0 25 c0 32
E: 13.381884 6 04 83 e0 25 c0 32
E: 13.391883 6 04 83 e0 25 c0 32
E: 13.401882 6 04 83 e0 25 c0 32
E: 13.411883 6 04 83 e0 25 c0 32
E: 13.421879 6 04 83 e0 25 c0 32
E: 13.431882 6 04 83 e0 25 c0 32
E: 13.441882 6 04 83 e0 25 c0 32
E: 13.451889 6 04 83 00 26 c0 32
E: 13.461883 6 04 83 00 26 c0 32
E: 13.471881 6 04 83 00 26 c0 32
E: 13.482883 6 04 83 00 26 c0 32
E: 13.492883 6 04 83 00 26 c0 32
E: 13.503882 6 04 83 00 26 c0 32
E: 13.513882 6 04 83 00 26 c0 32
E: 13.523883 6 04 83 00 26 c0 32
E: 13.533883 6 04 83 00 26 c0 32
E: 13.543882 6 04 83 00 26 c0 32
E: 13.553882 6 04 83 00 26 c0 32
E: 13.563883 6 04 83 00 26 c0 32
E: 13.573881 6 04 83 00 26 c0 32
E: 13.583883 6 04 83 00 26 c0 32
E: 13.593883 6 04 83 00 26 c0 32
E: 13.603883 6 04 83 00 26 c0 32
E: 13.613883 6 04 83 00 26 c0 32
E: 13.623882 6 04 83 00 26 c0 32
E: 13.633882 6 04 83 00 26 c0 32
E: 13.643883 6 04 83 00 26 c0 32
E: 13.653883 6 04 83 00 26 c0 32
E: 13.663883 6 04 83 00 26 c0 32
E: 13.674884 6 04 83 00 26 c0 32
E: 13.684883 6 04 83 00 26 c0 32
E: 13.694882 6 04 83 00 26 c0 32
E: 13.704884 6 04 83 00 26 c0 32
E: 13.714883 6 04 83 00 26 c0 32
E: 13.725884 6 04 83 00 26 c0 32
E: 13.735884 6 04 83 00 26 c0 32
E: 13.745883 6 04 83 00 26 c0 32
E: 13.755883 6 04 83 00 26 c0 32
E: 13.765882 6 04 83 00 26 c0 32
E: 13.775883 6 04 83 00 26 c0 32
E: 13.785882 6 04 83 00 26 c0 32
E: 13.795883 6 04 83 00 26 c0 32
E: 13.805882 6 04 83 00 26 c0 32
E: 13.815883 6 04 83 00 26 c0 32
E: 13.825882 6 04 83 00 26 c0 32
E: 13.836882 6 04 83 00 26 c0 32
E: 13.846882 6 04 83 00 26 c0 32
E: 13.856883 6 04 83 00 26 c0 32
E: 13.866883 6 04 83 00 26 c0 32
E: 13.876883 6 04 83 00 26 c0 32
E: 13.886882 6 04 83 00 26 c0 32
E: 13.896883 6 04 83 00 26 c0 32
E: 13.906883 6 04 83 00 26 c0 32
E: 13.916882 6 04 83 00 26 c0 32
E: 13.926882 6 04 83 00 26 c0 32
E: 13.936883 6 04 83 00 26 c0 32
E: 13.946883 6 04 83 00 26 c0 32
E: 13.956882 6 04 83 00 26 c0 32
E: 13.966882 6 04 83 00 26 c0 32
E: 13.977884 6 04 83 00 26 c0 32
E: 13.988883 6 04 83 00 26 c0 32
E: 13.998882 6 04 83 00 26 c0 32
E: 14.008883 6 04 83 00 26 c0 32
E: 14.018879 6 04 83 00 26 c0 32
E: 14.028882 6 04 83 00 26 c0 32
E: 14.038883 6 04 83 00 26 c0 32
E: 14.048883 6 04 83 00 26 c0 32
E: 14.058883 6 04 83 00 26 c0 32
E: 14.068883 6 04 83 00 26 c0 32
E: 14.078883 6 04 83 00 26 c0 32
E: 14.088883 6 04 83 00 26 c0 32
E: 14.098883 6 04 83 00 26 c0 32
E: 14.108882 6 04 83 00 26 c0 32
E: 14.118882 6 04 83 00 26 c0 32
E: 14.128883 6 04 83 00 26 c0 32
E: 14.138882 6 04 83 00 26 c0 32
E: 14.148881 6 04 83 00 26 c0 32
E: 14.159883 6 04 83 00 26 c0 32
E: 14.169883 6 04 83 00 26 c0 32
E: 14.179884 6 04 83 00 26 c0 32
E: 14.189883 6 04 83 00 26 c0 32
E: 14.199883 6 04 83 00 26 c0 32
E: 14.209883 6 04 83 00 26 c0 32
E: 14.219878 6 04 83 00 26 c0 32
E: 14.229883 6 04 83 00 26 c0 32
E: 14.239883 6 04 83 00 26 c0 32
E: 14.250882 6 04 83 00 26 c0 32
E: 14.260882 6 04 83 00 26 c0 32
E: 14.270880 6 04 83 00 26 c0 32
E: 14.280883 6 04 83 00 26 c0 32
E: 14.290882 6 04 83 00 26 c0 32
E: 14.300883 6 04 83 00 26 c0 32
E: 14.311883 6 04 83 00 26 c0 32
E: 14.321882 6 04 83 00 26 c0 32
E: 14.331883 6 04 83 00 26 c0 32
E: 14.341883 6 04 83 00 26 c0 32
E: 14.351883 6 04 83 00 26 c0 32
E: 14.361883 6 04 83 00 26 c0 32
E: 14.371882 6 04 83 00 26 c0 32
E: 14.381884 6 04 83 00 26 c0 32
E: 14.391883 6 04 83 00 26 c0 32
E: 14.401882 6 04 83 00 26 c0 32
E: 14.411882 6 04 83 00 26 c0 32
E: 14.421879 6 04 83 00 26 c0 32
E: 14.431883 6 04 83 00 26 c0 32
E: 14.441882 6 04 83 00 26 c0 32
E: 14.451882 6 04 83 00 26 c0 32
E: 14.461883 6 04 83 00 26 c0 32
E: 14.471880 6 04 83 00 26 c0 32
E: 14.482883 6 04 83 00 26 c0 32
E: 14.493883 6 04 83 00 26 c0 32
E: 14.503882 6 04 83 00 26 c0 32
E: 14.513887 6 04 83 30 26 c0 32
E: 14.523891 6 04 83 60 26 d0 32
E: 14.533888 6 04 83 80 26 d0 32
E: 14.543883 6 04 83 80 26 d0 32
E: 14.556889 6 04 83 b0 26 d0 32
E: 14.569889 6 04 83 d0 26 d0 32
E: 14.582884 6 04 83 d0 26 d0 32
E: 14.584893 6 04 87 60 4e f0 3b
E: 14.595894 6 04 83 f0 26 d0 32
E: 14.597884 6 04 87 60 4e f0 3b
E: 14.608888 6 04 87 60 4e f0 3b
E: 14.610886 6 04 83 f0 26 d0 32
E: 14.621884 6 04 83 f0 26 d0 32
E: 14.623887 6 04 87 60 4e f0 3b
E: 14.634888 6 04 87 60 4e f0 3b
E: 14.636884 6 04 83 f0 26 d0 32
E: 14.647888 6 04 83 f0 26 d0 32
E: 14.649884 6 04 87 60 4e f0 3b
E: 14.660888 6 04 87 60 4e f0 3b
E: 14.662886 6 04 83 f0 26 d0 32
E: 14.673886 6 04 83 f0 26 d0 32
E: 14.675888 6 04 87 60 4e f0 3b
E: 14.686888 6 04 87 60 4e f0 3b
E: 14.688884 6 04 83 f0 26 d0 32
E: 14.699893 6 04 83 10 27 d0 32
E: 14.701884 6 04 87 60 4e f0 3b
E: 14.712888 6 04 87 60 4e f0 3b
E: 14.714886 6 04 83 10 27 d0 32
E: 14.725888 6 04 83 10 27 d0 32
E: 14.727887 6 04 87 60 4e f0 3b
E: 14.740888 6 04 87 60 4e f0 3b
E: 14.742886 6 04 83 10 27 d0 32
E: 14.753888 6 04 83 10 27 d0 32
E: 14.755887 6 04 87 60 4e f0 3b
E: 14.766888 6 04 87 60 4e f0 3b
E: 14.768884 6 04 83 10 27 d0 32
E: 14.779889 6 04 83 10 27 d0 32
E: 14.781884 6 04 87 60 4e f0 3b
E: 14.792888 6 04 87 60 4e f0 3b
E: 14.794886 6 04 83 10 27 d0 32
E: 14.805889 6 04 83 10 27 d0 32
E: 14.807887 6 04 87 60 4e f0 3b
E: 14.818885 6 04 87 60 4e f0 3b
E: 14.820884 6 04 83 10 27 d0 32
E: 14.831888 6 04 83 10 27 d0 32
E: 14.833884 6 04 87 60 4e f0 3b
E: 14.844888 6 04 87 60 4e f0 3b
E: 14.846886 6 04 83 10 27 d0 32
E: 14.857889 6 04 83 10 27 d0 32
E: 14.859888 6 04 87 60 4e f0 3b
E: 14.870887 6 04 87 60 4e f0 3b
E: 14.872884 6 04 83 10 27 d0 32
E: 14.883888 6 04 83 10 27 d0 32
E: 14.885884 6 04 87 60 4e f0 3b
E: 14.896888 6 04 87 60 4e f0 3b
E: 14.898886 6 04 83 10 27 d0 32
E: 14.909888 6 04 83 10 27 d0 32
E: 14.911887 6 04 87 60 4e f0 3b
E: 14.922888 6 04 87 60 4e f0 3b
E: 14.924884 6 04 83 10 27 d0 32
E: 14.935887 6 04 83 10 27 d0 32
E: 14.937885 6 04 87 60 4e f0 3b
E: 14.948888 6 04 87 60 4e f0 3b
E: 14.950886 6 04 83 10 27 d0 32
E: 14.961888 6 04 83 10 27 d0 32
E: 14.963887 6 04 87 60 4e f0 3b
E: 14.974888 6 04 87 60 4e f0 3b
E: 14.976885 6 04 83 10 27 d0 32
E: 14.987888 6 04 83 10 27 d0 32
E: 14.989884 6 04 87 60 4e f0 3b
E: 15.001888 6 04 87 60 4e f0 3b
E: 15.003887 6 04 83 10 27 d0 32
E: 15.014888 6 04 83 10 27 d0 32
E: 15.016880 6 04 87 60 4e f0 3b
E: 15.028888 6 04 87 60 4e f0 3b
E: 15.030886 6 04 83 10 27 d0 32
E: 15.041889 6 04 83 10 27 d0 32
E: 15.043887 6 04 87 60 4e f0 3b
E: 15.054887 6 04 87 60 4e f0 3b
E: 15.056884 6 04 83 10 27 d0 32
E: 15.067888 6 04 83 10 27 d0 32
E: 15.069884 6 04 87 60 4e f0 3b
E: 15.080889 6 04 87 60 4e f0 3b
E: 15.082886 6 04 83 10 27 d0 32
E: 15.093887 6 04 83 10 27 d0 32
E: 15.095888 6 04 87 60 4e f0 3b
E: 15.106888 6 04 87 60 4e f0 3b
E: 15.108884 6 04 83 10 27 d0 32
E: 15.119888 6 04 83 10 27 d0 32
E: 15.121884 6 04 87 60 4e f0 3b
E: 15.132888 6 04 87 60 4e f0 3b
E: 15.134886 6 04 83 10 27 d0 32
E: 15.145888 6 04 83 10 27 d0 32
E: 15.147884 6 04 87 60 4e f0 3b
E: 15.158890 6 04 87 60 4e f0 3b
E: 15.160884 6 04 83 10 27 d0 32
E: 15.171885 6 04 83 10 27 d0 32
E: 15.173884 6 04 87 60 4e f0 3b
E: 15.184889 6 04 87 60 4e f0 3b
E: 15.186886 6 04 83 10 27 d0 32
E: 15.197889 6 04 83 10 27 d0 32
E: 15.199887 6 04 87 60 4e f0 3b
E: 15.210887 6 04 87 60 4e f0 3b
E: 15.212884 6 04 83 10 27 d0 32
E: 15.223887 6 04 83 10 27 d0 32
E: 15.225884 6 04 87 60 4e f0 3b
E: 15.236887 6 04 87 60 4e f0 3b
E: 15.238886 6 04 83 10 27 d0 32
E: 15.250888 6 04 83 10 27 d0 32
E: 15.252884 6 04 87 60 4e f0 3b
E: 15.263888 6 04 87 60 4e f0 3b
E: 15.265884 6 04 83 10 27 d0 32
E: 15.276889 6 04 83 10 27 d0 32
E: 15.278886 6 04 87 60 4e f0 3b
E: 15.289889 6 04 87 60 4e f0 3b
E: 15.291887 6 04 83 10 27 d0 32
E: 15.303888 6 04 83 10 27 d0 32
E: 15.305884 6 04 87 60 4e f0 3b
E: 15.316888 6 04 87 60 4e f0 3b
E: 15.318886 6 04 83 10 27 d0 32
E: 15.329888 6 04 83 10 27 d0 32
E: 15.331887 6 04 87 60 4e f0 3b
E: 15.342888 6 04 87 60 4e f0 3b
E: 15.344885 6 04 83 10 27 d0 32
E: 15.355888 6 04 83 10 27 d0 32
E: 15.357884 6 04 87 60 4e f0 3b
E: 15.368888 6 04 87 60 4e f0 3b
E: 15.370885 6 04 83 10 27 d0 32
E: 15.381888 6 04 83 10 27 d0 32
E: 15.383887 6 04 87 60 4e f0 3b
E: 15.394888 6 04 87 60 4e f0 3b
E: 15.396884 6 04 83 10 27 d0 32
E: 15.407887 6 04 83 10 27 d0 32
E: 15.409884 6 04 87 60 4e f0 3b
E: 15.420883 6 04 87 60 4e f0 3b
E: 15.422888 6 04 83 10 27 d0 32
E: 15.433888 6 04 83 10 27 d0 32
E: 15.435887 6 04 87 60 4e f0 3b
E: 15.446887 6 04 87 60 4e f0 3b
E: 15.448884 6 04 83 10 27 d0 32
E: 15.459893 6 04 83 30 27 d0 32
E: 15.461885 6 04 87 60 4e f0 3b
E: 15.472885 6 04 87 60 4e f0 3b
E: 15.474889 6 04 83 30 27 d0 32
E: 15.485888 6 04 83 30 27 d0 32
E: 15.487893 6 04 87 40 4e f0 3b
E: 15.498892 6 04 87 10 4e f0 3b
E: 15.500885 6 04 83 30 27 d0 32
E: 15.512895 6 04 83 50 27 d0 32
E: 15.514891 6 04 87 e0 4d f0 3b
E: 15.525892 6 04 87 b0 4d f0 3b
E: 15.527898 6 04 83 60 27 a0 32
E: 15.538896 6 04 83 70 27 40 32
E: 15.540891 6 04 87 80 4d 10 3c
E: 15.552888 6 04 87 80 4d 10 3c
E: 15.554893 6 04 83 70 27 e0 31
E: 15.565894 6 04 83 70 27 70 31
E: 15.567893 6 04 87 60 4d 10 3c
E: 15.579894 6 04 87 40 4d 50 3c
E: 15.581891 6 04 83 70 27 20 31
E: 15.593893 6 04 83 70 27 e0 30
E: 15.595894 6 04 87 20 4d 80 3c
E: 15.607894 6 04 87 10 4d a0 3c
E: 15.609891 6 04 83 70 27 b0 30
E: 15.622892 6 04 83 70 27 80 30
E: 15.624891 6 04 87 f0 4c d0 3c
E: 15.636893 6 04 87 e0 4c 10 3d
E: 15.638892 6 04 83 70 27 60 30
E: 15.650893 6 04 83 70 27 40 30
E: 15.652891 6 04 87 d0 4c 60 3d
E: 15.665893 6 04 87 c0 4c b0 3d
E: 15.667897 6 04 83 80 27 10 30
E: 15.679895 6 04 83 80 27 d0 2f
E: 15.681890 6 04 87 b0 4c 00 3e
E: 15.693894 6 04 87 a0 4c 60 3e
E: 15.695894 6 04 83 80 27 a0 2f
E: 15.708894 6 04 83 80 27 70 2f
E: 15.710894 6 04 87 90 4c c0 3e
E: 15.722895 6 04 87 70 4c 20 3f
E: 15.724892 6 04 83 80 27 50 2f
E: 15.736889 6 04 83 80 27 50 2f
E: 15.738894 6 04 87 50 4c 80 3f
E: 15.751893 6 04 87 40 4c e0 3f
E: 15.753891 6 04 83 80 27 30 2f
E: 15.766895 6 04 83 90 27 00 2f
E: 15.768889 6 04 87 20 4c 60 40
E: 15.781893 6 04 87 10 4c 00 41
E: 15.783897 6 04 83 a0 27 e0 2e
E: 15.795895 6 04 83 b0 27 c0 2e
E: 15.797891 6 04 87 00 4c a0 41
E: 15.810894 6 04 87 e0 4b 40 42
E: 15.812884 6 04 83 b0 27 c0 2e
E: 15.825893 6 04 83 b0 27 a0 2e
E: 15.827894 6 04 87 c0 4b d0 42
E: 15.839893 6 04 87 a0 4b 60 43
E: 15.841885 6 04 83 b0 27 a0 2e
E: 15.854899 6 04 83 d0 27 70 2e
E: 15.856891 6 04 87 90 4b e0 43
E: 15.869893 6 04 87 80 4b 30 44
E: 15.871895 6 04 83 10 28 50 2e
E: 15.884897 6 04 83 40 28 40 2e
E: 15.886893 6 04 87 70 4b 80 44
E: 15.898894 6 04 87 60 4b c0 44
E: 15.900894 6 04 83 60 28 30 2e
E: 15.913896 6 04 83 80 28 20 2e
E: 15.915894 6 04 87 50 4b 20 45
E: 15.928893 6 04 87 40 4b 50 45
E: 15.930886 6 04 83 80 28 20 2e
E: 15.942896 6 04 83 c0 28 00 2e
E: 15.944890 6 04 87 30 4b a0 45
E: 15.957892 6 04 87 20 4b d0 45
E: 15.959897 6 04 83 e0 28 f0 2d
E: 15.972894 6 04 83 00 29 e0 2d
E: 15.974894 6 04 87 10 4b 00 46
E: 15.987893 6 04 87 00 4b 20 46
E: 15.989884 6 04 83 00 29 e0 2d
E: 16.001898 6 04 83 20 29 d0 2d
E: 16.003893 6 04 87 00 4b 40 46
E: 16.017888 6 04 87 00 4b 40 46
E: 16.019893 6 04 83 40 29 b0 2d
E: 16.032897 6 04 83 60 29 a0 2d
E: 16.034891 6 04 87 00 4b 60 46
E: 16.047893 6 04 87 f0 4a 80 46
E: 16.049884 6 04 83 60 29 a0 2d
E: 16.061898 6 04 83 80 29 80 2d
E: 16.063894 6 04 87 e0 4a a0 46
E: 16.076889 6 04 87 e0 4a a0 46
E: 16.078886 6 04 83 80 29 80 2d
E: 16.091898 6 04 83 b0 29 60 2d
E: 16.093891 6 04 87 d0 4a c0 46
E: 16.105888 6 04 87 d0 4a c0 46
E: 16.107897 6 04 83 d0 29 30 2d
E: 16.120896 6 04 83 f0 29 10 2d
E: 16.122892 6 04 87 d0 4a e0 46
E: 16.135888 6 04 87 d0 4a e0 46
E: 16.137894 6 04 83 00 2a f0 2c
E: 16.150888 6 04 83 00 2a f0 2c
E: 16.152884 6 04 87 d0 4a e0 46
E: 16.166888 6 04 87 d0 4a e0 46
E: 16.168892 6 04 83 30 2a a0 2c
E: 16.181897 6 04 83 50 2a 40 2c
E: 16.183888 6 04 87 d0 4a e0 46
E: 16.196895 6 04 87 c0 4a 00 47
E: 16.198895 6 04 83 80 2a d0 2b
E: 16.211893 6 04 83 a0 2a 80 2b
E: 16.213891 6 04 87 b0 4a 20 47
E: 16.226893 6 04 87 a0 4a 60 47
E: 16.228894 6 04 83 b0 2a 40 2b
E: 16.242896 6 04 83 d0 2a f0 2a
E: 16.244891 6 04 87 80 4a c0 47
E: 16.257893 6 04 87 60 4a 30 48
E: 16.259897 6 04 83 e0 2a b0 2a
E: 16.274895 6 04 83 f0 2a 80 2a
E: 16.276889 6 04 87 40 4a b0 48
E: 16.289891 6 04 87 00 4a 30 49
E: 16.291895 6 04 83 00 2b 60 2a
E: 16.305895 6 04 83 10 2b 20 2a
E: 16.307894 6 04 87 b0 49 a0 49
E: 16.320892 6 04 87 80 49 f0 49
E: 16.322896 6 04 83 20 2b f0 29
E: 16.336896 6 04 83 30 2b d0 29
E: 16.338892 6 04 87 30 49 40 4a
E: 16.351893 6 04 87 00 49 80 4a
E: 16.353893 6 04 83 40 2b b0 29
E: 16.367895 6 04 83 50 2b 80 29
E: 16.369891 6 04 87 c0 48 c0 4a
E: 16.382894 6 04 87 90 48 f0 4a
E: 16.384893 6 04 83 60 2b 60 29
E: 16.398896 6 04 83 70 2b 40 29
E: 16.400891 6 04 87 50 48 30 4b
E: 16.414893 6 04 87 00 48 80 4b
E: 16.416879 6 04 83 70 2b 40 29
E: 16.429897 6 04 83 80 2b 20 29
E: 16.431893 6 04 87 d0 47 c0 4b
E: 16.445892 6 04 87 90 47 10 4c
E: 16.447887 6 04 83 80 2b 20 29
E: 16.460893 6 04 83 80 2b 00 29
E: 16.462891 6 04 87 50 47 60 4c
E: 16.476892 6 04 87 20 47 a0 4c
E: 16.478884 6 04 83 80 2b 00 29
E: 16.491897 6 04 83 90 2b e0 28
E: 16.493889 6 04 87 e0 46 00 4d
E: 16.507892 6 04 87 a0 46 80 4d
E: 16.509893 6 04 83 a0 2b c0 28
E: 16.522889 6 04 83 a0 2b c0 28
E: 16.524890 6 04 87 40 46 10 4e
E: 16.539893 6 04 87 e0 45 a0 4e
E: 16.541893 6 04 83 c0 2b a0 28
E: 16.554887 6 04 83 c0 2b a0 28
E: 16.556891 6 04 87 70 45 20 4f
E: 16.569892 6 04 87 20 45 80 4f
E: 16.571894 6 04 83 d0 2b 70 28
E: 16.585888 6 04 83 d0 2b 70 28
E: 16.587894 6 04 87 e0 44 d0 4f
E: 16.600893 6 04 87 a0 44 20 50
E: 16.602892 6 04 83 d0 2b 50 28
E: 16.615887 6 04 83 d0 2b 50 28
E: 16.617886 6 04 87 50 44 60 50
E: 16.630893 6 04 87 10 44 90 50
E: 16.632884 6 04 83 d0 2b 50 28
E: 16.645888 6 04 83 d0 2b 50 28
E: 16.647892 6 04 87 e0 43 c0 50
E: 16.660893 6 04 87 b0 43 f0 50
E: 16.662885 6 04 83 d0 2b 50 28
E: 16.675889 6 04 83 d0 2b 50 28
E: 16.677889 6 04 87 80 43 10 51
E: 16.690894 6 04 87 60 43 30 51
E: 16.692884 6 04 83 d0 2b 50 28
E: 16.706888 6 04 83 d0 2b 50 28
E: 16.708889 6 04 87 30 43 60 51
E: 16.721893 6 04 87 00 43 80 51
E: 16.723887 6 04 83 d0 2b 50 28
E: 16.736898 6 04 83 f0 2b 40 28
E: 16.738893 6 04 87 c0 42 a0 51
E: 16.751893 6 04 87 90 42 c0 51
E: 16.753884 6 04 83 f0 2b 40 28
E: 16.766888 6 04 83 f0 2b 40 28
E: 16.768889 6 04 87 50 42 e0 51
E: 16.782894 6 04 87 f0 41 10 52
E: 16.784890 6 04 83 d0 2b 40 28
E: 16.797895 6 04 83 b0 2b 50 28
E: 16.799894 6 04 87 80 41 40 52
E: 16.812893 6 04 87 30 41 60 52
E: 16.814892 6 04 83 90 2b 50 28
E: 16.827896 6 04 83 60 2b 60 28
E: 16.829890 6 04 87 f0 40 80 52
E: 16.841892 6 04 87 c0 40 90 52
E: 16.843897 6 04 83 00 2b 80 28
E: 16.856896 6 04 83 90 2a a0 28
E: 16.858892 6 04 87 80 40 a0 52
E: 16.872890 6 04 87 50 40 b0 52
E: 16.874898 6 04 83 20 2a c0 28
E: 16.887896 6 04 83 c0 29 d0 28
E: 16.889890 6 04 87 20 40 c0 52
E: 16.902893 6 04 87 00 40 d0 52
E: 16.904894 6 04 83 60 29 f0 28
E: 16.917896 6 04 83 f0 28 30 29
E: 16.919887 6 04 87 00 40 d0 52
E: 16.932893 6 04 87 e0 3f d0 52
E: 16.934895 6 04 83 80 28 90 29
E: 16.947895 6 04 83 20 28 00 2a
E: 16.949882 6 04 87 e0 3f d0 52
E: 16.962892 6 04 87 c0 3f d0 52
E: 16.964894 6 04 83 c0 27 80 2a
E: 16.978897 6 04 83 60 27 f0 2a
E: 16.980884 6 04 87 c0 3f d0 52
E: 16.993887 6 04 87 c0 3f d0 52
E: 16.995896 6 04 83 e0 26 60 2b
E: 17.008894 6 04 83 60 26 d0 2b
E: 17.010888 6 04 87 c0 3f d0 52
E: 17.024888 6 04 87 c0 3f d0 52
E: 17.026893 6 04 83 d0 25 40 2c
E: 17.039897 6 04 83 50 25 b0 2c
E: 17.041891 6 04 87 a0 3f e0 52
E: 17.056892 6 04 87 70 3f 00 53
E: 17.058895 6 04 83 d0 24 20 2d
E: 17.071893 6 04 83 60 24 90 2d
E: 17.073891 6 04 87 50 3f 10 53
E: 17.087885 6 04 87 50 3f 10 53
E: 17.089893 6 04 83 00 24 20 2e
E: 17.102897 6 04 83 a0 23 c0 2e
E: 17.104891 6 04 87 30 3f 20 53
E: 17.117888 6 04 87 30 3f 20 53
E: 17.119897 6 04 83 50 23 70 2f
E: 17.132896 6 04 83 00 23 20 30
E: 17.134891 6 04 87 10 3f 20 53
E: 17.147889 6 04 87 10 3f 20 53
E: 17.149894 6 04 83 c0 22 d0 30
E: 17.163896 6 04 83 80 22 70 31
E: 17.165884 6 04 87 10 3f 20 53
E: 17.178897 6 04 87 10 3f 40 53
E: 17.180894 6 04 83 40 22 10 32
E: 17.193896 6 04 83 00 22 b0 32
E: 17.195887 6 04 87 10 3f 40 53
E: 17.208895 6 04 87 10 3f 60 53
E: 17.210895 6 04 83 d0 21 60 33
E: 17.223897 6 04 83 a0 21 20 34
E: 17.225884 6 04 87 10 3f 60 53
E: 17.238896 6 04 87 30 3f 80 53
E: 17.240893 6 04 83 70 21 e0 34
E: 17.253894 6 04 83 40 21 a0 35
E: 17.255894 6 04 87 60 3f 90 53
E: 17.267888 6 04 87 60 3f 90 53
E: 17.269889 6 04 83 00 21 50 36
E: 17.282894 6 04 83 b0 20 00 37
E: 17.284887 6 04 87 90 3f 90 53
E: 17.298889 6 04 87 b0 3f 90 53
E: 17.300894 6 04 83 60 20 a0 37
E: 17.312896 6 04 83 20 20 10 38
E: 17.314885 6 04 87 b0 3f 90 53
E: 17.327893 6 04 87 d0 3f 90 53
E: 17.329894 6 04 83 e0 1f 90 38
E: 17.342895 6 04 83 a0 1f 10 39
E: 17.344884 6 04 87 d0 3f 90 53
E: 17.357896 6 04 87 f0 3f a0 53
E: 17.359897 6 04 83 70 1f 90 39
E: 17.371893 6 04 83 40 1f 30 3a
E: 17.373884 6 04 87 f0 3f a0 53
E: 17.385893 6 04 87 10 40 a0 53
E: 17.387897 6 04 83 10 1f e0 3a
E: 17.400896 6 04 83 f0 1e 90 3b
E: 17.402886 6 04 87 10 40 a0 53
E: 17.414887 6 04 87 10 40 a0 53
E: 17.416887 6 04 83 d0 1e 30 3c
E: 17.428895 6 04 83 b0 1e d0 3c
E: 17.430886 6 04 87 10 40 a0 53
E: 17.442888 6 04 87 10 40 a0 53
E: 17.444892 6 04 83 a0 1e 60 3d
E: 17.457895 6 04 83 90 1e e0 3d
E: 17.459887 6 04 87 10 40 a0 53
E: 17.471885 6 04 87 10 40 a0 53
E: 17.473892 6 04 83 80 1e 60 3e
E: 17.485896 6 04 83 70 1e d0 3e
E: 17.487887 6 04 87 10 40 a0 53
E: 17.500888 6 04 87 10 40 a0 53
E: 17.502894 6 04 83 60 1e 30 3f
E: 17.514893 6 04 83 60 1e 90 3f
E: 17.516884 6 04 87 10 40 a0 53
E: 17.528888 6 04 87 10 40 a0 53
E: 17.530891 6 04 83 60 1e d0 3f
E: 17.544893 6 04 83 60 1e 10 40
E: 17.546886 6 04 87 10 40 a0 53
E: 17.558894 6 04 87 30 40 b0 53
E: 17.560891 6 04 83 60 1e 50 40
E: 17.573891 6 04 83 60 1e d0 40
E: 17.575895 6 04 87 60 40 e0 53
E: 17.588893 6 04 87 90 40 30 54
E: 17.590893 6 04 83 60 1e 50 41
E: 17.602893 6 04 83 60 1e e0 41
E: 17.604890 6 04 87 c0 40 90 54
E: 17.616893 6 04 87 e0 40 e0 54
E: 17.618893 6 04 83 70 1e 60 42
E: 17.631896 6 04 83 80 1e d0 42
E: 17.633892 6 04 87 10 41 30 55
E: 17.645894 6 04 87 40 41 90 55
E: 17.647897 6 04 83 90 1e 40 43
E: 17.659894 6 04 83 90 1e 90 43
E: 17.661891 6 04 87 80 41 f0 55
E: 17.674894 6 04 87 c0 41 50 56
E: 17.676894 6 04 83 b0 1e e0 43
E: 17.688895 6 04 83 f0 1e 30 44
E: 17.690892 6 04 87 20 42 a0 56
E: 17.702893 6 04 87 a0 42 f0 56
E: 17.704894 6 04 83 40 1f 80 44
E: 17.717895 6 04 83 80 1f b0 44
E: 17.719894 6 04 87 20 43 40 57
E: 17.731893 6 04 87 b0 43 80 57
E: 17.733893 6 04 83 b0 1f e0 44
E: 17.745896 6 04 83 f0 1f 10 45
E: 17.747894 6 04 87 10 44 b0 57
E: 17.759893 6 04 87 80 44 e0 57
E: 17.761894 6 04 83 20 20 30 45
E: 17.774896 6 04 83 40 20 40 45
E: 17.776889 6 04 87 f0 44 00 58
E: 17.788893 6 04 87 60 45 20 58
E: 17.790895 6 04 83 80 20 60 45
E: 17.803896 6 04 83 d0 20 80 45
E: 17.805891 6 04 87 d0 45 40 58
E: 17.818889 6 04 87 50 46 60 58
E: 17.820893 6 04 83 20 21 90 45
E: 17.832896 6 04 83 70 21 a0 45
E: 17.834892 6 04 87 e0 46 70 58
E: 17.846893 6 04 87 70 47 80 58
E: 17.848894 6 04 83 d0 21 b0 45
E: 17.861895 6 04 83 20 22 c0 45
E: 17.863894 6 04 87 00 48 90 58
E: 17.875894 6 04 87 90 48 a0 58
E: 17.877893 6 04 83 90 22 d0 45
E: 17.889893 6 04 83 00 23 d0 45
E: 17.891892 6 04 87 10 49 a0 58
E: 17.903891 6 04 87 80 49 a0 58
E: 17.905891 6 04 83 80 23 d0 45
E: 17.918894 6 04 83 00 24 d0 45
E: 17.920889 6 04 87 f0 49 a0 58
E: 17.932891 6 04 87 50 4a a0 58
E: 17.934896 6 04 83 80 24 c0 45
E: 17.946896 6 04 83 f0 24 b0 45
E: 17.948889 6 04 87 90 4a a0 58
E: 17.961893 6 04 87 e0 4a 90 58
E: 17.963897 6 04 83 60 25 a0 45
E: 17.975896 6 04 83 c0 25 80 45
E: 17.977890 6 04 87 60 4b 90 58
E: 17.989893 6 04 87 e0 4b 80 58
E: 17.991897 6 04 83 20 26 60 45
E: 18.003896 6 04 83 60 26 40 45
E: 18.005890 6 04 87 60 4c 70 58
E: 18.018889 6 04 87 e0 4c 60 58
E: 18.020893 6 04 83 c0 26 20 45
E: 18.033894 6 04 83 40 27 00 45
E: 18.035892 6 04 87 50 4d 50 58
E: 18.047892 6 04 87 a0 4d 40 58
E: 18.049893 6 04 83 c0 27 e0 44
E: 18.063896 6 04 83 40 28 c0 44
E: 18.065890 6 04 87 10 4e 30 58
E: 18.078894 6 04 87 50 4e 20 58
E: 18.080893 6 04 83 c0 28 a0 44
E: 18.092895 6 04 83 30 29 60 44
E: 18.094893 6 04 87 90 4e 10 58
E: 18.107893 6 04 87 d0 4e 00 58
E: 18.109893 6 04 83 a0 29 10 44
E: 18.122895 6 04 83 00 2a b0 43
E: 18.124890 6 04 87 10 4f f0 57
E: 18.137893 6 04 87 70 4f e0 57
E: 18.139896 6 04 83 60 2a 50 43
E: 18.151895 6 04 83 a0 2a 00 43
E: 18.153890 6 04 87 c0 4f d0 57
E: 18.166891 6 04 87 20 50 b0 57
E: 18.168894 6 04 83 f0 2a b0 42
E: 18.181898 6 04 83 20 2b 70 42
E: 18.183894 6 04 87 90 50 90 57
E: 18.195892 6 04 87 00 51 70 57
E: 18.197894 6 04 83 70 2b 20 42
E: 18.210895 6 04 83 e0 2b d0 41
E: 18.212890 6 04 87 70 51 50 57
E: 18.225893 6 04 87 c0 51 30 57
E: 18.227897 6 04 83 50 2c 80 41
E: 18.240896 6 04 83 d0 2c 30 41
E: 18.242893 6 04 87 20 52 10 57
E: 18.254893 6 04 87 80 52 d0 56
E: 18.256893 6 04 83 30 2d f0 40
E: 18.268896 6 04 83 90 2d b0 40
E: 18.270891 6 04 87 d0 52 80 56
E: 18.282893 6 04 87 20 53 20 56
E: 18.284894 6 04 83 f0 2d 60 40
E: 18.297895 6 04 83 30 2e 30 40
E: 18.299894 6 04 87 60 53 d0 55
E: 18.312893 6 04 87 a0 53 80 55
E: 18.314896 6 04 83 80 2e e0 3f
E: 18.327896 6 04 83 d0 2e 70 3f
E: 18.329890 6 04 87 d0 53 40 55
E: 18.342893 6 04 87 00 54 f0 54
E: 18.344893 6 04 83 10 2f e0 3e
E: 18.357896 6 04 83 50 2f 50 3e
E: 18.359894 6 04 87 40 54 a0 54
E: 18.371891 6 04 87 70 54 60 54
E: 18.373893 6 04 83 90 2f b0 3d
E: 18.386896 6 04 83 d0 2f 20 3d
E: 18.388891 6 04 87 a0 54 10 54
E: 18.401893 6 04 87 f0 54 c0 53
E: 18.403897 6 04 83 10 30 90 3c
E: 18.415896 6 04 83 40 30 20 3c
E: 18.417886 6 04 87 50 55 70 53
E: 18.430893 6 04 87 b0 55 20 53
E: 18.432894 6 04 83 80 30 b0 3b
E: 18.445896 6 04 83 e0 30 30 3b
E: 18.447894 6 04 87 f0 55 f0 52
E: 18.460893 6 04 87 40 56 b0 52
E: 18.462896 6 04 83 40 31 c0 3a
E: 18.475897 6 04 83 a0 31 50 3a
E: 18.477890 6 04 87 90 56 60 52
E: 18.490893 6 04 87 e0 56 10 52
E: 18.492894 6 04 83 00 32 c0 39
E: 18.505895 6 04 83 50 32 10 39
E: 18.507894 6 04 87 30 57 a0 51
E: 18.519893 6 04 87 70 57 10 51
E: 18.521894 6 04 83 a0 32 60 38
E: 18.534896 6 04 83 f0 32 b0 37
E: 18.536891 6 04 87 b0 57 80 50
E: 18.549893 6 04 87 e0 57 10 50
E: 18.551895 6 04 83 30 33 00 37
E: 18.564895 6 04 83 60 33 80 36
E: 18.566893 6 04 87 10 58 90 4f
E: 18.579896 6 04 87 30 58 30 4f
E: 18.581892 6 04 83 90 33 00 36
E: 18.594896 6 04 83 c0 33 70 35
E: 18.596891 6 04 87 50 58 d0 4e
E: 18.609893 6 04 87 70 58 80 4e
E: 18.611897 6 04 83 e0 33 f0 34
E: 18.623896 6 04 83 00 34 90 34
E: 18.625891 6 04 87 90 58 20 4e
E: 18.638893 6 04 87 b0 58 e0 4d
E: 18.640892 6 04 83 20 34 00 34
E: 18.654896 6 04 83 40 34 60 33
E: 18.656891 6 04 87 d0 58 80 4d
E: 18.669892 6 04 87 e0 58 40 4d
E: 18.671895 6 04 83 60 34 b0 32
E: 18.684895 6 04 83 80 34 00 32
E: 18.686891 6 04 87 00 59 f0 4c
E: 18.699891 6 04 87 10 59 b0 4c
E: 18.701894 6 04 83 a0 34 80 31
E: 18.714895 6 04 83 c0 34 00 31
E: 18.716889 6 04 87 20 59 80 4c
E: 18.729891 6 04 87 30 59 30 4c
E: 18.731897 6 04 83 d0 34 a0 30
E: 18.744896 6 04 83 f0 34 30 30
E: 18.746892 6 04 87 40 59 00 4c
E: 18.760893 6 04 87 50 59 d0 4b
E: 18.762896 6 04 83 00 35 e0 2f
E: 18.774897 6 04 83 20 35 80 2f
E: 18.776891 6 04 87 60 59 70 4b
E: 18.789892 6 04 87 80 59 00 4b
E: 18.791896 6 04 83 30 35 40 2f
E: 18.804895 6 04 83 40 35 10 2f
E: 18.806892 6 04 87 a0 59 80 4a
E: 18.819889 6 04 87 b0 59 20 4a
E: 18.821893 6 04 83 50 35 c0 2e
E: 18.834895 6 04 83 60 35 90 2e
E: 18.836890 6 04 87 c0 59 d0 49
E: 18.849893 6 04 87 d0 59 a0 49
E: 18.851897 6 04 83 80 35 40 2e
E: 18.864896 6 04 83 90 35 10 2e
E: 18.866893 6 04 87 e0 59 50 49
E: 18.878894 6 04 87 f0 59 10 49
E: 18.880893 6 04 83 c0 35 d0 2d
E: 18.893895 6 04 83 00 36 80 2d
E: 18.895892 6 04 87 f0 59 e0 48
E: 18.908894 6 04 87 10 5a a0 48
E: 18.910895 6 04 83 30 36 40 2d
E: 18.923895 6 04 83 50 36 10 2d
E: 18.925891 6 04 87 50 5a 60 48
E: 18.938893 6 04 87 80 5a 30 48
E: 18.940893 6 04 83 80 36 e0 2c
E: 18.954896 6 04 83 a0 36 b0 2c
E: 18.956890 6 04 87 a0 5a 00 48
E: 18.969893 6 04 87 b0 5a e0 47
E: 18.971894 6 04 83 d0 36 60 2c
E: 18.984895 6 04 83 00 37 00 2c
E: 18.986884 6 04 87 b0 5a e0 47
E: 18.999893 6 04 87 d0 5a c0 47
E: 19.001893 6 04 83 20 37 b0 2b
E: 19.014897 6 04 83 40 37 70 2b
E: 19.016879 6 04 87 d0 5a c0 47
E: 19.029895 6 04 87 00 5b 90 47
E: 19.031896 6 04 83 50 37 40 2b
E: 19.044895 6 04 83 70 37 00 2b
E: 19.046891 6 04 87 10 5b 70 47
E: 19.060887 6 04 87 10 5b 70 47
E: 19.062895 6 04 83 80 37 d0 2a
E: 19.076897 6 04 83 90 37 b0 2a
E: 19.078893 6 04 87 30 5b 50 47
E: 19.091888 6 04 87 30 5b 50 47
E: 19.093894 6 04 83 a0 37 90 2a
E: 19.106888 6 04 83 a0 37 90 2a
E: 19.108884 6 04 87 30 5b 50 47
E: 19.121888 6 04 87 30 5b 50 47
E: 19.123892 6 04 83 a0 37 70 2a
E: 19.136888 6 04 83 a0 37 70 2a
E: 19.138886 6 04 87 30 5b 50 47
E: 19.151889 6 04 87 30 5b 50 47
E: 19.153889 6 04 83 a0 37 50 2a
E: 19.166888 6 04 83 a0 37 50 2a
E: 19.168884 6 04 87 30 5b 50 47
E: 19.182889 6 04 87 30 5b 50 47
E: 19.184884 6 04 83 a0 37 50 2a
E: 19.197887 6 04 83 a0 37 50 2a
E: 19.199887 6 04 87 30 5b 50 47
E: 19.212888 6 04 87 30 5b 50 47
E: 19.214886 6 04 83 a0 37 50 2a
E: 19.227888 6 04 83 a0 37 50 2a
E: 19.229884 6 04 87 30 5b 50 47
E: 19.242895 6 04 87 50 5b 20 47
E: 19.244884 6 04 83 a0 37 50 2a
E: 19.257890 6 04 83 a0 37 50 2a
E: 19.259887 6 04 87 50 5b 20 47
E: 19.272890 6 04 87 60 5b 00 47
E: 19.274887 6 04 83 a0 37 50 2a
E: 19.288887 6 04 83 a0 37 50 2a
E: 19.290886 6 04 87 60 5b 00 47
E: 19.303887 6 04 87 60 5b 00 47
E: 19.305883 6 04 83 a0 37 50 2a
E: 19.318887 6 04 83 a0 37 50 2a
E: 19.320884 6 04 87 60 5b 00 47
E: 19.334887 6 04 87 60 5b 00 47
E: 19.336883 6 04 83 a0 37 50 2a
E: 19.349888 6 04 83 a0 37 50 2a
E: 19.351887 6 04 87 60 5b 00 47
E: 19.364887 6 04 87 60 5b 00 47
E: 19.366885 6 04 83 a0 37 50 2a
E: 19.379888 6 04 83 a0 37 50 2a
E: 19.381883 6 04 87 60 5b 00 47
E: 19.395893 6 04 87 70 5b e0 46
E: 19.397884 6 04 83 a0 37 50 2a
E: 19.410888 6 04 83 a0 37 50 2a
E: 19.412884 6 04 87 70 5b e0 46
E: 19.425893 6 04 87 80 5b c0 46
E: 19.427887 6 04 83 a0 37 50 2a
E: 19.440898 6 04 83 b0 37 30 2a
E: 19.442886 6 04 87 80 5b c0 46
E: 19.455888 6 04 87 80 5b c0 46
E: 19.457892 6 04 83 c0 37 10 2a
E: 19.470885 6 04 83 c0 37 10 2a
E: 19.472884 6 04 87 80 5b c0 46
E: 19.485889 6 04 87 80 5b c0 46
E: 19.487892 6 04 83 c0 37 f0 29
E: 19.501888 6 04 83 c0 37 f0 29
E: 19.503887 6 04 87 80 5b c0 46
E: 19.516888 6 04 87 80 5b c0 46
E: 19.518891 6 04 83 c0 37 d0 29
E: 19.531889 6 04 83 c0 37 d0 29
E: 19.533885 6 04 87 80 5b c0 46
E: 19.546890 6 04 87 80 5b c0 46
E: 19.548885 6 04 83 c0 37 d0 29
E: 19.561888 6 04 83 c0 37 d0 29
E: 19.563888 6 04 87 80 5b c0 46
E: 19.576889 6 04 87 80 5b c0 46
E: 19.578886 6 04 83 c0 37 d0 29
E: 19.587888 6 04 87 80 5b c0 46
E: 19.597893 6 04 87 80 5b a0 46
E: 19.608888 6 04 87 80 5b a0 46
E: 19.618889 6 04 87 60 5b 80 46
E: 19.628888 6 04 87 60 5b 80 46
E: 19.638891 6 04 87 40 5b 80 46
E: 19.640891 6 04 83 e0 37 d0 29
E: 19.642889 6 04 82 e0 37 d0 29
E: 19.648882 6 04 87 40 5b 80 46
E: 19.658889 6 04 87 20 5b 80 46
E: 19.668883 6 04 87 20 5b 80 46
E: 19.678884 6 04 87 20 5b 80 46
E: 19.688882 6 04 87 20 5b 80 46
E: 19.698883 6 04 87 20 5b 80 46
E: 19.708883 6 04 87 20 5b 80 46
E: 19.718882 6 04 87 20 5b 80 46
E: 19.728883 6 04 87 20 5b 80 46
E: 19.738883 6 04 87 20 5b 80 46
E: 19.748883 6 04 87 20 5b 80 46
E: 19.758883 6 04 87 20 5b 80 46
E: 19.769882 6 04 87 20 5b 80 46
E: 19.779885 6 04 87 20 5b 80 46
E: 19.789882 6 04 87 20 5b 80 46
E: 19.799883 6 04 87 20 5b 80 46
E: 19.809882 6 04 87 20 5b 80 46
E: 19.819879 6 04 87 20 5b 80 46
E: 19.829882 6 04 87 20 5b 80 46
E: 19.839883 6 04 87 20 5b 80 46
E: 19.850883 6 04 87 20 5b 80 46
E: 19.860882 6 04 87 20 5b 80 46
E: 19.870880 6 04 87 20 5b 80 46
E: 19.880883 6 04 87 20 5b 80 46
E: 19.890882 6 04 87 20 5b 80 46
E: 19.900882 6 04 87 20 5b 80 46
E: 19.910883 6 04 87 20 5b 80 46
E: 19.921883 6 04 87 20 5b 80 46
E: 19.931882 6 04 87 20 5b 80 46
E: 19.941882 6 04 87 20 5b 80 46
E: 19.951883 6 04 87 20 5b 80 46
E: 19.961883 6 04 87 20 5b 80 46
E: 19.971880 6 04 87 20 5b 80 46
E: 19.981883 6 04 87 20 5b 80 46
E: 19.991882 6 04 87 20 5b 80 46
E: 20.001883 6 04 87 20 5b 80 46
E: 20.011882 6 04 87 20 5b 80 46
E: 20.021880 6 04 87 20 5b 80 46
E: 20.031883 6 04 87 20 5b 80 46
E: 20.041882 6 04 87 20 5b 80 46
E: 20.051882 6 04 87 20 5b 80 46
E: 20.061882 6 04 87 20 5b 80 46
E: 20.071880 6 04 87 20 5b 80 46
E: 20.081889 6 04 87 40 5b 80 46
E: 20.091883 6 04 87 40 5b 80 46
E: 20.103884 6 04 87 40 5b 80 46
E: 20.113887 6 04 87 60 5b 80 46
E: 20.123883 6 04 87 60 5b 80 46
E: 20.133887 6 04 87 80 5b 80 46
E: 20.143879 6 04 87 80 5b 80 46
E: 20.153888 6 04 87 a0 5b 80 46
E: 20.163883 6 04 87 a0 5b 80 46
E: 20.173880 6 04 87 a0 5b 80 46
E: 20.183884 6 04 87 a0 5b 80 46
E: 20.193882 6 04 87 a0 5b 80 46
E: 20.203882 6 04 87 a0 5b 80 46
E: 20.213880 6 04 87 a0 5b 80 46
E: 20.223882 6 04 87 a0 5b 80 46
E: 20.233882 6 04 87 a0 5b 80 46
E: 20.243883 6 04 87 a0 5b 80 46
E: 20.253883 6 04 87 a0 5b 80 46
E: 20.263883 6 04 87 a0 5b 80 46
E: 20.274882 6 04 87 a0 5b 80 46
E: 20.284881 6 04 87 a0 5b 80 46
E: 20.294882 6 04 87 a0 5b 80 46
E: 20.304886 6 04 87 c0 5b 80 46
E: 20.314882 6 04 87 c0 5b 80 46
E: 20.324883 6 04 87 c0 5b 80 46
E: 20.334883 6 04 87 c0 5b 80 46
E: 20.344883 6 04 87 c0 5b 80 46
E: 20.355883 6 04 87 c0 5b 80 46
E: 20.365888 6 04 87 e0 5b 80 46
E: 20.375883 6 04 87 e0 5b 80 46
E: 20.385887 6 04 87 00 5c 80 46
E: 20.444891 6 04 87 40 5c 50 46
E: 20.446879 6 04 86 40 5c 50 46
# 3. Finally, move your ten fingers on the screen and release them.
E: 28.274935 6 04 83 a0 0e a0 39
E: 28.284884 6 04 83 a0 0e a0 39
E: 28.294883 6 04 83 a0 0e a0 39
E: 28.304882 6 04 83 a0 0e a0 39
E: 28.314883 6 04 83 a0 0e a0 39
E: 28.324883 6 04 83 a0 0e a0 39
E: 28.334889 6 04 83 a0 0e 80 39
E: 28.344883 6 04 83 a0 0e 80 39
E: 28.354883 6 04 83 a0 0e 80 39
E: 28.364884 6 04 83 a0 0e 80 39
E: 28.374884 6 04 83 a0 0e 80 39
E: 28.384883 6 04 83 a0 0e 80 39
E: 28.394883 6 04 83 a0 0e 80 39
E: 28.404883 6 04 83 a0 0e 80 39
E: 28.415883 6 04 83 a0 0e 80 39
E: 28.425883 6 04 83 a0 0e 80 39
E: 28.435883 6 04 83 a0 0e 80 39
E: 28.445888 6 04 83 a0 0e 60 39
E: 28.455883 6 04 83 a0 0e 60 39
E: 28.465882 6 04 83 a0 0e 60 39
E: 28.475884 6 04 83 a0 0e 60 39
E: 28.485883 6 04 83 a0 0e 60 39
E: 28.495883 6 04 83 a0 0e 60 39
E: 28.506883 6 04 83 a0 0e 60 39
E: 28.516883 6 04 83 a0 0e 60 39
E: 28.526882 6 04 83 a0 0e 60 39
E: 28.536882 6 04 83 a0 0e 60 39
E: 28.547883 6 04 83 a0 0e 60 39
E: 28.557882 6 04 83 a0 0e 60 39
E: 28.567882 6 04 83 a0 0e 60 39
E: 28.577884 6 04 83 a0 0e 60 39
E: 28.587883 6 04 83 a0 0e 60 39
E: 28.597882 6 04 83 a0 0e 60 39
E: 28.607883 6 04 83 a0 0e 60 39
E: 28.617883 6 04 83 a0 0e 60 39
E: 28.627883 6 04 83 a0 0e 60 39
E: 28.637882 6 04 83 a0 0e 60 39
E: 28.647882 6 04 83 a0 0e 60 39
E: 28.657884 6 04 83 a0 0e 60 39
E: 28.667883 6 04 83 a0 0e 60 39
E: 28.678884 6 04 83 a0 0e 60 39
E: 28.688884 6 04 83 a0 0e 60 39
E: 28.698883 6 04 83 a0 0e 60 39
E: 28.708888 6 04 83 a0 0e 40 39
E: 28.718883 6 04 83 a0 0e 40 39
E: 28.728891 6 04 83 c0 0e 20 39
E: 28.738883 6 04 83 c0 0e 20 39
E: 28.753890 6 04 83 e0 0e 10 39
E: 28.767883 6 04 83 e0 0e 10 39
E: 28.783884 6 04 83 e0 0e 10 39
E: 28.785893 6 04 87 e0 25 10 20
E: 28.798888 6 04 83 e0 0e 10 39
E: 28.800884 6 04 87 e0 25 10 20
E: 28.813888 6 04 87 e0 25 10 20
E: 28.815887 6 04 83 e0 0e 10 39
E: 28.831888 6 04 83 e0 0e 10 39
E: 28.833884 6 04 87 e0 25 10 20
E: 28.848888 6 04 83 e0 0e 10 39
E: 28.850885 6 04 87 e0 25 10 20
E: 28.866888 6 04 87 e0 25 10 20
E: 28.868884 6 04 83 e0 0e 10 39
E: 28.884889 6 04 83 e0 0e 10 39
E: 28.886885 6 04 87 e0 25 10 20
E: 28.902888 6 04 83 e0 0e 10 39
E: 28.904888 6 04 87 e0 25 e0 1f
E: 28.919891 6 04 87 e0 25 90 1f
E: 28.921884 6 04 83 e0 0e 10 39
E: 28.937888 6 04 83 e0 0e 10 39
E: 28.939891 6 04 87 e0 25 40 1f
E: 28.955888 6 04 83 e0 0e 10 39
E: 28.957887 6 04 87 e0 25 00 1f
E: 28.972889 6 04 87 e0 25 d0 1e
E: 28.974888 6 04 83 e0 0e 10 39
E: 28.990888 6 04 83 e0 0e 10 39
E: 28.992888 6 04 87 e0 25 b0 1e
E: 29.011888 6 04 83 e0 0e 10 39
E: 29.013887 6 04 87 e0 25 90 1e
E: 29.032887 6 04 83 e0 0e 10 39
E: 29.034886 6 04 87 e0 25 90 1e
E: 29.052888 6 04 83 e0 0e 10 39
E: 29.054889 6 04 87 e0 25 70 1e
E: 29.072885 6 04 87 e0 25 70 1e
E: 29.074888 6 04 83 e0 0e 10 39
E: 29.093888 6 04 83 e0 0e 10 39
E: 29.095891 6 04 87 e0 25 50 1e
E: 29.113888 6 04 83 e0 0e 10 39
E: 29.115887 6 04 87 e0 25 50 1e
E: 29.133888 6 04 83 e0 0e 10 39
E: 29.135887 6 04 87 e0 25 50 1e
E: 29.154889 6 04 87 e0 25 50 1e
E: 29.156884 6 04 83 e0 0e 10 39
E: 29.174890 6 04 83 e0 0e 10 39
E: 29.176884 6 04 87 e0 25 50 1e
E: 29.194888 6 04 83 e0 0e 10 39
E: 29.196884 6 04 87 e0 25 50 1e
E: 29.215888 6 04 83 e0 0e 10 39
E: 29.217880 6 04 87 e0 25 50 1e
E: 29.235890 6 04 87 e0 25 50 1e
E: 29.237884 6 04 83 e0 0e 10 39
E: 29.255888 6 04 83 e0 0e 10 39
E: 29.257884 6 04 87 e0 25 50 1e
E: 29.276888 6 04 83 e0 0e 10 39
E: 29.278887 6 04 87 e0 25 50 1e
E: 29.297888 6 04 83 e0 0e 10 39
E: 29.299887 6 04 87 e0 25 50 1e
E: 29.317887 6 04 87 e0 25 50 1e
E: 29.319888 6 04 83 e0 0e 10 39
E: 29.337888 6 04 83 e0 0e 10 39
E: 29.339887 6 04 87 e0 25 50 1e
E: 29.358888 6 04 83 e0 0e 10 39
E: 29.360884 6 04 87 e0 25 50 1e
E: 29.378890 6 04 83 e0 0e 10 39
E: 29.380884 6 04 87 e0 25 50 1e
E: 29.398888 6 04 87 e0 25 50 1e
E: 29.400884 6 04 83 e0 0e 10 39
E: 29.419884 6 04 83 e0 0e 10 39
E: 29.421884 6 04 87 e0 25 50 1e
E: 29.439888 6 04 83 e0 0e 10 39
E: 29.441884 6 04 87 e0 25 50 1e
E: 29.459887 6 04 83 e0 0e 10 39
E: 29.461884 6 04 87 e0 25 50 1e
E: 29.488886 6 04 83 e0 0e 10 39
E: 29.490888 6 04 87 e0 25 50 1e
E: 29.517888 6 04 83 e0 0e 10 39
E: 29.519888 6 04 87 e0 25 50 1e
E: 29.547889 6 04 83 e0 0e 10 39
E: 29.549884 6 04 87 e0 25 50 1e
E: 29.577890 6 04 87 e0 25 50 1e
E: 29.579888 6 04 83 e0 0e 10 39
E: 29.606888 6 04 83 e0 0e 10 39
E: 29.608884 6 04 87 e0 25 50 1e
E: 29.635887 6 04 83 e0 0e 10 39
E: 29.637884 6 04 87 e0 25 50 1e
E: 29.664888 6 04 83 e0 0e 10 39
E: 29.666886 6 04 87 e0 25 50 1e
E: 29.693889 6 04 83 e0 0e 10 39
E: 29.695887 6 04 87 e0 25 50 1e
E: 29.722888 6 04 87 e0 25 50 1e
E: 29.724885 6 04 83 e0 0e 10 39
E: 29.751888 6 04 83 e0 0e 10 39
E: 29.753884 6 04 87 e0 25 50 1e
E: 29.781890 6 04 83 e0 0e 10 39
E: 29.783887 6 04 87 e0 25 50 1e
E: 29.810888 6 04 83 e0 0e 10 39
E: 29.812884 6 04 87 e0 25 50 1e
E: 29.839888 6 04 83 e0 0e 10 39
E: 29.841884 6 04 87 e0 25 50 1e
E: 29.868888 6 04 87 e0 25 50 1e
E: 29.870885 6 04 83 e0 0e 10 39
E: 29.897889 6 04 83 e0 0e 10 39
E: 29.899887 6 04 87 e0 25 50 1e
E: 29.927888 6 04 83 e0 0e 10 39
E: 29.929884 6 04 87 e0 25 50 1e
E: 29.956895 6 04 83 00 0f 10 39
E: 29.958885 6 04 87 e0 25 50 1e
E: 29.985897 6 04 83 10 0f d0 38
E: 29.987888 6 04 87 e0 25 50 1e
E: 30.014888 6 04 87 e0 25 50 1e
E: 30.016887 6 04 83 20 0f 50 38
E: 30.044896 6 04 83 30 0f b0 37
E: 30.046893 6 04 87 f0 25 10 1e
E: 30.073896 6 04 83 40 0f f0 36
E: 30.075896 6 04 87 10 26 b0 1d
E: 30.102900 6 04 83 50 0f 30 36
E: 30.104891 6 04 87 30 26 70 1d
E: 30.131898 6 04 83 60 0f 50 35
E: 30.133892 6 04 87 60 26 00 1d
E: 30.159893 6 04 87 80 26 b0 1c
E: 30.161891 6 04 83 60 0f 50 34
E: 30.188898 6 04 83 70 0f 50 33
E: 30.190893 6 04 87 b0 26 20 1c
E: 30.217898 6 04 83 80 0f 50 32
E: 30.219891 6 04 87 00 27 60 1b
E: 30.246898 6 04 83 90 0f 60 31
E: 30.248890 6 04 87 70 27 90 1a
E: 30.275898 6 04 83 a0 0f 80 30
E: 30.277891 6 04 87 f0 27 c0 19
E: 30.302893 6 04 87 70 28 00 19
E: 30.304893 6 04 83 b0 0f d0 2f
E: 30.326895 6 04 83 d0 0f 20 2f
E: 30.328891 6 04 87 d0 28 70 18
E: 30.351898 6 04 83 e0 0f a0 2e
E: 30.353890 6 04 87 20 29 00 18
E: 30.375896 6 04 83 00 10 00 2e
E: 30.377890 6 04 87 50 29 b0 17
E: 30.400892 6 04 87 a0 29 50 17
E: 30.402896 6 04 83 20 10 40 2d
E: 30.424895 6 04 83 50 10 80 2c
E: 30.426892 6 04 87 d0 29 00 17
E: 30.448897 6 04 83 70 10 f0 2b
E: 30.450893 6 04 87 00 2a d0 16
E: 30.473896 6 04 83 b0 10 70 2b
E: 30.475895 6 04 87 20 2a a0 16
E: 30.497893 6 04 87 30 2a 80 16
E: 30.499898 6 04 83 e0 10 10 2b
E: 30.522898 6 04 83 30 11 b0 2a
E: 30.524891 6 04 87 60 2a 50 16
E: 30.547898 6 04 83 70 11 70 2a
E: 30.549891 6 04 87 80 2a 20 16
E: 30.572895 6 04 83 c0 11 30 2a
E: 30.574895 6 04 87 a0 2a 00 16
E: 30.600896 6 04 83 20 12 00 2a
E: 30.602884 6 04 87 a0 2a 00 16
E: 30.629895 6 04 83 80 12 e0 29
E: 30.631894 6 04 87 c0 2a e0 15
E: 30.658898 6 04 83 e0 12 f0 29
E: 30.660884 6 04 87 c0 2a e0 15
E: 30.687896 6 04 87 e0 2a c0 15
E: 30.689893 6 04 83 20 13 00 2a
E: 30.716896 6 04 83 70 13 30 2a
E: 30.718886 6 04 87 e0 2a c0 15
E: 30.745897 6 04 83 d0 13 80 2a
E: 30.747894 6 04 87 10 2b a0 15
E: 30.774900 6 04 83 60 14 e0 2a
E: 30.776891 6 04 87 60 2b 90 15
E: 30.804898 6 04 83 00 15 40 2b
E: 30.806893 6 04 87 d0 2b 80 15
E: 30.833894 6 04 87 60 2c 70 15
E: 30.835897 6 04 83 c0 15 a0 2b
E: 30.862895 6 04 83 90 16 00 2c
E: 30.864889 6 04 87 00 2d 60 15
E: 30.891899 6 04 83 70 17 60 2c
E: 30.893891 6 04 87 a0 2d 50 15
E: 30.920898 6 04 83 50 18 b0 2c
E: 30.922893 6 04 87 40 2e 40 15
E: 30.949897 6 04 83 30 19 00 2d
E: 30.951893 6 04 87 d0 2e 30 15
E: 30.978893 6 04 87 50 2f 20 15
E: 30.980894 6 04 83 00 1a 40 2d
E: 31.006897 6 04 83 c0 1a 70 2d
E: 31.008892 6 04 87 d0 2f 10 15
E: 31.034897 6 04 83 70 1b a0 2d
E: 31.036889 6 04 87 50 30 00 15
E: 31.064897 6 04 83 10 1c c0 2d
E: 31.066893 6 04 87 d0 30 f0 14
E: 31.092896 6 04 83 b0 1c e0 2d
E: 31.094893 6 04 87 50 31 f0 14
E: 31.120892 6 04 87 c0 31 f0 14
E: 31.122894 6 04 83 50 1d 00 2e
E: 31.148894 6 04 83 00 1e 30 2e
E: 31.150894 6 04 87 30 32 f0 14
E: 31.176900 6 04 83 b0 1e 60 2e
E: 31.178892 6 04 87 a0 32 00 15
E: 31.204898 6 04 83 30 1f 80 2e
E: 31.206892 6 04 87 f0 32 10 15
E: 31.232897 6 04 83 c0 1f d0 2e
E: 31.234893 6 04 87 70 33 30 15
E: 31.261893 6 04 87 10 34 60 15
E: 31.263897 6 04 83 60 20 50 2f
E: 31.289898 6 04 83 20 21 f0 2f
E: 31.291894 6 04 87 d0 34 d0 15
E: 31.318898 6 04 83 e0 21 a0 30
E: 31.320891 6 04 87 a0 35 80 16
E: 31.347897 6 04 83 b0 22 70 31
E: 31.349891 6 04 87 70 36 50 17
E: 31.376899 6 04 83 80 23 60 32
E: 31.378892 6 04 87 50 37 40 18
E: 31.404894 6 04 87 30 38 60 19
E: 31.406896 6 04 83 40 24 80 33
E: 31.432895 6 04 83 f0 24 b0 34
E: 31.434892 6 04 87 10 39 a0 1a
E: 31.461898 6 04 83 90 25 f0 35
E: 31.463894 6 04 87 e0 39 f0 1b
E: 31.489899 6 04 83 10 26 50 37
E: 31.491894 6 04 87 a0 3a 70 1d
E: 31.517898 6 04 83 80 26 b0 38
E: 31.519892 6 04 87 40 3b f0 1e
E: 31.546895 6 04 87 c0 3b 70 20
E: 31.548894 6 04 83 d0 26 20 3a
E: 31.576897 6 04 83 10 27 a0 3b
E: 31.578893 6 04 87 20 3c f0 21
E: 31.604898 6 04 83 30 27 30 3d
E: 31.606893 6 04 87 70 3c 80 23
E: 31.632894 6 04 83 30 27 b0 3e
E: 31.634892 6 04 87 a0 3c 10 25
E: 31.660898 6 04 83 10 27 20 40
E: 31.662893 6 04 87 b0 3c 90 26
E: 31.688904 6 04 87 90 3c 00 28
E: 31.690895 6 04 83 e0 26 80 41
E: 31.716897 6 04 83 80 26 e0 42
E: 31.718892 6 04 87 40 3c 60 29
E: 31.744898 6 04 83 00 26 30 44
E: 31.746893 6 04 87 d0 3b c0 2a
E: 31.771895 6 04 83 60 25 70 45
E: 31.773891 6 04 87 40 3b 20 2c
E: 31.798899 6 04 83 b0 24 a0 46
E: 31.800890 6 04 87 90 3a 70 2d
E: 31.826893 6 04 87 c0 39 b0 2e
E: 31.828894 6 04 83 e0 23 c0 47
E: 31.853896 6 04 83 00 23 d0 48
E: 31.855894 6 04 87 e0 38 d0 2f
E: 31.880900 6 04 83 20 22 f0 49
E: 31.882893 6 04 87 f0 37 f0 30
E: 31.907898 6 04 83 30 21 20 4b
E: 31.909892 6 04 87 e0 36 10 32
E: 31.933898 6 04 83 30 20 40 4c
E: 31.935894 6 04 87 c0 35 30 33
E: 31.959895 6 04 87 a0 34 40 34
E: 31.961894 6 04 83 20 1f 60 4d
E: 31.985898 6 04 83 10 1e 60 4e
E: 31.987892 6 04 87 90 33 40 35
E: 32.011895 6 04 83 10 1d 50 4f
E: 32.013890 6 04 87 70 32 30 36
E: 32.037899 6 04 83 10 1c 30 50
E: 32.039893 6 04 87 50 31 00 37
E: 32.063897 6 04 83 10 1b f0 50
E: 32.065891 6 04 87 30 30 b0 37
E: 32.090895 6 04 87 00 2f 50 38
E: 32.092894 6 04 83 10 1a c0 51
E: 32.116897 6 04 83 00 19 90 52
E: 32.118893 6 04 87 b0 2d f0 38
E: 32.142893 6 04 83 d0 17 60 53
E: 32.144890 6 04 87 50 2c 80 39
E: 32.168899 6 04 83 90 16 30 54
E: 32.170892 6 04 87 e0 2a 20 3a
E: 32.194900 6 04 83 20 15 f0 54
E: 32.196890 6 04 87 40 29 c0 3a
E: 32.220890 6 04 87 80 27 60 3b
E: 32.222897 6 04 83 90 13 a0 55
E: 32.246898 6 04 83 e0 11 50 56
E: 32.248891 6 04 87 a0 25 00 3c
E: 32.272893 6 04 83 30 10 e0 56
E: 32.274894 6 04 87 c0 23 90 3c
E: 32.298894 6 04 83 90 0e 70 57
E: 32.300892 6 04 87 f0 21 10 3d
E: 32.324900 6 04 83 00 0d f0 57
E: 32.326892 6 04 87 30 20 80 3d
E: 32.351894 6 04 87 a0 1e e0 3d
E: 32.353893 6 04 83 90 0b 60 58
E: 32.377897 6 04 83 40 0a e0 58
E: 32.379894 6 04 87 30 1d 30 3e
E: 32.403898 6 04 83 00 09 80 59
E: 32.405891 6 04 87 e0 1b 80 3e
E: 32.428898 6 04 83 d0 07 20 5a
E: 32.430893 6 04 87 b0 1a d0 3e
E: 32.454897 6 04 83 a0 06 b0 5a
E: 32.456891 6 04 87 90 19 20 3f
E: 32.480895 6 04 87 70 18 70 3f
E: 32.482895 6 04 83 80 05 40 5b
E: 32.506896 6 04 83 70 04 d0 5b
E: 32.508891 6 04 87 60 17 c0 3f
E: 32.532898 6 04 83 a0 03 40 5c
E: 32.534892 6 04 87 50 16 40 40
E: 32.558898 6 04 83 10 03 90 5c
E: 32.560890 6 04 87 50 15 d0 40
E: 32.585899 6 04 83 80 02 f0 5c
E: 32.587893 6 04 87 90 14 40 41
E: 32.611893 6 04 87 00 14 90 41
E: 32.613894 6 04 83 10 02 40 5d
E: 32.637895 6 04 83 c0 01 80 5d
E: 32.639894 6 04 87 a0 13 d0 41
E: 32.663899 6 04 83 80 01 b0 5d
E: 32.665891 6 04 87 40 13 30 42
E: 32.688897 6 04 83 40 01 00 5e
E: 32.690892 6 04 87 00 13 a0 42
E: 32.713897 6 04 83 10 01 60 5e
E: 32.715893 6 04 87 e0 12 10 43
E: 32.738894 6 04 87 d0 12 70 43
E: 32.740895 6 04 83 f0 00 c0 5e
E: 32.763895 6 04 83 e0 00 00 5f
E: 32.765889 6 04 87 c0 12 a0 43
E: 32.789900 6 04 83 d0 00 30 5f
E: 32.791893 6 04 87 b0 12 d0 43
E: 32.815897 6 04 83 c0 00 50 5f
E: 32.817884 6 04 87 b0 12 f0 43
E: 32.842897 6 04 83 e0 00 70 5f
E: 32.844889 6 04 87 b0 12 20 44
E: 32.868892 6 04 87 c0 12 40 44
E: 32.870895 6 04 83 30 01 90 5f
E: 32.894894 6 04 83 c0 01 90 5f
E: 32.896891 6 04 87 e0 12 50 44
E: 32.920898 6 04 83 90 02 80 5f
E: 32.922892 6 04 87 10 13 30 44
E: 32.946897 6 04 83 70 03 60 5f
E: 32.948890 6 04 87 60 13 e0 43
E: 32.972895 6 04 83 60 04 20 5f
E: 32.974895 6 04 87 e0 13 70 43
E: 32.998893 6 04 87 80 14 f0 42
E: 33.000893 6 04 83 60 05 b0 5e
E: 33.024893 6 04 83 70 06 00 5e
E: 33.026891 6 04 87 60 15 60 42
E: 33.050897 6 04 83 a0 07 30 5d
E: 33.052891 6 04 87 80 16 c0 41
E: 33.076899 6 04 83 f0 08 50 5c
E: 33.078892 6 04 87 d0 17 00 41
E: 33.104897 6 04 83 50 0a 60 5b
E: 33.106892 6 04 87 50 19 20 40
E: 33.131893 6 04 87 f0 1a 30 3f
E: 33.133894 6 04 83 d0 0b 40 5a
E: 33.158897 6 04 83 50 0d 10 59
E: 33.160891 6 04 87 90 1c 40 3e
E: 33.185899 6 04 83 d0 0e f0 57
E: 33.187894 6 04 87 30 1e 60 3d
E: 33.212897 6 04 83 30 10 e0 56
E: 33.214892 6 04 87 c0 1f 90 3c
E: 33.239897 6 04 83 70 11 f0 55
E: 33.241891 6 04 87 20 21 d0 3b
E: 33.266893 6 04 87 30 22 40 3b
E: 33.268889 6 04 83 60 12 40 55
E: 33.293897 6 04 83 40 13 a0 54
E: 33.295894 6 04 87 30 23 c0 3a
E: 33.320897 6 04 83 20 14 10 54
E: 33.322893 6 04 87 20 24 50 3a
E: 33.348897 6 04 83 c0 14 b0 53
E: 33.350892 6 04 87 00 25 f0 39
E: 33.375899 6 04 83 70 15 50 53
E: 33.377890 6 04 87 e0 25 a0 39
E: 33.402892 6 04 87 b0 26 60 39
E: 33.404893 6 04 83 f0 15 10 53
E: 33.429895 6 04 83 80 16 c0 52
E: 33.431894 6 04 87 70 27 20 39
E: 33.456897 6 04 83 20 17 70 52
E: 33.458892 6 04 87 30 28 f0 38
E: 33.483900 6 04 83 d0 17 20 52
E: 33.485891 6 04 87 00 29 c0 38
E: 33.510898 6 04 83 a0 18 d0 51
E: 33.512890 6 04 87 e0 29 a0 38
E: 33.537895 6 04 87 d0 2a 80 38
E: 33.539898 6 04 83 80 19 70 51
E: 33.564896 6 04 83 60 1a 00 51
E: 33.566892 6 04 87 d0 2b 40 38
E: 33.591902 6 04 83 30 1b 80 50
E: 33.593892 6 04 87 c0 2c f0 37
E: 33.619893 6 04 83 d0 1b 20 50
E: 33.621890 6 04 87 70 2d b0 37
E: 33.646897 6 04 83 50 1c e0 4f
E: 33.648891 6 04 87 40 2e 90 37
E: 33.673890 6 04 87 10 2f 80 37
E: 33.675898 6 04 83 f0 1c 90 4f
E: 33.700897 6 04 83 a0 1d 50 4f
E: 33.702890 6 04 87 e0 2f 80 37
E: 33.727897 6 04 83 50 1e 10 4f
E: 33.729889 6 04 87 90 30 80 37
E: 33.754897 6 04 83 f0 1e d0 4e
E: 33.756890 6 04 87 30 31 90 37
E: 33.781899 6 04 83 50 1f a0 4e
E: 33.783892 6 04 87 90 31 90 37
E: 33.808891 6 04 87 e0 31 90 37
E: 33.810895 6 04 83 a0 1f 80 4e
E: 33.835896 6 04 83 e0 1f 60 4e
E: 33.837889 6 04 87 20 32 90 37
E: 33.863897 6 04 83 40 20 40 4e
E: 33.865889 6 04 87 50 32 90 37
E: 33.890899 6 04 83 70 20 30 4e
E: 33.892889 6 04 87 80 32 90 37
E: 33.917898 6 04 83 a0 20 20 4e
E: 33.919892 6 04 87 a0 32 90 37
E: 33.944891 6 04 87 c0 32 90 37
E: 33.946895 6 04 83 c0 20 10 4e
E: 33.971893 6 04 83 e0 20 00 4e
E: 33.973883 6 04 87 c0 32 90 37
E: 33.998888 6 04 83 e0 20 00 4e
E: 34.000887 6 04 87 e0 32 90 37
E: 34.025892 6 04 83 00 21 00 4e
E: 34.027885 6 04 87 e0 32 90 37
E: 34.052886 6 04 83 00 21 00 4e
E: 34.054890 6 04 87 00 33 90 37
E: 34.079888 6 04 87 00 33 90 37
E: 34.081888 6 04 83 20 21 00 4e
E: 34.106887 6 04 83 20 21 00 4e
E: 34.108882 6 04 87 00 33 90 37
E: 34.134887 6 04 83 20 21 00 4e
E: 34.136882 6 04 87 00 33 90 37
E: 34.161892 6 04 83 40 21 00 4e
E: 34.163885 6 04 87 00 33 90 37
E: 34.220892 6 04 83 90 21 20 4e
E: 34.222888 6 04 82 90 21 20 4e
E: 34.224888 6 04 87 50 33 c0 37
E: 34.226880 6 04 86 50 33 c0 37
# Thank you.
