R: 322 05 0d 09 04 a1 01 85 04 09 22 a1 00 09 42 15 00 25 01 75 01 95 01 81 02 09 32 15 00 25 01 81 02 09 51 75 05 95 01 16 00 00 26 10 00 81 02 09 47 75 01 95 01 15 00 25 01 81 02 05 01 09 30 75 10 95 01 55 0d 65 33 35 00 46 96 4e 26 ff 7f 81 02 09 31 75 10 95 01 55 0d 65 33 35 00 46 23 2c 26 ff 7f 81 02 05 0d 09 55 25 08 75 08 95 01 b1 02 c0 c0 05 01 09 01 a1 01 85 01 09 01 a1 00 05 09 19 01 29 02 15 00 25 01 95 02 75 01 81 02 95 01 75 06 81 01 05 01 09 30 09 31 16 00 00 26 ff 0f 36 00 00 46 ff 0f 66 00 00 75 10 95 02 81 02 c0 c0 06 00 ff 09 01 a1 01 09 01 15 00 26 ff 00 85 03 75 08 95 3f 81 02 06 00 ff 09 01 15 00 26 ff 00 75 08 95 3f 91 02 c0 05 0d 09 04 a1 01 85 02 09 20 a1 00 09 42 09 32 15 00 25 01 95 02 75 01 81 02 95 06 75 01 81 03 05 01 09 30 75 10 95 01 a4 55 0d 65 33 36 00 00 46 96 4e 16 00 00 26 ff 0f 81 02 09 31 16 00 00 26 ff 0f 36 00 00 46 23 2c 81 02 b4 c0 c0 05 0d 09 0e a1 01 85 05 09 22 a1 00 09 52 09 53 15 00 25 0a 75 08 95 02 b1 02 c0 c0
N: eGalax Inc. eGalaxTouch EXC7200-73F4
I: 3 0eef 73f4
# 1. Drag _one_ finger on the screen from one corner to the opposite, and release it.
E: 0.000000 6 04 83 00 00 80 7f
E: 0.008835 6 04 83 00 00 80 7f
E: 0.016736 6 04 83 20 00 60 7f
E: 0.024861 6 04 83 20 00 60 7f
E: 0.032758 6 04 83 20 00 60 7f
E: 0.040946 6 04 83 20 00 60 7f
E: 0.049983 6 04 83 40 00 50 7f
E: 0.057943 6 04 83 40 00 50 7f
E: 0.065980 6 04 83 50 00 30 7f
E: 0.073874 6 04 83 50 00 30 7f
E: 0.081895 6 04 83 50 00 30 7f
E: 0.090937 6 04 83 50 00 30 7f
E: 0.098901 6 04 83 50 00 30 7f
E: 0.106966 6 04 83 50 00 30 7f
E: 0.114959 6 04 83 50 00 30 7f
E: 0.122981 6 04 83 70 00 10 7f
E: 0.131869 6 04 83 70 00 10 7f
E: 0.139759 6 04 83 a0 00 e0 7e
E: 0.147756 6 04 83 a0 00 e0 7e
E: 0.155761 6 04 83 c0 00 d0 7e
E: 0.164762 6 04 83 c0 00 d0 7e
E: 0.172766 6 04 83 00 01 80 7e
E: 0.180930 6 04 83 20 01 60 7e
E: 0.188856 6 04 83 60 01 f0 7d
E: 0.196986 6 04 83 80 01 c0 7d
E: 0.205915 6 04 83 90 01 a0 7d
E: 0.213925 6 04 83 d0 01 30 7d
E: 0.221889 6 04 83 f0 01 00 7d
E: 0.229980 6 04 83 50 02 90 7c
E: 0.237885 6 04 83 80 02 50 7c
E: 0.246918 6 04 83 e0 02 c0 7b
E: 0.254885 6 04 83 40 03 10 7b
E: 0.262980 6 04 83 70 03 c0 7a
E: 0.270891 6 04 83 90 03 90 7a
E: 0.279763 6 04 83 d0 03 10 7a
E: 0.287778 6 04 83 f0 03 d0 79
E: 0.295869 6 04 83 50 04 20 79
E: 0.303878 6 04 83 c0 04 60 78
E: 0.311934 6 04 83 30 05 a0 77
E: 0.320909 6 04 83 60 05 40 77
E: 0.328951 6 04 83 c0 05 b0 76
E: 0.336933 6 04 83 20 06 00 76
E: 0.344952 6 04 83 80 06 40 75
E: 0.352956 6 04 83 b0 06 e0 74
E: 0.361931 6 04 83 00 07 50 74
E: 0.369888 6 04 83 70 07 b0 73
E: 0.377879 6 04 83 e0 07 f0 72
E: 0.385888 6 04 83 10 08 90 72
E: 0.394951 6 04 83 70 08 00 72
E: 0.402938 6 04 83 e0 08 50 71
E: 0.410886 6 04 83 10 09 00 71
E: 0.418934 6 04 83 70 09 60 70
E: 0.426938 6 04 83 f0 09 a0 6f
E: 0.435927 6 04 83 70 0a d0 6e
E: 0.443887 6 04 83 b0 0a 70 6e
E: 0.451882 6 04 83 20 0b c0 6d
E: 0.459856 6 04 83 90 0b 00 6d
E: 0.468936 6 04 83 10 0c 30 6c
E: 0.476931 6 04 83 50 0c d0 6b
E: 0.484886 6 04 83 c0 0c 30 6b
E: 0.492865 6 04 83 30 0d 70 6a
E: 0.500932 6 04 83 b0 0d a0 69
E: 0.509953 6 04 83 30 0e d0 68
E: 0.517972 6 04 83 70 0e 70 68
E: 0.525827 6 04 83 e0 0e c0 67
E: 0.533955 6 04 83 60 0f f0 66
E: 0.542957 6 04 83 e0 0f 20 66
E: 0.550986 6 04 83 60 10 60 65
E: 0.558888 6 04 83 e0 10 a0 64
E: 0.566990 6 04 83 50 11 e0 63
E: 0.574897 6 04 83 90 11 80 63
E: 0.583987 6 04 83 f0 11 e0 62
E: 0.591885 6 04 83 70 12 20 62
E: 0.599916 6 04 83 00 13 50 61
E: 0.607883 6 04 83 80 13 90 60
E: 0.617969 6 04 83 c0 13 30 60
E: 0.625838 6 04 83 30 14 90 5f
E: 0.633912 6 04 83 b0 14 d0 5e
E: 0.641892 6 04 83 40 15 10 5e
E: 0.649931 6 04 83 d0 15 50 5d
E: 0.658925 6 04 83 60 16 90 5c
E: 0.666980 6 04 83 e0 16 d0 5b
E: 0.674900 6 04 83 60 17 20 5b
E: 0.682914 6 04 83 e0 17 70 5a
E: 0.691893 6 04 83 20 18 10 5a
E: 0.699956 6 04 83 80 18 80 59
E: 0.707897 6 04 83 00 19 d0 58
E: 0.715980 6 04 83 90 19 10 58
E: 0.723935 6 04 83 20 1a 50 57
E: 0.732952 6 04 83 60 1a f0 56
E: 0.740893 6 04 83 e0 1a 50 56
E: 0.748925 6 04 83 70 1b 90 55
E: 0.756889 6 04 83 00 1c d0 54
E: 0.765865 6 04 83 40 1c 70 54
E: 0.773887 6 04 83 c0 1c e0 53
E: 0.781953 6 04 83 50 1d 30 53
E: 0.789887 6 04 83 e0 1d 70 52
E: 0.798968 6 04 83 70 1e c0 51
E: 0.806894 6 04 83 c0 1e 70 51
E: 0.814937 6 04 83 30 1f f0 50
E: 0.822883 6 04 83 b0 1f 40 50
E: 0.830915 6 04 83 40 20 90 4f
E: 0.839913 6 04 83 80 20 40 4f
E: 0.847893 6 04 83 00 21 b0 4e
E: 0.855967 6 04 83 90 21 10 4e
E: 0.863913 6 04 83 e0 21 c0 4d
E: 0.872950 6 04 83 60 22 30 4d
E: 0.880913 6 04 83 f0 22 80 4c
E: 0.888912 6 04 83 90 23 d0 4b
E: 0.896976 6 04 83 e0 23 80 4b
E: 0.904875 6 04 83 60 24 00 4b
E: 0.913947 6 04 83 f0 24 60 4a
E: 0.922009 6 04 83 80 25 b0 49
E: 0.929951 6 04 83 c0 25 60 49
E: 0.937969 6 04 83 40 26 e0 48
E: 0.946983 6 04 83 d0 26 50 48
E: 0.954928 6 04 83 10 27 00 48
E: 0.962951 6 04 83 90 27 70 47
E: 0.970952 6 04 83 20 28 d0 46
E: 0.978955 6 04 83 b0 28 30 46
E: 0.987989 6 04 83 f0 28 e0 45
E: 0.995914 6 04 83 70 29 60 45
E: 1.003974 6 04 83 00 2a b0 44
E: 1.011895 6 04 83 80 2a 00 44
E: 1.020982 6 04 83 c0 2a b0 43
E: 1.028962 6 04 83 30 2b 20 43
E: 1.036968 6 04 83 b0 2b 90 42
E: 1.044969 6 04 83 f0 2b 40 42
E: 1.052953 6 04 83 60 2c b0 41
E: 1.061934 6 04 83 f0 2c 10 41
E: 1.069907 6 04 83 80 2d 60 40
E: 1.077975 6 04 83 c0 2d 10 40
E: 1.085967 6 04 83 30 2e 90 3f
E: 1.094934 6 04 83 c0 2e 00 3f
E: 1.102894 6 04 83 50 2f 60 3e
E: 1.110911 6 04 83 90 2f 10 3e
E: 1.118972 6 04 83 00 30 90 3d
E: 1.127884 6 04 83 90 30 f0 3c
E: 1.135764 6 04 83 d0 30 a0 3c
E: 1.143760 6 04 83 40 31 30 3c
E: 1.151756 6 04 83 d0 31 90 3b
E: 1.159765 6 04 83 60 32 f0 3a
E: 1.168767 6 04 83 a0 32 a0 3a
E: 1.176893 6 04 83 20 33 20 3a
E: 1.184941 6 04 83 b0 33 a0 39
E: 1.192868 6 04 83 f0 33 60 39
E: 1.201991 6 04 83 70 34 e0 38
E: 1.209912 6 04 83 00 35 40 38
E: 1.217960 6 04 83 90 35 b0 37
E: 1.225919 6 04 83 20 36 20 37
E: 1.233979 6 04 83 60 36 e0 36
E: 1.242977 6 04 83 d0 36 70 36
E: 1.250908 6 04 83 10 37 40 36
E: 1.258910 6 04 83 80 37 d0 35
E: 1.266915 6 04 83 20 38 40 35
E: 1.275946 6 04 83 70 38 00 35
E: 1.283979 6 04 83 f0 38 90 34
E: 1.291947 6 04 83 90 39 10 34
E: 1.299914 6 04 83 e0 39 d0 33
E: 1.307834 6 04 83 70 3a 60 33
E: 1.316927 6 04 83 00 3b d0 32
E: 1.324960 6 04 83 a0 3b 30 32
E: 1.332946 6 04 83 f0 3b e0 31
E: 1.340959 6 04 83 70 3c 70 31
E: 1.349882 6 04 83 00 3d f0 30
E: 1.357905 6 04 83 50 3d b0 30
E: 1.365959 6 04 83 d0 3d 40 30
E: 1.373905 6 04 83 70 3e c0 2f
E: 1.382952 6 04 83 10 3f 30 2f
E: 1.390957 6 04 83 60 3f e0 2e
E: 1.398971 6 04 83 e0 3f 70 2e
E: 1.406972 6 04 83 80 40 f0 2d
E: 1.414950 6 04 83 d0 40 b0 2d
E: 1.423958 6 04 83 50 41 40 2d
E: 1.431975 6 04 83 f0 41 b0 2c
E: 1.439949 6 04 83 40 42 70 2c
E: 1.447964 6 04 83 c0 42 00 2c
E: 1.456922 6 04 83 60 43 80 2b
E: 1.464890 6 04 83 b0 43 40 2b
E: 1.472952 6 04 83 40 44 d0 2a
E: 1.480909 6 04 83 f0 44 60 2a
E: 1.489955 6 04 83 a0 45 e0 29
E: 1.497936 6 04 83 f0 45 a0 29
E: 1.505947 6 04 83 80 46 30 29
E: 1.513939 6 04 83 20 47 b0 28
E: 1.521957 6 04 83 70 47 70 28
E: 1.530981 6 04 83 00 48 10 28
E: 1.538921 6 04 83 b0 48 a0 27
E: 1.546938 6 04 83 60 49 20 27
E: 1.554963 6 04 83 b0 49 e0 26
E: 1.563991 6 04 83 40 4a 70 26
E: 1.571978 6 04 83 e0 4a f0 25
E: 1.579971 6 04 83 80 4b 70 25
E: 1.587991 6 04 83 d0 4b 30 25
E: 1.595942 6 04 83 60 4c d0 24
E: 1.604956 6 04 83 10 4d 70 24
E: 1.612906 6 04 83 c0 4d 00 24
E: 1.620942 6 04 83 10 4e c0 23
E: 1.628956 6 04 83 a0 4e 60 23
E: 1.637979 6 04 83 50 4f f0 22
E: 1.645889 6 04 83 a0 4f b0 22
E: 1.653921 6 04 83 30 50 50 22
E: 1.661974 6 04 83 e0 50 f0 21
E: 1.670950 6 04 83 40 51 c0 21
E: 1.678982 6 04 83 e0 51 50 21
E: 1.686950 6 04 83 90 52 d0 20
E: 1.694908 6 04 83 f0 52 90 20
E: 1.703946 6 04 83 90 53 20 20
E: 1.711971 6 04 83 40 54 b0 1f
E: 1.719943 6 04 83 a0 54 70 1f
E: 1.727902 6 04 83 40 55 10 1f
E: 1.735939 6 04 83 f0 55 b0 1e
E: 1.744994 6 04 83 a0 56 30 1e
E: 1.752935 6 04 83 50 57 b0 1d
E: 1.760984 6 04 83 b0 57 70 1d
E: 1.768966 6 04 83 50 58 10 1d
E: 1.777843 6 04 83 00 59 a0 1c
E: 1.785971 6 04 83 50 59 60 1c
E: 1.793982 6 04 83 f0 59 10 1c
E: 1.801897 6 04 83 a0 5a b0 1b
E: 1.810959 6 04 83 50 5b 40 1b
E: 1.818962 6 04 83 00 5c c0 1a
E: 1.826951 6 04 83 60 5c 80 1a
E: 1.834895 6 04 83 f0 5c 20 1a
E: 1.842955 6 04 83 a0 5d b0 19
E: 1.851827 6 04 83 f0 5d 70 19
E: 1.859922 6 04 83 80 5e 10 19
E: 1.867899 6 04 83 30 5f a0 18
E: 1.875945 6 04 83 f0 5f 20 18
E: 1.884911 6 04 83 50 60 e0 17
E: 1.892838 6 04 83 e0 60 70 17
E: 1.900742 6 04 83 90 61 00 17
E: 1.908791 6 04 83 e0 61 c0 16
E: 1.917826 6 04 83 80 62 60 16
E: 1.925895 6 04 83 30 63 00 16
E: 1.933880 6 04 83 e0 63 80 15
E: 1.941941 6 04 83 90 64 00 15
E: 1.950912 6 04 83 e0 64 c0 14
E: 1.958925 6 04 83 60 65 50 14
E: 1.966911 6 04 83 00 66 e0 13
E: 1.974967 6 04 83 50 66 a0 13
E: 1.982904 6 04 83 e0 66 40 13
E: 1.991978 6 04 83 80 67 c0 12
E: 1.999956 6 04 83 20 68 40 12
E: 2.007903 6 04 83 70 68 00 12
E: 2.015905 6 04 83 00 69 90 11
E: 2.024896 6 04 83 40 69 60 11
E: 2.032906 6 04 83 c0 69 00 11
E: 2.040955 6 04 83 00 6a d0 10
E: 2.048853 6 04 83 90 6a 70 10
E: 2.057944 6 04 83 40 6b e0 0f
E: 2.065924 6 04 83 90 6b a0 0f
E: 2.073966 6 04 83 10 6c 20 0f
E: 2.081940 6 04 83 b0 6c a0 0e
E: 2.089968 6 04 83 00 6d 60 0e
E: 2.098910 6 04 83 70 6d f0 0d
E: 2.106834 6 04 83 b0 6d c0 0d
E: 2.114950 6 04 83 30 6e 60 0d
E: 2.122795 6 04 83 c0 6e e0 0c
E: 2.131840 6 04 83 00 6f a0 0c
E: 2.139934 6 04 83 70 6f 30 0c
E: 2.147982 6 04 83 b0 6f f0 0b
E: 2.155970 6 04 83 30 70 90 0b
E: 2.164761 6 04 83 70 70 60 0b
E: 2.172746 6 04 83 e0 70 00 0b
E: 2.180754 6 04 83 20 71 d0 0a
E: 2.188754 6 04 83 a0 71 80 0a
E: 2.197758 6 04 83 e0 71 50 0a
E: 2.205756 6 04 83 50 72 e0 09
E: 2.213942 6 04 83 90 72 b0 09
E: 2.221937 6 04 83 10 73 40 09
E: 2.229897 6 04 83 50 73 10 09
E: 2.238931 6 04 83 c0 73 b0 08
E: 2.246902 6 04 83 00 74 80 08
E: 2.254937 6 04 83 20 74 60 08
E: 2.262963 6 04 83 90 74 10 08
E: 2.271940 6 04 83 d0 74 f0 07
E: 2.279942 6 04 83 50 75 a0 07
E: 2.287905 6 04 83 90 75 70 07
E: 2.295971 6 04 83 b0 75 60 07
E: 2.304923 6 04 83 20 76 00 07
E: 2.312966 6 04 83 b0 76 80 06
E: 2.320979 6 04 83 00 77 40 06
E: 2.328900 6 04 83 20 77 20 06
E: 2.337919 6 04 83 20 77 20 06
E: 2.345955 6 04 83 90 77 c0 05
E: 2.353849 6 04 83 c0 77 a0 05
E: 2.361902 6 04 83 e0 77 90 05
E: 2.369890 6 04 83 50 78 40 05
E: 2.378945 6 04 83 80 78 20 05
E: 2.386889 6 04 83 a0 78 10 05
E: 2.394919 6 04 83 a0 78 10 05
E: 2.402876 6 04 83 10 79 c0 04
E: 2.411977 6 04 83 40 79 a0 04
E: 2.419869 6 04 83 40 79 a0 04
E: 2.427948 6 04 83 d0 79 60 04
E: 2.435897 6 04 83 00 7a 40 04
E: 2.444888 6 04 83 20 7a 30 04
E: 2.452838 6 04 83 20 7a 30 04
E: 2.460927 6 04 83 20 7a 30 04
E: 2.468898 6 04 83 90 7a f0 03
E: 2.477952 6 04 83 c0 7a d0 03
E: 2.485909 6 04 83 c0 7a d0 03
E: 2.493942 6 04 83 e0 7a c0 03
E: 2.501918 6 04 83 40 7b 80 03
E: 2.509950 6 04 83 70 7b 60 03
E: 2.518919 6 04 83 e0 7b 00 03
E: 2.526963 6 04 83 10 7c d0 02
E: 2.534896 6 04 83 30 7c c0 02
E: 2.542923 6 04 83 30 7c c0 02
E: 2.551928 6 04 83 30 7c c0 02
E: 2.559891 6 04 83 30 7c c0 02
E: 2.567964 6 04 83 90 7c 60 02
E: 2.575950 6 04 83 b0 7c 30 02
E: 2.584924 6 04 83 b0 7c 30 02
E: 2.592902 6 04 83 d0 7c 10 02
E: 2.600879 6 04 83 10 7d d0 01
E: 2.608957 6 04 83 30 7d b0 01
E: 2.616918 6 04 83 30 7d b0 01
E: 2.625970 6 04 83 40 7d 90 01
E: 2.633950 6 04 83 40 7d 90 01
E: 2.641935 6 04 83 40 7d 90 01
E: 2.649944 6 04 83 40 7d 90 01
E: 2.657944 6 04 83 40 7d 90 01
E: 2.666923 6 04 83 40 7d 90 01
E: 2.674929 6 04 83 70 7d 60 01
E: 2.682955 6 04 83 90 7d 40 01
E: 2.690936 6 04 83 90 7d 40 01
E: 2.699923 6 04 83 90 7d 40 01
E: 2.707919 6 04 83 90 7d 40 01
E: 2.715968 6 04 83 c0 7d 10 01
E: 2.723953 6 04 83 c0 7d 10 01
E: 2.731945 6 04 83 e0 7d f0 00
E: 2.740954 6 04 83 e0 7d f0 00
E: 2.748882 6 04 83 e0 7d f0 00
E: 2.756916 6 04 83 e0 7d f0 00
E: 2.764920 6 04 83 e0 7d f0 00
E: 2.773942 6 04 83 e0 7d f0 00
E: 2.781953 6 04 83 00 7e e0 00
E: 2.789890 6 04 83 00 7e e0 00
E: 2.797918 6 04 83 00 7e e0 00
E: 2.805917 6 04 83 00 7e e0 00
E: 2.814951 6 04 83 00 7e e0 00
E: 2.822896 6 04 83 00 7e e0 00
E: 2.830942 6 04 83 00 7e e0 00
E: 2.838936 6 04 83 00 7e e0 00
E: 2.846878 6 04 83 00 7e e0 00
E: 2.855926 6 04 83 00 7e e0 00
E: 2.863879 6 04 83 00 7e e0 00
E: 2.871906 6 04 83 00 7e e0 00
E: 2.879941 6 04 83 00 7e e0 00
E: 2.888927 6 04 83 00 7e e0 00
E: 2.897917 6 04 83 00 7e e0 00
E: 2.905874 6 04 83 00 7e e0 00
E: 2.913942 6 04 83 00 7e e0 00
E: 2.921824 6 04 83 00 7e e0 00
E: 2.930923 6 04 83 00 7e e0 00
E: 2.938878 6 04 83 00 7e e0 00
E: 2.946854 6 04 83 00 7e e0 00
E: 2.954903 6 04 83 00 7e e0 00
E: 2.962945 6 04 83 00 7e e0 00
E: 2.971936 6 04 83 00 7e e0 00
E: 2.979881 6 04 83 00 7e e0 00
E: 2.987862 6 04 83 00 7e e0 00
E: 2.995921 6 04 83 00 7e e0 00
E: 3.004899 6 04 83 00 7e e0 00
E: 3.012938 6 04 83 00 7e e0 00
E: 3.020880 6 04 83 00 7e e0 00
E: 3.028883 6 04 83 00 7e e0 00
E: 3.036941 6 04 83 00 7e e0 00
E: 3.045879 6 04 83 00 7e e0 00
E: 3.053882 6 04 83 00 7e e0 00
E: 3.061882 6 04 83 00 7e e0 00
E: 3.069916 6 04 83 00 7e e0 00
E: 3.078921 6 04 83 00 7e e0 00
E: 3.086946 6 04 83 00 7e e0 00
E: 3.094883 6 04 83 00 7e e0 00
E: 3.102841 6 04 83 40 7e c0 00
E: 3.110964 6 04 83 90 7e a0 00
E: 3.120001 6 04 83 b0 7e 90 00
E: 3.127960 6 04 83 f0 7e 70 00
E: 3.135940 6 04 83 30 7f 50 00
E: 3.143933 6 04 83 50 7f 60 00
E: 3.151893 6 04 83 70 7f 50 00
E: 3.160840 6 04 83 70 7f 50 00
E: 3.168827 6 04 83 a0 7f 60 00
E: 3.176745 6 04 83 c0 7f 50 00
E: 3.184736 6 04 83 c0 7f 50 00
E: 3.193745 6 04 83 c0 7f 50 00
E: 3.201743 6 04 83 c0 7f 50 00
E: 3.209746 6 04 83 a0 7f 40 00
E: 3.217889 6 04 83 a0 7f 40 00
E: 3.225934 6 04 83 b0 7f 20 00
E: 3.234919 6 04 83 b0 7f 20 00
E: 3.242947 6 04 83 b0 7f 20 00
E: 3.250960 6 04 83 d0 7f 30 00
E: 3.258833 6 04 83 d0 7f 30 00
E: 3.267946 6 04 83 d0 7f 30 00
E: 3.275940 6 04 83 d0 7f 30 00
E: 3.283943 6 04 83 d0 7f 30 00
E: 3.291877 6 04 83 d0 7f 30 00
E: 3.299946 6 04 83 d0 7f 30 00
E: 3.308932 6 04 83 d0 7f 30 00
E: 3.316961 6 04 83 c0 7f 10 00
E: 3.324896 6 04 83 c0 7f 10 00
E: 3.332880 6 04 83 c0 7f 10 00
E: 3.340919 6 04 83 b0 7f 30 00
E: 3.387943 6 04 83 b0 7f 50 00
E: 3.388763 6 04 82 b0 7f 50 00
# 2. Land one finger,
   - land a second finger far enough from the first
   - move your two fingers
   - release the *first* finger
   - release the second finger
E: 10.289838 6 04 83 c0 44 90 47
E: 10.297725 6 04 83 c0 44 90 47
E: 10.305652 6 04 83 b0 44 70 47
E: 10.313698 6 04 83 b0 44 50 47
E: 10.322686 6 04 83 b0 44 50 47
E: 10.330701 6 04 83 b0 44 20 47
E: 10.338701 6 04 83 c0 44 00 47
E: 10.346799 6 04 83 c0 44 d0 46
E: 10.355747 6 04 83 d0 44 b0 46
E: 10.363818 6 04 83 d0 44 b0 46
E: 10.371861 6 04 83 f0 44 60 46
E: 10.379861 6 04 83 10 45 00 46
E: 10.387838 6 04 83 30 45 a0 45
E: 10.396843 6 04 83 50 45 50 45
E: 10.404829 6 04 83 70 45 10 45
E: 10.415819 6 04 83 90 45 c0 44
E: 10.426706 6 04 83 b0 45 60 44
E: 10.438721 6 04 83 d0 45 f0 43
E: 10.439737 6 04 87 a0 31 90 48
E: 10.450859 6 04 87 a0 31 90 48
E: 10.451806 6 04 83 f0 45 80 43
E: 10.462878 6 04 83 10 46 00 43
E: 10.463835 6 04 87 80 31 70 48
E: 10.473866 6 04 87 50 31 50 48
E: 10.474793 6 04 83 30 46 80 42
E: 10.485875 6 04 83 50 46 10 42
E: 10.486762 6 04 87 10 31 30 48
E: 10.497883 6 04 87 f0 30 20 48
E: 10.498787 6 04 83 60 46 d0 41
E: 10.508687 6 04 83 80 46 60 41
E: 10.509656 6 04 87 f0 30 20 48
E: 10.520711 6 04 87 90 30 00 48
E: 10.521685 6 04 83 b0 46 d0 40
E: 10.532774 6 04 83 d0 46 90 40
E: 10.533752 6 04 87 20 30 e0 47
E: 10.544781 6 04 87 b0 2f b0 47
E: 10.545749 6 04 83 00 47 20 40
E: 10.556779 6 04 83 30 47 90 3f
E: 10.557750 6 04 87 30 2f a0 47
E: 10.568810 6 04 87 b0 2e a0 47
E: 10.569730 6 04 83 50 47 50 3f
E: 10.580777 6 04 83 80 47 e0 3e
E: 10.581708 6 04 87 30 2e 80 47
E: 10.592736 6 04 87 b0 2d 90 47
E: 10.593754 6 04 83 c0 47 50 3e
E: 10.605801 6 04 83 10 48 c0 3d
E: 10.606740 6 04 87 40 2d 90 47
E: 10.617745 6 04 87 d0 2c 70 47
E: 10.618686 6 04 83 30 48 70 3d
E: 10.629820 6 04 83 70 48 00 3d
E: 10.630682 6 04 87 60 2c 60 47
E: 10.642715 6 04 87 f0 2b 40 47
E: 10.643682 6 04 83 90 48 d0 3c
E: 10.654779 6 04 83 d0 48 70 3c
E: 10.655758 6 04 87 80 2b 20 47
E: 10.666864 6 04 87 20 2b 10 47
E: 10.667780 6 04 83 f0 48 40 3c
E: 10.679774 6 04 83 30 49 e0 3b
E: 10.680747 6 04 87 c0 2a f0 46
E: 10.691686 6 04 87 60 2a d0 46
E: 10.692648 6 04 83 80 49 60 3b
E: 10.704666 6 04 83 d0 49 e0 3a
E: 10.705656 6 04 87 10 2a e0 46
E: 10.717708 6 04 87 c0 29 d0 46
E: 10.718659 6 04 83 00 4a a0 3a
E: 10.729739 6 04 83 10 4a 80 3a
E: 10.730724 6 04 87 70 29 d0 46
E: 10.742693 6 04 87 20 29 d0 46
E: 10.743659 6 04 83 50 4a 20 3a
E: 10.755823 6 04 83 70 4a f0 39
E: 10.756797 6 04 87 d0 28 d0 46
E: 10.767881 6 04 87 80 28 e0 46
E: 10.768772 6 04 83 c0 4a 90 39
E: 10.780734 6 04 83 e0 4a 60 39
E: 10.781716 6 04 87 60 28 e0 46
E: 10.793702 6 04 87 20 28 f0 46
E: 10.794692 6 04 83 30 4b 00 39
E: 10.806780 6 04 83 50 4b d0 38
E: 10.807739 6 04 87 d0 27 10 47
E: 10.818909 6 04 87 70 27 30 47
E: 10.819774 6 04 83 50 4b d0 38
E: 10.831844 6 04 83 b0 4b 60 38
E: 10.832767 6 04 87 20 27 40 47
E: 10.844737 6 04 87 f0 26 40 47
E: 10.845704 6 04 83 d0 4b 30 38
E: 10.857712 6 04 83 20 4c d0 37
E: 10.858643 6 04 87 f0 26 40 47
E: 10.870771 6 04 87 a0 26 50 47
E: 10.871665 6 04 83 80 4c 60 37
E: 10.883745 6 04 83 b0 4c 30 37
E: 10.884726 6 04 87 50 26 60 47
E: 10.896719 6 04 87 00 26 70 47
E: 10.897669 6 04 83 c0 4c 10 37
E: 10.909861 6 04 83 c0 4c 10 37
E: 10.910774 6 04 87 d0 25 70 47
E: 10.922833 6 04 87 90 25 80 47
E: 10.923741 6 04 83 10 4d c0 36
E: 10.935765 6 04 83 30 4d a0 36
E: 10.936737 6 04 87 70 25 80 47
E: 10.948768 6 04 87 40 25 90 47
E: 10.949694 6 04 83 80 4d 50 36
E: 10.961730 6 04 83 a0 4d 30 36
E: 10.962721 6 04 87 40 25 90 47
E: 10.975811 6 04 87 20 25 90 47
E: 10.976745 6 04 83 a0 4d 30 36
E: 10.988901 6 04 83 c0 4d 10 36
E: 10.989681 6 04 87 e0 24 a0 47
E: 11.001880 6 04 87 90 24 b0 47
E: 11.002788 6 04 83 00 4e d0 35
E: 11.014719 6 04 83 20 4e b0 35
E: 11.015667 6 04 87 40 24 c0 47
E: 11.027706 6 04 87 20 24 c0 47
E: 11.028685 6 04 83 20 4e b0 35
E: 11.040788 6 04 83 40 4e a0 35
E: 11.041691 6 04 87 f0 23 d0 47
E: 11.053823 6 04 87 d0 23 d0 47
E: 11.054848 6 04 83 40 4e a0 35
E: 11.066821 6 04 83 90 4e 70 35
E: 11.067762 6 04 87 a0 23 e0 47
E: 11.079808 6 04 87 80 23 f0 47
E: 11.080782 6 04 83 b0 4e 50 35
E: 11.092708 6 04 83 b0 4e 50 35
E: 11.093862 6 04 87 80 23 f0 47
E: 11.105807 6 04 87 80 23 f0 47
E: 11.106774 6 04 83 10 4f 00 35
E: 11.119720 6 04 83 30 4f e0 34
E: 11.120697 6 04 87 30 23 20 48
E: 11.132804 6 04 87 10 23 40 48
E: 11.133792 6 04 83 90 4f a0 34
E: 11.146674 6 04 83 c0 4f 80 34
E: 11.147703 6 04 87 10 23 40 48
E: 11.159691 6 04 87 c0 22 80 48
E: 11.160647 6 04 83 c0 4f 80 34
E: 11.173758 6 04 83 e0 4f 70 34
E: 11.174657 6 04 87 a0 22 a0 48
E: 11.186682 6 04 87 a0 22 a0 48
E: 11.187678 6 04 83 e0 4f 70 34
E: 11.199797 6 04 83 20 50 40 34
E: 11.200728 6 04 87 a0 22 a0 48
E: 11.213752 6 04 87 50 22 e0 48
E: 11.214814 6 04 83 80 50 10 34
E: 11.226778 6 04 83 b0 50 00 34
E: 11.227736 6 04 87 30 22 00 49
E: 11.240671 6 04 87 30 22 00 49
E: 11.241642 6 04 83 b0 50 00 34
E: 11.253878 6 04 83 00 51 e0 33
E: 11.254800 6 04 87 30 22 00 49
E: 11.266845 6 04 87 d0 21 40 49
E: 11.267709 6 04 83 20 51 e0 33
E: 11.280876 6 04 83 20 51 e0 33
E: 11.281800 6 04 87 b0 21 60 49
E: 11.293817 6 04 87 60 21 a0 49
E: 11.294654 6 04 83 20 51 e0 33
E: 11.307693 6 04 83 60 51 d0 33
E: 11.308629 6 04 87 30 21 c0 49
E: 11.320656 6 04 87 30 21 c0 49
E: 11.321617 6 04 83 60 51 d0 33
E: 11.334705 6 04 83 b0 51 b0 33
E: 11.335846 6 04 87 e0 20 00 4a
E: 11.347700 6 04 87 c0 20 20 4a
E: 11.348666 6 04 83 d0 51 b0 33
E: 11.360879 6 04 83 d0 51 b0 33
E: 11.361779 6 04 87 c0 20 20 4a
E: 11.374900 6 04 87 a0 20 30 4a
E: 11.375785 6 04 83 10 52 c0 33
E: 11.387889 6 04 83 10 52 c0 33
E: 11.388799 6 04 87 70 20 80 4a
E: 11.401863 6 04 87 50 20 a0 4a
E: 11.402814 6 04 83 30 52 c0 33
E: 11.414872 6 04 83 60 52 d0 33
E: 11.415713 6 04 87 20 20 f0 4a
E: 11.427685 6 04 87 00 20 20 4b
E: 11.428701 6 04 83 60 52 d0 33
E: 11.441827 6 04 83 80 52 d0 33
E: 11.442749 6 04 87 c0 1f 70 4b
E: 11.454809 6 04 87 a0 1f a0 4b
E: 11.455772 6 04 83 80 52 d0 33
E: 11.468823 6 04 83 80 52 d0 33
E: 11.469767 6 04 87 a0 1f a0 4b
E: 11.481845 6 04 87 90 1f c0 4b
E: 11.482756 6 04 83 80 52 d0 33
E: 11.495895 6 04 83 b0 52 e0 33
E: 11.496707 6 04 87 60 1f 00 4c
E: 11.508907 6 04 87 40 1f 20 4c
E: 11.509779 6 04 83 b0 52 e0 33
E: 11.521901 6 04 83 f0 52 10 34
E: 11.522745 6 04 87 40 1f 20 4c
E: 11.535808 6 04 87 30 1f 40 4c
E: 11.536782 6 04 83 10 53 20 34
E: 11.548749 6 04 83 10 53 20 34
E: 11.549691 6 04 87 00 1f 80 4c
E: 11.562724 6 04 87 f0 1e a0 4c
E: 11.563853 6 04 83 10 53 20 34
E: 11.575861 6 04 83 10 53 20 34
E: 11.576643 6 04 87 f0 1e a0 4c
E: 11.589851 6 04 87 b0 1e 00 4d
E: 11.590781 6 04 83 10 53 20 34
E: 11.602872 6 04 83 10 53 20 34
E: 11.603768 6 04 87 a0 1e 20 4d
E: 11.615863 6 04 87 70 1e 80 4d
E: 11.616782 6 04 83 60 53 60 34
E: 11.629837 6 04 83 80 53 70 34
E: 11.631180 6 04 87 60 1e b0 4d
E: 11.642886 6 04 87 50 1e d0 4d
E: 11.643786 6 04 83 c0 53 a0 34
E: 11.656892 6 04 83 e0 53 c0 34
E: 11.657755 6 04 87 50 1e d0 4d
E: 11.669690 6 04 87 30 1e 30 4e
E: 11.670689 6 04 83 e0 53 c0 34
E: 11.683825 6 04 83 e0 53 c0 34
E: 11.684716 6 04 87 20 1e 50 4e
E: 11.696717 6 04 87 20 1e 50 4e
E: 11.697671 6 04 83 e0 53 c0 34
E: 11.709831 6 04 83 e0 53 c0 34
E: 11.710693 6 04 87 20 1e 70 4e
E: 11.723827 6 04 87 20 1e 70 4e
E: 11.724768 6 04 83 e0 53 c0 34
E: 11.736807 6 04 83 e0 53 c0 34
E: 11.737758 6 04 87 00 1e c0 4e
E: 11.750804 6 04 87 f0 1d e0 4e
E: 11.751752 6 04 83 30 54 00 35
E: 11.763835 6 04 83 80 54 40 35
E: 11.764714 6 04 87 f0 1d e0 4e
E: 11.776895 6 04 87 e0 1d 00 4f
E: 11.777783 6 04 83 a0 54 60 35
E: 11.790861 6 04 83 a0 54 60 35
E: 11.791795 6 04 87 c0 1d 50 4f
E: 11.803909 6 04 87 b0 1d 70 4f
E: 11.804783 6 04 83 c0 54 80 35
E: 11.817811 6 04 83 c0 54 80 35
E: 11.818834 6 04 87 b0 1d 70 4f
E: 11.830715 6 04 87 a0 1d 90 4f
E: 11.831728 6 04 83 00 55 b0 35
E: 11.844773 6 04 83 20 55 d0 35
E: 11.845719 6 04 87 80 1d e0 4f
E: 11.857908 6 04 87 70 1d 00 50
E: 11.858778 6 04 83 20 55 d0 35
E: 11.870880 6 04 83 70 55 10 36
E: 11.871751 6 04 87 60 1d 50 50
E: 11.884916 6 04 87 50 1d 70 50
E: 11.885790 6 04 83 90 55 20 36
E: 11.897746 6 04 83 c0 55 70 36
E: 11.898688 6 04 87 40 1d c0 50
E: 11.911799 6 04 87 30 1d 10 51
E: 11.912691 6 04 83 e0 55 90 36
E: 11.924783 6 04 83 e0 55 90 36
E: 11.925721 6 04 87 30 1d 60 51
E: 11.938881 6 04 87 30 1d 90 51
E: 11.939785 6 04 83 f0 55 b0 36
E: 11.951841 6 04 83 20 56 f0 36
E: 11.952780 6 04 87 20 1d d0 51
E: 11.964901 6 04 87 20 1d f0 51
E: 11.965785 6 04 83 30 56 10 37
E: 11.978807 6 04 83 30 56 10 37
E: 11.979785 6 04 87 20 1d 20 52
E: 11.991881 6 04 87 20 1d 60 52
E: 11.992701 6 04 83 60 56 70 37
E: 12.005888 6 04 83 70 56 90 37
E: 12.006709 6 04 87 20 1d 80 52
E: 12.019797 6 04 87 20 1d 80 52
E: 12.020736 6 04 83 70 56 90 37
E: 12.033743 6 04 83 b0 56 f0 37
E: 12.034665 6 04 87 20 1d c0 52
E: 12.046814 6 04 87 20 1d 00 53
E: 12.047752 6 04 83 d0 56 10 38
E: 12.059883 6 04 83 d0 56 10 38
E: 12.060801 6 04 87 20 1d 20 53
E: 12.073873 6 04 87 20 1d 50 53
E: 12.074793 6 04 83 e0 56 30 38
E: 12.086848 6 04 83 10 57 70 38
E: 12.087665 6 04 87 20 1d 90 53
E: 12.100871 6 04 87 20 1d e0 53
E: 12.101776 6 04 83 30 57 90 38
E: 12.113827 6 04 83 30 57 90 38
E: 12.114772 6 04 87 20 1d 00 54
E: 12.127816 6 04 87 20 1d 40 54
E: 12.128765 6 04 83 70 57 00 39
E: 12.140693 6 04 83 80 57 30 39
E: 12.141680 6 04 87 20 1d 80 54
E: 12.153685 6 04 87 20 1d a0 54
E: 12.154718 6 04 83 b0 57 90 39
E: 12.167725 6 04 83 c0 57 c0 39
E: 12.168657 6 04 87 30 1d e0 54
E: 12.180706 6 04 87 30 1d 00 55
E: 12.181758 6 04 83 d0 57 e0 39
E: 12.194850 6 04 83 d0 57 e0 39
E: 12.195766 6 04 87 30 1d 30 55
E: 12.207872 6 04 87 30 1d 30 55
E: 12.208762 6 04 83 d0 57 e0 39
E: 12.220853 6 04 83 f0 57 40 3a
E: 12.221752 6 04 87 30 1d 50 55
E: 12.234885 6 04 87 30 1d 70 55
E: 12.235763 6 04 83 00 58 70 3a
E: 12.247826 6 04 83 00 58 70 3a
E: 12.248770 6 04 87 30 1d b0 55
E: 12.261883 6 04 87 40 1d d0 55
E: 12.262760 6 04 83 30 58 d0 3a
E: 12.274688 6 04 83 40 58 00 3b
E: 12.275682 6 04 87 40 1d 00 56
E: 12.288721 6 04 87 40 1d 20 56
E: 12.289638 6 04 83 40 58 00 3b
E: 12.301766 6 04 83 50 58 20 3b
E: 12.302652 6 04 87 40 1d 50 56
E: 12.314737 6 04 87 50 1d a0 56
E: 12.315769 6 04 83 80 58 70 3b
E: 12.328675 6 04 83 90 58 90 3b
E: 12.329644 6 04 87 50 1d f0 56
E: 12.341666 6 04 87 50 1d 30 57
E: 12.342641 6 04 83 c0 58 00 3c
E: 12.355673 6 04 83 d0 58 30 3c
E: 12.356647 6 04 87 60 1d 50 57
E: 12.368751 6 04 87 60 1d 50 57
E: 12.369740 6 04 83 00 59 90 3c
E: 12.382675 6 04 83 30 59 00 3d
E: 12.383679 6 04 87 60 1d 70 57
E: 12.395863 6 04 87 60 1d 70 57
E: 12.396801 6 04 83 50 59 60 3d
E: 12.408834 6 04 83 60 59 90 3d
E: 12.409787 6 04 87 80 1d b0 57
E: 12.422886 6 04 87 90 1d d0 57
E: 12.423792 6 04 83 80 59 e0 3d
E: 12.435905 6 04 83 a0 59 30 3e
E: 12.436776 6 04 87 b0 1d 20 58
E: 12.449835 6 04 87 d0 1d 80 58
E: 12.450801 6 04 83 c0 59 80 3e
E: 12.462788 6 04 83 e0 59 d0 3e
E: 12.463729 6 04 87 f0 1d f0 58
E: 12.476668 6 04 87 f0 1d 60 59
E: 12.477672 6 04 83 00 5a 30 3f
E: 12.489708 6 04 83 20 5a 90 3f
E: 12.490691 6 04 87 00 1e d0 59
E: 12.502759 6 04 87 10 1e 40 5a
E: 12.503678 6 04 83 30 5a c0 3f
E: 12.516709 6 04 83 30 5a e0 3f
E: 12.517779 6 04 87 20 1e a0 5a
E: 12.529876 6 04 87 20 1e f0 5a
E: 12.530779 6 04 83 50 5a 30 40
E: 12.543872 6 04 83 80 5a a0 40
E: 12.544754 6 04 87 20 1e 40 5b
E: 12.556892 6 04 87 30 1e 90 5b
E: 12.557780 6 04 83 a0 5a e0 40
E: 12.569734 6 04 83 d0 5a 50 41
E: 12.570617 6 04 87 40 1e e0 5b
E: 12.583816 6 04 87 40 1e 30 5c
E: 12.584637 6 04 83 00 5b e0 41
E: 12.596835 6 04 83 10 5b 30 42
E: 12.597758 6 04 87 50 1e 90 5c
E: 12.610801 6 04 87 60 1e f0 5c
E: 12.611748 6 04 83 40 5b b0 42
E: 12.623847 6 04 83 70 5b 30 43
E: 12.624762 6 04 87 70 1e 50 5d
E: 12.636740 6 04 87 70 1e a0 5d
E: 12.637784 6 04 83 80 5b 70 43
E: 12.650651 6 04 83 b0 5b d0 43
E: 12.651613 6 04 87 80 1e f0 5d
E: 12.663815 6 04 87 80 1e 30 5e
E: 12.664758 6 04 83 f0 5b 50 44
E: 12.677767 6 04 83 30 5c e0 44
E: 12.678793 6 04 87 90 1e 50 5e
E: 12.690831 6 04 87 90 1e 90 5e
E: 12.691775 6 04 83 50 5c 20 45
E: 12.704773 6 04 83 80 5c 90 45
E: 12.705726 6 04 87 a0 1e d0 5e
E: 12.717679 6 04 87 a0 1e f0 5e
E: 12.718645 6 04 83 c0 5c 00 46
E: 12.730782 6 04 83 e0 5c 40 46
E: 12.731749 6 04 87 a0 1e 40 5f
E: 12.744903 6 04 87 b0 1e 90 5f
E: 12.745778 6 04 83 20 5d a0 46
E: 12.757870 6 04 83 40 5d d0 46
E: 12.758748 6 04 87 b0 1e e0 5f
E: 12.771808 6 04 87 b0 1e 10 60
E: 12.772696 6 04 83 80 5d 30 47
E: 12.784717 6 04 83 c0 5d b0 47
E: 12.785712 6 04 87 b0 1e 50 60
E: 12.797683 6 04 87 c0 1e 90 60
E: 12.798734 6 04 83 e0 5d f0 47
E: 12.811864 6 04 83 f0 5d 10 48
E: 12.812737 6 04 87 c0 1e e0 60
E: 12.824822 6 04 87 c0 1e 00 61
E: 12.825762 6 04 83 30 5e 70 48
E: 12.838733 6 04 83 50 5e a0 48
E: 12.839720 6 04 87 c0 1e 00 61
E: 12.851816 6 04 87 c0 1e 40 61
E: 12.852682 6 04 83 90 5e f0 48
E: 12.865803 6 04 83 b0 5e 10 49
E: 12.866753 6 04 87 c0 1e 60 61
E: 12.878783 6 04 87 c0 1e 60 61
E: 12.879744 6 04 83 b0 5e 10 49
E: 12.891864 6 04 83 10 5f 60 49
E: 12.892681 6 04 87 c0 1e 60 61
E: 12.905762 6 04 87 c0 1e 60 61
E: 12.906640 6 04 83 40 5f 80 49
E: 12.918810 6 04 83 90 5f a0 49
E: 12.919675 6 04 87 c0 1e 60 61
E: 12.932785 6 04 87 c0 1e 60 61
E: 12.933755 6 04 83 00 60 c0 49
E: 12.945762 6 04 83 70 60 b0 49
E: 12.946706 6 04 87 c0 1e 60 61
E: 12.958695 6 04 87 c0 1e 60 61
E: 12.959642 6 04 83 d0 60 90 49
E: 12.972760 6 04 83 30 61 70 49
E: 12.973747 6 04 87 c0 1e 60 61
E: 12.985756 6 04 87 c0 1e 60 61
E: 12.986707 6 04 83 60 61 60 49
E: 12.999757 6 04 83 a0 61 40 49
E: 13.000646 6 04 87 a0 1e 80 61
E: 13.012637 6 04 87 a0 1e 80 61
E: 13.013611 6 04 83 f0 61 00 49
E: 13.026754 6 04 83 20 62 e0 48
E: 13.027753 6 04 87 a0 1e 80 61
E: 13.039752 6 04 87 a0 1e 80 61
E: 13.040727 6 04 83 70 62 90 48
E: 13.052744 6 04 83 90 62 70 48
E: 13.053617 6 04 87 50 1e 50 61
E: 13.066756 6 04 87 30 1e 40 61
E: 13.067721 6 04 83 e0 62 10 48
E: 13.079683 6 04 83 40 63 a0 47
E: 13.080646 6 04 87 f0 1d 00 61
E: 13.093664 6 04 87 a0 1d b0 60
E: 13.094714 6 04 83 b0 63 10 47
E: 13.106789 6 04 83 10 64 70 46
E: 13.107746 6 04 87 70 1d 80 60
E: 13.119702 6 04 87 30 1d 30 60
E: 13.120674 6 04 83 70 64 d0 45
E: 13.133659 6 04 83 c0 64 30 45
E: 13.134633 6 04 87 10 1d 00 60
E: 13.146674 6 04 87 e0 1c a0 5f
E: 13.147685 6 04 83 00 65 70 44
E: 13.160663 6 04 83 50 65 b0 43
E: 13.161619 6 04 87 90 1c 20 5f
E: 13.173692 6 04 87 40 1c 80 5e
E: 13.174685 6 04 83 90 65 e0 42
E: 13.187686 6 04 83 d0 65 20 42
E: 13.188666 6 04 87 00 1c e0 5d
E: 13.200731 6 04 87 e0 1b 90 5d
E: 13.201671 6 04 83 10 66 60 41
E: 13.213791 6 04 83 40 66 a0 40
E: 13.214704 6 04 87 b0 1b 20 5d
E: 13.227679 6 04 87 80 1b 90 5c
E: 13.228663 6 04 83 70 66 e0 3f
E: 13.240670 6 04 83 90 66 30 3f
E: 13.241641 6 04 87 70 1b 50 5c
E: 13.254662 6 04 87 50 1b d0 5b
E: 13.255633 6 04 83 b0 66 80 3e
E: 13.267691 6 04 83 d0 66 d0 3d
E: 13.268658 6 04 87 30 1b 40 5b
E: 13.280661 6 04 87 20 1b f0 5a
E: 13.281652 6 04 83 f0 66 20 3d
E: 13.294658 6 04 83 00 67 70 3c
E: 13.295659 6 04 87 00 1b 70 5a
E: 13.307662 6 04 87 e0 1a d0 59
E: 13.308658 6 04 83 00 67 c0 3b
E: 13.321679 6 04 83 10 67 00 3b
E: 13.322664 6 04 87 c0 1a 40 59
E: 13.334666 6 04 87 a0 1a a0 58
E: 13.335646 6 04 83 10 67 40 3a
E: 13.348681 6 04 83 20 67 90 39
E: 13.349654 6 04 87 80 1a 00 58
E: 13.361681 6 04 87 60 1a 60 57
E: 13.362655 6 04 83 20 67 d0 38
E: 13.374782 6 04 83 20 67 10 38
E: 13.375737 6 04 87 50 1a 10 57
E: 13.388736 6 04 87 30 1a 90 56
E: 13.389731 6 04 83 20 67 50 37
E: 13.401741 6 04 83 20 67 a0 36
E: 13.402736 6 04 87 10 1a e0 55
E: 13.415738 6 04 87 00 1a 30 55
E: 13.416729 6 04 83 20 67 e0 35
E: 13.428740 6 04 83 20 67 20 35
E: 13.429732 6 04 87 f0 19 70 54
E: 13.442770 6 04 87 e0 19 c0 53
E: 13.443783 6 04 83 20 67 60 34
E: 13.455812 6 04 83 20 67 b0 33
E: 13.456748 6 04 87 d0 19 00 53
E: 13.468868 6 04 87 c0 19 40 52
E: 13.469773 6 04 83 10 67 f0 32
E: 13.482872 6 04 83 10 67 40 32
E: 13.483808 6 04 87 c0 19 90 51
E: 13.499869 6 04 87 b0 19 f0 50
E: 13.500774 6 04 83 00 67 90 31
E: 13.513899 6 04 83 00 67 e0 30
E: 13.514743 6 04 87 b0 19 40 50
E: 13.526828 6 04 87 b0 19 80 4f
E: 13.527766 6 04 83 f0 66 30 30
E: 13.540893 6 04 83 e0 66 80 2f
E: 13.541746 6 04 87 a0 19 c0 4e
E: 13.553866 6 04 87 a0 19 10 4e
E: 13.554777 6 04 83 d0 66 d0 2e
E: 13.567826 6 04 83 c0 66 30 2e
E: 13.568746 6 04 87 a0 19 50 4d
E: 13.580845 6 04 87 a0 19 90 4c
E: 13.581771 6 04 83 b0 66 90 2d
E: 13.593867 6 04 83 b0 66 f0 2c
E: 13.594743 6 04 87 a0 19 d0 4b
E: 13.607881 6 04 87 a0 19 20 4b
E: 13.608773 6 04 83 a0 66 40 2c
E: 13.620832 6 04 83 90 66 a0 2b
E: 13.621675 6 04 87 90 19 70 4a
E: 13.634878 6 04 87 a0 19 c0 49
E: 13.635753 6 04 83 80 66 00 2b
E: 13.647843 6 04 83 70 66 60 2a
E: 13.648730 6 04 87 a0 19 10 49
E: 13.661799 6 04 87 a0 19 60 48
E: 13.662745 6 04 83 60 66 c0 29
E: 13.674841 6 04 83 50 66 20 29
E: 13.675708 6 04 87 a0 19 c0 47
E: 13.687727 6 04 87 a0 19 10 47
E: 13.688642 6 04 83 40 66 80 28
E: 13.701635 6 04 83 30 66 f0 27
E: 13.702649 6 04 87 b0 19 60 46
E: 13.714784 6 04 87 b0 19 b0 45
E: 13.715742 6 04 83 20 66 40 27
E: 13.728832 6 04 83 00 66 90 26
E: 13.729727 6 04 87 c0 19 f0 44
E: 13.741814 6 04 87 c0 19 30 44
E: 13.742761 6 04 83 e0 65 e0 25
E: 13.755788 6 04 83 d0 65 90 25
E: 13.756677 6 04 87 d0 19 70 43
E: 13.768756 6 04 87 d0 19 b0 42
E: 13.769739 6 04 83 b0 65 10 25
E: 13.781828 6 04 83 a0 65 d0 24
E: 13.782736 6 04 87 e0 19 00 42
E: 13.795839 6 04 87 e0 19 50 41
E: 13.796662 6 04 83 80 65 50 24
E: 13.808690 6 04 83 60 65 b0 23
E: 13.809681 6 04 87 f0 19 90 40
E: 13.822664 6 04 87 00 1a e0 3f
E: 13.823652 6 04 83 40 65 10 23
E: 13.835697 6 04 83 20 65 70 22
E: 13.836614 6 04 87 10 1a 40 3f
E: 13.849783 6 04 87 30 1a 90 3e
E: 13.850769 6 04 83 00 65 e0 21
E: 13.862794 6 04 83 f0 64 70 21
E: 13.863739 6 04 87 50 1a e0 3d
E: 13.875827 6 04 87 70 1a 30 3d
E: 13.876767 6 04 83 d0 64 f0 20
E: 13.889868 6 04 83 c0 64 60 20
E: 13.890736 6 04 87 90 1a 90 3c
E: 13.902891 6 04 87 a0 1a f0 3b
E: 13.903770 6 04 83 a0 64 e0 1f
E: 13.916749 6 04 83 80 64 60 1f
E: 13.917702 6 04 87 b0 1a 40 3b
E: 13.929751 6 04 87 c0 1a 90 3a
E: 13.930680 6 04 83 70 64 20 1f
E: 13.943756 6 04 83 70 64 00 1f
E: 13.944758 6 04 87 d0 1a e0 39
E: 13.956899 6 04 87 e0 1a 40 39
E: 13.957802 6 04 83 50 64 b0 1e
E: 13.969881 6 04 83 20 64 30 1e
E: 13.970770 6 04 87 00 1b 90 38
E: 13.983854 6 04 87 10 1b d0 37
E: 13.984781 6 04 83 e0 63 90 1d
E: 13.996681 6 04 83 c0 63 40 1d
E: 13.997731 6 04 87 30 1b 10 37
E: 14.010758 6 04 87 40 1b 60 36
E: 14.011693 6 04 83 90 63 c0 1c
E: 14.023887 6 04 83 80 63 80 1c
E: 14.024799 6 04 87 60 1b a0 35
E: 14.036825 6 04 87 80 1b f0 34
E: 14.037764 6 04 83 50 63 f0 1b
E: 14.050892 6 04 83 10 63 50 1b
E: 14.051721 6 04 87 90 1b 40 34
E: 14.063883 6 04 87 b0 1b a0 33
E: 14.064770 6 04 83 f0 62 00 1b
E: 14.077753 6 04 83 c0 62 90 1a
E: 14.078782 6 04 87 d0 1b f0 32
E: 14.090796 6 04 87 00 1c 40 32
E: 14.091694 6 04 83 80 62 10 1a
E: 14.104669 6 04 83 60 62 d0 19
E: 14.105672 6 04 87 20 1c a0 31
E: 14.117692 6 04 87 40 1c 10 31
E: 14.118717 6 04 83 50 62 b0 19
E: 14.130759 6 04 83 20 62 50 19
E: 14.131821 6 04 87 60 1c 90 30
E: 14.144757 6 04 87 70 1c 50 30
E: 14.145718 6 04 83 10 62 20 19
E: 14.157757 6 04 83 e0 61 b0 18
E: 14.158698 6 04 87 90 1c e0 2f
E: 14.171772 6 04 87 c0 1c 50 2f
E: 14.172759 6 04 83 a0 61 20 18
E: 14.184686 6 04 83 80 61 e0 17
E: 14.185652 6 04 87 d0 1c 10 2f
E: 14.198875 6 04 87 00 1d 90 2e
E: 14.199768 6 04 83 50 61 70 17
E: 14.211689 6 04 83 30 61 40 17
E: 14.212613 6 04 87 40 1d 00 2e
E: 14.224662 6 04 87 60 1d c0 2d
E: 14.225633 6 04 83 20 61 20 17
E: 14.238815 6 04 83 f0 60 d0 16
E: 14.239768 6 04 87 70 1d a0 2d
E: 14.251864 6 04 87 b0 1d 40 2d
E: 14.252750 6 04 83 d0 60 b0 16
E: 14.265808 6 04 83 d0 60 b0 16
E: 14.266756 6 04 87 f0 1d b0 2c
E: 14.278842 6 04 87 10 1e 70 2c
E: 14.279767 6 04 83 90 60 60 16
E: 14.292871 6 04 83 50 60 10 16
E: 14.293737 6 04 87 20 1e 50 2c
E: 14.306701 6 04 87 50 1e f0 2b
E: 14.307727 6 04 83 30 60 e0 15
E: 14.319730 6 04 83 30 60 e0 15
E: 14.320654 6 04 87 70 1e c0 2b
E: 14.333735 6 04 87 b0 1e 70 2b
E: 14.334783 6 04 83 10 60 c0 15
E: 14.346886 6 04 83 d0 5f 80 15
E: 14.347739 6 04 87 d0 1e 50 2b
E: 14.364736 6 04 87 d0 1e 50 2b
E: 14.365741 6 04 83 b0 5f 60 15
E: 14.377671 6 04 83 70 5f 10 15
E: 14.378623 6 04 87 e0 1e 30 2b
E: 14.390632 6 04 87 e0 1e 30 2b
E: 14.391611 6 04 83 50 5f f0 14
E: 14.404668 6 04 83 50 5f f0 14
E: 14.405641 6 04 87 20 1f 00 2b
E: 14.417695 6 04 87 80 1f d0 2a
E: 14.418763 6 04 83 00 5f c0 14
E: 14.431871 6 04 83 a0 5e c0 14
E: 14.432709 6 04 87 e0 1f b0 2a
E: 14.444700 6 04 87 40 20 90 2a
E: 14.445640 6 04 83 40 5e c0 14
E: 14.458841 6 04 83 e0 5d d0 14
E: 14.459767 6 04 87 a0 20 70 2a
E: 14.471726 6 04 87 d0 20 60 2a
E: 14.472666 6 04 83 b0 5d d0 14
E: 14.484695 6 04 83 70 5d e0 14
E: 14.485624 6 04 87 10 21 70 2a
E: 14.498708 6 04 87 30 21 70 2a
E: 14.499652 6 04 83 50 5d e0 14
E: 14.511799 6 04 83 20 5d f0 14
E: 14.512644 6 04 87 30 21 70 2a
E: 14.525708 6 04 87 30 21 70 2a
E: 14.526684 6 04 83 e0 5c 00 15
E: 14.538766 6 04 83 c0 5c 00 15
E: 14.539734 6 04 87 80 21 90 2a
E: 14.551683 6 04 87 a0 21 a0 2a
E: 14.552644 6 04 83 c0 5c 00 15
E: 14.565764 6 04 83 c0 5c 00 15
E: 14.566759 6 04 87 f0 21 e0 2a
E: 14.578822 6 04 87 50 22 30 2b
E: 14.579753 6 04 83 80 5c 30 15
E: 14.592846 6 04 83 60 5c 50 15
E: 14.593722 6 04 87 80 22 50 2b
E: 14.605869 6 04 87 d0 22 90 2b
E: 14.606758 6 04 83 20 5c 90 15
E: 14.619658 6 04 83 00 5c b0 15
E: 14.620682 6 04 87 f0 22 b0 2b
E: 14.632678 6 04 87 f0 22 b0 2b
E: 14.633656 6 04 83 c0 5b 10 16
E: 14.645865 6 04 83 70 5b 80 16
E: 14.646645 6 04 87 50 23 00 2c
E: 14.659676 6 04 87 70 23 20 2c
E: 14.660638 6 04 83 50 5b c0 16
E: 14.672674 6 04 83 20 5b 20 17
E: 14.673631 6 04 87 70 23 20 2c
E: 14.686891 6 04 87 d0 23 70 2c
E: 14.687763 6 04 83 e0 5a a0 17
E: 14.699883 6 04 83 c0 5a e0 17
E: 14.700671 6 04 87 f0 23 90 2c
E: 14.712825 6 04 87 40 24 e0 2c
E: 14.713764 6 04 83 90 5a 40 18
E: 14.726735 6 04 83 50 5a c0 18
E: 14.727629 6 04 87 90 24 50 2d
E: 14.739797 6 04 87 b0 24 80 2d
E: 14.740729 6 04 83 20 5a 50 19
E: 14.753673 6 04 83 00 5a a0 19
E: 14.754754 6 04 87 f0 24 f0 2d
E: 14.766732 6 04 87 40 25 60 2e
E: 14.767772 6 04 83 e0 59 10 1a
E: 14.780871 6 04 83 c0 59 90 1a
E: 14.781739 6 04 87 60 25 a0 2e
E: 14.793781 6 04 87 a0 25 00 2f
E: 14.794704 6 04 83 a0 59 20 1b
E: 14.806707 6 04 83 90 59 60 1b
E: 14.807688 6 04 87 e0 25 80 2f
E: 14.819694 6 04 87 00 26 c0 2f
E: 14.820663 6 04 83 70 59 e0 1b
E: 14.832851 6 04 83 50 59 70 1c
E: 14.833670 6 04 87 40 26 40 30
E: 14.846771 6 04 87 80 26 d0 30
E: 14.847752 6 04 83 40 59 10 1d
E: 14.859833 6 04 83 30 59 a0 1d
E: 14.860726 6 04 87 a0 26 10 31
E: 14.873866 6 04 87 d0 26 80 31
E: 14.874753 6 04 83 20 59 40 1e
E: 14.886839 6 04 83 10 59 f0 1e
E: 14.887686 6 04 87 10 27 f0 31
E: 14.899808 6 04 87 30 27 30 32
E: 14.900761 6 04 83 00 59 a0 1f
E: 14.912858 6 04 83 f0 58 f0 1f
E: 14.913762 6 04 87 60 27 a0 32
E: 14.925839 6 04 87 a0 27 20 33
E: 14.926764 6 04 83 d0 58 80 20
E: 14.938694 6 04 83 b0 58 30 21
E: 14.939648 6 04 87 d0 27 b0 33
E: 14.951775 6 04 87 f0 27 f0 33
E: 14.952730 6 04 83 90 58 e0 21
E: 14.965773 6 04 83 80 58 80 22
E: 14.966693 6 04 87 10 28 60 34
E: 14.978835 6 04 87 40 28 d0 34
E: 14.979766 6 04 83 70 58 20 23
E: 14.991883 6 04 83 60 58 b0 23
E: 14.992675 6 04 87 60 28 40 35
E: 15.004823 6 04 87 80 28 b0 35
E: 15.005769 6 04 83 50 58 50 24
E: 15.016836 6 04 83 40 58 e0 24
E: 15.017690 6 04 87 a0 28 10 36
E: 15.029796 6 04 87 a0 28 60 36
E: 15.030701 6 04 83 30 58 70 25
E: 15.046825 6 04 83 30 58 f0 25
E: 15.047702 6 04 87 c0 28 c0 36
E: 15.059877 6 04 87 c0 28 10 37
E: 15.060773 6 04 83 20 58 70 26
E: 15.072881 6 04 83 20 58 e0 26
E: 15.073705 6 04 87 c0 28 60 37
E: 15.085883 6 04 87 d0 28 90 37
E: 15.086772 6 04 83 20 58 50 27
E: 15.098774 6 04 83 10 58 c0 27
E: 15.099708 6 04 87 d0 28 90 37
E: 15.110704 6 04 87 d0 28 b0 37
E: 15.111647 6 04 83 10 58 30 28
E: 15.123658 6 04 83 10 58 90 28
E: 15.124670 6 04 87 d0 28 b0 37
E: 15.136719 6 04 87 d0 28 b0 37
E: 15.137666 6 04 83 10 58 c0 28
E: 15.149713 6 04 83 10 58 e0 28
E: 15.150778 6 04 87 d0 28 b0 37
E: 15.161842 6 04 87 d0 28 b0 37
E: 15.162774 6 04 83 10 58 10 29
E: 15.174884 6 04 83 10 58 30 29
E: 15.175690 6 04 87 d0 28 b0 37
E: 15.187887 6 04 87 d0 28 b0 37
E: 15.188774 6 04 83 10 58 30 29
E: 15.199837 6 04 83 10 58 30 29
E: 15.200773 6 04 87 d0 28 b0 37
E: 15.212826 6 04 87 d0 28 b0 37
E: 15.213776 6 04 83 10 58 30 29
E: 15.225806 6 04 83 10 58 30 29
E: 15.226779 6 04 87 d0 28 b0 37
E: 15.237817 6 04 87 d0 28 b0 37
E: 15.238773 6 04 83 10 58 30 29
E: 15.250839 6 04 83 10 58 30 29
E: 15.251773 6 04 87 d0 28 b0 37
E: 15.263776 6 04 87 d0 28 b0 37
E: 15.264771 6 04 83 10 58 30 29
E: 15.276817 6 04 83 10 58 30 29
E: 15.277766 6 04 87 d0 28 b0 37
E: 15.288857 6 04 87 d0 28 b0 37
E: 15.289771 6 04 83 10 58 30 29
E: 15.301837 6 04 83 10 58 30 29
E: 15.302761 6 04 87 d0 28 b0 37
E: 15.318879 6 04 87 d0 28 b0 37
E: 15.319771 6 04 83 10 58 30 29
E: 15.330746 6 04 83 10 58 30 29
E: 15.331693 6 04 87 d0 28 b0 37
E: 15.343878 6 04 87 d0 28 b0 37
E: 15.344752 6 04 83 10 58 30 29
E: 15.356768 6 04 83 10 58 30 29
E: 15.357716 6 04 87 d0 28 b0 37
E: 15.369649 6 04 87 d0 28 b0 37
E: 15.370627 6 04 83 10 58 30 29
E: 15.381649 6 04 83 10 58 30 29
E: 15.382625 6 04 87 d0 28 b0 37
E: 15.390656 6 04 87 d0 28 b0 37
E: 15.398655 6 04 87 d0 28 b0 37
E: 15.406856 6 04 87 d0 28 b0 37
E: 15.414865 6 04 87 d0 28 b0 37
E: 15.422837 6 04 87 d0 28 b0 37
E: 15.431836 6 04 87 d0 28 b0 37
E: 15.432780 6 04 83 10 58 60 29
E: 15.433631 6 04 82 10 58 60 29
E: 15.439695 6 04 87 d0 28 b0 37
E: 15.447651 6 04 87 d0 28 b0 37
E: 15.455678 6 04 87 d0 28 b0 37
E: 15.464608 6 04 87 d0 28 b0 37
E: 15.472737 6 04 87 d0 28 b0 37
E: 15.480790 6 04 87 d0 28 b0 37
E: 15.488771 6 04 87 d0 28 b0 37
E: 15.497809 6 04 87 d0 28 b0 37
E: 15.505828 6 04 87 d0 28 b0 37
E: 15.513805 6 04 87 d0 28 b0 37
E: 15.521851 6 04 87 d0 28 b0 37
E: 15.529834 6 04 87 d0 28 b0 37
E: 15.538835 6 04 87 d0 28 b0 37
E: 15.546801 6 04 87 d0 28 b0 37
E: 15.554768 6 04 87 d0 28 b0 37
E: 15.562819 6 04 87 d0 28 b0 37
E: 15.571834 6 04 87 d0 28 b0 37
E: 15.579865 6 04 87 d0 28 b0 37
E: 15.587812 6 04 87 d0 28 b0 37
E: 15.595773 6 04 87 d0 28 b0 37
E: 15.604716 6 04 87 d0 28 b0 37
E: 15.612796 6 04 87 d0 28 b0 37
E: 15.620789 6 04 87 d0 28 b0 37
E: 15.628751 6 04 87 d0 28 b0 37
E: 15.636818 6 04 87 d0 28 b0 37
E: 15.645816 6 04 87 d0 28 b0 37
E: 15.653810 6 04 87 d0 28 b0 37
E: 15.661856 6 04 87 d0 28 b0 37
E: 15.669792 6 04 87 d0 28 b0 37
E: 15.678762 6 04 87 d0 28 b0 37
E: 15.686815 6 04 87 d0 28 b0 37
E: 15.694861 6 04 87 d0 28 b0 37
E: 15.702783 6 04 87 d0 28 b0 37
E: 15.710796 6 04 87 d0 28 b0 37
E: 15.719813 6 04 87 d0 28 b0 37
E: 15.727795 6 04 87 d0 28 b0 37
E: 15.735837 6 04 87 d0 28 b0 37
E: 15.743837 6 04 87 d0 28 b0 37
E: 15.752834 6 04 87 d0 28 b0 37
E: 15.760814 6 04 87 d0 28 b0 37
E: 15.768797 6 04 87 d0 28 b0 37
E: 15.776819 6 04 87 d0 28 b0 37
E: 15.785860 6 04 87 d0 28 b0 37
E: 15.793787 6 04 87 d0 28 b0 37
E: 15.801833 6 04 87 d0 28 b0 37
E: 15.809833 6 04 87 d0 28 b0 37
E: 15.817847 6 04 87 d0 28 b0 37
E: 15.826834 6 04 87 d0 28 b0 37
E: 15.834773 6 04 87 d0 28 b0 37
E: 15.842833 6 04 87 d0 28 b0 37
E: 15.850719 6 04 87 d0 28 b0 37
E: 15.859844 6 04 87 d0 28 b0 37
E: 15.867845 6 04 87 d0 28 b0 37
E: 15.875858 6 04 87 d0 28 b0 37
E: 15.883840 6 04 87 d0 28 b0 37
E: 15.891838 6 04 87 d0 28 b0 37
E: 15.900855 6 04 87 d0 28 b0 37
E: 15.908797 6 04 87 d0 28 b0 37
E: 15.916832 6 04 87 d0 28 b0 37
E: 15.924831 6 04 87 d0 28 b0 37
E: 15.933861 6 04 87 d0 28 b0 37
E: 15.941842 6 04 87 d0 28 b0 37
E: 15.949873 6 04 87 d0 28 b0 37
E: 15.957850 6 04 87 d0 28 b0 37
E: 15.966860 6 04 87 d0 28 b0 37
E: 15.974855 6 04 87 d0 28 b0 37
E: 15.982850 6 04 87 d0 28 b0 37
E: 15.990850 6 04 87 d0 28 b0 37
E: 15.998806 6 04 87 d0 28 b0 37
E: 16.007866 6 04 87 d0 28 b0 37
E: 16.015855 6 04 87 d0 28 b0 37
E: 16.023804 6 04 87 d0 28 b0 37
E: 16.031830 6 04 87 d0 28 b0 37
E: 16.040792 6 04 87 d0 28 b0 37
E: 16.048798 6 04 87 d0 28 b0 37
E: 16.056788 6 04 87 d0 28 b0 37
E: 16.064692 6 04 87 d0 28 b0 37
E: 16.072815 6 04 87 d0 28 b0 37
E: 16.081828 6 04 87 d0 28 b0 37
E: 16.127808 6 04 87 e0 28 f0 37
E: 16.128749 6 04 86 e0 28 f0 37
# 3. Finally, move your ten fingers on the screen and release them.
E: 22.675824 6 04 83 b0 4d 30 10
E: 22.699570 6 04 83 b0 4d 30 10
E: 22.700570 6 04 87 c0 45 40 56
E: 22.729572 6 04 87 c0 45 40 56
E: 22.730585 6 04 83 b0 4d 30 10
E: 22.779740 6 04 83 b0 4d 20 10
E: 22.780615 6 04 82 b0 4d 20 10
E: 22.781649 6 04 87 d0 45 40 56
E: 22.782598 6 04 86 d0 45 40 56
# Thank you.
