R: 322 05 0d 09 04 a1 01 85 04 09 22 a1 00 09 42 15 00 25 01 75 01 95 01 81 02 09 32 15 00 25 01 81 02 09 51 75 05 95 01 16 00 00 26 10 00 81 02 09 47 75 01 95 01 15 00 25 01 81 02 05 01 09 30 75 10 95 01 55 0d 65 33 35 00 46 72 22 26 ff 7f 81 02 09 31 75 10 95 01 55 0d 65 33 35 00 46 87 13 26 ff 7f 81 02 05 0d 09 55 25 08 75 08 95 01 b1 02 c0 c0 05 01 09 01 a1 01 85 01 09 01 a1 00 05 09 19 01 29 02 15 00 25 01 95 02 75 01 81 02 95 01 75 06 81 01 05 01 09 30 09 31 16 00 00 26 ff 0f 36 00 00 46 ff 0f 66 00 00 75 10 95 02 81 02 c0 c0 06 00 ff 09 01 a1 01 09 01 15 00 26 ff 00 85 03 75 08 95 3f 81 02 06 00 ff 09 01 15 00 26 ff 00 75 08 95 3f 91 02 c0 05 0d 09 04 a1 01 85 02 09 20 a1 00 09 42 09 32 15 00 25 01 95 02 75 01 81 02 95 06 75 01 81 03 05 01 09 30 75 10 95 01 a4 55 0d 65 33 36 00 00 46 72 22 16 00 00 26 ff 0f 81 02 09 31 16 00 00 26 ff 0f 36 00 00 46 87 13 81 02 b4 c0 c0 05 0d 09 0e a1 01 85 05 09 22 a1 00 09 52 09 53 15 00 25 0a 75 08 95 02 b1 02 c0 c0
N: eGalax Inc. USB TouchController
I: 3 0eef 72fa
# 1. Drag _one_ finger on the screen from one corner to the opposite, and release it.
E: 0.000000 6 04 83 80 0a 40 11
E: 0.002884 6 04 83 80 0a 40 11
E: 0.007885 6 04 83 80 0a 40 11
E: 0.011872 6 04 83 80 0a 40 11
E: 0.016845 6 04 83 80 0a 40 11
E: 0.020784 6 04 83 80 0a 60 11
E: 0.024793 6 04 83 80 0a 60 11
E: 0.029756 6 04 83 80 0a 60 11
E: 0.033964 6 04 83 80 0a 60 11
E: 0.038950 6 04 83 80 0a 60 11
E: 0.042867 6 04 83 80 0a 60 11
E: 0.047888 6 04 83 80 0a 60 11
E: 0.051892 6 04 83 80 0a 60 11
E: 0.056888 6 04 83 80 0a 80 11
E: 0.064286 6 04 83 80 0a 80 11
E: 0.065742 6 04 83 90 0a b0 11
E: 0.069881 6 04 83 90 0a b0 11
E: 0.073875 6 04 83 a0 0a d0 11
E: 0.078890 6 04 83 b0 0a f0 11
E: 0.082812 6 04 83 d0 0a 10 12
E: 0.087935 6 04 83 e0 0a 30 12
E: 0.098277 6 04 83 00 0b 50 12
E: 0.098542 6 04 83 20 0b 80 12
E: 0.100811 6 04 83 50 0b b0 12
E: 0.105813 6 04 83 80 0b e0 12
E: 0.109805 6 04 83 b0 0b 20 13
E: 0.114803 6 04 83 f0 0b 60 13
E: 0.119000 6 04 83 30 0c a0 13
E: 0.123953 6 04 83 70 0c e0 13
E: 0.127880 6 04 83 b0 0c 30 14
E: 0.131880 6 04 83 f0 0c 80 14
E: 0.136866 6 04 83 30 0d d0 14
E: 0.140905 6 04 83 70 0d 30 15
E: 0.145752 6 04 83 b0 0d 80 15
E: 0.150002 6 04 83 00 0e d0 15
E: 0.155000 6 04 83 50 0e 20 16
E: 0.158991 6 04 83 a0 0e 70 16
E: 0.163822 6 04 83 f0 0e c0 16
E: 0.168153 6 04 83 40 0f 20 17
E: 0.172862 6 04 83 90 0f 80 17
E: 0.176739 6 04 83 f0 0f e0 17
E: 0.181809 6 04 83 50 10 40 18
E: 0.185739 6 04 83 b0 10 a0 18
E: 0.189903 6 04 83 10 11 10 19
E: 0.194875 6 04 83 70 11 80 19
E: 0.198798 6 04 83 d0 11 f0 19
E: 0.203785 6 04 83 40 12 50 1a
E: 0.207827 6 04 83 b0 12 b0 1a
E: 0.212838 6 04 83 20 13 10 1b
E: 0.216992 6 04 83 90 13 70 1b
E: 0.221912 6 04 83 10 14 e0 1b
E: 0.225921 6 04 83 90 14 50 1c
E: 0.230852 6 04 83 10 15 c0 1c
E: 0.234842 6 04 83 90 15 30 1d
E: 0.238848 6 04 83 10 16 a0 1d
E: 0.244398 6 04 83 a0 16 20 1e
E: 0.247913 6 04 83 30 17 a0 1e
E: 0.252998 6 04 83 c0 17 10 1f
E: 0.256966 6 04 83 50 18 80 1f
E: 0.262199 6 04 83 e0 18 f0 1f
E: 0.265853 6 04 83 70 19 70 20
E: 0.270883 6 04 83 10 1a f0 20
E: 0.274936 6 04 83 b0 1a 70 21
E: 0.279910 6 04 83 40 1b f0 21
E: 0.283769 6 04 83 e0 1b 70 22
E: 0.287772 6 04 83 80 1c 00 23
E: 0.292861 6 04 83 20 1d 80 23
E: 0.296926 6 04 83 c0 1d 00 24
E: 0.301932 6 04 83 60 1e 80 24
E: 0.305960 6 04 83 00 1f 10 25
E: 0.310961 6 04 83 a0 1f a0 25
E: 0.314827 6 04 83 50 20 30 26
E: 0.319866 6 04 83 00 21 c0 26
E: 0.323842 6 04 83 b0 21 50 27
E: 0.328808 6 04 83 60 22 d0 27
E: 0.332814 6 04 83 10 23 50 28
E: 0.337955 6 04 83 c0 23 d0 28
E: 0.341853 6 04 83 70 24 50 29
E: 0.345825 6 04 83 20 25 d0 29
E: 0.350875 6 04 83 d0 25 50 2a
E: 0.354905 6 04 83 80 26 e0 2a
E: 0.359792 6 04 83 30 27 70 2b
E: 0.363905 6 04 83 e0 27 00 2c
E: 0.369681 6 04 83 90 28 80 2c
E: 0.372966 6 04 83 50 29 00 2d
E: 0.377953 6 04 83 10 2a 80 2d
E: 0.381861 6 04 83 d0 2a 00 2e
E: 0.386841 6 04 83 90 2b 80 2e
E: 0.390804 6 04 83 50 2c 10 2f
E: 0.394769 6 04 83 10 2d a0 2f
E: 0.399832 6 04 83 d0 2d 30 30
E: 0.403964 6 04 83 90 2e c0 30
E: 0.408838 6 04 83 50 2f 50 31
E: 0.412788 6 04 83 10 30 e0 31
E: 0.417887 6 04 83 d0 30 70 32
E: 0.421815 6 04 83 90 31 00 33
E: 0.426870 6 04 83 50 32 90 33
E: 0.430890 6 04 83 10 33 20 34
E: 0.436389 6 04 83 d0 33 b0 34
E: 0.439934 6 04 83 90 34 40 35
E: 0.444317 6 04 83 50 35 d0 35
E: 0.448883 6 04 83 10 36 60 36
E: 0.452786 6 04 83 d0 36 f0 36
E: 0.457869 6 04 83 80 37 80 37
E: 0.461881 6 04 83 30 38 10 38
E: 0.466794 6 04 83 e0 38 a0 38
E: 0.471036 6 04 83 a0 39 30 39
E: 0.478196 6 04 83 50 3a c0 39
E: 0.480186 6 04 83 00 3b 50 3a
E: 0.484923 6 04 83 b0 3b d0 3a
E: 0.488891 6 04 83 60 3c 60 3b
E: 0.493803 6 04 83 10 3d e0 3b
E: 0.497825 6 04 83 c0 3d 60 3c
E: 0.501911 6 04 83 70 3e e0 3c
E: 0.506851 6 04 83 20 3f 60 3d
E: 0.510862 6 04 83 d0 3f f0 3d
E: 0.515859 6 04 83 80 40 80 3e
E: 0.519873 6 04 83 30 41 10 3f
E: 0.524911 6 04 83 e0 41 90 3f
E: 0.528920 6 04 83 90 42 10 40
E: 0.533933 6 04 83 40 43 90 40
E: 0.538110 6 04 83 e0 43 10 41
E: 0.542947 6 04 83 80 44 90 41
E: 0.546870 6 04 83 20 45 20 42
E: 0.551064 6 04 83 d0 45 b0 42
E: 0.555884 6 04 83 80 46 40 43
E: 0.559836 6 04 83 30 47 c0 43
E: 0.564882 6 04 83 d0 47 40 44
E: 0.568972 6 04 83 80 48 d0 44
E: 0.573938 6 04 83 30 49 60 45
E: 0.578155 6 04 83 d0 49 f0 45
E: 0.582892 6 04 83 80 4a 80 46
E: 0.586880 6 04 83 30 4b 10 47
E: 0.591875 6 04 83 e0 4b a0 47
E: 0.595875 6 04 83 80 4c 20 48
E: 0.599885 6 04 83 30 4d a0 48
E: 0.604877 6 04 83 d0 4d 20 49
E: 0.608936 6 04 83 80 4e b0 49
E: 0.613869 6 04 83 30 4f 40 4a
E: 0.617884 6 04 83 d0 4f d0 4a
E: 0.622851 6 04 83 70 50 50 4b
E: 0.626862 6 04 83 10 51 d0 4b
E: 0.631849 6 04 83 c0 51 60 4c
E: 0.635940 6 04 83 60 52 e0 4c
E: 0.640918 6 04 83 10 53 60 4d
E: 0.644846 6 04 83 b0 53 e0 4d
E: 0.649852 6 04 83 50 54 70 4e
E: 0.653899 6 04 83 00 55 f0 4e
E: 0.657849 6 04 83 a0 55 70 4f
E: 0.663074 6 04 83 40 56 f0 4f
E: 0.666948 6 04 83 e0 56 70 50
E: 0.671888 6 04 83 90 57 00 51
E: 0.675875 6 04 83 30 58 80 51
E: 0.680884 6 04 83 d0 58 00 52
E: 0.684854 6 04 83 70 59 80 52
E: 0.689876 6 04 83 20 5a 10 53
E: 0.693863 6 04 83 d0 5a 90 53
E: 0.698960 6 04 83 70 5b 10 54
E: 0.702908 6 04 83 10 5c 90 54
E: 0.706831 6 04 83 b0 5c 10 55
E: 0.711884 6 04 83 50 5d 90 55
E: 0.715865 6 04 83 f0 5d 10 56
E: 0.720868 6 04 83 90 5e 90 56
E: 0.724852 6 04 83 30 5f 10 57
E: 0.730100 6 04 83 d0 5f 80 57
E: 0.733896 6 04 83 70 60 f0 57
E: 0.738854 6 04 83 10 61 60 58
E: 0.742855 6 04 83 b0 61 d0 58
E: 0.747888 6 04 83 50 62 40 59
E: 0.751856 6 04 83 f0 62 b0 59
E: 0.755848 6 04 83 90 63 20 5a
E: 0.760931 6 04 83 30 64 90 5a
E: 0.764894 6 04 83 c0 64 00 5b
E: 0.769897 6 04 83 50 65 70 5b
E: 0.773786 6 04 83 e0 65 e0 5b
E: 0.778789 6 04 83 70 66 50 5c
E: 0.782869 6 04 83 00 67 d0 5c
E: 0.787907 6 04 83 90 67 40 5d
E: 0.792020 6 04 83 20 68 b0 5d
E: 0.796809 6 04 83 b0 68 20 5e
E: 0.801019 6 04 83 40 69 90 5e
E: 0.805885 6 04 83 d0 69 10 5f
E: 0.810190 6 04 83 60 6a 80 5f
E: 0.813974 6 04 83 e0 6a 00 60
E: 0.818889 6 04 83 70 6b 80 60
E: 0.822878 6 04 83 f0 6b f0 60
E: 0.827875 6 04 83 70 6c 60 61
E: 0.831792 6 04 83 f0 6c e0 61
E: 0.836942 6 04 83 80 6d 50 62
E: 0.840941 6 04 83 00 6e c0 62
E: 0.845968 6 04 83 80 6e 30 63
E: 0.849889 6 04 83 00 6f a0 63
E: 0.854882 6 04 83 80 6f 10 64
E: 0.859108 6 04 83 00 70 80 64
E: 0.862807 6 04 83 80 70 f0 64
E: 0.868052 6 04 83 00 71 60 65
E: 0.872025 6 04 83 60 71 c0 65
E: 0.876898 6 04 83 d0 71 20 66
E: 0.880793 6 04 83 40 72 80 66
E: 0.885913 6 04 83 c0 72 f0 66
E: 0.890002 6 04 83 40 73 60 67
E: 0.894887 6 04 83 c0 73 c0 67
E: 0.898785 6 04 83 20 74 10 68
E: 0.903955 6 04 83 90 74 70 68
E: 0.907812 6 04 83 00 75 d0 68
E: 0.911917 6 04 83 70 75 40 69
E: 0.916902 6 04 83 e0 75 b0 69
E: 0.920883 6 04 83 40 76 00 6a
E: 0.925895 6 04 83 a0 76 60 6a
E: 0.929959 6 04 83 10 77 c0 6a
E: 0.934913 6 04 83 60 77 10 6b
E: 0.938807 6 04 83 c0 77 60 6b
E: 0.943920 6 04 83 00 78 a0 6b
E: 0.947884 6 04 83 50 78 f0 6b
E: 0.952854 6 04 83 90 78 30 6c
E: 0.957888 6 04 83 d0 78 80 6c
E: 0.961842 6 04 83 00 79 c0 6c
E: 0.965842 6 04 83 30 79 f0 6c
E: 0.970208 6 04 83 70 79 30 6d
E: 0.976973 6 04 83 b0 79 60 6d
E: 0.979828 6 04 83 d0 79 80 6d
E: 0.985049 6 04 83 d0 79 80 6d
E: 0.988783 6 04 83 f0 79 a0 6d
E: 0.993875 6 04 83 20 7a c0 6d
E: 0.997790 6 04 83 40 7a e0 6d
E: 1.002908 6 04 83 60 7a f0 6d
E: 1.007000 6 04 83 60 7a f0 6d
E: 1.010940 6 04 83 80 7a 10 6e
E: 1.015937 6 04 83 80 7a 10 6e
E: 1.019933 6 04 83 80 7a 10 6e
E: 1.024939 6 04 83 80 7a 10 6e
E: 1.028894 6 04 83 80 7a 10 6e
E: 1.033866 6 04 83 80 7a 10 6e
E: 1.037795 6 04 83 80 7a 10 6e
E: 1.042907 6 04 83 80 7a 10 6e
E: 1.046757 6 04 83 80 7a 10 6e
E: 1.052071 6 04 83 80 7a 10 6e
E: 1.056070 6 04 83 80 7a 10 6e
E: 1.060072 6 04 83 80 7a 10 6e
E: 1.064884 6 04 83 80 7a 10 6e
E: 1.068826 6 04 83 80 7a 10 6e
E: 1.073864 6 04 83 80 7a 10 6e
E: 1.078074 6 04 83 80 7a 10 6e
E: 1.083071 6 04 83 80 7a 10 6e
E: 1.087068 6 04 83 80 7a 10 6e
E: 1.092073 6 04 83 80 7a 10 6e
E: 1.096066 6 04 83 80 7a 10 6e
E: 1.101067 6 04 83 80 7a 10 6e
E: 1.105066 6 04 83 80 7a 10 6e
E: 1.109956 6 04 83 80 7a 10 6e
E: 1.114066 6 04 83 80 7a 10 6e
E: 1.118069 6 04 83 80 7a 10 6e
E: 1.123067 6 04 83 80 7a 10 6e
E: 1.127064 6 04 83 80 7a 10 6e
E: 1.132068 6 04 83 80 7a 10 6e
E: 1.135958 6 04 83 80 7a 10 6e
E: 1.140957 6 04 83 80 7a 10 6e
E: 1.145065 6 04 83 80 7a 10 6e
E: 1.150069 6 04 83 80 7a 10 6e
E: 1.154066 6 04 83 80 7a 10 6e
E: 1.159075 6 04 83 80 7a 10 6e
E: 1.163066 6 04 83 80 7a 10 6e
E: 1.167073 6 04 83 80 7a 10 6e
E: 1.172068 6 04 83 80 7a 10 6e
E: 1.176069 6 04 83 80 7a 10 6e
E: 1.181069 6 04 83 80 7a 10 6e
E: 1.185064 6 04 83 80 7a 10 6e
E: 1.190071 6 04 83 80 7a 10 6e
E: 1.194071 6 04 83 80 7a 10 6e
E: 1.199063 6 04 83 80 7a 10 6e
E: 1.203068 6 04 83 80 7a 10 6e
E: 1.208067 6 04 83 80 7a 10 6e
E: 1.212072 6 04 83 80 7a 10 6e
E: 1.216068 6 04 83 80 7a 10 6e
E: 1.221071 6 04 83 80 7a 10 6e
E: 1.225064 6 04 83 80 7a 10 6e
E: 1.230072 6 04 83 80 7a 10 6e
E: 1.234061 6 04 83 80 7a 10 6e
E: 1.238953 6 04 83 80 7a 10 6e
E: 1.242940 6 04 83 80 7a 10 6e
E: 1.247961 6 04 83 80 7a 10 6e
E: 1.252065 6 04 83 80 7a 10 6e
E: 1.257068 6 04 83 80 7a 10 6e
E: 1.261066 6 04 83 80 7a 10 6e
E: 1.266074 6 04 83 80 7a 10 6e
E: 1.270067 6 04 83 80 7a 10 6e
E: 1.274069 6 04 83 80 7a 10 6e
E: 1.279074 6 04 83 80 7a 10 6e
E: 1.283066 6 04 83 80 7a 10 6e
E: 1.288070 6 04 83 80 7a 10 6e
E: 1.292064 6 04 83 80 7a 10 6e
E: 1.297067 6 04 83 80 7a 10 6e
E: 1.301066 6 04 83 80 7a 10 6e
E: 1.306071 6 04 83 80 7a 10 6e
E: 1.310066 6 04 83 80 7a 10 6e
E: 1.315067 6 04 83 80 7a 10 6e
E: 1.319069 6 04 83 80 7a 10 6e
E: 1.324066 6 04 83 80 7a 10 6e
E: 1.328065 6 04 83 80 7a 10 6e
E: 1.332069 6 04 83 80 7a 10 6e
E: 1.337070 6 04 83 80 7a 10 6e
E: 1.340806 6 04 83 80 7a 10 6e
E: 1.345873 6 04 83 80 7a 10 6e
E: 1.349751 6 04 83 80 7a 10 6e
E: 1.354745 6 04 83 80 7a 10 6e
E: 1.359068 6 04 83 80 7a 10 6e
E: 1.363892 6 04 83 80 7a 10 6e
E: 1.368089 6 04 83 80 7a 10 6e
E: 1.371960 6 04 83 80 7a 10 6e
E: 1.376954 6 04 83 80 7a 10 6e
E: 1.380957 6 04 83 80 7a 10 6e
E: 1.385950 6 04 83 80 7a 10 6e
E: 1.389952 6 04 83 80 7a 10 6e
E: 1.394955 6 04 83 80 7a 10 6e
E: 1.398950 6 04 83 80 7a 10 6e
E: 1.403953 6 04 83 80 7a 10 6e
E: 1.407949 6 04 83 80 7a 10 6e
E: 1.412953 6 04 83 80 7a 10 6e
E: 1.416953 6 04 83 80 7a 10 6e
E: 1.421950 6 04 83 80 7a 10 6e
E: 1.425953 6 04 83 80 7a 10 6e
E: 1.429951 6 04 83 80 7a 10 6e
E: 1.434953 6 04 83 80 7a 10 6e
E: 1.438956 6 04 83 80 7a 10 6e
E: 1.443949 6 04 83 80 7a 10 6e
E: 1.447949 6 04 83 80 7a 10 6e
E: 1.452952 6 04 83 80 7a 10 6e
E: 1.456956 6 04 83 80 7a 10 6e
E: 1.461947 6 04 83 80 7a 10 6e
E: 1.465952 6 04 83 80 7a 10 6e
E: 1.470954 6 04 83 80 7a 10 6e
E: 1.474955 6 04 83 80 7a 10 6e
E: 1.479957 6 04 83 80 7a 10 6e
E: 1.483951 6 04 83 80 7a 10 6e
E: 1.487952 6 04 83 80 7a 10 6e
E: 1.492954 6 04 83 80 7a 10 6e
E: 1.496957 6 04 83 80 7a 10 6e
E: 1.501951 6 04 83 80 7a 10 6e
E: 1.505949 6 04 83 80 7a 10 6e
E: 1.510952 6 04 83 80 7a 10 6e
E: 1.514949 6 04 83 80 7a 10 6e
E: 1.519949 6 04 83 80 7a 10 6e
E: 1.523953 6 04 83 80 7a 10 6e
E: 1.527945 6 04 83 80 7a 10 6e
E: 1.532948 6 04 83 80 7a 10 6e
E: 1.536950 6 04 83 80 7a 10 6e
E: 1.541953 6 04 83 80 7a 10 6e
E: 1.545949 6 04 83 80 7a 10 6e
E: 1.550947 6 04 83 80 7a 10 6e
E: 1.554947 6 04 83 80 7a 10 6e
E: 1.559957 6 04 83 80 7a 10 6e
E: 1.563949 6 04 83 80 7a 10 6e
E: 1.568953 6 04 83 80 7a 10 6e
E: 1.572949 6 04 83 80 7a 10 6e
E: 1.576951 6 04 83 80 7a 10 6e
E: 1.581955 6 04 83 80 7a 10 6e
E: 1.585951 6 04 83 80 7a 10 6e
E: 1.590956 6 04 83 80 7a 10 6e
E: 1.594948 6 04 83 80 7a 10 6e
E: 1.599956 6 04 83 80 7a 10 6e
E: 1.603948 6 04 83 80 7a 10 6e
E: 1.608948 6 04 83 80 7a 10 6e
E: 1.612949 6 04 83 80 7a 10 6e
E: 1.617950 6 04 83 80 7a 10 6e
E: 1.621955 6 04 83 80 7a 10 6e
E: 1.626949 6 04 83 80 7a 10 6e
E: 1.630950 6 04 83 80 7a 10 6e
E: 1.634947 6 04 83 80 7a 10 6e
E: 1.639949 6 04 83 80 7a 10 6e
E: 1.643955 6 04 83 80 7a 10 6e
E: 1.648947 6 04 83 80 7a 10 6e
E: 1.652950 6 04 83 80 7a 10 6e
E: 1.657953 6 04 83 80 7a 10 6e
E: 1.661948 6 04 83 80 7a 10 6e
E: 1.666952 6 04 83 80 7a 10 6e
E: 1.670954 6 04 83 80 7a 10 6e
E: 1.676419 6 04 83 a0 7a 30 6e
E: 1.679958 6 04 83 a0 7a 30 6e
E: 1.686256 6 04 83 b0 7a 50 6e
E: 1.688803 6 04 83 b0 7a 50 6e
E: 1.692954 6 04 83 b0 7a 50 6e
E: 1.697766 6 04 83 b0 7a 50 6e
E: 1.701743 6 04 83 b0 7a 50 6e
E: 1.707066 6 04 83 b0 7a 50 6e
E: 1.710870 6 04 83 b0 7a 50 6e
E: 1.715873 6 04 83 b0 7a 50 6e
E: 1.719836 6 04 83 b0 7a 50 6e
E: 1.725219 6 04 83 b0 7a 50 6e
E: 1.729070 6 04 83 b0 7a 50 6e
E: 1.733070 6 04 83 b0 7a 50 6e
E: 1.738069 6 04 83 b0 7a 50 6e
E: 1.742032 6 04 83 b0 7a 50 6e
E: 1.747068 6 04 83 b0 7a 50 6e
E: 1.750948 6 04 83 b0 7a 50 6e
E: 1.755952 6 04 83 b0 7a 50 6e
E: 1.760065 6 04 83 b0 7a 50 6e
E: 1.764878 6 04 83 b0 7a 50 6e
E: 1.768745 6 04 83 b0 7a 50 6e
E: 1.774065 6 04 83 b0 7a 50 6e
E: 1.778060 6 04 83 b0 7a 50 6e
E: 1.783066 6 04 83 b0 7a 50 6e
E: 1.787060 6 04 83 b0 7a 50 6e
E: 1.791105 6 04 83 90 7a 50 6e
E: 1.795953 6 04 83 90 7a 50 6e
E: 1.799770 6 04 83 90 7a 50 6e
E: 1.804745 6 04 83 90 7a 50 6e
E: 1.809061 6 04 83 90 7a 50 6e
E: 1.814017 6 04 83 90 7a 50 6e
E: 1.818070 6 04 83 90 7a 50 6e
E: 1.823065 6 04 83 90 7a 50 6e
E: 1.827065 6 04 83 90 7a 50 6e
E: 1.832061 6 04 83 90 7a 50 6e
E: 1.836065 6 04 83 90 7a 50 6e
E: 1.841063 6 04 83 90 7a 50 6e
E: 1.845063 6 04 83 90 7a 50 6e
E: 1.849063 6 04 83 90 7a 50 6e
E: 1.853747 6 04 83 90 7a 50 6e
E: 1.858067 6 04 83 90 7a 50 6e
E: 1.863063 6 04 83 90 7a 50 6e
E: 1.867063 6 04 83 90 7a 50 6e
E: 1.872064 6 04 83 90 7a 50 6e
E: 1.876058 6 04 83 90 7a 50 6e
E: 1.881061 6 04 83 90 7a 50 6e
E: 1.885065 6 04 83 90 7a 50 6e
E: 1.890090 6 04 83 90 7a 50 6e
E: 1.894066 6 04 83 90 7a 50 6e
E: 1.898065 6 04 83 90 7a 50 6e
E: 1.903061 6 04 83 90 7a 50 6e
E: 1.907062 6 04 83 90 7a 50 6e
E: 1.912063 6 04 83 90 7a 50 6e
E: 1.935106 6 04 83 80 7a 60 6e
E: 1.936885 6 04 82 80 7a 60 6e
# 2. Land one finger,
   - land a second finger far enough from the first
   - move your two fingers
   - release the *first* finger
   - release the second finger
E: 8.512030 6 04 83 b0 0f 60 71
E: 8.516849 6 04 83 b0 0f 60 71
E: 8.520704 6 04 83 b0 0f 60 71
E: 8.525906 6 04 83 b0 0f 60 71
E: 8.530019 6 04 83 b0 0f 60 71
E: 8.535016 6 04 83 b0 0f 60 71
E: 8.539019 6 04 83 b0 0f 60 71
E: 8.544012 6 04 83 b0 0f 60 71
E: 8.548014 6 04 83 b0 0f 60 71
E: 8.553020 6 04 83 b0 0f 60 71
E: 8.557016 6 04 83 b0 0f 60 71
E: 8.561019 6 04 83 b0 0f 60 71
E: 8.566024 6 04 83 b0 0f 60 71
E: 8.570012 6 04 83 b0 0f 60 71
E: 8.575012 6 04 83 b0 0f 60 71
E: 8.579018 6 04 83 b0 0f 60 71
E: 8.584016 6 04 83 b0 0f 60 71
E: 8.588014 6 04 83 b0 0f 60 71
E: 8.593029 6 04 83 b0 0f 60 71
E: 8.596905 6 04 83 b0 0f 60 71
E: 8.601839 6 04 83 b0 0f 60 71
E: 8.605909 6 04 83 b0 0f 60 71
E: 8.610788 6 04 83 b0 0f 60 71
E: 8.616783 6 04 83 b0 0f 60 71
E: 8.622924 6 04 83 b0 0f 60 71
E: 8.624234 6 04 83 b0 0f 60 71
E: 8.627710 6 04 83 b0 0f 60 71
E: 8.632791 6 04 83 b0 0f 60 71
E: 8.636705 6 04 83 b0 0f 60 71
E: 8.641697 6 04 83 b0 0f 60 71
E: 8.645882 6 04 83 b0 0f 60 71
E: 8.650905 6 04 83 b0 0f 60 71
E: 8.655014 6 04 83 b0 0f 60 71
E: 8.660019 6 04 83 b0 0f 60 71
E: 8.664015 6 04 83 b0 0f 60 71
E: 8.668912 6 04 83 b0 0f 60 71
E: 8.672805 6 04 83 b0 0f 60 71
E: 8.676791 6 04 83 b0 0f 60 71
E: 8.681827 6 04 83 b0 0f 60 71
E: 8.685903 6 04 83 b0 0f 60 71
E: 8.690826 6 04 83 b0 0f 60 71
E: 8.694706 6 04 83 b0 0f 60 71
E: 8.699770 6 04 83 b0 0f 60 71
E: 8.703840 6 04 83 b0 0f 60 71
E: 8.709018 6 04 83 b0 0f 60 71
E: 8.712897 6 04 83 b0 0f 60 71
E: 8.717902 6 04 83 b0 0f 60 71
E: 8.722012 6 04 83 b0 0f 60 71
E: 8.726016 6 04 83 b0 0f 60 71
E: 8.731011 6 04 83 b0 0f 60 71
E: 8.735054 6 04 83 b0 0f 80 71
E: 8.740015 6 04 83 b0 0f 80 71
E: 8.744053 6 04 83 b0 0f a0 71
E: 8.749021 6 04 83 b0 0f a0 71
E: 8.753016 6 04 83 b0 0f a0 71
E: 8.758016 6 04 83 b0 0f a0 71
E: 8.762017 6 04 83 b0 0f a0 71
E: 8.767015 6 04 83 b0 0f a0 71
E: 8.770906 6 04 83 b0 0f a0 71
E: 8.775902 6 04 83 b0 0f a0 71
E: 8.780019 6 04 83 b0 0f a0 71
E: 8.784016 6 04 83 b0 0f a0 71
E: 8.789021 6 04 83 b0 0f a0 71
E: 8.793012 6 04 83 b0 0f a0 71
E: 8.798023 6 04 83 b0 0f a0 71
E: 8.802018 6 04 83 b0 0f a0 71
E: 8.807011 6 04 83 b0 0f a0 71
E: 8.812016 6 04 83 b0 0f a0 71
E: 8.815926 6 04 83 b0 0f a0 71
E: 8.820907 6 04 83 b0 0f a0 71
E: 8.825906 6 04 83 b0 0f a0 71
E: 8.830015 6 04 83 b0 0f a0 71
E: 8.835012 6 04 83 b0 0f a0 71
E: 8.839021 6 04 83 b0 0f a0 71
E: 8.844020 6 04 83 b0 0f a0 71
E: 8.848012 6 04 83 b0 0f a0 71
E: 8.852020 6 04 83 b0 0f a0 71
E: 8.857015 6 04 83 b0 0f a0 71
E: 8.861004 6 04 83 b0 0f a0 71
E: 8.866058 6 04 83 c0 0f c0 71
E: 8.869912 6 04 83 c0 0f c0 71
E: 8.875021 6 04 83 c0 0f c0 71
E: 8.879012 6 04 83 c0 0f c0 71
E: 8.884016 6 04 83 c0 0f c0 71
E: 8.888011 6 04 83 c0 0f c0 71
E: 8.893019 6 04 83 c0 0f c0 71
E: 8.897014 6 04 83 c0 0f c0 71
E: 8.902016 6 04 83 c0 0f c0 71
E: 8.906020 6 04 83 c0 0f c0 71
E: 8.910018 6 04 83 c0 0f c0 71
E: 8.915012 6 04 83 c0 0f c0 71
E: 8.918906 6 04 83 c0 0f c0 71
E: 8.923909 6 04 83 c0 0f c0 71
E: 8.928016 6 04 83 c0 0f c0 71
E: 8.933011 6 04 83 c0 0f c0 71
E: 8.937014 6 04 83 c0 0f c0 71
E: 8.942017 6 04 83 c0 0f c0 71
E: 8.946015 6 04 83 c0 0f c0 71
E: 8.951013 6 04 83 c0 0f c0 71
E: 8.955008 6 04 83 c0 0f c0 71
E: 8.960011 6 04 83 c0 0f c0 71
E: 8.964017 6 04 83 c0 0f c0 71
E: 8.969013 6 04 83 c0 0f c0 71
E: 8.972892 6 04 83 c0 0f c0 71
E: 8.978013 6 04 83 c0 0f c0 71
E: 8.982010 6 04 83 c0 0f c0 71
E: 8.986010 6 04 83 c0 0f c0 71
E: 8.991011 6 04 83 c0 0f c0 71
E: 8.995013 6 04 83 c0 0f c0 71
E: 9.000012 6 04 83 c0 0f c0 71
E: 9.004018 6 04 83 c0 0f c0 71
E: 9.009016 6 04 83 c0 0f c0 71
E: 9.013014 6 04 83 c0 0f c0 71
E: 9.018059 6 04 83 c0 0f e0 71
E: 9.021907 6 04 83 c0 0f e0 71
E: 9.027023 6 04 83 c0 0f e0 71
E: 9.031011 6 04 83 c0 0f e0 71
E: 9.036013 6 04 83 c0 0f e0 71
E: 9.040010 6 04 83 c0 0f e0 71
E: 9.043969 6 04 83 c0 0f e0 71
E: 9.049020 6 04 83 c0 0f e0 71
E: 9.053013 6 04 83 c0 0f e0 71
E: 9.058013 6 04 83 c0 0f e0 71
E: 9.062012 6 04 83 c0 0f e0 71
E: 9.067020 6 04 83 c0 0f e0 71
E: 9.071017 6 04 83 c0 0f e0 71
E: 9.076010 6 04 83 c0 0f e0 71
E: 9.080013 6 04 83 c0 0f e0 71
E: 9.085016 6 04 83 c0 0f e0 71
E: 9.089017 6 04 83 c0 0f e0 71
E: 9.093894 6 04 83 c0 0f e0 71
E: 9.098009 6 04 83 c0 0f e0 71
E: 9.103009 6 04 83 c0 0f e0 71
E: 9.107012 6 04 83 c0 0f e0 71
E: 9.111012 6 04 83 c0 0f e0 71
E: 9.116013 6 04 83 c0 0f e0 71
E: 9.120014 6 04 83 c0 0f e0 71
E: 9.124898 6 04 83 c0 0f e0 71
E: 9.129011 6 04 83 c0 0f e0 71
E: 9.134011 6 04 83 c0 0f e0 71
E: 9.138018 6 04 83 c0 0f e0 71
E: 9.143014 6 04 83 c0 0f e0 71
E: 9.146952 6 04 83 c0 0f e0 71
E: 9.152010 6 04 83 c0 0f e0 71
E: 9.156016 6 04 83 c0 0f e0 71
E: 9.161005 6 04 83 c0 0f e0 71
E: 9.165015 6 04 83 c0 0f e0 71
E: 9.170012 6 04 83 c0 0f e0 71
E: 9.173832 6 04 83 c0 0f e0 71
E: 9.178017 6 04 83 c0 0f e0 71
E: 9.183014 6 04 83 c0 0f e0 71
E: 9.187010 6 04 83 c0 0f e0 71
E: 9.192010 6 04 83 c0 0f e0 71
E: 9.196011 6 04 83 c0 0f e0 71
E: 9.201014 6 04 83 c0 0f e0 71
E: 9.205011 6 04 83 c0 0f e0 71
E: 9.210017 6 04 83 c0 0f e0 71
E: 9.214014 6 04 83 c0 0f e0 71
E: 9.219013 6 04 83 c0 0f e0 71
E: 9.223015 6 04 83 c0 0f e0 71
E: 9.226931 6 04 83 c0 0f e0 71
E: 9.231901 6 04 83 c0 0f e0 71
E: 9.235900 6 04 83 c0 0f e0 71
E: 9.241013 6 04 83 c0 0f e0 71
E: 9.245012 6 04 83 c0 0f e0 71
E: 9.250010 6 04 83 c0 0f e0 71
E: 9.253913 6 04 83 c0 0f e0 71
E: 9.258800 6 04 83 c0 0f e0 71
E: 9.263009 6 04 83 c0 0f e0 71
E: 9.268013 6 04 83 c0 0f e0 71
E: 9.271904 6 04 83 c0 0f e0 71
E: 9.276751 6 04 83 c0 0f e0 71
E: 9.280815 6 04 83 c0 0f e0 71
E: 9.285698 6 04 83 c0 0f e0 71
E: 9.292885 6 04 83 c0 0f e0 71
E: 9.299898 6 04 83 c0 0f e0 71
E: 9.307009 6 04 83 c0 0f e0 71
E: 9.309052 6 04 87 20 6d 80 12
E: 9.315023 6 04 87 20 6d 80 12
E: 9.317015 6 04 83 c0 0f e0 71
E: 9.322019 6 04 83 c0 0f e0 71
E: 9.324011 6 04 87 20 6d 80 12
E: 9.328905 6 04 87 20 6d 80 12
E: 9.330905 6 04 83 c0 0f e0 71
E: 9.335905 6 04 83 c0 0f e0 71
E: 9.338019 6 04 87 20 6d 80 12
E: 9.344020 6 04 87 20 6d 80 12
E: 9.346020 6 04 83 c0 0f e0 71
E: 9.351017 6 04 83 c0 0f e0 71
E: 9.353013 6 04 87 20 6d 80 12
E: 9.358020 6 04 87 20 6d 80 12
E: 9.360002 6 04 83 c0 0f e0 71
E: 9.365706 6 04 83 c0 0f e0 71
E: 9.368015 6 04 87 20 6d 80 12
E: 9.373018 6 04 87 20 6d 80 12
E: 9.374820 6 04 83 c0 0f e0 71
E: 9.380015 6 04 83 c0 0f e0 71
E: 9.382016 6 04 87 20 6d 80 12
E: 9.387703 6 04 87 20 6d 80 12
E: 9.390013 6 04 83 c0 0f e0 71
E: 9.395017 6 04 83 c0 0f e0 71
E: 9.397011 6 04 87 20 6d 80 12
E: 9.402019 6 04 87 20 6d 80 12
E: 9.404018 6 04 83 c0 0f e0 71
E: 9.409017 6 04 83 c0 0f e0 71
E: 9.411018 6 04 87 20 6d 80 12
E: 9.417018 6 04 87 20 6d 80 12
E: 9.419012 6 04 83 c0 0f e0 71
E: 9.423818 6 04 83 c0 0f e0 71
E: 9.426011 6 04 87 20 6d 80 12
E: 9.430894 6 04 87 20 6d 80 12
E: 9.432898 6 04 83 c0 0f e0 71
E: 9.438902 6 04 83 c0 0f e0 71
E: 9.441019 6 04 87 20 6d 80 12
E: 9.446020 6 04 87 20 6d 80 12
E: 9.448016 6 04 83 c0 0f e0 71
E: 9.453014 6 04 83 c0 0f e0 71
E: 9.455016 6 04 87 20 6d 80 12
E: 9.461016 6 04 87 20 6d 80 12
E: 9.463017 6 04 83 c0 0f e0 71
E: 9.468019 6 04 83 c0 0f e0 71
E: 9.470015 6 04 87 20 6d 80 12
E: 9.475824 6 04 87 20 6d 80 12
E: 9.477777 6 04 83 c0 0f e0 71
E: 9.483012 6 04 83 c0 0f e0 71
E: 9.485020 6 04 87 20 6d 80 12
E: 9.491016 6 04 87 20 6d 80 12
E: 9.493017 6 04 83 c0 0f e0 71
E: 9.498017 6 04 83 c0 0f e0 71
E: 9.500017 6 04 87 20 6d 80 12
E: 9.505699 6 04 87 20 6d 80 12
E: 9.508018 6 04 83 c0 0f e0 71
E: 9.513014 6 04 83 c0 0f e0 71
E: 9.515016 6 04 87 20 6d 80 12
E: 9.521014 6 04 87 20 6d 80 12
E: 9.523010 6 04 83 c0 0f e0 71
E: 9.528015 6 04 83 c0 0f e0 71
E: 9.530014 6 04 87 20 6d 80 12
E: 9.535907 6 04 87 20 6d 80 12
E: 9.538014 6 04 83 c0 0f e0 71
E: 9.542969 6 04 83 c0 0f e0 71
E: 9.545020 6 04 87 20 6d 80 12
E: 9.551017 6 04 87 20 6d 80 12
E: 9.553020 6 04 83 c0 0f e0 71
E: 9.558023 6 04 83 c0 0f e0 71
E: 9.560009 6 04 87 20 6d 80 12
E: 9.566012 6 04 87 20 6d 80 12
E: 9.568012 6 04 83 c0 0f e0 71
E: 9.573014 6 04 83 c0 0f e0 71
E: 9.575020 6 04 87 20 6d 80 12
E: 9.580813 6 04 87 20 6d 80 12
E: 9.583016 6 04 83 c0 0f e0 71
E: 9.589013 6 04 83 c0 0f e0 71
E: 9.591010 6 04 87 20 6d 80 12
E: 9.596014 6 04 87 20 6d 80 12
E: 9.598015 6 04 83 c0 0f e0 71
E: 9.604014 6 04 83 c0 0f e0 71
E: 9.606018 6 04 87 20 6d 80 12
E: 9.611013 6 04 87 20 6d 80 12
E: 9.613009 6 04 83 c0 0f e0 71
E: 9.618694 6 04 83 c0 0f e0 71
E: 9.621020 6 04 87 20 6d 80 12
E: 9.626016 6 04 87 20 6d 80 12
E: 9.628010 6 04 83 c0 0f e0 71
E: 9.634019 6 04 83 c0 0f e0 71
E: 9.636026 6 04 87 20 6d 80 12
E: 9.640909 6 04 87 20 6d 80 12
E: 9.642843 6 04 83 c0 0f e0 71
E: 9.649016 6 04 83 c0 0f e0 71
E: 9.651016 6 04 87 20 6d 80 12
E: 9.656014 6 04 87 20 6d 80 12
E: 9.658007 6 04 83 c0 0f e0 71
E: 9.664019 6 04 83 c0 0f e0 71
E: 9.666011 6 04 87 20 6d 80 12
E: 9.671016 6 04 87 20 6d 80 12
E: 9.673009 6 04 83 c0 0f e0 71
E: 9.678816 6 04 83 c0 0f e0 71
E: 9.680701 6 04 87 20 6d 80 12
E: 9.685691 6 04 87 20 6d 80 12
E: 9.688015 6 04 83 c0 0f e0 71
E: 9.694018 6 04 83 c0 0f e0 71
E: 9.696015 6 04 87 20 6d 80 12
E: 9.701001 6 04 87 20 6d 80 12
E: 9.703017 6 04 83 c0 0f e0 71
E: 9.708693 6 04 83 c0 0f e0 71
E: 9.711018 6 04 87 20 6d 80 12
E: 9.716010 6 04 87 20 6d 80 12
E: 9.718012 6 04 83 c0 0f e0 71
E: 9.724014 6 04 83 c0 0f e0 71
E: 9.725935 6 04 87 20 6d 80 12
E: 9.731015 6 04 87 20 6d 80 12
E: 9.733017 6 04 83 c0 0f e0 71
E: 9.738905 6 04 83 c0 0f e0 71
E: 9.741018 6 04 87 20 6d 80 12
E: 9.746014 6 04 87 20 6d 80 12
E: 9.748017 6 04 83 c0 0f e0 71
E: 9.754016 6 04 83 c0 0f e0 71
E: 9.756011 6 04 87 20 6d 80 12
E: 9.761810 6 04 87 20 6d 80 12
E: 9.764014 6 04 83 c0 0f e0 71
E: 9.769011 6 04 83 c0 0f e0 71
E: 9.771009 6 04 87 20 6d 80 12
E: 9.777036 6 04 87 20 6d 80 12
E: 9.778816 6 04 83 c0 0f e0 71
E: 9.783695 6 04 83 c0 0f e0 71
E: 9.786012 6 04 87 20 6d 80 12
E: 9.792016 6 04 87 20 6d 80 12
E: 9.794014 6 04 83 c0 0f e0 71
E: 9.799012 6 04 83 c0 0f e0 71
E: 9.801010 6 04 87 20 6d 80 12
E: 9.807011 6 04 87 20 6d 80 12
E: 9.809017 6 04 83 c0 0f e0 71
E: 9.814015 6 04 83 c0 0f e0 71
E: 9.816011 6 04 87 20 6d 80 12
E: 9.822012 6 04 87 20 6d 80 12
E: 9.824009 6 04 83 c0 0f e0 71
E: 9.829010 6 04 83 c0 0f e0 71
E: 9.831010 6 04 87 20 6d 80 12
E: 9.837054 6 04 87 00 6d 90 12
E: 9.838909 6 04 83 c0 0f e0 71
E: 9.843903 6 04 83 c0 0f e0 71
E: 9.846010 6 04 87 00 6d 90 12
E: 9.852055 6 04 87 e0 6c b0 12
E: 9.854011 6 04 83 c0 0f e0 71
E: 9.858999 6 04 83 c0 0f e0 71
E: 9.861016 6 04 87 e0 6c b0 12
E: 9.866696 6 04 87 e0 6c b0 12
E: 9.869011 6 04 83 c0 0f e0 71
E: 9.873811 6 04 83 c0 0f e0 71
E: 9.876271 6 04 87 b0 6c c0 12
E: 9.881902 6 04 87 b0 6c c0 12
E: 9.884054 6 04 83 d0 0f b0 71
E: 9.888846 6 04 83 e0 0f 90 71
E: 9.891056 6 04 87 90 6c e0 12
E: 9.896823 6 04 87 90 6c e0 12
E: 9.898816 6 04 83 f0 0f 60 71
E: 9.904765 6 04 83 00 10 40 71
E: 9.907057 6 04 87 60 6c 00 13
E: 9.912055 6 04 87 40 6c 10 13
E: 9.914058 6 04 83 10 10 10 71
E: 9.920053 6 04 83 20 10 e0 70
E: 9.922054 6 04 87 10 6c 30 13
E: 9.927048 6 04 87 f0 6b 40 13
E: 9.929058 6 04 83 30 10 a0 70
E: 9.934868 6 04 83 40 10 70 70
E: 9.937040 6 04 87 d0 6b 50 13
E: 9.941882 6 04 87 a0 6b 70 13
E: 9.943937 6 04 83 50 10 30 70
E: 9.949944 6 04 83 60 10 00 70
E: 9.952056 6 04 87 80 6b 80 13
E: 9.957051 6 04 87 40 6b a0 13
E: 9.958903 6 04 83 80 10 c0 6f
E: 9.965056 6 04 83 90 10 90 6f
E: 9.967048 6 04 87 f0 6a c0 13
E: 9.972053 6 04 87 c0 6a d0 13
E: 9.974053 6 04 83 b0 10 50 6f
E: 9.980052 6 04 83 c0 10 20 6f
E: 9.982055 6 04 87 70 6a f0 13
E: 9.987052 6 04 87 40 6a 00 14
E: 9.989049 6 04 83 e0 10 d0 6e
E: 9.994814 6 04 83 00 11 80 6e
E: 9.996942 6 04 87 00 6a 20 14
E: 10.001936 6 04 87 b0 69 40 14
E: 10.003824 6 04 83 20 11 20 6e
E: 10.010063 6 04 83 40 11 e0 6d
E: 10.012045 6 04 87 70 69 50 14
E: 10.017055 6 04 87 20 69 60 14
E: 10.019047 6 04 83 60 11 90 6d
E: 10.025085 6 04 83 80 11 50 6d
E: 10.027049 6 04 87 d0 68 80 14
E: 10.032057 6 04 87 90 68 90 14
E: 10.034053 6 04 83 a0 11 00 6d
E: 10.039710 6 04 83 d0 11 b0 6c
E: 10.042002 6 04 87 40 68 b0 14
E: 10.046944 6 04 87 e0 67 d0 14
E: 10.048945 6 04 83 00 12 50 6c
E: 10.054945 6 04 83 30 12 f0 6b
E: 10.057048 6 04 87 70 67 f0 14
E: 10.062052 6 04 87 00 67 10 15
E: 10.064052 6 04 83 60 12 90 6b
E: 10.070051 6 04 83 90 12 30 6b
E: 10.072053 6 04 87 b0 66 30 15
E: 10.077048 6 04 87 50 66 50 15
E: 10.079053 6 04 83 d0 12 d0 6a
E: 10.085046 6 04 83 10 13 70 6a
E: 10.087052 6 04 87 e0 65 80 15
E: 10.091932 6 04 87 70 65 b0 15
E: 10.094051 6 04 83 40 13 00 6a
E: 10.099944 6 04 83 80 13 90 69
E: 10.102051 6 04 87 f0 64 e0 15
E: 10.107050 6 04 87 70 64 10 16
E: 10.108994 6 04 83 c0 13 20 69
E: 10.115062 6 04 83 00 14 b0 68
E: 10.117049 6 04 87 f0 63 40 16
E: 10.122709 6 04 87 70 63 70 16
E: 10.125056 6 04 83 40 14 30 68
E: 10.130054 6 04 83 80 14 b0 67
E: 10.132051 6 04 87 f0 62 b0 16
E: 10.138058 6 04 87 60 62 f0 16
E: 10.140050 6 04 83 c0 14 30 67
E: 10.145043 6 04 83 00 15 b0 66
E: 10.147072 6 04 87 e0 61 30 17
E: 10.152796 6 04 87 60 61 70 17
E: 10.155052 6 04 83 50 15 20 66
E: 10.160048 6 04 83 a0 15 90 65
E: 10.162055 6 04 87 e0 60 b0 17
E: 10.168055 6 04 87 50 60 f0 17
E: 10.170043 6 04 83 f0 15 00 65
E: 10.175050 6 04 83 40 16 70 64
E: 10.177055 6 04 87 c0 5f 40 18
E: 10.183050 6 04 87 30 5f 90 18
E: 10.185047 6 04 83 90 16 e0 63
E: 10.190055 6 04 83 e0 16 40 63
E: 10.192014 6 04 87 a0 5e e0 18
E: 10.197837 6 04 87 10 5e 30 19
E: 10.200053 6 04 83 30 17 b0 62
E: 10.204709 6 04 83 80 17 20 62
E: 10.207050 6 04 87 80 5d 80 19
E: 10.213048 6 04 87 f0 5c d0 19
E: 10.215051 6 04 83 e0 17 90 61
E: 10.220049 6 04 83 40 18 00 61
E: 10.221814 6 04 87 60 5c 30 1a
E: 10.227848 6 04 87 c0 5b 80 1a
E: 10.230051 6 04 83 90 18 70 60
E: 10.234710 6 04 83 e0 18 e0 5f
E: 10.237052 6 04 87 30 5b e0 1a
E: 10.243047 6 04 87 90 5a 40 1b
E: 10.245052 6 04 83 30 19 50 5f
E: 10.249940 6 04 83 80 19 c0 5e
E: 10.251931 6 04 87 f0 59 a0 1b
E: 10.257936 6 04 87 50 59 00 1c
E: 10.260045 6 04 83 d0 19 30 5e
E: 10.265048 6 04 83 20 1a a0 5d
E: 10.267046 6 04 87 b0 58 70 1c
E: 10.273052 6 04 87 10 58 e0 1c
E: 10.274928 6 04 83 70 1a 10 5d
E: 10.279742 6 04 83 b0 1a 80 5c
E: 10.281711 6 04 87 70 57 50 1d
E: 10.287954 6 04 87 d0 56 d0 1d
E: 10.290049 6 04 83 f0 1a f0 5b
E: 10.295051 6 04 83 30 1b 70 5b
E: 10.297046 6 04 87 30 56 50 1e
E: 10.303046 6 04 87 80 55 d0 1e
E: 10.305044 6 04 83 70 1b e0 5a
E: 10.309821 6 04 83 b0 1b 50 5a
E: 10.311821 6 04 87 d0 54 50 1f
E: 10.317811 6 04 87 20 54 d0 1f
E: 10.320052 6 04 83 f0 1b c0 59
E: 10.325047 6 04 83 30 1c 30 59
E: 10.327050 6 04 87 70 53 60 20
E: 10.333051 6 04 87 c0 52 00 21
E: 10.335051 6 04 83 70 1c a0 58
E: 10.340054 6 04 83 b0 1c 10 58
E: 10.342047 6 04 87 10 52 a0 21
E: 10.348050 6 04 87 60 51 40 22
E: 10.350044 6 04 83 f0 1c 80 57
E: 10.354941 6 04 83 30 1d f0 56
E: 10.357050 6 04 87 b0 50 f0 22
E: 10.362932 6 04 87 00 50 a0 23
E: 10.365051 6 04 83 70 1d 60 56
E: 10.370047 6 04 83 b0 1d d0 55
E: 10.372052 6 04 87 40 4f 60 24
E: 10.378050 6 04 87 80 4e 20 25
E: 10.380051 6 04 83 f0 1d 40 55
E: 10.385047 6 04 83 30 1e b0 54
E: 10.387054 6 04 87 c0 4d f0 25
E: 10.393051 6 04 87 10 4d c0 26
E: 10.395052 6 04 83 70 1e 20 54
E: 10.400046 6 04 83 c0 1e a0 53
E: 10.402053 6 04 87 60 4c a0 27
E: 10.407927 6 04 87 a0 4b 80 28
E: 10.410049 6 04 83 00 1f 20 53
E: 10.415052 6 04 83 50 1f a0 52
E: 10.417054 6 04 87 f0 4a 60 29
E: 10.423053 6 04 87 30 4a 50 2a
E: 10.425043 6 04 83 a0 1f 20 52
E: 10.430047 6 04 83 e0 1f a0 51
E: 10.432046 6 04 87 70 49 50 2b
E: 10.436705 6 04 87 b0 48 50 2c
E: 10.439046 6 04 83 20 20 20 51
E: 10.444827 6 04 83 60 20 a0 50
E: 10.446839 6 04 87 00 48 60 2d
E: 10.452139 6 04 87 50 47 70 2e
E: 10.453948 6 04 83 a0 20 20 50
E: 10.459193 6 04 83 e0 20 a0 4f
E: 10.461166 6 04 87 a0 46 80 2f
E: 10.466146 6 04 87 f0 45 a0 30
E: 10.468238 6 04 83 20 21 20 4f
E: 10.473146 6 04 83 50 21 c0 4e
E: 10.474726 6 04 87 40 45 c0 31
E: 10.479799 6 04 87 90 44 e0 32
E: 10.482047 6 04 83 90 21 60 4e
E: 10.486932 6 04 83 d0 21 00 4e
E: 10.488927 6 04 87 e0 43 00 34
E: 10.492744 6 04 87 40 43 20 35
E: 10.494721 6 04 83 10 22 90 4d
E: 10.499861 6 04 83 40 22 40 4d
E: 10.502048 6 04 87 a0 42 40 36
E: 10.505933 6 04 87 00 42 60 37
E: 10.508100 6 04 83 70 22 f0 4c
E: 10.512839 6 04 83 90 22 b0 4c
E: 10.514711 6 04 87 70 41 80 38
E: 10.519051 6 04 87 e0 40 a0 39
E: 10.521052 6 04 83 c0 22 60 4c
E: 10.525712 6 04 83 e0 22 30 4c
E: 10.528048 6 04 87 60 40 c0 3a
E: 10.532052 6 04 87 e0 3f d0 3b
E: 10.534054 6 04 83 10 23 f0 4b
E: 10.538049 6 04 83 30 23 c0 4b
E: 10.540051 6 04 87 70 3f e0 3c
E: 10.543708 6 04 87 00 3f f0 3d
E: 10.546050 6 04 83 50 23 80 4b
E: 10.550050 6 04 83 70 23 50 4b
E: 10.552047 6 04 87 a0 3e 00 3f
E: 10.555765 6 04 87 40 3e 10 40
E: 10.557929 6 04 83 90 23 10 4b
E: 10.560937 6 04 83 b0 23 e0 4a
E: 10.563042 6 04 87 e0 3d 20 41
E: 10.567049 6 04 87 80 3d 30 42
E: 10.569046 6 04 83 d0 23 a0 4a
E: 10.572704 6 04 83 f0 23 70 4a
E: 10.575044 6 04 87 30 3d 40 43
E: 10.579050 6 04 87 e0 3c 50 44
E: 10.581047 6 04 83 10 24 30 4a
E: 10.584705 6 04 83 20 24 00 4a
E: 10.587044 6 04 87 a0 3c 70 45
E: 10.590932 6 04 87 60 3c 80 46
E: 10.593049 6 04 83 40 24 c0 49
E: 10.596044 6 04 83 50 24 90 49
E: 10.598048 6 04 87 20 3c 90 47
E: 10.601712 6 04 87 f0 3b a0 48
E: 10.604050 6 04 83 70 24 50 49
E: 10.608045 6 04 83 80 24 20 49
E: 10.610045 6 04 87 c0 3b b0 49
E: 10.613711 6 04 87 90 3b c0 4a
E: 10.616044 6 04 83 90 24 e0 48
E: 10.620711 6 04 83 a0 24 b0 48
E: 10.623049 6 04 87 70 3b d0 4b
E: 10.627049 6 04 87 50 3b d0 4c
E: 10.629050 6 04 83 b0 24 60 48
E: 10.634048 6 04 83 c0 24 10 48
E: 10.636051 6 04 87 30 3b d0 4d
E: 10.640050 6 04 87 20 3b d0 4e
E: 10.642048 6 04 83 c0 24 b0 47
E: 10.646706 6 04 83 c0 24 50 47
E: 10.649049 6 04 87 10 3b d0 4f
E: 10.653904 6 04 87 00 3b d0 50
E: 10.656048 6 04 83 c0 24 f0 46
E: 10.660050 6 04 83 c0 24 90 46
E: 10.661933 6 04 87 00 3b d0 51
E: 10.666933 6 04 87 00 3b d0 52
E: 10.669046 6 04 83 c0 24 30 46
E: 10.674054 6 04 83 b0 24 d0 45
E: 10.676043 6 04 87 00 3b d0 53
E: 10.681049 6 04 87 10 3b c0 54
E: 10.683051 6 04 83 a0 24 70 45
E: 10.687048 6 04 83 90 24 20 45
E: 10.689053 6 04 87 20 3b c0 55
E: 10.694709 6 04 87 30 3b b0 56
E: 10.697049 6 04 83 80 24 e0 44
E: 10.702050 6 04 83 70 24 90 44
E: 10.704050 6 04 87 50 3b a0 57
E: 10.709048 6 04 87 70 3b 90 58
E: 10.711047 6 04 83 50 24 40 44
E: 10.716050 6 04 83 30 24 e0 43
E: 10.718043 6 04 87 a0 3b 90 59
E: 10.723045 6 04 87 d0 3b 80 5a
E: 10.725043 6 04 83 10 24 70 43
E: 10.731046 6 04 83 f0 23 00 43
E: 10.733044 6 04 87 00 3c 70 5b
E: 10.738042 6 04 87 40 3c 60 5c
E: 10.740051 6 04 83 c0 23 90 42
E: 10.746044 6 04 83 90 23 20 42
E: 10.748044 6 04 87 90 3c 50 5d
E: 10.753050 6 04 87 e0 3c 30 5e
E: 10.755048 6 04 83 60 23 b0 41
E: 10.761928 6 04 83 20 23 40 41
E: 10.763937 6 04 87 30 3d 10 5f
E: 10.767937 6 04 87 90 3d f0 5f
E: 10.770041 6 04 83 e0 22 d0 40
E: 10.777048 6 04 83 a0 22 60 40
E: 10.779052 6 04 87 f0 3d d0 60
E: 10.784050 6 04 87 50 3e a0 61
E: 10.786051 6 04 83 60 22 f0 3f
E: 10.792044 6 04 83 20 22 80 3f
E: 10.794048 6 04 87 c0 3e 70 62
E: 10.799047 6 04 87 30 3f 30 63
E: 10.801052 6 04 83 e0 21 10 3f
E: 10.807050 6 04 83 b0 21 c0 3e
E: 10.809043 6 04 87 a0 3f f0 63
E: 10.814049 6 04 87 10 40 a0 64
E: 10.816047 6 04 83 70 21 60 3e
E: 10.822045 6 04 83 30 21 00 3e
E: 10.824035 6 04 87 80 40 50 65
E: 10.829041 6 04 87 00 41 f0 65
E: 10.831047 6 04 83 f0 20 a0 3d
E: 10.837050 6 04 83 a0 20 40 3d
E: 10.839049 6 04 87 80 41 80 66
E: 10.843937 6 04 87 00 42 10 67
E: 10.846049 6 04 83 50 20 f0 3c
E: 10.852049 6 04 83 10 20 b0 3c
E: 10.854040 6 04 87 80 42 90 67
E: 10.859005 6 04 87 10 43 10 68
E: 10.861047 6 04 83 d0 1f 60 3c
E: 10.866935 6 04 83 80 1f 10 3c
E: 10.869045 6 04 87 a0 43 80 68
E: 10.873992 6 04 87 30 44 f0 68
E: 10.876042 6 04 83 30 1f d0 3b
E: 10.881936 6 04 83 f0 1e a0 3b
E: 10.884048 6 04 87 c0 44 50 69
E: 10.889047 6 04 87 50 45 b0 69
E: 10.891046 6 04 83 a0 1e 60 3b
E: 10.897044 6 04 83 50 1e 20 3b
E: 10.899047 6 04 87 e0 45 00 6a
E: 10.904045 6 04 87 80 46 50 6a
E: 10.906044 6 04 83 10 1e f0 3a
E: 10.912042 6 04 83 c0 1d c0 3a
E: 10.914050 6 04 87 20 47 90 6a
E: 10.919040 6 04 87 c0 47 c0 6a
E: 10.921048 6 04 83 70 1d 90 3a
E: 10.927050 6 04 83 30 1d 70 3a
E: 10.929048 6 04 87 60 48 f0 6a
E: 10.933862 6 04 87 00 49 20 6b
E: 10.936048 6 04 83 e0 1c 50 3a
E: 10.941705 6 04 83 80 1c 30 3a
E: 10.944050 6 04 87 a0 49 40 6b
E: 10.949048 6 04 87 40 4a 50 6b
E: 10.951045 6 04 83 40 1c 20 3a
E: 10.956889 6 04 83 f0 1b 00 3a
E: 10.959047 6 04 87 e0 4a 60 6b
E: 10.964041 6 04 87 80 4b 60 6b
E: 10.965926 6 04 83 b0 1b f0 39
E: 10.971936 6 04 83 60 1b e0 39
E: 10.974037 6 04 87 20 4c 60 6b
E: 10.979051 6 04 87 c0 4c 50 6b
E: 10.981046 6 04 83 00 1b d0 39
E: 10.987323 6 04 83 c0 1a c0 39
E: 10.988921 6 04 87 60 4d 30 6b
E: 10.993876 6 04 87 00 4e 10 6b
E: 10.995718 6 04 83 70 1a b0 39
E: 11.002043 6 04 83 10 1a b0 39
E: 11.004017 6 04 87 a0 4e e0 6a
E: 11.008802 6 04 87 40 4f a0 6a
E: 11.010813 6 04 83 b0 19 b0 39
E: 11.017041 6 04 83 50 19 b0 39
E: 11.019039 6 04 87 e0 4f 60 6a
E: 11.023809 6 04 87 80 50 20 6a
E: 11.025788 6 04 83 00 19 b0 39
E: 11.031796 6 04 83 d0 18 b0 39
E: 11.033791 6 04 87 20 51 e0 69
E: 11.038781 6 04 87 c0 51 90 69
E: 11.040785 6 04 83 80 18 c0 39
E: 11.046787 6 04 83 30 18 e0 39
E: 11.048790 6 04 87 60 52 30 69
E: 11.053789 6 04 87 10 53 d0 68
E: 11.055781 6 04 83 d0 17 10 3a
E: 11.061787 6 04 83 70 17 40 3a
E: 11.063785 6 04 87 b0 53 60 68
E: 11.068673 6 04 87 50 54 f0 67
E: 11.070787 6 04 83 10 17 80 3a
E: 11.076722 6 04 83 b0 16 c0 3a
E: 11.078718 6 04 87 f0 54 70 67
E: 11.083712 6 04 87 90 55 e0 66
E: 11.085630 6 04 83 60 16 10 3b
E: 11.091830 6 04 83 10 16 60 3b
E: 11.093775 6 04 87 30 56 50 66
E: 11.098783 6 04 87 d0 56 b0 65
E: 11.100781 6 04 83 c0 15 b0 3b
E: 11.106790 6 04 83 70 15 10 3c
E: 11.108782 6 04 87 70 57 10 65
E: 11.113786 6 04 87 10 58 60 64
E: 11.115789 6 04 83 20 15 80 3c
E: 11.121783 6 04 83 d0 14 f0 3c
E: 11.123782 6 04 87 b0 58 b0 63
E: 11.128786 6 04 87 50 59 00 63
E: 11.130782 6 04 83 80 14 60 3d
E: 11.136790 6 04 83 30 14 d0 3d
E: 11.138785 6 04 87 f0 59 40 62
E: 11.143784 6 04 87 80 5a 80 61
E: 11.145787 6 04 83 e0 13 40 3e
E: 11.150787 6 04 83 90 13 c0 3e
E: 11.152802 6 04 87 10 5b c0 60
E: 11.157789 6 04 87 a0 5b 00 60
E: 11.159733 6 04 83 40 13 40 3f
E: 11.165648 6 04 83 f0 12 c0 3f
E: 11.168017 6 04 87 30 5c 30 5f
E: 11.172930 6 04 87 c0 5c 60 5e
E: 11.174931 6 04 83 a0 12 50 40
E: 11.179300 6 04 83 50 12 e0 40
E: 11.180929 6 04 87 50 5d 80 5d
E: 11.185933 6 04 87 e0 5d a0 5c
E: 11.188044 6 04 83 10 12 60 41
E: 11.193049 6 04 83 d0 11 e0 41
E: 11.195041 6 04 87 60 5e c0 5b
E: 11.200039 6 04 87 e0 5e e0 5a
E: 11.202043 6 04 83 90 11 70 42
E: 11.206040 6 04 83 50 11 00 43
E: 11.208042 6 04 87 60 5f f0 59
E: 11.213035 6 04 87 d0 5f 00 59
E: 11.215045 6 04 83 10 11 90 43
E: 11.219702 6 04 83 d0 10 20 44
E: 11.222046 6 04 87 40 60 10 58
E: 11.226043 6 04 87 b0 60 20 57
E: 11.228046 6 04 83 90 10 b0 44
E: 11.232045 6 04 83 50 10 40 45
E: 11.234043 6 04 87 20 61 40 56
E: 11.238703 6 04 87 90 61 60 55
E: 11.241042 6 04 83 10 10 d0 45
E: 11.245046 6 04 83 d0 0f 60 46
E: 11.247040 6 04 87 f0 61 80 54
E: 11.250045 6 04 87 50 62 a0 53
E: 11.251705 6 04 83 a0 0f 00 47
E: 11.256044 6 04 83 70 0f a0 47
E: 11.258046 6 04 87 b0 62 c0 52
E: 11.261702 6 04 87 10 63 f0 51
E: 11.264046 6 04 83 40 0f 40 48
E: 11.268054 6 04 83 10 0f e0 48
E: 11.270039 6 04 87 60 63 20 51
E: 11.273697 6 04 87 b0 63 50 50
E: 11.276047 6 04 83 e0 0e 80 49
E: 11.279925 6 04 83 c0 0e 20 4a
E: 11.282042 6 04 87 00 64 70 4f
E: 11.285043 6 04 87 50 64 a0 4e
E: 11.287041 6 04 83 a0 0e c0 4a
E: 11.290707 6 04 83 80 0e 60 4b
E: 11.293042 6 04 87 90 64 c0 4d
E: 11.297041 6 04 87 d0 64 f0 4c
E: 11.299044 6 04 83 60 0e 00 4c
E: 11.302704 6 04 83 50 0e a0 4c
E: 11.305040 6 04 87 10 65 20 4c
E: 11.309046 6 04 87 50 65 50 4b
E: 11.311040 6 04 83 40 0e 40 4d
E: 11.315704 6 04 83 30 0e e0 4d
E: 11.318046 6 04 87 90 65 80 4a
E: 11.322045 6 04 87 d0 65 a0 49
E: 11.324038 6 04 83 20 0e 80 4e
E: 11.329038 6 04 83 10 0e 20 4f
E: 11.331043 6 04 87 10 66 c0 48
E: 11.335039 6 04 87 50 66 e0 47
E: 11.337046 6 04 83 00 0e c0 4f
E: 11.341860 6 04 83 f0 0d 60 50
E: 11.343694 6 04 87 80 66 00 47
E: 11.348697 6 04 87 b0 66 30 46
E: 11.350702 6 04 83 e0 0d 10 51
E: 11.356019 6 04 83 d0 0d b0 51
E: 11.358046 6 04 87 e0 66 50 45
E: 11.362041 6 04 87 10 67 80 44
E: 11.364053 6 04 83 c0 0d 60 52
E: 11.368699 6 04 83 b0 0d 00 53
E: 11.371006 6 04 87 40 67 a0 43
E: 11.375905 6 04 87 70 67 d0 42
E: 11.377934 6 04 83 a0 0d a0 53
E: 11.383047 6 04 83 90 0d 40 54
E: 11.385038 6 04 87 a0 67 f0 41
E: 11.391040 6 04 87 d0 67 20 41
E: 11.393037 6 04 83 80 0d f0 54
E: 11.398040 6 04 83 70 0d a0 55
E: 11.400044 6 04 87 f0 67 40 40
E: 11.405043 6 04 87 10 68 70 3f
E: 11.407042 6 04 83 60 0d 50 56
E: 11.412044 6 04 83 50 0d 00 57
E: 11.414044 6 04 87 30 68 90 3e
E: 11.420097 6 04 87 50 68 b0 3d
E: 11.422037 6 04 83 40 0d b0 57
E: 11.427042 6 04 83 40 0d 60 58
E: 11.429037 6 04 87 70 68 d0 3c
E: 11.434697 6 04 87 90 68 f0 3b
E: 11.437045 6 04 83 40 0d 20 59
E: 11.442036 6 04 83 40 0d d0 59
E: 11.444246 6 04 87 b0 68 10 3b
E: 11.450043 6 04 87 d0 68 30 3a
E: 11.452044 6 04 83 40 0d 90 5a
E: 11.457037 6 04 83 40 0d 40 5b
E: 11.459044 6 04 87 f0 68 40 39
E: 11.465037 6 04 87 10 69 60 38
E: 11.467043 6 04 83 40 0d 00 5c
E: 11.472037 6 04 83 40 0d b0 5c
E: 11.474042 6 04 87 20 69 70 37
E: 11.479927 6 04 87 40 69 90 36
E: 11.481931 6 04 83 50 0d 70 5d
E: 11.486927 6 04 83 60 0d 30 5e
E: 11.489042 6 04 87 50 69 a0 35
E: 11.494932 6 04 87 60 69 b0 34
E: 11.497045 6 04 83 70 0d f0 5e
E: 11.502040 6 04 83 80 0d a0 5f
E: 11.504046 6 04 87 70 69 c0 33
E: 11.510044 6 04 87 80 69 e0 32
E: 11.512043 6 04 83 90 0d 60 60
E: 11.517047 6 04 83 a0 0d 10 61
E: 11.519040 6 04 87 90 69 f0 31
E: 11.525043 6 04 87 a0 69 10 31
E: 11.527037 6 04 83 b0 0d c0 61
E: 11.532038 6 04 83 d0 0d 70 62
E: 11.534037 6 04 87 b0 69 20 30
E: 11.540041 6 04 87 c0 69 40 2f
E: 11.542041 6 04 83 f0 0d 20 63
E: 11.547036 6 04 83 10 0e d0 63
E: 11.549039 6 04 87 d0 69 60 2e
E: 11.555043 6 04 87 d0 69 80 2d
E: 11.557046 6 04 83 30 0e 80 64
E: 11.562041 6 04 83 50 0e 20 65
E: 11.564044 6 04 87 d0 69 a0 2c
E: 11.570036 6 04 87 d0 69 c0 2b
E: 11.572047 6 04 83 70 0e d0 65
E: 11.577043 6 04 83 90 0e 80 66
E: 11.579041 6 04 87 d0 69 f0 2a
E: 11.584931 6 04 87 c0 69 20 2a
E: 11.587041 6 04 83 b0 0e 30 67
E: 11.592039 6 04 83 d0 0e d0 67
E: 11.594040 6 04 87 b0 69 50 29
E: 11.600035 6 04 87 a0 69 80 28
E: 11.602041 6 04 83 f0 0e 80 68
E: 11.608043 6 04 83 20 0f 20 69
E: 11.610035 6 04 87 90 69 b0 27
E: 11.615045 6 04 87 80 69 e0 26
E: 11.617042 6 04 83 50 0f c0 69
E: 11.623039 6 04 83 80 0f 60 6a
E: 11.625044 6 04 87 60 69 20 26
E: 11.630041 6 04 87 40 69 60 25
E: 11.632038 6 04 83 b0 0f 10 6b
E: 11.638044 6 04 83 f0 0f b0 6b
E: 11.640039 6 04 87 20 69 a0 24
E: 11.645038 6 04 87 00 69 e0 23
E: 11.647045 6 04 83 30 10 50 6c
E: 11.653042 6 04 83 70 10 f0 6c
E: 11.655035 6 04 87 e0 68 20 23
E: 11.660037 6 04 87 c0 68 60 22
E: 11.662040 6 04 83 b0 10 90 6d
E: 11.668042 6 04 83 f0 10 30 6e
E: 11.670040 6 04 87 90 68 b0 21
E: 11.676017 6 04 87 60 68 00 21
E: 11.676913 6 04 83 30 11 d0 6e
E: 11.683311 6 04 83 70 11 60 6f
E: 11.684932 6 04 87 30 68 50 20
E: 11.689716 6 04 87 00 68 b0 1f
E: 11.691935 6 04 83 b0 11 f0 6f
E: 11.696925 6 04 83 f0 11 70 70
E: 11.698928 6 04 87 d0 67 10 1f
E: 11.705037 6 04 87 90 67 70 1e
E: 11.707045 6 04 83 20 12 d0 70
E: 11.712044 6 04 83 50 12 30 71
E: 11.714038 6 04 87 50 67 e0 1d
E: 11.719045 6 04 87 10 67 50 1d
E: 11.721040 6 04 83 90 12 90 71
E: 11.726047 6 04 83 c0 12 e0 71
E: 11.728044 6 04 87 d0 66 c0 1c
E: 11.734039 6 04 87 90 66 40 1c
E: 11.736045 6 04 83 f0 12 30 72
E: 11.741039 6 04 83 20 13 70 72
E: 11.743039 6 04 87 50 66 c0 1b
E: 11.748047 6 04 87 10 66 40 1b
E: 11.750040 6 04 83 50 13 b0 72
E: 11.756038 6 04 83 90 13 00 73
E: 11.758042 6 04 87 c0 65 d0 1a
E: 11.763039 6 04 87 90 65 70 1a
E: 11.765044 6 04 83 c0 13 30 73
E: 11.770040 6 04 83 f0 13 70 73
E: 11.771917 6 04 87 50 65 10 1a
E: 11.778040 6 04 87 00 65 c0 19
E: 11.780055 6 04 83 10 14 a0 73
E: 11.784931 6 04 83 40 14 d0 73
E: 11.786926 6 04 87 b0 64 60 19
E: 11.791931 6 04 87 50 64 00 19
E: 11.794040 6 04 83 70 14 00 74
E: 11.799036 6 04 83 b0 14 30 74
E: 11.801038 6 04 87 f0 63 b0 18
E: 11.807044 6 04 87 a0 63 70 18
E: 11.809044 6 04 83 e0 14 50 74
E: 11.814039 6 04 83 20 15 70 74
E: 11.816044 6 04 87 50 63 30 18
E: 11.821043 6 04 87 f0 62 f0 17
E: 11.823035 6 04 83 60 15 a0 74
E: 11.829044 6 04 83 90 15 c0 74
E: 11.831038 6 04 87 80 62 c0 17
E: 11.836044 6 04 87 10 62 90 17
E: 11.838081 6 04 83 c0 15 d0 74
E: 11.842703 6 04 83 00 16 f0 74
E: 11.845037 6 04 87 c0 61 70 17
E: 11.850044 6 04 87 50 61 50 17
E: 11.852041 6 04 83 50 16 10 75
E: 11.858041 6 04 83 80 16 20 75
E: 11.860038 6 04 87 e0 60 40 17
E: 11.865041 6 04 87 60 60 30 17
E: 11.867045 6 04 83 c0 16 30 75
E: 11.871985 6 04 83 10 17 40 75
E: 11.874039 6 04 87 e0 5f 30 17
E: 11.880038 6 04 87 60 5f 30 17
E: 11.882040 6 04 83 60 17 50 75
E: 11.886954 6 04 83 90 17 60 75
E: 11.888928 6 04 87 e0 5e 40 17
E: 11.893927 6 04 87 60 5e 60 17
E: 11.896045 6 04 83 d0 17 60 75
E: 11.901042 6 04 83 10 18 60 75
E: 11.903034 6 04 87 e0 5d 90 17
E: 11.909042 6 04 87 60 5d d0 17
E: 11.911044 6 04 83 40 18 60 75
E: 11.916040 6 04 83 80 18 60 75
E: 11.918039 6 04 87 e0 5c 20 18
E: 11.923037 6 04 87 50 5c 70 18
E: 11.925038 6 04 83 b0 18 60 75
E: 11.930996 6 04 83 f0 18 50 75
E: 11.933037 6 04 87 c0 5b d0 18
E: 11.937700 6 04 87 30 5b 40 19
E: 11.940044 6 04 83 30 19 30 75
E: 11.945036 6 04 83 60 19 20 75
E: 11.947044 6 04 87 a0 5a c0 19
E: 11.953038 6 04 87 10 5a 40 1a
E: 11.954882 6 04 83 a0 19 00 75
E: 11.960039 6 04 83 d0 19 e0 74
E: 11.962042 6 04 87 80 59 d0 1a
E: 11.967035 6 04 87 00 59 70 1b
E: 11.969044 6 04 83 10 1a c0 74
E: 11.974044 6 04 83 40 1a a0 74
E: 11.976041 6 04 87 80 58 10 1c
E: 11.982045 6 04 87 00 58 b0 1c
E: 11.984041 6 04 83 70 1a 70 74
E: 11.988960 6 04 83 b0 1a 40 74
E: 11.990928 6 04 87 80 57 60 1d
E: 11.995933 6 04 87 10 57 10 1e
E: 11.998036 6 04 83 e0 1a 10 74
E: 12.004048 6 04 83 10 1b e0 73
E: 12.006040 6 04 87 a0 56 c0 1e
E: 12.011038 6 04 87 30 56 70 1f
E: 12.013039 6 04 83 30 1b c0 73
E: 12.018043 6 04 83 60 1b 80 73
E: 12.020034 6 04 87 c0 55 30 20
E: 12.026035 6 04 87 50 55 00 21
E: 12.028045 6 04 83 90 1b 40 73
E: 12.032808 6 04 83 c0 1b f0 72
E: 12.034706 6 04 87 e0 54 d0 21
E: 12.040842 6 04 87 70 54 b0 22
E: 12.043038 6 04 83 f0 1b a0 72
E: 12.048036 6 04 83 20 1c 40 72
E: 12.050040 6 04 87 10 54 90 23
E: 12.056037 6 04 87 a0 53 80 24
E: 12.058039 6 04 83 50 1c e0 71
E: 12.063045 6 04 83 80 1c 70 71
E: 12.065059 6 04 87 40 53 70 25
E: 12.070810 6 04 87 e0 52 70 26
E: 12.073043 6 04 83 a0 1c 00 71
E: 12.077704 6 04 83 c0 1c 90 70
E: 12.080042 6 04 87 80 52 70 27
E: 12.085812 6 04 87 20 52 60 28
E: 12.087788 6 04 83 e0 1c 10 70
E: 12.092815 6 04 83 00 1d 90 6f
E: 12.094782 6 04 87 c0 51 50 29
E: 12.100781 6 04 87 70 51 40 2a
E: 12.102779 6 04 83 20 1d 00 6f
E: 12.107780 6 04 83 40 1d 60 6e
E: 12.109777 6 04 87 20 51 30 2b
E: 12.115783 6 04 87 e0 50 20 2c
E: 12.117780 6 04 83 60 1d c0 6d
E: 12.122781 6 04 83 80 1d 20 6d
E: 12.124777 6 04 87 a0 50 00 2d
E: 12.130775 6 04 87 60 50 e0 2d
E: 12.132778 6 04 83 a0 1d 70 6c
E: 12.137777 6 04 83 c0 1d c0 6b
E: 12.139778 6 04 87 30 50 c0 2e
E: 12.145774 6 04 87 00 50 a0 2f
E: 12.147777 6 04 83 e0 1d 10 6b
E: 12.152782 6 04 83 00 1e 60 6a
E: 12.154780 6 04 87 d0 4f 80 30
E: 12.160780 6 04 87 b0 4f 50 31
E: 12.162774 6 04 83 20 1e b0 69
E: 12.167775 6 04 83 40 1e 10 69
E: 12.169777 6 04 87 90 4f 20 32
E: 12.175778 6 04 87 70 4f f0 32
E: 12.177780 6 04 83 70 1e 70 68
E: 12.182775 6 04 83 a0 1e d0 67
E: 12.184780 6 04 87 50 4f c0 33
E: 12.190782 6 04 87 30 4f 80 34
E: 12.192781 6 04 83 d0 1e 30 67
E: 12.197776 6 04 83 00 1f 90 66
E: 12.199779 6 04 87 20 4f 50 35
E: 12.205777 6 04 87 10 4f 10 36
E: 12.207782 6 04 83 30 1f f0 65
E: 12.212776 6 04 83 60 1f 50 65
E: 12.214776 6 04 87 00 4f d0 36
E: 12.220749 6 04 87 f0 4e 80 37
E: 12.222775 6 04 83 80 1f b0 64
E: 12.227782 6 04 83 a0 1f 10 64
E: 12.229780 6 04 87 f0 4e 30 38
E: 12.235779 6 04 87 f0 4e e0 38
E: 12.237781 6 04 83 d0 1f 70 63
E: 12.242896 6 04 83 00 20 d0 62
E: 12.245052 6 04 87 f0 4e 80 39
E: 12.250886 6 04 87 f0 4e 20 3a
E: 12.252697 6 04 83 30 20 20 62
E: 12.257695 6 04 83 60 20 70 61
E: 12.259891 6 04 87 00 4f c0 3a
E: 12.265820 6 04 87 10 4f 50 3b
E: 12.267693 6 04 83 90 20 c0 60
E: 12.272798 6 04 83 c0 20 10 60
E: 12.274778 6 04 87 20 4f e0 3b
E: 12.279799 6 04 87 30 4f 70 3c
E: 12.281796 6 04 83 00 21 60 5f
E: 12.287817 6 04 83 40 21 b0 5e
E: 12.289720 6 04 87 40 4f f0 3c
E: 12.294908 6 04 87 40 4f 50 3d
E: 12.296730 6 04 83 80 21 00 5e
E: 12.301923 6 04 83 c0 21 50 5d
E: 12.303697 6 04 87 50 4f c0 3d
E: 12.308688 6 04 87 60 4f 30 3e
E: 12.311030 6 04 83 10 22 a0 5c
E: 12.315853 6 04 83 60 22 00 5c
E: 12.318033 6 04 87 70 4f b0 3e
E: 12.323029 6 04 87 80 4f 10 3f
E: 12.324824 6 04 83 b0 22 60 5b
E: 12.329695 6 04 83 00 23 c0 5a
E: 12.332222 6 04 87 90 4f 70 3f
E: 12.336701 6 04 87 b0 4f e0 3f
E: 12.339028 6 04 83 50 23 20 5a
E: 12.343695 6 04 83 a0 23 80 59
E: 12.345779 6 04 87 d0 4f 50 40
E: 12.351039 6 04 87 f0 4f d0 40
E: 12.353034 6 04 83 f0 23 e0 58
E: 12.358039 6 04 83 50 24 50 58
E: 12.360033 6 04 87 10 50 40 41
E: 12.363693 6 04 87 20 50 a0 41
E: 12.366041 6 04 83 a0 24 c0 57
E: 12.371033 6 04 83 00 25 30 57
E: 12.373036 6 04 87 40 50 00 42
E: 12.377039 6 04 87 60 50 70 42
E: 12.379040 6 04 83 60 25 90 56
E: 12.383703 6 04 83 c0 25 00 56
E: 12.386039 6 04 87 80 50 e0 42
E: 12.391038 6 04 87 a0 50 30 43
E: 12.393029 6 04 83 20 26 70 55
E: 12.397032 6 04 83 80 26 e0 54
E: 12.398956 6 04 87 c0 50 90 43
E: 12.404032 6 04 87 f0 50 f0 43
E: 12.406041 6 04 83 e0 26 50 54
E: 12.410035 6 04 83 40 27 c0 53
E: 12.412035 6 04 87 20 51 60 44
E: 12.417031 6 04 87 40 51 b0 44
E: 12.419033 6 04 83 a0 27 40 53
E: 12.422835 6 04 83 00 28 c0 52
E: 12.425031 6 04 87 60 51 00 45
E: 12.430033 6 04 87 90 51 60 45
E: 12.432038 6 04 83 60 28 40 52
E: 12.435692 6 04 83 c0 28 c0 51
E: 12.438041 6 04 87 c0 51 c0 45
E: 12.441035 6 04 87 e0 51 10 46
E: 12.444940 6 04 83 20 29 40 51
E: 12.446811 6 04 83 80 29 d0 50
E: 12.448790 6 04 87 10 52 60 46
E: 12.452704 6 04 87 40 52 b0 46
E: 12.455040 6 04 83 e0 29 60 50
E: 12.459035 6 04 83 40 2a f0 4f
E: 12.461033 6 04 87 60 52 f0 46
E: 12.464698 6 04 87 90 52 40 47
E: 12.467035 6 04 83 90 2a 80 4f
E: 12.471196 6 04 83 f0 2a 10 4f
E: 12.472852 6 04 87 c0 52 90 47
E: 12.475883 6 04 87 f0 52 f0 47
E: 12.478297 6 04 83 40 2b a0 4e
E: 12.482088 6 04 83 90 2b 40 4e
E: 12.483861 6 04 87 20 53 50 48
E: 12.488222 6 04 87 40 53 a0 48
E: 12.489892 6 04 83 e0 2b e0 4d
E: 12.493887 6 04 83 30 2c 80 4d
E: 12.496236 6 04 87 70 53 f0 48
E: 12.500192 6 04 87 a0 53 50 49
E: 12.502203 6 04 83 80 2c 20 4d
E: 12.507951 6 04 83 d0 2c c0 4c
E: 12.508210 6 04 87 e0 53 b0 49
E: 12.510697 6 04 87 10 54 00 4a
E: 12.512786 6 04 83 20 2d 60 4c
E: 12.516654 6 04 83 70 2d 10 4c
E: 12.518915 6 04 87 40 54 50 4a
E: 12.522984 6 04 87 70 54 b0 4a
E: 12.524920 6 04 83 c0 2d b0 4b
E: 12.528921 6 04 83 10 2e 60 4b
E: 12.531033 6 04 87 b0 54 10 4b
E: 12.535032 6 04 87 e0 54 60 4b
E: 12.536973 6 04 83 60 2e 00 4b
E: 12.540034 6 04 83 a0 2e b0 4a
E: 12.542031 6 04 87 10 55 c0 4b
E: 12.545689 6 04 87 40 55 20 4c
E: 12.548031 6 04 83 e0 2e 50 4a
E: 12.551919 6 04 83 10 2f 10 4a
E: 12.553917 6 04 87 70 55 80 4c
E: 12.557914 6 04 87 a0 55 c0 4c
E: 12.559924 6 04 83 50 2f c0 49
E: 12.563926 6 04 83 90 2f 70 49
E: 12.566029 6 04 87 d0 55 10 4d
E: 12.570030 6 04 87 00 56 70 4d
E: 12.572035 6 04 83 d0 2f 20 49
E: 12.576033 6 04 83 00 30 f0 48
E: 12.578031 6 04 87 30 56 d0 4d
E: 12.582033 6 04 87 50 56 20 4e
E: 12.583917 6 04 83 40 30 b0 48
E: 12.588921 6 04 83 80 30 70 48
E: 12.590917 6 04 87 80 56 70 4e
E: 12.594926 6 04 87 b0 56 d0 4e
E: 12.597035 6 04 83 b0 30 40 48
E: 12.601035 6 04 83 e0 30 00 48
E: 12.603036 6 04 87 e0 56 30 4f
E: 12.607806 6 04 87 00 57 70 4f
E: 12.611281 6 04 83 00 31 d0 47
E: 12.614727 6 04 83 30 31 90 47
E: 12.616720 6 04 87 30 57 c0 4f
E: 12.621090 6 04 87 50 57 00 50
E: 12.623153 6 04 83 50 31 60 47
E: 12.627742 6 04 83 80 31 20 47
E: 12.629639 6 04 87 80 57 50 50
E: 12.633647 6 04 87 a0 57 90 50
E: 12.635636 6 04 83 a0 31 f0 46
E: 12.640778 6 04 83 d0 31 c0 46
E: 12.642774 6 04 87 d0 57 d0 50
E: 12.646784 6 04 87 f0 57 00 51
E: 12.648677 6 04 83 f0 31 90 46
E: 12.653788 6 04 83 00 32 70 46
E: 12.655716 6 04 87 10 58 40 51
E: 12.659992 6 04 87 30 58 70 51
E: 12.661670 6 04 83 20 32 40 46
E: 12.666668 6 04 83 30 32 20 46
E: 12.668981 6 04 87 50 58 b0 51
E: 12.674012 6 04 87 70 58 e0 51
E: 12.676003 6 04 83 40 32 00 46
E: 12.679969 6 04 83 40 32 00 46
E: 12.681878 6 04 87 80 58 00 52
E: 12.687003 6 04 87 90 58 20 52
E: 12.688886 6 04 83 60 32 e0 45
E: 12.692856 6 04 83 60 32 e0 45
E: 12.694856 6 04 87 90 58 20 52
E: 12.699895 6 04 87 c0 58 60 52
E: 12.701962 6 04 83 60 32 e0 45
E: 12.705838 6 04 83 70 32 b0 45
E: 12.708008 6 04 87 d0 58 80 52
E: 12.713160 6 04 87 e0 58 a0 52
E: 12.714968 6 04 83 70 32 b0 45
E: 12.719013 6 04 83 90 32 90 45
E: 12.720968 6 04 87 e0 58 a0 52
E: 12.726003 6 04 87 f0 58 c0 52
E: 12.727969 6 04 83 90 32 90 45
E: 12.732679 6 04 83 90 32 70 45
E: 12.734967 6 04 87 f0 58 c0 52
E: 12.739963 6 04 87 f0 58 c0 52
E: 12.741964 6 04 83 90 32 70 45
E: 12.746969 6 04 83 90 32 70 45
E: 12.749005 6 04 87 00 59 f0 52
E: 12.753007 6 04 87 10 59 10 53
E: 12.754968 6 04 83 90 32 70 45
E: 12.759680 6 04 83 90 32 50 45
E: 12.761969 6 04 87 10 59 10 53
E: 12.766009 6 04 87 20 59 30 53
E: 12.768010 6 04 83 90 32 30 45
E: 12.770965 6 04 87 20 59 30 53
E: 12.774638 6 04 87 20 59 30 53
E: 12.779900 6 04 87 20 59 30 53
E: 12.783972 6 04 87 20 59 30 53
E: 12.788857 6 04 87 20 59 30 53
E: 12.792856 6 04 87 20 59 30 53
E: 12.794899 6 04 83 70 32 c0 44
E: 12.797011 6 04 82 70 32 c0 44
E: 12.798821 6 04 87 20 59 30 53
E: 12.801671 6 04 87 20 59 30 53
E: 12.806964 6 04 87 20 59 30 53
E: 12.810852 6 04 87 20 59 30 53
E: 12.814966 6 04 87 20 59 30 53
E: 12.819814 6 04 87 20 59 30 53
E: 12.823849 6 04 87 20 59 30 53
E: 12.828853 6 04 87 20 59 30 53
E: 12.832853 6 04 87 20 59 30 53
E: 12.837967 6 04 87 20 59 30 53
E: 12.841961 6 04 87 20 59 30 53
E: 12.846857 6 04 87 20 59 30 53
E: 12.850910 6 04 87 20 59 30 53
E: 12.855850 6 04 87 20 59 30 53
E: 12.859852 6 04 87 20 59 30 53
E: 12.864924 6 04 87 20 59 30 53
E: 12.868963 6 04 87 20 59 30 53
E: 12.873962 6 04 87 20 59 30 53
E: 12.877830 6 04 87 20 59 30 53
E: 12.881766 6 04 87 20 59 30 53
E: 12.886691 6 04 87 20 59 30 53
E: 12.890848 6 04 87 20 59 30 53
E: 12.895848 6 04 87 20 59 30 53
E: 12.900097 6 04 87 20 59 30 53
E: 12.904970 6 04 87 20 59 30 53
E: 12.908969 6 04 87 20 59 30 53
E: 12.913855 6 04 87 20 59 30 53
E: 12.917850 6 04 87 20 59 30 53
E: 12.922967 6 04 87 20 59 30 53
E: 12.926964 6 04 87 20 59 30 53
E: 12.931960 6 04 87 20 59 30 53
E: 12.935970 6 04 87 20 59 30 53
E: 12.939963 6 04 87 20 59 30 53
E: 12.944860 6 04 87 20 59 30 53
E: 12.948918 6 04 87 20 59 30 53
E: 12.953966 6 04 87 20 59 30 53
E: 12.957965 6 04 87 20 59 30 53
E: 12.962968 6 04 87 20 59 30 53
E: 12.966970 6 04 87 20 59 30 53
E: 12.971963 6 04 87 20 59 30 53
E: 12.975957 6 04 87 20 59 30 53
E: 12.980741 6 04 87 20 59 30 53
E: 12.984850 6 04 87 20 59 30 53
E: 12.989965 6 04 87 20 59 30 53
E: 12.993962 6 04 87 20 59 30 53
E: 12.997963 6 04 87 20 59 30 53
E: 13.002813 6 04 87 20 59 30 53
E: 13.006859 6 04 87 20 59 30 53
E: 13.011905 6 04 87 20 59 30 53
E: 13.015966 6 04 87 20 59 30 53
E: 13.020970 6 04 87 20 59 30 53
E: 13.024961 6 04 87 20 59 30 53
E: 13.029971 6 04 87 20 59 30 53
E: 13.033967 6 04 87 20 59 30 53
E: 13.038967 6 04 87 20 59 30 53
E: 13.042804 6 04 87 20 59 30 53
E: 13.047723 6 04 87 20 59 30 53
E: 13.051732 6 04 87 20 59 30 53
E: 13.056966 6 04 87 20 59 30 53
E: 13.060967 6 04 87 20 59 30 53
E: 13.064962 6 04 87 20 59 30 53
E: 13.069965 6 04 87 20 59 30 53
E: 13.073968 6 04 87 20 59 30 53
E: 13.078962 6 04 87 20 59 30 53
E: 13.082970 6 04 87 20 59 30 53
E: 13.087965 6 04 87 20 59 30 53
E: 13.091964 6 04 87 20 59 30 53
E: 13.096961 6 04 87 20 59 30 53
E: 13.100971 6 04 87 20 59 30 53
E: 13.105761 6 04 87 20 59 30 53
E: 13.109858 6 04 87 20 59 30 53
E: 13.114854 6 04 87 20 59 30 53
E: 13.118856 6 04 87 20 59 30 53
E: 13.122972 6 04 87 20 59 30 53
E: 13.127963 6 04 87 20 59 30 53
E: 13.131966 6 04 87 20 59 30 53
E: 13.136974 6 04 87 20 59 30 53
E: 13.140810 6 04 87 20 59 30 53
E: 13.145964 6 04 87 20 59 30 53
E: 13.149853 6 04 87 20 59 30 53
E: 13.154959 6 04 87 20 59 30 53
E: 13.158963 6 04 87 20 59 30 53
E: 13.163968 6 04 87 20 59 30 53
E: 13.167962 6 04 87 20 59 30 53
E: 13.172926 6 04 87 20 59 30 53
E: 13.176858 6 04 87 20 59 30 53
E: 13.180853 6 04 87 20 59 30 53
E: 13.185963 6 04 87 20 59 30 53
E: 13.189970 6 04 87 20 59 30 53
E: 13.194967 6 04 87 20 59 30 53
E: 13.198968 6 04 87 20 59 30 53
E: 13.203857 6 04 87 20 59 30 53
E: 13.207649 6 04 87 20 59 30 53
E: 13.212964 6 04 87 20 59 30 53
E: 13.216961 6 04 87 20 59 30 53
E: 13.221851 6 04 87 20 59 30 53
E: 13.225860 6 04 87 20 59 30 53
E: 13.230858 6 04 87 20 59 30 53
E: 13.234892 6 04 87 30 59 50 53
E: 13.239851 6 04 87 30 59 50 53
E: 13.243912 6 04 87 30 59 70 53
E: 13.247848 6 04 87 30 59 70 53
E: 13.252960 6 04 87 30 59 70 53
E: 13.256967 6 04 87 30 59 70 53
E: 13.261961 6 04 87 30 59 70 53
E: 13.265960 6 04 87 30 59 70 53
E: 13.270963 6 04 87 30 59 70 53
E: 13.274967 6 04 87 30 59 70 53
E: 13.279962 6 04 87 30 59 70 53
E: 13.283987 6 04 87 30 59 70 53
E: 13.288959 6 04 87 30 59 70 53
E: 13.292965 6 04 87 30 59 70 53
E: 13.296961 6 04 87 30 59 70 53
E: 13.301966 6 04 87 30 59 70 53
E: 13.305960 6 04 87 30 59 70 53
E: 13.310788 6 04 87 30 59 70 53
E: 13.314772 6 04 87 00 59 60 53
E: 13.319728 6 04 87 00 59 60 53
E: 13.323679 6 04 87 d0 58 30 53
E: 13.329006 6 04 87 a0 58 10 53
E: 13.333006 6 04 87 80 58 f0 52
E: 13.338006 6 04 87 60 58 e0 52
E: 13.341968 6 04 87 60 58 e0 52
E: 13.346001 6 04 87 40 58 c0 52
E: 13.350960 6 04 87 40 58 c0 52
E: 13.354960 6 04 87 40 58 c0 52
E: 13.360009 6 04 87 00 58 a0 52
E: 13.364000 6 04 87 e0 57 90 52
E: 13.368796 6 04 87 e0 57 90 52
E: 13.372888 6 04 87 90 57 60 52
E: 13.377889 6 04 87 60 57 40 52
E: 13.381887 6 04 87 40 57 30 52
E: 13.386995 6 04 87 00 57 10 52
E: 13.391006 6 04 87 d0 56 f0 51
E: 13.396003 6 04 87 80 56 c0 51
E: 13.399997 6 04 87 40 56 a0 51
E: 13.403889 6 04 87 10 56 90 51
E: 13.408892 6 04 87 c0 55 60 51
E: 13.412894 6 04 87 90 55 40 51
E: 13.418000 6 04 87 40 55 10 51
E: 13.422006 6 04 87 00 55 f0 50
E: 13.426999 6 04 87 a0 54 c0 50
E: 13.430961 6 04 87 30 54 80 50
E: 13.435888 6 04 87 b0 53 30 50
E: 13.458006 6 04 87 c0 52 70 4f
E: 13.460001 6 04 86 c0 52 70 4f
# 3. Finally, move your ten fingers on the screen and release them.
E: 17.224855 6 04 83 40 10 60 69
E: 17.228745 6 04 83 40 10 60 69
E: 17.233724 6 04 83 40 10 60 69
E: 17.237676 6 04 83 40 10 60 69
E: 17.242091 6 04 83 50 10 30 69
E: 17.247098 6 04 83 60 10 00 69
E: 17.251201 6 04 83 70 10 c0 68
E: 17.256218 6 04 83 90 10 70 68
E: 17.260199 6 04 83 b0 10 20 68
E: 17.265224 6 04 83 c0 10 f0 67
E: 17.269204 6 04 83 d0 10 b0 67
E: 17.274242 6 04 83 e0 10 80 67
E: 17.278204 6 04 83 f0 10 40 67
E: 17.283212 6 04 83 00 11 00 67
E: 17.287245 6 04 83 10 11 d0 66
E: 17.292208 6 04 83 20 11 90 66
E: 17.296236 6 04 83 30 11 60 66
E: 17.300199 6 04 83 40 11 30 66
E: 17.305246 6 04 83 50 11 10 66
E: 17.309202 6 04 83 60 11 e0 65
E: 17.314248 6 04 83 70 11 a0 65
E: 17.318204 6 04 83 80 11 60 65
E: 17.323200 6 04 83 90 11 30 65
E: 17.327241 6 04 83 a0 11 00 65
E: 17.332199 6 04 83 c0 11 d0 64
E: 17.336386 6 04 83 d0 11 a0 64
E: 17.341200 6 04 83 e0 11 70 64
E: 17.345238 6 04 83 00 12 40 64
E: 17.350206 6 04 83 20 12 10 64
E: 17.354243 6 04 83 40 12 e0 63
E: 17.358201 6 04 83 50 12 c0 63
E: 17.363199 6 04 83 70 12 90 63
E: 17.367240 6 04 83 90 12 60 63
E: 17.372251 6 04 83 b0 12 40 63
E: 17.376240 6 04 83 d0 12 20 63
E: 17.381206 6 04 83 e0 12 00 63
E: 17.385242 6 04 83 00 13 e0 62
E: 17.390207 6 04 83 20 13 c0 62
E: 17.394235 6 04 83 40 13 90 62
E: 17.398208 6 04 83 60 13 70 62
E: 17.403206 6 04 83 80 13 40 62
E: 17.407238 6 04 83 a0 13 20 62
E: 17.412207 6 04 83 d0 13 00 62
E: 17.416239 6 04 83 00 14 e0 61
E: 17.421203 6 04 83 30 14 c0 61
E: 17.425237 6 04 83 60 14 a0 61
E: 17.430205 6 04 83 80 14 80 61
E: 17.434246 6 04 83 a0 14 60 61
E: 17.439208 6 04 83 c0 14 40 61
E: 17.443355 6 04 83 e0 14 20 61
E: 17.448248 6 04 83 00 15 00 61
E: 17.452208 6 04 83 20 15 f0 60
E: 17.456244 6 04 83 40 15 e0 60
E: 17.460820 6 04 83 40 15 e0 60
E: 17.465245 6 04 83 70 15 c0 60
E: 17.470206 6 04 83 90 15 b0 60
E: 17.474241 6 04 83 b0 15 a0 60
E: 17.479200 6 04 83 d0 15 a0 60
E: 17.483207 6 04 83 00 16 a0 60
E: 17.488238 6 04 83 30 16 a0 60
E: 17.492205 6 04 83 60 16 a0 60
E: 17.497242 6 04 83 80 16 a0 60
E: 17.501222 6 04 83 b0 16 a0 60
E: 17.505244 6 04 83 e0 16 a0 60
E: 17.510209 6 04 83 10 17 90 60
E: 17.514201 6 04 83 30 17 90 60
E: 17.519244 6 04 83 50 17 90 60
E: 17.523206 6 04 83 70 17 80 60
E: 17.528247 6 04 83 90 17 80 60
E: 17.531822 6 04 83 90 17 80 60
E: 17.537747 6 04 83 b0 17 70 60
E: 17.540827 6 04 83 b0 17 70 60
E: 17.546248 6 04 83 d0 17 70 60
E: 17.549823 6 04 83 d0 17 70 60
E: 17.553826 6 04 83 d0 17 70 60
E: 17.558824 6 04 83 d0 17 70 60
E: 17.562821 6 04 83 d0 17 70 60
E: 17.567827 6 04 83 d0 17 70 60
E: 17.571819 6 04 83 d0 17 70 60
E: 17.577242 6 04 83 f0 17 60 60
E: 17.580814 6 04 83 f0 17 60 60
E: 17.586239 6 04 83 10 18 60 60
E: 17.589816 6 04 83 10 18 60 60
E: 17.594821 6 04 83 10 18 60 60
E: 17.598819 6 04 83 10 18 60 60
E: 17.604243 6 04 83 30 18 60 60
E: 17.607828 6 04 83 30 18 60 60
E: 17.611820 6 04 83 30 18 60 60
E: 17.616818 6 04 83 30 18 60 60
E: 17.620831 6 04 83 30 18 60 60
E: 17.634236 6 04 83 30 18 20 60
E: 17.638407 6 04 83 20 18 e0 5f
E: 17.643204 6 04 83 10 18 90 5f
E: 17.666242 6 04 83 00 18 20 5f
E: 17.671197 6 04 83 f0 17 a0 5e
E: 17.675238 6 04 83 e0 17 10 5e
E: 17.680215 6 04 83 d0 17 80 5d
E: 17.684243 6 04 83 c0 17 f0 5c
E: 17.689207 6 04 83 b0 17 60 5c
E: 17.693192 6 04 83 b0 17 d0 5b
E: 17.698243 6 04 83 b0 17 50 5b
E: 17.703207 6 04 83 b0 17 e0 5a
E: 17.709238 6 04 83 b0 17 80 5a
E: 17.715242 6 04 83 c0 17 30 5a
E: 17.721207 6 04 83 d0 17 e0 59
E: 17.727243 6 04 83 f0 17 90 59
E: 17.732206 6 04 83 10 18 50 59
E: 17.739072 6 04 83 20 18 20 59
E: 17.745247 6 04 83 30 18 f0 58
E: 17.751201 6 04 83 40 18 d0 58
E: 17.753610 6 04 87 50 13 d0 69
E: 17.757818 6 04 87 50 13 d0 69
E: 17.760241 6 04 83 60 18 80 58
E: 17.764241 6 04 83 a0 18 00 58
E: 17.765817 6 04 87 50 13 d0 69
E: 17.769820 6 04 87 50 13 d0 69
E: 17.772200 6 04 83 e0 18 70 57
E: 17.777237 6 04 83 20 19 e0 56
E: 17.778823 6 04 87 50 13 d0 69
E: 17.782821 6 04 87 50 13 d0 69
E: 17.785239 6 04 83 70 19 50 56
E: 17.790205 6 04 83 a0 19 f0 55
E: 17.791821 6 04 87 50 13 d0 69
E: 17.796823 6 04 87 50 13 d0 69
E: 17.799249 6 04 83 e0 19 90 55
E: 17.803203 6 04 83 10 1a 40 55
E: 17.804822 6 04 87 50 13 d0 69
E: 17.809817 6 04 87 50 13 d0 69
E: 17.812247 6 04 83 30 1a 00 55
E: 17.822281 6 04 83 40 1a d0 54
E: 17.822624 6 04 87 50 13 d0 69
E: 17.822760 6 04 87 50 13 d0 69
E: 17.824994 6 04 83 50 1a b0 54
E: 17.829786 6 04 83 50 1a b0 54
E: 17.831785 6 04 87 50 13 d0 69
E: 17.836789 6 04 87 50 13 d0 69
E: 17.838982 6 04 83 70 1a 90 54
E: 17.842817 6 04 83 70 1a 90 54
E: 17.844821 6 04 87 50 13 d0 69
E: 17.849817 6 04 87 50 13 d0 69
E: 17.852232 6 04 83 70 1a 70 54
E: 17.857824 6 04 83 70 1a 70 54
E: 17.859814 6 04 87 50 13 d0 69
E: 17.865819 6 04 87 50 13 d0 69
E: 17.868232 6 04 83 90 1a 50 54
E: 17.873818 6 04 87 50 13 d0 69
E: 17.875817 6 04 83 90 1a 50 54
E: 17.878873 6 04 8b 00 1d 80 33
E: 17.882201 6 04 83 b0 1a 30 54
E: 17.883827 6 04 8b 00 1d 80 33
E: 17.885817 6 04 87 50 13 d0 69
E: 17.889824 6 04 8b 00 1d 80 33
E: 17.891817 6 04 87 50 13 d0 69
E: 17.893822 6 04 83 b0 1a 30 54
E: 17.897825 6 04 87 50 13 d0 69
E: 17.900235 6 04 83 d0 1a 10 54
E: 17.901820 6 04 8b 00 1d 80 33
E: 17.905820 6 04 83 d0 1a 10 54
E: 17.907820 6 04 8b 00 1d 80 33
E: 17.909817 6 04 87 50 13 d0 69
E: 17.915820 6 04 8b 00 1d 80 33
E: 17.917821 6 04 87 50 13 d0 69
E: 17.920235 6 04 83 e0 1a f0 53
E: 17.924822 6 04 87 50 13 d0 69
E: 17.926823 6 04 83 e0 1a f0 53
E: 17.928828 6 04 8b 00 1d 80 33
E: 17.933822 6 04 87 50 13 d0 69
E: 17.935820 6 04 83 e0 1a f0 53
E: 17.940490 6 04 8b 30 1d 80 33
E: 17.940784 6 04 8f 30 15 60 20
E: 17.945248 6 04 83 00 1b d0 53
E: 17.947482 6 04 8b 50 1d 80 33
E: 17.948821 6 04 8f 30 15 60 20
E: 17.950824 6 04 87 50 13 d0 69
E: 17.956505 6 04 8b 80 1d 80 33
E: 17.957822 6 04 8f 30 15 60 20
E: 17.959823 6 04 87 50 13 d0 69
E: 17.962206 6 04 83 20 1b c0 53
E: 17.967820 6 04 8f 30 15 60 20
E: 17.969822 6 04 87 50 13 d0 69
E: 17.978076 6 04 83 50 1b a0 53
E: 17.978335 6 04 8b c0 1d 80 33
E: 17.978790 6 04 87 50 13 d0 69
E: 17.980903 6 04 83 70 1b 80 53
E: 17.982806 6 04 8b f0 1d 80 33
E: 17.984642 6 04 8f 30 15 60 20
E: 17.990091 6 04 83 90 1b 70 53
E: 17.992211 6 04 8b 10 1e 80 33
E: 17.993763 6 04 8f 30 15 60 20
E: 17.995615 6 04 87 50 13 d0 69
E: 18.001821 6 04 8b 10 1e 80 33
E: 18.003819 6 04 8f 30 15 60 20
E: 18.006107 6 04 87 80 13 d0 69
E: 18.008196 6 04 83 d0 1b 50 53
E: 18.013104 6 04 8f 50 15 40 20
E: 18.015109 6 04 87 b0 13 d0 69
E: 18.017200 6 04 83 30 1c 20 53
E: 18.019484 6 04 8b 50 1e 70 33
E: 18.024102 6 04 87 d0 13 d0 69
E: 18.026362 6 04 83 90 1c e0 52
E: 18.028482 6 04 8b a0 1e 60 33
E: 18.030103 6 04 8f 80 15 20 20
E: 18.036233 6 04 83 00 1d a0 52
E: 18.038474 6 04 8b e0 1e 50 33
E: 18.040609 6 04 8f d0 15 00 20
E: 18.042039 6 04 87 00 14 e0 69
E: 18.047515 6 04 8b 40 1f 40 33
E: 18.049102 6 04 8f 00 16 e0 1f
E: 18.051108 6 04 87 40 14 e0 69
E: 18.053199 6 04 83 70 1d 60 52
E: 18.059104 6 04 8f 50 16 c0 1f
E: 18.061106 6 04 87 80 14 e0 69
E: 18.063193 6 04 83 f0 1d 10 52
E: 18.065515 6 04 8b b0 1f 30 33
E: 18.071107 6 04 87 d0 14 e0 69
E: 18.073192 6 04 83 50 1e e0 51
E: 18.075516 6 04 8b 00 20 20 33
E: 18.077109 6 04 8f b0 16 b0 1f
E: 18.083197 6 04 83 90 1e b0 51
E: 18.085512 6 04 8b 60 20 00 33
E: 18.087109 6 04 8f 00 17 a0 1f
E: 18.089104 6 04 87 20 15 e0 69
E: 18.095516 6 04 8b b0 20 f0 32
E: 18.097107 6 04 8f 60 17 90 1f
E: 18.099101 6 04 87 70 15 e0 69
E: 18.101193 6 04 83 f0 1e 80 51
E: 18.105792 6 04 8f c0 17 80 1f
E: 18.108102 6 04 87 b0 15 e0 69
E: 18.110198 6 04 83 50 1f 40 51
E: 18.112414 6 04 8b 10 21 d0 32
E: 18.118107 6 04 87 e0 15 e0 69
E: 18.120200 6 04 83 a0 1f 10 51
E: 18.122476 6 04 8b 80 21 b0 32
E: 18.124009 6 04 8f 20 18 70 1f
E: 18.130202 6 04 83 00 20 e0 50
E: 18.132484 6 04 8b e0 21 a0 32
E: 18.134108 6 04 8f 80 18 60 1f
E: 18.136041 6 04 87 20 16 e0 69
E: 18.142477 6 04 8b 50 22 80 32
E: 18.144040 6 04 8f d0 18 60 1f
E: 18.145786 6 04 87 50 16 e0 69
E: 18.147842 6 04 83 70 20 b0 50
E: 18.154107 6 04 8f 00 19 60 1f
E: 18.156100 6 04 87 a0 16 d0 69
E: 18.158192 6 04 83 f0 20 80 50
E: 18.160411 6 04 8b c0 22 60 32
E: 18.166103 6 04 87 d0 16 c0 69
E: 18.168190 6 04 83 70 21 50 50
E: 18.170476 6 04 8b 20 23 50 32
E: 18.172041 6 04 8f 30 19 60 1f
E: 18.178237 6 04 83 f0 21 10 50
E: 18.180480 6 04 8b 90 23 30 32
E: 18.182104 6 04 8f 70 19 50 1f
E: 18.184042 6 04 87 20 17 b0 69
E: 18.190482 6 04 8b e0 23 20 32
E: 18.192107 6 04 8f a0 19 40 1f
E: 18.194108 6 04 87 60 17 a0 69
E: 18.196094 6 04 83 80 22 d0 4f
E: 18.202102 6 04 8f c0 19 40 1f
E: 18.204107 6 04 87 90 17 90 69
E: 18.206201 6 04 83 f0 22 a0 4f
E: 18.208418 6 04 8b 50 24 00 32
E: 18.214111 6 04 87 f0 17 80 69
E: 18.216199 6 04 83 70 23 60 4f
E: 18.218476 6 04 8b d0 24 e0 31
E: 18.220044 6 04 8f 10 1a 30 1f
E: 18.226860 6 04 83 f0 23 20 4f
E: 18.228496 6 04 8b 60 25 c0 31
E: 18.230044 6 04 8f 40 1a 20 1f
E: 18.231785 6 04 87 60 18 70 69
E: 18.239523 6 04 8b c0 25 a0 31
E: 18.241100 6 04 8f 90 1a 10 1f
E: 18.243104 6 04 87 e0 18 60 69
E: 18.245237 6 04 83 80 24 e0 4e
E: 18.251104 6 04 8f d0 1a 00 1f
E: 18.253103 6 04 87 50 19 50 69
E: 18.255235 6 04 83 10 25 a0 4e
E: 18.257182 6 04 8b 40 26 80 31
E: 18.263107 6 04 87 c0 19 50 69
E: 18.265235 6 04 83 70 25 70 4e
E: 18.267478 6 04 8b c0 26 50 31
E: 18.269044 6 04 8f 00 1b f0 1e
E: 18.276249 6 04 83 f0 25 40 4e
E: 18.278479 6 04 8b 50 27 20 31
E: 18.280104 6 04 8f 20 1b f0 1e
E: 18.282109 6 04 87 30 1a 50 69
E: 18.288512 6 04 8b b0 27 00 31
E: 18.290106 6 04 8f 60 1b e0 1e
E: 18.292101 6 04 87 90 1a 50 69
E: 18.294232 6 04 83 80 26 10 4e
E: 18.301110 6 04 8f 90 1b d0 1e
E: 18.303110 6 04 87 f0 1a 50 69
E: 18.305236 6 04 83 20 27 e0 4d
E: 18.307483 6 04 8b 30 28 d0 30
E: 18.314108 6 04 87 30 1b 50 69
E: 18.316187 6 04 83 c0 27 b0 4d
E: 18.318483 6 04 8b b0 28 90 30
E: 18.320042 6 04 8f e0 1b c0 1e
E: 18.327236 6 04 83 60 28 80 4d
E: 18.329477 6 04 8b 40 29 60 30
E: 18.331104 6 04 8f 10 1c b0 1e
E: 18.333105 6 04 87 60 1b 50 69
E: 18.340517 6 04 8b d0 29 30 30
E: 18.342100 6 04 8f 40 1c a0 1e
E: 18.344101 6 04 87 90 1b 50 69
E: 18.345842 6 04 83 00 29 50 4d
E: 18.353102 6 04 8f 90 1c 90 1e
E: 18.355103 6 04 87 c0 1b 70 69
E: 18.357190 6 04 83 a0 29 30 4d
E: 18.359479 6 04 8b 60 2a 00 30
E: 18.366101 6 04 87 f0 1b 80 69
E: 18.368189 6 04 83 40 2a 10 4d
E: 18.370473 6 04 8b d0 2a e0 2f
E: 18.372109 6 04 8f f0 1c 90 1e
E: 18.380231 6 04 83 c0 2a 00 4d
E: 18.382478 6 04 8b 50 2b c0 2f
E: 18.384101 6 04 8f 50 1d 90 1e
E: 18.386104 6 04 87 30 1c b0 69
E: 18.393474 6 04 8b b0 2b b0 2f
E: 18.395096 6 04 8f b0 1d 90 1e
E: 18.397108 6 04 87 80 1c 10 6a
E: 18.398843 6 04 83 50 2b f0 4c
E: 18.406108 6 04 8f 10 1e a0 1e
E: 18.408101 6 04 87 d0 1c 80 6a
E: 18.410188 6 04 83 f0 2b d0 4c
E: 18.412471 6 04 8b 20 2c a0 2f
E: 18.420107 6 04 87 00 1d d0 6a
E: 18.422240 6 04 83 90 2c b0 4c
E: 18.424504 6 04 8b b0 2c 90 2f
E: 18.426036 6 04 8f 70 1e b0 1e
E: 18.434232 6 04 83 30 2d 90 4c
E: 18.436478 6 04 8b 40 2d 80 2f
E: 18.438105 6 04 8f b0 1e c0 1e
E: 18.439774 6 04 87 40 1d 40 6b
E: 18.448513 6 04 8b d0 2d 70 2f
E: 18.450106 6 04 8f e0 1e d0 1e
E: 18.451773 6 04 87 70 1d 90 6b
E: 18.454234 6 04 83 e0 2d 70 4c
E: 18.461102 6 04 8f 30 1f e0 1e
E: 18.463103 6 04 87 90 1d d0 6b
E: 18.465226 6 04 83 90 2e 40 4c
E: 18.467477 6 04 8b 60 2e 60 2f
E: 18.481110 6 04 87 c0 1d 30 6c
E: 18.483107 6 04 8f 90 1f 00 1f
E: 18.485227 6 04 83 40 2f 20 4c
E: 18.487479 6 04 8b 00 2f 50 2f
E: 18.500103 6 04 87 10 1e c0 6c
E: 18.502476 6 04 8b a0 2f 40 2f
E: 18.518108 6 04 8f d0 1f 10 1f
E: 18.520193 6 04 83 f0 2f 00 4c
E: 18.546228 6 04 83 c0 30 e0 4b
E: 18.548474 6 04 8b 50 30 40 2f
E: 18.550105 6 04 8f 40 20 60 1f
E: 18.552109 6 04 87 60 1e 40 6d
E: 18.565239 6 04 83 90 31 b0 4b
E: 18.583103 6 04 87 d0 1e d0 6d
E: 18.585224 6 04 83 60 32 90 4b
E: 18.612104 6 04 8f d0 20 c0 1f
E: 18.614104 6 04 87 30 1f 40 6e
E: 18.616190 6 04 83 30 33 70 4b
E: 18.618474 6 04 8b 10 31 20 2f
E: 18.651104 6 04 87 a0 1f c0 6e
E: 18.653191 6 04 83 d0 33 50 4b
E: 18.681230 6 04 83 90 34 30 4b
E: 18.683473 6 04 8b e0 31 e0 2e
E: 18.685189 6 04 8f 70 21 10 20
E: 18.687102 6 04 87 f0 1f 20 6f
E: 18.700235 6 04 83 50 35 10 4b
E: 18.719104 6 04 87 60 20 90 6f
E: 18.721198 6 04 83 00 36 00 4b
E: 18.748105 6 04 87 b0 20 e0 6f
E: 18.750192 6 04 83 b0 36 f0 4a
E: 18.752475 6 04 8b c0 32 70 2e
E: 18.766107 6 04 8f e0 21 50 20
E: 18.768192 6 04 83 30 37 e0 4a
E: 18.784224 6 04 83 90 37 e0 4a
E: 18.786105 6 04 8f 50 22 a0 20
E: 18.814102 6 04 8f c0 22 30 21
E: 18.816096 6 04 87 e0 20 00 70
E: 18.818189 6 04 83 00 38 e0 4a
E: 18.833103 6 04 87 10 21 20 70
E: 18.835101 6 04 8f 20 23 a0 21
E: 18.837191 6 04 83 50 38 e0 4a
E: 18.850844 6 04 87 10 21 20 70
E: 18.853096 6 04 8f 70 23 20 22
E: 18.855220 6 04 83 90 38 e0 4a
E: 18.880226 6 04 83 e0 38 e0 4a
E: 18.882481 6 04 8b a0 33 50 2e
E: 18.884104 6 04 8f c0 23 b0 22
E: 18.886104 6 04 87 20 21 00 70
E: 18.899099 6 04 8f 00 24 50 23
E: 18.901104 6 04 87 20 21 e0 6f
E: 18.916240 6 04 83 20 39 e0 4a
E: 18.917816 6 04 87 20 21 e0 6f
E: 18.920107 6 04 8f 30 24 f0 23
E: 18.945100 6 04 8f 60 24 80 24
E: 18.947099 6 04 87 00 21 90 6f
E: 18.949186 6 04 83 50 39 e0 4a
E: 18.963108 6 04 87 d0 20 30 6f
E: 18.965096 6 04 8f 90 24 20 25
E: 18.982105 6 04 87 b0 20 f0 6e
E: 18.984099 6 04 8f c0 24 e0 25
E: 19.009511 6 04 8b 70 34 d0 2e
E: 19.011099 6 04 87 70 20 60 6e
E: 19.013185 6 04 83 70 39 10 4b
E: 19.028101 6 04 87 40 20 f0 6d
E: 19.030102 6 04 8f f0 24 c0 26
E: 19.047106 6 04 87 00 20 60 6d
E: 19.049095 6 04 8f 10 25 b0 27
E: 19.074232 6 04 83 70 39 70 4b
E: 19.076474 6 04 8b 50 35 20 2f
E: 19.092100 6 04 87 a0 1f c0 6c
E: 19.094095 6 04 8f 20 25 b0 28
E: 19.096190 6 04 83 60 39 00 4c
E: 19.098477 6 04 8b 10 37 30 2e
E: 19.109105 6 04 8f 10 25 a0 29
E: 19.111479 6 04 8b 60 39 70 2c
E: 19.113104 6 04 87 30 1f 20 6c
E: 19.135107 6 04 8f f0 24 90 2a
E: 19.137475 6 04 8b d0 3b b0 2a
E: 19.139096 6 04 87 a0 1e 70 6b
E: 19.141192 6 04 83 20 39 b0 4c
E: 19.153095 6 04 87 10 1e c0 6a
E: 19.155098 6 04 8f d0 24 80 2b
E: 19.170099 6 04 87 a0 1d 40 6a
E: 19.172100 6 04 8f b0 24 30 2c
E: 19.174227 6 04 83 c0 38 70 4d
E: 19.196228 6 04 83 50 38 30 4e
E: 19.198101 6 04 8f 80 24 10 2d
E: 19.200472 6 04 8b e0 3e 90 29
E: 19.212098 6 04 8f 40 24 e0 2d
E: 19.214100 6 04 87 20 1d b0 69
E: 19.229095 6 04 87 90 1c 10 69
E: 19.231094 6 04 8f 10 24 80 2e
E: 19.245098 6 04 87 00 1c 70 68
E: 19.247095 6 04 8f c0 23 20 2f
E: 19.249182 6 04 83 c0 37 f0 4e
E: 19.261096 6 04 87 90 1b 00 68
E: 19.263097 6 04 8f 80 23 90 2f
E: 19.265222 6 04 83 10 37 a0 4f
E: 19.277100 6 04 87 20 1b 80 67
E: 19.279094 6 04 8f 30 23 00 30
E: 19.281184 6 04 83 60 36 40 50
E: 19.293097 6 04 8f f0 22 60 30
E: 19.295093 6 04 87 c0 1a e0 66
E: 19.297472 6 04 8b e0 46 70 29
E: 19.299480 6 04 8a e0 46 70 29
E: 19.309095 6 04 87 70 1a 20 66
E: 19.311097 6 04 8f a0 22 c0 30
E: 19.324099 6 04 87 20 1a 50 65
E: 19.326098 6 04 8f 60 22 00 31
E: 19.328186 6 04 83 a0 35 b0 50
E: 19.340100 6 04 87 e0 19 70 64
E: 19.342092 6 04 8f 30 22 30 31
E: 19.344221 6 04 83 d0 34 00 51
E: 19.347911 6 04 8b 70 44 e0 3f
E: 19.355093 6 04 87 b0 19 90 63
E: 19.357093 6 04 8f e0 21 70 31
E: 19.359184 6 04 83 10 34 30 51
E: 19.370095 6 04 8f a0 21 a0 31
E: 19.372186 6 04 83 80 33 50 51
E: 19.374497 6 04 8b 90 44 f0 3f
E: 19.376096 6 04 87 90 19 a0 62
E: 19.385507 6 04 8b e0 44 10 40
E: 19.387095 6 04 87 80 19 c0 61
E: 19.389098 6 04 8f 40 21 d0 31
E: 19.400508 6 04 8b 60 45 40 40
E: 19.402096 6 04 87 80 19 e0 60
E: 19.404100 6 04 8f d0 20 f0 31
E: 19.414096 6 04 8f 60 20 f0 31
E: 19.416190 6 04 83 f0 32 20 51
E: 19.418475 6 04 8b 00 46 70 40
E: 19.428094 6 04 8f 00 20 f0 31
E: 19.430185 6 04 83 50 32 b0 50
E: 19.432476 6 04 8b d0 46 90 40
E: 19.442225 6 04 83 c0 31 10 50
E: 19.444430 6 04 8b c0 47 b0 40
E: 19.446098 6 04 8f 90 1f e0 31
E: 19.456223 6 04 83 50 31 50 4f
E: 19.458474 6 04 8b d0 48 d0 40
E: 19.460095 6 04 8f 00 1f b0 31
E: 19.470502 6 04 8b e0 49 f0 40
E: 19.472099 6 04 8f 70 1e 70 31
E: 19.474224 6 04 83 f0 30 70 4e
E: 19.484103 6 04 8f 00 1e 40 31
E: 19.486182 6 04 83 b0 30 80 4d
E: 19.488472 6 04 8b 10 4b 20 41
E: 19.490102 6 04 87 d0 19 20 5f
E: 19.492093 6 04 86 d0 19 20 5f
E: 19.498092 6 04 8f 90 1d f0 30
E: 19.500181 6 04 83 80 30 80 4c
E: 19.502467 6 04 8b 30 4c 50 41
E: 19.504522 6 04 87 40 0e d0 2e
E: 19.512181 6 04 83 60 30 70 4b
E: 19.514500 6 04 8b 50 4d 80 41
E: 19.515814 6 04 87 40 0e d0 2e
E: 19.518096 6 04 8f 20 1d 90 30
E: 19.526230 6 04 83 50 30 70 4a
E: 19.528475 6 04 8b 70 4e b0 41
E: 19.529814 6 04 87 40 0e d0 2e
E: 19.532095 6 04 8f d0 1c 40 30
E: 19.541499 6 04 8b 90 4f f0 41
E: 19.542809 6 04 87 40 0e d0 2e
E: 19.545092 6 04 8f 90 1c 10 30
E: 19.547192 6 04 83 40 30 60 49
E: 19.555808 6 04 87 40 0e d0 2e
E: 19.558095 6 04 8f 50 1c c0 2f
E: 19.560187 6 04 83 40 30 60 48
E: 19.562464 6 04 8b 90 50 40 42
E: 19.570095 6 04 8f 20 1c 80 2f
E: 19.572180 6 04 83 50 30 60 47
E: 19.574498 6 04 8b 80 51 b0 42
E: 19.575816 6 04 87 40 0e d0 2e
E: 19.585229 6 04 83 60 30 70 46
E: 19.587468 6 04 8b 50 52 30 43
E: 19.589092 6 04 87 40 0e a0 2e
E: 19.591096 6 04 8f f0 1b 20 2f
E: 19.600219 6 04 83 70 30 80 45
E: 19.602474 6 04 8b 00 53 c0 43
E: 19.604089 6 04 87 40 0e 70 2e
E: 19.606091 6 04 8f d0 1b a0 2e
E: 19.615506 6 04 8b 90 53 60 44
E: 19.617100 6 04 87 40 0e 30 2e
E: 19.619096 6 04 8f c0 1b 10 2e
E: 19.621180 6 04 83 90 30 90 44
E: 19.629096 6 04 87 40 0e f0 2d
E: 19.631099 6 04 8f c0 1b 70 2d
E: 19.633187 6 04 83 a0 30 a0 43
E: 19.635497 6 04 8b 10 54 10 45
E: 19.645095 6 04 8f d0 1b d0 2c
E: 19.647185 6 04 83 d0 30 c0 42
E: 19.649471 6 04 8b 60 54 e0 45
E: 19.651099 6 04 87 40 0e 90 2d
E: 19.660236 6 04 83 10 31 e0 41
E: 19.662474 6 04 8b 90 54 c0 46
E: 19.664094 6 04 87 30 0e 20 2d
E: 19.666090 6 04 8f e0 1b 30 2c
E: 19.676224 6 04 83 70 31 10 41
E: 19.678471 6 04 8b a0 54 a0 47
E: 19.680098 6 04 87 20 0e a0 2c
E: 19.682092 6 04 8f f0 1b b0 2b
E: 19.692504 6 04 8b 90 54 90 48
E: 19.694093 6 04 87 10 0e 20 2c
E: 19.696092 6 04 8f 10 1c 20 2b
E: 19.698188 6 04 83 f0 31 40 40
E: 19.708100 6 04 87 00 0e b0 2b
E: 19.710093 6 04 8f 30 1c c0 2a
E: 19.712183 6 04 83 90 32 90 3f
E: 19.714500 6 04 8b 60 54 80 49
E: 19.725097 6 04 8f 70 1c 40 2a
E: 19.727185 6 04 83 40 33 f0 3e
E: 19.729464 6 04 8b 10 54 80 4a
E: 19.731092 6 04 87 00 0e 50 2b
E: 19.742231 6 04 83 10 34 80 3e
E: 19.744508 6 04 8b a0 53 80 4b
E: 19.746091 6 04 8f e0 1c c0 29
E: 19.759510 6 04 8b 00 53 80 4c
E: 19.761094 6 04 8f 60 1d 40 29
E: 19.763184 6 04 83 f0 34 30 3e
E: 19.776509 6 04 8b 50 52 70 4d
E: 19.778094 6 04 87 20 0e e0 2a
E: 19.780097 6 04 8f 00 1e c0 28
E: 19.782182 6 04 83 e0 35 10 3e
E: 19.793105 6 04 87 70 0e 70 2a
E: 19.795101 6 04 8f c0 1e 60 28
E: 19.797185 6 04 83 e0 36 10 3e
E: 19.811099 6 04 8f 80 1f 10 28
E: 19.813183 6 04 83 e0 37 30 3e
E: 19.815095 6 04 87 d0 0e f0 29
E: 19.828225 6 04 83 f0 38 70 3e
E: 19.830481 6 04 8b 60 51 90 4e
E: 19.832092 6 04 8f 50 20 d0 27
E: 19.856216 6 04 83 00 3a f0 3e
E: 19.858091 6 04 8f 20 21 e0 27
E: 19.860469 6 04 8b 20 50 d0 4f
E: 19.874103 6 04 83 00 3b 90 3f
E: 19.876179 6 04 87 50 0f 70 29
E: 19.877779 6 04 8f f0 21 00 28
E: 19.891095 6 04 87 f0 0f 00 29
E: 19.893093 6 04 8f c0 22 30 28
E: 19.895218 6 04 83 f0 3b 60 40
E: 19.897470 6 04 8b e0 4e 30 51
E: 19.919500 6 04 8b a0 4d 80 52
E: 19.921185 6 04 83 d0 3c 70 41
E: 19.936224 6 04 83 90 3d a0 42
E: 19.938467 6 04 8b 90 4c d0 53
E: 19.940094 6 04 87 60 10 b0 28
E: 19.954230 6 04 83 20 3e d0 43
E: 19.956459 6 04 8b b0 4b 10 55
E: 19.958096 6 04 87 c0 10 70 28
E: 19.982093 6 04 8f 80 23 70 28
E: 19.984215 6 04 83 90 3e 00 45
E: 19.999227 6 04 83 e0 3e 40 46
E: 20.016227 6 04 83 10 3f b0 47
E: 20.018467 6 04 8b 30 4b 20 56
E: 20.020091 6 04 87 00 11 40 28
E: 20.046222 6 04 83 30 3f c0 48
E: 20.061232 6 04 83 10 3f 20 4a
E: 20.078505 6 04 8b 40 4b c0 56
E: 20.080168 6 04 87 30 11 20 28
E: 20.082181 6 04 83 c0 3e c0 4b
E: 20.107317 6 04 83 50 3e 60 4d
E: 20.109092 6 04 8f e0 24 40 29
E: 20.111087 6 04 8e e0 24 40 29
E: 20.123221 6 04 83 a0 3d 10 4f
E: 20.125094 6 04 87 50 11 30 28
E: 20.140235 6 04 83 e0 3c c0 50
E: 20.142089 6 04 87 50 11 80 28
E: 20.167219 6 04 83 20 3c 50 52
E: 20.184093 6 04 87 20 11 20 29
E: 20.186177 6 04 83 30 3b 80 52
E: 20.200093 6 04 87 d0 10 e0 29
E: 20.202184 6 04 83 00 3a a0 51
E: 20.204494 6 04 8b e0 4c b0 56
E: 20.206481 6 04 8a e0 4c b0 56
E: 20.216223 6 04 83 c0 38 40 50
E: 20.218090 6 04 87 70 10 d0 2a
E: 20.221908 6 04 8b e0 54 a0 41
E: 20.233224 6 04 83 80 37 d0 4e
E: 20.235496 6 04 8b d0 54 80 41
E: 20.237087 6 04 87 00 10 d0 2b
E: 20.249496 6 04 8b e0 54 30 41
E: 20.251093 6 04 87 90 0f d0 2c
E: 20.253181 6 04 83 90 36 c0 4d
E: 20.277216 6 04 83 80 35 c0 4c
E: 20.279094 6 04 87 50 10 50 2e
E: 20.291503 6 04 8b f0 54 60 40
E: 20.306090 6 04 87 e0 11 80 30
E: 20.308187 6 04 83 90 34 30 4c
E: 20.310468 6 04 8b 00 55 20 3f
E: 20.313916 6 04 8f 50 5f 90 57
E: 20.333506 6 04 8f 30 5f a0 57
E: 20.335231 6 04 83 b0 33 10 4c
E: 20.350499 6 04 8b 00 55 60 3d
E: 20.352094 6 04 87 c0 13 20 33
E: 20.354211 6 04 83 00 33 40 4c
E: 20.366497 6 04 8f d0 5e 70 57
E: 20.368094 6 04 87 a0 15 e0 35
E: 20.370176 6 04 83 80 32 a0 4c
E: 20.372476 6 04 8b e0 54 40 3b
E: 20.395224 6 04 83 10 32 30 4d
E: 20.397086 6 04 87 70 17 90 38
E: 20.399471 6 04 8b 80 54 40 39
E: 20.411090 6 04 87 10 19 e0 3a
E: 20.413465 6 04 8f 10 5e e0 56
E: 20.427515 6 04 8f 20 5d 30 56
E: 20.456097 6 04 87 90 1a e0 3c
E: 20.458179 6 04 83 d0 31 d0 4d
E: 20.472500 6 04 8f d0 5b 80 55
E: 20.474213 6 04 83 d0 31 70 4e
E: 20.476467 6 04 8b b0 53 d0 36
E: 20.488093 6 04 87 10 1c 60 3e
E: 20.490473 6 04 8b 90 52 30 34
E: 20.517220 6 04 83 00 32 10 4f
E: 20.519094 6 04 87 a0 1d 60 3f
E: 20.533220 6 04 83 80 32 90 4f
E: 20.535494 6 04 8f b0 59 40 55
E: 20.548504 6 04 8f 10 57 70 55
E: 20.550179 6 04 83 20 33 d0 4f
E: 20.577509 6 04 8f a0 53 80 56
E: 20.579174 6 04 83 d0 33 e0 4f
E: 20.581084 6 04 87 40 1f 00 40
E: 20.593080 6 04 87 c0 20 30 40
E: 20.595212 6 04 83 80 34 c0 4f
E: 20.610228 6 04 83 30 35 70 4f
E: 20.612465 6 04 8f 40 50 10 58
E: 20.614492 6 04 8b a0 4f 70 2e
E: 20.616469 6 04 8a a0 4f 70 2e
E: 20.637220 6 04 83 e0 35 00 4f
E: 20.639089 6 04 87 20 22 10 40
E: 20.641466 6 04 8f 00 4d c0 59
E: 20.653224 6 04 83 a0 36 60 4e
E: 20.669215 6 04 83 70 37 90 4d
E: 20.671461 6 04 8f 40 4a c0 5b
E: 20.695497 6 04 8f f0 47 10 5d
E: 20.697175 6 04 83 30 38 a0 4c
E: 20.699086 6 04 87 80 23 a0 3f
E: 20.701689 6 04 8b 20 28 00 72
E: 20.713224 6 04 83 f0 38 80 4b
E: 20.731497 6 04 8f 20 46 80 5d
E: 20.732810 6 04 8b 20 28 00 72
E: 20.758095 6 04 87 c0 24 c0 3e
E: 20.760477 6 04 8f c0 44 50 5d
E: 20.762179 6 04 83 90 39 40 4a
E: 20.775095 6 04 8b 40 28 f0 71
E: 20.777465 6 04 8f b0 43 c0 5c
E: 20.792805 6 04 8b 40 28 f0 71
E: 20.795493 6 04 8f e0 42 f0 5b
E: 20.820494 6 04 8f 40 42 10 5b
E: 20.822188 6 04 83 10 3a e0 48
E: 20.857090 6 04 8b 60 28 f0 71
E: 20.859180 6 04 83 50 3a 50 47
E: 20.885500 6 04 8f a0 41 00 5a
E: 20.887176 6 04 83 40 3a c0 45
E: 20.889094 6 04 87 00 27 b0 3b
E: 20.891086 6 04 86 00 27 b0 3b
E: 20.904086 6 04 8b 40 28 b0 71
E: 20.906171 6 04 83 00 3a 20 44
E: 20.923090 6 04 8b f0 27 40 71
E: 20.925221 6 04 83 80 39 80 42
E: 20.927461 6 04 8f a0 40 b0 58
E: 20.952214 6 04 83 b0 38 10 41
E: 20.954500 6 04 8f 50 3f 20 57
E: 20.970487 6 04 8f e0 3d 60 55
E: 20.972089 6 04 8b 30 27 90 70
E: 20.974218 6 04 83 a0 37 90 3f
E: 20.976690 6 04 87 a0 47 90 72
E: 20.988805 6 04 87 a0 47 90 72
E: 20.991089 6 04 8b 20 26 b0 6f
E: 20.993173 6 04 83 60 36 10 3e
E: 20.995488 6 04 8f 40 3c 90 53
E: 21.020093 6 04 87 c0 47 80 72
E: 21.022085 6 04 8b e0 24 e0 6e
E: 21.024491 6 04 8f 90 3a c0 51
E: 21.038094 6 04 8b 70 23 10 6e
E: 21.040178 6 04 83 d0 34 80 3c
E: 21.042461 6 04 8f e0 38 00 50
E: 21.044087 6 04 87 10 48 60 72
E: 21.056217 6 04 83 10 33 10 3b
E: 21.058457 6 04 8f 40 37 70 4e
E: 21.060081 6 04 87 90 48 30 72
E: 21.062085 6 04 8b e0 21 50 6d
E: 21.075498 6 04 8f a0 35 10 4d
E: 21.077090 6 04 87 30 49 f0 71
E: 21.079087 6 04 8b 50 20 90 6c
E: 21.081175 6 04 83 50 31 c0 39
E: 21.091217 6 04 83 a0 2f b0 38
E: 21.093465 6 04 8f 20 34 f0 4b
E: 21.107212 6 04 83 10 2e d0 37
E: 21.109459 6 04 8f c0 32 00 4b
E: 21.122226 6 04 83 b0 2c 20 37
E: 21.124492 6 04 8f c0 31 50 4a
E: 21.140215 6 04 83 70 2b a0 36
E: 21.142467 6 04 8f d0 30 c0 49
E: 21.144090 6 04 87 00 4a 70 71
E: 21.158494 6 04 8f d0 2f 50 49
E: 21.160174 6 04 83 80 2a 40 36
E: 21.176092 6 04 87 00 4b b0 70
E: 21.178177 6 04 83 90 29 00 36
E: 21.180459 6 04 8f 10 2f 00 49
E: 21.182087 6 04 8b 70 1d 40 6b
E: 21.184081 6 04 8a 70 1d 40 6b
E: 21.193173 6 04 83 c0 28 e0 35
E: 21.195500 6 04 8f 50 2e c0 48
E: 21.210217 6 04 83 00 28 e0 35
E: 21.212466 6 04 8f a0 2d a0 48
E: 21.214088 6 04 87 10 4c c0 6f
E: 21.216686 6 04 8b 90 04 40 2e
E: 21.226217 6 04 83 70 27 e0 35
E: 21.228452 6 04 8f 00 2d a0 48
E: 21.229795 6 04 8b 90 04 40 2e
E: 21.242488 6 04 8f 80 2c a0 48
E: 21.243795 6 04 8b 90 04 40 2e
E: 21.246210 6 04 83 00 27 e0 35
E: 21.258085 6 04 8b 90 04 70 2e
E: 21.260177 6 04 83 a0 26 10 36
E: 21.262463 6 04 8f 20 2c a0 48
E: 21.272087 6 04 8b a0 04 c0 2e
E: 21.274213 6 04 83 50 26 60 36
E: 21.276458 6 04 8f d0 2b c0 48
E: 21.288214 6 04 83 10 26 c0 36
E: 21.290464 6 04 8f 80 2b 10 49
E: 21.292083 6 04 8b d0 04 40 2f
E: 21.303214 6 04 83 f0 25 40 37
E: 21.305490 6 04 8f 30 2b 80 49
E: 21.307083 6 04 8b 20 05 e0 2f
E: 21.309042 6 04 87 80 4e 70 6d
E: 21.311014 6 04 86 80 4e 70 6d
E: 21.318217 6 04 83 e0 25 e0 37
E: 21.320084 6 04 8b 80 05 90 30
E: 21.334494 6 04 8f 10 2b 20 4a
E: 21.336079 6 04 8b e0 05 60 31
E: 21.338167 6 04 83 f0 25 90 38
E: 21.347995 6 04 8b 60 06 30 32
E: 21.349826 6 04 83 20 26 50 39
E: 21.352155 6 04 8f 30 2b e0 4a
E: 21.355762 6 04 87 d0 54 70 3f
E: 21.363172 6 04 83 60 26 20 3a
E: 21.365490 6 04 8f 70 2b b0 4b
E: 21.366800 6 04 87 d0 54 70 3f
E: 21.369082 6 04 8b 00 07 00 33
E: 21.377214 6 04 83 c0 26 f0 3a
E: 21.378800 6 04 87 d0 54 70 3f
E: 21.381083 6 04 8b b0 07 d0 33
E: 21.392223 6 04 83 40 27 c0 3b
E: 21.394495 6 04 8f e0 2b a0 4c
E: 21.396088 6 04 8b 70 08 a0 34
E: 21.407495 6 04 87 b0 54 90 3f
E: 21.409082 6 04 8b 40 09 70 35
E: 21.411175 6 04 83 d0 27 90 3c
E: 21.413460 6 04 8f 80 2c 90 4d
E: 21.422086 6 04 8b 10 0a 30 36
E: 21.424215 6 04 83 60 28 60 3d
E: 21.426464 6 04 8f 30 2d 80 4e
E: 21.428460 6 04 87 70 54 d0 3f
E: 21.436217 6 04 83 00 29 30 3e
E: 21.438456 6 04 8f f0 2d 60 4f
E: 21.440466 6 04 87 20 54 20 40
E: 21.442082 6 04 8b f0 0a f0 36
E: 21.451216 6 04 83 b0 29 f0 3e
E: 21.453456 6 04 8f d0 2e 30 50
E: 21.455487 6 04 87 e0 53 50 40
E: 21.457089 6 04 8b e0 0b a0 37
E: 21.465489 6 04 8f a0 2f e0 50
E: 21.467459 6 04 87 80 53 a0 40
E: 21.469079 6 04 8b d0 0c 40 38
E: 21.471172 6 04 83 70 2a a0 3f
E: 21.478498 6 04 87 00 53 00 41
E: 21.480082 6 04 8b c0 0d d0 38
E: 21.482170 6 04 83 30 2b 50 40
E: 21.484489 6 04 8f 80 30 80 51
E: 21.492093 6 04 8b b0 0e 50 39
E: 21.494209 6 04 83 00 2c e0 40
E: 21.496461 6 04 8f 60 31 20 52
E: 21.498465 6 04 87 80 52 70 41
E: 21.505212 6 04 83 d0 2c 60 41
E: 21.507456 6 04 8f 50 32 b0 52
E: 21.509456 6 04 87 20 52 c0 41
E: 21.511083 6 04 8b a0 0f c0 39
E: 21.519208 6 04 83 a0 2d e0 41
E: 21.521455 6 04 8f 00 33 10 53
E: 21.523455 6 04 87 a0 51 20 42
E: 21.525082 6 04 8b 50 10 10 3a
E: 21.533466 6 04 8f 80 33 60 53
E: 21.535486 6 04 87 40 51 60 42
E: 21.537082 6 04 8b 00 11 60 3a
E: 21.539172 6 04 83 30 2e 40 42
E: 21.548488 6 04 87 e0 50 c0 42
E: 21.550079 6 04 8b c0 11 a0 3a
E: 21.552175 6 04 83 d0 2e a0 42
E: 21.554486 6 04 8f e0 33 a0 53
E: 21.559079 6 04 8b 70 12 d0 3a
E: 21.585213 6 04 83 10 30 50 43
E: 21.589866 6 04 82 10 30 50 43
E: 21.590159 6 04 87 20 50 90 43
E: 21.591469 6 04 86 20 50 90 43
E: 21.593107 6 04 8f c0 34 70 54
E: 21.595190 6 04 8e c0 34 70 54
E: 21.597021 6 04 8b d0 13 00 3b
E: 21.598758 6 04 8a d0 13 00 3b
# Thank you.
