R: 322 05 0d 09 04 a1 01 85 04 09 22 a1 00 09 42 15 00 25 01 75 01 95 01 81 02 09 32 15 00 25 01 81 02 09 51 75 05 95 01 16 00 00 26 10 00 81 02 09 47 75 01 95 01 15 00 25 01 81 02 05 01 09 30 75 10 95 01 55 0d 65 33 35 00 46 34 49 26 ff 7f 81 02 09 31 75 10 95 01 55 0d 65 33 35 00 46 37 29 26 ff 7f 81 02 05 0d 09 55 25 08 75 08 95 01 b1 02 c0 c0 05 01 09 01 a1 01 85 01 09 01 a1 00 05 09 19 01 29 02 15 00 25 01 95 02 75 01 81 02 95 01 75 06 81 01 05 01 09 30 09 31 16 00 00 26 ff 0f 36 00 00 46 ff 0f 66 00 00 75 10 95 02 81 02 c0 c0 06 00 ff 09 01 a1 01 09 01 15 00 26 ff 00 85 03 75 08 95 3f 81 02 06 00 ff 09 01 15 00 26 ff 00 75 08 95 3f 91 02 c0 05 0d 09 04 a1 01 85 02 09 20 a1 00 09 42 09 32 15 00 25 01 95 02 75 01 81 02 95 06 75 01 81 03 05 01 09 30 75 10 95 01 a4 55 0d 65 33 36 00 00 46 34 49 16 00 00 26 ff 0f 81 02 09 31 16 00 00 26 ff 0f 36 00 00 46 37 29 81 02 b4 c0 c0 05 0d 09 0e a1 01 85 05 09 22 a1 00 09 52 09 53 15 00 25 0a 75 08 95 02 b1 02 c0 c0
N: eGalax Inc. USB TouchController
P: usb-0000:00:06.0-2/input0
I: 3 0eef 7349
E: 0.000000 6 04 83 20 70 e0 6c
E: 0.003362 6 04 83 20 70 e0 6c
E: 0.015864 6 04 83 20 70 e0 6c
E: 0.019184 6 04 83 20 70 e0 6c
E: 0.019366 6 04 83 20 70 e0 6c
E: 0.021346 6 04 83 20 70 e0 6c
E: 0.023748 6 04 83 20 70 e0 6c
E: 0.026752 6 04 83 20 70 e0 6c
E: 0.035722 6 04 83 20 70 e0 6c
E: 0.040102 6 04 83 20 70 e0 6c
E: 0.042458 6 04 83 20 70 e0 6c
E: 0.047761 6 04 83 20 70 e0 6c
E: 0.051703 6 04 83 20 70 e0 6c
E: 0.056542 6 04 83 20 70 e0 6c
E: 0.059831 6 04 83 20 70 e0 6c
E: 0.064877 6 04 83 20 70 e0 6c
E: 0.068274 6 04 83 20 70 e0 6c
E: 0.071729 6 04 83 20 70 e0 6c
E: 0.074815 6 04 83 20 70 e0 6c
E: 0.077147 6 04 83 20 70 e0 6c
E: 0.083721 6 04 83 00 70 c0 6c
E: 0.092511 6 04 83 f0 6f a0 6c
E: 0.101437 6 04 83 c0 6f 50 6c
E: 0.114763 6 04 83 90 6f 10 6c
E: 0.120052 6 04 83 40 6f b0 6b
E: 0.170102 6 04 83 e0 6e 30 6b
E: 0.174096 6 04 83 90 6e d0 6a
E: 0.175696 6 04 83 30 6e 40 6a
E: 0.178706 6 04 83 b0 6d a0 69
E: 0.181584 6 04 83 50 6d 30 69
E: 0.184785 6 04 83 e0 6c a0 68
E: 0.192930 6 04 83 50 6c f0 67
E: 0.195728 6 04 83 f0 6b 70 67
E: 0.198778 6 04 83 70 6b d0 66
E: 0.206584 6 04 83 e0 6a 20 66
E: 0.214652 6 04 83 40 6a 70 65
E: 0.227350 6 04 83 d0 69 f0 64
E: 0.231011 6 04 83 40 69 50 64
E: 0.241415 6 04 83 a0 68 a0 63
E: 0.258566 6 04 83 00 68 f0 62
E: 0.261691 6 04 83 50 67 30 62
E: 0.265055 6 04 83 a0 66 70 61
E: 0.274073 6 04 83 f0 65 b0 60
E: 0.282738 6 04 83 30 65 f0 5f
E: 0.290828 6 04 83 70 64 30 5f
E: 0.299416 6 04 83 b0 63 60 5e
E: 0.312478 6 04 83 f0 62 90 5d
E: 0.316797 6 04 83 20 62 c0 5c
E: 0.326464 6 04 83 50 61 f0 5b
E: 0.335542 6 04 83 80 60 20 5b
E: 0.343786 6 04 83 a0 5f 50 5a
E: 0.352747 6 04 83 c0 5e 70 59
E: 0.366333 6 04 83 e0 5d 90 58
E: 0.368868 6 04 83 00 5d c0 57
E: 0.377543 6 04 83 10 5c e0 56
E: 0.386807 6 04 83 20 5b 10 56
E: 0.396024 6 04 83 30 5a 30 55
E: 0.404421 6 04 83 40 59 50 54
E: 0.410546 6 04 83 40 58 70 53
E: 0.421479 6 04 83 40 57 90 52
E: 0.429922 6 04 83 50 56 b0 51
E: 0.436490 6 04 83 50 55 e0 50
E: 0.446343 6 04 83 50 54 00 50
E: 0.455195 6 04 83 50 53 30 4f
E: 0.464658 6 04 83 60 52 50 4e
E: 0.473449 6 04 83 60 51 70 4d
E: 0.482065 6 04 83 60 50 90 4c
E: 0.489774 6 04 83 60 4f b0 4b
E: 0.498881 6 04 83 60 4e d0 4a
E: 0.507813 6 04 83 50 4d f0 49
E: 0.516827 6 04 83 40 4c 10 49
E: 0.528062 6 04 83 30 4b 30 48
E: 0.533480 6 04 83 20 4a 50 47
E: 0.542100 6 04 83 10 49 60 46
E: 0.550871 6 04 83 f0 47 70 45
E: 0.559809 6 04 83 d0 46 80 44
E: 0.568799 6 04 83 c0 45 90 43
E: 0.574792 6 04 83 b0 44 a0 42
E: 0.584791 6 04 83 a0 43 a0 41
E: 0.593796 6 04 83 90 42 a0 40
E: 0.602813 6 04 83 80 41 b0 3f
E: 0.612191 6 04 83 70 40 c0 3e
E: 0.617587 6 04 83 60 3f d0 3d
E: 0.630728 6 04 83 50 3e e0 3c
E: 0.634530 6 04 83 40 3d f0 3b
E: 0.643276 6 04 83 30 3c 00 3b
E: 0.652025 6 04 83 30 3b 10 3a
E: 0.661520 6 04 83 30 3a 20 39
E: 0.670244 6 04 83 30 39 30 38
E: 0.679438 6 04 83 30 38 40 37
E: 0.687971 6 04 83 30 37 60 36
E: 0.697156 6 04 83 40 36 80 35
E: 0.703073 6 04 83 50 35 a0 34
E: 0.713497 6 04 83 60 34 c0 33
E: 0.722083 6 04 83 80 33 e0 32
E: 0.731571 6 04 83 a0 32 10 32
E: 0.740237 6 04 83 d0 31 40 31
E: 0.749023 6 04 83 30 31 a0 30
E: 0.758670 6 04 83 80 30 f0 2f
E: 0.764180 6 04 83 c0 2f 40 2f
E: 0.774657 6 04 83 30 2f c0 2e
E: 0.783360 6 04 83 90 2e 20 2e
E: 0.792098 6 04 83 e0 2d 70 2d
E: 0.798046 6 04 83 60 2d f0 2c
E: 0.808472 6 04 83 d0 2c 60 2c
E: 0.817184 6 04 83 60 2c f0 2b
E: 0.825976 6 04 83 d0 2b 70 2b
E: 0.835472 6 04 83 70 2b 10 2b
E: 0.841373 6 04 83 f0 2a 90 2a
E: 0.851742 6 04 83 90 2a 30 2a
E: 0.860350 6 04 83 10 2a c0 29
E: 0.869095 6 04 83 b0 29 60 29
E: 0.878688 6 04 83 40 29 f0 28
E: 0.884309 6 04 83 c0 28 70 28
E: 0.894097 6 04 83 60 28 10 28
E: 0.903388 6 04 83 10 28 c0 27
E: 0.912277 6 04 83 b0 27 60 27
E: 0.921665 6 04 83 60 27 10 27
E: 0.934740 6 04 83 f0 26 a0 26
E: 0.939671 6 04 83 a0 26 50 26
E: 0.944514 6 04 83 30 26 e0 25
E: 0.953668 6 04 83 e0 25 90 25
E: 0.963817 6 04 83 70 25 20 25
E: 0.972771 6 04 83 20 25 d0 24
E: 0.981811 6 04 83 c0 24 60 24
E: 0.990680 6 04 83 70 24 10 24
E: 0.999328 6 04 83 30 24 d0 23
E: 1.005212 6 04 83 d0 23 70 23
E: 1.015936 6 04 83 90 23 20 23
E: 1.024806 6 04 83 30 23 b0 22
E: 1.033795 6 04 83 e0 22 60 22
E: 1.042783 6 04 83 80 22 f0 21
E: 1.048800 6 04 83 30 22 a0 21
E: 1.058814 6 04 83 f0 21 60 21
E: 1.067852 6 04 83 90 21 00 21
E: 1.076816 6 04 83 50 21 b0 20
E: 1.085821 6 04 83 f0 20 40 20
E: 1.091819 6 04 83 a0 20 f0 1f
E: 1.101750 6 04 83 70 20 b0 1f
E: 1.110748 6 04 83 10 20 50 1f
E: 1.119822 6 04 83 d0 1f 00 1f
E: 1.125791 6 04 83 70 1f 90 1e
E: 1.134696 6 04 83 20 1f 40 1e
E: 1.143724 6 04 83 f0 1e 00 1e
E: 1.152485 6 04 83 a0 1e a0 1d
E: 1.164452 6 04 83 60 1e 60 1d
E: 1.168997 6 04 83 30 1e 30 1d
E: 1.184530 6 04 83 e0 1d e0 1c
E: 1.186792 6 04 83 a0 1d a0 1c
E: 1.195529 6 04 83 70 1d 70 1c
E: 1.204203 6 04 83 50 1d 50 1c
E: 1.213086 6 04 83 00 1d 00 1c
E: 1.222028 6 04 83 d0 1c c0 1b
E: 1.232998 6 04 83 a0 1c 90 1b
E: 1.238457 6 04 83 80 1c 70 1b
E: 1.248827 6 04 83 40 1c 20 1b
E: 1.257857 6 04 83 10 1c e0 1a
E: 1.266800 6 04 83 e0 1b b0 1a
E: 1.272816 6 04 83 90 1b 60 1a
E: 1.282846 6 04 83 60 1b 20 1a
E: 1.291728 6 04 83 30 1b f0 19
E: 1.300552 6 04 83 10 1b d0 19
E: 1.309285 6 04 83 d0 1a 80 19
E: 1.316058 6 04 83 a0 1a 40 19
E: 1.325827 6 04 83 50 1a e0 18
E: 1.334822 6 04 83 10 1a 90 18
E: 1.343854 6 04 83 e0 19 60 18
E: 1.349812 6 04 83 c0 19 30 18
E: 1.359783 6 04 83 70 19 e0 17
E: 1.368450 6 04 83 30 19 a0 17
E: 1.377808 6 04 83 00 19 70 17
E: 1.386799 6 04 83 b0 18 20 17
E: 1.392819 6 04 83 70 18 e0 16
E: 1.402801 6 04 83 20 18 80 16
E: 1.411958 6 04 83 e0 17 30 16
E: 1.420640 6 04 83 b0 17 00 16
E: 1.429678 6 04 83 60 17 a0 15
E: 1.435413 6 04 83 20 17 60 15
E: 1.446420 6 04 83 f0 16 30 15
E: 1.454812 6 04 83 a0 16 e0 14
E: 1.463827 6 04 83 60 16 a0 14
E: 1.472747 6 04 83 30 16 70 14
E: 1.478781 6 04 83 e0 15 10 14
E: 1.488931 6 04 83 a0 15 d0 13
E: 1.498455 6 04 83 40 15 70 13
E: 1.507241 6 04 83 f0 14 20 13
E: 1.513595 6 04 83 c0 14 f0 12
E: 1.523344 6 04 83 90 14 c0 12
E: 1.532100 6 04 83 40 14 70 12
E: 1.541094 6 04 83 00 14 30 12
E: 1.550395 6 04 83 d0 13 00 12
E: 1.556188 6 04 83 b0 13 e0 11
E: 1.566025 6 04 83 70 13 90 11
E: 1.574853 6 04 83 40 13 60 11
E: 1.584341 6 04 83 20 13 30 11
E: 1.593088 6 04 83 00 13 10 11
E: 1.598948 6 04 83 c0 12 c0 10
E: 1.609583 6 04 83 90 12 90 10
E: 1.618783 6 04 83 70 12 60 10
E: 1.626903 6 04 83 50 12 40 10
E: 1.636324 6 04 83 10 12 00 10
E: 1.643687 6 04 83 e0 11 d0 0f
E: 1.651934 6 04 83 c0 11 a0 0f
E: 1.661848 6 04 83 a0 11 80 0f
E: 1.671584 6 04 83 a0 11 80 0f
E: 1.676735 6 04 83 80 11 60 0f
E: 1.685862 6 04 83 80 11 60 0f
E: 1.695646 6 04 83 60 11 40 0f
E: 1.703819 6 04 83 60 11 40 0f
E: 1.712604 6 04 83 60 11 40 0f
E: 1.719809 6 04 83 60 11 40 0f
E: 1.728692 6 04 83 60 11 40 0f
E: 1.739396 6 04 83 60 11 40 0f
E: 1.748599 6 04 83 60 11 40 0f
E: 1.757284 6 04 83 60 11 40 0f
E: 1.763005 6 04 83 60 11 40 0f
E: 1.817596 6 04 83 c0 10 80 0e
E: 1.820538 6 04 82 c0 10 80 0e
E: 11.378367 6 04 83 70 67 b0 5c
E: 11.380921 6 04 83 70 67 b0 5c
E: 11.385976 6 04 83 70 67 b0 5c
E: 11.390699 6 04 83 70 67 b0 5c
E: 11.396767 6 04 83 70 67 b0 5c
E: 11.405597 6 04 83 70 67 b0 5c
E: 11.414736 6 04 83 70 67 b0 5c
E: 11.423520 6 04 83 70 67 b0 5c
E: 11.432740 6 04 83 70 67 b0 5c
E: 11.441729 6 04 83 70 67 b0 5c
E: 11.447224 6 04 83 70 67 b0 5c
E: 11.457201 6 04 83 70 67 b0 5c
E: 11.466102 6 04 83 70 67 b0 5c
E: 11.475181 6 04 83 70 67 b0 5c
E: 11.484510 6 04 83 70 67 b0 5c
E: 11.490735 6 04 83 70 67 b0 5c
E: 11.500412 6 04 83 70 67 b0 5c
E: 11.509166 6 04 83 70 67 b0 5c
E: 11.518755 6 04 83 70 67 b0 5c
E: 11.524568 6 04 83 70 67 b0 5c
E: 11.534096 6 04 83 70 67 b0 5c
E: 11.543573 6 04 83 70 67 b0 5c
E: 11.552328 6 04 83 70 67 b0 5c
E: 11.561062 6 04 83 70 67 b0 5c
E: 11.567632 6 04 83 70 67 b0 5c
E: 11.577308 6 04 83 70 67 b0 5c
E: 11.586034 6 04 83 70 67 b0 5c
E: 11.595467 6 04 83 70 67 b0 5c
E: 11.604210 6 04 83 70 67 b0 5c
E: 11.613736 6 04 83 70 67 b0 5c
E: 11.622465 6 04 83 70 67 b0 5c
E: 11.628223 6 04 83 70 67 b0 5c
E: 11.638588 6 04 83 70 67 b0 5c
E: 11.647465 6 04 83 70 67 b0 5c
E: 11.656099 6 04 83 70 67 b0 5c
E: 11.665697 6 04 83 70 67 b0 5c
E: 11.671491 6 04 83 70 67 b0 5c
E: 11.681344 6 04 83 70 67 b0 5c
E: 11.689980 6 04 83 70 67 b0 5c
E: 11.699459 6 04 83 70 67 b0 5c
E: 11.708682 6 04 83 70 67 b0 5c
E: 11.714399 6 04 83 70 67 b0 5c
E: 11.724221 6 04 83 70 67 b0 5c
E: 11.733847 6 04 83 70 67 b0 5c
E: 11.743939 6 04 83 70 67 b0 5c
E: 11.748216 6 04 83 70 67 b0 5c
E: 11.757997 6 04 83 70 67 b0 5c
E: 11.767039 6 04 83 70 67 b0 5c
E: 11.776571 6 04 83 70 67 b0 5c
E: 11.785156 6 04 83 70 67 b0 5c
E: 11.791009 6 04 83 70 67 b0 5c
E: 11.801517 6 04 83 70 67 b0 5c
E: 11.810128 6 04 83 70 67 b0 5c
E: 11.819692 6 04 83 70 67 b0 5c
E: 11.828316 6 04 83 70 67 b0 5c
E: 11.837068 6 04 83 70 67 b0 5c
E: 11.846634 6 04 83 70 67 b0 5c
E: 11.852307 6 04 83 70 67 b0 5c
E: 11.862070 6 04 83 70 67 b0 5c
E: 11.871705 6 04 83 70 67 b0 5c
E: 11.880257 6 04 83 70 67 b0 5c
E: 11.889036 6 04 83 70 67 b0 5c
E: 11.895604 6 04 83 70 67 b0 5c
E: 11.905300 6 04 83 70 67 b0 5c
E: 11.914003 6 04 83 70 67 b0 5c
E: 11.923512 6 04 83 70 67 b0 5c
E: 11.932465 6 04 83 70 67 b0 5c
E: 11.938308 6 04 83 70 67 b0 5c
E: 11.947946 6 04 83 70 67 b0 5c
E: 11.957509 6 04 83 70 67 b0 5c
E: 11.966177 6 04 83 70 67 b0 5c
E: 11.972011 6 04 83 70 67 b0 5c
E: 11.982800 6 04 83 70 67 b0 5c
E: 11.991176 6 04 83 70 67 b0 5c
E: 12.000798 6 04 83 70 67 b0 5c
E: 12.009363 6 04 83 70 67 b0 5c
E: 12.015517 6 04 83 70 67 b0 5c
E: 12.026279 6 04 83 70 67 b0 5c
E: 12.034280 6 04 83 70 67 b0 5c
E: 12.043104 6 04 83 70 67 b0 5c
E: 12.052702 6 04 83 70 67 b0 5c
E: 12.058451 6 04 83 70 67 b0 5c
E: 12.068163 6 04 83 70 67 b0 5c
E: 12.077784 6 04 83 70 67 b0 5c
E: 12.090784 6 04 83 70 67 b0 5c
E: 12.094421 6 04 83 70 67 b0 5c
E: 12.103730 6 04 83 70 67 b0 5c
E: 12.111746 6 04 83 70 67 b0 5c
E: 12.119727 6 04 83 70 67 b0 5c
E: 12.129298 6 04 83 70 67 b0 5c
E: 12.144905 6 04 83 70 67 b0 5c
E: 12.147765 6 04 83 70 67 b0 5c
E: 12.157761 6 04 83 70 67 b0 5c
E: 12.163450 6 04 83 70 67 b0 5c
E: 12.173373 6 04 83 70 67 b0 5c
E: 12.182485 6 04 83 70 67 b0 5c
E: 12.200339 6 04 83 70 67 b0 5c
E: 12.202823 6 04 83 70 67 b0 5c
E: 12.205775 6 04 83 70 67 b0 5c
E: 12.216064 6 04 83 70 67 b0 5c
E: 12.230879 6 04 83 70 67 b0 5c
E: 12.233861 6 04 83 70 67 b0 5c
E: 12.239856 6 04 83 70 67 b0 5c
E: 12.249674 6 04 83 70 67 b0 5c
E: 12.258359 6 04 83 70 67 b0 5c
E: 12.267114 6 04 83 70 67 b0 5c
E: 12.276785 6 04 83 70 67 b0 5c
E: 12.282801 6 04 83 70 67 b0 5c
E: 12.292831 6 04 83 70 67 b0 5c
E: 12.307897 6 04 83 70 67 b0 5c
E: 12.311349 6 04 83 70 67 b0 5c
E: 12.322265 6 04 83 70 67 b0 5c
E: 12.325965 6 04 83 70 67 b0 5c
E: 12.339254 6 04 83 70 67 b0 5c
E: 12.343046 6 04 83 70 67 b0 5c
E: 12.354778 6 04 83 70 67 b0 5c
E: 12.363338 6 04 83 70 67 b0 5c
E: 12.369154 6 04 83 70 67 b0 5c
E: 12.379753 6 04 83 70 67 b0 5c
E: 12.388602 6 04 83 70 67 b0 5c
E: 12.397554 6 04 83 70 67 b0 5c
E: 12.403706 6 04 83 70 67 b0 5c
E: 12.413520 6 04 83 70 67 b0 5c
E: 12.422508 6 04 83 70 67 b0 5c
E: 12.431267 6 04 83 70 67 b0 5c
E: 12.440474 6 04 83 70 67 b0 5c
E: 12.446469 6 04 83 70 67 b0 5c
E: 12.456218 6 04 83 70 67 b0 5c
E: 12.465653 6 04 83 70 67 b0 5c
E: 12.474364 6 04 83 70 67 b0 5c
E: 12.483092 6 04 83 70 67 b0 5c
E: 12.489748 6 04 83 70 67 b0 5c
E: 12.499418 6 04 83 70 67 b0 5c
E: 12.508169 6 04 83 70 67 b0 5c
E: 12.517693 6 04 83 70 67 b0 5c
E: 12.526407 6 04 83 70 67 b0 5c
E: 12.532303 6 04 83 70 67 b0 5c
E: 12.541994 6 04 83 70 67 b0 5c
E: 12.551583 6 04 83 70 67 b0 5c
E: 12.560172 6 04 83 70 67 b0 5c
E: 12.566041 6 04 83 70 67 b0 5c
E: 12.576672 6 04 83 70 67 b0 5c
E: 12.585483 6 04 83 70 67 b0 5c
E: 12.595203 6 04 83 70 67 b0 5c
E: 12.603062 6 04 83 70 67 b0 5c
E: 12.609581 6 04 83 70 67 b0 5c
E: 12.619277 6 04 83 70 67 b0 5c
E: 12.628047 6 04 83 70 67 b0 5c
E: 12.637577 6 04 83 70 67 b0 5c
E: 12.646307 6 04 83 70 67 b0 5c
E: 12.655212 6 04 83 70 67 b0 5c
E: 12.664234 6 04 83 70 67 b0 5c
E: 12.670044 6 04 83 70 67 b0 5c
E: 12.680308 6 04 83 70 67 b0 5c
E: 12.689120 6 04 83 70 67 b0 5c
E: 12.698002 6 04 83 70 67 b0 5c
E: 12.707512 6 04 83 70 67 b0 5c
E: 12.713393 6 04 83 70 67 b0 5c
E: 12.723084 6 04 83 70 67 b0 5c
E: 12.732816 6 04 83 70 67 b0 5c
E: 12.741248 6 04 83 70 67 b0 5c
E: 12.752727 6 04 83 70 67 b0 5c
E: 12.756692 6 04 83 70 67 b0 5c
E: 12.765326 6 04 83 70 67 b0 5c
E: 12.774055 6 04 83 70 67 b0 5c
E: 12.783660 6 04 83 70 67 b0 5c
E: 12.792240 6 04 83 70 67 b0 5c
E: 12.801466 6 04 83 70 67 b0 5c
E: 12.810571 6 04 83 70 67 b0 5c
E: 12.816225 6 04 83 70 67 b0 5c
E: 12.826005 6 04 83 70 67 b0 5c
E: 12.835420 6 04 83 70 67 b0 5c
E: 12.844169 6 04 83 70 67 b0 5c
E: 12.853858 6 04 83 70 67 b0 5c
E: 12.859542 6 04 83 70 67 b0 5c
E: 12.869113 6 04 83 70 67 b0 5c
E: 12.878648 6 04 83 70 67 b0 5c
E: 12.887422 6 04 83 70 67 b0 5c
E: 12.895972 6 04 83 70 67 b0 5c
E: 12.905531 6 04 83 70 67 b0 5c
E: 12.914283 6 04 83 70 67 b0 5c
E: 12.920245 6 04 83 70 67 b0 5c
E: 12.929992 6 04 83 70 67 b0 5c
E: 12.939549 6 04 83 70 67 b0 5c
E: 12.946796 6 04 83 70 67 b0 5c
E: 12.956823 6 04 83 70 67 b0 5c
E: 12.965805 6 04 83 70 67 b0 5c
E: 12.974472 6 04 83 70 67 b0 5c
E: 12.980292 6 04 83 70 67 b0 5c
E: 12.990771 6 04 83 70 67 b0 5c
E: 12.999681 6 04 83 70 67 b0 5c
E: 13.008361 6 04 83 70 67 b0 5c
E: 13.017804 6 04 83 70 67 b0 5c
E: 13.023838 6 04 83 70 67 b0 5c
E: 13.033851 6 04 83 70 67 b0 5c
E: 13.042799 6 04 83 70 67 b0 5c
E: 13.052884 6 04 83 70 67 b0 5c
E: 13.057287 6 04 83 70 67 b0 5c
E: 13.067844 6 04 83 70 67 b0 5c
E: 13.076031 6 04 83 70 67 b0 5c
E: 13.084751 6 04 83 70 67 b0 5c
E: 13.093771 6 04 83 70 67 b0 5c
E: 13.102592 6 04 83 70 67 b0 5c
E: 13.112140 6 04 83 70 67 b0 5c
E: 13.117786 6 04 83 70 67 b0 5c
E: 13.127599 6 04 83 70 67 b0 5c
E: 13.136337 6 04 83 70 67 b0 5c
E: 13.145804 6 04 83 70 67 b0 5c
E: 13.154745 6 04 83 70 67 b0 5c
E: 13.163810 6 04 83 70 67 b0 5c
E: 13.172791 6 04 83 70 67 b0 5c
E: 13.181782 6 04 83 70 67 b0 5c
E: 13.187845 6 04 83 70 67 b0 5c
E: 13.197490 6 04 83 70 67 b0 5c
E: 13.206348 6 04 83 70 67 b0 5c
E: 13.215810 6 04 83 70 67 b0 5c
E: 13.221806 6 04 83 70 67 b0 5c
E: 13.232147 6 04 83 70 67 b0 5c
E: 13.240796 6 04 83 70 67 b0 5c
E: 13.249471 6 04 83 70 67 b0 5c
E: 13.259001 6 04 83 70 67 b0 5c
E: 13.264818 6 04 83 70 67 b0 5c
E: 13.274853 6 04 83 70 67 b0 5c
E: 13.283803 6 04 83 70 67 b0 5c
E: 13.292810 6 04 83 70 67 b0 5c
E: 13.301773 6 04 83 70 67 b0 5c
E: 13.307845 6 04 83 70 67 b0 5c
E: 13.317573 6 04 83 70 67 b0 5c
E: 13.326277 6 04 83 70 67 b0 5c
E: 13.335819 6 04 83 70 67 b0 5c
E: 13.344739 6 04 83 70 67 b0 5c
E: 13.355537 6 04 83 70 67 b0 5c
E: 13.366979 6 04 83 70 67 b0 5c
E: 13.379598 6 04 83 70 67 b0 5c
E: 13.382429 6 04 87 10 18 20 16
E: 13.393985 6 04 83 70 67 b0 5c
E: 13.396841 6 04 87 10 18 20 16
E: 13.405750 6 04 87 10 18 20 16
E: 13.408747 6 04 83 70 67 b0 5c
E: 13.417662 6 04 83 70 67 b0 5c
E: 13.420520 6 04 87 10 18 20 16
E: 13.429299 6 04 87 10 18 20 16
E: 13.432974 6 04 83 70 67 b0 5c
E: 13.441803 6 04 83 70 67 b0 5c
E: 13.444905 6 04 87 10 18 20 16
E: 13.455786 6 04 87 10 18 20 16
E: 13.458751 6 04 83 70 67 b0 5c
E: 13.467856 6 04 83 70 67 b0 5c
E: 13.470811 6 04 87 10 18 20 16
E: 13.479668 6 04 87 10 18 20 16
E: 13.482516 6 04 83 70 67 b0 5c
E: 13.491429 6 04 83 70 67 b0 5c
E: 13.494976 6 04 87 10 18 20 16
E: 13.503817 6 04 87 10 18 20 16
E: 13.506790 6 04 83 70 67 b0 5c
E: 13.515789 6 04 83 70 67 b0 5c
E: 13.518794 6 04 87 10 18 20 16
E: 13.529771 6 04 87 10 18 20 16
E: 13.532740 6 04 83 70 67 b0 5c
E: 13.541772 6 04 83 70 67 b0 5c
E: 13.544650 6 04 87 10 18 20 16
E: 13.553746 6 04 87 10 18 20 16
E: 13.556784 6 04 83 70 67 b0 5c
E: 13.565816 6 04 83 70 67 b0 5c
E: 13.568746 6 04 87 10 18 20 16
E: 13.577820 6 04 87 10 18 20 16
E: 13.580741 6 04 83 70 67 b0 5c
E: 13.589743 6 04 83 70 67 b0 5c
E: 13.592741 6 04 87 10 18 20 16
E: 13.603815 6 04 87 10 18 20 16
E: 13.606600 6 04 83 70 67 b0 5c
E: 13.615421 6 04 83 70 67 b0 5c
E: 13.618901 6 04 87 10 18 20 16
E: 13.628138 6 04 87 10 18 20 16
E: 13.631339 6 04 83 70 67 b0 5c
E: 13.639788 6 04 83 70 67 b0 5c
E: 13.642768 6 04 87 10 18 20 16
E: 13.653605 6 04 87 10 18 20 16
E: 13.656458 6 04 83 70 67 b0 5c
E: 13.665927 6 04 83 70 67 b0 5c
E: 13.668868 6 04 87 10 18 20 16
E: 13.677804 6 04 87 10 18 20 16
E: 13.680744 6 04 83 70 67 b0 5c
E: 13.689568 6 04 83 70 67 b0 5c
E: 13.693188 6 04 87 10 18 20 16
E: 13.703394 6 04 87 10 18 20 16
E: 13.706424 6 04 83 70 67 b0 5c
E: 13.715985 6 04 83 70 67 b0 5c
E: 13.718840 6 04 87 10 18 20 16
E: 13.727633 6 04 87 10 18 20 16
E: 13.730495 6 04 83 70 67 b0 5c
E: 13.739299 6 04 83 70 67 b0 5c
E: 13.743000 6 04 87 10 18 20 16
E: 13.751790 6 04 87 10 18 20 16
E: 13.754749 6 04 83 70 67 b0 5c
E: 13.763660 6 04 83 70 67 b0 5c
E: 13.766533 6 04 87 10 18 20 16
E: 13.778013 6 04 87 10 18 20 16
E: 13.780923 6 04 83 70 67 b0 5c
E: 13.789738 6 04 83 70 67 b0 5c
E: 13.792755 6 04 87 10 18 20 16
E: 13.801803 6 04 87 10 18 20 16
E: 13.804873 6 04 83 70 67 b0 5c
E: 13.813813 6 04 83 70 67 b0 5c
E: 13.816816 6 04 87 10 18 20 16
E: 13.825747 6 04 87 10 18 20 16
E: 13.828795 6 04 83 70 67 b0 5c
E: 13.837471 6 04 83 70 67 b0 5c
E: 13.840404 6 04 87 10 18 20 16
E: 13.851821 6 04 87 10 18 20 16
E: 13.854797 6 04 83 70 67 b0 5c
E: 13.863787 6 04 83 70 67 b0 5c
E: 13.866741 6 04 87 10 18 20 16
E: 13.875738 6 04 87 10 18 20 16
E: 13.878866 6 04 83 70 67 b0 5c
E: 13.887835 6 04 83 70 67 b0 5c
E: 13.890754 6 04 87 10 18 20 16
E: 13.899758 6 04 87 10 18 20 16
E: 13.902790 6 04 83 70 67 b0 5c
E: 13.913857 6 04 83 70 67 b0 5c
E: 13.916793 6 04 87 10 18 20 16
E: 13.925768 6 04 87 10 18 20 16
E: 13.928721 6 04 83 70 67 b0 5c
E: 13.937797 6 04 83 70 67 b0 5c
E: 13.940596 6 04 87 10 18 20 16
E: 13.949671 6 04 87 10 18 20 16
E: 13.952521 6 04 83 70 67 b0 5c
E: 13.963552 6 04 83 70 67 b0 5c
E: 13.966326 6 04 87 10 18 20 16
E: 13.975763 6 04 87 10 18 20 16
E: 13.978787 6 04 83 70 67 b0 5c
E: 13.987796 6 04 83 70 67 b0 5c
E: 13.990791 6 04 87 10 18 20 16
E: 13.999904 6 04 87 10 18 20 16
E: 14.002769 6 04 83 70 67 b0 5c
E: 14.011811 6 04 83 70 67 b0 5c
E: 14.014535 6 04 87 10 18 20 16
E: 14.025925 6 04 87 10 18 20 16
E: 14.028826 6 04 83 70 67 b0 5c
E: 14.037663 6 04 83 70 67 b0 5c
E: 14.040532 6 04 87 10 18 20 16
E: 14.050027 6 04 87 10 18 20 16
E: 14.052916 6 04 83 70 67 b0 5c
E: 14.061731 6 04 83 70 67 b0 5c
E: 14.064765 6 04 87 10 18 20 16
E: 14.073822 6 04 87 10 18 20 16
E: 14.076791 6 04 83 70 67 b0 5c
E: 14.085412 6 04 83 70 67 b0 5c
E: 14.088879 6 04 87 10 18 20 16
E: 14.099799 6 04 87 10 18 20 16
E: 14.102795 6 04 83 70 67 b0 5c
E: 14.111815 6 04 83 70 67 b0 5c
E: 14.114782 6 04 87 10 18 20 16
E: 14.123543 6 04 87 10 18 20 16
E: 14.126479 6 04 83 70 67 b0 5c
E: 14.136036 6 04 83 70 67 b0 5c
E: 14.138949 6 04 87 10 18 20 16
E: 14.147917 6 04 87 10 18 20 16
E: 14.150842 6 04 83 70 67 b0 5c
E: 14.159758 6 04 83 70 67 b0 5c
E: 14.162730 6 04 87 10 18 20 16
E: 14.173807 6 04 87 10 18 20 16
E: 14.176788 6 04 83 70 67 b0 5c
E: 14.185661 6 04 83 70 67 b0 5c
E: 14.188553 6 04 87 10 18 20 16
E: 14.197305 6 04 87 10 18 20 16
E: 14.200933 6 04 83 70 67 b0 5c
E: 14.211806 6 04 83 70 67 b0 5c
E: 14.214748 6 04 87 10 18 20 16
E: 14.223485 6 04 87 10 18 20 16
E: 14.226534 6 04 83 70 67 b0 5c
E: 14.235448 6 04 83 70 67 b0 5c
E: 14.238990 6 04 87 10 18 20 16
E: 14.247565 6 04 87 10 18 20 16
E: 14.251495 6 04 83 70 67 b0 5c
E: 14.259385 6 04 83 70 67 b0 5c
E: 14.263478 6 04 87 10 18 20 16
E: 14.272978 6 04 87 10 18 20 16
E: 14.276066 6 04 83 70 67 b0 5c
E: 14.284803 6 04 83 70 67 b0 5c
E: 14.287796 6 04 87 10 18 20 16
E: 14.296785 6 04 87 10 18 20 16
E: 14.299770 6 04 83 70 67 b0 5c
E: 14.310580 6 04 83 70 67 b0 5c
E: 14.313742 6 04 87 10 18 20 16
E: 14.322799 6 04 87 10 18 20 16
E: 14.325793 6 04 83 70 67 b0 5c
E: 14.334800 6 04 83 70 67 b0 5c
E: 14.337744 6 04 87 10 18 20 16
E: 14.346813 6 04 87 10 18 20 16
E: 14.349798 6 04 83 70 67 b0 5c
E: 14.358785 6 04 83 70 67 b0 5c
E: 14.361779 6 04 87 10 18 20 16
E: 14.370668 6 04 87 10 18 20 16
E: 14.373582 6 04 83 70 67 b0 5c
E: 14.384468 6 04 83 70 67 b0 5c
E: 14.386393 6 04 87 10 18 20 16
E: 14.395466 6 04 87 10 18 20 16
E: 14.398931 6 04 83 70 67 b0 5c
E: 14.407792 6 04 83 70 67 b0 5c
E: 14.410806 6 04 87 10 18 20 16
E: 14.421611 6 04 87 10 18 20 16
E: 14.425726 6 04 83 70 67 b0 5c
E: 14.433833 6 04 83 70 67 b0 5c
E: 14.436809 6 04 87 10 18 20 16
E: 14.445802 6 04 87 10 18 20 16
E: 14.448751 6 04 83 70 67 b0 5c
E: 14.459532 6 04 83 70 67 b0 5c
E: 14.462446 6 04 87 10 18 20 16
E: 14.472022 6 04 87 10 18 20 16
E: 14.474948 6 04 83 70 67 b0 5c
E: 14.483800 6 04 83 70 67 b0 5c
E: 14.486742 6 04 87 10 18 20 16
E: 14.495539 6 04 87 10 18 20 16
E: 14.498447 6 04 83 70 67 b0 5c
E: 14.507991 6 04 83 70 67 b0 5c
E: 14.510770 6 04 87 10 18 20 16
E: 14.519801 6 04 87 10 18 20 16
E: 14.523206 6 04 83 70 67 b0 5c
E: 14.533598 6 04 83 70 67 b0 5c
E: 14.536523 6 04 87 10 18 20 16
E: 14.545567 6 04 87 10 18 20 16
E: 14.548528 6 04 83 70 67 b0 5c
E: 14.557332 6 04 83 70 67 b0 5c
E: 14.560986 6 04 87 10 18 20 16
E: 14.569827 6 04 87 10 18 20 16
E: 14.572859 6 04 83 70 67 b0 5c
E: 14.581797 6 04 83 70 67 b0 5c
E: 14.584784 6 04 87 10 18 20 16
E: 14.595790 6 04 87 10 18 20 16
E: 14.598758 6 04 83 70 67 b0 5c
E: 14.607414 6 04 83 70 67 b0 5c
E: 14.610327 6 04 87 10 18 20 16
E: 14.619823 6 04 87 10 18 20 16
E: 14.622818 6 04 83 70 67 b0 5c
E: 14.631810 6 04 83 70 67 b0 5c
E: 14.634800 6 04 87 10 18 20 16
E: 14.643818 6 04 87 10 18 20 16
E: 14.646773 6 04 83 70 67 b0 5c
E: 14.655817 6 04 83 70 67 b0 5c
E: 14.658770 6 04 87 10 18 20 16
E: 14.669803 6 04 87 10 18 20 16
E: 14.676069 6 04 83 70 67 b0 5c
E: 14.681358 6 04 83 70 67 b0 5c
E: 14.686287 6 04 87 10 18 20 16
E: 14.695113 6 04 87 10 18 20 16
E: 14.698049 6 04 83 70 67 b0 5c
E: 14.707056 6 04 83 70 67 b0 5c
E: 14.708964 6 04 87 10 18 20 16
E: 14.718432 6 04 87 10 18 20 16
E: 14.722277 6 04 83 70 67 b0 5c
E: 14.731146 6 04 83 70 67 b0 5c
E: 14.733977 6 04 87 10 18 20 16
E: 14.743240 6 04 87 10 18 20 16
E: 14.746110 6 04 83 70 67 b0 5c
E: 14.755469 6 04 83 70 67 b0 5c
E: 14.758354 6 04 87 10 18 20 16
E: 14.767143 6 04 87 10 18 20 16
E: 14.770670 6 04 83 70 67 b0 5c
E: 14.780927 6 04 83 70 67 b0 5c
E: 14.784803 6 04 87 10 18 20 16
E: 14.794449 6 04 87 10 18 20 16
E: 14.798302 6 04 83 70 67 b0 5c
E: 14.807066 6 04 83 70 67 b0 5c
E: 14.810995 6 04 87 10 18 20 16
E: 14.820414 6 04 87 10 18 20 16
E: 14.824341 6 04 83 70 67 b0 5c
E: 14.830096 6 04 83 70 67 b0 5c
E: 14.834965 6 04 87 10 18 20 16
E: 14.844549 6 04 87 10 18 20 16
E: 14.846455 6 04 83 70 67 b0 5c
E: 14.855217 6 04 83 70 67 b0 5c
E: 14.858114 6 04 87 10 18 20 16
E: 14.866849 6 04 87 10 18 20 16
E: 14.870755 6 04 83 70 67 b0 5c
E: 14.880482 6 04 83 70 67 b0 5c
E: 14.882429 6 04 87 10 18 20 16
E: 14.893372 6 04 87 10 18 20 16
E: 14.897236 6 04 83 70 67 b0 5c
E: 14.905970 6 04 83 70 67 b0 5c
E: 14.908919 6 04 87 10 18 20 16
E: 14.918428 6 04 87 10 18 20 16
E: 14.922320 6 04 83 70 67 b0 5c
E: 14.930966 6 04 83 70 67 b0 5c
E: 14.933937 6 04 87 10 18 20 16
E: 14.942991 6 04 87 10 18 20 16
E: 14.945890 6 04 83 70 67 b0 5c
E: 14.954777 6 04 83 70 67 b0 5c
E: 14.956783 6 04 87 10 18 20 16
E: 14.968232 6 04 87 10 18 20 16
E: 14.971155 6 04 83 70 67 b0 5c
E: 14.979905 6 04 83 70 67 b0 5c
E: 14.982827 6 04 87 10 18 20 16
E: 14.992267 6 04 87 10 18 20 16
E: 14.995186 6 04 83 70 67 b0 5c
E: 15.003932 6 04 83 70 67 b0 5c
E: 15.006852 6 04 87 10 18 20 16
E: 15.016158 6 04 87 10 18 20 16
E: 15.018011 6 04 83 70 67 b0 5c
E: 15.029548 6 04 83 70 67 b0 5c
E: 15.031409 6 04 87 10 18 20 16
E: 15.040279 6 04 87 10 18 20 16
E: 15.042130 6 04 83 70 67 b0 5c
E: 15.052833 6 04 83 70 67 b0 5c
E: 15.057511 6 04 87 10 18 20 16
E: 15.066434 6 04 87 10 18 20 16
E: 15.069476 6 04 83 70 67 b0 5c
E: 15.078232 6 04 83 70 67 b0 5c
E: 15.082099 6 04 87 10 18 20 16
E: 15.090881 6 04 87 10 18 20 16
E: 15.092747 6 04 83 70 67 b0 5c
E: 15.102294 6 04 83 70 67 b0 5c
E: 15.106259 6 04 87 10 18 20 16
E: 15.115301 6 04 87 10 18 20 16
E: 15.118118 6 04 83 70 67 b0 5c
E: 15.126861 6 04 83 70 67 b0 5c
E: 15.128815 6 04 87 10 18 20 16
E: 15.140139 6 04 87 10 18 20 16
E: 15.143050 6 04 83 70 67 b0 5c
E: 15.151814 6 04 83 70 67 b0 5c
E: 15.153754 6 04 87 10 18 20 16
E: 15.165302 6 04 87 10 18 20 16
E: 15.168241 6 04 83 70 67 b0 5c
E: 15.177041 6 04 83 70 67 b0 5c
E: 15.179073 6 04 87 10 18 20 16
E: 15.190052 6 04 87 10 18 20 16
E: 15.191950 6 04 83 70 67 b0 5c
E: 15.203468 6 04 83 70 67 b0 5c
E: 15.206407 6 04 87 10 18 20 16
E: 15.215158 6 04 87 10 18 20 16
E: 15.218127 6 04 83 70 67 b0 5c
E: 15.226857 6 04 83 70 67 b0 5c
E: 15.228828 6 04 87 10 18 20 16
E: 15.240265 6 04 87 10 18 20 16
E: 15.243162 6 04 83 70 67 b0 5c
E: 15.251904 6 04 83 70 67 b0 5c
E: 15.253875 6 04 87 10 18 20 16
E: 15.265334 6 04 87 10 18 20 16
E: 15.269181 6 04 83 70 67 b0 5c
E: 15.277979 6 04 83 90 67 a0 5c
E: 15.280840 6 04 87 10 18 20 16
E: 15.291056 6 04 87 10 18 20 16
E: 15.294006 6 04 83 a0 67 80 5c
E: 15.302829 6 04 83 a0 67 60 5c
E: 15.306423 6 04 87 10 18 20 16
E: 15.315282 6 04 87 10 18 20 16
E: 15.318183 6 04 83 a0 67 40 5c
E: 15.327082 6 04 83 b0 67 20 5c
E: 15.330117 6 04 87 10 18 20 16
E: 15.339066 6 04 87 10 18 20 16
E: 15.341032 6 04 83 b0 67 f0 5b
E: 15.351812 6 04 83 b0 67 b0 5b
E: 15.355429 6 04 87 10 18 20 16
E: 15.364200 6 04 87 30 18 10 16
E: 15.367120 6 04 83 b0 67 70 5b
E: 15.375846 6 04 83 b0 67 40 5b
E: 15.378770 6 04 87 30 18 f0 15
E: 15.388269 6 04 87 30 18 d0 15
E: 15.390171 6 04 83 c0 67 10 5b
E: 15.400885 6 04 83 c0 67 e0 5a
E: 15.404781 6 04 87 30 18 d0 15
E: 15.411449 6 04 87 40 18 a0 15
E: 15.415324 6 04 83 c0 67 a0 5a
E: 15.425802 6 04 83 c0 67 60 5a
E: 15.430442 6 04 87 40 18 a0 15
E: 15.436152 6 04 87 40 18 80 15
E: 15.438913 6 04 83 c0 67 20 5a
E: 15.448402 6 04 83 d0 67 e0 59
E: 15.451298 6 04 87 50 18 60 15
E: 15.463855 6 04 87 50 18 60 15
E: 15.466445 6 04 83 d0 67 a0 59
E: 15.475299 6 04 83 d0 67 60 59
E: 15.477328 6 04 87 60 18 30 15
E: 15.487856 6 04 87 70 18 10 15
E: 15.490425 6 04 83 d0 67 20 59
E: 15.499265 6 04 83 d0 67 f0 58
E: 15.502115 6 04 87 70 18 10 15
E: 15.510953 6 04 87 70 18 f0 14
E: 15.513816 6 04 83 d0 67 b0 58
E: 15.525277 6 04 83 e0 67 80 58
E: 15.528164 6 04 87 70 18 f0 14
E: 15.536899 6 04 87 70 18 d0 14
E: 15.538793 6 04 83 e0 67 50 58
E: 15.550453 6 04 83 e0 67 20 58
E: 15.553341 6 04 87 70 18 d0 14
E: 15.562119 6 04 87 70 18 d0 14
E: 15.565008 6 04 83 e0 67 e0 57
E: 15.573810 6 04 83 e0 67 b0 57
E: 15.576519 6 04 87 70 18 d0 14
E: 15.587236 6 04 87 70 18 d0 14
E: 15.590178 6 04 83 e0 67 80 57
E: 15.598795 6 04 83 e0 67 50 57
E: 15.601671 6 04 87 70 18 d0 14
E: 15.612205 6 04 87 70 18 d0 14
E: 15.615063 6 04 83 e0 67 20 57
E: 15.623851 6 04 83 e0 67 f0 56
E: 15.627730 6 04 87 80 18 a0 14
E: 15.637267 6 04 87 90 18 80 14
E: 15.641214 6 04 83 e0 67 c0 56
E: 15.650007 6 04 83 e0 67 a0 56
E: 15.653868 6 04 87 b0 18 40 14
E: 15.660509 6 04 87 c0 18 10 14
E: 15.665340 6 04 83 e0 67 80 56
E: 15.674336 6 04 83 e0 67 50 56
E: 15.676346 6 04 87 d0 18 f0 13
E: 15.685277 6 04 87 d0 18 f0 13
E: 15.688296 6 04 83 e0 67 20 56
E: 15.696783 6 04 83 e0 67 00 56
E: 15.700419 6 04 87 f0 18 d0 13
E: 15.711176 6 04 87 f0 18 d0 13
E: 15.714094 6 04 83 e0 67 e0 55
E: 15.723025 6 04 83 e0 67 c0 55
E: 15.725924 6 04 87 f0 18 b0 13
E: 15.735389 6 04 87 f0 18 b0 13
E: 15.737359 6 04 83 e0 67 a0 55
E: 15.747845 6 04 83 e0 67 70 55
E: 15.750839 6 04 87 f0 18 b0 13
E: 15.759791 6 04 87 10 19 90 13
E: 15.762962 6 04 83 e0 67 40 55
E: 15.772458 6 04 83 e0 67 10 55
E: 15.774344 6 04 87 20 19 70 13
E: 15.785292 6 04 87 20 19 70 13
E: 15.787947 6 04 83 e0 67 e0 54
E: 15.796761 6 04 83 e0 67 c0 54
E: 15.801451 6 04 87 40 19 50 13
E: 15.810228 6 04 87 40 19 50 13
E: 15.814037 6 04 83 e0 67 90 54
E: 15.823109 6 04 83 e0 67 60 54
E: 15.824771 6 04 87 50 19 30 13
E: 15.834324 6 04 87 50 19 30 13
E: 15.837169 6 04 83 e0 67 30 54
E: 15.846312 6 04 83 e0 67 00 54
E: 15.850175 6 04 87 50 19 30 13
E: 15.859452 6 04 87 70 19 10 13
E: 15.862064 6 04 83 e0 67 d0 53
E: 15.870878 6 04 83 e0 67 a0 53
E: 15.872808 6 04 87 90 19 f0 12
E: 15.884346 6 04 87 90 19 f0 12
E: 15.886262 6 04 83 e0 67 70 53
E: 15.895159 6 04 83 e0 67 50 53
E: 15.897998 6 04 87 b0 19 d0 12
E: 15.906807 6 04 87 b0 19 d0 12
E: 15.910408 6 04 83 e0 67 30 53
E: 15.921121 6 04 83 e0 67 10 53
E: 15.923038 6 04 87 b0 19 d0 12
E: 15.933868 6 04 87 b0 19 d0 12
E: 15.935738 6 04 83 e0 67 e0 52
E: 15.945238 6 04 83 e0 67 b0 52
E: 15.949233 6 04 87 b0 19 d0 12
E: 15.958166 6 04 87 b0 19 d0 12
E: 15.960100 6 04 83 e0 67 80 52
E: 15.970897 6 04 83 e0 67 50 52
E: 15.972855 6 04 87 b0 19 d0 12
E: 15.984383 6 04 87 e0 19 a0 12
E: 15.987360 6 04 83 e0 67 20 52
E: 15.996177 6 04 83 e0 67 f0 51
E: 15.997954 6 04 87 00 1a 90 12
E: 16.008912 6 04 87 30 1a 70 12
E: 16.012727 6 04 83 e0 67 c0 51
E: 16.020987 6 04 83 e0 67 90 51
E: 16.022860 6 04 87 50 1a 50 12
E: 16.034409 6 04 87 50 1a 50 12
E: 16.037302 6 04 83 e0 67 60 51
E: 16.046013 6 04 83 e0 67 40 51
E: 16.048885 6 04 87 70 1a 30 12
E: 16.058388 6 04 87 70 1a 30 12
E: 16.061345 6 04 83 e0 67 10 51
E: 16.069991 6 04 83 e0 67 e0 50
E: 16.071872 6 04 87 90 1a 20 12
E: 16.083411 6 04 87 90 1a 20 12
E: 16.086429 6 04 83 e0 67 a0 50
E: 16.094951 6 04 83 e0 67 60 50
E: 16.097855 6 04 87 b0 1a 00 12
E: 16.107337 6 04 87 e0 1a d0 11
E: 16.110234 6 04 83 e0 67 30 50
E: 16.119048 6 04 83 e0 67 00 50
E: 16.121948 6 04 87 10 1b b0 11
E: 16.131396 6 04 87 30 1b 90 11
E: 16.133407 6 04 83 e0 67 d0 4f
E: 16.144334 6 04 83 e0 67 a0 4f
E: 16.147262 6 04 87 30 1b 90 11
E: 16.156113 6 04 87 70 1b 60 11
E: 16.159125 6 04 83 e0 67 70 4f
E: 16.168163 6 04 83 e0 67 40 4f
E: 16.171002 6 04 87 a0 1b 50 11
E: 16.180558 6 04 87 c0 1b 40 11
E: 16.182873 6 04 83 e0 67 20 4f
E: 16.193210 6 04 83 e0 67 f0 4e
E: 16.197049 6 04 87 c0 1b 40 11
E: 16.206053 6 04 87 10 1c 20 11
E: 16.210546 6 04 83 e0 67 d0 4e
E: 16.219168 6 04 83 e0 67 d0 4e
E: 16.222094 6 04 87 40 1c 10 11
E: 16.230868 6 04 87 60 1c 00 11
E: 16.233861 6 04 83 e0 67 90 4e
E: 16.243483 6 04 83 e0 67 60 4e
E: 16.246405 6 04 87 a0 1c f0 10
E: 16.255210 6 04 87 d0 1c e0 10
E: 16.258125 6 04 83 e0 67 20 4e
E: 16.266867 6 04 83 e0 67 f0 4d
E: 16.270784 6 04 87 10 1d e0 10
E: 16.279251 6 04 87 40 1d e0 10
E: 16.282104 6 04 83 e0 67 d0 4d
E: 16.293491 6 04 83 e0 67 b0 4d
E: 16.296358 6 04 87 90 1d e0 10
E: 16.305071 6 04 87 c0 1d e0 10
E: 16.308099 6 04 83 e0 67 b0 4d
E: 16.317332 6 04 83 e0 67 70 4d
E: 16.319425 6 04 87 10 1e e0 10
E: 16.330327 6 04 87 60 1e e0 10
E: 16.334283 6 04 83 e0 67 30 4d
E: 16.343032 6 04 83 e0 67 00 4d
E: 16.346941 6 04 87 b0 1e e0 10
E: 16.356477 6 04 87 f0 1e e0 10
E: 16.360426 6 04 83 e0 67 e0 4c
E: 16.369107 6 04 83 e0 67 e0 4c
E: 16.373059 6 04 87 20 1f e0 10
E: 16.379061 6 04 87 40 1f e0 10
E: 16.382873 6 04 83 e0 67 c0 4c
E: 16.392354 6 04 83 e0 67 c0 4c
E: 16.395280 6 04 87 70 1f e0 10
E: 16.404058 6 04 87 90 1f e0 10
E: 16.406930 6 04 83 e0 67 a0 4c
E: 16.415903 6 04 83 d0 67 70 4c
E: 16.419948 6 04 87 b0 1f e0 10
E: 16.429412 6 04 87 b0 1f e0 10
E: 16.433296 6 04 83 d0 67 30 4c
E: 16.442010 6 04 83 d0 67 e0 4b
E: 16.445875 6 04 87 d0 1f e0 10
E: 16.455412 6 04 87 d0 1f e0 10
E: 16.458343 6 04 83 d0 67 b0 4b
E: 16.467006 6 04 83 d0 67 80 4b
E: 16.469868 6 04 87 10 20 e0 10
E: 16.479365 6 04 87 30 20 e0 10
E: 16.482285 6 04 83 d0 67 40 4b
E: 16.491010 6 04 83 d0 67 10 4b
E: 16.494876 6 04 87 50 20 e0 10
E: 16.504362 6 04 87 50 20 e0 10
E: 16.507289 6 04 83 d0 67 f0 4a
E: 16.515938 6 04 83 d0 67 f0 4a
E: 16.518813 6 04 87 90 20 e0 10
E: 16.528370 6 04 87 e0 20 e0 10
E: 16.531297 6 04 83 d0 67 b0 4a
E: 16.540228 6 04 83 d0 67 90 4a
E: 16.542823 6 04 87 30 21 e0 10
E: 16.554440 6 04 87 70 21 e0 10
E: 16.558496 6 04 83 d0 67 70 4a
E: 16.567305 6 04 83 d0 67 70 4a
E: 16.570061 6 04 87 b0 21 e0 10
E: 16.578838 6 04 87 e0 21 e0 10
E: 16.581795 6 04 83 d0 67 50 4a
E: 16.591367 6 04 83 c0 67 20 4a
E: 16.594050 6 04 87 00 22 e0 10
E: 16.602840 6 04 87 30 22 e0 10
E: 16.606765 6 04 83 c0 67 e0 49
E: 16.615263 6 04 83 c0 67 90 49
E: 16.617089 6 04 87 70 22 e0 10
E: 16.626367 6 04 87 a0 22 e0 10
E: 16.629278 6 04 83 c0 67 50 49
E: 16.637949 6 04 83 c0 67 20 49
E: 16.641804 6 04 87 d0 22 e0 10
E: 16.652289 6 04 87 00 23 f0 10
E: 16.653975 6 04 83 c0 67 00 49
E: 16.663396 6 04 83 c0 67 00 49
E: 16.666138 6 04 87 20 23 f0 10
E: 16.675435 6 04 87 40 23 f0 10
E: 16.678214 6 04 83 b0 67 b0 48
E: 16.686949 6 04 83 b0 67 60 48
E: 16.689912 6 04 87 70 23 00 11
E: 16.701275 6 04 87 a0 23 10 11
E: 16.704048 6 04 83 b0 67 30 48
E: 16.713432 6 04 83 b0 67 00 48
E: 16.716395 6 04 87 c0 23 10 11
E: 16.724916 6 04 87 f0 23 20 11
E: 16.727796 6 04 83 b0 67 e0 47
E: 16.739019 6 04 83 b0 67 e0 47
E: 16.741968 6 04 87 10 24 20 11
E: 16.751415 6 04 87 10 24 20 11
E: 16.754310 6 04 83 a0 67 90 47
E: 16.762947 6 04 83 90 67 40 47
E: 16.766831 6 04 87 30 24 20 11
E: 16.776424 6 04 87 50 24 30 11
E: 16.780197 6 04 83 90 67 e0 46
E: 16.788850 6 04 83 90 67 80 46
E: 16.791483 6 04 87 70 24 30 11
E: 16.799825 6 04 87 a0 24 40 11
E: 16.803303 6 04 83 90 67 30 46
E: 16.812018 6 04 83 90 67 e0 45
E: 16.814899 6 04 87 d0 24 50 11
E: 16.826174 6 04 87 f0 24 50 11
E: 16.829122 6 04 83 90 67 a0 45
E: 16.837955 6 04 83 90 67 70 45
E: 16.840907 6 04 87 20 25 60 11
E: 16.850421 6 04 87 50 25 60 11
E: 16.853166 6 04 83 90 67 50 45
E: 16.862336 6 04 83 90 67 30 45
E: 16.864297 6 04 87 70 25 60 11
E: 16.875334 6 04 87 a0 25 70 11
E: 16.878148 6 04 83 90 67 30 45
E: 16.887630 6 04 83 90 67 10 45
E: 16.889464 6 04 87 c0 25 70 11
E: 16.898335 6 04 87 f0 25 80 11
E: 16.901204 6 04 83 90 67 10 45
E: 16.912458 6 04 83 90 67 10 45
E: 16.915207 6 04 87 10 26 80 11
E: 16.924635 6 04 87 30 26 80 11
E: 16.926418 6 04 83 90 67 10 45
E: 16.934874 6 04 83 90 67 10 45
E: 16.937581 6 04 87 50 26 80 11
E: 16.947759 6 04 87 50 26 80 11
E: 16.952113 6 04 83 80 67 e0 44
E: 16.961070 6 04 83 80 67 a0 44
E: 16.964879 6 04 87 80 26 90 11
E: 16.974005 6 04 87 a0 26 90 11
E: 16.978343 6 04 83 80 67 70 44
E: 16.983857 6 04 83 80 67 50 44
E: 16.987337 6 04 87 c0 26 90 11
E: 16.998372 6 04 87 e0 26 90 11
E: 17.001088 6 04 83 80 67 30 44
E: 17.009953 6 04 83 80 67 30 44
E: 17.013376 6 04 87 e0 26 90 11
E: 17.022366 6 04 87 00 27 90 11
E: 17.025937 6 04 83 80 67 10 44
E: 17.034857 6 04 83 80 67 10 44
E: 17.038294 6 04 87 00 27 90 11
E: 17.047225 6 04 87 00 27 90 11
E: 17.049090 6 04 83 80 67 10 44
E: 17.059974 6 04 83 80 67 10 44
E: 17.063349 6 04 87 00 27 90 11
E: 17.074205 6 04 87 00 27 90 11
E: 17.076078 6 04 83 80 67 10 44
E: 17.084980 6 04 83 80 67 10 44
E: 17.088434 6 04 87 00 27 90 11
E: 17.096804 6 04 87 00 27 90 11
E: 17.099472 6 04 83 80 67 10 44
E: 17.110124 6 04 83 80 67 10 44
E: 17.113110 6 04 87 00 27 90 11
E: 17.121875 6 04 87 00 27 90 11
E: 17.123908 6 04 83 80 67 10 44
E: 17.135485 6 04 83 80 67 10 44
E: 17.138327 6 04 87 00 27 90 11
E: 17.147068 6 04 87 00 27 90 11
E: 17.148962 6 04 83 80 67 10 44
E: 17.160426 6 04 83 80 67 10 44
E: 17.162826 6 04 87 00 27 90 11
E: 17.170999 6 04 87 00 27 90 11
E: 17.172964 6 04 83 80 67 10 44
E: 17.184529 6 04 83 70 67 d0 43
E: 17.187338 6 04 87 00 27 90 11
E: 17.195915 6 04 87 20 27 90 11
E: 17.198810 6 04 83 70 67 90 43
E: 17.208366 6 04 83 70 67 60 43
E: 17.211278 6 04 87 20 27 90 11
E: 17.222025 6 04 87 40 27 90 11
E: 17.225931 6 04 83 70 67 40 43
E: 17.235483 6 04 83 70 67 20 43
E: 17.238393 6 04 87 40 27 90 11
E: 17.247374 6 04 87 40 27 90 11
E: 17.250413 6 04 83 70 67 20 43
E: 17.259148 6 04 83 70 67 00 43
E: 17.262036 6 04 87 40 27 90 11
E: 17.270816 6 04 87 40 27 90 11
E: 17.274479 6 04 83 70 67 00 43
E: 17.283257 6 04 83 70 67 00 43
E: 17.287232 6 04 87 40 27 90 11
E: 17.295956 6 04 87 40 27 90 11
E: 17.297935 6 04 83 70 67 00 43
E: 17.309168 6 04 83 70 67 00 43
E: 17.313028 6 04 87 40 27 90 11
E: 17.319089 6 04 87 40 27 90 11
E: 17.323010 6 04 83 70 67 00 43
E: 17.334234 6 04 83 70 67 00 43
E: 17.338038 6 04 87 40 27 90 11
E: 17.346879 6 04 87 40 27 90 11
E: 17.349854 6 04 83 70 67 00 43
E: 17.355873 6 04 83 70 67 00 43
E: 17.360799 6 04 87 40 27 90 11
E: 17.370358 6 04 87 40 27 90 11
E: 17.373284 6 04 83 70 67 00 43
E: 17.381999 6 04 83 70 67 00 43
E: 17.384869 6 04 87 40 27 90 11
E: 17.394352 6 04 87 40 27 90 11
E: 17.397131 6 04 83 70 67 00 43
E: 17.405877 6 04 83 70 67 00 43
E: 17.409789 6 04 87 40 27 90 11
E: 17.419305 6 04 87 40 27 90 11
E: 17.421073 6 04 83 70 67 00 43
E: 17.431833 6 04 83 70 67 00 43
E: 17.435553 6 04 87 40 27 90 11
E: 17.444118 6 04 87 40 27 90 11
E: 17.446991 6 04 83 70 67 00 43
E: 17.455826 6 04 83 70 67 00 43
E: 17.459459 6 04 87 40 27 90 11
E: 17.468351 6 04 87 40 27 90 11
E: 17.471372 6 04 83 70 67 00 43
E: 17.482110 6 04 83 70 67 00 43
E: 17.483977 6 04 87 40 27 90 11
E: 17.492792 6 04 87 40 27 90 11
E: 17.496397 6 04 83 70 67 00 43
E: 17.505165 6 04 83 70 67 00 43
E: 17.508057 6 04 87 40 27 90 11
E: 17.518960 6 04 87 40 27 90 11
E: 17.521945 6 04 83 70 67 00 43
E: 17.530799 6 04 83 70 67 00 43
E: 17.533530 6 04 87 40 27 90 11
E: 17.544186 6 04 87 40 27 90 11
E: 17.547074 6 04 83 70 67 00 43
E: 17.555873 6 04 83 70 67 00 43
E: 17.558746 6 04 87 40 27 90 11
E: 17.568296 6 04 87 40 27 90 11
E: 17.572130 6 04 83 70 67 00 43
E: 17.580951 6 04 83 70 67 00 43
E: 17.584818 6 04 87 40 27 90 11
E: 17.594287 6 04 87 40 27 90 11
E: 17.598208 6 04 83 70 67 00 43
E: 17.606965 6 04 83 70 67 00 43
E: 17.610850 6 04 87 40 27 90 11
E: 17.617457 6 04 87 40 27 90 11
E: 17.620386 6 04 83 70 67 00 43
E: 17.631098 6 04 83 70 67 00 43
E: 17.633697 6 04 87 40 27 90 11
E: 17.642610 6 04 87 40 27 90 11
E: 17.645131 6 04 83 70 67 00 43
E: 17.653921 6 04 83 70 67 00 43
E: 17.657845 6 04 87 40 27 90 11
E: 17.667464 6 04 87 40 27 90 11
E: 17.670397 6 04 83 70 67 00 43
E: 17.679278 6 04 87 60 27 a0 11
E: 17.687921 6 04 87 60 27 a0 11
E: 17.697473 6 04 87 80 27 b0 11
E: 17.706206 6 04 87 80 27 b0 11
E: 17.715148 6 04 87 a0 27 b0 11
E: 17.724443 6 04 87 a0 27 b0 11
E: 17.727388 6 04 83 60 67 b0 42
E: 17.729303 6 04 82 60 67 b0 42
E: 17.733067 6 04 87 a0 27 b0 11
E: 17.738930 6 04 87 a0 27 b0 11
E: 17.749447 6 04 87 a0 27 b0 11
E: 17.755174 6 04 87 a0 27 b0 11
E: 17.764965 6 04 87 a0 27 b0 11
E: 17.773953 6 04 87 a0 27 b0 11
E: 17.783295 6 04 87 a0 27 b0 11
E: 17.792279 6 04 87 a0 27 b0 11
E: 17.800990 6 04 87 a0 27 b0 11
E: 17.810453 6 04 87 a0 27 b0 11
E: 17.819058 6 04 87 a0 27 b0 11
E: 17.827799 6 04 87 a0 27 b0 11
E: 17.834456 6 04 87 a0 27 b0 11
E: 17.844173 6 04 87 a0 27 b0 11
E: 17.850026 6 04 87 a0 27 b0 11
E: 17.859786 6 04 87 a0 27 b0 11
E: 17.869454 6 04 87 a0 27 b0 11
E: 17.878013 6 04 87 a0 27 b0 11
E: 17.886796 6 04 87 a0 27 b0 11
E: 17.896253 6 04 87 a0 27 b0 11
E: 17.905104 6 04 87 a0 27 b0 11
E: 17.909929 6 04 87 a0 27 b0 11
E: 17.921304 6 04 87 a0 27 b0 11
E: 17.931181 6 04 87 a0 27 b0 11
E: 17.938870 6 04 87 a0 27 b0 11
E: 17.945554 6 04 87 a0 27 b0 11
E: 17.955167 6 04 87 a0 27 b0 11
E: 17.963987 6 04 87 a0 27 b0 11
E: 17.972862 6 04 87 a0 27 b0 11
E: 17.982230 6 04 87 a0 27 b0 11
E: 17.990930 6 04 87 a0 27 b0 11
E: 17.996877 6 04 87 a0 27 b0 11
E: 18.006874 6 04 87 a0 27 b0 11
E: 18.015784 6 04 87 a0 27 b0 11
E: 18.025459 6 04 87 a0 27 b0 11
E: 18.031124 6 04 87 a0 27 b0 11
E: 18.040780 6 04 87 a0 27 b0 11
E: 18.050429 6 04 87 a0 27 b0 11
E: 18.059063 6 04 87 a0 27 b0 11
E: 18.067855 6 04 87 a0 27 b0 11
E: 18.077364 6 04 87 a0 27 b0 11
E: 18.085866 6 04 87 a0 27 b0 11
E: 18.095232 6 04 87 a0 27 b0 11
E: 18.101362 6 04 87 a0 27 b0 11
E: 18.110880 6 04 87 a0 27 b0 11
E: 18.120295 6 04 87 a0 27 b0 11
E: 18.126237 6 04 87 a0 27 b0 11
E: 18.136188 6 04 87 a0 27 b0 11
E: 18.144992 6 04 87 a0 27 b0 11
E: 18.154571 6 04 87 a0 27 b0 11
E: 18.163254 6 04 87 a0 27 b0 11
E: 18.172004 6 04 87 a0 27 b0 11
E: 18.177931 6 04 87 a0 27 b0 11
E: 18.188383 6 04 87 a0 27 b0 11
E: 18.197189 6 04 87 a0 27 b0 11
E: 18.205937 6 04 87 a0 27 b0 11
E: 18.215422 6 04 87 a0 27 b0 11
E: 18.221307 6 04 87 a0 27 b0 11
E: 18.230947 6 04 87 a0 27 b0 11
E: 18.239827 6 04 87 a0 27 b0 11
E: 18.246458 6 04 87 a0 27 b0 11
E: 18.256145 6 04 87 a0 27 b0 11
E: 18.264889 6 04 87 a0 27 b0 11
E: 18.274340 6 04 87 a0 27 b0 11
E: 18.283129 6 04 87 a0 27 b0 11
E: 18.291816 6 04 87 a0 27 b0 11
E: 18.301476 6 04 87 a0 27 b0 11
E: 18.306981 6 04 87 a0 27 b0 11
E: 18.317360 6 04 87 a0 27 b0 11
E: 18.326273 6 04 87 a0 27 b0 11
E: 18.334940 6 04 87 a0 27 b0 11
E: 18.340784 6 04 87 a0 27 b0 11
E: 18.351238 6 04 87 a0 27 b0 11
E: 18.359999 6 04 87 a0 27 b0 11
E: 18.368804 6 04 87 a0 27 b0 11
E: 18.378237 6 04 87 a0 27 b0 11
E: 18.383994 6 04 87 a0 27 b0 11
E: 18.393998 6 04 87 a0 27 b0 11
E: 18.402990 6 04 87 a0 27 b0 11
E: 18.412010 6 04 87 a0 27 b0 11
E: 18.420996 6 04 87 a0 27 b0 11
E: 18.427473 6 04 87 a0 27 b0 11
E: 18.437242 6 04 87 a0 27 b0 11
E: 18.446009 6 04 87 a0 27 b0 11
E: 18.454943 6 04 87 a0 27 b0 11
E: 18.464313 6 04 87 a0 27 b0 11
E: 18.473123 6 04 87 a0 27 b0 11
E: 18.481887 6 04 87 a0 27 b0 11
E: 18.487414 6 04 87 a0 27 b0 11
E: 18.498290 6 04 87 a0 27 b0 11
E: 18.504731 6 04 87 a0 27 b0 11
E: 18.514122 6 04 87 a0 27 b0 11
E: 18.522950 6 04 87 a0 27 b0 11
E: 18.532372 6 04 87 a0 27 b0 11
E: 18.541367 6 04 87 a0 27 b0 11
E: 18.547304 6 04 87 a0 27 b0 11
E: 18.557306 6 04 87 a0 27 b0 11
E: 18.566006 6 04 87 a0 27 b0 11
E: 18.575645 6 04 87 a0 27 b0 11
E: 18.584209 6 04 87 a0 27 b0 11
E: 18.593194 6 04 87 a0 27 b0 11
E: 18.602125 6 04 87 a0 27 b0 11
E: 18.611086 6 04 87 a0 27 b0 11
E: 18.616864 6 04 87 a0 27 b0 11
E: 18.627355 6 04 87 a0 27 b0 11
E: 18.635973 6 04 87 a0 27 b0 11
E: 18.644754 6 04 87 a0 27 b0 11
E: 18.654242 6 04 87 a0 27 b0 11
E: 18.662931 6 04 87 a0 27 b0 11
E: 18.668784 6 04 87 a0 27 b0 11
E: 18.679365 6 04 87 a0 27 b0 11
E: 18.689705 6 04 87 a0 27 b0 11
E: 18.696871 6 04 87 a0 27 b0 11
E: 18.702960 6 04 87 a0 27 b0 11
E: 18.713332 6 04 87 a0 27 b0 11
E: 18.721993 6 04 87 a0 27 b0 11
E: 18.731637 6 04 87 a0 27 b0 11
E: 18.740115 6 04 87 a0 27 b0 11
E: 18.748944 6 04 87 a0 27 b0 11
E: 18.755544 6 04 87 a0 27 b0 11
E: 18.765268 6 04 87 a0 27 b0 11
E: 18.773814 6 04 87 a0 27 b0 11
E: 18.783290 6 04 87 a0 27 b0 11
E: 18.792044 6 04 87 a0 27 b0 11
E: 18.797921 6 04 87 a0 27 b0 11
E: 18.808392 6 04 87 a0 27 b0 11
E: 18.817421 6 04 87 a0 27 b0 11
E: 18.826157 6 04 87 a0 27 b0 11
E: 18.834867 6 04 87 a0 27 b0 11
E: 18.844204 6 04 87 a0 27 b0 11
E: 18.853003 6 04 87 a0 27 b0 11
E: 18.858548 6 04 87 a0 27 b0 11
E: 18.867309 6 04 87 a0 27 b0 11
E: 18.875981 6 04 87 a0 27 b0 11
E: 18.884931 6 04 87 a0 27 b0 11
E: 18.893781 6 04 87 a0 27 b0 11
E: 18.903322 6 04 87 a0 27 b0 11
E: 18.911976 6 04 87 a0 27 b0 11
E: 18.917859 6 04 87 a0 27 b0 11
E: 18.928359 6 04 87 a0 27 b0 11
E: 18.936968 6 04 87 a0 27 b0 11
E: 18.945770 6 04 87 a0 27 b0 11
E: 18.955360 6 04 87 a0 27 b0 11
E: 18.964121 6 04 87 a0 27 b0 11
E: 18.972925 6 04 87 a0 27 b0 11
E: 18.978465 6 04 87 a0 27 b0 11
E: 18.989143 6 04 87 a0 27 b0 11
E: 18.997939 6 04 87 a0 27 b0 11
E: 19.007515 6 04 87 a0 27 b0 11
E: 19.013355 6 04 87 a0 27 b0 11
E: 19.022934 6 04 87 a0 27 b0 11
E: 19.031730 6 04 87 a0 27 b0 11
E: 19.038374 6 04 87 a0 27 b0 11
E: 19.047925 6 04 87 a0 27 b0 11
E: 19.057474 6 04 87 a0 27 b0 11
E: 19.066329 6 04 87 a0 27 b0 11
E: 19.075324 6 04 87 a0 27 b0 11
E: 19.084236 6 04 87 a0 27 b0 11
E: 19.093004 6 04 87 a0 27 b0 11
E: 19.098864 6 04 87 a0 27 b0 11
E: 19.109367 6 04 87 a0 27 b0 11
E: 19.118214 6 04 87 a0 27 b0 11
E: 19.127043 6 04 87 a0 27 b0 11
E: 19.180098 6 04 87 a0 27 90 11
E: 19.183043 6 04 86 a0 27 90 11
E: 30.049758 6 04 83 80 16 90 53
E: 30.190063 6 04 83 80 16 90 53
E: 30.192901 6 04 82 80 16 90 53
E: 30.203024 6 04 83 80 4b 90 22
E: 30.229066 6 04 83 80 4b 90 22
E: 30.231973 6 04 87 60 66 00 5b
E: 30.234978 6 04 8b 40 72 80 4c
E: 30.254574 6 04 83 80 4b 90 22
E: 30.256983 6 04 8b 40 72 80 4c
E: 30.259923 6 04 87 60 66 00 5b
E: 30.263586 6 04 8f 30 5e 00 5e
E: 30.281965 6 04 83 80 4b 90 22
E: 30.286666 6 04 8f 30 5e 20 5e
E: 30.289535 6 04 8b 40 72 a0 4c
E: 30.310142 6 04 8b 40 72 a0 4c
E: 30.313035 6 04 87 60 66 00 5b
E: 30.315989 6 04 8f 30 5e 40 5e
E: 30.319628 6 04 83 80 4b 90 22
E: 30.334157 6 04 87 60 66 00 5b
E: 30.337123 6 04 8f 30 5e 40 5e
E: 30.339986 6 04 83 80 4b 90 22
E: 30.342973 6 04 8b 40 72 c0 4c
E: 30.362217 6 04 8b 40 72 e0 4c
E: 30.365207 6 04 83 80 4b 90 22
E: 30.369127 6 04 8f 30 5e 80 5e
E: 30.388474 6 04 83 80 4b 90 22
E: 30.391366 6 04 8b 40 72 e0 4c
E: 30.393096 6 04 87 60 66 00 5b
E: 30.396049 6 04 8f 30 5e 80 5e
E: 30.412976 6 04 83 80 4b 90 22
E: 30.417670 6 04 8b 40 72 e0 4c
E: 30.419685 6 04 87 60 66 00 5b
E: 30.422587 6 04 8f 30 5e 80 5e
E: 30.443674 6 04 8f 40 5e a0 5e
E: 30.446497 6 04 8b 50 72 00 4d
E: 30.449412 6 04 83 80 4b 90 22
E: 30.468641 6 04 87 60 66 00 5b
E: 30.471556 6 04 8f 40 5e a0 5e
E: 30.474491 6 04 83 80 4b 90 22
E: 30.477275 6 04 8b 50 72 00 4d
E: 30.494649 6 04 8f 40 5e a0 5e
E: 30.497528 6 04 83 80 4b 90 22
E: 30.500631 6 04 8b 50 72 00 4d
E: 30.503597 6 04 87 60 66 00 5b
E: 30.522481 6 04 83 80 4b 90 22
E: 30.525408 6 04 8f 40 5e a0 5e
E: 30.528349 6 04 8b 50 72 00 4d
E: 30.547540 6 04 83 80 4b 90 22
E: 30.549508 6 04 8b 50 72 00 4d
E: 30.552533 6 04 87 60 66 00 5b
E: 30.555377 6 04 8f 40 5e a0 5e
E: 30.574065 6 04 8b 50 72 00 4d
E: 30.577030 6 04 87 60 66 00 5b
E: 30.579925 6 04 8f 40 5e a0 5e
E: 30.582996 6 04 83 80 4b 90 22
E: 30.602328 6 04 8b 50 72 00 4d
E: 30.605244 6 04 83 80 4b 90 22
E: 30.609164 6 04 8f 40 5e a0 5e
E: 30.628374 6 04 8f 40 5e a0 5e
E: 30.631278 6 04 83 80 4b 90 22
E: 30.633194 6 04 8b 50 72 00 4d
E: 30.636118 6 04 87 60 66 00 5b
E: 30.654158 6 04 83 80 4b 90 22
E: 30.656547 6 04 8b 50 72 00 4d
E: 30.659429 6 04 87 60 66 00 5b
E: 30.662192 6 04 8f 40 5e a0 5e
E: 30.681148 6 04 83 80 4b 90 22
E: 30.684018 6 04 8f 40 5e a0 5e
E: 30.686977 6 04 8b 50 72 00 4d
E: 30.706644 6 04 8b 50 72 00 4d
E: 30.709492 6 04 87 60 66 00 5b
E: 30.712552 6 04 8f 40 5e a0 5e
E: 30.715450 6 04 83 80 4b 90 22
E: 30.733949 6 04 87 60 66 00 5b
E: 30.737515 6 04 8f 40 5e a0 5e
E: 30.741490 6 04 83 80 4b 90 22
E: 30.744674 6 04 8b 50 72 00 4d
E: 30.761550 6 04 8b 50 72 00 4d
E: 30.765470 6 04 83 80 4b 90 22
E: 30.768347 6 04 8f 40 5e c0 5e
E: 30.787083 6 04 83 80 4b 90 22
E: 30.790667 6 04 8b 50 72 00 4d
E: 30.791975 6 04 87 60 66 00 5b
E: 30.794934 6 04 8f 40 5e c0 5e
E: 30.812251 6 04 83 80 4b 90 22
E: 30.815144 6 04 8b 50 72 00 4d
E: 30.818049 6 04 87 60 66 00 5b
E: 30.821002 6 04 8f 40 5e c0 5e
E: 30.840190 6 04 8f 40 5e c0 5e
E: 30.843099 6 04 8b 50 72 00 4d
E: 30.846034 6 04 83 80 4b 90 22
E: 30.867734 6 04 87 60 66 00 5b
E: 30.870214 6 04 8f 40 5e c0 5e
E: 30.874185 6 04 83 80 4b 90 22
E: 30.877037 6 04 8b 50 72 00 4d
E: 30.892542 6 04 8f 40 5e c0 5e
E: 30.895540 6 04 83 80 4b 90 22
E: 30.898785 6 04 8b 50 72 00 4d
E: 30.901216 6 04 87 60 66 00 5b
E: 30.921905 6 04 83 80 4b 90 22
E: 30.925544 6 04 8f 40 5e c0 5e
E: 30.947960 6 04 83 80 4b 90 22
E: 30.951525 6 04 8b 50 72 00 4d
E: 30.954463 6 04 87 60 66 00 5b
E: 30.958342 6 04 8f 40 5e c0 5e
E: 30.971009 6 04 8b 50 72 00 4d
E: 30.973942 6 04 87 60 66 00 5b
E: 30.976865 6 04 8f 40 5e a0 5e
E: 30.981597 6 04 83 80 4b 90 22
E: 31.000310 6 04 83 80 4b 90 22
E: 31.003247 6 04 8f 40 5e a0 5e
E: 31.026370 6 04 8f 40 5e a0 5e
E: 31.030149 6 04 83 80 4b 90 22
E: 31.033096 6 04 8b 50 72 00 4d
E: 31.036065 6 04 87 60 66 00 5b
E: 31.053209 6 04 83 80 4b 90 22
E: 31.056104 6 04 8b 50 72 e0 4c
E: 31.059041 6 04 87 60 66 00 5b
E: 31.061902 6 04 8f 40 5e a0 5e
E: 31.081376 6 04 83 80 4b 90 22
E: 31.084220 6 04 8f 40 5e a0 5e
E: 31.105145 6 04 8b 50 72 e0 4c
E: 31.108094 6 04 87 60 66 00 5b
E: 31.111005 6 04 8f 40 5e a0 5e
E: 31.115677 6 04 83 80 4b 90 22
E: 31.132097 6 04 8b 50 72 b0 4c
E: 31.134986 6 04 87 60 66 00 5b
E: 31.136907 6 04 8f 40 5e a0 5e
E: 31.140554 6 04 83 80 4b 90 22
E: 31.157108 6 04 87 60 66 00 5b
E: 31.160988 6 04 8f 50 5e 80 5e
E: 31.164596 6 04 83 80 4b 90 22
E: 31.167581 6 04 8b 50 72 b0 4c
E: 31.185924 6 04 8b 50 72 90 4c
E: 31.189522 6 04 83 80 4b 90 22
E: 31.192551 6 04 8f 50 5e 80 5e
E: 31.211401 6 04 83 80 4b 90 22
E: 31.214357 6 04 8b 50 72 70 4c
E: 31.217315 6 04 87 60 66 00 5b
E: 31.221270 6 04 8f 50 5e 60 5e
E: 31.238122 6 04 83 80 4b 90 22
E: 31.241056 6 04 8b 50 72 50 4c
E: 31.243990 6 04 87 60 66 00 5b
E: 31.246893 6 04 8f 50 5e 60 5e
E: 31.266233 6 04 8f 50 5e 60 5e
E: 31.270725 6 04 8b 50 72 30 4c
E: 31.272970 6 04 83 80 4b 90 22
E: 31.292155 6 04 87 60 66 00 5b
E: 31.295031 6 04 8f 50 5e 60 5e
E: 31.297977 6 04 83 80 4b 90 22
E: 31.301428 6 04 8b 50 72 30 4c
E: 31.318263 6 04 8f 50 5e 60 5e
E: 31.321059 6 04 83 80 4b 90 22
E: 31.324771 6 04 8b 50 72 10 4c
E: 31.327718 6 04 87 60 66 00 5b
E: 31.346455 6 04 83 80 4b 90 22
E: 31.349324 6 04 8f 50 5e 60 5e
E: 31.353192 6 04 8b 50 72 10 4c
E: 31.372494 6 04 83 80 4b 90 22
E: 31.375388 6 04 8b 50 72 f0 4b
E: 31.377222 6 04 87 60 66 d0 5a
E: 31.379152 6 04 8f 50 5e 40 5e
E: 31.396586 6 04 8b 50 72 f0 4b
E: 31.399516 6 04 87 60 66 b0 5a
E: 31.401276 6 04 8f 50 5e 20 5e
E: 31.403189 6 04 83 80 4b 90 22
E: 31.424281 6 04 8b 50 72 d0 4b
E: 31.427057 6 04 83 80 4b 90 22
E: 31.429989 6 04 8f 50 5e 20 5e
E: 31.452821 6 04 8f 50 5e 20 5e
E: 31.453930 6 04 83 80 4b 90 22
E: 31.457554 6 04 8b 50 72 b0 4b
E: 31.461304 6 04 87 60 66 80 5a
E: 31.476087 6 04 83 80 4b 90 22
E: 31.479021 6 04 8b 50 72 80 4b
E: 31.482071 6 04 87 60 66 40 5a
E: 31.485957 6 04 8f 60 5e f0 5d
E: 31.505039 6 04 83 80 4b 90 22
E: 31.508915 6 04 8f 70 5e d0 5d
E: 31.511927 6 04 8b 50 72 60 4b
E: 31.531215 6 04 8b 50 72 30 4b
E: 31.533102 6 04 87 60 66 00 5a
E: 31.536009 6 04 8f 70 5e a0 5d
E: 31.538973 6 04 83 80 4b 90 22
E: 31.558336 6 04 87 60 66 c0 59
E: 31.561120 6 04 8f 70 5e 70 5d
E: 31.564026 6 04 83 80 4b 90 22
E: 31.566980 6 04 8b 50 72 00 4b
E: 31.586683 6 04 8b 50 72 e0 4a
E: 31.587090 6 04 83 90 4b 70 22
E: 31.589975 6 04 8f 70 5e 70 5d
E: 31.611239 6 04 83 90 4b 70 22
E: 31.614167 6 04 8b 50 72 b0 4a
E: 31.617058 6 04 87 60 66 70 59
E: 31.619950 6 04 8f 70 5e 40 5d
E: 31.639363 6 04 83 b0 4b 50 22
E: 31.642226 6 04 8b 50 72 70 4a
E: 31.645139 6 04 87 60 66 10 59
E: 31.648035 6 04 8f 80 5e 00 5d
E: 31.667293 6 04 8b 50 72 20 4a
E: 31.670154 6 04 83 d0 4b 10 22
E: 31.689536 6 04 87 60 66 a0 58
E: 31.692387 6 04 8f 90 5e 90 5c
E: 31.695333 6 04 8b 50 72 d0 49
E: 31.714230 6 04 8f a0 5e 10 5c
E: 31.717207 6 04 8b 50 72 70 49
E: 31.719899 6 04 87 60 66 20 58
E: 31.739046 6 04 83 00 4c b0 21
E: 31.741963 6 04 87 80 66 10 58
E: 31.744904 6 04 8b 50 72 10 49
E: 31.768675 6 04 83 20 4c 70 21
E: 31.771573 6 04 8b 50 72 a0 48
E: 31.774481 6 04 8f b0 5e 70 5b
E: 31.793037 6 04 8b 50 72 30 48
E: 31.795972 6 04 8f c0 5e c0 5a
E: 31.799635 6 04 83 40 4c 40 21
E: 31.819988 6 04 8b 50 72 c0 47
E: 31.821923 6 04 83 50 4c 10 21
E: 31.825501 6 04 8f d0 5e 40 5a
E: 31.846013 6 04 8f e0 5e a0 59
E: 31.847889 6 04 83 60 4c f0 20
E: 31.851573 6 04 8b 50 72 40 47
E: 31.871890 6 04 83 60 4c f0 20
E: 31.875659 6 04 8b 50 72 c0 46
E: 31.878539 6 04 8f f0 5e 00 59
E: 31.899170 6 04 83 90 4c a0 20
E: 31.902085 6 04 8f 00 5f 80 58
E: 31.904996 6 04 8b 50 72 50 46
E: 31.907918 6 04 87 40 67 90 59
E: 31.911644 6 04 86 40 67 90 59
E: 31.924264 6 04 8b 40 72 d0 45
E: 31.927159 6 04 8f 10 5f 00 58
E: 31.929112 6 04 83 b0 4c 70 20
E: 31.950540 6 04 8f 20 5f 80 57
E: 31.953448 6 04 83 c0 4c 50 20
E: 31.955378 6 04 8b 30 72 50 45
E: 31.958278 6 04 87 60 66 d0 50
E: 31.977617 6 04 8b 30 72 d0 44
E: 31.980425 6 04 83 f0 4c 00 20
E: 31.983355 6 04 8f 20 5f 20 57
E: 32.002646 6 04 83 10 4d d0 1f
E: 32.005444 6 04 8b 30 72 70 44
E: 32.008362 6 04 87 60 66 d0 50
E: 32.011407 6 04 8f 30 5f a0 56
E: 32.030506 6 04 83 30 4d a0 1f
E: 32.033400 6 04 8b 30 72 10 44
E: 32.036238 6 04 87 60 66 a0 50
E: 32.038135 6 04 8f 30 5f 20 56
E: 32.055473 6 04 8f 30 5f c0 55
E: 32.058309 6 04 8b 30 72 c0 43
E: 32.061226 6 04 83 70 4d 60 1f
E: 32.082476 6 04 87 70 66 60 50
E: 32.085163 6 04 8f 30 5f 50 55
E: 32.088063 6 04 83 a0 4d 30 1f
E: 32.091034 6 04 8b 30 72 80 43
E: 32.110354 6 04 8f 30 5f d0 54
E: 32.113230 6 04 83 c0 4d 10 1f
E: 32.116175 6 04 8b 20 72 20 43
E: 32.119100 6 04 87 70 66 00 50
E: 32.134158 6 04 83 10 4e e0 1e
E: 32.137022 6 04 8f 30 5f 70 54
E: 32.139937 6 04 8b 20 72 b0 42
E: 32.161215 6 04 83 50 4e b0 1e
E: 32.164240 6 04 8b 20 72 60 42
E: 32.167046 6 04 87 80 66 90 4f
E: 32.168985 6 04 8f 40 5f f0 53
E: 32.186314 6 04 8b 10 72 f0 41
E: 32.189284 6 04 87 80 66 10 4f
E: 32.192194 6 04 8f 40 5f 70 53
E: 32.194115 6 04 83 80 4e 90 1e
E: 32.213361 6 04 8b 10 72 90 41
E: 32.217158 6 04 83 d0 4e 60 1e
E: 32.220104 6 04 8f 50 5f 10 53
E: 32.239395 6 04 8f 50 5f a0 52
E: 32.241282 6 04 83 10 4f 40 1e
E: 32.244187 6 04 8b 10 72 40 41
E: 32.247129 6 04 87 80 66 90 4e
E: 32.265882 6 04 83 40 4f 20 1e
E: 32.269468 6 04 8b 00 72 e0 40
E: 32.272417 6 04 87 80 66 10 4e
E: 32.275399 6 04 8f 50 5f 20 52
E: 32.292086 6 04 83 60 4f 10 1e
E: 32.294971 6 04 8f 60 5f d0 51
E: 32.298023 6 04 8b 00 72 80 40
E: 32.316976 6 04 8b 00 72 30 40
E: 32.319864 6 04 87 90 66 80 4d
E: 32.322924 6 04 8f 60 5f 60 51
E: 32.324865 6 04 83 b0 4f e0 1d
E: 32.342496 6 04 87 90 66 00 4d
E: 32.345345 6 04 8f 60 5f e0 50
E: 32.349273 6 04 83 f0 4f c0 1d
E: 32.352168 6 04 8b f0 71 d0 3f
E: 32.367581 6 04 8b f0 71 70 3f
E: 32.370482 6 04 83 50 50 90 1d
E: 32.374266 6 04 8f 60 5f 80 50
E: 32.393208 6 04 83 a0 50 70 1d
E: 32.397046 6 04 8b f0 71 20 3f
E: 32.400382 6 04 87 a0 66 80 4c
E: 32.403334 6 04 8f 70 5f 10 50
E: 32.418661 6 04 8b e0 71 c0 3e
E: 32.421575 6 04 87 a0 66 f0 4b
E: 32.423463 6 04 8f 70 5f 90 4f
E: 32.426484 6 04 83 10 51 50 1d
E: 32.447242 6 04 8f 70 5f 30 4f
E: 32.450136 6 04 8b e0 71 80 3e
E: 32.453092 6 04 83 70 51 30 1d
E: 32.472304 6 04 87 b0 66 60 4b
E: 32.475244 6 04 8f 80 5f c0 4e
E: 32.478249 6 04 83 b0 51 20 1d
E: 32.481177 6 04 8b d0 71 20 3e
E: 32.498685 6 04 8f 80 5f 40 4e
E: 32.501692 6 04 83 e0 51 10 1d
E: 32.505453 6 04 8b c0 71 b0 3d
E: 32.508331 6 04 87 b0 66 d0 4a
E: 32.527928 6 04 83 00 52 00 1d
E: 32.530517 6 04 8f 80 5f e0 4d
E: 32.533293 6 04 8b c0 71 60 3d
E: 32.553937 6 04 8b c0 71 00 3d
E: 32.557605 6 04 87 c0 66 40 4a
E: 32.560464 6 04 8f 90 5f 70 4d
E: 32.564026 6 04 83 60 52 f0 1c
E: 32.580637 6 04 8b c0 71 b0 3c
E: 32.583508 6 04 87 d0 66 b0 49
E: 32.586531 6 04 8f a0 5f e0 4c
E: 32.590298 6 04 83 a0 52 e0 1c
E: 32.607600 6 04 8b c0 71 70 3c
E: 32.610536 6 04 83 d0 52 d0 1c
E: 32.614398 6 04 8f a0 5f 80 4c
E: 32.633056 6 04 8f b0 5f 00 4c
E: 32.636923 6 04 83 30 53 c0 1c
E: 32.640691 6 04 8b c0 71 10 3c
E: 32.643468 6 04 87 e0 66 00 49
E: 32.658048 6 04 83 80 53 b0 1c
E: 32.661004 6 04 8b c0 71 c0 3b
E: 32.664670 6 04 87 e0 66 50 48
E: 32.667577 6 04 8f c0 5f 70 4b
E: 32.685939 6 04 8b b0 71 50 3b
E: 32.711297 6 04 8b a0 71 c0 3a
E: 32.714231 6 04 87 f0 66 90 47
E: 32.717729 6 04 8f d0 5f d0 4a
E: 32.721179 6 04 83 c0 53 a0 1c
E: 32.734190 6 04 87 f0 66 e0 46
E: 32.737311 6 04 8f e0 5f 30 4a
E: 32.740063 6 04 83 f0 53 90 1c
E: 32.742918 6 04 8b 90 71 50 3a
E: 32.764436 6 04 8b 90 71 00 3a
E: 32.767291 6 04 83 40 54 80 1c
E: 32.788665 6 04 83 80 54 70 1c
E: 32.791890 6 04 8b 90 71 90 39
E: 32.793473 6 04 87 00 67 30 46
E: 32.796339 6 04 8f f0 5f 90 49
E: 32.810998 6 04 8b 90 71 40 39
E: 32.813976 6 04 87 10 67 80 45
E: 32.816929 6 04 8f 00 60 f0 48
E: 32.837945 6 04 8b 80 71 d0 38
E: 32.861140 6 04 87 20 67 d0 44
E: 32.864056 6 04 8f 10 60 50 48
E: 32.865983 6 04 8b 80 71 50 38
E: 32.883331 6 04 8f 20 60 b0 47
E: 32.886228 6 04 8b 80 71 f0 37
E: 32.890102 6 04 87 30 67 30 44
E: 32.911440 6 04 83 e0 54 60 1c
E: 32.913275 6 04 8b 80 71 b0 37
E: 32.934419 6 04 8b 80 71 50 37
E: 32.937324 6 04 87 40 67 90 43
E: 32.939224 6 04 8f 30 60 10 47
E: 32.942169 6 04 83 30 55 50 1c
E: 32.957131 6 04 8b 80 71 00 37
E: 32.961039 6 04 87 40 67 f0 42
E: 32.964683 6 04 8f 40 60 70 46
E: 32.967587 6 04 83 70 55 40 1c
E: 32.986001 6 04 83 a0 55 30 1c
E: 33.011235 6 04 8f 50 60 d0 45
E: 33.014121 6 04 83 f0 55 20 1c
E: 33.017177 6 04 8b 80 71 d0 36
E: 33.020003 6 04 87 50 67 60 42
E: 33.031431 6 04 8b 80 71 a0 36
E: 33.033280 6 04 87 50 67 d0 41
E: 33.035216 6 04 8f 60 60 30 45
E: 33.060188 6 04 8b 80 71 80 36
E: 33.081608 6 04 8b 70 71 30 36
E: 33.085528 6 04 87 60 67 50 41
E: 33.088390 6 04 8f 70 60 a0 44
E: 33.104946 6 04 87 60 67 e0 40
E: 33.108666 6 04 8f 80 60 10 44
E: 33.111548 6 04 8b 60 71 f0 35
E: 33.132607 6 04 8b 60 71 c0 35
E: 33.135517 6 04 83 30 56 10 1c
E: 33.155956 6 04 83 60 56 10 1c
E: 33.159782 6 04 8b 60 71 a0 35
E: 33.162522 6 04 87 70 67 70 40
E: 33.166414 6 04 8f 90 60 90 43
E: 33.179107 6 04 8b 60 71 a0 35
E: 33.182049 6 04 87 70 67 10 40
E: 33.184994 6 04 8f a0 60 10 43
E: 33.188919 6 04 83 80 56 10 1c
E: 33.205959 6 04 8b 60 71 80 35
E: 33.209644 6 04 83 a0 56 10 1c
E: 33.228673 6 04 87 80 67 b0 3f
E: 33.231529 6 04 8f b0 60 a0 42
E: 33.234492 6 04 83 a0 56 10 1c
E: 33.238158 6 04 8b 60 71 80 35
E: 33.251667 6 04 8f c0 60 40 42
E: 33.254475 6 04 83 c0 56 10 1c
E: 33.257415 6 04 8b 60 71 60 35
E: 33.261307 6 04 87 80 67 60 3f
E: 33.278554 6 04 83 c0 56 10 1c
E: 33.281393 6 04 87 80 67 10 3f
E: 33.285333 6 04 8b 60 71 60 35
E: 33.302575 6 04 8b 40 71 20 35
E: 33.305482 6 04 87 80 67 d0 3e
E: 33.309469 6 04 8f d0 60 f0 41
E: 33.311517 6 04 83 10 57 00 1c
E: 33.326200 6 04 8b 30 71 f0 34
E: 33.329036 6 04 87 80 67 a0 3e
E: 33.333064 6 04 8f e0 60 b0 41
E: 33.336586 6 04 83 40 57 f0 1b
E: 33.353361 6 04 87 90 67 70 3e
E: 33.356350 6 04 8b 20 71 d0 34
E: 33.358278 6 04 83 60 57 f0 1b
E: 33.375510 6 04 8f f0 60 80 41
E: 33.378428 6 04 83 80 57 f0 1b
E: 33.382294 6 04 8b 20 71 d0 34
E: 33.385188 6 04 87 90 67 50 3e
E: 33.397974 6 04 83 80 57 f0 1b
E: 33.400920 6 04 8b 10 71 b0 34
E: 33.405605 6 04 87 90 67 30 3e
E: 33.407518 6 04 8f f0 60 50 41
E: 33.425939 6 04 83 a0 57 f0 1b
E: 33.429673 6 04 87 a0 67 00 3e
E: 33.431537 6 04 8b 00 71 90 34
E: 33.450000 6 04 8b f0 70 70 34
E: 33.454518 6 04 87 a0 67 e0 3d
E: 33.457360 6 04 8f 00 61 20 41
E: 33.460214 6 04 83 a0 57 f0 1b
E: 33.473050 6 04 87 a0 67 e0 3d
E: 33.477675 6 04 8f 00 61 00 41
E: 33.480517 6 04 83 a0 57 f0 1b
E: 33.483396 6 04 8b f0 70 70 34
E: 33.499950 6 04 8b d0 70 50 34
E: 33.503517 6 04 83 a0 57 f0 1b
E: 33.506464 6 04 87 a0 67 c0 3d
E: 33.523116 6 04 8b d0 70 50 34
E: 33.525033 6 04 87 a0 67 c0 3d
E: 33.526974 6 04 8f 00 61 e0 40
E: 33.548241 6 04 8b d0 70 30 34
E: 33.551189 6 04 87 a0 67 a0 3d
E: 33.554212 6 04 8f 00 61 e0 40
E: 33.577004 6 04 87 a0 67 a0 3d
E: 33.579924 6 04 8b d0 70 30 34
E: 33.583664 6 04 83 a0 57 f0 1b
E: 33.600187 6 04 87 a0 67 a0 3d
E: 33.603113 6 04 8f 00 61 c0 40
E: 33.606415 6 04 83 a0 57 f0 1b
E: 33.610049 6 04 8b d0 70 30 34
E: 33.623062 6 04 8f 00 61 c0 40
E: 33.625917 6 04 8b d0 70 30 34
E: 33.628974 6 04 87 a0 67 a0 3d
E: 33.650372 6 04 83 a0 57 f0 1b
E: 33.653264 6 04 8b d0 70 30 34
E: 33.674487 6 04 8b d0 70 30 34
E: 33.677430 6 04 87 a0 67 a0 3d
E: 33.681309 6 04 8f 00 61 a0 40
E: 33.698565 6 04 8b d0 70 30 34
E: 33.701544 6 04 87 a0 67 a0 3d
E: 33.705538 6 04 8f 00 61 a0 40
E: 33.724485 6 04 87 a0 67 a0 3d
E: 33.727403 6 04 8b d0 70 30 34
E: 33.730416 6 04 83 a0 57 f0 1b
E: 33.746947 6 04 8f 00 61 a0 40
E: 33.750701 6 04 83 a0 57 f0 1b
E: 33.754531 6 04 8b d0 70 30 34
E: 33.757413 6 04 87 a0 67 a0 3d
E: 33.772003 6 04 83 a0 57 f0 1b
E: 33.774996 6 04 8b d0 70 30 34
E: 33.778613 6 04 87 a0 67 a0 3d
E: 33.781464 6 04 8f 00 61 a0 40
E: 33.797939 6 04 83 a0 57 f0 1b
E: 33.801680 6 04 87 a0 67 a0 3d
E: 33.803542 6 04 8b d0 70 30 34
E: 33.821999 6 04 8b d0 70 30 34
E: 33.826665 6 04 87 a0 67 a0 3d
E: 33.829667 6 04 8f 00 61 a0 40
E: 33.832488 6 04 83 a0 57 f0 1b
E: 33.847362 6 04 87 a0 67 a0 3d
E: 33.850301 6 04 8f 00 61 a0 40
E: 33.853180 6 04 83 a0 57 f0 1b
E: 33.856098 6 04 8b d0 70 30 34
E: 33.875237 6 04 8b d0 70 30 34
E: 33.878115 6 04 83 a0 57 f0 1b
E: 33.881053 6 04 87 a0 67 a0 3d
E: 33.898248 6 04 8b d0 70 30 34
E: 33.901168 6 04 87 a0 67 a0 3d
E: 33.904125 6 04 8f 00 61 a0 40
E: 33.921345 6 04 8b d0 70 30 34
E: 33.925192 6 04 87 a0 67 a0 3d
E: 33.928129 6 04 8f 00 61 a0 40
E: 33.931008 6 04 83 a0 57 f0 1b
E: 33.948536 6 04 87 a0 67 a0 3d
E: 33.951480 6 04 8b d0 70 30 34
E: 33.954352 6 04 83 a0 57 f0 1b
E: 33.973689 6 04 87 a0 67 a0 3d
E: 33.976531 6 04 83 c0 57 a0 1b
E: 33.979533 6 04 8b d0 70 30 34
E: 34.024585 6 04 8f 00 61 90 40
E: 34.027460 6 04 8e 00 61 90 40
E: 34.030347 6 04 83 c0 57 30 1a
E: 34.033219 6 04 82 c0 57 30 1a
E: 34.036181 6 04 87 b0 67 b0 3d
E: 34.039829 6 04 86 b0 67 b0 3d
E: 34.042086 6 04 8b b0 70 b0 33
E: 34.045009 6 04 8a b0 70 b0 33

