R: 244 05 0d 09 04 a1 01 85 04 09 22 a1 00 09 42 15 00 25 01 75 01 95 01 81 02 09 32 15 00 25 01 81 02 09 51 75 05 95 01 16 00 00 26 10 00 81 02 09 47 75 01 95 01 15 00 25 01 81 02 05 01 09 30 75 10 95 01 55 0d 65 33 35 00 46 23 28 26 ff 7f 81 02 09 31 75 10 95 01 55 0d 65 33 35 00 46 11 19 26 ff 7f 81 02 05 0d 09 55 25 08 75 08 95 01 b1 02 c0 c0 05 01 09 01 a1 01 85 01 09 01 a1 00 05 09 19 01 29 02 15 00 25 01 95 02 75 01 81 02 95 01 75 06 81 01 05 01 09 30 09 31 16 00 00 26 ff 0f 36 00 00 46 ff 0f 66 00 00 75 10 95 02 81 02 c0 c0 06 00 ff 09 01 a1 01 09 01 15 00 26 ff 00 85 03 75 08 95 3f 81 02 06 00 ff 09 01 15 00 26 ff 00 75 08 95 3f 91 02 c0 05 0d 09 0e a1 01 85 05 09 22 a1 00 09 52 09 53 15 00 25 0a 75 08 95 02 b1 02 c0 c0
N: eGalax_eMPIA Technology Inc. PCAP MultiTouch Controller
I: 3 0eef a001
E: 0.000000 6 04 83 a0 43 40 1e
E: 0.008000 6 04 83 a0 43 40 1e
E: 0.016000 6 04 83 a0 43 60 1e
E: 0.024000 6 04 83 a0 43 80 1e
E: 0.032000 6 04 83 a0 43 a0 1e
E: 0.040000 6 04 83 a0 43 b0 1e
E: 0.048000 6 04 83 a0 43 b0 1e
E: 0.056000 6 04 83 a0 43 c0 1e
E: 0.064000 6 04 83 a0 43 c0 1e
E: 0.072000 6 04 83 a0 43 c0 1e
E: 0.080000 6 04 83 a0 43 c0 1e
E: 0.088000 6 04 83 a0 43 c0 1e
E: 0.096000 6 04 83 a0 43 c0 1e
E: 0.104000 6 04 83 a0 43 c0 1e
E: 0.112000 6 04 83 a0 43 c0 1e
E: 0.120000 6 04 83 a0 43 c0 1e
E: 0.128000 6 04 83 a0 43 d0 1e
E: 0.136000 6 04 83 a0 43 d0 1e
E: 0.144000 6 04 83 a0 43 d0 1e
E: 0.152000 6 04 83 a0 43 d0 1e
E: 0.160000 6 04 83 a0 43 d0 1e
E: 0.168000 6 04 83 a0 43 d0 1e
E: 0.176000 6 04 83 a0 43 d0 1e
E: 0.184000 6 04 83 a0 43 d0 1e
E: 0.192000 6 04 83 a0 43 e0 1e
E: 0.200000 6 04 83 a0 43 e0 1e
E: 0.208000 6 04 83 a0 43 e0 1e
E: 0.216000 6 04 83 a0 43 e0 1e
E: 0.224000 6 04 83 a0 43 e0 1e
E: 0.232000 6 04 83 c0 43 40 1f
E: 0.240000 6 04 83 d0 43 60 1f
E: 0.248000 6 04 83 d0 43 70 1f
E: 0.256000 6 04 83 d0 43 80 1f
E: 0.264000 6 04 83 d0 43 80 1f
E: 0.272000 6 04 83 d0 43 80 1f
E: 0.280000 6 04 83 e0 43 90 1f
E: 0.288000 6 04 83 e0 43 90 1f
E: 0.296000 6 04 83 e0 43 90 1f
E: 0.304000 6 04 83 e0 43 90 1f
E: 0.312000 6 04 83 e0 43 90 1f
E: 0.320000 6 04 83 e0 43 90 1f
E: 0.328000 6 04 83 00 44 00 20
E: 0.336000 6 04 83 10 44 20 20
E: 0.344000 6 04 83 10 44 30 20
E: 0.352000 6 04 83 10 44 40 20
E: 0.360000 6 04 83 10 44 50 20
E: 0.368000 6 04 83 10 44 50 20
E: 0.376000 6 04 83 10 44 50 20
E: 0.384000 6 04 83 10 44 50 20
E: 0.392000 6 04 83 10 44 50 20
E: 0.400000 6 04 83 10 44 50 20
E: 0.408000 6 04 83 10 44 50 20
E: 0.416000 6 04 83 10 44 50 20
E: 0.424000 6 04 83 10 44 50 20
E: 0.432000 6 04 83 10 44 50 20
E: 0.440000 6 04 83 10 44 50 20
E: 0.448000 6 04 83 10 44 50 20
E: 0.456000 6 04 83 10 44 70 20
E: 0.464000 6 04 83 10 44 80 20
E: 0.472000 6 04 83 10 44 80 20
E: 0.480000 6 04 83 20 44 a0 20
E: 0.488000 6 04 80 20 44 a0 20
E: 2.496000 6 04 83 a0 32 d0 1d
E: 2.504000 6 04 83 a0 32 d0 1d
E: 2.512000 6 04 87 20 43 f0 1d
E: 2.520000 6 04 83 a0 32 d0 1d
E: 2.528000 6 04 87 20 43 f0 1d
E: 2.536000 6 04 83 a0 32 d0 1d
E: 2.544000 6 04 87 20 43 f0 1d
E: 2.552000 6 04 83 a0 32 d0 1d
E: 2.560000 6 04 87 20 43 f0 1d
E: 2.568000 6 04 83 a0 32 d0 1d
E: 2.576000 6 04 87 20 43 f0 1d
E: 2.584000 6 04 83 a0 32 d0 1d
E: 2.592000 6 04 87 20 43 f0 1d
E: 2.600000 6 04 83 a0 32 d0 1d
E: 2.608000 6 04 87 20 43 f0 1d
E: 2.616000 6 04 83 a0 32 d0 1d
E: 2.624000 6 04 87 20 43 f0 1d
E: 2.632000 6 04 83 a0 32 e0 1d
E: 2.640000 6 04 87 20 43 30 1e
E: 2.648000 6 04 83 a0 32 00 1e
E: 2.656000 6 04 87 20 43 c0 1e
E: 2.664000 6 04 83 a0 32 30 1e
E: 2.672000 6 04 87 10 43 40 1f
E: 2.680000 6 04 83 a0 32 60 1e
E: 2.688000 6 04 87 10 43 b0 1f
E: 2.696000 6 04 83 a0 32 c0 1e
E: 2.704000 6 04 87 10 43 00 20
E: 2.712000 6 04 83 a0 32 10 1f
E: 2.720000 6 04 87 10 43 60 20
E: 2.728000 6 04 83 a0 32 40 1f
E: 2.736000 6 04 87 00 43 c0 20
E: 2.744000 6 04 83 90 32 80 1f
E: 2.752000 6 04 87 00 43 20 21
E: 2.760000 6 04 83 80 32 c0 1f
E: 2.768000 6 04 87 f0 42 60 21
E: 2.776000 6 04 83 70 32 00 20
E: 2.784000 6 04 87 f0 42 b0 21
E: 2.792000 6 04 83 70 32 60 20
E: 2.800000 6 04 87 e0 42 f0 21
E: 2.808000 6 04 83 60 32 a0 20
E: 2.816000 6 04 87 e0 42 30 22
E: 2.824000 6 04 83 50 32 e0 20
E: 2.832000 6 04 87 d0 42 90 22
E: 2.840000 6 04 83 50 32 10 21
E: 2.848000 6 04 87 d0 42 b0 22
E: 2.856000 6 04 83 50 32 60 21
E: 2.864000 6 04 87 c0 42 e0 22
E: 2.872000 6 04 83 50 32 c0 21
E: 2.880000 6 04 87 c0 42 10 23
E: 2.888000 6 04 83 50 32 f0 21
E: 2.896000 6 04 87 c0 42 40 23
E: 2.904000 6 04 83 50 32 20 22
E: 2.912000 6 04 87 c0 42 60 23
E: 2.920000 6 04 83 50 32 50 22
E: 2.928000 6 04 87 c0 42 70 23
E: 2.936000 6 04 83 50 32 80 22
E: 2.944000 6 04 87 c0 42 80 23
E: 2.952000 6 04 83 50 32 90 22
E: 2.960000 6 04 87 c0 42 a0 23
E: 2.968000 6 04 83 50 32 b0 22
E: 2.976000 6 04 87 c0 42 b0 23
E: 2.984000 6 04 83 50 32 c0 22
E: 2.992000 6 04 87 c0 42 c0 23
E: 3.000000 6 04 83 50 32 d0 22
E: 3.008000 6 04 87 c0 42 e0 23
E: 3.016000 6 04 83 50 32 e0 22
E: 3.024000 6 04 87 c0 42 f0 23
E: 3.032000 6 04 83 50 32 f0 22
E: 3.040000 6 04 87 c0 42 00 24
E: 3.048000 6 04 83 50 32 00 23
E: 3.056000 6 04 87 c0 42 00 24
E: 3.064000 6 04 83 50 32 10 23
E: 3.072000 6 04 87 c0 42 10 24
E: 3.080000 6 04 83 50 32 20 23
E: 3.088000 6 04 87 c0 42 10 24
E: 3.096000 6 04 83 50 32 20 23
E: 3.104000 6 04 87 c0 42 10 24
E: 3.112000 6 04 83 50 32 20 23
E: 3.120000 6 04 87 c0 42 10 24
E: 3.128000 6 04 83 50 32 20 23
E: 3.136000 6 04 87 c0 42 10 24
E: 3.144000 6 04 83 50 32 20 23
E: 3.152000 6 04 87 c0 42 10 24
E: 3.160000 6 04 83 50 32 20 23
E: 3.168000 6 04 87 c0 42 10 24
E: 3.176000 6 04 83 50 32 20 23
E: 3.184000 6 04 87 c0 42 10 24
E: 3.192000 6 04 83 50 32 20 23
E: 3.200000 6 04 87 c0 42 20 24
E: 3.208000 6 04 83 40 32 50 23
E: 3.216000 6 04 87 d0 42 20 24
E: 3.224000 6 04 84 d0 42 20 24
E: 3.232000 6 04 83 40 32 d0 23
E: 3.240000 6 04 80 40 32 d0 23
