R: 322 05 0d 09 04 a1 01 85 04 09 22 a1 00 09 42 15 00 25 01 75 01 95 01 81 02 09 32 15 00 25 01 81 02 09 51 75 05 95 01 16 00 00 26 10 00 81 02 09 47 75 01 95 01 15 00 25 01 81 02 05 01 09 30 75 10 95 01 55 0d 65 33 35 00 46 34 49 26 ff 7f 81 02 09 31 75 10 95 01 55 0d 65 33 35 00 46 37 29 26 ff 7f 81 02 05 0d 09 55 25 08 75 08 95 01 b1 02 c0 c0 05 01 09 01 a1 01 85 01 09 01 a1 00 05 09 19 01 29 02 15 00 25 01 95 02 75 01 81 02 95 01 75 06 81 01 05 01 09 30 09 31 16 00 00 26 ff 0f 36 00 00 46 ff 0f 66 00 00 75 10 95 02 81 02 c0 c0 06 00 ff 09 01 a1 01 09 01 15 00 26 ff 00 85 03 75 08 95 3f 81 02 06 00 ff 09 01 15 00 26 ff 00 75 08 95 3f 91 02 c0 05 0d 09 04 a1 01 85 02 09 20 a1 00 09 42 09 32 15 00 25 01 95 02 75 01 81 02 95 06 75 01 81 03 05 01 09 30 75 10 95 01 a4 55 0d 65 33 36 00 00 46 34 49 16 00 00 26 ff 0f 81 02 09 31 16 00 00 26 ff 0f 36 00 00 46 37 29 81 02 b4 c0 c0 05 0d 09 0e a1 01 85 05 09 22 a1 00 09 52 09 53 15 00 25 0a 75 08 95 02 b1 02 c0 c0
N: eGalax Inc. USB TouchController
I: 3 0eef 7224
# 1. Drag _one_ finger on the screen from one corner to the opposite, and release it.
E: 0.000000 6 04 83 f0 7f 00 00
E: 0.006938 6 04 83 f0 7f 00 00
E: 0.013907 6 04 83 f0 7f 00 00
E: 0.020922 6 04 83 f0 7f 00 00
E: 0.028907 6 04 83 f0 7f 00 00
E: 0.035899 6 04 83 f0 7f 00 00
E: 0.042902 6 04 83 f0 7f 00 00
E: 0.050916 6 04 83 c0 7f 00 00
E: 0.057920 6 04 83 90 7f 40 00
E: 0.064913 6 04 83 80 7f 80 00
E: 0.071916 6 04 83 50 7f 90 00
E: 0.079910 6 04 83 10 7f c0 00
E: 0.086913 6 04 83 c0 7e 10 01
E: 0.094913 6 04 83 60 7e 70 01
E: 0.101915 6 04 83 10 7e e0 01
E: 0.109911 6 04 83 c0 7d 60 02
E: 0.116912 6 04 83 70 7d e0 02
E: 0.124909 6 04 83 40 7d 30 03
E: 0.131912 6 04 83 00 7d 90 03
E: 0.138910 6 04 83 e0 7c c0 03
E: 0.146914 6 04 83 b0 7c 10 04
E: 0.153929 6 04 83 90 7c 40 04
E: 0.161920 6 04 83 50 7c 90 04
E: 0.168914 6 04 83 30 7c c0 04
E: 0.176914 6 04 83 f0 7b 10 05
E: 0.183911 6 04 83 d0 7b 40 05
E: 0.192912 6 04 83 b0 7b 60 05
E: 0.199910 6 04 83 80 7b b0 05
E: 0.207912 6 04 83 60 7b e0 05
E: 0.214911 6 04 83 20 7b 30 06
E: 0.222915 6 04 83 f0 7a 60 06
E: 0.230910 6 04 83 b0 7a b0 06
E: 0.237913 6 04 83 80 7a e0 06
E: 0.245910 6 04 83 40 7a 40 07
E: 0.252913 6 04 83 10 7a 70 07
E: 0.260909 6 04 83 d0 79 d0 07
E: 0.268912 6 04 83 b0 79 00 08
E: 0.275909 6 04 83 80 79 20 08
E: 0.283914 6 04 83 50 79 70 08
E: 0.291908 6 04 83 30 79 a0 08
E: 0.298914 6 04 83 10 79 c0 08
E: 0.306907 6 04 83 d0 78 10 09
E: 0.314912 6 04 83 80 78 70 09
E: 0.321909 6 04 83 50 78 b0 09
E: 0.329913 6 04 83 10 78 10 0a
E: 0.337909 6 04 83 e0 77 40 0a
E: 0.344911 6 04 83 c0 77 60 0a
E: 0.352907 6 04 83 90 77 b0 0a
E: 0.359915 6 04 83 70 77 e0 0a
E: 0.367907 6 04 83 30 77 40 0b
E: 0.375913 6 04 83 00 77 70 0b
E: 0.382911 6 04 83 c0 76 d0 0b
E: 0.390912 6 04 83 90 76 00 0c
E: 0.398910 6 04 83 50 76 60 0c
E: 0.405914 6 04 83 20 76 90 0c
E: 0.413911 6 04 83 d0 75 f0 0c
E: 0.420914 6 04 83 a0 75 20 0d
E: 0.428908 6 04 83 60 75 80 0d
E: 0.436917 6 04 83 30 75 b0 0d
E: 0.443914 6 04 83 e0 74 10 0e
E: 0.452919 6 04 83 80 74 80 0e
E: 0.460911 6 04 83 50 74 c0 0e
E: 0.467915 6 04 83 00 74 20 0f
E: 0.475911 6 04 83 d0 73 50 0f
E: 0.483914 6 04 83 80 73 b0 0f
E: 0.490910 6 04 83 20 73 10 10
E: 0.498914 6 04 83 e0 72 50 10
E: 0.505910 6 04 83 90 72 b0 10
E: 0.513913 6 04 83 60 72 e0 10
E: 0.521910 6 04 83 10 72 40 11
E: 0.528911 6 04 83 e0 71 70 11
E: 0.536908 6 04 83 80 71 d0 11
E: 0.544914 6 04 83 20 71 40 12
E: 0.551909 6 04 83 e0 70 90 12
E: 0.559912 6 04 83 80 70 f0 12
E: 0.567908 6 04 83 40 70 30 13
E: 0.574914 6 04 83 e0 6f 90 13
E: 0.582911 6 04 83 80 6f 10 14
E: 0.589913 6 04 83 40 6f 60 14
E: 0.597909 6 04 83 e0 6e c0 14
E: 0.605911 6 04 83 70 6e 40 15
E: 0.612910 6 04 83 30 6e 90 15
E: 0.620912 6 04 83 e0 6d f0 15
E: 0.628909 6 04 83 b0 6d 30 16
E: 0.635912 6 04 83 60 6d 90 16
E: 0.643909 6 04 83 30 6d d0 16
E: 0.651911 6 04 83 d0 6c 40 17
E: 0.658915 6 04 83 70 6c c0 17
E: 0.666915 6 04 83 00 6c 40 18
E: 0.673910 6 04 83 b0 6b 90 18
E: 0.681912 6 04 83 60 6b 00 19
E: 0.689910 6 04 83 00 6b 80 19
E: 0.696913 6 04 83 c0 6a d0 19
E: 0.704910 6 04 83 60 6a 30 1a
E: 0.713912 6 04 83 30 6a 70 1a
E: 0.720911 6 04 83 d0 69 d0 1a
E: 0.728912 6 04 83 70 69 50 1b
E: 0.736909 6 04 83 00 69 d0 1b
E: 0.743913 6 04 83 b0 68 20 1c
E: 0.751926 6 04 83 50 68 80 1c
E: 0.758921 6 04 83 20 68 c0 1c
E: 0.766912 6 04 83 d0 67 20 1d
E: 0.774914 6 04 83 70 67 a0 1d
E: 0.781911 6 04 83 30 67 f0 1d
E: 0.789912 6 04 83 d0 66 50 1e
E: 0.797909 6 04 83 60 66 c0 1e
E: 0.804911 6 04 83 f0 65 40 1f
E: 0.812910 6 04 83 b0 65 90 1f
E: 0.820912 6 04 83 50 65 00 20
E: 0.827910 6 04 83 e0 64 80 20
E: 0.835911 6 04 83 70 64 00 21
E: 0.842907 6 04 83 20 64 50 21
E: 0.850912 6 04 83 c0 63 b0 21
E: 0.858908 6 04 83 50 63 20 22
E: 0.865912 6 04 83 e0 62 a0 22
E: 0.873910 6 04 83 90 62 f0 22
E: 0.881912 6 04 83 30 62 60 23
E: 0.888910 6 04 83 c0 61 e0 23
E: 0.896910 6 04 83 40 61 60 24
E: 0.904907 6 04 83 f0 60 b0 24
E: 0.911911 6 04 83 80 60 10 25
E: 0.919908 6 04 83 00 60 70 25
E: 0.926911 6 04 83 70 5f e0 25
E: 0.934910 6 04 83 e0 5e 60 26
E: 0.942909 6 04 83 90 5e b0 26
E: 0.949909 6 04 83 20 5e 10 27
E: 0.957910 6 04 83 a0 5d 90 27
E: 0.966910 6 04 83 20 5d 10 28
E: 0.973912 6 04 83 d0 5c 60 28
E: 0.981911 6 04 83 60 5c c0 28
E: 0.988911 6 04 83 e0 5b 40 29
E: 0.996908 6 04 83 50 5b c0 29
E: 1.004910 6 04 83 c0 5a 50 2a
E: 1.011911 6 04 83 60 5a a0 2a
E: 1.019919 6 04 83 e0 59 10 2b
E: 1.027910 6 04 83 60 59 90 2b
E: 1.034914 6 04 83 e0 58 10 2c
E: 1.042909 6 04 83 90 58 60 2c
E: 1.050913 6 04 83 20 58 c0 2c
E: 1.057914 6 04 83 a0 57 40 2d
E: 1.065917 6 04 83 10 57 c0 2d
E: 1.072911 6 04 83 90 56 50 2e
E: 1.080915 6 04 83 40 56 a0 2e
E: 1.088906 6 04 83 d0 55 10 2f
E: 1.095913 6 04 83 50 55 90 2f
E: 1.103908 6 04 83 d0 54 10 30
E: 1.111912 6 04 83 40 54 90 30
E: 1.118910 6 04 83 b0 53 10 31
E: 1.126912 6 04 83 20 53 90 31
E: 1.133909 6 04 83 a0 52 10 32
E: 1.141912 6 04 83 50 52 60 32
E: 1.149909 6 04 83 e0 51 c0 32
E: 1.156912 6 04 83 50 51 30 33
E: 1.164908 6 04 83 c0 50 b0 33
E: 1.172912 6 04 83 30 50 30 34
E: 1.179908 6 04 83 a0 4f b0 34
E: 1.187912 6 04 83 10 4f 30 35
E: 1.195908 6 04 83 b0 4e 80 35
E: 1.202914 6 04 83 30 4e e0 35
E: 1.210910 6 04 83 a0 4d 60 36
E: 1.218913 6 04 83 00 4d e0 36
E: 1.226911 6 04 83 60 4c 60 37
E: 1.234912 6 04 83 c0 4b e0 37
E: 1.241910 6 04 83 20 4b 60 38
E: 1.249913 6 04 83 80 4a e0 38
E: 1.257909 6 04 83 e0 49 60 39
E: 1.264912 6 04 83 40 49 e0 39
E: 1.272909 6 04 83 b0 48 60 3a
E: 1.280914 6 04 83 20 48 e0 3a
E: 1.287909 6 04 83 80 47 60 3b
E: 1.295913 6 04 83 f0 46 f0 3b
E: 1.302910 6 04 83 60 46 70 3c
E: 1.310912 6 04 83 d0 45 f0 3c
E: 1.318911 6 04 83 40 45 70 3d
E: 1.325911 6 04 83 b0 44 f0 3d
E: 1.333910 6 04 83 20 44 80 3e
E: 1.341913 6 04 83 90 43 10 3f
E: 1.348909 6 04 83 00 43 a0 3f
E: 1.356932 6 04 83 70 42 20 40
E: 1.364909 6 04 83 d0 41 b0 40
E: 1.371919 6 04 83 30 41 30 41
E: 1.379911 6 04 83 a0 40 b0 41
E: 1.386917 6 04 83 10 40 40 42
E: 1.394910 6 04 83 70 3f d0 42
E: 1.402914 6 04 83 d0 3e 60 43
E: 1.409908 6 04 83 30 3e f0 43
E: 1.417914 6 04 83 90 3d 80 44
E: 1.425909 6 04 83 f0 3c 10 45
E: 1.432914 6 04 83 50 3c a0 45
E: 1.440910 6 04 83 b0 3b 30 46
E: 1.448918 6 04 83 10 3b c0 46
E: 1.455911 6 04 83 70 3a 50 47
E: 1.463915 6 04 83 d0 39 e0 47
E: 1.470987 6 04 83 30 39 60 48
E: 1.478914 6 04 83 90 38 e0 48
E: 1.487910 6 04 83 e0 37 70 49
E: 1.494912 6 04 83 30 37 00 4a
E: 1.502910 6 04 83 90 36 80 4a
E: 1.510910 6 04 83 f0 35 00 4b
E: 1.517910 6 04 83 40 35 90 4b
E: 1.525912 6 04 83 a0 34 10 4c
E: 1.532909 6 04 83 00 34 a0 4c
E: 1.540909 6 04 83 50 33 30 4d
E: 1.548906 6 04 83 b0 32 c0 4d
E: 1.555912 6 04 83 00 32 40 4e
E: 1.563906 6 04 83 50 31 c0 4e
E: 1.571911 6 04 83 b0 30 40 4f
E: 1.578911 6 04 83 10 30 c0 4f
E: 1.586909 6 04 83 70 2f 50 50
E: 1.594911 6 04 83 d0 2e e0 50
E: 1.601911 6 04 83 30 2e 70 51
E: 1.609908 6 04 83 80 2d 00 52
E: 1.617911 6 04 83 e0 2c 90 52
E: 1.624910 6 04 83 40 2c 20 53
E: 1.632910 6 04 83 90 2b b0 53
E: 1.639912 6 04 83 e0 2a 40 54
E: 1.647945 6 04 83 40 2a d0 54
E: 1.655912 6 04 83 90 29 60 55
E: 1.662920 6 04 83 f0 28 f0 55
E: 1.670915 6 04 83 50 28 70 56
E: 1.678918 6 04 83 b0 27 f0 56
E: 1.685911 6 04 83 10 27 70 57
E: 1.693913 6 04 83 70 26 00 58
E: 1.700912 6 04 83 d0 25 90 58
E: 1.708914 6 04 83 30 25 20 59
E: 1.716908 6 04 83 90 24 a0 59
E: 1.723913 6 04 83 f0 23 20 5a
E: 1.731908 6 04 83 50 23 a0 5a
E: 1.740913 6 04 83 a0 22 30 5b
E: 1.747910 6 04 83 f0 21 c0 5b
E: 1.755914 6 04 83 40 21 50 5c
E: 1.762910 6 04 83 a0 20 e0 5c
E: 1.770913 6 04 83 00 20 70 5d
E: 1.778908 6 04 83 60 1f 00 5e
E: 1.785913 6 04 83 c0 1e a0 5e
E: 1.793911 6 04 83 10 1e 40 5f
E: 1.801912 6 04 83 60 1d e0 5f
E: 1.808909 6 04 83 c0 1c 70 60
E: 1.816917 6 04 83 20 1c 00 61
E: 1.823910 6 04 83 80 1b 90 61
E: 1.831851 6 04 83 e0 1a 30 62
E: 1.839912 6 04 83 50 1a d0 62
E: 1.846914 6 04 83 c0 19 70 63
E: 1.854910 6 04 83 20 19 00 64
E: 1.862916 6 04 83 90 18 90 64
E: 1.869911 6 04 83 00 18 20 65
E: 1.877915 6 04 83 70 17 b0 65
E: 1.885910 6 04 83 e0 16 50 66
E: 1.892915 6 04 83 50 16 f0 66
E: 1.900909 6 04 83 c0 15 80 67
E: 1.907892 6 04 83 40 15 10 68
E: 1.915910 6 04 83 c0 14 a0 68
E: 1.923914 6 04 83 40 14 30 69
E: 1.930910 6 04 83 c0 13 c0 69
E: 1.938911 6 04 83 40 13 50 6a
E: 1.946908 6 04 83 c0 12 e0 6a
E: 1.953929 6 04 83 70 12 40 6b
E: 1.961917 6 04 83 10 12 c0 6b
E: 1.969918 6 04 83 90 11 50 6c
E: 1.976913 6 04 83 10 11 e0 6c
E: 1.984915 6 04 83 90 10 80 6d
E: 1.991910 6 04 83 10 10 20 6e
E: 2.000913 6 04 83 c0 0f 80 6e
E: 2.008907 6 04 83 60 0f 00 6f
E: 2.015914 6 04 83 e0 0e 90 6f
E: 2.023913 6 04 83 60 0e 20 70
E: 2.031914 6 04 83 e0 0d b0 70
E: 2.038910 6 04 83 60 0d 40 71
E: 2.046912 6 04 83 e0 0c d0 71
E: 2.053909 6 04 83 90 0c 30 72
E: 2.061911 6 04 83 20 0c a0 72
E: 2.069909 6 04 83 a0 0b 20 73
E: 2.076911 6 04 83 10 0b b0 73
E: 2.084907 6 04 83 80 0a 50 74
E: 2.092910 6 04 83 00 0a e0 74
E: 2.099907 6 04 83 80 09 70 75
E: 2.107909 6 04 83 00 09 00 76
E: 2.115908 6 04 83 b0 08 60 76
E: 2.122910 6 04 83 40 08 d0 76
E: 2.130908 6 04 83 c0 07 50 77
E: 2.138909 6 04 83 40 07 d0 77
E: 2.145909 6 04 83 c0 06 60 78
E: 2.153908 6 04 83 40 06 f0 78
E: 2.161909 6 04 83 f0 05 40 79
E: 2.168910 6 04 83 80 05 c0 79
E: 2.176908 6 04 83 00 05 40 7a
E: 2.184909 6 04 83 80 04 e0 7a
E: 2.191909 6 04 83 f0 03 a0 7b
E: 2.198909 6 04 83 60 03 70 7c
E: 2.206908 6 04 83 b0 02 40 7d
E: 2.213911 6 04 83 10 02 00 7e
E: 2.221910 6 04 83 b0 01 70 7e
E: 2.228911 6 04 83 70 01 c0 7e
E: 2.236907 6 04 83 40 01 f0 7e
E: 2.243912 6 04 83 20 01 10 7f
E: 2.285921 6 04 83 50 00 c0 7f
E: 2.287903 6 04 82 50 00 c0 7f
# 2. Land one finger,
   - land a second finger far enough from the first
   - move your two fingers
   - release the *first* finger
   - release the second finger
E: 15.373979 6 04 83 c0 19 40 49
E: 15.380954 6 04 83 c0 19 40 49
E: 15.388930 6 04 83 c0 19 40 49
E: 15.396907 6 04 83 c0 19 40 49
E: 15.403916 6 04 83 c0 19 40 49
E: 15.411907 6 04 83 c0 19 40 49
E: 15.420905 6 04 83 c0 19 40 49
E: 15.427905 6 04 83 c0 19 40 49
E: 15.435909 6 04 83 c0 19 40 49
E: 15.442903 6 04 83 c0 19 40 49
E: 15.450924 6 04 83 b0 19 70 49
E: 15.458927 6 04 83 b0 19 90 49
E: 15.465907 6 04 83 b0 19 90 49
E: 15.473919 6 04 83 b0 19 c0 49
E: 15.481910 6 04 83 b0 19 c0 49
E: 15.488906 6 04 83 b0 19 c0 49
E: 15.496907 6 04 83 b0 19 c0 49
E: 15.504914 6 04 83 b0 19 e0 49
E: 15.511908 6 04 83 b0 19 e0 49
E: 15.519902 6 04 83 b0 19 e0 49
E: 15.526906 6 04 83 b0 19 e0 49
E: 15.534898 6 04 83 b0 19 e0 49
E: 15.542904 6 04 83 b0 19 e0 49
E: 15.549901 6 04 83 b0 19 e0 49
E: 15.557904 6 04 83 b0 19 e0 49
E: 15.565901 6 04 83 b0 19 e0 49
E: 15.572903 6 04 83 b0 19 e0 49
E: 15.580899 6 04 83 b0 19 e0 49
E: 15.588906 6 04 83 b0 19 e0 49
E: 15.595902 6 04 83 b0 19 e0 49
E: 15.603904 6 04 83 b0 19 e0 49
E: 15.610902 6 04 83 b0 19 e0 49
E: 15.618905 6 04 83 b0 19 e0 49
E: 15.626902 6 04 83 b0 19 e0 49
E: 15.633944 6 04 83 b0 19 e0 49
E: 15.641901 6 04 83 b0 19 e0 49
E: 15.649904 6 04 83 b0 19 e0 49
E: 15.656904 6 04 83 b0 19 e0 49
E: 15.664906 6 04 83 b0 19 e0 49
E: 15.672902 6 04 83 b0 19 e0 49
E: 15.680905 6 04 83 b0 19 e0 49
E: 15.688902 6 04 83 b0 19 e0 49
E: 15.695905 6 04 83 b0 19 e0 49
E: 15.703901 6 04 83 b0 19 e0 49
E: 15.711906 6 04 83 b0 19 e0 49
E: 15.718905 6 04 83 b0 19 e0 49
E: 15.726905 6 04 83 b0 19 e0 49
E: 15.734903 6 04 83 b0 19 e0 49
E: 15.741902 6 04 83 b0 19 e0 49
E: 15.749903 6 04 83 b0 19 e0 49
E: 15.756903 6 04 83 b0 19 e0 49
E: 15.764897 6 04 83 b0 19 e0 49
E: 15.772902 6 04 83 b0 19 e0 49
E: 15.779897 6 04 83 b0 19 e0 49
E: 15.787905 6 04 83 b0 19 e0 49
E: 15.795900 6 04 83 b0 19 e0 49
E: 15.802905 6 04 83 b0 19 e0 49
E: 15.810904 6 04 83 b0 19 e0 49
E: 15.817904 6 04 83 b0 19 e0 49
E: 15.825902 6 04 83 b0 19 e0 49
E: 15.833912 6 04 83 b0 19 e0 49
E: 15.840902 6 04 83 b0 19 e0 49
E: 15.848905 6 04 83 b0 19 e0 49
E: 15.856901 6 04 83 b0 19 e0 49
E: 15.863906 6 04 83 b0 19 e0 49
E: 15.871901 6 04 83 b0 19 e0 49
E: 15.879904 6 04 83 b0 19 e0 49
E: 15.886901 6 04 83 b0 19 e0 49
E: 15.894905 6 04 83 b0 19 e0 49
E: 15.902900 6 04 83 b0 19 e0 49
E: 15.909903 6 04 83 b0 19 e0 49
E: 15.917901 6 04 83 b0 19 e0 49
E: 15.924904 6 04 83 b0 19 e0 49
E: 15.933899 6 04 83 b0 19 e0 49
E: 15.941905 6 04 83 b0 19 e0 49
E: 15.948924 6 04 83 b0 19 e0 49
E: 15.956917 6 04 83 b0 19 e0 49
E: 15.964902 6 04 83 b0 19 e0 49
E: 15.971908 6 04 83 b0 19 e0 49
E: 15.979902 6 04 83 b0 19 e0 49
E: 15.986907 6 04 83 b0 19 e0 49
E: 15.994902 6 04 83 b0 19 e0 49
E: 16.002904 6 04 83 b0 19 e0 49
E: 16.009901 6 04 83 b0 19 e0 49
E: 16.017905 6 04 83 b0 19 e0 49
E: 16.025902 6 04 83 b0 19 e0 49
E: 16.032905 6 04 83 b0 19 e0 49
E: 16.040903 6 04 83 b0 19 e0 49
E: 16.048906 6 04 83 b0 19 e0 49
E: 16.055904 6 04 83 b0 19 e0 49
E: 16.063904 6 04 83 b0 19 e0 49
E: 16.070904 6 04 83 b0 19 e0 49
E: 16.078902 6 04 83 b0 19 e0 49
E: 16.086903 6 04 83 b0 19 e0 49
E: 16.093903 6 04 83 b0 19 e0 49
E: 16.101903 6 04 83 b0 19 e0 49
E: 16.109905 6 04 83 b0 19 e0 49
E: 16.116904 6 04 83 b0 19 e0 49
E: 16.124903 6 04 83 b0 19 e0 49
E: 16.131898 6 04 83 b0 19 e0 49
E: 16.139905 6 04 83 b0 19 e0 49
E: 16.147903 6 04 83 b0 19 e0 49
E: 16.154906 6 04 83 b0 19 e0 49
E: 16.162905 6 04 83 b0 19 e0 49
E: 16.170904 6 04 83 b0 19 e0 49
E: 16.177902 6 04 83 b0 19 e0 49
E: 16.185905 6 04 83 b0 19 e0 49
E: 16.193903 6 04 83 b0 19 e0 49
E: 16.201904 6 04 83 b0 19 e0 49
E: 16.209903 6 04 83 b0 19 e0 49
E: 16.216902 6 04 83 b0 19 e0 49
E: 16.224903 6 04 83 b0 19 e0 49
E: 16.232905 6 04 83 b0 19 e0 49
E: 16.239902 6 04 83 b0 19 e0 49
E: 16.247903 6 04 83 b0 19 e0 49
E: 16.255902 6 04 83 b0 19 e0 49
E: 16.262903 6 04 83 b0 19 e0 49
E: 16.270906 6 04 83 b0 19 e0 49
E: 16.277905 6 04 83 b0 19 e0 49
E: 16.285902 6 04 83 b0 19 e0 49
E: 16.293903 6 04 83 b0 19 e0 49
E: 16.300900 6 04 83 b0 19 e0 49
E: 16.308904 6 04 83 b0 19 e0 49
E: 16.316902 6 04 83 b0 19 e0 49
E: 16.323908 6 04 83 b0 19 e0 49
E: 16.331901 6 04 83 b0 19 e0 49
E: 16.339904 6 04 83 b0 19 e0 49
E: 16.346903 6 04 83 b0 19 e0 49
E: 16.354905 6 04 83 b0 19 e0 49
E: 16.361903 6 04 83 b0 19 e0 49
E: 16.369901 6 04 83 b0 19 e0 49
E: 16.377901 6 04 83 b0 19 e0 49
E: 16.384901 6 04 83 b0 19 e0 49
E: 16.392900 6 04 83 b0 19 e0 49
E: 16.400905 6 04 83 b0 19 e0 49
E: 16.407898 6 04 83 b0 19 e0 49
E: 16.415906 6 04 83 b0 19 e0 49
E: 16.423903 6 04 83 b0 19 e0 49
E: 16.430904 6 04 83 b0 19 e0 49
E: 16.438904 6 04 83 b0 19 e0 49
E: 16.446904 6 04 83 b0 19 e0 49
E: 16.454904 6 04 83 b0 19 e0 49
E: 16.462898 6 04 83 b0 19 e0 49
E: 16.469902 6 04 83 b0 19 e0 49
E: 16.477901 6 04 83 b0 19 e0 49
E: 16.485904 6 04 83 b0 19 e0 49
E: 16.492901 6 04 83 b0 19 e0 49
E: 16.500897 6 04 83 b0 19 e0 49
E: 16.507903 6 04 83 b0 19 e0 49
E: 16.515901 6 04 83 b0 19 e0 49
E: 16.523903 6 04 83 b0 19 e0 49
E: 16.530902 6 04 83 b0 19 e0 49
E: 16.538903 6 04 83 b0 19 e0 49
E: 16.546903 6 04 83 b0 19 e0 49
E: 16.553903 6 04 83 b0 19 e0 49
E: 16.561902 6 04 83 b0 19 e0 49
E: 16.569903 6 04 83 b0 19 e0 49
E: 16.576902 6 04 83 b0 19 e0 49
E: 16.584903 6 04 83 b0 19 e0 49
E: 16.591903 6 04 83 b0 19 e0 49
E: 16.599905 6 04 83 b0 19 e0 49
E: 16.607902 6 04 83 b0 19 e0 49
E: 16.614903 6 04 83 b0 19 e0 49
E: 16.622902 6 04 83 b0 19 e0 49
E: 16.630906 6 04 83 b0 19 e0 49
E: 16.637902 6 04 83 b0 19 e0 49
E: 16.645908 6 04 83 b0 19 e0 49
E: 16.653902 6 04 83 b0 19 e0 49
E: 16.660905 6 04 83 b0 19 e0 49
E: 16.668904 6 04 83 b0 19 e0 49
E: 16.675907 6 04 83 b0 19 e0 49
E: 16.683902 6 04 83 b0 19 e0 49
E: 16.691907 6 04 83 b0 19 e0 49
E: 16.698904 6 04 83 b0 19 e0 49
E: 16.707906 6 04 83 b0 19 e0 49
E: 16.715900 6 04 83 b0 19 e0 49
E: 16.722905 6 04 83 b0 19 e0 49
E: 16.730900 6 04 83 b0 19 e0 49
E: 16.738903 6 04 83 b0 19 e0 49
E: 16.745904 6 04 83 b0 19 e0 49
E: 16.753903 6 04 83 b0 19 e0 49
E: 16.761903 6 04 83 b0 19 e0 49
E: 16.768904 6 04 83 b0 19 e0 49
E: 16.776901 6 04 83 b0 19 e0 49
E: 16.783905 6 04 83 b0 19 e0 49
E: 16.791901 6 04 83 b0 19 e0 49
E: 16.799905 6 04 83 b0 19 e0 49
E: 16.806903 6 04 83 b0 19 e0 49
E: 16.814902 6 04 83 b0 19 e0 49
E: 16.822903 6 04 83 b0 19 e0 49
E: 16.829903 6 04 83 b0 19 e0 49
E: 16.837903 6 04 83 b0 19 e0 49
E: 16.845900 6 04 83 b0 19 e0 49
E: 16.852903 6 04 83 b0 19 e0 49
E: 16.860901 6 04 83 b0 19 e0 49
E: 16.868898 6 04 83 b0 19 e0 49
E: 16.875904 6 04 83 b0 19 e0 49
E: 16.883901 6 04 83 b0 19 e0 49
E: 16.890905 6 04 83 b0 19 e0 49
E: 16.898905 6 04 83 b0 19 e0 49
E: 16.906904 6 04 83 b0 19 e0 49
E: 16.913902 6 04 83 b0 19 e0 49
E: 16.921905 6 04 83 b0 19 e0 49
E: 16.929902 6 04 83 b0 19 e0 49
E: 16.936904 6 04 83 b0 19 e0 49
E: 16.944902 6 04 83 b0 19 e0 49
E: 16.951905 6 04 83 b0 19 e0 49
E: 16.959834 6 04 83 b0 19 e0 49
E: 16.968905 6 04 83 b0 19 e0 49
E: 16.975902 6 04 83 b0 19 e0 49
E: 16.983905 6 04 83 b0 19 e0 49
E: 16.991902 6 04 83 b0 19 e0 49
E: 16.998902 6 04 83 b0 19 e0 49
E: 17.006900 6 04 83 b0 19 e0 49
E: 17.014903 6 04 83 b0 19 e0 49
E: 17.021900 6 04 83 b0 19 e0 49
E: 17.029904 6 04 83 b0 19 e0 49
E: 17.037901 6 04 83 b0 19 e0 49
E: 17.044905 6 04 83 b0 19 e0 49
E: 17.052899 6 04 83 b0 19 e0 49
E: 17.059906 6 04 83 b0 19 e0 49
E: 17.067901 6 04 83 b0 19 e0 49
E: 17.075905 6 04 83 b0 19 e0 49
E: 17.082902 6 04 83 b0 19 e0 49
E: 17.090905 6 04 83 b0 19 e0 49
E: 17.098902 6 04 83 b0 19 e0 49
E: 17.105903 6 04 83 b0 19 e0 49
E: 17.113902 6 04 83 b0 19 e0 49
E: 17.121904 6 04 83 b0 19 e0 49
E: 17.128903 6 04 83 b0 19 e0 49
E: 17.136903 6 04 83 b0 19 e0 49
E: 17.143902 6 04 83 b0 19 e0 49
E: 17.151905 6 04 83 b0 19 e0 49
E: 17.159901 6 04 83 b0 19 e0 49
E: 17.166901 6 04 83 b0 19 e0 49
E: 17.174902 6 04 83 b0 19 e0 49
E: 17.182903 6 04 83 b0 19 e0 49
E: 17.189902 6 04 83 b0 19 e0 49
E: 17.197902 6 04 83 b0 19 e0 49
E: 17.204903 6 04 83 b0 19 e0 49
E: 17.212903 6 04 83 b0 19 e0 49
E: 17.221900 6 04 83 b0 19 e0 49
E: 17.228903 6 04 83 b0 19 e0 49
E: 17.236899 6 04 83 b0 19 e0 49
E: 17.244903 6 04 83 b0 19 e0 49
E: 17.251901 6 04 83 b0 19 e0 49
E: 17.259903 6 04 83 b0 19 e0 49
E: 17.267902 6 04 83 b0 19 e0 49
E: 17.274902 6 04 83 b0 19 e0 49
E: 17.282901 6 04 83 b0 19 e0 49
E: 17.289904 6 04 83 b0 19 e0 49
E: 17.297903 6 04 83 b0 19 e0 49
E: 17.305903 6 04 83 b0 19 e0 49
E: 17.312903 6 04 83 b0 19 e0 49
E: 17.320904 6 04 83 b0 19 e0 49
E: 17.328901 6 04 83 b0 19 e0 49
E: 17.335905 6 04 83 b0 19 e0 49
E: 17.343901 6 04 83 b0 19 e0 49
E: 17.351904 6 04 83 b0 19 e0 49
E: 17.358900 6 04 83 b0 19 e0 49
E: 17.366904 6 04 83 b0 19 e0 49
E: 17.373900 6 04 83 b0 19 e0 49
E: 17.381902 6 04 83 b0 19 e0 49
E: 17.389896 6 04 83 b0 19 e0 49
E: 17.396903 6 04 83 b0 19 e0 49
E: 17.404893 6 04 83 b0 19 e0 49
E: 17.412905 6 04 83 b0 19 e0 49
E: 17.419901 6 04 83 b0 19 e0 49
E: 17.427906 6 04 83 b0 19 e0 49
E: 17.435903 6 04 83 b0 19 e0 49
E: 17.442905 6 04 83 b0 19 e0 49
E: 17.450902 6 04 83 b0 19 e0 49
E: 17.457900 6 04 83 b0 19 e0 49
E: 17.465903 6 04 83 b0 19 e0 49
E: 17.473909 6 04 83 b0 19 e0 49
E: 17.481904 6 04 83 b0 19 e0 49
E: 17.489906 6 04 83 b0 19 e0 49
E: 17.497902 6 04 83 b0 19 e0 49
E: 17.504904 6 04 83 b0 19 e0 49
E: 17.512900 6 04 83 b0 19 e0 49
E: 17.519901 6 04 83 b0 19 e0 49
E: 17.527902 6 04 83 b0 19 e0 49
E: 17.535904 6 04 83 b0 19 e0 49
E: 17.542903 6 04 83 b0 19 e0 49
E: 17.550903 6 04 83 b0 19 e0 49
E: 17.558903 6 04 83 b0 19 e0 49
E: 17.565902 6 04 83 b0 19 e0 49
E: 17.573903 6 04 83 b0 19 e0 49
E: 17.581897 6 04 83 b0 19 e0 49
E: 17.588904 6 04 83 b0 19 e0 49
E: 17.596854 6 04 83 b0 19 e0 49
E: 17.603903 6 04 83 b0 19 e0 49
E: 17.611904 6 04 83 b0 19 e0 49
E: 17.619903 6 04 83 b0 19 e0 49
E: 17.626904 6 04 83 b0 19 e0 49
E: 17.634905 6 04 83 b0 19 e0 49
E: 17.642903 6 04 83 b0 19 e0 49
E: 17.650000 6 04 83 b0 19 e0 49
E: 17.657905 6 04 83 b0 19 e0 49
E: 17.665902 6 04 83 b0 19 e0 49
E: 17.672904 6 04 83 b0 19 e0 49
E: 17.680903 6 04 83 b0 19 e0 49
E: 17.688903 6 04 83 b0 19 e0 49
E: 17.695901 6 04 83 b0 19 e0 49
E: 17.703852 6 04 83 b0 19 e0 49
E: 17.710900 6 04 83 b0 19 e0 49
E: 17.718901 6 04 83 b0 19 e0 49
E: 17.726901 6 04 83 b0 19 e0 49
E: 17.733904 6 04 83 b0 19 e0 49
E: 17.742900 6 04 83 b0 19 e0 49
E: 17.750902 6 04 83 b0 19 e0 49
E: 17.757902 6 04 83 b0 19 e0 49
E: 17.765904 6 04 83 b0 19 e0 49
E: 17.772854 6 04 83 b0 19 e0 49
E: 17.780904 6 04 83 b0 19 e0 49
E: 17.788851 6 04 83 b0 19 e0 49
E: 17.795904 6 04 83 b0 19 e0 49
E: 17.803902 6 04 83 b0 19 e0 49
E: 17.811903 6 04 83 b0 19 e0 49
E: 17.818902 6 04 83 b0 19 e0 49
E: 17.826903 6 04 83 b0 19 e0 49
E: 17.834902 6 04 83 b0 19 e0 49
E: 17.841907 6 04 83 b0 19 e0 49
E: 17.849902 6 04 83 b0 19 e0 49
E: 17.856904 6 04 83 b0 19 e0 49
E: 17.864901 6 04 83 b0 19 e0 49
E: 17.872911 6 04 83 b0 19 e0 49
E: 17.879904 6 04 83 b0 19 e0 49
E: 17.887906 6 04 83 b0 19 e0 49
E: 17.895901 6 04 83 b0 19 e0 49
E: 17.902903 6 04 83 b0 19 e0 49
E: 17.910902 6 04 83 b0 19 e0 49
E: 17.918903 6 04 83 b0 19 e0 49
E: 17.925902 6 04 83 b0 19 e0 49
E: 17.933902 6 04 83 b0 19 e0 49
E: 17.941903 6 04 83 b0 19 e0 49
E: 17.948902 6 04 83 b0 19 e0 49
E: 17.956901 6 04 83 b0 19 e0 49
E: 17.963906 6 04 83 b0 19 e0 49
E: 17.971903 6 04 83 b0 19 e0 49
E: 17.979905 6 04 83 b0 19 e0 49
E: 17.986902 6 04 83 b0 19 e0 49
E: 17.995904 6 04 83 b0 19 e0 49
E: 18.003902 6 04 83 b0 19 e0 49
E: 18.010904 6 04 83 b0 19 e0 49
E: 18.018903 6 04 83 b0 19 e0 49
E: 18.026904 6 04 83 b0 19 e0 49
E: 18.033904 6 04 83 b0 19 e0 49
E: 18.041905 6 04 83 b0 19 e0 49
E: 18.048903 6 04 83 b0 19 e0 49
E: 18.056906 6 04 83 b0 19 e0 49
E: 18.064902 6 04 83 b0 19 e0 49
E: 18.071906 6 04 83 b0 19 e0 49
E: 18.079902 6 04 83 b0 19 e0 49
E: 18.087903 6 04 83 b0 19 e0 49
E: 18.094900 6 04 83 b0 19 e0 49
E: 18.102905 6 04 83 b0 19 e0 49
E: 18.110900 6 04 83 b0 19 e0 49
E: 18.117905 6 04 83 b0 19 e0 49
E: 18.125901 6 04 83 b0 19 e0 49
E: 18.132905 6 04 83 b0 19 e0 49
E: 18.140899 6 04 83 b0 19 e0 49
E: 18.148905 6 04 83 b0 19 e0 49
E: 18.155903 6 04 83 b0 19 e0 49
E: 18.163905 6 04 83 b0 19 e0 49
E: 18.171902 6 04 83 b0 19 e0 49
E: 18.178905 6 04 83 b0 19 e0 49
E: 18.186904 6 04 83 b0 19 e0 49
E: 18.193903 6 04 83 b0 19 e0 49
E: 18.201902 6 04 83 b0 19 e0 49
E: 18.209904 6 04 83 b0 19 e0 49
E: 18.216903 6 04 83 b0 19 e0 49
E: 18.224904 6 04 83 b0 19 e0 49
E: 18.232903 6 04 83 b0 19 e0 49
E: 18.239905 6 04 83 b0 19 e0 49
E: 18.247901 6 04 83 b0 19 e0 49
E: 18.256905 6 04 83 b0 19 e0 49
E: 18.263901 6 04 83 b0 19 e0 49
E: 18.271904 6 04 83 b0 19 e0 49
E: 18.279901 6 04 83 b0 19 e0 49
E: 18.286901 6 04 83 b0 19 e0 49
E: 18.294901 6 04 83 b0 19 e0 49
E: 18.301902 6 04 83 b0 19 e0 49
E: 18.309903 6 04 83 b0 19 e0 49
E: 18.317901 6 04 83 b0 19 e0 49
E: 18.324901 6 04 83 b0 19 e0 49
E: 18.332853 6 04 83 b0 19 e0 49
E: 18.340902 6 04 83 b0 19 e0 49
E: 18.347902 6 04 83 b0 19 e0 49
E: 18.355903 6 04 83 b0 19 e0 49
E: 18.363902 6 04 83 b0 19 e0 49
E: 18.370905 6 04 83 b0 19 e0 49
E: 18.378903 6 04 83 b0 19 e0 49
E: 18.385903 6 04 83 b0 19 e0 49
E: 18.393901 6 04 83 b0 19 e0 49
E: 18.401904 6 04 83 b0 19 e0 49
E: 18.408903 6 04 83 b0 19 e0 49
E: 18.416902 6 04 83 b0 19 e0 49
E: 18.424904 6 04 83 b0 19 e0 49
E: 18.431902 6 04 83 b0 19 e0 49
E: 18.439906 6 04 83 b0 19 e0 49
E: 18.447855 6 04 83 b0 19 e0 49
E: 18.454906 6 04 83 b0 19 e0 49
E: 18.462900 6 04 83 b0 19 e0 49
E: 18.469903 6 04 83 b0 19 e0 49
E: 18.477901 6 04 83 b0 19 e0 49
E: 18.485903 6 04 83 b0 19 e0 49
E: 18.492902 6 04 83 b0 19 e0 49
E: 18.500904 6 04 83 b0 19 e0 49
E: 18.509898 6 04 83 b0 19 e0 49
E: 18.516903 6 04 83 b0 19 e0 49
E: 18.524898 6 04 83 b0 19 e0 49
E: 18.532905 6 04 83 b0 19 e0 49
E: 18.539900 6 04 83 b0 19 e0 49
E: 18.547906 6 04 83 b0 19 e0 49
E: 18.554902 6 04 83 b0 19 e0 49
E: 18.562903 6 04 83 b0 19 e0 49
E: 18.570901 6 04 83 b0 19 e0 49
E: 18.577902 6 04 83 b0 19 e0 49
E: 18.585901 6 04 83 b0 19 e0 49
E: 18.593904 6 04 83 b0 19 e0 49
E: 18.600903 6 04 83 b0 19 e0 49
E: 18.608902 6 04 83 b0 19 e0 49
E: 18.616901 6 04 83 b0 19 e0 49
E: 18.623902 6 04 83 b0 19 e0 49
E: 18.631901 6 04 83 b0 19 e0 49
E: 18.638902 6 04 83 b0 19 e0 49
E: 18.646902 6 04 83 b0 19 e0 49
E: 18.654901 6 04 83 b0 19 e0 49
E: 18.661902 6 04 83 b0 19 e0 49
E: 18.669909 6 04 83 b0 19 e0 49
E: 18.677903 6 04 83 b0 19 e0 49
E: 18.684903 6 04 83 b0 19 e0 49
E: 18.692900 6 04 83 b0 19 e0 49
E: 18.700902 6 04 83 b0 19 e0 49
E: 18.707899 6 04 83 b0 19 e0 49
E: 18.715903 6 04 83 b0 19 e0 49
E: 18.723901 6 04 83 b0 19 e0 49
E: 18.730902 6 04 83 b0 19 e0 49
E: 18.738902 6 04 83 b0 19 e0 49
E: 18.745902 6 04 83 b0 19 e0 49
E: 18.753902 6 04 83 b0 19 e0 49
E: 18.761903 6 04 83 b0 19 e0 49
E: 18.769903 6 04 83 b0 19 e0 49
E: 18.777901 6 04 83 b0 19 e0 49
E: 18.785902 6 04 83 b0 19 e0 49
E: 18.792902 6 04 83 b0 19 e0 49
E: 18.800901 6 04 83 b0 19 e0 49
E: 18.808903 6 04 83 b0 19 e0 49
E: 18.815901 6 04 83 b0 19 e0 49
E: 18.823903 6 04 83 b0 19 e0 49
E: 18.830901 6 04 83 b0 19 e0 49
E: 18.838906 6 04 83 b0 19 e0 49
E: 18.846901 6 04 83 b0 19 e0 49
E: 18.853905 6 04 83 b0 19 e0 49
E: 18.861900 6 04 83 b0 19 e0 49
E: 18.869907 6 04 83 b0 19 e0 49
E: 18.876901 6 04 83 b0 19 e0 49
E: 18.884906 6 04 83 b0 19 e0 49
E: 18.892898 6 04 83 b0 19 e0 49
E: 18.899905 6 04 83 b0 19 e0 49
E: 18.907889 6 04 83 b0 19 e0 49
E: 18.915906 6 04 83 b0 19 e0 49
E: 18.922903 6 04 83 b0 19 e0 49
E: 18.930905 6 04 83 b0 19 e0 49
E: 18.937903 6 04 83 b0 19 e0 49
E: 18.945910 6 04 83 b0 19 e0 49
E: 18.953908 6 04 83 b0 19 e0 49
E: 18.960905 6 04 83 b0 19 e0 49
E: 18.968904 6 04 83 b0 19 e0 49
E: 18.976905 6 04 83 b0 19 e0 49
E: 18.983902 6 04 83 b0 19 e0 49
E: 18.991905 6 04 83 b0 19 e0 49
E: 18.999901 6 04 83 b0 19 e0 49
E: 19.006901 6 04 83 b0 19 e0 49
E: 19.014903 6 04 83 b0 19 e0 49
E: 19.021901 6 04 83 b0 19 e0 49
E: 19.030900 6 04 83 b0 19 e0 49
E: 19.038901 6 04 83 b0 19 e0 49
E: 19.045903 6 04 83 b0 19 e0 49
E: 19.053901 6 04 83 b0 19 e0 49
E: 19.061902 6 04 83 b0 19 e0 49
E: 19.069335 6 04 83 b0 19 e0 49
E: 19.076908 6 04 83 b0 19 e0 49
E: 19.083905 6 04 83 b0 19 e0 49
E: 19.091903 6 04 83 b0 19 e0 49
E: 19.099911 6 04 83 b0 19 e0 49
E: 19.106904 6 04 83 b0 19 e0 49
E: 19.114906 6 04 83 b0 19 e0 49
E: 19.122902 6 04 83 b0 19 e0 49
E: 19.133902 6 04 83 b0 19 e0 49
E: 19.144902 6 04 83 b0 19 e0 49
E: 19.154901 6 04 83 b0 19 e0 49
E: 19.156926 6 04 87 00 60 40 38
E: 19.165906 6 04 87 00 60 40 38
E: 19.167910 6 04 83 b0 19 e0 49
E: 19.176905 6 04 83 b0 19 e0 49
E: 19.178906 6 04 87 00 60 40 38
E: 19.187906 6 04 87 00 60 40 38
E: 19.189902 6 04 83 b0 19 e0 49
E: 19.198907 6 04 83 b0 19 e0 49
E: 19.200907 6 04 87 00 60 40 38
E: 19.209906 6 04 87 00 60 40 38
E: 19.211908 6 04 83 b0 19 e0 49
E: 19.220905 6 04 83 b0 19 e0 49
E: 19.222905 6 04 87 00 60 40 38
E: 19.231907 6 04 87 00 60 40 38
E: 19.233906 6 04 83 b0 19 e0 49
E: 19.242908 6 04 83 b0 19 e0 49
E: 19.244906 6 04 87 00 60 40 38
E: 19.253906 6 04 87 00 60 40 38
E: 19.255909 6 04 83 b0 19 e0 49
E: 19.264905 6 04 83 b0 19 e0 49
E: 19.266907 6 04 87 00 60 40 38
E: 19.275907 6 04 87 00 60 40 38
E: 19.277905 6 04 83 b0 19 e0 49
E: 19.287906 6 04 83 b0 19 e0 49
E: 19.289908 6 04 87 00 60 40 38
E: 19.298907 6 04 87 00 60 40 38
E: 19.300907 6 04 83 b0 19 e0 49
E: 19.309905 6 04 83 b0 19 e0 49
E: 19.311909 6 04 87 00 60 40 38
E: 19.320906 6 04 87 00 60 40 38
E: 19.322906 6 04 83 b0 19 e0 49
E: 19.331905 6 04 83 b0 19 e0 49
E: 19.333906 6 04 87 00 60 40 38
E: 19.342904 6 04 87 00 60 40 38
E: 19.344906 6 04 83 b0 19 e0 49
E: 19.353906 6 04 83 b0 19 e0 49
E: 19.355909 6 04 87 00 60 40 38
E: 19.364906 6 04 87 00 60 40 38
E: 19.366906 6 04 83 b0 19 e0 49
E: 19.375905 6 04 83 b0 19 e0 49
E: 19.377906 6 04 87 00 60 40 38
E: 19.386907 6 04 87 00 60 40 38
E: 19.388901 6 04 83 b0 19 e0 49
E: 19.397906 6 04 83 b0 19 e0 49
E: 19.399910 6 04 87 00 60 40 38
E: 19.408904 6 04 87 00 60 40 38
E: 19.410906 6 04 83 b0 19 e0 49
E: 19.419907 6 04 83 b0 19 e0 49
E: 19.421906 6 04 87 00 60 40 38
E: 19.429905 6 04 87 00 60 40 38
E: 19.431905 6 04 83 b0 19 e0 49
E: 19.440909 6 04 83 b0 19 e0 49
E: 19.442905 6 04 87 00 60 40 38
E: 19.451911 6 04 87 00 60 40 38
E: 19.453906 6 04 83 b0 19 e0 49
E: 19.462907 6 04 83 b0 19 e0 49
E: 19.464905 6 04 87 00 60 40 38
E: 19.473907 6 04 87 00 60 40 38
E: 19.475907 6 04 83 b0 19 e0 49
E: 19.484860 6 04 83 b0 19 e0 49
E: 19.486905 6 04 87 00 60 40 38
E: 19.495908 6 04 87 00 60 40 38
E: 19.497904 6 04 83 b0 19 e0 49
E: 19.506908 6 04 83 b0 19 e0 49
E: 19.508908 6 04 87 00 60 40 38
E: 19.517907 6 04 87 00 60 40 38
E: 19.519908 6 04 83 b0 19 e0 49
E: 19.528908 6 04 83 b0 19 e0 49
E: 19.530904 6 04 87 00 60 40 38
E: 19.539912 6 04 87 00 60 40 38
E: 19.541905 6 04 83 b0 19 e0 49
E: 19.551913 6 04 83 b0 19 e0 49
E: 19.553905 6 04 87 00 60 40 38
E: 19.562905 6 04 87 00 60 40 38
E: 19.564853 6 04 83 b0 19 e0 49
E: 19.573907 6 04 83 b0 19 e0 49
E: 19.575906 6 04 87 00 60 40 38
E: 19.584908 6 04 87 00 60 40 38
E: 19.586904 6 04 83 b0 19 e0 49
E: 19.595908 6 04 83 b0 19 e0 49
E: 19.597906 6 04 87 00 60 40 38
E: 19.606907 6 04 87 00 60 40 38
E: 19.608907 6 04 83 b0 19 e0 49
E: 19.617908 6 04 83 b0 19 e0 49
E: 19.619906 6 04 87 00 60 40 38
E: 19.628903 6 04 87 00 60 40 38
E: 19.630902 6 04 83 b0 19 e0 49
E: 19.639855 6 04 83 b0 19 e0 49
E: 19.641905 6 04 87 00 60 40 38
E: 19.650932 6 04 87 00 60 40 38
E: 19.652914 6 04 83 b0 19 e0 49
E: 19.661912 6 04 83 b0 19 e0 49
E: 19.663910 6 04 87 00 60 40 38
E: 19.672910 6 04 87 00 60 40 38
E: 19.674906 6 04 83 b0 19 e0 49
E: 19.682909 6 04 83 b0 19 e0 49
E: 19.684910 6 04 87 00 60 40 38
E: 19.693907 6 04 87 00 60 40 38
E: 19.695909 6 04 83 b0 19 e0 49
E: 19.704907 6 04 83 b0 19 e0 49
E: 19.706906 6 04 87 00 60 40 38
E: 19.715907 6 04 87 00 60 40 38
E: 19.717906 6 04 83 b0 19 e0 49
E: 19.726906 6 04 83 b0 19 e0 49
E: 19.728907 6 04 87 00 60 40 38
E: 19.737906 6 04 87 00 60 40 38
E: 19.739908 6 04 83 b0 19 e0 49
E: 19.748911 6 04 83 b0 19 e0 49
E: 19.750906 6 04 87 00 60 40 38
E: 19.759908 6 04 87 00 60 40 38
E: 19.761905 6 04 83 b0 19 e0 49
E: 19.770906 6 04 83 b0 19 e0 49
E: 19.772856 6 04 87 00 60 40 38
E: 19.781911 6 04 87 00 60 40 38
E: 19.783907 6 04 83 b0 19 e0 49
E: 19.792907 6 04 83 b0 19 e0 49
E: 19.794907 6 04 87 00 60 40 38
E: 19.804852 6 04 87 00 60 40 38
E: 19.806909 6 04 83 b0 19 e0 49
E: 19.815907 6 04 83 b0 19 e0 49
E: 19.817906 6 04 87 00 60 40 38
E: 19.826908 6 04 87 00 60 40 38
E: 19.828905 6 04 83 b0 19 e0 49
E: 19.837906 6 04 83 b0 19 e0 49
E: 19.839910 6 04 87 00 60 40 38
E: 19.848906 6 04 87 00 60 40 38
E: 19.850906 6 04 83 b0 19 e0 49
E: 19.859909 6 04 83 b0 19 e0 49
E: 19.861906 6 04 87 00 60 40 38
E: 19.870913 6 04 87 00 60 40 38
E: 19.872908 6 04 83 b0 19 e0 49
E: 19.881907 6 04 83 b0 19 e0 49
E: 19.883909 6 04 87 00 60 40 38
E: 19.892908 6 04 87 00 60 40 38
E: 19.894907 6 04 83 b0 19 e0 49
E: 19.903907 6 04 83 b0 19 e0 49
E: 19.905903 6 04 87 00 60 40 38
E: 19.914908 6 04 87 00 60 40 38
E: 19.916859 6 04 83 b0 19 e0 49
E: 19.925907 6 04 83 b0 19 e0 49
E: 19.927909 6 04 87 00 60 40 38
E: 19.936905 6 04 87 00 60 40 38
E: 19.938907 6 04 83 b0 19 e0 49
E: 19.946905 6 04 83 b0 19 e0 49
E: 19.948852 6 04 87 00 60 40 38
E: 19.957912 6 04 87 00 60 40 38
E: 19.959906 6 04 83 b0 19 e0 49
E: 19.968907 6 04 83 b0 19 e0 49
E: 19.970903 6 04 87 00 60 40 38
E: 19.979907 6 04 87 00 60 40 38
E: 19.981906 6 04 83 b0 19 e0 49
E: 19.990905 6 04 83 b0 19 e0 49
E: 19.992906 6 04 87 00 60 40 38
E: 20.001907 6 04 87 00 60 40 38
E: 20.003906 6 04 83 b0 19 e0 49
E: 20.012860 6 04 83 b0 19 e0 49
E: 20.014905 6 04 87 00 60 40 38
E: 20.023908 6 04 87 00 60 40 38
E: 20.025903 6 04 83 b0 19 e0 49
E: 20.034909 6 04 83 b0 19 e0 49
E: 20.036907 6 04 87 00 60 40 38
E: 20.045921 6 04 87 00 60 60 38
E: 20.047907 6 04 83 b0 19 e0 49
E: 20.057907 6 04 83 b0 19 e0 49
E: 20.059905 6 04 87 00 60 60 38
E: 20.068907 6 04 87 00 60 60 38
E: 20.070905 6 04 83 b0 19 e0 49
E: 20.079909 6 04 83 b0 19 e0 49
E: 20.081904 6 04 87 00 60 60 38
E: 20.090904 6 04 87 00 60 60 38
E: 20.092854 6 04 83 b0 19 e0 49
E: 20.101907 6 04 83 b0 19 e0 49
E: 20.103905 6 04 87 00 60 60 38
E: 20.112906 6 04 87 00 60 60 38
E: 20.114904 6 04 83 b0 19 e0 49
E: 20.123907 6 04 83 b0 19 e0 49
E: 20.125906 6 04 87 00 60 60 38
E: 20.134905 6 04 87 00 60 60 38
E: 20.136906 6 04 83 b0 19 e0 49
E: 20.145907 6 04 83 b0 19 e0 49
E: 20.147906 6 04 87 00 60 60 38
E: 20.156859 6 04 87 00 60 60 38
E: 20.158909 6 04 83 b0 19 e0 49
E: 20.167908 6 04 83 b0 19 e0 49
E: 20.169904 6 04 87 00 60 60 38
E: 20.178909 6 04 87 00 60 60 38
E: 20.180908 6 04 83 b0 19 e0 49
E: 20.189910 6 04 83 b0 19 e0 49
E: 20.191906 6 04 87 00 60 60 38
E: 20.199905 6 04 87 00 60 60 38
E: 20.201904 6 04 83 b0 19 e0 49
E: 20.210907 6 04 83 b0 19 e0 49
E: 20.212906 6 04 87 00 60 60 38
E: 20.221905 6 04 87 00 60 60 38
E: 20.223906 6 04 83 b0 19 e0 49
E: 20.232906 6 04 83 b0 19 e0 49
E: 20.234906 6 04 87 00 60 60 38
E: 20.243907 6 04 87 00 60 60 38
E: 20.245906 6 04 83 b0 19 e0 49
E: 20.254907 6 04 83 b0 19 e0 49
E: 20.256905 6 04 87 00 60 60 38
E: 20.265907 6 04 87 00 60 60 38
E: 20.267907 6 04 83 b0 19 e0 49
E: 20.276912 6 04 83 b0 19 e0 49
E: 20.278907 6 04 87 00 60 60 38
E: 20.287909 6 04 87 00 60 60 38
E: 20.289908 6 04 83 b0 19 e0 49
E: 20.298908 6 04 83 b0 19 e0 49
E: 20.300853 6 04 87 00 60 60 38
E: 20.309907 6 04 87 00 60 60 38
E: 20.311910 6 04 83 b0 19 e0 49
E: 20.321907 6 04 83 b0 19 e0 49
E: 20.323909 6 04 87 00 60 60 38
E: 20.332851 6 04 87 00 60 60 38
E: 20.334906 6 04 83 b0 19 e0 49
E: 20.343906 6 04 83 b0 19 e0 49
E: 20.345905 6 04 87 00 60 60 38
E: 20.354908 6 04 87 00 60 60 38
E: 20.356906 6 04 83 b0 19 e0 49
E: 20.365904 6 04 83 b0 19 e0 49
E: 20.367907 6 04 87 00 60 60 38
E: 20.376907 6 04 87 00 60 60 38
E: 20.378916 6 04 83 b0 19 e0 49
E: 20.387909 6 04 83 b0 19 e0 49
E: 20.389906 6 04 87 00 60 60 38
E: 20.398907 6 04 87 00 60 60 38
E: 20.400902 6 04 83 b0 19 e0 49
E: 20.409903 6 04 83 b0 19 e0 49
E: 20.411904 6 04 87 00 60 60 38
E: 20.420910 6 04 87 00 60 60 38
E: 20.422871 6 04 83 b0 19 e0 49
E: 20.431836 6 04 83 b0 19 e0 49
E: 20.434114 6 04 87 00 60 60 38
E: 20.442908 6 04 87 00 60 60 38
E: 20.444881 6 04 83 b0 19 e0 49
E: 20.453911 6 04 83 b0 19 e0 49
E: 20.455911 6 04 87 00 60 60 38
E: 20.463905 6 04 87 00 60 60 38
E: 20.465902 6 04 83 b0 19 e0 49
E: 20.474922 6 04 83 b0 19 c0 49
E: 20.476885 6 04 87 00 60 60 38
E: 20.485911 6 04 87 00 60 60 38
E: 20.487920 6 04 83 b0 19 90 49
E: 20.496918 6 04 83 b0 19 60 49
E: 20.498908 6 04 87 00 60 60 38
E: 20.507911 6 04 87 00 60 60 38
E: 20.509915 6 04 83 b0 19 40 49
E: 20.518922 6 04 83 c0 19 10 49
E: 20.520906 6 04 87 00 60 60 38
E: 20.529910 6 04 87 00 60 60 38
E: 20.531921 6 04 83 d0 19 d0 48
E: 20.540889 6 04 83 d0 19 80 48
E: 20.542909 6 04 87 00 60 60 38
E: 20.551911 6 04 87 00 60 60 38
E: 20.553910 6 04 83 e0 19 20 48
E: 20.562918 6 04 83 e0 19 f0 47
E: 20.564907 6 04 87 00 60 60 38
E: 20.574907 6 04 87 00 60 60 38
E: 20.576919 6 04 83 f0 19 b0 47
E: 20.584915 6 04 83 f0 19 70 47
E: 20.586912 6 04 87 00 60 30 38
E: 20.595914 6 04 87 00 60 10 38
E: 20.597918 6 04 83 f0 19 30 47
E: 20.605916 6 04 83 f0 19 f0 46
E: 20.607917 6 04 87 00 60 e0 37
E: 20.616914 6 04 87 00 60 c0 37
E: 20.618921 6 04 83 00 1a a0 46
E: 20.626916 6 04 83 00 1a 50 46
E: 20.628914 6 04 87 00 60 90 37
E: 20.637916 6 04 87 00 60 60 37
E: 20.639913 6 04 83 00 1a 00 46
E: 20.648915 6 04 83 00 1a b0 45
E: 20.650918 6 04 87 f0 5f 30 37
E: 20.658915 6 04 87 e0 5f f0 36
E: 20.660918 6 04 83 10 1a 60 45
E: 20.669917 6 04 83 10 1a 10 45
E: 20.671922 6 04 87 d0 5f b0 36
E: 20.679853 6 04 87 c0 5f 70 36
E: 20.681919 6 04 83 10 1a c0 44
E: 20.690920 6 04 83 10 1a 70 44
E: 20.692925 6 04 87 b0 5f 40 36
E: 20.700917 6 04 87 a0 5f 00 36
E: 20.702921 6 04 83 10 1a 30 44
E: 20.710917 6 04 83 10 1a e0 43
E: 20.712916 6 04 87 a0 5f c0 35
E: 20.722023 6 04 87 a0 5f 90 35
E: 20.723918 6 04 83 10 1a a0 43
E: 20.732918 6 04 83 10 1a 70 43
E: 20.734918 6 04 87 90 5f 50 35
E: 20.742914 6 04 87 90 5f 20 35
E: 20.744921 6 04 83 10 1a 30 43
E: 20.753917 6 04 83 10 1a d0 42
E: 20.755922 6 04 87 80 5f f0 34
E: 20.763915 6 04 87 80 5f c0 34
E: 20.765917 6 04 83 20 1a 70 42
E: 20.774920 6 04 83 20 1a 00 42
E: 20.776917 6 04 87 70 5f 90 34
E: 20.784912 6 04 87 70 5f 50 34
E: 20.786920 6 04 83 20 1a 90 41
E: 20.795916 6 04 83 20 1a 20 41
E: 20.797919 6 04 87 60 5f 10 34
E: 20.805918 6 04 87 50 5f d0 33
E: 20.807915 6 04 83 20 1a c0 40
E: 20.815920 6 04 83 20 1a 60 40
E: 20.817915 6 04 87 50 5f a0 33
E: 20.826918 6 04 87 50 5f 70 33
E: 20.828916 6 04 83 20 1a 10 40
E: 20.837923 6 04 83 20 1a e0 3f
E: 20.839918 6 04 87 50 5f 40 33
E: 20.847917 6 04 87 40 5f 10 33
E: 20.849920 6 04 83 20 1a a0 3f
E: 20.857989 6 04 83 30 1a 50 3f
E: 20.859913 6 04 87 40 5f d0 32
E: 20.867925 6 04 87 40 5f a0 32
E: 20.869918 6 04 83 30 1a f0 3e
E: 20.877914 6 04 83 30 1a 90 3e
E: 20.879922 6 04 87 30 5f 70 32
E: 20.888916 6 04 87 30 5f 40 32
E: 20.890920 6 04 83 40 1a 30 3e
E: 20.898923 6 04 83 50 1a e0 3d
E: 20.900913 6 04 87 30 5f 10 32
E: 20.909918 6 04 87 30 5f e0 31
E: 20.911918 6 04 83 50 1a 90 3d
E: 20.919914 6 04 83 50 1a 40 3d
E: 20.921917 6 04 87 30 5f c0 31
E: 20.929915 6 04 87 20 5f 90 31
E: 20.931913 6 04 83 50 1a f0 3c
E: 20.939921 6 04 83 60 1a a0 3c
E: 20.941915 6 04 87 20 5f 60 31
E: 20.950917 6 04 87 20 5f 40 31
E: 20.952920 6 04 83 70 1a 40 3c
E: 20.960918 6 04 83 80 1a e0 3b
E: 20.962917 6 04 87 20 5f 10 31
E: 20.970916 6 04 87 20 5f f0 30
E: 20.972914 6 04 83 80 1a 90 3b
E: 20.980918 6 04 83 80 1a 60 3b
E: 20.982915 6 04 87 10 5f d0 30
E: 20.990912 6 04 87 10 5f b0 30
E: 20.992922 6 04 83 90 1a 10 3b
E: 21.001916 6 04 83 90 1a c0 3a
E: 21.003921 6 04 87 00 5f 80 30
E: 21.011917 6 04 87 00 5f 50 30
E: 21.013913 6 04 83 90 1a 60 3a
E: 21.021921 6 04 83 a0 1a 10 3a
E: 21.023917 6 04 87 00 5f 20 30
E: 21.031914 6 04 87 00 5f f0 2f
E: 21.033921 6 04 83 b0 1a c0 39
E: 21.041922 6 04 83 c0 1a 70 39
E: 21.043916 6 04 87 f0 5e c0 2f
E: 21.050916 6 04 87 f0 5e 90 2f
E: 21.052917 6 04 83 c0 1a 20 39
E: 21.060917 6 04 83 c0 1a d0 38
E: 21.062916 6 04 87 f0 5e 70 2f
E: 21.070913 6 04 87 f0 5e 40 2f
E: 21.072920 6 04 83 c0 1a 70 38
E: 21.080921 6 04 83 c0 1a 10 38
E: 21.082917 6 04 87 f0 5e 10 2f
E: 21.091922 6 04 87 e0 5e f0 2e
E: 21.093919 6 04 83 d0 1a b0 37
E: 21.100913 6 04 83 d0 1a 50 37
E: 21.102921 6 04 87 e0 5e c0 2e
E: 21.111916 6 04 87 e0 5e 90 2e
E: 21.113919 6 04 83 d0 1a e0 36
E: 21.121920 6 04 83 e0 1a 70 36
E: 21.123914 6 04 87 e0 5e 60 2e
E: 21.131920 6 04 87 e0 5e 40 2e
E: 21.133918 6 04 83 f0 1a 00 36
E: 21.140916 6 04 83 f0 1a 90 35
E: 21.142920 6 04 87 e0 5e 10 2e
E: 21.150915 6 04 87 e0 5e e0 2d
E: 21.152917 6 04 83 00 1b 20 35
E: 21.160923 6 04 83 10 1b a0 34
E: 21.162914 6 04 87 e0 5e b0 2d
E: 21.170914 6 04 87 e0 5e 80 2d
E: 21.172923 6 04 83 20 1b 10 34
E: 21.180916 6 04 83 20 1b 90 33
E: 21.182913 6 04 87 e0 5e 50 2d
E: 21.189917 6 04 87 e0 5e 20 2d
E: 21.191919 6 04 83 30 1b 10 33
E: 21.198915 6 04 83 30 1b 90 32
E: 21.200918 6 04 87 e0 5e e0 2c
E: 21.207916 6 04 87 e0 5e a0 2c
E: 21.209915 6 04 83 40 1b 20 32
E: 21.216920 6 04 83 40 1b a0 31
E: 21.218915 6 04 87 e0 5e 60 2c
E: 21.225913 6 04 87 e0 5e 20 2c
E: 21.227920 6 04 83 40 1b 30 31
E: 21.234919 6 04 83 40 1b b0 30
E: 21.236915 6 04 87 e0 5e e0 2b
E: 21.243920 6 04 87 e0 5e b0 2b
E: 21.245915 6 04 83 50 1b 40 30
E: 21.252918 6 04 83 60 1b d0 2f
E: 21.254918 6 04 87 e0 5e 70 2b
E: 21.261914 6 04 87 e0 5e 30 2b
E: 21.263919 6 04 83 70 1b 60 2f
E: 21.270919 6 04 83 70 1b 00 2f
E: 21.272915 6 04 87 e0 5e f0 2a
E: 21.279912 6 04 87 e0 5e b0 2a
E: 21.281917 6 04 83 70 1b a0 2e
E: 21.288916 6 04 83 70 1b 40 2e
E: 21.290912 6 04 87 e0 5e 70 2a
E: 21.297919 6 04 87 e0 5e 30 2a
E: 21.299920 6 04 83 80 1b e0 2d
E: 21.306915 6 04 83 80 1b 70 2d
E: 21.308919 6 04 87 e0 5e f0 29
E: 21.315912 6 04 87 e0 5e b0 29
E: 21.317913 6 04 83 80 1b 00 2d
E: 21.324918 6 04 83 80 1b a0 2c
E: 21.326915 6 04 87 e0 5e 60 29
E: 21.333914 6 04 87 e0 5e 10 29
E: 21.335924 6 04 83 90 1b 40 2c
E: 21.343918 6 04 83 90 1b e0 2b
E: 21.345912 6 04 87 e0 5e d0 28
E: 21.353917 6 04 87 e0 5e 80 28
E: 21.355916 6 04 83 90 1b 80 2b
E: 21.362916 6 04 83 90 1b 20 2b
E: 21.364918 6 04 87 e0 5e 30 28
E: 21.371914 6 04 87 e0 5e e0 27
E: 21.373917 6 04 83 a0 1b c0 2a
E: 21.380921 6 04 83 a0 1b 60 2a
E: 21.382916 6 04 87 e0 5e 80 27
E: 21.389910 6 04 87 e0 5e 20 27
E: 21.391855 6 04 83 a0 1b 00 2a
E: 21.398922 6 04 83 a0 1b a0 29
E: 21.400919 6 04 87 e0 5e c0 26
E: 21.405912 6 04 87 e0 5e 90 26
E: 21.414922 6 04 83 b0 1b 40 29
E: 21.416919 6 04 87 e0 5e 40 26
E: 21.422912 6 04 87 e0 5e 10 26
E: 21.431928 6 04 83 c0 1b e0 28
E: 21.433914 6 04 87 e0 5e b0 25
E: 21.440917 6 04 87 e0 5e 40 25
E: 21.442918 6 04 83 c0 1b 70 28
E: 21.449919 6 04 83 d0 1b 00 28
E: 21.451918 6 04 87 e0 5e c0 24
E: 21.458917 6 04 87 e0 5e 30 24
E: 21.460920 6 04 83 e0 1b a0 27
E: 21.467916 6 04 83 e0 1b 40 27
E: 21.469918 6 04 87 e0 5e a0 23
E: 21.476925 6 04 87 e0 5e 10 23
E: 21.478918 6 04 83 e0 1b e0 26
E: 21.485924 6 04 83 f0 1b 80 26
E: 21.487917 6 04 87 e0 5e 80 22
E: 21.495916 6 04 87 e0 5e 00 22
E: 21.497917 6 04 83 f0 1b 20 26
E: 21.504918 6 04 83 f0 1b c0 25
E: 21.506914 6 04 87 e0 5e 90 21
E: 21.513917 6 04 87 e0 5e 20 21
E: 21.515916 6 04 83 f0 1b 60 25
E: 21.523918 6 04 83 f0 1b 10 25
E: 21.525916 6 04 87 e0 5e c0 20
E: 21.533915 6 04 87 e0 5e 60 20
E: 21.535915 6 04 83 f0 1b b0 24
E: 21.542921 6 04 83 00 1c 50 24
E: 21.544918 6 04 87 e0 5e 00 20
E: 21.551915 6 04 87 e0 5e a0 1f
E: 21.553918 6 04 83 00 1c f0 23
E: 21.560921 6 04 83 00 1c 90 23
E: 21.562914 6 04 87 e0 5e 40 1f
E: 21.569918 6 04 87 e0 5e d0 1e
E: 21.571917 6 04 83 00 1c 30 23
E: 21.578916 6 04 83 00 1c d0 22
E: 21.580862 6 04 87 e0 5e 70 1e
E: 21.587919 6 04 87 e0 5e 10 1e
E: 21.589913 6 04 83 00 1c 70 22
E: 21.596858 6 04 83 10 1c 00 22
E: 21.598920 6 04 87 e0 5e a0 1d
E: 21.607915 6 04 87 e0 5e 40 1d
E: 21.609914 6 04 83 10 1c a0 21
E: 21.616915 6 04 83 10 1c 40 21
E: 21.618920 6 04 87 f0 5e e0 1c
E: 21.625919 6 04 87 f0 5e 90 1c
E: 21.627916 6 04 83 10 1c e0 20
E: 21.634923 6 04 83 10 1c 80 20
E: 21.636918 6 04 87 f0 5e 40 1c
E: 21.643914 6 04 87 f0 5e f0 1b
E: 21.645922 6 04 83 10 1c 30 20
E: 21.652921 6 04 83 20 1c e0 1f
E: 21.654913 6 04 87 f0 5e b0 1b
E: 21.661915 6 04 87 f0 5e 70 1b
E: 21.663922 6 04 83 30 1c 80 1f
E: 21.670916 6 04 83 30 1c 20 1f
E: 21.672917 6 04 87 f0 5e 20 1b
E: 21.679854 6 04 87 f0 5e d0 1a
E: 21.681912 6 04 83 40 1c c0 1e
E: 21.688918 6 04 83 40 1c 60 1e
E: 21.690913 6 04 87 f0 5e 90 1a
E: 21.697915 6 04 87 f0 5e 50 1a
E: 21.699920 6 04 83 40 1c 00 1e
E: 21.707919 6 04 83 40 1c b0 1d
E: 21.709911 6 04 87 f0 5e 00 1a
E: 21.716918 6 04 87 f0 5e b0 19
E: 21.718915 6 04 83 40 1c 60 1d
E: 21.725913 6 04 83 40 1c 20 1d
E: 21.727921 6 04 87 f0 5e 60 19
E: 21.734914 6 04 87 f0 5e 10 19
E: 21.736913 6 04 83 40 1c d0 1c
E: 21.743920 6 04 83 40 1c 80 1c
E: 21.746028 6 04 87 f0 5e b0 18
E: 21.752916 6 04 87 f0 5e 60 18
E: 21.754920 6 04 83 50 1c 30 1c
E: 21.761919 6 04 83 60 1c e0 1b
E: 21.763913 6 04 87 f0 5e 00 18
E: 21.770917 6 04 87 f0 5e b0 17
E: 21.772914 6 04 83 60 1c 90 1b
E: 21.779918 6 04 83 60 1c 40 1b
E: 21.781917 6 04 87 f0 5e 60 17
E: 21.788915 6 04 87 f0 5e 10 17
E: 21.790918 6 04 83 70 1c f0 1a
E: 21.797920 6 04 83 70 1c a0 1a
E: 21.799917 6 04 87 f0 5e d0 16
E: 21.806914 6 04 87 f0 5e 90 16
E: 21.808918 6 04 83 70 1c 50 1a
E: 21.815917 6 04 83 70 1c 10 1a
E: 21.817911 6 04 87 f0 5e 60 16
E: 21.824909 6 04 87 f0 5e 60 16
E: 21.826916 6 04 83 70 1c d0 19
E: 21.833912 6 04 83 70 1c 90 19
E: 21.835922 6 04 87 f0 5e 20 16
E: 21.842916 6 04 87 00 5f f0 15
E: 21.844915 6 04 83 70 1c 60 19
E: 21.851920 6 04 83 70 1c 30 19
E: 21.853916 6 04 87 00 5f c0 15
E: 21.860913 6 04 87 00 5f a0 15
E: 21.862918 6 04 83 70 1c 10 19
E: 21.871917 6 04 83 70 1c e0 18
E: 21.873909 6 04 87 00 5f a0 15
E: 21.880919 6 04 87 00 5f 60 15
E: 21.882913 6 04 83 70 1c c0 18
E: 21.889923 6 04 83 80 1c 90 18
E: 21.891909 6 04 87 00 5f 60 15
E: 21.898917 6 04 87 00 5f 20 15
E: 21.900862 6 04 83 90 1c 50 18
E: 21.907906 6 04 83 90 1c 10 18
E: 21.909907 6 04 87 00 5f f0 14
E: 21.916918 6 04 87 00 5f b0 14
E: 21.918910 6 04 83 90 1c d0 17
E: 21.925914 6 04 83 90 1c 80 17
E: 21.927919 6 04 87 00 5f 70 14
E: 21.934914 6 04 87 00 5f 40 14
E: 21.936916 6 04 83 90 1c 30 17
E: 21.943919 6 04 83 90 1c e0 16
E: 21.945917 6 04 87 00 5f 10 14
E: 21.952917 6 04 87 00 5f e0 13
E: 21.954919 6 04 83 90 1c 90 16
E: 21.961919 6 04 83 90 1c 60 16
E: 21.963915 6 04 87 00 5f c0 13
E: 21.970918 6 04 87 00 5f 90 13
E: 21.972917 6 04 83 90 1c 40 16
E: 21.979914 6 04 83 90 1c 10 16
E: 21.981916 6 04 87 00 5f 60 13
E: 21.988916 6 04 87 00 5f 30 13
E: 21.990915 6 04 83 a0 1c d0 15
E: 21.997918 6 04 83 a0 1c 90 15
E: 21.999918 6 04 87 00 5f 10 13
E: 22.006906 6 04 87 00 5f 10 13
E: 22.008917 6 04 83 a0 1c 40 15
E: 22.015920 6 04 83 b0 1c f0 14
E: 22.017912 6 04 87 00 5f f0 12
E: 22.024909 6 04 87 00 5f f0 12
E: 22.026916 6 04 83 b0 1c c0 14
E: 22.033916 6 04 83 c0 1c 80 14
E: 22.035914 6 04 87 00 5f f0 12
E: 22.043906 6 04 87 00 5f f0 12
E: 22.045912 6 04 83 c0 1c 40 14
E: 22.052924 6 04 83 d0 1c f0 13
E: 22.054916 6 04 87 00 5f d0 12
E: 22.061905 6 04 87 00 5f d0 12
E: 22.063924 6 04 83 d0 1c c0 13
E: 22.070918 6 04 83 d0 1c 90 13
E: 22.072914 6 04 87 00 5f b0 12
E: 22.079911 6 04 87 00 5f b0 12
E: 22.081917 6 04 83 d0 1c 50 13
E: 22.088914 6 04 83 d0 1c 10 13
E: 22.090918 6 04 87 00 5f 90 12
E: 22.097908 6 04 87 00 5f 90 12
E: 22.099917 6 04 83 d0 1c e0 12
E: 22.106911 6 04 83 d0 1c e0 12
E: 22.108914 6 04 87 00 5f 70 12
E: 22.115914 6 04 87 00 5f 50 12
E: 22.117916 6 04 83 d0 1c c0 12
E: 22.125906 6 04 83 d0 1c c0 12
E: 22.127906 6 04 87 00 5f 50 12
E: 22.134921 6 04 87 00 5f 30 12
E: 22.136905 6 04 83 d0 1c c0 12
E: 22.143906 6 04 83 d0 1c c0 12
E: 22.145907 6 04 87 00 5f 30 12
E: 22.152907 6 04 87 00 5f 30 12
E: 22.154918 6 04 83 e0 1c 80 12
E: 22.161926 6 04 83 f0 1c 50 12
E: 22.163909 6 04 87 00 5f 30 12
E: 22.170911 6 04 87 00 5f 10 12
E: 22.172862 6 04 83 f0 1c 30 12
E: 22.179923 6 04 83 f0 1c 00 12
E: 22.181902 6 04 87 00 5f 10 12
E: 22.188857 6 04 87 00 5f d0 11
E: 22.190905 6 04 83 f0 1c 00 12
E: 22.197918 6 04 83 f0 1c e0 11
E: 22.199921 6 04 87 00 5f b0 11
E: 22.206906 6 04 87 00 5f b0 11
E: 22.208916 6 04 83 f0 1c c0 11
E: 22.215909 6 04 83 f0 1c c0 11
E: 22.217914 6 04 87 00 5f 90 11
E: 22.225907 6 04 87 00 5f 90 11
E: 22.227921 6 04 83 f0 1c a0 11
E: 22.234906 6 04 83 f0 1c a0 11
E: 22.236854 6 04 87 00 5f 90 11
E: 22.243923 6 04 87 10 5f 70 11
E: 22.245905 6 04 83 f0 1c a0 11
E: 22.252852 6 04 83 f0 1c a0 11
E: 22.254906 6 04 87 10 5f 70 11
E: 22.261914 6 04 87 10 5f 50 11
E: 22.263915 6 04 83 f0 1c 80 11
E: 22.270918 6 04 83 f0 1c 50 11
E: 22.272923 6 04 87 10 5f 30 11
E: 22.279916 6 04 87 10 5f 00 11
E: 22.281907 6 04 83 f0 1c 50 11
E: 22.288921 6 04 83 f0 1c 30 11
E: 22.290915 6 04 87 10 5f d0 10
E: 22.297909 6 04 87 10 5f d0 10
E: 22.299905 6 04 83 f0 1c 30 11
E: 22.306916 6 04 83 f0 1c 00 11
E: 22.308916 6 04 87 10 5f a0 10
E: 22.315906 6 04 87 10 5f a0 10
E: 22.317914 6 04 83 f0 1c e0 10
E: 22.324910 6 04 83 f0 1c e0 10
E: 22.326916 6 04 87 10 5f 80 10
E: 22.333903 6 04 87 10 5f 80 10
E: 22.335921 6 04 83 f0 1c c0 10
E: 22.342917 6 04 83 f0 1c a0 10
E: 22.344903 6 04 87 10 5f 80 10
E: 22.351911 6 04 87 10 5f 80 10
E: 22.353914 6 04 83 f0 1c 80 10
E: 22.360903 6 04 83 f0 1c 80 10
E: 22.362907 6 04 87 10 5f 80 10
E: 22.369918 6 04 87 10 5f 60 10
E: 22.371915 6 04 83 f0 1c 60 10
E: 22.379908 6 04 83 f0 1c 60 10
E: 22.381906 6 04 87 10 5f 60 10
E: 22.388917 6 04 87 10 5f 40 10
E: 22.390902 6 04 83 f0 1c 60 10
E: 22.398907 6 04 83 f0 1c 60 10
E: 22.400906 6 04 87 10 5f 40 10
E: 22.407907 6 04 87 10 5f 40 10
E: 22.409907 6 04 83 f0 1c 60 10
E: 22.416905 6 04 83 f0 1c 60 10
E: 22.418906 6 04 87 10 5f 40 10
E: 22.425908 6 04 87 10 5f 40 10
E: 22.427906 6 04 83 f0 1c 60 10
E: 22.434914 6 04 83 f0 1c 60 10
E: 22.436909 6 04 87 10 5f 40 10
E: 22.443900 6 04 87 10 5f 40 10
E: 22.445906 6 04 83 f0 1c 60 10
E: 22.452905 6 04 83 f0 1c 60 10
E: 22.454905 6 04 87 10 5f 40 10
E: 22.461907 6 04 87 10 5f 40 10
E: 22.463909 6 04 83 f0 1c 60 10
E: 22.470907 6 04 83 f0 1c 60 10
E: 22.472907 6 04 87 10 5f 40 10
E: 22.479907 6 04 87 10 5f 40 10
E: 22.481904 6 04 83 f0 1c 60 10
E: 22.488909 6 04 83 f0 1c 60 10
E: 22.490905 6 04 87 10 5f 40 10
E: 22.497907 6 04 87 10 5f 40 10
E: 22.499909 6 04 83 f0 1c 60 10
E: 22.506907 6 04 83 f0 1c 60 10
E: 22.508902 6 04 87 10 5f 40 10
E: 22.515908 6 04 87 10 5f 40 10
E: 22.517905 6 04 83 f0 1c 60 10
E: 22.524902 6 04 83 f0 1c 60 10
E: 22.526907 6 04 87 10 5f 40 10
E: 22.533908 6 04 87 10 5f 40 10
E: 22.535906 6 04 83 f0 1c 60 10
E: 22.542907 6 04 83 f0 1c 60 10
E: 22.544908 6 04 87 10 5f 40 10
E: 22.551906 6 04 87 10 5f 40 10
E: 22.553906 6 04 83 f0 1c 60 10
E: 22.561907 6 04 83 f0 1c 60 10
E: 22.563905 6 04 87 10 5f 40 10
E: 22.570907 6 04 87 10 5f 40 10
E: 22.572905 6 04 83 f0 1c 60 10
E: 22.579906 6 04 83 f0 1c 60 10
E: 22.581906 6 04 87 10 5f 40 10
E: 22.588905 6 04 87 10 5f 40 10
E: 22.590904 6 04 83 f0 1c 60 10
E: 22.597908 6 04 83 f0 1c 60 10
E: 22.599908 6 04 87 10 5f 40 10
E: 22.606904 6 04 87 10 5f 40 10
E: 22.608906 6 04 83 f0 1c 60 10
E: 22.615907 6 04 83 f0 1c 60 10
E: 22.617903 6 04 87 10 5f 40 10
E: 22.624908 6 04 87 10 5f 40 10
E: 22.626905 6 04 83 f0 1c 60 10
E: 22.633903 6 04 83 f0 1c 60 10
E: 22.635911 6 04 87 10 5f 40 10
E: 22.643907 6 04 87 10 5f 40 10
E: 22.645901 6 04 83 f0 1c 60 10
E: 22.652907 6 04 83 f0 1c 60 10
E: 22.654902 6 04 87 10 5f 40 10
E: 22.661907 6 04 87 10 5f 40 10
E: 22.663853 6 04 83 f0 1c 60 10
E: 22.670904 6 04 83 f0 1c 60 10
E: 22.672908 6 04 87 10 5f 40 10
E: 22.679911 6 04 87 10 5f 40 10
E: 22.681905 6 04 83 f0 1c 60 10
E: 22.688907 6 04 83 f0 1c 60 10
E: 22.690907 6 04 87 10 5f 40 10
E: 22.697909 6 04 87 10 5f 40 10
E: 22.699906 6 04 83 f0 1c 60 10
E: 22.706907 6 04 83 f0 1c 60 10
E: 22.708906 6 04 87 10 5f 40 10
E: 22.715906 6 04 87 10 5f 40 10
E: 22.717904 6 04 83 f0 1c 60 10
E: 22.725907 6 04 83 f0 1c 60 10
E: 22.727906 6 04 87 10 5f 40 10
E: 22.734905 6 04 87 10 5f 40 10
E: 22.736906 6 04 83 f0 1c 60 10
E: 22.743906 6 04 83 f0 1c 60 10
E: 22.745906 6 04 87 10 5f 40 10
E: 22.752906 6 04 87 10 5f 40 10
E: 22.754905 6 04 83 f0 1c 60 10
E: 22.761907 6 04 83 f0 1c 60 10
E: 22.763906 6 04 87 10 5f 40 10
E: 22.770905 6 04 87 10 5f 40 10
E: 22.772906 6 04 83 f0 1c 60 10
E: 22.779907 6 04 83 f0 1c 60 10
E: 22.781902 6 04 87 10 5f 40 10
E: 22.788908 6 04 87 10 5f 40 10
E: 22.790904 6 04 83 f0 1c 60 10
E: 22.797903 6 04 83 f0 1c 60 10
E: 22.799909 6 04 87 10 5f 40 10
E: 22.806908 6 04 87 10 5f 40 10
E: 22.808906 6 04 83 f0 1c 60 10
E: 22.815908 6 04 83 f0 1c 60 10
E: 22.817905 6 04 87 10 5f 40 10
E: 22.824907 6 04 87 10 5f 40 10
E: 22.826906 6 04 83 f0 1c 60 10
E: 22.833906 6 04 83 f0 1c 60 10
E: 22.835906 6 04 87 10 5f 40 10
E: 22.842908 6 04 87 10 5f 40 10
E: 22.844905 6 04 83 f0 1c 60 10
E: 22.851907 6 04 83 f0 1c 60 10
E: 22.853906 6 04 87 10 5f 40 10
E: 22.860905 6 04 87 10 5f 40 10
E: 22.862904 6 04 83 f0 1c 60 10
E: 22.869909 6 04 83 f0 1c 60 10
E: 22.871908 6 04 87 10 5f 40 10
E: 22.878904 6 04 87 10 5f 40 10
E: 22.880908 6 04 83 f0 1c 60 10
E: 22.888907 6 04 83 f0 1c 60 10
E: 22.890903 6 04 87 10 5f 40 10
E: 22.898909 6 04 87 10 5f 40 10
E: 22.900908 6 04 83 f0 1c 60 10
E: 22.907887 6 04 83 f0 1c 60 10
E: 22.909902 6 04 87 10 5f 40 10
E: 22.916906 6 04 87 10 5f 40 10
E: 22.918905 6 04 83 f0 1c 60 10
E: 22.925906 6 04 83 f0 1c 60 10
E: 22.927906 6 04 87 10 5f 40 10
E: 22.934907 6 04 87 10 5f 40 10
E: 22.936906 6 04 83 f0 1c 60 10
E: 22.943909 6 04 83 f0 1c 60 10
E: 22.945904 6 04 87 10 5f 40 10
E: 22.952907 6 04 87 10 5f 40 10
E: 22.954905 6 04 83 f0 1c 60 10
E: 22.961906 6 04 83 f0 1c 60 10
E: 22.963909 6 04 87 10 5f 40 10
E: 22.970907 6 04 87 10 5f 40 10
E: 22.972902 6 04 83 f0 1c 60 10
E: 22.979909 6 04 83 f0 1c 60 10
E: 22.981906 6 04 87 10 5f 40 10
E: 22.988903 6 04 87 10 5f 40 10
E: 22.990907 6 04 83 f0 1c 60 10
E: 22.997908 6 04 83 f0 1c 60 10
E: 22.999906 6 04 87 10 5f 40 10
E: 23.006906 6 04 87 10 5f 40 10
E: 23.008905 6 04 83 f0 1c 60 10
E: 23.015906 6 04 83 f0 1c 60 10
E: 23.017906 6 04 87 10 5f 40 10
E: 23.024907 6 04 87 10 5f 40 10
E: 23.026904 6 04 83 f0 1c 60 10
E: 23.033908 6 04 83 f0 1c 60 10
E: 23.035907 6 04 87 10 5f 40 10
E: 23.042906 6 04 87 10 5f 40 10
E: 23.044907 6 04 83 f0 1c 60 10
E: 23.052905 6 04 83 f0 1c 60 10
E: 23.054903 6 04 87 10 5f 40 10
E: 23.061909 6 04 87 10 5f 40 10
E: 23.063906 6 04 83 f0 1c 60 10
E: 23.070904 6 04 83 f0 1c 60 10
E: 23.072907 6 04 87 10 5f 40 10
E: 23.079907 6 04 87 10 5f 40 10
E: 23.081904 6 04 83 f0 1c 60 10
E: 23.088910 6 04 83 f0 1c 60 10
E: 23.090905 6 04 87 10 5f 40 10
E: 23.097907 6 04 87 10 5f 40 10
E: 23.099910 6 04 83 f0 1c 60 10
E: 23.106908 6 04 83 f0 1c 60 10
E: 23.108905 6 04 87 10 5f 40 10
E: 23.115910 6 04 87 10 5f 40 10
E: 23.117904 6 04 83 f0 1c 60 10
E: 23.124906 6 04 83 f0 1c 60 10
E: 23.126908 6 04 87 10 5f 40 10
E: 23.133906 6 04 87 10 5f 40 10
E: 23.135906 6 04 83 f0 1c 60 10
E: 23.142922 6 04 83 f0 1c 80 10
E: 23.144908 6 04 87 10 5f 40 10
E: 23.151908 6 04 87 10 5f 40 10
E: 23.153908 6 04 83 f0 1c 80 10
E: 23.161904 6 04 83 f0 1c 80 10
E: 23.163906 6 04 87 10 5f 40 10
E: 23.170909 6 04 87 10 5f 40 10
E: 23.172907 6 04 83 f0 1c 80 10
E: 23.179905 6 04 83 f0 1c 80 10
E: 23.181904 6 04 87 10 5f 40 10
E: 23.188908 6 04 87 10 5f 40 10
E: 23.190905 6 04 83 f0 1c 80 10
E: 23.197907 6 04 83 f0 1c 80 10
E: 23.199908 6 04 87 10 5f 40 10
E: 23.206906 6 04 87 10 5f 40 10
E: 23.208906 6 04 83 f0 1c 80 10
E: 23.215906 6 04 83 f0 1c 80 10
E: 23.217903 6 04 87 10 5f 40 10
E: 23.224907 6 04 87 10 5f 40 10
E: 23.226904 6 04 83 f0 1c 80 10
E: 23.234904 6 04 83 f0 1c 80 10
E: 23.236908 6 04 87 10 5f 40 10
E: 23.243907 6 04 87 10 5f 40 10
E: 23.245904 6 04 83 f0 1c 80 10
E: 23.252909 6 04 83 f0 1c 80 10
E: 23.254904 6 04 87 10 5f 40 10
E: 23.261903 6 04 87 10 5f 40 10
E: 23.263909 6 04 83 f0 1c 80 10
E: 23.270905 6 04 83 f0 1c 80 10
E: 23.272905 6 04 87 10 5f 40 10
E: 23.279910 6 04 87 10 5f 40 10
E: 23.282003 6 04 83 f0 1c 80 10
E: 23.288907 6 04 83 f0 1c 80 10
E: 23.290906 6 04 87 10 5f 40 10
E: 23.297908 6 04 87 10 5f 40 10
E: 23.299906 6 04 83 f0 1c 80 10
E: 23.306909 6 04 83 f0 1c 80 10
E: 23.308906 6 04 87 10 5f 40 10
E: 23.315906 6 04 87 10 5f 40 10
E: 23.317907 6 04 83 f0 1c 80 10
E: 23.324906 6 04 83 f0 1c 80 10
E: 23.326905 6 04 87 10 5f 40 10
E: 23.333908 6 04 87 10 5f 40 10
E: 23.335906 6 04 83 f0 1c 80 10
E: 23.342904 6 04 83 f0 1c 80 10
E: 23.344906 6 04 87 10 5f 40 10
E: 23.351905 6 04 87 10 5f 40 10
E: 23.353903 6 04 83 f0 1c 80 10
E: 23.360909 6 04 83 f0 1c 80 10
E: 23.362904 6 04 87 10 5f 40 10
E: 23.369906 6 04 87 10 5f 40 10
E: 23.371909 6 04 83 f0 1c 80 10
E: 23.378907 6 04 83 f0 1c 80 10
E: 23.380905 6 04 87 10 5f 40 10
E: 23.387910 6 04 87 10 5f 40 10
E: 23.389901 6 04 83 f0 1c 80 10
E: 23.396904 6 04 83 f0 1c 80 10
E: 23.398907 6 04 87 10 5f 40 10
E: 23.406901 6 04 87 10 5f 40 10
E: 23.408903 6 04 83 f0 1c 80 10
E: 23.416907 6 04 83 f0 1c 80 10
E: 23.418904 6 04 87 10 5f 40 10
E: 23.425905 6 04 87 10 5f 40 10
E: 23.427906 6 04 83 f0 1c 80 10
E: 23.434910 6 04 83 f0 1c 80 10
E: 23.436904 6 04 87 10 5f 40 10
E: 23.443970 6 04 87 10 5f 40 10
E: 23.445904 6 04 83 f0 1c 80 10
E: 23.452902 6 04 83 f0 1c 80 10
E: 23.454909 6 04 87 10 5f 40 10
E: 23.461907 6 04 87 10 5f 40 10
E: 23.463906 6 04 83 f0 1c 80 10
E: 23.470905 6 04 83 f0 1c 80 10
E: 23.472855 6 04 87 10 5f 40 10
E: 23.479917 6 04 87 10 5f 40 10
E: 23.481907 6 04 83 f0 1c 80 10
E: 23.488908 6 04 83 f0 1c 80 10
E: 23.490906 6 04 87 10 5f 40 10
E: 23.497908 6 04 87 10 5f 40 10
E: 23.499906 6 04 83 f0 1c 80 10
E: 23.506905 6 04 83 f0 1c 80 10
E: 23.508906 6 04 87 10 5f 40 10
E: 23.515905 6 04 87 10 5f 40 10
E: 23.523910 6 04 87 10 5f 40 10
E: 23.530907 6 04 87 10 5f 40 10
E: 23.538910 6 04 87 10 5f 40 10
E: 23.546908 6 04 87 10 5f 40 10
E: 23.553908 6 04 87 10 5f 40 10
E: 23.555919 6 04 83 f0 1c 90 10
E: 23.557916 6 04 82 f0 1c 90 10
E: 23.561951 6 04 87 10 5f 40 10
E: 23.570035 6 04 87 10 5f 40 10
E: 23.576863 6 04 87 10 5f 40 10
E: 23.584852 6 04 87 10 5f 40 10
E: 23.592880 6 04 87 10 5f 40 10
E: 23.599864 6 04 87 10 5f 40 10
E: 23.607844 6 04 87 10 5f 40 10
E: 23.615835 6 04 87 10 5f 40 10
E: 23.622895 6 04 87 10 5f 40 10
E: 23.630872 6 04 87 10 5f 40 10
E: 23.637832 6 04 87 10 5f 40 10
E: 23.645834 6 04 87 10 5f 40 10
E: 23.653834 6 04 87 10 5f 40 10
E: 23.660857 6 04 87 10 5f 40 10
E: 23.669861 6 04 87 10 5f 40 10
E: 23.677955 6 04 87 10 5f 40 10
E: 23.684898 6 04 87 10 5f 40 10
E: 23.692906 6 04 87 10 5f 40 10
E: 23.700920 6 04 87 10 5f 40 10
E: 23.707905 6 04 87 10 5f 40 10
E: 23.715902 6 04 87 10 5f 40 10
E: 23.722903 6 04 87 10 5f 40 10
E: 23.730912 6 04 87 10 5f 40 10
E: 23.738925 6 04 87 10 5f 40 10
E: 23.745881 6 04 87 10 5f 40 10
E: 23.753952 6 04 87 10 5f 40 10
E: 23.761945 6 04 87 10 5f 40 10
E: 23.768943 6 04 87 10 5f 40 10
E: 23.776922 6 04 87 10 5f 40 10
E: 23.784927 6 04 87 10 5f 40 10
E: 23.791909 6 04 87 10 5f 40 10
E: 23.799926 6 04 87 10 5f 40 10
E: 23.807910 6 04 87 10 5f 40 10
E: 23.814906 6 04 87 10 5f 40 10
E: 23.822903 6 04 87 10 5f 40 10
E: 23.829902 6 04 87 10 5f 40 10
E: 23.837914 6 04 87 10 5f 40 10
E: 23.845907 6 04 87 10 5f 40 10
E: 23.852904 6 04 87 10 5f 40 10
E: 23.860903 6 04 87 10 5f 40 10
E: 23.868915 6 04 87 10 5f 40 10
E: 23.875915 6 04 87 10 5f 40 10
E: 23.883908 6 04 87 10 5f 40 10
E: 23.890904 6 04 87 10 5f 40 10
E: 23.898914 6 04 87 10 5f 40 10
E: 23.906900 6 04 87 10 5f 40 10
E: 23.913907 6 04 87 10 5f 40 10
E: 23.921905 6 04 87 10 5f 40 10
E: 23.930857 6 04 87 10 5f 40 10
E: 23.937914 6 04 87 10 5f 40 10
E: 23.945863 6 04 87 10 5f 40 10
E: 23.953935 6 04 87 10 5f 40 10
E: 23.960910 6 04 87 10 5f 40 10
E: 23.968924 6 04 87 10 5f 40 10
E: 23.975909 6 04 87 10 5f 40 10
E: 23.983906 6 04 87 10 5f 40 10
E: 23.991903 6 04 87 10 5f 40 10
E: 23.998863 6 04 87 10 5f 40 10
E: 24.006912 6 04 87 10 5f 40 10
E: 24.014905 6 04 87 10 5f 40 10
E: 24.021903 6 04 87 10 5f 40 10
E: 24.029902 6 04 87 10 5f 40 10
E: 24.037914 6 04 87 10 5f 40 10
E: 24.044907 6 04 87 10 5f 40 10
E: 24.052904 6 04 87 10 5f 40 10
E: 24.059903 6 04 87 10 5f 40 10
E: 24.067916 6 04 87 10 5f 40 10
E: 24.075908 6 04 87 10 5f 40 10
E: 24.082905 6 04 87 10 5f 40 10
E: 24.090904 6 04 87 10 5f 40 10
E: 24.098904 6 04 87 10 5f 40 10
E: 24.105907 6 04 87 10 5f 40 10
E: 24.113903 6 04 87 10 5f 40 10
E: 24.121902 6 04 87 10 5f 40 10
E: 24.128902 6 04 87 10 5f 40 10
E: 24.136903 6 04 87 10 5f 40 10
E: 24.144902 6 04 87 10 5f 40 10
E: 24.151836 6 04 87 10 5f 40 10
E: 24.159902 6 04 87 10 5f 40 10
E: 24.166903 6 04 87 10 5f 40 10
E: 24.174902 6 04 87 10 5f 40 10
E: 24.182901 6 04 87 10 5f 40 10
E: 24.190900 6 04 87 10 5f 40 10
E: 24.198901 6 04 87 10 5f 40 10
E: 24.206901 6 04 87 10 5f 40 10
E: 24.213902 6 04 87 10 5f 40 10
E: 24.221901 6 04 87 10 5f 40 10
E: 24.228901 6 04 87 10 5f 40 10
E: 24.236902 6 04 87 10 5f 40 10
E: 24.244902 6 04 87 10 5f 40 10
E: 24.251901 6 04 87 10 5f 40 10
E: 24.259902 6 04 87 10 5f 40 10
E: 24.267901 6 04 87 10 5f 40 10
E: 24.274903 6 04 87 10 5f 40 10
E: 24.282902 6 04 87 10 5f 40 10
E: 24.290903 6 04 87 10 5f 40 10
E: 24.297901 6 04 87 10 5f 40 10
E: 24.305905 6 04 87 10 5f 40 10
E: 24.313902 6 04 87 10 5f 40 10
E: 24.320902 6 04 87 10 5f 40 10
E: 24.328900 6 04 87 10 5f 40 10
E: 24.335904 6 04 87 10 5f 40 10
E: 24.343901 6 04 87 10 5f 40 10
E: 24.351902 6 04 87 10 5f 40 10
E: 24.358901 6 04 87 10 5f 40 10
E: 24.366902 6 04 87 10 5f 40 10
E: 24.374900 6 04 87 10 5f 40 10
E: 24.381901 6 04 87 10 5f 40 10
E: 24.389903 6 04 87 10 5f 40 10
E: 24.397903 6 04 87 10 5f 40 10
E: 24.404904 6 04 87 10 5f 40 10
E: 24.412904 6 04 87 10 5f 40 10
E: 24.419900 6 04 87 10 5f 40 10
E: 24.427902 6 04 87 10 5f 40 10
E: 24.435907 6 04 87 10 5f 40 10
E: 24.443942 6 04 87 10 5f 40 10
E: 24.451901 6 04 87 10 5f 40 10
E: 24.459903 6 04 87 10 5f 40 10
E: 24.466903 6 04 87 10 5f 40 10
E: 24.474913 6 04 87 10 5f 40 10
E: 24.481906 6 04 87 10 5f 40 10
E: 24.489903 6 04 87 10 5f 40 10
E: 24.497902 6 04 87 10 5f 40 10
E: 24.504903 6 04 87 10 5f 40 10
E: 24.512902 6 04 87 10 5f 40 10
E: 24.520902 6 04 87 10 5f 40 10
E: 24.527901 6 04 87 10 5f 40 10
E: 24.535903 6 04 87 10 5f 40 10
E: 24.543901 6 04 87 10 5f 40 10
E: 24.550902 6 04 87 10 5f 40 10
E: 24.558902 6 04 87 10 5f 40 10
E: 24.566901 6 04 87 10 5f 40 10
E: 24.573902 6 04 87 10 5f 40 10
E: 24.581903 6 04 87 10 5f 40 10
E: 24.588902 6 04 87 10 5f 40 10
E: 24.596902 6 04 87 10 5f 40 10
E: 24.604899 6 04 87 10 5f 40 10
E: 24.611901 6 04 87 10 5f 40 10
E: 24.619901 6 04 87 10 5f 40 10
E: 24.627907 6 04 87 10 5f 40 10
E: 24.634904 6 04 87 10 5f 40 10
E: 24.642904 6 04 87 10 5f 40 10
E: 24.650899 6 04 87 10 5f 40 10
E: 24.657904 6 04 87 10 5f 40 10
E: 24.665902 6 04 87 10 5f 40 10
E: 24.672902 6 04 87 10 5f 40 10
E: 24.680907 6 04 87 10 5f 40 10
E: 24.688905 6 04 87 10 5f 40 10
E: 24.695901 6 04 87 10 5f 40 10
E: 24.704903 6 04 87 10 5f 40 10
E: 24.712901 6 04 87 10 5f 40 10
E: 24.719905 6 04 87 10 5f 40 10
E: 24.727901 6 04 87 10 5f 40 10
E: 24.735903 6 04 87 10 5f 40 10
E: 24.742903 6 04 87 10 5f 40 10
E: 24.750901 6 04 87 10 5f 40 10
E: 24.757904 6 04 87 10 5f 40 10
E: 24.765902 6 04 87 10 5f 40 10
E: 24.773902 6 04 87 10 5f 40 10
E: 24.780901 6 04 87 10 5f 40 10
E: 24.788901 6 04 87 10 5f 40 10
E: 24.796901 6 04 87 10 5f 40 10
E: 24.803901 6 04 87 10 5f 40 10
E: 24.811902 6 04 87 10 5f 40 10
E: 24.819902 6 04 87 10 5f 40 10
E: 24.826903 6 04 87 10 5f 40 10
E: 24.834901 6 04 87 10 5f 40 10
E: 24.841901 6 04 87 10 5f 40 10
E: 24.849902 6 04 87 10 5f 40 10
E: 24.857902 6 04 87 10 5f 40 10
E: 24.864902 6 04 87 10 5f 40 10
E: 24.872903 6 04 87 10 5f 40 10
E: 24.880901 6 04 87 10 5f 40 10
E: 24.887904 6 04 87 10 5f 40 10
E: 24.895838 6 04 87 10 5f 40 10
E: 24.903903 6 04 87 10 5f 40 10
E: 24.910900 6 04 87 10 5f 40 10
E: 24.918904 6 04 87 10 5f 40 10
E: 24.925903 6 04 87 10 5f 40 10
E: 24.933903 6 04 87 10 5f 40 10
E: 24.941901 6 04 87 10 5f 40 10
E: 24.948900 6 04 87 10 5f 40 10
E: 24.956900 6 04 87 10 5f 40 10
E: 24.965901 6 04 87 10 5f 40 10
E: 24.972901 6 04 87 10 5f 40 10
E: 24.980900 6 04 87 10 5f 40 10
E: 24.987900 6 04 87 10 5f 40 10
E: 24.995902 6 04 87 10 5f 40 10
E: 25.003900 6 04 87 10 5f 40 10
E: 25.010901 6 04 87 10 5f 40 10
E: 25.018903 6 04 87 10 5f 40 10
E: 25.026903 6 04 87 10 5f 40 10
E: 25.033903 6 04 87 10 5f 40 10
E: 25.041902 6 04 87 10 5f 40 10
E: 25.049901 6 04 87 10 5f 40 10
E: 25.056901 6 04 87 10 5f 40 10
E: 25.064852 6 04 87 10 5f 40 10
E: 25.072903 6 04 87 10 5f 40 10
E: 25.079910 6 04 87 10 5f 40 10
E: 25.087906 6 04 87 10 5f 40 10
E: 25.095902 6 04 87 10 5f 40 10
E: 25.102904 6 04 87 10 5f 40 10
E: 25.110902 6 04 87 10 5f 40 10
E: 25.117903 6 04 87 10 5f 40 10
E: 25.125901 6 04 87 10 5f 40 10
E: 25.133903 6 04 87 10 5f 40 10
E: 25.140903 6 04 87 10 5f 40 10
E: 25.148904 6 04 87 10 5f 40 10
E: 25.156900 6 04 87 10 5f 40 10
E: 25.163902 6 04 87 10 5f 40 10
E: 25.171901 6 04 87 10 5f 40 10
E: 25.179903 6 04 87 10 5f 40 10
E: 25.186901 6 04 87 10 5f 40 10
E: 25.194902 6 04 87 10 5f 40 10
E: 25.201902 6 04 87 10 5f 40 10
E: 25.209903 6 04 87 10 5f 40 10
E: 25.218902 6 04 87 10 5f 40 10
E: 25.225902 6 04 87 10 5f 40 10
E: 25.233903 6 04 87 10 5f 40 10
E: 25.241901 6 04 87 10 5f 40 10
E: 25.248901 6 04 87 10 5f 40 10
E: 25.256903 6 04 87 10 5f 40 10
E: 25.263900 6 04 87 10 5f 40 10
E: 25.271906 6 04 87 10 5f 40 10
E: 25.279901 6 04 87 10 5f 40 10
E: 25.286904 6 04 87 10 5f 40 10
E: 25.294903 6 04 87 10 5f 40 10
E: 25.302902 6 04 87 10 5f 40 10
E: 25.309902 6 04 87 10 5f 40 10
E: 25.317904 6 04 87 10 5f 40 10
E: 25.325901 6 04 87 10 5f 40 10
E: 25.332903 6 04 87 10 5f 40 10
E: 25.340901 6 04 87 10 5f 40 10
E: 25.348904 6 04 87 10 5f 40 10
E: 25.355901 6 04 87 10 5f 40 10
E: 25.363902 6 04 87 10 5f 40 10
E: 25.370902 6 04 87 10 5f 40 10
E: 25.378903 6 04 87 10 5f 40 10
E: 25.386914 6 04 87 10 5f 40 10
E: 25.393904 6 04 87 10 5f 40 10
E: 25.401903 6 04 87 10 5f 40 10
E: 25.409901 6 04 87 10 5f 40 10
E: 25.416903 6 04 87 10 5f 40 10
E: 25.424904 6 04 87 10 5f 40 10
E: 25.431901 6 04 87 10 5f 40 10
E: 25.439906 6 04 87 10 5f 40 10
E: 25.447897 6 04 87 10 5f 40 10
E: 25.454901 6 04 87 10 5f 40 10
E: 25.462902 6 04 87 10 5f 40 10
E: 25.470903 6 04 87 10 5f 40 10
E: 25.478902 6 04 87 10 5f 40 10
E: 25.486902 6 04 87 10 5f 40 10
E: 25.493900 6 04 87 10 5f 40 10
E: 25.501901 6 04 87 10 5f 40 10
E: 25.509902 6 04 87 10 5f 40 10
E: 25.516901 6 04 87 10 5f 40 10
E: 25.524899 6 04 87 10 5f 40 10
E: 25.532905 6 04 87 10 5f 40 10
E: 25.539903 6 04 87 10 5f 40 10
E: 25.547902 6 04 87 10 5f 40 10
E: 25.554899 6 04 87 10 5f 40 10
E: 25.562901 6 04 87 10 5f 40 10
E: 25.570902 6 04 87 10 5f 40 10
E: 25.577902 6 04 87 10 5f 40 10
E: 25.585901 6 04 87 10 5f 40 10
E: 25.625919 6 04 87 10 5f 50 10
E: 25.627906 6 04 86 10 5f 50 10
# 3. Finally, move your ten fingers on the screen and release them.
E: 32.221995 6 04 83 80 0a a0 1a
E: 32.228959 6 04 83 80 0a a0 1a
E: 32.236912 6 04 83 80 0a a0 1a
E: 32.244934 6 04 83 80 0a a0 1a
E: 32.251921 6 04 83 80 0a a0 1a
E: 32.259909 6 04 83 80 0a a0 1a
E: 32.266907 6 04 83 80 0a a0 1a
E: 32.274906 6 04 83 80 0a a0 1a
E: 32.282916 6 04 83 80 0a a0 1a
E: 32.289925 6 04 83 80 0a c0 1a
E: 32.297927 6 04 83 80 0a c0 1a
E: 32.305929 6 04 83 80 0a e0 1a
E: 32.312923 6 04 83 80 0a e0 1a
E: 32.320909 6 04 83 80 0a e0 1a
E: 32.328908 6 04 83 80 0a e0 1a
E: 32.335854 6 04 83 80 0a e0 1a
E: 32.343913 6 04 83 80 0a e0 1a
E: 32.350910 6 04 83 80 0a e0 1a
E: 32.358909 6 04 83 80 0a e0 1a
E: 32.366905 6 04 83 80 0a e0 1a
E: 32.373909 6 04 83 80 0a e0 1a
E: 32.381905 6 04 83 80 0a e0 1a
E: 32.389907 6 04 83 80 0a e0 1a
E: 32.396906 6 04 83 80 0a e0 1a
E: 32.404908 6 04 83 80 0a e0 1a
E: 32.412903 6 04 83 80 0a e0 1a
E: 32.419904 6 04 83 80 0a e0 1a
E: 32.427903 6 04 83 80 0a e0 1a
E: 32.435164 6 04 83 80 0a e0 1a
E: 32.443901 6 04 83 80 0a e0 1a
E: 32.452918 6 04 83 80 0a 00 1b
E: 32.462923 6 04 83 80 0a 00 1b
E: 32.473914 6 04 83 80 0a 00 1b
E: 32.483906 6 04 83 80 0a 00 1b
E: 32.485927 6 04 87 30 14 c0 10
E: 32.493911 6 04 83 80 0a 00 1b
E: 32.495906 6 04 87 30 14 c0 10
E: 32.503916 6 04 87 30 14 c0 10
E: 32.505907 6 04 83 80 0a 00 1b
E: 32.513908 6 04 83 80 0a 00 1b
E: 32.515911 6 04 87 30 14 c0 10
E: 32.523906 6 04 87 30 14 c0 10
E: 32.525904 6 04 83 80 0a 00 1b
E: 32.534911 6 04 83 80 0a 00 1b
E: 32.536908 6 04 87 30 14 c0 10
E: 32.544907 6 04 87 30 14 c0 10
E: 32.546907 6 04 83 80 0a 00 1b
E: 32.554908 6 04 83 80 0a 00 1b
E: 32.556906 6 04 87 30 14 c0 10
E: 32.564909 6 04 87 30 14 c0 10
E: 32.566905 6 04 83 80 0a 00 1b
E: 32.575911 6 04 83 80 0a 00 1b
E: 32.577905 6 04 87 30 14 c0 10
E: 32.585905 6 04 87 30 14 c0 10
E: 32.587908 6 04 83 80 0a 00 1b
E: 32.595906 6 04 83 80 0a 00 1b
E: 32.597903 6 04 87 30 14 c0 10
E: 32.605911 6 04 87 30 14 c0 10
E: 32.607907 6 04 83 80 0a 00 1b
E: 32.615907 6 04 83 80 0a 00 1b
E: 32.617905 6 04 87 30 14 c0 10
E: 32.626907 6 04 87 30 14 c0 10
E: 32.628907 6 04 83 80 0a 00 1b
E: 32.636907 6 04 83 80 0a 00 1b
E: 32.638904 6 04 87 30 14 c0 10
E: 32.646910 6 04 87 30 14 c0 10
E: 32.648907 6 04 83 80 0a 00 1b
E: 32.656907 6 04 83 80 0a 00 1b
E: 32.658906 6 04 87 30 14 c0 10
E: 32.667906 6 04 87 30 14 c0 10
E: 32.670162 6 04 83 80 0a 00 1b
E: 32.677882 6 04 83 80 0a 00 1b
E: 32.679915 6 04 87 30 14 c0 10
E: 32.687935 6 04 87 30 14 c0 10
E: 32.689908 6 04 83 80 0a 00 1b
E: 32.697921 6 04 83 80 0a 00 1b
E: 32.699914 6 04 87 30 14 c0 10
E: 32.708913 6 04 87 30 14 c0 10
E: 32.710908 6 04 83 80 0a 00 1b
E: 32.719908 6 04 83 80 0a 00 1b
E: 32.721907 6 04 87 30 14 c0 10
E: 32.729908 6 04 87 30 14 c0 10
E: 32.731907 6 04 83 80 0a 00 1b
E: 32.739909 6 04 83 80 0a 00 1b
E: 32.741905 6 04 87 30 14 c0 10
E: 32.749908 6 04 87 30 14 c0 10
E: 32.751907 6 04 83 80 0a 00 1b
E: 32.759906 6 04 83 80 0a 00 1b
E: 32.761854 6 04 87 30 14 c0 10
E: 32.770947 6 04 87 30 14 c0 10
E: 32.772906 6 04 83 80 0a 00 1b
E: 32.781926 6 04 83 80 0a 00 1b
E: 32.783917 6 04 87 30 14 c0 10
E: 32.793913 6 04 83 80 0a 00 1b
E: 32.795910 6 04 87 30 14 c0 10
E: 32.805967 6 04 87 30 14 c0 10
E: 32.807908 6 04 83 80 0a 00 1b
E: 32.817909 6 04 83 80 0a 00 1b
E: 32.819909 6 04 87 30 14 c0 10
E: 32.829904 6 04 83 80 0a 00 1b
E: 32.831836 6 04 87 30 14 c0 10
E: 32.841908 6 04 87 30 14 c0 10
E: 32.843907 6 04 83 80 0a 00 1b
E: 32.853907 6 04 83 80 0a 00 1b
E: 32.855907 6 04 87 30 14 c0 10
E: 32.864906 6 04 83 80 0a 00 1b
E: 32.866905 6 04 87 30 14 c0 10
E: 32.876909 6 04 87 30 14 c0 10
E: 32.878904 6 04 83 80 0a 00 1b
E: 32.888908 6 04 83 80 0a 00 1b
E: 32.890904 6 04 87 30 14 c0 10
E: 32.900911 6 04 83 80 0a 00 1b
E: 32.902906 6 04 87 30 14 c0 10
E: 32.912910 6 04 87 30 14 c0 10
E: 32.914904 6 04 83 80 0a 00 1b
E: 32.924908 6 04 83 80 0a 00 1b
E: 32.926905 6 04 87 30 14 c0 10
E: 32.936925 6 04 83 80 0a 00 1b
E: 32.938909 6 04 87 30 14 c0 10
E: 32.947916 6 04 87 30 14 c0 10
E: 32.949906 6 04 83 80 0a 00 1b
E: 32.960915 6 04 83 80 0a 00 1b
E: 32.962908 6 04 87 30 14 c0 10
E: 32.972909 6 04 83 80 0a 00 1b
E: 32.974905 6 04 87 30 14 c0 10
E: 32.984910 6 04 87 30 14 c0 10
E: 32.986905 6 04 83 80 0a 00 1b
E: 32.996909 6 04 83 80 0a 00 1b
E: 32.998904 6 04 87 30 14 c0 10
E: 33.008910 6 04 83 80 0a 00 1b
E: 33.010906 6 04 87 30 14 c0 10
E: 33.019910 6 04 87 30 14 c0 10
E: 33.021925 6 04 83 80 0a 30 1b
E: 33.031932 6 04 83 80 0a 30 1b
E: 33.033916 6 04 87 30 14 c0 10
E: 33.043932 6 04 83 90 0a 60 1b
E: 33.045921 6 04 87 30 14 c0 10
E: 33.055922 6 04 87 30 14 c0 10
E: 33.057911 6 04 83 90 0a 60 1b
E: 33.068916 6 04 83 90 0a 60 1b
E: 33.070908 6 04 87 30 14 c0 10
E: 33.082921 6 04 87 30 14 c0 10
E: 33.084910 6 04 83 90 0a 60 1b
E: 33.095914 6 04 83 90 0a 60 1b
E: 33.097910 6 04 87 30 14 c0 10
E: 33.109911 6 04 83 90 0a 60 1b
E: 33.111908 6 04 87 30 14 c0 10
E: 33.122910 6 04 83 90 0a 60 1b
E: 33.124909 6 04 87 30 14 c0 10
E: 33.136911 6 04 87 30 14 c0 10
E: 33.138907 6 04 83 90 0a 60 1b
E: 33.149910 6 04 83 90 0a 60 1b
E: 33.151907 6 04 87 30 14 c0 10
E: 33.163910 6 04 83 90 0a 60 1b
E: 33.165905 6 04 87 30 14 c0 10
E: 33.176909 6 04 83 90 0a 60 1b
E: 33.178907 6 04 87 30 14 c0 10
E: 33.190909 6 04 87 30 14 c0 10
E: 33.192907 6 04 83 90 0a 60 1b
E: 33.203911 6 04 83 90 0a 60 1b
E: 33.205906 6 04 87 30 14 c0 10
E: 33.218910 6 04 83 90 0a 60 1b
E: 33.220907 6 04 87 30 14 c0 10
E: 33.231909 6 04 83 90 0a 60 1b
E: 33.233863 6 04 87 30 14 c0 10
E: 33.245916 6 04 87 30 14 c0 10
E: 33.247909 6 04 83 90 0a 60 1b
E: 33.258909 6 04 83 90 0a 60 1b
E: 33.260908 6 04 87 30 14 c0 10
E: 33.272913 6 04 83 90 0a 60 1b
E: 33.274907 6 04 87 30 14 c0 10
E: 33.285911 6 04 83 90 0a 60 1b
E: 33.287907 6 04 87 30 14 c0 10
E: 33.299914 6 04 87 30 14 c0 10
E: 33.301908 6 04 83 90 0a 60 1b
E: 33.312911 6 04 83 90 0a 60 1b
E: 33.314907 6 04 87 30 14 c0 10
E: 33.326912 6 04 83 90 0a 60 1b
E: 33.328919 6 04 87 30 14 a0 10
E: 33.339911 6 04 83 90 0a 60 1b
E: 33.341906 6 04 87 30 14 a0 10
E: 33.353910 6 04 87 30 14 a0 10
E: 33.355907 6 04 83 90 0a 60 1b
E: 33.366908 6 04 83 90 0a 60 1b
E: 33.368907 6 04 87 30 14 a0 10
E: 33.380910 6 04 83 90 0a 60 1b
E: 33.382905 6 04 87 30 14 a0 10
E: 33.393909 6 04 83 90 0a 60 1b
E: 33.395908 6 04 87 30 14 a0 10
E: 33.407910 6 04 87 30 14 a0 10
E: 33.409905 6 04 83 90 0a 60 1b
E: 33.427911 6 04 87 30 14 a0 10
E: 33.429906 6 04 83 90 0a 60 1b
E: 33.446911 6 04 83 90 0a 60 1b
E: 33.448906 6 04 87 30 14 a0 10
E: 33.466910 6 04 83 90 0a 60 1b
E: 33.468908 6 04 87 30 14 a0 10
E: 33.487920 6 04 83 90 0a 60 1b
E: 33.489908 6 04 87 30 14 a0 10
E: 33.507930 6 04 83 b0 0a 90 1b
E: 33.509865 6 04 87 30 14 a0 10
E: 33.527920 6 04 87 30 14 a0 10
E: 33.529927 6 04 83 c0 0a b0 1b
E: 33.547945 6 04 83 c0 0a b0 1b
E: 33.549909 6 04 87 30 14 a0 10
E: 33.567938 6 04 83 d0 0a d0 1b
E: 33.569918 6 04 87 30 14 a0 10
E: 33.587920 6 04 83 d0 0a d0 1b
E: 33.589912 6 04 87 30 14 a0 10
E: 33.607915 6 04 83 d0 0a d0 1b
E: 33.609908 6 04 87 30 14 a0 10
E: 33.627911 6 04 87 30 14 a0 10
E: 33.629908 6 04 83 d0 0a d0 1b
E: 33.646915 6 04 83 d0 0a d0 1b
E: 33.648910 6 04 87 30 14 a0 10
E: 33.666914 6 04 83 d0 0a d0 1b
E: 33.668910 6 04 87 30 14 a0 10
E: 33.686912 6 04 83 d0 0a d0 1b
E: 33.688910 6 04 87 30 14 a0 10
E: 33.706916 6 04 83 d0 0a d0 1b
E: 33.708911 6 04 87 30 14 a0 10
E: 33.726911 6 04 87 30 14 a0 10
E: 33.728909 6 04 83 d0 0a d0 1b
E: 33.747914 6 04 83 d0 0a d0 1b
E: 33.749907 6 04 87 30 14 a0 10
E: 33.767912 6 04 83 d0 0a d0 1b
E: 33.769907 6 04 87 30 14 a0 10
E: 33.787913 6 04 83 d0 0a d0 1b
E: 33.789907 6 04 87 30 14 a0 10
E: 33.807913 6 04 83 d0 0a d0 1b
E: 33.809906 6 04 87 30 14 a0 10
E: 33.827912 6 04 87 30 14 a0 10
E: 33.829908 6 04 83 d0 0a d0 1b
E: 33.849913 6 04 83 d0 0a d0 1b
E: 33.851909 6 04 87 30 14 a0 10
E: 33.870913 6 04 83 d0 0a d0 1b
E: 33.872909 6 04 87 30 14 a0 10
E: 33.892912 6 04 83 d0 0a d0 1b
E: 33.894906 6 04 87 30 14 a0 10
E: 33.914913 6 04 83 d0 0a d0 1b
E: 33.916911 6 04 87 30 14 a0 10
E: 33.936913 6 04 87 30 14 a0 10
E: 33.938907 6 04 83 d0 0a d0 1b
E: 33.957922 6 04 83 d0 0a d0 1b
E: 33.959912 6 04 87 30 14 a0 10
E: 33.979913 6 04 83 d0 0a d0 1b
E: 33.981908 6 04 87 30 14 a0 10
E: 34.002923 6 04 83 d0 0a d0 1b
E: 34.004911 6 04 87 30 14 a0 10
E: 34.024914 6 04 83 d0 0a d0 1b
E: 34.026908 6 04 87 30 14 a0 10
E: 34.045915 6 04 83 d0 0a d0 1b
E: 34.047910 6 04 87 30 14 a0 10
E: 34.067913 6 04 87 30 14 a0 10
E: 34.069902 6 04 83 d0 0a d0 1b
E: 34.089917 6 04 83 d0 0a d0 1b
E: 34.091912 6 04 87 30 14 a0 10
E: 34.111912 6 04 83 d0 0a d0 1b
E: 34.113907 6 04 87 30 14 a0 10
E: 34.133913 6 04 83 d0 0a d0 1b
E: 34.135908 6 04 87 30 14 a0 10
E: 34.154927 6 04 83 d0 0a d0 1b
E: 34.156914 6 04 87 30 14 a0 10
E: 34.176914 6 04 87 30 14 a0 10
E: 34.178908 6 04 83 d0 0a d0 1b
E: 34.198914 6 04 83 d0 0a d0 1b
E: 34.200910 6 04 87 30 14 a0 10
E: 34.220913 6 04 83 d0 0a d0 1b
E: 34.222907 6 04 87 30 14 a0 10
E: 34.241911 6 04 83 d0 0a d0 1b
E: 34.243910 6 04 87 30 14 a0 10
E: 34.264912 6 04 83 d0 0a d0 1b
E: 34.266908 6 04 87 30 14 a0 10
E: 34.286921 6 04 87 30 14 a0 10
E: 34.288911 6 04 83 d0 0a d0 1b
E: 34.308915 6 04 83 d0 0a d0 1b
E: 34.310908 6 04 87 30 14 a0 10
E: 34.330911 6 04 83 d0 0a d0 1b
E: 34.332910 6 04 87 30 14 a0 10
E: 34.365910 6 04 83 d0 0a d0 1b
E: 34.367924 6 04 87 20 14 80 10
E: 34.389904 6 04 83 d0 0a d0 1b
E: 34.391903 6 04 87 20 14 80 10
E: 34.412922 6 04 87 20 14 60 10
E: 34.414908 6 04 83 d0 0a d0 1b
E: 34.447914 6 04 83 d0 0a d0 1b
E: 34.449919 6 04 87 20 14 40 10
E: 34.471924 6 04 83 d0 0a d0 1b
E: 34.473913 6 04 87 20 14 40 10
E: 34.495925 6 04 83 d0 0a d0 1b
E: 34.497926 6 04 87 20 14 20 10
E: 34.531919 6 04 83 d0 0a d0 1b
E: 34.533909 6 04 87 20 14 20 10
E: 34.555925 6 04 87 20 14 00 10
E: 34.557907 6 04 83 d0 0a d0 1b
E: 34.579912 6 04 83 d0 0a d0 1b
E: 34.581907 6 04 87 20 14 00 10
E: 34.619910 6 04 87 20 14 00 10
E: 34.621906 6 04 83 d0 0a d0 1b
E: 34.643908 6 04 83 d0 0a d0 1b
E: 34.645941 6 04 87 20 14 00 10
E: 34.667927 6 04 83 d0 0a d0 1b
E: 34.669910 6 04 87 20 14 00 10
E: 34.706924 6 04 83 d0 0a d0 1b
E: 34.730915 6 04 83 d0 0a d0 1b
E: 34.732924 6 04 87 20 14 20 10
E: 34.753932 6 04 83 d0 0a d0 1b
E: 34.755915 6 04 87 20 14 20 10
E: 34.799919 6 04 83 d0 0a d0 1b
E: 34.801908 6 04 87 20 14 20 10
E: 34.823933 6 04 83 d0 0a d0 1b
E: 34.825911 6 04 87 20 14 20 10
E: 34.846917 6 04 87 20 14 20 10
E: 34.848912 6 04 83 d0 0a d0 1b
E: 34.889918 6 04 83 d0 0a d0 1b
E: 34.913917 6 04 83 d0 0a d0 1b
E: 34.915911 6 04 87 20 14 20 10
E: 34.937911 6 04 83 d0 0a d0 1b
E: 34.939930 6 04 87 20 14 20 10
E: 34.977919 6 04 83 d0 0a d0 1b
E: 35.001915 6 04 87 20 14 20 10
E: 35.003911 6 04 83 d0 0a d0 1b
E: 35.026915 6 04 83 d0 0a d0 1b
E: 35.028910 6 04 87 20 14 20 10
E: 35.093915 6 04 83 d0 0a d0 1b
E: 35.095909 6 04 87 20 14 20 10
E: 35.117913 6 04 83 d0 0a d0 1b
E: 35.119922 6 04 87 20 14 40 10
E: 35.160913 6 04 83 d0 0a d0 1b
E: 35.184913 6 04 83 d0 0a d0 1b
E: 35.186908 6 04 87 20 14 40 10
E: 35.207912 6 04 83 d0 0a d0 1b
E: 35.209907 6 04 87 20 14 40 10
E: 35.280917 6 04 83 d0 0a d0 1b
E: 35.282908 6 04 87 20 14 40 10
E: 35.304916 6 04 87 20 14 40 10
E: 35.306909 6 04 83 d0 0a d0 1b
E: 35.376931 6 04 83 d0 0a d0 1b
E: 35.378922 6 04 87 20 14 70 10
E: 35.398919 6 04 83 d0 0a d0 1b
E: 35.400913 6 04 87 20 14 70 10
E: 35.443914 6 04 87 20 14 70 10
E: 35.467917 6 04 87 20 14 70 10
E: 35.469912 6 04 83 d0 0a d0 1b
E: 35.491932 6 04 83 d0 0a d0 1b
E: 35.493910 6 04 87 20 14 70 10
E: 35.532919 6 04 87 20 14 70 10
E: 35.557915 6 04 83 d0 0a d0 1b
E: 35.559838 6 04 87 20 14 70 10
E: 35.580914 6 04 83 d0 0a d0 1b
E: 35.582908 6 04 87 20 14 70 10
E: 35.652916 6 04 83 d0 0a d0 1b
E: 35.654908 6 04 87 20 14 70 10
E: 35.676929 6 04 83 d0 0a f0 1b
E: 35.678924 6 04 87 20 14 70 10
E: 35.699935 6 04 83 e0 0a 50 1c
E: 35.720946 6 04 83 f0 0a d0 1c
E: 35.742944 6 04 83 00 0b 80 1d
E: 35.764942 6 04 83 10 0b 50 1e
E: 35.766932 6 04 87 c0 14 40 10
E: 35.785935 6 04 83 10 0b 30 1f
E: 35.787932 6 04 87 e0 15 30 10
E: 35.807874 6 04 83 20 0b 20 20
E: 35.809935 6 04 87 20 17 40 10
E: 35.829930 6 04 83 20 0b 10 21
E: 35.831930 6 04 87 40 18 80 10
E: 35.851931 6 04 87 20 19 f0 10
E: 35.853922 6 04 83 20 0b 20 22
E: 35.873934 6 04 87 d0 19 a0 11
E: 35.875923 6 04 83 20 0b 40 23
E: 35.894951 6 04 83 30 0b 70 24
E: 35.896929 6 04 87 40 1a 80 12
E: 35.915936 6 04 83 40 0b 90 25
E: 35.917929 6 04 87 90 1a 70 13
E: 35.936932 6 04 83 50 0b b0 26
E: 35.938925 6 04 87 c0 1a 70 14
E: 35.958947 6 04 87 d0 1a 80 15
E: 35.960928 6 04 83 50 0b e0 27
E: 35.980940 6 04 87 e0 1a 90 16
E: 35.982925 6 04 83 50 0b 10 29
E: 36.001941 6 04 83 50 0b 30 2a
E: 36.003930 6 04 87 e0 1a a0 17
E: 36.023867 6 04 83 50 0b 50 2b
E: 36.025930 6 04 87 e0 1a a0 18
E: 36.044931 6 04 83 50 0b 60 2c
E: 36.046931 6 04 87 e0 1a a0 19
E: 36.066927 6 04 87 d0 1a 90 1a
E: 36.068922 6 04 83 50 0b 70 2d
E: 36.088058 6 04 87 d0 1a 70 1b
E: 36.089920 6 04 83 50 0b 80 2e
E: 36.109934 6 04 83 50 0b 90 2f
E: 36.111932 6 04 87 c0 1a 60 1c
E: 36.130932 6 04 83 50 0b 90 30
E: 36.132927 6 04 87 c0 1a 60 1d
E: 36.151935 6 04 83 50 0b 80 31
E: 36.153929 6 04 87 b0 1a 70 1e
E: 36.172929 6 04 83 50 0b 80 32
E: 36.193934 6 04 83 50 0b 90 33
E: 36.214933 6 04 83 50 0b b0 34
E: 36.236933 6 04 83 50 0b d0 35
E: 36.257931 6 04 83 50 0b f0 36
E: 36.278932 6 04 83 50 0b 10 38
E: 36.280928 6 04 87 b0 1a 10 20
E: 36.282918 6 04 86 b0 1a 10 20
E: 36.300930 6 04 83 50 0b 40 39
E: 36.302929 6 04 87 70 4b 10 4f
E: 36.321924 6 04 87 70 4b 10 4f
E: 36.323926 6 04 83 50 0b 60 3a
E: 36.342937 6 04 87 60 4b 40 4f
E: 36.344924 6 04 83 50 0b 80 3b
E: 36.363934 6 04 83 50 0b 90 3c
E: 36.365925 6 04 87 60 4b a0 4f
E: 36.385928 6 04 87 60 4b 20 50
E: 36.387924 6 04 83 50 0b b0 3d
E: 36.406936 6 04 87 60 4b b0 50
E: 36.408925 6 04 83 50 0b d0 3e
E: 36.426935 6 04 87 70 4b 50 51
E: 36.428925 6 04 83 50 0b 00 40
E: 36.448939 6 04 83 50 0b 20 41
E: 36.469941 6 04 83 50 0b 30 42
E: 36.490935 6 04 87 80 4b 30 52
E: 36.511931 6 04 87 90 4b 50 53
E: 36.513925 6 04 83 60 0b 60 43
E: 36.533932 6 04 83 60 0b a0 44
E: 36.554951 6 04 83 60 0b e0 45
E: 36.575945 6 04 83 70 0b 10 47
E: 36.597937 6 04 83 70 0b 40 48
E: 36.618938 6 04 83 70 0b 70 49
E: 36.639939 6 04 83 80 0b 90 4a
E: 36.641927 6 04 87 a0 4b 30 55
E: 36.643919 6 04 86 a0 4b 30 55
E: 36.660926 6 04 83 80 0b a0 4b
E: 36.662928 6 04 87 00 23 e0 3f
E: 36.683940 6 04 83 80 0b b0 4c
E: 36.685929 6 04 87 f0 22 00 40
E: 36.703933 6 04 87 e0 22 40 40
E: 36.705922 6 04 83 80 0b c0 4d
E: 36.724938 6 04 87 d0 22 a0 40
E: 36.726923 6 04 83 80 0b d0 4e
E: 36.746938 6 04 87 d0 22 20 41
E: 36.748926 6 04 83 80 0b d0 4f
E: 36.767936 6 04 83 80 0b c0 50
E: 36.769926 6 04 87 c0 22 c0 41
E: 36.788935 6 04 83 80 0b b0 51
E: 36.790925 6 04 87 b0 22 70 42
E: 36.809928 6 04 87 a0 22 30 43
E: 36.811923 6 04 83 80 0b 90 52
E: 36.830934 6 04 87 90 22 f0 43
E: 36.832926 6 04 83 70 0b 70 53
E: 36.852931 6 04 87 90 22 a0 44
E: 36.854923 6 04 83 70 0b 40 54
E: 36.873935 6 04 83 60 0b 00 55
E: 36.875929 6 04 87 80 22 50 45
E: 36.894933 6 04 83 50 0b c0 55
E: 36.896926 6 04 87 70 22 00 46
E: 36.915930 6 04 87 70 22 b0 46
E: 36.917921 6 04 83 50 0b 70 56
E: 36.936934 6 04 87 70 22 50 47
E: 36.938922 6 04 83 50 0b 10 57
E: 36.956932 6 04 87 70 22 e0 47
E: 36.958922 6 04 83 50 0b a0 57
E: 36.977937 6 04 83 40 0b 30 58
E: 36.979929 6 04 87 70 22 80 48
E: 36.998931 6 04 83 40 0b b0 58
E: 37.000931 6 04 87 60 22 10 49
E: 37.019932 6 04 87 50 22 a0 49
E: 37.021924 6 04 83 30 0b 30 59
E: 37.040938 6 04 87 40 22 20 4a
E: 37.042924 6 04 83 30 0b a0 59
E: 37.061933 6 04 87 40 22 90 4a
E: 37.063924 6 04 83 30 0b 00 5a
E: 37.081929 6 04 83 30 0b 60 5a
E: 37.083928 6 04 87 40 22 f0 4a
E: 37.103935 6 04 83 30 0b c0 5a
E: 37.106057 6 04 87 40 22 40 4b
E: 37.124931 6 04 87 40 22 90 4b
E: 37.126923 6 04 83 30 0b 10 5b
E: 37.145960 6 04 87 40 22 d0 4b
E: 37.147927 6 04 83 30 0b 50 5b
E: 37.166950 6 04 87 40 22 00 4c
E: 37.168929 6 04 83 30 0b 80 5b
E: 37.186938 6 04 83 30 0b a0 5b
E: 37.188928 6 04 87 40 22 30 4c
E: 37.207921 6 04 83 30 0b a0 5b
E: 37.209917 6 04 87 40 22 50 4c
E: 37.228917 6 04 87 40 22 50 4c
E: 37.230909 6 04 83 30 0b a0 5b
E: 37.249924 6 04 87 40 22 70 4c
E: 37.251910 6 04 83 30 0b a0 5b
E: 37.270913 6 04 87 40 22 70 4c
E: 37.272909 6 04 83 30 0b a0 5b
E: 37.291911 6 04 83 30 0b a0 5b
E: 37.293903 6 04 87 40 22 70 4c
E: 37.311913 6 04 83 30 0b a0 5b
E: 37.313909 6 04 87 40 22 70 4c
E: 37.332912 6 04 87 40 22 70 4c
E: 37.334907 6 04 83 30 0b a0 5b
E: 37.354912 6 04 87 40 22 70 4c
E: 37.356911 6 04 83 30 0b a0 5b
E: 37.375911 6 04 87 40 22 70 4c
E: 37.377908 6 04 83 30 0b a0 5b
E: 37.396912 6 04 83 30 0b a0 5b
E: 37.398907 6 04 87 40 22 70 4c
E: 37.416913 6 04 83 30 0b a0 5b
E: 37.418907 6 04 87 40 22 70 4c
E: 37.437918 6 04 87 40 22 70 4c
E: 37.439909 6 04 83 30 0b a0 5b
E: 37.458911 6 04 87 40 22 70 4c
E: 37.460909 6 04 83 30 0b a0 5b
E: 37.479915 6 04 87 40 22 70 4c
E: 37.481907 6 04 83 30 0b a0 5b
E: 37.500913 6 04 83 30 0b a0 5b
E: 37.502908 6 04 87 40 22 70 4c
E: 37.521915 6 04 83 30 0b a0 5b
E: 37.523910 6 04 87 40 22 70 4c
E: 37.541912 6 04 87 40 22 70 4c
E: 37.543831 6 04 83 30 0b a0 5b
E: 37.562910 6 04 87 40 22 70 4c
E: 37.564910 6 04 83 30 0b a0 5b
E: 37.583911 6 04 87 40 22 70 4c
E: 37.585907 6 04 83 30 0b a0 5b
E: 37.605911 6 04 83 30 0b a0 5b
E: 37.607909 6 04 87 40 22 70 4c
E: 37.626913 6 04 83 30 0b a0 5b
E: 37.628911 6 04 87 40 22 70 4c
E: 37.647918 6 04 87 40 22 70 4c
E: 37.649908 6 04 83 30 0b a0 5b
E: 37.667911 6 04 87 40 22 70 4c
E: 37.669907 6 04 83 30 0b a0 5b
E: 37.688908 6 04 87 40 22 70 4c
E: 37.690910 6 04 83 30 0b a0 5b
E: 37.709913 6 04 83 30 0b a0 5b
E: 37.711911 6 04 87 40 22 70 4c
E: 37.730911 6 04 83 30 0b a0 5b
E: 37.732910 6 04 87 40 22 70 4c
E: 37.751932 6 04 87 40 22 70 4c
E: 37.753912 6 04 83 30 0b a0 5b
E: 37.772915 6 04 87 40 22 70 4c
E: 37.774909 6 04 83 30 0b a0 5b
E: 37.793908 6 04 87 40 22 70 4c
E: 37.795908 6 04 83 30 0b a0 5b
E: 37.813913 6 04 83 30 0b a0 5b
E: 37.815909 6 04 87 40 22 70 4c
E: 37.834914 6 04 83 30 0b a0 5b
E: 37.836909 6 04 87 40 22 70 4c
E: 37.855911 6 04 87 40 22 70 4c
E: 37.857907 6 04 83 30 0b a0 5b
E: 37.877911 6 04 87 40 22 70 4c
E: 37.879909 6 04 83 30 0b a0 5b
E: 37.898913 6 04 87 40 22 70 4c
E: 37.900912 6 04 83 30 0b a0 5b
E: 37.919916 6 04 83 30 0b a0 5b
E: 37.921909 6 04 87 40 22 70 4c
E: 37.939912 6 04 83 30 0b a0 5b
E: 37.941907 6 04 87 40 22 70 4c
E: 37.960912 6 04 87 40 22 70 4c
E: 37.962908 6 04 83 30 0b a0 5b
E: 37.981912 6 04 87 40 22 70 4c
E: 37.983909 6 04 83 30 0b a0 5b
E: 38.002914 6 04 87 40 22 70 4c
E: 38.004909 6 04 83 30 0b a0 5b
E: 38.023915 6 04 83 30 0b a0 5b
E: 38.025907 6 04 87 40 22 70 4c
E: 38.044912 6 04 83 30 0b a0 5b
E: 38.046908 6 04 87 40 22 70 4c
E: 38.064912 6 04 87 40 22 70 4c
E: 38.066908 6 04 83 30 0b a0 5b
E: 38.085912 6 04 87 40 22 70 4c
E: 38.087909 6 04 83 30 0b a0 5b
E: 38.106912 6 04 87 40 22 70 4c
E: 38.108909 6 04 83 30 0b a0 5b
E: 38.128913 6 04 83 30 0b a0 5b
E: 38.130909 6 04 87 40 22 70 4c
E: 38.149924 6 04 83 30 0b a0 5b
E: 38.151912 6 04 87 40 22 70 4c
E: 38.169916 6 04 87 40 22 70 4c
E: 38.171910 6 04 83 30 0b a0 5b
E: 38.190913 6 04 87 40 22 70 4c
E: 38.192909 6 04 83 30 0b a0 5b
E: 38.211914 6 04 87 40 22 70 4c
E: 38.213906 6 04 83 30 0b a0 5b
E: 38.232911 6 04 83 30 0b a0 5b
E: 38.234906 6 04 87 40 22 70 4c
E: 38.253912 6 04 83 30 0b a0 5b
E: 38.255908 6 04 87 40 22 70 4c
E: 38.274911 6 04 87 40 22 70 4c
E: 38.276908 6 04 83 30 0b a0 5b
E: 38.295914 6 04 87 40 22 70 4c
E: 38.297909 6 04 83 30 0b a0 5b
E: 38.315915 6 04 87 40 22 70 4c
E: 38.317907 6 04 83 30 0b a0 5b
E: 38.336914 6 04 83 30 0b a0 5b
E: 38.338908 6 04 87 40 22 70 4c
E: 38.357913 6 04 83 30 0b a0 5b
E: 38.359911 6 04 87 40 22 70 4c
E: 38.379911 6 04 87 40 22 70 4c
E: 38.381907 6 04 83 30 0b a0 5b
E: 38.400915 6 04 87 40 22 70 4c
E: 38.402908 6 04 83 30 0b a0 5b
E: 38.420912 6 04 87 40 22 70 4c
E: 38.422908 6 04 83 30 0b a0 5b
E: 38.441916 6 04 83 30 0b a0 5b
E: 38.443908 6 04 87 40 22 70 4c
E: 38.462916 6 04 83 30 0b a0 5b
E: 38.464909 6 04 87 40 22 70 4c
E: 38.483912 6 04 87 40 22 70 4c
E: 38.485906 6 04 83 30 0b a0 5b
E: 38.504931 6 04 83 20 0b f0 5b
E: 38.542941 6 04 87 40 22 50 4c
E: 38.544916 6 04 86 40 22 50 4c
E: 38.548919 6 04 83 20 0b 40 5d
E: 38.550917 6 04 82 20 0b 40 5d
# Thank you.
