R: 297 05 0d 09 04 a1 01 09 22 a1 02 09 42 15 00 25 01 75 01 95 01 81 02 95 03 81 03 09 32 09 47 95 02 81 02 95 02 81 03 09 51 75 08 95 01 81 02 05 01 26 ff 7f 65 11 55 0e 46 7c 24 75 10 95 01 09 30 81 02 09 31 46 96 14 81 02 c0 a1 02 05 0d 09 42 15 00 25 01 75 01 95 01 81 02 95 03 81 03 09 32 09 47 95 02 81 02 95 02 81 03 09 51 75 08 95 01 81 02 05 01 26 ff 7f 65 11 55 0e 46 7c 24 75 10 95 01 09 30 81 02 09 31 46 96 14 81 02 c0 a1 02 05 0d 09 42 15 00 25 01 75 01 95 01 81 02 95 03 81 03 09 32 09 47 95 02 81 02 95 02 81 03 09 51 75 08 95 01 81 02 05 01 26 ff 7f 65 11 55 0e 46 7c 24 75 10 95 01 09 30 81 02 09 31 46 96 14 81 02 c0 a1 02 05 0d 09 42 15 00 25 01 75 01 95 01 81 02 95 03 81 03 09 32 09 47 95 02 81 02 95 02 81 03 09 51 75 08 95 01 81 02 05 01 26 ff 7f 65 11 55 0e 46 7c 24 75 10 95 01 09 30 81 02 09 31 46 96 14 81 02 c0 05 0d 09 54 75 08 95 01 15 00 25 08 81 02 09 55 b1 02 c0
N: Elo TouchSystems Optical Touchscreen 02.04.22.02.
I: 3 04e7 0080
# 1. Drag _one_ finger on the screen from one corner to the opposite, and release it.
E: 0.000000 25 31 01 40 04 68 79 00 00 00 00 00 00 00 00 00 00 00 00 00 00 00 00 00 00 01
E: 0.015955 25 31 01 40 04 68 79 00 00 00 00 00 00 00 00 00 00 00 00 00 00 00 00 00 00 01
E: 0.030989 25 31 01 58 04 68 79 00 00 00 00 00 00 00 00 00 00 00 00 00 00 00 00 00 00 01
E: 0.046983 25 31 01 70 04 60 79 00 00 00 00 00 00 00 00 00 00 00 00 00 00 00 00 00 00 01
E: 0.061987 25 31 01 88 04 50 79 00 00 00 00 00 00 00 00 00 00 00 00 00 00 00 00 00 00 01
E: 0.077985 25 31 01 98 04 30 79 00 00 00 00 00 00 00 00 00 00 00 00 00 00 00 00 00 00 01
E: 0.092940 25 31 01 b0 04 10 79 00 00 00 00 00 00 00 00 00 00 00 00 00 00 00 00 00 00 01
E: 0.109087 25 31 01 c8 04 e8 78 00 00 00 00 00 00 00 00 00 00 00 00 00 00 00 00 00 00 01
E: 0.123962 25 31 01 f8 04 c8 78 00 00 00 00 00 00 00 00 00 00 00 00 00 00 00 00 00 00 01
E: 0.139916 25 31 01 20 05 90 78 00 00 00 00 00 00 00 00 00 00 00 00 00 00 00 00 00 00 01
E: 0.154923 25 31 01 48 05 50 78 00 00 00 00 00 00 00 00 00 00 00 00 00 00 00 00 00 00 01
E: 0.170917 25 31 01 60 05 28 78 00 00 00 00 00 00 00 00 00 00 00 00 00 00 00 00 00 00 01
E: 0.185917 25 31 01 80 05 d8 77 00 00 00 00 00 00 00 00 00 00 00 00 00 00 00 00 00 00 01
E: 0.201914 25 31 01 a8 05 98 77 00 00 00 00 00 00 00 00 00 00 00 00 00 00 00 00 00 00 01
E: 0.216913 25 31 01 c0 05 48 77 00 00 00 00 00 00 00 00 00 00 00 00 00 00 00 00 00 00 01
E: 0.233260 25 31 01 f0 05 f0 76 00 00 00 00 00 00 00 00 00 00 00 00 00 00 00 00 00 00 01
E: 0.248088 25 31 01 08 06 78 76 00 00 00 00 00 00 00 00 00 00 00 00 00 00 00 00 00 00 01
E: 0.263091 25 31 01 38 06 28 76 00 00 00 00 00 00 00 00 00 00 00 00 00 00 00 00 00 00 01
E: 0.278992 25 31 01 60 06 e8 75 00 00 00 00 00 00 00 00 00 00 00 00 00 00 00 00 00 00 01
E: 0.293966 25 31 01 90 06 78 75 00 00 00 00 00 00 00 00 00 00 00 00 00 00 00 00 00 00 01
E: 0.310109 25 31 01 b8 06 18 75 00 00 00 00 00 00 00 00 00 00 00 00 00 00 00 00 00 00 01
E: 0.326073 25 31 01 e0 06 c0 74 00 00 00 00 00 00 00 00 00 00 00 00 00 00 00 00 00 00 01
E: 0.340996 25 31 01 18 07 48 74 00 00 00 00 00 00 00 00 00 00 00 00 00 00 00 00 00 00 01
E: 0.356166 25 31 01 48 07 d8 73 00 00 00 00 00 00 00 00 00 00 00 00 00 00 00 00 00 00 01
E: 0.372216 25 31 01 88 07 60 73 00 00 00 00 00 00 00 00 00 00 00 00 00 00 00 00 00 00 01
E: 0.386932 25 31 01 d0 07 e0 72 00 00 00 00 00 00 00 00 00 00 00 00 00 00 00 00 00 00 01
E: 0.403301 25 31 01 18 08 50 72 00 00 00 00 00 00 00 00 00 00 00 00 00 00 00 00 00 00 01
E: 0.418301 25 31 01 68 08 d0 71 00 00 00 00 00 00 00 00 00 00 00 00 00 00 00 00 00 00 01
E: 0.434254 25 31 01 c0 08 38 71 00 00 00 00 00 00 00 00 00 00 00 00 00 00 00 00 00 00 01
E: 0.449422 25 31 01 10 09 b0 70 00 00 00 00 00 00 00 00 00 00 00 00 00 00 00 00 00 00 01
E: 0.465103 25 31 01 78 09 08 70 00 00 00 00 00 00 00 00 00 00 00 00 00 00 00 00 00 00 01
E: 0.479942 25 31 01 c8 09 78 6f 00 00 00 00 00 00 00 00 00 00 00 00 00 00 00 00 00 00 01
E: 0.496268 25 31 01 30 0a e0 6e 00 00 00 00 00 00 00 00 00 00 00 00 00 00 00 00 00 00 01
E: 0.510998 25 31 01 a0 0a 40 6e 00 00 00 00 00 00 00 00 00 00 00 00 00 00 00 00 00 00 01
E: 0.526005 25 31 01 00 0b a8 6d 00 00 00 00 00 00 00 00 00 00 00 00 00 00 00 00 00 00 01
E: 0.541993 25 31 01 60 0b 18 6d 00 00 00 00 00 00 00 00 00 00 00 00 00 00 00 00 00 00 01
E: 0.557091 25 31 01 c8 0b 70 6c 00 00 00 00 00 00 00 00 00 00 00 00 00 00 00 00 00 00 01
E: 0.573060 25 31 01 30 0c d8 6b 00 00 00 00 00 00 00 00 00 00 00 00 00 00 00 00 00 00 01
E: 0.587972 25 31 01 98 0c 30 6b 00 00 00 00 00 00 00 00 00 00 00 00 00 00 00 00 00 00 01
E: 0.603946 25 31 01 f8 0c 90 6a 00 00 00 00 00 00 00 00 00 00 00 00 00 00 00 00 00 00 01
E: 0.618940 25 31 01 68 0d f0 69 00 00 00 00 00 00 00 00 00 00 00 00 00 00 00 00 00 00 01
E: 0.634939 25 31 01 d0 0d 38 69 00 00 00 00 00 00 00 00 00 00 00 00 00 00 00 00 00 00 01
E: 0.649938 25 31 01 40 0e 90 68 00 00 00 00 00 00 00 00 00 00 00 00 00 00 00 00 00 00 01
E: 0.665908 25 31 01 a0 0e 08 68 00 00 00 00 00 00 00 00 00 00 00 00 00 00 00 00 00 00 01
E: 0.680938 25 31 01 18 0f 30 67 00 00 00 00 00 00 00 00 00 00 00 00 00 00 00 00 00 00 01
E: 0.696935 25 31 01 88 0f 98 66 00 00 00 00 00 00 00 00 00 00 00 00 00 00 00 00 00 00 01
E: 0.711936 25 31 01 e8 0f 08 66 00 00 00 00 00 00 00 00 00 00 00 00 00 00 00 00 00 00 01
E: 0.727935 25 31 01 58 10 58 65 00 00 00 00 00 00 00 00 00 00 00 00 00 00 00 00 00 00 01
E: 0.743220 25 31 01 c0 10 b0 64 00 00 00 00 00 00 00 00 00 00 00 00 00 00 00 00 00 00 01
E: 0.759159 25 31 01 28 11 00 64 00 00 00 00 00 00 00 00 00 00 00 00 00 00 00 00 00 00 01
E: 0.774337 25 31 01 98 11 38 63 00 00 00 00 00 00 00 00 00 00 00 00 00 00 00 00 00 00 01
E: 0.788976 25 31 01 08 12 88 62 00 00 00 00 00 00 00 00 00 00 00 00 00 00 00 00 00 00 01
E: 0.805286 25 31 01 68 12 e8 61 00 00 00 00 00 00 00 00 00 00 00 00 00 00 00 00 00 00 01
E: 0.820309 25 31 01 d0 12 30 61 00 00 00 00 00 00 00 00 00 00 00 00 00 00 00 00 00 00 01
E: 0.836183 25 31 01 38 13 80 60 00 00 00 00 00 00 00 00 00 00 00 00 00 00 00 00 00 00 01
E: 0.850983 25 31 01 98 13 d0 5f 00 00 00 00 00 00 00 00 00 00 00 00 00 00 00 00 00 00 01
E: 0.867232 25 31 01 00 14 20 5f 00 00 00 00 00 00 00 00 00 00 00 00 00 00 00 00 00 00 01
E: 0.881982 25 31 01 60 14 88 5e 00 00 00 00 00 00 00 00 00 00 00 00 00 00 00 00 00 00 01
E: 0.897948 25 31 01 c8 14 d8 5d 00 00 00 00 00 00 00 00 00 00 00 00 00 00 00 00 00 00 01
E: 0.912936 25 31 01 28 15 30 5d 00 00 00 00 00 00 00 00 00 00 00 00 00 00 00 00 00 00 01
E: 0.929052 25 31 01 98 15 90 5c 00 00 00 00 00 00 00 00 00 00 00 00 00 00 00 00 00 00 01
E: 0.944035 25 31 01 08 16 f0 5b 00 00 00 00 00 00 00 00 00 00 00 00 00 00 00 00 00 00 01
E: 0.960027 25 31 01 68 16 50 5b 00 00 00 00 00 00 00 00 00 00 00 00 00 00 00 00 00 00 01
E: 0.974952 25 31 01 d8 16 98 5a 00 00 00 00 00 00 00 00 00 00 00 00 00 00 00 00 00 00 01
E: 0.991284 25 31 01 40 17 10 5a 00 00 00 00 00 00 00 00 00 00 00 00 00 00 00 00 00 00 01
E: 1.006072 25 31 01 a0 17 78 59 00 00 00 00 00 00 00 00 00 00 00 00 00 00 00 00 00 00 01
E: 1.021072 25 31 01 00 18 d8 58 00 00 00 00 00 00 00 00 00 00 00 00 00 00 00 00 00 00 01
E: 1.036973 25 31 01 68 18 50 58 00 00 00 00 00 00 00 00 00 00 00 00 00 00 00 00 00 00 01
E: 1.052086 25 31 01 c0 18 c0 57 00 00 00 00 00 00 00 00 00 00 00 00 00 00 00 00 00 00 01
E: 1.068326 25 31 01 20 19 50 57 00 00 00 00 00 00 00 00 00 00 00 00 00 00 00 00 00 00 01
E: 1.083091 25 31 01 88 19 c0 56 00 00 00 00 00 00 00 00 00 00 00 00 00 00 00 00 00 00 01
E: 1.099050 25 31 01 e0 19 50 56 00 00 00 00 00 00 00 00 00 00 00 00 00 00 00 00 00 00 01
E: 1.114061 25 31 01 38 1a c0 55 00 00 00 00 00 00 00 00 00 00 00 00 00 00 00 00 00 00 01
E: 1.130332 25 31 01 98 1a 50 55 00 00 00 00 00 00 00 00 00 00 00 00 00 00 00 00 00 00 01
E: 1.145058 25 31 01 e8 1a d0 54 00 00 00 00 00 00 00 00 00 00 00 00 00 00 00 00 00 00 01
E: 1.160944 25 31 01 40 1b 70 54 00 00 00 00 00 00 00 00 00 00 00 00 00 00 00 00 00 00 01
E: 1.175934 25 31 01 a0 1b e0 53 00 00 00 00 00 00 00 00 00 00 00 00 00 00 00 00 00 00 01
E: 1.191928 25 31 01 f0 1b 88 53 00 00 00 00 00 00 00 00 00 00 00 00 00 00 00 00 00 00 01
E: 1.206925 25 31 01 50 1c f8 52 00 00 00 00 00 00 00 00 00 00 00 00 00 00 00 00 00 00 01
E: 1.222924 25 31 01 b0 1c 88 52 00 00 00 00 00 00 00 00 00 00 00 00 00 00 00 00 00 00 01
E: 1.238288 25 31 01 10 1d 10 52 00 00 00 00 00 00 00 00 00 00 00 00 00 00 00 00 00 00 01
E: 1.254068 25 31 01 68 1d a0 51 00 00 00 00 00 00 00 00 00 00 00 00 00 00 00 00 00 00 01
E: 1.269038 25 31 01 c8 1d 40 51 00 00 00 00 00 00 00 00 00 00 00 00 00 00 00 00 00 00 01
E: 1.283967 25 31 01 28 1e c8 50 00 00 00 00 00 00 00 00 00 00 00 00 00 00 00 00 00 00 01
E: 1.299938 25 31 01 80 1e 58 50 00 00 00 00 00 00 00 00 00 00 00 00 00 00 00 00 00 00 01
E: 1.314925 25 31 01 e0 1e f8 4f 00 00 00 00 00 00 00 00 00 00 00 00 00 00 00 00 00 00 01
E: 1.330920 25 31 01 38 1f 80 4f 00 00 00 00 00 00 00 00 00 00 00 00 00 00 00 00 00 00 01
E: 1.345922 25 31 01 98 1f 18 4f 00 00 00 00 00 00 00 00 00 00 00 00 00 00 00 00 00 00 01
E: 1.361922 25 31 01 f0 1f a8 4e 00 00 00 00 00 00 00 00 00 00 00 00 00 00 00 00 00 00 01
E: 1.376920 25 31 01 50 20 48 4e 00 00 00 00 00 00 00 00 00 00 00 00 00 00 00 00 00 00 01
E: 1.392918 25 31 01 b8 20 d8 4d 00 00 00 00 00 00 00 00 00 00 00 00 00 00 00 00 00 00 01
E: 1.407919 25 31 01 20 21 60 4d 00 00 00 00 00 00 00 00 00 00 00 00 00 00 00 00 00 00 01
E: 1.423917 25 31 01 90 21 e8 4c 00 00 00 00 00 00 00 00 00 00 00 00 00 00 00 00 00 00 01
E: 1.438916 25 31 01 00 22 78 4c 00 00 00 00 00 00 00 00 00 00 00 00 00 00 00 00 00 00 01
E: 1.454915 25 31 01 70 22 f8 4b 00 00 00 00 00 00 00 00 00 00 00 00 00 00 00 00 00 00 01
E: 1.470061 25 31 01 e8 22 80 4b 00 00 00 00 00 00 00 00 00 00 00 00 00 00 00 00 00 00 01
E: 1.486387 25 31 01 58 23 08 4b 00 00 00 00 00 00 00 00 00 00 00 00 00 00 00 00 00 00 01
E: 1.501107 25 31 01 c8 23 88 4a 00 00 00 00 00 00 00 00 00 00 00 00 00 00 00 00 00 00 01
E: 1.517065 25 31 01 38 24 18 4a 00 00 00 00 00 00 00 00 00 00 00 00 00 00 00 00 00 00 01
E: 1.532007 25 31 01 b0 24 b0 49 00 00 00 00 00 00 00 00 00 00 00 00 00 00 00 00 00 00 01
E: 1.547024 25 31 01 20 25 38 49 00 00 00 00 00 00 00 00 00 00 00 00 00 00 00 00 00 00 01
E: 1.563289 25 31 01 98 25 c0 48 00 00 00 00 00 00 00 00 00 00 00 00 00 00 00 00 00 00 01
E: 1.577938 25 31 01 08 26 60 48 00 00 00 00 00 00 00 00 00 00 00 00 00 00 00 00 00 00 01
E: 1.593900 25 31 01 78 26 f8 47 00 00 00 00 00 00 00 00 00 00 00 00 00 00 00 00 00 00 01
E: 1.609154 25 31 01 e0 26 80 47 00 00 00 00 00 00 00 00 00 00 00 00 00 00 00 00 00 00 01
E: 1.625169 25 31 01 38 27 28 47 00 00 00 00 00 00 00 00 00 00 00 00 00 00 00 00 00 00 01
E: 1.640143 25 31 01 a8 27 d0 46 00 00 00 00 00 00 00 00 00 00 00 00 00 00 00 00 00 00 01
E: 1.656011 25 31 01 08 28 80 46 00 00 00 00 00 00 00 00 00 00 00 00 00 00 00 00 00 00 01
E: 1.671349 25 31 01 60 28 10 46 00 00 00 00 00 00 00 00 00 00 00 00 00 00 00 00 00 00 01
E: 1.686959 25 31 01 c0 28 a0 45 00 00 00 00 00 00 00 00 00 00 00 00 00 00 00 00 00 00 01
E: 1.702262 25 31 01 28 29 48 45 00 00 00 00 00 00 00 00 00 00 00 00 00 00 00 00 00 00 01
E: 1.718173 25 31 01 88 29 e8 44 00 00 00 00 00 00 00 00 00 00 00 00 00 00 00 00 00 00 01
E: 1.733099 25 31 01 e8 29 70 44 00 00 00 00 00 00 00 00 00 00 00 00 00 00 00 00 00 00 01
E: 1.748938 25 31 01 58 2a f8 43 00 00 00 00 00 00 00 00 00 00 00 00 00 00 00 00 00 00 01
E: 1.763929 25 31 01 e0 2a a0 43 00 00 00 00 00 00 00 00 00 00 00 00 00 00 00 00 00 00 01
E: 1.779887 25 31 01 70 2b 28 43 00 00 00 00 00 00 00 00 00 00 00 00 00 00 00 00 00 00 01
E: 1.794882 25 31 01 f8 2b c8 42 00 00 00 00 00 00 00 00 00 00 00 00 00 00 00 00 00 00 01
E: 1.809881 25 31 01 80 2c 68 42 00 00 00 00 00 00 00 00 00 00 00 00 00 00 00 00 00 00 01
E: 1.825880 25 31 01 08 2d f8 41 00 00 00 00 00 00 00 00 00 00 00 00 00 00 00 00 00 00 01
E: 1.840878 25 31 01 90 2d 90 41 00 00 00 00 00 00 00 00 00 00 00 00 00 00 00 00 00 00 01
E: 1.857213 25 31 01 00 2e 38 41 00 00 00 00 00 00 00 00 00 00 00 00 00 00 00 00 00 00 01
E: 1.872156 25 31 01 78 2e d8 40 00 00 00 00 00 00 00 00 00 00 00 00 00 00 00 00 00 00 01
E: 1.888124 25 31 01 f8 2e 68 40 00 00 00 00 00 00 00 00 00 00 00 00 00 00 00 00 00 00 01
E: 1.903043 25 31 01 60 2f 18 40 00 00 00 00 00 00 00 00 00 00 00 00 00 00 00 00 00 00 01
E: 1.919263 25 31 01 c0 2f c0 3f 00 00 00 00 00 00 00 00 00 00 00 00 00 00 00 00 00 00 01
E: 1.933931 25 31 01 20 30 78 3f 00 00 00 00 00 00 00 00 00 00 00 00 00 00 00 00 00 00 01
E: 1.949891 25 31 01 78 30 28 3f 00 00 00 00 00 00 00 00 00 00 00 00 00 00 00 00 00 00 01
E: 1.964885 25 31 01 d8 30 d0 3e 00 00 00 00 00 00 00 00 00 00 00 00 00 00 00 00 00 00 01
E: 1.980880 25 31 01 38 31 88 3e 00 00 00 00 00 00 00 00 00 00 00 00 00 00 00 00 00 00 01
E: 1.995876 25 31 01 a0 31 38 3e 00 00 00 00 00 00 00 00 00 00 00 00 00 00 00 00 00 00 01
E: 2.011875 25 31 01 f0 31 e8 3d 00 00 00 00 00 00 00 00 00 00 00 00 00 00 00 00 00 00 01
E: 2.027153 25 31 01 40 32 90 3d 00 00 00 00 00 00 00 00 00 00 00 00 00 00 00 00 00 00 01
E: 2.041931 25 31 01 a8 32 48 3d 00 00 00 00 00 00 00 00 00 00 00 00 00 00 00 00 00 00 01
E: 2.058269 25 31 01 00 33 f0 3c 00 00 00 00 00 00 00 00 00 00 00 00 00 00 00 00 00 00 01
E: 2.072896 25 31 01 68 33 98 3c 00 00 00 00 00 00 00 00 00 00 00 00 00 00 00 00 00 00 01
E: 2.089243 25 31 01 c0 33 30 3c 00 00 00 00 00 00 00 00 00 00 00 00 00 00 00 00 00 00 01
E: 2.103929 25 31 01 30 34 e0 3b 00 00 00 00 00 00 00 00 00 00 00 00 00 00 00 00 00 00 01
E: 2.119934 25 31 01 90 34 88 3b 00 00 00 00 00 00 00 00 00 00 00 00 00 00 00 00 00 00 01
E: 2.135251 25 31 01 00 35 20 3b 00 00 00 00 00 00 00 00 00 00 00 00 00 00 00 00 00 00 01
E: 2.151038 25 31 01 70 35 b0 3a 00 00 00 00 00 00 00 00 00 00 00 00 00 00 00 00 00 00 01
E: 2.166080 25 31 01 d8 35 50 3a 00 00 00 00 00 00 00 00 00 00 00 00 00 00 00 00 00 00 01
E: 2.181916 25 31 01 28 36 f0 39 00 00 00 00 00 00 00 00 00 00 00 00 00 00 00 00 00 00 01
E: 2.196878 25 31 01 80 36 80 39 00 00 00 00 00 00 00 00 00 00 00 00 00 00 00 00 00 00 01
E: 2.212876 25 31 01 08 37 08 39 00 00 00 00 00 00 00 00 00 00 00 00 00 00 00 00 00 00 01
E: 2.228111 25 31 01 58 37 b0 38 00 00 00 00 00 00 00 00 00 00 00 00 00 00 00 00 00 00 01
E: 2.244032 25 31 01 e0 37 20 38 00 00 00 00 00 00 00 00 00 00 00 00 00 00 00 00 00 00 01
E: 2.259025 25 31 01 50 38 a8 37 00 00 00 00 00 00 00 00 00 00 00 00 00 00 00 00 00 00 01
E: 2.274370 25 31 01 d8 38 30 37 00 00 00 00 00 00 00 00 00 00 00 00 00 00 00 00 00 00 01
E: 2.289916 25 31 01 70 39 a0 36 00 00 00 00 00 00 00 00 00 00 00 00 00 00 00 00 00 00 01
E: 2.305878 25 31 01 f0 39 18 36 00 00 00 00 00 00 00 00 00 00 00 00 00 00 00 00 00 00 01
E: 2.321366 25 31 01 70 3a a8 35 00 00 00 00 00 00 00 00 00 00 00 00 00 00 00 00 00 00 01
E: 2.336305 25 31 01 00 3b 30 35 00 00 00 00 00 00 00 00 00 00 00 00 00 00 00 00 00 00 01
E: 2.352030 25 31 01 88 3b c0 34 00 00 00 00 00 00 00 00 00 00 00 00 00 00 00 00 00 00 01
E: 2.366915 25 31 01 10 3c 48 34 00 00 00 00 00 00 00 00 00 00 00 00 00 00 00 00 00 00 01
E: 2.382879 25 31 01 98 3c c8 33 00 00 00 00 00 00 00 00 00 00 00 00 00 00 00 00 00 00 01
E: 2.397870 25 31 01 10 3d 50 33 00 00 00 00 00 00 00 00 00 00 00 00 00 00 00 00 00 00 01
E: 2.413869 25 31 01 a8 3d c8 32 00 00 00 00 00 00 00 00 00 00 00 00 00 00 00 00 00 00 01
E: 2.428864 25 31 01 38 3e 40 32 00 00 00 00 00 00 00 00 00 00 00 00 00 00 00 00 00 00 01
E: 2.444865 25 31 01 c8 3e c0 31 00 00 00 00 00 00 00 00 00 00 00 00 00 00 00 00 00 00 01
E: 2.459863 25 31 01 50 3f 48 31 00 00 00 00 00 00 00 00 00 00 00 00 00 00 00 00 00 00 01
E: 2.475861 25 31 01 d8 3f e8 30 00 00 00 00 00 00 00 00 00 00 00 00 00 00 00 00 00 00 01
E: 2.490862 25 31 01 48 40 90 30 00 00 00 00 00 00 00 00 00 00 00 00 00 00 00 00 00 00 01
E: 2.506862 25 31 01 c8 40 18 30 00 00 00 00 00 00 00 00 00 00 00 00 00 00 00 00 00 00 01
E: 2.521860 25 31 01 40 41 c0 2f 00 00 00 00 00 00 00 00 00 00 00 00 00 00 00 00 00 00 01
E: 2.537861 25 31 01 a8 41 68 2f 00 00 00 00 00 00 00 00 00 00 00 00 00 00 00 00 00 00 01
E: 2.552904 25 31 01 08 42 18 2f 00 00 00 00 00 00 00 00 00 00 00 00 00 00 00 00 00 00 01
E: 2.567909 25 31 01 88 42 c0 2e 00 00 00 00 00 00 00 00 00 00 00 00 00 00 00 00 00 00 01
E: 2.584195 25 31 01 10 43 68 2e 00 00 00 00 00 00 00 00 00 00 00 00 00 00 00 00 00 00 01
E: 2.598912 25 31 01 98 43 10 2e 00 00 00 00 00 00 00 00 00 00 00 00 00 00 00 00 00 00 01
E: 2.614875 25 31 01 08 44 b8 2d 00 00 00 00 00 00 00 00 00 00 00 00 00 00 00 00 00 00 01
E: 2.629866 25 31 01 88 44 68 2d 00 00 00 00 00 00 00 00 00 00 00 00 00 00 00 00 00 00 01
E: 2.645972 25 31 01 10 45 10 2d 00 00 00 00 00 00 00 00 00 00 00 00 00 00 00 00 00 00 01
E: 2.661008 25 31 01 90 45 c0 2c 00 00 00 00 00 00 00 00 00 00 00 00 00 00 00 00 00 00 01
E: 2.677175 25 31 01 10 46 80 2c 00 00 00 00 00 00 00 00 00 00 00 00 00 00 00 00 00 00 01
E: 2.691921 25 31 01 88 46 30 2c 00 00 00 00 00 00 00 00 00 00 00 00 00 00 00 00 00 00 01
E: 2.707871 25 31 01 08 47 e8 2b 00 00 00 00 00 00 00 00 00 00 00 00 00 00 00 00 00 00 01
E: 2.722863 25 31 01 78 47 98 2b 00 00 00 00 00 00 00 00 00 00 00 00 00 00 00 00 00 00 01
E: 2.738861 25 31 01 00 48 58 2b 00 00 00 00 00 00 00 00 00 00 00 00 00 00 00 00 00 00 01
E: 2.753858 25 31 01 68 48 18 2b 00 00 00 00 00 00 00 00 00 00 00 00 00 00 00 00 00 00 01
E: 2.769859 25 31 01 d0 48 d0 2a 00 00 00 00 00 00 00 00 00 00 00 00 00 00 00 00 00 00 01
E: 2.785113 25 31 01 40 49 98 2a 00 00 00 00 00 00 00 00 00 00 00 00 00 00 00 00 00 00 01
E: 2.801024 25 31 01 b0 49 58 2a 00 00 00 00 00 00 00 00 00 00 00 00 00 00 00 00 00 00 01
E: 2.816022 25 31 01 00 4a 18 2a 00 00 00 00 00 00 00 00 00 00 00 00 00 00 00 00 00 00 01
E: 2.831306 25 31 01 70 4a d8 29 00 00 00 00 00 00 00 00 00 00 00 00 00 00 00 00 00 00 01
E: 2.847003 25 31 01 d8 4a 98 29 00 00 00 00 00 00 00 00 00 00 00 00 00 00 00 00 00 00 01
E: 2.862335 25 31 01 38 4b 48 29 00 00 00 00 00 00 00 00 00 00 00 00 00 00 00 00 00 00 01
E: 2.877988 25 31 01 a8 4b 08 29 00 00 00 00 00 00 00 00 00 00 00 00 00 00 00 00 00 00 01
E: 2.893047 25 31 01 10 4c c8 28 00 00 00 00 00 00 00 00 00 00 00 00 00 00 00 00 00 00 01
E: 2.909389 25 31 01 80 4c 78 28 00 00 00 00 00 00 00 00 00 00 00 00 00 00 00 00 00 00 01
E: 2.923904 25 31 01 d8 4c 38 28 00 00 00 00 00 00 00 00 00 00 00 00 00 00 00 00 00 00 01
E: 2.939865 25 31 01 40 4d e8 27 00 00 00 00 00 00 00 00 00 00 00 00 00 00 00 00 00 00 01
E: 2.954855 25 31 01 a0 4d 90 27 00 00 00 00 00 00 00 00 00 00 00 00 00 00 00 00 00 00 01
E: 2.970853 25 31 01 00 4e 40 27 00 00 00 00 00 00 00 00 00 00 00 00 00 00 00 00 00 00 01
E: 2.986228 25 31 01 58 4e 00 27 00 00 00 00 00 00 00 00 00 00 00 00 00 00 00 00 00 00 01
E: 3.002103 25 31 01 b0 4e c0 26 00 00 00 00 00 00 00 00 00 00 00 00 00 00 00 00 00 00 01
E: 3.017257 25 31 01 08 4f 78 26 00 00 00 00 00 00 00 00 00 00 00 00 00 00 00 00 00 00 01
E: 3.032976 25 31 01 68 4f 38 26 00 00 00 00 00 00 00 00 00 00 00 00 00 00 00 00 00 00 01
E: 3.047918 25 31 01 c0 4f f8 25 00 00 00 00 00 00 00 00 00 00 00 00 00 00 00 00 00 00 01
E: 3.064241 25 31 01 18 50 b0 25 00 00 00 00 00 00 00 00 00 00 00 00 00 00 00 00 00 00 01
E: 3.079032 25 31 01 88 50 58 25 00 00 00 00 00 00 00 00 00 00 00 00 00 00 00 00 00 00 01
E: 3.094202 25 31 01 f8 50 00 25 00 00 00 00 00 00 00 00 00 00 00 00 00 00 00 00 00 00 01
E: 3.110128 25 31 01 68 51 a8 24 00 00 00 00 00 00 00 00 00 00 00 00 00 00 00 00 00 00 01
E: 3.125190 25 31 01 d0 51 40 24 00 00 00 00 00 00 00 00 00 00 00 00 00 00 00 00 00 00 01
E: 3.140993 25 31 01 40 52 e8 23 00 00 00 00 00 00 00 00 00 00 00 00 00 00 00 00 00 00 01
E: 3.155913 25 31 01 b0 52 88 23 00 00 00 00 00 00 00 00 00 00 00 00 00 00 00 00 00 00 01
E: 3.171911 25 31 01 10 53 30 23 00 00 00 00 00 00 00 00 00 00 00 00 00 00 00 00 00 00 01
E: 3.186862 25 31 01 78 53 e0 22 00 00 00 00 00 00 00 00 00 00 00 00 00 00 00 00 00 00 01
E: 3.203104 25 31 01 e0 53 88 22 00 00 00 00 00 00 00 00 00 00 00 00 00 00 00 00 00 00 01
E: 3.218137 25 31 01 38 54 30 22 00 00 00 00 00 00 00 00 00 00 00 00 00 00 00 00 00 00 01
E: 3.234109 25 31 01 a8 54 d8 21 00 00 00 00 00 00 00 00 00 00 00 00 00 00 00 00 00 00 01
E: 3.249049 25 31 01 10 55 90 21 00 00 00 00 00 00 00 00 00 00 00 00 00 00 00 00 00 00 01
E: 3.264922 25 31 01 80 55 38 21 00 00 00 00 00 00 00 00 00 00 00 00 00 00 00 00 00 00 01
E: 3.280168 25 31 01 f8 55 f0 20 00 00 00 00 00 00 00 00 00 00 00 00 00 00 00 00 00 00 01
E: 3.295910 25 31 01 60 56 98 20 00 00 00 00 00 00 00 00 00 00 00 00 00 00 00 00 00 00 01
E: 3.310861 25 31 01 d8 56 40 20 00 00 00 00 00 00 00 00 00 00 00 00 00 00 00 00 00 00 01
E: 3.325854 25 31 01 48 57 f8 1f 00 00 00 00 00 00 00 00 00 00 00 00 00 00 00 00 00 00 01
E: 3.341855 25 31 01 c0 57 a8 1f 00 00 00 00 00 00 00 00 00 00 00 00 00 00 00 00 00 00 01
E: 3.357188 25 31 01 30 58 60 1f 00 00 00 00 00 00 00 00 00 00 00 00 00 00 00 00 00 00 01
E: 3.372939 25 31 01 a0 58 18 1f 00 00 00 00 00 00 00 00 00 00 00 00 00 00 00 00 00 00 01
E: 3.387956 25 31 01 f8 58 d8 1e 00 00 00 00 00 00 00 00 00 00 00 00 00 00 00 00 00 00 01
E: 3.404107 25 31 01 68 59 90 1e 00 00 00 00 00 00 00 00 00 00 00 00 00 00 00 00 00 00 01
E: 3.418917 25 31 01 d0 59 50 1e 00 00 00 00 00 00 00 00 00 00 00 00 00 00 00 00 00 00 01
E: 3.434858 25 31 01 38 5a 18 1e 00 00 00 00 00 00 00 00 00 00 00 00 00 00 00 00 00 00 01
E: 3.449855 25 31 01 a8 5a d8 1d 00 00 00 00 00 00 00 00 00 00 00 00 00 00 00 00 00 00 01
E: 3.465849 25 31 01 18 5b 98 1d 00 00 00 00 00 00 00 00 00 00 00 00 00 00 00 00 00 00 01
E: 3.480850 25 31 01 88 5b 58 1d 00 00 00 00 00 00 00 00 00 00 00 00 00 00 00 00 00 00 01
E: 3.496847 25 31 01 00 5c 00 1d 00 00 00 00 00 00 00 00 00 00 00 00 00 00 00 00 00 00 01
E: 3.511847 25 31 01 78 5c c0 1c 00 00 00 00 00 00 00 00 00 00 00 00 00 00 00 00 00 00 01
E: 3.527845 25 31 01 00 5d 80 1c 00 00 00 00 00 00 00 00 00 00 00 00 00 00 00 00 00 00 01
E: 3.543048 25 31 01 80 5d 28 1c 00 00 00 00 00 00 00 00 00 00 00 00 00 00 00 00 00 00 01
E: 3.558897 25 31 01 f8 5d d8 1b 00 00 00 00 00 00 00 00 00 00 00 00 00 00 00 00 00 00 01
E: 3.573905 25 31 01 70 5e 90 1b 00 00 00 00 00 00 00 00 00 00 00 00 00 00 00 00 00 00 01
E: 3.588900 25 31 01 e0 5e 50 1b 00 00 00 00 00 00 00 00 00 00 00 00 00 00 00 00 00 00 01
E: 3.605192 25 31 01 50 5f 10 1b 00 00 00 00 00 00 00 00 00 00 00 00 00 00 00 00 00 00 01
E: 3.620022 25 31 01 b8 5f d0 1a 00 00 00 00 00 00 00 00 00 00 00 00 00 00 00 00 00 00 01
E: 3.635969 25 31 01 28 60 90 1a 00 00 00 00 00 00 00 00 00 00 00 00 00 00 00 00 00 00 01
E: 3.651231 25 31 01 98 60 50 1a 00 00 00 00 00 00 00 00 00 00 00 00 00 00 00 00 00 00 01
E: 3.667195 25 31 01 f8 60 18 1a 00 00 00 00 00 00 00 00 00 00 00 00 00 00 00 00 00 00 01
E: 3.682204 25 31 01 70 61 d0 19 00 00 00 00 00 00 00 00 00 00 00 00 00 00 00 00 00 00 01
E: 3.697893 25 31 01 e8 61 90 19 00 00 00 00 00 00 00 00 00 00 00 00 00 00 00 00 00 00 01
E: 3.712845 25 31 01 58 62 40 19 00 00 00 00 00 00 00 00 00 00 00 00 00 00 00 00 00 00 01
E: 3.729405 25 31 01 c8 62 00 19 00 00 00 00 00 00 00 00 00 00 00 00 00 00 00 00 00 00 01
E: 3.744072 25 31 01 30 63 c8 18 00 00 00 00 00 00 00 00 00 00 00 00 00 00 00 00 00 00 01
E: 3.760280 25 31 01 90 63 98 18 00 00 00 00 00 00 00 00 00 00 00 00 00 00 00 00 00 00 01
E: 3.774878 25 31 01 f8 63 60 18 00 00 00 00 00 00 00 00 00 00 00 00 00 00 00 00 00 00 01
E: 3.790844 25 31 01 58 64 30 18 00 00 00 00 00 00 00 00 00 00 00 00 00 00 00 00 00 00 01
E: 3.806322 25 31 01 c8 64 f0 17 00 00 00 00 00 00 00 00 00 00 00 00 00 00 00 00 00 00 01
E: 3.821226 25 31 01 28 65 d0 17 00 00 00 00 00 00 00 00 00 00 00 00 00 00 00 00 00 00 01
E: 3.836899 25 31 01 90 65 90 17 00 00 00 00 00 00 00 00 00 00 00 00 00 00 00 00 00 00 01
E: 3.851880 25 31 01 00 66 40 17 00 00 00 00 00 00 00 00 00 00 00 00 00 00 00 00 00 00 01
E: 3.868230 25 31 01 60 66 00 17 00 00 00 00 00 00 00 00 00 00 00 00 00 00 00 00 00 00 01
E: 3.882945 25 31 01 b0 66 c0 16 00 00 00 00 00 00 00 00 00 00 00 00 00 00 00 00 00 00 01
E: 3.899068 25 31 01 18 67 98 16 00 00 00 00 00 00 00 00 00 00 00 00 00 00 00 00 00 00 01
E: 3.913886 25 31 01 68 67 80 16 00 00 00 00 00 00 00 00 00 00 00 00 00 00 00 00 00 00 01
E: 3.929839 25 31 01 d8 67 40 16 00 00 00 00 00 00 00 00 00 00 00 00 00 00 00 00 00 00 01
E: 3.944831 25 31 01 28 68 08 16 00 00 00 00 00 00 00 00 00 00 00 00 00 00 00 00 00 00 01
E: 3.960827 25 31 01 78 68 e8 15 00 00 00 00 00 00 00 00 00 00 00 00 00 00 00 00 00 00 01
E: 3.975825 25 31 01 b8 68 b8 15 00 00 00 00 00 00 00 00 00 00 00 00 00 00 00 00 00 00 01
E: 3.991824 25 31 01 00 69 98 15 00 00 00 00 00 00 00 00 00 00 00 00 00 00 00 00 00 00 01
E: 4.007076 25 31 01 60 69 58 15 00 00 00 00 00 00 00 00 00 00 00 00 00 00 00 00 00 00 01
E: 4.023086 25 31 01 b0 69 28 15 00 00 00 00 00 00 00 00 00 00 00 00 00 00 00 00 00 00 01
E: 4.038230 25 31 01 00 6a f8 14 00 00 00 00 00 00 00 00 00 00 00 00 00 00 00 00 00 00 01
E: 4.053873 25 31 01 60 6a c0 14 00 00 00 00 00 00 00 00 00 00 00 00 00 00 00 00 00 00 01
E: 4.068836 25 31 01 c8 6a 88 14 00 00 00 00 00 00 00 00 00 00 00 00 00 00 00 00 00 00 01
E: 4.083827 25 31 01 28 6b 48 14 00 00 00 00 00 00 00 00 00 00 00 00 00 00 00 00 00 00 01
E: 4.100089 25 31 01 98 6b 08 14 00 00 00 00 00 00 00 00 00 00 00 00 00 00 00 00 00 00 01
E: 4.115064 25 31 01 08 6c d0 13 00 00 00 00 00 00 00 00 00 00 00 00 00 00 00 00 00 00 01
E: 4.131259 25 31 01 78 6c 88 13 00 00 00 00 00 00 00 00 00 00 00 00 00 00 00 00 00 00 01
E: 4.145879 25 31 01 f8 6c 30 13 00 00 00 00 00 00 00 00 00 00 00 00 00 00 00 00 00 00 01
E: 4.161833 25 31 01 60 6d e0 12 00 00 00 00 00 00 00 00 00 00 00 00 00 00 00 00 00 00 01
E: 4.176826 25 31 01 c0 6d 98 12 00 00 00 00 00 00 00 00 00 00 00 00 00 00 00 00 00 00 01
E: 4.192820 25 31 01 18 6e 50 12 00 00 00 00 00 00 00 00 00 00 00 00 00 00 00 00 00 00 01
E: 4.207819 25 31 01 68 6e 28 12 00 00 00 00 00 00 00 00 00 00 00 00 00 00 00 00 00 00 01
E: 4.223986 25 31 01 a8 6e f0 11 00 00 00 00 00 00 00 00 00 00 00 00 00 00 00 00 00 00 01
E: 4.238944 25 31 01 f0 6e b0 11 00 00 00 00 00 00 00 00 00 00 00 00 00 00 00 00 00 00 01
E: 4.255133 25 31 01 38 6f 70 11 00 00 00 00 00 00 00 00 00 00 00 00 00 00 00 00 00 00 01
E: 4.270103 25 31 01 88 6f 30 11 00 00 00 00 00 00 00 00 00 00 00 00 00 00 00 00 00 00 01
E: 4.286079 25 31 01 d8 6f f0 10 00 00 00 00 00 00 00 00 00 00 00 00 00 00 00 00 00 00 01
E: 4.301236 25 31 01 28 70 a8 10 00 00 00 00 00 00 00 00 00 00 00 00 00 00 00 00 00 00 01
E: 4.315995 25 31 01 80 70 60 10 00 00 00 00 00 00 00 00 00 00 00 00 00 00 00 00 00 00 01
E: 4.332177 25 31 01 d0 70 20 10 00 00 00 00 00 00 00 00 00 00 00 00 00 00 00 00 00 00 01
E: 4.347188 25 31 01 20 71 d8 0f 00 00 00 00 00 00 00 00 00 00 00 00 00 00 00 00 00 00 01
E: 4.362968 25 31 01 70 71 98 0f 00 00 00 00 00 00 00 00 00 00 00 00 00 00 00 00 00 00 01
E: 4.378239 25 31 01 d0 71 48 0f 00 00 00 00 00 00 00 00 00 00 00 00 00 00 00 00 00 00 01
E: 4.393875 25 31 01 20 72 08 0f 00 00 00 00 00 00 00 00 00 00 00 00 00 00 00 00 00 00 01
E: 4.408800 25 31 01 70 72 c8 0e 00 00 00 00 00 00 00 00 00 00 00 00 00 00 00 00 00 00 01
E: 4.424819 25 31 01 c0 72 88 0e 00 00 00 00 00 00 00 00 00 00 00 00 00 00 00 00 00 00 01
E: 4.439815 25 31 01 10 73 48 0e 00 00 00 00 00 00 00 00 00 00 00 00 00 00 00 00 00 00 01
E: 4.455814 25 31 01 60 73 00 0e 00 00 00 00 00 00 00 00 00 00 00 00 00 00 00 00 00 00 01
E: 4.470813 25 31 01 b8 73 b8 0d 00 00 00 00 00 00 00 00 00 00 00 00 00 00 00 00 00 00 01
E: 4.486812 25 31 01 08 74 78 0d 00 00 00 00 00 00 00 00 00 00 00 00 00 00 00 00 00 00 01
E: 4.501810 25 31 01 50 74 50 0d 00 00 00 00 00 00 00 00 00 00 00 00 00 00 00 00 00 00 01
E: 4.517786 25 31 01 a0 74 10 0d 00 00 00 00 00 00 00 00 00 00 00 00 00 00 00 00 00 00 01
E: 4.533239 25 31 01 e8 74 c8 0c 00 00 00 00 00 00 00 00 00 00 00 00 00 00 00 00 00 00 01
E: 4.548921 25 31 01 30 75 78 0c 00 00 00 00 00 00 00 00 00 00 00 00 00 00 00 00 00 00 01
E: 4.563976 25 31 01 80 75 30 0c 00 00 00 00 00 00 00 00 00 00 00 00 00 00 00 00 00 00 01
E: 4.579832 25 31 01 c0 75 f0 0b 00 00 00 00 00 00 00 00 00 00 00 00 00 00 00 00 00 00 01
E: 4.594813 25 31 01 18 76 98 0b 00 00 00 00 00 00 00 00 00 00 00 00 00 00 00 00 00 00 01
E: 4.609809 25 31 01 68 76 38 0b 00 00 00 00 00 00 00 00 00 00 00 00 00 00 00 00 00 00 01
E: 4.625807 25 31 01 c0 76 e0 0a 00 00 00 00 00 00 00 00 00 00 00 00 00 00 00 00 00 00 01
E: 4.640807 25 31 01 18 77 88 0a 00 00 00 00 00 00 00 00 00 00 00 00 00 00 00 00 00 00 01
E: 4.656806 25 31 01 70 77 30 0a 00 00 00 00 00 00 00 00 00 00 00 00 00 00 00 00 00 00 01
E: 4.671806 25 31 01 c0 77 e0 09 00 00 00 00 00 00 00 00 00 00 00 00 00 00 00 00 00 00 01
E: 4.688169 25 31 01 f8 77 a0 09 00 00 00 00 00 00 00 00 00 00 00 00 00 00 00 00 00 00 01
E: 4.703049 25 31 01 30 78 60 09 00 00 00 00 00 00 00 00 00 00 00 00 00 00 00 00 00 00 01
E: 4.719027 25 31 01 68 78 30 09 00 00 00 00 00 00 00 00 00 00 00 00 00 00 00 00 00 00 01
E: 4.733853 25 31 01 98 78 f8 08 00 00 00 00 00 00 00 00 00 00 00 00 00 00 00 00 00 00 01
E: 4.749813 25 31 01 b8 78 c0 08 00 00 00 00 00 00 00 00 00 00 00 00 00 00 00 00 00 00 01
E: 4.764806 25 31 01 e8 78 98 08 00 00 00 00 00 00 00 00 00 00 00 00 00 00 00 00 00 00 01
E: 4.780803 25 31 01 00 79 70 08 00 00 00 00 00 00 00 00 00 00 00 00 00 00 00 00 00 00 01
E: 4.796248 25 31 01 38 79 30 08 00 00 00 00 00 00 00 00 00 00 00 00 00 00 00 00 00 00 01
E: 4.811969 25 31 01 68 79 10 08 00 00 00 00 00 00 00 00 00 00 00 00 00 00 00 00 00 00 01
E: 4.827146 25 31 01 90 79 d0 07 00 00 00 00 00 00 00 00 00 00 00 00 00 00 00 00 00 00 01
E: 4.843099 25 31 01 a8 79 b8 07 00 00 00 00 00 00 00 00 00 00 00 00 00 00 00 00 00 00 01
E: 4.858282 25 31 01 d0 79 80 07 00 00 00 00 00 00 00 00 00 00 00 00 00 00 00 00 00 00 01
E: 4.873189 25 31 01 e8 79 68 07 00 00 00 00 00 00 00 00 00 00 00 00 00 00 00 00 00 00 01
E: 4.888987 25 31 01 08 7a 48 07 00 00 00 00 00 00 00 00 00 00 00 00 00 00 00 00 00 00 01
E: 4.903975 25 31 01 20 7a 38 07 00 00 00 00 00 00 00 00 00 00 00 00 00 00 00 00 00 00 01
E: 4.919841 25 31 01 38 7a 28 07 00 00 00 00 00 00 00 00 00 00 00 00 00 00 00 00 00 00 01
E: 4.935126 25 31 01 40 7a 20 07 00 00 00 00 00 00 00 00 00 00 00 00 00 00 00 00 00 00 01
E: 4.951061 25 31 01 58 7a 10 07 00 00 00 00 00 00 00 00 00 00 00 00 00 00 00 00 00 00 01
E: 4.966018 25 31 01 70 7a e8 06 00 00 00 00 00 00 00 00 00 00 00 00 00 00 00 00 00 00 01
E: 4.981863 25 31 01 88 7a d8 06 00 00 00 00 00 00 00 00 00 00 00 00 00 00 00 00 00 00 01
E: 4.996821 25 31 01 a0 7a d8 06 00 00 00 00 00 00 00 00 00 00 00 00 00 00 00 00 00 00 01
E: 5.012802 25 31 01 b8 7a c8 06 00 00 00 00 00 00 00 00 00 00 00 00 00 00 00 00 00 00 01
E: 5.027801 25 31 01 d0 7a a8 06 00 00 00 00 00 00 00 00 00 00 00 00 00 00 00 00 00 00 01
E: 5.044107 25 31 01 e8 7a 90 06 00 00 00 00 00 00 00 00 00 00 00 00 00 00 00 00 00 00 01
E: 5.059135 25 31 01 00 7b 80 06 00 00 00 00 00 00 00 00 00 00 00 00 00 00 00 00 00 00 01
E: 5.075280 25 31 01 18 7b 70 06 00 00 00 00 00 00 00 00 00 00 00 00 00 00 00 00 00 00 01
E: 5.090013 25 31 01 30 7b 48 06 00 00 00 00 00 00 00 00 00 00 00 00 00 00 00 00 00 00 01
E: 5.104900 25 31 01 40 7b 38 06 00 00 00 00 00 00 00 00 00 00 00 00 00 00 00 00 00 00 01
E: 5.121208 25 31 01 58 7b 28 06 00 00 00 00 00 00 00 00 00 00 00 00 00 00 00 00 00 00 01
E: 5.135845 25 31 01 68 7b 20 06 00 00 00 00 00 00 00 00 00 00 00 00 00 00 00 00 00 00 01
E: 5.151816 25 31 01 80 7b f8 05 00 00 00 00 00 00 00 00 00 00 00 00 00 00 00 00 00 00 01
E: 5.166808 25 31 01 98 7b e0 05 00 00 00 00 00 00 00 00 00 00 00 00 00 00 00 00 00 00 01
E: 5.182795 25 31 01 b8 7b c8 05 00 00 00 00 00 00 00 00 00 00 00 00 00 00 00 00 00 00 01
E: 5.197793 25 31 01 c8 7b a8 05 00 00 00 00 00 00 00 00 00 00 00 00 00 00 00 00 00 00 01
E: 5.213829 25 31 01 d8 7b 98 05 00 00 00 00 00 00 00 00 00 00 00 00 00 00 00 00 00 00 01
E: 5.228791 25 31 01 f0 7b 88 05 00 00 00 00 00 00 00 00 00 00 00 00 00 00 00 00 00 00 01
E: 5.244790 25 31 01 10 7c 60 05 00 00 00 00 00 00 00 00 00 00 00 00 00 00 00 00 00 00 01
E: 5.259798 25 31 01 28 7c 48 05 00 00 00 00 00 00 00 00 00 00 00 00 00 00 00 00 00 00 01
E: 5.275788 25 31 01 40 7c 38 05 00 00 00 00 00 00 00 00 00 00 00 00 00 00 00 00 00 00 01
E: 5.290789 25 31 01 60 7c 10 05 00 00 00 00 00 00 00 00 00 00 00 00 00 00 00 00 00 00 01
E: 5.306789 25 31 01 78 7c 10 05 00 00 00 00 00 00 00 00 00 00 00 00 00 00 00 00 00 00 01
E: 5.321788 25 31 01 90 7c f8 04 00 00 00 00 00 00 00 00 00 00 00 00 00 00 00 00 00 00 01
E: 5.337786 25 31 01 a8 7c f0 04 00 00 00 00 00 00 00 00 00 00 00 00 00 00 00 00 00 00 01
E: 5.352787 25 31 01 c0 7c d0 04 00 00 00 00 00 00 00 00 00 00 00 00 00 00 00 00 00 00 01
E: 5.368786 25 31 01 d8 7c b8 04 00 00 00 00 00 00 00 00 00 00 00 00 00 00 00 00 00 00 01
E: 5.383787 25 31 01 e8 7c b8 04 00 00 00 00 00 00 00 00 00 00 00 00 00 00 00 00 00 00 01
E: 5.398786 25 31 01 00 7d b0 04 00 00 00 00 00 00 00 00 00 00 00 00 00 00 00 00 00 00 01
E: 5.414778 25 31 01 20 7d 80 04 00 00 00 00 00 00 00 00 00 00 00 00 00 00 00 00 00 00 01
E: 5.429784 25 31 01 38 7d 70 04 00 00 00 00 00 00 00 00 00 00 00 00 00 00 00 00 00 00 01
E: 5.446129 25 31 01 50 7d 68 04 00 00 00 00 00 00 00 00 00 00 00 00 00 00 00 00 00 00 01
E: 5.460953 25 31 01 70 7d 40 04 00 00 00 00 00 00 00 00 00 00 00 00 00 00 00 00 00 00 01
E: 5.476919 25 31 01 88 7d 38 04 00 00 00 00 00 00 00 00 00 00 00 00 00 00 00 00 00 00 01
E: 5.491831 25 31 01 98 7d 28 04 00 00 00 00 00 00 00 00 00 00 00 00 00 00 00 00 00 00 01
E: 5.507802 25 31 01 a8 7d 08 04 00 00 00 00 00 00 00 00 00 00 00 00 00 00 00 00 00 00 01
E: 5.522797 25 31 01 c0 7d f0 03 00 00 00 00 00 00 00 00 00 00 00 00 00 00 00 00 00 00 01
E: 5.539173 25 31 01 d0 7d e8 03 00 00 00 00 00 00 00 00 00 00 00 00 00 00 00 00 00 00 01
E: 5.553970 25 31 01 d8 7d e0 03 00 00 00 00 00 00 00 00 00 00 00 00 00 00 00 00 00 00 01
E: 5.569906 25 31 01 e0 7d b8 03 00 00 00 00 00 00 00 00 00 00 00 00 00 00 00 00 00 00 01
E: 5.585030 25 31 01 e0 7d b0 03 00 00 00 00 00 00 00 00 00 00 00 00 00 00 00 00 00 00 01
E: 5.600827 25 31 01 e8 7d a0 03 00 00 00 00 00 00 00 00 00 00 00 00 00 00 00 00 00 00 01
E: 5.617159 25 31 01 f8 7d 98 03 00 00 00 00 00 00 00 00 00 00 00 00 00 00 00 00 00 00 01
E: 5.631834 25 31 01 f8 7d 78 03 00 00 00 00 00 00 00 00 00 00 00 00 00 00 00 00 00 00 01
E: 5.646801 25 31 01 08 7e 60 03 00 00 00 00 00 00 00 00 00 00 00 00 00 00 00 00 00 00 01
E: 5.662795 25 31 01 10 7e 58 03 00 00 00 00 00 00 00 00 00 00 00 00 00 00 00 00 00 00 01
E: 5.678782 25 31 01 20 7e 48 03 00 00 00 00 00 00 00 00 00 00 00 00 00 00 00 00 00 00 01
E: 5.693780 25 31 01 40 7e 48 03 00 00 00 00 00 00 00 00 00 00 00 00 00 00 00 00 00 00 01
E: 5.708778 25 31 01 58 7e 40 03 00 00 00 00 00 00 00 00 00 00 00 00 00 00 00 00 00 00 01
E: 5.725191 25 31 01 60 7e 28 03 00 00 00 00 00 00 00 00 00 00 00 00 00 00 00 00 00 00 01
E: 5.739982 25 31 01 70 7e 20 03 00 00 00 00 00 00 00 00 00 00 00 00 00 00 00 00 00 00 01
E: 5.754896 25 31 01 80 7e 20 03 00 00 00 00 00 00 00 00 00 00 00 00 00 00 00 00 00 00 01
E: 5.771228 25 31 01 98 7e 30 03 00 00 00 00 00 00 00 00 00 00 00 00 00 00 00 00 00 00 01
E: 5.785992 25 31 01 b0 7e 30 03 00 00 00 00 00 00 00 00 00 00 00 00 00 00 00 00 00 00 01
E: 5.801950 25 31 01 d0 7e 18 03 00 00 00 00 00 00 00 00 00 00 00 00 00 00 00 00 00 00 01
E: 5.817064 25 31 01 e0 7e 00 03 00 00 00 00 00 00 00 00 00 00 00 00 00 00 00 00 00 00 01
E: 5.833031 25 31 01 f8 7e f0 02 00 00 00 00 00 00 00 00 00 00 00 00 00 00 00 00 00 00 01
E: 5.848331 25 31 01 38 7f 40 02 00 00 00 00 00 00 00 00 00 00 00 00 00 00 00 00 00 00 01
E: 5.863842 25 31 01 50 7f 20 02 00 00 00 00 00 00 00 00 00 00 00 00 00 00 00 00 00 00 01
E: 5.878793 25 31 01 50 7f 20 02 00 00 00 00 00 00 00 00 00 00 00 00 00 00 00 00 00 00 01
E: 5.894783 25 31 01 50 7f 20 02 00 00 00 00 00 00 00 00 00 00 00 00 00 00 00 00 00 00 01
E: 5.909768 25 31 01 50 7f 18 02 00 00 00 00 00 00 00 00 00 00 00 00 00 00 00 00 00 00 01
E: 5.925772 25 31 01 48 7f f0 01 00 00 00 00 00 00 00 00 00 00 00 00 00 00 00 00 00 00 01
E: 5.940839 25 31 01 48 7f e8 01 00 00 00 00 00 00 00 00 00 00 00 00 00 00 00 00 00 00 01
E: 5.956832 25 31 01 48 7f e8 01 00 00 00 00 00 00 00 00 00 00 00 00 00 00 00 00 00 00 01
E: 5.971812 25 31 01 48 7f e8 01 00 00 00 00 00 00 00 00 00 00 00 00 00 00 00 00 00 00 01
E: 5.986781 25 31 01 50 7f f0 01 00 00 00 00 00 00 00 00 00 00 00 00 00 00 00 00 00 00 01
E: 6.003162 25 31 01 50 7f f0 01 00 00 00 00 00 00 00 00 00 00 00 00 00 00 00 00 00 00 01
E: 6.017814 25 31 01 50 7f f0 01 00 00 00 00 00 00 00 00 00 00 00 00 00 00 00 00 00 00 01
E: 6.033784 25 31 01 50 7f f0 01 00 00 00 00 00 00 00 00 00 00 00 00 00 00 00 00 00 00 01
E: 6.048766 25 31 01 50 7f f0 01 00 00 00 00 00 00 00 00 00 00 00 00 00 00 00 00 00 00 01
E: 6.064765 25 31 01 50 7f f0 01 00 00 00 00 00 00 00 00 00 00 00 00 00 00 00 00 00 00 01
E: 6.079765 25 31 01 50 7f f0 01 00 00 00 00 00 00 00 00 00 00 00 00 00 00 00 00 00 00 01
E: 6.095764 25 31 01 50 7f f0 01 00 00 00 00 00 00 00 00 00 00 00 00 00 00 00 00 00 00 01
E: 6.110763 25 31 01 50 7f f0 01 00 00 00 00 00 00 00 00 00 00 00 00 00 00 00 00 00 00 01
E: 6.126771 25 31 01 50 7f f0 01 00 00 00 00 00 00 00 00 00 00 00 00 00 00 00 00 00 00 01
E: 6.141763 25 31 01 50 7f f0 01 00 00 00 00 00 00 00 00 00 00 00 00 00 00 00 00 00 00 01
E: 6.157762 25 31 01 50 7f f0 01 00 00 00 00 00 00 00 00 00 00 00 00 00 00 00 00 00 00 01
E: 6.172768 25 31 01 68 7f 30 02 00 00 00 00 00 00 00 00 00 00 00 00 00 00 00 00 00 00 01
E: 6.188824 25 31 01 68 7f 30 02 00 00 00 00 00 00 00 00 00 00 00 00 00 00 00 00 00 00 01
E: 6.203826 25 31 01 58 7f 00 02 00 00 00 00 00 00 00 00 00 00 00 00 00 00 00 00 00 00 01
E: 6.220193 25 31 01 58 7f f8 01 00 00 00 00 00 00 00 00 00 00 00 00 00 00 00 00 00 00 01
E: 6.234804 25 31 01 58 7f f8 01 00 00 00 00 00 00 00 00 00 00 00 00 00 00 00 00 00 00 01
E: 6.249775 25 31 01 58 7f 00 02 00 00 00 00 00 00 00 00 00 00 00 00 00 00 00 00 00 00 01
E: 6.265769 25 31 01 68 7f 30 02 00 00 00 00 00 00 00 00 00 00 00 00 00 00 00 00 00 00 01
E: 6.280978 25 31 01 58 7f 00 02 00 00 00 00 00 00 00 00 00 00 00 00 00 00 00 00 00 00 01
E: 6.296788 25 31 01 58 7f 00 02 00 00 00 00 00 00 00 00 00 00 00 00 00 00 00 00 00 00 01
E: 6.312171 25 31 01 50 7f f8 01 00 00 00 00 00 00 00 00 00 00 00 00 00 00 00 00 00 00 01
E: 6.327832 25 31 01 50 7f e8 01 00 00 00 00 00 00 00 00 00 00 00 00 00 00 00 00 00 00 01
E: 6.342772 25 31 01 50 7f e0 01 00 00 00 00 00 00 00 00 00 00 00 00 00 00 00 00 00 00 01
E: 6.358772 25 31 01 50 7f e0 01 00 00 00 00 00 00 00 00 00 00 00 00 00 00 00 00 00 00 01
E: 6.373757 25 31 01 50 7f e0 01 00 00 00 00 00 00 00 00 00 00 00 00 00 00 00 00 00 00 01
E: 6.389756 25 31 01 50 7f e0 01 00 00 00 00 00 00 00 00 00 00 00 00 00 00 00 00 00 00 01
E: 6.404755 25 31 01 50 7f e0 01 00 00 00 00 00 00 00 00 00 00 00 00 00 00 00 00 00 00 01
E: 6.420755 25 31 01 50 7f e0 01 00 00 00 00 00 00 00 00 00 00 00 00 00 00 00 00 00 00 01
E: 6.435755 25 31 01 50 7f e0 01 00 00 00 00 00 00 00 00 00 00 00 00 00 00 00 00 00 00 01
E: 6.451754 25 31 01 50 7f e0 01 00 00 00 00 00 00 00 00 00 00 00 00 00 00 00 00 00 00 01
E: 6.466754 25 31 01 50 7f e0 01 00 00 00 00 00 00 00 00 00 00 00 00 00 00 00 00 00 00 01
E: 6.482754 25 31 01 50 7f e0 01 00 00 00 00 00 00 00 00 00 00 00 00 00 00 00 00 00 00 01
E: 6.497753 25 31 01 50 7f e0 01 00 00 00 00 00 00 00 00 00 00 00 00 00 00 00 00 00 00 01
E: 6.512755 25 31 01 48 7f e0 01 00 00 00 00 00 00 00 00 00 00 00 00 00 00 00 00 00 00 01
E: 6.528753 25 31 01 48 7f e0 01 00 00 00 00 00 00 00 00 00 00 00 00 00 00 00 00 00 00 01
E: 6.543751 25 31 01 48 7f e0 01 00 00 00 00 00 00 00 00 00 00 00 00 00 00 00 00 00 00 01
E: 6.559752 25 31 01 48 7f e0 01 00 00 00 00 00 00 00 00 00 00 00 00 00 00 00 00 00 00 01
E: 6.574751 25 31 01 48 7f e0 01 00 00 00 00 00 00 00 00 00 00 00 00 00 00 00 00 00 00 01
E: 6.590754 25 31 01 50 7f f8 01 00 00 00 00 00 00 00 00 00 00 00 00 00 00 00 00 00 00 01
E: 6.606104 25 31 01 50 7f f8 01 00 00 00 00 00 00 00 00 00 00 00 00 00 00 00 00 00 00 01
E: 6.622076 25 31 01 50 7f f8 01 00 00 00 00 00 00 00 00 00 00 00 00 00 00 00 00 00 00 01
E: 6.636804 25 31 01 50 7f f8 01 00 00 00 00 00 00 00 00 00 00 00 00 00 00 00 00 00 00 01
E: 6.652768 25 31 01 50 7f f8 01 00 00 00 00 00 00 00 00 00 00 00 00 00 00 00 00 00 00 01
E: 6.667751 25 31 01 50 7f f8 01 00 00 00 00 00 00 00 00 00 00 00 00 00 00 00 00 00 00 01
E: 6.683760 25 31 01 50 7f f8 01 00 00 00 00 00 00 00 00 00 00 00 00 00 00 00 00 00 00 01
E: 6.698757 25 31 01 50 7f f0 01 00 00 00 00 00 00 00 00 00 00 00 00 00 00 00 00 00 00 01
E: 6.714751 25 31 01 48 7f f0 01 00 00 00 00 00 00 00 00 00 00 00 00 00 00 00 00 00 00 01
E: 6.738841 25 31 01 10 7f e0 01 00 00 00 00 00 00 00 00 00 00 00 00 00 00 00 00 00 00 01
E: 6.740919 25 30 01 58 7e e0 01 00 00 00 00 00 00 00 00 00 00 00 00 00 00 00 00 00 00 01
# 2. Land one finger,
   - land a second finger far enough from the first
   - move your two fingers
   - release the *first* finger
   - release the second finger
E: 9.715753 25 31 01 28 13 58 5c 00 00 00 00 00 00 00 00 00 00 00 00 00 00 00 00 00 00 01
E: 9.730705 25 31 01 28 13 58 5c 00 00 00 00 00 00 00 00 00 00 00 00 00 00 00 00 00 00 01
E: 9.746682 25 31 01 28 13 50 5c 00 00 00 00 00 00 00 00 00 00 00 00 00 00 00 00 00 00 01
E: 9.761678 25 31 01 28 13 30 5c 00 00 00 00 00 00 00 00 00 00 00 00 00 00 00 00 00 00 01
E: 9.776674 25 31 01 28 13 28 5c 00 00 00 00 00 00 00 00 00 00 00 00 00 00 00 00 00 00 01
E: 9.792673 25 31 01 30 13 20 5c 00 00 00 00 00 00 00 00 00 00 00 00 00 00 00 00 00 00 01
E: 9.807644 25 31 01 30 13 20 5c 00 00 00 00 00 00 00 00 00 00 00 00 00 00 00 00 00 00 01
E: 9.823671 25 31 01 30 13 20 5c 00 00 00 00 00 00 00 00 00 00 00 00 00 00 00 00 00 00 01
E: 9.838669 25 31 01 30 13 20 5c 00 00 00 00 00 00 00 00 00 00 00 00 00 00 00 00 00 00 01
E: 9.854667 25 31 01 30 13 20 5c 00 00 00 00 00 00 00 00 00 00 00 00 00 00 00 00 00 00 01
E: 9.869668 25 31 01 30 13 20 5c 00 00 00 00 00 00 00 00 00 00 00 00 00 00 00 00 00 00 01
E: 9.885672 25 31 01 30 13 38 5c 00 00 00 00 00 00 00 00 00 00 00 00 00 00 00 00 00 00 01
E: 9.900667 25 31 01 30 13 38 5c 00 00 00 00 00 00 00 00 00 00 00 00 00 00 00 00 00 00 01
E: 9.916669 25 31 01 30 13 30 5c 00 00 00 00 00 00 00 00 00 00 00 00 00 00 00 00 00 00 01
E: 9.931665 25 31 01 30 13 30 5c 00 00 00 00 00 00 00 00 00 00 00 00 00 00 00 00 00 00 01
E: 9.947665 25 31 01 30 13 30 5c 00 00 00 00 00 00 00 00 00 00 00 00 00 00 00 00 00 00 01
E: 9.962665 25 31 01 30 13 30 5c 00 00 00 00 00 00 00 00 00 00 00 00 00 00 00 00 00 00 01
E: 9.978664 25 31 01 30 13 30 5c 00 00 00 00 00 00 00 00 00 00 00 00 00 00 00 00 00 00 01
E: 9.993664 25 31 01 30 13 30 5c 00 00 00 00 00 00 00 00 00 00 00 00 00 00 00 00 00 00 01
E: 10.009665 25 31 01 30 13 30 5c 00 00 00 00 00 00 00 00 00 00 00 00 00 00 00 00 00 00 01
E: 10.024665 25 31 01 30 13 28 5c 00 00 00 00 00 00 00 00 00 00 00 00 00 00 00 00 00 00 01
E: 10.039662 25 31 01 30 13 28 5c 00 00 00 00 00 00 00 00 00 00 00 00 00 00 00 00 00 00 01
E: 10.055662 25 31 01 30 13 28 5c 00 00 00 00 00 00 00 00 00 00 00 00 00 00 00 00 00 00 01
E: 10.070662 25 31 01 30 13 28 5c 00 00 00 00 00 00 00 00 00 00 00 00 00 00 00 00 00 00 01
E: 10.086661 25 31 01 30 13 28 5c 00 00 00 00 00 00 00 00 00 00 00 00 00 00 00 00 00 00 01
E: 10.101661 25 31 01 30 13 28 5c 00 00 00 00 00 00 00 00 00 00 00 00 00 00 00 00 00 00 01
E: 10.117660 25 31 01 30 13 28 5c 00 00 00 00 00 00 00 00 00 00 00 00 00 00 00 00 00 00 01
E: 10.132661 25 31 01 30 13 28 5c 00 00 00 00 00 00 00 00 00 00 00 00 00 00 00 00 00 00 01
E: 10.148659 25 31 01 30 13 28 5c 00 00 00 00 00 00 00 00 00 00 00 00 00 00 00 00 00 00 01
E: 10.163661 25 31 01 30 13 28 5c 00 00 00 00 00 00 00 00 00 00 00 00 00 00 00 00 00 00 01
E: 10.179657 25 31 01 30 13 28 5c 00 00 00 00 00 00 00 00 00 00 00 00 00 00 00 00 00 00 01
E: 10.194661 25 31 01 30 13 20 5c 00 00 00 00 00 00 00 00 00 00 00 00 00 00 00 00 00 00 01
E: 10.210658 25 31 01 30 13 20 5c 00 00 00 00 00 00 00 00 00 00 00 00 00 00 00 00 00 00 01
E: 10.225657 25 31 01 30 13 20 5c 00 00 00 00 00 00 00 00 00 00 00 00 00 00 00 00 00 00 01
E: 10.241661 25 31 01 38 13 20 5c 00 00 00 00 00 00 00 00 00 00 00 00 00 00 00 00 00 00 01
E: 10.256657 25 31 01 38 13 20 5c 00 00 00 00 00 00 00 00 00 00 00 00 00 00 00 00 00 00 01
E: 10.271657 25 31 01 38 13 20 5c 00 00 00 00 00 00 00 00 00 00 00 00 00 00 00 00 00 00 01
E: 10.287655 25 31 01 38 13 20 5c 00 00 00 00 00 00 00 00 00 00 00 00 00 00 00 00 00 00 01
E: 10.302654 25 31 01 38 13 20 5c 00 00 00 00 00 00 00 00 00 00 00 00 00 00 00 00 00 00 01
E: 10.318654 25 31 01 38 13 20 5c 00 00 00 00 00 00 00 00 00 00 00 00 00 00 00 00 00 00 01
E: 10.333656 25 31 01 38 13 20 5c 00 00 00 00 00 00 00 00 00 00 00 00 00 00 00 00 00 00 01
E: 10.349660 25 31 01 38 13 20 5c 00 00 00 00 00 00 00 00 00 00 00 00 00 00 00 00 00 00 01
E: 10.364655 25 31 01 38 13 20 5c 00 00 00 00 00 00 00 00 00 00 00 00 00 00 00 00 00 00 01
E: 10.380654 25 31 01 38 13 20 5c 00 00 00 00 00 00 00 00 00 00 00 00 00 00 00 00 00 00 01
E: 10.395654 25 31 01 38 13 20 5c 00 00 00 00 00 00 00 00 00 00 00 00 00 00 00 00 00 00 01
E: 10.411653 25 31 01 38 13 20 5c 00 00 00 00 00 00 00 00 00 00 00 00 00 00 00 00 00 00 01
E: 10.426654 25 31 01 38 13 20 5c 00 00 00 00 00 00 00 00 00 00 00 00 00 00 00 00 00 00 01
E: 10.442653 25 31 01 38 13 20 5c 00 00 00 00 00 00 00 00 00 00 00 00 00 00 00 00 00 00 01
E: 10.457653 25 31 01 38 13 20 5c 00 00 00 00 00 00 00 00 00 00 00 00 00 00 00 00 00 00 01
E: 10.473651 25 31 01 38 13 20 5c 00 00 00 00 00 00 00 00 00 00 00 00 00 00 00 00 00 00 01
E: 10.488651 25 31 01 38 13 20 5c 00 00 00 00 00 00 00 00 00 00 00 00 00 00 00 00 00 00 01
E: 10.504651 25 31 01 38 13 20 5c 00 00 00 00 00 00 00 00 00 00 00 00 00 00 00 00 00 00 01
E: 10.519653 25 31 01 38 13 28 5c 00 00 00 00 00 00 00 00 00 00 00 00 00 00 00 00 00 00 01
E: 10.534650 25 31 01 38 13 28 5c 00 00 00 00 00 00 00 00 00 00 00 00 00 00 00 00 00 00 01
E: 10.550663 25 31 01 38 13 28 5c 00 00 00 00 00 00 00 00 00 00 00 00 00 00 00 00 00 00 01
E: 10.565651 25 31 01 38 13 28 5c 00 00 00 00 00 00 00 00 00 00 00 00 00 00 00 00 00 00 01
E: 10.581648 25 31 01 38 13 28 5c 00 00 00 00 00 00 00 00 00 00 00 00 00 00 00 00 00 00 01
E: 10.596648 25 31 01 38 13 28 5c 00 00 00 00 00 00 00 00 00 00 00 00 00 00 00 00 00 00 01
E: 10.612622 25 31 01 38 13 28 5c 00 00 00 00 00 00 00 00 00 00 00 00 00 00 00 00 00 00 01
E: 10.627647 25 31 01 38 13 28 5c 00 00 00 00 00 00 00 00 00 00 00 00 00 00 00 00 00 00 01
E: 10.643647 25 31 01 38 13 28 5c 00 00 00 00 00 00 00 00 00 00 00 00 00 00 00 00 00 00 01
E: 10.658647 25 31 01 38 13 28 5c 00 00 00 00 00 00 00 00 00 00 00 00 00 00 00 00 00 00 01
E: 10.674650 25 31 01 38 13 28 5c 00 00 00 00 00 00 00 00 00 00 00 00 00 00 00 00 00 00 01
E: 10.689646 25 31 01 38 13 28 5c 00 00 00 00 00 00 00 00 00 00 00 00 00 00 00 00 00 00 01
E: 10.705647 25 31 01 38 13 28 5c 00 00 00 00 00 00 00 00 00 00 00 00 00 00 00 00 00 00 01
E: 10.720698 25 31 01 38 13 28 5c 00 00 00 00 00 00 00 00 00 00 00 00 00 00 00 00 00 00 01
E: 10.736699 25 31 01 38 13 28 5c 00 00 00 00 00 00 00 00 00 00 00 00 00 00 00 00 00 00 01
E: 10.751700 25 31 01 38 13 28 5c 00 00 00 00 00 00 00 00 00 00 00 00 00 00 00 00 00 00 01
E: 10.767698 25 31 01 38 13 28 5c 00 00 00 00 00 00 00 00 00 00 00 00 00 00 00 00 00 00 01
E: 10.782696 25 31 01 38 13 28 5c 00 00 00 00 00 00 00 00 00 00 00 00 00 00 00 00 00 00 01
E: 10.797697 25 31 01 38 13 28 5c 00 00 00 00 00 00 00 00 00 00 00 00 00 00 00 00 00 00 01
E: 10.813695 25 31 01 38 13 28 5c 00 00 00 00 00 00 00 00 00 00 00 00 00 00 00 00 00 00 01
E: 10.828697 25 31 01 38 13 28 5c 00 00 00 00 00 00 00 00 00 00 00 00 00 00 00 00 00 00 01
E: 10.844697 25 31 01 38 13 28 5c 00 00 00 00 00 00 00 00 00 00 00 00 00 00 00 00 00 00 01
E: 10.859696 25 31 01 38 13 28 5c 00 00 00 00 00 00 00 00 00 00 00 00 00 00 00 00 00 00 01
E: 10.875693 25 31 01 38 13 28 5c 00 00 00 00 00 00 00 00 00 00 00 00 00 00 00 00 00 00 01
E: 10.890696 25 31 01 38 13 28 5c 00 00 00 00 00 00 00 00 00 00 00 00 00 00 00 00 00 00 01
E: 10.906695 25 31 01 38 13 28 5c 00 00 00 00 00 00 00 00 00 00 00 00 00 00 00 00 00 00 01
E: 10.921692 25 31 01 38 13 28 5c 00 00 00 00 00 00 00 00 00 00 00 00 00 00 00 00 00 00 01
E: 10.937693 25 31 01 38 13 28 5c 00 00 00 00 00 00 00 00 00 00 00 00 00 00 00 00 00 00 01
E: 10.952695 25 31 01 38 13 20 5c 00 00 00 00 00 00 00 00 00 00 00 00 00 00 00 00 00 00 01
E: 10.968690 25 31 01 38 13 20 5c 00 00 00 00 00 00 00 00 00 00 00 00 00 00 00 00 00 00 01
E: 10.983692 25 31 01 38 13 20 5c 00 00 00 00 00 00 00 00 00 00 00 00 00 00 00 00 00 00 01
E: 10.999695 25 31 01 38 13 20 5c 00 00 00 00 00 00 00 00 00 00 00 00 00 00 00 00 00 00 01
E: 11.014696 25 31 01 30 13 20 5c 00 00 00 00 00 00 00 00 00 00 00 00 00 00 00 00 00 00 01
E: 11.030693 25 31 01 30 13 20 5c 00 00 00 00 00 00 00 00 00 00 00 00 00 00 00 00 00 00 01
E: 11.045690 25 31 01 30 13 20 5c 00 00 00 00 00 00 00 00 00 00 00 00 00 00 00 00 00 00 01
E: 11.060688 25 31 01 30 13 20 5c 00 00 00 00 00 00 00 00 00 00 00 00 00 00 00 00 00 00 01
E: 11.076691 25 31 01 30 13 20 5c 00 00 00 00 00 00 00 00 00 00 00 00 00 00 00 00 00 00 01
E: 11.091691 25 31 01 30 13 20 5c 00 00 00 00 00 00 00 00 00 00 00 00 00 00 00 00 00 00 01
E: 11.107694 25 31 01 30 13 28 5c 00 00 00 00 00 00 00 00 00 00 00 00 00 00 00 00 00 00 01
E: 11.122635 25 31 01 30 13 28 5c 00 00 00 00 00 00 00 00 00 00 00 00 00 00 00 00 00 00 01
E: 11.138634 25 31 01 30 13 28 5c 00 00 00 00 00 00 00 00 00 00 00 00 00 00 00 00 00 00 01
E: 11.156637 25 31 01 28 13 30 5c 00 00 00 00 00 00 00 00 00 00 00 00 00 00 00 00 00 00 01
E: 11.171637 25 31 01 20 13 38 5c 00 00 00 00 00 00 00 00 00 00 00 00 00 00 00 00 00 00 01
E: 11.187633 25 31 01 20 13 38 5c 00 00 00 00 00 00 00 00 00 00 00 00 00 00 00 00 00 00 01
E: 11.202637 25 31 01 20 13 38 5c 31 02 d8 56 a0 14 00 00 00 00 00 00 00 00 00 00 00 00 02
E: 11.218634 25 31 01 20 13 38 5c 31 02 d8 56 a0 14 00 00 00 00 00 00 00 00 00 00 00 00 02
E: 11.233636 25 31 01 30 13 38 5c 31 02 c8 56 a0 14 00 00 00 00 00 00 00 00 00 00 00 00 02
E: 11.249634 25 31 01 30 13 38 5c 31 02 c8 56 b0 14 00 00 00 00 00 00 00 00 00 00 00 00 02
E: 11.264636 25 31 01 30 13 48 5c 31 02 c0 56 c0 14 00 00 00 00 00 00 00 00 00 00 00 00 02
E: 11.279635 25 31 01 30 13 50 5c 31 02 b8 56 e0 14 00 00 00 00 00 00 00 00 00 00 00 00 02
E: 11.295633 25 31 01 30 13 50 5c 31 02 b0 56 f0 14 00 00 00 00 00 00 00 00 00 00 00 00 02
E: 11.310630 25 31 01 30 13 50 5c 31 02 b0 56 f0 14 00 00 00 00 00 00 00 00 00 00 00 00 02
E: 11.326630 25 31 01 30 13 50 5c 31 02 b0 56 f0 14 00 00 00 00 00 00 00 00 00 00 00 00 02
E: 11.341630 25 31 01 30 13 50 5c 31 02 b0 56 f0 14 00 00 00 00 00 00 00 00 00 00 00 00 02
E: 11.357629 25 31 01 30 13 50 5c 31 02 b0 56 f0 14 00 00 00 00 00 00 00 00 00 00 00 00 02
E: 11.372631 25 31 01 38 13 50 5c 31 02 b0 56 f0 14 00 00 00 00 00 00 00 00 00 00 00 00 02
E: 11.388621 25 31 01 38 13 50 5c 31 02 b0 56 f0 14 00 00 00 00 00 00 00 00 00 00 00 00 02
E: 11.403628 25 31 01 38 13 50 5c 31 02 b0 56 f0 14 00 00 00 00 00 00 00 00 00 00 00 00 02
E: 11.419627 25 31 01 38 13 50 5c 31 02 b0 56 f0 14 00 00 00 00 00 00 00 00 00 00 00 00 02
E: 11.434628 25 31 01 38 13 50 5c 31 02 b0 56 f0 14 00 00 00 00 00 00 00 00 00 00 00 00 02
E: 11.450629 25 31 01 38 13 50 5c 31 02 b0 56 f8 14 00 00 00 00 00 00 00 00 00 00 00 00 02
E: 11.465629 25 31 01 38 13 50 5c 31 02 b0 56 08 15 00 00 00 00 00 00 00 00 00 00 00 00 02
E: 11.481627 25 31 01 38 13 50 5c 31 02 b0 56 08 15 00 00 00 00 00 00 00 00 00 00 00 00 02
E: 11.496640 25 31 01 38 13 50 5c 31 02 b0 56 10 15 00 00 00 00 00 00 00 00 00 00 00 00 02
E: 11.512626 25 31 01 38 13 50 5c 31 02 b0 56 10 15 00 00 00 00 00 00 00 00 00 00 00 00 02
E: 11.527627 25 31 01 30 13 50 5c 31 02 b0 56 28 15 00 00 00 00 00 00 00 00 00 00 00 00 02
E: 11.542627 25 31 01 30 13 50 5c 31 02 b0 56 30 15 00 00 00 00 00 00 00 00 00 00 00 00 02
E: 11.558624 25 31 01 30 13 50 5c 31 02 b0 56 30 15 00 00 00 00 00 00 00 00 00 00 00 00 02
E: 11.573624 25 31 01 30 13 50 5c 31 02 b0 56 30 15 00 00 00 00 00 00 00 00 00 00 00 00 02
E: 11.589624 25 31 01 30 13 50 5c 31 02 b0 56 30 15 00 00 00 00 00 00 00 00 00 00 00 00 02
E: 11.604622 25 31 01 30 13 50 5c 31 02 b0 56 30 15 00 00 00 00 00 00 00 00 00 00 00 00 02
E: 11.620624 25 31 01 30 13 50 5c 31 02 b0 56 30 15 00 00 00 00 00 00 00 00 00 00 00 00 02
E: 11.635622 25 31 01 30 13 50 5c 31 02 b0 56 30 15 00 00 00 00 00 00 00 00 00 00 00 00 02
E: 11.651620 25 31 01 30 13 50 5c 31 02 b0 56 30 15 00 00 00 00 00 00 00 00 00 00 00 00 02
E: 11.666621 25 31 01 30 13 50 5c 31 02 b0 56 30 15 00 00 00 00 00 00 00 00 00 00 00 00 02
E: 11.682622 25 31 01 30 13 50 5c 31 02 b0 56 30 15 00 00 00 00 00 00 00 00 00 00 00 00 02
E: 11.697618 25 31 01 28 13 50 5c 31 02 b0 56 30 15 00 00 00 00 00 00 00 00 00 00 00 00 02
E: 11.713624 25 31 01 28 13 50 5c 31 02 b0 56 38 15 00 00 00 00 00 00 00 00 00 00 00 00 02
E: 11.728620 25 31 01 28 13 50 5c 31 02 b0 56 38 15 00 00 00 00 00 00 00 00 00 00 00 00 02
E: 11.744622 25 31 01 28 13 40 5c 31 02 b0 56 38 15 00 00 00 00 00 00 00 00 00 00 00 00 02
E: 11.759621 25 31 01 28 13 40 5c 31 02 b0 56 48 15 00 00 00 00 00 00 00 00 00 00 00 00 02
E: 11.775621 25 31 01 28 13 40 5c 31 02 a8 56 48 15 00 00 00 00 00 00 00 00 00 00 00 00 02
E: 11.790621 25 31 01 28 13 38 5c 31 02 a8 56 50 15 00 00 00 00 00 00 00 00 00 00 00 00 02
E: 11.805620 25 31 01 28 13 38 5c 31 02 a8 56 58 15 00 00 00 00 00 00 00 00 00 00 00 00 02
E: 11.821620 25 31 01 28 13 38 5c 31 02 a8 56 68 15 00 00 00 00 00 00 00 00 00 00 00 00 02
E: 11.836618 25 31 01 28 13 38 5c 31 02 a8 56 68 15 00 00 00 00 00 00 00 00 00 00 00 00 02
E: 11.852619 25 31 01 28 13 20 5c 31 02 b0 56 78 15 00 00 00 00 00 00 00 00 00 00 00 00 02
E: 11.867619 25 31 01 28 13 08 5c 31 02 b0 56 78 15 00 00 00 00 00 00 00 00 00 00 00 00 02
E: 11.883618 25 31 01 20 13 08 5c 31 02 b0 56 80 15 00 00 00 00 00 00 00 00 00 00 00 00 02
E: 11.898618 25 31 01 20 13 08 5c 31 02 b0 56 98 15 00 00 00 00 00 00 00 00 00 00 00 00 02
E: 11.914619 25 31 01 28 13 f0 5b 31 02 b0 56 a8 15 00 00 00 00 00 00 00 00 00 00 00 00 02
E: 11.929618 25 31 01 28 13 f0 5b 31 02 b8 56 b8 15 00 00 00 00 00 00 00 00 00 00 00 00 02
E: 11.945618 25 31 01 28 13 d0 5b 31 02 b8 56 d8 15 00 00 00 00 00 00 00 00 00 00 00 00 02
E: 11.960619 25 31 01 28 13 b0 5b 31 02 b8 56 f0 15 00 00 00 00 00 00 00 00 00 00 00 00 02
E: 11.976655 25 31 01 28 13 b0 5b 31 02 b8 56 18 16 00 00 00 00 00 00 00 00 00 00 00 00 02
E: 11.991638 25 31 01 30 13 70 5b 31 02 b8 56 38 16 00 00 00 00 00 00 00 00 00 00 00 00 02
E: 12.007617 25 31 01 30 13 50 5b 31 02 b8 56 70 16 00 00 00 00 00 00 00 00 00 00 00 00 02
E: 12.022628 25 31 01 30 13 28 5b 31 02 b8 56 a8 16 00 00 00 00 00 00 00 00 00 00 00 00 02
E: 12.038613 25 31 01 30 13 f8 5a 31 02 c0 56 e0 16 00 00 00 00 00 00 00 00 00 00 00 00 02
E: 12.054149 25 31 01 28 13 c8 5a 31 02 c0 56 10 17 00 00 00 00 00 00 00 00 00 00 00 00 02
E: 12.068661 25 31 01 20 13 98 5a 31 02 c0 56 48 17 00 00 00 00 00 00 00 00 00 00 00 00 02
E: 12.084638 25 31 01 18 13 50 5a 31 02 c8 56 98 17 00 00 00 00 00 00 00 00 00 00 00 00 02
E: 12.099632 25 31 01 10 13 18 5a 31 02 d0 56 d0 17 00 00 00 00 00 00 00 00 00 00 00 00 02
E: 12.115856 25 31 01 10 13 e8 59 31 02 d0 56 00 18 00 00 00 00 00 00 00 00 00 00 00 00 02
E: 12.130672 25 31 01 08 13 b8 59 31 02 d8 56 38 18 00 00 00 00 00 00 00 00 00 00 00 00 02
E: 12.147005 25 31 01 f8 12 78 59 31 02 d8 56 70 18 00 00 00 00 00 00 00 00 00 00 00 00 02
E: 12.161766 25 31 01 f8 12 38 59 31 02 d8 56 a8 18 00 00 00 00 00 00 00 00 00 00 00 00 02
E: 12.177783 25 31 01 f0 12 08 59 31 02 e0 56 e0 18 00 00 00 00 00 00 00 00 00 00 00 00 02
E: 12.192849 25 31 01 e8 12 c0 58 31 02 e8 56 f8 18 00 00 00 00 00 00 00 00 00 00 00 00 02
E: 12.208794 25 31 01 d8 12 70 58 31 02 f0 56 30 19 00 00 00 00 00 00 00 00 00 00 00 00 02
E: 12.223669 25 31 01 d8 12 18 58 31 02 f8 56 68 19 00 00 00 00 00 00 00 00 00 00 00 00 02
E: 12.239666 25 31 01 c8 12 f8 57 31 02 f8 56 a0 19 00 00 00 00 00 00 00 00 00 00 00 00 02
E: 12.254622 25 31 01 c0 12 a8 57 31 02 08 57 c0 19 00 00 00 00 00 00 00 00 00 00 00 00 02
E: 12.270614 25 31 01 c0 12 50 57 31 02 08 57 f8 19 00 00 00 00 00 00 00 00 00 00 00 00 02
E: 12.285612 25 31 01 a8 12 d8 56 31 02 08 57 38 1a 00 00 00 00 00 00 00 00 00 00 00 00 02
E: 12.301611 25 31 01 98 12 80 56 31 02 08 57 78 1a 00 00 00 00 00 00 00 00 00 00 00 00 02
E: 12.316609 25 31 01 88 12 28 56 31 02 08 57 c0 1a 00 00 00 00 00 00 00 00 00 00 00 00 02
E: 12.331609 25 31 01 80 12 d0 55 31 02 08 57 08 1b 00 00 00 00 00 00 00 00 00 00 00 00 02
E: 12.347621 25 31 01 68 12 58 55 31 02 08 57 58 1b 00 00 00 00 00 00 00 00 00 00 00 00 02
E: 12.362978 25 31 01 60 12 f8 54 31 02 08 57 b0 1b 00 00 00 00 00 00 00 00 00 00 00 00 02
E: 12.377757 25 31 01 48 12 48 54 31 02 20 57 20 1c 00 00 00 00 00 00 00 00 00 00 00 00 02
E: 12.394001 25 31 01 40 12 e0 53 31 02 30 57 70 1c 00 00 00 00 00 00 00 00 00 00 00 00 02
E: 12.408973 25 31 01 30 12 78 53 31 02 30 57 c0 1c 00 00 00 00 00 00 00 00 00 00 00 00 02
E: 12.424931 25 31 01 28 12 e8 52 31 02 28 57 10 1d 00 00 00 00 00 00 00 00 00 00 00 00 02
E: 12.439667 25 31 01 10 12 c0 52 31 02 28 57 60 1d 00 00 00 00 00 00 00 00 00 00 00 00 02
E: 12.455618 25 31 01 08 12 60 52 31 02 30 57 a8 1d 00 00 00 00 00 00 00 00 00 00 00 00 02
E: 12.471145 25 31 01 f0 11 e8 51 31 02 38 57 00 1e 00 00 00 00 00 00 00 00 00 00 00 00 02
E: 12.486019 25 31 01 e8 11 68 51 31 02 38 57 50 1e 00 00 00 00 00 00 00 00 00 00 00 00 02
E: 12.501782 25 31 01 d8 11 f8 50 31 02 40 57 a8 1e 00 00 00 00 00 00 00 00 00 00 00 00 02
E: 12.516854 25 31 01 d0 11 80 50 31 02 40 57 f0 1e 00 00 00 00 00 00 00 00 00 00 00 00 02
E: 12.533738 25 31 01 b8 11 18 50 31 02 40 57 58 1f 00 00 00 00 00 00 00 00 00 00 00 00 02
E: 12.548791 25 31 01 a8 11 20 4f 31 02 50 57 c0 1f 00 00 00 00 00 00 00 00 00 00 00 00 02
E: 12.564905 25 31 01 a0 11 60 4e 31 02 58 57 30 20 00 00 00 00 00 00 00 00 00 00 00 00 02
E: 12.579736 25 31 01 88 11 d8 4d 31 02 68 57 90 20 00 00 00 00 00 00 00 00 00 00 00 00 02
E: 12.595010 25 31 01 68 11 30 4d 31 02 78 57 e8 20 00 00 00 00 00 00 00 00 00 00 00 00 02
E: 12.610728 25 31 01 50 11 88 4c 31 02 78 57 40 21 00 00 00 00 00 00 00 00 00 00 00 00 02
E: 12.625682 25 31 01 30 11 e8 4b 31 02 90 57 a8 21 00 00 00 00 00 00 00 00 00 00 00 00 02
E: 12.641788 25 31 01 20 11 40 4b 31 02 98 57 f8 21 00 00 00 00 00 00 00 00 00 00 00 00 02
E: 12.656662 25 31 01 10 11 c8 4a 31 02 a0 57 68 22 00 00 00 00 00 00 00 00 00 00 00 00 02
E: 12.672620 25 31 01 f8 10 58 4a 31 02 a0 57 b8 22 00 00 00 00 00 00 00 00 00 00 00 00 02
E: 12.687615 25 31 01 f0 10 d0 49 31 02 b0 57 08 23 00 00 00 00 00 00 00 00 00 00 00 00 02
E: 12.703610 25 31 01 e0 10 58 49 31 02 b0 57 50 23 00 00 00 00 00 00 00 00 00 00 00 00 02
E: 12.718594 25 31 01 d0 10 c0 48 31 02 c0 57 a0 23 00 00 00 00 00 00 00 00 00 00 00 00 02
E: 12.734610 25 31 01 b8 10 48 48 31 02 c0 57 f0 23 00 00 00 00 00 00 00 00 00 00 00 00 02
E: 12.749608 25 31 01 b8 10 98 47 31 02 c0 57 40 24 00 00 00 00 00 00 00 00 00 00 00 00 02
E: 12.765608 25 31 01 a0 10 00 47 31 02 c8 57 88 24 00 00 00 00 00 00 00 00 00 00 00 00 02
E: 12.781012 25 31 01 88 10 58 46 31 02 d8 57 d0 24 00 00 00 00 00 00 00 00 00 00 00 00 02
E: 12.796856 25 31 01 70 10 e0 45 31 02 d8 57 10 25 00 00 00 00 00 00 00 00 00 00 00 00 02
E: 12.811776 25 31 01 68 10 50 45 31 02 f0 57 70 25 00 00 00 00 00 00 00 00 00 00 00 00 02
E: 12.827624 25 31 01 50 10 d8 44 31 02 f0 57 b0 25 00 00 00 00 00 00 00 00 00 00 00 00 02
E: 12.842610 25 31 01 40 10 70 44 31 02 f0 57 e8 25 00 00 00 00 00 00 00 00 00 00 00 00 02
E: 12.858607 25 31 01 20 10 f0 43 31 02 00 58 50 26 00 00 00 00 00 00 00 00 00 00 00 00 02
E: 12.873606 25 31 01 18 10 78 43 31 02 10 58 a0 26 00 00 00 00 00 00 00 00 00 00 00 00 02
E: 12.889872 25 31 01 08 10 00 43 31 02 10 58 e8 26 00 00 00 00 00 00 00 00 00 00 00 00 02
E: 12.904767 25 31 01 f8 0f 88 42 31 02 20 58 30 27 00 00 00 00 00 00 00 00 00 00 00 00 02
E: 12.920751 25 31 01 e8 0f 18 42 31 02 28 58 80 27 00 00 00 00 00 00 00 00 00 00 00 00 02
E: 12.936016 25 31 01 d8 0f 90 41 31 02 30 58 e0 27 00 00 00 00 00 00 00 00 00 00 00 00 02
E: 12.950651 25 31 01 d0 0f 10 41 31 02 30 58 30 28 00 00 00 00 00 00 00 00 00 00 00 00 02
E: 12.966614 25 31 01 c0 0f 80 40 31 02 40 58 80 28 00 00 00 00 00 00 00 00 00 00 00 00 02
E: 12.981975 25 31 01 b0 0f e0 3f 31 02 48 58 d0 28 00 00 00 00 00 00 00 00 00 00 00 00 02
E: 12.997760 25 31 01 a0 0f 38 3f 31 02 50 58 20 29 00 00 00 00 00 00 00 00 00 00 00 00 02
E: 13.012736 25 31 01 98 0f a8 3e 31 02 50 58 70 29 00 00 00 00 00 00 00 00 00 00 00 00 02
E: 13.028899 25 31 01 90 0f 10 3e 31 02 50 58 b0 29 00 00 00 00 00 00 00 00 00 00 00 00 02
E: 13.043721 25 31 01 80 0f 78 3d 31 02 50 58 00 2a 00 00 00 00 00 00 00 00 00 00 00 00 02
E: 13.058637 25 31 01 78 0f e0 3c 31 02 60 58 50 2a 00 00 00 00 00 00 00 00 00 00 00 00 02
E: 13.074609 25 31 01 68 0f 48 3c 31 02 60 58 b8 2a 00 00 00 00 00 00 00 00 00 00 00 00 02
E: 13.089605 25 31 01 60 0f b0 3b 31 02 60 58 08 2b 00 00 00 00 00 00 00 00 00 00 00 00 02
E: 13.105602 25 31 01 60 0f 00 3b 31 02 68 58 60 2b 00 00 00 00 00 00 00 00 00 00 00 00 02
E: 13.120601 25 31 01 50 0f 88 3a 31 02 70 58 d8 2b 00 00 00 00 00 00 00 00 00 00 00 00 02
E: 13.136599 25 31 01 50 0f e8 39 31 02 70 58 30 2c 00 00 00 00 00 00 00 00 00 00 00 00 02
E: 13.151599 25 31 01 40 0f 50 39 31 02 78 58 a0 2c 00 00 00 00 00 00 00 00 00 00 00 00 02
E: 13.167598 25 31 01 38 0f a0 38 31 02 78 58 08 2d 00 00 00 00 00 00 00 00 00 00 00 00 02
E: 13.182597 25 31 01 28 0f f8 37 31 02 78 58 60 2d 00 00 00 00 00 00 00 00 00 00 00 00 02
E: 13.199006 25 31 01 28 0f 80 37 31 02 78 58 d8 2d 00 00 00 00 00 00 00 00 00 00 00 00 02
E: 13.213692 25 31 01 28 0f e8 36 31 02 88 58 28 2e 00 00 00 00 00 00 00 00 00 00 00 00 02
E: 13.229721 25 31 01 18 0f 40 36 31 02 90 58 80 2e 00 00 00 00 00 00 00 00 00 00 00 00 02
E: 13.244968 25 31 01 18 0f 90 35 31 02 90 58 d8 2e 00 00 00 00 00 00 00 00 00 00 00 00 02
E: 13.260644 25 31 01 10 0f 00 35 31 02 90 58 40 2f 00 00 00 00 00 00 00 00 00 00 00 00 02
E: 13.275605 25 31 01 10 0f 70 34 31 02 a0 58 a8 2f 00 00 00 00 00 00 00 00 00 00 00 00 02
E: 13.290624 25 31 01 00 0f e0 33 31 02 a8 58 f8 2f 00 00 00 00 00 00 00 00 00 00 00 00 02
E: 13.306597 25 31 01 00 0f 70 33 31 02 a8 58 68 30 00 00 00 00 00 00 00 00 00 00 00 00 02
E: 13.321937 25 31 01 f8 0e d0 32 31 02 b0 58 c0 30 00 00 00 00 00 00 00 00 00 00 00 00 02
E: 13.337857 25 31 01 f8 0e 60 32 31 02 b8 58 20 31 00 00 00 00 00 00 00 00 00 00 00 00 02
E: 13.352978 25 31 01 f8 0e e8 31 31 02 c0 58 78 31 00 00 00 00 00 00 00 00 00 00 00 00 02
E: 13.368632 25 31 01 f8 0e 78 31 31 02 c8 58 c8 31 00 00 00 00 00 00 00 00 00 00 00 00 02
E: 13.383604 25 31 01 f8 0e 18 31 31 02 c8 58 18 32 00 00 00 00 00 00 00 00 00 00 00 00 02
E: 13.399596 25 31 01 00 0f c0 30 31 02 c8 58 60 32 00 00 00 00 00 00 00 00 00 00 00 00 02
E: 13.415003 25 31 01 00 0f 60 30 31 02 c8 58 b0 32 00 00 00 00 00 00 00 00 00 00 00 00 02
E: 13.430618 25 31 01 08 0f 00 30 31 02 c8 58 f0 32 00 00 00 00 00 00 00 00 00 00 00 00 02
E: 13.446056 25 31 01 08 0f 88 2f 31 02 d8 58 30 33 00 00 00 00 00 00 00 00 00 00 00 00 02
E: 13.461757 25 31 01 08 0f 28 2f 31 02 d8 58 58 33 00 00 00 00 00 00 00 00 00 00 00 00 02
E: 13.476716 25 31 01 00 0f e8 2e 31 02 e0 58 a0 33 00 00 00 00 00 00 00 00 00 00 00 00 02
E: 13.492910 25 31 01 00 0f 68 2e 31 02 e0 58 e0 33 00 00 00 00 00 00 00 00 00 00 00 00 02
E: 13.507642 25 31 01 18 0f d8 2d 31 02 e0 58 20 34 00 00 00 00 00 00 00 00 00 00 00 00 02
E: 13.523603 25 31 01 18 0f 60 2d 31 02 e8 58 58 34 00 00 00 00 00 00 00 00 00 00 00 00 02
E: 13.538594 25 31 01 18 0f f8 2c 31 02 e8 58 90 34 00 00 00 00 00 00 00 00 00 00 00 00 02
E: 13.553991 25 31 01 18 0f a0 2c 31 02 f0 58 c8 34 00 00 00 00 00 00 00 00 00 00 00 00 02
E: 13.569953 25 31 01 18 0f 40 2c 31 02 f8 58 f0 34 00 00 00 00 00 00 00 00 00 00 00 00 02
E: 13.584699 25 31 01 18 0f e8 2b 31 02 f8 58 28 35 00 00 00 00 00 00 00 00 00 00 00 00 02
E: 13.600720 25 31 01 20 0f 90 2b 31 02 f8 58 60 35 00 00 00 00 00 00 00 00 00 00 00 00 02
E: 13.615607 25 31 01 20 0f 38 2b 31 02 00 59 88 35 00 00 00 00 00 00 00 00 00 00 00 00 02
E: 13.631995 25 31 01 20 0f f8 2a 31 02 00 59 c0 35 00 00 00 00 00 00 00 00 00 00 00 00 02
E: 13.646630 25 31 01 20 0f b0 2a 31 02 00 59 e0 35 00 00 00 00 00 00 00 00 00 00 00 00 02
E: 13.662596 25 31 01 20 0f 58 2a 31 02 08 59 10 36 00 00 00 00 00 00 00 00 00 00 00 00 02
E: 13.677590 25 31 01 28 0f 18 2a 31 02 10 59 30 36 00 00 00 00 00 00 00 00 00 00 00 00 02
E: 13.693924 25 31 01 30 0f c0 29 31 02 10 59 58 36 00 00 00 00 00 00 00 00 00 00 00 00 02
E: 13.709011 25 31 01 38 0f 48 29 31 02 20 59 78 36 00 00 00 00 00 00 00 00 00 00 00 00 02
E: 13.724648 25 31 01 38 0f 18 29 31 02 20 59 b0 36 00 00 00 00 00 00 00 00 00 00 00 00 02
E: 13.739743 25 31 01 38 0f d8 28 31 02 20 59 c8 36 00 00 00 00 00 00 00 00 00 00 00 00 02
E: 13.755631 25 31 01 38 0f 90 28 31 02 28 59 f8 36 00 00 00 00 00 00 00 00 00 00 00 00 02
E: 13.771062 25 31 01 38 0f 40 28 31 02 28 59 18 37 00 00 00 00 00 00 00 00 00 00 00 00 02
E: 13.786689 25 31 01 38 0f 10 28 31 02 30 59 50 37 00 00 00 00 00 00 00 00 00 00 00 00 02
E: 13.802000 25 31 01 38 0f c0 27 31 02 30 59 68 37 00 00 00 00 00 00 00 00 00 00 00 00 02
E: 13.816892 25 31 01 38 0f 68 27 31 02 30 59 88 37 00 00 00 00 00 00 00 00 00 00 00 00 02
E: 13.832704 25 31 01 40 0f 18 27 31 02 30 59 a8 37 00 00 00 00 00 00 00 00 00 00 00 00 02
E: 13.847968 25 31 01 40 0f c0 26 31 02 38 59 c8 37 00 00 00 00 00 00 00 00 00 00 00 00 02
E: 13.863629 25 31 01 40 0f 88 26 31 02 38 59 f0 37 00 00 00 00 00 00 00 00 00 00 00 00 02
E: 13.878593 25 31 01 48 0f 40 26 31 02 38 59 00 38 00 00 00 00 00 00 00 00 00 00 00 00 02
E: 13.894584 25 31 01 48 0f e8 25 31 02 38 59 38 38 00 00 00 00 00 00 00 00 00 00 00 00 02
E: 13.909580 25 31 01 50 0f a8 25 31 02 38 59 50 38 00 00 00 00 00 00 00 00 00 00 00 00 02
E: 13.925580 25 31 01 58 0f 68 25 31 02 38 59 68 38 00 00 00 00 00 00 00 00 00 00 00 00 02
E: 13.940579 25 31 01 68 0f 28 25 31 02 40 59 88 38 00 00 00 00 00 00 00 00 00 00 00 00 02
E: 13.956577 25 31 01 68 0f d8 24 31 02 48 59 a0 38 00 00 00 00 00 00 00 00 00 00 00 00 02
E: 13.971576 25 31 01 68 0f 80 24 31 02 48 59 b8 38 00 00 00 00 00 00 00 00 00 00 00 00 02
E: 13.987575 25 31 01 70 0f 30 24 31 02 48 59 d0 38 00 00 00 00 00 00 00 00 00 00 00 00 02
E: 14.002574 25 31 01 70 0f e8 23 31 02 48 59 f8 38 00 00 00 00 00 00 00 00 00 00 00 00 02
E: 14.018575 25 31 01 78 0f b0 23 31 02 48 59 10 39 00 00 00 00 00 00 00 00 00 00 00 00 02
E: 14.034113 25 31 01 80 0f 70 23 31 02 50 59 28 39 00 00 00 00 00 00 00 00 00 00 00 00 02
E: 14.048810 25 31 01 90 0f 28 23 31 02 58 59 48 39 00 00 00 00 00 00 00 00 00 00 00 00 02
E: 14.064986 25 31 01 90 0f e8 22 31 02 58 59 58 39 00 00 00 00 00 00 00 00 00 00 00 00 02
E: 14.079625 25 31 01 90 0f c0 22 31 02 60 59 68 39 00 00 00 00 00 00 00 00 00 00 00 00 02
E: 14.095975 25 31 01 98 0f 80 22 31 02 60 59 80 39 00 00 00 00 00 00 00 00 00 00 00 00 02
E: 14.110747 25 31 01 a0 0f 50 22 31 02 60 59 a0 39 00 00 00 00 00 00 00 00 00 00 00 00 02
E: 14.126694 25 31 01 a8 0f 20 22 31 02 60 59 a8 39 00 00 00 00 00 00 00 00 00 00 00 00 02
E: 14.141606 25 31 01 b0 0f f8 21 31 02 68 59 b0 39 00 00 00 00 00 00 00 00 00 00 00 00 02
E: 14.157582 25 31 01 b8 0f c8 21 31 02 68 59 c8 39 00 00 00 00 00 00 00 00 00 00 00 00 02
E: 14.172576 25 31 01 c0 0f 98 21 31 02 68 59 e0 39 00 00 00 00 00 00 00 00 00 00 00 00 02
E: 14.188819 25 31 01 c8 0f 70 21 31 02 68 59 f8 39 00 00 00 00 00 00 00 00 00 00 00 00 02
E: 14.203734 25 31 01 c8 0f 58 21 31 02 68 59 00 3a 00 00 00 00 00 00 00 00 00 00 00 00 02
E: 14.219712 25 31 01 c8 0f 38 21 31 02 68 59 10 3a 00 00 00 00 00 00 00 00 00 00 00 00 02
E: 14.234596 25 31 01 d0 0f 10 21 31 02 68 59 38 3a 00 00 00 00 00 00 00 00 00 00 00 00 02
E: 14.250578 25 31 01 d0 0f e8 20 31 02 68 59 40 3a 00 00 00 00 00 00 00 00 00 00 00 00 02
E: 14.265573 25 31 01 d8 0f c8 20 31 02 78 59 50 3a 00 00 00 00 00 00 00 00 00 00 00 00 02
E: 14.281570 25 31 01 d8 0f b8 20 31 02 78 59 50 3a 00 00 00 00 00 00 00 00 00 00 00 00 02
E: 14.296569 25 31 01 d8 0f 98 20 31 02 78 59 68 3a 00 00 00 00 00 00 00 00 00 00 00 00 02
E: 14.312569 25 31 01 d8 0f 68 20 31 02 78 59 88 3a 00 00 00 00 00 00 00 00 00 00 00 00 02
E: 14.327568 25 31 01 d8 0f 48 20 31 02 78 59 90 3a 00 00 00 00 00 00 00 00 00 00 00 00 02
E: 14.342566 25 31 01 d8 0f 20 20 31 02 78 59 90 3a 00 00 00 00 00 00 00 00 00 00 00 00 02
E: 14.358541 25 31 01 d8 0f 10 20 31 02 80 59 a0 3a 00 00 00 00 00 00 00 00 00 00 00 00 02
E: 14.373567 25 31 01 d8 0f f0 1f 31 02 80 59 a8 3a 00 00 00 00 00 00 00 00 00 00 00 00 02
E: 14.389564 25 31 01 d8 0f d0 1f 31 02 80 59 b8 3a 00 00 00 00 00 00 00 00 00 00 00 00 02
E: 14.404568 25 31 01 d8 0f b8 1f 31 02 80 59 d0 3a 00 00 00 00 00 00 00 00 00 00 00 00 02
E: 14.420564 25 31 01 d0 0f 98 1f 31 02 80 59 e0 3a 00 00 00 00 00 00 00 00 00 00 00 00 02
E: 14.435564 25 31 01 d0 0f 88 1f 31 02 80 59 e0 3a 00 00 00 00 00 00 00 00 00 00 00 00 02
E: 14.451899 25 31 01 d0 0f 68 1f 31 02 88 59 e8 3a 00 00 00 00 00 00 00 00 00 00 00 00 02
E: 14.466795 25 31 01 d0 0f 68 1f 31 02 88 59 e8 3a 00 00 00 00 00 00 00 00 00 00 00 00 02
E: 14.482943 25 31 01 d0 0f 48 1f 31 02 90 59 f0 3a 00 00 00 00 00 00 00 00 00 00 00 00 02
E: 14.497612 25 31 01 d0 0f 40 1f 31 02 90 59 f8 3a 00 00 00 00 00 00 00 00 00 00 00 00 02
E: 14.513574 25 31 01 d8 0f 38 1f 31 02 88 59 08 3b 00 00 00 00 00 00 00 00 00 00 00 00 02
E: 14.528568 25 31 01 d8 0f 38 1f 31 02 88 59 10 3b 00 00 00 00 00 00 00 00 00 00 00 00 02
E: 14.544561 25 31 01 d8 0f 18 1f 31 02 88 59 20 3b 00 00 00 00 00 00 00 00 00 00 00 00 02
E: 14.559562 25 31 01 d0 0f 00 1f 31 02 88 59 20 3b 00 00 00 00 00 00 00 00 00 00 00 00 02
E: 14.574559 25 31 01 d0 0f f8 1e 31 02 88 59 20 3b 00 00 00 00 00 00 00 00 00 00 00 00 02
E: 14.590773 25 31 01 d0 0f f8 1e 31 02 88 59 18 3b 00 00 00 00 00 00 00 00 00 00 00 00 02
E: 14.605602 25 31 01 d0 0f f8 1e 31 02 88 59 18 3b 00 00 00 00 00 00 00 00 00 00 00 00 02
E: 14.621576 25 31 01 d0 0f f8 1e 31 02 88 59 10 3b 00 00 00 00 00 00 00 00 00 00 00 00 02
E: 14.636564 25 31 01 c8 0f f8 1e 31 02 88 59 10 3b 00 00 00 00 00 00 00 00 00 00 00 00 02
E: 14.652837 25 31 01 c8 0f f8 1e 31 02 88 59 10 3b 00 00 00 00 00 00 00 00 00 00 00 00 02
E: 14.667600 25 31 01 c8 0f f0 1e 31 02 88 59 10 3b 00 00 00 00 00 00 00 00 00 00 00 00 02
E: 14.683558 25 31 01 c8 0f f0 1e 31 02 88 59 10 3b 00 00 00 00 00 00 00 00 00 00 00 00 02
E: 14.698546 25 31 01 c8 0f f0 1e 31 02 88 59 10 3b 00 00 00 00 00 00 00 00 00 00 00 00 02
E: 14.714558 25 31 01 d0 0f f0 1e 31 02 88 59 10 3b 00 00 00 00 00 00 00 00 00 00 00 00 02
E: 14.729746 25 31 01 d0 0f f0 1e 31 02 88 59 10 3b 00 00 00 00 00 00 00 00 00 00 00 00 02
E: 14.745669 25 31 01 d0 0f f0 1e 31 02 88 59 10 3b 00 00 00 00 00 00 00 00 00 00 00 00 02
E: 14.760588 25 31 01 d8 0f f0 1e 31 02 88 59 10 3b 00 00 00 00 00 00 00 00 00 00 00 00 02
E: 14.775764 25 31 01 d8 0f f0 1e 31 02 88 59 10 3b 00 00 00 00 00 00 00 00 00 00 00 00 02
E: 14.791582 25 31 01 d8 0f f0 1e 31 02 88 59 10 3b 00 00 00 00 00 00 00 00 00 00 00 00 02
E: 14.806549 25 31 01 d8 0f f0 1e 31 02 88 59 10 3b 00 00 00 00 00 00 00 00 00 00 00 00 02
E: 14.822541 25 31 01 d8 0f f0 1e 31 02 88 59 10 3b 00 00 00 00 00 00 00 00 00 00 00 00 02
E: 14.837542 25 31 01 d8 0f f0 1e 31 02 88 59 10 3b 00 00 00 00 00 00 00 00 00 00 00 00 02
E: 14.853542 25 31 01 d8 0f f0 1e 31 02 88 59 10 3b 00 00 00 00 00 00 00 00 00 00 00 00 02
E: 14.868540 25 31 01 d8 0f f0 1e 31 02 88 59 10 3b 00 00 00 00 00 00 00 00 00 00 00 00 02
E: 14.884539 25 31 01 d8 0f f0 1e 31 02 88 59 10 3b 00 00 00 00 00 00 00 00 00 00 00 00 02
E: 14.899552 25 31 01 d8 0f f0 1e 31 02 88 59 10 3b 00 00 00 00 00 00 00 00 00 00 00 00 02
E: 14.915556 25 31 01 d0 0f f0 1e 31 02 88 59 10 3b 00 00 00 00 00 00 00 00 00 00 00 00 02
E: 14.930915 25 31 01 d0 0f f0 1e 31 02 88 59 10 3b 00 00 00 00 00 00 00 00 00 00 00 00 02
E: 14.946575 25 31 01 d0 0f f0 1e 31 02 88 59 10 3b 00 00 00 00 00 00 00 00 00 00 00 00 02
E: 14.961544 25 31 01 d0 0f f0 1e 31 02 88 59 10 3b 00 00 00 00 00 00 00 00 00 00 00 00 02
E: 14.977539 25 31 01 d0 0f f0 1e 31 02 88 59 10 3b 00 00 00 00 00 00 00 00 00 00 00 00 02
E: 14.992553 25 31 01 c8 0f f8 1e 31 02 88 59 10 3b 00 00 00 00 00 00 00 00 00 00 00 00 02
E: 15.008964 25 31 01 b0 0f f8 1e 31 02 88 59 10 3b 00 00 00 00 00 00 00 00 00 00 00 00 02
E: 15.023845 25 31 01 98 0f e0 1e 31 02 88 59 10 3b 00 00 00 00 00 00 00 00 00 00 00 00 02
E: 15.036706 25 30 01 90 0f 88 1e 31 02 88 59 10 3b 00 00 00 00 00 00 00 00 00 00 00 00 02
E: 15.052970 25 31 02 88 59 10 3b 00 00 00 00 00 00 00 00 00 00 00 00 00 00 00 00 00 00 01
E: 15.067630 25 31 02 88 59 10 3b 00 00 00 00 00 00 00 00 00 00 00 00 00 00 00 00 00 00 01
E: 15.083571 25 31 02 88 59 10 3b 00 00 00 00 00 00 00 00 00 00 00 00 00 00 00 00 00 00 01
E: 15.098541 25 31 02 88 59 10 3b 00 00 00 00 00 00 00 00 00 00 00 00 00 00 00 00 00 00 01
E: 15.114534 25 31 02 88 59 10 3b 00 00 00 00 00 00 00 00 00 00 00 00 00 00 00 00 00 00 01
E: 15.129535 25 31 02 88 59 10 3b 00 00 00 00 00 00 00 00 00 00 00 00 00 00 00 00 00 00 01
E: 15.144532 25 31 02 88 59 10 3b 00 00 00 00 00 00 00 00 00 00 00 00 00 00 00 00 00 00 01
E: 15.160531 25 31 02 88 59 10 3b 00 00 00 00 00 00 00 00 00 00 00 00 00 00 00 00 00 00 01
E: 15.175532 25 31 02 88 59 10 3b 00 00 00 00 00 00 00 00 00 00 00 00 00 00 00 00 00 00 01
E: 15.191533 25 31 02 88 59 10 3b 00 00 00 00 00 00 00 00 00 00 00 00 00 00 00 00 00 00 01
E: 15.206531 25 31 02 88 59 10 3b 00 00 00 00 00 00 00 00 00 00 00 00 00 00 00 00 00 00 01
E: 15.222531 25 31 02 88 59 10 3b 00 00 00 00 00 00 00 00 00 00 00 00 00 00 00 00 00 00 01
E: 15.237547 25 31 02 88 59 00 3b 00 00 00 00 00 00 00 00 00 00 00 00 00 00 00 00 00 00 01
E: 15.253957 25 31 02 88 59 00 3b 00 00 00 00 00 00 00 00 00 00 00 00 00 00 00 00 00 00 01
E: 15.268563 25 31 02 88 59 00 3b 00 00 00 00 00 00 00 00 00 00 00 00 00 00 00 00 00 00 01
E: 15.284536 25 31 02 88 59 00 3b 00 00 00 00 00 00 00 00 00 00 00 00 00 00 00 00 00 00 01
E: 15.299529 25 31 02 88 59 00 3b 00 00 00 00 00 00 00 00 00 00 00 00 00 00 00 00 00 00 01
E: 15.315528 25 31 02 88 59 00 3b 00 00 00 00 00 00 00 00 00 00 00 00 00 00 00 00 00 00 01
E: 15.330527 25 31 02 88 59 00 3b 00 00 00 00 00 00 00 00 00 00 00 00 00 00 00 00 00 00 01
E: 15.346527 25 31 02 88 59 00 3b 00 00 00 00 00 00 00 00 00 00 00 00 00 00 00 00 00 00 01
E: 15.361544 25 31 02 88 59 08 3b 00 00 00 00 00 00 00 00 00 00 00 00 00 00 00 00 00 00 01
E: 15.377566 25 31 02 88 59 08 3b 00 00 00 00 00 00 00 00 00 00 00 00 00 00 00 00 00 00 01
E: 15.392610 25 31 02 88 59 08 3b 00 00 00 00 00 00 00 00 00 00 00 00 00 00 00 00 00 00 01
E: 15.407576 25 31 02 88 59 00 3b 00 00 00 00 00 00 00 00 00 00 00 00 00 00 00 00 00 00 01
E: 15.423912 25 31 02 88 59 00 3b 00 00 00 00 00 00 00 00 00 00 00 00 00 00 00 00 00 00 01
E: 15.438563 25 31 02 88 59 00 3b 00 00 00 00 00 00 00 00 00 00 00 00 00 00 00 00 00 00 01
E: 15.454532 25 31 02 88 59 00 3b 00 00 00 00 00 00 00 00 00 00 00 00 00 00 00 00 00 00 01
E: 15.469526 25 31 02 88 59 00 3b 00 00 00 00 00 00 00 00 00 00 00 00 00 00 00 00 00 00 01
E: 15.485524 25 31 02 88 59 00 3b 00 00 00 00 00 00 00 00 00 00 00 00 00 00 00 00 00 00 01
E: 15.500538 25 31 02 88 59 00 3b 00 00 00 00 00 00 00 00 00 00 00 00 00 00 00 00 00 00 01
E: 15.516522 25 31 02 88 59 00 3b 00 00 00 00 00 00 00 00 00 00 00 00 00 00 00 00 00 00 01
E: 15.531523 25 31 02 88 59 00 3b 00 00 00 00 00 00 00 00 00 00 00 00 00 00 00 00 00 00 01
E: 15.547522 25 31 02 88 59 00 3b 00 00 00 00 00 00 00 00 00 00 00 00 00 00 00 00 00 00 01
E: 15.562521 25 31 02 88 59 00 3b 00 00 00 00 00 00 00 00 00 00 00 00 00 00 00 00 00 00 01
E: 15.578519 25 31 02 88 59 00 3b 00 00 00 00 00 00 00 00 00 00 00 00 00 00 00 00 00 00 01
E: 15.593521 25 31 02 88 59 00 3b 00 00 00 00 00 00 00 00 00 00 00 00 00 00 00 00 00 00 01
E: 15.609521 25 31 02 88 59 00 3b 00 00 00 00 00 00 00 00 00 00 00 00 00 00 00 00 00 00 01
E: 15.624520 25 31 02 88 59 00 3b 00 00 00 00 00 00 00 00 00 00 00 00 00 00 00 00 00 00 01
E: 15.640519 25 31 02 88 59 00 3b 00 00 00 00 00 00 00 00 00 00 00 00 00 00 00 00 00 00 01
E: 15.655520 25 31 02 88 59 00 3b 00 00 00 00 00 00 00 00 00 00 00 00 00 00 00 00 00 00 01
E: 15.670519 25 31 02 88 59 00 3b 00 00 00 00 00 00 00 00 00 00 00 00 00 00 00 00 00 00 01
E: 15.686518 25 31 02 88 59 00 3b 00 00 00 00 00 00 00 00 00 00 00 00 00 00 00 00 00 00 01
E: 15.701568 25 31 02 88 59 00 3b 00 00 00 00 00 00 00 00 00 00 00 00 00 00 00 00 00 00 01
E: 15.717571 25 31 02 88 59 00 3b 00 00 00 00 00 00 00 00 00 00 00 00 00 00 00 00 00 00 01
E: 15.732569 25 31 02 88 59 00 3b 00 00 00 00 00 00 00 00 00 00 00 00 00 00 00 00 00 00 01
E: 15.748568 25 31 02 88 59 00 3b 00 00 00 00 00 00 00 00 00 00 00 00 00 00 00 00 00 00 01
E: 15.763570 25 31 02 88 59 00 3b 00 00 00 00 00 00 00 00 00 00 00 00 00 00 00 00 00 00 01
E: 15.779567 25 31 02 88 59 00 3b 00 00 00 00 00 00 00 00 00 00 00 00 00 00 00 00 00 00 01
E: 15.794569 25 31 02 88 59 00 3b 00 00 00 00 00 00 00 00 00 00 00 00 00 00 00 00 00 00 01
E: 15.810575 25 31 02 90 59 f8 3a 00 00 00 00 00 00 00 00 00 00 00 00 00 00 00 00 00 00 01
E: 15.825543 25 31 02 90 59 f8 3a 00 00 00 00 00 00 00 00 00 00 00 00 00 00 00 00 00 00 01
E: 15.841565 25 31 02 90 59 f8 3a 00 00 00 00 00 00 00 00 00 00 00 00 00 00 00 00 00 00 01
E: 15.856565 25 31 02 90 59 f8 3a 00 00 00 00 00 00 00 00 00 00 00 00 00 00 00 00 00 00 01
E: 15.872564 25 31 02 90 59 f8 3a 00 00 00 00 00 00 00 00 00 00 00 00 00 00 00 00 00 00 01
E: 15.887563 25 31 02 90 59 f8 3a 00 00 00 00 00 00 00 00 00 00 00 00 00 00 00 00 00 00 01
E: 15.903530 25 31 02 90 59 f8 3a 00 00 00 00 00 00 00 00 00 00 00 00 00 00 00 00 00 00 01
E: 15.918562 25 31 02 90 59 f8 3a 00 00 00 00 00 00 00 00 00 00 00 00 00 00 00 00 00 00 01
E: 15.933566 25 31 02 90 59 f8 3a 00 00 00 00 00 00 00 00 00 00 00 00 00 00 00 00 00 00 01
E: 15.949566 25 31 02 90 59 f8 3a 00 00 00 00 00 00 00 00 00 00 00 00 00 00 00 00 00 00 01
E: 15.964563 25 31 02 90 59 f8 3a 00 00 00 00 00 00 00 00 00 00 00 00 00 00 00 00 00 00 01
E: 15.980560 25 31 02 90 59 f8 3a 00 00 00 00 00 00 00 00 00 00 00 00 00 00 00 00 00 00 01
E: 15.995561 25 31 02 90 59 f8 3a 00 00 00 00 00 00 00 00 00 00 00 00 00 00 00 00 00 00 01
E: 16.011562 25 31 02 90 59 f8 3a 00 00 00 00 00 00 00 00 00 00 00 00 00 00 00 00 00 00 01
E: 16.026562 25 31 02 90 59 f8 3a 00 00 00 00 00 00 00 00 00 00 00 00 00 00 00 00 00 00 01
E: 16.042560 25 31 02 90 59 f8 3a 00 00 00 00 00 00 00 00 00 00 00 00 00 00 00 00 00 00 01
E: 16.057565 25 31 02 90 59 f8 3a 00 00 00 00 00 00 00 00 00 00 00 00 00 00 00 00 00 00 01
E: 16.073561 25 31 02 90 59 f8 3a 00 00 00 00 00 00 00 00 00 00 00 00 00 00 00 00 00 00 01
E: 16.088562 25 31 02 90 59 f8 3a 00 00 00 00 00 00 00 00 00 00 00 00 00 00 00 00 00 00 01
E: 16.104557 25 31 02 90 59 f8 3a 00 00 00 00 00 00 00 00 00 00 00 00 00 00 00 00 00 00 01
E: 16.119561 25 31 02 90 59 f8 3a 00 00 00 00 00 00 00 00 00 00 00 00 00 00 00 00 00 00 01
E: 16.135560 25 31 02 90 59 f8 3a 00 00 00 00 00 00 00 00 00 00 00 00 00 00 00 00 00 00 01
E: 16.150557 25 31 02 90 59 f8 3a 00 00 00 00 00 00 00 00 00 00 00 00 00 00 00 00 00 00 01
E: 16.166559 25 31 02 90 59 f8 3a 00 00 00 00 00 00 00 00 00 00 00 00 00 00 00 00 00 00 01
E: 16.181557 25 31 02 90 59 f8 3a 00 00 00 00 00 00 00 00 00 00 00 00 00 00 00 00 00 00 01
E: 16.196556 25 31 02 90 59 f8 3a 00 00 00 00 00 00 00 00 00 00 00 00 00 00 00 00 00 00 01
E: 16.212556 25 31 02 90 59 f8 3a 00 00 00 00 00 00 00 00 00 00 00 00 00 00 00 00 00 00 01
E: 16.227558 25 31 02 90 59 f8 3a 00 00 00 00 00 00 00 00 00 00 00 00 00 00 00 00 00 00 01
E: 16.243530 25 31 02 90 59 f8 3a 00 00 00 00 00 00 00 00 00 00 00 00 00 00 00 00 00 00 01
E: 16.258569 25 31 02 90 59 f8 3a 00 00 00 00 00 00 00 00 00 00 00 00 00 00 00 00 00 00 01
E: 16.274554 25 31 02 90 59 f8 3a 00 00 00 00 00 00 00 00 00 00 00 00 00 00 00 00 00 00 01
E: 16.289554 25 31 02 90 59 f8 3a 00 00 00 00 00 00 00 00 00 00 00 00 00 00 00 00 00 00 01
E: 16.305554 25 31 02 90 59 f8 3a 00 00 00 00 00 00 00 00 00 00 00 00 00 00 00 00 00 00 01
E: 16.320554 25 31 02 90 59 f8 3a 00 00 00 00 00 00 00 00 00 00 00 00 00 00 00 00 00 00 01
E: 16.336556 25 31 02 90 59 f8 3a 00 00 00 00 00 00 00 00 00 00 00 00 00 00 00 00 00 00 01
E: 16.351556 25 31 02 90 59 f8 3a 00 00 00 00 00 00 00 00 00 00 00 00 00 00 00 00 00 00 01
E: 16.367552 25 31 02 90 59 f8 3a 00 00 00 00 00 00 00 00 00 00 00 00 00 00 00 00 00 00 01
E: 16.382555 25 31 02 90 59 f8 3a 00 00 00 00 00 00 00 00 00 00 00 00 00 00 00 00 00 00 01
E: 16.398551 25 31 02 90 59 f8 3a 00 00 00 00 00 00 00 00 00 00 00 00 00 00 00 00 00 00 01
E: 16.413556 25 31 02 90 59 f8 3a 00 00 00 00 00 00 00 00 00 00 00 00 00 00 00 00 00 00 01
E: 16.428549 25 31 02 90 59 f8 3a 00 00 00 00 00 00 00 00 00 00 00 00 00 00 00 00 00 00 01
E: 16.444549 25 31 02 90 59 f8 3a 00 00 00 00 00 00 00 00 00 00 00 00 00 00 00 00 00 00 01
E: 16.459554 25 31 02 90 59 f8 3a 00 00 00 00 00 00 00 00 00 00 00 00 00 00 00 00 00 00 01
E: 16.475551 25 31 02 90 59 f8 3a 00 00 00 00 00 00 00 00 00 00 00 00 00 00 00 00 00 00 01
E: 16.490552 25 31 02 90 59 f8 3a 00 00 00 00 00 00 00 00 00 00 00 00 00 00 00 00 00 00 01
E: 16.506553 25 31 02 90 59 f8 3a 00 00 00 00 00 00 00 00 00 00 00 00 00 00 00 00 00 00 01
E: 16.521550 25 31 02 90 59 f8 3a 00 00 00 00 00 00 00 00 00 00 00 00 00 00 00 00 00 00 01
E: 16.537552 25 31 02 90 59 f8 3a 00 00 00 00 00 00 00 00 00 00 00 00 00 00 00 00 00 00 01
E: 16.552552 25 31 02 90 59 f8 3a 00 00 00 00 00 00 00 00 00 00 00 00 00 00 00 00 00 00 01
E: 16.568548 25 31 02 90 59 f8 3a 00 00 00 00 00 00 00 00 00 00 00 00 00 00 00 00 00 00 01
E: 16.583550 25 31 02 90 59 f8 3a 00 00 00 00 00 00 00 00 00 00 00 00 00 00 00 00 00 00 01
E: 16.599546 25 31 02 90 59 f8 3a 00 00 00 00 00 00 00 00 00 00 00 00 00 00 00 00 00 00 01
E: 16.614546 25 31 02 90 59 f8 3a 00 00 00 00 00 00 00 00 00 00 00 00 00 00 00 00 00 00 01
E: 16.630546 25 31 02 90 59 f8 3a 00 00 00 00 00 00 00 00 00 00 00 00 00 00 00 00 00 00 01
E: 16.645521 25 31 02 90 59 f8 3a 00 00 00 00 00 00 00 00 00 00 00 00 00 00 00 00 00 00 01
E: 16.661545 25 31 02 90 59 f8 3a 00 00 00 00 00 00 00 00 00 00 00 00 00 00 00 00 00 00 01
E: 16.676531 25 31 02 90 59 f8 3a 00 00 00 00 00 00 00 00 00 00 00 00 00 00 00 00 00 00 01
E: 16.691529 25 31 02 90 59 f8 3a 00 00 00 00 00 00 00 00 00 00 00 00 00 00 00 00 00 00 01
E: 16.707552 25 31 02 88 59 f8 3a 00 00 00 00 00 00 00 00 00 00 00 00 00 00 00 00 00 00 01
E: 16.722544 25 31 02 88 59 f8 3a 00 00 00 00 00 00 00 00 00 00 00 00 00 00 00 00 00 00 01
E: 16.738544 25 31 02 88 59 f8 3a 00 00 00 00 00 00 00 00 00 00 00 00 00 00 00 00 00 00 01
E: 16.753545 25 31 02 88 59 f8 3a 00 00 00 00 00 00 00 00 00 00 00 00 00 00 00 00 00 00 01
E: 16.769546 25 31 02 88 59 f8 3a 00 00 00 00 00 00 00 00 00 00 00 00 00 00 00 00 00 00 01
E: 16.784546 25 31 02 88 59 f8 3a 00 00 00 00 00 00 00 00 00 00 00 00 00 00 00 00 00 00 01
E: 16.800543 25 31 02 88 59 f8 3a 00 00 00 00 00 00 00 00 00 00 00 00 00 00 00 00 00 00 01
E: 16.815541 25 31 02 88 59 f8 3a 00 00 00 00 00 00 00 00 00 00 00 00 00 00 00 00 00 00 01
E: 16.831540 25 31 02 88 59 f8 3a 00 00 00 00 00 00 00 00 00 00 00 00 00 00 00 00 00 00 01
E: 16.846546 25 31 02 88 59 00 3b 00 00 00 00 00 00 00 00 00 00 00 00 00 00 00 00 00 00 01
E: 16.862501 25 31 02 88 59 10 3b 00 00 00 00 00 00 00 00 00 00 00 00 00 00 00 00 00 00 01
E: 16.877878 25 31 02 88 59 10 3b 00 00 00 00 00 00 00 00 00 00 00 00 00 00 00 00 00 00 01
E: 16.893527 25 31 02 88 59 10 3b 00 00 00 00 00 00 00 00 00 00 00 00 00 00 00 00 00 00 01
E: 16.908511 25 31 02 88 59 08 3b 00 00 00 00 00 00 00 00 00 00 00 00 00 00 00 00 00 00 01
E: 16.924506 25 31 02 88 59 00 3b 00 00 00 00 00 00 00 00 00 00 00 00 00 00 00 00 00 00 01
E: 16.939857 25 31 02 88 59 00 3b 00 00 00 00 00 00 00 00 00 00 00 00 00 00 00 00 00 00 01
E: 16.954530 25 31 02 88 59 00 3b 00 00 00 00 00 00 00 00 00 00 00 00 00 00 00 00 00 00 01
E: 16.970511 25 31 02 78 59 00 3b 00 00 00 00 00 00 00 00 00 00 00 00 00 00 00 00 00 00 01
E: 16.985504 25 31 02 78 59 08 3b 00 00 00 00 00 00 00 00 00 00 00 00 00 00 00 00 00 00 01
E: 17.001535 25 31 02 80 59 10 3b 00 00 00 00 00 00 00 00 00 00 00 00 00 00 00 00 00 00 01
E: 17.016665 25 31 02 80 59 10 3b 00 00 00 00 00 00 00 00 00 00 00 00 00 00 00 00 00 00 01
E: 17.032872 25 31 02 80 59 10 3b 00 00 00 00 00 00 00 00 00 00 00 00 00 00 00 00 00 00 01
E: 17.047523 25 31 02 80 59 10 3b 00 00 00 00 00 00 00 00 00 00 00 00 00 00 00 00 00 00 01
E: 17.063492 25 31 02 80 59 10 3b 00 00 00 00 00 00 00 00 00 00 00 00 00 00 00 00 00 00 01
E: 17.078484 25 31 02 80 59 10 3b 00 00 00 00 00 00 00 00 00 00 00 00 00 00 00 00 00 00 01
E: 17.094482 25 31 02 80 59 10 3b 00 00 00 00 00 00 00 00 00 00 00 00 00 00 00 00 00 00 01
E: 17.109489 25 31 02 80 59 10 3b 00 00 00 00 00 00 00 00 00 00 00 00 00 00 00 00 00 00 01
E: 17.125486 25 31 02 80 59 10 3b 00 00 00 00 00 00 00 00 00 00 00 00 00 00 00 00 00 00 01
E: 17.140484 25 31 02 80 59 10 3b 00 00 00 00 00 00 00 00 00 00 00 00 00 00 00 00 00 00 01
E: 17.156497 25 31 02 80 59 00 3b 00 00 00 00 00 00 00 00 00 00 00 00 00 00 00 00 00 00 01
E: 17.171493 25 31 02 88 59 00 3b 00 00 00 00 00 00 00 00 00 00 00 00 00 00 00 00 00 00 01
E: 17.187479 25 31 02 88 59 00 3b 00 00 00 00 00 00 00 00 00 00 00 00 00 00 00 00 00 00 01
E: 17.202478 25 31 02 88 59 00 3b 00 00 00 00 00 00 00 00 00 00 00 00 00 00 00 00 00 00 01
E: 17.217493 25 31 02 88 59 08 3b 00 00 00 00 00 00 00 00 00 00 00 00 00 00 00 00 00 00 01
E: 17.228949 25 30 02 a0 59 18 3b 00 00 00 00 00 00 00 00 00 00 00 00 00 00 00 00 00 00 01
# 3. Finally, move your ten fingers on the screen and release them.
E: 23.048411 25 31 01 78 54 f0 15 00 00 00 00 00 00 00 00 00 00 00 00 00 00 00 00 00 00 01
E: 23.072422 25 31 01 78 54 f0 15 00 00 00 00 00 00 00 00 00 00 00 00 00 00 00 00 00 00 01
E: 23.098403 25 31 01 58 54 d8 15 31 02 a8 5c 20 1a 00 00 00 00 00 00 00 00 00 00 00 00 02
E: 23.133335 25 31 01 38 54 d8 15 31 02 a8 5c 20 1a 31 03 18 58 88 1e 00 00 00 00 00 00 03
E: 23.190331 25 31 01 20 54 a0 15 31 02 a8 5c 20 1a 31 03 18 58 88 1e 31 04 20 17 f0 49 04
E: 23.264361 25 31 01 20 54 a0 15 31 02 c0 5c 20 1a 31 03 18 58 88 1e 31 04 20 17 f0 49 04
E: 23.338365 25 31 01 c8 53 38 16 31 02 88 5d 78 1c 31 04 f8 1b 10 47 00 00 00 00 00 00 03
E: 23.408334 25 31 01 90 53 a8 16 31 02 a8 5d 20 1d 31 04 08 1d 70 46 00 00 00 00 00 00 03
E: 23.482330 25 31 01 78 53 c8 16 31 02 b0 5d 38 1d 31 04 40 1d 60 46 00 00 00 00 00 00 03
E: 23.558361 25 31 01 60 53 c8 16 31 02 b8 5d 38 1d 31 04 50 1d 60 46 00 00 00 00 00 00 03
E: 23.633377 25 31 01 50 53 b8 16 31 02 c8 5d 18 1d 31 04 50 1d 60 46 00 00 00 00 00 00 03
E: 23.706339 25 31 01 48 53 b8 16 31 02 c8 5d 18 1d 31 04 50 1d 60 46 00 00 00 00 00 00 03
E: 23.778331 25 31 01 48 53 b8 16 31 02 c0 5d 18 1d 31 04 50 1d 60 46 00 00 00 00 00 00 03
E: 23.854310 25 31 01 48 53 b8 16 31 02 c0 5d 18 1d 31 04 50 1d 60 46 00 00 00 00 00 00 03
E: 23.929311 25 31 01 38 53 98 16 31 02 c8 5d 00 1d 31 04 50 1d 60 46 00 00 00 00 00 00 03
E: 24.004318 25 31 01 38 53 98 16 31 02 c8 5d 00 1d 31 04 50 1d 60 46 00 00 00 00 00 00 03
E: 24.077306 25 31 01 30 53 a0 16 31 02 c8 5d 00 1d 31 04 50 1d 60 46 00 00 00 00 00 00 03
E: 24.150305 25 31 01 30 53 b8 16 31 02 d0 5d 00 1d 31 04 50 1d 60 46 00 00 00 00 00 00 03
E: 24.225299 25 31 01 30 53 b8 16 31 02 d0 5d 00 1d 31 04 50 1d 60 46 00 00 00 00 00 00 03
E: 24.300299 25 31 01 40 53 b8 16 31 02 d0 5d f0 1c 31 04 50 1d 60 46 00 00 00 00 00 00 03
E: 24.376297 25 31 01 40 53 b8 16 31 02 d0 5d f0 1c 31 04 50 1d 68 46 00 00 00 00 00 00 03
E: 24.449293 25 31 01 40 53 b8 16 31 02 d0 5d f0 1c 31 04 50 1d 68 46 00 00 00 00 00 00 03
E: 24.521326 25 31 01 40 53 b8 16 31 02 d0 5d f0 1c 31 04 50 1d 68 46 00 00 00 00 00 00 03
E: 24.596343 25 31 01 40 53 b8 16 31 02 d0 5d f0 1c 31 04 50 1d 68 46 00 00 00 00 00 00 03
E: 24.671347 25 31 01 38 53 c0 16 31 02 d0 5d f0 1c 31 04 50 1d 60 46 00 00 00 00 00 00 03
E: 24.747338 25 31 01 38 53 c0 16 31 02 d0 5d f0 1c 31 04 50 1d 60 46 00 00 00 00 00 00 03
E: 24.820345 25 31 01 38 53 b8 16 31 02 d0 5d f0 1c 31 04 50 1d 60 46 00 00 00 00 00 00 03
E: 24.892342 25 31 01 38 53 98 16 31 02 d0 5d e8 1c 31 04 50 1d 60 46 00 00 00 00 00 00 03
E: 24.967282 25 31 01 38 53 98 16 31 02 d0 5d e8 1c 31 04 50 1d 68 46 00 00 00 00 00 00 03
E: 25.043280 25 31 01 40 53 b0 16 31 02 d8 5d e8 1c 31 04 50 1d 68 46 00 00 00 00 00 00 03
E: 25.118314 25 31 01 40 53 b0 16 31 02 d8 5d e8 1c 31 04 50 1d 68 46 00 00 00 00 00 00 03
E: 25.190280 25 31 01 40 53 b0 16 31 02 d8 5d e8 1c 31 04 50 1d 68 46 00 00 00 00 00 00 03
E: 25.263275 25 31 01 40 53 b0 16 31 02 d8 5d e8 1c 31 04 50 1d 68 46 00 00 00 00 00 00 03
E: 25.338325 25 31 01 40 53 b0 16 31 02 d8 5d e8 1c 31 04 50 1d 68 46 00 00 00 00 00 00 03
E: 25.414326 25 31 01 40 53 b0 16 31 02 d8 5d e8 1c 31 04 50 1d 68 46 00 00 00 00 00 00 03
E: 25.489327 25 31 01 38 53 98 16 31 02 d8 5d e8 1c 31 04 50 1d 68 46 00 00 00 00 00 00 03
E: 25.560318 25 31 01 38 53 98 16 31 02 d8 5d e8 1c 31 04 50 1d 68 46 00 00 00 00 00 00 03
E: 25.634317 25 31 01 38 53 98 16 31 02 d8 5d e8 1c 31 04 50 1d 68 46 00 00 00 00 00 00 03
E: 25.710319 25 31 01 38 53 98 16 31 02 d8 5d e8 1c 31 04 50 1d 68 46 00 00 00 00 00 00 03
E: 25.785317 25 31 01 38 53 98 16 31 02 d8 5d e8 1c 31 04 50 1d 68 46 00 00 00 00 00 00 03
E: 25.860321 25 31 01 38 53 98 16 31 02 d0 5d e8 1c 31 04 50 1d 68 46 00 00 00 00 00 00 03
E: 25.933307 25 31 01 38 53 98 16 31 02 d0 5d e8 1c 31 04 50 1d 68 46 00 00 00 00 00 00 03
E: 26.006310 25 31 01 38 53 98 16 31 02 d0 5d e8 1c 31 04 50 1d 68 46 00 00 00 00 00 00 03
E: 26.081303 25 31 01 38 53 98 16 31 02 d0 5d e8 1c 31 04 50 1d 68 46 00 00 00 00 00 00 03
E: 26.157303 25 31 01 38 53 98 16 31 02 d0 5d e8 1c 31 04 50 1d 68 46 00 00 00 00 00 00 03
E: 26.232301 25 31 01 38 53 98 16 31 02 d0 5d e8 1c 31 04 50 1d 68 46 00 00 00 00 00 00 03
E: 26.304308 25 31 01 38 53 98 16 31 02 d0 5d e8 1c 31 04 48 1d 68 46 00 00 00 00 00 00 03
E: 26.357305 25 31 01 60 53 60 16 31 02 d0 5d e8 1c 00 00 00 00 00 00 00 00 00 00 00 00 02
E: 26.359300 25 30 01 b0 53 e0 15 30 02 88 5e 58 1f 30 03 08 58 d8 1e 30 04 48 1d 58 46 04
# Thank you.
