R: 273 05 0d 09 04 a1 01 85 01 09 22 a1 02 09 42 15 00 25 01 75 01 95 01 81 02 09 32 81 02 95 06 81 03 75 08 09 51 95 01 81 02 05 01 26 ff 0f 75 10 55 0e 65 33 09 30 35 00 46 ff 0f 81 02 46 ff 0f 09 31 81 02 c0 a1 02 05 0d 09 42 15 00 25 01 75 01 95 01 81 02 09 32 81 02 95 06 81 03 75 08 09 51 95 01 81 02 05 01 26 ff 0f 75 10 55 00 65 00 09 30 35 00 46 ff 0f 81 02 46 ff 0f 09 31 81 02 c0 05 0d 09 54 25 10 95 01 75 08 81 02 85 08 09 55 25 02 b1 02 c0 09 0e a1 01 85 07 09 22 a1 00 09 52 09 53 15 00 25 0a 75 08 95 02 b1 02 c0 06 00 ff 09 55 85 80 15 00 26 ff 00 75 08 95 01 b1 82 c0 05 01 09 02 a1 01 85 54 09 01 a1 00 05 09 19 01 29 02 15 00 25 01 75 01 95 02 81 02 95 06 81 03 05 01 09 30 15 00 26 ff 0f 75 10 95 01 81 02 09 31 75 10 95 01 81 02 09 3b 16 00 00 26 00 01 36 00 00 46 00 01 66 00 00 75 10 95 01 81 62 c0 c0
N: Elo TouchSystems Elo TouchSystems 2515 IntelliTouch Plus USB Touchmonitor
I: 3 04e7 0022
E: 0.000000 14 01 03 00 24 03 21 08 00 00 00 00 00 00 01
E: 0.008000 14 01 03 00 25 03 21 08 00 00 00 00 00 00 01
E: 0.016000 14 01 03 00 26 03 21 08 00 00 00 00 00 00 01
E: 0.024000 14 01 03 00 26 03 22 08 00 00 00 00 00 00 01
E: 0.032000 14 01 03 00 26 03 22 08 00 00 00 00 00 00 01
E: 0.040000 14 01 03 00 26 03 22 08 00 00 00 00 00 00 01
E: 0.048000 14 01 03 00 26 03 23 08 00 00 00 00 00 00 01
E: 0.056000 14 01 03 00 27 03 23 08 00 00 00 00 00 00 01
E: 0.064000 14 01 03 00 27 03 23 08 00 00 00 00 00 00 01
E: 0.072000 14 01 03 00 27 03 23 08 00 00 00 00 00 00 01
E: 0.080000 14 01 03 00 27 03 23 08 00 00 00 00 00 00 01
E: 0.088000 14 01 03 00 27 03 23 08 00 00 00 00 00 00 01
E: 0.096000 14 01 03 00 27 03 23 08 00 00 00 00 00 00 01
E: 0.104000 14 01 03 00 27 03 24 08 00 00 00 00 00 00 01
E: 0.112000 14 01 03 00 27 03 24 08 00 00 00 00 00 00 01
E: 0.120000 14 01 03 00 28 03 24 08 00 00 00 00 00 00 01
E: 0.128000 14 01 03 00 28 03 24 08 00 00 00 00 00 00 01
E: 0.136000 14 01 03 00 28 03 24 08 00 00 00 00 00 00 01
E: 0.144000 14 01 03 00 29 03 24 08 00 00 00 00 00 00 01
E: 0.152000 14 01 03 00 29 03 24 08 00 00 00 00 00 00 01
E: 0.160000 14 01 03 00 29 03 25 08 00 00 00 00 00 00 01
E: 0.168000 14 01 03 00 2a 03 25 08 00 00 00 00 00 00 01
E: 0.176000 14 01 03 00 2a 03 25 08 00 00 00 00 00 00 01
E: 0.184000 14 01 03 00 2b 03 25 08 00 00 00 00 00 00 01
E: 0.192000 14 01 03 00 2c 03 24 08 00 00 00 00 00 00 01
E: 0.200000 14 01 03 00 2d 03 24 08 00 00 00 00 00 00 01
E: 0.208000 14 01 03 00 2e 03 23 08 00 00 00 00 00 00 01
E: 0.216000 14 01 03 00 30 03 23 08 00 00 00 00 00 00 01
E: 0.224000 14 01 03 00 33 03 22 08 00 00 00 00 00 00 01
E: 0.232000 14 01 03 00 35 03 21 08 00 00 00 00 00 00 01
E: 0.240000 14 01 03 00 3b 03 1f 08 00 00 00 00 00 00 01
E: 0.248000 14 01 03 00 42 03 1d 08 00 00 00 00 00 00 01
E: 0.256000 14 01 03 00 4b 03 1a 08 00 00 00 00 00 00 01
E: 0.264000 14 01 03 00 55 03 15 08 00 00 00 00 00 00 01
E: 0.272000 14 01 03 00 60 03 12 08 00 00 00 00 00 00 01
E: 0.280000 14 01 03 00 6a 03 0e 08 00 00 00 00 00 00 01
E: 0.288000 14 01 03 00 75 03 0c 08 00 00 00 00 00 00 01
E: 0.296000 14 01 03 00 7e 03 0a 08 00 00 00 00 00 00 01
E: 0.304000 14 01 03 00 88 03 08 08 00 00 00 00 00 00 01
E: 0.312000 14 01 03 00 91 03 06 08 00 00 00 00 00 00 01
E: 0.320000 14 01 03 00 9b 03 05 08 00 00 00 00 00 00 01
E: 0.328000 14 01 03 00 a5 03 05 08 00 00 00 00 00 00 01
E: 0.336000 14 01 03 00 af 03 04 08 00 00 00 00 00 00 01
E: 0.344000 14 01 03 00 ba 03 04 08 00 00 00 00 00 00 01
E: 0.352000 14 01 03 00 c6 03 03 08 00 00 00 00 00 00 01
E: 0.360000 14 01 03 00 d1 03 02 08 00 00 00 00 00 00 01
E: 0.368000 14 01 03 00 dc 03 01 08 00 00 00 00 00 00 01
E: 0.376000 14 01 03 00 e8 03 00 08 00 00 00 00 00 00 01
E: 0.384000 14 01 03 00 f4 03 ff 07 00 00 00 00 00 00 01
E: 0.392000 14 01 03 00 ff 03 ff 07 00 00 00 00 00 00 01
E: 0.400000 14 01 03 00 0a 04 ff 07 00 00 00 00 00 00 01
E: 0.408000 14 01 03 00 15 04 ff 07 00 00 00 00 00 00 01
E: 0.416000 14 01 03 00 1f 04 fd 07 00 00 00 00 00 00 01
E: 0.424000 14 01 03 00 2a 04 fd 07 00 00 00 00 00 00 01
E: 0.432000 14 01 03 00 36 04 fd 07 00 00 00 00 00 00 01
E: 0.440000 14 01 03 00 41 04 fe 07 00 00 00 00 00 00 01
E: 0.448000 14 01 03 00 4b 04 fe 07 00 00 00 00 00 00 01
E: 0.456000 14 01 03 00 56 04 fe 07 00 00 00 00 00 00 01
E: 0.464000 14 01 03 00 62 04 fd 07 00 00 00 00 00 00 01
E: 0.472000 14 01 03 00 6d 04 fd 07 00 00 00 00 00 00 01
E: 0.480000 14 01 03 00 77 04 fd 07 00 00 00 00 00 00 01
E: 0.488000 14 01 03 00 83 04 fc 07 00 00 00 00 00 00 01
E: 0.496000 14 01 03 00 8d 04 fb 07 00 00 00 00 00 00 01
E: 0.504000 14 01 03 00 98 04 fa 07 00 00 00 00 00 00 01
E: 0.512000 14 01 03 00 a3 04 fa 07 00 00 00 00 00 00 01
E: 0.520000 14 01 03 00 ad 04 f9 07 00 00 00 00 00 00 01
E: 0.528000 14 01 03 00 b7 04 f9 07 00 00 00 00 00 00 01
E: 0.536000 14 01 03 00 bf 04 f9 07 00 00 00 00 00 00 01
E: 0.544000 14 01 03 00 c8 04 f9 07 00 00 00 00 00 00 01
E: 0.552000 14 01 03 00 d2 04 fa 07 00 00 00 00 00 00 01
E: 0.560000 14 01 03 00 d9 04 fc 07 00 00 00 00 00 00 01
E: 0.568000 14 01 03 00 e1 04 fe 07 00 00 00 00 00 00 01
E: 0.576000 14 01 03 00 e9 04 ff 07 00 00 00 00 00 00 01
E: 0.584000 14 01 03 00 f0 04 00 08 00 00 00 00 00 00 01
E: 0.592000 14 01 03 00 f8 04 02 08 00 00 00 00 00 00 01
E: 0.600000 14 01 03 00 00 05 02 08 00 00 00 00 00 00 01
E: 0.608000 14 01 03 00 07 05 03 08 00 00 00 00 00 00 01
E: 0.616000 14 01 03 00 0f 05 04 08 00 00 00 00 00 00 01
E: 0.624000 14 01 03 00 17 05 04 08 00 00 00 00 00 00 01
E: 0.632000 14 01 03 00 21 05 03 08 00 00 00 00 00 00 01
E: 0.640000 14 01 03 00 29 05 03 08 00 00 00 00 00 00 01
E: 0.648000 14 01 03 00 32 05 02 08 00 00 00 00 00 00 01
E: 0.656000 14 01 03 00 3b 05 00 08 00 00 00 00 00 00 01
E: 0.664000 14 01 03 00 45 05 00 08 00 00 00 00 00 00 01
E: 0.672000 14 01 03 00 4d 05 fe 07 00 00 00 00 00 00 01
E: 0.680000 14 01 03 00 56 05 fc 07 00 00 00 00 00 00 01
E: 0.688000 14 01 03 00 5e 05 fa 07 00 00 00 00 00 00 01
E: 0.696000 14 01 03 00 65 05 f9 07 00 00 00 00 00 00 01
E: 0.704000 14 01 03 00 6e 05 f8 07 00 00 00 00 00 00 01
E: 0.712000 14 01 03 00 75 05 f8 07 00 00 00 00 00 00 01
E: 0.720000 14 01 03 00 7d 05 f7 07 00 00 00 00 00 00 01
E: 0.728000 14 01 03 00 83 05 f7 07 00 00 00 00 00 00 01
E: 0.736000 14 01 03 00 8a 05 f8 07 00 00 00 00 00 00 01
E: 0.744000 14 01 03 00 90 05 f8 07 00 00 00 00 00 00 01
E: 0.752000 14 01 03 00 93 05 f8 07 00 00 00 00 00 00 01
E: 0.760000 14 01 03 00 98 05 fa 07 00 00 00 00 00 00 01
E: 0.768000 14 01 03 00 9e 05 fb 07 00 00 00 00 00 00 01
E: 0.776000 14 01 03 00 a0 05 fb 07 00 00 00 00 00 00 01
E: 0.784000 14 01 03 00 a3 05 fc 07 00 00 00 00 00 00 01
E: 0.792000 14 01 03 00 a9 05 fc 07 00 00 00 00 00 00 01
E: 0.800000 14 01 03 00 ae 05 fd 07 00 00 00 00 00 00 01
E: 0.808000 14 01 03 00 b0 05 fe 07 00 00 00 00 00 00 01
E: 0.816000 14 01 03 00 b3 05 fe 07 00 00 00 00 00 00 01
E: 0.824000 14 01 03 00 b5 05 ff 07 00 00 00 00 00 00 01
E: 0.832000 14 01 03 00 b9 05 ff 07 00 00 00 00 00 00 01
E: 0.840000 14 01 03 00 bf 05 ff 07 00 00 00 00 00 00 01
E: 0.848000 14 01 03 00 c4 05 ff 07 00 00 00 00 00 00 01
E: 0.856000 14 01 03 00 c7 05 00 08 00 00 00 00 00 00 01
E: 0.864000 14 01 03 00 cc 05 00 08 00 00 00 00 00 00 01
E: 0.872000 14 01 03 00 d2 05 02 08 00 00 00 00 00 00 01
E: 0.880000 14 01 03 00 d8 05 04 08 00 00 00 00 00 00 01
E: 0.888000 14 01 03 00 de 05 04 08 00 00 00 00 00 00 01
E: 0.896000 14 01 03 00 e4 05 05 08 00 00 00 00 00 00 01
E: 0.904000 14 01 03 00 e9 05 05 08 00 00 00 00 00 00 01
E: 0.912000 14 01 03 00 ec 05 05 08 00 00 00 00 00 00 01
E: 0.920000 14 01 03 00 ef 05 06 08 00 00 00 00 00 00 01
E: 0.928000 14 01 03 00 f4 05 06 08 00 00 00 00 00 00 01
E: 0.936000 14 01 03 00 f8 05 07 08 00 00 00 00 00 00 01
E: 0.944000 14 01 03 00 fa 05 07 08 00 00 00 00 00 00 01
E: 0.952000 14 01 03 00 fc 05 07 08 00 00 00 00 00 00 01
E: 0.960000 14 01 03 00 fe 05 07 08 00 00 00 00 00 00 01
E: 0.968000 14 01 03 00 00 06 07 08 00 00 00 00 00 00 01
E: 0.976000 14 01 03 00 02 06 07 08 00 00 00 00 00 00 01
E: 0.984000 14 01 03 00 05 06 07 08 00 00 00 00 00 00 01
E: 0.992000 14 01 03 00 07 06 07 08 00 00 00 00 00 00 01
E: 1.000000 14 01 03 00 09 06 07 08 00 00 00 00 00 00 01
E: 1.008000 14 01 03 00 0b 06 08 08 00 00 00 00 00 00 01
E: 1.016000 14 01 03 00 0d 06 08 08 00 00 00 00 00 00 01
E: 1.024000 14 01 03 00 0f 06 08 08 00 00 00 00 00 00 01
E: 1.032000 14 01 03 00 11 06 08 08 00 00 00 00 00 00 01
E: 1.040000 14 01 03 00 13 06 08 08 00 00 00 00 00 00 01
E: 1.048000 14 01 03 00 16 06 08 08 00 00 00 00 00 00 01
E: 1.056000 14 01 03 00 19 06 08 08 00 00 00 00 00 00 01
E: 1.064000 14 01 03 00 1e 06 07 08 00 00 00 00 00 00 01
E: 1.072000 14 01 03 00 24 06 07 08 00 00 00 00 00 00 01
E: 1.080000 14 01 03 00 27 06 06 08 00 00 00 00 00 00 01
E: 1.088000 14 01 03 00 2e 06 06 08 00 00 00 00 00 00 01
E: 1.096000 14 01 03 00 33 06 05 08 00 00 00 00 00 00 01
E: 1.104000 14 01 03 00 35 06 05 08 00 00 00 00 00 00 01
E: 1.112000 14 01 03 00 38 06 06 08 00 00 00 00 00 00 01
E: 1.120000 14 01 03 00 3a 06 05 08 00 00 00 00 00 00 01
E: 1.128000 14 01 03 00 3c 06 05 08 00 00 00 00 00 00 01
E: 1.136000 14 01 03 00 3e 06 06 08 00 00 00 00 00 00 01
E: 1.144000 14 01 03 00 3f 06 06 08 00 00 00 00 00 00 01
E: 1.152000 14 01 03 00 41 06 06 08 00 00 00 00 00 00 01
E: 1.160000 14 01 03 00 41 06 06 08 00 00 00 00 00 00 01
E: 1.168000 14 01 03 00 42 06 06 08 00 00 00 00 00 00 01
E: 1.176000 14 01 03 00 43 06 06 08 00 00 00 00 00 00 01
E: 1.184000 14 01 03 00 44 06 06 08 00 00 00 00 00 00 01
E: 1.192000 14 01 03 00 44 06 07 08 00 00 00 00 00 00 01
E: 1.200000 14 01 03 00 44 06 07 08 00 00 00 00 00 00 01
E: 1.208000 14 01 03 00 45 06 07 08 00 00 00 00 00 00 01
E: 1.216000 14 01 03 00 45 06 07 08 00 00 00 00 00 00 01
E: 1.224000 14 01 03 00 45 06 07 08 00 00 00 00 00 00 01
E: 1.232000 14 01 03 00 45 06 07 08 00 00 00 00 00 00 01
E: 1.240000 14 01 03 00 45 06 07 08 00 00 00 00 00 00 01
E: 1.248000 14 01 03 00 45 06 08 08 00 00 00 00 00 00 01
E: 1.256000 14 01 03 00 45 06 08 08 00 00 00 00 00 00 01
E: 1.264000 14 01 03 00 45 06 08 08 00 00 00 00 00 00 01
E: 1.272000 14 01 03 00 45 06 08 08 00 00 00 00 00 00 01
E: 1.280000 14 01 03 00 45 06 08 08 00 00 00 00 00 00 01
E: 1.288000 14 01 03 00 45 06 08 08 00 00 00 00 00 00 01
E: 1.296000 14 01 00 00 45 06 08 08 00 00 00 00 00 00 01
E: 11.304000 14 01 03 00 d4 03 cc 07 00 00 00 00 00 00 01
E: 11.312000 14 01 03 00 d4 03 cc 07 00 00 00 00 00 00 01
E: 11.320000 14 01 03 00 d4 03 cc 07 00 00 00 00 00 00 01
E: 11.328000 14 01 03 00 d4 03 cc 07 00 00 00 00 00 00 01
E: 11.336000 14 01 03 00 d6 03 cb 07 00 00 00 00 00 00 01
E: 11.344000 14 01 03 00 d8 03 c9 07 03 01 91 03 15 08 02
E: 11.352000 14 01 03 00 d8 03 c9 07 03 01 83 03 12 08 02
E: 11.360000 14 01 03 00 d9 03 c7 07 03 01 8b 03 1c 08 02
E: 11.368000 14 01 03 00 d9 03 c7 07 03 01 89 03 1d 08 02
E: 11.376000 14 01 03 00 da 03 c7 07 03 01 83 03 1c 08 02
E: 11.384000 14 01 03 00 da 03 c7 07 03 01 79 03 19 08 02
E: 11.392000 14 01 03 00 da 03 c7 07 03 01 77 03 1b 08 02
E: 11.400000 14 01 03 00 da 03 c7 07 03 01 78 03 1d 08 02
E: 11.408000 14 01 03 00 d9 03 ca 07 00 00 00 00 00 00 01
E: 11.416000 14 01 03 00 d9 03 cc 07 00 00 00 00 00 00 01
E: 11.424000 14 01 03 00 d8 03 d0 07 00 01 78 03 1d 08 02
E: 11.432000 14 01 03 00 d8 03 d1 07 00 00 00 00 00 00 01
E: 11.440000 14 01 03 00 d7 03 d1 07 03 01 72 03 34 08 02
E: 11.448000 14 01 03 00 d7 03 d1 07 03 01 72 03 24 08 02
E: 11.456000 14 01 03 00 d7 03 d2 07 03 01 72 03 16 08 02
E: 11.464000 14 01 03 00 d6 03 d2 07 03 01 72 03 14 08 02
E: 11.472000 14 01 03 00 d6 03 d2 07 03 01 72 03 14 08 02
E: 11.480000 14 01 03 00 d5 03 d3 07 03 01 73 03 14 08 02
E: 11.488000 14 01 03 00 d5 03 d3 07 03 01 73 03 14 08 02
E: 11.496000 14 01 03 00 d5 03 d3 07 03 01 73 03 14 08 02
E: 11.504000 14 01 03 00 d4 03 d3 07 03 01 73 03 14 08 02
E: 11.512000 14 01 03 00 d4 03 d3 07 03 01 73 03 14 08 02
E: 11.520000 14 01 03 00 d4 03 d3 07 03 01 73 03 14 08 02
E: 11.528000 14 01 03 00 d3 03 d3 07 03 01 73 03 14 08 02
E: 11.536000 14 01 03 00 d3 03 d0 07 03 01 73 03 14 08 02
E: 11.544000 14 01 03 00 d3 03 cc 07 03 01 73 03 14 08 02
E: 11.552000 14 01 03 00 d3 03 ca 07 03 01 73 03 14 08 02
E: 11.560000 14 01 03 00 d4 03 c9 07 03 01 73 03 15 08 02
E: 11.568000 14 01 03 00 d4 03 c9 07 03 01 73 03 15 08 02
E: 11.576000 14 01 03 00 d4 03 c9 07 03 01 73 03 15 08 02
E: 11.584000 14 01 03 00 d4 03 c8 07 03 01 73 03 15 08 02
E: 11.592000 14 01 03 00 d4 03 c8 07 03 01 73 03 16 08 02
E: 11.600000 14 01 03 00 d5 03 c8 07 03 01 74 03 16 08 02
E: 11.608000 14 01 03 00 d5 03 c8 07 03 01 74 03 17 08 02
E: 11.616000 14 01 03 00 d5 03 c7 07 03 01 74 03 17 08 02
E: 11.624000 14 01 03 00 d6 03 c7 07 03 01 74 03 17 08 02
E: 11.632000 14 01 03 00 d6 03 c7 07 03 01 75 03 17 08 02
E: 11.640000 14 01 03 00 d6 03 c7 07 03 01 75 03 18 08 02
E: 11.648000 14 01 03 00 d7 03 c7 07 03 01 75 03 19 08 02
E: 11.656000 14 01 03 00 d7 03 c7 07 03 01 76 03 19 08 02
E: 11.664000 14 01 03 00 d8 03 c7 07 03 01 76 03 19 08 02
E: 11.672000 14 01 03 00 d9 03 c7 07 03 01 76 03 19 08 02
E: 11.680000 14 01 03 00 da 03 c8 07 03 01 77 03 1c 08 02
E: 11.688000 14 01 03 00 da 03 c8 07 03 01 78 03 1c 08 02
E: 11.696000 14 01 03 00 dc 03 c9 07 03 01 79 03 1e 08 02
E: 11.704000 14 01 03 00 dd 03 ca 07 03 01 7b 03 20 08 02
E: 11.712000 14 01 03 00 df 03 cb 07 03 01 7d 03 22 08 02
E: 11.720000 14 01 03 00 e0 03 cc 07 03 01 7f 03 22 08 02
E: 11.728000 14 01 03 00 e3 03 cf 07 03 01 86 03 26 08 02
E: 11.736000 14 01 03 00 e5 03 d3 07 00 00 00 00 00 00 01
E: 11.744000 14 01 03 00 e7 03 dc 07 00 01 86 03 26 08 02
E: 11.752000 14 01 03 00 ef 03 e5 07 00 00 00 00 00 00 01
E: 11.760000 14 01 03 00 f6 03 fa 07 03 01 c0 03 38 08 02
E: 11.768000 14 01 03 00 07 04 0d 08 03 01 c8 03 38 08 02
E: 11.776000 14 01 03 00 16 04 1f 08 03 01 d0 03 38 08 02
E: 11.784000 14 01 03 00 25 04 28 08 03 01 d5 03 38 08 02
E: 11.792000 14 01 03 00 2c 04 23 08 03 01 da 03 3c 08 02
E: 11.800000 14 01 03 00 2e 04 2a 08 03 01 dd 03 3f 08 02
E: 11.808000 14 01 03 00 32 04 3a 08 03 01 e1 03 41 08 02
E: 11.816000 14 01 03 00 35 04 3a 08 03 01 e5 03 43 08 02
E: 11.824000 14 01 03 00 39 04 4a 08 03 01 e7 03 43 08 02
E: 11.832000 14 01 03 00 3e 04 4a 08 03 01 e9 03 43 08 02
E: 11.840000 14 01 03 00 45 04 4a 08 03 01 ec 03 48 08 02
E: 11.848000 14 01 03 01 f2 03 45 08 00 00 00 00 00 00 01
E: 11.856000 14 01 00 00 45 04 4a 08 00 00 00 00 00 00 01
E: 11.864000 14 01 03 01 fd 03 42 08 00 00 00 00 00 00 01
E: 11.872000 14 01 03 00 9b 04 20 08 03 01 17 04 3c 08 02
E: 11.880000 14 01 03 00 a2 04 22 08 03 01 31 04 34 08 02
E: 11.888000 14 01 03 00 ad 04 24 08 03 01 48 04 27 08 02
E: 11.896000 14 01 03 00 b2 04 46 08 03 01 58 04 25 08 02
E: 11.904000 14 01 03 00 b9 04 48 08 03 01 5f 04 25 08 02
E: 11.912000 14 01 03 00 c1 04 46 08 03 01 65 04 24 08 02
E: 11.920000 14 01 03 01 6d 04 28 08 00 00 00 00 00 00 01
E: 11.928000 14 01 00 00 c1 04 46 08 03 01 74 04 2c 08 02
E: 11.936000 14 01 03 01 80 04 2c 08 00 00 00 00 00 00 01
E: 11.944000 14 01 03 00 18 05 22 08 03 01 97 04 2b 08 02
E: 11.952000 14 01 03 00 1e 05 20 08 03 01 af 04 29 08 02
E: 11.960000 14 01 03 00 26 05 18 08 03 01 bd 04 24 08 02
E: 11.968000 14 01 03 00 34 05 14 08 03 01 c9 04 1e 08 02
E: 11.976000 14 01 03 00 3f 05 0f 08 03 01 da 04 16 08 02
E: 11.984000 14 01 03 00 4a 05 0e 08 03 01 e8 04 0f 08 02
E: 11.992000 14 01 03 00 51 05 22 08 03 01 f4 04 0a 08 02
E: 12.000000 14 01 03 00 56 05 2f 08 03 01 fd 04 09 08 02
E: 12.008000 14 01 03 01 08 05 0c 08 00 00 00 00 00 00 01
E: 12.016000 14 01 03 01 13 05 0e 08 00 00 00 00 00 00 01
E: 12.024000 14 01 00 00 56 05 2f 08 00 00 00 00 00 00 01
E: 12.032000 14 01 03 01 29 05 14 08 00 00 00 00 00 00 01
E: 12.040000 14 01 03 01 49 05 1b 08 00 00 00 00 00 00 01
E: 12.048000 14 01 03 00 d4 05 f9 07 03 01 66 05 22 08 02
E: 12.056000 14 01 03 00 e0 05 02 08 03 01 7c 05 1c 08 02
E: 12.064000 14 01 03 00 ee 05 0b 08 03 01 8c 05 19 08 02
E: 12.072000 14 01 03 00 f7 05 34 08 03 01 9a 05 14 08 02
E: 12.080000 14 01 03 00 02 06 58 08 03 01 a6 05 0e 08 02
E: 12.088000 14 01 03 00 0e 06 57 08 03 01 ae 05 0e 08 02
E: 12.096000 14 01 03 00 16 06 62 08 03 01 b4 05 0e 08 02
E: 12.104000 14 01 03 00 1c 06 55 08 03 01 b7 05 0e 08 02
E: 12.112000 14 01 03 00 24 06 55 08 03 01 ba 05 0e 08 02
E: 12.120000 14 01 03 00 2c 06 45 08 03 01 c3 05 0d 08 02
E: 12.128000 14 01 03 00 34 06 37 08 03 01 cd 05 0c 08 02
E: 12.136000 14 01 03 00 3d 06 2e 08 03 01 e1 05 0b 08 02
E: 12.144000 14 01 03 00 47 06 2e 08 03 01 f3 05 09 08 02
E: 12.152000 14 01 03 00 50 06 24 08 03 01 00 06 08 08 02
E: 12.160000 14 01 03 00 64 06 11 08 03 01 08 06 08 08 02
E: 12.168000 14 01 03 01 0e 06 08 08 00 00 00 00 00 00 01
E: 12.176000 14 01 03 00 76 06 0e 08 03 01 14 06 08 08 02
E: 12.184000 14 01 03 00 82 06 01 08 03 01 1b 06 0a 08 02
E: 12.192000 14 01 03 00 8a 06 f5 07 03 01 23 06 0b 08 02
E: 12.200000 14 01 03 01 2e 06 0d 08 00 00 00 00 00 00 01
E: 12.208000 14 01 00 00 8a 06 f5 07 00 00 00 00 00 00 01
E: 12.216000 14 01 03 01 41 06 13 08 00 00 00 00 00 00 01
E: 12.224000 14 01 03 01 55 06 18 08 00 00 00 00 00 00 01
E: 12.232000 14 01 03 00 d2 06 01 08 03 01 62 06 1b 08 02
E: 12.240000 14 01 03 00 d8 06 fb 07 03 01 69 06 1a 08 02
E: 12.248000 14 01 03 00 e1 06 ee 07 03 01 70 06 19 08 02
E: 12.256000 14 01 03 00 e7 06 e1 07 03 01 75 06 17 08 02
E: 12.264000 14 01 03 00 ef 06 d3 07 03 01 7c 06 15 08 02
E: 12.272000 14 01 03 00 f3 06 c9 07 03 01 81 06 13 08 02
E: 12.280000 14 01 03 00 f6 06 c0 07 03 01 84 06 12 08 02
E: 12.288000 14 01 03 00 f9 06 b8 07 03 01 8a 06 0d 08 02
E: 12.296000 14 01 03 00 fa 06 b6 07 03 01 8f 06 0b 08 02
E: 12.304000 14 01 03 00 fc 06 b4 07 03 01 93 06 0b 08 02
E: 12.312000 14 01 03 00 fd 06 b4 07 03 01 97 06 0c 08 02
E: 12.320000 14 01 03 00 fe 06 b3 07 03 01 99 06 0c 08 02
E: 12.328000 14 01 03 00 ff 06 b3 07 03 01 9a 06 0d 08 02
E: 12.336000 14 01 03 00 00 07 b2 07 03 01 9b 06 0e 08 02
E: 12.344000 14 01 03 00 01 07 b2 07 03 01 9c 06 0f 08 02
E: 12.352000 14 01 03 00 02 07 b1 07 03 01 9d 06 0f 08 02
E: 12.360000 14 01 03 00 03 07 b1 07 03 01 9f 06 11 08 02
E: 12.368000 14 01 03 00 04 07 b0 07 03 01 a1 06 12 08 02
E: 12.376000 14 01 03 00 05 07 b0 07 03 01 a1 06 13 08 02
E: 12.384000 14 01 03 00 05 07 b0 07 03 01 a1 06 15 08 02
E: 12.392000 14 01 03 00 05 07 b1 07 03 01 a1 06 16 08 02
E: 12.400000 14 01 03 00 06 07 b2 07 03 01 a1 06 17 08 02
E: 12.408000 14 01 03 00 06 07 b5 07 03 01 9f 06 17 08 02
E: 12.416000 14 01 03 00 06 07 b7 07 03 01 9f 06 17 08 02
E: 12.424000 14 01 03 00 06 07 b8 07 03 01 9f 06 17 08 02
E: 12.432000 14 01 03 00 05 07 b8 07 03 01 9f 06 18 08 02
E: 12.440000 14 01 03 00 05 07 b8 07 03 01 9f 06 17 08 02
E: 12.448000 14 01 03 00 05 07 b8 07 03 01 9f 06 17 08 02
E: 12.456000 14 01 03 00 05 07 b9 07 03 01 9e 06 17 08 02
E: 12.464000 14 01 03 00 05 07 b9 07 03 01 9e 06 15 08 02
E: 12.472000 14 01 03 00 05 07 ba 07 03 01 9e 06 15 08 02
E: 12.480000 14 01 03 00 04 07 ba 07 03 01 9e 06 14 08 02
E: 12.488000 14 01 03 00 04 07 bb 07 03 01 9d 06 14 08 02
E: 12.496000 14 01 03 00 04 07 bb 07 03 01 9d 06 13 08 02
E: 12.504000 14 01 03 00 03 07 bb 07 03 01 9d 06 13 08 02
E: 12.512000 14 01 03 00 03 07 bb 07 03 01 9d 06 12 08 02
E: 12.520000 14 01 03 00 03 07 bb 07 03 01 9c 06 11 08 02
E: 12.528000 14 01 03 00 03 07 bc 07 03 01 9c 06 0f 08 02
E: 12.536000 14 01 03 00 03 07 bc 07 03 01 9c 06 0e 08 02
E: 12.544000 14 01 03 00 03 07 bc 07 03 01 9c 06 0e 08 02
E: 12.552000 14 01 03 00 03 07 bc 07 03 01 9c 06 0d 08 02
E: 12.560000 14 01 03 00 02 07 bd 07 03 01 9b 06 0c 08 02
E: 12.568000 14 01 03 00 02 07 bd 07 03 01 9b 06 0c 08 02
E: 12.576000 14 01 03 00 02 07 bd 07 03 01 9b 06 0b 08 02
E: 12.584000 14 01 03 00 02 07 bd 07 03 01 9a 06 0d 08 02
E: 12.592000 14 01 03 00 02 07 bd 07 03 01 9a 06 0e 08 02
E: 12.600000 14 01 03 00 02 07 bd 07 03 01 9a 06 0e 08 02
E: 12.608000 14 01 03 00 02 07 bc 07 03 01 9a 06 0e 08 02
E: 12.616000 14 01 03 00 02 07 bd 07 03 01 9a 06 0d 08 02
E: 12.624000 14 01 03 00 02 07 bd 07 03 01 9a 06 0d 08 02
E: 12.632000 14 01 03 00 02 07 bd 07 03 01 9a 06 0d 08 02
E: 12.640000 14 01 03 00 02 07 bd 07 03 01 9a 06 0d 08 02
E: 12.648000 14 01 03 00 02 07 bd 07 03 01 9a 06 0d 08 02
E: 12.656000 14 01 03 00 02 07 bd 07 03 01 9a 06 0d 08 02
E: 12.664000 14 01 03 00 02 07 bd 07 03 01 9a 06 0d 08 02
E: 12.672000 14 01 03 00 02 07 bd 07 03 01 9a 06 0b 08 02
E: 12.680000 14 01 03 00 02 07 bd 07 03 01 9a 06 0b 08 02
E: 12.688000 14 01 03 00 02 07 bd 07 03 01 9a 06 0b 08 02
E: 12.696000 14 01 03 00 02 07 bd 07 03 01 99 06 0b 08 02
E: 12.704000 14 01 03 00 02 07 bd 07 03 01 99 06 0b 08 02
E: 12.712000 14 01 03 00 02 07 bc 07 03 01 99 06 0a 08 02
E: 12.720000 14 01 03 00 02 07 bc 07 03 01 99 06 08 08 02
E: 12.728000 14 01 03 00 02 07 bc 07 03 01 99 06 08 08 02
E: 12.736000 14 01 03 00 01 07 bc 07 03 01 99 06 08 08 02
E: 12.744000 14 01 03 00 01 07 bc 07 03 01 99 06 08 08 02
E: 12.752000 14 01 03 00 01 07 bc 07 03 01 99 06 08 08 02
E: 12.760000 14 01 03 00 01 07 bc 07 03 01 99 06 08 08 02
E: 12.768000 14 01 03 00 01 07 bc 07 03 01 99 06 08 08 02
E: 12.776000 14 01 03 00 01 07 bc 07 03 01 99 06 08 08 02
E: 12.784000 14 01 03 00 01 07 bc 07 03 01 99 06 08 08 02
E: 12.792000 14 01 03 00 01 07 bc 07 03 01 99 06 08 08 02
E: 12.800000 14 01 03 00 01 07 bc 07 03 01 99 06 08 08 02
E: 12.808000 14 01 03 00 02 07 bc 07 03 01 99 06 08 08 02
E: 12.816000 14 01 03 00 02 07 bc 07 03 01 99 06 08 08 02
E: 12.824000 14 01 03 00 02 07 bc 07 03 01 99 06 08 08 02
E: 12.832000 14 01 03 00 02 07 bc 07 03 01 99 06 08 08 02
E: 12.840000 14 01 03 00 02 07 bc 07 03 01 99 06 08 08 02
E: 12.848000 14 01 03 00 02 07 bc 07 03 01 9a 06 08 08 02
E: 12.856000 14 01 03 00 02 07 bc 07 03 01 9a 06 08 08 02
E: 12.864000 14 01 03 00 02 07 bc 07 03 01 9a 06 08 08 02
E: 12.872000 14 01 03 00 02 07 bc 07 03 01 9a 06 08 08 02
E: 12.880000 14 01 03 00 03 07 bc 07 03 01 9a 06 08 08 02
E: 12.888000 14 01 03 00 03 07 bd 07 03 01 9a 06 0a 08 02
E: 12.896000 14 01 03 00 03 07 bd 07 03 01 9a 06 0b 08 02
E: 12.904000 14 01 03 00 03 07 bc 07 03 01 9a 06 0a 08 02
E: 12.912000 14 01 03 00 04 07 bb 07 00 00 00 00 00 00 01
E: 12.920000 14 01 03 00 04 07 ba 07 00 00 00 00 00 00 01
E: 12.928000 14 01 03 00 04 07 b9 07 00 00 00 00 00 00 01
E: 12.936000 14 01 03 00 05 07 b8 07 00 01 9a 06 0a 08 02
E: 12.944000 14 01 03 00 05 07 b7 07 00 00 00 00 00 00 01
E: 12.952000 14 01 03 00 05 07 b6 07 00 00 00 00 00 00 01
E: 12.960000 14 01 03 00 06 07 b6 07 00 00 00 00 00 00 01
E: 12.968000 14 01 03 00 06 07 b5 07 00 00 00 00 00 00 01
E: 12.976000 14 01 03 00 06 07 b4 07 00 00 00 00 00 00 01
E: 12.984000 14 01 03 00 07 07 b3 07 00 00 00 00 00 00 01
E: 12.992000 14 01 03 00 07 07 b2 07 00 00 00 00 00 00 01
E: 13.000000 14 01 03 00 07 07 b2 07 00 00 00 00 00 00 01
E: 13.008000 14 01 03 00 08 07 b1 07 00 00 00 00 00 00 01
E: 13.016000 14 01 03 00 08 07 b0 07 00 00 00 00 00 00 01
E: 13.024000 14 01 03 00 09 07 af 07 00 00 00 00 00 00 01
E: 13.032000 14 01 03 00 09 07 af 07 00 00 00 00 00 00 01
E: 13.040000 14 01 03 00 09 07 b0 07 00 00 00 00 00 00 01
E: 13.048000 14 01 03 00 09 07 b0 07 00 00 00 00 00 00 01
E: 13.056000 14 01 03 00 09 07 b0 07 00 00 00 00 00 00 01
E: 13.064000 14 01 03 00 09 07 b0 07 00 00 00 00 00 00 01
E: 13.072000 14 01 03 00 09 07 b1 07 00 00 00 00 00 00 01
E: 13.080000 14 01 03 00 09 07 b1 07 00 00 00 00 00 00 01
E: 13.088000 14 01 03 00 09 07 b1 07 00 00 00 00 00 00 01
E: 13.096000 14 01 03 00 0a 07 b1 07 00 00 00 00 00 00 01
E: 13.104000 14 01 03 00 0a 07 b2 07 00 00 00 00 00 00 01
E: 13.112000 14 01 03 00 0a 07 b2 07 00 00 00 00 00 00 01
E: 13.120000 14 01 03 00 0a 07 b2 07 00 00 00 00 00 00 01
E: 13.128000 14 01 03 00 0a 07 b2 07 00 00 00 00 00 00 01
E: 13.136000 14 01 03 00 0a 07 b2 07 00 00 00 00 00 00 01
E: 13.144000 14 01 03 00 0a 07 b2 07 00 00 00 00 00 00 01
E: 13.152000 14 01 03 00 0a 07 b3 07 00 00 00 00 00 00 01
E: 13.160000 14 01 03 00 0a 07 b3 07 00 00 00 00 00 00 01
E: 13.168000 14 01 03 00 0a 07 b3 07 00 00 00 00 00 00 01
E: 13.176000 14 01 03 00 0a 07 b3 07 00 00 00 00 00 00 01
E: 13.184000 14 01 03 00 0a 07 b3 07 00 00 00 00 00 00 01
E: 13.192000 14 01 03 00 0a 07 b3 07 00 00 00 00 00 00 01
E: 13.200000 14 01 03 00 0a 07 b3 07 00 00 00 00 00 00 01
E: 13.208000 14 01 03 00 0a 07 b3 07 00 00 00 00 00 00 01
E: 13.216000 14 01 03 00 0a 07 b3 07 00 00 00 00 00 00 01
E: 13.224000 14 01 03 00 0a 07 b3 07 00 00 00 00 00 00 01
E: 13.232000 14 01 03 00 0a 07 b3 07 00 00 00 00 00 00 01
E: 13.240000 14 01 03 00 0a 07 b2 07 00 00 00 00 00 00 01
E: 13.248000 14 01 03 00 0a 07 b3 07 00 00 00 00 00 00 01
E: 13.256000 14 01 03 00 0a 07 b3 07 00 00 00 00 00 00 01
E: 13.264000 14 01 03 00 0a 07 b3 07 00 00 00 00 00 00 01
E: 13.272000 14 01 03 00 0a 07 b2 07 00 00 00 00 00 00 01
E: 13.280000 14 01 03 00 0a 07 b2 07 00 00 00 00 00 00 01
E: 13.288000 14 01 03 00 0a 07 b2 07 00 00 00 00 00 00 01
E: 13.296000 14 01 03 00 0a 07 b2 07 00 00 00 00 00 00 01
E: 13.304000 14 01 03 00 0a 07 b2 07 00 00 00 00 00 00 01
E: 13.312000 14 01 03 00 0a 07 b2 07 00 00 00 00 00 00 01
E: 13.320000 14 01 03 00 0a 07 b2 07 00 00 00 00 00 00 01
E: 13.328000 14 01 03 00 0a 07 b2 07 00 00 00 00 00 00 01
E: 13.336000 14 01 03 00 0a 07 b2 07 00 00 00 00 00 00 01
E: 13.344000 14 01 03 00 0a 07 b2 07 00 00 00 00 00 00 01
E: 13.352000 14 01 03 00 0a 07 b2 07 00 00 00 00 00 00 01
E: 13.360000 14 01 03 00 0a 07 b2 07 00 00 00 00 00 00 01
E: 13.368000 14 01 03 00 09 07 b2 07 00 00 00 00 00 00 01
E: 13.376000 14 01 03 00 09 07 b1 07 00 00 00 00 00 00 01
E: 13.384000 14 01 03 00 09 07 b1 07 00 00 00 00 00 00 01
E: 13.392000 14 01 03 00 09 07 b1 07 00 00 00 00 00 00 01
E: 13.400000 14 01 03 00 09 07 b1 07 00 00 00 00 00 00 01
E: 13.408000 14 01 03 00 09 07 b1 07 00 00 00 00 00 00 01
E: 13.416000 14 01 03 00 09 07 b1 07 00 00 00 00 00 00 01
E: 13.424000 14 01 03 00 09 07 b1 07 00 00 00 00 00 00 01
E: 13.432000 14 01 03 00 09 07 b1 07 00 00 00 00 00 00 01
E: 13.440000 14 01 03 00 09 07 b1 07 00 00 00 00 00 00 01
E: 13.448000 14 01 03 00 09 07 b1 07 00 00 00 00 00 00 01
E: 13.456000 14 01 03 00 09 07 b1 07 00 00 00 00 00 00 01
E: 13.464000 14 01 03 00 09 07 b1 07 00 00 00 00 00 00 01
E: 13.472000 14 01 03 00 09 07 b1 07 00 00 00 00 00 00 01
E: 13.480000 14 01 03 00 09 07 b1 07 00 00 00 00 00 00 01
E: 13.488000 14 01 03 00 09 07 b1 07 00 00 00 00 00 00 01
E: 13.496000 14 01 03 00 09 07 b1 07 00 00 00 00 00 00 01
E: 13.504000 14 01 03 00 09 07 b1 07 00 00 00 00 00 00 01
E: 13.512000 14 01 03 00 09 07 b1 07 00 00 00 00 00 00 01
E: 13.520000 14 01 03 00 09 07 b1 07 00 00 00 00 00 00 01
E: 13.528000 14 01 03 00 09 07 b1 07 00 00 00 00 00 00 01
E: 13.536000 14 01 03 00 09 07 b1 07 00 00 00 00 00 00 01
E: 13.544000 14 01 03 00 09 07 b1 07 00 00 00 00 00 00 01
E: 13.552000 14 01 03 00 09 07 b1 07 00 00 00 00 00 00 01
E: 13.560000 14 01 03 00 09 07 b1 07 00 00 00 00 00 00 01
E: 13.568000 14 01 03 00 09 07 b1 07 00 00 00 00 00 00 01
E: 13.576000 14 01 03 00 09 07 b1 07 00 00 00 00 00 00 01
E: 13.584000 14 01 03 00 09 07 b1 07 00 00 00 00 00 00 01
E: 13.592000 14 01 03 00 09 07 b1 07 00 00 00 00 00 00 01
E: 13.600000 14 01 03 00 09 07 b1 07 00 00 00 00 00 00 01
E: 13.608000 14 01 03 00 09 07 b1 07 00 00 00 00 00 00 01
E: 13.616000 14 01 03 00 09 07 b1 07 00 00 00 00 00 00 01
E: 13.624000 14 01 03 00 09 07 b1 07 00 00 00 00 00 00 01
E: 13.632000 14 01 03 00 09 07 b1 07 00 00 00 00 00 00 01
E: 13.640000 14 01 03 00 09 07 b1 07 00 00 00 00 00 00 01
E: 13.648000 14 01 03 00 09 07 b1 07 00 00 00 00 00 00 01
E: 13.656000 14 01 03 00 09 07 b1 07 00 00 00 00 00 00 01
E: 13.664000 14 01 03 00 09 07 b1 07 00 00 00 00 00 00 01
E: 13.672000 14 01 03 00 09 07 b1 07 00 00 00 00 00 00 01
E: 13.680000 14 01 03 00 09 07 b1 07 00 00 00 00 00 00 01
E: 13.688000 14 01 03 00 09 07 b1 07 00 00 00 00 00 00 01
E: 13.696000 14 01 03 00 09 07 b1 07 00 00 00 00 00 00 01
E: 13.704000 14 01 03 00 09 07 b1 07 00 00 00 00 00 00 01
E: 13.712000 14 01 03 00 09 07 b1 07 00 00 00 00 00 00 01
E: 13.720000 14 01 03 00 09 07 b1 07 00 00 00 00 00 00 01
E: 13.728000 14 01 03 00 09 07 b1 07 00 00 00 00 00 00 01
E: 13.736000 14 01 03 00 09 07 b1 07 00 00 00 00 00 00 01
E: 13.744000 14 01 03 00 09 07 b1 07 00 00 00 00 00 00 01
E: 13.752000 14 01 03 00 09 07 b1 07 00 00 00 00 00 00 01
E: 13.760000 14 01 03 00 09 07 b1 07 00 00 00 00 00 00 01
E: 13.768000 14 01 03 00 09 07 b1 07 00 00 00 00 00 00 01
E: 13.776000 14 01 03 00 09 07 b1 07 00 00 00 00 00 00 01
E: 13.784000 14 01 03 00 09 07 b1 07 00 00 00 00 00 00 01
E: 13.792000 14 01 03 00 09 07 b1 07 00 00 00 00 00 00 01
E: 13.800000 14 01 03 00 09 07 b2 07 00 00 00 00 00 00 01
E: 13.808000 14 01 03 00 09 07 b2 07 00 00 00 00 00 00 01
E: 13.816000 14 01 03 00 09 07 b2 07 00 00 00 00 00 00 01
E: 13.824000 14 01 03 00 09 07 b2 07 00 00 00 00 00 00 01
E: 13.832000 14 01 03 00 09 07 b2 07 00 00 00 00 00 00 01
E: 13.840000 14 01 00 00 09 07 b2 07 00 00 00 00 00 00 01
