R: 348 05 0d 09 04 a1 01 85 01 09 22 a1 02 09 42 15 00 25 01 75 01 95 01 81 02 09 32 81 02 95 06 81 03 75 08 09 51 95 01 81 02 05 01 26 00 04 75 10 55 00 65 00 09 30 35 00 46 00 00 81 02 26 58 02 09 31 46 00 00 81 02 c0 a1 02 05 0d 09 42 15 00 25 01 75 01 95 01 81 02 09 32 81 02 95 06 81 03 75 08 09 51 95 01 81 02 05 01 26 00 04 75 10 55 00 65 00 09 30 35 00 46 00 00 81 02 26 58 02 09 31 46 00 00 81 02 c0 a1 02 05 0d 09 42 15 00 25 01 75 01 95 01 81 02 09 32 81 02 95 06 81 03 75 08 09 51 95 01 81 02 05 01 26 00 04 75 10 55 00 65 00 09 30 35 00 46 00 00 81 02 26 58 02 09 31 46 00 00 81 02 c0 a1 02 05 0d 09 42 15 00 25 01 75 01 95 01 81 02 09 32 81 02 95 06 81 03 75 08 09 51 95 01 81 02 05 01 26 00 04 75 10 55 00 65 00 09 30 35 00 46 00 00 81 02 26 58 02 09 31 46 00 00 81 02 c0 a1 02 05 0d 09 42 15 00 25 01 75 01 95 01 81 02 09 32 81 02 95 06 81 03 75 08 09 51 95 01 81 02 05 01 26 00 04 75 10 55 00 65 00 09 30 35 00 46 00 00 81 02 26 58 02 09 31 46 00 00 81 02 c0 05 0d 09 54 95 01 75 08 15 00 25 08 81 02 85 02 09 55 75 08 95 01 b1 02 c0
N: FocalTech Lab FTxxxx MultiTouch
I: 3 10c4 81b9
# 1. Drag _one_ finger on the screen from one corner to the opposite, and release it.
E: 0.000000 32 01 03 00 3e 00 2d 00 00 0f ff 0f ff 0f 00 0f ff 0f ff 0f 00 0f ff 0f ff 0f 00 0f ff 0f ff 0f 01
E: 0.018986 32 01 03 00 3e 00 2c 00 00 0f ff 0f ff 0f 00 0f ff 0f ff 0f 00 0f ff 0f ff 0f 00 0f ff 0f ff 0f 01
E: 0.036979 32 01 03 00 3d 00 2c 00 00 0f ff 0f ff 0f 00 0f ff 0f ff 0f 00 0f ff 0f ff 0f 00 0f ff 0f ff 0f 01
E: 0.053940 32 01 03 00 3d 00 2b 00 00 0f ff 0f ff 0f 00 0f ff 0f ff 0f 00 0f ff 0f ff 0f 00 0f ff 0f ff 0f 01
E: 0.071882 32 01 03 00 3c 00 2b 00 00 0f ff 0f ff 0f 00 0f ff 0f ff 0f 00 0f ff 0f ff 0f 00 0f ff 0f ff 0f 01
E: 0.089908 32 01 03 00 3c 00 2b 00 00 0f ff 0f ff 0f 00 0f ff 0f ff 0f 00 0f ff 0f ff 0f 00 0f ff 0f ff 0f 01
E: 0.106912 32 01 03 00 3c 00 2b 00 00 0f ff 0f ff 0f 00 0f ff 0f ff 0f 00 0f ff 0f ff 0f 00 0f ff 0f ff 0f 01
E: 0.124933 32 01 03 00 3b 00 2b 00 00 0f ff 0f ff 0f 00 0f ff 0f ff 0f 00 0f ff 0f ff 0f 00 0f ff 0f ff 0f 01
E: 0.142915 32 01 03 00 3b 00 2b 00 00 0f ff 0f ff 0f 00 0f ff 0f ff 0f 00 0f ff 0f ff 0f 00 0f ff 0f ff 0f 01
E: 0.160854 32 01 03 00 3b 00 2b 00 00 0f ff 0f ff 0f 00 0f ff 0f ff 0f 00 0f ff 0f ff 0f 00 0f ff 0f ff 0f 01
E: 0.177897 32 01 03 00 3b 00 2b 00 00 0f ff 0f ff 0f 00 0f ff 0f ff 0f 00 0f ff 0f ff 0f 00 0f ff 0f ff 0f 01
E: 0.195889 32 01 03 00 3b 00 2b 00 00 0f ff 0f ff 0f 00 0f ff 0f ff 0f 00 0f ff 0f ff 0f 00 0f ff 0f ff 0f 01
E: 0.213880 32 01 03 00 3b 00 2b 00 00 0f ff 0f ff 0f 00 0f ff 0f ff 0f 00 0f ff 0f ff 0f 00 0f ff 0f ff 0f 01
E: 0.231869 32 01 03 00 3b 00 2b 00 00 0f ff 0f ff 0f 00 0f ff 0f ff 0f 00 0f ff 0f ff 0f 00 0f ff 0f ff 0f 01
E: 0.248862 32 01 03 00 3b 00 2b 00 00 0f ff 0f ff 0f 00 0f ff 0f ff 0f 00 0f ff 0f ff 0f 00 0f ff 0f ff 0f 01
E: 0.266823 32 01 03 00 3b 00 2b 00 00 0f ff 0f ff 0f 00 0f ff 0f ff 0f 00 0f ff 0f ff 0f 00 0f ff 0f ff 0f 01
E: 0.284852 32 01 03 00 3a 00 2b 00 00 0f ff 0f ff 0f 00 0f ff 0f ff 0f 00 0f ff 0f ff 0f 00 0f ff 0f ff 0f 01
E: 0.302834 32 01 03 00 3a 00 2b 00 00 0f ff 0f ff 0f 00 0f ff 0f ff 0f 00 0f ff 0f ff 0f 00 0f ff 0f ff 0f 01
E: 0.319826 32 01 03 00 3a 00 2b 00 00 0f ff 0f ff 0f 00 0f ff 0f ff 0f 00 0f ff 0f ff 0f 00 0f ff 0f ff 0f 01
E: 0.337828 32 01 03 00 3a 00 2c 00 00 0f ff 0f ff 0f 00 0f ff 0f ff 0f 00 0f ff 0f ff 0f 00 0f ff 0f ff 0f 01
E: 0.355817 32 01 03 00 3b 00 2c 00 00 0f ff 0f ff 0f 00 0f ff 0f ff 0f 00 0f ff 0f ff 0f 00 0f ff 0f ff 0f 01
E: 0.372720 32 01 03 00 3b 00 2c 00 00 0f ff 0f ff 0f 00 0f ff 0f ff 0f 00 0f ff 0f ff 0f 00 0f ff 0f ff 0f 01
E: 0.390800 32 01 03 00 3b 00 2d 00 00 0f ff 0f ff 0f 00 0f ff 0f ff 0f 00 0f ff 0f ff 0f 00 0f ff 0f ff 0f 01
E: 0.408800 32 01 03 00 3c 00 2d 00 00 0f ff 0f ff 0f 00 0f ff 0f ff 0f 00 0f ff 0f ff 0f 00 0f ff 0f ff 0f 01
E: 0.426733 32 01 03 00 3e 00 2e 00 00 0f ff 0f ff 0f 00 0f ff 0f ff 0f 00 0f ff 0f ff 0f 00 0f ff 0f ff 0f 01
E: 0.444780 32 01 03 00 3f 00 2f 00 00 0f ff 0f ff 0f 00 0f ff 0f ff 0f 00 0f ff 0f ff 0f 00 0f ff 0f ff 0f 01
E: 0.461729 32 01 03 00 43 00 31 00 00 0f ff 0f ff 0f 00 0f ff 0f ff 0f 00 0f ff 0f ff 0f 00 0f ff 0f ff 0f 01
E: 0.479724 32 01 03 00 47 00 33 00 00 0f ff 0f ff 0f 00 0f ff 0f ff 0f 00 0f ff 0f ff 0f 00 0f ff 0f ff 0f 01
E: 0.496655 32 01 03 00 4b 00 36 00 00 0f ff 0f ff 0f 00 0f ff 0f ff 0f 00 0f ff 0f ff 0f 00 0f ff 0f ff 0f 01
E: 0.514742 32 01 03 00 50 00 39 00 00 0f ff 0f ff 0f 00 0f ff 0f ff 0f 00 0f ff 0f ff 0f 00 0f ff 0f ff 0f 01
E: 0.532733 32 01 03 00 55 00 3c 00 00 0f ff 0f ff 0f 00 0f ff 0f ff 0f 00 0f ff 0f ff 0f 00 0f ff 0f ff 0f 01
E: 0.550725 32 01 03 00 5b 00 40 00 00 0f ff 0f ff 0f 00 0f ff 0f ff 0f 00 0f ff 0f ff 0f 00 0f ff 0f ff 0f 01
E: 0.567693 32 01 03 00 61 00 43 00 00 0f ff 0f ff 0f 00 0f ff 0f ff 0f 00 0f ff 0f ff 0f 00 0f ff 0f ff 0f 01
E: 0.585677 32 01 03 00 67 00 47 00 00 0f ff 0f ff 0f 00 0f ff 0f ff 0f 00 0f ff 0f ff 0f 00 0f ff 0f ff 0f 01
E: 0.603697 32 01 03 00 6e 00 4b 00 00 0f ff 0f ff 0f 00 0f ff 0f ff 0f 00 0f ff 0f ff 0f 00 0f ff 0f ff 0f 01
E: 0.621694 32 01 03 00 75 00 4f 00 00 0f ff 0f ff 0f 00 0f ff 0f ff 0f 00 0f ff 0f ff 0f 00 0f ff 0f ff 0f 01
E: 0.638679 32 01 03 00 83 00 58 00 00 0f ff 0f ff 0f 00 0f ff 0f ff 0f 00 0f ff 0f ff 0f 00 0f ff 0f ff 0f 01
E: 0.656622 32 01 03 00 88 00 5b 00 00 0f ff 0f ff 0f 00 0f ff 0f ff 0f 00 0f ff 0f ff 0f 00 0f ff 0f ff 0f 01
E: 0.674664 32 01 03 00 8e 00 60 00 00 0f ff 0f ff 0f 00 0f ff 0f ff 0f 00 0f ff 0f ff 0f 00 0f ff 0f ff 0f 01
E: 0.692652 32 01 03 00 95 00 64 00 00 0f ff 0f ff 0f 00 0f ff 0f ff 0f 00 0f ff 0f ff 0f 00 0f ff 0f ff 0f 01
E: 0.709645 32 01 03 00 9d 00 68 00 00 0f ff 0f ff 0f 00 0f ff 0f ff 0f 00 0f ff 0f ff 0f 00 0f ff 0f ff 0f 01
E: 0.727636 32 01 03 00 ac 00 71 00 00 0f ff 0f ff 0f 00 0f ff 0f ff 0f 00 0f ff 0f ff 0f 00 0f ff 0f ff 0f 01
E: 0.745626 32 01 03 00 b2 00 75 00 00 0f ff 0f ff 0f 00 0f ff 0f ff 0f 00 0f ff 0f ff 0f 00 0f ff 0f ff 0f 01
E: 0.763618 32 01 03 00 b8 00 79 00 00 0f ff 0f ff 0f 00 0f ff 0f ff 0f 00 0f ff 0f ff 0f 00 0f ff 0f ff 0f 01
E: 0.780585 32 01 03 00 bf 00 7e 00 00 0f ff 0f ff 0f 00 0f ff 0f ff 0f 00 0f ff 0f ff 0f 00 0f ff 0f ff 0f 01
E: 0.798587 32 01 03 00 c6 00 83 00 00 0f ff 0f ff 0f 00 0f ff 0f ff 0f 00 0f ff 0f ff 0f 00 0f ff 0f ff 0f 01
E: 0.816528 32 01 03 00 d5 00 8c 00 00 0f ff 0f ff 0f 00 0f ff 0f ff 0f 00 0f ff 0f ff 0f 00 0f ff 0f ff 0f 01
E: 0.834515 32 01 03 00 da 00 8f 00 00 0f ff 0f ff 0f 00 0f ff 0f ff 0f 00 0f ff 0f ff 0f 00 0f ff 0f ff 0f 01
E: 0.851575 32 01 03 00 e0 00 93 00 00 0f ff 0f ff 0f 00 0f ff 0f ff 0f 00 0f ff 0f ff 0f 00 0f ff 0f ff 0f 01
E: 0.869565 32 01 03 00 e6 00 96 00 00 0f ff 0f ff 0f 00 0f ff 0f ff 0f 00 0f ff 0f ff 0f 00 0f ff 0f ff 0f 01
E: 0.886511 32 01 03 00 ec 00 9a 00 00 0f ff 0f ff 0f 00 0f ff 0f ff 0f 00 0f ff 0f ff 0f 00 0f ff 0f ff 0f 01
E: 0.905543 32 01 03 00 f2 00 9e 00 00 0f ff 0f ff 0f 00 0f ff 0f ff 0f 00 0f ff 0f ff 0f 00 0f ff 0f ff 0f 01
E: 0.922533 32 01 03 00 f9 00 a3 00 00 0f ff 0f ff 0f 00 0f ff 0f ff 0f 00 0f ff 0f ff 0f 00 0f ff 0f ff 0f 01
E: 0.940525 32 01 03 00 07 01 ad 00 00 0f ff 0f ff 0f 00 0f ff 0f ff 0f 00 0f ff 0f ff 0f 00 0f ff 0f ff 0f 01
E: 0.957517 32 01 03 00 0d 01 b0 00 00 0f ff 0f ff 0f 00 0f ff 0f ff 0f 00 0f ff 0f ff 0f 00 0f ff 0f ff 0f 01
E: 0.976460 32 01 03 00 14 01 b5 00 00 0f ff 0f ff 0f 00 0f ff 0f ff 0f 00 0f ff 0f ff 0f 00 0f ff 0f ff 0f 01
E: 0.993496 32 01 03 00 24 01 bf 00 00 0f ff 0f ff 0f 00 0f ff 0f ff 0f 00 0f ff 0f ff 0f 00 0f ff 0f ff 0f 01
E: 1.011406 32 01 03 00 2b 01 c3 00 00 0f ff 0f ff 0f 00 0f ff 0f ff 0f 00 0f ff 0f ff 0f 00 0f ff 0f ff 0f 01
E: 1.028492 32 01 03 00 3a 01 cd 00 00 0f ff 0f ff 0f 00 0f ff 0f ff 0f 00 0f ff 0f ff 0f 00 0f ff 0f ff 0f 01
E: 1.047481 32 01 03 00 49 01 d6 00 00 0f ff 0f ff 0f 00 0f ff 0f ff 0f 00 0f ff 0f ff 0f 00 0f ff 0f ff 0f 01
E: 1.064398 32 01 03 00 4f 01 da 00 00 0f ff 0f ff 0f 00 0f ff 0f ff 0f 00 0f ff 0f ff 0f 00 0f ff 0f ff 0f 01
E: 1.082434 32 01 03 00 5e 01 e3 00 00 0f ff 0f ff 0f 00 0f ff 0f ff 0f 00 0f ff 0f ff 0f 00 0f ff 0f ff 0f 01
E: 1.099450 32 01 03 00 6d 01 ec 00 00 0f ff 0f ff 0f 00 0f ff 0f ff 0f 00 0f ff 0f ff 0f 00 0f ff 0f ff 0f 01
E: 1.118450 32 01 03 00 74 01 f0 00 00 0f ff 0f ff 0f 00 0f ff 0f ff 0f 00 0f ff 0f ff 0f 00 0f ff 0f ff 0f 01
E: 1.135433 32 01 03 00 84 01 fa 00 00 0f ff 0f ff 0f 00 0f ff 0f ff 0f 00 0f ff 0f ff 0f 00 0f ff 0f ff 0f 01
E: 1.153396 32 01 03 00 8b 01 fe 00 00 0f ff 0f ff 0f 00 0f ff 0f ff 0f 00 0f ff 0f ff 0f 00 0f ff 0f ff 0f 01
E: 1.170414 32 01 03 00 9c 01 08 01 00 0f ff 0f ff 0f 00 0f ff 0f ff 0f 00 0f ff 0f ff 0f 00 0f ff 0f ff 0f 01
E: 1.189402 32 01 03 00 ab 01 12 01 00 0f ff 0f ff 0f 00 0f ff 0f ff 0f 00 0f ff 0f ff 0f 00 0f ff 0f ff 0f 01
E: 1.206362 32 01 03 00 b2 01 16 01 00 0f ff 0f ff 0f 00 0f ff 0f ff 0f 00 0f ff 0f ff 0f 00 0f ff 0f ff 0f 01
E: 1.224389 32 01 03 00 c3 01 21 01 00 0f ff 0f ff 0f 00 0f ff 0f ff 0f 00 0f ff 0f ff 0f 00 0f ff 0f ff 0f 01
E: 1.241317 32 01 03 00 d3 01 2a 01 00 0f ff 0f ff 0f 00 0f ff 0f ff 0f 00 0f ff 0f ff 0f 00 0f ff 0f ff 0f 01
E: 1.260377 32 01 03 00 da 01 2e 01 00 0f ff 0f ff 0f 00 0f ff 0f ff 0f 00 0f ff 0f ff 0f 00 0f ff 0f ff 0f 01
E: 1.276311 32 01 03 00 eb 01 38 01 00 0f ff 0f ff 0f 00 0f ff 0f ff 0f 00 0f ff 0f ff 0f 00 0f ff 0f ff 0f 01
E: 1.295319 32 01 03 00 fa 01 41 01 00 0f ff 0f ff 0f 00 0f ff 0f ff 0f 00 0f ff 0f ff 0f 00 0f ff 0f ff 0f 01
E: 1.312343 32 01 03 00 01 02 45 01 00 0f ff 0f ff 0f 00 0f ff 0f ff 0f 00 0f ff 0f ff 0f 00 0f ff 0f ff 0f 01
E: 1.331334 32 01 03 00 13 02 4f 01 00 0f ff 0f ff 0f 00 0f ff 0f ff 0f 00 0f ff 0f ff 0f 00 0f ff 0f ff 0f 01
E: 1.347327 32 01 03 00 23 02 57 01 00 0f ff 0f ff 0f 00 0f ff 0f ff 0f 00 0f ff 0f ff 0f 00 0f ff 0f ff 0f 01
E: 1.366325 32 01 03 00 2a 02 5b 01 00 0f ff 0f ff 0f 00 0f ff 0f ff 0f 00 0f ff 0f ff 0f 00 0f ff 0f ff 0f 01
E: 1.383307 32 01 03 00 3b 02 64 01 00 0f ff 0f ff 0f 00 0f ff 0f ff 0f 00 0f ff 0f ff 0f 00 0f ff 0f ff 0f 01
E: 1.402303 32 01 03 00 4a 02 6d 01 00 0f ff 0f ff 0f 00 0f ff 0f ff 0f 00 0f ff 0f ff 0f 00 0f ff 0f ff 0f 01
E: 1.418292 32 01 03 00 51 02 70 01 00 0f ff 0f ff 0f 00 0f ff 0f ff 0f 00 0f ff 0f ff 0f 00 0f ff 0f ff 0f 01
E: 1.437283 32 01 03 00 61 02 79 01 00 0f ff 0f ff 0f 00 0f ff 0f ff 0f 00 0f ff 0f ff 0f 00 0f ff 0f ff 0f 01
E: 1.454279 32 01 03 00 68 02 7d 01 00 0f ff 0f ff 0f 00 0f ff 0f ff 0f 00 0f ff 0f ff 0f 00 0f ff 0f ff 0f 01
E: 1.473215 32 01 03 00 79 02 86 01 00 0f ff 0f ff 0f 00 0f ff 0f ff 0f 00 0f ff 0f ff 0f 00 0f ff 0f ff 0f 01
E: 1.489204 32 01 03 00 80 02 89 01 00 0f ff 0f ff 0f 00 0f ff 0f ff 0f 00 0f ff 0f ff 0f 00 0f ff 0f ff 0f 01
E: 1.508208 32 01 03 00 87 02 8d 01 00 0f ff 0f ff 0f 00 0f ff 0f ff 0f 00 0f ff 0f ff 0f 00 0f ff 0f ff 0f 01
E: 1.525233 32 01 03 00 97 02 96 01 00 0f ff 0f ff 0f 00 0f ff 0f ff 0f 00 0f ff 0f ff 0f 00 0f ff 0f ff 0f 01
E: 1.543223 32 01 03 00 9e 02 98 01 00 0f ff 0f ff 0f 00 0f ff 0f ff 0f 00 0f ff 0f ff 0f 00 0f ff 0f ff 0f 01
E: 1.560216 32 01 03 00 a5 02 9d 01 00 0f ff 0f ff 0f 00 0f ff 0f ff 0f 00 0f ff 0f ff 0f 00 0f ff 0f ff 0f 01
E: 1.579206 32 01 03 00 ab 02 a0 01 00 0f ff 0f ff 0f 00 0f ff 0f ff 0f 00 0f ff 0f ff 0f 00 0f ff 0f ff 0f 01
E: 1.595197 32 01 03 00 bb 02 a9 01 00 0f ff 0f ff 0f 00 0f ff 0f ff 0f 00 0f ff 0f ff 0f 00 0f ff 0f ff 0f 01
E: 1.615188 32 01 03 00 c1 02 ac 01 00 0f ff 0f ff 0f 00 0f ff 0f ff 0f 00 0f ff 0f ff 0f 00 0f ff 0f ff 0f 01
E: 1.631180 32 01 03 00 c7 02 b0 01 00 0f ff 0f ff 0f 00 0f ff 0f ff 0f 00 0f ff 0f ff 0f 00 0f ff 0f ff 0f 01
E: 1.650104 32 01 03 00 ce 02 b4 01 00 0f ff 0f ff 0f 00 0f ff 0f ff 0f 00 0f ff 0f ff 0f 00 0f ff 0f ff 0f 01
E: 1.666169 32 01 03 00 d5 02 b8 01 00 0f ff 0f ff 0f 00 0f ff 0f ff 0f 00 0f ff 0f ff 0f 00 0f ff 0f ff 0f 01
E: 1.685157 32 01 03 00 e4 02 c0 01 00 0f ff 0f ff 0f 00 0f ff 0f ff 0f 00 0f ff 0f ff 0f 00 0f ff 0f ff 0f 01
E: 1.702152 32 01 03 00 ea 02 c3 01 00 0f ff 0f ff 0f 00 0f ff 0f ff 0f 00 0f ff 0f ff 0f 00 0f ff 0f ff 0f 01
E: 1.721143 32 01 03 00 f0 02 c6 01 00 0f ff 0f ff 0f 00 0f ff 0f ff 0f 00 0f ff 0f ff 0f 00 0f ff 0f ff 0f 01
E: 1.737138 32 01 03 00 f8 02 c9 01 00 0f ff 0f ff 0f 00 0f ff 0f ff 0f 00 0f ff 0f ff 0f 00 0f ff 0f ff 0f 01
E: 1.756074 32 01 03 00 ff 02 cd 01 00 0f ff 0f ff 0f 00 0f ff 0f ff 0f 00 0f ff 0f ff 0f 00 0f ff 0f ff 0f 01
E: 1.773067 32 01 03 00 0f 03 d5 01 00 0f ff 0f ff 0f 00 0f ff 0f ff 0f 00 0f ff 0f ff 0f 00 0f ff 0f ff 0f 01
E: 1.792108 32 01 03 00 16 03 d8 01 00 0f ff 0f ff 0f 00 0f ff 0f ff 0f 00 0f ff 0f ff 0f 00 0f ff 0f ff 0f 01
E: 1.808091 32 01 03 00 1d 03 db 01 00 0f ff 0f ff 0f 00 0f ff 0f ff 0f 00 0f ff 0f ff 0f 00 0f ff 0f ff 0f 01
E: 1.827000 32 01 03 00 24 03 de 01 00 0f ff 0f ff 0f 00 0f ff 0f ff 0f 00 0f ff 0f ff 0f 00 0f ff 0f ff 0f 01
E: 1.844079 32 01 03 00 2b 03 e1 01 00 0f ff 0f ff 0f 00 0f ff 0f ff 0f 00 0f ff 0f ff 0f 00 0f ff 0f ff 0f 01
E: 1.863068 32 01 03 00 33 03 e5 01 00 0f ff 0f ff 0f 00 0f ff 0f ff 0f 00 0f ff 0f ff 0f 00 0f ff 0f ff 0f 01
E: 1.879003 32 01 03 00 3b 03 e8 01 00 0f ff 0f ff 0f 00 0f ff 0f ff 0f 00 0f ff 0f ff 0f 00 0f ff 0f ff 0f 01
E: 1.898058 32 01 03 00 42 03 eb 01 00 0f ff 0f ff 0f 00 0f ff 0f ff 0f 00 0f ff 0f ff 0f 00 0f ff 0f ff 0f 01
E: 1.914049 32 01 03 00 49 03 ee 01 00 0f ff 0f ff 0f 00 0f ff 0f ff 0f 00 0f ff 0f ff 0f 00 0f ff 0f ff 0f 01
E: 1.934022 32 01 03 00 50 03 f1 01 00 0f ff 0f ff 0f 00 0f ff 0f ff 0f 00 0f ff 0f ff 0f 00 0f ff 0f ff 0f 01
E: 1.950026 32 01 03 00 57 03 f4 01 00 0f ff 0f ff 0f 00 0f ff 0f ff 0f 00 0f ff 0f ff 0f 00 0f ff 0f ff 0f 01
E: 1.968966 32 01 03 00 5e 03 f7 01 00 0f ff 0f ff 0f 00 0f ff 0f ff 0f 00 0f ff 0f ff 0f 00 0f ff 0f ff 0f 01
E: 1.984960 32 01 03 00 65 03 fa 01 00 0f ff 0f ff 0f 00 0f ff 0f ff 0f 00 0f ff 0f ff 0f 00 0f ff 0f ff 0f 01
E: 2.004999 32 01 03 00 6c 03 fd 01 00 0f ff 0f ff 0f 00 0f ff 0f ff 0f 00 0f ff 0f ff 0f 00 0f ff 0f ff 0f 01
E: 2.020991 32 01 03 00 73 03 00 02 00 0f ff 0f ff 0f 00 0f ff 0f ff 0f 00 0f ff 0f ff 0f 00 0f ff 0f ff 0f 01
E: 2.039980 32 01 03 00 7b 03 04 02 00 0f ff 0f ff 0f 00 0f ff 0f ff 0f 00 0f ff 0f ff 0f 00 0f ff 0f ff 0f 01
E: 2.055983 32 01 03 00 82 03 07 02 00 0f ff 0f ff 0f 00 0f ff 0f ff 0f 00 0f ff 0f ff 0f 00 0f ff 0f ff 0f 01
E: 2.074933 32 01 03 00 8a 03 0a 02 00 0f ff 0f ff 0f 00 0f ff 0f ff 0f 00 0f ff 0f ff 0f 00 0f ff 0f ff 0f 01
E: 2.091950 32 01 03 00 92 03 0d 02 00 0f ff 0f ff 0f 00 0f ff 0f ff 0f 00 0f ff 0f ff 0f 00 0f ff 0f ff 0f 01
E: 2.110910 32 01 03 00 9a 03 11 02 00 0f ff 0f ff 0f 00 0f ff 0f ff 0f 00 0f ff 0f ff 0f 00 0f ff 0f ff 0f 01
E: 2.126911 32 01 03 00 a2 03 14 02 00 0f ff 0f ff 0f 00 0f ff 0f ff 0f 00 0f ff 0f ff 0f 00 0f ff 0f ff 0f 01
E: 2.145841 32 01 03 00 a9 03 17 02 00 0f ff 0f ff 0f 00 0f ff 0f ff 0f 00 0f ff 0f ff 0f 00 0f ff 0f ff 0f 01
E: 2.161928 32 01 03 00 af 03 1a 02 00 0f ff 0f ff 0f 00 0f ff 0f ff 0f 00 0f ff 0f ff 0f 00 0f ff 0f ff 0f 01
E: 2.181911 32 01 03 00 b5 03 1c 02 00 0f ff 0f ff 0f 00 0f ff 0f ff 0f 00 0f ff 0f ff 0f 00 0f ff 0f ff 0f 01
E: 2.197902 32 01 03 00 b9 03 1f 02 00 0f ff 0f ff 0f 00 0f ff 0f ff 0f 00 0f ff 0f ff 0f 00 0f ff 0f ff 0f 01
E: 2.216908 32 01 03 00 bb 03 20 02 00 0f ff 0f ff 0f 00 0f ff 0f ff 0f 00 0f ff 0f ff 0f 00 0f ff 0f ff 0f 01
E: 2.232888 32 01 03 00 bc 03 20 02 00 0f ff 0f ff 0f 00 0f ff 0f ff 0f 00 0f ff 0f ff 0f 00 0f ff 0f ff 0f 01
E: 2.252875 32 01 03 00 be 03 21 02 00 0f ff 0f ff 0f 00 0f ff 0f ff 0f 00 0f ff 0f ff 0f 00 0f ff 0f ff 0f 01
E: 2.268868 32 01 03 00 bf 03 22 02 00 0f ff 0f ff 0f 00 0f ff 0f ff 0f 00 0f ff 0f ff 0f 00 0f ff 0f ff 0f 01
E: 2.287859 32 01 03 00 c0 03 23 02 00 0f ff 0f ff 0f 00 0f ff 0f ff 0f 00 0f ff 0f ff 0f 00 0f ff 0f ff 0f 01
E: 2.303856 32 01 03 00 c1 03 23 02 00 0f ff 0f ff 0f 00 0f ff 0f ff 0f 00 0f ff 0f ff 0f 00 0f ff 0f ff 0f 01
E: 2.323839 32 01 03 00 c2 03 24 02 00 0f ff 0f ff 0f 00 0f ff 0f ff 0f 00 0f ff 0f ff 0f 00 0f ff 0f ff 0f 01
E: 2.339759 32 01 03 00 c4 03 25 02 00 0f ff 0f ff 0f 00 0f ff 0f ff 0f 00 0f ff 0f ff 0f 00 0f ff 0f ff 0f 01
E: 2.358773 32 01 03 00 c4 03 25 02 00 0f ff 0f ff 0f 00 0f ff 0f ff 0f 00 0f ff 0f ff 0f 00 0f ff 0f ff 0f 01
E: 2.374813 32 01 03 00 c5 03 26 02 00 0f ff 0f ff 0f 00 0f ff 0f ff 0f 00 0f ff 0f ff 0f 00 0f ff 0f ff 0f 01
E: 2.394765 32 01 03 00 c6 03 27 02 00 0f ff 0f ff 0f 00 0f ff 0f ff 0f 00 0f ff 0f ff 0f 00 0f ff 0f ff 0f 01
E: 2.409797 32 01 03 00 c8 03 27 02 00 0f ff 0f ff 0f 00 0f ff 0f ff 0f 00 0f ff 0f ff 0f 00 0f ff 0f ff 0f 01
E: 2.429792 32 01 03 00 cc 03 2a 02 00 0f ff 0f ff 0f 00 0f ff 0f ff 0f 00 0f ff 0f ff 0f 00 0f ff 0f ff 0f 01
E: 2.445784 32 01 03 00 d0 03 2d 02 00 0f ff 0f ff 0f 00 0f ff 0f ff 0f 00 0f ff 0f ff 0f 00 0f ff 0f ff 0f 01
E: 2.464774 32 01 03 00 d4 03 2f 02 00 0f ff 0f ff 0f 00 0f ff 0f ff 0f 00 0f ff 0f ff 0f 00 0f ff 0f ff 0f 01
E: 2.480762 32 01 03 00 d5 03 30 02 00 0f ff 0f ff 0f 00 0f ff 0f ff 0f 00 0f ff 0f ff 0f 00 0f ff 0f ff 0f 01
E: 2.500747 32 01 03 00 d6 03 31 02 00 0f ff 0f ff 0f 00 0f ff 0f ff 0f 00 0f ff 0f ff 0f 00 0f ff 0f ff 0f 01
E: 2.516689 32 01 03 00 d7 03 31 02 00 0f ff 0f ff 0f 00 0f ff 0f ff 0f 00 0f ff 0f ff 0f 00 0f ff 0f ff 0f 01
E: 2.535700 32 01 03 00 d8 03 31 02 00 0f ff 0f ff 0f 00 0f ff 0f ff 0f 00 0f ff 0f ff 0f 00 0f ff 0f ff 0f 01
E: 2.551726 32 01 03 00 d8 03 32 02 00 0f ff 0f ff 0f 00 0f ff 0f ff 0f 00 0f ff 0f ff 0f 00 0f ff 0f ff 0f 01
E: 2.570716 32 01 03 00 d9 03 33 02 00 0f ff 0f ff 0f 00 0f ff 0f ff 0f 00 0f ff 0f ff 0f 00 0f ff 0f ff 0f 01
E: 2.586661 32 01 03 00 da 03 33 02 00 0f ff 0f ff 0f 00 0f ff 0f ff 0f 00 0f ff 0f ff 0f 00 0f ff 0f ff 0f 01
E: 2.606634 32 01 03 00 da 03 33 02 00 0f ff 0f ff 0f 00 0f ff 0f ff 0f 00 0f ff 0f ff 0f 00 0f ff 0f ff 0f 01
E: 2.622691 32 01 03 00 db 03 33 02 00 0f ff 0f ff 0f 00 0f ff 0f ff 0f 00 0f ff 0f ff 0f 00 0f ff 0f ff 0f 01
E: 2.641668 32 01 03 00 db 03 33 02 00 0f ff 0f ff 0f 00 0f ff 0f ff 0f 00 0f ff 0f ff 0f 00 0f ff 0f ff 0f 01
E: 2.657649 32 01 03 00 db 03 33 02 00 0f ff 0f ff 0f 00 0f ff 0f ff 0f 00 0f ff 0f ff 0f 00 0f ff 0f ff 0f 01
E: 2.677651 32 01 03 00 db 03 33 02 00 0f ff 0f ff 0f 00 0f ff 0f ff 0f 00 0f ff 0f ff 0f 00 0f ff 0f ff 0f 01
E: 2.693584 32 01 03 00 db 03 33 02 00 0f ff 0f ff 0f 00 0f ff 0f ff 0f 00 0f ff 0f ff 0f 00 0f ff 0f ff 0f 01
E: 2.712641 32 01 03 00 db 03 33 02 00 0f ff 0f ff 0f 00 0f ff 0f ff 0f 00 0f ff 0f ff 0f 00 0f ff 0f ff 0f 01
E: 2.728637 32 01 03 00 da 03 33 02 00 0f ff 0f ff 0f 00 0f ff 0f ff 0f 00 0f ff 0f ff 0f 00 0f ff 0f ff 0f 01
E: 2.748586 32 01 03 00 da 03 33 02 00 0f ff 0f ff 0f 00 0f ff 0f ff 0f 00 0f ff 0f ff 0f 00 0f ff 0f ff 0f 01
E: 2.764618 32 01 03 00 d9 03 33 02 00 0f ff 0f ff 0f 00 0f ff 0f ff 0f 00 0f ff 0f ff 0f 00 0f ff 0f ff 0f 01
E: 2.783596 32 01 03 00 d9 03 33 02 00 0f ff 0f ff 0f 00 0f ff 0f ff 0f 00 0f ff 0f ff 0f 00 0f ff 0f ff 0f 01
E: 2.799587 32 01 03 00 d9 03 33 02 00 0f ff 0f ff 0f 00 0f ff 0f ff 0f 00 0f ff 0f ff 0f 00 0f ff 0f ff 0f 01
E: 2.819593 32 01 03 00 d8 03 32 02 00 0f ff 0f ff 0f 00 0f ff 0f ff 0f 00 0f ff 0f ff 0f 00 0f ff 0f ff 0f 01
E: 2.835570 32 01 03 00 d8 03 32 02 00 0f ff 0f ff 0f 00 0f ff 0f ff 0f 00 0f ff 0f ff 0f 00 0f ff 0f ff 0f 01
E: 2.854560 32 01 03 00 d8 03 32 02 00 0f ff 0f ff 0f 00 0f ff 0f ff 0f 00 0f ff 0f ff 0f 00 0f ff 0f ff 0f 01
E: 2.870571 32 01 03 00 d8 03 31 02 00 0f ff 0f ff 0f 00 0f ff 0f ff 0f 00 0f ff 0f ff 0f 00 0f ff 0f ff 0f 01
E: 2.892541 32 01 03 00 d8 03 31 02 00 0f ff 0f ff 0f 00 0f ff 0f ff 0f 00 0f ff 0f ff 0f 00 0f ff 0f ff 0f 01
E: 2.907557 32 01 00 00 d8 03 31 02 00 0f ff 0f ff 0f 00 0f ff 0f ff 0f 00 0f ff 0f ff 0f 00 0f ff 0f ff 0f 01
# 2. Land one finger,
   - land a second finger far enough from the first
   - move your two fingers
   - release the *first* finger
   - release the second finger
E: 18.744646 32 01 03 00 cf 00 c4 01 00 0f ff 0f ff 0f 00 0f ff 0f ff 0f 00 0f ff 0f ff 0f 00 0f ff 0f ff 0f 01
E: 18.764620 32 01 03 00 cf 00 c4 01 00 0f ff 0f ff 0f 00 0f ff 0f ff 0f 00 0f ff 0f ff 0f 00 0f ff 0f ff 0f 01
E: 18.780612 32 01 03 00 cf 00 c4 01 00 0f ff 0f ff 0f 00 0f ff 0f ff 0f 00 0f ff 0f ff 0f 00 0f ff 0f ff 0f 01
E: 18.799603 32 01 03 00 cf 00 c4 01 00 0f ff 0f ff 0f 00 0f ff 0f ff 0f 00 0f ff 0f ff 0f 00 0f ff 0f ff 0f 01
E: 18.816551 32 01 03 00 cf 00 c4 01 00 0f ff 0f ff 0f 00 0f ff 0f ff 0f 00 0f ff 0f ff 0f 00 0f ff 0f ff 0f 01
E: 18.835586 32 01 03 00 cf 00 c4 01 00 0f ff 0f ff 0f 00 0f ff 0f ff 0f 00 0f ff 0f ff 0f 00 0f ff 0f ff 0f 01
E: 18.851576 32 01 03 00 cf 00 c4 01 00 0f ff 0f ff 0f 00 0f ff 0f ff 0f 00 0f ff 0f ff 0f 00 0f ff 0f ff 0f 01
E: 18.870568 32 01 03 00 cf 00 c4 01 00 0f ff 0f ff 0f 00 0f ff 0f ff 0f 00 0f ff 0f ff 0f 00 0f ff 0f ff 0f 01
E: 18.887532 32 01 03 00 cf 00 c4 01 00 0f ff 0f ff 0f 00 0f ff 0f ff 0f 00 0f ff 0f ff 0f 00 0f ff 0f ff 0f 01
E: 18.906503 32 01 03 00 cf 00 c4 01 00 0f ff 0f ff 0f 00 0f ff 0f ff 0f 00 0f ff 0f ff 0f 00 0f ff 0f ff 0f 01
E: 18.922543 32 01 03 00 cf 00 c4 01 00 0f ff 0f ff 0f 00 0f ff 0f ff 0f 00 0f ff 0f ff 0f 00 0f ff 0f ff 0f 01
E: 18.941493 32 01 03 00 cf 00 c4 01 00 0f ff 0f ff 0f 00 0f ff 0f ff 0f 00 0f ff 0f ff 0f 00 0f ff 0f ff 0f 01
E: 18.958524 32 01 03 00 cf 00 c4 01 00 0f ff 0f ff 0f 00 0f ff 0f ff 0f 00 0f ff 0f ff 0f 00 0f ff 0f ff 0f 01
E: 18.977524 32 01 03 00 cf 00 c4 01 00 0f ff 0f ff 0f 00 0f ff 0f ff 0f 00 0f ff 0f ff 0f 00 0f ff 0f ff 0f 01
E: 18.993506 32 01 03 00 cf 00 c4 01 00 0f ff 0f ff 0f 00 0f ff 0f ff 0f 00 0f ff 0f ff 0f 00 0f ff 0f ff 0f 01
E: 19.012497 32 01 03 00 cf 00 c4 01 00 0f ff 0f ff 0f 00 0f ff 0f ff 0f 00 0f ff 0f ff 0f 00 0f ff 0f ff 0f 01
E: 19.028488 32 01 03 00 cf 00 c4 01 00 0f ff 0f ff 0f 00 0f ff 0f ff 0f 00 0f ff 0f ff 0f 00 0f ff 0f ff 0f 01
E: 19.048479 32 01 03 00 cf 00 c4 01 00 0f ff 0f ff 0f 00 0f ff 0f ff 0f 00 0f ff 0f ff 0f 00 0f ff 0f ff 0f 01
E: 19.064469 32 01 03 00 cf 00 c4 01 00 0f ff 0f ff 0f 00 0f ff 0f ff 0f 00 0f ff 0f ff 0f 00 0f ff 0f ff 0f 01
E: 19.083462 32 01 03 00 cf 00 c4 01 00 0f ff 0f ff 0f 00 0f ff 0f ff 0f 00 0f ff 0f ff 0f 00 0f ff 0f ff 0f 01
E: 19.099462 32 01 03 00 ce 00 c4 01 00 0f ff 0f ff 0f 00 0f ff 0f ff 0f 00 0f ff 0f ff 0f 00 0f ff 0f ff 0f 01
E: 19.118446 32 01 03 00 ce 00 c4 01 00 0f ff 0f ff 0f 00 0f ff 0f ff 0f 00 0f ff 0f ff 0f 00 0f ff 0f ff 0f 01
E: 19.135440 32 01 03 00 ce 00 c4 01 00 0f ff 0f ff 0f 00 0f ff 0f ff 0f 00 0f ff 0f ff 0f 00 0f ff 0f ff 0f 01
E: 19.154437 32 01 03 00 ce 00 c4 01 00 0f ff 0f ff 0f 00 0f ff 0f ff 0f 00 0f ff 0f ff 0f 00 0f ff 0f ff 0f 01
E: 19.170418 32 01 03 00 ce 00 c4 01 00 0f ff 0f ff 0f 00 0f ff 0f ff 0f 00 0f ff 0f ff 0f 00 0f ff 0f ff 0f 01
E: 19.189378 32 01 03 00 ce 00 c4 01 00 0f ff 0f ff 0f 00 0f ff 0f ff 0f 00 0f ff 0f ff 0f 00 0f ff 0f ff 0f 01
E: 19.206349 32 01 03 00 ce 00 c4 01 00 0f ff 0f ff 0f 00 0f ff 0f ff 0f 00 0f ff 0f ff 0f 00 0f ff 0f ff 0f 01
E: 19.225392 32 01 03 00 ce 00 c4 01 00 0f ff 0f ff 0f 00 0f ff 0f ff 0f 00 0f ff 0f ff 0f 00 0f ff 0f ff 0f 01
E: 19.241383 32 01 03 00 ce 00 c4 01 00 0f ff 0f ff 0f 00 0f ff 0f ff 0f 00 0f ff 0f ff 0f 00 0f ff 0f ff 0f 01
E: 19.260373 32 01 03 00 ce 00 c4 01 00 0f ff 0f ff 0f 00 0f ff 0f ff 0f 00 0f ff 0f ff 0f 00 0f ff 0f ff 0f 01
E: 19.277365 32 01 03 00 ce 00 c4 01 00 0f ff 0f ff 0f 00 0f ff 0f ff 0f 00 0f ff 0f ff 0f 00 0f ff 0f ff 0f 01
E: 19.296306 32 01 03 00 ce 00 c4 01 00 0f ff 0f ff 0f 00 0f ff 0f ff 0f 00 0f ff 0f ff 0f 00 0f ff 0f ff 0f 01
E: 19.312358 32 01 03 00 cf 00 c4 01 00 0f ff 0f ff 0f 00 0f ff 0f ff 0f 00 0f ff 0f ff 0f 00 0f ff 0f ff 0f 01
E: 19.331338 32 01 03 00 cf 00 c4 01 00 0f ff 0f ff 0f 00 0f ff 0f ff 0f 00 0f ff 0f ff 0f 00 0f ff 0f ff 0f 01
E: 19.348328 32 01 03 00 cf 00 c4 01 00 0f ff 0f ff 0f 00 0f ff 0f ff 0f 00 0f ff 0f ff 0f 00 0f ff 0f ff 0f 01
E: 19.367319 32 01 03 00 cf 00 c4 01 00 0f ff 0f ff 0f 00 0f ff 0f ff 0f 00 0f ff 0f ff 0f 00 0f ff 0f ff 0f 01
E: 19.383262 32 01 03 00 cf 00 c4 01 00 0f ff 0f ff 0f 00 0f ff 0f ff 0f 00 0f ff 0f ff 0f 00 0f ff 0f ff 0f 01
E: 19.402321 32 01 03 00 cf 00 c3 01 00 0f ff 0f ff 0f 00 0f ff 0f ff 0f 00 0f ff 0f ff 0f 00 0f ff 0f ff 0f 01
E: 19.419294 32 01 03 00 cf 00 c3 01 00 0f ff 0f ff 0f 00 0f ff 0f ff 0f 00 0f ff 0f ff 0f 00 0f ff 0f ff 0f 01
E: 19.438251 32 01 03 00 cf 00 c3 01 00 0f ff 0f ff 0f 00 0f ff 0f ff 0f 00 0f ff 0f ff 0f 00 0f ff 0f ff 0f 01
E: 19.454275 32 01 03 00 cf 00 c3 01 00 0f ff 0f ff 0f 00 0f ff 0f ff 0f 00 0f ff 0f ff 0f 00 0f ff 0f ff 0f 01
E: 19.473215 32 01 03 00 cf 00 c3 01 00 0f ff 0f ff 0f 00 0f ff 0f ff 0f 00 0f ff 0f ff 0f 00 0f ff 0f ff 0f 01
E: 19.489207 32 01 03 00 cf 00 c3 01 00 0f ff 0f ff 0f 00 0f ff 0f ff 0f 00 0f ff 0f ff 0f 00 0f ff 0f ff 0f 01
E: 19.509250 32 01 03 00 cf 00 c3 01 00 0f ff 0f ff 0f 00 0f ff 0f ff 0f 00 0f ff 0f ff 0f 00 0f ff 0f ff 0f 01
E: 19.525242 32 01 03 00 cf 00 c3 01 00 0f ff 0f ff 0f 00 0f ff 0f ff 0f 00 0f ff 0f ff 0f 00 0f ff 0f ff 0f 01
E: 19.544232 32 01 03 00 cf 00 c3 01 00 0f ff 0f ff 0f 00 0f ff 0f ff 0f 00 0f ff 0f ff 0f 00 0f ff 0f ff 0f 01
E: 19.560223 32 01 03 00 cf 00 c3 01 00 0f ff 0f ff 0f 00 0f ff 0f ff 0f 00 0f ff 0f ff 0f 00 0f ff 0f ff 0f 01
E: 19.579214 32 01 03 00 cf 00 c3 01 00 0f ff 0f ff 0f 00 0f ff 0f ff 0f 00 0f ff 0f ff 0f 00 0f ff 0f ff 0f 01
E: 19.596157 32 01 03 00 cf 00 c3 01 00 0f ff 0f ff 0f 00 0f ff 0f ff 0f 00 0f ff 0f ff 0f 00 0f ff 0f ff 0f 01
E: 19.615198 32 01 03 00 cf 00 c3 01 00 0f ff 0f ff 0f 00 0f ff 0f ff 0f 00 0f ff 0f ff 0f 00 0f ff 0f ff 0f 01
E: 19.633156 32 01 03 00 cf 00 c3 01 03 01 ca 00 9a 00 00 0f ff 0f ff 0f 00 0f ff 0f ff 0f 00 0f ff 0f ff 0f 02
E: 19.651193 32 01 03 00 cf 00 c3 01 03 01 c9 00 9a 00 00 0f ff 0f ff 0f 00 0f ff 0f ff 0f 00 0f ff 0f ff 0f 02
E: 19.668175 32 01 03 00 cf 00 c3 01 03 01 c9 00 9a 00 00 0f ff 0f ff 0f 00 0f ff 0f ff 0f 00 0f ff 0f ff 0f 02
E: 19.686125 32 01 03 00 cf 00 c3 01 03 01 c9 00 9a 00 00 0f ff 0f ff 0f 00 0f ff 0f ff 0f 00 0f ff 0f ff 0f 02
E: 19.704098 32 01 03 00 cf 00 c3 01 03 01 c9 00 9a 00 00 0f ff 0f ff 0f 00 0f ff 0f ff 0f 00 0f ff 0f ff 0f 02
E: 19.722130 32 01 03 00 ce 00 c2 01 03 01 c8 00 99 00 00 0f ff 0f ff 0f 00 0f ff 0f ff 0f 00 0f ff 0f ff 0f 02
E: 19.739134 32 01 03 00 ce 00 c2 01 03 01 c8 00 99 00 00 0f ff 0f ff 0f 00 0f ff 0f ff 0f 00 0f ff 0f ff 0f 02
E: 19.757132 32 01 03 00 ce 00 c2 01 03 01 c8 00 98 00 00 0f ff 0f ff 0f 00 0f ff 0f ff 0f 00 0f ff 0f ff 0f 02
E: 19.774119 32 01 03 00 ce 00 c2 01 03 01 c8 00 98 00 00 0f ff 0f ff 0f 00 0f ff 0f ff 0f 00 0f ff 0f ff 0f 02
E: 19.793060 32 01 03 00 ce 00 c2 01 03 01 c8 00 98 00 00 0f ff 0f ff 0f 00 0f ff 0f ff 0f 00 0f ff 0f ff 0f 02
E: 19.810101 32 01 03 00 ce 00 c2 01 03 01 c8 00 98 00 00 0f ff 0f ff 0f 00 0f ff 0f ff 0f 00 0f ff 0f ff 0f 02
E: 19.828090 32 01 03 00 ce 00 c2 01 03 01 c8 00 98 00 00 0f ff 0f ff 0f 00 0f ff 0f ff 0f 00 0f ff 0f ff 0f 02
E: 19.845081 32 01 03 00 ce 00 c2 01 03 01 c8 00 98 00 00 0f ff 0f ff 0f 00 0f ff 0f ff 0f 00 0f ff 0f ff 0f 02
E: 19.863073 32 01 03 00 ce 00 c2 01 03 01 c8 00 98 00 00 0f ff 0f ff 0f 00 0f ff 0f ff 0f 00 0f ff 0f ff 0f 02
E: 19.881077 32 01 03 00 ce 00 c2 01 03 01 c7 00 98 00 00 0f ff 0f ff 0f 00 0f ff 0f ff 0f 00 0f ff 0f ff 0f 02
E: 19.899072 32 01 03 00 ce 00 c2 01 03 01 c7 00 97 00 00 0f ff 0f ff 0f 00 0f ff 0f ff 0f 00 0f ff 0f ff 0f 02
E: 19.915995 32 01 03 00 ce 00 c2 01 03 01 c7 00 97 00 00 0f ff 0f ff 0f 00 0f ff 0f ff 0f 00 0f ff 0f ff 0f 02
E: 19.934006 32 01 03 00 ce 00 c1 01 03 01 c7 00 97 00 00 0f ff 0f ff 0f 00 0f ff 0f ff 0f 00 0f ff 0f ff 0f 02
E: 19.951979 32 01 03 00 ce 00 c1 01 03 01 c7 00 97 00 00 0f ff 0f ff 0f 00 0f ff 0f ff 0f 00 0f ff 0f ff 0f 02
E: 19.969990 32 01 03 00 ce 00 c1 01 03 01 c7 00 97 00 00 0f ff 0f ff 0f 00 0f ff 0f ff 0f 00 0f ff 0f ff 0f 02
E: 19.987011 32 01 03 00 ce 00 c1 01 03 01 c7 00 97 00 00 0f ff 0f ff 0f 00 0f ff 0f ff 0f 00 0f ff 0f ff 0f 02
E: 20.005017 32 01 03 00 ce 00 c1 01 03 01 c6 00 97 00 00 0f ff 0f ff 0f 00 0f ff 0f ff 0f 00 0f ff 0f ff 0f 02
E: 20.023005 32 01 03 00 ce 00 c0 01 03 01 c6 00 97 00 00 0f ff 0f ff 0f 00 0f ff 0f ff 0f 00 0f ff 0f ff 0f 02
E: 20.040983 32 01 03 00 ce 00 c0 01 03 01 c6 00 97 00 00 0f ff 0f ff 0f 00 0f ff 0f ff 0f 00 0f ff 0f ff 0f 02
E: 20.057978 32 01 03 00 ce 00 c0 01 03 01 c6 00 97 00 00 0f ff 0f ff 0f 00 0f ff 0f ff 0f 00 0f ff 0f ff 0f 02
E: 20.075916 32 01 03 00 ce 00 c0 01 03 01 c6 00 97 00 00 0f ff 0f ff 0f 00 0f ff 0f ff 0f 00 0f ff 0f ff 0f 02
E: 20.092958 32 01 03 00 ce 00 c0 01 03 01 c6 00 97 00 00 0f ff 0f ff 0f 00 0f ff 0f ff 0f 00 0f ff 0f ff 0f 02
E: 20.111948 32 01 03 00 ce 00 c0 01 03 01 c6 00 97 00 00 0f ff 0f ff 0f 00 0f ff 0f ff 0f 00 0f ff 0f ff 0f 02
E: 20.128892 32 01 03 00 ce 00 c0 01 03 01 c6 00 97 00 00 0f ff 0f ff 0f 00 0f ff 0f ff 0f 00 0f ff 0f ff 0f 02
E: 20.146931 32 01 03 00 ce 00 c0 01 03 01 c6 00 97 00 00 0f ff 0f ff 0f 00 0f ff 0f ff 0f 00 0f ff 0f ff 0f 02
E: 20.163926 32 01 03 00 ce 00 c0 01 03 01 c6 00 97 00 00 0f ff 0f ff 0f 00 0f ff 0f ff 0f 00 0f ff 0f ff 0f 02
E: 20.181883 32 01 03 00 ce 00 c0 01 03 01 c5 00 97 00 00 0f ff 0f ff 0f 00 0f ff 0f ff 0f 00 0f ff 0f ff 0f 02
E: 20.199869 32 01 03 00 ce 00 c0 01 03 01 c5 00 97 00 00 0f ff 0f ff 0f 00 0f ff 0f ff 0f 00 0f ff 0f ff 0f 02
E: 20.217904 32 01 03 00 ce 00 c0 01 03 01 c6 00 97 00 00 0f ff 0f ff 0f 00 0f ff 0f ff 0f 00 0f ff 0f ff 0f 02
E: 20.234896 32 01 03 00 ce 00 bf 01 03 01 c6 00 97 00 00 0f ff 0f ff 0f 00 0f ff 0f ff 0f 00 0f ff 0f ff 0f 02
E: 20.252876 32 01 03 00 ce 00 bf 01 03 01 c6 00 97 00 00 0f ff 0f ff 0f 00 0f ff 0f ff 0f 00 0f ff 0f ff 0f 02
E: 20.270868 32 01 03 00 ce 00 bf 01 03 01 c6 00 97 00 00 0f ff 0f ff 0f 00 0f ff 0f ff 0f 00 0f ff 0f ff 0f 02
E: 20.288854 32 01 03 00 cf 00 bf 01 03 01 c6 00 97 00 00 0f ff 0f ff 0f 00 0f ff 0f ff 0f 00 0f ff 0f ff 0f 02
E: 20.305853 32 01 03 00 cf 00 bf 01 03 01 c6 00 97 00 00 0f ff 0f ff 0f 00 0f ff 0f ff 0f 00 0f ff 0f ff 0f 02
E: 20.323851 32 01 03 00 d0 00 bf 01 03 01 c6 00 97 00 00 0f ff 0f ff 0f 00 0f ff 0f ff 0f 00 0f ff 0f ff 0f 02
E: 20.340845 32 01 03 00 d1 00 bf 01 03 01 c7 00 97 00 00 0f ff 0f ff 0f 00 0f ff 0f ff 0f 00 0f ff 0f ff 0f 02
E: 20.359734 32 01 03 00 d3 00 bf 01 03 01 c8 00 97 00 00 0f ff 0f ff 0f 00 0f ff 0f ff 0f 00 0f ff 0f ff 0f 02
E: 20.376754 32 01 03 00 d6 00 bf 01 03 01 ca 00 98 00 00 0f ff 0f ff 0f 00 0f ff 0f ff 0f 00 0f ff 0f ff 0f 02
E: 20.394822 32 01 03 00 dc 00 bf 01 03 01 cf 00 98 00 00 0f ff 0f ff 0f 00 0f ff 0f ff 0f 00 0f ff 0f ff 0f 02
E: 20.411813 32 01 03 00 e4 00 bf 01 03 01 d6 00 99 00 00 0f ff 0f ff 0f 00 0f ff 0f ff 0f 00 0f ff 0f ff 0f 02
E: 20.430803 32 01 03 00 ed 00 bf 01 03 01 df 00 9a 00 00 0f ff 0f ff 0f 00 0f ff 0f ff 0f 00 0f ff 0f ff 0f 02
E: 20.447795 32 01 03 00 f8 00 bf 01 03 01 e9 00 9b 00 00 0f ff 0f ff 0f 00 0f ff 0f ff 0f 00 0f ff 0f ff 0f 02
E: 20.465790 32 01 03 00 02 01 bf 01 03 01 ff 00 9b 00 00 0f ff 0f ff 0f 00 0f ff 0f ff 0f 00 0f ff 0f ff 0f 02
E: 20.482785 32 01 03 00 1c 01 bf 01 03 01 08 01 9c 00 00 0f ff 0f ff 0f 00 0f ff 0f ff 0f 00 0f ff 0f ff 0f 02
E: 20.500742 32 01 03 00 26 01 bf 01 03 01 1e 01 9e 00 00 0f ff 0f ff 0f 00 0f ff 0f ff 0f 00 0f ff 0f ff 0f 02
E: 20.518741 32 01 03 00 31 01 bf 01 03 01 28 01 9e 00 00 0f ff 0f ff 0f 00 0f ff 0f ff 0f 00 0f ff 0f ff 0f 02
E: 20.536700 32 01 03 00 49 01 c0 01 03 01 3e 01 9f 00 00 0f ff 0f ff 0f 00 0f ff 0f ff 0f 00 0f ff 0f ff 0f 02
E: 20.553750 32 01 03 00 52 01 c0 01 03 01 47 01 9f 00 00 0f ff 0f ff 0f 00 0f ff 0f ff 0f 00 0f ff 0f ff 0f 02
E: 20.572732 32 01 03 00 5d 01 c0 01 03 01 52 01 a0 00 00 0f ff 0f ff 0f 00 0f ff 0f ff 0f 00 0f ff 0f ff 0f 02
E: 20.589739 32 01 03 00 68 01 c0 01 03 01 68 01 a1 00 00 0f ff 0f ff 0f 00 0f ff 0f ff 0f 00 0f ff 0f ff 0f 02
E: 20.607713 32 01 03 00 7f 01 c1 01 03 01 71 01 a2 00 00 0f ff 0f ff 0f 00 0f ff 0f ff 0f 00 0f ff 0f ff 0f 02
E: 20.624704 32 01 03 00 88 01 c1 01 03 01 7c 01 a2 00 00 0f ff 0f ff 0f 00 0f ff 0f ff 0f 00 0f ff 0f ff 0f 02
E: 20.642697 32 01 03 00 92 01 c1 01 03 01 93 01 a4 00 00 0f ff 0f ff 0f 00 0f ff 0f ff 0f 00 0f ff 0f ff 0f 02
E: 20.660687 32 01 03 00 a9 01 c2 01 03 01 9c 01 a4 00 00 0f ff 0f ff 0f 00 0f ff 0f ff 0f 00 0f ff 0f ff 0f 02
E: 20.678665 32 01 03 00 b2 01 c2 01 03 01 a7 01 a5 00 00 0f ff 0f ff 0f 00 0f ff 0f ff 0f 00 0f ff 0f ff 0f 02
E: 20.695653 32 01 03 00 bd 01 c3 01 03 01 be 01 a6 00 00 0f ff 0f ff 0f 00 0f ff 0f ff 0f 00 0f ff 0f ff 0f 02
E: 20.713660 32 01 03 00 d5 01 c3 01 03 01 c7 01 a6 00 00 0f ff 0f ff 0f 00 0f ff 0f ff 0f 00 0f ff 0f ff 0f 02
E: 20.730652 32 01 03 00 df 01 c3 01 03 01 dd 01 a7 00 00 0f ff 0f ff 0f 00 0f ff 0f ff 0f 00 0f ff 0f ff 0f 02
E: 20.749644 32 01 03 00 f7 01 c3 01 03 01 e6 01 a8 00 00 0f ff 0f ff 0f 00 0f ff 0f ff 0f 00 0f ff 0f ff 0f 02
E: 20.766584 32 01 03 00 01 02 c4 01 03 01 f1 01 a9 00 00 0f ff 0f ff 0f 00 0f ff 0f ff 0f 00 0f ff 0f ff 0f 02
E: 20.784626 32 01 03 00 18 02 c4 01 03 01 08 02 ab 00 00 0f ff 0f ff 0f 00 0f ff 0f ff 0f 00 0f ff 0f ff 0f 02
E: 20.801616 32 01 03 00 22 02 c4 01 03 01 11 02 ac 00 00 0f ff 0f ff 0f 00 0f ff 0f ff 0f 00 0f ff 0f ff 0f 02
E: 20.820608 32 01 03 00 2c 02 c5 01 03 01 1c 02 ad 00 00 0f ff 0f ff 0f 00 0f ff 0f ff 0f 00 0f ff 0f ff 0f 02
E: 20.837610 32 01 03 00 36 02 c6 01 03 01 32 02 af 00 00 0f ff 0f ff 0f 00 0f ff 0f ff 0f 00 0f ff 0f ff 0f 02
E: 20.855566 32 01 03 00 41 02 c6 01 03 01 3a 02 af 00 00 0f ff 0f ff 0f 00 0f ff 0f ff 0f 00 0f ff 0f ff 0f 02
E: 20.872583 32 01 03 00 4c 02 c6 01 03 01 43 02 af 00 00 0f ff 0f ff 0f 00 0f ff 0f ff 0f 00 0f ff 0f ff 0f 02
E: 20.890572 32 01 03 00 56 02 c7 01 03 01 4c 02 af 00 00 0f ff 0f ff 0f 00 0f ff 0f ff 0f 00 0f ff 0f ff 0f 02
E: 20.907563 32 01 03 00 60 02 c7 01 03 01 55 02 b0 00 00 0f ff 0f ff 0f 00 0f ff 0f ff 0f 00 0f ff 0f ff 0f 02
E: 20.926502 32 01 03 00 69 02 c7 01 03 01 5d 02 b0 00 00 0f ff 0f ff 0f 00 0f ff 0f ff 0f 00 0f ff 0f ff 0f 02
E: 20.943551 32 01 03 00 71 02 c7 01 03 01 65 02 b0 00 00 0f ff 0f ff 0f 00 0f ff 0f ff 0f 00 0f ff 0f ff 0f 02
E: 20.961535 32 01 03 00 79 02 c7 01 03 01 6d 02 b0 00 00 0f ff 0f ff 0f 00 0f ff 0f ff 0f 00 0f ff 0f ff 0f 02
E: 20.978530 32 01 03 00 80 02 c7 01 03 01 74 02 b1 00 00 0f ff 0f ff 0f 00 0f ff 0f ff 0f 00 0f ff 0f ff 0f 02
E: 20.997519 32 01 03 00 87 02 c7 01 03 01 7a 02 b2 00 00 0f ff 0f ff 0f 00 0f ff 0f ff 0f 00 0f ff 0f ff 0f 02
E: 21.014507 32 01 03 00 8c 02 c7 01 03 01 7c 02 b2 00 00 0f ff 0f ff 0f 00 0f ff 0f ff 0f 00 0f ff 0f ff 0f 02
E: 21.032441 32 01 03 00 8f 02 c8 01 03 01 7f 02 b2 00 00 0f ff 0f ff 0f 00 0f ff 0f ff 0f 00 0f ff 0f ff 0f 02
E: 21.049493 32 01 03 00 91 02 c8 01 03 01 81 02 b2 00 00 0f ff 0f ff 0f 00 0f ff 0f ff 0f 00 0f ff 0f ff 0f 02
E: 21.068417 32 01 03 00 93 02 c8 01 03 01 84 02 b2 00 00 0f ff 0f ff 0f 00 0f ff 0f ff 0f 00 0f ff 0f ff 0f 02
E: 21.085475 32 01 03 00 96 02 c8 01 03 01 85 02 b2 00 00 0f ff 0f ff 0f 00 0f ff 0f ff 0f 00 0f ff 0f ff 0f 02
E: 21.103470 32 01 03 00 97 02 c8 01 03 01 88 02 b3 00 00 0f ff 0f ff 0f 00 0f ff 0f ff 0f 00 0f ff 0f ff 0f 02
E: 21.120458 32 01 03 00 9a 02 c8 01 03 01 8a 02 b3 00 00 0f ff 0f ff 0f 00 0f ff 0f ff 0f 00 0f ff 0f ff 0f 02
E: 21.139448 32 01 03 00 9b 02 c9 01 03 01 8b 02 b3 00 00 0f ff 0f ff 0f 00 0f ff 0f ff 0f 00 0f ff 0f ff 0f 02
E: 21.156392 32 01 03 00 9d 02 c9 01 03 01 8c 02 b3 00 00 0f ff 0f ff 0f 00 0f ff 0f ff 0f 00 0f ff 0f ff 0f 02
E: 21.174432 32 01 03 00 9e 02 c9 01 03 01 8c 02 b3 00 00 0f ff 0f ff 0f 00 0f ff 0f ff 0f 00 0f ff 0f ff 0f 02
E: 21.191349 32 01 03 00 9e 02 c9 01 03 01 8c 02 b3 00 00 0f ff 0f ff 0f 00 0f ff 0f ff 0f 00 0f ff 0f ff 0f 02
E: 21.210414 32 01 03 00 9e 02 c9 01 03 01 8d 02 b3 00 00 0f ff 0f ff 0f 00 0f ff 0f ff 0f 00 0f ff 0f ff 0f 02
E: 21.227405 32 01 03 00 9f 02 c9 01 03 01 8e 02 b3 00 00 0f ff 0f ff 0f 00 0f ff 0f ff 0f 00 0f ff 0f ff 0f 02
E: 21.245390 32 01 03 00 9f 02 c8 01 03 01 8e 02 b3 00 00 0f ff 0f ff 0f 00 0f ff 0f ff 0f 00 0f ff 0f ff 0f 02
E: 21.262372 32 01 03 00 9f 02 c8 01 03 01 8e 02 b3 00 00 0f ff 0f ff 0f 00 0f ff 0f ff 0f 00 0f ff 0f ff 0f 02
E: 21.280375 32 01 03 00 a0 02 c8 01 03 01 8f 02 b2 00 00 0f ff 0f ff 0f 00 0f ff 0f ff 0f 00 0f ff 0f ff 0f 02
E: 21.298364 32 01 03 00 a0 02 c8 01 03 01 8f 02 b2 00 00 0f ff 0f ff 0f 00 0f ff 0f ff 0f 00 0f ff 0f ff 0f 02
E: 21.316337 32 01 03 00 a0 02 c8 01 03 01 8f 02 b2 00 00 0f ff 0f ff 0f 00 0f ff 0f ff 0f 00 0f ff 0f ff 0f 02
E: 21.333339 32 01 03 00 a0 02 c8 01 03 01 8f 02 b2 00 00 0f ff 0f ff 0f 00 0f ff 0f ff 0f 00 0f ff 0f ff 0f 02
E: 21.351341 32 01 03 00 a1 02 c8 01 03 01 8f 02 b2 00 00 0f ff 0f ff 0f 00 0f ff 0f ff 0f 00 0f ff 0f ff 0f 02
E: 21.368330 32 01 03 00 a1 02 c8 01 03 01 90 02 b2 00 00 0f ff 0f ff 0f 00 0f ff 0f ff 0f 00 0f ff 0f ff 0f 02
E: 21.387312 32 01 03 00 a1 02 c8 01 03 01 90 02 b2 00 00 0f ff 0f ff 0f 00 0f ff 0f ff 0f 00 0f ff 0f ff 0f 02
E: 21.404276 32 01 03 00 a1 02 c8 01 03 01 90 02 b2 00 00 0f ff 0f ff 0f 00 0f ff 0f ff 0f 00 0f ff 0f ff 0f 02
E: 21.422232 32 01 03 00 a1 02 c8 01 03 01 90 02 b2 00 00 0f ff 0f ff 0f 00 0f ff 0f ff 0f 00 0f ff 0f ff 0f 02
E: 21.439294 32 01 03 00 a2 02 c8 01 03 01 90 02 b2 00 00 0f ff 0f ff 0f 00 0f ff 0f ff 0f 00 0f ff 0f ff 0f 02
E: 21.458289 32 01 03 00 a2 02 c8 01 03 01 90 02 b2 00 00 0f ff 0f ff 0f 00 0f ff 0f ff 0f 00 0f ff 0f ff 0f 02
E: 21.475268 32 01 03 00 a2 02 c8 01 03 01 90 02 b2 00 00 0f ff 0f ff 0f 00 0f ff 0f ff 0f 00 0f ff 0f ff 0f 02
E: 21.493259 32 01 03 00 a2 02 c8 01 03 01 90 02 b2 00 00 0f ff 0f ff 0f 00 0f ff 0f ff 0f 00 0f ff 0f ff 0f 02
E: 21.510252 32 01 03 00 a2 02 c8 01 03 01 90 02 b2 00 00 0f ff 0f ff 0f 00 0f ff 0f ff 0f 00 0f ff 0f ff 0f 02
E: 21.529241 32 01 03 00 a2 02 c8 01 03 01 90 02 b2 00 00 0f ff 0f ff 0f 00 0f ff 0f ff 0f 00 0f ff 0f ff 0f 02
E: 21.546237 32 01 03 00 a2 02 c8 01 03 01 90 02 b2 00 00 0f ff 0f ff 0f 00 0f ff 0f ff 0f 00 0f ff 0f ff 0f 02
E: 21.564224 32 01 03 00 a2 02 c8 01 03 01 90 02 b2 00 00 0f ff 0f ff 0f 00 0f ff 0f ff 0f 00 0f ff 0f ff 0f 02
E: 21.581215 32 01 03 00 a2 02 c8 01 03 01 90 02 b2 00 00 0f ff 0f ff 0f 00 0f ff 0f ff 0f 00 0f ff 0f ff 0f 02
E: 21.599206 32 01 03 00 a2 02 c8 01 03 01 90 02 b2 00 00 0f ff 0f ff 0f 00 0f ff 0f ff 0f 00 0f ff 0f ff 0f 02
E: 21.617143 32 01 03 00 a2 02 c8 01 03 01 90 02 b2 00 00 0f ff 0f ff 0f 00 0f ff 0f ff 0f 00 0f ff 0f ff 0f 02
E: 21.635198 32 01 03 00 a2 02 c8 01 03 01 91 02 b2 00 00 0f ff 0f ff 0f 00 0f ff 0f ff 0f 00 0f ff 0f ff 0f 02
E: 21.652191 32 01 03 00 a2 02 c8 01 03 01 91 02 b2 00 00 0f ff 0f ff 0f 00 0f ff 0f ff 0f 00 0f ff 0f ff 0f 02
E: 21.669171 32 01 03 01 91 02 b2 00 00 00 a2 02 c8 01 00 0f ff 0f ff 0f 00 0f ff 0f ff 0f 00 0f ff 0f ff 0f 01
E: 21.686173 32 01 03 01 92 02 b2 00 00 0f ff 0f ff 0f 00 0f ff 0f ff 0f 00 0f ff 0f ff 0f 00 0f ff 0f ff 0f 01
E: 21.704153 32 01 03 01 92 02 b2 00 00 0f ff 0f ff 0f 00 0f ff 0f ff 0f 00 0f ff 0f ff 0f 00 0f ff 0f ff 0f 01
E: 21.722154 32 01 03 01 93 02 b2 00 00 0f ff 0f ff 0f 00 0f ff 0f ff 0f 00 0f ff 0f ff 0f 00 0f ff 0f ff 0f 01
E: 21.740137 32 01 03 01 93 02 b2 00 00 0f ff 0f ff 0f 00 0f ff 0f ff 0f 00 0f ff 0f ff 0f 00 0f ff 0f ff 0f 01
E: 21.757125 32 01 03 01 93 02 b2 00 00 0f ff 0f ff 0f 00 0f ff 0f ff 0f 00 0f ff 0f ff 0f 00 0f ff 0f ff 0f 01
E: 21.775127 32 01 03 01 94 02 b2 00 00 0f ff 0f ff 0f 00 0f ff 0f ff 0f 00 0f ff 0f ff 0f 00 0f ff 0f ff 0f 01
E: 21.792114 32 01 03 01 94 02 b2 00 00 0f ff 0f ff 0f 00 0f ff 0f ff 0f 00 0f ff 0f ff 0f 00 0f ff 0f ff 0f 01
E: 21.811103 32 01 03 01 94 02 b2 00 00 0f ff 0f ff 0f 00 0f ff 0f ff 0f 00 0f ff 0f ff 0f 00 0f ff 0f ff 0f 01
E: 21.828095 32 01 03 01 94 02 b2 00 00 0f ff 0f ff 0f 00 0f ff 0f ff 0f 00 0f ff 0f ff 0f 00 0f ff 0f ff 0f 01
E: 21.846068 32 01 03 01 95 02 b2 00 00 0f ff 0f ff 0f 00 0f ff 0f ff 0f 00 0f ff 0f ff 0f 00 0f ff 0f ff 0f 01
E: 21.863074 32 01 03 01 95 02 b2 00 00 0f ff 0f ff 0f 00 0f ff 0f ff 0f 00 0f ff 0f ff 0f 00 0f ff 0f ff 0f 01
E: 21.882065 32 01 03 01 95 02 b2 00 00 0f ff 0f ff 0f 00 0f ff 0f ff 0f 00 0f ff 0f ff 0f 00 0f ff 0f ff 0f 01
E: 21.899065 32 01 03 01 96 02 b2 00 00 0f ff 0f ff 0f 00 0f ff 0f ff 0f 00 0f ff 0f ff 0f 00 0f ff 0f ff 0f 01
E: 21.917046 32 01 03 01 96 02 b2 00 00 0f ff 0f ff 0f 00 0f ff 0f ff 0f 00 0f ff 0f ff 0f 00 0f ff 0f ff 0f 01
E: 21.934041 32 01 03 01 96 02 b2 00 00 0f ff 0f ff 0f 00 0f ff 0f ff 0f 00 0f ff 0f ff 0f 00 0f ff 0f ff 0f 01
E: 21.952042 32 01 03 01 96 02 b1 00 00 0f ff 0f ff 0f 00 0f ff 0f ff 0f 00 0f ff 0f ff 0f 00 0f ff 0f ff 0f 01
E: 21.970020 32 01 03 01 96 02 b1 00 00 0f ff 0f ff 0f 00 0f ff 0f ff 0f 00 0f ff 0f ff 0f 00 0f ff 0f ff 0f 01
E: 21.988011 32 01 03 01 96 02 b1 00 00 0f ff 0f ff 0f 00 0f ff 0f ff 0f 00 0f ff 0f ff 0f 00 0f ff 0f ff 0f 01
E: 22.005011 32 01 03 01 96 02 b1 00 00 0f ff 0f ff 0f 00 0f ff 0f ff 0f 00 0f ff 0f ff 0f 00 0f ff 0f ff 0f 01
E: 22.022995 32 01 03 01 96 02 b1 00 00 0f ff 0f ff 0f 00 0f ff 0f ff 0f 00 0f ff 0f ff 0f 00 0f ff 0f ff 0f 01
E: 22.040928 32 01 03 01 97 02 b1 00 00 0f ff 0f ff 0f 00 0f ff 0f ff 0f 00 0f ff 0f ff 0f 00 0f ff 0f ff 0f 01
E: 22.058976 32 01 03 01 97 02 b1 00 00 0f ff 0f ff 0f 00 0f ff 0f ff 0f 00 0f ff 0f ff 0f 00 0f ff 0f ff 0f 01
E: 22.075920 32 01 03 01 97 02 b1 00 00 0f ff 0f ff 0f 00 0f ff 0f ff 0f 00 0f ff 0f ff 0f 00 0f ff 0f ff 0f 01
E: 22.093962 32 01 03 01 97 02 b1 00 00 0f ff 0f ff 0f 00 0f ff 0f ff 0f 00 0f ff 0f ff 0f 00 0f ff 0f ff 0f 01
E: 22.110952 32 01 03 01 97 02 b1 00 00 0f ff 0f ff 0f 00 0f ff 0f ff 0f 00 0f ff 0f ff 0f 00 0f ff 0f ff 0f 01
E: 22.129943 32 01 03 01 97 02 b1 00 00 0f ff 0f ff 0f 00 0f ff 0f ff 0f 00 0f ff 0f ff 0f 00 0f ff 0f ff 0f 01
E: 22.146918 32 01 03 01 96 02 b1 00 00 0f ff 0f ff 0f 00 0f ff 0f ff 0f 00 0f ff 0f ff 0f 00 0f ff 0f ff 0f 01
E: 22.164923 32 01 03 01 96 02 b1 00 00 0f ff 0f ff 0f 00 0f ff 0f ff 0f 00 0f ff 0f ff 0f 00 0f ff 0f ff 0f 01
E: 22.181926 32 01 03 01 96 02 b0 00 00 0f ff 0f ff 0f 00 0f ff 0f ff 0f 00 0f ff 0f ff 0f 00 0f ff 0f ff 0f 01
E: 22.200905 32 01 03 01 96 02 b0 00 00 0f ff 0f ff 0f 00 0f ff 0f ff 0f 00 0f ff 0f ff 0f 00 0f ff 0f ff 0f 01
E: 22.217903 32 01 03 01 96 02 b0 00 00 0f ff 0f ff 0f 00 0f ff 0f ff 0f 00 0f ff 0f ff 0f 00 0f ff 0f ff 0f 01
E: 22.235861 32 01 03 01 96 02 b0 00 00 0f ff 0f ff 0f 00 0f ff 0f ff 0f 00 0f ff 0f ff 0f 00 0f ff 0f ff 0f 01
E: 22.252860 32 01 03 01 95 02 b0 00 00 0f ff 0f ff 0f 00 0f ff 0f ff 0f 00 0f ff 0f ff 0f 00 0f ff 0f ff 0f 01
E: 22.270871 32 01 03 01 95 02 b0 00 00 0f ff 0f ff 0f 00 0f ff 0f ff 0f 00 0f ff 0f ff 0f 00 0f ff 0f ff 0f 01
E: 22.288857 32 01 03 01 94 02 b0 00 00 0f ff 0f ff 0f 00 0f ff 0f ff 0f 00 0f ff 0f ff 0f 00 0f ff 0f ff 0f 01
E: 22.306819 32 01 03 01 94 02 b0 00 00 0f ff 0f ff 0f 00 0f ff 0f ff 0f 00 0f ff 0f ff 0f 00 0f ff 0f ff 0f 01
E: 22.323853 32 01 03 01 94 02 af 00 00 0f ff 0f ff 0f 00 0f ff 0f ff 0f 00 0f ff 0f ff 0f 00 0f ff 0f ff 0f 01
E: 22.341838 32 01 03 01 94 02 af 00 00 0f ff 0f ff 0f 00 0f ff 0f ff 0f 00 0f ff 0f ff 0f 00 0f ff 0f ff 0f 01
E: 22.358835 32 01 03 01 93 02 af 00 00 0f ff 0f ff 0f 00 0f ff 0f ff 0f 00 0f ff 0f ff 0f 00 0f ff 0f ff 0f 01
E: 22.377828 32 01 03 01 93 02 b0 00 00 0f ff 0f ff 0f 00 0f ff 0f ff 0f 00 0f ff 0f ff 0f 00 0f ff 0f ff 0f 01
E: 22.393811 32 01 03 01 93 02 b0 00 00 0f ff 0f ff 0f 00 0f ff 0f ff 0f 00 0f ff 0f ff 0f 00 0f ff 0f ff 0f 01
E: 22.415806 32 01 00 01 93 02 b0 00 00 0f ff 0f ff 0f 00 0f ff 0f ff 0f 00 0f ff 0f ff 0f 00 0f ff 0f ff 0f 01
# 3. Finally, move your ten fingers on the screen and release them.
E: 33.614200 32 01 03 00 af 00 66 00 03 01 2a 01 0a 02 00 0f ff 0f ff 0f 00 0f ff 0f ff 0f 00 0f ff 0f ff 0f 02
E: 33.636206 32 01 03 00 af 00 65 00 03 01 2a 01 0a 02 03 02 25 03 d1 01 03 03 67 03 15 00 00 0f ff 0f ff 0f 04
E: 33.655199 32 01 03 00 af 00 65 00 03 01 2a 01 0a 02 03 02 25 03 d0 01 03 03 67 03 15 00 03 04 bb 01 b1 01 05
E: 33.673188 32 01 03 00 af 00 65 00 03 01 2a 01 0a 02 03 02 24 03 d0 01 03 03 67 03 15 00 03 04 ba 01 b0 01 05
E: 33.691180 32 01 03 00 af 00 65 00 03 01 2a 01 09 02 03 02 22 03 d0 01 03 03 67 03 15 00 03 04 ba 01 b0 01 05
E: 33.709172 32 01 03 00 b0 00 65 00 03 01 2a 01 08 02 03 02 21 03 d0 01 03 03 66 03 15 00 03 04 ba 01 b0 01 05
E: 33.727160 32 01 03 00 b0 00 64 00 03 01 2a 01 08 02 03 02 1f 03 d0 01 03 03 67 03 16 00 03 04 ba 01 b0 01 05
E: 33.744162 32 01 03 00 b0 00 64 00 03 01 2a 01 08 02 03 02 1e 03 cf 01 03 03 67 03 16 00 03 04 ba 01 b0 01 05
E: 33.762076 32 01 03 00 b0 00 64 00 03 01 2a 01 07 02 03 02 1d 03 cf 01 03 03 67 03 18 00 03 04 ba 01 b0 01 05
E: 33.780144 32 01 03 00 b0 00 64 00 03 01 2a 01 07 02 03 02 1d 03 cf 01 03 03 67 03 19 00 03 04 ba 01 b0 01 05
E: 33.798129 32 01 03 00 b0 00 64 00 03 01 28 01 07 02 03 02 1c 03 ce 01 03 03 68 03 19 00 03 04 ba 01 b0 01 05
E: 33.815119 32 01 03 00 b0 00 65 00 03 01 28 01 06 02 03 02 1c 03 ce 01 03 03 68 03 1a 00 03 04 ba 01 b0 01 05
E: 33.833113 32 01 03 00 b0 00 65 00 03 01 28 01 06 02 03 02 1d 03 ce 01 03 03 69 03 1b 00 03 04 b9 01 b0 01 05
E: 33.851102 32 01 03 00 af 00 65 00 03 01 27 01 06 02 03 02 1d 03 ce 01 03 03 69 03 1c 00 03 04 b9 01 b0 01 05
E: 33.869092 32 01 03 00 af 00 65 00 03 01 27 01 06 02 03 02 1d 03 ce 01 03 03 69 03 1c 00 03 04 b9 01 b1 01 05
E: 33.886042 32 01 03 00 af 00 67 00 03 01 26 01 06 02 03 02 1e 03 ce 01 03 03 6a 03 1c 00 03 04 b8 01 b1 01 05
E: 33.904080 32 01 03 00 ad 00 68 00 03 01 25 01 07 02 03 02 1e 03 ce 01 03 03 6b 03 1c 00 03 04 b7 01 b1 01 05
E: 33.922074 32 01 03 00 ab 00 6b 00 03 01 22 01 0a 02 03 02 1e 03 ce 01 03 03 6b 03 1d 00 03 04 b6 01 b2 01 05
E: 33.940060 32 01 03 00 a8 00 6f 00 03 01 1f 01 0d 02 03 02 1f 03 ce 01 03 03 6b 03 1d 00 03 04 b6 01 b3 01 05
E: 33.957054 32 01 03 00 a4 00 75 00 03 01 1b 01 10 02 03 02 21 03 ce 01 03 03 6d 03 1d 00 03 04 b4 01 b4 01 05
E: 33.975046 32 01 03 00 9f 00 7b 00 03 01 17 01 14 02 03 02 23 03 ce 01 03 03 6f 03 1e 00 03 04 b2 01 b8 01 05
E: 33.992010 32 01 03 00 9b 00 80 00 03 01 14 01 18 02 03 02 26 03 ce 01 03 03 70 03 1e 00 03 04 af 01 bb 01 05
E: 34.009941 32 01 03 00 98 00 87 00 03 01 11 01 1d 02 03 02 2b 03 ce 01 03 03 73 03 1f 00 03 04 ac 01 bf 01 05
E: 34.027012 32 01 03 00 94 00 8d 00 03 01 0f 01 22 02 03 02 2e 03 cf 01 03 03 75 03 1f 00 03 04 ab 01 c4 01 05
E: 34.045002 32 01 03 00 92 00 92 00 03 01 0f 01 24 02 03 02 30 03 cf 01 03 03 77 03 20 00 03 04 aa 01 c6 01 05
E: 34.062998 32 01 03 00 91 00 94 00 03 01 0f 01 26 02 03 02 32 03 cf 01 03 03 78 03 20 00 03 04 aa 01 c7 01 05
E: 34.080940 32 01 03 00 90 00 96 00 03 01 0e 01 27 02 03 02 34 03 d0 01 03 03 79 03 20 00 03 04 aa 01 c8 01 05
E: 34.097932 32 01 03 00 90 00 97 00 03 01 0e 01 28 02 03 02 35 03 d0 01 03 03 7a 03 20 00 03 04 aa 01 c9 01 05
E: 34.115933 32 01 03 00 90 00 97 00 03 01 0d 01 28 02 03 02 36 03 d0 01 03 03 7a 03 20 00 03 04 ac 01 c9 01 05
E: 34.133922 32 01 03 00 90 00 97 00 03 01 0d 01 29 02 03 02 36 03 d0 01 03 03 7b 03 1f 00 03 04 ae 01 c9 01 05
E: 34.151914 32 01 03 00 91 00 97 00 03 01 0d 01 29 02 03 02 35 03 d1 01 03 03 7b 03 1f 00 03 04 b3 01 c7 01 05
E: 34.168947 32 01 03 00 93 00 96 00 03 01 0d 01 29 02 03 02 32 03 d4 01 03 03 7b 03 1f 00 03 04 b9 01 c4 01 05
E: 34.186908 32 01 03 00 94 00 94 00 03 01 0d 01 29 02 03 02 2d 03 d6 01 03 03 7a 03 1e 00 03 04 bd 01 c0 01 05
E: 34.204929 32 01 03 00 95 00 93 00 03 01 0d 01 29 02 03 02 27 03 d9 01 03 03 78 03 1d 00 03 04 c1 01 bd 01 05
E: 34.222921 32 01 03 00 97 00 91 00 03 01 0d 01 29 02 03 02 21 03 dc 01 03 03 77 03 1d 00 03 04 c5 01 ba 01 05
E: 34.240871 32 01 03 00 98 00 90 00 03 01 0d 01 28 02 03 02 1c 03 de 01 03 03 74 03 1c 00 03 04 c9 01 b8 01 05
E: 34.257889 32 01 03 00 98 00 8f 00 03 01 0d 01 28 02 03 02 17 03 df 01 03 03 73 03 1c 00 03 04 cb 01 b7 01 05
E: 34.275894 32 01 03 00 99 00 8e 00 03 01 0d 01 28 02 03 02 16 03 e0 01 03 03 71 03 1b 00 03 04 cc 01 b6 01 05
E: 34.293893 32 01 03 00 99 00 8e 00 03 01 0d 01 27 02 03 02 14 03 e1 01 03 03 70 03 1a 00 03 04 ce 01 b5 01 05
E: 34.311884 32 01 03 00 99 00 8d 00 03 01 0d 01 27 02 03 02 13 03 e1 01 03 03 6f 03 1a 00 03 04 cf 01 b3 01 05
E: 34.328867 32 01 03 00 99 00 8d 00 03 01 0d 01 27 02 03 02 13 03 e2 01 03 03 6f 03 1b 00 03 04 cf 01 b3 01 05
E: 34.346836 32 01 03 00 99 00 8d 00 03 01 0d 01 27 02 03 02 13 03 e2 01 03 03 6f 03 1b 00 03 04 d0 01 b3 01 05
E: 34.364821 32 01 03 00 98 00 8e 00 03 01 0d 01 27 02 03 02 15 03 e2 01 03 03 70 03 1c 00 03 04 cf 01 b2 01 05
E: 34.382842 32 01 03 00 96 00 8f 00 03 01 0c 01 27 02 03 02 1b 03 e3 01 03 03 74 03 1f 00 03 04 cf 01 b3 01 05
E: 34.399831 32 01 03 00 93 00 92 00 03 01 0c 01 27 02 03 02 22 03 e3 01 03 03 7a 03 22 00 03 04 cd 01 b3 01 05
E: 34.417727 32 01 03 00 8f 00 96 00 03 01 0b 01 28 02 03 02 2b 03 e4 01 03 03 89 03 2a 00 03 04 c8 01 b5 01 05
E: 34.435809 32 01 03 00 8c 00 99 00 03 01 09 01 28 02 03 02 36 03 e5 01 03 03 90 03 2d 00 03 04 c3 01 b7 01 05
E: 34.452798 32 01 03 00 8b 00 9a 00 03 01 09 01 29 02 03 02 40 03 e6 01 03 03 97 03 31 00 03 04 c2 01 b8 01 05
E: 34.470789 32 01 03 00 8a 00 9b 00 03 01 09 01 29 02 03 02 49 03 e6 01 03 03 9e 03 34 00 03 04 c1 01 b8 01 05
E: 34.488782 32 01 03 00 8a 00 9b 00 03 01 09 01 29 02 03 02 51 03 e7 01 03 03 a2 03 36 00 03 04 bf 01 b9 01 05
E: 34.506727 32 01 03 00 8c 00 9c 00 03 01 0b 01 29 02 03 02 56 03 e8 01 03 03 a4 03 37 00 03 04 bf 01 b9 01 05
E: 34.523776 32 01 03 00 91 00 9b 00 03 01 11 01 29 02 03 02 58 03 e8 01 03 03 a6 03 38 00 03 04 bf 01 b9 01 05
E: 34.541765 32 01 03 00 99 00 99 00 03 01 1a 01 28 02 03 02 58 03 e8 01 03 03 a6 03 38 00 03 04 c1 01 b9 01 05
E: 34.559662 32 01 03 00 ab 00 94 00 03 01 2d 01 22 02 03 02 57 03 e9 01 03 03 a5 03 38 00 03 04 c7 01 b6 01 05
E: 34.577736 32 01 03 00 bc 00 8d 00 03 01 34 01 1e 02 03 02 51 03 ec 01 03 03 a3 03 38 00 03 04 d9 01 ae 01 05
E: 34.594727 32 01 03 00 c3 00 8a 00 03 01 44 01 14 02 03 02 4b 03 ef 01 03 03 a1 03 38 00 03 04 e8 01 a6 01 05
E: 34.612719 32 01 03 00 ca 00 86 00 03 01 49 01 0f 02 03 02 45 03 f0 01 03 03 9f 03 38 00 03 04 f7 01 97 01 05
E: 34.630712 32 01 03 00 cf 00 82 00 03 01 4d 01 0a 02 03 02 3e 03 f2 01 03 03 9c 03 38 00 03 04 fb 01 93 01 05
E: 34.648682 32 01 03 00 d3 00 7f 00 03 01 4f 01 06 02 03 02 39 03 f4 01 03 03 99 03 38 00 03 04 ff 01 8f 01 05
E: 34.666642 32 01 03 00 d5 00 7e 00 03 01 50 01 04 02 03 02 35 03 f5 01 03 03 97 03 38 00 03 04 00 02 8d 01 05
E: 34.683601 32 01 03 00 d5 00 7e 00 03 01 51 01 03 02 03 02 32 03 f6 01 03 03 95 03 38 00 03 04 01 02 8c 01 05
E: 34.701684 32 01 03 00 d5 00 7d 00 03 01 51 01 01 02 03 02 31 03 f6 01 03 03 92 03 38 00 03 04 02 02 8b 01 05
E: 34.719672 32 01 03 00 d5 00 7d 00 03 01 51 01 01 02 03 02 2f 03 f7 01 03 03 91 03 3a 00 03 04 03 02 8a 01 05
E: 34.736620 32 01 03 00 d4 00 7e 00 03 01 51 01 01 02 03 02 2f 03 f7 01 03 03 90 03 3b 00 03 04 03 02 8a 01 05
E: 34.754648 32 01 03 00 d3 00 7f 00 03 01 51 01 01 02 03 02 2f 03 f7 01 03 03 8f 03 3c 00 03 04 03 02 8a 01 05
E: 34.772631 32 01 03 00 d2 00 80 00 03 01 51 01 01 02 03 02 2f 03 f7 01 03 03 8f 03 3e 00 03 04 03 02 8a 01 05
E: 34.789566 32 01 03 00 ce 00 84 00 03 01 4f 01 02 02 03 02 30 03 f8 01 03 03 8f 03 3f 00 03 04 01 02 8a 01 05
E: 34.807599 32 01 03 00 ca 00 89 00 03 01 4c 01 05 02 03 02 31 03 f9 01 03 03 8f 03 3f 00 03 04 f3 01 94 01 05
E: 34.825583 32 01 03 00 c6 00 8d 00 03 01 47 01 08 02 03 02 33 03 f9 01 03 03 90 03 41 00 03 04 ec 01 97 01 05
E: 34.842605 32 01 03 00 c2 00 91 00 03 01 44 01 0b 02 03 02 34 03 fa 01 03 03 90 03 42 00 03 04 e6 01 9a 01 05
E: 34.860595 32 01 03 00 c0 00 95 00 03 01 42 01 0d 02 03 02 35 03 fa 01 03 03 90 03 44 00 03 04 e2 01 9d 01 05
E: 34.878504 32 01 03 00 bf 00 96 00 03 01 42 01 0d 02 03 02 35 03 fa 01 03 03 8f 03 46 00 03 04 e1 01 9e 01 05
E: 34.896539 32 01 03 00 bf 00 96 00 03 01 42 01 0e 02 03 02 35 03 fa 01 03 03 8f 03 48 00 03 04 e1 01 9f 01 05
E: 34.913587 32 01 03 00 c0 00 96 00 03 01 43 01 0e 02 03 02 35 03 fa 01 03 03 8c 03 4b 00 03 04 e2 01 a0 01 05
E: 34.932568 32 01 03 00 c5 00 94 00 03 01 46 01 0e 02 03 02 34 03 fb 01 03 03 89 03 4d 00 03 04 e5 01 a0 01 05
E: 34.949499 32 01 03 00 cb 00 91 00 03 01 4b 01 0c 02 03 02 2f 03 fc 01 03 03 85 03 4f 00 03 04 f7 01 96 01 05
E: 34.967509 32 01 03 00 d1 00 8d 00 03 01 51 01 0a 02 03 02 29 03 fd 01 03 03 80 03 52 00 03 04 fd 01 93 01 05
E: 34.985512 32 01 03 00 d6 00 89 00 03 01 55 01 06 02 03 02 22 03 fe 01 03 03 7a 03 53 00 03 04 04 02 90 01 05
E: 35.003532 32 01 03 00 db 00 85 00 03 01 57 01 02 02 03 02 1b 03 ff 01 03 03 74 03 54 00 03 04 17 02 98 01 05
E: 35.020521 32 01 03 00 df 00 82 00 03 01 59 01 01 02 03 02 13 03 00 02 03 03 6d 03 55 00 03 04 1b 02 9a 01 05
E: 35.038515 32 01 03 00 e0 00 81 00 03 01 5a 01 ff 01 03 02 0c 03 00 02 03 03 6b 03 55 00 03 04 1b 02 9a 01 05
E: 35.055506 32 01 03 00 e1 00 80 00 03 01 5b 01 fe 01 03 02 0a 03 00 02 03 03 68 03 54 00 03 04 1c 02 9a 01 05
E: 35.073497 32 01 03 00 e1 00 80 00 03 01 5c 01 fd 01 03 02 07 03 00 02 03 03 67 03 54 00 03 04 1c 02 9b 01 05
E: 35.091489 32 01 03 00 e1 00 80 00 03 01 5c 01 fd 01 03 02 06 03 00 02 03 03 66 03 55 00 03 04 1c 02 9b 01 05
E: 35.108480 32 01 03 00 e0 00 80 00 03 01 5d 01 fd 01 03 02 06 03 00 02 03 03 66 03 55 00 03 04 1d 02 9c 01 05
E: 35.126413 32 01 03 00 dd 00 84 00 03 01 5b 01 fe 01 03 02 07 03 ff 01 03 03 66 03 55 00 03 04 1e 02 9d 01 05
E: 35.144426 32 01 03 00 d6 00 89 00 03 01 57 01 01 02 03 02 0c 03 fe 01 03 03 6a 03 58 00 03 04 21 02 a1 01 05
E: 35.161454 32 01 03 00 c7 00 95 00 03 01 51 01 05 02 03 02 13 03 fe 01 03 03 6f 03 5b 00 03 04 39 02 ac 01 05
E: 35.179443 32 01 03 00 bb 00 a0 00 03 01 42 01 0f 02 03 02 1a 03 fe 01 03 03 74 03 5e 00 03 04 4a 02 b3 01 05
E: 35.197434 32 01 03 00 b6 00 a4 00 03 01 3c 01 13 02 03 02 21 03 fe 01 03 03 7a 03 60 00 03 04 51 02 b5 01 05
E: 35.214424 32 01 03 00 b2 00 a8 00 03 01 38 01 16 02 03 02 26 03 fe 01 03 03 7e 03 62 00 03 04 56 02 b6 01 05
E: 35.232415 32 01 03 00 b1 00 a9 00 03 01 37 01 18 02 03 02 29 03 fe 01 03 03 80 03 63 00 03 04 58 02 b6 01 05
E: 35.250361 32 01 03 00 b0 00 aa 00 03 01 36 01 19 02 03 02 2a 03 fe 01 03 03 80 03 63 00 03 04 59 02 b7 01 05
E: 35.268385 32 01 03 00 b0 00 a9 00 03 01 36 01 19 02 03 02 2a 03 fe 01 03 03 80 03 63 00 03 04 5a 02 b7 01 05
E: 35.286357 32 01 03 00 b1 00 a9 00 03 01 36 01 19 02 03 02 2a 03 fe 01 03 03 7f 03 63 00 03 04 5a 02 b7 01 05
E: 35.303275 32 01 03 00 b2 00 a8 00 03 01 36 01 19 02 03 02 29 03 fe 01 03 03 7e 03 62 00 03 04 59 02 b7 01 05
E: 35.322372 32 01 03 00 b3 00 a6 00 03 01 36 01 19 02 03 02 27 03 ff 01 03 03 7d 03 61 00 03 04 59 02 b7 01 05
E: 35.339362 32 01 03 00 b4 00 a5 00 03 01 36 01 19 02 03 02 25 03 ff 01 03 03 7c 03 61 00 03 04 59 02 b7 01 05
E: 35.357354 32 01 03 00 b5 00 a4 00 03 01 37 01 18 02 03 02 23 03 00 02 03 03 7b 03 60 00 03 04 58 02 b7 01 05
E: 35.374297 32 01 03 00 b6 00 a2 00 03 01 37 01 18 02 03 02 22 03 00 02 03 03 7a 03 60 00 03 04 57 02 b6 01 05
E: 35.393232 32 01 03 00 b7 00 a1 00 03 01 37 01 18 02 03 02 20 03 01 02 03 03 79 03 60 00 03 04 55 02 b6 01 05
E: 35.410325 32 01 03 00 b8 00 a1 00 03 01 38 01 17 02 03 02 1e 03 01 02 03 03 78 03 60 00 03 04 54 02 b6 01 05
E: 35.428313 32 01 03 00 b8 00 9f 00 03 01 38 01 16 02 03 02 1c 03 01 02 03 03 78 03 5f 00 03 04 41 02 b1 01 05
E: 35.446320 32 01 03 00 b9 00 9e 00 03 01 39 01 15 02 03 02 1a 03 02 02 03 03 78 03 5f 00 03 04 3b 02 af 01 05
E: 35.464294 32 01 03 00 ba 00 9e 00 03 01 3a 01 14 02 03 02 18 03 03 02 03 03 77 03 5f 00 03 04 36 02 ad 01 05
E: 35.482289 32 01 03 00 ba 00 9d 00 03 01 3a 01 14 02 03 02 16 03 03 02 03 03 77 03 5f 00 03 04 35 02 ac 01 05
E: 35.500276 32 01 03 00 bb 00 9d 00 03 01 3a 01 14 02 03 02 14 03 03 02 03 03 76 03 5f 00 03 04 33 02 ac 01 05
E: 35.517265 32 01 03 00 bb 00 9d 00 03 01 3b 01 13 02 03 02 13 03 03 02 03 03 76 03 5f 00 03 04 32 02 ab 01 05
E: 35.535260 32 01 03 00 bb 00 9c 00 03 01 3b 01 13 02 03 02 12 03 03 02 03 03 75 03 5f 00 03 04 31 02 ab 01 05
E: 35.553214 32 01 03 00 bb 00 9c 00 03 01 3b 01 12 02 03 02 11 03 03 02 03 03 75 03 5f 00 03 04 2f 02 aa 01 05
E: 35.571178 32 01 03 00 bb 00 9c 00 03 01 3b 01 12 02 03 02 10 03 04 02 03 03 74 03 5f 00 03 04 2e 02 a9 01 05
E: 35.588239 32 01 03 00 bb 00 9b 00 03 01 3b 01 11 02 03 02 0f 03 04 02 03 03 74 03 5f 00 03 04 2d 02 a9 01 05
E: 35.606186 32 01 03 00 bb 00 9b 00 03 01 3b 01 11 02 03 02 0e 03 04 02 03 03 74 03 5f 00 03 04 2c 02 a9 01 05
E: 35.624224 32 01 03 00 bc 00 9b 00 03 01 3b 01 11 02 03 02 0c 03 04 02 03 03 74 03 5f 00 03 04 2b 02 a8 01 05
E: 35.642212 32 01 03 00 bc 00 9b 00 03 01 3d 01 10 02 03 02 0b 03 04 02 03 03 73 03 5f 00 03 04 2a 02 a8 01 05
E: 35.659202 32 01 03 00 bc 00 9b 00 03 01 3e 01 0f 02 03 02 09 03 05 02 03 03 73 03 5f 00 03 04 2a 02 a7 01 05
E: 35.676147 32 01 03 00 bc 00 9b 00 03 01 40 01 0f 02 03 02 08 03 07 02 03 03 73 03 5f 00 03 04 29 02 a8 01 05
E: 35.690185 32 01 03 00 bb 00 9d 00 00 01 40 01 0f 02 00 02 08 03 07 02 00 03 73 03 5f 00 00 04 29 02 a8 01 01
E: 35.708174 32 01 03 00 bb 00 9d 00 00 0f ff 0f ff 0f 00 0f ff 0f ff 0f 00 0f ff 0f ff 0f 00 0f ff 0f ff 0f 01
E: 35.724168 32 01 00 00 bb 00 9d 00 00 0f ff 0f ff 0f 00 0f ff 0f ff 0f 00 0f ff 0f ff 0f 00 0f ff 0f ff 0f 01
# Thank you.
