R: 177 05 0d 09 04 a1 01 85 01 09 22 a1 02 09 42 15 00 25 01 75 01 95 01 81 02 09 32 81 02 09 47 81 02 95 05 81 03 09 51 75 08 95 01 81 02 05 01 35 00 55 0e 65 33 75 10 95 01 09 30 26 ff 4b 46 70 03 81 02 09 31 26 ff 2b 46 f1 01 81 02 46 00 00 c0 a1 02 05 0d 09 42 15 00 25 01 75 01 95 01 81 02 09 32 81 02 09 47 81 02 95 05 81 03 09 51 75 08 95 01 81 02 05 01 35 00 55 0e 65 33 75 10 95 01 09 30 26 ff 4b 46 70 03 81 02 09 31 26 ff 2b 46 f1 01 81 02 46 00 00 c0 05 0d 09 54 75 08 95 01 81 02 05 0d 85 02 09 55 25 02 75 08 95 01 b1 02 c0
N: Hanvon 10.1
I: 3 20b3 0a18
E: 670.916409 14 01 07 00 e3 17 a5 0d 00 ff ff ff ff ff 01
E: 670.924409 14 01 07 00 e4 17 a8 0d 00 ff ff ff ff ff 01
E: 670.932412 14 01 07 00 e6 17 b1 0d 00 ff ff ff ff ff 01
E: 670.940412 14 01 07 00 ea 17 b9 0d 00 ff ff ff ff ff 01
E: 670.948415 14 01 07 00 f1 17 c4 0d 00 ff ff ff ff ff 01
E: 670.956410 14 01 07 00 fd 17 d3 0d 00 ff ff ff ff ff 01
E: 670.960409 14 01 07 00 0f 18 ea 0d 00 ff ff ff ff ff 01
E: 670.968404 14 01 07 00 3f 18 12 0e 00 ff ff ff ff ff 01
E: 670.976407 14 01 07 00 79 18 4d 0e 00 ff ff ff ff ff 01
E: 670.984431 14 01 07 00 cb 18 a4 0e 00 ff ff ff ff ff 01
E: 670.992533 14 01 07 00 18 19 fa 0e 00 ff ff ff ff ff 01
E: 671.000429 14 01 07 00 60 19 51 0f 00 ff ff ff ff ff 01
E: 671.008409 14 01 07 00 aa 19 b0 0f 00 ff ff ff ff ff 01
E: 671.016406 14 01 07 00 28 1a 32 10 00 ff ff ff ff ff 01
E: 671.020516 14 01 07 00 86 1a 94 10 00 ff ff ff ff ff 01
E: 671.028395 14 01 07 00 e1 1a f4 10 00 ff ff ff ff ff 01
E: 671.036317 14 01 07 00 30 1b 54 11 00 ff ff ff ff ff 01
E: 671.044332 14 01 07 00 83 1b bc 11 00 ff ff ff ff ff 01
E: 671.052356 14 01 07 00 0a 1c 4d 12 00 ff ff ff ff ff 01
E: 671.060409 14 01 07 00 8c 1c ce 12 00 ff ff ff ff ff 01
E: 671.068406 14 01 07 00 e6 1c 2b 13 00 ff ff ff ff ff 01
E: 671.076411 14 01 07 00 39 1d 91 13 00 ff ff ff ff ff 01
E: 671.080553 14 01 07 00 a8 1d 27 14 00 ff ff ff ff ff 01
E: 671.088495 14 01 07 00 37 1e ae 14 00 ff ff ff ff ff 01
E: 671.096422 14 01 07 00 b9 1e 2d 15 00 ff ff ff ff ff 01
E: 671.104410 14 01 07 00 0e 1f 92 15 00 ff ff ff ff ff 01
E: 671.112396 14 01 07 00 7b 1f 27 16 00 ff ff ff ff ff 01
E: 671.120405 14 01 07 00 02 20 a9 16 00 ff ff ff ff ff 01
E: 671.128411 14 01 07 00 86 20 25 17 00 ff ff ff ff ff 01
E: 671.136455 14 01 07 00 e3 20 81 17 00 ff ff ff ff ff 01
E: 671.140535 14 01 07 00 3b 21 ee 17 00 ff ff ff ff ff 01
E: 671.148511 14 01 07 00 98 21 5c 18 00 ff ff ff ff ff 01
E: 671.156530 14 01 07 00 32 22 e0 18 00 ff ff ff ff ff 01
E: 671.164413 14 01 07 00 b6 22 5e 19 00 ff ff ff ff ff 01
E: 671.172410 14 01 07 00 0a 23 bb 19 00 ff ff ff ff ff 01
E: 671.180414 14 01 07 00 6f 23 4c 1a 00 ff ff ff ff ff 01
E: 671.188418 14 01 07 00 b9 23 af 1a 00 ff ff ff ff ff 01
E: 671.196409 14 01 07 00 1c 24 0b 1b 00 ff ff ff ff ff 01
E: 671.200492 14 01 07 00 7a 24 66 1b 00 ff ff ff ff ff 01
E: 671.208408 14 01 07 00 d0 24 b9 1b 00 ff ff ff ff ff 01
E: 671.216407 14 01 07 00 19 25 18 1c 00 ff ff ff ff ff 01
E: 671.224411 14 01 07 00 55 25 6f 1c 00 ff ff ff ff ff 01
E: 671.232406 14 01 07 00 7a 25 aa 1c 00 ff ff ff ff ff 01
E: 671.240410 14 01 07 00 9e 25 df 1c 00 ff ff ff ff ff 01
E: 671.248410 14 01 07 00 b4 25 fe 1c 00 ff ff ff ff ff 01
E: 671.256406 14 01 07 00 cb 25 1c 1d 00 ff ff ff ff ff 01
E: 671.264416 14 01 07 00 e0 25 37 1d 00 ff ff ff ff ff 01
E: 671.268412 14 01 07 00 f3 25 50 1d 00 ff ff ff ff ff 01
E: 671.276517 14 01 07 00 06 26 65 1d 00 ff ff ff ff ff 01
E: 671.284404 14 01 07 00 15 26 78 1d 00 ff ff ff ff ff 01
E: 671.292411 14 01 07 00 23 26 88 1d 00 ff ff ff ff ff 01
E: 671.300424 14 01 07 00 30 26 97 1d 00 ff ff ff ff ff 01
E: 671.308410 14 01 07 00 3c 26 a4 1d 00 ff ff ff ff ff 01
E: 671.316412 14 01 07 00 45 26 af 1d 00 ff ff ff ff ff 01
E: 671.324411 14 01 07 00 4d 26 b9 1d 00 ff ff ff ff ff 01
E: 671.328504 14 01 07 00 54 26 c1 1d 00 ff ff ff ff ff 01
E: 671.336404 14 01 07 00 5b 26 c8 1d 00 ff ff ff ff ff 01
E: 671.344413 14 01 07 00 61 26 ce 1d 00 ff ff ff ff ff 01
E: 671.352409 14 01 07 00 67 26 d4 1d 00 ff ff ff ff ff 01
E: 671.360411 14 01 07 00 67 26 d4 1d 00 ff ff ff ff ff 01
E: 671.368401 14 01 07 00 67 26 d4 1d 00 ff ff ff ff ff 01
E: 671.376408 14 01 06 00 67 26 d4 1d 00 ff ff ff ff ff 01
E: 672.156410 14 01 07 00 fb 17 7b 0e 00 ff ff ff ff ff 01
E: 672.164404 14 01 07 00 fb 17 79 0e 00 ff ff ff ff ff 01
E: 672.172407 14 01 07 00 fb 17 78 0e 00 ff ff ff ff ff 01
E: 672.180410 14 01 07 00 fb 17 76 0e 00 ff ff ff ff ff 01
E: 672.188405 14 01 07 00 fb 17 74 0e 00 ff ff ff ff ff 01
E: 672.196413 14 01 07 00 fb 17 74 0e 00 ff ff ff ff ff 01
E: 672.200445 14 01 07 00 fe 17 75 0e 00 ff ff ff ff ff 01
E: 672.208312 14 01 07 00 01 18 7c 0e 00 ff ff ff ff ff 01
E: 672.216377 14 01 07 00 04 18 85 0e 00 ff ff ff ff ff 01
E: 672.224524 14 01 07 00 09 18 95 0e 00 ff ff ff ff ff 01
E: 672.232323 14 01 07 00 11 18 aa 0e 00 ff ff ff ff ff 01
E: 672.240323 14 01 07 00 1b 18 c4 0e 00 ff ff ff ff ff 01
E: 672.248401 14 01 07 00 29 18 e0 0e 00 ff ff ff ff ff 01
E: 672.256411 14 01 07 00 3b 18 fd 0e 00 ff ff ff ff ff 01
E: 672.260498 14 01 07 00 65 18 29 0f 00 ff ff ff ff ff 01
E: 672.268400 14 01 07 00 96 18 54 0f 00 ff ff ff ff ff 01
E: 672.276398 14 01 07 00 c7 18 7e 0f 00 ff ff ff ff ff 01
E: 672.284406 14 01 07 00 f4 18 aa 0f 00 ff ff ff ff ff 01
E: 672.292405 14 01 07 00 1a 19 d7 0f 00 ff ff ff ff ff 01
E: 672.300424 14 01 07 00 3e 19 08 10 00 ff ff ff ff ff 01
E: 672.308403 14 01 07 00 62 19 40 10 00 ff ff ff ff ff 01
E: 672.316407 14 01 07 00 86 19 7a 10 00 ff ff ff ff ff 01
E: 672.324407 14 01 07 00 a4 19 b1 10 00 ff ff ff ff ff 01
E: 672.328549 14 01 07 00 bf 19 e4 10 00 ff ff ff ff ff 01
E: 672.336401 14 01 07 00 d3 19 03 11 00 ff ff ff ff ff 01
E: 672.344407 14 01 07 00 f4 19 33 11 00 ff ff ff ff ff 01
E: 672.352408 14 01 07 00 0b 1a 50 11 00 ff ff ff ff ff 01
E: 672.360406 14 01 07 00 40 1a 7d 11 00 ff ff ff ff ff 01
E: 672.368407 14 01 07 00 79 1a a8 11 00 ff ff ff ff ff 01
E: 672.376406 14 01 07 00 ae 1a d1 11 00 ff ff ff ff ff 01
E: 672.384402 14 01 07 00 de 1a fb 11 00 ff ff ff ff ff 01
E: 672.388521 14 01 07 00 07 1b 2e 12 00 ff ff ff ff ff 01
E: 672.396402 14 01 07 00 2c 1b 63 12 00 ff ff ff ff ff 01
E: 672.404406 14 01 07 00 52 1b 99 12 00 ff ff ff ff ff 01
E: 672.412408 14 01 07 00 74 1b ca 12 00 ff ff ff ff ff 01
E: 672.420398 14 01 07 00 89 1b e7 12 00 ff ff ff ff ff 01
E: 672.428400 14 01 07 00 9b 1b 04 13 00 ff ff ff ff ff 01
E: 672.436401 14 01 07 00 ae 1b 21 13 00 ff ff ff ff ff 01
E: 672.444403 14 01 07 00 c2 1b 3d 13 00 ff ff ff ff ff 01
E: 672.448401 14 01 07 00 d6 1b 59 13 00 ff ff ff ff ff 01
E: 672.456407 14 01 07 00 eb 1b 75 13 00 ff ff ff ff ff 01
E: 672.464405 14 01 07 00 11 1c 9f 13 00 ff ff ff ff ff 01
E: 672.472401 14 01 07 00 3c 1c c7 13 00 ff ff ff ff ff 01
E: 672.480407 14 01 07 00 6e 1c ee 13 00 ff ff ff ff ff 01
E: 672.488405 14 01 07 00 9a 1c 12 14 00 ff ff ff ff ff 01
E: 672.496400 14 01 07 00 c4 1c 38 14 00 ff ff ff ff ff 01
E: 672.508404 14 01 07 00 97 1d 25 15 07 01 ed 25 61 0e 02
E: 672.524405 14 01 07 00 9a 1d 2e 15 07 01 ee 25 6c 0e 02
E: 672.528397 14 01 07 00 9a 1d 2e 15 07 01 ee 25 6c 0e 02
E: 672.548404 14 01 07 00 9d 1d 46 15 07 01 f1 25 7b 0e 02
E: 672.556398 14 01 07 00 9d 1d 46 15 07 01 f1 25 7b 0e 02
E: 672.572403 14 01 07 00 b0 1d 6a 15 07 01 fb 25 b4 0e 02
E: 672.580401 14 01 07 00 b0 1d 6a 15 07 01 fb 25 b4 0e 02
E: 672.596404 14 01 07 00 d3 1d bb 15 07 01 19 26 ee 0e 02
E: 672.604400 14 01 07 00 d3 1d bb 15 07 01 19 26 ee 0e 02
E: 672.620404 14 01 07 00 d3 1d bb 15 07 01 19 26 ee 0e 02
E: 672.636409 14 01 07 00 87 1e 60 16 07 01 b4 26 ae 0f 02
E: 672.640382 14 01 07 00 87 1e 60 16 07 01 b4 26 ae 0f 02
E: 672.660408 14 01 07 00 ef 1e b9 16 07 01 13 27 44 10 02
E: 672.668404 14 01 07 00 ef 1e b9 16 07 01 13 27 44 10 02
E: 672.684401 14 01 07 00 4c 1f 2a 17 07 01 61 27 ce 10 02
E: 672.692404 14 01 07 00 4c 1f 2a 17 07 01 61 27 ce 10 02
E: 672.708402 14 01 07 00 c3 1f d6 17 07 01 cc 27 aa 11 02
E: 672.716403 14 01 07 00 c3 1f d6 17 07 01 cc 27 aa 11 02
E: 672.736405 14 01 07 00 69 20 63 18 07 01 66 28 73 12 02
E: 672.744273 14 01 07 00 69 20 63 18 07 01 66 28 73 12 02
E: 672.760408 14 01 07 00 e3 20 f8 18 07 01 de 28 b7 12 02
E: 672.768399 14 01 07 00 e3 20 f8 18 07 01 de 28 b7 12 02
E: 672.784402 14 01 07 00 4e 21 73 19 07 01 3e 29 08 13 02
E: 672.796404 14 01 07 00 da 21 cc 19 07 01 a7 29 5c 13 02
E: 672.804397 14 01 07 00 da 21 cc 19 07 01 a7 29 5c 13 02
E: 672.820403 14 01 07 00 62 22 1e 1a 07 01 1a 2a b6 13 02
E: 672.836407 14 01 07 00 e1 22 93 1a 07 01 99 2a 10 14 02
E: 672.840404 14 01 07 00 e1 22 93 1a 07 01 99 2a 10 14 02
E: 672.860409 14 01 07 00 42 23 eb 1a 07 01 f7 2a 8f 14 02
E: 672.868397 14 01 07 00 42 23 eb 1a 07 01 f7 2a 8f 14 02
E: 672.884401 14 01 07 00 42 23 eb 1a 07 01 f7 2a 8f 14 02
E: 672.892397 14 01 07 01 31 2c db 15 06 00 42 23 eb 1a 02
E: 672.900416 14 01 07 01 30 2c dd 15 06 00 42 23 eb 1a 02
E: 672.908402 14 01 07 01 30 2c e1 15 06 00 42 23 eb 1a 02
E: 672.912401 14 01 07 01 33 2c e8 15 06 00 42 23 eb 1a 02
E: 672.920397 14 01 07 01 39 2c f0 15 06 00 42 23 eb 1a 02
E: 672.928403 14 01 07 01 43 2c fc 15 06 00 42 23 eb 1a 02
E: 672.936405 14 01 07 01 5b 2c 0c 16 06 00 42 23 eb 1a 02
E: 672.944403 14 01 07 01 8d 2c 29 16 06 00 42 23 eb 1a 02
E: 672.952397 14 01 07 01 bc 2c 4d 16 06 00 42 23 eb 1a 02
E: 672.960522 14 01 07 01 e6 2c 77 16 06 00 42 23 eb 1a 02
E: 672.968306 14 01 07 01 0e 2d a4 16 06 00 42 23 eb 1a 02
E: 672.976322 14 01 07 01 38 2d d2 16 06 00 42 23 eb 1a 02
E: 672.980504 14 01 07 01 62 2d fe 16 06 00 42 23 eb 1a 02
E: 672.988403 14 01 07 01 86 2d 28 17 06 00 42 23 eb 1a 02
E: 672.996401 14 01 07 01 9d 2d 42 17 06 00 42 23 eb 1a 02
E: 673.004400 14 01 07 01 c2 2d 6c 17 06 00 42 23 eb 1a 02
E: 673.012400 14 01 07 01 e9 2d 96 17 06 00 42 23 eb 1a 02
E: 673.020400 14 01 07 01 1b 2e c1 17 06 00 42 23 eb 1a 02
E: 673.028401 14 01 07 01 6f 2e fb 17 06 00 42 23 eb 1a 02
E: 673.036414 14 01 07 01 a8 2e 25 18 06 00 42 23 eb 1a 02
E: 673.040407 14 01 07 01 d5 2e 58 18 06 00 42 23 eb 1a 02
E: 673.048399 14 01 07 01 02 2f 89 18 06 00 42 23 eb 1a 02
E: 673.056398 14 01 07 01 2e 2f b8 18 06 00 42 23 eb 1a 02
E: 673.064400 14 01 07 01 58 2f e7 18 06 00 42 23 eb 1a 02
E: 673.072402 14 01 07 01 7d 2f 13 19 06 00 42 23 eb 1a 02
E: 673.080397 14 01 07 01 a3 2f 3d 19 06 00 42 23 eb 1a 02
E: 673.088403 14 01 07 01 ca 2f 65 19 06 00 42 23 eb 1a 02
E: 673.096404 14 01 07 01 f7 2f 8e 19 06 00 42 23 eb 1a 02
E: 673.104397 14 01 07 01 54 30 c6 19 06 00 42 23 eb 1a 02
E: 673.108395 14 01 07 01 a8 30 fe 19 06 00 42 23 eb 1a 02
E: 673.116397 14 01 07 01 da 30 2c 1a 06 00 42 23 eb 1a 02
E: 673.124405 14 01 07 01 08 31 5a 1a 06 00 42 23 eb 1a 02
E: 673.132403 14 01 07 01 36 31 89 1a 06 00 42 23 eb 1a 02
E: 673.140398 14 01 07 01 62 31 b8 1a 06 00 42 23 eb 1a 02
E: 673.148405 14 01 07 01 86 31 e5 1a 06 00 42 23 eb 1a 02
E: 673.156402 14 01 07 01 ab 31 0d 1b 06 00 42 23 eb 1a 02
E: 673.164404 14 01 07 01 c2 31 27 1b 06 00 42 23 eb 1a 02
E: 673.168528 14 01 07 01 e9 31 4d 1b 06 00 42 23 eb 1a 02
E: 673.176400 14 01 07 01 03 32 64 1b 06 00 42 23 eb 1a 02
E: 673.184405 14 01 07 01 39 32 87 1b 06 00 42 23 eb 1a 02
E: 673.192402 14 01 07 01 70 32 a8 1b 06 00 42 23 eb 1a 02
E: 673.200416 14 01 07 01 a3 32 c6 1b 06 00 42 23 eb 1a 02
E: 673.208405 14 01 07 01 c2 32 d9 1b 06 00 42 23 eb 1a 02
E: 673.216405 14 01 07 01 df 32 ec 1b 06 00 42 23 eb 1a 02
E: 673.224403 14 01 07 01 f6 32 ff 1b 06 00 42 23 eb 1a 02
E: 673.228419 14 01 07 01 0c 33 12 1c 06 00 42 23 eb 1a 02
E: 673.236400 14 01 07 01 1f 33 23 1c 06 00 42 23 eb 1a 02
E: 673.244398 14 01 07 01 32 33 35 1c 06 00 42 23 eb 1a 02
E: 673.252397 14 01 07 01 42 33 43 1c 06 00 42 23 eb 1a 02
E: 673.260402 14 01 07 01 50 33 53 1c 06 00 42 23 eb 1a 02
E: 673.268402 14 01 07 01 5d 33 60 1c 06 00 42 23 eb 1a 02
E: 673.276405 14 01 07 01 69 33 6b 1c 06 00 42 23 eb 1a 02
E: 673.284399 14 01 07 01 73 33 76 1c 06 00 42 23 eb 1a 02
E: 673.292401 14 01 07 01 7c 33 7e 1c 06 00 42 23 eb 1a 02
E: 673.296415 14 01 07 01 87 33 86 1c 06 00 42 23 eb 1a 02
E: 673.304410 14 01 07 01 87 33 86 1c 06 00 42 23 eb 1a 02
E: 673.312402 14 01 07 01 87 33 86 1c 06 00 42 23 eb 1a 02
E: 673.320395 14 01 06 01 87 33 86 1c 06 00 42 23 eb 1a 02
