R: 281 05 0d 09 04 a1 01 85 0a 09 22 a1 00 09 42 09 32 15 00 25 01 95 02 75 01 81 02 95 06 81 03 05 01 26 ff 1f 75 10 95 01 55 0d 65 33 09 31 35 00 46 61 13 81 02 09 30 46 73 22 81 02 05 0d 75 08 95 01 09 30 26 ff 00 81 02 09 51 81 02 85 0c 09 55 25 02 95 01 b1 02 c0 06 00 ff 85 02 09 01 75 08 95 07 b1 02 85 03 09 02 75 08 95 07 b1 02 85 04 09 03 75 08 95 07 b1 02 85 05 09 04 75 08 95 07 b1 02 85 06 09 05 75 08 96 27 00 b1 02 85 07 09 06 75 08 96 27 00 b1 02 85 08 09 07 75 08 95 07 b1 02 85 09 09 08 75 08 95 07 b1 02 85 0b 09 09 75 08 96 07 00 b1 02 85 0d 09 0a 75 08 96 27 00 b1 02 c0 09 0e a1 01 85 0e 09 52 09 53 95 07 b1 02 c0 05 01 09 02 a1 01 85 01 09 01 a1 00 05 09 19 01 29 02 15 00 25 01 75 01 95 02 81 02 75 06 95 01 81 01 05 01 09 31 09 30 15 00 27 ff 1f 00 00 75 10 95 02 81 02 c0 09 01 a1 02 15 00 26 ff 00 95 02 75 08 81 03 c0 c0
N: IDEACOM  IDC 6650
I: 3 1cb6 6650
# 1. Drag _one_ finger on the screen from one corner to the opposite, and release it.
E: 0.000000 8 0a 00 ec 1e e4 00 5e 01
E: 0.007991 8 0a 03 ec 1e e6 00 5c 01
E: 0.015951 8 0a 03 ec 1e e8 00 5e 01
E: 0.023928 8 0a 03 ec 1e e8 00 60 01
E: 0.032980 8 0a 03 ec 1e ea 00 62 01
E: 0.041119 8 0a 03 f0 1e ec 00 64 01
E: 0.049297 8 0a 03 f2 1e ee 00 68 01
E: 0.057075 8 0a 03 f6 1e f0 00 6c 01
E: 0.065461 8 0a 03 f8 1e f2 00 70 01
E: 0.073223 8 0a 03 fa 1e f8 00 74 01
E: 0.081072 8 0a 03 fa 1e fe 00 78 01
E: 0.089048 8 0a 03 fa 1e 06 01 7a 01
E: 0.098085 8 0a 03 f8 1e 14 01 76 01
E: 0.106896 8 0a 03 f4 1e 22 01 78 01
E: 0.116082 8 0a 03 f0 1e 36 01 7a 01
E: 0.125038 8 0a 03 ea 1e 4a 01 7c 01
E: 0.132939 8 0a 03 e2 1e 64 01 80 01
E: 0.141057 8 0a 03 da 1e 7a 01 84 01
E: 0.209749 8 0a 03 d2 1e 98 01 88 01
E: 0.209984 8 0a 03 c8 1e b4 01 8a 01
E: 0.210185 8 0a 03 bc 1e d6 01 8c 01
E: 0.210433 8 0a 03 a6 1e fc 01 8e 01
E: 0.210616 8 0a 03 92 1e 20 02 8c 01
E: 0.210735 8 0a 03 7a 1e 48 02 8a 01
E: 0.210853 8 0a 03 60 1e 70 02 8c 01
E: 0.218990 8 0a 03 46 1e 9c 02 90 01
E: 0.227014 8 0a 03 22 1e d2 02 92 01
E: 0.237965 8 0a 03 fc 1d 0a 03 8e 01
E: 0.247070 8 0a 03 d2 1d 42 03 8e 01
E: 0.255952 8 0a 03 a6 1d 86 03 90 01
E: 0.265025 8 0a 03 72 1d c4 03 92 01
E: 0.273976 8 0a 03 40 1d 0a 04 92 01
E: 0.282012 8 0a 03 02 1d 48 04 8c 01
E: 0.302047 8 0a 03 d0 1c 8c 04 8e 01
E: 0.310118 8 0a 03 9c 1c cc 04 90 01
E: 0.318802 8 0a 03 5a 1c 1a 05 92 01
E: 0.326953 8 0a 03 1c 1c 66 05 94 01
E: 0.338010 8 0a 03 dc 1b b6 05 90 01
E: 0.348997 8 0a 03 9a 1b 06 06 8c 01
E: 0.359931 8 0a 03 52 1b 5e 06 8c 01
E: 0.367934 8 0a 03 0c 1b b2 06 8e 01
E: 0.376421 8 0a 03 ba 1a 0c 07 8e 01
E: 0.385808 8 0a 03 6c 1a 66 07 8e 01
E: 0.393092 8 0a 03 1c 1a c0 07 8e 01
E: 0.401036 8 0a 03 d2 19 1a 08 8a 01
E: 0.409078 8 0a 03 8a 19 70 08 84 01
E: 0.433222 8 0a 03 48 19 c2 08 82 01
E: 0.441007 8 0a 03 fc 18 18 09 7c 01
E: 0.449167 8 0a 03 aa 18 86 09 7c 01
E: 0.457129 8 0a 03 58 18 e8 09 7a 01
E: 0.470126 8 0a 03 04 18 58 0a 74 01
E: 0.479009 8 0a 03 b2 17 b6 0a 72 01
E: 0.487009 8 0a 03 58 17 22 0b 72 01
E: 0.496007 8 0a 03 fe 16 82 0b 6c 01
E: 0.505093 8 0a 03 ac 16 e6 0b 68 01
E: 0.515988 8 0a 03 60 16 42 0c 64 01
E: 0.524149 8 0a 03 0c 16 9c 0c 64 01
E: 0.533116 8 0a 03 be 15 f6 0c 66 01
E: 0.540974 8 0a 03 72 15 56 0d 64 01
E: 0.549527 8 0a 03 28 15 ac 0d 64 01
E: 0.571251 8 0a 03 de 14 08 0e 66 01
E: 0.579179 8 0a 03 92 14 5e 0e 66 01
E: 0.587135 8 0a 03 40 14 ca 0e 66 01
E: 0.599104 8 0a 03 f2 13 28 0f 62 01
E: 0.607243 8 0a 03 a2 13 8a 0f 60 01
E: 0.614947 8 0a 03 48 13 e8 0f 60 01
E: 0.623950 8 0a 03 f8 12 4e 10 5e 01
E: 0.632955 8 0a 03 aa 12 a8 10 5a 01
E: 0.646948 8 0a 03 5a 12 06 11 5d 01
E: 0.655055 8 0a 03 16 12 5a 11 58 01
E: 0.663038 8 0a 03 c0 11 b4 11 5a 01
E: 0.671072 8 0a 03 78 11 0c 12 5c 01
E: 0.679101 8 0a 03 2e 11 60 12 5c 01
E: 0.690973 8 0a 03 ec 10 ae 12 58 01
E: 0.700992 8 0a 03 a6 10 02 13 5a 01
E: 0.733210 8 0a 03 62 10 50 13 54 01
E: 0.742182 8 0a 03 1e 10 a4 13 4e 01
E: 0.749984 8 0a 03 c0 0f 16 14 4e 01
E: 0.758087 8 0a 03 6e 0f 7a 14 51 01
E: 0.766196 8 0a 03 0e 0f ec 14 54 01
E: 0.775788 8 0a 03 be 0e 52 15 4e 01
E: 0.802241 8 0a 03 6a 0e b8 15 51 01
E: 0.811943 8 0a 03 1e 0e 14 16 57 01
E: 0.818586 8 0a 03 bc 0d 84 16 5d 01
E: 0.826000 8 0a 03 6c 0d e6 16 5a 01
E: 0.836076 8 0a 03 16 0d 4c 17 5d 01
E: 0.845381 8 0a 03 ce 0c a2 17 5a 01
E: 0.853974 8 0a 03 82 0c fc 17 5d 01
E: 0.862970 8 0a 03 3e 0c 46 18 5d 01
E: 0.871859 8 0a 03 f8 0b 94 18 5a 01
E: 0.879952 8 0a 03 b2 0b d8 18 54 01
E: 0.893891 8 0a 03 74 0b 20 19 5a 01
E: 0.902927 8 0a 03 3a 0b 60 19 5d 01
E: 0.911927 8 0a 03 f8 0a a8 19 5a 01
E: 0.920027 8 0a 03 be 0a ec 19 5e 01
E: 0.928099 8 0a 03 86 0a 2c 1a 62 01
E: 0.935919 8 0a 03 4c 0a 6e 1a 66 01
E: 0.944078 8 0a 03 14 0a ac 1a 6a 01
E: 0.953180 8 0a 03 dc 09 ea 1a 6c 01
E: 0.963081 8 0a 03 a6 09 24 1b 68 01
E: 0.974132 8 0a 03 70 09 5a 1b 64 01
E: 0.986028 8 0a 03 3c 09 94 1b 68 01
E: 0.997368 8 0a 03 04 09 ca 1b 6c 01
E: 1.003394 8 0a 03 c8 08 08 1c 70 01
E: 1.011051 8 0a 03 8c 08 42 1c 74 01
E: 1.019128 8 0a 03 4e 08 80 1c 78 01
E: 1.026990 8 0a 03 14 08 b6 1c 7c 01
E: 1.038080 8 0a 03 d6 07 ee 1c 7c 01
E: 1.048965 8 0a 03 9e 07 20 1d 7c 01
E: 1.059250 8 0a 03 60 07 52 1d 76 01
E: 1.066905 8 0a 03 24 07 82 1d 7a 01
E: 1.076073 8 0a 03 e8 06 ae 1d 7e 01
E: 1.083958 8 0a 03 aa 06 e0 1d 82 01
E: 1.092134 8 0a 03 6e 06 10 1e 86 01
E: 1.100068 8 0a 03 32 06 40 1e 8a 01
E: 1.108001 8 0a 03 fc 05 6c 1e 8e 01
E: 1.116171 8 0a 03 cc 05 92 1e 92 01
E: 1.124104 8 0a 03 a4 05 b2 1e 96 01
E: 1.132082 8 0a 03 80 05 ce 1e 98 01
E: 1.140166 8 0a 03 62 05 e6 1e 9a 01
E: 1.149515 8 0a 03 4a 05 f8 1e 9c 01
E: 1.156869 8 0a 03 38 05 06 1f 9e 01
E: 1.165109 8 0a 03 28 05 12 1f a0 01
E: 1.172884 8 0a 03 1a 05 1c 1f a2 01
E: 1.180947 8 0a 03 0e 05 24 1f a4 01
E: 1.188925 8 0a 03 04 05 2a 1f a6 01
E: 1.196875 8 0a 03 fc 04 30 1f a8 01
E: 1.205058 8 0a 03 f4 04 32 1f aa 01
E: 1.212960 8 0a 03 ee 04 34 1f ac 01
E: 1.221932 8 0a 03 e4 04 34 1f ae 01
E: 1.230096 8 0a 03 e2 04 36 1f b0 01
E: 1.238058 8 0a 03 dc 04 36 1f b2 01
E: 1.246023 8 0a 03 da 04 36 1f b4 01
E: 1.254019 8 0a 03 d6 04 36 1f b6 01
E: 1.262052 8 0a 03 d4 04 36 1f b8 01
E: 1.269943 8 0a 03 d0 04 36 1f ba 01
E: 1.278077 8 0a 03 ce 04 36 1f bc 01
E: 1.286151 8 0a 03 ce 04 36 1f be 01
E: 1.295030 8 0a 03 ce 04 36 1f c0 01
E: 1.304085 8 0a 03 ce 04 36 1f c2 01
E: 1.310907 8 0a 03 ce 04 36 1f c4 01
E: 1.319215 8 0a 03 ce 04 36 1f c6 01
E: 1.326939 8 0a 03 ce 04 36 1f c8 01
E: 1.335024 8 0a 03 ce 04 36 1f ca 01
E: 1.342984 8 0a 03 ce 04 36 1f cc 01
E: 1.352034 8 0a 03 ce 04 36 1f ce 01
E: 1.359904 8 0a 03 ce 04 36 1f d0 01
E: 1.367983 8 0a 03 ce 04 36 1f d2 01
E: 1.375940 8 0a 03 ce 04 36 1f d4 01
E: 1.383951 8 0a 03 ce 04 36 1f d6 01
E: 1.391921 8 0a 03 ce 04 36 1f d8 01
E: 1.399883 8 0a 03 ce 04 36 1f da 01
E: 1.408895 8 0a 03 ce 04 36 1f dc 01
E: 1.416884 8 0a 03 ce 04 36 1f de 01
E: 1.425044 8 0a 03 ce 04 36 1f e0 01
E: 1.433136 8 0a 03 ce 04 36 1f e2 01
E: 1.441021 8 0a 03 ce 04 36 1f e4 01
E: 1.451235 8 0a 03 ce 04 36 1f e6 01
E: 1.457121 8 0a 03 ce 04 36 1f e8 01
E: 1.465087 8 0a 03 ce 04 36 1f ea 01
E: 1.474179 8 0a 03 ce 04 36 1f ec 01
E: 1.482274 8 0a 03 ce 04 36 1f ee 01
E: 1.489963 8 0a 03 ca 04 36 1f f0 01
E: 1.498867 8 0a 03 c2 04 36 1f f2 01
E: 1.506118 8 0a 03 bc 04 36 1f f4 01
E: 1.514130 8 0a 03 b8 04 34 1f f4 01
E: 1.521987 8 0a 03 b4 04 34 1f f4 01
E: 1.529887 8 0a 03 b2 04 32 1f f4 01
E: 1.557010 8 0a 03 b2 04 32 1f f4 01
E: 1.558644 8 0a 00 b2 04 32 1f f4 01
# 2. Land one finger,
   - land a second finger far enough from the first
   - move your two fingers
   - release the *first* finger
   - release the second finger
E: 11.000924 8 0a 00 dc 15 ec 14 d2 01
E: 11.008965 8 0a 03 de 15 e8 14 ae 01
E: 11.016848 8 0a 03 e0 15 e8 14 b4 01
E: 11.024953 8 0a 03 e2 15 e8 14 ba 01
E: 11.032841 8 0a 03 de 15 ea 14 c0 01
E: 11.040949 8 0a 03 de 15 ee 14 c6 01
E: 11.048959 8 0a 03 da 15 f0 14 ce 01
E: 11.056966 8 0a 03 d8 15 f4 14 d6 01
E: 11.064967 8 0a 03 d4 15 f8 14 de 01
E: 11.073054 8 0a 03 d4 15 fc 14 e6 01
E: 11.081967 8 0a 03 d2 15 00 15 ee 01
E: 11.089903 8 0a 03 d2 15 04 15 f6 01
E: 11.098026 8 0a 03 d0 15 06 15 fe 01
E: 11.105975 8 0a 03 d2 15 08 15 06 01
E: 11.113957 8 0a 03 d2 15 08 15 0e 01
E: 11.122515 8 0a 03 d2 15 08 15 16 01
E: 11.129962 8 0a 03 d2 15 08 15 20 01
E: 11.137923 8 0a 03 d2 15 08 15 20 01
E: 11.145841 8 0a 03 d2 15 08 15 20 01
E: 11.154979 8 0a 03 d2 15 08 15 20 01
E: 11.162924 8 0a 03 d2 15 08 15 20 01
E: 11.170934 8 0a 03 d2 15 08 15 20 01
E: 11.178907 8 0a 03 d2 15 08 15 20 01
E: 11.186925 8 0a 03 d2 15 08 15 20 01
E: 11.194885 8 0a 03 d2 15 08 15 20 01
E: 11.202914 8 0a 03 d2 15 08 15 20 01
E: 11.210907 8 0a 03 d2 15 08 15 20 01
E: 11.219920 8 0a 03 d2 15 08 15 20 01
E: 11.227917 8 0a 03 d2 15 08 15 20 01
E: 11.235912 8 0a 03 d2 15 08 15 20 01
E: 11.243887 8 0a 03 d2 15 08 15 20 01
E: 11.251926 8 0a 03 d2 15 08 15 20 01
E: 11.259908 8 0a 03 d2 15 08 15 20 01
E: 11.267915 8 0a 03 d2 15 08 15 20 01
E: 11.276259 8 0a 03 d2 15 08 15 20 01
E: 11.284929 8 0a 03 d2 15 08 15 20 01
E: 11.292896 8 0a 03 d2 15 08 15 20 01
E: 11.300926 8 0a 03 d2 15 08 15 20 01
E: 11.308917 8 0a 03 d2 15 08 15 20 01
E: 11.317724 8 0a 03 d2 15 08 15 20 01
E: 11.324921 8 0a 03 d2 15 08 15 20 01
E: 11.332940 8 0a 03 d2 15 08 15 20 01
E: 11.340943 8 0a 03 d2 15 08 15 20 01
E: 11.349918 8 0a 03 d2 15 08 15 20 01
E: 11.357919 8 0a 03 d2 15 08 15 20 01
E: 11.365897 8 0a 03 d2 15 08 15 20 01
E: 11.373880 8 0a 03 d2 15 08 15 20 01
E: 11.381919 8 0a 03 d2 15 08 15 20 01
E: 11.389949 8 0a 03 d2 15 08 15 20 01
E: 11.397895 8 0a 03 d2 15 08 15 20 01
E: 11.405916 8 0a 03 d2 15 08 15 20 01
E: 11.414898 8 0a 03 d2 15 08 15 20 01
E: 11.422929 8 0a 03 d2 15 08 15 20 01
E: 11.430942 8 0a 03 d2 15 08 15 20 01
E: 11.438925 8 0a 03 d2 15 08 15 20 01
E: 11.446923 8 0a 03 d2 15 08 15 20 01
E: 11.454965 8 0a 03 d4 15 0c 15 20 01
E: 11.462960 8 0a 03 d8 15 12 15 20 01
E: 11.470970 8 0a 03 da 15 14 15 20 01
E: 11.478580 8 0a 03 dc 15 16 15 20 01
E: 11.488791 8 0a 03 de 15 18 15 20 01
E: 11.496807 8 0a 03 de 15 18 15 00 01
E: 11.505070 8 0a 03 de 15 18 15 06 01
E: 11.512531 8 0a 03 de 15 18 15 0c 01
E: 11.519974 8 0a 03 de 15 18 15 12 01
E: 11.527961 8 0a 03 de 15 18 15 18 01
E: 11.535975 8 0a 03 de 15 18 15 1e 01
E: 11.543848 8 0a 03 de 15 18 15 24 01
E: 11.553041 8 0a 03 de 15 18 15 2a 01
E: 11.560966 8 0a 03 de 15 18 15 30 01
E: 11.568986 8 0a 03 de 15 18 15 36 01
E: 11.576943 8 0a 03 de 15 18 15 3c 01
E: 11.584940 8 0a 03 de 15 18 15 42 01
E: 11.592961 8 0a 03 de 15 18 15 48 01
E: 11.600970 8 0a 03 de 15 18 15 4e 01
E: 11.608909 8 0a 03 de 15 18 15 51 01
E: 11.617960 8 0a 03 de 15 18 15 54 01
E: 11.625944 8 0a 03 de 15 18 15 57 01
E: 11.634931 8 0a 03 de 15 18 15 5a 01
E: 11.642057 8 0a 03 de 15 18 15 5d 01
E: 11.650025 8 0a 03 de 15 18 15 58 01
E: 11.657839 8 0a 03 de 15 18 15 5a 01
E: 11.666023 8 0a 03 de 15 18 15 5c 01
E: 11.673953 8 0a 03 de 15 18 15 5e 01
E: 11.682962 8 0a 03 de 15 18 15 60 01
E: 11.690835 8 0a 03 de 15 18 15 62 01
E: 11.698874 8 0a 03 de 15 18 15 64 01
E: 11.706843 8 0a 03 de 15 18 15 66 01
E: 11.714955 8 0a 03 de 15 18 15 68 01
E: 11.722973 8 0a 03 de 15 18 15 6a 01
E: 11.731022 8 0a 03 de 15 18 15 6c 01
E: 11.739369 8 0a 03 de 15 18 15 6e 01
E: 11.748058 8 0a 03 de 15 18 15 70 01
E: 11.756039 8 0a 03 de 15 18 15 72 01
E: 11.763992 8 0a 03 e0 15 1c 15 74 01
E: 11.771953 8 0a 03 e2 15 1c 15 76 01
E: 11.779957 8 0a 03 e4 15 1e 15 78 01
E: 11.787956 8 0a 03 e6 15 1e 15 7a 01
E: 11.795936 8 0a 03 e6 15 20 15 7c 01
E: 11.803924 8 0a 03 e6 15 20 15 7e 01
E: 11.811934 8 0a 03 e6 15 20 15 80 01
E: 11.820937 8 0a 03 e6 15 20 15 82 01
E: 11.828932 8 0a 03 e6 15 20 15 84 01
E: 11.837042 8 0a 03 e6 15 20 15 86 01
E: 11.844945 8 0a 03 e6 15 20 15 88 01
E: 11.852931 8 0a 03 e6 15 20 15 8a 01
E: 11.860904 8 0a 03 e6 15 20 15 8c 01
E: 11.868829 8 0a 03 e6 15 20 15 8e 01
E: 11.876948 8 0a 03 e6 15 20 15 90 01
E: 11.885953 8 0a 03 e6 15 20 15 92 01
E: 11.893930 8 0a 03 e6 15 20 15 94 01
E: 11.901930 8 0a 03 e6 15 20 15 96 01
E: 11.909914 8 0a 03 e6 15 20 15 98 01
E: 11.917945 8 0a 03 e6 15 20 15 9a 01
E: 11.925926 8 0a 03 e6 15 20 15 9c 01
E: 11.933977 8 0a 03 e6 15 20 15 9e 01
E: 11.942922 8 0a 03 e6 15 20 15 a0 01
E: 11.950924 8 0a 03 e6 15 20 15 a2 01
E: 11.958947 8 0a 03 e6 15 20 15 a4 01
E: 11.966933 8 0a 03 e6 15 20 15 a6 01
E: 11.974543 8 0a 03 e6 15 20 15 a8 01
E: 11.982938 8 0a 03 e6 15 20 15 aa 01
E: 11.990905 8 0a 03 e6 15 20 15 aa 01
E: 11.998906 8 0a 03 e6 15 20 15 aa 01
E: 12.007948 8 0a 03 e6 15 20 15 ac 01
E: 12.015883 8 0a 03 e6 15 20 15 ac 01
E: 12.023956 8 0a 03 e6 15 20 15 ae 01
E: 12.031928 8 0a 03 e6 15 20 15 b0 01
E: 12.039939 8 0a 03 e6 15 20 15 b2 01
E: 12.047914 8 0a 03 e6 15 20 15 b2 01
E: 12.055915 8 0a 03 e6 15 20 15 b4 01
E: 12.063958 8 0a 03 e6 15 20 15 b6 01
E: 12.073047 8 0a 03 e6 15 20 15 b8 01
E: 12.080930 8 0a 03 e6 15 20 15 b8 01
E: 12.088891 8 0a 03 e6 15 20 15 b8 01
E: 12.096954 8 0a 03 e6 15 20 15 ba 01
E: 12.104928 8 0a 03 e6 15 20 15 bc 01
E: 12.112956 8 0a 03 e6 15 20 15 bc 01
E: 12.120907 8 0a 03 e6 15 20 15 bc 01
E: 12.128875 8 0a 03 e6 15 20 15 bc 01
E: 12.137906 8 0a 03 e6 15 20 15 bc 01
E: 12.145890 8 0a 03 e6 15 20 15 bc 01
E: 12.153913 8 0a 03 e6 15 20 15 bc 01
E: 12.161898 8 0a 03 e6 15 20 15 bc 01
E: 12.169902 8 0a 03 e6 15 20 15 bc 01
E: 12.177923 8 0a 03 e6 15 20 15 be 01
E: 12.208918 8 0a 03 e6 15 20 15 be 01
E: 12.210903 8 0a 00 ee 0a 58 19 de 02
E: 12.215888 8 0a 03 e6 15 20 15 be 01
E: 12.218127 8 0a 03 ee 0a 5a 19 70 02
E: 12.223922 8 0a 03 e6 15 20 15 be 01
E: 12.225900 8 0a 03 f0 0a 5a 19 78 02
E: 12.230879 8 0a 03 e6 15 20 15 be 01
E: 12.232913 8 0a 03 f0 0a 5a 19 80 02
E: 12.238880 8 0a 03 e6 15 20 15 be 01
E: 12.240886 8 0a 03 f4 0a 60 19 88 02
E: 12.245892 8 0a 03 e6 15 20 15 be 01
E: 12.247902 8 0a 03 f2 0a 66 19 90 02
E: 12.253885 8 0a 03 e6 15 20 15 be 01
E: 12.255900 8 0a 03 f4 0a 6c 19 98 02
E: 12.261871 8 0a 03 e6 15 20 15 be 01
E: 12.263916 8 0a 03 f4 0a 72 19 9e 02
E: 12.268933 8 0a 03 e6 15 20 15 be 01
E: 12.270905 8 0a 03 f6 0a 76 19 a4 02
E: 12.276924 8 0a 03 e6 15 20 15 be 01
E: 12.278913 8 0a 03 f8 0a 7a 19 aa 02
E: 12.283894 8 0a 03 e6 15 20 15 be 01
E: 12.285891 8 0a 03 f8 0a 7e 19 b0 02
E: 12.291874 8 0a 03 e6 15 20 15 be 01
E: 12.293910 8 0a 03 f8 0a 80 19 b6 02
E: 12.299898 8 0a 03 e6 15 20 15 be 01
E: 12.301893 8 0a 03 f6 0a 84 19 bc 02
E: 12.306897 8 0a 03 e6 15 20 15 be 01
E: 12.308895 8 0a 03 f8 0a 86 19 c2 02
E: 12.314894 8 0a 03 e6 15 20 15 be 01
E: 12.316873 8 0a 03 f8 0a 86 19 c8 02
E: 12.322887 8 0a 03 e6 15 20 15 be 01
E: 12.324918 8 0a 03 f8 0a 86 19 cc 02
E: 12.329878 8 0a 03 e6 15 20 15 be 01
E: 12.331887 8 0a 03 f8 0a 86 19 d0 02
E: 12.337890 8 0a 03 e6 15 20 15 be 01
E: 12.339896 8 0a 03 f8 0a 86 19 d4 02
E: 12.345895 8 0a 03 e6 15 20 15 be 01
E: 12.347895 8 0a 03 f8 0a 86 19 d8 02
E: 12.352870 8 0a 03 e6 15 20 15 be 01
E: 12.354942 8 0a 03 f8 0a 86 19 dc 02
E: 12.360903 8 0a 03 e6 15 20 15 be 01
E: 12.362932 8 0a 03 f8 0a 86 19 e0 02
E: 12.368904 8 0a 03 e6 15 20 15 be 01
E: 12.370902 8 0a 03 f8 0a 86 19 e4 02
E: 12.375903 8 0a 03 e6 15 20 15 be 01
E: 12.377893 8 0a 03 f8 0a 86 19 e8 02
E: 12.383880 8 0a 03 e6 15 20 15 be 01
E: 12.385911 8 0a 03 f8 0a 86 19 ec 02
E: 12.391878 8 0a 03 e6 15 20 15 be 01
E: 12.393890 8 0a 03 f8 0a 86 19 f0 02
E: 12.398914 8 0a 03 e6 15 20 15 be 01
E: 12.400893 8 0a 03 f8 0a 86 19 f2 02
E: 12.406901 8 0a 03 e6 15 20 15 be 01
E: 12.408893 8 0a 03 f8 0a 86 19 f4 02
E: 12.414878 8 0a 03 e6 15 20 15 be 01
E: 12.416918 8 0a 03 f8 0a 86 19 f6 02
E: 12.421882 8 0a 03 e6 15 20 15 be 01
E: 12.423896 8 0a 03 f8 0a 86 19 f8 02
E: 12.429918 8 0a 03 e6 15 20 15 be 01
E: 12.431904 8 0a 03 f8 0a 86 19 fa 02
E: 12.436924 8 0a 03 e6 15 20 15 c0 01
E: 12.438904 8 0a 03 f8 0a 86 19 fc 02
E: 12.444874 8 0a 03 e6 15 20 15 c0 01
E: 12.446918 8 0a 03 f8 0a 86 19 fe 02
E: 12.452871 8 0a 03 e6 15 20 15 c0 01
E: 12.454888 8 0a 03 f8 0a 86 19 00 02
E: 12.459893 8 0a 03 e6 15 20 15 c0 01
E: 12.461890 8 0a 03 f8 0a 86 19 02 02
E: 12.467949 8 0a 03 e6 15 20 15 c0 01
E: 12.469918 8 0a 03 f8 0a 86 19 04 02
E: 12.475929 8 0a 03 e6 15 20 15 c2 01
E: 12.477930 8 0a 03 f8 0a 86 19 06 02
E: 12.482883 8 0a 03 e6 15 20 15 c2 01
E: 12.484885 8 0a 03 f8 0a 86 19 08 02
E: 12.490894 8 0a 03 e6 15 20 15 c2 01
E: 12.492893 8 0a 03 f8 0a 86 19 0a 02
E: 12.498902 8 0a 03 e6 15 20 15 c2 01
E: 12.500908 8 0a 03 f8 0a 86 19 0c 02
E: 12.505928 8 0a 03 e6 15 20 15 c2 01
E: 12.507941 8 0a 03 f8 0a 86 19 0e 02
E: 12.513884 8 0a 03 e6 15 20 15 c2 01
E: 12.515886 8 0a 03 f8 0a 86 19 10 02
E: 12.521927 8 0a 03 e6 15 20 15 c2 01
E: 12.523907 8 0a 03 f8 0a 86 19 12 02
E: 12.528897 8 0a 03 e6 15 20 15 c2 01
E: 12.530896 8 0a 03 f8 0a 86 19 14 02
E: 12.536890 8 0a 03 e6 15 20 15 c4 01
E: 12.538924 8 0a 03 f8 0a 86 19 16 02
E: 12.544898 8 0a 03 e6 15 20 15 c6 01
E: 12.546900 8 0a 03 f8 0a 86 19 20 02
E: 12.551898 8 0a 03 e6 15 20 15 c6 01
E: 12.553868 8 0a 03 f8 0a 86 19 20 02
E: 12.559891 8 0a 03 e6 15 20 15 c6 01
E: 12.562013 8 0a 03 f8 0a 86 19 20 02
E: 12.567932 8 0a 03 e6 15 20 15 c6 01
E: 12.569855 8 0a 03 f8 0a 86 19 20 02
E: 12.574953 8 0a 03 e6 15 20 15 c8 01
E: 12.576882 8 0a 03 f8 0a 86 19 20 02
E: 12.582928 8 0a 03 e6 15 20 15 ca 01
E: 12.584871 8 0a 03 f8 0a 86 19 20 02
E: 12.590896 8 0a 03 e6 15 20 15 ca 01
E: 12.592867 8 0a 03 f8 0a 86 19 20 02
E: 12.597910 8 0a 03 e6 15 20 15 ca 01
E: 12.599877 8 0a 03 f8 0a 86 19 20 02
E: 12.605908 8 0a 03 e6 15 20 15 ca 01
E: 12.608216 8 0a 03 f8 0a 86 19 20 02
E: 12.613988 8 0a 03 e6 15 20 15 ca 01
E: 12.615981 8 0a 03 f8 0a 86 19 20 02
E: 12.621078 8 0a 03 e6 15 20 15 ca 01
E: 12.623219 8 0a 03 f8 0a 86 19 20 02
E: 12.629025 8 0a 03 e6 15 20 15 ca 01
E: 12.630986 8 0a 03 f8 0a 86 19 20 02
E: 12.637022 8 0a 03 e6 15 20 15 ca 01
E: 12.639005 8 0a 03 f8 0a 86 19 20 02
E: 12.644016 8 0a 03 e6 15 20 15 ca 01
E: 12.646020 8 0a 03 f8 0a 86 19 20 02
E: 12.652130 8 0a 03 e6 15 20 15 ca 01
E: 12.653997 8 0a 03 f8 0a 86 19 20 02
E: 12.660070 8 0a 03 e6 15 20 15 cc 01
E: 12.662015 8 0a 03 f8 0a 86 19 20 02
E: 12.667012 8 0a 03 e6 15 20 15 cc 01
E: 12.669022 8 0a 03 f8 0a 86 19 20 02
E: 12.674939 8 0a 03 e6 15 20 15 cc 01
E: 12.676882 8 0a 03 f8 0a 86 19 20 02
E: 12.682951 8 0a 03 e6 15 20 15 cc 01
E: 12.684846 8 0a 03 f8 0a 86 19 20 02
E: 12.689908 8 0a 03 e6 15 20 15 cc 01
E: 12.691822 8 0a 03 f8 0a 86 19 20 02
E: 12.697897 8 0a 03 e6 15 20 15 cc 01
E: 12.699894 8 0a 03 f8 0a 86 19 20 02
E: 12.704927 8 0a 03 e6 15 20 15 cc 01
E: 12.706888 8 0a 03 f8 0a 86 19 20 02
E: 12.712899 8 0a 03 e6 15 20 15 cc 01
E: 12.714909 8 0a 03 f8 0a 86 19 20 02
E: 12.720901 8 0a 03 e6 15 20 15 cc 01
E: 12.722911 8 0a 03 f8 0a 86 19 20 02
E: 12.727901 8 0a 03 e6 15 20 15 cc 01
E: 12.729893 8 0a 03 f8 0a 86 19 20 02
E: 12.735924 8 0a 03 e6 15 20 15 cc 01
E: 12.737874 8 0a 03 f8 0a 86 19 20 02
E: 12.743873 8 0a 03 e6 15 20 15 cc 01
E: 12.745891 8 0a 03 f8 0a 86 19 20 02
E: 12.750893 8 0a 03 e6 15 20 15 cc 01
E: 12.752869 8 0a 03 f8 0a 86 19 20 02
E: 12.758927 8 0a 03 e6 15 20 15 cc 01
E: 12.760875 8 0a 03 f8 0a 86 19 20 02
E: 12.766901 8 0a 03 e6 15 20 15 cc 01
E: 12.768870 8 0a 03 f8 0a 86 19 20 02
E: 12.773864 8 0a 03 e6 15 20 15 cc 01
E: 12.775989 8 0a 03 f8 0a 86 19 20 02
E: 12.781941 8 0a 03 e6 15 20 15 cc 01
E: 12.783830 8 0a 03 f8 0a 86 19 20 02
E: 12.789903 8 0a 03 e6 15 20 15 cc 01
E: 12.791909 8 0a 03 f8 0a 86 19 20 02
E: 12.796953 8 0a 03 e6 15 20 15 cc 01
E: 12.798966 8 0a 03 f8 0a 86 19 20 02
E: 12.805242 8 0a 03 e6 15 20 15 cc 01
E: 12.806882 8 0a 03 f8 0a 86 19 20 02
E: 12.812900 8 0a 03 e6 15 20 15 cc 01
E: 12.814846 8 0a 03 f8 0a 86 19 20 02
E: 12.819823 8 0a 03 e6 15 20 15 cc 01
E: 12.821799 8 0a 03 f6 0a 8a 19 20 02
E: 12.828020 8 0a 03 e6 15 20 15 cc 01
E: 12.829983 8 0a 03 f2 0a 8c 19 20 02
E: 12.835868 8 0a 03 e6 15 20 15 cc 01
E: 12.837866 8 0a 03 ee 0a 90 19 20 02
E: 12.842928 8 0a 03 e6 15 20 15 cc 01
E: 12.844840 8 0a 03 ee 0a 90 19 20 02
E: 12.850863 8 0a 03 e6 15 20 15 cc 01
E: 12.852863 8 0a 03 ee 0a 92 19 20 02
E: 12.857919 8 0a 03 e6 15 20 15 cc 01
E: 12.859994 8 0a 03 ee 0a 92 19 20 02
E: 12.865875 8 0a 03 e6 15 20 15 cc 01
E: 12.867861 8 0a 03 ee 0a 92 19 20 02
E: 12.873931 8 0a 03 e6 15 20 15 cc 01
E: 12.876003 8 0a 03 ee 0a 92 19 20 02
E: 12.880899 8 0a 03 e6 15 20 15 cc 01
E: 12.882986 8 0a 03 ee 0a 92 19 20 02
E: 12.888936 8 0a 03 e6 15 20 15 cc 01
E: 12.891005 8 0a 03 ee 0a 92 19 20 02
E: 12.896943 8 0a 03 e6 15 20 15 cc 01
E: 12.898990 8 0a 03 ee 0a 92 19 20 02
E: 12.904082 8 0a 03 e6 15 20 15 cc 01
E: 12.906068 8 0a 03 ee 0a 92 19 20 02
E: 12.911873 8 0a 03 e6 15 20 15 cc 01
E: 12.914039 8 0a 03 ee 0a 92 19 20 02
E: 12.919887 8 0a 03 e6 15 20 15 cc 01
E: 12.921972 8 0a 03 ee 0a 92 19 20 02
E: 12.926975 8 0a 03 e6 15 20 15 cc 01
E: 12.928930 8 0a 03 ee 0a 92 19 20 02
E: 12.934997 8 0a 03 e6 15 20 15 cc 01
E: 12.936932 8 0a 03 ee 0a 92 19 20 02
E: 12.942963 8 0a 03 e6 15 20 15 cc 01
E: 12.944975 8 0a 03 f2 0a 92 19 20 02
E: 12.949978 8 0a 03 e6 15 20 15 cc 01
E: 12.952007 8 0a 03 f6 0a 92 19 20 02
E: 12.957966 8 0a 03 e6 15 20 15 cc 01
E: 12.959988 8 0a 03 f8 0a 92 19 20 02
E: 12.965025 8 0a 03 e6 15 20 15 cc 01
E: 12.966539 8 0a 03 fc 0a 90 19 20 02
E: 12.972987 8 0a 03 e6 15 20 15 cc 01
E: 12.974989 8 0a 03 fe 0a 90 19 20 02
E: 12.981016 8 0a 03 e6 15 20 15 cc 01
E: 12.982998 8 0a 03 fe 0a 90 19 20 02
E: 12.987941 8 0a 03 e6 15 20 15 cc 01
E: 12.989924 8 0a 03 fe 0a 90 19 20 02
E: 12.995971 8 0a 03 e6 15 20 15 cc 01
E: 12.997984 8 0a 03 fe 0a 90 19 20 02
E: 13.003967 8 0a 03 e6 15 20 15 cc 01
E: 13.005926 8 0a 03 fe 0a 90 19 20 02
E: 13.011048 8 0a 03 e6 15 20 15 cc 01
E: 13.013074 8 0a 03 fe 0a 90 19 20 02
E: 13.018960 8 0a 03 e6 15 20 15 cc 01
E: 13.020926 8 0a 03 fe 0a 90 19 20 02
E: 13.026986 8 0a 03 e6 15 20 15 cc 01
E: 13.028987 8 0a 03 fe 0a 90 19 20 02
E: 13.035959 8 0a 03 e6 15 20 15 cc 01
E: 13.037927 8 0a 03 fe 0a 90 19 20 02
E: 13.044310 8 0a 03 e6 15 20 15 cc 01
E: 13.045961 8 0a 03 fe 0a 90 19 20 02
E: 13.051939 8 0a 03 e6 15 20 15 cc 01
E: 13.053957 8 0a 03 fe 0a 90 19 20 02
E: 13.059854 8 0a 03 e6 15 20 15 cc 01
E: 13.061971 8 0a 03 fe 0a 90 19 20 02
E: 13.067965 8 0a 03 e6 15 20 15 cc 01
E: 13.069927 8 0a 03 fe 0a 90 19 20 02
E: 13.076055 8 0a 03 e6 15 20 15 cc 01
E: 13.077962 8 0a 03 fe 0a 90 19 20 02
E: 13.084031 8 0a 03 e6 15 20 15 cc 01
E: 13.085957 8 0a 03 fe 0a 90 19 20 02
E: 13.093038 8 0a 03 e4 15 1c 15 cc 01
E: 13.094999 8 0a 03 fe 0a 90 19 20 02
E: 13.101002 8 0a 03 e2 15 12 15 cc 01
E: 13.103076 8 0a 03 fe 0a 90 19 20 02
E: 13.109042 8 0a 03 e0 15 0a 15 cc 01
E: 13.111072 8 0a 03 fe 0a 90 19 20 02
E: 13.118105 8 0a 03 de 15 04 15 cc 01
E: 13.120019 8 0a 03 fe 0a 90 19 20 02
E: 13.124990 8 0a 03 de 15 00 15 cc 01
E: 13.127052 8 0a 03 fe 0a 90 19 20 02
E: 13.134030 8 0a 03 dc 15 fc 14 cc 01
E: 13.135947 8 0a 03 fe 0a 90 19 20 02
E: 13.141945 8 0a 03 dc 15 00 15 cc 01
E: 13.143937 8 0a 03 fe 0a 90 19 20 02
E: 13.149969 8 0a 03 dc 15 fc 14 cc 01
E: 13.151943 8 0a 03 fe 0a 90 19 20 02
E: 13.156950 8 0a 03 dc 15 fe 14 cc 01
E: 13.158953 8 0a 03 fe 0a 90 19 20 02
E: 13.164973 8 0a 03 dc 15 02 15 cc 01
E: 13.166939 8 0a 03 fe 0a 90 19 20 02
E: 13.172932 8 0a 03 dc 15 06 15 cc 01
E: 13.174939 8 0a 03 fe 0a 90 19 20 02
E: 13.179985 8 0a 03 de 15 0a 15 cc 01
E: 13.181944 8 0a 03 fe 0a 90 19 20 02
E: 13.187954 8 0a 03 dc 15 0e 15 cc 01
E: 13.189941 8 0a 03 fe 0a 90 19 20 02
E: 13.194933 8 0a 03 dc 15 0e 15 cc 01
E: 13.196884 8 0a 03 fe 0a 90 19 20 02
E: 13.202914 8 0a 03 dc 15 0e 15 cc 01
E: 13.204882 8 0a 03 fe 0a 90 19 20 02
E: 13.210938 8 0a 03 dc 15 0e 15 cc 01
E: 13.212885 8 0a 03 fe 0a 90 19 20 02
E: 13.217925 8 0a 03 dc 15 0e 15 cc 01
E: 13.219899 8 0a 03 fe 0a 90 19 20 02
E: 13.225929 8 0a 03 dc 15 0e 15 cc 01
E: 13.227888 8 0a 03 fe 0a 90 19 20 02
E: 13.233910 8 0a 03 dc 15 0e 15 cc 01
E: 13.235869 8 0a 03 fe 0a 90 19 20 02
E: 13.240905 8 0a 03 dc 15 0e 15 cc 01
E: 13.242895 8 0a 03 fe 0a 90 19 20 02
E: 13.248813 8 0a 03 dc 15 0e 15 cc 01
E: 13.250896 8 0a 03 fe 0a 90 19 20 02
E: 13.256936 8 0a 03 dc 15 0e 15 cc 01
E: 13.258891 8 0a 03 fe 0a 90 19 20 02
E: 13.264905 8 0a 03 dc 15 0e 15 cc 01
E: 13.266886 8 0a 03 fe 0a 90 19 20 02
E: 13.272946 8 0a 03 dc 15 0e 15 cc 01
E: 13.274870 8 0a 03 fe 0a 90 19 20 02
E: 13.281901 8 0a 03 dc 15 0e 15 cc 01
E: 13.283888 8 0a 03 fe 0a 90 19 20 02
E: 13.289836 8 0a 03 dc 15 0e 15 cc 01
E: 13.291910 8 0a 03 fe 0a 90 19 20 02
E: 13.298901 8 0a 03 dc 15 0e 15 cc 01
E: 13.300837 8 0a 03 fe 0a 90 19 20 02
E: 13.305913 8 0a 03 dc 15 0e 15 cc 01
E: 13.307890 8 0a 03 fe 0a 90 19 20 02
E: 13.313932 8 0a 03 dc 15 0e 15 cc 01
E: 13.315890 8 0a 03 fe 0a 90 19 20 02
E: 13.321934 8 0a 03 dc 15 0e 15 cc 01
E: 13.323883 8 0a 03 fe 0a 90 19 20 02
E: 13.328924 8 0a 03 dc 15 0e 15 ca 01
E: 13.331180 8 0a 03 02 0b 90 19 20 02
E: 13.336958 8 0a 03 dc 15 0e 15 c8 01
E: 13.338983 8 0a 03 08 0b 8e 19 20 02
E: 13.343956 8 0a 03 dc 15 0e 15 c6 01
E: 13.345978 8 0a 03 10 0b 8c 19 20 02
E: 13.350932 8 0a 03 dc 15 0e 15 c6 01
E: 13.353058 8 0a 03 14 0b 8a 19 20 02
E: 13.358915 8 0a 03 dc 15 0e 15 c6 01
E: 13.360920 8 0a 03 18 0b 8a 19 20 02
E: 13.364975 8 0a 03 e2 15 12 15 c4 01
E: 13.366993 8 0a 03 1a 0b 90 19 20 02
E: 13.372411 8 0a 03 ee 15 18 15 c4 01
E: 13.374019 8 0a 03 1e 0b 94 19 20 02
E: 13.378971 8 0a 03 f8 15 1e 15 c2 01
E: 13.380975 8 0a 03 26 0b 98 19 20 02
E: 13.385956 8 0a 03 02 16 24 15 c2 01
E: 13.387976 8 0a 03 2a 0b a2 19 20 02
E: 13.392820 8 0a 03 0e 16 26 15 c2 01
E: 13.394979 8 0a 03 36 0b aa 19 20 02
E: 13.399952 8 0a 03 1a 16 2c 15 c2 01
E: 13.401975 8 0a 03 40 0b b2 19 20 02
E: 13.405957 8 0a 03 26 16 30 15 c2 01
E: 13.407977 8 0a 03 50 0b b8 19 20 02
E: 13.412977 8 0a 03 30 16 36 15 c2 01
E: 13.415009 8 0a 03 5c 0b c0 19 20 02
E: 13.420037 8 0a 03 3e 16 3c 15 c2 01
E: 13.422123 8 0a 03 6e 0b c6 19 20 02
E: 13.426993 8 0a 03 4c 16 40 15 c2 01
E: 13.428976 8 0a 03 7a 0b d0 19 20 02
E: 13.433988 8 0a 03 58 16 4a 15 c2 01
E: 13.436067 8 0a 03 8c 0b dc 19 20 02
E: 13.441102 8 0a 03 66 16 52 15 c2 01
E: 13.443009 8 0a 03 9a 0b e8 19 20 02
E: 13.447962 8 0a 03 74 16 5e 15 c2 01
E: 13.449977 8 0a 03 ac 0b f6 19 20 02
E: 13.453971 8 0a 03 86 16 66 15 c2 01
E: 13.455972 8 0a 03 ba 0b 02 1a 20 02
E: 13.460956 8 0a 03 98 16 72 15 c2 01
E: 13.462543 8 0a 03 c8 0b 10 1a 20 02
E: 13.469979 8 0a 03 ac 16 7c 15 bc 01
E: 13.472008 8 0a 03 d6 0b 1a 1a 20 02
E: 13.478032 8 0a 03 ba 16 88 15 ba 01
E: 13.480003 8 0a 03 e8 0b 24 1a 20 02
E: 13.485843 8 0a 03 d0 16 94 15 ba 01
E: 13.487960 8 0a 03 00 0c 2c 1a 20 02
E: 13.494962 8 0a 03 e4 16 a2 15 ba 01
E: 13.496973 8 0a 03 1a 0c 38 1a 20 02
E: 13.503041 8 0a 03 fa 16 ae 15 ba 01
E: 13.505082 8 0a 03 32 0c 42 1a 20 02
E: 13.510986 8 0a 03 10 17 bc 15 ba 01
E: 13.513016 8 0a 03 48 0c 4e 1a 20 02
E: 13.518048 8 0a 03 24 17 ce 15 ba 01
E: 13.520150 8 0a 03 5c 0c 58 1a 20 02
E: 13.525045 8 0a 03 3c 17 da 15 ba 01
E: 13.527178 8 0a 03 6e 0c 66 1a 20 02
E: 13.532025 8 0a 03 52 17 ea 15 b4 01
E: 13.533949 8 0a 03 82 0c 70 1a 20 02
E: 13.539874 8 0a 03 68 17 f6 15 b2 01
E: 13.541994 8 0a 03 9a 0c 7c 1a 20 02
E: 13.546979 8 0a 03 7a 17 08 16 b2 01
E: 13.548844 8 0a 03 b2 0c 88 1a 20 02
E: 13.553981 8 0a 03 8e 17 16 16 b2 01
E: 13.555977 8 0a 03 c8 0c 94 1a 20 02
E: 13.561968 8 0a 03 a2 17 28 16 b2 01
E: 13.564009 8 0a 03 e0 0c 9e 1a 20 02
E: 13.569493 8 0a 03 b4 17 38 16 b2 01
E: 13.570993 8 0a 03 f2 0c aa 1a 20 02
E: 13.576999 8 0a 03 c4 17 46 16 b2 01
E: 13.578993 8 0a 03 0a 0d ba 1a 20 02
E: 13.583876 8 0a 03 d4 17 56 16 b4 01
E: 13.585888 8 0a 03 1a 0d ca 1a 20 02
E: 13.590997 8 0a 03 e6 17 66 16 b6 01
E: 13.592983 8 0a 03 2c 0d da 1a 20 02
E: 13.598172 8 0a 03 f8 17 78 16 b8 01
E: 13.599845 8 0a 03 3a 0d ec 1a 20 02
E: 13.605012 8 0a 03 0a 18 8a 16 b8 01
E: 13.606978 8 0a 03 58 0d f4 1a 20 02
E: 13.611961 8 0a 03 1c 18 9a 16 ba 01
E: 13.613963 8 0a 03 68 0d 06 1b 20 02
E: 13.619299 8 0a 03 2c 18 ac 16 bc 01
E: 13.621041 8 0a 03 82 0d 16 1b 20 02
E: 13.625957 8 0a 03 3c 18 be 16 be 01
E: 13.627962 8 0a 03 92 0d 2c 1b 20 02
E: 13.633006 8 0a 03 4c 18 d2 16 c0 01
E: 13.634848 8 0a 03 a8 0d 3a 1b 20 02
E: 13.640604 8 0a 03 5c 18 e4 16 c2 01
E: 13.642569 8 0a 03 b8 0d 4e 1b 20 02
E: 13.646443 8 0a 03 6c 18 f6 16 c4 01
E: 13.647992 8 0a 03 ca 0d 5c 1b 20 02
E: 13.653056 8 0a 03 7e 18 08 17 c6 01
E: 13.655081 8 0a 03 da 0d 6e 1b 20 02
E: 13.659898 8 0a 03 8e 18 1a 17 c6 01
E: 13.662030 8 0a 03 ea 0d 7e 1b 20 02
E: 13.666964 8 0a 03 a0 18 2a 17 c6 01
E: 13.668855 8 0a 03 fa 0d 8e 1b 20 02
E: 13.674133 8 0a 03 b0 18 38 17 c6 01
E: 13.676543 8 0a 03 08 0e 9c 1b 20 02
E: 13.680977 8 0a 03 c2 18 46 17 c6 01
E: 13.682945 8 0a 03 18 0e a8 1b 20 02
E: 13.688224 8 0a 03 d2 18 52 17 c6 01
E: 13.689966 8 0a 03 2a 0e b4 1b 20 02
E: 13.696984 8 0a 03 e2 18 5e 17 c0 01
E: 13.698982 8 0a 03 3c 0e be 1b 20 02
E: 13.705944 8 0a 03 f2 18 6c 17 ba 01
E: 13.707991 8 0a 03 58 0e ca 1b 20 02
E: 13.715970 8 0a 03 fe 18 7e 17 b4 01
E: 13.717967 8 0a 03 6e 0e d0 1b 20 02
E: 13.725950 8 0a 03 0c 19 8c 17 ae 01
E: 13.728123 8 0a 03 86 0e dc 1b 20 02
E: 13.734975 8 0a 03 1a 19 9c 17 a8 01
E: 13.737026 8 0a 03 98 0e e8 1b 20 02
E: 13.744009 8 0a 03 28 19 a8 17 a6 01
E: 13.745965 8 0a 03 aa 0e f6 1b 20 02
E: 13.751944 8 0a 03 3e 19 ba 17 a6 01
E: 13.754059 8 0a 03 bc 0e 02 1c 20 02
E: 13.757984 8 0a 03 50 19 ca 17 a6 01
E: 13.759898 8 0a 03 d2 0e 0e 1c 20 02
E: 13.764994 8 0a 03 66 19 d8 17 a6 01
E: 13.766963 8 0a 03 e4 0e 1c 1c 20 02
E: 13.771969 8 0a 03 7c 19 e2 17 a6 01
E: 13.773960 8 0a 03 f6 0e 2c 1c 20 02
E: 13.778936 8 0a 03 90 19 ee 17 a6 01
E: 13.780963 8 0a 03 08 0f 3a 1c 20 02
E: 13.785968 8 0a 03 a0 19 f8 17 a6 01
E: 13.787979 8 0a 03 14 0f 46 1c 20 02
E: 13.792951 8 0a 03 b0 19 02 18 a6 01
E: 13.794973 8 0a 03 22 0f 52 1c 20 02
E: 13.799954 8 0a 03 be 19 0a 18 a6 01
E: 13.801980 8 0a 03 2e 0f 5c 1c 20 02
E: 13.806986 8 0a 03 cc 19 12 18 a6 01
E: 13.808974 8 0a 03 3c 0f 62 1c 20 02
E: 13.814950 8 0a 03 d8 19 18 18 a6 01
E: 13.816972 8 0a 03 48 0f 6c 1c 20 02
E: 13.822000 8 0a 03 e2 19 20 18 a6 01
E: 13.823978 8 0a 03 54 0f 76 1c 20 02
E: 13.829950 8 0a 03 ec 19 24 18 a6 01
E: 13.832093 8 0a 03 5c 0f 80 1c 20 02
E: 13.838149 8 0a 03 f2 19 2c 18 a6 01
E: 13.840083 8 0a 03 66 0f 8a 1c 20 02
E: 13.845026 8 0a 03 f8 19 34 18 a8 01
E: 13.847029 8 0a 03 6c 0f 94 1c 20 02
E: 13.853043 8 0a 03 fe 19 3c 18 aa 01
E: 13.854906 8 0a 03 74 0f 9c 1c 20 02
E: 13.859886 8 0a 03 06 1a 44 18 ac 01
E: 13.862160 8 0a 03 7a 0f a4 1c 20 02
E: 13.868038 8 0a 03 0c 1a 4e 18 ae 01
E: 13.870032 8 0a 03 82 0f aa 1c 20 02
E: 13.876019 8 0a 03 14 1a 54 18 b0 01
E: 13.878012 8 0a 03 88 0f b0 1c 20 02
E: 13.883038 8 0a 03 1a 1a 5c 18 b2 01
E: 13.885041 8 0a 03 8e 0f b6 1c 20 02
E: 13.891019 8 0a 03 1c 1a 62 18 b4 01
E: 13.893042 8 0a 03 92 0f b8 1c 20 02
E: 13.898027 8 0a 03 22 1a 68 18 b6 01
E: 13.900036 8 0a 03 96 0f ba 1c 20 02
E: 13.905887 8 0a 03 26 1a 6c 18 b8 01
E: 13.908003 8 0a 03 96 0f ba 1c 20 02
E: 13.913040 8 0a 03 2a 1a 72 18 ba 01
E: 13.914904 8 0a 03 98 0f bc 1c 20 02
E: 13.920904 8 0a 03 2e 1a 74 18 bc 01
E: 13.922958 8 0a 03 9c 0f be 1c 20 02
E: 13.928967 8 0a 03 32 1a 76 18 be 01
E: 13.930989 8 0a 03 9e 0f c0 1c 20 02
E: 13.935946 8 0a 03 32 1a 78 18 c0 01
E: 13.937999 8 0a 03 a2 0f c2 1c 20 02
E: 13.943973 8 0a 03 34 1a 7a 18 c2 01
E: 13.945980 8 0a 03 a4 0f c4 1c 20 02
E: 13.950947 8 0a 03 34 1a 7a 18 c4 01
E: 13.952976 8 0a 03 a6 0f c6 1c 20 02
E: 13.958548 8 0a 03 34 1a 7a 18 c6 01
E: 13.959941 8 0a 03 a6 0f c6 1c 20 02
E: 13.966958 8 0a 03 34 1a 7a 18 c8 01
E: 13.968959 8 0a 03 a6 0f c6 1c 20 02
E: 13.973973 8 0a 03 34 1a 7a 18 ca 01
E: 13.975940 8 0a 03 a6 0f c6 1c 20 02
E: 13.981928 8 0a 03 34 1a 7a 18 cc 01
E: 13.983940 8 0a 03 a6 0f c6 1c 20 02
E: 13.989958 8 0a 03 34 1a 7a 18 ce 01
E: 13.991939 8 0a 03 a6 0f c6 1c 20 02
E: 13.996932 8 0a 03 34 1a 7a 18 d0 01
E: 13.998946 8 0a 03 a6 0f c6 1c 20 02
E: 14.004970 8 0a 03 34 1a 7a 18 d2 01
E: 14.006950 8 0a 03 a6 0f c6 1c 20 02
E: 14.012897 8 0a 03 34 1a 7a 18 d2 01
E: 14.014886 8 0a 03 a6 0f c6 1c 20 02
E: 14.019999 8 0a 03 34 1a 7a 18 d4 01
E: 14.022027 8 0a 03 a6 0f c6 1c 20 02
E: 14.027900 8 0a 03 34 1a 7a 18 d4 01
E: 14.029880 8 0a 03 a6 0f c6 1c 20 02
E: 14.035968 8 0a 03 34 1a 7a 18 d6 01
E: 14.037935 8 0a 03 a6 0f c6 1c 20 02
E: 14.042932 8 0a 03 34 1a 7a 18 d8 01
E: 14.044936 8 0a 03 a6 0f c6 1c 20 02
E: 14.050947 8 0a 03 34 1a 7a 18 da 01
E: 14.052940 8 0a 03 a6 0f c6 1c 20 02
E: 14.058896 8 0a 03 34 1a 7a 18 da 01
E: 14.060901 8 0a 03 a6 0f c6 1c 20 02
E: 14.065923 8 0a 03 34 1a 7a 18 da 01
E: 14.067892 8 0a 03 a6 0f c6 1c 20 02
E: 14.073978 8 0a 03 34 1a 7a 18 dc 01
E: 14.075944 8 0a 03 a6 0f c6 1c 20 02
E: 14.080951 8 0a 03 34 1a 7a 18 de 01
E: 14.082946 8 0a 03 a6 0f c6 1c 20 02
E: 14.088895 8 0a 03 34 1a 7a 18 de 01
E: 14.090883 8 0a 03 a6 0f c6 1c 20 02
E: 14.096966 8 0a 03 34 1a 7a 18 e0 01
E: 14.098954 8 0a 03 a6 0f c6 1c 20 02
E: 14.103931 8 0a 03 34 1a 7a 18 e2 01
E: 14.105940 8 0a 03 a6 0f c6 1c 20 02
E: 14.111951 8 0a 03 34 1a 7a 18 e2 01
E: 14.113885 8 0a 03 a6 0f c6 1c 20 02
E: 14.119889 8 0a 03 34 1a 7a 18 e2 01
E: 14.121880 8 0a 03 a6 0f c6 1c 20 02
E: 14.126939 8 0a 03 34 1a 7a 18 e2 01
E: 14.128883 8 0a 03 a6 0f c6 1c 20 02
E: 14.134924 8 0a 03 34 1a 7a 18 e2 01
E: 14.136920 8 0a 03 a6 0f c6 1c 20 02
E: 14.142947 8 0a 03 34 1a 7a 18 e4 01
E: 14.144937 8 0a 03 a6 0f c6 1c 20 02
E: 14.149894 8 0a 03 34 1a 7a 18 e4 01
E: 14.151882 8 0a 03 a6 0f c6 1c 20 02
E: 14.157969 8 0a 03 36 1a 7e 18 e6 01
E: 14.159940 8 0a 03 a6 0f c6 1c 20 02
E: 14.165933 8 0a 03 34 1a 84 18 e6 01
E: 14.167971 8 0a 03 aa 0f c6 1c 20 02
E: 14.172974 8 0a 03 36 1a 88 18 e8 01
E: 14.174983 8 0a 03 b2 0f c4 1c 20 02
E: 14.180952 8 0a 03 34 1a 8a 18 e8 01
E: 14.182980 8 0a 03 b8 0f c4 1c 20 02
E: 14.187835 8 0a 03 34 1a 8e 18 e8 01
E: 14.189977 8 0a 03 ba 0f c2 1c 20 02
E: 14.195957 8 0a 03 36 1a 8e 18 e8 01
E: 14.197973 8 0a 03 bc 0f c2 1c 20 02
E: 14.203996 8 0a 03 36 1a 90 18 e8 01
E: 14.205979 8 0a 03 ba 0f c4 1c 20 02
E: 14.210916 8 0a 03 36 1a 90 18 e8 01
E: 14.212887 8 0a 03 ba 0f c4 1c 20 02
E: 14.218821 8 0a 03 36 1a 92 18 e8 01
E: 14.220940 8 0a 03 ba 0f c4 1c 20 02
E: 14.225889 8 0a 03 36 1a 92 18 e8 01
E: 14.227883 8 0a 03 ba 0f c4 1c 20 02
E: 14.233886 8 0a 03 36 1a 92 18 e8 01
E: 14.235931 8 0a 03 ba 0f c4 1c 20 02
E: 14.241894 8 0a 03 36 1a 92 18 e8 01
E: 14.243896 8 0a 03 ba 0f c4 1c 20 02
E: 14.248882 8 0a 03 36 1a 92 18 e8 01
E: 14.250928 8 0a 03 ba 0f c4 1c 20 02
E: 14.256886 8 0a 03 36 1a 92 18 e8 01
E: 14.258881 8 0a 03 ba 0f c4 1c 20 02
E: 14.264886 8 0a 03 36 1a 92 18 e8 01
E: 14.266937 8 0a 03 ba 0f c4 1c 20 02
E: 14.271927 8 0a 03 36 1a 92 18 e8 01
E: 14.273882 8 0a 03 ba 0f c4 1c 20 02
E: 14.279936 8 0a 03 36 1a 92 18 e8 01
E: 14.281912 8 0a 03 ba 0f c4 1c 20 02
E: 14.287870 8 0a 03 36 1a 92 18 e8 01
E: 14.289880 8 0a 03 ba 0f c4 1c 20 02
E: 14.294895 8 0a 03 36 1a 92 18 e8 01
E: 14.296908 8 0a 03 ba 0f c4 1c 20 02
E: 14.302934 8 0a 03 36 1a 92 18 e8 01
E: 14.304882 8 0a 03 ba 0f c4 1c 20 02
E: 14.310879 8 0a 03 36 1a 92 18 e8 01
E: 14.312950 8 0a 03 ba 0f c4 1c 20 02
E: 14.317901 8 0a 03 36 1a 92 18 e8 01
E: 14.319882 8 0a 03 ba 0f c4 1c 20 02
E: 14.325879 8 0a 03 36 1a 92 18 e8 01
E: 14.327885 8 0a 03 ba 0f c4 1c 20 02
E: 14.333934 8 0a 03 36 1a 92 18 e8 01
E: 14.335891 8 0a 03 ba 0f c4 1c 20 02
E: 14.340885 8 0a 03 36 1a 92 18 e8 01
E: 14.342893 8 0a 03 ba 0f c4 1c 20 02
E: 14.348926 8 0a 03 36 1a 92 18 e8 01
E: 14.350889 8 0a 03 ba 0f c4 1c 20 02
E: 14.356885 8 0a 03 36 1a 92 18 e8 01
E: 14.358880 8 0a 03 ba 0f c4 1c 20 02
E: 14.363930 8 0a 03 36 1a 92 18 e8 01
E: 14.365883 8 0a 03 ba 0f c4 1c 20 02
E: 14.371885 8 0a 03 36 1a 92 18 e8 01
E: 14.373916 8 0a 03 b8 0f c8 1c 20 02
E: 14.379912 8 0a 03 36 1a 92 18 e8 01
E: 14.381900 8 0a 03 b6 0f cc 1c 20 02
E: 14.386898 8 0a 03 36 1a 92 18 e8 01
E: 14.388919 8 0a 03 b4 0f d0 1c 20 02
E: 14.394931 8 0a 03 36 1a 92 18 e8 01
E: 14.396923 8 0a 03 b4 0f d2 1c 20 02
E: 14.401917 8 0a 03 36 1a 92 18 e8 01
E: 14.403929 8 0a 03 b2 0f d4 1c 20 02
E: 14.409922 8 0a 03 36 1a 92 18 e8 01
E: 14.411890 8 0a 03 b2 0f d4 1c 20 02
E: 14.417886 8 0a 03 36 1a 92 18 e8 01
E: 14.419926 8 0a 03 b2 0f d4 1c 00 02
E: 14.424936 8 0a 03 36 1a 92 18 e8 01
E: 14.426891 8 0a 03 b2 0f d4 1c 00 02
E: 14.432887 8 0a 03 36 1a 92 18 e8 01
E: 14.434880 8 0a 03 b2 0f d4 1c 00 02
E: 14.440926 8 0a 03 36 1a 92 18 e8 01
E: 14.442930 8 0a 03 b2 0f d4 1c 03 02
E: 14.447925 8 0a 03 36 1a 92 18 e8 01
E: 14.449881 8 0a 03 b2 0f d4 1c 03 02
E: 14.455930 8 0a 03 36 1a 92 18 e8 01
E: 14.457920 8 0a 03 b2 0f d4 1c 06 02
E: 14.463921 8 0a 03 36 1a 92 18 e8 01
E: 14.465881 8 0a 03 b2 0f d4 1c 06 02
E: 14.470936 8 0a 03 36 1a 92 18 e8 01
E: 14.472885 8 0a 03 b2 0f d4 1c 06 02
E: 14.478902 8 0a 03 36 1a 92 18 e8 01
E: 14.480897 8 0a 03 b2 0f d4 1c 06 02
E: 14.486923 8 0a 03 36 1a 92 18 e8 01
E: 14.488885 8 0a 03 b2 0f d4 1c 06 02
E: 14.493877 8 0a 03 36 1a 92 18 e8 01
E: 14.495891 8 0a 03 b2 0f d4 1c 06 02
E: 14.501923 8 0a 03 36 1a 92 18 e8 01
E: 14.503892 8 0a 03 b2 0f d4 1c 06 02
E: 14.509929 8 0a 03 36 1a 92 18 e8 01
E: 14.511930 8 0a 03 b2 0f d4 1c 09 02
E: 14.516925 8 0a 03 36 1a 92 18 e8 01
E: 14.518979 8 0a 03 b2 0f d4 1c 0c 02
E: 14.524921 8 0a 03 36 1a 92 18 e8 01
E: 14.526928 8 0a 03 b2 0f d4 1c 0f 02
E: 14.533284 8 0a 03 36 1a 92 18 e8 01
E: 14.535046 8 0a 03 b2 0f d4 1c 12 02
E: 14.539902 8 0a 03 36 1a 92 18 e8 01
E: 14.541920 8 0a 03 b2 0f d4 1c 15 02
E: 14.547998 8 0a 03 36 1a 92 18 e8 01
E: 14.549978 8 0a 03 b2 0f d4 1c 18 02
E: 14.555223 8 0a 03 36 1a 92 18 e8 01
E: 14.557037 8 0a 03 b2 0f d4 1c 1b 02
E: 14.562998 8 0a 03 36 1a 92 18 e8 01
E: 14.564929 8 0a 03 b2 0f d4 1c 1b 02
E: 14.571062 8 0a 03 36 1a 92 18 e8 01
E: 14.573018 8 0a 03 b2 0f d4 1c 1e 02
E: 14.577989 8 0a 03 36 1a 92 18 e8 01
E: 14.579976 8 0a 03 b2 0f d4 1c 21 02
E: 14.585970 8 0a 03 36 1a 92 18 e8 01
E: 14.587935 8 0a 03 b2 0f d4 1c 21 02
E: 14.593981 8 0a 03 36 1a 92 18 e8 01
E: 14.595949 8 0a 03 b2 0f d4 1c 21 02
E: 14.603205 8 0a 03 36 1a 92 18 e8 01
E: 14.603557 8 0a 03 b2 0f d4 1c 21 02
E: 14.609046 8 0a 03 36 1a 92 18 e8 01
E: 14.610962 8 0a 03 b2 0f d4 1c 21 02
E: 14.616981 8 0a 03 36 1a 92 18 ea 01
E: 14.619044 8 0a 03 b2 0f d4 1c 24 02
E: 14.623966 8 0a 03 36 1a 92 18 ea 01
E: 14.626019 8 0a 03 b2 0f d4 1c 27 02
E: 14.631919 8 0a 03 36 1a 92 18 ea 01
E: 14.633918 8 0a 03 b2 0f d4 1c 2a 02
E: 14.639959 8 0a 03 36 1a 92 18 ea 01
E: 14.641836 8 0a 03 b2 0f d4 1c 2d 02
E: 14.647042 8 0a 03 36 1a 92 18 ea 01
E: 14.648915 8 0a 03 b2 0f d4 1c 2d 02
E: 14.654916 8 0a 03 36 1a 92 18 ea 01
E: 14.656927 8 0a 03 b2 0f d4 1c 2d 02
E: 14.662936 8 0a 03 36 1a 92 18 ea 01
E: 14.664887 8 0a 03 b2 0f d4 1c 2d 02
E: 14.669909 8 0a 03 36 1a 92 18 ea 01
E: 14.671935 8 0a 03 b2 0f d4 1c 2d 02
E: 14.677910 8 0a 03 36 1a 92 18 ea 01
E: 14.679883 8 0a 03 b2 0f d4 1c 2d 02
E: 14.685922 8 0a 03 36 1a 92 18 ea 01
E: 14.687924 8 0a 03 b2 0f d4 1c 2d 02
E: 14.692892 8 0a 03 36 1a 92 18 ea 01
E: 14.694913 8 0a 03 b2 0f d4 1c 2d 02
E: 14.700891 8 0a 03 36 1a 92 18 ea 01
E: 14.702519 8 0a 03 b2 0f d4 1c 2d 02
E: 14.708938 8 0a 03 36 1a 92 18 ea 01
E: 14.710891 8 0a 03 b2 0f d4 1c 2d 02
E: 14.715886 8 0a 03 36 1a 92 18 ea 01
E: 14.717909 8 0a 03 b2 0f d4 1c 2d 02
E: 14.723933 8 0a 03 36 1a 92 18 ea 01
E: 14.725885 8 0a 03 b2 0f d4 1c 2d 02
E: 14.731881 8 0a 03 36 1a 92 18 ea 01
E: 14.733936 8 0a 03 b2 0f d4 1c 2d 02
E: 14.738936 8 0a 03 36 1a 92 18 ea 01
E: 14.740887 8 0a 03 b2 0f d4 1c 2d 02
E: 14.746890 8 0a 03 36 1a 92 18 ea 01
E: 14.748878 8 0a 03 b2 0f d4 1c 2d 02
E: 14.754932 8 0a 03 36 1a 92 18 ea 01
E: 14.756923 8 0a 03 b2 0f d4 1c 30 02
E: 14.761917 8 0a 03 36 1a 92 18 ea 01
E: 14.763964 8 0a 03 b2 0f d4 1c 33 02
E: 14.769904 8 0a 03 36 1a 92 18 ea 01
E: 14.771927 8 0a 03 b2 0f d4 1c 36 02
E: 14.777913 8 0a 03 36 1a 92 18 ea 01
E: 14.779956 8 0a 03 b2 0f d4 1c 39 02
E: 14.784922 8 0a 03 36 1a 92 18 ea 01
E: 14.786952 8 0a 03 b2 0f d4 1c 3c 02
E: 14.792843 8 0a 03 36 1a 92 18 ea 01
E: 14.795039 8 0a 03 b2 0f d4 1c 3f 02
E: 14.800996 8 0a 03 36 1a 92 18 ea 01
E: 14.802860 8 0a 03 b2 0f d4 1c 42 02
E: 14.807857 8 0a 03 36 1a 92 18 ea 01
E: 14.809902 8 0a 03 b2 0f d4 1c 42 02
E: 14.815914 8 0a 03 36 1a 92 18 ea 01
E: 14.817867 8 0a 03 b2 0f d4 1c 42 02
E: 14.822936 8 0a 03 36 1a 92 18 ea 01
E: 14.824885 8 0a 03 b2 0f d4 1c 42 02
E: 14.830920 8 0a 03 36 1a 92 18 ea 01
E: 14.832882 8 0a 03 b2 0f d4 1c 42 02
E: 14.838941 8 0a 03 36 1a 92 18 ea 01
E: 14.840886 8 0a 03 b2 0f d4 1c 42 02
E: 14.845884 8 0a 03 36 1a 92 18 ea 01
E: 14.847885 8 0a 03 b2 0f d4 1c 42 02
E: 14.853928 8 0a 03 36 1a 92 18 ea 01
E: 14.855898 8 0a 03 b2 0f d4 1c 42 02
E: 14.861908 8 0a 03 36 1a 92 18 ea 01
E: 14.863889 8 0a 03 b2 0f d4 1c 42 02
E: 14.868933 8 0a 03 36 1a 92 18 ea 01
E: 14.870984 8 0a 03 b2 0f d4 1c 42 02
E: 14.877007 8 0a 03 36 1a 92 18 ea 01
E: 14.879031 8 0a 03 b2 0f d4 1c 42 02
E: 14.884939 8 0a 03 36 1a 92 18 ea 01
E: 14.886930 8 0a 03 b2 0f d4 1c 45 02
E: 14.891918 8 0a 03 36 1a 92 18 ea 01
E: 14.893880 8 0a 03 b2 0f d4 1c 48 02
E: 14.899873 8 0a 03 36 1a 92 18 ea 01
E: 14.902653 8 0a 03 b2 0f d4 1c 4b 02
E: 14.908341 8 0a 03 36 1a 92 18 ea 01
E: 14.909976 8 0a 03 b2 0f d4 1c 4b 02
E: 14.914892 8 0a 03 36 1a 92 18 ea 01
E: 14.916863 8 0a 03 b2 0f d4 1c 4b 02
E: 14.922855 8 0a 03 36 1a 92 18 ea 01
E: 14.924976 8 0a 03 b2 0f d4 1c 4b 02
E: 14.930944 8 0a 03 36 1a 92 18 ea 01
E: 14.932879 8 0a 03 b2 0f d4 1c 4b 02
E: 14.937936 8 0a 03 36 1a 92 18 ea 01
E: 14.939894 8 0a 03 b2 0f d4 1c 4b 02
E: 14.945825 8 0a 03 36 1a 92 18 ea 01
E: 14.947931 8 0a 03 b2 0f d4 1c 4b 02
E: 14.953928 8 0a 03 36 1a 92 18 ec 01
E: 14.955939 8 0a 03 b2 0f d4 1c 4b 02
E: 14.960901 8 0a 03 36 1a 92 18 ec 01
E: 14.962936 8 0a 03 b2 0f d4 1c 4b 02
E: 14.968915 8 0a 03 36 1a 92 18 ec 01
E: 14.970907 8 0a 03 b2 0f d4 1c 4b 02
E: 14.977114 8 0a 03 36 1a 92 18 ee 01
E: 14.978952 8 0a 03 b2 0f d4 1c 4b 02
E: 14.983931 8 0a 03 36 1a 92 18 ee 01
E: 14.985885 8 0a 03 b2 0f d4 1c 4b 02
E: 14.991858 8 0a 03 36 1a 92 18 ee 01
E: 14.993940 8 0a 03 b2 0f d4 1c 4b 02
E: 14.999999 8 0a 03 36 1a 92 18 f0 01
E: 15.002029 8 0a 03 b2 0f d4 1c 4b 02
E: 15.006952 8 0a 03 36 1a 92 18 f0 01
E: 15.008854 8 0a 03 b2 0f d4 1c 4b 02
E: 15.014980 8 0a 03 36 1a 92 18 f0 01
E: 15.016933 8 0a 03 b2 0f d4 1c 4b 02
E: 15.022928 8 0a 03 36 1a 92 18 f0 01
E: 15.025031 8 0a 03 b2 0f d4 1c 4b 02
E: 15.029956 8 0a 03 36 1a 92 18 f0 01
E: 15.031937 8 0a 03 b2 0f d4 1c 4b 02
E: 15.037942 8 0a 03 36 1a 92 18 f0 01
E: 15.039938 8 0a 03 b2 0f d4 1c 4b 02
E: 15.045983 8 0a 03 36 1a 92 18 f0 01
E: 15.047942 8 0a 03 b2 0f d4 1c 4b 02
E: 15.053001 8 0a 03 36 1a 92 18 f0 01
E: 15.054931 8 0a 03 b2 0f d4 1c 4b 02
E: 15.060967 8 0a 03 36 1a 92 18 f0 01
E: 15.062926 8 0a 03 b2 0f d4 1c 4b 02
E: 15.069094 8 0a 03 36 1a 92 18 f0 01
E: 15.070993 8 0a 03 b2 0f d4 1c 4e 02
E: 15.081388 8 0a 03 36 1a 92 18 f0 01
E: 15.081718 8 0a 03 b2 0f d4 1c 4e 02
E: 15.083960 8 0a 03 36 1a 92 18 f0 01
E: 15.085926 8 0a 03 b2 0f d4 1c 4e 02
E: 15.092026 8 0a 03 36 1a 92 18 f0 01
E: 15.093979 8 0a 03 b2 0f d4 1c 4e 02
E: 15.098958 8 0a 03 36 1a 92 18 f0 01
E: 15.100926 8 0a 03 b2 0f d4 1c 4e 02
E: 15.106992 8 0a 03 36 1a 92 18 f0 01
E: 15.108977 8 0a 03 b2 0f d4 1c 51 02
E: 15.113966 8 0a 03 36 1a 92 18 f0 01
E: 15.115943 8 0a 03 b2 0f d4 1c 51 02
E: 15.122026 8 0a 03 36 1a 92 18 ea 01
E: 15.124001 8 0a 03 b2 0f d4 1c 51 02
E: 15.129972 8 0a 03 36 1a 92 18 e4 01
E: 15.131988 8 0a 03 b2 0f d4 1c 54 02
E: 15.165936 8 0a 03 b2 0f d4 1c 54 02
E: 15.170936 8 0a 03 36 1a 92 18 d8 01
E: 15.174944 8 0a 03 b2 0f d4 1c 54 02
E: 15.179963 8 0a 03 36 1a 92 18 d0 01
E: 15.183986 8 0a 03 b2 0f d4 1c 54 02
E: 15.188943 8 0a 03 36 1a 92 18 8e 01
E: 15.192927 8 0a 03 b2 0f d4 1c 54 02
E: 15.197850 8 0a 00 36 1a 92 18 94 01
E: 15.202060 8 0a 03 b2 0f d4 1c 54 02
E: 15.210848 8 0a 03 b2 0f d4 1c 54 02
E: 15.218892 8 0a 03 b2 0f d4 1c 54 02
E: 15.227922 8 0a 03 b2 0f d4 1c 54 02
E: 15.236938 8 0a 03 b2 0f d4 1c 54 02
E: 15.245928 8 0a 03 b2 0f d4 1c 54 02
E: 15.254929 8 0a 03 b2 0f d4 1c 54 02
E: 15.264118 8 0a 03 b6 0f d6 1c 54 02
E: 15.271943 8 0a 03 bc 0f da 1c 54 02
E: 15.280960 8 0a 03 be 0f de 1c 54 02
E: 15.289954 8 0a 03 c0 0f e0 1c 54 02
E: 15.298933 8 0a 03 c0 0f e2 1c 54 02
E: 15.308265 8 0a 03 c0 0f e4 1c 54 02
E: 15.315962 8 0a 03 c0 0f e4 1c 54 02
E: 15.324983 8 0a 03 be 0f e8 1c 54 02
E: 15.333915 8 0a 03 be 0f e8 1c 54 02
E: 15.342965 8 0a 03 be 0f ea 1c 54 02
E: 15.351930 8 0a 03 be 0f ea 1c 54 02
E: 15.359891 8 0a 03 be 0f ea 1c 54 02
E: 15.368930 8 0a 03 be 0f ea 1c 54 02
E: 15.377891 8 0a 03 be 0f ea 1c 54 02
E: 15.386925 8 0a 03 be 0f ea 1c 54 02
E: 15.395893 8 0a 03 be 0f ea 1c 54 02
E: 15.404923 8 0a 03 be 0f ea 1c 54 02
E: 15.412913 8 0a 03 be 0f ea 1c 54 02
E: 15.421911 8 0a 03 be 0f ea 1c 54 02
E: 15.430928 8 0a 03 be 0f ea 1c 54 02
E: 15.439882 8 0a 03 be 0f ea 1c 54 02
E: 15.448920 8 0a 03 be 0f ea 1c 54 02
E: 15.457882 8 0a 03 be 0f ea 1c 54 02
E: 15.465931 8 0a 03 be 0f ea 1c 54 02
E: 15.474894 8 0a 03 be 0f ea 1c 54 02
E: 15.483926 8 0a 03 be 0f ea 1c 54 02
E: 15.492932 8 0a 03 be 0f ea 1c 54 02
E: 15.501897 8 0a 03 be 0f ea 1c 54 02
E: 15.510942 8 0a 03 be 0f ea 1c 54 02
E: 15.518930 8 0a 03 be 0f ea 1c 54 02
E: 15.527927 8 0a 03 be 0f ea 1c 54 02
E: 15.536930 8 0a 03 be 0f ea 1c 54 02
E: 15.545924 8 0a 03 be 0f ea 1c 54 02
E: 15.554997 8 0a 03 be 0f ea 1c 54 02
E: 15.563946 8 0a 03 be 0f ea 1c 54 02
E: 15.571976 8 0a 03 be 0f ea 1c 54 02
E: 15.580933 8 0a 03 be 0f ea 1c 54 02
E: 15.589899 8 0a 03 be 0f ea 1c 54 02
E: 15.598923 8 0a 03 be 0f ea 1c 54 02
E: 15.607888 8 0a 03 be 0f ea 1c 54 02
E: 15.616933 8 0a 03 be 0f ea 1c 54 02
E: 15.624893 8 0a 03 be 0f ea 1c 54 02
E: 15.633900 8 0a 03 be 0f ea 1c 54 02
E: 15.642837 8 0a 03 be 0f ea 1c 54 02
E: 15.651940 8 0a 03 be 0f ea 1c 54 02
E: 15.660926 8 0a 03 be 0f ea 1c 54 02
E: 15.669882 8 0a 03 be 0f ea 1c 54 02
E: 15.677917 8 0a 03 be 0f ea 1c 54 02
E: 15.686902 8 0a 03 be 0f ea 1c 54 02
E: 15.695927 8 0a 03 be 0f ea 1c 54 02
E: 15.704936 8 0a 03 be 0f ea 1c 54 02
E: 15.713929 8 0a 03 be 0f ea 1c 54 02
E: 15.722926 8 0a 03 be 0f ea 1c 54 02
E: 15.730886 8 0a 03 be 0f ea 1c 54 02
E: 15.739919 8 0a 03 be 0f ea 1c 54 02
E: 15.748884 8 0a 03 be 0f ea 1c 54 02
E: 15.757900 8 0a 03 be 0f ea 1c 54 02
E: 15.766961 8 0a 03 be 0f ea 1c 54 02
E: 15.776041 8 0a 03 be 0f ea 1c 54 02
E: 15.783931 8 0a 03 be 0f ea 1c 54 02
E: 15.792889 8 0a 03 be 0f ea 1c 54 02
E: 15.801924 8 0a 03 be 0f ea 1c 54 02
E: 15.810892 8 0a 03 be 0f ea 1c 54 02
E: 15.819957 8 0a 03 be 0f ea 1c 54 02
E: 15.828935 8 0a 03 be 0f ea 1c 54 02
E: 15.836927 8 0a 03 be 0f ea 1c 54 02
E: 15.845920 8 0a 03 be 0f ea 1c 54 02
E: 15.854884 8 0a 03 be 0f ea 1c 54 02
E: 15.863915 8 0a 03 be 0f ea 1c 54 02
E: 15.872927 8 0a 03 be 0f ea 1c 54 02
E: 15.881969 8 0a 03 be 0f ea 1c 54 02
E: 15.889941 8 0a 03 be 0f ea 1c 54 02
E: 15.898931 8 0a 03 be 0f ea 1c 54 02
E: 15.907832 8 0a 03 be 0f ea 1c 54 02
E: 15.916909 8 0a 03 be 0f ea 1c 54 02
E: 15.925932 8 0a 03 be 0f ea 1c 54 02
E: 15.934862 8 0a 03 be 0f ea 1c 54 02
E: 15.942550 8 0a 03 be 0f ea 1c 54 02
E: 15.951894 8 0a 03 be 0f ea 1c 54 02
E: 15.960868 8 0a 03 be 0f ea 1c 54 02
E: 15.969870 8 0a 03 be 0f ea 1c 54 02
E: 15.978870 8 0a 03 be 0f ea 1c 54 02
E: 15.987892 8 0a 03 be 0f ea 1c 54 02
E: 15.995946 8 0a 03 be 0f ea 1c 54 02
E: 16.004969 8 0a 03 be 0f ea 1c 54 02
E: 16.014029 8 0a 03 be 0f ea 1c 54 02
E: 16.022884 8 0a 03 be 0f ea 1c 54 02
E: 16.031955 8 0a 03 ba 0f ea 1c 54 02
E: 16.040906 8 0a 03 b2 0f e8 1c 54 02
E: 16.048893 8 0a 03 ae 0f e8 1c 54 02
E: 16.057887 8 0a 03 aa 0f e8 1c 54 02
E: 16.066991 8 0a 03 aa 0f e8 1c 54 02
E: 16.075958 8 0a 03 a8 0f e8 1c 54 02
E: 16.084894 8 0a 03 a8 0f e8 1c 54 02
E: 16.092896 8 0a 03 a8 0f e8 1c 54 02
E: 16.101910 8 0a 03 a8 0f e8 1c 54 02
E: 16.110871 8 0a 03 a8 0f e8 1c 54 02
E: 16.119925 8 0a 03 a8 0f e8 1c 54 02
E: 16.128883 8 0a 03 a8 0f e8 1c 54 02
E: 16.137860 8 0a 03 a8 0f e8 1c 54 02
E: 16.145898 8 0a 03 a8 0f e8 1c 54 02
E: 16.154881 8 0a 03 a8 0f e8 1c 54 02
E: 16.163867 8 0a 03 a8 0f e8 1c 54 02
E: 16.172867 8 0a 03 a8 0f e8 1c 54 02
E: 16.181868 8 0a 03 a8 0f e8 1c 54 02
E: 16.190538 8 0a 03 a8 0f e8 1c 54 02
E: 16.198942 8 0a 03 a8 0f e8 1c 54 02
E: 16.207882 8 0a 03 a8 0f e8 1c 54 02
E: 16.216877 8 0a 03 a8 0f e8 1c 54 02
E: 16.225873 8 0a 03 a8 0f e8 1c 54 02
E: 16.233872 8 0a 03 a8 0f e8 1c 54 02
E: 16.258950 8 0a 03 a8 0f e8 1c 54 02
E: 16.260896 8 0a 00 a8 0f e8 1c 54 02
# 3. Finally, move your ten fingers on the screen and release them.
E: 23.565931 8 0a 00 04 1d f2 17 20 01
E: 23.583970 8 0a 03 02 1d f0 17 20 01
E: 23.606029 8 0a 00 02 1d f0 17 20 01
E: 23.617898 8 0a 00 12 12 2a 12 e6 01
E: 23.624861 8 0a 03 14 12 2c 12 d6 01
E: 23.633032 8 0a 03 16 12 2c 12 da 01
E: 23.641956 8 0a 03 18 12 2c 12 de 01
E: 23.649951 8 0a 03 16 12 2c 12 e2 01
E: 23.658077 8 0a 03 16 12 2c 12 e6 01
E: 23.666031 8 0a 03 14 12 2c 12 ea 01
E: 23.693036 8 0a 03 12 12 2c 12 ee 01
E: 23.694924 8 0a 00 fa 1a ba 09 fe 02
E: 23.707959 8 0a 03 10 12 2c 12 f2 01
E: 23.709970 8 0a 03 fa 1a bc 09 02 02
E: 23.714976 8 0a 03 10 12 2c 12 f4 01
E: 23.716973 8 0a 03 fa 1a be 09 06 02
E: 23.722856 8 0a 03 c2 12 88 12 f6 01
E: 23.724880 8 0a 03 fa 1a c0 09 0c 02
E: 23.731110 8 0a 03 58 13 d6 12 fa 01
E: 23.732928 8 0a 03 fe 1a c4 09 12 02
E: 23.737972 8 0a 03 3e 14 4c 13 00 01
E: 23.739973 8 0a 03 02 1b c6 09 16 02
E: 23.745843 8 0a 03 02 15 b0 13 06 01
E: 23.748066 8 0a 03 08 1b c8 09 20 02
E: 23.752982 8 0a 03 e4 15 22 14 0a 01
E: 23.755002 8 0a 03 0c 1b c8 09 20 02
E: 23.760975 8 0a 03 a4 17 08 15 0e 01
E: 23.763273 8 0a 03 10 1b c8 09 20 02
E: 23.769024 8 0a 03 18 19 c8 15 12 01
E: 23.770887 8 0a 03 10 1b c6 09 20 02
E: 23.775972 8 0a 03 0c 1a 46 16 16 01
E: 23.777977 8 0a 03 10 1b c6 09 20 02
E: 23.784078 8 0a 03 da 1a b0 16 20 01
E: 23.785950 8 0a 03 10 1b c6 09 20 02
E: 23.791991 8 0a 03 62 1b f6 16 20 01
E: 23.793933 8 0a 03 10 1b c6 09 20 02
E: 23.798867 8 0a 03 d4 1b 32 17 20 01
E: 23.801564 8 0a 03 10 1b c6 09 20 02
E: 23.806981 8 0a 03 1e 1c 5a 17 20 01
E: 23.808931 8 0a 03 10 1b c6 09 20 02
E: 23.813980 8 0a 03 5a 1c 78 17 20 01
E: 23.816058 8 0a 03 10 1b c6 09 20 02
E: 23.822039 8 0a 03 82 1c 8e 17 20 01
E: 23.823949 8 0a 03 10 1b c6 09 20 02
E: 23.829948 8 0a 03 a4 1c a0 17 20 01
E: 23.832063 8 0a 03 10 1b c6 09 20 02
E: 23.837107 8 0a 03 ba 1c ac 17 20 01
E: 23.838988 8 0a 03 10 1b c6 09 20 02
E: 23.844992 8 0a 03 ce 1c b6 17 20 01
E: 23.847000 8 0a 03 10 1b c6 09 20 02
E: 23.853047 8 0a 03 dc 1c be 17 20 01
E: 23.855008 8 0a 03 10 1b c6 09 20 02
E: 23.859993 8 0a 03 ea 1c c4 17 20 01
E: 23.861952 8 0a 03 10 1b c6 09 20 02
E: 23.867902 8 0a 03 f2 1c ca 17 20 01
E: 23.870173 8 0a 03 10 1b c6 09 20 02
E: 23.876069 8 0a 03 fa 1c cc 17 20 01
E: 23.878012 8 0a 03 10 1b c6 09 20 02
E: 23.883053 8 0a 03 00 1d ce 17 20 01
E: 23.885011 8 0a 03 10 1b c6 09 20 02
E: 23.890885 8 0a 03 06 1d d0 17 20 01
E: 23.892880 8 0a 03 10 1b c6 09 20 02
E: 23.898373 8 0a 03 08 1d d4 17 20 01
E: 23.899885 8 0a 03 10 1b c6 09 20 02
E: 23.905842 8 0a 03 0c 1d d6 17 20 01
E: 23.907823 8 0a 03 10 1b c6 09 20 02
E: 23.913860 8 0a 03 0c 1d d8 17 20 01
E: 23.915832 8 0a 03 10 1b c6 09 20 02
E: 23.920958 8 0a 03 0e 1d da 17 20 01
E: 23.922949 8 0a 03 10 1b c6 09 20 02
E: 23.928998 8 0a 03 0e 1d dc 17 20 01
E: 23.930993 8 0a 03 10 1b c6 09 20 02
E: 23.936966 8 0a 03 0e 1d dc 17 20 01
E: 23.938901 8 0a 03 10 1b c6 09 20 02
E: 23.943967 8 0a 03 0e 1d de 17 20 01
E: 23.945940 8 0a 03 10 1b c6 09 20 02
E: 23.951889 8 0a 03 0e 1d de 17 20 01
E: 23.953962 8 0a 03 10 1b c6 09 20 02
E: 23.959932 8 0a 03 0e 1d de 17 20 01
E: 23.961890 8 0a 03 10 1b c6 09 20 02
E: 23.966887 8 0a 03 0e 1d de 17 20 01
E: 23.968908 8 0a 03 10 1b c6 09 20 02
E: 23.974899 8 0a 03 0e 1d de 17 20 01
E: 23.976904 8 0a 03 10 1b c6 09 20 02
E: 23.982891 8 0a 03 0e 1d de 17 20 01
E: 23.984916 8 0a 03 10 1b ca 09 20 02
E: 23.989932 8 0a 03 0e 1d de 17 20 01
E: 23.991925 8 0a 03 10 1b ce 09 20 02
E: 23.997920 8 0a 03 0e 1d de 17 20 01
E: 23.999935 8 0a 03 10 1b d2 09 20 02
E: 24.004828 8 0a 03 0e 1d de 17 20 01
E: 24.006969 8 0a 03 10 1b d6 09 20 02
E: 24.012913 8 0a 03 0e 1d de 17 20 01
E: 24.014935 8 0a 03 10 1b d6 09 20 02
E: 24.021024 8 0a 03 0e 1d de 17 20 01
E: 24.022916 8 0a 03 10 1b d6 09 20 02
E: 24.027902 8 0a 03 0e 1d de 17 20 01
E: 24.029885 8 0a 03 10 1b d6 09 20 02
E: 24.035881 8 0a 03 0e 1d de 17 20 01
E: 24.037935 8 0a 03 10 1b d6 09 20 02
E: 24.043900 8 0a 03 0e 1d de 17 20 01
E: 24.045882 8 0a 03 10 1b d6 09 20 02
E: 24.050887 8 0a 03 0e 1d de 17 20 01
E: 24.052930 8 0a 03 10 1b d6 09 20 02
E: 24.058897 8 0a 03 0e 1d de 17 20 01
E: 24.060877 8 0a 03 10 1b d6 09 20 02
E: 24.066902 8 0a 03 0e 1d de 17 20 01
E: 24.068930 8 0a 03 10 1b d6 09 20 02
E: 24.073890 8 0a 03 0e 1d de 17 20 01
E: 24.075882 8 0a 03 10 1b d6 09 20 02
E: 24.081920 8 0a 03 0e 1d de 17 20 01
E: 24.083932 8 0a 03 10 1b d6 09 20 02
E: 24.089895 8 0a 03 0e 1d de 17 20 01
E: 24.091965 8 0a 03 10 1b d6 09 20 02
E: 24.096903 8 0a 03 0e 1d de 17 20 01
E: 24.098912 8 0a 03 10 1b d6 09 20 02
E: 24.104912 8 0a 03 0e 1d de 17 20 01
E: 24.110826 8 0a 03 10 1b dc 09 20 02
E: 24.112839 8 0a 03 0e 1d de 17 20 01
E: 24.114938 8 0a 03 0e 1b e4 09 20 02
E: 24.119942 8 0a 03 0e 1d de 17 20 01
E: 24.121932 8 0a 03 0c 1b ec 09 20 02
E: 24.127843 8 0a 03 0e 1d de 17 20 01
E: 24.129955 8 0a 03 0c 1b f0 09 20 02
E: 24.135921 8 0a 03 0e 1d de 17 20 01
E: 24.137922 8 0a 03 0a 1b f4 09 20 02
E: 24.142988 8 0a 03 0e 1d de 17 20 01
E: 24.144854 8 0a 03 0c 1b f4 09 20 02
E: 24.150888 8 0a 03 0e 1d de 17 20 01
E: 24.152888 8 0a 03 0c 1b f4 09 20 02
E: 24.157999 8 0a 03 0e 1d de 17 20 01
E: 24.159951 8 0a 03 0c 1b f4 09 20 02
E: 24.166061 8 0a 03 0e 1d de 17 20 01
E: 24.167929 8 0a 03 0c 1b f4 09 20 02
E: 24.173933 8 0a 03 0e 1d de 17 20 01
E: 24.175936 8 0a 03 0c 1b f4 09 20 02
E: 24.180906 8 0a 03 0e 1d de 17 20 01
E: 24.182879 8 0a 03 0c 1b f4 09 20 02
E: 24.188904 8 0a 03 0e 1d de 17 20 01
E: 24.190880 8 0a 03 0c 1b f4 09 20 02
E: 24.196904 8 0a 03 0e 1d de 17 20 01
E: 24.198883 8 0a 03 0c 1b f4 09 20 02
E: 24.203873 8 0a 03 0e 1d de 17 20 01
E: 24.205882 8 0a 03 0c 1b f4 09 20 02
E: 24.211895 8 0a 03 0e 1d de 17 20 01
E: 24.213876 8 0a 03 0c 1b f4 09 20 02
E: 24.219908 8 0a 03 0e 1d de 17 20 01
E: 24.221872 8 0a 03 0c 1b f4 09 20 02
E: 24.226871 8 0a 03 0e 1d de 17 20 01
E: 24.228890 8 0a 03 0c 1b f4 09 20 02
E: 24.234883 8 0a 03 0e 1d de 17 20 01
E: 24.236867 8 0a 03 0c 1b f4 09 20 02
E: 24.242901 8 0a 03 0e 1d de 17 20 01
E: 24.244873 8 0a 03 0c 1b f4 09 20 02
E: 24.249894 8 0a 03 0e 1d de 17 20 01
E: 24.251873 8 0a 03 0c 1b f4 09 20 02
E: 24.257914 8 0a 03 0e 1d de 17 20 01
E: 24.259885 8 0a 03 0c 1b f4 09 20 02
E: 24.265876 8 0a 03 0e 1d de 17 20 01
E: 24.267889 8 0a 03 0c 1b f4 09 20 02
E: 24.272964 8 0a 03 0e 1d de 17 20 01
E: 24.274996 8 0a 03 0c 1b f4 09 20 02
E: 24.280915 8 0a 03 0e 1d de 17 20 01
E: 24.282880 8 0a 03 0c 1b f4 09 20 02
E: 24.288933 8 0a 03 0e 1d de 17 20 01
E: 24.290892 8 0a 03 0c 1b f4 09 20 02
E: 24.295880 8 0a 03 0e 1d de 17 20 01
E: 24.297869 8 0a 03 0c 1b f4 09 20 02
E: 24.303902 8 0a 03 0e 1d de 17 20 01
E: 24.305900 8 0a 03 0c 1b f4 09 20 02
E: 24.311887 8 0a 03 0e 1d de 17 20 01
E: 24.313906 8 0a 03 0c 1b f4 09 20 02
E: 24.318950 8 0a 03 0e 1d de 17 20 01
E: 24.320901 8 0a 03 0c 1b f4 09 20 02
E: 24.326883 8 0a 03 0e 1d de 17 20 01
E: 24.328875 8 0a 03 0c 1b f4 09 20 02
E: 24.334903 8 0a 03 0e 1d de 17 20 01
E: 24.336868 8 0a 03 0c 1b f4 09 20 02
E: 24.342014 8 0a 03 0e 1d de 17 20 01
E: 24.343973 8 0a 03 0c 1b f4 09 20 02
E: 24.349962 8 0a 03 0e 1d de 17 20 01
E: 24.351899 8 0a 03 0c 1b f4 09 20 02
E: 24.357872 8 0a 03 0e 1d de 17 20 01
E: 24.359802 8 0a 03 0c 1b f4 09 20 02
E: 24.364938 8 0a 03 0e 1d de 17 20 01
E: 24.366875 8 0a 03 0c 1b f4 09 20 02
E: 24.372912 8 0a 03 0e 1d de 17 20 01
E: 24.374494 8 0a 03 0c 1b f4 09 20 02
E: 24.380966 8 0a 03 0a 1d e2 17 20 01
E: 24.382887 8 0a 03 0c 1b f4 09 20 02
E: 24.387905 8 0a 03 fc 1c e8 17 20 01
E: 24.389914 8 0a 03 0c 1b f4 09 20 02
E: 24.394943 8 0a 03 f0 1c ec 17 20 01
E: 24.396877 8 0a 03 0c 1b f4 09 20 02
E: 24.401923 8 0a 03 e4 1c f0 17 20 01
E: 24.403907 8 0a 03 0c 1b f0 09 20 02
E: 24.409051 8 0a 03 d6 1c fa 17 20 01
E: 24.410958 8 0a 03 0a 1b e8 09 20 02
E: 24.415936 8 0a 03 c6 1c 02 18 20 01
E: 24.417896 8 0a 03 06 1b e2 09 20 02
E: 24.422951 8 0a 03 b6 1c 0c 18 20 01
E: 24.424899 8 0a 03 00 1b e0 09 20 02
E: 24.429944 8 0a 03 a2 1c 12 18 20 01
E: 24.432033 8 0a 03 fc 1a dc 09 20 02
E: 24.436009 8 0a 03 92 1c 1a 18 20 01
E: 24.438018 8 0a 03 f8 1a dc 09 20 02
E: 24.443069 8 0a 03 84 1c 24 18 20 01
E: 24.445032 8 0a 03 ee 1a e6 09 20 02
E: 24.450644 8 0a 03 78 1c 32 18 20 01
E: 24.452028 8 0a 03 e2 1a f2 09 20 02
E: 24.457029 8 0a 03 6e 1c 40 18 20 01
E: 24.459269 8 0a 03 da 1a fe 09 20 02
E: 24.464043 8 0a 03 64 1c 50 18 03 01
E: 24.466046 8 0a 03 d4 1a 0e 0a 20 02
E: 24.470961 8 0a 03 5a 1c 5e 18 09 01
E: 24.472981 8 0a 03 cc 1a 18 0a 20 02
E: 24.478991 8 0a 03 50 1c 6e 18 0c 01
E: 24.480981 8 0a 03 c6 1a 24 0a 20 02
E: 24.486968 8 0a 03 46 1c 7a 18 0f 01
E: 24.488964 8 0a 03 c2 1a 28 0a 20 02
E: 24.495970 8 0a 03 44 1c 84 18 12 01
E: 24.497970 8 0a 03 c4 1a 2e 0a 20 02
E: 24.503951 8 0a 03 40 1c 90 18 15 01
E: 24.505986 8 0a 03 c6 1a 2e 0a 20 02
E: 24.511976 8 0a 03 3e 1c 9a 18 18 01
E: 24.513966 8 0a 03 ca 1a 2c 0a 20 02
E: 24.520871 8 0a 03 3a 1c a6 18 12 01
E: 24.522859 8 0a 03 ce 1a 2c 0a 20 02
E: 24.549967 8 0a 03 36 1c b2 18 12 01
E: 24.551967 8 0a 03 d2 1a 2a 0a 20 02
E: 24.563975 8 0a 03 2e 1c bc 18 0c 01
E: 24.565964 8 0a 03 d2 1a 28 0a 20 02
E: 24.577093 8 0a 03 18 1c d2 18 06 01
E: 24.578916 8 0a 03 d0 1a 1c 0a 20 02
E: 24.584900 8 0a 03 00 1c e6 18 03 01
E: 24.588714 8 0a 03 cc 1a 12 0a 20 02
E: 24.593983 8 0a 03 e4 1b fc 18 03 01
E: 24.595968 8 0a 03 c8 1a 04 0a 20 02
E: 24.602050 8 0a 03 cc 1b 10 19 03 01
E: 24.604035 8 0a 03 c4 1a fa 09 20 02
E: 24.609950 8 0a 03 b4 1b 24 19 06 01
E: 24.611846 8 0a 03 c0 1a f0 09 20 02
E: 24.619029 8 0a 03 9a 1b 34 19 09 01
E: 24.621087 8 0a 03 bc 1a e6 09 20 02
E: 24.625934 8 0a 03 80 1b 46 19 0c 01
E: 24.627972 8 0a 03 b6 1a e2 09 20 02
E: 24.633990 8 0a 03 66 1b 52 19 0f 01
E: 24.638384 8 0a 03 b2 1a da 09 20 02
E: 24.642111 8 0a 03 56 1b 64 19 12 01
E: 24.644215 8 0a 03 ae 1a d8 09 20 02
E: 24.648867 8 0a 03 46 1b 74 19 15 01
E: 24.650860 8 0a 03 ac 1a d2 09 20 02
E: 24.657086 8 0a 03 3a 1b 88 19 18 01
E: 24.659056 8 0a 03 a6 1a ce 09 20 02
E: 24.664123 8 0a 03 30 1b 9c 19 1b 01
E: 24.665986 8 0a 03 a4 1a ca 09 20 02
E: 24.672246 8 0a 03 26 1b ae 19 1e 01
E: 24.674573 8 0a 03 9c 1a c4 09 20 02
E: 24.679998 8 0a 03 20 1b c0 19 21 01
E: 24.681993 8 0a 03 9c 1a c0 09 20 02
E: 24.686884 8 0a 03 1c 1b d0 19 24 01
E: 24.689106 8 0a 03 98 1a bc 09 20 02
E: 24.695109 8 0a 03 18 1b de 19 24 01
E: 24.697023 8 0a 03 96 1a b8 09 20 02
E: 24.703006 8 0a 03 16 1b ea 19 24 01
E: 24.704962 8 0a 03 92 1a b6 09 20 02
E: 24.710003 8 0a 03 0c 1b f4 19 27 01
E: 24.711986 8 0a 03 8e 1a b4 09 20 02
E: 24.716975 8 0a 03 06 1b 00 1a 2a 01
E: 24.718973 8 0a 03 86 1a b2 09 20 02
E: 24.724000 8 0a 03 fe 1a 0a 1a 2d 01
E: 24.725955 8 0a 03 8a 1a a8 09 20 02
E: 24.730962 8 0a 03 f6 1a 12 1a 30 01
E: 24.732973 8 0a 03 86 1a 9e 09 20 02
E: 24.737023 8 0a 03 f0 1a 1a 1a 33 01
E: 24.739020 8 0a 03 8a 1a 90 09 20 02
E: 24.744010 8 0a 03 ec 1a 22 1a 30 01
E: 24.745960 8 0a 03 8a 1a 86 09 20 02
E: 24.750962 8 0a 03 e8 1a 28 1a 30 01
E: 24.752972 8 0a 03 8e 1a 7a 09 20 02
E: 24.757962 8 0a 03 e4 1a 30 1a 2d 01
E: 24.759960 8 0a 03 8e 1a 72 09 20 02
E: 24.764939 8 0a 03 e2 1a 3a 1a 2d 01
E: 24.766907 8 0a 03 90 1a 68 09 20 02
E: 24.771902 8 0a 03 de 1a 42 1a 2d 01
E: 24.773923 8 0a 03 90 1a 60 09 20 02
E: 24.778935 8 0a 03 de 1a 4c 1a 30 01
E: 24.780948 8 0a 03 92 1a 5a 09 20 02
E: 24.784923 8 0a 03 de 1a 54 1a 30 01
E: 24.786907 8 0a 03 94 1a 54 09 20 02
E: 24.791914 8 0a 03 dc 1a 5c 1a 30 01
E: 24.793917 8 0a 03 94 1a 50 09 20 02
E: 24.798926 8 0a 03 da 1a 66 1a 33 01
E: 24.800946 8 0a 03 92 1a 4e 09 20 02
E: 24.805936 8 0a 03 d8 1a 6c 1a 36 01
E: 24.807907 8 0a 03 92 1a 4a 09 20 02
E: 24.812901 8 0a 03 d6 1a 74 1a 39 01
E: 24.814923 8 0a 03 92 1a 48 09 20 02
E: 24.819908 8 0a 03 d4 1a 7c 1a 3c 01
E: 24.821890 8 0a 03 90 1a 44 09 20 02
E: 24.826971 8 0a 03 d0 1a 82 1a 3f 01
E: 24.828918 8 0a 03 92 1a 3c 09 20 02
E: 24.832900 8 0a 03 cc 1a 8a 1a 42 01
E: 24.834927 8 0a 03 92 1a 36 09 20 02
E: 24.839912 8 0a 03 cc 1a 90 1a 45 01
E: 24.841895 8 0a 03 94 1a 2e 09 20 02
E: 24.846975 8 0a 03 ca 1a 96 1a 48 01
E: 24.848901 8 0a 03 96 1a 28 09 20 02
E: 24.853899 8 0a 03 c6 1a 9a 1a 4b 01
E: 24.855926 8 0a 03 98 1a 20 09 20 02
E: 24.860912 8 0a 03 c4 1a 9e 1a 4e 01
E: 24.862881 8 0a 03 9a 1a 1c 09 20 02
E: 24.867998 8 0a 03 c0 1a a2 1a 51 01
E: 24.869950 8 0a 03 9e 1a 16 09 20 02
E: 24.873907 8 0a 03 bc 1a a4 1a 54 01
E: 24.875933 8 0a 03 9e 1a 10 09 20 02
E: 24.880909 8 0a 03 bc 1a a8 1a 57 01
E: 24.882900 8 0a 03 9e 1a 0a 09 20 02
E: 24.887928 8 0a 03 ba 1a aa 1a 5a 01
E: 24.889982 8 0a 03 98 1a 00 09 20 02
E: 24.894948 8 0a 03 b8 1a ac 1a 5d 01
E: 24.896929 8 0a 03 94 1a f6 08 20 02
E: 24.901913 8 0a 03 b6 1a ae 1a 58 01
E: 24.903902 8 0a 03 8e 1a ee 08 20 02
E: 24.908937 8 0a 03 b4 1a b0 1a 5a 01
E: 24.910906 8 0a 03 86 1a e2 08 20 02
E: 24.916240 8 0a 03 b4 1a b0 1a 5c 01
E: 24.917942 8 0a 03 7e 1a d8 08 20 02
E: 24.921957 8 0a 03 b4 1a b0 1a 5e 01
E: 24.923967 8 0a 03 76 1a cc 08 20 02
E: 24.928960 8 0a 03 b4 1a b0 1a 60 01
E: 24.930976 8 0a 03 6e 1a c2 08 20 02
E: 24.935946 8 0a 03 b4 1a b0 1a 62 01
E: 24.937973 8 0a 03 66 1a b8 08 20 02
E: 24.942949 8 0a 03 b4 1a b0 1a 64 01
E: 24.944968 8 0a 03 62 1a b2 08 20 02
E: 24.949966 8 0a 03 b4 1a b0 1a 66 01
E: 24.951967 8 0a 03 60 1a a8 08 20 02
E: 24.956910 8 0a 03 b4 1a b0 1a 66 01
E: 24.958945 8 0a 03 5c 1a a2 08 20 02
E: 24.963910 8 0a 03 b4 1a b0 1a 66 01
E: 24.965913 8 0a 03 5e 1a 9e 08 20 02
E: 24.970938 8 0a 03 b4 1a b0 1a 66 01
E: 24.972926 8 0a 03 5a 1a 9a 08 20 02
E: 24.977914 8 0a 03 b4 1a b0 1a 66 01
E: 24.979927 8 0a 03 58 1a 96 08 20 02
E: 24.983920 8 0a 03 b4 1a b0 1a 66 01
E: 24.985906 8 0a 03 56 1a 92 08 20 02
E: 24.992031 8 0a 03 b4 1a b0 1a 66 01
E: 24.993919 8 0a 03 58 1a 8e 08 20 02
E: 25.000047 8 0a 03 b4 1a b0 1a 62 01
E: 25.002056 8 0a 03 5a 1a 8a 08 20 02
E: 25.009046 8 0a 03 b6 1a b4 1a 5e 01
E: 25.011056 8 0a 03 5e 1a 80 08 20 02
E: 25.017052 8 0a 03 b0 1a c2 1a 5a 01
E: 25.018901 8 0a 03 62 1a 80 08 20 02
E: 25.025052 8 0a 03 b2 1a ca 1a 5d 01
E: 25.027058 8 0a 03 66 1a 74 08 20 02
E: 25.034066 8 0a 03 a8 1a d2 1a 57 01
E: 25.035966 8 0a 03 62 1a 6e 08 20 02
E: 25.042276 8 0a 03 a8 1a d8 1a 51 01
E: 25.044081 8 0a 03 66 1a 66 08 20 02
E: 25.059836 8 0a 03 a4 1a de 1a 4b 01
E: 25.061843 8 0a 03 6a 1a 5e 08 20 02
E: 25.078993 8 0a 03 a4 1a e2 1a 45 01
E: 25.081081 8 0a 03 6c 1a 54 08 20 02
E: 25.086970 8 0a 03 a2 1a e6 1a 3f 01
E: 25.088972 8 0a 03 68 1a 4c 08 20 02
E: 25.094972 8 0a 03 a0 1a ea 1a 39 01
E: 25.096963 8 0a 03 68 1a 46 08 20 02
E: 25.103961 8 0a 03 a2 1a ee 1a 33 01
E: 25.105998 8 0a 03 66 1a 40 08 20 02
E: 25.111963 8 0a 03 a4 1a f0 1a 2d 01
E: 25.113967 8 0a 03 62 1a 3c 08 20 02
E: 25.119945 8 0a 03 a4 1a f2 1a 27 01
E: 25.121985 8 0a 03 5e 1a 3e 08 20 02
E: 25.128978 8 0a 03 a8 1a f6 1a 21 01
E: 25.130979 8 0a 03 5c 1a 3a 08 20 02
E: 25.136836 8 0a 03 a4 1a f6 1a 1b 01
E: 25.138948 8 0a 03 5a 1a 36 08 20 02
E: 25.144956 8 0a 03 aa 1a f8 1a 15 01
E: 25.147057 8 0a 03 5a 1a 32 08 20 02
E: 25.154024 8 0a 03 a8 1a f6 1a 0f 01
E: 25.156015 8 0a 03 5c 1a 2e 08 20 02
E: 25.161982 8 0a 03 ac 1a f8 1a 09 01
E: 25.163999 8 0a 03 5e 1a 2a 08 20 02
E: 25.169870 8 0a 03 ac 1a f6 1a 0c 01
E: 25.171954 8 0a 03 5e 1a 2a 08 20 02
E: 25.176917 8 0a 03 ac 1a f6 1a 0c 01
E: 25.178922 8 0a 03 5e 1a 28 08 20 02
E: 25.184840 8 0a 03 ac 1a f6 1a 06 01
E: 25.186980 8 0a 03 5c 1a 28 08 20 02
E: 25.191945 8 0a 03 ac 1a f6 1a 00 01
E: 25.193843 8 0a 03 5c 1a 28 08 20 02
E: 25.207969 8 0a 03 ac 1a f6 1a 20 01
E: 25.209932 8 0a 03 5c 1a 28 08 20 02
E: 25.239969 8 0a 03 ac 1a f6 1a 21 01
E: 25.241966 8 0a 00 ac 1a f6 1a 21 01
E: 25.243946 8 0a 03 5c 1a 28 08 20 02
E: 25.245856 8 0a 00 5c 1a 28 08 20 02
# Thank you.
