R: 279 05 0d 09 04 a1 01 85 0a 09 22 a1 02 09 42 09 32 15 00 25 01 95 02 75 01 81 02 95 06 81 03 05 01 26 ff 1f 75 10 95 01 55 0d 65 33 09 31 35 00 46 39 13 81 02 09 30 46 24 22 81 02 05 0d 75 08 95 01 09 30 26 ff 00 81 02 09 51 81 02 85 0c 09 55 25 02 95 01 b1 02 c0 06 00 ff 85 02 09 01 75 08 95 07 b1 02 85 03 09 02 75 08 95 07 b1 02 85 04 09 03 75 08 95 07 b1 02 85 05 09 04 75 08 95 07 b1 02 85 06 09 05 75 08 95 1f b1 02 85 07 09 06 75 08 96 1f 00 b1 02 85 08 09 07 75 08 95 07 b1 02 85 09 09 08 75 08 95 07 b1 02 85 0b 09 09 75 08 95 07 b1 02 85 0d 09 0a 75 08 96 1f 00 b1 02 c0 09 0e a1 01 85 0e 09 52 09 53 95 07 b1 02 c0 05 01 09 02 a1 01 85 01 09 01 a1 00 05 09 19 01 29 02 15 00 25 01 75 01 95 02 81 02 75 06 95 01 81 01 05 01 09 31 09 30 15 00 27 ff 1f 00 00 75 10 95 02 81 02 c0 09 01 a1 02 15 00 26 ff 00 95 02 75 08 81 03 c0 c0
N: IDEACOM  IDC 6651
I: 3 1cb6 6651
# 1. Drag _one_ finger on the screen from one corner to the opposite, and release it.
E: 0.000000 8 0a 00 26 1f 72 00 20 01
E: 0.003953 8 0a 03 20 1f 78 00 fe 01
E: 0.007959 8 0a 03 1c 1f 7a 00 10 01
E: 0.011966 8 0a 03 1a 1f 7c 00 20 01
E: 0.015923 8 0a 03 1a 1f 7a 00 20 01
E: 0.019931 8 0a 03 1c 1f 78 00 20 01
E: 0.023950 8 0a 03 20 1f 72 00 20 01
E: 0.027925 8 0a 03 26 1f 6e 00 20 01
E: 0.031917 8 0a 03 2a 1f 66 00 20 01
E: 0.035927 8 0a 03 30 1f 60 00 20 01
E: 0.039925 8 0a 03 36 1f 5a 00 20 01
E: 0.043954 8 0a 03 3e 1f 56 00 20 01
E: 0.047926 8 0a 03 44 1f 4e 00 20 01
E: 0.051947 8 0a 03 4a 1f 4a 00 20 01
E: 0.055964 8 0a 03 4e 1f 44 00 20 01
E: 0.058925 8 0a 03 52 1f 40 00 20 01
E: 0.062938 8 0a 03 56 1f 3a 00 20 01
E: 0.066970 8 0a 03 5a 1f 36 00 20 01
E: 0.070934 8 0a 03 5e 1f 30 00 20 01
E: 0.074927 8 0a 03 62 1f 2e 00 20 01
E: 0.078927 8 0a 03 66 1f 2a 00 00 01
E: 0.083962 8 0a 03 6a 1f 26 00 12 01
E: 0.087938 8 0a 03 6c 1f 24 00 24 01
E: 0.092121 8 0a 03 6c 1f 24 00 33 01
E: 0.095939 8 0a 03 6c 1f 24 00 42 01
E: 0.099924 8 0a 03 6c 1f 24 00 51 01
E: 0.103925 8 0a 03 6c 1f 24 00 58 01
E: 0.107930 8 0a 03 6c 1f 24 00 60 01
E: 0.111967 8 0a 03 6c 1f 24 00 68 01
E: 0.115930 8 0a 03 6c 1f 24 00 70 01
E: 0.119954 8 0a 03 6c 1f 24 00 78 01
E: 0.123942 8 0a 03 6c 1f 24 00 80 01
E: 0.127926 8 0a 03 6c 1f 24 00 86 01
E: 0.131926 8 0a 03 6c 1f 24 00 8c 01
E: 0.135959 8 0a 03 6c 1f 24 00 92 01
E: 0.140928 8 0a 03 6c 1f 24 00 98 01
E: 0.144951 8 0a 03 6c 1f 24 00 9e 01
E: 0.148962 8 0a 03 6c 1f 24 00 a4 01
E: 0.152931 8 0a 03 6c 1f 24 00 aa 01
E: 0.156927 8 0a 03 6c 1f 24 00 b0 01
E: 0.160949 8 0a 03 6c 1f 24 00 b4 01
E: 0.164925 8 0a 03 6c 1f 24 00 b8 01
E: 0.168926 8 0a 03 6c 1f 24 00 bc 01
E: 0.172924 8 0a 03 6c 1f 24 00 c0 01
E: 0.177923 8 0a 03 6c 1f 24 00 c4 01
E: 0.181925 8 0a 03 6c 1f 24 00 c8 01
E: 0.185932 8 0a 03 72 1f 22 00 cc 01
E: 0.189925 8 0a 03 7e 1f 22 00 d0 01
E: 0.193932 8 0a 03 88 1f 20 00 d4 01
E: 0.197941 8 0a 03 90 1f 20 00 d8 01
E: 0.201933 8 0a 03 98 1f 20 00 da 01
E: 0.205929 8 0a 03 9e 1f 20 00 dc 01
E: 0.209933 8 0a 03 a2 1f 20 00 de 01
E: 0.213953 8 0a 03 a6 1f 20 00 e0 01
E: 0.218956 8 0a 03 aa 1f 20 00 e2 01
E: 0.222934 8 0a 03 ac 1f 20 00 e4 01
E: 0.226953 8 0a 03 ae 1f 20 00 e6 01
E: 0.230926 8 0a 03 ae 1f 20 00 e8 01
E: 0.234956 8 0a 03 ae 1f 20 00 ea 01
E: 0.238929 8 0a 03 ae 1f 20 00 ec 01
E: 0.242925 8 0a 03 ae 1f 20 00 ee 01
E: 0.246918 8 0a 03 ae 1f 20 00 f0 01
E: 0.250921 8 0a 03 ae 1f 20 00 f2 01
E: 0.255079 8 0a 03 ae 1f 20 00 f4 01
E: 0.258951 8 0a 03 ae 1f 20 00 f6 01
E: 0.262930 8 0a 03 ae 1f 20 00 f8 01
E: 0.266958 8 0a 03 ae 1f 20 00 fa 01
E: 0.270946 8 0a 03 ae 1f 20 00 fc 01
E: 0.274929 8 0a 03 ae 1f 20 00 fe 01
E: 0.278917 8 0a 03 ae 1f 20 00 fe 01
E: 0.282948 8 0a 03 ae 1f 20 00 fe 01
E: 0.286918 8 0a 03 ae 1f 20 00 fe 01
E: 0.290914 8 0a 03 ae 1f 20 00 fe 01
E: 0.294914 8 0a 03 ae 1f 20 00 fe 01
E: 0.298914 8 0a 03 ae 1f 20 00 fe 01
E: 0.303188 8 0a 03 ae 1f 20 00 fe 01
E: 0.306922 8 0a 03 ae 1f 20 00 fe 01
E: 0.310906 8 0a 03 ae 1f 20 00 fe 01
E: 0.314889 8 0a 03 ae 1f 20 00 fe 01
E: 0.318941 8 0a 03 ae 1f 20 00 fe 01
E: 0.322918 8 0a 03 ae 1f 20 00 fe 01
E: 0.326914 8 0a 03 ae 1f 20 00 fe 01
E: 0.330913 8 0a 03 ae 1f 20 00 fe 01
E: 0.334912 8 0a 03 ae 1f 20 00 fe 01
E: 0.339092 8 0a 03 ae 1f 20 00 fe 01
E: 0.342937 8 0a 03 ae 1f 20 00 fe 01
E: 0.346946 8 0a 03 ae 1f 20 00 fe 01
E: 0.350941 8 0a 03 ae 1f 20 00 fe 01
E: 0.354918 8 0a 03 ae 1f 20 00 fe 01
E: 0.358913 8 0a 03 ae 1f 20 00 fe 01
E: 0.362913 8 0a 03 ae 1f 20 00 fe 01
E: 0.366912 8 0a 03 ae 1f 20 00 fe 01
E: 0.370911 8 0a 03 ae 1f 20 00 fe 01
E: 0.375915 8 0a 03 ae 1f 20 00 fe 01
E: 0.381912 8 0a 03 ae 1f 20 00 fe 01
E: 0.387947 8 0a 03 ae 1f 20 00 fe 01
E: 0.397965 8 0a 03 a6 1f 20 00 f6 01
E: 0.406973 8 0a 03 9e 1f 20 00 f4 01
E: 0.416948 8 0a 03 92 1f 26 00 f2 01
E: 0.426981 8 0a 03 7a 1f 36 00 ec 01
E: 0.432969 8 0a 03 5e 1f 48 00 ee 01
E: 0.436935 8 0a 03 40 1f 5c 00 f0 01
E: 0.439925 8 0a 03 1e 1f 74 00 f2 01
E: 0.443931 8 0a 03 f4 1e 8c 00 f4 01
E: 0.449933 8 0a 03 ca 1e a6 00 f6 01
E: 0.455931 8 0a 03 9c 1e c2 00 f8 01
E: 0.465939 8 0a 03 70 1e e0 00 f2 01
E: 0.474978 8 0a 03 40 1e fe 00 ec 01
E: 0.480998 8 0a 03 08 1e 20 01 ee 01
E: 0.484940 8 0a 03 cc 1d 46 01 f0 01
E: 0.490966 8 0a 03 8e 1d 6e 01 f2 01
E: 0.496970 8 0a 03 4a 1d 98 01 f4 01
E: 0.506941 8 0a 03 04 1d c6 01 de 01
E: 0.512934 8 0a 03 ba 1c f6 01 e0 01
E: 0.518940 8 0a 03 64 1c 2c 02 e2 01
E: 0.525937 8 0a 03 0e 1c 64 02 e4 01
E: 0.531965 8 0a 03 b2 1b a0 02 e4 01
E: 0.538938 8 0a 03 50 1b e2 02 d0 01
E: 0.545893 8 0a 03 e8 1a 26 03 ce 01
E: 0.556973 8 0a 03 80 1a 6e 03 ce 01
E: 0.564941 8 0a 03 12 1a b8 03 c6 01
E: 0.567927 8 0a 03 a6 19 06 04 ca 01
E: 0.571930 8 0a 03 2c 19 58 04 ce 01
E: 0.575951 8 0a 03 b8 18 aa 04 d2 01
E: 0.582095 8 0a 03 40 18 fe 04 d4 01
E: 0.591989 8 0a 03 d0 17 50 05 c0 01
E: 0.598962 8 0a 03 5e 17 a4 05 c0 01
E: 0.603935 8 0a 03 ec 16 fa 05 c2 01
E: 0.609935 8 0a 03 7c 16 50 06 c4 01
E: 0.615956 8 0a 03 10 16 a6 06 c4 01
E: 0.620975 8 0a 03 a6 15 fc 06 b2 01
E: 0.625984 8 0a 03 3c 15 52 07 b4 01
E: 0.630967 8 0a 03 d4 14 a8 07 a2 01
E: 0.636992 8 0a 03 6c 14 fe 07 94 01
E: 0.647939 8 0a 03 04 14 52 08 8c 01
E: 0.657924 8 0a 03 9e 13 a4 08 7c 01
E: 0.661937 8 0a 03 3a 13 f8 08 7e 01
E: 0.665969 8 0a 03 d4 12 52 09 7e 01
E: 0.669930 8 0a 03 72 12 a4 09 80 01
E: 0.674958 8 0a 03 12 12 fc 09 80 01
E: 0.681965 8 0a 03 b4 11 4e 0a 7c 01
E: 0.697958 8 0a 03 5c 11 a4 0a 6c 01
E: 0.703928 8 0a 03 04 11 f4 0a 66 01
E: 0.714923 8 0a 03 a4 10 4e 0b 64 01
E: 0.720922 8 0a 03 4c 10 a2 0b 5d 01
E: 0.724969 8 0a 03 f0 0f fe 0b 5c 01
E: 0.728939 8 0a 03 8e 0f 5a 0c 60 01
E: 0.732969 8 0a 03 2e 0f b8 0c 60 01
E: 0.737957 8 0a 03 ce 0e 14 0d 5a 01
E: 0.747982 8 0a 03 74 0e 6a 0d 4e 01
E: 0.754957 8 0a 03 1c 0e c0 0d 4e 01
E: 0.761140 8 0a 03 bc 0d 18 0e 57 01
E: 0.769953 8 0a 03 60 0d 74 0e 5d 01
E: 0.777965 8 0a 03 04 0d ce 0e 54 01
E: 0.780938 8 0a 03 a6 0c 2a 0f 5d 01
E: 0.784969 8 0a 03 44 0c 86 0f 5a 01
E: 0.790949 8 0a 03 e6 0b e4 0f 4e 01
E: 0.799960 8 0a 03 88 0b 3e 10 3f 01
E: 0.808953 8 0a 03 2a 0b 98 10 33 01
E: 0.815963 8 0a 03 cc 0a f4 10 3f 01
E: 0.819928 8 0a 03 70 0a 50 11 4b 01
E: 0.824934 8 0a 03 14 0a ae 11 57 01
E: 0.830962 8 0a 03 b6 09 0a 12 5a 01
E: 0.836932 8 0a 03 5c 09 68 12 45 01
E: 0.842914 8 0a 03 00 09 c6 12 33 01
E: 0.848952 8 0a 03 a8 08 24 13 36 01
E: 0.859929 8 0a 03 4a 08 82 13 39 01
E: 0.869023 8 0a 03 f2 07 e0 13 39 01
E: 0.872966 8 0a 03 98 07 3e 14 48 01
E: 0.879955 8 0a 03 3e 07 a2 14 57 01
E: 0.885956 8 0a 03 e0 06 04 15 58 01
E: 0.892936 8 0a 03 84 06 68 15 57 01
E: 0.898933 8 0a 03 2a 06 ca 15 4b 01
E: 0.904943 8 0a 03 d0 05 30 16 51 01
E: 0.914127 8 0a 03 76 05 92 16 57 01
E: 0.924943 8 0a 03 1e 05 f4 16 5a 01
E: 0.931022 8 0a 03 c8 04 56 17 5c 01
E: 0.934940 8 0a 03 72 04 b8 17 64 01
E: 0.938956 8 0a 03 1e 04 1a 18 6c 01
E: 0.944940 8 0a 03 c8 03 7c 18 72 01
E: 0.950933 8 0a 03 74 03 da 18 78 01
E: 0.955957 8 0a 03 22 03 3a 19 7a 01
E: 0.961962 8 0a 03 d8 02 94 19 6a 01
E: 0.965939 8 0a 03 8e 02 f0 19 72 01
E: 0.969961 8 0a 03 4e 02 48 1a 7a 01
E: 0.973936 8 0a 03 0e 02 9c 1a 82 01
E: 0.977933 8 0a 03 d8 01 ee 1a 88 01
E: 0.983953 8 0a 03 a2 01 3a 1b 8e 01
E: 0.989988 8 0a 03 74 01 84 1b 90 01
E: 0.995937 8 0a 03 4a 01 cc 1b 90 01
E: 1.000936 8 0a 03 26 01 10 1c 8a 01
E: 1.006955 8 0a 03 04 01 54 1c 7a 01
E: 1.010939 8 0a 03 e6 00 96 1c 80 01
E: 1.014931 8 0a 03 ca 00 d4 1c 84 01
E: 1.018953 8 0a 03 b4 00 10 1d 8a 01
E: 1.022939 8 0a 03 9e 00 48 1d 90 01
E: 1.026935 8 0a 03 8c 00 7e 1d 96 01
E: 1.030942 8 0a 03 7c 00 ae 1d 9a 01
E: 1.034965 8 0a 03 6e 00 da 1d a0 01
E: 1.038939 8 0a 03 62 00 04 1e a6 01
E: 1.042954 8 0a 03 58 00 2a 1e aa 01
E: 1.046934 8 0a 03 4e 00 4c 1e ae 01
E: 1.050932 8 0a 03 46 00 6c 1e b2 01
E: 1.054932 8 0a 03 40 00 88 1e b6 01
E: 1.058952 8 0a 03 3a 00 a2 1e ba 01
E: 1.062947 8 0a 03 34 00 ba 1e be 01
E: 1.066991 8 0a 03 30 00 ce 1e c2 01
E: 1.070941 8 0a 03 2c 00 e0 1e c6 01
E: 1.074970 8 0a 03 2a 00 f0 1e ca 01
E: 1.078937 8 0a 03 28 00 fe 1e cc 01
E: 1.082928 8 0a 03 28 00 0a 1f ce 01
E: 1.086927 8 0a 03 26 00 16 1f d0 01
E: 1.090941 8 0a 03 26 00 20 1f d2 01
E: 1.094987 8 0a 03 24 00 2a 1f d6 01
E: 1.098934 8 0a 03 24 00 32 1f d8 01
E: 1.102927 8 0a 03 24 00 38 1f da 01
E: 1.106926 8 0a 03 24 00 3e 1f dc 01
E: 1.109925 8 0a 03 24 00 44 1f de 01
E: 1.113924 8 0a 03 26 00 48 1f de 01
E: 1.117918 8 0a 03 26 00 48 1f e0 01
E: 1.121950 8 0a 03 26 00 48 1f e2 01
E: 1.125927 8 0a 03 26 00 48 1f e4 01
E: 1.129925 8 0a 03 26 00 48 1f e6 01
E: 1.133964 8 0a 03 26 00 48 1f e8 01
E: 1.137938 8 0a 03 26 00 48 1f ea 01
E: 1.141946 8 0a 03 26 00 48 1f ec 01
E: 1.145952 8 0a 03 26 00 48 1f ee 01
E: 1.149929 8 0a 03 26 00 48 1f f0 01
E: 1.153927 8 0a 03 26 00 48 1f f2 01
E: 1.157914 8 0a 03 26 00 48 1f f4 01
E: 1.161921 8 0a 03 26 00 48 1f f6 01
E: 1.165921 8 0a 03 26 00 48 1f f8 01
E: 1.169923 8 0a 03 26 00 48 1f fa 01
E: 1.173942 8 0a 03 26 00 48 1f fc 01
E: 1.177929 8 0a 03 26 00 48 1f fe 01
E: 1.181940 8 0a 03 26 00 48 1f fe 01
E: 1.185918 8 0a 03 26 00 48 1f fe 01
E: 1.189945 8 0a 03 26 00 48 1f fe 01
E: 1.193920 8 0a 03 26 00 48 1f fe 01
E: 1.197973 8 0a 03 26 00 48 1f fe 01
E: 1.201923 8 0a 03 26 00 48 1f fe 01
E: 1.205917 8 0a 03 26 00 48 1f fe 01
E: 1.209913 8 0a 03 26 00 48 1f fe 01
E: 1.213914 8 0a 03 26 00 48 1f fe 01
E: 1.217915 8 0a 03 26 00 48 1f fe 01
E: 1.221910 8 0a 03 26 00 48 1f fe 01
E: 1.225977 8 0a 03 28 00 4e 1f fe 01
E: 1.229936 8 0a 03 2c 00 58 1f fe 01
E: 1.233943 8 0a 03 2e 00 60 1f fe 01
E: 1.237928 8 0a 03 30 00 66 1f fe 01
E: 1.241973 8 0a 03 32 00 6a 1f fe 01
E: 1.245922 8 0a 03 32 00 6a 1f fe 01
E: 1.249951 8 0a 03 32 00 6a 1f fe 01
E: 1.253923 8 0a 03 32 00 6a 1f fe 01
E: 1.257946 8 0a 03 32 00 6a 1f fe 01
E: 1.261926 8 0a 03 32 00 6a 1f fe 01
E: 1.265948 8 0a 03 32 00 6a 1f fe 01
E: 1.269918 8 0a 03 32 00 6a 1f fe 01
E: 1.273942 8 0a 03 32 00 6a 1f fe 01
E: 1.277930 8 0a 03 32 00 6a 1f fc 01
E: 1.281928 8 0a 03 32 00 6a 1f fa 01
E: 1.285926 8 0a 03 32 00 6a 1f f8 01
E: 1.289925 8 0a 03 32 00 6a 1f f4 01
E: 1.293921 8 0a 03 32 00 6a 1f f0 01
E: 1.297922 8 0a 03 32 00 6a 1f ea 01
E: 1.301922 8 0a 03 32 00 6a 1f de 01
E: 1.305924 8 0a 03 32 00 6a 1f ca 01
E: 1.309983 8 0a 03 32 00 6a 1f b6 01
E: 1.313931 8 0a 03 32 00 6a 1f a4 01
E: 1.317951 8 0a 03 32 00 6a 1f 92 01
E: 1.340905 8 0a 03 32 00 6a 1f 20 01
E: 1.342921 8 0a 00 32 00 6a 1f 20 01
# 2. Land one finger,
   - land a second finger far enough from the first
   - move your two fingers
   - release the *first* finger
   - release the second finger
E: 10.632962 8 0a 00 ae 0d 9c 1a 09 01
E: 10.635939 8 0a 03 ac 0d 9e 1a 06 01
E: 10.639955 8 0a 03 aa 0d 9e 1a 0c 01
E: 10.643926 8 0a 03 aa 0d 9e 1a 12 01
E: 10.647924 8 0a 03 aa 0d 9c 1a 18 01
E: 10.651922 8 0a 03 aa 0d 9a 1a 21 01
E: 10.655922 8 0a 03 aa 0d 98 1a 2a 01
E: 10.658961 8 0a 03 aa 0d 96 1a 33 01
E: 10.662933 8 0a 03 aa 0d 96 1a 3c 01
E: 10.666922 8 0a 03 aa 0d 96 1a 45 01
E: 10.670947 8 0a 03 aa 0d 96 1a 4e 01
E: 10.674958 8 0a 03 aa 0d 96 1a 57 01
E: 10.678918 8 0a 03 aa 0d 96 1a 58 01
E: 10.682921 8 0a 03 aa 0d 96 1a 5e 01
E: 10.686948 8 0a 03 aa 0d 96 1a 64 01
E: 10.690923 8 0a 03 aa 0d 96 1a 68 01
E: 10.694919 8 0a 03 aa 0d 96 1a 6c 01
E: 10.698918 8 0a 03 aa 0d 96 1a 70 01
E: 10.702918 8 0a 03 aa 0d 96 1a 76 01
E: 10.706910 8 0a 03 aa 0d 96 1a 7a 01
E: 10.710918 8 0a 03 aa 0d 96 1a 7e 01
E: 10.714918 8 0a 03 aa 0d 96 1a 82 01
E: 10.718918 8 0a 03 aa 0d 96 1a 86 01
E: 10.722936 8 0a 03 aa 0d 96 1a 8a 01
E: 10.726943 8 0a 03 aa 0d 96 1a 8c 01
E: 10.731145 8 0a 03 aa 0d 96 1a 90 01
E: 10.734955 8 0a 03 aa 0d 96 1a 94 01
E: 10.739216 8 0a 03 aa 0d 96 1a 98 01
E: 10.742911 8 0a 03 aa 0d 96 1a 9c 01
E: 10.746906 8 0a 03 aa 0d 96 1a 9e 01
E: 10.750945 8 0a 03 aa 0d 96 1a a0 01
E: 10.754917 8 0a 03 aa 0d 96 1a a2 01
E: 10.758932 8 0a 03 aa 0d 96 1a a4 01
E: 10.762966 8 0a 03 aa 0d 96 1a a8 01
E: 10.766954 8 0a 03 aa 0d 96 1a aa 01
E: 10.770935 8 0a 03 aa 0d 96 1a ac 01
E: 10.774952 8 0a 03 aa 0d 96 1a ae 01
E: 10.778972 8 0a 03 aa 0d 96 1a b0 01
E: 10.782922 8 0a 03 aa 0d 96 1a b0 01
E: 10.786921 8 0a 03 aa 0d 96 1a b2 01
E: 10.790927 8 0a 03 aa 0d 96 1a b4 01
E: 10.794927 8 0a 03 aa 0d 96 1a b6 01
E: 10.798925 8 0a 03 aa 0d 96 1a b8 01
E: 10.802925 8 0a 03 aa 0d 96 1a ba 01
E: 10.806926 8 0a 03 aa 0d 96 1a bc 01
E: 10.810926 8 0a 03 aa 0d 96 1a be 01
E: 10.814928 8 0a 03 aa 0d 96 1a c0 01
E: 10.818922 8 0a 03 aa 0d 96 1a c0 01
E: 10.822956 8 0a 03 aa 0d 96 1a c2 01
E: 10.827017 8 0a 03 aa 0d 96 1a c4 01
E: 10.830926 8 0a 03 aa 0d 96 1a c4 01
E: 10.835949 8 0a 03 aa 0d 96 1a c4 01
E: 10.839936 8 0a 03 aa 0d 96 1a c6 01
E: 10.843947 8 0a 03 aa 0d 96 1a c6 01
E: 10.848924 8 0a 03 aa 0d 96 1a c6 01
E: 10.853919 8 0a 03 aa 0d 96 1a c6 01
E: 10.857911 8 0a 03 aa 0d 96 1a c6 01
E: 10.862956 8 0a 03 aa 0d 96 1a c6 01
E: 10.866926 8 0a 03 aa 0d 96 1a c6 01
E: 10.871954 8 0a 03 aa 0d 96 1a c6 01
E: 10.875955 8 0a 03 aa 0d 90 1a c6 01
E: 10.880941 8 0a 03 ae 0d 88 1a c6 01
E: 10.884973 8 0a 03 b0 0d 82 1a c6 01
E: 10.889936 8 0a 03 b2 0d 7c 1a c6 01
E: 10.893931 8 0a 03 b4 0d 78 1a c6 01
E: 10.898917 8 0a 03 b4 0d 78 1a c6 01
E: 10.902913 8 0a 03 b4 0d 78 1a c6 01
E: 10.907933 8 0a 03 b4 0d 78 1a c6 01
E: 10.911923 8 0a 03 b4 0d 78 1a c6 01
E: 10.916927 8 0a 03 b4 0d 78 1a c6 01
E: 10.920923 8 0a 03 b4 0d 78 1a c6 01
E: 10.925957 8 0a 03 b4 0d 78 1a c6 01
E: 10.929958 8 0a 03 b4 0d 78 1a c6 01
E: 10.934958 8 0a 03 b4 0d 78 1a c6 01
E: 10.939926 8 0a 03 b4 0d 78 1a c6 01
E: 10.943920 8 0a 03 b4 0d 78 1a c6 01
E: 10.948928 8 0a 03 b4 0d 78 1a c6 01
E: 10.952919 8 0a 03 b4 0d 78 1a c6 01
E: 10.957910 8 0a 03 b4 0d 78 1a c6 01
E: 10.961916 8 0a 03 b4 0d 78 1a c6 01
E: 10.966954 8 0a 03 b4 0d 78 1a c6 01
E: 10.970941 8 0a 03 b4 0d 78 1a c6 01
E: 10.975908 8 0a 03 b4 0d 78 1a c6 01
E: 10.979939 8 0a 03 b4 0d 78 1a c6 01
E: 10.984929 8 0a 03 b4 0d 78 1a c6 01
E: 10.989921 8 0a 03 b4 0d 78 1a c6 01
E: 10.993921 8 0a 03 b4 0d 78 1a c6 01
E: 10.998917 8 0a 03 b4 0d 78 1a c6 01
E: 11.002915 8 0a 03 b4 0d 78 1a c6 01
E: 11.007912 8 0a 03 b4 0d 78 1a c6 01
E: 11.011920 8 0a 03 b4 0d 78 1a c6 01
E: 11.017046 8 0a 03 b4 0d 78 1a c6 01
E: 11.020932 8 0a 03 b4 0d 78 1a c6 01
E: 11.025957 8 0a 03 b4 0d 78 1a c6 01
E: 11.030953 8 0a 03 b4 0d 78 1a c6 01
E: 11.034919 8 0a 03 b4 0d 78 1a c6 01
E: 11.039946 8 0a 03 b4 0d 78 1a c6 01
E: 11.043926 8 0a 03 b4 0d 78 1a c6 01
E: 11.048920 8 0a 03 b4 0d 78 1a c6 01
E: 11.052919 8 0a 03 b4 0d 78 1a c6 01
E: 11.057945 8 0a 03 b4 0d 78 1a c6 01
E: 11.061930 8 0a 03 b4 0d 78 1a c6 01
E: 11.067216 8 0a 03 b4 0d 78 1a c6 01
E: 11.070946 8 0a 03 b4 0d 78 1a c6 01
E: 11.075948 8 0a 03 b4 0d 78 1a c6 01
E: 11.080925 8 0a 03 b4 0d 78 1a c6 01
E: 11.084917 8 0a 03 b4 0d 78 1a c6 01
E: 11.089915 8 0a 03 b4 0d 78 1a c6 01
E: 11.093910 8 0a 03 b4 0d 78 1a c6 01
E: 11.098915 8 0a 03 b4 0d 78 1a c6 01
E: 11.102913 8 0a 03 b4 0d 78 1a c6 01
E: 11.107920 8 0a 03 b4 0d 78 1a c6 01
E: 11.111922 8 0a 03 b4 0d 78 1a c6 01
E: 11.116946 8 0a 03 b4 0d 78 1a c6 01
E: 11.120922 8 0a 03 b4 0d 78 1a c6 01
E: 11.125956 8 0a 03 b4 0d 78 1a c6 01
E: 11.129924 8 0a 03 b4 0d 78 1a c6 01
E: 11.136946 8 0a 03 b4 0d 78 1a c6 01
E: 11.142971 8 0a 03 b4 0d 78 1a c6 01
E: 11.148948 8 0a 03 b4 0d 78 1a c6 01
E: 11.155948 8 0a 03 b4 0d 78 1a c6 01
E: 11.161927 8 0a 03 b4 0d 78 1a c6 01
E: 11.168894 8 0a 03 b4 0d 78 1a c6 01
E: 11.175968 8 0a 03 b4 0d 78 1a b4 01
E: 11.182959 8 0a 03 b4 0d 78 1a b4 01
E: 11.189938 8 0a 03 b4 0d 78 1a a2 01
E: 11.197932 8 0a 03 b4 0d 78 1a 90 01
E: 11.205875 8 0a 03 b4 0d 78 1a 80 01
E: 11.212944 8 0a 03 b4 0d 78 1a 70 01
E: 11.220927 8 0a 03 b4 0d 78 1a 60 01
E: 11.228963 8 0a 03 b4 0d 78 1a 57 01
E: 11.235952 8 0a 03 b4 0d 78 1a 42 01
E: 11.243959 8 0a 03 b4 0d 78 1a 30 01
E: 11.251959 8 0a 03 b4 0d 78 1a 1e 01
E: 11.258878 8 0a 03 b4 0d 78 1a 0c 01
E: 11.266954 8 0a 03 b4 0d 78 1a 20 01
E: 11.274965 8 0a 03 b4 0d 78 1a 20 01
E: 11.281926 8 0a 03 b4 0d 78 1a 20 01
E: 11.289922 8 0a 03 b4 0d 78 1a 20 01
E: 11.297922 8 0a 03 b4 0d 78 1a 20 01
E: 11.304915 8 0a 03 b4 0d 78 1a 20 01
E: 11.312934 8 0a 03 b4 0d 78 1a 20 01
E: 11.320914 8 0a 03 b4 0d 78 1a 20 01
E: 11.328065 8 0a 03 b4 0d 78 1a 20 01
E: 11.335946 8 0a 03 b4 0d 78 1a 20 01
E: 11.343884 8 0a 03 b4 0d 78 1a 20 01
E: 11.350933 8 0a 03 b4 0d 78 1a 20 01
E: 11.360958 8 0a 03 b4 0d 78 1a 20 01
E: 11.369914 8 0a 03 b4 0d 78 1a 20 01
E: 11.379954 8 0a 03 b4 0d 78 1a 20 01
E: 11.388947 8 0a 03 b4 0d 78 1a 20 01
E: 11.398913 8 0a 03 b4 0d 78 1a 20 01
E: 11.407915 8 0a 03 b4 0d 78 1a 20 01
E: 11.417905 8 0a 03 b4 0d 78 1a 20 01
E: 11.426911 8 0a 03 b4 0d 78 1a 20 01
E: 11.434935 8 0a 03 b4 0d 78 1a 20 01
E: 11.441916 8 0a 03 b4 0d 78 1a 20 01
E: 11.450005 8 0a 03 b4 0d 78 1a 20 01
E: 11.457929 8 0a 03 b4 0d 78 1a 20 01
E: 11.466954 8 0a 03 b4 0d 78 1a 20 01
E: 11.474929 8 0a 03 b4 0d 78 1a 20 01
E: 11.481959 8 0a 03 b4 0d 78 1a 20 01
E: 11.489955 8 0a 03 b4 0d 78 1a 20 01
E: 11.498076 8 0a 03 b4 0d 78 1a 20 01
E: 11.506935 8 0a 03 b4 0d 78 1a 20 01
E: 11.514910 8 0a 03 b4 0d 78 1a 20 01
E: 11.523948 8 0a 03 b4 0d 78 1a 20 01
E: 11.533955 8 0a 03 b4 0d 78 1a 20 01
E: 11.542955 8 0a 03 b4 0d 78 1a 20 01
E: 11.552926 8 0a 03 b4 0d 78 1a 20 01
E: 11.562071 8 0a 03 b4 0d 78 1a 20 01
E: 11.571934 8 0a 03 b4 0d 78 1a 20 01
E: 11.580971 8 0a 03 b4 0d 78 1a 20 01
E: 11.590981 8 0a 03 b4 0d 78 1a 20 01
E: 11.599928 8 0a 03 b4 0d 78 1a 20 01
E: 11.609989 8 0a 03 b4 0d 78 1a 20 01
E: 11.618915 8 0a 03 b4 0d 78 1a 20 01
E: 11.628916 8 0a 03 b4 0d 78 1a 20 01
E: 11.637950 8 0a 03 b4 0d 78 1a 20 01
E: 11.647951 8 0a 03 b4 0d 78 1a 20 01
E: 11.656956 8 0a 03 b4 0d 78 1a 20 01
E: 11.666935 8 0a 03 b4 0d 78 1a 20 01
E: 11.675942 8 0a 03 b4 0d 78 1a 20 01
E: 11.685965 8 0a 03 b4 0d 78 1a 20 01
E: 11.694947 8 0a 03 b4 0d 78 1a 20 01
E: 11.704926 8 0a 03 b4 0d 78 1a 20 01
E: 11.713949 8 0a 03 b4 0d 78 1a 20 01
E: 11.723956 8 0a 03 b4 0d 78 1a 20 01
E: 11.732947 8 0a 03 b4 0d 78 1a 20 01
E: 11.742956 8 0a 03 b4 0d 78 1a 20 01
E: 11.751926 8 0a 03 b4 0d 78 1a 20 01
E: 11.761919 8 0a 03 b4 0d 78 1a 20 01
E: 11.770964 8 0a 03 b4 0d 78 1a 20 01
E: 11.779950 8 0a 03 b4 0d 78 1a 20 01
E: 11.789960 8 0a 03 b4 0d 78 1a 20 01
E: 11.799974 8 0a 03 b4 0d 78 1a 20 01
E: 11.808981 8 0a 03 b4 0d 78 1a 20 01
E: 11.818929 8 0a 03 b4 0d 78 1a 20 01
E: 11.827923 8 0a 03 b4 0d 78 1a 20 01
E: 11.836920 8 0a 03 b4 0d 78 1a 20 01
E: 11.846951 8 0a 03 b4 0d 78 1a 20 01
E: 11.855947 8 0a 03 b4 0d 78 1a 20 01
E: 11.865962 8 0a 03 b4 0d 78 1a 20 01
E: 11.874959 8 0a 03 b4 0d 78 1a 20 01
E: 11.884927 8 0a 03 b4 0d 78 1a 20 01
E: 11.893958 8 0a 03 b4 0d 78 1a 20 01
E: 11.903941 8 0a 03 b4 0d 78 1a 20 01
E: 11.912907 8 0a 03 b4 0d 78 1a 20 01
E: 11.922903 8 0a 03 b4 0d 78 1a 20 01
E: 11.931915 8 0a 03 b4 0d 78 1a 20 01
E: 11.941925 8 0a 03 b4 0d 78 1a 20 01
E: 11.950938 8 0a 03 b4 0d 78 1a 20 01
E: 11.960907 8 0a 03 b4 0d 78 1a 20 01
E: 11.969902 8 0a 03 b4 0d 78 1a 20 01
E: 11.979933 8 0a 03 b4 0d 78 1a 20 01
E: 11.988939 8 0a 03 b4 0d 78 1a 20 01
E: 11.998932 8 0a 03 b4 0d 78 1a 20 01
E: 12.007936 8 0a 03 b4 0d 78 1a 20 01
E: 12.076979 8 0a 03 b4 0d 78 1a 20 01
E: 12.078945 8 0a 00 70 0c 04 05 20 02
E: 12.096961 8 0a 03 b4 0d 78 1a 20 01
E: 12.098949 8 0a 03 70 0c 04 05 20 02
E: 12.113932 8 0a 03 b4 0d 78 1a 20 01
E: 12.115921 8 0a 03 70 0c 02 05 20 02
E: 12.132075 8 0a 03 b4 0d 78 1a 20 01
E: 12.133964 8 0a 03 70 0c 00 05 20 02
E: 12.149962 8 0a 03 b4 0d 78 1a 20 01
E: 12.151930 8 0a 03 70 0c fc 04 20 02
E: 12.167927 8 0a 03 b4 0d 78 1a 20 01
E: 12.169929 8 0a 03 70 0c fa 04 20 02
E: 12.185965 8 0a 03 b4 0d 78 1a 20 01
E: 12.187931 8 0a 03 70 0c f6 04 20 02
E: 12.203971 8 0a 03 b4 0d 78 1a 20 01
E: 12.205939 8 0a 03 70 0c f2 04 20 02
E: 12.221923 8 0a 03 b4 0d 78 1a 20 01
E: 12.223921 8 0a 03 70 0c ee 04 20 02
E: 12.238920 8 0a 03 b4 0d 78 1a 20 01
E: 12.240920 8 0a 03 70 0c ee 04 20 02
E: 12.256978 8 0a 03 b4 0d 78 1a 20 01
E: 12.258960 8 0a 03 70 0c ee 04 20 02
E: 12.274963 8 0a 03 b4 0d 78 1a 20 01
E: 12.276926 8 0a 03 70 0c ee 04 20 02
E: 12.292965 8 0a 03 b4 0d 78 1a 20 01
E: 12.294922 8 0a 03 70 0c ee 04 20 02
E: 12.311002 8 0a 03 ba 0d 76 1a 20 01
E: 12.312926 8 0a 03 70 0c ee 04 20 02
E: 12.328980 8 0a 03 c6 0d 74 1a 20 01
E: 12.330929 8 0a 03 70 0c ee 04 20 02
E: 12.346985 8 0a 03 ce 0d 72 1a 20 01
E: 12.348937 8 0a 03 70 0c ee 04 20 02
E: 12.363953 8 0a 03 d6 0d 72 1a 20 01
E: 12.365928 8 0a 03 70 0c ee 04 20 02
E: 12.381935 8 0a 03 da 0d 70 1a 20 01
E: 12.383914 8 0a 03 70 0c ee 04 20 02
E: 12.399986 8 0a 03 dc 0d 70 1a 20 01
E: 12.401929 8 0a 03 70 0c ee 04 20 02
E: 12.413966 8 0a 03 dc 0d 70 1a 20 01
E: 12.415922 8 0a 03 70 0c ee 04 20 02
E: 12.427930 8 0a 03 dc 0d 70 1a 20 01
E: 12.429930 8 0a 03 70 0c ee 04 20 02
E: 12.442930 8 0a 03 dc 0d 70 1a 20 01
E: 12.444956 8 0a 03 70 0c ee 04 20 02
E: 12.456970 8 0a 03 dc 0d 70 1a 20 01
E: 12.458929 8 0a 03 70 0c ee 04 20 02
E: 12.470935 8 0a 03 dc 0d 70 1a 20 01
E: 12.472934 8 0a 03 70 0c ee 04 20 02
E: 12.485052 8 0a 03 dc 0d 70 1a 20 01
E: 12.486941 8 0a 03 70 0c ee 04 20 02
E: 12.498975 8 0a 03 dc 0d 70 1a 20 01
E: 12.500964 8 0a 03 70 0c ee 04 20 02
E: 12.512950 8 0a 03 d4 0d 70 1a 20 01
E: 12.514916 8 0a 03 70 0c ee 04 20 02
E: 12.522955 8 0a 03 cc 0d 70 1a 20 01
E: 12.524943 8 0a 03 78 0c ee 04 20 02
E: 12.533986 8 0a 03 c2 0d 70 1a 20 01
E: 12.535941 8 0a 03 80 0c ee 04 20 02
E: 12.544161 8 0a 03 b8 0d 6e 1a 20 01
E: 12.545969 8 0a 03 8a 0c ee 04 20 02
E: 12.553951 8 0a 03 a0 0d 68 1a 20 01
E: 12.555930 8 0a 03 92 0c ee 04 20 02
E: 12.563949 8 0a 03 8a 0d 62 1a 20 01
E: 12.565941 8 0a 03 9e 0c f0 04 20 02
E: 12.574944 8 0a 03 74 0d 5c 1a 20 01
E: 12.576943 8 0a 03 b4 0c f4 04 20 02
E: 12.585895 8 0a 03 60 0d 58 1a 20 01
E: 12.587852 8 0a 03 ca 0c f6 04 20 02
E: 12.595853 8 0a 03 4a 0d 54 1a 20 01
E: 12.597848 8 0a 03 da 0c f6 04 20 02
E: 12.606004 8 0a 03 38 0d 50 1a 20 01
E: 12.608045 8 0a 03 f0 0c f8 04 20 02
E: 12.611953 8 0a 03 22 0d 4c 1a 20 01
E: 12.613881 8 0a 03 04 0d f8 04 20 02
E: 12.618947 8 0a 03 10 0d 46 1a 20 01
E: 12.620857 8 0a 03 1c 0d fa 04 20 02
E: 12.627060 8 0a 03 f6 0c 42 1a 20 01
E: 12.628950 8 0a 03 32 0d fa 04 20 02
E: 12.632976 8 0a 03 dc 0c 3a 1a 20 01
E: 12.634939 8 0a 03 4e 0d fc 04 20 02
E: 12.644985 8 0a 03 be 0c 34 1a 20 01
E: 12.646934 8 0a 03 68 0d fc 04 20 02
E: 12.658966 8 0a 03 9c 0c 2c 1a 20 01
E: 12.660977 8 0a 03 88 0d fe 04 20 02
E: 12.672977 8 0a 03 7e 0c 26 1a 20 01
E: 12.674941 8 0a 03 a6 0d fe 04 20 02
E: 12.686948 8 0a 03 60 0c 1e 1a 20 01
E: 12.688974 8 0a 03 c8 0d 00 05 20 02
E: 12.700952 8 0a 03 44 0c 18 1a 20 01
E: 12.702934 8 0a 03 e8 0d 00 05 20 02
E: 12.714986 8 0a 03 26 0c 12 1a 20 01
E: 12.716966 8 0a 03 18 0e 04 05 20 02
E: 12.728946 8 0a 03 0c 0c 0e 1a 20 01
E: 12.730922 8 0a 03 42 0e 08 05 20 02
E: 12.742010 8 0a 03 f0 0b 08 1a 20 01
E: 12.743981 8 0a 03 78 0e 0e 05 20 02
E: 12.752985 8 0a 03 d2 0b 02 1a 20 01
E: 12.754940 8 0a 03 aa 0e 14 05 20 02
E: 12.768986 8 0a 03 b6 0b f6 19 20 01
E: 12.770947 8 0a 03 e0 0e 1c 05 20 02
E: 12.785951 8 0a 03 9a 0b ee 19 20 01
E: 12.787937 8 0a 03 14 0f 24 05 20 02
E: 12.802997 8 0a 03 80 0b e0 19 20 01
E: 12.804958 8 0a 03 4a 0f 2c 05 20 02
E: 12.819990 8 0a 03 56 0b d2 19 20 01
E: 12.821948 8 0a 03 7a 0f 34 05 20 02
E: 12.837984 8 0a 03 32 0b c0 19 20 01
E: 12.839940 8 0a 03 b0 0f 3e 05 20 02
E: 12.854978 8 0a 03 02 0b ae 19 20 01
E: 12.856968 8 0a 03 e2 0f 46 05 20 02
E: 12.871962 8 0a 03 d8 0a 9a 19 20 01
E: 12.873944 8 0a 03 14 10 56 05 20 02
E: 12.884979 8 0a 03 a8 0a 88 19 20 01
E: 12.886933 8 0a 03 4e 10 64 05 20 02
E: 12.898993 8 0a 03 80 0a 74 19 03 01
E: 12.900941 8 0a 03 86 10 7a 05 20 02
E: 12.908960 8 0a 03 54 0a 62 19 12 01
E: 12.910936 8 0a 03 be 10 8c 05 20 02
E: 12.917950 8 0a 03 32 0a 4e 19 1e 01
E: 12.919928 8 0a 03 f2 10 a4 05 20 02
E: 12.931984 8 0a 03 0e 0a 3c 19 0c 01
E: 12.933951 8 0a 03 14 11 b6 05 20 02
E: 12.946034 8 0a 03 f4 09 26 19 03 01
E: 12.947941 8 0a 03 36 11 cc 05 20 02
E: 12.959977 8 0a 03 ea 09 0e 19 20 01
E: 12.961966 8 0a 03 4c 11 e0 05 20 02
E: 12.973951 8 0a 03 d4 09 fa 18 20 01
E: 12.975928 8 0a 03 60 11 f8 05 20 02
E: 12.990947 8 0a 03 d0 09 dc 18 20 01
E: 12.992927 8 0a 03 68 11 0c 06 20 02
E: 13.004971 8 0a 03 d4 09 c0 18 20 01
E: 13.006941 8 0a 03 70 11 24 06 20 02
E: 13.016980 8 0a 03 e6 09 9e 18 20 01
E: 13.018941 8 0a 03 6a 11 40 06 20 02
E: 13.031020 8 0a 03 fc 09 7e 18 20 01
E: 13.032940 8 0a 03 62 11 5c 06 20 02
E: 13.066988 8 0a 03 1a 0a 58 18 20 01
E: 13.068949 8 0a 03 4e 11 7a 06 20 02
E: 13.084979 8 0a 03 38 0a 34 18 20 01
E: 13.086941 8 0a 03 3a 11 98 06 20 02
E: 13.101947 8 0a 03 60 0a 04 18 20 01
E: 13.103924 8 0a 03 10 11 b8 06 20 02
E: 13.120104 8 0a 03 90 0a d8 17 20 01
E: 13.121959 8 0a 03 e8 10 d6 06 20 02
E: 13.137975 8 0a 03 c4 0a a6 17 20 01
E: 13.139941 8 0a 03 ae 10 f4 06 20 02
E: 13.151999 8 0a 03 00 0b 7a 17 20 01
E: 13.153935 8 0a 03 76 10 10 07 20 02
E: 13.165946 8 0a 03 3a 0b 4a 17 20 01
E: 13.167933 8 0a 03 2c 10 2c 07 20 02
E: 13.179945 8 0a 03 7a 0b 22 17 20 01
E: 13.181942 8 0a 03 ec 0f 46 07 20 02
E: 13.193977 8 0a 03 b8 0b f8 16 20 01
E: 13.195933 8 0a 03 a2 0f 60 07 20 02
E: 13.207971 8 0a 03 f8 0b d0 16 20 01
E: 13.209947 8 0a 03 60 0f 76 07 20 02
E: 13.218975 8 0a 03 36 0c aa 16 20 01
E: 13.220944 8 0a 03 18 0f 8c 07 20 02
E: 13.226968 8 0a 03 72 0c 88 16 20 01
E: 13.228945 8 0a 03 da 0e a0 07 20 02
E: 13.235967 8 0a 03 ae 0c 6a 16 20 01
E: 13.237948 8 0a 03 96 0e b2 07 20 02
E: 13.246948 8 0a 03 e6 0c 50 16 20 01
E: 13.248928 8 0a 03 54 0e c4 07 20 02
E: 13.256955 8 0a 03 30 0d 34 16 20 01
E: 13.259029 8 0a 03 0e 0e d2 07 20 02
E: 13.266965 8 0a 03 72 0d 1c 16 20 01
E: 13.268941 8 0a 03 c8 0d e0 07 20 02
E: 13.276947 8 0a 03 c0 0d 04 16 20 01
E: 13.278925 8 0a 03 7e 0d ec 07 20 02
E: 13.284945 8 0a 03 00 0e f0 15 20 01
E: 13.286924 8 0a 03 26 0d f8 07 20 02
E: 13.292945 8 0a 03 46 0e dc 15 20 01
E: 13.294924 8 0a 03 d0 0c 02 08 20 02
E: 13.300946 8 0a 03 7e 0e ca 15 20 01
E: 13.302926 8 0a 03 72 0c 0c 08 20 02
E: 13.312999 8 0a 03 b8 0e b8 15 20 01
E: 13.314935 8 0a 03 18 0c 14 08 20 02
E: 13.323995 8 0a 03 e6 0e a8 15 20 01
E: 13.325949 8 0a 03 be 0b 1a 08 20 02
E: 13.337981 8 0a 03 1a 0f 9a 15 20 01
E: 13.339943 8 0a 03 64 0b 1e 08 20 02
E: 13.350973 8 0a 03 48 0f 8e 15 20 01
E: 13.352944 8 0a 03 0e 0b 20 08 20 02
E: 13.364946 8 0a 03 7a 0f 82 15 20 01
E: 13.366922 8 0a 03 c0 0a 20 08 20 02
E: 13.377971 8 0a 03 a8 0f 78 15 20 01
E: 13.379931 8 0a 03 78 0a 20 08 20 02
E: 13.391977 8 0a 03 dc 0f 70 15 20 01
E: 13.393951 8 0a 03 34 0a 1e 08 20 02
E: 13.405948 8 0a 03 0e 10 6a 15 20 01
E: 13.407986 8 0a 03 f8 09 1c 08 20 02
E: 13.418956 8 0a 03 4c 10 64 15 20 01
E: 13.420938 8 0a 03 c0 09 18 08 20 02
E: 13.432993 8 0a 03 86 10 62 15 20 01
E: 13.434943 8 0a 03 8e 09 14 08 20 02
E: 13.455992 8 0a 03 c6 10 62 15 20 01
E: 13.457952 8 0a 03 5e 09 10 08 20 02
E: 13.467959 8 0a 03 00 11 64 15 20 01
E: 13.469943 8 0a 03 30 09 0c 08 20 02
E: 13.479944 8 0a 03 42 11 6c 15 20 01
E: 13.481941 8 0a 03 f6 08 04 08 20 02
E: 13.488946 8 0a 03 7c 11 74 15 20 01
E: 13.490933 8 0a 03 be 08 fa 07 20 02
E: 13.495979 8 0a 03 ba 11 80 15 20 01
E: 13.497949 8 0a 03 82 08 ee 07 20 02
E: 13.505946 8 0a 03 f6 11 8c 15 20 01
E: 13.507935 8 0a 03 4a 08 e0 07 20 02
E: 13.516984 8 0a 03 32 12 9a 15 20 01
E: 13.518940 8 0a 03 12 08 d0 07 20 02
E: 13.524994 8 0a 03 68 12 aa 15 20 01
E: 13.527031 8 0a 03 de 07 c0 07 20 02
E: 13.531958 8 0a 03 9e 12 ba 15 20 01
E: 13.533971 8 0a 03 ac 07 ae 07 20 02
E: 13.539979 8 0a 03 ce 12 ce 15 20 01
E: 13.541951 8 0a 03 80 07 9c 07 20 02
E: 13.547946 8 0a 03 fc 12 e0 15 20 01
E: 13.549940 8 0a 03 56 07 8a 07 20 02
E: 13.555946 8 0a 03 24 13 f4 15 20 01
E: 13.557935 8 0a 03 30 07 78 07 20 02
E: 13.563978 8 0a 03 4c 13 06 16 20 01
E: 13.565949 8 0a 03 0e 07 64 07 20 02
E: 13.571944 8 0a 03 70 13 1a 16 20 01
E: 13.573939 8 0a 03 ee 06 50 07 20 02
E: 13.580987 8 0a 03 92 13 2c 16 20 01
E: 13.582934 8 0a 03 d0 06 3c 07 20 02
E: 13.591005 8 0a 03 b0 13 40 16 06 01
E: 13.593095 8 0a 03 b4 06 26 07 20 02
E: 13.600965 8 0a 03 cc 13 54 16 12 01
E: 13.602975 8 0a 03 9e 06 14 07 20 02
E: 13.609962 8 0a 03 e4 13 6a 16 1e 01
E: 13.611936 8 0a 03 8a 06 fe 06 20 02
E: 13.619996 8 0a 03 fa 13 80 16 27 01
E: 13.621948 8 0a 03 7a 06 ea 06 20 02
E: 13.633992 8 0a 03 0c 14 98 16 30 01
E: 13.635939 8 0a 03 6c 06 d6 06 20 02
E: 13.646953 8 0a 03 1e 14 b0 16 2d 01
E: 13.648939 8 0a 03 64 06 c2 06 20 02
E: 13.655950 8 0a 03 2e 14 c8 16 39 01
E: 13.657942 8 0a 03 56 06 aa 06 20 02
E: 13.662954 8 0a 03 38 14 e6 16 45 01
E: 13.664943 8 0a 03 50 06 94 06 20 02
E: 13.672950 8 0a 03 42 14 02 17 51 01
E: 13.674924 8 0a 03 46 06 7c 06 20 02
E: 13.690949 8 0a 03 4a 14 20 17 58 01
E: 13.692930 8 0a 03 42 06 66 06 20 02
E: 13.699950 8 0a 03 50 14 3c 17 60 01
E: 13.701943 8 0a 03 3e 06 4e 06 20 02
E: 13.707948 8 0a 03 54 14 5c 17 68 01
E: 13.709964 8 0a 03 3c 06 36 06 20 02
E: 13.715999 8 0a 03 56 14 7a 17 70 01
E: 13.717946 8 0a 03 3c 06 1e 06 20 02
E: 13.722948 8 0a 03 56 14 98 17 78 01
E: 13.724939 8 0a 03 3e 06 06 06 20 02
E: 13.730987 8 0a 03 56 14 b2 17 80 01
E: 13.732947 8 0a 03 40 06 f0 05 20 02
E: 13.738981 8 0a 03 54 14 d0 17 86 01
E: 13.740942 8 0a 03 44 06 da 05 20 02
E: 13.746950 8 0a 03 50 14 ea 17 8c 01
E: 13.748939 8 0a 03 48 06 c4 05 20 02
E: 13.754951 8 0a 03 4a 14 06 18 92 01
E: 13.756938 8 0a 03 4e 06 b0 05 20 02
E: 13.763978 8 0a 03 40 14 1e 18 82 01
E: 13.765948 8 0a 03 56 06 9e 05 20 02
E: 13.773974 8 0a 03 36 14 38 18 72 01
E: 13.775944 8 0a 03 5e 06 8c 05 20 02
E: 13.785952 8 0a 03 28 14 4e 18 62 01
E: 13.787927 8 0a 03 6a 06 7a 05 20 02
E: 13.799951 8 0a 03 1a 14 66 18 5d 01
E: 13.802054 8 0a 03 74 06 68 05 20 02
E: 13.816996 8 0a 03 0a 14 7c 18 4e 01
E: 13.818937 8 0a 03 8c 06 5a 05 20 02
E: 13.829957 8 0a 03 f8 13 94 18 39 01
E: 13.831931 8 0a 03 a2 06 4a 05 20 02
E: 13.839937 8 0a 03 e6 13 aa 18 42 01
E: 13.841932 8 0a 03 c2 06 3c 05 20 02
E: 13.849936 8 0a 03 ce 13 c2 18 4e 01
E: 13.851927 8 0a 03 e2 06 2e 05 20 02
E: 13.859939 8 0a 03 aa 13 da 18 5a 01
E: 13.861938 8 0a 03 0a 07 20 05 20 02
E: 13.872947 8 0a 03 86 13 f4 18 5c 01
E: 13.874926 8 0a 03 32 07 12 05 20 02
E: 13.885945 8 0a 03 5c 13 0c 19 64 01
E: 13.887929 8 0a 03 60 07 04 05 20 02
E: 13.896941 8 0a 03 32 13 24 19 6c 01
E: 13.898925 8 0a 03 8c 07 f6 04 20 02
E: 13.908985 8 0a 03 06 13 38 19 74 01
E: 13.910935 8 0a 03 be 07 ea 04 20 02
E: 13.921972 8 0a 03 d8 12 4e 19 64 01
E: 13.923930 8 0a 03 f8 07 de 04 20 02
E: 13.935950 8 0a 03 aa 12 62 19 64 01
E: 13.937936 8 0a 03 32 08 d4 04 20 02
E: 13.947973 8 0a 03 7a 12 76 19 64 01
E: 13.949943 8 0a 03 72 08 ca 04 20 02
E: 13.957972 8 0a 03 4c 12 88 19 64 01
E: 13.959932 8 0a 03 b0 08 c0 04 20 02
E: 13.968988 8 0a 03 1e 12 9c 19 64 01
E: 13.970935 8 0a 03 f4 08 b6 04 20 02
E: 13.982934 8 0a 03 f2 11 ae 19 64 01
E: 13.984932 8 0a 03 34 09 ac 04 20 02
E: 13.996935 8 0a 03 c8 11 c0 19 64 01
E: 13.998924 8 0a 03 78 09 a4 04 20 02
E: 14.010976 8 0a 03 8e 11 ce 19 64 01
E: 14.012942 8 0a 03 ac 09 98 04 09 02
E: 14.024991 8 0a 03 5a 11 dc 19 64 01
E: 14.026937 8 0a 03 e6 09 8e 04 1b 02
E: 14.038952 8 0a 03 1e 11 e8 19 64 01
E: 14.040932 8 0a 03 14 0a 82 04 2a 02
E: 14.052938 8 0a 03 ea 10 f4 19 64 01
E: 14.054928 8 0a 03 44 0a 78 04 39 02
E: 14.066967 8 0a 03 b2 10 fe 19 64 01
E: 14.068938 8 0a 03 6a 0a 6e 04 48 02
E: 14.080945 8 0a 03 84 10 08 1a 64 01
E: 14.082929 8 0a 03 92 0a 66 04 57 02
E: 14.094943 8 0a 03 54 10 10 1a 64 01
E: 14.096931 8 0a 03 b2 0a 5c 04 5c 02
E: 14.108945 8 0a 03 2c 10 1a 1a 64 01
E: 14.110936 8 0a 03 d2 0a 54 04 64 02
E: 14.122944 8 0a 03 04 10 22 1a 64 01
E: 14.124931 8 0a 03 ec 0a 4c 04 6c 02
E: 14.136967 8 0a 03 e4 0f 2a 1a 64 01
E: 14.138974 8 0a 03 04 0b 46 04 74 02
E: 14.150991 8 0a 03 c4 0f 2e 1a 64 01
E: 14.152949 8 0a 03 18 0b 40 04 7c 02
E: 14.164948 8 0a 03 aa 0f 36 1a 64 01
E: 14.166927 8 0a 03 2c 0b 3c 04 84 02
E: 14.178943 8 0a 03 92 0f 3a 1a 64 01
E: 14.180929 8 0a 03 3c 0b 36 04 8a 02
E: 14.193979 8 0a 03 7e 0f 40 1a 64 01
E: 14.196055 8 0a 03 4c 0b 32 04 90 02
E: 14.207966 8 0a 03 6c 0f 44 1a 64 01
E: 14.210045 8 0a 03 5a 0b 2e 04 96 02
E: 14.221950 8 0a 03 5c 0f 4a 1a 64 01
E: 14.223935 8 0a 03 66 0b 2a 04 9c 02
E: 14.235947 8 0a 03 4c 0f 4c 1a 64 01
E: 14.237862 8 0a 03 70 0b 26 04 a2 02
E: 14.249992 8 0a 03 40 0f 52 1a 64 01
E: 14.251944 8 0a 03 7c 0b 24 04 a8 02
E: 14.263997 8 0a 03 34 0f 54 1a 64 01
E: 14.265949 8 0a 03 86 0b 22 04 ae 02
E: 14.277945 8 0a 03 2a 0f 58 1a 64 01
E: 14.279938 8 0a 03 90 0b 1e 04 b2 02
E: 14.291941 8 0a 03 20 0f 58 1a 64 01
E: 14.293932 8 0a 03 98 0b 1e 04 b6 02
E: 14.305975 8 0a 03 18 0f 5a 1a 64 01
E: 14.307944 8 0a 03 a0 0b 1a 04 ba 02
E: 14.319944 8 0a 03 10 0f 5a 1a 64 01
E: 14.321933 8 0a 03 a8 0b 18 04 be 02
E: 14.333947 8 0a 03 08 0f 5c 1a 64 01
E: 14.335928 8 0a 03 b0 0b 14 04 c2 02
E: 14.347994 8 0a 03 02 0f 5c 1a 64 01
E: 14.349950 8 0a 03 b6 0b 14 04 c6 02
E: 14.361987 8 0a 03 fc 0e 5e 1a 64 01
E: 14.363941 8 0a 03 bc 0b 12 04 ca 02
E: 14.375945 8 0a 03 f6 0e 5e 1a 64 01
E: 14.377936 8 0a 03 c2 0b 12 04 ce 02
E: 14.390937 8 0a 03 f2 0e 60 1a 64 01
E: 14.392933 8 0a 03 c8 0b 10 04 d0 02
E: 14.404980 8 0a 03 ee 0e 60 1a 64 01
E: 14.406962 8 0a 03 cc 0b 12 04 d4 02
E: 14.418975 8 0a 03 ec 0e 60 1a 64 01
E: 14.420939 8 0a 03 cc 0b 10 04 d8 02
E: 14.432935 8 0a 03 e8 0e 60 1a 64 01
E: 14.434927 8 0a 03 d2 0b 10 04 da 02
E: 14.446931 8 0a 03 e8 0e 60 1a 64 01
E: 14.448935 8 0a 03 d4 0b 0e 04 dc 02
E: 14.460937 8 0a 03 e8 0e 60 1a 64 01
E: 14.462933 8 0a 03 d8 0b 0e 04 de 02
E: 14.474936 8 0a 03 e8 0e 60 1a 64 01
E: 14.476926 8 0a 03 dc 0b 0e 04 e0 02
E: 14.489083 8 0a 03 e8 0e 60 1a 64 01
E: 14.490971 8 0a 03 e0 0b 0e 04 e2 02
E: 14.502978 8 0a 03 e8 0e 60 1a 64 01
E: 14.504973 8 0a 03 e2 0b 0e 04 e4 02
E: 14.516945 8 0a 03 e8 0e 60 1a 64 01
E: 14.518934 8 0a 03 e2 0b 0e 04 e6 02
E: 14.530933 8 0a 03 e8 0e 60 1a 64 01
E: 14.532926 8 0a 03 e2 0b 0e 04 e8 02
E: 14.545042 8 0a 03 e8 0e 60 1a 64 01
E: 14.546939 8 0a 03 e2 0b 0e 04 ea 02
E: 14.558973 8 0a 03 e8 0e 60 1a 64 01
E: 14.560935 8 0a 03 e2 0b 0e 04 ea 02
E: 14.572976 8 0a 03 e8 0e 60 1a 64 01
E: 14.574940 8 0a 03 e2 0b 0e 04 ec 02
E: 14.587962 8 0a 03 e8 0e 60 1a 64 01
E: 14.589945 8 0a 03 e2 0b 0e 04 ee 02
E: 14.601953 8 0a 03 e8 0e 60 1a 64 01
E: 14.603938 8 0a 03 e2 0b 0e 04 f0 02
E: 14.615992 8 0a 03 e8 0e 60 1a 64 01
E: 14.617939 8 0a 03 e2 0b 0e 04 f2 02
E: 14.629983 8 0a 03 e8 0e 60 1a 64 01
E: 14.631940 8 0a 03 e2 0b 0e 04 f4 02
E: 14.643933 8 0a 03 e8 0e 60 1a 64 01
E: 14.645927 8 0a 03 e2 0b 0e 04 f6 02
E: 14.657954 8 0a 03 e8 0e 60 1a 64 01
E: 14.659926 8 0a 03 e2 0b 0e 04 f8 02
E: 14.671944 8 0a 03 e8 0e 60 1a 64 01
E: 14.673929 8 0a 03 e2 0b 0e 04 fa 02
E: 14.685959 8 0a 03 e8 0e 60 1a 64 01
E: 14.687936 8 0a 03 e2 0b 0e 04 fc 02
E: 14.699931 8 0a 03 e8 0e 60 1a 64 01
E: 14.701933 8 0a 03 e2 0b 0e 04 fe 02
E: 14.714920 8 0a 03 e8 0e 60 1a 64 01
E: 14.716929 8 0a 03 e2 0b 0e 04 fe 02
E: 14.728953 8 0a 03 e8 0e 60 1a 64 01
E: 14.730921 8 0a 03 e2 0b 0e 04 fe 02
E: 14.742995 8 0a 03 e8 0e 60 1a 64 01
E: 14.744937 8 0a 03 e2 0b 0e 04 fe 02
E: 14.756980 8 0a 03 e8 0e 60 1a 64 01
E: 14.758923 8 0a 03 e2 0b 0e 04 fe 02
E: 14.770966 8 0a 03 e8 0e 60 1a 64 01
E: 14.772927 8 0a 03 e2 0b 0e 04 fe 02
E: 14.784968 8 0a 03 e8 0e 60 1a 64 01
E: 14.786922 8 0a 03 e2 0b 0e 04 fe 02
E: 14.798922 8 0a 03 e8 0e 60 1a 64 01
E: 14.800917 8 0a 03 e2 0b 0e 04 fe 02
E: 14.812954 8 0a 03 e8 0e 60 1a 64 01
E: 14.814924 8 0a 03 e2 0b 0e 04 fe 02
E: 14.826967 8 0a 03 e8 0e 60 1a 64 01
E: 14.828925 8 0a 03 e2 0b 0e 04 fe 02
E: 14.840960 8 0a 03 e8 0e 60 1a 64 01
E: 14.842921 8 0a 03 e2 0b 0e 04 fe 02
E: 14.854934 8 0a 03 e8 0e 60 1a 64 01
E: 14.856922 8 0a 03 e2 0b 0e 04 fe 02
E: 14.869922 8 0a 03 e8 0e 60 1a 64 01
E: 14.871912 8 0a 03 e2 0b 0e 04 fe 02
E: 14.883926 8 0a 03 e8 0e 60 1a 64 01
E: 14.885922 8 0a 03 e2 0b 0e 04 fe 02
E: 14.897921 8 0a 03 e8 0e 60 1a 64 01
E: 14.899915 8 0a 03 e2 0b 0e 04 fe 02
E: 14.911921 8 0a 03 e8 0e 60 1a 64 01
E: 14.913921 8 0a 03 e2 0b 0e 04 fe 02
E: 14.925923 8 0a 03 e8 0e 60 1a 64 01
E: 14.927915 8 0a 03 e2 0b 0e 04 fe 02
E: 14.939922 8 0a 03 e8 0e 60 1a 64 01
E: 14.941962 8 0a 03 e2 0b 0e 04 fe 02
E: 14.953929 8 0a 03 e8 0e 60 1a 64 01
E: 14.955929 8 0a 03 e2 0b 0e 04 fe 02
E: 14.967963 8 0a 03 e8 0e 60 1a 64 01
E: 14.969927 8 0a 03 e2 0b 0e 04 fe 02
E: 14.981961 8 0a 03 e8 0e 60 1a 64 01
E: 14.983927 8 0a 03 e2 0b 0e 04 fe 02
E: 14.996941 8 0a 03 e8 0e 60 1a 64 01
E: 14.998932 8 0a 03 e8 0b 0c 04 fe 02
E: 15.010924 8 0a 03 e8 0e 60 1a 64 01
E: 15.012926 8 0a 03 f2 0b 0a 04 fe 02
E: 15.024960 8 0a 03 e8 0e 60 1a 64 01
E: 15.026926 8 0a 03 fa 0b 08 04 fe 02
E: 15.038953 8 0a 03 e8 0e 60 1a 64 01
E: 15.040966 8 0a 03 00 0c 06 04 fe 02
E: 15.052956 8 0a 03 e8 0e 60 1a 64 01
E: 15.054932 8 0a 03 04 0c 04 04 fe 02
E: 15.066950 8 0a 03 e8 0e 60 1a 64 01
E: 15.068932 8 0a 03 08 0c 04 04 fe 02
E: 15.080923 8 0a 03 e8 0e 60 1a 64 01
E: 15.082915 8 0a 03 08 0c 04 04 fe 02
E: 15.094941 8 0a 03 e8 0e 60 1a 64 01
E: 15.096924 8 0a 03 08 0c 04 04 fe 02
E: 15.108924 8 0a 03 e8 0e 60 1a 64 01
E: 15.110914 8 0a 03 08 0c 04 04 fe 02
E: 15.122928 8 0a 03 e8 0e 60 1a 64 01
E: 15.124926 8 0a 03 08 0c 04 04 fe 02
E: 15.136923 8 0a 03 e8 0e 60 1a 64 01
E: 15.138914 8 0a 03 08 0c 04 04 fe 02
E: 15.150924 8 0a 03 e8 0e 60 1a 64 01
E: 15.152918 8 0a 03 08 0c 04 04 fe 02
E: 15.164977 8 0a 03 e8 0e 60 1a 64 01
E: 15.166925 8 0a 03 08 0c 04 04 fe 02
E: 15.178963 8 0a 03 e8 0e 60 1a 64 01
E: 15.180933 8 0a 03 08 0c 04 04 fe 02
E: 15.192961 8 0a 03 e8 0e 60 1a 64 01
E: 15.194919 8 0a 03 08 0c 04 04 fe 02
E: 15.206931 8 0a 03 e8 0e 60 1a 64 01
E: 15.208928 8 0a 03 08 0c 04 04 fe 02
E: 15.220972 8 0a 03 e8 0e 60 1a 64 01
E: 15.222928 8 0a 03 08 0c 04 04 fe 02
E: 15.234963 8 0a 03 e8 0e 60 1a 64 01
E: 15.236932 8 0a 03 08 0c 04 04 fe 02
E: 15.248935 8 0a 03 e8 0e 60 1a 64 01
E: 15.250932 8 0a 03 08 0c 04 04 fe 02
E: 15.263945 8 0a 03 e8 0e 60 1a 64 01
E: 15.265928 8 0a 03 08 0c 04 04 fe 02
E: 15.277968 8 0a 03 e8 0e 60 1a 64 01
E: 15.279923 8 0a 03 08 0c 04 04 fe 02
E: 15.292003 8 0a 03 e8 0e 60 1a 64 01
E: 15.293954 8 0a 03 08 0c 04 04 fe 02
E: 15.305937 8 0a 03 e8 0e 60 1a 64 01
E: 15.307923 8 0a 03 08 0c 04 04 fe 02
E: 15.319931 8 0a 03 e8 0e 60 1a 64 01
E: 15.321928 8 0a 03 08 0c 04 04 fe 02
E: 15.333929 8 0a 03 e8 0e 60 1a 64 01
E: 15.335917 8 0a 03 08 0c 04 04 fe 02
E: 15.347955 8 0a 03 e8 0e 60 1a 64 01
E: 15.349925 8 0a 03 08 0c 04 04 fe 02
E: 15.362930 8 0a 03 e8 0e 60 1a 64 01
E: 15.364939 8 0a 03 08 0c 04 04 fe 02
E: 15.376981 8 0a 03 e8 0e 60 1a 64 01
E: 15.378927 8 0a 03 08 0c 04 04 fe 02
E: 15.390964 8 0a 03 e8 0e 60 1a 64 01
E: 15.392933 8 0a 03 08 0c 04 04 fe 02
E: 15.404948 8 0a 03 e8 0e 60 1a 64 01
E: 15.406921 8 0a 03 08 0c 04 04 fe 02
E: 15.418962 8 0a 03 e8 0e 60 1a 64 01
E: 15.420961 8 0a 03 08 0c 04 04 fe 02
E: 15.432956 8 0a 03 e8 0e 60 1a 64 01
E: 15.434929 8 0a 03 08 0c 04 04 fe 02
E: 15.446932 8 0a 03 e8 0e 60 1a 64 01
E: 15.448919 8 0a 03 08 0c 04 04 fe 02
E: 15.460938 8 0a 03 e8 0e 60 1a 64 01
E: 15.462924 8 0a 03 08 0c 04 04 fe 02
E: 15.474973 8 0a 03 e8 0e 60 1a 64 01
E: 15.476932 8 0a 03 08 0c 04 04 fe 02
E: 15.488959 8 0a 03 e8 0e 60 1a 64 01
E: 15.490929 8 0a 03 08 0c 04 04 fe 02
E: 15.502932 8 0a 03 e8 0e 60 1a 64 01
E: 15.504918 8 0a 03 08 0c 04 04 fe 02
E: 15.516931 8 0a 03 e8 0e 60 1a 64 01
E: 15.518913 8 0a 03 08 0c 04 04 fe 02
E: 15.530952 8 0a 03 e8 0e 60 1a 64 01
E: 15.532932 8 0a 03 08 0c 04 04 fe 02
E: 15.544931 8 0a 03 e8 0e 60 1a 64 01
E: 15.546928 8 0a 03 08 0c 04 04 fe 02
E: 15.558933 8 0a 03 e8 0e 60 1a 64 01
E: 15.560919 8 0a 03 08 0c 04 04 fe 02
E: 15.572986 8 0a 03 e8 0e 60 1a 64 01
E: 15.574957 8 0a 03 08 0c 04 04 fe 02
E: 15.587957 8 0a 03 e8 0e 60 1a 64 01
E: 15.589938 8 0a 03 08 0c 04 04 fe 02
E: 15.601930 8 0a 03 e8 0e 60 1a 64 01
E: 15.604030 8 0a 03 08 0c 04 04 fe 02
E: 15.615968 8 0a 03 e8 0e 60 1a 64 01
E: 15.617936 8 0a 03 08 0c 04 04 fc 02
E: 15.629975 8 0a 03 e8 0e 60 1a 64 01
E: 15.631938 8 0a 03 08 0c 04 04 ec 02
E: 15.738994 8 0a 03 e8 0e 60 1a 7a 01
E: 15.740926 8 0a 03 08 0c 04 04 ec 02
E: 15.749931 8 0a 03 08 0c 04 04 ec 02
E: 15.751922 8 0a 03 e8 0e 60 1a 8e 01
E: 15.760939 8 0a 03 e8 0e 60 1a 10 01
E: 15.762959 8 0a 03 08 0c 04 04 ec 02
E: 15.772943 8 0a 00 e8 0e 60 1a 10 01
E: 15.774923 8 0a 03 08 0c 04 04 ec 02
E: 15.783965 8 0a 03 08 0c 04 04 ec 02
E: 15.794939 8 0a 03 08 0c 04 04 ec 02
E: 15.804945 8 0a 03 0e 0c 02 04 ec 02
E: 15.816089 8 0a 03 18 0c 02 04 ec 02
E: 15.825951 8 0a 03 22 0c 02 04 ec 02
E: 15.836942 8 0a 03 28 0c 02 04 ec 02
E: 15.846925 8 0a 03 30 0c 02 04 ec 02
E: 15.856915 8 0a 03 34 0c 02 04 ec 02
E: 15.866941 8 0a 03 34 0c 02 04 ec 02
E: 15.878928 8 0a 03 34 0c 02 04 ec 02
E: 15.888968 8 0a 03 34 0c 02 04 ea 02
E: 15.899950 8 0a 03 34 0c 02 04 ea 02
E: 15.909953 8 0a 03 34 0c 02 04 e8 02
E: 15.919955 8 0a 03 34 0c 02 04 e8 02
E: 15.930920 8 0a 03 34 0c 02 04 e8 02
E: 15.940909 8 0a 03 34 0c 02 04 e8 02
E: 15.951915 8 0a 03 34 0c 02 04 e8 02
E: 15.962912 8 0a 03 34 0c 02 04 e8 02
E: 15.972910 8 0a 03 34 0c 02 04 e8 02
E: 15.983919 8 0a 03 34 0c 02 04 e8 02
E: 15.993912 8 0a 03 34 0c 02 04 e8 02
E: 16.004959 8 0a 03 34 0c 02 04 e8 02
E: 16.014967 8 0a 03 34 0c 02 04 e8 02
E: 16.025956 8 0a 03 34 0c 02 04 e8 02
E: 16.036916 8 0a 03 34 0c 02 04 e8 02
E: 16.046914 8 0a 03 34 0c 02 04 e8 02
E: 16.057946 8 0a 03 34 0c 02 04 e8 02
E: 16.067968 8 0a 03 34 0c 02 04 e8 02
E: 16.078946 8 0a 03 34 0c 02 04 e8 02
E: 16.088952 8 0a 03 34 0c 02 04 e8 02
E: 16.099950 8 0a 03 34 0c 02 04 e8 02
E: 16.109947 8 0a 03 34 0c 02 04 e8 02
E: 16.120922 8 0a 03 34 0c 02 04 e8 02
E: 16.130914 8 0a 03 34 0c 02 04 e8 02
E: 16.141932 8 0a 03 34 0c 02 04 e8 02
E: 16.151917 8 0a 03 34 0c 02 04 e8 02
E: 16.163912 8 0a 03 34 0c 02 04 e8 02
E: 16.173911 8 0a 03 34 0c 02 04 e8 02
E: 16.184936 8 0a 03 3a 0c 02 04 e6 02
E: 16.194931 8 0a 03 42 0c 04 04 e6 02
E: 16.205981 8 0a 03 4a 0c 06 04 e6 02
E: 16.215953 8 0a 03 4e 0c 06 04 e6 02
E: 16.226999 8 0a 03 52 0c 06 04 e6 02
E: 16.236940 8 0a 03 54 0c 06 04 e6 02
E: 16.247937 8 0a 03 54 0c 06 04 e6 02
E: 16.258961 8 0a 03 54 0c 06 04 e6 02
E: 16.268965 8 0a 03 54 0c 06 04 e6 02
E: 16.279959 8 0a 03 54 0c 06 04 e6 02
E: 16.290952 8 0a 03 54 0c 06 04 e6 02
E: 16.300967 8 0a 03 54 0c 06 04 e6 02
E: 16.311963 8 0a 03 54 0c 06 04 e6 02
E: 16.321927 8 0a 03 54 0c 06 04 e6 02
E: 16.332918 8 0a 03 54 0c 06 04 e6 02
E: 16.342908 8 0a 03 54 0c 06 04 e6 02
E: 16.353923 8 0a 03 54 0c 06 04 e6 02
E: 16.363910 8 0a 03 54 0c 06 04 e6 02
E: 16.374912 8 0a 03 54 0c 06 04 e6 02
E: 16.384911 8 0a 03 54 0c 06 04 e6 02
E: 16.395917 8 0a 03 54 0c 06 04 e6 02
E: 16.405966 8 0a 03 54 0c 06 04 e6 02
E: 16.416945 8 0a 03 54 0c 06 04 e6 02
E: 16.426915 8 0a 03 54 0c 06 04 e6 02
E: 16.437912 8 0a 03 54 0c 06 04 e6 02
E: 16.447939 8 0a 03 54 0c 06 04 e6 02
E: 16.458951 8 0a 03 54 0c 06 04 e6 02
E: 16.469963 8 0a 03 54 0c 06 04 e6 02
E: 16.479920 8 0a 03 54 0c 06 04 e6 02
E: 16.490914 8 0a 03 54 0c 06 04 e6 02
E: 16.500963 8 0a 03 54 0c 06 04 e6 02
E: 16.511943 8 0a 03 54 0c 06 04 e6 02
E: 16.522921 8 0a 03 54 0c 06 04 e6 02
E: 16.532913 8 0a 03 54 0c 06 04 e6 02
E: 16.543910 8 0a 03 54 0c 06 04 e6 02
E: 16.553933 8 0a 03 54 0c 06 04 e6 02
E: 16.564916 8 0a 03 54 0c 06 04 e6 02
E: 16.574913 8 0a 03 54 0c 06 04 e6 02
E: 16.585940 8 0a 03 54 0c 06 04 e6 02
E: 16.595924 8 0a 03 54 0c 06 04 e6 02
E: 16.606969 8 0a 03 54 0c 06 04 e6 02
E: 16.616948 8 0a 03 54 0c 06 04 e6 02
E: 16.627955 8 0a 03 54 0c 06 04 e6 02
E: 16.637922 8 0a 03 54 0c 06 04 e6 02
E: 16.648914 8 0a 03 54 0c 06 04 e6 02
E: 16.658950 8 0a 03 54 0c 06 04 e6 02
E: 16.669951 8 0a 03 54 0c 06 04 e6 02
E: 16.679964 8 0a 03 54 0c 06 04 e4 02
E: 16.690965 8 0a 03 54 0c 06 04 e2 02
E: 16.700958 8 0a 03 54 0c 06 04 de 02
E: 16.711960 8 0a 03 54 0c 06 04 ca 02
E: 16.716944 8 0a 03 54 0c 06 04 ca 02
E: 16.736912 8 0a 03 54 0c 06 04 ca 02
E: 16.738901 8 0a 00 54 0c 06 04 ca 02
# 3. Finally, move your ten fingers on the screen and release them.
E: 29.819971 8 0a 00 6a 14 9c 0b ac 01
E: 30.537011 8 0a 03 6a 14 9c 0b 20 01
E: 30.539932 8 0a 03 68 14 9a 0b 20 01
E: 30.541912 8 0a 03 68 14 9a 0b 20 01
E: 30.543908 8 0a 00 68 14 9a 0b 20 01
# Thank you.
