R: 435 05 0d 09 04 a1 01 85 0a 09 22 a1 02 05 0d 09 42 15 00 25 01 75 01 95 01 81 02 09 32 81 02 09 47 81 02 95 05 81 03 75 08 09 51 95 01 81 02 05 01 15 00 26 ff 7f 75 10 09 30 81 02 09 31 81 02 05 0d 09 48 09 49 95 02 81 02 c0 a1 02 05 0d 09 42 15 00 25 01 75 01 95 01 81 02 09 32 81 02 09 47 81 02 95 05 81 03 75 08 09 51 95 01 81 02 05 01 15 00 26 ff 7f 75 10 09 30 81 02 09 31 81 02 05 0d 09 48 09 49 95 02 81 02 c0 a1 02 05 0d 09 42 15 00 25 01 75 01 95 01 81 02 09 32 81 02 09 47 81 02 95 05 81 03 75 08 09 51 95 01 81 02 05 01 15 00 26 ff 7f 75 10 09 30 81 02 09 31 81 02 05 0d 09 48 09 49 95 02 81 02 c0 a1 02 05 0d 09 42 15 00 25 01 75 01 95 01 81 02 09 32 81 02 09 47 81 02 95 05 81 03 75 08 09 51 95 01 81 02 05 01 15 00 26 ff 7f 75 10 09 30 81 02 09 31 81 02 05 0d 09 48 09 49 95 02 81 02 c0 a1 02 05 0d 09 42 15 00 25 01 75 01 95 01 81 02 09 32 81 02 09 47 81 02 95 05 81 03 75 08 09 51 95 01 81 02 05 01 15 00 26 ff 7f 75 10 09 30 81 02 09 31 81 02 05 0d 09 48 09 49 95 02 81 02 c0 a1 02 05 0d 09 42 15 00 25 01 75 01 95 01 81 02 09 32 81 02 09 47 81 02 95 05 81 03 75 08 09 51 95 01 81 02 05 01 15 00 26 ff 7f 75 10 09 30 81 02 09 31 81 02 05 0d 09 48 09 49 95 02 81 02 c0 05 0d 09 54 95 01 75 08 81 02 09 55 25 06 b1 02 c0 09 0e a1 01 85 0c 09 23 a1 02 09 52 15 00 25 06 75 08 95 01 b1 02 c0 c0
N: IRM Touch IRM MultiTouch Screen
I: 3 23c9 5666
# 1. Drag _one_ finger on the screen from one corner to the opposite, and release it.
E: 0.000000 62 0a 07 64 35 7c 65 03 16 04 62 02 00 00 00 00 00 00 00 00 00 00 00 00 00 00 00 00 00 00 00 00 00 00 00 00 00 00 00 00 00 00 00 00 00 00 00 00 00 00 00 00 00 00 00 00 00 00 00 00 00 00 01
E: 0.015785 62 0a 07 64 35 7c 65 03 35 04 8d 02 00 00 00 00 00 00 00 00 00 00 00 00 00 00 00 00 00 00 00 00 00 00 00 00 00 00 00 00 00 00 00 00 00 00 00 00 00 00 00 00 00 00 00 00 00 00 00 00 00 00 01
E: 0.032764 62 0a 07 64 07 7c 7a 03 bb 03 96 02 00 00 00 00 00 00 00 00 00 00 00 00 00 00 00 00 00 00 00 00 00 00 00 00 00 00 00 00 00 00 00 00 00 00 00 00 00 00 00 00 00 00 00 00 00 00 00 00 00 00 01
E: 0.049757 62 0a 07 64 2a 7b e1 03 e9 03 26 02 00 00 00 00 00 00 00 00 00 00 00 00 00 00 00 00 00 00 00 00 00 00 00 00 00 00 00 00 00 00 00 00 00 00 00 00 00 00 00 00 00 00 00 00 00 00 00 00 00 00 01
E: 0.065773 62 0a 07 64 35 7a 51 04 5f 03 a7 02 00 00 00 00 00 00 00 00 00 00 00 00 00 00 00 00 00 00 00 00 00 00 00 00 00 00 00 00 00 00 00 00 00 00 00 00 00 00 00 00 00 00 00 00 00 00 00 00 00 00 01
E: 0.082759 62 0a 07 64 13 79 ce 04 98 04 6b 02 00 00 00 00 00 00 00 00 00 00 00 00 00 00 00 00 00 00 00 00 00 00 00 00 00 00 00 00 00 00 00 00 00 00 00 00 00 00 00 00 00 00 00 00 00 00 00 00 00 00 01
E: 0.083747 62 0a 07 64 4c 78 20 05 98 04 6b 02 00 00 00 00 00 00 00 00 00 00 00 00 00 00 00 00 00 00 00 00 00 00 00 00 00 00 00 00 00 00 00 00 00 00 00 00 00 00 00 00 00 00 00 00 00 00 00 00 00 00 01
E: 0.099755 62 0a 07 64 7e 77 76 05 07 04 67 02 00 00 00 00 00 00 00 00 00 00 00 00 00 00 00 00 00 00 00 00 00 00 00 00 00 00 00 00 00 00 00 00 00 00 00 00 00 00 00 00 00 00 00 00 00 00 00 00 00 00 01
E: 0.100629 62 0a 07 64 af 76 d4 05 07 04 67 02 00 00 00 00 00 00 00 00 00 00 00 00 00 00 00 00 00 00 00 00 00 00 00 00 00 00 00 00 00 00 00 00 00 00 00 00 00 00 00 00 00 00 00 00 00 00 00 00 00 00 01
E: 0.115769 62 0a 07 64 e1 75 33 06 a0 04 6f 02 00 00 00 00 00 00 00 00 00 00 00 00 00 00 00 00 00 00 00 00 00 00 00 00 00 00 00 00 00 00 00 00 00 00 00 00 00 00 00 00 00 00 00 00 00 00 00 00 00 00 01
E: 0.116748 62 0a 07 64 0b 75 96 06 a0 04 6f 02 00 00 00 00 00 00 00 00 00 00 00 00 00 00 00 00 00 00 00 00 00 00 00 00 00 00 00 00 00 00 00 00 00 00 00 00 00 00 00 00 00 00 00 00 00 00 00 00 00 00 01
E: 0.132756 62 0a 07 64 35 74 02 07 7a 04 fd 02 00 00 00 00 00 00 00 00 00 00 00 00 00 00 00 00 00 00 00 00 00 00 00 00 00 00 00 00 00 00 00 00 00 00 00 00 00 00 00 00 00 00 00 00 00 00 00 00 00 00 01
E: 0.133751 62 0a 07 64 5f 73 6d 07 7a 04 fd 02 00 00 00 00 00 00 00 00 00 00 00 00 00 00 00 00 00 00 00 00 00 00 00 00 00 00 00 00 00 00 00 00 00 00 00 00 00 00 00 00 00 00 00 00 00 00 00 00 00 00 01
E: 0.149757 62 0a 07 64 89 72 ee 07 ff 03 d2 02 00 00 00 00 00 00 00 00 00 00 00 00 00 00 00 00 00 00 00 00 00 00 00 00 00 00 00 00 00 00 00 00 00 00 00 00 00 00 00 00 00 00 00 00 00 00 00 00 00 00 01
E: 0.150624 62 0a 07 64 b3 71 89 08 ff 03 d2 02 00 00 00 00 00 00 00 00 00 00 00 00 00 00 00 00 00 00 00 00 00 00 00 00 00 00 00 00 00 00 00 00 00 00 00 00 00 00 00 00 00 00 00 00 00 00 00 00 00 00 01
E: 0.166767 62 0a 07 64 ce 70 35 09 5b 04 8d 02 00 00 00 00 00 00 00 00 00 00 00 00 00 00 00 00 00 00 00 00 00 00 00 00 00 00 00 00 00 00 00 00 00 00 00 00 00 00 00 00 00 00 00 00 00 00 00 00 00 00 01
E: 0.167748 62 0a 07 64 d9 6f f3 09 5b 04 8d 02 00 00 00 00 00 00 00 00 00 00 00 00 00 00 00 00 00 00 00 00 00 00 00 00 00 00 00 00 00 00 00 00 00 00 00 00 00 00 00 00 00 00 00 00 00 00 00 00 00 00 01
E: 0.182767 62 0a 07 64 d6 6e b0 0a ff 03 19 02 00 00 00 00 00 00 00 00 00 00 00 00 00 00 00 00 00 00 00 00 00 00 00 00 00 00 00 00 00 00 00 00 00 00 00 00 00 00 00 00 00 00 00 00 00 00 00 00 00 00 01
E: 0.183748 62 0a 07 64 c3 6d 69 0b ff 03 19 02 00 00 00 00 00 00 00 00 00 00 00 00 00 00 00 00 00 00 00 00 00 00 00 00 00 00 00 00 00 00 00 00 00 00 00 00 00 00 00 00 00 00 00 00 00 00 00 00 00 00 01
E: 0.199755 62 0a 07 64 a0 6c 2a 0c 54 04 26 02 00 00 00 00 00 00 00 00 00 00 00 00 00 00 00 00 00 00 00 00 00 00 00 00 00 00 00 00 00 00 00 00 00 00 00 00 00 00 00 00 00 00 00 00 00 00 00 00 00 00 01
E: 0.200627 62 0a 07 64 67 6b f0 0c 54 04 26 02 00 00 00 00 00 00 00 00 00 00 00 00 00 00 00 00 00 00 00 00 00 00 00 00 00 00 00 00 00 00 00 00 00 00 00 00 00 00 00 00 00 00 00 00 00 00 00 00 00 00 01
E: 0.216768 62 0a 07 64 2e 6a b6 0d 2d 04 7c 02 00 00 00 00 00 00 00 00 00 00 00 00 00 00 00 00 00 00 00 00 00 00 00 00 00 00 00 00 00 00 00 00 00 00 00 00 00 00 00 00 00 00 00 00 00 00 00 00 00 00 01
E: 0.217751 62 0a 07 64 ed 68 7c 0e 2d 04 7c 02 00 00 00 00 00 00 00 00 00 00 00 00 00 00 00 00 00 00 00 00 00 00 00 00 00 00 00 00 00 00 00 00 00 00 00 00 00 00 00 00 00 00 00 00 00 00 00 00 00 00 01
E: 0.232766 62 0a 07 64 bb 67 46 0f a4 03 26 02 00 00 00 00 00 00 00 00 00 00 00 00 00 00 00 00 00 00 00 00 00 00 00 00 00 00 00 00 00 00 00 00 00 00 00 00 00 00 00 00 00 00 00 00 00 00 00 00 00 00 01
E: 0.233749 62 0a 07 64 a0 66 19 10 a4 03 26 02 00 00 00 00 00 00 00 00 00 00 00 00 00 00 00 00 00 00 00 00 00 00 00 00 00 00 00 00 00 00 00 00 00 00 00 00 00 00 00 00 00 00 00 00 00 00 00 00 00 00 01
E: 0.249759 62 0a 07 64 76 65 f0 10 2d 04 56 02 00 00 00 00 00 00 00 00 00 00 00 00 00 00 00 00 00 00 00 00 00 00 00 00 00 00 00 00 00 00 00 00 00 00 00 00 00 00 00 00 00 00 00 00 00 00 00 00 00 00 01
E: 0.250626 62 0a 07 64 35 64 cc 11 2d 04 56 02 00 00 00 00 00 00 00 00 00 00 00 00 00 00 00 00 00 00 00 00 00 00 00 00 00 00 00 00 00 00 00 00 00 00 00 00 00 00 00 00 00 00 00 00 00 00 00 00 00 00 01
E: 0.266766 62 0a 07 64 04 63 a7 12 07 04 19 02 00 00 00 00 00 00 00 00 00 00 00 00 00 00 00 00 00 00 00 00 00 00 00 00 00 00 00 00 00 00 00 00 00 00 00 00 00 00 00 00 00 00 00 00 00 00 00 00 00 00 01
E: 0.267751 62 0a 07 64 d2 61 87 13 07 04 19 02 00 00 00 00 00 00 00 00 00 00 00 00 00 00 00 00 00 00 00 00 00 00 00 00 00 00 00 00 00 00 00 00 00 00 00 00 00 00 00 00 00 00 00 00 00 00 00 00 00 00 01
E: 0.282769 62 0a 07 64 b7 60 67 14 94 03 51 02 00 00 00 00 00 00 00 00 00 00 00 00 00 00 00 00 00 00 00 00 00 00 00 00 00 00 00 00 00 00 00 00 00 00 00 00 00 00 00 00 00 00 00 00 00 00 00 00 00 00 01
E: 0.283751 62 0a 07 64 9c 5f 53 15 94 03 51 02 00 00 00 00 00 00 00 00 00 00 00 00 00 00 00 00 00 00 00 00 00 00 00 00 00 00 00 00 00 00 00 00 00 00 00 00 00 00 00 00 00 00 00 00 00 00 00 00 00 00 01
E: 0.299770 62 0a 07 64 72 5e 44 16 ff 03 26 02 00 00 00 00 00 00 00 00 00 00 00 00 00 00 00 00 00 00 00 00 00 00 00 00 00 00 00 00 00 00 00 00 00 00 00 00 00 00 00 00 00 00 00 00 00 00 00 00 00 00 01
E: 0.300751 62 0a 07 64 22 5d 46 17 ff 03 26 02 00 00 00 00 00 00 00 00 00 00 00 00 00 00 00 00 00 00 00 00 00 00 00 00 00 00 00 00 00 00 00 00 00 00 00 00 00 00 00 00 00 00 00 00 00 00 00 00 00 00 01
E: 0.316757 62 0a 07 64 d2 5b 48 18 ff 03 1e 02 00 00 00 00 00 00 00 00 00 00 00 00 00 00 00 00 00 00 00 00 00 00 00 00 00 00 00 00 00 00 00 00 00 00 00 00 00 00 00 00 00 00 00 00 00 00 00 00 00 00 01
E: 0.317626 62 0a 07 64 82 5a 4b 19 ff 03 1e 02 00 00 00 00 00 00 00 00 00 00 00 00 00 00 00 00 00 00 00 00 00 00 00 00 00 00 00 00 00 00 00 00 00 00 00 00 00 00 00 00 00 00 00 00 00 00 00 00 00 00 01
E: 0.332763 62 0a 07 64 2a 59 4d 1a bb 03 1e 02 00 00 00 00 00 00 00 00 00 00 00 00 00 00 00 00 00 00 00 00 00 00 00 00 00 00 00 00 00 00 00 00 00 00 00 00 00 00 00 00 00 00 00 00 00 00 00 00 00 00 01
E: 0.333625 62 0a 07 64 c3 57 4f 1b bb 03 1e 02 00 00 00 00 00 00 00 00 00 00 00 00 00 00 00 00 00 00 00 00 00 00 00 00 00 00 00 00 00 00 00 00 00 00 00 00 00 00 00 00 00 00 00 00 00 00 00 00 00 00 01
E: 0.349762 62 0a 07 64 63 56 4d 1c b3 03 11 02 00 00 00 00 00 00 00 00 00 00 00 00 00 00 00 00 00 00 00 00 00 00 00 00 00 00 00 00 00 00 00 00 00 00 00 00 00 00 00 00 00 00 00 00 00 00 00 00 00 00 01
E: 0.350625 62 0a 07 64 0b 55 53 1d b3 03 11 02 00 00 00 00 00 00 00 00 00 00 00 00 00 00 00 00 00 00 00 00 00 00 00 00 00 00 00 00 00 00 00 00 00 00 00 00 00 00 00 00 00 00 00 00 00 00 00 00 00 00 01
E: 0.366764 62 0a 07 64 c3 53 51 1e 76 03 22 02 00 00 00 00 00 00 00 00 00 00 00 00 00 00 00 00 00 00 00 00 00 00 00 00 00 00 00 00 00 00 00 00 00 00 00 00 00 00 00 00 00 00 00 00 00 00 00 00 00 00 01
E: 0.367624 62 0a 07 64 89 52 4b 1f 76 03 22 02 00 00 00 00 00 00 00 00 00 00 00 00 00 00 00 00 00 00 00 00 00 00 00 00 00 00 00 00 00 00 00 00 00 00 00 00 00 00 00 00 00 00 00 00 00 00 00 00 00 00 01
E: 0.382763 62 0a 07 64 50 51 51 20 bb 03 04 02 00 00 00 00 00 00 00 00 00 00 00 00 00 00 00 00 00 00 00 00 00 00 00 00 00 00 00 00 00 00 00 00 00 00 00 00 00 00 00 00 00 00 00 00 00 00 00 00 00 00 01
E: 0.383747 62 0a 07 64 1e 50 60 21 bb 03 04 02 00 00 00 00 00 00 00 00 00 00 00 00 00 00 00 00 00 00 00 00 00 00 00 00 00 00 00 00 00 00 00 00 00 00 00 00 00 00 00 00 00 00 00 00 00 00 00 00 00 00 01
E: 0.399766 62 0a 07 64 e5 4e 6b 22 a4 03 3c 02 00 00 00 00 00 00 00 00 00 00 00 00 00 00 00 00 00 00 00 00 00 00 00 00 00 00 00 00 00 00 00 00 00 00 00 00 00 00 00 00 00 00 00 00 00 00 00 00 00 00 01
E: 0.400746 62 0a 07 64 9d 4d 76 23 a4 03 3c 02 00 00 00 00 00 00 00 00 00 00 00 00 00 00 00 00 00 00 00 00 00 00 00 00 00 00 00 00 00 00 00 00 00 00 00 00 00 00 00 00 00 00 00 00 00 00 00 00 00 00 01
E: 0.416769 62 0a 07 64 63 4c 78 24 b3 03 22 02 00 00 00 00 00 00 00 00 00 00 00 00 00 00 00 00 00 00 00 00 00 00 00 00 00 00 00 00 00 00 00 00 00 00 00 00 00 00 00 00 00 00 00 00 00 00 00 00 00 00 01
E: 0.417745 62 0a 07 64 39 4b 82 25 b3 03 22 02 00 00 00 00 00 00 00 00 00 00 00 00 00 00 00 00 00 00 00 00 00 00 00 00 00 00 00 00 00 00 00 00 00 00 00 00 00 00 00 00 00 00 00 00 00 00 00 00 00 00 01
E: 0.432768 62 0a 07 64 1e 4a 85 26 0b 03 37 02 00 00 00 00 00 00 00 00 00 00 00 00 00 00 00 00 00 00 00 00 00 00 00 00 00 00 00 00 00 00 00 00 00 00 00 00 00 00 00 00 00 00 00 00 00 00 00 00 00 00 01
E: 0.433748 62 0a 07 64 04 49 87 27 0b 03 37 02 00 00 00 00 00 00 00 00 00 00 00 00 00 00 00 00 00 00 00 00 00 00 00 00 00 00 00 00 00 00 00 00 00 00 00 00 00 00 00 00 00 00 00 00 00 00 00 00 00 00 01
E: 0.449764 62 0a 07 64 e1 47 89 28 ab 03 11 02 00 00 00 00 00 00 00 00 00 00 00 00 00 00 00 00 00 00 00 00 00 00 00 00 00 00 00 00 00 00 00 00 00 00 00 00 00 00 00 00 00 00 00 00 00 00 00 00 00 00 01
E: 0.450746 62 0a 07 64 a8 46 98 29 ab 03 11 02 00 00 00 00 00 00 00 00 00 00 00 00 00 00 00 00 00 00 00 00 00 00 00 00 00 00 00 00 00 00 00 00 00 00 00 00 00 00 00 00 00 00 00 00 00 00 00 00 00 00 01
E: 0.466764 62 0a 07 64 7e 45 a3 2a 9c 03 51 02 00 00 00 00 00 00 00 00 00 00 00 00 00 00 00 00 00 00 00 00 00 00 00 00 00 00 00 00 00 00 00 00 00 00 00 00 00 00 00 00 00 00 00 00 00 00 00 00 00 00 01
E: 0.467748 62 0a 07 64 63 44 a9 2b 9c 03 51 02 00 00 00 00 00 00 00 00 00 00 00 00 00 00 00 00 00 00 00 00 00 00 00 00 00 00 00 00 00 00 00 00 00 00 00 00 00 00 00 00 00 00 00 00 00 00 00 00 00 00 01
E: 0.482764 62 0a 07 64 50 43 b0 2c 76 03 40 02 00 00 00 00 00 00 00 00 00 00 00 00 00 00 00 00 00 00 00 00 00 00 00 00 00 00 00 00 00 00 00 00 00 00 00 00 00 00 00 00 00 00 00 00 00 00 00 00 00 00 01
E: 0.483746 62 0a 07 64 35 42 ba 2d 76 03 40 02 00 00 00 00 00 00 00 00 00 00 00 00 00 00 00 00 00 00 00 00 00 00 00 00 00 00 00 00 00 00 00 00 00 00 00 00 00 00 00 00 00 00 00 00 00 00 00 00 00 00 01
E: 0.499754 62 0a 07 64 22 41 c1 2e 40 03 26 02 00 00 00 00 00 00 00 00 00 00 00 00 00 00 00 00 00 00 00 00 00 00 00 00 00 00 00 00 00 00 00 00 00 00 00 00 00 00 00 00 00 00 00 00 00 00 00 00 00 00 01
E: 0.500625 62 0a 07 64 08 40 c7 2f 40 03 26 02 00 00 00 00 00 00 00 00 00 00 00 00 00 00 00 00 00 00 00 00 00 00 00 00 00 00 00 00 00 00 00 00 00 00 00 00 00 00 00 00 00 00 00 00 00 00 00 00 00 00 01
E: 0.516765 62 0a 07 64 fc 3e c9 30 6e 03 4d 02 00 00 00 00 00 00 00 00 00 00 00 00 00 00 00 00 00 00 00 00 00 00 00 00 00 00 00 00 00 00 00 00 00 00 00 00 00 00 00 00 00 00 00 00 00 00 00 00 00 00 01
E: 0.517623 62 0a 07 64 00 3e d0 31 6e 03 4d 02 00 00 00 00 00 00 00 00 00 00 00 00 00 00 00 00 00 00 00 00 00 00 00 00 00 00 00 00 00 00 00 00 00 00 00 00 00 00 00 00 00 00 00 00 00 00 00 00 00 00 01
E: 0.532763 62 0a 07 64 fc 3c ce 32 0f 04 08 02 00 00 00 00 00 00 00 00 00 00 00 00 00 00 00 00 00 00 00 00 00 00 00 00 00 00 00 00 00 00 00 00 00 00 00 00 00 00 00 00 00 00 00 00 00 00 00 00 00 00 01
E: 0.533624 62 0a 07 64 e1 3b d0 33 0f 04 08 02 00 00 00 00 00 00 00 00 00 00 00 00 00 00 00 00 00 00 00 00 00 00 00 00 00 00 00 00 00 00 00 00 00 00 00 00 00 00 00 00 00 00 00 00 00 00 00 00 00 00 01
E: 0.549764 62 0a 07 64 ce 3a ce 34 94 03 5a 02 00 00 00 00 00 00 00 00 00 00 00 00 00 00 00 00 00 00 00 00 00 00 00 00 00 00 00 00 00 00 00 00 00 00 00 00 00 00 00 00 00 00 00 00 00 00 00 00 00 00 01
E: 0.550624 62 0a 07 64 b4 39 cb 35 94 03 5a 02 00 00 00 00 00 00 00 00 00 00 00 00 00 00 00 00 00 00 00 00 00 00 00 00 00 00 00 00 00 00 00 00 00 00 00 00 00 00 00 00 00 00 00 00 00 00 00 00 00 00 01
E: 0.566762 62 0a 07 64 a1 38 ce 36 d9 03 56 02 00 00 00 00 00 00 00 00 00 00 00 00 00 00 00 00 00 00 00 00 00 00 00 00 00 00 00 00 00 00 00 00 00 00 00 00 00 00 00 00 00 00 00 00 00 00 00 00 00 00 01
E: 0.567746 62 0a 07 64 8d 37 d4 37 d9 03 56 02 00 00 00 00 00 00 00 00 00 00 00 00 00 00 00 00 00 00 00 00 00 00 00 00 00 00 00 00 00 00 00 00 00 00 00 00 00 00 00 00 00 00 00 00 00 00 00 00 00 00 01
E: 0.582762 62 0a 07 64 73 36 df 38 07 04 1e 02 00 00 00 00 00 00 00 00 00 00 00 00 00 00 00 00 00 00 00 00 00 00 00 00 00 00 00 00 00 00 00 00 00 00 00 00 00 00 00 00 00 00 00 00 00 00 00 00 00 00 01
E: 0.583746 62 0a 07 64 58 35 ee 39 07 04 1e 02 00 00 00 00 00 00 00 00 00 00 00 00 00 00 00 00 00 00 00 00 00 00 00 00 00 00 00 00 00 00 00 00 00 00 00 00 00 00 00 00 00 00 00 00 00 00 00 00 00 00 01
E: 0.599764 62 0a 07 64 54 34 f9 3a 76 03 fb 01 00 00 00 00 00 00 00 00 00 00 00 00 00 00 00 00 00 00 00 00 00 00 00 00 00 00 00 00 00 00 00 00 00 00 00 00 00 00 00 00 00 00 00 00 00 00 00 00 00 00 01
E: 0.600745 62 0a 07 64 77 33 03 3c 76 03 fb 01 00 00 00 00 00 00 00 00 00 00 00 00 00 00 00 00 00 00 00 00 00 00 00 00 00 00 00 00 00 00 00 00 00 00 00 00 00 00 00 00 00 00 00 00 00 00 00 00 00 00 01
E: 0.616764 62 0a 07 64 99 32 05 3d ce 02 19 02 00 00 00 00 00 00 00 00 00 00 00 00 00 00 00 00 00 00 00 00 00 00 00 00 00 00 00 00 00 00 00 00 00 00 00 00 00 00 00 00 00 00 00 00 00 00 00 00 00 00 01
E: 0.617745 62 0a 07 64 bb 31 08 3e ce 02 19 02 00 00 00 00 00 00 00 00 00 00 00 00 00 00 00 00 00 00 00 00 00 00 00 00 00 00 00 00 00 00 00 00 00 00 00 00 00 00 00 00 00 00 00 00 00 00 00 00 00 00 01
E: 0.632764 62 0a 07 64 ce 30 05 3f e1 03 15 02 00 00 00 00 00 00 00 00 00 00 00 00 00 00 00 00 00 00 00 00 00 00 00 00 00 00 00 00 00 00 00 00 00 00 00 00 00 00 00 00 00 00 00 00 00 00 00 00 00 00 01
E: 0.633747 62 0a 07 64 d2 2f 0c 40 e1 03 15 02 00 00 00 00 00 00 00 00 00 00 00 00 00 00 00 00 00 00 00 00 00 00 00 00 00 00 00 00 00 00 00 00 00 00 00 00 00 00 00 00 00 00 00 00 00 00 00 00 00 00 01
E: 0.649763 62 0a 07 64 de 2e 05 41 57 03 37 02 00 00 00 00 00 00 00 00 00 00 00 00 00 00 00 00 00 00 00 00 00 00 00 00 00 00 00 00 00 00 00 00 00 00 00 00 00 00 00 00 00 00 00 00 00 00 00 00 00 00 01
E: 0.650691 62 0a 07 64 f8 2d fb 41 57 03 37 02 00 00 00 00 00 00 00 00 00 00 00 00 00 00 00 00 00 00 00 00 00 00 00 00 00 00 00 00 00 00 00 00 00 00 00 00 00 00 00 00 00 00 00 00 00 00 00 00 00 00 01
E: 0.666765 62 0a 07 64 13 2d e7 42 3d 04 1e 02 00 00 00 00 00 00 00 00 00 00 00 00 00 00 00 00 00 00 00 00 00 00 00 00 00 00 00 00 00 00 00 00 00 00 00 00 00 00 00 00 00 00 00 00 00 00 00 00 00 00 01
E: 0.667625 62 0a 07 64 17 2c d4 43 3d 04 1e 02 00 00 00 00 00 00 00 00 00 00 00 00 00 00 00 00 00 00 00 00 00 00 00 00 00 00 00 00 00 00 00 00 00 00 00 00 00 00 00 00 00 00 00 00 00 00 00 00 00 00 01
E: 0.682760 62 0a 07 64 39 2b bc 44 bb 03 04 02 00 00 00 00 00 00 00 00 00 00 00 00 00 00 00 00 00 00 00 00 00 00 00 00 00 00 00 00 00 00 00 00 00 00 00 00 00 00 00 00 00 00 00 00 00 00 00 00 00 00 01
E: 0.683621 62 0a 07 64 6b 2a a5 45 bb 03 04 02 00 00 00 00 00 00 00 00 00 00 00 00 00 00 00 00 00 00 00 00 00 00 00 00 00 00 00 00 00 00 00 00 00 00 00 00 00 00 00 00 00 00 00 00 00 00 00 00 00 00 01
E: 0.699762 62 0a 07 64 9d 29 96 46 94 03 67 02 00 00 00 00 00 00 00 00 00 00 00 00 00 00 00 00 00 00 00 00 00 00 00 00 00 00 00 00 00 00 00 00 00 00 00 00 00 00 00 00 00 00 00 00 00 00 00 00 00 00 01
E: 0.700622 62 0a 07 64 bf 28 93 47 94 03 67 02 00 00 00 00 00 00 00 00 00 00 00 00 00 00 00 00 00 00 00 00 00 00 00 00 00 00 00 00 00 00 00 00 00 00 00 00 00 00 00 00 00 00 00 00 00 00 00 00 00 00 01
E: 0.716764 62 0a 07 64 e9 27 91 48 e9 03 33 02 00 00 00 00 00 00 00 00 00 00 00 00 00 00 00 00 00 00 00 00 00 00 00 00 00 00 00 00 00 00 00 00 00 00 00 00 00 00 00 00 00 00 00 00 00 00 00 00 00 00 01
E: 0.717624 62 0a 07 64 23 27 86 49 e9 03 33 02 00 00 00 00 00 00 00 00 00 00 00 00 00 00 00 00 00 00 00 00 00 00 00 00 00 00 00 00 00 00 00 00 00 00 00 00 00 00 00 00 00 00 00 00 00 00 00 00 00 00 01
E: 0.732766 62 0a 07 64 5c 26 7c 4a e1 03 2f 02 00 00 00 00 00 00 00 00 00 00 00 00 00 00 00 00 00 00 00 00 00 00 00 00 00 00 00 00 00 00 00 00 00 00 00 00 00 00 00 00 00 00 00 00 00 00 00 00 00 00 01
E: 0.733623 62 0a 07 64 9d 25 75 4b e1 03 2f 02 00 00 00 00 00 00 00 00 00 00 00 00 00 00 00 00 00 00 00 00 00 00 00 00 00 00 00 00 00 00 00 00 00 00 00 00 00 00 00 00 00 00 00 00 00 00 00 00 00 00 01
E: 0.749763 62 0a 07 64 d6 24 62 4c 85 03 37 02 00 00 00 00 00 00 00 00 00 00 00 00 00 00 00 00 00 00 00 00 00 00 00 00 00 00 00 00 00 00 00 00 00 00 00 00 00 00 00 00 00 00 00 00 00 00 00 00 00 00 01
E: 0.750746 62 0a 07 64 10 24 4a 4d 85 03 37 02 00 00 00 00 00 00 00 00 00 00 00 00 00 00 00 00 00 00 00 00 00 00 00 00 00 00 00 00 00 00 00 00 00 00 00 00 00 00 00 00 00 00 00 00 00 00 00 00 00 00 01
E: 0.766754 62 0a 07 64 50 23 2e 4e bb 03 19 02 00 00 00 00 00 00 00 00 00 00 00 00 00 00 00 00 00 00 00 00 00 00 00 00 00 00 00 00 00 00 00 00 00 00 00 00 00 00 00 00 00 00 00 00 00 00 00 00 00 00 01
E: 0.767621 62 0a 07 64 8a 22 1b 4f bb 03 19 02 00 00 00 00 00 00 00 00 00 00 00 00 00 00 00 00 00 00 00 00 00 00 00 00 00 00 00 00 00 00 00 00 00 00 00 00 00 00 00 00 00 00 00 00 00 00 00 00 00 00 01
E: 0.782759 62 0a 07 64 cb 21 ff 4f d2 03 49 02 00 00 00 00 00 00 00 00 00 00 00 00 00 00 00 00 00 00 00 00 00 00 00 00 00 00 00 00 00 00 00 00 00 00 00 00 00 00 00 00 00 00 00 00 00 00 00 00 00 00 01
E: 0.783619 62 0a 07 64 13 21 d6 50 d2 03 49 02 00 00 00 00 00 00 00 00 00 00 00 00 00 00 00 00 00 00 00 00 00 00 00 00 00 00 00 00 00 00 00 00 00 00 00 00 00 00 00 00 00 00 00 00 00 00 00 00 00 00 01
E: 0.799765 62 0a 07 64 5c 20 a9 51 f0 03 78 02 00 00 00 00 00 00 00 00 00 00 00 00 00 00 00 00 00 00 00 00 00 00 00 00 00 00 00 00 00 00 00 00 00 00 00 00 00 00 00 00 00 00 00 00 00 00 00 00 00 00 01
E: 0.800741 62 0a 07 64 bb 1f 80 52 f0 03 78 02 00 00 00 00 00 00 00 00 00 00 00 00 00 00 00 00 00 00 00 00 00 00 00 00 00 00 00 00 00 00 00 00 00 00 00 00 00 00 00 00 00 00 00 00 00 00 00 00 00 00 01
E: 0.816764 62 0a 07 64 04 1f 4e 53 2d 04 19 02 00 00 00 00 00 00 00 00 00 00 00 00 00 00 00 00 00 00 00 00 00 00 00 00 00 00 00 00 00 00 00 00 00 00 00 00 00 00 00 00 00 00 00 00 00 00 00 00 00 00 01
E: 0.817745 62 0a 07 64 36 1e 19 54 2d 04 19 02 00 00 00 00 00 00 00 00 00 00 00 00 00 00 00 00 00 00 00 00 00 00 00 00 00 00 00 00 00 00 00 00 00 00 00 00 00 00 00 00 00 00 00 00 00 00 00 00 00 00 01
E: 0.832753 62 0a 07 64 77 1d eb 54 d2 03 fb 01 00 00 00 00 00 00 00 00 00 00 00 00 00 00 00 00 00 00 00 00 00 00 00 00 00 00 00 00 00 00 00 00 00 00 00 00 00 00 00 00 00 00 00 00 00 00 00 00 00 00 01
E: 0.833624 62 0a 07 64 d6 1c c7 55 d2 03 fb 01 00 00 00 00 00 00 00 00 00 00 00 00 00 00 00 00 00 00 00 00 00 00 00 00 00 00 00 00 00 00 00 00 00 00 00 00 00 00 00 00 00 00 00 00 00 00 00 00 00 00 01
E: 0.849768 62 0a 07 64 36 1c 9e 56 16 04 40 02 00 00 00 00 00 00 00 00 00 00 00 00 00 00 00 00 00 00 00 00 00 00 00 00 00 00 00 00 00 00 00 00 00 00 00 00 00 00 00 00 00 00 00 00 00 00 00 00 00 00 01
E: 0.850622 62 0a 07 64 95 1b 71 57 16 04 40 02 00 00 00 00 00 00 00 00 00 00 00 00 00 00 00 00 00 00 00 00 00 00 00 00 00 00 00 00 00 00 00 00 00 00 00 00 00 00 00 00 00 00 00 00 00 00 00 00 00 00 01
E: 0.866765 62 0a 07 64 fc 1a 3f 58 d9 03 78 02 00 00 00 00 00 00 00 00 00 00 00 00 00 00 00 00 00 00 00 00 00 00 00 00 00 00 00 00 00 00 00 00 00 00 00 00 00 00 00 00 00 00 00 00 00 00 00 00 00 00 01
E: 0.867744 62 0a 07 64 5c 1a 12 59 d9 03 78 02 00 00 00 00 00 00 00 00 00 00 00 00 00 00 00 00 00 00 00 00 00 00 00 00 00 00 00 00 00 00 00 00 00 00 00 00 00 00 00 00 00 00 00 00 00 00 00 00 00 00 01
E: 0.882764 62 0a 07 64 d2 19 e9 59 ca 03 51 02 00 00 00 00 00 00 00 00 00 00 00 00 00 00 00 00 00 00 00 00 00 00 00 00 00 00 00 00 00 00 00 00 00 00 00 00 00 00 00 00 00 00 00 00 00 00 00 00 00 00 01
E: 0.883744 62 0a 07 64 49 19 c5 5a ca 03 51 02 00 00 00 00 00 00 00 00 00 00 00 00 00 00 00 00 00 00 00 00 00 00 00 00 00 00 00 00 00 00 00 00 00 00 00 00 00 00 00 00 00 00 00 00 00 00 00 00 00 00 01
E: 0.899752 62 0a 07 64 cf 18 98 5b 54 04 ff 01 00 00 00 00 00 00 00 00 00 00 00 00 00 00 00 00 00 00 00 00 00 00 00 00 00 00 00 00 00 00 00 00 00 00 00 00 00 00 00 00 00 00 00 00 00 00 00 00 00 00 01
E: 0.900622 62 0a 07 64 45 18 55 5c 54 04 ff 01 00 00 00 00 00 00 00 00 00 00 00 00 00 00 00 00 00 00 00 00 00 00 00 00 00 00 00 00 00 00 00 00 00 00 00 00 00 00 00 00 00 00 00 00 00 00 00 00 00 00 01
E: 0.916761 62 0a 07 64 cb 17 16 5d d2 03 51 02 00 00 00 00 00 00 00 00 00 00 00 00 00 00 00 00 00 00 00 00 00 00 00 00 00 00 00 00 00 00 00 00 00 00 00 00 00 00 00 00 00 00 00 00 00 00 00 00 00 00 01
E: 0.917622 62 0a 07 64 51 17 e5 5d d2 03 51 02 00 00 00 00 00 00 00 00 00 00 00 00 00 00 00 00 00 00 00 00 00 00 00 00 00 00 00 00 00 00 00 00 00 00 00 00 00 00 00 00 00 00 00 00 00 00 00 00 00 00 01
E: 0.932765 62 0a 07 64 cf 16 bc 5e 16 04 56 02 00 00 00 00 00 00 00 00 00 00 00 00 00 00 00 00 00 00 00 00 00 00 00 00 00 00 00 00 00 00 00 00 00 00 00 00 00 00 00 00 00 00 00 00 00 00 00 00 00 00 01
E: 0.933621 62 0a 07 64 4d 16 97 5f 16 04 56 02 00 00 00 00 00 00 00 00 00 00 00 00 00 00 00 00 00 00 00 00 00 00 00 00 00 00 00 00 00 00 00 00 00 00 00 00 00 00 00 00 00 00 00 00 00 00 00 00 00 00 01
E: 0.949764 62 0a 07 64 cb 15 80 60 3d 04 44 02 00 00 00 00 00 00 00 00 00 00 00 00 00 00 00 00 00 00 00 00 00 00 00 00 00 00 00 00 00 00 00 00 00 00 00 00 00 00 00 00 00 00 00 00 00 00 00 00 00 00 01
E: 0.950744 62 0a 07 64 51 15 6c 61 3d 04 44 02 00 00 00 00 00 00 00 00 00 00 00 00 00 00 00 00 00 00 00 00 00 00 00 00 00 00 00 00 00 00 00 00 00 00 00 00 00 00 00 00 00 00 00 00 00 00 00 00 00 00 01
E: 0.965761 62 0a 07 64 cf 14 62 62 af 04 2f 02 00 00 00 00 00 00 00 00 00 00 00 00 00 00 00 00 00 00 00 00 00 00 00 00 00 00 00 00 00 00 00 00 00 00 00 00 00 00 00 00 00 00 00 00 00 00 00 00 00 00 01
E: 0.966622 62 0a 07 64 45 14 60 63 af 04 2f 02 00 00 00 00 00 00 00 00 00 00 00 00 00 00 00 00 00 00 00 00 00 00 00 00 00 00 00 00 00 00 00 00 00 00 00 00 00 00 00 00 00 00 00 00 00 00 00 00 00 00 01
E: 0.982761 62 0a 07 64 c3 13 5d 64 af 04 5a 02 00 00 00 00 00 00 00 00 00 00 00 00 00 00 00 00 00 00 00 00 00 00 00 00 00 00 00 00 00 00 00 00 00 00 00 00 00 00 00 00 00 00 00 00 00 00 00 00 00 00 01
E: 0.983620 62 0a 07 64 49 13 60 65 af 04 5a 02 00 00 00 00 00 00 00 00 00 00 00 00 00 00 00 00 00 00 00 00 00 00 00 00 00 00 00 00 00 00 00 00 00 00 00 00 00 00 00 00 00 00 00 00 00 00 00 00 00 00 01
E: 0.999759 62 0a 07 64 de 12 5d 66 3d 04 49 02 00 00 00 00 00 00 00 00 00 00 00 00 00 00 00 00 00 00 00 00 00 00 00 00 00 00 00 00 00 00 00 00 00 00 00 00 00 00 00 00 00 00 00 00 00 00 00 00 00 00 01
E: 1.000620 62 0a 07 64 7b 12 53 67 3d 04 49 02 00 00 00 00 00 00 00 00 00 00 00 00 00 00 00 00 00 00 00 00 00 00 00 00 00 00 00 00 00 00 00 00 00 00 00 00 00 00 00 00 00 00 00 00 00 00 00 00 00 00 01
E: 1.016763 62 0a 07 64 17 12 3b 68 0f 04 44 02 00 00 00 00 00 00 00 00 00 00 00 00 00 00 00 00 00 00 00 00 00 00 00 00 00 00 00 00 00 00 00 00 00 00 00 00 00 00 00 00 00 00 00 00 00 00 00 00 00 00 01
E: 1.017741 62 0a 07 64 bc 11 16 69 0f 04 44 02 00 00 00 00 00 00 00 00 00 00 00 00 00 00 00 00 00 00 00 00 00 00 00 00 00 00 00 00 00 00 00 00 00 00 00 00 00 00 00 00 00 00 00 00 00 00 00 00 00 00 01
E: 1.032763 62 0a 07 64 58 11 e1 69 3d 04 62 02 00 00 00 00 00 00 00 00 00 00 00 00 00 00 00 00 00 00 00 00 00 00 00 00 00 00 00 00 00 00 00 00 00 00 00 00 00 00 00 00 00 00 00 00 00 00 00 00 00 00 01
E: 1.033745 62 0a 07 64 ed 10 9a 6a 3d 04 62 02 00 00 00 00 00 00 00 00 00 00 00 00 00 00 00 00 00 00 00 00 00 00 00 00 00 00 00 00 00 00 00 00 00 00 00 00 00 00 00 00 00 00 00 00 00 00 00 00 00 00 01
E: 1.049760 62 0a 07 64 92 10 41 6b 0f 04 62 02 00 00 00 00 00 00 00 00 00 00 00 00 00 00 00 00 00 00 00 00 00 00 00 00 00 00 00 00 00 00 00 00 00 00 00 00 00 00 00 00 00 00 00 00 00 00 00 00 00 00 01
E: 1.050621 62 0a 07 64 36 10 d8 6b 0f 04 62 02 00 00 00 00 00 00 00 00 00 00 00 00 00 00 00 00 00 00 00 00 00 00 00 00 00 00 00 00 00 00 00 00 00 00 00 00 00 00 00 00 00 00 00 00 00 00 00 00 00 00 01
E: 1.065758 62 0a 07 64 e2 0f 62 6c 0f 04 62 02 00 00 00 00 00 00 00 00 00 00 00 00 00 00 00 00 00 00 00 00 00 00 00 00 00 00 00 00 00 00 00 00 00 00 00 00 00 00 00 00 00 00 00 00 00 00 00 00 00 00 01
E: 1.082764 62 0a 07 64 41 0f 5f 6d 16 04 ce 02 00 00 00 00 00 00 00 00 00 00 00 00 00 00 00 00 00 00 00 00 00 00 00 00 00 00 00 00 00 00 00 00 00 00 00 00 00 00 00 00 00 00 00 00 00 00 00 00 00 00 01
E: 1.099764 62 0a 07 64 a1 0e 5d 6e 54 04 a3 02 00 00 00 00 00 00 00 00 00 00 00 00 00 00 00 00 00 00 00 00 00 00 00 00 00 00 00 00 00 00 00 00 00 00 00 00 00 00 00 00 00 00 00 00 00 00 00 00 00 00 01
E: 1.100621 62 0a 07 64 45 0e e3 6e 54 04 a3 02 00 00 00 00 00 00 00 00 00 00 00 00 00 00 00 00 00 00 00 00 00 00 00 00 00 00 00 00 00 00 00 00 00 00 00 00 00 00 00 00 00 00 00 00 00 00 00 00 00 00 01
E: 1.115763 62 0a 07 64 e9 0d 71 6f 26 04 9f 02 00 00 00 00 00 00 00 00 00 00 00 00 00 00 00 00 00 00 00 00 00 00 00 00 00 00 00 00 00 00 00 00 00 00 00 00 00 00 00 00 00 00 00 00 00 00 00 00 00 00 01
E: 1.116621 62 0a 07 64 86 0d 03 70 26 04 9f 02 00 00 00 00 00 00 00 00 00 00 00 00 00 00 00 00 00 00 00 00 00 00 00 00 00 00 00 00 00 00 00 00 00 00 00 00 00 00 00 00 00 00 00 00 00 00 00 00 00 00 01
E: 1.132759 62 0a 07 64 2a 0d 91 70 54 04 9a 02 00 00 00 00 00 00 00 00 00 00 00 00 00 00 00 00 00 00 00 00 00 00 00 00 00 00 00 00 00 00 00 00 00 00 00 00 00 00 00 00 00 00 00 00 00 00 00 00 00 00 01
E: 1.133620 62 0a 07 64 c7 0c 1b 71 54 04 9a 02 00 00 00 00 00 00 00 00 00 00 00 00 00 00 00 00 00 00 00 00 00 00 00 00 00 00 00 00 00 00 00 00 00 00 00 00 00 00 00 00 00 00 00 00 00 00 00 00 00 00 01
E: 1.149757 62 0a 07 64 73 0c 9c 71 2d 04 67 02 00 00 00 00 00 00 00 00 00 00 00 00 00 00 00 00 00 00 00 00 00 00 00 00 00 00 00 00 00 00 00 00 00 00 00 00 00 00 00 00 00 00 00 00 00 00 00 00 00 00 01
E: 1.165767 62 0a 07 64 d3 0b 84 72 ff 03 26 02 00 00 00 00 00 00 00 00 00 00 00 00 00 00 00 00 00 00 00 00 00 00 00 00 00 00 00 00 00 00 00 00 00 00 00 00 00 00 00 00 00 00 00 00 00 00 00 00 00 00 01
E: 1.182753 62 0a 07 64 58 0b 4a 73 0f 04 49 02 00 00 00 00 00 00 00 00 00 00 00 00 00 00 00 00 00 00 00 00 00 00 00 00 00 00 00 00 00 00 00 00 00 00 00 00 00 00 00 00 00 00 00 00 00 00 00 00 00 00 01
E: 1.199761 62 0a 07 64 d6 0a 21 74 89 04 56 02 00 00 00 00 00 00 00 00 00 00 00 00 00 00 00 00 00 00 00 00 00 00 00 00 00 00 00 00 00 00 00 00 00 00 00 00 00 00 00 00 00 00 00 00 00 00 00 00 00 00 01
E: 1.215763 62 0a 07 64 4d 0a 0e 75 07 04 3c 02 00 00 00 00 00 00 00 00 00 00 00 00 00 00 00 00 00 00 00 00 00 00 00 00 00 00 00 00 00 00 00 00 00 00 00 00 00 00 00 00 00 00 00 00 00 00 00 00 00 00 01
E: 1.232765 62 0a 07 64 e2 09 d4 75 f0 03 56 02 00 00 00 00 00 00 00 00 00 00 00 00 00 00 00 00 00 00 00 00 00 00 00 00 00 00 00 00 00 00 00 00 00 00 00 00 00 00 00 00 00 00 00 00 00 00 00 00 00 00 01
E: 1.249750 62 0a 07 64 95 09 77 76 d9 03 26 02 00 00 00 00 00 00 00 00 00 00 00 00 00 00 00 00 00 00 00 00 00 00 00 00 00 00 00 00 00 00 00 00 00 00 00 00 00 00 00 00 00 00 00 00 00 00 00 00 00 00 01
E: 1.265777 62 0a 07 64 58 09 f8 76 57 03 74 02 00 00 00 00 00 00 00 00 00 00 00 00 00 00 00 00 00 00 00 00 00 00 00 00 00 00 00 00 00 00 00 00 00 00 00 00 00 00 00 00 00 00 00 00 00 00 00 00 00 00 01
E: 1.282748 62 0a 07 64 3a 09 39 77 e9 03 9a 02 00 00 00 00 00 00 00 00 00 00 00 00 00 00 00 00 00 00 00 00 00 00 00 00 00 00 00 00 00 00 00 00 00 00 00 00 00 00 00 00 00 00 00 00 00 00 00 00 00 00 01
E: 1.299731 62 0a 07 64 fd 08 a9 77 44 04 4d 02 00 00 00 00 00 00 00 00 00 00 00 00 00 00 00 00 00 00 00 00 00 00 00 00 00 00 00 00 00 00 00 00 00 00 00 00 00 00 00 00 00 00 00 00 00 00 00 00 00 00 01
E: 1.315750 62 0a 07 64 c7 08 0b 78 d9 03 15 02 00 00 00 00 00 00 00 00 00 00 00 00 00 00 00 00 00 00 00 00 00 00 00 00 00 00 00 00 00 00 00 00 00 00 00 00 00 00 00 00 00 00 00 00 00 00 00 00 00 00 01
E: 1.316622 62 0a 07 64 7b 08 91 78 d9 03 15 02 00 00 00 00 00 00 00 00 00 00 00 00 00 00 00 00 00 00 00 00 00 00 00 00 00 00 00 00 00 00 00 00 00 00 00 00 00 00 00 00 00 00 00 00 00 00 00 00 00 00 01
E: 1.332766 62 0a 07 64 00 08 39 79 b7 04 89 02 00 00 00 00 00 00 00 00 00 00 00 00 00 00 00 00 00 00 00 00 00 00 00 00 00 00 00 00 00 00 00 00 00 00 00 00 00 00 00 00 00 00 00 00 00 00 00 00 00 00 01
E: 1.333741 62 0a 07 64 58 07 fa 79 b7 04 89 02 00 00 00 00 00 00 00 00 00 00 00 00 00 00 00 00 00 00 00 00 00 00 00 00 00 00 00 00 00 00 00 00 00 00 00 00 00 00 00 00 00 00 00 00 00 00 00 00 00 00 01
E: 1.348751 62 0a 04 64 7b 06 d6 7a b7 04 89 02 00 00 00 00 00 00 00 00 00 00 00 00 00 00 00 00 00 00 00 00 00 00 00 00 00 00 00 00 00 00 00 00 00 00 00 00 00 00 00 00 00 00 00 00 00 00 00 00 00 00 01
# 2. Land one finger,
   - land a second finger far enough from the first
   - move your two fingers
   - release the *first* finger
   - release the second finger
E: 14.631924 62 0a 07 65 7b 10 22 2a 7a 04 11 02 00 00 00 00 00 00 00 00 00 00 00 00 00 00 00 00 00 00 00 00 00 00 00 00 00 00 00 00 00 00 00 00 00 00 00 00 00 00 00 00 00 00 00 00 00 00 00 00 00 00 01
E: 14.648685 62 0a 07 65 7b 10 22 2a 13 05 22 02 00 00 00 00 00 00 00 00 00 00 00 00 00 00 00 00 00 00 00 00 00 00 00 00 00 00 00 00 00 00 00 00 00 00 00 00 00 00 00 00 00 00 00 00 00 00 00 00 00 00 01
E: 14.664661 62 0a 07 65 7b 10 22 2a af 04 22 02 00 00 00 00 00 00 00 00 00 00 00 00 00 00 00 00 00 00 00 00 00 00 00 00 00 00 00 00 00 00 00 00 00 00 00 00 00 00 00 00 00 00 00 00 00 00 00 00 00 00 01
E: 14.681657 62 0a 07 65 7b 10 22 2a b7 04 1e 02 00 00 00 00 00 00 00 00 00 00 00 00 00 00 00 00 00 00 00 00 00 00 00 00 00 00 00 00 00 00 00 00 00 00 00 00 00 00 00 00 00 00 00 00 00 00 00 00 00 00 01
E: 14.698657 62 0a 07 65 7b 10 22 2a d5 04 1e 02 00 00 00 00 00 00 00 00 00 00 00 00 00 00 00 00 00 00 00 00 00 00 00 00 00 00 00 00 00 00 00 00 00 00 00 00 00 00 00 00 00 00 00 00 00 00 00 00 00 00 01
E: 14.714657 62 0a 07 65 7b 10 22 2a e5 04 15 02 00 00 00 00 00 00 00 00 00 00 00 00 00 00 00 00 00 00 00 00 00 00 00 00 00 00 00 00 00 00 00 00 00 00 00 00 00 00 00 00 00 00 00 00 00 00 00 00 00 00 01
E: 14.731658 62 0a 07 65 7b 10 22 2a ec 04 ea 01 00 00 00 00 00 00 00 00 00 00 00 00 00 00 00 00 00 00 00 00 00 00 00 00 00 00 00 00 00 00 00 00 00 00 00 00 00 00 00 00 00 00 00 00 00 00 00 00 00 00 01
E: 14.748658 62 0a 07 65 7b 10 22 2a dd 04 ea 01 00 00 00 00 00 00 00 00 00 00 00 00 00 00 00 00 00 00 00 00 00 00 00 00 00 00 00 00 00 00 00 00 00 00 00 00 00 00 00 00 00 00 00 00 00 00 00 00 00 00 01
E: 14.764655 62 0a 07 65 7b 10 22 2a d5 04 ea 01 00 00 00 00 00 00 00 00 00 00 00 00 00 00 00 00 00 00 00 00 00 00 00 00 00 00 00 00 00 00 00 00 00 00 00 00 00 00 00 00 00 00 00 00 00 00 00 00 00 00 01
E: 14.781654 62 0a 07 65 7b 10 22 2a d5 04 ea 01 00 00 00 00 00 00 00 00 00 00 00 00 00 00 00 00 00 00 00 00 00 00 00 00 00 00 00 00 00 00 00 00 00 00 00 00 00 00 00 00 00 00 00 00 00 00 00 00 00 00 01
E: 14.798658 62 0a 07 65 7b 10 22 2a d5 04 ee 01 00 00 00 00 00 00 00 00 00 00 00 00 00 00 00 00 00 00 00 00 00 00 00 00 00 00 00 00 00 00 00 00 00 00 00 00 00 00 00 00 00 00 00 00 00 00 00 00 00 00 01
E: 14.814651 62 0a 07 65 7b 10 22 2a d5 04 ee 01 00 00 00 00 00 00 00 00 00 00 00 00 00 00 00 00 00 00 00 00 00 00 00 00 00 00 00 00 00 00 00 00 00 00 00 00 00 00 00 00 00 00 00 00 00 00 00 00 00 00 01
E: 14.831655 62 0a 07 65 7b 10 22 2a ce 04 1e 02 00 00 00 00 00 00 00 00 00 00 00 00 00 00 00 00 00 00 00 00 00 00 00 00 00 00 00 00 00 00 00 00 00 00 00 00 00 00 00 00 00 00 00 00 00 00 00 00 00 00 01
E: 14.848657 62 0a 07 65 7b 10 22 2a e5 04 ee 01 00 00 00 00 00 00 00 00 00 00 00 00 00 00 00 00 00 00 00 00 00 00 00 00 00 00 00 00 00 00 00 00 00 00 00 00 00 00 00 00 00 00 00 00 00 00 00 00 00 00 01
E: 14.864655 62 0a 07 65 7b 10 22 2a ce 04 ee 01 00 00 00 00 00 00 00 00 00 00 00 00 00 00 00 00 00 00 00 00 00 00 00 00 00 00 00 00 00 00 00 00 00 00 00 00 00 00 00 00 00 00 00 00 00 00 00 00 00 00 01
E: 14.881657 62 0a 07 65 7b 10 22 2a ce 04 1e 02 00 00 00 00 00 00 00 00 00 00 00 00 00 00 00 00 00 00 00 00 00 00 00 00 00 00 00 00 00 00 00 00 00 00 00 00 00 00 00 00 00 00 00 00 00 00 00 00 00 00 01
E: 14.898655 62 0a 07 65 7b 10 22 2a c6 04 11 02 00 00 00 00 00 00 00 00 00 00 00 00 00 00 00 00 00 00 00 00 00 00 00 00 00 00 00 00 00 00 00 00 00 00 00 00 00 00 00 00 00 00 00 00 00 00 00 00 00 00 01
E: 14.914656 62 0a 07 65 7b 10 22 2a c6 04 22 02 00 00 00 00 00 00 00 00 00 00 00 00 00 00 00 00 00 00 00 00 00 00 00 00 00 00 00 00 00 00 00 00 00 00 00 00 00 00 00 00 00 00 00 00 00 00 00 00 00 00 01
E: 14.931631 62 0a 07 65 7b 10 22 2a d5 04 22 02 00 00 00 00 00 00 00 00 00 00 00 00 00 00 00 00 00 00 00 00 00 00 00 00 00 00 00 00 00 00 00 00 00 00 00 00 00 00 00 00 00 00 00 00 00 00 00 00 00 00 01
E: 14.948655 62 0a 07 65 7b 10 22 2a dd 04 22 02 00 00 00 00 00 00 00 00 00 00 00 00 00 00 00 00 00 00 00 00 00 00 00 00 00 00 00 00 00 00 00 00 00 00 00 00 00 00 00 00 00 00 00 00 00 00 00 00 00 00 01
E: 14.964655 62 0a 07 65 7b 10 22 2a bf 04 1e 02 00 00 00 00 00 00 00 00 00 00 00 00 00 00 00 00 00 00 00 00 00 00 00 00 00 00 00 00 00 00 00 00 00 00 00 00 00 00 00 00 00 00 00 00 00 00 00 00 00 00 01
E: 14.981654 62 0a 07 65 7b 10 22 2a ec 04 1e 02 00 00 00 00 00 00 00 00 00 00 00 00 00 00 00 00 00 00 00 00 00 00 00 00 00 00 00 00 00 00 00 00 00 00 00 00 00 00 00 00 00 00 00 00 00 00 00 00 00 00 01
E: 14.998654 62 0a 07 65 7b 10 22 2a dd 04 1e 02 00 00 00 00 00 00 00 00 00 00 00 00 00 00 00 00 00 00 00 00 00 00 00 00 00 00 00 00 00 00 00 00 00 00 00 00 00 00 00 00 00 00 00 00 00 00 00 00 00 00 01
E: 15.014655 62 0a 07 65 7b 10 22 2a f4 04 1e 02 00 00 00 00 00 00 00 00 00 00 00 00 00 00 00 00 00 00 00 00 00 00 00 00 00 00 00 00 00 00 00 00 00 00 00 00 00 00 00 00 00 00 00 00 00 00 00 00 00 00 01
E: 15.031654 62 0a 07 65 7b 10 22 2a fc 04 1e 02 00 00 00 00 00 00 00 00 00 00 00 00 00 00 00 00 00 00 00 00 00 00 00 00 00 00 00 00 00 00 00 00 00 00 00 00 00 00 00 00 00 00 00 00 00 00 00 00 00 00 01
E: 15.048654 62 0a 07 65 7b 10 22 2a d5 04 1e 02 00 00 00 00 00 00 00 00 00 00 00 00 00 00 00 00 00 00 00 00 00 00 00 00 00 00 00 00 00 00 00 00 00 00 00 00 00 00 00 00 00 00 00 00 00 00 00 00 00 00 01
E: 15.064658 62 0a 07 65 7b 10 22 2a 13 05 1e 02 00 00 00 00 00 00 00 00 00 00 00 00 00 00 00 00 00 00 00 00 00 00 00 00 00 00 00 00 00 00 00 00 00 00 00 00 00 00 00 00 00 00 00 00 00 00 00 00 00 00 01
E: 15.081654 62 0a 07 65 a1 10 22 2a 1a 05 19 02 00 00 00 00 00 00 00 00 00 00 00 00 00 00 00 00 00 00 00 00 00 00 00 00 00 00 00 00 00 00 00 00 00 00 00 00 00 00 00 00 00 00 00 00 00 00 00 00 00 00 01
E: 15.098654 62 0a 07 65 32 11 22 2a 1a 05 1e 02 00 00 00 00 00 00 00 00 00 00 00 00 00 00 00 00 00 00 00 00 00 00 00 00 00 00 00 00 00 00 00 00 00 00 00 00 00 00 00 00 00 00 00 00 00 00 00 00 00 00 01
E: 15.114654 62 0a 07 65 6f 11 22 2a 1a 05 1e 02 00 00 00 00 00 00 00 00 00 00 00 00 00 00 00 00 00 00 00 00 00 00 00 00 00 00 00 00 00 00 00 00 00 00 00 00 00 00 00 00 00 00 00 00 00 00 00 00 00 00 01
E: 15.131674 62 0a 07 65 77 11 22 2a fc 04 19 02 00 00 00 00 00 00 00 00 00 00 00 00 00 00 00 00 00 00 00 00 00 00 00 00 00 00 00 00 00 00 00 00 00 00 00 00 00 00 00 00 00 00 00 00 00 00 00 00 00 00 01
E: 15.148655 62 0a 07 65 6f 11 22 2a e5 04 1e 02 00 00 00 00 00 00 00 00 00 00 00 00 00 00 00 00 00 00 00 00 00 00 00 00 00 00 00 00 00 00 00 00 00 00 00 00 00 00 00 00 00 00 00 00 00 00 00 00 00 00 01
E: 15.164654 62 0a 07 65 6f 11 22 2a fc 04 19 02 00 00 00 00 00 00 00 00 00 00 00 00 00 00 00 00 00 00 00 00 00 00 00 00 00 00 00 00 00 00 00 00 00 00 00 00 00 00 00 00 00 00 00 00 00 00 00 00 00 00 01
E: 15.181653 62 0a 07 65 6f 11 22 2a ec 04 1e 02 00 00 00 00 00 00 00 00 00 00 00 00 00 00 00 00 00 00 00 00 00 00 00 00 00 00 00 00 00 00 00 00 00 00 00 00 00 00 00 00 00 00 00 00 00 00 00 00 00 00 01
E: 15.198654 62 0a 07 65 6f 11 22 2a d5 04 22 02 00 00 00 00 00 00 00 00 00 00 00 00 00 00 00 00 00 00 00 00 00 00 00 00 00 00 00 00 00 00 00 00 00 00 00 00 00 00 00 00 00 00 00 00 00 00 00 00 00 00 01
E: 15.214653 62 0a 07 65 6f 11 22 2a ec 04 1e 02 00 00 00 00 00 00 00 00 00 00 00 00 00 00 00 00 00 00 00 00 00 00 00 00 00 00 00 00 00 00 00 00 00 00 00 00 00 00 00 00 00 00 00 00 00 00 00 00 00 00 01
E: 15.231654 62 0a 07 65 6f 11 22 2a d5 04 22 02 00 00 00 00 00 00 00 00 00 00 00 00 00 00 00 00 00 00 00 00 00 00 00 00 00 00 00 00 00 00 00 00 00 00 00 00 00 00 00 00 00 00 00 00 00 00 00 00 00 00 01
E: 15.248652 62 0a 07 65 6f 11 22 2a dd 04 1e 02 00 00 00 00 00 00 00 00 00 00 00 00 00 00 00 00 00 00 00 00 00 00 00 00 00 00 00 00 00 00 00 00 00 00 00 00 00 00 00 00 00 00 00 00 00 00 00 00 00 00 01
E: 15.264654 62 0a 07 65 6f 11 22 2a d5 04 1e 02 00 00 00 00 00 00 00 00 00 00 00 00 00 00 00 00 00 00 00 00 00 00 00 00 00 00 00 00 00 00 00 00 00 00 00 00 00 00 00 00 00 00 00 00 00 00 00 00 00 00 01
E: 15.281652 62 0a 07 65 6f 11 22 2a d5 04 19 02 00 00 00 00 00 00 00 00 00 00 00 00 00 00 00 00 00 00 00 00 00 00 00 00 00 00 00 00 00 00 00 00 00 00 00 00 00 00 00 00 00 00 00 00 00 00 00 00 00 00 01
E: 15.298648 62 0a 07 65 6f 11 22 2a d5 04 19 02 00 00 00 00 00 00 00 00 00 00 00 00 00 00 00 00 00 00 00 00 00 00 00 00 00 00 00 00 00 00 00 00 00 00 00 00 00 00 00 00 00 00 00 00 00 00 00 00 00 00 01
E: 15.314652 62 0a 07 65 6f 11 22 2a b7 04 19 02 00 00 00 00 00 00 00 00 00 00 00 00 00 00 00 00 00 00 00 00 00 00 00 00 00 00 00 00 00 00 00 00 00 00 00 00 00 00 00 00 00 00 00 00 00 00 00 00 00 00 01
E: 15.331650 62 0a 07 65 6f 11 22 2a e5 04 1e 02 00 00 00 00 00 00 00 00 00 00 00 00 00 00 00 00 00 00 00 00 00 00 00 00 00 00 00 00 00 00 00 00 00 00 00 00 00 00 00 00 00 00 00 00 00 00 00 00 00 00 01
E: 15.348653 62 0a 07 65 6f 11 22 2a ce 04 22 02 00 00 00 00 00 00 00 00 00 00 00 00 00 00 00 00 00 00 00 00 00 00 00 00 00 00 00 00 00 00 00 00 00 00 00 00 00 00 00 00 00 00 00 00 00 00 00 00 00 00 01
E: 15.364652 62 0a 07 65 6f 11 22 2a dd 04 22 02 00 00 00 00 00 00 00 00 00 00 00 00 00 00 00 00 00 00 00 00 00 00 00 00 00 00 00 00 00 00 00 00 00 00 00 00 00 00 00 00 00 00 00 00 00 00 00 00 00 00 01
E: 15.381652 62 0a 07 65 6f 11 22 2a d5 04 22 02 00 00 00 00 00 00 00 00 00 00 00 00 00 00 00 00 00 00 00 00 00 00 00 00 00 00 00 00 00 00 00 00 00 00 00 00 00 00 00 00 00 00 00 00 00 00 00 00 00 00 01
E: 15.398653 62 0a 07 65 6f 11 22 2a dd 04 1e 02 00 00 00 00 00 00 00 00 00 00 00 00 00 00 00 00 00 00 00 00 00 00 00 00 00 00 00 00 00 00 00 00 00 00 00 00 00 00 00 00 00 00 00 00 00 00 00 00 00 00 01
E: 15.414648 62 0a 07 65 6f 11 22 2a dd 04 1e 02 00 00 00 00 00 00 00 00 00 00 00 00 00 00 00 00 00 00 00 00 00 00 00 00 00 00 00 00 00 00 00 00 00 00 00 00 00 00 00 00 00 00 00 00 00 00 00 00 00 00 01
E: 15.431650 62 0a 07 65 6f 11 22 2a e5 04 22 02 00 00 00 00 00 00 00 00 00 00 00 00 00 00 00 00 00 00 00 00 00 00 00 00 00 00 00 00 00 00 00 00 00 00 00 00 00 00 00 00 00 00 00 00 00 00 00 00 00 00 01
E: 15.448652 62 0a 07 65 6f 11 22 2a d5 04 26 02 00 00 00 00 00 00 00 00 00 00 00 00 00 00 00 00 00 00 00 00 00 00 00 00 00 00 00 00 00 00 00 00 00 00 00 00 00 00 00 00 00 00 00 00 00 00 00 00 00 00 01
E: 15.464651 62 0a 07 65 6f 11 22 2a 03 05 49 02 00 00 00 00 00 00 00 00 00 00 00 00 00 00 00 00 00 00 00 00 00 00 00 00 00 00 00 00 00 00 00 00 00 00 00 00 00 00 00 00 00 00 00 00 00 00 00 00 00 00 01
E: 15.481652 62 0a 07 65 6f 11 22 2a c6 04 4d 02 00 00 00 00 00 00 00 00 00 00 00 00 00 00 00 00 00 00 00 00 00 00 00 00 00 00 00 00 00 00 00 00 00 00 00 00 00 00 00 00 00 00 00 00 00 00 00 00 00 00 01
E: 15.498651 62 0a 07 65 6f 11 22 2a e5 04 4d 02 00 00 00 00 00 00 00 00 00 00 00 00 00 00 00 00 00 00 00 00 00 00 00 00 00 00 00 00 00 00 00 00 00 00 00 00 00 00 00 00 00 00 00 00 00 00 00 00 00 00 01
E: 15.514652 62 0a 07 65 6f 11 22 2a f4 04 51 02 00 00 00 00 00 00 00 00 00 00 00 00 00 00 00 00 00 00 00 00 00 00 00 00 00 00 00 00 00 00 00 00 00 00 00 00 00 00 00 00 00 00 00 00 00 00 00 00 00 00 01
E: 15.531648 62 0a 07 65 6f 11 22 2a ec 04 51 02 00 00 00 00 00 00 00 00 00 00 00 00 00 00 00 00 00 00 00 00 00 00 00 00 00 00 00 00 00 00 00 00 00 00 00 00 00 00 00 00 00 00 00 00 00 00 00 00 00 00 01
E: 15.548651 62 0a 07 65 6f 11 22 2a e5 04 51 02 00 00 00 00 00 00 00 00 00 00 00 00 00 00 00 00 00 00 00 00 00 00 00 00 00 00 00 00 00 00 00 00 00 00 00 00 00 00 00 00 00 00 00 00 00 00 00 00 00 00 01
E: 15.564650 62 0a 07 65 6f 11 22 2a 03 05 4d 02 00 00 00 00 00 00 00 00 00 00 00 00 00 00 00 00 00 00 00 00 00 00 00 00 00 00 00 00 00 00 00 00 00 00 00 00 00 00 00 00 00 00 00 00 00 00 00 00 00 00 01
E: 15.581651 62 0a 07 65 6f 11 22 2a e5 04 51 02 00 00 00 00 00 00 00 00 00 00 00 00 00 00 00 00 00 00 00 00 00 00 00 00 00 00 00 00 00 00 00 00 00 00 00 00 00 00 00 00 00 00 00 00 00 00 00 00 00 00 01
E: 15.598649 62 0a 07 65 6f 11 22 2a ce 04 4d 02 00 00 00 00 00 00 00 00 00 00 00 00 00 00 00 00 00 00 00 00 00 00 00 00 00 00 00 00 00 00 00 00 00 00 00 00 00 00 00 00 00 00 00 00 00 00 00 00 00 00 01
E: 15.614649 62 0a 07 65 6f 11 22 2a 03 05 51 02 00 00 00 00 00 00 00 00 00 00 00 00 00 00 00 00 00 00 00 00 00 00 00 00 00 00 00 00 00 00 00 00 00 00 00 00 00 00 00 00 00 00 00 00 00 00 00 00 00 00 01
E: 15.631650 62 0a 07 65 6f 11 22 2a ce 04 4d 02 00 00 00 00 00 00 00 00 00 00 00 00 00 00 00 00 00 00 00 00 00 00 00 00 00 00 00 00 00 00 00 00 00 00 00 00 00 00 00 00 00 00 00 00 00 00 00 00 00 00 01
E: 15.648654 62 0a 07 65 6f 11 22 2a 0b 05 49 02 00 00 00 00 00 00 00 00 00 00 00 00 00 00 00 00 00 00 00 00 00 00 00 00 00 00 00 00 00 00 00 00 00 00 00 00 00 00 00 00 00 00 00 00 00 00 00 00 00 00 01
E: 15.665650 62 0a 07 65 6f 11 22 2a 1a 05 4d 02 00 00 00 00 00 00 00 00 00 00 00 00 00 00 00 00 00 00 00 00 00 00 00 00 00 00 00 00 00 00 00 00 00 00 00 00 00 00 00 00 00 00 00 00 00 00 00 00 00 00 02
E: 15.681645 62 0a 07 65 6f 11 22 2a 22 05 44 02 07 66 e6 10 39 45 67 03 4d 02 00 00 00 00 00 00 00 00 00 00 00 00 00 00 00 00 00 00 00 00 00 00 00 00 00 00 00 00 00 00 00 00 00 00 00 00 00 00 00 00 02
E: 15.698650 62 0a 07 65 6f 11 22 2a 03 05 49 02 07 66 e6 10 39 45 81 04 5a 02 00 00 00 00 00 00 00 00 00 00 00 00 00 00 00 00 00 00 00 00 00 00 00 00 00 00 00 00 00 00 00 00 00 00 00 00 00 00 00 00 02
E: 15.716643 62 0a 07 65 6f 11 22 2a ab 05 4d 02 07 66 e6 10 39 45 a0 04 51 02 00 00 00 00 00 00 00 00 00 00 00 00 00 00 00 00 00 00 00 00 00 00 00 00 00 00 00 00 00 00 00 00 00 00 00 00 00 00 00 00 02
E: 15.731638 62 0a 07 65 6f 11 22 2a a4 05 44 02 07 66 e6 10 39 45 91 04 51 02 00 00 00 00 00 00 00 00 00 00 00 00 00 00 00 00 00 00 00 00 00 00 00 00 00 00 00 00 00 00 00 00 00 00 00 00 00 00 00 00 02
E: 15.748642 62 0a 07 65 6f 11 22 2a 9c 05 49 02 07 66 e6 10 39 45 af 04 4d 02 00 00 00 00 00 00 00 00 00 00 00 00 00 00 00 00 00 00 00 00 00 00 00 00 00 00 00 00 00 00 00 00 00 00 00 00 00 00 00 00 02
E: 15.765641 62 0a 07 65 6f 11 22 2a b3 05 49 02 07 66 e6 10 39 45 a8 04 56 02 00 00 00 00 00 00 00 00 00 00 00 00 00 00 00 00 00 00 00 00 00 00 00 00 00 00 00 00 00 00 00 00 00 00 00 00 00 00 00 00 02
E: 15.781640 62 0a 07 65 6f 11 22 2a 6e 05 44 02 07 66 e6 10 39 45 af 04 5a 02 00 00 00 00 00 00 00 00 00 00 00 00 00 00 00 00 00 00 00 00 00 00 00 00 00 00 00 00 00 00 00 00 00 00 00 00 00 00 00 00 02
E: 15.798641 62 0a 07 65 6f 11 22 2a 6e 05 26 02 07 66 e6 10 39 45 a8 04 5e 02 00 00 00 00 00 00 00 00 00 00 00 00 00 00 00 00 00 00 00 00 00 00 00 00 00 00 00 00 00 00 00 00 00 00 00 00 00 00 00 00 02
E: 15.815641 62 0a 07 65 6f 11 22 2a 6e 05 19 02 07 66 e6 10 39 45 a0 04 1e 02 00 00 00 00 00 00 00 00 00 00 00 00 00 00 00 00 00 00 00 00 00 00 00 00 00 00 00 00 00 00 00 00 00 00 00 00 00 00 00 00 02
E: 15.831640 62 0a 07 65 6f 11 22 2a 50 05 15 02 07 66 e6 10 39 45 a0 04 33 02 00 00 00 00 00 00 00 00 00 00 00 00 00 00 00 00 00 00 00 00 00 00 00 00 00 00 00 00 00 00 00 00 00 00 00 00 00 00 00 00 02
E: 15.848641 62 0a 07 65 6f 11 22 2a 22 05 19 02 07 66 e6 10 39 45 b7 04 33 02 00 00 00 00 00 00 00 00 00 00 00 00 00 00 00 00 00 00 00 00 00 00 00 00 00 00 00 00 00 00 00 00 00 00 00 00 00 00 00 00 02
E: 15.865640 62 0a 07 65 6f 11 22 2a 22 05 19 02 07 66 e6 10 39 45 a0 04 49 02 00 00 00 00 00 00 00 00 00 00 00 00 00 00 00 00 00 00 00 00 00 00 00 00 00 00 00 00 00 00 00 00 00 00 00 00 00 00 00 00 02
E: 15.881640 62 0a 07 65 6f 11 22 2a b7 04 15 02 07 66 e6 10 39 45 af 04 4d 02 00 00 00 00 00 00 00 00 00 00 00 00 00 00 00 00 00 00 00 00 00 00 00 00 00 00 00 00 00 00 00 00 00 00 00 00 00 00 00 00 02
E: 15.898640 62 0a 07 65 6f 11 22 2a dd 04 15 02 07 66 e6 10 39 45 c6 04 51 02 00 00 00 00 00 00 00 00 00 00 00 00 00 00 00 00 00 00 00 00 00 00 00 00 00 00 00 00 00 00 00 00 00 00 00 00 00 00 00 00 02
E: 15.915639 62 0a 07 65 6f 11 22 2a 03 05 11 02 07 66 e6 10 39 45 91 04 5e 02 00 00 00 00 00 00 00 00 00 00 00 00 00 00 00 00 00 00 00 00 00 00 00 00 00 00 00 00 00 00 00 00 00 00 00 00 00 00 00 00 02
E: 15.931637 62 0a 07 65 6f 11 22 2a 29 05 11 02 07 66 0c 11 39 45 dd 04 67 02 00 00 00 00 00 00 00 00 00 00 00 00 00 00 00 00 00 00 00 00 00 00 00 00 00 00 00 00 00 00 00 00 00 00 00 00 00 00 00 00 02
E: 15.948640 62 0a 07 65 95 11 26 2a f0 05 08 02 07 66 ac 11 46 45 f4 04 5e 02 00 00 00 00 00 00 00 00 00 00 00 00 00 00 00 00 00 00 00 00 00 00 00 00 00 00 00 00 00 00 00 00 00 00 00 00 00 00 00 00 02
E: 15.965641 62 0a 07 65 3d 12 2a 2a f0 05 04 02 07 66 17 12 4f 45 13 05 44 02 00 00 00 00 00 00 00 00 00 00 00 00 00 00 00 00 00 00 00 00 00 00 00 00 00 00 00 00 00 00 00 00 00 00 00 00 00 00 00 00 02
E: 15.981659 62 0a 07 65 82 12 2a 2a 40 05 26 02 07 66 cf 12 5b 45 a8 04 33 02 00 00 00 00 00 00 00 00 00 00 00 00 00 00 00 00 00 00 00 00 00 00 00 00 00 00 00 00 00 00 00 00 00 00 00 00 00 00 00 00 02
E: 15.998641 62 0a 07 65 bf 12 2e 2a bf 04 26 02 07 66 13 13 60 45 63 04 1e 02 00 00 00 00 00 00 00 00 00 00 00 00 00 00 00 00 00 00 00 00 00 00 00 00 00 00 00 00 00 00 00 00 00 00 00 00 00 00 00 00 02
E: 16.015640 62 0a 07 65 ac 13 37 2a bb 05 26 02 07 66 13 13 60 45 dd 04 11 02 00 00 00 00 00 00 00 00 00 00 00 00 00 00 00 00 00 00 00 00 00 00 00 00 00 00 00 00 00 00 00 00 00 00 00 00 00 00 00 00 02
E: 16.032654 62 0a 07 65 10 14 3b 2a 9c 05 22 02 07 66 51 13 64 45 40 05 5e 02 00 00 00 00 00 00 00 00 00 00 00 00 00 00 00 00 00 00 00 00 00 00 00 00 00 00 00 00 00 00 00 00 00 00 00 00 00 00 00 00 02
E: 16.048653 62 0a 07 65 5c 14 3b 2a fc 04 26 02 07 66 73 14 75 45 44 04 51 02 00 00 00 00 00 00 00 00 00 00 00 00 00 00 00 00 00 00 00 00 00 00 00 00 00 00 00 00 00 00 00 00 00 00 00 00 00 00 00 00 02
E: 16.065640 62 0a 07 65 67 15 48 2a 07 06 1e 02 07 66 1b 15 7e 45 98 04 11 02 00 00 00 00 00 00 00 00 00 00 00 00 00 00 00 00 00 00 00 00 00 00 00 00 00 00 00 00 00 00 00 00 00 00 00 00 00 00 00 00 02
E: 16.082655 62 0a 07 65 00 16 51 2a 6e 05 1e 02 07 66 d2 15 7e 45 67 05 26 02 00 00 00 00 00 00 00 00 00 00 00 00 00 00 00 00 00 00 00 00 00 00 00 00 00 00 00 00 00 00 00 00 00 00 00 00 00 00 00 00 02
E: 16.098654 62 0a 07 65 cf 16 5e 2a 22 05 1e 02 07 66 45 16 7a 45 ff 03 26 02 00 00 00 00 00 00 00 00 00 00 00 00 00 00 00 00 00 00 00 00 00 00 00 00 00 00 00 00 00 00 00 00 00 00 00 00 00 00 00 00 02
E: 16.115654 62 0a 07 65 58 17 66 2a 9c 05 26 02 07 66 3a 17 71 45 91 04 26 02 00 00 00 00 00 00 00 00 00 00 00 00 00 00 00 00 00 00 00 00 00 00 00 00 00 00 00 00 00 00 00 00 00 00 00 00 00 00 00 00 02
E: 16.132657 62 0a 07 65 73 18 78 2a 31 05 26 02 07 66 d2 17 68 45 a8 04 44 02 00 00 00 00 00 00 00 00 00 00 00 00 00 00 00 00 00 00 00 00 00 00 00 00 00 00 00 00 00 00 00 00 00 00 00 00 00 00 00 00 02
E: 16.148654 62 0a 07 65 3a 19 85 2a 22 05 22 02 07 66 cf 18 5b 45 5b 04 62 02 00 00 00 00 00 00 00 00 00 00 00 00 00 00 00 00 00 00 00 00 00 00 00 00 00 00 00 00 00 00 00 00 00 00 00 00 00 00 00 00 02
E: 16.149518 62 0a 07 65 00 1a 91 2a 22 05 22 02 00 00 00 00 00 00 00 00 00 00 00 00 00 00 00 00 00 00 00 00 00 00 00 00 00 00 00 00 00 00 00 00 00 00 00 00 00 00 00 00 00 00 00 00 00 00 00 00 00 00 02
E: 16.165653 62 0a 07 65 cf 1a 9e 2a 6e 05 26 02 07 66 6f 19 53 45 a8 04 40 02 00 00 00 00 00 00 00 00 00 00 00 00 00 00 00 00 00 00 00 00 00 00 00 00 00 00 00 00 00 00 00 00 00 00 00 00 00 00 00 00 02
E: 16.166630 62 0a 07 66 1f 1a 4a 45 a8 04 40 02 00 00 00 00 00 00 00 00 00 00 00 00 00 00 00 00 00 00 00 00 00 00 00 00 00 00 00 00 00 00 00 00 00 00 00 00 00 00 00 00 00 00 00 00 00 00 00 00 00 00 02
E: 16.182643 62 0a 07 65 45 1c b8 2a fc 04 26 02 07 66 a1 1a 42 45 26 04 15 02 00 00 00 00 00 00 00 00 00 00 00 00 00 00 00 00 00 00 00 00 00 00 00 00 00 00 00 00 00 00 00 00 00 00 00 00 00 00 00 00 02
E: 16.198652 62 0a 07 65 60 1d ce 2a d9 05 26 02 07 66 51 1b 39 45 8d 05 e6 01 00 00 00 00 00 00 00 00 00 00 00 00 00 00 00 00 00 00 00 00 00 00 00 00 00 00 00 00 00 00 00 00 00 00 00 00 00 00 00 00 02
E: 16.215655 62 0a 07 65 64 1e df 2a 31 05 fb 01 07 66 54 1c 28 45 6a 04 c8 01 00 00 00 00 00 00 00 00 00 00 00 00 00 00 00 00 00 00 00 00 00 00 00 00 00 00 00 00 00 00 00 00 00 00 00 00 00 00 00 00 02
E: 16.232653 62 0a 07 65 77 1f f4 2a 03 05 f7 01 07 66 f5 1c 1f 45 94 05 49 02 00 00 00 00 00 00 00 00 00 00 00 00 00 00 00 00 00 00 00 00 00 00 00 00 00 00 00 00 00 00 00 00 00 00 00 00 00 00 00 00 02
E: 16.248653 62 0a 07 65 d6 20 13 2b e1 05 22 02 07 66 2e 1e 0e 45 26 04 f7 01 00 00 00 00 00 00 00 00 00 00 00 00 00 00 00 00 00 00 00 00 00 00 00 00 00 00 00 00 00 00 00 00 00 00 00 00 00 00 00 00 02
E: 16.265652 62 0a 07 65 10 22 28 2b 13 05 f7 01 07 66 41 1f 05 45 bb 05 0c 02 00 00 00 00 00 00 00 00 00 00 00 00 00 00 00 00 00 00 00 00 00 00 00 00 00 00 00 00 00 00 00 00 00 00 00 00 00 00 00 00 02
E: 16.282654 62 0a 07 65 32 23 39 2b 9c 05 19 02 07 66 4d 20 0a 45 5b 04 d0 01 00 00 00 00 00 00 00 00 00 00 00 00 00 00 00 00 00 00 00 00 00 00 00 00 00 00 00 00 00 00 00 00 00 00 00 00 00 00 00 00 02
E: 16.298652 62 0a 07 65 5c 24 46 2b d2 05 15 02 07 66 2a 21 12 45 d9 05 2f 02 00 00 00 00 00 00 00 00 00 00 00 00 00 00 00 00 00 00 00 00 00 00 00 00 00 00 00 00 00 00 00 00 00 00 00 00 00 00 00 00 02
E: 16.316654 62 0a 07 65 a5 25 53 2b dd 04 f3 01 07 66 ac 21 17 45 44 04 cc 01 00 00 00 00 00 00 00 00 00 00 00 00 00 00 00 00 00 00 00 00 00 00 00 00 00 00 00 00 00 00 00 00 00 00 00 00 00 00 00 00 02
E: 16.332650 62 0a 07 65 cf 26 57 2b 0f 06 ff 01 07 66 f5 22 1f 45 ce 04 dd 01 00 00 00 00 00 00 00 00 00 00 00 00 00 00 00 00 00 00 00 00 00 00 00 00 00 00 00 00 00 00 00 00 00 00 00 00 00 00 00 00 02
E: 16.349653 62 0a 07 65 da 27 57 2b fc 04 bf 01 07 66 4d 24 2c 45 72 04 ee 01 00 00 00 00 00 00 00 00 00 00 00 00 00 00 00 00 00 00 00 00 00 00 00 00 00 00 00 00 00 00 00 00 00 00 00 00 00 00 00 00 02
E: 16.365650 62 0a 07 65 fc 28 57 2b 67 05 19 02 07 66 fc 24 30 45 a8 04 9d 01 00 00 00 00 00 00 00 00 00 00 00 00 00 00 00 00 00 00 00 00 00 00 00 00 00 00 00 00 00 00 00 00 00 00 00 00 00 00 00 00 02
E: 16.383652 62 0a 07 65 2e 2a 57 2b ca 05 fb 01 07 66 1f 26 39 45 89 04 bf 01 00 00 00 00 00 00 00 00 00 00 00 00 00 00 00 00 00 00 00 00 00 00 00 00 00 00 00 00 00 00 00 00 00 00 00 00 00 00 00 00 02
E: 16.399651 62 0a 07 65 60 2b 57 2b d5 04 f3 01 07 66 d6 26 42 45 4c 04 a5 01 00 00 00 00 00 00 00 00 00 00 00 00 00 00 00 00 00 00 00 00 00 00 00 00 00 00 00 00 00 00 00 00 00 00 00 00 00 00 00 00 02
E: 16.400517 62 0a 07 66 8e 27 46 45 4c 04 a5 01 00 00 00 00 00 00 00 00 00 00 00 00 00 00 00 00 00 00 00 00 00 00 00 00 00 00 00 00 00 00 00 00 00 00 00 00 00 00 00 00 00 00 00 00 00 00 00 00 00 00 02
E: 16.415647 62 0a 07 65 7a 2c 53 2b ff 05 04 02 07 66 26 28 4a 45 b7 04 e1 01 00 00 00 00 00 00 00 00 00 00 00 00 00 00 00 00 00 00 00 00 00 00 00 00 00 00 00 00 00 00 00 00 00 00 00 00 00 00 00 00 02
E: 16.433653 62 0a 07 65 7e 2d 4a 2b e5 04 dd 01 07 66 ed 28 4f 45 16 04 bf 01 00 00 00 00 00 00 00 00 00 00 00 00 00 00 00 00 00 00 00 00 00 00 00 00 00 00 00 00 00 00 00 00 00 00 00 00 00 00 00 00 02
E: 16.434516 62 0a 07 66 a4 29 53 45 16 04 bf 01 00 00 00 00 00 00 00 00 00 00 00 00 00 00 00 00 00 00 00 00 00 00 00 00 00 00 00 00 00 00 00 00 00 00 00 00 00 00 00 00 00 00 00 00 00 00 00 00 00 00 02
E: 16.448645 62 0a 07 65 91 2e 42 2b 8d 05 19 02 07 66 6b 2a 53 45 0b 05 a1 01 00 00 00 00 00 00 00 00 00 00 00 00 00 00 00 00 00 00 00 00 00 00 00 00 00 00 00 00 00 00 00 00 00 00 00 00 00 00 00 00 02
E: 16.466651 62 0a 07 65 b4 2f 3e 2b f4 04 d0 01 07 66 b4 2b 57 45 5b 04 e6 01 00 00 00 00 00 00 00 00 00 00 00 00 00 00 00 00 00 00 00 00 00 00 00 00 00 00 00 00 00 00 00 00 00 00 00 00 00 00 00 00 02
E: 16.482652 62 0a 07 65 ce 30 35 2b 0b 05 e1 01 07 66 6b 2c 5b 45 26 04 cc 01 00 00 00 00 00 00 00 00 00 00 00 00 00 00 00 00 00 00 00 00 00 00 00 00 00 00 00 00 00 00 00 00 00 00 00 00 00 00 00 00 02
E: 16.483628 62 0a 07 66 39 2d 5b 45 26 04 cc 01 00 00 00 00 00 00 00 00 00 00 00 00 00 00 00 00 00 00 00 00 00 00 00 00 00 00 00 00 00 00 00 00 00 00 00 00 00 00 00 00 00 00 00 00 00 00 00 00 00 00 02
E: 16.498639 62 0a 07 65 f1 31 2c 2b ab 05 0c 02 07 66 08 2e 60 45 ab 05 ea 01 00 00 00 00 00 00 00 00 00 00 00 00 00 00 00 00 00 00 00 00 00 00 00 00 00 00 00 00 00 00 00 00 00 00 00 00 00 00 00 00 02
E: 16.516641 62 0a 07 65 13 33 24 2b c6 04 04 02 07 66 60 2f 64 45 44 04 bb 01 00 00 00 00 00 00 00 00 00 00 00 00 00 00 00 00 00 00 00 00 00 00 00 00 00 00 00 00 00 00 00 00 00 00 00 00 00 00 00 00 02
E: 16.532658 62 0a 07 65 1f 34 1f 2b f0 05 26 02 07 66 82 30 68 45 7a 04 d4 01 00 00 00 00 00 00 00 00 00 00 00 00 00 00 00 00 00 00 00 00 00 00 00 00 00 00 00 00 00 00 00 00 00 00 00 00 00 00 00 00 02
E: 16.549639 62 0a 07 65 1b 35 24 2b d5 04 e1 01 07 66 95 31 68 45 b7 04 c3 01 00 00 00 00 00 00 00 00 00 00 00 00 00 00 00 00 00 00 00 00 00 00 00 00 00 00 00 00 00 00 00 00 00 00 00 00 00 00 00 00 02
E: 16.565636 62 0a 07 65 2e 36 2c 2b 50 05 1e 02 07 66 3d 32 68 45 54 04 a9 01 00 00 00 00 00 00 00 00 00 00 00 00 00 00 00 00 00 00 00 00 00 00 00 00 00 00 00 00 00 00 00 00 00 00 00 00 00 00 00 00 02
E: 16.566625 62 0a 07 66 04 33 6d 45 54 04 a9 01 00 00 00 00 00 00 00 00 00 00 00 00 00 00 00 00 00 00 00 00 00 00 00 00 00 00 00 00 00 00 00 00 00 00 00 00 00 00 00 00 00 00 00 00 00 00 00 00 00 00 02
E: 16.582635 62 0a 07 65 49 37 31 2b d5 04 1e 02 07 66 d2 33 6d 45 50 05 c8 01 00 00 00 00 00 00 00 00 00 00 00 00 00 00 00 00 00 00 00 00 00 00 00 00 00 00 00 00 00 00 00 00 00 00 00 00 00 00 00 00 02
E: 16.598636 62 0a 07 65 5c 38 35 2b 5f 05 f7 01 07 66 49 35 6d 45 89 04 90 01 00 00 00 00 00 00 00 00 00 00 00 00 00 00 00 00 00 00 00 00 00 00 00 00 00 00 00 00 00 00 00 00 00 00 00 00 00 00 00 00 02
E: 16.615636 62 0a 07 65 6f 39 35 2b a4 05 5e 02 07 66 6b 36 6d 45 1e 04 6d 01 00 00 00 00 00 00 00 00 00 00 00 00 00 00 00 00 00 00 00 00 00 00 00 00 00 00 00 00 00 00 00 00 00 00 00 00 00 00 00 00 02
E: 16.632635 62 0a 07 65 a1 3a 31 2b af 04 1e 02 07 66 cb 37 71 45 22 05 dd 01 00 00 00 00 00 00 00 00 00 00 00 00 00 00 00 00 00 00 00 00 00 00 00 00 00 00 00 00 00 00 00 00 00 00 00 00 00 00 00 00 02
E: 16.648635 62 0a 07 65 ac 3b 2c 2b bb 05 2b 02 07 66 2a 39 7a 45 a0 04 ae 01 00 00 00 00 00 00 00 00 00 00 00 00 00 00 00 00 00 00 00 00 00 00 00 00 00 00 00 00 00 00 00 00 00 00 00 00 00 00 00 00 02
E: 16.665637 62 0a 07 65 a8 3c 28 2b b7 04 67 02 07 66 5c 3a 7e 45 44 04 b2 01 00 00 00 00 00 00 00 00 00 00 00 00 00 00 00 00 00 00 00 00 00 00 00 00 00 00 00 00 00 00 00 00 00 00 00 00 00 00 00 00 02
E: 16.682636 62 0a 07 65 a4 3d 1b 2b bb 05 11 02 07 66 cb 3b 7e 45 54 04 83 01 00 00 00 00 00 00 00 00 00 00 00 00 00 00 00 00 00 00 00 00 00 00 00 00 00 00 00 00 00 00 00 00 00 00 00 00 00 00 00 00 02
E: 16.698634 62 0a 07 65 99 3e 06 2b dd 04 19 02 07 66 50 3d 82 45 6e 05 fb 01 00 00 00 00 00 00 00 00 00 00 00 00 00 00 00 00 00 00 00 00 00 00 00 00 00 00 00 00 00 00 00 00 00 00 00 00 00 00 00 00 02
E: 16.715634 62 0a 07 65 9d 3f ec 2a 39 05 c8 01 07 66 a0 3e 86 45 44 04 cc 01 00 00 00 00 00 00 00 00 00 00 00 00 00 00 00 00 00 00 00 00 00 00 00 00 00 00 00 00 00 00 00 00 00 00 00 00 00 00 00 00 02
E: 16.732636 62 0a 07 65 bf 40 d2 2a b7 04 2f 02 07 66 da 3f 86 45 07 04 d9 01 00 00 00 00 00 00 00 00 00 00 00 00 00 00 00 00 00 00 00 00 00 00 00 00 00 00 00 00 00 00 00 00 00 00 00 00 00 00 00 00 02
E: 16.748634 62 0a 07 65 e1 41 bc 2a e5 04 f3 01 07 66 50 41 86 45 63 04 f7 01 00 00 00 00 00 00 00 00 00 00 00 00 00 00 00 00 00 00 00 00 00 00 00 00 00 00 00 00 00 00 00 00 00 00 00 00 00 00 00 00 02
E: 16.765635 62 0a 07 65 13 43 a7 2a 5f 05 c8 01 07 66 ed 42 86 45 13 05 ff 01 00 00 00 00 00 00 00 00 00 00 00 00 00 00 00 00 00 00 00 00 00 00 00 00 00 00 00 00 00 00 00 00 00 00 00 00 00 00 00 00 02
E: 16.782635 62 0a 07 65 4c 44 96 2a 22 05 94 01 07 66 73 44 86 45 7a 04 ea 01 00 00 00 00 00 00 00 00 00 00 00 00 00 00 00 00 00 00 00 00 00 00 00 00 00 00 00 00 00 00 00 00 00 00 00 00 00 00 00 00 02
E: 16.798635 62 0a 07 65 95 45 89 2a c6 04 e1 01 07 66 c3 45 82 45 3d 04 26 02 00 00 00 00 00 00 00 00 00 00 00 00 00 00 00 00 00 00 00 00 00 00 00 00 00 00 00 00 00 00 00 00 00 00 00 00 00 00 00 00 02
E: 16.815634 62 0a 07 65 e5 46 80 2a 8d 05 04 02 07 66 49 47 7e 45 81 04 04 02 00 00 00 00 00 00 00 00 00 00 00 00 00 00 00 00 00 00 00 00 00 00 00 00 00 00 00 00 00 00 00 00 00 00 00 00 00 00 00 00 02
E: 16.832635 62 0a 07 65 45 48 7c 2a 03 05 d4 01 07 66 a0 48 7a 45 63 04 e1 01 00 00 00 00 00 00 00 00 00 00 00 00 00 00 00 00 00 00 00 00 00 00 00 00 00 00 00 00 00 00 00 00 00 00 00 00 00 00 00 00 02
E: 16.848635 62 0a 07 65 ca 49 80 2a 13 05 04 02 07 66 58 49 75 45 0f 04 26 02 00 00 00 00 00 00 00 00 00 00 00 00 00 00 00 00 00 00 00 00 00 00 00 00 00 00 00 00 00 00 00 00 00 00 00 00 00 00 00 00 02
E: 16.849626 62 0a 07 66 17 4a 75 45 0f 04 26 02 00 00 00 00 00 00 00 00 00 00 00 00 00 00 00 00 00 00 00 00 00 00 00 00 00 00 00 00 00 00 00 00 00 00 00 00 00 00 00 00 00 00 00 00 00 00 00 00 00 00 02
E: 16.865633 62 0a 07 65 39 4b 8d 2a a8 04 c3 01 07 66 ed 4a 75 45 72 04 ea 01 00 00 00 00 00 00 00 00 00 00 00 00 00 00 00 00 00 00 00 00 00 00 00 00 00 00 00 00 00 00 00 00 00 00 00 00 00 00 00 00 02
E: 16.883634 62 0a 07 65 b0 4c a7 2a 94 05 15 02 07 66 4c 4c 75 45 98 04 f7 01 00 00 00 00 00 00 00 00 00 00 00 00 00 00 00 00 00 00 00 00 00 00 00 00 00 00 00 00 00 00 00 00 00 00 00 00 00 00 00 00 02
E: 16.898634 62 0a 07 65 f1 4d c1 2a 98 04 f7 01 07 66 04 4d 7a 45 f8 03 44 02 00 00 00 00 00 00 00 00 00 00 00 00 00 00 00 00 00 00 00 00 00 00 00 00 00 00 00 00 00 00 00 00 00 00 00 00 00 00 00 00 02
E: 16.899625 62 0a 07 66 c3 4d 7e 45 f8 03 44 02 00 00 00 00 00 00 00 00 00 00 00 00 00 00 00 00 00 00 00 00 00 00 00 00 00 00 00 00 00 00 00 00 00 00 00 00 00 00 00 00 00 00 00 00 00 00 00 00 00 00 02
E: 16.915633 62 0a 07 65 04 4f d6 2a 8d 05 ff 01 07 66 91 4e 82 45 af 04 26 02 00 00 00 00 00 00 00 00 00 00 00 00 00 00 00 00 00 00 00 00 00 00 00 00 00 00 00 00 00 00 00 00 00 00 00 00 00 00 00 00 02
E: 16.932633 62 0a 07 65 9d 4f e3 2a d5 04 c3 01 07 66 26 50 93 45 76 05 3c 02 00 00 00 00 00 00 00 00 00 00 00 00 00 00 00 00 00 00 00 00 00 00 00 00 00 00 00 00 00 00 00 00 00 00 00 00 00 00 00 00 02
E: 16.933626 62 0a 07 65 54 50 f0 2a d5 04 c3 01 00 00 00 00 00 00 00 00 00 00 00 00 00 00 00 00 00 00 00 00 00 00 00 00 00 00 00 00 00 00 00 00 00 00 00 00 00 00 00 00 00 00 00 00 00 00 00 00 00 00 02
E: 16.948635 62 0a 07 65 0b 51 f9 2a f4 04 f3 01 07 66 a4 51 a0 45 e1 03 2f 02 00 00 00 00 00 00 00 00 00 00 00 00 00 00 00 00 00 00 00 00 00 00 00 00 00 00 00 00 00 00 00 00 00 00 00 00 00 00 00 00 02
E: 16.965636 62 0a 07 65 63 52 06 2b 39 05 08 02 07 66 f4 52 ad 45 44 04 62 02 00 00 00 00 00 00 00 00 00 00 00 00 00 00 00 00 00 00 00 00 00 00 00 00 00 00 00 00 00 00 00 00 00 00 00 00 00 00 00 00 02
E: 16.982633 62 0a 07 65 7e 53 01 2b ce 04 83 01 07 66 54 54 ba 45 7a 04 26 02 00 00 00 00 00 00 00 00 00 00 00 00 00 00 00 00 00 00 00 00 00 00 00 00 00 00 00 00 00 00 00 00 00 00 00 00 00 00 00 00 02
E: 16.998633 62 0a 07 65 a8 54 f0 2a 9c 05 e6 01 07 66 f1 55 cb 45 85 05 26 02 00 00 00 00 00 00 00 00 00 00 00 00 00 00 00 00 00 00 00 00 00 00 00 00 00 00 00 00 00 00 00 00 00 00 00 00 00 00 00 00 02
E: 17.015634 62 0a 07 65 b3 55 d2 2a a0 04 dd 01 07 66 5f 57 d0 45 d9 03 fb 01 00 00 00 00 00 00 00 00 00 00 00 00 00 00 00 00 00 00 00 00 00 00 00 00 00 00 00 00 00 00 00 00 00 00 00 00 00 00 00 00 02
E: 17.032633 62 0a 07 65 ed 56 ab 2a fc 04 ae 01 07 66 a0 58 cb 45 f8 03 49 02 00 00 00 00 00 00 00 00 00 00 00 00 00 00 00 00 00 00 00 00 00 00 00 00 00 00 00 00 00 00 00 00 00 00 00 00 00 00 00 00 02
E: 17.048634 62 0a 07 65 17 58 91 2a 85 05 e1 01 07 66 e1 59 c3 45 35 04 89 02 00 00 00 00 00 00 00 00 00 00 00 00 00 00 00 00 00 00 00 00 00 00 00 00 00 00 00 00 00 00 00 00 00 00 00 00 00 00 00 00 02
E: 17.065632 62 0a 07 65 41 59 85 2a b7 04 ae 01 07 66 99 5a ba 45 d9 03 62 02 00 00 00 00 00 00 00 00 00 00 00 00 00 00 00 00 00 00 00 00 00 00 00 00 00 00 00 00 00 00 00 00 00 00 00 00 00 00 00 00 02
E: 17.066625 62 0a 07 66 50 5b b6 45 d9 03 62 02 00 00 00 00 00 00 00 00 00 00 00 00 00 00 00 00 00 00 00 00 00 00 00 00 00 00 00 00 00 00 00 00 00 00 00 00 00 00 00 00 00 00 00 00 00 00 00 00 00 00 02
E: 17.082632 62 0a 07 65 6b 5a 80 2a a0 04 a9 01 07 66 1e 5c ad 45 98 04 15 02 00 00 00 00 00 00 00 00 00 00 00 00 00 00 00 00 00 00 00 00 00 00 00 00 00 00 00 00 00 00 00 00 00 00 00 00 00 00 00 00 02
E: 17.098633 62 0a 07 65 c3 5b 89 2a a8 04 d9 01 07 66 6f 5d a5 45 c2 03 04 02 00 00 00 00 00 00 00 00 00 00 00 00 00 00 00 00 00 00 00 00 00 00 00 00 00 00 00 00 00 00 00 00 00 00 00 00 00 00 00 00 02
E: 17.115632 62 0a 07 65 e5 5c 9a 2a a8 04 c3 01 07 66 17 5e a5 45 54 04 74 02 00 00 00 00 00 00 00 00 00 00 00 00 00 00 00 00 00 00 00 00 00 00 00 00 00 00 00 00 00 00 00 00 00 00 00 00 00 00 00 00 02
E: 17.116622 62 0a 07 66 b7 5e a9 45 54 04 74 02 00 00 00 00 00 00 00 00 00 00 00 00 00 00 00 00 00 00 00 00 00 00 00 00 00 00 00 00 00 00 00 00 00 00 00 00 00 00 00 00 00 00 00 00 00 00 00 00 00 00 02
E: 17.131630 62 0a 07 65 f0 5d ab 2a 39 05 11 02 07 66 41 5f ad 45 2d 04 62 02 00 00 00 00 00 00 00 00 00 00 00 00 00 00 00 00 00 00 00 00 00 00 00 00 00 00 00 00 00 00 00 00 00 00 00 00 00 00 00 00 02
E: 17.148633 62 0a 07 65 91 5e b8 2a 72 04 dd 01 07 66 f8 5f b2 45 54 04 22 02 00 00 00 00 00 00 00 00 00 00 00 00 00 00 00 00 00 00 00 00 00 00 00 00 00 00 00 00 00 00 00 00 00 00 00 00 00 00 00 00 02
E: 17.149627 62 0a 07 65 50 5f c5 2a 72 04 dd 01 07 66 a0 60 ba 45 54 04 22 02 00 00 00 00 00 00 00 00 00 00 00 00 00 00 00 00 00 00 00 00 00 00 00 00 00 00 00 00 00 00 00 00 00 00 00 00 00 00 00 00 02
E: 17.165632 62 0a 07 65 17 60 d2 2a d5 04 19 02 07 66 2a 61 ba 45 f0 03 fb 01 00 00 00 00 00 00 00 00 00 00 00 00 00 00 00 00 00 00 00 00 00 00 00 00 00 00 00 00 00 00 00 00 00 00 00 00 00 00 00 00 02
E: 17.182632 62 0a 07 65 67 61 e8 2a e5 04 a9 01 07 66 e9 61 c3 45 35 04 2f 02 00 00 00 00 00 00 00 00 00 00 00 00 00 00 00 00 00 00 00 00 00 00 00 00 00 00 00 00 00 00 00 00 00 00 00 00 00 00 00 00 02
E: 17.183623 62 0a 07 66 a0 62 cb 45 35 04 2f 02 00 00 00 00 00 00 00 00 00 00 00 00 00 00 00 00 00 00 00 00 00 00 00 00 00 00 00 00 00 00 00 00 00 00 00 00 00 00 00 00 00 00 00 00 00 00 00 00 00 00 02
E: 17.198631 62 0a 07 65 07 62 f0 2a 1a 05 dd 01 07 66 31 63 d0 45 07 04 2f 02 00 00 00 00 00 00 00 00 00 00 00 00 00 00 00 00 00 00 00 00 00 00 00 00 00 00 00 00 00 00 00 00 00 00 00 00 00 00 00 00 02
E: 17.215631 62 0a 07 65 50 63 fd 2a 22 05 ee 01 07 66 f0 63 dd 45 f8 03 2f 02 00 00 00 00 00 00 00 00 00 00 00 00 00 00 00 00 00 00 00 00 00 00 00 00 00 00 00 00 00 00 00 00 00 00 00 00 00 00 00 00 02
E: 17.216624 62 0a 07 66 a0 64 e9 45 f8 03 2f 02 00 00 00 00 00 00 00 00 00 00 00 00 00 00 00 00 00 00 00 00 00 00 00 00 00 00 00 00 00 00 00 00 00 00 00 00 00 00 00 00 00 00 00 00 00 00 00 00 00 00 02
E: 17.232632 62 0a 07 65 72 64 01 2b 03 05 a9 01 07 66 67 65 f6 45 7a 04 85 02 00 00 00 00 00 00 00 00 00 00 00 00 00 00 00 00 00 00 00 00 00 00 00 00 00 00 00 00 00 00 00 00 00 00 00 00 00 00 00 00 02
E: 17.248631 62 0a 07 65 04 65 01 2b af 04 cc 01 07 66 ce 66 14 46 ff 03 1e 02 00 00 00 00 00 00 00 00 00 00 00 00 00 00 00 00 00 00 00 00 00 00 00 00 00 00 00 00 00 00 00 00 00 00 00 00 00 00 00 00 02
E: 17.265631 62 0a 07 65 07 66 fd 2a 7e 05 f3 01 07 66 85 67 21 46 2d 04 b6 01 00 00 00 00 00 00 00 00 00 00 00 00 00 00 00 00 00 00 00 00 00 00 00 00 00 00 00 00 00 00 00 00 00 00 00 00 00 00 00 00 02
E: 17.266624 62 0a 07 66 35 68 2e 46 2d 04 b6 01 00 00 00 00 00 00 00 00 00 00 00 00 00 00 00 00 00 00 00 00 00 00 00 00 00 00 00 00 00 00 00 00 00 00 00 00 00 00 00 00 00 00 00 00 00 00 00 00 00 00 02
E: 17.282631 62 0a 07 65 a0 66 f9 2a e5 04 46 01 07 66 04 69 37 46 40 05 15 02 00 00 00 00 00 00 00 00 00 00 00 00 00 00 00 00 00 00 00 00 00 00 00 00 00 00 00 00 00 00 00 00 00 00 00 00 00 00 00 00 02
E: 17.298632 62 0a 07 65 b3 67 f4 2a d9 05 bb 01 07 66 a0 6a 48 46 e1 03 dd 01 00 00 00 00 00 00 00 00 00 00 00 00 00 00 00 00 00 00 00 00 00 00 00 00 00 00 00 00 00 00 00 00 00 00 00 00 00 00 00 00 02
E: 17.315631 62 0a 07 65 bf 68 f0 2a ce 04 60 01 07 66 c3 6b 48 46 94 05 1e 02 00 00 00 00 00 00 00 00 00 00 00 00 00 00 00 00 00 00 00 00 00 00 00 00 00 00 00 00 00 00 00 00 00 00 00 00 00 00 00 00 02
E: 17.331629 62 0a 07 65 8d 69 ec 2a 39 05 a9 01 07 66 89 6c 44 46 89 04 26 02 00 00 00 00 00 00 00 00 00 00 00 00 00 00 00 00 00 00 00 00 00 00 00 00 00 00 00 00 00 00 00 00 00 00 00 00 00 00 00 00 02
E: 17.348630 62 0a 07 65 0f 6a ec 2a b7 04 c8 01 07 66 e5 6c 3f 46 d9 03 fb 01 00 00 00 00 00 00 00 00 00 00 00 00 00 00 00 00 00 00 00 00 00 00 00 00 00 00 00 00 00 00 00 00 00 00 00 00 00 00 00 00 02
E: 17.349623 62 0a 07 65 af 6a e8 2a b7 04 c8 01 00 00 00 00 00 00 00 00 00 00 00 00 00 00 00 00 00 00 00 00 00 00 00 00 00 00 00 00 00 00 00 00 00 00 00 00 00 00 00 00 00 00 00 00 00 00 00 00 00 00 02
E: 17.365629 62 0a 07 65 39 6b e8 2a ec 04 c8 01 07 66 9c 6d 3f 46 76 05 f7 01 00 00 00 00 00 00 00 00 00 00 00 00 00 00 00 00 00 00 00 00 00 00 00 00 00 00 00 00 00 00 00 00 00 00 00 00 00 00 00 00 02
E: 17.381630 62 0a 07 65 e1 6b e3 2a 40 05 87 01 07 66 63 6e 48 46 39 05 22 02 00 00 00 00 00 00 00 00 00 00 00 00 00 00 00 00 00 00 00 00 00 00 00 00 00 00 00 00 00 00 00 00 00 00 00 00 00 00 00 00 02
E: 17.398633 62 0a 07 65 d6 6c df 2a bf 04 c3 01 07 66 bf 6e 4c 46 b7 04 0c 02 00 00 00 00 00 00 00 00 00 00 00 00 00 00 00 00 00 00 00 00 00 00 00 00 00 00 00 00 00 00 00 00 00 00 00 00 00 00 00 00 02
E: 17.415631 62 0a 07 65 50 6d df 2a 31 05 d0 01 07 66 31 6f 59 46 b7 04 c3 01 00 00 00 00 00 00 00 00 00 00 00 00 00 00 00 00 00 00 00 00 00 00 00 00 00 00 00 00 00 00 00 00 00 00 00 00 00 00 00 00 02
E: 17.431630 62 0a 07 65 e9 6d df 2a 85 05 7a 01 07 66 58 6f 5e 46 a8 04 d0 01 00 00 00 00 00 00 00 00 00 00 00 00 00 00 00 00 00 00 00 00 00 00 00 00 00 00 00 00 00 00 00 00 00 00 00 00 00 00 00 00 02
E: 17.448629 62 0a 07 65 54 6e df 2a a0 04 d0 01 07 66 58 6f 5e 46 d5 04 cc 01 00 00 00 00 00 00 00 00 00 00 00 00 00 00 00 00 00 00 00 00 00 00 00 00 00 00 00 00 00 00 00 00 00 00 00 00 00 00 00 00 02
E: 17.465629 62 0a 07 65 22 6f df 2a bf 04 cc 01 07 66 50 6f 5e 46 f0 05 c3 01 00 00 00 00 00 00 00 00 00 00 00 00 00 00 00 00 00 00 00 00 00 00 00 00 00 00 00 00 00 00 00 00 00 00 00 00 00 00 00 00 02
E: 17.481629 62 0a 07 65 6e 6f df 2a c6 04 d9 01 07 66 50 6f 5e 46 a0 04 c8 01 00 00 00 00 00 00 00 00 00 00 00 00 00 00 00 00 00 00 00 00 00 00 00 00 00 00 00 00 00 00 00 00 00 00 00 00 00 00 00 00 02
E: 17.498630 62 0a 07 65 76 6f df 2a e5 04 e1 01 07 66 50 6f 5e 46 a0 04 cc 01 00 00 00 00 00 00 00 00 00 00 00 00 00 00 00 00 00 00 00 00 00 00 00 00 00 00 00 00 00 00 00 00 00 00 00 00 00 00 00 00 02
E: 17.515629 62 0a 07 65 6e 6f df 2a ec 04 ea 01 07 66 50 6f 5e 46 07 06 d4 01 00 00 00 00 00 00 00 00 00 00 00 00 00 00 00 00 00 00 00 00 00 00 00 00 00 00 00 00 00 00 00 00 00 00 00 00 00 00 00 00 02
E: 17.531627 62 0a 07 65 67 6f df 2a ce 04 ee 01 07 66 50 6f 5e 46 a0 04 d9 01 00 00 00 00 00 00 00 00 00 00 00 00 00 00 00 00 00 00 00 00 00 00 00 00 00 00 00 00 00 00 00 00 00 00 00 00 00 00 00 00 02
E: 17.548629 62 0a 07 65 67 6f df 2a d5 04 f7 01 07 66 50 6f 5e 46 e9 05 dd 01 00 00 00 00 00 00 00 00 00 00 00 00 00 00 00 00 00 00 00 00 00 00 00 00 00 00 00 00 00 00 00 00 00 00 00 00 00 00 00 00 02
E: 17.565628 62 0a 07 65 67 6f df 2a bf 04 fb 01 07 66 50 6f 5e 46 e5 04 e6 01 00 00 00 00 00 00 00 00 00 00 00 00 00 00 00 00 00 00 00 00 00 00 00 00 00 00 00 00 00 00 00 00 00 00 00 00 00 00 00 00 02
E: 17.581628 62 0a 07 65 67 6f df 2a a8 04 f3 01 07 66 50 6f 5e 46 bf 04 ea 01 00 00 00 00 00 00 00 00 00 00 00 00 00 00 00 00 00 00 00 00 00 00 00 00 00 00 00 00 00 00 00 00 00 00 00 00 00 00 00 00 02
E: 17.598628 62 0a 07 65 67 6f df 2a 89 04 ea 01 07 66 50 6f 5e 46 a0 04 e1 01 00 00 00 00 00 00 00 00 00 00 00 00 00 00 00 00 00 00 00 00 00 00 00 00 00 00 00 00 00 00 00 00 00 00 00 00 00 00 00 00 02
E: 17.615629 62 0a 07 65 67 6f df 2a 16 04 94 01 07 66 50 6f 5e 46 91 04 e6 01 00 00 00 00 00 00 00 00 00 00 00 00 00 00 00 00 00 00 00 00 00 00 00 00 00 00 00 00 00 00 00 00 00 00 00 00 00 00 00 00 02
E: 17.631626 62 0a 07 65 41 6f df 2a 63 02 94 01 07 66 50 6f 5e 46 89 04 bf 01 00 00 00 00 00 00 00 00 00 00 00 00 00 00 00 00 00 00 00 00 00 00 00 00 00 00 00 00 00 00 00 00 00 00 00 00 00 00 00 00 02
E: 17.648625 62 0a 04 65 54 6e 1f 2b 63 02 94 01 07 66 50 6f 5e 46 6a 04 b6 01 00 00 00 00 00 00 00 00 00 00 00 00 00 00 00 00 00 00 00 00 00 00 00 00 00 00 00 00 00 00 00 00 00 00 00 00 00 00 00 00 02
E: 17.664636 62 0a 07 66 50 6f 5e 46 5b 04 b2 01 00 00 00 00 00 00 00 00 00 00 00 00 00 00 00 00 00 00 00 00 00 00 00 00 00 00 00 00 00 00 00 00 00 00 00 00 00 00 00 00 00 00 00 00 00 00 00 00 00 00 01
E: 17.681638 62 0a 07 66 50 6f 5e 46 44 04 bb 01 00 00 00 00 00 00 00 00 00 00 00 00 00 00 00 00 00 00 00 00 00 00 00 00 00 00 00 00 00 00 00 00 00 00 00 00 00 00 00 00 00 00 00 00 00 00 00 00 00 00 01
E: 17.698636 62 0a 07 66 50 6f 5e 46 72 04 bf 01 00 00 00 00 00 00 00 00 00 00 00 00 00 00 00 00 00 00 00 00 00 00 00 00 00 00 00 00 00 00 00 00 00 00 00 00 00 00 00 00 00 00 00 00 00 00 00 00 00 00 01
E: 17.714636 62 0a 07 66 50 6f 5e 46 44 04 bb 01 00 00 00 00 00 00 00 00 00 00 00 00 00 00 00 00 00 00 00 00 00 00 00 00 00 00 00 00 00 00 00 00 00 00 00 00 00 00 00 00 00 00 00 00 00 00 00 00 00 00 01
E: 17.731634 62 0a 07 66 50 6f 5e 46 6a 04 b2 01 00 00 00 00 00 00 00 00 00 00 00 00 00 00 00 00 00 00 00 00 00 00 00 00 00 00 00 00 00 00 00 00 00 00 00 00 00 00 00 00 00 00 00 00 00 00 00 00 00 00 01
E: 17.748639 62 0a 07 66 50 6f 5e 46 63 04 dd 01 00 00 00 00 00 00 00 00 00 00 00 00 00 00 00 00 00 00 00 00 00 00 00 00 00 00 00 00 00 00 00 00 00 00 00 00 00 00 00 00 00 00 00 00 00 00 00 00 00 00 01
E: 17.764634 62 0a 07 66 50 6f 5e 46 54 04 dd 01 00 00 00 00 00 00 00 00 00 00 00 00 00 00 00 00 00 00 00 00 00 00 00 00 00 00 00 00 00 00 00 00 00 00 00 00 00 00 00 00 00 00 00 00 00 00 00 00 00 00 01
E: 17.781637 62 0a 07 66 50 6f 5e 46 5b 04 f7 01 00 00 00 00 00 00 00 00 00 00 00 00 00 00 00 00 00 00 00 00 00 00 00 00 00 00 00 00 00 00 00 00 00 00 00 00 00 00 00 00 00 00 00 00 00 00 00 00 00 00 01
E: 17.798636 62 0a 07 66 50 6f 5e 46 44 04 ea 01 00 00 00 00 00 00 00 00 00 00 00 00 00 00 00 00 00 00 00 00 00 00 00 00 00 00 00 00 00 00 00 00 00 00 00 00 00 00 00 00 00 00 00 00 00 00 00 00 00 00 01
E: 17.814636 62 0a 07 66 50 6f 5e 46 4c 04 ea 01 00 00 00 00 00 00 00 00 00 00 00 00 00 00 00 00 00 00 00 00 00 00 00 00 00 00 00 00 00 00 00 00 00 00 00 00 00 00 00 00 00 00 00 00 00 00 00 00 00 00 01
E: 17.831636 62 0a 07 66 50 6f 5e 46 3d 04 e6 01 00 00 00 00 00 00 00 00 00 00 00 00 00 00 00 00 00 00 00 00 00 00 00 00 00 00 00 00 00 00 00 00 00 00 00 00 00 00 00 00 00 00 00 00 00 00 00 00 00 00 01
E: 17.847636 62 0a 07 66 50 6f 5e 46 54 04 ea 01 00 00 00 00 00 00 00 00 00 00 00 00 00 00 00 00 00 00 00 00 00 00 00 00 00 00 00 00 00 00 00 00 00 00 00 00 00 00 00 00 00 00 00 00 00 00 00 00 00 00 01
E: 17.864634 62 0a 07 66 50 6f 5e 46 3d 04 ea 01 00 00 00 00 00 00 00 00 00 00 00 00 00 00 00 00 00 00 00 00 00 00 00 00 00 00 00 00 00 00 00 00 00 00 00 00 00 00 00 00 00 00 00 00 00 00 00 00 00 00 01
E: 17.881634 62 0a 07 66 50 6f 5e 46 3d 04 e6 01 00 00 00 00 00 00 00 00 00 00 00 00 00 00 00 00 00 00 00 00 00 00 00 00 00 00 00 00 00 00 00 00 00 00 00 00 00 00 00 00 00 00 00 00 00 00 00 00 00 00 01
E: 17.897637 62 0a 07 66 50 6f 5e 46 2d 04 f7 01 00 00 00 00 00 00 00 00 00 00 00 00 00 00 00 00 00 00 00 00 00 00 00 00 00 00 00 00 00 00 00 00 00 00 00 00 00 00 00 00 00 00 00 00 00 00 00 00 00 00 01
E: 17.914636 62 0a 07 66 50 6f 5e 46 4c 04 f7 01 00 00 00 00 00 00 00 00 00 00 00 00 00 00 00 00 00 00 00 00 00 00 00 00 00 00 00 00 00 00 00 00 00 00 00 00 00 00 00 00 00 00 00 00 00 00 00 00 00 00 01
E: 17.931631 62 0a 07 66 50 6f 5e 46 3d 04 f3 01 00 00 00 00 00 00 00 00 00 00 00 00 00 00 00 00 00 00 00 00 00 00 00 00 00 00 00 00 00 00 00 00 00 00 00 00 00 00 00 00 00 00 00 00 00 00 00 00 00 00 01
E: 17.948635 62 0a 07 66 50 6f 5e 46 35 04 ea 01 00 00 00 00 00 00 00 00 00 00 00 00 00 00 00 00 00 00 00 00 00 00 00 00 00 00 00 00 00 00 00 00 00 00 00 00 00 00 00 00 00 00 00 00 00 00 00 00 00 00 01
E: 17.964634 62 0a 07 66 50 6f 5e 46 3d 04 ee 01 00 00 00 00 00 00 00 00 00 00 00 00 00 00 00 00 00 00 00 00 00 00 00 00 00 00 00 00 00 00 00 00 00 00 00 00 00 00 00 00 00 00 00 00 00 00 00 00 00 00 01
E: 17.981634 62 0a 07 66 50 6f 5e 46 44 04 ea 01 00 00 00 00 00 00 00 00 00 00 00 00 00 00 00 00 00 00 00 00 00 00 00 00 00 00 00 00 00 00 00 00 00 00 00 00 00 00 00 00 00 00 00 00 00 00 00 00 00 00 01
E: 17.997633 62 0a 07 66 50 6f 5e 46 26 04 ae 01 00 00 00 00 00 00 00 00 00 00 00 00 00 00 00 00 00 00 00 00 00 00 00 00 00 00 00 00 00 00 00 00 00 00 00 00 00 00 00 00 00 00 00 00 00 00 00 00 00 00 01
E: 18.014634 62 0a 07 66 50 6f 5e 46 3d 04 b2 01 00 00 00 00 00 00 00 00 00 00 00 00 00 00 00 00 00 00 00 00 00 00 00 00 00 00 00 00 00 00 00 00 00 00 00 00 00 00 00 00 00 00 00 00 00 00 00 00 00 00 01
E: 18.031624 62 0a 07 66 50 6f 5e 46 54 04 bb 01 00 00 00 00 00 00 00 00 00 00 00 00 00 00 00 00 00 00 00 00 00 00 00 00 00 00 00 00 00 00 00 00 00 00 00 00 00 00 00 00 00 00 00 00 00 00 00 00 00 00 01
E: 18.047634 62 0a 07 66 50 6f 5e 46 35 04 b6 01 00 00 00 00 00 00 00 00 00 00 00 00 00 00 00 00 00 00 00 00 00 00 00 00 00 00 00 00 00 00 00 00 00 00 00 00 00 00 00 00 00 00 00 00 00 00 00 00 00 00 01
E: 18.064634 62 0a 07 66 50 6f 5e 46 4c 04 b2 01 00 00 00 00 00 00 00 00 00 00 00 00 00 00 00 00 00 00 00 00 00 00 00 00 00 00 00 00 00 00 00 00 00 00 00 00 00 00 00 00 00 00 00 00 00 00 00 00 00 00 01
E: 18.081633 62 0a 07 66 50 6f 5e 46 3d 04 b6 01 00 00 00 00 00 00 00 00 00 00 00 00 00 00 00 00 00 00 00 00 00 00 00 00 00 00 00 00 00 00 00 00 00 00 00 00 00 00 00 00 00 00 00 00 00 00 00 00 00 00 01
E: 18.097634 62 0a 07 66 50 6f 5e 46 a4 03 f7 01 00 00 00 00 00 00 00 00 00 00 00 00 00 00 00 00 00 00 00 00 00 00 00 00 00 00 00 00 00 00 00 00 00 00 00 00 00 00 00 00 00 00 00 00 00 00 00 00 00 00 01
E: 18.114624 62 0a 04 66 bf 6e a2 46 a4 03 f7 01 00 00 00 00 00 00 00 00 00 00 00 00 00 00 00 00 00 00 00 00 00 00 00 00 00 00 00 00 00 00 00 00 00 00 00 00 00 00 00 00 00 00 00 00 00 00 00 00 00 00 01
# 3. Finally, move your ten fingers on the screen and release them.
E: 28.821729 62 0a 07 67 77 0d 7c 1e 03 07 62 02 07 68 49 0f cc 27 0f 06 fb 01 07 69 d2 27 22 30 bf 04 04 02 07 6a 2e 16 d2 18 63 04 b2 01 07 6b 64 24 98 15 57 03 62 02 00 00 00 00 00 00 00 00 00 00 06
E: 28.838599 62 0a 07 67 77 0d 7c 1e 39 07 5a 02 07 68 49 0f cc 27 2d 06 d0 01 07 69 d2 27 22 30 ce 04 ff 01 07 6a 2e 16 d2 18 7a 04 8b 01 07 6b 64 24 98 15 2a 03 49 02 07 6c 92 0c 1f 4f bb 07 26 02 06
E: 28.854575 62 0a 07 67 77 0d 7c 1e 40 07 49 02 07 68 49 0f cc 27 44 06 bf 01 07 69 d2 27 22 30 0b 05 ea 01 07 6a 2e 16 d2 18 6a 04 94 01 07 6b 64 24 98 15 76 03 6f 02 07 6c 92 0c 1f 4f 22 09 19 02 06
E: 28.870565 62 0a 07 67 77 0d 7c 1e 48 07 49 02 07 68 49 0f cc 27 3d 06 c3 01 07 69 d2 27 22 30 03 05 0c 02 07 6a 2e 16 d2 18 72 04 94 01 07 6b 64 24 98 15 85 03 81 02 07 6c c3 0d 23 4f bb 07 3c 02 06
E: 28.887566 62 0a 07 67 77 0d 7c 1e 03 07 4d 02 07 68 49 0f cc 27 ff 05 bf 01 07 69 d2 27 22 30 c6 04 1e 02 07 6a 2e 16 d2 18 98 04 90 01 07 6b 91 24 a1 15 a4 03 2f 02 07 6c 4d 0e 23 4f ca 07 4d 02 06
E: 28.903567 62 0a 07 67 77 0d 7c 1e af 06 33 02 07 68 49 0f cc 27 b3 05 a5 01 07 69 08 28 2e 30 13 05 1e 02 07 6a 2e 16 d2 18 29 05 b6 01 07 6b 41 25 c3 15 e1 03 d9 01 07 6c 5c 0e 23 4f 4c 08 4d 02 06
E: 28.918565 62 0a 07 67 b4 0d 80 1e 07 06 fb 01 07 68 86 0f cc 27 31 05 9d 01 07 69 e5 28 66 30 13 05 33 02 07 6a 6b 16 ca 18 4c 04 d4 01 07 6b c3 25 dd 15 48 03 1e 02 07 6c 7b 0e 23 4f 85 07 15 02 06
E: 28.936565 62 0a 07 67 92 0e 92 1e 7a 06 f3 01 07 68 6b 10 d0 27 0f 06 ee 01 07 69 7e 29 89 30 1a 05 0c 02 07 6a 49 17 b0 18 bf 04 a9 01 07 6b ed 26 11 16 76 03 f7 01 07 6c 1b 0f 23 4f 0b 07 33 02 06
E: 28.953585 62 0a 07 67 49 0f 9e 1e 6a 04 f3 01 07 68 ed 10 d4 27 2d 06 ee 01 07 69 8a 2a c9 30 63 04 37 02 07 6a e2 17 ab 18 35 04 d0 01 07 6b f1 27 3c 16 76 03 f7 01 07 6c 8e 0f 23 4f f4 06 e6 01 06
E: 28.954534 62 0a 07 67 1f 10 b4 1e 6a 04 f3 01 00 00 00 00 00 00 00 00 00 00 00 00 00 00 00 00 00 00 00 00 00 00 00 00 00 00 00 00 00 00 00 00 00 00 00 00 00 00 00 00 00 00 00 00 00 00 00 00 00 00 06
E: 28.970578 62 0a 07 67 c7 10 c1 1e b7 04 d9 01 07 68 ac 11 e1 27 ca 05 f7 01 07 69 2a 2b ec 30 98 04 49 02 07 6a 0c 19 ce 18 7a 04 bf 01 07 6b 73 28 4d 16 03 03 37 02 07 6c 45 10 1f 4f 8d 07 c8 01 06
E: 28.988569 62 0a 07 67 9d 11 d2 1e 2d 04 a5 01 07 68 82 12 ee 27 6a 06 dd 01 07 69 45 2c 28 31 7a 04 5a 02 07 6a 27 1a fd 18 91 04 b2 01 07 6b 86 29 62 16 94 03 d9 01 07 6c de 10 1b 4f 9c 07 94 01 06
E: 28.989429 62 0a 07 6c 9d 11 12 4f 9c 07 94 01 00 00 00 00 00 00 00 00 00 00 00 00 00 00 00 00 00 00 00 00 00 00 00 00 00 00 00 00 00 00 00 00 00 00 00 00 00 00 00 00 00 00 00 00 00 00 00 00 00 00 06
E: 29.003574 62 0a 07 67 c7 12 e8 1e dd 04 a5 01 07 68 0c 13 fb 27 d2 05 ea 01 07 69 50 2d 53 31 72 04 37 02 07 6a 1b 1b 2c 19 54 04 b2 01 07 6b b0 2a 6f 16 85 03 44 02 07 6c 36 12 0e 4f c2 07 dd 01 06
E: 29.019580 62 0a 07 67 7e 13 f5 1e 26 04 a1 01 07 68 1f 14 15 28 4c 06 ee 01 07 69 36 2e 69 31 72 04 ea 01 07 6a f1 1b 58 19 b7 04 b6 01 07 6b cb 2b 73 16 e1 03 5e 02 07 6c 13 13 01 4f 50 07 c8 01 06
E: 29.020429 62 0a 07 67 2e 14 0a 1f 26 04 a1 01 07 6c e2 13 f8 4e 50 07 c8 01 00 00 00 00 00 00 00 00 00 00 00 00 00 00 00 00 00 00 00 00 00 00 00 00 00 00 00 00 00 00 00 00 00 00 00 00 00 00 00 00 06
E: 29.036578 62 0a 07 67 bf 14 17 1f af 04 d4 01 07 68 de 14 22 28 57 05 0c 02 07 69 b8 2e 71 31 af 04 40 02 07 6a 6b 1c 6d 19 4c 04 b2 01 07 6b ce 2c 78 16 5f 03 fb 01 07 6c 8a 14 f0 4e a4 07 2b 02 06
E: 29.037429 62 0a 07 68 ac 15 33 28 57 05 0c 02 00 00 00 00 00 00 00 00 00 00 00 00 00 00 00 00 00 00 00 00 00 00 00 00 00 00 00 00 00 00 00 00 00 00 00 00 00 00 00 00 00 00 00 00 00 00 00 00 00 00 06
E: 29.053574 62 0a 07 67 77 15 2c 1f 35 04 a1 01 07 68 54 16 40 28 35 06 ee 01 07 69 e9 2f 87 31 7a 04 11 02 07 6a 9d 1d a1 19 d5 04 b6 01 07 6b e9 2d 80 16 ca 03 2f 02 07 6c 86 15 d6 4e 48 05 fb 01 06
E: 29.054554 62 0a 07 6c 8a 16 af 4e 48 05 fb 01 00 00 00 00 00 00 00 00 00 00 00 00 00 00 00 00 00 00 00 00 00 00 00 00 00 00 00 00 00 00 00 00 00 00 00 00 00 00 00 00 00 00 00 00 00 00 00 00 00 00 06
E: 29.068564 62 0a 07 67 99 16 4f 1f 89 04 b2 01 07 68 2a 17 51 28 40 05 e1 01 07 69 e5 30 98 31 dd 04 2b 02 07 6a bf 1e c3 19 5b 04 98 01 07 6b e5 2e 8d 16 94 03 dd 01 07 6c 86 17 95 4e 63 04 0c 02 06
E: 29.088581 62 0a 07 67 49 17 64 1f 44 04 f7 01 07 68 7b 18 73 28 e1 05 d0 01 07 69 77 31 a0 31 7a 04 4d 02 07 6a f1 1f d9 19 af 04 d4 01 07 6b f1 2f ab 16 9c 03 26 02 07 6c fc 18 95 4e 85 05 d0 01 06
E: 29.089556 62 0a 07 67 f9 17 7e 1f 44 04 f7 01 07 69 17 32 a5 31 7a 04 4d 02 00 00 00 00 00 00 00 00 00 00 00 00 00 00 00 00 00 00 00 00 00 00 00 00 00 00 00 00 00 00 00 00 00 00 00 00 00 00 00 00 06
E: 29.104577 62 0a 07 67 b0 18 98 1f 0f 04 9d 01 07 68 95 19 9e 28 a4 05 ea 01 07 69 bf 32 ad 31 98 04 b4 02 07 6a 0c 21 e5 19 f0 03 d4 01 07 6b fc 30 d2 16 50 03 a9 01 07 6c 36 1a b4 4e 13 05 40 02 06
E: 29.121580 62 0a 07 67 e2 19 cc 1f bf 04 b2 01 07 68 b8 1a d6 28 67 05 19 02 07 69 f8 33 b2 31 a0 04 56 02 07 6a 2e 22 ee 19 54 04 d9 01 07 6b 17 32 fd 16 bb 03 11 02 07 6c 7e 1b c9 4e a4 05 5e 02 06
E: 29.138580 62 0a 07 67 f5 1a fb 1f f0 03 fb 01 07 68 58 1b f4 28 ca 05 ea 01 07 69 2a 35 b6 31 1e 04 26 02 07 6a 32 23 fb 19 35 04 dd 01 07 6b 1b 33 24 17 67 03 e6 01 07 6c 54 1c b4 4e 03 05 fb 01 06
E: 29.139430 62 0a 07 68 00 1c 13 29 ca 05 ea 01 00 00 00 00 00 00 00 00 00 00 00 00 00 00 00 00 00 00 00 00 00 00 00 00 00 00 00 00 00 00 00 00 00 00 00 00 00 00 00 00 00 00 00 00 00 00 00 00 00 00 06
E: 29.153578 62 0a 07 67 10 1c 2f 20 e5 04 dd 01 07 68 b8 1c 31 29 fc 04 8b 01 07 69 63 36 bf 31 bf 04 f7 01 07 6a 5c 24 15 1a e1 03 98 01 07 6b 17 34 4b 17 7e 03 dd 01 07 6c 8e 1d 6f 4e 98 04 15 02 06
E: 29.167577 62 0a 07 67 b0 1c 48 20 2d 04 d4 01 07 68 08 1e 69 29 ab 05 d4 01 07 69 95 37 cb 31 91 04 f3 01 07 6a 7e 25 37 1a 81 04 a5 01 07 6b 13 35 6d 17 9c 03 2b 02 07 6c a8 1e 33 4e 22 05 b6 01 06
E: 29.168552 62 0a 07 67 58 1d 62 20 2d 04 d4 01 00 00 00 00 00 00 00 00 00 00 00 00 00 00 00 00 00 00 00 00 00 00 00 00 00 00 00 00 00 00 00 00 00 00 00 00 00 00 00 00 00 00 00 00 00 00 00 00 00 00 06
E: 29.185575 62 0a 07 67 10 1e 78 20 0f 04 90 01 07 68 bf 1e 82 29 7e 05 ae 01 07 69 ed 38 dd 31 35 04 74 02 07 6a 8a 26 5a 1a f8 03 a1 01 07 6b 0f 36 7e 17 6e 03 a9 01 07 6c b4 1f 10 4e 63 04 ea 01 06
E: 29.186429 62 0a 07 68 77 1f 9c 29 7e 05 ae 01 00 00 00 00 00 00 00 00 00 00 00 00 00 00 00 00 00 00 00 00 00 00 00 00 00 00 00 00 00 00 00 00 00 00 00 00 00 00 00 00 00 00 00 00 00 00 00 00 00 00 06
E: 29.201568 62 0a 07 67 6f 1f 9e 20 f4 04 dd 01 07 68 4d 20 b6 29 bf 04 ee 01 07 69 45 3a ee 31 89 04 b6 01 07 6a 9d 27 78 1a 54 04 94 01 07 6b 39 37 8b 17 ff 03 15 02 07 6c de 20 ff 4d 7e 05 15 02 06
E: 29.218579 62 0a 07 67 a1 20 b8 20 2d 04 bf 01 07 68 e2 21 dd 29 85 05 ae 01 07 69 76 3b ff 31 bf 04 04 02 07 6a b0 28 8d 1a 6a 04 e6 01 07 6b 4c 38 87 17 5f 03 fb 01 07 6c 95 21 f6 4d f4 04 e1 01 06
E: 29.219427 62 0a 07 6c 64 22 e9 4d f4 04 e1 01 00 00 00 00 00 00 00 00 00 00 00 00 00 00 00 00 00 00 00 00 00 00 00 00 00 00 00 00 00 00 00 00 00 00 00 00 00 00 00 00 00 00 00 00 00 00 00 00 00 00 06
E: 29.236574 62 0a 07 67 00 22 ce 20 07 04 d4 01 07 68 04 23 e1 29 6e 05 ee 01 07 69 bf 3c 10 32 63 04 f3 01 07 6a 1f 2a 9e 1a 1e 04 6d 01 07 6b c3 39 7a 17 85 03 e6 01 07 6c 2a 23 e1 4d bf 04 c8 01 06
E: 29.251574 62 0a 07 67 9d 23 e3 20 5b 04 bb 01 07 68 82 24 d4 29 13 05 22 02 07 69 2e 3e 1d 32 07 04 22 02 07 6a 86 2b b0 1a 44 04 d4 01 07 6b 22 3b 76 17 a4 03 bb 01 07 6c 73 24 d4 4d 31 05 d4 01 06
E: 29.268576 62 0a 07 67 e5 24 f0 20 89 04 90 01 07 68 17 26 c7 29 b7 04 08 02 07 69 bb 3f 2a 32 af 04 22 02 07 6a c7 2c c5 1a 81 04 bb 01 07 6b 63 3c 7e 17 ca 03 e1 01 07 6c 9d 25 d8 4d fc 04 a9 01 06
E: 29.285581 62 0a 07 67 1f 26 fd 20 1e 04 ea 01 07 68 60 27 c7 29 6e 05 ea 01 07 69 2a 41 37 32 98 04 c3 01 07 6a 26 2e db 1a 07 04 b2 01 07 6b b4 3d 94 17 40 03 90 01 07 6c f5 26 e5 4d 22 05 cc 01 06
E: 29.303579 62 0a 07 67 a4 27 0e 21 ca 03 04 02 07 68 a1 28 d4 29 e5 04 fb 01 07 69 82 42 44 32 5b 04 d9 01 07 6a 7e 2f f5 1a ff 03 e1 01 07 6b 13 3f a9 17 94 03 d4 01 07 6c ac 27 ee 4d 1a 05 e1 01 06
E: 29.304429 62 0a 07 6c 5c 28 f6 4d 1a 05 e1 01 00 00 00 00 00 00 00 00 00 00 00 00 00 00 00 00 00 00 00 00 00 00 00 00 00 00 00 00 00 00 00 00 00 00 00 00 00 00 00 00 00 00 00 00 00 00 00 00 00 00 06
E: 29.319573 62 0a 07 67 50 29 24 21 f0 03 bb 01 07 68 2e 2a f2 29 f4 04 d0 01 07 69 f1 43 4d 32 3d 04 ea 01 07 6a ce 30 13 1b a8 04 98 01 07 6b 7a 40 c7 17 9c 03 0c 02 07 6c 2a 29 ff 4d c6 04 bf 01 06
E: 29.337580 62 0a 07 67 bf 2a 35 21 e9 03 1e 02 07 68 e9 2b 19 2a 91 04 04 02 07 69 7e 45 51 32 4c 04 56 02 07 6a 2e 32 35 1b 81 04 d9 01 07 6b ca 41 ea 17 39 03 b6 01 07 6c bf 2a 0c 4e 48 05 e1 01 06
E: 29.354577 62 0a 07 67 3d 2c 42 21 35 04 f3 01 07 68 49 2d 3b 2a 6e 05 15 02 07 69 d6 46 55 32 44 04 f7 01 07 6a 8d 33 57 1b 85 03 69 01 07 6b 39 43 0c 18 6e 03 e6 01 07 6c 8e 2b 10 4e 03 05 b6 01 06
E: 29.355533 62 0a 07 6b 1f 44 1d 18 6e 03 e6 01 07 6c 45 2c 10 4e 03 05 b6 01 00 00 00 00 00 00 00 00 00 00 00 00 00 00 00 00 00 00 00 00 00 00 00 00 00 00 00 00 00 00 00 00 00 00 00 00 00 00 00 00 06
E: 29.369572 62 0a 07 67 86 2d 53 21 e9 03 b2 01 07 68 82 2e 5e 2a 31 05 f7 01 07 69 73 48 59 32 2d 04 fb 01 07 6a fc 34 76 1b 44 04 bf 01 07 6b e5 44 2f 18 7e 03 65 01 07 6c 0c 2d 0c 4e b7 04 72 01 06
E: 29.386576 62 0a 07 67 13 2f 64 21 2d 04 a5 01 07 68 1f 30 85 2a 29 05 3c 02 07 69 17 4a 5e 32 6a 04 b6 01 07 6a 6b 36 94 1b b7 04 d0 01 07 6b 35 46 3c 18 e9 03 11 02 07 6c 99 2e ff 4d 29 05 a1 01 06
E: 29.387428 62 0a 07 68 0c 31 9a 2a 29 05 3c 02 00 00 00 00 00 00 00 00 00 00 00 00 00 00 00 00 00 00 00 00 00 00 00 00 00 00 00 00 00 00 00 00 00 00 00 00 00 00 00 00 00 00 00 00 00 00 00 00 00 00 06
E: 29.403572 62 0a 07 67 8a 30 7e 21 54 04 f3 01 07 68 f8 31 ab 2a 1a 05 fb 01 07 69 95 4b 62 32 4c 04 1e 02 07 6a b4 37 a5 1b 2d 04 94 01 07 6b 67 47 44 18 76 03 90 01 07 6c c3 2f e9 4d 40 05 cc 01 06
E: 29.419573 62 0a 07 67 08 32 9c 21 f8 03 ee 01 07 68 7e 33 c9 2a 0b 05 d9 01 07 69 2a 4d 6b 32 54 04 cc 01 07 6a 32 39 b2 1b 94 03 ee 01 07 6b ed 48 48 18 48 03 9d 01 07 6c 2a 31 c3 4d ce 04 c8 01 06
E: 29.436565 62 0a 07 67 77 33 c3 21 16 04 dd 01 07 68 b7 34 db 2a 6e 05 37 02 07 69 dd 4e 7c 32 4c 04 49 02 07 6a e5 3a bf 1b ab 03 76 01 07 6b b0 4a 48 18 39 03 7e 01 07 6c 99 32 a0 4d 6a 04 9d 01 06
E: 29.451561 62 0a 07 67 0c 35 ee 21 d9 03 dd 01 07 68 36 36 f0 2a 31 05 37 02 07 69 b0 50 96 32 16 04 c8 01 07 6a a8 3c d0 1b 89 04 ee 01 07 6b 63 4c 4d 18 e9 03 76 01 07 6c da 33 8b 4d 50 05 94 01 06
E: 29.470562 62 0a 07 67 bf 36 19 22 f8 03 ee 01 07 68 08 38 0e 2b d5 04 1e 02 07 69 82 52 b4 32 7a 04 c3 01 07 6a 1f 3e e1 1b fc 04 a1 01 07 6b ca 4d 5a 18 85 03 08 02 07 6c 1b 35 82 4d e5 04 a1 01 06
E: 29.487560 62 0a 07 67 63 38 40 22 44 04 ea 01 07 68 e1 39 31 2b e5 04 dd 01 07 69 17 54 d2 32 26 04 f7 01 07 6a 9d 3f f7 1b 63 04 e1 01 07 6b 32 4f 78 18 9c 03 60 01 07 6c a1 36 7e 4d c6 04 a1 01 06
E: 29.502561 62 0a 07 67 e9 39 66 22 f8 03 d9 01 07 68 ac 3b 57 2b ce 04 f3 01 07 69 7e 55 e3 32 5b 04 ee 01 07 6a 2a 41 15 1c e1 03 65 01 07 6b b0 50 9f 18 ab 03 d4 01 07 6c 3d 38 75 4d 16 04 7e 01 06
E: 29.503550 62 0a 07 6b 8d 51 b4 18 ab 03 d4 01 00 00 00 00 00 00 00 00 00 00 00 00 00 00 00 00 00 00 00 00 00 00 00 00 00 00 00 00 00 00 00 00 00 00 00 00 00 00 00 00 00 00 00 00 00 00 00 00 00 00 06
E: 29.519561 62 0a 07 67 49 3b 89 22 b3 03 bf 01 07 68 41 3d 75 2b 40 05 08 02 07 69 bf 56 ec 32 89 04 a1 01 07 6a d6 42 37 1c c2 03 a1 01 07 6b 6b 52 ca 18 2a 03 28 01 07 6c bb 39 6d 4d f4 04 a9 01 06
E: 29.536561 62 0a 07 67 d6 3c a7 22 07 04 ee 01 07 68 73 3e 87 2b ec 04 56 02 07 69 17 58 ec 32 d9 03 a1 01 07 6a 45 44 4d 1c bf 04 9d 01 07 6b e1 53 ec 18 b3 03 bf 01 07 6c 2a 3b 5b 4d 39 05 83 01 06
E: 29.552580 62 0a 07 67 4c 3e b8 22 d2 03 0c 02 07 68 da 3f 94 2b 03 05 26 02 07 69 b3 59 e7 32 7a 04 dd 01 07 6a 0b 45 55 1c 5b 04 a1 01 07 6b fc 54 fd 18 ab 03 87 01 07 6c c7 3c 46 4d 1a 05 a5 01 06
E: 29.553534 62 0a 07 6a e1 45 5e 1c 5b 04 a1 01 00 00 00 00 00 00 00 00 00 00 00 00 00 00 00 00 00 00 00 00 00 00 00 00 00 00 00 00 00 00 00 00 00 00 00 00 00 00 00 00 00 00 00 00 00 00 00 00 00 00 06
E: 29.569561 62 0a 07 67 b4 3f c1 22 f8 03 04 02 07 68 50 41 9c 2b 50 05 2f 02 07 69 0b 5b e3 32 3d 04 f7 01 07 6a c7 46 67 1c 85 03 76 01 07 6b 4c 56 06 19 13 03 65 01 07 6c 8a 3e 2c 4d 7a 04 a1 01 06
E: 29.586562 62 0a 07 67 e5 40 c9 22 f8 03 e1 01 07 68 b7 42 a5 2b 13 05 f3 01 07 69 6b 5c e3 32 81 04 d0 01 07 6a 63 48 73 1c 3d 04 35 01 07 6b 95 57 06 19 67 03 33 02 07 6c 35 40 1b 4d 54 04 dd 01 06
E: 29.587550 62 0a 07 6c 22 41 12 4d 54 04 dd 01 00 00 00 00 00 00 00 00 00 00 00 00 00 00 00 00 00 00 00 00 00 00 00 00 00 00 00 00 00 00 00 00 00 00 00 00 00 00 00 00 00 00 00 00 00 00 00 00 00 00 06
E: 29.603560 62 0a 07 67 26 42 d2 22 26 04 9d 01 07 68 e9 43 ad 2b 98 04 ea 01 07 69 b3 5d e3 32 e9 03 b6 01 07 6a bb 49 7c 1c 4c 04 53 01 07 6b dd 58 0a 19 d2 03 87 01 07 6c 00 42 0a 4d e1 03 9d 01 06
E: 29.619559 62 0a 07 67 95 43 df 22 35 04 87 01 07 68 5f 45 b2 2b fc 04 d4 01 07 69 fc 5e df 32 07 04 19 02 07 6a fc 4a 85 1c e1 03 76 01 07 6b 35 5a 13 19 50 03 31 01 07 6c 7e 43 fd 4c dd 04 a5 01 06
E: 29.635560 62 0a 07 67 b7 44 ec 22 07 04 ae 01 07 68 a0 46 b6 2b ce 04 fb 01 07 69 00 60 db 32 0f 04 7e 01 07 6a 45 4c 92 1c ec 04 72 01 07 6b 7e 5b 20 19 e1 03 67 02 07 6c ed 44 ec 4c ec 04 bb 01 06
E: 29.653562 62 0a 07 67 e9 45 f9 22 8d 03 a1 01 07 68 b4 47 bf 2b a0 04 ff 01 07 69 91 60 db 32 16 04 a9 01 07 6a 67 4d a7 1c 6a 04 bf 01 07 6b a0 5c 2c 19 ab 03 ae 01 07 6c 5c 46 da 4c 81 04 b2 01 06
E: 29.654549 62 0a 07 69 41 61 db 32 16 04 a9 01 00 00 00 00 00 00 00 00 00 00 00 00 00 00 00 00 00 00 00 00 00 00 00 00 00 00 00 00 00 00 00 00 00 00 00 00 00 00 00 00 00 00 00 00 00 00 00 00 00 00 06
E: 29.669559 62 0a 07 67 2a 47 0a 23 26 04 90 01 07 68 bf 48 cc 2b 03 05 d9 01 07 69 00 62 db 32 91 04 cc 01 07 6a ce 4e c1 1c 8d 03 cc 01 07 6b f8 5d 3e 19 03 03 24 01 07 6c da 47 c9 4c 4c 04 83 01 06
E: 29.685560 62 0a 07 67 6b 48 1b 23 e1 03 94 01 07 68 67 49 d8 2b 54 04 ee 01 07 69 8d 63 db 32 a8 04 cc 01 07 6a 3d 50 db 1c 44 04 8b 01 07 6b 41 5f 53 19 bb 03 5a 02 07 6c 22 49 c1 4c 39 05 a1 01 06
E: 29.686553 62 0a 07 68 2e 4a e5 2b 54 04 ee 01 00 00 00 00 00 00 00 00 00 00 00 00 00 00 00 00 00 00 00 00 00 00 00 00 00 00 00 00 00 00 00 00 00 00 00 00 00 00 00 00 00 00 00 00 00 00 00 00 00 00 06
E: 29.703561 62 0a 07 67 9d 49 2c 23 94 03 87 01 07 68 0b 4b f2 2b 5b 04 ff 01 07 69 f4 64 e3 32 35 04 a9 01 07 6a 76 51 f5 1c 16 04 a5 01 07 6b 7a 60 69 19 9c 03 bf 01 07 6c 54 4a c5 4c 89 04 c3 01 06
E: 29.720560 62 0a 07 67 ce 4a 3e 23 c2 03 5c 01 07 68 73 4c 0c 2c c6 04 d9 01 07 69 17 66 f4 32 89 04 d9 01 07 6a 99 52 0e 1d f0 03 c3 01 07 6b a4 61 83 19 31 03 24 01 07 6c a4 4b d2 4c 5b 04 d9 01 06
E: 29.735562 62 0a 07 67 e1 4b 4f 23 c2 03 94 01 07 68 22 4d 19 2c af 04 dd 01 07 69 58 67 12 33 16 04 6d 01 07 6a c3 53 24 1d 89 04 a1 01 07 6b bf 62 a5 19 16 04 fb 01 07 6c ce 4c da 4c 22 05 d0 01 06
E: 29.736549 62 0a 07 68 da 4d 2a 2c af 04 dd 01 00 00 00 00 00 00 00 00 00 00 00 00 00 00 00 00 00 00 00 00 00 00 00 00 00 00 00 00 00 00 00 00 00 00 00 00 00 00 00 00 00 00 00 00 00 00 00 00 00 00 06
E: 29.753577 62 0a 07 67 e5 4c 60 23 e9 03 42 01 07 68 63 4e 33 2c b7 04 d0 01 07 69 a8 68 35 33 35 04 d0 01 07 6a ce 54 35 1d d9 03 d0 01 07 6b da 63 cc 19 7e 03 3a 01 07 6c d2 4d d6 4c 2d 04 c8 01 06
E: 29.768561 62 0a 07 67 bb 4d 71 23 5f 03 94 01 07 68 1b 4f 44 2c 1a 05 ff 01 07 69 9c 69 4a 33 54 04 7e 01 07 6a 9c 55 42 1d d2 03 d0 01 07 6b dd 64 f2 19 16 04 44 02 07 6c c7 4e c9 4c a8 04 ee 01 06
E: 29.784561 62 0a 07 67 1e 4e 76 23 8d 03 69 01 07 68 35 50 5a 2c 5b 04 b2 01 07 69 0f 6a 53 33 a0 04 90 01 07 6a f8 55 46 1d 72 04 d9 01 07 6b 7e 65 08 1a a4 03 40 02 07 6c 39 4f c5 4c 0b 05 bf 01 06
E: 29.802561 62 0a 07 67 b7 4e 7e 23 e1 03 90 01 07 68 bf 50 62 2c ce 04 b2 01 07 69 fc 6a 5c 33 54 04 a1 01 07 6a 91 56 4f 1d 1e 04 7a 01 07 6b c3 65 0c 1a 40 03 56 02 07 6c 1e 50 bc 4c 35 04 b6 01 06
E: 29.820560 62 0a 07 67 1b 4f 82 23 ff 03 94 01 07 68 50 51 6f 2c 48 05 bf 01 07 69 50 6b 60 33 6a 04 9d 01 07 6a ed 56 53 1d c2 03 4f 01 07 6b 54 66 11 1a ca 03 62 02 07 6c 22 51 b4 4c af 04 bb 01 06
E: 29.836561 62 0a 07 67 ca 4f 8b 23 7e 03 98 01 07 68 7e 51 73 2c ce 04 04 02 07 69 58 6b 60 33 91 04 a5 01 07 6a 9c 57 5c 1d f0 03 5c 01 07 6b 91 66 11 1a b3 03 49 02 07 6c 76 51 af 4c bf 04 a9 01 06
E: 29.851557 62 0a 07 67 08 50 8f 23 94 03 a1 01 07 68 a4 51 78 2c 6a 04 11 02 07 69 50 6b 60 33 98 04 ea 01 07 6a da 57 60 1d e9 03 87 01 07 6b 91 66 11 1a 85 03 4d 02 07 6c 76 51 af 4c e5 04 a5 01 06
E: 29.868559 62 0a 07 67 08 50 8f 23 ab 03 bb 01 07 68 35 52 80 2c 89 04 19 02 07 69 48 6b 60 33 a8 04 e1 01 07 6a da 57 60 1d 07 04 7e 01 07 6b 89 66 11 1a 9c 03 56 02 07 6c 67 51 af 4c f4 04 a5 01 06
E: 29.884558 62 0a 07 67 00 50 8f 23 a4 03 bf 01 07 68 72 52 85 2c a0 04 22 02 07 69 48 6b 60 33 a8 04 d4 01 07 6a d2 57 60 1d 1e 04 69 01 07 6b 89 66 11 1a ab 03 5a 02 07 6c 5f 51 af 4c f4 04 a1 01 06
E: 29.901556 62 0a 07 67 00 50 8f 23 ca 03 69 01 07 68 7a 52 85 2c 81 04 26 02 07 69 48 6b 60 33 af 04 c3 01 07 6a d2 57 60 1d 26 04 ae 01 07 6b 89 66 11 1a ab 03 22 02 07 6c 5f 51 af 4c f4 04 a1 01 06
E: 29.918558 62 0a 07 67 00 50 8f 23 b3 03 d0 01 07 68 72 52 85 2c d5 04 2b 02 07 69 48 6b 60 33 af 04 bb 01 07 6a d2 57 60 1d 16 04 72 01 07 6b 89 66 11 1a ab 03 22 02 07 6c 5f 51 af 4c d5 04 a1 01 06
E: 29.934556 62 0a 07 67 00 50 8f 23 a4 03 cc 01 07 68 72 52 85 2c ce 04 26 02 07 69 48 6b 60 33 bf 04 bb 01 07 6a d2 57 60 1d 07 04 53 01 07 6b 89 66 11 1a a4 03 5a 02 07 6c 5f 51 af 4c d5 04 a5 01 06
E: 29.951556 62 0a 07 67 00 50 8f 23 9c 03 d0 01 07 68 72 52 85 2c e5 04 1e 02 07 69 48 6b 60 33 89 04 bb 01 07 6a d2 57 60 1d 1e 04 87 01 07 6b 89 66 11 1a b3 03 5a 02 07 6c 5f 51 af 4c d5 04 a5 01 06
E: 29.969557 62 0a 07 67 00 50 8f 23 a4 03 d4 01 07 68 72 52 85 2c c6 04 fb 01 07 69 48 6b 60 33 98 04 b2 01 07 6a d2 57 60 1d f8 03 83 01 07 6b 89 66 11 1a 9c 03 1e 02 07 6c 5f 51 af 4c b7 04 a5 01 06
E: 29.985559 62 0a 07 67 00 50 8f 23 ab 03 d0 01 07 68 72 52 85 2c fc 04 2f 02 07 69 48 6b 60 33 91 04 ae 01 07 6a d2 57 60 1d 0f 04 69 01 07 6b 89 66 11 1a bb 03 1e 02 07 6c 5f 51 af 4c 98 04 a5 01 06
E: 30.001556 62 0a 07 67 00 50 8f 23 ab 03 c3 01 07 68 72 52 85 2c d5 04 26 02 07 69 48 6b 60 33 72 04 a1 01 07 6a d2 57 60 1d 26 04 83 01 07 6b a8 66 11 1a c2 03 fb 01 07 6c 5f 51 af 4c af 04 a1 01 06
E: 30.017556 62 0a 07 67 00 50 8f 23 94 03 bb 01 07 68 72 52 85 2c a8 04 ea 01 07 69 48 6b 60 33 81 04 98 01 07 6a d2 57 60 1d 35 04 8b 01 07 6b 39 67 15 1a ab 03 0c 02 07 6c 5f 51 af 4c b7 04 9d 01 06
E: 30.034555 62 0a 07 67 00 50 8f 23 ab 03 b2 01 07 68 72 52 85 2c af 04 15 02 07 69 48 6b 60 33 81 04 9d 01 07 6a d2 57 60 1d 35 04 94 01 07 6b 76 67 15 1a 8d 03 2f 02 07 6c 5f 51 af 4c 98 04 9d 01 06
E: 30.050556 62 0a 07 67 26 50 8f 23 07 04 b2 01 07 68 72 52 85 2c 7a 04 15 02 07 69 48 6b 60 33 f8 03 4f 01 07 6a d2 57 60 1d 89 04 8b 01 07 6b 76 67 15 1a ca 03 37 02 07 6c 5f 51 af 4c bf 04 9d 01 06
E: 30.069556 62 0a 07 67 dd 50 94 23 85 01 7e 01 04 68 7a 52 80 2c 7a 04 15 02 07 69 85 6b 64 33 72 00 65 01 07 6a 0f 58 60 1d 9c 03 90 01 07 6b 6e 67 15 1a b7 00 a3 00 07 6c 5f 51 af 4c af 04 94 01 06
E: 30.084541 62 0a 04 67 22 51 ba 23 85 01 7e 01 04 69 ed 6c b6 33 72 00 65 01 04 6a 58 59 9c 1d 9c 03 90 01 04 6b bb 67 22 1a b7 00 a3 00 07 6c 5f 51 af 4c 63 02 c3 01 00 00 00 00 00 00 00 00 00 00 05
E: 30.097544 62 0a 04 6c 86 51 80 4c 63 02 c3 01 00 00 00 00 00 00 00 00 00 00 00 00 00 00 00 00 00 00 00 00 00 00 00 00 00 00 00 00 00 00 00 00 00 00 00 00 00 00 00 00 00 00 00 00 00 00 00 00 00 00 01
# Thank you.
