R: 324 05 01 09 02 a1 01 85 10 09 01 a1 00 05 09 19 01 29 02 15 00 25 01 95 02 75 01 81 02 95 06 81 03 05 01 09 30 09 31 15 00 26 ff 7f 75 10 95 02 81 02 c0 c0 05 0d 09 04 a1 01 85 30 09 22 a1 02 09 42 15 00 25 01 75 01 95 01 81 02 09 32 81 02 09 47 81 02 95 05 81 03 09 51 75 08 95 01 81 02 05 01 09 30 26 ff 7f 55 0f 65 11 35 00 46 51 02 75 10 95 01 81 02 09 31 35 00 46 73 01 81 02 c0 a1 02 05 0d 09 42 15 00 25 01 75 01 95 01 81 02 09 32 81 02 09 47 81 02 95 05 81 03 09 51 75 08 95 01 81 02 05 01 09 30 26 ff 7f 55 0f 65 11 35 00 46 51 02 75 10 95 01 81 02 09 31 35 00 46 73 01 81 02 c0 05 0d 09 54 15 00 26 02 00 75 08 95 01 81 02 85 03 09 55 15 00 26 ff 00 75 08 95 01 b1 02 c0 05 0d 09 0e a1 01 85 02 09 52 09 53 15 00 26 ff 00 75 08 95 02 b1 02 c0 05 0d 09 02 a1 01 85 20 09 20 a1 00 09 42 15 00 25 01 75 01 95 01 81 02 95 07 81 03 05 01 09 30 26 ff 7f 55 0f 65 11 35 00 46 51 02 75 10 95 01 81 02 09 31 35 00 46 73 01 81 02 85 01 06 00 ff 09 01 75 08 95 01 b1 02 c0 c0
N: Beijing IRTOUCHSYSTEMS Co.,LtD IRTOUCH InfraRed USB TouchScreen
I: 3 6615 0070
E: 83985.345954 14 30 07 00 5b 1a e3 09 00 01 bf 32 93 1d 01
E: 83985.371932 14 30 07 00 e3 19 e3 09 00 01 bf 32 93 1d 01
E: 83985.397930 14 30 07 00 e3 19 e3 09 00 01 bf 32 93 1d 01
E: 83985.423929 14 30 07 00 6f 19 0f 09 00 01 bf 32 93 1d 01
E: 83985.449983 14 30 07 00 6f 19 0f 09 00 01 bf 32 93 1d 01
E: 83985.475954 14 30 07 00 6f 19 0f 09 00 01 bf 32 93 1d 01
E: 83985.501931 14 30 07 00 fb 18 0f 09 00 01 bf 32 93 1d 01
E: 83985.527957 14 30 07 00 fb 18 0f 09 00 01 bf 32 93 1d 01
E: 83985.552934 14 30 07 00 87 18 3b 08 00 01 bf 32 93 1d 01
E: 83985.579054 14 30 07 00 87 18 3b 08 00 01 bf 32 93 1d 01
E: 83985.604932 14 30 07 00 87 18 6b 07 00 01 bf 32 93 1d 01
E: 83985.630930 14 30 07 00 87 18 6b 07 00 01 bf 32 93 1d 01
E: 83985.657029 14 30 07 00 87 18 6b 07 00 01 bf 32 93 1d 01
E: 83985.682952 14 30 07 00 87 18 6b 07 00 01 bf 32 93 1d 01
E: 83985.709034 14 30 07 00 6f 19 9b 06 00 01 bf 32 93 1d 01
E: 83985.735032 14 30 07 00 5b 1a 9b 06 00 01 bf 32 93 1d 01
E: 83985.760934 14 30 07 00 5b 1a 9b 06 00 01 bf 32 93 1d 01
E: 83985.786957 14 30 07 00 47 1b 9b 06 00 01 bf 32 93 1d 01
E: 83985.813021 14 30 07 00 47 1b 9b 06 00 01 bf 32 93 1d 01
E: 83985.839035 14 30 07 00 47 1b 9b 06 00 01 bf 32 93 1d 01
E: 83985.865034 14 30 07 00 bb 1b 9b 06 00 01 bf 32 93 1d 01
E: 83985.891022 14 30 07 00 33 1c 9b 06 00 01 bf 32 93 1d 01
E: 83985.917035 14 30 07 00 bb 1b 9b 06 00 01 bf 32 93 1d 01
E: 83985.942930 14 30 07 00 bb 1b 6b 07 00 01 bf 32 93 1d 01
E: 83985.968938 14 30 07 00 bb 1b 6b 07 00 01 bf 32 93 1d 01
E: 83985.995023 14 30 07 00 bb 1b 6b 07 00 01 bf 32 93 1d 01
E: 83986.020935 14 30 07 00 bb 1b 3b 08 00 01 bf 32 93 1d 01
E: 83986.046954 14 30 07 00 d3 1a 0f 09 00 01 bf 32 93 1d 01
E: 83986.073018 14 30 07 00 d3 1a e3 09 00 01 bf 32 93 1d 01
E: 83986.099032 14 30 07 00 d3 1a e3 09 00 01 bf 32 93 1d 01
E: 83986.125021 14 30 07 00 d3 1a b3 0a 00 01 bf 32 93 1d 01
E: 83986.151034 14 30 07 00 5b 1a b3 0a 00 01 bf 32 93 1d 01
E: 83986.177046 14 30 07 00 5b 1a b3 0a 00 01 bf 32 93 1d 01
E: 83986.203034 14 30 07 00 5b 1a 87 0b 00 01 bf 32 93 1d 01
E: 83986.229029 14 30 06 00 5b 1a 87 0b 00 01 bf 32 93 1d 01
E: 83988.306961 14 30 07 00 af 3e b7 13 00 01 bf 32 93 1d 01
E: 83988.332939 14 30 07 00 27 3f 8b 14 00 01 bf 32 93 1d 01
E: 83988.358963 14 30 07 00 27 3f 8b 14 00 01 bf 32 93 1d 01
E: 83988.385048 14 30 07 00 27 3f 5b 15 00 01 bf 32 93 1d 01
E: 83988.409936 14 30 07 00 af 3e 5b 15 00 01 bf 32 93 1d 01
E: 83988.435965 14 30 07 00 3b 3e 5b 15 00 01 bf 32 93 1d 01
E: 83988.461939 14 30 07 00 3b 3e 5b 15 00 01 bf 32 93 1d 01
E: 83988.487942 14 30 07 00 3b 3e 5b 15 00 01 bf 32 93 1d 01
E: 83988.513958 14 30 07 00 3b 3e 5b 15 00 01 bf 32 93 1d 01
E: 83988.540049 14 30 07 00 3b 3e 2f 16 00 01 bf 32 93 1d 01
E: 83988.566024 14 30 07 00 3b 3e 2f 16 00 01 bf 32 93 1d 01
E: 83988.591939 14 30 07 00 53 3d 2f 16 00 01 bf 32 93 1d 01
E: 83988.617960 14 30 07 00 53 3d 03 17 00 01 bf 32 93 1d 01
E: 83988.644028 14 30 07 00 53 3d 03 17 00 01 bf 32 93 1d 01
E: 83988.670053 14 30 07 00 53 3d d3 17 00 01 bf 32 93 1d 01
E: 83988.696039 14 30 07 00 3b 3e a3 18 00 01 bf 32 93 1d 01
E: 83988.721940 14 30 07 00 3b 3e 77 19 00 01 bf 32 93 1d 01
E: 83988.747960 14 30 07 00 3b 3e 4b 1a 00 01 bf 32 93 1d 01
E: 83988.773940 14 30 07 00 3b 3e eb 1b 00 01 bf 32 93 1d 01
E: 83988.799941 14 30 07 00 3b 3e 93 1d 00 01 bf 32 93 1d 01
E: 83988.825992 14 30 07 00 3b 3e 63 1e 00 01 bf 32 93 1d 01
E: 83988.851938 14 30 07 00 3b 3e 33 1f 00 01 bf 32 93 1d 01
E: 83988.877945 14 30 07 00 c7 3d db 20 00 01 bf 32 93 1d 01
E: 83988.903965 14 30 07 00 c7 3d ab 21 00 01 bf 32 93 1d 01
E: 83988.929939 14 30 07 00 53 3d ab 21 00 01 bf 32 93 1d 01
E: 83988.956049 14 30 07 00 53 3d 4f 23 00 01 bf 32 93 1d 01
E: 83988.982040 14 30 07 00 df 3c 4f 23 00 01 bf 32 93 1d 01
E: 83989.008047 14 30 07 00 df 3c 1f 24 00 01 bf 32 93 1d 01
E: 83989.034040 14 30 07 00 ef 3b 1f 24 00 01 bf 32 93 1d 01
E: 83989.060041 14 30 07 00 ef 3b f3 24 00 01 bf 32 93 1d 01
E: 83989.085950 14 30 07 00 07 3b f3 24 00 01 bf 32 93 1d 01
E: 83989.111990 14 30 07 00 07 3b f3 24 00 01 bf 32 93 1d 01
E: 83989.137938 14 30 07 00 17 3a c7 25 00 01 bf 32 93 1d 01
E: 83989.163937 14 30 07 00 17 3a c7 25 00 01 bf 32 93 1d 01
E: 83989.190034 14 30 07 00 2f 39 c7 25 00 01 bf 32 93 1d 01
E: 83989.216043 14 30 07 00 2f 39 97 26 00 01 bf 32 93 1d 01
E: 83989.242055 14 30 07 00 3f 38 97 26 00 01 bf 32 93 1d 01
E: 83989.268044 14 30 07 00 cb 37 97 26 00 01 bf 32 93 1d 01
E: 83989.294047 14 30 07 00 57 37 97 26 00 01 bf 32 93 1d 01
E: 83989.320028 14 30 07 00 df 36 97 26 00 01 bf 32 93 1d 01
E: 83989.345942 14 30 07 00 67 36 97 26 00 01 bf 32 93 1d 01
E: 83989.370962 14 30 07 00 7f 35 6b 27 00 01 bf 32 93 1d 01
E: 83989.396941 14 30 07 00 0b 35 6b 27 00 01 bf 32 93 1d 01
E: 83989.422991 14 30 07 00 97 34 6b 27 00 01 bf 32 93 1d 01
E: 83989.448942 14 30 07 00 1f 34 3b 28 00 01 bf 32 93 1d 01
E: 83989.474962 14 30 07 00 33 33 3b 28 00 01 bf 32 93 1d 01
E: 83989.500945 14 30 07 00 bf 32 0f 29 00 01 bf 32 93 1d 01
E: 83989.526939 14 30 07 00 cf 31 df 29 00 01 bf 32 93 1d 01
E: 83989.552993 14 30 06 00 cf 31 df 29 00 01 bf 32 93 1d 01
E: 83990.020969 14 30 07 00 df 36 0f 29 00 01 bf 32 93 1d 01
E: 83990.046955 14 30 07 00 cb 37 3b 28 00 01 bf 32 93 1d 01
E: 83990.072944 14 30 07 00 b7 38 97 26 00 01 bf 32 93 1d 01
E: 83990.098942 14 30 07 00 a3 39 c7 25 00 01 bf 32 93 1d 01
E: 83990.125045 14 30 07 00 07 3b c7 25 00 01 bf 32 93 1d 01
E: 83990.150046 14 30 06 00 07 3b c7 25 00 01 bf 32 93 1d 01
E: 83991.552947 14 30 07 00 53 3d e7 12 00 01 bf 32 93 1d 01
E: 83991.578963 14 30 07 00 53 3d e7 12 00 01 bf 32 93 1d 01
E: 83991.604949 14 30 07 00 53 3d e7 12 00 01 bf 32 93 1d 01
E: 83991.630944 14 30 07 00 db 3c e7 12 00 01 bf 32 93 1d 01
E: 83991.657041 14 30 07 00 67 3c e7 12 00 01 bf 32 93 1d 01
E: 83991.682944 14 30 07 00 db 3c e7 12 00 01 bf 32 93 1d 01
E: 83991.708973 14 30 07 00 db 3c bb 13 00 01 bf 32 93 1d 01
E: 83991.734966 14 30 07 00 53 3d bb 13 00 01 bf 32 93 1d 01
E: 83991.760948 14 30 07 00 53 3d bb 13 00 01 bf 32 93 1d 01
E: 83991.786945 14 30 07 00 53 3d bb 13 00 01 bf 32 93 1d 01
E: 83991.813000 14 30 07 00 53 3d bb 13 00 01 bf 32 93 1d 01
E: 83991.838966 14 30 07 00 53 3d 8b 14 00 01 bf 32 93 1d 01
E: 83991.864947 14 30 07 00 3b 3e 8b 14 00 01 bf 32 93 1d 01
E: 83991.890945 14 30 07 00 3b 3e 5f 15 00 01 bf 32 93 1d 01
E: 83991.916998 14 30 06 00 3b 3e 5f 15 00 01 bf 32 93 1d 01
E: 83991.969059 14 30 07 00 f7 2f 5f 15 00 01 bf 32 93 1d 01
E: 83991.994046 14 30 07 00 f7 2f 5f 15 00 01 bf 32 93 1d 01
E: 83992.020951 14 30 07 00 e7 30 5f 15 00 01 bf 32 93 1d 01
E: 83992.435962 14 30 07 00 a7 33 1f 24 00 01 bf 32 93 1d 01
E: 83992.461950 14 30 07 00 cf 31 1f 24 00 01 bf 32 93 1d 01
E: 83992.488047 14 30 06 00 cf 31 1f 24 00 01 bf 32 93 1d 01
E: 83994.306052 14 30 07 00 57 37 87 0b 00 01 bf 32 93 1d 01
E: 83994.331947 14 30 07 00 53 37 fb 0d 00 01 bf 32 93 1d 01
E: 83994.357978 14 30 07 00 53 37 9f 0f 00 01 bf 32 93 1d 01
E: 83994.383948 14 30 07 00 53 37 43 11 00 01 bf 32 93 1d 01
E: 83994.409974 14 30 07 00 53 37 e7 12 00 01 bf 32 93 1d 01
E: 83994.464954 14 30 07 00 53 37 03 17 07 01 b3 27 bf 1c 02
E: 83994.516962 14 30 07 00 53 37 4b 1a 07 01 9b 28 4b 1a 02
E: 83994.542951 14 30 07 00 53 37 47 1a 07 01 9b 28 47 1a 02
E: 83994.568973 14 30 07 00 53 37 4b 1a 07 01 8b 29 4b 1a 02
E: 83994.595054 14 30 07 00 53 37 63 1e 07 01 8b 29 03 17 02
E: 83994.621053 14 30 07 00 df 36 ab 21 07 01 73 2a 2f 16 02
E: 83994.646955 14 30 07 00 df 36 4f 23 07 01 63 2b 5b 15 02
E: 83994.672952 14 30 07 00 df 36 1f 24 07 01 63 2b 5b 15 02
E: 83994.699060 14 30 07 00 f3 35 97 26 07 01 4b 2c bb 13 02
E: 83994.724952 14 30 07 00 0b 35 67 27 07 01 c3 2c bb 13 02
E: 83994.751003 14 30 07 00 0b 35 0f 29 07 01 3b 2d bb 13 02
E: 83994.776953 14 30 07 00 1f 34 df 29 07 01 23 2e bb 13 02
E: 83994.802951 14 30 07 00 33 33 af 2a 07 01 23 2e e7 12 02
E: 83994.829040 14 30 07 00 bb 32 83 2b 07 01 0f 2f 13 12 02
E: 83994.881041 14 30 07 00 6f 30 53 2c 07 01 6f 30 13 12 02
E: 83994.907066 14 30 07 00 e3 30 53 2c 07 01 e3 30 13 12 02
E: 83994.933053 14 30 07 00 e7 30 53 2c 07 01 e7 30 13 12 02
E: 83994.959036 14 30 07 00 9b 2e 53 2c 07 01 bb 32 13 12 02
E: 83994.983951 14 30 07 00 af 2d b3 2a 07 01 ab 33 e7 12 02
E: 83995.010063 14 30 07 00 3b 2d b3 2a 07 01 93 34 e7 12 02
E: 83995.035948 14 30 07 00 c3 2c df 29 07 01 0b 35 e7 12 02
E: 83995.061960 14 30 07 00 4b 2c 0b 29 07 01 0b 35 17 12 02
E: 83995.085952 14 30 07 00 4b 2c 0b 29 06 01 0b 35 17 12 02
E: 83995.111018 14 30 07 00 d7 2b 0b 29 00 01 0b 35 17 12 01
E: 83995.192063 14 30 07 00 c3 2c 83 2b 07 01 97 34 17 12 02
E: 83995.218055 14 30 07 00 af 2d 83 2b 07 01 1f 34 43 11 02
E: 83995.244066 14 30 07 00 9b 2e 27 2d 07 01 33 33 43 11 02
E: 83995.270047 14 30 07 00 f7 2f f7 2d 07 01 33 33 43 11 02
E: 83995.293048 14 30 06 00 f7 2f f7 2d 07 01 d3 31 43 11 02
E: 83995.318953 14 30 00 00 f7 2f f7 2d 07 01 6f 30 43 11 02
E: 83995.344979 14 30 00 00 f7 2f f7 2d 07 01 fb 2f 43 11 02
E: 83995.371055 14 30 00 00 f7 2f f7 2d 07 01 fb 2f 43 11 02
E: 83995.452066 14 30 07 00 df 36 3b 28 07 01 3b 2d e7 12 02
E: 83995.477975 14 30 07 00 57 37 97 26 07 01 4b 2c 8b 14 02
E: 83995.503964 14 30 07 00 cb 37 f3 24 07 01 63 2b 8b 14 02
E: 83995.529954 14 30 07 00 cb 37 23 24 07 01 73 2a 2f 16 02
E: 83995.556061 14 30 07 00 53 37 7b 22 07 01 ff 29 ff 16 02
E: 83995.582055 14 30 07 00 df 36 7b 22 07 01 13 29 d3 17 02
E: 83995.608054 14 30 07 00 df 36 7b 22 07 01 13 29 a7 18 02
E: 83995.631042 14 30 07 00 df 36 7b 22 06 01 13 29 a7 18 02
E: 83995.657055 14 30 07 00 df 36 7b 22 00 01 13 29 a7 18 01
E: 83995.683055 14 30 07 00 df 36 7b 22 00 01 13 29 a7 18 01
E: 83995.709068 14 30 07 00 df 36 7b 22 00 01 13 29 a7 18 01
E: 83995.735054 14 30 07 00 df 36 4f 23 00 01 13 29 a7 18 01
E: 83995.761045 14 30 07 00 df 36 23 24 00 01 13 29 a7 18 01
E: 83995.787049 14 30 07 00 53 37 23 24 00 01 13 29 a7 18 01
E: 83995.812976 14 30 07 00 53 37 f3 24 00 01 13 29 a7 18 01
E: 83995.838960 14 30 07 00 cb 37 f3 24 00 01 13 29 a7 18 01
E: 83995.864956 14 30 07 00 cb 37 c7 25 00 01 13 29 a7 18 01
E: 83995.890978 14 30 07 00 57 37 c7 25 00 01 13 29 a7 18 01
E: 83995.915990 14 30 06 00 57 37 c7 25 00 01 13 29 a7 18 01
E: 83995.942070 14 30 07 00 57 37 c7 25 00 01 13 29 a7 18 01
E: 83996.592069 14 30 07 00 f7 2f c7 25 00 01 13 29 a7 18 01
E: 83996.774060 14 30 07 00 4f 2c df 29 00 01 13 29 a7 18 01
E: 83996.799957 14 30 07 00 af 2d df 29 00 01 13 29 a7 18 01
E: 83996.825956 14 30 07 00 83 2f b3 2a 00 01 13 29 a7 18 01
E: 83996.906071 14 30 07 00 33 33 0b 29 07 01 6f 30 6f 10 02
E: 83996.932057 14 30 07 00 1f 34 0b 29 07 01 fb 2f 43 11 02
E: 83996.958057 14 30 07 00 97 34 3b 28 07 01 0f 2f 43 11 02
E: 83996.983954 14 30 07 00 f3 35 6b 27 07 01 9b 2e 43 11 02
E: 83997.010076 14 30 07 00 df 36 c3 25 07 01 23 2e e7 12 02
E: 83997.035954 14 30 07 00 57 37 f3 24 07 01 af 2d e7 12 02
E: 83997.061959 14 30 07 00 cb 37 23 24 07 01 3b 2d 8b 14 02
E: 83997.088058 14 30 07 00 cb 37 7b 22 07 01 4b 2c 5f 15 02
E: 83997.114045 14 30 07 00 b7 38 7b 22 07 01 d7 2b ff 16 02
E: 83997.140071 14 30 07 00 b7 38 db 20 07 01 5f 2b a7 18 02
E: 83997.189058 14 30 07 00 b7 38 33 1f 06 01 5f 2b a7 18 02
E: 83997.215046 14 30 07 00 43 38 33 1f 00 01 5f 2b a7 18 01
E: 83997.241057 14 30 07 00 43 38 33 1f 00 01 5f 2b a7 18 01
E: 83997.267071 14 30 07 00 43 38 33 1f 00 01 5f 2b a7 18 01
E: 83997.292959 14 30 07 00 43 38 33 1f 00 01 5f 2b a7 18 01
E: 83997.318980 14 30 07 00 b7 38 33 1f 00 01 5f 2b a7 18 01
E: 83997.344979 14 30 07 00 b7 38 33 1f 00 01 5f 2b a7 18 01
E: 83997.370971 14 30 07 00 2b 39 33 1f 00 01 5f 2b a7 18 01
E: 83997.396964 14 30 07 00 2b 39 33 1f 00 01 5f 2b a7 18 01
E: 83997.422958 14 30 07 00 2b 39 07 20 00 01 5f 2b a7 18 01
E: 83997.449083 14 30 07 00 2b 39 ab 21 00 01 5f 2b a7 18 01
E: 83997.474956 14 30 07 00 2b 39 7b 22 00 01 5f 2b a7 18 01
E: 83997.500959 14 30 07 00 2b 39 4f 23 00 01 5f 2b a7 18 01
E: 83997.527009 14 30 07 00 b7 38 23 24 00 01 5f 2b a7 18 01
E: 83997.553060 14 30 07 00 b7 38 f3 24 00 01 5f 2b a7 18 01
E: 83997.579072 14 30 07 00 43 38 c3 25 00 01 5f 2b a7 18 01
E: 83997.605058 14 30 07 00 cb 37 97 26 00 01 5f 2b a7 18 01
E: 83997.631058 14 30 07 00 cb 37 3b 28 00 01 5f 2b a7 18 01
E: 83997.656962 14 30 07 00 df 36 0b 29 00 01 5f 2b a7 18 01
E: 83997.712056 14 30 07 00 67 36 df 29 07 01 d7 2b 77 19 02
E: 83997.737958 14 30 07 00 f3 35 df 29 07 01 4f 2c a7 18 02
E: 83997.764061 14 30 07 00 7f 35 83 2b 07 01 c3 2c d3 17 02
E: 83997.789063 14 30 07 00 0b 35 83 2b 07 01 3b 2d d3 17 02
E: 83997.815048 14 30 07 00 97 34 83 2b 07 01 23 2e 2f 16 02
E: 83997.841005 14 30 07 00 a7 33 83 2b 07 01 9b 2e 8b 14 02
E: 83997.866958 14 30 07 00 bf 32 83 2b 07 01 0f 2f 8b 14 02
E: 83997.892965 14 30 07 00 cf 31 83 2b 07 01 83 2f e7 12 02
E: 83997.944987 14 30 07 00 6f 30 df 29 07 01 6f 30 17 12 02
E: 83997.970963 14 30 07 00 9b 2e 0b 29 07 01 d3 31 17 12 02
E: 83998.021057 14 30 07 00 af 2d 67 27 06 01 d3 31 17 12 02
E: 83998.045968 14 30 06 00 af 2d 67 27 00 01 d3 31 17 12 01
E: 84001.084994 14 30 07 00 c3 15 57 0c 00 01 d3 31 17 12 01
E: 84001.111065 14 30 07 00 af 16 2b 0d 00 01 d3 31 17 12 01
E: 84001.137056 14 30 07 00 27 17 2b 0d 00 01 d3 31 17 12 01
E: 84001.163055 14 30 07 00 9b 17 2b 0d 00 01 d3 31 17 12 01
E: 84001.243989 14 30 07 00 9b 17 83 0b 07 01 a3 50 23 24 02
E: 84001.269967 14 30 07 00 83 18 83 0b 07 01 a3 50 23 24 02
E: 84001.295979 14 30 07 00 83 18 57 0c 07 01 a3 50 23 24 02
E: 84001.322057 14 30 07 00 83 18 2b 0d 07 01 a3 50 7b 22 02
E: 84001.348066 14 30 07 00 83 18 2b 0d 07 01 a3 50 7b 22 02
E: 84001.374065 14 30 07 00 83 18 2b 0d 07 01 1b 51 7b 22 02
E: 84001.400064 14 30 07 00 83 18 2b 0d 07 01 8f 51 7b 22 02
E: 84001.426051 14 30 07 00 83 18 2b 0d 07 01 8f 51 db 20 02
E: 84001.452076 14 30 07 00 83 18 2b 0d 07 01 03 52 db 20 02
E: 84001.478081 14 30 07 00 83 18 57 0c 07 01 03 52 33 1f 02
E: 84001.659063 14 30 07 00 fb 18 57 0c 07 01 8f 51 eb 1b 02
E: 84001.684970 14 30 07 00 6f 19 57 0c 07 01 8f 51 eb 1b 02
E: 84001.710993 14 30 07 00 6f 19 57 0c 07 01 1b 51 bf 1c 02
E: 84001.736968 14 30 07 00 6f 19 57 0c 07 01 1b 51 93 1d 02
E: 84001.762971 14 30 07 00 6f 19 57 0c 07 01 1b 51 93 1d 02
E: 84001.788972 14 30 07 00 6f 19 27 0d 07 01 17 51 33 1f 02
E: 84001.811989 14 30 06 00 6f 19 27 0d 06 01 17 51 33 1f 02
E: 84010.461086 14 30 07 00 9b 17 9f 0f 06 01 17 51 33 1f 02
E: 84010.486997 14 30 07 00 9b 17 cb 0e 00 01 17 51 33 1f 01
E: 84010.512988 14 30 07 00 9b 17 cb 0e 00 01 17 51 33 1f 01
E: 84010.568092 14 30 07 00 0f 18 cb 0e 07 01 77 58 87 34 02
E: 84010.594089 14 30 07 00 0f 18 cb 0e 07 01 87 57 87 34 02
E: 84010.619989 14 30 07 00 0f 18 cb 0e 07 01 87 57 87 34 02
E: 84010.646062 14 30 07 00 0f 18 cb 0e 07 01 9f 56 e7 32 02
E: 84010.671984 14 30 07 00 0f 18 cb 0e 07 01 9f 56 e7 32 02
E: 84010.697987 14 30 07 00 0f 18 cb 0e 07 01 27 56 13 32 02
E: 84010.724013 14 30 07 00 0f 18 cb 0e 07 01 af 55 3f 31 02
E: 84010.750041 14 30 07 00 0f 18 cb 0e 07 01 af 55 3f 31 02
E: 84010.776009 14 30 07 00 0f 18 cb 0e 07 01 af 55 6f 30 02
E: 84010.801988 14 30 07 00 0f 18 cb 0e 07 01 af 55 9f 2f 02
E: 84010.828000 14 30 07 00 0f 18 cb 0e 07 01 af 55 9f 2f 02
E: 84010.854084 14 30 07 00 0f 18 cb 0e 07 01 27 56 9f 2f 02
E: 84010.880088 14 30 07 00 0f 18 cb 0e 07 01 9f 56 9f 2f 02
E: 84010.906087 14 30 07 00 0f 18 cb 0e 07 01 87 57 f7 2d 02
E: 84010.931991 14 30 07 00 0f 18 cb 0e 07 01 87 57 f7 2d 02
E: 84010.958089 14 30 07 00 0f 18 cb 0e 07 01 77 58 f7 2d 02
E: 84010.983982 14 30 07 00 0f 18 cb 0e 07 01 77 58 f7 2d 02
E: 84011.009992 14 30 07 00 0f 18 cb 0e 07 01 5f 59 57 2c 02
E: 84011.036013 14 30 07 00 0f 18 fb 0d 07 01 5f 59 57 2c 02
E: 84011.062068 14 30 07 00 0f 18 2b 0d 07 01 4f 5a af 2a 02
E: 84011.088089 14 30 07 00 0f 18 2b 0d 07 01 4f 5a af 2a 02
E: 84011.139993 14 30 07 00 0f 18 83 0b 07 01 37 5b 83 0b 02
E: 84011.163089 14 30 07 00 0f 18 83 0b 06 01 37 5b 83 0b 02
E: 84011.189085 14 30 07 00 87 18 83 0b 00 01 37 5b 83 0b 01
E: 84011.215103 14 30 07 00 fb 18 b3 0a 00 01 37 5b 83 0b 01
E: 84011.241092 14 30 07 00 fb 18 b3 0a 00 01 37 5b 83 0b 01
E: 84011.267083 14 30 07 00 fb 18 b3 0a 00 01 37 5b 83 0b 01
E: 84011.293094 14 30 07 00 fb 18 83 0b 00 01 37 5b 83 0b 01
E: 84011.317991 14 30 07 00 fb 18 83 0b 00 01 37 5b 83 0b 01
E: 84011.398992 14 30 07 00 fb 18 2b 0d 07 01 0f 5d 37 1f 02
E: 84011.451013 14 30 07 00 0f 18 cb 0e 07 01 37 5b d7 20 02
E: 84011.477010 14 30 07 00 0f 18 9f 0f 07 01 4f 5a d7 20 02
E: 84011.503091 14 30 07 00 0f 18 6f 10 07 01 5f 59 7f 22 02
E: 84011.529089 14 30 07 00 0f 18 43 11 07 01 77 58 7f 22 02
E: 84011.581104 14 30 07 00 0f 18 1f 24 07 01 87 57 1f 24 02
E: 84011.607016 14 30 07 00 0f 18 1f 24 07 01 87 57 1f 24 02
E: 84011.633089 14 30 07 00 0f 18 c7 25 07 01 9f 56 c7 25 02
E: 84011.659089 14 30 07 00 0f 18 17 12 07 01 af 55 c7 25 02
E: 84011.685093 14 30 07 00 0f 18 43 11 07 01 c7 54 67 27 02
E: 84011.710990 14 30 07 00 9b 17 43 11 07 01 4f 54 67 27 02
E: 84011.736991 14 30 07 00 9b 17 43 11 07 01 d7 53 67 27 02
E: 84011.763090 14 30 07 00 9b 17 43 11 07 01 ef 52 67 27 02
E: 84011.789090 14 30 07 00 9b 17 73 10 07 01 07 52 67 27 02
E: 84011.815087 14 30 07 00 9b 17 73 10 07 01 8f 51 67 27 02
E: 84011.841093 14 30 07 00 9b 17 73 10 07 01 17 51 c7 25 02
E: 84011.867090 14 30 07 00 9b 17 73 10 07 01 8f 51 c7 25 02
E: 84011.893089 14 30 07 00 0f 18 9f 0f 07 01 07 52 1f 24 02
E: 84011.919090 14 30 07 00 0f 18 9f 0f 07 01 ef 52 1f 24 02
E: 84011.945002 14 30 07 00 0f 18 cb 0e 07 01 ef 52 7f 22 02
E: 84011.970993 14 30 07 00 0f 18 cb 0e 07 01 d7 53 7f 22 02
E: 84011.996991 14 30 07 00 0f 18 cb 0e 07 01 d7 53 d7 20 02
E: 84012.023081 14 30 07 00 0f 18 cb 0e 07 01 c7 54 d7 20 02
E: 84012.048990 14 30 07 00 0f 18 cb 0e 07 01 c7 54 37 1f 02
E: 84012.074994 14 30 07 00 0f 18 cb 0e 07 01 af 55 37 1f 02
E: 84012.101012 14 30 07 00 0f 18 cb 0e 07 01 27 56 37 1f 02
E: 84012.152055 14 30 07 00 0f 18 cb 0e 07 01 ff 57 cb 0e 02
E: 84012.178096 14 30 07 00 0f 18 cb 0e 07 01 5f 59 37 1f 02
E: 84012.204080 14 30 07 00 0f 18 9f 0f 07 01 4f 5a 37 1f 02
E: 84012.254089 14 30 07 00 83 18 6f 10 06 01 4f 5a 37 1f 02
E: 84012.279110 14 30 06 00 83 18 6f 10 00 01 4f 5a 37 1f 01
E: 84012.513098 14 30 07 00 5f 59 1f 24 00 01 4f 5a 37 1f 01
E: 84012.538992 14 30 07 00 77 58 1f 24 00 01 4f 5a 37 1f 01
E: 84012.565083 14 30 07 00 87 57 7f 22 00 01 4f 5a 37 1f 01
E: 84012.590994 14 30 07 00 9f 56 7f 22 00 01 4f 5a 37 1f 01
E: 84012.616996 14 30 07 00 af 55 7f 22 00 01 4f 5a 37 1f 01
E: 84012.642992 14 30 07 00 c7 54 7f 22 00 01 4f 5a 37 1f 01
E: 84012.669013 14 30 07 00 d7 53 7f 22 00 01 4f 5a 37 1f 01
E: 84012.695092 14 30 07 00 ef 52 1f 24 00 01 4f 5a 37 1f 01
E: 84012.721092 14 30 07 00 07 52 1f 24 00 01 4f 5a 37 1f 01
E: 84012.746998 14 30 07 00 8f 51 1f 24 00 01 4f 5a 37 1f 01
E: 84012.772993 14 30 07 00 17 51 c7 25 00 01 4f 5a 37 1f 01
E: 84012.798991 14 30 07 00 2f 50 c7 25 00 01 4f 5a 37 1f 01
E: 84012.825018 14 30 07 00 b7 4f c7 25 00 01 4f 5a 37 1f 01
E: 84012.851017 14 30 07 00 3f 4f 67 27 00 01 4f 5a 37 1f 01
E: 84012.877000 14 30 07 00 cb 4e 67 27 00 01 4f 5a 37 1f 01
E: 84012.903080 14 30 07 00 57 4e 67 27 00 01 4f 5a 37 1f 01
E: 84012.928993 14 30 07 00 57 4e 0f 29 00 01 4f 5a 37 1f 01
E: 84012.954995 14 30 07 00 57 4e 0f 29 00 01 4f 5a 37 1f 01
E: 84012.981017 14 30 07 00 57 4e 0f 29 00 01 4f 5a 37 1f 01
E: 84013.007091 14 30 07 00 57 4e 0f 29 00 01 4f 5a 37 1f 01
E: 84013.033081 14 30 07 00 cb 4e 0f 29 00 01 4f 5a 37 1f 01
E: 84013.059078 14 30 07 00 cb 4e 0f 29 00 01 4f 5a 37 1f 01
E: 84013.085092 14 30 07 00 3f 4f 0f 29 00 01 4f 5a 37 1f 01
E: 84013.111106 14 30 07 00 3f 4f 0f 29 00 01 4f 5a 37 1f 01
E: 84013.137097 14 30 07 00 2f 50 0f 29 00 01 4f 5a 37 1f 01
E: 84013.163097 14 30 07 00 2f 50 0f 29 00 01 4f 5a 37 1f 01
E: 84013.189099 14 30 07 00 a3 50 67 27 00 01 4f 5a 37 1f 01
E: 84013.214989 14 30 07 00 17 51 67 27 00 01 4f 5a 37 1f 01
E: 84013.239993 14 30 07 00 8f 51 67 27 00 01 4f 5a 37 1f 01
E: 84013.265991 14 30 07 00 07 52 c7 25 00 01 4f 5a 37 1f 01
E: 84013.292013 14 30 07 00 ef 52 c7 25 00 01 4f 5a 37 1f 01
E: 84013.318018 14 30 07 00 ef 52 1f 24 00 01 4f 5a 37 1f 01
E: 84013.344014 14 30 06 00 ef 52 1f 24 00 01 4f 5a 37 1f 01
E: 84013.369991 14 30 07 00 4f 54 7f 22 00 01 4f 5a 37 1f 01
E: 84013.395992 14 30 07 00 c7 54 d7 20 00 01 4f 5a 37 1f 01
E: 84013.422001 14 30 07 00 af 55 d7 20 00 01 4f 5a 37 1f 01
E: 84013.448011 14 30 07 00 27 56 37 1f 00 01 4f 5a 37 1f 01
E: 84013.473994 14 30 07 00 9f 56 37 1f 00 01 4f 5a 37 1f 01
E: 84013.499996 14 30 07 00 87 57 8f 1d 00 01 4f 5a 37 1f 01
E: 84013.525996 14 30 07 00 87 57 8f 1d 00 01 4f 5a 37 1f 01
E: 84013.552095 14 30 07 00 87 57 ef 1b 00 01 4f 5a 37 1f 01
E: 84013.578006 14 30 07 00 ff 57 ef 1b 00 01 4f 5a 37 1f 01
E: 84013.604095 14 30 07 00 ff 57 ef 1b 00 01 4f 5a 37 1f 01
E: 84013.629993 14 30 07 00 ff 57 ef 1b 00 01 4f 5a 37 1f 01
E: 84013.655991 14 30 07 00 ff 57 ef 1b 00 01 4f 5a 37 1f 01
E: 84013.682015 14 30 06 00 ff 57 ef 1b 00 01 4f 5a 37 1f 01
E: 84013.707994 14 30 07 00 ff 57 ef 1b 00 01 4f 5a 37 1f 01
E: 84013.733998 14 30 07 00 ff 57 ef 1b 00 01 4f 5a 37 1f 01
E: 84013.759995 14 30 07 00 ff 57 ef 1b 00 01 4f 5a 37 1f 01
E: 84013.786054 14 30 07 00 77 58 ef 1b 00 01 4f 5a 37 1f 01
E: 84013.841001 14 30 07 00 77 58 9f 0f 07 01 83 18 47 1a 02
E: 84013.867000 14 30 07 00 0f 18 47 1a 07 01 77 58 9f 0f 02
E: 84013.892996 14 30 07 00 0f 18 cb 0e 07 01 77 58 47 1a 02
E: 84013.941994 14 30 07 00 0f 18 cb 0e 06 01 77 58 47 1a 02
E: 84013.967999 14 30 07 00 0f 18 cb 0e 00 01 77 58 47 1a 01
E: 84013.993998 14 30 07 00 0f 18 cb 0e 00 01 77 58 47 1a 01
E: 84014.020094 14 30 07 00 0f 18 cb 0e 00 01 77 58 47 1a 01
E: 84014.046087 14 30 07 00 0f 18 cb 0e 00 01 77 58 47 1a 01
E: 84014.072093 14 30 07 00 0f 18 fb 0d 00 01 77 58 47 1a 01
E: 84014.098094 14 30 07 00 0f 18 2b 0d 00 01 77 58 47 1a 01
E: 84014.124096 14 30 07 00 0f 18 2b 0d 00 01 77 58 47 1a 01
E: 84014.149995 14 30 07 00 0f 18 2b 0d 00 01 77 58 47 1a 01
E: 84014.176016 14 30 07 00 0f 18 2b 0d 00 01 77 58 47 1a 01
E: 84014.200995 14 30 07 00 0f 18 57 0c 00 01 77 58 47 1a 01
E: 84014.226993 14 30 07 00 0f 18 57 0c 00 01 77 58 47 1a 01
E: 84014.253092 14 30 07 00 0f 18 57 0c 00 01 77 58 47 1a 01
E: 84014.279017 14 30 07 00 0f 18 57 0c 00 01 77 58 47 1a 01
E: 84014.304996 14 30 07 00 87 18 57 0c 00 01 77 58 47 1a 01
E: 84014.331001 14 30 07 00 87 18 57 0c 00 01 77 58 47 1a 01
E: 84014.357096 14 30 07 00 fb 18 57 0c 00 01 77 58 47 1a 01
E: 84014.383096 14 30 07 00 87 18 57 0c 00 01 77 58 47 1a 01
E: 84014.409097 14 30 07 00 fb 18 2b 0d 00 01 77 58 47 1a 01
E: 84014.435095 14 30 07 00 fb 18 fb 0d 00 01 77 58 47 1a 01
E: 84014.461096 14 30 06 00 fb 18 fb 0d 00 01 77 58 47 1a 01
