R: 870 05 0d 09 04 a1 01 85 01 09 22 a1 02 09 42 15 00 25 01 75 01 95 01 81 02 09 32 81 02 09 47 81 02 95 05 81 03 75 08 09 51 95 01 81 02 05 01 75 10 55 0e 65 11 09 30 35 00 46 98 12 26 80 07 81 02 09 31 46 78 0a 26 38 04 81 02 c0 a1 02 05 0d 09 42 15 00 25 01 75 01 95 01 81 02 09 32 81 02 09 47 81 02 95 05 81 03 75 08 09 51 95 01 81 02 05 01 75 10 55 0e 65 11 09 30 35 00 46 98 12 26 80 07 81 02 46 78 0a 26 38 04 09 31 81 02 c0 a1 02 05 0d 09 42 15 00 25 01 75 01 95 01 81 02 09 32 81 02 09 47 81 02 95 05 81 03 75 08 09 51 95 01 81 02 05 01 75 10 55 0e 65 11 09 30 35 00 46 98 12 26 80 07 81 02 46 78 0a 26 38 04 09 31 81 02 c0 a1 02 05 0d 09 42 15 00 25 01 75 01 95 01 81 02 09 32 81 02 09 47 81 02 95 05 81 03 75 08 09 51 95 01 81 02 05 01 75 10 55 0e 65 11 09 30 35 00 46 98 12 26 80 07 81 02 46 78 0a 26 38 04 09 31 81 02 c0 a1 02 05 0d 09 42 15 00 25 01 75 01 95 01 81 02 09 32 81 02 09 47 81 02 95 05 81 03 75 08 09 51 95 01 81 02 05 01 75 10 55 0e 65 11 09 30 35 00 46 98 12 26 80 07 81 02 46 78 0a 26 38 04 09 31 81 02 c0 a1 02 05 0d 09 42 15 00 25 01 75 01 95 01 81 02 09 32 81 02 09 47 81 02 95 05 81 03 75 08 09 51 95 01 81 02 05 01 75 10 55 0e 65 11 09 30 35 00 46 98 12 26 80 07 81 02 46 78 0a 26 38 04 09 31 81 02 c0 a1 02 05 0d 09 42 15 00 25 01 75 01 95 01 81 02 09 32 81 02 09 47 81 02 95 05 81 03 75 08 09 51 95 01 81 02 05 01 75 10 55 0e 65 11 09 30 35 00 46 98 12 26 80 07 81 02 46 78 0a 26 38 04 09 31 81 02 c0 a1 02 05 0d 09 42 15 00 25 01 75 01 95 01 81 02 09 32 81 02 09 47 81 02 95 05 81 03 75 08 09 51 95 01 81 02 05 01 75 10 55 0e 65 11 09 30 35 00 46 98 12 26 80 07 81 02 46 78 0a 26 38 04 09 31 81 02 c0 a1 02 05 0d 09 42 15 00 25 01 75 01 95 01 81 02 09 32 81 02 09 47 81 02 95 05 81 03 75 08 09 51 95 01 81 02 05 01 75 10 55 0e 65 11 09 30 35 00 46 98 12 26 80 07 81 02 46 78 0a 26 38 04 09 31 81 02 c0 a1 02 05 0d 09 42 15 00 25 01 75 01 95 01 81 02 09 32 81 02 09 47 81 02 95 05 81 03 75 08 09 51 95 01 81 02 05 01 75 10 55 0e 65 11 09 30 35 00 46 98 12 26 80 07 81 02 46 78 0a 26 38 04 09 31 81 02 c0 05 0d 09 54 95 01 75 08 15 00 25 0a 81 02 25 0a 09 55 b1 02 c0 09 0e a1 01 85 03 09 22 a1 00 09 52 09 53 15 00 25 0a 75 08 95 02 b1 02 c0 c0 05 01 09 02 a1 01 85 04 09 01 a1 00 05 09 19 01 29 02 15 00 25 01 75 01 95 02 81 02 95 06 81 03 05 01 09 30 75 10 95 01 15 00 26 7f 07 81 02 09 31 26 37 04 81 02 c0 c0 06 00 ff 09 01 a1 01 85 05 15 00 26 ff 00 75 08 95 19 09 01 b1 02 c0 05 14 09 2b a1 02 85 07 09 2b 15 00 25 0a 75 08 95 40 b1 02 09 4b 15 00 25 0a 75 08 95 02 91 02 c0 05 14 09 2c a1 02 85 08 09 2b 15 00 25 0a 75 08 95 05 81 02 09 4b 15 00 25 0a 75 08 95 47 91 02 c0
N: LGE LGE MultiTouch Device
I: 3 043e 9aa1
# 1. Drag _one_ finger on the screen from one corner to the opposite, and release it.
E: 0.000000 62 01 00 0a 21 00 03 00 00 00 00 00 00 00 00 00 00 00 00 00 00 00 00 00 00 00 00 00 00 00 00 00 00 00 00 00 00 00 00 00 00 00 00 00 00 00 00 00 00 00 00 00 00 00 00 00 00 00 00 00 00 00 01
E: 0.009995 62 01 07 0a 26 00 03 00 00 00 00 00 00 00 00 00 00 00 00 00 00 00 00 00 00 00 00 00 00 00 00 00 00 00 00 00 00 00 00 00 00 00 00 00 00 00 00 00 00 00 00 00 00 00 00 00 00 00 00 00 00 00 01
E: 0.019995 62 01 07 0a 2a 00 04 00 00 00 00 00 00 00 00 00 00 00 00 00 00 00 00 00 00 00 00 00 00 00 00 00 00 00 00 00 00 00 00 00 00 00 00 00 00 00 00 00 00 00 00 00 00 00 00 00 00 00 00 00 00 00 01
E: 0.029991 62 01 07 0a 2d 00 04 00 00 00 00 00 00 00 00 00 00 00 00 00 00 00 00 00 00 00 00 00 00 00 00 00 00 00 00 00 00 00 00 00 00 00 00 00 00 00 00 00 00 00 00 00 00 00 00 00 00 00 00 00 00 00 01
E: 0.039982 62 01 07 0a 2f 00 04 00 00 00 00 00 00 00 00 00 00 00 00 00 00 00 00 00 00 00 00 00 00 00 00 00 00 00 00 00 00 00 00 00 00 00 00 00 00 00 00 00 00 00 00 00 00 00 00 00 00 00 00 00 00 00 01
E: 0.049929 62 01 07 0a 32 00 04 00 00 00 00 00 00 00 00 00 00 00 00 00 00 00 00 00 00 00 00 00 00 00 00 00 00 00 00 00 00 00 00 00 00 00 00 00 00 00 00 00 00 00 00 00 00 00 00 00 00 00 00 00 00 00 01
E: 0.059973 62 01 07 0a 35 00 05 00 00 00 00 00 00 00 00 00 00 00 00 00 00 00 00 00 00 00 00 00 00 00 00 00 00 00 00 00 00 00 00 00 00 00 00 00 00 00 00 00 00 00 00 00 00 00 00 00 00 00 00 00 00 00 01
E: 0.069968 62 01 07 0a 3b 00 06 00 00 00 00 00 00 00 00 00 00 00 00 00 00 00 00 00 00 00 00 00 00 00 00 00 00 00 00 00 00 00 00 00 00 00 00 00 00 00 00 00 00 00 00 00 00 00 00 00 00 00 00 00 00 00 01
E: 0.079966 62 01 07 0a 41 00 07 00 00 00 00 00 00 00 00 00 00 00 00 00 00 00 00 00 00 00 00 00 00 00 00 00 00 00 00 00 00 00 00 00 00 00 00 00 00 00 00 00 00 00 00 00 00 00 00 00 00 00 00 00 00 00 01
E: 0.089959 62 01 07 0a 47 00 0a 00 00 00 00 00 00 00 00 00 00 00 00 00 00 00 00 00 00 00 00 00 00 00 00 00 00 00 00 00 00 00 00 00 00 00 00 00 00 00 00 00 00 00 00 00 00 00 00 00 00 00 00 00 00 00 01
E: 0.099955 62 01 07 0a 4d 00 0d 00 00 00 00 00 00 00 00 00 00 00 00 00 00 00 00 00 00 00 00 00 00 00 00 00 00 00 00 00 00 00 00 00 00 00 00 00 00 00 00 00 00 00 00 00 00 00 00 00 00 00 00 00 00 00 01
E: 0.109946 62 01 07 0a 54 00 10 00 00 00 00 00 00 00 00 00 00 00 00 00 00 00 00 00 00 00 00 00 00 00 00 00 00 00 00 00 00 00 00 00 00 00 00 00 00 00 00 00 00 00 00 00 00 00 00 00 00 00 00 00 00 00 01
E: 0.119944 62 01 07 0a 5c 00 15 00 00 00 00 00 00 00 00 00 00 00 00 00 00 00 00 00 00 00 00 00 00 00 00 00 00 00 00 00 00 00 00 00 00 00 00 00 00 00 00 00 00 00 00 00 00 00 00 00 00 00 00 00 00 00 01
E: 0.129940 62 01 07 0a 64 00 19 00 00 00 00 00 00 00 00 00 00 00 00 00 00 00 00 00 00 00 00 00 00 00 00 00 00 00 00 00 00 00 00 00 00 00 00 00 00 00 00 00 00 00 00 00 00 00 00 00 00 00 00 00 00 00 01
E: 0.139929 62 01 07 0a 6d 00 1f 00 00 00 00 00 00 00 00 00 00 00 00 00 00 00 00 00 00 00 00 00 00 00 00 00 00 00 00 00 00 00 00 00 00 00 00 00 00 00 00 00 00 00 00 00 00 00 00 00 00 00 00 00 00 00 01
E: 0.149927 62 01 07 0a 75 00 24 00 00 00 00 00 00 00 00 00 00 00 00 00 00 00 00 00 00 00 00 00 00 00 00 00 00 00 00 00 00 00 00 00 00 00 00 00 00 00 00 00 00 00 00 00 00 00 00 00 00 00 00 00 00 00 01
E: 0.159923 62 01 07 0a 7e 00 2a 00 00 00 00 00 00 00 00 00 00 00 00 00 00 00 00 00 00 00 00 00 00 00 00 00 00 00 00 00 00 00 00 00 00 00 00 00 00 00 00 00 00 00 00 00 00 00 00 00 00 00 00 00 00 00 01
E: 0.169921 62 01 07 0a 87 00 30 00 00 00 00 00 00 00 00 00 00 00 00 00 00 00 00 00 00 00 00 00 00 00 00 00 00 00 00 00 00 00 00 00 00 00 00 00 00 00 00 00 00 00 00 00 00 00 00 00 00 00 00 00 00 00 01
E: 0.179913 62 01 07 0a 90 00 37 00 00 00 00 00 00 00 00 00 00 00 00 00 00 00 00 00 00 00 00 00 00 00 00 00 00 00 00 00 00 00 00 00 00 00 00 00 00 00 00 00 00 00 00 00 00 00 00 00 00 00 00 00 00 00 01
E: 0.189906 62 01 07 0a 9a 00 3d 00 00 00 00 00 00 00 00 00 00 00 00 00 00 00 00 00 00 00 00 00 00 00 00 00 00 00 00 00 00 00 00 00 00 00 00 00 00 00 00 00 00 00 00 00 00 00 00 00 00 00 00 00 00 00 01
E: 0.199905 62 01 07 0a a4 00 44 00 00 00 00 00 00 00 00 00 00 00 00 00 00 00 00 00 00 00 00 00 00 00 00 00 00 00 00 00 00 00 00 00 00 00 00 00 00 00 00 00 00 00 00 00 00 00 00 00 00 00 00 00 00 00 01
E: 0.209898 62 01 07 0a ae 00 4b 00 00 00 00 00 00 00 00 00 00 00 00 00 00 00 00 00 00 00 00 00 00 00 00 00 00 00 00 00 00 00 00 00 00 00 00 00 00 00 00 00 00 00 00 00 00 00 00 00 00 00 00 00 00 00 01
E: 0.219893 62 01 07 0a b8 00 52 00 00 00 00 00 00 00 00 00 00 00 00 00 00 00 00 00 00 00 00 00 00 00 00 00 00 00 00 00 00 00 00 00 00 00 00 00 00 00 00 00 00 00 00 00 00 00 00 00 00 00 00 00 00 00 01
E: 0.229890 62 01 07 0a c3 00 59 00 00 00 00 00 00 00 00 00 00 00 00 00 00 00 00 00 00 00 00 00 00 00 00 00 00 00 00 00 00 00 00 00 00 00 00 00 00 00 00 00 00 00 00 00 00 00 00 00 00 00 00 00 00 00 01
E: 0.239882 62 01 07 0a cf 00 60 00 00 00 00 00 00 00 00 00 00 00 00 00 00 00 00 00 00 00 00 00 00 00 00 00 00 00 00 00 00 00 00 00 00 00 00 00 00 00 00 00 00 00 00 00 00 00 00 00 00 00 00 00 00 00 01
E: 0.249838 62 01 07 0a da 00 67 00 00 00 00 00 00 00 00 00 00 00 00 00 00 00 00 00 00 00 00 00 00 00 00 00 00 00 00 00 00 00 00 00 00 00 00 00 00 00 00 00 00 00 00 00 00 00 00 00 00 00 00 00 00 00 01
E: 0.259872 62 01 07 0a e6 00 6d 00 00 00 00 00 00 00 00 00 00 00 00 00 00 00 00 00 00 00 00 00 00 00 00 00 00 00 00 00 00 00 00 00 00 00 00 00 00 00 00 00 00 00 00 00 00 00 00 00 00 00 00 00 00 00 01
E: 0.269870 62 01 07 0a f1 00 74 00 00 00 00 00 00 00 00 00 00 00 00 00 00 00 00 00 00 00 00 00 00 00 00 00 00 00 00 00 00 00 00 00 00 00 00 00 00 00 00 00 00 00 00 00 00 00 00 00 00 00 00 00 00 00 01
E: 0.279864 62 01 07 0a fe 00 7b 00 00 00 00 00 00 00 00 00 00 00 00 00 00 00 00 00 00 00 00 00 00 00 00 00 00 00 00 00 00 00 00 00 00 00 00 00 00 00 00 00 00 00 00 00 00 00 00 00 00 00 00 00 00 00 01
E: 0.289857 62 01 07 0a 0a 01 82 00 00 00 00 00 00 00 00 00 00 00 00 00 00 00 00 00 00 00 00 00 00 00 00 00 00 00 00 00 00 00 00 00 00 00 00 00 00 00 00 00 00 00 00 00 00 00 00 00 00 00 00 00 00 00 01
E: 0.299855 62 01 07 0a 17 01 8a 00 00 00 00 00 00 00 00 00 00 00 00 00 00 00 00 00 00 00 00 00 00 00 00 00 00 00 00 00 00 00 00 00 00 00 00 00 00 00 00 00 00 00 00 00 00 00 00 00 00 00 00 00 00 00 01
E: 0.309848 62 01 07 0a 24 01 91 00 00 00 00 00 00 00 00 00 00 00 00 00 00 00 00 00 00 00 00 00 00 00 00 00 00 00 00 00 00 00 00 00 00 00 00 00 00 00 00 00 00 00 00 00 00 00 00 00 00 00 00 00 00 00 01
E: 0.319845 62 01 07 0a 32 01 99 00 00 00 00 00 00 00 00 00 00 00 00 00 00 00 00 00 00 00 00 00 00 00 00 00 00 00 00 00 00 00 00 00 00 00 00 00 00 00 00 00 00 00 00 00 00 00 00 00 00 00 00 00 00 00 01
E: 0.329839 62 01 07 0a 40 01 a2 00 00 00 00 00 00 00 00 00 00 00 00 00 00 00 00 00 00 00 00 00 00 00 00 00 00 00 00 00 00 00 00 00 00 00 00 00 00 00 00 00 00 00 00 00 00 00 00 00 00 00 00 00 00 00 01
E: 0.339831 62 01 07 0a 4e 01 aa 00 00 00 00 00 00 00 00 00 00 00 00 00 00 00 00 00 00 00 00 00 00 00 00 00 00 00 00 00 00 00 00 00 00 00 00 00 00 00 00 00 00 00 00 00 00 00 00 00 00 00 00 00 00 00 01
E: 0.349830 62 01 07 0a 5d 01 b2 00 00 00 00 00 00 00 00 00 00 00 00 00 00 00 00 00 00 00 00 00 00 00 00 00 00 00 00 00 00 00 00 00 00 00 00 00 00 00 00 00 00 00 00 00 00 00 00 00 00 00 00 00 00 00 01
E: 0.359826 62 01 07 0a 6c 01 bb 00 00 00 00 00 00 00 00 00 00 00 00 00 00 00 00 00 00 00 00 00 00 00 00 00 00 00 00 00 00 00 00 00 00 00 00 00 00 00 00 00 00 00 00 00 00 00 00 00 00 00 00 00 00 00 01
E: 0.369819 62 01 07 0a 7b 01 c4 00 00 00 00 00 00 00 00 00 00 00 00 00 00 00 00 00 00 00 00 00 00 00 00 00 00 00 00 00 00 00 00 00 00 00 00 00 00 00 00 00 00 00 00 00 00 00 00 00 00 00 00 00 00 00 01
E: 0.379814 62 01 07 0a 8a 01 cd 00 00 00 00 00 00 00 00 00 00 00 00 00 00 00 00 00 00 00 00 00 00 00 00 00 00 00 00 00 00 00 00 00 00 00 00 00 00 00 00 00 00 00 00 00 00 00 00 00 00 00 00 00 00 00 01
E: 0.389807 62 01 07 0a 9a 01 d6 00 00 00 00 00 00 00 00 00 00 00 00 00 00 00 00 00 00 00 00 00 00 00 00 00 00 00 00 00 00 00 00 00 00 00 00 00 00 00 00 00 00 00 00 00 00 00 00 00 00 00 00 00 00 00 01
E: 0.399804 62 01 07 0a a8 01 df 00 00 00 00 00 00 00 00 00 00 00 00 00 00 00 00 00 00 00 00 00 00 00 00 00 00 00 00 00 00 00 00 00 00 00 00 00 00 00 00 00 00 00 00 00 00 00 00 00 00 00 00 00 00 00 01
E: 0.409799 62 01 07 0a b7 01 e9 00 00 00 00 00 00 00 00 00 00 00 00 00 00 00 00 00 00 00 00 00 00 00 00 00 00 00 00 00 00 00 00 00 00 00 00 00 00 00 00 00 00 00 00 00 00 00 00 00 00 00 00 00 00 00 01
E: 0.419796 62 01 07 0a c7 01 f3 00 00 00 00 00 00 00 00 00 00 00 00 00 00 00 00 00 00 00 00 00 00 00 00 00 00 00 00 00 00 00 00 00 00 00 00 00 00 00 00 00 00 00 00 00 00 00 00 00 00 00 00 00 00 00 01
E: 0.429788 62 01 07 0a d7 01 fd 00 00 00 00 00 00 00 00 00 00 00 00 00 00 00 00 00 00 00 00 00 00 00 00 00 00 00 00 00 00 00 00 00 00 00 00 00 00 00 00 00 00 00 00 00 00 00 00 00 00 00 00 00 00 00 01
E: 0.439783 62 01 07 0a e7 01 07 01 00 00 00 00 00 00 00 00 00 00 00 00 00 00 00 00 00 00 00 00 00 00 00 00 00 00 00 00 00 00 00 00 00 00 00 00 00 00 00 00 00 00 00 00 00 00 00 00 00 00 00 00 00 00 01
E: 0.449778 62 01 07 0a f7 01 11 01 00 00 00 00 00 00 00 00 00 00 00 00 00 00 00 00 00 00 00 00 00 00 00 00 00 00 00 00 00 00 00 00 00 00 00 00 00 00 00 00 00 00 00 00 00 00 00 00 00 00 00 00 00 00 01
E: 0.459774 62 01 07 0a 07 02 1c 01 00 00 00 00 00 00 00 00 00 00 00 00 00 00 00 00 00 00 00 00 00 00 00 00 00 00 00 00 00 00 00 00 00 00 00 00 00 00 00 00 00 00 00 00 00 00 00 00 00 00 00 00 00 00 01
E: 0.469768 62 01 07 0a 17 02 26 01 00 00 00 00 00 00 00 00 00 00 00 00 00 00 00 00 00 00 00 00 00 00 00 00 00 00 00 00 00 00 00 00 00 00 00 00 00 00 00 00 00 00 00 00 00 00 00 00 00 00 00 00 00 00 01
E: 0.479765 62 01 07 0a 28 02 31 01 00 00 00 00 00 00 00 00 00 00 00 00 00 00 00 00 00 00 00 00 00 00 00 00 00 00 00 00 00 00 00 00 00 00 00 00 00 00 00 00 00 00 00 00 00 00 00 00 00 00 00 00 00 00 01
E: 0.489759 62 01 07 0a 38 02 3c 01 00 00 00 00 00 00 00 00 00 00 00 00 00 00 00 00 00 00 00 00 00 00 00 00 00 00 00 00 00 00 00 00 00 00 00 00 00 00 00 00 00 00 00 00 00 00 00 00 00 00 00 00 00 00 01
E: 0.499755 62 01 07 0a 49 02 47 01 00 00 00 00 00 00 00 00 00 00 00 00 00 00 00 00 00 00 00 00 00 00 00 00 00 00 00 00 00 00 00 00 00 00 00 00 00 00 00 00 00 00 00 00 00 00 00 00 00 00 00 00 00 00 01
E: 0.509747 62 01 07 0a 59 02 53 01 00 00 00 00 00 00 00 00 00 00 00 00 00 00 00 00 00 00 00 00 00 00 00 00 00 00 00 00 00 00 00 00 00 00 00 00 00 00 00 00 00 00 00 00 00 00 00 00 00 00 00 00 00 00 01
E: 0.519745 62 01 07 0a 6a 02 5e 01 00 00 00 00 00 00 00 00 00 00 00 00 00 00 00 00 00 00 00 00 00 00 00 00 00 00 00 00 00 00 00 00 00 00 00 00 00 00 00 00 00 00 00 00 00 00 00 00 00 00 00 00 00 00 01
E: 0.529738 62 01 07 0a 7b 02 6a 01 00 00 00 00 00 00 00 00 00 00 00 00 00 00 00 00 00 00 00 00 00 00 00 00 00 00 00 00 00 00 00 00 00 00 00 00 00 00 00 00 00 00 00 00 00 00 00 00 00 00 00 00 00 00 01
E: 0.539733 62 01 07 0a 8d 02 75 01 00 00 00 00 00 00 00 00 00 00 00 00 00 00 00 00 00 00 00 00 00 00 00 00 00 00 00 00 00 00 00 00 00 00 00 00 00 00 00 00 00 00 00 00 00 00 00 00 00 00 00 00 00 00 01
E: 0.549729 62 01 07 0a 9e 02 81 01 00 00 00 00 00 00 00 00 00 00 00 00 00 00 00 00 00 00 00 00 00 00 00 00 00 00 00 00 00 00 00 00 00 00 00 00 00 00 00 00 00 00 00 00 00 00 00 00 00 00 00 00 00 00 01
E: 0.559725 62 01 07 0a af 02 8c 01 00 00 00 00 00 00 00 00 00 00 00 00 00 00 00 00 00 00 00 00 00 00 00 00 00 00 00 00 00 00 00 00 00 00 00 00 00 00 00 00 00 00 00 00 00 00 00 00 00 00 00 00 00 00 01
E: 0.569720 62 01 07 0a c1 02 98 01 00 00 00 00 00 00 00 00 00 00 00 00 00 00 00 00 00 00 00 00 00 00 00 00 00 00 00 00 00 00 00 00 00 00 00 00 00 00 00 00 00 00 00 00 00 00 00 00 00 00 00 00 00 00 01
E: 0.579715 62 01 07 0a d3 02 a3 01 00 00 00 00 00 00 00 00 00 00 00 00 00 00 00 00 00 00 00 00 00 00 00 00 00 00 00 00 00 00 00 00 00 00 00 00 00 00 00 00 00 00 00 00 00 00 00 00 00 00 00 00 00 00 01
E: 0.589707 62 01 07 0a e6 02 af 01 00 00 00 00 00 00 00 00 00 00 00 00 00 00 00 00 00 00 00 00 00 00 00 00 00 00 00 00 00 00 00 00 00 00 00 00 00 00 00 00 00 00 00 00 00 00 00 00 00 00 00 00 00 00 01
E: 0.599703 62 01 07 0a f8 02 bb 01 00 00 00 00 00 00 00 00 00 00 00 00 00 00 00 00 00 00 00 00 00 00 00 00 00 00 00 00 00 00 00 00 00 00 00 00 00 00 00 00 00 00 00 00 00 00 00 00 00 00 00 00 00 00 01
E: 0.609700 62 01 07 0a 0a 03 c6 01 00 00 00 00 00 00 00 00 00 00 00 00 00 00 00 00 00 00 00 00 00 00 00 00 00 00 00 00 00 00 00 00 00 00 00 00 00 00 00 00 00 00 00 00 00 00 00 00 00 00 00 00 00 00 01
E: 0.619696 62 01 07 0a 1d 03 d2 01 00 00 00 00 00 00 00 00 00 00 00 00 00 00 00 00 00 00 00 00 00 00 00 00 00 00 00 00 00 00 00 00 00 00 00 00 00 00 00 00 00 00 00 00 00 00 00 00 00 00 00 00 00 00 01
E: 0.629690 62 01 07 0a 30 03 de 01 00 00 00 00 00 00 00 00 00 00 00 00 00 00 00 00 00 00 00 00 00 00 00 00 00 00 00 00 00 00 00 00 00 00 00 00 00 00 00 00 00 00 00 00 00 00 00 00 00 00 00 00 00 00 01
E: 0.639683 62 01 07 0a 43 03 ea 01 00 00 00 00 00 00 00 00 00 00 00 00 00 00 00 00 00 00 00 00 00 00 00 00 00 00 00 00 00 00 00 00 00 00 00 00 00 00 00 00 00 00 00 00 00 00 00 00 00 00 00 00 00 00 01
E: 0.651676 62 01 07 0a 56 03 f6 01 00 00 00 00 00 00 00 00 00 00 00 00 00 00 00 00 00 00 00 00 00 00 00 00 00 00 00 00 00 00 00 00 00 00 00 00 00 00 00 00 00 00 00 00 00 00 00 00 00 00 00 00 00 00 01
E: 0.659674 62 01 07 0a 6a 03 03 02 00 00 00 00 00 00 00 00 00 00 00 00 00 00 00 00 00 00 00 00 00 00 00 00 00 00 00 00 00 00 00 00 00 00 00 00 00 00 00 00 00 00 00 00 00 00 00 00 00 00 00 00 00 00 01
E: 0.669668 62 01 07 0a 7e 03 0f 02 00 00 00 00 00 00 00 00 00 00 00 00 00 00 00 00 00 00 00 00 00 00 00 00 00 00 00 00 00 00 00 00 00 00 00 00 00 00 00 00 00 00 00 00 00 00 00 00 00 00 00 00 00 00 01
E: 0.679664 62 01 07 0a 91 03 1c 02 00 00 00 00 00 00 00 00 00 00 00 00 00 00 00 00 00 00 00 00 00 00 00 00 00 00 00 00 00 00 00 00 00 00 00 00 00 00 00 00 00 00 00 00 00 00 00 00 00 00 00 00 00 00 01
E: 0.689657 62 01 07 0a a5 03 28 02 00 00 00 00 00 00 00 00 00 00 00 00 00 00 00 00 00 00 00 00 00 00 00 00 00 00 00 00 00 00 00 00 00 00 00 00 00 00 00 00 00 00 00 00 00 00 00 00 00 00 00 00 00 00 01
E: 0.699654 62 01 07 0a b9 03 35 02 00 00 00 00 00 00 00 00 00 00 00 00 00 00 00 00 00 00 00 00 00 00 00 00 00 00 00 00 00 00 00 00 00 00 00 00 00 00 00 00 00 00 00 00 00 00 00 00 00 00 00 00 00 00 01
E: 0.709649 62 01 07 0a cd 03 41 02 00 00 00 00 00 00 00 00 00 00 00 00 00 00 00 00 00 00 00 00 00 00 00 00 00 00 00 00 00 00 00 00 00 00 00 00 00 00 00 00 00 00 00 00 00 00 00 00 00 00 00 00 00 00 01
E: 0.719645 62 01 07 0a e1 03 4e 02 00 00 00 00 00 00 00 00 00 00 00 00 00 00 00 00 00 00 00 00 00 00 00 00 00 00 00 00 00 00 00 00 00 00 00 00 00 00 00 00 00 00 00 00 00 00 00 00 00 00 00 00 00 00 01
E: 0.729639 62 01 07 0a f5 03 5a 02 00 00 00 00 00 00 00 00 00 00 00 00 00 00 00 00 00 00 00 00 00 00 00 00 00 00 00 00 00 00 00 00 00 00 00 00 00 00 00 00 00 00 00 00 00 00 00 00 00 00 00 00 00 00 01
E: 0.739631 62 01 07 0a 08 04 67 02 00 00 00 00 00 00 00 00 00 00 00 00 00 00 00 00 00 00 00 00 00 00 00 00 00 00 00 00 00 00 00 00 00 00 00 00 00 00 00 00 00 00 00 00 00 00 00 00 00 00 00 00 00 00 01
E: 0.749627 62 01 07 0a 1c 04 73 02 00 00 00 00 00 00 00 00 00 00 00 00 00 00 00 00 00 00 00 00 00 00 00 00 00 00 00 00 00 00 00 00 00 00 00 00 00 00 00 00 00 00 00 00 00 00 00 00 00 00 00 00 00 00 01
E: 0.759625 62 01 07 0a 31 04 80 02 00 00 00 00 00 00 00 00 00 00 00 00 00 00 00 00 00 00 00 00 00 00 00 00 00 00 00 00 00 00 00 00 00 00 00 00 00 00 00 00 00 00 00 00 00 00 00 00 00 00 00 00 00 00 01
E: 0.769620 62 01 07 0a 45 04 8c 02 00 00 00 00 00 00 00 00 00 00 00 00 00 00 00 00 00 00 00 00 00 00 00 00 00 00 00 00 00 00 00 00 00 00 00 00 00 00 00 00 00 00 00 00 00 00 00 00 00 00 00 00 00 00 01
E: 0.779615 62 01 07 0a 59 04 99 02 00 00 00 00 00 00 00 00 00 00 00 00 00 00 00 00 00 00 00 00 00 00 00 00 00 00 00 00 00 00 00 00 00 00 00 00 00 00 00 00 00 00 00 00 00 00 00 00 00 00 00 00 00 00 01
E: 0.789620 62 01 07 0a 6e 04 a5 02 00 00 00 00 00 00 00 00 00 00 00 00 00 00 00 00 00 00 00 00 00 00 00 00 00 00 00 00 00 00 00 00 00 00 00 00 00 00 00 00 00 00 00 00 00 00 00 00 00 00 00 00 00 00 01
E: 0.799603 62 01 07 0a 82 04 b2 02 00 00 00 00 00 00 00 00 00 00 00 00 00 00 00 00 00 00 00 00 00 00 00 00 00 00 00 00 00 00 00 00 00 00 00 00 00 00 00 00 00 00 00 00 00 00 00 00 00 00 00 00 00 00 01
E: 0.809639 62 01 07 0a 96 04 be 02 00 00 00 00 00 00 00 00 00 00 00 00 00 00 00 00 00 00 00 00 00 00 00 00 00 00 00 00 00 00 00 00 00 00 00 00 00 00 00 00 00 00 00 00 00 00 00 00 00 00 00 00 00 00 01
E: 0.819595 62 01 07 0a aa 04 ca 02 00 00 00 00 00 00 00 00 00 00 00 00 00 00 00 00 00 00 00 00 00 00 00 00 00 00 00 00 00 00 00 00 00 00 00 00 00 00 00 00 00 00 00 00 00 00 00 00 00 00 00 00 00 00 01
E: 0.829627 62 01 07 0a bf 04 d7 02 00 00 00 00 00 00 00 00 00 00 00 00 00 00 00 00 00 00 00 00 00 00 00 00 00 00 00 00 00 00 00 00 00 00 00 00 00 00 00 00 00 00 00 00 00 00 00 00 00 00 00 00 00 00 01
E: 0.839581 62 01 07 0a d2 04 e3 02 00 00 00 00 00 00 00 00 00 00 00 00 00 00 00 00 00 00 00 00 00 00 00 00 00 00 00 00 00 00 00 00 00 00 00 00 00 00 00 00 00 00 00 00 00 00 00 00 00 00 00 00 00 00 01
E: 0.849621 62 01 07 0a e6 04 ef 02 00 00 00 00 00 00 00 00 00 00 00 00 00 00 00 00 00 00 00 00 00 00 00 00 00 00 00 00 00 00 00 00 00 00 00 00 00 00 00 00 00 00 00 00 00 00 00 00 00 00 00 00 00 00 01
E: 0.859575 62 01 07 0a fa 04 fb 02 00 00 00 00 00 00 00 00 00 00 00 00 00 00 00 00 00 00 00 00 00 00 00 00 00 00 00 00 00 00 00 00 00 00 00 00 00 00 00 00 00 00 00 00 00 00 00 00 00 00 00 00 00 00 01
E: 0.869613 62 01 07 0a 0e 05 07 03 00 00 00 00 00 00 00 00 00 00 00 00 00 00 00 00 00 00 00 00 00 00 00 00 00 00 00 00 00 00 00 00 00 00 00 00 00 00 00 00 00 00 00 00 00 00 00 00 00 00 00 00 00 00 01
E: 0.879565 62 01 07 0a 22 05 13 03 00 00 00 00 00 00 00 00 00 00 00 00 00 00 00 00 00 00 00 00 00 00 00 00 00 00 00 00 00 00 00 00 00 00 00 00 00 00 00 00 00 00 00 00 00 00 00 00 00 00 00 00 00 00 01
E: 0.889596 62 01 07 0a 36 05 1f 03 00 00 00 00 00 00 00 00 00 00 00 00 00 00 00 00 00 00 00 00 00 00 00 00 00 00 00 00 00 00 00 00 00 00 00 00 00 00 00 00 00 00 00 00 00 00 00 00 00 00 00 00 00 00 01
E: 0.899555 62 01 07 0a 49 05 2a 03 00 00 00 00 00 00 00 00 00 00 00 00 00 00 00 00 00 00 00 00 00 00 00 00 00 00 00 00 00 00 00 00 00 00 00 00 00 00 00 00 00 00 00 00 00 00 00 00 00 00 00 00 00 00 01
E: 0.909590 62 01 07 0a 5c 05 34 03 00 00 00 00 00 00 00 00 00 00 00 00 00 00 00 00 00 00 00 00 00 00 00 00 00 00 00 00 00 00 00 00 00 00 00 00 00 00 00 00 00 00 00 00 00 00 00 00 00 00 00 00 00 00 01
E: 0.921600 62 01 07 0a 6f 05 3f 03 00 00 00 00 00 00 00 00 00 00 00 00 00 00 00 00 00 00 00 00 00 00 00 00 00 00 00 00 00 00 00 00 00 00 00 00 00 00 00 00 00 00 00 00 00 00 00 00 00 00 00 00 00 00 01
E: 0.931536 62 01 07 0a 81 05 48 03 00 00 00 00 00 00 00 00 00 00 00 00 00 00 00 00 00 00 00 00 00 00 00 00 00 00 00 00 00 00 00 00 00 00 00 00 00 00 00 00 00 00 00 00 00 00 00 00 00 00 00 00 00 00 01
E: 0.941530 62 01 07 0a 94 05 52 03 00 00 00 00 00 00 00 00 00 00 00 00 00 00 00 00 00 00 00 00 00 00 00 00 00 00 00 00 00 00 00 00 00 00 00 00 00 00 00 00 00 00 00 00 00 00 00 00 00 00 00 00 00 00 01
E: 0.951528 62 01 07 0a a6 05 5b 03 00 00 00 00 00 00 00 00 00 00 00 00 00 00 00 00 00 00 00 00 00 00 00 00 00 00 00 00 00 00 00 00 00 00 00 00 00 00 00 00 00 00 00 00 00 00 00 00 00 00 00 00 00 00 01
E: 0.961524 62 01 07 0a b9 05 63 03 00 00 00 00 00 00 00 00 00 00 00 00 00 00 00 00 00 00 00 00 00 00 00 00 00 00 00 00 00 00 00 00 00 00 00 00 00 00 00 00 00 00 00 00 00 00 00 00 00 00 00 00 00 00 01
E: 0.971538 62 01 07 0a cb 05 6b 03 00 00 00 00 00 00 00 00 00 00 00 00 00 00 00 00 00 00 00 00 00 00 00 00 00 00 00 00 00 00 00 00 00 00 00 00 00 00 00 00 00 00 00 00 00 00 00 00 00 00 00 00 00 00 01
E: 0.981515 62 01 07 0a dd 05 73 03 00 00 00 00 00 00 00 00 00 00 00 00 00 00 00 00 00 00 00 00 00 00 00 00 00 00 00 00 00 00 00 00 00 00 00 00 00 00 00 00 00 00 00 00 00 00 00 00 00 00 00 00 00 00 01
E: 0.991507 62 01 00 0b 70 05 83 03 07 0a ef 05 7c 03 00 00 00 00 00 00 00 00 00 00 00 00 00 00 00 00 00 00 00 00 00 00 00 00 00 00 00 00 00 00 00 00 00 00 00 00 00 00 00 00 00 00 00 00 00 00 00 00 02
E: 1.001505 62 01 07 0b 79 05 84 03 07 0a 02 06 83 03 00 00 00 00 00 00 00 00 00 00 00 00 00 00 00 00 00 00 00 00 00 00 00 00 00 00 00 00 00 00 00 00 00 00 00 00 00 00 00 00 00 00 00 00 00 00 00 00 02
E: 1.011457 62 01 07 0b 84 05 89 03 07 0a 13 06 8b 03 00 00 00 00 00 00 00 00 00 00 00 00 00 00 00 00 00 00 00 00 00 00 00 00 00 00 00 00 00 00 00 00 00 00 00 00 00 00 00 00 00 00 00 00 00 00 00 00 02
E: 1.021513 62 01 07 0b 84 05 89 03 07 0a 24 06 92 03 00 00 00 00 00 00 00 00 00 00 00 00 00 00 00 00 00 00 00 00 00 00 00 00 00 00 00 00 00 00 00 00 00 00 00 00 00 00 00 00 00 00 00 00 00 00 00 00 02
E: 1.031491 62 01 07 0b 8b 05 8b 03 07 0a 36 06 99 03 00 00 00 00 00 00 00 00 00 00 00 00 00 00 00 00 00 00 00 00 00 00 00 00 00 00 00 00 00 00 00 00 00 00 00 00 00 00 00 00 00 00 00 00 00 00 00 00 02
E: 1.041483 62 01 07 0b 8b 05 8b 03 07 0a 47 06 a0 03 00 00 00 00 00 00 00 00 00 00 00 00 00 00 00 00 00 00 00 00 00 00 00 00 00 00 00 00 00 00 00 00 00 00 00 00 00 00 00 00 00 00 00 00 00 00 00 00 02
E: 1.051479 62 01 07 0b 8b 05 8b 03 07 0a 57 06 a7 03 00 00 00 00 00 00 00 00 00 00 00 00 00 00 00 00 00 00 00 00 00 00 00 00 00 00 00 00 00 00 00 00 00 00 00 00 00 00 00 00 00 00 00 00 00 00 00 00 02
E: 1.061473 62 01 00 0b 8b 05 8b 03 07 0a 67 06 ad 03 00 00 00 00 00 00 00 00 00 00 00 00 00 00 00 00 00 00 00 00 00 00 00 00 00 00 00 00 00 00 00 00 00 00 00 00 00 00 00 00 00 00 00 00 00 00 00 00 02
E: 1.069470 62 01 07 0a 77 06 b3 03 00 0a 67 06 ad 03 00 00 00 00 00 00 00 00 00 00 00 00 00 00 00 00 00 00 00 00 00 00 00 00 00 00 00 00 00 00 00 00 00 00 00 00 00 00 00 00 00 00 00 00 00 00 00 00 01
E: 1.079464 62 01 07 0a 87 06 b9 03 00 0a 67 06 ad 03 00 00 00 00 00 00 00 00 00 00 00 00 00 00 00 00 00 00 00 00 00 00 00 00 00 00 00 00 00 00 00 00 00 00 00 00 00 00 00 00 00 00 00 00 00 00 00 00 01
E: 1.089455 62 01 07 0a 96 06 bf 03 00 0a 67 06 ad 03 00 00 00 00 00 00 00 00 00 00 00 00 00 00 00 00 00 00 00 00 00 00 00 00 00 00 00 00 00 00 00 00 00 00 00 00 00 00 00 00 00 00 00 00 00 00 00 00 01
E: 1.099454 62 01 07 0a a4 06 c5 03 00 0a 67 06 ad 03 00 00 00 00 00 00 00 00 00 00 00 00 00 00 00 00 00 00 00 00 00 00 00 00 00 00 00 00 00 00 00 00 00 00 00 00 00 00 00 00 00 00 00 00 00 00 00 00 01
E: 1.109447 62 01 07 0a b3 06 cb 03 00 0a 67 06 ad 03 00 00 00 00 00 00 00 00 00 00 00 00 00 00 00 00 00 00 00 00 00 00 00 00 00 00 00 00 00 00 00 00 00 00 00 00 00 00 00 00 00 00 00 00 00 00 00 00 01
E: 1.119445 62 01 07 0a c1 06 d2 03 00 0a 67 06 ad 03 00 00 00 00 00 00 00 00 00 00 00 00 00 00 00 00 00 00 00 00 00 00 00 00 00 00 00 00 00 00 00 00 00 00 00 00 00 00 00 00 00 00 00 00 00 00 00 00 01
E: 1.129437 62 01 07 0a d0 06 d9 03 00 0a 67 06 ad 03 00 00 00 00 00 00 00 00 00 00 00 00 00 00 00 00 00 00 00 00 00 00 00 00 00 00 00 00 00 00 00 00 00 00 00 00 00 00 00 00 00 00 00 00 00 00 00 00 01
E: 1.139431 62 01 07 0a dd 06 e0 03 00 0a 67 06 ad 03 00 00 00 00 00 00 00 00 00 00 00 00 00 00 00 00 00 00 00 00 00 00 00 00 00 00 00 00 00 00 00 00 00 00 00 00 00 00 00 00 00 00 00 00 00 00 00 00 01
E: 1.149428 62 01 07 0a ea 06 e6 03 00 0a 67 06 ad 03 00 00 00 00 00 00 00 00 00 00 00 00 00 00 00 00 00 00 00 00 00 00 00 00 00 00 00 00 00 00 00 00 00 00 00 00 00 00 00 00 00 00 00 00 00 00 00 00 01
E: 1.159425 62 01 07 0a f7 06 ec 03 00 0a 67 06 ad 03 00 00 00 00 00 00 00 00 00 00 00 00 00 00 00 00 00 00 00 00 00 00 00 00 00 00 00 00 00 00 00 00 00 00 00 00 00 00 00 00 00 00 00 00 00 00 00 00 01
E: 1.169418 62 01 07 0a 03 07 f3 03 00 0a 67 06 ad 03 00 00 00 00 00 00 00 00 00 00 00 00 00 00 00 00 00 00 00 00 00 00 00 00 00 00 00 00 00 00 00 00 00 00 00 00 00 00 00 00 00 00 00 00 00 00 00 00 01
E: 1.179413 62 01 07 0a 0f 07 f9 03 00 0a 67 06 ad 03 00 00 00 00 00 00 00 00 00 00 00 00 00 00 00 00 00 00 00 00 00 00 00 00 00 00 00 00 00 00 00 00 00 00 00 00 00 00 00 00 00 00 00 00 00 00 00 00 01
E: 1.189407 62 01 07 0a 1a 07 00 04 00 0a 67 06 ad 03 00 00 00 00 00 00 00 00 00 00 00 00 00 00 00 00 00 00 00 00 00 00 00 00 00 00 00 00 00 00 00 00 00 00 00 00 00 00 00 00 00 00 00 00 00 00 00 00 01
E: 1.199403 62 01 07 0a 24 07 06 04 00 0a 67 06 ad 03 00 00 00 00 00 00 00 00 00 00 00 00 00 00 00 00 00 00 00 00 00 00 00 00 00 00 00 00 00 00 00 00 00 00 00 00 00 00 00 00 00 00 00 00 00 00 00 00 01
E: 1.209397 62 01 07 0a 2e 07 0d 04 00 0a 67 06 ad 03 00 00 00 00 00 00 00 00 00 00 00 00 00 00 00 00 00 00 00 00 00 00 00 00 00 00 00 00 00 00 00 00 00 00 00 00 00 00 00 00 00 00 00 00 00 00 00 00 01
E: 1.219393 62 01 07 0a 37 07 13 04 00 0a 67 06 ad 03 00 00 00 00 00 00 00 00 00 00 00 00 00 00 00 00 00 00 00 00 00 00 00 00 00 00 00 00 00 00 00 00 00 00 00 00 00 00 00 00 00 00 00 00 00 00 00 00 01
E: 1.229389 62 01 07 0a 3f 07 19 04 00 0a 67 06 ad 03 00 00 00 00 00 00 00 00 00 00 00 00 00 00 00 00 00 00 00 00 00 00 00 00 00 00 00 00 00 00 00 00 00 00 00 00 00 00 00 00 00 00 00 00 00 00 00 00 01
E: 1.239381 62 01 07 0a 46 07 1f 04 00 0a 67 06 ad 03 00 00 00 00 00 00 00 00 00 00 00 00 00 00 00 00 00 00 00 00 00 00 00 00 00 00 00 00 00 00 00 00 00 00 00 00 00 00 00 00 00 00 00 00 00 00 00 00 01
E: 1.249379 62 01 07 0a 4d 07 24 04 00 0a 67 06 ad 03 00 00 00 00 00 00 00 00 00 00 00 00 00 00 00 00 00 00 00 00 00 00 00 00 00 00 00 00 00 00 00 00 00 00 00 00 00 00 00 00 00 00 00 00 00 00 00 00 01
E: 1.259373 62 01 07 0a 52 07 28 04 00 0a 67 06 ad 03 00 00 00 00 00 00 00 00 00 00 00 00 00 00 00 00 00 00 00 00 00 00 00 00 00 00 00 00 00 00 00 00 00 00 00 00 00 00 00 00 00 00 00 00 00 00 00 00 01
E: 1.269367 62 01 07 0a 56 07 2b 04 00 0a 67 06 ad 03 00 00 00 00 00 00 00 00 00 00 00 00 00 00 00 00 00 00 00 00 00 00 00 00 00 00 00 00 00 00 00 00 00 00 00 00 00 00 00 00 00 00 00 00 00 00 00 00 01
E: 1.279349 62 01 07 0a 56 07 2b 04 00 0a 67 06 ad 03 00 00 00 00 00 00 00 00 00 00 00 00 00 00 00 00 00 00 00 00 00 00 00 00 00 00 00 00 00 00 00 00 00 00 00 00 00 00 00 00 00 00 00 00 00 00 00 00 01
E: 1.289341 62 01 07 0a 56 07 2b 04 00 0a 67 06 ad 03 00 00 00 00 00 00 00 00 00 00 00 00 00 00 00 00 00 00 00 00 00 00 00 00 00 00 00 00 00 00 00 00 00 00 00 00 00 00 00 00 00 00 00 00 00 00 00 00 01
E: 1.299351 62 01 00 0a 56 07 2b 04 00 0a 67 06 ad 03 00 00 00 00 00 00 00 00 00 00 00 00 00 00 00 00 00 00 00 00 00 00 00 00 00 00 00 00 00 00 00 00 00 00 00 00 00 00 00 00 00 00 00 00 00 00 00 00 01
E: 1.309330 62 01 00 0a 56 07 2b 04 00 0a 67 06 ad 03 00 00 00 00 00 00 00 00 00 00 00 00 00 00 00 00 00 00 00 00 00 00 00 00 00 00 00 00 00 00 00 00 00 00 00 00 00 00 00 00 00 00 00 00 00 00 00 00 00
# 2. Land one finger,
   - land a second finger far enough from the first
   - move your two fingers
   - release the *first* finger
   - release the second finger
E: 22.650643 62 01 00 0c 9f 02 b8 02 00 0a 67 06 ad 03 00 00 00 00 00 00 00 00 00 00 00 00 00 00 00 00 00 00 00 00 00 00 00 00 00 00 00 00 00 00 00 00 00 00 00 00 00 00 00 00 00 00 00 00 00 00 00 00 01
E: 22.660654 62 01 07 0c 9f 02 b8 02 00 0a 67 06 ad 03 00 00 00 00 00 00 00 00 00 00 00 00 00 00 00 00 00 00 00 00 00 00 00 00 00 00 00 00 00 00 00 00 00 00 00 00 00 00 00 00 00 00 00 00 00 00 00 00 01
E: 22.670629 62 01 07 0c 9f 02 b8 02 00 0a 67 06 ad 03 00 00 00 00 00 00 00 00 00 00 00 00 00 00 00 00 00 00 00 00 00 00 00 00 00 00 00 00 00 00 00 00 00 00 00 00 00 00 00 00 00 00 00 00 00 00 00 00 01
E: 22.680702 62 01 07 0c 9f 02 b8 02 00 0a 67 06 ad 03 00 00 00 00 00 00 00 00 00 00 00 00 00 00 00 00 00 00 00 00 00 00 00 00 00 00 00 00 00 00 00 00 00 00 00 00 00 00 00 00 00 00 00 00 00 00 00 00 01
E: 22.690624 62 01 07 0c 9f 02 b8 02 00 0a 67 06 ad 03 00 00 00 00 00 00 00 00 00 00 00 00 00 00 00 00 00 00 00 00 00 00 00 00 00 00 00 00 00 00 00 00 00 00 00 00 00 00 00 00 00 00 00 00 00 00 00 00 01
E: 22.700633 62 01 07 0c 9f 02 b7 02 00 0a 67 06 ad 03 00 00 00 00 00 00 00 00 00 00 00 00 00 00 00 00 00 00 00 00 00 00 00 00 00 00 00 00 00 00 00 00 00 00 00 00 00 00 00 00 00 00 00 00 00 00 00 00 01
E: 22.710565 62 01 07 0c 9f 02 b7 02 00 0a 67 06 ad 03 00 00 00 00 00 00 00 00 00 00 00 00 00 00 00 00 00 00 00 00 00 00 00 00 00 00 00 00 00 00 00 00 00 00 00 00 00 00 00 00 00 00 00 00 00 00 00 00 01
E: 22.720607 62 01 07 0c 9f 02 b7 02 00 0a 67 06 ad 03 00 00 00 00 00 00 00 00 00 00 00 00 00 00 00 00 00 00 00 00 00 00 00 00 00 00 00 00 00 00 00 00 00 00 00 00 00 00 00 00 00 00 00 00 00 00 00 00 01
E: 22.730602 62 01 07 0c 9f 02 b7 02 00 0a 67 06 ad 03 00 00 00 00 00 00 00 00 00 00 00 00 00 00 00 00 00 00 00 00 00 00 00 00 00 00 00 00 00 00 00 00 00 00 00 00 00 00 00 00 00 00 00 00 00 00 00 00 01
E: 22.740612 62 01 07 0c a0 02 b6 02 00 0a 67 06 ad 03 00 00 00 00 00 00 00 00 00 00 00 00 00 00 00 00 00 00 00 00 00 00 00 00 00 00 00 00 00 00 00 00 00 00 00 00 00 00 00 00 00 00 00 00 00 00 00 00 01
E: 22.750545 62 01 07 0c a0 02 b6 02 00 0a 67 06 ad 03 00 00 00 00 00 00 00 00 00 00 00 00 00 00 00 00 00 00 00 00 00 00 00 00 00 00 00 00 00 00 00 00 00 00 00 00 00 00 00 00 00 00 00 00 00 00 00 00 01
E: 22.760586 62 01 07 0c a0 02 b6 02 00 0a 67 06 ad 03 00 00 00 00 00 00 00 00 00 00 00 00 00 00 00 00 00 00 00 00 00 00 00 00 00 00 00 00 00 00 00 00 00 00 00 00 00 00 00 00 00 00 00 00 00 00 00 00 01
E: 22.770551 62 01 07 0c 9f 02 b6 02 00 0a 67 06 ad 03 00 00 00 00 00 00 00 00 00 00 00 00 00 00 00 00 00 00 00 00 00 00 00 00 00 00 00 00 00 00 00 00 00 00 00 00 00 00 00 00 00 00 00 00 00 00 00 00 01
E: 22.780545 62 01 07 0c 9f 02 b6 02 00 0a 67 06 ad 03 00 00 00 00 00 00 00 00 00 00 00 00 00 00 00 00 00 00 00 00 00 00 00 00 00 00 00 00 00 00 00 00 00 00 00 00 00 00 00 00 00 00 00 00 00 00 00 00 01
E: 22.790571 62 01 07 0c 9f 02 b6 02 00 0a 67 06 ad 03 00 00 00 00 00 00 00 00 00 00 00 00 00 00 00 00 00 00 00 00 00 00 00 00 00 00 00 00 00 00 00 00 00 00 00 00 00 00 00 00 00 00 00 00 00 00 00 00 01
E: 22.800585 62 01 07 0c 9f 02 b5 02 00 0a 67 06 ad 03 00 00 00 00 00 00 00 00 00 00 00 00 00 00 00 00 00 00 00 00 00 00 00 00 00 00 00 00 00 00 00 00 00 00 00 00 00 00 00 00 00 00 00 00 00 00 00 00 01
E: 22.810558 62 01 07 0c 9f 02 b5 02 00 0a 67 06 ad 03 00 00 00 00 00 00 00 00 00 00 00 00 00 00 00 00 00 00 00 00 00 00 00 00 00 00 00 00 00 00 00 00 00 00 00 00 00 00 00 00 00 00 00 00 00 00 00 00 01
E: 22.820559 62 01 07 0c 9f 02 b5 02 00 0a 67 06 ad 03 00 00 00 00 00 00 00 00 00 00 00 00 00 00 00 00 00 00 00 00 00 00 00 00 00 00 00 00 00 00 00 00 00 00 00 00 00 00 00 00 00 00 00 00 00 00 00 00 01
E: 22.830519 62 01 07 0c 9f 02 b5 02 00 0a 67 06 ad 03 00 00 00 00 00 00 00 00 00 00 00 00 00 00 00 00 00 00 00 00 00 00 00 00 00 00 00 00 00 00 00 00 00 00 00 00 00 00 00 00 00 00 00 00 00 00 00 00 01
E: 22.840527 62 01 07 0c 9e 02 b5 02 00 0a 67 06 ad 03 00 00 00 00 00 00 00 00 00 00 00 00 00 00 00 00 00 00 00 00 00 00 00 00 00 00 00 00 00 00 00 00 00 00 00 00 00 00 00 00 00 00 00 00 00 00 00 00 01
E: 22.850539 62 01 07 0c 9e 02 b5 02 00 0a 67 06 ad 03 00 00 00 00 00 00 00 00 00 00 00 00 00 00 00 00 00 00 00 00 00 00 00 00 00 00 00 00 00 00 00 00 00 00 00 00 00 00 00 00 00 00 00 00 00 00 00 00 01
E: 22.860552 62 01 07 0c 9e 02 b4 02 00 0a 67 06 ad 03 00 00 00 00 00 00 00 00 00 00 00 00 00 00 00 00 00 00 00 00 00 00 00 00 00 00 00 00 00 00 00 00 00 00 00 00 00 00 00 00 00 00 00 00 00 00 00 00 01
E: 22.870531 62 01 07 0c 9e 02 b4 02 00 0a 67 06 ad 03 00 00 00 00 00 00 00 00 00 00 00 00 00 00 00 00 00 00 00 00 00 00 00 00 00 00 00 00 00 00 00 00 00 00 00 00 00 00 00 00 00 00 00 00 00 00 00 00 01
E: 22.880525 62 01 07 0c 9e 02 b4 02 00 0a 67 06 ad 03 00 00 00 00 00 00 00 00 00 00 00 00 00 00 00 00 00 00 00 00 00 00 00 00 00 00 00 00 00 00 00 00 00 00 00 00 00 00 00 00 00 00 00 00 00 00 00 00 01
E: 22.890539 62 01 07 0c 9d 02 b3 02 00 0a 67 06 ad 03 00 00 00 00 00 00 00 00 00 00 00 00 00 00 00 00 00 00 00 00 00 00 00 00 00 00 00 00 00 00 00 00 00 00 00 00 00 00 00 00 00 00 00 00 00 00 00 00 01
E: 22.900479 62 01 07 0c 9d 02 b3 02 00 0a 67 06 ad 03 00 00 00 00 00 00 00 00 00 00 00 00 00 00 00 00 00 00 00 00 00 00 00 00 00 00 00 00 00 00 00 00 00 00 00 00 00 00 00 00 00 00 00 00 00 00 00 00 01
E: 22.910514 62 01 07 0c 9d 02 b3 02 00 0a 67 06 ad 03 00 00 00 00 00 00 00 00 00 00 00 00 00 00 00 00 00 00 00 00 00 00 00 00 00 00 00 00 00 00 00 00 00 00 00 00 00 00 00 00 00 00 00 00 00 00 00 00 01
E: 22.920524 62 01 07 0c 9e 02 b2 02 00 0a 67 06 ad 03 00 00 00 00 00 00 00 00 00 00 00 00 00 00 00 00 00 00 00 00 00 00 00 00 00 00 00 00 00 00 00 00 00 00 00 00 00 00 00 00 00 00 00 00 00 00 00 00 01
E: 22.930433 62 01 07 0c 9e 02 b2 02 00 0a 67 06 ad 03 00 00 00 00 00 00 00 00 00 00 00 00 00 00 00 00 00 00 00 00 00 00 00 00 00 00 00 00 00 00 00 00 00 00 00 00 00 00 00 00 00 00 00 00 00 00 00 00 01
E: 22.940495 62 01 07 0c 9e 02 b2 02 00 0a 67 06 ad 03 00 00 00 00 00 00 00 00 00 00 00 00 00 00 00 00 00 00 00 00 00 00 00 00 00 00 00 00 00 00 00 00 00 00 00 00 00 00 00 00 00 00 00 00 00 00 00 00 01
E: 22.950493 62 01 07 0c 9e 02 b2 02 00 0a 67 06 ad 03 00 00 00 00 00 00 00 00 00 00 00 00 00 00 00 00 00 00 00 00 00 00 00 00 00 00 00 00 00 00 00 00 00 00 00 00 00 00 00 00 00 00 00 00 00 00 00 00 01
E: 22.960448 62 01 07 0c 9e 02 b2 02 00 0a 67 06 ad 03 00 00 00 00 00 00 00 00 00 00 00 00 00 00 00 00 00 00 00 00 00 00 00 00 00 00 00 00 00 00 00 00 00 00 00 00 00 00 00 00 00 00 00 00 00 00 00 00 01
E: 22.970446 62 01 07 0c 9e 02 b2 02 00 0a 67 06 ad 03 00 00 00 00 00 00 00 00 00 00 00 00 00 00 00 00 00 00 00 00 00 00 00 00 00 00 00 00 00 00 00 00 00 00 00 00 00 00 00 00 00 00 00 00 00 00 00 00 01
E: 22.980475 62 01 07 0c 9e 02 b2 02 00 0a 67 06 ad 03 00 00 00 00 00 00 00 00 00 00 00 00 00 00 00 00 00 00 00 00 00 00 00 00 00 00 00 00 00 00 00 00 00 00 00 00 00 00 00 00 00 00 00 00 00 00 00 00 01
E: 22.990474 62 01 07 0c 9e 02 b2 02 00 0a 67 06 ad 03 00 00 00 00 00 00 00 00 00 00 00 00 00 00 00 00 00 00 00 00 00 00 00 00 00 00 00 00 00 00 00 00 00 00 00 00 00 00 00 00 00 00 00 00 00 00 00 00 01
E: 23.000467 62 01 07 0c 9e 02 b2 02 00 0a 67 06 ad 03 00 00 00 00 00 00 00 00 00 00 00 00 00 00 00 00 00 00 00 00 00 00 00 00 00 00 00 00 00 00 00 00 00 00 00 00 00 00 00 00 00 00 00 00 00 00 00 00 01
E: 23.010423 62 01 07 0c 9e 02 b2 02 00 0a 67 06 ad 03 00 00 00 00 00 00 00 00 00 00 00 00 00 00 00 00 00 00 00 00 00 00 00 00 00 00 00 00 00 00 00 00 00 00 00 00 00 00 00 00 00 00 00 00 00 00 00 00 01
E: 23.020455 62 01 07 0c 9e 02 b2 02 00 0a 67 06 ad 03 00 00 00 00 00 00 00 00 00 00 00 00 00 00 00 00 00 00 00 00 00 00 00 00 00 00 00 00 00 00 00 00 00 00 00 00 00 00 00 00 00 00 00 00 00 00 00 00 01
E: 23.030471 62 01 07 0c 9f 02 b1 02 00 0a 67 06 ad 03 00 00 00 00 00 00 00 00 00 00 00 00 00 00 00 00 00 00 00 00 00 00 00 00 00 00 00 00 00 00 00 00 00 00 00 00 00 00 00 00 00 00 00 00 00 00 00 00 01
E: 23.040445 62 01 07 0c 9f 02 b1 02 00 0d 16 03 5f 02 00 00 00 00 00 00 00 00 00 00 00 00 00 00 00 00 00 00 00 00 00 00 00 00 00 00 00 00 00 00 00 00 00 00 00 00 00 00 00 00 00 00 00 00 00 00 00 00 02
E: 23.050463 62 01 07 0c a0 02 b1 02 07 0d 15 03 5f 02 00 00 00 00 00 00 00 00 00 00 00 00 00 00 00 00 00 00 00 00 00 00 00 00 00 00 00 00 00 00 00 00 00 00 00 00 00 00 00 00 00 00 00 00 00 00 00 00 02
E: 23.060403 62 01 07 0c a1 02 b0 02 07 0d 15 03 5e 02 00 00 00 00 00 00 00 00 00 00 00 00 00 00 00 00 00 00 00 00 00 00 00 00 00 00 00 00 00 00 00 00 00 00 00 00 00 00 00 00 00 00 00 00 00 00 00 00 02
E: 23.070449 62 01 07 0c a1 02 af 02 07 0d 15 03 5e 02 00 00 00 00 00 00 00 00 00 00 00 00 00 00 00 00 00 00 00 00 00 00 00 00 00 00 00 00 00 00 00 00 00 00 00 00 00 00 00 00 00 00 00 00 00 00 00 00 02
E: 23.080444 62 01 07 0c a2 02 af 02 07 0d 15 03 5e 02 00 00 00 00 00 00 00 00 00 00 00 00 00 00 00 00 00 00 00 00 00 00 00 00 00 00 00 00 00 00 00 00 00 00 00 00 00 00 00 00 00 00 00 00 00 00 00 00 02
E: 23.090427 62 01 07 0c a2 02 af 02 07 0d 15 03 5e 02 00 00 00 00 00 00 00 00 00 00 00 00 00 00 00 00 00 00 00 00 00 00 00 00 00 00 00 00 00 00 00 00 00 00 00 00 00 00 00 00 00 00 00 00 00 00 00 00 02
E: 23.100430 62 01 07 0c a2 02 ae 02 07 0d 15 03 5e 02 00 00 00 00 00 00 00 00 00 00 00 00 00 00 00 00 00 00 00 00 00 00 00 00 00 00 00 00 00 00 00 00 00 00 00 00 00 00 00 00 00 00 00 00 00 00 00 00 02
E: 23.110451 62 01 07 0c a3 02 ae 02 07 0d 14 03 5d 02 00 00 00 00 00 00 00 00 00 00 00 00 00 00 00 00 00 00 00 00 00 00 00 00 00 00 00 00 00 00 00 00 00 00 00 00 00 00 00 00 00 00 00 00 00 00 00 00 02
E: 23.120422 62 01 07 0c a2 02 ae 02 07 0d 14 03 5d 02 00 00 00 00 00 00 00 00 00 00 00 00 00 00 00 00 00 00 00 00 00 00 00 00 00 00 00 00 00 00 00 00 00 00 00 00 00 00 00 00 00 00 00 00 00 00 00 00 02
E: 23.130390 62 01 07 0c a3 02 ae 02 07 0d 15 03 5d 02 00 00 00 00 00 00 00 00 00 00 00 00 00 00 00 00 00 00 00 00 00 00 00 00 00 00 00 00 00 00 00 00 00 00 00 00 00 00 00 00 00 00 00 00 00 00 00 00 02
E: 23.140412 62 01 07 0c a3 02 ae 02 07 0d 15 03 5e 02 00 00 00 00 00 00 00 00 00 00 00 00 00 00 00 00 00 00 00 00 00 00 00 00 00 00 00 00 00 00 00 00 00 00 00 00 00 00 00 00 00 00 00 00 00 00 00 00 02
E: 23.150407 62 01 07 0c a3 02 ae 02 07 0d 15 03 5d 02 00 00 00 00 00 00 00 00 00 00 00 00 00 00 00 00 00 00 00 00 00 00 00 00 00 00 00 00 00 00 00 00 00 00 00 00 00 00 00 00 00 00 00 00 00 00 00 00 02
E: 23.160388 62 01 07 0c a3 02 ae 02 07 0d 15 03 5d 02 00 00 00 00 00 00 00 00 00 00 00 00 00 00 00 00 00 00 00 00 00 00 00 00 00 00 00 00 00 00 00 00 00 00 00 00 00 00 00 00 00 00 00 00 00 00 00 00 02
E: 23.170397 62 01 07 0c a4 02 ae 02 07 0d 16 03 5e 02 00 00 00 00 00 00 00 00 00 00 00 00 00 00 00 00 00 00 00 00 00 00 00 00 00 00 00 00 00 00 00 00 00 00 00 00 00 00 00 00 00 00 00 00 00 00 00 00 02
E: 23.180311 62 01 07 0c a4 02 ae 02 07 0d 16 03 5e 02 00 00 00 00 00 00 00 00 00 00 00 00 00 00 00 00 00 00 00 00 00 00 00 00 00 00 00 00 00 00 00 00 00 00 00 00 00 00 00 00 00 00 00 00 00 00 00 00 02
E: 23.190387 62 01 07 0c a4 02 ad 02 07 0d 17 03 5f 02 00 00 00 00 00 00 00 00 00 00 00 00 00 00 00 00 00 00 00 00 00 00 00 00 00 00 00 00 00 00 00 00 00 00 00 00 00 00 00 00 00 00 00 00 00 00 00 00 02
E: 23.200384 62 01 07 0c a4 02 ad 02 07 0d 18 03 5f 02 00 00 00 00 00 00 00 00 00 00 00 00 00 00 00 00 00 00 00 00 00 00 00 00 00 00 00 00 00 00 00 00 00 00 00 00 00 00 00 00 00 00 00 00 00 00 00 00 02
E: 23.210380 62 01 07 0c a4 02 ae 02 07 0d 19 03 60 02 00 00 00 00 00 00 00 00 00 00 00 00 00 00 00 00 00 00 00 00 00 00 00 00 00 00 00 00 00 00 00 00 00 00 00 00 00 00 00 00 00 00 00 00 00 00 00 00 02
E: 23.220356 62 01 07 0c a4 02 ae 02 07 0d 19 03 60 02 00 00 00 00 00 00 00 00 00 00 00 00 00 00 00 00 00 00 00 00 00 00 00 00 00 00 00 00 00 00 00 00 00 00 00 00 00 00 00 00 00 00 00 00 00 00 00 00 02
E: 23.230355 62 01 07 0c a4 02 ae 02 07 0d 19 03 60 02 00 00 00 00 00 00 00 00 00 00 00 00 00 00 00 00 00 00 00 00 00 00 00 00 00 00 00 00 00 00 00 00 00 00 00 00 00 00 00 00 00 00 00 00 00 00 00 00 02
E: 23.240364 62 01 07 0c a4 02 ae 02 07 0d 1a 03 61 02 00 00 00 00 00 00 00 00 00 00 00 00 00 00 00 00 00 00 00 00 00 00 00 00 00 00 00 00 00 00 00 00 00 00 00 00 00 00 00 00 00 00 00 00 00 00 00 00 02
E: 23.250359 62 01 07 0c a3 02 ae 02 07 0d 1a 03 61 02 00 00 00 00 00 00 00 00 00 00 00 00 00 00 00 00 00 00 00 00 00 00 00 00 00 00 00 00 00 00 00 00 00 00 00 00 00 00 00 00 00 00 00 00 00 00 00 00 02
E: 23.260336 62 01 07 0c a3 02 ae 02 07 0d 1a 03 61 02 00 00 00 00 00 00 00 00 00 00 00 00 00 00 00 00 00 00 00 00 00 00 00 00 00 00 00 00 00 00 00 00 00 00 00 00 00 00 00 00 00 00 00 00 00 00 00 00 02
E: 23.270328 62 01 07 0c a3 02 ae 02 07 0d 1a 03 61 02 00 00 00 00 00 00 00 00 00 00 00 00 00 00 00 00 00 00 00 00 00 00 00 00 00 00 00 00 00 00 00 00 00 00 00 00 00 00 00 00 00 00 00 00 00 00 00 00 02
E: 23.280343 62 01 07 0c a3 02 ae 02 07 0d 19 03 60 02 00 00 00 00 00 00 00 00 00 00 00 00 00 00 00 00 00 00 00 00 00 00 00 00 00 00 00 00 00 00 00 00 00 00 00 00 00 00 00 00 00 00 00 00 00 00 00 00 02
E: 23.290342 62 01 07 0c a3 02 ad 02 07 0d 18 03 60 02 00 00 00 00 00 00 00 00 00 00 00 00 00 00 00 00 00 00 00 00 00 00 00 00 00 00 00 00 00 00 00 00 00 00 00 00 00 00 00 00 00 00 00 00 00 00 00 00 02
E: 23.300287 62 01 07 0c a3 02 ac 02 07 0d 18 03 60 02 00 00 00 00 00 00 00 00 00 00 00 00 00 00 00 00 00 00 00 00 00 00 00 00 00 00 00 00 00 00 00 00 00 00 00 00 00 00 00 00 00 00 00 00 00 00 00 00 02
E: 23.310311 62 01 07 0c a3 02 ac 02 07 0d 18 03 60 02 00 00 00 00 00 00 00 00 00 00 00 00 00 00 00 00 00 00 00 00 00 00 00 00 00 00 00 00 00 00 00 00 00 00 00 00 00 00 00 00 00 00 00 00 00 00 00 00 02
E: 23.320321 62 01 07 0c a3 02 ab 02 07 0d 17 03 5f 02 00 00 00 00 00 00 00 00 00 00 00 00 00 00 00 00 00 00 00 00 00 00 00 00 00 00 00 00 00 00 00 00 00 00 00 00 00 00 00 00 00 00 00 00 00 00 00 00 02
E: 23.330320 62 01 07 0c a4 02 aa 02 07 0d 17 03 5e 02 00 00 00 00 00 00 00 00 00 00 00 00 00 00 00 00 00 00 00 00 00 00 00 00 00 00 00 00 00 00 00 00 00 00 00 00 00 00 00 00 00 00 00 00 00 00 00 00 02
E: 23.340311 62 01 07 0c a4 02 a9 02 07 0d 16 03 5d 02 00 00 00 00 00 00 00 00 00 00 00 00 00 00 00 00 00 00 00 00 00 00 00 00 00 00 00 00 00 00 00 00 00 00 00 00 00 00 00 00 00 00 00 00 00 00 00 00 02
E: 23.350301 62 01 07 0c a3 02 a8 02 07 0d 14 03 5b 02 00 00 00 00 00 00 00 00 00 00 00 00 00 00 00 00 00 00 00 00 00 00 00 00 00 00 00 00 00 00 00 00 00 00 00 00 00 00 00 00 00 00 00 00 00 00 00 00 02
E: 23.360302 62 01 07 0c a3 02 a6 02 07 0d 13 03 59 02 00 00 00 00 00 00 00 00 00 00 00 00 00 00 00 00 00 00 00 00 00 00 00 00 00 00 00 00 00 00 00 00 00 00 00 00 00 00 00 00 00 00 00 00 00 00 00 00 02
E: 23.370298 62 01 07 0c a1 02 a3 02 07 0d 12 03 56 02 00 00 00 00 00 00 00 00 00 00 00 00 00 00 00 00 00 00 00 00 00 00 00 00 00 00 00 00 00 00 00 00 00 00 00 00 00 00 00 00 00 00 00 00 00 00 00 00 02
E: 23.380234 62 01 07 0c a0 02 a1 02 07 0d 10 03 53 02 00 00 00 00 00 00 00 00 00 00 00 00 00 00 00 00 00 00 00 00 00 00 00 00 00 00 00 00 00 00 00 00 00 00 00 00 00 00 00 00 00 00 00 00 00 00 00 00 02
E: 23.390288 62 01 07 0c 9e 02 9d 02 07 0d 0d 03 4f 02 00 00 00 00 00 00 00 00 00 00 00 00 00 00 00 00 00 00 00 00 00 00 00 00 00 00 00 00 00 00 00 00 00 00 00 00 00 00 00 00 00 00 00 00 00 00 00 00 02
E: 23.400281 62 01 07 0c 9c 02 98 02 07 0d 0b 03 4a 02 00 00 00 00 00 00 00 00 00 00 00 00 00 00 00 00 00 00 00 00 00 00 00 00 00 00 00 00 00 00 00 00 00 00 00 00 00 00 00 00 00 00 00 00 00 00 00 00 02
E: 23.410278 62 01 07 0c 9a 02 92 02 07 0d 08 03 44 02 00 00 00 00 00 00 00 00 00 00 00 00 00 00 00 00 00 00 00 00 00 00 00 00 00 00 00 00 00 00 00 00 00 00 00 00 00 00 00 00 00 00 00 00 00 00 00 00 02
E: 23.420272 62 01 07 0c 97 02 8c 02 07 0d 04 03 3e 02 00 00 00 00 00 00 00 00 00 00 00 00 00 00 00 00 00 00 00 00 00 00 00 00 00 00 00 00 00 00 00 00 00 00 00 00 00 00 00 00 00 00 00 00 00 00 00 00 02
E: 23.430267 62 01 07 0c 94 02 85 02 07 0d 01 03 36 02 00 00 00 00 00 00 00 00 00 00 00 00 00 00 00 00 00 00 00 00 00 00 00 00 00 00 00 00 00 00 00 00 00 00 00 00 00 00 00 00 00 00 00 00 00 00 00 00 02
E: 23.440262 62 01 07 0c 91 02 7e 02 07 0d fc 02 2e 02 00 00 00 00 00 00 00 00 00 00 00 00 00 00 00 00 00 00 00 00 00 00 00 00 00 00 00 00 00 00 00 00 00 00 00 00 00 00 00 00 00 00 00 00 00 00 00 00 02
E: 23.450256 62 01 07 0c 8e 02 74 02 07 0d f8 02 26 02 00 00 00 00 00 00 00 00 00 00 00 00 00 00 00 00 00 00 00 00 00 00 00 00 00 00 00 00 00 00 00 00 00 00 00 00 00 00 00 00 00 00 00 00 00 00 00 00 02
E: 23.460253 62 01 07 0c 8b 02 6b 02 07 0d f3 02 1c 02 00 00 00 00 00 00 00 00 00 00 00 00 00 00 00 00 00 00 00 00 00 00 00 00 00 00 00 00 00 00 00 00 00 00 00 00 00 00 00 00 00 00 00 00 00 00 00 00 02
E: 23.470246 62 01 07 0c 86 02 62 02 07 0d ee 02 13 02 00 00 00 00 00 00 00 00 00 00 00 00 00 00 00 00 00 00 00 00 00 00 00 00 00 00 00 00 00 00 00 00 00 00 00 00 00 00 00 00 00 00 00 00 00 00 00 00 02
E: 23.480185 62 01 07 0c 82 02 58 02 07 0d e9 02 08 02 00 00 00 00 00 00 00 00 00 00 00 00 00 00 00 00 00 00 00 00 00 00 00 00 00 00 00 00 00 00 00 00 00 00 00 00 00 00 00 00 00 00 00 00 00 00 00 00 02
E: 23.490239 62 01 07 0c 7c 02 4d 02 07 0d e3 02 fe 01 00 00 00 00 00 00 00 00 00 00 00 00 00 00 00 00 00 00 00 00 00 00 00 00 00 00 00 00 00 00 00 00 00 00 00 00 00 00 00 00 00 00 00 00 00 00 00 00 02
E: 23.500233 62 01 07 0c 77 02 42 02 07 0d dd 02 f2 01 00 00 00 00 00 00 00 00 00 00 00 00 00 00 00 00 00 00 00 00 00 00 00 00 00 00 00 00 00 00 00 00 00 00 00 00 00 00 00 00 00 00 00 00 00 00 00 00 02
E: 23.510228 62 01 07 0c 72 02 37 02 07 0d d7 02 e7 01 00 00 00 00 00 00 00 00 00 00 00 00 00 00 00 00 00 00 00 00 00 00 00 00 00 00 00 00 00 00 00 00 00 00 00 00 00 00 00 00 00 00 00 00 00 00 00 00 02
E: 23.520222 62 01 07 0c 6c 02 2b 02 07 0d d1 02 db 01 00 00 00 00 00 00 00 00 00 00 00 00 00 00 00 00 00 00 00 00 00 00 00 00 00 00 00 00 00 00 00 00 00 00 00 00 00 00 00 00 00 00 00 00 00 00 00 00 02
E: 23.530219 62 01 07 0c 65 02 20 02 07 0d ca 02 cf 01 00 00 00 00 00 00 00 00 00 00 00 00 00 00 00 00 00 00 00 00 00 00 00 00 00 00 00 00 00 00 00 00 00 00 00 00 00 00 00 00 00 00 00 00 00 00 00 00 02
E: 23.540211 62 01 07 0c 5e 02 14 02 07 0d c3 02 c3 01 00 00 00 00 00 00 00 00 00 00 00 00 00 00 00 00 00 00 00 00 00 00 00 00 00 00 00 00 00 00 00 00 00 00 00 00 00 00 00 00 00 00 00 00 00 00 00 00 02
E: 23.550151 62 01 07 0c 58 02 07 02 07 0d bc 02 b7 01 00 00 00 00 00 00 00 00 00 00 00 00 00 00 00 00 00 00 00 00 00 00 00 00 00 00 00 00 00 00 00 00 00 00 00 00 00 00 00 00 00 00 00 00 00 00 00 00 02
E: 23.560204 62 01 07 0c 51 02 fb 01 07 0d b5 02 aa 01 00 00 00 00 00 00 00 00 00 00 00 00 00 00 00 00 00 00 00 00 00 00 00 00 00 00 00 00 00 00 00 00 00 00 00 00 00 00 00 00 00 00 00 00 00 00 00 00 02
E: 23.570197 62 01 07 0c 4b 02 ef 01 07 0d ad 02 9d 01 00 00 00 00 00 00 00 00 00 00 00 00 00 00 00 00 00 00 00 00 00 00 00 00 00 00 00 00 00 00 00 00 00 00 00 00 00 00 00 00 00 00 00 00 00 00 00 00 02
E: 23.580117 62 01 07 0c 44 02 e3 01 07 0d a6 02 91 01 00 00 00 00 00 00 00 00 00 00 00 00 00 00 00 00 00 00 00 00 00 00 00 00 00 00 00 00 00 00 00 00 00 00 00 00 00 00 00 00 00 00 00 00 00 00 00 00 02
E: 23.590188 62 01 07 0c 3c 02 d7 01 07 0d 9e 02 84 01 00 00 00 00 00 00 00 00 00 00 00 00 00 00 00 00 00 00 00 00 00 00 00 00 00 00 00 00 00 00 00 00 00 00 00 00 00 00 00 00 00 00 00 00 00 00 00 00 02
E: 23.600181 62 01 07 0c 35 02 cb 01 07 0d 97 02 78 01 00 00 00 00 00 00 00 00 00 00 00 00 00 00 00 00 00 00 00 00 00 00 00 00 00 00 00 00 00 00 00 00 00 00 00 00 00 00 00 00 00 00 00 00 00 00 00 00 02
E: 23.610176 62 01 07 0c 2f 02 bf 01 07 0d 90 02 6c 01 00 00 00 00 00 00 00 00 00 00 00 00 00 00 00 00 00 00 00 00 00 00 00 00 00 00 00 00 00 00 00 00 00 00 00 00 00 00 00 00 00 00 00 00 00 00 00 00 02
E: 23.620169 62 01 07 0c 29 02 b4 01 07 0d 89 02 61 01 00 00 00 00 00 00 00 00 00 00 00 00 00 00 00 00 00 00 00 00 00 00 00 00 00 00 00 00 00 00 00 00 00 00 00 00 00 00 00 00 00 00 00 00 00 00 00 00 02
E: 23.630165 62 01 07 0c 24 02 a9 01 07 0d 83 02 56 01 00 00 00 00 00 00 00 00 00 00 00 00 00 00 00 00 00 00 00 00 00 00 00 00 00 00 00 00 00 00 00 00 00 00 00 00 00 00 00 00 00 00 00 00 00 00 00 00 02
E: 23.640160 62 01 07 0c 1e 02 9f 01 07 0d 7e 02 4c 01 00 00 00 00 00 00 00 00 00 00 00 00 00 00 00 00 00 00 00 00 00 00 00 00 00 00 00 00 00 00 00 00 00 00 00 00 00 00 00 00 00 00 00 00 00 00 00 00 02
E: 23.650157 62 01 07 0c 19 02 97 01 07 0d 79 02 44 01 00 00 00 00 00 00 00 00 00 00 00 00 00 00 00 00 00 00 00 00 00 00 00 00 00 00 00 00 00 00 00 00 00 00 00 00 00 00 00 00 00 00 00 00 00 00 00 00 02
E: 23.660151 62 01 07 0c 15 02 8f 01 07 0d 75 02 3c 01 00 00 00 00 00 00 00 00 00 00 00 00 00 00 00 00 00 00 00 00 00 00 00 00 00 00 00 00 00 00 00 00 00 00 00 00 00 00 00 00 00 00 00 00 00 00 00 00 02
E: 23.670144 62 01 07 0c 12 02 88 01 07 0d 72 02 36 01 00 00 00 00 00 00 00 00 00 00 00 00 00 00 00 00 00 00 00 00 00 00 00 00 00 00 00 00 00 00 00 00 00 00 00 00 00 00 00 00 00 00 00 00 00 00 00 00 02
E: 23.680084 62 01 07 0c 0f 02 83 01 07 0d 6f 02 31 01 00 00 00 00 00 00 00 00 00 00 00 00 00 00 00 00 00 00 00 00 00 00 00 00 00 00 00 00 00 00 00 00 00 00 00 00 00 00 00 00 00 00 00 00 00 00 00 00 02
E: 23.690134 62 01 07 0c 0d 02 7f 01 07 0d 6d 02 2d 01 00 00 00 00 00 00 00 00 00 00 00 00 00 00 00 00 00 00 00 00 00 00 00 00 00 00 00 00 00 00 00 00 00 00 00 00 00 00 00 00 00 00 00 00 00 00 00 00 02
E: 23.700133 62 01 07 0c 0b 02 7c 01 07 0d 6c 02 2b 01 00 00 00 00 00 00 00 00 00 00 00 00 00 00 00 00 00 00 00 00 00 00 00 00 00 00 00 00 00 00 00 00 00 00 00 00 00 00 00 00 00 00 00 00 00 00 00 00 02
E: 23.710125 62 01 07 0c 0a 02 7a 01 07 0d 6b 02 29 01 00 00 00 00 00 00 00 00 00 00 00 00 00 00 00 00 00 00 00 00 00 00 00 00 00 00 00 00 00 00 00 00 00 00 00 00 00 00 00 00 00 00 00 00 00 00 00 00 02
E: 23.720122 62 01 07 0c 09 02 79 01 07 0d 6a 02 28 01 00 00 00 00 00 00 00 00 00 00 00 00 00 00 00 00 00 00 00 00 00 00 00 00 00 00 00 00 00 00 00 00 00 00 00 00 00 00 00 00 00 00 00 00 00 00 00 00 02
E: 23.730120 62 01 07 0c 08 02 78 01 07 0d 6a 02 27 01 00 00 00 00 00 00 00 00 00 00 00 00 00 00 00 00 00 00 00 00 00 00 00 00 00 00 00 00 00 00 00 00 00 00 00 00 00 00 00 00 00 00 00 00 00 00 00 00 02
E: 23.740095 62 01 07 0c 08 02 78 01 07 0d 6a 02 27 01 00 00 00 00 00 00 00 00 00 00 00 00 00 00 00 00 00 00 00 00 00 00 00 00 00 00 00 00 00 00 00 00 00 00 00 00 00 00 00 00 00 00 00 00 00 00 00 00 02
E: 23.750093 62 01 07 0c 08 02 78 01 07 0d 6a 02 27 01 00 00 00 00 00 00 00 00 00 00 00 00 00 00 00 00 00 00 00 00 00 00 00 00 00 00 00 00 00 00 00 00 00 00 00 00 00 00 00 00 00 00 00 00 00 00 00 00 02
E: 23.760102 62 01 07 0c 08 02 78 01 07 0d 6b 02 28 01 00 00 00 00 00 00 00 00 00 00 00 00 00 00 00 00 00 00 00 00 00 00 00 00 00 00 00 00 00 00 00 00 00 00 00 00 00 00 00 00 00 00 00 00 00 00 00 00 02
E: 23.770081 62 01 07 0c 08 02 78 01 07 0d 6b 02 28 01 00 00 00 00 00 00 00 00 00 00 00 00 00 00 00 00 00 00 00 00 00 00 00 00 00 00 00 00 00 00 00 00 00 00 00 00 00 00 00 00 00 00 00 00 00 00 00 00 02
E: 23.780042 62 01 07 0c 08 02 79 01 07 0d 6b 02 28 01 00 00 00 00 00 00 00 00 00 00 00 00 00 00 00 00 00 00 00 00 00 00 00 00 00 00 00 00 00 00 00 00 00 00 00 00 00 00 00 00 00 00 00 00 00 00 00 00 02
E: 23.790024 62 01 07 0c 08 02 79 01 07 0d 6b 02 28 01 00 00 00 00 00 00 00 00 00 00 00 00 00 00 00 00 00 00 00 00 00 00 00 00 00 00 00 00 00 00 00 00 00 00 00 00 00 00 00 00 00 00 00 00 00 00 00 00 02
E: 23.800082 62 01 07 0c 08 02 79 01 07 0d 6c 02 29 01 00 00 00 00 00 00 00 00 00 00 00 00 00 00 00 00 00 00 00 00 00 00 00 00 00 00 00 00 00 00 00 00 00 00 00 00 00 00 00 00 00 00 00 00 00 00 00 00 02
E: 23.810066 62 01 07 0c 08 02 79 01 07 0d 6c 02 29 01 00 00 00 00 00 00 00 00 00 00 00 00 00 00 00 00 00 00 00 00 00 00 00 00 00 00 00 00 00 00 00 00 00 00 00 00 00 00 00 00 00 00 00 00 00 00 00 00 02
E: 23.820076 62 01 07 0c 08 02 78 01 07 0d 6c 02 29 01 00 00 00 00 00 00 00 00 00 00 00 00 00 00 00 00 00 00 00 00 00 00 00 00 00 00 00 00 00 00 00 00 00 00 00 00 00 00 00 00 00 00 00 00 00 00 00 00 02
E: 23.830051 62 01 07 0c 08 02 78 01 07 0d 6c 02 29 01 00 00 00 00 00 00 00 00 00 00 00 00 00 00 00 00 00 00 00 00 00 00 00 00 00 00 00 00 00 00 00 00 00 00 00 00 00 00 00 00 00 00 00 00 00 00 00 00 02
E: 23.840046 62 01 07 0c 08 02 78 01 07 0d 6c 02 29 01 00 00 00 00 00 00 00 00 00 00 00 00 00 00 00 00 00 00 00 00 00 00 00 00 00 00 00 00 00 00 00 00 00 00 00 00 00 00 00 00 00 00 00 00 00 00 00 00 02
E: 23.850060 62 01 07 0c 08 02 78 01 07 0d 6d 02 29 01 00 00 00 00 00 00 00 00 00 00 00 00 00 00 00 00 00 00 00 00 00 00 00 00 00 00 00 00 00 00 00 00 00 00 00 00 00 00 00 00 00 00 00 00 00 00 00 00 02
E: 23.860039 62 01 07 0c 08 02 78 01 07 0d 6d 02 29 01 00 00 00 00 00 00 00 00 00 00 00 00 00 00 00 00 00 00 00 00 00 00 00 00 00 00 00 00 00 00 00 00 00 00 00 00 00 00 00 00 00 00 00 00 00 00 00 00 02
E: 23.869996 62 01 07 0c 08 02 78 01 07 0d 6d 02 29 01 00 00 00 00 00 00 00 00 00 00 00 00 00 00 00 00 00 00 00 00 00 00 00 00 00 00 00 00 00 00 00 00 00 00 00 00 00 00 00 00 00 00 00 00 00 00 00 00 02
E: 23.880025 62 01 07 0c 08 02 78 01 07 0d 6d 02 29 01 00 00 00 00 00 00 00 00 00 00 00 00 00 00 00 00 00 00 00 00 00 00 00 00 00 00 00 00 00 00 00 00 00 00 00 00 00 00 00 00 00 00 00 00 00 00 00 00 02
E: 23.890023 62 01 07 0c 08 02 78 01 07 0d 6d 02 29 01 00 00 00 00 00 00 00 00 00 00 00 00 00 00 00 00 00 00 00 00 00 00 00 00 00 00 00 00 00 00 00 00 00 00 00 00 00 00 00 00 00 00 00 00 00 00 00 00 02
E: 23.900017 62 01 07 0c 08 02 78 01 07 0d 6d 02 29 01 00 00 00 00 00 00 00 00 00 00 00 00 00 00 00 00 00 00 00 00 00 00 00 00 00 00 00 00 00 00 00 00 00 00 00 00 00 00 00 00 00 00 00 00 00 00 00 00 02
E: 23.910001 62 01 07 0c 07 02 78 01 07 0d 6d 02 2a 01 00 00 00 00 00 00 00 00 00 00 00 00 00 00 00 00 00 00 00 00 00 00 00 00 00 00 00 00 00 00 00 00 00 00 00 00 00 00 00 00 00 00 00 00 00 00 00 00 02
E: 23.920007 62 01 07 0c 07 02 78 01 07 0d 6d 02 2a 01 00 00 00 00 00 00 00 00 00 00 00 00 00 00 00 00 00 00 00 00 00 00 00 00 00 00 00 00 00 00 00 00 00 00 00 00 00 00 00 00 00 00 00 00 00 00 00 00 02
E: 23.930018 62 01 07 0c 07 02 79 01 07 0d 6d 02 2a 01 00 00 00 00 00 00 00 00 00 00 00 00 00 00 00 00 00 00 00 00 00 00 00 00 00 00 00 00 00 00 00 00 00 00 00 00 00 00 00 00 00 00 00 00 00 00 00 00 02
E: 23.940009 62 01 07 0c 08 02 79 01 07 0d 6e 02 2a 01 00 00 00 00 00 00 00 00 00 00 00 00 00 00 00 00 00 00 00 00 00 00 00 00 00 00 00 00 00 00 00 00 00 00 00 00 00 00 00 00 00 00 00 00 00 00 00 00 02
E: 23.949954 62 01 07 0c 08 02 79 01 07 0d 6e 02 2b 01 00 00 00 00 00 00 00 00 00 00 00 00 00 00 00 00 00 00 00 00 00 00 00 00 00 00 00 00 00 00 00 00 00 00 00 00 00 00 00 00 00 00 00 00 00 00 00 00 02
E: 23.960003 62 01 07 0c 07 02 79 01 07 0d 6e 02 2b 01 00 00 00 00 00 00 00 00 00 00 00 00 00 00 00 00 00 00 00 00 00 00 00 00 00 00 00 00 00 00 00 00 00 00 00 00 00 00 00 00 00 00 00 00 00 00 00 00 02
E: 23.969995 62 01 07 0c 08 02 79 01 07 0d 6e 02 2b 01 00 00 00 00 00 00 00 00 00 00 00 00 00 00 00 00 00 00 00 00 00 00 00 00 00 00 00 00 00 00 00 00 00 00 00 00 00 00 00 00 00 00 00 00 00 00 00 00 02
E: 23.979993 62 01 07 0c 08 02 79 01 07 0d 6e 02 2c 01 00 00 00 00 00 00 00 00 00 00 00 00 00 00 00 00 00 00 00 00 00 00 00 00 00 00 00 00 00 00 00 00 00 00 00 00 00 00 00 00 00 00 00 00 00 00 00 00 02
E: 23.989927 62 01 07 0c 08 02 79 01 07 0d 6e 02 2c 01 00 00 00 00 00 00 00 00 00 00 00 00 00 00 00 00 00 00 00 00 00 00 00 00 00 00 00 00 00 00 00 00 00 00 00 00 00 00 00 00 00 00 00 00 00 00 00 00 02
E: 23.999929 62 01 07 0c 08 02 79 01 07 0d 6e 02 2c 01 00 00 00 00 00 00 00 00 00 00 00 00 00 00 00 00 00 00 00 00 00 00 00 00 00 00 00 00 00 00 00 00 00 00 00 00 00 00 00 00 00 00 00 00 00 00 00 00 02
E: 24.009939 62 01 07 0c 08 02 79 01 07 0d 6e 02 2c 01 00 00 00 00 00 00 00 00 00 00 00 00 00 00 00 00 00 00 00 00 00 00 00 00 00 00 00 00 00 00 00 00 00 00 00 00 00 00 00 00 00 00 00 00 00 00 00 00 02
E: 24.019975 62 01 07 0c 08 02 79 01 07 0d 6e 02 2d 01 00 00 00 00 00 00 00 00 00 00 00 00 00 00 00 00 00 00 00 00 00 00 00 00 00 00 00 00 00 00 00 00 00 00 00 00 00 00 00 00 00 00 00 00 00 00 00 00 02
E: 24.029953 62 01 07 0c 08 02 79 01 07 0d 6e 02 2d 01 00 00 00 00 00 00 00 00 00 00 00 00 00 00 00 00 00 00 00 00 00 00 00 00 00 00 00 00 00 00 00 00 00 00 00 00 00 00 00 00 00 00 00 00 00 00 00 00 02
E: 24.039946 62 01 07 0c 08 02 79 01 07 0d 6e 02 2d 01 00 00 00 00 00 00 00 00 00 00 00 00 00 00 00 00 00 00 00 00 00 00 00 00 00 00 00 00 00 00 00 00 00 00 00 00 00 00 00 00 00 00 00 00 00 00 00 00 02
E: 24.049962 62 01 07 0c 08 02 79 01 07 0d 6e 02 2c 01 00 00 00 00 00 00 00 00 00 00 00 00 00 00 00 00 00 00 00 00 00 00 00 00 00 00 00 00 00 00 00 00 00 00 00 00 00 00 00 00 00 00 00 00 00 00 00 00 02
E: 24.059939 62 01 07 0c 08 02 79 01 07 0d 6e 02 2c 01 00 00 00 00 00 00 00 00 00 00 00 00 00 00 00 00 00 00 00 00 00 00 00 00 00 00 00 00 00 00 00 00 00 00 00 00 00 00 00 00 00 00 00 00 00 00 00 00 02
E: 24.069934 62 01 07 0c 08 02 79 01 07 0d 6e 02 2c 01 00 00 00 00 00 00 00 00 00 00 00 00 00 00 00 00 00 00 00 00 00 00 00 00 00 00 00 00 00 00 00 00 00 00 00 00 00 00 00 00 00 00 00 00 00 00 00 00 02
E: 24.079928 62 01 07 0c 08 02 79 01 07 0d 6e 02 2c 01 00 00 00 00 00 00 00 00 00 00 00 00 00 00 00 00 00 00 00 00 00 00 00 00 00 00 00 00 00 00 00 00 00 00 00 00 00 00 00 00 00 00 00 00 00 00 00 00 02
E: 24.089924 62 01 07 0c 08 02 79 01 07 0d 6e 02 2c 01 00 00 00 00 00 00 00 00 00 00 00 00 00 00 00 00 00 00 00 00 00 00 00 00 00 00 00 00 00 00 00 00 00 00 00 00 00 00 00 00 00 00 00 00 00 00 00 00 02
E: 24.099918 62 01 07 0c 08 02 79 01 07 0d 6e 02 2c 01 00 00 00 00 00 00 00 00 00 00 00 00 00 00 00 00 00 00 00 00 00 00 00 00 00 00 00 00 00 00 00 00 00 00 00 00 00 00 00 00 00 00 00 00 00 00 00 00 02
E: 24.109871 62 01 07 0c 08 02 79 01 07 0d 6e 02 2c 01 00 00 00 00 00 00 00 00 00 00 00 00 00 00 00 00 00 00 00 00 00 00 00 00 00 00 00 00 00 00 00 00 00 00 00 00 00 00 00 00 00 00 00 00 00 00 00 00 02
E: 24.119925 62 01 07 0c 08 02 79 01 07 0d 6e 02 2b 01 00 00 00 00 00 00 00 00 00 00 00 00 00 00 00 00 00 00 00 00 00 00 00 00 00 00 00 00 00 00 00 00 00 00 00 00 00 00 00 00 00 00 00 00 00 00 00 00 02
E: 24.129904 62 01 07 0c 08 02 79 01 07 0d 6e 02 2b 01 00 00 00 00 00 00 00 00 00 00 00 00 00 00 00 00 00 00 00 00 00 00 00 00 00 00 00 00 00 00 00 00 00 00 00 00 00 00 00 00 00 00 00 00 00 00 00 00 02
E: 24.139897 62 01 07 0c 08 02 79 01 07 0d 6e 02 2b 01 00 00 00 00 00 00 00 00 00 00 00 00 00 00 00 00 00 00 00 00 00 00 00 00 00 00 00 00 00 00 00 00 00 00 00 00 00 00 00 00 00 00 00 00 00 00 00 00 02
E: 24.149857 62 01 07 0c 08 02 79 01 07 0d 6e 02 2b 01 00 00 00 00 00 00 00 00 00 00 00 00 00 00 00 00 00 00 00 00 00 00 00 00 00 00 00 00 00 00 00 00 00 00 00 00 00 00 00 00 00 00 00 00 00 00 00 00 02
E: 24.159856 62 01 07 0c 08 02 7a 01 07 0d 6e 02 2b 01 00 00 00 00 00 00 00 00 00 00 00 00 00 00 00 00 00 00 00 00 00 00 00 00 00 00 00 00 00 00 00 00 00 00 00 00 00 00 00 00 00 00 00 00 00 00 00 00 02
E: 24.169862 62 01 07 0c 08 02 79 01 07 0d 6e 02 2b 01 00 00 00 00 00 00 00 00 00 00 00 00 00 00 00 00 00 00 00 00 00 00 00 00 00 00 00 00 00 00 00 00 00 00 00 00 00 00 00 00 00 00 00 00 00 00 00 00 02
E: 24.179895 62 01 07 0c 08 02 7a 01 07 0d 6d 02 2a 01 00 00 00 00 00 00 00 00 00 00 00 00 00 00 00 00 00 00 00 00 00 00 00 00 00 00 00 00 00 00 00 00 00 00 00 00 00 00 00 00 00 00 00 00 00 00 00 00 02
E: 24.189777 62 01 07 0c 08 02 7a 01 07 0d 6d 02 2a 01 00 00 00 00 00 00 00 00 00 00 00 00 00 00 00 00 00 00 00 00 00 00 00 00 00 00 00 00 00 00 00 00 00 00 00 00 00 00 00 00 00 00 00 00 00 00 00 00 02
E: 24.199868 62 01 07 0c 08 02 7a 01 07 0d 6d 02 2a 01 00 00 00 00 00 00 00 00 00 00 00 00 00 00 00 00 00 00 00 00 00 00 00 00 00 00 00 00 00 00 00 00 00 00 00 00 00 00 00 00 00 00 00 00 00 00 00 00 02
E: 24.209865 62 01 07 0c 08 02 7a 01 07 0d 6d 02 2a 01 00 00 00 00 00 00 00 00 00 00 00 00 00 00 00 00 00 00 00 00 00 00 00 00 00 00 00 00 00 00 00 00 00 00 00 00 00 00 00 00 00 00 00 00 00 00 00 00 02
E: 24.219856 62 01 07 0c 08 02 7a 01 07 0d 6d 02 2a 01 00 00 00 00 00 00 00 00 00 00 00 00 00 00 00 00 00 00 00 00 00 00 00 00 00 00 00 00 00 00 00 00 00 00 00 00 00 00 00 00 00 00 00 00 00 00 00 00 02
E: 24.229870 62 01 00 0c 08 02 7a 01 07 0d 6d 02 2a 01 00 00 00 00 00 00 00 00 00 00 00 00 00 00 00 00 00 00 00 00 00 00 00 00 00 00 00 00 00 00 00 00 00 00 00 00 00 00 00 00 00 00 00 00 00 00 00 00 02
E: 24.239846 62 01 07 0d 6d 02 2a 01 00 0d 6d 02 2a 01 00 00 00 00 00 00 00 00 00 00 00 00 00 00 00 00 00 00 00 00 00 00 00 00 00 00 00 00 00 00 00 00 00 00 00 00 00 00 00 00 00 00 00 00 00 00 00 00 01
E: 24.249844 62 01 07 0d 6d 02 2a 01 00 0d 6d 02 2a 01 00 00 00 00 00 00 00 00 00 00 00 00 00 00 00 00 00 00 00 00 00 00 00 00 00 00 00 00 00 00 00 00 00 00 00 00 00 00 00 00 00 00 00 00 00 00 00 00 01
E: 24.259836 62 01 07 0d 6d 02 2a 01 00 0d 6d 02 2a 01 00 00 00 00 00 00 00 00 00 00 00 00 00 00 00 00 00 00 00 00 00 00 00 00 00 00 00 00 00 00 00 00 00 00 00 00 00 00 00 00 00 00 00 00 00 00 00 00 01
E: 24.269734 62 01 07 0d 6d 02 2a 01 00 0d 6d 02 2a 01 00 00 00 00 00 00 00 00 00 00 00 00 00 00 00 00 00 00 00 00 00 00 00 00 00 00 00 00 00 00 00 00 00 00 00 00 00 00 00 00 00 00 00 00 00 00 00 00 01
E: 24.279840 62 01 07 0d 6d 02 29 01 00 0d 6d 02 2a 01 00 00 00 00 00 00 00 00 00 00 00 00 00 00 00 00 00 00 00 00 00 00 00 00 00 00 00 00 00 00 00 00 00 00 00 00 00 00 00 00 00 00 00 00 00 00 00 00 01
E: 24.289823 62 01 07 0d 6d 02 29 01 00 0d 6d 02 2a 01 00 00 00 00 00 00 00 00 00 00 00 00 00 00 00 00 00 00 00 00 00 00 00 00 00 00 00 00 00 00 00 00 00 00 00 00 00 00 00 00 00 00 00 00 00 00 00 00 01
E: 24.299901 62 01 07 0d 6d 02 28 01 00 0d 6d 02 2a 01 00 00 00 00 00 00 00 00 00 00 00 00 00 00 00 00 00 00 00 00 00 00 00 00 00 00 00 00 00 00 00 00 00 00 00 00 00 00 00 00 00 00 00 00 00 00 00 00 01
E: 24.309812 62 01 07 0d 6d 02 28 01 00 0d 6d 02 2a 01 00 00 00 00 00 00 00 00 00 00 00 00 00 00 00 00 00 00 00 00 00 00 00 00 00 00 00 00 00 00 00 00 00 00 00 00 00 00 00 00 00 00 00 00 00 00 00 00 01
E: 24.319822 62 01 07 0d 6c 02 28 01 00 0d 6d 02 2a 01 00 00 00 00 00 00 00 00 00 00 00 00 00 00 00 00 00 00 00 00 00 00 00 00 00 00 00 00 00 00 00 00 00 00 00 00 00 00 00 00 00 00 00 00 00 00 00 00 01
E: 24.329767 62 01 07 0d 6c 02 28 01 00 0d 6d 02 2a 01 00 00 00 00 00 00 00 00 00 00 00 00 00 00 00 00 00 00 00 00 00 00 00 00 00 00 00 00 00 00 00 00 00 00 00 00 00 00 00 00 00 00 00 00 00 00 00 00 01
E: 24.339811 62 01 07 0d 6d 02 28 01 00 0d 6d 02 2a 01 00 00 00 00 00 00 00 00 00 00 00 00 00 00 00 00 00 00 00 00 00 00 00 00 00 00 00 00 00 00 00 00 00 00 00 00 00 00 00 00 00 00 00 00 00 00 00 00 01
E: 24.349810 62 01 07 0d 6c 02 28 01 00 0d 6d 02 2a 01 00 00 00 00 00 00 00 00 00 00 00 00 00 00 00 00 00 00 00 00 00 00 00 00 00 00 00 00 00 00 00 00 00 00 00 00 00 00 00 00 00 00 00 00 00 00 00 00 01
E: 24.359781 62 01 07 0d 6c 02 28 01 00 0d 6d 02 2a 01 00 00 00 00 00 00 00 00 00 00 00 00 00 00 00 00 00 00 00 00 00 00 00 00 00 00 00 00 00 00 00 00 00 00 00 00 00 00 00 00 00 00 00 00 00 00 00 00 01
E: 24.369798 62 01 07 0d 6c 02 27 01 00 0d 6d 02 2a 01 00 00 00 00 00 00 00 00 00 00 00 00 00 00 00 00 00 00 00 00 00 00 00 00 00 00 00 00 00 00 00 00 00 00 00 00 00 00 00 00 00 00 00 00 00 00 00 00 01
E: 24.379777 62 01 07 0d 6c 02 27 01 00 0d 6d 02 2a 01 00 00 00 00 00 00 00 00 00 00 00 00 00 00 00 00 00 00 00 00 00 00 00 00 00 00 00 00 00 00 00 00 00 00 00 00 00 00 00 00 00 00 00 00 00 00 00 00 01
E: 24.389749 62 01 07 0d 6c 02 27 01 00 0d 6d 02 2a 01 00 00 00 00 00 00 00 00 00 00 00 00 00 00 00 00 00 00 00 00 00 00 00 00 00 00 00 00 00 00 00 00 00 00 00 00 00 00 00 00 00 00 00 00 00 00 00 00 01
E: 24.399764 62 01 07 0d 6c 02 27 01 00 0d 6d 02 2a 01 00 00 00 00 00 00 00 00 00 00 00 00 00 00 00 00 00 00 00 00 00 00 00 00 00 00 00 00 00 00 00 00 00 00 00 00 00 00 00 00 00 00 00 00 00 00 00 00 01
E: 24.409779 62 01 07 0d 6d 02 27 01 00 0d 6d 02 2a 01 00 00 00 00 00 00 00 00 00 00 00 00 00 00 00 00 00 00 00 00 00 00 00 00 00 00 00 00 00 00 00 00 00 00 00 00 00 00 00 00 00 00 00 00 00 00 00 00 01
E: 24.419771 62 01 07 0d 6c 02 27 01 00 0d 6d 02 2a 01 00 00 00 00 00 00 00 00 00 00 00 00 00 00 00 00 00 00 00 00 00 00 00 00 00 00 00 00 00 00 00 00 00 00 00 00 00 00 00 00 00 00 00 00 00 00 00 00 01
E: 24.429766 62 01 07 0d 6d 02 28 01 00 0d 6d 02 2a 01 00 00 00 00 00 00 00 00 00 00 00 00 00 00 00 00 00 00 00 00 00 00 00 00 00 00 00 00 00 00 00 00 00 00 00 00 00 00 00 00 00 00 00 00 00 00 00 00 01
E: 24.439747 62 01 07 0d 6d 02 28 01 00 0d 6d 02 2a 01 00 00 00 00 00 00 00 00 00 00 00 00 00 00 00 00 00 00 00 00 00 00 00 00 00 00 00 00 00 00 00 00 00 00 00 00 00 00 00 00 00 00 00 00 00 00 00 00 01
E: 24.449742 62 01 07 0d 6d 02 28 01 00 0d 6d 02 2a 01 00 00 00 00 00 00 00 00 00 00 00 00 00 00 00 00 00 00 00 00 00 00 00 00 00 00 00 00 00 00 00 00 00 00 00 00 00 00 00 00 00 00 00 00 00 00 00 00 01
E: 24.459735 62 01 07 0d 6d 02 28 01 00 0d 6d 02 2a 01 00 00 00 00 00 00 00 00 00 00 00 00 00 00 00 00 00 00 00 00 00 00 00 00 00 00 00 00 00 00 00 00 00 00 00 00 00 00 00 00 00 00 00 00 00 00 00 00 01
E: 24.469731 62 01 07 0d 6d 02 28 01 00 0d 6d 02 2a 01 00 00 00 00 00 00 00 00 00 00 00 00 00 00 00 00 00 00 00 00 00 00 00 00 00 00 00 00 00 00 00 00 00 00 00 00 00 00 00 00 00 00 00 00 00 00 00 00 01
E: 24.479723 62 01 07 0d 6d 02 28 01 00 0d 6d 02 2a 01 00 00 00 00 00 00 00 00 00 00 00 00 00 00 00 00 00 00 00 00 00 00 00 00 00 00 00 00 00 00 00 00 00 00 00 00 00 00 00 00 00 00 00 00 00 00 00 00 01
E: 24.489741 62 01 07 0d 6d 02 29 01 00 0d 6d 02 2a 01 00 00 00 00 00 00 00 00 00 00 00 00 00 00 00 00 00 00 00 00 00 00 00 00 00 00 00 00 00 00 00 00 00 00 00 00 00 00 00 00 00 00 00 00 00 00 00 00 01
E: 24.499719 62 01 07 0d 6d 02 29 01 00 0d 6d 02 2a 01 00 00 00 00 00 00 00 00 00 00 00 00 00 00 00 00 00 00 00 00 00 00 00 00 00 00 00 00 00 00 00 00 00 00 00 00 00 00 00 00 00 00 00 00 00 00 00 00 01
E: 24.509713 62 01 07 0d 6d 02 29 01 00 0d 6d 02 2a 01 00 00 00 00 00 00 00 00 00 00 00 00 00 00 00 00 00 00 00 00 00 00 00 00 00 00 00 00 00 00 00 00 00 00 00 00 00 00 00 00 00 00 00 00 00 00 00 00 01
E: 24.519724 62 01 07 0d 6e 02 29 01 00 0d 6d 02 2a 01 00 00 00 00 00 00 00 00 00 00 00 00 00 00 00 00 00 00 00 00 00 00 00 00 00 00 00 00 00 00 00 00 00 00 00 00 00 00 00 00 00 00 00 00 00 00 00 00 01
E: 24.529706 62 01 07 0d 6e 02 29 01 00 0d 6d 02 2a 01 00 00 00 00 00 00 00 00 00 00 00 00 00 00 00 00 00 00 00 00 00 00 00 00 00 00 00 00 00 00 00 00 00 00 00 00 00 00 00 00 00 00 00 00 00 00 00 00 01
E: 24.539698 62 01 07 0d 6e 02 29 01 00 0d 6d 02 2a 01 00 00 00 00 00 00 00 00 00 00 00 00 00 00 00 00 00 00 00 00 00 00 00 00 00 00 00 00 00 00 00 00 00 00 00 00 00 00 00 00 00 00 00 00 00 00 00 00 01
E: 24.549695 62 01 07 0d 6e 02 29 01 00 0d 6d 02 2a 01 00 00 00 00 00 00 00 00 00 00 00 00 00 00 00 00 00 00 00 00 00 00 00 00 00 00 00 00 00 00 00 00 00 00 00 00 00 00 00 00 00 00 00 00 00 00 00 00 01
E: 24.559689 62 01 07 0d 6e 02 29 01 00 0d 6d 02 2a 01 00 00 00 00 00 00 00 00 00 00 00 00 00 00 00 00 00 00 00 00 00 00 00 00 00 00 00 00 00 00 00 00 00 00 00 00 00 00 00 00 00 00 00 00 00 00 00 00 01
E: 24.569700 62 01 07 0d 6f 02 29 01 00 0d 6d 02 2a 01 00 00 00 00 00 00 00 00 00 00 00 00 00 00 00 00 00 00 00 00 00 00 00 00 00 00 00 00 00 00 00 00 00 00 00 00 00 00 00 00 00 00 00 00 00 00 00 00 01
E: 24.579694 62 01 07 0d 6f 02 2a 01 00 0d 6d 02 2a 01 00 00 00 00 00 00 00 00 00 00 00 00 00 00 00 00 00 00 00 00 00 00 00 00 00 00 00 00 00 00 00 00 00 00 00 00 00 00 00 00 00 00 00 00 00 00 00 00 01
E: 24.589673 62 01 07 0d 6f 02 2a 01 00 0d 6d 02 2a 01 00 00 00 00 00 00 00 00 00 00 00 00 00 00 00 00 00 00 00 00 00 00 00 00 00 00 00 00 00 00 00 00 00 00 00 00 00 00 00 00 00 00 00 00 00 00 00 00 01
E: 24.595670 62 01 07 0d 6f 02 2a 01 00 0d 6d 02 2a 01 00 00 00 00 00 00 00 00 00 00 00 00 00 00 00 00 00 00 00 00 00 00 00 00 00 00 00 00 00 00 00 00 00 00 00 00 00 00 00 00 00 00 00 00 00 00 00 00 01
E: 24.605664 62 01 07 0d 6f 02 2a 01 00 0d 6d 02 2a 01 00 00 00 00 00 00 00 00 00 00 00 00 00 00 00 00 00 00 00 00 00 00 00 00 00 00 00 00 00 00 00 00 00 00 00 00 00 00 00 00 00 00 00 00 00 00 00 00 01
E: 24.615671 62 01 00 0d 6f 02 2a 01 00 0d 6d 02 2a 01 00 00 00 00 00 00 00 00 00 00 00 00 00 00 00 00 00 00 00 00 00 00 00 00 00 00 00 00 00 00 00 00 00 00 00 00 00 00 00 00 00 00 00 00 00 00 00 00 01
E: 24.625652 62 01 00 0d 6f 02 2a 01 00 0d 6d 02 2a 01 00 00 00 00 00 00 00 00 00 00 00 00 00 00 00 00 00 00 00 00 00 00 00 00 00 00 00 00 00 00 00 00 00 00 00 00 00 00 00 00 00 00 00 00 00 00 00 00 00
# 3. Finally, move your ten fingers on the screen and release them.
E: 34.968474 62 01 00 0e 4b 03 62 03 00 0d 6d 02 2a 01 00 00 00 00 00 00 00 00 00 00 00 00 00 00 00 00 00 00 00 00 00 00 00 00 00 00 00 00 00 00 00 00 00 00 00 00 00 00 00 00 00 00 00 00 00 00 00 00 01
E: 34.978488 62 01 00 0f cc 02 c1 03 07 0e 4b 03 62 03 00 10 15 03 5a 02 00 11 52 05 c4 02 00 00 00 00 00 00 00 00 00 00 00 00 00 00 00 00 00 00 00 00 00 00 00 00 00 00 00 00 00 00 00 00 00 00 00 00 04
E: 34.990509 62 01 07 0f cd 02 c3 03 07 0e 4b 03 62 03 07 10 18 03 59 02 07 11 52 05 c2 02 00 12 16 05 2c 03 00 13 dc 04 52 03 00 00 00 00 00 00 00 00 00 00 00 00 00 00 00 00 00 00 00 00 00 00 00 00 06
E: 35.002450 62 01 00 14 6f 04 35 03 07 0f cd 02 c3 03 07 0e 4b 03 62 03 07 10 19 03 58 02 07 11 51 05 c1 02 07 12 15 05 2b 03 07 13 da 04 51 03 00 00 00 00 00 00 00 00 00 00 00 00 00 00 00 00 00 00 07
E: 35.012478 62 01 07 14 6f 04 34 03 07 0f cd 02 c3 03 07 0e 4b 03 61 03 07 10 19 03 58 02 07 11 51 05 c0 02 07 12 15 05 2a 03 07 13 d9 04 4f 03 00 15 11 04 2a 02 00 00 00 00 00 00 00 00 00 00 00 00 08
E: 35.024468 62 01 07 14 6f 04 33 03 00 0f cd 02 c3 03 07 0e 4b 03 61 03 07 10 19 03 58 02 07 11 51 05 c0 02 07 12 15 05 29 03 07 13 d9 04 4e 03 07 15 11 04 2a 02 00 00 00 00 00 00 00 00 00 00 00 00 08
E: 35.036465 62 01 07 14 6f 04 33 03 07 0e 4b 03 61 03 07 10 19 03 58 02 07 11 52 05 bf 02 07 12 15 05 28 03 07 13 d8 04 4e 03 07 15 12 04 2b 02 00 15 11 04 2a 02 00 00 00 00 00 00 00 00 00 00 00 00 07
E: 35.046464 62 01 07 14 6f 04 33 03 07 0e 4b 03 61 03 07 10 19 03 58 02 07 11 52 05 bf 02 07 12 15 05 27 03 07 13 d7 04 4d 03 07 15 12 04 2b 02 00 15 11 04 2a 02 00 00 00 00 00 00 00 00 00 00 00 00 07
E: 35.058455 62 01 07 14 6f 04 33 03 07 0e 4b 03 61 03 07 10 19 03 58 02 07 11 53 05 be 02 07 12 14 05 27 03 07 13 d7 04 4b 03 07 15 13 04 2b 02 00 15 11 04 2a 02 00 00 00 00 00 00 00 00 00 00 00 00 07
E: 35.070451 62 01 07 14 6f 04 33 03 07 0e 4b 03 60 03 07 10 19 03 58 02 07 11 54 05 bd 02 07 12 14 05 26 03 07 13 d7 04 4a 03 07 15 13 04 2b 02 00 15 11 04 2a 02 00 00 00 00 00 00 00 00 00 00 00 00 07
E: 35.082417 62 01 07 14 70 04 32 03 07 0e 4b 03 60 03 07 10 19 03 58 02 07 11 55 05 bd 02 07 12 13 05 25 03 07 13 d6 04 48 03 07 15 13 04 2b 02 00 15 11 04 2a 02 00 00 00 00 00 00 00 00 00 00 00 00 07
E: 35.092414 62 01 07 14 70 04 31 03 07 0e 4b 03 60 03 07 10 18 03 59 02 07 11 56 05 bd 02 07 12 13 05 24 03 07 13 d6 04 47 03 07 15 14 04 2b 02 00 15 11 04 2a 02 00 00 00 00 00 00 00 00 00 00 00 00 07
E: 35.104409 62 01 07 14 6f 04 30 03 07 0e 4b 03 60 03 07 10 18 03 59 02 07 11 57 05 bd 02 07 12 13 05 24 03 07 13 d6 04 47 03 07 15 14 04 2b 02 00 15 11 04 2a 02 00 00 00 00 00 00 00 00 00 00 00 00 07
E: 35.116403 62 01 07 14 6f 04 30 03 07 0e 4b 03 60 03 07 10 18 03 59 02 07 11 58 05 bd 02 07 12 12 05 24 03 07 13 d6 04 47 03 07 15 14 04 2a 02 00 15 11 04 2a 02 00 00 00 00 00 00 00 00 00 00 00 00 07
E: 35.128395 62 01 07 14 6f 04 30 03 07 0e 4b 03 60 03 07 10 18 03 59 02 07 11 58 05 bd 02 07 12 12 05 24 03 07 13 d6 04 46 03 07 15 14 04 2a 02 00 15 11 04 2a 02 00 00 00 00 00 00 00 00 00 00 00 00 07
E: 35.138413 62 01 07 14 70 04 30 03 07 0e 4b 03 60 03 07 10 18 03 5a 02 07 11 58 05 bd 02 07 12 12 05 24 03 07 13 d7 04 46 03 07 15 14 04 2a 02 00 15 11 04 2a 02 00 00 00 00 00 00 00 00 00 00 00 00 07
E: 35.150388 62 01 07 14 6f 04 2f 03 07 0e 4b 03 60 03 07 10 18 03 5a 02 07 11 59 05 bd 02 07 12 13 05 25 03 07 13 d6 04 46 03 07 15 14 04 2a 02 00 15 11 04 2a 02 00 00 00 00 00 00 00 00 00 00 00 00 07
E: 35.162382 62 01 07 14 6f 04 2f 03 07 0e 4b 03 60 03 07 10 18 03 5a 02 07 11 59 05 bd 02 07 12 13 05 25 03 07 13 d7 04 46 03 07 15 14 04 29 02 00 15 11 04 2a 02 00 00 00 00 00 00 00 00 00 00 00 00 07
E: 35.174377 62 01 07 14 6f 04 2f 03 07 0e 4b 03 61 03 07 10 18 03 5a 02 07 11 59 05 bd 02 07 12 13 05 25 03 07 13 d7 04 47 03 07 15 14 04 29 02 00 15 11 04 2a 02 00 00 00 00 00 00 00 00 00 00 00 00 07
E: 35.184389 62 01 07 14 6f 04 2f 03 07 0e 4b 03 61 03 07 10 18 03 5a 02 07 11 59 05 bd 02 07 12 14 05 26 03 07 13 d7 04 47 03 07 15 14 04 29 02 00 15 11 04 2a 02 00 00 00 00 00 00 00 00 00 00 00 00 07
E: 35.196395 62 01 07 14 6f 04 2f 03 07 0e 4a 03 60 03 07 10 18 03 5a 02 07 11 5a 05 bd 02 07 12 14 05 26 03 07 13 d7 04 48 03 07 15 14 04 29 02 00 15 11 04 2a 02 00 00 00 00 00 00 00 00 00 00 00 00 07
E: 35.208380 62 01 07 14 6e 04 2f 03 07 0e 4b 03 61 03 07 10 18 03 5a 02 07 11 5a 05 be 02 07 12 15 05 27 03 07 13 d7 04 47 03 07 15 14 04 29 02 00 15 11 04 2a 02 00 00 00 00 00 00 00 00 00 00 00 00 07
E: 35.218375 62 01 07 14 6e 04 2e 03 07 0e 4b 03 60 03 07 10 18 03 5a 02 07 11 5a 05 be 02 07 12 15 05 27 03 07 13 d7 04 47 03 07 15 14 04 29 02 00 15 11 04 2a 02 00 00 00 00 00 00 00 00 00 00 00 00 07
E: 35.230367 62 01 07 14 6e 04 2e 03 07 0e 4b 03 61 03 07 10 18 03 5a 02 07 11 5a 05 be 02 07 12 15 05 27 03 07 13 d7 04 47 03 07 15 14 04 29 02 00 15 11 04 2a 02 00 00 00 00 00 00 00 00 00 00 00 00 07
E: 35.242306 62 01 07 14 6f 04 2d 03 07 0e 4b 03 61 03 07 10 18 03 5a 02 07 11 5a 05 be 02 07 12 15 05 27 03 07 13 d7 04 48 03 07 15 14 04 29 02 00 15 11 04 2a 02 00 00 00 00 00 00 00 00 00 00 00 00 07
E: 35.252358 62 01 07 14 6f 04 2d 03 07 0e 4b 03 60 03 07 10 18 03 5a 02 07 11 5a 05 bf 02 07 12 15 05 27 03 07 13 d7 04 48 03 07 15 14 04 29 02 00 15 11 04 2a 02 00 00 00 00 00 00 00 00 00 00 00 00 07
E: 35.264348 62 01 07 14 6f 04 2d 03 07 0e 4c 03 60 03 07 10 18 03 59 02 07 11 5a 05 bf 02 07 12 15 05 27 03 07 13 d7 04 48 03 07 15 14 04 29 02 00 15 11 04 2a 02 00 00 00 00 00 00 00 00 00 00 00 00 07
E: 35.274278 62 01 07 14 6f 04 2d 03 07 0e 4c 03 60 03 07 10 19 03 59 02 07 11 5b 05 bf 02 07 12 15 05 28 03 07 13 d7 04 48 03 07 15 13 04 29 02 00 15 11 04 2a 02 00 00 00 00 00 00 00 00 00 00 00 00 07
E: 35.286341 62 01 07 14 6f 04 2d 03 07 0e 4c 03 60 03 07 10 19 03 59 02 07 11 5b 05 bf 02 07 12 15 05 27 03 07 13 d7 04 48 03 07 15 13 04 29 02 00 15 11 04 2a 02 00 00 00 00 00 00 00 00 00 00 00 00 07
E: 35.296300 62 01 07 14 6f 04 2c 03 07 0e 4b 03 60 03 07 10 19 03 59 02 07 11 5a 05 bf 02 07 12 14 05 27 03 07 13 d8 04 48 03 07 15 13 04 29 02 00 15 11 04 2a 02 00 00 00 00 00 00 00 00 00 00 00 00 07
E: 35.308292 62 01 07 14 6f 04 2c 03 07 0e 4b 03 60 03 07 10 19 03 58 02 07 11 5a 05 be 02 07 12 14 05 27 03 07 13 d8 04 48 03 07 15 12 04 29 02 00 15 11 04 2a 02 00 00 00 00 00 00 00 00 00 00 00 00 07
E: 35.318289 62 01 07 14 6e 04 2d 03 00 16 76 02 a8 03 07 0e 4a 03 5f 03 07 10 19 03 58 02 07 11 5a 05 be 02 07 12 14 05 27 03 07 13 d8 04 47 03 07 15 12 04 28 02 00 00 00 00 00 00 00 00 00 00 00 00 08
E: 35.330241 62 01 07 14 6e 04 2c 03 07 16 76 02 a7 03 07 0e 49 03 5e 03 07 10 1a 03 57 02 07 11 59 05 be 02 07 12 13 05 26 03 07 13 d8 04 47 03 07 15 11 04 28 02 00 00 00 00 00 00 00 00 00 00 00 00 08
E: 35.340238 62 01 07 14 6d 04 2d 03 00 17 c5 02 b0 03 07 16 75 02 a5 03 07 0e 49 03 5e 03 07 10 1a 03 56 02 07 11 59 05 bd 02 07 12 12 05 26 03 07 13 d8 04 47 03 07 15 11 04 28 02 00 00 00 00 00 00 09
E: 35.350278 62 01 07 14 6d 04 2c 03 00 18 c5 02 b0 03 07 16 74 02 a3 03 07 0e 46 03 5c 03 07 10 1a 03 56 02 07 11 59 05 bd 02 07 12 12 05 25 03 07 13 d8 04 46 03 07 15 10 04 27 02 00 00 00 00 00 00 09
E: 35.360258 62 01 07 14 6c 04 2b 03 07 18 c4 02 ad 03 07 16 73 02 a0 03 07 0e 45 03 5a 03 07 10 1b 03 55 02 07 11 58 05 bc 02 07 12 11 05 25 03 07 13 d8 04 45 03 07 15 10 04 26 02 00 00 00 00 00 00 09
E: 35.372249 62 01 07 14 6b 04 29 03 07 18 c3 02 a8 03 07 16 72 02 9d 03 07 0e 43 03 58 03 07 10 1a 03 54 02 07 11 58 05 ba 02 07 12 12 05 24 03 07 13 d8 04 44 03 00 19 fd 02 9e 03 07 15 0f 04 24 02 0a
E: 35.382297 62 01 07 14 6a 04 27 03 07 18 c3 02 a4 03 07 16 71 02 9b 03 07 0e 41 03 54 03 07 10 1a 03 53 02 07 11 58 05 b9 02 07 12 11 05 22 03 07 13 d8 04 42 03 07 19 f9 02 99 03 07 15 0e 04 22 02 0a
E: 35.392135 62 01 07 14 69 04 25 03 07 18 c2 02 a2 03 07 16 70 02 98 03 07 0e 3f 03 51 03 07 10 19 03 51 02 07 11 57 05 b6 02 07 12 10 05 21 03 07 13 d7 04 40 03 07 19 f8 02 96 03 07 15 0e 04 20 02 0a
E: 35.402234 62 01 07 14 68 04 22 03 07 18 c1 02 9f 03 07 16 6e 02 93 03 07 0e 3d 03 4d 03 07 10 18 03 4f 02 07 11 57 05 b4 02 07 12 10 05 1e 03 07 13 d5 04 3d 03 07 19 f7 02 94 03 07 15 0d 04 1c 02 0a
E: 35.414285 62 01 07 14 67 04 1d 03 07 18 c0 02 9d 03 07 16 6b 02 8e 03 07 0e 3a 03 49 03 07 10 16 03 4c 02 07 11 56 05 b0 02 07 12 0f 05 1b 03 07 13 d4 04 39 03 07 19 f6 02 91 03 07 15 0d 04 18 02 0a
E: 35.424223 62 01 07 14 66 04 18 03 07 18 bd 02 97 03 07 16 69 02 89 03 07 0e 37 03 44 03 07 10 13 03 49 02 07 11 55 05 ac 02 07 12 0e 05 16 03 07 13 d2 04 35 03 07 19 f5 02 8e 03 07 15 0c 04 13 02 0a
E: 35.434271 62 01 07 14 64 04 13 03 07 18 bb 02 90 03 07 16 67 02 84 03 07 0e 34 03 40 03 07 10 10 03 45 02 07 11 54 05 a7 02 07 12 0c 05 11 03 07 13 d1 04 30 03 07 19 f3 02 8c 03 07 15 0b 04 0e 02 0a
E: 35.446266 62 01 07 14 63 04 0d 03 07 18 b8 02 8a 03 07 16 64 02 7f 03 07 0e 31 03 3b 03 07 10 0d 03 41 02 07 11 52 05 a1 02 07 12 09 05 0b 03 07 13 ce 04 2a 03 07 19 f0 02 85 03 07 15 0a 04 08 02 0a
E: 35.456211 62 01 07 14 62 04 07 03 07 18 b5 02 85 03 07 16 61 02 7b 03 07 0e 2e 03 36 03 07 10 09 03 3d 02 07 11 50 05 9b 02 07 12 07 05 05 03 07 13 cd 04 24 03 07 19 ed 02 80 03 07 15 08 04 02 02 0a
E: 35.468254 62 01 07 14 60 04 00 03 07 18 b2 02 7f 03 07 16 5e 02 75 03 07 0e 2b 03 30 03 07 10 05 03 38 02 07 11 4f 05 94 02 07 12 05 05 fe 02 07 13 cb 04 1d 03 07 19 ea 02 7b 03 07 15 06 04 fa 01 0a
E: 35.478249 62 01 07 14 5e 04 f8 02 07 18 ad 02 7a 03 07 16 5a 02 6f 03 07 0e 27 03 2a 03 07 10 01 03 33 02 07 11 4c 05 8d 02 07 12 03 05 f6 02 07 13 c9 04 16 03 07 19 e7 02 75 03 07 15 04 04 f2 01 0a
E: 35.490194 62 01 07 14 5c 04 ef 02 07 18 a9 02 73 03 07 16 56 02 68 03 07 0e 23 03 23 03 07 10 fd 02 2e 02 07 11 4a 05 85 02 07 12 00 05 ee 02 07 13 c7 04 0e 03 07 19 e3 02 6f 03 07 15 02 04 ea 01 0a
E: 35.500209 62 01 07 14 59 04 e7 02 07 18 a5 02 6c 03 07 16 53 02 62 03 07 0e 1f 03 1b 03 07 10 f9 02 28 02 07 11 48 05 7d 02 07 12 fd 04 e4 02 07 13 c5 04 05 03 07 19 df 02 68 03 07 15 00 04 e1 01 0a
E: 35.512231 62 01 07 14 57 04 df 02 07 18 a1 02 65 03 07 16 4e 02 5a 03 07 0e 1a 03 13 03 07 10 f4 02 21 02 07 11 44 05 74 02 07 12 fa 04 db 02 07 13 c2 04 fd 02 07 19 da 02 61 03 07 15 fd 03 d7 01 0a
E: 35.524087 62 01 07 14 54 04 d5 02 07 18 9c 02 5e 03 07 16 4a 02 52 03 07 0e 15 03 0b 03 07 10 ef 02 1a 02 07 11 41 05 6a 02 07 12 f7 04 d2 02 07 13 c0 04 f3 02 07 19 d5 02 59 03 07 15 fa 03 ce 01 0a
E: 35.534091 62 01 07 14 51 04 cb 02 07 18 98 02 55 03 07 16 45 02 49 03 07 0e 11 03 02 03 07 10 ea 02 12 02 07 11 3e 05 61 02 07 12 f5 04 c8 02 07 13 bd 04 e9 02 07 19 d0 02 51 03 07 15 f7 03 c4 01 0a
E: 35.546214 62 01 07 14 4e 04 c1 02 07 18 93 02 4c 03 07 16 41 02 3f 03 07 0e 0b 03 f8 02 07 10 e4 02 09 02 07 11 3b 05 57 02 07 12 f1 04 be 02 07 13 ba 04 df 02 07 19 cb 02 48 03 07 15 f3 03 ba 01 0a
E: 35.558067 62 01 07 14 4b 04 b7 02 07 18 8e 02 43 03 07 16 3c 02 35 03 07 0e 06 03 ee 02 07 10 de 02 00 02 07 11 37 05 4d 02 07 12 ed 04 b4 02 07 13 b6 04 d4 02 07 19 c5 02 3e 03 07 15 f0 03 b0 01 0a
E: 35.570179 62 01 07 14 47 04 ad 02 07 18 88 02 38 03 07 16 37 02 2a 03 07 0e 00 03 e3 02 07 10 d7 02 f6 01 07 11 33 05 43 02 07 12 ea 04 a9 02 07 13 b3 04 ca 02 07 19 bf 02 33 03 07 15 ec 03 a5 01 0a
E: 35.584196 62 01 07 14 44 04 a3 02 07 18 82 02 2d 03 07 16 31 02 1e 03 07 0e fa 02 d7 02 07 10 d0 02 ea 01 07 11 2f 05 39 02 07 12 e6 04 9e 02 07 13 af 04 bf 02 07 19 b8 02 27 03 07 15 e9 03 9a 01 0a
E: 35.596190 62 01 07 14 40 04 98 02 07 18 7c 02 20 03 07 16 2a 02 11 03 07 0e f3 02 ca 02 07 10 c8 02 df 01 07 11 2b 05 2e 02 07 12 e3 04 94 02 07 13 ac 04 b4 02 07 19 b2 02 1b 03 07 15 e5 03 8f 01 0a
E: 35.606186 62 01 07 14 3c 04 8d 02 07 18 76 02 13 03 07 16 24 02 03 03 07 0e ec 02 bd 02 07 10 c0 02 d2 01 07 11 27 05 23 02 07 12 df 04 88 02 07 13 a8 04 a9 02 07 19 aa 02 0d 03 07 15 e2 03 84 01 0a
E: 35.618180 62 01 07 14 38 04 81 02 07 18 6e 02 05 03 07 16 1d 02 f6 02 07 0e e4 02 af 02 07 10 b7 02 c5 01 07 11 22 05 18 02 07 12 da 04 7c 02 07 13 a4 04 9d 02 07 19 a2 02 ff 02 07 15 de 03 78 01 0a
E: 35.628174 62 01 07 14 34 04 75 02 07 18 66 02 f7 02 07 16 16 02 e7 02 07 0e dc 02 a0 02 07 10 ae 02 b7 01 07 11 1e 05 0c 02 07 12 d6 04 70 02 07 13 9f 04 90 02 07 19 9a 02 f1 02 07 15 da 03 6c 01 0a
E: 35.638186 62 01 07 14 2f 04 68 02 07 18 5d 02 e9 02 07 16 0d 02 d8 02 07 0e d3 02 90 02 07 10 a3 02 a9 01 07 11 19 05 00 02 07 12 d1 04 64 02 07 13 9b 04 83 02 07 19 92 02 e2 02 07 15 d7 03 60 01 0a
E: 35.650163 62 01 07 14 2a 04 5b 02 07 18 54 02 d9 02 07 16 04 02 c8 02 07 0e ca 02 80 02 07 10 99 02 99 01 07 11 15 05 f2 01 07 12 cc 04 57 02 07 13 96 04 76 02 07 19 89 02 d2 02 07 15 d4 03 53 01 0a
E: 35.660158 62 01 07 14 25 04 4d 02 07 18 4b 02 ca 02 07 16 fb 01 b9 02 07 0e c0 02 70 02 07 10 8d 02 89 01 07 11 10 05 e5 01 07 12 c7 04 49 02 07 13 91 04 69 02 07 19 80 02 c2 02 07 15 d1 03 46 01 0a
E: 35.670153 62 01 07 14 20 04 3f 02 07 18 41 02 ba 02 07 16 f1 01 a9 02 07 0e b6 02 5f 02 07 10 81 02 79 01 07 11 0b 05 d8 01 07 12 c2 04 3b 02 07 13 8c 04 5b 02 07 19 76 02 b2 02 07 15 cc 03 38 01 0a
E: 35.682107 62 01 07 14 1a 04 31 02 07 18 37 02 ab 02 07 16 e8 01 99 02 07 0e ac 02 4e 02 07 10 75 02 68 01 07 11 07 05 cb 01 07 12 bd 04 2e 02 07 13 86 04 4d 02 07 19 6d 02 a3 02 07 15 cc 03 38 01 0a
E: 35.692140 62 01 07 14 15 04 23 02 07 18 2d 02 9c 02 07 16 df 01 8a 02 07 0e a2 02 3e 02 07 10 69 02 58 01 07 11 01 05 be 01 07 12 b8 04 20 02 07 13 80 04 40 02 07 19 64 02 93 02 07 15 c8 03 2a 01 0a
E: 35.702139 62 01 07 14 0f 04 15 02 07 18 23 02 8d 02 07 16 d5 01 7b 02 07 0e 98 02 2e 02 07 10 5d 02 48 01 07 11 fc 04 b0 01 07 12 b3 04 13 02 07 13 7b 04 32 02 07 19 5b 02 84 02 07 15 c3 03 1b 01 0a
E: 35.712132 62 01 07 14 0a 04 08 02 07 18 1b 02 7f 02 07 16 d5 01 7b 02 07 0e 8f 02 1f 02 07 10 51 02 38 01 07 11 f7 04 a3 01 07 12 ae 04 06 02 07 13 77 04 26 02 07 19 52 02 75 02 07 15 c0 03 0b 01 0a
E: 35.724073 62 01 07 14 06 04 fb 01 07 18 12 02 71 02 07 16 d5 01 7b 02 07 0e 86 02 11 02 07 10 47 02 2a 01 07 11 f3 04 97 01 07 12 a9 04 f9 01 07 13 72 04 1a 02 07 19 49 02 67 02 07 15 bd 03 fd 00 0a
E: 35.734125 62 01 07 14 02 04 f0 01 07 18 0a 02 64 02 07 16 cb 01 6d 02 07 0e 7d 02 04 02 07 10 3c 02 1d 01 07 11 ee 04 8c 01 07 12 a5 04 ee 01 07 13 6d 04 0e 02 07 19 42 02 59 02 07 15 ba 03 f0 00 0a
E: 35.744074 62 01 07 14 fe 03 e4 01 07 18 02 02 58 02 07 16 cb 01 6d 02 07 0e 76 02 f7 01 07 10 33 02 12 01 07 11 ea 04 81 01 07 12 a1 04 e3 01 07 13 6a 04 03 02 07 19 3a 02 4d 02 07 15 b7 03 e2 00 0a
E: 35.754072 62 01 07 14 fb 03 d9 01 07 18 fb 01 4d 02 07 16 cb 01 6d 02 07 0e 70 02 ed 01 07 10 2b 02 07 01 07 11 e6 04 76 01 07 12 9d 04 d8 01 07 13 66 04 f9 01 07 19 33 02 41 02 07 15 b4 03 d6 00 0a
E: 35.764106 62 01 07 14 f7 03 cf 01 07 18 f5 01 43 02 00 16 cb 01 6d 02 07 0e 6a 02 e2 01 07 10 24 02 ff 00 07 11 e3 04 6c 01 07 12 9a 04 ce 01 07 13 63 04 ef 01 07 19 2d 02 37 02 07 15 b4 03 cb 00 0a
E: 35.774110 62 01 07 14 f4 03 c6 01 07 18 f0 01 39 02 07 0e 64 02 d9 01 07 10 1e 02 f7 00 07 11 e0 04 63 01 07 12 97 04 c5 01 07 13 5f 04 e6 01 07 19 28 02 2e 02 07 15 b4 03 cb 00 00 15 b4 03 cb 00 09
E: 35.784092 62 01 07 14 f1 03 bd 01 07 18 ec 01 32 02 07 0e 60 02 d2 01 07 10 1a 02 f1 00 07 11 dd 04 5b 01 07 12 94 04 bd 01 07 13 5c 04 de 01 07 19 23 02 26 02 07 15 b4 03 cb 00 00 15 b4 03 cb 00 09
E: 35.794052 62 01 07 14 ef 03 b5 01 07 18 e7 01 2b 02 00 1a 8d 01 08 02 07 0e 5c 02 cb 01 07 10 16 02 eb 00 07 11 da 04 54 01 07 12 92 04 b6 01 07 13 5a 04 d7 01 07 19 1f 02 20 02 00 15 b4 03 cb 00 0a
E: 35.804085 62 01 07 14 ed 03 af 01 07 18 e4 01 26 02 07 1a 8d 01 08 02 07 0e 59 02 c6 01 07 10 13 02 e7 00 07 11 d7 04 4e 01 07 12 8f 04 b0 01 07 13 57 04 d0 01 07 19 1c 02 1c 02 00 15 b4 03 cb 00 09
E: 35.814080 62 01 07 14 ea 03 aa 01 07 18 e2 01 22 02 07 1a 8d 01 08 02 07 0e 57 02 c2 01 07 10 11 02 e4 00 07 11 d5 04 49 01 07 12 8d 04 ab 01 07 13 55 04 cb 01 07 19 19 02 18 02 00 15 b4 03 cb 00 09
E: 35.824023 62 01 07 14 e9 03 a6 01 07 18 e0 01 1f 02 07 1a 8c 01 07 02 07 0e 55 02 bf 01 07 10 0f 02 e1 00 07 11 d4 04 45 01 07 12 8b 04 a7 01 07 13 54 04 c6 01 07 19 18 02 16 02 00 15 b4 03 cb 00 09
E: 35.833993 62 01 07 14 e8 03 a2 01 07 18 df 01 1d 02 07 1a 8c 01 07 02 07 0e 54 02 bc 01 07 10 0e 02 df 00 07 11 d3 04 42 01 07 12 8a 04 a4 01 07 13 52 04 c3 01 07 19 17 02 14 02 00 15 b4 03 cb 00 09
E: 35.844064 62 01 07 14 e7 03 a1 01 07 18 df 01 1b 02 07 1a 8c 01 07 02 07 0e 53 02 bb 01 07 10 0e 02 df 00 07 11 d2 04 40 01 07 12 89 04 a2 01 07 13 51 04 c1 01 07 19 16 02 13 02 00 1b b4 03 9f 00 0a
E: 35.854021 62 01 07 14 e7 03 9f 01 07 18 de 01 1b 02 07 1a 8c 01 07 02 07 0e 52 02 b9 01 07 10 0e 02 de 00 07 11 d1 04 3e 01 07 12 89 04 a1 01 07 13 51 04 c0 01 07 19 16 02 12 02 00 1c b4 03 9f 00 0a
E: 35.864055 62 01 07 14 e6 03 9f 01 07 18 dd 01 1a 02 07 1a 8c 01 06 02 07 0e 52 02 b9 01 07 10 0e 02 de 00 07 11 d1 04 3e 01 07 12 89 04 a0 01 07 13 50 04 c0 01 07 19 16 02 12 02 07 1c b3 03 9f 00 0a
E: 35.874002 62 01 07 14 e6 03 9f 01 07 18 dd 01 1a 02 07 1a 8b 01 05 02 07 0e 52 02 b9 01 07 10 0f 02 de 00 07 11 d1 04 3e 01 07 12 89 04 a0 01 07 13 50 04 c0 01 07 19 16 02 12 02 07 1c b3 03 9f 00 0a
E: 35.884046 62 01 07 14 e6 03 9f 01 07 18 dd 01 1a 02 07 1a 8b 01 05 02 07 0e 52 02 b9 01 07 10 0f 02 df 00 07 11 d1 04 3e 01 07 12 89 04 a1 01 07 13 50 04 c1 01 07 19 16 02 12 02 07 1c b3 03 9f 00 0a
E: 35.894040 62 01 07 14 e6 03 9f 01 07 18 dd 01 1a 02 07 1a 8b 01 05 02 07 0e 52 02 b9 01 07 10 0f 02 df 00 07 11 d1 04 3f 01 07 12 89 04 a1 01 07 13 50 04 c1 01 07 19 17 02 12 02 00 1c b3 03 9f 00 0a
E: 35.903988 62 01 07 14 e6 03 9f 01 07 18 dd 01 1a 02 07 1a 8b 01 05 02 07 0e 53 02 b9 01 07 10 10 02 df 00 07 11 d1 04 3f 01 07 12 89 04 a1 01 07 13 4f 04 c2 01 07 19 17 02 12 02 00 1c b3 03 9f 00 09
E: 35.912027 62 01 07 14 e6 03 9f 01 07 18 dd 01 1a 02 07 1a 8b 01 05 02 07 0e 53 02 ba 01 07 10 10 02 df 00 07 11 d1 04 3f 01 07 12 89 04 a1 01 07 13 4f 04 c2 01 07 19 18 02 12 02 00 1c b3 03 9f 00 09
E: 35.918030 62 01 07 14 e6 03 9f 01 07 18 dd 01 1a 02 07 1a 8c 01 05 02 07 0e 53 02 ba 01 07 10 10 02 df 00 00 11 d1 04 3f 01 07 12 89 04 a1 01 07 13 4f 04 c2 01 07 19 17 02 12 02 00 1c b3 03 9f 00 09
E: 35.921968 62 01 00 14 e6 03 9f 01 00 18 dd 01 1a 02 07 1a 8c 01 05 02 07 0e 54 02 ba 01 07 10 10 02 df 00 00 12 89 04 a1 01 00 13 4f 04 c2 01 07 19 17 02 12 02 00 19 17 02 12 02 00 1c b3 03 9f 00 08
E: 35.927951 62 01 07 1a 8c 01 05 02 07 0e 54 02 ba 01 07 10 10 02 df 00 07 19 17 02 12 02 00 10 10 02 df 00 00 12 89 04 a1 01 00 13 4f 04 c2 01 00 19 17 02 12 02 00 19 17 02 12 02 00 1c b3 03 9f 00 04
E: 35.933963 62 01 07 1a 8c 01 05 02 07 0e 54 02 ba 01 00 10 10 02 df 00 07 19 17 02 12 02 00 10 10 02 df 00 00 12 89 04 a1 01 00 13 4f 04 c2 01 00 19 17 02 12 02 00 19 17 02 12 02 00 1c b3 03 9f 00 04
E: 35.942001 62 01 07 1a 8b 01 03 02 07 0e 54 02 ba 01 00 19 17 02 12 02 00 19 17 02 12 02 00 10 10 02 df 00 00 12 89 04 a1 01 00 13 4f 04 c2 01 00 19 17 02 12 02 00 19 17 02 12 02 00 1c b3 03 9f 00 03
E: 35.951996 62 01 07 1a 8b 01 03 02 00 0e 54 02 ba 01 00 19 17 02 12 02 00 19 17 02 12 02 00 10 10 02 df 00 00 12 89 04 a1 01 00 13 4f 04 c2 01 00 19 17 02 12 02 00 19 17 02 12 02 00 1c b3 03 9f 00 02
E: 35.959928 62 01 07 1a 8b 01 03 02 00 0e 54 02 ba 01 00 19 17 02 12 02 00 19 17 02 12 02 00 10 10 02 df 00 00 12 89 04 a1 01 00 13 4f 04 c2 01 00 19 17 02 12 02 00 19 17 02 12 02 00 1c b3 03 9f 00 01
E: 35.969987 62 01 00 1a 8b 01 03 02 00 0e 54 02 ba 01 00 19 17 02 12 02 00 19 17 02 12 02 00 10 10 02 df 00 00 12 89 04 a1 01 00 13 4f 04 c2 01 00 19 17 02 12 02 00 19 17 02 12 02 00 1c b3 03 9f 00 01
E: 35.979926 62 01 00 1a 8b 01 03 02 00 0e 54 02 ba 01 00 19 17 02 12 02 00 19 17 02 12 02 00 10 10 02 df 00 00 12 89 04 a1 01 00 13 4f 04 c2 01 00 19 17 02 12 02 00 19 17 02 12 02 00 1c b3 03 9f 00 00
# Thank you.
