R: 89 05 0d 09 04 a1 01 09 22 a1 00 09 42 15 00 25 01 75 01 95 01 81 02 95 03 81 03 09 32 09 47 95 02 81 02 95 0a 81 03 05 01 26 ff 7f 65 11 55 0e 46 ba 0e 75 10 95 01 09 30 81 02 09 31 46 ea 0b 81 02 05 0d 09 51 75 10 95 01 81 02 09 55 15 00 25 08 75 08 95 01 b1 02 c0 c0
N: LUMIO Inc LUMIO CrystalTouch ver 01.03.12.00.
I: 3 202e 0007
# 1. Drag _one_ finger on the screen from one corner to the opposite, and release it.
E: 0.000000 8 31 00 d8 07 a0 0a 01 00
E: 0.015226 8 31 00 d8 07 a0 0a 01 00
E: 0.031134 8 31 00 e8 07 a0 0a 01 00
E: 0.046605 8 31 00 00 08 b0 0a 01 00
E: 0.062095 8 31 00 38 08 c8 0a 01 00
E: 0.077886 8 31 00 a0 08 18 0b 01 00
E: 0.092868 8 31 00 f0 08 58 0b 01 00
E: 0.108876 8 31 00 40 09 a8 0b 01 00
E: 0.124868 8 31 00 a8 09 20 0c 01 00
E: 0.139863 8 31 00 08 0a a8 0c 01 00
E: 0.186977 8 31 00 80 0a 48 0d 01 00
E: 0.201880 8 31 00 38 0c 78 0f 01 00
E: 0.217879 8 31 00 50 0d b0 10 01 00
E: 0.233182 8 31 00 50 0e d8 11 01 00
E: 0.249073 8 31 00 38 0f 00 13 01 00
E: 0.264911 8 31 00 28 10 38 14 01 00
E: 0.279866 8 31 00 40 11 90 15 01 00
E: 0.295623 8 31 00 78 12 08 17 01 00
E: 0.311173 8 31 00 d0 13 80 18 01 00
E: 0.327041 8 31 00 58 15 18 1a 01 00
E: 0.342073 8 31 00 e8 16 b8 1b 01 00
E: 0.358189 8 31 00 78 18 60 1d 01 00
E: 0.373612 8 31 00 28 1a 20 1f 01 00
E: 0.389079 8 31 00 f8 1b 00 21 01 00
E: 0.405085 8 31 00 08 1e 10 23 01 00
E: 0.420092 8 31 00 20 20 40 25 01 00
E: 0.436052 8 31 00 78 22 90 27 01 00
E: 0.450878 8 31 00 e0 24 e8 29 01 00
E: 0.466872 8 31 00 50 27 38 2c 01 00
E: 0.481881 8 31 00 c0 29 a8 2e 01 00
E: 0.497872 8 31 00 48 2c 38 31 01 00
E: 0.512911 8 31 00 d8 2e e0 33 01 00
E: 0.528878 8 31 00 68 31 70 36 01 00
E: 0.544874 8 31 00 10 34 f8 38 01 00
E: 0.559957 8 31 00 e0 36 48 3b 01 00
E: 0.575872 8 31 00 d0 39 70 3d 01 00
E: 0.590877 8 31 00 a0 3c 90 3f 01 00
E: 0.606871 8 31 00 30 3f 98 41 01 00
E: 0.621881 8 31 00 b8 41 80 43 01 00
E: 0.637180 8 31 00 08 44 80 45 01 00
E: 0.668877 8 31 00 40 46 60 47 01 00
E: 0.684875 8 31 00 78 4a 08 4a 01 00
E: 0.699872 8 31 00 08 4d f8 4b 01 00
E: 0.715869 8 31 00 20 4f b0 4d 01 00
E: 0.730874 8 31 00 18 51 48 4f 01 00
E: 0.746873 8 31 00 f8 52 e0 50 01 00
E: 0.761870 8 31 00 d0 54 70 52 01 00
E: 0.777875 8 31 00 b0 56 d8 53 01 00
E: 0.808875 8 31 00 78 58 40 55 01 00
E: 0.824873 8 31 00 98 5b c0 56 01 00
E: 0.839875 8 31 00 78 5d e8 57 01 00
E: 0.855867 8 31 00 08 5f e0 58 01 00
E: 0.870899 8 31 00 80 60 d8 59 01 00
E: 0.886874 8 31 00 20 62 88 5a 01 00
E: 0.901877 8 31 00 b8 63 70 5b 01 00
E: 0.917871 8 31 00 30 65 58 5c 01 00
E: 0.933080 8 31 00 70 66 40 5d 01 00
E: 0.949139 8 31 00 90 67 30 5e 01 00
E: 0.964875 8 31 00 b0 68 20 5f 01 00
E: 0.979873 8 31 00 b0 69 18 60 01 00
E: 0.995875 8 31 00 90 6a f8 60 01 00
E: 1.010876 8 31 00 50 6b a8 61 01 00
E: 1.026875 8 31 00 d8 6b 48 62 01 00
E: 1.041873 8 31 00 40 6c e8 62 01 00
E: 1.057873 8 31 00 a8 6c 70 63 01 00
E: 1.072877 8 31 00 18 6d 10 64 01 00
E: 1.088849 8 31 00 80 6d b0 64 01 00
E: 1.104883 8 31 00 f0 6d 68 65 01 00
E: 1.119878 8 31 00 40 6e 70 66 01 00
E: 1.135877 8 31 00 b0 6e 50 67 01 00
E: 1.150312 8 31 00 20 6f 20 68 01 00
E: 1.167164 8 31 00 90 6f d8 68 01 00
E: 1.181935 8 31 00 e0 6f 58 69 01 00
E: 1.197879 8 31 00 10 70 b8 69 01 00
E: 1.212876 8 31 00 18 70 f0 69 01 00
E: 1.228875 8 31 00 18 70 10 6a 01 00
E: 1.244877 8 31 00 18 70 18 6a 01 00
E: 1.259875 8 31 00 18 70 30 6a 01 00
E: 1.275805 8 31 00 18 70 30 6a 01 00
E: 1.290875 8 31 00 10 70 28 6a 01 00
E: 1.306804 8 31 00 10 70 28 6a 01 00
E: 1.321812 8 31 00 10 70 28 6a 01 00
E: 1.337887 8 31 00 10 70 38 6a 01 00
E: 1.352801 8 31 00 10 70 38 6a 01 00
E: 1.368878 8 31 00 10 70 28 6a 01 00
E: 1.384879 8 31 00 08 70 20 6a 01 00
E: 1.399878 8 31 00 00 70 18 6a 01 00
E: 1.415785 8 31 00 00 70 18 6a 01 00
E: 1.430877 8 31 00 00 70 f8 69 01 00
E: 1.446881 8 31 00 00 70 d8 69 01 00
E: 1.461880 8 30 00 48 70 58 69 01 00
# 2. Land one finger,
   - land a second finger far enough from the first
   - move your two fingers
   - release the *first* finger
   - release the second finger
E: 5.274007 8 31 00 48 0b 28 0a 01 00
E: 5.289206 8 31 00 c8 09 d8 0d 02 00
E: 5.290179 8 30 00 48 0b 28 0a 01 00
E: 5.305025 8 31 00 c8 09 d8 0d 02 00
E: 5.320107 8 31 00 d0 09 08 0e 02 00
E: 5.336083 8 31 00 e0 09 40 0e 02 00
E: 5.351072 8 31 00 e8 09 68 0e 02 00
E: 5.366976 8 31 00 f8 09 a8 0e 02 00
E: 5.383117 8 31 00 f8 09 c8 0e 02 00
E: 5.397925 8 31 00 e0 09 18 0f 02 00
E: 5.413909 8 31 00 e0 09 80 0f 02 00
E: 5.428939 8 31 00 c0 09 e8 0f 02 00
E: 5.444947 8 31 00 a8 09 68 10 02 00
E: 5.459908 8 31 00 a8 09 e8 10 02 00
E: 5.475910 8 31 00 b8 09 70 11 02 00
E: 5.490909 8 31 00 c0 09 08 12 02 00
E: 5.507160 8 31 00 d8 09 b8 12 02 00
E: 5.522903 8 31 00 f8 09 80 13 02 00
E: 5.537917 8 31 00 28 0a 60 14 02 00
E: 5.553916 8 31 00 60 0a 40 15 02 00
E: 5.568910 8 31 00 88 0a 18 16 02 00
E: 5.584941 8 31 00 b0 0a e0 16 02 00
E: 5.599915 8 31 00 d0 0a b0 17 02 00
E: 5.615910 8 31 00 e8 0a 78 18 02 00
E: 5.631910 8 31 00 00 0b 48 19 02 00
E: 5.646908 8 31 00 18 0b 30 1a 02 00
E: 5.662911 8 31 00 30 0b 18 1b 02 00
E: 5.677910 8 31 00 58 0b 10 1c 02 00
E: 5.693912 8 31 00 88 0b f8 1c 02 00
E: 5.708910 8 31 00 c0 0b e0 1d 02 00
E: 5.724910 8 31 00 f8 0b c0 1e 02 00
E: 5.739910 8 31 00 30 0c 88 1f 02 00
E: 5.755890 8 31 00 60 0c 50 20 02 00
E: 5.771911 8 31 00 88 0c 18 21 02 00
E: 5.786916 8 31 00 b0 0c e0 21 02 00
E: 5.802912 8 31 00 d8 0c a8 22 02 00
E: 5.817911 8 31 00 f8 0c 60 23 02 00
E: 5.833912 8 31 00 18 0d 20 24 02 00
E: 5.848911 8 31 00 30 0d e8 24 02 00
E: 5.864910 8 31 00 50 0d c0 25 02 00
E: 5.879947 8 31 00 70 0d 90 26 02 00
E: 5.895914 8 31 00 98 0d 78 27 02 00
E: 5.911912 8 31 00 c0 0d 58 28 02 00
E: 5.926942 8 31 00 e0 0d 30 29 02 00
E: 5.942912 8 31 00 08 0e 00 2a 02 00
E: 5.957222 8 31 00 20 0e b0 2a 02 00
E: 5.973228 8 31 00 40 0e 78 2b 02 00
E: 5.989130 8 31 00 58 0e 30 2c 02 00
E: 6.004955 8 31 00 70 0e f8 2c 02 00
E: 6.019913 8 31 00 90 0e c0 2d 02 00
E: 6.035913 8 31 00 a0 0e 80 2e 02 00
E: 6.051914 8 31 00 b8 0e 48 2f 02 00
E: 6.066900 8 31 00 b8 0e 00 30 02 00
E: 6.082222 8 31 00 c8 0e c0 30 02 00
E: 6.097919 8 31 00 c8 0e 88 31 02 00
E: 6.113914 8 31 00 d0 0e 30 32 02 00
E: 6.128914 8 31 00 e8 0e f0 32 02 00
E: 6.144917 8 31 00 00 0f 90 33 02 00
E: 6.191929 8 31 00 10 0f 38 34 02 00
E: 6.207915 8 31 00 10 0f e8 35 02 00
E: 6.222908 8 31 00 28 0f c0 36 02 00
E: 6.238927 8 31 00 48 0f 88 37 02 00
E: 6.240916 8 31 00 e8 20 00 5b 01 00
E: 6.254297 8 31 00 60 0f 38 38 02 00
E: 6.255770 8 31 00 e8 20 00 5b 01 00
E: 6.270000 8 31 00 90 0f d8 38 02 00
E: 6.271893 8 31 00 a8 20 c0 5a 01 00
E: 6.286099 8 31 00 b0 0f 58 39 02 00
E: 6.287942 8 31 00 38 20 68 5a 01 00
E: 6.300949 8 31 00 d0 0f e0 39 02 00
E: 6.302917 8 31 00 d8 1f e8 59 01 00
E: 6.316918 8 31 00 e8 0f 80 3a 02 00
E: 6.318917 8 31 00 68 1f 68 59 01 00
E: 6.331917 8 31 00 20 10 20 3b 02 00
E: 6.333918 8 31 00 10 1f e8 58 01 00
E: 6.347916 8 31 00 58 10 d0 3b 02 00
E: 6.349917 8 31 00 b0 1e 70 58 01 00
E: 6.362915 8 31 00 90 10 78 3c 02 00
E: 6.364920 8 31 00 68 1e 10 58 01 00
E: 6.379123 8 31 00 a8 10 20 3d 02 00
E: 6.380946 8 31 00 c0 1d 78 57 01 00
E: 6.393925 8 31 00 d8 10 b8 3d 02 00
E: 6.395916 8 31 00 68 1d 00 57 01 00
E: 6.410122 8 31 00 10 11 60 3e 02 00
E: 6.411939 8 31 00 20 1d 88 56 01 00
E: 6.425916 8 31 00 30 11 08 3f 02 00
E: 6.427914 8 31 00 d0 1c 08 56 01 00
E: 6.440944 8 31 00 68 11 b8 3f 02 00
E: 6.442914 8 31 00 78 1c 78 55 01 00
E: 6.456917 8 31 00 98 11 68 40 02 00
E: 6.458919 8 31 00 10 1c e8 54 01 00
E: 6.472134 8 31 00 c8 11 20 41 02 00
E: 6.473946 8 31 00 98 1b 40 54 01 00
E: 6.487562 8 31 00 08 12 d0 41 02 00
E: 6.488916 8 31 00 58 1b d0 53 01 00
E: 6.502555 8 31 00 48 12 98 42 02 00
E: 6.503913 8 31 00 38 1b 70 53 01 00
E: 6.519123 8 31 00 88 12 58 43 02 00
E: 6.520590 8 31 00 18 1b 60 53 01 00
E: 6.533554 8 31 00 d0 12 20 44 02 00
E: 6.534843 8 31 00 18 1b 60 53 01 00
E: 6.549554 8 31 00 20 13 18 45 02 00
E: 6.550911 8 31 00 10 1b 60 53 01 00
E: 6.565991 8 31 00 58 13 e8 45 02 00
E: 6.567922 8 31 00 10 1b 78 53 01 00
E: 6.580950 8 31 00 c8 13 c0 46 02 00
E: 6.582917 8 31 00 20 1b 88 53 01 00
E: 6.596928 8 31 00 38 1b 88 53 01 00
E: 6.598917 8 31 00 18 14 98 47 02 00
E: 6.612923 8 31 00 98 3b 48 31 01 00
E: 6.614917 8 31 00 00 18 70 52 02 00
E: 6.627919 8 31 00 88 42 58 2a 01 00
E: 6.629924 8 31 00 00 19 e0 54 02 00
E: 6.643918 8 31 00 a0 43 20 2a 01 00
E: 6.645918 8 31 00 70 19 a0 55 02 00
E: 6.659019 8 31 00 a0 43 20 2a 01 00
E: 6.660952 8 31 00 c0 19 10 56 02 00
E: 6.674913 8 31 00 e0 42 40 2b 01 00
E: 6.676919 8 31 00 20 1a 68 56 02 00
E: 6.689918 8 31 00 18 42 70 2c 01 00
E: 6.692116 8 31 00 90 1a f0 56 02 00
E: 6.705867 8 31 00 50 41 b0 2d 01 00
E: 6.707957 8 31 00 30 1b b0 57 02 00
E: 6.721123 8 31 00 80 40 f0 2e 01 00
E: 6.722915 8 31 00 b8 1b 68 58 02 00
E: 6.736926 8 31 00 a0 3f 48 30 01 00
E: 6.738930 8 31 00 50 1c 18 59 02 00
E: 6.752920 8 31 00 f8 3e 80 31 01 00
E: 6.755190 8 31 00 08 1d f8 59 02 00
E: 6.767951 8 31 00 50 3e c8 32 01 00
E: 6.769922 8 31 00 c0 1d a0 5a 02 00
E: 6.783857 8 31 00 c8 3d 00 34 01 00
E: 6.785919 8 31 00 a0 1e 58 5b 02 00
E: 6.798206 8 31 00 60 3d 28 35 01 00
E: 6.801114 8 31 00 a0 1f 38 5c 02 00
E: 6.814921 8 31 00 08 3d 50 36 01 00
E: 6.816920 8 31 00 b8 20 30 5d 02 00
E: 6.829924 8 31 00 a8 3c 88 37 01 00
E: 6.831923 8 31 00 f0 21 48 5e 02 00
E: 6.845924 8 31 00 18 3c e0 38 01 00
E: 6.847921 8 31 00 40 23 60 5f 02 00
E: 6.860920 8 31 00 e8 3b 10 3a 01 00
E: 6.862920 8 31 00 b0 24 a8 60 02 00
E: 6.876922 8 31 00 e0 3b 10 3b 01 00
E: 6.878920 8 31 00 20 26 c0 61 02 00
E: 6.892925 8 31 00 c0 3b 78 3c 01 00
E: 6.894919 8 31 00 a8 27 b0 62 02 00
E: 6.907951 8 31 00 c0 3b c8 3d 01 00
E: 6.909923 8 31 00 30 29 68 63 02 00
E: 6.923949 8 31 00 08 3c c8 3e 01 00
E: 6.925920 8 31 00 b8 2a f8 63 02 00
E: 6.938934 8 31 00 60 3c c8 3f 01 00
E: 6.940920 8 31 00 40 2c 70 64 02 00
E: 6.954924 8 31 00 e8 3c b8 40 01 00
E: 6.956920 8 31 00 c8 2d c8 64 02 00
E: 6.969924 8 31 00 60 3d 90 41 01 00
E: 6.971934 8 31 00 58 2f 10 65 02 00
E: 6.985922 8 31 00 f0 3d 38 42 01 00
E: 6.987942 8 31 00 d8 30 58 65 02 00
E: 7.000922 8 31 00 b0 3e e0 42 01 00
E: 7.002924 8 31 00 58 32 58 65 02 00
E: 7.016923 8 31 00 90 3f 70 43 01 00
E: 7.018922 8 31 00 c8 33 40 65 02 00
E: 7.032925 8 31 00 90 40 e8 43 01 00
E: 7.034922 8 31 00 38 35 20 65 02 00
E: 7.047925 8 31 00 90 41 38 44 01 00
E: 7.049922 8 31 00 c0 36 08 65 02 00
E: 7.063922 8 31 00 90 42 38 44 01 00
E: 7.065922 8 31 00 20 38 c8 64 02 00
E: 7.078925 8 31 00 00 44 30 44 01 00
E: 7.080921 8 31 00 90 39 88 64 02 00
E: 7.094925 8 31 00 f0 44 30 44 01 00
E: 7.096922 8 31 00 00 3b 30 64 02 00
E: 7.109923 8 31 00 d0 45 30 44 01 00
E: 7.111920 8 31 00 70 3c c8 63 02 00
E: 7.125925 8 31 00 70 47 70 43 01 00
E: 7.127921 8 31 00 e0 3d 60 63 02 00
E: 7.140926 8 31 00 a8 48 c8 42 01 00
E: 7.142924 8 31 00 40 3f 08 63 02 00
E: 7.157114 8 31 00 c0 49 10 42 01 00
E: 7.159660 8 31 00 88 40 b0 62 02 00
E: 7.172247 8 31 00 c0 4a 48 41 01 00
E: 7.175193 8 31 00 d0 41 58 62 02 00
E: 7.188133 8 31 00 f8 4b 18 40 01 00
E: 7.189945 8 31 00 18 43 f0 61 02 00
E: 7.203919 8 31 00 10 4d d8 3e 01 00
E: 7.205870 8 31 00 60 44 80 61 02 00
E: 7.218930 8 31 00 30 4e 98 3d 01 00
E: 7.220924 8 31 00 a8 45 18 61 02 00
E: 7.234925 8 31 00 20 4f 60 3c 01 00
E: 7.236924 8 31 00 d0 46 d8 60 02 00
E: 7.249926 8 31 00 00 50 20 3b 01 00
E: 7.251927 8 31 00 10 48 d0 60 02 00
E: 7.265926 8 31 00 c8 50 e0 39 01 00
E: 7.267924 8 31 00 68 49 d0 60 02 00
E: 7.280924 8 31 00 68 51 a0 38 01 00
E: 7.282923 8 31 00 d8 4a d8 60 02 00
E: 7.296923 8 31 00 c8 51 90 37 01 00
E: 7.298924 8 31 00 68 4c f0 60 02 00
E: 7.312923 8 31 00 08 52 a0 36 01 00
E: 7.314930 8 31 00 10 4e 10 61 02 00
E: 7.327926 8 31 00 20 52 b8 35 01 00
E: 7.329927 8 31 00 b8 4f 30 61 02 00
E: 7.343924 8 31 00 20 52 c8 34 01 00
E: 7.345924 8 31 00 78 51 48 61 02 00
E: 7.358924 8 31 00 f0 51 00 34 01 00
E: 7.360925 8 31 00 38 53 80 61 02 00
E: 7.374929 8 31 00 b0 51 38 33 01 00
E: 7.376924 8 31 00 f0 54 98 61 02 00
E: 7.389928 8 31 00 38 51 c0 32 01 00
E: 7.391925 8 31 00 98 56 98 61 02 00
E: 7.406085 8 31 00 b0 50 30 32 01 00
E: 7.407957 8 31 00 60 58 50 61 02 00
E: 7.420924 8 31 00 08 50 a0 31 01 00
E: 7.422918 8 31 00 20 5a 08 61 02 00
E: 7.436926 8 31 00 40 4f 28 31 01 00
E: 7.438937 8 31 00 c8 5b d8 60 02 00
E: 7.452926 8 31 00 40 4e c8 30 01 00
E: 7.454925 8 31 00 58 5d 68 60 02 00
E: 7.467925 8 31 00 10 4d 68 30 01 00
E: 7.469927 8 31 00 10 5f 80 5f 02 00
E: 7.483928 8 31 00 d0 4b 18 30 01 00
E: 7.485924 8 31 00 60 60 08 5f 02 00
E: 7.498926 8 31 00 78 4a b0 2f 01 00
E: 7.500920 8 31 00 70 61 c8 5e 02 00
E: 7.514930 8 31 00 e8 48 88 2f 01 00
E: 7.516928 8 31 00 88 62 00 5e 02 00
E: 7.530134 8 31 00 90 47 40 2f 01 00
E: 7.531956 8 31 00 e0 63 c0 5b 02 00
E: 7.546130 8 31 00 18 46 18 2f 01 00
E: 7.547956 8 31 00 b8 64 98 5a 02 00
E: 7.560955 8 31 00 d8 44 c0 2e 01 00
E: 7.562925 8 31 00 88 65 28 59 02 00
E: 7.576927 8 31 00 38 43 a0 2e 01 00
E: 7.578927 8 31 00 30 66 e8 57 02 00
E: 7.622928 8 31 00 b8 41 a0 2e 01 00
E: 7.624929 8 31 00 c8 66 a8 56 02 00
E: 7.638936 8 31 00 60 3c 60 2e 01 00
E: 7.640924 8 31 00 a8 67 c0 53 02 00
E: 7.654931 8 31 00 d8 3b 50 2d 01 00
E: 7.656941 8 31 00 c0 68 e8 4f 02 00
E: 7.670927 8 31 00 78 3a 50 2d 01 00
E: 7.672921 8 31 00 18 69 10 4e 02 00
E: 7.685927 8 31 00 a0 37 c8 2d 01 00
E: 7.687931 8 31 00 38 69 c8 4d 02 00
E: 7.701128 8 31 00 90 35 e0 2d 01 00
E: 7.703128 8 31 00 38 69 98 4d 02 00
E: 7.716928 8 31 00 18 34 e8 2d 01 00
E: 7.718931 8 31 00 78 69 20 4d 02 00
E: 7.732930 8 31 00 f0 32 e8 2d 01 00
E: 7.734927 8 31 00 d0 69 e0 4c 02 00
E: 7.747930 8 31 00 e8 31 d0 2d 01 00
E: 7.750136 8 31 00 28 6a d8 4c 02 00
E: 7.763614 8 31 00 20 31 c8 2d 01 00
E: 7.765125 8 31 00 78 6a d8 4c 02 00
E: 7.778565 8 31 00 e8 2f b0 2d 01 00
E: 7.779922 8 31 00 c0 6a 48 4d 02 00
E: 7.794597 8 31 00 60 2f b0 2d 01 00
E: 7.795959 8 31 00 f8 6a 18 4e 02 00
E: 7.809580 8 31 00 20 2f a8 2d 01 00
E: 7.810558 8 31 00 30 6b 38 4f 02 00
E: 7.825525 8 31 00 20 2f a8 2d 01 00
E: 7.826924 8 31 00 48 6b d0 50 02 00
E: 7.840565 8 31 00 28 2f c0 2d 01 00
E: 7.841922 8 31 00 48 6b 08 53 02 00
E: 7.856564 8 31 00 70 2f 08 2e 01 00
E: 7.857967 8 31 00 38 6b a0 55 02 00
E: 7.902571 8 31 00 e8 2f 58 2e 01 00
E: 7.903922 8 31 00 38 6b a0 58 02 00
E: 7.918565 8 31 00 08 32 18 2f 01 00
E: 7.919925 8 31 00 70 6b f8 5d 02 00
E: 7.934565 8 31 00 90 32 10 30 01 00
E: 7.935922 8 31 00 70 6b d8 61 02 00
E: 7.950566 8 31 00 f8 32 d8 30 01 00
E: 7.951922 8 31 00 f8 69 b0 6b 02 00
E: 7.965567 8 31 00 00 35 f0 30 01 00
E: 7.966923 8 31 00 d0 69 10 6f 02 00
E: 7.980565 8 31 00 70 36 18 31 01 00
E: 7.981924 8 31 00 98 69 98 72 02 00
E: 7.996565 8 31 00 c0 37 78 31 01 00
E: 7.997923 8 31 00 28 69 f8 76 02 00
E: 8.012563 8 31 00 20 39 d8 31 01 00
E: 8.013923 8 31 00 b0 68 50 7b 02 00
E: 8.027602 8 31 00 68 3a 48 32 01 00
E: 8.028965 8 31 00 20 68 f0 7e 02 00
E: 8.043603 8 31 00 d8 3b 88 32 01 00
E: 8.045126 8 31 00 90 67 b8 7f 02 00
E: 8.058631 8 31 00 38 3d c8 32 01 00
E: 8.059996 8 31 00 f8 66 e8 7f 02 00
E: 8.074569 8 31 00 a8 3e f0 32 01 00
E: 8.075923 8 31 00 48 66 f0 7f 02 00
E: 8.089567 8 31 00 18 40 20 33 01 00
E: 8.090924 8 31 00 80 65 f0 7f 02 00
E: 8.105570 8 31 00 70 41 38 33 01 00
E: 8.106925 8 31 00 98 64 f0 7f 02 00
E: 8.120568 8 31 00 98 42 70 33 01 00
E: 8.121924 8 31 00 98 63 f0 7f 02 00
E: 8.136569 8 31 00 f0 43 70 33 01 00
E: 8.137923 8 31 00 80 62 f0 7f 02 00
E: 8.152567 8 31 00 20 45 70 33 01 00
E: 8.153923 8 31 00 58 61 f0 7f 02 00
E: 8.167550 8 31 00 58 46 58 33 01 00
E: 8.168922 8 31 00 f8 5f f0 7f 02 00
E: 8.183566 8 31 00 80 47 48 33 01 00
E: 8.184925 8 31 00 98 5e f0 7f 02 00
E: 8.198619 8 31 00 90 48 40 33 01 00
E: 8.199998 8 31 00 00 5d f0 7f 02 00
E: 8.214567 8 31 00 70 49 20 33 01 00
E: 8.215925 8 31 00 50 5b f0 7f 02 00
E: 8.229567 8 31 00 38 4a 20 33 01 00
E: 8.230926 8 31 00 a8 59 f0 7f 02 00
E: 8.245572 8 31 00 d0 4a 20 33 01 00
E: 8.246925 8 31 00 08 58 f0 7f 02 00
E: 8.260567 8 31 00 60 4b 20 33 01 00
E: 8.261925 8 31 00 88 56 f0 7f 02 00
E: 8.276567 8 31 00 08 4c 08 33 01 00
E: 8.277925 8 31 00 f8 54 f0 7f 02 00
E: 8.292566 8 31 00 78 4c 08 33 01 00
E: 8.293925 8 31 00 58 53 f0 7f 02 00
E: 8.307568 8 31 00 00 4d d8 32 01 00
E: 8.308925 8 31 00 c8 51 f0 7f 02 00
E: 8.323570 8 31 00 70 4d a8 32 01 00
E: 8.324925 8 31 00 28 50 f0 7f 02 00
E: 8.338614 8 31 00 d0 4d 88 32 01 00
E: 8.339639 8 31 00 88 4e f0 7f 02 00
E: 8.354937 8 31 00 08 4e 68 32 01 00
E: 8.356568 8 31 00 e0 4c f0 7f 02 00
E: 8.370176 8 31 00 58 4e 58 32 01 00
E: 8.371601 8 31 00 20 4b f0 7f 02 00
E: 8.385607 8 31 00 a8 4e 30 32 01 00
E: 8.386998 8 31 00 78 49 f0 7f 02 00
E: 8.400569 8 31 00 30 4f e8 31 01 00
E: 8.401925 8 31 00 b0 47 f0 7f 02 00
E: 8.416595 8 31 00 80 4f b0 31 01 00
E: 8.417560 8 31 00 e0 45 f0 7f 02 00
E: 8.432604 8 31 00 f0 4f 78 31 01 00
E: 8.434003 8 31 00 f8 43 f0 7f 02 00
E: 8.447598 8 31 00 60 50 20 31 01 00
E: 8.449113 8 31 00 38 42 f0 7f 02 00
E: 8.463616 8 31 00 d0 50 e0 30 01 00
E: 8.464965 8 31 00 90 40 f0 7f 02 00
E: 8.478572 8 31 00 40 51 88 30 01 00
E: 8.479927 8 31 00 08 3f c0 7e 02 00
E: 8.494611 8 31 00 c8 51 10 30 01 00
E: 8.496003 8 31 00 90 3d 30 7d 02 00
E: 8.509580 8 31 00 70 52 70 2f 01 00
E: 8.510929 8 31 00 48 3c a0 7b 02 00
E: 8.525568 8 31 00 20 53 d8 2e 01 00
E: 8.526929 8 31 00 08 3b 38 7a 02 00
E: 8.541570 8 31 00 d8 53 20 2e 01 00
E: 8.542928 8 31 00 e8 39 e8 78 02 00
E: 8.587547 8 31 00 d8 53 20 2e 01 00
E: 8.589179 8 31 00 f0 38 e8 78 02 00
E: 8.603973 8 31 00 40 33 18 51 01 00
E: 8.605936 8 31 00 90 35 00 7b 02 00
E: 8.618935 8 31 00 c0 2b 50 59 01 00
E: 8.620936 8 31 00 98 34 38 7c 02 00
E: 8.634938 8 31 00 e8 29 88 5b 01 00
E: 8.636876 8 31 00 28 34 60 7d 02 00
E: 8.649926 8 31 00 50 29 60 5c 01 00
E: 8.651867 8 31 00 28 34 60 7d 02 00
E: 8.665938 8 31 00 78 28 68 5d 01 00
E: 8.667934 8 31 00 d0 37 c0 79 02 00
E: 8.680933 8 31 00 08 28 f8 5d 01 00
E: 8.682935 8 31 00 d0 38 c0 79 02 00
E: 8.696940 8 31 00 b0 27 70 5e 01 00
E: 8.698935 8 31 00 18 39 20 7b 02 00
E: 8.711938 8 31 00 60 27 e8 5e 01 00
E: 8.713934 8 31 00 70 39 b8 7c 02 00
E: 8.727937 8 31 00 18 27 60 5f 01 00
E: 8.729927 8 31 00 c8 39 60 7e 02 00
E: 8.743938 8 31 00 d8 26 d0 5f 01 00
E: 8.745936 8 31 00 18 3a 98 7f 02 00
E: 8.758965 8 31 00 a0 26 28 60 01 00
E: 8.761173 8 31 00 88 3a e0 7f 02 00
E: 8.774938 8 31 00 68 26 90 60 01 00
E: 8.776939 8 31 00 00 3b f0 7f 02 00
E: 8.789930 8 31 00 28 26 e8 60 01 00
E: 8.791938 8 31 00 88 3b f0 7f 02 00
E: 8.805943 8 31 00 f0 25 50 61 01 00
E: 8.807932 8 31 00 e0 3b f0 7f 02 00
E: 8.820941 8 31 00 d0 25 b8 61 01 00
E: 8.822929 8 31 00 30 3c f0 7f 02 00
E: 8.836936 8 31 00 88 25 38 62 01 00
E: 8.838936 8 31 00 68 3c f0 7f 02 00
E: 8.850932 8 30 00 10 25 60 62 01 00
E: 8.852938 8 30 00 10 3d f0 7f 02 00
E: 9.692134 8 31 00 68 5d e0 39 01 00
E: 9.707033 8 31 00 68 5d e0 39 01 00
E: 9.722471 8 31 00 b0 5d 38 3b 01 00
E: 9.738004 8 30 00 50 5e 70 3c 01 00
# 3. Finally, move your ten fingers on the screen and release them.
E: 13.442072 8 31 00 58 1f 58 31 01 00
E: 13.457138 8 31 00 58 1f 58 31 01 00
E: 13.503002 8 31 00 b8 43 18 24 02 00
E: 13.505290 8 30 00 40 39 40 24 01 00
E: 13.518948 8 31 00 b8 43 18 24 02 00
E: 13.533980 8 31 00 c0 42 40 25 02 00
E: 13.550009 8 31 00 78 41 f8 26 02 00
E: 13.597072 8 31 00 e8 3f 18 29 02 00
E: 13.612976 8 31 00 20 3f 18 30 02 00
E: 13.627972 8 31 00 c0 3e a8 33 02 00
E: 13.643997 8 31 00 e0 2c e0 3c 01 00
E: 13.645302 8 31 00 c0 3e 58 36 02 00
E: 13.659906 8 31 00 e0 2c e0 3c 01 00
E: 13.661979 8 31 00 c0 3e e8 38 02 00
E: 13.675098 8 31 00 c0 2d f8 3d 01 00
E: 13.676975 8 31 00 00 3f 78 3b 02 00
E: 13.690974 8 31 00 e8 2e 60 3f 01 00
E: 13.692977 8 31 00 c8 3f 80 3d 02 00
E: 13.706188 8 31 00 18 30 f0 40 01 00
E: 13.707997 8 31 00 d0 40 18 3f 02 00
E: 13.721979 8 31 00 40 31 80 42 01 00
E: 13.723973 8 31 00 f0 41 40 40 02 00
E: 13.736978 8 31 00 40 32 e0 43 01 00
E: 13.738986 8 31 00 18 43 b8 40 02 00
E: 13.752976 8 31 00 18 33 38 45 01 00
E: 13.754974 8 31 00 88 44 b8 40 02 00
E: 13.769179 8 31 00 a0 33 50 46 01 00
E: 13.771000 8 31 00 f8 45 f0 3f 02 00
E: 13.783975 8 31 00 f0 33 28 47 01 00
E: 13.785975 8 31 00 68 47 98 3e 02 00
E: 13.814979 8 31 00 f0 33 a0 47 01 00
E: 13.816978 8 31 00 38 49 88 3c 02 00
E: 13.830975 8 31 00 80 31 40 4a 01 00
E: 13.832978 8 31 00 90 4c 00 39 02 00
E: 13.845979 8 31 00 98 30 90 4a 01 00
E: 13.848316 8 31 00 b0 4e b0 36 02 00
E: 13.861978 8 31 00 c8 2f 90 4a 01 00
E: 13.863975 8 31 00 b0 50 a0 34 02 00
E: 13.876976 8 31 00 a8 2e f0 49 01 00
E: 13.878975 8 31 00 b8 52 b0 32 02 00
E: 13.892977 8 31 00 40 2d 30 49 01 00
E: 13.894978 8 31 00 b8 54 00 31 02 00
E: 13.908977 8 31 00 70 2b 70 48 01 00
E: 13.910975 8 31 00 08 57 38 2f 02 00
E: 13.923975 8 31 00 88 29 c8 47 01 00
E: 13.925968 8 31 00 40 59 c8 2d 02 00
E: 13.940170 8 31 00 a8 27 10 47 01 00
E: 13.942003 8 31 00 e0 5a 88 2d 02 00
E: 13.954295 8 31 00 c0 25 68 46 01 00
E: 13.956260 8 31 00 40 5c 88 2d 02 00
E: 13.971194 8 31 00 f0 23 b0 45 01 00
E: 13.973168 8 31 00 78 5d 10 2e 02 00
E: 13.985978 8 31 00 40 22 10 45 01 00
E: 13.987976 8 31 00 88 5e d0 2e 02 00
E: 14.001978 8 31 00 b8 20 70 44 01 00
E: 14.003977 8 31 00 68 5f d0 2f 02 00
E: 14.016980 8 31 00 80 1f e0 43 01 00
E: 14.018976 8 31 00 88 5f 58 31 02 00
E: 14.032978 8 31 00 88 1e 30 43 01 00
E: 14.034981 8 31 00 88 5f 00 34 02 00
E: 14.048981 8 31 00 00 1e c8 42 01 00
E: 14.051282 8 31 00 78 5f 28 36 02 00
E: 14.064178 8 31 00 c8 1d 88 42 01 00
E: 14.066001 8 31 00 38 5f 90 38 02 00
E: 14.079975 8 31 00 c8 1d 70 42 01 00
E: 14.081977 8 31 00 20 5f c8 3a 02 00
E: 14.094978 8 31 00 c0 1d 60 42 01 00
E: 14.096981 8 31 00 20 5f 18 3d 02 00
E: 14.110981 8 31 00 b8 1d 50 42 01 00
E: 14.112978 8 31 00 28 5f 18 3f 02 00
E: 14.125910 8 31 00 b8 1d 50 42 01 00
E: 14.127978 8 31 00 68 5f 10 41 02 00
E: 14.141980 8 31 00 c0 1d 48 42 01 00
E: 14.143978 8 31 00 e0 5f b8 42 02 00
E: 14.157045 8 31 00 c8 1d 40 42 01 00
E: 14.159171 8 31 00 68 60 40 44 02 00
E: 14.172547 8 31 00 d0 1d 40 42 01 00
E: 14.173477 8 31 00 10 61 80 45 02 00
E: 14.188999 8 31 00 e8 1d 40 42 01 00
E: 14.190459 8 31 00 d8 61 70 46 02 00
E: 14.204284 8 31 00 20 1e 40 42 01 00
E: 14.206295 8 31 00 90 62 10 47 02 00
E: 14.220067 8 31 00 98 1e 58 42 01 00
E: 14.221979 8 31 00 58 63 10 47 02 00
E: 14.235560 8 31 00 78 1f 98 42 01 00
E: 14.236257 8 31 00 38 64 08 47 02 00
E: 14.251063 8 31 00 a8 20 00 43 01 00
E: 14.253241 8 31 00 10 65 78 46 02 00
E: 14.266142 8 31 00 08 22 70 43 01 00
E: 14.268163 8 31 00 e0 65 70 45 02 00
E: 14.282011 8 31 00 58 23 d8 43 01 00
E: 14.283977 8 31 00 b8 66 c0 43 02 00
E: 14.296963 8 31 00 70 24 28 44 01 00
E: 14.298984 8 31 00 70 67 a0 41 02 00
E: 14.312985 8 31 00 48 25 30 44 01 00
E: 14.314981 8 31 00 d0 67 f8 3f 02 00
E: 14.328984 8 31 00 d0 25 30 44 01 00
E: 14.330980 8 31 00 18 68 08 3e 02 00
E: 14.343982 8 31 00 50 26 10 44 01 00
E: 14.345980 8 31 00 30 68 18 3c 02 00
E: 14.359980 8 31 00 c8 26 e0 43 01 00
E: 14.361972 8 31 00 48 68 10 3a 02 00
E: 14.374980 8 31 00 38 27 98 43 01 00
E: 14.377036 8 31 00 48 68 f8 37 02 00
E: 14.390981 8 31 00 98 27 50 43 01 00
E: 14.392981 8 31 00 28 68 00 36 02 00
E: 14.406197 8 31 00 e8 27 f0 42 01 00
E: 14.408170 8 31 00 f0 67 68 34 02 00
E: 14.421978 8 31 00 20 28 78 42 01 00
E: 14.423978 8 31 00 60 67 80 33 02 00
E: 14.436982 8 31 00 50 28 f8 41 01 00
E: 14.438991 8 31 00 a8 66 98 32 02 00
E: 14.468405 8 31 00 60 28 f8 41 01 00
E: 14.471618 8 31 00 88 66 98 32 02 00
E: 14.483742 8 31 00 c8 3c 18 60 01 00
E: 14.485141 8 31 00 70 66 70 48 02 00
E: 14.499655 8 31 00 e0 3e b8 64 01 00
E: 14.501048 8 31 00 70 66 80 4d 02 00
E: 14.514625 8 31 00 e0 3e b8 64 01 00
E: 14.516026 8 31 00 d0 65 60 4e 02 00
E: 14.530620 8 31 00 10 3d 08 64 01 00
E: 14.531977 8 31 00 e8 64 60 4e 02 00
E: 14.545620 8 31 00 70 3c 90 62 01 00
E: 14.546976 8 31 00 10 64 10 4e 02 00
E: 14.561621 8 31 00 f8 3b 20 61 01 00
E: 14.562977 8 31 00 28 63 98 4d 02 00
E: 14.576654 8 31 00 c8 38 50 5b 01 00
E: 14.578185 8 31 00 40 62 20 4d 02 00
E: 14.592562 8 31 00 d8 37 10 59 01 00
E: 14.594135 8 31 00 50 61 a8 4c 02 00
E: 14.608619 8 31 00 58 37 b0 57 01 00
E: 14.609979 8 31 00 70 60 30 4c 02 00
E: 14.623620 8 31 00 e8 36 b0 57 01 00
E: 14.624978 8 31 00 80 5f e8 4b 02 00
E: 14.639616 8 31 00 98 34 80 57 01 00
E: 14.640976 8 31 00 90 5e b0 4b 02 00
E: 14.654618 8 31 00 f8 33 80 57 01 00
E: 14.655979 8 31 00 b0 5d 58 4b 02 00
E: 14.670579 8 31 00 f8 33 80 57 01 00
E: 14.671979 8 31 00 c8 5c 30 4b 02 00
E: 14.685628 8 31 00 50 36 98 56 01 00
E: 14.686976 8 31 00 e0 5b 10 4b 02 00
E: 14.701620 8 31 00 d8 36 38 4a 01 00
E: 14.702975 8 31 00 08 5b f0 4a 02 00
E: 14.716651 8 31 00 d8 36 30 46 01 00
E: 14.718050 8 31 00 50 5a f0 4a 02 00
E: 14.732620 8 31 00 c8 36 b8 44 01 00
E: 14.733978 8 31 00 98 59 f8 4a 02 00
E: 14.749005 8 31 00 b8 36 f0 43 01 00
E: 14.750988 8 31 00 d8 58 40 4b 02 00
E: 14.764314 8 31 00 b8 36 58 43 01 00
E: 14.766246 8 31 00 48 58 58 4b 02 00
E: 14.780169 8 31 00 b0 36 b8 42 01 00
E: 14.782132 8 31 00 a8 57 b0 4b 02 00
E: 14.795025 8 31 00 b0 36 48 42 01 00
E: 14.797191 8 31 00 20 57 00 4c 02 00
E: 14.811190 8 31 00 c0 36 e8 41 01 00
E: 14.813012 8 31 00 a8 56 50 4c 02 00
E: 14.825985 8 31 00 e8 36 a8 41 01 00
E: 14.827989 8 31 00 48 56 88 4c 02 00
E: 14.841989 8 31 00 00 37 78 41 01 00
E: 14.843985 8 31 00 10 56 a0 4c 02 00
E: 14.856983 8 31 00 18 37 68 41 01 00
E: 14.858984 8 31 00 f8 55 b8 4c 02 00
E: 14.873019 8 31 00 20 37 68 41 01 00
E: 14.874937 8 31 00 f8 55 b8 4c 02 00
E: 14.888996 8 31 00 38 37 50 41 01 00
E: 14.890981 8 31 00 00 56 b8 4c 02 00
E: 14.903989 8 31 00 40 37 50 41 01 00
E: 14.906207 8 31 00 10 56 b8 4c 02 00
E: 14.919984 8 31 00 48 37 48 41 01 00
E: 14.921985 8 31 00 28 56 b8 4c 02 00
E: 14.934915 8 31 00 48 37 48 41 01 00
E: 14.936242 8 31 00 40 56 c8 4c 02 00
E: 14.950986 8 31 00 40 37 50 41 01 00
E: 14.952986 8 31 00 80 56 d0 4c 02 00
E: 14.981016 8 30 00 40 37 68 41 01 00
E: 14.982983 8 30 00 d0 56 28 4d 02 00
# Thank you.
