R: 297 05 0d 09 04 a1 01 09 22 a1 02 09 42 15 00 25 01 75 01 95 01 81 02 95 03 81 03 09 32 09 47 95 02 81 02 95 02 81 03 09 51 75 08 95 01 81 02 05 01 26 ff 7f 65 11 55 0e 46 b0 0e 75 10 95 01 09 30 81 02 09 31 46 c2 0b 81 02 c0 a1 02 05 0d 09 42 15 00 25 01 75 01 95 01 81 02 95 03 81 03 09 32 09 47 95 02 81 02 95 02 81 03 09 51 75 08 95 01 81 02 05 01 26 ff 7f 65 11 55 0e 46 b0 0e 75 10 95 01 09 30 81 02 09 31 46 c2 0b 81 02 c0 a1 02 05 0d 09 42 15 00 25 01 75 01 95 01 81 02 95 03 81 03 09 32 09 47 95 02 81 02 95 02 81 03 09 51 75 08 95 01 81 02 05 01 26 ff 7f 65 11 55 0e 46 b0 0e 75 10 95 01 09 30 81 02 09 31 46 c2 0b 81 02 c0 a1 02 05 0d 09 42 15 00 25 01 75 01 95 01 81 02 95 03 81 03 09 32 09 47 95 02 81 02 95 02 81 03 09 51 75 08 95 01 81 02 05 01 26 ff 7f 65 11 55 0e 46 b0 0e 75 10 95 01 09 30 81 02 09 31 46 c2 0b 81 02 c0 05 0d 09 54 75 08 95 01 15 00 25 08 81 02 09 55 b1 02 c0
N: LUMIO Inc LUMIO CrystalTouch ver 02.03.24.00.
I: 3 202e 0006
# 1. Drag _one_ finger on the screen from one corner to the opposite, and release it.
E: 0.000000 25 31 01 80 13 68 19 00 00 00 00 00 00 00 00 00 00 00 00 00 00 00 00 00 00 01
E: 0.018216 25 31 01 80 13 68 19 00 00 00 00 00 00 00 00 00 00 00 00 00 00 00 00 00 00 01
E: 0.034877 25 31 01 80 13 68 19 00 00 00 00 00 00 00 00 00 00 00 00 00 00 00 00 00 00 01
E: 0.052943 25 31 01 88 13 80 19 00 00 00 00 00 00 00 00 00 00 00 00 00 00 00 00 00 00 01
E: 0.069951 25 31 01 c8 13 c0 19 00 00 00 00 00 00 00 00 00 00 00 00 00 00 00 00 00 00 01
E: 0.086942 25 31 01 28 14 20 1a 00 00 00 00 00 00 00 00 00 00 00 00 00 00 00 00 00 00 01
E: 0.104871 25 31 01 80 14 90 1a 00 00 00 00 00 00 00 00 00 00 00 00 00 00 00 00 00 00 01
E: 0.119101 25 31 01 08 15 18 1b 00 00 00 00 00 00 00 00 00 00 00 00 00 00 00 00 00 00 01
E: 0.139889 25 31 01 b0 15 b8 1b 00 00 00 00 00 00 00 00 00 00 00 00 00 00 00 00 00 00 01
E: 0.157373 25 31 01 90 16 90 1c 00 00 00 00 00 00 00 00 00 00 00 00 00 00 00 00 00 00 01
E: 0.173756 25 31 01 90 17 50 1d 00 00 00 00 00 00 00 00 00 00 00 00 00 00 00 00 00 00 01
E: 0.191814 25 31 01 a8 18 50 1e 00 00 00 00 00 00 00 00 00 00 00 00 00 00 00 00 00 00 01
E: 0.206091 25 31 01 00 1a 68 1f 00 00 00 00 00 00 00 00 00 00 00 00 00 00 00 00 00 00 01
E: 0.225408 25 31 01 70 1b b0 20 00 00 00 00 00 00 00 00 00 00 00 00 00 00 00 00 00 00 01
E: 0.243911 25 31 01 38 1d 00 22 00 00 00 00 00 00 00 00 00 00 00 00 00 00 00 00 00 00 01
E: 0.261325 25 31 01 20 1f 68 23 00 00 00 00 00 00 00 00 00 00 00 00 00 00 00 00 00 00 01
E: 0.279306 25 31 01 38 21 08 25 00 00 00 00 00 00 00 00 00 00 00 00 00 00 00 00 00 00 01
E: 0.295833 25 31 01 a8 23 90 26 00 00 00 00 00 00 00 00 00 00 00 00 00 00 00 00 00 00 01
E: 0.312355 25 31 01 18 26 60 28 00 00 00 00 00 00 00 00 00 00 00 00 00 00 00 00 00 00 01
E: 0.330878 25 31 01 b8 28 58 2a 00 00 00 00 00 00 00 00 00 00 00 00 00 00 00 00 00 00 01
E: 0.345028 25 31 01 90 2b 90 2c 00 00 00 00 00 00 00 00 00 00 00 00 00 00 00 00 00 00 01
E: 0.364924 25 31 01 70 2e a0 2e 00 00 00 00 00 00 00 00 00 00 00 00 00 00 00 00 00 00 01
E: 0.383294 25 31 01 70 31 c8 30 00 00 00 00 00 00 00 00 00 00 00 00 00 00 00 00 00 00 01
E: 0.399355 25 31 01 90 34 40 33 00 00 00 00 00 00 00 00 00 00 00 00 00 00 00 00 00 00 01
E: 0.418310 25 31 01 a0 37 b0 35 00 00 00 00 00 00 00 00 00 00 00 00 00 00 00 00 00 00 01
E: 0.435289 25 31 01 a0 3a 18 38 00 00 00 00 00 00 00 00 00 00 00 00 00 00 00 00 00 00 01
E: 0.451381 25 31 01 70 3d 78 3a 00 00 00 00 00 00 00 00 00 00 00 00 00 00 00 00 00 00 01
E: 0.470309 25 31 01 20 40 c0 3c 00 00 00 00 00 00 00 00 00 00 00 00 00 00 00 00 00 00 01
E: 0.488259 25 31 01 80 42 c0 3e 00 00 00 00 00 00 00 00 00 00 00 00 00 00 00 00 00 00 01
E: 0.505440 25 31 01 b8 44 e0 40 00 00 00 00 00 00 00 00 00 00 00 00 00 00 00 00 00 00 01
E: 0.522448 25 31 01 f8 46 28 43 00 00 00 00 00 00 00 00 00 00 00 00 00 00 00 00 00 00 01
E: 0.540483 25 31 01 28 49 68 45 00 00 00 00 00 00 00 00 00 00 00 00 00 00 00 00 00 00 01
E: 0.557457 25 31 01 20 4b 98 47 00 00 00 00 00 00 00 00 00 00 00 00 00 00 00 00 00 00 01
E: 0.575457 25 31 01 d0 4c 78 49 00 00 00 00 00 00 00 00 00 00 00 00 00 00 00 00 00 00 01
E: 0.592211 25 31 01 60 4e 58 4b 00 00 00 00 00 00 00 00 00 00 00 00 00 00 00 00 00 00 01
E: 0.606102 25 31 01 00 50 40 4d 00 00 00 00 00 00 00 00 00 00 00 00 00 00 00 00 00 00 01
E: 0.627340 25 31 01 80 51 18 4f 00 00 00 00 00 00 00 00 00 00 00 00 00 00 00 00 00 00 01
E: 0.644319 25 31 01 c0 52 d8 50 00 00 00 00 00 00 00 00 00 00 00 00 00 00 00 00 00 00 01
E: 0.661835 25 31 01 e0 53 80 52 00 00 00 00 00 00 00 00 00 00 00 00 00 00 00 00 00 00 01
E: 0.679265 25 31 01 b0 54 00 54 00 00 00 00 00 00 00 00 00 00 00 00 00 00 00 00 00 00 01
E: 0.696269 25 31 01 88 55 78 55 00 00 00 00 00 00 00 00 00 00 00 00 00 00 00 00 00 00 01
E: 0.713863 25 31 01 60 56 c8 56 00 00 00 00 00 00 00 00 00 00 00 00 00 00 00 00 00 00 01
E: 0.730908 25 31 01 40 57 10 58 00 00 00 00 00 00 00 00 00 00 00 00 00 00 00 00 00 00 01
E: 0.749269 25 31 01 08 58 28 59 00 00 00 00 00 00 00 00 00 00 00 00 00 00 00 00 00 00 01
E: 0.765906 25 31 01 b0 58 20 5a 00 00 00 00 00 00 00 00 00 00 00 00 00 00 00 00 00 00 01
E: 0.784268 25 31 01 38 59 d0 5a 00 00 00 00 00 00 00 00 00 00 00 00 00 00 00 00 00 00 01
E: 0.801238 25 31 01 c8 59 60 5b 00 00 00 00 00 00 00 00 00 00 00 00 00 00 00 00 00 00 01
E: 0.817823 25 31 01 58 5a e0 5b 00 00 00 00 00 00 00 00 00 00 00 00 00 00 00 00 00 00 01
E: 0.835892 25 31 01 e0 5a 50 5c 00 00 00 00 00 00 00 00 00 00 00 00 00 00 00 00 00 00 01
E: 0.853272 25 31 01 70 5b c0 5c 00 00 00 00 00 00 00 00 00 00 00 00 00 00 00 00 00 00 01
E: 0.870830 25 31 01 d8 5b 10 5d 00 00 00 00 00 00 00 00 00 00 00 00 00 00 00 00 00 00 01
E: 0.887836 25 31 01 f8 5b 28 5d 00 00 00 00 00 00 00 00 00 00 00 00 00 00 00 00 00 00 01
E: 0.904875 25 31 01 00 5c 28 5d 00 00 00 00 00 00 00 00 00 00 00 00 00 00 00 00 00 00 01
E: 0.922787 25 31 01 00 5c 28 5d 00 00 00 00 00 00 00 00 00 00 00 00 00 00 00 00 00 00 01
E: 0.939829 25 31 01 f8 5b 20 5d 00 00 00 00 00 00 00 00 00 00 00 00 00 00 00 00 00 00 01
E: 0.957842 25 31 01 f8 5b 20 5d 00 00 00 00 00 00 00 00 00 00 00 00 00 00 00 00 00 00 01
E: 0.974821 25 31 01 f0 5b 08 5d 00 00 00 00 00 00 00 00 00 00 00 00 00 00 00 00 00 00 01
E: 0.991766 25 31 01 f0 5b 08 5d 00 00 00 00 00 00 00 00 00 00 00 00 00 00 00 00 00 00 01
E: 1.009826 25 31 01 e8 5b f0 5c 00 00 00 00 00 00 00 00 00 00 00 00 00 00 00 00 00 00 01
E: 1.026912 25 31 01 e8 5b e0 5c 00 00 00 00 00 00 00 00 00 00 00 00 00 00 00 00 00 00 01
E: 1.042323 25 31 01 e0 5b c8 5c 00 00 00 00 00 00 00 00 00 00 00 00 00 00 00 00 00 00 01
E: 1.062269 25 31 01 e0 5b c0 5c 00 00 00 00 00 00 00 00 00 00 00 00 00 00 00 00 00 00 01
E: 1.077303 25 31 01 d8 5b b0 5c 00 00 00 00 00 00 00 00 00 00 00 00 00 00 00 00 00 00 01
E: 1.095342 25 31 01 c0 5b a0 5c 00 00 00 00 00 00 00 00 00 00 00 00 00 00 00 00 00 00 01
E: 1.106340 25 30 01 b0 5b 28 5c 00 00 00 00 00 00 00 00 00 00 00 00 00 00 00 00 00 00 01
# 2. Land one finger,
   - land a second finger far enough from the first
   - move your two fingers
   - release the *first* finger
   - release the second finger
E: 4.386011 25 31 01 88 17 38 64 00 00 00 00 00 00 00 00 00 00 00 00 00 00 00 00 00 00 01
E: 4.401500 25 31 01 88 17 38 64 00 00 00 00 00 00 00 00 00 00 00 00 00 00 00 00 00 00 01
E: 4.417210 25 31 01 78 17 b8 63 00 00 00 00 00 00 00 00 00 00 00 00 00 00 00 00 00 00 01
E: 4.434975 25 31 01 70 17 10 63 00 00 00 00 00 00 00 00 00 00 00 00 00 00 00 00 00 00 01
E: 4.453339 25 31 01 70 17 68 62 00 00 00 00 00 00 00 00 00 00 00 00 00 00 00 00 00 00 01
E: 4.473347 25 31 01 70 17 90 61 00 00 00 00 00 00 00 00 00 00 00 00 00 00 00 00 00 00 01
E: 4.490256 25 31 01 80 17 88 60 00 00 00 00 00 00 00 00 00 00 00 00 00 00 00 00 00 00 01
E: 4.507491 25 31 01 80 17 68 5f 00 00 00 00 00 00 00 00 00 00 00 00 00 00 00 00 00 00 01
E: 4.524853 25 31 01 80 17 20 5e 00 00 00 00 00 00 00 00 00 00 00 00 00 00 00 00 00 00 01
E: 4.542672 25 31 01 88 17 98 5c 00 00 00 00 00 00 00 00 00 00 00 00 00 00 00 00 00 00 01
E: 4.560294 25 31 01 a0 17 10 5b 00 00 00 00 00 00 00 00 00 00 00 00 00 00 00 00 00 00 01
E: 4.577330 25 31 01 b8 17 80 59 00 00 00 00 00 00 00 00 00 00 00 00 00 00 00 00 00 00 01
E: 4.594067 25 31 01 d8 17 d0 57 00 00 00 00 00 00 00 00 00 00 00 00 00 00 00 00 00 00 01
E: 4.611897 25 31 01 08 18 20 56 00 00 00 00 00 00 00 00 00 00 00 00 00 00 00 00 00 00 01
E: 4.629354 25 31 01 40 18 70 54 00 00 00 00 00 00 00 00 00 00 00 00 00 00 00 00 00 00 01
E: 4.647288 25 31 01 80 18 90 52 00 00 00 00 00 00 00 00 00 00 00 00 00 00 00 00 00 00 01
E: 4.664336 25 31 01 e0 18 c8 50 00 00 00 00 00 00 00 00 00 00 00 00 00 00 00 00 00 00 01
E: 4.681338 25 31 01 38 19 c0 4e 00 00 00 00 00 00 00 00 00 00 00 00 00 00 00 00 00 00 01
E: 4.699344 25 31 01 80 19 c8 4c 00 00 00 00 00 00 00 00 00 00 00 00 00 00 00 00 00 00 01
E: 4.716304 25 31 01 e0 19 80 4a 00 00 00 00 00 00 00 00 00 00 00 00 00 00 00 00 00 00 01
E: 4.734297 25 31 01 40 1a c0 47 00 00 00 00 00 00 00 00 00 00 00 00 00 00 00 00 00 00 01
E: 4.751351 25 31 01 78 1a 40 45 00 00 00 00 00 00 00 00 00 00 00 00 00 00 00 00 00 00 01
E: 4.768298 25 31 01 a8 1a 00 43 00 00 00 00 00 00 00 00 00 00 00 00 00 00 00 00 00 00 01
E: 4.786457 25 31 01 e0 1a f8 40 00 00 00 00 00 00 00 00 00 00 00 00 00 00 00 00 00 00 01
E: 4.803347 25 31 01 28 1b f0 3e 00 00 00 00 00 00 00 00 00 00 00 00 00 00 00 00 00 00 01
E: 4.821333 25 31 01 90 1b d0 3c 00 00 00 00 00 00 00 00 00 00 00 00 00 00 00 00 00 00 01
E: 4.836422 25 31 01 e8 1b b0 3a 00 00 00 00 00 00 00 00 00 00 00 00 00 00 00 00 00 00 01
E: 4.855553 25 31 01 38 1c b8 38 00 00 00 00 00 00 00 00 00 00 00 00 00 00 00 00 00 00 01
E: 4.873453 25 31 01 b0 1c 08 36 00 00 00 00 00 00 00 00 00 00 00 00 00 00 00 00 00 00 01
E: 4.890502 25 31 01 e8 1c e8 33 00 00 00 00 00 00 00 00 00 00 00 00 00 00 00 00 00 00 01
E: 4.905104 25 31 01 20 1d a0 31 00 00 00 00 00 00 00 00 00 00 00 00 00 00 00 00 00 00 01
E: 4.925280 25 31 01 58 1d 30 2f 00 00 00 00 00 00 00 00 00 00 00 00 00 00 00 00 00 00 01
E: 4.942300 25 31 01 98 1d 58 2d 00 00 00 00 00 00 00 00 00 00 00 00 00 00 00 00 00 00 01
E: 4.962343 25 31 01 e0 1d 88 2b 00 00 00 00 00 00 00 00 00 00 00 00 00 00 00 00 00 00 01
E: 4.979857 25 31 01 38 1e f0 29 00 00 00 00 00 00 00 00 00 00 00 00 00 00 00 00 00 00 01
E: 4.997338 25 31 01 88 1e 60 28 00 00 00 00 00 00 00 00 00 00 00 00 00 00 00 00 00 00 01
E: 5.014903 25 31 01 c8 1e 08 27 31 02 e0 67 70 10 00 00 00 00 00 00 00 00 00 00 00 00 02
E: 5.032281 25 31 01 20 1f b0 25 31 02 e0 67 70 10 00 00 00 00 00 00 00 00 00 00 00 00 02
E: 5.050334 25 31 01 80 1f 88 24 31 02 30 67 68 10 00 00 00 00 00 00 00 00 00 00 00 00 02
E: 5.067302 25 31 01 b8 1f 88 23 31 02 30 66 68 10 00 00 00 00 00 00 00 00 00 00 00 00 02
E: 5.081168 25 31 01 40 20 68 22 31 02 d8 64 a0 10 00 00 00 00 00 00 00 00 00 00 00 00 02
E: 5.102332 25 31 01 a8 20 80 21 31 02 38 63 f0 10 00 00 00 00 00 00 00 00 00 00 00 00 02
E: 5.119296 25 31 01 f8 20 f0 20 31 02 88 61 50 11 00 00 00 00 00 00 00 00 00 00 00 00 02
E: 5.137292 25 31 01 40 21 78 20 31 02 b8 5f f8 11 00 00 00 00 00 00 00 00 00 00 00 00 02
E: 5.153952 25 31 01 b0 21 08 20 31 02 f0 5d c0 12 00 00 00 00 00 00 00 00 00 00 00 00 02
E: 5.169421 25 31 01 58 22 90 1f 31 02 08 5c b8 13 00 00 00 00 00 00 00 00 00 00 00 00 02
E: 5.189446 25 31 01 18 23 38 1f 31 02 28 5a f0 14 00 00 00 00 00 00 00 00 00 00 00 00 02
E: 5.206529 25 31 01 b8 23 38 1f 31 02 48 58 70 16 00 00 00 00 00 00 00 00 00 00 00 00 02
E: 5.224284 25 31 01 40 24 58 1f 31 02 88 56 18 18 00 00 00 00 00 00 00 00 00 00 00 00 02
E: 5.238134 25 31 01 e8 24 a8 1f 31 02 08 55 c0 19 00 00 00 00 00 00 00 00 00 00 00 00 02
E: 5.255144 25 31 01 78 25 18 20 31 02 b0 53 88 1b 00 00 00 00 00 00 00 00 00 00 00 00 02
E: 5.273132 25 31 01 28 26 b0 20 31 02 68 52 78 1d 00 00 00 00 00 00 00 00 00 00 00 00 02
E: 5.294331 25 31 01 e8 26 78 21 31 02 38 51 88 1f 00 00 00 00 00 00 00 00 00 00 00 00 02
E: 5.311307 25 31 01 b0 27 58 22 31 02 30 50 a8 21 00 00 00 00 00 00 00 00 00 00 00 00 02
E: 5.329352 25 31 01 68 28 38 23 31 02 70 4f d0 23 00 00 00 00 00 00 00 00 00 00 00 00 02
E: 5.346342 25 31 01 f8 28 38 24 31 02 d0 4e 10 26 00 00 00 00 00 00 00 00 00 00 00 00 02
E: 5.364446 25 31 01 78 29 50 25 31 02 50 4e 48 28 00 00 00 00 00 00 00 00 00 00 00 00 02
E: 5.381352 25 31 01 10 2a 88 26 31 02 00 4e 60 2a 00 00 00 00 00 00 00 00 00 00 00 00 02
E: 5.398315 25 31 01 70 2a f8 27 31 02 00 4e 50 2c 00 00 00 00 00 00 00 00 00 00 00 00 02
E: 5.416260 25 31 01 d0 2a 68 29 31 02 18 4e 28 2e 00 00 00 00 00 00 00 00 00 00 00 00 02
E: 5.433359 25 31 01 20 2b d8 2a 31 02 68 4e e8 2f 00 00 00 00 00 00 00 00 00 00 00 00 02
E: 5.451347 25 31 01 88 2b 68 2c 31 02 f0 4e 80 31 00 00 00 00 00 00 00 00 00 00 00 00 02
E: 5.468264 25 31 01 d8 2b d0 2d 31 02 80 4f f0 32 00 00 00 00 00 00 00 00 00 00 00 00 02
E: 5.485309 25 31 01 28 2c 40 2f 31 02 48 50 48 34 00 00 00 00 00 00 00 00 00 00 00 00 02
E: 5.502299 25 31 01 70 2c d0 30 31 02 20 51 78 35 00 00 00 00 00 00 00 00 00 00 00 00 02
E: 5.520304 25 31 01 e0 2c 48 32 31 02 10 52 90 36 00 00 00 00 00 00 00 00 00 00 00 00 02
E: 5.537279 25 31 01 40 2d d8 33 31 02 10 53 90 37 00 00 00 00 00 00 00 00 00 00 00 00 02
E: 5.554307 25 31 01 90 2d 68 35 31 02 30 54 88 38 00 00 00 00 00 00 00 00 00 00 00 00 02
E: 5.572137 25 31 01 d0 2d f8 36 31 02 60 55 58 39 00 00 00 00 00 00 00 00 00 00 00 00 02
E: 5.588899 25 31 01 18 2e a0 38 31 02 98 56 20 3a 00 00 00 00 00 00 00 00 00 00 00 00 02
E: 5.605998 25 31 01 68 2e 50 3a 31 02 e8 57 c8 3a 00 00 00 00 00 00 00 00 00 00 00 00 02
E: 5.624503 25 31 01 b0 2e 10 3c 31 02 40 59 80 3b 00 00 00 00 00 00 00 00 00 00 00 00 02
E: 5.641221 25 31 01 f8 2e b8 3d 31 02 98 5a 40 3c 00 00 00 00 00 00 00 00 00 00 00 00 02
E: 5.656235 25 31 01 30 2f 60 3f 31 02 d8 5b 08 3d 00 00 00 00 00 00 00 00 00 00 00 00 02
E: 5.674372 25 31 01 58 2f f0 40 31 02 00 5d e0 3d 00 00 00 00 00 00 00 00 00 00 00 00 02
E: 5.694345 25 31 01 70 2f 70 42 31 02 18 5e e8 3e 00 00 00 00 00 00 00 00 00 00 00 00 02
E: 5.711350 25 31 01 98 2f f8 43 31 02 e8 5e f8 3f 00 00 00 00 00 00 00 00 00 00 00 00 02
E: 5.727866 25 31 01 b0 2f 90 45 31 02 90 5f 48 41 00 00 00 00 00 00 00 00 00 00 00 00 02
E: 5.745971 25 31 01 c8 2f 18 47 31 02 f8 5f d0 42 00 00 00 00 00 00 00 00 00 00 00 00 02
E: 5.762867 25 31 01 e0 2f a8 48 31 02 30 60 80 44 00 00 00 00 00 00 00 00 00 00 00 00 02
E: 5.780297 25 31 01 f0 2f 28 4a 31 02 30 60 38 46 00 00 00 00 00 00 00 00 00 00 00 00 02
E: 5.798320 25 31 01 f0 2f 98 4b 31 02 10 60 f0 47 00 00 00 00 00 00 00 00 00 00 00 00 02
E: 5.814905 25 31 01 f0 2f 08 4d 31 02 b0 5f b0 49 00 00 00 00 00 00 00 00 00 00 00 00 02
E: 5.833595 25 31 01 d8 2f 98 4e 31 02 18 5f 80 4b 00 00 00 00 00 00 00 00 00 00 00 00 02
E: 5.850378 25 31 01 d8 2f 08 50 31 02 40 5e 58 4d 00 00 00 00 00 00 00 00 00 00 00 00 02
E: 5.868328 25 31 01 b8 2f 48 51 31 02 40 5d 48 4f 00 00 00 00 00 00 00 00 00 00 00 00 02
E: 5.885271 25 31 01 78 2f 88 52 31 02 50 5c 48 51 00 00 00 00 00 00 00 00 00 00 00 00 02
E: 5.903361 25 31 01 38 2f a0 53 31 02 88 5b 48 53 00 00 00 00 00 00 00 00 00 00 00 00 02
E: 5.920267 25 31 01 e0 2e a8 54 31 02 e0 5a 28 55 00 00 00 00 00 00 00 00 00 00 00 00 02
E: 5.938587 25 31 01 90 2e a8 55 31 02 68 5a 30 57 00 00 00 00 00 00 00 00 00 00 00 00 02
E: 5.955026 25 31 01 00 2e 90 56 31 02 58 5a f8 58 00 00 00 00 00 00 00 00 00 00 00 00 02
E: 5.970416 25 31 01 48 2d 70 57 31 02 58 5a 78 5a 00 00 00 00 00 00 00 00 00 00 00 00 02
E: 5.990455 25 31 01 88 2c 50 58 31 02 b0 5a b0 5b 00 00 00 00 00 00 00 00 00 00 00 00 02
E: 6.007536 25 31 01 a0 2b 18 59 31 02 58 5b c8 5c 00 00 00 00 00 00 00 00 00 00 00 00 02
E: 6.024791 25 31 01 a8 2a f0 59 31 02 20 5c 90 5d 00 00 00 00 00 00 00 00 00 00 00 00 02
E: 6.039172 25 31 01 68 29 70 5a 31 02 40 5d 28 5e 00 00 00 00 00 00 00 00 00 00 00 00 02
E: 6.059268 25 31 01 20 28 00 5b 31 02 90 5e 70 5e 00 00 00 00 00 00 00 00 00 00 00 00 02
E: 6.073200 25 31 01 d0 26 70 5b 31 02 18 60 70 5e 00 00 00 00 00 00 00 00 00 00 00 00 02
E: 6.090018 25 31 01 88 25 c8 5b 31 02 b0 61 18 5e 00 00 00 00 00 00 00 00 00 00 00 00 02
E: 6.109483 25 31 01 30 24 10 5c 31 02 60 63 80 5d 00 00 00 00 00 00 00 00 00 00 00 00 02
E: 6.128129 25 31 01 f0 22 48 5c 31 02 18 65 a0 5c 00 00 00 00 00 00 00 00 00 00 00 00 02
E: 6.146127 25 31 01 b0 21 58 5c 31 02 c8 66 60 5b 00 00 00 00 00 00 00 00 00 00 00 00 02
E: 6.163398 25 31 01 78 20 58 5c 31 02 60 68 e0 59 00 00 00 00 00 00 00 00 00 00 00 00 02
E: 6.180345 25 31 01 58 1f 50 5c 31 02 b8 69 18 58 00 00 00 00 00 00 00 00 00 00 00 00 02
E: 6.198316 25 31 01 50 1e 28 5c 31 02 f0 6a 48 56 00 00 00 00 00 00 00 00 00 00 00 00 02
E: 6.215359 25 31 01 68 1d 00 5c 31 02 f0 6b 60 54 00 00 00 00 00 00 00 00 00 00 00 00 02
E: 6.230388 25 31 01 b0 1c c8 5b 31 02 c0 6c 68 52 00 00 00 00 00 00 00 00 00 00 00 00 02
E: 6.249876 25 31 01 30 1c 88 5b 31 02 50 6d 80 50 00 00 00 00 00 00 00 00 00 00 00 00 02
E: 6.267334 25 31 01 e0 1b 48 5b 31 02 c0 6d 78 4e 00 00 00 00 00 00 00 00 00 00 00 00 02
E: 6.285312 25 31 01 b0 1b 18 5b 31 02 00 6e 70 4c 00 00 00 00 00 00 00 00 00 00 00 00 02
E: 6.300423 25 31 01 88 1b d8 5a 31 02 00 6e 68 4a 00 00 00 00 00 00 00 00 00 00 00 00 02
E: 6.319314 25 31 01 68 1b 68 5a 31 02 e8 6d 50 48 00 00 00 00 00 00 00 00 00 00 00 00 02
E: 6.336895 25 31 01 48 1b f0 59 31 02 e0 6d 48 46 00 00 00 00 00 00 00 00 00 00 00 00 02
E: 6.353873 25 31 01 30 1b 60 59 31 02 c0 6d 08 44 00 00 00 00 00 00 00 00 00 00 00 00 02
E: 6.371885 25 31 01 20 1b b8 58 31 02 a0 6d 80 41 00 00 00 00 00 00 00 00 00 00 00 00 02
E: 6.387649 25 31 01 18 1b 10 58 31 02 60 6d 38 3f 00 00 00 00 00 00 00 00 00 00 00 00 02
E: 6.404765 25 31 01 18 1b 60 57 31 02 18 6d e8 3c 00 00 00 00 00 00 00 00 00 00 00 00 02
E: 6.423928 25 31 01 18 1b 88 56 31 02 c0 6c c8 3a 00 00 00 00 00 00 00 00 00 00 00 00 02
E: 6.441232 25 31 01 28 1b a0 55 31 02 48 6c 28 39 00 00 00 00 00 00 00 00 00 00 00 00 02
E: 6.456055 25 31 01 38 1b c8 54 31 02 d0 6b 40 37 00 00 00 00 00 00 00 00 00 00 00 00 02
E: 6.473109 25 31 01 50 1b c8 53 31 02 60 6b 70 35 00 00 00 00 00 00 00 00 00 00 00 00 02
E: 6.493317 25 31 01 68 1b b0 52 31 02 f0 6a 90 33 00 00 00 00 00 00 00 00 00 00 00 00 02
E: 6.511277 25 31 01 98 1b 58 51 31 02 90 6a c0 31 00 00 00 00 00 00 00 00 00 00 00 00 02
E: 6.528353 25 31 01 d0 1b f8 4f 31 02 30 6a f0 2f 00 00 00 00 00 00 00 00 00 00 00 00 02
E: 6.545920 25 31 01 18 1c 98 4e 31 02 a8 69 68 2e 00 00 00 00 00 00 00 00 00 00 00 00 02
E: 6.561398 25 31 01 60 1c 50 4d 31 02 10 69 10 2d 00 00 00 00 00 00 00 00 00 00 00 00 02
E: 6.579353 25 31 01 a8 1c 48 4c 31 02 60 68 f8 2b 00 00 00 00 00 00 00 00 00 00 00 00 02
E: 6.596352 25 31 01 10 1d 00 4b 31 02 98 67 00 2b 00 00 00 00 00 00 00 00 00 00 00 00 02
E: 6.615348 25 31 01 80 1d c0 49 31 02 b0 66 38 2a 00 00 00 00 00 00 00 00 00 00 00 00 02
E: 6.631391 25 31 01 10 1e 68 48 31 02 a8 65 88 29 00 00 00 00 00 00 00 00 00 00 00 00 02
E: 6.650365 25 31 01 c0 1e 00 47 31 02 80 64 08 29 00 00 00 00 00 00 00 00 00 00 00 00 02
E: 6.668346 25 31 01 68 1f c8 45 31 02 30 63 88 28 00 00 00 00 00 00 00 00 00 00 00 00 02
E: 6.685276 25 31 01 f8 1f b0 44 31 02 e0 61 18 28 00 00 00 00 00 00 00 00 00 00 00 00 02
E: 6.702873 25 31 01 80 20 c0 43 31 02 90 60 d8 27 00 00 00 00 00 00 00 00 00 00 00 00 02
E: 6.720335 25 31 01 18 21 b8 42 31 02 38 5f d8 27 00 00 00 00 00 00 00 00 00 00 00 00 02
E: 6.738516 25 31 01 b8 21 b0 41 31 02 b0 5d f0 27 00 00 00 00 00 00 00 00 00 00 00 00 02
E: 6.755203 25 31 01 58 22 b8 40 31 02 38 5c 80 28 00 00 00 00 00 00 00 00 00 00 00 00 02
E: 6.771892 25 31 01 c8 22 e0 3f 31 02 88 5a e8 28 00 00 00 00 00 00 00 00 00 00 00 00 02
E: 6.789897 25 31 01 38 23 30 3f 31 02 c8 58 a0 29 00 00 00 00 00 00 00 00 00 00 00 00 02
E: 6.807548 25 31 01 a8 23 78 3e 31 02 38 57 70 2a 00 00 00 00 00 00 00 00 00 00 00 00 02
E: 6.825261 25 31 01 28 24 b0 3d 31 02 c8 55 50 2b 00 00 00 00 00 00 00 00 00 00 00 00 02
E: 6.841875 25 31 01 d0 24 e8 3c 31 02 70 54 50 2c 00 00 00 00 00 00 00 00 00 00 00 00 02
E: 6.860285 25 31 01 90 25 20 3c 31 02 18 53 68 2d 00 00 00 00 00 00 00 00 00 00 00 00 02
E: 6.876969 25 31 01 48 26 90 3b 31 02 d0 51 a8 2e 00 00 00 00 00 00 00 00 00 00 00 00 02
E: 6.893876 25 31 01 18 27 30 3b 31 02 a0 50 20 30 00 00 00 00 00 00 00 00 00 00 00 00 02
E: 6.911875 25 31 01 f0 27 f0 3a 31 02 98 4f a8 31 00 00 00 00 00 00 00 00 00 00 00 00 02
E: 6.928879 25 31 01 c0 28 f0 3a 31 02 d0 4e 20 33 00 00 00 00 00 00 00 00 00 00 00 00 02
E: 6.946878 25 31 01 a8 29 f0 3a 31 02 18 4e b0 34 00 00 00 00 00 00 00 00 00 00 00 00 02
E: 6.963876 25 31 01 b0 2a 40 3b 31 02 d0 4d 98 36 00 00 00 00 00 00 00 00 00 00 00 00 02
E: 6.981875 25 31 01 c0 2b d8 3b 31 02 40 4d 18 38 00 00 00 00 00 00 00 00 00 00 00 00 02
E: 6.998877 25 31 01 c0 2c 98 3c 31 02 00 4d a8 39 00 00 00 00 00 00 00 00 00 00 00 00 02
E: 7.016912 25 31 01 98 2d 68 3d 31 02 f8 4c 60 3b 00 00 00 00 00 00 00 00 00 00 00 00 02
E: 7.031243 25 31 01 70 2e 68 3e 31 02 f8 4c 00 3d 00 00 00 00 00 00 00 00 00 00 00 00 02
E: 7.049036 25 31 01 38 2f 98 3f 31 02 28 4d 90 3e 00 00 00 00 00 00 00 00 00 00 00 00 02
E: 7.067494 25 31 01 e8 2f d0 40 31 02 88 4d 10 40 00 00 00 00 00 00 00 00 00 00 00 00 02
E: 7.085370 25 31 01 88 30 20 42 31 02 f8 4d 78 41 00 00 00 00 00 00 00 00 00 00 00 00 02
E: 7.104303 25 31 01 00 31 70 43 31 02 a0 4e b0 42 00 00 00 00 00 00 00 00 00 00 00 00 02
E: 7.119396 25 31 01 58 31 c0 44 31 02 60 4f c8 43 00 00 00 00 00 00 00 00 00 00 00 00 02
E: 7.138516 25 31 01 80 31 00 46 31 02 48 50 a8 44 00 00 00 00 00 00 00 00 00 00 00 00 02
E: 7.156304 25 31 01 80 31 20 47 31 02 48 51 70 45 00 00 00 00 00 00 00 00 00 00 00 00 02
E: 7.172914 25 31 01 60 31 50 48 31 02 70 52 18 46 00 00 00 00 00 00 00 00 00 00 00 00 02
E: 7.189894 25 31 01 30 31 70 49 31 02 a8 53 a0 46 00 00 00 00 00 00 00 00 00 00 00 00 02
E: 7.206890 25 31 01 d0 30 90 4a 31 02 e0 54 30 47 00 00 00 00 00 00 00 00 00 00 00 00 02
E: 7.225211 25 31 01 58 30 b8 4b 31 02 f8 55 b8 47 00 00 00 00 00 00 00 00 00 00 00 00 02
E: 7.241891 25 31 01 a8 2f f0 4c 31 02 00 57 38 48 00 00 00 00 00 00 00 00 00 00 00 00 02
E: 7.260321 25 31 01 80 2e 40 4e 31 02 e8 57 d8 48 00 00 00 00 00 00 00 00 00 00 00 00 02
E: 7.274291 25 30 01 f0 2c e8 4e 31 02 c0 58 80 49 00 00 00 00 00 00 00 00 00 00 00 00 02
E: 7.292151 25 31 02 58 59 10 4a 00 00 00 00 00 00 00 00 00 00 00 00 00 00 00 00 00 00 01
E: 7.309270 25 31 02 e8 59 c0 4a 00 00 00 00 00 00 00 00 00 00 00 00 00 00 00 00 00 00 01
E: 7.325856 25 31 02 58 5a 68 4b 00 00 00 00 00 00 00 00 00 00 00 00 00 00 00 00 00 00 01
E: 7.343851 25 31 02 a8 5a 08 4c 00 00 00 00 00 00 00 00 00 00 00 00 00 00 00 00 00 00 01
E: 7.360857 25 31 02 f0 5a 98 4c 00 00 00 00 00 00 00 00 00 00 00 00 00 00 00 00 00 00 01
E: 7.378871 25 31 02 20 5b 28 4d 00 00 00 00 00 00 00 00 00 00 00 00 00 00 00 00 00 00 01
E: 7.395850 25 31 02 40 5b 98 4d 00 00 00 00 00 00 00 00 00 00 00 00 00 00 00 00 00 00 01
E: 7.413852 25 31 02 58 5b 08 4e 00 00 00 00 00 00 00 00 00 00 00 00 00 00 00 00 00 00 01
E: 7.430863 25 31 02 70 5b 58 4e 00 00 00 00 00 00 00 00 00 00 00 00 00 00 00 00 00 00 01
E: 7.447888 25 31 02 80 5b a8 4e 00 00 00 00 00 00 00 00 00 00 00 00 00 00 00 00 00 00 01
E: 7.465872 25 31 02 88 5b f0 4e 00 00 00 00 00 00 00 00 00 00 00 00 00 00 00 00 00 00 01
E: 7.480054 25 31 02 90 5b 40 4f 00 00 00 00 00 00 00 00 00 00 00 00 00 00 00 00 00 00 01
E: 7.499876 25 31 02 a0 5b a0 4f 00 00 00 00 00 00 00 00 00 00 00 00 00 00 00 00 00 00 01
E: 7.517872 25 31 02 b0 5b 10 50 00 00 00 00 00 00 00 00 00 00 00 00 00 00 00 00 00 00 01
E: 7.534868 25 31 02 c0 5b 68 50 00 00 00 00 00 00 00 00 00 00 00 00 00 00 00 00 00 00 01
E: 7.552873 25 31 02 c0 5b f0 50 00 00 00 00 00 00 00 00 00 00 00 00 00 00 00 00 00 00 01
E: 7.569874 25 31 02 f0 5b c0 51 00 00 00 00 00 00 00 00 00 00 00 00 00 00 00 00 00 00 01
E: 7.587313 25 31 02 18 5c 98 52 00 00 00 00 00 00 00 00 00 00 00 00 00 00 00 00 00 00 01
E: 7.604889 25 31 02 50 5c 88 53 00 00 00 00 00 00 00 00 00 00 00 00 00 00 00 00 00 00 01
E: 7.621924 25 31 02 88 5c 70 54 00 00 00 00 00 00 00 00 00 00 00 00 00 00 00 00 00 00 01
E: 7.639660 25 31 02 d0 5c 88 55 00 00 00 00 00 00 00 00 00 00 00 00 00 00 00 00 00 00 01
E: 7.657185 25 31 02 20 5d 90 56 00 00 00 00 00 00 00 00 00 00 00 00 00 00 00 00 00 00 01
E: 7.673926 25 31 02 80 5d a8 57 00 00 00 00 00 00 00 00 00 00 00 00 00 00 00 00 00 00 01
E: 7.691939 25 31 02 e8 5d c8 58 00 00 00 00 00 00 00 00 00 00 00 00 00 00 00 00 00 00 01
E: 7.708876 25 31 02 50 5e f8 59 00 00 00 00 00 00 00 00 00 00 00 00 00 00 00 00 00 00 01
E: 7.726881 25 31 02 98 5e 68 5b 00 00 00 00 00 00 00 00 00 00 00 00 00 00 00 00 00 00 01
E: 7.743888 25 31 02 a8 5e e8 5c 00 00 00 00 00 00 00 00 00 00 00 00 00 00 00 00 00 00 01
E: 7.760873 25 31 02 a8 5e c0 5e 00 00 00 00 00 00 00 00 00 00 00 00 00 00 00 00 00 00 01
E: 7.778875 25 31 02 50 5e 98 60 00 00 00 00 00 00 00 00 00 00 00 00 00 00 00 00 00 00 01
E: 7.796891 25 31 02 c8 5d 28 62 00 00 00 00 00 00 00 00 00 00 00 00 00 00 00 00 00 00 01
E: 7.813875 25 31 02 38 5d 30 63 00 00 00 00 00 00 00 00 00 00 00 00 00 00 00 00 00 00 01
E: 7.830875 25 31 02 98 5c 10 64 00 00 00 00 00 00 00 00 00 00 00 00 00 00 00 00 00 00 01
E: 7.848874 25 31 02 98 5b d0 64 00 00 00 00 00 00 00 00 00 00 00 00 00 00 00 00 00 00 01
E: 7.865874 25 31 02 60 5a 88 65 00 00 00 00 00 00 00 00 00 00 00 00 00 00 00 00 00 00 01
E: 7.882876 25 31 02 f0 58 10 66 00 00 00 00 00 00 00 00 00 00 00 00 00 00 00 00 00 00 01
E: 7.900878 25 31 02 90 57 60 66 00 00 00 00 00 00 00 00 00 00 00 00 00 00 00 00 00 00 01
E: 7.918028 25 31 02 20 56 60 66 00 00 00 00 00 00 00 00 00 00 00 00 00 00 00 00 00 00 01
E: 7.935879 25 31 02 c0 54 08 66 00 00 00 00 00 00 00 00 00 00 00 00 00 00 00 00 00 00 01
E: 7.952876 25 31 02 68 53 60 65 00 00 00 00 00 00 00 00 00 00 00 00 00 00 00 00 00 00 01
E: 7.969878 25 31 02 f0 51 60 64 00 00 00 00 00 00 00 00 00 00 00 00 00 00 00 00 00 00 01
E: 7.987878 25 31 02 78 50 08 63 00 00 00 00 00 00 00 00 00 00 00 00 00 00 00 00 00 00 01
E: 8.004926 25 31 02 38 4f 78 61 00 00 00 00 00 00 00 00 00 00 00 00 00 00 00 00 00 00 01
E: 8.022929 25 31 02 50 4e d8 5f 00 00 00 00 00 00 00 00 00 00 00 00 00 00 00 00 00 00 01
E: 8.039880 25 31 02 60 4d 10 5e 00 00 00 00 00 00 00 00 00 00 00 00 00 00 00 00 00 00 01
E: 8.057246 25 31 02 b0 4c 40 5c 00 00 00 00 00 00 00 00 00 00 00 00 00 00 00 00 00 00 01
E: 8.074847 25 31 02 50 4c 38 5a 00 00 00 00 00 00 00 00 00 00 00 00 00 00 00 00 00 00 01
E: 8.092275 25 31 02 30 4c e0 57 00 00 00 00 00 00 00 00 00 00 00 00 00 00 00 00 00 00 01
E: 8.110316 25 31 02 30 4c 90 55 00 00 00 00 00 00 00 00 00 00 00 00 00 00 00 00 00 00 01
E: 8.127322 25 31 02 58 4c 58 53 00 00 00 00 00 00 00 00 00 00 00 00 00 00 00 00 00 00 01
E: 8.143883 25 31 02 a8 4c 10 51 00 00 00 00 00 00 00 00 00 00 00 00 00 00 00 00 00 00 01
E: 8.161877 25 31 02 30 4d d0 4e 00 00 00 00 00 00 00 00 00 00 00 00 00 00 00 00 00 00 01
E: 8.178880 25 31 02 f8 4d 90 4c 00 00 00 00 00 00 00 00 00 00 00 00 00 00 00 00 00 00 01
E: 8.196879 25 31 02 e8 4e 68 4a 00 00 00 00 00 00 00 00 00 00 00 00 00 00 00 00 00 00 01
E: 8.213877 25 31 02 f0 4f 78 48 00 00 00 00 00 00 00 00 00 00 00 00 00 00 00 00 00 00 01
E: 8.230879 25 31 02 20 51 90 46 00 00 00 00 00 00 00 00 00 00 00 00 00 00 00 00 00 00 01
E: 8.248964 25 31 02 98 52 a8 44 00 00 00 00 00 00 00 00 00 00 00 00 00 00 00 00 00 00 01
E: 8.266307 25 31 02 28 54 e0 42 00 00 00 00 00 00 00 00 00 00 00 00 00 00 00 00 00 00 01
E: 8.284297 25 31 02 d0 55 48 41 00 00 00 00 00 00 00 00 00 00 00 00 00 00 00 00 00 00 01
E: 8.300878 25 31 02 a8 57 c0 3f 00 00 00 00 00 00 00 00 00 00 00 00 00 00 00 00 00 00 01
E: 8.318371 25 31 02 88 59 50 3e 00 00 00 00 00 00 00 00 00 00 00 00 00 00 00 00 00 00 01
E: 8.336305 25 31 02 50 5b 18 3d 00 00 00 00 00 00 00 00 00 00 00 00 00 00 00 00 00 00 01
E: 8.352881 25 31 02 e0 5c 10 3c 00 00 00 00 00 00 00 00 00 00 00 00 00 00 00 00 00 00 01
E: 8.370882 25 31 02 30 5e 48 3b 00 00 00 00 00 00 00 00 00 00 00 00 00 00 00 00 00 00 01
E: 8.388317 25 31 02 28 5f d8 3a 00 00 00 00 00 00 00 00 00 00 00 00 00 00 00 00 00 00 01
E: 8.404935 25 31 02 f0 5f a8 3a 00 00 00 00 00 00 00 00 00 00 00 00 00 00 00 00 00 00 01
E: 8.422893 25 31 02 80 60 88 3a 00 00 00 00 00 00 00 00 00 00 00 00 00 00 00 00 00 00 01
E: 8.439932 25 31 02 f0 60 60 3a 00 00 00 00 00 00 00 00 00 00 00 00 00 00 00 00 00 00 01
E: 8.457878 25 31 02 98 61 60 3a 00 00 00 00 00 00 00 00 00 00 00 00 00 00 00 00 00 00 01
E: 8.468920 25 30 02 38 62 88 3a 00 00 00 00 00 00 00 00 00 00 00 00 00 00 00 00 00 00 01
# 3. Finally, move your ten fingers on the screen and release them.
E: 11.833016 25 31 01 80 2c 60 48 00 00 00 00 00 00 00 00 00 00 00 00 00 00 00 00 00 00 01
E: 11.848262 25 31 01 80 2c 60 48 00 00 00 00 00 00 00 00 00 00 00 00 00 00 00 00 00 00 01
E: 11.866456 25 31 01 80 2c 30 48 00 00 00 00 00 00 00 00 00 00 00 00 00 00 00 00 00 00 01
E: 11.885916 25 31 01 78 2c 10 48 00 00 00 00 00 00 00 00 00 00 00 00 00 00 00 00 00 00 01
E: 11.902909 25 31 01 78 2c e8 47 00 00 00 00 00 00 00 00 00 00 00 00 00 00 00 00 00 00 01
E: 11.919910 25 31 01 68 2c a8 47 00 00 00 00 00 00 00 00 00 00 00 00 00 00 00 00 00 00 01
E: 11.937919 25 31 01 58 2c 50 47 00 00 00 00 00 00 00 00 00 00 00 00 00 00 00 00 00 00 01
E: 11.954959 25 31 01 38 2c d8 46 00 00 00 00 00 00 00 00 00 00 00 00 00 00 00 00 00 00 01
E: 11.971487 25 31 01 28 2c 60 46 00 00 00 00 00 00 00 00 00 00 00 00 00 00 00 00 00 00 01
E: 11.989964 25 31 01 20 2c e8 45 00 00 00 00 00 00 00 00 00 00 00 00 00 00 00 00 00 00 01
E: 12.007418 25 31 01 18 2c 70 45 00 00 00 00 00 00 00 00 00 00 00 00 00 00 00 00 00 00 01
E: 12.025334 25 31 01 18 2c f8 44 00 00 00 00 00 00 00 00 00 00 00 00 00 00 00 00 00 00 01
E: 12.041919 25 31 01 18 2c 90 44 00 00 00 00 00 00 00 00 00 00 00 00 00 00 00 00 00 00 01
E: 12.059912 25 31 01 10 2c 30 44 00 00 00 00 00 00 00 00 00 00 00 00 00 00 00 00 00 00 01
E: 12.077499 25 31 01 10 2c c8 43 00 00 00 00 00 00 00 00 00 00 00 00 00 00 00 00 00 00 01
E: 12.094462 25 31 01 10 2c 58 43 00 00 00 00 00 00 00 00 00 00 00 00 00 00 00 00 00 00 01
E: 12.112382 25 31 01 10 2c e0 42 00 00 00 00 00 00 00 00 00 00 00 00 00 00 00 00 00 00 01
E: 12.129007 25 31 01 10 2c 70 42 00 00 00 00 00 00 00 00 00 00 00 00 00 00 00 00 00 00 01
E: 12.146918 25 31 01 18 2c 10 42 00 00 00 00 00 00 00 00 00 00 00 00 00 00 00 00 00 00 01
E: 12.163947 25 31 01 20 2c b0 41 00 00 00 00 00 00 00 00 00 00 00 00 00 00 00 00 00 00 01
E: 12.180482 25 31 01 40 2c 80 41 00 00 00 00 00 00 00 00 00 00 00 00 00 00 00 00 00 00 01
E: 12.197434 25 31 01 58 2c 38 41 00 00 00 00 00 00 00 00 00 00 00 00 00 00 00 00 00 00 01
E: 12.214396 25 31 01 60 2c f0 40 00 00 00 00 00 00 00 00 00 00 00 00 00 00 00 00 00 00 01
E: 12.232391 25 31 01 60 2c a0 40 00 00 00 00 00 00 00 00 00 00 00 00 00 00 00 00 00 00 01
E: 12.249397 25 31 01 60 2c 38 40 00 00 00 00 00 00 00 00 00 00 00 00 00 00 00 00 00 00 01
E: 12.266393 25 31 01 60 2c d0 3f 00 00 00 00 00 00 00 00 00 00 00 00 00 00 00 00 00 00 01
E: 12.284393 25 31 01 60 2c 80 3f 00 00 00 00 00 00 00 00 00 00 00 00 00 00 00 00 00 00 01
E: 12.301443 25 31 01 60 2c 30 3f 00 00 00 00 00 00 00 00 00 00 00 00 00 00 00 00 00 00 01
E: 12.321354 25 31 01 60 2c e8 3e 00 00 00 00 00 00 00 00 00 00 00 00 00 00 00 00 00 00 01
E: 12.337958 25 31 01 68 2c 90 3e 00 00 00 00 00 00 00 00 00 00 00 00 00 00 00 00 00 00 01
E: 12.356939 25 31 01 68 2c 38 3e 00 00 00 00 00 00 00 00 00 00 00 00 00 00 00 00 00 00 01
E: 12.373940 25 31 01 50 2c f8 3d 00 00 00 00 00 00 00 00 00 00 00 00 00 00 00 00 00 00 01
E: 12.391909 25 31 01 48 2c c0 3d 00 00 00 00 00 00 00 00 00 00 00 00 00 00 00 00 00 00 01
E: 12.408919 25 31 01 38 2c 90 3d 31 02 00 1d 68 2a 00 00 00 00 00 00 00 00 00 00 00 00 02
E: 12.426364 25 31 01 20 2c 70 3d 31 02 00 1d 68 2a 00 00 00 00 00 00 00 00 00 00 00 00 02
E: 12.444110 25 31 01 08 2c 68 3d 31 02 f0 1c 68 2a 00 00 00 00 00 00 00 00 00 00 00 00 02
E: 12.460924 25 31 01 08 2c 68 3d 31 02 e8 1c 68 2a 00 00 00 00 00 00 00 00 00 00 00 00 02
E: 12.478917 25 31 01 e8 2b 78 3d 31 02 d0 1c 98 2a 00 00 00 00 00 00 00 00 00 00 00 00 02
E: 12.495915 25 31 01 c0 2b 78 3d 31 02 b8 1c d0 2a 00 00 00 00 00 00 00 00 00 00 00 00 02
E: 12.512919 25 31 01 80 2b 90 3d 31 02 90 1c 30 2b 00 00 00 00 00 00 00 00 00 00 00 00 02
E: 12.530916 25 31 01 40 2b b0 3d 31 02 50 1c 98 2b 00 00 00 00 00 00 00 00 00 00 00 00 02
E: 12.547921 25 31 01 f8 2a e8 3d 31 02 18 1c 08 2c 00 00 00 00 00 00 00 00 00 00 00 00 02
E: 12.565956 25 31 01 a0 2a 20 3e 31 02 d0 1b 88 2c 00 00 00 00 00 00 00 00 00 00 00 00 02
E: 12.582919 25 31 01 48 2a 60 3e 31 02 78 1b 20 2d 00 00 00 00 00 00 00 00 00 00 00 00 02
E: 12.599926 25 31 01 f0 29 b0 3e 31 02 20 1b e8 2d 00 00 00 00 00 00 00 00 00 00 00 00 02
E: 12.617915 25 31 01 80 29 20 3f 31 02 c8 1a a8 2e 00 00 00 00 00 00 00 00 00 00 00 00 02
E: 12.634919 25 31 01 30 29 98 3f 31 02 78 1a 50 2f 00 00 00 00 00 00 00 00 00 00 00 00 02
E: 12.650106 25 31 01 c0 28 28 40 31 02 10 1a 10 30 00 00 00 00 00 00 00 00 00 00 00 00 02
E: 12.668475 25 31 01 58 28 c0 40 31 02 b8 19 d8 30 00 00 00 00 00 00 00 00 00 00 00 00 02
E: 12.686929 25 31 01 e0 27 68 41 31 02 60 19 c8 31 00 00 00 00 00 00 00 00 00 00 00 00 02
E: 12.704951 25 31 01 80 27 10 42 31 02 08 19 c0 32 00 00 00 00 00 00 00 00 00 00 00 00 02
E: 12.720469 25 31 01 28 27 c0 42 31 02 a8 18 c0 33 00 00 00 00 00 00 00 00 00 00 00 00 02
E: 12.741350 25 31 01 d0 26 80 43 31 02 58 18 c8 34 00 00 00 00 00 00 00 00 00 00 00 00 02
E: 12.758333 25 31 01 a0 26 30 44 31 02 18 18 e8 35 00 00 00 00 00 00 00 00 00 00 00 00 02
E: 12.775922 25 31 01 50 26 f0 44 31 02 d0 17 10 37 00 00 00 00 00 00 00 00 00 00 00 00 02
E: 12.791497 25 31 01 10 26 a8 45 31 02 78 17 f8 37 00 00 00 00 00 00 00 00 00 00 00 00 02
E: 12.811435 25 31 01 c0 25 68 46 31 02 58 17 30 39 00 00 00 00 00 00 00 00 00 00 00 00 02
E: 12.828359 25 31 01 a0 25 10 47 31 02 30 17 00 3a 00 00 00 00 00 00 00 00 00 00 00 00 02
E: 12.845359 25 31 01 80 25 b0 47 31 02 f0 16 d0 3a 00 00 00 00 00 00 00 00 00 00 00 00 02
E: 12.861500 25 31 01 58 25 58 48 31 02 b8 16 98 3b 00 00 00 00 00 00 00 00 00 00 00 00 02
E: 12.885343 25 31 01 30 25 d0 48 31 02 88 16 58 3c 00 00 00 00 00 00 00 00 00 00 00 00 02
E: 12.902350 25 31 01 08 25 78 49 31 02 68 16 18 3d 00 00 00 00 00 00 00 00 00 00 00 00 02
E: 12.917924 25 31 01 08 25 08 4a 31 02 60 16 d0 3d 00 00 00 00 00 00 00 00 00 00 00 00 02
E: 12.935394 25 31 01 08 25 78 4a 31 02 58 16 30 3e 31 03 78 08 90 40 00 00 00 00 00 00 03
E: 12.952335 25 31 01 00 25 e8 4a 31 02 58 16 c0 3e 31 03 78 08 90 40 00 00 00 00 00 00 03
E: 12.969935 25 31 01 00 25 38 4b 31 02 58 16 28 3f 31 03 70 08 18 41 00 00 00 00 00 00 03
E: 12.986929 25 31 01 e8 24 90 4b 31 02 58 16 b0 3f 31 03 60 08 c0 41 00 00 00 00 00 00 03
E: 13.005009 25 31 01 e8 24 e0 4b 31 02 58 16 30 40 31 03 60 08 48 42 00 00 00 00 00 00 03
E: 13.021944 25 31 01 e8 24 40 4c 31 02 60 16 b8 40 31 03 78 08 a0 42 00 00 00 00 00 00 03
E: 13.039639 25 31 01 e8 24 a0 4c 31 02 78 16 38 41 31 03 90 08 78 43 00 00 00 00 00 00 03
E: 13.057356 25 31 01 e8 24 10 4d 31 02 90 16 c0 41 31 03 a8 08 18 44 00 00 00 00 00 00 03
E: 13.074372 25 31 01 f8 24 70 4d 31 02 a0 16 60 42 31 03 c8 08 e0 44 00 00 00 00 00 00 03
E: 13.091928 25 31 01 08 25 00 4e 31 02 c0 16 20 43 31 03 f8 08 b8 45 00 00 00 00 00 00 03
E: 13.108932 25 31 01 20 25 88 4e 31 02 f0 16 e0 43 31 03 38 09 a8 46 00 00 00 00 00 00 03
E: 13.125990 25 31 01 38 25 18 4f 31 02 30 17 88 44 31 03 80 09 a0 47 00 00 00 00 00 00 03
E: 13.144506 25 31 01 50 25 c8 4f 31 02 80 17 68 45 31 03 d8 09 90 48 00 00 00 00 00 00 03
E: 13.162369 25 31 01 70 25 90 50 31 02 f0 17 40 46 31 03 30 0a 88 49 00 00 00 00 00 00 03
E: 13.178935 25 31 01 88 25 58 51 31 02 48 18 00 47 31 03 80 0a 80 4a 00 00 00 00 00 00 03
E: 13.195931 25 31 01 a8 25 f0 51 31 02 a0 18 c8 47 31 03 d0 0a 40 4b 00 00 00 00 00 00 03
E: 13.212485 25 31 01 c0 25 98 52 31 02 e0 18 78 48 31 03 18 0b e8 4b 00 00 00 00 00 00 03
E: 13.229407 25 31 01 f0 25 20 53 31 02 20 19 20 49 31 03 68 0b 90 4c 00 00 00 00 00 00 03
E: 13.247407 25 31 01 00 26 c0 53 31 02 60 19 b8 49 31 03 a0 0b 20 4d 00 00 00 00 00 00 03
E: 13.265990 25 31 01 18 26 38 54 31 02 b0 19 40 4a 31 03 d8 0b 90 4d 00 00 00 00 00 00 03
E: 13.282493 25 31 01 38 26 98 54 31 02 00 1a e0 4a 31 03 00 0c e0 4d 00 00 00 00 00 00 03
E: 13.301332 25 31 01 50 26 e8 54 31 02 38 1a 40 4b 31 03 20 0c 30 4e 00 00 00 00 00 00 03
E: 13.317934 25 31 01 58 26 28 55 31 02 70 1a 88 4b 31 03 38 0c 58 4e 00 00 00 00 00 00 03
E: 13.335943 25 31 01 68 26 60 55 31 02 a0 1a d8 4b 31 03 50 0c 98 4e 00 00 00 00 00 00 03
E: 13.353099 25 31 01 88 26 a8 55 31 02 d8 1a 28 4c 31 03 80 0c f0 4e 00 00 00 00 00 00 03
E: 13.369944 25 31 01 b0 26 00 56 31 02 18 1b 98 4c 31 03 c0 0c 40 4f 00 00 00 00 00 00 03
E: 13.387936 25 31 01 e0 26 48 56 31 02 78 1b 00 4d 31 03 10 0d 90 4f 00 00 00 00 00 00 03
E: 13.403506 25 31 01 28 27 b8 56 31 02 e0 1b 68 4d 31 03 60 0d f8 4f 00 00 00 00 00 00 03
E: 13.421493 25 31 01 70 27 30 57 31 02 38 1c d8 4d 31 03 b0 0d 48 50 00 00 00 00 00 00 03
E: 13.439957 25 31 01 b0 27 98 57 31 02 98 1c 28 4e 31 03 00 0e 80 50 00 00 00 00 00 00 03
E: 13.457549 25 31 01 00 28 f0 57 31 02 f8 1c 78 4e 31 03 50 0e d8 50 00 00 00 00 00 00 03
E: 13.475348 25 31 01 50 28 48 58 31 02 48 1d d0 4e 31 03 b0 0e 30 51 00 00 00 00 00 00 03
E: 13.489190 25 31 01 90 28 a8 58 31 02 98 1d 38 4f 31 03 00 0f 78 51 00 00 00 00 00 00 03
E: 13.507201 25 31 01 e0 28 08 59 31 02 f8 1d a0 4f 31 03 58 0f b8 51 00 00 00 00 00 00 03
E: 13.527865 25 31 01 20 29 50 59 31 02 48 1e f0 4f 31 03 a8 0f 08 52 00 00 00 00 00 00 03
E: 13.547338 25 31 01 60 29 a0 59 31 02 98 1e 40 50 31 03 f0 0f 60 52 00 00 00 00 00 00 03
E: 13.561025 25 31 01 60 29 f8 59 31 02 e8 1e a0 50 31 03 38 10 98 52 00 00 00 00 00 00 03
E: 13.580963 25 31 01 f0 28 38 5b 31 02 50 1f d0 50 31 03 70 10 d0 52 00 00 00 00 00 00 03
E: 13.597022 25 31 01 d0 26 20 5d 31 02 58 1f 10 51 31 03 b8 10 10 53 00 00 00 00 00 00 03
E: 13.616381 25 31 01 78 26 98 5d 31 02 70 1f 58 51 31 03 f0 10 40 53 00 00 00 00 00 00 03
E: 13.630522 25 31 01 78 26 98 5d 31 02 a0 1f 90 51 31 03 28 11 78 53 00 00 00 00 00 00 03
E: 13.649381 25 31 01 c0 28 90 5c 31 02 f8 1f b8 51 31 03 60 11 98 53 00 00 00 00 00 00 03
E: 13.666391 25 31 01 58 29 90 5c 31 02 30 20 d8 51 31 03 90 11 e8 53 00 00 00 00 00 00 03
E: 13.681447 25 31 01 98 29 98 5c 31 02 60 20 18 52 31 03 b0 11 00 54 00 00 00 00 00 00 03
E: 13.699415 25 31 01 c8 29 c0 5c 31 02 80 20 40 52 31 03 e0 11 18 54 00 00 00 00 00 00 03
E: 13.716409 25 31 01 e0 29 f0 5c 31 02 98 20 80 52 31 03 00 12 50 54 00 00 00 00 00 00 03
E: 13.734409 25 31 01 00 2a 10 5d 31 02 c0 20 98 52 31 03 10 12 58 54 00 00 00 00 00 00 03
E: 13.759380 25 31 01 20 2a 38 5d 31 02 d8 20 c8 52 31 03 28 12 70 54 00 00 00 00 00 00 03
E: 13.781942 25 31 01 28 2a 58 5d 31 02 e8 20 e8 52 31 03 30 12 88 54 00 00 00 00 00 00 03
E: 13.804946 25 31 01 40 2a 70 5d 31 02 e8 20 08 53 31 03 30 12 90 54 00 00 00 00 00 00 03
E: 13.827412 25 31 01 40 2a 88 5d 31 02 f0 20 18 53 31 03 30 12 90 54 31 04 70 50 c0 4a 04
E: 13.849489 25 31 01 48 2a a0 5d 31 02 f0 20 18 53 31 03 30 12 90 54 31 04 70 50 c0 4a 04
E: 13.869114 25 31 01 48 2a a8 5d 31 02 f0 20 20 53 31 03 30 12 90 54 31 04 a8 4f 10 4a 04
E: 13.890069 25 31 01 58 2a b8 5d 31 02 f0 20 20 53 31 03 30 12 90 54 31 04 a0 4e 08 49 04
E: 13.912050 25 31 01 58 2a b8 5d 31 02 f0 20 20 53 31 03 30 12 90 54 31 04 d8 4d 30 48 04
E: 13.932046 25 31 01 50 2a b0 5d 31 02 f0 20 20 53 31 03 30 12 90 54 31 04 f0 4c f0 46 04
E: 13.954048 25 31 01 50 2a b0 5d 31 02 f0 20 20 53 31 03 30 12 90 54 31 04 40 4c f8 45 04
E: 13.975089 25 31 01 50 2a a8 5d 31 02 f0 20 20 53 31 03 30 12 90 54 31 04 68 4b b8 44 04
E: 13.995052 25 31 01 50 2a a8 5d 31 02 f0 20 20 53 31 03 30 12 90 54 31 04 d0 4a c8 43 04
E: 14.015048 25 31 01 68 2a a8 5d 31 02 f0 20 20 53 31 03 30 12 90 54 31 04 08 4a 80 42 04
E: 14.034204 25 31 01 70 2a 88 5d 31 02 00 21 30 53 31 03 30 12 80 54 31 04 88 49 78 41 04
E: 14.053040 25 31 01 70 2a 68 5d 31 02 08 21 38 53 31 03 40 12 80 54 31 04 00 49 48 40 04
E: 14.073538 25 31 01 70 2a 68 5d 31 02 28 21 40 53 31 03 60 12 a0 54 31 04 88 48 28 3f 04
E: 14.090154 25 31 01 00 2a 28 5d 31 02 50 21 78 53 31 03 78 12 d0 54 31 04 20 48 00 3e 04
E: 14.114432 25 31 01 00 2a 28 5d 31 02 c0 21 e8 53 31 03 c8 12 18 55 31 04 90 47 d8 3c 04
E: 14.137434 25 31 01 a0 2a 10 5e 31 02 38 22 48 54 31 03 18 13 50 55 31 04 38 47 d0 3b 04
E: 14.159371 25 31 01 38 2b b0 5e 31 02 c0 22 b8 54 31 03 88 13 98 55 31 04 a0 46 80 3a 04
E: 14.179053 25 31 01 b8 2b 00 5f 31 02 18 23 18 55 31 03 e0 13 d8 55 31 04 10 46 40 39 04
E: 14.198431 25 31 01 48 2c 48 5f 31 02 88 24 50 56 31 03 38 14 00 56 31 04 50 45 d8 37 04
E: 14.215394 25 31 01 a0 2c 78 5f 31 02 a0 24 50 56 31 03 88 14 10 56 31 04 c8 44 d0 36 04
E: 14.230498 25 31 01 08 2d 98 5f 31 02 a0 24 e8 55 31 03 d8 14 28 56 31 04 b8 43 40 35 04
E: 14.248955 25 31 01 60 2d b0 5f 31 02 f0 24 d0 55 31 03 38 15 28 56 31 04 78 43 90 34 04
E: 14.266496 25 31 01 b8 2d b0 5f 31 02 40 25 c8 55 31 03 98 15 08 56 31 04 78 43 18 34 04
E: 14.282956 25 31 01 08 2e a0 5f 31 02 b0 25 b8 55 31 03 10 16 d8 55 31 04 98 43 f0 33 04
E: 14.302343 25 31 01 58 2e 88 5f 31 02 20 26 a0 55 31 03 80 16 58 55 31 04 98 43 88 33 04
E: 14.321308 25 31 01 c8 2e 68 5f 31 02 90 26 78 55 31 03 f8 16 18 55 31 04 a0 42 f0 31 04
E: 14.339193 25 31 01 48 2f 40 5f 31 02 18 27 48 55 31 03 80 17 08 55 31 04 20 42 f8 30 04
E: 14.363934 25 31 01 c8 2f 08 5f 31 02 c8 27 20 55 31 03 00 18 b0 54 31 04 e0 41 48 30 04
E: 14.388069 25 31 01 90 30 c8 5e 31 02 c0 28 d0 54 31 03 c8 18 78 54 31 04 a8 41 88 2f 04
E: 14.419954 25 31 01 58 31 80 5e 31 02 78 29 90 54 31 03 80 19 60 54 31 04 78 40 c8 2d 04
E: 14.448978 25 31 01 20 32 28 5e 31 02 78 2a 40 54 31 03 98 1a 30 54 31 04 a0 3f 68 2c 04
E: 14.475957 25 31 01 48 33 b0 5d 31 02 90 2b c0 53 31 03 f8 1b c8 53 31 04 98 3d d8 29 04
E: 14.500431 25 31 01 10 34 50 5d 31 02 80 2c 30 53 31 03 e0 1c 50 53 31 04 80 3c 48 28 05
E: 14.503933 25 31 05 08 4d 28 1b 00 00 00 00 00 00 00 00 00 00 00 00 00 00 00 00 00 00 00
E: 14.529301 25 31 01 d8 34 e0 5c 31 02 58 2d b8 52 31 03 a8 1d c8 52 31 04 c8 3b 08 27 05
E: 14.533025 25 31 05 08 4d 28 1b 00 00 00 00 00 00 00 00 00 00 00 00 00 00 00 00 00 00 00
E: 14.555879 25 31 01 80 35 70 5c 31 02 08 2e 40 52 31 03 78 1e 50 52 31 04 78 3b 40 26 05
E: 14.559963 25 31 05 90 4c 78 1a 00 00 00 00 00 00 00 00 00 00 00 00 00 00 00 00 00 00 00
E: 14.582865 25 31 01 30 36 f0 5b 31 02 c8 2e c0 51 31 03 40 1f b0 51 31 04 58 3b c0 25 05
E: 14.586976 25 31 05 00 4c b0 19 00 00 00 00 00 00 00 00 00 00 00 00 00 00 00 00 00 00 00
E: 14.610866 25 31 01 e0 36 70 5b 31 02 80 2f 30 51 31 03 08 20 00 51 31 04 58 3b 60 25 05
E: 14.614965 25 31 05 80 4b e8 18 00 00 00 00 00 00 00 00 00 00 00 00 00 00 00 00 00 00 00
E: 14.637399 25 31 01 88 37 d8 5a 31 02 50 30 78 50 31 03 a0 20 48 50 31 04 00 3b 98 24 05
E: 14.641406 25 31 05 e0 4a f0 17 00 00 00 00 00 00 00 00 00 00 00 00 00 00 00 00 00 00 00
E: 14.666862 25 31 01 50 38 28 5a 31 02 18 31 c8 4f 31 03 40 21 60 4f 31 04 a8 3a d0 23 05
E: 14.671065 25 31 05 88 4a 38 17 00 00 00 00 00 00 00 00 00 00 00 00 00 00 00 00 00 00 00
E: 14.691212 25 31 01 f8 38 98 59 31 02 c0 31 30 4f 31 03 e0 21 c8 4e 31 04 50 3a 38 23 05
E: 14.698349 25 31 05 58 4a c0 16 00 00 00 00 00 00 00 00 00 00 00 00 00 00 00 00 00 00 00
E: 14.720906 25 31 01 88 39 08 59 31 02 60 32 98 4e 31 03 80 22 18 4e 31 04 10 3a c0 22 05
E: 14.724738 25 31 05 18 4a 68 16 00 00 00 00 00 00 00 00 00 00 00 00 00 00 00 00 00 00 00
E: 14.747867 25 31 01 10 3a 60 58 31 02 e8 32 00 4e 31 03 00 23 68 4d 31 04 e8 39 78 22 05
E: 14.751981 25 31 05 e8 49 28 16 00 00 00 00 00 00 00 00 00 00 00 00 00 00 00 00 00 00 00
E: 14.773213 25 31 01 a8 3a c0 57 31 02 70 33 50 4d 31 03 70 23 d8 4c 31 04 d8 39 50 22 05
E: 14.780362 25 31 05 b8 49 f8 15 00 00 00 00 00 00 00 00 00 00 00 00 00 00 00 00 00 00 00
E: 14.803885 25 31 01 28 3b 10 57 31 02 f8 33 a0 4c 31 03 f0 23 48 4c 31 04 d8 39 50 22 05
E: 14.807982 25 31 05 a8 49 e8 15 00 00 00 00 00 00 00 00 00 00 00 00 00 00 00 00 00 00 00
E: 14.831869 25 31 01 b0 3b 58 56 31 02 88 34 f8 4b 31 03 98 24 88 4b 31 04 e8 39 58 22 05
E: 14.835975 25 31 05 a8 49 e8 15 00 00 00 00 00 00 00 00 00 00 00 00 00 00 00 00 00 00 00
E: 14.859908 25 31 01 58 3c 70 55 31 02 20 35 40 4b 31 03 f8 24 f8 4a 31 04 00 3a 70 22 05
E: 14.864323 25 31 05 a8 49 e8 15 00 00 00 00 00 00 00 00 00 00 00 00 00 00 00 00 00 00 00
E: 14.885868 25 31 01 a8 3c a8 54 31 02 70 35 80 4a 31 03 38 25 50 4a 31 04 70 3a 90 22 05
E: 14.889968 25 31 05 b0 49 e0 15 00 00 00 00 00 00 00 00 00 00 00 00 00 00 00 00 00 00 00
E: 14.912868 25 31 01 f0 3c c8 53 31 02 c0 35 c8 49 31 03 60 25 e0 49 31 04 20 3b a8 22 05
E: 14.916977 25 31 05 f0 49 e0 15 00 00 00 00 00 00 00 00 00 00 00 00 00 00 00 00 00 00 00
E: 14.939144 25 31 01 28 3d 00 53 31 02 e0 35 18 49 31 03 98 25 58 49 31 04 18 3c c0 22 05
E: 14.943296 25 31 05 c8 4a e8 15 00 00 00 00 00 00 00 00 00 00 00 00 00 00 00 00 00 00 00
E: 14.964902 25 31 01 28 3d 50 52 31 02 e0 35 68 48 31 03 b0 25 c0 48 31 04 38 3d c0 22 05
E: 14.969566 25 31 05 10 4c 20 16 00 00 00 00 00 00 00 00 00 00 00 00 00 00 00 00 00 00 00
E: 14.993866 25 31 01 10 3d 88 51 31 02 c0 35 b0 47 31 03 b0 25 10 48 31 04 18 3e 70 22 05
E: 14.997974 25 31 05 78 4d 78 16 00 00 00 00 00 00 00 00 00 00 00 00 00 00 00 00 00 00 00
E: 15.026866 25 31 01 f8 3c 68 50 31 02 b8 35 20 47 31 03 70 25 88 47 31 04 f8 3e 58 22 05
E: 15.030968 25 31 05 08 4f e8 16 00 00 00 00 00 00 00 00 00 00 00 00 00 00 00 00 00 00 00
E: 15.059915 25 31 01 80 3c 58 4f 31 02 30 35 18 46 31 03 f8 24 d0 46 31 04 70 40 58 22 05
E: 15.064012 25 31 05 c0 50 78 17 00 00 00 00 00 00 00 00 00 00 00 00 00 00 00 00 00 00 00
E: 15.091317 25 31 01 20 3c 68 4e 31 02 78 34 20 45 31 03 48 24 e8 45 31 04 30 43 b8 23 05
E: 15.095365 25 31 05 a0 52 58 18 00 00 00 00 00 00 00 00 00 00 00 00 00 00 00 00 00 00 00
E: 15.116525 25 31 01 68 3b 70 4d 31 02 c8 33 40 44 31 03 90 23 28 45 31 04 c8 44 58 24 05
E: 15.120358 25 31 05 e0 53 10 19 00 00 00 00 00 00 00 00 00 00 00 00 00 00 00 00 00 00 00
E: 15.143918 25 31 01 90 3a 68 4c 31 02 08 33 60 43 31 03 90 22 30 44 31 04 90 46 90 25 05
E: 15.147977 25 31 05 30 55 08 1a 00 00 00 00 00 00 00 00 00 00 00 00 00 00 00 00 00 00 00
E: 15.166902 25 31 01 e0 39 80 4b 31 02 90 32 c0 42 31 03 e0 21 88 43 31 04 58 47 20 26 05
E: 15.171022 25 31 05 10 56 d0 1a 00 00 00 00 00 00 00 00 00 00 00 00 00 00 00 00 00 00 00
E: 15.194344 25 31 01 50 39 d0 4a 31 02 f8 31 00 42 31 03 28 21 f8 42 31 04 80 48 48 27 05
E: 15.198366 25 31 05 00 57 d8 1b 00 00 00 00 00 00 00 00 00 00 00 00 00 00 00 00 00 00 00
E: 15.223320 25 31 01 c0 38 08 4a 31 02 48 31 48 41 31 03 68 20 48 42 31 04 28 49 f8 27 05
E: 15.227366 25 31 05 a8 57 d0 1c 00 00 00 00 00 00 00 00 00 00 00 00 00 00 00 00 00 00 00
E: 15.253872 25 31 01 e8 37 20 49 31 02 b8 30 d0 40 31 03 a0 1f d8 41 31 04 40 49 58 28 05
E: 15.257985 25 31 05 e0 57 60 1d 00 00 00 00 00 00 00 00 00 00 00 00 00 00 00 00 00 00 00
E: 15.285352 25 31 01 38 37 58 48 31 02 d0 2f e8 3f 31 03 d0 1e 58 41 31 04 40 4a e8 29 06
E: 15.289387 25 31 05 f8 57 48 1e 31 06 30 65 e0 24 00 00 00 00 00 00 00 00 00 00 00 00 00
E: 15.314949 25 31 01 c0 35 a0 46 31 02 c8 2e 00 3f 31 03 b0 1d 60 40 31 04 38 4b e0 2b 06
E: 15.318989 25 31 05 80 58 30 20 31 06 30 65 e0 24 00 00 00 00 00 00 00 00 00 00 00 00 00
E: 15.353341 25 31 01 98 35 48 46 31 02 d8 2d 20 3e 31 03 b0 1c 78 3f 31 04 68 4b 30 2d 06
E: 15.356997 25 31 05 b8 58 40 21 31 06 48 65 40 26 00 00 00 00 00 00 00 00 00 00 00 00 00
E: 15.389887 25 31 01 78 35 10 46 31 02 d8 2c 20 3d 31 03 a8 1b 70 3e 31 04 68 4b a0 2e 06
E: 15.393987 25 31 05 80 58 08 23 31 06 50 65 d0 27 00 00 00 00 00 00 00 00 00 00 00 00 00
E: 15.432872 25 31 01 78 35 10 46 31 02 d0 2b 38 3c 31 03 a8 1a a8 3d 31 04 80 4b b0 30 06
E: 15.437394 25 31 05 80 58 00 25 31 06 50 65 f0 29 00 00 00 00 00 00 00 00 00 00 00 00 00
E: 15.479911 25 31 01 30 37 90 47 31 02 c8 2a 50 3b 31 03 a8 19 e8 3c 31 04 80 4b 08 33 06
E: 15.483982 25 31 05 f8 57 90 26 31 06 10 65 f8 2b 00 00 00 00 00 00 00 00 00 00 00 00 00
E: 15.527365 25 31 01 50 38 98 48 31 02 a0 29 50 3a 31 03 88 18 f0 3b 31 04 10 4b f8 35 06
E: 15.531485 25 31 05 80 57 b0 29 31 06 80 64 b0 2e 00 00 00 00 00 00 00 00 00 00 00 00 00
E: 15.566878 25 31 01 88 39 98 49 31 02 a8 28 60 39 31 03 b0 17 28 3b 31 04 e8 49 b8 39 06
E: 15.570978 25 31 05 00 56 b8 2d 31 06 60 63 f0 31 00 00 00 00 00 00 00 00 00 00 00 00 00
E: 15.607884 25 31 01 f0 3a d8 4a 31 02 e0 27 60 38 31 03 18 17 98 3a 31 04 98 48 10 3e 06
E: 15.611977 25 31 05 d8 54 18 32 31 06 40 62 60 35 00 00 00 00 00 00 00 00 00 00 00 00 00
E: 15.648924 25 31 01 28 3d 90 4c 31 02 50 27 60 37 31 03 a0 16 00 3a 31 04 d0 47 a0 42 06
E: 15.652963 25 31 05 b8 53 60 36 31 06 20 61 a0 38 00 00 00 00 00 00 00 00 00 00 00 00 00
E: 15.685313 25 31 01 38 40 d8 4e 31 02 b8 26 20 36 31 03 e0 15 f8 38 31 04 d0 47 78 47 06
E: 15.689478 25 31 05 d0 52 90 3a 31 06 48 60 98 3b 00 00 00 00 00 00 00 00 00 00 00 00 00
E: 15.715950 25 30 01 00 43 90 50 31 02 78 26 e0 33 31 03 60 15 48 38 31 04 f0 47 78 4c 06
E: 15.720006 25 31 05 d0 52 d0 3e 31 06 48 60 40 3f 00 00 00 00 00 00 00 00 00 00 00 00 00
E: 15.747900 25 31 02 78 26 10 32 31 03 08 15 60 37 31 04 b8 48 e8 4f 31 05 50 53 10 42 05
E: 15.751997 25 31 06 b0 60 60 42 00 00 00 00 00 00 00 00 00 00 00 00 00 00 00 00 00 00 00
E: 15.779315 25 31 02 10 26 80 31 31 03 e0 14 70 36 31 04 58 4a 50 52 31 05 a0 54 e8 44 05
E: 15.783378 25 31 06 d8 61 20 45 00 00 00 00 00 00 00 00 00 00 00 00 00 00 00 00 00 00 00
E: 15.809884 25 31 02 10 26 80 30 31 03 e0 14 98 35 31 04 90 4b f8 53 31 05 e8 55 08 47 05
E: 15.813975 25 31 06 28 63 78 47 00 00 00 00 00 00 00 00 00 00 00 00 00 00 00 00 00 00 00
E: 15.840927 25 31 02 40 26 08 2f 31 03 f8 14 90 34 31 04 e8 4c b8 55 31 05 28 57 38 49 05
E: 15.844974 25 31 06 78 64 c0 49 00 00 00 00 00 00 00 00 00 00 00 00 00 00 00 00 00 00 00
E: 15.875122 25 31 02 90 26 90 2d 31 03 38 15 38 33 31 04 d0 4d 18 57 31 05 10 58 38 4b 05
E: 15.878974 25 31 06 48 65 c8 4b 00 00 00 00 00 00 00 00 00 00 00 00 00 00 00 00 00 00 00
E: 15.905370 25 31 02 30 27 48 2c 31 03 c8 15 18 32 31 04 d0 4d 58 59 31 05 10 58 f0 4c 05
E: 15.909297 25 31 06 48 65 b0 4d 00 00 00 00 00 00 00 00 00 00 00 00 00 00 00 00 00 00 00
E: 15.938330 25 31 02 30 28 d8 2a 31 03 b0 16 28 31 31 04 38 4d 20 5b 31 05 08 58 a0 4e 05
E: 15.942373 25 31 06 40 65 90 4f 00 00 00 00 00 00 00 00 00 00 00 00 00 00 00 00 00 00 00
E: 15.966894 25 31 02 38 29 90 29 31 03 90 17 08 30 31 04 30 4c 78 5c 31 05 90 55 c0 51 05
E: 15.970993 25 31 06 50 64 40 51 00 00 00 00 00 00 00 00 00 00 00 00 00 00 00 00 00 00 00
E: 15.997873 25 31 02 a0 2a 48 28 31 03 b0 18 88 2e 31 04 68 4a 08 5e 30 05 88 54 70 52 05
E: 16.001978 25 31 06 d0 62 60 52 00 00 00 00 00 00 00 00 00 00 00 00 00 00 00 00 00 00 00
E: 16.022997 25 31 02 80 2b 08 28 31 03 c8 19 58 2d 31 04 80 48 50 5f 31 06 e8 60 70 53 04
E: 16.047967 25 31 02 50 2c 08 28 31 03 18 1b 80 2c 31 04 f0 45 f8 5f 31 06 c8 5e a0 53 04
E: 16.077089 25 31 02 e0 2d 18 27 31 03 58 1c c8 2b 31 04 e8 43 08 60 31 06 d0 5c a0 53 04
E: 16.105890 25 31 01 f8 38 b0 2d 31 02 08 2f a0 26 31 03 70 1d 28 2b 31 04 70 42 08 60 05
E: 16.110128 25 31 06 e8 5a 70 53 00 00 00 00 00 00 00 00 00 00 00 00 00 00 00 00 00 00 00
E: 16.139941 25 31 01 f8 38 b0 2d 31 02 28 30 48 26 31 03 50 1e 28 2b 31 04 d8 40 b0 5f 05
E: 16.143985 25 31 06 18 59 f0 52 00 00 00 00 00 00 00 00 00 00 00 00 00 00 00 00 00 00 00
E: 16.173901 25 31 01 28 3a b8 2d 31 02 68 31 48 26 31 03 00 1f d0 2a 31 04 08 3f 28 5f 05
E: 16.177955 25 31 06 88 57 10 52 00 00 00 00 00 00 00 00 00 00 00 00 00 00 00 00 00 00 00
E: 16.206887 25 31 01 60 3b 20 2e 31 02 c0 32 68 26 31 03 b8 20 68 29 31 04 d0 3c 60 5e 05
E: 16.210983 25 31 06 b8 55 e8 50 00 00 00 00 00 00 00 00 00 00 00 00 00 00 00 00 00 00 00
E: 16.239891 25 31 01 b0 3c d0 2e 31 02 38 34 d0 26 31 03 08 22 a8 28 31 04 10 3b e8 5d 05
E: 16.243975 25 31 06 c8 53 c8 4f 00 00 00 00 00 00 00 00 00 00 00 00 00 00 00 00 00 00 00
E: 16.272918 25 31 01 60 3d 10 30 31 02 30 35 d8 27 31 03 90 23 90 27 31 04 f0 38 78 5d 05
E: 16.277061 25 31 06 f8 50 70 4f 00 00 00 00 00 00 00 00 00 00 00 00 00 00 00 00 00 00 00
E: 16.305889 25 31 01 60 3d 30 31 31 02 30 35 b8 28 31 03 90 23 90 27 31 04 b0 36 78 5d 05
E: 16.309975 25 31 06 d0 4e 98 4e 00 00 00 00 00 00 00 00 00 00 00 00 00 00 00 00 00 00 00
E: 16.341512 25 31 01 80 3c 78 32 31 02 60 34 c8 29 31 03 78 23 a8 27 31 04 38 35 a8 5d 05
E: 16.345306 25 31 06 38 4d f0 4d 00 00 00 00 00 00 00 00 00 00 00 00 00 00 00 00 00 00 00
E: 16.375966 25 31 01 18 3a 10 35 31 02 48 32 f8 2b 31 03 30 22 c0 28 31 04 d0 34 80 5e 05
E: 16.380045 25 31 06 18 4d 10 4d 00 00 00 00 00 00 00 00 00 00 00 00 00 00 00 00 00 00 00
E: 16.403879 25 31 01 b8 38 90 36 31 02 b0 30 88 2d 31 03 28 20 60 2a 31 04 d0 34 f0 5f 05
E: 16.407989 25 31 06 88 4c 10 4d 00 00 00 00 00 00 00 00 00 00 00 00 00 00 00 00 00 00 00
E: 16.443322 25 31 01 28 37 98 38 31 02 f0 2e 70 2f 31 03 98 1d 18 2d 31 04 50 36 e8 61 05
E: 16.447383 25 31 06 a0 4a 10 4d 00 00 00 00 00 00 00 00 00 00 00 00 00 00 00 00 00 00 00
E: 16.470896 25 31 01 e0 35 98 3a 31 02 90 2d 58 31 31 03 c8 1b e0 2e 31 04 18 38 00 64 05
E: 16.474936 25 31 06 a0 4a 58 4e 00 00 00 00 00 00 00 00 00 00 00 00 00 00 00 00 00 00 00
E: 16.507228 25 31 01 50 33 50 3e 31 02 70 2b 90 34 31 03 58 1a 10 31 31 04 d0 39 90 65 05
E: 16.513983 25 31 06 b0 4c 20 4f 00 00 00 00 00 00 00 00 00 00 00 00 00 00 00 00 00 00 00
E: 16.544882 25 31 01 18 32 a0 40 31 02 48 2a e0 36 31 03 e8 18 a0 33 31 04 d8 3c 18 66 05
E: 16.548991 25 31 06 20 4f 70 4f 00 00 00 00 00 00 00 00 00 00 00 00 00 00 00 00 00 00 00
E: 16.578957 25 31 01 f8 2f 50 44 31 02 98 28 00 3a 31 03 68 17 70 36 31 04 f0 40 18 66 05
E: 16.582976 25 31 06 30 52 70 4f 00 00 00 00 00 00 00 00 00 00 00 00 00 00 00 00 00 00 00
E: 16.627883 25 31 01 28 2f f0 46 31 02 f0 27 38 3c 31 03 68 16 e0 38 31 04 30 43 30 65 05
E: 16.632714 25 31 06 88 55 78 4e 00 00 00 00 00 00 00 00 00 00 00 00 00 00 00 00 00 00 00
E: 16.672904 25 31 01 38 2e 80 49 31 02 28 27 c8 3e 31 03 a0 15 d8 3a 31 04 58 46 20 63 05
E: 16.677066 25 31 06 50 59 f8 4c 00 00 00 00 00 00 00 00 00 00 00 00 00 00 00 00 00 00 00
E: 16.715881 25 31 01 a0 2d 78 4c 31 02 b0 26 c0 41 31 03 f0 14 a0 3d 31 04 60 49 70 5f 05
E: 16.719980 25 31 06 60 5d b8 49 00 00 00 00 00 00 00 00 00 00 00 00 00 00 00 00 00 00 00
E: 16.756902 25 31 01 18 2d 58 4f 31 02 80 26 78 44 31 03 a0 14 48 40 31 04 90 4b 30 5b 05
E: 16.760978 25 31 06 28 60 58 46 00 00 00 00 00 00 00 00 00 00 00 00 00 00 00 00 00 00 00
E: 16.798900 25 31 01 18 2d 20 52 31 02 80 26 20 47 31 03 a0 14 d8 42 31 04 a0 4c c0 55 05
E: 16.802996 25 31 06 30 62 a8 42 00 00 00 00 00 00 00 00 00 00 00 00 00 00 00 00 00 00 00
E: 16.841880 25 31 01 28 2d 40 54 31 02 98 26 58 49 31 03 d0 14 00 45 31 04 48 4d 80 51 05
E: 16.845992 25 31 06 58 63 c0 3e 00 00 00 00 00 00 00 00 00 00 00 00 00 00 00 00 00 00 00
E: 16.877969 25 31 01 70 2d b0 56 31 02 08 27 d8 4b 31 03 30 15 70 47 31 04 a0 4d b0 4c 05
E: 16.881980 25 31 06 38 64 d0 3a 00 00 00 00 00 00 00 00 00 00 00 00 00 00 00 00 00 00 00
E: 16.916887 25 31 01 00 2e 28 59 31 02 a8 27 30 4e 31 03 c8 15 d0 49 31 04 a0 4d f8 47 05
E: 16.920997 25 31 06 10 65 00 37 00 00 00 00 00 00 00 00 00 00 00 00 00 00 00 00 00 00 00
E: 16.951882 25 31 01 78 2e d8 5a 31 02 30 28 f0 4f 31 03 40 16 a0 4b 31 04 90 4d 60 44 05
E: 16.956003 25 31 06 90 65 18 34 00 00 00 00 00 00 00 00 00 00 00 00 00 00 00 00 00 00 00
E: 16.989903 25 31 01 48 2f 78 5c 31 02 d8 28 a8 51 31 03 e8 16 88 4d 31 04 10 4d 38 40 05
E: 16.993982 25 31 06 e8 65 88 31 00 00 00 00 00 00 00 00 00 00 00 00 00 00 00 00 00 00 00
E: 17.017308 25 31 01 60 2f 90 5c 31 02 a0 29 e0 52 31 03 a0 17 f8 4e 31 04 e0 4c 70 3d 05
E: 17.021382 25 31 06 18 66 a0 2f 00 00 00 00 00 00 00 00 00 00 00 00 00 00 00 00 00 00 00
E: 17.048889 25 31 01 e8 2f 28 5d 31 02 10 2b d8 54 31 03 48 18 18 50 31 04 88 4b 88 39 06
E: 17.052995 25 31 05 10 57 c0 2b 31 06 18 66 b0 2e 00 00 00 00 00 00 00 00 00 00 00 00 00
E: 17.084949 25 31 01 28 31 60 5e 31 02 78 2b d8 54 31 03 e0 18 f0 50 31 04 38 4b b8 37 06
E: 17.089085 25 31 05 10 57 c0 2b 31 06 08 66 c8 2d 00 00 00 00 00 00 00 00 00 00 00 00 00
E: 17.120934 25 31 01 78 32 d0 5e 31 02 e0 2b e0 54 31 03 b8 19 f0 51 31 04 30 4b 68 36 06
E: 17.124947 25 31 05 d8 56 d0 2a 31 06 d8 65 60 2d 00 00 00 00 00 00 00 00 00 00 00 00 00
E: 17.152896 25 31 01 c8 33 d0 5e 31 02 c0 2c c8 54 31 03 c8 1a d0 52 31 04 f0 4a 10 35 06
E: 17.157000 25 31 05 88 56 80 29 31 06 b0 65 40 2d 00 00 00 00 00 00 00 00 00 00 00 00 00
E: 17.181890 25 31 01 08 35 90 5e 31 02 38 2d a0 54 31 03 d0 1b 68 53 31 04 60 4a 68 33 06
E: 17.186004 25 31 05 e8 55 f0 27 31 06 78 65 40 2d 00 00 00 00 00 00 00 00 00 00 00 00 00
E: 17.209886 25 31 01 50 36 60 5e 31 02 d0 2d 38 54 31 03 f0 1c d8 53 31 04 e0 49 08 32 06
E: 17.214035 25 31 05 b8 55 68 27 31 06 20 65 68 2d 00 00 00 00 00 00 00 00 00 00 00 00 00
E: 17.243969 25 31 01 48 37 38 5e 31 02 78 2e 38 54 31 03 d8 1d 60 54 31 04 a0 49 00 31 06
E: 17.248135 25 31 05 b8 55 68 27 31 06 d8 64 d8 2d 00 00 00 00 00 00 00 00 00 00 00 00 00
E: 17.273901 25 31 01 30 38 00 5e 31 02 b8 2f 28 54 31 03 c8 1e 00 55 31 04 e0 47 a0 2e 06
E: 17.277995 25 31 05 58 56 38 28 31 06 90 64 60 2e 00 00 00 00 00 00 00 00 00 00 00 00 00
E: 17.312886 25 31 01 b0 39 b0 5d 31 02 00 31 50 54 31 03 38 20 00 56 31 04 f8 46 00 2d 06
E: 17.317025 25 31 05 58 56 b0 28 31 06 28 64 08 2f 00 00 00 00 00 00 00 00 00 00 00 00 00
E: 17.345889 25 31 01 50 3b 88 5d 31 02 38 33 f0 54 31 03 60 21 38 56 31 04 58 46 b0 2b 06
E: 17.350000 25 31 05 38 56 b0 28 31 06 a8 63 20 30 00 00 00 00 00 00 00 00 00 00 00 00 00
E: 17.373897 25 31 01 f0 3d 30 5d 31 02 18 35 58 55 31 03 70 23 98 57 31 04 38 46 d8 2a 06
E: 17.377991 25 31 05 e0 55 b0 28 31 06 18 63 e8 31 00 00 00 00 00 00 00 00 00 00 00 00 00
E: 17.403887 25 31 01 80 40 30 5d 31 02 30 37 00 56 31 03 d0 24 a8 57 31 04 f8 45 60 2a 06
E: 17.407994 25 31 05 e0 55 f0 28 31 06 28 62 68 33 00 00 00 00 00 00 00 00 00 00 00 00 00
E: 17.435887 25 31 01 b8 42 10 5e 31 02 48 39 c0 56 31 03 f0 26 a8 58 31 04 c0 45 58 2a 06
E: 17.439997 25 31 05 f8 55 58 29 31 06 30 60 48 37 00 00 00 00 00 00 00 00 00 00 00 00 00
E: 17.463890 25 31 01 40 45 80 5f 31 02 a8 3b f0 57 31 03 28 29 08 59 31 04 70 45 58 2a 06
E: 17.468006 25 31 05 f8 55 38 2a 31 06 a0 5f 50 39 00 00 00 00 00 00 00 00 00 00 00 00 00
E: 17.492889 25 31 01 78 46 20 61 31 02 60 3d f0 58 31 03 a0 2a 28 59 31 04 30 45 a0 2a 06
E: 17.496994 25 31 05 e0 55 30 2b 31 06 68 5f b0 3a 00 00 00 00 00 00 00 00 00 00 00 00 00
E: 17.520891 25 31 01 e0 47 90 62 31 02 d0 3e f8 59 31 03 e8 2b 28 59 31 04 a8 44 30 2b 06
E: 17.524999 25 31 05 d0 55 58 2c 31 06 50 5f 78 3c 00 00 00 00 00 00 00 00 00 00 00 00 00
E: 17.548897 25 31 01 08 49 a8 63 31 02 d0 3f a8 5a 31 03 d0 2c 98 59 31 04 10 44 30 2c 06
E: 17.552996 25 31 05 d0 55 30 2e 31 06 10 5f 58 3e 00 00 00 00 00 00 00 00 00 00 00 00 00
E: 17.581912 25 31 01 d0 49 d0 64 31 02 40 40 38 5b 31 03 78 2d 18 5a 31 04 38 43 50 2d 06
E: 17.585997 25 31 05 88 55 f0 2f 31 06 b0 5e 60 40 00 00 00 00 00 00 00 00 00 00 00 00 00
E: 17.614892 25 31 01 50 4a c0 65 31 02 90 40 a8 5b 31 03 00 2e c0 5a 31 04 28 42 c0 2e 06
E: 17.618997 25 31 05 f8 54 c8 31 31 06 00 5e 80 42 00 00 00 00 00 00 00 00 00 00 00 00 00
E: 17.647896 25 31 01 c0 4a d8 66 31 02 c8 40 30 5c 31 03 30 2e f8 5a 31 04 10 41 88 30 06
E: 17.652007 25 31 05 30 54 08 34 31 06 28 5d f0 44 00 00 00 00 00 00 00 00 00 00 00 00 00
E: 17.679192 25 31 01 08 4b f0 67 31 02 00 41 10 5d 31 03 38 2e 30 5b 31 04 f0 3f 70 32 06
E: 17.686358 25 31 05 98 53 40 36 31 06 40 5c a8 47 00 00 00 00 00 00 00 00 00 00 00 00 00
E: 17.716981 25 31 01 08 4b f0 68 31 02 38 41 b0 5d 31 03 48 2e 48 5b 31 04 f8 3e 20 34 06
E: 17.721123 25 31 05 20 53 18 38 31 06 58 5b 00 4a 00 00 00 00 00 00 00 00 00 00 00 00 00
E: 17.751929 25 31 01 e8 4a 90 69 31 02 50 41 38 5e 31 03 50 2e 80 5b 31 04 08 3e e8 35 06
E: 17.756007 25 31 05 80 52 c8 39 31 06 50 5a 10 4c 00 00 00 00 00 00 00 00 00 00 00 00 00
E: 17.792903 25 31 01 e8 4a 00 6a 31 02 50 41 98 5e 31 03 50 2e 80 5b 31 04 48 3d 68 37 06
E: 17.797009 25 31 05 d8 51 00 3b 31 06 b0 59 78 4d 00 00 00 00 00 00 00 00 00 00 00 00 00
E: 17.827890 25 31 01 d0 4a 00 6a 31 02 20 41 98 5e 31 03 f0 2d 80 5b 31 04 10 3d a8 38 06
E: 17.831993 25 31 05 d8 51 a8 3b 31 06 a0 59 08 4e 00 00 00 00 00 00 00 00 00 00 00 00 00
E: 17.863898 25 31 01 08 4a f0 69 31 02 e8 3f 78 5e 31 03 d0 2c f0 5a 31 04 10 3d e0 39 06
E: 17.868001 25 31 05 00 52 50 3c 31 06 90 59 08 4e 00 00 00 00 00 00 00 00 00 00 00 00 00
E: 17.897895 25 31 01 28 48 f8 68 31 02 58 3e e8 5d 31 03 20 2b a8 5a 31 04 d8 3d a8 3b 06
E: 17.902017 25 31 05 18 52 c0 3c 31 06 a0 59 08 4e 00 00 00 00 00 00 00 00 00 00 00 00 00
E: 17.940908 25 31 01 80 45 b0 67 31 02 50 3c 90 5d 31 03 50 28 98 59 31 04 80 3f b8 3d 06
E: 17.945017 25 31 05 50 52 30 3d 31 06 70 5b 18 4f 00 00 00 00 00 00 00 00 00 00 00 00 00
E: 17.972907 25 31 01 a0 42 68 66 31 02 e0 39 48 5c 31 03 e0 25 98 59 31 04 f8 3f 40 3e 06
E: 17.977000 25 31 05 b0 52 a0 3d 31 06 c8 5c c0 4f 00 00 00 00 00 00 00 00 00 00 00 00 00
E: 18.014894 25 31 01 48 3e 58 64 31 02 10 37 60 5b 31 03 b8 23 38 59 31 04 30 40 d8 3e 06
E: 18.019002 25 31 05 e8 53 08 3f 31 06 90 5d 58 50 00 00 00 00 00 00 00 00 00 00 00 00 00
E: 18.056905 25 31 01 78 3c 00 64 31 02 28 35 10 5b 31 03 d0 21 d8 58 31 04 10 41 10 40 06
E: 18.060996 25 31 05 00 54 40 3f 31 06 f0 5d 68 50 00 00 00 00 00 00 00 00 00 00 00 00 00
E: 18.100894 25 31 01 c0 3b 00 64 31 02 78 34 f0 5a 31 03 38 21 a8 58 31 04 50 41 80 40 06
E: 18.105023 25 31 05 00 54 40 3f 31 06 20 5e 68 50 00 00 00 00 00 00 00 00 00 00 00 00 00
E: 18.138908 25 31 01 b8 3b e8 63 31 02 78 34 e8 5a 31 03 38 21 a8 58 31 04 50 41 80 40 06
E: 18.142996 25 31 05 00 54 50 3f 31 06 20 5e 50 50 00 00 00 00 00 00 00 00 00 00 00 00 00
E: 18.153868 25 30 01 b8 3b c8 63 30 02 88 34 e0 5a 30 03 48 21 b0 58 30 04 50 41 30 40 06
E: 18.158301 25 31 05 a8 53 70 3f 30 06 20 5e 00 50 00 00 00 00 00 00 00 00 00 00 00 00 00
E: 18.161994 25 30 05 68 53 70 3f 00 00 00 00 00 00 00 00 00 00 00 00 00 00 00 00 00 00 01
# Thank you.
