R: 344 05 0d 09 04 a1 01 85 01 09 22 a1 02 09 42 15 00 25 01 75 01 95 01 81 02 09 32 81 02 95 06 81 03 75 08 09 51 95 01 81 02 05 01 26 ff 3f 75 10 55 0e 65 11 09 30 35 00 46 1e 19 81 02 26 ff 3f 09 31 35 00 46 be 0f 81 02 26 ff 3f c0 a1 02 05 0d 09 42 15 00 25 01 75 01 95 01 81 02 09 32 81 02 95 06 81 03 75 08 09 51 95 01 81 02 05 01 26 ff 3f 75 10 55 0e 65 11 09 30 35 00 46 1e 19 81 02 26 ff 3f 09 31 35 00 46 be 0f 81 02 26 ff 3f c0 05 0d 09 54 95 01 75 08 25 02 81 02 85 02 09 55 25 02 b1 02 c0 09 0e a1 01 85 03 09 23 a1 02 09 52 09 53 15 00 25 0a 75 08 95 02 b1 02 c0 c0 05 01 09 02 a1 01 09 01 a1 00 85 04 05 09 95 03 75 01 19 01 29 03 15 00 25 01 81 02 95 01 75 05 81 01 05 01 75 10 95 02 09 30 09 31 15 00 26 ff 7f 81 02 c0 c0 05 0d 09 02 a1 01 85 05 09 20 a1 00 09 42 09 32 15 00 25 01 75 01 95 02 81 02 95 0e 81 03 05 01 26 ff 3f 75 10 95 01 55 0e 65 11 09 30 35 00 46 1e 19 81 02 26 ff 3f 09 31 35 00 46 be 0f 81 02 26 ff 3f c0 c0 06 00 ff 09 01 a1 01 85 06 19 01 29 40 15 00 26 ff 00 75 08 95 40 81 00 19 01 29 40 91 00 c0
N: Nexio Touch Device.   HID Multi-Touch
I: 3 1870 0100
# 1. Drag _one_ finger on the screen from one corner to the opposite, and release it.
E: 0.000000 14 01 03 01 00 07 13 13 02 02 a5 09 4f 24 01
E: 0.004744 14 01 03 01 08 07 02 13 02 02 a5 09 4f 24 01
E: 0.027732 14 01 03 01 3e 07 06 13 00 02 a5 09 4f 24 01
E: 0.050714 14 01 03 01 99 07 18 13 00 02 a5 09 4f 24 01
E: 0.073715 14 01 03 01 09 08 42 13 00 02 a5 09 4f 24 01
E: 0.096719 14 01 03 01 85 08 86 13 00 02 a5 09 4f 24 01
E: 0.119716 14 01 03 01 05 09 fa 13 00 02 a5 09 4f 24 01
E: 0.142748 14 01 03 01 8d 09 ab 14 00 02 a5 09 4f 24 01
E: 0.165720 14 01 03 01 1b 0a 89 15 00 02 a5 09 4f 24 01
E: 0.188717 14 01 03 01 b1 0a 80 16 00 02 a5 09 4f 24 01
E: 0.211720 14 01 03 01 66 0b 7f 17 00 02 a5 09 4f 24 01
E: 0.234717 14 01 03 01 3b 0c 85 18 00 02 a5 09 4f 24 01
E: 0.257716 14 01 03 01 23 0d 99 19 00 02 a5 09 4f 24 01
E: 0.280718 14 01 03 01 18 0e ac 1a 00 02 a5 09 4f 24 01
E: 0.303719 14 01 03 01 15 0f ab 1b 00 02 a5 09 4f 24 01
E: 0.326718 14 01 03 01 20 10 97 1c 00 02 a5 09 4f 24 01
E: 0.349654 14 01 03 01 2e 11 76 1d 00 02 a5 09 4f 24 01
E: 0.373721 14 01 03 01 30 12 40 1e 00 02 a5 09 4f 24 01
E: 0.396719 14 01 03 01 35 13 f1 1e 00 02 a5 09 4f 24 01
E: 0.419719 14 01 03 01 3f 14 94 1f 00 02 a5 09 4f 24 01
E: 0.442717 14 01 03 01 51 15 32 20 00 02 a5 09 4f 24 01
E: 0.465718 14 01 03 01 81 16 be 20 00 02 a5 09 4f 24 01
E: 0.488718 14 01 03 01 db 17 3c 21 00 02 a5 09 4f 24 01
E: 0.511719 14 01 03 01 50 19 ce 21 00 02 a5 09 4f 24 01
E: 0.534719 14 01 03 01 c9 1a 76 22 00 02 a5 09 4f 24 01
E: 0.557721 14 01 03 01 3d 1c 16 23 00 02 a5 09 4f 24 01
E: 0.580719 14 01 03 01 b4 1d 97 23 00 02 a5 09 4f 24 01
E: 0.603718 14 01 03 01 2f 1f 09 24 00 02 a5 09 4f 24 01
E: 0.626720 14 01 03 01 b4 20 78 24 00 02 a5 09 4f 24 01
E: 0.649718 14 01 03 01 41 22 d9 24 00 02 a5 09 4f 24 01
E: 0.672722 14 01 03 01 c5 23 35 25 00 02 a5 09 4f 24 01
E: 0.695721 14 01 03 01 3f 25 8f 25 00 02 a5 09 4f 24 01
E: 0.718721 14 01 03 01 b7 26 df 25 00 02 a5 09 4f 24 01
E: 0.741721 14 01 03 01 28 28 25 26 00 02 a5 09 4f 24 01
E: 0.764719 14 01 03 01 94 29 7a 26 00 02 a5 09 4f 24 01
E: 0.787721 14 01 03 01 f5 2a e2 26 00 02 a5 09 4f 24 01
E: 0.810722 14 01 03 01 37 2c 45 27 00 02 a5 09 4f 24 01
E: 0.833721 14 01 03 01 61 2d af 27 00 02 a5 09 4f 24 01
E: 0.857723 14 01 03 01 8c 2e 31 28 00 02 a5 09 4f 24 01
E: 0.880722 14 01 03 01 bb 2f d5 28 00 02 a5 09 4f 24 01
E: 0.903723 14 01 03 01 dc 30 9e 29 00 02 a5 09 4f 24 01
E: 0.926727 14 01 03 01 eb 31 71 2a 00 02 a5 09 4f 24 01
E: 0.949697 14 01 03 01 ef 32 41 2b 00 02 a5 09 4f 24 01
E: 0.972724 14 01 03 01 e9 33 18 2c 00 02 a5 09 4f 24 01
E: 0.995725 14 01 03 01 db 34 ed 2c 00 02 a5 09 4f 24 01
E: 1.018724 14 01 03 01 c8 35 b7 2d 00 02 a5 09 4f 24 01
E: 1.041723 14 01 03 01 a4 36 74 2e 00 02 a5 09 4f 24 01
E: 1.064724 14 01 03 01 61 37 18 2f 00 02 a5 09 4f 24 01
E: 1.087724 14 01 03 01 16 38 a8 2f 00 02 a5 09 4f 24 01
E: 1.110724 14 01 03 01 cc 38 38 30 00 02 a5 09 4f 24 01
E: 1.133722 14 01 03 01 72 39 cd 30 00 02 a5 09 4f 24 01
E: 1.156728 14 01 03 01 ff 39 57 31 00 02 a5 09 4f 24 01
E: 1.179724 14 01 03 01 6d 3a b7 31 00 02 a5 09 4f 24 01
E: 1.202726 14 01 03 01 c7 3a e4 31 00 02 a5 09 4f 24 01
E: 1.225750 14 01 03 01 17 3b ee 31 00 02 a5 09 4f 24 01
E: 1.248729 14 01 03 01 4e 3b e8 31 00 02 a5 09 4f 24 01
E: 1.271726 14 01 03 01 65 3b e0 31 00 02 a5 09 4f 24 01
E: 1.294726 14 01 03 01 65 3b da 31 00 02 a5 09 4f 24 01
E: 1.317770 14 01 03 01 52 3b d6 31 00 02 a5 09 4f 24 01
E: 1.340732 14 01 03 01 2b 3b d2 31 00 02 a5 09 4f 24 01
E: 1.363730 14 01 03 01 f4 3a c9 31 00 02 a5 09 4f 24 01
E: 1.386734 14 01 03 01 c2 3a bb 31 00 02 a5 09 4f 24 01
E: 1.410719 14 01 03 01 9e 3a ab 31 00 02 a5 09 4f 24 01
E: 1.433730 14 01 03 01 89 3a 93 31 00 02 a5 09 4f 24 01
E: 1.456728 14 01 03 01 7f 3a 71 31 00 02 a5 09 4f 24 01
E: 1.479740 14 01 03 01 7c 3a 50 31 00 02 a5 09 4f 24 01
E: 1.502728 14 01 03 01 7c 3a 3d 31 00 02 a5 09 4f 24 01
E: 1.524730 14 01 03 01 7e 3a 36 31 00 02 a5 09 4f 24 01
E: 1.547755 14 01 03 01 7f 3a 35 31 00 02 a5 09 4f 24 01
E: 1.570744 14 01 03 01 80 3a 37 31 00 02 a5 09 4f 24 01
E: 1.593741 14 01 03 01 81 3a 39 31 00 02 a5 09 4f 24 01
E: 1.616727 14 01 03 01 83 3a 2b 31 00 02 a5 09 4f 24 01
E: 1.639732 14 01 03 01 84 3a ef 30 00 02 a5 09 4f 24 01
E: 1.662730 14 01 03 01 6e 3a 7f 30 00 02 a5 09 4f 24 01
E: 1.685729 14 01 03 01 21 3a f6 2f 00 02 a5 09 4f 24 01
E: 1.709733 14 01 03 01 98 39 68 2f 00 02 a5 09 4f 24 01
E: 1.732730 14 01 03 01 ed 38 cb 2e 00 02 a5 09 4f 24 01
E: 1.755730 14 01 03 01 34 38 2b 2e 00 02 a5 09 4f 24 01
E: 1.778730 14 01 03 01 7b 37 97 2d 00 02 a5 09 4f 24 01
E: 1.801707 14 01 03 01 d0 36 fa 2c 00 02 a5 09 4f 24 01
E: 1.824727 14 01 02 01 d0 36 fa 2c 00 02 a5 09 4f 24 01
# 2. Land one finger,
   - land a second finger far enough from the first
   - move your two fingers
   - release the *first* finger
   - release the second finger
E: 5.237812 14 01 03 01 80 05 a3 0a 02 02 a5 09 4f 24 01
E: 5.260759 14 01 03 01 87 05 98 0a 02 02 a5 09 4f 24 01
E: 5.283755 14 01 03 01 ad 05 a4 0a 00 02 a5 09 4f 24 01
E: 5.306760 14 01 03 01 da 05 c7 0a 00 02 a5 09 4f 24 01
E: 5.329757 14 01 03 01 11 06 00 0b 00 02 a5 09 4f 24 01
E: 5.352761 14 01 03 01 67 06 4c 0b 00 02 a5 09 4f 24 01
E: 5.375757 14 01 03 01 ce 06 a2 0b 00 02 a5 09 4f 24 01
E: 5.398759 14 01 03 01 3a 07 f6 0b 00 02 a5 09 4f 24 01
E: 5.421759 14 01 03 01 b2 07 43 0c 00 02 a5 09 4f 24 01
E: 5.444760 14 01 03 01 32 08 9e 0c 00 02 a5 09 4f 24 01
E: 5.467763 14 01 03 01 be 08 08 0d 00 02 a5 09 4f 24 01
E: 5.490764 14 01 03 01 5e 09 5e 0d 00 02 a5 09 4f 24 01
E: 5.513764 14 01 03 01 12 0a 99 0d 00 02 a5 09 4f 24 01
E: 5.536755 14 01 03 01 cf 0a d2 0d 00 02 a5 09 4f 24 01
E: 5.559839 14 01 03 01 91 0b 04 0e 00 02 a5 09 4f 24 01
E: 5.582761 14 01 03 01 53 0c 25 0e 00 02 a5 09 4f 24 01
E: 5.605764 14 01 03 01 08 0d 45 0e 00 02 a5 09 4f 24 01
E: 5.628764 14 01 03 01 b1 0d 81 0e 00 02 a5 09 4f 24 01
E: 5.651761 14 01 03 01 62 0e d7 0e 00 02 a5 09 4f 24 01
E: 5.674762 14 01 03 01 11 0f 27 0f 00 02 a5 09 4f 24 01
E: 5.697766 14 01 03 01 af 0f 58 0f 00 02 a5 09 4f 24 01
E: 5.720762 14 01 03 01 3f 10 6d 0f 00 02 a5 09 4f 24 01
E: 5.743763 14 01 03 01 b2 10 70 0f 00 02 a5 09 4f 24 01
E: 5.766813 14 01 03 01 f7 10 71 0f 00 02 a5 09 4f 24 01
E: 5.789766 14 01 03 01 11 11 71 0f 00 02 a5 09 4f 24 01
E: 5.812764 14 01 03 01 13 11 6f 0f 00 02 a5 09 4f 24 01
E: 5.835762 14 01 03 01 0c 11 6b 0f 00 02 a5 09 4f 24 01
E: 5.858766 14 01 03 01 05 11 66 0f 00 02 a5 09 4f 24 01
E: 5.881763 14 01 03 01 0c 11 63 0f 00 02 a5 09 4f 24 01
E: 5.904769 14 01 03 01 2e 11 61 0f 00 02 a5 09 4f 24 01
E: 5.927766 14 01 03 01 66 11 61 0f 00 02 a5 09 4f 24 01
E: 5.950763 14 01 03 01 a9 11 61 0f 00 02 a5 09 4f 24 01
E: 5.973765 14 01 03 01 ec 11 61 0f 00 02 a5 09 4f 24 01
E: 5.996764 14 01 03 01 2e 12 61 0f 00 02 a5 09 4f 24 01
E: 6.019765 14 01 03 01 70 12 62 0f 00 02 a5 09 4f 24 01
E: 6.042764 14 01 03 01 bc 12 62 0f 00 02 a5 09 4f 24 01
E: 6.065764 14 01 03 01 1f 13 62 0f 00 02 a5 09 4f 24 01
E: 6.088763 14 01 03 01 8a 13 62 0f 00 02 a5 09 4f 24 01
E: 6.111765 14 01 03 01 db 13 66 0f 00 02 a5 09 4f 24 01
E: 6.134766 14 01 03 01 1d 14 7d 0f 00 02 a5 09 4f 24 01
E: 6.157766 14 01 03 01 73 14 ac 0f 00 02 a5 09 4f 24 01
E: 6.180766 14 01 03 01 d3 14 dc 0f 00 02 a5 09 4f 24 01
E: 6.203769 14 01 03 01 36 15 fa 0f 00 02 a5 09 4f 24 01
E: 6.226767 14 01 03 01 a0 15 06 10 00 02 a5 09 4f 24 01
E: 6.249767 14 01 03 01 03 16 08 10 00 02 a5 09 4f 24 01
E: 6.272770 14 01 03 01 54 16 0d 10 00 02 a5 09 4f 24 01
E: 6.295766 14 01 03 01 96 16 24 10 00 02 a5 09 4f 24 01
E: 6.318771 14 01 03 01 d8 16 46 10 00 02 a5 09 4f 24 01
E: 6.341766 14 01 03 01 22 17 69 10 00 02 a5 09 4f 24 01
E: 6.364756 14 01 03 01 6f 17 85 10 00 02 a5 09 4f 24 01
E: 6.387768 14 01 03 01 bf 17 98 10 00 02 a5 09 4f 24 01
E: 6.410768 14 01 03 01 11 18 b1 10 00 02 a5 09 4f 24 01
E: 6.433766 14 01 03 01 67 18 e1 10 00 02 a5 09 4f 24 01
E: 6.457766 14 01 03 01 67 18 e1 10 00 02 a5 09 4f 24 01
E: 6.480764 14 01 00 01 15 19 a4 11 00 02 45 35 1f 24 00
E: 6.504765 14 01 00 01 5e 19 c5 11 00 02 2a 35 db 23 00
E: 6.527767 14 01 00 01 bd 19 07 12 00 02 f5 34 2c 23 00
E: 6.550767 14 01 00 01 11 1a 57 12 00 02 82 34 06 22 00
E: 6.574765 14 01 00 01 54 1a b9 12 00 02 b8 33 9a 20 00
E: 6.597767 14 01 00 01 83 1a 2a 13 00 02 95 32 13 1f 00
E: 6.621792 14 01 03 01 aa 1a 8d 13 03 02 24 31 90 1d 02
E: 6.644744 14 01 03 01 c9 1a dd 13 03 02 88 2f 39 1c 02
E: 6.668771 14 01 03 01 ca 1a 1e 14 03 02 e8 2d 20 1b 02
E: 6.691772 14 01 03 01 b1 1a 57 14 03 02 54 2c 51 1a 02
E: 6.714773 14 01 03 01 88 1a a3 14 03 02 e5 2a dd 19 02
E: 6.738773 14 01 03 01 52 1a 03 15 03 02 c7 29 c2 19 02
E: 6.761773 14 01 03 01 06 1a 56 15 03 02 11 29 ed 19 02
E: 6.784772 14 01 03 01 a0 19 8b 15 03 02 a2 28 49 1a 02
E: 6.808775 14 01 03 01 2e 19 b7 15 03 02 4d 28 cb 1a 02
E: 6.831774 14 01 03 01 bc 18 e7 15 03 02 12 28 6a 1b 02
E: 6.854805 14 01 03 01 44 18 1c 16 03 02 f7 27 33 1c 02
E: 6.878801 14 01 03 01 c7 17 5a 16 03 02 0a 28 26 1d 02
E: 6.901652 14 01 03 01 4b 17 95 16 03 02 57 28 26 1e 02
E: 6.924801 14 01 03 01 d2 16 bb 16 03 02 c9 28 34 1f 02
E: 6.948693 14 01 03 01 58 16 cb 16 03 02 4a 29 59 20 02
E: 6.971778 14 01 03 01 da 15 cd 16 03 02 d1 29 8d 21 02
E: 6.994775 14 01 03 01 68 15 ca 16 03 02 5b 2a ca 22 02
E: 7.018778 14 01 03 01 0b 15 c7 16 03 02 d5 2a 08 24 02
E: 7.041777 14 01 03 01 b3 14 c4 16 03 02 41 2b 3d 25 02
E: 7.064776 14 01 03 01 5b 14 c3 16 03 02 a2 2b 58 26 02
E: 7.087776 14 01 03 01 1a 14 c3 16 03 02 e7 2b 53 27 02
E: 7.110774 14 01 03 01 ec 13 c3 16 03 02 08 2c 27 28 02
E: 7.134784 14 01 03 01 af 13 c3 16 03 02 0f 2c c9 28 02
E: 7.157744 14 01 03 01 61 13 c3 16 03 02 f5 2b 3b 29 02
E: 7.180776 14 01 03 01 16 13 c8 16 03 02 a9 2b 8f 29 02
E: 7.203777 14 01 03 01 d0 12 e2 16 03 02 43 2b c7 29 02
E: 7.227777 14 01 03 01 8e 12 11 17 03 02 d4 2a e0 29 02
E: 7.250777 14 01 03 01 4d 12 4f 17 03 02 4f 2a d6 29 02
E: 7.273777 14 01 03 01 19 12 96 17 03 02 a0 29 a5 29 02
E: 7.297777 14 01 03 01 fe 11 e5 17 03 02 c3 28 69 29 02
E: 7.320826 14 01 03 01 ed 11 38 18 03 02 c9 27 30 29 02
E: 7.343779 14 01 03 01 d2 11 83 18 03 02 c3 26 f1 28 02
E: 7.367779 14 01 03 01 af 11 c6 18 03 02 bb 25 ac 28 02
E: 7.390778 14 01 03 01 92 11 09 19 03 02 b6 24 63 28 02
E: 7.414776 14 01 03 01 73 11 4e 19 03 02 b4 23 25 28 02
E: 7.437778 14 01 03 01 47 11 91 19 03 02 b3 22 02 28 02
E: 7.460778 14 01 03 01 1c 11 cb 19 03 02 b4 21 fa 27 02
E: 7.483776 14 01 03 01 03 11 01 1a 03 02 b4 20 13 28 02
E: 7.507758 14 01 03 01 f9 10 36 1a 03 02 cb 1f 56 28 02
E: 7.530781 14 01 03 01 f8 10 5e 1a 03 02 10 1f ba 28 02
E: 7.553818 14 01 03 01 fb 10 75 1a 03 02 6d 1e 30 29 02
E: 7.577780 14 01 03 01 fe 10 7b 1a 03 02 d4 1d b3 29 02
E: 7.600779 14 01 03 01 ff 10 68 1a 03 02 57 1d 35 2a 02
E: 7.623793 14 01 03 01 e9 10 19 1a 03 02 01 1d b7 2a 02
E: 7.646779 14 01 03 01 e9 10 19 1a 03 02 01 1d b7 2a 02
E: 7.669778 14 01 03 01 ed 14 da 20 02 02 01 1d b7 2a 01
E: 7.692778 14 01 03 01 b9 18 93 27 02 02 01 1d b7 2a 01
E: 7.715782 14 01 03 01 3e 1b 51 2c 00 02 01 1d b7 2a 01
E: 7.738778 14 01 03 01 3b 1c b4 2e 00 02 01 1d b7 2a 01
E: 7.762781 14 01 03 01 1e 1c 96 2f 00 02 01 1d b7 2a 01
E: 7.785779 14 01 03 01 7b 1b c2 2f 00 02 01 1d b7 2a 01
E: 7.808779 14 01 03 01 a8 1a a5 2f 00 02 01 1d b7 2a 01
E: 7.831779 14 01 03 01 bc 19 5b 2f 00 02 01 1d b7 2a 01
E: 7.854780 14 01 03 01 c0 18 e7 2e 00 02 01 1d b7 2a 01
E: 7.877780 14 01 03 01 b2 17 76 2e 00 02 01 1d b7 2a 01
E: 7.900779 14 01 03 01 7f 16 32 2e 00 02 01 1d b7 2a 01
E: 7.923782 14 01 03 01 3a 15 16 2e 00 02 01 1d b7 2a 01
E: 7.946781 14 01 03 01 23 14 32 2e 00 02 01 1d b7 2a 01
E: 7.969780 14 01 03 01 4f 13 92 2e 00 02 01 1d b7 2a 01
E: 7.992781 14 01 03 01 ac 12 12 2f 00 02 01 1d b7 2a 01
E: 8.015781 14 01 03 01 39 12 99 2f 00 02 01 1d b7 2a 01
E: 8.038805 14 01 03 01 fc 11 2c 30 00 02 01 1d b7 2a 01
E: 8.061849 14 01 03 01 e9 11 c7 30 00 02 01 1d b7 2a 01
E: 8.084782 14 01 03 01 05 12 5a 31 00 02 01 1d b7 2a 01
E: 8.107784 14 01 03 01 70 12 d4 31 00 02 01 1d b7 2a 01
E: 8.130780 14 01 03 01 17 13 3f 32 00 02 01 1d b7 2a 01
E: 8.153823 14 01 03 01 cd 13 a6 32 00 02 01 1d b7 2a 01
E: 8.176783 14 01 03 01 ae 14 f3 32 00 02 01 1d b7 2a 01
E: 8.199808 14 01 03 01 d2 15 12 33 00 02 01 1d b7 2a 01
E: 8.222782 14 01 03 01 05 17 f7 32 00 02 01 1d b7 2a 01
E: 8.245786 14 01 03 01 16 18 a1 32 00 02 01 1d b7 2a 01
E: 8.268779 14 01 03 01 f7 18 2c 32 00 02 01 1d b7 2a 01
E: 8.291783 14 01 03 01 b5 19 a4 31 00 02 01 1d b7 2a 01
E: 8.314784 14 01 03 01 75 1a 0a 31 00 02 01 1d b7 2a 01
E: 8.337784 14 01 03 01 34 1b 6c 30 00 02 01 1d b7 2a 01
E: 8.360775 14 01 03 01 dc 1b bf 2f 00 02 01 1d b7 2a 01
E: 8.383782 14 01 03 01 85 1c f5 2e 00 02 01 1d b7 2a 01
E: 8.406788 14 01 03 01 3b 1d 23 2e 00 02 01 1d b7 2a 01
E: 8.429784 14 01 03 01 e3 1d 64 2d 00 02 01 1d b7 2a 01
E: 8.452783 14 01 03 01 8d 1e b7 2c 00 02 01 1d b7 2a 01
E: 8.476784 14 01 03 01 56 1f 27 2c 00 02 01 1d b7 2a 01
E: 8.499782 14 01 03 01 37 20 c9 2b 00 02 01 1d b7 2a 01
E: 8.522784 14 01 03 01 15 21 9f 2b 00 02 01 1d b7 2a 01
E: 8.545777 14 01 03 01 f3 21 99 2b 00 02 01 1d b7 2a 01
E: 8.568783 14 01 03 01 e3 22 bc 2b 00 02 01 1d b7 2a 01
E: 8.591796 14 01 03 01 ee 23 29 2c 00 02 01 1d b7 2a 01
E: 8.614787 14 01 03 01 0d 25 d9 2c 00 02 01 1d b7 2a 01
E: 8.637846 14 01 03 01 2f 26 b3 2d 00 02 01 1d b7 2a 01
E: 8.660786 14 01 03 01 45 27 b7 2e 00 02 01 1d b7 2a 01
E: 8.683785 14 01 03 01 43 28 dc 2f 00 02 01 1d b7 2a 01
E: 8.706791 14 01 03 01 16 29 0e 31 00 02 01 1d b7 2a 01
E: 8.729813 14 01 03 01 a5 29 31 32 00 02 01 1d b7 2a 01
E: 8.752783 14 01 03 01 d1 29 28 33 00 02 01 1d b7 2a 01
E: 8.775786 14 01 03 01 a0 29 ed 33 00 02 01 1d b7 2a 01
E: 8.798789 14 01 03 01 38 29 82 34 00 02 01 1d b7 2a 01
E: 8.821788 14 01 03 01 82 28 dd 34 00 02 01 1d b7 2a 01
E: 8.844816 14 01 03 01 4b 27 e2 34 00 02 01 1d b7 2a 01
E: 8.867789 14 01 03 01 81 25 5a 34 00 02 01 1d b7 2a 01
E: 8.913786 14 01 02 01 81 25 5a 34 00 02 01 1d b7 2a 01
# 3. Finally, move your ten fingers on the screen and release them.
E: 11.895859 14 01 03 01 80 10 27 16 02 02 01 1d b7 2a 01
E: 11.918811 14 01 03 01 7e 10 13 16 02 02 01 1d b7 2a 01
E: 11.941815 14 01 03 01 b5 10 18 16 00 02 01 1d b7 2a 01
E: 11.964812 14 01 03 01 1a 11 1f 16 00 02 01 1d b7 2a 01
E: 11.986812 14 01 03 01 99 11 24 16 00 02 01 1d b7 2a 01
E: 12.010816 14 01 03 01 1f 12 2f 16 00 02 01 1d b7 2a 01
E: 12.033791 14 01 03 01 b2 12 50 16 00 02 01 1d b7 2a 01
E: 12.056835 14 01 03 01 4c 13 81 16 00 02 01 1d b7 2a 01
E: 12.079835 14 01 03 01 df 13 ab 16 00 02 01 1d b7 2a 01
E: 12.102817 14 01 03 01 78 14 c2 16 00 02 01 1d b7 2a 01
E: 12.125814 14 01 03 01 1b 15 cb 16 00 02 01 1d b7 2a 01
E: 12.148830 14 01 03 01 bb 15 cb 16 00 02 01 1d b7 2a 01
E: 12.170814 14 01 03 01 58 16 c8 16 00 02 01 1d b7 2a 01
E: 12.193813 14 01 03 01 eb 16 c6 16 00 02 01 1d b7 2a 01
E: 12.217812 14 01 03 01 75 17 cb 16 00 02 01 1d b7 2a 01
E: 12.240816 14 01 03 01 fb 17 dc 16 00 02 01 1d b7 2a 01
E: 12.263814 14 01 03 01 85 18 fb 16 00 02 01 1d b7 2a 01
E: 12.286817 14 01 03 01 08 19 25 17 00 02 01 1d b7 2a 01
E: 12.309815 14 01 03 01 6f 19 4b 17 00 02 01 1d b7 2a 01
E: 12.332814 14 01 03 01 be 19 60 17 00 02 01 1d b7 2a 01
E: 12.355815 14 01 03 01 f2 19 68 17 00 02 01 1d b7 2a 01
E: 12.378816 14 01 03 01 08 1a 69 17 00 02 01 1d b7 2a 01
E: 12.401817 14 01 03 01 08 1a 69 17 00 02 01 1d b7 2a 01
E: 12.424814 14 01 00 01 00 1a 62 17 00 02 d9 10 89 25 00
E: 12.448813 14 01 00 01 e9 19 4d 17 00 02 bd 10 68 25 00
E: 12.471812 14 01 00 01 ef 19 4a 17 00 02 92 10 61 25 00
E: 12.494813 14 01 00 01 f7 19 37 17 00 02 48 10 31 25 00
E: 12.518813 14 01 00 01 fd 19 18 17 00 02 f0 0f d7 24 00
E: 12.541812 14 01 00 01 00 1a fa 16 00 02 a8 0f 84 24 00
E: 12.564824 14 01 03 01 01 1a e3 16 03 02 7f 0f 53 24 02
E: 12.587820 14 01 03 01 01 1a d4 16 03 02 64 0f 33 24 02
E: 12.610820 14 01 03 01 00 1a cd 16 03 02 36 0f 0a 24 02
E: 12.634714 14 01 03 01 00 1a cc 16 03 02 f1 0e db 23 02
E: 12.657822 14 01 03 01 e8 19 cc 16 03 02 af 0e bb 23 02
E: 12.680820 14 01 03 01 a3 19 cc 16 03 02 6c 0e a8 23 02
E: 12.704820 14 01 03 01 45 19 c9 16 03 02 13 0e 8e 23 02
E: 12.727820 14 01 03 01 e1 18 c6 16 03 02 b0 0d 52 23 02
E: 12.751831 14 01 03 01 78 18 c5 16 03 02 4a 0d fb 22 02
E: 12.774824 14 01 03 01 15 18 c1 16 03 02 e6 0c ab 22 02
E: 12.797822 14 01 03 01 b0 17 b5 16 03 02 88 0c 6c 22 02
E: 12.821820 14 01 03 01 4a 17 98 16 03 02 24 0c 23 22 02
E: 12.844822 14 01 03 01 ed 16 6c 16 03 02 bc 0b cc 21 02
E: 12.867828 14 01 03 01 96 16 42 16 03 02 50 0b 6d 21 02
E: 12.891824 14 01 03 01 40 16 2a 16 03 02 e9 0a 0b 21 02
E: 12.914822 14 01 03 01 40 16 2a 16 03 02 e9 0a 0b 21 02
E: 12.937821 14 01 03 01 40 16 2a 16 03 02 e9 0a 0b 21 02
E: 12.961812 14 01 03 01 40 16 2a 16 03 02 e9 0a 0b 21 02
E: 12.984822 14 01 03 01 40 16 2a 16 03 02 e9 0a 0b 21 02
E: 13.008824 14 01 03 01 40 16 2a 16 03 02 e9 0a 0b 21 02
E: 13.031822 14 01 03 01 40 16 2a 16 03 02 e9 0a 0b 21 02
E: 13.054824 14 01 03 01 40 16 2a 16 03 02 e9 0a 0b 21 02
E: 13.078823 14 01 03 01 40 16 2a 16 03 02 e9 0a 0b 21 02
E: 13.101826 14 01 03 01 40 16 2a 16 03 02 e9 0a 0b 21 02
E: 13.125824 14 01 03 01 40 16 2a 16 03 02 e9 0a 0b 21 02
E: 13.148822 14 01 03 01 40 16 2a 16 03 02 e9 0a 0b 21 02
E: 13.171821 14 01 03 01 40 16 2a 16 03 02 e9 0a 0b 21 02
E: 13.195822 14 01 03 01 40 16 2a 16 03 02 e9 0a 0b 21 02
E: 13.218827 14 01 03 01 40 16 2a 16 03 02 e9 0a 0b 21 02
E: 13.242822 14 01 03 01 1b 11 ea 10 03 02 97 0c c9 19 02
E: 13.265823 14 01 03 01 1b 11 ea 10 03 02 97 0c c9 19 02
E: 13.289826 14 01 03 01 1b 11 ea 10 03 02 97 0c c9 19 02
E: 13.313824 14 01 03 01 1b 11 ea 10 03 02 97 0c c9 19 02
E: 13.336867 14 01 03 01 1b 11 ea 10 03 02 97 0c c9 19 02
E: 13.360900 14 01 03 01 4b 0a dd 09 03 02 a1 0f d3 10 02
E: 13.383804 14 01 03 01 1c 09 0a 09 03 02 28 10 18 10 02
E: 13.407826 14 01 03 01 1c 09 0a 09 03 02 28 10 18 10 02
E: 13.431826 14 01 03 01 1c 09 0a 09 03 02 28 10 18 10 02
E: 13.455826 14 01 03 01 d6 08 eb 09 02 02 28 10 18 10 01
E: 13.478828 14 01 03 01 e8 08 35 0a 02 02 28 10 18 10 01
E: 13.501825 14 01 03 01 f7 08 48 0a 00 02 28 10 18 10 01
E: 13.525824 14 01 03 01 00 09 7f 0a 00 02 28 10 18 10 01
E: 13.548826 14 01 03 01 02 09 cb 0a 00 02 28 10 18 10 01
E: 13.571824 14 01 03 01 02 09 4d 0b 00 02 28 10 18 10 01
E: 13.594863 14 01 03 01 01 09 77 0c 00 02 28 10 18 10 01
E: 13.618825 14 01 03 01 00 09 0d 0e 00 02 28 10 18 10 01
E: 13.641880 14 01 03 01 00 09 65 0f 00 02 28 10 18 10 01
E: 13.664824 14 01 03 01 ff 08 3f 10 00 02 28 10 18 10 01
E: 13.688827 14 01 03 01 f8 08 ba 10 00 02 28 10 18 10 01
E: 13.712827 14 01 03 01 de 08 06 11 00 02 28 10 18 10 01
E: 13.736827 14 01 03 01 ba 08 34 11 00 02 28 10 18 10 01
E: 13.760825 14 01 03 01 9a 08 54 11 00 02 28 10 18 10 01
E: 13.784830 14 01 03 01 84 08 81 11 00 02 28 10 18 10 01
E: 13.808826 14 01 03 01 71 08 b6 11 00 02 28 10 18 10 01
E: 13.832828 14 01 03 01 4c 08 ec 11 00 02 28 10 18 10 01
E: 13.856825 14 01 03 01 13 08 28 12 00 02 28 10 18 10 01
E: 13.879774 14 01 03 01 d0 07 6a 12 00 02 28 10 18 10 01
E: 13.903824 14 01 03 01 93 07 b2 12 00 02 28 10 18 10 01
E: 13.927856 14 01 03 01 93 07 b2 12 00 02 28 10 18 10 01
E: 13.951840 14 01 03 01 93 07 b2 12 00 02 28 10 18 10 01
E: 13.975858 14 01 03 01 13 07 dc 13 02 02 51 10 2c 10 01
E: 13.998829 14 01 03 01 02 07 8f 14 02 02 51 10 2c 10 01
E: 14.022829 14 01 03 01 02 07 8f 14 02 02 51 10 2c 10 01
E: 14.045825 14 01 03 01 02 07 8f 14 02 02 51 10 2c 10 01
E: 14.069826 14 01 03 01 02 07 8f 14 02 02 51 10 2c 10 01
E: 14.093828 14 01 03 01 02 07 8f 14 02 02 51 10 2c 10 01
E: 14.117829 14 01 03 01 02 07 8f 14 02 02 51 10 2c 10 01
E: 14.140826 14 01 00 01 24 08 4f 17 00 02 e2 0c 3b 0e 00
E: 14.164858 14 01 00 01 24 08 4f 17 00 02 e2 0c 3b 0e 00
E: 14.187826 14 01 00 01 24 08 4f 17 00 02 e2 0c 3b 0e 00
E: 14.211829 14 01 00 01 24 08 4f 17 00 02 e2 0c 3b 0e 00
E: 14.235826 14 01 00 01 24 08 4f 17 00 02 e2 0c 3b 0e 00
E: 14.259828 14 01 00 01 24 08 4f 17 00 02 e2 0c 3b 0e 00
E: 14.282827 14 01 00 01 24 08 4f 17 00 02 e2 0c 3b 0e 00
E: 14.306828 14 01 00 01 24 08 4f 17 00 02 e2 0c 3b 0e 00
E: 14.330827 14 01 00 01 24 08 4f 17 00 02 e2 0c 3b 0e 00
E: 14.353828 14 01 00 01 24 08 4f 17 00 02 e2 0c 3b 0e 00
E: 14.377827 14 01 00 01 24 08 4f 17 00 02 e2 0c 3b 0e 00
E: 14.401828 14 01 00 01 24 08 4f 17 00 02 e2 0c 3b 0e 00
E: 14.425828 14 01 00 01 17 07 6e 11 00 02 f8 07 6c 11 00
E: 14.449831 14 01 00 01 a0 05 94 0d 00 02 46 0a fd 13 00
E: 14.473827 14 01 00 01 e4 04 51 0b 00 02 39 0c 2a 15 00
E: 14.497829 14 01 00 01 e4 04 51 0b 00 02 39 0c 2a 15 00
E: 14.520833 14 01 03 01 be 04 cf 09 02 02 39 0c 2a 15 01
E: 14.544872 14 01 03 01 dc 04 a6 09 02 02 39 0c 2a 15 01
E: 14.567832 14 01 03 01 f4 04 81 09 00 02 39 0c 2a 15 01
E: 14.591833 14 01 03 01 00 05 34 09 00 02 39 0c 2a 15 01
E: 14.614837 14 01 03 01 0b 05 c7 08 00 02 39 0c 2a 15 01
E: 14.639836 14 01 03 01 20 05 41 08 00 02 39 0c 2a 15 01
E: 14.663837 14 01 03 01 3e 05 c3 07 00 02 39 0c 2a 15 01
E: 14.687833 14 01 03 01 5b 05 57 07 00 02 39 0c 2a 15 01
E: 14.711835 14 01 03 01 70 05 e0 06 00 02 39 0c 2a 15 01
E: 14.734838 14 01 03 01 7d 05 73 06 00 02 39 0c 2a 15 01
E: 14.758837 14 01 03 01 82 05 31 06 00 02 39 0c 2a 15 01
E: 14.782834 14 01 03 01 85 05 17 06 00 02 39 0c 2a 15 01
E: 14.806834 14 01 03 01 8b 05 14 06 00 02 39 0c 2a 15 01
E: 14.830836 14 01 03 01 a0 05 1a 06 00 02 39 0c 2a 15 01
E: 14.854838 14 01 03 01 d0 05 21 06 00 02 39 0c 2a 15 01
E: 14.878836 14 01 03 01 15 06 25 06 00 02 39 0c 2a 15 01
E: 14.901835 14 01 03 01 54 06 27 06 00 02 39 0c 2a 15 01
E: 14.925840 14 01 03 01 7b 06 27 06 00 02 39 0c 2a 15 01
E: 14.949836 14 01 03 01 8b 06 37 06 00 02 39 0c 2a 15 01
E: 14.973837 14 01 03 01 8e 06 73 06 00 02 39 0c 2a 15 01
E: 14.997836 14 01 03 01 8e 06 d5 06 00 02 39 0c 2a 15 01
E: 15.020861 14 01 03 01 8e 06 2c 07 00 02 39 0c 2a 15 01
E: 15.044839 14 01 03 01 8d 06 7b 07 00 02 39 0c 2a 15 01
E: 15.068783 14 01 03 01 8b 06 e5 07 00 02 39 0c 2a 15 01
E: 15.092835 14 01 03 01 8b 06 4e 08 00 02 39 0c 2a 15 01
E: 15.116838 14 01 03 01 98 06 ae 08 00 02 39 0c 2a 15 01
E: 15.140847 14 01 03 01 ba 06 23 09 00 02 39 0c 2a 15 01
E: 15.163841 14 01 03 01 e1 06 a4 09 00 02 39 0c 2a 15 01
E: 15.186837 14 01 03 01 fa 06 27 0a 00 02 39 0c 2a 15 01
E: 15.210840 14 01 03 01 04 07 a3 0a 00 02 39 0c 2a 15 01
E: 15.233841 14 01 03 01 06 07 f8 0a 00 02 39 0c 2a 15 01
E: 15.257839 14 01 03 01 04 07 1e 0b 00 02 39 0c 2a 15 01
E: 15.280838 14 01 03 01 02 07 27 0b 00 02 39 0c 2a 15 01
E: 15.304839 14 01 03 01 00 07 22 0b 00 02 39 0c 2a 15 01
E: 15.327839 14 01 03 01 00 07 1a 0b 00 02 39 0c 2a 15 01
E: 15.351840 14 01 03 01 00 07 15 0b 00 02 39 0c 2a 15 01
E: 15.374852 14 01 03 01 ff 06 12 0b 00 02 39 0c 2a 15 01
E: 15.398821 14 01 03 01 ff 06 11 0b 00 02 39 0c 2a 15 01
E: 15.421840 14 01 03 01 ff 06 12 0b 00 02 39 0c 2a 15 01
E: 15.444840 14 01 03 01 ff 06 12 0b 00 02 39 0c 2a 15 01
E: 15.468840 14 01 03 01 ff 06 12 0b 00 02 39 0c 2a 15 01
E: 15.491841 14 01 03 01 00 07 13 0b 00 02 39 0c 2a 15 01
E: 15.514824 14 01 03 01 00 07 13 0b 00 02 39 0c 2a 15 01
E: 15.538841 14 01 03 01 00 07 13 0b 00 02 39 0c 2a 15 01
E: 15.561841 14 01 03 01 00 07 13 0b 00 02 39 0c 2a 15 01
E: 15.584841 14 01 03 01 00 07 13 0b 00 02 39 0c 2a 15 01
E: 15.607843 14 01 03 01 00 07 13 0b 00 02 39 0c 2a 15 01
# Thank you.
