R: 344 05 0d 09 04 a1 01 85 01 09 22 a1 02 09 42 15 00 25 01 75 01 95 01 81 02 09 32 81 02 95 06 81 03 75 08 09 51 95 01 81 02 05 01 26 ff 3f 75 10 55 0e 65 11 09 30 35 00 46 1e 19 81 02 26 ff 3f 09 31 35 00 46 be 0f 81 02 26 ff 3f c0 a1 02 05 0d 09 42 15 00 25 01 75 01 95 01 81 02 09 32 81 02 95 06 81 03 75 08 09 51 95 01 81 02 05 01 26 ff 3f 75 10 55 0e 65 11 09 30 35 00 46 1e 19 81 02 26 ff 3f 09 31 35 00 46 be 0f 81 02 26 ff 3f c0 05 0d 09 54 95 01 75 08 25 02 81 02 85 02 09 55 25 02 b1 02 c0 09 0e a1 01 85 03 09 23 a1 02 09 52 09 53 15 00 25 0a 75 08 95 02 b1 02 c0 c0 05 01 09 02 a1 01 09 01 a1 00 85 04 05 09 95 03 75 01 19 01 29 03 15 00 25 01 81 02 95 01 75 05 81 01 05 01 75 10 95 02 09 30 09 31 15 00 26 ff 7f 81 02 c0 c0 05 0d 09 02 a1 01 85 05 09 20 a1 00 09 42 09 32 15 00 25 01 75 01 95 02 81 02 95 0e 81 03 05 01 26 ff 3f 75 10 95 01 55 0e 65 11 09 30 35 00 46 1e 19 81 02 26 ff 3f 09 31 35 00 46 be 0f 81 02 26 ff 3f c0 c0 06 00 ff 09 01 a1 01 85 06 19 01 29 40 15 00 26 ff 00 75 08 95 40 81 00 19 01 29 40 91 00 c0
N: Nexio Touch Device(HL) Nexio HID Multi-Touch NIB 420(42")
I: 3 1870 0100
E: 950.641960 14 01 00 01 da 27 ef 31 00 02 5b 22 ae 1d 00
E: 950.654944 14 01 03 01 da 27 ef 31 00 02 5b 22 ae 1d 01
E: 950.666957 14 01 03 01 da 27 ef 31 00 02 5b 22 ae 1d 01
E: 950.679863 14 01 03 01 da 27 ef 31 00 02 5b 22 ae 1d 01
E: 950.692958 14 01 03 01 da 27 ef 31 00 02 5b 22 ae 1d 01
E: 950.704890 14 01 03 01 da 27 ef 31 00 02 5b 22 ae 1d 01
E: 950.717862 14 01 03 01 da 27 ef 31 00 02 5b 22 ae 1d 01
E: 950.730930 14 01 03 01 6d 27 1b 32 00 02 5b 22 ae 1d 01
E: 950.743853 14 01 03 01 4b 27 36 32 00 02 5b 22 ae 1d 01
E: 950.755937 14 01 03 01 2b 27 46 32 00 02 5b 22 ae 1d 01
E: 950.768879 14 01 03 01 0a 27 4c 32 00 02 5b 22 ae 1d 01
E: 950.781888 14 01 03 01 e9 26 55 32 00 02 5b 22 ae 1d 01
E: 950.793888 14 01 03 01 c3 26 6b 32 00 02 5b 22 ae 1d 01
E: 950.806937 14 01 03 01 97 26 87 32 00 02 5b 22 ae 1d 01
E: 950.819944 14 01 03 01 67 26 9e 32 00 02 5b 22 ae 1d 01
E: 950.832877 14 01 03 01 37 26 b6 32 00 02 5b 22 ae 1d 01
E: 950.844875 14 01 03 01 05 26 d3 32 00 02 5b 22 ae 1d 01
E: 950.857861 14 01 03 01 ce 25 ed 32 00 02 5b 22 ae 1d 01
E: 950.870933 14 01 03 01 8f 25 fc 32 00 02 5b 22 ae 1d 01
E: 950.883891 14 01 03 01 4e 25 01 33 00 02 5b 22 ae 1d 01
E: 950.895869 14 01 03 01 10 25 01 33 00 02 5b 22 ae 1d 01
E: 950.908873 14 01 03 01 d3 24 ff 32 00 02 5b 22 ae 1d 01
E: 950.921860 14 01 03 01 8c 24 fe 32 00 02 5b 22 ae 1d 01
E: 950.933864 14 01 03 01 3b 24 fd 32 00 02 5b 22 ae 1d 01
E: 950.946872 14 01 03 01 ed 23 fc 32 00 02 5b 22 ae 1d 01
E: 950.959874 14 01 03 01 a7 23 fc 32 00 02 5b 22 ae 1d 01
E: 950.971881 14 01 03 01 5c 23 fc 32 00 02 5b 22 ae 1d 01
E: 950.984937 14 01 03 01 06 23 01 33 00 02 5b 22 ae 1d 01
E: 950.997958 14 01 03 01 ab 22 12 33 00 02 5b 22 ae 1d 01
E: 951.010862 14 01 03 01 55 22 28 33 00 02 5b 22 ae 1d 01
E: 951.022929 14 01 03 01 06 22 3b 33 00 02 5b 22 ae 1d 01
E: 951.035862 14 01 03 01 b9 21 4a 33 00 02 5b 22 ae 1d 01
E: 951.048911 14 01 03 01 69 21 55 33 00 02 5b 22 ae 1d 01
E: 951.061870 14 01 03 01 14 21 5c 33 00 02 5b 22 ae 1d 01
E: 951.073905 14 01 03 01 c2 20 60 33 00 02 5b 22 ae 1d 01
E: 951.086882 14 01 03 01 6e 20 67 33 00 02 5b 22 ae 1d 01
E: 951.099852 14 01 03 01 13 20 76 33 00 02 5b 22 ae 1d 01
E: 951.112957 14 01 03 01 b7 1f 8d 33 00 02 5b 22 ae 1d 01
E: 951.124874 14 01 03 01 61 1f a2 33 00 02 5b 22 ae 1d 01
E: 951.137873 14 01 03 01 0c 1f af 33 00 02 5b 22 ae 1d 01
E: 951.150945 14 01 03 01 b2 1e a9 33 00 02 5b 22 ae 1d 01
E: 951.163929 14 01 03 01 51 1e 82 33 00 02 5b 22 ae 1d 01
E: 951.175937 14 01 03 01 ed 1d 48 33 00 02 5b 22 ae 1d 01
E: 951.188879 14 01 03 01 88 1d 17 33 00 02 5b 22 ae 1d 01
E: 951.201825 14 01 03 01 23 1d fc 32 00 02 5b 22 ae 1d 01
E: 951.213862 14 01 03 01 bd 1c f3 32 00 02 5b 22 ae 1d 01
E: 951.226958 14 01 03 01 59 1c f4 32 00 02 5b 22 ae 1d 01
E: 951.239941 14 01 03 01 f4 1b f8 32 00 02 5b 22 ae 1d 01
E: 951.251864 14 01 03 01 8d 1b fb 32 00 02 5b 22 ae 1d 01
E: 951.264959 14 01 03 01 1f 1b f6 32 00 02 5b 22 ae 1d 01
E: 951.277866 14 01 03 01 ab 1a dd 32 00 02 5b 22 ae 1d 01
E: 951.290939 14 01 03 01 3a 1a af 32 00 02 5b 22 ae 1d 01
E: 951.302886 14 01 03 01 cd 19 7c 32 00 02 5b 22 ae 1d 01
E: 951.315958 14 01 03 01 64 19 57 32 00 02 5b 22 ae 1d 01
E: 951.328944 14 01 03 01 fd 18 3e 32 00 02 5b 22 ae 1d 01
E: 951.341867 14 01 03 01 96 18 21 32 00 02 5b 22 ae 1d 01
E: 951.353888 14 01 03 01 33 18 f9 31 00 02 5b 22 ae 1d 01
E: 951.366864 14 01 03 01 d2 17 cb 31 00 02 5b 22 ae 1d 01
E: 951.379911 14 01 03 01 6f 17 a7 31 00 02 5b 22 ae 1d 01
E: 951.392871 14 01 03 01 0d 17 8b 31 00 02 5b 22 ae 1d 01
E: 951.404866 14 01 03 01 b0 16 6a 31 00 02 5b 22 ae 1d 01
E: 951.417883 14 01 03 01 5a 16 42 31 00 02 5b 22 ae 1d 01
E: 951.430875 14 01 03 01 05 16 16 31 00 02 5b 22 ae 1d 01
E: 951.442862 14 01 03 01 af 15 eb 30 00 02 5b 22 ae 1d 01
E: 951.455861 14 01 03 01 62 15 c1 30 00 02 5b 22 ae 1d 01
E: 951.468879 14 01 03 01 22 15 9d 30 00 02 5b 22 ae 1d 01
E: 951.480861 14 01 02 01 22 15 9d 30 00 02 5b 22 ae 1d 01
E: 951.481851 14 01 02 01 22 15 9d 30 00 02 5b 22 ae 1d 01
E: 954.842958 14 01 00 01 fe 2a 24 29 00 02 5b 22 ae 1d 00
E: 954.855886 14 01 03 01 fe 2a 24 29 00 02 5b 22 ae 1d 01
E: 954.868947 14 01 03 01 fe 2a 24 29 00 02 5b 22 ae 1d 01
E: 954.881866 14 01 03 01 fe 2a 24 29 00 02 5b 22 ae 1d 01
E: 954.893875 14 01 03 01 fa 2a a0 29 00 02 5b 22 ae 1d 01
E: 954.906867 14 01 03 01 ff 2a e6 29 00 02 5b 22 ae 1d 01
E: 954.919941 14 01 03 01 00 2b 23 2a 00 02 5b 22 ae 1d 01
E: 954.931958 14 01 03 01 ff 2a 5d 2a 00 02 5b 22 ae 1d 01
E: 954.944861 14 01 03 01 fb 2a 95 2a 00 02 5b 22 ae 1d 01
E: 954.957872 14 01 03 01 ee 2a c5 2a 00 02 5b 22 ae 1d 01
E: 954.970875 14 01 03 01 d7 2a ee 2a 00 02 5b 22 ae 1d 01
E: 954.982892 14 01 03 01 bc 2a 1c 2b 00 02 5b 22 ae 1d 01
E: 954.995889 14 01 03 01 a5 2a 54 2b 00 02 5b 22 ae 1d 01
E: 955.008957 14 01 03 01 95 2a 8b 2b 00 02 5b 22 ae 1d 01
E: 955.020874 14 01 03 01 87 2a bd 2b 00 02 5b 22 ae 1d 01
E: 955.033873 14 01 03 01 73 2a ec 2b 00 02 5b 22 ae 1d 01
E: 955.046893 14 01 03 01 58 2a 19 2c 00 02 5b 22 ae 1d 01
E: 955.059876 14 01 03 01 42 2a 45 2c 00 02 5b 22 ae 1d 01
E: 955.071957 14 01 03 01 2f 2a 71 2c 00 02 5b 22 ae 1d 01
E: 955.084869 14 01 03 01 17 2a 9e 2c 00 02 5b 22 ae 1d 01
E: 955.097869 14 01 03 01 f7 29 cb 2c 00 02 5b 22 ae 1d 01
E: 955.109873 14 01 03 01 d8 29 f3 2c 00 02 5b 22 ae 1d 01
E: 955.122858 14 01 03 01 b7 29 15 2d 00 02 5b 22 ae 1d 01
E: 955.135944 14 01 03 01 93 29 3f 2d 00 02 5b 22 ae 1d 01
E: 955.148879 14 01 03 01 74 29 71 2d 00 02 5b 22 ae 1d 01
E: 955.160948 14 01 03 01 59 29 9c 2d 00 02 5b 22 ae 1d 01
E: 955.173868 14 01 03 01 40 29 b6 2d 00 02 5b 22 ae 1d 01
E: 955.186861 14 01 03 01 26 29 cb 2d 00 02 5b 22 ae 1d 01
E: 955.198871 14 01 03 01 0c 29 e5 2d 00 02 5b 22 ae 1d 01
E: 955.211861 14 01 03 01 ee 28 03 2e 00 02 5b 22 ae 1d 01
E: 955.224940 14 01 03 01 cb 28 24 2e 00 02 5b 22 ae 1d 01
E: 955.237853 14 01 03 01 b0 28 45 2e 00 02 5b 22 ae 1d 01
E: 955.249865 14 01 03 01 9d 28 5d 2e 00 02 5b 22 ae 1d 01
E: 955.262869 14 01 03 01 89 28 6a 2e 00 02 5b 22 ae 1d 01
E: 955.275937 14 01 03 01 72 28 6e 2e 00 02 5b 22 ae 1d 01
E: 955.287946 14 01 03 01 5a 28 71 2e 00 02 5b 22 ae 1d 01
E: 955.300875 14 01 03 01 42 28 7e 2e 00 02 5b 22 ae 1d 01
E: 955.313877 14 01 03 01 26 28 97 2e 00 02 5b 22 ae 1d 01
E: 955.326852 14 01 03 01 04 28 b1 2e 00 02 5b 22 ae 1d 01
E: 955.338934 14 01 03 01 e8 27 c1 2e 00 02 5b 22 ae 1d 01
E: 955.351861 14 01 03 01 d4 27 c7 2e 00 02 5b 22 ae 1d 01
E: 955.364935 14 01 03 01 d4 27 c7 2e 00 02 5b 22 ae 1d 01
E: 955.377875 14 01 00 01 75 27 c4 2e 00 02 af 10 3b 31 00
E: 955.390863 14 01 00 01 4d 27 a2 2e 00 02 a0 10 10 31 00
E: 955.403866 14 01 00 01 48 27 c3 2e 00 02 a4 10 1b 31 00
E: 955.416887 14 01 00 01 3f 27 f0 2e 00 02 a9 10 22 31 00
E: 955.429872 14 01 00 01 3f 27 f0 2e 00 02 a9 10 22 31 00
E: 955.441871 14 01 00 01 2a 27 22 2f 00 02 a8 10 f9 30 00
E: 955.454935 14 01 03 01 05 27 66 2f 03 02 9c 10 93 30 02
E: 955.467957 14 01 03 01 db 26 a0 2f 03 02 8b 10 1e 30 02
E: 955.480865 14 01 03 01 b7 26 b4 2f 03 02 80 10 c7 2f 02
E: 955.493893 14 01 03 01 95 26 ae 2f 03 02 7b 10 95 2f 02
E: 955.506858 14 01 03 01 72 26 95 2f 03 02 7a 10 78 2f 02
E: 955.518934 14 01 03 01 52 26 69 2f 03 02 76 10 55 2f 02
E: 955.531888 14 01 03 01 37 26 3c 2f 03 02 68 10 34 2f 02
E: 955.544876 14 01 03 01 1d 26 20 2f 03 02 58 10 1f 2f 02
E: 955.557872 14 01 03 01 03 26 13 2f 03 02 4b 10 14 2f 02
E: 955.570856 14 01 03 01 e8 25 2c 2f 03 02 3c 10 f0 2e 02
E: 955.583957 14 01 03 01 ca 25 7e 2f 03 02 2b 10 8c 2e 02
E: 955.596868 14 01 03 01 a7 25 dd 2f 03 02 1e 10 06 2e 02
E: 955.608957 14 01 03 01 87 25 1c 30 03 02 18 10 85 2d 02
E: 955.621869 14 01 03 01 65 25 37 30 03 02 16 10 15 2d 02
E: 955.634957 14 01 03 01 3e 25 3c 30 03 02 16 10 b3 2c 02
E: 955.647943 14 01 03 01 18 25 3f 30 03 02 17 10 59 2c 02
E: 955.660887 14 01 03 01 f5 24 52 30 03 02 18 10 02 2c 02
E: 955.673893 14 01 03 01 d1 24 79 30 03 02 13 10 ab 2b 02
E: 955.686834 14 01 03 01 a7 24 a8 30 03 02 05 10 52 2b 02
E: 955.699927 14 01 03 01 7c 24 cd 30 03 02 f4 0f f9 2a 02
E: 955.712847 14 01 03 01 58 24 e1 30 03 02 e9 0f 9f 2a 02
E: 955.725861 14 01 03 01 36 24 ec 30 03 02 e4 0f 44 2a 02
E: 955.738959 14 01 03 01 0f 24 00 31 03 02 e3 0f e7 29 02
E: 955.751873 14 01 03 01 e5 23 28 31 03 02 e8 0f 88 29 02
E: 955.764957 14 01 03 01 b9 23 5a 31 03 02 f6 0f 1f 29 02
E: 955.777866 14 01 03 01 92 23 81 31 03 02 08 10 ae 28 02
E: 955.790958 14 01 03 01 6d 23 96 31 03 02 15 10 42 28 02
E: 955.803877 14 01 03 01 44 23 9c 31 03 02 23 10 dc 27 02
E: 955.816957 14 01 03 01 16 23 a6 31 03 02 33 10 7b 27 02
E: 955.829876 14 01 03 01 e4 22 c8 31 03 02 42 10 1c 27 02
E: 955.842884 14 01 03 01 b2 22 fe 31 03 02 4a 10 bf 26 02
E: 955.855935 14 01 03 01 81 22 2d 32 03 02 51 10 65 26 02
E: 955.868867 14 01 03 01 52 22 48 32 03 02 63 10 0e 26 02
E: 955.881874 14 01 03 01 25 22 51 32 03 02 81 10 b8 25 02
E: 955.894867 14 01 03 01 fa 21 58 32 03 02 9d 10 69 25 02
E: 955.907938 14 01 03 01 c9 21 76 32 03 02 ad 10 1d 25 02
E: 955.920958 14 01 03 01 93 21 ab 32 03 02 b3 10 d4 24 02
E: 955.933864 14 01 03 01 5b 21 dc 32 03 02 bd 10 8c 24 02
E: 955.946956 14 01 03 01 23 21 f9 32 03 02 d8 10 3f 24 02
E: 955.959861 14 01 03 01 ed 20 04 33 03 02 f9 10 f6 23 02
E: 955.972897 14 01 03 01 b6 20 05 33 03 02 18 11 b1 23 02
E: 955.985869 14 01 03 01 7e 20 0b 33 03 02 3e 11 6e 23 02
E: 955.998886 14 01 03 01 46 20 2b 33 03 02 61 11 3b 23 02
E: 956.011853 14 01 03 01 04 20 61 33 03 02 75 11 0f 23 02
E: 956.024932 14 01 03 01 b6 1f 92 33 03 02 7d 11 d4 22 02
E: 956.037944 14 01 03 01 6a 1f ae 33 03 02 87 11 9c 22 02
E: 956.050867 14 01 03 01 24 1f b9 33 03 02 a2 11 78 22 02
E: 956.063949 14 01 03 01 e2 1e c0 33 03 02 c2 11 60 22 02
E: 956.075850 14 01 03 01 e2 1e c0 33 03 02 c2 11 60 22 02
E: 956.088957 14 01 03 01 a0 1e dc 33 03 02 e1 11 3b 22 02
E: 956.101873 14 01 03 01 50 1e 10 34 03 02 07 12 08 22 02
E: 956.114958 14 01 03 01 f9 1d 42 34 03 02 2a 12 db 21 02
E: 956.127944 14 01 03 01 a5 1d 60 34 03 02 3e 12 b8 21 02
E: 956.140865 14 01 03 01 4e 1d 6c 34 03 02 46 12 8e 21 02
E: 956.153870 14 01 03 01 f1 1c 73 34 03 02 46 12 5a 21 02
E: 956.166858 14 01 03 01 8f 1c 89 34 03 02 44 12 2c 21 02
E: 956.179944 14 01 03 01 2a 1c b1 34 03 02 4c 12 11 21 02
E: 956.192869 14 01 03 01 bd 1b e2 34 03 02 68 12 07 21 02
E: 956.205893 14 01 03 01 bd 1b e2 34 03 02 68 12 07 21 02
E: 956.218873 14 01 02 01 bd 1b e2 34 02 02 68 12 21 21 02
E: 956.230931 14 01 00 01 cf 17 41 2d 00 02 68 12 07 21 00
E: 956.255888 14 01 03 01 ef 14 63 26 00 02 68 12 07 21 01
E: 956.268873 14 01 03 01 33 13 c7 21 00 02 68 12 07 21 01
E: 956.281872 14 01 03 01 8e 12 af 1f 00 02 68 12 07 21 01
E: 956.293882 14 01 03 01 88 12 3f 1f 00 02 68 12 07 21 01
E: 956.306870 14 01 03 01 b8 12 84 1f 00 02 68 12 07 21 01
E: 956.331837 14 01 03 01 f2 12 da 1f 00 02 68 12 07 21 01
E: 956.344853 14 01 03 01 2c 13 f9 1f 00 02 68 12 07 21 01
E: 956.357895 14 01 03 01 59 13 e7 1f 00 02 68 12 07 21 01
E: 956.382944 14 01 03 01 7b 13 c5 1f 00 02 68 12 07 21 01
E: 956.395957 14 01 03 01 9f 13 a1 1f 00 02 68 12 07 21 01
E: 956.408938 14 01 03 01 bf 13 7a 1f 00 02 68 12 07 21 01
E: 956.420955 14 01 03 01 d2 13 53 1f 00 02 68 12 07 21 01
E: 956.445945 14 01 03 01 e3 13 2a 1f 00 02 68 12 07 21 01
E: 956.458889 14 01 03 01 00 14 fe 1e 00 02 68 12 07 21 01
E: 956.471861 14 01 03 01 1f 14 cf 1e 00 02 68 12 07 21 01
E: 956.483936 14 01 03 01 33 14 a5 1e 00 02 68 12 07 21 01
E: 956.496877 14 01 03 01 45 14 7e 1e 00 02 68 12 07 21 01
E: 956.509930 14 01 03 01 64 14 5b 1e 00 02 68 12 07 21 01
E: 956.522867 14 01 03 01 84 14 42 1e 00 02 68 12 07 21 01
E: 956.534936 14 01 03 01 98 14 2c 1e 00 02 68 12 07 21 01
E: 956.547888 14 01 03 01 aa 14 0f 1e 00 02 68 12 07 21 01
E: 956.560856 14 01 03 01 c8 14 f0 1d 00 02 68 12 07 21 01
E: 956.573871 14 01 03 01 e8 14 cf 1d 00 02 68 12 07 21 01
E: 956.585876 14 01 03 01 06 15 ab 1d 00 02 68 12 07 21 01
E: 956.598880 14 01 03 01 2c 15 86 1d 00 02 68 12 07 21 01
E: 956.611848 14 01 03 01 4f 15 5f 1d 00 02 68 12 07 21 01
E: 956.623861 14 01 03 01 6d 15 3a 1d 00 02 68 12 07 21 01
E: 956.636870 14 01 03 01 91 15 17 1d 00 02 68 12 07 21 01
E: 956.661846 14 01 03 01 bd 15 ec 1c 00 02 68 12 07 21 01
E: 956.674872 14 01 03 01 ee 15 ba 1c 00 02 68 12 07 21 01
E: 956.687957 14 01 03 01 21 16 91 1c 00 02 68 12 07 21 01
E: 956.699885 14 01 03 01 55 16 7a 1c 00 02 68 12 07 21 01
E: 956.712854 14 01 03 01 84 16 6e 1c 00 02 68 12 07 21 01
E: 956.725870 14 01 03 01 ae 16 5c 1c 00 02 68 12 07 21 01
E: 956.738851 14 01 03 01 d5 16 45 1c 00 02 68 12 07 21 01
E: 956.750945 14 01 03 01 f9 16 2f 1c 00 02 68 12 07 21 01
E: 956.763843 14 01 03 01 22 17 1f 1c 00 02 68 12 07 21 01
E: 956.776932 14 01 03 01 46 17 0c 1c 00 02 68 12 07 21 01
E: 956.788871 14 01 03 01 64 17 f1 1b 00 02 68 12 07 21 01
E: 956.801852 14 01 03 01 89 17 d8 1b 00 02 68 12 07 21 01
E: 956.814888 14 01 02 01 89 17 d8 1b 00 02 68 12 07 21 01
E: 956.816871 14 01 02 01 89 17 d8 1b 00 02 68 12 07 21 01
