R: 76 05 0d 09 04 a1 01 09 22 a1 00 09 51 15 00 25 0f 75 04 95 01 81 02 09 42 15 00 25 01 75 01 95 01 81 02 09 32 81 02 09 47 81 02 81 01 05 01 75 10 95 01 09 30 26 ff 07 81 02 09 31 26 ff 07 81 02 05 0d 09 55 75 08 95 05 b1 02 c0 c0
N: PenMount PM1400A
I: 3 14e1 3500
# 1. Drag _one_ finger on the screen from one corner to the opposite, and release it.
E: 0.000000 5 70 34 00 48 00
E: 0.008781 5 70 34 00 48 00
E: 0.016463 5 70 34 00 48 00
E: 0.026909 5 70 34 00 48 00
E: 0.033905 5 70 34 00 48 00
E: 0.043870 5 70 34 00 48 00
E: 0.051843 5 70 34 00 48 00
E: 0.062073 5 70 34 00 48 00
E: 0.071922 5 70 34 00 48 00
E: 0.079853 5 70 34 00 48 00
E: 0.090425 5 70 34 00 48 00
E: 0.097926 5 70 34 00 48 00
E: 0.105887 5 70 34 00 48 00
E: 0.115902 5 70 34 00 48 00
E: 0.124725 5 70 34 00 48 00
E: 0.133973 5 70 34 00 48 00
E: 0.141924 5 70 34 00 48 00
E: 0.149952 5 70 34 00 48 00
E: 0.159897 5 70 34 00 48 00
E: 0.167896 5 70 34 00 48 00
E: 0.181893 5 70 34 00 48 00
E: 0.195865 5 70 34 00 48 00
E: 0.205888 5 70 34 00 48 00
E: 0.217892 5 70 34 00 48 00
E: 0.227893 5 70 34 00 48 00
E: 0.240075 5 70 37 00 48 00
E: 0.251874 5 70 3b 00 4b 00
E: 0.266033 5 70 3c 00 4d 00
E: 0.282162 5 70 40 00 4f 00
E: 0.293939 5 70 46 00 53 00
E: 0.305955 5 70 4d 00 58 00
E: 0.318083 5 70 57 00 61 00
E: 0.333999 5 70 62 00 67 00
E: 0.341948 5 70 71 00 72 00
E: 0.355881 5 70 83 00 7d 00
E: 0.366010 5 70 97 00 8d 00
E: 0.377832 5 70 ae 00 9e 00
E: 0.389956 5 70 c4 00 b2 00
E: 0.398076 5 70 da 00 c2 00
E: 0.406176 5 70 ee 00 cf 00
E: 0.417847 5 70 fb 00 d8 00
E: 0.431833 5 70 0e 01 e5 00
E: 0.444150 5 70 1f 01 f2 00
E: 0.455892 5 70 2e 01 00 01
E: 0.463824 5 70 40 01 0d 01
E: 0.475964 5 70 52 01 1a 01
E: 0.487886 5 70 62 01 27 01
E: 0.498120 5 70 72 01 32 01
E: 0.510085 5 70 83 01 40 01
E: 0.523868 5 70 8e 01 49 01
E: 0.535872 5 70 a2 01 5a 01
E: 0.547870 5 70 b3 01 6a 01
E: 0.559864 5 70 c3 01 77 01
E: 0.571913 5 70 d5 01 86 01
E: 0.582057 5 70 e7 01 94 01
E: 0.595877 5 70 f7 01 a1 01
E: 0.607877 5 70 08 02 ae 01
E: 0.620044 5 70 18 02 bb 01
E: 0.631873 5 70 25 02 c6 01
E: 0.639939 5 70 37 02 d6 01
E: 0.650013 5 70 48 02 e5 01
E: 0.660056 5 70 58 02 f3 01
E: 0.672048 5 70 69 02 00 02
E: 0.682148 5 70 77 02 0d 02
E: 0.693895 5 70 85 02 18 02
E: 0.702163 5 70 92 02 25 02
E: 0.718157 5 70 a1 02 33 02
E: 0.727877 5 70 ae 02 40 02
E: 0.742019 5 70 bc 02 4d 02
E: 0.756087 5 70 cb 02 5a 02
E: 0.772118 5 70 d7 02 63 02
E: 0.783919 5 70 e7 02 73 02
E: 0.794063 5 70 f8 02 80 02
E: 0.806069 5 70 06 03 8d 02
E: 0.813895 5 70 17 03 9a 02
E: 0.826063 5 70 27 03 a8 02
E: 0.837931 5 70 38 03 b7 02
E: 0.848085 5 70 48 03 c7 02
E: 0.858087 5 70 5a 03 d4 02
E: 0.868094 5 70 6a 03 e3 02
E: 0.880087 5 70 7c 03 f5 02
E: 0.892030 5 70 8b 03 04 03
E: 0.903908 5 70 9c 03 14 03
E: 0.915875 5 70 ac 03 25 03
E: 0.929893 5 70 bd 03 37 03
E: 0.940045 5 70 cd 03 49 03
E: 0.950092 5 70 df 03 5a 03
E: 0.959889 5 70 f1 03 6a 03
E: 0.972082 5 70 03 04 7c 03
E: 0.983901 5 70 14 04 8d 03
E: 0.995871 5 70 27 04 9d 03
E: 1.005900 5 70 3b 04 ac 03
E: 1.016315 5 70 4f 04 be 03
E: 1.027875 5 70 64 04 cd 03
E: 1.039880 5 70 76 04 df 03
E: 1.050160 5 70 8a 04 f1 03
E: 1.058063 5 70 9d 04 00 04
E: 1.070070 5 70 af 04 10 04
E: 1.079884 5 70 c2 04 21 04
E: 1.092064 5 70 d4 04 31 04
E: 1.104035 5 70 e6 04 40 04
E: 1.115869 5 70 f6 04 50 04
E: 1.127863 5 70 08 05 5f 04
E: 1.139864 5 70 19 05 71 04
E: 1.151881 5 70 29 05 80 04
E: 1.160091 5 70 3b 05 90 04
E: 1.172079 5 70 4b 05 9f 04
E: 1.183860 5 70 5a 05 af 04
E: 1.195898 5 70 6b 05 be 04
E: 1.205870 5 70 79 05 cd 04
E: 1.214875 5 70 88 05 dd 04
E: 1.224105 5 70 97 05 ec 04
E: 1.234091 5 70 a1 05 f5 04
E: 1.244120 5 70 b0 05 07 05
E: 1.255915 5 70 bd 05 14 05
E: 1.266100 5 70 c8 05 21 05
E: 1.273970 5 70 d4 05 2f 05
E: 1.284094 5 70 df 05 3c 05
E: 1.294375 5 70 eb 05 47 05
E: 1.306048 5 70 f6 05 52 05
E: 1.316134 5 70 02 06 5f 05
E: 1.327875 5 70 0d 06 6a 05
E: 1.342169 5 70 19 06 75 05
E: 1.353850 5 70 22 06 83 05
E: 1.364090 5 70 30 06 8e 05
E: 1.376119 5 70 38 06 99 05
E: 1.386109 5 70 45 06 a8 05
E: 1.398109 5 70 52 06 b8 05
E: 1.410054 5 70 5e 06 c7 05
E: 1.420058 5 70 66 06 d2 05
E: 1.432085 5 70 73 06 e4 05
E: 1.440085 5 70 80 06 f3 05
E: 1.448116 5 70 8d 06 03 06
E: 1.457880 5 70 99 06 12 06
E: 1.470060 5 70 a4 06 1f 06
E: 1.480042 5 70 ac 06 28 06
E: 1.490063 5 70 b8 06 38 06
E: 1.502123 5 70 c2 06 45 06
E: 1.512037 5 70 c8 06 4e 06
E: 1.526048 5 70 d5 06 59 06
E: 1.534041 5 70 dc 06 62 06
E: 1.542097 5 70 e4 06 6a 06
E: 1.550083 5 70 eb 06 71 06
E: 1.563891 5 70 ee 06 78 06
E: 1.574054 5 70 f5 06 7e 06
E: 1.584055 5 70 f9 06 85 06
E: 1.596052 5 70 fb 06 89 06
E: 1.607885 5 70 fe 06 8c 06
E: 1.619849 5 70 02 07 92 06
E: 1.630041 5 70 05 07 97 06
E: 1.642093 5 70 07 07 99 06
E: 1.653865 5 70 08 07 9d 06
E: 1.665859 5 70 0c 07 a2 06
E: 1.677862 5 70 0d 07 a4 06
E: 1.689847 5 70 0f 07 a6 06
E: 1.701871 5 70 10 07 a8 06
E: 1.713915 5 70 12 07 aa 06
E: 1.723850 5 70 12 07 aa 06
E: 1.736066 5 70 14 07 ad 06
E: 1.747887 5 70 14 07 ad 06
E: 1.762086 5 70 15 07 ad 06
E: 1.774010 5 70 15 07 af 06
E: 1.787899 5 70 15 07 af 06
E: 1.803899 5 70 17 07 af 06
E: 1.817925 5 70 17 07 b1 06
E: 1.831887 5 70 17 07 b1 06
E: 1.847883 5 70 17 07 b1 06
E: 1.862017 5 70 19 07 b3 06
E: 1.876071 5 70 1a 07 b5 06
E: 1.892088 5 70 1c 07 b8 06
E: 1.906090 5 70 1e 07 b8 06
E: 1.919880 5 70 1e 07 ba 06
E: 1.935876 5 70 1f 07 ba 06
E: 1.949872 5 70 21 07 ba 06
E: 1.963878 5 70 23 07 ba 06
E: 1.979975 5 70 24 07 bc 06
E: 1.994140 5 70 26 07 be 06
E: 2.009892 5 70 26 07 be 06
E: 2.023881 5 70 26 07 be 06
E: 2.037911 5 70 29 07 c1 06
E: 2.051952 5 70 29 07 c1 06
E: 2.067925 5 70 29 07 c1 06
E: 2.082076 5 70 2b 07 c1 06
E: 2.096099 5 70 2c 07 c1 06
E: 2.109866 5 70 2c 07 c1 06
E: 2.120055 5 70 2e 07 c1 06
E: 2.128255 5 70 30 07 c1 06
E: 2.143919 5 70 30 07 c1 06
E: 2.158065 5 70 31 07 c3 06
E: 2.169868 5 70 31 07 c3 06
E: 2.182050 5 70 33 07 c5 06
E: 2.192117 5 70 35 07 c7 06
E: 2.204082 5 70 36 07 c9 06
E: 2.216054 5 70 38 07 cc 06
E: 2.228065 5 70 3a 07 ce 06
E: 2.240053 5 70 3b 07 d0 06
E: 2.250303 5 70 3d 07 d2 06
E: 2.262103 5 70 40 07 d9 06
E: 2.274043 5 70 42 07 dd 06
E: 2.285904 5 70 43 07 e2 06
E: 2.296078 5 70 47 07 e8 06
E: 2.306064 5 70 48 07 ea 06
E: 2.317847 5 70 4a 07 f1 06
E: 2.328040 5 70 4d 07 f6 06
E: 2.342056 5 70 4f 07 fa 06
E: 2.349917 5 70 54 07 03 07
E: 2.362017 5 70 59 07 0c 07
E: 2.374008 5 70 5e 07 19 07
E: 2.384050 5 70 63 07 22 07
E: 2.394154 5 70 6b 07 2f 07
E: 2.405929 5 70 6e 07 38 07
E: 2.416030 5 70 76 07 43 07
E: 2.425876 5 70 7b 07 4c 07
E: 2.437851 5 70 7e 07 50 07
E: 2.448077 5 70 87 07 5b 07
E: 2.455899 5 70 8c 07 62 07
E: 2.466097 5 70 92 07 6d 07
E: 2.474048 5 70 97 07 73 07
E: 2.481853 5 70 9c 07 78 07
E: 2.489880 5 70 9e 07 7c 07
E: 2.500066 5 70 a4 07 83 07
E: 2.508059 5 70 a7 07 87 07
E: 2.518086 5 70 ab 07 8c 07
E: 2.527865 5 70 ae 07 90 07
E: 2.536074 5 70 b0 07 92 07
E: 2.543836 5 70 b0 07 92 07
E: 2.552041 5 70 b1 07 95 07
E: 2.561921 5 70 b6 07 9b 07
E: 2.572030 5 70 ba 07 a0 07
E: 2.582055 5 70 bb 07 a2 07
E: 2.594048 5 70 be 07 a4 07
E: 2.604080 5 70 be 07 a6 07
E: 2.614012 5 70 c0 07 a6 07
E: 2.626016 5 70 c0 07 a8 07
E: 2.636071 5 70 c2 07 a8 07
E: 2.646054 5 70 c2 07 ab 07
E: 2.658051 5 70 c3 07 ad 07
E: 2.667977 5 70 c7 07 af 07
E: 2.678198 5 70 c8 07 b1 07
E: 2.690099 5 70 cc 07 b6 07
E: 2.700109 5 70 cd 07 b8 07
E: 2.710103 5 70 cf 07 ba 07
E: 2.722054 5 70 d1 07 bc 07
E: 2.732079 5 70 d2 07 be 07
E: 2.741866 5 70 d2 07 be 07
E: 2.753987 5 70 d4 07 c1 07
E: 2.764165 5 70 d5 07 c3 07
E: 2.773874 5 70 d5 07 c3 07
E: 2.785852 5 70 d5 07 c3 07
E: 2.796020 5 70 d7 07 c5 07
E: 2.807894 5 70 d7 07 c5 07
E: 2.817854 5 70 d7 07 c5 07
E: 2.828063 5 70 d9 07 c7 07
E: 2.839913 5 70 d9 07 c7 07
E: 2.849852 5 70 d9 07 c7 07
E: 2.860025 5 70 da 07 ca 07
E: 2.871909 5 70 da 07 ca 07
E: 2.881848 5 70 da 07 ca 07
E: 2.891856 5 70 da 07 ca 07
E: 2.903819 5 70 da 07 ca 07
E: 2.913813 5 70 da 07 ca 07
E: 2.924027 5 70 dc 07 cc 07
E: 2.935893 5 70 dc 07 cc 07
E: 2.945920 5 70 dc 07 cc 07
E: 2.955861 5 70 dc 07 cc 07
E: 2.967869 5 70 dc 07 cc 07
E: 2.977875 5 70 dc 07 cc 07
E: 2.987854 5 70 dc 07 cc 07
E: 2.999950 5 70 dc 07 cc 07
E: 3.009920 5 70 dc 07 cc 07
E: 3.019862 5 70 dc 07 cc 07
E: 3.031870 5 70 dc 07 cc 07
E: 3.041866 5 70 dc 07 cc 07
E: 3.051870 5 70 dc 07 cc 07
E: 3.063870 5 70 dc 07 cc 07
E: 3.073869 5 70 dc 07 cc 07
E: 3.085870 5 70 dc 07 cc 07
E: 3.095855 5 70 dc 07 cc 07
E: 3.105853 5 70 dc 07 cc 07
E: 3.117878 5 70 dc 07 cc 07
E: 3.127865 5 70 dc 07 cc 07
E: 3.137869 5 70 dc 07 cc 07
E: 3.149866 5 70 dc 07 cc 07
E: 3.157853 5 70 dc 07 cc 07
E: 3.170137 5 70 da 07 ca 07
E: 3.181917 5 70 da 07 ca 07
E: 3.191866 5 70 da 07 ca 07
E: 3.203867 5 70 da 07 ca 07
E: 3.214179 5 40 da 07 ca 07
# 2. Land one finger,
   - land a second finger far enough from the first
   - move your two fingers
   - release the *first* finger
   - release the second finger
E: 7.533915 5 70 52 01 fe 03
E: 7.536305 5 71 0b 06 63 04
E: 7.547930 5 70 52 01 fe 03
E: 7.549931 5 71 0b 06 63 04
E: 7.561866 5 70 52 01 fe 03
E: 7.565833 5 71 0b 06 63 04
E: 7.577874 5 70 52 01 fe 03
E: 7.581844 5 71 0b 06 66 04
E: 7.591833 5 70 52 01 fe 03
E: 7.593768 5 71 0b 06 66 04
E: 7.605799 5 70 52 01 fe 03
E: 7.607787 5 71 0b 06 66 04
E: 7.621838 5 70 52 01 fe 03
E: 7.623963 5 71 0b 06 68 04
E: 7.635815 5 70 52 01 fe 03
E: 7.637778 5 71 0b 06 68 04
E: 7.649768 5 70 52 01 fe 03
E: 7.653778 5 71 0b 06 68 04
E: 7.665818 5 70 52 01 fe 03
E: 7.667818 5 71 0b 06 68 04
E: 7.679788 5 70 52 01 fe 03
E: 7.683995 5 71 0b 06 6a 04
E: 7.695837 5 70 52 01 fe 03
E: 7.697960 5 71 0b 06 6c 04
E: 7.709849 5 70 52 01 fe 03
E: 7.714092 5 71 0b 06 71 04
E: 7.723822 5 70 52 01 fe 03
E: 7.727831 5 71 0b 06 71 04
E: 7.739812 5 70 52 01 fe 03
E: 7.744014 5 71 0b 06 73 04
E: 7.755854 5 70 52 01 fe 03
E: 7.758038 5 71 0b 06 75 04
E: 7.769856 5 70 52 01 fe 03
E: 7.771822 5 71 0b 06 75 04
E: 7.785832 5 70 52 01 fe 03
E: 7.788041 5 71 0b 06 77 04
E: 7.801835 5 70 52 01 fe 03
E: 7.803816 5 71 0b 06 77 04
E: 7.817833 5 70 52 01 fe 03
E: 7.819816 5 71 0b 06 77 04
E: 7.833830 5 70 52 01 fe 03
E: 7.838015 5 71 0b 06 7a 04
E: 7.850279 5 70 52 01 00 04
E: 7.851971 5 71 0b 06 7a 04
E: 7.863833 5 70 52 01 00 04
E: 7.865894 5 71 0b 06 7a 04
E: 7.879839 5 70 52 01 00 04
E: 7.884097 5 71 0b 06 7c 04
E: 7.895833 5 70 52 01 00 04
E: 7.897814 5 71 0b 06 7c 04
E: 7.911826 5 70 52 01 00 04
E: 7.913842 5 71 0b 06 7c 04
E: 7.925831 5 70 52 01 00 04
E: 7.928039 5 71 0b 06 7e 04
E: 7.941823 5 70 52 01 00 04
E: 7.945830 5 71 0b 06 7e 04
E: 7.958106 5 70 52 01 02 04
E: 7.961808 5 71 0b 06 7e 04
E: 7.973810 5 70 52 01 02 04
E: 7.977837 5 71 0b 06 7e 04
E: 7.989830 5 70 52 01 02 04
E: 7.991816 5 71 0b 06 7e 04
E: 8.006103 5 70 52 01 05 04
E: 8.007991 5 71 0b 06 80 04
E: 8.021857 5 70 52 01 05 04
E: 8.026168 5 71 0b 06 82 04
E: 8.037099 5 70 52 01 05 04
E: 8.039819 5 71 0b 06 82 04
E: 8.051852 5 70 52 01 05 04
E: 8.053812 5 71 0b 06 82 04
E: 8.067830 5 70 52 01 05 04
E: 8.070025 5 71 0d 06 85 04
E: 8.083805 5 70 52 01 05 04
E: 8.087811 5 71 0d 06 85 04
E: 8.097865 5 70 52 01 05 04
E: 8.102021 5 71 0d 06 87 04
E: 8.113831 5 70 52 01 05 04
E: 8.118058 5 71 0d 06 89 04
E: 8.129831 5 70 52 01 05 04
E: 8.131817 5 71 0d 06 89 04
E: 8.145816 5 70 52 01 05 04
E: 8.147982 5 71 0f 06 8b 04
E: 8.161831 5 70 52 01 05 04
E: 8.163815 5 71 0f 06 8b 04
E: 8.177834 5 70 52 01 05 04
E: 8.179815 5 71 0f 06 8b 04
E: 8.193814 5 70 52 01 05 04
E: 8.196002 5 71 0f 06 8d 04
E: 8.209856 5 70 52 01 05 04
E: 8.211814 5 71 0f 06 8d 04
E: 8.225833 5 70 52 01 05 04
E: 8.228048 5 71 10 06 8d 04
E: 8.241809 5 70 52 01 05 04
E: 8.243816 5 71 10 06 8d 04
E: 8.255856 5 70 52 01 05 04
E: 8.258015 5 71 10 06 90 04
E: 8.271828 5 70 52 01 05 04
E: 8.273813 5 71 10 06 90 04
E: 8.287848 5 70 52 01 05 04
E: 8.289829 5 71 10 06 90 04
E: 8.303828 5 70 52 01 05 04
E: 8.306042 5 71 12 06 90 04
E: 8.320175 5 70 52 01 02 04
E: 8.321899 5 71 12 06 90 04
E: 8.335848 5 70 52 01 02 04
E: 8.337829 5 71 12 06 90 04
E: 8.351817 5 70 52 01 02 04
E: 8.353825 5 71 12 06 90 04
E: 8.368225 5 70 53 01 02 04
E: 8.372056 5 71 12 06 92 04
E: 8.383828 5 70 53 01 02 04
E: 8.385812 5 71 12 06 92 04
E: 8.399819 5 70 53 01 02 04
E: 8.401996 5 71 14 06 92 04
E: 8.415827 5 70 53 01 02 04
E: 8.417811 5 71 14 06 92 04
E: 8.431826 5 70 53 01 02 04
E: 8.435812 5 71 14 06 92 04
E: 8.445807 5 70 53 01 02 04
E: 8.447778 5 71 14 06 92 04
E: 8.462150 5 70 53 01 00 04
E: 8.464014 5 71 14 06 94 04
E: 8.477830 5 70 53 01 00 04
E: 8.482012 5 71 15 06 94 04
E: 8.493827 5 70 53 01 00 04
E: 8.495809 5 71 15 06 94 04
E: 8.509845 5 70 53 01 00 04
E: 8.511828 5 71 15 06 94 04
E: 8.525824 5 70 53 01 00 04
E: 8.527813 5 71 15 06 94 04
E: 8.539822 5 70 53 01 00 04
E: 8.541809 5 71 15 06 94 04
E: 8.555855 5 70 53 01 00 04
E: 8.560023 5 71 17 06 96 04
E: 8.571814 5 70 53 01 00 04
E: 8.575825 5 71 17 06 96 04
E: 8.588093 5 70 52 01 00 04
E: 8.589810 5 71 17 06 96 04
E: 8.603842 5 70 52 01 00 04
E: 8.605809 5 71 17 06 96 04
E: 8.619824 5 70 52 01 00 04
E: 8.621808 5 71 17 06 96 04
E: 8.635846 5 70 52 01 00 04
E: 8.637750 5 71 17 06 96 04
E: 8.651806 5 70 52 01 00 04
E: 8.653836 5 71 17 06 96 04
E: 8.667826 5 70 52 01 00 04
E: 8.671826 5 71 17 06 96 04
E: 8.684184 5 70 52 01 02 04
E: 8.685811 5 71 17 06 96 04
E: 8.699848 5 70 52 01 02 04
E: 8.701808 5 71 17 06 96 04
E: 8.715821 5 70 52 01 02 04
E: 8.717808 5 71 17 06 96 04
E: 8.729821 5 70 52 01 02 04
E: 8.731796 5 71 17 06 96 04
E: 8.745849 5 70 52 01 02 04
E: 8.747857 5 71 17 06 96 04
E: 8.761825 5 70 52 01 02 04
E: 8.763807 5 71 17 06 96 04
E: 8.777794 5 70 52 01 02 04
E: 8.779803 5 71 17 06 96 04
E: 8.793825 5 70 52 01 02 04
E: 8.795809 5 71 17 06 96 04
E: 8.809822 5 70 52 01 02 04
E: 8.811809 5 71 17 06 96 04
E: 8.825842 5 70 52 01 02 04
E: 8.827814 5 71 17 06 96 04
E: 8.841823 5 70 52 01 02 04
E: 8.843807 5 71 17 06 96 04
E: 8.857836 5 70 52 01 02 04
E: 8.859809 5 71 17 06 96 04
E: 8.871827 5 70 52 01 02 04
E: 8.875811 5 71 17 06 96 04
E: 8.887848 5 70 52 01 02 04
E: 8.889818 5 71 17 06 96 04
E: 8.904287 5 70 52 01 05 04
E: 8.905945 5 71 17 06 96 04
E: 8.919860 5 70 52 01 05 04
E: 8.921808 5 71 17 06 96 04
E: 8.935833 5 70 52 01 05 04
E: 8.939832 5 71 17 06 96 04
E: 8.951824 5 70 52 01 05 04
E: 8.953844 5 71 17 06 96 04
E: 8.967812 5 70 52 01 05 04
E: 8.969819 5 71 17 06 96 04
E: 8.983823 5 70 52 01 05 04
E: 8.985811 5 71 17 06 96 04
E: 8.999787 5 70 52 01 05 04
E: 9.001822 5 71 17 06 96 04
E: 9.015823 5 70 52 01 05 04
E: 9.017819 5 71 17 06 96 04
E: 9.032254 5 70 52 01 07 04
E: 9.033820 5 71 17 06 96 04
E: 9.047801 5 70 52 01 07 04
E: 9.051826 5 71 17 06 96 04
E: 9.061825 5 70 52 01 07 04
E: 9.063842 5 71 17 06 96 04
E: 9.077810 5 70 52 01 07 04
E: 9.079818 5 71 17 06 96 04
E: 9.093827 5 70 52 01 07 04
E: 9.095807 5 71 17 06 96 04
E: 9.109779 5 70 52 01 07 04
E: 9.111817 5 71 17 06 96 04
E: 9.125824 5 70 52 01 07 04
E: 9.127806 5 71 17 06 96 04
E: 9.142249 5 70 53 01 07 04
E: 9.143813 5 71 17 06 96 04
E: 9.157802 5 70 53 01 07 04
E: 9.159786 5 71 17 06 96 04
E: 9.173846 5 70 53 01 07 04
E: 9.175807 5 71 17 06 96 04
E: 9.187820 5 70 53 01 07 04
E: 9.189806 5 71 17 06 96 04
E: 9.204841 5 70 53 01 07 04
E: 9.207803 5 71 17 06 96 04
E: 9.219844 5 70 53 01 07 04
E: 9.223830 5 71 17 06 96 04
E: 9.235819 5 70 53 01 07 04
E: 9.237804 5 71 17 06 96 04
E: 9.252172 5 70 53 01 09 04
E: 9.253786 5 71 17 06 96 04
E: 9.267820 5 70 53 01 09 04
E: 9.269804 5 71 17 06 96 04
E: 9.283818 5 70 53 01 09 04
E: 9.285803 5 71 17 06 96 04
E: 9.300122 5 70 53 01 0b 04
E: 9.301879 5 71 17 06 96 04
E: 9.313879 5 70 53 01 0b 04
E: 9.315845 5 71 17 06 96 04
E: 9.329822 5 70 53 01 0b 04
E: 9.333819 5 71 17 06 96 04
E: 9.346198 5 70 53 01 09 04
E: 9.347806 5 71 17 06 96 04
E: 9.361857 5 70 53 01 09 04
E: 9.366103 5 71 15 06 94 04
E: 9.377822 5 70 53 01 09 04
E: 9.379804 5 71 15 06 94 04
E: 9.393820 5 70 53 01 09 04
E: 9.395804 5 71 15 06 94 04
E: 9.409795 5 70 53 01 09 04
E: 9.411764 5 71 15 06 94 04
E: 9.426132 5 70 53 01 07 04
E: 9.429804 5 71 15 06 94 04
E: 9.439818 5 70 53 01 07 04
E: 9.442045 5 71 14 06 94 04
E: 9.455824 5 70 53 01 07 04
E: 9.457975 5 71 14 06 92 04
E: 9.471793 5 70 53 01 07 04
E: 9.475797 5 71 14 06 92 04
E: 9.487816 5 70 53 01 07 04
E: 9.489809 5 71 14 06 92 04
E: 9.503805 5 70 53 01 07 04
E: 9.505816 5 71 14 06 92 04
E: 9.519795 5 70 53 01 07 04
E: 9.523811 5 71 14 06 92 04
E: 9.535767 5 70 53 01 07 04
E: 9.537743 5 71 14 06 92 04
E: 9.552720 5 70 52 01 07 04
E: 9.555790 5 71 14 06 92 04
E: 9.565833 5 70 52 01 07 04
E: 9.567823 5 71 14 06 92 04
E: 9.581816 5 70 52 01 07 04
E: 9.583808 5 71 14 06 92 04
E: 9.597817 5 70 52 01 07 04
E: 9.599784 5 71 14 06 92 04
E: 9.613817 5 70 52 01 07 04
E: 9.615802 5 71 14 06 92 04
E: 9.629817 5 70 52 01 07 04
E: 9.631802 5 71 14 06 92 04
E: 9.645831 5 70 52 01 07 04
E: 9.647754 5 71 14 06 92 04
E: 9.661810 5 70 52 01 07 04
E: 9.665816 5 71 14 06 92 04
E: 9.677816 5 70 52 01 07 04
E: 9.679800 5 71 14 06 92 04
E: 9.693796 5 70 52 01 07 04
E: 9.695767 5 71 14 06 92 04
E: 9.707820 5 70 52 01 07 04
E: 9.709830 5 71 14 06 92 04
E: 9.723804 5 70 52 01 07 04
E: 9.727813 5 71 14 06 92 04
E: 9.741807 5 70 52 01 07 04
E: 9.745806 5 71 14 06 92 04
E: 9.755804 5 70 52 01 07 04
E: 9.757817 5 71 14 06 92 04
E: 9.772267 5 70 52 01 05 04
E: 9.773940 5 71 14 06 92 04
E: 9.787845 5 70 52 01 05 04
E: 9.789799 5 71 14 06 92 04
E: 9.803818 5 70 52 01 05 04
E: 9.805799 5 71 14 06 92 04
E: 9.817836 5 70 52 01 05 04
E: 9.819834 5 71 14 06 92 04
E: 9.833838 5 70 52 01 05 04
E: 9.835812 5 71 14 06 92 04
E: 9.850253 5 70 52 01 07 04
E: 9.851752 5 71 14 06 92 04
E: 9.865807 5 70 52 01 07 04
E: 9.867748 5 71 14 06 92 04
E: 9.881754 5 70 52 01 07 04
E: 9.883740 5 71 14 06 92 04
E: 9.897837 5 70 52 01 07 04
E: 9.901805 5 71 14 06 92 04
E: 9.913817 5 70 52 01 07 04
E: 9.915786 5 71 14 06 92 04
E: 9.927843 5 70 52 01 07 04
E: 9.930076 5 71 15 06 92 04
E: 9.943816 5 70 52 01 07 04
E: 9.947813 5 71 15 06 92 04
E: 9.959791 5 70 52 01 07 04
E: 9.961826 5 71 15 06 92 04
E: 9.974144 5 70 52 01 09 04
E: 9.977826 5 71 15 06 92 04
E: 9.989813 5 70 52 01 09 04
E: 9.991798 5 71 15 06 92 04
E: 10.003812 5 70 52 01 09 04
E: 10.005989 5 71 17 06 94 04
E: 10.019819 5 70 52 01 09 04
E: 10.021815 5 71 17 06 94 04
E: 10.033836 5 71 17 06 94 04
E: 10.048205 5 70 50 01 09 04
E: 10.049891 5 71 17 06 94 04
E: 10.061841 5 71 17 06 94 04
E: 10.074551 5 40 50 01 09 04
E: 10.077818 5 71 17 06 94 04
E: 10.087810 5 71 17 06 94 04
E: 10.101809 5 71 17 06 94 04
E: 10.113809 5 71 17 06 94 04
E: 10.127803 5 71 17 06 94 04
E: 10.139840 5 71 17 06 94 04
E: 10.153809 5 71 17 06 94 04
E: 10.165797 5 71 17 06 94 04
E: 10.179794 5 71 17 06 94 04
E: 10.193809 5 71 17 06 94 04
E: 10.205783 5 71 17 06 94 04
E: 10.219798 5 71 17 06 94 04
E: 10.233812 5 71 17 06 94 04
E: 10.247808 5 71 17 06 94 04
E: 10.261807 5 71 17 06 94 04
E: 10.273808 5 71 17 06 94 04
E: 10.287806 5 71 17 06 94 04
E: 10.299806 5 71 17 06 94 04
E: 10.314070 5 71 15 06 92 04
E: 10.325832 5 71 15 06 92 04
E: 10.339808 5 71 15 06 92 04
E: 10.353855 5 71 15 06 92 04
E: 10.365829 5 71 15 06 92 04
E: 10.380021 5 71 15 06 90 04
E: 10.391806 5 71 15 06 90 04
E: 10.405811 5 71 15 06 90 04
E: 10.420011 5 71 14 06 90 04
E: 10.431805 5 71 14 06 90 04
E: 10.445991 5 71 14 06 8d 04
E: 10.457777 5 71 14 06 8d 04
E: 10.471805 5 71 14 06 8d 04
E: 10.485805 5 71 14 06 8d 04
E: 10.499790 5 71 14 06 8d 04
E: 10.511827 5 71 14 06 8d 04
E: 10.523991 5 71 12 06 8b 04
E: 10.537807 5 71 12 06 8b 04
E: 10.551810 5 71 12 06 8b 04
E: 10.563798 5 71 12 06 8b 04
E: 10.577806 5 71 12 06 8b 04
E: 10.590001 5 71 12 06 89 04
E: 10.601825 5 71 12 06 89 04
E: 10.615805 5 71 12 06 89 04
E: 10.627990 5 71 10 06 89 04
E: 10.641813 5 71 10 06 89 04
E: 10.654069 5 71 10 06 87 04
E: 10.667809 5 71 10 06 87 04
E: 10.679804 5 71 10 06 87 04
E: 10.693779 5 71 10 06 87 04
E: 10.705809 5 71 10 06 87 04
E: 10.719806 5 71 10 06 87 04
E: 10.731803 5 71 10 06 87 04
E: 10.745765 5 71 10 06 87 04
E: 10.759803 5 71 10 06 87 04
E: 10.771790 5 71 10 06 87 04
E: 10.785749 5 71 10 06 87 04
E: 10.799803 5 71 10 06 87 04
E: 10.813801 5 71 10 06 87 04
E: 10.825772 5 71 10 06 87 04
E: 10.839819 5 71 10 06 87 04
E: 10.853815 5 71 10 06 87 04
E: 10.867809 5 71 10 06 87 04
E: 10.879812 5 71 10 06 87 04
E: 10.893803 5 71 10 06 87 04
E: 10.907804 5 71 10 06 87 04
E: 10.919781 5 71 10 06 87 04
E: 10.933803 5 71 10 06 87 04
E: 10.947804 5 71 10 06 87 04
E: 10.959790 5 71 10 06 87 04
E: 10.973807 5 71 10 06 87 04
E: 10.987802 5 71 10 06 87 04
E: 10.999801 5 71 10 06 87 04
E: 11.013794 5 71 10 06 87 04
E: 11.027803 5 71 10 06 87 04
E: 11.039800 5 71 10 06 87 04
E: 11.051791 5 71 10 06 87 04
E: 11.065805 5 71 10 06 87 04
E: 11.079801 5 71 10 06 87 04
E: 11.091800 5 71 10 06 87 04
E: 11.105800 5 71 10 06 87 04
E: 11.119790 5 71 10 06 87 04
E: 11.131805 5 71 10 06 87 04
E: 11.143800 5 71 10 06 87 04
E: 11.157801 5 71 10 06 87 04
E: 11.171819 5 71 10 06 87 04
E: 11.183800 5 71 10 06 87 04
E: 11.197798 5 71 10 06 87 04
E: 11.209837 5 71 10 06 87 04
E: 11.221799 5 71 10 06 87 04
E: 11.236073 5 71 10 06 85 04
E: 11.247786 5 71 10 06 85 04
E: 11.257823 5 71 10 06 85 04
E: 11.267800 5 71 10 06 85 04
E: 11.279982 5 71 12 06 82 04
E: 11.289947 5 71 14 06 82 04
E: 11.302023 5 41 14 06 82 04
# 3. Finally, move your ten fingers on the screen and release them.
E: 24.269789 5 70 6f 03 37 02
E: 24.271780 5 71 ef 01 e5 02
E: 24.281821 5 70 6f 03 37 02
E: 24.283689 5 71 ef 01 e5 02
E: 24.293750 5 70 6e 03 3b 02
E: 24.297695 5 71 ef 01 e5 02
E: 24.305711 5 70 6e 03 40 02
E: 24.309647 5 71 ef 01 e5 02
E: 24.317698 5 70 6e 03 44 02
E: 24.319611 5 71 ef 01 e5 02
E: 24.329728 5 70 6e 03 46 02
E: 24.331649 5 71 ef 01 e5 02
E: 24.339767 5 70 6e 03 4b 02
E: 24.341756 5 71 ef 01 e5 02
E: 24.351640 5 70 6e 03 4b 02
E: 24.353686 5 71 ef 01 e5 02
E: 24.363854 5 70 6e 03 49 02
E: 24.367644 5 71 ef 01 e5 02
E: 24.375853 5 70 6c 03 49 02
E: 24.377631 5 71 ef 01 e5 02
E: 24.387676 5 70 6c 03 49 02
E: 24.391612 5 71 ef 01 e5 02
E: 24.399825 5 70 6c 03 46 02
E: 24.401610 5 71 ef 01 e5 02
E: 24.411656 5 70 6c 03 46 02
E: 24.415617 5 71 ef 01 e5 02
E: 24.423806 5 70 6c 03 44 02
E: 24.425614 5 71 ef 01 e5 02
E: 24.433840 5 70 6c 03 42 02
E: 24.435629 5 71 ef 01 e5 02
E: 24.445680 5 70 6c 03 42 02
E: 24.447667 5 71 ef 01 e5 02
E: 24.457803 5 70 6c 03 40 02
E: 24.459630 5 71 ef 01 e5 02
E: 24.470119 5 70 6c 03 3e 02
E: 24.473744 5 71 ef 01 e5 02
E: 24.481604 5 70 6c 03 3e 02
E: 24.485603 5 71 ef 01 e5 02
E: 24.493947 5 70 6e 03 3b 02
E: 24.497610 5 71 ef 01 e5 02
E: 24.505991 5 70 6e 03 39 02
E: 24.507771 5 71 ef 01 e8 02
E: 24.518005 5 70 6e 03 37 02
E: 24.519765 5 71 ef 01 ea 02
E: 24.530084 5 70 6e 03 35 02
E: 24.531815 5 71 ef 01 ec 02
E: 24.541665 5 70 6e 03 35 02
E: 24.543897 5 71 ef 01 f0 02
E: 24.553973 5 70 6f 03 35 02
E: 24.555787 5 71 f1 01 f5 02
E: 24.565623 5 70 6f 03 35 02
E: 24.569790 5 71 f4 01 fc 02
E: 24.577873 5 70 71 03 37 02
E: 24.579775 5 71 f6 01 00 03
E: 24.590025 5 70 73 03 39 02
E: 24.594048 5 71 f7 01 07 03
E: 24.601992 5 70 73 03 3b 02
E: 24.606081 5 71 fb 01 0d 03
E: 24.613945 5 70 74 03 40 02
E: 24.617806 5 71 fc 01 14 03
E: 24.628082 5 70 76 03 44 02
E: 24.631945 5 71 01 02 1d 03
E: 24.640037 5 70 78 03 4b 02
E: 24.641869 5 71 03 02 23 03
E: 24.652060 5 70 79 03 4f 02
E: 24.655967 5 71 06 02 2e 03
E: 24.664418 5 70 7b 03 58 02
E: 24.665800 5 71 0a 02 37 03
E: 24.675839 5 70 7c 03 5f 02
E: 24.678987 5 71 0e 02 44 03
E: 24.687853 5 70 7e 03 63 02
E: 24.691711 5 71 12 02 4d 03
E: 24.699879 5 70 80 03 6e 02
E: 24.703792 5 71 17 02 58 03
E: 24.711855 5 70 83 03 79 02
E: 24.713810 5 71 1c 02 61 03
E: 24.723853 5 70 85 03 82 02
E: 24.725916 5 71 20 02 6e 03
E: 24.735667 5 70 86 03 89 02
E: 24.737774 5 71 25 02 7e 03
E: 24.749905 5 70 88 03 94 02
E: 24.752144 5 71 2a 02 87 03
E: 24.761785 5 70 8b 03 a1 02
E: 24.765836 5 71 2f 02 96 03
E: 24.773872 5 70 8f 03 b0 02
E: 24.775725 5 71 34 02 9f 03
E: 24.785847 5 70 90 03 bb 02
E: 24.789714 5 71 36 02 a6 03
E: 24.797851 5 70 93 03 c9 02
E: 24.802374 5 71 3b 02 b3 03
E: 24.809692 5 70 95 03 d2 02
E: 24.813630 5 71 40 02 c0 03
E: 24.821860 5 70 98 03 df 02
E: 24.823691 5 71 43 02 cb 03
E: 24.833840 5 70 9a 03 e8 02
E: 24.835898 5 71 48 02 d8 03
E: 24.845899 5 70 9c 03 f3 02
E: 24.847777 5 71 4b 02 e1 03
E: 24.857858 5 70 9f 03 fe 02
E: 24.859786 5 71 50 02 ec 03
E: 24.869668 5 70 a1 03 04 03
E: 24.871758 5 71 53 02 f5 03
E: 24.881873 5 70 a2 03 0f 03
E: 24.885821 5 71 58 02 00 04
E: 24.893760 5 70 a4 03 18 03
E: 24.897718 5 71 5d 02 0d 04
E: 24.905832 5 70 a7 03 23 03
E: 24.907729 5 71 61 02 16 04
E: 24.915858 5 70 a9 03 2e 03
E: 24.919656 5 71 65 02 23 04
E: 24.927729 5 70 ac 03 3c 03
E: 24.931781 5 71 69 02 2c 04
E: 24.941711 5 70 ae 03 44 03
E: 24.943653 5 71 6a 02 33 04
E: 24.953899 5 70 af 03 4b 03
E: 24.955717 5 71 6f 02 3e 04
E: 24.966045 5 70 b3 03 58 03
E: 24.967637 5 71 73 02 47 04
E: 24.975848 5 70 b4 03 5f 03
E: 24.977791 5 71 76 02 52 04
E: 24.987845 5 70 b6 03 6c 03
E: 24.989812 5 71 79 02 5b 04
E: 24.999825 5 70 b9 03 75 03
E: 25.004428 5 71 7e 02 66 04
E: 25.009667 5 70 bb 03 82 03
E: 25.013633 5 71 81 02 6f 04
E: 25.021677 5 70 bd 03 8b 03
E: 25.025702 5 71 86 02 7a 04
E: 25.033870 5 70 be 03 92 03
E: 25.035730 5 71 8a 02 82 04
E: 25.045899 5 70 c1 03 9f 03
E: 25.047885 5 71 8e 02 8d 04
E: 25.057913 5 70 c3 03 a8 03
E: 25.059758 5 71 92 02 96 04
E: 25.069857 5 70 c6 03 b3 03
E: 25.071905 5 71 95 02 9f 04
E: 25.081658 5 70 ca 03 be 03
E: 25.083717 5 71 9a 02 ac 04
E: 25.093835 5 70 cd 03 c9 03
E: 25.095801 5 71 9d 02 b3 04
E: 25.105823 5 70 cf 03 d2 03
E: 25.109712 5 71 9f 02 ba 04
E: 25.117824 5 70 d2 03 dd 03
E: 25.119703 5 71 a4 02 c5 04
E: 25.129835 5 70 d3 03 e6 03
E: 25.131702 5 71 a5 02 cb 04
E: 25.143849 5 70 d7 03 ea 03
E: 25.145739 5 71 a7 02 d0 04
E: 25.155687 5 70 d8 03 f1 03
E: 25.157700 5 71 ac 02 d9 04
E: 25.167727 5 70 dc 03 fc 03
E: 25.171647 5 71 af 02 e4 04
E: 25.179895 5 70 dd 03 02 04
E: 25.181743 5 71 b3 02 ea 04
E: 25.191868 5 70 e1 03 10 04
E: 25.195458 5 71 b6 02 f5 04
E: 25.203987 5 70 e2 03 18 04
E: 25.205745 5 71 b8 02 fc 04
E: 25.215824 5 70 e6 03 23 04
E: 25.219822 5 71 bb 02 00 05
E: 25.227760 5 70 e7 03 2c 04
E: 25.232230 5 71 bc 02 09 05
E: 25.239660 5 70 e9 03 31 04
E: 25.241620 5 71 be 02 10 05
E: 25.253852 5 70 e9 03 35 04
E: 25.257706 5 71 c1 02 19 05
E: 25.265770 5 70 ec 03 3e 04
E: 25.267708 5 71 c3 02 1f 05
E: 25.277833 5 70 ee 03 47 04
E: 25.279639 5 71 c6 02 28 05
E: 25.289693 5 70 ef 03 4b 04
E: 25.291765 5 71 c8 02 2f 05
E: 25.301718 5 70 f3 03 56 04
E: 25.303738 5 71 cb 02 33 05
E: 25.313869 5 70 f4 03 5f 04
E: 25.315708 5 71 cd 02 3c 05
E: 25.325868 5 70 f6 03 63 04
E: 25.327711 5 71 ce 02 40 05
E: 25.337833 5 70 f9 03 6f 04
E: 25.342041 5 71 d0 02 45 05
E: 25.349738 5 70 fb 03 73 04
E: 25.353773 5 71 d3 02 4e 05
E: 25.365857 5 70 fd 03 77 04
E: 25.367708 5 71 d5 02 52 05
E: 25.379850 5 70 fe 03 82 04
E: 25.381703 5 71 d7 02 56 05
E: 25.393847 5 70 00 04 89 04
E: 25.397711 5 71 d8 02 5f 05
E: 25.405858 5 70 03 04 94 04
E: 25.407732 5 71 dc 02 64 05
E: 25.417860 5 70 05 04 9d 04
E: 25.419731 5 71 dd 02 6a 05
E: 25.429930 5 70 06 04 a6 04
E: 25.431748 5 71 df 02 71 05
E: 25.441840 5 70 0a 04 ac 04
E: 25.443902 5 71 e2 02 75 05
E: 25.453680 5 70 0b 04 b5 04
E: 25.455621 5 71 e4 02 7e 05
E: 25.465849 5 70 0d 04 bc 04
E: 25.467972 5 71 e5 02 83 05
E: 25.475835 5 70 0f 04 c5 04
E: 25.477796 5 71 e7 02 87 05
E: 25.491823 5 70 10 04 cb 04
E: 25.493708 5 71 ea 02 90 05
E: 25.505839 5 70 14 04 d4 04
E: 25.509856 5 71 ec 02 96 05
E: 25.517779 5 70 15 04 db 04
E: 25.519736 5 71 ee 02 9d 05
E: 25.529902 5 70 17 04 e4 04
E: 25.531733 5 71 f1 02 a4 05
E: 25.541833 5 70 18 04 ea 04
E: 25.546096 5 71 f3 02 ac 05
E: 25.553764 5 70 1a 04 f3 04
E: 25.557773 5 71 f4 02 b3 05
E: 25.565643 5 70 1c 04 fa 04
E: 25.569844 5 71 f6 02 b8 05
E: 25.577690 5 70 1c 04 fe 04
E: 25.581753 5 71 f9 02 c0 05
E: 25.589879 5 70 1d 04 07 05
E: 25.591890 5 71 fb 02 c7 05
E: 25.601807 5 70 21 04 0e 05
E: 25.603791 5 71 fc 02 cb 05
E: 25.613820 5 70 21 04 12 05
E: 25.617775 5 71 fe 02 d0 05
E: 25.625798 5 70 22 04 1d 05
E: 25.627687 5 71 00 03 d9 05
E: 25.637811 5 70 26 04 21 05
E: 25.641993 5 71 01 03 dd 05
E: 25.651824 5 70 27 04 26 05
E: 25.656290 5 71 03 03 e1 05
E: 25.665664 5 70 29 04 2f 05
E: 25.669730 5 71 06 03 ed 05
E: 25.677691 5 70 2b 04 33 05
E: 25.681638 5 71 08 03 f1 05
E: 25.689648 5 70 2b 04 37 05
E: 25.691693 5 71 0a 03 f5 05
E: 25.701650 5 70 2e 04 3e 05
E: 25.705692 5 71 0d 03 fe 05
E: 25.713833 5 70 2e 04 43 05
E: 25.715719 5 71 0f 03 03 06
E: 25.725650 5 70 2f 04 45 05
E: 25.727890 5 71 12 03 0e 06
E: 25.737788 5 70 31 04 4e 05
E: 25.739691 5 71 13 03 12 06
E: 25.749815 5 70 33 04 52 05
E: 25.754022 5 71 15 03 16 06
E: 25.761677 5 70 33 04 54 05
E: 25.765639 5 71 17 03 1b 06
E: 25.773642 5 70 34 04 56 05
E: 25.775693 5 71 17 03 1d 06
E: 25.785812 5 70 36 04 5b 05
E: 25.789801 5 71 1a 03 24 06
E: 25.797855 5 70 38 04 5f 05
E: 25.799750 5 71 1c 03 28 06
E: 25.810065 5 70 39 04 61 05
E: 25.811778 5 71 1d 03 2a 06
E: 25.825868 5 70 39 04 66 05
E: 25.827752 5 71 1f 03 33 06
E: 25.839841 5 70 3d 04 6a 05
E: 25.842086 5 71 21 03 38 06
E: 25.853846 5 70 3e 04 6f 05
E: 25.855702 5 71 22 03 3a 06
E: 25.867662 5 70 40 04 77 05
E: 25.871636 5 71 22 03 3e 06
E: 25.879795 5 70 41 04 7e 05
E: 25.881860 5 71 22 03 40 06
E: 25.893792 5 70 41 04 83 05
E: 25.895733 5 71 25 03 45 06
E: 25.907875 5 70 43 04 8b 05
E: 25.911792 5 71 27 03 49 06
E: 25.923822 5 70 43 04 92 05
E: 25.925716 5 71 29 03 4b 06
E: 25.937839 5 70 45 04 96 05
E: 25.939693 5 71 2a 03 52 06
E: 25.951840 5 70 45 04 9d 05
E: 25.954019 5 71 2c 03 57 06
E: 25.965758 5 70 46 04 9f 05
E: 25.969682 5 71 2e 03 59 06
E: 25.981644 5 70 48 04 a8 05
E: 25.983621 5 71 2e 03 5d 06
E: 25.995807 5 70 4a 04 ac 05
E: 25.999713 5 71 2f 03 62 06
E: 26.009644 5 70 4b 04 b3 05
E: 26.013733 5 71 33 03 66 06
E: 26.025773 5 70 4b 04 b5 05
E: 26.029775 5 71 33 03 6a 06
E: 26.039836 5 70 4d 04 be 05
E: 26.041897 5 71 34 03 6f 06
E: 26.053795 5 70 50 04 c3 05
E: 26.055761 5 71 34 03 71 06
E: 26.069834 5 70 50 04 c7 05
E: 26.073649 5 71 34 03 71 06
E: 26.083806 5 70 52 04 cb 05
E: 26.087692 5 71 38 03 78 06
E: 26.095829 5 70 52 04 ce 05
E: 26.099689 5 71 39 03 7c 06
E: 26.105839 5 70 54 04 d0 05
E: 26.107799 5 71 39 03 7e 06
E: 26.117816 5 70 54 04 d2 05
E: 26.119734 5 71 3b 03 80 06
E: 26.129809 5 70 55 04 d9 05
E: 26.131685 5 71 3c 03 85 06
E: 26.141802 5 70 57 04 dd 05
E: 26.146093 5 71 3e 03 89 06
E: 26.151690 5 70 57 04 df 05
E: 26.155972 5 71 40 03 8c 06
E: 26.163648 5 70 58 04 e4 05
E: 26.167724 5 71 40 03 90 06
E: 26.175639 5 70 58 04 e4 05
E: 26.179727 5 71 41 03 90 06
E: 26.187714 5 70 58 04 e6 05
E: 26.193503 5 71 43 03 92 06
E: 26.197750 5 70 5a 04 e8 05
E: 26.201692 5 71 45 03 99 06
E: 26.209820 5 70 5c 04 ef 05
E: 26.211683 5 71 46 03 9b 06
E: 26.221846 5 70 5d 04 f5 05
E: 26.223697 5 71 48 03 9f 06
E: 26.233816 5 70 5d 04 f8 05
E: 26.235713 5 71 4a 03 a2 06
E: 26.243869 5 70 5f 04 fc 05
E: 26.245725 5 71 4b 03 a4 06
E: 26.255861 5 70 61 04 fe 05
E: 26.257866 5 71 4d 03 aa 06
E: 26.269780 5 70 61 04 03 06
E: 26.273693 5 71 4f 03 ad 06
E: 26.283812 5 70 62 04 05 06
E: 26.287690 5 71 50 03 b1 06
E: 26.299608 5 70 64 04 09 06
E: 26.301676 5 71 52 03 b3 06
E: 26.313799 5 70 66 04 0b 06
E: 26.315668 5 71 53 03 b8 06
E: 26.327826 5 70 66 04 0e 06
E: 26.331695 5 71 55 03 bc 06
E: 26.341676 5 70 67 04 10 06
E: 26.343707 5 71 55 03 be 06
E: 26.355842 5 70 67 04 12 06
E: 26.357688 5 71 57 03 c3 06
E: 26.369788 5 70 69 04 14 06
E: 26.373800 5 71 58 03 c7 06
E: 26.383796 5 70 6b 04 16 06
E: 26.385727 5 71 5a 03 c9 06
E: 26.397797 5 70 6c 04 1b 06
E: 26.399870 5 71 5c 03 cc 06
E: 26.411649 5 70 6c 04 1d 06
E: 26.413766 5 71 5c 03 ce 06
E: 26.425812 5 70 6c 04 1f 06
E: 26.429747 5 71 5d 03 d2 06
E: 26.439902 5 70 6e 04 22 06
E: 26.441635 5 71 5f 03 d4 06
E: 26.451842 5 70 6f 04 24 06
E: 26.453787 5 71 61 03 d7 06
E: 26.463769 5 70 6f 04 26 06
E: 26.465792 5 71 62 03 d9 06
E: 26.475595 5 70 6f 04 2a 06
E: 26.477675 5 71 64 03 dd 06
E: 26.487806 5 70 71 04 2d 06
E: 26.491616 5 71 66 03 df 06
E: 26.499644 5 70 73 04 31 06
E: 26.501614 5 71 66 03 e2 06
E: 26.509837 5 70 74 04 33 06
E: 26.511698 5 71 67 03 e4 06
E: 26.521811 5 70 74 04 35 06
E: 26.525686 5 71 69 03 e6 06
E: 26.533724 5 70 76 04 38 06
E: 26.535858 5 71 69 03 e8 06
E: 26.545881 5 70 78 04 3c 06
E: 26.547738 5 71 6a 03 ed 06
E: 26.557809 5 70 78 04 3e 06
E: 26.559762 5 71 6c 03 ef 06
E: 26.571806 5 70 79 04 43 06
E: 26.573736 5 71 6c 03 f3 06
E: 26.585886 5 70 7b 04 45 06
E: 26.589696 5 71 6e 03 f6 06
E: 26.599825 5 70 7b 04 47 06
E: 26.603686 5 71 6f 03 fa 06
E: 26.613822 5 70 7d 04 49 06
E: 26.615692 5 71 71 03 fc 06
E: 26.627807 5 70 7e 04 4b 06
E: 26.631692 5 71 71 03 fe 06
E: 26.641833 5 70 7e 04 50 06
E: 26.645835 5 71 73 03 01 07
E: 26.655848 5 70 80 04 52 06
E: 26.657686 5 71 73 03 03 07
E: 26.669816 5 70 82 04 54 06
E: 26.671695 5 71 74 03 07 07
E: 26.683817 5 70 83 04 59 06
E: 26.685664 5 71 76 03 0c 07
E: 26.699665 5 70 85 04 5b 06
E: 26.701717 5 71 78 03 0e 07
E: 26.713648 5 70 86 04 5f 06
E: 26.715676 5 71 78 03 10 07
E: 26.725800 5 70 88 04 64 06
E: 26.727676 5 71 79 03 12 07
E: 26.739625 5 70 88 04 66 06
E: 26.743757 5 71 79 03 17 07
E: 26.753817 5 70 88 04 68 06
E: 26.755721 5 71 7b 03 19 07
E: 26.767773 5 70 8a 04 6a 06
E: 26.769731 5 71 7c 03 1b 07
E: 26.781847 5 70 8b 04 6d 06
E: 26.783699 5 71 7c 03 1d 07
E: 26.793804 5 70 8b 04 6f 06
E: 26.797727 5 71 7e 03 1f 07
E: 26.803795 5 70 8d 04 73 06
E: 26.805686 5 71 80 03 24 07
E: 26.815821 5 70 8f 04 75 06
E: 26.819646 5 71 80 03 26 07
E: 26.827685 5 70 8f 04 78 06
E: 26.829692 5 71 81 03 28 07
E: 26.839924 5 70 90 04 7c 06
E: 26.843788 5 71 81 03 2b 07
E: 26.849769 5 70 92 04 7e 06
E: 26.853806 5 71 83 03 2d 07
E: 26.861743 5 70 92 04 80 06
E: 26.863729 5 71 85 03 31 07
E: 26.873840 5 70 92 04 83 06
E: 26.875728 5 71 85 03 33 07
E: 26.885839 5 70 94 04 85 06
E: 26.889697 5 71 86 03 36 07
E: 26.897820 5 70 95 04 89 06
E: 26.899687 5 71 86 03 3a 07
E: 26.909642 5 70 95 04 89 06
E: 26.913731 5 71 88 03 3c 07
E: 26.921730 5 70 97 04 8c 06
E: 26.925692 5 71 8a 03 3e 07
E: 26.933847 5 70 98 04 90 06
E: 26.937830 5 71 8a 03 41 07
E: 26.945829 5 70 98 04 92 06
E: 26.947669 5 71 8b 03 45 07
E: 26.957680 5 70 98 04 94 06
E: 26.961803 5 71 8d 03 49 07
E: 26.969833 5 70 9a 04 97 06
E: 26.971887 5 71 8d 03 4c 07
E: 26.983787 5 70 9a 04 99 06
E: 26.985790 5 71 8d 03 4e 07
E: 26.997894 5 70 9a 04 9b 06
E: 26.999731 5 71 8f 03 50 07
E: 27.011726 5 70 9c 04 9d 06
E: 27.015691 5 71 90 03 52 07
E: 27.027858 5 70 9d 04 9f 06
E: 27.029699 5 71 92 03 57 07
E: 27.041687 5 70 9d 04 a2 06
E: 27.045696 5 71 92 03 59 07
E: 27.055873 5 70 9f 04 a4 06
E: 27.059730 5 71 93 03 5b 07
E: 27.069665 5 70 9f 04 a6 06
E: 27.071692 5 71 93 03 5d 07
E: 27.083821 5 70 a1 04 a8 06
E: 27.085693 5 71 95 03 60 07
E: 27.095648 5 70 a1 04 aa 06
E: 27.099626 5 71 95 03 62 07
E: 27.107825 5 70 a2 04 ad 06
E: 27.109610 5 71 97 03 66 07
E: 27.119640 5 70 a2 04 ad 06
E: 27.123718 5 71 98 03 68 07
E: 27.131750 5 70 a4 04 af 06
E: 27.133843 5 71 98 03 6b 07
E: 27.143890 5 70 a6 04 b1 06
E: 27.145735 5 71 9a 03 6d 07
E: 27.155780 5 70 a6 04 b3 06
E: 27.159766 5 71 9c 03 6f 07
E: 27.167735 5 70 a7 04 b3 06
E: 27.171707 5 71 9c 03 71 07
E: 27.179720 5 70 a7 04 b5 06
E: 27.183763 5 71 9d 03 76 07
E: 27.192803 5 70 a9 04 b8 06
E: 27.195795 5 71 9f 03 78 07
E: 27.203862 5 70 ab 04 ba 06
E: 27.205712 5 71 9f 03 7a 07
E: 27.215644 5 70 ab 04 ba 06
E: 27.217736 5 71 a1 03 7c 07
E: 27.227821 5 70 ac 04 bc 06
E: 27.231709 5 71 a2 03 7e 07
E: 27.241831 5 70 ae 04 be 06
E: 27.243689 5 71 a2 03 81 07
E: 27.253658 5 70 ae 04 be 06
E: 27.257748 5 71 a4 03 83 07
E: 27.265743 5 70 af 04 c1 06
E: 27.267613 5 71 a4 03 83 07
E: 27.277708 5 70 af 04 c1 06
E: 27.279783 5 71 a4 03 85 07
E: 27.289915 5 70 b1 04 c3 06
E: 27.291754 5 71 a6 03 87 07
E: 27.301637 5 70 b1 04 c3 06
E: 27.303723 5 71 a6 03 87 07
E: 27.313797 5 70 b3 04 c5 06
E: 27.317792 5 71 a7 03 89 07
E: 27.327599 5 70 b3 04 c5 06
E: 27.335790 5 70 b4 04 c5 06
E: 27.339599 5 71 a7 03 89 07
E: 27.347724 5 70 b6 04 c7 06
E: 27.349706 5 71 a9 03 8c 07
E: 27.359640 5 70 b6 04 c7 06
E: 27.363740 5 71 a9 03 8e 07
E: 27.369889 5 70 b6 04 c9 06
E: 27.371746 5 41 a9 03 8e 07
E: 27.381858 5 70 b8 04 c9 06
E: 27.391863 5 40 b8 04 c9 06
# Thank you.
