R: 141 05 0d 09 04 a1 01 85 04 09 22 a1 02 09 42 15 00 25 01 75 01 95 01 81 02 09 32 81 02 95 06 81 03 75 08 09 51 95 01 81 02 05 01 26 ff 04 75 10 55 00 65 00 09 30 35 00 46 ff 04 81 02 09 31 46 ff 04 81 02 c0 05 0d 09 54 95 01 75 08 15 00 25 0a 81 02 09 55 b1 02 c0 05 0c 09 01 a1 01 85 03 a1 02 09 b5 15 00 25 01 75 01 95 01 81 02 09 b6 81 02 09 b7 81 02 09 cd 81 02 09 e2 81 02 09 e9 81 02 09 ea 81 02 05 01 09 82 81 02 c0 c0
N: ACER INCORPORATED. Wireless KB/Touch Pad
I: 3 1784 0016
# 1. Drag _one_ finger on the screen from one corner to the opposite, and release it.
E: 0.000000 2 03 00
E: 0.167716 2 03 00
E: 0.327710 2 03 00
E: 0.935716 2 03 00
E: 2.437501 8 04 03 00 26 02 15 02 02
E: 2.439574 8 04 03 01 08 03 ef 01 02
E: 2.441421 8 04 03 00 26 02 14 02 02
E: 2.443496 8 04 03 01 08 03 ee 01 02
E: 2.445422 8 04 03 00 24 02 13 02 02
E: 2.447496 8 04 03 01 06 03 eb 01 02
E: 2.457423 8 04 03 00 22 02 10 02 02
E: 2.459497 8 04 03 01 04 03 e7 01 02
E: 2.461422 8 04 03 00 20 02 0d 02 02
E: 2.463495 8 04 03 01 02 03 e3 01 02
E: 2.465420 8 04 03 00 1d 02 0a 02 02
E: 2.467499 8 04 03 01 ff 02 df 01 02
E: 2.477423 8 04 03 00 1a 02 09 02 02
E: 2.479496 8 04 03 01 fc 02 dc 01 02
E: 2.481424 8 04 03 00 17 02 08 02 02
E: 2.483496 8 04 03 01 f9 02 d9 01 02
E: 2.485413 8 04 03 00 13 02 05 02 02
E: 2.487500 8 04 03 01 f5 02 d4 01 02
E: 2.491452 8 04 03 00 0f 02 04 02 02
E: 2.493498 8 04 03 01 f1 02 d1 01 02
E: 2.495420 8 04 03 00 0b 02 03 02 02
E: 2.497498 8 04 03 01 ed 02 ce 01 02
E: 2.499422 8 04 03 00 07 02 02 02 02
E: 2.501495 8 04 03 01 e9 02 ca 01 02
E: 2.513442 8 04 03 00 02 02 02 02 02
E: 2.515501 8 04 03 01 e5 02 c9 01 02
E: 2.517426 8 04 03 00 fd 01 02 02 02
E: 2.519512 8 04 03 01 e1 02 c8 01 02
E: 2.521420 8 04 03 00 f8 01 04 02 02
E: 2.523502 8 04 03 01 db 02 c5 01 02
E: 2.533420 8 04 03 00 ed 01 08 02 02
E: 2.535491 8 04 03 01 d6 02 c5 01 02
E: 2.537422 8 04 03 00 e2 01 0c 02 02
E: 2.539499 8 04 03 01 d1 02 c5 01 02
E: 2.541576 8 04 03 00 d6 01 11 02 02
E: 2.543707 8 04 03 01 ca 02 c5 01 02
E: 2.547453 8 04 03 00 d2 01 14 02 02
E: 2.549509 8 04 03 01 c0 02 c9 01 02
E: 2.551537 8 04 03 00 ce 01 17 02 02
E: 2.553752 8 04 03 01 b6 02 cd 01 02
E: 2.555453 8 04 03 00 c9 01 1b 02 02
E: 2.557498 8 04 03 01 aa 02 d2 01 02
E: 2.567686 8 04 03 00 c1 01 26 02 02
E: 2.569530 8 04 03 01 a6 02 d6 01 02
E: 2.571421 8 04 03 00 b9 01 31 02 02
E: 2.573498 8 04 03 01 a2 02 da 01 02
E: 2.575634 8 04 03 00 b0 01 3c 02 02
E: 2.577732 8 04 03 01 9e 02 de 01 02
E: 2.589442 8 04 03 00 ae 01 41 02 02
E: 2.591581 8 04 03 01 9b 02 e2 01 02
E: 2.592658 8 04 03 00 ac 01 46 02 02
E: 2.595909 8 04 03 01 98 02 e6 01 02
E: 2.597536 8 04 03 00 a8 01 4d 02 02
E: 2.599686 8 04 03 01 94 02 eb 01 02
E: 2.602657 8 04 03 00 a6 01 53 02 02
E: 2.605748 8 04 03 01 91 02 f1 01 02
E: 2.607596 8 04 03 00 a4 01 59 02 02
E: 2.609684 8 04 03 01 8e 02 f7 01 02
E: 2.611633 8 04 03 00 a1 01 5f 02 02
E: 2.613713 8 04 03 01 8b 02 fd 01 02
E: 2.623600 8 04 03 00 a0 01 66 02 02
E: 2.625686 8 04 03 01 8a 02 04 02 02
E: 2.627629 8 04 03 00 9f 01 6d 02 02
E: 2.629529 8 04 03 01 89 02 0b 02 02
E: 2.631423 8 04 03 00 9d 01 75 02 02
E: 2.633498 8 04 03 01 86 02 13 02 02
E: 2.643683 8 04 03 00 9d 01 7d 02 02
E: 2.645527 8 04 03 01 86 02 1a 02 02
E: 2.647422 8 04 03 00 9d 01 85 02 02
E: 2.649499 8 04 03 01 86 02 21 02 02
E: 2.650690 8 04 03 00 9c 01 8e 02 02
E: 2.652635 8 04 03 01 84 02 2a 02 02
E: 2.659595 8 04 03 00 9c 01 96 02 02
E: 2.661687 8 04 03 01 84 02 31 02 02
E: 2.663455 8 04 03 00 9c 01 9e 02 02
E: 2.665497 8 04 03 01 84 02 38 02 02
E: 2.667422 8 04 03 00 9e 01 a6 02 02
E: 2.669498 8 04 03 01 86 02 41 02 02
E: 2.679601 8 04 03 00 a2 01 b5 02 02
E: 2.681785 8 04 03 01 88 02 47 02 02
E: 2.683635 8 04 03 00 a6 01 c4 02 02
E: 2.685815 8 04 03 01 8a 02 4d 02 02
E: 2.687596 8 04 03 00 ac 01 d3 02 02
E: 2.689780 8 04 03 01 8d 02 55 02 02
E: 2.699634 8 04 03 00 af 01 d8 02 02
E: 2.701726 8 04 03 01 95 02 61 02 02
E: 2.703610 8 04 03 00 b2 01 dd 02 02
E: 2.705841 8 04 03 01 9d 02 6d 02 02
E: 2.707452 8 04 03 00 b5 01 e2 02 02
E: 2.709501 8 04 03 01 a5 02 7b 02 02
E: 2.719423 8 04 03 00 be 01 ea 02 02
E: 2.721499 8 04 03 01 ae 02 83 02 02
E: 2.723423 8 04 03 00 c7 01 f2 02 02
E: 2.725497 8 04 03 01 b7 02 8b 02 02
E: 2.727962 8 04 03 00 d2 01 fb 02 02
E: 2.729668 8 04 03 01 c0 02 93 02 02
E: 2.735619 8 04 03 00 d7 01 fc 02 02
E: 2.737715 8 04 03 01 c5 02 95 02 02
E: 2.739458 8 04 03 00 dc 01 fd 02 02
E: 2.741501 8 04 03 01 ca 02 97 02 02
E: 2.743579 8 04 03 00 e2 01 00 03 02
E: 2.745684 8 04 03 01 d0 02 99 02 02
E: 2.755377 8 04 03 00 ef 01 02 03 02
E: 2.757499 8 04 03 01 dd 02 9c 02 02
E: 2.759426 8 04 03 00 fc 01 04 03 02
E: 2.761709 8 04 03 01 ea 02 9f 02 02
E: 2.763638 8 04 03 00 0b 02 07 03 02
E: 2.765727 8 04 03 01 f9 02 a3 02 02
E: 2.775438 8 04 03 00 11 02 07 03 02
E: 2.777501 8 04 03 01 06 03 a7 02 02
E: 2.779423 8 04 03 00 17 02 07 03 02
E: 2.781499 8 04 03 01 13 03 ab 02 02
E: 2.783425 8 04 03 00 1f 02 08 03 02
E: 2.785492 8 04 03 01 21 03 af 02 02
E: 2.789423 8 04 03 00 2d 02 09 03 02
E: 2.791481 8 04 03 01 26 03 b1 02 02
E: 2.793611 8 04 03 00 3b 02 0a 03 02
E: 2.795528 8 04 03 01 2b 03 b3 02 02
E: 2.797511 8 04 03 00 49 02 0c 03 02
E: 2.799743 8 04 03 01 31 03 b5 02 02
E: 2.809604 8 04 03 00 4e 02 0d 03 02
E: 2.810659 8 04 03 01 3c 03 ba 02 02
E: 2.814692 8 04 03 00 53 02 0e 03 02
E: 2.817196 8 04 03 01 47 03 bf 02 02
E: 2.819034 8 04 03 00 58 02 0f 03 02
E: 2.821183 8 04 03 01 52 03 c4 02 02
E: 2.829083 8 04 03 00 5c 02 10 03 02
E: 2.831501 8 04 03 01 55 03 c6 02 02
E: 2.833529 8 04 03 00 60 02 11 03 02
E: 2.835239 8 04 03 01 58 03 c8 02 02
E: 2.836663 8 04 03 00 65 02 14 03 02
E: 2.838697 8 04 03 01 5c 03 cb 02 02
E: 2.851599 8 04 03 00 68 02 16 03 02
E: 2.853716 8 04 03 01 5e 03 cd 02 02
E: 2.854733 8 04 03 00 6b 02 18 03 02
E: 2.857501 8 04 03 01 60 03 cf 02 02
E: 2.859422 8 04 03 00 6f 02 1c 03 02
E: 2.861499 8 04 03 01 64 03 d3 02 02
E: 2.865638 8 04 03 00 71 02 1f 03 02
E: 2.867741 8 04 03 01 65 03 d7 02 02
E: 2.869451 8 04 03 00 73 02 22 03 02
E: 2.871499 8 04 03 01 66 03 db 02 02
E: 2.873594 8 04 03 00 76 02 26 03 02
E: 2.875732 8 04 03 01 69 03 df 02 02
E: 2.885422 8 04 03 00 77 02 2a 03 02
E: 2.887499 8 04 03 01 69 03 e3 02 02
E: 2.889639 8 04 03 00 78 02 2e 03 02
E: 2.891727 8 04 03 01 69 03 e7 02 02
E: 2.893455 8 04 03 00 7a 02 32 03 02
E: 2.895726 8 04 03 01 6b 03 ec 02 02
E: 2.905438 8 04 03 00 7a 02 34 03 02
E: 2.907746 8 04 03 01 6a 03 f1 02 02
E: 2.909452 8 04 03 00 7a 02 36 03 02
E: 2.911574 8 04 03 01 69 03 f6 02 02
E: 2.913551 8 04 03 00 79 02 39 03 02
E: 2.915685 8 04 03 01 68 03 fd 02 02
E: 2.921430 8 04 03 00 77 02 3e 03 02
E: 2.923498 8 04 03 01 66 03 02 03 02
E: 2.925423 8 04 03 00 75 02 43 03 02
E: 2.927503 8 04 03 01 64 03 07 03 02
E: 2.929426 8 04 03 00 73 02 49 03 02
E: 2.931499 8 04 03 01 60 03 0d 03 02
E: 2.941427 8 04 03 00 6b 02 54 03 02
E: 2.943501 8 04 03 01 57 03 18 03 02
E: 2.945625 8 04 03 00 63 02 5f 03 02
E: 2.947713 8 04 03 01 4e 03 23 03 02
E: 2.949534 8 04 03 00 5a 02 6c 03 02
E: 2.951818 8 04 03 01 45 03 2f 03 02
E: 2.961641 8 04 03 00 51 02 75 03 02
E: 2.963824 8 04 03 01 3b 03 35 03 02
E: 2.965636 8 04 03 00 48 02 7e 03 02
E: 2.967822 8 04 03 01 31 03 3b 03 02
E: 2.968680 8 04 03 00 3e 02 87 03 02
E: 2.972088 8 04 03 01 27 03 42 03 02
E: 2.977598 8 04 03 00 35 02 8d 03 02
E: 2.979822 8 04 03 01 22 03 44 03 02
E: 2.981458 8 04 03 00 2c 02 93 03 02
E: 2.983790 8 04 03 01 1d 03 46 03 02
E: 2.985623 8 04 03 00 21 02 99 03 02
E: 2.987810 8 04 03 01 18 03 49 03 02
E: 2.997624 8 04 03 00 1d 02 9a 03 02
E: 2.999608 8 04 03 01 0c 03 4d 03 02
E: 3.001641 8 04 03 00 19 02 9b 03 02
E: 3.003708 8 04 03 01 00 03 51 03 02
E: 3.005635 8 04 03 00 13 02 9e 03 02
E: 3.006662 8 04 03 01 f3 02 55 03 02
E: 3.017466 8 04 03 00 0e 02 9f 03 02
E: 3.019500 8 04 03 01 ef 02 56 03 02
E: 3.021640 8 04 03 00 09 02 a0 03 02
E: 3.023750 8 04 03 01 eb 02 57 03 02
E: 3.025456 8 04 03 00 03 02 a1 03 02
E: 3.027500 8 04 03 01 e5 02 58 03 02
E: 3.033621 8 04 03 00 ff 01 a1 03 02
E: 3.035686 8 04 03 01 e1 02 58 03 02
E: 3.037599 8 04 03 00 fb 01 a1 03 02
E: 3.039727 8 04 03 01 dd 02 58 03 02
E: 3.041636 8 04 03 00 f5 01 a3 03 02
E: 3.043729 8 04 03 01 d7 02 5a 03 02
E: 3.051457 8 04 03 00 f0 01 a4 03 02
E: 3.053517 8 04 03 01 d3 02 5b 03 02
E: 3.055422 8 04 03 00 eb 01 a5 03 02
E: 3.057680 8 04 03 01 cf 02 5c 03 02
E: 3.059622 8 04 03 00 e6 01 a6 03 02
E: 3.061533 8 04 03 01 c9 02 5d 03 02
E: 3.071425 8 04 03 00 e2 01 a7 03 02
E: 3.073502 8 04 03 01 c5 02 5f 03 02
E: 3.075426 8 04 03 00 de 01 a8 03 02
E: 3.077500 8 04 03 01 c1 02 61 03 02
E: 3.079428 8 04 03 00 d9 01 ab 03 02
E: 3.081501 8 04 03 01 bb 02 65 03 02
E: 3.087633 8 04 00 00 d9 01 ab 03 02
E: 3.089730 8 04 00 01 bb 02 65 03 02
E: 3.177426 8 04 00 00 d9 01 ab 03 02
E: 3.179435 8 04 00 01 bb 02 65 03 02
E: 3.783737 2 03 00
# 2. Land one finger,
   - land a second finger far enough from the first
   - move your two fingers
   - release the *first* finger
   - release the second finger
E: 6.955526 8 04 03 00 26 02 fb 02 02
E: 6.957546 8 04 03 01 27 03 25 02 02
E: 6.959454 8 04 03 00 26 02 fb 02 02
E: 6.961462 8 04 03 01 27 03 25 02 02
E: 6.963458 8 04 03 00 27 02 fb 02 02
E: 6.964679 8 04 03 01 27 03 25 02 02
E: 6.975463 8 04 03 00 27 02 fb 02 02
E: 6.977463 8 04 03 01 27 03 25 02 02
E: 6.979456 8 04 03 00 27 02 fb 02 02
E: 6.981463 8 04 03 01 27 03 25 02 02
E: 6.983456 8 04 03 00 29 02 fb 02 02
E: 6.985638 8 04 03 01 28 03 25 02 02
E: 6.991454 8 04 03 00 2a 02 fb 02 02
E: 6.993610 8 04 03 01 29 03 25 02 02
E: 6.995456 8 04 03 00 2b 02 fb 02 02
E: 6.997609 8 04 03 01 2a 03 25 02 02
E: 6.999456 8 04 03 00 2c 02 fb 02 02
E: 7.001839 8 04 03 01 2b 03 27 02 02
E: 7.011660 8 04 03 00 2d 02 fb 02 02
E: 7.013641 8 04 03 01 2d 03 2a 02 02
E: 7.015455 8 04 03 00 2e 02 fb 02 02
E: 7.017717 8 04 03 01 2f 03 2d 02 02
E: 7.019487 8 04 03 00 30 02 fd 02 02
E: 7.021530 8 04 03 01 33 03 31 02 02
E: 7.031456 8 04 03 00 32 02 ff 02 02
E: 7.033533 8 04 03 01 35 03 35 02 02
E: 7.035464 8 04 03 00 34 02 01 03 02
E: 7.037532 8 04 03 01 37 03 39 02 02
E: 7.039460 8 04 03 00 37 02 03 03 02
E: 7.041533 8 04 03 01 3a 03 3e 02 02
E: 7.047457 8 04 03 00 39 02 06 03 02
E: 7.049760 8 04 03 01 3c 03 43 02 02
E: 7.051485 8 04 03 00 3b 02 09 03 02
E: 7.053543 8 04 03 01 3e 03 48 02 02
E: 7.055456 8 04 03 00 3d 02 0d 03 02
E: 7.057748 8 04 03 01 41 03 4d 02 02
E: 7.067646 8 04 03 00 3f 02 10 03 02
E: 7.069763 8 04 03 01 42 03 51 02 02
E: 7.070813 8 04 03 00 41 02 13 03 02
E: 7.073765 8 04 03 01 43 03 55 02 02
E: 7.075485 8 04 03 00 43 02 17 03 02
E: 7.077537 8 04 03 01 46 03 5a 02 02
E: 7.087457 8 04 03 00 45 02 1a 03 02
E: 7.089533 8 04 03 01 47 03 5f 02 02
E: 7.091460 8 04 03 00 47 02 1d 03 02
E: 7.093533 8 04 03 01 48 03 64 02 02
E: 7.095461 8 04 03 00 49 02 21 03 02
E: 7.097532 8 04 03 01 49 03 69 02 02
E: 7.103672 8 04 03 00 4a 02 25 03 02
E: 7.105760 8 04 03 01 4a 03 6e 02 02
E: 7.107491 8 04 03 00 4b 02 29 03 02
E: 7.109532 8 04 03 01 4b 03 73 02 02
E: 7.111470 8 04 03 00 4d 02 2d 03 02
E: 7.113534 8 04 03 01 4c 03 7a 02 02
E: 7.123461 8 04 03 00 4d 02 2e 03 02
E: 7.125532 8 04 03 01 4c 03 80 02 02
E: 7.127672 8 04 03 00 4d 02 2f 03 02
E: 7.129762 8 04 03 01 4c 03 86 02 02
E: 7.131490 8 04 03 00 4e 02 32 03 02
E: 7.133533 8 04 03 01 4e 03 8e 02 02
E: 7.143676 8 04 03 00 4e 02 34 03 02
E: 7.145568 8 04 03 01 4e 03 94 02 02
E: 7.147470 8 04 03 00 4e 02 36 03 02
E: 7.149532 8 04 03 01 4e 03 9a 02 02
E: 7.151681 8 04 03 00 4f 02 39 03 02
E: 7.153762 8 04 03 01 4f 03 a1 02 02
E: 7.157488 8 04 03 00 4f 02 3d 03 02
E: 7.159533 8 04 03 01 4f 03 a7 02 02
E: 7.161458 8 04 03 00 4f 02 41 03 02
E: 7.163533 8 04 03 01 4f 03 ad 02 02
E: 7.165667 8 04 03 00 51 02 47 03 02
E: 7.167686 8 04 03 01 50 03 b5 02 02
E: 7.177490 8 04 03 00 52 02 4c 03 02
E: 7.179535 8 04 03 01 50 03 bb 02 02
E: 7.181459 8 04 03 00 53 02 51 03 02
E: 7.183534 8 04 03 01 50 03 c1 02 02
E: 7.185468 8 04 03 00 54 02 58 03 02
E: 7.187531 8 04 03 01 52 03 c8 02 02
E: 7.197681 8 04 03 00 55 02 5d 03 02
E: 7.199770 8 04 03 01 53 03 ce 02 02
E: 7.201489 8 04 03 00 56 02 62 03 02
E: 7.203533 8 04 03 01 54 03 d4 02 02
E: 7.205458 8 04 03 00 58 02 69 03 02
E: 7.207533 8 04 03 01 55 03 da 02 02
E: 7.213459 8 04 03 00 59 02 6e 03 02
E: 7.215537 8 04 03 01 56 03 df 02 02
E: 7.217458 8 04 03 00 5a 02 73 03 02
E: 7.219532 8 04 03 01 57 03 e4 02 02
E: 7.221696 8 04 03 00 5d 02 78 03 02
E: 7.223763 8 04 03 01 59 03 eb 02 02
E: 7.233458 8 04 03 00 5f 02 7b 03 02
E: 7.235535 8 04 03 01 5b 03 ef 02 02
E: 7.236874 8 04 03 00 61 02 7e 03 02
E: 7.239739 8 04 03 01 5d 03 f3 02 02
E: 7.241670 8 04 03 00 63 02 83 03 02
E: 7.243573 8 04 03 01 5f 03 f9 02 02
E: 7.253633 8 04 03 00 65 02 86 03 02
E: 7.255763 8 04 03 01 62 03 fd 02 02
E: 7.257492 8 04 03 00 67 02 89 03 02
E: 7.259534 8 04 03 01 65 03 01 03 02
E: 7.261460 8 04 03 00 6b 02 8d 03 02
E: 7.263545 8 04 03 01 68 03 05 03 02
E: 7.269618 8 04 03 00 6e 02 8e 03 02
E: 7.271564 8 04 03 01 6b 03 07 03 02
E: 7.273675 8 04 03 00 71 02 8f 03 02
E: 7.275763 8 04 03 01 6e 03 09 03 02
E: 7.277493 8 04 03 00 76 02 92 03 02
E: 7.279534 8 04 03 01 71 03 0c 03 02
E: 7.289461 8 04 03 00 79 02 92 03 02
E: 7.291534 8 04 03 01 75 03 0d 03 02
E: 7.293463 8 04 03 00 7c 02 92 03 02
E: 7.295534 8 04 03 01 79 03 0e 03 02
E: 7.297460 8 04 03 00 81 02 92 03 02
E: 7.299537 8 04 03 01 7d 03 11 03 02
E: 7.309463 8 04 03 00 85 02 91 03 02
E: 7.311534 8 04 03 01 81 03 11 03 02
E: 7.313462 8 04 03 00 89 02 90 03 02
E: 7.315532 8 04 03 01 85 03 11 03 02
E: 7.317459 8 04 03 00 8e 02 8f 03 02
E: 7.319533 8 04 03 01 89 03 11 03 02
E: 7.329462 8 04 03 00 92 02 8d 03 02
E: 7.331535 8 04 03 01 8d 03 10 03 02
E: 7.333462 8 04 03 00 96 02 8b 03 02
E: 7.335538 8 04 03 01 91 03 0f 03 02
E: 7.337458 8 04 03 00 9c 02 88 03 02
E: 7.339532 8 04 03 01 96 03 0c 03 02
E: 7.343674 8 04 03 00 a0 02 85 03 02
E: 7.345563 8 04 03 01 9a 03 0a 03 02
E: 7.347457 8 04 03 00 a4 02 82 03 02
E: 7.349752 8 04 03 01 9e 03 08 03 02
E: 7.351627 8 04 03 00 a9 02 7d 03 02
E: 7.353720 8 04 03 01 a2 03 05 03 02
E: 7.365663 8 04 03 00 ad 02 79 03 02
E: 7.367806 8 04 03 01 a5 03 03 03 02
E: 7.368754 8 04 03 00 b1 02 75 03 02
E: 7.371820 8 04 03 01 a8 03 01 03 02
E: 7.373528 8 04 03 00 b5 02 6f 03 02
E: 7.375611 8 04 03 01 ac 03 fd 02 02
E: 7.385673 8 04 03 00 b8 02 6b 03 02
E: 7.387691 8 04 03 01 af 03 f9 02 02
E: 7.389626 8 04 03 00 bb 02 67 03 02
E: 7.391764 8 04 03 01 b2 03 f5 02 02
E: 7.393490 8 04 03 00 be 02 62 03 02
E: 7.395731 8 04 03 01 b5 03 f1 02 02
E: 7.399653 8 04 03 00 c0 02 5d 03 02
E: 7.401683 8 04 03 01 b7 03 ec 02 02
E: 7.403654 8 04 03 00 c2 02 58 03 02
E: 7.405838 8 04 03 01 b9 03 e7 02 02
E: 7.407665 8 04 03 00 c5 02 51 03 02
E: 7.409765 8 04 03 01 bb 03 e2 02 02
E: 7.418675 8 04 03 00 c6 02 4b 03 02
E: 7.421753 8 04 03 01 bc 03 dc 02 02
E: 7.423659 8 04 03 00 c7 02 45 03 02
E: 7.425565 8 04 03 01 bd 03 d6 02 02
E: 7.427486 8 04 03 00 ca 02 3e 03 02
E: 7.429538 8 04 03 01 c0 03 d0 02 02
E: 7.441640 8 04 03 00 cb 02 37 03 02
E: 7.443727 8 04 03 01 c1 03 ca 02 02
E: 7.445492 8 04 03 00 cc 02 30 03 02
E: 7.447752 8 04 03 01 c2 03 c4 02 02
E: 7.449648 8 04 03 00 ce 02 28 03 02
E: 7.451735 8 04 03 01 c4 03 bc 02 02
E: 7.455493 8 04 03 00 ce 02 22 03 02
E: 7.457039 8 04 03 01 c4 03 b6 02 02
E: 7.458980 8 04 03 00 ce 02 1c 03 02
E: 7.462159 8 04 03 01 c4 03 b0 02 02
E: 7.462570 8 04 03 00 d0 02 16 03 02
E: 7.465683 8 04 03 01 c5 03 aa 02 02
E: 7.475483 8 04 03 00 d0 02 0f 03 02
E: 7.477527 8 04 03 01 c5 03 a4 02 02
E: 7.479627 8 04 03 00 d0 02 08 03 02
E: 7.481684 8 04 03 01 c5 03 9e 02 02
E: 7.483492 8 04 03 00 d0 02 00 03 02
E: 7.484825 8 04 03 01 c6 03 96 02 02
E: 7.495257 8 04 03 00 d0 02 f9 02 02
E: 7.496615 8 04 03 01 c6 03 8f 02 02
E: 7.499226 8 04 03 00 d0 02 f2 02 02
E: 7.501281 8 04 03 01 c6 03 88 02 02
E: 7.502676 8 04 03 00 cf 02 e9 02 02
E: 7.505681 8 04 03 01 c5 03 7f 02 02
E: 7.511625 8 04 03 00 cf 02 e1 02 02
E: 7.513334 8 04 03 01 c5 03 77 02 02
E: 7.515488 8 04 03 00 cf 02 d9 02 02
E: 7.517350 8 04 03 01 c5 03 6f 02 02
E: 7.519629 8 04 03 00 cd 02 d0 02 02
E: 7.521767 8 04 03 01 c3 03 66 02 02
E: 7.531685 8 04 03 00 cc 02 c9 02 02
E: 7.533705 8 04 03 01 c2 03 5e 02 02
E: 7.535705 8 04 03 00 cb 02 c2 02 02
E: 7.537711 8 04 03 01 c1 03 56 02 02
E: 7.539631 8 04 03 00 c9 02 b9 02 02
E: 7.541718 8 04 03 01 bf 03 4e 02 02
E: 7.551827 8 04 03 00 c8 02 b1 02 02
E: 7.552693 8 04 03 01 be 03 47 02 02
E: 7.555806 8 04 03 00 c7 02 a9 02 02
E: 7.558339 8 04 03 01 bd 03 40 02 02
E: 7.560826 8 04 03 00 c5 02 a0 02 02
E: 7.565941 8 04 03 01 bc 03 37 02 02
E: 7.567612 8 04 03 00 c3 02 8f 02 02
E: 7.569342 8 04 03 01 bb 03 2f 02 02
E: 7.571061 8 04 03 00 c1 02 7e 02 02
E: 7.573753 8 04 03 01 ba 03 27 02 02
E: 7.575096 8 04 03 00 bd 02 6b 02 02
E: 7.577720 8 04 03 01 b7 03 1e 02 02
E: 7.586885 8 04 03 00 bc 02 65 02 02
E: 7.591704 8 04 03 01 b4 03 0d 02 02
E: 7.592728 8 04 03 00 bb 02 5f 02 02
E: 7.595764 8 04 03 01 b1 03 fc 01 02
E: 7.597674 8 04 03 00 b9 02 57 02 02
E: 7.599761 8 04 03 01 ae 03 e9 01 02
E: 7.601601 8 04 03 00 b8 02 51 02 02
E: 7.603729 8 04 03 01 ad 03 e4 01 02
E: 7.605951 8 04 03 00 b7 02 4b 02 02
E: 7.606704 8 04 03 01 ac 03 df 01 02
E: 7.609954 8 04 03 00 b5 02 45 02 02
E: 7.611716 8 04 03 01 aa 03 d9 01 02
E: 7.620898 8 04 03 00 b3 02 3f 02 02
E: 7.626016 8 04 03 01 a9 03 d4 01 02
E: 7.627000 8 04 03 00 b1 02 39 02 02
E: 7.629719 8 04 03 01 a8 03 cf 01 02
E: 7.631163 8 04 03 00 af 02 32 02 02
E: 7.633722 8 04 03 01 a5 03 c8 01 02
E: 7.641649 8 04 03 00 ad 02 2c 02 02
E: 7.643718 8 04 03 01 a3 03 c3 01 02
E: 7.645169 8 04 03 00 ab 02 26 02 02
E: 7.647718 8 04 03 01 a1 03 be 01 02
E: 7.649670 8 04 03 00 a8 02 1e 02 02
E: 7.651730 8 04 03 01 9f 03 b7 01 02
E: 7.663636 8 04 03 00 a6 02 18 02 02
E: 7.665973 8 04 03 01 9d 03 b2 01 02
E: 7.667631 8 04 03 00 a4 02 12 02 02
E: 7.669736 8 04 03 01 9b 03 ad 01 02
E: 7.671668 8 04 03 00 a1 02 0c 02 02
E: 7.673744 8 04 03 01 98 03 a7 01 02
E: 7.677654 8 04 03 00 9e 02 07 02 02
E: 7.679702 8 04 03 01 95 03 a2 01 02
E: 7.681593 8 04 03 00 9b 02 02 02 02
E: 7.683703 8 04 03 01 92 03 9d 01 02
E: 7.685659 8 04 03 00 96 02 fd 01 02
E: 7.687561 8 04 03 01 8e 03 98 01 02
E: 7.697676 8 04 03 00 93 02 fa 01 02
E: 7.699855 8 04 03 01 8b 03 93 01 02
E: 7.701673 8 04 03 00 90 02 f7 01 02
E: 7.703936 8 04 03 01 88 03 8e 01 02
E: 7.705691 8 04 03 00 8b 02 f2 01 02
E: 7.707725 8 04 03 01 83 03 89 01 02
E: 7.716871 8 04 03 00 87 02 ef 01 02
E: 7.720733 8 04 03 01 7f 03 86 01 02
E: 7.724299 8 04 03 00 83 02 ec 01 02
E: 7.726633 8 04 03 01 7b 03 83 01 02
E: 7.729615 8 04 03 00 7d 02 e9 01 02
E: 7.731121 8 04 03 01 76 03 7f 01 02
E: 7.733655 8 04 03 00 78 02 e8 01 02
E: 7.735156 8 04 03 01 71 03 7d 01 02
E: 7.737527 8 04 03 00 73 02 e7 01 02
E: 7.739763 8 04 03 01 6c 03 7b 01 02
E: 7.741529 8 04 03 00 6d 02 e6 01 02
E: 7.743753 8 04 03 01 67 03 78 01 02
E: 7.753564 8 04 03 00 68 02 e7 01 02
E: 7.755568 8 04 03 01 62 03 78 01 02
E: 7.757459 8 04 03 00 63 02 e8 01 02
E: 7.759537 8 04 03 01 5d 03 78 01 02
E: 7.761534 8 04 03 00 5c 02 e9 01 02
E: 7.763767 8 04 03 01 56 03 78 01 02
E: 7.772737 8 04 03 00 51 02 ed 01 02
E: 7.775762 8 04 03 01 4a 03 7a 01 02
E: 7.777659 8 04 03 00 46 02 f1 01 02
E: 7.779569 8 04 03 01 3e 03 7c 01 02
E: 7.781464 8 04 03 00 39 02 f6 01 02
E: 7.783549 8 04 03 01 32 03 7f 01 02
E: 7.793468 8 04 03 00 35 02 f9 01 02
E: 7.795537 8 04 03 01 2e 03 80 01 02
E: 7.797466 8 04 03 00 31 02 fc 01 02
E: 7.799538 8 04 03 01 2a 03 81 01 02
E: 7.801529 8 04 03 00 2b 02 ff 01 02
E: 7.803771 8 04 03 01 24 03 84 01 02
E: 7.809497 8 04 03 00 21 02 06 02 02
E: 7.811550 8 04 03 01 1a 03 8a 01 02
E: 7.813677 8 04 03 00 17 02 0d 02 02
E: 7.815771 8 04 03 01 10 03 90 01 02
E: 7.817494 8 04 03 00 0c 02 14 02 02
E: 7.819538 8 04 03 01 04 03 96 01 02
E: 7.829682 8 04 03 00 09 02 18 02 02
E: 7.831767 8 04 03 01 00 03 99 01 02
E: 7.833498 8 04 03 00 06 02 1c 02 02
E: 7.835546 8 04 03 01 fc 02 9c 01 02
E: 7.837675 8 04 03 00 01 02 22 02 02
E: 7.839768 8 04 03 01 f8 02 a0 01 02
E: 7.849466 8 04 03 00 fa 01 2e 02 02
E: 7.851540 8 04 03 01 f1 02 a9 01 02
E: 7.853464 8 04 03 00 f3 01 3a 02 02
E: 7.855538 8 04 03 01 ea 02 b2 01 02
E: 7.856713 8 04 03 00 ec 01 46 02 02
E: 7.859842 8 04 03 01 e1 02 bc 01 02
E: 7.863660 8 04 03 00 ea 01 4a 02 02
E: 7.865608 8 04 03 01 df 02 c1 01 02
E: 7.867467 8 04 03 00 e8 01 4e 02 02
E: 7.869567 8 04 03 01 dd 02 c6 01 02
E: 7.871795 8 04 03 00 e6 01 53 02 02
E: 7.873753 8 04 03 01 da 02 cb 01 02
E: 7.882780 8 04 03 00 e4 01 58 02 02
E: 7.885881 8 04 03 01 d8 02 d0 01 02
E: 7.887659 8 04 03 00 e2 01 5d 02 02
E: 7.889829 8 04 03 01 d6 02 d5 01 02
E: 7.892056 8 04 03 00 e0 01 64 02 02
E: 7.893732 8 04 03 01 d4 02 da 01 02
E: 7.903678 8 04 03 00 df 01 69 02 02
E: 7.904756 8 04 03 01 d3 02 df 01 02
E: 7.906865 8 04 03 00 de 01 6e 02 02
E: 7.909758 8 04 03 01 d2 02 e4 01 02
E: 7.911660 8 04 03 00 dd 01 75 02 02
E: 7.913744 8 04 03 01 d1 02 e9 01 02
E: 7.918779 8 04 03 00 dd 01 7b 02 02
E: 7.923341 8 04 03 01 d1 02 ee 01 02
E: 7.924714 8 04 03 00 dd 01 81 02 02
E: 7.928224 8 04 03 01 d1 02 f3 01 02
E: 7.931636 8 04 03 00 dc 01 87 02 02
E: 7.933726 8 04 03 01 d0 02 f8 01 02
E: 7.939445 8 04 03 00 dc 01 8d 02 02
E: 7.941769 8 04 03 01 d0 02 fd 01 02
E: 7.943671 8 04 03 00 dc 01 93 02 02
E: 7.945528 8 04 03 01 d0 02 02 02 02
E: 7.948216 8 04 03 00 dd 01 99 02 02
E: 7.950851 8 04 03 01 d1 02 09 02 02
E: 7.959073 8 04 03 00 de 01 9f 02 02
E: 7.961753 8 04 03 01 d2 02 0f 02 02
E: 7.963131 8 04 03 00 df 01 a5 02 02
E: 7.965722 8 04 03 01 d3 02 15 02 02
E: 7.966621 8 04 03 00 e1 01 ab 02 02
E: 7.968591 8 04 03 01 d4 02 1b 02 02
E: 7.974726 8 04 03 00 e2 01 b0 02 02
E: 7.978367 8 04 03 01 d5 02 21 02 02
E: 7.981612 8 04 03 00 e3 01 b5 02 02
E: 7.983858 8 04 03 01 d6 02 27 02 02
E: 7.985673 8 04 03 00 e5 01 bc 02 02
E: 7.987745 8 04 03 01 d8 02 2d 02 02
E: 7.995675 8 04 03 00 e7 01 c1 02 02
E: 7.997765 8 04 03 01 da 02 33 02 02
E: 7.999669 8 04 03 00 e9 01 c6 02 02
E: 8.001722 8 04 03 01 dc 02 39 02 02
E: 8.004249 8 04 03 00 eb 01 cd 02 02
E: 8.006640 8 04 03 01 df 02 40 02 02
E: 8.015085 8 04 03 00 ed 01 d2 02 02
E: 8.017529 8 04 03 01 e1 02 46 02 02
E: 8.018781 8 04 03 00 ef 01 d7 02 02
E: 8.022039 8 04 03 01 e3 02 4c 02 02
E: 8.023624 8 04 03 00 f1 01 dd 02 02
E: 8.024712 8 04 03 01 e5 02 52 02 02
E: 8.029497 8 04 03 00 f3 01 e3 02 02
E: 8.031541 8 04 03 01 e7 02 57 02 02
E: 8.033673 8 04 03 00 f5 01 e9 02 02
E: 8.035763 8 04 03 01 e9 02 5c 02 02
E: 8.036863 8 04 03 00 f7 01 ef 02 02
E: 8.039995 8 04 03 01 eb 02 61 02 02
E: 8.051895 8 04 03 00 f8 01 f5 02 02
E: 8.053746 8 04 03 01 ec 02 66 02 02
E: 8.054705 8 04 03 00 f9 01 fb 02 02
E: 8.058367 8 04 03 01 ed 02 6b 02 02
E: 8.060813 8 04 03 00 fb 01 02 03 02
E: 8.065080 8 04 03 01 ef 02 71 02 02
E: 8.067134 8 04 03 00 fc 01 08 03 02
E: 8.069151 8 04 03 01 f0 02 76 02 02
E: 8.071634 8 04 03 00 fd 01 0e 03 02
E: 8.073150 8 04 03 01 f1 02 7b 02 02
E: 8.074685 8 04 03 00 fe 01 14 03 02
E: 8.077853 8 04 03 01 f2 02 82 02 02
E: 8.087498 8 04 03 00 fe 01 19 03 02
E: 8.089620 8 04 03 01 f2 02 88 02 02
E: 8.091666 8 04 03 00 fe 01 1e 03 02
E: 8.093859 8 04 03 01 f2 02 8e 02 02
E: 8.095618 8 04 03 00 ff 01 23 03 02
E: 8.097705 8 04 03 01 f3 02 94 02 02
E: 8.106732 8 04 03 00 ff 01 25 03 02
E: 8.110242 8 04 03 01 f3 02 99 02 02
E: 8.111584 8 04 03 00 ff 01 27 03 02
E: 8.113724 8 04 03 01 f3 02 9e 02 02
E: 8.115689 8 04 03 00 00 02 2a 03 02
E: 8.117719 8 04 03 01 f4 02 a5 02 02
E: 8.123626 8 04 03 00 00 02 2f 03 02
E: 8.125769 8 04 03 01 f4 02 a7 02 02
E: 8.127489 8 04 03 00 00 02 34 03 02
E: 8.129567 8 04 03 01 f4 02 a9 02 02
E: 8.130727 8 04 03 00 00 02 3a 03 02
E: 8.132701 8 04 03 01 f4 02 ad 02 02
E: 8.143697 8 04 03 00 00 02 3c 03 02
E: 8.145573 8 04 03 01 f4 02 af 02 02
E: 8.147620 8 04 03 00 00 02 3e 03 02
E: 8.148727 8 04 03 01 f4 02 b1 02 02
E: 8.152304 8 04 03 00 00 02 41 03 02
E: 8.154702 8 04 03 01 f4 02 b4 02 02
E: 8.159624 8 04 03 00 00 02 47 03 02
E: 8.161129 8 04 03 01 f4 02 b9 02 02
E: 8.163662 8 04 03 00 00 02 4d 03 02
E: 8.165156 8 04 03 01 f4 02 be 02 02
E: 8.167635 8 04 03 00 fe 01 53 03 02
E: 8.169747 8 04 03 01 f2 02 c4 02 02
E: 8.179437 8 04 03 00 fe 01 59 03 02
E: 8.181544 8 04 03 01 f2 02 c9 02 02
E: 8.182705 8 04 03 00 fe 01 5f 03 02
E: 8.185726 8 04 03 01 f2 02 ce 02 02
E: 8.187601 8 04 03 00 fd 01 65 03 02
E: 8.189706 8 04 03 01 f0 02 d3 02 02
E: 8.199656 8 04 03 00 fd 01 6a 03 02
E: 8.201772 8 04 03 01 f0 02 d8 02 02
E: 8.203663 8 04 03 00 fd 01 6f 03 02
E: 8.205569 8 04 03 01 f0 02 dd 02 02
E: 8.207692 8 04 03 00 fb 01 76 03 02
E: 8.209771 8 04 03 01 ee 02 e4 02 02
E: 8.219640 8 04 03 00 fb 01 7b 03 02
E: 8.221774 8 04 03 01 ee 02 e9 02 02
E: 8.222862 8 04 03 00 fb 01 80 03 02
E: 8.225790 8 04 03 01 ee 02 ee 02 02
E: 8.227640 8 04 03 00 f9 01 85 03 02
E: 8.229731 8 04 03 01 ec 02 f3 02 02
E: 8.233666 8 04 03 00 f9 01 89 03 02
E: 8.235571 8 04 03 01 eb 02 f8 02 02
E: 8.237681 8 04 03 00 f9 01 8d 03 02
E: 8.239753 8 04 03 01 ea 02 fd 02 02
E: 8.241620 8 04 03 00 f7 01 92 03 02
E: 8.243742 8 04 03 01 e9 02 03 03 02
E: 8.252658 8 04 03 00 f7 01 93 03 02
E: 8.255506 8 04 03 01 e9 02 07 03 02
E: 8.257623 8 04 03 00 f7 01 94 03 02
E: 8.259665 8 04 03 01 e9 02 0b 03 02
E: 8.261634 8 04 03 00 f6 01 97 03 02
E: 8.263688 8 04 03 01 e7 02 11 03 02
E: 8.269634 8 04 03 00 f6 01 98 03 02
E: 8.271632 8 04 03 01 e7 02 12 03 02
E: 8.273501 8 04 03 00 f6 01 99 03 02
E: 8.275537 8 04 03 01 e7 02 13 03 02
E: 8.277701 8 04 03 00 f5 01 9c 03 02
E: 8.278757 8 04 03 01 e6 02 16 03 02
E: 8.289863 8 04 03 00 f5 01 9d 03 02
E: 8.291770 8 04 03 01 e6 02 17 03 02
E: 8.292689 8 04 03 00 f5 01 9e 03 02
E: 8.295845 8 04 03 01 e6 02 18 03 02
E: 8.297686 8 04 03 00 f4 01 a1 03 02
E: 8.299742 8 04 03 01 e5 02 19 03 02
E: 8.309684 8 04 03 00 f4 01 a2 03 02
E: 8.311772 8 04 03 01 e5 02 1a 03 02
E: 8.313501 8 04 03 00 f4 01 a3 03 02
E: 8.315543 8 04 03 01 e5 02 1b 03 02
E: 8.317469 8 04 03 00 f4 01 a4 03 02
E: 8.319543 8 04 03 01 e5 02 1e 03 02
E: 8.325471 8 04 03 00 f4 01 a5 03 02
E: 8.327546 8 04 03 01 e5 02 1f 03 02
E: 8.329467 8 04 03 00 f4 01 a6 03 02
E: 8.331542 8 04 03 01 e5 02 20 03 02
E: 8.333467 8 04 03 00 f3 01 a8 03 02
E: 8.335550 8 04 03 01 e4 02 21 03 02
E: 8.345469 8 04 03 00 f3 01 a8 03 02
E: 8.347474 8 04 03 01 e4 02 21 03 02
E: 8.349467 8 04 03 00 f3 01 a8 03 02
E: 8.351669 8 04 03 01 e4 02 21 03 02
E: 8.353683 8 04 03 00 f3 01 a9 03 02
E: 8.355873 8 04 03 01 e4 02 23 03 02
E: 8.365643 8 04 03 00 f3 01 a9 03 02
E: 8.367688 8 04 03 01 e4 02 23 03 02
E: 8.369680 8 04 03 00 f3 01 a9 03 02
E: 8.371687 8 04 03 01 e4 02 23 03 02
E: 8.373499 8 04 03 00 f2 01 ab 03 02
E: 8.375623 8 04 03 01 e4 02 25 03 02
E: 8.379683 8 04 03 00 f2 01 ab 03 02
E: 8.381689 8 04 03 01 e4 02 25 03 02
E: 8.383680 8 04 03 00 f2 01 ab 03 02
E: 8.385688 8 04 03 01 e4 02 25 03 02
E: 8.387657 8 04 03 00 f2 01 ad 03 02
E: 8.389654 8 04 03 01 e4 02 25 03 02
E: 8.401477 8 04 03 00 f2 01 ad 03 02
E: 8.403476 8 04 03 01 e4 02 25 03 02
E: 8.405469 8 04 03 00 f2 01 ad 03 02
E: 8.407484 8 04 03 01 e4 02 25 03 02
E: 8.409472 8 04 03 00 f2 01 ad 03 02
E: 8.411560 8 04 03 01 e3 02 26 03 02
E: 8.421469 8 04 03 00 f2 01 ad 03 02
E: 8.423473 8 04 03 01 e3 02 26 03 02
E: 8.425468 8 04 03 00 f2 01 ad 03 02
E: 8.427476 8 04 03 01 e3 02 26 03 02
E: 8.429468 8 04 03 00 f2 01 ae 03 02
E: 8.431547 8 04 03 01 e3 02 28 03 02
E: 8.435478 8 04 03 00 f2 01 ae 03 02
E: 8.437473 8 04 03 01 e3 02 28 03 02
E: 8.439468 8 04 03 00 f2 01 ae 03 02
E: 8.441477 8 04 03 01 e3 02 28 03 02
E: 8.443469 8 04 03 00 f1 01 b0 03 02
E: 8.445549 8 04 03 01 e3 02 28 03 02
E: 8.454703 8 04 03 00 f1 01 b0 03 02
E: 8.457682 8 04 03 01 e3 02 28 03 02
E: 8.459681 8 04 03 00 f1 01 b0 03 02
E: 8.461688 8 04 03 01 e3 02 28 03 02
E: 8.463680 8 04 03 00 f1 01 b0 03 02
E: 8.465777 8 04 03 01 e3 02 2a 03 02
E: 8.475469 8 04 03 00 f1 01 b0 03 02
E: 8.477487 8 04 03 01 e3 02 2a 03 02
E: 8.479467 8 04 03 00 f1 01 b0 03 02
E: 8.481476 8 04 03 01 e3 02 2a 03 02
E: 8.483472 8 04 03 00 f1 01 b2 03 02
E: 8.485549 8 04 03 01 e3 02 2a 03 02
E: 8.491470 8 04 03 00 f1 01 b2 03 02
E: 8.493476 8 04 03 01 e3 02 2a 03 02
E: 8.495469 8 04 03 00 f1 01 b2 03 02
E: 8.497474 8 04 03 01 e3 02 2a 03 02
E: 8.499469 8 04 03 00 f1 01 b2 03 02
E: 8.501557 8 04 03 01 e3 02 2b 03 02
E: 8.511469 8 04 03 00 f1 01 b2 03 02
E: 8.513477 8 04 03 01 e3 02 2b 03 02
E: 8.515468 8 04 03 00 f1 01 b2 03 02
E: 8.517477 8 04 03 01 e3 02 2b 03 02
E: 8.519468 8 04 03 00 f1 01 b3 03 02
E: 8.521543 8 04 03 01 e3 02 2b 03 02
E: 8.530735 8 04 03 00 f1 01 b3 03 02
E: 8.533825 8 04 03 01 e3 02 2b 03 02
E: 8.534735 8 04 03 00 f1 01 b3 03 02
E: 8.536714 8 04 03 01 e3 02 2b 03 02
E: 8.540266 8 04 03 00 f1 01 b3 03 02
E: 8.542710 8 04 03 01 e2 02 2d 03 02
E: 8.546609 8 04 03 00 f1 01 b3 03 02
E: 8.549209 8 04 03 01 e2 02 2d 03 02
E: 8.550598 8 04 03 00 f1 01 b3 03 02
E: 8.552548 8 04 03 01 e2 02 2d 03 02
E: 8.554562 8 04 03 00 f1 01 b3 03 02
E: 8.557141 8 04 03 01 e2 02 2d 03 02
E: 8.567228 8 04 03 00 f1 01 b3 03 02
E: 8.569233 8 04 03 01 e2 02 2d 03 02
E: 8.570804 8 04 03 00 f1 01 b3 03 02
E: 8.573500 8 04 03 01 e2 02 2d 03 02
E: 8.575610 8 04 03 00 f0 01 b5 03 02
E: 8.577705 8 04 03 01 e2 02 2f 03 02
E: 8.587610 8 04 03 00 f0 01 b5 03 02
E: 8.589297 8 04 03 01 e2 02 2f 03 02
E: 8.591676 8 04 03 00 f0 01 b5 03 02
E: 8.593286 8 04 03 01 e2 02 2f 03 02
E: 8.595667 8 04 03 00 f0 01 b5 03 02
E: 8.597685 8 04 03 01 e2 02 2f 03 02
E: 8.633701 8 04 00 00 e2 02 2f 03 02
E: 8.635880 8 04 00 01 e2 02 2f 03 02
E: 8.723478 8 04 00 00 e2 02 2f 03 02
E: 8.725479 8 04 00 01 e2 02 2f 03 02
E: 9.329792 2 03 00
# 3. Finally, move your ten fingers on the screen and release them.
E: 12.073587 8 04 03 00 e3 01 09 03 02
E: 12.075592 8 04 03 01 c9 02 8d 02 02
E: 12.077503 8 04 03 00 e3 01 0a 03 02
E: 12.079574 8 04 03 01 c9 02 8e 02 02
E: 12.081500 8 04 03 00 e3 01 0d 03 02
E: 12.083567 8 04 03 01 c8 02 91 02 02
E: 12.093498 8 04 03 00 e3 01 0f 03 02
E: 12.095577 8 04 03 01 c8 02 96 02 02
E: 12.097497 8 04 03 00 e3 01 11 03 02
E: 12.099572 8 04 03 01 c8 02 9b 02 02
E: 12.101513 8 04 03 00 e3 01 14 03 02
E: 12.103572 8 04 03 01 c7 02 a0 02 02
E: 12.113500 8 04 03 00 e3 01 16 03 02
E: 12.115573 8 04 03 01 c7 02 a5 02 02
E: 12.117498 8 04 03 00 e3 01 18 03 02
E: 12.119567 8 04 03 01 c7 02 aa 02 02
E: 12.121497 8 04 03 00 e4 01 1b 03 02
E: 12.123575 8 04 03 01 c6 02 b0 02 02
E: 12.127497 8 04 03 00 e4 01 20 03 02
E: 12.129575 8 04 03 01 c6 02 b5 02 02
E: 12.130736 8 04 03 00 e4 01 25 03 02
E: 12.133756 8 04 03 01 c6 02 ba 02 02
E: 12.135696 8 04 03 00 e6 01 2b 03 02
E: 12.136751 8 04 03 01 c5 02 c1 02 02
E: 12.147682 8 04 03 00 e6 01 30 03 02
E: 12.149804 8 04 03 01 c5 02 c3 02 02
E: 12.151539 8 04 03 00 e6 01 35 03 02
E: 12.153573 8 04 03 01 c5 02 c5 02 02
E: 12.155711 8 04 03 00 e8 01 3a 03 02
E: 12.157826 8 04 03 01 c5 02 c9 02 02
E: 12.166593 8 04 03 00 e9 01 40 03 02
E: 12.169785 8 04 03 01 c5 02 cf 02 02
E: 12.171710 8 04 03 00 ea 01 46 03 02
E: 12.173766 8 04 03 01 c5 02 d5 02 02
E: 12.175706 8 04 03 00 eb 01 4c 03 02
E: 12.177596 8 04 03 01 c7 02 dc 02 02
E: 12.183153 8 04 03 00 ec 01 51 03 02
E: 12.185790 8 04 03 01 c8 02 e3 02 02
E: 12.187173 8 04 03 00 ed 01 56 03 02
E: 12.189587 8 04 03 01 c9 02 ea 02 02
E: 12.191153 8 04 03 00 ef 01 5d 03 02
E: 12.193584 8 04 03 01 ca 02 f1 02 02
E: 12.203158 8 04 03 00 f1 01 62 03 02
E: 12.205794 8 04 03 01 cc 02 f7 02 02
E: 12.207154 8 04 03 00 f3 01 67 03 02
E: 12.209761 8 04 03 01 ce 02 fd 02 02
E: 12.211195 8 04 03 00 f5 01 6e 03 02
E: 12.213763 8 04 03 01 d0 02 05 03 02
E: 12.223667 8 04 03 00 f7 01 73 03 02
E: 12.225162 8 04 03 01 d2 02 0a 03 02
E: 12.226719 8 04 03 00 f9 01 78 03 02
E: 12.229195 8 04 03 01 d4 02 0f 03 02
E: 12.231672 8 04 03 00 fb 01 7d 03 02
E: 12.232706 8 04 03 01 d6 02 16 03 02
E: 12.239223 8 04 03 00 fd 01 80 03 02
E: 12.241206 8 04 03 01 d8 02 1b 03 02
E: 12.243636 8 04 03 00 ff 01 83 03 02
E: 12.245306 8 04 03 01 da 02 20 03 02
E: 12.247718 8 04 03 00 02 02 88 03 02
E: 12.249298 8 04 03 01 dc 02 25 03 02
E: 12.259223 8 04 03 00 04 02 8c 03 02
E: 12.261576 8 04 03 01 de 02 29 03 02
E: 12.263224 8 04 03 00 06 02 90 03 02
E: 12.265573 8 04 03 01 e0 02 2d 03 02
E: 12.267220 8 04 03 00 09 02 94 03 02
E: 12.269278 8 04 03 01 e3 02 32 03 02
E: 12.279683 8 04 03 00 0b 02 97 03 02
E: 12.281346 8 04 03 01 e5 02 36 03 02
E: 12.283716 8 04 03 00 0d 02 9a 03 02
E: 12.285351 8 04 03 01 e7 02 3a 03 02
E: 12.287211 8 04 03 00 0f 02 9e 03 02
E: 12.289760 8 04 03 01 e9 02 3e 03 02
E: 12.295253 8 04 03 00 0f 02 9f 03 02
E: 12.297578 8 04 03 01 e9 02 3f 03 02
E: 12.299220 8 04 03 00 0f 02 a0 03 02
E: 12.301586 8 04 03 01 e9 02 40 03 02
E: 12.303219 8 04 03 00 11 02 a1 03 02
E: 12.305573 8 04 03 01 eb 02 41 03 02
E: 12.315221 8 04 03 00 11 02 a2 03 02
E: 12.317575 8 04 03 01 eb 02 42 03 02
E: 12.319218 8 04 03 00 11 02 a3 03 02
E: 12.321575 8 04 03 01 eb 02 43 03 02
E: 12.323250 8 04 03 00 13 02 a4 03 02
E: 12.325804 8 04 03 01 ed 02 46 03 02
E: 12.334739 8 04 03 00 13 02 a5 03 02
E: 12.337606 8 04 03 01 ed 02 47 03 02
E: 12.339499 8 04 03 00 13 02 a6 03 02
E: 12.341576 8 04 03 01 ed 02 48 03 02
E: 12.343709 8 04 03 00 15 02 a8 03 02
E: 12.345803 8 04 03 01 ef 02 49 03 02
E: 12.349530 8 04 03 00 15 02 a9 03 02
E: 12.351573 8 04 03 01 ef 02 49 03 02
E: 12.353510 8 04 03 00 15 02 aa 03 02
E: 12.355577 8 04 03 01 ef 02 49 03 02
E: 12.357711 8 04 03 00 17 02 ab 03 02
E: 12.359809 8 04 03 01 f1 02 4b 03 02
E: 12.369527 8 04 03 00 17 02 ab 03 02
E: 12.371590 8 04 03 01 f1 02 4c 03 02
E: 12.373498 8 04 03 00 17 02 ab 03 02
E: 12.375576 8 04 03 01 f1 02 4d 03 02
E: 12.377501 8 04 03 00 19 02 ad 03 02
E: 12.379577 8 04 03 01 f2 02 4e 03 02
E: 12.389500 8 04 03 00 19 02 ae 03 02
E: 12.391579 8 04 03 01 f2 02 4e 03 02
E: 12.393501 8 04 03 00 19 02 af 03 02
E: 12.395575 8 04 03 01 f2 02 4e 03 02
E: 12.397699 8 04 03 00 1a 02 b0 03 02
E: 12.399792 8 04 03 01 f3 02 50 03 02
E: 12.405531 8 04 03 00 1a 02 b0 03 02
E: 12.407629 8 04 03 01 f3 02 50 03 02
E: 12.409512 8 04 03 00 1a 02 b0 03 02
E: 12.411507 8 04 03 01 f3 02 50 03 02
E: 12.413503 8 04 03 00 1b 02 b0 03 02
E: 12.415575 8 04 03 01 f4 02 51 03 02
E: 12.425506 8 04 03 00 1b 02 b0 03 02
E: 12.427505 8 04 03 01 f4 02 51 03 02
E: 12.429502 8 04 03 00 1b 02 b0 03 02
E: 12.431504 8 04 03 01 f4 02 51 03 02
E: 12.433499 8 04 03 00 1b 02 b2 03 02
E: 12.435570 8 04 03 01 f4 02 51 03 02
E: 12.441503 8 04 03 00 1b 02 b2 03 02
E: 12.443505 8 04 03 01 f4 02 51 03 02
E: 12.445502 8 04 03 00 1b 02 b2 03 02
E: 12.447504 8 04 03 01 f4 02 51 03 02
E: 12.449501 8 04 03 00 1c 02 b2 03 02
E: 12.451577 8 04 03 01 f5 02 53 03 02
E: 12.461494 8 04 00 00 1c 02 b2 03 02
E: 12.463809 8 04 00 01 f5 02 53 03 02
E: 12.551729 8 04 00 00 1c 02 b2 03 02
E: 12.553702 8 04 00 01 f5 02 53 03 02
E: 13.157230 2 03 00
# Thank you.
