R: 402 05 01 09 02 a1 01 85 0d 09 01 a1 00 05 09 19 01 29 02 15 00 25 01 95 02 75 01 81 02 95 01 75 06 81 03 05 01 55 0e 65 11 75 10 95 01 35 00 46 5a 14 26 ff 7f 09 30 81 22 46 72 0b 26 ff 7f 09 31 81 22 95 08 75 08 81 03 c0 c0 05 0d 09 04 a1 01 85 01 09 22 a1 02 09 42 15 00 25 01 75 01 95 01 81 02 09 32 81 02 09 47 81 02 95 05 81 03 75 08 09 51 95 01 81 02 05 01 75 10 55 0e 65 11 09 30 35 00 46 5a 14 26 ff 7f 81 02 09 31 46 72 0b 26 ff 7f 81 02 c0 a1 02 05 0d 09 42 15 00 25 01 75 01 95 01 81 02 09 32 81 02 09 47 81 02 95 05 81 03 75 08 09 51 95 01 81 02 05 01 75 10 55 0e 65 11 09 30 35 00 46 5a 14 26 ff 7f 81 02 46 72 0b 26 ff 7f 09 31 81 02 c0 05 0d 09 54 15 00 26 ff 00 95 01 75 08 81 02 09 55 25 02 95 01 85 02 b1 02 c0 05 0d 09 0e a1 01 06 00 ff 09 01 26 ff 00 75 08 95 47 85 03 b1 02 09 01 96 ff 03 85 04 b1 02 09 01 95 0b 85 05 b1 02 09 01 96 ff 03 85 06 b1 02 09 01 95 0f 85 07 b1 02 09 01 96 ff 03 85 08 b1 02 09 01 96 ff 03 85 09 b1 02 09 01 95 3f 85 0a b1 02 09 01 96 ff 03 85 0b b1 02 09 01 96 c3 03 85 0e b1 02 09 01 96 ff 03 85 0f b1 02 09 01 96 83 03 85 10 b1 02 09 01 96 93 00 85 11 b1 02 09 01 96 ff 03 85 12 b1 02 05 0d 09 23 a1 02 09 52 09 53 15 00 25 0a 75 08 95 02 85 0c b1 02 c0 c0
N: PixArtImaging OpticalTouchScreen
I: 3 093a 8002
# 1. Drag _one_ finger on the screen from one corner to the opposite, and release it.
E: 0.000000 14 01 07 00 6b 00 75 00 00 01 f1 1c 69 4b 01
E: 0.007906 14 01 07 00 8b 00 bb 00 00 01 f1 1c 69 4b 01
E: 0.015894 14 01 07 00 9b 00 de 00 00 01 f1 1c 69 4b 01
E: 0.023876 14 01 07 00 a6 00 f7 00 00 01 f1 1c 69 4b 01
E: 0.031895 14 01 07 00 af 00 0c 01 00 01 f1 1c 69 4b 01
E: 0.039979 14 01 07 00 b5 00 1c 01 00 01 f1 1c 69 4b 01
E: 0.047947 14 01 07 00 ba 00 29 01 00 01 f1 1c 69 4b 01
E: 0.055945 14 01 07 00 be 00 32 01 00 01 f1 1c 69 4b 01
E: 0.063949 14 01 07 00 c0 00 38 01 00 01 f1 1c 69 4b 01
E: 0.071947 14 01 07 00 c2 00 3c 01 00 01 f1 1c 69 4b 01
E: 0.079982 14 01 07 00 c3 00 3f 01 00 01 f1 1c 69 4b 01
E: 0.087935 14 01 07 00 c4 00 41 01 00 01 f1 1c 69 4b 01
E: 0.095901 14 01 07 00 c4 00 42 01 00 01 f1 1c 69 4b 01
E: 0.103986 14 01 07 00 c4 00 43 01 00 01 f1 1c 69 4b 01
E: 0.111990 14 01 07 00 c5 00 43 01 00 01 f1 1c 69 4b 01
E: 0.119992 14 01 07 00 c5 00 44 01 00 01 f1 1c 69 4b 01
E: 0.127957 14 01 07 00 c5 00 45 01 00 01 f1 1c 69 4b 01
E: 0.135997 14 01 07 00 c6 00 46 01 00 01 f1 1c 69 4b 01
E: 0.143955 14 01 07 00 c6 00 46 01 00 01 f1 1c 69 4b 01
E: 0.151938 14 01 07 00 c6 00 46 01 00 01 f1 1c 69 4b 01
E: 0.159958 14 01 07 00 c6 00 47 01 00 01 f1 1c 69 4b 01
E: 0.167997 14 01 07 00 c6 00 48 01 00 01 f1 1c 69 4b 01
E: 0.175993 14 01 07 00 c7 00 48 01 00 01 f1 1c 69 4b 01
E: 0.183961 14 01 07 00 c7 00 49 01 00 01 f1 1c 69 4b 01
E: 0.191999 14 01 07 00 c7 00 4a 01 00 01 f1 1c 69 4b 01
E: 0.199961 14 01 07 00 c7 00 4a 01 00 01 f1 1c 69 4b 01
E: 0.207964 14 01 07 00 c8 00 4b 01 00 01 f1 1c 69 4b 01
E: 0.215958 14 01 07 00 c8 00 4c 01 00 01 f1 1c 69 4b 01
E: 0.223994 14 01 07 00 c8 00 4c 01 00 01 f1 1c 69 4b 01
E: 0.231997 14 01 07 00 c9 00 4d 01 00 01 f1 1c 69 4b 01
E: 0.239965 14 01 07 00 c9 00 4e 01 00 01 f1 1c 69 4b 01
E: 0.247885 14 01 07 00 c9 00 4e 01 00 01 f1 1c 69 4b 01
E: 0.255966 14 01 07 00 c9 00 4f 01 00 01 f1 1c 69 4b 01
E: 0.263962 14 01 07 00 ca 00 4f 01 00 01 f1 1c 69 4b 01
E: 0.271968 14 01 07 00 ca 00 50 01 00 01 f1 1c 69 4b 01
E: 0.279964 14 01 07 00 ca 00 51 01 00 01 f1 1c 69 4b 01
E: 0.288000 14 01 07 00 ca 00 51 01 00 01 f1 1c 69 4b 01
E: 0.295970 14 01 07 00 ca 00 51 01 00 01 f1 1c 69 4b 01
E: 0.303971 14 01 07 00 cb 00 52 01 00 01 f1 1c 69 4b 01
E: 0.312005 14 01 07 00 cb 00 53 01 00 01 f1 1c 69 4b 01
E: 0.319967 14 01 07 00 cb 00 53 01 00 01 f1 1c 69 4b 01
E: 0.327975 14 01 07 00 cb 00 53 01 00 01 f1 1c 69 4b 01
E: 0.336012 14 01 07 00 cb 00 54 01 00 01 f1 1c 69 4b 01
E: 0.343975 14 01 07 00 cb 00 54 01 00 01 f1 1c 69 4b 01
E: 0.351976 14 01 07 00 cc 00 55 01 00 01 f1 1c 69 4b 01
E: 0.360013 14 01 07 00 cc 00 55 01 00 01 f1 1c 69 4b 01
E: 0.367980 14 01 07 00 cc 00 56 01 00 01 f1 1c 69 4b 01
E: 0.375980 14 01 07 00 cc 00 57 01 00 01 f1 1c 69 4b 01
E: 0.383978 14 01 07 00 cd 00 57 01 00 01 f1 1c 69 4b 01
E: 0.391981 14 01 07 00 cd 00 58 01 00 01 f1 1c 69 4b 01
E: 0.399980 14 01 07 00 cd 00 58 01 00 01 f1 1c 69 4b 01
E: 0.407983 14 01 07 00 cd 00 59 01 00 01 f1 1c 69 4b 01
E: 0.415977 14 01 07 00 cd 00 59 01 00 01 f1 1c 69 4b 01
E: 0.423989 14 01 07 00 ce 00 5a 01 00 01 f1 1c 69 4b 01
E: 0.431974 14 01 07 00 ce 00 5a 01 00 01 f1 1c 69 4b 01
E: 0.440018 14 01 07 00 d0 00 5e 01 00 01 f1 1c 69 4b 01
E: 0.448021 14 01 07 00 03 01 ac 01 00 01 f1 1c 69 4b 01
E: 0.455988 14 01 07 00 36 01 ff 01 00 01 f1 1c 69 4b 01
E: 0.463989 14 01 07 00 63 01 43 02 00 01 f1 1c 69 4b 01
E: 0.471991 14 01 07 00 92 01 8e 02 00 01 f1 1c 69 4b 01
E: 0.479942 14 01 07 00 bf 01 d5 02 00 01 f1 1c 69 4b 01
E: 0.487972 14 01 07 00 bf 01 d5 02 00 01 f1 1c 69 4b 01
E: 0.495993 14 01 07 00 ee 01 22 03 00 01 f1 1c 69 4b 01
E: 0.503941 14 01 07 00 1c 02 6b 03 00 01 f1 1c 69 4b 01
E: 0.511987 14 01 07 00 46 02 ab 03 00 01 f1 1c 69 4b 01
E: 0.519944 14 01 07 00 77 02 f8 03 00 01 f1 1c 69 4b 01
E: 0.527995 14 01 07 00 a4 02 3c 04 00 01 f1 1c 69 4b 01
E: 0.536036 14 01 07 00 d5 02 84 04 00 01 f1 1c 69 4b 01
E: 0.544020 14 01 07 00 0a 03 d2 04 00 01 f1 1c 69 4b 01
E: 0.551954 14 01 07 00 43 03 22 05 00 01 f1 1c 69 4b 01
E: 0.559998 14 01 07 00 81 03 76 05 00 01 f1 1c 69 4b 01
E: 0.568000 14 01 07 00 c3 03 cb 05 00 01 f1 1c 69 4b 01
E: 0.575948 14 01 07 00 08 04 21 06 00 01 f1 1c 69 4b 01
E: 0.584037 14 01 07 00 53 04 7a 06 00 01 f1 1c 69 4b 01
E: 0.591947 14 01 07 00 9a 04 c7 06 00 01 f1 1c 69 4b 01
E: 0.600006 14 01 07 00 ee 04 26 07 00 01 f1 1c 69 4b 01
E: 0.608026 14 01 07 00 45 05 87 07 00 01 f1 1c 69 4b 01
E: 0.616005 14 01 07 00 9f 05 e8 07 00 01 f1 1c 69 4b 01
E: 0.624036 14 01 07 00 f9 05 4a 08 00 01 f1 1c 69 4b 01
E: 0.632009 14 01 07 00 53 06 a7 08 00 01 f1 1c 69 4b 01
E: 0.640038 14 01 07 00 b5 06 0f 09 00 01 f1 1c 69 4b 01
E: 0.647999 14 01 07 00 18 07 77 09 00 01 f1 1c 69 4b 01
E: 0.656005 14 01 07 00 18 07 77 09 00 01 f1 1c 69 4b 01
E: 0.664009 14 01 07 00 80 07 de 09 00 01 f1 1c 69 4b 01
E: 0.671939 14 01 07 00 e9 07 45 0a 00 01 f1 1c 69 4b 01
E: 0.680044 14 01 07 00 58 08 af 0a 00 01 f1 1c 69 4b 01
E: 0.688010 14 01 07 00 c9 08 19 0b 00 01 f1 1c 69 4b 01
E: 0.696002 14 01 07 00 3d 09 7f 0b 00 01 f1 1c 69 4b 01
E: 0.704007 14 01 07 00 b9 09 ee 0b 00 01 f1 1c 69 4b 01
E: 0.712014 14 01 07 00 39 0a 60 0c 00 01 f1 1c 69 4b 01
E: 0.719963 14 01 07 00 ba 0a d1 0c 00 01 f1 1c 69 4b 01
E: 0.728005 14 01 07 00 40 0b 44 0d 00 01 f1 1c 69 4b 01
E: 0.736043 14 01 07 00 c9 0b ba 0d 00 01 f1 1c 69 4b 01
E: 0.744018 14 01 07 00 56 0c 34 0e 00 01 f1 1c 69 4b 01
E: 0.752049 14 01 07 00 e7 0c b1 0e 00 01 f1 1c 69 4b 01
E: 0.760017 14 01 07 00 78 0d 31 0f 00 01 f1 1c 69 4b 01
E: 0.767973 14 01 07 00 0a 0e b5 0f 00 01 f1 1c 69 4b 01
E: 0.776018 14 01 07 00 9f 0e 3c 10 00 01 f1 1c 69 4b 01
E: 0.784054 14 01 07 00 35 0f c6 10 00 01 f1 1c 69 4b 01
E: 0.792021 14 01 07 00 c4 0f 4e 11 00 01 f1 1c 69 4b 01
E: 0.799970 14 01 07 00 c4 0f 4e 11 00 01 f1 1c 69 4b 01
E: 0.808057 14 01 07 00 53 10 d6 11 00 01 f1 1c 69 4b 01
E: 0.816024 14 01 07 00 e4 10 60 12 00 01 f1 1c 69 4b 01
E: 0.824020 14 01 07 00 e4 10 60 12 00 01 f1 1c 69 4b 01
E: 0.832058 14 01 07 00 72 11 eb 12 00 01 f1 1c 69 4b 01
E: 0.840062 14 01 07 00 ff 11 76 13 00 01 f1 1c 69 4b 01
E: 0.848030 14 01 07 00 8b 12 01 14 00 01 f1 1c 69 4b 01
E: 0.856027 14 01 07 00 15 13 8c 14 00 01 f1 1c 69 4b 01
E: 0.863977 14 01 07 00 a0 13 1a 15 00 01 f1 1c 69 4b 01
E: 0.872029 14 01 07 00 2f 14 a8 15 00 01 f1 1c 69 4b 01
E: 0.880062 14 01 07 00 b8 14 35 16 00 01 f1 1c 69 4b 01
E: 0.888028 14 01 07 00 4c 15 ca 16 00 01 f1 1c 69 4b 01
E: 0.895980 14 01 07 00 d6 15 53 17 00 01 f1 1c 69 4b 01
E: 0.904049 14 01 07 00 5c 16 dc 17 00 01 f1 1c 69 4b 01
E: 0.912034 14 01 07 00 e8 16 68 18 00 01 f1 1c 69 4b 01
E: 0.919982 14 01 07 00 72 17 ef 18 00 01 f1 1c 69 4b 01
E: 0.927962 14 01 07 00 fa 17 75 19 00 01 f1 1c 69 4b 01
E: 0.936051 14 01 07 00 80 18 f8 19 00 01 f1 1c 69 4b 01
E: 0.944038 14 01 07 00 06 19 7a 1a 00 01 f1 1c 69 4b 01
E: 0.952035 14 01 07 00 87 19 fb 1a 00 01 f1 1c 69 4b 01
E: 0.960065 14 01 07 00 04 1a 77 1b 00 01 f1 1c 69 4b 01
E: 0.968038 14 01 07 00 7e 1a f3 1b 00 01 f1 1c 69 4b 01
E: 0.975996 14 01 07 00 f9 1a 6e 1c 00 01 f1 1c 69 4b 01
E: 0.984041 14 01 07 00 72 1b e4 1c 00 01 f1 1c 69 4b 01
E: 0.992031 14 01 07 00 72 1b e4 1c 00 01 f1 1c 69 4b 01
E: 1.000042 14 01 07 00 eb 1b 59 1d 00 01 f1 1c 69 4b 01
E: 1.008042 14 01 07 00 5d 1c ca 1d 00 01 f1 1c 69 4b 01
E: 1.016042 14 01 07 00 ca 1c 38 1e 00 01 f1 1c 69 4b 01
E: 1.023993 14 01 07 00 39 1d a6 1e 00 01 f1 1c 69 4b 01
E: 1.032046 14 01 07 00 a2 1d 10 1f 00 01 f1 1c 69 4b 01
E: 1.040039 14 01 07 00 05 1e 76 1f 00 01 f1 1c 69 4b 01
E: 1.048046 14 01 07 00 69 1e d9 1f 00 01 f1 1c 69 4b 01
E: 1.056041 14 01 07 00 ca 1e 3c 20 00 01 f1 1c 69 4b 01
E: 1.064047 14 01 07 00 27 1f 9c 20 00 01 f1 1c 69 4b 01
E: 1.072080 14 01 07 00 84 1f f8 20 00 01 f1 1c 69 4b 01
E: 1.080052 14 01 07 00 e2 1f 57 21 00 01 f1 1c 69 4b 01
E: 1.088046 14 01 07 00 40 20 b2 21 00 01 f1 1c 69 4b 01
E: 1.096044 14 01 07 00 9a 20 0c 22 00 01 f1 1c 69 4b 01
E: 1.103997 14 01 07 00 f3 20 5f 22 00 01 f1 1c 69 4b 01
E: 1.112087 14 01 07 00 48 21 b2 22 00 01 f1 1c 69 4b 01
E: 1.120005 14 01 07 00 99 21 03 23 00 01 f1 1c 69 4b 01
E: 1.128054 14 01 07 00 e9 21 55 23 00 01 f1 1c 69 4b 01
E: 1.136054 14 01 07 00 39 22 a8 23 00 01 f1 1c 69 4b 01
E: 1.144057 14 01 07 00 88 22 fc 23 00 01 f1 1c 69 4b 01
E: 1.152055 14 01 07 00 88 22 fc 23 00 01 f1 1c 69 4b 01
E: 1.160058 14 01 07 00 da 22 4d 24 00 01 f1 1c 69 4b 01
E: 1.168092 14 01 07 00 2b 23 9f 24 00 01 f1 1c 69 4b 01
E: 1.176060 14 01 07 00 78 23 f6 24 00 01 f1 1c 69 4b 01
E: 1.184061 14 01 07 00 c4 23 4c 25 00 01 f1 1c 69 4b 01
E: 1.192010 14 01 07 00 0f 24 a2 25 00 01 f1 1c 69 4b 01
E: 1.200062 14 01 07 00 5b 24 f8 25 00 01 f1 1c 69 4b 01
E: 1.208095 14 01 07 00 a8 24 4f 26 00 01 f1 1c 69 4b 01
E: 1.216065 14 01 07 00 f5 24 a8 26 00 01 f1 1c 69 4b 01
E: 1.224013 14 01 07 00 44 25 02 27 00 01 f1 1c 69 4b 01
E: 1.232098 14 01 07 00 9b 25 66 27 00 01 f1 1c 69 4b 01
E: 1.240067 14 01 07 00 e9 25 c7 27 00 01 f1 1c 69 4b 01
E: 1.248098 14 01 07 00 39 26 29 28 00 01 f1 1c 69 4b 01
E: 1.256102 14 01 07 00 8d 26 8e 28 00 01 f1 1c 69 4b 01
E: 1.264066 14 01 07 00 de 26 f8 28 00 01 f1 1c 69 4b 01
E: 1.272069 14 01 07 00 33 27 63 29 00 01 f1 1c 69 4b 01
E: 1.280063 14 01 07 00 89 27 ce 29 00 01 f1 1c 69 4b 01
E: 1.288066 14 01 07 00 e1 27 3b 2a 00 01 f1 1c 69 4b 01
E: 1.296069 14 01 07 00 37 28 ab 2a 00 01 f1 1c 69 4b 01
E: 1.304021 14 01 07 00 8a 28 1f 2b 00 01 f1 1c 69 4b 01
E: 1.312071 14 01 07 00 8a 28 1f 2b 00 01 f1 1c 69 4b 01
E: 1.320021 14 01 07 00 8a 28 1f 2b 00 01 f1 1c 69 4b 01
E: 1.328075 14 01 07 00 e9 28 95 2b 00 01 f1 1c 69 4b 01
E: 1.336060 14 01 07 00 44 29 04 2c 00 01 f1 1c 69 4b 01
E: 1.344075 14 01 07 00 a7 29 7c 2c 00 01 f1 1c 69 4b 01
E: 1.352110 14 01 07 00 04 2a ec 2c 00 01 f1 1c 69 4b 01
E: 1.360076 14 01 07 00 6b 2a 65 2d 00 01 f1 1c 69 4b 01
E: 1.368079 14 01 07 00 cb 2a d7 2d 00 01 f1 1c 69 4b 01
E: 1.376078 14 01 07 00 2e 2b 55 2e 00 01 f1 1c 69 4b 01
E: 1.384029 14 01 07 00 8b 2b ca 2e 00 01 f1 1c 69 4b 01
E: 1.392072 14 01 07 00 ee 2b 3b 2f 00 01 f1 1c 69 4b 01
E: 1.400082 14 01 07 00 4e 2c b2 2f 00 01 f1 1c 69 4b 01
E: 1.408083 14 01 07 00 b7 2c 29 30 00 01 f1 1c 69 4b 01
E: 1.416032 14 01 07 00 1e 2d 9e 30 00 01 f1 1c 69 4b 01
E: 1.424084 14 01 07 00 8d 2d 12 31 00 01 f1 1c 69 4b 01
E: 1.432041 14 01 07 00 02 2e 90 31 00 01 f1 1c 69 4b 01
E: 1.440084 14 01 07 00 70 2e 07 32 00 01 f1 1c 69 4b 01
E: 1.448035 14 01 07 00 da 2e 85 32 00 01 f1 1c 69 4b 01
E: 1.456086 14 01 07 00 4a 2f 0a 33 00 01 f1 1c 69 4b 01
E: 1.464046 14 01 07 00 b6 2f 88 33 00 01 f1 1c 69 4b 01
E: 1.472038 14 01 07 00 21 30 06 34 00 01 f1 1c 69 4b 01
E: 1.480038 14 01 07 00 92 30 80 34 00 01 f1 1c 69 4b 01
E: 1.488121 14 01 07 00 92 30 80 34 00 01 f1 1c 69 4b 01
E: 1.496092 14 01 07 00 06 31 ff 34 00 01 f1 1c 69 4b 01
E: 1.504041 14 01 07 00 74 31 78 35 00 01 f1 1c 69 4b 01
E: 1.512020 14 01 07 00 e1 31 f0 35 00 01 f1 1c 69 4b 01
E: 1.520043 14 01 07 00 59 32 6c 36 00 01 f1 1c 69 4b 01
E: 1.528126 14 01 07 00 c8 32 e0 36 00 01 f1 1c 69 4b 01
E: 1.536066 14 01 07 00 3f 33 54 37 00 01 f1 1c 69 4b 01
E: 1.544087 14 01 07 00 b2 33 bd 37 00 01 f1 1c 69 4b 01
E: 1.552053 14 01 07 00 27 34 2d 38 00 01 f1 1c 69 4b 01
E: 1.560096 14 01 07 00 93 34 96 38 00 01 f1 1c 69 4b 01
E: 1.568097 14 01 07 00 fc 34 00 39 00 01 f1 1c 69 4b 01
E: 1.576048 14 01 07 00 6a 35 71 39 00 01 f1 1c 69 4b 01
E: 1.584099 14 01 07 00 ce 35 d9 39 00 01 f1 1c 69 4b 01
E: 1.592103 14 01 07 00 30 36 41 3a 00 01 f1 1c 69 4b 01
E: 1.600132 14 01 07 00 99 36 a8 3a 00 01 f1 1c 69 4b 01
E: 1.608101 14 01 07 00 fa 36 07 3b 00 01 f1 1c 69 4b 01
E: 1.616102 14 01 07 00 58 37 66 3b 00 01 f1 1c 69 4b 01
E: 1.624102 14 01 07 00 b9 37 cb 3b 00 01 f1 1c 69 4b 01
E: 1.632137 14 01 07 00 11 38 28 3c 00 01 f1 1c 69 4b 01
E: 1.640136 14 01 07 00 6d 38 8a 3c 00 01 f1 1c 69 4b 01
E: 1.648139 14 01 07 00 c9 38 ee 3c 00 01 f1 1c 69 4b 01
E: 1.656104 14 01 07 00 c9 38 ee 3c 00 01 f1 1c 69 4b 01
E: 1.664109 14 01 07 00 26 39 53 3d 00 01 f1 1c 69 4b 01
E: 1.672058 14 01 07 00 8d 39 b9 3d 00 01 f1 1c 69 4b 01
E: 1.680110 14 01 07 00 f2 39 1f 3e 00 01 f1 1c 69 4b 01
E: 1.688046 14 01 07 00 51 3a 74 3e 00 01 f1 1c 69 4b 01
E: 1.696111 14 01 07 00 b4 3a d2 3e 00 01 f1 1c 69 4b 01
E: 1.704063 14 01 07 00 1d 3b 2d 3f 00 01 f1 1c 69 4b 01
E: 1.712147 14 01 07 00 88 3b 91 3f 00 01 f1 1c 69 4b 01
E: 1.720063 14 01 07 00 f7 3b fc 3f 00 01 f1 1c 69 4b 01
E: 1.728150 14 01 07 00 69 3c 6d 40 00 01 f1 1c 69 4b 01
E: 1.736061 14 01 07 00 d3 3c dc 40 00 01 f1 1c 69 4b 01
E: 1.744149 14 01 07 00 59 3d 5c 41 00 01 f1 1c 69 4b 01
E: 1.752117 14 01 07 00 de 3d d2 41 00 01 f1 1c 69 4b 01
E: 1.760120 14 01 07 00 6e 3e 4b 42 00 01 f1 1c 69 4b 01
E: 1.768116 14 01 07 00 fd 3e d1 42 00 01 f1 1c 69 4b 01
E: 1.776122 14 01 07 00 90 3f 5b 43 00 01 f1 1c 69 4b 01
E: 1.784117 14 01 07 00 2a 40 d6 43 00 01 f1 1c 69 4b 01
E: 1.792120 14 01 07 00 cb 40 65 44 00 01 f1 1c 69 4b 01
E: 1.800120 14 01 07 00 6d 41 ee 44 00 01 f1 1c 69 4b 01
E: 1.808121 14 01 07 00 0e 42 7a 45 00 01 f1 1c 69 4b 01
E: 1.816122 14 01 07 00 0e 42 7a 45 00 01 f1 1c 69 4b 01
E: 1.824120 14 01 07 00 0e 42 7a 45 00 01 f1 1c 69 4b 01
E: 1.832123 14 01 07 00 b9 42 fc 45 00 01 f1 1c 69 4b 01
E: 1.840081 14 01 07 00 5d 43 86 46 00 01 f1 1c 69 4b 01
E: 1.848082 14 01 07 00 07 44 1a 47 00 01 f1 1c 69 4b 01
E: 1.856126 14 01 07 00 ae 44 ab 47 00 01 f1 1c 69 4b 01
E: 1.864126 14 01 07 00 4b 45 39 48 00 01 f1 1c 69 4b 01
E: 1.872077 14 01 07 00 eb 45 d1 48 00 01 f1 1c 69 4b 01
E: 1.880129 14 01 07 00 85 46 5f 49 00 01 f1 1c 69 4b 01
E: 1.888079 14 01 07 00 1e 47 f1 49 00 01 f1 1c 69 4b 01
E: 1.896127 14 01 07 00 b2 47 7e 4a 00 01 f1 1c 69 4b 01
E: 1.904082 14 01 07 00 40 48 08 4b 00 01 f1 1c 69 4b 01
E: 1.912132 14 01 07 00 c9 48 90 4b 00 01 f1 1c 69 4b 01
E: 1.920082 14 01 07 00 4f 49 11 4c 00 01 f1 1c 69 4b 01
E: 1.928133 14 01 07 00 ce 49 8d 4c 00 01 f1 1c 69 4b 01
E: 1.936078 14 01 07 00 4d 4a fd 4c 00 01 f1 1c 69 4b 01
E: 1.944134 14 01 07 00 c9 4a 61 4d 00 01 f1 1c 69 4b 01
E: 1.952093 14 01 07 00 3f 4b c0 4d 00 01 f1 1c 69 4b 01
E: 1.960137 14 01 07 00 ac 4b 22 4e 00 01 f1 1c 69 4b 01
E: 1.968137 14 01 07 00 1a 4c 75 4e 00 01 f1 1c 69 4b 01
E: 1.976139 14 01 07 00 86 4c bd 4e 00 01 f1 1c 69 4b 01
E: 1.984140 14 01 07 00 ec 4c 06 4f 00 01 f1 1c 69 4b 01
E: 1.992137 14 01 07 00 ec 4c 06 4f 00 01 f1 1c 69 4b 01
E: 2.000173 14 01 07 00 52 4d 46 4f 00 01 f1 1c 69 4b 01
E: 2.008142 14 01 07 00 b2 4d 88 4f 00 01 f1 1c 69 4b 01
E: 2.016143 14 01 07 00 0d 4e cc 4f 00 01 f1 1c 69 4b 01
E: 2.024141 14 01 07 00 6b 4e 08 50 00 01 f1 1c 69 4b 01
E: 2.032144 14 01 07 00 c3 4e 45 50 00 01 f1 1c 69 4b 01
E: 2.040094 14 01 07 00 1e 4f 7c 50 00 01 f1 1c 69 4b 01
E: 2.048145 14 01 07 00 74 4f b6 50 00 01 f1 1c 69 4b 01
E: 2.056180 14 01 07 00 ca 4f f5 50 00 01 f1 1c 69 4b 01
E: 2.064148 14 01 07 00 1d 50 37 51 00 01 f1 1c 69 4b 01
E: 2.072096 14 01 07 00 77 50 74 51 00 01 f1 1c 69 4b 01
E: 2.080149 14 01 07 00 d6 50 ad 51 00 01 f1 1c 69 4b 01
E: 2.088099 14 01 07 00 33 51 ec 51 00 01 f1 1c 69 4b 01
E: 2.096148 14 01 07 00 95 51 27 52 00 01 f1 1c 69 4b 01
E: 2.104103 14 01 07 00 f6 51 69 52 00 01 f1 1c 69 4b 01
E: 2.112153 14 01 07 00 54 52 ad 52 00 01 f1 1c 69 4b 01
E: 2.120102 14 01 07 00 b5 52 ec 52 00 01 f1 1c 69 4b 01
E: 2.128154 14 01 07 00 15 53 30 53 00 01 f1 1c 69 4b 01
E: 2.136080 14 01 07 00 70 53 75 53 00 01 f1 1c 69 4b 01
E: 2.144158 14 01 07 00 cc 53 c0 53 00 01 f1 1c 69 4b 01
E: 2.152156 14 01 07 00 20 54 06 54 00 01 f1 1c 69 4b 01
E: 2.160155 14 01 07 00 20 54 06 54 00 01 f1 1c 69 4b 01
E: 2.168191 14 01 07 00 71 54 4c 54 00 01 f1 1c 69 4b 01
E: 2.176158 14 01 07 00 c1 54 94 54 00 01 f1 1c 69 4b 01
E: 2.184161 14 01 07 00 11 55 de 54 00 01 f1 1c 69 4b 01
E: 2.192193 14 01 07 00 61 55 28 55 00 01 f1 1c 69 4b 01
E: 2.200183 14 01 07 00 b4 55 69 55 00 01 f1 1c 69 4b 01
E: 2.208195 14 01 07 00 05 56 ab 55 00 01 f1 1c 69 4b 01
E: 2.216164 14 01 07 00 59 56 e4 55 00 01 f1 1c 69 4b 01
E: 2.224164 14 01 07 00 ab 56 1f 56 00 01 f1 1c 69 4b 01
E: 2.232160 14 01 07 00 fd 56 5f 56 00 01 f1 1c 69 4b 01
E: 2.240163 14 01 07 00 47 57 9b 56 00 01 f1 1c 69 4b 01
E: 2.248167 14 01 07 00 8d 57 d6 56 00 01 f1 1c 69 4b 01
E: 2.256180 14 01 07 00 ce 57 0e 57 00 01 f1 1c 69 4b 01
E: 2.264162 14 01 07 00 0a 58 43 57 00 01 f1 1c 69 4b 01
E: 2.272118 14 01 07 00 42 58 75 57 00 01 f1 1c 69 4b 01
E: 2.280168 14 01 07 00 79 58 98 57 00 01 f1 1c 69 4b 01
E: 2.288119 14 01 07 00 a6 58 c4 57 00 01 f1 1c 69 4b 01
E: 2.296119 14 01 07 00 d4 58 e2 57 00 01 f1 1c 69 4b 01
E: 2.304120 14 01 07 00 03 59 04 58 00 01 f1 1c 69 4b 01
E: 2.312173 14 01 07 00 29 59 1f 58 00 01 f1 1c 69 4b 01
E: 2.320120 14 01 07 00 29 59 1f 58 00 01 f1 1c 69 4b 01
E: 2.328175 14 01 07 00 29 59 1f 58 00 01 f1 1c 69 4b 01
E: 2.336118 14 01 07 00 53 59 32 58 00 01 f1 1c 69 4b 01
E: 2.344209 14 01 07 00 78 59 42 58 00 01 f1 1c 69 4b 01
E: 2.352175 14 01 07 00 99 59 55 58 00 01 f1 1c 69 4b 01
E: 2.360126 14 01 07 00 bb 59 6a 58 00 01 f1 1c 69 4b 01
E: 2.368177 14 01 07 00 e0 59 84 58 00 01 f1 1c 69 4b 01
E: 2.376179 14 01 07 00 09 5a a4 58 00 01 f1 1c 69 4b 01
E: 2.384179 14 01 07 00 37 5a cb 58 00 01 f1 1c 69 4b 01
E: 2.392173 14 01 07 00 6c 5a ea 58 00 01 f1 1c 69 4b 01
E: 2.400181 14 01 07 00 a2 5a 0e 59 00 01 f1 1c 69 4b 01
E: 2.408182 14 01 07 00 d9 5a 36 59 00 01 f1 1c 69 4b 01
E: 2.416183 14 01 07 00 13 5b 55 59 00 01 f1 1c 69 4b 01
E: 2.424176 14 01 07 00 4b 5b 76 59 00 01 f1 1c 69 4b 01
E: 2.432218 14 01 07 00 81 5b 9a 59 00 01 f1 1c 69 4b 01
E: 2.440179 14 01 07 00 b5 5b bf 59 00 01 f1 1c 69 4b 01
E: 2.448185 14 01 07 00 e6 5b e4 59 00 01 f1 1c 69 4b 01
E: 2.456136 14 01 07 00 14 5c 09 5a 00 01 f1 1c 69 4b 01
E: 2.464187 14 01 07 00 40 5c 2c 5a 00 01 f1 1c 69 4b 01
E: 2.472137 14 01 07 00 68 5c 4e 5a 00 01 f1 1c 69 4b 01
E: 2.480190 14 01 07 00 8c 5c 6d 5a 00 01 f1 1c 69 4b 01
E: 2.488136 14 01 07 00 8c 5c 6d 5a 00 01 f1 1c 69 4b 01
E: 2.496188 14 01 07 00 b0 5c 7e 5a 00 01 f1 1c 69 4b 01
E: 2.504140 14 01 07 00 cd 5c 9b 5a 00 01 f1 1c 69 4b 01
E: 2.512192 14 01 07 00 e7 5c b4 5a 00 01 f1 1c 69 4b 01
E: 2.520142 14 01 07 00 00 5d cd 5a 00 01 f1 1c 69 4b 01
E: 2.528193 14 01 07 00 1c 5d da 5a 00 01 f1 1c 69 4b 01
E: 2.536136 14 01 07 00 34 5d f5 5a 00 01 f1 1c 69 4b 01
E: 2.544218 14 01 07 00 50 5d 04 5b 00 01 f1 1c 69 4b 01
E: 2.552145 14 01 07 00 68 5d 21 5b 00 01 f1 1c 69 4b 01
E: 2.560195 14 01 07 00 87 5d 34 5b 00 01 f1 1c 69 4b 01
E: 2.568188 14 01 07 00 a2 5d 55 5b 00 01 f1 1c 69 4b 01
E: 2.576230 14 01 07 00 bd 5d 75 5b 00 01 f1 1c 69 4b 01
E: 2.584148 14 01 07 00 da 5d 96 5b 00 01 f1 1c 69 4b 01
E: 2.592199 14 01 07 00 fc 5d ac 5b 00 01 f1 1c 69 4b 01
E: 2.600200 14 01 07 00 1d 5e c3 5b 00 01 f1 1c 69 4b 01
E: 2.608234 14 01 07 00 3e 5e dc 5b 00 01 f1 1c 69 4b 01
E: 2.616153 14 01 07 00 59 5e 00 5c 00 01 f1 1c 69 4b 01
E: 2.624193 14 01 07 00 74 5e 22 5c 00 01 f1 1c 69 4b 01
E: 2.632203 14 01 07 00 8e 5e 42 5c 00 01 f1 1c 69 4b 01
E: 2.640154 14 01 07 00 ac 5e 56 5c 00 01 f1 1c 69 4b 01
E: 2.648238 14 01 07 00 cc 5e 6e 5c 00 01 f1 1c 69 4b 01
E: 2.656153 14 01 07 00 cc 5e 6e 5c 00 01 f1 1c 69 4b 01
E: 2.664208 14 01 07 00 e9 5e 93 5c 00 01 f1 1c 69 4b 01
E: 2.672156 14 01 07 00 0b 5f ae 5c 00 01 f1 1c 69 4b 01
E: 2.680205 14 01 07 00 2f 5f ca 5c 00 01 f1 1c 69 4b 01
E: 2.688159 14 01 07 00 53 5f e9 5c 00 01 f1 1c 69 4b 01
E: 2.696211 14 01 07 00 79 5f 09 5d 00 01 f1 1c 69 4b 01
E: 2.704161 14 01 07 00 9d 5f 2a 5d 00 01 f1 1c 69 4b 01
E: 2.712139 14 01 07 00 bf 5f 48 5d 00 01 f1 1c 69 4b 01
E: 2.720162 14 01 07 00 de 5f 65 5d 00 01 f1 1c 69 4b 01
E: 2.728235 14 01 07 00 fb 5f 80 5d 00 01 f1 1c 69 4b 01
E: 2.736140 14 01 07 00 16 60 99 5d 00 01 f1 1c 69 4b 01
E: 2.744165 14 01 07 00 2f 60 b1 5d 00 01 f1 1c 69 4b 01
E: 2.752217 14 01 07 00 47 60 c9 5d 00 01 f1 1c 69 4b 01
E: 2.760217 14 01 07 00 63 60 e4 5d 00 01 f1 1c 69 4b 01
E: 2.768218 14 01 07 00 79 60 09 5e 00 01 f1 1c 69 4b 01
E: 2.776211 14 01 07 00 93 60 21 5e 00 01 f1 1c 69 4b 01
E: 2.784219 14 01 07 00 ae 60 39 5e 00 01 f1 1c 69 4b 01
E: 2.792175 14 01 07 00 ca 60 53 5e 00 01 f1 1c 69 4b 01
E: 2.800220 14 01 07 00 e7 60 6e 5e 00 01 f1 1c 69 4b 01
E: 2.808170 14 01 07 00 05 61 8b 5e 00 01 f1 1c 69 4b 01
E: 2.816255 14 01 07 00 23 61 a7 5e 00 01 f1 1c 69 4b 01
E: 2.824220 14 01 07 00 23 61 a7 5e 00 01 f1 1c 69 4b 01
E: 2.832258 14 01 07 00 41 61 c5 5e 00 01 f1 1c 69 4b 01
E: 2.840172 14 01 07 00 41 61 c5 5e 00 01 f1 1c 69 4b 01
E: 2.848225 14 01 07 00 63 61 e6 5e 00 01 f1 1c 69 4b 01
E: 2.856175 14 01 07 00 80 61 03 5f 00 01 f1 1c 69 4b 01
E: 2.864227 14 01 07 00 9e 61 21 5f 00 01 f1 1c 69 4b 01
E: 2.872177 14 01 07 00 b9 61 3b 5f 00 01 f1 1c 69 4b 01
E: 2.880228 14 01 07 00 d2 61 54 5f 00 01 f1 1c 69 4b 01
E: 2.888178 14 01 07 00 ea 61 6c 5f 00 01 f1 1c 69 4b 01
E: 2.896262 14 01 07 00 05 62 87 5f 00 01 f1 1c 69 4b 01
E: 2.904180 14 01 07 00 23 62 a4 5f 00 01 f1 1c 69 4b 01
E: 2.912188 14 01 07 00 44 62 c6 5f 00 01 f1 1c 69 4b 01
E: 2.920182 14 01 07 00 69 62 eb 5f 00 01 f1 1c 69 4b 01
E: 2.928265 14 01 07 00 92 62 14 60 00 01 f1 1c 69 4b 01
E: 2.936178 14 01 07 00 c3 62 34 60 00 01 f1 1c 69 4b 01
E: 2.944225 14 01 07 00 f1 62 65 60 00 01 f1 1c 69 4b 01
E: 2.952235 14 01 07 00 20 63 98 60 00 01 f1 1c 69 4b 01
E: 2.960237 14 01 07 00 57 63 bf 60 00 01 f1 1c 69 4b 01
E: 2.968186 14 01 07 00 89 63 f7 60 00 01 f1 1c 69 4b 01
E: 2.976237 14 01 07 00 c0 63 21 61 00 01 f1 1c 69 4b 01
E: 2.984238 14 01 07 00 f3 63 5c 61 00 01 f1 1c 69 4b 01
E: 2.992235 14 01 07 00 f3 63 5c 61 00 01 f1 1c 69 4b 01
E: 3.000214 14 01 07 00 26 64 95 61 00 01 f1 1c 69 4b 01
E: 3.008240 14 01 07 00 59 64 cc 61 00 01 f1 1c 69 4b 01
E: 3.016242 14 01 07 00 8c 64 04 62 00 01 f1 1c 69 4b 01
E: 3.024243 14 01 07 00 bf 64 3b 62 00 01 f1 1c 69 4b 01
E: 3.032170 14 01 07 00 f3 64 71 62 00 01 f1 1c 69 4b 01
E: 3.040277 14 01 07 00 27 65 a7 62 00 01 f1 1c 69 4b 01
E: 3.048277 14 01 07 00 5a 65 dd 62 00 01 f1 1c 69 4b 01
E: 3.056195 14 01 07 00 8d 65 12 63 00 01 f1 1c 69 4b 01
E: 3.064195 14 01 07 00 c1 65 47 63 00 01 f1 1c 69 4b 01
E: 3.072196 14 01 07 00 f3 65 7c 63 00 01 f1 1c 69 4b 01
E: 3.080247 14 01 07 00 25 66 af 63 00 01 f1 1c 69 4b 01
E: 3.088199 14 01 07 00 55 66 e0 63 00 01 f1 1c 69 4b 01
E: 3.096178 14 01 07 00 83 66 0f 64 00 01 f1 1c 69 4b 01
E: 3.104200 14 01 07 00 b0 66 3d 64 00 01 f1 1c 69 4b 01
E: 3.112251 14 01 07 00 dc 66 6a 64 00 01 f1 1c 69 4b 01
E: 3.120202 14 01 07 00 08 67 96 64 00 01 f1 1c 69 4b 01
E: 3.128257 14 01 07 00 34 67 c3 64 00 01 f1 1c 69 4b 01
E: 3.136193 14 01 07 00 5f 67 ef 64 00 01 f1 1c 69 4b 01
E: 3.144289 14 01 07 00 90 67 04 65 00 01 f1 1c 69 4b 01
E: 3.152287 14 01 07 00 bc 67 35 65 00 01 f1 1c 69 4b 01
E: 3.160203 14 01 07 00 bc 67 35 65 00 01 f1 1c 69 4b 01
E: 3.168291 14 01 07 00 ed 67 4f 65 00 01 f1 1c 69 4b 01
E: 3.176257 14 01 07 00 18 68 83 65 00 01 f1 1c 69 4b 01
E: 3.184258 14 01 07 00 43 68 b7 65 00 01 f1 1c 69 4b 01
E: 3.192208 14 01 07 00 6e 68 e9 65 00 01 f1 1c 69 4b 01
E: 3.200261 14 01 07 00 9a 68 1a 66 00 01 f1 1c 69 4b 01
E: 3.208262 14 01 07 00 c8 68 4c 66 00 01 f1 1c 69 4b 01
E: 3.216260 14 01 07 00 f6 68 7e 66 00 01 f1 1c 69 4b 01
E: 3.224265 14 01 07 00 25 69 b0 66 00 01 f1 1c 69 4b 01
E: 3.232295 14 01 07 00 57 69 e5 66 00 01 f1 1c 69 4b 01
E: 3.240214 14 01 07 00 8d 69 0a 67 00 01 f1 1c 69 4b 01
E: 3.248297 14 01 07 00 c1 69 31 67 00 01 f1 1c 69 4b 01
E: 3.256216 14 01 07 00 f2 69 6a 67 00 01 f1 1c 69 4b 01
E: 3.264299 14 01 07 00 1f 6a 9d 67 00 01 f1 1c 69 4b 01
E: 3.272216 14 01 07 00 4f 6a d3 67 00 01 f1 1c 69 4b 01
E: 3.280300 14 01 07 00 80 6a f6 67 00 01 f1 1c 69 4b 01
E: 3.288213 14 01 07 00 b1 6a 1b 68 00 01 f1 1c 69 4b 01
E: 3.296260 14 01 07 00 dc 6a 4f 68 00 01 f1 1c 69 4b 01
E: 3.304219 14 01 07 00 09 6b 71 68 00 01 f1 1c 69 4b 01
E: 3.312270 14 01 07 00 34 6b 93 68 00 01 f1 1c 69 4b 01
E: 3.320221 14 01 07 00 5e 6b b6 68 00 01 f1 1c 69 4b 01
E: 3.328201 14 01 07 00 5e 6b b6 68 00 01 f1 1c 69 4b 01
E: 3.336191 14 01 07 00 8c 6b c4 68 00 01 f1 1c 69 4b 01
E: 3.344261 14 01 07 00 8c 6b c4 68 00 01 f1 1c 69 4b 01
E: 3.352275 14 01 07 00 b8 6b d6 68 00 01 f1 1c 69 4b 01
E: 3.360270 14 01 07 00 e4 6b ec 68 00 01 f1 1c 69 4b 01
E: 3.368308 14 01 07 00 11 6c 04 69 00 01 f1 1c 69 4b 01
E: 3.376275 14 01 07 00 3c 6c 20 69 00 01 f1 1c 69 4b 01
E: 3.384279 14 01 07 00 69 6c 3f 69 00 01 f1 1c 69 4b 01
E: 3.392272 14 01 07 00 94 6c 68 69 00 01 f1 1c 69 4b 01
E: 3.400312 14 01 07 00 bb 6c 8e 69 00 01 f1 1c 69 4b 01
E: 3.408278 14 01 07 00 e5 6c b8 69 00 01 f1 1c 69 4b 01
E: 3.416314 14 01 07 00 0f 6d e2 69 00 01 f1 1c 69 4b 01
E: 3.424231 14 01 07 00 3a 6d 0b 6a 00 01 f1 1c 69 4b 01
E: 3.432284 14 01 07 00 64 6d 36 6a 00 01 f1 1c 69 4b 01
E: 3.440233 14 01 07 00 8e 6d 5f 6a 00 01 f1 1c 69 4b 01
E: 3.448284 14 01 07 00 b8 6d 89 6a 00 01 f1 1c 69 4b 01
E: 3.456236 14 01 07 00 e3 6d b3 6a 00 01 f1 1c 69 4b 01
E: 3.464287 14 01 07 00 0d 6e dd 6a 00 01 f1 1c 69 4b 01
E: 3.472237 14 01 07 00 38 6e 08 6b 00 01 f1 1c 69 4b 01
E: 3.480289 14 01 07 00 60 6e 31 6b 00 01 f1 1c 69 4b 01
E: 3.488239 14 01 07 00 89 6e 59 6b 00 01 f1 1c 69 4b 01
E: 3.496287 14 01 07 00 89 6e 59 6b 00 01 f1 1c 69 4b 01
E: 3.504240 14 01 07 00 b7 6e 86 6b 00 01 f1 1c 69 4b 01
E: 3.512292 14 01 07 00 e6 6e b5 6b 00 01 f1 1c 69 4b 01
E: 3.520237 14 01 07 00 16 6f e6 6b 00 01 f1 1c 69 4b 01
E: 3.528293 14 01 07 00 43 6f 13 6c 00 01 f1 1c 69 4b 01
E: 3.536219 14 01 07 00 75 6f 44 6c 00 01 f1 1c 69 4b 01
E: 3.544326 14 01 07 00 a6 6f 76 6c 00 01 f1 1c 69 4b 01
E: 3.552294 14 01 07 00 d7 6f a6 6c 00 01 f1 1c 69 4b 01
E: 3.560253 14 01 07 00 07 70 d7 6c 00 01 f1 1c 69 4b 01
E: 3.568296 14 01 07 00 38 70 08 6d 00 01 f1 1c 69 4b 01
E: 3.576298 14 01 07 00 6a 70 39 6d 00 01 f1 1c 69 4b 01
E: 3.584297 14 01 07 00 9a 70 6a 6d 00 01 f1 1c 69 4b 01
E: 3.592248 14 01 07 00 c9 70 99 6d 00 01 f1 1c 69 4b 01
E: 3.600335 14 01 07 00 f5 70 c4 6d 00 01 f1 1c 69 4b 01
E: 3.608296 14 01 07 00 22 71 f2 6d 00 01 f1 1c 69 4b 01
E: 3.616258 14 01 07 00 55 71 11 6e 00 01 f1 1c 69 4b 01
E: 3.624251 14 01 07 00 87 71 32 6e 00 01 f1 1c 69 4b 01
E: 3.632302 14 01 07 00 bd 71 5c 6e 00 01 f1 1c 69 4b 01
E: 3.640255 14 01 07 00 f5 71 9d 6e 00 01 f1 1c 69 4b 01
E: 3.648261 14 01 07 00 2f 72 df 6e 00 01 f1 1c 69 4b 01
E: 3.656255 14 01 07 00 67 72 1e 6f 00 01 f1 1c 69 4b 01
E: 3.664338 14 01 07 00 67 72 1e 6f 00 01 f1 1c 69 4b 01
E: 3.672256 14 01 07 00 a1 72 5d 6f 00 01 f1 1c 69 4b 01
E: 3.680309 14 01 07 00 d6 72 98 6f 00 01 f1 1c 69 4b 01
E: 3.688259 14 01 07 00 09 73 ce 6f 00 01 f1 1c 69 4b 01
E: 3.696309 14 01 07 00 3b 73 03 70 00 01 f1 1c 69 4b 01
E: 3.704259 14 01 07 00 6d 73 38 70 00 01 f1 1c 69 4b 01
E: 3.712343 14 01 07 00 9c 73 69 70 00 01 f1 1c 69 4b 01
E: 3.720261 14 01 07 00 c8 73 96 70 00 01 f1 1c 69 4b 01
E: 3.728303 14 01 07 00 f0 73 bf 70 00 01 f1 1c 69 4b 01
E: 3.736293 14 01 07 00 16 74 e6 70 00 01 f1 1c 69 4b 01
E: 3.744304 14 01 07 00 39 74 f6 70 00 01 f1 1c 69 4b 01
E: 3.752347 14 01 07 00 5a 74 08 71 00 01 f1 1c 69 4b 01
E: 3.760316 14 01 07 00 81 74 0d 71 00 01 f1 1c 69 4b 01
E: 3.768316 14 01 07 00 a8 74 2d 71 00 01 f1 1c 69 4b 01
E: 3.776317 14 01 07 00 d1 74 50 71 00 01 f1 1c 69 4b 01
E: 3.784316 14 01 07 00 f6 74 71 71 00 01 f1 1c 69 4b 01
E: 3.792318 14 01 07 00 20 75 7e 71 00 01 f1 1c 69 4b 01
E: 3.800321 14 01 07 00 46 75 a6 71 00 01 f1 1c 69 4b 01
E: 3.808270 14 01 07 00 6b 75 cc 71 00 01 f1 1c 69 4b 01
E: 3.816320 14 01 07 00 90 75 da 71 00 01 f1 1c 69 4b 01
E: 3.824250 14 01 07 00 90 75 da 71 00 01 f1 1c 69 4b 01
E: 3.832355 14 01 07 00 ac 75 fa 71 00 01 f1 1c 69 4b 01
E: 3.840272 14 01 07 00 c8 75 1a 72 00 01 f1 1c 69 4b 01
E: 3.848322 14 01 07 00 c8 75 1a 72 00 01 f1 1c 69 4b 01
E: 3.856265 14 01 07 00 e7 75 25 72 00 01 f1 1c 69 4b 01
E: 3.864325 14 01 07 00 02 76 45 72 00 01 f1 1c 69 4b 01
E: 3.872276 14 01 07 00 1a 76 63 72 00 01 f1 1c 69 4b 01
E: 3.880359 14 01 07 00 34 76 6b 72 00 01 f1 1c 69 4b 01
E: 3.888247 14 01 07 00 4c 76 8b 72 00 01 f1 1c 69 4b 01
E: 3.896319 14 01 07 00 66 76 ab 72 00 01 f1 1c 69 4b 01
E: 3.904279 14 01 07 00 81 76 cb 72 00 01 f1 1c 69 4b 01
E: 3.912330 14 01 07 00 98 76 e7 72 00 01 f1 1c 69 4b 01
E: 3.920259 14 01 07 00 b0 76 02 73 00 01 f1 1c 69 4b 01
E: 3.928333 14 01 07 00 c7 76 1c 73 00 01 f1 1c 69 4b 01
E: 3.936305 14 01 07 00 de 76 36 73 00 01 f1 1c 69 4b 01
E: 3.944333 14 01 07 00 f9 76 53 73 00 01 f1 1c 69 4b 01
E: 3.952357 14 01 07 00 15 77 71 73 00 01 f1 1c 69 4b 01
E: 3.960334 14 01 07 00 2e 77 8b 73 00 01 f1 1c 69 4b 01
E: 3.968368 14 01 07 00 45 77 a3 73 00 01 f1 1c 69 4b 01
E: 3.976336 14 01 07 00 5c 77 bb 73 00 01 f1 1c 69 4b 01
E: 3.984337 14 01 07 00 76 77 d6 73 00 01 f1 1c 69 4b 01
E: 3.992337 14 01 07 00 76 77 d6 73 00 01 f1 1c 69 4b 01
E: 4.000341 14 01 07 00 8e 77 ef 73 00 01 f1 1c 69 4b 01
E: 4.008284 14 01 07 00 a4 77 06 74 00 01 f1 1c 69 4b 01
E: 4.016343 14 01 07 00 ba 77 1d 74 00 01 f1 1c 69 4b 01
E: 4.024291 14 01 07 00 d3 77 36 74 00 01 f1 1c 69 4b 01
E: 4.032345 14 01 07 00 ee 77 51 74 00 01 f1 1c 69 4b 01
E: 4.040293 14 01 07 00 0a 78 6e 74 00 01 f1 1c 69 4b 01
E: 4.048293 14 01 07 00 25 78 89 74 00 01 f1 1c 69 4b 01
E: 4.056295 14 01 07 00 3f 78 a3 74 00 01 f1 1c 69 4b 01
E: 4.064346 14 01 07 00 55 78 b9 74 00 01 f1 1c 69 4b 01
E: 4.072297 14 01 07 00 6b 78 cf 74 00 01 f1 1c 69 4b 01
E: 4.080276 14 01 07 00 83 78 e7 74 00 01 f1 1c 69 4b 01
E: 4.088298 14 01 07 00 97 78 fc 74 00 01 f1 1c 69 4b 01
E: 4.096348 14 01 07 00 ab 78 10 75 00 01 f1 1c 69 4b 01
E: 4.104295 14 01 07 00 c0 78 25 75 00 01 f1 1c 69 4b 01
E: 4.112300 14 01 07 00 d4 78 39 75 00 01 f1 1c 69 4b 01
E: 4.120301 14 01 07 00 e6 78 4c 75 00 01 f1 1c 69 4b 01
E: 4.128351 14 01 07 00 f8 78 5e 75 00 01 f1 1c 69 4b 01
E: 4.136343 14 01 07 00 0a 79 67 75 00 01 f1 1c 69 4b 01
E: 4.144282 14 01 07 00 19 79 86 75 00 01 f1 1c 69 4b 01
E: 4.152358 14 01 07 00 2d 79 91 75 00 01 f1 1c 69 4b 01
E: 4.160355 14 01 07 00 2d 79 91 75 00 01 f1 1c 69 4b 01
E: 4.168356 14 01 07 00 3d 79 af 75 00 01 f1 1c 69 4b 01
E: 4.176389 14 01 07 00 54 79 d8 75 00 01 f1 1c 69 4b 01
E: 4.184390 14 01 07 00 6c 79 ff 75 00 01 f1 1c 69 4b 01
E: 4.192308 14 01 07 00 83 79 23 76 00 01 f1 1c 69 4b 01
E: 4.200316 14 01 07 00 9a 79 44 76 00 01 f1 1c 69 4b 01
E: 4.208310 14 01 07 00 b1 79 63 76 00 01 f1 1c 69 4b 01
E: 4.216360 14 01 07 00 c7 79 81 76 00 01 f1 1c 69 4b 01
E: 4.224310 14 01 07 00 dd 79 9c 76 00 01 f1 1c 69 4b 01
E: 4.232361 14 01 07 00 f0 79 b4 76 00 01 f1 1c 69 4b 01
E: 4.240314 14 01 07 00 03 7a cb 76 00 01 f1 1c 69 4b 01
E: 4.248397 14 01 07 00 17 7a e3 76 00 01 f1 1c 69 4b 01
E: 4.256314 14 01 07 00 2b 7a f9 76 00 01 f1 1c 69 4b 01
E: 4.264366 14 01 07 00 3e 7a 0e 77 00 01 f1 1c 69 4b 01
E: 4.272317 14 01 07 00 51 7a 23 77 00 01 f1 1c 69 4b 01
E: 4.280366 14 01 07 00 64 7a 38 77 00 01 f1 1c 69 4b 01
E: 4.288317 14 01 07 00 77 7a 4d 77 00 01 f1 1c 69 4b 01
E: 4.296400 14 01 07 00 8b 7a 63 77 00 01 f1 1c 69 4b 01
E: 4.304289 14 01 07 00 a0 7a 78 77 00 01 f1 1c 69 4b 01
E: 4.312371 14 01 07 00 b5 7a 8f 77 00 01 f1 1c 69 4b 01
E: 4.320321 14 01 07 00 ca 7a a4 77 00 01 f1 1c 69 4b 01
E: 4.328370 14 01 07 00 ca 7a a4 77 00 01 f1 1c 69 4b 01
E: 4.336353 14 01 07 00 dd 7a ca 77 00 01 f1 1c 69 4b 01
E: 4.344374 14 01 07 00 f4 7a d5 77 00 01 f1 1c 69 4b 01
E: 4.352375 14 01 07 00 07 7b e0 77 00 01 f1 1c 69 4b 01
E: 4.360374 14 01 07 00 07 7b e0 77 00 01 f1 1c 69 4b 01
E: 4.368377 14 01 07 00 1a 7b 04 78 00 01 f1 1c 69 4b 01
E: 4.376326 14 01 07 00 30 7b 2d 78 00 01 f1 1c 69 4b 01
E: 4.384410 14 01 07 00 46 7b 52 78 00 01 f1 1c 69 4b 01
E: 4.392327 14 01 07 00 5c 7b 76 78 00 01 f1 1c 69 4b 01
E: 4.400378 14 01 07 00 73 7b 97 78 00 01 f1 1c 69 4b 01
E: 4.408332 14 01 07 00 8a 7b b7 78 00 01 f1 1c 69 4b 01
E: 4.416379 14 01 07 00 a2 7b d6 78 00 01 f1 1c 69 4b 01
E: 4.424324 14 01 07 00 b9 7b f4 78 00 01 f1 1c 69 4b 01
E: 4.432383 14 01 07 00 d2 7b 12 79 00 01 f1 1c 69 4b 01
E: 4.440332 14 01 07 00 ee 7b 33 79 00 01 f1 1c 69 4b 01
E: 4.448383 14 01 07 00 0b 7c 54 79 00 01 f1 1c 69 4b 01
E: 4.456334 14 01 07 00 29 7c 76 79 00 01 f1 1c 69 4b 01
E: 4.464385 14 01 07 00 48 7c 8c 79 00 01 f1 1c 69 4b 01
E: 4.472335 14 01 07 00 68 7c a8 79 00 01 f1 1c 69 4b 01
E: 4.480419 14 01 07 00 8b 7c c9 79 00 01 f1 1c 69 4b 01
E: 4.488337 14 01 07 00 b2 7c f3 79 00 01 f1 1c 69 4b 01
E: 4.496387 14 01 07 00 b2 7c f3 79 00 01 f1 1c 69 4b 01
E: 4.504334 14 01 07 00 e1 7c 33 7a 00 01 f1 1c 69 4b 01
E: 4.512383 14 01 07 00 17 7d b1 7a 00 01 f1 1c 69 4b 01
E: 4.520340 14 01 07 00 49 7d 07 7b 00 01 f1 1c 69 4b 01
E: 4.528394 14 01 07 00 75 7d 51 7b 00 01 f1 1c 69 4b 01
E: 4.536343 14 01 07 00 a2 7d 95 7b 00 01 f1 1c 69 4b 01
E: 4.544392 14 01 07 00 cb 7d d2 7b 00 01 f1 1c 69 4b 01
E: 4.552395 14 01 07 00 ea 7d 00 7c 00 01 f1 1c 69 4b 01
E: 4.560396 14 01 07 00 07 7e 29 7c 00 01 f1 1c 69 4b 01
E: 4.568345 14 01 07 00 1e 7e 4a 7c 00 01 f1 1c 69 4b 01
E: 4.576396 14 01 07 00 30 7e 63 7c 00 01 f1 1c 69 4b 01
E: 4.584399 14 01 07 00 3d 7e 76 7c 00 01 f1 1c 69 4b 01
E: 4.592318 14 01 07 00 46 7e 83 7c 00 01 f1 1c 69 4b 01
E: 4.600326 14 01 07 00 4d 7e 8d 7c 00 01 f1 1c 69 4b 01
E: 4.608350 14 01 07 00 53 7e 8b 7c 00 01 f1 1c 69 4b 01
E: 4.616433 14 01 07 00 54 7e 8d 7c 00 01 f1 1c 69 4b 01
E: 4.624393 14 01 07 00 54 7e 8d 7c 00 01 f1 1c 69 4b 01
E: 4.632402 14 01 07 00 55 7e 8e 7c 00 01 f1 1c 69 4b 01
E: 4.640436 14 01 07 00 55 7e 8f 7c 00 01 f1 1c 69 4b 01
E: 4.648413 14 01 07 00 56 7e 90 7c 00 01 f1 1c 69 4b 01
E: 4.656354 14 01 07 00 56 7e 91 7c 00 01 f1 1c 69 4b 01
E: 4.664401 14 01 07 00 56 7e 91 7c 00 01 f1 1c 69 4b 01
E: 4.672407 14 01 07 00 58 7e 94 7c 00 01 f1 1c 69 4b 01
E: 4.680407 14 01 07 00 5a 7e 98 7c 00 01 f1 1c 69 4b 01
E: 4.688408 14 01 07 00 64 7e a7 7c 00 01 f1 1c 69 4b 01
E: 4.696402 14 01 07 00 65 7e a9 7c 00 01 f1 1c 69 4b 01
E: 4.704407 14 01 07 00 65 7e a9 7c 00 01 f1 1c 69 4b 01
E: 4.712411 14 01 07 00 65 7e aa 7c 00 01 f1 1c 69 4b 01
E: 4.720404 14 01 07 00 66 7e aa 7c 00 01 f1 1c 69 4b 01
E: 4.728358 14 01 07 00 66 7e aa 7c 00 01 f1 1c 69 4b 01
E: 4.736405 14 01 07 00 66 7e ab 7c 00 01 f1 1c 69 4b 01
E: 4.744394 14 01 07 00 66 7e ab 7c 00 01 f1 1c 69 4b 01
E: 4.752413 14 01 07 00 66 7e ab 7c 00 01 f1 1c 69 4b 01
E: 4.760444 14 01 07 00 66 7e ab 7c 00 01 f1 1c 69 4b 01
E: 4.768414 14 01 07 00 66 7e ab 7c 00 01 f1 1c 69 4b 01
E: 4.776415 14 01 07 00 66 7e ab 7c 00 01 f1 1c 69 4b 01
E: 4.784449 14 01 07 00 66 7e ac 7c 00 01 f1 1c 69 4b 01
E: 4.792417 14 01 07 00 68 7e af 7c 00 01 f1 1c 69 4b 01
E: 4.800419 14 01 07 00 69 7e b4 7c 00 01 f1 1c 69 4b 01
E: 4.808416 14 01 07 00 69 7e b4 7c 00 01 f1 1c 69 4b 01
E: 4.816418 14 01 07 00 69 7e b4 7c 00 01 f1 1c 69 4b 01
E: 4.824422 14 01 07 00 6a 7e b5 7c 00 01 f1 1c 69 4b 01
E: 4.832413 14 01 07 00 6a 7e b5 7c 00 01 f1 1c 69 4b 01
E: 4.840421 14 01 07 00 6a 7e b5 7c 00 01 f1 1c 69 4b 01
E: 4.848421 14 01 07 00 6a 7e b5 7c 00 01 f1 1c 69 4b 01
E: 4.856417 14 01 07 00 6a 7e b5 7c 00 01 f1 1c 69 4b 01
E: 4.864423 14 01 07 00 6a 7e b5 7c 00 01 f1 1c 69 4b 01
E: 4.872425 14 01 07 00 6a 7e b6 7c 00 01 f1 1c 69 4b 01
E: 4.880427 14 01 07 00 6a 7e b6 7c 00 01 f1 1c 69 4b 01
E: 4.888425 14 01 07 00 6a 7e b6 7c 00 01 f1 1c 69 4b 01
E: 4.896427 14 01 07 00 6a 7e b6 7c 00 01 f1 1c 69 4b 01
E: 4.904425 14 01 07 00 6a 7e b6 7c 00 01 f1 1c 69 4b 01
E: 4.912430 14 01 07 00 6b 7e b6 7c 00 01 f1 1c 69 4b 01
E: 4.920424 14 01 07 00 6b 7e b7 7c 00 01 f1 1c 69 4b 01
E: 4.928430 14 01 07 00 6b 7e b7 7c 00 01 f1 1c 69 4b 01
E: 4.936426 14 01 07 00 6b 7e b6 7c 00 01 f1 1c 69 4b 01
E: 4.944433 14 01 07 00 6c 7e b7 7c 00 01 f1 1c 69 4b 01
E: 4.952431 14 01 07 00 6d 7e bb 7c 00 01 f1 1c 69 4b 01
E: 4.960433 14 01 07 00 90 7e 09 7d 00 01 f1 1c 69 4b 01
E: 4.968431 14 01 06 00 90 7e 09 7d 00 01 f1 1c 69 4b 01
# 2. Land one finger,
   - land a second finger far enough from the first
   - move your two fingers
   - release the *first* finger
   - release the second finger
E: 9.024883 14 01 07 00 16 2a b7 18 00 01 f1 1c 69 4b 01
E: 9.032793 14 01 07 00 12 2a c5 18 00 01 f1 1c 69 4b 01
E: 9.040874 14 01 07 00 12 2a c5 18 00 01 f1 1c 69 4b 01
E: 9.048875 14 01 07 00 12 2a c5 18 00 01 f1 1c 69 4b 01
E: 9.056812 14 01 07 00 12 2a c5 18 00 01 f1 1c 69 4b 01
E: 9.064841 14 01 07 00 12 2a c5 18 00 01 f1 1c 69 4b 01
E: 9.072841 14 01 07 00 12 2a c5 18 00 01 f1 1c 69 4b 01
E: 9.080878 14 01 07 00 12 2a c5 18 00 01 f1 1c 69 4b 01
E: 9.088879 14 01 07 00 12 2a c5 18 00 01 f1 1c 69 4b 01
E: 9.096793 14 01 07 00 12 2a c5 18 00 01 f1 1c 69 4b 01
E: 9.104845 14 01 07 00 12 2a c5 18 00 01 f1 1c 69 4b 01
E: 9.112867 14 01 07 00 12 2a c5 18 00 01 f1 1c 69 4b 01
E: 9.120864 14 01 07 00 12 2a c5 18 00 01 f1 1c 69 4b 01
E: 9.128830 14 01 07 00 12 2a c5 18 00 01 f1 1c 69 4b 01
E: 9.136870 14 01 07 00 12 2a c5 18 00 01 f1 1c 69 4b 01
E: 9.144848 14 01 07 00 12 2a c5 18 00 01 f1 1c 69 4b 01
E: 9.152937 14 01 07 00 12 2a c5 18 00 01 f1 1c 69 4b 01
E: 9.160848 14 01 07 00 12 2a c5 18 00 01 f1 1c 69 4b 01
E: 9.168884 14 01 07 00 12 2a c5 18 00 01 f1 1c 69 4b 01
E: 9.176885 14 01 07 00 12 2a c5 18 00 01 f1 1c 69 4b 01
E: 9.184888 14 01 07 00 12 2a c5 18 00 01 f1 1c 69 4b 01
E: 9.192870 14 01 07 00 12 2a c5 18 00 01 f1 1c 69 4b 01
E: 9.200888 14 01 07 00 12 2a c5 18 00 01 f1 1c 69 4b 01
E: 9.208856 14 01 07 00 12 2a c5 18 00 01 f1 1c 69 4b 01
E: 9.216857 14 01 07 00 12 2a c5 18 00 01 f1 1c 69 4b 01
E: 9.224855 14 01 07 00 12 2a c5 18 00 01 f1 1c 69 4b 01
E: 9.232836 14 01 07 00 12 2a c5 18 00 01 f1 1c 69 4b 01
E: 9.240857 14 01 07 00 12 2a c5 18 00 01 f1 1c 69 4b 01
E: 9.248860 14 01 07 00 12 2a c5 18 00 01 f1 1c 69 4b 01
E: 9.256897 14 01 07 00 12 2a c5 18 00 01 f1 1c 69 4b 01
E: 9.264896 14 01 07 00 12 2a c5 18 00 01 f1 1c 69 4b 01
E: 9.272892 14 01 07 00 12 2a c5 18 00 01 f1 1c 69 4b 01
E: 9.280863 14 01 07 00 12 2a c5 18 00 01 f1 1c 69 4b 01
E: 9.288899 14 01 07 00 12 2a c5 18 00 01 f1 1c 69 4b 01
E: 9.296862 14 01 07 00 12 2a c5 18 00 01 f1 1c 69 4b 01
E: 9.304863 14 01 07 00 12 2a c5 18 00 01 f1 1c 69 4b 01
E: 9.312866 14 01 07 00 12 2a c5 18 00 01 f1 1c 69 4b 01
E: 9.320884 14 01 07 00 12 2a c5 18 00 01 f1 1c 69 4b 01
E: 9.328866 14 01 07 00 12 2a c5 18 00 01 f1 1c 69 4b 01
E: 9.336877 14 01 07 00 12 2a c5 18 00 01 f1 1c 69 4b 01
E: 9.344905 14 01 07 00 12 2a c5 18 00 01 f1 1c 69 4b 01
E: 9.352962 14 01 07 00 12 2a c5 18 00 01 f1 1c 69 4b 01
E: 9.360889 14 01 07 00 12 2a c5 18 00 01 f1 1c 69 4b 01
E: 9.368905 14 01 07 00 12 2a c5 18 00 01 f1 1c 69 4b 01
E: 9.376871 14 01 07 00 12 2a c5 18 00 01 f1 1c 69 4b 01
E: 9.384872 14 01 07 00 12 2a c5 18 00 01 f1 1c 69 4b 01
E: 9.392874 14 01 07 00 12 2a c5 18 00 01 f1 1c 69 4b 01
E: 9.400873 14 01 07 00 12 2a c5 18 00 01 f1 1c 69 4b 01
E: 9.408796 14 01 07 00 12 2a c5 18 00 01 f1 1c 69 4b 01
E: 9.416910 14 01 07 00 12 2a c5 18 00 01 f1 1c 69 4b 01
E: 9.424877 14 01 07 00 12 2a c5 18 00 01 f1 1c 69 4b 01
E: 9.432877 14 01 07 00 12 2a c5 18 00 01 f1 1c 69 4b 01
E: 9.440916 14 01 07 00 12 2a c5 18 00 01 f1 1c 69 4b 01
E: 9.448878 14 01 07 00 12 2a c5 18 00 01 f1 1c 69 4b 01
E: 9.456902 14 01 07 00 12 2a c5 18 00 01 f1 1c 69 4b 01
E: 9.464896 14 01 07 00 12 2a c5 18 00 01 f1 1c 69 4b 01
E: 9.472881 14 01 07 00 12 2a c5 18 00 01 f1 1c 69 4b 01
E: 9.480880 14 01 07 00 12 2a c5 18 00 01 f1 1c 69 4b 01
E: 9.488923 14 01 07 00 12 2a c5 18 07 01 e5 39 41 17 02
E: 9.496882 14 01 07 00 12 2a c5 18 07 01 e5 39 41 17 02
E: 9.504918 14 01 07 00 12 2a c5 18 07 01 e5 39 41 17 02
E: 9.512903 14 01 07 00 12 2a c5 18 07 01 e5 39 41 17 02
E: 9.520922 14 01 07 00 12 2a c5 18 07 01 e5 39 41 17 02
E: 9.528925 14 01 07 00 12 2a c5 18 07 01 e5 39 41 17 02
E: 9.536906 14 01 07 00 12 2a c5 18 07 01 e5 39 41 17 02
E: 9.544927 14 01 07 00 12 2a c5 18 07 01 e5 39 41 17 02
E: 9.552978 14 01 07 00 12 2a c5 18 07 01 e5 39 41 17 02
E: 9.560928 14 01 07 00 12 2a c5 18 07 01 e5 39 41 17 02
E: 9.568910 14 01 07 00 12 2a c5 18 07 01 e5 39 41 17 02
E: 9.576926 14 01 07 00 12 2a c5 18 07 01 e5 39 41 17 02
E: 9.584894 14 01 07 00 12 2a c5 18 07 01 e5 39 41 17 02
E: 9.592893 14 01 07 00 12 2a c5 18 07 01 e5 39 41 17 02
E: 9.600823 14 01 07 00 12 2a c5 18 07 01 e5 39 41 17 02
E: 9.608893 14 01 07 00 12 2a c5 18 07 01 e5 39 41 17 02
E: 9.616921 14 01 07 00 12 2a c5 18 07 01 e5 39 41 17 02
E: 9.624897 14 01 07 00 12 2a c5 18 07 01 e5 39 41 17 02
E: 9.632896 14 01 07 00 12 2a c5 18 07 01 e5 39 41 17 02
E: 9.640922 14 01 07 00 12 2a c5 18 07 01 e5 39 41 17 02
E: 9.648897 14 01 07 00 12 2a c5 18 07 01 e5 39 41 17 02
E: 9.656919 14 01 07 00 12 2a c5 18 07 01 e5 39 41 17 02
E: 9.664938 14 01 07 00 12 2a c5 18 07 01 e5 39 41 17 02
E: 9.672939 14 01 07 00 12 2a c5 18 07 01 e5 39 41 17 02
E: 9.680904 14 01 07 00 12 2a c5 18 07 01 e5 39 41 17 02
E: 9.688896 14 01 07 00 12 2a c5 18 07 01 e5 39 41 17 02
E: 9.696941 14 01 07 00 12 2a c5 18 07 01 e5 39 41 17 02
E: 9.704905 14 01 07 00 12 2a c5 18 07 01 e5 39 41 17 02
E: 9.712908 14 01 07 00 12 2a c5 18 07 01 e5 39 41 17 02
E: 9.720942 14 01 07 00 12 2a c5 18 07 01 e5 39 41 17 02
E: 9.728941 14 01 07 00 12 2a c5 18 07 01 e5 39 41 17 02
E: 9.736901 14 01 07 00 12 2a c5 18 07 01 e5 39 41 17 02
E: 9.744909 14 01 07 00 12 2a c5 18 07 01 e5 39 41 17 02
E: 9.752960 14 01 07 00 12 2a c5 18 07 01 e5 39 41 17 02
E: 9.760857 14 01 07 00 12 2a c5 18 07 01 e5 39 41 17 02
E: 9.768911 14 01 07 00 12 2a c5 18 07 01 e5 39 41 17 02
E: 9.776912 14 01 07 00 12 2a c5 18 07 01 e5 39 41 17 02
E: 9.784912 14 01 07 00 12 2a c5 18 07 01 e5 39 41 17 02
E: 9.792936 14 01 07 00 12 2a c5 18 07 01 e5 39 41 17 02
E: 9.800915 14 01 07 00 12 2a c5 18 07 01 e5 39 41 17 02
E: 9.808917 14 01 07 00 12 2a c5 18 07 01 de 39 4a 17 02
E: 9.816936 14 01 07 00 12 2a c5 18 07 01 dc 39 53 17 02
E: 9.824950 14 01 07 00 12 2a c5 18 07 01 db 39 55 17 02
E: 9.832923 14 01 07 00 12 2a c5 18 07 01 da 39 57 17 02
E: 9.840937 14 01 07 00 12 2a c5 18 07 01 da 39 57 17 02
E: 9.848922 14 01 07 00 12 2a c5 18 07 01 da 39 5a 17 02
E: 9.856959 14 01 07 00 12 2a c5 18 07 01 d9 39 5c 17 02
E: 9.864915 14 01 07 00 12 2a c5 18 07 01 d8 39 5e 17 02
E: 9.872961 14 01 07 00 12 2a c5 18 07 01 d5 39 62 17 02
E: 9.880959 14 01 07 00 12 2a c5 18 07 01 ca 39 6b 17 02
E: 9.888962 14 01 07 00 12 2a c5 18 07 01 c1 39 74 17 02
E: 9.896948 14 01 07 00 12 2a c5 18 07 01 b8 39 7c 17 02
E: 9.904926 14 01 07 00 12 2a c5 18 07 01 b8 39 87 17 02
E: 9.912927 14 01 07 00 12 2a c5 18 07 01 b8 39 8a 17 02
E: 9.920949 14 01 07 00 12 2a c5 18 07 01 b9 39 8f 17 02
E: 9.928959 14 01 07 00 12 2a c5 18 07 01 b9 39 8f 17 02
E: 9.936910 14 01 07 00 12 2a c5 18 07 01 b7 39 93 17 02
E: 9.944932 14 01 07 00 12 2a c5 18 07 01 b1 39 a0 17 02
E: 9.952974 14 01 07 00 12 2a c5 18 07 01 b2 39 af 17 02
E: 9.960933 14 01 07 00 12 2a c5 18 07 01 ad 39 c2 17 02
E: 9.968969 14 01 07 00 12 2a c5 18 07 01 a9 39 d2 17 02
E: 9.976933 14 01 07 00 12 2a c5 18 07 01 a3 39 e8 17 02
E: 9.984958 14 01 07 00 12 2a c5 18 07 01 98 39 00 18 02
E: 9.992960 14 01 07 00 12 2a c5 18 07 01 91 39 1c 18 02
E: 10.000968 14 01 07 00 12 2a c5 18 07 01 90 39 3a 18 02
E: 10.008936 14 01 07 00 12 2a c5 18 07 01 90 39 3a 18 02
E: 10.016972 14 01 07 00 12 2a c5 18 07 01 86 39 5a 18 02
E: 10.024939 14 01 07 00 12 2a c5 18 07 01 7f 39 7e 18 02
E: 10.032940 14 01 07 00 12 2a c5 18 07 01 79 39 a8 18 02
E: 10.040976 14 01 07 00 08 2a 1d 19 07 01 75 39 d5 18 02
E: 10.048941 14 01 07 00 01 2a 75 19 07 01 70 39 03 19 02
E: 10.056978 14 01 07 00 fa 29 ce 19 07 01 6b 39 35 19 02
E: 10.064943 14 01 07 00 ef 29 22 1a 07 01 63 39 68 19 02
E: 10.072893 14 01 07 00 eb 29 78 1a 07 01 60 39 a1 19 02
E: 10.080980 14 01 07 00 e3 29 d2 1a 07 01 59 39 de 19 02
E: 10.088968 14 01 07 00 df 29 2b 1b 07 01 54 39 1c 1a 02
E: 10.096904 14 01 07 00 dd 29 85 1b 07 01 50 39 5e 1a 02
E: 10.104897 14 01 07 00 db 29 e0 1b 07 01 48 39 a3 1a 02
E: 10.112982 14 01 07 00 d8 29 3d 1c 07 01 44 39 ea 1a 02
E: 10.120898 14 01 07 00 d6 29 9c 1c 07 01 40 39 33 1b 02
E: 10.128966 14 01 07 00 d7 29 fb 1c 07 01 3b 39 7f 1b 02
E: 10.136869 14 01 07 00 d6 29 5b 1d 07 01 32 39 cd 1b 02
E: 10.144952 14 01 07 00 da 29 c1 1d 07 01 2c 39 1f 1c 02
E: 10.152996 14 01 07 00 de 29 28 1e 07 01 26 39 74 1c 02
E: 10.160951 14 01 07 00 e3 29 92 1e 07 01 1f 39 cb 1c 02
E: 10.168901 14 01 07 00 e3 29 92 1e 07 01 1f 39 cb 1c 02
E: 10.176955 14 01 07 00 e7 29 fd 1e 07 01 19 39 29 1d 02
E: 10.184955 14 01 07 00 e8 29 6a 1f 07 01 15 39 85 1d 02
E: 10.192956 14 01 07 00 ef 29 d9 1f 07 01 11 39 e4 1d 02
E: 10.200955 14 01 07 00 f5 29 49 20 07 01 11 39 e4 1d 02
E: 10.208979 14 01 07 00 fe 29 b9 20 07 01 11 39 e4 1d 02
E: 10.216962 14 01 07 00 08 2a 29 21 07 01 0b 39 5a 1e 02
E: 10.224960 14 01 07 00 11 2a 99 21 07 01 04 39 cf 1e 02
E: 10.232960 14 01 07 00 1a 2a 09 22 07 01 04 39 cf 1e 02
E: 10.240962 14 01 07 00 23 2a 79 22 07 01 04 39 cf 1e 02
E: 10.248960 14 01 07 00 2d 2a e8 22 07 01 fb 38 5b 1f 02
E: 10.256964 14 01 07 00 34 2a 59 23 07 01 f6 38 e2 1f 02
E: 10.264912 14 01 07 00 3f 2a c8 23 07 01 f6 38 e2 1f 02
E: 10.272964 14 01 07 00 47 2a 39 24 07 01 f6 38 e2 1f 02
E: 10.280963 14 01 07 00 4e 2a aa 24 07 01 eb 38 7f 20 02
E: 10.288983 14 01 07 00 5a 2a 20 25 07 01 e5 38 17 21 02
E: 10.296999 14 01 07 00 68 2a 95 25 07 01 e1 38 a9 21 02
E: 10.305000 14 01 07 00 75 2a 09 26 07 01 de 38 37 22 02
E: 10.312984 14 01 07 00 7e 2a 7c 26 07 01 d6 38 c1 22 02
E: 10.320917 14 01 07 00 88 2a ef 26 07 01 d1 38 48 23 02
E: 10.328971 14 01 07 00 8d 2a 65 27 07 01 c9 38 ce 23 02
E: 10.336917 14 01 07 00 8d 2a 65 27 07 01 c9 38 ce 23 02
E: 10.344971 14 01 07 00 94 2a dc 27 07 01 bf 38 53 24 02
E: 10.353006 14 01 07 00 8d 2a 4b 28 07 01 c0 38 dc 24 02
E: 10.360921 14 01 07 00 88 2a ba 28 07 01 c1 38 62 25 02
E: 10.368972 14 01 07 00 88 2a 28 29 07 01 c5 38 e4 25 02
E: 10.376974 14 01 07 00 89 2a 95 29 07 01 c3 38 67 26 02
E: 10.384976 14 01 07 00 8b 2a 03 2a 07 01 c2 38 e5 26 02
E: 10.392925 14 01 07 00 8e 2a 70 2a 07 01 c1 38 62 27 02
E: 10.400978 14 01 07 00 8f 2a da 2a 07 01 c0 38 dc 27 02
E: 10.409004 14 01 07 00 90 2a 43 2b 07 01 c4 38 51 28 02
E: 10.416975 14 01 07 00 93 2a ad 2b 07 01 c4 38 c1 28 02
E: 10.424928 14 01 07 00 95 2a 17 2c 07 01 c3 38 31 29 02
E: 10.432981 14 01 07 00 9a 2a 7e 2c 07 01 c4 38 9d 29 02
E: 10.440977 14 01 07 00 9a 2a 7e 2c 07 01 c4 38 9d 29 02
E: 10.448999 14 01 07 00 9d 2a e3 2c 07 01 c7 38 07 2a 02
E: 10.456931 14 01 07 00 9f 2a 47 2d 07 01 c7 38 72 2a 02
E: 10.464984 14 01 07 00 a5 2a ab 2d 07 01 c4 38 d9 2a 02
E: 10.473016 14 01 07 00 aa 2a 0f 2e 07 01 c5 38 3c 2b 02
E: 10.480985 14 01 07 00 af 2a 6e 2e 07 01 c8 38 9f 2b 02
E: 10.489020 14 01 07 00 b3 2a ce 2e 07 01 ca 38 00 2c 02
E: 10.497023 14 01 07 00 b7 2a 2e 2f 07 01 c7 38 5f 2c 02
E: 10.504998 14 01 07 00 b7 2a 2e 2f 07 01 c7 38 5f 2c 02
E: 10.513024 14 01 07 00 bb 2a 8b 2f 07 01 c9 38 bc 2c 02
E: 10.520931 14 01 07 00 c3 2a e8 2f 07 01 cd 38 19 2d 02
E: 10.529024 14 01 07 00 c7 2a 44 30 07 01 cc 38 71 2d 02
E: 10.536939 14 01 07 00 ca 2a 9e 30 07 01 cd 38 c9 2d 02
E: 10.544991 14 01 07 00 d2 2a f8 30 07 01 d0 38 22 2e 02
E: 10.552951 14 01 07 00 d7 2a 50 31 07 01 cb 38 79 2e 02
E: 10.560919 14 01 07 00 da 2a a7 31 07 01 c9 38 cf 2e 02
E: 10.568993 14 01 07 00 e0 2a 00 32 07 01 cd 38 25 2f 02
E: 10.576994 14 01 07 00 e4 2a 52 32 07 01 c9 38 78 2f 02
E: 10.584996 14 01 07 00 eb 2a a7 32 07 01 cb 38 cb 2f 02
E: 10.592945 14 01 07 00 ec 2a f7 32 07 01 c8 38 1e 30 02
E: 10.600996 14 01 07 00 f0 2a 48 33 07 01 c2 38 70 30 02
E: 10.609016 14 01 07 00 f2 2a 95 33 07 01 c1 38 bf 30 02
E: 10.616997 14 01 07 00 f7 2a e8 33 07 01 c5 38 10 31 02
E: 10.624948 14 01 07 00 fa 2a 3c 34 07 01 c4 38 5f 31 02
E: 10.633034 14 01 07 00 fd 2a 89 34 07 01 c4 38 ac 31 02
E: 10.641000 14 01 07 00 ff 2a d8 34 07 01 c2 38 f6 31 02
E: 10.649019 14 01 07 00 03 2b 22 35 07 01 c3 38 40 32 02
E: 10.657002 14 01 07 00 06 2b 6e 35 07 01 c5 38 84 32 02
E: 10.665003 14 01 07 00 0b 2b b6 35 07 01 c6 38 cc 32 02
E: 10.673002 14 01 07 00 0b 2b b6 35 07 01 c6 38 cc 32 02
E: 10.681005 14 01 07 00 0e 2b 00 36 07 01 c8 38 0d 33 02
E: 10.688925 14 01 07 00 0f 2b 46 36 07 01 c9 38 51 33 02
E: 10.697006 14 01 07 00 15 2b 90 36 07 01 cd 38 92 33 02
E: 10.705037 14 01 07 00 1b 2b d6 36 07 01 d2 38 d5 33 02
E: 10.713029 14 01 07 00 1a 2b 16 37 07 01 d3 38 11 34 02
E: 10.720959 14 01 07 00 1b 2b 52 37 07 01 d2 38 4c 34 02
E: 10.729011 14 01 07 00 1c 2b 94 37 07 01 d3 38 8a 34 02
E: 10.736959 14 01 07 00 1c 2b cd 37 07 01 d3 38 c0 34 02
E: 10.745028 14 01 07 00 1d 2b 03 38 07 01 d4 38 f3 34 02
E: 10.753004 14 01 07 00 1f 2b 34 38 07 01 d0 38 26 35 02
E: 10.761011 14 01 07 00 21 2b 6c 38 07 01 d2 38 5a 35 02
E: 10.769012 14 01 07 00 23 2b 9f 38 07 01 d4 38 8a 35 02
E: 10.777013 14 01 07 00 23 2b cb 38 07 01 d4 38 b2 35 02
E: 10.785050 14 01 07 00 24 2b f3 38 07 01 d4 38 d7 35 02
E: 10.793016 14 01 07 00 25 2b 18 39 07 01 d6 38 fa 35 02
E: 10.801017 14 01 07 00 27 2b 3a 39 07 01 d7 38 1a 36 02
E: 10.809006 14 01 07 00 27 2b 5c 39 07 01 da 38 37 36 02
E: 10.816961 14 01 07 00 23 2b 7b 39 07 01 db 38 56 36 02
E: 10.825041 14 01 07 00 26 2b a0 39 07 01 dc 38 78 36 02
E: 10.833053 14 01 07 00 29 2b c1 39 07 01 de 38 97 36 02
E: 10.841008 14 01 07 00 29 2b c1 39 07 01 de 38 97 36 02
E: 10.849038 14 01 07 00 2b 2b df 39 07 01 df 38 b3 36 02
E: 10.857039 14 01 07 00 2d 2b f9 39 07 01 e0 38 cb 36 02
E: 10.865022 14 01 07 00 2f 2b 12 3a 07 01 e1 38 e2 36 02
E: 10.873055 14 01 07 00 2c 2b 20 3a 07 01 e0 38 f4 36 02
E: 10.880973 14 01 07 00 2e 2b 35 3a 07 01 e0 38 06 37 02
E: 10.889026 14 01 07 00 30 2b 47 3a 07 01 e1 38 17 37 02
E: 10.897025 14 01 07 00 32 2b 57 3a 07 01 e2 38 25 37 02
E: 10.905043 14 01 07 00 33 2b 66 3a 07 01 e3 38 33 37 02
E: 10.912976 14 01 07 00 30 2b 6d 3a 07 01 e2 38 3d 37 02
E: 10.921050 14 01 07 00 30 2b 71 3a 07 01 e2 38 40 37 02
E: 10.929029 14 01 07 00 32 2b 7d 3a 07 01 e2 38 44 37 02
E: 10.936979 14 01 07 00 33 2b 88 3a 07 01 e2 38 47 37 02
E: 10.944957 14 01 07 00 33 2b 88 3a 07 01 e2 38 47 37 02
E: 10.953024 14 01 07 00 32 2b 89 3a 07 01 e2 38 49 37 02
E: 10.961063 14 01 07 00 31 2b 8a 3a 07 01 e2 38 4c 37 02
E: 10.969033 14 01 07 00 30 2b 8b 3a 07 01 e1 38 4e 37 02
E: 10.977028 14 01 07 00 2f 2b 8c 3a 07 01 e1 38 51 37 02
E: 10.985069 14 01 07 00 2f 2b 8d 3a 07 01 e1 38 53 37 02
E: 10.993056 14 01 07 00 2e 2b 8e 3a 07 01 e1 38 55 37 02
E: 11.001068 14 01 07 00 2d 2b 8f 3a 07 01 e1 38 57 37 02
E: 11.009031 14 01 07 00 2d 2b 8f 3a 07 01 e1 38 57 37 02
E: 11.017039 14 01 07 00 2d 2b 8f 3a 07 01 e0 38 5a 37 02
E: 11.025039 14 01 07 00 2c 2b 90 3a 07 01 e1 38 5b 37 02
E: 11.033040 14 01 07 00 2c 2b 90 3a 07 01 e1 38 5d 37 02
E: 11.041058 14 01 07 00 2c 2b 91 3a 07 01 e1 38 5e 37 02
E: 11.049040 14 01 07 00 2c 2b 91 3a 07 01 e2 38 5f 37 02
E: 11.057059 14 01 07 00 2c 2b 91 3a 07 01 e3 38 60 37 02
E: 11.065061 14 01 07 00 2c 2b 91 3a 07 01 e3 38 61 37 02
E: 11.073059 14 01 07 00 2c 2b 91 3a 07 01 e4 38 62 37 02
E: 11.081043 14 01 07 00 2c 2b 92 3a 07 01 e5 38 63 37 02
E: 11.089045 14 01 07 00 2c 2b 92 3a 07 01 e5 38 64 37 02
E: 11.097067 14 01 07 00 2c 2b 92 3a 07 01 e6 38 64 37 02
E: 11.105046 14 01 07 00 2c 2b 92 3a 07 01 e6 38 65 37 02
E: 11.113065 14 01 07 00 2c 2b 92 3a 07 01 e6 38 66 37 02
E: 11.121000 14 01 07 00 2c 2b 92 3a 07 01 e7 38 66 37 02
E: 11.129050 14 01 07 00 2c 2b 92 3a 07 01 e7 38 67 37 02
E: 11.137065 14 01 07 00 2c 2b 92 3a 07 01 e8 38 68 37 02
E: 11.145067 14 01 07 00 2b 2b 92 3a 07 01 e8 38 68 37 02
E: 11.153020 14 01 07 00 2b 2b 92 3a 07 01 e8 38 69 37 02
E: 11.161085 14 01 07 00 2b 2b 92 3a 07 01 e9 38 69 37 02
E: 11.169070 14 01 07 00 2b 2b 92 3a 07 01 e9 38 6a 37 02
E: 11.177070 14 01 07 00 2b 2b 92 3a 07 01 e9 38 6a 37 02
E: 11.185087 14 01 07 00 2b 2b 92 3a 07 01 e9 38 6b 37 02
E: 11.193049 14 01 07 00 2b 2b 92 3a 07 01 e9 38 6b 37 02
E: 11.201053 14 01 07 00 2b 2b 92 3a 07 01 ea 38 6b 37 02
E: 11.209057 14 01 07 00 2b 2b 91 3a 07 01 ea 38 6c 37 02
E: 11.217056 14 01 07 00 2a 2b 91 3a 07 01 ea 38 6c 37 02
E: 11.225058 14 01 07 00 2a 2b 91 3a 07 01 ea 38 6c 37 02
E: 11.233058 14 01 07 00 2a 2b 91 3a 07 01 ea 38 6d 37 02
E: 11.241061 14 01 07 00 2b 2b 90 3a 07 01 eb 38 6c 37 02
E: 11.249017 14 01 07 00 2b 2b 8f 3a 07 01 eb 38 6c 37 02
E: 11.257080 14 01 07 00 2c 2b 8e 3a 07 01 eb 38 6d 37 02
E: 11.265062 14 01 07 00 2c 2b 8e 3a 07 01 eb 38 6d 37 02
E: 11.273063 14 01 07 00 2d 2b 8d 3a 07 01 ec 38 6d 37 02
E: 11.281020 14 01 07 00 2d 2b 8c 3a 07 01 ed 38 6c 37 02
E: 11.289063 14 01 07 00 2e 2b 8c 3a 07 01 ed 38 6d 37 02
E: 11.297067 14 01 07 00 2e 2b 8b 3a 07 01 ed 38 6d 37 02
E: 11.305061 14 01 07 00 2f 2b 8a 3a 07 01 ed 38 6d 37 02
E: 11.313068 14 01 07 00 2f 2b 89 3a 07 01 ed 38 6d 37 02
E: 11.321084 14 01 07 00 2f 2b 89 3a 07 01 ed 38 6e 37 02
E: 11.329068 14 01 07 00 30 2b 88 3a 07 01 ed 38 6e 37 02
E: 11.337069 14 01 07 00 30 2b 87 3a 07 01 ed 38 6e 37 02
E: 11.345105 14 01 07 00 30 2b 87 3a 07 01 ed 38 6e 37 02
E: 11.353026 14 01 07 00 31 2b 87 3a 07 01 ed 38 6e 37 02
E: 11.361073 14 01 07 00 31 2b 86 3a 07 01 ed 38 6d 37 02
E: 11.369073 14 01 07 00 30 2b 85 3a 07 01 ee 38 6e 37 02
E: 11.377074 14 01 07 00 30 2b 83 3a 07 01 ee 38 6e 37 02
E: 11.385072 14 01 07 00 30 2b 81 3a 07 01 ee 38 6e 37 02
E: 11.393075 14 01 07 00 2f 2b 80 3a 07 01 ef 38 6e 37 02
E: 11.401076 14 01 07 00 2f 2b 7e 3a 07 01 f0 38 6d 37 02
E: 11.409110 14 01 07 00 2e 2b 7d 3a 07 01 f1 38 6d 37 02
E: 11.417077 14 01 07 00 2e 2b 7b 3a 07 01 f1 38 6c 37 02
E: 11.425079 14 01 07 00 2e 2b 7a 3a 07 01 f2 38 6b 37 02
E: 11.433112 14 01 07 00 2d 2b 78 3a 07 01 f2 38 6c 37 02
E: 11.441081 14 01 07 00 2d 2b 77 3a 07 01 f4 38 6a 37 02
E: 11.449079 14 01 07 00 2d 2b 77 3a 07 01 f4 38 6a 37 02
E: 11.457101 14 01 07 00 2c 2b 76 3a 07 01 f5 38 6a 37 02
E: 11.465083 14 01 07 00 2d 2b 74 3a 07 01 f5 38 69 37 02
E: 11.473103 14 01 07 00 2d 2b 72 3a 07 01 f7 38 68 37 02
E: 11.481083 14 01 07 00 2d 2b 70 3a 07 01 f8 38 67 37 02
E: 11.489085 14 01 07 00 2e 2b 6e 3a 07 01 fa 38 65 37 02
E: 11.497085 14 01 07 00 2e 2b 6c 3a 07 01 fb 38 64 37 02
E: 11.505007 14 01 07 00 2e 2b 6c 3a 07 01 fb 38 64 37 02
E: 11.513087 14 01 07 00 2e 2b 6a 3a 07 01 fc 38 63 37 02
E: 11.521109 14 01 07 00 2f 2b 67 3a 07 01 fd 38 61 37 02
E: 11.529088 14 01 07 00 30 2b 65 3a 07 01 ff 38 60 37 02
E: 11.537121 14 01 07 00 31 2b 63 3a 07 01 00 39 5f 37 02
E: 11.545127 14 01 07 00 31 2b 61 3a 07 01 01 39 5e 37 02
E: 11.553033 14 01 07 00 31 2b 5f 3a 07 01 02 39 5c 37 02
E: 11.561124 14 01 07 00 32 2b 5d 3a 07 01 03 39 5b 37 02
E: 11.569087 14 01 07 00 32 2b 5b 3a 07 01 04 39 5a 37 02
E: 11.577094 14 01 07 00 33 2b 59 3a 07 01 05 39 59 37 02
E: 11.585094 14 01 07 00 34 2b 58 3a 07 01 06 39 58 37 02
E: 11.593126 14 01 07 00 33 2b 57 3a 07 01 06 39 58 37 02
E: 11.601090 14 01 07 00 34 2b 56 3a 07 01 07 39 59 37 02
E: 11.609096 14 01 07 00 33 2b 56 3a 07 01 08 39 5a 37 02
E: 11.617098 14 01 07 00 33 2b 56 3a 07 01 0a 39 5c 37 02
E: 11.625098 14 01 07 00 33 2b 57 3a 07 01 0c 39 5e 37 02
E: 11.633121 14 01 07 00 35 2b 58 3a 07 01 13 39 6a 37 02
E: 11.641117 14 01 07 00 32 2b 53 3a 07 01 19 39 7c 37 02
E: 11.649130 14 01 07 00 32 2b 53 3a 07 01 19 39 7c 37 02
E: 11.657115 14 01 07 00 32 2b 53 3a 07 01 19 39 7c 37 02
E: 11.665117 14 01 07 00 32 2b 53 3a 07 01 19 39 7c 37 02
E: 11.673132 14 01 07 00 32 2b 53 3a 07 01 19 39 7c 37 02
E: 11.681100 14 01 07 00 32 2b 53 3a 07 01 19 39 7c 37 02
E: 11.689102 14 01 07 00 32 2b 53 3a 07 01 19 39 7c 37 02
E: 11.697136 14 01 07 00 32 2b 53 3a 07 01 19 39 7c 37 02
E: 11.705097 14 01 07 00 32 2b 53 3a 07 01 19 39 7c 37 02
E: 11.713106 14 01 06 00 32 2b 53 3a 07 01 19 39 7c 37 02
E: 11.721126 14 01 06 00 32 2b 53 3a 07 01 19 39 7c 37 02
E: 11.729109 14 01 07 01 39 39 c1 37 00 01 19 39 7c 37 01
E: 11.737102 14 01 07 01 41 39 d0 37 00 01 19 39 7c 37 01
E: 11.745109 14 01 07 01 46 39 da 37 00 01 19 39 7c 37 01
E: 11.753039 14 01 07 01 4a 39 e0 37 00 01 19 39 7c 37 01
E: 11.761130 14 01 07 01 4e 39 e4 37 00 01 19 39 7c 37 01
E: 11.769147 14 01 07 01 55 39 e6 37 00 01 19 39 7c 37 01
E: 11.777116 14 01 07 01 5e 39 e9 37 00 01 19 39 7c 37 01
E: 11.785135 14 01 07 01 66 39 ec 37 00 01 19 39 7c 37 01
E: 11.793133 14 01 07 01 6a 39 ed 37 00 01 19 39 7c 37 01
E: 11.801115 14 01 07 01 6d 39 f0 37 00 01 19 39 7c 37 01
E: 11.809089 14 01 07 01 6d 39 f0 37 00 01 19 39 7c 37 01
E: 11.817149 14 01 07 01 6e 39 f0 37 00 01 19 39 7c 37 01
E: 11.825119 14 01 07 01 70 39 f0 37 00 01 19 39 7c 37 01
E: 11.833118 14 01 07 01 70 39 f0 37 00 01 19 39 7c 37 01
E: 11.841135 14 01 07 01 70 39 f0 37 00 01 19 39 7c 37 01
E: 11.849121 14 01 07 01 78 39 ef 37 00 01 19 39 7c 37 01
E: 11.857143 14 01 07 01 7d 39 ee 37 00 01 19 39 7c 37 01
E: 11.865160 14 01 07 01 80 39 ed 37 00 01 19 39 7c 37 01
E: 11.873155 14 01 07 01 80 39 ed 37 00 01 19 39 7c 37 01
E: 11.881175 14 01 07 01 82 39 ec 37 00 01 19 39 7c 37 01
E: 11.889123 14 01 07 01 83 39 ec 37 00 01 19 39 7c 37 01
E: 11.897125 14 01 07 01 84 39 ec 37 00 01 19 39 7c 37 01
E: 11.905156 14 01 07 01 84 39 ec 37 00 01 19 39 7c 37 01
E: 11.913164 14 01 07 01 86 39 eb 37 00 01 19 39 7c 37 01
E: 11.921145 14 01 07 01 87 39 eb 37 00 01 19 39 7c 37 01
E: 11.929126 14 01 07 01 87 39 eb 37 00 01 19 39 7c 37 01
E: 11.937164 14 01 07 01 88 39 eb 37 00 01 19 39 7c 37 01
E: 11.945145 14 01 07 01 88 39 eb 37 00 01 19 39 7c 37 01
E: 11.953056 14 01 07 01 8e 39 e7 37 00 01 19 39 7c 37 01
E: 11.961130 14 01 07 01 8e 39 e7 37 00 01 19 39 7c 37 01
E: 11.969132 14 01 07 01 93 39 e4 37 00 01 19 39 7c 37 01
E: 11.977134 14 01 07 01 97 39 e2 37 00 01 19 39 7c 37 01
E: 11.985127 14 01 07 01 9a 39 e0 37 00 01 19 39 7c 37 01
E: 11.993171 14 01 07 01 9c 39 de 37 00 01 19 39 7c 37 01
E: 12.001135 14 01 07 01 a4 39 d8 37 00 01 19 39 7c 37 01
E: 12.009135 14 01 07 01 a4 39 d8 37 00 01 19 39 7c 37 01
E: 12.017170 14 01 07 01 ab 39 d3 37 00 01 19 39 7c 37 01
E: 12.025139 14 01 07 01 af 39 cf 37 00 01 19 39 7c 37 01
E: 12.033139 14 01 07 01 b2 39 cc 37 00 01 19 39 7c 37 01
E: 12.041158 14 01 07 01 b4 39 cb 37 00 01 19 39 7c 37 01
E: 12.049139 14 01 07 01 b5 39 ca 37 00 01 19 39 7c 37 01
E: 12.057137 14 01 07 01 b5 39 c9 37 00 01 19 39 7c 37 01
E: 12.065143 14 01 07 01 b6 39 c9 37 00 01 19 39 7c 37 01
E: 12.073142 14 01 07 01 b6 39 c8 37 00 01 19 39 7c 37 01
E: 12.081143 14 01 07 01 bb 39 c4 37 00 01 19 39 7c 37 01
E: 12.089179 14 01 07 01 bb 39 c3 37 00 01 19 39 7c 37 01
E: 12.097166 14 01 07 01 c0 39 be 37 00 01 19 39 7c 37 01
E: 12.105144 14 01 07 01 c5 39 b8 37 00 01 19 39 7c 37 01
E: 12.113163 14 01 07 01 c7 39 b7 37 00 01 19 39 7c 37 01
E: 12.121181 14 01 07 01 c8 39 b7 37 00 01 19 39 7c 37 01
E: 12.129182 14 01 07 01 cc 39 b4 37 00 01 19 39 7c 37 01
E: 12.137142 14 01 07 01 d1 39 b1 37 00 01 19 39 7c 37 01
E: 12.145150 14 01 07 01 d4 39 af 37 00 01 19 39 7c 37 01
E: 12.153130 14 01 07 01 d6 39 ad 37 00 01 19 39 7c 37 01
E: 12.161144 14 01 07 01 d8 39 ac 37 00 01 19 39 7c 37 01
E: 12.169189 14 01 07 01 d8 39 ab 37 00 01 19 39 7c 37 01
E: 12.177187 14 01 07 01 d8 39 ab 37 00 01 19 39 7c 37 01
E: 12.185171 14 01 07 01 d8 39 aa 37 00 01 19 39 7c 37 01
E: 12.193170 14 01 07 01 d8 39 aa 37 00 01 19 39 7c 37 01
E: 12.201154 14 01 07 01 d8 39 a9 37 00 01 19 39 7c 37 01
E: 12.209191 14 01 07 01 d8 39 a8 37 00 01 19 39 7c 37 01
E: 12.217155 14 01 06 01 d8 39 a8 37 00 01 19 39 7c 37 01
# 3. Finally, move your ten fingers on the screen and release them.
E: 31.531086 14 01 07 00 ba 1f 49 2d 00 01 19 39 7c 37 01
E: 31.539093 14 01 07 00 b4 1f 4c 2d 00 01 19 39 7c 37 01
E: 31.547092 14 01 07 00 b4 1f 4c 2d 00 01 19 39 7c 37 01
E: 31.555096 14 01 07 00 b4 1f 4c 2d 00 01 19 39 7c 37 01
E: 31.563092 14 01 07 00 b4 1f 4c 2d 00 01 19 39 7c 37 01
E: 31.571070 14 01 07 00 b4 1f 4c 2d 00 01 19 39 7c 37 01
E: 31.579113 14 01 07 00 b4 1f 4c 2d 00 01 19 39 7c 37 01
E: 31.587057 14 01 07 00 b4 1f 4c 2d 00 01 19 39 7c 37 01
E: 31.595079 14 01 07 00 b4 1f 4c 2d 00 01 19 39 7c 37 01
E: 31.603101 14 01 07 00 b4 1f 4c 2d 00 01 19 39 7c 37 01
E: 31.611098 14 01 07 00 b4 1f 4c 2d 00 01 19 39 7c 37 01
E: 31.619098 14 01 07 00 b4 1f 4c 2d 00 01 19 39 7c 37 01
E: 31.627098 14 01 07 00 b4 1f 4c 2d 00 01 19 39 7c 37 01
E: 31.635103 14 01 07 00 b4 1f 4c 2d 00 01 19 39 7c 37 01
E: 31.643101 14 01 07 00 b4 1f 4c 2d 00 01 19 39 7c 37 01
E: 31.651101 14 01 07 00 b4 1f 4c 2d 00 01 19 39 7c 37 01
E: 31.659119 14 01 06 00 b4 1f 4c 2d 00 01 19 39 7c 37 01
E: 32.131151 14 01 07 00 ed 1c 7b 2f 00 01 19 39 7c 37 01
E: 32.139152 14 01 07 00 ea 1c 8d 2f 00 01 19 39 7c 37 01
E: 32.147166 14 01 07 00 ea 1c 8d 2f 00 01 19 39 7c 37 01
E: 32.155155 14 01 07 00 ea 1c 8d 2f 00 01 19 39 7c 37 01
E: 32.163152 14 01 07 00 ea 1c 8d 2f 00 01 19 39 7c 37 01
E: 32.171169 14 01 07 00 ea 1c 8d 2f 00 01 19 39 7c 37 01
E: 32.179154 14 01 07 00 ea 1c 8d 2f 00 01 19 39 7c 37 01
E: 32.187151 14 01 07 00 ea 1c 8d 2f 00 01 19 39 7c 37 01
E: 32.195156 14 01 07 00 ea 1c 8d 2f 00 01 19 39 7c 37 01
E: 32.203174 14 01 07 00 ea 1c 8d 2f 00 01 19 39 7c 37 01
E: 32.211163 14 01 07 00 ea 1c 8d 2f 00 01 19 39 7c 37 01
E: 32.219176 14 01 06 00 ea 1c 8d 2f 00 01 19 39 7c 37 01
E: 32.363192 14 01 07 00 08 1e 1c 33 00 01 19 39 7c 37 01
E: 32.371155 14 01 07 00 03 1e 1f 33 00 01 19 39 7c 37 01
E: 32.379179 14 01 07 00 03 1e 1f 33 00 01 19 39 7c 37 01
E: 32.387160 14 01 07 00 03 1e 1f 33 00 01 19 39 7c 37 01
E: 32.395191 14 01 07 00 03 1e 1f 33 00 01 19 39 7c 37 01
E: 32.403177 14 01 07 00 03 1e 1f 33 00 01 19 39 7c 37 01
E: 32.411181 14 01 07 00 03 1e 1f 33 00 01 19 39 7c 37 01
E: 32.419181 14 01 07 00 03 1e 1f 33 00 01 19 39 7c 37 01
E: 32.427183 14 01 07 00 03 1e 1f 33 00 01 19 39 7c 37 01
E: 32.435197 14 01 07 00 03 1e 1f 33 00 01 19 39 7c 37 01
E: 32.443185 14 01 07 00 03 1e 1f 33 00 01 19 39 7c 37 01
E: 32.451198 14 01 07 00 03 1e 1f 33 00 01 19 39 7c 37 01
E: 32.459185 14 01 07 00 03 1e 1f 33 00 01 19 39 7c 37 01
E: 32.467200 14 01 07 00 03 1e 1f 33 00 01 19 39 7c 37 01
E: 32.475183 14 01 07 00 03 1e 1f 33 00 01 19 39 7c 37 01
E: 32.483192 14 01 07 00 03 1e 1f 33 00 01 19 39 7c 37 01
E: 32.491185 14 01 07 00 03 1e 1f 33 00 01 19 39 7c 37 01
E: 32.499203 14 01 07 00 03 1e 1f 33 00 01 19 39 7c 37 01
E: 32.507190 14 01 07 00 03 1e 1f 33 00 01 19 39 7c 37 01
E: 32.515191 14 01 07 00 03 1e 1f 33 00 01 19 39 7c 37 01
E: 32.523189 14 01 07 00 03 1e 1f 33 00 01 19 39 7c 37 01
E: 32.531190 14 01 07 00 03 1e 1f 33 00 01 19 39 7c 37 01
E: 32.539195 14 01 07 00 03 1e 1f 33 00 01 19 39 7c 37 01
E: 32.547194 14 01 07 00 03 1e 1f 33 00 01 19 39 7c 37 01
E: 32.555191 14 01 07 00 03 1e 1f 33 00 01 19 39 7c 37 01
E: 32.563210 14 01 07 00 20 1e dd 32 00 01 19 39 7c 37 01
E: 32.571178 14 01 07 00 3c 1e a6 32 00 01 19 39 7c 37 01
E: 32.579196 14 01 07 00 59 1e 75 32 00 01 19 39 7c 37 01
E: 32.587171 14 01 07 00 78 1e 4a 32 00 01 19 39 7c 37 01
E: 32.595164 14 01 07 00 9c 1e 20 32 00 01 19 39 7c 37 01
E: 32.603199 14 01 07 00 bf 1e f9 31 00 01 19 39 7c 37 01
E: 32.611199 14 01 07 00 da 1e da 31 00 01 19 39 7c 37 01
E: 32.619183 14 01 07 00 ee 1e c3 31 00 01 19 39 7c 37 01
E: 32.627219 14 01 07 00 01 1f b2 31 00 01 19 39 7c 37 01
E: 32.635217 14 01 07 00 16 1f a5 31 00 01 19 39 7c 37 01
E: 32.643220 14 01 07 00 2f 1f 9d 31 00 01 19 39 7c 37 01
E: 32.651204 14 01 06 00 2f 1f 9d 31 00 01 19 39 7c 37 01
E: 32.827223 14 01 07 00 df 21 f5 35 00 01 19 39 7c 37 01
E: 32.835222 14 01 07 00 e1 21 05 36 00 01 19 39 7c 37 01
E: 32.843223 14 01 07 00 e1 21 05 36 00 01 19 39 7c 37 01
E: 32.851225 14 01 07 00 e1 21 05 36 00 01 19 39 7c 37 01
E: 32.859226 14 01 07 00 e1 21 05 36 00 01 19 39 7c 37 01
E: 32.867238 14 01 07 00 e1 21 05 36 00 01 19 39 7c 37 01
E: 32.875223 14 01 06 00 e1 21 05 36 00 01 19 39 7c 37 01
E: 33.891326 14 01 07 00 9c 27 11 3a 07 01 de 30 8c 2d 02
E: 33.899342 14 01 07 00 b5 27 ff 39 07 01 de 30 8c 2d 02
E: 33.907327 14 01 07 00 b6 27 ff 39 07 01 df 30 8c 2d 02
E: 33.915332 14 01 07 00 b6 27 ff 39 07 01 df 30 8b 2d 02
E: 33.923334 14 01 07 00 b8 27 fd 39 07 01 df 30 8b 2d 02
E: 33.931345 14 01 07 00 b9 27 fa 39 07 01 df 30 8b 2d 02
E: 33.939330 14 01 07 00 bb 27 f2 39 07 01 df 30 8b 2d 02
E: 33.947331 14 01 07 00 c0 27 e9 39 07 01 df 30 8b 2d 02
E: 33.955336 14 01 07 00 c6 27 db 39 07 01 df 30 8a 2d 02
E: 33.963350 14 01 07 00 d1 27 cb 39 07 01 de 30 8a 2d 02
E: 33.971334 14 01 07 00 da 27 bd 39 07 01 dd 30 8a 2d 02
E: 33.979353 14 01 07 00 e5 27 ae 39 07 01 dc 30 8a 2d 02
E: 33.987352 14 01 07 00 ef 27 a1 39 07 01 db 30 8a 2d 02
E: 33.995341 14 01 07 00 fa 27 93 39 07 01 da 30 8a 2d 02
E: 34.003356 14 01 07 00 05 28 87 39 07 01 d8 30 8a 2d 02
E: 34.011355 14 01 07 00 11 28 7b 39 07 01 d7 30 8b 2d 02
E: 34.019343 14 01 07 00 1c 28 70 39 07 01 d6 30 8b 2d 02
E: 34.027357 14 01 07 00 28 28 64 39 07 01 d5 30 8b 2d 02
E: 34.035340 14 01 07 00 36 28 58 39 07 01 d5 30 8b 2d 02
E: 34.043358 14 01 07 00 42 28 4e 39 07 01 d4 30 8b 2d 02
E: 34.051357 14 01 07 00 42 28 4e 39 07 01 d4 30 8b 2d 02
E: 34.059363 14 01 07 00 50 28 42 39 07 01 d3 30 8c 2d 02
E: 34.067349 14 01 07 00 5e 28 36 39 07 01 d3 30 8c 2d 02
E: 34.075349 14 01 07 00 6c 28 2b 39 07 01 d2 30 8c 2d 02
E: 34.083346 14 01 07 00 7c 28 1d 39 07 01 d1 30 8c 2d 02
E: 34.091351 14 01 07 00 8b 28 10 39 07 01 d0 30 8c 2d 02
E: 34.099365 14 01 07 00 98 28 04 39 07 01 d0 30 8c 2d 02
E: 34.107347 14 01 07 00 a6 28 f8 38 07 01 cf 30 8b 2d 02
E: 34.115349 14 01 07 00 b5 28 ea 38 07 01 ce 30 8b 2d 02
E: 34.123354 14 01 07 00 c3 28 df 38 07 01 cd 30 8b 2d 02
E: 34.131350 14 01 07 00 cf 28 d4 38 07 01 cc 30 8b 2d 02
E: 34.139354 14 01 07 00 db 28 cb 38 07 01 cb 30 8b 2d 02
E: 34.147356 14 01 07 00 e5 28 c3 38 07 01 cc 30 8a 2d 02
E: 34.155356 14 01 07 00 ef 28 bc 38 07 01 cb 30 8a 2d 02
E: 34.163371 14 01 07 00 ff 28 bb 38 07 01 cb 30 8a 2d 02
E: 34.171356 14 01 07 00 0e 29 b6 38 07 01 ca 30 8a 2d 02
E: 34.179355 14 01 07 00 1f 29 b0 38 07 01 ca 30 8a 2d 02
E: 34.187356 14 01 07 00 32 29 ab 38 07 01 c9 30 8b 2d 02
E: 34.195374 14 01 07 00 43 29 a0 38 07 01 c9 30 8d 2d 02
E: 34.203363 14 01 07 00 5b 29 93 38 07 01 cb 30 8f 2d 02
E: 34.211359 14 01 07 00 76 29 7e 38 07 01 d0 30 96 2d 02
E: 34.219361 14 01 07 00 76 29 7e 38 07 01 d0 30 96 2d 02
E: 34.227358 14 01 07 00 76 29 7e 38 07 01 d0 30 96 2d 02
E: 34.235376 14 01 07 00 76 29 7e 38 07 01 d0 30 96 2d 02
E: 34.243357 14 01 07 00 76 29 7e 38 07 01 d0 30 96 2d 02
E: 34.251361 14 01 07 00 76 29 7e 38 07 01 d0 30 96 2d 02
E: 34.259361 14 01 07 00 76 29 7e 38 07 01 d0 30 96 2d 02
E: 34.267360 14 01 07 00 76 29 7e 38 07 01 d0 30 96 2d 02
E: 34.275362 14 01 07 00 76 29 7e 38 07 01 d0 30 96 2d 02
E: 34.283346 14 01 06 00 76 29 7e 38 06 01 d0 30 96 2d 02
E: 34.851420 14 01 07 00 c6 2f d0 36 00 01 d0 30 96 2d 01
E: 34.859358 14 01 07 00 be 2f c6 36 00 01 d0 30 96 2d 01
E: 34.867333 14 01 07 00 be 2f c6 36 00 01 d0 30 96 2d 01
E: 34.875329 14 01 07 00 be 2f c6 36 00 01 d0 30 96 2d 01
E: 34.883327 14 01 07 00 be 2f c6 36 00 01 d0 30 96 2d 01
E: 34.891427 14 01 07 00 be 2f c6 36 00 01 d0 30 96 2d 01
E: 34.899421 14 01 07 00 be 2f c6 36 00 01 d0 30 96 2d 01
E: 34.907428 14 01 07 00 be 2f c6 36 00 01 d0 30 96 2d 01
E: 34.915427 14 01 07 00 be 2f c6 36 00 01 d0 30 96 2d 01
E: 34.923430 14 01 07 00 be 2f c6 36 00 01 d0 30 96 2d 01
E: 34.931433 14 01 07 00 be 2f c6 36 00 01 d0 30 96 2d 01
E: 34.939445 14 01 07 00 be 2f c6 36 00 01 d0 30 96 2d 01
E: 34.947431 14 01 06 00 be 2f c6 36 00 01 d0 30 96 2d 01
# Thank you.
