R: 253 05 0d 09 04 a1 01 85 01 09 22 a1 02 09 42 15 00 25 01 75 01 95 01 81 02 09 32 81 02 09 47 81 02 95 05 81 03 75 08 09 51 95 01 81 02 05 01 75 10 55 0e 65 11 09 30 35 00 46 98 12 26 80 07 81 02 09 31 46 78 0a 26 38 04 81 02 c0 a1 02 05 0d 09 42 15 00 25 01 75 01 95 01 81 02 09 32 81 02 09 47 81 02 95 05 81 03 75 08 09 51 95 01 81 02 05 01 75 10 55 0e 65 11 09 30 35 00 46 98 12 26 80 07 81 02 46 78 0a 26 38 04 09 31 81 02 c0 05 0d 09 54 15 00 26 ff 00 95 01 75 08 81 02 09 55 25 02 95 01 85 02 b1 02 06 00 ff 09 01 26 ff 00 75 08 95 47 85 03 b1 02 09 01 96 ff 03 85 04 b1 02 09 01 95 0b 85 05 b1 02 09 01 96 ff 03 85 06 b1 02 09 01 95 0f 85 07 b1 02 09 01 96 ff 03 85 08 b1 02 09 01 96 ff 03 85 09 b1 02 09 01 95 0f 85 0a b1 02 09 01 96 ff 03 85 0b b1 02 c0
N: QUANTA OpticalTouchScreen
P: usb-0000:00:1d.0-2/input0
I: 3 0408 3001
E: 0.000000 14 01 00 00 f1 05 4b 01 00 01 fc 04 60 02 00
E: 0.007974 14 01 00 00 f1 05 4b 01 00 01 fc 04 60 02 00
E: 0.015969 14 01 00 00 f1 05 4b 01 00 01 fc 04 60 02 00
E: 0.023971 14 01 00 00 f1 05 4b 01 00 01 fc 04 60 02 00
E: 0.031980 14 01 07 00 f7 05 49 01 00 01 fc 04 60 02 01
E: 0.039973 14 01 07 00 f7 05 49 01 00 01 fc 04 60 02 01
E: 0.047970 14 01 07 00 f7 05 49 01 00 01 fc 04 60 02 01
E: 0.055971 14 01 07 00 f7 05 49 01 00 01 fc 04 60 02 01
E: 0.063966 14 01 07 00 f7 05 49 01 00 01 fc 04 60 02 01
E: 0.071971 14 01 07 00 f7 05 49 01 00 01 fc 04 60 02 01
E: 0.079968 14 01 07 00 f7 05 49 01 00 01 fc 04 60 02 01
E: 0.087970 14 01 07 00 f7 05 49 01 00 01 fc 04 60 02 01
E: 0.095968 14 01 07 00 f7 05 49 01 00 01 fc 04 60 02 01
E: 0.103970 14 01 07 00 f7 05 49 01 00 01 fc 04 60 02 01
E: 0.111966 14 01 07 00 f7 05 49 01 00 01 fc 04 60 02 01
E: 0.119963 14 01 07 00 f7 05 49 01 00 01 fc 04 60 02 01
E: 0.127967 14 01 07 00 f7 05 49 01 00 01 fc 04 60 02 01
E: 0.135963 14 01 07 00 eb 05 48 01 00 01 fc 04 60 02 01
E: 0.143971 14 01 07 00 ea 05 47 01 00 01 fc 04 60 02 01
E: 0.151975 14 01 07 00 e7 05 47 01 00 01 fc 04 60 02 01
E: 0.159969 14 01 07 00 e4 05 46 01 00 01 fc 04 60 02 01
E: 0.167975 14 01 07 00 e2 05 46 01 00 01 fc 04 60 02 01
E: 0.183972 14 01 07 00 dc 05 45 01 00 01 fc 04 60 02 01
E: 0.191975 14 01 07 00 d8 05 43 01 00 01 fc 04 60 02 01
E: 0.199970 14 01 07 00 d1 05 42 01 00 01 fc 04 60 02 01
E: 0.207973 14 01 07 00 c7 05 3f 01 00 01 fc 04 60 02 01
E: 0.215972 14 01 07 00 ba 05 3b 01 00 01 fc 04 60 02 01
E: 0.223972 14 01 07 00 ad 05 37 01 00 01 fc 04 60 02 01
E: 0.231970 14 01 07 00 a3 05 34 01 00 01 fc 04 60 02 01
E: 0.239974 14 01 07 00 9c 05 32 01 00 01 fc 04 60 02 01
E: 0.247971 14 01 07 00 97 05 31 01 00 01 fc 04 60 02 01
E: 0.255973 14 01 07 00 94 05 30 01 00 01 fc 04 60 02 01
E: 0.263971 14 01 07 00 8e 05 2e 01 00 01 fc 04 60 02 01
E: 0.271974 14 01 07 00 82 05 2b 01 00 01 fc 04 60 02 01
E: 0.279968 14 01 07 00 72 05 26 01 00 01 fc 04 60 02 01
E: 0.287972 14 01 07 00 63 05 23 01 00 01 fc 04 60 02 01
E: 0.295970 14 01 07 00 56 05 1f 01 00 01 fc 04 60 02 01
E: 0.303972 14 01 07 00 4b 05 1c 01 00 01 fc 04 60 02 01
E: 0.311969 14 01 07 00 3f 05 19 01 00 01 fc 04 60 02 01
E: 0.319972 14 01 07 00 34 05 16 01 00 01 fc 04 60 02 01
E: 0.327965 14 01 07 00 34 05 16 01 00 01 fc 04 60 02 01
E: 0.335972 14 01 07 00 27 05 12 01 00 01 fc 04 60 02 01
E: 0.343968 14 01 07 00 1a 05 0f 01 00 01 fc 04 60 02 01
E: 0.351972 14 01 07 00 0d 05 0c 01 00 01 fc 04 60 02 01
E: 0.359966 14 01 07 00 00 05 09 01 00 01 fc 04 60 02 01
E: 0.367971 14 01 07 00 f1 04 06 01 00 01 fc 04 60 02 01
E: 0.375967 14 01 07 00 e3 04 04 01 00 01 fc 04 60 02 01
E: 0.383972 14 01 07 00 d4 04 01 01 00 01 fc 04 60 02 01
E: 0.391969 14 01 07 00 c6 04 fe 00 00 01 fc 04 60 02 01
E: 0.399969 14 01 07 00 b8 04 fb 00 00 01 fc 04 60 02 01
E: 0.407968 14 01 07 00 a8 04 f7 00 00 01 fc 04 60 02 01
E: 0.415971 14 01 07 00 98 04 f4 00 00 01 fc 04 60 02 01
E: 0.423966 14 01 07 00 87 04 f1 00 00 01 fc 04 60 02 01
E: 0.431970 14 01 07 00 76 04 ee 00 00 01 fc 04 60 02 01
E: 0.439968 14 01 07 00 66 04 ec 00 00 01 fc 04 60 02 01
E: 0.447968 14 01 07 00 55 04 ea 00 00 01 fc 04 60 02 01
E: 0.455967 14 01 07 00 45 04 e7 00 00 01 fc 04 60 02 01
E: 0.463970 14 01 07 00 34 04 e4 00 00 01 fc 04 60 02 01
E: 0.471966 14 01 07 00 22 04 e2 00 00 01 fc 04 60 02 01
E: 0.479971 14 01 07 00 0f 04 df 00 00 01 fc 04 60 02 01
E: 0.487965 14 01 07 00 fc 03 dc 00 00 01 fc 04 60 02 01
E: 0.495970 14 01 07 00 e9 03 da 00 00 01 fc 04 60 02 01
E: 0.503967 14 01 07 00 d8 03 d8 00 00 01 fc 04 60 02 01
E: 0.519969 14 01 07 00 c6 03 d5 00 00 01 fc 04 60 02 01
E: 0.527830 14 01 07 00 b5 03 d3 00 00 01 fc 04 60 02 01
E: 0.543966 14 01 07 00 a3 03 d0 00 00 01 fc 04 60 02 01
E: 0.551969 14 01 07 00 91 03 ce 00 00 01 fc 04 60 02 01
E: 0.559964 14 01 07 00 80 03 cc 00 00 01 fc 04 60 02 01
E: 0.567967 14 01 07 00 6f 03 c9 00 00 01 fc 04 60 02 01
E: 0.575966 14 01 07 00 5c 03 c6 00 00 01 fc 04 60 02 01
E: 0.583968 14 01 07 00 49 03 c2 00 00 01 fc 04 60 02 01
E: 0.591965 14 01 07 00 36 03 be 00 00 01 fc 04 60 02 01
E: 0.599967 14 01 07 00 24 03 bc 00 00 01 fc 04 60 02 01
E: 0.607965 14 01 07 00 12 03 bb 00 00 01 fc 04 60 02 01
E: 0.615967 14 01 07 00 00 03 bb 00 00 01 fc 04 60 02 01
E: 0.623963 14 01 07 00 ee 02 ba 00 00 01 fc 04 60 02 01
E: 0.631967 14 01 07 00 db 02 ba 00 00 01 fc 04 60 02 01
E: 0.639964 14 01 07 00 ca 02 ba 00 00 01 fc 04 60 02 01
E: 0.647965 14 01 07 00 b8 02 ba 00 00 01 fc 04 60 02 01
E: 0.655964 14 01 07 00 a6 02 ba 00 00 01 fc 04 60 02 01
E: 0.663967 14 01 07 00 94 02 bb 00 00 01 fc 04 60 02 01
E: 0.671962 14 01 07 00 84 02 bb 00 00 01 fc 04 60 02 01
E: 0.679966 14 01 07 00 74 02 bc 00 00 01 fc 04 60 02 01
E: 0.687963 14 01 07 00 64 02 bd 00 00 01 fc 04 60 02 01
E: 0.695964 14 01 07 00 52 02 bf 00 00 01 fc 04 60 02 01
E: 0.703963 14 01 07 00 42 02 c1 00 00 01 fc 04 60 02 01
E: 0.711965 14 01 07 00 33 02 c5 00 00 01 fc 04 60 02 01
E: 0.719963 14 01 07 00 26 02 ca 00 00 01 fc 04 60 02 01
E: 0.727961 14 01 07 00 26 02 ca 00 00 01 fc 04 60 02 01
E: 0.735963 14 01 07 00 1a 02 cf 00 00 01 fc 04 60 02 01
E: 0.743964 14 01 07 00 0e 02 d4 00 00 01 fc 04 60 02 01
E: 0.751962 14 01 07 00 03 02 d9 00 00 01 fc 04 60 02 01
E: 0.759961 14 01 07 00 f9 01 de 00 00 01 fc 04 60 02 01
E: 0.767962 14 01 07 00 f0 01 e4 00 00 01 fc 04 60 02 01
E: 0.775963 14 01 07 00 e7 01 ea 00 00 01 fc 04 60 02 01
E: 0.783961 14 01 07 00 de 01 f0 00 00 01 fc 04 60 02 01
E: 0.791965 14 01 07 00 d5 01 f6 00 00 01 fc 04 60 02 01
E: 0.799960 14 01 07 00 cd 01 fc 00 00 01 fc 04 60 02 01
E: 0.807964 14 01 07 00 c4 01 02 01 00 01 fc 04 60 02 01
E: 0.815962 14 01 07 00 bd 01 09 01 00 01 fc 04 60 02 01
E: 0.823963 14 01 07 00 b8 01 11 01 00 01 fc 04 60 02 01
E: 0.831961 14 01 07 00 b2 01 19 01 00 01 fc 04 60 02 01
E: 0.847963 14 01 07 00 ad 01 21 01 00 01 fc 04 60 02 01
E: 0.855961 14 01 07 00 a8 01 2a 01 00 01 fc 04 60 02 01
E: 0.863961 14 01 07 00 a5 01 31 01 00 01 fc 04 60 02 01
E: 0.871963 14 01 07 00 a4 01 35 01 00 01 fc 04 60 02 01
E: 0.879960 14 01 07 00 a3 01 38 01 00 01 fc 04 60 02 01
E: 0.887961 14 01 07 00 a2 01 3e 01 00 01 fc 04 60 02 01
E: 0.895960 14 01 07 00 a0 01 4b 01 00 01 fc 04 60 02 01
E: 0.903963 14 01 07 00 9f 01 5b 01 00 01 fc 04 60 02 01
E: 0.911959 14 01 07 00 9e 01 69 01 00 01 fc 04 60 02 01
E: 0.919963 14 01 07 00 9f 01 73 01 00 01 fc 04 60 02 01
E: 0.927960 14 01 07 00 a2 01 7d 01 00 01 fc 04 60 02 01
E: 0.943959 14 01 07 00 a5 01 87 01 00 01 fc 04 60 02 01
E: 0.951963 14 01 07 00 a9 01 90 01 00 01 fc 04 60 02 01
E: 0.959956 14 01 07 00 ad 01 9a 01 00 01 fc 04 60 02 01
E: 0.967961 14 01 07 00 b2 01 a3 01 00 01 fc 04 60 02 01
E: 0.975959 14 01 07 00 b7 01 ab 01 00 01 fc 04 60 02 01
E: 0.983962 14 01 07 00 be 01 b4 01 00 01 fc 04 60 02 01
E: 0.991959 14 01 07 00 c4 01 bd 01 00 01 fc 04 60 02 01
E: 0.999959 14 01 07 00 cb 01 c5 01 00 01 fc 04 60 02 01
E: 1.007958 14 01 07 00 d3 01 cc 01 00 01 fc 04 60 02 01
E: 1.015961 14 01 07 00 da 01 d3 01 00 01 fc 04 60 02 01
E: 1.023956 14 01 07 00 e3 01 da 01 00 01 fc 04 60 02 01
E: 1.031961 14 01 07 00 ec 01 e1 01 00 01 fc 04 60 02 01
E: 1.039958 14 01 07 00 f6 01 e8 01 00 01 fc 04 60 02 01
E: 1.047958 14 01 07 00 00 02 ee 01 00 01 fc 04 60 02 01
E: 1.055957 14 01 07 00 0a 02 f3 01 00 01 fc 04 60 02 01
E: 1.063960 14 01 07 00 14 02 f7 01 00 01 fc 04 60 02 01
E: 1.071955 14 01 07 00 1e 02 fc 01 00 01 fc 04 60 02 01
E: 1.079959 14 01 07 00 29 02 00 02 00 01 fc 04 60 02 01
E: 1.087958 14 01 07 00 33 02 04 02 00 01 fc 04 60 02 01
E: 1.095959 14 01 07 00 3d 02 06 02 00 01 fc 04 60 02 01
E: 1.103957 14 01 07 00 48 02 08 02 00 01 fc 04 60 02 01
E: 1.111957 14 01 07 00 53 02 0a 02 00 01 fc 04 60 02 01
E: 1.119956 14 01 07 00 5c 02 0b 02 00 01 fc 04 60 02 01
E: 1.127947 14 01 07 00 5c 02 0b 02 00 01 fc 04 60 02 01
E: 1.135956 14 01 07 00 61 02 0c 02 00 01 fc 04 60 02 01
E: 1.143948 14 01 07 00 63 02 0b 02 00 01 fc 04 60 02 01
E: 1.151966 14 01 07 00 68 02 0b 02 00 01 fc 04 60 02 01
E: 1.159950 14 01 07 00 71 02 0c 02 00 01 fc 04 60 02 01
E: 1.167965 14 01 07 00 7f 02 0c 02 00 01 fc 04 60 02 01
E: 1.183970 14 01 07 00 90 02 0c 02 00 01 fc 04 60 02 01
E: 1.191948 14 01 07 00 9f 02 0a 02 00 01 fc 04 60 02 01
E: 1.199956 14 01 07 00 aa 02 09 02 00 01 fc 04 60 02 01
E: 1.207946 14 01 07 00 b4 02 06 02 00 01 fc 04 60 02 01
E: 1.215955 14 01 07 00 bf 02 03 02 00 01 fc 04 60 02 01
E: 1.223959 14 01 07 00 ca 02 ff 01 00 01 fc 04 60 02 01
E: 1.231955 14 01 07 00 d4 02 fc 01 00 01 fc 04 60 02 01
E: 1.239955 14 01 07 00 de 02 f8 01 00 01 fc 04 60 02 01
E: 1.247955 14 01 07 00 e5 02 f5 01 00 01 fc 04 60 02 01
E: 1.255958 14 01 07 00 e9 02 f4 01 00 01 fc 04 60 02 01
E: 1.263952 14 01 07 00 eb 02 f3 01 00 01 fc 04 60 02 01
E: 1.271956 14 01 07 00 ee 02 f2 01 00 01 fc 04 60 02 01
E: 1.279954 14 01 07 00 f5 02 ef 01 00 01 fc 04 60 02 01
E: 1.287955 14 01 07 00 01 03 eb 01 00 01 fc 04 60 02 01
E: 1.295953 14 01 07 00 0d 03 e7 01 00 01 fc 04 60 02 01
E: 1.303955 14 01 07 00 19 03 e2 01 00 01 fc 04 60 02 01
E: 1.311952 14 01 07 00 21 03 dd 01 00 01 fc 04 60 02 01
E: 1.319956 14 01 07 00 29 03 d8 01 00 01 fc 04 60 02 01
E: 1.327953 14 01 07 00 32 03 d3 01 00 01 fc 04 60 02 01
E: 1.335950 14 01 07 00 32 03 d3 01 00 01 fc 04 60 02 01
E: 1.343953 14 01 07 00 3b 03 cd 01 00 01 fc 04 60 02 01
E: 1.351954 14 01 07 00 44 03 c8 01 00 01 fc 04 60 02 01
E: 1.359950 14 01 07 00 4c 03 c3 01 00 01 fc 04 60 02 01
E: 1.367956 14 01 07 00 55 03 bf 01 00 01 fc 04 60 02 01
E: 1.375951 14 01 07 00 5d 03 ba 01 00 01 fc 04 60 02 01
E: 1.383954 14 01 07 00 66 03 b4 01 00 01 fc 04 60 02 01
E: 1.391952 14 01 07 00 70 03 ae 01 00 01 fc 04 60 02 01
E: 1.399953 14 01 07 00 7c 03 a8 01 00 01 fc 04 60 02 01
E: 1.407952 14 01 07 00 87 03 a2 01 00 01 fc 04 60 02 01
E: 1.415954 14 01 07 00 92 03 9c 01 00 01 fc 04 60 02 01
E: 1.423951 14 01 07 00 9d 03 95 01 00 01 fc 04 60 02 01
E: 1.431954 14 01 07 00 a8 03 8f 01 00 01 fc 04 60 02 01
E: 1.439952 14 01 07 00 b3 03 88 01 00 01 fc 04 60 02 01
E: 1.447954 14 01 07 00 bf 03 81 01 00 01 fc 04 60 02 01
E: 1.455950 14 01 07 00 cb 03 79 01 00 01 fc 04 60 02 01
E: 1.463951 14 01 07 00 d7 03 73 01 00 01 fc 04 60 02 01
E: 1.471951 14 01 07 00 e3 03 6c 01 00 01 fc 04 60 02 01
E: 1.479953 14 01 07 00 ef 03 65 01 00 01 fc 04 60 02 01
E: 1.487949 14 01 07 00 fb 03 5e 01 00 01 fc 04 60 02 01
E: 1.495952 14 01 07 00 08 04 57 01 00 01 fc 04 60 02 01
E: 1.503950 14 01 07 00 16 04 50 01 00 01 fc 04 60 02 01
E: 1.519953 14 01 07 00 23 04 49 01 00 01 fc 04 60 02 01
E: 1.527827 14 01 07 00 30 04 42 01 00 01 fc 04 60 02 01
E: 1.543949 14 01 07 00 3d 04 3b 01 00 01 fc 04 60 02 01
E: 1.551952 14 01 07 00 4c 04 34 01 00 01 fc 04 60 02 01
E: 1.559946 14 01 07 00 5d 04 2d 01 00 01 fc 04 60 02 01
E: 1.567952 14 01 07 00 6d 04 26 01 00 01 fc 04 60 02 01
E: 1.575947 14 01 07 00 7e 04 1e 01 00 01 fc 04 60 02 01
E: 1.583951 14 01 07 00 8f 04 17 01 00 01 fc 04 60 02 01
E: 1.591949 14 01 07 00 a1 04 0f 01 00 01 fc 04 60 02 01
E: 1.599950 14 01 07 00 b3 04 07 01 00 01 fc 04 60 02 01
E: 1.607948 14 01 07 00 c7 04 ff 00 00 01 fc 04 60 02 01
E: 1.615951 14 01 07 00 dc 04 f8 00 00 01 fc 04 60 02 01
E: 1.623947 14 01 07 00 f0 04 f1 00 00 01 fc 04 60 02 01
E: 1.631950 14 01 07 00 03 05 eb 00 00 01 fc 04 60 02 01
E: 1.639948 14 01 07 00 16 05 e6 00 00 01 fc 04 60 02 01
E: 1.647950 14 01 07 00 29 05 e2 00 00 01 fc 04 60 02 01
E: 1.655949 14 01 07 00 3b 05 df 00 00 01 fc 04 60 02 01
E: 1.663950 14 01 07 00 4d 05 dc 00 00 01 fc 04 60 02 01
E: 1.671947 14 01 07 00 5e 05 d9 00 00 01 fc 04 60 02 01
E: 1.679951 14 01 07 00 6e 05 d7 00 00 01 fc 04 60 02 01
E: 1.687945 14 01 07 00 7f 05 d6 00 00 01 fc 04 60 02 01
E: 1.695949 14 01 07 00 8f 05 d5 00 00 01 fc 04 60 02 01
E: 1.703946 14 01 07 00 9e 05 d5 00 00 01 fc 04 60 02 01
E: 1.711947 14 01 07 00 ad 05 d5 00 00 01 fc 04 60 02 01
E: 1.719946 14 01 07 00 bc 05 d5 00 00 01 fc 04 60 02 01
E: 1.727950 14 01 07 00 cb 05 d6 00 00 01 fc 04 60 02 01
E: 1.735940 14 01 07 00 cb 05 d6 00 00 01 fc 04 60 02 01
E: 1.743949 14 01 07 00 da 05 d8 00 00 01 fc 04 60 02 01
E: 1.751946 14 01 07 00 e8 05 da 00 00 01 fc 04 60 02 01
E: 1.759946 14 01 07 00 f6 05 dc 00 00 01 fc 04 60 02 01
E: 1.767945 14 01 07 00 03 06 df 00 00 01 fc 04 60 02 01
E: 1.775948 14 01 07 00 0f 06 e3 00 00 01 fc 04 60 02 01
E: 1.783945 14 01 07 00 1a 06 e7 00 00 01 fc 04 60 02 01
E: 1.791948 14 01 07 00 24 06 ec 00 00 01 fc 04 60 02 01
E: 1.799946 14 01 07 00 2d 06 f1 00 00 01 fc 04 60 02 01
E: 1.807947 14 01 07 00 35 06 f6 00 00 01 fc 04 60 02 01
E: 1.815945 14 01 07 00 3c 06 fc 00 00 01 fc 04 60 02 01
E: 1.823947 14 01 07 00 43 06 02 01 00 01 fc 04 60 02 01
E: 1.831944 14 01 07 00 4a 06 08 01 00 01 fc 04 60 02 01
E: 1.847949 14 01 07 00 50 06 0e 01 00 01 fc 04 60 02 01
E: 1.855947 14 01 07 00 55 06 15 01 00 01 fc 04 60 02 01
E: 1.863943 14 01 07 00 59 06 1d 01 00 01 fc 04 60 02 01
E: 1.871946 14 01 07 00 5e 06 25 01 00 01 fc 04 60 02 01
E: 1.879944 14 01 07 00 63 06 2e 01 00 01 fc 04 60 02 01
E: 1.887944 14 01 07 00 67 06 37 01 00 01 fc 04 60 02 01
E: 1.895945 14 01 07 00 6a 06 3e 01 00 01 fc 04 60 02 01
E: 1.903946 14 01 07 00 6a 06 42 01 00 01 fc 04 60 02 01
E: 1.911942 14 01 07 00 6a 06 44 01 00 01 fc 04 60 02 01
E: 1.919945 14 01 07 00 6a 06 47 01 00 01 fc 04 60 02 01
E: 1.927943 14 01 07 00 6b 06 4c 01 00 01 fc 04 60 02 01
E: 1.943947 14 01 07 00 6a 06 52 01 00 01 fc 04 60 02 01
E: 1.951943 14 01 07 00 6a 06 56 01 00 01 fc 04 60 02 01
E: 1.959941 14 01 07 00 68 06 5a 01 00 01 fc 04 60 02 01
E: 1.967946 14 01 07 00 67 06 5e 01 00 01 fc 04 60 02 01
E: 1.975942 14 01 07 00 65 06 64 01 00 01 fc 04 60 02 01
E: 1.983944 14 01 07 00 61 06 6d 01 00 01 fc 04 60 02 01
E: 1.991943 14 01 07 00 5b 06 77 01 00 01 fc 04 60 02 01
E: 1.999943 14 01 07 00 56 06 80 01 00 01 fc 04 60 02 01
E: 2.007942 14 01 07 00 51 06 84 01 00 01 fc 04 60 02 01
E: 2.015944 14 01 07 00 4e 06 85 01 00 01 fc 04 60 02 01
E: 2.023942 14 01 07 00 4b 06 85 01 00 01 fc 04 60 02 01
E: 2.031942 14 01 07 00 45 06 87 01 00 01 fc 04 60 02 01
E: 2.039942 14 01 07 00 3a 06 8c 01 00 01 fc 04 60 02 01
E: 2.047944 14 01 07 00 2b 06 92 01 00 01 fc 04 60 02 01
E: 2.055941 14 01 07 00 1c 06 96 01 00 01 fc 04 60 02 01
E: 2.063942 14 01 07 00 0e 06 98 01 00 01 fc 04 60 02 01
E: 2.071941 14 01 07 00 00 06 9a 01 00 01 fc 04 60 02 01
E: 2.079944 14 01 07 00 f2 05 9c 01 00 01 fc 04 60 02 01
E: 2.087939 14 01 07 00 e4 05 9c 01 00 01 fc 04 60 02 01
E: 2.095942 14 01 07 00 d5 05 9d 01 00 01 fc 04 60 02 01
E: 2.103941 14 01 07 00 c6 05 9d 01 00 01 fc 04 60 02 01
E: 2.111942 14 01 07 00 b8 05 9d 01 00 01 fc 04 60 02 01
E: 2.119940 14 01 07 00 a9 05 9e 01 00 01 fc 04 60 02 01
E: 2.127943 14 01 07 00 9a 05 9e 01 00 01 fc 04 60 02 01
E: 2.135935 14 01 07 00 9a 05 9e 01 00 01 fc 04 60 02 01
E: 2.143931 14 01 07 00 8b 05 9d 01 00 01 fc 04 60 02 01
E: 2.151939 14 01 07 00 7b 05 9c 01 00 01 fc 04 60 02 01
E: 2.159929 14 01 07 00 6c 05 9c 01 00 01 fc 04 60 02 01
E: 2.167938 14 01 07 00 5d 05 9c 01 00 01 fc 04 60 02 01
E: 2.175928 14 01 07 00 4e 05 9c 01 00 01 fc 04 60 02 01
E: 2.191939 14 01 07 00 3f 05 9c 01 00 01 fc 04 60 02 01
E: 2.199928 14 01 07 00 30 05 9c 01 00 01 fc 04 60 02 01
E: 2.207938 14 01 07 00 21 05 9b 01 00 01 fc 04 60 02 01
E: 2.215928 14 01 07 00 12 05 9b 01 00 01 fc 04 60 02 01
E: 2.223936 14 01 07 00 04 05 9c 01 00 01 fc 04 60 02 01
E: 2.231940 14 01 07 00 f7 04 9c 01 00 01 fc 04 60 02 01
E: 2.239938 14 01 07 00 ea 04 9d 01 00 01 fc 04 60 02 01
E: 2.247940 14 01 07 00 dc 04 9d 01 00 01 fc 04 60 02 01
E: 2.255939 14 01 07 00 d0 04 9d 01 00 01 fc 04 60 02 01
E: 2.263938 14 01 07 00 c6 04 9d 01 00 01 fc 04 60 02 01
E: 2.271938 14 01 07 00 c0 04 9d 01 00 01 fc 04 60 02 01
E: 2.279939 14 01 07 00 bd 04 9d 01 00 01 fc 04 60 02 01
E: 2.287936 14 01 07 00 b9 04 9d 01 00 01 fc 04 60 02 01
E: 2.295939 14 01 07 00 b0 04 9e 01 00 01 fc 04 60 02 01
E: 2.303938 14 01 07 00 a3 04 9f 01 00 01 fc 04 60 02 01
E: 2.311938 14 01 07 00 97 04 a0 01 00 01 fc 04 60 02 01
E: 2.319936 14 01 07 00 91 04 a0 01 00 01 fc 04 60 02 01
E: 2.327939 14 01 07 00 90 04 a0 01 00 01 fc 04 60 02 01
E: 2.335934 14 01 07 00 8f 04 a0 01 00 01 fc 04 60 02 01
E: 2.343933 14 01 07 00 8f 04 a0 01 00 01 fc 04 60 02 01
E: 2.351937 14 01 07 00 8a 04 a1 01 00 01 fc 04 60 02 01
E: 2.359936 14 01 07 00 85 04 a0 01 00 01 fc 04 60 02 01
E: 2.367936 14 01 07 00 7e 04 9f 01 00 01 fc 04 60 02 01
E: 2.375938 14 01 07 00 72 04 9c 01 00 01 fc 04 60 02 01
E: 2.383936 14 01 07 00 63 04 96 01 00 01 fc 04 60 02 01
E: 2.423936 14 01 04 00 63 04 96 01 00 01 fc 04 60 02 01
