R: 396 05 01 09 02 a1 01 85 0d 09 01 a1 00 05 09 19 01 29 02 15 00 25 01 95 02 75 01 81 02 95 01 75 06 81 03 05 01 55 0e 65 11 75 10 95 01 35 00 46 98 12 26 7f 07 09 30 81 22 46 78 0a 26 37 04 09 31 81 22 c0 c0 05 0d 09 04 a1 01 85 01 09 22 a1 02 09 42 15 00 25 01 75 01 95 01 81 02 09 32 81 02 09 47 81 02 95 05 81 03 75 08 09 51 95 01 81 02 05 01 75 10 55 0e 65 11 09 30 35 00 46 98 12 26 7f 07 81 02 09 31 46 78 0a 26 37 04 81 02 c0 a1 02 05 0d 09 42 15 00 25 01 75 01 95 01 81 02 09 32 81 02 09 47 81 02 95 05 81 03 75 08 09 51 95 01 81 02 05 01 75 10 55 0e 65 11 09 30 35 00 46 98 12 26 7f 07 81 02 46 78 0a 26 37 04 09 31 81 02 c0 05 0d 09 54 15 00 26 ff 00 95 01 75 08 81 02 09 55 25 02 95 01 85 02 b1 02 c0 05 0d 09 0e a1 01 06 00 ff 09 01 26 ff 00 75 08 95 47 85 03 b1 02 09 01 96 ff 03 85 04 b1 02 09 01 95 0b 85 05 b1 02 09 01 96 ff 03 85 06 b1 02 09 01 95 0f 85 07 b1 02 09 01 96 ff 03 85 08 b1 02 09 01 96 ff 03 85 09 b1 02 09 01 95 3f 85 0a b1 02 09 01 96 ff 03 85 0b b1 02 09 01 96 c3 03 85 0e b1 02 09 01 96 ff 03 85 0f b1 02 09 01 96 83 03 85 10 b1 02 09 01 96 93 00 85 11 b1 02 09 01 96 ff 03 85 12 b1 02 05 0d 09 23 a1 02 09 52 09 53 15 00 25 0a 75 08 95 02 85 0c b1 02 c0 c0
N: Quanta OpticalTouchScreen
I: 3 0408 3008
# 1. Drag _one_ finger on the screen from one corner to the opposite, and release it.
E: 0.000000 14 01 07 00 1c 00 1f 00 00 01 00 00 00 00 01
E: 0.007928 14 01 07 00 1c 00 1f 00 00 01 00 00 00 00 01
E: 0.015983 14 01 07 00 1c 00 1f 00 00 01 00 00 00 00 01
E: 0.023977 14 01 07 00 1c 00 1f 00 00 01 00 00 00 00 01
E: 0.031977 14 01 07 00 1c 00 1f 00 00 01 00 00 00 00 01
E: 0.039979 14 01 07 00 1c 00 1f 00 00 01 00 00 00 00 01
E: 0.047977 14 01 07 00 1c 00 1f 00 00 01 00 00 00 00 01
E: 0.055977 14 01 07 00 1c 00 1f 00 00 01 00 00 00 00 01
E: 0.063977 14 01 07 00 1c 00 1f 00 00 01 00 00 00 00 01
E: 0.071975 14 01 07 00 1c 00 1f 00 00 01 00 00 00 00 01
E: 0.079975 14 01 07 00 1c 00 1f 00 00 01 00 00 00 00 01
E: 0.087977 14 01 07 00 1c 00 1f 00 00 01 00 00 00 00 01
E: 0.095975 14 01 07 00 1c 00 1f 00 00 01 00 00 00 00 01
E: 0.103975 14 01 07 00 1c 00 1f 00 00 01 00 00 00 00 01
E: 0.111978 14 01 07 00 1c 00 1f 00 00 01 00 00 00 00 01
E: 0.119979 14 01 07 00 1c 00 1f 00 00 01 00 00 00 00 01
E: 0.127977 14 01 07 00 1c 00 1f 00 00 01 00 00 00 00 01
E: 0.135978 14 01 07 00 1c 00 1f 00 00 01 00 00 00 00 01
E: 0.143984 14 01 07 00 1e 00 22 00 00 01 00 00 00 00 01
E: 0.151983 14 01 07 00 20 00 24 00 00 01 00 00 00 00 01
E: 0.159982 14 01 07 00 22 00 26 00 00 01 00 00 00 00 01
E: 0.167982 14 01 07 00 24 00 28 00 00 01 00 00 00 00 01
E: 0.175982 14 01 07 00 25 00 2a 00 00 01 00 00 00 00 01
E: 0.183981 14 01 07 00 27 00 2c 00 00 01 00 00 00 00 01
E: 0.191983 14 01 07 00 29 00 2e 00 00 01 00 00 00 00 01
E: 0.199948 14 01 07 00 2b 00 30 00 00 01 00 00 00 00 01
E: 0.207981 14 01 07 00 2d 00 32 00 00 01 00 00 00 00 01
E: 0.215984 14 01 07 00 2f 00 34 00 00 01 00 00 00 00 01
E: 0.223975 14 01 07 00 2f 00 34 00 00 01 00 00 00 00 01
E: 0.231982 14 01 07 00 31 00 36 00 00 01 00 00 00 00 01
E: 0.239941 14 01 07 00 33 00 38 00 00 01 00 00 00 00 01
E: 0.247982 14 01 07 00 35 00 39 00 00 01 00 00 00 00 01
E: 0.255982 14 01 07 00 37 00 3b 00 00 01 00 00 00 00 01
E: 0.263983 14 01 07 00 39 00 3d 00 00 01 00 00 00 00 01
E: 0.271981 14 01 07 00 3b 00 3f 00 00 01 00 00 00 00 01
E: 0.279983 14 01 07 00 3d 00 41 00 00 01 00 00 00 00 01
E: 0.287983 14 01 07 00 3f 00 43 00 00 01 00 00 00 00 01
E: 0.295982 14 01 07 00 41 00 44 00 00 01 00 00 00 00 01
E: 0.303940 14 01 07 00 43 00 46 00 00 01 00 00 00 00 01
E: 0.311982 14 01 07 00 45 00 48 00 00 01 00 00 00 00 01
E: 0.319982 14 01 07 00 47 00 4a 00 00 01 00 00 00 00 01
E: 0.327985 14 01 07 00 4a 00 4c 00 00 01 00 00 00 00 01
E: 0.335983 14 01 07 00 4c 00 4d 00 00 01 00 00 00 00 01
E: 0.343982 14 01 07 00 4e 00 4f 00 00 01 00 00 00 00 01
E: 0.351981 14 01 07 00 50 00 51 00 00 01 00 00 00 00 01
E: 0.359982 14 01 07 00 52 00 52 00 00 01 00 00 00 00 01
E: 0.367979 14 01 07 00 54 00 54 00 00 01 00 00 00 00 01
E: 0.375982 14 01 07 00 56 00 56 00 00 01 00 00 00 00 01
E: 0.383980 14 01 07 00 59 00 58 00 00 01 00 00 00 00 01
E: 0.391975 14 01 07 00 59 00 58 00 00 01 00 00 00 00 01
E: 0.399938 14 01 07 00 5b 00 59 00 00 01 00 00 00 00 01
E: 0.407983 14 01 07 00 5e 00 5c 00 00 01 00 00 00 00 01
E: 0.415979 14 01 07 00 60 00 5e 00 00 01 00 00 00 00 01
E: 0.423980 14 01 07 00 63 00 60 00 00 01 00 00 00 00 01
E: 0.431984 14 01 07 00 65 00 63 00 00 01 00 00 00 00 01
E: 0.439982 14 01 07 00 68 00 65 00 00 01 00 00 00 00 01
E: 0.447981 14 01 07 00 6a 00 67 00 00 01 00 00 00 00 01
E: 0.455981 14 01 07 00 6d 00 69 00 00 01 00 00 00 00 01
E: 0.463982 14 01 07 00 6f 00 6b 00 00 01 00 00 00 00 01
E: 0.471975 14 01 07 00 6f 00 6b 00 00 01 00 00 00 00 01
E: 0.479982 14 01 07 00 72 00 6e 00 00 01 00 00 00 00 01
E: 0.487982 14 01 07 00 74 00 70 00 00 01 00 00 00 00 01
E: 0.495981 14 01 07 00 77 00 72 00 00 01 00 00 00 00 01
E: 0.503979 14 01 07 00 7a 00 75 00 00 01 00 00 00 00 01
E: 0.511980 14 01 07 00 7c 00 77 00 00 01 00 00 00 00 01
E: 0.519981 14 01 07 00 7f 00 79 00 00 01 00 00 00 00 01
E: 0.527978 14 01 07 00 82 00 7c 00 00 01 00 00 00 00 01
E: 0.535979 14 01 07 00 84 00 7e 00 00 01 00 00 00 00 01
E: 0.543980 14 01 07 00 87 00 80 00 00 01 00 00 00 00 01
E: 0.551979 14 01 07 00 8a 00 83 00 00 01 00 00 00 00 01
E: 0.559973 14 01 07 00 8a 00 83 00 00 01 00 00 00 00 01
E: 0.567956 14 01 07 00 8d 00 85 00 00 01 00 00 00 00 01
E: 0.575983 14 01 07 00 90 00 87 00 00 01 00 00 00 00 01
E: 0.583980 14 01 07 00 93 00 8a 00 00 01 00 00 00 00 01
E: 0.591981 14 01 07 00 96 00 8c 00 00 01 00 00 00 00 01
E: 0.599979 14 01 07 00 99 00 8f 00 00 01 00 00 00 00 01
E: 0.607978 14 01 07 00 9c 00 91 00 00 01 00 00 00 00 01
E: 0.615980 14 01 07 00 9f 00 94 00 00 01 00 00 00 00 01
E: 0.623980 14 01 07 00 a2 00 96 00 00 01 00 00 00 00 01
E: 0.631977 14 01 07 00 a5 00 98 00 00 01 00 00 00 00 01
E: 0.639981 14 01 07 00 a8 00 9b 00 00 01 00 00 00 00 01
E: 0.647980 14 01 07 00 ab 00 9d 00 00 01 00 00 00 00 01
E: 0.655981 14 01 07 00 ae 00 a0 00 00 01 00 00 00 00 01
E: 0.663979 14 01 07 00 b1 00 a3 00 00 01 00 00 00 00 01
E: 0.671979 14 01 07 00 b4 00 a5 00 00 01 00 00 00 00 01
E: 0.679979 14 01 07 00 b7 00 a8 00 00 01 00 00 00 00 01
E: 0.687976 14 01 07 00 ba 00 ab 00 00 01 00 00 00 00 01
E: 0.695981 14 01 07 00 bd 00 ad 00 00 01 00 00 00 00 01
E: 0.703978 14 01 07 00 c0 00 b0 00 00 01 00 00 00 00 01
E: 0.711979 14 01 07 00 c4 00 b3 00 00 01 00 00 00 00 01
E: 0.719982 14 01 07 00 c7 00 b5 00 00 01 00 00 00 00 01
E: 0.727974 14 01 07 00 c7 00 b5 00 00 01 00 00 00 00 01
E: 0.735980 14 01 07 00 ca 00 b8 00 00 01 00 00 00 00 01
E: 0.743979 14 01 07 00 cd 00 ba 00 00 01 00 00 00 00 01
E: 0.751978 14 01 07 00 d0 00 bc 00 00 01 00 00 00 00 01
E: 0.759932 14 01 07 00 d4 00 bf 00 00 01 00 00 00 00 01
E: 0.767979 14 01 07 00 d7 00 c1 00 00 01 00 00 00 00 01
E: 0.775977 14 01 07 00 da 00 c4 00 00 01 00 00 00 00 01
E: 0.783981 14 01 07 00 de 00 c6 00 00 01 00 00 00 00 01
E: 0.791979 14 01 07 00 e1 00 c8 00 00 01 00 00 00 00 01
E: 0.799979 14 01 07 00 e4 00 cb 00 00 01 00 00 00 00 01
E: 0.807978 14 01 07 00 e7 00 cd 00 00 01 00 00 00 00 01
E: 0.815979 14 01 07 00 ea 00 cf 00 00 01 00 00 00 00 01
E: 0.823978 14 01 07 00 ed 00 d1 00 00 01 00 00 00 00 01
E: 0.831979 14 01 07 00 f0 00 d3 00 00 01 00 00 00 00 01
E: 0.839978 14 01 07 00 f3 00 d6 00 00 01 00 00 00 00 01
E: 0.847979 14 01 07 00 f6 00 d8 00 00 01 00 00 00 00 01
E: 0.855978 14 01 07 00 f9 00 da 00 00 01 00 00 00 00 01
E: 0.863976 14 01 07 00 fc 00 dd 00 00 01 00 00 00 00 01
E: 0.871978 14 01 07 00 00 01 df 00 00 01 00 00 00 00 01
E: 0.879979 14 01 07 00 03 01 e1 00 00 01 00 00 00 00 01
E: 0.887978 14 01 07 00 06 01 e3 00 00 01 00 00 00 00 01
E: 0.895973 14 01 07 00 06 01 e3 00 00 01 00 00 00 00 01
E: 0.903979 14 01 07 00 09 01 e6 00 00 01 00 00 00 00 01
E: 0.911978 14 01 07 00 0d 01 e8 00 00 01 00 00 00 00 01
E: 0.919979 14 01 07 00 10 01 eb 00 00 01 00 00 00 00 01
E: 0.927978 14 01 07 00 13 01 ed 00 00 01 00 00 00 00 01
E: 0.935976 14 01 07 00 16 01 ef 00 00 01 00 00 00 00 01
E: 0.943978 14 01 07 00 1a 01 f2 00 00 01 00 00 00 00 01
E: 0.951978 14 01 07 00 1d 01 f4 00 00 01 00 00 00 00 01
E: 0.959978 14 01 07 00 20 01 f6 00 00 01 00 00 00 00 01
E: 0.967979 14 01 07 00 24 01 f9 00 00 01 00 00 00 00 01
E: 0.975981 14 01 07 00 27 01 fb 00 00 01 00 00 00 00 01
E: 0.983971 14 01 07 00 27 01 fb 00 00 01 00 00 00 00 01
E: 0.991978 14 01 07 00 2a 01 fd 00 00 01 00 00 00 00 01
E: 0.999979 14 01 07 00 2e 01 ff 00 00 01 00 00 00 00 01
E: 1.007978 14 01 07 00 31 01 02 01 00 01 00 00 00 00 01
E: 1.015978 14 01 07 00 35 01 04 01 00 01 00 00 00 00 01
E: 1.023980 14 01 07 00 38 01 06 01 00 01 00 00 00 00 01
E: 1.031979 14 01 07 00 3c 01 09 01 00 01 00 00 00 00 01
E: 1.039979 14 01 07 00 3f 01 0b 01 00 01 00 00 00 00 01
E: 1.047978 14 01 07 00 43 01 0e 01 00 01 00 00 00 00 01
E: 1.055969 14 01 07 00 43 01 0e 01 00 01 00 00 00 00 01
E: 1.063979 14 01 07 00 46 01 10 01 00 01 00 00 00 00 01
E: 1.071930 14 01 07 00 4a 01 13 01 00 01 00 00 00 00 01
E: 1.079977 14 01 07 00 4e 01 15 01 00 01 00 00 00 00 01
E: 1.087977 14 01 07 00 51 01 18 01 00 01 00 00 00 00 01
E: 1.095977 14 01 07 00 55 01 1a 01 00 01 00 00 00 00 01
E: 1.103978 14 01 07 00 59 01 1c 01 00 01 00 00 00 00 01
E: 1.111977 14 01 07 00 5c 01 1f 01 00 01 00 00 00 00 01
E: 1.119976 14 01 07 00 60 01 22 01 00 01 00 00 00 00 01
E: 1.127977 14 01 07 00 64 01 24 01 00 01 00 00 00 00 01
E: 1.135976 14 01 07 00 67 01 27 01 00 01 00 00 00 00 01
E: 1.143978 14 01 07 00 6b 01 2a 01 00 01 00 00 00 00 01
E: 1.151976 14 01 07 00 6f 01 2d 01 00 01 00 00 00 00 01
E: 1.159976 14 01 07 00 73 01 2f 01 00 01 00 00 00 00 01
E: 1.167978 14 01 07 00 77 01 32 01 00 01 00 00 00 00 01
E: 1.175977 14 01 07 00 7b 01 35 01 00 01 00 00 00 00 01
E: 1.183976 14 01 07 00 7f 01 38 01 00 01 00 00 00 00 01
E: 1.191978 14 01 07 00 83 01 3b 01 00 01 00 00 00 00 01
E: 1.199975 14 01 07 00 87 01 3e 01 00 01 00 00 00 00 01
E: 1.207978 14 01 07 00 8b 01 41 01 00 01 00 00 00 00 01
E: 1.215977 14 01 07 00 8f 01 44 01 00 01 00 00 00 00 01
E: 1.223969 14 01 07 00 8f 01 44 01 00 01 00 00 00 00 01
E: 1.231977 14 01 07 00 94 01 46 01 00 01 00 00 00 00 01
E: 1.239956 14 01 07 00 98 01 49 01 00 01 00 00 00 00 01
E: 1.247976 14 01 07 00 9c 01 4c 01 00 01 00 00 00 00 01
E: 1.255978 14 01 07 00 a0 01 4f 01 00 01 00 00 00 00 01
E: 1.263978 14 01 07 00 a4 01 52 01 00 01 00 00 00 00 01
E: 1.271975 14 01 07 00 a8 01 55 01 00 01 00 00 00 00 01
E: 1.279973 14 01 07 00 ac 01 58 01 00 01 00 00 00 00 01
E: 1.287975 14 01 07 00 b1 01 5b 01 00 01 00 00 00 00 01
E: 1.295977 14 01 07 00 b5 01 5e 01 00 01 00 00 00 00 01
E: 1.303976 14 01 07 00 b9 01 61 01 00 01 00 00 00 00 01
E: 1.311976 14 01 07 00 bd 01 64 01 00 01 00 00 00 00 01
E: 1.319976 14 01 07 00 c1 01 67 01 00 01 00 00 00 00 01
E: 1.327976 14 01 07 00 c5 01 6a 01 00 01 00 00 00 00 01
E: 1.335976 14 01 07 00 ca 01 6d 01 00 01 00 00 00 00 01
E: 1.343976 14 01 07 00 ce 01 6f 01 00 01 00 00 00 00 01
E: 1.351976 14 01 07 00 d2 01 72 01 00 01 00 00 00 00 01
E: 1.359976 14 01 07 00 d6 01 75 01 00 01 00 00 00 00 01
E: 1.367975 14 01 07 00 da 01 78 01 00 01 00 00 00 00 01
E: 1.375974 14 01 07 00 de 01 7b 01 00 01 00 00 00 00 01
E: 1.383977 14 01 07 00 e2 01 7e 01 00 01 00 00 00 00 01
E: 1.391969 14 01 07 00 e2 01 7e 01 00 01 00 00 00 00 01
E: 1.399977 14 01 07 00 e6 01 81 01 00 01 00 00 00 00 01
E: 1.407976 14 01 07 00 ea 01 84 01 00 01 00 00 00 00 01
E: 1.415975 14 01 07 00 ee 01 86 01 00 01 00 00 00 00 01
E: 1.423976 14 01 07 00 f2 01 89 01 00 01 00 00 00 00 01
E: 1.431976 14 01 07 00 f6 01 8c 01 00 01 00 00 00 00 01
E: 1.439977 14 01 07 00 fa 01 8f 01 00 01 00 00 00 00 01
E: 1.447976 14 01 07 00 fe 01 92 01 00 01 00 00 00 00 01
E: 1.455976 14 01 07 00 02 02 94 01 00 01 00 00 00 00 01
E: 1.463976 14 01 07 00 06 02 97 01 00 01 00 00 00 00 01
E: 1.471975 14 01 07 00 0a 02 9a 01 00 01 00 00 00 00 01
E: 1.479975 14 01 07 00 0f 02 9d 01 00 01 00 00 00 00 01
E: 1.487969 14 01 07 00 0f 02 9d 01 00 01 00 00 00 00 01
E: 1.495975 14 01 07 00 12 02 a0 01 00 01 00 00 00 00 01
E: 1.503975 14 01 07 00 17 02 a3 01 00 01 00 00 00 00 01
E: 1.511944 14 01 07 00 1b 02 a5 01 00 01 00 00 00 00 01
E: 1.519975 14 01 07 00 1f 02 a8 01 00 01 00 00 00 00 01
E: 1.527949 14 01 07 00 24 02 ab 01 00 01 00 00 00 00 01
E: 1.535972 14 01 07 00 28 02 ae 01 00 01 00 00 00 00 01
E: 1.543974 14 01 07 00 2d 02 b1 01 00 01 00 00 00 00 01
E: 1.551973 14 01 07 00 31 02 b4 01 00 01 00 00 00 00 01
E: 1.559969 14 01 07 00 31 02 b4 01 00 01 00 00 00 00 01
E: 1.567975 14 01 07 00 36 02 b7 01 00 01 00 00 00 00 01
E: 1.575974 14 01 07 00 3b 02 ba 01 00 01 00 00 00 00 01
E: 1.583973 14 01 07 00 40 02 bd 01 00 01 00 00 00 00 01
E: 1.591976 14 01 07 00 45 02 c0 01 00 01 00 00 00 00 01
E: 1.599974 14 01 07 00 49 02 c4 01 00 01 00 00 00 00 01
E: 1.607973 14 01 07 00 4e 02 c7 01 00 01 00 00 00 00 01
E: 1.615974 14 01 07 00 53 02 ca 01 00 01 00 00 00 00 01
E: 1.623974 14 01 07 00 58 02 cd 01 00 01 00 00 00 00 01
E: 1.631975 14 01 07 00 5d 02 d0 01 00 01 00 00 00 00 01
E: 1.639973 14 01 07 00 62 02 d3 01 00 01 00 00 00 00 01
E: 1.647976 14 01 07 00 68 02 d6 01 00 01 00 00 00 00 01
E: 1.655972 14 01 07 00 6d 02 d9 01 00 01 00 00 00 00 01
E: 1.663973 14 01 07 00 72 02 dd 01 00 01 00 00 00 00 01
E: 1.671975 14 01 07 00 77 02 e0 01 00 01 00 00 00 00 01
E: 1.679974 14 01 07 00 7d 02 e3 01 00 01 00 00 00 00 01
E: 1.687972 14 01 07 00 82 02 e6 01 00 01 00 00 00 00 01
E: 1.695976 14 01 07 00 88 02 e9 01 00 01 00 00 00 00 01
E: 1.703973 14 01 07 00 8e 02 ec 01 00 01 00 00 00 00 01
E: 1.711974 14 01 07 00 93 02 f0 01 00 01 00 00 00 00 01
E: 1.719973 14 01 07 00 99 02 f3 01 00 01 00 00 00 00 01
E: 1.727967 14 01 07 00 99 02 f3 01 00 01 00 00 00 00 01
E: 1.735973 14 01 07 00 9f 02 f6 01 00 01 00 00 00 00 01
E: 1.743972 14 01 07 00 a4 02 f9 01 00 01 00 00 00 00 01
E: 1.751973 14 01 07 00 aa 02 fc 01 00 01 00 00 00 00 01
E: 1.759973 14 01 07 00 b0 02 ff 01 00 01 00 00 00 00 01
E: 1.767972 14 01 07 00 b5 02 02 02 00 01 00 00 00 00 01
E: 1.775973 14 01 07 00 ba 02 05 02 00 01 00 00 00 00 01
E: 1.783971 14 01 07 00 c0 02 08 02 00 01 00 00 00 00 01
E: 1.791973 14 01 07 00 c6 02 0b 02 00 01 00 00 00 00 01
E: 1.799972 14 01 07 00 cc 02 0e 02 00 01 00 00 00 00 01
E: 1.807973 14 01 07 00 d1 02 11 02 00 01 00 00 00 00 01
E: 1.815973 14 01 07 00 d7 02 14 02 00 01 00 00 00 00 01
E: 1.823972 14 01 07 00 dd 02 17 02 00 01 00 00 00 00 01
E: 1.831973 14 01 07 00 e2 02 1a 02 00 01 00 00 00 00 01
E: 1.839972 14 01 07 00 e7 02 1d 02 00 01 00 00 00 00 01
E: 1.847972 14 01 07 00 ed 02 20 02 00 01 00 00 00 00 01
E: 1.855972 14 01 07 00 f3 02 23 02 00 01 00 00 00 00 01
E: 1.863971 14 01 07 00 f8 02 26 02 00 01 00 00 00 00 01
E: 1.871974 14 01 07 00 fe 02 29 02 00 01 00 00 00 00 01
E: 1.879973 14 01 07 00 04 03 2c 02 00 01 00 00 00 00 01
E: 1.887974 14 01 07 00 0a 03 2f 02 00 01 00 00 00 00 01
E: 1.895965 14 01 07 00 0a 03 2f 02 00 01 00 00 00 00 01
E: 1.903971 14 01 07 00 10 03 32 02 00 01 00 00 00 00 01
E: 1.911973 14 01 07 00 15 03 36 02 00 01 00 00 00 00 01
E: 1.919974 14 01 07 00 1b 03 39 02 00 01 00 00 00 00 01
E: 1.927972 14 01 07 00 21 03 3c 02 00 01 00 00 00 00 01
E: 1.935971 14 01 07 00 26 03 3f 02 00 01 00 00 00 00 01
E: 1.943969 14 01 07 00 2c 03 42 02 00 01 00 00 00 00 01
E: 1.951973 14 01 07 00 31 03 45 02 00 01 00 00 00 00 01
E: 1.959973 14 01 07 00 37 03 48 02 00 01 00 00 00 00 01
E: 1.967970 14 01 07 00 3d 03 4b 02 00 01 00 00 00 00 01
E: 1.975972 14 01 07 00 43 03 4f 02 00 01 00 00 00 00 01
E: 1.983971 14 01 07 00 48 03 52 02 00 01 00 00 00 00 01
E: 1.991965 14 01 07 00 48 03 52 02 00 01 00 00 00 00 01
E: 1.999972 14 01 07 00 4e 03 55 02 00 01 00 00 00 00 01
E: 2.007973 14 01 07 00 54 03 59 02 00 01 00 00 00 00 01
E: 2.015969 14 01 07 00 5a 03 5c 02 00 01 00 00 00 00 01
E: 2.023971 14 01 07 00 5f 03 5f 02 00 01 00 00 00 00 01
E: 2.031971 14 01 07 00 65 03 62 02 00 01 00 00 00 00 01
E: 2.039970 14 01 07 00 6b 03 65 02 00 01 00 00 00 00 01
E: 2.047972 14 01 07 00 70 03 68 02 00 01 00 00 00 00 01
E: 2.055966 14 01 07 00 70 03 68 02 00 01 00 00 00 00 01
E: 2.063971 14 01 07 00 76 03 6b 02 00 01 00 00 00 00 01
E: 2.071972 14 01 07 00 7c 03 6e 02 00 01 00 00 00 00 01
E: 2.079970 14 01 07 00 82 03 71 02 00 01 00 00 00 00 01
E: 2.087969 14 01 07 00 88 03 74 02 00 01 00 00 00 00 01
E: 2.095972 14 01 07 00 8e 03 77 02 00 01 00 00 00 00 01
E: 2.103972 14 01 07 00 94 03 7a 02 00 01 00 00 00 00 01
E: 2.111971 14 01 07 00 9a 03 7d 02 00 01 00 00 00 00 01
E: 2.119975 14 01 07 00 a0 03 80 02 00 01 00 00 00 00 01
E: 2.127970 14 01 07 00 a6 03 83 02 00 01 00 00 00 00 01
E: 2.135971 14 01 07 00 ac 03 86 02 00 01 00 00 00 00 01
E: 2.143969 14 01 07 00 b2 03 88 02 00 01 00 00 00 00 01
E: 2.151970 14 01 07 00 b8 03 8b 02 00 01 00 00 00 00 01
E: 2.159970 14 01 07 00 be 03 8e 02 00 01 00 00 00 00 01
E: 2.167969 14 01 07 00 c4 03 91 02 00 01 00 00 00 00 01
E: 2.175970 14 01 07 00 ca 03 94 02 00 01 00 00 00 00 01
E: 2.183970 14 01 07 00 d0 03 97 02 00 01 00 00 00 00 01
E: 2.191970 14 01 07 00 d6 03 9a 02 00 01 00 00 00 00 01
E: 2.199968 14 01 07 00 dc 03 9d 02 00 01 00 00 00 00 01
E: 2.207970 14 01 07 00 e2 03 a0 02 00 01 00 00 00 00 01
E: 2.215970 14 01 07 00 e8 03 a3 02 00 01 00 00 00 00 01
E: 2.223962 14 01 07 00 e8 03 a3 02 00 01 00 00 00 00 01
E: 2.231969 14 01 07 00 ee 03 a6 02 00 01 00 00 00 00 01
E: 2.239966 14 01 07 00 f4 03 a8 02 00 01 00 00 00 00 01
E: 2.247968 14 01 07 00 fa 03 ab 02 00 01 00 00 00 00 01
E: 2.255970 14 01 07 00 00 04 ae 02 00 01 00 00 00 00 01
E: 2.263969 14 01 07 00 06 04 b1 02 00 01 00 00 00 00 01
E: 2.271969 14 01 07 00 0c 04 b4 02 00 01 00 00 00 00 01
E: 2.279968 14 01 07 00 12 04 b7 02 00 01 00 00 00 00 01
E: 2.287969 14 01 07 00 18 04 b9 02 00 01 00 00 00 00 01
E: 2.295970 14 01 07 00 1d 04 bc 02 00 01 00 00 00 00 01
E: 2.303969 14 01 07 00 24 04 bf 02 00 01 00 00 00 00 01
E: 2.311971 14 01 07 00 2a 04 c2 02 00 01 00 00 00 00 01
E: 2.319970 14 01 07 00 30 04 c5 02 00 01 00 00 00 00 01
E: 2.327970 14 01 07 00 36 04 c8 02 00 01 00 00 00 00 01
E: 2.335969 14 01 07 00 3c 04 ca 02 00 01 00 00 00 00 01
E: 2.343969 14 01 07 00 42 04 cd 02 00 01 00 00 00 00 01
E: 2.351970 14 01 07 00 48 04 d0 02 00 01 00 00 00 00 01
E: 2.359969 14 01 07 00 4e 04 d3 02 00 01 00 00 00 00 01
E: 2.367969 14 01 07 00 53 04 d5 02 00 01 00 00 00 00 01
E: 2.375967 14 01 07 00 59 04 d8 02 00 01 00 00 00 00 01
E: 2.383968 14 01 07 00 5f 04 db 02 00 01 00 00 00 00 01
E: 2.391961 14 01 07 00 5f 04 db 02 00 01 00 00 00 00 01
E: 2.399967 14 01 07 00 65 04 de 02 00 01 00 00 00 00 01
E: 2.407967 14 01 07 00 6b 04 e1 02 00 01 00 00 00 00 01
E: 2.415967 14 01 07 00 71 04 e4 02 00 01 00 00 00 00 01
E: 2.423967 14 01 07 00 76 04 e7 02 00 01 00 00 00 00 01
E: 2.431969 14 01 07 00 7c 04 e9 02 00 01 00 00 00 00 01
E: 2.439968 14 01 07 00 82 04 ec 02 00 01 00 00 00 00 01
E: 2.447967 14 01 07 00 88 04 ef 02 00 01 00 00 00 00 01
E: 2.455970 14 01 07 00 8e 04 f2 02 00 01 00 00 00 00 01
E: 2.463968 14 01 07 00 95 04 f4 02 00 01 00 00 00 00 01
E: 2.471968 14 01 07 00 9b 04 f7 02 00 01 00 00 00 00 01
E: 2.479966 14 01 07 00 a1 04 fa 02 00 01 00 00 00 00 01
E: 2.487966 14 01 07 00 a7 04 fc 02 00 01 00 00 00 00 01
E: 2.495966 14 01 07 00 ad 04 ff 02 00 01 00 00 00 00 01
E: 2.503961 14 01 07 00 ad 04 ff 02 00 01 00 00 00 00 01
E: 2.511969 14 01 07 00 b3 04 01 03 00 01 00 00 00 00 01
E: 2.519969 14 01 07 00 ba 04 04 03 00 01 00 00 00 00 01
E: 2.527965 14 01 07 00 c0 04 07 03 00 01 00 00 00 00 01
E: 2.535964 14 01 07 00 c6 04 09 03 00 01 00 00 00 00 01
E: 2.543967 14 01 07 00 cd 04 0b 03 00 01 00 00 00 00 01
E: 2.551965 14 01 07 00 d3 04 0e 03 00 01 00 00 00 00 01
E: 2.559965 14 01 07 00 d3 04 0e 03 00 01 00 00 00 00 01
E: 2.567968 14 01 07 00 da 04 10 03 00 01 00 00 00 00 01
E: 2.575968 14 01 07 00 e0 04 13 03 00 01 00 00 00 00 01
E: 2.583965 14 01 07 00 e7 04 15 03 00 01 00 00 00 00 01
E: 2.591967 14 01 07 00 ee 04 18 03 00 01 00 00 00 00 01
E: 2.599969 14 01 07 00 f4 04 1b 03 00 01 00 00 00 00 01
E: 2.607965 14 01 07 00 fb 04 1d 03 00 01 00 00 00 00 01
E: 2.615967 14 01 07 00 01 05 1f 03 00 01 00 00 00 00 01
E: 2.623966 14 01 07 00 08 05 21 03 00 01 00 00 00 00 01
E: 2.631967 14 01 07 00 0f 05 24 03 00 01 00 00 00 00 01
E: 2.639966 14 01 07 00 16 05 25 03 00 01 00 00 00 00 01
E: 2.647965 14 01 07 00 1c 05 27 03 00 01 00 00 00 00 01
E: 2.655967 14 01 07 00 23 05 2a 03 00 01 00 00 00 00 01
E: 2.663967 14 01 07 00 2a 05 2c 03 00 01 00 00 00 00 01
E: 2.671967 14 01 07 00 30 05 2e 03 00 01 00 00 00 00 01
E: 2.679967 14 01 07 00 37 05 30 03 00 01 00 00 00 00 01
E: 2.687966 14 01 07 00 3d 05 33 03 00 01 00 00 00 00 01
E: 2.695966 14 01 07 00 44 05 34 03 00 01 00 00 00 00 01
E: 2.703966 14 01 07 00 4a 05 37 03 00 01 00 00 00 00 01
E: 2.711964 14 01 07 00 50 05 39 03 00 01 00 00 00 00 01
E: 2.719966 14 01 07 00 57 05 3b 03 00 01 00 00 00 00 01
E: 2.727958 14 01 07 00 57 05 3b 03 00 01 00 00 00 00 01
E: 2.735965 14 01 07 00 5d 05 3d 03 00 01 00 00 00 00 01
E: 2.743963 14 01 07 00 63 05 3f 03 00 01 00 00 00 00 01
E: 2.751966 14 01 07 00 69 05 42 03 00 01 00 00 00 00 01
E: 2.759967 14 01 07 00 6f 05 44 03 00 01 00 00 00 00 01
E: 2.767968 14 01 07 00 76 05 46 03 00 01 00 00 00 00 01
E: 2.775967 14 01 07 00 7c 05 48 03 00 01 00 00 00 00 01
E: 2.783964 14 01 07 00 82 05 4a 03 00 01 00 00 00 00 01
E: 2.791967 14 01 07 00 88 05 4c 03 00 01 00 00 00 00 01
E: 2.799966 14 01 07 00 8f 05 4e 03 00 01 00 00 00 00 01
E: 2.807966 14 01 07 00 95 05 51 03 00 01 00 00 00 00 01
E: 2.815966 14 01 07 00 9b 05 53 03 00 01 00 00 00 00 01
E: 2.823964 14 01 07 00 a2 05 56 03 00 01 00 00 00 00 01
E: 2.831965 14 01 07 00 a8 05 58 03 00 01 00 00 00 00 01
E: 2.839966 14 01 07 00 ae 05 5a 03 00 01 00 00 00 00 01
E: 2.847966 14 01 07 00 b5 05 5d 03 00 01 00 00 00 00 01
E: 2.855966 14 01 07 00 bb 05 5f 03 00 01 00 00 00 00 01
E: 2.863964 14 01 07 00 c1 05 62 03 00 01 00 00 00 00 01
E: 2.871965 14 01 07 00 c8 05 64 03 00 01 00 00 00 00 01
E: 2.879965 14 01 07 00 ce 05 67 03 00 01 00 00 00 00 01
E: 2.887965 14 01 07 00 d5 05 69 03 00 01 00 00 00 00 01
E: 2.895957 14 01 07 00 d5 05 69 03 00 01 00 00 00 00 01
E: 2.903953 14 01 07 00 db 05 6c 03 00 01 00 00 00 00 01
E: 2.911967 14 01 07 00 e1 05 6e 03 00 01 00 00 00 00 01
E: 2.919966 14 01 07 00 e7 05 70 03 00 01 00 00 00 00 01
E: 2.927965 14 01 07 00 ee 05 72 03 00 01 00 00 00 00 01
E: 2.935965 14 01 07 00 f4 05 74 03 00 01 00 00 00 00 01
E: 2.943965 14 01 07 00 fa 05 76 03 00 01 00 00 00 00 01
E: 2.951965 14 01 07 00 00 06 78 03 00 01 00 00 00 00 01
E: 2.959966 14 01 07 00 06 06 7a 03 00 01 00 00 00 00 01
E: 2.967967 14 01 07 00 0c 06 7c 03 00 01 00 00 00 00 01
E: 2.975966 14 01 07 00 13 06 7e 03 00 01 00 00 00 00 01
E: 2.983966 14 01 07 00 19 06 80 03 00 01 00 00 00 00 01
E: 2.991962 14 01 07 00 1e 06 82 03 00 01 00 00 00 00 01
E: 2.999964 14 01 07 00 24 06 84 03 00 01 00 00 00 00 01
E: 3.007956 14 01 07 00 24 06 84 03 00 01 00 00 00 00 01
E: 3.015964 14 01 07 00 2a 06 85 03 00 01 00 00 00 00 01
E: 3.023964 14 01 07 00 30 06 88 03 00 01 00 00 00 00 01
E: 3.031964 14 01 07 00 36 06 89 03 00 01 00 00 00 00 01
E: 3.039964 14 01 07 00 3c 06 8c 03 00 01 00 00 00 00 01
E: 3.047964 14 01 07 00 42 06 8e 03 00 01 00 00 00 00 01
E: 3.055958 14 01 07 00 42 06 8e 03 00 01 00 00 00 00 01
E: 3.063964 14 01 07 00 48 06 90 03 00 01 00 00 00 00 01
E: 3.071964 14 01 07 00 4e 06 92 03 00 01 00 00 00 00 01
E: 3.079964 14 01 07 00 53 06 94 03 00 01 00 00 00 00 01
E: 3.087964 14 01 07 00 59 06 96 03 00 01 00 00 00 00 01
E: 3.095964 14 01 07 00 5f 06 99 03 00 01 00 00 00 00 01
E: 3.103964 14 01 07 00 65 06 9b 03 00 01 00 00 00 00 01
E: 3.111965 14 01 07 00 6b 06 9e 03 00 01 00 00 00 00 01
E: 3.119964 14 01 07 00 71 06 a0 03 00 01 00 00 00 00 01
E: 3.127962 14 01 07 00 77 06 a2 03 00 01 00 00 00 00 01
E: 3.135964 14 01 07 00 7d 06 a4 03 00 01 00 00 00 00 01
E: 3.143962 14 01 07 00 84 06 a6 03 00 01 00 00 00 00 01
E: 3.151962 14 01 07 00 8a 06 a8 03 00 01 00 00 00 00 01
E: 3.159964 14 01 07 00 90 06 aa 03 00 01 00 00 00 00 01
E: 3.167964 14 01 07 00 97 06 ac 03 00 01 00 00 00 00 01
E: 3.175962 14 01 07 00 9d 06 ae 03 00 01 00 00 00 00 01
E: 3.183963 14 01 07 00 a4 06 b0 03 00 01 00 00 00 00 01
E: 3.191963 14 01 07 00 aa 06 b2 03 00 01 00 00 00 00 01
E: 3.199964 14 01 07 00 b0 06 b4 03 00 01 00 00 00 00 01
E: 3.207963 14 01 07 00 b7 06 b6 03 00 01 00 00 00 00 01
E: 3.215963 14 01 07 00 bd 06 b8 03 00 01 00 00 00 00 01
E: 3.223956 14 01 07 00 bd 06 b8 03 00 01 00 00 00 00 01
E: 3.231962 14 01 07 00 c3 06 ba 03 00 01 00 00 00 00 01
E: 3.239963 14 01 07 00 ca 06 bc 03 00 01 00 00 00 00 01
E: 3.247961 14 01 07 00 d0 06 bf 03 00 01 00 00 00 00 01
E: 3.255962 14 01 07 00 d6 06 c1 03 00 01 00 00 00 00 01
E: 3.263961 14 01 07 00 dc 06 c4 03 00 01 00 00 00 00 01
E: 3.271963 14 01 07 00 e2 06 c6 03 00 01 00 00 00 00 01
E: 3.279961 14 01 07 00 e7 06 c8 03 00 01 00 00 00 00 01
E: 3.287963 14 01 07 00 ed 06 ca 03 00 01 00 00 00 00 01
E: 3.295962 14 01 07 00 f3 06 cd 03 00 01 00 00 00 00 01
E: 3.303962 14 01 07 00 f8 06 cf 03 00 01 00 00 00 00 01
E: 3.311962 14 01 07 00 fd 06 d2 03 00 01 00 00 00 00 01
E: 3.319963 14 01 07 00 02 07 d5 03 00 01 00 00 00 00 01
E: 3.327963 14 01 07 00 07 07 d7 03 00 01 00 00 00 00 01
E: 3.335962 14 01 07 00 0c 07 da 03 00 01 00 00 00 00 01
E: 3.343962 14 01 07 00 11 07 dc 03 00 01 00 00 00 00 01
E: 3.351961 14 01 07 00 15 07 de 03 00 01 00 00 00 00 01
E: 3.359964 14 01 07 00 19 07 e0 03 00 01 00 00 00 00 01
E: 3.367963 14 01 07 00 1e 07 e1 03 00 01 00 00 00 00 01
E: 3.375961 14 01 07 00 22 07 e3 03 00 01 00 00 00 00 01
E: 3.383964 14 01 07 00 26 07 e5 03 00 01 00 00 00 00 01
E: 3.391954 14 01 07 00 26 07 e5 03 00 01 00 00 00 00 01
E: 3.399963 14 01 07 00 2a 07 e7 03 00 01 00 00 00 00 01
E: 3.407962 14 01 07 00 2e 07 e9 03 00 01 00 00 00 00 01
E: 3.415961 14 01 07 00 31 07 eb 03 00 01 00 00 00 00 01
E: 3.423962 14 01 07 00 35 07 ec 03 00 01 00 00 00 00 01
E: 3.431961 14 01 07 00 39 07 ee 03 00 01 00 00 00 00 01
E: 3.439961 14 01 07 00 3d 07 f0 03 00 01 00 00 00 00 01
E: 3.447962 14 01 07 00 41 07 f2 03 00 01 00 00 00 00 01
E: 3.455962 14 01 07 00 44 07 f4 03 00 01 00 00 00 00 01
E: 3.463965 14 01 07 00 48 07 f6 03 00 01 00 00 00 00 01
E: 3.471962 14 01 07 00 4b 07 f8 03 00 01 00 00 00 00 01
E: 3.479960 14 01 07 00 4f 07 fa 03 00 01 00 00 00 00 01
E: 3.487962 14 01 07 00 52 07 fc 03 00 01 00 00 00 00 01
E: 3.495961 14 01 07 00 54 07 fd 03 00 01 00 00 00 00 01
E: 3.503961 14 01 07 00 57 07 fe 03 00 01 00 00 00 00 01
E: 3.511953 14 01 07 00 57 07 fe 03 00 01 00 00 00 00 01
E: 3.519961 14 01 07 00 59 07 00 04 00 01 00 00 00 00 01
E: 3.527957 14 01 07 00 5a 07 01 04 00 01 00 00 00 00 01
E: 3.535960 14 01 07 00 5c 07 02 04 00 01 00 00 00 00 01
E: 3.543959 14 01 07 00 5d 07 03 04 00 01 00 00 00 00 01
E: 3.551960 14 01 07 00 5f 07 04 04 00 01 00 00 00 00 01
E: 3.559955 14 01 07 00 5f 07 04 04 00 01 00 00 00 00 01
E: 3.567960 14 01 07 00 60 07 05 04 00 01 00 00 00 00 01
E: 3.575961 14 01 07 00 61 07 07 04 00 01 00 00 00 00 01
E: 3.583962 14 01 07 00 62 07 08 04 00 01 00 00 00 00 01
E: 3.591961 14 01 07 00 63 07 0a 04 00 01 00 00 00 00 01
E: 3.599961 14 01 07 00 64 07 0b 04 00 01 00 00 00 00 01
E: 3.607962 14 01 07 00 64 07 0c 04 00 01 00 00 00 00 01
E: 3.615960 14 01 07 00 65 07 0d 04 00 01 00 00 00 00 01
E: 3.623958 14 01 07 00 66 07 0d 04 00 01 00 00 00 00 01
E: 3.631953 14 01 07 00 66 07 0d 04 00 01 00 00 00 00 01
E: 3.639962 14 01 07 00 67 07 0e 04 00 01 00 00 00 00 01
E: 3.647959 14 01 07 00 68 07 10 04 00 01 00 00 00 00 01
E: 3.655960 14 01 07 00 68 07 11 04 00 01 00 00 00 00 01
E: 3.663959 14 01 07 00 69 07 12 04 00 01 00 00 00 00 01
E: 3.671960 14 01 07 00 6a 07 13 04 00 01 00 00 00 00 01
E: 3.679961 14 01 07 00 6b 07 16 04 00 01 00 00 00 00 01
E: 3.687961 14 01 07 00 6c 07 1a 04 00 01 00 00 00 00 01
E: 3.695960 14 01 07 00 6d 07 1d 04 00 01 00 00 00 00 01
E: 3.703960 14 01 07 00 6e 07 1f 04 00 01 00 00 00 00 01
E: 3.711959 14 01 07 00 6e 07 21 04 00 01 00 00 00 00 01
E: 3.719959 14 01 07 00 6f 07 22 04 00 01 00 00 00 00 01
E: 3.727952 14 01 07 00 6f 07 22 04 00 01 00 00 00 00 01
E: 3.735958 14 01 07 00 6f 07 23 04 00 01 00 00 00 00 01
E: 3.743957 14 01 07 00 6f 07 24 04 00 01 00 00 00 00 01
E: 3.751953 14 01 07 00 6f 07 24 04 00 01 00 00 00 00 01
E: 3.759952 14 01 07 00 6f 07 24 04 00 01 00 00 00 00 01
E: 3.767952 14 01 07 00 6f 07 24 04 00 01 00 00 00 00 01
E: 3.775959 14 01 07 00 70 07 25 04 00 01 00 00 00 00 01
E: 3.783953 14 01 07 00 70 07 25 04 00 01 00 00 00 00 01
E: 3.791952 14 01 07 00 70 07 25 04 00 01 00 00 00 00 01
E: 3.799952 14 01 07 00 70 07 25 04 00 01 00 00 00 00 01
E: 3.807954 14 01 07 00 70 07 25 04 00 01 00 00 00 00 01
E: 3.815951 14 01 07 00 70 07 25 04 00 01 00 00 00 00 01
E: 3.823950 14 01 07 00 70 07 25 04 00 01 00 00 00 00 01
E: 3.831952 14 01 07 00 70 07 25 04 00 01 00 00 00 00 01
E: 3.839952 14 01 07 00 70 07 25 04 00 01 00 00 00 00 01
E: 3.847953 14 01 07 00 70 07 25 04 00 01 00 00 00 00 01
E: 3.855954 14 01 07 00 70 07 25 04 00 01 00 00 00 00 01
E: 3.863951 14 01 07 00 70 07 25 04 00 01 00 00 00 00 01
E: 3.871953 14 01 07 00 70 07 25 04 00 01 00 00 00 00 01
E: 3.879957 14 01 06 00 70 07 25 04 00 01 00 00 00 00 01
# 2. Land one finger,
   - land a second finger far enough from the first
   - move your two fingers
   - release the *first* finger
   - release the second finger
E: 11.927919 14 01 07 00 ae 00 f8 01 00 01 00 00 00 00 01
E: 11.935861 14 01 07 00 ae 00 f8 01 00 01 00 00 00 00 01
E: 11.943902 14 01 07 00 ae 00 f8 01 00 01 00 00 00 00 01
E: 11.951895 14 01 07 00 ae 00 f8 01 00 01 00 00 00 00 01
E: 11.959897 14 01 07 00 ae 00 f8 01 00 01 00 00 00 00 01
E: 11.967895 14 01 07 00 ae 00 f8 01 00 01 00 00 00 00 01
E: 11.975897 14 01 07 00 ae 00 f8 01 00 01 00 00 00 00 01
E: 11.983895 14 01 07 00 ae 00 f8 01 00 01 00 00 00 00 01
E: 11.991898 14 01 07 00 ae 00 f8 01 00 01 00 00 00 00 01
E: 11.999899 14 01 07 00 ae 00 f8 01 00 01 00 00 00 00 01
E: 12.007896 14 01 07 00 ae 00 f8 01 00 01 00 00 00 00 01
E: 12.015897 14 01 07 00 ae 00 f8 01 00 01 00 00 00 00 01
E: 12.023897 14 01 07 00 ae 00 f8 01 00 01 00 00 00 00 01
E: 12.031897 14 01 07 00 ae 00 f8 01 00 01 00 00 00 00 01
E: 12.039897 14 01 07 00 ae 00 f8 01 00 01 00 00 00 00 01
E: 12.047896 14 01 07 00 ae 00 f8 01 00 01 00 00 00 00 01
E: 12.055894 14 01 07 00 ae 00 f8 01 00 01 00 00 00 00 01
E: 12.063896 14 01 07 00 ae 00 f8 01 00 01 00 00 00 00 01
E: 12.071897 14 01 07 00 ae 00 f8 01 00 01 00 00 00 00 01
E: 12.079894 14 01 07 00 ae 00 f8 01 00 01 00 00 00 00 01
E: 12.087896 14 01 07 00 ae 00 f8 01 00 01 00 00 00 00 01
E: 12.095894 14 01 07 00 ae 00 f8 01 00 01 00 00 00 00 01
E: 12.103896 14 01 07 00 ae 00 f8 01 00 01 00 00 00 00 01
E: 12.111897 14 01 07 00 ae 00 f8 01 00 01 00 00 00 00 01
E: 12.119896 14 01 07 00 ae 00 f8 01 00 01 00 00 00 00 01
E: 12.127896 14 01 07 00 ae 00 f8 01 00 01 00 00 00 00 01
E: 12.135895 14 01 07 00 ae 00 f8 01 00 01 00 00 00 00 01
E: 12.143848 14 01 07 00 ae 00 f8 01 00 01 00 00 00 00 01
E: 12.151895 14 01 07 00 ae 00 f8 01 00 01 00 00 00 00 01
E: 12.159896 14 01 07 00 ae 00 f8 01 00 01 00 00 00 00 01
E: 12.167894 14 01 07 00 ae 00 f8 01 00 01 00 00 00 00 01
E: 12.175898 14 01 07 00 ae 00 f8 01 00 01 00 00 00 00 01
E: 12.183893 14 01 07 00 ae 00 f8 01 00 01 00 00 00 00 01
E: 12.191898 14 01 07 00 ae 00 f8 01 00 01 00 00 00 00 01
E: 12.199899 14 01 07 00 ae 00 f8 01 00 01 00 00 00 00 01
E: 12.207897 14 01 07 00 ae 00 f8 01 00 01 00 00 00 00 01
E: 12.215893 14 01 07 00 ae 00 f8 01 00 01 00 00 00 00 01
E: 12.223894 14 01 07 00 ae 00 f8 01 00 01 00 00 00 00 01
E: 12.231882 14 01 07 00 ae 00 f8 01 00 01 00 00 00 00 01
E: 12.239896 14 01 07 00 ae 00 f8 01 00 01 00 00 00 00 01
E: 12.247895 14 01 07 00 ae 00 f8 01 00 01 00 00 00 00 01
E: 12.255896 14 01 07 00 ae 00 f8 01 00 01 00 00 00 00 01
E: 12.263895 14 01 07 00 ae 00 f8 01 00 01 00 00 00 00 01
E: 12.271895 14 01 07 00 ae 00 f8 01 00 01 00 00 00 00 01
E: 12.279894 14 01 07 00 ae 00 f8 01 00 01 00 00 00 00 01
E: 12.287895 14 01 07 00 ae 00 f8 01 00 01 00 00 00 00 01
E: 12.295896 14 01 07 00 ae 00 f8 01 00 01 00 00 00 00 01
E: 12.303895 14 01 07 00 ae 00 f8 01 00 01 00 00 00 00 01
E: 12.311894 14 01 07 00 ae 00 f8 01 00 01 00 00 00 00 01
E: 12.319894 14 01 07 00 ae 00 f8 01 00 01 00 00 00 00 01
E: 12.327894 14 01 07 00 ae 00 f8 01 00 01 00 00 00 00 01
E: 12.335894 14 01 07 00 ae 00 f8 01 00 01 00 00 00 00 01
E: 12.343894 14 01 07 00 ae 00 f8 01 00 01 00 00 00 00 01
E: 12.351894 14 01 07 00 ae 00 f8 01 00 01 00 00 00 00 01
E: 12.359896 14 01 07 00 ae 00 f8 01 00 01 00 00 00 00 01
E: 12.367893 14 01 07 00 ae 00 f8 01 00 01 00 00 00 00 01
E: 12.375894 14 01 07 00 ae 00 f8 01 00 01 00 00 00 00 01
E: 12.383870 14 01 07 00 ae 00 f8 01 00 01 00 00 00 00 01
E: 12.391894 14 01 07 00 ae 00 f8 01 00 01 00 00 00 00 01
E: 12.399893 14 01 07 00 ae 00 f8 01 00 01 00 00 00 00 01
E: 12.407895 14 01 07 00 ae 00 f8 01 00 01 00 00 00 00 01
E: 12.415894 14 01 07 00 ae 00 f8 01 00 01 00 00 00 00 01
E: 12.423895 14 01 07 00 ae 00 f8 01 00 01 00 00 00 00 01
E: 12.431892 14 01 07 00 ae 00 f8 01 00 01 00 00 00 00 01
E: 12.439894 14 01 07 00 ae 00 f8 01 00 01 00 00 00 00 01
E: 12.447894 14 01 07 00 ae 00 f8 01 00 01 00 00 00 00 01
E: 12.455894 14 01 07 00 ae 00 f8 01 00 01 00 00 00 00 01
E: 12.463895 14 01 07 00 ae 00 f8 01 00 01 00 00 00 00 01
E: 12.471894 14 01 07 00 ae 00 f8 01 00 01 00 00 00 00 01
E: 12.479893 14 01 07 00 ae 00 f8 01 00 01 00 00 00 00 01
E: 12.487893 14 01 07 00 ae 00 f8 01 00 01 00 00 00 00 01
E: 12.495893 14 01 07 00 ae 00 f8 01 00 01 00 00 00 00 01
E: 12.503842 14 01 07 00 ae 00 f8 01 00 01 00 00 00 00 01
E: 12.511859 14 01 07 00 ae 00 f8 01 00 01 00 00 00 00 01
E: 12.519891 14 01 07 00 ae 00 f8 01 00 01 00 00 00 00 01
E: 12.527894 14 01 07 00 ae 00 f8 01 00 01 00 00 00 00 01
E: 12.535893 14 01 07 00 ae 00 f8 01 00 01 00 00 00 00 01
E: 12.543894 14 01 07 00 ae 00 f8 01 00 01 00 00 00 00 01
E: 12.551895 14 01 07 00 ae 00 f8 01 00 01 00 00 00 00 01
E: 12.559891 14 01 07 00 ae 00 f8 01 00 01 00 00 00 00 01
E: 12.567894 14 01 07 00 ae 00 f8 01 00 01 00 00 00 00 01
E: 12.575892 14 01 07 00 ae 00 f8 01 00 01 00 00 00 00 01
E: 12.583892 14 01 07 00 ae 00 f8 01 00 01 00 00 00 00 01
E: 12.591894 14 01 07 00 ae 00 f8 01 00 01 00 00 00 00 01
E: 12.599891 14 01 07 00 ae 00 f8 01 00 01 00 00 00 00 01
E: 12.607891 14 01 07 00 ae 00 f8 01 00 01 00 00 00 00 01
E: 12.615893 14 01 07 00 ae 00 f8 01 00 01 00 00 00 00 01
E: 12.623894 14 01 07 00 ae 00 f8 01 00 01 00 00 00 00 01
E: 12.631895 14 01 07 00 ae 00 f8 01 00 01 00 00 00 00 01
E: 12.639893 14 01 07 00 ae 00 f8 01 00 01 00 00 00 00 01
E: 12.647894 14 01 07 00 ae 00 f8 01 00 01 00 00 00 00 01
E: 12.655892 14 01 07 00 ae 00 f8 01 00 01 00 00 00 00 01
E: 12.663893 14 01 07 00 ae 00 f8 01 00 01 00 00 00 00 01
E: 12.671892 14 01 07 00 ae 00 f8 01 00 01 00 00 00 00 01
E: 12.679891 14 01 07 00 ae 00 f8 01 00 01 00 00 00 00 01
E: 12.687893 14 01 07 00 ae 00 f8 01 00 01 00 00 00 00 01
E: 12.695892 14 01 07 00 ae 00 f8 01 00 01 00 00 00 00 01
E: 12.703890 14 01 07 00 ae 00 f8 01 00 01 00 00 00 00 01
E: 12.711892 14 01 07 00 ae 00 f8 01 00 01 00 00 00 00 01
E: 12.719891 14 01 07 00 ae 00 f8 01 00 01 00 00 00 00 01
E: 12.727892 14 01 07 00 ae 00 f8 01 00 01 00 00 00 00 01
E: 12.735892 14 01 07 00 ae 00 f8 01 00 01 00 00 00 00 01
E: 12.743891 14 01 07 00 ae 00 f8 01 00 01 00 00 00 00 01
E: 12.751891 14 01 07 00 ae 00 f8 01 00 01 00 00 00 00 01
E: 12.759891 14 01 07 00 ae 00 f8 01 00 01 00 00 00 00 01
E: 12.767891 14 01 07 00 ae 00 f8 01 00 01 00 00 00 00 01
E: 12.775892 14 01 07 00 ae 00 f8 01 00 01 00 00 00 00 01
E: 12.783892 14 01 07 00 ae 00 f8 01 00 01 00 00 00 00 01
E: 12.791890 14 01 07 00 ae 00 f8 01 00 01 00 00 00 00 01
E: 12.799890 14 01 07 00 ae 00 f8 01 00 01 00 00 00 00 01
E: 12.807891 14 01 07 00 ae 00 f8 01 00 01 00 00 00 00 01
E: 12.815892 14 01 07 00 ae 00 f8 01 00 01 00 00 00 00 01
E: 12.823891 14 01 07 00 ae 00 f8 01 00 01 00 00 00 00 01
E: 12.831892 14 01 07 00 ae 00 f8 01 00 01 00 00 00 00 01
E: 12.839891 14 01 07 00 ae 00 f8 01 00 01 00 00 00 00 01
E: 12.847891 14 01 07 00 ae 00 f8 01 00 01 00 00 00 00 01
E: 12.855889 14 01 07 00 ae 00 f8 01 00 01 00 00 00 00 01
E: 12.863888 14 01 07 00 ae 00 f8 01 00 01 00 00 00 00 01
E: 12.871893 14 01 07 00 ae 00 f8 01 00 01 00 00 00 00 01
E: 12.879891 14 01 07 00 ae 00 f8 01 00 01 00 00 00 00 01
E: 12.887893 14 01 07 00 ae 00 f8 01 00 01 00 00 00 00 01
E: 12.895891 14 01 07 00 ae 00 f8 01 00 01 00 00 00 00 01
E: 12.903890 14 01 07 00 ae 00 f8 01 00 01 00 00 00 00 01
E: 12.911892 14 01 07 00 ae 00 f8 01 00 01 00 00 00 00 01
E: 12.919890 14 01 07 00 ae 00 f8 01 00 01 00 00 00 00 01
E: 12.927890 14 01 07 00 ae 00 f8 01 00 01 00 00 00 00 01
E: 12.935889 14 01 07 00 ae 00 f8 01 00 01 00 00 00 00 01
E: 12.943891 14 01 07 00 ae 00 f8 01 00 01 00 00 00 00 01
E: 12.951892 14 01 07 00 ae 00 f8 01 00 01 00 00 00 00 01
E: 12.959890 14 01 07 00 ae 00 f8 01 00 01 00 00 00 00 01
E: 12.967890 14 01 07 00 ae 00 f8 01 00 01 00 00 00 00 01
E: 12.975890 14 01 07 00 ae 00 f8 01 00 01 00 00 00 00 01
E: 12.983890 14 01 07 00 ae 00 f8 01 00 01 00 00 00 00 01
E: 12.991891 14 01 07 00 ae 00 f8 01 00 01 00 00 00 00 01
E: 12.999890 14 01 07 00 ae 00 f8 01 00 01 00 00 00 00 01
E: 13.007891 14 01 07 00 ae 00 f8 01 00 01 00 00 00 00 01
E: 13.015890 14 01 07 00 ae 00 f8 01 00 01 00 00 00 00 01
E: 13.023890 14 01 07 00 ae 00 f8 01 00 01 00 00 00 00 01
E: 13.031889 14 01 07 00 ae 00 f8 01 00 01 00 00 00 00 01
E: 13.039891 14 01 07 00 ae 00 f8 01 00 01 00 00 00 00 01
E: 13.047891 14 01 07 00 ae 00 f8 01 00 01 00 00 00 00 01
E: 13.055890 14 01 07 00 ae 00 f8 01 00 01 00 00 00 00 01
E: 13.063889 14 01 07 00 ae 00 f8 01 00 01 00 00 00 00 01
E: 13.071889 14 01 07 00 ae 00 f8 01 00 01 00 00 00 00 01
E: 13.079889 14 01 07 00 ae 00 f8 01 00 01 00 00 00 00 01
E: 13.087891 14 01 07 00 ae 00 f8 01 00 01 00 00 00 00 01
E: 13.095891 14 01 07 00 ae 00 f8 01 00 01 00 00 00 00 01
E: 13.103890 14 01 07 00 ae 00 f8 01 00 01 00 00 00 00 01
E: 13.111889 14 01 07 00 ae 00 f8 01 00 01 00 00 00 00 01
E: 13.119887 14 01 07 00 ae 00 f8 01 00 01 00 00 00 00 01
E: 13.127891 14 01 07 00 ae 00 f8 01 00 01 00 00 00 00 01
E: 13.135889 14 01 07 00 ae 00 f8 01 00 01 00 00 00 00 01
E: 13.143890 14 01 07 00 ae 00 f8 01 00 01 00 00 00 00 01
E: 13.151888 14 01 07 00 ae 00 f8 01 00 01 00 00 00 00 01
E: 13.159889 14 01 07 00 ae 00 f8 01 00 01 00 00 00 00 01
E: 13.167889 14 01 07 00 ae 00 f8 01 00 01 00 00 00 00 01
E: 13.175889 14 01 07 00 ae 00 f8 01 00 01 00 00 00 00 01
E: 13.183888 14 01 07 00 ae 00 f8 01 00 01 00 00 00 00 01
E: 13.191889 14 01 07 00 ae 00 f8 01 00 01 00 00 00 00 01
E: 13.199889 14 01 07 00 ae 00 f8 01 00 01 00 00 00 00 01
E: 13.207889 14 01 07 00 ae 00 f8 01 00 01 00 00 00 00 01
E: 13.215890 14 01 07 00 ae 00 f8 01 00 01 00 00 00 00 01
E: 13.223887 14 01 07 00 ae 00 f8 01 00 01 00 00 00 00 01
E: 13.231889 14 01 07 00 ae 00 f8 01 00 01 00 00 00 00 01
E: 13.239888 14 01 07 00 ae 00 f8 01 00 01 00 00 00 00 01
E: 13.247888 14 01 07 00 ae 00 f8 01 00 01 00 00 00 00 01
E: 13.255888 14 01 07 00 ae 00 f8 01 00 01 00 00 00 00 01
E: 13.263889 14 01 07 00 ae 00 f8 01 00 01 00 00 00 00 01
E: 13.271888 14 01 07 00 ae 00 f8 01 00 01 00 00 00 00 01
E: 13.279887 14 01 07 00 ae 00 f8 01 00 01 00 00 00 00 01
E: 13.287888 14 01 07 00 ae 00 f8 01 00 01 00 00 00 00 01
E: 13.295888 14 01 07 00 ae 00 f8 01 00 01 00 00 00 00 01
E: 13.303886 14 01 07 00 ae 00 f8 01 00 01 00 00 00 00 01
E: 13.311889 14 01 07 00 ae 00 f8 01 00 01 00 00 00 00 01
E: 13.319888 14 01 07 00 ae 00 f8 01 00 01 00 00 00 00 01
E: 13.327888 14 01 07 00 ae 00 f8 01 00 01 00 00 00 00 01
E: 13.335888 14 01 07 00 ae 00 f8 01 00 01 00 00 00 00 01
E: 13.343887 14 01 07 00 ae 00 f8 01 00 01 00 00 00 00 01
E: 13.351888 14 01 07 00 ae 00 f8 01 00 01 00 00 00 00 01
E: 13.359888 14 01 07 00 ae 00 f8 01 00 01 00 00 00 00 01
E: 13.367889 14 01 07 00 ae 00 f8 01 00 01 00 00 00 00 01
E: 13.375898 14 01 07 00 ae 00 f8 01 07 01 b3 06 30 02 02
E: 13.383889 14 01 07 00 ae 00 f8 01 07 01 b3 06 30 02 02
E: 13.391890 14 01 07 00 ae 00 f8 01 07 01 b3 06 30 02 02
E: 13.399888 14 01 07 00 ae 00 f8 01 07 01 b3 06 30 02 02
E: 13.407890 14 01 07 00 ae 00 f8 01 07 01 b3 06 30 02 02
E: 13.415889 14 01 07 00 ae 00 f8 01 07 01 b3 06 30 02 02
E: 13.423888 14 01 07 00 ae 00 f8 01 07 01 b3 06 30 02 02
E: 13.431888 14 01 07 00 ae 00 f8 01 07 01 b3 06 30 02 02
E: 13.439888 14 01 07 00 ae 00 f8 01 07 01 b3 06 30 02 02
E: 13.447890 14 01 07 00 ae 00 f8 01 07 01 b3 06 30 02 02
E: 13.455888 14 01 07 00 ae 00 f8 01 07 01 b3 06 30 02 02
E: 13.463888 14 01 07 00 ae 00 f8 01 07 01 b3 06 30 02 02
E: 13.471889 14 01 07 00 ae 00 f8 01 07 01 b3 06 30 02 02
E: 13.479889 14 01 07 00 ae 00 f8 01 07 01 b3 06 30 02 02
E: 13.487891 14 01 07 00 ae 00 f8 01 07 01 b3 06 30 02 02
E: 13.495889 14 01 07 00 ae 00 f8 01 07 01 b3 06 30 02 02
E: 13.503887 14 01 07 00 ae 00 f8 01 07 01 b3 06 30 02 02
E: 13.511840 14 01 07 00 ae 00 f8 01 07 01 b3 06 30 02 02
E: 13.519888 14 01 07 00 ae 00 f8 01 07 01 b3 06 30 02 02
E: 13.527896 14 01 07 00 ae 00 f8 01 07 01 b3 06 31 02 02
E: 13.535889 14 01 07 00 ae 00 f8 01 07 01 b3 06 31 02 02
E: 13.543886 14 01 07 00 ae 00 f8 01 07 01 b3 06 31 02 02
E: 13.551889 14 01 07 00 ae 00 f8 01 07 01 b3 06 31 02 02
E: 13.559891 14 01 07 00 ae 00 f8 01 07 01 b3 06 31 02 02
E: 13.567891 14 01 07 00 ae 00 f8 01 07 01 b3 06 31 02 02
E: 13.575887 14 01 07 00 ae 00 f8 01 07 01 b3 06 31 02 02
E: 13.583887 14 01 07 00 ae 00 f8 01 07 01 b3 06 31 02 02
E: 13.591887 14 01 07 00 ae 00 f8 01 07 01 b3 06 31 02 02
E: 13.599886 14 01 07 00 ae 00 f8 01 07 01 b3 06 31 02 02
E: 13.607888 14 01 07 00 ae 00 f8 01 07 01 b3 06 31 02 02
E: 13.615885 14 01 07 00 ae 00 f8 01 07 01 b3 06 31 02 02
E: 13.623888 14 01 07 00 ae 00 f8 01 07 01 b3 06 31 02 02
E: 13.631887 14 01 07 00 ae 00 f8 01 07 01 b3 06 31 02 02
E: 13.639887 14 01 07 00 ae 00 f8 01 07 01 b3 06 31 02 02
E: 13.647887 14 01 07 00 ae 00 f8 01 07 01 b3 06 31 02 02
E: 13.655886 14 01 07 00 ae 00 f8 01 07 01 b3 06 31 02 02
E: 13.663886 14 01 07 00 ae 00 f8 01 07 01 b3 06 31 02 02
E: 13.671887 14 01 07 00 ae 00 f8 01 07 01 b3 06 31 02 02
E: 13.679887 14 01 07 00 ae 00 f8 01 07 01 b3 06 31 02 02
E: 13.687886 14 01 07 00 ae 00 f8 01 07 01 b3 06 31 02 02
E: 13.695886 14 01 07 00 ae 00 f8 01 07 01 b3 06 31 02 02
E: 13.703886 14 01 07 00 ae 00 f8 01 07 01 b3 06 31 02 02
E: 13.711884 14 01 07 00 ae 00 f8 01 07 01 b3 06 31 02 02
E: 13.719886 14 01 07 00 ae 00 f8 01 07 01 b3 06 31 02 02
E: 13.727885 14 01 07 00 ae 00 f8 01 07 01 b3 06 31 02 02
E: 13.735886 14 01 07 00 ae 00 f8 01 07 01 b3 06 31 02 02
E: 13.743884 14 01 07 00 ae 00 f8 01 07 01 b3 06 31 02 02
E: 13.751885 14 01 07 00 ae 00 f8 01 07 01 b3 06 31 02 02
E: 13.759887 14 01 07 00 ae 00 f8 01 07 01 b3 06 31 02 02
E: 13.767887 14 01 07 00 ae 00 f8 01 07 01 b3 06 31 02 02
E: 13.775886 14 01 07 00 ae 00 f8 01 07 01 b3 06 31 02 02
E: 13.783886 14 01 07 00 ae 00 f8 01 07 01 b3 06 31 02 02
E: 13.791886 14 01 07 00 ae 00 f8 01 07 01 b3 06 31 02 02
E: 13.799887 14 01 07 00 ae 00 f8 01 07 01 b3 06 31 02 02
E: 13.807886 14 01 07 00 ae 00 f8 01 07 01 b3 06 31 02 02
E: 13.815883 14 01 07 00 ae 00 f8 01 07 01 b3 06 31 02 02
E: 13.823886 14 01 07 00 ae 00 f8 01 07 01 b3 06 31 02 02
E: 13.831886 14 01 07 00 ae 00 f8 01 07 01 b3 06 31 02 02
E: 13.839885 14 01 07 00 ae 00 f8 01 07 01 b3 06 31 02 02
E: 13.847887 14 01 07 00 ae 00 f8 01 07 01 b3 06 31 02 02
E: 13.855886 14 01 07 00 ae 00 f8 01 07 01 b3 06 31 02 02
E: 13.863884 14 01 07 00 ae 00 f8 01 07 01 b3 06 31 02 02
E: 13.871886 14 01 07 00 ae 00 f8 01 07 01 b3 06 31 02 02
E: 13.879886 14 01 07 00 ae 00 f8 01 07 01 b3 06 31 02 02
E: 13.887885 14 01 07 00 ae 00 f8 01 07 01 b3 06 31 02 02
E: 13.895885 14 01 07 00 ae 00 f8 01 07 01 b3 06 31 02 02
E: 13.903884 14 01 07 00 ae 00 f8 01 07 01 b3 06 31 02 02
E: 13.911885 14 01 07 00 ae 00 f8 01 07 01 b3 06 31 02 02
E: 13.919885 14 01 07 00 ae 00 f8 01 07 01 b3 06 31 02 02
E: 13.927883 14 01 07 00 ae 00 f8 01 07 01 b3 06 31 02 02
E: 13.935884 14 01 07 00 ae 00 f8 01 07 01 b3 06 31 02 02
E: 13.943886 14 01 07 00 ae 00 f8 01 07 01 b3 06 31 02 02
E: 13.951885 14 01 07 00 ae 00 f8 01 07 01 b3 06 31 02 02
E: 13.959884 14 01 07 00 ae 00 f8 01 07 01 b3 06 31 02 02
E: 13.967885 14 01 07 00 ae 00 f8 01 07 01 b3 06 31 02 02
E: 13.975883 14 01 07 00 ae 00 f8 01 07 01 b3 06 31 02 02
E: 13.983883 14 01 07 00 ae 00 f8 01 07 01 b3 06 31 02 02
E: 13.991885 14 01 07 00 ae 00 f8 01 07 01 b3 06 31 02 02
E: 13.999883 14 01 07 00 ae 00 f8 01 07 01 b3 06 31 02 02
E: 14.007885 14 01 07 00 ae 00 f8 01 07 01 b3 06 31 02 02
E: 14.015885 14 01 07 00 ae 00 f8 01 07 01 b3 06 31 02 02
E: 14.023884 14 01 07 00 ae 00 f8 01 07 01 b3 06 31 02 02
E: 14.031884 14 01 07 00 ae 00 f8 01 07 01 b3 06 31 02 02
E: 14.039886 14 01 07 00 ae 00 f8 01 07 01 b3 06 31 02 02
E: 14.047883 14 01 07 00 ae 00 f8 01 07 01 b3 06 31 02 02
E: 14.055885 14 01 07 00 ae 00 f8 01 07 01 b3 06 31 02 02
E: 14.063884 14 01 07 00 ae 00 f8 01 07 01 b3 06 31 02 02
E: 14.071885 14 01 07 00 ae 00 f8 01 07 01 b3 06 31 02 02
E: 14.079883 14 01 07 00 ae 00 f8 01 07 01 b3 06 31 02 02
E: 14.087882 14 01 07 00 ae 00 f8 01 07 01 b3 06 31 02 02
E: 14.095883 14 01 07 00 ae 00 f8 01 07 01 b3 06 31 02 02
E: 14.103884 14 01 07 00 ae 00 f8 01 07 01 b3 06 31 02 02
E: 14.111890 14 01 07 00 ae 00 f8 01 07 01 b3 06 30 02 02
E: 14.119884 14 01 07 00 ae 00 f8 01 07 01 b3 06 30 02 02
E: 14.127882 14 01 07 00 ae 00 f8 01 07 01 b3 06 30 02 02
E: 14.135881 14 01 07 00 ae 00 f8 01 07 01 b3 06 30 02 02
E: 14.143883 14 01 07 00 ae 00 f8 01 07 01 b3 06 30 02 02
E: 14.151883 14 01 07 00 ae 00 f8 01 07 01 b3 06 30 02 02
E: 14.159883 14 01 07 00 ae 00 f8 01 07 01 b3 06 30 02 02
E: 14.167883 14 01 07 00 ae 00 f8 01 07 01 b3 06 30 02 02
E: 14.175882 14 01 07 00 ae 00 f8 01 07 01 b3 06 30 02 02
E: 14.183883 14 01 07 00 ae 00 f8 01 07 01 b3 06 30 02 02
E: 14.191836 14 01 07 00 ae 00 f8 01 07 01 b3 06 30 02 02
E: 14.199882 14 01 07 00 ae 00 f8 01 07 01 b3 06 30 02 02
E: 14.207885 14 01 07 00 ae 00 f8 01 07 01 b3 06 30 02 02
E: 14.215881 14 01 07 00 ae 00 f8 01 07 01 b3 06 30 02 02
E: 14.223861 14 01 07 00 ae 00 f8 01 07 01 b3 06 30 02 02
E: 14.231884 14 01 07 00 ae 00 f8 01 07 01 b3 06 30 02 02
E: 14.239881 14 01 07 00 ae 00 f8 01 07 01 b3 06 30 02 02
E: 14.247883 14 01 07 00 ae 00 f8 01 07 01 b3 06 30 02 02
E: 14.255884 14 01 07 00 ae 00 f8 01 07 01 b3 06 30 02 02
E: 14.263881 14 01 07 00 ae 00 f8 01 07 01 b3 06 30 02 02
E: 14.271883 14 01 07 00 ae 00 f8 01 07 01 b3 06 30 02 02
E: 14.279882 14 01 07 00 ae 00 f8 01 07 01 b3 06 30 02 02
E: 14.287883 14 01 07 00 ae 00 f8 01 07 01 b3 06 30 02 02
E: 14.295881 14 01 07 00 ae 00 f8 01 07 01 b3 06 30 02 02
E: 14.303880 14 01 07 00 ae 00 f8 01 07 01 b3 06 30 02 02
E: 14.311882 14 01 07 00 ae 00 f8 01 07 01 b3 06 30 02 02
E: 14.319883 14 01 07 00 ae 00 f8 01 07 01 b3 06 30 02 02
E: 14.327889 14 01 07 00 ae 00 f8 01 07 01 b2 06 30 02 02
E: 14.335884 14 01 07 00 ae 00 f8 01 07 01 b2 06 30 02 02
E: 14.343882 14 01 07 00 ae 00 f8 01 07 01 b2 06 30 02 02
E: 14.351883 14 01 07 00 ae 00 f8 01 07 01 b2 06 30 02 02
E: 14.359881 14 01 07 00 ae 00 f8 01 07 01 b2 06 30 02 02
E: 14.367885 14 01 07 00 ae 00 f8 01 07 01 b2 06 30 02 02
E: 14.375883 14 01 07 00 ae 00 f8 01 07 01 b2 06 30 02 02
E: 14.383882 14 01 07 00 ae 00 f8 01 07 01 b2 06 30 02 02
E: 14.391882 14 01 07 00 ae 00 f8 01 07 01 b2 06 30 02 02
E: 14.399883 14 01 07 00 ae 00 f8 01 07 01 b2 06 30 02 02
E: 14.407881 14 01 07 00 ae 00 f8 01 07 01 b2 06 30 02 02
E: 14.415882 14 01 07 00 ae 00 f8 01 07 01 b2 06 30 02 02
E: 14.423882 14 01 07 00 ae 00 f8 01 07 01 b2 06 30 02 02
E: 14.431884 14 01 07 00 ae 00 f8 01 07 01 b2 06 30 02 02
E: 14.439884 14 01 07 00 ae 00 f8 01 07 01 b2 06 30 02 02
E: 14.447885 14 01 07 00 ae 00 f8 01 07 01 b2 06 30 02 02
E: 14.455879 14 01 07 00 ae 00 f8 01 07 01 b2 06 30 02 02
E: 14.463881 14 01 07 00 ae 00 f8 01 07 01 b2 06 30 02 02
E: 14.471882 14 01 07 00 ae 00 f8 01 07 01 b2 06 30 02 02
E: 14.479879 14 01 07 00 ae 00 f8 01 07 01 b2 06 30 02 02
E: 14.487881 14 01 07 00 ae 00 f8 01 07 01 b2 06 30 02 02
E: 14.495882 14 01 07 00 ae 00 f8 01 07 01 b2 06 30 02 02
E: 14.503882 14 01 07 00 ae 00 f8 01 07 01 b2 06 30 02 02
E: 14.511840 14 01 07 00 ae 00 f8 01 07 01 b2 06 30 02 02
E: 14.519882 14 01 07 00 ae 00 f8 01 07 01 b2 06 30 02 02
E: 14.527881 14 01 07 00 ae 00 f8 01 07 01 b2 06 30 02 02
E: 14.535881 14 01 07 00 ae 00 f8 01 07 01 b2 06 30 02 02
E: 14.543881 14 01 07 00 ae 00 f8 01 07 01 b2 06 30 02 02
E: 14.551880 14 01 07 00 ae 00 f8 01 07 01 b2 06 30 02 02
E: 14.559882 14 01 07 00 ae 00 f8 01 07 01 b2 06 30 02 02
E: 14.567878 14 01 07 00 ae 00 f8 01 07 01 b2 06 30 02 02
E: 14.575886 14 01 07 00 ae 00 f8 01 07 01 b1 06 30 02 02
E: 14.583880 14 01 07 00 ae 00 f8 01 07 01 b1 06 30 02 02
E: 14.591882 14 01 07 00 ae 00 f8 01 07 01 b1 06 30 02 02
E: 14.599880 14 01 07 00 ae 00 f8 01 07 01 b1 06 30 02 02
E: 14.607880 14 01 07 00 ae 00 f8 01 07 01 b1 06 30 02 02
E: 14.615880 14 01 07 00 ae 00 f8 01 07 01 b1 06 30 02 02
E: 14.623880 14 01 07 00 ae 00 f8 01 07 01 b1 06 30 02 02
E: 14.631879 14 01 07 00 ae 00 f8 01 07 01 b1 06 30 02 02
E: 14.639881 14 01 07 00 ae 00 f8 01 07 01 b1 06 30 02 02
E: 14.647878 14 01 07 00 ae 00 f8 01 07 01 b1 06 30 02 02
E: 14.655885 14 01 07 00 ae 00 f8 01 07 01 b0 06 30 02 02
E: 14.663887 14 01 07 00 ae 00 f8 01 07 01 b0 06 31 02 02
E: 14.671879 14 01 07 00 ae 00 f8 01 07 01 b0 06 31 02 02
E: 14.679886 14 01 07 00 ae 00 f8 01 07 01 af 06 31 02 02
E: 14.687881 14 01 07 00 ae 00 f8 01 07 01 af 06 31 02 02
E: 14.695878 14 01 07 00 ae 00 f8 01 07 01 af 06 31 02 02
E: 14.703886 14 01 07 00 ae 00 f8 01 07 01 ae 06 31 02 02
E: 14.711879 14 01 07 00 ae 00 f8 01 07 01 ae 06 31 02 02
E: 14.719880 14 01 07 00 ae 00 f8 01 07 01 ae 06 31 02 02
E: 14.727883 14 01 07 00 ae 00 f8 01 07 01 ad 06 31 02 02
E: 14.735877 14 01 07 00 ae 00 f8 01 07 01 ad 06 31 02 02
E: 14.743883 14 01 07 00 ae 00 f8 01 07 01 ac 06 31 02 02
E: 14.751876 14 01 07 00 ae 00 f8 01 07 01 ac 06 31 02 02
E: 14.759887 14 01 07 00 ae 00 f8 01 07 01 ab 06 31 02 02
E: 14.767886 14 01 07 00 ae 00 f8 01 07 01 aa 06 31 02 02
E: 14.775877 14 01 07 00 ae 00 f8 01 07 01 aa 06 31 02 02
E: 14.783886 14 01 07 00 ae 00 f8 01 07 01 a9 06 32 02 02
E: 14.791886 14 01 07 00 ae 00 f8 01 07 01 a8 06 32 02 02
E: 14.799886 14 01 07 00 ae 00 f8 01 07 01 a7 06 32 02 02
E: 14.807886 14 01 07 00 ae 00 f8 01 07 01 a6 06 32 02 02
E: 14.815880 14 01 07 00 ae 00 f8 01 07 01 a6 06 32 02 02
E: 14.823885 14 01 07 00 ae 00 f8 01 07 01 a5 06 32 02 02
E: 14.831886 14 01 07 00 ae 00 f8 01 07 01 a4 06 32 02 02
E: 14.839886 14 01 07 00 ae 00 f8 01 07 01 a3 06 32 02 02
E: 14.847887 14 01 07 00 ae 00 f8 01 07 01 a2 06 32 02 02
E: 14.855885 14 01 07 00 ae 00 f8 01 07 01 a1 06 32 02 02
E: 14.863882 14 01 07 00 ae 00 f8 01 07 01 9f 06 33 02 02
E: 14.871887 14 01 07 00 ae 00 f8 01 07 01 9e 06 33 02 02
E: 14.879885 14 01 07 00 ae 00 f8 01 07 01 9d 06 33 02 02
E: 14.887878 14 01 07 00 ae 00 f8 01 07 01 9d 06 33 02 02
E: 14.895885 14 01 07 00 ae 00 f8 01 07 01 9b 06 33 02 02
E: 14.903884 14 01 07 00 ae 00 f8 01 07 01 99 06 32 02 02
E: 14.911885 14 01 07 00 ae 00 f8 01 07 01 98 06 32 02 02
E: 14.919884 14 01 07 00 ae 00 f8 01 07 01 96 06 32 02 02
E: 14.927884 14 01 07 00 ae 00 f8 01 07 01 94 06 32 02 02
E: 14.935882 14 01 07 00 ae 00 f8 01 07 01 92 06 32 02 02
E: 14.943883 14 01 07 00 ae 00 f8 01 07 01 90 06 32 02 02
E: 14.951884 14 01 07 00 ae 00 f8 01 07 01 8e 06 32 02 02
E: 14.959884 14 01 07 00 b2 00 f9 01 07 01 8c 06 32 02 02
E: 14.967884 14 01 07 00 b5 00 f9 01 07 01 8a 06 32 02 02
E: 14.975882 14 01 07 00 b8 00 f9 01 07 01 88 06 32 02 02
E: 14.983884 14 01 07 00 bb 00 fa 01 07 01 85 06 32 02 02
E: 14.991883 14 01 07 00 bf 00 fa 01 07 01 83 06 32 02 02
E: 14.999881 14 01 07 00 c2 00 fa 01 07 01 81 06 32 02 02
E: 15.007883 14 01 07 00 c5 00 fa 01 07 01 7e 06 31 02 02
E: 15.015883 14 01 07 00 c9 00 fb 01 07 01 7c 06 31 02 02
E: 15.023884 14 01 07 00 cc 00 fb 01 07 01 79 06 31 02 02
E: 15.031884 14 01 07 00 cf 00 fb 01 07 01 77 06 31 02 02
E: 15.039884 14 01 07 00 d2 00 fb 01 07 01 75 06 31 02 02
E: 15.047883 14 01 07 00 d5 00 fc 01 07 01 72 06 31 02 02
E: 15.055876 14 01 07 00 d5 00 fc 01 07 01 72 06 31 02 02
E: 15.063883 14 01 07 00 d8 00 fc 01 07 01 70 06 31 02 02
E: 15.071885 14 01 07 00 dc 00 fc 01 07 01 6e 06 31 02 02
E: 15.079882 14 01 07 00 df 00 fc 01 07 01 6c 06 31 02 02
E: 15.087883 14 01 07 00 e1 00 fc 01 07 01 69 06 31 02 02
E: 15.095882 14 01 07 00 e4 00 fd 01 07 01 67 06 31 02 02
E: 15.103882 14 01 07 00 e7 00 fd 01 07 01 65 06 31 02 02
E: 15.111882 14 01 07 00 ea 00 fd 01 07 01 63 06 31 02 02
E: 15.119883 14 01 07 00 ec 00 fe 01 07 01 62 06 31 02 02
E: 15.127882 14 01 07 00 ef 00 fe 01 07 01 60 06 31 02 02
E: 15.135884 14 01 07 00 f2 00 fe 01 07 01 5e 06 31 02 02
E: 15.143883 14 01 07 00 f4 00 fe 01 07 01 5c 06 30 02 02
E: 15.151883 14 01 07 00 f7 00 ff 01 07 01 5b 06 30 02 02
E: 15.159882 14 01 07 00 fa 00 ff 01 07 01 59 06 30 02 02
E: 15.167882 14 01 07 00 fd 00 ff 01 07 01 57 06 30 02 02
E: 15.175877 14 01 07 00 fd 00 ff 01 07 01 57 06 30 02 02
E: 15.183882 14 01 07 00 ff 00 00 02 07 01 55 06 30 02 02
E: 15.191883 14 01 07 00 02 01 00 02 07 01 54 06 30 02 02
E: 15.199883 14 01 07 00 05 01 00 02 07 01 52 06 30 02 02
E: 15.207881 14 01 07 00 08 01 00 02 07 01 50 06 30 02 02
E: 15.215881 14 01 07 00 0a 01 01 02 07 01 4e 06 30 02 02
E: 15.223828 14 01 07 00 0a 01 01 02 07 01 4e 06 30 02 02
E: 15.231884 14 01 07 00 0d 01 01 02 07 01 4c 06 30 02 02
E: 15.239882 14 01 07 00 10 01 01 02 07 01 4b 06 30 02 02
E: 15.247883 14 01 07 00 12 01 01 02 07 01 49 06 30 02 02
E: 15.255881 14 01 07 00 15 01 02 02 07 01 47 06 30 02 02
E: 15.263882 14 01 07 00 17 01 02 02 07 01 45 06 30 02 02
E: 15.271883 14 01 07 00 1a 01 02 02 07 01 44 06 30 02 02
E: 15.279881 14 01 07 00 1c 01 03 02 07 01 42 06 30 02 02
E: 15.287882 14 01 07 00 1e 01 03 02 07 01 41 06 30 02 02
E: 15.295883 14 01 07 00 20 01 03 02 07 01 3f 06 30 02 02
E: 15.303883 14 01 07 00 23 01 04 02 07 01 3d 06 30 02 02
E: 15.311883 14 01 07 00 25 01 04 02 07 01 3c 06 30 02 02
E: 15.319883 14 01 07 00 27 01 04 02 07 01 3a 06 30 02 02
E: 15.327883 14 01 07 00 29 01 05 02 07 01 39 06 30 02 02
E: 15.335882 14 01 07 00 2c 01 05 02 07 01 37 06 30 02 02
E: 15.343882 14 01 07 00 2e 01 05 02 07 01 35 06 30 02 02
E: 15.351882 14 01 07 00 30 01 05 02 07 01 34 06 31 02 02
E: 15.359882 14 01 07 00 32 01 06 02 07 01 32 06 31 02 02
E: 15.367881 14 01 07 00 34 01 06 02 07 01 30 06 31 02 02
E: 15.375881 14 01 07 00 36 01 06 02 07 01 2f 06 31 02 02
E: 15.383881 14 01 07 00 39 01 06 02 07 01 2d 06 31 02 02
E: 15.391874 14 01 07 00 39 01 06 02 07 01 2d 06 31 02 02
E: 15.399880 14 01 07 00 3b 01 07 02 07 01 2b 06 31 02 02
E: 15.407882 14 01 07 00 3d 01 07 02 07 01 2a 06 31 02 02
E: 15.415882 14 01 07 00 3f 01 07 02 07 01 28 06 32 02 02
E: 15.423879 14 01 07 00 42 01 07 02 07 01 26 06 32 02 02
E: 15.431881 14 01 07 00 44 01 07 02 07 01 24 06 32 02 02
E: 15.439879 14 01 07 00 46 01 08 02 07 01 22 06 32 02 02
E: 15.447879 14 01 07 00 49 01 08 02 07 01 20 06 32 02 02
E: 15.455881 14 01 07 00 4b 01 08 02 07 01 1f 06 32 02 02
E: 15.463881 14 01 07 00 4e 01 08 02 07 01 1d 06 32 02 02
E: 15.471880 14 01 07 00 50 01 09 02 07 01 1b 06 32 02 02
E: 15.479880 14 01 07 00 53 01 09 02 07 01 18 06 33 02 02
E: 15.487881 14 01 07 00 55 01 09 02 07 01 16 06 33 02 02
E: 15.495879 14 01 07 00 58 01 09 02 07 01 14 06 33 02 02
E: 15.503882 14 01 07 00 5b 01 09 02 07 01 12 06 33 02 02
E: 15.511881 14 01 07 00 5d 01 0a 02 07 01 10 06 33 02 02
E: 15.519882 14 01 07 00 5f 01 0a 02 07 01 0e 06 33 02 02
E: 15.527880 14 01 07 00 62 01 0a 02 07 01 0c 06 33 02 02
E: 15.535880 14 01 07 00 64 01 0a 02 07 01 09 06 33 02 02
E: 15.543880 14 01 07 00 66 01 0a 02 07 01 07 06 33 02 02
E: 15.551880 14 01 07 00 68 01 0b 02 07 01 05 06 34 02 02
E: 15.559874 14 01 07 00 68 01 0b 02 07 01 05 06 34 02 02
E: 15.567880 14 01 07 00 6a 01 0b 02 07 01 03 06 34 02 02
E: 15.575881 14 01 07 00 6c 01 0b 02 07 01 01 06 34 02 02
E: 15.583880 14 01 07 00 6e 01 0b 02 07 01 ff 05 34 02 02
E: 15.591880 14 01 07 00 70 01 0c 02 07 01 fc 05 34 02 02
E: 15.599879 14 01 07 00 72 01 0c 02 07 01 fa 05 34 02 02
E: 15.607880 14 01 07 00 74 01 0c 02 07 01 f8 05 34 02 02
E: 15.615878 14 01 07 00 76 01 0c 02 07 01 f6 05 34 02 02
E: 15.623880 14 01 07 00 77 01 0c 02 07 01 f4 05 34 02 02
E: 15.631879 14 01 07 00 79 01 0d 02 07 01 f2 05 34 02 02
E: 15.639879 14 01 07 00 7b 01 0d 02 07 01 f1 05 35 02 02
E: 15.647880 14 01 07 00 7d 01 0d 02 07 01 ef 05 35 02 02
E: 15.655880 14 01 07 00 7f 01 0d 02 07 01 ed 05 35 02 02
E: 15.663877 14 01 07 00 80 01 0d 02 07 01 eb 05 35 02 02
E: 15.671878 14 01 07 00 82 01 0e 02 07 01 e9 05 35 02 02
E: 15.679873 14 01 07 00 82 01 0e 02 07 01 e9 05 35 02 02
E: 15.687879 14 01 07 00 83 01 0e 02 07 01 e7 05 35 02 02
E: 15.695881 14 01 07 00 85 01 0e 02 07 01 e5 05 35 02 02
E: 15.703881 14 01 07 00 87 01 0e 02 07 01 e3 05 35 02 02
E: 15.711879 14 01 07 00 88 01 0f 02 07 01 e1 05 35 02 02
E: 15.719873 14 01 07 00 88 01 0f 02 07 01 e1 05 35 02 02
E: 15.727880 14 01 07 00 8a 01 0f 02 07 01 df 05 35 02 02
E: 15.735882 14 01 07 00 8c 01 0f 02 07 01 dd 05 35 02 02
E: 15.743878 14 01 07 00 8d 01 0f 02 07 01 db 05 35 02 02
E: 15.751879 14 01 07 00 8f 01 10 02 07 01 da 05 35 02 02
E: 15.759878 14 01 07 00 91 01 10 02 07 01 d8 05 35 02 02
E: 15.767880 14 01 07 00 92 01 10 02 07 01 d6 05 35 02 02
E: 15.775879 14 01 07 00 94 01 10 02 07 01 d4 05 35 02 02
E: 15.783879 14 01 07 00 96 01 11 02 07 01 d2 05 35 02 02
E: 15.791878 14 01 07 00 98 01 11 02 07 01 d0 05 35 02 02
E: 15.799879 14 01 07 00 99 01 11 02 07 01 ce 05 35 02 02
E: 15.807878 14 01 07 00 9b 01 11 02 07 01 cc 05 35 02 02
E: 15.815878 14 01 07 00 9d 01 12 02 07 01 ca 05 35 02 02
E: 15.823878 14 01 07 00 9f 01 12 02 07 01 c8 05 35 02 02
E: 15.831879 14 01 07 00 a0 01 12 02 07 01 c6 05 35 02 02
E: 15.839878 14 01 07 00 a2 01 12 02 07 01 c5 05 36 02 02
E: 15.847878 14 01 07 00 a4 01 13 02 07 01 c3 05 36 02 02
E: 15.855877 14 01 07 00 a6 01 13 02 07 01 c1 05 36 02 02
E: 15.863877 14 01 07 00 a8 01 13 02 07 01 c0 05 36 02 02
E: 15.871878 14 01 07 00 ab 01 14 02 07 01 be 05 36 02 02
E: 15.879878 14 01 07 00 ad 01 14 02 07 01 bd 05 36 02 02
E: 15.887872 14 01 07 00 ad 01 14 02 07 01 bd 05 36 02 02
E: 15.895877 14 01 07 00 af 01 14 02 07 01 bb 05 36 02 02
E: 15.903877 14 01 07 00 b1 01 14 02 07 01 ba 05 36 02 02
E: 15.911877 14 01 07 00 b3 01 15 02 07 01 b9 05 36 02 02
E: 15.919877 14 01 07 00 b6 01 15 02 07 01 b7 05 36 02 02
E: 15.927879 14 01 07 00 b8 01 15 02 07 01 b6 05 36 02 02
E: 15.935876 14 01 07 00 bb 01 16 02 07 01 b5 05 36 02 02
E: 15.943878 14 01 07 00 bd 01 16 02 07 01 b4 05 36 02 02
E: 15.951878 14 01 07 00 c0 01 17 02 07 01 b3 05 36 02 02
E: 15.959877 14 01 07 00 c2 01 17 02 07 01 b2 05 36 02 02
E: 15.967876 14 01 07 00 c4 01 18 02 07 01 b0 05 36 02 02
E: 15.975876 14 01 07 00 c7 01 18 02 07 01 af 05 36 02 02
E: 15.983876 14 01 07 00 c9 01 18 02 07 01 ae 05 36 02 02
E: 15.991877 14 01 07 00 cc 01 19 02 07 01 ad 05 36 02 02
E: 15.999878 14 01 07 00 ce 01 19 02 07 01 ad 05 36 02 02
E: 16.007876 14 01 07 00 d0 01 19 02 07 01 ac 05 36 02 02
E: 16.015878 14 01 07 00 d3 01 1a 02 07 01 ab 05 36 02 02
E: 16.023876 14 01 07 00 d5 01 1a 02 07 01 aa 05 36 02 02
E: 16.031877 14 01 07 00 d7 01 1a 02 07 01 a9 05 36 02 02
E: 16.039877 14 01 07 00 d9 01 1a 02 07 01 a8 05 36 02 02
E: 16.047877 14 01 07 00 db 01 1b 02 07 01 a7 05 36 02 02
E: 16.055871 14 01 07 00 db 01 1b 02 07 01 a7 05 36 02 02
E: 16.063876 14 01 07 00 de 01 1b 02 07 01 a6 05 36 02 02
E: 16.071876 14 01 07 00 e0 01 1b 02 07 01 a5 05 36 02 02
E: 16.079877 14 01 07 00 e2 01 1b 02 07 01 a4 05 36 02 02
E: 16.087875 14 01 07 00 e4 01 1c 02 07 01 a3 05 37 02 02
E: 16.095878 14 01 07 00 e6 01 1c 02 07 01 a2 05 37 02 02
E: 16.103874 14 01 07 00 e8 01 1c 02 07 01 a0 05 37 02 02
E: 16.111877 14 01 07 00 ea 01 1c 02 07 01 9f 05 37 02 02
E: 16.119876 14 01 07 00 ec 01 1d 02 07 01 9e 05 37 02 02
E: 16.127877 14 01 07 00 ee 01 1d 02 07 01 9d 05 37 02 02
E: 16.135877 14 01 07 00 f0 01 1d 02 07 01 9c 05 37 02 02
E: 16.143876 14 01 07 00 f2 01 1e 02 07 01 9b 05 37 02 02
E: 16.151877 14 01 07 00 f4 01 1e 02 07 01 9a 05 37 02 02
E: 16.159877 14 01 07 00 f6 01 1e 02 07 01 98 05 37 02 02
E: 16.167875 14 01 07 00 f8 01 1e 02 07 01 97 05 37 02 02
E: 16.175874 14 01 07 00 fa 01 1e 02 07 01 96 05 38 02 02
E: 16.183876 14 01 07 00 fc 01 1f 02 07 01 95 05 38 02 02
E: 16.191870 14 01 07 00 fc 01 1f 02 07 01 95 05 38 02 02
E: 16.199879 14 01 07 00 fe 01 1f 02 07 01 93 05 38 02 02
E: 16.207878 14 01 07 00 00 02 1f 02 07 01 92 05 38 02 02
E: 16.215879 14 01 07 00 02 02 1f 02 07 01 91 05 38 02 02
E: 16.223825 14 01 07 00 02 02 1f 02 07 01 91 05 38 02 02
E: 16.231873 14 01 07 00 04 02 1f 02 07 01 8f 05 38 02 02
E: 16.239828 14 01 07 00 06 02 1f 02 07 01 8e 05 38 02 02
E: 16.247875 14 01 07 00 08 02 1f 02 07 01 8d 05 38 02 02
E: 16.255877 14 01 07 00 0a 02 1f 02 07 01 8b 05 38 02 02
E: 16.263873 14 01 07 00 0c 02 1f 02 07 01 89 05 39 02 02
E: 16.271875 14 01 07 00 0e 02 20 02 07 01 88 05 39 02 02
E: 16.279874 14 01 07 00 10 02 20 02 07 01 86 05 39 02 02
E: 16.287875 14 01 07 00 13 02 20 02 07 01 85 05 39 02 02
E: 16.295875 14 01 07 00 15 02 1f 02 07 01 83 05 39 02 02
E: 16.303875 14 01 07 00 17 02 20 02 07 01 81 05 39 02 02
E: 16.311875 14 01 07 00 1a 02 20 02 07 01 7f 05 39 02 02
E: 16.319876 14 01 07 00 1c 02 20 02 07 01 7d 05 39 02 02
E: 16.327873 14 01 07 00 1e 02 20 02 07 01 7b 05 39 02 02
E: 16.335874 14 01 07 00 21 02 20 02 07 01 79 05 3a 02 02
E: 16.343873 14 01 07 00 23 02 20 02 07 01 77 05 3a 02 02
E: 16.351876 14 01 07 00 26 02 20 02 07 01 75 05 3a 02 02
E: 16.359874 14 01 07 00 28 02 20 02 07 01 73 05 3a 02 02
E: 16.367873 14 01 07 00 2b 02 20 02 07 01 71 05 3a 02 02
E: 16.375876 14 01 07 00 2d 02 21 02 07 01 6e 05 3a 02 02
E: 16.383876 14 01 07 00 2f 02 21 02 07 01 6c 05 3a 02 02
E: 16.391870 14 01 07 00 2f 02 21 02 07 01 6c 05 3a 02 02
E: 16.399875 14 01 07 00 32 02 22 02 07 01 6a 05 3b 02 02
E: 16.407876 14 01 07 00 34 02 22 02 07 01 68 05 3b 02 02
E: 16.415874 14 01 07 00 37 02 22 02 07 01 65 05 3b 02 02
E: 16.423874 14 01 07 00 39 02 23 02 07 01 63 05 3b 02 02
E: 16.431874 14 01 07 00 3b 02 23 02 07 01 61 05 3b 02 02
E: 16.439872 14 01 07 00 3d 02 24 02 07 01 5f 05 3b 02 02
E: 16.447873 14 01 07 00 3f 02 24 02 07 01 5d 05 3c 02 02
E: 16.455873 14 01 07 00 41 02 24 02 07 01 5a 05 3c 02 02
E: 16.463873 14 01 07 00 43 02 25 02 07 01 58 05 3c 02 02
E: 16.471874 14 01 07 00 45 02 25 02 07 01 56 05 3c 02 02
E: 16.479874 14 01 07 00 47 02 25 02 07 01 54 05 3c 02 02
E: 16.487873 14 01 07 00 49 02 26 02 07 01 52 05 3d 02 02
E: 16.495873 14 01 07 00 4a 02 26 02 07 01 4f 05 3d 02 02
E: 16.503873 14 01 07 00 4c 02 26 02 07 01 4d 05 3d 02 02
E: 16.511874 14 01 07 00 4e 02 27 02 07 01 4a 05 3d 02 02
E: 16.519874 14 01 07 00 4f 02 27 02 07 01 47 05 3d 02 02
E: 16.527875 14 01 07 00 51 02 27 02 07 01 44 05 3e 02 02
E: 16.535874 14 01 07 00 53 02 28 02 07 01 41 05 3e 02 02
E: 16.543873 14 01 07 00 54 02 28 02 07 01 3e 05 3e 02 02
E: 16.551867 14 01 07 00 54 02 28 02 07 01 3e 05 3e 02 02
E: 16.559874 14 01 07 00 56 02 28 02 07 01 3b 05 3e 02 02
E: 16.567872 14 01 07 00 58 02 28 02 07 01 38 05 3e 02 02
E: 16.575873 14 01 07 00 59 02 29 02 07 01 35 05 3f 02 02
E: 16.583873 14 01 07 00 5b 02 29 02 07 01 32 05 3f 02 02
E: 16.591873 14 01 07 00 5d 02 29 02 07 01 2f 05 3f 02 02
E: 16.599874 14 01 07 00 5e 02 2a 02 07 01 2c 05 40 02 02
E: 16.607874 14 01 07 00 60 02 2a 02 07 01 29 05 40 02 02
E: 16.615875 14 01 07 00 62 02 2b 02 07 01 26 05 40 02 02
E: 16.623874 14 01 07 00 63 02 2b 02 07 01 23 05 41 02 02
E: 16.631875 14 01 07 00 66 02 2b 02 07 01 20 05 41 02 02
E: 16.639873 14 01 07 00 67 02 2c 02 07 01 1d 05 41 02 02
E: 16.647872 14 01 07 00 6a 02 2c 02 07 01 1a 05 42 02 02
E: 16.655872 14 01 07 00 6b 02 2d 02 07 01 17 05 42 02 02
E: 16.663872 14 01 07 00 6d 02 2d 02 07 01 13 05 43 02 02
E: 16.671874 14 01 07 00 6f 02 2e 02 07 01 10 05 43 02 02
E: 16.679873 14 01 07 00 71 02 2e 02 07 01 0d 05 43 02 02
E: 16.687871 14 01 07 00 73 02 2e 02 07 01 0a 05 44 02 02
E: 16.695865 14 01 07 00 73 02 2e 02 07 01 0a 05 44 02 02
E: 16.703873 14 01 07 00 76 02 2f 02 07 01 07 05 44 02 02
E: 16.711871 14 01 07 00 77 02 2f 02 07 01 04 05 44 02 02
E: 16.719867 14 01 07 00 77 02 2f 02 07 01 04 05 44 02 02
E: 16.727872 14 01 07 00 7a 02 30 02 07 01 02 05 45 02 02
E: 16.735873 14 01 07 00 7b 02 30 02 07 01 ff 04 45 02 02
E: 16.743871 14 01 07 00 7d 02 31 02 07 01 fc 04 45 02 02
E: 16.751870 14 01 07 00 7f 02 31 02 07 01 f9 04 45 02 02
E: 16.759870 14 01 07 00 81 02 31 02 07 01 f6 04 46 02 02
E: 16.767870 14 01 07 00 83 02 32 02 07 01 f4 04 46 02 02
E: 16.775873 14 01 07 00 84 02 32 02 07 01 f1 04 46 02 02
E: 16.783872 14 01 07 00 86 02 33 02 07 01 ee 04 47 02 02
E: 16.791872 14 01 07 00 88 02 33 02 07 01 eb 04 47 02 02
E: 16.799869 14 01 07 00 8a 02 34 02 07 01 e8 04 47 02 02
E: 16.807869 14 01 07 00 8c 02 34 02 07 01 e5 04 47 02 02
E: 16.815871 14 01 07 00 8e 02 34 02 07 01 e2 04 47 02 02
E: 16.823872 14 01 07 00 8f 02 35 02 07 01 df 04 47 02 02
E: 16.831869 14 01 07 00 91 02 35 02 07 01 dc 04 47 02 02
E: 16.839870 14 01 07 00 93 02 35 02 07 01 d9 04 48 02 02
E: 16.847871 14 01 07 00 95 02 36 02 07 01 d6 04 48 02 02
E: 16.855872 14 01 07 00 97 02 36 02 07 01 d3 04 48 02 02
E: 16.863867 14 01 07 00 98 02 37 02 07 01 d0 04 49 02 02
E: 16.871871 14 01 07 00 9a 02 37 02 07 01 cd 04 49 02 02
E: 16.879871 14 01 07 00 9c 02 37 02 07 01 cb 04 49 02 02
E: 16.887865 14 01 07 00 9c 02 37 02 07 01 cb 04 49 02 02
E: 16.895870 14 01 07 00 9d 02 38 02 07 01 c8 04 49 02 02
E: 16.903871 14 01 07 00 9f 02 38 02 07 01 c5 04 4a 02 02
E: 16.911869 14 01 07 00 a1 02 38 02 07 01 c2 04 4a 02 02
E: 16.919870 14 01 07 00 a2 02 39 02 07 01 c0 04 4a 02 02
E: 16.927871 14 01 07 00 a4 02 39 02 07 01 be 04 4a 02 02
E: 16.935870 14 01 07 00 a6 02 39 02 07 01 bb 04 4b 02 02
E: 16.943870 14 01 07 00 a7 02 3a 02 07 01 b9 04 4b 02 02
E: 16.951871 14 01 07 00 a9 02 3a 02 07 01 b7 04 4b 02 02
E: 16.959870 14 01 07 00 aa 02 3a 02 07 01 b5 04 4c 02 02
E: 16.967871 14 01 07 00 ac 02 3b 02 07 01 b3 04 4c 02 02
E: 16.975868 14 01 07 00 ad 02 3b 02 07 01 b1 04 4c 02 02
E: 16.983870 14 01 07 00 af 02 3b 02 07 01 af 04 4c 02 02
E: 16.991873 14 01 07 00 b0 02 3b 02 07 01 ac 04 4d 02 02
E: 16.999870 14 01 07 00 b2 02 3c 02 07 01 aa 04 4d 02 02
E: 17.007870 14 01 07 00 b4 02 3c 02 07 01 a8 04 4d 02 02
E: 17.015870 14 01 07 00 b5 02 3c 02 07 01 a6 04 4e 02 02
E: 17.023870 14 01 07 00 b7 02 3d 02 07 01 a4 04 4e 02 02
E: 17.031871 14 01 07 00 b8 02 3d 02 07 01 a1 04 4e 02 02
E: 17.039869 14 01 07 00 ba 02 3d 02 07 01 9f 04 4f 02 02
E: 17.047872 14 01 07 00 bb 02 3d 02 07 01 9d 04 4f 02 02
E: 17.055863 14 01 07 00 bb 02 3d 02 07 01 9d 04 4f 02 02
E: 17.063870 14 01 07 00 bc 02 3d 02 07 01 9b 04 4f 02 02
E: 17.071872 14 01 07 00 bd 02 3d 02 07 01 9a 04 4f 02 02
E: 17.079869 14 01 07 00 bf 02 3e 02 07 01 98 04 50 02 02
E: 17.087870 14 01 07 00 c0 02 3e 02 07 01 97 04 50 02 02
E: 17.095870 14 01 07 00 c0 02 3e 02 07 01 95 04 50 02 02
E: 17.103870 14 01 07 00 c1 02 3e 02 07 01 94 04 50 02 02
E: 17.111868 14 01 07 00 c2 02 3e 02 07 01 93 04 51 02 02
E: 17.119870 14 01 07 00 c3 02 3e 02 07 01 92 04 51 02 02
E: 17.127863 14 01 07 00 c3 02 3e 02 07 01 92 04 51 02 02
E: 17.135867 14 01 07 00 c4 02 3f 02 07 01 91 04 51 02 02
E: 17.143868 14 01 07 00 c4 02 3e 02 07 01 90 04 51 02 02
E: 17.151863 14 01 07 00 c4 02 3e 02 07 01 90 04 51 02 02
E: 17.159869 14 01 07 00 c4 02 3f 02 07 01 8f 04 51 02 02
E: 17.167870 14 01 07 00 c5 02 3f 02 07 01 8f 04 51 02 02
E: 17.175861 14 01 07 00 c5 02 3f 02 07 01 8f 04 51 02 02
E: 17.183868 14 01 07 00 c6 02 3f 02 07 01 8e 04 51 02 02
E: 17.191861 14 01 07 00 c6 02 3f 02 07 01 8e 04 51 02 02
E: 17.199862 14 01 07 00 c6 02 3f 02 07 01 8e 04 51 02 02
E: 17.207869 14 01 07 00 c6 02 3f 02 07 01 8d 04 51 02 02
E: 17.215869 14 01 07 00 c6 02 3f 02 07 01 8d 04 52 02 02
E: 17.223864 14 01 07 00 c6 02 3f 02 07 01 8d 04 52 02 02
E: 17.231863 14 01 07 00 c6 02 3f 02 07 01 8d 04 52 02 02
E: 17.239869 14 01 07 00 c6 02 3f 02 07 01 8c 04 52 02 02
E: 17.247863 14 01 07 00 c6 02 3f 02 07 01 8c 04 52 02 02
E: 17.255861 14 01 07 00 c6 02 3f 02 07 01 8c 04 52 02 02
E: 17.263859 14 01 07 00 c6 02 3f 02 07 01 8c 04 52 02 02
E: 17.271869 14 01 07 00 c7 02 3f 02 07 01 8c 04 52 02 02
E: 17.279859 14 01 07 00 c7 02 3f 02 07 01 8c 04 52 02 02
E: 17.287862 14 01 07 00 c7 02 3f 02 07 01 8c 04 52 02 02
E: 17.295862 14 01 07 00 c7 02 3f 02 07 01 8c 04 52 02 02
E: 17.303862 14 01 07 00 c7 02 3f 02 07 01 8c 04 52 02 02
E: 17.311862 14 01 07 00 c7 02 3f 02 07 01 8c 04 52 02 02
E: 17.319862 14 01 07 00 c7 02 3f 02 07 01 8c 04 52 02 02
E: 17.327862 14 01 07 00 c7 02 3f 02 07 01 8c 04 52 02 02
E: 17.335870 14 01 07 00 c7 02 3f 02 07 01 8b 04 52 02 02
E: 17.343861 14 01 07 00 c7 02 3f 02 07 01 8b 04 52 02 02
E: 17.351862 14 01 07 00 c7 02 3f 02 07 01 8b 04 52 02 02
E: 17.359862 14 01 07 00 c7 02 3f 02 07 01 8b 04 52 02 02
E: 17.367860 14 01 07 00 c7 02 3f 02 07 01 8b 04 52 02 02
E: 17.375867 14 01 07 00 c8 02 3f 02 07 01 8b 04 52 02 02
E: 17.383861 14 01 07 00 c8 02 3f 02 07 01 8b 04 52 02 02
E: 17.391862 14 01 07 00 c8 02 3f 02 07 01 8b 04 52 02 02
E: 17.399862 14 01 07 00 c8 02 3f 02 07 01 8b 04 52 02 02
E: 17.407861 14 01 07 00 c8 02 3f 02 07 01 8b 04 52 02 02
E: 17.415861 14 01 07 00 c8 02 3f 02 07 01 8b 04 52 02 02
E: 17.423868 14 01 07 00 c8 02 3f 02 07 01 8a 04 52 02 02
E: 17.431863 14 01 07 00 c8 02 3f 02 07 01 8a 04 52 02 02
E: 17.439860 14 01 07 00 c8 02 3f 02 07 01 8a 04 52 02 02
E: 17.447861 14 01 07 00 c8 02 3f 02 07 01 8a 04 52 02 02
E: 17.455860 14 01 07 00 c8 02 3f 02 07 01 8a 04 52 02 02
E: 17.463861 14 01 07 00 c8 02 3f 02 07 01 8a 04 52 02 02
E: 17.471861 14 01 07 00 c8 02 3f 02 07 01 8a 04 52 02 02
E: 17.479864 14 01 07 00 c8 02 3f 02 07 01 8a 04 52 02 02
E: 17.487865 14 01 07 00 c8 02 3f 02 07 01 8a 04 52 02 02
E: 17.495864 14 01 07 00 c8 02 3f 02 07 01 8a 04 52 02 02
E: 17.503861 14 01 07 00 c8 02 3f 02 07 01 8a 04 52 02 02
E: 17.511859 14 01 07 00 c8 02 3f 02 07 01 8a 04 52 02 02
E: 17.519863 14 01 07 00 c8 02 3f 02 07 01 8a 04 52 02 02
E: 17.527859 14 01 07 00 c8 02 3f 02 07 01 8a 04 52 02 02
E: 17.535863 14 01 07 00 c8 02 3f 02 07 01 8a 04 52 02 02
E: 17.543861 14 01 07 00 c8 02 3f 02 07 01 8a 04 52 02 02
E: 17.551861 14 01 07 00 c8 02 3f 02 07 01 8a 04 52 02 02
E: 17.559860 14 01 07 00 c8 02 3f 02 07 01 8a 04 52 02 02
E: 17.567860 14 01 07 00 c8 02 3f 02 07 01 8a 04 52 02 02
E: 17.575867 14 01 07 00 c9 02 3f 02 07 01 8a 04 52 02 02
E: 17.583867 14 01 07 00 c8 02 3f 02 07 01 8a 04 51 02 02
E: 17.591867 14 01 07 00 c9 02 3f 02 07 01 8a 04 51 02 02
E: 17.599865 14 01 07 00 c8 02 3f 02 07 01 8a 04 51 02 02
E: 17.607859 14 01 07 00 c8 02 3f 02 07 01 8a 04 51 02 02
E: 17.615860 14 01 07 00 c8 02 3f 02 07 01 8a 04 51 02 02
E: 17.623858 14 01 07 00 c8 02 3f 02 07 01 8a 04 51 02 02
E: 17.631860 14 01 07 00 c8 02 3f 02 07 01 8a 04 51 02 02
E: 17.639860 14 01 07 00 c8 02 3f 02 07 01 8a 04 51 02 02
E: 17.647861 14 01 07 00 c8 02 3f 02 07 01 8a 04 51 02 02
E: 17.655859 14 01 07 00 c8 02 3f 02 07 01 8a 04 51 02 02
E: 17.663860 14 01 07 00 c8 02 3f 02 07 01 8a 04 51 02 02
E: 17.671860 14 01 07 00 c8 02 3f 02 07 01 8a 04 51 02 02
E: 17.679859 14 01 07 00 c8 02 3f 02 07 01 8a 04 51 02 02
E: 17.687858 14 01 07 00 c8 02 3f 02 07 01 8a 04 51 02 02
E: 17.695860 14 01 07 00 c8 02 3f 02 07 01 8a 04 51 02 02
E: 17.703860 14 01 07 00 c8 02 3f 02 07 01 8a 04 51 02 02
E: 17.711859 14 01 07 00 c8 02 3f 02 07 01 8a 04 51 02 02
E: 17.719860 14 01 07 00 c8 02 3f 02 07 01 8a 04 51 02 02
E: 17.727860 14 01 07 00 c8 02 3f 02 07 01 8a 04 51 02 02
E: 17.735860 14 01 07 00 c8 02 3f 02 07 01 8a 04 51 02 02
E: 17.743865 14 01 07 00 c8 02 3e 02 07 01 8a 04 51 02 02
E: 17.751856 14 01 07 00 c8 02 3e 02 07 01 8a 04 51 02 02
E: 17.759859 14 01 07 00 c8 02 3e 02 07 01 8a 04 51 02 02
E: 17.767860 14 01 07 00 c8 02 3e 02 07 01 8a 04 51 02 02
E: 17.775859 14 01 07 00 c8 02 3e 02 07 01 8a 04 51 02 02
E: 17.783858 14 01 07 00 c8 02 3e 02 07 01 8a 04 51 02 02
E: 17.791859 14 01 07 00 c8 02 3e 02 07 01 8a 04 51 02 02
E: 17.799858 14 01 07 00 c8 02 3e 02 07 01 8a 04 51 02 02
E: 17.807866 14 01 07 00 c8 02 3e 02 07 01 8b 04 51 02 02
E: 17.815859 14 01 07 00 c8 02 3e 02 07 01 8b 04 51 02 02
E: 17.823858 14 01 07 00 c8 02 3e 02 07 01 8b 04 51 02 02
E: 17.831858 14 01 07 00 c8 02 3e 02 07 01 8b 04 51 02 02
E: 17.839856 14 01 07 00 c8 02 3e 02 07 01 8b 04 51 02 02
E: 17.847860 14 01 07 00 c8 02 3e 02 07 01 8b 04 51 02 02
E: 17.855858 14 01 07 00 c8 02 3e 02 07 01 8b 04 51 02 02
E: 17.863855 14 01 07 00 c8 02 3e 02 07 01 8b 04 51 02 02
E: 17.871861 14 01 07 00 c8 02 3e 02 07 01 8b 04 51 02 02
E: 17.879865 14 01 06 00 c8 02 3e 02 07 01 8b 04 51 02 02
E: 17.887871 14 01 06 00 c8 02 3e 02 07 01 8b 04 51 02 02
E: 17.895858 14 01 06 00 c8 02 3e 02 07 01 8b 04 51 02 02
E: 17.903857 14 01 07 01 8b 04 51 02 00 01 8b 04 51 02 01
E: 17.911860 14 01 07 01 8b 04 51 02 00 01 8b 04 51 02 01
E: 17.919855 14 01 07 01 8b 04 51 02 00 01 8b 04 51 02 01
E: 17.927855 14 01 07 01 8b 04 51 02 00 01 8b 04 51 02 01
E: 17.935856 14 01 07 01 8b 04 51 02 00 01 8b 04 51 02 01
E: 17.943859 14 01 07 01 8b 04 51 02 00 01 8b 04 51 02 01
E: 17.951857 14 01 07 01 8b 04 51 02 00 01 8b 04 51 02 01
E: 17.959857 14 01 07 01 8b 04 51 02 00 01 8b 04 51 02 01
E: 17.967853 14 01 07 01 8b 04 51 02 00 01 8b 04 51 02 01
E: 17.975856 14 01 07 01 8b 04 51 02 00 01 8b 04 51 02 01
E: 17.983808 14 01 07 01 8b 04 51 02 00 01 8b 04 51 02 01
E: 17.991856 14 01 07 01 8b 04 51 02 00 01 8b 04 51 02 01
E: 17.999856 14 01 07 01 8b 04 51 02 00 01 8b 04 51 02 01
E: 18.007856 14 01 07 01 8b 04 51 02 00 01 8b 04 51 02 01
E: 18.015856 14 01 07 01 8b 04 51 02 00 01 8b 04 51 02 01
E: 18.023857 14 01 07 01 8b 04 51 02 00 01 8b 04 51 02 01
E: 18.031856 14 01 07 01 8b 04 51 02 00 01 8b 04 51 02 01
E: 18.039855 14 01 07 01 8b 04 51 02 00 01 8b 04 51 02 01
E: 18.047857 14 01 07 01 8b 04 51 02 00 01 8b 04 51 02 01
E: 18.055855 14 01 07 01 8b 04 51 02 00 01 8b 04 51 02 01
E: 18.063856 14 01 07 01 8b 04 51 02 00 01 8b 04 51 02 01
E: 18.071857 14 01 07 01 8b 04 51 02 00 01 8b 04 51 02 01
E: 18.079855 14 01 07 01 8b 04 51 02 00 01 8b 04 51 02 01
E: 18.087856 14 01 07 01 8b 04 51 02 00 01 8b 04 51 02 01
E: 18.095855 14 01 07 01 8b 04 51 02 00 01 8b 04 51 02 01
E: 18.103855 14 01 07 01 8b 04 51 02 00 01 8b 04 51 02 01
E: 18.111855 14 01 07 01 8b 04 51 02 00 01 8b 04 51 02 01
E: 18.119855 14 01 07 01 8b 04 51 02 00 01 8b 04 51 02 01
E: 18.127855 14 01 07 01 8b 04 51 02 00 01 8b 04 51 02 01
E: 18.135853 14 01 07 01 8b 04 51 02 00 01 8b 04 51 02 01
E: 18.143856 14 01 07 01 8b 04 51 02 00 01 8b 04 51 02 01
E: 18.151855 14 01 07 01 8b 04 51 02 00 01 8b 04 51 02 01
E: 18.159856 14 01 07 01 8b 04 51 02 00 01 8b 04 51 02 01
E: 18.167852 14 01 07 01 8b 04 51 02 00 01 8b 04 51 02 01
E: 18.175856 14 01 07 01 8b 04 51 02 00 01 8b 04 51 02 01
E: 18.183807 14 01 07 01 8b 04 51 02 00 01 8b 04 51 02 01
E: 18.191854 14 01 07 01 8b 04 51 02 00 01 8b 04 51 02 01
E: 18.199854 14 01 07 01 8b 04 51 02 00 01 8b 04 51 02 01
E: 18.207853 14 01 07 01 8b 04 51 02 00 01 8b 04 51 02 01
E: 18.215853 14 01 07 01 8b 04 51 02 00 01 8b 04 51 02 01
E: 18.223855 14 01 07 01 8b 04 51 02 00 01 8b 04 51 02 01
E: 18.231853 14 01 07 01 8b 04 51 02 00 01 8b 04 51 02 01
E: 18.239855 14 01 07 01 8b 04 51 02 00 01 8b 04 51 02 01
E: 18.247855 14 01 07 01 8b 04 51 02 00 01 8b 04 51 02 01
E: 18.255855 14 01 07 01 8b 04 51 02 00 01 8b 04 51 02 01
E: 18.263854 14 01 07 01 8b 04 51 02 00 01 8b 04 51 02 01
E: 18.271855 14 01 07 01 8b 04 51 02 00 01 8b 04 51 02 01
E: 18.279853 14 01 07 01 8b 04 51 02 00 01 8b 04 51 02 01
E: 18.287809 14 01 07 01 8b 04 51 02 00 01 8b 04 51 02 01
E: 18.295854 14 01 07 01 8b 04 51 02 00 01 8b 04 51 02 01
E: 18.303853 14 01 07 01 8b 04 51 02 00 01 8b 04 51 02 01
E: 18.311845 14 01 07 01 8b 04 51 02 00 01 8b 04 51 02 01
E: 18.319853 14 01 07 01 8b 04 51 02 00 01 8b 04 51 02 01
E: 18.327854 14 01 07 01 8b 04 51 02 00 01 8b 04 51 02 01
E: 18.335853 14 01 07 01 8b 04 51 02 00 01 8b 04 51 02 01
E: 18.343854 14 01 07 01 8b 04 51 02 00 01 8b 04 51 02 01
E: 18.351854 14 01 07 01 8b 04 51 02 00 01 8b 04 51 02 01
E: 18.359855 14 01 07 01 8b 04 51 02 00 01 8b 04 51 02 01
E: 18.367851 14 01 07 01 8b 04 51 02 00 01 8b 04 51 02 01
E: 18.375854 14 01 07 01 8b 04 51 02 00 01 8b 04 51 02 01
E: 18.383806 14 01 07 01 8b 04 51 02 00 01 8b 04 51 02 01
E: 18.391856 14 01 07 01 8b 04 51 02 00 01 8b 04 51 02 01
E: 18.399854 14 01 07 01 8b 04 51 02 00 01 8b 04 51 02 01
E: 18.407857 14 01 07 01 8b 04 51 02 00 01 8b 04 51 02 01
E: 18.415854 14 01 07 01 8b 04 51 02 00 01 8b 04 51 02 01
E: 18.423854 14 01 07 01 8b 04 51 02 00 01 8b 04 51 02 01
E: 18.431853 14 01 07 01 8b 04 51 02 00 01 8b 04 51 02 01
E: 18.439853 14 01 07 01 8b 04 51 02 00 01 8b 04 51 02 01
E: 18.447853 14 01 07 01 8b 04 51 02 00 01 8b 04 51 02 01
E: 18.455852 14 01 07 01 8b 04 51 02 00 01 8b 04 51 02 01
E: 18.463852 14 01 07 01 8b 04 51 02 00 01 8b 04 51 02 01
E: 18.471853 14 01 07 01 8b 04 51 02 00 01 8b 04 51 02 01
E: 18.479852 14 01 07 01 8b 04 51 02 00 01 8b 04 51 02 01
E: 18.487851 14 01 07 01 8b 04 51 02 00 01 8b 04 51 02 01
E: 18.495853 14 01 07 01 8b 04 51 02 00 01 8b 04 51 02 01
E: 18.503854 14 01 07 01 8b 04 51 02 00 01 8b 04 51 02 01
E: 18.511853 14 01 07 01 8b 04 51 02 00 01 8b 04 51 02 01
E: 18.519852 14 01 07 01 8b 04 51 02 00 01 8b 04 51 02 01
E: 18.527852 14 01 07 01 8b 04 51 02 00 01 8b 04 51 02 01
E: 18.535851 14 01 07 01 8b 04 51 02 00 01 8b 04 51 02 01
E: 18.543852 14 01 07 01 8b 04 51 02 00 01 8b 04 51 02 01
E: 18.551852 14 01 07 01 8b 04 51 02 00 01 8b 04 51 02 01
E: 18.559850 14 01 07 01 8b 04 51 02 00 01 8b 04 51 02 01
E: 18.567852 14 01 07 01 8b 04 51 02 00 01 8b 04 51 02 01
E: 18.575851 14 01 07 01 8b 04 51 02 00 01 8b 04 51 02 01
E: 18.583853 14 01 07 01 8b 04 51 02 00 01 8b 04 51 02 01
E: 18.591852 14 01 07 01 8b 04 51 02 00 01 8b 04 51 02 01
E: 18.599849 14 01 07 01 8b 04 51 02 00 01 8b 04 51 02 01
E: 18.607854 14 01 07 01 8b 04 51 02 00 01 8b 04 51 02 01
E: 18.615854 14 01 07 01 8b 04 51 02 00 01 8b 04 51 02 01
E: 18.623852 14 01 07 01 8b 04 51 02 00 01 8b 04 51 02 01
E: 18.631852 14 01 07 01 8b 04 51 02 00 01 8b 04 51 02 01
E: 18.639851 14 01 07 01 8b 04 51 02 00 01 8b 04 51 02 01
E: 18.647850 14 01 07 01 8b 04 51 02 00 01 8b 04 51 02 01
E: 18.655853 14 01 07 01 8b 04 51 02 00 01 8b 04 51 02 01
E: 18.663850 14 01 07 01 8b 04 51 02 00 01 8b 04 51 02 01
E: 18.671850 14 01 07 01 8b 04 51 02 00 01 8b 04 51 02 01
E: 18.679851 14 01 07 01 8b 04 51 02 00 01 8b 04 51 02 01
E: 18.687850 14 01 07 01 8b 04 51 02 00 01 8b 04 51 02 01
E: 18.695851 14 01 07 01 8b 04 51 02 00 01 8b 04 51 02 01
E: 18.703852 14 01 07 01 8b 04 51 02 00 01 8b 04 51 02 01
E: 18.711849 14 01 07 01 8b 04 51 02 00 01 8b 04 51 02 01
E: 18.719853 14 01 07 01 8b 04 51 02 00 01 8b 04 51 02 01
E: 18.727850 14 01 07 01 8b 04 51 02 00 01 8b 04 51 02 01
E: 18.735851 14 01 07 01 8b 04 51 02 00 01 8b 04 51 02 01
E: 18.743850 14 01 07 01 8b 04 51 02 00 01 8b 04 51 02 01
E: 18.751850 14 01 07 01 8b 04 51 02 00 01 8b 04 51 02 01
E: 18.759854 14 01 07 01 8b 04 51 02 00 01 8b 04 51 02 01
E: 18.767852 14 01 07 01 8b 04 51 02 00 01 8b 04 51 02 01
E: 18.775853 14 01 07 01 8b 04 51 02 00 01 8b 04 51 02 01
E: 18.783851 14 01 07 01 8b 04 51 02 00 01 8b 04 51 02 01
E: 18.791850 14 01 07 01 8b 04 51 02 00 01 8b 04 51 02 01
E: 18.799853 14 01 07 01 8b 04 51 02 00 01 8b 04 51 02 01
E: 18.807851 14 01 07 01 8b 04 51 02 00 01 8b 04 51 02 01
E: 18.815851 14 01 07 01 8b 04 51 02 00 01 8b 04 51 02 01
E: 18.823851 14 01 07 01 8b 04 51 02 00 01 8b 04 51 02 01
E: 18.831851 14 01 07 01 8b 04 51 02 00 01 8b 04 51 02 01
E: 18.839853 14 01 07 01 8b 04 51 02 00 01 8b 04 51 02 01
E: 18.847850 14 01 07 01 8b 04 51 02 00 01 8b 04 51 02 01
E: 18.855853 14 01 07 01 8b 04 51 02 00 01 8b 04 51 02 01
E: 18.863847 14 01 07 01 8b 04 51 02 00 01 8b 04 51 02 01
E: 18.871850 14 01 07 01 8b 04 51 02 00 01 8b 04 51 02 01
E: 18.879850 14 01 07 01 8b 04 51 02 00 01 8b 04 51 02 01
E: 18.887850 14 01 07 01 8b 04 51 02 00 01 8b 04 51 02 01
E: 18.895849 14 01 07 01 8b 04 51 02 00 01 8b 04 51 02 01
E: 18.903850 14 01 07 01 8b 04 51 02 00 01 8b 04 51 02 01
E: 18.911850 14 01 07 01 8b 04 51 02 00 01 8b 04 51 02 01
E: 18.919850 14 01 07 01 8b 04 51 02 00 01 8b 04 51 02 01
E: 18.927850 14 01 07 01 8b 04 51 02 00 01 8b 04 51 02 01
E: 18.935851 14 01 07 01 8b 04 51 02 00 01 8b 04 51 02 01
E: 18.943850 14 01 07 01 8b 04 51 02 00 01 8b 04 51 02 01
E: 18.951850 14 01 07 01 8b 04 51 02 00 01 8b 04 51 02 01
E: 18.959849 14 01 07 01 8b 04 51 02 00 01 8b 04 51 02 01
E: 18.967850 14 01 07 01 8b 04 51 02 00 01 8b 04 51 02 01
E: 18.975849 14 01 07 01 8b 04 51 02 00 01 8b 04 51 02 01
E: 18.983850 14 01 07 01 8b 04 51 02 00 01 8b 04 51 02 01
E: 18.991850 14 01 07 01 8b 04 51 02 00 01 8b 04 51 02 01
E: 18.999857 14 01 06 01 8b 04 51 02 00 01 8b 04 51 02 01
# 3. Finally, move your ten fingers on the screen and release them.
E: 36.543750 14 01 07 01 a1 05 52 01 07 00 c3 01 15 01 02
E: 36.551672 14 01 07 01 a1 05 52 01 07 00 c3 01 15 01 02
E: 36.559742 14 01 07 01 a1 05 52 01 07 00 c1 01 15 01 02
E: 36.567728 14 01 07 01 a1 05 52 01 07 00 c1 01 15 01 02
E: 36.575731 14 01 07 01 a1 05 52 01 07 00 c1 01 15 01 02
E: 36.583689 14 01 07 01 a1 05 52 01 07 00 c1 01 15 01 02
E: 36.591731 14 01 07 01 a1 05 52 01 07 00 c1 01 15 01 02
E: 36.599737 14 01 07 01 a1 05 52 01 07 00 c1 01 16 01 02
E: 36.607731 14 01 07 01 a1 05 52 01 07 00 c1 01 16 01 02
E: 36.615731 14 01 07 01 a1 05 52 01 07 00 c1 01 16 01 02
E: 36.623730 14 01 07 01 a1 05 52 01 07 00 c1 01 16 01 02
E: 36.631737 14 01 07 01 a1 05 52 01 07 00 c2 01 16 01 02
E: 36.639732 14 01 07 01 a1 05 52 01 07 00 c2 01 16 01 02
E: 36.647730 14 01 07 01 a1 05 52 01 07 00 c2 01 16 01 02
E: 36.655731 14 01 07 01 a1 05 52 01 07 00 c2 01 16 01 02
E: 36.663730 14 01 07 01 a1 05 52 01 07 00 c2 01 16 01 02
E: 36.671731 14 01 07 01 a1 05 52 01 07 00 c2 01 16 01 02
E: 36.679731 14 01 07 01 a1 05 52 01 07 00 c2 01 16 01 02
E: 36.687731 14 01 07 01 a1 05 52 01 07 00 c2 01 16 01 02
E: 36.695730 14 01 07 01 a1 05 52 01 07 00 c2 01 16 01 02
E: 36.703730 14 01 07 01 a1 05 52 01 07 00 c2 01 16 01 02
E: 36.711730 14 01 07 01 a1 05 52 01 07 00 c2 01 16 01 02
E: 36.719685 14 01 07 01 a1 05 52 01 07 00 c2 01 16 01 02
E: 36.727730 14 01 07 01 a1 05 52 01 07 00 c2 01 16 01 02
E: 36.735729 14 01 07 01 a1 05 52 01 07 00 c2 01 16 01 02
E: 36.743731 14 01 07 01 a1 05 52 01 07 00 c2 01 16 01 02
E: 36.751729 14 01 07 01 a1 05 52 01 07 00 c2 01 16 01 02
E: 36.759737 14 01 07 01 a1 05 53 01 07 00 c2 01 16 01 02
E: 36.767728 14 01 07 01 a1 05 53 01 07 00 c2 01 16 01 02
E: 36.775730 14 01 07 01 a1 05 53 01 07 00 c2 01 16 01 02
E: 36.783728 14 01 07 01 a1 05 53 01 07 00 c2 01 16 01 02
E: 36.791732 14 01 07 01 a1 05 53 01 07 00 c2 01 16 01 02
E: 36.799731 14 01 07 01 a1 05 53 01 07 00 c2 01 16 01 02
E: 36.807728 14 01 07 01 a1 05 53 01 07 00 c2 01 16 01 02
E: 36.815730 14 01 07 01 a1 05 53 01 07 00 c2 01 16 01 02
E: 36.823730 14 01 07 01 a1 05 53 01 07 00 c2 01 16 01 02
E: 36.831729 14 01 07 01 a1 05 53 01 07 00 c2 01 16 01 02
E: 36.839730 14 01 07 01 a1 05 53 01 07 00 c2 01 16 01 02
E: 36.847728 14 01 07 01 a1 05 53 01 07 00 c2 01 16 01 02
E: 36.855728 14 01 07 01 a1 05 53 01 07 00 c2 01 16 01 02
E: 36.863726 14 01 07 01 a1 05 53 01 07 00 c2 01 16 01 02
E: 36.871732 14 01 07 01 a1 05 53 01 07 00 c2 01 16 01 02
E: 36.879734 14 01 07 01 a1 05 53 01 07 00 c2 01 15 01 02
E: 36.887730 14 01 07 01 a1 05 53 01 07 00 c2 01 15 01 02
E: 36.895729 14 01 07 01 a1 05 53 01 07 00 c2 01 15 01 02
E: 36.903727 14 01 07 01 a1 05 53 01 07 00 c2 01 15 01 02
E: 36.911727 14 01 07 01 a1 05 53 01 07 00 c2 01 15 01 02
E: 36.919729 14 01 07 01 a1 05 53 01 07 00 c2 01 15 01 02
E: 36.927728 14 01 07 01 a1 05 53 01 07 00 c2 01 15 01 02
E: 36.935728 14 01 07 01 a1 05 53 01 07 00 c2 01 15 01 02
E: 36.943729 14 01 07 01 a1 05 53 01 07 00 c2 01 15 01 02
E: 36.951729 14 01 07 01 a1 05 53 01 07 00 c2 01 15 01 02
E: 36.959727 14 01 07 01 a1 05 53 01 07 00 c2 01 15 01 02
E: 36.967728 14 01 07 01 a1 05 53 01 07 00 c2 01 15 01 02
E: 36.975728 14 01 07 01 a1 05 53 01 07 00 c2 01 15 01 02
E: 36.983686 14 01 07 01 a1 05 53 01 07 00 c2 01 15 01 02
E: 36.991727 14 01 07 01 a1 05 53 01 07 00 c2 01 15 01 02
E: 36.999729 14 01 07 01 a1 05 53 01 07 00 c2 01 15 01 02
E: 37.007729 14 01 07 01 a1 05 53 01 07 00 c2 01 15 01 02
E: 37.015728 14 01 07 01 a1 05 53 01 07 00 c2 01 15 01 02
E: 37.023728 14 01 07 01 a1 05 53 01 07 00 c2 01 15 01 02
E: 37.031727 14 01 07 01 a1 05 53 01 07 00 c2 01 15 01 02
E: 37.039735 14 01 07 01 a1 05 53 01 07 00 c2 01 14 01 02
E: 37.047728 14 01 07 01 a1 05 53 01 07 00 c2 01 14 01 02
E: 37.055726 14 01 07 01 a1 05 53 01 07 00 c2 01 14 01 02
E: 37.063729 14 01 07 01 a1 05 53 01 07 00 c2 01 14 01 02
E: 37.071726 14 01 07 01 a1 05 53 01 07 00 c2 01 14 01 02
E: 37.079729 14 01 07 01 a1 05 53 01 07 00 c2 01 14 01 02
E: 37.087727 14 01 07 01 a1 05 53 01 07 00 c2 01 14 01 02
E: 37.095728 14 01 07 01 a1 05 53 01 07 00 c2 01 14 01 02
E: 37.103725 14 01 07 01 a1 05 53 01 07 00 c2 01 14 01 02
E: 37.111728 14 01 07 01 a1 05 53 01 07 00 c2 01 14 01 02
E: 37.119729 14 01 07 01 a1 05 53 01 07 00 c2 01 14 01 02
E: 37.127727 14 01 07 01 a1 05 53 01 07 00 c2 01 14 01 02
E: 37.135727 14 01 07 01 a1 05 53 01 07 00 c2 01 14 01 02
E: 37.143727 14 01 07 01 a1 05 53 01 07 00 c2 01 14 01 02
E: 37.151734 14 01 07 01 a1 05 52 01 07 00 c2 01 14 01 02
E: 37.159727 14 01 07 01 a1 05 52 01 07 00 c2 01 14 01 02
E: 37.167727 14 01 07 01 a1 05 52 01 07 00 c2 01 14 01 02
E: 37.175729 14 01 07 01 a1 05 52 01 07 00 c2 01 14 01 02
E: 37.183733 14 01 07 01 a1 05 52 01 07 00 c2 01 13 01 02
E: 37.191728 14 01 07 01 a1 05 52 01 07 00 c2 01 13 01 02
E: 37.199726 14 01 07 01 a1 05 52 01 07 00 c2 01 13 01 02
E: 37.207728 14 01 07 01 a1 05 52 01 07 00 c2 01 13 01 02
E: 37.215725 14 01 07 01 a1 05 52 01 07 00 c2 01 13 01 02
E: 37.223727 14 01 07 01 a1 05 52 01 07 00 c2 01 13 01 02
E: 37.231727 14 01 07 01 a1 05 52 01 07 00 c2 01 13 01 02
E: 37.239734 14 01 07 01 a0 05 52 01 07 00 c2 01 13 01 02
E: 37.247727 14 01 07 01 a0 05 52 01 07 00 c2 01 13 01 02
E: 37.255728 14 01 07 01 a0 05 52 01 07 00 c2 01 13 01 02
E: 37.263727 14 01 07 01 a0 05 52 01 07 00 c2 01 13 01 02
E: 37.271729 14 01 07 01 a0 05 52 01 07 00 c2 01 13 01 02
E: 37.279728 14 01 07 01 a0 05 52 01 07 00 c2 01 13 01 02
E: 37.287727 14 01 07 01 a0 05 52 01 07 00 c2 01 13 01 02
E: 37.295727 14 01 07 01 a0 05 52 01 07 00 c2 01 13 01 02
E: 37.303727 14 01 07 01 a0 05 52 01 07 00 c2 01 13 01 02
E: 37.311727 14 01 07 01 a0 05 52 01 07 00 c2 01 13 01 02
E: 37.319728 14 01 07 01 a0 05 52 01 07 00 c2 01 13 01 02
E: 37.327727 14 01 07 01 a0 05 52 01 07 00 c2 01 13 01 02
E: 37.335728 14 01 07 01 a0 05 52 01 07 00 c2 01 13 01 02
E: 37.343726 14 01 07 01 a0 05 52 01 07 00 c2 01 13 01 02
E: 37.351725 14 01 07 01 a0 05 52 01 07 00 c2 01 13 01 02
E: 37.359726 14 01 07 01 a0 05 52 01 07 00 c2 01 13 01 02
E: 37.367726 14 01 07 01 a0 05 52 01 07 00 c2 01 13 01 02
E: 37.375728 14 01 07 01 a0 05 52 01 07 00 c2 01 13 01 02
E: 37.383728 14 01 07 01 a0 05 52 01 07 00 c2 01 13 01 02
E: 37.391726 14 01 07 01 a0 05 52 01 07 00 c2 01 13 01 02
E: 37.399727 14 01 07 01 a0 05 52 01 07 00 c2 01 13 01 02
E: 37.407726 14 01 07 01 a0 05 52 01 07 00 c2 01 13 01 02
E: 37.415727 14 01 07 01 a0 05 52 01 07 00 c2 01 13 01 02
E: 37.423726 14 01 07 01 a0 05 52 01 07 00 c2 01 13 01 02
E: 37.431727 14 01 07 01 a0 05 52 01 07 00 c2 01 13 01 02
E: 37.439726 14 01 07 01 a0 05 52 01 07 00 c2 01 13 01 02
E: 37.447726 14 01 07 01 a0 05 52 01 07 00 c2 01 13 01 02
E: 37.455726 14 01 07 01 a0 05 52 01 07 00 c2 01 13 01 02
E: 37.463726 14 01 07 01 a0 05 52 01 07 00 c2 01 13 01 02
E: 37.471727 14 01 07 01 a0 05 52 01 07 00 c2 01 13 01 02
E: 37.479724 14 01 07 01 a0 05 52 01 07 00 c2 01 13 01 02
E: 37.487724 14 01 07 01 a0 05 52 01 07 00 c2 01 13 01 02
E: 37.495728 14 01 07 01 a0 05 52 01 07 00 c2 01 13 01 02
E: 37.503724 14 01 07 01 a0 05 52 01 07 00 c2 01 13 01 02
E: 37.511726 14 01 07 01 a0 05 52 01 07 00 c2 01 13 01 02
E: 37.519725 14 01 07 01 a0 05 52 01 07 00 c2 01 13 01 02
E: 37.527726 14 01 07 01 a0 05 52 01 07 00 c2 01 13 01 02
E: 37.535726 14 01 07 01 a0 05 52 01 07 00 c2 01 13 01 02
E: 37.543726 14 01 07 01 a0 05 52 01 07 00 c2 01 13 01 02
E: 37.551725 14 01 07 01 a0 05 52 01 07 00 c2 01 13 01 02
E: 37.559726 14 01 07 01 a0 05 52 01 07 00 c2 01 13 01 02
E: 37.567724 14 01 07 01 a0 05 52 01 07 00 c2 01 13 01 02
E: 37.575726 14 01 07 01 a0 05 52 01 07 00 c2 01 13 01 02
E: 37.583725 14 01 07 01 a0 05 52 01 07 00 c2 01 13 01 02
E: 37.591725 14 01 07 01 a0 05 52 01 07 00 c2 01 13 01 02
E: 37.599725 14 01 07 01 a0 05 52 01 07 00 c2 01 13 01 02
E: 37.607726 14 01 07 01 a0 05 52 01 07 00 c2 01 13 01 02
E: 37.615725 14 01 07 01 a0 05 52 01 07 00 c2 01 13 01 02
E: 37.623724 14 01 07 01 a0 05 52 01 07 00 c2 01 13 01 02
E: 37.631725 14 01 07 01 a0 05 52 01 07 00 c2 01 13 01 02
E: 37.639725 14 01 07 01 a0 05 52 01 07 00 c2 01 13 01 02
E: 37.647723 14 01 07 01 a0 05 52 01 07 00 c2 01 13 01 02
E: 37.655725 14 01 07 01 a0 05 52 01 07 00 c2 01 13 01 02
E: 37.663725 14 01 07 01 a0 05 52 01 07 00 c2 01 13 01 02
E: 37.671734 14 01 07 01 a0 05 52 01 07 00 c2 01 14 01 02
E: 37.679725 14 01 07 01 a0 05 52 01 07 00 c2 01 14 01 02
E: 37.687728 14 01 07 01 a0 05 52 01 07 00 c2 01 14 01 02
E: 37.695725 14 01 07 01 a0 05 52 01 07 00 c2 01 14 01 02
E: 37.703724 14 01 07 01 a0 05 52 01 07 00 c2 01 14 01 02
E: 37.711724 14 01 07 01 a0 05 52 01 07 00 c2 01 14 01 02
E: 37.719726 14 01 07 01 a0 05 52 01 07 00 c2 01 14 01 02
E: 37.727725 14 01 07 01 a0 05 52 01 07 00 c2 01 14 01 02
E: 37.735722 14 01 07 01 a0 05 52 01 07 00 c2 01 14 01 02
E: 37.743725 14 01 07 01 a0 05 52 01 07 00 c2 01 14 01 02
E: 37.751724 14 01 07 01 a0 05 52 01 07 00 c2 01 14 01 02
E: 37.759724 14 01 07 01 a0 05 52 01 07 00 c2 01 14 01 02
E: 37.767721 14 01 07 01 a0 05 52 01 07 00 c2 01 14 01 02
E: 37.775724 14 01 07 01 a0 05 52 01 07 00 c2 01 14 01 02
E: 37.783723 14 01 07 01 a0 05 52 01 07 00 c2 01 14 01 02
E: 37.791723 14 01 07 01 a0 05 52 01 07 00 c2 01 14 01 02
E: 37.799723 14 01 07 01 a0 05 52 01 07 00 c2 01 14 01 02
E: 37.807723 14 01 07 01 a0 05 52 01 07 00 c2 01 14 01 02
E: 37.815724 14 01 07 01 a0 05 52 01 07 00 c2 01 14 01 02
E: 37.823730 14 01 07 01 a0 05 52 01 07 00 c2 01 15 01 02
E: 37.831729 14 01 07 01 a0 05 52 01 07 00 c2 01 16 01 02
E: 37.839727 14 01 07 01 9f 05 53 01 07 00 c3 01 17 01 02
E: 37.847730 14 01 07 01 9f 05 54 01 07 00 c3 01 18 01 02
E: 37.855729 14 01 07 01 9f 05 55 01 07 00 c3 01 19 01 02
E: 37.863727 14 01 07 01 9e 05 56 01 07 00 c4 01 1b 01 02
E: 37.871729 14 01 07 01 9e 05 57 01 07 00 c4 01 1d 01 02
E: 37.879727 14 01 07 01 9d 05 58 01 07 00 c4 01 1f 01 02
E: 37.887723 14 01 07 01 9d 05 58 01 07 00 c4 01 1f 01 02
E: 37.895729 14 01 07 01 9d 05 5a 01 07 00 c5 01 21 01 02
E: 37.903729 14 01 07 01 9c 05 5b 01 07 00 c5 01 23 01 02
E: 37.911727 14 01 07 01 9b 05 5d 01 07 00 c6 01 26 01 02
E: 37.919728 14 01 07 01 9a 05 60 01 07 00 c6 01 29 01 02
E: 37.927728 14 01 07 01 9a 05 62 01 07 00 c7 01 2c 01 02
E: 37.935728 14 01 07 01 99 05 64 01 07 00 c7 01 2f 01 02
E: 37.943728 14 01 07 01 98 05 66 01 07 00 c8 01 32 01 02
E: 37.951729 14 01 07 01 97 05 69 01 07 00 c9 01 36 01 02
E: 37.959730 14 01 07 01 96 05 6b 01 07 00 c9 01 3a 01 02
E: 37.967727 14 01 07 01 95 05 6e 01 07 00 ca 01 3d 01 02
E: 37.975728 14 01 07 01 94 05 71 01 07 00 ca 01 41 01 02
E: 37.983727 14 01 07 01 93 05 74 01 07 00 cb 01 45 01 02
E: 37.991720 14 01 07 01 93 05 74 01 07 00 cb 01 45 01 02
E: 37.999728 14 01 07 01 92 05 77 01 07 00 cc 01 4a 01 02
E: 38.007727 14 01 07 01 92 05 7a 01 07 00 cd 01 4e 01 02
E: 38.015728 14 01 07 01 91 05 7d 01 07 00 cd 01 52 01 02
E: 38.023728 14 01 07 01 90 05 80 01 07 00 ce 01 57 01 02
E: 38.031729 14 01 07 01 8f 05 83 01 07 00 cf 01 5b 01 02
E: 38.039729 14 01 07 01 8e 05 86 01 07 00 cf 01 60 01 02
E: 38.047722 14 01 07 01 8e 05 86 01 07 00 cf 01 60 01 02
E: 38.055728 14 01 07 01 8d 05 8a 01 07 00 d0 01 64 01 02
E: 38.063728 14 01 07 01 8c 05 8d 01 07 00 d1 01 69 01 02
E: 38.071727 14 01 07 01 8b 05 90 01 07 00 d1 01 6e 01 02
E: 38.079728 14 01 07 01 8a 05 94 01 07 00 d2 01 72 01 02
E: 38.087727 14 01 07 01 89 05 97 01 07 00 d2 01 76 01 02
E: 38.095727 14 01 07 01 88 05 9b 01 07 00 d3 01 7b 01 02
E: 38.103727 14 01 07 01 87 05 9e 01 07 00 d3 01 7f 01 02
E: 38.111728 14 01 07 01 86 05 a1 01 07 00 d4 01 83 01 02
E: 38.119726 14 01 07 01 85 05 a5 01 07 00 d5 01 87 01 02
E: 38.127729 14 01 07 01 85 05 a8 01 07 00 d5 01 8b 01 02
E: 38.135728 14 01 07 01 84 05 ab 01 07 00 d6 01 8f 01 02
E: 38.143729 14 01 07 01 83 05 af 01 07 00 d6 01 93 01 02
E: 38.151728 14 01 07 01 82 05 b2 01 07 00 d6 01 97 01 02
E: 38.159727 14 01 07 01 81 05 b5 01 07 00 d7 01 9a 01 02
E: 38.167727 14 01 07 01 80 05 b8 01 07 00 d7 01 9e 01 02
E: 38.175727 14 01 07 01 7f 05 bb 01 07 00 d8 01 a1 01 02
E: 38.183729 14 01 07 01 7f 05 bf 01 07 00 d8 01 a5 01 02
E: 38.191727 14 01 07 01 7e 05 c2 01 07 00 d9 01 a8 01 02
E: 38.199727 14 01 07 01 7d 05 c5 01 07 00 d9 01 ac 01 02
E: 38.207727 14 01 07 01 7c 05 c8 01 07 00 d9 01 af 01 02
E: 38.215721 14 01 07 01 7c 05 c8 01 07 00 d9 01 af 01 02
E: 38.223728 14 01 07 01 7c 05 cb 01 07 00 da 01 b2 01 02
E: 38.231727 14 01 07 01 7b 05 ce 01 07 00 da 01 b6 01 02
E: 38.239726 14 01 07 01 7a 05 d1 01 07 00 db 01 b9 01 02
E: 38.247724 14 01 07 01 7a 05 d4 01 07 00 db 01 bd 01 02
E: 38.255726 14 01 07 01 79 05 d7 01 07 00 dc 01 c0 01 02
E: 38.263726 14 01 07 01 78 05 da 01 07 00 dd 01 c4 01 02
E: 38.271726 14 01 07 01 78 05 dd 01 07 00 dd 01 c8 01 02
E: 38.279725 14 01 07 01 77 05 e0 01 07 00 de 01 cb 01 02
E: 38.287727 14 01 07 01 76 05 e3 01 07 00 de 01 cf 01 02
E: 38.295727 14 01 07 01 76 05 e6 01 07 00 df 01 d2 01 02
E: 38.303726 14 01 07 01 75 05 e8 01 07 00 e0 01 d6 01 02
E: 38.311727 14 01 07 01 74 05 eb 01 07 00 e0 01 da 01 02
E: 38.319726 14 01 07 01 74 05 ee 01 07 00 e1 01 de 01 02
E: 38.327726 14 01 07 01 73 05 f1 01 07 00 e1 01 e1 01 02
E: 38.335726 14 01 07 01 73 05 f3 01 07 00 e2 01 e5 01 02
E: 38.343726 14 01 07 01 72 05 f6 01 07 00 e2 01 e9 01 02
E: 38.351724 14 01 07 01 72 05 f9 01 07 00 e3 01 ed 01 02
E: 38.359725 14 01 07 01 71 05 fb 01 07 00 e4 01 f1 01 02
E: 38.367723 14 01 07 01 71 05 fe 01 07 00 e4 01 f5 01 02
E: 38.375727 14 01 07 01 70 05 01 02 07 00 e5 01 f9 01 02
E: 38.383721 14 01 07 01 70 05 01 02 07 00 e5 01 f9 01 02
E: 38.391727 14 01 07 01 70 05 03 02 07 00 e5 01 fd 01 02
E: 38.399727 14 01 07 01 70 05 06 02 07 00 e6 01 01 02 02
E: 38.407726 14 01 07 01 6f 05 08 02 07 00 e6 01 05 02 02
E: 38.415725 14 01 07 01 6f 05 0b 02 07 00 e7 01 09 02 02
E: 38.423725 14 01 07 01 6f 05 0e 02 07 00 e7 01 0c 02 02
E: 38.431724 14 01 07 01 6e 05 10 02 07 00 e7 01 10 02 02
E: 38.439725 14 01 07 01 6e 05 13 02 07 00 e8 01 14 02 02
E: 38.447725 14 01 07 01 6e 05 15 02 07 00 e8 01 17 02 02
E: 38.455725 14 01 07 01 6e 05 18 02 07 00 e8 01 1b 02 02
E: 38.463724 14 01 07 01 6e 05 1a 02 07 00 e9 01 1e 02 02
E: 38.471724 14 01 07 01 6d 05 1d 02 07 00 e9 01 21 02 02
E: 38.479725 14 01 07 01 6d 05 20 02 07 00 e9 01 24 02 02
E: 38.487725 14 01 07 01 6d 05 22 02 07 00 ea 01 27 02 02
E: 38.495719 14 01 07 01 6d 05 22 02 07 00 ea 01 27 02 02
E: 38.503724 14 01 07 01 6d 05 25 02 07 00 ea 01 2a 02 02
E: 38.511724 14 01 07 01 6d 05 27 02 07 00 ea 01 2d 02 02
E: 38.519725 14 01 07 01 6d 05 2a 02 07 00 ea 01 2f 02 02
E: 38.527725 14 01 07 01 6d 05 2c 02 07 00 eb 01 32 02 02
E: 38.535725 14 01 07 01 6d 05 2f 02 07 00 eb 01 34 02 02
E: 38.543725 14 01 07 01 6d 05 31 02 07 00 eb 01 36 02 02
E: 38.551717 14 01 07 01 6d 05 31 02 07 00 eb 01 36 02 02
E: 38.559724 14 01 07 01 6d 05 34 02 07 00 eb 01 38 02 02
E: 38.567726 14 01 07 01 6d 05 36 02 07 00 eb 01 3a 02 02
E: 38.575724 14 01 07 01 6d 05 38 02 07 00 eb 01 3c 02 02
E: 38.583726 14 01 07 01 6d 05 3b 02 07 00 eb 01 3e 02 02
E: 38.591725 14 01 07 01 6d 05 3d 02 07 00 ec 01 40 02 02
E: 38.599723 14 01 07 01 6d 05 3f 02 07 00 ec 01 42 02 02
E: 38.607724 14 01 07 01 6d 05 42 02 07 00 ec 01 44 02 02
E: 38.615722 14 01 07 01 6d 05 44 02 07 00 ec 01 45 02 02
E: 38.623723 14 01 07 01 6d 05 46 02 07 00 ec 01 47 02 02
E: 38.631721 14 01 07 01 6d 05 48 02 07 00 ec 01 48 02 02
E: 38.639723 14 01 07 01 6d 05 4a 02 07 00 ec 01 49 02 02
E: 38.647724 14 01 07 01 6d 05 4b 02 07 00 ec 01 4b 02 02
E: 38.655724 14 01 07 01 6d 05 4d 02 07 00 ec 01 4c 02 02
E: 38.663723 14 01 07 01 6e 05 4e 02 07 00 ec 01 4d 02 02
E: 38.671724 14 01 07 01 6e 05 50 02 07 00 ec 01 4e 02 02
E: 38.679721 14 01 07 01 6e 05 51 02 07 00 ec 01 4e 02 02
E: 38.687725 14 01 07 01 6e 05 52 02 07 00 ec 01 4f 02 02
E: 38.695724 14 01 07 01 6e 05 53 02 07 00 ec 01 50 02 02
E: 38.703718 14 01 07 01 6e 05 53 02 07 00 ec 01 50 02 02
E: 38.711723 14 01 07 01 6e 05 54 02 07 00 ec 01 51 02 02
E: 38.719718 14 01 07 01 6e 05 54 02 07 00 ec 01 51 02 02
E: 38.727723 14 01 07 01 6e 05 55 02 07 00 ec 01 52 02 02
E: 38.735719 14 01 07 01 6e 05 55 02 07 00 ec 01 52 02 02
E: 38.743717 14 01 07 01 6e 05 55 02 07 00 ec 01 52 02 02
E: 38.751716 14 01 07 01 6e 05 55 02 07 00 ec 01 52 02 02
E: 38.759717 14 01 07 01 6e 05 55 02 07 00 ec 01 52 02 02
E: 38.767715 14 01 07 01 6e 05 55 02 07 00 ec 01 52 02 02
E: 38.775717 14 01 07 01 6e 05 55 02 07 00 ec 01 52 02 02
E: 38.783715 14 01 07 01 6e 05 55 02 07 00 ec 01 52 02 02
E: 38.791717 14 01 07 01 6e 05 55 02 07 00 ec 01 52 02 02
E: 38.799722 14 01 07 01 6d 05 55 02 07 00 ec 01 52 02 02
E: 38.807717 14 01 07 01 6d 05 55 02 07 00 ec 01 52 02 02
E: 38.815722 14 01 06 01 6d 05 55 02 06 00 ec 01 52 02 02
# Thank you.
