R: 402 05 01 09 02 a1 01 85 0d 09 01 a1 00 05 09 19 01 29 02 15 00 25 01 95 02 75 01 81 02 95 01 75 06 81 03 05 01 55 0e 65 11 75 10 95 01 35 00 46 4c 11 26 7f 07 09 30 81 22 46 bb 09 26 37 04 09 31 81 22 95 08 75 08 81 03 c0 c0 05 0d 09 04 a1 01 85 01 09 22 a1 02 09 42 15 00 25 01 75 01 95 01 81 02 09 32 81 02 09 47 81 02 95 05 81 03 75 08 09 51 95 01 81 02 05 01 75 10 55 0e 65 11 09 30 35 00 46 4c 11 26 7f 07 81 02 09 31 46 bb 09 26 37 04 81 02 c0 a1 02 05 0d 09 42 15 00 25 01 75 01 95 01 81 02 09 32 81 02 09 47 81 02 95 05 81 03 75 08 09 51 95 01 81 02 05 01 75 10 55 0e 65 11 09 30 35 00 46 4c 11 26 7f 07 81 02 46 bb 09 26 37 04 09 31 81 02 c0 05 0d 09 54 15 00 26 ff 00 95 01 75 08 81 02 09 55 25 02 95 01 85 02 b1 02 c0 05 0d 09 0e a1 01 06 00 ff 09 01 26 ff 00 75 08 95 47 85 03 b1 02 09 01 96 ff 03 85 04 b1 02 09 01 95 0b 85 05 b1 02 09 01 96 ff 03 85 06 b1 02 09 01 95 0f 85 07 b1 02 09 01 96 ff 03 85 08 b1 02 09 01 96 ff 03 85 09 b1 02 09 01 95 3f 85 0a b1 02 09 01 96 ff 03 85 0b b1 02 09 01 96 c3 03 85 0e b1 02 09 01 96 ff 03 85 0f b1 02 09 01 96 83 03 85 10 b1 02 09 01 96 93 00 85 11 b1 02 09 01 96 ff 03 85 12 b1 02 05 0d 09 23 a1 02 09 52 09 53 15 00 25 0a 75 08 95 02 85 0c b1 02 c0 c0
N: Quanta OpticalTouchScreen
I: 3 0408 3008
# 1. Drag _one_ finger on the screen from one corner to the opposite, and release it.
E: 0.000000 14 01 07 00 69 07 32 00 00 00 00 00 00 00 01
E: 0.008002 14 01 07 00 69 07 32 00 00 00 00 00 00 00 01
E: 0.016013 14 01 07 00 69 07 33 00 00 00 00 00 00 00 01
E: 0.023963 14 01 07 00 69 07 33 00 00 00 00 00 00 00 01
E: 0.031998 14 01 07 00 69 07 33 00 00 00 00 00 00 00 01
E: 0.039990 14 01 07 00 69 07 33 00 00 00 00 00 00 00 01
E: 0.048004 14 01 07 00 69 07 33 00 00 00 00 00 00 00 01
E: 0.055998 14 01 07 00 69 07 33 00 00 00 00 00 00 00 01
E: 0.064013 14 01 07 00 69 07 33 00 00 00 00 00 00 00 01
E: 0.072005 14 01 07 00 69 07 33 00 00 00 00 00 00 00 01
E: 0.080020 14 01 07 00 69 07 33 00 00 00 00 00 00 00 01
E: 0.088013 14 01 07 00 69 07 33 00 00 00 00 00 00 00 01
E: 0.096028 14 01 07 00 69 07 33 00 00 00 00 00 00 00 01
E: 0.104021 14 01 07 00 69 07 33 00 00 00 00 00 00 00 01
E: 0.112035 14 01 07 00 69 07 33 00 00 00 00 00 00 00 01
E: 0.120005 14 01 07 00 69 07 33 00 00 00 00 00 00 00 01
E: 0.128044 14 01 07 00 69 07 33 00 00 00 00 00 00 00 01
E: 0.136025 14 01 07 00 69 07 33 00 00 00 00 00 00 00 01
E: 0.144057 14 01 07 00 69 07 34 00 00 00 00 00 00 00 01
E: 0.152035 14 01 07 00 69 07 34 00 00 00 00 00 00 00 01
E: 0.160066 14 01 07 00 68 07 34 00 00 00 00 00 00 00 01
E: 0.168060 14 01 07 00 68 07 35 00 00 00 00 00 00 00 01
E: 0.176068 14 01 07 00 68 07 35 00 00 00 00 00 00 00 01
E: 0.184059 14 01 07 00 68 07 35 00 00 00 00 00 00 00 01
E: 0.192058 14 01 07 00 68 07 36 00 00 00 00 00 00 00 01
E: 0.200067 14 01 07 00 67 07 36 00 00 00 00 00 00 00 01
E: 0.208065 14 01 07 00 67 07 37 00 00 00 00 00 00 00 01
E: 0.216069 14 01 07 00 67 07 37 00 00 00 00 00 00 00 01
E: 0.224073 14 01 07 00 66 07 38 00 00 00 00 00 00 00 01
E: 0.232080 14 01 07 00 65 07 39 00 00 00 00 00 00 00 01
E: 0.240080 14 01 07 00 64 07 3b 00 00 00 00 00 00 00 01
E: 0.248064 14 01 07 00 62 07 3d 00 00 00 00 00 00 00 01
E: 0.256088 14 01 07 00 61 07 3e 00 00 00 00 00 00 00 01
E: 0.264092 14 01 07 00 61 07 3e 00 00 00 00 00 00 00 01
E: 0.272097 14 01 07 00 5f 07 3f 00 00 00 00 00 00 00 01
E: 0.280104 14 01 07 00 5c 07 41 00 00 00 00 00 00 00 01
E: 0.288104 14 01 07 00 59 07 43 00 00 00 00 00 00 00 01
E: 0.296108 14 01 07 00 56 07 45 00 00 00 00 00 00 00 01
E: 0.304111 14 01 07 00 53 07 47 00 00 00 00 00 00 00 01
E: 0.312115 14 01 07 00 50 07 4a 00 00 00 00 00 00 00 01
E: 0.320120 14 01 07 00 4c 07 4d 00 00 00 00 00 00 00 01
E: 0.328124 14 01 07 00 48 07 4f 00 00 00 00 00 00 00 01
E: 0.336127 14 01 07 00 44 07 52 00 00 00 00 00 00 00 01
E: 0.344128 14 01 07 00 44 07 52 00 00 00 00 00 00 00 01
E: 0.352103 14 01 07 00 40 07 55 00 00 00 00 00 00 00 01
E: 0.360139 14 01 07 00 3c 07 57 00 00 00 00 00 00 00 01
E: 0.368143 14 01 07 00 37 07 5a 00 00 00 00 00 00 00 01
E: 0.376147 14 01 07 00 33 07 5e 00 00 00 00 00 00 00 01
E: 0.384151 14 01 07 00 2e 07 61 00 00 00 00 00 00 00 01
E: 0.392156 14 01 07 00 29 07 65 00 00 00 00 00 00 00 01
E: 0.400159 14 01 07 00 24 07 69 00 00 00 00 00 00 00 01
E: 0.408161 14 01 07 00 1f 07 6c 00 00 00 00 00 00 00 01
E: 0.416167 14 01 07 00 1a 07 70 00 00 00 00 00 00 00 01
E: 0.424170 14 01 07 00 15 07 74 00 00 00 00 00 00 00 01
E: 0.432176 14 01 07 00 0f 07 78 00 00 00 00 00 00 00 01
E: 0.440179 14 01 07 00 0b 07 7c 00 00 00 00 00 00 00 01
E: 0.448181 14 01 07 00 06 07 7f 00 00 00 00 00 00 00 01
E: 0.456186 14 01 07 00 01 07 83 00 00 00 00 00 00 00 01
E: 0.464191 14 01 07 00 fc 06 87 00 00 00 00 00 00 00 01
E: 0.472194 14 01 07 00 f7 06 8b 00 00 00 00 00 00 00 01
E: 0.480198 14 01 07 00 f2 06 8f 00 00 00 00 00 00 00 01
E: 0.488203 14 01 07 00 ec 06 94 00 00 00 00 00 00 00 01
E: 0.496206 14 01 07 00 e6 06 98 00 00 00 00 00 00 00 01
E: 0.504214 14 01 07 00 e0 06 9d 00 00 00 00 00 00 00 01
E: 0.512211 14 01 07 00 e0 06 9d 00 00 00 00 00 00 00 01
E: 0.520218 14 01 07 00 da 06 a1 00 00 00 00 00 00 00 01
E: 0.528222 14 01 07 00 d4 06 a6 00 00 00 00 00 00 00 01
E: 0.536226 14 01 07 00 cd 06 ab 00 00 00 00 00 00 00 01
E: 0.544230 14 01 07 00 c6 06 b0 00 00 00 00 00 00 00 01
E: 0.552199 14 01 07 00 bf 06 b5 00 00 00 00 00 00 00 01
E: 0.560238 14 01 07 00 b8 06 ba 00 00 00 00 00 00 00 01
E: 0.568242 14 01 07 00 b1 06 c0 00 00 00 00 00 00 00 01
E: 0.576246 14 01 07 00 a9 06 c5 00 00 00 00 00 00 00 01
E: 0.584250 14 01 07 00 a2 06 ca 00 00 00 00 00 00 00 01
E: 0.592253 14 01 07 00 9a 06 cf 00 00 00 00 00 00 00 01
E: 0.600258 14 01 07 00 92 06 d5 00 00 00 00 00 00 00 01
E: 0.608261 14 01 07 00 8a 06 da 00 00 00 00 00 00 00 01
E: 0.616266 14 01 07 00 81 06 df 00 00 00 00 00 00 00 01
E: 0.624270 14 01 07 00 78 06 e5 00 00 00 00 00 00 00 01
E: 0.632273 14 01 07 00 6e 06 ec 00 00 00 00 00 00 00 01
E: 0.640277 14 01 07 00 65 06 f2 00 00 00 00 00 00 00 01
E: 0.648282 14 01 07 00 5b 06 f8 00 00 00 00 00 00 00 01
E: 0.656285 14 01 07 00 50 06 fe 00 00 00 00 00 00 00 01
E: 0.664289 14 01 07 00 45 06 05 01 00 00 00 00 00 00 01
E: 0.672289 14 01 07 00 45 06 05 01 00 00 00 00 00 00 01
E: 0.680297 14 01 07 00 3a 06 0b 01 00 00 00 00 00 00 01
E: 0.688301 14 01 07 00 2f 06 12 01 00 00 00 00 00 00 01
E: 0.696305 14 01 07 00 23 06 19 01 00 00 00 00 00 00 01
E: 0.704308 14 01 07 00 17 06 20 01 00 00 00 00 00 00 01
E: 0.712313 14 01 07 00 0a 06 27 01 00 00 00 00 00 00 01
E: 0.720316 14 01 07 00 fe 05 2e 01 00 00 00 00 00 00 01
E: 0.728321 14 01 07 00 f1 05 35 01 00 00 00 00 00 00 01
E: 0.736325 14 01 07 00 e4 05 3d 01 00 00 00 00 00 00 01
E: 0.744328 14 01 07 00 d7 05 44 01 00 00 00 00 00 00 01
E: 0.752331 14 01 07 00 ca 05 4c 01 00 00 00 00 00 00 01
E: 0.760336 14 01 07 00 bc 05 54 01 00 00 00 00 00 00 01
E: 0.768336 14 01 07 00 bc 05 54 01 00 00 00 00 00 00 01
E: 0.776343 14 01 07 00 ae 05 5c 01 00 00 00 00 00 00 01
E: 0.784349 14 01 07 00 a0 05 64 01 00 00 00 00 00 00 01
E: 0.792351 14 01 07 00 92 05 6d 01 00 00 00 00 00 00 01
E: 0.800356 14 01 07 00 84 05 75 01 00 00 00 00 00 00 01
E: 0.808360 14 01 07 00 76 05 7d 01 00 00 00 00 00 00 01
E: 0.816364 14 01 07 00 67 05 85 01 00 00 00 00 00 00 01
E: 0.824368 14 01 07 00 58 05 8e 01 00 00 00 00 00 00 01
E: 0.832373 14 01 07 00 49 05 96 01 00 00 00 00 00 00 01
E: 0.840372 14 01 07 00 49 05 96 01 00 00 00 00 00 00 01
E: 0.848380 14 01 07 00 3a 05 9f 01 00 00 00 00 00 00 01
E: 0.856383 14 01 07 00 2b 05 a7 01 00 00 00 00 00 00 01
E: 0.864388 14 01 07 00 1c 05 b0 01 00 00 00 00 00 00 01
E: 0.872392 14 01 07 00 0c 05 b8 01 00 00 00 00 00 00 01
E: 0.880396 14 01 07 00 fd 04 c1 01 00 00 00 00 00 00 01
E: 0.888400 14 01 07 00 ed 04 c9 01 00 00 00 00 00 00 01
E: 0.896403 14 01 07 00 dd 04 d2 01 00 00 00 00 00 00 01
E: 0.904407 14 01 07 00 cd 04 da 01 00 00 00 00 00 00 01
E: 0.912411 14 01 07 00 bc 04 e3 01 00 00 00 00 00 00 01
E: 0.920409 14 01 07 00 aa 04 eb 01 00 00 00 00 00 00 01
E: 0.928419 14 01 07 00 99 04 f4 01 00 00 00 00 00 00 01
E: 0.936423 14 01 07 00 87 04 fc 01 00 00 00 00 00 00 01
E: 0.944427 14 01 07 00 76 04 05 02 00 00 00 00 00 00 01
E: 0.952429 14 01 07 00 64 04 0d 02 00 00 00 00 00 00 01
E: 0.960435 14 01 07 00 53 04 15 02 00 00 00 00 00 00 01
E: 0.968439 14 01 07 00 41 04 1d 02 00 00 00 00 00 00 01
E: 0.976442 14 01 07 00 2f 04 25 02 00 00 00 00 00 00 01
E: 0.984447 14 01 07 00 1e 04 2d 02 00 00 00 00 00 00 01
E: 0.992451 14 01 07 00 0d 04 35 02 00 00 00 00 00 00 01
E: 1.000452 14 01 07 00 fc 03 3d 02 00 00 00 00 00 00 01
E: 1.008455 14 01 07 00 fc 03 3d 02 00 00 00 00 00 00 01
E: 1.016463 14 01 07 00 eb 03 44 02 00 00 00 00 00 00 01
E: 1.024465 14 01 07 00 db 03 4b 02 00 00 00 00 00 00 01
E: 1.032470 14 01 07 00 ca 03 52 02 00 00 00 00 00 00 01
E: 1.040474 14 01 07 00 ba 03 59 02 00 00 00 00 00 00 01
E: 1.048477 14 01 07 00 a9 03 60 02 00 00 00 00 00 00 01
E: 1.056482 14 01 07 00 98 03 67 02 00 00 00 00 00 00 01
E: 1.064486 14 01 07 00 87 03 6e 02 00 00 00 00 00 00 01
E: 1.072490 14 01 07 00 76 03 75 02 00 00 00 00 00 00 01
E: 1.080494 14 01 07 00 64 03 7c 02 00 00 00 00 00 00 01
E: 1.088498 14 01 07 00 52 03 83 02 00 00 00 00 00 00 01
E: 1.096502 14 01 07 00 41 03 89 02 00 00 00 00 00 00 01
E: 1.104506 14 01 07 00 30 03 90 02 00 00 00 00 00 00 01
E: 1.112509 14 01 07 00 1e 03 97 02 00 00 00 00 00 00 01
E: 1.120513 14 01 07 00 0c 03 9e 02 00 00 00 00 00 00 01
E: 1.128518 14 01 07 00 fb 02 a5 02 00 00 00 00 00 00 01
E: 1.136522 14 01 07 00 ea 02 ab 02 00 00 00 00 00 00 01
E: 1.144526 14 01 07 00 d9 02 b2 02 00 00 00 00 00 00 01
E: 1.152528 14 01 07 00 c8 02 b9 02 00 00 00 00 00 00 01
E: 1.160534 14 01 07 00 b7 02 c0 02 00 00 00 00 00 00 01
E: 1.168539 14 01 07 00 a7 02 c7 02 00 00 00 00 00 00 01
E: 1.176538 14 01 07 00 a7 02 c7 02 00 00 00 00 00 00 01
E: 1.184545 14 01 07 00 96 02 cd 02 00 00 00 00 00 00 01
E: 1.192549 14 01 07 00 86 02 d4 02 00 00 00 00 00 00 01
E: 1.200554 14 01 07 00 76 02 da 02 00 00 00 00 00 00 01
E: 1.208557 14 01 07 00 66 02 e0 02 00 00 00 00 00 00 01
E: 1.216561 14 01 07 00 57 02 e6 02 00 00 00 00 00 00 01
E: 1.224565 14 01 07 00 47 02 ec 02 00 00 00 00 00 00 01
E: 1.232569 14 01 07 00 38 02 f2 02 00 00 00 00 00 00 01
E: 1.240573 14 01 07 00 29 02 f8 02 00 00 00 00 00 00 01
E: 1.248575 14 01 07 00 1a 02 fe 02 00 00 00 00 00 00 01
E: 1.256581 14 01 07 00 0b 02 03 03 00 00 00 00 00 00 01
E: 1.264585 14 01 07 00 fc 01 08 03 00 00 00 00 00 00 01
E: 1.272588 14 01 07 00 ed 01 0e 03 00 00 00 00 00 00 01
E: 1.280588 14 01 07 00 ed 01 0e 03 00 00 00 00 00 00 01
E: 1.288597 14 01 07 00 df 01 14 03 00 00 00 00 00 00 01
E: 1.296601 14 01 07 00 d0 01 1a 03 00 00 00 00 00 00 01
E: 1.304605 14 01 07 00 c1 01 20 03 00 00 00 00 00 00 01
E: 1.312608 14 01 07 00 b3 01 26 03 00 00 00 00 00 00 01
E: 1.320612 14 01 07 00 a5 01 2c 03 00 00 00 00 00 00 01
E: 1.328615 14 01 07 00 97 01 31 03 00 00 00 00 00 00 01
E: 1.336620 14 01 07 00 8a 01 37 03 00 00 00 00 00 00 01
E: 1.344620 14 01 07 00 8a 01 37 03 00 00 00 00 00 00 01
E: 1.352627 14 01 07 00 7c 01 3d 03 00 00 00 00 00 00 01
E: 1.360632 14 01 07 00 6e 01 42 03 00 00 00 00 00 00 01
E: 1.368636 14 01 07 00 60 01 48 03 00 00 00 00 00 00 01
E: 1.376640 14 01 07 00 52 01 4d 03 00 00 00 00 00 00 01
E: 1.384644 14 01 07 00 45 01 53 03 00 00 00 00 00 00 01
E: 1.392648 14 01 07 00 38 01 59 03 00 00 00 00 00 00 01
E: 1.400652 14 01 07 00 2b 01 5e 03 00 00 00 00 00 00 01
E: 1.408656 14 01 07 00 1e 01 64 03 00 00 00 00 00 00 01
E: 1.416660 14 01 07 00 12 01 69 03 00 00 00 00 00 00 01
E: 1.424664 14 01 07 00 06 01 6f 03 00 00 00 00 00 00 01
E: 1.432660 14 01 07 00 fa 00 74 03 00 00 00 00 00 00 01
E: 1.440671 14 01 07 00 ef 00 79 03 00 00 00 00 00 00 01
E: 1.448675 14 01 07 00 e4 00 7e 03 00 00 00 00 00 00 01
E: 1.456679 14 01 07 00 da 00 83 03 00 00 00 00 00 00 01
E: 1.464683 14 01 07 00 d0 00 87 03 00 00 00 00 00 00 01
E: 1.472687 14 01 07 00 c6 00 8b 03 00 00 00 00 00 00 01
E: 1.480691 14 01 07 00 bd 00 8f 03 00 00 00 00 00 00 01
E: 1.488695 14 01 07 00 b4 00 93 03 00 00 00 00 00 00 01
E: 1.496699 14 01 07 00 ac 00 97 03 00 00 00 00 00 00 01
E: 1.504703 14 01 07 00 a4 00 9a 03 00 00 00 00 00 00 01
E: 1.512703 14 01 07 00 a4 00 9a 03 00 00 00 00 00 00 01
E: 1.520711 14 01 07 00 9c 00 9d 03 00 00 00 00 00 00 01
E: 1.528716 14 01 07 00 94 00 a1 03 00 00 00 00 00 00 01
E: 1.536719 14 01 07 00 8d 00 a4 03 00 00 00 00 00 00 01
E: 1.544723 14 01 07 00 86 00 a7 03 00 00 00 00 00 00 01
E: 1.552726 14 01 07 00 80 00 aa 03 00 00 00 00 00 00 01
E: 1.560731 14 01 07 00 7a 00 ac 03 00 00 00 00 00 00 01
E: 1.568735 14 01 07 00 74 00 af 03 00 00 00 00 00 00 01
E: 1.576739 14 01 07 00 6e 00 b2 03 00 00 00 00 00 00 01
E: 1.584743 14 01 07 00 69 00 b5 03 00 00 00 00 00 00 01
E: 1.592747 14 01 07 00 63 00 b8 03 00 00 00 00 00 00 01
E: 1.600751 14 01 07 00 5d 00 bc 03 00 00 00 00 00 00 01
E: 1.608754 14 01 07 00 58 00 bf 03 00 00 00 00 00 00 01
E: 1.616759 14 01 07 00 52 00 c3 03 00 00 00 00 00 00 01
E: 1.624763 14 01 07 00 4c 00 c7 03 00 00 00 00 00 00 01
E: 1.632766 14 01 07 00 46 00 cb 03 00 00 00 00 00 00 01
E: 1.640770 14 01 07 00 41 00 d0 03 00 00 00 00 00 00 01
E: 1.648774 14 01 07 00 3b 00 d4 03 00 00 00 00 00 00 01
E: 1.656777 14 01 07 00 35 00 d9 03 00 00 00 00 00 00 01
E: 1.664782 14 01 07 00 30 00 dd 03 00 00 00 00 00 00 01
E: 1.672782 14 01 07 00 30 00 dd 03 00 00 00 00 00 00 01
E: 1.680790 14 01 07 00 2c 00 e1 03 00 00 00 00 00 00 01
E: 1.688794 14 01 07 00 29 00 e4 03 00 00 00 00 00 00 01
E: 1.696797 14 01 07 00 26 00 e6 03 00 00 00 00 00 00 01
E: 1.704802 14 01 07 00 24 00 e9 03 00 00 00 00 00 00 01
E: 1.712805 14 01 07 00 22 00 eb 03 00 00 00 00 00 00 01
E: 1.720810 14 01 07 00 20 00 ec 03 00 00 00 00 00 00 01
E: 1.728814 14 01 07 00 1f 00 ed 03 00 00 00 00 00 00 01
E: 1.736817 14 01 07 00 1e 00 ee 03 00 00 00 00 00 00 01
E: 1.744822 14 01 07 00 1e 00 ef 03 00 00 00 00 00 00 01
E: 1.752823 14 01 07 00 1d 00 ef 03 00 00 00 00 00 00 01
E: 1.760829 14 01 07 00 1d 00 f0 03 00 00 00 00 00 00 01
E: 1.768833 14 01 07 00 1c 00 f0 03 00 00 00 00 00 00 01
E: 1.776833 14 01 07 00 1c 00 f0 03 00 00 00 00 00 00 01
E: 1.784837 14 01 07 00 1c 00 f0 03 00 00 00 00 00 00 01
E: 1.792841 14 01 07 00 1c 00 f0 03 00 00 00 00 00 00 01
E: 1.800846 14 01 07 00 1c 00 f0 03 00 00 00 00 00 00 01
E: 1.808854 14 01 07 00 1b 00 f1 03 00 00 00 00 00 00 01
E: 1.816853 14 01 07 00 1b 00 f1 03 00 00 00 00 00 00 01
E: 1.824860 14 01 07 00 1b 00 f2 03 00 00 00 00 00 00 01
E: 1.832866 14 01 07 00 1a 00 f4 03 00 00 00 00 00 00 01
E: 1.840865 14 01 07 00 1a 00 f4 03 00 00 00 00 00 00 01
E: 1.848874 14 01 07 00 19 00 f7 03 00 00 00 00 00 00 01
E: 1.856877 14 01 07 00 18 00 fa 03 00 00 00 00 00 00 01
E: 1.864881 14 01 07 00 17 00 fe 03 00 00 00 00 00 00 01
E: 1.872884 14 01 07 00 17 00 02 04 00 00 00 00 00 00 01
E: 1.880888 14 01 07 00 15 00 0a 04 00 00 00 00 00 00 01
E: 1.888892 14 01 07 00 14 00 0f 04 00 00 00 00 00 00 01
E: 1.896867 14 01 06 00 14 00 0f 04 00 00 00 00 00 00 01
# 2. Land one finger,
   - land a second finger far enough from the first
   - move your two fingers
   - release the *first* finger
   - release the second finger
E: 14.391070 14 01 07 00 68 03 92 02 07 01 b8 04 7c 02 02
E: 14.399049 14 01 07 00 68 03 92 02 07 01 b8 04 7c 02 02
E: 14.407060 14 01 07 00 68 03 92 02 07 01 b8 04 7c 02 02
E: 14.415064 14 01 07 00 68 03 92 02 07 01 b8 04 7c 02 02
E: 14.423068 14 01 07 00 68 03 92 02 07 01 b8 04 7c 02 02
E: 14.431072 14 01 07 00 68 03 92 02 07 01 b8 04 7c 02 02
E: 14.439076 14 01 07 00 68 03 92 02 07 01 b8 04 7c 02 02
E: 14.447079 14 01 07 00 68 03 92 02 07 01 b8 04 7c 02 02
E: 14.455087 14 01 07 00 68 03 93 02 07 01 b9 04 7c 02 02
E: 14.463087 14 01 07 00 68 03 93 02 07 01 b9 04 7c 02 02
E: 14.471091 14 01 07 00 68 03 93 02 07 01 b9 04 7c 02 02
E: 14.479094 14 01 07 00 68 03 93 02 07 01 b9 04 7c 02 02
E: 14.487098 14 01 07 00 68 03 93 02 07 01 b9 04 7c 02 02
E: 14.495103 14 01 07 00 68 03 93 02 07 01 b9 04 7c 02 02
E: 14.503107 14 01 07 00 68 03 93 02 07 01 b9 04 7c 02 02
E: 14.511111 14 01 07 00 68 03 93 02 07 01 b9 04 7c 02 02
E: 14.519115 14 01 07 00 68 03 93 02 07 01 b9 04 7c 02 02
E: 14.527119 14 01 07 00 68 03 93 02 07 01 b9 04 7c 02 02
E: 14.535123 14 01 07 00 68 03 93 02 07 01 b9 04 7c 02 02
E: 14.543126 14 01 07 00 68 03 93 02 07 01 b9 04 7c 02 02
E: 14.551130 14 01 07 00 68 03 93 02 07 01 b9 04 7c 02 02
E: 14.559134 14 01 07 00 68 03 93 02 07 01 b9 04 7c 02 02
E: 14.567138 14 01 07 00 68 03 93 02 07 01 b9 04 7c 02 02
E: 14.575147 14 01 07 00 68 03 94 02 07 01 b9 04 7c 02 02
E: 14.583145 14 01 07 00 68 03 94 02 07 01 b9 04 7c 02 02
E: 14.591150 14 01 07 00 68 03 94 02 07 01 b9 04 7c 02 02
E: 14.599154 14 01 07 00 68 03 94 02 07 01 b9 04 7c 02 02
E: 14.607158 14 01 07 00 68 03 94 02 07 01 b9 04 7c 02 02
E: 14.615162 14 01 07 00 68 03 94 02 07 01 b9 04 7c 02 02
E: 14.623165 14 01 07 00 68 03 94 02 07 01 b9 04 7c 02 02
E: 14.631170 14 01 07 00 68 03 94 02 07 01 b9 04 7c 02 02
E: 14.639174 14 01 07 00 68 03 94 02 07 01 b9 04 7c 02 02
E: 14.647177 14 01 07 00 68 03 94 02 07 01 b9 04 7c 02 02
E: 14.655181 14 01 07 00 68 03 94 02 07 01 b9 04 7c 02 02
E: 14.663190 14 01 07 00 68 03 95 02 07 01 b9 04 7c 02 02
E: 14.671190 14 01 07 00 68 03 95 02 07 01 b9 04 7c 02 02
E: 14.679193 14 01 07 00 68 03 95 02 07 01 b9 04 7c 02 02
E: 14.687197 14 01 07 00 68 03 95 02 07 01 b9 04 7c 02 02
E: 14.695205 14 01 07 00 68 03 95 02 07 01 b9 04 7b 02 02
E: 14.703205 14 01 07 00 68 03 95 02 07 01 b9 04 7b 02 02
E: 14.711209 14 01 07 00 68 03 95 02 07 01 b9 04 7b 02 02
E: 14.719217 14 01 07 00 69 03 95 02 07 01 b9 04 7b 02 02
E: 14.727221 14 01 07 00 69 03 96 02 07 01 b9 04 7b 02 02
E: 14.735221 14 01 07 00 69 03 96 02 07 01 b9 04 7b 02 02
E: 14.743229 14 01 07 00 69 03 97 02 07 01 b9 04 7b 02 02
E: 14.751227 14 01 07 00 69 03 97 02 07 01 b9 04 7b 02 02
E: 14.759233 14 01 07 00 69 03 97 02 07 01 b9 04 7b 02 02
E: 14.767237 14 01 07 00 69 03 97 02 07 01 b9 04 7b 02 02
E: 14.775245 14 01 07 00 69 03 97 02 07 01 b8 04 7b 02 02
E: 14.783248 14 01 07 00 69 03 98 02 07 01 b8 04 7b 02 02
E: 14.791253 14 01 07 00 6a 03 98 02 07 01 b8 04 7a 02 02
E: 14.799257 14 01 07 00 6a 03 99 02 07 01 b8 04 7a 02 02
E: 14.807260 14 01 07 00 6a 03 99 02 07 01 b7 04 7a 02 02
E: 14.815263 14 01 07 00 6a 03 9a 02 07 01 b7 04 7a 02 02
E: 14.823269 14 01 07 00 6b 03 9a 02 07 01 b7 04 79 02 02
E: 14.831273 14 01 07 00 6b 03 9b 02 07 01 b7 04 79 02 02
E: 14.839276 14 01 07 00 6b 03 9c 02 07 01 b7 04 79 02 02
E: 14.847281 14 01 07 00 6b 03 9d 02 07 01 b6 04 79 02 02
E: 14.855280 14 01 07 00 6b 03 9d 02 07 01 b6 04 79 02 02
E: 14.863288 14 01 07 00 6c 03 9d 02 07 01 b6 04 78 02 02
E: 14.871292 14 01 07 00 6c 03 9e 02 07 01 b5 04 78 02 02
E: 14.879296 14 01 07 00 6c 03 9f 02 07 01 b5 04 78 02 02
E: 14.887302 14 01 07 00 6d 03 a0 02 07 01 b5 04 77 02 02
E: 14.895308 14 01 07 00 6d 03 a1 02 07 01 b4 04 77 02 02
E: 14.903309 14 01 07 00 6e 03 a2 02 07 01 b4 04 77 02 02
E: 14.911311 14 01 07 00 6e 03 a4 02 07 01 b4 04 77 02 02
E: 14.919316 14 01 07 00 6f 03 a5 02 07 01 b4 04 77 02 02
E: 14.927320 14 01 07 00 6f 03 a6 02 07 01 b4 04 77 02 02
E: 14.935323 14 01 07 00 70 03 a8 02 07 01 b4 04 77 02 02
E: 14.943327 14 01 07 00 70 03 a9 02 07 01 b4 04 77 02 02
E: 14.951332 14 01 07 00 71 03 ab 02 07 01 b4 04 77 02 02
E: 14.959335 14 01 07 00 71 03 ad 02 07 01 b4 04 76 02 02
E: 14.967339 14 01 07 00 72 03 af 02 07 01 b4 04 76 02 02
E: 14.975339 14 01 07 00 72 03 af 02 07 01 b4 04 76 02 02
E: 14.983345 14 01 07 00 72 03 b1 02 07 01 b4 04 76 02 02
E: 14.991350 14 01 07 00 73 03 b3 02 07 01 b4 04 76 02 02
E: 14.999355 14 01 07 00 74 03 b5 02 07 01 b3 04 76 02 02
E: 15.007360 14 01 07 00 75 03 b7 02 07 01 b3 04 76 02 02
E: 15.015364 14 01 07 00 76 03 b9 02 07 01 b3 04 76 02 02
E: 15.023363 14 01 07 00 76 03 b9 02 07 01 b3 04 76 02 02
E: 15.031371 14 01 07 00 76 03 bb 02 07 01 b3 04 76 02 02
E: 15.039375 14 01 07 00 77 03 bd 02 07 01 b3 04 76 02 02
E: 15.047379 14 01 07 00 78 03 c0 02 07 01 b3 04 76 02 02
E: 15.055382 14 01 07 00 79 03 c2 02 07 01 b3 04 76 02 02
E: 15.063386 14 01 07 00 7a 03 c4 02 07 01 b3 04 76 02 02
E: 15.071391 14 01 07 00 7b 03 c6 02 07 01 b3 04 76 02 02
E: 15.079395 14 01 07 00 7c 03 c8 02 07 01 b3 04 76 02 02
E: 15.087398 14 01 07 00 7d 03 cb 02 07 01 b3 04 76 02 02
E: 15.095390 14 01 07 00 7f 03 cd 02 07 01 b3 04 76 02 02
E: 15.103380 14 01 07 00 80 03 cf 02 07 01 b3 04 76 02 02
E: 15.111411 14 01 07 00 81 03 d1 02 07 01 b3 04 76 02 02
E: 15.119415 14 01 07 00 83 03 d3 02 07 01 b3 04 76 02 02
E: 15.127418 14 01 07 00 84 03 d5 02 07 01 b3 04 76 02 02
E: 15.135422 14 01 07 00 85 03 d7 02 07 01 b3 04 76 02 02
E: 15.143427 14 01 07 00 87 03 da 02 07 01 b3 04 76 02 02
E: 15.151431 14 01 07 00 88 03 dc 02 07 01 b3 04 76 02 02
E: 15.159434 14 01 07 00 8a 03 de 02 07 01 b3 04 76 02 02
E: 15.167439 14 01 07 00 8b 03 e0 02 07 01 b3 04 76 02 02
E: 15.175444 14 01 07 00 8c 03 e2 02 07 01 b3 04 76 02 02
E: 15.183425 14 01 07 00 8e 03 e4 02 07 01 b3 04 76 02 02
E: 15.191446 14 01 07 00 8e 03 e4 02 07 01 b3 04 76 02 02
E: 15.199454 14 01 07 00 8f 03 e6 02 07 01 b3 04 76 02 02
E: 15.207458 14 01 07 00 91 03 e8 02 07 01 b3 04 76 02 02
E: 15.215463 14 01 07 00 92 03 e9 02 07 01 b3 04 76 02 02
E: 15.223466 14 01 07 00 94 03 eb 02 07 01 b3 04 76 02 02
E: 15.231470 14 01 07 00 96 03 ed 02 07 01 b3 04 76 02 02
E: 15.239473 14 01 07 00 98 03 f0 02 07 01 b3 04 76 02 02
E: 15.247478 14 01 07 00 9b 03 f2 02 07 01 b3 04 76 02 02
E: 15.255481 14 01 07 00 9d 03 f4 02 07 01 b3 04 75 02 02
E: 15.263485 14 01 07 00 9f 03 f6 02 07 01 b3 04 76 02 02
E: 15.271490 14 01 07 00 a1 03 f7 02 07 01 b3 04 76 02 02
E: 15.279493 14 01 07 00 a3 03 f9 02 07 01 b3 04 76 02 02
E: 15.287496 14 01 07 00 a4 03 fa 02 07 01 b3 04 76 02 02
E: 15.295501 14 01 07 00 a6 03 fc 02 07 01 b3 04 76 02 02
E: 15.303505 14 01 07 00 a8 03 fe 02 07 01 b3 04 76 02 02
E: 15.311509 14 01 07 00 aa 03 ff 02 07 01 b3 04 76 02 02
E: 15.319514 14 01 07 00 ab 03 01 03 07 01 b4 04 76 02 02
E: 15.327517 14 01 07 00 ad 03 02 03 07 01 b4 04 76 02 02
E: 15.335521 14 01 07 00 af 03 03 03 07 01 b4 04 76 02 02
E: 15.343525 14 01 07 00 b0 03 05 03 07 01 b4 04 76 02 02
E: 15.351528 14 01 07 00 b2 03 06 03 07 01 b4 04 76 02 02
E: 15.359529 14 01 07 00 b2 03 06 03 07 01 b4 04 76 02 02
E: 15.367536 14 01 07 00 b4 03 08 03 07 01 b3 04 76 02 02
E: 15.375541 14 01 07 00 b5 03 09 03 07 01 b3 04 76 02 02
E: 15.383546 14 01 07 00 b6 03 0b 03 07 01 b3 04 75 02 02
E: 15.391554 14 01 07 00 b8 03 0c 03 07 01 b3 04 75 02 02
E: 15.399554 14 01 07 00 b9 03 0d 03 07 01 b3 04 75 02 02
E: 15.407556 14 01 07 00 bb 03 0f 03 07 01 b3 04 75 02 02
E: 15.415561 14 01 07 00 bc 03 11 03 07 01 b3 04 75 02 02
E: 15.423565 14 01 07 00 bd 03 12 03 07 01 b2 04 75 02 02
E: 15.431569 14 01 07 00 bf 03 14 03 07 01 b2 04 75 02 02
E: 15.439574 14 01 07 00 c0 03 16 03 07 01 b1 04 74 02 02
E: 15.447564 14 01 07 00 c1 03 18 03 07 01 b1 04 74 02 02
E: 15.455579 14 01 07 00 c3 03 19 03 07 01 b0 04 73 02 02
E: 15.463556 14 01 07 00 c4 03 1b 03 07 01 af 04 73 02 02
E: 15.471588 14 01 07 00 c6 03 1d 03 07 01 af 04 73 02 02
E: 15.479589 14 01 07 00 c6 03 1d 03 07 01 af 04 73 02 02
E: 15.487595 14 01 07 00 c7 03 1f 03 07 01 ae 04 72 02 02
E: 15.495600 14 01 07 00 c8 03 20 03 07 01 ae 04 72 02 02
E: 15.503604 14 01 07 00 c9 03 22 03 07 01 ad 04 72 02 02
E: 15.511608 14 01 07 00 ca 03 23 03 07 01 ac 04 72 02 02
E: 15.519608 14 01 07 00 ca 03 23 03 07 01 ac 04 72 02 02
E: 15.527616 14 01 07 00 cb 03 24 03 07 01 ac 04 72 02 02
E: 15.535619 14 01 07 00 cc 03 25 03 07 01 ac 04 72 02 02
E: 15.543620 14 01 07 00 cc 03 25 03 07 01 ac 04 72 02 02
E: 15.551628 14 01 07 00 cd 03 26 03 07 01 ac 04 73 02 02
E: 15.559631 14 01 07 00 cd 03 27 03 07 01 ad 04 73 02 02
E: 15.567635 14 01 07 00 cd 03 27 03 07 01 ae 04 74 02 02
E: 15.575639 14 01 07 00 ce 03 28 03 07 01 af 04 75 02 02
E: 15.583607 14 01 07 00 ce 03 28 03 07 01 b0 04 76 02 02
E: 15.591648 14 01 07 00 cf 03 28 03 07 01 b2 04 77 02 02
E: 15.599651 14 01 07 00 cf 03 28 03 07 01 b4 04 78 02 02
E: 15.607655 14 01 07 00 cf 03 28 03 07 01 b5 04 79 02 02
E: 15.615659 14 01 07 00 d0 03 28 03 07 01 b7 04 7a 02 02
E: 15.623663 14 01 07 00 d1 03 27 03 07 01 b9 04 7b 02 02
E: 15.631667 14 01 07 00 d2 03 27 03 07 01 bb 04 7c 02 02
E: 15.639671 14 01 07 00 d3 03 27 03 07 01 bc 04 7e 02 02
E: 15.647676 14 01 07 00 d4 03 26 03 07 01 be 04 7f 02 02
E: 15.655678 14 01 07 00 d5 03 26 03 07 01 c0 04 80 02 02
E: 15.663682 14 01 07 00 d5 03 26 03 07 01 c1 04 81 02 02
E: 15.671687 14 01 07 00 d6 03 25 03 07 01 c3 04 82 02 02
E: 15.679681 14 01 07 00 d6 03 24 03 07 01 c4 04 83 02 02
E: 15.687690 14 01 07 00 d6 03 24 03 07 01 c4 04 83 02 02
E: 15.695699 14 01 07 00 d7 03 24 03 07 01 c6 04 84 02 02
E: 15.703703 14 01 07 00 d7 03 23 03 07 01 c7 04 85 02 02
E: 15.711697 14 01 07 00 d8 03 23 03 07 01 c9 04 85 02 02
E: 15.719711 14 01 07 00 d8 03 22 03 07 01 ca 04 86 02 02
E: 15.727714 14 01 07 00 d9 03 22 03 07 01 cb 04 87 02 02
E: 15.735718 14 01 07 00 da 03 21 03 07 01 cc 04 87 02 02
E: 15.743722 14 01 07 00 da 03 21 03 07 01 cd 04 87 02 02
E: 15.751724 14 01 07 00 db 03 21 03 07 01 ce 04 87 02 02
E: 15.759730 14 01 07 00 dc 03 21 03 07 01 cf 04 88 02 02
E: 15.767734 14 01 07 00 dc 03 20 03 07 01 d0 04 88 02 02
E: 15.775737 14 01 07 00 dd 03 20 03 07 01 d2 04 87 02 02
E: 15.783706 14 01 07 00 de 03 20 03 07 01 d4 04 87 02 02
E: 15.791747 14 01 07 00 df 03 21 03 07 01 d5 04 86 02 02
E: 15.799750 14 01 07 00 e1 03 21 03 07 01 d7 04 86 02 02
E: 15.807754 14 01 07 00 e3 03 22 03 07 01 d8 04 85 02 02
E: 15.815759 14 01 07 00 e5 03 23 03 07 01 da 04 84 02 02
E: 15.823762 14 01 07 00 e7 03 25 03 07 01 db 04 83 02 02
E: 15.831766 14 01 07 00 ea 03 26 03 07 01 dc 04 82 02 02
E: 15.839770 14 01 07 00 ec 03 28 03 07 01 de 04 81 02 02
E: 15.847774 14 01 07 00 f0 03 2a 03 07 01 df 04 80 02 02
E: 15.855772 14 01 07 00 f0 03 2a 03 07 01 df 04 80 02 02
E: 15.863782 14 01 07 00 f3 03 2c 03 07 01 e0 04 7f 02 02
E: 15.871786 14 01 07 00 f7 03 2f 03 07 01 e1 04 7e 02 02
E: 15.879760 14 01 07 00 fa 03 31 03 07 01 e3 04 7d 02 02
E: 15.887792 14 01 07 00 fd 03 34 03 07 01 e4 04 7c 02 02
E: 15.895798 14 01 07 00 01 04 37 03 07 01 e7 04 7c 02 02
E: 15.903802 14 01 07 00 05 04 3a 03 07 01 e9 04 7b 02 02
E: 15.911806 14 01 07 00 08 04 3c 03 07 01 eb 04 7b 02 02
E: 15.919799 14 01 07 00 0b 04 3e 03 07 01 ee 04 7c 02 02
E: 15.927801 14 01 07 00 0e 04 41 03 07 01 f1 04 7c 02 02
E: 15.935789 14 01 07 00 11 04 42 03 07 01 f4 04 7d 02 02
E: 15.943793 14 01 07 00 13 04 44 03 07 01 f8 04 7e 02 02
E: 15.951798 14 01 07 00 15 04 45 03 07 01 fb 04 7f 02 02
E: 15.959801 14 01 07 00 17 04 46 03 07 01 ff 04 81 02 02
E: 15.967805 14 01 07 00 19 04 47 03 07 01 03 05 82 02 02
E: 15.975809 14 01 07 00 1a 04 48 03 07 01 07 05 84 02 02
E: 15.983836 14 01 07 00 1a 04 48 03 07 01 07 05 84 02 02
E: 15.991845 14 01 07 00 22 04 4f 03 07 01 05 05 83 02 02
E: 15.999849 14 01 07 00 2a 04 55 03 07 01 04 05 82 02 02
E: 16.007852 14 01 07 00 32 04 5b 03 07 01 02 05 81 02 02
E: 16.015857 14 01 07 00 39 04 61 03 07 01 00 05 81 02 02
E: 16.023855 14 01 07 00 39 04 61 03 07 01 00 05 81 02 02
E: 16.031865 14 01 07 00 40 04 67 03 07 01 ff 04 80 02 02
E: 16.039868 14 01 07 00 48 04 6d 03 07 01 fd 04 80 02 02
E: 16.047872 14 01 07 00 4f 04 73 03 07 01 fb 04 80 02 02
E: 16.055875 14 01 07 00 56 04 79 03 07 01 fa 04 81 02 02
E: 16.063879 14 01 07 00 5d 04 7f 03 07 01 f8 04 81 02 02
E: 16.071857 14 01 07 00 65 04 85 03 07 01 f6 04 82 02 02
E: 16.079889 14 01 07 00 6c 04 8a 03 07 01 f4 04 83 02 02
E: 16.087891 14 01 07 00 73 04 90 03 07 01 f2 04 84 02 02
E: 16.095896 14 01 07 00 7a 04 96 03 07 01 f0 04 85 02 02
E: 16.103872 14 01 07 00 80 04 9c 03 07 01 ee 04 86 02 02
E: 16.111904 14 01 07 00 86 04 a1 03 07 01 ec 04 88 02 02
E: 16.119881 14 01 07 00 8d 04 a7 03 07 01 ea 04 89 02 02
E: 16.127912 14 01 07 00 93 04 ac 03 07 01 e8 04 8a 02 02
E: 16.135889 14 01 07 00 99 04 b1 03 07 01 e6 04 8c 02 02
E: 16.143920 14 01 07 00 9f 04 b6 03 07 01 e3 04 8d 02 02
E: 16.151911 14 01 07 00 a4 04 bb 03 07 01 e1 04 8f 02 02
E: 16.159928 14 01 07 00 aa 04 c0 03 07 01 df 04 91 02 02
E: 16.167932 14 01 07 00 af 04 c4 03 07 01 dc 04 93 02 02
E: 16.175936 14 01 07 00 b4 04 c9 03 07 01 d9 04 95 02 02
E: 16.183940 14 01 07 00 b9 04 cd 03 07 01 d7 04 97 02 02
E: 16.191912 14 01 07 00 b9 04 cd 03 07 01 d7 04 97 02 02
E: 16.199947 14 01 07 00 be 04 d1 03 07 01 d4 04 99 02 02
E: 16.207940 14 01 07 00 c3 04 d5 03 07 01 d1 04 9c 02 02
E: 16.215928 14 01 07 00 c7 04 d9 03 07 01 ce 04 9e 02 02
E: 16.223932 14 01 07 00 cb 04 dd 03 07 01 cb 04 a1 02 02
E: 16.231928 14 01 07 00 cf 04 e0 03 07 01 c8 04 a3 02 02
E: 16.239931 14 01 07 00 d3 04 e4 03 07 01 c6 04 a6 02 02
E: 16.247961 14 01 07 00 d7 04 e8 03 07 01 c3 04 a8 02 02
E: 16.255979 14 01 07 00 db 04 eb 03 07 01 c0 04 aa 02 02
E: 16.263989 14 01 07 00 de 04 ee 03 07 01 bd 04 ad 02 02
E: 16.271977 14 01 07 00 e2 04 f1 03 07 01 bb 04 b0 02 02
E: 16.279959 14 01 07 00 e6 04 f4 03 07 01 b8 04 b2 02 02
E: 16.287991 14 01 07 00 e9 04 f6 03 07 01 b5 04 b5 02 02
E: 16.295995 14 01 07 00 ed 04 f9 03 07 01 b2 04 b9 02 02
E: 16.303998 14 01 07 00 f0 04 fc 03 07 01 af 04 bc 02 02
E: 16.312003 14 01 07 00 f3 04 fe 03 07 01 ac 04 c0 02 02
E: 16.320007 14 01 07 00 f5 04 01 04 07 01 a8 04 c3 02 02
E: 16.328010 14 01 07 00 f8 04 03 04 07 01 a5 04 c7 02 02
E: 16.336015 14 01 07 00 fa 04 06 04 07 01 a2 04 ca 02 02
E: 16.344019 14 01 07 00 fb 04 08 04 07 01 9f 04 ce 02 02
E: 16.352033 14 01 07 00 fd 04 0a 04 07 01 9c 04 d1 02 02
E: 16.360022 14 01 07 00 fd 04 0a 04 07 01 9c 04 d1 02 02
E: 16.368031 14 01 07 00 fe 04 0c 04 07 01 99 04 d4 02 02
E: 16.376034 14 01 07 00 ff 04 0e 04 07 01 96 04 d8 02 02
E: 16.384028 14 01 07 00 00 05 0f 04 07 01 93 04 db 02 02
E: 16.392043 14 01 07 00 01 05 11 04 07 01 91 04 de 02 02
E: 16.400046 14 01 07 00 01 05 12 04 07 01 8e 04 e1 02 02
E: 16.408054 14 01 07 00 02 05 12 04 07 01 8b 04 e4 02 02
E: 16.416054 14 01 07 00 02 05 13 04 07 01 89 04 e6 02 02
E: 16.424058 14 01 07 00 01 05 14 04 07 01 87 04 e9 02 02
E: 16.432062 14 01 07 00 01 05 15 04 07 01 84 04 eb 02 02
E: 16.440066 14 01 07 00 00 05 15 04 07 01 82 04 ee 02 02
E: 16.448069 14 01 07 00 ff 04 15 04 07 01 80 04 f0 02 02
E: 16.456074 14 01 07 00 fe 04 14 04 07 01 7e 04 f2 02 02
E: 16.464078 14 01 07 00 fc 04 14 04 07 01 7c 04 f4 02 02
E: 16.472081 14 01 07 00 fb 04 14 04 07 01 7a 04 f6 02 02
E: 16.480059 14 01 07 00 f9 04 13 04 07 01 79 04 f7 02 02
E: 16.488089 14 01 07 00 f7 04 13 04 07 01 78 04 f9 02 02
E: 16.496089 14 01 07 00 f7 04 13 04 07 01 78 04 f9 02 02
E: 16.504098 14 01 07 00 f6 04 13 04 07 01 77 04 fa 02 02
E: 16.512102 14 01 07 00 f4 04 12 04 07 01 76 04 fb 02 02
E: 16.520101 14 01 07 00 f4 04 12 04 07 01 76 04 fb 02 02
E: 16.528109 14 01 07 00 f3 04 12 04 07 01 75 04 fc 02 02
E: 16.536113 14 01 07 00 f1 04 11 04 07 01 74 04 fd 02 02
E: 16.544117 14 01 07 00 f0 04 11 04 07 01 74 04 fe 02 02
E: 16.552120 14 01 07 00 ee 04 10 04 07 01 73 04 fe 02 02
E: 16.560125 14 01 07 00 ed 04 0f 04 07 01 73 04 ff 02 02
E: 16.568130 14 01 07 00 eb 04 0e 04 07 01 73 04 ff 02 02
E: 16.576133 14 01 07 00 e8 04 0d 04 07 01 74 04 ff 02 02
E: 16.584136 14 01 07 00 e6 04 0c 04 07 01 74 04 00 03 02
E: 16.592140 14 01 07 00 e2 04 0a 04 07 01 75 04 00 03 02
E: 16.600144 14 01 07 00 df 04 08 04 07 01 75 04 00 03 02
E: 16.608148 14 01 07 00 da 04 06 04 07 01 76 04 01 03 02
E: 16.616153 14 01 07 00 d6 04 04 04 07 01 77 04 01 03 02
E: 16.624156 14 01 07 00 d1 04 01 04 07 01 78 04 01 03 02
E: 16.632160 14 01 07 00 cb 04 fd 03 07 01 78 04 02 03 02
E: 16.640164 14 01 07 00 c5 04 f9 03 07 01 79 04 02 03 02
E: 16.648168 14 01 07 00 bf 04 f5 03 07 01 7a 04 02 03 02
E: 16.656172 14 01 07 00 b9 04 f1 03 07 01 7a 04 02 03 02
E: 16.664176 14 01 07 00 b3 04 ec 03 07 01 7b 04 02 03 02
E: 16.672180 14 01 07 00 ad 04 e8 03 07 01 7c 04 02 03 02
E: 16.680184 14 01 07 00 a7 04 e3 03 07 01 7d 04 02 03 02
E: 16.688183 14 01 07 00 a7 04 e3 03 07 01 7d 04 02 03 02
E: 16.696192 14 01 07 00 a1 04 de 03 07 01 7d 04 01 03 02
E: 16.704196 14 01 07 00 9b 04 da 03 07 01 7f 04 00 03 02
E: 16.712201 14 01 07 00 95 04 d5 03 07 01 80 04 ff 02 02
E: 16.720204 14 01 07 00 90 04 d0 03 07 01 82 04 fd 02 02
E: 16.728173 14 01 07 00 8b 04 cc 03 07 01 83 04 fb 02 02
E: 16.736201 14 01 07 00 86 04 c7 03 07 01 85 04 f9 02 02
E: 16.744215 14 01 07 00 81 04 c3 03 07 01 88 04 f7 02 02
E: 16.752219 14 01 07 00 7c 04 be 03 07 01 8a 04 f4 02 02
E: 16.760224 14 01 07 00 78 04 ba 03 07 01 8d 04 f1 02 02
E: 16.768228 14 01 07 00 73 04 b5 03 07 01 90 04 ef 02 02
E: 16.776232 14 01 07 00 6f 04 b1 03 07 01 93 04 ec 02 02
E: 16.784236 14 01 07 00 6c 04 ad 03 07 01 95 04 e9 02 02
E: 16.792240 14 01 07 00 68 04 a9 03 07 01 98 04 e6 02 02
E: 16.800242 14 01 07 00 64 04 a5 03 07 01 9b 04 e4 02 02
E: 16.808248 14 01 07 00 61 04 a1 03 07 01 9d 04 e1 02 02
E: 16.816251 14 01 07 00 5b 04 9b 03 07 01 a3 04 e0 02 02
E: 16.824256 14 01 07 00 56 04 95 03 07 01 a7 04 de 02 02
E: 16.832260 14 01 07 00 51 04 8f 03 07 01 ab 04 dd 02 02
E: 16.840262 14 01 07 00 4e 04 8a 03 07 01 af 04 da 02 02
E: 16.848267 14 01 07 00 4b 04 84 03 07 01 b2 04 d8 02 02
E: 16.856267 14 01 07 00 4b 04 84 03 07 01 b2 04 d8 02 02
E: 16.864275 14 01 07 00 49 04 7f 03 07 01 b5 04 d5 02 02
E: 16.872280 14 01 07 00 47 04 7a 03 07 01 b8 04 d2 02 02
E: 16.880284 14 01 07 00 45 04 76 03 07 01 bb 04 ce 02 02
E: 16.888286 14 01 07 00 44 04 71 03 07 01 be 04 cb 02 02
E: 16.896290 14 01 07 00 43 04 6c 03 07 01 c1 04 c7 02 02
E: 16.904294 14 01 07 00 43 04 68 03 07 01 c3 04 c3 02 02
E: 16.912299 14 01 07 00 42 04 63 03 07 01 c5 04 bf 02 02
E: 16.920302 14 01 07 00 42 04 5e 03 07 01 c7 04 bb 02 02
E: 16.928307 14 01 07 00 41 04 59 03 07 01 ca 04 b7 02 02
E: 16.936310 14 01 07 00 41 04 54 03 07 01 cc 04 b3 02 02
E: 16.944315 14 01 07 00 41 04 4f 03 07 01 cf 04 af 02 02
E: 16.952317 14 01 07 00 42 04 4a 03 07 01 d1 04 ab 02 02
E: 16.960322 14 01 07 00 42 04 46 03 07 01 d4 04 a7 02 02
E: 16.968350 14 01 07 00 43 04 41 03 07 01 d7 04 a2 02 02
E: 16.976332 14 01 07 00 44 04 3c 03 07 01 db 04 9e 02 02
E: 16.984300 14 01 07 00 45 04 37 03 07 01 df 04 99 02 02
E: 16.992339 14 01 07 00 46 04 32 03 07 01 e3 04 95 02 02
E: 17.000338 14 01 07 00 46 04 32 03 07 01 e3 04 95 02 02
E: 17.008346 14 01 07 00 47 04 2d 03 07 01 e7 04 90 02 02
E: 17.016351 14 01 07 00 49 04 28 03 07 01 eb 04 8c 02 02
E: 17.024349 14 01 07 00 49 04 28 03 07 01 eb 04 8c 02 02
E: 17.032358 14 01 07 00 4b 04 24 03 07 01 f0 04 87 02 02
E: 17.040362 14 01 07 00 4d 04 1e 03 07 01 f5 04 82 02 02
E: 17.048367 14 01 07 00 4f 04 19 03 07 01 fa 04 7d 02 02
E: 17.056369 14 01 07 00 52 04 14 03 07 01 ff 04 78 02 02
E: 17.064375 14 01 07 00 55 04 0f 03 07 01 04 05 72 02 02
E: 17.072378 14 01 07 00 58 04 09 03 07 01 0a 05 6c 02 02
E: 17.080382 14 01 07 00 5c 04 03 03 07 01 10 05 66 02 02
E: 17.088385 14 01 07 00 60 04 fe 02 07 01 16 05 60 02 02
E: 17.096391 14 01 07 00 65 04 f8 02 07 01 1c 05 5a 02 02
E: 17.104393 14 01 07 00 69 04 f3 02 07 01 22 05 54 02 02
E: 17.112399 14 01 07 00 6f 04 ed 02 07 01 28 05 4e 02 02
E: 17.120401 14 01 07 00 74 04 e8 02 07 01 2f 05 48 02 02
E: 17.128377 14 01 07 00 7a 04 e3 02 07 01 35 05 42 02 02
E: 17.136382 14 01 07 00 80 04 de 02 07 01 3c 05 3c 02 02
E: 17.144414 14 01 07 00 87 04 d9 02 07 01 42 05 36 02 02
E: 17.152416 14 01 07 00 8e 04 d4 02 07 01 49 05 30 02 02
E: 17.160421 14 01 07 00 95 04 cf 02 07 01 50 05 2b 02 02
E: 17.168425 14 01 07 00 9c 04 ca 02 07 01 56 05 25 02 02
E: 17.176429 14 01 07 00 a3 04 c5 02 07 01 5d 05 20 02 02
E: 17.184433 14 01 07 00 aa 04 c1 02 07 01 63 05 1c 02 02
E: 17.192432 14 01 07 00 aa 04 c1 02 07 01 63 05 1c 02 02
E: 17.200441 14 01 07 00 b1 04 bd 02 07 01 6a 05 17 02 02
E: 17.208445 14 01 07 00 b8 04 ba 02 07 01 70 05 13 02 02
E: 17.216448 14 01 07 00 bf 04 b6 02 07 01 77 05 0f 02 02
E: 17.224452 14 01 07 00 c5 04 b3 02 07 01 7d 05 0c 02 02
E: 17.232456 14 01 07 00 cc 04 b0 02 07 01 83 05 09 02 02
E: 17.240460 14 01 07 00 d3 04 ae 02 07 01 89 05 06 02 02
E: 17.248463 14 01 07 00 d9 04 ac 02 07 01 8f 05 03 02 02
E: 17.256468 14 01 07 00 e0 04 aa 02 07 01 95 05 01 02 02
E: 17.264472 14 01 07 00 e5 04 a8 02 07 01 9a 05 ff 01 02
E: 17.272476 14 01 07 00 eb 04 a7 02 07 01 9f 05 fe 01 02
E: 17.280480 14 01 07 00 f0 04 a6 02 07 01 a4 05 fc 01 02
E: 17.288483 14 01 07 00 f4 04 a4 02 07 01 a9 05 fb 01 02
E: 17.296478 14 01 07 00 f8 04 a3 02 07 01 ad 05 fa 01 02
E: 17.304492 14 01 07 00 fc 04 a2 02 07 01 b2 05 fa 01 02
E: 17.312495 14 01 07 00 ff 04 a2 02 07 01 b5 05 fa 01 02
E: 17.320499 14 01 07 00 03 05 a1 02 07 01 b9 05 f9 01 02
E: 17.328503 14 01 07 00 06 05 a1 02 07 01 bc 05 f9 01 02
E: 17.336507 14 01 07 00 09 05 a1 02 07 01 bf 05 f9 01 02
E: 17.344512 14 01 07 00 0b 05 a0 02 07 01 c1 05 f9 01 02
E: 17.352514 14 01 07 00 0e 05 a0 02 07 01 c4 05 f9 01 02
E: 17.360515 14 01 07 00 0e 05 a0 02 07 01 c4 05 f9 01 02
E: 17.368523 14 01 07 00 10 05 a0 02 07 01 c6 05 f9 01 02
E: 17.376527 14 01 07 00 12 05 a0 02 07 01 c7 05 f9 01 02
E: 17.384531 14 01 07 00 14 05 a0 02 07 01 c9 05 f9 01 02
E: 17.392534 14 01 07 00 16 05 a0 02 07 01 ca 05 f9 01 02
E: 17.400539 14 01 07 00 17 05 a0 02 07 01 cb 05 f9 01 02
E: 17.408543 14 01 07 00 19 05 a0 02 07 01 cc 05 f9 01 02
E: 17.416551 14 01 07 00 1a 05 a0 02 07 01 cd 05 f9 01 02
E: 17.424551 14 01 07 00 1b 05 a1 02 07 01 ce 05 f9 01 02
E: 17.432554 14 01 07 00 1c 05 a1 02 07 01 ce 05 f9 01 02
E: 17.440558 14 01 07 00 1d 05 a1 02 07 01 cf 05 f9 01 02
E: 17.448562 14 01 07 00 1d 05 a1 02 07 01 d0 05 f9 01 02
E: 17.456566 14 01 07 00 1e 05 a1 02 07 01 d0 05 f9 01 02
E: 17.464570 14 01 07 00 1f 05 a1 02 07 01 d0 05 f9 01 02
E: 17.472571 14 01 07 00 1f 05 a1 02 07 01 d0 05 f9 01 02
E: 17.480577 14 01 07 00 20 05 a1 02 07 01 d0 05 f9 01 02
E: 17.488580 14 01 07 00 21 05 a1 02 07 01 d0 05 f9 01 02
E: 17.496582 14 01 07 00 21 05 a1 02 07 01 d0 05 f9 01 02
E: 17.504586 14 01 07 00 21 05 a1 02 07 01 d0 05 f9 01 02
E: 17.512594 14 01 07 00 21 05 a1 02 07 01 d1 05 f9 01 02
E: 17.520594 14 01 07 00 21 05 a1 02 07 01 d1 05 f9 01 02
E: 17.528600 14 01 07 00 21 05 a1 02 07 01 d1 05 f9 01 02
E: 17.536601 14 01 07 00 21 05 a1 02 07 01 d1 05 f9 01 02
E: 17.544605 14 01 07 00 21 05 a1 02 07 01 d1 05 f9 01 02
E: 17.552613 14 01 07 00 22 05 a1 02 07 01 d1 05 f9 01 02
E: 17.560614 14 01 07 00 22 05 a1 02 07 01 d1 05 f9 01 02
E: 17.568618 14 01 07 00 22 05 a1 02 07 01 d1 05 f9 01 02
E: 17.576622 14 01 07 00 22 05 a1 02 07 01 d1 05 f9 01 02
E: 17.584626 14 01 07 00 22 05 a1 02 07 01 d1 05 f9 01 02
E: 17.592629 14 01 07 00 22 05 a1 02 07 01 d1 05 f9 01 02
E: 17.600633 14 01 07 00 22 05 a1 02 07 01 d1 05 f9 01 02
E: 17.608637 14 01 07 00 22 05 a1 02 07 01 d1 05 f9 01 02
E: 17.616642 14 01 07 00 22 05 a1 02 07 01 d1 05 f9 01 02
E: 17.624645 14 01 07 00 22 05 a1 02 07 01 d1 05 f9 01 02
E: 17.632650 14 01 07 00 22 05 a1 02 07 01 d1 05 f9 01 02
E: 17.640653 14 01 07 00 22 05 a1 02 07 01 d1 05 f9 01 02
E: 17.648661 14 01 07 00 23 05 a1 02 07 01 d2 05 f8 01 02
E: 17.656665 14 01 07 00 22 05 a1 02 07 01 d2 05 f8 01 02
E: 17.664665 14 01 07 00 22 05 a1 02 07 01 d2 05 f8 01 02
E: 17.672669 14 01 07 00 22 05 a1 02 07 01 d2 05 f8 01 02
E: 17.680673 14 01 07 00 22 05 a1 02 07 01 d2 05 f8 01 02
E: 17.688675 14 01 07 00 22 05 a1 02 07 01 d2 05 f8 01 02
E: 17.696681 14 01 07 00 22 05 a1 02 07 01 d2 05 f8 01 02
E: 17.704685 14 01 07 00 22 05 a1 02 07 01 d2 05 f8 01 02
E: 17.712689 14 01 07 00 22 05 a1 02 07 01 d2 05 f8 01 02
E: 17.720692 14 01 07 00 22 05 a1 02 07 01 d2 05 f8 01 02
E: 17.728700 14 01 07 00 23 05 a1 02 07 01 d2 05 f8 01 02
E: 17.736705 14 01 07 00 24 05 a0 02 07 01 d2 05 f8 01 02
E: 17.744705 14 01 07 00 24 05 a0 02 07 01 d2 05 f8 01 02
E: 17.752707 14 01 07 00 24 05 a0 02 07 01 d2 05 f8 01 02
E: 17.760712 14 01 07 00 24 05 a0 02 07 01 d2 05 f8 01 02
E: 17.768716 14 01 07 00 24 05 a0 02 07 01 d2 05 f8 01 02
E: 17.776720 14 01 07 00 24 05 a0 02 07 01 d2 05 f8 01 02
E: 17.784724 14 01 07 00 24 05 a0 02 07 01 d2 05 f8 01 02
E: 17.792728 14 01 07 00 24 05 a0 02 07 01 d2 05 f8 01 02
E: 17.800734 14 01 06 00 24 05 a0 02 07 01 d2 05 f8 01 02
E: 17.808734 14 01 06 00 24 05 a0 02 07 01 d2 05 f8 01 02
E: 17.816738 14 01 07 01 d2 05 f8 01 00 01 d2 05 f8 01 01
E: 17.824742 14 01 07 01 d2 05 f8 01 00 01 d2 05 f8 01 01
E: 17.832746 14 01 07 01 d2 05 f8 01 00 01 d2 05 f8 01 01
E: 17.840750 14 01 07 01 d2 05 f8 01 00 01 d2 05 f8 01 01
E: 17.848754 14 01 07 01 d2 05 f8 01 00 01 d2 05 f8 01 01
E: 17.856758 14 01 07 01 d2 05 f8 01 00 01 d2 05 f8 01 01
E: 17.864762 14 01 07 01 d2 05 f8 01 00 01 d2 05 f8 01 01
E: 17.872766 14 01 07 01 d2 05 f8 01 00 01 d2 05 f8 01 01
E: 17.880770 14 01 07 01 d2 05 f8 01 00 01 d2 05 f8 01 01
E: 17.888774 14 01 07 01 d2 05 f8 01 00 01 d2 05 f8 01 01
E: 17.896778 14 01 07 01 d2 05 f8 01 00 01 d2 05 f8 01 01
E: 17.904782 14 01 07 01 d2 05 f8 01 00 01 d2 05 f8 01 01
E: 17.912785 14 01 07 01 d2 05 f8 01 00 01 d2 05 f8 01 01
E: 17.920790 14 01 07 01 d2 05 f8 01 00 01 d2 05 f8 01 01
E: 17.928793 14 01 07 01 d2 05 f8 01 00 01 d2 05 f8 01 01
E: 17.936798 14 01 07 01 d2 05 f8 01 00 01 d2 05 f8 01 01
E: 17.944802 14 01 07 01 d2 05 f8 01 00 01 d2 05 f8 01 01
E: 17.952805 14 01 07 01 d2 05 f8 01 00 01 d2 05 f8 01 01
E: 17.960808 14 01 07 01 d2 05 f8 01 00 01 d2 05 f8 01 01
E: 17.968813 14 01 07 01 d2 05 f8 01 00 01 d2 05 f8 01 01
E: 17.976817 14 01 07 01 d2 05 f8 01 00 01 d2 05 f8 01 01
E: 17.984821 14 01 07 01 d2 05 f8 01 00 01 d2 05 f8 01 01
E: 17.992826 14 01 07 01 d2 05 f8 01 00 01 d2 05 f8 01 01
E: 18.000829 14 01 07 01 d2 05 f8 01 00 01 d2 05 f8 01 01
E: 18.008834 14 01 07 01 d2 05 f8 01 00 01 d2 05 f8 01 01
E: 18.016837 14 01 07 01 d2 05 f8 01 00 01 d2 05 f8 01 01
E: 18.024840 14 01 07 01 d2 05 f8 01 00 01 d2 05 f8 01 01
E: 18.032845 14 01 07 01 d2 05 f8 01 00 01 d2 05 f8 01 01
E: 18.040849 14 01 07 01 d2 05 f8 01 00 01 d2 05 f8 01 01
E: 18.048853 14 01 07 01 d2 05 f8 01 00 01 d2 05 f8 01 01
E: 18.056857 14 01 07 01 d2 05 f8 01 00 01 d2 05 f8 01 01
E: 18.064860 14 01 07 01 d2 05 f8 01 00 01 d2 05 f8 01 01
E: 18.072864 14 01 07 01 d2 05 f8 01 00 01 d2 05 f8 01 01
E: 18.080868 14 01 07 01 d2 05 f8 01 00 01 d2 05 f8 01 01
E: 18.088842 14 01 07 01 d2 05 f8 01 00 01 d2 05 f8 01 01
E: 18.096876 14 01 07 01 d2 05 f8 01 00 01 d2 05 f8 01 01
E: 18.104880 14 01 07 01 d2 05 f8 01 00 01 d2 05 f8 01 01
E: 18.112884 14 01 07 01 d2 05 f8 01 00 01 d2 05 f8 01 01
E: 18.120889 14 01 07 01 d2 05 f8 01 00 01 d2 05 f8 01 01
E: 18.128892 14 01 07 01 d2 05 f8 01 00 01 d2 05 f8 01 01
E: 18.136896 14 01 07 01 d2 05 f8 01 00 01 d2 05 f8 01 01
E: 18.144900 14 01 07 01 d2 05 f8 01 00 01 d2 05 f8 01 01
E: 18.152903 14 01 07 01 d2 05 f8 01 00 01 d2 05 f8 01 01
E: 18.160908 14 01 07 01 d2 05 f8 01 00 01 d2 05 f8 01 01
E: 18.168912 14 01 07 01 d2 05 f8 01 00 01 d2 05 f8 01 01
E: 18.176915 14 01 07 01 d2 05 f8 01 00 01 d2 05 f8 01 01
E: 18.184920 14 01 07 01 d2 05 f8 01 00 01 d2 05 f8 01 01
E: 18.192923 14 01 07 01 d2 05 f8 01 00 01 d2 05 f8 01 01
E: 18.200927 14 01 07 01 d2 05 f8 01 00 01 d2 05 f8 01 01
E: 18.208932 14 01 07 01 d2 05 f8 01 00 01 d2 05 f8 01 01
E: 18.216935 14 01 07 01 d2 05 f8 01 00 01 d2 05 f8 01 01
E: 18.224940 14 01 07 01 d2 05 f8 01 00 01 d2 05 f8 01 01
E: 18.232943 14 01 07 01 d2 05 f8 01 00 01 d2 05 f8 01 01
E: 18.240947 14 01 07 01 d2 05 f8 01 00 01 d2 05 f8 01 01
E: 18.248951 14 01 07 01 d2 05 f8 01 00 01 d2 05 f8 01 01
E: 18.256960 14 01 07 01 d1 05 f8 01 00 01 d2 05 f8 01 01
E: 18.264960 14 01 07 01 d1 05 f8 01 00 01 d2 05 f8 01 01
E: 18.272963 14 01 07 01 d1 05 f8 01 00 01 d2 05 f8 01 01
E: 18.280968 14 01 07 01 d1 05 f8 01 00 01 d2 05 f8 01 01
E: 18.288941 14 01 07 01 d1 05 f8 01 00 01 d2 05 f8 01 01
E: 18.296975 14 01 07 01 d1 05 f8 01 00 01 d2 05 f8 01 01
E: 18.304979 14 01 07 01 d1 05 f8 01 00 01 d2 05 f8 01 01
E: 18.312983 14 01 07 01 d1 05 f8 01 00 01 d2 05 f8 01 01
E: 18.320987 14 01 07 01 d1 05 f8 01 00 01 d2 05 f8 01 01
E: 18.328991 14 01 07 01 d1 05 f8 01 00 01 d2 05 f8 01 01
E: 18.336993 14 01 07 01 d1 05 f8 01 00 01 d2 05 f8 01 01
E: 18.344998 14 01 07 01 d1 05 f8 01 00 01 d2 05 f8 01 01
E: 18.353001 14 01 07 01 d1 05 f8 01 00 01 d2 05 f8 01 01
E: 18.361006 14 01 07 01 d1 05 f8 01 00 01 d2 05 f8 01 01
E: 18.369011 14 01 07 01 d1 05 f8 01 00 01 d2 05 f8 01 01
E: 18.377014 14 01 07 01 d1 05 f8 01 00 01 d2 05 f8 01 01
E: 18.385018 14 01 07 01 d1 05 f8 01 00 01 d2 05 f8 01 01
E: 18.393021 14 01 07 01 d1 05 f8 01 00 01 d2 05 f8 01 01
E: 18.401026 14 01 07 01 d1 05 f8 01 00 01 d2 05 f8 01 01
E: 18.409030 14 01 07 01 d1 05 f8 01 00 01 d2 05 f8 01 01
E: 18.417035 14 01 07 01 d1 05 f8 01 00 01 d2 05 f8 01 01
E: 18.425039 14 01 07 01 d1 05 f8 01 00 01 d2 05 f8 01 01
E: 18.433043 14 01 07 01 d1 05 f8 01 00 01 d2 05 f8 01 01
E: 18.441046 14 01 07 01 d1 05 f8 01 00 01 d2 05 f8 01 01
E: 18.449050 14 01 07 01 d1 05 f8 01 00 01 d2 05 f8 01 01
E: 18.457054 14 01 07 01 d1 05 f8 01 00 01 d2 05 f8 01 01
E: 18.465057 14 01 07 01 d1 05 f8 01 00 01 d2 05 f8 01 01
E: 18.473062 14 01 07 01 d1 05 f8 01 00 01 d2 05 f8 01 01
E: 18.481066 14 01 07 01 d1 05 f8 01 00 01 d2 05 f8 01 01
E: 18.489070 14 01 07 01 d1 05 f8 01 00 01 d2 05 f8 01 01
E: 18.497072 14 01 07 01 d1 05 f8 01 00 01 d2 05 f8 01 01
E: 18.505077 14 01 07 01 d1 05 f8 01 00 01 d2 05 f8 01 01
E: 18.513081 14 01 07 01 d1 05 f8 01 00 01 d2 05 f8 01 01
E: 18.521086 14 01 07 01 d1 05 f8 01 00 01 d2 05 f8 01 01
E: 18.529089 14 01 07 01 d1 05 f8 01 00 01 d2 05 f8 01 01
E: 18.537094 14 01 07 01 d1 05 f8 01 00 01 d2 05 f8 01 01
E: 18.545098 14 01 07 01 d1 05 f8 01 00 01 d2 05 f8 01 01
E: 18.553100 14 01 07 01 d1 05 f8 01 00 01 d2 05 f8 01 01
E: 18.561105 14 01 07 01 d1 05 f8 01 00 01 d2 05 f8 01 01
E: 18.569109 14 01 07 01 d1 05 f8 01 00 01 d2 05 f8 01 01
E: 18.577112 14 01 07 01 d1 05 f8 01 00 01 d2 05 f8 01 01
E: 18.585117 14 01 07 01 d1 05 f8 01 00 01 d2 05 f8 01 01
E: 18.593121 14 01 07 01 d1 05 f8 01 00 01 d2 05 f8 01 01
E: 18.601125 14 01 07 01 d1 05 f8 01 00 01 d2 05 f8 01 01
E: 18.609128 14 01 07 01 d1 05 f8 01 00 01 d2 05 f8 01 01
E: 18.617132 14 01 07 01 d1 05 f8 01 00 01 d2 05 f8 01 01
E: 18.625137 14 01 07 01 d1 05 f8 01 00 01 d2 05 f8 01 01
E: 18.633141 14 01 07 01 d1 05 f8 01 00 01 d2 05 f8 01 01
E: 18.641145 14 01 07 01 d1 05 f8 01 00 01 d2 05 f8 01 01
E: 18.649153 14 01 07 01 d1 05 f9 01 00 01 d2 05 f8 01 01
E: 18.657152 14 01 07 01 d1 05 f9 01 00 01 d2 05 f8 01 01
E: 18.665156 14 01 07 01 d1 05 f9 01 00 01 d2 05 f8 01 01
E: 18.673161 14 01 07 01 d1 05 f9 01 00 01 d2 05 f8 01 01
E: 18.681164 14 01 07 01 d1 05 f9 01 00 01 d2 05 f8 01 01
E: 18.689168 14 01 07 01 d1 05 f9 01 00 01 d2 05 f8 01 01
E: 18.697173 14 01 07 01 d1 05 f9 01 00 01 d2 05 f8 01 01
E: 18.705176 14 01 07 01 d1 05 f9 01 00 01 d2 05 f8 01 01
E: 18.713180 14 01 07 01 d1 05 f9 01 00 01 d2 05 f8 01 01
E: 18.721184 14 01 07 01 d1 05 f9 01 00 01 d2 05 f8 01 01
E: 18.729188 14 01 07 01 d1 05 f9 01 00 01 d2 05 f8 01 01
E: 18.737192 14 01 07 01 d1 05 f9 01 00 01 d2 05 f8 01 01
E: 18.745196 14 01 07 01 d1 05 f9 01 00 01 d2 05 f8 01 01
E: 18.753199 14 01 07 01 d1 05 f9 01 00 01 d2 05 f8 01 01
E: 18.761205 14 01 07 01 d1 05 f9 01 00 01 d2 05 f8 01 01
E: 18.769207 14 01 07 01 d1 05 f9 01 00 01 d2 05 f8 01 01
E: 18.777212 14 01 07 01 d1 05 f9 01 00 01 d2 05 f8 01 01
E: 18.785215 14 01 07 01 d1 05 f9 01 00 01 d2 05 f8 01 01
E: 18.793219 14 01 07 01 d1 05 f9 01 00 01 d2 05 f8 01 01
E: 18.801224 14 01 07 01 d1 05 f9 01 00 01 d2 05 f8 01 01
E: 18.809227 14 01 07 01 d1 05 f9 01 00 01 d2 05 f8 01 01
E: 18.817231 14 01 07 01 d1 05 f9 01 00 01 d2 05 f8 01 01
E: 18.825235 14 01 07 01 d1 05 f9 01 00 01 d2 05 f8 01 01
E: 18.833239 14 01 07 01 d1 05 f9 01 00 01 d2 05 f8 01 01
E: 18.841243 14 01 07 01 d1 05 f9 01 00 01 d2 05 f8 01 01
E: 18.849247 14 01 07 01 d1 05 f9 01 00 01 d2 05 f8 01 01
E: 18.857252 14 01 07 01 d1 05 f9 01 00 01 d2 05 f8 01 01
E: 18.865255 14 01 07 01 d1 05 f9 01 00 01 d2 05 f8 01 01
E: 18.873259 14 01 07 01 d1 05 f9 01 00 01 d2 05 f8 01 01
E: 18.881264 14 01 07 01 d1 05 f9 01 00 01 d2 05 f8 01 01
E: 18.889267 14 01 07 01 d1 05 f9 01 00 01 d2 05 f8 01 01
E: 18.897271 14 01 07 01 d1 05 f9 01 00 01 d2 05 f8 01 01
E: 18.905275 14 01 07 01 d1 05 f9 01 00 01 d2 05 f8 01 01
E: 18.913279 14 01 07 01 d1 05 f9 01 00 01 d2 05 f8 01 01
E: 18.921283 14 01 07 01 d1 05 f9 01 00 01 d2 05 f8 01 01
E: 18.929286 14 01 07 01 d1 05 f9 01 00 01 d2 05 f8 01 01
E: 18.937290 14 01 07 01 d1 05 f9 01 00 01 d2 05 f8 01 01
E: 18.945296 14 01 06 01 d1 05 f9 01 00 01 d2 05 f8 01 01
# 3. Finally, move your ten fingers on the screen and release them.
E: 86.226468 14 01 07 01 88 06 aa 02 07 00 cc 00 a4 02 02
E: 86.234449 14 01 07 01 88 06 aa 02 07 00 cc 00 a4 02 02
E: 86.242426 14 01 07 01 88 06 aa 02 07 00 cc 00 a4 02 02
E: 86.250461 14 01 07 01 88 06 aa 02 07 00 cc 00 a4 02 02
E: 86.258488 14 01 07 01 88 06 aa 02 07 00 cc 00 a4 02 02
E: 86.266484 14 01 07 01 88 06 aa 02 07 00 cc 00 a4 02 02
E: 86.274495 14 01 07 01 88 06 aa 02 07 00 cc 00 a4 02 02
E: 86.282498 14 01 07 01 87 06 aa 02 07 00 cc 00 a5 02 02
E: 86.290508 14 01 07 01 86 06 ab 02 07 00 cd 00 a5 02 02
E: 86.298501 14 01 07 01 86 06 ab 02 07 00 cd 00 a5 02 02
E: 86.306513 14 01 07 01 85 06 ab 02 07 00 ce 00 a6 02 02
E: 86.314514 14 01 07 01 83 06 ab 02 07 00 d0 00 a7 02 02
E: 86.322516 14 01 07 01 83 06 ab 02 07 00 d0 00 a7 02 02
E: 86.330523 14 01 07 01 81 06 ac 02 07 00 d2 00 a8 02 02
E: 86.338531 14 01 07 01 7f 06 ac 02 07 00 d4 00 a9 02 02
E: 86.346506 14 01 07 01 7c 06 ad 02 07 00 d6 00 aa 02 02
E: 86.354508 14 01 07 01 78 06 ae 02 07 00 d9 00 ab 02 02
E: 86.362541 14 01 07 01 74 06 af 02 07 00 dc 00 ad 02 02
E: 86.370547 14 01 07 01 70 06 b0 02 07 00 df 00 ae 02 02
E: 86.378547 14 01 07 01 6b 06 b1 02 07 00 e2 00 b0 02 02
E: 86.386553 14 01 07 01 66 06 b2 02 07 00 e6 00 b2 02 02
E: 86.394549 14 01 07 01 66 06 b2 02 07 00 e6 00 b2 02 02
E: 86.402555 14 01 07 01 66 06 b2 02 07 00 e6 00 b2 02 02
E: 86.410556 14 01 07 01 66 06 b2 02 07 00 e6 00 b2 02 02
E: 86.418546 14 01 07 01 66 06 b2 02 07 00 e6 00 b2 02 02
E: 86.426557 14 01 06 01 66 06 b2 02 06 00 e6 00 b2 02 02
E: 87.563130 14 01 07 01 c7 05 d0 01 07 00 89 01 90 01 02
E: 87.571142 14 01 07 01 c7 05 d0 01 07 00 89 01 90 01 02
E: 87.579232 14 01 07 01 c7 05 d0 01 07 00 89 01 90 01 02
E: 87.587147 14 01 07 01 c7 05 d0 01 07 00 89 01 90 01 02
E: 87.595139 14 01 07 01 c7 05 d0 01 07 00 89 01 90 01 02
E: 87.604031 14 01 06 01 c7 05 d0 01 06 00 89 01 90 01 02
E: 87.675197 14 01 07 01 1d 05 bc 01 07 00 36 02 8e 01 02
E: 87.683232 14 01 07 01 1d 05 bc 01 07 00 36 02 8e 01 02
E: 87.691179 14 01 07 01 1d 05 bc 01 07 00 36 02 8e 01 02
E: 87.699198 14 01 07 01 1d 05 bc 01 07 00 36 02 8e 01 02
E: 87.707177 14 01 07 01 1d 05 bc 01 07 00 36 02 8e 01 02
E: 87.715209 14 01 06 01 1d 05 bc 01 06 00 36 02 8e 01 02
# Thank you.
