R: 430 05 01 09 02 a1 01 85 0d 09 01 a1 00 05 09 19 01 29 02 15 00 25 01 95 02 75 01 81 02 05 0d 09 32 95 01 75 01 81 02 95 01 75 05 81 03 05 01 55 0e 65 11 75 10 95 01 35 00 46 98 12 26 7f 07 09 30 81 22 46 78 0a 26 37 04 09 31 81 22 35 00 45 00 15 81 25 7f 75 08 95 01 09 38 81 06 09 00 75 08 95 07 81 03 c0 c0 05 0d 09 04 a1 01 85 01 09 22 a1 02 09 42 15 00 25 01 75 01 95 01 81 02 09 32 81 02 09 47 81 02 95 05 81 03 75 08 09 51 95 01 81 02 05 01 75 10 55 0e 65 11 09 30 35 00 46 98 12 26 7f 07 81 02 09 31 46 78 0a 26 37 04 81 02 c0 a1 02 05 0d 09 42 15 00 25 01 75 01 95 01 81 02 09 32 81 02 09 47 81 02 95 05 81 03 75 08 09 51 95 01 81 02 05 01 75 10 55 0e 65 11 09 30 35 00 46 98 12 26 7f 07 81 02 46 78 0a 26 37 04 09 31 81 02 c0 05 0d 09 54 15 00 26 ff 00 95 01 75 08 81 02 09 55 25 02 95 01 85 02 b1 02 c0 05 0d 09 0e a1 01 06 00 ff 09 01 26 ff 00 75 08 95 47 85 03 b1 02 09 01 96 ff 03 85 04 b1 02 09 01 95 0b 85 05 b1 02 09 01 96 ff 03 85 06 b1 02 09 01 95 0f 85 07 b1 02 09 01 96 ff 03 85 08 b1 02 09 01 96 ff 03 85 09 b1 02 09 01 95 3f 85 0a b1 02 09 01 96 ff 03 85 0b b1 02 09 01 96 c3 03 85 0e b1 02 09 01 96 ff 03 85 0f b1 02 09 01 96 83 03 85 10 b1 02 09 01 96 93 00 85 11 b1 02 09 01 96 ff 03 85 12 b1 02 05 0d 09 23 a1 02 09 52 09 53 15 00 25 0a 75 08 95 02 85 0c b1 02 c0 c0
N: TPV OpticalTouchScreen
I: 3 25aa 8883
# 1. Drag _one_ finger on the screen from one corner to the opposite, and release it.
E: 0.000000 14 01 07 00 24 00 19 04 00 01 a7 02 cb 01 01
E: 0.008019 14 01 07 00 24 00 19 04 00 01 a7 02 cb 01 01
E: 0.016008 14 01 07 00 24 00 19 04 00 01 a7 02 cb 01 01
E: 0.024036 14 01 07 00 24 00 19 04 00 01 a7 02 cb 01 01
E: 0.032009 14 01 07 00 24 00 19 04 00 01 a7 02 cb 01 01
E: 0.040019 14 01 07 00 24 00 19 04 00 01 a7 02 cb 01 01
E: 0.048024 14 01 07 00 24 00 19 04 00 01 a7 02 cb 01 01
E: 0.055987 14 01 07 00 24 00 19 04 00 01 a7 02 cb 01 01
E: 0.063965 14 01 07 00 24 00 19 04 00 01 a7 02 cb 01 01
E: 0.072044 14 01 07 00 28 00 16 04 00 01 a7 02 cb 01 01
E: 0.080004 14 01 07 00 2b 00 14 04 00 01 a7 02 cb 01 01
E: 0.087985 14 01 07 00 2e 00 12 04 00 01 a7 02 cb 01 01
E: 0.096023 14 01 07 00 32 00 10 04 00 01 a7 02 cb 01 01
E: 0.103987 14 01 07 00 35 00 0e 04 00 01 a7 02 cb 01 01
E: 0.112288 14 01 07 00 39 00 0c 04 00 01 a7 02 cb 01 01
E: 0.120009 14 01 07 00 3b 00 08 04 00 01 a7 02 cb 01 01
E: 0.128033 14 01 07 00 3e 00 05 04 00 01 a7 02 cb 01 01
E: 0.135997 14 01 07 00 41 00 02 04 00 01 a7 02 cb 01 01
E: 0.144010 14 01 07 00 45 00 fe 03 00 01 a7 02 cb 01 01
E: 0.152068 14 01 07 00 4a 00 fb 03 00 01 a7 02 cb 01 01
E: 0.159994 14 01 07 00 4e 00 f8 03 00 01 a7 02 cb 01 01
E: 0.167998 14 01 07 00 54 00 f4 03 00 01 a7 02 cb 01 01
E: 0.176016 14 01 07 00 54 00 f4 03 00 01 a7 02 cb 01 01
E: 0.184062 14 01 07 00 5a 00 f1 03 00 01 a7 02 cb 01 01
E: 0.192071 14 01 07 00 60 00 ec 03 00 01 a7 02 cb 01 01
E: 0.200028 14 01 07 00 68 00 e8 03 00 01 a7 02 cb 01 01
E: 0.208028 14 01 07 00 68 00 e8 03 00 01 a7 02 cb 01 01
E: 0.216003 14 01 07 00 6f 00 e3 03 00 01 a7 02 cb 01 01
E: 0.223987 14 01 07 00 77 00 de 03 00 01 a7 02 cb 01 01
E: 0.231960 14 01 07 00 7f 00 d8 03 00 01 a7 02 cb 01 01
E: 0.240012 14 01 07 00 88 00 d2 03 00 01 a7 02 cb 01 01
E: 0.248040 14 01 07 00 92 00 cb 03 00 01 a7 02 cb 01 01
E: 0.256030 14 01 07 00 9c 00 c5 03 00 01 a7 02 cb 01 01
E: 0.264028 14 01 07 00 a6 00 bf 03 00 01 a7 02 cb 01 01
E: 0.272035 14 01 07 00 b1 00 b8 03 00 01 a7 02 cb 01 01
E: 0.280004 14 01 07 00 bc 00 b0 03 00 01 a7 02 cb 01 01
E: 0.287983 14 01 07 00 c8 00 a7 03 00 01 a7 02 cb 01 01
E: 0.295946 14 01 07 00 d5 00 9f 03 00 01 a7 02 cb 01 01
E: 0.304000 14 01 07 00 e2 00 97 03 00 01 a7 02 cb 01 01
E: 0.314971 14 01 07 00 f0 00 8d 03 00 01 a7 02 cb 01 01
E: 0.320046 14 01 07 00 fd 00 84 03 00 01 a7 02 cb 01 01
E: 0.328025 14 01 07 00 0c 01 7a 03 00 01 a7 02 cb 01 01
E: 0.336042 14 01 07 00 1b 01 70 03 00 01 a7 02 cb 01 01
E: 0.344003 14 01 07 00 1b 01 70 03 00 01 a7 02 cb 01 01
E: 0.352038 14 01 07 00 2b 01 66 03 00 01 a7 02 cb 01 01
E: 0.360032 14 01 07 00 3b 01 5c 03 00 01 a7 02 cb 01 01
E: 0.368039 14 01 07 00 4c 01 52 03 00 01 a7 02 cb 01 01
E: 0.377883 14 01 07 00 5d 01 47 03 00 01 a7 02 cb 01 01
E: 0.383996 14 01 07 00 6f 01 3d 03 00 01 a7 02 cb 01 01
E: 0.391997 14 01 07 00 80 01 33 03 00 01 a7 02 cb 01 01
E: 0.400020 14 01 07 00 92 01 29 03 00 01 a7 02 cb 01 01
E: 0.408149 14 01 07 00 a4 01 1f 03 00 01 a7 02 cb 01 01
E: 0.416152 14 01 07 00 b6 01 16 03 00 01 a7 02 cb 01 01
E: 0.424009 14 01 07 00 c8 01 0d 03 00 01 a7 02 cb 01 01
E: 0.432002 14 01 07 00 db 01 04 03 00 01 a7 02 cb 01 01
E: 0.440052 14 01 07 00 ed 01 fb 02 00 01 a7 02 cb 01 01
E: 0.448030 14 01 07 00 00 02 f1 02 00 01 a7 02 cb 01 01
E: 0.456024 14 01 07 00 13 02 e8 02 00 01 a7 02 cb 01 01
E: 0.464023 14 01 07 00 26 02 de 02 00 01 a7 02 cb 01 01
E: 0.472004 14 01 07 00 39 02 d4 02 00 01 a7 02 cb 01 01
E: 0.479993 14 01 07 00 4c 02 cb 02 00 01 a7 02 cb 01 01
E: 0.487986 14 01 07 00 5f 02 c1 02 00 01 a7 02 cb 01 01
E: 0.496240 14 01 07 00 72 02 b8 02 00 01 a7 02 cb 01 01
E: 0.504037 14 01 07 00 84 02 ae 02 00 01 a7 02 cb 01 01
E: 0.512023 14 01 07 00 84 02 ae 02 00 01 a7 02 cb 01 01
E: 0.520033 14 01 07 00 97 02 a4 02 00 01 a7 02 cb 01 01
E: 0.528022 14 01 07 00 aa 02 9a 02 00 01 a7 02 cb 01 01
E: 0.536020 14 01 07 00 bd 02 90 02 00 01 a7 02 cb 01 01
E: 0.543980 14 01 07 00 d1 02 86 02 00 01 a7 02 cb 01 01
E: 0.551957 14 01 07 00 e5 02 7c 02 00 01 a7 02 cb 01 01
E: 0.560006 14 01 07 00 f8 02 72 02 00 01 a7 02 cb 01 01
E: 0.568056 14 01 07 00 0c 03 68 02 00 01 a7 02 cb 01 01
E: 0.576004 14 01 07 00 1e 03 5f 02 00 01 a7 02 cb 01 01
E: 0.584031 14 01 07 00 31 03 56 02 00 01 a7 02 cb 01 01
E: 0.592031 14 01 07 00 43 03 4e 02 00 01 a7 02 cb 01 01
E: 0.600046 14 01 07 00 56 03 45 02 00 01 a7 02 cb 01 01
E: 0.607991 14 01 07 00 68 03 3d 02 00 01 a7 02 cb 01 01
E: 0.615994 14 01 07 00 7c 03 34 02 00 01 a7 02 cb 01 01
E: 0.624014 14 01 07 00 90 03 2b 02 00 01 a7 02 cb 01 01
E: 0.635050 14 01 07 00 a4 03 22 02 00 01 a7 02 cb 01 01
E: 0.640059 14 01 07 00 b8 03 19 02 00 01 a7 02 cb 01 01
E: 0.648100 14 01 07 00 cc 03 10 02 00 01 a7 02 cb 01 01
E: 0.656052 14 01 07 00 df 03 07 02 00 01 a7 02 cb 01 01
E: 0.664043 14 01 07 00 f2 03 ff 01 00 01 a7 02 cb 01 01
E: 0.671997 14 01 07 00 05 04 f7 01 00 01 a7 02 cb 01 01
E: 0.679957 14 01 07 00 05 04 f7 01 00 01 a7 02 cb 01 01
E: 0.688008 14 01 07 00 18 04 ef 01 00 01 a7 02 cb 01 01
E: 0.696052 14 01 07 00 2b 04 e7 01 00 01 a7 02 cb 01 01
E: 0.704037 14 01 07 00 3d 04 df 01 00 01 a7 02 cb 01 01
E: 0.712030 14 01 07 00 3d 04 df 01 00 01 a7 02 cb 01 01
E: 0.720024 14 01 07 00 50 04 d7 01 00 01 a7 02 cb 01 01
E: 0.728009 14 01 07 00 62 04 d0 01 00 01 a7 02 cb 01 01
E: 0.735982 14 01 07 00 73 04 c8 01 00 01 a7 02 cb 01 01
E: 0.743949 14 01 07 00 85 04 c0 01 00 01 a7 02 cb 01 01
E: 0.751995 14 01 07 00 96 04 b9 01 00 01 a7 02 cb 01 01
E: 0.762829 14 01 07 00 a7 04 b1 01 00 01 a7 02 cb 01 01
E: 0.768047 14 01 07 00 b8 04 aa 01 00 01 a7 02 cb 01 01
E: 0.776026 14 01 07 00 c8 04 a3 01 00 01 a7 02 cb 01 01
E: 0.784036 14 01 07 00 d8 04 9b 01 00 01 a7 02 cb 01 01
E: 0.792027 14 01 07 00 e8 04 93 01 00 01 a7 02 cb 01 01
E: 0.799986 14 01 07 00 f7 04 8c 01 00 01 a7 02 cb 01 01
E: 0.807977 14 01 07 00 07 05 84 01 00 01 a7 02 cb 01 01
E: 0.816038 14 01 07 00 17 05 7c 01 00 01 a7 02 cb 01 01
E: 0.824442 14 01 07 00 27 05 75 01 00 01 a7 02 cb 01 01
E: 0.832028 14 01 07 00 37 05 6d 01 00 01 a7 02 cb 01 01
E: 0.839994 14 01 07 00 47 05 66 01 00 01 a7 02 cb 01 01
E: 0.848011 14 01 07 00 47 05 66 01 00 01 a7 02 cb 01 01
E: 0.856046 14 01 07 00 56 05 5e 01 00 01 a7 02 cb 01 01
E: 0.863986 14 01 07 00 65 05 57 01 00 01 a7 02 cb 01 01
E: 0.872090 14 01 07 00 73 05 50 01 00 01 a7 02 cb 01 01
E: 0.880085 14 01 07 00 80 05 49 01 00 01 a7 02 cb 01 01
E: 0.889978 14 01 07 00 8b 05 43 01 00 01 a7 02 cb 01 01
E: 0.896056 14 01 07 00 96 05 3c 01 00 01 a7 02 cb 01 01
E: 0.904002 14 01 07 00 a0 05 36 01 00 01 a7 02 cb 01 01
E: 0.912025 14 01 07 00 ab 05 2f 01 00 01 a7 02 cb 01 01
E: 0.920052 14 01 07 00 b6 05 28 01 00 01 a7 02 cb 01 01
E: 0.927979 14 01 07 00 c2 05 21 01 00 01 a7 02 cb 01 01
E: 0.935982 14 01 07 00 cf 05 1a 01 00 01 a7 02 cb 01 01
E: 0.944023 14 01 07 00 dc 05 12 01 00 01 a7 02 cb 01 01
E: 0.952044 14 01 07 00 ea 05 0b 01 00 01 a7 02 cb 01 01
E: 0.960004 14 01 07 00 f8 05 04 01 00 01 a7 02 cb 01 01
E: 0.968035 14 01 07 00 05 06 fd 00 00 01 a7 02 cb 01 01
E: 0.976034 14 01 07 00 12 06 f7 00 00 01 a7 02 cb 01 01
E: 0.984033 14 01 07 00 1d 06 f1 00 00 01 a7 02 cb 01 01
E: 0.991975 14 01 07 00 28 06 ec 00 00 01 a7 02 cb 01 01
E: 0.999946 14 01 07 00 31 06 e6 00 00 01 a7 02 cb 01 01
E: 1.008010 14 01 07 00 3b 06 e1 00 00 01 a7 02 cb 01 01
E: 1.016036 14 01 07 00 3b 06 e1 00 00 01 a7 02 cb 01 01
E: 1.024041 14 01 07 00 45 06 db 00 00 01 a7 02 cb 01 01
E: 1.032054 14 01 07 00 4f 06 d5 00 00 01 a7 02 cb 01 01
E: 1.040060 14 01 07 00 5a 06 cf 00 00 01 a7 02 cb 01 01
E: 1.048025 14 01 07 00 65 06 c9 00 00 01 a7 02 cb 01 01
E: 1.056072 14 01 07 00 6f 06 c4 00 00 01 a7 02 cb 01 01
E: 1.063970 14 01 07 00 7a 06 bf 00 00 01 a7 02 cb 01 01
E: 1.072011 14 01 07 00 84 06 ba 00 00 01 a7 02 cb 01 01
E: 1.080007 14 01 07 00 8e 06 b5 00 00 01 a7 02 cb 01 01
E: 1.088008 14 01 07 00 97 06 b0 00 00 01 a7 02 cb 01 01
E: 1.096005 14 01 07 00 a0 06 ac 00 00 01 a7 02 cb 01 01
E: 1.104025 14 01 07 00 a7 06 a7 00 00 01 a7 02 cb 01 01
E: 1.112036 14 01 07 00 ae 06 a3 00 00 01 a7 02 cb 01 01
E: 1.120042 14 01 07 00 b4 06 9e 00 00 01 a7 02 cb 01 01
E: 1.128031 14 01 07 00 b9 06 9a 00 00 01 a7 02 cb 01 01
E: 1.136058 14 01 07 00 be 06 96 00 00 01 a7 02 cb 01 01
E: 1.146539 14 01 07 00 c3 06 92 00 00 01 a7 02 cb 01 01
E: 1.151998 14 01 07 00 c9 06 8e 00 00 01 a7 02 cb 01 01
E: 1.159999 14 01 07 00 cf 06 8a 00 00 01 a7 02 cb 01 01
E: 1.168016 14 01 07 00 d6 06 86 00 00 01 a7 02 cb 01 01
E: 1.176045 14 01 07 00 d6 06 86 00 00 01 a7 02 cb 01 01
E: 1.184043 14 01 07 00 dd 06 83 00 00 01 a7 02 cb 01 01
E: 1.192100 14 01 07 00 e4 06 7f 00 00 01 a7 02 cb 01 01
E: 1.200034 14 01 07 00 ec 06 7c 00 00 01 a7 02 cb 01 01
E: 1.210199 14 01 07 00 f2 06 79 00 00 01 a7 02 cb 01 01
E: 1.216000 14 01 07 00 f8 06 76 00 00 01 a7 02 cb 01 01
E: 1.223990 14 01 07 00 f8 06 76 00 00 01 a7 02 cb 01 01
E: 1.232007 14 01 07 00 fe 06 73 00 00 01 a7 02 cb 01 01
E: 1.241072 14 01 07 00 02 07 70 00 00 01 a7 02 cb 01 01
E: 1.247968 14 01 07 00 06 07 6e 00 00 01 a7 02 cb 01 01
E: 1.256020 14 01 07 00 0a 07 6b 00 00 01 a7 02 cb 01 01
E: 1.264050 14 01 07 00 0d 07 69 00 00 01 a7 02 cb 01 01
E: 1.272032 14 01 07 00 10 07 67 00 00 01 a7 02 cb 01 01
E: 1.280025 14 01 07 00 13 07 64 00 00 01 a7 02 cb 01 01
E: 1.288022 14 01 07 00 16 07 62 00 00 01 a7 02 cb 01 01
E: 1.296016 14 01 07 00 19 07 60 00 00 01 a7 02 cb 01 01
E: 1.304034 14 01 07 00 1c 07 5e 00 00 01 a7 02 cb 01 01
E: 1.311985 14 01 07 00 1f 07 5d 00 00 01 a7 02 cb 01 01
E: 1.320103 14 01 07 00 21 07 5b 00 00 01 a7 02 cb 01 01
E: 1.328090 14 01 07 00 23 07 5a 00 00 01 a7 02 cb 01 01
E: 1.336070 14 01 07 00 23 07 59 00 00 01 a7 02 cb 01 01
E: 1.344045 14 01 07 00 23 07 59 00 00 01 a7 02 cb 01 01
E: 1.352008 14 01 07 00 24 07 59 00 00 01 a7 02 cb 01 01
E: 1.360020 14 01 07 00 24 07 58 00 00 01 a7 02 cb 01 01
E: 1.368062 14 01 07 00 26 07 57 00 00 01 a7 02 cb 01 01
E: 1.375979 14 01 07 00 26 07 57 00 00 01 a7 02 cb 01 01
E: 1.383969 14 01 07 00 26 07 57 00 00 01 a7 02 cb 01 01
E: 1.392032 14 01 07 00 26 07 56 00 00 01 a7 02 cb 01 01
E: 1.400050 14 01 07 00 27 07 56 00 00 01 a7 02 cb 01 01
E: 1.408008 14 01 07 00 27 07 56 00 00 01 a7 02 cb 01 01
E: 1.416025 14 01 07 00 27 07 56 00 00 01 a7 02 cb 01 01
E: 1.424080 14 01 07 00 27 07 55 00 00 01 a7 02 cb 01 01
E: 1.432023 14 01 07 00 27 07 55 00 00 01 a7 02 cb 01 01
E: 1.439970 14 01 07 00 27 07 55 00 00 01 a7 02 cb 01 01
E: 1.447945 14 01 07 00 28 07 55 00 00 01 a7 02 cb 01 01
E: 1.456007 14 01 07 00 28 07 55 00 00 01 a7 02 cb 01 01
E: 1.464004 14 01 07 00 28 07 55 00 00 01 a7 02 cb 01 01
E: 1.472043 14 01 07 00 28 07 54 00 00 01 a7 02 cb 01 01
E: 1.479997 14 01 07 00 28 07 54 00 00 01 a7 02 cb 01 01
E: 1.488013 14 01 07 00 29 07 53 00 00 01 a7 02 cb 01 01
E: 1.496007 14 01 06 00 29 07 53 00 00 01 a7 02 cb 01 01
E: 1.503999 14 01 06 00 29 07 53 00 00 01 a7 02 cb 01 01
E: 1.512718 14 01 06 00 29 07 53 00 00 01 a7 02 cb 01 01
# 2. Land one finger,
   - land a second finger far enough from the first
   - move your two fingers
   - release the *first* finger
   - release the second finger
E: 12.904002 14 01 07 00 79 06 98 03 00 01 a7 02 cb 01 01
E: 12.912007 14 01 07 00 79 06 98 03 00 01 a7 02 cb 01 01
E: 12.920015 14 01 07 00 79 06 98 03 00 01 a7 02 cb 01 01
E: 12.928377 14 01 07 00 79 06 98 03 00 01 a7 02 cb 01 01
E: 12.936034 14 01 07 00 79 06 98 03 00 01 a7 02 cb 01 01
E: 12.943984 14 01 07 00 79 06 98 03 00 01 a7 02 cb 01 01
E: 12.952003 14 01 07 00 79 06 98 03 00 01 a7 02 cb 01 01
E: 12.960239 14 01 07 00 79 06 98 03 00 01 a7 02 cb 01 01
E: 12.968098 14 01 07 00 79 06 98 03 00 01 a7 02 cb 01 01
E: 12.987247 14 01 07 00 79 06 98 03 00 01 a7 02 cb 01 01
E: 12.987418 14 01 07 00 79 06 98 03 00 01 a7 02 cb 01 01
E: 12.994430 14 01 07 00 79 06 98 03 00 01 a7 02 cb 01 01
E: 12.999993 14 01 07 00 79 06 98 03 00 01 a7 02 cb 01 01
E: 13.011183 14 01 07 00 79 06 98 03 00 01 a7 02 cb 01 01
E: 13.018998 14 01 07 00 79 06 98 03 00 01 a7 02 cb 01 01
E: 13.023977 14 01 07 00 79 06 98 03 00 01 a7 02 cb 01 01
E: 13.032030 14 01 07 00 79 06 98 03 00 01 a7 02 cb 01 01
E: 13.040010 14 01 07 00 79 06 98 03 00 01 a7 02 cb 01 01
E: 13.048025 14 01 07 00 79 06 98 03 00 01 a7 02 cb 01 01
E: 13.056001 14 01 07 00 79 06 98 03 00 01 a7 02 cb 01 01
E: 13.064036 14 01 07 00 79 06 98 03 00 01 a7 02 cb 01 01
E: 13.072041 14 01 07 00 79 06 98 03 00 01 a7 02 cb 01 01
E: 13.080021 14 01 07 00 79 06 98 03 00 01 a7 02 cb 01 01
E: 13.088030 14 01 07 00 79 06 98 03 00 01 a7 02 cb 01 01
E: 13.095992 14 01 07 00 79 06 98 03 00 01 a7 02 cb 01 01
E: 13.104018 14 01 07 00 79 06 98 03 00 01 a7 02 cb 01 01
E: 13.112014 14 01 07 00 79 06 98 03 00 01 a7 02 cb 01 01
E: 13.123805 14 01 07 00 79 06 98 03 00 01 a7 02 cb 01 01
E: 13.128023 14 01 07 00 79 06 98 03 00 01 a7 02 cb 01 01
E: 13.136054 14 01 07 00 79 06 98 03 00 01 a7 02 cb 01 01
E: 13.144000 14 01 07 00 79 06 98 03 00 01 a7 02 cb 01 01
E: 13.151994 14 01 07 00 79 06 98 03 00 01 a7 02 cb 01 01
E: 13.160020 14 01 07 00 79 06 98 03 00 01 a7 02 cb 01 01
E: 13.168081 14 01 07 00 79 06 98 03 00 01 a7 02 cb 01 01
E: 13.176024 14 01 07 00 79 06 98 03 00 01 a7 02 cb 01 01
E: 13.184036 14 01 07 00 79 06 98 03 00 01 a7 02 cb 01 01
E: 13.192013 14 01 07 00 79 06 98 03 00 01 a7 02 cb 01 01
E: 13.200003 14 01 07 00 79 06 98 03 00 01 a7 02 cb 01 01
E: 13.208005 14 01 07 00 79 06 98 03 00 01 a7 02 cb 01 01
E: 13.216025 14 01 07 00 79 06 98 03 00 01 a7 02 cb 01 01
E: 13.224051 14 01 07 00 79 06 98 03 00 01 a7 02 cb 01 01
E: 13.232026 14 01 07 00 79 06 98 03 00 01 a7 02 cb 01 01
E: 13.240047 14 01 07 00 79 06 98 03 00 01 a7 02 cb 01 01
E: 13.248010 14 01 07 00 79 06 98 03 00 01 a7 02 cb 01 01
E: 13.256012 14 01 07 00 79 06 98 03 00 01 a7 02 cb 01 01
E: 13.264010 14 01 07 00 79 06 98 03 00 01 a7 02 cb 01 01
E: 13.272035 14 01 07 00 79 06 98 03 00 01 a7 02 cb 01 01
E: 13.280008 14 01 07 00 79 06 98 03 00 01 a7 02 cb 01 01
E: 13.288010 14 01 07 00 79 06 98 03 00 01 a7 02 cb 01 01
E: 13.296004 14 01 07 00 79 06 98 03 00 01 a7 02 cb 01 01
E: 13.304036 14 01 07 00 79 06 98 03 00 01 a7 02 cb 01 01
E: 13.312012 14 01 07 00 79 06 98 03 00 01 a7 02 cb 01 01
E: 13.320019 14 01 07 00 79 06 98 03 00 01 a7 02 cb 01 01
E: 13.328010 14 01 07 00 79 06 98 03 00 01 a7 02 cb 01 01
E: 13.336036 14 01 07 00 79 06 98 03 00 01 a7 02 cb 01 01
E: 13.344005 14 01 07 00 79 06 98 03 00 01 a7 02 cb 01 01
E: 13.352016 14 01 07 00 79 06 98 03 00 01 a7 02 cb 01 01
E: 13.359996 14 01 07 00 79 06 98 03 00 01 a7 02 cb 01 01
E: 13.368014 14 01 07 00 79 06 98 03 00 01 a7 02 cb 01 01
E: 13.375990 14 01 07 00 79 06 98 03 00 01 a7 02 cb 01 01
E: 13.384020 14 01 07 00 79 06 98 03 00 01 a7 02 cb 01 01
E: 13.392000 14 01 07 00 79 06 98 03 00 01 a7 02 cb 01 01
E: 13.400019 14 01 07 00 79 06 98 03 00 01 a7 02 cb 01 01
E: 13.407995 14 01 07 00 79 06 98 03 00 01 a7 02 cb 01 01
E: 13.416017 14 01 07 00 79 06 98 03 00 01 a7 02 cb 01 01
E: 13.423989 14 01 07 00 79 06 98 03 00 01 a7 02 cb 01 01
E: 13.432016 14 01 07 00 79 06 98 03 00 01 a7 02 cb 01 01
E: 13.439989 14 01 07 00 79 06 98 03 00 01 a7 02 cb 01 01
E: 13.448021 14 01 07 00 79 06 98 03 00 01 a7 02 cb 01 01
E: 13.455992 14 01 07 00 79 06 98 03 00 01 a7 02 cb 01 01
E: 13.464024 14 01 07 00 79 06 98 03 00 01 a7 02 cb 01 01
E: 13.471992 14 01 07 00 79 06 98 03 00 01 a7 02 cb 01 01
E: 13.480018 14 01 07 00 79 06 98 03 00 01 a7 02 cb 01 01
E: 13.487992 14 01 07 00 79 06 98 03 00 01 a7 02 cb 01 01
E: 13.496018 14 01 07 00 79 06 98 03 00 01 a7 02 cb 01 01
E: 13.503987 14 01 07 00 79 06 98 03 00 01 a7 02 cb 01 01
E: 13.512019 14 01 07 00 79 06 98 03 00 01 a7 02 cb 01 01
E: 13.519988 14 01 07 00 79 06 98 03 00 01 a7 02 cb 01 01
E: 13.528016 14 01 07 00 79 06 98 03 00 01 a7 02 cb 01 01
E: 13.535992 14 01 07 00 79 06 98 03 00 01 a7 02 cb 01 01
E: 13.544021 14 01 07 00 79 06 98 03 00 01 a7 02 cb 01 01
E: 13.551992 14 01 07 00 79 06 98 03 00 01 a7 02 cb 01 01
E: 13.560020 14 01 07 00 79 06 98 03 00 01 a7 02 cb 01 01
E: 13.567994 14 01 07 00 79 06 98 03 00 01 a7 02 cb 01 01
E: 13.575996 14 01 07 00 79 06 98 03 00 01 a7 02 cb 01 01
E: 13.583994 14 01 07 00 79 06 98 03 00 01 a7 02 cb 01 01
E: 13.591990 14 01 07 00 79 06 98 03 00 01 a7 02 cb 01 01
E: 13.600016 14 01 07 00 79 06 98 03 00 01 a7 02 cb 01 01
E: 13.608009 14 01 07 00 79 06 98 03 00 01 a7 02 cb 01 01
E: 13.616027 14 01 07 00 79 06 98 03 00 01 a7 02 cb 01 01
E: 13.623991 14 01 07 00 79 06 98 03 00 01 a7 02 cb 01 01
E: 13.632020 14 01 07 00 79 06 98 03 00 01 a7 02 cb 01 01
E: 13.639990 14 01 07 00 79 06 98 03 00 01 a7 02 cb 01 01
E: 13.648017 14 01 07 00 79 06 98 03 00 01 a7 02 cb 01 01
E: 13.655993 14 01 07 00 79 06 98 03 00 01 a7 02 cb 01 01
E: 13.664031 14 01 07 00 79 06 98 03 07 01 2b 01 d5 00 02
E: 13.671990 14 01 07 00 79 06 98 03 07 01 2b 01 d5 00 02
E: 13.680015 14 01 07 00 79 06 98 03 07 01 2b 01 d5 00 02
E: 13.687989 14 01 07 00 79 06 98 03 07 01 2b 01 d5 00 02
E: 13.696023 14 01 07 00 79 06 98 03 07 01 2b 01 d5 00 02
E: 13.703991 14 01 07 00 79 06 98 03 07 01 2b 01 d5 00 02
E: 13.712015 14 01 07 00 79 06 98 03 07 01 2b 01 d5 00 02
E: 13.719985 14 01 07 00 79 06 98 03 07 01 2b 01 d5 00 02
E: 13.728017 14 01 07 00 79 06 98 03 07 01 2b 01 d5 00 02
E: 13.735989 14 01 07 00 79 06 98 03 07 01 2b 01 d5 00 02
E: 13.744023 14 01 07 00 79 06 98 03 07 01 2b 01 d5 00 02
E: 13.752012 14 01 07 00 79 06 98 03 07 01 2b 01 d5 00 02
E: 13.759989 14 01 07 00 79 06 98 03 07 01 2b 01 d5 00 02
E: 13.768015 14 01 07 00 79 06 98 03 07 01 2b 01 d5 00 02
E: 13.775990 14 01 07 00 79 06 98 03 07 01 2b 01 d5 00 02
E: 13.784013 14 01 07 00 79 06 98 03 07 01 2b 01 d5 00 02
E: 13.791989 14 01 07 00 79 06 98 03 07 01 2b 01 d5 00 02
E: 13.800015 14 01 07 00 79 06 98 03 07 01 2b 01 d5 00 02
E: 13.808042 14 01 07 00 79 06 98 03 07 01 2b 01 d5 00 02
E: 13.816010 14 01 07 00 79 06 98 03 07 01 2b 01 d5 00 02
E: 13.824000 14 01 07 00 79 06 98 03 07 01 2b 01 d5 00 02
E: 13.832079 14 01 07 00 79 06 98 03 07 01 2b 01 d5 00 02
E: 13.839997 14 01 07 00 79 06 98 03 07 01 2b 01 d5 00 02
E: 13.848036 14 01 07 00 79 06 98 03 07 01 2b 01 d5 00 02
E: 13.855989 14 01 07 00 79 06 98 03 07 01 2c 01 d5 00 02
E: 13.864012 14 01 07 00 79 06 98 03 07 01 2c 01 d5 00 02
E: 13.871999 14 01 07 00 79 06 98 03 07 01 2c 01 d5 00 02
E: 13.880016 14 01 07 00 79 06 98 03 07 01 2c 01 d5 00 02
E: 13.887984 14 01 07 00 79 06 98 03 07 01 2c 01 d5 00 02
E: 13.896015 14 01 07 00 79 06 98 03 07 01 2c 01 d5 00 02
E: 13.903992 14 01 07 00 79 06 98 03 07 01 2c 01 d5 00 02
E: 13.912019 14 01 07 00 79 06 98 03 07 01 2c 01 d5 00 02
E: 13.919989 14 01 07 00 79 06 98 03 07 01 2c 01 d5 00 02
E: 13.928013 14 01 07 00 79 06 98 03 07 01 2c 01 d5 00 02
E: 13.935988 14 01 07 00 79 06 98 03 07 01 2c 01 d5 00 02
E: 13.944081 14 01 07 00 79 06 98 03 07 01 2c 01 d5 00 02
E: 13.951989 14 01 07 00 79 06 98 03 07 01 2c 01 d5 00 02
E: 13.960024 14 01 07 00 79 06 98 03 07 01 2c 01 d5 00 02
E: 13.967991 14 01 07 00 79 06 98 03 07 01 2c 01 d5 00 02
E: 13.976022 14 01 07 00 79 06 98 03 07 01 2d 01 d5 00 02
E: 13.983991 14 01 07 00 79 06 98 03 07 01 2d 01 d5 00 02
E: 13.992025 14 01 07 00 79 06 98 03 07 01 2d 01 d5 00 02
E: 13.999991 14 01 07 00 79 06 98 03 07 01 2d 01 d5 00 02
E: 14.008014 14 01 07 00 79 06 98 03 07 01 2d 01 d5 00 02
E: 14.016003 14 01 07 00 79 06 98 03 07 01 2d 01 d5 00 02
E: 14.023996 14 01 07 00 79 06 98 03 07 01 2d 01 d5 00 02
E: 14.032037 14 01 07 00 79 06 98 03 07 01 2d 01 d5 00 02
E: 14.039998 14 01 07 00 79 06 98 03 07 01 2d 01 d5 00 02
E: 14.048017 14 01 07 00 79 06 98 03 07 01 2d 01 d5 00 02
E: 14.055989 14 01 07 00 79 06 98 03 07 01 2d 01 d5 00 02
E: 14.064018 14 01 07 00 79 06 98 03 07 01 2d 01 d5 00 02
E: 14.071995 14 01 07 00 79 06 98 03 07 01 2d 01 d5 00 02
E: 14.080038 14 01 07 00 79 06 98 03 07 01 2d 01 d5 00 02
E: 14.087994 14 01 07 00 79 06 98 03 07 01 2d 01 d5 00 02
E: 14.096024 14 01 07 00 79 06 98 03 07 01 2e 01 d5 00 02
E: 14.104001 14 01 07 00 79 06 98 03 07 01 2e 01 d5 00 02
E: 14.112014 14 01 07 00 79 06 98 03 07 01 2e 01 d5 00 02
E: 14.119993 14 01 07 00 79 06 98 03 07 01 2e 01 d5 00 02
E: 14.128014 14 01 07 00 79 06 98 03 07 01 2e 01 d5 00 02
E: 14.135992 14 01 07 00 79 06 98 03 07 01 2e 01 d5 00 02
E: 14.144077 14 01 07 00 79 06 98 03 07 01 2e 01 d5 00 02
E: 14.151990 14 01 07 00 79 06 98 03 07 01 2e 01 d5 00 02
E: 14.160017 14 01 07 00 79 06 98 03 07 01 2e 01 d5 00 02
E: 14.167990 14 01 07 00 79 06 98 03 07 01 2e 01 d5 00 02
E: 14.176017 14 01 07 00 79 06 98 03 07 01 2e 01 d5 00 02
E: 14.183990 14 01 07 00 79 06 98 03 07 01 2e 01 d5 00 02
E: 14.192016 14 01 07 00 79 06 98 03 07 01 2e 01 d5 00 02
E: 14.199992 14 01 07 00 79 06 98 03 07 01 2e 01 d5 00 02
E: 14.208020 14 01 07 00 79 06 98 03 07 01 2e 01 d5 00 02
E: 14.215991 14 01 07 00 79 06 98 03 07 01 2f 01 d5 00 02
E: 14.224023 14 01 07 00 79 06 98 03 07 01 2f 01 d5 00 02
E: 14.231991 14 01 07 00 79 06 98 03 07 01 2f 01 d5 00 02
E: 14.240017 14 01 07 00 79 06 98 03 07 01 30 01 d5 00 02
E: 14.247994 14 01 07 00 79 06 98 03 07 01 31 01 d5 00 02
E: 14.256020 14 01 07 00 79 06 98 03 07 01 33 01 d5 00 02
E: 14.263996 14 01 07 00 79 06 98 03 07 01 33 01 d5 00 02
E: 14.272036 14 01 07 00 79 06 98 03 07 01 35 01 d5 00 02
E: 14.279990 14 01 07 00 79 06 98 03 07 01 37 01 d5 00 02
E: 14.288016 14 01 07 00 79 06 98 03 07 01 39 01 d5 00 02
E: 14.295995 14 01 07 00 79 06 98 03 07 01 3a 01 d5 00 02
E: 14.304030 14 01 07 00 73 06 97 03 07 01 3c 01 d5 00 02
E: 14.312011 14 01 07 00 6f 06 96 03 07 01 3e 01 d5 00 02
E: 14.320074 14 01 07 00 6a 06 95 03 07 01 40 01 d5 00 02
E: 14.328005 14 01 07 00 64 06 95 03 07 01 42 01 d5 00 02
E: 14.336040 14 01 07 00 5d 06 94 03 07 01 44 01 d5 00 02
E: 14.344060 14 01 07 00 57 06 93 03 07 01 47 01 d5 00 02
E: 14.352025 14 01 07 00 57 06 93 03 07 01 47 01 d5 00 02
E: 14.360033 14 01 07 00 53 06 8d 03 07 01 4a 01 d5 00 02
E: 14.368007 14 01 07 00 4c 06 91 03 07 01 4d 01 d5 00 02
E: 14.376006 14 01 07 00 44 06 92 03 07 01 50 01 d4 00 02
E: 14.384050 14 01 07 00 3e 06 93 03 07 01 54 01 d4 00 02
E: 14.392001 14 01 07 00 36 06 94 03 07 01 58 01 d4 00 02
E: 14.400032 14 01 07 00 36 06 94 03 07 01 58 01 d4 00 02
E: 14.408037 14 01 07 00 2f 06 96 03 07 01 5c 01 d4 00 02
E: 14.416045 14 01 07 00 28 06 95 03 07 01 60 01 d3 00 02
E: 14.424029 14 01 07 00 21 06 95 03 07 01 65 01 d3 00 02
E: 14.431989 14 01 07 00 1a 06 95 03 07 01 6a 01 d3 00 02
E: 14.440043 14 01 07 00 12 06 95 03 07 01 6f 01 d3 00 02
E: 14.448003 14 01 07 00 0a 06 95 03 07 01 74 01 d3 00 02
E: 14.456011 14 01 07 00 02 06 95 03 07 01 7a 01 d2 00 02
E: 14.464035 14 01 07 00 fa 05 94 03 07 01 80 01 d2 00 02
E: 14.472023 14 01 07 00 f2 05 94 03 07 01 86 01 d2 00 02
E: 14.480030 14 01 07 00 ea 05 93 03 07 01 8d 01 d2 00 02
E: 14.488010 14 01 07 00 e1 05 93 03 07 01 94 01 d2 00 02
E: 14.496007 14 01 07 00 d9 05 92 03 07 01 9b 01 d2 00 02
E: 14.504042 14 01 07 00 d0 05 91 03 07 01 a1 01 d2 00 02
E: 14.512008 14 01 07 00 d0 05 91 03 07 01 a1 01 d2 00 02
E: 14.520021 14 01 07 00 c7 05 91 03 07 01 a8 01 d2 00 02
E: 14.528054 14 01 07 00 be 05 90 03 07 01 b0 01 d2 00 02
E: 14.536001 14 01 07 00 b5 05 8f 03 07 01 b7 01 d1 00 02
E: 14.544051 14 01 07 00 ab 05 8f 03 07 01 bf 01 d1 00 02
E: 14.552001 14 01 07 00 a1 05 8e 03 07 01 c7 01 d1 00 02
E: 14.560016 14 01 07 00 97 05 8d 03 07 01 d0 01 d1 00 02
E: 14.568027 14 01 07 00 8d 05 8d 03 07 01 d8 01 d1 00 02
E: 14.575959 14 01 07 00 82 05 8c 03 07 01 e1 01 d1 00 02
E: 14.584040 14 01 07 00 77 05 8b 03 07 01 ea 01 d1 00 02
E: 14.592019 14 01 07 00 6b 05 8b 03 07 01 f3 01 d1 00 02
E: 14.600853 14 01 07 00 60 05 8a 03 07 01 fd 01 d1 00 02
E: 14.607998 14 01 07 00 54 05 8a 03 07 01 07 02 d1 00 02
E: 14.616123 14 01 07 00 48 05 89 03 07 01 11 02 d1 00 02
E: 14.624015 14 01 07 00 3b 05 89 03 07 01 1b 02 d1 00 02
E: 14.632007 14 01 07 00 2f 05 89 03 07 01 26 02 d2 00 02
E: 14.640014 14 01 07 00 23 05 88 03 07 01 31 02 d2 00 02
E: 14.648031 14 01 07 00 16 05 88 03 07 01 3c 02 d2 00 02
E: 14.656164 14 01 07 00 0a 05 87 03 07 01 47 02 d2 00 02
E: 14.664048 14 01 07 00 fd 04 87 03 07 01 53 02 d3 00 02
E: 14.672043 14 01 07 00 f0 04 86 03 07 01 5e 02 d3 00 02
E: 14.680039 14 01 07 00 f0 04 86 03 07 01 5e 02 d3 00 02
E: 14.688007 14 01 07 00 e3 04 86 03 07 01 6a 02 d3 00 02
E: 14.696057 14 01 07 00 d6 04 86 03 07 01 76 02 d4 00 02
E: 14.704094 14 01 07 00 c9 04 86 03 07 01 82 02 d4 00 02
E: 14.712006 14 01 07 00 bb 04 85 03 07 01 8e 02 d4 00 02
E: 14.720098 14 01 07 00 ad 04 85 03 07 01 9a 02 d4 00 02
E: 14.728047 14 01 07 00 9f 04 85 03 07 01 a6 02 d3 00 02
E: 14.736002 14 01 07 00 91 04 85 03 07 01 b3 02 d3 00 02
E: 14.744158 14 01 07 00 82 04 84 03 07 01 bf 02 d2 00 02
E: 14.752006 14 01 07 00 74 04 84 03 07 01 cb 02 d2 00 02
E: 14.760119 14 01 07 00 65 04 84 03 07 01 d9 02 d1 00 02
E: 14.768038 14 01 07 00 56 04 84 03 07 01 e6 02 d1 00 02
E: 14.776338 14 01 07 00 48 04 83 03 07 01 f3 02 d1 00 02
E: 14.784059 14 01 07 00 39 04 83 03 07 01 00 03 d0 00 02
E: 14.792037 14 01 07 00 2a 04 82 03 07 01 0d 03 d0 00 02
E: 14.800016 14 01 07 00 1b 04 81 03 07 01 1b 03 cf 00 02
E: 14.808029 14 01 07 00 0c 04 81 03 07 01 28 03 cf 00 02
E: 14.816034 14 01 07 00 fc 03 80 03 07 01 36 03 ce 00 02
E: 14.824037 14 01 07 00 ec 03 80 03 07 01 44 03 cd 00 02
E: 14.832277 14 01 07 00 dc 03 7f 03 07 01 52 03 cc 00 02
E: 14.840032 14 01 07 00 cb 03 7f 03 07 01 60 03 cc 00 02
E: 14.848000 14 01 07 00 cb 03 7f 03 07 01 60 03 cc 00 02
E: 14.856018 14 01 07 00 ba 03 7f 03 07 01 6e 03 cb 00 02
E: 14.864045 14 01 07 00 aa 03 7f 03 07 01 7c 03 ca 00 02
E: 14.872133 14 01 07 00 99 03 7e 03 07 01 8b 03 c9 00 02
E: 14.880001 14 01 07 00 88 03 7e 03 07 01 99 03 c7 00 02
E: 14.888035 14 01 07 00 78 03 7d 03 07 01 a8 03 c6 00 02
E: 14.896068 14 01 07 00 67 03 7d 03 07 01 b7 03 c5 00 02
E: 14.904006 14 01 07 00 57 03 7c 03 07 01 c5 03 c4 00 02
E: 14.912050 14 01 07 00 57 03 7c 03 07 01 c5 03 c4 00 02
E: 14.920009 14 01 07 00 47 03 7c 03 07 01 d4 03 c3 00 02
E: 14.928103 14 01 07 00 36 03 7b 03 07 01 e2 03 c2 00 02
E: 14.936325 14 01 07 00 26 03 7a 03 07 01 f1 03 c1 00 02
E: 14.944017 14 01 07 00 16 03 7a 03 07 01 00 04 bf 00 02
E: 14.952060 14 01 07 00 06 03 79 03 07 01 0e 04 be 00 02
E: 14.960052 14 01 07 00 f6 02 79 03 07 01 1d 04 bd 00 02
E: 14.968013 14 01 07 00 e6 02 78 03 07 01 2b 04 bc 00 02
E: 14.976059 14 01 07 00 d6 02 78 03 07 01 3a 04 ba 00 02
E: 14.984097 14 01 07 00 c7 02 77 03 07 01 48 04 b9 00 02
E: 14.992078 14 01 07 00 b8 02 77 03 07 01 57 04 b7 00 02
E: 15.000007 14 01 07 00 aa 02 76 03 07 01 65 04 b6 00 02
E: 15.008029 14 01 07 00 9c 02 76 03 07 01 74 04 b4 00 02
E: 15.016006 14 01 07 00 9c 02 76 03 07 01 74 04 b4 00 02
E: 15.023958 14 01 07 00 8f 02 76 03 07 01 83 04 b2 00 02
E: 15.032022 14 01 07 00 82 02 75 03 07 01 92 04 b0 00 02
E: 15.039998 14 01 07 00 76 02 75 03 07 01 a1 04 ae 00 02
E: 15.047966 14 01 07 00 69 02 75 03 07 01 b0 04 ac 00 02
E: 15.056275 14 01 07 00 5d 02 74 03 07 01 bf 04 aa 00 02
E: 15.064006 14 01 07 00 52 02 74 03 07 01 ce 04 a8 00 02
E: 15.072038 14 01 07 00 47 02 74 03 07 01 dd 04 a7 00 02
E: 15.079997 14 01 07 00 3d 02 73 03 07 01 ec 04 a6 00 02
E: 15.088041 14 01 07 00 34 02 73 03 07 01 fb 04 a4 00 02
E: 15.096000 14 01 07 00 2b 02 73 03 07 01 09 05 a3 00 02
E: 15.104062 14 01 07 00 24 02 72 03 07 01 17 05 a3 00 02
E: 15.112066 14 01 07 00 1d 02 72 03 07 01 25 05 a2 00 02
E: 15.120006 14 01 07 00 17 02 72 03 07 01 32 05 a1 00 02
E: 15.128347 14 01 07 00 12 02 71 03 07 01 3e 05 a0 00 02
E: 15.136036 14 01 07 00 0e 02 71 03 07 01 4a 05 a0 00 02
E: 15.144043 14 01 07 00 0a 02 71 03 07 01 55 05 9f 00 02
E: 15.152143 14 01 07 00 07 02 70 03 07 01 5f 05 9e 00 02
E: 15.160020 14 01 07 00 04 02 70 03 07 01 69 05 9e 00 02
E: 15.168036 14 01 07 00 02 02 70 03 07 01 72 05 9d 00 02
E: 15.176030 14 01 07 00 00 02 70 03 07 01 7b 05 9d 00 02
E: 15.184082 14 01 07 00 00 02 70 03 07 01 7b 05 9d 00 02
E: 15.192008 14 01 07 00 fe 01 70 03 07 01 82 05 9c 00 02
E: 15.199993 14 01 07 00 fc 01 6f 03 07 01 89 05 9c 00 02
E: 15.208066 14 01 07 00 fc 01 6f 03 07 01 8f 05 9c 00 02
E: 15.216048 14 01 07 00 fc 01 6f 03 07 01 95 05 9b 00 02
E: 15.224012 14 01 07 00 fc 01 6f 03 07 01 9a 05 9b 00 02
E: 15.232058 14 01 07 00 fc 01 6f 03 07 01 9f 05 9b 00 02
E: 15.240011 14 01 07 00 fc 01 6f 03 07 01 a4 05 9b 00 02
E: 15.248044 14 01 07 00 fc 01 6f 03 07 01 a8 05 9b 00 02
E: 15.256110 14 01 07 00 fc 01 6f 03 07 01 ac 05 9b 00 02
E: 15.264041 14 01 07 00 fb 01 6f 03 07 01 af 05 9b 00 02
E: 15.271990 14 01 07 00 fb 01 70 03 07 01 b2 05 9a 00 02
E: 15.279974 14 01 07 00 fb 01 70 03 07 01 b5 05 9a 00 02
E: 15.288031 14 01 07 00 fb 01 70 03 07 01 b8 05 9a 00 02
E: 15.296009 14 01 07 00 fb 01 70 03 07 01 ba 05 9a 00 02
E: 15.304030 14 01 07 00 fb 01 70 03 07 01 bc 05 9a 00 02
E: 15.311994 14 01 07 00 fb 01 70 03 07 01 bf 05 9a 00 02
E: 15.320023 14 01 07 00 fb 01 70 03 07 01 c0 05 9a 00 02
E: 15.327993 14 01 07 00 fb 01 70 03 07 01 c2 05 9a 00 02
E: 15.336033 14 01 07 00 fb 01 70 03 07 01 c2 05 9b 00 02
E: 15.343991 14 01 07 00 fb 01 70 03 07 01 c2 05 9b 00 02
E: 15.352018 14 01 07 00 fb 01 70 03 07 01 c3 05 9b 00 02
E: 15.359990 14 01 07 00 fb 01 70 03 07 01 c3 05 9b 00 02
E: 15.368015 14 01 07 00 fb 01 70 03 07 01 c3 05 9b 00 02
E: 15.375989 14 01 07 00 fa 01 70 03 07 01 c4 05 9b 00 02
E: 15.384016 14 01 07 00 fa 01 70 03 07 01 c4 05 9b 00 02
E: 15.392033 14 01 07 00 fa 01 70 03 07 01 c4 05 9b 00 02
E: 15.400071 14 01 07 00 fa 01 70 03 07 01 c4 05 9b 00 02
E: 15.408010 14 01 07 00 fa 01 70 03 07 01 c4 05 9b 00 02
E: 15.415995 14 01 07 00 fa 01 70 03 07 01 c4 05 9b 00 02
E: 15.424027 14 01 07 00 fa 01 70 03 07 01 c4 05 9b 00 02
E: 15.431988 14 01 07 00 fa 01 70 03 07 01 c4 05 9b 00 02
E: 15.440017 14 01 07 00 fa 01 70 03 07 01 c5 05 9b 00 02
E: 15.447999 14 01 07 00 fa 01 70 03 07 01 c5 05 9b 00 02
E: 15.456019 14 01 07 00 fa 01 70 03 07 01 c5 05 9b 00 02
E: 15.463991 14 01 07 00 fa 01 70 03 07 01 c5 05 9b 00 02
E: 15.472016 14 01 07 00 fa 01 70 03 07 01 c5 05 9b 00 02
E: 15.479988 14 01 07 00 fa 01 70 03 07 01 c5 05 9b 00 02
E: 15.488026 14 01 07 00 f9 01 70 03 07 01 c5 05 9b 00 02
E: 15.496009 14 01 07 00 f9 01 70 03 07 01 c5 05 9b 00 02
E: 15.504040 14 01 07 00 f9 01 70 03 07 01 c6 05 9b 00 02
E: 15.512007 14 01 07 00 f9 01 70 03 07 01 c6 05 9b 00 02
E: 15.520014 14 01 07 00 f9 01 70 03 07 01 c6 05 9b 00 02
E: 15.528010 14 01 07 00 f9 01 70 03 07 01 c6 05 9b 00 02
E: 15.536018 14 01 07 00 f9 01 70 03 07 01 c6 05 9b 00 02
E: 15.543995 14 01 07 00 f9 01 70 03 07 01 c6 05 9b 00 02
E: 15.552017 14 01 07 00 f9 01 70 03 07 01 c6 05 9b 00 02
E: 15.560016 14 01 07 00 f9 01 70 03 07 01 c6 05 9b 00 02
E: 15.568012 14 01 07 00 f9 01 70 03 07 01 c6 05 9b 00 02
E: 15.575993 14 01 07 00 f8 01 70 03 07 01 c6 05 9b 00 02
E: 15.584053 14 01 07 00 f8 01 70 03 07 01 c6 05 9b 00 02
E: 15.592014 14 01 07 00 f8 01 70 03 07 01 c7 05 9b 00 02
E: 15.600061 14 01 07 00 f8 01 70 03 07 01 c7 05 9b 00 02
E: 15.608017 14 01 07 00 f8 01 70 03 07 01 c7 05 9b 00 02
E: 15.616029 14 01 07 00 f8 01 70 03 07 01 c7 05 9b 00 02
E: 15.624020 14 01 07 00 f8 01 70 03 07 01 c7 05 9b 00 02
E: 15.632019 14 01 07 00 f8 01 70 03 07 01 c7 05 9b 00 02
E: 15.639995 14 01 07 00 f8 01 70 03 07 01 c7 05 9b 00 02
E: 15.648031 14 01 07 00 f8 01 70 03 07 01 c7 05 9b 00 02
E: 15.655990 14 01 07 00 f8 01 70 03 07 01 c7 05 9b 00 02
E: 15.664019 14 01 07 00 f8 01 70 03 07 01 c7 05 9b 00 02
E: 15.671994 14 01 07 00 f8 01 70 03 07 01 c7 05 9b 00 02
E: 15.680024 14 01 07 00 f8 01 70 03 07 01 c7 05 9b 00 02
E: 15.687992 14 01 07 00 f8 01 70 03 07 01 c7 05 9b 00 02
E: 15.696026 14 01 07 00 f8 01 70 03 07 01 c8 05 9b 00 02
E: 15.703992 14 01 07 00 f8 01 70 03 07 01 c8 05 9b 00 02
E: 15.712016 14 01 07 00 f7 01 70 03 07 01 c8 05 9b 00 02
E: 15.720019 14 01 07 00 f7 01 70 03 07 01 c8 05 9b 00 02
E: 15.728013 14 01 07 00 f7 01 70 03 07 01 c8 05 9b 00 02
E: 15.736033 14 01 07 00 f7 01 70 03 07 01 c8 05 9b 00 02
E: 15.744000 14 01 07 00 f7 01 70 03 07 01 c8 05 9b 00 02
E: 15.752016 14 01 07 00 f7 01 70 03 07 01 c8 05 9b 00 02
E: 15.759991 14 01 07 00 f7 01 70 03 07 01 c8 05 9b 00 02
E: 15.768023 14 01 07 00 f7 01 70 03 07 01 c8 05 9b 00 02
E: 15.775997 14 01 07 00 f7 01 70 03 07 01 c8 05 9b 00 02
E: 15.784017 14 01 07 00 f7 01 70 03 07 01 c8 05 9b 00 02
E: 15.791991 14 01 07 00 f7 01 70 03 07 01 c8 05 9b 00 02
E: 15.800020 14 01 07 00 f7 01 70 03 07 01 c8 05 9b 00 02
E: 15.808001 14 01 07 00 f7 01 70 03 07 01 c8 05 9b 00 02
E: 15.816018 14 01 07 00 f7 01 70 03 07 01 c8 05 9b 00 02
E: 15.823994 14 01 07 00 f7 01 70 03 07 01 c8 05 9b 00 02
E: 15.832035 14 01 07 00 f7 01 70 03 07 01 c9 05 9b 00 02
E: 15.839993 14 01 07 00 f7 01 70 03 07 01 c9 05 9b 00 02
E: 15.848028 14 01 07 00 f7 01 70 03 07 01 c9 05 9b 00 02
E: 15.855996 14 01 07 00 f7 01 70 03 07 01 c9 05 9b 00 02
E: 15.864021 14 01 07 00 f7 01 70 03 07 01 c9 05 9b 00 02
E: 15.871996 14 01 07 00 f7 01 70 03 07 01 c9 05 9b 00 02
E: 15.880019 14 01 07 00 f7 01 70 03 07 01 c9 05 9b 00 02
E: 15.887991 14 01 07 00 f7 01 70 03 07 01 c9 05 9b 00 02
E: 15.896017 14 01 07 00 f7 01 70 03 07 01 c9 05 9b 00 02
E: 15.903998 14 01 07 00 f7 01 70 03 07 01 c9 05 9b 00 02
E: 15.912020 14 01 07 00 f7 01 70 03 07 01 c9 05 9b 00 02
E: 15.919990 14 01 07 00 f7 01 70 03 07 01 c9 05 9b 00 02
E: 15.928023 14 01 07 00 f7 01 70 03 07 01 c9 05 9b 00 02
E: 15.935987 14 01 07 00 f7 01 70 03 07 01 c9 05 9b 00 02
E: 15.944016 14 01 07 00 f7 01 70 03 07 01 c9 05 9b 00 02
E: 15.951987 14 01 07 00 f7 01 70 03 07 01 c9 05 9b 00 02
E: 15.960018 14 01 07 00 f7 01 70 03 07 01 c9 05 9b 00 02
E: 15.967990 14 01 07 00 f7 01 70 03 07 01 c9 05 9b 00 02
E: 15.976031 14 01 07 00 f6 01 70 03 07 01 c9 05 9b 00 02
E: 15.984015 14 01 07 00 f6 01 70 03 07 01 c9 05 9b 00 02
E: 15.992043 14 01 07 00 f6 01 70 03 07 01 c9 05 9b 00 02
E: 16.000008 14 01 07 00 f6 01 70 03 07 01 c9 05 9b 00 02
E: 16.008016 14 01 07 00 f6 01 70 03 07 01 c9 05 9b 00 02
E: 16.015991 14 01 07 00 f6 01 70 03 07 01 c9 05 9b 00 02
E: 16.024018 14 01 07 00 f6 01 70 03 07 01 c9 05 9b 00 02
E: 16.031995 14 01 07 00 f6 01 70 03 07 01 c9 05 9b 00 02
E: 16.040026 14 01 07 00 f6 01 70 03 07 01 c9 05 9b 00 02
E: 16.048008 14 01 07 00 f6 01 70 03 07 01 c9 05 9b 00 02
E: 16.056021 14 01 07 00 f6 01 70 03 07 01 c9 05 9b 00 02
E: 16.063994 14 01 07 00 f6 01 70 03 07 01 c9 05 9b 00 02
E: 16.072024 14 01 07 00 f6 01 70 03 07 01 c9 05 9b 00 02
E: 16.079987 14 01 07 00 f6 01 6f 03 07 01 c9 05 9b 00 02
E: 16.088061 14 01 07 00 f6 01 6f 03 07 01 c9 05 9b 00 02
E: 16.096044 14 01 07 00 f6 01 6f 03 07 01 c9 05 9b 00 02
E: 16.104009 14 01 07 00 f6 01 6f 03 07 01 c9 05 9b 00 02
E: 16.111987 14 01 07 00 f6 01 6f 03 07 01 c9 05 9b 00 02
E: 16.120027 14 01 07 00 f6 01 6f 03 07 01 c9 05 9b 00 02
E: 16.127993 14 01 07 00 f6 01 6f 03 07 01 c9 05 9b 00 02
E: 16.136018 14 01 07 00 f6 01 6f 03 07 01 c9 05 9b 00 02
E: 16.143989 14 01 07 00 f6 01 6f 03 07 01 c9 05 9b 00 02
E: 16.152022 14 01 07 00 f6 01 6f 03 07 01 c9 05 9b 00 02
E: 16.159991 14 01 07 00 f6 01 6f 03 07 01 c9 05 9b 00 02
E: 16.168024 14 01 07 00 f6 01 6f 03 07 01 c9 05 9b 00 02
E: 16.175990 14 01 07 00 f6 01 6f 03 07 01 c9 05 9b 00 02
E: 16.184018 14 01 07 00 f6 01 6f 03 07 01 c9 05 9b 00 02
E: 16.191996 14 01 07 00 f6 01 6f 03 07 01 c9 05 9b 00 02
E: 16.200020 14 01 07 00 f6 01 6f 03 07 01 c9 05 9b 00 02
E: 16.207989 14 01 06 00 f6 01 6f 03 07 01 c9 05 9b 00 02
E: 16.216033 14 01 06 00 f6 01 6f 03 07 01 c9 05 9b 00 02
E: 16.224004 14 01 07 01 ca 05 9b 00 00 01 c9 05 9b 00 01
E: 16.232047 14 01 07 01 ca 05 9b 00 00 01 c9 05 9b 00 01
E: 16.240010 14 01 07 01 ca 05 9b 00 00 01 c9 05 9b 00 01
E: 16.248039 14 01 07 01 ca 05 9b 00 00 01 c9 05 9b 00 01
E: 16.256029 14 01 07 01 ca 05 9a 00 00 01 c9 05 9b 00 01
E: 16.264042 14 01 07 01 ca 05 9a 00 00 01 c9 05 9b 00 01
E: 16.271991 14 01 07 01 ca 05 9a 00 00 01 c9 05 9b 00 01
E: 16.280040 14 01 07 01 ca 05 9a 00 00 01 c9 05 9b 00 01
E: 16.288020 14 01 07 01 ca 05 9a 00 00 01 c9 05 9b 00 01
E: 16.296015 14 01 07 01 ca 05 9a 00 00 01 c9 05 9b 00 01
E: 16.304011 14 01 07 01 ca 05 9a 00 00 01 c9 05 9b 00 01
E: 16.312040 14 01 07 01 ca 05 9a 00 00 01 c9 05 9b 00 01
E: 16.320009 14 01 07 01 ca 05 9a 00 00 01 c9 05 9b 00 01
E: 16.328018 14 01 07 01 ca 05 9a 00 00 01 c9 05 9b 00 01
E: 16.336026 14 01 07 01 ca 05 9a 00 00 01 c9 05 9b 00 01
E: 16.344042 14 01 07 01 ca 05 9a 00 00 01 c9 05 9b 00 01
E: 16.352012 14 01 07 01 ca 05 9a 00 00 01 c9 05 9b 00 01
E: 16.360016 14 01 07 01 ca 05 9a 00 00 01 c9 05 9b 00 01
E: 16.368004 14 01 07 01 ca 05 9a 00 00 01 c9 05 9b 00 01
E: 16.376004 14 01 07 01 ca 05 9a 00 00 01 c9 05 9b 00 01
E: 16.384015 14 01 07 01 ca 05 9a 00 00 01 c9 05 9b 00 01
E: 16.391992 14 01 07 01 ca 05 9a 00 00 01 c9 05 9b 00 01
E: 16.400007 14 01 07 01 ca 05 9a 00 00 01 c9 05 9b 00 01
E: 16.408020 14 01 07 01 ca 05 9a 00 00 01 c9 05 9b 00 01
E: 16.416070 14 01 07 01 ca 05 9a 00 00 01 c9 05 9b 00 01
E: 16.424039 14 01 07 01 ca 05 9a 00 00 01 c9 05 9b 00 01
E: 16.432018 14 01 07 01 ca 05 9a 00 00 01 c9 05 9b 00 01
E: 16.440041 14 01 07 01 ca 05 9a 00 00 01 c9 05 9b 00 01
E: 16.448011 14 01 07 01 ca 05 9a 00 00 01 c9 05 9b 00 01
E: 16.456034 14 01 07 01 ca 05 9a 00 00 01 c9 05 9b 00 01
E: 16.464007 14 01 07 01 ca 05 9a 00 00 01 c9 05 9b 00 01
E: 16.471992 14 01 07 01 ca 05 9a 00 00 01 c9 05 9b 00 01
E: 16.480028 14 01 07 01 ca 05 9a 00 00 01 c9 05 9b 00 01
E: 16.487994 14 01 07 01 ca 05 9a 00 00 01 c9 05 9b 00 01
E: 16.496022 14 01 07 01 ca 05 9a 00 00 01 c9 05 9b 00 01
E: 16.503995 14 01 07 01 ca 05 9a 00 00 01 c9 05 9b 00 01
E: 16.512018 14 01 07 01 ca 05 9a 00 00 01 c9 05 9b 00 01
E: 16.519995 14 01 07 01 ca 05 9a 00 00 01 c9 05 9b 00 01
E: 16.528010 14 01 07 01 ca 05 9a 00 00 01 c9 05 9b 00 01
E: 16.535995 14 01 07 01 ca 05 9a 00 00 01 c9 05 9b 00 01
E: 16.544016 14 01 07 01 ca 05 9a 00 00 01 c9 05 9b 00 01
E: 16.551990 14 01 07 01 ca 05 9a 00 00 01 c9 05 9b 00 01
E: 16.560016 14 01 07 01 ca 05 9a 00 00 01 c9 05 9b 00 01
E: 16.568000 14 01 07 01 ca 05 9a 00 00 01 c9 05 9b 00 01
E: 16.576016 14 01 07 01 ca 05 9a 00 00 01 c9 05 9b 00 01
E: 16.583990 14 01 07 01 ca 05 9a 00 00 01 c9 05 9b 00 01
E: 16.592014 14 01 07 01 ca 05 9a 00 00 01 c9 05 9b 00 01
E: 16.599988 14 01 07 01 ca 05 9a 00 00 01 c9 05 9b 00 01
E: 16.608013 14 01 07 01 ca 05 9a 00 00 01 c9 05 9b 00 01
E: 16.615996 14 01 07 01 ca 05 9a 00 00 01 c9 05 9b 00 01
E: 16.624018 14 01 07 01 cb 05 9a 00 00 01 c9 05 9b 00 01
E: 16.631991 14 01 07 01 cb 05 9a 00 00 01 c9 05 9b 00 01
E: 16.640022 14 01 07 01 cb 05 9a 00 00 01 c9 05 9b 00 01
E: 16.647994 14 01 07 01 cb 05 9a 00 00 01 c9 05 9b 00 01
E: 16.656067 14 01 07 01 cb 05 9a 00 00 01 c9 05 9b 00 01
E: 16.664025 14 01 07 01 cb 05 9a 00 00 01 c9 05 9b 00 01
E: 16.672015 14 01 07 01 cb 05 9a 00 00 01 c9 05 9b 00 01
E: 16.679995 14 01 07 01 cb 05 9a 00 00 01 c9 05 9b 00 01
E: 16.688011 14 01 07 01 cb 05 9a 00 00 01 c9 05 9b 00 01
E: 16.695994 14 01 07 01 cb 05 9a 00 00 01 c9 05 9b 00 01
E: 16.704039 14 01 07 01 cb 05 9a 00 00 01 c9 05 9b 00 01
E: 16.712008 14 01 07 01 cb 05 9a 00 00 01 c9 05 9b 00 01
E: 16.720017 14 01 07 01 cb 05 9a 00 00 01 c9 05 9b 00 01
E: 16.727994 14 01 07 01 cb 05 9b 00 00 01 c9 05 9b 00 01
E: 16.736019 14 01 07 01 cb 05 9b 00 00 01 c9 05 9b 00 01
E: 16.743990 14 01 07 01 cb 05 9b 00 00 01 c9 05 9b 00 01
E: 16.752014 14 01 07 01 cb 05 9b 00 00 01 c9 05 9b 00 01
E: 16.759995 14 01 07 01 cb 05 9b 00 00 01 c9 05 9b 00 01
E: 16.768015 14 01 07 01 cb 05 9b 00 00 01 c9 05 9b 00 01
E: 16.776024 14 01 07 01 cb 05 9b 00 00 01 c9 05 9b 00 01
E: 16.783993 14 01 07 01 cb 05 9b 00 00 01 c9 05 9b 00 01
E: 16.792023 14 01 07 01 cb 05 9b 00 00 01 c9 05 9b 00 01
E: 16.799991 14 01 07 01 cb 05 9b 00 00 01 c9 05 9b 00 01
E: 16.808015 14 01 07 01 cb 05 9b 00 00 01 c9 05 9b 00 01
E: 16.815993 14 01 07 01 cb 05 9b 00 00 01 c9 05 9b 00 01
E: 16.824018 14 01 07 01 cb 05 9b 00 00 01 c9 05 9b 00 01
E: 16.831991 14 01 07 01 cb 05 9b 00 00 01 c9 05 9b 00 01
E: 16.840024 14 01 07 01 cb 05 9b 00 00 01 c9 05 9b 00 01
E: 16.847994 14 01 07 01 cb 05 9b 00 00 01 c9 05 9b 00 01
E: 16.856018 14 01 07 01 cb 05 9b 00 00 01 c9 05 9b 00 01
E: 16.863998 14 01 07 01 cb 05 9b 00 00 01 c9 05 9b 00 01
E: 16.872015 14 01 07 01 cb 05 9b 00 00 01 c9 05 9b 00 01
E: 16.879993 14 01 07 01 cb 05 9b 00 00 01 c9 05 9b 00 01
E: 16.888021 14 01 07 01 cb 05 9b 00 00 01 c9 05 9b 00 01
E: 16.896000 14 01 07 01 cb 05 9b 00 00 01 c9 05 9b 00 01
E: 16.904033 14 01 07 01 cb 05 9b 00 00 01 c9 05 9b 00 01
E: 16.912000 14 01 07 01 cb 05 9b 00 00 01 c9 05 9b 00 01
E: 16.920023 14 01 07 01 cb 05 9b 00 00 01 c9 05 9b 00 01
E: 16.927999 14 01 07 01 cb 05 9b 00 00 01 c9 05 9b 00 01
E: 16.936017 14 01 07 01 cb 05 9b 00 00 01 c9 05 9b 00 01
E: 16.943993 14 01 07 01 cb 05 9b 00 00 01 c9 05 9b 00 01
E: 16.952018 14 01 07 01 cb 05 9b 00 00 01 c9 05 9b 00 01
E: 16.959993 14 01 07 01 cb 05 9b 00 00 01 c9 05 9b 00 01
E: 16.968019 14 01 07 01 cb 05 9b 00 00 01 c9 05 9b 00 01
E: 16.975994 14 01 07 01 cb 05 9b 00 00 01 c9 05 9b 00 01
E: 16.984016 14 01 07 01 cb 05 9b 00 00 01 c9 05 9b 00 01
E: 16.991991 14 01 07 01 cb 05 9b 00 00 01 c9 05 9b 00 01
E: 17.000019 14 01 07 01 cb 05 9b 00 00 01 c9 05 9b 00 01
E: 17.007993 14 01 07 01 cb 05 9b 00 00 01 c9 05 9b 00 01
E: 17.016013 14 01 07 01 cb 05 9b 00 00 01 c9 05 9b 00 01
E: 17.023993 14 01 07 01 cb 05 9b 00 00 01 c9 05 9b 00 01
E: 17.032015 14 01 07 01 cb 05 9b 00 00 01 c9 05 9b 00 01
E: 17.039988 14 01 07 01 cb 05 9b 00 00 01 c9 05 9b 00 01
E: 17.048019 14 01 07 01 cb 05 9b 00 00 01 c9 05 9b 00 01
E: 17.055998 14 01 07 01 cb 05 9b 00 00 01 c9 05 9b 00 01
E: 17.064017 14 01 07 01 cb 05 9b 00 00 01 c9 05 9b 00 01
E: 17.071993 14 01 07 01 cb 05 9b 00 00 01 c9 05 9b 00 01
E: 17.080020 14 01 07 01 cb 05 9b 00 00 01 c9 05 9b 00 01
E: 17.087992 14 01 07 01 cb 05 9b 00 00 01 c9 05 9b 00 01
E: 17.096022 14 01 07 01 cb 05 9b 00 00 01 c9 05 9b 00 01
E: 17.103996 14 01 07 01 cb 05 9b 00 00 01 c9 05 9b 00 01
E: 17.112031 14 01 07 01 cb 05 9b 00 00 01 c9 05 9b 00 01
E: 17.119992 14 01 07 01 cb 05 9b 00 00 01 c9 05 9b 00 01
E: 17.128024 14 01 07 01 cb 05 9b 00 00 01 c9 05 9b 00 01
E: 17.136004 14 01 07 01 cb 05 9b 00 00 01 c9 05 9b 00 01
E: 17.144020 14 01 07 01 cb 05 9b 00 00 01 c9 05 9b 00 01
E: 17.151994 14 01 07 01 cb 05 9b 00 00 01 c9 05 9b 00 01
E: 17.160020 14 01 07 01 cb 05 9b 00 00 01 c9 05 9b 00 01
E: 17.167992 14 01 07 01 cb 05 9b 00 00 01 c9 05 9b 00 01
E: 17.176017 14 01 07 01 cb 05 9b 00 00 01 c9 05 9b 00 01
E: 17.183995 14 01 07 01 cb 05 9b 00 00 01 c9 05 9b 00 01
E: 17.192020 14 01 07 01 cb 05 9b 00 00 01 c9 05 9b 00 01
E: 17.199992 14 01 07 01 cb 05 9b 00 00 01 c9 05 9b 00 01
E: 17.208020 14 01 07 01 cb 05 9b 00 00 01 c9 05 9b 00 01
E: 17.215998 14 01 07 01 cb 05 9b 00 00 01 c9 05 9b 00 01
E: 17.224023 14 01 06 01 cb 05 9b 00 00 01 c9 05 9b 00 01
E: 17.231988 14 01 06 01 cb 05 9b 00 00 01 c9 05 9b 00 01
# 3. Finally, move your ten fingers on the screen and release them.
E: 24.864038 14 01 07 00 2c 06 90 01 00 01 c9 05 9b 00 01
E: 24.872443 14 01 06 00 2c 06 90 01 00 01 c9 05 9b 00 01
E: 24.880119 14 01 06 00 2c 06 90 01 00 01 c9 05 9b 00 01
# Thank you.
