R: 122 05 0d 09 04 a1 01 85 01 09 22 a1 00 09 42 15 00 25 01 75 01 95 01 81 02 09 32 95 01 81 03 09 37 95 01 81 03 95 01 81 03 15 00 25 0f 75 04 09 51 95 01 81 02 09 54 95 01 81 02 09 55 95 01 81 02 05 01 26 ff 03 15 00 75 10 65 00 09 30 95 01 81 02 09 31 81 02 c0 05 0d 09 0e 85 02 09 23 a1 02 15 00 25 0a 09 52 75 08 95 01 b1 02 09 53 95 01 b1 02 09 55 95 01 b1 02 c0 c0
N: TRS-STAR SMT-C-T16U V1.0
I: 3 238f 0001
# 1. Drag _one_ finger on the screen from one corner to the opposite, and release it.
E: 0.000000 7 01 07 f1 d9 03 c0 03
E: 0.678263 7 01 07 f1 d9 03 bd 03
E: 0.942109 7 01 07 f1 d6 03 bd 03
E: 1.054009 7 01 07 f1 d6 03 bc 03
E: 1.079773 7 01 07 f1 d5 03 bc 03
E: 1.103915 7 01 07 f1 d5 03 bb 03
E: 1.141902 7 01 07 f1 d4 03 ba 03
E: 1.180017 7 01 07 f1 d3 03 b9 03
E: 1.206299 7 01 07 f1 d3 03 b8 03
E: 1.218031 7 01 07 f1 d2 03 b8 03
E: 1.229817 7 01 07 f1 d2 03 b7 03
E: 1.242409 7 01 07 f1 d1 03 b7 03
E: 1.256098 7 01 07 f1 d1 03 b6 03
E: 1.268094 7 01 07 f1 d0 03 b6 03
E: 1.280361 7 01 07 f1 d0 03 b5 03
E: 1.291801 7 01 07 f1 cf 03 b4 03
E: 1.318393 7 01 07 f1 ce 03 b3 03
E: 1.330191 7 01 07 f1 cd 03 b2 03
E: 1.342183 7 01 07 f1 cd 03 b1 03
E: 1.355912 7 01 07 f1 cc 03 af 03
E: 1.367918 7 01 07 f1 ca 03 ae 03
E: 1.380152 7 01 07 f1 c9 03 ac 03
E: 1.394180 7 01 07 f1 c7 03 aa 03
E: 1.406063 7 01 07 f1 c6 03 a8 03
E: 1.418007 7 01 07 f1 c4 03 a6 03
E: 1.430177 7 01 07 f1 c2 03 a3 03
E: 1.443917 7 01 07 f1 c0 03 a1 03
E: 1.455726 7 01 07 f1 bd 03 9d 03
E: 1.468335 7 01 07 f1 ba 03 9a 03
E: 1.479750 7 01 07 f1 b7 03 96 03
E: 1.493558 7 01 07 f1 b4 03 92 03
E: 1.506169 7 01 07 f1 b0 03 8e 03
E: 1.517507 7 01 07 f1 ac 03 8a 03
E: 1.530156 7 01 07 f1 a8 03 85 03
E: 1.543784 7 01 07 f1 a5 03 81 03
E: 1.555971 7 01 07 f1 a1 03 7d 03
E: 1.568086 7 01 07 f1 9d 03 79 03
E: 1.580232 7 01 07 f1 99 03 75 03
E: 1.593974 7 01 07 f1 95 03 71 03
E: 1.606165 7 01 07 f1 91 03 6d 03
E: 1.618071 7 01 07 f1 8d 03 69 03
E: 1.629820 7 01 07 f1 8a 03 66 03
E: 1.644147 7 01 07 f1 86 03 62 03
E: 1.655438 7 01 07 f1 82 03 5e 03
E: 1.668344 7 01 07 f1 7f 03 5b 03
E: 1.682154 7 01 07 f1 7c 03 58 03
E: 1.694017 7 01 07 f1 79 03 55 03
E: 1.706012 7 01 07 f1 76 03 52 03
E: 1.717953 7 01 07 f1 73 03 4f 03
E: 1.732181 7 01 07 f1 70 03 4c 03
E: 1.743666 7 01 07 f1 6d 03 48 03
E: 1.756208 7 01 07 f1 6a 03 45 03
E: 1.768018 7 01 07 f1 67 03 42 03
E: 1.782066 7 01 07 f1 65 03 3f 03
E: 1.794038 7 01 07 f1 62 03 3b 03
E: 1.806081 7 01 07 f1 5f 03 38 03
E: 1.817700 7 01 07 f1 5c 03 35 03
E: 1.832054 7 01 07 f1 59 03 32 03
E: 1.844133 7 01 07 f1 56 03 2f 03
E: 1.855965 7 01 07 f1 53 03 2c 03
E: 1.868371 7 01 07 f1 50 03 29 03
E: 1.882038 7 01 07 f1 4d 03 27 03
E: 1.894076 7 01 07 f1 4b 03 23 03
E: 1.905842 7 01 07 f1 48 03 20 03
E: 1.917949 7 01 07 f1 45 03 1d 03
E: 1.931939 7 01 07 f1 43 03 1a 03
E: 1.944242 7 01 07 f1 40 03 17 03
E: 1.955953 7 01 07 f1 3e 03 14 03
E: 1.968086 7 01 07 f1 3b 03 11 03
E: 1.982174 7 01 07 f1 39 03 0e 03
E: 1.993891 7 01 07 f1 36 03 0b 03
E: 2.006264 7 01 07 f1 33 03 07 03
E: 2.020253 7 01 07 f1 31 03 04 03
E: 2.031765 7 01 07 f1 2e 03 01 03
E: 2.043307 7 01 07 f1 2b 03 fe 02
E: 2.056140 7 01 07 f1 28 03 fa 02
E: 2.069586 7 01 07 f1 25 03 f7 02
E: 2.082134 7 01 07 f1 23 03 f3 02
E: 2.094088 7 01 07 f1 1f 03 ef 02
E: 2.106161 7 01 07 f1 1c 03 ea 02
E: 2.120215 7 01 07 f1 18 03 e6 02
E: 2.132020 7 01 07 f1 14 03 e2 02
E: 2.144142 7 01 07 f1 11 03 de 02
E: 2.155424 7 01 07 f1 0d 03 da 02
E: 2.169993 7 01 07 f1 0a 03 d5 02
E: 2.182139 7 01 07 f1 06 03 d1 02
E: 2.194273 7 01 07 f1 02 03 cd 02
E: 2.205929 7 01 07 f1 fe 02 c9 02
E: 2.220066 7 01 07 f1 fa 02 c5 02
E: 2.231834 7 01 07 f1 f7 02 c0 02
E: 2.244002 7 01 07 f1 f3 02 bc 02
E: 2.257916 7 01 07 f1 ef 02 b8 02
E: 2.270079 7 01 07 f1 eb 02 b4 02
E: 2.281830 7 01 07 f1 e7 02 af 02
E: 2.294142 7 01 07 f1 e3 02 ab 02
E: 2.308053 7 01 07 f1 df 02 a7 02
E: 2.320111 7 01 07 f1 db 02 a3 02
E: 2.332151 7 01 07 f1 d7 02 9f 02
E: 2.343914 7 01 07 f1 d3 02 9a 02
E: 2.357872 7 01 07 f1 cf 02 96 02
E: 2.370160 7 01 07 f1 ca 02 91 02
E: 2.382022 7 01 07 f1 c6 02 8c 02
E: 2.394351 7 01 07 f1 c1 02 87 02
E: 2.408006 7 01 07 f1 bd 02 83 02
E: 2.420003 7 01 07 f1 b9 02 7f 02
E: 2.432061 7 01 07 f1 b4 02 7a 02
E: 2.446129 7 01 07 f1 af 02 75 02
E: 2.457972 7 01 07 f1 aa 02 71 02
E: 2.470046 7 01 07 f1 a5 02 6c 02
E: 2.482193 7 01 07 f1 a0 02 67 02
E: 2.495732 7 01 07 f1 9c 02 63 02
E: 2.508067 7 01 07 f1 98 02 5f 02
E: 2.520242 7 01 07 f1 94 02 5b 02
E: 2.531990 7 01 07 f1 90 02 57 02
E: 2.546156 7 01 07 f1 8c 02 53 02
E: 2.558274 7 01 07 f1 88 02 4f 02
E: 2.570027 7 01 07 f1 84 02 4b 02
E: 2.582139 7 01 07 f1 80 02 47 02
E: 2.596276 7 01 07 f1 7b 02 43 02
E: 2.607881 7 01 07 f1 77 02 40 02
E: 2.620172 7 01 07 f1 73 02 3b 02
E: 2.632222 7 01 07 f1 6f 02 37 02
E: 2.645996 7 01 07 f1 6b 02 33 02
E: 2.658016 7 01 07 f1 65 02 2e 02
E: 2.670116 7 01 07 f1 61 02 2b 02
E: 2.682153 7 01 07 f1 5d 02 27 02
E: 2.696087 7 01 07 f1 59 02 22 02
E: 2.708045 7 01 07 f1 55 02 1f 02
E: 2.720202 7 01 07 f1 50 02 1b 02
E: 2.733915 7 01 07 f1 4c 02 17 02
E: 2.746210 7 01 07 f1 48 02 13 02
E: 2.757986 7 01 07 f1 44 02 0e 02
E: 2.769734 7 01 07 f1 40 02 0a 02
E: 2.784078 7 01 07 f1 3c 02 06 02
E: 2.796175 7 01 07 f1 38 02 02 02
E: 2.807575 7 01 07 f1 33 02 fe 01
E: 2.820153 7 01 07 f1 2f 02 fa 01
E: 2.834085 7 01 07 f1 2b 02 f6 01
E: 2.846166 7 01 07 f1 27 02 f2 01
E: 2.857991 7 01 07 f1 22 02 ed 01
E: 2.869802 7 01 07 f1 1e 02 e9 01
E: 2.884236 7 01 07 f1 1a 02 e5 01
E: 2.896151 7 01 07 f1 15 02 e0 01
E: 2.907993 7 01 07 f1 10 02 db 01
E: 2.920070 7 01 07 f1 0b 02 d6 01
E: 2.934188 7 01 07 f1 06 02 d2 01
E: 2.946055 7 01 07 f1 01 02 cd 01
E: 2.957555 7 01 07 f1 fc 01 c8 01
E: 2.972013 7 01 07 f1 f7 01 c3 01
E: 2.984021 7 01 07 f1 f2 01 bf 01
E: 2.996110 7 01 07 f1 ed 01 ba 01
E: 3.008035 7 01 07 f1 e8 01 b5 01
E: 3.022305 7 01 07 f1 e3 01 b1 01
E: 3.033979 7 01 07 f1 de 01 ac 01
E: 3.046529 7 01 07 f1 d9 01 a7 01
E: 3.057832 7 01 07 f1 d3 01 a3 01
E: 3.072250 7 01 07 f1 ce 01 9e 01
E: 3.084302 7 01 07 f1 c9 01 9a 01
E: 3.096306 7 01 07 f1 c3 01 96 01
E: 3.108032 7 01 07 f1 be 01 91 01
E: 3.122202 7 01 07 f1 b9 01 8d 01
E: 3.134102 7 01 07 f1 b4 01 89 01
E: 3.146085 7 01 07 f1 ae 01 84 01
E: 3.157492 7 01 07 f1 a9 01 80 01
E: 3.172051 7 01 07 f1 a4 01 7b 01
E: 3.183795 7 01 07 f1 9e 01 77 01
E: 3.195763 7 01 07 f1 9a 01 73 01
E: 3.210136 7 01 07 f1 95 01 70 01
E: 3.222311 7 01 07 f1 90 01 6b 01
E: 3.233686 7 01 07 f1 8c 01 68 01
E: 3.246129 7 01 07 f1 86 01 63 01
E: 3.260158 7 01 07 f1 82 01 60 01
E: 3.271976 7 01 07 f1 7d 01 5c 01
E: 3.283976 7 01 07 f1 79 01 58 01
E: 3.296471 7 01 07 f1 74 01 54 01
E: 3.309538 7 01 07 f1 70 01 51 01
E: 3.322092 7 01 07 f1 6b 01 4d 01
E: 3.334214 7 01 07 f1 67 01 49 01
E: 3.346154 7 01 07 f1 62 01 46 01
E: 3.360010 7 01 07 f1 5d 01 41 01
E: 3.372226 7 01 07 f1 58 01 3d 01
E: 3.384035 7 01 07 f1 53 01 39 01
E: 3.397948 7 01 07 f1 4f 01 36 01
E: 3.410079 7 01 07 f1 4b 01 32 01
E: 3.421914 7 01 07 f1 47 01 2e 01
E: 3.434264 7 01 07 f1 42 01 2b 01
E: 3.447967 7 01 07 f1 3e 01 27 01
E: 3.460119 7 01 07 f1 3a 01 23 01
E: 3.472358 7 01 07 f1 37 01 20 01
E: 3.483802 7 01 07 f1 33 01 1c 01
E: 3.497786 7 01 07 f1 2f 01 18 01
E: 3.510187 7 01 07 f1 2b 01 14 01
E: 3.521879 7 01 07 f1 27 01 11 01
E: 3.534049 7 01 07 f1 23 01 0d 01
E: 3.548400 7 01 07 f1 1f 01 09 01
E: 3.560058 7 01 07 f1 1b 01 06 01
E: 3.572044 7 01 07 f1 18 01 02 01
E: 3.583895 7 01 07 f1 14 01 fe 00
E: 3.598104 7 01 07 f1 10 01 fa 00
E: 3.610105 7 01 07 f1 0c 01 f7 00
E: 3.621887 7 01 07 f1 08 01 f3 00
E: 3.634164 7 01 07 f1 05 01 f0 00
E: 3.648017 7 01 07 f1 02 01 ed 00
E: 3.659876 7 01 07 f1 fe 00 ea 00
E: 3.671395 7 01 07 f1 fa 00 e6 00
E: 3.686189 7 01 07 f1 f5 00 e2 00
E: 3.697772 7 01 07 f1 f1 00 de 00
E: 3.710075 7 01 07 f1 ed 00 db 00
E: 3.722214 7 01 07 f1 e9 00 d7 00
E: 3.736234 7 01 07 f1 e5 00 d4 00
E: 3.748081 7 01 07 f1 e1 00 d0 00
E: 3.760367 7 01 07 f1 dd 00 cd 00
E: 3.772014 7 01 07 f1 d9 00 c9 00
E: 3.786177 7 01 07 f1 d5 00 c5 00
E: 3.798095 7 01 07 f1 d0 00 c2 00
E: 3.810197 7 01 07 f1 cc 00 be 00
E: 3.824152 7 01 07 f1 c8 00 bb 00
E: 3.836296 7 01 07 f1 c4 00 b8 00
E: 3.848024 7 01 07 f1 c0 00 b4 00
E: 3.860075 7 01 07 f1 bb 00 b1 00
E: 3.874213 7 01 07 f1 b7 00 ae 00
E: 3.886150 7 01 07 f1 b3 00 aa 00
E: 3.898141 7 01 07 f1 b0 00 a7 00
E: 3.910125 7 01 07 f1 ad 00 a5 00
E: 3.924275 7 01 07 f1 a8 00 a1 00
E: 3.936209 7 01 07 f1 a4 00 9e 00
E: 3.948223 7 01 07 f1 a1 00 9b 00
E: 3.960096 7 01 07 f1 9e 00 98 00
E: 3.974169 7 01 07 f1 9a 00 96 00
E: 3.986067 7 01 07 f1 97 00 93 00
E: 3.997992 7 01 07 f1 94 00 90 00
E: 4.010146 7 01 07 f1 90 00 8d 00
E: 4.023937 7 01 07 f1 8d 00 8a 00
E: 4.036159 7 01 07 f1 89 00 88 00
E: 4.048026 7 01 07 f1 86 00 85 00
E: 4.062256 7 01 07 f1 83 00 82 00
E: 4.074213 7 01 07 f1 80 00 7f 00
E: 4.086133 7 01 07 f1 7c 00 7c 00
E: 4.098020 7 01 07 f1 79 00 7a 00
E: 4.112120 7 01 07 f1 76 00 77 00
E: 4.124477 7 01 07 f1 73 00 74 00
E: 4.138743 7 01 07 f1 70 00 72 00
E: 4.148066 7 01 07 f1 6d 00 6f 00
E: 4.161741 7 01 07 f1 6a 00 6d 00
E: 4.174175 7 01 07 f1 68 00 6b 00
E: 4.186187 7 01 07 f1 65 00 69 00
E: 4.197734 7 01 07 f1 63 00 67 00
E: 4.212109 7 01 07 f1 61 00 65 00
E: 4.223985 7 01 07 f1 5f 00 63 00
E: 4.235844 7 01 07 f1 5d 00 61 00
E: 4.248128 7 01 07 f1 5b 00 5f 00
E: 4.262221 7 01 07 f1 59 00 5d 00
E: 4.274103 7 01 07 f1 57 00 5c 00
E: 4.286125 7 01 07 f1 55 00 5a 00
E: 4.300038 7 01 07 f1 54 00 59 00
E: 4.312065 7 01 07 f1 53 00 58 00
E: 4.324055 7 01 07 f1 52 00 57 00
E: 4.335264 7 01 07 f1 51 00 56 00
E: 4.349914 7 01 07 f1 50 00 55 00
E: 4.362032 7 01 07 f1 4f 00 54 00
E: 4.374326 7 01 07 f1 4e 00 53 00
E: 4.385928 7 01 07 f1 4d 00 53 00
E: 4.400091 7 01 07 f1 4c 00 52 00
E: 4.424043 7 01 07 f1 4b 00 51 00
E: 4.450073 7 01 07 f1 4a 00 50 00
E: 4.462105 7 01 07 f1 4a 00 4f 00
E: 4.474100 7 01 07 f1 49 00 4f 00
E: 4.488082 7 01 07 f1 49 00 4e 00
E: 4.500250 7 01 07 f1 48 00 4e 00
E: 4.512127 7 01 07 f1 48 00 4d 00
E: 4.523330 7 01 07 f1 47 00 4d 00
E: 4.538436 7 01 07 f1 47 00 4c 00
E: 4.550268 7 01 07 f1 46 00 4c 00
E: 4.574066 7 01 07 f1 45 00 4b 00
E: 4.599563 7 01 07 f1 44 00 4a 00
E: 4.626199 7 01 07 f1 44 00 49 00
E: 4.638047 7 01 07 f1 43 00 49 00
E: 4.662067 7 01 07 f1 42 00 48 00
E: 4.688017 7 01 07 f1 41 00 47 00
E: 4.711704 7 01 07 f1 40 00 46 00
E: 4.737974 7 01 07 f1 3f 00 45 00
E: 4.764064 7 01 07 f1 3f 00 44 00
E: 4.775359 7 01 07 f1 3e 00 44 00
E: 4.788002 7 01 07 f1 3d 00 43 00
E: 4.800229 7 01 07 f1 3d 00 42 00
E: 4.814079 7 01 07 f1 3c 00 42 00
E: 4.826115 7 01 07 f1 3c 00 41 00
E: 4.837983 7 01 07 f1 3b 00 41 00
E: 4.850174 7 01 07 f1 3b 00 40 00
E: 4.864099 7 01 07 f1 3a 00 40 00
E: 4.875791 7 01 07 f1 3a 00 3f 00
E: 4.900039 7 01 07 f1 39 00 3e 00
E: 4.926179 7 01 07 f1 38 00 3d 00
E: 4.964172 7 01 07 f1 37 00 3c 00
E: 5.001998 7 01 07 f1 36 00 3b 00
E: 5.038043 7 01 07 f1 35 00 3a 00
E: 5.076044 7 01 07 f1 34 00 3a 00
E: 5.088194 7 01 07 f1 34 00 39 00
E: 5.140214 7 01 07 f1 33 00 38 00
E: 5.202227 7 01 07 f1 32 00 37 00
E: 5.264070 7 01 07 f1 31 00 37 00
E: 5.277979 7 01 07 f1 31 00 36 00
E: 5.388030 7 01 06 f0 31 00 36 00
# 2. Land one finger,
   - land a second finger far enough from the first
   - move your two fingers
   - release the *first* finger
   - release the second finger
E: 12.230277 7 01 07 f1 87 02 e7 02
E: 12.556220 7 01 07 f1 87 02 e4 02
E: 14.226027 7 01 17 f2 9a 01 34 03
E: 15.047406 7 01 07 f2 87 02 e3 02
E: 16.010223 7 01 17 f2 9a 01 31 03
E: 16.048344 7 01 07 f2 87 02 e2 02
E: 16.049885 7 01 17 f2 9a 01 30 03
E: 16.086139 7 01 07 f2 87 02 e1 02
E: 16.087855 7 01 17 f2 9a 01 2f 03
E: 16.098128 7 01 17 f2 9a 01 2e 03
E: 16.111552 7 01 07 f2 87 02 e0 02
E: 16.124193 7 01 17 f2 9a 01 2d 03
E: 16.138499 7 01 07 f2 87 02 df 02
E: 16.150072 7 01 17 f2 9a 01 2c 03
E: 16.151215 7 01 07 f2 87 02 de 02
E: 16.161996 7 01 17 f2 9a 01 2b 03
E: 16.175912 7 01 07 f2 87 02 dd 02
E: 16.177966 7 01 17 f2 9a 01 2a 03
E: 16.189942 7 01 07 f2 87 02 dc 02
E: 16.191890 7 01 17 f2 9a 01 29 03
E: 16.201374 7 01 07 f2 87 02 db 02
E: 16.203970 7 01 17 f2 9a 01 28 03
E: 16.215780 7 01 07 f2 87 02 da 02
E: 16.218116 7 01 17 f2 9a 01 27 03
E: 16.228333 7 01 07 f2 85 02 d8 02
E: 16.230154 7 01 17 f2 9a 01 26 03
E: 16.240127 7 01 07 f2 84 02 d7 02
E: 16.242270 7 01 17 f2 9a 01 25 03
E: 16.253992 7 01 07 f2 84 02 d6 02
E: 16.256355 7 01 17 f2 9a 01 23 03
E: 16.265906 7 01 07 f2 84 02 d4 02
E: 16.267945 7 01 17 f2 9a 01 21 03
E: 16.278156 7 01 07 f2 84 02 d2 02
E: 16.280534 7 01 17 f2 9a 01 1f 03
E: 16.291763 7 01 07 f2 84 02 d0 02
E: 16.294257 7 01 17 f2 9a 01 1c 03
E: 16.304010 7 01 07 f2 84 02 ce 02
E: 16.306445 7 01 17 f2 9a 01 1a 03
E: 16.318128 7 01 07 f2 84 02 cc 02
E: 16.320256 7 01 17 f2 9a 01 18 03
E: 16.330083 7 01 07 f2 84 02 c9 02
E: 16.332196 7 01 17 f2 9a 01 16 03
E: 16.342071 7 01 07 f2 83 02 c7 02
E: 16.344471 7 01 17 f2 9a 01 13 03
E: 16.355336 7 01 07 f2 83 02 c5 02
E: 16.358118 7 01 17 f2 9a 01 11 03
E: 16.368017 7 01 07 f2 83 02 c3 02
E: 16.370042 7 01 17 f2 98 01 0f 03
E: 16.381827 7 01 07 f2 83 02 c0 02
E: 16.384403 7 01 17 f2 98 01 0d 03
E: 16.394009 7 01 07 f2 83 02 be 02
E: 16.395825 7 01 17 f2 98 01 0b 03
E: 16.406102 7 01 07 f2 82 02 bc 02
E: 16.407937 7 01 17 f2 98 01 09 03
E: 16.419303 7 01 07 f2 82 02 ba 02
E: 16.422048 7 01 17 f2 98 01 06 03
E: 16.431793 7 01 07 f2 82 02 b7 02
E: 16.434094 7 01 17 f2 98 01 04 03
E: 16.446127 7 01 07 f2 82 02 b5 02
E: 16.448260 7 01 17 f2 98 01 02 03
E: 16.458189 7 01 07 f2 82 02 b3 02
E: 16.460258 7 01 17 f2 98 01 00 03
E: 16.469582 7 01 07 f2 82 02 b1 02
E: 16.471974 7 01 17 f2 97 01 fd 02
E: 16.484110 7 01 07 f2 81 02 ae 02
E: 16.485884 7 01 17 f2 97 01 fb 02
E: 16.496038 7 01 07 f2 81 02 ac 02
E: 16.498338 7 01 17 f2 97 01 f9 02
E: 16.510078 7 01 07 f2 81 02 aa 02
E: 16.512146 7 01 17 f2 97 01 f7 02
E: 16.522061 7 01 07 f2 81 02 a8 02
E: 16.524431 7 01 17 f2 97 01 f4 02
E: 16.534043 7 01 07 f2 81 02 a5 02
E: 16.536352 7 01 17 f2 97 01 f2 02
E: 16.548190 7 01 07 f2 81 02 a3 02
E: 16.550274 7 01 17 f2 97 01 f0 02
E: 16.559925 7 01 07 f2 81 02 a1 02
E: 16.562184 7 01 17 f2 96 01 ed 02
E: 16.573901 7 01 07 f2 81 02 9e 02
E: 16.576368 7 01 17 f2 96 01 eb 02
E: 16.586091 7 01 07 f2 80 02 9c 02
E: 16.587756 7 01 17 f2 96 01 e8 02
E: 16.598187 7 01 07 f2 80 02 99 02
E: 16.600460 7 01 17 f2 96 01 e6 02
E: 16.612034 7 01 07 f2 80 02 97 02
E: 16.614286 7 01 17 f2 96 01 e3 02
E: 16.624146 7 01 07 f2 80 02 94 02
E: 16.626275 7 01 17 f2 96 01 e1 02
E: 16.638179 7 01 07 f2 80 02 92 02
E: 16.640513 7 01 17 f2 96 01 de 02
E: 16.649979 7 01 07 f2 80 02 8f 02
E: 16.651910 7 01 17 f2 96 01 dc 02
E: 16.661695 7 01 07 f2 80 02 8d 02
E: 16.663899 7 01 17 f2 96 01 d9 02
E: 16.675381 7 01 07 f2 80 02 8a 02
E: 16.678207 7 01 17 f2 96 01 d7 02
E: 16.688172 7 01 07 f2 80 02 88 02
E: 16.690276 7 01 17 f2 95 01 d4 02
E: 16.701933 7 01 07 f2 80 02 85 02
E: 16.704214 7 01 17 f2 95 01 d2 02
E: 16.714084 7 01 07 f2 7f 02 83 02
E: 16.716248 7 01 17 f2 95 01 d0 02
E: 16.726161 7 01 07 f2 7f 02 81 02
E: 16.728268 7 01 17 f2 95 01 cd 02
E: 16.740081 7 01 07 f2 7f 02 7e 02
E: 16.742198 7 01 17 f2 95 01 ca 02
E: 16.751833 7 01 07 f2 7f 02 7c 02
E: 16.753835 7 01 17 f2 95 01 c8 02
E: 16.766091 7 01 07 f2 7f 02 79 02
E: 16.767929 7 01 17 f2 95 01 c5 02
E: 16.778192 7 01 07 f2 7f 02 77 02
E: 16.780477 7 01 17 f2 95 01 c3 02
E: 16.790117 7 01 07 f2 7f 02 73 02
E: 16.791680 7 01 17 f2 95 01 c0 02
E: 16.804158 7 01 07 f2 7f 02 70 02
E: 16.806133 7 01 17 f2 95 01 be 02
E: 16.817293 7 01 07 f2 7e 02 6d 02
E: 16.818280 7 01 17 f2 95 01 bb 02
E: 16.829874 7 01 07 f2 7e 02 6a 02
E: 16.831926 7 01 17 f2 95 01 b9 02
E: 16.842076 7 01 07 f2 7e 02 67 02
E: 16.844101 7 01 17 f2 94 01 b6 02
E: 16.854096 7 01 07 f2 7e 02 64 02
E: 16.856072 7 01 17 f2 94 01 b3 02
E: 16.868053 7 01 07 f2 7e 02 62 02
E: 16.870314 7 01 17 f2 94 01 b1 02
E: 16.880252 7 01 07 f2 7e 02 60 02
E: 16.882303 7 01 17 f2 94 01 ae 02
E: 16.894105 7 01 07 f2 7e 02 5d 02
E: 16.896310 7 01 17 f2 94 01 ac 02
E: 16.906339 7 01 07 f2 7e 02 5b 02
E: 16.907912 7 01 17 f2 94 01 aa 02
E: 16.918121 7 01 07 f2 7d 02 59 02
E: 16.920113 7 01 17 f2 94 01 a7 02
E: 16.931732 7 01 07 f2 7d 02 56 02
E: 16.934477 7 01 17 f2 94 01 a5 02
E: 16.944096 7 01 07 f2 7d 02 54 02
E: 16.946251 7 01 17 f2 94 01 a2 02
E: 16.958077 7 01 07 f2 7d 02 52 02
E: 16.960234 7 01 17 f2 94 01 a0 02
E: 16.970098 7 01 07 f2 7d 02 4f 02
E: 16.972224 7 01 17 f2 94 01 9d 02
E: 16.984081 7 01 07 f2 7d 02 4d 02
E: 16.986183 7 01 17 f2 93 01 9b 02
E: 16.996125 7 01 07 f2 7d 02 4b 02
E: 16.998188 7 01 17 f2 93 01 99 02
E: 17.008271 7 01 07 f2 7c 02 48 02
E: 17.009615 7 01 17 f2 93 01 96 02
E: 17.021948 7 01 07 f2 7c 02 46 02
E: 17.024229 7 01 17 f2 93 01 94 02
E: 17.033901 7 01 07 f2 7c 02 44 02
E: 17.036320 7 01 17 f2 93 01 91 02
E: 17.048175 7 01 07 f2 7c 02 41 02
E: 17.050064 7 01 17 f2 93 01 8f 02
E: 17.060284 7 01 07 f2 7c 02 3f 02
E: 17.062094 7 01 17 f2 93 01 8d 02
E: 17.071924 7 01 07 f2 7c 02 3c 02
E: 17.073795 7 01 17 f2 93 01 8a 02
E: 17.086206 7 01 07 f2 7c 02 3a 02
E: 17.087556 7 01 17 f2 93 01 88 02
E: 17.098133 7 01 07 f2 7c 02 37 02
E: 17.100195 7 01 17 f2 93 01 86 02
E: 17.111937 7 01 07 f2 7c 02 35 02
E: 17.114162 7 01 17 f2 92 01 83 02
E: 17.124041 7 01 07 f2 7c 02 33 02
E: 17.126269 7 01 17 f2 92 01 81 02
E: 17.135665 7 01 07 f2 7c 02 31 02
E: 17.138225 7 01 17 f2 92 01 7f 02
E: 17.149840 7 01 07 f2 7b 02 2e 02
E: 17.152246 7 01 17 f2 92 01 7c 02
E: 17.161658 7 01 07 f2 7b 02 2c 02
E: 17.164024 7 01 17 f2 92 01 7a 02
E: 17.175822 7 01 07 f2 7b 02 2a 02
E: 17.178719 7 01 17 f2 92 01 78 02
E: 17.188103 7 01 07 f2 7b 02 28 02
E: 17.189615 7 01 17 f2 92 01 76 02
E: 17.200099 7 01 07 f2 7b 02 26 02
E: 17.201319 7 01 17 f2 92 01 73 02
E: 17.214128 7 01 07 f2 7b 02 24 02
E: 17.216201 7 01 17 f2 92 01 71 02
E: 17.226186 7 01 07 f2 7b 02 22 02
E: 17.228270 7 01 17 f2 92 01 6f 02
E: 17.239243 7 01 07 f2 7a 02 1f 02
E: 17.242459 7 01 17 f2 91 01 6d 02
E: 17.252001 7 01 07 f2 7a 02 1e 02
E: 17.254186 7 01 17 f2 91 01 6b 02
E: 17.263861 7 01 07 f2 7a 02 1c 02
E: 17.265775 7 01 17 f2 91 01 68 02
E: 17.278039 7 01 07 f2 7a 02 1a 02
E: 17.279813 7 01 17 f2 91 01 66 02
E: 17.290197 7 01 07 f2 7a 02 19 02
E: 17.291910 7 01 17 f2 91 01 64 02
E: 17.304041 7 01 07 f2 7a 02 17 02
E: 17.306375 7 01 17 f2 91 01 62 02
E: 17.316145 7 01 07 f2 7a 02 14 02
E: 17.318159 7 01 17 f2 91 01 60 02
E: 17.327990 7 01 07 f2 7a 02 12 02
E: 17.330108 7 01 17 f2 91 01 5d 02
E: 17.341954 7 01 07 f2 7a 02 0f 02
E: 17.344372 7 01 17 f2 91 01 5b 02
E: 17.354168 7 01 07 f2 7a 02 0d 02
E: 17.355980 7 01 17 f2 91 01 59 02
E: 17.366028 7 01 07 f2 7a 02 0b 02
E: 17.368283 7 01 17 f2 91 01 57 02
E: 17.379884 7 01 07 f2 7a 02 08 02
E: 17.381803 7 01 17 f2 91 01 54 02
E: 17.392171 7 01 07 f2 79 02 06 02
E: 17.393933 7 01 17 f2 90 01 52 02
E: 17.406031 7 01 07 f2 79 02 04 02
E: 17.408274 7 01 17 f2 90 01 50 02
E: 17.418021 7 01 07 f2 79 02 01 02
E: 17.420129 7 01 17 f2 90 01 4d 02
E: 17.431432 7 01 07 f2 79 02 ff 01
E: 17.433991 7 01 17 f2 90 01 4b 02
E: 17.444049 7 01 07 f2 79 02 fc 01
E: 17.446105 7 01 17 f2 90 01 49 02
E: 17.456119 7 01 07 f2 79 02 fa 01
E: 17.458121 7 01 17 f2 90 01 46 02
E: 17.469987 7 01 07 f2 79 02 f8 01
E: 17.471897 7 01 17 f2 90 01 44 02
E: 17.481932 7 01 07 f2 78 02 f5 01
E: 17.484415 7 01 17 f2 90 01 41 02
E: 17.493994 7 01 07 f2 78 02 f3 01
E: 17.496304 7 01 17 f2 90 01 3f 02
E: 17.508014 7 01 07 f2 78 02 f0 01
E: 17.510230 7 01 17 f2 90 01 3c 02
E: 17.519985 7 01 07 f2 78 02 ee 01
E: 17.522054 7 01 17 f2 90 01 3a 02
E: 17.534084 7 01 07 f2 78 02 eb 01
E: 17.536120 7 01 17 f2 90 01 38 02
E: 17.546024 7 01 07 f2 78 02 e8 01
E: 17.547930 7 01 17 f2 90 01 35 02
E: 17.557763 7 01 07 f2 77 02 e6 01
E: 17.559876 7 01 17 f2 90 01 33 02
E: 17.571993 7 01 07 f2 77 02 e3 01
E: 17.574168 7 01 17 f2 90 01 31 02
E: 17.584264 7 01 07 f2 77 02 e0 01
E: 17.586208 7 01 17 f2 90 01 2f 02
E: 17.598131 7 01 07 f2 77 02 de 01
E: 17.600236 7 01 17 f2 8f 01 2c 02
E: 17.610039 7 01 07 f2 77 02 dc 01
E: 17.612186 7 01 17 f2 8f 01 2a 02
E: 17.622055 7 01 07 f2 77 02 da 01
E: 17.624181 7 01 17 f2 8f 01 28 02
E: 17.636052 7 01 07 f2 77 02 d8 01
E: 17.637736 7 01 17 f2 8f 01 26 02
E: 17.648035 7 01 07 f2 77 02 d6 01
E: 17.649540 7 01 17 f2 8f 01 24 02
E: 17.661981 7 01 07 f2 76 02 d4 01
E: 17.664065 7 01 17 f2 8f 01 23 02
E: 17.674188 7 01 07 f2 76 02 d2 01
E: 17.676142 7 01 17 f2 8f 01 21 02
E: 17.686385 7 01 07 f2 76 02 d0 01
E: 17.687859 7 01 17 f2 8f 01 20 02
E: 17.700135 7 01 07 f2 76 02 cf 01
E: 17.701561 7 01 17 f2 8f 01 1e 02
E: 17.711987 7 01 07 f2 76 02 ce 01
E: 17.714241 7 01 17 f2 8f 01 1d 02
E: 17.726190 7 01 07 f2 76 02 cc 01
E: 17.728306 7 01 17 f2 8f 01 1b 02
E: 17.738117 7 01 07 f2 76 02 cb 01
E: 17.740089 7 01 17 f2 8f 01 1a 02
E: 17.749845 7 01 07 f2 76 02 ca 01
E: 17.751930 7 01 17 f2 8f 01 19 02
E: 17.764065 7 01 07 f2 76 02 c9 01
E: 17.765867 7 01 17 f2 8f 01 18 02
E: 17.776160 7 01 07 f2 75 02 c8 01
E: 17.778235 7 01 17 f2 8f 01 16 02
E: 17.790057 7 01 07 f2 75 02 c7 01
E: 17.792132 7 01 17 f2 8f 01 15 02
E: 17.802033 7 01 07 f2 75 02 c6 01
E: 17.814027 7 01 17 f2 8f 01 14 02
E: 17.815919 7 01 07 f2 75 02 c5 01
E: 17.828159 7 01 17 f2 8f 01 13 02
E: 17.829877 7 01 07 f2 75 02 c4 01
E: 17.839769 7 01 17 f2 8f 01 12 02
E: 17.854042 7 01 07 f2 75 02 c3 01
E: 17.856153 7 01 17 f2 8f 01 11 02
E: 17.866126 7 01 07 f2 75 02 c2 01
E: 17.868234 7 01 17 f2 8f 01 10 02
E: 17.878097 7 01 07 f2 75 02 c1 01
E: 17.880281 7 01 17 f2 8f 01 0f 02
E: 17.890092 7 01 07 f2 75 02 c0 01
E: 17.904119 7 01 17 f2 8f 01 0e 02
E: 17.918148 7 01 07 f2 74 02 bf 01
E: 17.920271 7 01 17 f2 8f 01 0d 02
E: 17.930049 7 01 07 f2 74 02 be 01
E: 17.932043 7 01 17 f2 8f 01 0c 02
E: 17.956193 7 01 07 f2 74 02 bd 01
E: 17.958228 7 01 17 f2 8f 01 0b 02
E: 17.968059 7 01 17 f2 8f 01 0a 02
E: 17.980584 7 01 07 f2 74 02 bc 01
E: 17.993371 7 01 17 f2 8f 01 09 02
E: 17.996378 7 01 07 f2 74 02 bb 01
E: 18.019947 7 01 17 f2 8f 01 08 02
E: 18.022004 7 01 07 f2 74 02 ba 01
E: 18.031886 7 01 17 f2 8f 01 07 02
E: 18.044135 7 01 07 f2 74 02 b9 01
E: 18.056083 7 01 17 f2 8f 01 06 02
E: 18.070345 7 01 07 f2 74 02 b8 01
E: 18.096046 7 01 17 f2 8f 01 05 02
E: 18.098274 7 01 07 f2 73 02 b8 01
E: 18.108019 7 01 07 f2 73 02 b7 01
E: 18.120058 7 01 17 f2 8f 01 04 02
E: 18.133989 7 01 07 f2 73 02 b6 01
E: 18.146064 7 01 17 f2 8f 01 03 02
E: 18.172093 7 01 07 f2 73 02 b5 01
E: 18.184153 7 01 17 f2 8f 01 02 02
E: 18.210083 7 01 07 f2 73 02 b4 01
E: 18.224010 7 01 17 f2 8f 01 01 02
E: 18.250174 7 01 07 f2 73 02 b3 01
E: 18.262008 7 01 17 f2 8f 01 00 02
E: 18.288120 7 01 07 f2 73 02 b2 01
E: 18.300015 7 01 17 f2 8f 01 ff 01
E: 18.338166 7 01 07 f2 73 02 b1 01
E: 18.351688 7 01 17 f2 8f 01 fe 01
E: 18.376221 7 01 07 f2 72 02 b1 01
E: 18.390365 7 01 07 f2 72 02 b0 01
E: 18.416182 7 01 17 f2 8f 01 fd 01
E: 18.466154 7 01 07 f2 72 02 af 01
E: 18.480268 7 01 17 f2 8f 01 fc 01
E: 18.544113 7 01 07 f2 72 02 ae 01
E: 18.570243 7 01 17 f2 8f 01 fb 01
E: 18.646089 7 01 07 f2 72 02 ad 01
E: 18.672006 7 01 17 f2 8f 01 fa 01
E: 18.786178 7 01 07 f2 72 02 ac 01
E: 18.800226 7 01 17 f2 8f 01 f9 01
E: 18.940245 7 01 17 f2 8f 01 f8 01
E: 18.992104 7 01 17 f2 8f 01 f7 01
E: 19.018405 7 01 17 f2 8f 01 f6 01
E: 19.041950 7 01 06 f1 72 02 ac 01
E: 19.054086 7 01 17 f1 8f 01 f5 01
E: 19.104154 7 01 17 f1 8f 01 f4 01
E: 19.118458 7 01 17 f1 8e 01 f4 01
E: 19.218048 7 01 17 f1 8d 01 f4 01
E: 19.268076 7 01 17 f1 8c 01 f4 01
E: 19.330226 7 01 17 f1 8b 01 f4 01
E: 19.394128 7 01 17 f1 8a 01 f4 01
E: 19.418073 7 01 17 f1 8a 01 f7 01
E: 19.494131 7 01 17 f1 89 01 f7 01
E: 19.670166 7 01 17 f1 88 01 f7 01
E: 20.172060 7 01 17 f1 87 01 f7 01
E: 20.898163 7 01 16 f0 87 01 f7 01
# 3. Finally, move your ten fingers on the screen and release them.
E: 28.748129 7 01 07 f1 d1 03 6b 02
E: 29.114024 7 01 17 f2 5a 03 26 03
E: 29.292050 7 01 07 f2 d1 03 68 02
E: 29.306205 7 01 17 f2 5a 03 23 03
E: 29.370066 7 01 17 f2 5a 03 22 03
E: 29.433800 7 01 07 f2 d1 03 67 02
E: 29.459849 7 01 07 f2 ce 03 67 02
E: 29.474881 7 01 17 f2 5a 03 21 03
E: 29.721988 7 01 07 f2 ce 03 66 02
E: 29.734890 7 01 07 f2 cd 03 66 02
E: 29.840164 7 01 17 f2 5a 03 24 03
E: 29.879997 7 01 17 f2 5a 03 25 03
E: 29.908066 7 01 17 f2 5a 03 26 03
E: 29.950044 7 01 17 f2 5a 03 27 03
E: 29.979167 7 01 07 f2 cd 03 65 02
E: 29.982062 7 01 17 f2 5a 03 28 03
E: 30.006261 7 01 17 f2 5a 03 29 03
E: 30.050014 7 01 17 f2 5a 03 2a 03
E: 30.092111 7 01 17 f2 5a 03 2b 03
E: 30.162111 7 01 07 f2 cd 03 64 02
E: 30.165408 7 01 17 f2 5a 03 2c 03
E: 30.204033 7 01 17 f2 5a 03 2d 03
E: 30.292261 7 01 17 f2 5a 03 2e 03
E: 30.377806 7 01 17 f2 5a 03 2f 03
E: 30.436029 7 01 07 f2 cd 03 63 02
E: 30.481286 7 01 17 f2 5a 03 30 03
E: 30.792174 7 01 17 f2 5a 03 31 03
E: 31.094147 7 01 07 f2 cd 03 62 02
E: 31.676227 7 01 07 f2 cd 03 61 02
E: 32.126001 7 01 16 f0 5a 03 31 03
E: 32.129229 7 01 06 f0 cd 03 61 02
E: 32.978034 7 01 17 f2 67 03 f5 02
E: 32.981120 7 01 07 f2 dc 03 14 02
E: 33.066047 7 01 16 f0 67 03 f5 02
E: 33.070570 7 01 06 f0 dc 03 14 02
E: 33.190234 7 01 07 f1 20 00 3c 02
E: 33.204079 7 01 17 f2 a9 00 1d 03
E: 33.315847 7 01 06 f0 20 00 3c 02
E: 33.319021 7 01 16 f0 a9 00 1d 03
E: 33.574213 7 01 07 f2 ff 01 02 01
E: 33.579027 7 01 17 f2 1a 00 10 02
E: 33.627162 7 01 06 f0 ff 01 02 01
E: 33.631082 7 01 16 f0 1a 00 10 02
E: 33.907687 7 01 07 f1 e3 03 ba 01
E: 34.005785 7 01 06 f0 e3 03 ba 01
E: 34.560131 7 01 17 f2 15 00 b7 01
E: 34.563366 7 01 07 f2 fe 01 af 00
E: 34.621317 7 01 16 f0 15 00 b7 01
E: 34.625866 7 01 06 f0 fe 01 af 00
E: 34.905921 7 01 17 f2 87 03 41 02
E: 34.908819 7 01 07 f2 e5 03 5b 01
E: 34.980137 7 01 16 f0 87 03 41 02
E: 34.984582 7 01 06 f0 e5 03 5b 01
E: 35.200211 7 01 07 f1 42 01 c1 02
E: 35.300167 7 01 06 f0 42 01 c1 02
# Thank you.
