R: 219 05 0d 09 04 a1 01 85 01 09 22 a1 02 09 42 15 00 25 01 75 01 95 01 81 02 09 32 95 01 81 02 95 06 81 01 05 01 26 00 10 75 10 95 01 65 00 09 30 81 02 09 31 46 00 10 81 02 05 0d 09 51 26 ff 00 75 08 95 01 81 02 c0 85 02 09 55 15 00 25 08 75 08 95 01 b1 02 c0 05 0d 09 0e a1 01 85 03 a1 02 09 23 09 52 09 53 15 00 25 08 75 08 95 02 b1 02 c0 c0 05 01 09 02 a1 01 09 01 a1 00 85 04 05 09 19 01 29 02 15 00 25 01 95 02 75 01 81 02 95 01 75 06 81 01 05 01 09 30 09 31 15 00 26 00 10 35 00 46 00 10 65 00 75 10 95 02 81 62 c0 c0 06 00 ff 09 01 a1 01 85 05 09 00 15 00 26 ff 00 75 08 95 3f b1 02 c0 06 00 ff 09 01 a1 01 85 06 09 00 15 00 26 ff 00 75 08 95 3f 81 02 c0
N: Zytronic Displays Limited Zytronic Touchscreen Controller
I: 3 14c8 0005
# 1. Drag _one_ finger on the screen from one corner to the opposite, and release it.
E: 0.000000 7 01 07 9d 01 4f 01 00
E: 0.007224 7 01 07 9d 01 4f 01 00
E: 0.015440 7 01 07 9d 01 4f 01 00
E: 0.024524 7 01 07 9d 01 4f 01 00
E: 0.031019 7 01 07 9d 01 4f 01 00
E: 0.039432 7 01 07 9d 01 4f 01 00
E: 0.047565 7 01 07 9d 01 4f 01 00
E: 0.055429 7 01 07 9d 01 4f 01 00
E: 0.064646 7 01 07 bb 01 54 01 00
E: 0.072051 7 01 07 c0 01 55 01 00
E: 0.080081 7 01 07 c5 01 56 01 00
E: 0.088143 7 01 07 c9 01 58 01 00
E: 0.096080 7 01 07 cf 01 59 01 00
E: 0.104592 7 01 07 d2 01 5b 01 00
E: 0.112107 7 01 07 d6 01 5d 01 00
E: 0.120034 7 01 07 da 01 5f 01 00
E: 0.127161 7 01 07 de 01 61 01 00
E: 0.136037 7 01 07 e3 01 63 01 00
E: 0.143834 7 01 07 e7 01 64 01 00
E: 0.152088 7 01 07 ea 01 66 01 00
E: 0.159836 7 01 07 ee 01 68 01 00
E: 0.167873 7 01 04 ef 01 68 01 00
E: 0.399892 7 01 07 aa 02 77 01 00
E: 0.407215 7 01 07 aa 02 77 01 00
E: 0.415313 7 01 07 aa 02 77 01 00
E: 0.423951 7 01 07 aa 02 77 01 00
E: 0.431197 7 01 07 aa 02 77 01 00
E: 0.439727 7 01 07 aa 02 77 01 00
E: 0.447386 7 01 07 c3 02 6d 01 00
E: 0.455561 7 01 07 c9 02 6b 01 00
E: 0.463647 7 01 07 cf 02 69 01 00
E: 0.472052 7 01 07 d5 02 67 01 00
E: 0.480085 7 01 07 db 02 65 01 00
E: 0.488066 7 01 07 df 02 62 01 00
E: 0.495876 7 01 07 e4 02 5f 01 00
E: 0.503880 7 01 07 e7 02 5e 01 00
E: 0.511881 7 01 07 ec 02 5c 01 00
E: 0.519065 7 01 07 f1 02 5a 01 00
E: 0.527257 7 01 07 f5 02 59 01 00
E: 0.535167 7 01 07 fa 02 57 01 00
E: 0.544088 7 01 07 00 03 55 01 00
E: 0.551754 7 01 07 07 03 53 01 00
E: 0.559962 7 01 07 0c 03 51 01 00
E: 0.567226 7 01 04 11 03 4f 01 00
E: 0.999983 7 01 07 22 05 06 01 00
E: 1.007847 7 01 07 22 05 06 01 00
E: 1.016077 7 01 07 22 05 06 01 00
E: 1.023841 7 01 07 22 05 06 01 00
E: 1.031806 7 01 07 22 05 06 01 00
E: 1.039881 7 01 04 22 05 06 01 00
# 2. Land one finger,
#  - land a second finger far enough from the first
#  - move your two fingers
#  - release the *first* finger
#  - release the second finger
E: 4.624006 7 01 07 ee 04 73 03 00
E: 4.631401 7 01 07 ee 04 73 03 00
E: 4.639655 7 01 07 ee 04 73 03 00
E: 4.647102 7 01 07 ee 04 73 03 00
E: 4.655747 7 01 07 fe 04 8c 03 00
E: 4.663567 7 01 07 03 05 95 03 00
E: 4.671547 7 01 07 08 05 9d 03 00
E: 4.679479 7 01 07 0d 05 a8 03 00
E: 4.687545 7 01 07 11 05 b2 03 00
E: 4.695070 7 01 07 17 05 bf 03 00
E: 4.703869 7 01 07 1b 05 ca 03 00
E: 4.711543 7 01 07 1f 05 d4 03 00
E: 4.720198 7 01 07 22 05 e0 03 00
E: 4.728163 7 01 07 25 05 ea 03 00
E: 4.735228 7 01 07 28 05 f5 03 00
E: 4.744292 7 01 07 2b 05 04 04 00
E: 4.752212 7 01 07 2d 05 0f 04 00
E: 4.759364 7 01 07 30 05 1f 04 00
E: 4.768117 7 01 07 32 05 2c 04 00
E: 4.776108 7 01 07 33 05 37 04 00
E: 4.783307 7 01 07 36 05 47 04 00
E: 4.792081 7 01 07 37 05 52 04 00
E: 4.799209 7 01 07 38 05 5b 04 00
E: 4.808164 7 01 07 39 05 65 04 00
E: 4.815262 7 01 07 3a 05 70 04 00
E: 4.824160 7 01 07 3a 05 79 04 00
E: 4.831241 7 01 07 3b 05 80 04 00
E: 4.840101 7 01 07 3c 05 88 04 00
E: 4.848084 7 01 07 3c 05 8e 04 00
E: 4.856132 7 01 07 3d 05 96 04 00
E: 4.863214 7 01 07 3e 05 9c 04 00
E: 4.872109 7 01 07 3f 05 a2 04 00
E: 4.879183 7 01 07 3f 05 a8 04 00
E: 4.888070 7 01 07 40 05 b1 04 00
E: 4.896184 7 01 07 42 05 b8 04 00
E: 4.904210 7 01 07 43 05 c2 04 00
E: 4.911257 7 01 07 45 05 cb 04 00
E: 4.920532 7 01 07 45 05 d5 04 00
E: 4.927228 7 01 07 46 05 e0 04 00
E: 4.936478 7 01 07 46 05 e9 04 00
E: 4.944027 7 01 07 47 05 f5 04 00
E: 4.952075 7 01 07 48 05 fe 04 00
E: 4.960600 7 01 07 49 05 08 05 00
E: 4.968162 7 01 07 49 05 11 05 00
E: 4.976172 7 01 07 4a 05 1a 05 00
E: 4.984165 7 01 07 4b 05 25 05 00
E: 4.992177 7 01 07 4b 05 2d 05 00
E: 4.999228 7 01 07 4c 05 36 05 00
E: 5.008110 7 01 07 4d 05 41 05 00
E: 5.015190 7 01 07 4f 05 47 05 00
E: 5.024107 7 01 07 50 05 51 05 00
E: 5.032550 7 01 07 50 05 5a 05 00
E: 5.040209 7 01 07 51 05 64 05 00
E: 5.047086 7 01 07 52 05 6c 05 00
E: 5.056185 7 01 07 53 05 78 05 00
E: 5.063207 7 01 07 54 05 80 05 00
E: 5.072108 7 01 07 56 05 89 05 00
E: 5.079180 7 01 07 57 05 91 05 00
E: 5.088109 7 01 07 57 05 97 05 00
E: 5.095183 7 01 07 58 05 9e 05 00
E: 5.103231 7 01 07 58 05 a3 05 00
E: 5.111046 7 01 07 58 05 a6 05 00
E: 5.120128 7 01 07 58 05 aa 05 00
E: 5.128039 7 01 07 59 05 ad 05 00
E: 5.136080 7 01 07 59 05 b0 05 00
E: 5.144603 7 01 07 59 05 b3 05 00
E: 5.152188 7 01 07 59 05 b4 05 00
E: 5.160595 7 01 07 59 05 b6 05 00
E: 5.168166 7 01 07 59 05 b7 05 00
E: 5.176175 7 01 07 59 05 b9 05 00
E: 5.184089 7 01 07 59 05 ba 05 00
E: 5.192226 7 01 07 59 05 bd 05 00
E: 5.199220 7 01 07 59 05 c0 05 00
E: 5.207969 7 01 07 59 05 c2 05 00
E: 5.215189 7 01 07 59 05 c4 05 00
E: 5.224140 7 01 07 59 05 c7 05 00
E: 5.231237 7 01 07 59 05 cb 05 00
E: 5.240139 7 01 07 59 05 ce 05 00
E: 5.248048 7 01 07 59 05 d2 05 00
E: 5.256233 7 01 07 59 05 d7 05 00
E: 5.263188 7 01 07 59 05 db 05 00
E: 5.272105 7 01 07 59 05 e1 05 00
E: 5.279181 7 01 07 59 05 e6 05 00
E: 5.288102 7 01 07 59 05 eb 05 00
E: 5.295211 7 01 07 59 05 ef 05 00
E: 5.304168 7 01 07 59 05 f3 05 00
E: 5.311027 7 01 07 59 05 f7 05 00
E: 5.320218 7 01 07 59 05 fa 05 00
E: 5.328081 7 01 07 59 05 fc 05 00
E: 5.336178 7 01 07 59 05 fd 05 00
E: 5.344041 7 01 07 59 05 ff 05 00
E: 5.352076 7 01 07 59 05 01 06 00
E: 5.360113 7 01 07 5a 05 03 06 00
E: 5.367306 7 01 07 5b 05 04 06 00
E: 5.376079 7 01 07 5c 05 04 06 00
E: 5.383303 7 01 07 5d 05 06 06 00
E: 5.392173 7 01 07 5e 05 08 06 00
E: 5.399222 7 01 07 5f 05 0b 06 00
E: 5.408187 7 01 07 60 05 0d 06 00
E: 5.415202 7 01 07 61 05 12 06 00
E: 5.424112 7 01 07 62 05 15 06 00
E: 5.432052 7 01 07 63 05 18 06 00
E: 5.440124 7 01 07 65 05 1c 06 00
E: 5.448046 7 01 07 65 05 1f 06 00
E: 5.456100 7 01 07 65 05 22 06 00
E: 5.463208 7 01 07 66 05 28 06 00
E: 5.472107 7 01 07 66 05 2c 06 00
E: 5.479185 7 01 07 65 05 33 06 00
E: 5.488130 7 01 07 65 05 39 06 00
E: 5.495184 7 01 07 66 05 42 06 00
E: 5.504139 7 01 07 67 05 4a 06 00
E: 5.511026 7 01 07 67 05 51 06 00
E: 5.520159 7 01 07 67 05 5a 06 00
E: 5.528080 7 01 07 67 05 62 06 00
E: 5.536185 7 01 07 67 05 6a 06 00
E: 5.544033 7 01 07 68 05 71 06 00
E: 5.552084 7 01 07 69 05 77 06 00
E: 5.559941 7 01 07 6a 05 7e 06 00
E: 5.567375 7 01 07 6b 05 84 06 00
E: 5.576085 7 01 07 6b 05 88 06 00
E: 5.583308 7 01 07 6a 05 8c 06 00
E: 5.592068 7 01 07 6a 05 8f 06 00
E: 5.600088 7 01 07 6b 05 93 06 00
E: 5.608191 7 01 07 6b 05 94 06 00
E: 5.615244 7 01 07 6b 05 96 06 00
E: 5.624064 7 01 07 6b 05 98 06 00
E: 5.632100 7 01 07 6b 05 99 06 00
E: 5.640177 7 01 07 6a 05 9c 06 00
E: 5.648086 7 01 07 69 05 9d 06 00
E: 5.656132 7 01 07 67 05 9e 06 00
E: 5.663212 7 01 07 67 05 9f 06 00
E: 5.672199 7 01 07 67 05 a1 06 00
E: 5.679184 7 01 07 67 05 a1 06 00
E: 5.696216 7 01 07 66 05 a2 06 00
E: 5.703261 7 01 07 66 05 a3 06 00
E: 5.711220 7 01 07 65 05 a3 06 00
E: 5.720117 7 01 07 b1 08 08 08 03
E: 5.736728 7 01 07 65 05 a5 06 00
E: 5.743645 7 01 07 b1 08 08 08 03
E: 5.751959 7 01 07 63 05 a8 06 00
E: 5.759213 7 01 07 b1 08 08 08 03
E: 5.767875 7 01 07 62 05 ac 06 00
E: 5.776158 7 01 07 ae 08 e0 07 03
E: 5.783388 7 01 07 61 05 b0 06 00
E: 5.792061 7 01 07 ad 08 c7 07 03
E: 5.800102 7 01 07 60 05 b4 06 00
E: 5.808239 7 01 07 ac 08 af 07 03
E: 5.815213 7 01 07 5f 05 b9 06 00
E: 5.824115 7 01 07 aa 08 96 07 03
E: 5.831177 7 01 07 5e 05 bd 06 00
E: 5.847420 7 01 07 a8 08 7e 07 03
E: 5.855548 7 01 07 5c 05 c1 06 00
E: 5.864116 7 01 07 a5 08 65 07 03
E: 5.872086 7 01 07 5a 05 c5 06 00
E: 5.880173 7 01 07 a3 08 4d 07 03
E: 5.888215 7 01 07 58 05 c9 06 00
E: 5.896079 7 01 07 a0 08 34 07 03
E: 5.904076 7 01 07 55 05 cc 06 00
E: 5.911377 7 01 07 9d 08 1b 07 03
E: 5.920092 7 01 07 52 05 ce 06 00
E: 5.928048 7 01 07 9a 08 02 07 03
E: 5.936076 7 01 07 4f 05 cf 06 00
E: 5.943217 7 01 07 98 08 e8 06 03
E: 5.951243 7 01 07 4c 05 ce 06 00
E: 5.960554 7 01 07 95 08 cc 06 03
E: 5.976180 7 01 07 4a 05 ca 06 00
E: 5.983226 7 01 07 93 08 c7 06 03
E: 5.992656 7 01 07 48 05 c4 06 00
E: 6.000071 7 01 07 90 08 c0 06 03
E: 6.008104 7 01 07 46 05 bb 06 00
E: 6.015231 7 01 07 8c 08 b6 06 03
E: 6.024093 7 01 07 43 05 b1 06 00
E: 6.031711 7 01 07 89 08 ac 06 03
E: 6.039582 7 01 07 40 05 a6 06 00
E: 6.047854 7 01 07 86 08 a1 06 03
E: 6.056037 7 01 07 3e 05 9a 06 00
E: 6.063282 7 01 07 83 08 94 06 03
E: 6.072182 7 01 07 3c 05 8e 06 00
E: 6.079197 7 01 07 7f 08 87 06 03
E: 6.088082 7 01 07 3a 05 81 06 00
E: 6.096050 7 01 07 7b 08 7a 06 03
E: 6.111193 7 01 07 38 05 73 06 00
E: 6.120047 7 01 07 78 08 6d 06 03
E: 6.127538 7 01 07 36 05 66 06 00
E: 6.135542 7 01 07 75 08 60 06 03
E: 6.143653 7 01 07 35 05 5a 06 00
E: 6.151699 7 01 07 71 08 54 06 03
E: 6.159666 7 01 07 33 05 4e 06 00
E: 6.167568 7 01 07 6d 08 49 06 03
E: 6.176107 7 01 07 32 05 44 06 00
E: 6.183278 7 01 07 6a 08 40 06 03
E: 6.192526 7 01 07 30 05 3c 06 00
E: 6.200112 7 01 07 66 08 39 06 03
E: 6.208077 7 01 07 2f 05 36 06 00
E: 6.215360 7 01 07 63 08 33 06 03
E: 6.224097 7 01 07 2d 05 31 06 00
E: 6.231706 7 01 07 60 08 2f 06 03
E: 6.247287 7 01 07 2c 05 2d 06 00
E: 6.256136 7 01 07 5e 08 2c 06 03
E: 6.264182 7 01 07 2b 05 2b 06 00
E: 6.272081 7 01 07 5b 08 2a 06 03
E: 6.280183 7 01 07 2b 05 2a 06 00
E: 6.288080 7 01 07 5a 08 29 06 03
E: 6.295256 7 01 07 2b 05 29 06 00
E: 6.303961 7 01 07 5a 08 29 06 03
E: 6.312048 7 01 07 2b 05 2a 06 00
E: 6.320035 7 01 07 5a 08 2b 06 03
E: 6.327915 7 01 07 2b 05 2b 06 00
E: 6.336214 7 01 07 5a 08 2c 06 03
E: 6.343938 7 01 07 2c 05 2d 06 00
E: 6.351983 7 01 07 5b 08 2e 06 03
E: 6.360052 7 01 07 2d 05 2f 06 00
E: 6.367950 7 01 07 5b 08 30 06 03
E: 6.375930 7 01 07 2e 05 32 06 00
E: 6.383207 7 01 07 5c 08 34 06 03
E: 6.391618 7 01 07 2f 05 36 06 00
E: 6.407554 7 01 07 5d 08 38 06 03
E: 6.415400 7 01 07 2f 05 3a 06 00
E: 6.424216 7 01 07 5e 08 3c 06 03
E: 6.432074 7 01 07 30 05 3f 06 00
E: 6.440480 7 01 07 5f 08 42 06 03
E: 6.448153 7 01 07 31 05 45 06 00
E: 6.456082 7 01 07 5f 08 48 06 03
E: 6.464179 7 01 07 32 05 4b 06 00
E: 6.471998 7 01 07 60 08 4e 06 03
E: 6.479840 7 01 07 33 05 51 06 00
E: 6.488206 7 01 07 60 08 55 06 03
E: 6.496193 7 01 07 34 05 58 06 00
E: 6.503184 7 01 07 60 08 5c 06 03
E: 6.511454 7 01 07 35 05 5f 06 00
E: 6.520607 7 01 07 5f 08 63 06 03
E: 6.536141 7 01 07 37 05 66 06 00
E: 6.543894 7 01 07 5d 08 69 06 03
E: 6.552151 7 01 07 38 05 6d 06 00
E: 6.560549 7 01 07 5c 08 70 06 03
E: 6.568113 7 01 07 39 05 73 06 00
E: 6.576082 7 01 07 5c 08 76 06 03
E: 6.583343 7 01 07 3a 05 79 06 00
E: 6.591937 7 01 07 5a 08 7c 06 03
E: 6.600097 7 01 07 3b 05 7e 06 00
E: 6.608312 7 01 07 58 08 81 06 03
E: 6.616113 7 01 07 3b 05 84 06 00
E: 6.624121 7 01 07 57 08 87 06 03
E: 6.632236 7 01 07 3c 05 8a 06 00
E: 6.640233 7 01 07 55 08 8e 06 03
E: 6.647206 7 01 07 3d 05 91 06 00
E: 6.656509 7 01 04 54 08 91 06 03
E: 6.664191 7 01 07 3f 05 9c 06 00
E: 6.680208 7 01 07 40 05 a5 06 00
E: 6.687968 7 01 07 42 05 b1 06 00
E: 6.695203 7 01 07 43 05 b8 06 00
E: 6.704561 7 01 07 43 05 bd 06 00
E: 6.711246 7 01 07 44 05 c4 06 00
E: 6.719267 7 01 07 45 05 c9 06 00
E: 6.735277 7 01 07 46 05 cf 06 00
E: 6.744641 7 01 07 48 05 d5 06 00
E: 6.752247 7 01 07 49 05 d6 06 00
E: 6.760221 7 01 07 4a 05 d6 06 00
E: 6.767241 7 01 07 4a 05 d7 06 00
E: 6.776149 7 01 07 4b 05 d7 06 00
E: 6.784110 7 01 07 4c 05 d7 06 00
E: 6.792195 7 01 07 4d 05 d7 06 00
E: 6.799241 7 01 07 4d 05 d7 06 00
E: 6.816235 7 01 07 4d 05 d7 06 00
E: 6.824116 7 01 07 4e 05 d7 06 00
E: 6.831248 7 01 07 4f 05 d7 06 00
E: 6.839100 7 01 07 4f 05 d6 06 00
E: 6.848261 7 01 07 50 05 d6 06 00
E: 6.856009 7 01 07 50 05 d6 06 00
E: 6.864009 7 01 07 50 05 d6 06 00
E: 6.872065 7 01 07 50 05 d6 06 00
E: 6.880000 7 01 07 50 05 d6 06 00
E: 6.887992 7 01 07 50 05 d6 06 00
E: 6.903864 7 01 07 50 05 d6 06 00
E: 6.911850 7 01 07 50 05 d6 06 00
E: 6.919858 7 01 07 50 05 d6 06 00
E: 6.927825 7 01 07 50 05 d6 06 00
E: 6.943267 7 01 07 50 05 d6 06 00
E: 6.951855 7 01 07 50 05 d6 06 00
E: 6.959945 7 01 07 5b 05 bf 06 00
E: 6.968534 7 01 07 5d 05 bd 06 00
E: 6.984144 7 01 07 5e 05 bb 06 00
E: 6.991953 7 01 07 61 05 b8 06 00
E: 6.999340 7 01 07 62 05 b7 06 00
E: 7.007992 7 01 07 63 05 b6 06 00
E: 7.016136 7 01 07 65 05 b6 06 00
E: 7.023885 7 01 07 65 05 b6 06 00
E: 7.040151 7 01 07 65 05 b5 06 00
E: 7.047286 7 01 07 64 05 b5 06 00
E: 7.056008 7 01 07 64 05 b5 06 00
E: 7.064138 7 01 07 63 05 b5 06 00
E: 7.071937 7 01 07 63 05 b5 06 00
E: 7.080378 7 01 07 63 05 b5 06 00
E: 7.087998 7 01 07 63 05 b5 06 00
E: 7.095286 7 01 07 63 05 b5 06 00
E: 7.104045 7 01 07 63 05 b5 06 00
E: 7.119888 7 01 07 63 05 b5 06 00
E: 7.127854 7 01 07 63 05 b5 06 00
E: 7.135847 7 01 07 63 05 b5 06 00
E: 7.143848 7 01 07 63 05 b5 06 00
E: 7.152025 7 01 07 a8 07 0b 08 03
E: 7.159898 7 01 07 63 05 b5 06 00
E: 7.167855 7 01 07 a8 07 0b 08 03
E: 7.175858 7 01 07 63 05 b5 06 00
E: 7.183856 7 01 07 a8 07 0b 08 03
E: 7.191846 7 01 07 63 05 b5 06 00
E: 7.199881 7 01 07 a8 07 0b 08 03
E: 7.207857 7 01 07 63 05 b5 06 00
E: 7.223888 7 01 07 a8 07 0b 08 03
E: 7.231853 7 01 07 63 05 b5 06 00
E: 7.239859 7 01 07 a8 07 0b 08 03
E: 7.247855 7 01 07 63 05 b5 06 00
E: 7.255854 7 01 07 a8 07 0b 08 03
E: 7.263856 7 01 07 63 05 b5 06 00
E: 7.271859 7 01 07 a8 07 0b 08 03
E: 7.279855 7 01 07 63 05 b5 06 00
E: 7.287853 7 01 07 a8 07 0b 08 03
E: 7.295853 7 01 07 63 05 b5 06 00
E: 7.303859 7 01 07 a8 07 0b 08 03
E: 7.311886 7 01 07 63 05 b5 06 00
E: 7.319855 7 01 07 a8 07 0b 08 03
E: 7.335861 7 01 07 63 05 b5 06 00
E: 7.343849 7 01 07 a8 07 0b 08 03
E: 7.351857 7 01 07 63 05 b5 06 00
E: 7.359865 7 01 07 a8 07 0b 08 03
E: 7.367816 7 01 07 63 05 b5 06 00
E: 7.375857 7 01 07 a8 07 0b 08 03
E: 7.383907 7 01 07 63 05 b5 06 00
E: 7.391936 7 01 07 a8 07 0b 08 03
E: 7.400046 7 01 07 63 05 b5 06 00
E: 7.407363 7 01 07 a8 07 0b 08 03
E: 7.415539 7 01 07 63 05 b5 06 00
E: 7.423868 7 01 07 a8 07 0b 08 03
E: 7.431516 7 01 07 63 05 b5 06 00
E: 7.439938 7 01 07 a7 07 f4 07 03
E: 7.447550 7 01 07 63 05 b5 06 00
E: 7.455595 7 01 07 a7 07 db 07 03
E: 7.463516 7 01 07 63 05 b5 06 00
E: 7.471916 7 01 07 a7 07 c1 07 03
E: 7.479517 7 01 07 63 05 b5 06 00
E: 7.487561 7 01 07 a6 07 a8 07 03
E: 7.495521 7 01 07 63 05 b5 06 00
E: 7.503556 7 01 07 a6 07 8f 07 03
E: 7.511513 7 01 07 63 05 b5 06 00
E: 7.519919 7 01 07 a5 07 76 07 03
E: 7.527520 7 01 07 63 05 b5 06 00
E: 7.535930 7 01 07 a6 07 5e 07 03
E: 7.543553 7 01 07 5e 05 cd 06 00
E: 7.559876 7 01 07 a6 07 46 07 03
E: 7.567595 7 01 07 5c 05 cf 06 00
E: 7.575936 7 01 07 a5 07 2d 07 03
E: 7.583373 7 01 07 5b 05 d1 06 00
E: 7.592122 7 01 07 a5 07 16 07 03
E: 7.600164 7 01 07 59 05 d3 06 00
E: 7.608243 7 01 07 a5 07 fe 06 03
E: 7.615961 7 01 07 58 05 d4 06 00
E: 7.624475 7 01 07 a6 07 e7 06 03
E: 7.632071 7 01 07 57 05 d5 06 00
E: 7.640134 7 01 07 a8 07 d5 06 03
E: 7.648125 7 01 07 56 05 d5 06 00
E: 7.656040 7 01 07 ab 07 d5 06 03
E: 7.663931 7 01 07 55 05 d5 06 00
E: 7.672093 7 01 07 ae 07 d4 06 03
E: 7.680070 7 01 07 53 05 d2 06 00
E: 7.688704 7 01 07 b3 07 d0 06 03
E: 7.695196 7 01 07 51 05 cc 06 00
E: 7.703446 7 01 07 b8 07 c9 06 03
E: 7.711227 7 01 07 4e 05 c5 06 00
E: 7.720579 7 01 07 bc 07 c0 06 03
E: 7.728105 7 01 07 4b 05 bb 06 00
E: 7.736292 7 01 07 be 07 b8 06 03
E: 7.744055 7 01 07 4a 05 b3 06 00
E: 7.752114 7 01 07 c0 07 ad 06 03
E: 7.760525 7 01 07 47 05 a7 06 00
E: 7.768241 7 01 07 c2 07 a1 06 03
E: 7.776205 7 01 07 43 05 9b 06 00
E: 7.784207 7 01 07 c2 07 94 06 03
E: 7.799277 7 01 07 40 05 8e 06 00
E: 7.807255 7 01 07 c3 07 87 06 03
E: 7.816277 7 01 07 3d 05 80 06 00
E: 7.824134 7 01 07 c3 07 78 06 03
E: 7.832241 7 01 07 3a 05 71 06 00
E: 7.840202 7 01 07 c1 07 69 06 03
E: 7.847271 7 01 07 37 05 62 06 00
E: 7.856096 7 01 07 be 07 5a 06 03
E: 7.864202 7 01 07 34 05 53 06 00
E: 7.871309 7 01 07 ba 07 4c 06 03
E: 7.880198 7 01 07 31 05 45 06 00
E: 7.888213 7 01 07 b4 07 40 06 03
E: 7.895559 7 01 07 30 05 3a 06 00
E: 7.904170 7 01 07 af 07 35 06 03
E: 7.912179 7 01 07 2e 05 31 06 00
E: 7.920100 7 01 07 ab 07 2e 06 03
E: 7.927267 7 01 07 2c 05 2b 06 00
E: 7.936131 7 01 07 a7 07 28 06 03
E: 7.944057 7 01 07 2b 05 25 06 00
E: 7.952137 7 01 07 a3 07 23 06 03
E: 7.959962 7 01 07 2b 05 22 06 00
E: 7.967292 7 01 07 a0 07 21 06 03
E: 7.976244 7 01 07 2b 05 20 06 00
E: 7.984122 7 01 07 9f 07 1f 06 03
E: 7.992096 7 01 07 2b 05 1f 06 00
E: 8.000128 7 01 07 9f 07 1e 06 03
E: 8.008140 7 01 07 2b 05 1e 06 00
E: 8.016048 7 01 07 9f 07 1e 06 03
E: 8.024049 7 01 07 2b 05 1e 06 00
E: 8.040142 7 01 07 a0 07 1e 06 03
E: 8.047857 7 01 07 2b 05 1e 06 00
E: 8.055934 7 01 07 a1 07 1f 06 03
E: 8.063933 7 01 07 2c 05 1f 06 00
E: 8.072019 7 01 07 a2 07 1f 06 03
E: 8.079931 7 01 07 2d 05 20 06 00
E: 8.088238 7 01 07 a3 07 20 06 03
E: 8.095933 7 01 07 2e 05 20 06 00
E: 8.103311 7 01 07 a4 07 21 06 03
E: 8.112108 7 01 07 2f 05 21 06 00
E: 8.120048 7 01 07 a4 07 21 06 03
E: 8.128426 7 01 07 31 05 22 06 00
E: 8.136221 7 01 07 a5 07 22 06 03
E: 8.144075 7 01 07 32 05 23 06 00
E: 8.152145 7 01 07 a7 07 23 06 03
E: 8.159969 7 01 07 32 05 24 06 00
E: 8.168113 7 01 07 a8 07 23 06 03
E: 8.176223 7 01 07 33 05 24 06 00
E: 8.184096 7 01 07 a9 07 24 06 03
E: 8.191893 7 01 07 33 05 24 06 00
E: 8.200101 7 01 07 a8 07 24 06 03
E: 8.207931 7 01 07 32 05 24 06 00
E: 8.216033 7 01 07 a8 07 24 06 03
E: 8.223896 7 01 07 32 05 24 06 00
E: 8.231933 7 01 07 a7 07 24 06 03
E: 8.239862 7 01 07 32 05 24 06 00
E: 8.247863 7 01 07 a7 07 24 06 03
E: 8.255865 7 01 07 32 05 24 06 00
E: 8.263860 7 01 07 a7 07 24 06 03
E: 8.271860 7 01 07 32 05 24 06 00
E: 8.279863 7 01 07 a7 07 24 06 03
E: 8.287862 7 01 07 32 05 24 06 00
E: 8.295863 7 01 07 a7 07 24 06 03
E: 8.303862 7 01 07 32 05 24 06 00
E: 8.319864 7 01 07 a7 07 24 06 03
E: 8.327859 7 01 07 32 05 24 06 00
E: 8.335864 7 01 07 a7 07 24 06 03
E: 8.343922 7 01 04 32 05 24 06 00
E: 8.360603 7 01 07 a7 07 24 06 03
E: 8.375237 7 01 07 a7 07 24 06 03
E: 8.383646 7 01 07 b9 07 13 06 03
E: 8.391948 7 01 07 bc 07 0e 06 03
E: 8.399595 7 01 07 bf 07 0b 06 03
E: 8.407857 7 01 07 c2 07 07 06 03
E: 8.415569 7 01 07 c5 07 04 06 03
E: 8.431563 7 01 07 c7 07 02 06 03
E: 8.439939 7 01 07 ca 07 01 06 03
E: 8.447563 7 01 07 cc 07 01 06 03
E: 8.455981 7 01 07 cd 07 00 06 03
E: 8.471564 7 01 07 cf 07 ff 05 03
E: 8.479563 7 01 07 d4 07 fe 05 03
E: 8.487945 7 01 07 d5 07 fe 05 03
E: 8.495566 7 01 07 d6 07 fe 05 03
E: 8.503936 7 01 07 d7 07 fe 05 03
E: 8.511563 7 01 07 d9 07 fe 05 03
E: 8.527565 7 01 07 da 07 fe 05 03
E: 8.535938 7 01 07 de 07 fe 05 03
E: 8.543558 7 01 07 e0 07 fe 05 03
E: 8.559952 7 01 07 e1 07 fe 05 03
E: 8.567565 7 01 07 e3 07 fe 05 03
E: 8.575934 7 01 07 e4 07 fe 05 03
E: 8.583564 7 01 07 e6 07 fd 05 03
E: 8.591934 7 01 07 e7 07 fd 05 03
E: 8.599970 7 01 07 e8 07 fd 05 03
E: 8.615968 7 01 07 e9 07 fd 05 03
E: 8.631863 7 01 07 e9 07 fd 05 03
E: 8.639863 7 01 07 e9 07 fd 05 03
E: 8.647863 7 01 07 e9 07 fd 05 03
E: 8.655872 7 01 07 e9 07 fd 05 03
E: 8.671863 7 01 07 e9 07 fd 05 03
E: 8.687864 7 01 07 e9 07 fd 05 03
E: 8.695831 7 01 07 e9 07 fd 05 03
E: 8.703867 7 01 07 e9 07 fd 05 03
E: 8.711867 7 01 07 e9 07 fd 05 03
E: 8.719865 7 01 07 e9 07 fd 05 03
E: 8.727857 7 01 07 e9 07 fd 05 03
E: 8.735866 7 01 07 e9 07 fd 05 03
E: 8.743855 7 01 07 e9 07 fd 05 03
E: 8.759888 7 01 07 e9 07 fd 05 03
E: 8.767866 7 01 07 e9 07 fd 05 03
E: 8.775868 7 01 07 e9 07 fd 05 03
E: 8.783865 7 01 07 e9 07 fd 05 03
E: 8.791865 7 01 07 e9 07 fd 05 03
E: 8.807839 7 01 07 e9 07 fd 05 03
E: 8.815859 7 01 07 e9 07 fd 05 03
E: 8.823864 7 01 07 e9 07 fd 05 03
E: 8.831863 7 01 07 e9 07 fd 05 03
E: 8.847864 7 01 07 e9 07 fd 05 03
E: 8.855873 7 01 07 e9 07 fd 05 03
E: 8.863865 7 01 07 e9 07 fd 05 03
E: 8.871866 7 01 07 e9 07 fd 05 03
E: 8.887867 7 01 07 e9 07 fd 05 03
E: 8.895863 7 01 07 e9 07 fd 05 03
E: 8.903867 7 01 07 e9 07 fd 05 03
E: 8.911866 7 01 07 e9 07 fd 05 03
E: 8.919863 7 01 07 e9 07 fd 05 03
E: 8.927892 7 01 07 e9 07 fd 05 03
E: 8.935867 7 01 07 e9 07 fd 05 03
E: 8.951377 7 01 07 e9 07 fd 05 03
E: 8.959910 7 01 07 e9 07 fd 05 03
E: 8.968058 7 01 07 e9 07 fd 05 03
E: 8.976055 7 01 07 e9 07 fd 05 03
E: 8.984060 7 01 07 e9 07 fd 05 03
E: 8.992059 7 01 07 e9 07 fd 05 03
E: 9.000058 7 01 07 e9 07 fd 05 03
E: 9.008058 7 01 07 e9 07 fd 05 03
E: 9.016018 7 01 07 e9 07 fd 05 03
E: 9.023866 7 01 07 e9 07 fd 05 03
E: 9.039869 7 01 07 e9 07 fd 05 03
E: 9.047953 7 01 04 e9 07 fd 05 03
# 3. Finally, move your ten fingers on the screen and release them.
E: 14.215424 7 01 07 01 08 e0 06 00
E: 14.223295 7 01 07 01 08 e0 06 00
E: 14.232082 7 01 07 01 08 e0 06 00
E: 14.239608 7 01 07 01 08 e0 06 00
E: 14.247908 7 01 07 01 08 e0 06 00
E: 14.255907 7 01 07 01 08 e0 06 00
E: 14.271907 7 01 07 01 08 e0 06 00
E: 14.279906 7 01 07 01 08 e0 06 00
E: 14.287576 7 01 07 01 08 e0 06 00
E: 14.295906 7 01 07 01 08 e0 06 00
E: 14.303624 7 01 07 c6 07 34 01 01
E: 14.312019 7 01 07 1e 08 e1 06 00
E: 14.327384 7 01 07 8f 07 35 01 01
E: 14.335654 7 01 07 2b 08 e1 06 00
E: 14.344213 7 01 07 56 07 35 01 01
E: 14.352185 7 01 07 38 08 e1 06 00
E: 14.360190 7 01 07 19 07 37 01 01
E: 14.368184 7 01 07 48 08 e0 06 00
E: 14.384186 7 01 07 da 06 39 01 01
E: 14.392177 7 01 07 58 08 e0 06 00
E: 14.400144 7 01 07 94 06 3d 01 01
E: 14.408014 7 01 07 6a 08 df 06 00
E: 14.424213 7 01 07 4a 06 41 01 01
E: 14.431243 7 01 07 7c 08 de 06 00
E: 14.439694 7 01 07 fe 05 47 01 01
E: 14.447649 7 01 07 8f 08 de 06 00
E: 14.464136 7 01 07 b2 05 4d 01 01
E: 14.472194 7 01 07 a1 08 dd 06 00
E: 14.479985 7 01 07 64 05 54 01 01
E: 14.488022 7 01 07 b4 08 dc 06 00
E: 14.495980 7 01 07 12 05 5d 01 01
E: 14.503983 7 01 07 c1 08 da 06 00
E: 14.519983 7 01 07 e5 04 66 01 01
E: 14.528151 7 01 07 cc 08 d9 06 00
E: 14.536023 7 01 07 c3 04 70 01 01
E: 14.544158 7 01 07 d5 08 d8 06 00
E: 14.552236 7 01 07 9e 04 7b 01 01
E: 14.567984 7 01 07 dc 08 d7 06 00
E: 14.575986 7 01 07 79 04 86 01 01
E: 14.583982 7 01 07 e1 08 d5 06 00
E: 14.591982 7 01 07 55 04 91 01 01
E: 14.599983 7 01 07 e4 08 d0 06 00
E: 14.615986 7 01 07 33 04 9c 01 01
E: 14.623986 7 01 07 e5 08 c8 06 00
E: 14.631956 7 01 07 16 04 a5 01 01
E: 14.639982 7 01 07 e6 08 bc 06 00
E: 14.648015 7 01 07 fd 03 ae 01 01
E: 14.655983 7 01 07 e3 08 ae 06 00
E: 14.671984 7 01 07 e8 03 b6 01 01
E: 14.679981 7 01 07 e0 08 9d 06 00
E: 14.687390 7 01 07 d2 03 be 01 01
E: 14.696201 7 01 07 da 08 8a 06 00
E: 14.704511 7 01 07 bd 03 c5 01 01
E: 14.720016 7 01 07 d4 08 76 06 00
E: 14.727974 7 01 07 aa 03 cb 01 01
E: 14.735980 7 01 07 cd 08 61 06 00
E: 14.743991 7 01 07 9b 03 d0 01 01
E: 14.752188 7 01 07 c5 08 4a 06 00
E: 14.768241 7 01 07 8f 03 d5 01 01
E: 14.776024 7 01 07 bc 08 33 06 00
E: 14.784188 7 01 07 87 03 d9 01 01
E: 14.792019 7 01 07 b2 08 1c 06 00
E: 14.799985 7 01 07 81 03 dc 01 01
E: 14.808020 7 01 07 a7 08 04 06 00
E: 14.823985 7 01 07 7c 03 df 01 01
E: 14.832113 7 01 07 9c 08 e7 05 00
E: 14.839385 7 01 07 78 03 e2 01 01
E: 14.847352 7 01 07 91 08 c8 05 00
E: 14.856024 7 01 07 75 03 23 02 01
E: 14.863987 7 01 07 85 08 aa 05 00
E: 14.871363 7 01 07 73 03 8b 02 01
E: 14.880143 7 01 07 79 08 8c 05 00
E: 14.888194 7 01 07 72 03 1b 03 01
E: 14.895982 7 01 07 6d 08 70 05 00
E: 14.903987 7 01 07 70 03 a8 03 01
E: 14.919987 7 01 07 60 08 54 05 00
E: 14.928257 7 01 07 6f 03 32 04 01
E: 14.936191 7 01 07 53 08 38 05 00
E: 14.944204 7 01 07 6e 03 b9 04 01
E: 14.952192 7 01 07 49 08 24 05 00
E: 14.960016 7 01 07 6e 03 1b 05 01
E: 14.967983 7 01 07 3d 08 03 05 00
E: 14.975340 7 01 07 6d 03 9c 05 01
E: 14.984154 7 01 07 31 08 df 04 00
E: 15.000016 7 01 07 6d 03 1a 06 01
E: 15.007991 7 01 07 27 08 b9 04 00
E: 15.016247 7 01 07 6d 03 97 06 01
E: 15.024149 7 01 07 1e 08 92 04 00
E: 15.032227 7 01 07 6c 03 13 07 01
E: 15.040143 7 01 07 15 08 6d 04 00
E: 15.048000 7 01 07 6c 03 8e 07 01
E: 15.055987 7 01 07 0c 08 4f 04 00
E: 15.063303 7 01 07 6c 03 f7 07 01
E: 15.080183 7 01 07 05 08 35 04 00
E: 15.088020 7 01 07 6b 03 32 08 01
E: 15.095987 7 01 07 fd 07 1e 04 00
E: 15.104028 7 01 07 6a 03 2d 08 01
E: 15.111986 7 01 07 f7 07 09 04 00
E: 15.119393 7 01 07 6a 03 13 08 01
E: 15.127408 7 01 07 f3 07 f4 03 00
E: 15.136352 7 01 07 69 03 fa 07 01
E: 15.143451 7 01 07 f0 07 e2 03 00
E: 15.151999 7 01 07 68 03 e3 07 01
E: 15.167989 7 01 07 ef 07 cf 03 00
E: 15.175993 7 01 07 66 03 cf 07 01
E: 15.183987 7 01 07 ee 07 c1 03 00
E: 15.191658 7 01 07 64 03 be 07 01
E: 15.199683 7 01 07 ed 07 ba 03 00
E: 15.207997 7 01 07 63 03 af 07 01
E: 15.215616 7 01 07 ec 07 b5 03 00
E: 15.224018 7 01 07 61 03 a2 07 01
E: 15.231648 7 01 07 ec 07 b2 03 00
E: 15.239997 7 01 07 60 03 98 07 01
E: 15.255619 7 01 07 ec 07 b0 03 00
E: 15.271616 7 01 07 5d 03 78 07 01
E: 15.279616 7 01 07 ed 07 ae 03 00
E: 15.287990 7 01 07 5a 03 39 07 01
E: 15.295617 7 01 07 ee 07 ac 03 00
E: 15.303987 7 01 07 57 03 12 07 01
E: 15.311616 7 01 04 ee 07 ac 03 00
E: 15.320277 7 01 07 4b 03 c2 06 01
E: 15.336022 7 01 07 40 03 87 06 01
E: 15.343995 7 01 07 38 03 5f 06 01
E: 15.351991 7 01 07 2e 03 38 06 01
E: 15.359989 7 01 07 24 03 11 06 01
E: 15.367989 7 01 07 1a 03 ea 05 01
E: 15.375986 7 01 07 0f 03 c2 05 01
E: 15.392155 7 01 07 04 03 9b 05 01
E: 15.400072 7 01 07 f9 02 74 05 01
E: 15.407987 7 01 07 69 08 48 08 03
E: 15.415251 7 01 07 e3 02 27 05 01
E: 15.424152 7 01 07 70 08 22 08 03
E: 15.431987 7 01 07 ce 02 1a 05 01
E: 15.440018 7 01 07 76 08 d6 07 03
E: 15.456019 7 01 07 b2 02 41 05 01
E: 15.471991 7 01 07 82 08 44 07 03
E: 15.488200 7 01 07 7c 02 c2 05 01
E: 15.495987 7 01 07 8e 08 c9 06 03
E: 15.504900 7 01 07 68 02 09 06 01
E: 15.511655 7 01 07 96 08 84 06 03
E: 15.519657 7 01 07 59 02 66 06 01
E: 15.527644 7 01 07 9e 08 41 06 03
E: 15.536001 7 01 07 4f 02 dc 06 01
E: 15.543635 7 01 07 a6 08 02 06 03
E: 15.551618 7 01 07 4a 02 55 07 01
E: 15.567618 7 01 07 ae 08 c7 05 03
E: 15.576015 7 01 07 48 02 d2 07 01
E: 15.583623 7 01 07 b6 08 8d 05 03
E: 15.591622 7 01 07 48 02 54 08 01
E: 15.599619 7 01 07 ba 08 52 05 03
E: 15.607619 7 01 07 49 02 d8 08 01
E: 15.615618 7 01 07 bd 08 14 05 03
E: 15.631656 7 01 07 4a 02 58 09 01
E: 15.640006 7 01 07 bd 08 21 05 03
E: 15.647620 7 01 07 4a 02 86 09 01
E: 15.655990 7 01 07 bc 08 38 05 03
E: 15.663623 7 01 07 4b 02 9f 09 01
E: 15.671989 7 01 07 b7 08 4f 05 03
E: 15.679618 7 01 07 4c 02 b8 09 01
E: 15.687989 7 01 07 af 08 6c 05 03
E: 15.695620 7 01 07 4d 02 d7 09 01
E: 15.703993 7 01 07 a4 08 83 05 03
E: 15.711622 7 01 07 4f 02 ee 09 01
E: 15.720144 7 01 07 98 08 9b 05 03
E: 15.736078 7 01 07 52 02 02 0a 01
E: 15.743995 7 01 07 89 08 b4 05 03
E: 15.752020 7 01 07 57 02 16 0a 01
E: 15.759990 7 01 07 79 08 cc 05 03
E: 15.767993 7 01 07 63 02 2c 0a 01
E: 15.775994 7 01 07 64 08 e9 05 03
E: 15.783992 7 01 07 6f 02 3b 0a 01
E: 15.792012 7 01 07 53 08 ff 05 03
E: 15.808027 7 01 07 7f 02 48 0a 01
E: 15.815990 7 01 07 43 08 15 06 03
E: 15.824200 7 01 07 91 02 53 0a 01
E: 15.832153 7 01 07 32 08 2b 06 03
E: 15.840179 7 01 07 a5 02 5c 0a 01
E: 15.848048 7 01 07 22 08 42 06 03
E: 15.863992 7 01 07 ba 02 64 0a 01
E: 15.871997 7 01 07 12 08 58 06 03
E: 15.879988 7 01 07 cf 02 6c 0a 01
E: 15.887993 7 01 07 03 08 6f 06 03
E: 15.895982 7 01 07 e5 02 74 0a 01
E: 15.904197 7 01 07 f5 07 83 06 03
E: 15.912197 7 01 07 fc 02 7a 0a 01
E: 15.928196 7 01 07 e8 07 97 06 03
E: 15.936028 7 01 07 12 03 81 0a 01
E: 15.944002 7 01 07 da 07 a9 06 03
E: 15.951990 7 01 07 27 03 86 0a 01
E: 15.959988 7 01 07 cd 07 b9 06 03
E: 15.967995 7 01 07 3f 03 8a 0a 01
E: 15.975992 7 01 07 bf 07 c7 06 03
E: 15.983991 7 01 07 57 03 8c 0a 01
E: 15.999991 7 01 07 af 07 d2 06 03
E: 16.007994 7 01 07 71 03 8d 0a 01
E: 16.015992 7 01 07 a0 07 da 06 03
E: 16.023992 7 01 07 8a 03 8b 0a 01
E: 16.032196 7 01 07 95 07 de 06 03
E: 16.040197 7 01 07 9d 03 89 0a 01
E: 16.047995 7 01 07 86 07 e1 06 03
E: 16.055992 7 01 07 b5 03 84 0a 01
E: 16.063992 7 01 07 78 07 e1 06 03
E: 16.071997 7 01 07 cc 03 7e 0a 01
E: 16.079992 7 01 07 6a 07 dd 06 03
E: 16.088012 7 01 07 e3 03 76 0a 01
E: 16.103995 7 01 07 5d 07 d7 06 03
E: 16.111993 7 01 07 f8 03 6c 0a 01
E: 16.119995 7 01 07 51 07 cd 06 03
E: 16.128178 7 01 07 0d 04 5e 0a 01
E: 16.136025 7 01 07 47 07 bf 06 03
E: 16.144034 7 01 07 22 04 4c 0a 01
E: 16.152030 7 01 07 3f 07 b0 06 03
E: 16.159998 7 01 07 37 04 36 0a 01
E: 16.167994 7 01 07 3a 07 9e 06 03
E: 16.183997 7 01 07 4b 04 1e 0a 01
E: 16.191994 7 01 07 38 07 8b 06 03
E: 16.199994 7 01 07 5a 04 04 0a 01
E: 16.207948 7 01 07 38 07 76 06 03
E: 16.215990 7 01 07 64 04 ea 09 01
E: 16.224092 7 01 07 3a 07 5e 06 03
E: 16.232199 7 01 07 6b 04 d1 09 01
E: 16.240006 7 01 07 3d 07 46 06 03
E: 16.247993 7 01 07 6e 04 b7 09 01
E: 16.263997 7 01 07 40 07 2f 06 03
E: 16.271996 7 01 07 6f 04 a0 09 01
E: 16.279993 7 01 07 45 07 18 06 03
E: 16.287994 7 01 07 6f 04 89 09 01
E: 16.295991 7 01 07 4b 07 02 06 03
E: 16.303993 7 01 07 6f 04 72 09 01
E: 16.320020 7 01 07 51 07 ed 05 03
E: 16.328294 7 01 07 6f 04 5c 09 01
E: 16.336188 7 01 07 57 07 d9 05 03
E: 16.344388 7 01 07 6e 04 4a 09 01
E: 16.352200 7 01 07 5f 07 c7 05 03
E: 16.360200 7 01 07 6e 04 3c 09 01
E: 16.368202 7 01 07 66 07 b6 05 03
E: 16.376028 7 01 07 6d 04 32 09 01
E: 16.391996 7 01 07 6e 07 a6 05 03
E: 16.399994 7 01 07 6b 04 2b 09 01
E: 16.407985 7 01 07 74 07 97 05 03
E: 16.415993 7 01 07 69 04 26 09 01
E: 16.424000 7 01 07 79 07 8a 05 03
E: 16.431994 7 01 07 67 04 23 09 01
E: 16.440201 7 01 07 7e 07 7e 05 03
E: 16.448185 7 01 07 66 04 20 09 01
E: 16.463995 7 01 07 82 07 74 05 03
E: 16.471997 7 01 07 64 04 1d 09 01
E: 16.479995 7 01 07 87 07 6c 05 03
E: 16.488003 7 01 07 63 04 1b 09 01
E: 16.495995 7 01 07 8a 07 64 05 03
E: 16.503997 7 01 07 60 04 1a 09 01
E: 16.511995 7 01 07 8d 07 5d 05 03
E: 16.519995 7 01 07 5e 04 19 09 01
E: 16.528191 7 01 07 90 07 57 05 03
E: 16.544011 7 01 07 5c 04 19 09 01
E: 16.552007 7 01 07 92 07 54 05 03
E: 16.559997 7 01 07 59 04 18 09 01
E: 16.567997 7 01 07 93 07 52 05 03
E: 16.575996 7 01 07 57 04 18 09 01
E: 16.583998 7 01 07 94 07 51 05 03
E: 16.592001 7 01 07 50 04 18 09 01
E: 16.600020 7 01 07 95 07 4e 05 03
E: 16.607996 7 01 07 45 04 18 09 01
E: 16.615994 7 01 07 95 07 49 05 03
E: 16.623993 7 01 04 39 04 18 09 01
E: 16.631999 7 01 07 96 07 45 05 03
E: 16.639999 7 01 07 96 07 42 05 03
E: 16.648239 7 01 07 93 07 39 05 03
E: 16.656017 7 01 04 93 07 39 05 03
E: 16.687921 7 01 04 69 07 5b 01 00
# Thank you.
