# 050:0 -> 056A:00F4 / Tablet | Cintiq 24HD Tablet
D:0
R: 211 05 01 09 02 a1 01 85 01 09 01 a1 00 05 09 19 01 29 03 15 00 25 01 95 03 75 01 81 02 95 05 81 03 05 01 09 30 09 31 09 38 15 81 25 7f 75 08 95 03 81 06 c0 c0 05 0d 09 01 a1 01 85 02 09 00 75 08 96 09 00 15 00 26 ff 00 81 02 85 0c 09 00 75 08 96 09 00 15 00 26 ff 00 81 02 85 02 09 00 95 01 b1 02 85 03 09 00 95 01 b1 02 85 05 09 00 95 08 b1 02 85 07 09 00 95 06 b1 02 85 08 09 00 95 04 b1 02 85 0a 09 00 95 02 b1 02 85 0b 09 00 95 01 b1 02 85 10 09 00 95 05 b1 02 85 20 09 00 95 08 b1 02 85 04 09 00 95 01 b1 02 85 0d 09 00 95 01 b1 02 85 11 09 00 95 01 b1 02 85 12 09 00 95 02 b1 02 85 30 09 00 95 01 b1 02 85 cc 09 00 95 02 b1 02 c0
N: Tablet Cintiq 24HD Tablet
P: usb-0000:00:14.0-6.0/input0
I: 3 056A 00F4
# SET_REPORT (Feature) ID: 20 -> 20 44 00 00 00 00 00 00 00 (length 9)
# SET_REPORT (Feature) ID: 02 -> 02 02 (length 2)
# SET_REPORT (Feature) ID: 20 -> 20 44 00 00 00 00 00 00 00 (length 9)
# SET_REPORT (Feature) ID: 20 -> 20 44 00 00 00 00 00 00 00 (length 9)
# SET_REPORT (Feature) ID: 20 -> 20 44 00 00 00 00 00 00 00 (length 9)
# SET_REPORT (Feature) ID: 20 -> 20 44 00 00 00 00 00 00 00 (length 9)
# SET_REPORT (Feature) ID: 20 -> 20 44 00 00 00 00 00 00 00 (length 9)
# SET_REPORT (Feature) ID: 20 -> 20 44 00 00 00 00 00 00 00 (length 9)
E: 0.000000 10 02 c2 80 42 48 0d e2 11 00 00
E: 0.010999 10 02 ea 6a 47 2e 3e 90 c0 00 d5
E: 0.018931 10 02 e2 6a 14 2e 23 00 2c c9 d6
E: 0.029931 10 02 ea 69 d4 2e 14 90 c0 00 d9
E: 0.036926 10 02 e2 69 c6 2e 10 00 2e ca d9
E: 0.048996 10 02 ea 69 bc 2e 33 90 40 00 db
E: 0.055999 10 02 e2 69 a3 2e 54 00 2c 48 da
E: 0.067999 10 02 ea 69 87 2e 8e 8f c0 00 db
E: 0.075001 10 02 e2 69 78 2e b3 00 29 c8 dd
E: 0.086998 10 02 ea 69 6d 2e df 8f 40 00 df
E: 0.093999 10 02 e2 69 69 2e f1 00 27 c8 dd
E: 0.106000 10 02 ea 69 6d 2f 08 8e 80 00 dc
E: 0.112999 10 02 e2 69 65 2f 18 00 25 c5 df
E: 0.124999 10 02 ea 69 41 2f 54 8d 40 00 df
E: 0.132002 10 02 e2 69 24 2f 73 00 26 c0 e0
E: 0.144000 10 02 ea 68 ee 2f 7f 8b c0 00 dd
E: 0.151001 10 02 e0 68 c0 2f 82 00 27 c3 da
E: 0.163000 10 02 ea 68 6d 2f b4 89 40 00 d7
E: 0.169998 10 02 e0 68 02 2f e4 00 29 45 d3
E: 0.181998 10 02 ea 66 ef 30 3b 84 40 00 d5
E: 0.188999 10 02 e0 66 7b 30 76 00 2b c8 db
E: 0.201000 10 02 ea 66 04 30 fa 7e 00 00 dd
E: 0.207999 10 02 e0 65 e2 31 27 00 2d cd e0
E: 0.220000 10 02 ea 65 ba 31 89 75 c0 00 df
E: 0.226995 10 02 e0 65 9d 31 d1 00 2e cc dc
E: 0.238999 10 02 ea 65 50 32 3d 6a 80 00 df
E: 0.245995 10 02 e0 65 25 32 97 00 30 ca de
E: 0.257998 10 02 ea 64 de 33 39 5c c0 00 dd
E: 0.265000 10 02 e0 64 ba 33 c0 00 2f c6 dd
E: 0.276994 10 02 ea 64 ad 34 bc 4c c0 00 da
E: 0.284000 10 02 e0 64 ab 35 78 00 2e c5 d6
E: 0.295995 10 02 ea 64 d5 36 a6 3b 40 00 d6
E: 0.302998 10 02 e0 65 0b 37 63 00 2e c1 da
E: 0.314999 10 02 ea 65 af 38 88 28 80 00 d6
E: 0.321999 10 02 e0 66 3d 38 ff 00 2c 3f d7
E: 0.334001 10 02 ea 67 39 39 9d 16 c0 00 d0
E: 0.340998 10 02 e0 67 f1 39 dc 00 2d bf d1
E: 0.352999 10 02 ea 69 52 3a 19 05 80 00 d7
E: 0.359957 10 02 e0 6a 63 3a 22 00 2d 3b d4
E: 0.370998 10 02 ea 6c 1b 39 f6 0a 20 00 d5
E: 0.378998 10 02 e0 6d 3e 39 cf 00 2b bc d4
E: 0.389938 10 02 ea 6f 64 39 63 17 e0 00 d4
E: 0.398000 10 02 e0 70 b4 39 0e 00 2c bb d6
E: 0.408999 10 02 ea 73 0c 38 4e 23 a0 00 d1
E: 0.416998 10 02 e0 74 40 37 af 00 29 be d2
E: 0.427997 10 02 ea 75 f5 36 95 2b 20 00 c9
E: 0.435997 10 02 e0 76 f0 35 df 00 29 3f c8
E: 0.446998 10 02 ea 78 44 34 95 31 20 00 c9
E: 0.454999 10 02 e0 78 e4 33 ac 00 29 bf ca
E: 0.465994 10 02 ea 79 84 32 20 33 60 00 ca
E: 0.472998 10 02 e0 79 af 31 49 00 28 c0 ca
E: 0.484998 10 02 ea 79 a5 2f ab 34 20 00 cc
E: 0.491997 10 02 e0 79 69 2e 9d 00 29 41 cd
E: 0.503997 10 02 ea 78 a0 2d 19 33 20 00 c9
E: 0.510998 10 02 e0 77 f8 2c 35 00 29 c2 cb
E: 0.522998 10 02 ea 76 82 2a f8 30 e0 00 d3
E: 0.529998 10 02 e0 75 74 2a 4a 00 29 c4 d3
E: 0.541997 10 02 ea 73 7c 29 6d 2b e0 00 d3
E: 0.548994 10 02 e0 72 0d 29 0d 00 2a 46 d5
E: 0.560998 10 02 ea 6f cb 28 a2 25 a0 00 d6
E: 0.568000 10 02 e0 6e 54 28 74 00 2a 48 da
E: 0.579998 10 02 ea 6b e3 28 54 20 60 00 dd
E: 0.587000 10 02 e0 6a 6e 28 61 00 2a 4c dd
E: 0.598992 10 02 ea 67 f8 28 8d 1a 60 00 e3
E: 0.605997 10 02 e0 66 ab 28 a6 00 2b 4f e5
E: 0.617997 10 02 ea 64 7c 28 ff 14 a0 00 eb
E: 0.624996 10 02 e0 63 8b 29 51 00 2c 50 ea
E: 0.636997 10 02 ea 62 4d 29 f3 0c e0 00 eb
E: 0.643992 10 02 e0 61 cf 2a 72 00 2e 4f ee
E: 0.655996 10 02 ea 61 6b 2b 1d 05 60 00 eb
E: 0.662996 10 02 e0 61 58 2b 91 00 2e 4f e7
E: 0.674996 10 02 ea 61 8a 2c 1b 02 c0 00 e3
E: 0.681998 10 02 e0 61 da 2c 69 00 2c 4e e3
E: 0.693993 10 02 ea 62 90 2c c8 0a c0 00 dc
E: 0.700997 10 02 e0 63 06 2d 01 00 2d 4e dc
E: 0.712996 10 02 ea 63 cd 2d 49 12 80 00 df
E: 0.719998 10 02 e0 64 6a 2d 76 00 2b cf e2
E: 0.731996 10 02 ea 65 4e 2d 94 1b c0 00 e2
E: 0.738996 10 02 e0 65 e3 2d bf 00 2b 4e e2
E: 0.750995 10 02 ea 66 bf 2d e6 25 c0 00 e1
E: 0.757997 10 02 e0 67 33 2d f8 00 2c 4c e3
E: 0.769999 10 02 ea 67 eb 2d fc 30 c0 00 e1
E: 0.776996 10 02 e0 68 50 2e 08 00 2a ca e3
E: 0.787997 10 02 ea 68 e0 2d f9 3b c0 00 e0
E: 0.795997 10 02 e0 69 33 2d f7 00 2a 48 e2
E: 0.806996 10 02 ea 69 a8 2d ef 46 40 00 dc
E: 0.814997 10 02 e0 69 d8 2d f5 00 2a 47 de
E: 0.825996 10 02 ea 6a 34 2d c9 51 80 00 dc
E: 0.833995 10 02 e0 6a 54 2d b1 00 28 c5 df
E: 0.844997 10 02 ea 6a 68 2d 75 5b c0 00 dc
E: 0.852997 10 02 e0 6a 65 2d 52 00 28 c5 dc
E: 0.863997 10 02 ea 6a 5b 2c ff 65 80 00 dc
E: 0.870997 10 02 e0 6a 53 2c ce 00 2a 45 dc
E: 0.882996 10 02 ea 6a 26 2c 6e 6c c0 00 df
E: 0.889995 10 02 e0 6a 14 2c 2e 00 2b 45 db
E: 0.901996 10 02 ea 69 bf 2b d9 71 40 00 d6
E: 0.908996 10 02 e0 69 5d 2b 97 00 2d 47 db
E: 0.920995 10 02 ea 68 da 2b 61 72 c0 00 d9
E: 0.927992 10 02 e0 68 ad 2b 70 00 2c 48 da
E: 0.939995 10 02 ea 68 89 2b 8b 70 c0 00 d8
E: 0.946995 10 02 e0 68 84 2b ae 00 2b 4a d8
E: 0.958995 10 02 ea 68 8d 2b df 6c 00 00 d6
E: 0.965992 10 02 e0 68 88 2b f4 00 2b 4b da
E: 0.977992 10 02 ea 68 a3 2b f7 63 00 00 d8
E: 0.984996 10 02 e0 68 b9 2c 00 00 2a 4a d9
E: 0.996999 10 02 ea 68 e7 2c 1f 58 00 00 d9
E: 1.003997 10 02 e0 68 fd 2c 46 00 2a 4a d8
E: 1.015992 10 02 ea 69 22 2c b6 4b 00 00 de
E: 1.022995 10 02 e0 69 35 2d 09 00 29 49 dc
E: 1.034995 10 02 ea 69 5a 2d de 3d 80 00 e3
E: 1.041995 10 02 e0 69 6a 2e 83 00 27 c7 e5
E: 1.053996 10 02 ea 69 99 2f 9c 2e c0 00 ed
E: 1.060994 10 02 e0 69 ad 30 3d 00 25 c5 ec
E: 1.072994 10 02 ea 6a 35 31 41 1f c0 00 f1
E: 1.079995 10 02 e0 6a b5 32 03 00 23 c4 ee
E: 1.091995 10 02 ea 6b 37 33 44 12 00 00 ec
E: 1.098990 10 02 e0 6b 5c 33 f5 00 25 40 ed
E: 1.110994 10 02 ea 6b 87 35 4f 05 80 00 e4
E: 1.117995 10 02 e0 6b 84 36 06 00 26 40 e2
E: 1.129994 10 02 ea 6b 5e 37 4d 04 a0 00 e0
E: 1.136993 10 02 e0 6b 32 38 2a 00 27 3c e0
E: 1.148990 10 02 ea 6a bd 39 71 0d a0 00 df
E: 1.155995 10 02 e0 6a 6d 3a 1d 00 28 b8 de
E: 1.167996 10 02 ea 69 a2 3b 5f 14 a0 00 e2
E: 1.174994 10 02 e0 69 0a 3b fe 00 26 36 e1
E: 1.186995 10 02 ea 68 0f 3d 66 1a a0 00 dd
E: 1.193994 10 02 e0 67 8e 3e 58 00 24 34 d9
E: 1.205995 10 02 ea 66 9a 40 15 1d 60 00 e2
E: 1.212995 10 02 e0 66 11 41 30 00 24 b0 e3
E: 1.223994 10 02 ea 65 35 42 a9 1e 60 00 e1
E: 1.231960 10 02 e0 64 a5 43 63 00 21 ad e3
E: 1.242994 10 02 ea 63 b7 44 71 1e a0 00 e7
E: 1.250994 10 02 e0 62 f6 44 f1 00 21 a8 eb
E: 1.261991 10 02 ea 61 a8 45 68 1e 60 00 eb
E: 1.269993 10 02 e0 60 b6 45 90 00 23 25 ef
E: 1.280993 10 02 ea 5f 64 45 94 1e a0 00 f3
E: 1.288994 10 02 e0 5e 62 45 63 00 22 24 f0
E: 1.310995 10 02 80 00 00 00 00 00 00 00 00
E: 1.516994 10 02 c2 80 42 48 0d e2 11 00 00
E: 1.528989 10 02 ea 6d 51 22 28 1c 40 00 da
E: 1.535994 10 02 e0 6f 10 22 3d 00 25 c3 d4
E: 1.546992 10 02 ea 71 c6 22 81 1b 80 00 d7
E: 1.554992 10 02 e0 73 60 22 d7 00 26 4e d0
E: 1.565989 10 02 ea 75 96 23 6b 19 c0 00 d0
E: 1.573991 10 02 e0 76 dd 23 f1 00 25 4d d2
E: 1.584993 10 02 ea 78 71 24 c7 18 00 00 d1
E: 1.592992 10 02 e0 79 10 25 49 00 24 d1 d0
E: 1.603992 10 02 ea 79 ec 26 7f 16 c0 00 d8
E: 1.611927 10 02 e0 7a 55 27 66 00 22 d6 d5
E: 1.622993 10 02 ea 7a c1 28 f3 15 00 00 d4
E: 1.630991 10 02 e0 7a da 2a 10 00 20 57 da
E: 1.641990 10 02 ea 7a f0 2b ce 13 80 00 d9
E: 1.648988 10 02 e0 7a f3 2c d6 00 1d 53 dc
E: 1.660992 10 02 ea 7a d9 2e 68 11 80 00 e1
E: 1.667991 10 02 e0 7a bf 2f 74 00 19 4e e6
E: 1.679991 10 02 ea 7a 87 30 db 0e 80 00 e3
E: 1.686990 10 02 e0 7a 4d 31 bf 00 17 4d de
E: 1.698987 10 02 ea 79 e8 33 66 0c 80 00 e2
E: 1.705991 10 02 e0 79 97 34 73 00 17 49 df
E: 1.717993 10 02 ea 79 0a 36 39 0b 80 00 da
E: 1.724991 10 02 e0 78 a8 37 2d 00 18 46 da
E: 1.736993 10 02 ea 77 fd 38 dd 0b 00 00 d9
E: 1.743991 10 02 e0 77 98 39 d2 00 1a c2 d4
E: 1.755992 10 02 ea 76 ec 3b 8e 09 c0 00 d4
E: 1.762991 10 02 e0 76 71 3c 8d 00 1e 3d d2
E: 1.774992 10 02 ea 75 9c 3e 2d 09 80 00 c8
E: 1.781919 10 02 e0 75 0a 3f 22 00 1e b8 c5
E: 1.793992 10 02 ea 74 0e 40 a2 08 80 00 ce
E: 1.800991 10 02 e0 73 73 41 53 00 1f 34 c9
E: 1.812988 10 02 ea 72 63 42 55 09 00 00 c9
E: 1.819991 10 02 e0 71 bc 42 e6 00 1e b0 c9
E: 1.831923 10 02 ea 70 e3 43 96 0b 40 00 cc
E: 1.838991 10 02 e0 70 67 43 d7 00 1d ab d1
E: 1.850987 10 02 ea 6f 72 44 0f 0c 40 00 d4
E: 1.857991 10 02 e0 6e d0 44 11 00 20 26 db
E: 1.869996 10 02 ea 6d 87 43 e2 0d 80 00 d7
E: 1.876993 10 02 e0 6c c5 43 98 00 21 23 d6
E: 1.888987 10 02 ea 6b 5f 42 d1 0d 80 00 d6
E: 1.895986 10 02 e0 6a 78 42 26 00 22 a1 d4
E: 1.907991 10 02 ea 69 21 40 bc 0c 80 00 d9
E: 1.914990 10 02 e0 68 78 3f cc 00 25 24 db
E: 1.926992 10 02 ea 67 61 3e 74 0c 00 00 d4
E: 1.933991 10 02 e0 66 a3 3d 89 00 27 26 da
E: 1.945999 10 02 ea 65 77 3b e3 0b 00 00 dd
E: 1.952991 10 02 e0 64 ed 3b 10 00 29 2c dd
E: 1.964990 10 02 ea 64 6c 39 c8 09 c0 00 d9
E: 1.971989 10 02 e0 64 4e 38 f4 00 2a 30 db
E: 1.982992 10 02 ea 64 4d 37 99 07 00 00 dc
E: 1.990991 10 02 e0 64 77 36 ea 00 2b 34 d5
E: 2.001990 10 02 ea 64 e9 36 0a 06 80 00 ca
E: 2.009990 10 02 e0 65 31 35 90 00 2b 39 c4
E: 2.020989 10 02 ea 65 a9 34 9e 05 80 00 c5
E: 2.028989 10 02 e0 65 f6 33 fe 00 2a bc c9
E: 2.039990 10 02 ea 66 82 33 29 05 80 00 d0
E: 2.047989 10 02 e0 66 f8 32 bd 00 2b bf d2
E: 2.058992 10 02 ea 67 c8 32 20 07 c0 00 ce
E: 2.065986 10 02 e0 68 39 31 cf 00 2c 40 cf
E: 2.077990 10 02 ea 68 eb 31 6e 09 00 00 ca
E: 2.084991 10 02 e0 69 55 31 35 00 2b c3 c8
E: 2.096990 10 02 ea 69 d0 30 dd 0c 40 00 cc
E: 2.103990 10 02 e0 6a 0e 30 a4 00 2b 45 cf
E: 2.115990 10 02 ea 6a 5f 30 4a 0e 40 00 d1
E: 2.122989 10 02 e0 6a 7e 30 13 00 28 cc d0
E: 2.134990 10 02 ea 6a a4 2f c4 11 00 00 d5
E: 2.141989 10 02 e0 6a cf 2f b6 00 28 cf d4
E: 2.153989 10 02 ea 6b 13 2f 99 12 40 00 d0
E: 2.160989 10 02 e0 6b 34 2f 97 00 29 d2 d3
E: 2.172990 10 02 ea 6b 5b 2f a9 14 c0 00 c9
E: 2.179986 10 02 e0 6b 64 2f c1 00 2a d4 c6
E: 2.191992 10 02 ea 6b 4d 2f eb 17 00 00 b8
E: 2.198985 10 02 e0 6b 28 30 04 00 2c d2 b5
E: 2.210991 10 02 ea 6a e6 30 2d 18 40 00 af
E: 2.217990 10 02 e0 6a bf 30 46 00 2b 51 a8
E: 2.229985 10 02 ea 6a 75 30 42 19 40 00 a4
E: 2.236989 10 02 e0 6a 49 30 40 00 2a 50 a4
E: 2.248984 10 02 ea 69 e3 30 4a 19 80 00 a5
E: 2.255990 10 02 e0 69 95 30 5c 00 2a 50 a3
E: 2.267990 10 02 ea 68 f4 30 8a 1b 00 00 a3
E: 2.274989 10 02 e0 68 83 30 d0 00 29 4f a2
E: 2.286988 10 02 ea 67 9f 31 5c 1b 80 00 a0
E: 2.293991 10 02 e0 67 08 31 cc 00 29 4f a0
E: 2.305991 10 02 ea 66 03 32 c4 1d 80 00 a6
E: 2.312990 10 02 e0 65 54 33 75 74 68 ce af
E: 2.324990 10 02 ea 64 57 34 ca 1e c0 00 a7
E: 2.331924 10 02 e0 63 ec 35 b8 79 68 c7 a1
E: 2.343989 10 02 ea 63 77 37 38 20 40 00 a9
E: 2.350989 10 02 e1 63 4a 38 4b 7d 69 c5 af
E: 2.362988 10 02 ea 63 36 3a 3d 22 00 00 a4
E: 2.369988 10 02 e1 63 40 3b 9c 85 e9 c3 ad
E: 2.381956 10 02 ea 63 7b 3e 39 25 00 00 a7
E: 2.388989 10 02 e0 63 c2 3f c3 86 e9 c0 ab
E: 2.399988 10 02 ea 64 82 41 f2 28 00 00 a5
E: 2.407988 10 02 e1 65 4c 43 39 86 29 40 a8
E: 2.418989 10 02 ea 66 e0 44 cd 2b 40 00 b1
E: 2.426988 10 02 e1 68 05 45 a4 86 28 bd ab
E: 2.437987 10 02 ea 6a 45 46 9c 2e 80 00 a4
E: 2.445989 10 02 e1 6b 97 47 0a 86 27 ba a8
E: 2.456988 10 02 ea 6d f6 47 5f 30 00 00 a9
E: 2.464988 10 02 e0 6f 69 47 55 84 e6 38 aa
E: 2.475989 10 02 ea 71 d5 46 d2 30 00 00 a6
E: 2.483987 10 02 e0 73 34 46 5f 83 25 36 ab
E: 2.494987 10 02 ea 75 6b 45 2b 2d c0 00 aa
E: 2.501989 10 02 e0 76 c5 44 39 83 e4 36 b3
E: 2.513986 10 02 ea 78 88 42 95 2b c0 00 a5
E: 2.520988 10 02 e0 79 7a 41 76 90 e2 b5 a6
E: 2.532987 10 02 ea 7a d8 3f 60 27 40 00 ad
E: 2.539987 10 02 e0 7b 74 3e 23 a7 a1 b7 a7
E: 2.551986 10 02 ea 7c 2e 3c 08 22 c0 00 ad
E: 2.558988 10 02 e1 7c 64 3a ea b7 61 ba a9
E: 2.570987 10 02 ea 7c 5a 39 1f 1e 00 00 a6
E: 2.577988 10 02 e1 7c 1c 38 19 b7 61 3d a8
E: 2.589988 10 02 ea 7b 4d 36 96 19 c0 00 a9
E: 2.596923 10 02 e1 7a 89 35 d6 b9 62 40 a1
E: 2.608987 10 02 ea 79 08 34 b2 17 00 00 a2
E: 2.615988 10 02 e1 77 fc 34 2a ab e2 c2 a7
E: 2.627987 10 02 ea 76 14 33 a0 16 40 00 aa
E: 2.634988 10 02 e1 74 ef 33 74 a4 23 44 b1
E: 2.646972 10 02 ea 72 ee 33 75 18 00 00 af
E: 2.653988 10 02 e0 71 b6 33 90 9d 23 c0 aa
E: 2.665987 10 02 ea 6f ea 33 f7 1a 00 00 a8
E: 2.672986 10 02 e1 6e f2 34 51 94 e4 c1 a6
E: 2.684988 10 02 ea 6d 71 35 07 1e 40 00 a6
E: 2.691988 10 02 e0 6c a3 35 89 9b e6 42 a2
E: 2.703987 10 02 ea 6b 92 36 43 22 c0 00 a0
E: 2.710986 10 02 e0 6b 08 36 b5 9b e6 c1 a7
E: 2.722986 10 02 ea 6a 55 37 5d 27 00 00 ad
E: 2.729989 10 02 e0 69 e9 37 d0 9b e7 c6 b0
E: 2.741988 10 02 ea 69 60 38 61 2a 80 00 ad
E: 2.748986 10 02 e0 69 26 38 ba 99 a7 c5 a9
E: 2.760987 10 02 ea 68 f5 39 47 2e 40 00 a8
E: 2.767988 10 02 e0 68 d0 39 7e 8a a7 c4 a8
E: 2.779986 10 02 ea 68 a8 39 dd 31 40 00 b2
E: 2.786985 10 02 e0 68 9a 3a 11 78 a8 43 b6
E: 2.798981 10 02 ea 68 9c 3a 47 33 c0 00 c0
E: 2.805986 10 02 e0 68 a7 3a 66 40 a8 c2 c5
E: 2.816986 10 02 ea 68 e0 3a 86 35 00 00 cf
E: 2.824986 10 02 e0 69 07 3a aa 00 29 40 d0
E: 2.835987 10 02 ea 69 2c 3a b9 34 80 00 d9
E: 2.843986 10 02 e0 69 39 3a bb 00 29 40 e0
E: 2.854986 10 02 ea 69 2c 3a c1 33 80 00 eb
E: 2.862986 10 02 e0 69 13 3a cd 00 28 bf ef
E: 2.873987 10 02 ea 68 e4 3a da 31 80 00 f0
E: 2.881982 10 02 e0 68 c7 3a dc 00 28 3e f3
E: 2.903986 10 02 80 00 00 00 00 00 00 00 00
E: 3.167985 10 02 c2 80 42 48 0d e2 11 00 00
E: 3.179987 10 02 ea 6a 8b 3b a0 04 60 00 ce
E: 3.186985 10 02 e0 6a 94 3b 9d 00 2b c1 cf
E: 3.198981 10 02 ea 6a b2 3b 6c 07 20 00 cb
E: 3.205985 10 02 e0 6a bc 3b 51 00 2e 42 c7
E: 3.217985 10 02 ea 6a cb 3b 1f 09 60 00 c4
E: 3.224984 10 02 e0 6a cf 3b 06 00 30 3f c5
E: 3.236984 10 02 ea 6a cd 3a cb 0b a0 00 c5
E: 3.243984 10 02 e0 6a cc 3a b5 00 31 40 c5
E: 3.255984 10 02 ea 6a c4 3a 90 0d a0 00 c9
E: 3.262984 10 02 e0 6a c1 3a 7a 00 30 c0 c8
E: 3.274984 10 02 ea 6a b0 3a 56 0f 60 00 cd
E: 3.281979 10 02 e0 6a a4 3a 42 00 31 41 cd
E: 3.293984 10 02 ea 6a 9e 3a 34 10 e0 00 d1
E: 3.300984 10 02 e0 6a 9c 3a 3a 00 31 c1 d0
E: 3.311984 10 02 ea 6a 84 3a 4e 12 20 00 d2
E: 3.319985 10 02 e0 6a 6c 3a 77 00 32 41 d4
E: 3.330983 10 02 ea 6a 50 3a b2 13 a0 00 d5
E: 3.338986 10 02 e0 6a 33 3a dd 00 32 c1 d8
E: 3.349985 10 02 ea 6a 06 3b 1e 11 a0 00 db
E: 3.357984 10 02 e0 6a 02 3b 42 00 32 c1 da
E: 3.368983 10 02 ea 69 fd 3b 6e 10 20 00 d9
E: 3.376983 10 02 e0 6a 02 3b 8f 00 32 c1 de
E: 3.387985 10 02 ea 69 fb 3b cf 0e 60 00 df
E: 3.394983 10 02 e0 6a 01 3b e5 00 32 c1 dd
E: 3.406984 10 02 ea 6a 0f 3c 12 0c 60 00 dc
E: 3.413980 10 02 e0 6a 1d 3c 30 00 32 41 dd
E: 3.425983 10 02 ea 6a 3f 3c 59 0b 20 00 de
E: 3.432982 10 02 e0 6a 4b 3c 7b 00 32 41 de
E: 3.444982 10 02 ea 6a 4d 3c ad 0a 60 00 dc
E: 3.451984 10 02 e0 6a 48 3c de 00 32 41 dd
E: 3.463983 10 02 ea 6a 4a 3d 1a 0a 20 00 d8
E: 3.470983 10 02 e0 6a 49 3d 37 00 32 41 de
E: 3.482982 10 02 ea 6a 48 3d 59 09 e0 00 da
E: 3.489984 10 02 e0 6a 49 3d 6c 00 32 41 db
E: 3.501983 10 02 ea 6a 39 3d 7c 0a 20 00 da
E: 3.508983 10 02 e0 6a 25 3d 8e 00 32 41 df
E: 3.520983 10 02 ea 69 f1 3d 9e 0a a0 00 df
E: 3.527983 10 02 e0 69 f2 3d 9f 00 32 41 de
E: 3.539983 10 02 ea 69 e8 3d a4 0b a0 00 d8
E: 3.546982 10 02 e0 69 ef 3d a4 00 32 41 dc
E: 3.558983 10 02 ea 69 f8 3d 9f 0c e0 00 dc
E: 3.565983 10 02 e0 69 f4 3d a1 00 32 41 db
E: 3.577984 10 02 ea 69 e3 3d a7 0d a0 00 d8
E: 3.584986 10 02 e0 69 ce 3d b2 00 32 41 d9
E: 3.596982 10 02 ea 69 a7 3d b3 0d e0 00 da
E: 3.603985 10 02 e0 69 9e 3d a5 00 31 c2 d8
E: 3.615980 10 02 ea 69 95 3d af 0d a0 00 d6
E: 3.622985 10 02 e0 69 9f 3d ae 00 2f 43 d6
E: 3.634983 10 02 ea 69 a4 3d a4 0d 60 00 d1
E: 3.641982 10 02 e0 69 aa 3d a2 00 2d 43 d2
E: 3.653983 10 02 ea 69 aa 3d 9a 0c e0 00 cc
E: 3.660983 10 02 e0 69 aa 3d 92 00 2b 43 cd
E: 3.672981 10 02 ea 69 a8 3d 87 0c 20 00 cf
E: 3.679983 10 02 e0 69 a7 3d 80 00 29 c2 cc
E: 3.691983 10 02 ea 69 a0 3d 76 0b 60 00 ce
E: 3.698977 10 02 e4 69 9b 3d 71 00 29 c2 c9
E: 3.710982 10 02 ea 69 99 3d 67 0a 20 00 cb
E: 3.717982 10 02 e4 69 8f 3d 65 00 2a 42 ca
E: 3.728981 10 02 ea 69 8c 3d 5c 09 20 00 c9
E: 3.736981 10 02 e4 69 80 3d 55 00 2a 42 ca
E: 3.747983 10 02 ea 69 74 3d 4c 08 20 00 c9
E: 3.755982 10 02 e4 69 6a 3d 44 00 2a 41 c9
E: 3.766981 10 02 ea 69 49 3d 31 07 a0 00 cd
E: 3.774981 10 02 e4 69 2e 3d 21 00 2a c1 cd
E: 3.785981 10 02 ea 68 ff 3d 07 06 e0 00 d1
E: 3.793981 10 02 e4 68 ed 3c f2 00 2a c1 d5
E: 3.804982 10 02 ea 68 c0 3c dc 06 60 00 db
E: 3.812982 10 02 e4 68 9f 3c c3 00 2b 42 dd
E: 3.823982 10 02 ea 68 88 3c a9 05 a0 00 df
E: 3.830982 10 02 e4 68 84 3c 9b 00 2b c3 e1
E: 3.842982 10 02 ea 68 84 3c 83 04 a0 00 e4
E: 3.849982 10 02 e4 68 82 3c 78 00 2c 43 ea
E: 3.861982 10 02 ea 68 60 3c 66 03 e0 00 ee
E: 3.868982 10 02 e0 68 48 3c 73 00 2c 44 f1
E: 3.880981 10 02 ea 67 fe 3c f7 02 60 00 f1
E: 3.887982 10 02 e0 67 cb 3d 61 00 2c c4 f2
E: 3.899981 10 02 ea 67 8d 3e 2f 00 60 00 f0
E: 3.917981 10 02 80 00 00 00 00 00 00 00 00
E: 4.359979 10 02 c2 80 c2 48 0d e2 11 00 00
E: 4.366974 10 02 e0 6c c5 41 53 00 21 d2 98
E: 4.374914 10 02 e0 6c b9 41 32 00 20 55 93
E: 4.381976 10 02 e0 6c ab 41 0e 00 1e 58 86
E: 4.388980 10 02 e0 6c 99 40 e5 00 1c 5a 7c
E: 4.395978 10 02 e0 6c 6f 40 b8 00 1d 5a 79
E: 4.402979 10 02 e0 6c 38 40 94 00 1d d9 73
E: 4.409980 10 02 e0 6b fc 40 83 00 1d d8 6a
E: 4.417980 10 02 e0 6b b9 40 3b 00 1e 58 6c
E: 4.424978 10 02 e0 6b 76 40 27 4b 1e 57 6e
E: 4.431974 10 02 e1 6b 35 3f e5 58 5e d3 6c
E: 4.438978 10 02 e0 6a fe 3f b6 64 5e d2 6d
E: 4.445981 10 02 e1 6a c6 3f 95 6a 5f 52 6f
E: 4.452980 10 02 e0 6a 8b 3f 80 6c 9f 52 69
E: 4.460981 10 02 e1 6a 37 3f 70 6c df d2 69
E: 4.467981 10 02 e0 69 bf 3f 6d 6d df d3 66
E: 4.474980 10 02 e1 69 27 3f 87 6e 1f d4 69
E: 4.481978 10 02 e0 68 73 3f b7 6e 5f d4 6a
E: 4.488980 10 02 e0 67 9f 40 04 6e df d7 6c
E: 4.496978 10 02 e1 66 d8 40 61 6d df d8 6f
E: 4.503977 10 02 e1 65 f3 40 cc 6d 20 58 6a
E: 4.510979 10 02 e0 64 f3 41 62 6c 60 59 65
E: 4.517978 10 02 e1 64 06 42 04 6b e0 59 67
E: 4.524977 10 02 e0 63 27 42 c5 6b 60 58 66
E: 4.531975 10 02 e1 62 57 43 94 6a 20 d8 69
E: 4.539977 10 02 e0 61 97 44 7c 69 60 d8 6d
E: 4.546978 10 02 e0 60 ff 45 35 68 21 55 62
E: 4.553978 10 02 e1 60 87 45 fa 67 61 d5 60
E: 4.560978 10 02 e0 60 16 46 dc 66 61 d4 62
E: 4.567974 10 02 e0 5f c3 47 a9 66 a1 d3 66
E: 4.574978 10 02 e0 5f 88 48 79 66 62 52 6d
E: 4.582979 10 02 e1 5f 67 49 34 66 62 52 6a
E: 4.589977 10 02 e1 5f 5d 49 ff 66 e2 51 67
E: 4.596977 10 02 e0 5f 66 4a b0 66 e2 d1 64
E: 4.603978 10 02 e1 5f 86 4b 66 68 62 d3 68
E: 4.610977 10 02 e0 5f b1 4c 2f 6a 23 53 6b
E: 4.617978 10 02 e1 5f f2 4c f0 6d a3 53 73
E: 4.625978 10 02 e1 60 43 4d 86 71 63 4f 69
E: 4.632977 10 02 e0 60 a0 4e 11 75 e3 4e 64
E: 4.639978 10 02 e0 61 0d 4e 8f 7b 23 4e 66
E: 4.646979 10 02 e1 61 7e 4e ed 81 23 4e 64
E: 4.653978 10 02 e0 61 eb 4f 30 88 a3 4e 60
E: 4.660977 10 02 e0 62 75 4f 64 8f 23 4e 65
E: 4.667977 10 02 e0 63 02 4f 82 97 e3 4d 64
E: 4.675977 10 02 e1 63 95 4f 83 9f 63 4d 64
E: 4.682976 10 02 e1 64 26 4f 68 a7 23 51 67
E: 4.689977 10 02 e0 64 c1 4f 48 ae 63 51 65
E: 4.696976 10 02 e1 65 4d 4f 17 b3 23 51 65
E: 4.703977 10 02 e1 65 c9 4e e4 b7 a3 52 64
E: 4.710977 10 02 e0 66 54 4e 9a b9 23 52 64
E: 4.718976 10 02 e0 66 db 4e 4a bb 23 51 66
E: 4.725978 10 02 e0 67 6a 4d de bb e3 51 64
E: 4.732977 10 02 e1 67 f5 4d 5d bc 62 d1 6a
E: 4.739977 10 02 e1 68 76 4c d2 bd 22 d1 6f
E: 4.746979 10 02 e1 68 dd 4c 3c bb a2 d1 71
E: 4.753977 10 02 e1 69 2e 4b c0 ba 62 d1 6f
E: 4.761976 10 02 e0 69 75 4b 3c b7 22 51 6c
E: 4.768977 10 02 e1 69 9e 4a d9 b5 e2 51 6b
E: 4.775976 10 02 e1 69 b9 4a 7b b3 a1 d2 6d
E: 4.782976 10 02 e1 69 bf 4a 24 b1 61 52 6f
E: 4.789978 10 02 e1 69 b4 49 ce ab a1 53 6d
E: 4.797978 10 02 e1 69 97 49 7f 9f e0 d3 6c
E: 4.804976 10 02 e1 69 61 49 32 89 20 53 6e
E: 4.811976 10 02 e1 69 09 48 ed 63 60 53 6c
E: 4.818976 10 02 e0 68 9f 48 b0 00 20 53 6c
E: 4.825977 10 02 e0 68 1b 48 5d 00 20 53 73
E: 4.832976 10 02 e0 67 a0 47 c6 00 20 53 73
E: 4.840977 10 02 e0 67 1c 47 1b 00 20 d3 82
E: 4.847975 10 02 e0 66 a1 46 7a 00 20 d2 86
E: 4.854976 10 02 e0 66 16 45 e3 00 21 52 94
E: 4.861976 10 02 e0 65 72 45 5b 00 22 53 b7
E: 4.868976 10 02 e0 64 c4 44 e4 00 21 d3 ce
E: 4.875977 10 02 e0 64 07 44 71 00 21 d4 df
E: 4.883977 10 02 e0 63 4c 44 0d 00 21 d5 ef
E: 5.423974 10 02 80 00 00 00 00 00 00 00 00
E: 7.105965 10 02 c2 80 21 b8 0c 99 31 00 00
E: 7.112966 10 02 e0 69 a0 40 a4 00 23 4b 9e
E: 7.119897 10 02 e0 69 05 40 ea 00 22 cb 9c
E: 7.127893 10 02 e0 68 6b 41 39 00 22 ca a7
E: 7.134966 10 02 e0 67 c2 41 7f 00 22 c9 9f
E: 7.141965 10 02 e0 67 03 41 cf 00 23 48 9b
E: 7.148964 10 02 e0 66 24 42 0d 00 23 c8 99
E: 7.155966 10 02 e0 65 26 42 4d 00 24 48 9a
E: 7.162965 10 02 e0 64 35 42 78 00 23 c8 97
E: 7.170966 10 02 e0 63 60 42 9d 00 23 4b 8f
E: 7.177966 10 02 e0 62 83 42 b6 00 24 49 89
E: 7.184960 10 02 e0 61 b2 42 b8 00 25 48 89
E: 7.191965 10 02 e0 60 ee 42 a4 00 25 c7 85
E: 7.198966 10 02 e0 60 31 42 70 00 25 47 7d
E: 7.205965 10 02 e0 5f 7e 42 24 00 25 46 7d
E: 7.213966 10 02 e0 5e b4 41 be 00 24 c6 79
E: 7.220964 10 02 e0 5d d4 41 36 00 25 c6 78
E: 7.227965 10 02 e0 5c df 40 9a 00 26 c6 7c
E: 7.234964 10 02 e0 5b ec 3f e8 00 26 c7 85
E: 7.241966 10 02 e0 5a f6 3f 3c 00 26 c8 7e
E: 7.248964 10 02 e0 59 e3 3e 93 00 27 47 7f
E: 7.256964 10 02 e0 58 d6 3d fd 00 28 48 7c
E: 7.263964 10 02 e0 57 e5 3d 6f 00 28 c9 83
E: 7.270964 10 02 e0 57 15 3d 05 00 29 4a 82
E: 7.277965 10 02 e0 56 4a 3c ba 00 29 ca 85
E: 7.284964 10 02 e0 55 93 3c 85 00 2a 4b 89
E: 7.291966 10 02 e0 54 ec 3c 64 00 2b 4c 8c
E: 7.299965 10 02 e0 54 34 3c 5c 00 2b cc 8f
E: 7.306965 10 02 e0 53 99 3c 6f 00 2c 4d 8d
E: 7.313965 10 02 e0 53 24 3c 98 00 2c 4e 8f
E: 7.320965 10 02 e0 52 c7 3c e2 00 2c ce 8e
E: 7.327964 10 02 e0 52 7b 3d 3a 00 2d 4e 88
E: 7.334964 10 02 e0 52 51 3d 91 00 2d ce 89
E: 7.342965 10 02 e0 52 40 3d ea 00 2d ce 8a
E: 7.349964 10 02 e0 52 42 3e 4f 00 2d ce 8a
E: 7.356965 10 02 e0 52 57 3e d6 00 2e 4e 89
E: 7.363964 10 02 e0 52 7e 3f 8b 00 2e cd 8f
E: 7.370964 10 02 e0 52 bd 40 6f 00 2f 4c 96
E: 7.377965 10 02 e0 53 10 41 5f 00 2f 48 88
E: 7.385965 10 02 e0 53 7a 42 6c 00 2f 47 89
E: 7.392964 10 02 e0 53 fc 43 99 00 2e c6 8b
E: 7.399963 10 02 e0 54 97 44 d5 00 2e c5 98
E: 7.406964 10 02 e0 55 44 45 fa 00 2e 40 8d
E: 7.413962 10 02 e0 56 07 46 f3 00 2d 40 88
E: 7.420964 10 02 e0 56 ef 47 d2 00 2d 3f 93
E: 7.428964 10 02 e0 57 e2 48 8c 00 2d 3d 9a
E: 7.435963 10 02 e0 59 04 49 17 00 2c be 9a
E: 7.442963 10 02 e0 5a 22 49 79 00 2c bd 9a
E: 7.449963 10 02 e0 5b 52 49 bc 00 2c bc 94
E: 7.456964 10 02 e0 5c 80 49 ca 00 2c bb 96
E: 7.463965 10 02 e0 5d c7 49 b7 00 2c 3e 95
E: 7.471959 10 02 e0 5e fb 49 90 00 2b bd 91
E: 7.478963 10 02 e0 60 16 49 4e 00 2b bc 97
E: 7.485963 10 02 e0 61 2e 48 f2 00 2a bd 98
E: 7.492963 10 02 e0 62 33 48 7f 00 2a 3e 9e
E: 7.499963 10 02 e0 63 32 47 f1 00 2a bd 92
E: 7.506964 10 02 e0 64 26 47 59 00 2a 3c 8e
E: 7.514960 10 02 e0 65 21 46 ae 00 29 bc 8c
E: 7.521962 10 02 e0 66 23 45 fb 00 29 bc 8a
E: 7.528964 10 02 e0 67 0d 45 35 00 29 bc 8a
E: 7.535964 10 02 e0 67 e5 44 62 00 29 bd 91
E: 7.542964 10 02 e0 68 98 43 8d 00 29 be 8f
E: 7.549963 10 02 e0 69 49 42 ba 00 2a 3e 85
E: 7.557963 10 02 e0 69 e1 41 fa 00 29 3e 85
E: 7.564959 10 02 e0 6a 5e 41 3b 00 28 40 87
E: 7.571921 10 02 e0 6a b4 40 8a 00 27 42 88
E: 7.578963 10 02 e0 6a f0 3f d1 00 27 c3 8b
E: 7.585963 10 02 e0 6b 1d 3f 2f 00 28 c3 80
E: 7.592962 10 02 e0 6b 31 3e 97 00 28 c3 76
E: 7.600963 10 02 e0 6b 37 3e 06 00 28 c4 71
E: 7.607963 10 02 e0 6b 2d 3d 81 00 28 c5 6d
E: 7.614959 10 02 e0 6b 15 3d 05 00 29 46 68
E: 7.621921 10 02 e0 6a f2 3c 9f 00 29 c6 6b
E: 7.628964 10 02 e0 6a c8 3c 48 00 2a c5 6f
E: 7.635963 10 02 e0 6a 9b 3b f0 00 2a c5 6f
E: 7.643964 10 02 e0 6a 6a 3b a3 00 2a c6 76
E: 7.650963 10 02 e0 6a 31 3b 57 00 2a c7 73
E: 7.657963 10 02 e0 69 ea 3b 12 00 2a 47 6f
E: 7.664959 10 02 e0 69 ab 3a d4 00 2a 47 6a
E: 7.671962 10 02 e0 69 6f 3a 96 00 2a 47 69
E: 7.678962 10 02 e0 69 2f 3a 65 00 29 c7 6a
E: 7.686963 10 02 e0 68 f9 3a 31 00 29 c8 69
E: 7.693964 10 02 e0 68 bd 3a 03 00 29 c8 69
E: 7.700962 10 02 e0 68 84 39 e0 00 29 c8 6a
E: 7.707963 10 02 e0 68 4f 39 c0 00 29 c8 6e
E: 7.714958 10 02 e0 68 12 39 a6 00 29 c9 6a
E: 7.721963 10 02 e0 67 d4 39 90 00 29 c9 6b
E: 7.729963 10 02 e0 67 97 39 77 00 2a 49 6d
E: 7.736963 10 02 e0 67 5e 39 65 00 2a 4a 6e
E: 7.743962 10 02 e0 67 2c 39 57 00 2a ca 6e
E: 7.750962 10 02 e0 67 0a 39 4c 00 2a ca 6f
E: 7.757962 10 02 e0 66 e9 39 49 00 2b 4a 6e
E: 7.764958 10 02 e0 66 d4 39 49 00 2b 4a 6c
E: 7.772962 10 02 e0 66 bf 39 4b 00 2b ca 6f
E: 7.773961 10 0c 00 00 00 00 00 08 00 00 00
E: 7.779898 10 02 e0 66 ab 39 50 00 2b cb 6d
E: 7.786959 10 02 e0 66 98 39 5c 00 2b cb 6c
E: 7.793892 10 02 e0 66 7d 39 6a 00 2c 4b 6f
E: 7.800959 10 02 e0 66 66 39 7d 00 2c 4b 6c
E: 7.807963 10 02 e0 66 48 39 94 00 2c cb 6e
E: 7.815962 10 02 e0 66 2b 39 a8 00 2c cb 73
E: 7.822958 10 02 e0 66 0a 39 c0 00 2c cb 71
E: 7.829961 10 02 e0 65 de 39 d7 00 2d 4c 70
E: 7.836963 10 02 e0 65 b6 39 f0 00 2d 4c 76
E: 7.843960 10 02 e0 65 89 3a 11 00 2d 4d 76
E: 7.850963 10 02 e0 65 60 3a 30 00 2c cd 7b
E: 7.858962 10 02 e0 65 40 3a 56 00 2c 4d 78
E: 7.865960 10 02 e0 65 16 3a 85 00 2b cd 7c
E: 7.872957 10 02 e0 64 ee 3a b3 00 2b 4d 7f
E: 7.879963 10 02 e0 64 c1 3a ed 00 2a cc 83
E: 7.886961 10 02 e0 64 88 3b 2c 00 2a 4c 85
E: 7.893961 10 02 e0 64 4c 3b 6b 00 2a 4c 89
E: 7.901962 10 02 e0 64 09 3b b5 00 29 ca 8c
E: 7.908963 10 02 e0 63 c6 3b ff 00 29 ca 90
E: 7.915964 10 02 e0 63 7d 3c 52 00 2a 46 8a
E: 7.922960 10 02 e0 63 2c 3c aa 00 2a c6 85
E: 7.929963 10 02 e0 62 e8 3d 0d 00 2b 46 87
E: 7.936960 10 02 e0 62 9d 3d 73 00 2b c6 87
E: 7.944965 10 02 e0 62 5a 3d d6 00 2c 47 86
E: 7.951961 10 02 e0 62 1c 3e 3f 00 2c c7 87
E: 7.958962 10 02 e0 61 db 3e ae 00 2d 47 8b
E: 7.965962 10 02 e0 61 a0 3f 19 00 2d c8 8c
E: 7.972958 10 02 e0 61 60 3f 8b 00 2d cb 8f
E: 7.979962 10 02 e0 61 26 40 09 00 2d 4b 92
E: 7.987960 10 02 e0 60 ee 40 88 00 2d 4a 90
E: 7.994960 10 02 e0 60 bc 40 f7 00 2c ca 8f
E: 8.001960 10 02 e0 60 8b 41 6d 00 2c 4a 8a
E: 8.008960 10 02 e0 60 64 41 e3 00 2b ca 88
E: 8.015961 10 02 e0 60 40 42 54 00 2b 49 89
E: 8.022957 10 02 e0 60 24 42 c4 00 2a c9 8a
E: 8.030962 10 02 e0 60 14 43 2c 00 2a 49 89
E: 8.037962 10 02 e0 60 05 43 98 00 2a c8 8c
E: 8.044961 10 02 e0 60 02 44 0b 00 2a c8 94
E: 8.051960 10 02 e0 60 02 44 6e 00 2b 47 96
E: 8.058960 10 02 e0 60 03 44 cb 00 2b 47 92
E: 8.065960 10 02 e0 60 16 45 35 00 2b 46 8c
E: 8.073961 10 02 e0 60 2d 45 98 00 2b c6 8d
E: 8.080960 10 02 e0 60 46 45 ed 00 2b 46 8b
E: 8.087961 10 02 e0 60 68 46 46 00 2b 46 89
E: 8.094961 10 02 e0 60 87 46 98 00 2b 46 89
E: 8.101960 10 02 e0 60 af 46 e9 00 2b 46 8a
E: 8.108961 10 02 e0 60 d7 47 37 00 2a c6 8a
E: 8.116960 10 02 e0 61 05 47 7e 00 2a c6 8b
E: 8.123960 10 02 e0 61 34 47 b8 00 2a c5 8a
E: 8.130962 10 02 e0 61 6f 47 e7 00 2a 44 8b
E: 8.137962 10 02 e0 61 ba 48 10 00 29 c4 8e
E: 8.144962 10 02 e0 62 0f 48 2d 00 29 c4 8a
E: 8.151962 10 02 e0 62 72 48 3b 00 2a 43 89
E: 8.159960 10 02 e0 62 ce 48 42 00 2a c3 89
E: 8.166961 10 02 e0 63 3a 48 3a 00 2a c3 88
E: 8.173960 10 02 e0 63 a4 48 25 00 2b 42 86
E: 8.180960 10 02 e0 64 14 48 00 00 2b c2 87
E: 8.187960 10 02 e0 64 89 47 d2 00 2b c2 83
E: 8.194960 10 02 e0 65 04 47 9c 00 2c 42 7e
E: 8.202961 10 02 e0 65 80 47 56 00 2c 42 7f
E: 8.209961 10 02 e0 65 f9 47 0e 00 2b 42 7a
E: 8.216960 10 02 e0 66 62 46 b4 00 2b 42 77
E: 8.223960 10 02 e0 66 c8 46 51 00 2b 43 7a
E: 8.230960 10 02 e0 67 2b 45 ec 00 2b 43 7a
E: 8.237960 10 02 e0 67 8b 45 83 00 2b c4 7b
E: 8.245959 10 02 e0 67 e4 45 1b 00 2b c4 7e
E: 8.252960 10 02 e0 68 3c 44 b3 00 2b c5 82
E: 8.259960 10 02 e0 68 8b 44 44 00 2c 45 87
E: 8.266959 10 02 e0 68 e3 43 d5 00 2c 46 80
E: 8.273960 10 02 e0 69 32 43 65 00 2c 46 7c
E: 8.280959 10 02 e0 69 7d 42 f4 00 2b c6 7b
E: 8.288960 10 02 e0 69 bc 42 89 00 2b 47 77
E: 8.295959 10 02 e0 69 f4 42 19 00 2a c7 76
E: 8.302960 10 02 e0 6a 1b 41 af 00 2a 47 7b
E: 8.309959 10 02 e0 6a 38 41 49 00 29 c7 78
E: 8.316960 10 02 e0 6a 47 40 dc 00 29 c7 7e
E: 8.323960 10 02 e0 6a 50 40 73 00 29 c6 84
E: 8.331955 10 02 e0 6a 4a 40 03 00 29 47 8f
E: 8.338960 10 02 e0 6a 42 3f 96 00 29 47 87
E: 8.345963 10 02 e0 6a 2f 3f 29 00 29 47 86
E: 8.352959 10 02 e0 6a 1a 3e c6 00 29 47 86
E: 8.359960 10 02 e0 6a 02 3e 66 00 29 46 85
E: 8.366961 10 02 e0 69 e0 3d f6 00 29 c8 85
E: 8.374961 10 02 e0 69 be 3d 8c 00 29 c9 88
E: 8.381960 10 02 e0 69 9b 3d 27 00 29 c9 88
E: 8.388960 10 02 e0 69 72 3c c7 00 29 ca 8a
E: 8.395959 10 02 e0 69 4c 3c 68 00 29 ca 8e
E: 8.402959 10 02 e0 69 2a 3c 16 00 29 cb 97
E: 8.409959 10 02 e0 69 01 3b c0 00 29 cc 96
E: 8.417959 10 02 e0 68 dd 3b 67 00 29 cd 99
E: 8.424959 10 02 e0 68 ba 3b 10 00 29 4b 91
E: 8.431958 10 02 e0 68 91 3a bf 00 29 ca 94
E: 8.438959 10 02 e0 68 69 3a 6e 00 29 ca 91
E: 8.439932 10 0c 00 00 00 00 00 00 00 00 00
E: 8.445898 10 02 e0 68 44 3a 1a 00 2a 4a 94
E: 8.452889 10 02 e0 68 1a 39 d5 00 2a c9 95
E: 8.459888 10 02 e0 67 f9 39 95 00 2a c9 97
E: 8.467888 10 02 e0 67 cd 39 44 00 2b 49 97
E: 8.474889 10 02 e0 67 a8 39 02 00 2b c9 96
E: 8.481890 10 02 e0 67 87 38 c0 00 2b ca 9a
E: 8.488893 10 02 e0 67 62 38 80 00 2c 4b 9b
E: 8.495886 10 02 e0 67 47 38 3f 00 2c cc 9c
E: 8.503891 10 02 e0 67 31 38 0a 00 2c cd 9a
E: 8.510888 10 02 e0 67 1b 37 d4 00 2d 4e 9c
E: 8.517893 10 02 e0 67 0a 37 90 00 2d ce a1
E: 8.524893 10 02 e0 66 f9 37 5b 00 2d ce 9a
E: 8.531897 10 02 e0 66 eb 37 2a 00 2e 4e 9b
E: 8.538896 10 02 e0 66 d8 36 fa 00 2e 4d 96
E: 8.546887 10 02 e0 66 cb 36 d1 00 2e cc 97
E: 8.553886 10 02 e0 66 b7 36 a8 00 2e cb 93
E: 8.560894 10 02 e0 66 a4 36 7f 00 2e ca 93
E: 8.567887 10 02 e0 66 95 36 54 00 2f 4a 8d
E: 8.574891 10 02 e0 66 88 36 2d 00 2f 49 8f
E: 8.581896 10 02 e0 66 79 36 09 00 2f 49 89
E: 8.589915 10 02 e0 66 6f 35 ea 00 2f 49 8b
E: 8.596917 10 02 e0 66 63 35 c9 00 2f ca 89
E: 8.603894 10 02 e0 66 54 35 ac 00 2f ca 8a
E: 8.610909 10 02 e0 66 44 35 95 00 2f cb 88
E: 8.617911 10 02 e0 66 39 35 6d 00 2f cb 89
E: 8.624957 10 02 e0 66 2a 35 59 00 2f cc 8a
E: 8.632958 10 02 e0 66 1d 35 47 00 30 4c 89
E: 8.639957 10 02 e0 66 0f 35 39 00 30 4c 8b
E: 8.646959 10 02 e0 66 05 35 2d 00 30 4d 8b
E: 8.653958 10 02 e0 65 f9 35 26 00 30 4d 88
E: 8.660958 10 02 e0 65 e9 35 20 00 30 4d 89
E: 8.667957 10 02 e0 65 e2 35 1b 00 30 4d 8b
E: 8.675957 10 02 e0 65 df 35 15 00 30 4d 89
E: 8.682957 10 02 e0 65 e0 35 17 00 30 4d 8f
E: 8.689958 10 02 e0 65 df 35 18 00 30 4d 8b
E: 8.696957 10 02 e0 65 e7 35 1c 00 30 4d 8b
E: 8.703957 10 02 e0 65 ea 35 1c 00 30 4d 8c
E: 8.710958 10 02 e0 65 f0 35 1d 00 30 4d 8e
E: 8.717957 10 02 e0 65 f8 35 1e 00 30 4d 8f
E: 8.725957 10 02 e0 65 fc 35 28 00 30 4d 8a
E: 8.732958 10 02 e0 66 00 35 2f 00 30 4d 8b
E: 8.739957 10 02 e0 66 04 35 38 00 30 4d 8e
E: 8.746957 10 02 e0 66 09 35 41 00 30 4d 89
E: 8.753957 10 02 e0 66 03 35 4e 00 30 4d 88
E: 8.760957 10 02 e0 66 00 35 55 00 30 4d 89
E: 8.768958 10 02 e0 66 00 35 63 00 30 4d 8a
E: 8.775961 10 02 e0 65 f3 35 68 00 30 4d 87
E: 8.782960 10 02 e0 65 ee 35 75 00 30 4d 85
E: 8.789957 10 02 e0 65 e4 35 7e 00 30 4d 86
E: 8.796958 10 02 e0 65 e1 35 88 00 30 4d 86
E: 8.803957 10 02 e0 65 d2 35 91 00 30 4d 87
E: 8.811958 10 02 e0 65 ce 35 93 00 30 4d 85
E: 8.818961 10 02 e0 65 c9 35 98 00 30 4d 89
E: 8.825958 10 02 e0 65 c2 35 a0 00 30 4d 87
E: 8.832956 10 02 e0 65 bf 35 a7 00 30 4d 8a
E: 8.839957 10 02 e0 65 bc 35 ac 00 30 4d 84
E: 8.846955 10 02 e0 65 b3 35 b4 00 30 4e 8b
E: 8.854958 10 02 e0 65 ae 35 b8 00 2f 4e 89
E: 8.861956 10 02 e0 65 a5 35 be 00 2e 4e 88
E: 8.868957 10 02 e0 65 a2 35 c7 00 2d cd 8a
E: 8.875957 10 02 e0 65 9c 35 cc 00 2c cd 8b
E: 8.882956 10 02 e0 65 99 35 cb 00 2b cd 8a
E: 8.889957 10 02 e0 65 99 35 c8 00 2b 4d 8a
E: 8.897952 10 02 e0 65 9a 35 c7 00 2a 4d 8a
E: 8.904956 10 02 e0 65 9a 35 c6 00 29 4c 8b
E: 8.911957 10 02 e0 65 9c 35 b6 00 29 4c 89
E: 8.918957 10 02 e0 65 9e 35 b3 00 29 4c 89
E: 8.925956 10 02 e0 65 9f 35 a8 00 29 4c 85
E: 8.932956 10 02 e0 65 9f 35 9d 00 29 4c 8b
E: 8.940921 10 02 e0 65 a4 35 8e 00 29 4c 85
E: 8.947954 10 02 e0 65 ae 35 7b 00 29 4c 8a
E: 8.954957 10 02 e0 65 b3 35 5f 00 29 4c 8b
E: 8.961958 10 02 e0 65 c6 35 3d 00 29 4c 89
E: 8.968958 10 02 e0 65 d8 35 1e 00 29 4c 8a
E: 8.975956 10 02 e0 65 f4 34 f3 00 29 4c 8e
E: 8.983956 10 02 e0 66 06 34 c5 00 29 4c 8c
E: 8.990885 10 02 e0 66 18 34 8a 00 2a 4d 8d
E: 8.997953 10 02 e0 66 1d 34 4a 00 2b 4d 91
E: 9.004957 10 02 e0 66 1f 34 0b 00 2c 4d 90
E: 9.011958 10 02 e0 66 15 33 be 00 2d 4e 96
E: 9.018957 10 02 e0 66 05 33 77 00 2e 4e 9b
E: 9.026956 10 02 e0 65 e0 33 31 00 2f 4f 9d
E: 9.033956 10 02 e0 65 b0 32 e1 00 2f cf 97
E: 9.040938 10 02 e0 65 72 32 8a 00 30 d0 94
E: 9.047953 10 02 e0 65 2b 32 31 00 2f d0 90
E: 9.054956 10 02 e0 64 dc 31 d9 00 2e d0 8d
E: 9.061957 10 02 e0 64 7e 31 89 00 2e 50 8b
E: 9.069955 10 02 e0 64 19 31 3f 00 2d 50 85
E: 9.076956 10 02 e0 63 a3 31 04 00 2c d0 84
E: 9.083955 10 02 e0 63 19 30 c6 00 2c 51 80
E: 9.090953 10 02 e0 62 7f 30 9d 00 2c 51 80
E: 9.097951 10 02 e0 61 db 30 85 00 2b d1 85
E: 9.104957 10 02 e0 61 27 30 74 00 2c d3 84
E: 9.112956 10 02 e0 60 6c 30 7b 00 2c d4 85
E: 9.119955 10 02 e0 5f bc 30 8e 00 2d 54 86
E: 9.126955 10 02 e0 5f 12 30 b2 00 2d d5 86
E: 9.133956 10 02 e0 5e 6d 30 e6 00 2e 56 87
E: 9.140956 10 02 e0 5d da 31 2c 00 2e 56 84
E: 9.147952 10 02 e0 5d 4d 31 78 00 2e d6 82
E: 9.155955 10 02 e0 5c c8 31 cd 00 2e d6 86
E: 9.162956 10 02 e0 5c 5b 32 22 00 2e 56 84
E: 9.169955 10 02 e0 5b fe 32 7b 00 2e 56 86
E: 9.176957 10 02 e0 5b ae 32 df 00 2e 55 88
E: 9.183954 10 02 e0 5b 72 33 4d 00 2e 54 91
E: 9.190954 10 02 e0 5b 3b 33 bb 00 2e 54 87
E: 9.198955 10 02 e0 5b 1d 34 3f 00 2d d4 85
E: 9.205954 10 02 e0 5b 06 34 cd 00 2d d3 80
E: 9.212956 10 02 e0 5a f9 35 64 00 2d d3 81
E: 9.219955 10 02 e0 5a ff 35 ef 00 2d d3 81
E: 9.226958 10 02 e0 5b 0a 36 85 00 2e 52 84
E: 9.233956 10 02 e0 5b 26 37 19 00 2e 52 8c
E: 9.241952 10 02 e0 5b 4d 37 a3 00 2e d1 94
E: 9.248957 10 02 e0 5b 7d 38 27 00 2e d1 8c
E: 9.255956 10 02 e0 5b bf 38 97 00 2e 50 8e
E: 9.262956 10 02 e0 5c 08 38 fd 00 2e 50 8e
E: 9.269956 10 02 e0 5c 56 39 5c 00 2d cf 8e
E: 9.276955 10 02 e0 5c b0 39 b8 00 2d cf 8f
E: 9.284955 10 02 e0 5d 12 3a 17 00 2d 4e 8c
E: 9.291951 10 02 e0 5d 75 3a 71 00 2c cd 92
E: 9.298956 10 02 e0 5d d4 3a c6 00 2c 4d 91
E: 9.305954 10 02 e0 5e 39 3b 1a 00 2c cc 90
E: 9.312954 10 02 e0 5e 98 3b 68 00 2d 4b 9a
E: 9.319955 10 02 e0 5e f9 3b ae 00 2d 4a 9b
E: 9.327954 10 02 e0 5f 55 3b f3 00 2d c9 9f
E: 9.334955 10 02 e0 5f ad 3c 31 00 2d c4 96
E: 9.341950 10 02 e0 60 01 3c 72 00 2e 45 96
E: 9.348955 10 02 e0 60 52 3c ac 00 2e c5 96
E: 9.355955 10 02 e0 60 af 3c e4 00 2e 45 94
E: 9.362951 10 02 e0 61 08 3d 13 00 2d c5 97
E: 9.370954 10 02 e0 61 66 3d 3e 00 2c c6 90
E: 9.377954 10 02 e0 61 bb 3d 65 00 2b c7 90
E: 9.384954 10 02 e0 62 11 3d 8e 00 2b 47 8d
E: 9.391951 10 02 e0 62 60 3d b2 00 2b cb 8f
E: 9.398955 10 02 e0 62 a8 3d d7 00 2c 4b 8d
E: 9.405954 10 02 e0 62 eb 3d ff 00 2c 4b 8f
E: 9.413950 10 02 e0 63 27 3e 1f 00 2c cb 8f
E: 9.420955 10 02 e0 63 67 3e 41 00 2d 4b 8f
E: 9.427953 10 02 e0 63 9b 3e 65 00 2d ca 88
E: 9.434953 10 02 e0 63 cc 3e 83 00 2e ca 8e
E: 9.441949 10 02 e0 64 06 3e 9c 00 2e cb 8c
E: 9.448953 10 02 e0 64 3a 3e b5 00 2e 4a 8e
E: 9.456955 10 02 e0 64 78 3e cd 00 2d ca 8d
E: 9.463954 10 02 e0 64 ae 3e de 00 2d 4a 90
E: 9.470953 10 02 e0 64 ee 3e f1 00 2c c9 91
E: 9.477955 10 02 e0 65 27 3f 06 00 2c 49 92
E: 9.484954 10 02 e0 65 69 3f 10 00 2b c9 91
E: 9.491950 10 02 e0 65 a3 3f 1a 00 2b 49 91
E: 9.499953 10 02 e0 65 db 3f 23 00 2a c9 90
E: 9.506953 10 02 e0 66 12 3f 29 00 2a c8 93
E: 9.513953 10 02 e0 66 42 3f 29 00 2b 48 91
E: 9.520954 10 02 e0 66 74 3f 29 00 2c 48 92
E: 9.527952 10 02 e0 66 a2 3f 25 00 2c c8 92
E: 9.534954 10 02 e0 66 d7 3f 1e 00 2d 48 92
E: 9.542953 10 02 e0 67 0d 3f 12 00 2e 48 90
E: 9.549954 10 02 e0 67 3f 3f 05 00 2e c8 93
E: 9.556953 10 02 e0 67 76 3e f6 00 2f 48 91
E: 9.563953 10 02 e0 67 a8 3e e1 00 2f c8 8e
E: 9.570954 10 02 e0 67 e0 3e cd 00 2f 48 91
E: 9.577952 10 02 e0 68 12 3e bd 00 2e c8 8f
E: 9.585953 10 02 e0 68 4f 3e 9d 00 2e 49 88
E: 9.592953 10 02 e0 68 8a 3e 7c 00 2d c9 89
E: 9.599953 10 02 e0 68 c0 3e 50 00 2d 49 8a
E: 9.606954 10 02 e0 68 f6 3e 20 00 2c c9 84
E: 9.613953 10 02 e0 69 2b 3d e1 00 2c 4a 85
E: 9.620953 10 02 e0 69 69 3d 93 00 2b ca 86
E: 9.621908 10 0c 00 00 00 00 00 10 00 00 00
E: 9.628882 10 02 e0 69 a2 3d 41 00 2b 4b 87
E: 9.635953 10 02 e0 69 e8 3c e4 00 2a cb 84
E: 9.642889 10 02 e0 6a 2c 3c 84 00 2a 4b 85
E: 9.649895 10 02 e0 6a 69 3c 22 00 2a 4b 8a
E: 9.656887 10 02 e0 6a 9d 3b c1 00 2a 4c 8b
E: 9.663883 10 02 e0 6a c8 3b 59 00 2a 4c 85
E: 9.671878 10 02 e0 6a ee 3a f3 00 2a cc 83
E: 9.678886 10 02 e0 6b 04 3a 97 00 2b 4c 7c
E: 9.685879 10 02 e0 6b 12 3a 29 00 2b 4c 78
E: 9.692880 10 02 e0 6b 15 39 c1 00 2b cc 78
E: 9.699874 10 02 e0 6b 0d 39 5d 00 2c 4c 7c
E: 9.706900 10 02 e0 6a fd 38 f5 00 2c cd 7c
E: 9.714883 10 02 e0 6a e3 38 90 00 2c 4d 81
E: 9.721887 10 02 e0 6a c3 38 38 00 2c ce 84
E: 9.728880 10 02 e0 6a 9e 37 ec 00 2c cf 8a
E: 9.735881 10 02 e0 6a 70 37 8b 00 2c d0 8c
E: 9.742887 10 02 e0 6a 34 37 45 00 2d 50 8a
E: 9.749963 10 02 e0 69 dc 37 05 00 2d 50 89
E: 9.757891 10 02 e0 69 81 36 cf 00 2c d0 88
E: 9.764882 10 02 e0 69 21 36 a5 00 2c cf 84
E: 9.771880 10 02 e0 68 c2 36 89 00 2c 4f 86
E: 9.778878 10 02 e0 68 62 36 73 00 2c 4e 88
E: 9.785888 10 02 e0 67 f0 36 68 00 2b ce 84
E: 9.792882 10 02 e0 67 86 36 69 00 2b cd 88
E: 9.800884 10 02 e0 67 16 36 74 00 2b cd 88
E: 9.807879 10 02 e0 66 ad 36 89 00 2b cd 88
E: 9.814899 10 02 e0 66 41 36 a4 00 2c cd 8b
E: 9.821891 10 02 e0 65 da 36 c3 00 2d 4d 90
E: 9.828883 10 02 e0 65 72 36 ef 00 2d cd 92
E: 9.835870 10 02 e0 65 0f 37 27 00 2d 4d 94
E: 9.843879 10 02 e0 64 b2 37 6b 00 2d 4d 99
E: 9.850894 10 02 e0 64 5a 37 ca 00 2d 4c 9c
E: 9.857883 10 02 e0 64 06 38 1a 00 2c c9 9a
E: 9.864882 10 02 e0 63 b4 38 7b 00 2c c9 96
E: 9.871879 10 02 e0 63 75 38 da 00 2c 4a 96
E: 9.878882 10 02 e0 63 39 39 3c 00 2b ca 95
E: 9.886887 10 02 e0 62 f7 39 aa 00 2b cb 96
E: 9.893884 10 02 e0 62 c1 3a 0f 00 2c 4b 95
E: 9.900883 10 02 e0 62 94 3a 7e 00 2d 4b 96
E: 9.907871 10 02 e0 62 71 3a ef 00 2d cb 9b
E: 9.914898 10 02 e0 62 55 3b 65 00 2d cf 9f
E: 9.921890 10 02 e0 62 47 3b d7 00 2e 4d a0
E: 9.929885 10 02 e0 62 3b 3c 44 00 2e cd 9b
E: 9.936874 10 02 e0 62 38 3c bd 00 2e cd 99
E: 9.943883 10 02 e0 62 33 3d 2f 00 2f 4d 97
E: 9.950959 10 02 e0 62 39 3d aa 00 2f 4d 97
E: 9.957888 10 02 e0 62 3a 3e 1a 00 2f cd 95
E: 9.964878 10 02 e0 62 40 3e 87 00 2f cd 9a
E: 9.972880 10 02 e0 62 4d 3e ed 00 2f cd 9b
E: 9.979880 10 02 e0 62 57 3f 4b 00 2f ce 9c
E: 9.986889 10 02 e0 62 6a 3f b8 00 30 4d a1
E: 9.993883 10 02 e0 62 7f 40 17 00 30 4c a7
E: 10.000874 10 02 e0 62 98 40 76 00 30 4c a1
E: 10.007871 10 02 e0 62 ba 40 c8 00 2f cc a2
E: 10.015961 10 02 e0 62 e2 41 15 00 2f cc a3
E: 10.022890 10 02 e0 63 08 41 53 00 2f cc 9d
E: 10.029884 10 02 e0 63 37 41 92 00 2f 4d 9d
E: 10.036879 10 02 e0 63 58 41 d0 00 2f 4d 9d
E: 10.043877 10 02 e0 63 7f 42 05 00 2e ce 9f
E: 10.050887 10 02 e0 63 a1 42 33 00 2e 4e 9e
E: 10.051885 10 0c 00 00 00 00 00 00 00 00 00
E: 10.057885 10 02 e0 63 c7 42 60 00 2d ce 9f
E: 10.065873 10 02 e0 63 e9 42 90 00 2d cd a1
E: 10.072881 10 02 e0 64 0a 42 b1 00 2d 4d a3
E: 10.079880 10 02 e0 64 29 42 d5 00 2c cc 9f
E: 10.086883 10 02 e0 64 4b 42 fb 00 2c cb a2
E: 10.093883 10 02 e0 64 6f 43 16 00 2c 4b 9f
E: 10.100878 10 02 e0 64 91 43 29 00 2b ca 9f
E: 10.108880 10 02 e0 64 bc 43 3c 00 2b c9 98
E: 10.115881 10 02 e0 64 e5 43 44 00 2b 49 9d
E: 10.122886 10 02 e0 65 0e 43 41 00 2b 49 99
E: 10.129883 10 02 e0 65 34 43 44 00 2a c8 98
E: 10.136878 10 02 e0 65 6c 43 2e 00 2a 48 95
E: 10.143879 10 02 e0 65 9c 43 1a 00 29 c8 94
E: 10.151882 10 02 e0 65 d2 43 03 00 29 c8 92
E: 10.158883 10 02 e0 66 02 42 e2 00 29 48 92
E: 10.165882 10 02 e0 66 31 42 b9 00 28 c8 92
E: 10.172877 10 02 e0 66 53 42 91 00 29 c8 8b
E: 10.179869 10 02 e0 66 77 42 60 00 2a c9 86
E: 10.186879 10 02 e0 66 94 42 2b 00 2b 49 86
E: 10.194883 10 02 e0 66 af 41 f2 00 2c 49 84
E: 10.201871 10 02 e0 66 cb 41 b5 00 2c ca 86
E: 10.208872 10 02 e0 66 e9 41 71 00 2d ca 81
E: 10.215896 10 02 e0 67 04 41 29 00 2e 4b 87
E: 10.222884 10 02 e0 67 17 40 dc 00 2e cb 86
E: 10.229882 10 02 e0 67 2b 40 91 00 2e cc 88
E: 10.237879 10 02 e0 67 40 40 3c 00 2e 4d 8d
E: 10.244877 10 02 e0 67 53 3f d7 00 2e 4d 8f
E: 10.251876 10 02 e0 67 65 3f 7e 00 2d cd 89
E: 10.258883 10 02 e0 67 74 3f 25 00 2d cc 84
E: 10.265880 10 02 e0 67 7f 3e c7 00 2d cc 84
E: 10.273877 10 02 e0 67 86 3e 66 00 2d 4c 81
E: 10.280880 10 02 e0 67 86 3e 0c 00 2d 4c 80
E: 10.287883 10 02 e0 67 86 3d ac 00 2d 4b 80
E: 10.294884 10 02 e0 67 7f 3d 4a 00 2d 4b 87
E: 10.301875 10 02 e0 67 7b 3c e9 00 2d 4b 86
E: 10.308876 10 02 e0 67 79 3c 87 00 2d 4c 84
E: 10.316888 10 02 e0 67 73 3c 24 00 2d 4c 88
E: 10.323868 10 02 e0 67 6b 3b c5 00 2d 4d 92
E: 10.330873 10 02 e0 67 61 3b 5f 00 2d 4d 91
E: 10.337880 10 02 e0 67 53 3a f9 00 2d 4d 8c
E: 10.344879 10 02 e0 67 42 3a 9b 00 2d 4d 88
E: 10.351898 10 02 e0 67 35 3a 44 00 2d 4c 88
E: 10.359895 10 02 e0 67 28 39 e5 00 2d 4c 87
E: 10.366897 10 02 e0 67 1c 39 92 00 2d 4c 84
E: 10.373876 10 02 e0 67 0c 39 36 00 2d cc 89
E: 10.380878 10 02 e0 67 00 38 dd 00 2d cc 8a
E: 10.387876 10 02 e0 66 ee 38 7e 00 2d cc 8e
E: 10.394877 10 02 e0 66 e3 38 27 00 2d cd 92
E: 10.402884 10 02 e0 66 d3 37 cc 00 2d ce 91
E: 10.409871 10 02 e0 66 c1 37 59 00 2e 4f 97
E: 10.416869 10 02 e0 66 b3 36 f9 00 2e 4e 90
E: 10.423889 10 02 e0 66 a4 36 9b 00 2e 4e 8c
E: 10.430908 10 02 e0 66 8d 36 3a 00 2e ce 8f
E: 10.437885 10 02 e0 66 74 35 dd 00 2e ce 8b
E: 10.444876 10 02 e0 66 5b 35 89 00 2e ce 88
E: 10.452868 10 02 e0 66 38 35 30 00 2f 4d 88
E: 10.459987 10 02 e0 66 11 34 d0 00 2f 4d 8e
E: 10.466947 10 02 e0 65 ea 34 82 00 2f cd 8e
E: 10.473892 10 02 e0 65 c3 34 37 00 2f cd 8f
E: 10.480898 10 02 e0 65 91 33 eb 00 2f cf 92
E: 10.481955 10 0c 00 00 00 00 00 20 00 00 00
E: 10.487885 10 02 e0 65 66 33 af 00 2f 50 96
E: 10.495945 10 02 e0 65 37 33 71 00 2e 51 95
E: 10.502884 10 02 e0 65 05 33 40 00 2d d1 9b
E: 10.509889 10 02 e0 64 d2 33 0d 00 2d 51 99
E: 10.516882 10 02 e0 64 9e 32 e1 00 2c 51 94
E: 10.523876 10 02 e0 64 66 32 b6 00 2b d0 93
E: 10.530867 10 02 e0 64 2f 32 8e 00 2b 50 8f
E: 10.538900 10 02 e0 63 f6 32 6e 00 2a 4f 8f
E: 10.545907 10 02 e0 63 b8 32 51 00 2a ce 8c
E: 10.552889 10 02 e0 63 71 32 3c 00 2b 4e 8a
E: 10.559877 10 02 e0 63 26 32 2b 00 2b cd 88
E: 10.566876 10 02 e0 62 d7 32 20 00 2b cd 87
E: 10.573874 10 02 e0 62 88 32 1d 00 2c 4d 84
E: 10.581896 10 02 e0 62 35 32 1f 00 2c cd 84
E: 10.588883 10 02 e0 61 e4 32 24 00 2d 4d 85
E: 10.595877 10 02 e0 61 92 32 2d 00 2d ce 81
E: 10.602876 10 02 e0 61 38 32 38 00 2d ce 86
E: 10.609872 10 02 e0 60 da 32 45 00 2d 4e 86
E: 10.616954 10 02 e0 60 7b 32 51 00 2d 4e 80
E: 10.624886 10 02 e0 60 19 32 61 00 2c ce 86
E: 10.631882 10 02 e0 5f b9 32 72 00 2c ce 88
E: 10.638875 10 02 e0 5f 4a 32 80 00 2c 4e 8d
E: 10.645880 10 02 e0 5e d6 32 a3 00 2c 4e 92
E: 10.652878 10 02 e0 5e 54 32 c8 00 2c 4d 96
E: 10.659883 10 02 e0 5d c7 32 fd 00 2c 4d 9c
E: 10.667875 10 02 e0 5d 22 33 41 00 2d 4d a2
E: 10.674874 10 02 e0 5c 76 33 8a 00 2d cd 9e
E: 10.681903 10 02 e0 5b c9 33 e2 00 2d cd 9f
E: 10.688882 10 02 e0 5b 2e 34 53 00 2d ce 9e
E: 10.695881 10 02 e0 5a 7f 34 d5 00 2d ce 9b
E: 10.702875 10 02 e0 59 cc 35 63 00 2d cf 9b
E: 10.710870 10 02 e0 59 1d 36 00 00 2e 4f 9f
E: 10.717875 10 02 e0 58 4f 36 b1 00 2d cf a0
E: 10.724880 10 02 e0 57 a0 37 78 00 2d 4f a1
E: 10.731875 10 02 e0 56 fd 38 54 00 2d 4e a1
E: 10.738868 10 02 e0 56 62 39 14 00 2d ce 9d
E: 10.745893 10 02 e0 55 cc 39 ec 00 2e ce 9b
E: 10.753886 10 02 e0 55 51 3a e3 00 2f 4d 9d
E: 10.760882 10 02 e0 54 ec 3b ea 00 2f cb ab
E: 10.767877 10 02 e0 54 95 3c ef 00 2f cb 9f
E: 10.774872 10 02 e0 54 64 3e 00 00 2f 4a 9a
E: 10.781897 10 02 e0 54 5c 3f 11 00 2f 4a 9a
E: 10.782895 10 0c 00 00 00 00 00 00 00 00 00
E: 10.788883 10 02 e0 54 6e 40 29 00 2e c9 a1
E: 10.796876 10 02 e0 54 a5 41 2b 00 2e c8 a2
E: 10.803876 10 02 e0 54 f5 42 1b 00 2d c7 9b
E: 10.810874 10 02 e0 55 5b 43 11 00 2d 47 9d
E: 10.817879 10 02 e0 55 df 44 04 00 2d 46 a4
E: 10.824883 10 02 e0 56 7b 44 e9 00 2d 44 a8
E: 10.831879 10 02 e0 57 2c 45 cb 00 2d c4 a7
E: 10.839876 10 02 e0 57 ec 46 90 00 2d c3 a9
E: 10.846872 10 02 e0 58 df 47 4a 00 2d c2 b7
E: 10.853876 10 02 e0 59 e0 47 e4 00 2c c0 c2
E: 10.860882 10 02 e0 5a de 48 7a 00 2d 3f be
E: 10.867879 10 02 e0 5b ec 48 e4 00 2d 3d ca
E: 10.874874 10 02 e0 5d 2d 49 30 00 2c 3d cd
E: 10.882903 10 02 e0 5e 83 49 73 00 2a 3e c8
E: 10.889885 10 02 e0 5f b7 49 87 00 2a 3d ca
E: 10.896871 10 02 e0 60 fc 49 85 00 29 bd ce
E: 10.903874 10 02 e0 62 60 49 74 00 29 3d cc
E: 10.910875 10 02 e0 63 8f 49 40 00 2a 3e c6
E: 10.917877 10 02 e0 64 b8 48 f9 00 29 bf c1
E: 10.925912 10 02 e0 65 e0 48 90 00 28 c0 c6
E: 10.932953 10 02 e0 67 03 48 28 00 28 c0 b9
E: 10.939884 10 02 e0 67 e3 47 87 00 2a 3f b0
E: 10.946879 10 02 e0 68 c7 46 ee 00 29 be a9
E: 10.953870 10 02 e0 69 b2 46 4d 00 29 3d a4
E: 10.960875 10 02 e0 6a a2 45 9c 00 29 3c aa
E: 10.968874 10 02 e0 6b 88 44 e0 00 27 be ab
E: 10.975881 10 02 e0 6c 50 44 12 00 27 be a5
E: 10.976880 10 0c 00 00 00 00 00 40 00 00 00
E: 10.982878 10 02 e0 6c fb 43 5b 00 27 bd 9e
E: 10.989874 10 02 e0 6d 94 42 af 00 27 bc 98
E: 10.996877 10 02 e0 6e 14 42 00 00 26 be 93
E: 11.003881 10 02 e0 6e 7a 41 63 00 25 c0 90
E: 11.011880 10 02 e0 6e be 40 c5 00 25 c0 91
E: 11.018869 10 02 e0 6e d7 40 2c 00 26 c1 9b
E: 11.025873 10 02 e0 6e d8 3f 88 00 27 c0 91
E: 11.032873 10 02 e0 6e bf 3e ee 00 27 c0 8e
E: 11.039876 10 02 e0 6e 87 3e 5e 00 28 c1 8c
E: 11.046879 10 02 e0 6e 2e 3d da 00 28 c1 8e
E: 11.054874 10 02 e0 6d a6 3d 44 00 29 c3 8f
E: 11.061873 10 02 e0 6d 19 3c cb 00 29 c4 92
E: 11.068878 10 02 e0 6c 78 3c 5d 00 2a 45 95
E: 11.075881 10 02 e0 6b cb 3b fe 00 29 46 98
E: 11.082873 10 02 e0 6a f6 3b a1 00 29 c7 9d
E: 11.089874 10 02 e0 6a 10 3b 55 00 29 c8 9f
E: 11.097872 10 02 e0 68 fd 3b 13 00 29 48 9f
E: 11.104878 10 02 e0 67 f3 3a d8 00 29 49 9e
E: 11.111879 10 02 e0 66 ec 3a ba 00 29 47 9c
E: 11.118874 10 02 e0 65 e0 3a ad 00 2a 47 9e
E: 11.125877 10 02 e0 64 ca 3a b7 00 2a c7 a1
E: 11.132953 10 02 e0 63 dd 3a cd 00 2a c6 a2
E: 11.140883 10 02 e0 63 01 3a e2 00 2a c6 a5
E: 11.147874 10 02 e0 62 2c 3b 0e 00 2b 46 a9
E: 11.154867 10 02 e0 61 40 3b 35 00 2b c6 b7
E: 11.161876 10 02 e0 60 5e 3b 6e 00 2b c6 b3
E: 11.168882 10 02 e0 5f 9a 3b bd 00 2b 45 b5
E: 11.175878 10 02 e0 5e dc 3c 17 00 2b 45 b9
E: 11.183875 10 02 e0 5e 09 3c 8a 00 2b c6 be
E: 11.190872 10 02 e0 5d 64 3c fd 00 2c c7 bd
E: 11.197891 10 02 e0 5c b5 3d 8a 00 2c c7 c9
E: 11.204873 10 02 e0 5c 21 3e 1a 00 2b c8 cb
E: 11.211878 10 02 e0 5b b0 3e 9a 00 2a c8 ca
E: 11.218872 10 02 e0 5b 70 3f 36 00 2b 48 c6
E: 11.226870 10 02 e0 5b 2e 3f cd 00 2b c8 ce
E: 11.233894 10 02 e0 5a fe 40 76 00 2b c8 c8
E: 11.234879 10 0c 00 00 00 00 00 00 00 00 00
E: 11.240880 10 02 e0 5a ef 41 0f 00 2b c8 ca
E: 11.247875 10 02 e0 5a ed 41 a9 00 2b 48 c7
E: 11.254871 10 02 e0 5a ea 42 39 00 2b 48 bf
E: 11.261873 10 02 e0 5a f2 42 d9 00 2c 47 bf
E: 11.269872 10 02 e0 5a f3 43 63 00 2c c7 b8
E: 11.276879 10 02 e0 5b 07 43 fd 00 2c c6 be
E: 11.283873 10 02 e0 5b 28 44 97 00 2d 46 c0
E: 11.290876 10 02 e0 5b 4f 45 1f 00 2c c2 b4
E: 11.297891 10 02 e0 5b 85 45 a0 00 2c c1 b2
E: 11.304879 10 02 e0 5b ce 46 23 00 2c 41 b6
E: 11.312878 10 02 e0 5c 23 46 95 00 2b c0 b0
E: 11.319872 10 02 e0 5c 88 46 f7 00 2b 40 af
E: 11.326864 10 02 e0 5d 0a 47 57 00 2a c0 b1
E: 11.333894 10 02 e0 5d 95 47 bf 00 29 c0 ac
E: 11.340877 10 02 e0 5e 2a 48 0e 00 28 42 b3
E: 11.347869 10 02 e0 5e c1 48 5b 00 28 c6 ac
E: 11.355865 10 02 e0 5f 6f 48 a9 00 29 44 ad
E: 11.362880 10 02 e0 60 05 48 e3 00 29 40 ae
E: 11.369879 10 02 e0 60 b0 49 11 00 29 40 a9
E: 11.376876 10 02 e0 61 6c 49 30 00 29 41 a9
E: 11.383876 10 02 e0 62 2d 49 49 00 28 c2 a9
E: 11.390870 10 02 e0 62 e6 49 4c 00 2a 43 a6
E: 11.398893 10 02 e0 63 96 49 47 00 2b c3 a5
E: 11.405879 10 02 e0 64 68 49 2e 00 2a c4 a5
E: 11.412877 10 02 e0 65 40 49 06 00 2a 46 a6
E: 11.419871 10 02 e0 66 23 48 c7 00 29 cb a5
E: 11.426869 10 02 e0 66 f6 48 7e 00 28 cd a1
E: 11.433880 10 02 e0 67 d1 48 24 00 29 cb a7
E: 11.441875 10 02 e0 68 7f 47 cc 00 2a 4a 99
E: 11.448864 10 02 e0 69 36 47 71 00 29 c9 91
E: 11.455864 10 02 e0 69 f4 47 07 00 28 c9 8c
E: 11.462868 10 02 e0 6a 8f 46 9e 00 28 48 8e
E: 11.469884 10 02 e0 6b 0f 46 27 00 28 c8 8d
E: 11.470873 10 0c 00 00 00 00 00 80 00 00 00
E: 11.476876 10 02 e0 6b 7f 45 b0 00 29 47 8e
E: 11.484871 10 02 e0 6b db 45 33 00 2a 46 95
E: 11.491873 10 02 e0 6c 21 44 bc 00 29 c8 95
E: 11.498869 10 02 e0 6c 4c 44 3a 00 29 c9 99
E: 11.505885 10 02 e0 6c 71 43 c7 00 29 ca 9a
E: 11.512877 10 02 e0 6c 80 43 56 00 29 ca 97
E: 11.519873 10 02 e0 6c 77 42 e7 00 2a 4a 95
E: 11.527878 10 02 e0 6c 5c 42 89 00 29 ca 90
E: 11.534876 10 02 e0 6c 2b 42 2a 00 29 ca 94
E: 11.541951 10 02 e0 6b ed 41 dd 00 29 4a 95
E: 11.548944 10 02 e0 6b 9a 41 98 00 29 4a 97
E: 11.555883 10 02 e0 6b 2c 41 54 00 29 ca 9b
E: 11.562877 10 02 e0 6a b6 41 14 00 29 cb 99
E: 11.570873 10 02 e0 6a 35 40 dd 00 2a 4c 9e
E: 11.577874 10 02 e0 69 92 40 ad 00 2a cc 9d
E: 11.584883 10 02 e0 68 f9 40 7d 00 2a 4d a0
E: 11.591879 10 02 e0 68 71 40 57 00 2a 4e a4
E: 11.598877 10 02 e0 67 eb 40 38 00 2a 4f a7
E: 11.605873 10 02 e0 67 6d 40 19 00 2a 4f a6
E: 11.613878 10 02 e0 66 ed 3f ff 00 2a 50 a8
E: 11.620953 10 02 e0 66 70 3f e3 00 2a 50 a7
E: 11.627954 10 02 e0 65 f4 3f c9 00 2a ce a4
E: 11.634886 10 02 e0 65 72 3f b3 00 2a cf a9
E: 11.641877 10 02 e0 64 f0 3f 91 00 2a cd a9
E: 11.648870 10 02 e0 64 85 3f 86 00 2a cc a9
E: 11.656870 10 02 e0 64 17 3f 73 00 2a cb af
E: 11.663864 10 02 e0 63 bd 3f 6a 00 2a 49 ae
E: 11.664890 10 0c 00 00 00 00 00 00 00 00 00
E: 11.670878 10 02 e0 63 66 3f 5b 00 2a c8 ad
E: 11.677876 10 02 e0 63 16 3f 53 00 2a 47 ad
E: 11.684874 10 02 e0 62 d0 3f 44 00 2a 47 b3
E: 11.691870 10 02 e0 62 96 3f 3e 00 2a c7 b3
E: 11.699949 10 02 e0 62 5e 3f 37 00 2b c7 af
E: 11.706879 10 02 e0 62 39 3f 30 00 2c c7 ad
E: 11.713876 10 02 e0 62 22 3f 2c 00 2d c7 ae
E: 11.720871 10 02 e0 62 0d 3f 23 00 2e 47 af
E: 11.727876 10 02 e0 62 01 3f 23 00 2e c7 aa
E: 11.734875 10 02 e0 61 fe 3f 20 00 2f 47 a9
E: 11.742876 10 02 e0 61 fb 3f 1d 00 2f c7 ad
E: 11.749875 10 02 e0 61 f8 3f 1d 00 30 48 a9
E: 11.756869 10 02 e0 61 fb 3f 1f 00 30 48 a8
E: 11.763873 10 02 e0 61 fc 3f 24 00 30 48 a9
E: 11.770873 10 02 e0 61 ff 3f 2c 00 30 48 a8
E: 11.777876 10 02 e0 62 05 3f 35 00 30 48 aa
E: 11.785870 10 02 e0 62 0a 3f 3d 00 30 48 aa
E: 11.792867 10 02 e0 62 13 3f 4b 00 30 48 aa
E: 11.799948 10 02 e0 62 1c 3f 58 00 30 48 ae
E: 11.806878 10 02 e0 62 2c 3f 65 00 30 47 ac
E: 11.813870 10 02 e0 62 36 3f 75 00 30 47 ad
E: 11.820870 10 02 e0 62 42 3f 82 00 30 47 ad
E: 11.828866 10 02 e0 62 4e 3f 90 00 30 47 ac
E: 11.835874 10 02 e0 62 57 3f 9c 00 30 47 ab
E: 11.842876 10 02 e0 62 59 3f a7 00 30 46 af
E: 11.849869 10 02 e0 62 58 3f b3 00 2f c6 ac
E: 11.856868 10 02 e0 62 54 3f bc 00 2f c6 af
E: 11.863889 10 02 e0 62 50 3f c6 00 2f c6 ae
E: 11.871876 10 02 e0 62 49 3f cf 00 2f c6 ad
E: 11.878876 10 02 e0 62 3b 3f d2 00 2f c6 af
E: 11.885869 10 02 e0 62 30 3f db 00 2f c6 ae
E: 11.892869 10 02 e0 62 1e 3f e0 00 2f c6 ad
E: 11.899891 10 02 e0 62 14 3f eb 00 2f c6 ae
E: 11.906875 10 02 e0 62 05 3f f5 00 30 46 b2
E: 11.914873 10 02 e0 61 f8 40 01 00 30 45 ac
E: 11.921869 10 02 e0 61 e9 40 0b 00 30 45 b1
E: 11.928869 10 02 e0 61 db 40 13 00 30 c5 b1
E: 11.929873 10 0c 8d 00 00 00 00 00 00 00 00
E: 11.935875 10 02 e0 61 c9 40 27 00 30 c5 b6
E: 11.942877 10 02 e0 61 b9 40 2b 00 30 c7 b2
E: 11.949869 10 02 e0 61 a4 40 34 00 30 c7 b6
E: 11.957864 10 02 e0 61 95 40 38 00 30 c7 b6
E: 11.958869 10 0c 8e 00 00 00 00 00 00 00 00
E: 11.964888 10 02 e0 61 7e 40 40 00 30 c7 b6
E: 11.971872 10 02 e0 61 63 40 45 00 30 c7 b5
E: 11.978874 10 02 e0 61 4b 40 49 00 30 c8 b2
E: 11.985869 10 02 e0 61 42 40 4a 00 30 cb bd
E: 11.987864 10 0c 8f 00 00 00 00 00 00 00 00
E: 11.992860 10 02 e0 61 29 40 4e 00 2f 4c c0
E: 12.000872 10 02 e0 61 13 40 46 00 2e 4c bb
E: 12.007876 10 02 e0 61 0d 40 4f 00 2c ce b6
E: 12.014871 10 02 e0 61 05 40 50 00 2b cf bb
E: 12.015870 10 0c 94 00 00 00 00 00 00 00 00
E: 12.021868 10 02 e0 60 e9 40 55 00 2a 50 b7
E: 12.028872 10 02 e0 60 ea 40 5a 00 29 52 b7
E: 12.035871 10 02 e0 60 e0 40 53 00 28 53 b5
E: 12.043875 10 02 e0 60 d7 40 5e 00 26 d2 b7
E: 12.044874 10 0c 9a 00 00 00 00 00 00 00 00
E: 12.050869 10 02 e0 60 d8 40 69 00 26 d2 b8
E: 12.057867 10 02 e0 60 cb 40 6f 00 26 d2 b5
E: 12.064872 10 02 e0 60 c2 40 77 00 27 52 b7
E: 12.071872 10 02 e0 60 c4 40 84 00 27 52 bb
E: 12.073873 10 0c 9d 00 00 00 00 00 00 00 00
E: 12.078874 10 02 e0 60 c2 40 90 00 27 51 b7
E: 12.086868 10 02 e0 60 bf 40 9a 00 27 51 b6
E: 12.093871 10 02 e0 60 bd 40 9b 00 27 d1 b4
E: 12.100866 10 02 e0 60 bc 40 a0 00 27 d1 b1
E: 12.101871 10 0c a1 00 00 00 00 00 00 00 00
E: 12.107876 10 02 e0 60 bf 40 aa 00 27 d1 b4
E: 12.114868 10 02 e0 60 c1 40 b0 00 27 d1 b7
E: 12.121867 10 02 e0 60 cc 40 b5 00 27 d1 b7
E: 12.129871 10 02 e0 60 d7 40 b7 00 27 d1 b7
E: 12.130872 10 0c a4 00 00 00 00 00 00 00 00
E: 12.136872 10 02 e0 60 e2 40 ad 00 27 d1 b0
E: 12.143875 10 02 e0 60 f6 40 ad 00 27 d1 b8
E: 12.150868 10 02 e0 60 fe 40 b0 00 27 d1 bb
E: 12.157867 10 02 e0 61 0c 40 9e 00 27 d0 b6
E: 12.159871 10 0c a7 00 00 00 00 00 00 00 00
E: 12.164871 10 02 e0 61 1f 40 9c 00 27 d0 b6
E: 12.172873 10 02 e0 61 2f 40 9a 00 27 50 b4
E: 12.179869 10 02 e0 61 44 40 93 00 27 50 bc
E: 12.186869 10 02 e0 61 4e 40 8e 00 26 d0 bf
E: 12.187875 10 0c ab 00 00 00 00 00 00 00 00
E: 12.193872 10 02 e0 61 67 40 87 00 26 d0 bc
E: 12.200872 10 02 e0 61 80 40 8f 00 26 51 be
E: 12.207877 10 02 e0 61 9c 40 82 00 26 51 c3
E: 12.214869 10 02 e0 61 bb 40 88 00 26 51 bc
E: 12.216859 10 0c ae 00 00 00 00 00 00 00 00
E: 12.222868 10 02 e0 61 da 40 84 00 25 d1 bd
E: 12.229866 10 02 e0 62 08 40 86 00 27 51 b9
E: 12.236881 10 02 e0 62 2d 40 7e 00 28 d1 bf
E: 12.243870 10 02 e0 62 53 40 72 00 2a 51 ba
E: 12.245872 10 0c b1 00 00 00 00 00 00 00 00
E: 12.250869 10 02 e0 62 7c 40 72 00 2b d1 b6
E: 12.257867 10 02 e0 62 ac 40 62 00 2d 51 b4
E: 12.265870 10 02 e0 62 de 40 5f 00 2e 52 b6
E: 12.272874 10 02 e0 63 03 40 50 00 2f d2 b4
E: 12.273869 10 0c b2 00 00 00 00 00 00 00 00
E: 12.279867 10 02 e0 63 2b 40 42 00 30 d2 b6
E: 12.286869 10 02 e0 63 58 40 32 00 30 52 b5
E: 12.293874 10 02 e0 63 88 40 13 00 2f 52 b7
E: 12.300868 10 02 e0 63 b6 3f fc 00 2f 52 b5
E: 12.302873 10 0c b3 00 00 00 00 00 00 00 00
E: 12.308875 10 02 e0 63 e1 3f e0 00 2e d2 b7
E: 12.315869 10 02 e0 64 0c 3f c9 00 2e 50 b5
E: 12.322866 10 02 e0 64 37 3f b2 00 2d ce b6
E: 12.329870 10 02 e0 64 5e 3f 97 00 2d 4c b2
E: 12.331886 10 0c b5 00 00 00 00 00 00 00 00
E: 12.336873 10 02 e0 64 82 3f 7e 00 2c ca b5
E: 12.343874 10 02 e0 64 a7 3f 64 00 2c 49 b0
E: 12.351864 10 02 e0 64 c9 3f 4c 00 2b c7 b1
E: 12.358858 10 02 e0 64 ed 3f 31 00 2a c6 b2
E: 12.359858 10 0c b8 00 00 00 00 00 00 00 00
E: 12.365889 10 02 e0 65 09 3f 15 00 2a 45 b4
E: 12.372876 10 02 e0 65 25 3f 04 00 2a 45 b7
E: 12.379867 10 02 e0 65 40 3e ef 00 29 c6 b0
E: 12.386864 10 02 e0 65 4e 3e d8 00 29 46 b2
E: 12.388871 10 0c b9 00 00 00 00 00 00 00 00
E: 12.394870 10 02 e0 65 5f 3e cc 00 28 c6 b2
E: 12.401870 10 02 e0 65 67 3e b8 00 28 47 b0
E: 12.408869 10 02 e0 65 6a 3e a4 00 28 47 b0
E: 12.415867 10 02 e0 65 70 3e 9d 00 27 c7 b0
E: 12.422867 10 02 e0 65 70 3e 90 00 27 c8 b2
E: 12.429859 10 02 e0 65 6c 3e 86 00 27 48 b1
E: 12.437872 10 02 e0 65 67 3e 82 00 27 48 b1
E: 12.444870 10 02 e0 65 5b 3e 7f 00 27 48 b2
E: 12.445873 10 0c ba 00 00 00 00 00 00 00 00
E: 12.451866 10 02 e0 65 48 3e 7d 00 27 49 b5
E: 12.458865 10 02 e0 65 3a 3e 81 00 27 49 b5
E: 12.465878 10 02 e0 65 22 3e 83 00 27 49 b7
E: 12.473874 10 02 e0 64 fb 3e 97 00 27 49 b7
E: 12.474866 10 0c bb 00 00 00 00 00 00 00 00
E: 12.480871 10 02 e0 64 d2 3e a7 00 27 49 b6
E: 12.487866 10 02 e0 64 a8 3e b5 00 27 c9 b6
E: 12.494862 10 02 e0 64 6e 3e c8 00 28 49 ba
E: 12.501874 10 02 e0 64 43 3e e1 00 28 48 b5
E: 12.508872 10 02 e0 64 10 3e f4 00 28 c8 b8
E: 12.515867 10 02 e0 63 dc 3f 0c 00 29 48 b9
E: 12.523865 10 02 e0 63 a7 3f 1e 00 2a 48 b8
E: 12.530866 10 02 e0 63 74 3f 31 00 2a c7 b8
E: 12.531871 10 0c bc 00 00 00 00 00 00 00 00
E: 12.537870 10 02 e0 63 3a 3f 42 00 2b 47 bd
E: 12.544867 10 02 e0 63 0e 3f 50 00 2c 46 bd
E: 12.551863 10 02 e0 62 e6 3f 4f 00 2c c6 bc
E: 12.558864 10 02 e0 62 af 3f 5f 00 2d 46 bf
E: 12.560872 10 0c b8 00 00 00 00 00 00 00 00
E: 12.566906 10 02 e0 62 8b 3f 69 00 2d c5 c3
E: 12.573874 10 02 e0 62 5d 3f 74 00 2e c5 c1
E: 12.580873 10 02 e0 62 2f 3f 7f 00 2f 45 c5
E: 12.587868 10 02 e0 62 0e 3f 82 00 2f c4 c9
E: 12.589871 10 0c b3 00 00 00 00 00 00 00 00
E: 12.594869 10 02 e0 61 eb 3f 88 00 30 44 c5
E: 12.601871 10 02 e0 61 c6 3f 9d 00 30 c4 c9
E: 12.609867 10 02 e0 61 a5 3f 8f 00 31 c4 cd
E: 12.616862 10 02 e0 61 8e 3f a7 00 31 c4 ca
E: 12.617874 10 0c b0 00 00 00 00 00 00 00 00
E: 12.623865 10 02 e0 61 77 3f a5 00 32 44 ce
E: 12.630864 10 02 e0 61 60 3f a0 00 32 43 ce
E: 12.637871 10 02 e0 61 4f 3f a2 00 32 43 cd
E: 12.644871 10 02 e0 61 3b 3f a2 00 32 c5 d6
E: 12.646861 10 0c ae 00 00 00 00 00 00 00 00
E: 12.652866 10 02 e0 61 2a 3f 9e 00 30 c4 d9
E: 12.659865 10 02 e0 61 20 3f 93 00 2f 44 d9
E: 12.666886 10 02 e0 61 10 3f 89 00 2d 44 d1
E: 12.673871 10 02 e0 60 ff 3f 85 00 2b c4 d5
E: 12.675869 10 0c ac 00 00 00 00 00 00 00 00
E: 12.680871 10 02 e0 60 e5 3f 7c 00 2a 44 d9
E: 12.687865 10 02 e0 60 d2 3f 71 00 29 44 d5
E: 12.695865 10 02 e0 60 c5 3f 6a 00 27 c4 d2
E: 12.702869 10 02 e0 60 c1 3f 74 00 26 43 d5
E: 12.703860 10 0c a9 00 00 00 00 00 00 00 00
E: 12.709870 10 02 e0 60 ae 3f 5e 00 26 43 d8
E: 12.716874 10 02 e0 60 9c 3f 60 00 26 c3 d6
E: 12.723866 10 02 e0 60 90 3f 55 00 26 c3 d3
E: 12.730868 10 02 e0 60 7e 3f 4c 00 27 43 d5
E: 12.732875 10 0c a5 00 00 00 00 00 00 00 00
E: 12.738871 10 02 e0 60 6b 3f 47 00 27 c3 d4
E: 12.745870 10 02 e0 60 54 3f 3a 00 27 c3 d3
E: 12.752864 10 02 e0 60 36 3f 33 00 28 43 d4
E: 12.759868 10 02 e0 60 2d 3f 29 00 28 c3 d0
E: 12.761866 10 0c a1 00 00 00 00 00 00 00 00
E: 12.766868 10 02 e0 60 17 3f 1e 00 28 c4 d1
E: 12.773872 10 02 e0 60 02 3f 17 00 29 44 d3
E: 12.781865 10 02 e0 5f f0 3f 13 00 29 44 d5
E: 12.788858 10 02 e0 5f e9 3f 14 00 29 c4 d8
E: 12.789864 10 0c 9d 00 00 00 00 00 00 00 00
E: 12.795866 10 02 e0 5f cb 3f 0b 00 29 c4 d4
E: 12.802870 10 02 e0 5f ba 3f 0b 00 2a 44 d6
E: 12.809870 10 02 e0 5f a7 3f 00 00 2a c4 db
E: 12.816864 10 02 e0 5f ae 3f 0c 00 2a c4 d9
E: 12.818855 10 0c 9a 00 00 00 00 00 00 00 00
E: 12.824865 10 02 e0 5f 99 3f 04 00 2b 44 d8
E: 12.831864 10 02 e0 5f 9c 3f 08 00 2b 44 de
E: 12.838871 10 02 e0 5f 92 3f 00 00 2b 44 db
E: 12.845869 10 02 e0 5f 96 3f 02 00 2b c5 df
E: 12.847864 10 0c 98 00 00 00 00 00 00 00 00
E: 12.852857 10 02 e0 5f 92 3e f5 00 2b c5 dd
E: 12.859868 10 02 e0 5f 99 3e ed 00 2b c5 d9
E: 12.867864 10 02 e0 5f a3 3e f4 00 2b c5 de
E: 12.874872 10 02 e0 5f a7 3e e8 00 2b c5 db
E: 12.875869 10 0c 93 00 00 00 00 00 00 00 00
E: 12.881863 10 02 e0 5f cb 3e fa 00 2b c5 d8
E: 12.888858 10 02 e0 5f c4 3e ed 00 2b c5 da
E: 12.895863 10 02 e0 5f dc 3e f3 00 2b c5 d8
E: 12.902871 10 02 e0 5f f2 3e f0 00 2b 45 df
E: 12.904867 10 0c 90 00 00 00 00 00 00 00 00
E: 12.910869 10 02 e0 5f ed 3e dc 00 2b 45 df
E: 12.917864 10 02 e0 60 1a 3e e7 00 2a c5 da
E: 12.924855 10 02 e0 60 3f 3e f6 00 2a c5 dd
E: 12.931867 10 02 e0 60 51 3e ee 00 2a 45 dc
E: 12.933868 10 0c 8c 00 00 00 00 00 00 00 00
E: 12.938870 10 02 e0 60 62 3e e6 00 29 c5 de
E: 12.945869 10 02 e0 60 78 3e e8 00 29 c5 df
E: 12.953858 10 02 e0 60 a4 3e f6 00 29 44 e7
E: 12.960856 10 02 e0 60 c1 3e fa 00 28 c4 e2
E: 12.961865 10 0c 88 00 00 00 00 00 00 00 00
E: 12.967868 10 02 e0 60 d3 3e e4 00 28 44 e1
E: 12.974866 10 02 e0 61 0a 3f 11 00 27 c4 e2
E: 12.981865 10 02 e0 61 28 3f 0d 00 27 44 e2
E: 12.988856 10 02 e0 61 56 3f 25 00 26 c4 dc
E: 12.990855 10 0c 84 00 00 00 00 00 00 00 00
E: 12.996880 10 02 e0 61 75 3f 29 00 26 44 e0
E: 13.003870 10 02 e0 61 98 3f 32 00 25 c4 e9
E: 13.010865 10 02 e0 61 b7 3f 26 00 25 44 e4
E: 13.017864 10 02 e0 61 d0 3f 3f 00 25 44 e4
E: 13.019866 10 0c 81 00 00 00 00 00 00 00 00
E: 13.024865 10 02 e0 61 ee 3f 35 00 26 c4 e4
E: 13.031866 10 02 e0 62 16 3f 45 00 28 c4 e1
E: 13.039868 10 02 e0 62 2e 3f 4e 00 2a c4 e4
E: 13.046865 10 02 e0 62 43 3f 51 00 2c 44 e3
E: 13.047871 10 0c c4 00 00 00 00 00 00 00 00
E: 13.053863 10 02 e0 62 6d 3f 5c 00 2d c4 e0
E: 13.060868 10 02 e0 62 84 3f 57 00 2f 44 e3
E: 13.067868 10 02 e0 62 9e 3f 6b 00 30 c4 dc
E: 13.074870 10 02 e0 62 b1 3f 6d 00 32 44 dc
E: 13.076868 10 0c 00 00 00 00 00 00 00 00 00
E: 13.082865 10 02 e0 62 bf 3f 77 00 31 c3 e3
E: 13.089862 10 02 e0 62 e1 3f 82 00 31 43 de
E: 13.096861 10 02 e0 62 ee 3f 81 00 30 c3 df
E: 13.103870 10 02 e0 63 01 3f 90 00 30 43 db
E: 13.110868 10 02 e0 63 10 3f 8d 00 30 43 da
E: 13.117864 10 02 e0 63 27 3f 9c 00 2f c3 df
E: 13.125866 10 02 e0 63 38 3f a0 00 2f 43 d9
E: 13.132867 10 02 e0 63 38 3f ae 00 2f 43 d4
E: 13.139866 10 02 e0 63 4f 3f ab 00 2e c3 d3
E: 13.146867 10 02 e0 63 58 3f b9 00 2e c3 d3
E: 13.153859 10 02 e0 63 64 3f af 00 2e 43 d0
E: 13.160868 10 02 e0 63 70 3f ad 00 2e 43 d2
E: 13.168865 10 02 e0 63 63 3f b5 00 2d c3 cc
E: 13.175868 10 02 e0 63 70 3f a6 00 2d c3 ca
E: 13.182863 10 02 e0 63 7c 3f a5 00 2d c3 ca
E: 13.189863 10 02 e0 63 7b 3f 9f 00 2d c3 ca
E: 13.196882 10 02 e0 63 81 3f 90 00 2d c3 c5
E: 13.203869 10 02 e0 63 78 3f 8a 00 2d 43 c9
E: 13.211869 10 02 e0 63 80 3f 77 00 2d 43 ca
E: 13.218864 10 02 e0 63 6d 3f 69 00 2d 43 c1
E: 13.225854 10 02 e0 63 69 3f 5d 00 2d 43 c5
E: 13.232944 10 02 e0 63 70 3f 5d 00 2d 43 c5
E: 13.239872 10 02 e0 63 60 3f 56 00 2d 43 c2
E: 13.246862 10 02 e0 63 60 3f 3f 00 2d 43 c4
E: 13.254862 10 02 e0 63 58 3f 3a 00 2d c3 c1
E: 13.261862 10 02 e0 63 4e 3f 34 00 2d c3 c6
E: 13.268876 10 02 e0 63 50 3f 35 00 2d c4 c8
E: 13.275866 10 02 e0 63 50 3f 2e 00 2d c4 c4
E: 13.282862 10 02 e0 63 41 3f 2c 00 2d c4 c3
E: 13.289861 10 02 e0 63 40 3f 2a 00 2d c4 c7
E: 13.297872 10 02 e0 63 41 3f 2a 00 2d c4 c2
E: 13.304867 10 02 e0 63 36 3f 2f 00 2d c4 c6
E: 13.311868 10 02 e0 63 39 3f 2b 00 2d c4 c5
E: 13.318861 10 02 e0 63 3a 3f 2e 00 2d c4 c3
E: 13.325861 10 02 e0 63 2f 3f 35 00 2e 44 c4
E: 13.332873 10 02 e0 63 30 3f 38 00 2e 44 c6
E: 13.340868 10 02 e0 63 32 3f 41 00 2e 44 c5
E: 13.347862 10 02 e0 63 38 3f 49 00 2e 44 cb
E: 13.354861 10 02 e0 63 31 3f 4d 00 2e 44 c0
E: 13.361863 10 02 e0 63 21 3f 54 00 2e 44 c4
E: 13.368863 10 02 e0 63 31 3f 62 00 2e 44 c4
E: 13.375866 10 02 e0 63 27 3f 70 00 2e 44 c0
E: 13.383865 10 02 e0 63 2c 3f 7f 00 2e 44 c7
E: 13.390865 10 02 e0 63 28 3f 85 00 2e 44 c1
E: 13.397881 10 02 e0 63 31 3f 8c 00 2e 44 c7
E: 13.404867 10 02 e0 63 3c 3f 8e 00 2e 43 c6
E: 13.411866 10 02 e0 63 3c 3f 95 00 2e 43 c6
E: 13.418862 10 02 e0 63 40 3f 9e 00 2e 43 c2
E: 13.426856 10 02 e0 63 3a 3f a3 00 2e 43 c5
E: 13.433871 10 02 e0 63 4e 3f a7 00 2e 43 c1
E: 13.440867 10 02 e0 63 41 3f b3 00 2e 43 c4
E: 13.447856 10 02 e0 63 45 3f ba 00 2e 43 c0
E: 13.454862 10 02 e0 63 4e 3f ba 00 2e 43 c2
E: 13.461859 10 02 e0 63 56 3f ba 00 2e 43 c2
E: 13.469867 10 02 e0 63 5c 3f c4 00 2e 43 c1
E: 13.476867 10 02 e0 63 64 3f c1 00 2d c3 c0
E: 13.483861 10 02 e0 63 66 3f c8 00 2d c3 c3
E: 13.490860 10 02 e0 63 6b 3f d2 00 2d c3 c2
E: 13.497881 10 02 e0 63 67 3f d3 00 2d c3 c1
E: 13.504867 10 02 e0 63 79 3f df 00 2d c3 c0
E: 13.512865 10 02 e0 63 70 3f e2 00 2d c3 c2
E: 13.519861 10 02 e0 63 7f 3f e8 00 2d c3 c1
E: 13.526852 10 02 e0 63 7c 3f f2 00 2d c3 c0
E: 13.533863 10 02 e0 63 7d 3f f9 00 2d c3 c0
E: 13.540866 10 02 e0 63 7c 3f ff 00 2d c3 bc
E: 13.547856 10 02 e0 63 7b 40 00 00 2d c3 c3
E: 13.555860 10 02 e0 63 84 40 03 00 2d c3 c2
E: 13.562862 10 02 e0 63 8b 40 00 00 2d c3 c3
E: 13.569867 10 02 e0 63 86 40 01 00 2d c3 be
E: 13.576866 10 02 e0 63 96 40 00 00 2d 43 c0
E: 13.577858 10 0c 00 00 00 00 00 02 00 00 00
E: 13.583863 10 02 e0 63 94 40 03 00 2d 43 bc
E: 13.590856 10 02 e0 63 93 40 03 00 2d 43 bf
E: 13.598867 10 02 e0 63 93 3f fe 00 2d 43 bf
E: 13.605869 10 02 e0 63 94 3f fe 00 2d 43 bf
E: 13.612868 10 02 e0 63 91 3f fb 00 2d 43 bd
E: 13.619865 10 02 e0 63 89 40 01 00 2d 43 bd
E: 13.626866 10 02 e0 63 81 3f f6 00 2d 43 bc
E: 13.633864 10 02 e0 63 78 3f f6 00 2d 43 bc
E: 13.641867 10 02 e0 63 69 3f f7 00 2d 43 be
E: 13.648866 10 02 e0 63 60 3f f6 00 2d 43 be
E: 13.655865 10 02 e0 63 5a 3f f1 00 2d 43 be
E: 13.662868 10 02 e0 63 4b 3f f1 00 2d c3 bc
# SET_REPORT (Feature) ID: 20 -> 20 54 00 00 00 00 00 00 00 (length 9)
E: 13.669864 10 02 e0 63 35 3f f4 00 2d c3 bc
E: 13.676860 10 02 e0 63 2c 3f e9 00 2d c3 c3
E: 13.684863 10 02 e0 63 22 3f e9 00 2d c3 c2
E: 13.691860 10 02 e0 63 16 3f e2 00 2e 43 c1
E: 13.698858 10 02 e0 63 0d 3f d7 00 2e 43 bc
E: 13.705879 10 02 e0 62 fe 3f c8 00 2e 43 c2
E: 13.712877 10 02 e0 62 f8 3f b4 00 2e 43 c2
E: 13.719868 10 02 e0 62 f6 3f a0 00 2e c3 c2
E: 13.727866 10 02 e0 62 f3 3f 7e 00 2e c3 c1
E: 13.734864 10 02 e0 62 fd 3f 60 00 2e c3 c0
E: 13.741854 10 02 e0 63 16 3f 3c 00 2e c3 bc
E: 13.748863 10 02 e0 63 24 3f 0b 00 2e c3 be
E: 13.755863 10 02 e0 63 3a 3e d3 00 2e c4 bb
E: 13.762865 10 02 e0 63 48 3e 98 00 2e c4 b9
E: 13.770862 10 02 e0 63 52 3e 49 00 2e c5 b8
E: 13.777857 10 02 e0 63 53 3d f8 00 2e 46 bb
E: 13.784864 10 02 e0 63 57 3d 97 00 2e 47 ba
E: 13.791868 10 02 e0 63 5c 3d 27 00 2d c8 b8
E: 13.798858 10 02 e0 63 5a 3c ad 00 2d ca bb
E: 13.805859 10 02 e0 63 5d 3c 2e 00 2d 4b ba
E: 13.813853 10 02 e0 63 6a 3b b6 00 2d 4d bc
E: 13.820872 10 02 e0 63 6b 3b 37 00 2d 4e ba
E: 13.827867 10 02 e0 63 66 3a bf 00 2d 4d b4
E: 13.834861 10 02 e0 63 58 3a 4e 00 2d 4d b0
E: 13.835860 10 0c 00 00 00 00 00 00 00 00 00
E: 13.841858 10 02 e0 63 37 39 e9 00 2c cd af
E: 13.848863 10 02 e0 63 01 39 8a 00 2c cd af
E: 13.856866 10 02 e0 62 ba 39 2a 00 2c cd ae
E: 13.863864 10 02 e0 62 66 38 ce 00 2c cd ae
E: 13.870860 10 02 e0 62 01 38 6f 00 2d 4e ac
E: 13.877851 10 02 e0 61 93 38 1a 00 2d cf b2
E: 13.884865 10 02 e0 61 06 37 cb 00 2d d0 c1
E: 13.891865 10 02 e0 60 77 37 6e 00 2c d2 bb
E: 13.899860 10 02 e0 5f ec 37 34 00 2c 51 b9
E: 13.906855 10 02 e0 5f 4f 36 ff 00 2c 51 b9
E: 13.913879 10 02 e0 5e b5 36 e4 00 2c 50 b2
E: 13.920870 10 02 e0 5e 12 36 cd 00 2c 4f b5
E: 13.927861 10 02 e0 5d 6d 36 ce 00 2c 4e b9
E: 13.934864 10 02 e0 5c bc 36 d4 00 2b cd c1
E: 13.942859 10 02 e0 5c 26 36 e5 00 2b 4d bd
E: 13.949938 10 02 e0 5b 84 37 02 00 2b 4c b9
E: 13.956870 10 02 e0 5b 12 37 16 00 2b cc ba
E: 13.963860 10 02 e0 5a 95 37 44 00 2c 4c be
E: 13.970859 10 02 e0 5a 2a 37 68 00 2c 4c bf
E: 13.977859 10 02 e0 59 c1 37 a1 00 2c 4c c5
E: 13.985868 10 02 e0 59 64 37 dc 00 2b cc c2
E: 13.992864 10 02 e0 59 0d 38 1f 00 2c 4d cd
E: 13.999858 10 02 e0 58 c5 38 69 00 2d 4d c5
E: 14.006854 10 02 e0 58 8d 38 b0 00 2c ce c0
E: 14.013879 10 02 e0 58 50 38 f0 00 2c 4f c1
E: 14.020870 10 02 e0 58 2e 39 26 00 2b d0 c7
E: 14.028866 10 02 e0 58 0a 39 80 00 2b 51 c1
E: 14.035859 10 02 e0 57 fb 39 c5 00 2a 52 c7
E: 14.042863 10 02 e0 57 f2 3a 13 00 29 d3 c7
E: 14.049936 10 02 e0 58 03 3a 72 00 28 d1 c5
E: 14.056869 10 02 e0 58 1e 3a c4 00 28 51 c5
E: 14.063864 10 02 e0 58 46 3b 24 00 28 cf c9
E: 14.071856 10 02 e0 58 67 3b 75 00 28 cd cd
E: 14.078863 10 02 e0 58 95 3b c7 00 28 cb d3
E: 14.085862 10 02 e0 58 c7 3c 19 00 28 ca c8
E: 14.092863 10 02 e0 59 18 3c 72 00 28 4a cd
E: 14.099857 10 02 e0 59 54 3c c2 00 28 4a cf
E: 14.106858 10 02 e0 59 a2 3d 0d 00 27 4c cf
E: 14.114879 10 02 e0 59 fb 3d 51 00 28 4c c9
E: 14.121866 10 02 e0 5a 3f 3d 9f 00 29 4d ca
E: 14.128863 10 02 e0 5a 97 3d f0 00 2a 4e ca
E: 14.135859 10 02 e0 5a ef 3e 2a 00 2b 50 c8
E: 14.142862 10 02 e0 5b 52 3e 67 00 2b d0 c5
E: 14.149877 10 02 e0 5b a5 3e a4 00 2c 4f c4
E: 14.157860 10 02 e0 5c 0c 3e d5 00 2c cf ca
E: 14.164859 10 02 e0 5c 79 3f 14 00 2d 4d cb
E: 14.171857 10 02 e0 5c fb 3f 57 00 2b cb cb
E: 14.178863 10 02 e0 5d 6a 3f 7c 00 2a 4a d0
E: 14.185863 10 02 e0 5d f3 3f ad 00 29 c9 d7
E: 14.192859 10 02 e0 5e 74 3f e5 00 2a 48 ce
E: 14.200858 10 02 e0 5e f4 40 0b 00 2a 47 ce
E: 14.207863 10 02 e0 5f 7b 40 3a 00 2a 47 d0
E: 14.214879 10 02 e0 60 02 40 5b 00 2a c8 cf
E: 14.221864 10 02 e0 60 ba 40 78 00 2a ca c9
E: 14.228863 10 02 e0 61 84 40 9f 00 2a 4b cd
E: 14.235857 10 02 e0 62 53 40 bf 00 2b 4c c8
E: 14.242861 10 02 e0 63 33 40 c5 00 2b cd c1
E: 14.243859 10 0c 00 00 00 00 00 04 00 00 00
E: 14.250860 10 02 e0 64 08 40 ba 00 2b 4f bf
E: 14.257865 10 02 e0 65 04 40 ac 00 2a 51 c2
E: 14.264863 10 02 e0 66 01 40 8a 00 29 d2 c5
E: 14.271860 10 02 e0 66 f1 40 70 00 29 52 cc
E: 14.278861 10 02 e0 67 be 40 38 00 2a 52 d3
E: 14.285858 10 02 e0 68 83 3f fc 00 2a d2 ca
E: 14.293866 10 02 e0 69 6d 3f bd 00 2a 53 cb
E: 14.300861 10 02 e0 6a 51 3f 7c 00 28 d1 d3
E: 14.307861 10 02 e0 6b 15 3f 3a 00 28 51 c9
E: 14.314859 10 02 e0 6b dd 3e f9 00 28 cf cc
# SET_REPORT (Feature) ID: 20 -> 20 64 00 00 00 00 00 00 00 (length 9)
E: 14.321865 10 02 e0 6c 97 3e b1 00 29 ce bf
E: 14.328859 10 02 e0 6d 5f 3e 72 00 29 4d bf
E: 14.336856 10 02 e0 6e 18 3e 3b 00 28 4c bc
E: 14.343853 10 02 e0 6e ef 3d f5 00 27 4a c0
E: 14.350859 10 02 e0 6f a4 3d b4 00 26 4b b8
E: 14.357864 10 02 e0 70 33 3d 5d 00 27 4c b4
E: 14.364857 10 02 e0 70 9b 3c fd 00 27 4c b3
E: 14.371849 10 02 e0 71 05 3c a2 00 26 cd ba
E: 14.379858 10 02 e0 71 51 3c 4d 00 26 4f b7
E: 14.386861 10 02 e0 71 7f 3b f5 00 26 50 b5
E: 14.393863 10 02 e0 71 a7 3b a5 00 26 51 bc
E: 14.400854 10 02 e0 71 a1 3b 58 00 26 d2 bb
E: 14.407857 10 02 e0 71 98 3b 04 00 27 50 b4
E: 14.414869 10 02 e0 71 7b 3a ba 00 26 4f ad
E: 14.422880 10 02 e0 71 4c 3a 6e 00 25 ce a9
E: 14.429863 10 02 e0 71 31 3a 28 00 25 4d ab
E: 14.436873 10 02 e0 70 f8 39 e7 00 25 4d af
E: 14.443854 10 02 e0 70 d1 39 a2 00 25 cc a4
E: 14.450870 10 02 e0 70 8b 39 63 00 26 4c a7
E: 14.457862 10 02 e0 70 40 39 1a 00 26 4c a4
E: 14.465856 10 02 e0 6f e8 38 dc 00 26 cd ad
E: 14.472848 10 02 e0 6f 79 38 9c 00 27 ce b2
E: 14.479854 10 02 e0 6f 0b 38 5d 00 28 d0 b5
E: 14.480873 10 0c 00 00 00 00 00 00 00 00 00
E: 14.486861 10 02 e0 6e 89 38 2a 00 29 d1 b8
E: 14.493863 10 02 e0 6d e1 37 fe 00 29 d2 ca
E: 14.500857 10 02 e0 6d 44 37 d7 00 29 53 bf
E: 14.508852 10 02 e0 6c a5 37 ab 00 29 54 ca
E: 14.515861 10 02 e0 6b fb 37 81 00 29 54 c7
E: 14.522863 10 02 e0 6b 44 37 6d 00 29 54 ca
E: 14.529862 10 02 e0 6a a0 37 65 00 29 d3 ce
E: 14.536855 10 02 e0 69 d6 37 64 00 29 d2 d0
E: 14.543851 10 02 e0 69 16 37 73 00 28 d0 ca
E: 14.551860 10 02 e0 68 61 37 87 00 28 4f cb
E: 14.558863 10 02 e0 67 b6 37 9d 00 28 ce cf
E: 14.565860 10 02 e0 66 f8 37 ca 00 29 4c cc
E: 14.572856 10 02 e0 66 3b 37 f8 00 29 cd ce
E: 14.579856 10 02 e0 65 63 38 21 00 2a ce cc
E: 14.586857 10 02 e0 64 a1 38 49 00 29 cf cf
E: 14.594851 10 02 e0 63 e8 38 99 00 28 d1 cb
E: 14.601849 10 02 e0 63 24 38 dc 00 29 d3 cb
E: 14.608853 10 02 e0 62 71 39 31 00 2a d4 c8
E: 14.615867 10 02 e0 61 c1 39 86 00 2b d5 cb
E: 14.622856 10 02 e0 61 11 39 d6 00 2c d5 db
E: 14.629848 10 02 e0 60 85 3a 54 00 2b d3 d2
E: 14.637849 10 02 e0 60 0c 3a be 00 2a 52 ce
E: 14.644871 10 02 e0 5f b4 3b 40 00 2b 50 d4
E: 14.651857 10 02 e0 5f 5c 3b be 00 2b 4e d6
E: 14.658861 10 02 e0 5f 26 3c 2c 00 2b 4d d6
E: 14.665859 10 02 e0 5f 09 3c af 00 2b 4d cc
E: 14.672855 10 02 e0 5e dd 3d 14 00 2b 4d ce
E: 14.680914 10 02 e0 5e df 3d 8c 00 2a 4d ce
E: 14.687866 10 02 e0 5e ca 3d fd 00 2b cd ca
E: 14.694861 10 02 e0 5e dc 3e 5e 00 2c 4e ca
E: 14.701856 10 02 e0 5e fe 3e e2 00 2c ce c9
E: 14.708854 10 02 e0 5f 15 3f 5a 00 2d 4e cb
E: 14.715936 10 02 e0 5f 41 3f dd 00 2d 4d ce
E: 14.723864 10 02 e0 5f 8e 40 66 00 2d 4b ca
E: 14.730856 10 02 e0 5f dc 40 cb 00 2c cb c2
E: 14.737855 10 02 e0 60 36 41 2e 00 2c 4b bd
E: 14.744859 10 02 e0 60 ad 41 81 00 2b cb c3
E: 14.751849 10 02 e0 61 37 41 b9 00 2a cb b8
E: 14.758861 10 02 e0 61 ba 41 f8 00 29 cc bf
E: 14.766858 10 02 e0 62 5a 42 1f 00 29 4c bc
E: 14.773854 10 02 e0 62 ee 42 38 00 29 4d b0
E: 14.780869 10 02 e0 63 8f 42 59 00 29 4d b5
E: 14.787860 10 02 e0 64 1d 42 77 00 29 cc ad
E: 14.794874 10 02 e0 64 b9 42 76 00 29 cb ad
E: 14.801854 10 02 e0 65 59 42 78 00 29 c9 af
E: 14.809847 10 02 e0 65 df 42 64 00 29 48 ae
E: 14.816875 10 02 e0 66 72 42 58 00 2a 48 b5
E: 14.823861 10 02 e0 66 df 42 35 00 2a c8 ae
E: 14.830860 10 02 e0 67 3b 42 09 00 2a c7 ae
E: 14.837855 10 02 e0 67 83 41 db 00 2a c7 b3
E: 14.844856 10 02 e0 67 cc 41 aa 00 2a c7 aa
E: 14.852860 10 02 e0 67 ed 41 6f 00 2b 48 ac
E: 14.859856 10 02 e0 68 18 41 3a 00 2b 48 af
E: 14.866856 10 02 e0 68 24 41 0b 00 2b c9 af
E: 14.873854 10 02 e0 68 30 40 d3 00 2c 4a b3
E: 14.880874 10 02 e0 68 2e 40 9d 00 2b 4a b3
E: 14.887861 10 02 e0 68 32 40 77 00 2a cc b5
E: 14.895860 10 02 e0 68 24 40 45 00 2a 4c bc
E: 14.902853 10 02 e0 68 10 40 10 00 2a 4d bb
E: 14.909855 10 02 e0 67 f0 3f e8 00 2a 4e bd
E: 14.916856 10 02 e0 67 c6 3f c7 00 2a 4d ba
E: 14.923854 10 02 e0 67 a4 3f af 00 2a 4c b7
E: 14.930858 10 02 e0 67 68 3f 8c 00 2a ca be
E: 14.938853 10 02 e0 67 3b 3f 80 00 2b 49 ba
E: 14.945868 10 02 e0 67 02 3f 65 00 2b c7 b8
E: 14.952862 10 02 e0 66 d5 3f 60 00 2c 46 c2
E: 14.959859 10 02 e0 66 a0 3f 51 00 2c c4 bd
E: 14.966857 10 02 e0 66 6d 3f 3f 00 2d 43 c1
E: 14.973848 10 02 e0 66 49 3f 3b 00 2e 43 c1
E: 14.981852 10 02 e0 66 18 3f 2d 00 2e c3 c1
E: 14.988852 10 02 e0 65 f8 3f 1e 00 2f 43 cb
E: 14.995860 10 02 e0 65 d1 3f 28 00 2f c3 c4
E: 15.002853 10 02 e0 65 b2 3f 31 00 2f c3 c7
E: 15.009858 10 02 e0 65 94 3f 31 00 30 45 ca
E: 15.016857 10 02 e0 65 77 3f 38 00 2e c5 c8
E: 15.024860 10 02 e0 65 75 3f 41 00 2d c5 c9
E: 15.031856 10 02 e0 65 75 3f 3b 00 2c 45 c9
E: 15.038851 10 02 e0 65 6b 3f 42 00 2a 45 c5
E: 15.045853 10 02 e0 65 6f 3f 51 00 28 c5 cb
E: 15.052859 10 02 e0 65 7b 3f 57 00 27 45 ca
E: 15.059855 10 02 e0 65 7d 3f 72 00 26 45 c4
E: 15.067854 10 02 e0 65 7c 3f 7f 00 24 c3 c1
E: 15.074853 10 02 e0 65 7f 3f 85 00 24 c3 c2
E: 15.081874 10 02 e0 65 8b 3f 8c 00 24 c3 c5
E: 15.088860 10 02 e0 65 91 3f 91 00 24 c3 c5
E: 15.095857 10 02 e0 65 92 3f 9c 00 24 c3 c0
E: 15.102853 10 02 e0 65 9c 3f a2 00 24 c3 c3
E: 15.110848 10 02 e0 65 9f 3f a9 00 24 c3 c2
E: 15.117857 10 02 e0 65 a5 3f a4 00 24 43 c7
E: 15.124879 10 02 e0 65 b6 3f a2 00 24 43 c9
E: 15.131879 10 02 e0 65 ca 3f a2 00 24 43 c7
E: 15.138879 10 02 e0 65 c6 3f af 00 23 c3 c9
E: 15.145878 10 02 e0 65 e3 3f 9f 00 23 c3 cb
E: 15.153878 10 02 e0 65 dd 3f 9c 00 23 c3 c7
E: 15.160878 10 02 e0 65 ef 3f af 00 23 c3 d2
E: 15.167876 10 02 e0 65 f2 3f ad 00 23 c3 cf
E: 15.174878 10 02 e0 65 fc 3f b3 00 23 43 c9
E: 15.181879 10 02 e0 65 fa 3f ac 00 23 43 cd
E: 15.188879 10 02 e0 66 07 3f b5 00 23 43 cb
E: 15.189877 10 0c 00 00 00 00 00 01 00 00 00
E: 15.196852 10 02 e0 65 f5 3f a5 00 25 43 cf
E: 15.203861 10 02 e0 65 f2 3f a7 00 25 c3 ce
E: 15.210860 10 02 e0 65 ff 3f a7 00 25 c3 cc
E: 15.217848 10 02 e0 65 fd 3f 96 00 26 43 cd
E: 15.224857 10 02 e0 66 00 3f 8f 00 26 43 cf
E: 15.231856 10 02 e0 66 01 3f 89 00 26 c3 c8
E: 15.239862 10 02 e0 66 0b 3f 7d 00 27 43 ce
E: 15.246847 10 02 e0 66 00 3f 6a 00 29 43 cc
E: 15.253861 10 02 e0 66 0a 3f 60 00 27 c3 ca
E: 15.260859 10 02 e0 66 02 3f 52 00 29 c3 c8
# SET_REPORT (Feature) ID: 20 -> 20 44 00 00 00 00 00 00 00 (length 9)
E: 15.267860 10 02 e0 66 02 3f 46 00 2a 43 c9
E: 15.274857 10 02 e0 66 03 3f 28 00 2a c3 cf
E: 15.282857 10 02 e0 66 0f 3f 18 00 2b 43 c9
E: 15.289853 10 02 e0 66 09 3f 03 00 2c c3 cf
E: 15.296850 10 02 e0 66 21 3e f9 00 2e c3 d2
E: 15.303854 10 02 e0 66 34 3e dc 00 2e 44 cc
E: 15.310852 10 02 e0 66 49 3e d0 00 2f c4 ce
E: 15.317848 10 02 e0 66 70 3e b0 00 2f c5 c8
E: 15.325856 10 02 e0 66 96 3e 9d 00 30 45 c6
E: 15.332876 10 02 e0 66 b1 3e 7a 00 31 46 ca
E: 15.339854 10 02 e0 66 d7 3e 5e 00 31 c6 c4
E: 15.346853 10 02 e0 66 f1 3e 3e 00 31 c7 c0
E: 15.353855 10 02 e0 67 24 3e 2a 00 30 c8 c2
E: 15.360850 10 02 e0 67 48 3e 0a 00 30 48 bf
E: 15.368935 10 02 e0 67 6d 3d e0 00 2f c8 bd
E: 15.375931 10 02 e0 67 93 3d b3 00 2f 49 bc
E: 15.382935 10 02 e0 67 c4 3d 8b 00 2e ca b4
E: 15.389861 10 02 e0 67 eb 3d 4d 00 2d ca b5
E: 15.396857 10 02 e0 68 0e 3d 0c 00 2d 4b b7
E: 15.403853 10 02 e0 68 2f 3c cc 00 2c cc b4
E: 15.404843 10 0c 00 00 00 00 00 00 00 00 00
E: 15.411855 10 02 e0 68 48 3c 99 00 2c 4c b7
E: 15.418859 10 02 e0 68 66 3c 5e 00 2b 4d b1
E: 15.425859 10 02 e0 68 71 3c 27 00 2a ce b2
E: 15.432853 10 02 e0 68 71 3b f6 00 2a 4f b0
E: 15.439849 10 02 e0 68 6b 3b cd 00 29 cf b7
E: 15.446852 10 02 e0 68 59 3b 94 00 29 cf b7
E: 15.454855 10 02 e0 68 3d 3b 6a 00 29 d0 b1
E: 15.461844 10 02 e0 68 23 3b 47 00 29 cf b1
E: 15.468843 10 02 e0 67 fd 3b 1d 00 29 cd b1
E: 15.475867 10 02 e0 67 d6 3a fe 00 29 cc ae
E: 15.482866 10 02 e0 67 ac 3a dc 00 2a 4b af
E: 15.489859 10 02 e0 67 7a 3a c0 00 2a c9 ae
E: 15.497852 10 02 e0 67 46 3a a5 00 2b 48 ad
E: 15.504852 10 02 e0 67 0d 3a 8d 00 2b c7 ad
E: 15.511843 10 02 e0 66 d9 3a 7c 00 2c 46 ae
E: 15.518860 10 02 e0 66 a5 3a 68 00 2c c7 ac
E: 15.525860 10 02 e0 66 6b 3a 50 00 2d 48 ac
E: 15.532855 10 02 e0 66 39 3a 47 00 2d c8 ad
E: 15.540851 10 02 e0 66 03 3a 38 00 2e c9 b0
E: 15.547871 10 02 e0 65 ca 3a 31 00 2e c9 bd
E: 15.554859 10 02 e0 65 93 3a 2c 00 2d c9 b9
E: 15.561857 10 02 e0 65 5b 3a 23 00 2c c9 b9
E: 15.568852 10 02 e0 65 23 3a 1c 00 2b ca b9
E: 15.575848 10 02 e0 64 fb 3a 1f 00 2a ca c0
E: 15.583932 10 02 e0 64 cf 3a 23 00 29 ca b8
E: 15.590859 10 02 e0 64 ab 3a 24 00 28 4a c2
E: 15.597851 10 02 e0 64 86 3a 28 00 27 4a c5
E: 15.604851 10 02 e0 64 5a 3a 26 00 26 ca bd
E: 15.611855 10 02 e0 64 2c 3a 2e 00 27 4a b8
E: 15.618859 10 02 e0 64 13 3a 43 00 27 ca c0
E: 15.626858 10 02 e0 63 e4 3a 48 00 28 4a c1
E: 15.627859 10 0c 97 00 00 00 00 00 00 00 00
E: 15.633852 10 02 e0 63 ba 3a 56 00 29 4a c2
E: 15.640850 10 02 e0 63 98 3a 67 00 29 c9 c4
E: 15.647853 10 02 e0 63 71 3a 76 00 2a 49 c1
E: 15.654857 10 02 e0 63 52 3a 9a 00 2a c9 c0
E: 15.661858 10 02 e0 63 2d 3a a0 00 2b 49 c7
E: 15.669851 10 02 e0 63 0e 3a bc 00 2b c8 c4
E: 15.676850 10 02 e0 62 f1 3a d0 00 2c 48 c7
E: 15.683850 10 02 e0 62 c8 3a e1 00 2c c7 c7
E: 15.684857 10 0c 98 00 00 00 00 00 00 00 00
E: 15.690855 10 02 e0 62 b1 3a f7 00 2d 47 cb
E: 15.697852 10 02 e0 62 9f 3b 09 00 2d c7 c4
E: 15.704848 10 02 e0 62 83 3b 24 00 2e 46 c5
E: 15.712927 10 02 e0 62 6b 3b 2f 00 2e c6 ce
E: 15.713867 10 0c 9d 00 00 00 00 00 00 00 00
E: 15.719856 10 02 e0 62 56 3b 42 00 2f 45 cc
E: 15.726858 10 02 e0 62 34 3b 47 00 2f c5 c8
E: 15.733851 10 02 e0 62 25 3b 66 00 2f c5 ce
E: 15.740849 10 02 e0 62 09 3b 79 00 30 44 ce
E: 15.742840 10 0c a2 00 00 00 00 00 00 00 00
E: 15.747854 10 02 e0 61 ee 3b 8b 00 30 c4 cd
E: 15.754856 10 02 e0 61 d8 3b ab 00 30 c3 d4
E: 15.762853 10 02 e0 61 d9 3b ba 00 31 43 d5
E: 15.769843 10 02 e0 61 ca 3b d9 00 31 43 ce
E: 15.770844 10 0c a6 00 00 00 00 00 00 00 00
E: 15.776850 10 02 e0 61 be 3b ec 00 31 43 ce
E: 15.783856 10 02 e0 61 bb 3c 05 00 31 c5 d5
E: 15.790854 10 02 e0 61 bb 3c 22 00 31 c5 d3
E: 15.797856 10 02 e0 61 c2 3c 33 00 31 c5 c9
E: 15.799850 10 0c aa 00 00 00 00 00 00 00 00
E: 15.805850 10 02 e0 61 c2 3c 41 00 31 c7 cd
E: 15.812851 10 02 e0 61 c5 3c 54 00 31 c9 c9
E: 15.819849 10 02 e0 61 c6 3c 5e 00 32 4b c8
E: 15.826921 10 02 e0 61 d5 3c 71 00 32 4d cb
E: 15.828859 10 0c ae 00 00 00 00 00 00 00 00
E: 15.833856 10 02 e0 61 d4 3c 7a 00 32 cf c4
E: 15.840856 10 02 e0 61 da 3c 73 00 32 cf cf
E: 15.848850 10 02 e0 61 e6 3c 77 00 32 d0 cb
E: 15.855849 10 02 e0 61 fe 3c 88 00 33 52 c7
E: 15.856854 10 0c b3 00 00 00 00 00 00 00 00
E: 15.862853 10 02 e0 62 0c 3c 7c 00 32 d2 c5
E: 15.869855 10 02 e0 62 1d 3c 87 00 32 d1 ca
E: 15.876849 10 02 e0 62 2e 3c 8a 00 32 d1 ca
E: 15.883850 10 02 e0 62 45 3c 87 00 32 51 c7
E: 15.885853 10 0c b5 00 00 00 00 00 00 00 00
E: 15.891852 10 02 e0 62 5f 3c 8a 00 32 51 bd
E: 15.898873 10 02 e0 62 79 3c 83 00 31 d1 c1
E: 15.905852 10 02 e0 62 99 3c 7c 00 31 d1 c0
E: 15.912853 10 02 e0 62 b3 3c 76 00 31 51 bd
E: 15.914852 10 0c b7 00 00 00 00 00 00 00 00
E: 15.919848 10 02 e0 62 dc 3c 67 00 30 d1 bc
E: 15.926853 10 02 e0 62 f5 3c 5c 00 30 d1 b8
E: 15.934853 10 02 e0 63 10 3c 50 00 30 51 bc
E: 15.941857 10 02 e0 63 28 3c 50 00 2f d1 ba
E: 15.942855 10 0c b8 00 00 00 00 00 00 00 00
E: 15.948855 10 02 e0 63 37 3c 35 00 2f 51 bb
E: 15.955849 10 02 e0 63 3e 3c 29 00 2f 51 b9
E: 15.962850 10 02 e0 63 48 3c 23 00 2e d1 b9
E: 15.969852 10 02 e0 63 46 3c 14 00 2e 51 bb
E: 15.977854 10 02 e0 63 3d 3c 10 00 2e 51 bb
E: 15.984849 10 02 e0 63 2d 3c 0a 00 2e 51 bb
E: 15.991851 10 02 e0 63 1e 3c 03 00 2d d1 be
E: 15.998861 10 02 e0 63 00 3b f9 00 2d d2 b9
E: 16.005856 10 02 e0 62 e1 3b fc 00 2d d2 ba
E: 16.012850 10 02 e0 62 bd 3c 01 00 2e 52 b9
E: 16.020849 10 02 e0 62 95 3c 0b 00 2e 52 ba
E: 16.027843 10 02 e0 62 6e 3c 16 00 2e d2 b9
E: 16.028853 10 0c 00 00 00 00 00 00 00 00 00
E: 16.034852 10 02 e0 62 40 3c 23 00 2e d2 b9
E: 16.041851 10 02 e0 62 0f 3c 35 00 2f 52 ba
E: 16.048849 10 02 e0 61 e3 3c 42 00 2f d2 ba
E: 16.055843 10 02 e0 61 b4 3c 5a 00 30 52 bd
E: 16.063847 10 02 e0 61 84 3c 73 00 30 52 bd
E: 16.070856 10 02 e0 61 39 3c 89 00 30 d2 bd
E: 16.077853 10 02 e0 61 0f 3c a9 00 30 d3 cb
E: 16.084849 10 02 e0 60 ec 3c c9 00 2f d2 c4
E: 16.091852 10 02 e0 60 ca 3c e4 00 2e 52 ce
E: 16.098870 10 02 e0 60 a7 3c f3 00 2d 52 c9
E: 16.106855 10 02 e0 60 90 3d 14 00 2b d1 c6
E: 16.113854 10 02 e0 60 79 3d 29 00 2a d1 c5
E: 16.120847 10 02 e0 60 66 3d 42 00 29 d1 c7
E: 16.127840 10 02 e0 60 65 3d 59 00 28 d0 c6
E: 16.134850 10 02 e0 60 63 3d 6e 00 27 cf c1
E: 16.141854 10 02 e0 60 62 3d 85 00 27 ce c0
E: 16.149848 10 02 e0 60 65 3d 8c 00 28 4e c6
E: 16.156848 10 02 e0 60 7e 3d a5 00 28 4e c0
E: 16.163868 10 02 e0 60 8d 3d b2 00 28 cd c4
E: 16.170854 10 02 e0 60 a5 3d c6 00 28 4d c4
E: 16.177853 10 02 e0 60 c5 3d df 00 28 4d c5
E: 16.184849 10 02 e0 60 e3 3d f4 00 28 4d c9
E: 16.192843 10 02 e0 61 08 3e 0c 00 27 cc c7
E: 16.199851 10 02 e0 61 3c 3e 29 00 27 4c cb
E: 16.206854 10 02 e0 61 67 3e 48 00 26 cc cd
E: 16.213849 10 02 e0 61 8e 3e 53 00 26 4b d0
E: 16.220853 10 02 e0 61 b6 3e 6a 00 25 cb c8
E: 16.227848 10 02 e0 61 d8 3e 89 00 25 cb d2
E: 16.235848 10 02 e0 61 f3 3e a6 00 27 4b ce
E: 16.242853 10 02 e0 62 0a 3e d4 00 28 ca d6
E: 16.249848 10 02 e0 62 26 3e ff 00 2a 4a d2
E: 16.256848 10 02 e0 62 33 3f 4d 00 2b c9 cf
E: 16.263840 10 02 e0 62 48 3f 8d 00 2d c9 d3
E: 16.270854 10 02 e0 62 61 3f d8 00 2f 48 d0
E: 16.278853 10 02 e0 62 74 40 35 00 30 c7 d3
E: 16.285848 10 02 e0 62 83 40 93 00 32 43 cb
E: 16.292849 10 02 e0 62 9a 40 f4 00 31 c4 c1
E: 16.299850 10 02 e0 62 b3 41 53 00 31 45 c1
E: 16.306854 10 02 e0 62 d8 41 c8 00 30 c6 bf
E: 16.313847 10 02 e0 63 01 42 2d 00 30 47 bb
E: 16.321846 10 02 e0 63 35 42 9d 00 2f c8 b5
E: 16.328846 10 02 e0 63 78 43 29 00 2f 48 b4
E: 16.335848 10 02 e0 63 cf 43 d6 00 2e c9 b5
E: 16.342852 10 02 e0 64 48 44 92 00 2e 4c b4
E: 16.349847 10 02 e0 64 e4 45 3f 00 2d c6 ad
E: 16.356846 10 02 e0 65 98 45 d5 00 2c c5 aa
E: 16.364865 10 02 e0 66 72 46 5c 00 2b 45 a8
E: 16.371852 10 02 e0 67 3c 46 c2 00 2b c4 a6
E: 16.378846 10 02 e0 68 14 47 18 00 2b 43 aa
E: 16.385847 10 02 e0 68 f7 47 5b 00 2a c2 a4
E: 16.392846 10 02 e0 69 fe 47 7e 00 2a 42 a5
E: 16.399867 10 02 e0 6b 1a 47 96 00 29 42 b0
E: 16.407853 10 02 e0 6c 17 47 86 00 29 46 a4
E: 16.414848 10 02 e0 6d 22 47 71 00 29 c4 9e
E: 16.421846 10 02 e0 6e 61 47 49 00 29 c4 9f
E: 16.428846 10 02 e0 6f 80 47 0b 00 28 43 95
E: 16.435858 10 02 e0 70 8f 46 c6 00 27 c3 93
E: 16.442851 10 02 e0 71 84 46 6c 00 27 c4 88
E: 16.450846 10 02 e0 72 76 45 f5 00 27 c5 87
E: 16.457849 10 02 e0 73 38 45 7a 00 27 c6 87
E: 16.464867 10 02 e0 73 ee 44 e9 00 27 47 84
E: 16.471853 10 02 e0 74 7f 44 50 00 27 49 86
E: 16.478841 10 02 e0 74 f4 43 af 00 27 c9 85
E: 16.485848 10 02 e0 75 57 43 17 00 28 4a 7f
E: 16.493849 10 02 e0 75 a8 42 8c 00 27 cb 74
E: 16.500861 10 02 e0 75 d8 42 16 00 27 4b 75
E: 16.507855 10 02 e0 75 e5 41 ae 00 27 4c 71
E: 16.514851 10 02 e0 75 c4 41 56 00 27 cd 70
E: 16.521843 10 02 e0 75 7d 41 17 00 27 4e 70
E: 16.528854 10 02 e0 75 11 40 e1 00 26 ce 70
E: 16.536874 10 02 e0 74 75 40 b6 00 26 d0 6e
E: 16.543875 10 02 e0 73 a6 40 9a 00 27 51 70
E: 16.550854 10 02 e0 72 c3 40 93 00 27 52 71
E: 16.557852 10 02 e0 71 a2 40 a3 00 27 53 73
E: 16.564844 10 02 e0 70 84 40 cf 00 27 d3 72
E: 16.571848 10 02 e0 6f 5d 41 0a 00 28 54 6f
E: 16.579844 10 02 e0 6e 3a 41 4e 00 28 d4 6f
E: 16.586866 10 02 e0 6d 03 41 9c 00 29 d5 6d
E: 16.593891 10 02 e0 6b ee 41 e9 00 29 d6 6d
E: 16.600920 10 02 e0 6a d9 42 3d 00 2a 56 72
E: 16.607920 10 02 e0 69 c4 42 98 00 2a d6 77
E: 16.614919 10 02 e0 68 b5 43 0d 00 2b 56 79
E: 16.622918 10 02 e0 67 c4 43 86 00 2b d6 7c
E: 16.629918 10 02 e0 66 ef 44 12 00 2b d6 87
E: 16.636905 10 02 e0 66 3d 44 9f 00 2c 55 8f
E: 16.643919 10 02 e0 65 8e 45 0e 00 2c d0 81
E: 16.650920 10 02 e0 65 10 45 87 00 2c d0 80
E: 16.657919 10 02 e0 64 bc 45 ed 00 2c d0 81
E: 16.665919 10 02 e0 64 84 46 44 00 2c d0 85
E: 16.672918 10 02 e0 64 6f 46 91 00 2c cf 8b
E: 16.679918 10 02 e0 64 74 46 d3 00 2c cf 8f
E: 16.686918 10 02 e0 64 8d 47 12 00 2c cf 97
E: 16.693918 10 02 e0 64 c0 47 48 00 2c 4f 95
E: 16.700919 10 02 e0 65 09 47 75 00 2b d3 9b
E: 16.708919 10 02 e0 65 67 47 9c 00 2b d2 9d
E: 16.715919 10 02 e0 65 e9 47 b8 00 2b 51 9d
E: 16.722918 10 02 e0 66 73 47 c6 00 2b 51 9c
E: 16.729918 10 02 e0 67 0e 47 c2 00 2b d0 a3
E: 16.736918 10 02 e0 67 ab 47 b9 00 2c 4f a1
E: 16.743918 10 02 e0 68 47 47 a6 00 2c cf a4
E: 16.751918 10 02 e0 68 e9 47 8d 00 2c ce a5
E: 16.758917 10 02 e0 69 9a 47 7c 00 2c ce a5
E: 16.765917 10 02 e0 6a 4b 47 62 00 2c 4e b1
E: 16.772918 10 02 e0 6a de 47 4d 00 2c ce b8
E: 16.779918 10 02 e0 6b 71 47 2d 00 2d 4d b8
E: 16.786919 10 02 e0 6b ee 47 13 00 2d 4e b6
E: 16.794918 10 02 e0 6c 5d 46 f1 00 2c ce b6
E: 16.801918 10 02 e0 6c c7 46 e5 00 2c ce c2
E: 16.808918 10 02 e0 6d 29 46 d2 00 2c 4f c6
E: 16.815918 10 02 e0 6d 7e 46 b4 00 2c 4f c4
E: 16.822917 10 02 e0 6d cd 46 a0 00 2c 4f cb
E: 16.829918 10 02 e0 6e 24 46 96 00 2b d0 cc
E: 16.837915 10 02 e0 6e 6b 46 7d 00 2a d0 d8
E: 16.844918 10 02 e0 6e ba 46 5f 00 29 d0 d9
E: 16.851918 10 02 e0 6e fc 46 41 00 2a d1 d9
E: 16.858918 10 02 e0 6f 49 46 38 00 2b d1 dc
E: 16.865918 10 02 e0 6f 85 46 0f 00 2c d1 e2
E: 16.872918 10 02 e0 6f cf 45 f6 00 2d d2 de
E: 16.880918 10 02 e0 70 0f 45 d6 00 2e d3 e1
E: 16.887878 10 02 e0 70 59 45 c4 00 2f d3 e0
E: 16.894917 10 02 e0 70 94 45 a5 00 30 d3 e6
E: 16.901918 10 02 e0 70 da 45 8d 00 31 54 e8
E: 16.908918 10 02 e0 71 31 45 81 00 2f d5 eb
E: 16.915918 10 02 e0 71 7d 45 6b 00 2e d5 ef
E: 16.923918 10 02 e0 71 c9 45 61 00 2d d5 ed
E: 16.930918 10 02 e0 72 14 45 57 00 2c 55 f2
E: 16.937915 10 02 e0 72 62 45 58 00 2b 56 f1
E: 16.944918 10 02 e0 72 a1 45 57 00 2a 56 f0
E: 16.962917 10 02 80 00 00 00 00 00 00 00 00
E: 16.975917 10 0c 00 8f 00 00 00 00 00 00 00
E: 17.033920 10 0c 00 98 00 00 00 00 00 00 00
E: 17.059917 10 0c 00 9f 00 00 00 00 00 00 00
E: 17.089846 10 0c 00 a3 00 00 00 00 00 00 00
E: 17.115845 10 0c 00 a5 00 00 00 00 00 00 00
E: 17.141848 10 0c 00 a8 00 00 00 00 00 00 00
E: 17.167850 10 0c 00 aa 00 00 00 00 00 00 00
E: 17.192840 10 0c 00 ad 00 00 00 00 00 00 00
E: 17.218846 10 0c 00 b2 00 00 00 00 00 00 00
E: 17.244849 10 0c 00 00 00 00 00 00 00 00 00
E: 17.687844 10 0c 00 8e 00 00 00 00 00 00 00
E: 17.738851 10 0c 00 8f 00 00 00 00 00 00 00
E: 17.764863 10 0c 00 8d 00 00 00 00 00 00 00
E: 17.790841 10 0c 00 8b 00 00 00 00 00 00 00
E: 17.816841 10 0c 00 88 00 00 00 00 00 00 00
E: 17.841842 10 0c 00 84 00 00 00 00 00 00 00
E: 17.867845 10 0c 00 81 00 00 00 00 00 00 00
E: 17.893841 10 0c 00 c5 00 00 00 00 00 00 00
E: 17.919842 10 0c 00 c1 00 00 00 00 00 00 00
E: 17.944847 10 0c 00 b9 00 00 00 00 00 00 00
E: 17.970847 10 0c 00 b3 00 00 00 00 00 00 00
E: 17.996861 10 0c 00 b1 00 00 00 00 00 00 00
E: 18.022840 10 0c 00 aa 00 00 00 00 00 00 00
E: 18.048843 10 0c 00 a9 00 00 00 00 00 00 00
E: 18.073847 10 0c 00 a5 00 00 00 00 00 00 00
E: 18.099845 10 0c 00 9f 00 00 00 00 00 00 00
E: 18.125842 10 0c 00 9a 00 00 00 00 00 00 00
E: 18.151840 10 0c 00 96 00 00 00 00 00 00 00
E: 18.177846 10 0c 00 94 00 00 00 00 00 00 00
E: 18.228844 10 0c 00 95 00 00 00 00 00 00 00
E: 18.254835 10 0c 00 98 00 00 00 00 00 00 00
E: 18.280839 10 0c 00 00 00 00 00 00 00 00 00
E: 18.555839 10 0c 00 00 00 00 00 00 00 01 00
# SET_REPORT (Feature) ID: 20 -> 20 44 00 00 00 00 00 00 00 (length 9)
E: 18.796840 10 0c 00 00 00 00 00 00 00 00 00
E: 19.197831 10 0c 00 00 00 00 00 00 00 02 00
# SET_REPORT (Feature) ID: 20 -> 20 45 00 00 00 00 00 00 00 (length 9)
E: 19.397836 10 0c 00 00 00 00 00 00 00 00 00
E: 19.819840 10 0c 00 00 00 00 00 00 00 04 00
# SET_REPORT (Feature) ID: 20 -> 20 46 00 00 00 00 00 00 00 (length 9)
E: 19.999831 10 0c 00 00 00 00 00 00 00 00 00
E: 21.002898 10 0c 00 00 00 00 00 00 00 10 00
E: 21.283826 10 0c 00 00 00 00 00 00 00 00 00
E: 21.504826 10 0c 00 00 00 00 00 00 00 08 00
E: 21.824823 10 0c 00 00 00 00 00 00 00 00 00
E: 22.145826 10 0c 00 00 00 00 00 00 00 20 00
E: 22.306828 10 0c 00 00 00 00 00 00 00 00 00
E: 22.486821 10 0c 00 00 00 00 00 00 00 40 00
E: 22.647820 10 0c 00 00 00 00 00 00 00 00 00
E: 22.807822 10 0c 00 00 00 00 00 00 00 80 00
E: 23.048817 10 0c 00 00 00 00 00 00 00 00 00
E: 25.093885 10 0c 00 00 00 00 00 08 00 00 00
E: 25.354807 10 0c 00 00 00 00 00 00 00 00 00
