# 027:0 -> 056A:00D0 / Wacom Co.,Ltd. | CTT-460
D:0
R: 176 05 01 09 02 a1 01 85 01 09 01 a1 00 05 09 19 01 29 05 15 00 25 01 95 05 75 01 81 02 95 01 75 03 81 01 05 01 09 30 09 31 15 81 25 7f 75 08 95 02 81 06 c0 c0 05 0d 09 01 a1 01 85 02 a1 00 06 00 ff 09 01 15 00 26 ff 00 75 08 95 08 81 02 c0 09 01 85 02 95 01 b1 02 09 01 85 03 95 01 b1 02 09 01 85 04 95 01 b1 02 09 01 85 05 95 01 b1 02 09 01 85 10 95 02 b1 02 09 01 85 11 95 10 b1 02 09 01 85 13 95 01 b1 02 09 01 85 20 95 01 b1 02 09 01 85 21 95 01 b1 02 09 01 85 06 95 01 b1 02 09 01 85 07 95 01 b1 02 09 01 85 14 95 01 b1 02 c0
N: Wacom Co.,Ltd. CTT-460
P: usb-0000:00:14.0-6.0/input0
I: 3 056A 00D0
# SET_REPORT (Feature) ID: 02 -> 02 02 (length 2)
# 027:1 -> 056A:00D0 / Wacom Co.,Ltd. | CTT-460
D:1
R: 75 06 00 ff 09 01 a1 01 85 02 05 0d 09 22 a1 00 06 00 ff 09 01 15 00 26 ff 00 75 08 95 02 81 02 05 01 09 30 35 00 46 e0 2e 26 e0 01 75 10 95 01 81 02 09 31 46 40 1f 26 40 01 81 02 06 00 ff 09 01 26 ff 00 75 08 95 0d 81 02 c0 c0
N: Wacom Co.,Ltd. CTT-460
P: usb-0000:00:14.0-6.1/input0
I: 3 056A 00D0
E: 0.000000 20 02 00 00 00 00 00 00 00 00 00 00 00 00 00 00 00 00 00 00 00
E: 1.240056 20 02 00 3a 80 a4 00 b3 80 a1 00 b1 00 00 00 00 00 81 11 00 00
E: 1.260018 20 02 00 4b 80 a3 00 b3 80 9f 00 b1 00 00 00 00 00 81 11 00 00
E: 1.276059 20 02 00 59 80 a1 00 b0 80 9e 00 af 00 00 00 00 00 81 11 00 00
E: 1.300060 20 02 00 72 80 a0 00 a9 80 9d 00 a8 00 00 00 00 00 81 11 00 00
E: 1.316062 20 02 00 70 80 a0 00 a4 80 9d 00 9f 00 00 00 00 00 80 11 00 00
E: 1.336066 20 02 00 77 80 98 00 a0 80 97 00 9d 00 00 00 00 00 81 11 00 00
E: 1.352021 20 02 00 6c 80 90 00 9f 80 8c 00 9d 00 00 00 00 00 80 11 00 00
E: 1.372067 20 02 00 6e 80 86 00 9c 80 85 00 9b 00 00 00 00 00 81 11 00 00
E: 1.392066 20 02 00 70 80 79 00 9c 80 77 00 9b 00 00 00 00 00 80 11 00 00
E: 1.412066 20 02 00 79 80 6a 00 9f 80 6a 00 9d 00 00 00 00 00 81 11 00 00
E: 1.428066 20 02 00 75 80 64 00 9f 80 61 00 9d 00 00 00 00 00 80 11 00 00
E: 1.448065 20 02 00 7b 80 58 00 a8 80 57 00 a7 00 00 00 00 00 81 11 00 00
E: 1.464006 20 02 00 72 80 53 00 b0 80 4f 00 af 00 00 00 00 00 80 11 00 00
E: 1.488066 20 02 00 6f 80 52 00 b7 80 4f 00 b3 00 00 00 00 00 81 11 00 00
E: 1.504067 20 02 00 75 80 52 00 c0 80 4f 00 bf 00 00 00 00 00 80 11 00 00
E: 1.524064 20 02 00 73 80 5c 00 c7 80 5a 00 c5 00 00 00 00 00 81 11 00 00
E: 1.540065 20 02 00 67 80 64 00 cc 80 61 00 c8 00 00 00 00 00 80 11 00 00
E: 1.564066 20 02 00 63 80 73 00 d7 80 72 00 d5 00 00 00 00 00 81 11 00 00
E: 1.580065 20 02 00 62 80 7c 00 da 80 78 00 d8 00 00 00 00 00 80 11 00 00
E: 1.600065 20 02 00 61 80 8e 00 de 80 8b 00 da 00 00 00 00 00 81 11 00 00
E: 1.616065 20 02 00 5b 80 9d 00 dd 80 9b 00 da 00 00 00 00 00 80 11 00 00
E: 1.636064 20 02 00 59 80 af 00 df 80 ae 00 db 00 00 00 00 00 81 11 00 00
E: 1.652064 20 02 00 5f 80 b8 00 df 80 b4 00 db 00 00 00 00 00 80 11 00 00
E: 1.676065 20 02 00 5d 80 ca 00 de 80 c7 00 da 00 00 00 00 00 81 11 00 00
E: 1.692065 20 02 00 56 80 d4 00 db 80 d4 00 d8 00 00 00 00 00 80 11 00 00
E: 1.712065 20 02 00 51 80 db 00 d0 80 d9 00 d1 00 00 00 00 00 81 11 00 00
E: 1.728064 20 02 00 5e 80 dc 00 ca 80 d9 00 c7 00 00 00 00 00 80 11 00 00
E: 1.752066 20 02 00 6e 80 d3 00 c4 80 d2 00 c2 00 00 00 00 00 81 11 00 00
E: 1.768064 20 02 00 6e 80 cb 00 bf 80 c7 00 be 00 00 00 00 00 80 11 00 00
E: 1.788064 20 02 00 77 80 bc 00 bb 80 bb 00 ba 00 00 00 00 00 81 11 00 00
E: 1.804065 20 02 00 7c 80 b4 00 bc 80 b1 00 bb 00 00 00 00 00 80 11 00 00
E: 1.828064 20 02 00 77 80 a4 00 c0 80 a0 00 be 00 00 00 00 00 81 11 00 00
E: 1.844004 20 02 00 79 80 9f 00 c4 80 9d 00 c2 00 00 00 00 00 80 11 00 00
E: 1.864064 20 02 00 7c 80 98 00 ca 80 96 00 c6 00 00 00 00 00 81 11 00 00
E: 1.880063 20 02 00 83 80 96 00 d6 80 95 00 d4 00 00 00 00 00 80 11 00 00
E: 1.900065 20 02 00 76 80 9d 00 e5 80 9b 00 e4 00 00 00 00 00 81 11 00 00
E: 1.920063 20 02 00 72 80 a0 00 f1 80 9d 00 ed 00 00 00 00 00 80 11 00 00
E: 1.940002 20 02 00 77 80 ac 00 ff 80 aa 00 fd 00 00 00 00 00 81 11 00 00
E: 1.956063 20 02 00 75 80 b3 01 02 80 b0 01 00 00 00 00 00 00 80 11 00 00
E: 1.976019 20 02 00 78 80 c1 01 05 80 c0 01 01 00 00 00 00 00 81 11 00 00
E: 1.992063 20 02 00 76 80 c8 01 06 80 c6 01 03 00 00 00 00 00 80 11 00 00
E: 2.016063 20 02 00 71 80 d7 01 03 80 d6 01 01 00 00 00 00 00 81 11 00 00
E: 2.032064 20 02 00 72 80 dc 01 00 80 da 00 fe 00 00 00 00 00 80 11 00 00
E: 2.052061 20 02 00 69 80 e3 00 f0 80 df 00 ed 00 00 00 00 00 81 11 00 00
E: 2.068061 20 02 00 58 80 e5 00 e6 80 e5 00 e5 00 00 00 00 00 80 11 00 00
E: 2.092062 20 02 00 5c 80 e2 00 d9 80 df 00 d7 00 00 00 00 00 81 11 00 00
E: 2.108062 20 02 00 63 80 de 00 d2 80 db 00 d2 00 00 00 00 00 80 11 00 00
E: 2.128062 20 02 00 65 80 cd 00 cd 80 c9 00 c8 00 00 00 00 00 81 11 00 00
E: 2.144061 20 02 00 6e 80 c4 00 cb 80 c3 00 c7 00 00 00 00 00 80 11 00 00
E: 2.168062 20 02 00 74 80 b2 00 cc 80 b0 00 c8 00 00 00 00 00 81 11 00 00
E: 2.184064 20 02 00 82 80 a7 00 d1 80 a6 00 cf 00 00 00 00 00 80 11 00 00
E: 2.204061 20 02 00 7d 80 a0 00 d8 80 9d 00 d6 00 00 00 00 00 81 11 00 00
E: 2.220062 20 02 00 7d 80 a0 00 dc 80 9d 00 d9 00 00 00 00 00 80 11 00 00
E: 2.240063 20 02 00 82 80 a4 00 e6 80 a0 00 e4 00 00 00 00 00 81 11 00 00
E: 2.260019 20 02 00 84 80 ad 00 ed 80 ac 00 eb 00 00 00 00 00 80 11 00 00
E: 2.280061 20 02 00 7b 80 b8 00 f1 80 b4 00 ed 00 00 00 00 00 81 11 00 00
E: 2.296060 20 02 00 76 80 c4 00 f2 80 c2 00 ee 00 00 00 00 00 80 11 00 00
E: 2.316062 20 02 00 76 80 cd 00 f1 80 c9 00 ed 00 00 00 00 00 81 11 00 00
E: 2.336061 20 02 00 81 80 d4 00 ed 80 d3 00 ec 00 00 00 00 00 80 11 00 00
E: 2.356061 20 02 00 85 80 d5 00 e1 80 d4 00 e0 00 00 00 00 00 81 11 00 00
E: 2.372061 20 02 00 7e 80 d1 00 dd 80 d0 00 da 00 00 00 00 00 80 11 00 00
E: 2.392056 20 02 00 74 80 c7 00 d8 80 c5 00 d6 00 00 00 00 00 81 11 00 00
E: 2.408061 20 02 00 83 80 c2 00 d4 80 c0 00 d2 00 00 00 00 00 80 11 00 00
E: 2.432006 20 02 00 81 80 b6 00 cf 80 b3 00 ce 00 00 00 00 00 81 11 00 00
E: 2.447993 20 02 00 85 80 b5 00 ce 80 b2 00 cd 00 00 00 00 00 80 11 00 00
E: 2.468058 20 02 00 81 80 b5 00 cf 80 b3 00 ce 00 00 00 00 00 81 11 00 00
E: 2.484060 20 02 00 77 80 bb 00 d2 80 ba 00 d0 00 00 00 00 00 80 11 00 00
E: 2.508060 20 02 00 00 00 00 00 00 00 00 00 00 00 00 00 00 00 00 00 00 00
E: 2.924058 20 02 01 00 00 00 00 00 00 00 00 00 00 00 00 00 00 00 00 00 00
E: 3.132056 20 02 00 00 00 00 00 00 00 00 00 00 00 00 00 00 00 00 00 00 00
E: 4.176052 20 02 02 00 00 00 00 00 00 00 00 00 00 00 00 00 00 00 00 00 00
E: 4.404050 20 02 00 00 00 00 00 00 00 00 00 00 00 00 00 00 00 00 00 00 00
E: 4.675980 20 02 04 00 00 00 00 00 00 00 00 00 00 00 00 00 00 00 00 00 00
E: 4.948005 20 02 00 00 00 00 00 00 00 00 00 00 00 00 00 00 00 00 00 00 00
E: 5.304057 20 02 08 00 00 00 00 00 00 00 00 00 00 00 00 00 00 00 00 00 00
E: 5.571987 20 02 00 00 00 00 00 00 00 00 00 00 00 00 00 00 00 00 00 00 00
E: 6.344040 20 02 01 00 00 00 00 00 00 00 00 00 00 00 00 00 00 00 00 00 00
E: 6.555979 20 02 00 00 00 00 00 00 00 00 00 00 00 00 00 00 00 00 00 00 00
E: 7.308048 20 02 00 64 80 c2 00 bd 80 c0 00 bc 00 00 00 00 00 81 11 00 00
E: 7.324037 20 02 00 65 80 c3 00 b7 80 c1 00 b3 00 00 00 00 00 81 11 00 00
E: 7.344037 20 02 00 6c 80 c2 00 b2 80 c1 00 b0 00 00 00 00 00 81 11 00 00
E: 7.360036 20 02 00 76 80 c2 00 ae 80 c0 00 ad 00 00 00 00 00 80 11 00 00
E: 7.380039 20 02 00 7b 80 be 00 a2 80 bd 00 9e 00 00 00 00 00 81 11 00 00
E: 7.400039 20 02 00 6a 80 b9 00 9d 80 b4 00 9c 00 00 00 00 00 80 11 00 00
E: 7.420035 20 02 00 6f 80 b0 00 90 80 ae 00 8c 00 00 00 00 00 81 11 00 00
E: 7.436036 20 02 00 69 80 a3 00 8d 80 9f 00 89 00 00 00 00 00 80 11 00 00
E: 7.456036 20 02 00 6a 80 8f 00 8a 80 8b 00 88 00 00 00 00 00 81 11 00 00
E: 7.471990 20 02 00 72 80 87 00 8b 80 86 00 89 00 00 00 00 00 80 11 00 00
E: 7.495976 20 02 00 6e 80 78 00 90 80 75 00 8c 00 00 00 00 00 81 11 00 00
E: 7.512036 20 02 00 78 80 6e 00 98 80 6d 00 96 00 00 00 00 00 80 11 00 00
E: 7.532035 20 02 00 65 80 65 00 a3 80 62 00 9f 00 00 00 00 00 81 11 00 00
E: 7.548036 20 02 00 74 80 65 00 ab 80 62 00 a9 00 00 00 00 00 80 11 00 00
E: 7.572035 20 02 00 70 80 67 00 b7 80 63 00 b3 00 00 00 00 00 81 11 00 00
E: 7.588036 20 02 00 76 80 6d 00 c3 80 6c 00 c2 00 00 00 00 00 80 11 00 00
E: 7.608036 20 02 00 6b 80 7b 00 d0 80 77 00 cf 00 00 00 00 00 81 11 00 00
E: 7.624034 20 02 00 60 80 89 00 d8 80 88 00 d6 00 00 00 00 00 80 11 00 00
E: 7.648035 20 02 00 5a 80 9e 00 dd 80 9c 00 d9 00 00 00 00 00 81 11 00 00
E: 7.664036 20 02 00 5a 80 a8 00 db 80 a2 00 d9 00 00 00 00 00 80 11 00 00
E: 7.683969 20 02 00 61 80 b4 00 da 80 b1 00 d8 00 00 00 00 00 81 11 00 00
E: 7.700035 20 02 00 62 80 b7 00 d9 80 b3 00 d7 00 00 00 00 00 80 11 00 00
E: 7.720035 20 02 00 60 80 b7 00 d8 80 b4 00 d6 00 00 00 00 00 81 11 00 00
E: 7.740034 20 02 00 5e 80 b7 00 d8 80 b3 00 d6 00 00 00 00 00 80 11 00 00
E: 7.760035 20 02 00 5b 80 b7 00 d5 80 b3 00 d4 00 00 00 00 00 81 11 00 00
E: 7.775994 20 02 00 4d 80 b5 00 d2 80 b2 00 d2 00 00 00 00 00 80 11 00 00
E: 7.796037 20 02 00 4e 80 b0 00 ce 80 ae 00 c9 00 00 00 00 00 81 11 00 00
E: 7.816038 20 02 00 4a 80 ab 00 cc 80 ab 00 c8 00 00 00 00 00 80 11 00 00
E: 7.836035 20 02 00 52 80 a6 00 c9 80 a1 00 c6 00 00 00 00 00 81 11 00 00
E: 7.852034 20 02 00 55 80 a4 00 c9 80 a0 00 c5 00 00 00 00 00 80 11 00 00
E: 7.872034 20 02 00 5a 80 a3 00 c9 80 9f 00 c5 00 00 00 00 00 81 11 00 00
E: 7.888035 20 02 00 5b 80 a3 00 c9 80 a0 00 c5 00 00 00 00 00 80 11 00 00
E: 7.912034 20 02 00 5c 80 a3 00 ca 80 9f 00 c6 00 00 00 00 00 81 11 00 00
E: 7.928033 20 02 00 5f 80 a3 00 c9 80 9f 00 c5 00 00 00 00 00 80 11 00 00
E: 7.948033 20 02 00 62 80 a3 00 c8 80 a0 00 c5 00 00 00 00 00 81 11 00 00
E: 7.964034 20 02 00 7e 80 a3 00 c0 80 9f 00 be 00 00 00 00 00 80 11 00 00
E: 7.988034 20 02 00 7e 80 a3 00 c0 80 9f 00 be 00 00 00 00 00 93 21 00 00
E: 8.004033 20 02 00 96 80 a5 00 bc 80 d5 00 bb 95 81 06 00 bc 80 21 00 00
E: 8.024034 20 02 00 a6 80 a7 00 ba 80 d6 00 b9 a3 81 05 00 ba 81 21 00 00
E: 8.040033 20 02 00 a2 80 a8 00 b7 80 d6 00 b6 a2 81 05 00 b7 80 21 00 00
E: 8.064033 20 02 00 b5 80 aa 00 af 80 d7 00 af c0 81 04 00 af 81 21 00 00
E: 8.080033 20 02 00 b4 80 ac 00 ac 80 d9 00 aa be 81 06 00 ac 80 21 00 00
E: 8.100033 20 02 00 af 80 af 00 a5 80 db 00 a4 c0 81 08 00 a5 81 21 00 00
E: 8.116032 20 02 00 bb 80 b1 00 a0 80 dd 00 9f c9 81 0a 00 a0 80 21 00 00
E: 8.140033 20 02 00 b3 80 b2 00 94 80 e0 00 93 c7 81 0e 00 94 81 21 00 00
E: 8.156031 20 02 00 b6 80 b3 00 90 80 e1 00 8f c4 81 0f 00 90 80 21 00 00
E: 8.176034 20 02 00 ac 80 b3 00 87 80 e2 00 85 c2 81 11 00 87 81 21 00 00
E: 8.192032 20 02 00 ab 80 b2 00 82 80 e2 00 81 c4 81 12 00 82 80 21 00 00
E: 8.216034 20 02 00 b4 80 b3 00 7f 80 e2 00 7e c6 81 12 00 7f 81 21 00 00
E: 8.232034 20 02 00 b6 80 b2 00 7e 80 e1 00 7e c5 81 11 00 7e 80 21 00 00
E: 8.252031 20 02 00 b0 80 b2 00 7f 80 e2 00 7e c2 81 12 00 7f 81 21 00 00
E: 8.268032 20 02 00 a8 80 b3 00 7f 80 e2 00 7e bc 81 12 00 7f 80 21 00 00
E: 8.292032 20 02 00 a9 80 b1 00 82 80 e1 00 80 bc 81 12 00 82 81 21 00 00
E: 8.308032 20 02 00 a5 80 b2 00 86 80 e2 00 84 bd 81 12 00 86 80 21 00 00
E: 8.327964 20 02 00 b0 80 b3 00 8f 80 e2 00 8f c2 81 12 00 8f 81 21 00 00
E: 8.343957 20 02 00 b2 80 b2 00 93 80 e1 00 92 c0 81 11 00 93 80 21 00 00
E: 8.367955 20 02 00 a8 80 b3 00 a1 80 e2 00 a1 bb 81 12 00 a1 81 21 00 00
E: 8.383976 20 02 00 b4 80 b3 00 a7 80 e2 00 a5 c0 81 12 00 a7 80 21 00 00
E: 8.403989 20 02 00 b1 80 b5 00 b5 80 e5 00 b4 c4 81 15 00 b5 81 21 00 00
E: 8.419959 20 02 00 b6 80 b5 00 bb 80 e5 00 ba b9 81 15 00 bb 80 21 00 00
E: 8.444033 20 02 00 b7 80 b8 00 c8 80 e7 00 c7 c9 81 16 00 c8 81 21 00 00
E: 8.459986 20 02 00 b3 80 b9 00 cf 80 e8 00 ce bd 81 17 00 cf 80 21 00 00
E: 8.480031 20 02 00 c2 80 bb 00 da 80 e9 00 da ce 81 18 00 da 81 21 00 00
E: 8.495961 20 02 00 b9 80 bb 00 e0 80 ea 00 df ba 81 19 00 e0 80 21 00 00
E: 8.519969 20 02 00 c0 80 bd 00 e7 80 eb 00 e5 c3 81 19 00 e7 81 21 00 00
E: 8.535987 20 02 00 bb 80 be 00 ea 80 ec 00 e8 c1 81 1a 00 ea 80 21 00 00
E: 8.555971 20 02 00 b7 80 be 00 ec 80 ec 00 ea bf 81 1a 00 ec 81 21 00 00
E: 8.571984 20 02 00 b9 80 be 00 ec 80 ec 00 ea c1 81 1a 00 ec 80 21 00 00
E: 8.596029 20 02 00 bb 80 be 00 eb 80 ec 00 e9 c4 81 1a 00 eb 81 21 00 00
E: 8.612031 20 02 00 b8 80 bd 00 e8 80 eb 00 e7 c3 81 1a 00 e8 80 21 00 00
E: 8.632031 20 02 00 b8 80 bc 00 e3 80 eb 00 e2 bc 81 1a 00 e3 81 21 00 00
E: 8.652030 20 02 00 b3 80 bb 00 df 80 ea 00 df b5 81 1a 00 df 80 21 00 00
E: 8.672031 20 02 00 b5 80 bb 00 d8 80 ea 00 d6 c0 81 19 00 d8 81 21 00 00
E: 8.688030 20 02 00 b6 80 bb 00 d2 80 e9 00 d1 c1 81 18 00 d2 80 21 00 00
E: 8.707984 20 02 00 c1 80 bc 00 c9 80 ea 00 c8 c3 81 19 00 c9 81 21 00 00
E: 8.724030 20 02 00 b9 80 bc 00 c3 80 ea 00 c1 c4 81 19 00 c3 80 21 00 00
E: 8.747967 20 02 00 b6 80 bd 00 b8 80 eb 00 b7 ba 81 1a 00 b8 81 21 00 00
E: 8.764030 20 02 00 c6 80 bd 00 b2 80 eb 00 b2 cf 81 19 00 b2 80 21 00 00
E: 8.783958 20 02 00 bd 80 bd 00 a7 80 eb 00 a6 c6 81 19 00 a7 81 21 00 00
E: 8.804029 20 02 00 c8 80 bc 00 a1 80 eb 00 a1 cc 81 1a 00 a1 80 21 00 00
E: 8.824029 20 02 00 c0 80 bc 00 98 80 ea 00 96 cf 81 19 00 98 81 21 00 00
E: 8.839996 20 02 00 bb 80 bc 00 92 80 ea 00 91 c4 81 19 00 92 80 21 00 00
E: 8.859985 20 02 00 c4 80 bc 00 8b 80 ea 00 8b cd 81 19 00 8b 81 21 00 00
E: 8.880028 20 02 00 bb 80 bb 00 85 80 ea 00 83 c9 81 19 00 85 80 21 00 00
E: 8.899985 20 02 00 b7 80 ba 00 7d 80 e9 00 7c c0 81 18 00 7d 81 21 00 00
E: 8.916029 20 02 00 c2 80 ba 00 7a 80 e9 00 79 c9 81 18 00 7a 80 21 00 00
E: 8.935985 20 02 00 b8 80 ba 00 75 80 e8 00 75 cf 81 16 00 75 81 21 00 00
E: 8.956029 20 02 00 af 80 ba 00 73 80 e8 00 71 c8 81 16 00 73 80 21 00 00
E: 8.976027 20 02 00 ad 80 b9 00 70 80 e8 00 6e c7 81 17 00 70 81 21 00 00
E: 8.992025 20 02 00 ac 80 b8 00 6f 80 e7 00 6d c4 81 17 00 6f 80 21 00 00
E: 9.012028 20 02 00 ad 80 b9 00 6c 80 e7 00 6b c1 81 16 00 6c 81 21 00 00
E: 9.032029 20 02 00 ad 80 b8 00 6c 80 e7 00 6b be 81 16 00 6c 80 21 00 00
E: 9.052027 20 02 00 ac 80 b8 00 6c 80 e7 00 6b bf 81 16 00 6c 81 21 00 00
E: 9.068028 20 02 00 af 80 b7 00 6d 80 e6 00 6b c0 81 16 00 6d 80 21 00 00
E: 9.092034 20 02 00 b0 80 b8 00 6e 80 e7 00 6c c0 81 16 00 6e 81 21 00 00
E: 9.108034 20 02 00 b1 80 b8 00 6f 80 e7 00 6e c3 81 16 00 6f 80 21 00 00
E: 9.128027 20 02 00 b1 80 b8 00 73 80 e7 00 71 c9 81 16 00 73 81 21 00 00
E: 9.144028 20 02 00 b0 80 b8 00 75 80 e7 00 73 c6 81 16 00 75 80 21 00 00
E: 9.168029 20 02 00 b9 80 b8 00 78 80 e7 00 78 cb 81 16 00 78 81 21 00 00
E: 9.184027 20 02 00 b3 80 b9 00 7a 80 e7 00 7a bf 81 16 00 7a 80 21 00 00
E: 9.204027 20 02 00 b8 80 b9 00 7e 80 e8 00 7d c2 81 17 00 7e 81 21 00 00
E: 9.220029 20 02 00 c5 80 b9 00 82 80 e7 00 80 c5 81 16 00 82 80 21 00 00
E: 9.243983 20 02 00 c3 80 ba 00 88 80 e9 00 86 cf 81 18 00 88 81 21 00 00
E: 9.259984 20 02 00 c7 80 ba 00 8c 80 e8 00 8b d1 81 16 00 8c 80 21 00 00
E: 9.279964 20 02 00 bf 80 bb 00 92 80 e9 00 91 be 81 18 00 92 81 21 00 00
E: 9.296028 20 02 00 be 80 bc 00 97 80 ea 00 95 c1 81 19 00 97 80 21 00 00
E: 9.319983 20 02 00 c0 80 bd 00 9f 80 eb 00 9f c9 81 19 00 9f 81 21 00 00
E: 9.336026 20 02 00 b8 80 be 00 a3 80 ec 00 a2 c4 81 1a 00 a3 80 21 00 00
E: 9.356026 20 02 00 be 80 c0 00 ab 80 ed 00 aa c9 81 1b 00 ab 81 21 00 00
E: 9.372027 20 02 00 bb 80 c1 00 b1 80 ee 00 af cb 81 1b 00 b1 80 21 00 00
E: 9.396027 20 02 00 c2 80 c2 00 b8 80 ef 00 b7 cc 81 1d 00 b8 81 21 00 00
E: 9.411982 20 02 00 c3 80 c2 00 bc 80 f0 00 bb cb 81 1e 00 bc 80 21 00 00
E: 9.432025 20 02 00 bd 80 c2 00 c4 80 ef 00 c2 cb 81 1d 00 c4 81 21 00 00
E: 9.447980 20 02 00 c7 80 c2 00 c9 80 ef 00 c8 d4 81 1d 00 c9 80 21 00 00
E: 9.472026 20 02 00 c4 80 c3 00 ce 80 f0 00 cd c8 81 1e 00 ce 81 21 00 00
E: 9.487982 20 02 00 c2 80 c2 00 d2 80 f0 00 d1 c9 81 1e 00 d2 80 21 00 00
E: 9.507964 20 02 00 c6 80 c2 00 da 80 ef 00 da d4 81 1d 00 da 81 21 00 00
E: 9.527979 20 02 00 c8 80 c2 00 dc 80 f0 00 dc d5 81 1e 00 dc 80 21 00 00
E: 9.548028 20 02 00 c3 80 c2 00 df 80 f0 00 df cc 81 1e 00 df 81 21 00 00
E: 9.563982 20 02 00 c6 80 c2 00 e1 80 ef 00 e0 cd 81 1d 00 e1 80 21 00 00
E: 9.583983 20 02 00 c9 80 c1 00 e4 80 ef 00 e2 d0 81 1d 00 e4 81 21 00 00
E: 9.604025 20 02 00 c7 80 c1 00 e4 80 ee 00 e3 d1 81 1c 00 e4 80 21 00 00
E: 9.623965 20 02 00 c8 80 c1 00 e6 80 ee 00 e5 d3 81 1c 00 e6 81 21 00 00
E: 9.640026 20 02 00 c4 80 c1 00 e6 80 ee 00 e5 d0 81 1c 00 e6 80 21 00 00
E: 9.660024 20 02 00 c7 80 c0 00 e6 80 ee 00 e5 d1 81 1c 00 e6 81 21 00 00
E: 9.680025 20 02 00 c7 80 c1 00 e6 80 ef 00 e5 d3 81 1d 00 e6 80 21 00 00
E: 9.700025 20 02 00 c5 80 c1 00 e5 80 ee 00 e4 d0 81 1c 00 e5 81 21 00 00
E: 9.716025 20 02 00 c4 80 c1 00 e2 80 ee 00 e2 cf 81 1c 00 e2 80 21 00 00
E: 9.740025 20 02 00 c3 80 c1 00 de 80 ee 00 de cf 81 1c 00 de 81 21 00 00
E: 9.756024 20 02 00 cc 80 c0 00 dc 80 ee 00 dc dc 81 1c 00 dc 80 21 00 00
E: 9.776025 20 02 00 c6 80 c1 00 d6 80 ee 00 d4 d3 81 1b 00 d6 81 21 00 00
E: 9.792024 20 02 00 c5 80 c2 00 d0 80 ee 00 cf ce 81 1b 00 d0 80 21 00 00
E: 9.815981 20 02 00 cb 80 c2 00 c9 80 ef 00 c8 db 81 1c 00 c9 81 21 00 00
E: 9.832025 20 02 00 ce 80 c1 00 c5 80 ee 00 c5 e1 81 1c 00 c5 80 21 00 00
E: 9.851981 20 02 00 c7 80 c2 00 bb 80 ee 00 ba d1 81 1b 00 bb 81 21 00 00
E: 9.867953 20 02 00 cc 80 c1 00 b6 80 ee 00 b5 db 81 1c 00 b6 80 21 00 00
E: 9.892024 20 02 00 ca 80 c1 00 ad 80 ee 00 ab da 81 1c 00 ad 81 21 00 00
E: 9.908024 20 02 00 ca 80 c2 00 a6 80 ee 00 a5 d4 81 1b 00 a6 80 21 00 00
E: 9.928023 20 02 00 d4 80 c0 00 9d 80 ee 00 9d e7 81 1c 00 9d 81 21 00 00
E: 9.947964 20 02 00 cf 80 c0 00 97 80 ed 00 96 dd 81 1b 00 97 80 21 00 00
E: 9.967981 20 02 00 d4 80 c0 00 8e 80 ed 00 8d e0 81 1b 00 8e 81 21 00 00
E: 9.983954 20 02 00 d2 80 c0 00 89 80 ed 00 89 e3 81 1b 00 89 80 21 00 00
E: 10.003982 20 02 00 c5 80 bf 00 7e 80 ec 00 7d c6 81 1a 00 7e 81 21 00 00
E: 10.023980 20 02 00 cd 80 be 00 79 80 ec 00 78 cf 81 1a 00 79 80 21 00 00
E: 10.044023 20 02 00 c6 80 bd 00 70 80 eb 00 6e cb 81 19 00 70 81 21 00 00
E: 10.060021 20 02 00 c1 80 bd 00 6a 80 eb 00 69 c4 81 19 00 6a 80 21 00 00
E: 10.080024 20 02 00 cf 80 bc 00 62 80 ea 00 62 d3 81 19 00 62 81 21 00 00
E: 10.099980 20 02 00 c6 80 bc 00 5e 80 ea 00 5c cc 81 18 00 5e 80 21 00 00
E: 10.120023 20 02 00 c4 80 ba 00 56 80 e9 00 55 c7 81 18 00 56 81 21 00 00
E: 10.135957 20 02 00 c5 80 b9 00 52 80 e8 00 51 c7 81 17 00 52 80 21 00 00
E: 10.156023 20 02 00 d0 80 b9 00 4d 80 e7 00 4d d7 81 16 00 4d 81 21 00 00
E: 10.176021 20 02 00 c8 80 b9 00 4a 80 e7 00 48 cf 81 16 00 4a 80 21 00 00
E: 10.196022 20 02 00 be 80 b8 00 45 80 e7 00 43 ca 81 16 00 45 81 21 00 00
E: 10.212023 20 02 00 c0 80 b8 00 42 80 e7 00 41 ca 81 16 00 42 80 21 00 00
E: 10.232024 20 02 00 c1 80 b7 00 3f 80 e6 00 3e cb 81 16 00 3f 81 21 00 00
E: 10.252023 20 02 00 bf 80 b7 00 3e 80 e6 00 3d cb 81 16 00 3e 80 21 00 00
E: 10.272022 20 02 00 c7 80 b7 00 3d 80 e6 00 3c d3 81 15 00 3d 81 21 00 00
E: 10.288023 20 02 00 c6 80 b8 00 3d 80 e6 00 3c d3 81 15 00 3d 80 21 00 00
E: 10.308022 20 02 00 c8 80 b8 00 3d 80 e6 00 3c d6 81 15 00 3d 81 21 00 00
E: 10.328022 20 02 00 c8 80 b8 00 3d 80 e7 00 3d d4 81 16 00 3d 80 21 00 00
E: 10.348022 20 02 00 c9 80 b7 00 3d 80 e6 00 3c d6 81 15 00 3d 81 21 00 00
E: 10.363979 20 02 00 c9 80 b8 00 3d 80 e6 00 3c d5 81 15 00 3d 80 21 00 00
E: 10.388023 20 02 00 ca 80 b8 00 3d 80 e6 00 3c d8 81 15 00 3d 81 21 00 00
E: 10.404022 20 02 00 ca 80 b8 00 3d 80 e6 00 3d e1 81 15 00 3d 80 21 00 00
E: 10.424021 20 02 00 ca 80 b7 00 3d 80 e6 00 3c d6 81 15 00 3d 81 21 00 00
E: 10.440021 20 02 00 c9 80 b8 00 3e 80 e6 00 3c e0 81 15 00 3e 80 21 00 00
E: 10.464022 20 02 00 ac 80 b8 00 3e 80 e6 00 3e bd 81 15 00 3e 81 21 00 00
E: 10.480022 20 02 00 61 80 b9 00 3e 80 e7 00 3a 85 81 15 00 3e 80 21 00 00
E: 10.500021 20 02 00 00 00 00 00 00 00 00 00 00 00 00 00 00 00 00 00 00 00
E: 19.815974 20 02 00 2c 80 e8 01 2d 80 e7 01 2a 00 00 00 00 00 81 11 00 00
E: 19.835975 20 02 00 7b 80 e8 01 2a 80 e5 01 28 00 00 00 00 00 81 11 00 00
E: 19.855976 20 02 00 8c 80 e9 01 29 80 e6 01 27 00 00 00 00 00 81 11 00 00
E: 19.871975 20 02 00 90 80 ea 01 29 80 e6 01 27 00 00 00 00 00 80 11 00 00
E: 19.891975 20 02 00 a1 80 e9 01 28 80 e5 01 26 00 00 00 00 00 81 11 00 00
E: 19.907974 20 02 00 ba 80 e8 01 27 80 e8 01 25 00 00 00 00 00 80 11 00 00
E: 19.931978 20 02 00 ed 80 e7 01 24 80 ed 01 23 00 00 00 00 00 81 11 00 00
E: 19.947975 20 02 00 ed 80 e7 01 24 80 ed 01 23 00 00 00 00 00 92 21 00 00
E: 19.967975 20 02 00 ff 80 d6 01 21 80 ee 01 20 ff 81 0d 01 21 81 21 00 00
E: 19.987975 20 02 00 ff 80 d4 01 21 80 ed 01 20 ff 81 0c 01 21 80 21 00 00
E: 20.007972 20 02 00 ff 80 d3 01 23 80 ea 01 21 ff 81 0b 01 23 81 21 00 00
E: 20.027975 20 02 00 ff 80 d2 01 26 80 e9 00 e7 86 81 0a 00 a8 88 22 00 00
E: 20.047975 20 02 00 ff 80 d2 01 26 80 e9 00 e7 86 81 0a 00 a8 a3 21 00 00
E: 20.063974 20 02 00 ff 80 d1 01 2a 80 e1 01 2a ff 80 fa 01 2a 80 21 00 00
E: 20.087975 20 02 00 8b 80 d1 00 bc 80 df 00 f4 ff 80 fa 01 2d 89 22 00 00
E: 20.103975 20 02 00 8b 80 d1 00 bc 80 df 00 f4 ff 80 fa 01 2d a2 12 00 00
E: 20.123973 20 02 00 00 00 00 00 00 80 ec 01 31 ff 80 dc 01 31 81 11 00 00
E: 20.143974 20 02 00 00 00 00 00 00 80 ec 01 31 ff 80 dc 01 31 92 21 00 00
E: 20.163974 20 02 00 ff 81 0e 01 33 80 fc 01 33 ef 80 e6 01 33 81 21 00 00
E: 20.179976 20 02 00 ff 81 1e 01 33 81 04 01 33 ff 80 ea 01 33 80 21 00 00
E: 20.203974 20 02 00 ff 81 23 01 31 81 10 01 31 f9 80 f9 01 31 81 21 00 00
E: 20.219974 20 02 00 ff 81 32 01 30 81 16 01 30 ff 80 fc 01 30 80 21 00 00
E: 20.239974 20 02 00 ff 81 36 01 2d 81 1e 01 2d ff 81 00 01 2d 81 21 00 00
E: 20.259973 20 02 00 f8 81 37 01 2b 81 1f 01 2b f9 81 0c 01 2b 80 21 00 00
E: 20.279973 20 02 00 ad 81 45 01 24 81 1b 01 23 dd 81 0d 01 24 81 21 00 00
E: 20.295975 20 02 00 9d 81 45 01 20 81 1b 01 1f cb 81 0e 01 20 80 21 00 00
E: 20.319973 20 02 00 00 00 00 00 00 81 11 01 1c b5 81 11 01 1d 81 11 00 00
E: 20.335973 20 02 00 00 00 00 00 00 81 0e 01 17 92 81 0e 01 1b 80 11 00 00
E: 20.355974 20 02 00 00 00 00 00 00 00 00 00 00 00 00 00 00 00 00 00 00 00
E: 36.259895 20 02 00 ff 80 f3 00 5a 80 b9 00 96 ff 80 f3 00 d3 81 12 00 00
E: 36.283896 20 02 00 ff 80 f3 00 59 80 ba 00 8d ff 80 f3 00 c1 81 12 00 00
E: 36.299895 20 02 00 c0 80 f8 00 59 80 bc 00 95 f6 80 be 00 d2 89 22 00 00
E: 36.323896 20 02 00 a7 80 f9 00 58 80 c1 00 8c fb 80 d2 00 c0 89 22 00 00
E: 36.343895 20 02 00 b4 80 f9 00 58 80 c2 00 8b fb 80 d2 00 bf 88 22 00 00
E: 36.363895 20 02 00 b4 80 f9 00 58 80 c2 00 8b fb 80 d2 00 bf a3 12 00 00
E: 36.379898 20 02 00 ff 80 f5 00 58 80 c2 00 8b ff 80 f5 00 bf 80 12 00 00
E: 36.403896 20 02 00 ff 80 f4 00 58 80 ba 00 8b ff 80 f4 00 bf 81 12 00 00
E: 36.419895 20 02 00 ff 80 e4 00 58 80 b7 00 8b ff 80 e4 00 bf 80 12 00 00
E: 36.439895 20 02 00 ff 80 e1 00 58 80 d0 00 8c ff 80 e1 00 c0 81 12 00 00
E: 36.459895 20 02 00 ff 80 de 00 59 80 a3 00 8d ff 80 de 00 c1 80 12 00 00
E: 36.479895 20 02 00 ff 80 ce 00 5b 80 9d 00 9f ff 80 ce 00 e4 81 12 00 00
E: 36.499894 20 02 00 ff 80 cd 00 6d 80 9a 00 a0 ff 80 cd 00 d4 80 12 00 00
E: 36.519894 20 02 00 ff 80 ce 00 7f 80 97 00 b3 ee 80 60 00 e7 89 22 00 00
E: 36.539895 20 02 00 ff 80 dc 00 80 80 9f 00 b4 ff 80 62 00 e8 88 22 00 00
E: 36.559894 20 02 00 ff 80 dc 00 80 80 9f 00 b4 ff 80 62 00 e8 a3 12 00 00
E: 36.575892 20 02 00 ff 80 f2 00 81 80 b8 00 b5 ff 80 f2 00 ea 80 12 00 00
E: 36.599894 20 02 00 ff 81 07 00 81 80 ce 00 bd ff 81 07 00 fa 81 12 00 00
E: 36.615894 20 02 00 bd 81 20 00 81 80 dd 00 bd ff 80 e6 00 f9 88 22 00 00
E: 36.639894 20 02 00 ff 81 2e 00 6e 80 f0 00 aa ff 80 b3 00 e7 89 22 00 00
E: 36.655893 20 02 00 ff 81 2e 00 6e 80 f0 00 aa ff 80 b3 00 e7 86 32 00 00
E: 36.679893 20 02 00 ff 81 2e 00 6e 80 f0 00 aa ff 80 b3 00 e7 87 32 00 00
E: 36.695893 20 02 00 ff 81 43 00 57 81 04 00 8b ff 80 c5 00 bf 88 22 00 00
E: 36.719826 20 02 00 f6 81 40 00 44 81 01 00 77 ff 80 c2 00 ab 81 22 00 00
E: 36.735820 20 02 00 f9 81 31 00 44 80 f1 00 77 f8 80 b2 00 aa 80 22 00 00
E: 36.759818 20 02 00 f9 81 31 00 44 80 f1 00 77 f8 80 b2 00 aa 87 32 00 00
E: 36.775894 20 02 00 f9 81 31 00 44 80 f1 00 77 f8 80 b2 00 aa 86 32 00 00
E: 36.799894 20 02 00 f9 81 31 00 44 80 f1 00 77 f8 80 b2 00 aa a3 12 00 00
E: 36.815894 20 02 00 fb 80 f3 00 45 80 bc 00 81 ff 80 85 00 be 88 22 00 00
E: 36.835825 20 02 00 fb 80 f3 00 45 80 bc 00 81 ff 80 85 00 be a3 12 00 00
E: 36.855893 20 02 00 ff 80 d2 00 5a 80 b1 00 9e ff 80 d2 00 e3 80 12 00 00
E: 36.875893 20 02 00 ff 80 d2 00 6e 80 b3 00 aa ff 80 d2 00 e6 81 12 00 00
E: 36.895826 20 02 00 ff 80 e4 00 80 80 b7 00 b3 ff 80 e4 00 e7 80 12 00 00
E: 36.915813 20 02 00 ff 80 e5 00 81 80 b7 00 bd e8 80 89 00 f9 89 22 00 00
E: 36.935893 20 02 00 ff 80 e5 00 81 80 b7 00 bd e8 80 89 00 f9 a2 12 00 00
E: 36.955892 20 02 00 af 81 21 00 81 80 e3 00 bd ff 80 fa 00 fa 89 22 00 00
E: 36.975891 20 02 00 d1 81 2d 00 80 81 09 00 bc ff 80 e6 00 f9 88 22 00 00
E: 36.995826 20 02 00 ff 81 34 00 6e 80 fc 00 aa fd 80 c4 00 e7 89 22 00 00
E: 37.015821 20 02 00 ff 81 43 00 6d 81 04 00 a9 ff 80 c6 00 e6 80 22 00 00
E: 37.039824 20 02 00 ff 81 43 00 5a 81 04 00 9e ff 80 c5 00 e3 81 22 00 00
E: 37.055820 20 02 00 ff 81 43 00 5a 81 04 00 9e ff 80 c5 00 e3 86 32 00 00
E: 37.079892 20 02 00 d4 81 2f 00 58 81 00 00 8b ff 80 d1 00 bf 81 22 00 00
E: 37.095892 20 02 00 c1 81 1d 00 58 80 f7 00 8c ff 80 d2 00 c0 80 22 00 00
E: 37.115891 20 02 00 c1 81 1d 00 58 80 f7 00 8c ff 80 d2 00 c0 a3 12 00 00
E: 37.135891 20 02 00 c1 81 1d 00 58 80 f7 00 8c ff 80 d2 00 c0 86 13 00 00
E: 37.155833 20 02 00 ff 80 e1 00 6d 80 af 00 a0 ff 80 e1 00 d4 81 12 00 00
E: 37.171891 20 02 00 ff 80 d1 00 7f 80 a6 00 b2 ff 80 d1 00 e6 80 12 00 00
E: 37.195890 20 02 00 ff 80 de 00 81 80 a4 00 bd ff 80 de 00 fa 81 12 00 00
E: 37.211891 20 02 00 ff 80 e0 00 93 80 a9 00 c7 ff 80 e0 00 fb 80 12 00 00
E: 37.235894 20 02 00 ff 80 e3 00 95 80 b4 00 d1 ff 80 e3 01 0e 81 12 00 00
E: 37.251893 20 02 00 ff 80 f4 00 a7 80 bd 00 da ff 80 f4 01 0e 80 12 00 00
E: 37.275890 20 02 00 d3 81 08 00 96 80 e3 00 d2 ff 80 be 01 0f 89 22 00 00
E: 37.291890 20 02 00 e2 81 1a 00 96 80 ec 00 d2 ff 80 be 01 0f 88 22 00 00
E: 37.315822 20 02 00 e8 81 2e 00 95 80 f6 00 c9 ff 80 bf 00 fd 89 22 00 00
E: 37.331815 20 02 00 ee 81 31 00 94 80 fa 00 c8 f0 80 c3 00 fc 80 22 00 00
E: 37.355890 20 02 00 ff 81 43 00 80 81 04 00 bd ff 80 c6 00 fa 81 22 00 00
E: 37.371891 20 02 00 ff 81 43 00 80 81 04 00 bd ff 80 c6 00 fa 86 32 00 00
E: 37.395891 20 02 00 ff 81 43 00 80 81 04 00 bd ff 80 c6 00 fa 87 32 00 00
E: 37.411890 20 02 00 00 00 00 00 00 00 00 00 00 00 00 00 00 00 00 00 00 00
