D: 0
R: 154 05 01 09 02 a1 01 85 01 09 01 a1 00 05 09 19 01 29 03 15 00 25 01 95 03 75 01 81 02 95 05 81 03 05 01 09 30 09 31 09 38 15 81 25 7f 75 08 95 03 81 06 c0 c0 05 0d 09 01 a1 01 85 02 09 00 75 08 95 09 15 00 26 ff 00 81 02 09 3a 25 02 95 01 b1 02 85 03 09 00 26 ff 00 b1 02 85 04 09 3a 25 01 b1 02 85 05 09 00 26 ff 00 95 08 b1 02 85 06 09 00 b1 02 85 07 09 00 95 04 b1 02 85 08 09 00 b1 02 85 09 09 00 95 01 b1 02 85 0a 09 00 95 02 b1 02 85 0b 09 00 95 01 b1 02 c0
N: Tablet XD-0405-U
P: usb-0000:00:14.0-1/input0
I: 3 056a 0041
D: 0
E: 0.000001 5 01 00 02 fd 00
E: 0.023987 5 01 00 03 00 00
E: 0.043932 5 01 00 03 00 00
E: 0.059987 5 01 00 03 01 00
E: 0.075978 5 01 00 03 01 00
E: 0.091977 5 01 00 04 02 00
E: 0.103978 5 01 00 03 02 00
E: 0.119978 5 01 00 02 04 00
E: 0.135977 5 01 00 01 04 00
E: 0.143977 5 01 00 00 03 00
E: 0.155919 5 01 00 00 03 00
E: 0.163977 5 01 00 01 04 00
E: 0.175917 5 01 00 01 04 00
E: 0.183927 5 01 00 00 05 00
E: 0.195976 5 01 00 01 04 00
E: 0.200000 5 01 00 00 03 00
E: 0.204000 5 01 00 00 03 00
E: 0.215976 5 01 00 00 05 00
E: 0.220000 5 01 00 ff 03 00
E: 0.224017 5 01 00 00 03 00
E: 0.231984 5 01 00 00 03 00
E: 0.236020 5 01 00 ff 04 00
E: 0.240016 5 01 00 00 03 00
E: 0.244020 5 01 00 ff 03 00
E: 0.251982 5 01 00 ff 04 00
E: 0.256006 5 01 00 ff 04 00
E: 0.260019 5 01 00 ff 03 00
E: 0.263962 5 01 00 ff 05 00
E: 0.271984 5 01 00 ff 04 00
E: 0.275916 5 01 00 fe 04 00
E: 0.280018 5 01 00 ff 04 00
E: 0.284016 5 01 00 fe 05 00
E: 0.291982 5 01 00 ff 05 00
E: 0.295915 5 01 00 fe 04 00
E: 0.300017 5 01 00 fd 05 00
E: 0.304014 5 01 00 fe 04 00
E: 0.311983 5 01 00 fe 05 00
E: 0.316006 5 01 00 fe 06 00
E: 0.320014 5 01 00 fd 04 00
E: 0.324017 5 01 00 fd 05 00
E: 0.331982 5 01 00 fd 05 00
E: 0.335961 5 01 00 fc 04 00
E: 0.339924 5 01 00 fd 05 00
E: 0.344016 5 01 00 fc 05 00
E: 0.351981 5 01 00 fd 04 00
E: 0.356017 5 01 00 fc 04 00
E: 0.360014 5 01 00 fd 04 00
E: 0.364014 5 01 00 fc 05 00
E: 0.371922 5 01 00 fc 04 00
E: 0.376015 5 01 00 fc 04 00
E: 0.380006 5 01 00 fc 04 00
E: 0.384005 5 01 00 fc 04 00
E: 0.391982 5 01 00 fc 04 00
E: 0.396003 5 01 00 fb 03 00
E: 0.400003 5 01 00 fc 03 00
E: 0.404004 5 01 00 fb 03 00
E: 0.411979 5 01 00 fc 03 00
E: 0.415956 5 01 00 fa 03 00
E: 0.419926 5 01 00 fb 03 00
E: 0.423918 5 01 00 fa 03 00
E: 0.431980 5 01 00 fb 02 00
E: 0.436004 5 01 00 fb 03 00
E: 0.439923 5 01 00 fa 03 00
E: 0.443997 5 01 00 fa 02 00
E: 0.451971 5 01 00 fa 02 00
E: 0.455995 5 01 00 fa 03 00
E: 0.460003 5 01 00 fb 02 00
E: 0.464004 5 01 00 fa 03 00
E: 0.471980 5 01 00 fa 02 00
E: 0.476004 5 01 00 fa 02 00
E: 0.480002 5 01 00 fa 02 00
E: 0.483912 5 01 00 fa 02 00
E: 0.491980 5 01 00 fb 01 00
E: 0.496002 5 01 00 fb 01 00
E: 0.499959 5 01 00 fa 01 00
E: 0.507978 5 01 00 fb 00 00
E: 0.512002 5 01 00 fb 00 00
E: 0.516001 5 01 00 fb ff 00
E: 0.520002 5 01 00 fb 00 00
E: 0.524003 5 01 00 fb ff 00
E: 0.531978 5 01 00 fb fe 00
E: 0.536000 5 01 00 fa fe 00
E: 0.540002 5 01 00 fb fe 00
E: 0.547978 5 01 00 fb fe 00
E: 0.552001 5 01 00 fb fd 00
E: 0.556001 5 01 00 fa fd 00
E: 0.560002 5 01 00 fa fc 00
E: 0.563912 5 01 00 fa fc 00
E: 0.571977 5 01 00 fb fb 00
E: 0.576000 5 01 00 fa fc 00
E: 0.579999 5 01 00 fb fb 00
E: 0.584001 5 01 00 fb fb 00
E: 0.591952 5 01 00 fb fb 00
E: 0.595999 5 01 00 fb fb 00
E: 0.600001 5 01 00 fb fa 00
E: 0.604003 5 01 00 fc fb 00
E: 0.611909 5 01 00 fc fa 00
E: 0.616001 5 01 00 fd fb 00
E: 0.620001 5 01 00 fc fb 00
E: 0.624001 5 01 00 fd fa 00
E: 0.631977 5 01 00 fd fb 00
E: 0.636003 5 01 00 fd f9 00
E: 0.640000 5 01 00 fc fb 00
E: 0.644002 5 01 00 fd fa 00
E: 0.651976 5 01 00 fd fa 00
E: 0.655999 5 01 00 fe fa 00
E: 0.659998 5 01 00 fd fa 00
E: 0.667977 5 01 00 fe f9 00
E: 0.671955 5 01 00 fd fa 00
E: 0.675908 5 01 00 fe fa 00
E: 0.679992 5 01 00 ff f9 00
E: 0.684001 5 01 00 fe fa 00
E: 0.691975 5 01 00 ff f9 00
E: 0.695998 5 01 00 ff fa 00
E: 0.699919 5 01 00 ff fa 00
E: 0.707975 5 01 00 00 f9 00
E: 0.712000 5 01 00 00 fa 00
E: 0.715999 5 01 00 00 fa 00
E: 0.719917 5 01 00 00 fa 00
E: 0.727975 5 01 00 01 fb 00
E: 0.731998 5 01 00 00 fa 00
E: 0.736001 5 01 00 00 fb 00
E: 0.739997 5 01 00 01 fa 00
E: 0.747969 5 01 00 00 fb 00
E: 0.751917 5 01 00 01 fb 00
E: 0.755954 5 01 00 00 fb 00
E: 0.759906 5 01 00 00 fb 00
E: 0.763998 5 01 00 00 fc 00
E: 0.771965 5 01 00 01 fb 00
E: 0.775989 5 01 00 00 fc 00
E: 0.779917 5 01 00 00 fb 00
E: 0.787974 5 01 00 01 fd 00
E: 0.791998 5 01 00 00 fc 00
E: 0.795997 5 01 00 01 fd 00
E: 0.799996 5 01 00 00 fd 00
E: 0.807973 5 01 00 01 fd 00
E: 0.811996 5 01 00 01 fd 00
E: 0.815997 5 01 00 00 fd 00
E: 0.819907 5 01 00 01 fd 00
E: 0.831971 5 01 00 01 fb 00
E: 0.839971 5 01 00 01 fc 00
E: 0.851968 5 01 00 00 fc 00
E: 0.855997 5 01 00 00 fd 00
E: 0.867905 5 01 00 00 fd 00
E: 0.875959 5 01 00 ff fc 00
E: 0.887974 5 01 00 00 fc 00
E: 0.895971 5 01 00 00 fc 00
E: 0.907972 5 01 00 00 fd 00
E: 0.915970 5 01 00 ff fc 00
E: 0.927951 5 01 00 00 fd 00
E: 0.935972 5 01 00 fe fd 00
E: 0.951971 5 01 00 fe fd 00
E: 0.959971 5 01 00 fe fd 00
E: 0.971961 5 01 00 fd fe 00
E: 0.987970 5 01 00 fc fd 00
E: 0.995968 5 01 00 fe fd 00
E: 1.007969 5 01 00 fd fe 00
E: 1.391956 5 01 00 ff da 00
E: 1.395985 5 01 00 03 00 00
E: 1.399987 5 01 00 04 00 00
E: 1.407962 5 01 00 05 ff 00
E: 1.411988 5 01 00 04 00 00
E: 1.415987 5 01 00 04 00 00
E: 1.419987 5 01 00 04 00 00
E: 1.427897 5 01 00 05 00 00
E: 1.431986 5 01 00 05 ff 00
E: 1.435986 5 01 00 05 00 00
E: 1.439985 5 01 00 05 00 00
E: 1.447938 5 01 00 04 00 00
E: 1.451899 5 01 00 05 00 00
E: 1.455938 5 01 00 05 00 00
E: 1.459985 5 01 00 04 00 00
E: 1.467962 5 01 00 05 00 00
E: 1.471895 5 01 00 05 00 00
E: 1.475985 5 01 00 06 00 00
E: 1.479985 5 01 00 05 00 00
E: 1.487962 5 01 00 05 00 00
E: 1.491894 5 01 00 05 00 00
E: 1.495985 5 01 00 05 00 00
E: 1.499984 5 01 00 06 00 00
E: 1.507960 5 01 00 05 ff 00
E: 1.511984 5 01 00 05 00 00
E: 1.515986 5 01 00 06 00 00
E: 1.519982 5 01 00 05 00 00
E: 1.527960 5 01 00 05 00 00
E: 1.531902 5 01 00 06 00 00
E: 1.535941 5 01 00 06 00 00
E: 1.539898 5 01 00 05 00 00
E: 1.547961 5 01 00 06 00 00
E: 1.551984 5 01 00 06 00 00
E: 1.555975 5 01 00 05 00 00
E: 1.559975 5 01 00 07 00 00
E: 1.567952 5 01 00 05 00 00
E: 1.571975 5 01 00 06 00 00
E: 1.575975 5 01 00 06 00 00
E: 1.579977 5 01 00 06 ff 00
E: 1.587945 5 01 00 07 00 00
E: 1.591975 5 01 00 06 00 00
E: 1.595973 5 01 00 07 ff 00
E: 1.599975 5 01 00 06 00 00
E: 1.607950 5 01 00 06 00 00
E: 1.611892 5 01 00 07 ff 00
E: 1.615974 5 01 00 06 00 00
E: 1.619974 5 01 00 07 ff 00
E: 1.627931 5 01 00 06 00 00
E: 1.631974 5 01 00 07 00 00
E: 1.635974 5 01 00 07 ff 00
E: 1.639975 5 01 00 07 00 00
E: 1.647951 5 01 00 07 ff 00
E: 1.651973 5 01 00 07 00 00
E: 1.655974 5 01 00 07 00 00
E: 1.659973 5 01 00 08 00 00
E: 1.667949 5 01 00 06 ff 00
E: 1.671974 5 01 00 07 00 00
E: 1.675974 5 01 00 07 00 00
E: 1.679892 5 01 00 08 ff 00
E: 1.687950 5 01 00 07 00 00
E: 1.691972 5 01 00 08 00 00
E: 1.695972 5 01 00 07 00 00
E: 1.699973 5 01 00 08 00 00
E: 1.707901 5 01 00 08 00 00
E: 1.711970 5 01 00 07 00 00
E: 1.715972 5 01 00 08 ff 00
E: 1.719973 5 01 00 08 00 00
E: 1.727947 5 01 00 08 00 00
E: 1.731976 5 01 00 09 00 00
E: 1.735971 5 01 00 08 00 00
E: 1.739972 5 01 00 08 00 00
E: 1.747947 5 01 00 0a 01 00
E: 1.751972 5 01 00 07 00 00
E: 1.755974 5 01 00 09 00 00
E: 1.759972 5 01 00 08 00 00
E: 1.767948 5 01 00 09 00 00
E: 1.771972 5 01 00 09 01 00
E: 1.775972 5 01 00 09 00 00
E: 1.779966 5 01 00 09 01 00
E: 1.787900 5 01 00 08 00 00
E: 1.791894 5 01 00 09 01 00
E: 1.795972 5 01 00 09 00 00
E: 1.799974 5 01 00 09 01 00
E: 1.807948 5 01 00 09 01 00
E: 1.811972 5 01 00 08 00 00
E: 1.815970 5 01 00 09 01 00
E: 1.819972 5 01 00 0a 01 00
E: 1.827946 5 01 00 07 01 00
E: 1.831972 5 01 00 09 01 00
E: 1.835971 5 01 00 09 01 00
E: 1.843947 5 01 00 09 01 00
E: 1.847905 5 01 00 08 01 00
E: 1.851969 5 01 00 09 00 00
E: 1.855970 5 01 00 09 02 00
E: 1.863914 5 01 00 07 01 00
E: 1.867922 5 01 00 09 01 00
E: 1.871970 5 01 00 08 00 00
E: 1.875970 5 01 00 09 01 00
E: 1.879970 5 01 00 08 01 00
E: 1.887946 5 01 00 08 01 00
E: 1.891969 5 01 00 09 01 00
E: 1.895968 5 01 00 08 01 00
E: 1.899971 5 01 00 09 01 00
E: 1.907947 5 01 00 08 01 00
E: 1.911969 5 01 00 07 00 00
E: 1.915970 5 01 00 08 01 00
E: 1.919971 5 01 00 07 01 00
E: 1.927945 5 01 00 07 01 00
E: 1.931967 5 01 00 06 01 00
E: 1.935967 5 01 00 07 01 00
E: 1.939969 5 01 00 06 01 00
E: 1.947925 5 01 00 07 00 00
E: 1.951969 5 01 00 05 01 00
E: 1.955969 5 01 00 06 01 00
E: 1.963886 5 01 00 05 02 00
E: 1.967970 5 01 00 06 01 00
E: 1.971969 5 01 00 04 02 00
E: 2.723941 5 01 00 01 1f 00
E: 2.727963 5 01 00 fc 03 00
E: 2.731880 5 01 00 fd 02 00
E: 2.735963 5 01 00 fc 03 00
E: 2.743939 5 01 00 fc 02 00
E: 2.747877 5 01 00 fb 03 00
E: 2.751964 5 01 00 fb 02 00
E: 2.755964 5 01 00 fb 03 00
E: 2.763937 5 01 00 fb 02 00
E: 2.767961 5 01 00 fa 02 00
E: 3.343924 5 01 00 18 92 00
E: 3.347944 5 01 00 08 fa 00
E: 3.351951 5 01 00 09 f9 00
E: 3.359870 5 01 00 08 f9 00
E: 3.363953 5 01 00 0a f9 00
E: 3.367916 5 01 00 08 f9 00
E: 3.371879 5 01 00 0a f9 00
E: 3.379930 5 01 00 09 f9 00
E: 3.383953 5 01 00 0b f9 00
E: 3.387955 5 01 00 0b f9 00
E: 3.391953 5 01 00 0a f9 00
E: 3.399928 5 01 00 0c fa 00
E: 3.403954 5 01 00 0b f9 00
E: 3.407952 5 01 00 0c f9 00
E: 3.411951 5 01 00 0b fa 00
E: 3.419860 5 01 00 0b f9 00
E: 3.423943 5 01 00 0c fb 00
E: 3.427943 5 01 00 0b fa 00
E: 3.431943 5 01 00 0a f9 00
E: 3.439918 5 01 00 0c fa 00
E: 3.443942 5 01 00 0a fb 00
E: 3.447941 5 01 00 0a fa 00
E: 3.451940 5 01 00 0a fb 00
E: 3.459917 5 01 00 0a fa 00
E: 3.463942 5 01 00 08 fa 00
E: 3.467941 5 01 00 09 fa 00
E: 3.471941 5 01 00 0a fb 00
E: 3.479858 5 01 00 08 fb 00
E: 3.483941 5 01 00 09 fb 00
E: 3.487942 5 01 00 08 fc 00
E: 3.491941 5 01 00 0a fb 00
E: 3.499859 5 01 00 07 fb 00
E: 3.503942 5 01 00 08 fc 00
E: 3.507940 5 01 00 07 fc 00
E: 3.511941 5 01 00 08 fc 00
E: 3.519917 5 01 00 07 fd 00
E: 3.523943 5 01 00 06 fd 00
E: 3.527948 5 01 00 06 fc 00
E: 3.531947 5 01 00 06 fd 00
E: 3.539932 5 01 00 05 fd 00
E: 3.543870 5 01 00 04 fe 00
E: 3.547849 5 01 00 04 fd 00
E: 3.551949 5 01 00 03 fe 00
E: 3.563859 5 01 00 04 fc 00
E: 3.571924 5 01 00 04 fd 00
E: 3.583926 5 01 00 03 fe 00
E: 3.591923 5 01 00 03 fe 00
E: 3.603924 5 01 00 03 00 00
E: 3.619923 5 01 00 03 ff 00
E: 3.631868 5 01 00 03 ff 00
E: 3.659924 5 01 00 03 01 00
E: 3.743921 5 01 02 02 03 00
E: 3.767922 5 01 02 ff 03 00
E: 3.783921 5 01 02 00 03 00
E: 3.799854 5 01 02 ff 03 00
E: 3.807847 5 01 02 ff 03 00
E: 3.819913 5 01 02 ff 03 00
E: 3.827911 5 01 02 ff 03 00
E: 3.843912 5 01 02 ff 03 00
E: 3.863919 5 01 02 fe 03 00
E: 3.907918 5 01 02 ff 03 00
E: 3.931857 5 01 02 00 03 00
E: 3.951919 5 01 02 00 03 00
E: 3.963909 5 01 00 00 01 00
E: 3.987908 5 01 00 01 03 00
E: 4.027909 5 01 00 01 03 00
E: 4.063908 5 01 00 00 03 00
E: 4.107905 5 01 00 00 03 00
E: 4.139906 5 01 00 00 03 00
E: 4.327903 5 01 00 fd 02 00
E: 4.367896 5 01 04 00 00 00
E: 4.399902 5 01 04 00 01 01
E: 4.403929 5 01 04 00 ff 00
E: 4.455904 5 01 04 00 01 01
E: 4.459923 5 01 04 00 00 00
E: 4.515898 5 01 04 ff 00 01
E: 4.519924 5 01 04 01 00 00
E: 4.675898 5 01 04 ff 01 ff
E: 4.679921 5 01 04 00 00 00
E: 4.703843 5 01 04 00 ff ff
E: 4.707870 5 01 04 01 00 00
E: 4.723897 5 01 04 00 00 ff
E: 4.727920 5 01 04 00 00 00
E: 4.747895 5 01 04 00 00 ff
E: 4.755895 5 01 04 01 00 00
E: 4.807896 5 01 04 ff 00 ff
E: 4.815894 5 01 04 00 00 00
E: 4.967892 5 01 04 fe 00 01
E: 4.975891 5 01 04 00 00 00
E: 4.999891 5 01 04 ff ff 01
E: 5.003914 5 01 04 01 01 00
E: 5.019891 5 01 04 00 00 01
E: 5.023914 5 01 04 00 00 00
E: 5.055890 5 01 04 ff 00 01
E: 5.059914 5 01 04 00 00 00
E: 5.103833 5 01 04 00 00 01
E: 5.107915 5 01 04 00 00 00
E: 5.163887 5 01 00 00 00 00
E: 5.399892 5 01 01 01 00 00
E: 5.547890 5 01 00 00 00 00
E: 5.759821 5 01 01 fe 01 00
E: 5.935882 5 01 00 00 00 00
E: 6.139871 5 01 01 ff 00 00
E: 6.279878 5 01 00 00 00 00
E: 6.579870 5 01 04 01 00 00
E: 6.611805 5 01 04 00 00 01
E: 6.615896 5 01 04 00 00 00
E: 6.671816 5 01 04 00 02 01
E: 6.675886 5 01 04 00 00 00
E: 6.695813 5 01 04 00 03 00
E: 6.775860 5 01 04 00 02 01
E: 6.779894 5 01 04 01 01 00
E: 6.835863 5 01 00 00 00 00
E: 6.839815 5 01 00 00 00 01
E: 6.847869 5 01 00 00 00 00
E: 6.959857 5 01 00 02 fd 00
E: 6.979865 5 01 00 01 fd 00
E: 6.991865 5 01 00 02 ff ff
E: 6.995889 5 01 00 00 ff 00
E: 7.011811 5 01 00 02 fe ff
E: 7.015889 5 01 00 00 00 00
E: 7.035865 5 01 00 01 ff ff
E: 7.039808 5 01 00 00 00 00
E: 7.079860 5 01 00 00 00 ff
E: 7.087864 5 01 04 00 00 00
E: 7.215860 5 01 00 00 00 00
E: 7.327859 5 01 00 fe fd 00
E: 7.407800 5 01 04 00 01 00
E: 7.547856 5 01 00 00 00 00
E: 7.639853 5 01 04 00 ff 00
E: 7.771852 5 01 00 00 00 00
E: 8.027848 5 01 02 00 00 00
E: 8.255776 5 01 00 00 00 00
E: 8.311785 5 01 02 00 00 00
E: 8.471817 5 01 02 00 03 00
E: 8.475861 5 01 00 00 00 00
E: 8.623837 5 01 00 fc 01 00
E: 8.631836 5 01 00 fc 01 00
E: 8.635860 5 01 00 fd 01 00
E: 8.643836 5 01 00 fd 00 00
E: 8.647863 5 01 00 fd 02 00
E: 8.651837 5 01 00 fc 01 00
E: 8.655855 5 01 00 fc 00 00
E: 8.663829 5 01 00 fc 01 00
E: 8.667852 5 01 00 fc 01 00
E: 8.671849 5 01 00 fc 01 00
E: 8.675845 5 01 00 fc 00 00
E: 8.683780 5 01 00 fb 01 00
E: 8.687876 5 01 00 fc 00 00
E: 8.691850 5 01 00 fb 00 00
E: 8.695849 5 01 00 fb 00 00
E: 8.703826 5 01 00 fb 00 00
E: 8.707852 5 01 00 fa ff 00
E: 8.711850 5 01 00 fa 00 00
E: 8.715849 5 01 00 fb ff 00
E: 8.723825 5 01 00 fa 00 00
E: 8.727849 5 01 00 fb fe 00
E: 8.731849 5 01 00 fb ff 00
E: 8.735848 5 01 00 fa ff 00
E: 8.743826 5 01 00 fc fe 00
E: 8.747846 5 01 00 fc fe 00
E: 8.751848 5 01 00 fc fd 00
E: 8.755848 5 01 00 fd fd 00
E: 8.763775 5 01 00 fd fd 00
E: 8.767853 5 01 00 fe fd 00
E: 8.771848 5 01 00 fe fd 00
E: 8.775849 5 01 00 ff fd 00
E: 8.783825 5 01 00 ff fc 00
E: 8.787847 5 01 00 00 fc 00
E: 8.791849 5 01 00 02 fc 00
E: 8.795847 5 01 00 01 fb 00
E: 8.803824 5 01 00 03 fb 00
E: 8.807849 5 01 00 04 fb 00
E: 8.811849 5 01 00 04 fa 00
E: 8.815848 5 01 00 05 fb 00
E: 8.823825 5 01 00 06 fa 00
E: 8.827849 5 01 00 07 f9 00
E: 8.831846 5 01 00 07 fa 00
E: 8.835848 5 01 00 08 fa 00
E: 8.843780 5 01 00 09 fa 00
E: 8.847849 5 01 00 0a fa 00
E: 8.851848 5 01 00 0a f9 00
E: 8.855848 5 01 00 0a fa 00
E: 8.863808 5 01 00 0c fb 00
E: 8.867849 5 01 00 0b fc 00
E: 8.871847 5 01 00 0d fb 00
E: 8.875847 5 01 00 0d fc 00
E: 8.883823 5 01 00 0d fd 00
E: 8.887849 5 01 00 0e fd 00
E: 8.891847 5 01 00 0d fe 00
E: 8.895846 5 01 00 0d fe 00
E: 8.903822 5 01 00 0e ff 00
E: 8.907845 5 01 00 0d 00 00
E: 8.911802 5 01 00 0d 00 00
E: 8.915773 5 01 00 0b 01 00
E: 8.923823 5 01 00 0c 01 00
E: 8.927847 5 01 00 0b 02 00
E: 8.931848 5 01 00 0b 01 00
E: 8.935845 5 01 00 0a 02 00
E: 8.943823 5 01 00 09 03 00
E: 8.947775 5 01 00 08 03 00
E: 8.951848 5 01 00 07 03 00
E: 8.955848 5 01 00 07 03 00
E: 8.963823 5 01 00 05 04 00
E: 8.967847 5 01 00 05 04 00
E: 8.971845 5 01 00 04 05 00
E: 8.975846 5 01 00 02 04 00
E: 8.983821 5 01 00 02 05 00
E: 8.987801 5 01 00 00 05 00
E: 8.991779 5 01 00 ff 05 00
E: 8.995775 5 01 00 ff 05 00
E: 9.003821 5 01 00 fd 05 00
E: 9.007845 5 01 00 fc 06 00
E: 9.011846 5 01 00 fb 06 00
E: 9.015845 5 01 00 f9 05 00
E: 9.023820 5 01 00 fa 05 00
E: 9.027846 5 01 00 f8 06 00
E: 9.031844 5 01 00 f7 05 00
E: 9.035844 5 01 00 f6 06 00
E: 9.043820 5 01 00 f5 06 00
E: 9.047844 5 01 00 f4 06 00
E: 9.051845 5 01 00 f4 05 00
E: 9.055843 5 01 00 f3 05 00
E: 9.063818 5 01 00 f2 05 00
E: 9.067761 5 01 00 f2 05 00
E: 9.071849 5 01 00 f0 04 00
E: 9.075843 5 01 00 f1 05 00
E: 9.083820 5 01 00 f0 04 00
E: 9.087844 5 01 00 f0 05 00
E: 9.091846 5 01 00 ef 04 00
E: 9.095842 5 01 00 f0 03 00
E: 9.103820 5 01 00 f0 04 00
E: 9.107843 5 01 00 ef 04 00
E: 9.111843 5 01 00 f0 03 00
E: 9.115843 5 01 00 f1 02 00
E: 9.123818 5 01 00 f2 02 00
E: 9.127844 5 01 00 f2 02 00
E: 9.131844 5 01 00 f4 01 00
E: 9.135838 5 01 00 f5 01 00
E: 9.143817 5 01 00 f7 00 00
E: 9.147841 5 01 00 f9 00 00
E: 9.151769 5 01 00 fa ff 00
E: 9.155843 5 01 00 fc ff 00
E: 9.163817 5 01 00 fd fe 00
E: 9.171817 5 01 00 00 fc 00
E: 9.175843 5 01 00 01 fd 00
E: 9.183818 5 01 00 03 fd 00
E: 9.187841 5 01 00 04 fc 00
E: 9.191842 5 01 00 05 fb 00
E: 9.195842 5 01 00 06 fc 00
E: 9.203769 5 01 00 07 fa 00
E: 9.207842 5 01 00 08 fb 00
E: 9.211841 5 01 00 0a f9 00
E: 9.215840 5 01 00 0a fa 00
E: 9.223758 5 01 00 0b fa 00
E: 9.227797 5 01 00 0d fa 00
E: 9.231770 5 01 00 0b fa 00
E: 9.239818 5 01 00 0d fa 00
E: 9.243840 5 01 00 0e fb 00
E: 9.247841 5 01 00 0d fb 00
E: 9.251841 5 01 00 0f fb 00
E: 9.259817 5 01 00 0d fc 00
E: 9.263841 5 01 00 0f fd 00
E: 9.267840 5 01 00 0d fc 00
E: 9.271840 5 01 00 0e fd 00
E: 9.279816 5 01 00 0d fe 00
E: 9.283841 5 01 00 0c fd 00
E: 9.287841 5 01 00 0d fe 00
E: 9.291841 5 01 00 0c fe 00
E: 9.295841 5 01 00 0b fe 00
E: 9.303814 5 01 00 0c fe 00
E: 9.307766 5 01 00 09 ff 00
E: 9.311777 5 01 00 09 ff 00
E: 9.319816 5 01 00 0a ff 00
E: 9.323840 5 01 00 09 ff 00
E: 9.327839 5 01 00 08 ff 00
E: 9.331839 5 01 00 08 ff 00
E: 9.335838 5 01 00 0a 00 00
E: 9.343816 5 01 00 07 00 00
E: 9.347838 5 01 00 09 ff 00
E: 9.351839 5 01 00 09 01 00
E: 9.359815 5 01 00 0a 00 00
E: 9.363841 5 01 00 0a 00 00
E: 9.367839 5 01 00 0b 00 00
E: 9.371839 5 01 00 0b 00 00
E: 9.375837 5 01 00 0a 00 00
E: 9.383767 5 01 00 0b 01 00
E: 9.387838 5 01 00 0c ff 00
E: 9.391838 5 01 00 0b 00 00
E: 9.399814 5 01 00 0c 00 00
E: 9.403766 5 01 00 0d ff 00
E: 9.407839 5 01 00 0d fe 00
E: 9.411839 5 01 00 0a 00 00
E: 9.415839 5 01 00 0c fe 00
E: 9.423813 5 01 00 0d fd 00
E: 9.427764 5 01 00 0e fe 00
E: 9.431838 5 01 00 0d fd 00
E: 9.439813 5 01 00 0c fe 00
E: 11.311782 5 01 00 fe 03 00
E: 11.335779 5 01 00 ff fd 00
E: 11.387780 5 01 00 03 fe 00
E: 11.403779 5 01 00 03 00 00
E: 11.415781 5 01 00 04 00 00
E: 11.427778 5 01 00 05 ff 00
E: 11.443777 5 01 00 06 00 00
E: 11.455767 5 01 00 06 ff 00
E: 11.467779 5 01 00 08 ff 00
E: 11.479730 5 01 00 0a ff 00
E: 11.495777 5 01 00 0b ff 00
E: 11.507775 5 01 00 0f ff 00
E: 11.519737 5 01 00 0f 00 00
E: 11.535728 5 01 00 11 ff 00
E: 11.547777 5 01 00 10 00 00
E: 11.559776 5 01 00 12 00 00
E: 11.571776 5 01 00 11 00 00
E: 11.587775 5 01 00 14 02 00
E: 11.599726 5 01 00 12 01 00
E: 11.611775 5 01 00 13 02 00
E: 11.627777 5 01 00 13 02 00
E: 11.639775 5 01 00 11 02 00
E: 11.651774 5 01 00 0f 02 00
E: 11.663716 5 01 00 0e 01 00
E: 11.679774 5 01 00 0b 02 00
E: 11.691772 5 01 00 09 02 00
E: 11.703752 5 01 00 05 02 00
E: 11.731729 5 01 00 ff 04 00
E: 11.743775 5 01 00 fc 02 00
E: 11.755725 5 01 00 f8 03 00
E: 11.771774 5 01 00 f6 02 00
E: 11.783771 5 01 00 f4 04 00
E: 11.795753 5 01 00 f3 03 00
E: 11.811772 5 01 00 f3 04 00
E: 11.823772 5 01 00 f3 03 00
E: 11.835770 5 01 00 f5 03 00
E: 11.851771 5 01 00 f6 04 00
E: 11.863770 5 01 00 f8 03 00
E: 11.875751 5 01 00 fb 03 00
E: 11.887770 5 01 00 fc 03 00
E: 11.915773 5 01 00 fc 04 00
E: 11.979769 5 01 00 00 03 00
E: 12.007769 5 01 00 00 04 00
E: 12.035768 5 01 00 01 03 00
E: 12.139726 5 01 00 01 03 00
E: 12.231766 5 01 00 01 fc 00
E: 12.255765 5 01 00 02 fd 00
E: 12.283762 5 01 00 00 fc 00
E: 12.347762 5 01 02 01 fe 00
E: 12.507760 5 01 00 01 01 00
E: 12.703757 5 01 00 fc ff 00
E: 12.731752 5 01 00 fc ff 00
E: 12.847754 5 01 00 ff 00 01
E: 12.863754 5 01 00 00 00 00
E: 12.875754 5 01 00 00 00 01
E: 12.887754 5 01 00 00 00 00
E: 12.903754 5 01 00 00 00 01
E: 12.915751 5 01 00 00 00 00
E: 12.927752 5 01 00 00 00 01
E: 12.943752 5 01 00 00 00 00
E: 12.955752 5 01 00 00 00 01
E: 12.967753 5 01 00 00 00 00
E: 12.979752 5 01 00 00 00 01
E: 12.995751 5 01 00 00 00 00
E: 13.007751 5 01 00 00 01 01
E: 13.019754 5 01 00 00 00 00
E: 13.099693 5 01 00 01 03 00
E: 13.123750 5 01 00 00 03 00
E: 13.139748 5 01 00 00 03 00
E: 13.151750 5 01 00 00 03 ff
E: 13.163726 5 01 00 ff 03 00
E: 13.179748 5 01 00 ff 03 00
E: 13.191748 5 01 00 00 02 ff
E: 13.203747 5 01 00 00 00 00
E: 13.295744 5 01 00 ff 00 01
E: 13.311746 5 01 00 00 00 00
E: 13.323727 5 01 00 00 00 01
E: 13.335743 5 01 00 00 00 00
E: 13.347744 5 01 00 00 ff 01
E: 13.363742 5 01 00 00 00 00
E: 13.375745 5 01 00 00 00 01
E: 13.387744 5 01 00 00 00 00
E: 13.403744 5 01 00 00 00 01
E: 13.415744 5 01 00 00 00 00
E: 13.427743 5 01 00 00 00 01
E: 13.439692 5 01 00 00 00 00
E: 13.507743 5 01 00 00 00 ff
E: 13.519743 5 01 00 00 00 00
E: 13.531742 5 01 00 00 00 ff
E: 13.547740 5 01 00 00 00 00
E: 13.559742 5 01 00 00 00 ff
E: 13.571742 5 01 00 00 00 00
E: 13.587742 5 01 00 00 00 ff
E: 13.599741 5 01 00 00 00 00
E: 13.611740 5 01 00 00 00 ff
E: 13.623739 5 01 00 00 00 00
E: 13.731739 5 01 00 00 fd 00
E: 13.863736 5 01 00 01 00 ff
E: 13.875738 5 01 00 00 00 00
E: 13.887737 5 01 00 00 00 ff
E: 13.903736 5 01 00 00 01 00
E: 13.915735 5 01 00 00 01 ff
E: 13.927735 5 01 00 00 02 00
E: 13.939690 5 01 00 00 01 ff
E: 13.955735 5 01 00 00 01 00
E: 13.967734 5 01 00 00 00 ff
E: 13.979735 5 01 00 00 01 00
E: 13.995675 5 01 00 00 00 ff
E: 14.007735 5 01 00 00 00 00
E: 14.019734 5 01 00 00 00 ff
E: 14.031733 5 01 00 00 00 00
E: 14.047673 5 01 00 00 00 ff
E: 14.059734 5 01 00 00 00 00
E: 14.243731 5 01 00 03 fd 00
E: 14.295671 5 01 00 ff fd 00
E: 14.323730 5 01 00 fe fd 00
E: 14.347729 5 01 01 00 ff 00
E: 14.531724 5 01 00 ff 01 00
E: 14.599722 5 01 00 fd fe 00
E: 14.639723 5 01 00 fd ff 00
E: 14.743721 5 01 00 ff 03 00
E: 14.823720 5 01 00 ff 03 00
E: 15.267712 5 01 00 fc 04 00
E: 15.283709 5 01 00 fe 04 00
E: 15.295710 5 01 00 fc 04 00
E: 15.307713 5 01 00 fd 03 00
E: 15.323713 5 01 00 fd 03 00
E: 15.335709 5 01 00 fc 03 00
E: 15.347711 5 01 00 fd 02 00
E: 15.363717 5 01 00 fc 02 00
E: 15.375719 5 01 00 fa 01 00
E: 15.387718 5 01 00 fa 02 00
E: 15.399717 5 01 00 fa 01 00
E: 15.415718 5 01 00 fc 01 00
E: 15.427718 5 01 00 fd 01 00
E: 15.623705 5 01 00 fc 00 00
E: 15.639706 5 01 00 fd 00 00
E: 15.651648 5 01 00 fa 00 00
E: 15.663713 5 01 00 f9 00 00
E: 15.675712 5 01 00 f6 00 00
E: 15.691716 5 01 00 f5 00 00
E: 15.703711 5 01 00 f3 ff 00
E: 15.715713 5 01 00 f0 ff 00
E: 15.731701 5 01 00 ee fe 00
E: 15.743711 5 01 00 ec fd 00
E: 15.755645 5 01 00 e8 fd 00
E: 15.767711 5 01 00 e8 fd 00
E: 15.783711 5 01 00 e7 fc 00
E: 15.795709 5 01 00 e9 fb 00
E: 15.807712 5 01 00 ec fa 00
E: 15.823710 5 01 00 ef f8 00
E: 15.835708 5 01 00 f3 f7 00
E: 15.847710 5 01 00 f9 f6 00
E: 15.859709 5 01 00 fd f4 00
E: 15.875710 5 01 00 02 f2 00
E: 15.887642 5 01 00 06 ef 00
E: 15.899710 5 01 00 0a ef 00
E: 15.915709 5 01 00 0e ee 00
E: 15.927708 5 01 00 12 ed 00
E: 15.939699 5 01 00 14 ea 00
E: 15.951699 5 01 00 19 ed 00
E: 15.967640 5 01 00 1c ed 00
E: 15.979709 5 01 00 1e ed 00
E: 15.991641 5 01 00 21 f1 00
E: 16.007707 5 01 00 23 f3 00
E: 16.019707 5 01 00 24 f5 00
E: 16.031708 5 01 00 24 f8 00
E: 16.043708 5 01 00 22 fa 00
E: 16.059642 5 01 00 23 fc 00
E: 16.071629 5 01 00 1f ff 00
E: 16.083672 5 01 00 1e 01 00
E: 16.099697 5 01 00 1c 04 00
E: 16.111696 5 01 00 19 05 00
E: 16.123695 5 01 00 18 06 00
E: 16.135690 5 01 00 15 07 00
E: 16.151697 5 01 00 13 08 00
E: 16.163696 5 01 00 11 07 00
E: 16.175695 5 01 00 0d 06 00
E: 16.191694 5 01 00 0a 05 00
E: 16.203694 5 01 00 08 05 00
E: 16.215682 5 01 00 05 04 00
E: 16.231702 5 01 00 04 04 00
E: 16.255703 5 01 00 04 04 00
E: 16.307701 5 01 00 fd fe 00
E: 16.335700 5 01 00 fb fb 00
E: 16.347694 5 01 00 fc fc 00
E: 16.359636 5 01 00 fd fb 00
E: 16.375701 5 01 00 fd fb 00
E: 16.387680 5 01 00 fd f9 00
E: 16.399699 5 01 00 00 f9 00
E: 16.415700 5 01 00 01 f7 00
E: 16.427700 5 01 00 03 f7 00
E: 16.439700 5 01 00 05 f6 00
E: 16.451699 5 01 00 07 f5 00
E: 16.467628 5 01 00 09 f6 00
E: 16.479699 5 01 00 09 f6 00
E: 16.491698 5 01 00 0a f5 00
E: 16.507698 5 01 00 0b f7 00
E: 16.519698 5 01 00 0a f7 00
E: 16.531702 5 01 00 0a f7 00
E: 16.543700 5 01 00 0a f8 00
E: 16.899692 5 01 00 f9 c7 00
E: 16.911690 5 01 00 f0 02 00
E: 16.927692 5 01 00 ee 01 00
E: 16.939693 5 01 00 ee 01 00
E: 16.951692 5 01 00 ec 00 00
E: 16.967689 5 01 00 ed 01 00
E: 16.979621 5 01 00 ec 00 00
E: 16.991683 5 01 00 eb ff 00
E: 17.003623 5 01 00 eb ff 00
E: 17.019681 5 01 00 eb fe 00
E: 17.031679 5 01 00 ea fd 00
E: 17.043681 5 01 00 eb fe 00
E: 17.059679 5 01 00 ea fe 00
E: 17.071680 5 01 00 ea fe 00
E: 17.083680 5 01 00 eb fe 00
E: 17.099679 5 01 00 e9 fd 00
E: 17.111678 5 01 00 e8 fe 00
E: 17.123679 5 01 00 ea fd 00
E: 17.135677 5 01 00 e9 fd 00
E: 17.151626 5 01 00 e9 fd 00
E: 17.163680 5 01 00 ea fc 00
E: 17.175678 5 01 00 ea fc 00
E: 17.191679 5 01 00 ea fc 00
E: 17.203680 5 01 00 ec fb 00
E: 17.215619 5 01 00 ed fa 00
E: 17.227677 5 01 00 ed fa 00
E: 17.243676 5 01 00 f0 f8 00
E: 17.255677 5 01 00 f0 f7 00
E: 17.819669 5 01 00 25 c7 00
E: 17.835613 5 01 00 0b 11 00
E: 17.847676 5 01 00 0a 0e 00
E: 17.859677 5 01 00 0c 0f 00
E: 17.875675 5 01 00 0b 0d 00
E: 17.887672 5 01 00 0b 0e 00
E: 17.899673 5 01 00 0b 0e 00
E: 17.911674 5 01 00 0b 0d 00
E: 17.927674 5 01 00 0a 0e 00
E: 17.939665 5 01 00 0c 0d 00
E: 17.951664 5 01 00 0b 0f 00
E: 17.963674 5 01 00 0b 0d 00
E: 17.979669 5 01 00 0c 0d 00
E: 17.991672 5 01 00 0c 0e 00
E: 18.003671 5 01 00 0c 0d 00
E: 18.775658 5 01 00 d3 d8 00
E: 18.791649 5 01 00 e9 f0 00
E: 18.803658 5 01 00 ea fa 00
E: 18.815659 5 01 00 e3 f6 00
E: 18.827637 5 01 00 e7 f0 00
E: 18.843648 5 01 00 e6 ef 00
E: 18.855648 5 01 00 e3 f5 00
E: 18.867657 5 01 00 e5 f4 00
E: 18.883656 5 01 00 e4 f5 00
E: 18.895656 5 01 00 e7 f6 00
E: 18.907634 5 01 00 ea f7 00
E: 18.919655 5 01 00 ed f8 00
E: 18.935655 5 01 00 f0 fa 00
E: 18.947656 5 01 00 f4 fb 00
E: 18.959655 5 01 00 f7 fc 00
E: 18.975652 5 01 00 f9 fd 00
E: 18.987653 5 01 00 fc fd 00
E: 18.999654 5 01 00 fd fd 00
E: 19.223641 5 01 00 04 03 00
E: 19.251642 5 01 00 05 fd 00
E: 19.263649 5 01 00 03 ff 00
E: 19.275651 5 01 00 03 ff 00
E: 19.303628 5 01 00 04 fe 00
E: 19.315650 5 01 00 03 00 00
E: 19.343649 5 01 00 04 fe 00
E: 19.355648 5 01 00 01 fd 00
E: 19.367648 5 01 00 01 fd 00
E: 19.383626 5 01 00 01 fd 00
E: 19.395647 5 01 00 01 fd 00
E: 19.407649 5 01 00 01 fd 00
E: 19.435638 5 01 00 03 fc 00
E: 19.459645 5 01 00 01 fb 00
E: 19.487646 5 01 00 02 fd 00
E: 19.511647 5 01 00 00 fd 00
E: 19.751634 5 01 00 fd fb 00
E: 19.763632 5 01 00 ff fc 00
E: 19.775632 5 01 00 ff fd 00
E: 19.803614 5 01 00 00 fc 00
E: 19.827632 5 01 00 ff fc 00
E: 19.855631 5 01 00 fb fb 00
E: 19.867631 5 01 00 fa ff 00
E: 19.879630 5 01 00 fa fe 00
E: 19.895638 5 01 00 f9 00 00
E: 19.907639 5 01 00 f9 fe 00
E: 19.919639 5 01 00 f9 00 00
E: 19.935637 5 01 00 fa 00 00
E: 19.947639 5 01 00 f9 00 00
E: 19.959629 5 01 00 f9 00 00
E: 19.975610 5 01 00 fa 00 00
E: 19.987629 5 01 00 fa 00 00
E: 19.999629 5 01 00 fa 00 00
E: 20.011631 5 01 00 fb 01 00
E: 20.027627 5 01 00 fb 01 00
E: 20.039629 5 01 00 fc 00 00
E: 20.051628 5 01 00 fc 01 00
E: 20.067620 5 01 00 fc 01 00
E: 20.091637 5 01 00 fc 02 00
E: 20.119635 5 01 00 fd 01 00
E: 20.435630 5 01 00 ff 03 00
E: 20.447632 5 01 00 ff 03 00
E: 20.459611 5 01 00 fd 04 00
E: 20.471631 5 01 00 fd 05 00
E: 20.487629 5 01 00 fb 07 00
E: 20.499628 5 01 00 f9 07 00
E: 20.511629 5 01 00 f9 08 00
E: 20.527628 5 01 00 f7 07 00
E: 20.539607 5 01 00 f5 08 00
E: 20.551628 5 01 00 f2 08 00
E: 20.563627 5 01 00 f2 07 00
E: 20.579626 5 01 00 f1 08 00
E: 20.591627 5 01 00 f0 08 00
E: 20.603627 5 01 00 f1 08 00
E: 20.619625 5 01 00 f2 08 00
E: 20.631570 5 01 00 f4 06 00
E: 20.643559 5 01 00 f7 07 00
E: 20.659627 5 01 00 fc 06 00
E: 20.671625 5 01 00 ff 04 00
E: 20.683625 5 01 00 02 03 00
E: 20.695624 5 01 00 06 03 00
E: 20.711624 5 01 00 0a 02 00
E: 20.723628 5 01 00 0c 02 00
E: 20.735622 5 01 00 11 01 00
E: 20.751571 5 01 00 13 00 00
E: 20.763566 5 01 00 17 00 00
E: 20.775625 5 01 00 1a 00 00
E: 20.787564 5 01 00 1b ff 00
E: 20.803570 5 01 00 1c ff 00
E: 20.815564 5 01 00 1d ff 00
E: 20.827623 5 01 00 1f ff 00
E: 20.843623 5 01 00 1f 00 00
E: 20.855623 5 01 00 1f ff 00
E: 20.867622 5 01 00 20 00 00
E: 20.879621 5 01 00 1d 00 00
E: 20.895621 5 01 00 1d fe 00
E: 20.907622 5 01 00 19 fe 00
E: 20.919622 5 01 00 18 fe 00
E: 20.935624 5 01 00 15 ff 00
E: 20.947622 5 01 00 13 00 00
E: 20.959564 5 01 00 10 00 00
E: 20.971593 5 01 00 0d 00 00
E: 20.987612 5 01 00 0b 00 00
E: 20.999612 5 01 00 07 ff 00
E: 21.011562 5 01 00 04 fe 00
E: 21.027611 5 01 00 03 fe 00
E: 21.051610 5 01 00 02 fd 00
E: 21.079609 5 01 00 fc fe 00
E: 21.091552 5 01 00 fc fd 00
E: 21.103610 5 01 00 fa fd 00
E: 21.119609 5 01 00 fa fe 00
E: 21.131609 5 01 00 f9 fe 00
E: 21.143558 5 01 00 fa fd 00
E: 21.155610 5 01 00 fa fd 00
E: 21.171609 5 01 00 fb fb 00
E: 21.183559 5 01 00 fb fc 00
E: 21.195607 5 01 00 fb fb 00
E: 21.211558 5 01 00 fb fb 00
E: 21.223607 5 01 00 fa fc 00
E: 21.235605 5 01 00 fa fc 00
E: 21.247548 5 01 00 f9 fc 00
E: 21.263608 5 01 00 f8 fd 00
E: 21.275606 5 01 00 f6 fc 00
E: 21.287606 5 01 00 f8 fd 00
E: 21.303604 5 01 00 f9 fd 00
E: 21.315561 5 01 00 f8 fe 00
E: 21.327606 5 01 00 f8 fe 00
E: 21.343607 5 01 00 f8 ff 00
E: 21.355609 5 01 00 f8 ff 00
E: 21.367601 5 01 00 f6 ff 00
E: 21.379605 5 01 00 f4 00 00
E: 21.395603 5 01 00 f4 00 00
E: 21.407607 5 01 00 f2 01 00
E: 21.419604 5 01 00 f0 02 00
E: 21.435602 5 01 00 ef 02 00
E: 21.447602 5 01 00 ef 04 00
E: 21.459602 5 01 00 ed 04 00
E: 21.471602 5 01 00 ed 06 00
E: 21.487601 5 01 00 ee 06 00
E: 21.499602 5 01 00 ee 06 00
E: 21.511601 5 01 00 f0 06 00
E: 21.527602 5 01 00 f3 07 00
E: 21.539584 5 01 00 f5 08 00
E: 21.551602 5 01 00 f7 07 00
E: 21.563601 5 01 00 fa 05 00
E: 21.579542 5 01 00 fd 05 00
E: 21.591602 5 01 00 01 04 00
E: 21.603601 5 01 00 04 03 00
E: 21.619599 5 01 00 09 02 00
E: 21.631573 5 01 00 0f 03 00
E: 21.643599 5 01 00 12 03 00
E: 21.655599 5 01 00 16 02 00
E: 21.671600 5 01 00 17 00 00
E: 21.683599 5 01 00 14 00 00
E: 21.695598 5 01 00 16 ff 00
E: 21.711584 5 01 00 15 fe 00
E: 21.723598 5 01 00 12 ff 00
E: 21.735597 5 01 00 11 ff 00
E: 21.747599 5 01 00 0f 00 00
E: 21.763597 5 01 00 0c 00 00
E: 21.775598 5 01 00 0b ff 00
E: 21.787544 5 01 00 0b ff 00
E: 21.803599 5 01 00 0c fe 00
E: 21.815570 5 01 00 0c fd 00
E: 21.827596 5 01 00 0a fd 00
E: 21.839596 5 01 00 09 fd 00
E: 21.855591 5 01 00 06 fe 00
E: 21.895594 5 01 00 f8 ff 00
E: 21.907595 5 01 00 f6 01 00
E: 21.919595 5 01 00 f3 01 00
E: 21.931591 5 01 00 f0 02 00
E: 21.947595 5 01 00 f0 01 00
E: 21.959594 5 01 00 eb 01 00
E: 21.971593 5 01 00 eb 00 00
E: 21.987595 5 01 00 eb 01 00
E: 21.999536 5 01 00 e9 00 00
E: 22.011593 5 01 00 e9 01 00
E: 22.023592 5 01 00 eb 00 00
E: 22.039595 5 01 00 ec 01 00
E: 22.051595 5 01 00 f0 01 00
E: 22.063593 5 01 00 f4 01 00
E: 22.079545 5 01 00 fa fe 00
E: 22.103592 5 01 00 02 fa 00
E: 22.119593 5 01 00 07 fb 00
E: 22.131591 5 01 00 0c fa 00
E: 22.143592 5 01 00 10 f9 00
E: 22.155590 5 01 00 14 f9 00
E: 22.171590 5 01 00 14 f9 00
E: 22.183589 5 01 00 17 f9 00
E: 22.195542 5 01 00 19 fa 00
E: 22.211592 5 01 00 18 fb 00
E: 22.223590 5 01 00 18 fa 00
E: 22.235588 5 01 00 16 fc 00
E: 22.247590 5 01 00 16 fc 00
E: 22.263592 5 01 00 13 fe 00
E: 22.275589 5 01 00 10 ff 00
E: 22.287588 5 01 00 0c 00 00
E: 22.303530 5 01 00 07 01 00
E: 22.315589 5 01 00 03 02 00
E: 22.327528 5 01 00 00 03 00
E: 22.339590 5 01 00 fd 03 00
E: 22.355586 5 01 00 fa 03 00
E: 22.367589 5 01 00 f7 04 00
E: 22.379587 5 01 00 f3 04 00
E: 22.395587 5 01 00 ee 04 00
E: 22.407587 5 01 00 eb 05 00
E: 22.419586 5 01 00 e9 06 00
E: 22.431585 5 01 00 e6 07 00
E: 22.447585 5 01 00 e6 08 00
E: 22.459586 5 01 00 e7 09 00
E: 22.471588 5 01 00 e9 07 00
E: 22.487537 5 01 00 ed 06 00
E: 22.499586 5 01 00 f2 05 00
E: 22.511584 5 01 00 f8 01 00
E: 22.539584 5 01 00 02 fd 00
E: 22.551585 5 01 00 07 fd 00
E: 22.563585 5 01 00 0b fc 00
E: 22.579584 5 01 00 0f fb 00
E: 22.591579 5 01 00 14 fa 00
E: 22.603528 5 01 00 19 f9 00
E: 22.615584 5 01 00 1a f9 00
E: 22.631582 5 01 00 1d f8 00
E: 22.643580 5 01 00 1d fa 00
E: 22.655581 5 01 00 20 fb 00
E: 22.671584 5 01 00 1e fb 00
E: 22.683560 5 01 00 1f fc 00
E: 22.695581 5 01 00 1e fd 00
E: 22.707563 5 01 00 1d fe 00
E: 22.723582 5 01 00 1d 00 00
E: 25.563538 5 01 00 ff 05 00
E: 25.571530 5 01 00 00 06 00
E: 25.575554 5 01 00 ff 03 00
E: 25.583475 5 01 00 ff 03 00
E: 25.587556 5 01 00 00 03 00
E: 25.591555 5 01 00 ff 03 00
E: 25.595554 5 01 00 00 03 00
E: 25.603473 5 01 00 ff 03 00
E: 25.611528 5 01 00 fe 05 00
E: 25.623529 5 01 00 ff 05 00
E: 25.631539 5 01 00 fe 04 00
E: 25.643538 5 01 00 ff 05 00
E: 25.651538 5 01 00 fe 04 00
E: 25.663540 5 01 00 ff 03 00
E: 25.671471 5 01 00 fe 04 00
E: 25.683538 5 01 00 ff 03 00
E: 25.691471 5 01 00 00 04 00
E: 25.703481 5 01 00 ff 03 00
E: 25.711538 5 01 00 00 03 00
E: 25.727536 5 01 00 00 04 00
E: 25.743537 5 01 00 ff 03 00
E: 25.751470 5 01 00 00 03 00
E: 25.767527 5 01 00 ff 04 00
E: 25.783526 5 01 00 00 03 00
E: 25.791479 5 01 00 00 03 00
E: 25.807527 5 01 00 00 03 00
E: 25.827525 5 01 00 ff 03 00
E: 25.851526 5 01 00 ff 03 00
E: 25.879478 5 01 00 ff 03 00
E: 25.891527 5 01 00 ff 03 00
E: 25.907534 5 01 00 ff 03 00
E: 25.927533 5 01 00 ff 03 00
E: 25.947467 5 01 00 fe 03 00
E: 26.003533 5 01 00 ff 03 00
E: 26.043522 5 01 00 00 03 00
E: 26.071531 5 01 00 01 03 00
E: 26.191529 5 01 00 00 03 00
E: 26.219519 5 01 00 00 03 00
E: 26.243528 5 01 00 01 03 00
E: 26.267527 5 01 00 01 03 00
E: 26.287519 5 01 00 ff 03 00
E: 26.299516 5 01 00 00 03 00
E: 26.307463 5 01 00 ff 03 00
E: 26.319450 5 01 00 00 04 00
E: 26.327519 5 01 00 00 04 00
E: 26.339517 5 01 00 00 04 00
E: 26.347517 5 01 00 00 03 00
E: 26.359517 5 01 00 00 04 00
E: 26.367503 5 01 00 00 04 00
E: 26.379524 5 01 00 00 03 00
E: 26.387526 5 01 00 00 04 00
E: 26.391549 5 01 00 00 03 00
E: 26.403518 5 01 00 00 04 00
E: 26.411517 5 01 00 00 05 00
E: 26.423525 5 01 00 00 05 00
E: 26.431526 5 01 00 00 05 00
E: 26.439526 5 01 00 00 03 00
E: 26.443548 5 01 00 00 03 00
E: 26.451469 5 01 00 00 05 00
E: 26.459524 5 01 00 00 03 00
E: 26.467515 5 01 00 00 04 00
E: 26.471539 5 01 00 00 03 00
E: 26.483516 5 01 00 01 04 00
E: 26.491514 5 01 00 01 04 00
E: 26.503515 5 01 00 01 03 00
E: 26.511514 5 01 00 01 03 00
E: 26.523474 5 01 00 01 03 00
E: 26.539457 5 01 00 01 03 00
E: 26.547514 5 01 00 01 03 00
E: 26.563515 5 01 00 00 03 00
E: 26.579512 5 01 00 01 03 00
E: 26.591514 5 01 00 01 03 00
E: 26.607522 5 01 00 01 03 00
E: 26.623521 5 01 00 01 03 00
E: 26.639521 5 01 00 01 03 00
E: 26.671521 5 01 00 01 03 00
E: 26.707524 5 01 00 ff fd 00
E: 26.719453 5 01 00 ff fd 00
E: 26.727519 5 01 00 ff fd 00
E: 26.739519 5 01 00 ff fc 00
E: 26.747519 5 01 00 00 fc 00
E: 26.759518 5 01 00 ff fb 00
E: 26.767494 5 01 00 00 fc 00
E: 26.771542 5 01 00 00 fd 00
E: 26.779518 5 01 00 ff fd 00
E: 26.787519 5 01 00 ff fc 00
E: 26.799519 5 01 00 ff fb 00
E: 26.807449 5 01 00 ff fc 00
E: 26.819519 5 01 00 fe fc 00
E: 26.827517 5 01 00 ff fc 00
E: 26.839517 5 01 00 fe fd 00
E: 26.847449 5 01 00 ff fc 00
E: 26.859440 5 01 00 00 fd 00
E: 26.867457 5 01 00 00 fd 00
E: 26.879518 5 01 00 ff fd 00
E: 26.887484 5 01 00 01 fd 00
E: 26.899517 5 01 00 00 fd 00
E: 26.911517 5 01 00 00 fd 00
E: 26.931497 5 01 00 00 fd 00
E: 26.955517 5 01 00 00 fd 00
E: 26.987507 5 01 00 ff fd 00
E: 27.255504 5 01 00 02 fd 00
E: 27.275502 5 01 00 00 fc 00
E: 27.287502 5 01 00 02 fd 00
E: 27.299501 5 01 00 01 fd 00
E: 27.307501 5 01 00 01 fd 00
E: 27.319503 5 01 00 01 fc 00
E: 27.327502 5 01 00 ff fd 00
E: 27.339443 5 01 00 ff fc 00
E: 27.347499 5 01 00 ff fc 00
E: 27.359488 5 01 00 00 fc 00
E: 27.367441 5 01 00 00 fd 00
E: 27.375500 5 01 00 01 fd 00
E: 27.383500 5 01 00 01 fd 00
E: 27.387523 5 01 00 01 fd 00
E: 27.399500 5 01 00 00 fc 00
E: 27.407500 5 01 00 00 fb 00
E: 27.419499 5 01 00 00 fc 00
E: 27.427499 5 01 00 fe fc 00
E: 27.439496 5 01 00 fe fc 00
E: 27.447479 5 01 00 ff fc 00
E: 27.459499 5 01 00 ff fc 00
E: 27.467440 5 01 00 00 fd 00
E: 27.479508 5 01 00 ff fc 00
E: 27.487507 5 01 00 00 fc 00
E: 27.499506 5 01 00 00 fc 00
E: 27.507505 5 01 00 00 fd 00
E: 27.523504 5 01 00 ff fd 00
E: 27.615448 5 01 00 fe 04 00
E: 27.627495 5 01 00 00 03 00
E: 27.639495 5 01 00 01 03 00
E: 27.647495 5 01 00 00 03 00
E: 27.663494 5 01 00 ff 03 00
E: 27.675494 5 01 00 00 03 00
E: 27.683494 5 01 00 00 03 00
E: 27.695435 5 01 00 00 04 00
E: 27.707428 5 01 00 01 04 00
E: 27.723426 5 01 00 02 04 00
E: 27.743493 5 01 00 02 03 00
E: 27.759495 5 01 00 01 03 00
E: 27.779490 5 01 00 01 03 00
E: 27.795492 5 01 00 01 03 00
E: 27.815492 5 01 00 02 03 00
E: 27.823493 5 01 02 00 00 00
E: 28.019494 5 01 00 01 01 00
E: 28.263495 5 01 00 01 fd 00
E: 28.343484 5 01 04 01 ff 00
E: 28.531432 5 01 00 00 00 00
E: 28.719428 5 01 00 fd 00 00
E: 28.735476 5 01 00 fd 00 00
E: 28.739501 5 01 01 ff 00 00
E: 28.871423 5 01 00 00 00 00
E: 30.003454 5 01 02 00 00 00
E: 30.155451 5 01 00 00 00 00
E: 30.531444 5 01 00 fd ff 00
E: 30.547386 5 01 00 fd ff 00
E: 30.563447 5 01 00 fd ff 00
E: 30.575395 5 01 00 fd 00 00
E: 31.031436 5 01 00 ff 03 00
E: 31.051434 5 01 00 01 03 00
E: 31.071376 5 01 00 02 03 00
E: 31.091385 5 01 00 01 03 00
E: 31.123434 5 01 00 01 03 00
E: 31.151433 5 01 00 ff 03 00
E: 31.167433 5 01 00 ff 03 00
E: 31.183414 5 01 00 00 04 00
E: 31.191433 5 01 00 00 03 00
E: 31.203433 5 01 00 00 03 00
E: 31.211432 5 01 00 01 03 00
E: 31.223430 5 01 00 00 03 00
E: 31.231432 5 01 00 01 03 00
E: 31.243431 5 01 00 01 03 00
E: 31.251431 5 01 00 00 03 00
E: 31.263410 5 01 00 01 04 00
E: 31.271433 5 01 00 00 03 00
E: 31.283431 5 01 00 00 04 00
E: 31.291433 5 01 00 00 04 00
E: 31.303432 5 01 00 00 03 00
E: 31.311432 5 01 00 01 04 00
E: 31.323430 5 01 00 00 03 00
E: 31.331431 5 01 00 01 04 00
E: 31.343371 5 01 00 01 04 00
E: 31.351379 5 01 00 00 03 00
E: 31.363430 5 01 00 01 04 00
E: 31.371425 5 01 00 01 03 00
E: 31.383430 5 01 00 01 03 00
E: 31.391430 5 01 00 00 04 00
E: 31.403370 5 01 00 01 04 00
E: 31.411429 5 01 00 02 03 00
E: 31.423370 5 01 00 01 04 00
E: 31.431430 5 01 00 01 04 00
E: 31.443417 5 01 00 00 03 00
E: 31.451428 5 01 00 00 04 00
E: 31.463428 5 01 00 00 03 00
E: 31.471427 5 01 00 00 04 00
E: 31.483428 5 01 00 ff 04 00
E: 31.491427 5 01 00 00 04 00
E: 31.503428 5 01 00 ff 04 00
E: 31.511427 5 01 00 00 04 00
E: 31.519423 5 01 00 00 03 00
E: 31.527377 5 01 00 ff 05 00
E: 31.539367 5 01 00 00 04 00
E: 31.543451 5 01 00 ff 03 00
E: 31.551426 5 01 00 00 04 00
E: 31.563426 5 01 00 ff 05 00
E: 31.571425 5 01 00 00 04 00
E: 31.579427 5 01 00 ff 03 00
E: 31.587426 5 01 00 00 04 00
E: 31.591449 5 01 00 ff 03 00
E: 31.603426 5 01 00 00 04 00
E: 31.607449 5 01 00 ff 03 00
E: 31.619404 5 01 00 ff 04 00
E: 31.627424 5 01 00 ff 04 00
E: 31.631449 5 01 00 00 03 00
E: 31.643424 5 01 00 00 05 00
E: 31.651425 5 01 00 00 05 00
E: 31.663425 5 01 00 00 04 00
E: 31.667448 5 01 00 00 03 00
E: 31.679424 5 01 00 ff 05 00
E: 31.687423 5 01 00 00 04 00
E: 31.691449 5 01 00 01 03 00
E: 31.703366 5 01 00 00 04 00
E: 31.711355 5 01 00 ff 05 00
E: 31.723425 5 01 00 00 04 00
E: 31.731423 5 01 00 01 04 00
E: 31.743424 5 01 00 00 05 00
E: 31.751422 5 01 00 00 04 00
E: 31.763431 5 01 00 ff 04 00
E: 31.771430 5 01 00 00 04 00
E: 31.783430 5 01 00 00 04 00
E: 31.791430 5 01 00 00 04 00
E: 31.803422 5 01 00 01 05 00
E: 31.811430 5 01 00 01 05 00
E: 31.819429 5 01 00 00 03 00
E: 31.827429 5 01 00 01 05 00
E: 31.839430 5 01 00 01 04 00
E: 31.843454 5 01 00 01 03 00
E: 31.851408 5 01 00 01 05 00
E: 31.863429 5 01 00 00 04 00
E: 31.867452 5 01 00 00 03 00
E: 31.879422 5 01 00 01 04 00
E: 31.883444 5 01 00 00 03 00
E: 31.891421 5 01 00 ff 05 00
E: 31.903421 5 01 00 00 05 00
E: 31.911420 5 01 00 00 04 00
E: 31.923420 5 01 00 00 05 00
E: 31.931420 5 01 00 00 04 00
E: 31.943404 5 01 00 00 05 00
E: 31.955419 5 01 00 00 04 00
E: 31.963421 5 01 00 ff 05 00
E: 31.975420 5 01 00 00 04 00
E: 31.983419 5 01 00 00 04 00
E: 31.995417 5 01 00 00 04 00
E: 32.003418 5 01 00 ff 04 00
E: 32.015396 5 01 00 ff 04 00
E: 32.023418 5 01 00 00 04 00
E: 32.035418 5 01 00 ff 04 00
E: 32.043417 5 01 00 00 04 00
E: 32.047441 5 01 00 00 03 00
E: 32.059418 5 01 00 00 04 00
E: 32.067418 5 01 00 ff 03 00
E: 32.079418 5 01 00 00 04 00
E: 32.087416 5 01 00 00 04 00
E: 32.095406 5 01 00 00 03 00
E: 32.103417 5 01 00 ff 04 00
E: 32.115411 5 01 00 ff 05 00
E: 32.123416 5 01 00 00 04 00
E: 32.135417 5 01 00 ff 05 00
E: 32.143417 5 01 00 ff 04 00
E: 32.155414 5 01 00 ff 04 00
E: 32.159440 5 01 00 ff 03 00
E: 32.167368 5 01 00 ff 04 00
E: 32.179415 5 01 00 ff 05 00
E: 32.187417 5 01 00 ff 04 00
E: 32.199415 5 01 00 00 04 00
E: 32.207415 5 01 00 00 05 00
E: 32.219416 5 01 00 ff 04 00
E: 32.227414 5 01 00 ff 05 00
E: 32.239415 5 01 00 ff 05 00
E: 32.247366 5 01 00 fe 04 00
E: 32.255413 5 01 00 00 03 00
E: 32.263415 5 01 00 fe 04 00
E: 32.275413 5 01 00 fe 03 00
E: 32.283415 5 01 00 fe 04 00
E: 32.295412 5 01 00 ff 03 00
E: 32.303413 5 01 00 fe 03 00
E: 32.315412 5 01 00 ff 03 00
E: 32.323413 5 01 00 00 04 00
E: 32.335392 5 01 00 ff 03 00
E: 32.347415 5 01 00 fe 04 00
E: 32.359413 5 01 00 fe 03 00
E: 32.375412 5 01 00 fe 04 00
E: 32.387413 5 01 00 fe 03 00
E: 32.403414 5 01 00 fe 03 00
E: 32.427410 5 01 00 fe 03 00
E: 32.455411 5 01 00 ff 03 00
E: 32.487409 5 01 00 01 03 00
E: 32.519411 5 01 00 ff 03 00
E: 32.555409 5 01 00 00 03 00
E: 32.587408 5 01 00 00 03 00
E: 32.623408 5 01 00 01 03 00
E: 33.911393 5 01 00 b9 00 00
E: 33.931392 5 01 00 03 ff 00
E: 33.951391 5 01 00 03 00 00
E: 33.963390 5 01 00 03 00 00
E: 33.983382 5 01 00 03 00 00
E: 34.011382 5 01 00 03 ff 00
E: 34.043383 5 01 00 03 00 00
E: 34.135392 5 01 00 03 ff 00
E: 34.167383 5 01 00 03 ff 00
E: 34.187389 5 01 00 03 fe 00
E: 34.207389 5 01 00 03 ff 00
E: 34.271387 5 01 00 03 fe 00
E: 34.311379 5 01 01 00 fe 00
E: 34.431384 5 01 01 01 fd 00
E: 34.451382 5 01 01 01 fd 00
E: 34.467382 5 01 00 02 fe 00
E: 34.479383 5 01 00 02 fd 00
E: 34.495381 5 01 00 02 fd 00
E: 34.511375 5 01 00 03 fe 00
E: 34.527375 5 01 00 03 fd 00
E: 34.535374 5 01 00 03 fd 00
E: 34.547376 5 01 00 03 fe 00
E: 34.555374 5 01 00 02 fd 00
E: 34.567354 5 01 00 02 fd 00
E: 34.575374 5 01 00 03 fd 00
E: 34.587373 5 01 00 02 fd 00
E: 34.595373 5 01 00 02 fd 00
E: 34.607385 5 01 00 03 fd 00
E: 34.615381 5 01 00 02 fd 00
E: 34.627381 5 01 00 02 fd 00
E: 34.635381 5 01 01 03 fd 00
E: 34.647381 5 01 01 03 fc 00
E: 34.655323 5 01 01 03 fd 00
E: 34.667382 5 01 01 03 fd 00
E: 34.675371 5 01 01 02 fd 00
E: 34.687372 5 01 01 03 fd 00
E: 34.695381 5 01 01 02 fd 00
E: 34.707323 5 01 01 02 fd 00
E: 34.715380 5 01 01 02 fd 00
E: 34.727322 5 01 01 02 fd 00
E: 34.735380 5 01 01 02 fc 00
E: 34.747378 5 01 01 03 fc 00
E: 34.755379 5 01 01 04 fc 00
E: 34.759394 5 01 01 03 fe 00
E: 34.771370 5 01 01 04 fc 00
E: 34.775402 5 01 01 03 fe 00
E: 34.787379 5 01 01 04 fc 00
E: 34.791402 5 01 01 03 fe 00
E: 34.795402 5 01 01 02 fd 00
E: 34.807378 5 01 00 05 fc 00
E: 34.815378 5 01 00 05 fc 00
E: 34.819356 5 01 00 02 fd 00
E: 34.827378 5 01 00 03 fe 00
E: 34.831401 5 01 00 03 fe 00
E: 34.835401 5 01 00 02 fd 00
E: 34.839393 5 01 00 03 fe 00
E: 34.851369 5 01 00 05 fc 00
E: 34.855393 5 01 00 03 fe 00
E: 34.859395 5 01 00 02 fd 00
E: 34.867369 5 01 00 03 ff 00
E: 34.871391 5 01 00 03 fd 00
E: 34.875392 5 01 00 03 fe 00
E: 34.883368 5 01 00 03 ff 00
E: 34.887392 5 01 00 03 fd 00
E: 34.895368 5 01 00 05 fc 00
E: 34.899388 5 01 00 03 fe 00
E: 34.907309 5 01 00 03 fe 00
E: 34.911310 5 01 00 03 fd 00
E: 34.923367 5 01 00 05 fc 00
E: 34.927400 5 01 00 03 fe 00
E: 34.931400 5 01 02 03 fd 00
E: 34.935402 5 01 02 03 fe 00
E: 34.939399 5 01 02 03 fe 00
E: 34.947376 5 01 02 03 fd 00
E: 34.951399 5 01 02 03 fe 00
E: 34.955398 5 01 02 03 fe 00
E: 34.963375 5 01 02 03 fe 00
E: 34.971309 5 01 02 05 fc 00
E: 34.975403 5 01 02 03 fd 00
E: 34.987373 5 01 02 04 fd 00
E: 34.991314 5 01 02 03 fe 00
E: 35.003308 5 01 02 04 fc 00
E: 35.011376 5 01 02 03 fd 00
E: 35.023308 5 01 02 04 fd 00
E: 35.031375 5 01 02 03 fd 00
E: 35.043308 5 01 02 04 fd 00
E: 35.051375 5 01 02 03 fd 00
E: 35.063374 5 01 02 04 fc 00
E: 35.071365 5 01 02 03 fe 00
E: 35.083306 5 01 02 03 fd 00
E: 35.087396 5 01 00 02 fe 00
E: 35.095373 5 01 00 03 fd 00
E: 35.107372 5 01 00 03 fd 00
E: 35.115372 5 01 00 04 fd 00
E: 35.127371 5 01 00 03 fd 00
E: 35.135372 5 01 00 03 fd 00
E: 35.147374 5 01 00 03 fd 00
E: 35.155372 5 01 00 03 fe 00
E: 35.167321 5 01 00 04 fe 00
E: 35.175372 5 01 00 04 fd 00
E: 35.187371 5 01 00 03 fe 00
E: 35.195370 5 01 00 04 fe 00
E: 35.207304 5 01 00 03 fd 00
E: 35.215370 5 01 00 04 fd 00
E: 35.227372 5 01 00 04 fe 00
E: 35.235372 5 01 00 04 fd 00
E: 35.247371 5 01 00 04 fd 00
E: 35.251313 5 01 02 02 ff 00
E: 35.255396 5 01 02 03 ff 00
E: 35.267303 5 01 02 03 fd 00
E: 35.275363 5 01 02 04 fe 00
E: 35.287303 5 01 02 04 fd 00
E: 35.295361 5 01 02 03 fe 00
E: 35.307303 5 01 02 03 fd 00
E: 35.315362 5 01 02 03 fe 00
E: 35.327361 5 01 02 03 fe 00
E: 35.335360 5 01 02 03 fd 00
E: 35.347369 5 01 02 03 fd 00
E: 35.355368 5 01 02 04 fd 00
E: 35.367370 5 01 02 04 fd 00
E: 35.375369 5 01 02 04 fc 00
E: 35.387368 5 01 02 04 fd 00
E: 35.395370 5 01 02 04 fd 00
E: 35.403310 5 01 02 03 ff 00
E: 35.411308 5 01 02 04 fc 00
E: 35.423361 5 01 02 04 fc 00
E: 35.427385 5 01 00 02 ff 00
E: 35.435369 5 01 00 04 fc 00
E: 35.443369 5 01 00 02 fd 00
E: 35.451301 5 01 00 04 fc 00
E: 35.463370 5 01 00 04 fc 00
E: 35.467390 5 01 00 03 fe 00
E: 35.475369 5 01 00 05 fc 00
E: 35.487367 5 01 00 04 fc 00
E: 35.491389 5 01 00 03 fe 00
E: 35.495313 5 01 00 03 ff 00
E: 35.507366 5 01 00 05 fc 00
E: 35.511392 5 01 00 03 ff 00
E: 35.523367 5 01 00 05 fc 00
E: 35.531356 5 01 00 04 fd 00
E: 35.535298 5 01 00 03 ff 00
E: 35.547367 5 01 00 04 fd 00
E: 35.555366 5 01 02 04 fe 00
E: 35.567365 5 01 02 04 fe 00
E: 35.571388 5 01 02 03 ff 00
E: 35.583295 5 01 02 04 fe 00
E: 35.591293 5 01 02 04 fe 00
E: 35.603364 5 01 02 04 fe 00
E: 35.611363 5 01 02 04 fe 00
E: 35.623363 5 01 02 04 fe 00
E: 35.631363 5 01 02 03 fe 00
E: 35.643361 5 01 02 02 fd 00
E: 35.651363 5 01 02 03 fe 00
E: 35.667363 5 01 00 03 fc 00
E: 35.683355 5 01 00 03 fc 00
E: 35.691355 5 01 00 02 fd 00
E: 35.703352 5 01 00 03 fd 00
E: 35.715354 5 01 00 03 fc 00
E: 35.727353 5 01 00 03 fd 00
E: 35.735359 5 01 00 02 fd 00
E: 35.747361 5 01 00 02 fd 00
E: 35.755360 5 01 00 02 fd 00
E: 35.767363 5 01 00 03 fd 00
E: 35.775360 5 01 00 03 fd 00
E: 35.787361 5 01 00 03 fd 00
E: 35.791384 5 01 00 03 ff 00
E: 35.803359 5 01 00 05 fe 00
E: 35.807386 5 01 02 03 ff 00
E: 35.811383 5 01 02 03 ff 00
E: 35.815384 5 01 02 03 ff 00
E: 35.823347 5 01 02 03 fe 00
E: 35.831350 5 01 02 05 fe 00
E: 35.835378 5 01 02 03 fe 00
E: 35.847352 5 01 02 05 fd 00
E: 35.851378 5 01 02 03 ff 00
E: 35.855377 5 01 02 03 fe 00
E: 35.863355 5 01 02 03 ff 00
E: 35.871351 5 01 02 05 fc 00
E: 35.875376 5 01 02 03 fe 00
E: 35.883351 5 01 02 03 fe 00
E: 35.887375 5 01 02 03 fe 00
E: 35.895302 5 01 02 05 fc 00
E: 35.907351 5 01 02 05 fc 00
E: 35.911374 5 01 00 03 fe 00
E: 35.923358 5 01 00 05 fc 00
E: 35.927385 5 01 00 03 fe 00
E: 35.931381 5 01 00 02 fd 00
E: 35.935322 5 01 00 03 fe 00
E: 35.943359 5 01 00 02 fd 00
E: 35.947381 5 01 00 03 fe 00
E: 35.959358 5 01 00 05 fb 00
E: 35.963384 5 01 00 03 fd 00
E: 35.971356 5 01 00 05 fc 00
E: 35.975307 5 01 00 03 fd 00
E: 35.983359 5 01 00 04 fe 00
E: 35.987384 5 01 00 03 fe 00
E: 35.991381 5 01 00 03 fe 00
E: 35.999358 5 01 00 03 fe 00
E: 36.007357 5 01 00 05 fd 00
E: 36.011381 5 01 00 03 fe 00
E: 36.023357 5 01 00 04 fc 00
E: 36.031357 5 01 00 04 fc 00
E: 36.039357 5 01 00 02 fd 00
E: 36.047354 5 01 00 04 fc 00
E: 36.059356 5 01 00 03 fc 00
E: 36.067356 5 01 00 04 fc 00
E: 36.079356 5 01 00 04 fc 00
E: 36.087356 5 01 00 04 fd 00
E: 36.099355 5 01 00 04 fd 00
E: 36.107288 5 01 00 03 fe 00
E: 36.119356 5 01 00 03 fe 00
E: 36.127357 5 01 00 03 fe 00
E: 36.143356 5 01 00 03 fd 00
E: 36.159354 5 01 00 02 fd 00
E: 36.179352 5 01 00 03 fc 00
E: 36.191353 5 01 00 02 fd 00
E: 36.207354 5 01 00 02 fd 00
E: 36.211380 5 01 02 01 ff 00
E: 36.227352 5 01 02 03 fe 00
E: 36.243352 5 01 02 03 fe 00
E: 36.267352 5 01 02 03 ff 00
E: 36.303330 5 01 02 03 fe 00
E: 36.331284 5 01 02 02 fd 00
E: 36.351352 5 01 00 02 fe 00
E: 36.371351 5 01 00 01 fd 00
E: 36.391351 5 01 00 01 fd 00
E: 36.443349 5 01 00 01 fd 00
E: 36.487291 5 01 00 03 fd 00
E: 36.507281 5 01 00 03 fd 00
E: 36.523269 5 01 00 04 fe 00
E: 36.539348 5 01 00 04 fe 00
E: 36.551350 5 01 00 03 fe 00
E: 36.567288 5 01 00 03 fe 00
E: 36.583346 5 01 00 03 fe 00
E: 36.599347 5 01 00 04 fd 00
E: 36.611349 5 01 00 03 fe 00
E: 36.623347 5 01 02 03 fe 00
E: 36.631343 5 01 02 03 ff 00
E: 36.647345 5 01 02 03 fe 00
E: 36.747344 5 01 00 00 01 00
E: 36.771344 5 01 00 ff 03 00
E: 36.791295 5 01 00 ff 03 00
E: 36.811346 5 01 00 fe 03 00
E: 36.827343 5 01 00 ff 03 00
E: 36.839343 5 01 00 00 03 00
E: 36.847343 5 01 00 00 04 00
E: 36.859342 5 01 00 01 04 00
E: 36.867276 5 01 00 01 04 00
E: 36.879334 5 01 00 00 05 00
E: 36.887342 5 01 00 01 04 00
E: 36.899341 5 01 00 01 04 00
E: 36.907341 5 01 00 00 04 00
E: 36.919341 5 01 02 01 04 00
E: 36.923365 5 01 02 01 03 00
E: 36.927366 5 01 02 01 03 00
E: 36.931365 5 01 02 01 03 00
E: 36.939341 5 01 02 02 03 00
E: 36.943364 5 01 02 02 04 00
E: 36.947282 5 01 02 01 03 00
E: 36.951371 5 01 02 02 03 00
E: 36.959341 5 01 02 02 04 00
E: 36.963366 5 01 02 01 03 00
E: 36.967365 5 01 02 01 04 00
E: 36.971357 5 01 02 02 03 00
E: 36.979331 5 01 02 01 03 00
E: 36.983282 5 01 02 01 04 00
E: 36.987357 5 01 02 02 04 00
E: 36.995333 5 01 02 01 03 00
E: 36.999355 5 01 02 01 03 00
E: 37.003355 5 01 02 01 03 00
E: 37.007355 5 01 02 01 03 00
E: 37.015282 5 01 02 02 03 00
E: 37.019356 5 01 02 01 04 00
E: 37.027331 5 01 02 02 06 00
E: 37.031281 5 01 02 01 03 00
E: 37.039330 5 01 02 01 03 00
E: 37.043353 5 01 02 01 03 00
E: 37.047355 5 01 02 01 03 00
E: 37.055330 5 01 02 01 03 00
E: 37.059355 5 01 00 02 03 00
E: 37.063353 5 01 00 01 03 00
E: 37.067355 5 01 00 01 04 00
E: 37.075329 5 01 00 00 03 00
E: 37.079354 5 01 00 01 03 00
E: 37.083355 5 01 00 01 03 00
E: 37.087353 5 01 00 00 04 00
E: 37.095329 5 01 00 00 04 00
E: 37.099280 5 01 00 01 04 00
E: 37.103354 5 01 00 00 03 00
E: 37.107354 5 01 00 00 04 00
E: 37.115278 5 01 00 00 04 00
E: 37.119353 5 01 00 00 04 00
E: 37.123352 5 01 00 00 04 00
E: 37.127353 5 01 00 00 05 00
E: 37.135329 5 01 00 00 04 00
E: 37.139352 5 01 00 00 04 00
E: 37.143352 5 01 00 00 04 00
E: 37.147352 5 01 00 00 05 00
E: 37.155328 5 01 00 00 04 00
E: 37.159352 5 01 00 00 05 00
E: 37.163355 5 01 00 00 04 00
E: 37.167352 5 01 00 01 05 00
E: 37.175328 5 01 00 00 05 00
E: 37.179353 5 01 00 01 04 00
E: 37.415323 5 01 00 00 ab 00
E: 37.423325 5 01 00 ff 05 00
E: 37.427349 5 01 00 00 03 00
E: 37.435324 5 01 00 ff 03 00
E: 37.439349 5 01 00 ff 03 00
E: 37.447262 5 01 00 ff 05 00
E: 37.455254 5 01 00 00 03 00
E: 37.463323 5 01 00 ff 05 00
E: 37.467346 5 01 00 ff 03 00
E: 37.479323 5 01 00 00 05 00
E: 37.483346 5 01 00 00 03 00
E: 37.487346 5 01 02 00 03 00
E: 37.495324 5 01 02 00 03 00
E: 37.499348 5 01 02 00 03 00
E: 37.503347 5 01 02 00 03 00
E: 37.507299 5 01 02 00 03 00
E: 37.519322 5 01 02 00 05 00
E: 37.523341 5 01 02 00 03 00
E: 37.535322 5 01 02 00 05 00
E: 37.539346 5 01 02 00 03 00
E: 37.547322 5 01 02 00 04 00
E: 37.555323 5 01 02 ff 03 00
E: 37.559345 5 01 02 00 03 00
E: 37.567321 5 01 02 00 04 00
E: 37.579322 5 01 02 ff 05 00
E: 37.587322 5 01 02 ff 04 00
E: 37.599318 5 01 02 00 04 00
E: 37.607288 5 01 02 ff 04 00
E: 37.615321 5 01 00 00 03 00
E: 37.623321 5 01 00 00 04 00
E: 37.635322 5 01 00 00 04 00
E: 37.643261 5 01 00 00 04 00
E: 37.655322 5 01 00 00 04 00
E: 37.663320 5 01 00 00 04 00
E: 37.675320 5 01 00 00 04 00
E: 37.683317 5 01 00 01 04 00
E: 37.695321 5 01 00 00 04 00
E: 37.699344 5 01 00 01 03 00
E: 37.707260 5 01 00 01 04 00
E: 37.715320 5 01 00 01 03 00
E: 37.723319 5 01 00 01 04 00
E: 37.735319 5 01 00 01 05 00
E: 37.743317 5 01 00 01 04 00
E: 37.755318 5 01 00 00 04 00
E: 37.763318 5 01 00 01 03 00
E: 37.767337 5 01 02 01 02 00
E: 38.079313 5 01 00 01 28 00
E: 38.091313 5 01 00 fd 00 00
E: 38.103266 5 01 00 fc 00 00
E: 38.115311 5 01 00 fc 00 00
E: 38.123315 5 01 00 fd 00 00
E: 38.131321 5 01 00 fd 00 00
E: 38.139320 5 01 00 fc 00 00
E: 38.151320 5 01 00 fc 00 00
E: 38.159319 5 01 00 fc 00 00
E: 38.171320 5 01 00 fc 00 00
E: 38.175343 5 01 01 fe 00 00
E: 38.183317 5 01 03 fc 00 00
E: 38.191262 5 01 01 fe 01 00
E: 38.195344 5 01 03 ff 00 00
E: 38.203319 5 01 03 fd 00 00
E: 38.219319 5 01 03 fd 01 00
E: 38.259319 5 01 03 fe 03 00
E: 38.451306 5 01 00 ed 01 00
E: 38.463306 5 01 00 fd 00 00
E: 38.475305 5 01 00 fd 00 00
E: 38.483305 5 01 00 fc 00 00
E: 38.495306 5 01 00 fd 00 00
E: 38.503308 5 01 00 fd 00 00
E: 38.515308 5 01 00 fd 00 00
E: 38.523306 5 01 00 fd 00 00
E: 38.535307 5 01 00 fd 00 00
E: 38.543245 5 01 00 fd 00 00
E: 38.555306 5 01 00 fc 00 00
E: 38.563245 5 01 00 fd 00 00
E: 38.575305 5 01 00 fc 00 00
E: 38.583304 5 01 00 fd ff 00
E: 38.595244 5 01 00 fc 00 00
E: 38.611304 5 01 00 fd 00 00
E: 38.619286 5 01 02 fe 00 00
E: 38.623327 5 01 00 ff 00 00
E: 38.631311 5 01 03 00 00 00
E: 38.759310 5 01 03 f8 01 00
E: 38.771263 5 01 03 fd 00 00
E: 38.779301 5 01 03 fd 00 00
E: 38.791308 5 01 03 fd 00 00
E: 38.795332 5 01 01 fe ff 00
E: 38.799332 5 01 00 fe 00 00
E: 38.811309 5 01 00 fc ff 00
E: 38.819308 5 01 00 fd ff 00
E: 38.831308 5 01 00 fd fe 00
E: 38.839305 5 01 00 fc fe 00
E: 38.851258 5 01 00 fc fd 00
E: 38.855330 5 01 00 fd fe 00
E: 38.863307 5 01 00 fb fe 00
E: 38.871307 5 01 00 fd fe 00
E: 38.875329 5 01 00 fd ff 00
E: 38.879329 5 01 00 fd ff 00
E: 38.891305 5 01 00 fb fd 00
E: 38.899306 5 01 00 fb fd 00
E: 38.903329 5 01 00 fd ff 00
E: 38.911299 5 01 00 fd fe 00
E: 38.915321 5 01 00 fd ff 00
E: 38.919318 5 01 00 fd fe 00
E: 38.923324 5 01 00 fc ff 00
E: 38.931304 5 01 00 fd fe 00
E: 38.935252 5 01 00 fd ff 00
E: 38.939321 5 01 00 fd fe 00
E: 38.943324 5 01 00 fc fe 00
E: 38.955297 5 01 00 fb fd 00
E: 38.959321 5 01 00 fd fe 00
E: 38.967297 5 01 00 fd fe 00
E: 38.971320 5 01 00 fd fe 00
E: 38.975319 5 01 00 fc fe 00
E: 38.979320 5 01 00 fd fe 00
E: 38.983321 5 01 00 fd fe 00
E: 38.991298 5 01 00 fc fe 00
E: 38.995330 5 01 00 fd fe 00
E: 38.999328 5 01 00 fd fd 00
E: 39.003332 5 01 00 fc fe 00
E: 39.011239 5 01 00 fc fe 00
E: 39.015285 5 01 00 fc fd 00
E: 39.019258 5 01 00 fc fd 00
E: 39.027304 5 01 00 fc fd 00
E: 39.031328 5 01 00 fc fd 00
E: 39.035238 5 01 00 fd fd 00
E: 39.039331 5 01 00 fc fd 00
E: 39.047302 5 01 00 fd fd 00
E: 39.051318 5 01 00 fc fd 00
E: 39.055319 5 01 00 fd fd 00
E: 39.059318 5 01 00 fd fd 00
E: 39.063320 5 01 00 fc fd 00
E: 39.071303 5 01 00 fd fc 00
E: 39.075326 5 01 00 fc fd 00
E: 39.079328 5 01 00 fd fc 00
E: 39.087303 5 01 00 fd fd 00
E: 39.091236 5 01 00 fd fc 00
E: 39.095327 5 01 00 fe fc 00
E: 39.099325 5 01 00 fd fd 00
E: 39.107286 5 01 00 fe fc 00
E: 39.111327 5 01 00 fe fc 00
E: 39.115325 5 01 00 fe fc 00
E: 39.119326 5 01 00 fe fc 00
E: 39.127302 5 01 00 fe fc 00
E: 39.131326 5 01 00 fe fc 00
E: 39.135326 5 01 00 ff fd 00
E: 39.139326 5 01 00 fe fc 00
E: 39.147236 5 01 00 fe fc 00
E: 39.151326 5 01 00 fe fc 00
E: 39.155327 5 01 00 fe fc 00
E: 39.159325 5 01 00 fe fb 00
E: 39.167293 5 01 00 fe fc 00
E: 39.171317 5 01 00 fe fc 00
E: 39.175317 5 01 00 fe fb 00
E: 39.179313 5 01 00 fe fc 00
E: 39.187269 5 01 00 fe fc 00
E: 39.191241 5 01 00 fe fb 00
E: 39.195284 5 01 00 fe fb 00
E: 39.199325 5 01 00 ff fc 00
E: 39.207302 5 01 00 fe fc 00
E: 39.211324 5 01 00 fe fc 00
E: 39.215325 5 01 00 ff fc 00
E: 39.219324 5 01 00 fe fc 00
E: 39.227300 5 01 00 fe fc 00
E: 39.231242 5 01 00 ff fc 00
E: 39.235327 5 01 00 ff fc 00
E: 39.239324 5 01 00 ff fc 00
E: 39.247300 5 01 00 ff fd 00
E: 39.251324 5 01 00 00 fd 00
E: 39.255327 5 01 00 ff fc 00
E: 39.259326 5 01 00 ff fd 00
E: 39.267291 5 01 00 00 fd 00
E: 39.271246 5 01 00 00 fc 00
E: 39.275266 5 01 00 ff fd 00
E: 39.279316 5 01 00 00 fc 00
E: 39.287233 5 01 00 00 fc 00
E: 39.291317 5 01 00 ff fc 00
E: 39.295316 5 01 00 ff fd 00
E: 39.299316 5 01 00 00 fc 00
E: 39.307291 5 01 00 ff fd 00
E: 39.311314 5 01 00 ff fd 00
E: 39.315314 5 01 04 ff fc 00
E: 39.319315 5 01 04 00 fd 00
E: 39.327299 5 01 04 ff fd 00
E: 39.331325 5 01 04 00 fd 00
E: 39.335322 5 01 04 00 fd 00
E: 39.339324 5 01 04 ff fc 00
E: 39.347231 5 01 04 00 fd 00
E: 39.351323 5 01 04 ff fd 00
E: 39.359299 5 01 04 ff fb 00
E: 39.367290 5 01 04 ff fd 00
E: 39.371314 5 01 04 ff fd 00
E: 39.375314 5 01 04 ff fd 00
E: 39.379322 5 01 04 ff fd 00
E: 39.387299 5 01 04 fe fc 00
E: 39.391322 5 01 04 ff fd 00
E: 39.395324 5 01 04 ff fd 00
E: 39.399322 5 01 04 ff fd 00
E: 39.407302 5 01 04 ff fd 00
E: 39.411232 5 01 04 ff fd 00
E: 39.415324 5 01 04 00 fd 00
E: 39.427300 5 01 04 ff fb 00
E: 39.431321 5 01 04 ff fd 00
E: 39.439240 5 01 04 ff fb 00
E: 39.451300 5 01 04 fe fc 00
E: 39.459284 5 01 04 fe fc 00
E: 39.471298 5 01 04 fd fc 00
E: 39.479298 5 01 04 fe fc 00
E: 39.491228 5 01 04 fd fc 00
E: 39.499297 5 01 04 fd fc 00
E: 39.511297 5 01 00 fd fc 00
E: 39.519296 5 01 00 fc fb 00
E: 39.531296 5 01 00 fd fc 00
E: 39.535319 5 01 00 fe fd 00
E: 39.547295 5 01 00 fd fc 00
E: 39.555229 5 01 00 fe fc 00
E: 39.567297 5 01 00 fe fd 00
E: 39.575228 5 01 00 fe fc 00
E: 39.587297 5 01 00 fe fc 00
E: 39.591318 5 01 00 ff fd 00
E: 39.599295 5 01 00 fd fc 00
E: 39.611237 5 01 00 fe fc 00
E: 39.619297 5 01 00 fe fd 00
E: 39.631297 5 01 00 fe fd 00
E: 39.639294 5 01 00 fe fc 00
E: 39.651232 5 01 00 ff fd 00
E: 39.659294 5 01 00 fe fc 00
E: 39.671293 5 01 00 ff fd 00
E: 39.679293 5 01 00 ff fc 00
E: 39.691292 5 01 00 ff fc 00
E: 39.695233 5 01 00 00 fd 00
E: 39.707225 5 01 00 00 fc 00
E: 39.715293 5 01 00 00 fd 00
E: 39.727293 5 01 00 01 fc 00
E: 39.735292 5 01 00 01 fc 00
E: 39.747293 5 01 00 01 fc 00
E: 39.755291 5 01 00 01 fc 00
E: 39.767225 5 01 00 02 fc 00
E: 39.775293 5 01 00 02 fc 00
E: 39.787291 5 01 00 02 fc 00
E: 39.795290 5 01 00 03 fc 00
E: 39.807294 5 01 00 02 fc 00
E: 39.815290 5 01 00 03 fb 00
E: 39.827232 5 01 00 03 fc 00
E: 39.835293 5 01 00 03 fb 00
E: 39.847290 5 01 00 03 fc 00
E: 39.855291 5 01 00 03 fc 00
E: 39.867274 5 01 00 03 fd 00
E: 39.875274 5 01 00 03 fd 00
E: 39.887294 5 01 00 03 fd 00
E: 39.895290 5 01 00 03 fe 00
E: 39.907290 5 01 00 03 fe 00
E: 39.919289 5 01 00 03 fe 00
E: 39.935290 5 01 00 03 fe 00
E: 39.951220 5 01 00 03 00 00
E: 40.831265 5 01 00 00 fd 00
E: 40.859263 5 01 00 fd fe 00
E: 40.871263 5 01 00 fd ff 00
E: 40.887263 5 01 00 fd ff 00
E: 40.899264 5 01 00 fc ff 00
E: 40.907264 5 01 00 fc ff 00
E: 40.915262 5 01 00 fc ff 00
E: 40.927240 5 01 00 fc fe 00
E: 40.939261 5 01 00 fd ff 00
E: 40.947263 5 01 00 fd ff 00
E: 40.955263 5 01 00 fd ff 00
E: 40.991261 5 01 00 fd ff 00
E: 41.027261 5 01 00 fd fe 00
E: 41.059259 5 01 00 fd ff 00
E: 41.083257 5 01 00 fd fe 00
E: 41.107259 5 01 00 fd fe 00
E: 41.127260 5 01 00 fd ff 00
E: 41.147258 5 01 00 fd ff 00
E: 41.167210 5 01 00 fd ff 00
E: 41.183259 5 01 00 fd 00 00
E: 41.203256 5 01 00 fd ff 00
E: 41.223256 5 01 00 fd fe 00
E: 41.251266 5 01 00 fe fd 00
E: 41.291267 5 01 00 fe fd 00
E: 41.319257 5 01 00 fd fe 00
E: 41.339256 5 01 00 fd fd 00
E: 41.351255 5 01 00 fc fd 00
E: 41.367255 5 01 00 fd fc 00
E: 41.379254 5 01 00 fc fe 00
E: 41.387255 5 01 00 fd fd 00
E: 41.391277 5 01 00 fd fe 00
E: 41.403254 5 01 00 fc fd 00
E: 41.407277 5 01 00 fd ff 00
E: 41.419249 5 01 00 fc fe 00
E: 41.423230 5 01 00 fd fe 00
E: 41.431253 5 01 00 fc fe 00
E: 41.443252 5 01 00 fd ff 00
E: 41.451252 5 01 00 fc fe 00
E: 41.463253 5 01 00 fb ff 00
E: 41.471252 5 01 00 fb fe 00
E: 41.479252 5 01 00 fd ff 00
E: 41.483276 5 01 00 fd ff 00
E: 41.487276 5 01 00 fc ff 00
E: 41.491277 5 01 00 fd ff 00
E: 41.499247 5 01 00 fc ff 00
E: 41.503273 5 01 00 fc ff 00
E: 41.507277 5 01 00 fc 00 00
E: 41.511198 5 01 00 fc ff 00
E: 41.519252 5 01 00 fc ff 00
E: 41.523274 5 01 00 fc ff 00
E: 41.527230 5 01 00 fd 00 00
E: 41.531276 5 01 00 fc 00 00
E: 41.539252 5 01 00 fd ff 00
E: 41.543275 5 01 00 fd 00 00
E: 41.547274 5 01 00 fc 00 00
E: 41.551275 5 01 00 fd 00 00
E: 41.559252 5 01 00 fd 00 00
E: 41.563274 5 01 00 fd 00 00
E: 41.567278 5 01 00 fd 00 00
E: 41.571278 5 01 00 fd 01 00
E: 41.583223 5 01 00 fb 00 00
E: 41.587274 5 01 00 fd 00 00
E: 41.591274 5 01 00 fd 01 00
E: 41.599203 5 01 00 fd 00 00
E: 41.603276 5 01 00 fd 00 00
E: 41.607274 5 01 00 fd 01 00
E: 41.611274 5 01 00 fd 00 00
E: 41.619251 5 01 00 fc 00 00
E: 41.623275 5 01 00 fd 01 00
E: 41.627273 5 01 00 fc 00 00
E: 41.631279 5 01 00 fd 00 00
E: 41.639252 5 01 00 fc 00 00
E: 41.643275 5 01 00 fd 01 00
E: 41.647274 5 01 00 fd 00 00
E: 41.651275 5 01 00 fd 00 00
E: 41.659251 5 01 00 fd 00 00
E: 41.667249 5 01 00 fb 01 00
E: 41.671273 5 01 00 fd 00 00
E: 41.683247 5 01 00 fc 00 00
E: 41.687272 5 01 00 fd 00 00
E: 41.699249 5 01 00 fd 01 00
E: 41.707248 5 01 00 fc 00 00
E: 41.719248 5 01 00 fd 00 00
E: 41.727249 5 01 00 fc 00 00
E: 41.739248 5 01 00 fd 00 00
E: 41.747248 5 01 00 fd 00 00
E: 41.759246 5 01 00 fd ff 00
E: 41.771247 5 01 00 fd 00 00
E: 41.787246 5 01 00 fd ff 00
E: 41.807248 5 01 00 fd ff 00
E: 41.831247 5 01 00 fd fe 00
E: 41.867245 5 01 00 fd fd 00
E: 41.911253 5 01 00 00 fd 00
E: 41.991249 5 01 00 fd fe 00
E: 42.203240 5 01 00 03 01 00
E: 42.223239 5 01 00 03 00 00
E: 42.239240 5 01 00 03 00 00
E: 42.259240 5 01 00 03 00 00
E: 42.363236 5 01 01 02 ff 00
E: 42.535234 5 01 01 03 ff 00
E: 42.543233 5 01 01 03 00 00
E: 42.559235 5 01 01 03 ff 00
E: 42.575234 5 01 01 03 ff 00
E: 42.583233 5 01 01 03 ff 00
E: 42.599233 5 01 01 03 00 00
E: 42.607233 5 01 01 03 01 00
E: 42.619232 5 01 01 03 00 00
E: 42.627233 5 01 02 03 00 00
E: 42.639232 5 01 02 04 01 00
E: 42.647232 5 01 02 03 00 00
E: 42.659232 5 01 02 03 00 00
E: 42.675231 5 01 02 03 ff 00
E: 42.687231 5 01 02 03 00 00
E: 42.703186 5 01 02 03 ff 00
E: 42.719232 5 01 02 03 00 00
E: 42.739229 5 01 02 03 00 00
E: 42.759230 5 01 02 03 01 00
E: 42.783229 5 01 02 03 00 00
E: 42.807229 5 01 02 03 01 00
E: 42.823230 5 01 02 03 00 00
E: 42.839228 5 01 02 04 00 00
E: 42.851228 5 01 02 03 00 00
E: 42.859206 5 01 02 04 00 00
E: 42.867228 5 01 02 04 00 00
E: 42.879228 5 01 02 03 00 00
E: 42.887226 5 01 02 03 00 00
E: 42.899227 5 01 02 03 01 00
E: 42.915227 5 01 02 03 ff 00
E: 42.923226 5 01 02 03 00 00
E: 42.939227 5 01 02 04 00 00
E: 42.951228 5 01 02 03 ff 00
E: 42.959176 5 01 02 03 00 00
E: 42.971227 5 01 02 04 00 00
E: 42.979236 5 01 02 04 ff 00
E: 42.987234 5 01 02 04 00 00
E: 42.999234 5 01 00 04 00 00
E: 43.011233 5 01 00 04 00 00
E: 43.019233 5 01 00 04 00 00
E: 43.023258 5 01 02 01 00 00
E: 43.027256 5 01 00 02 00 00
E: 43.039219 5 01 00 04 00 00
E: 43.051234 5 01 00 04 00 00
E: 43.059232 5 01 00 04 01 00
E: 43.071233 5 01 00 05 00 00
E: 43.079234 5 01 00 04 01 00
E: 43.083257 5 01 00 03 01 00
E: 43.095233 5 01 00 05 00 00
E: 43.103233 5 01 00 04 01 00
E: 43.115232 5 01 00 05 00 00
E: 43.123212 5 01 00 03 01 00
E: 43.131211 5 01 00 03 00 00
E: 43.139231 5 01 00 04 00 00
E: 43.151232 5 01 00 04 01 00
E: 43.159198 5 01 00 04 00 00
E: 43.171232 5 01 00 04 00 00
E: 43.175255 5 01 00 03 00 00
E: 43.183232 5 01 00 04 01 00
E: 43.195231 5 01 00 04 00 00
E: 43.203231 5 01 00 05 00 00
E: 43.215230 5 01 00 04 00 00
E: 43.223232 5 01 00 05 00 00
E: 43.235222 5 01 00 04 00 00
E: 43.239244 5 01 00 03 00 00
E: 43.243245 5 01 00 03 00 00
E: 43.251222 5 01 00 03 00 00
E: 43.255245 5 01 00 03 00 00
E: 43.259245 5 01 00 03 00 00
E: 43.263245 5 01 00 04 00 00
E: 43.271221 5 01 00 03 00 00
E: 43.275244 5 01 00 04 00 00
E: 43.279244 5 01 00 03 00 00
E: 43.283246 5 01 00 04 00 00
E: 43.291164 5 01 00 03 00 00
E: 43.295231 5 01 00 04 00 00
E: 43.299156 5 01 00 03 00 00
E: 43.303247 5 01 00 03 01 00
E: 43.311220 5 01 00 04 00 00
E: 43.315246 5 01 00 03 00 00
E: 43.319249 5 01 00 03 00 00
E: 43.323247 5 01 00 04 01 00
E: 43.331223 5 01 00 03 00 00
E: 43.335247 5 01 00 04 00 00
E: 43.339244 5 01 00 04 00 00
E: 43.343198 5 01 00 04 00 00
E: 43.351224 5 01 00 04 01 00
E: 43.355243 5 01 00 04 00 00
E: 43.359245 5 01 00 04 00 00
E: 43.363245 5 01 00 04 00 00
E: 43.371221 5 01 00 04 00 00
E: 43.375167 5 01 00 04 00 00
E: 43.379250 5 01 00 04 00 00
E: 43.383243 5 01 00 04 00 00
E: 43.391219 5 01 00 04 00 00
E: 43.395244 5 01 00 04 00 00
E: 43.399243 5 01 00 04 00 00
E: 43.403242 5 01 00 04 00 00
E: 43.411222 5 01 00 04 00 00
E: 43.415243 5 01 00 04 01 00
E: 43.419165 5 01 00 04 00 00
E: 43.423245 5 01 00 05 00 00
E: 43.431220 5 01 00 04 00 00
E: 43.435242 5 01 00 05 00 00
E: 43.439245 5 01 00 04 01 00
E: 43.443244 5 01 00 04 00 00
E: 43.451219 5 01 00 04 00 00
E: 43.455168 5 01 00 04 00 00
E: 43.459244 5 01 00 03 00 00
E: 43.463242 5 01 00 04 00 00
E: 43.471218 5 01 00 03 00 00
E: 43.475241 5 01 00 04 00 00
E: 43.479241 5 01 00 03 00 00
E: 43.483241 5 01 00 04 00 00
E: 43.491217 5 01 00 03 00 00
E: 43.495241 5 01 00 04 ff 00
E: 43.499240 5 01 00 03 01 00
E: 43.503241 5 01 00 03 ff 00
E: 43.511217 5 01 00 04 00 00
E: 43.515239 5 01 00 03 00 00
E: 43.519241 5 01 00 04 00 00
E: 43.523240 5 01 00 03 00 00
E: 43.531195 5 01 00 03 00 00
E: 43.535179 5 01 00 03 00 00
E: 43.543215 5 01 00 05 00 00
E: 43.555216 5 01 00 04 01 00
E: 43.563215 5 01 00 04 00 00
E: 43.575216 5 01 02 03 00 00
E: 43.583217 5 01 02 03 00 00
E: 43.595216 5 01 03 01 00 00
E: 43.611217 5 01 03 03 ff 00
E: 43.623215 5 01 03 03 ff 00
E: 43.635176 5 01 03 03 00 00
E: 43.643215 5 01 03 03 00 00
E: 43.655215 5 01 03 04 00 00
E: 43.663213 5 01 03 03 00 00
E: 43.675156 5 01 03 04 00 00
E: 43.683214 5 01 03 04 00 00
E: 43.695214 5 01 03 04 00 00
E: 43.699186 5 01 03 03 00 00
E: 43.711214 5 01 03 04 00 00
E: 43.719213 5 01 03 04 ff 00
E: 43.723236 5 01 03 03 00 00
E: 43.731154 5 01 02 03 00 00
E: 43.739213 5 01 02 05 00 00
E: 43.743236 5 01 02 03 ff 00
E: 43.751212 5 01 02 03 00 00
E: 43.755236 5 01 02 03 00 00
E: 43.759238 5 01 00 03 00 00
E: 43.771213 5 01 00 05 00 00
E: 43.779214 5 01 00 04 ff 00
E: 43.791157 5 01 00 03 00 00
E: 43.799143 5 01 00 03 00 00
E: 43.815214 5 01 00 03 00 00
E: 43.835213 5 01 00 03 00 00
E: 43.843211 5 01 00 03 00 00
E: 43.859210 5 01 00 04 00 00
E: 43.871210 5 01 00 04 00 00
E: 43.879211 5 01 00 03 01 00
E: 43.891210 5 01 00 04 00 00
E: 43.899211 5 01 00 03 00 00
E: 43.911209 5 01 00 03 00 00
E: 43.919188 5 01 00 03 00 00
E: 43.931210 5 01 00 03 00 00
E: 43.939209 5 01 00 03 00 00
E: 43.955209 5 01 00 04 00 00
E: 43.971209 5 01 00 04 00 00
E: 43.983210 5 01 00 03 00 00
E: 43.999150 5 01 00 03 00 00
E: 44.015210 5 01 00 03 ff 00
E: 44.035153 5 01 00 03 00 00
E: 44.051207 5 01 00 03 00 00
E: 44.075207 5 01 00 03 ff 00
E: 44.099149 5 01 00 03 00 00
E: 44.115206 5 01 00 03 00 00
E: 44.131205 5 01 02 02 00 00
E: 44.327203 5 01 00 00 00 00
E: 44.395201 5 01 00 03 03 00
E: 44.427202 5 01 00 03 01 00
E: 44.459150 5 01 00 03 01 00
E: 44.495201 5 01 00 03 00 00
E: 44.535200 5 01 00 03 00 00
E: 44.571199 5 01 00 03 ff 00
E: 44.607198 5 01 00 03 ff 00
E: 44.619198 5 01 00 03 00 00
E: 44.635192 5 01 02 02 00 00
E: 44.667197 5 01 02 03 00 00
E: 44.795195 5 01 00 00 00 00
E: 44.935192 5 01 00 fd 02 00
E: 44.955192 5 01 00 ff 03 00
E: 44.971191 5 01 00 fe 03 00
E: 44.987134 5 01 00 fd 03 00
E: 44.999191 5 01 00 fc 03 00
E: 45.011149 5 01 00 fc 02 00
E: 45.023191 5 01 00 fc 02 00
E: 45.031190 5 01 00 fb 02 00
E: 45.035216 5 01 00 fd 01 00
E: 45.039214 5 01 00 fd 01 00
E: 45.051191 5 01 00 fb 02 00
E: 45.055216 5 01 00 fd 01 00
E: 45.063191 5 01 00 fd 01 00
E: 45.067131 5 01 00 fd 01 00
E: 45.071124 5 01 00 fd 01 00
E: 45.075215 5 01 00 fd 01 00
E: 45.083191 5 01 00 fd 01 00
E: 45.087213 5 01 00 fc 01 00
E: 45.091213 5 01 00 fd 01 00
E: 45.095215 5 01 00 fd 02 00
E: 45.103190 5 01 00 fd 01 00
E: 45.107216 5 01 00 fc 01 00
E: 45.111213 5 01 00 fd 01 00
E: 45.115215 5 01 00 fc 01 00
E: 45.123188 5 01 00 fc 02 00
E: 45.127130 5 01 00 fc 01 00
E: 45.131217 5 01 00 fc 02 00
E: 45.135213 5 01 00 fc 01 00
E: 45.143190 5 01 00 fc 01 00
E: 45.147213 5 01 00 fc 01 00
E: 45.151212 5 01 00 fd 02 00
E: 45.155136 5 01 00 fc 01 00
E: 45.163189 5 01 00 fc 01 00
E: 45.167212 5 01 00 fd 02 00
E: 45.171211 5 01 00 fc 01 00
E: 45.175212 5 01 00 fd 02 00
E: 45.183188 5 01 00 fd 01 00
E: 45.187211 5 01 00 fc 02 00
E: 45.191212 5 01 00 fd 01 00
E: 45.195212 5 01 00 fd 02 00
E: 45.203129 5 01 00 fd 02 00
E: 45.207213 5 01 00 fc 01 00
E: 45.211211 5 01 00 fc 02 00
E: 45.215211 5 01 00 fc 02 00
E: 45.223128 5 01 00 fd 02 00
E: 45.227212 5 01 00 fc 01 00
E: 45.231211 5 01 00 fc 02 00
E: 45.235211 5 01 00 fd 02 00
E: 45.243139 5 01 00 fc 02 00
E: 45.247140 5 01 00 fd 02 00
E: 45.251210 5 01 00 fc 01 00
E: 45.255210 5 01 00 fd 02 00
E: 45.263186 5 01 00 fd 02 00
E: 45.267210 5 01 00 fd 02 00
E: 45.271128 5 01 00 fd 01 00
E: 45.283186 5 01 00 fb 04 00
E: 45.291128 5 01 00 fc 04 00
E: 45.303185 5 01 02 fd 04 00
E: 45.311186 5 01 02 fd 04 00
E: 45.323164 5 01 02 fd 04 00
E: 45.331186 5 01 02 fe 03 00
E: 45.343186 5 01 02 ff 03 00
E: 45.351131 5 01 02 ff 03 00
E: 45.363187 5 01 02 ff 03 00
E: 45.375185 5 01 02 ff 03 00
E: 45.391184 5 01 02 00 03 00
E: 45.415160 5 01 02 ff 03 00
E: 45.451184 5 01 00 00 02 00
E: 45.743178 5 01 00 fd 03 00
E: 45.767130 5 01 00 fd 03 00
E: 45.783179 5 01 00 fd 02 00
E: 45.795179 5 01 00 fd 03 00
E: 45.811178 5 01 00 fc 03 00
E: 45.823177 5 01 00 fd 02 00
E: 45.831176 5 01 00 fd 02 00
E: 45.843176 5 01 00 fc 01 00
E: 45.851180 5 01 00 fd 02 00
E: 45.863176 5 01 00 fd 01 00
E: 45.883177 5 01 00 fd 01 00
E: 46.227132 5 01 04 ff 00 00
E: 46.231160 5 01 06 00 00 00
E: 46.351168 5 01 04 00 00 00
E: 46.363167 5 01 00 00 00 00
E: 46.539161 5 01 04 00 00 00
E: 46.651163 5 01 00 00 00 00
E: 46.839100 5 01 02 00 00 00
E: 46.983113 5 01 00 00 00 00
E: 48.635140 5 01 00 ff fd 00
E: 48.651100 5 01 00 02 fd 00
E: 48.679128 5 01 00 fd 00 00
E: 48.699087 5 01 00 fe fc 00
E: 48.715135 5 01 00 ff fc 00
E: 48.731134 5 01 00 00 fd 00
E: 48.751126 5 01 00 01 fd 00
E: 48.763125 5 01 00 04 fe 00
E: 48.775122 5 01 00 03 ff 00
E: 48.779079 5 01 00 03 00 00
E: 48.791125 5 01 00 05 00 00
E: 48.795148 5 01 00 04 01 00
E: 48.799157 5 01 00 04 01 00
E: 48.803156 5 01 00 04 01 00
E: 48.811133 5 01 00 06 02 00
E: 48.815157 5 01 00 06 02 00
E: 48.819160 5 01 00 07 02 00
E: 48.823156 5 01 00 07 03 00
E: 48.831132 5 01 00 08 03 00
E: 48.835158 5 01 00 09 03 00
E: 48.839156 5 01 00 0a 04 00
E: 48.843158 5 01 00 0a 03 00
E: 48.851132 5 01 00 0c 04 00
E: 48.855076 5 01 00 0c 05 00
E: 48.859073 5 01 00 0d 00 00
E: 48.867135 5 01 00 0f 09 00
E: 48.871155 5 01 00 0e 05 00
E: 48.875157 5 01 00 10 02 00
E: 48.879156 5 01 00 11 09 00
E: 48.887131 5 01 00 13 03 00
E: 48.891157 5 01 00 13 07 00
E: 48.895119 5 01 00 12 05 00
E: 48.899157 5 01 00 15 06 00
E: 48.903155 5 01 00 16 06 00
