# 048:0 -> 056A:00FA / Tablet | Cintiq 22HD Tablet
D:0
R: 211 05 01 09 02 a1 01 85 01 09 01 a1 00 05 09 19 01 29 03 15 00 25 01 95 03 75 01 81 02 95 05 81 03 05 01 09 30 09 31 09 38 15 81 25 7f 75 08 95 03 81 06 c0 c0 05 0d 09 01 a1 01 85 02 09 00 75 08 96 09 00 15 00 26 ff 00 81 02 85 0c 09 00 75 08 96 09 00 15 00 26 ff 00 81 02 85 02 09 00 95 01 b1 02 85 03 09 00 95 01 b1 02 85 05 09 00 95 08 b1 02 85 07 09 00 95 06 b1 02 85 08 09 00 95 04 b1 02 85 0a 09 00 95 02 b1 02 85 0b 09 00 95 01 b1 02 85 10 09 00 95 05 b1 02 85 20 09 00 95 08 b1 02 85 04 09 00 95 01 b1 02 85 0d 09 00 95 01 b1 02 85 11 09 00 95 01 b1 02 85 12 09 00 95 02 b1 02 85 30 09 00 95 01 b1 02 85 cc 09 00 95 02 b1 02 c0
N: Tablet Cintiq 22HD Tablet
P: usb-0000:00:14.0-6.0/input0
I: 3 056A 00FA
# SET_REPORT (Feature) ID: 02 -> 02 02 (length 2)
E: 0.000000 10 02 c2 80 22 48 10 f7 31 00 00
E: 0.008000 10 02 e0 54 72 2d c8 00 32 71 9c
E: 0.014936 10 02 e0 53 be 2d eb 00 31 f0 9a
E: 0.021930 10 02 e0 53 32 2e 1f 00 31 6f 94
E: 0.028978 10 02 e0 52 8a 2e 5d 00 31 6e 9d
E: 0.043010 10 02 e0 51 3c 2f 11 00 30 ea 8d
E: 0.050010 10 02 e0 50 8b 2f 7f 00 30 e9 8e
E: 0.057013 10 02 e0 4f d2 30 06 00 30 e6 8f
E: 0.064011 10 02 e0 4f 38 30 96 00 30 64 8f
E: 0.072010 10 02 e0 4e 99 31 26 00 30 63 82
E: 0.079009 10 02 e0 4e 15 31 b8 00 30 62 78
E: 0.086010 10 02 e0 4d aa 32 54 00 30 61 75
E: 0.093010 10 02 e0 4d 49 32 f2 00 30 5f 71
E: 0.100010 10 02 e0 4c ec 33 8a 00 2f de 71
E: 0.107009 10 02 e0 4c a4 34 2a 00 2e dc 6f
E: 0.114010 10 02 e0 4c 6d 34 cf 00 2e 5b 6d
E: 0.121009 10 02 e0 4c 4c 35 62 00 2d da 6d
E: 0.128010 10 02 e0 4c 37 35 f2 00 2d da 66
E: 0.136012 10 02 e0 4c 3c 36 81 00 2d d9 64
E: 0.143009 10 02 e0 4c 50 37 0c 00 2d d9 61
E: 0.150006 10 02 e0 4c 7b 37 95 00 2d 58 62
E: 0.157009 10 02 e0 4c c0 38 27 00 2c d7 65
E: 0.164008 10 02 e0 4d 1e 38 ca 00 2c 57 66
E: 0.171009 10 02 e0 4d 87 39 5f 00 2c 58 65
E: 0.178009 10 02 e0 4e 1c 39 ed 00 2c 58 61
E: 0.185009 10 02 e0 4e c3 3a 72 00 2c 57 5f
E: 0.192009 10 02 e0 4f 81 3a e8 00 2b d5 58
E: 0.198998 10 02 e0 50 54 3b 3f 00 2b 55 5a
E: 0.206999 10 02 e0 51 47 3b 7f 00 2a d4 58
E: 0.213940 10 02 e0 52 32 3b a9 00 2a d4 5e
E: 0.220999 10 02 e0 53 2f 3b c6 00 2b 53 5e
E: 0.227999 10 02 e0 54 2c 3b d8 00 2b 53 5c
E: 0.234999 10 02 e0 55 46 3b e0 00 2b 52 5d
E: 0.241999 10 02 e0 56 62 3b dd 00 2b 51 61
E: 0.248999 10 02 e0 57 8d 3b cd 00 2b 51 5d
E: 0.255932 10 02 e0 58 b8 3b b8 00 2b 50 62
E: 0.263000 10 02 e0 59 e4 3b 93 00 2b 50 6b
E: 0.270998 10 02 e0 5b 16 3b 65 00 2b d0 6b
E: 0.277999 10 02 e0 5c 37 3b 2e 00 2b 51 6b
E: 0.284999 10 02 e0 5d 60 3a ee 00 2b 50 68
E: 0.291998 10 02 e0 5e 76 3a 99 00 2b 50 6c
E: 0.298999 10 02 e0 5f 8d 3a 37 00 2b 51 6c
E: 0.305928 10 02 e0 60 91 39 cf 00 2a d1 6d
E: 0.312998 10 02 e0 61 9f 39 5e 00 2a d2 71
E: 0.319998 10 02 e0 62 87 38 e2 00 2b 53 73
E: 0.326998 10 02 e0 63 7a 38 53 00 2a d3 71
E: 0.333998 10 02 e0 64 5a 37 be 00 2a d3 6d
E: 0.341999 10 02 e0 65 3d 37 2a 00 2a d4 6f
E: 0.348999 10 02 e0 66 03 36 95 00 2a d4 6d
E: 0.355935 10 02 e0 66 a2 35 ee 00 2a d5 6e
E: 0.362999 10 02 e0 67 25 35 41 00 2a d6 6e
E: 0.369998 10 02 e0 67 8c 34 83 00 2a d6 6f
E: 0.376998 10 02 e0 67 db 33 cc 00 2a d6 6e
E: 0.383998 10 02 e0 68 17 33 23 00 2a 56 6c
E: 0.390961 10 02 e0 68 3c 32 78 00 2a 57 6e
E: 0.397998 10 02 e0 68 4f 31 c5 00 2a 57 6d
E: 0.405934 10 02 e0 68 48 31 17 00 29 d8 6f
E: 0.412998 10 02 e0 68 2a 30 63 00 29 d7 71
E: 0.419997 10 02 e0 67 f2 2f c2 00 29 d7 72
E: 0.426997 10 02 e0 67 a8 2f 33 00 29 d6 71
E: 0.433998 10 02 e0 67 51 2e ac 00 29 d6 73
E: 0.440955 10 02 e0 66 f5 2e 27 00 29 d6 70
E: 0.447997 10 02 e0 66 94 2d 9a 00 2a 57 77
E: 0.454997 10 02 e0 66 34 2d 16 00 2a d8 7a
E: 0.462999 10 02 e0 65 d6 2c 96 00 2b 57 7a
E: 0.469997 10 02 e0 65 6d 2c 28 00 2a d6 79
E: 0.476955 10 02 e0 64 fb 2b e2 00 2a 55 7b
E: 0.484000 10 02 e0 64 8e 2b be 00 2a 55 7b
E: 0.490951 10 02 e0 64 26 2b ad 00 2a 54 7c
E: 0.498000 10 02 e0 63 c7 2b 9a 00 2a 54 80
E: 0.504999 10 02 e0 63 6b 2b 79 00 2a 53 86
E: 0.512003 10 02 e0 63 09 2b 4f 00 2a d2 8a
E: 0.519001 10 02 e0 62 af 2b 1c 00 2a d0 91
E: 0.525997 10 02 e0 62 5f 2a f1 00 2b 50 91
E: 0.533999 10 02 e0 62 0d 2a e2 00 2c 50 97
E: 0.540954 10 02 e0 61 aa 2b 06 00 2c cf 98
E: 0.547997 10 02 e0 61 30 2b 45 00 2b ce 9a
E: 0.554998 10 02 e0 60 cf 2b a6 00 2b 4c 98
E: 0.561996 10 02 e0 60 7c 2c 16 00 2a ca 9a
E: 0.568997 10 02 e0 60 3a 2c 90 00 29 c7 96
E: 0.575997 10 02 e0 60 0c 2d 13 00 29 48 92
E: 0.582996 10 02 e0 5f ed 2d 9c 00 29 48 83
E: 0.589996 10 02 e0 5f ed 2e 22 00 29 47 79
E: 0.597996 10 02 e0 60 0c 2e 9c 00 29 46 76
E: 0.604997 10 02 e0 60 42 2f 1c 00 28 c5 72
E: 0.611997 10 02 e0 60 88 2f a9 00 28 44 6d
E: 0.618997 10 02 e0 60 d4 30 44 00 27 c2 6f
E: 0.625996 10 02 e0 61 2d 30 e4 00 26 c0 6d
E: 0.632997 10 02 e0 61 89 31 83 00 25 bf 6e
E: 0.639997 10 02 e0 61 dc 32 1d 00 25 3e 6d
E: 0.646994 10 02 e0 62 21 32 b3 00 24 3c 6e
E: 0.653997 10 02 e0 62 63 33 50 00 23 3a 6e
E: 0.661992 10 02 e0 62 95 34 04 00 23 b7 6e
E: 0.668997 10 02 e0 62 bd 34 b8 00 23 b5 73
E: 0.675998 10 02 e0 62 d8 35 70 00 23 b4 74
E: 0.682997 10 02 e0 62 eb 36 2a 00 23 33 73
E: 0.689996 10 02 e0 62 f4 36 db 00 23 30 70
E: 0.696998 10 02 e0 62 f4 37 88 00 22 ac 77
E: 0.703999 10 02 e0 62 e4 38 34 00 22 a9 75
E: 0.710998 10 02 e0 62 c9 38 d4 00 22 26 78
E: 0.717996 10 02 e0 62 a4 39 68 00 22 23 7b
E: 0.725996 10 02 e0 62 77 39 f2 00 22 22 79
E: 0.732997 10 02 e0 62 41 3a 68 00 22 21 75
E: 0.739996 10 02 e0 62 02 3a d9 00 22 9f 74
E: 0.746942 10 02 e0 61 bc 3b 44 00 23 1d 77
E: 0.753996 10 02 e0 61 5b 3b b8 00 22 1b 7a
E: 0.760995 10 02 e0 60 e4 3c 39 00 21 99 7b
E: 0.767995 10 02 e0 60 59 3c bb 00 21 97 7a
E: 0.774996 10 02 e0 5f c0 3d 3e 00 21 15 79
E: 0.781997 10 02 e0 5f 08 3d d4 00 21 15 79
E: 0.789995 10 02 e0 5e 24 3e 5d 00 21 94 7a
E: 0.796995 10 02 e0 5d 26 3e c8 00 22 12 78
E: 0.803995 10 02 e0 5c 0a 3f 04 00 22 12 7a
E: 0.810997 10 02 e0 5b 08 3f 08 00 22 91 75
E: 0.817997 10 02 e0 59 f5 3e d0 00 23 12 72
E: 0.824995 10 02 e0 58 fb 3e 6a 00 23 92 6f
E: 0.831996 10 02 e0 58 0d 3d cb 00 23 94 6f
E: 0.838993 10 02 e0 57 0e 3c f0 00 24 94 6e
E: 0.845996 10 02 e0 55 ef 3b e3 00 25 13 68
E: 0.853996 10 02 e0 54 d8 3a 92 00 25 14 6f
E: 0.860997 10 02 e0 53 e0 38 d6 00 25 95 72
E: 0.867995 10 02 e0 53 12 37 23 00 27 17 6d
E: 0.874996 10 02 e0 52 45 35 1f 00 28 19 74
E: 0.881995 10 02 e0 51 9c 33 3d 00 29 9b 7b
E: 0.888995 10 02 e0 51 35 31 1e 00 2b 20 8a
E: 0.895997 10 02 e0 51 1a 2f a4 00 2c 22 93
E: 0.902995 10 02 e0 51 44 2e 4f 00 2d a5 9c
E: 0.909995 10 02 e0 51 97 2c db 00 2e a8 aa
E: 0.916995 10 02 e0 52 0f 2b 92 00 2f aa ab
E: 0.924996 10 02 e0 52 9e 2a 4e 00 30 ae ad
E: 0.931999 10 02 e0 53 41 28 e4 00 31 b3 b7
E: 0.938997 10 02 e0 53 fe 27 bd 00 32 36 b5
E: 0.945997 10 02 e0 55 01 26 d6 00 32 b9 b0
E: 0.952996 10 02 e0 56 26 25 e7 00 33 bd ac
E: 0.959996 10 02 e0 57 68 24 ff 00 33 c2 ac
E: 0.966995 10 02 e0 58 da 24 42 00 34 44 a9
E: 0.973996 10 02 e0 5a 70 23 be 00 35 48 98
E: 0.980992 10 02 e0 5c 06 23 5f 00 35 4b 84
E: 0.987996 10 02 e0 5d e9 23 25 00 35 4e 7b
E: 0.995995 10 02 e0 5f c5 23 05 00 34 d1 77
E: 1.002995 10 02 e0 61 d4 23 02 00 34 53 6d
E: 1.009993 10 02 e0 63 7d 22 fb 00 33 d5 69
E: 1.016995 10 02 e0 65 2e 22 fd 00 32 d7 65
E: 1.023994 10 02 e0 66 a4 23 18 00 32 59 6a
E: 1.030996 10 02 e0 68 0d 23 47 00 31 5c 69
E: 1.037994 10 02 e0 69 74 23 8a 00 2f dd 6e
E: 1.044994 10 02 e0 6a 92 23 e2 00 2f 5d 6e
E: 1.051997 10 02 e0 6b 95 24 4f 00 2e de 6d
E: 1.059994 10 02 e0 6c 99 24 d2 00 2d df 72
E: 1.066996 10 02 e0 6d 87 25 58 00 2c 60 71
E: 1.073932 10 02 e0 6e 2c 25 fc 00 2b 60 71
E: 1.080949 10 02 e0 6e 9f 26 a7 00 2a e2 72
E: 1.087996 10 02 e0 6e f6 27 5e 00 29 62 71
E: 1.094995 10 02 e0 6f 28 28 34 00 28 63 70
E: 1.101995 10 02 e0 6f 3d 29 06 00 27 62 74
E: 1.108994 10 02 e0 6f 31 29 b6 00 26 63 73
E: 1.115995 10 02 e0 6f 0a 2a 54 00 25 63 73
E: 1.123996 10 02 e0 6e d2 2a dc 00 24 e3 77
E: 1.130995 10 02 e0 6e 93 2b 60 00 24 63 78
E: 1.137996 10 02 e0 6e 53 2b fa 00 23 e2 7c
E: 1.144994 10 02 e0 6e 0d 2c b6 00 23 61 96
E: 1.151994 10 02 e0 6d c1 2d 7c 00 22 62 99
E: 1.158994 10 02 e0 6d 66 2e 6f 00 20 e2 9f
E: 1.165995 10 02 e0 6d 07 2f 77 00 1f e1 a5
E: 1.172993 10 02 e0 6c b7 30 c4 00 1f 60 ac
E: 1.179994 10 02 e0 6c 5e 31 f2 00 1e e0 a4
E: 1.187994 10 02 e0 6c 07 33 0e 00 1d de 98
E: 1.194996 10 02 e0 6b b5 34 40 00 1d 5c 92
E: 1.201995 10 02 e0 6b 6c 35 62 00 1c dc 7d
E: 1.208994 10 02 e0 6b 29 36 5d 00 1c 5b 71
E: 1.215994 10 02 e0 6a fd 37 3c 00 1c 5a 6b
E: 1.222993 10 02 e0 6a ea 38 0c 00 1b d8 62
E: 1.229995 10 02 e1 6a f7 38 9d 90 1b 55 61
E: 1.236995 10 02 e1 6b 03 39 15 59 9a d4 64
E: 1.243994 10 02 e0 6a fc 39 7d 00 19 d2 67
E: 1.250994 10 02 e0 6a d2 39 e6 00 19 51 65
E: 1.258995 10 02 e0 6a 8e 3a 55 00 18 cf 67
E: 1.265994 10 02 e0 6a 3f 3a ce 00 19 4c 64
E: 1.272994 10 02 e0 69 d9 3b 59 00 19 c9 6a
E: 1.279993 10 02 e0 69 5b 3b f3 00 1a 47 6c
E: 1.286993 10 02 e0 68 c3 3c 9d 00 1a 45 6f
E: 1.293994 10 02 e0 68 0e 3d 50 00 1a c1 6e
E: 1.300993 10 02 e0 67 59 3d d8 00 1a c0 69
E: 1.307993 10 02 e0 66 9b 3e 3f 00 1b 3f 6b
E: 1.314995 10 02 e0 65 dc 3e 7c 00 1b bb 6a
E: 1.322993 10 02 e0 65 1e 3e 90 00 1b b8 68
E: 1.329994 10 02 e0 64 6c 3e 80 00 1b b6 68
E: 1.336993 10 02 e0 63 c0 3e 4b 00 1c 34 6d
E: 1.343996 10 02 e0 63 06 3d fa 00 1c b3 6f
E: 1.350998 10 02 e0 62 43 3d 91 00 1d b1 73
E: 1.357993 10 02 e0 61 8a 3d 16 00 1e b0 74
E: 1.364995 10 02 e0 60 e8 3c 9b 00 1f 2d 74
E: 1.371993 10 02 e0 60 76 3c 2f 00 1f ab 75
E: 1.378996 10 02 e0 60 18 3b cb 00 20 29 79
E: 1.386994 10 02 e0 5f b5 3b 63 00 20 a8 7b
E: 1.393992 10 02 e0 5f 33 3b 0c 00 22 27 7f
E: 1.400993 10 02 e0 5e 94 3a ad 00 23 27 85
E: 1.407993 10 02 e0 5d dd 3a 45 00 24 a7 91
E: 1.414993 10 02 e0 5d 16 39 ca 00 25 27 9c
E: 1.421994 10 02 e0 5c 51 39 2d 00 25 a7 aa
E: 1.428993 10 02 e0 5b 9e 38 7b 00 26 26 aa
E: 1.435994 10 02 e0 5a e4 37 a9 00 27 a5 ac
E: 1.442993 10 02 e0 5a 1d 36 cd 00 29 a5 b2
E: 1.449993 10 02 e0 59 64 35 b6 00 2b 26 b4
E: 1.457992 10 02 e0 58 a5 34 70 00 2b a7 c0
E: 1.464992 10 02 e0 58 06 33 1a 00 2b a7 b6
E: 1.471993 10 02 e0 57 7d 31 9d 00 2c a8 bb
E: 1.478992 10 02 e0 57 09 2f eb 00 2d a8 b8
E: 1.485957 10 02 e0 56 93 2e 67 00 2f 2a bb
E: 1.492992 10 02 e0 56 43 2c a7 00 30 2c c4
E: 1.499994 10 02 e0 56 0b 2a ef 00 31 ae bc
E: 1.506993 10 02 e0 55 f5 29 2b 00 32 b0 c2
E: 1.513992 10 02 e0 56 0a 27 81 00 33 31 c1
E: 1.521993 10 02 e0 56 45 26 15 00 33 b3 be
E: 1.528992 10 02 e0 56 a9 24 91 00 35 35 c3
E: 1.535992 10 02 e0 57 27 23 4d 00 36 36 bb
E: 1.542929 10 02 e0 57 b2 22 33 00 36 bb b7
E: 1.549918 10 02 e0 58 6a 21 16 00 36 c0 b5
E: 1.556994 10 02 e0 59 51 20 20 00 35 c0 b4
E: 1.563993 10 02 e0 5a 25 1f 5e 00 35 c2 aa
E: 1.570993 10 02 e0 5a fc 1e c0 00 36 c3 a3
E: 1.577993 10 02 e0 5b c8 1e 18 00 37 47 9f
E: 1.585994 10 02 e0 5c ad 1d 74 00 36 c9 99
E: 1.592992 10 02 e0 5d 9f 1c d7 00 36 4e 9f
E: 1.599992 10 02 e0 5e 66 1c 56 00 36 52 a7
E: 1.606993 10 02 e0 5f 36 1b fb 00 36 53 a3
E: 1.613991 10 02 e0 5f f1 1b bd 00 35 55 9f
E: 1.620993 10 02 e0 60 c4 1b 9f 00 34 d5 99
E: 1.627992 10 02 e0 61 be 1b 9c 00 33 d7 96
E: 1.634992 10 02 e0 62 8f 1b b0 00 33 d7 93
E: 1.641991 10 02 e0 63 76 1b d9 00 33 58 89
E: 1.649991 10 02 e0 64 5b 1c 29 00 32 d8 89
E: 1.656950 10 02 e0 65 71 1c a2 00 32 58 87
E: 1.663992 10 02 e0 66 65 1d 1f 00 32 d8 78
E: 1.670991 10 02 e0 67 62 1d b5 00 32 da 76
E: 1.677928 10 02 e0 68 4e 1e 43 00 31 dc 74
E: 1.684945 10 02 e0 69 38 1e d6 00 31 5c 70
E: 1.691989 10 02 e0 69 f6 1f 71 00 31 5b 74
E: 1.698992 10 02 e0 6a 75 20 14 00 31 5a 77
E: 1.705988 10 02 e0 6a d3 20 b9 00 31 59 78
E: 1.712992 10 02 e0 6b 17 21 54 00 30 d8 7a
E: 1.720992 10 02 e0 6b 3f 21 fa 00 30 59 78
E: 1.727992 10 02 e0 6b 64 22 97 00 30 59 7b
E: 1.734992 10 02 e0 6b 8b 23 2d 00 30 59 7b
E: 1.741991 10 02 e0 6b b7 23 d0 00 2f d9 7a
E: 1.748992 10 02 e0 6b e3 24 68 00 2f 58 80
E: 1.755988 10 02 e0 6c 09 24 e6 00 2e d9 7e
E: 1.762991 10 02 e0 6c 2b 25 52 00 2e 59 79
E: 1.769991 10 02 e0 6c 3a 25 ae 00 2e 5a 7a
E: 1.776992 10 02 e0 6c 43 26 01 00 2d 59 7b
E: 1.784994 10 02 e0 6c 38 26 3f 00 2c d8 75
E: 1.791994 10 02 e0 6c 1b 26 72 00 2c d8 77
E: 1.798991 10 02 e0 6b f4 26 9c 00 2c d7 77
E: 1.805989 10 02 e0 6b c7 26 bc 00 2c 57 72
E: 1.812994 10 02 e0 6b a1 26 cd 00 2b d7 73
E: 1.819991 10 02 e0 6b 74 26 dc 00 2b d7 6e
E: 1.826990 10 02 e0 6b 53 26 e9 00 2b 56 6e
E: 1.833993 10 02 e0 6b 41 26 ea 00 2a d6 6d
E: 1.840951 10 02 e0 6b 36 26 e3 00 2a d6 68
E: 1.847991 10 02 e0 6b 33 26 d3 00 2a 56 6b
E: 1.855987 10 02 e0 6b 24 26 c0 00 29 d6 65
E: 1.862990 10 02 e0 6b 05 26 a8 00 29 d7 61
E: 1.869990 10 02 e0 6a e0 26 90 00 29 d6 5f
E: 1.876991 10 02 e1 6a ba 26 70 52 69 56 5c
E: 1.883924 10 02 e0 6a 82 26 3b 81 29 55 5f
E: 1.890948 10 02 e0 6a 40 25 fd 85 e9 55 5f
E: 1.897991 10 02 e0 69 f9 25 b2 87 a8 d5 5d
E: 1.904992 10 02 e0 69 9a 25 5b 87 a8 d4 61
E: 1.911991 10 02 e1 69 12 25 03 88 e8 d5 64
E: 1.919992 10 02 e1 68 84 24 b5 8a e8 55 66
E: 1.926990 10 02 e1 67 f2 24 69 8c a8 54 67
E: 1.933991 10 02 e0 67 52 24 2a 8d 68 54 61
E: 1.940950 10 02 e0 66 96 23 f8 8d 28 54 63
E: 1.947990 10 02 e0 65 cc 23 d4 8c 68 54 65
E: 1.954990 10 02 e1 64 c9 23 c3 87 a7 d4 60
E: 1.961990 10 02 e0 63 c5 23 c9 86 e8 54 60
E: 1.968992 10 02 e1 62 a4 23 e2 86 28 54 61
E: 1.975991 10 02 e1 61 87 24 0d 86 68 54 63
E: 1.983991 10 02 e1 60 54 24 51 85 28 d4 64
E: 1.990948 10 02 e1 5f 33 24 b4 85 28 d4 64
E: 1.997990 10 02 e1 5e 08 25 27 85 29 54 65
E: 2.004990 10 02 e0 5c da 25 c1 86 29 54 66
E: 2.011931 10 02 e0 5b b5 26 77 88 a9 d4 63
E: 2.018924 10 02 e1 5a 8c 27 40 8a ea 54 62
E: 2.025939 10 02 e0 59 74 28 29 8d 6a d3 65
E: 2.032940 10 02 e0 58 67 29 25 8e ea d3 65
E: 2.039998 10 02 e1 57 88 2a 33 93 ab 53 5a
E: 2.046927 10 02 e1 56 c1 2b 60 96 ab d2 5b
E: 2.054940 10 02 e0 56 24 2c b0 98 2b d2 5f
E: 2.061940 10 02 e0 55 b2 2e 02 98 2c 51 5e
E: 2.068999 10 02 e1 55 6c 2f 71 98 2c 50 5a
E: 2.075930 10 02 e1 55 4b 30 e9 98 6c d0 65
E: 2.082923 10 02 e0 55 4e 32 3f 96 ac cf 5a
E: 2.089997 10 02 e1 55 8f 33 8f 95 ac ce 58
E: 2.096932 10 02 e1 55 f9 34 d1 95 2d 4d 58
E: 2.103987 10 02 e0 56 95 35 e6 94 ed 4c 56
E: 2.110931 10 02 e1 57 66 36 e3 95 2c cb 53
E: 2.118924 10 02 e0 58 5a 37 b7 96 2c ca 54
E: 2.125930 10 02 e1 59 7f 38 5e 98 2c c8 5a
E: 2.132918 10 02 e0 5a aa 38 d4 99 ec 47 65
E: 2.139988 10 02 e0 5b f6 39 1b 9d 2c 46 61
E: 2.146931 10 02 e1 5d 64 39 2f a5 ab c5 66
E: 2.153987 10 02 e1 5e d6 39 14 ac 2b c5 64
E: 2.160932 10 02 e1 60 5d 38 c9 b2 2b 44 66
E: 2.167922 10 02 e0 61 ee 38 51 b6 2a c4 64
E: 2.174939 10 02 e1 63 54 37 ac b7 aa 43 62
E: 2.182924 10 02 e0 64 b5 36 e4 b8 a9 c2 62
E: 2.189987 10 02 e0 66 03 35 f8 b8 69 42 60
E: 2.196927 10 02 e0 67 1f 34 ec b8 68 c2 67
E: 2.203987 10 02 e0 68 1c 33 ba b8 68 42 67
E: 2.210932 10 02 e0 68 e8 32 81 b8 a7 c2 63
E: 2.217922 10 02 e0 69 89 31 35 b7 e7 43 67
E: 2.224939 10 02 e1 69 f2 2f f8 b7 e6 c3 65
E: 2.231924 10 02 e0 6a 2e 2e c9 b8 26 44 61
E: 2.238990 10 02 e0 6a 3f 2d 89 b7 e6 45 60
E: 2.246984 10 02 e0 6a 28 2c 53 b7 65 c7 60
E: 2.253988 10 02 e0 69 ec 2b 44 b4 e5 c7 5c
E: 2.260989 10 02 e1 69 86 2a 54 b0 a5 c9 62
E: 2.267990 10 02 e1 69 03 29 82 ad a5 4a 60
E: 2.274930 10 02 e1 68 64 28 e5 ac a5 cb 67
E: 2.281989 10 02 e0 67 ac 28 62 ab e5 cc 64
E: 2.288987 10 02 e0 66 c8 27 f8 ab 65 cd 61
E: 2.295930 10 02 e1 65 de 27 aa aa a6 4f 61
E: 2.302942 10 02 e0 64 cb 27 80 aa 26 50 61
E: 2.310956 10 02 e0 63 b1 27 76 a9 e6 d1 60
E: 2.317988 10 02 e0 62 6c 27 8c a9 e7 52 62
E: 2.324927 10 02 e1 61 30 27 bd aa e7 d3 64
E: 2.331989 10 02 e0 5f f5 28 10 ab 68 53 62
E: 2.338986 10 02 e1 5e be 28 80 ab a8 d4 64
E: 2.345991 10 02 e0 5d 9c 29 03 ac 29 54 66
E: 2.352988 10 02 e1 5c 7f 29 a0 ab a9 55 66
E: 2.359987 10 02 e1 5b 85 2a 5c ab e9 d5 61
E: 2.366988 10 02 e0 5a 98 2b 2a ac 6a 55 5f
E: 2.374989 10 02 e0 59 dc 2c 1d ac aa d5 63
E: 2.381988 10 02 e0 59 5c 2d 36 ad 6b 54 62
E: 2.388971 10 02 e0 59 11 2e 6a ac eb 53 5b
E: 2.395988 10 02 e0 59 06 2f ac ac 2b 53 59
E: 2.402989 10 02 e0 59 36 30 e9 aa 6b 52 61
E: 2.409987 10 02 e0 59 a3 31 ea a8 2b 52 5c
E: 2.416989 10 02 e0 5a 49 32 ca a5 6b d1 60
E: 2.423988 10 02 e0 5b 29 33 86 a3 eb d0 5e
E: 2.430988 10 02 e0 5c 29 34 15 a3 ab ce 63
E: 2.437989 10 02 e0 5d 4e 34 60 a3 ab 4d 61
E: 2.445989 10 02 e0 5e 72 34 65 a5 eb 4c 65
E: 2.452988 10 02 e1 5f a2 34 3e aa eb 4b 63
E: 2.459988 10 02 e1 60 c2 33 f0 af ea ca 61
E: 2.466987 10 02 e0 61 cc 33 86 b5 aa c9 62
E: 2.473989 10 02 e1 62 8a 32 f8 ba aa 48 62
E: 2.480985 10 02 e0 63 39 32 48 bc e9 c7 60
E: 2.487987 10 02 e0 63 c4 31 78 be 29 c7 63
E: 2.494988 10 02 e1 64 26 30 98 be 29 47 66
E: 2.501988 10 02 e0 64 5e 2f af bd e9 47 5d
E: 2.509988 10 02 e0 64 6b 2e d7 bd e8 c7 5e
E: 2.516988 10 02 e0 64 4d 2e 01 bc a8 c7 5f
E: 2.523988 10 02 e1 64 10 2d 3a b8 e8 c7 5d
E: 2.530987 10 02 e0 63 b4 2c 89 b3 e8 c7 61
E: 2.537988 10 02 e0 63 38 2b fb b0 a8 48 5c
E: 2.544988 10 02 e0 62 94 2b 96 ac e8 48 59
E: 2.551929 10 02 e0 61 d6 2b 62 a8 68 c9 5f
E: 2.558988 10 02 e1 60 e0 2b 5e a8 e8 ca 63
E: 2.565987 10 02 e0 5f df 2b 8e a8 28 cb 5c
E: 2.572986 10 02 e1 5e d1 2b e9 a8 a8 cc 5f
E: 2.580987 10 02 e1 5d d7 2c 70 aa 29 4c 63
E: 2.587987 10 02 e1 5c fc 2d 1d ae 29 4d 66
E: 2.594987 10 02 e0 5c 4e 2d ec ae a9 cd 5d
E: 2.601988 10 02 e1 5b e0 2e d4 af 29 cd 5f
E: 2.608987 10 02 e1 5b ac 2f c0 ae 6a 4d 5d
E: 2.615987 10 02 e1 5b a3 30 ac a9 aa 4c 63
E: 2.622986 10 02 e1 5b bf 31 7a 98 2a 4c 61
E: 2.629987 10 02 e1 5b f0 32 32 73 6a 4c 62
E: 2.636987 10 02 e0 5c 30 32 d5 30 aa 4b 5d
E: 2.644988 10 02 e0 5c 74 33 56 00 2a 4b 61
E: 2.651990 10 02 e0 5c ba 33 b2 00 2a 4a 63
E: 2.658986 10 02 e0 5c ff 33 e1 00 29 c9 65
E: 2.665988 10 02 e0 5d 40 33 f2 00 29 48 6f
E: 2.672989 10 02 e0 5d 7b 33 e8 00 28 c7 71
E: 2.679989 10 02 e0 5d b8 33 d7 00 29 46 7a
E: 2.686988 10 02 e0 5d f6 33 b9 00 29 c5 81
E: 2.693986 10 02 e0 5e 34 33 a1 00 29 c4 97
E: 2.700988 10 02 e0 5e 66 33 8f 00 2a 43 a4
E: 2.707985 10 02 e0 5e 90 33 83 00 2a c2 b6
E: 2.715987 10 02 e0 5e ab 33 83 00 2b 41 c2
E: 2.722987 10 02 e0 5e b5 33 8b 00 2b c1 d0
E: 2.729987 10 02 e0 5e bf 33 a6 00 2b c0 e5
E: 2.736986 10 02 e0 5e ae 33 ce 00 2c c0 f2
E: 2.744986 10 02 80 00 00 00 00 00 00 00 00
E: 2.877928 10 0c 00 00 00 00 00 01 00 00 00
E: 2.882920 10 0c 00 00 00 00 00 00 00 00 00
E: 2.967943 10 0c 00 00 00 00 00 01 00 00 00
E: 3.228910 10 0c 00 00 00 00 00 00 00 00 00
E: 3.456988 10 0c 00 00 00 00 00 02 00 00 00
E: 3.596986 10 0c 00 00 00 00 00 00 00 00 00
E: 4.303979 10 0c 00 00 00 00 00 02 00 00 00
E: 4.461935 10 0c 00 00 00 00 00 00 00 00 00
E: 4.714977 10 0c 00 00 00 00 00 01 00 00 00
E: 4.853976 10 0c 00 00 00 00 00 00 00 00 00
E: 5.104902 10 0c 00 00 00 00 00 04 00 00 00
E: 5.268906 10 0c 00 00 00 00 00 00 00 00 00
E: 5.499905 10 0c 00 00 00 00 00 08 00 00 00
E: 5.654919 10 0c 00 00 00 00 00 00 00 00 00
E: 6.025899 10 0c 00 00 00 00 01 00 00 00 00
E: 6.057897 10 0c 00 00 00 00 00 00 00 00 00
E: 6.160897 10 0c 00 00 00 00 01 00 00 00 00
E: 6.319900 10 0c 00 00 00 00 00 00 00 00 00
E: 6.683892 10 0c 10 00 00 00 00 00 00 00 00
E: 6.736904 10 02 c2 80 22 48 10 f7 31 00 00
E: 6.743895 10 02 e0 68 eb 30 7b 00 2f c2 7a
E: 6.750900 10 02 e0 68 7b 2f e1 00 2f 45 78
E: 6.757900 10 02 e0 67 f5 2f 5b 00 2e c7 76
E: 6.765900 10 02 e0 67 62 2e e3 00 2e 4a 72
E: 6.772895 10 02 e0 66 c2 2e 6b 00 2d cc 71
E: 6.779893 10 02 e0 66 16 2e 06 00 2d cf 70
E: 6.786918 10 02 e0 65 55 2d bb 00 2d 52 76
E: 6.793898 10 02 e0 64 7e 2d 89 00 2c d5 73
E: 6.800899 10 02 e0 63 af 2d 75 00 2c 58 72
E: 6.807893 10 02 e0 62 cb 2d 76 00 2c 5b 73
E: 6.814903 10 02 e0 61 e5 2d 95 00 2c 5e 70
E: 6.821901 10 02 e0 60 db 2d c2 00 2b e0 73
E: 6.829896 10 02 e0 5f d8 2e 0c 00 2b 63 72
E: 6.836888 10 02 e0 5e d3 2e 74 00 2b 63 70
E: 6.837884 10 0c 00 00 00 00 00 00 00 00 00
E: 6.843886 10 02 e0 5d ce 2e f9 00 2b 62 73
E: 6.850904 10 02 e0 5c ce 2f 97 00 2b e1 77
E: 6.857904 10 02 e0 5b f3 30 5b 00 2c 61 77
E: 6.864915 10 02 e0 5b 44 31 37 00 2c e0 78
E: 6.871912 10 02 e0 5a ad 32 19 00 2d 60 70
E: 6.878915 10 02 e0 5a 3f 33 0a 00 2d 60 71
E: 6.885915 10 02 e0 59 ee 34 08 00 2d df 72
E: 6.892915 10 02 e0 59 c4 35 15 00 2d de 71
E: 6.900975 10 02 e0 59 af 35 ff 00 2e 5d 6f
E: 6.907965 10 02 e0 59 b0 36 e7 00 2e dc 6d
E: 6.914966 10 02 e0 59 c1 37 c7 00 2f 5b 6f
E: 6.921962 10 02 e0 59 e1 38 b0 00 2f 59 6e
E: 6.928967 10 02 e0 5a 10 39 73 00 2f 59 6c
E: 6.935967 10 02 e0 5a 4a 3a 25 00 2f 58 6f
E: 6.942968 10 02 e0 5a 95 3a c8 00 2f 57 68
E: 6.949965 10 02 e0 5a f0 3b 55 00 2f 56 6e
E: 6.956967 10 0c 10 00 00 00 00 00 00 00 00
E: 6.957894 10 02 e0 5b 54 3b cc 00 2f 55 6f
E: 6.964901 10 02 e0 5b bf 3c 37 00 2f 54 71
E: 6.971965 10 02 e0 5c 37 3c 96 00 2e d4 75
E: 6.978901 10 02 e0 5c b5 3c eb 00 2e d3 74
E: 6.985963 10 02 e0 5d 3a 3d 33 00 2d d1 7e
E: 6.992966 10 02 e0 5d bb 3d 68 00 2d 51 78
E: 6.999967 10 02 e0 5e 35 3d 96 00 2d 52 7c
E: 7.000903 10 0c 08 00 00 00 00 00 00 00 00
E: 7.006901 10 02 e0 5e ab 3d b9 00 2d 53 7d
E: 7.013963 10 02 e0 5f 1a 3d d0 00 2d 53 82
E: 7.020901 10 02 e0 5f 79 3d db 00 2c d4 84
E: 7.021896 10 0c 04 00 00 00 00 00 00 00 00
E: 7.028900 10 02 e0 5f ca 3d e3 00 2c d5 8b
E: 7.035899 10 02 e0 60 0f 3d e3 00 2c 56 8c
E: 7.036900 10 0c 02 00 00 00 00 00 00 00 00
E: 7.042897 10 02 e0 60 4e 3d e2 00 2b d6 92
E: 7.049886 10 02 e0 60 7e 3d d6 00 2b 57 97
E: 7.056895 10 02 e0 60 a9 3d d4 00 2a d7 99
E: 7.060892 10 0c 01 00 00 00 00 00 00 00 00
E: 7.063899 10 02 e0 60 c6 3d c6 00 2a 59 9e
E: 7.070886 10 02 e0 60 e0 3d bb 00 29 da a2
E: 7.075885 10 0c 00 80 00 00 00 00 00 00 00
E: 7.077896 10 02 e0 60 ed 3d ad 00 29 5c a5
E: 7.085924 10 02 e0 60 fa 3d a0 00 29 5e a5
E: 7.092893 10 02 e0 60 fa 3d 94 00 28 e0 ab
E: 7.099890 10 02 e0 61 00 3d 8c 00 28 e2 ab
E: 7.100891 10 0c 00 40 00 00 00 00 00 00 00
E: 7.106884 10 02 e0 60 fd 3d 8a 00 28 e3 a8
E: 7.113885 10 02 e0 60 f5 3d 80 00 27 e3 af
E: 7.115894 10 0c 00 20 00 00 00 00 00 00 00
E: 7.120917 10 02 e0 60 e8 3d 7c 00 26 e4 ac
E: 7.127899 10 02 e0 60 d4 3d 77 00 26 65 af
E: 7.134892 10 02 e0 60 bb 3d 6f 00 25 e6 ad
E: 7.135884 10 0c 00 10 00 00 00 00 00 00 00
E: 7.141885 10 02 e0 60 9f 3d 67 00 25 66 b3
E: 7.149895 10 02 e0 60 81 3d 63 00 24 e7 b2
E: 7.156963 10 02 e0 60 63 3d 61 00 24 e8 b0
E: 7.163901 10 02 e0 60 3f 3d 5c 00 25 69 b0
E: 7.170901 10 02 e0 60 1d 3d 60 00 25 6a b4
E: 7.173894 10 0c 00 08 00 00 00 00 00 00 00
E: 7.177893 10 02 e0 60 00 3d 5f 00 25 ea b6
E: 7.184892 10 02 e0 5f de 3d 65 00 26 6a b4
E: 7.191897 10 02 e0 5f be 3d 66 00 26 eb b7
E: 7.198895 10 02 e0 5f a3 3d 69 00 27 6b b5
E: 7.206893 10 02 e0 5f 89 3d 71 00 28 6b b7
E: 7.213893 10 02 e0 5f 6f 3d 76 00 28 ec b5
E: 7.220891 10 02 e0 5f 57 3d 7f 00 29 ec b4
E: 7.227898 10 02 e0 5f 45 3d 88 00 2a 6c b5
E: 7.234897 10 02 e0 5f 31 3d 90 00 2b 6b b4
E: 7.241892 10 02 e0 5f 28 3d 98 00 2b eb b7
E: 7.248883 10 02 e0 5f 22 3d 9f 00 2c eb b6
E: 7.255914 10 02 e0 5f 1f 3d ac 00 2d 6b b4
E: 7.263894 10 02 e0 5f 1e 3d b1 00 2e 6b b7
E: 7.270892 10 02 e0 5f 23 3d bc 00 2e eb b3
E: 7.277888 10 02 e0 5f 2c 3d ca 00 2f 6b b2
E: 7.284882 10 02 e0 5f 3a 3d dc 00 2f 6a b1
E: 7.291895 10 02 e0 5f 40 3d f3 00 2f ea af
E: 7.298898 10 02 e0 5f 4d 3e 0c 00 2f e9 ad
E: 7.305893 10 02 e0 5f 56 3e 2c 00 2f e8 af
E: 7.312891 10 02 e0 5f 66 3e 51 00 2f e7 a8
E: 7.316881 10 0c 00 10 00 00 00 00 00 00 00
E: 7.319895 10 02 e0 5f 73 3e 7c 00 2f e6 aa
E: 7.327898 10 02 e0 5f 89 3e ab 00 2f e5 a6
E: 7.334897 10 02 e0 5f 9b 3e d8 00 2f e4 a5
E: 7.336897 10 0c 00 40 00 00 00 00 00 00 00
E: 7.341891 10 02 e0 5f b2 3f 07 00 2f 62 a2
E: 7.348889 10 02 e0 5f c8 3f 33 00 2f 61 a0
E: 7.355908 10 02 e0 5f da 3f 60 00 2e df a2
E: 7.356900 10 0c 00 80 00 00 00 00 00 00 00
E: 7.362900 10 02 e0 5f f2 3f 91 00 2e 5d a2
E: 7.369899 10 02 e0 60 05 3f c5 00 2e 5b a0
E: 7.376893 10 0c 02 00 00 00 00 00 00 00 00
E: 7.377886 10 02 e0 60 1f 40 01 00 2d d9 a1
E: 7.384895 10 02 e0 60 3d 40 44 00 2d 57 a1
E: 7.391894 10 02 e0 60 5a 40 8e 00 2c d4 a3
E: 7.396899 10 0c 04 00 00 00 00 00 00 00 00
E: 7.398896 10 02 e0 60 7b 40 d6 00 2c 52 a2
E: 7.405894 10 02 e0 60 93 41 1e 00 2b cf a1
E: 7.412889 10 02 e0 60 ab 41 63 00 2b 50 9e
E: 7.416882 10 0c 10 00 00 00 00 00 00 00 00
E: 7.419889 10 02 e0 60 c1 41 a6 00 2a d0 98
E: 7.426897 10 02 e0 60 de 41 e4 00 29 d0 91
E: 7.433896 10 02 e0 60 f2 42 20 00 29 51 8e
E: 7.440891 10 02 e0 61 10 42 5a 00 28 d1 8f
E: 7.448890 10 02 e0 61 2b 42 8d 00 28 51 88
E: 7.455911 10 02 e0 61 4d 42 ba 00 27 d1 87
E: 7.456912 10 0c 00 00 00 00 00 00 00 00 00
E: 7.462897 10 02 e0 61 73 42 e5 00 27 51 82
E: 7.469892 10 02 e0 61 a2 43 08 00 26 52 82
E: 7.476886 10 02 e0 61 d0 43 29 00 27 52 7e
E: 7.483883 10 02 e0 61 fe 43 46 00 27 d2 7f
E: 7.490891 10 02 e0 62 33 43 5f 00 28 53 79
E: 7.497898 10 02 e0 62 66 43 71 00 28 d4 79
E: 7.504890 10 02 e0 62 94 43 84 00 29 54 7a
E: 7.511891 10 02 e0 62 b8 43 8d 00 29 d5 7a
E: 7.519912 10 02 e0 62 d6 43 8e 00 2a 56 7b
E: 7.526894 10 02 e0 62 ec 43 8d 00 2a d5 7a
E: 7.533897 10 02 e0 62 ff 43 87 00 2b 53 79
E: 7.540890 10 02 e0 63 12 43 7b 00 2b d2 7b
E: 7.547884 10 02 e0 63 25 43 6d 00 2c 51 7a
E: 7.554912 10 02 e0 63 37 43 56 00 2c d1 78
E: 7.561898 10 02 e0 63 4c 43 3d 00 2d 50 78
E: 7.568896 10 02 e0 63 5e 43 20 00 2d d0 7b
E: 7.575887 10 02 e0 63 70 42 fb 00 2e 50 79
E: 7.582882 10 02 e0 63 7b 42 d5 00 2f 50 7a
E: 7.590910 10 02 e0 63 8a 42 a9 00 2e d0 78
E: 7.597895 10 02 e0 63 95 42 79 00 2e 51 79
E: 7.604890 10 02 e0 63 97 42 45 00 2d d2 79
E: 7.611888 10 02 e0 63 96 42 10 00 2d 53 7d
E: 7.618912 10 02 e0 63 8b 41 dc 00 2c d4 83
E: 7.625893 10 02 e0 63 77 41 a8 00 2c d5 84
E: 7.632896 10 02 e0 63 5d 41 77 00 2c d6 8b
E: 7.639891 10 02 e0 63 3e 41 4b 00 2c d8 8e
E: 7.646890 10 02 e0 63 17 41 1e 00 2c d9 92
E: 7.654912 10 02 e0 62 ee 40 ef 00 2c db 96
E: 7.655897 10 0c 10 00 00 00 00 00 00 00 00
E: 7.661896 10 02 e0 62 bf 40 c7 00 2c da 91
E: 7.668898 10 02 e0 62 8d 40 a7 00 2d 59 92
E: 7.675891 10 02 e0 62 5b 40 84 00 2d d8 93
E: 7.682891 10 02 e0 62 27 40 68 00 2e 57 97
E: 7.689914 10 02 e0 61 f6 40 52 00 2e d6 95
E: 7.696897 10 02 e0 61 ca 40 3d 00 2f 55 96
E: 7.703891 10 02 e0 61 98 40 2b 00 2f d4 94
E: 7.710888 10 02 e0 61 61 40 20 00 30 d3 96
E: 7.718886 10 02 e0 61 2b 40 18 00 30 52 96
E: 7.725893 10 02 e0 60 f5 40 13 00 2f d1 95
E: 7.732896 10 02 e0 60 c7 40 14 00 2f 4f 98
E: 7.739890 10 02 e0 60 98 40 18 00 2e ce 9a
E: 7.746887 10 02 e0 60 71 40 21 00 2e cc 9b
E: 7.753910 10 02 e0 60 49 40 29 00 2e 4a 9c
E: 7.760896 10 02 e0 60 26 40 3c 00 2d c8 9e
E: 7.767894 10 02 e0 60 01 40 4e 00 2d 46 9e
E: 7.768894 10 0c 00 00 00 00 00 00 00 00 00
E: 7.774885 10 02 e0 5f e4 40 65 00 2d 46 a0
E: 7.782888 10 02 e0 5f c4 40 7b 00 2c c6 a2
E: 7.789908 10 02 e0 5f a5 40 96 00 2c 46 a2
E: 7.796892 10 02 e0 5f 8b 40 b4 00 2b c5 a5
E: 7.803891 10 02 e0 5f 72 40 d0 00 2b 45 a4
E: 7.808888 10 0c 00 00 00 00 00 20 00 00 00
E: 7.810890 10 02 e0 5f 5a 40 ef 00 2a c4 a8
E: 7.817894 10 02 e0 5f 47 41 0c 00 2a 43 ab
E: 7.824913 10 02 e0 5f 30 41 2a 00 29 c2 ac
E: 7.831896 10 02 e0 5f 1f 41 4b 00 2a c4 ab
E: 7.839889 10 02 e0 5f 0d 41 69 00 2b 47 a8
E: 7.846888 10 02 e0 5f 01 41 90 00 2b c9 a8
E: 7.853910 10 02 e0 5e f0 41 b3 00 2c cb ab
E: 7.860895 10 02 e0 5e e8 41 d9 00 2d 4d a7
E: 7.867894 10 02 e0 5e dc 42 01 00 2d cf a6
E: 7.874884 10 02 e0 5e d6 42 2d 00 2e 50 a6
E: 7.881881 10 02 e0 5e cc 42 56 00 2e d2 a7
E: 7.888908 10 02 e0 5e c5 42 7f 00 2f 54 a6
E: 7.895891 10 02 e0 5e bb 42 ae 00 2f d5 a0
E: 7.902894 10 02 e0 5e ae 42 d6 00 30 57 a0
E: 7.910888 10 02 e0 5e a2 42 ff 00 30 58 a1
E: 7.917883 10 02 e0 5e 91 43 28 00 30 da a0
E: 7.924909 10 02 e0 5e 7e 43 53 00 31 5b a2
E: 7.925893 10 0c 10 00 00 00 00 00 00 00 00
E: 7.927894 10 0c 10 00 00 00 00 00 00 00 00
E: 7.931895 10 02 e0 5e 6a 43 79 00 31 5d a2
E: 7.938883 10 02 e0 5e 57 43 a1 00 31 de a2
E: 7.945887 10 02 e0 5e 47 43 d1 00 32 5c a3
E: 7.946881 10 0c 00 00 00 00 00 00 00 00 00
E: 7.952883 10 02 e0 5e 32 43 fd 00 32 5a a3
E: 7.959885 10 02 e0 5e 20 44 23 00 32 d8 a3
E: 7.966896 10 02 e0 5e 0b 44 4a 00 33 55 a2
E: 7.974883 10 02 e0 5d f9 44 70 00 33 53 a5
E: 7.981887 10 02 e0 5d e8 44 92 00 33 d1 a4
E: 7.988891 10 02 e0 5d d2 44 b1 00 34 4e aa
E: 7.995895 10 02 e0 5d bc 44 d6 00 34 4c a9
E: 8.002893 10 02 e0 5d a4 44 f9 00 34 ca ad
E: 8.009888 10 02 e0 5d 8c 45 18 00 35 48 af
E: 8.016880 10 02 e0 5d 72 45 38 00 35 c6 b2
E: 8.023909 10 02 e0 5d 53 45 55 00 36 48 b2
E: 8.030895 10 02 e0 5d 38 45 74 00 36 c9 b3
E: 8.037889 10 02 e0 5d 18 45 8e 00 37 4a b1
E: 8.045886 10 02 e0 5c fa 45 ac 00 36 4c b1
E: 8.052909 10 02 e0 5c d7 45 c7 00 34 ce b0
E: 8.059888 10 02 e0 5c bc 45 e1 00 33 d0 b2
E: 8.066893 10 02 e0 5c a4 45 fa 00 32 d2 b3
E: 8.073888 10 02 e0 5c 8c 46 11 00 31 d3 b3
E: 8.080880 10 02 e0 5c 7d 46 2f 00 30 55 b2
E: 8.087910 10 02 e0 5c 66 46 46 00 2f 57 b0
E: 8.094894 10 02 e0 5c 58 46 60 00 2e 59 b1
E: 8.101893 10 02 e0 5c 48 46 78 00 2d 5b b3
E: 8.109888 10 02 e0 5c 3f 46 8c 00 2c 5d b3
E: 8.116879 10 02 e0 5c 36 46 a2 00 2a df b1
E: 8.123909 10 02 e0 5c 2a 46 b3 00 29 e1 b2
E: 8.130894 10 02 e0 5c 25 46 c7 00 28 e3 b0
E: 8.137889 10 02 e0 5c 1c 46 df 00 27 e1 b2
E: 8.144887 10 02 e0 5c 1a 46 f7 00 26 e0 ae
E: 8.151909 10 02 e0 5c 14 47 0d 00 25 df ac
E: 8.158892 10 02 e0 5c 0d 47 25 00 26 5e ac
E: 8.165895 10 02 e0 5c 07 47 3f 00 26 dc af
E: 8.173883 10 02 e0 5c 05 47 55 00 27 5b ae
E: 8.177880 10 0c 00 00 00 00 00 20 00 00 00
E: 8.180887 10 02 e0 5c 0a 47 71 00 27 d9 a9
E: 8.187891 10 02 e0 5c 07 47 89 00 28 58 ab
E: 8.194894 10 02 e0 5c 13 47 a3 00 28 57 a4
E: 8.201894 10 02 e0 5c 17 47 bb 00 28 d5 a6
E: 8.208884 10 02 e0 5c 26 47 cd 00 28 d4 a0
E: 8.215879 10 02 e0 5c 2c 47 de 00 29 53 a0
E: 8.222892 10 02 e0 5c 2e 47 ea 00 29 52 a1
E: 8.229894 10 02 e0 5c 31 47 fa 00 29 51 a1
E: 8.236890 10 02 e0 5c 30 48 07 00 29 50 a2
E: 8.244887 10 02 e0 5c 2e 48 0e 00 29 4f a2
E: 8.251878 10 02 e0 5c 2e 48 16 00 29 4e a0
E: 8.258892 10 02 e0 5c 2c 48 1f 00 29 4d a0
E: 8.265895 10 02 e0 5c 2d 48 20 00 29 4c a2
E: 8.272883 10 02 e0 5c 2f 48 22 00 29 4c a0
E: 8.279886 10 02 e0 5c 32 48 27 00 29 4b a3
E: 8.286908 10 02 e0 5c 32 48 28 00 29 4b a1
E: 8.293891 10 02 e0 5c 35 48 29 00 29 4a a0
E: 8.300894 10 02 e0 5c 30 48 28 00 29 4a a2
E: 8.307883 10 02 e0 5c 32 48 2a 00 29 49 a5
E: 8.315886 10 02 e0 5c 32 48 24 00 28 c9 a7
E: 8.322885 10 02 e0 5c 2e 48 1f 00 28 c9 a6
E: 8.329889 10 02 e0 5c 2c 48 1a 00 28 c9 a4
E: 8.336887 10 02 e0 5c 27 48 18 00 28 c9 a5
E: 8.343886 10 02 e0 5c 1f 48 15 00 29 49 ab
E: 8.346878 10 0c 00 00 00 00 00 00 00 00 00
E: 8.350890 10 02 e0 5c 1a 48 15 00 29 49 ab
E: 8.357905 10 02 e0 5c 0f 48 18 00 29 49 ab
E: 8.364893 10 02 e0 5c 09 48 1d 00 29 49 aa
E: 8.371887 10 02 e0 5b fc 48 24 00 29 49 a9
E: 8.379886 10 02 e0 5b f3 48 32 00 29 48 ad
E: 8.386908 10 02 e0 5b e2 48 42 00 29 48 af
E: 8.393888 10 02 e0 5b d3 48 51 00 29 c8 af
E: 8.400893 10 02 e0 5b ca 48 66 00 29 c8 ad
E: 8.407887 10 02 e0 5b bc 48 7c 00 29 c7 af
E: 8.414879 10 02 e0 5b b3 48 92 00 2a 47 ad
E: 8.421907 10 02 e0 5b a8 48 a4 00 2a 46 ae
E: 8.428887 10 02 e0 5b a1 48 bb 00 2a c5 ae
E: 8.435892 10 02 e0 5b 97 48 cf 00 2a c5 ae
E: 8.442886 10 02 e0 5b 93 48 e1 00 2b 44 af
E: 8.448877 10 0c 00 00 00 00 00 40 00 00 00
E: 8.450880 10 02 e0 5b 8d 48 f2 00 2b 43 ad
E: 8.457905 10 02 e0 5b 8a 49 04 00 2b c2 ac
E: 8.464894 10 02 e0 5b 87 49 16 00 2b c1 ae
E: 8.471882 10 02 e0 5b 82 49 22 00 2c 40 af
E: 8.478886 10 02 e0 5b 80 49 31 00 2c 40 ac
E: 8.485877 10 02 e0 5b 7c 49 3b 00 2c c0 ac
E: 8.492892 10 02 e0 5b 7c 49 40 00 2c bf ac
E: 8.499894 10 02 e0 5b 7e 49 42 00 2c be ac
E: 8.506887 10 02 e0 5b 7d 49 41 00 2c bd ae
E: 8.514878 10 02 e0 5b 7d 49 41 00 2d 3c ac
E: 8.521907 10 02 e0 5b 7c 49 3b 00 2d 3c ac
E: 8.528888 10 02 e0 5b 80 49 34 00 2d 3c ae
E: 8.533891 10 0c 00 00 00 00 00 c0 00 00 00
E: 8.535888 10 02 e0 5b 84 49 2a 00 2d 3b ae
E: 8.542884 10 02 e0 5b 8b 49 19 00 2d 3b aa
E: 8.549876 10 02 e0 5b 95 49 04 00 2d 3b a8
E: 8.556905 10 02 e0 5b a4 48 e6 00 2d 3b a8
E: 8.563888 10 02 e0 5b bf 48 c0 00 2d 3b a8
E: 8.570887 10 02 e0 5b e0 48 8b 00 2d 3c a7
E: 8.577888 10 02 e0 5c 13 48 48 00 2c bc a5
E: 8.585878 10 02 e0 5c 41 47 f7 00 2c 3e a1
E: 8.592891 10 02 e0 5c 73 47 9f 00 2b bf a2
E: 8.599893 10 02 e0 5c 9c 47 3a 00 2b 40 a2
E: 8.606886 10 02 e0 5c b3 46 b9 00 2a c3 a5
E: 8.613883 10 02 e0 5c bd 46 30 00 2a 46 a7
E: 8.620906 10 02 e0 5c ba 45 a7 00 29 49 a8
E: 8.627886 10 02 e0 5c a9 45 19 00 28 ca ad
E: 8.634890 10 02 e0 5c 82 44 8b 00 28 4b aa
E: 8.641886 10 02 e0 5c 4d 44 03 00 27 cc a5
E: 8.649876 10 02 e0 5c 06 43 86 00 27 ce a7
E: 8.656906 10 02 e0 5b bc 43 16 00 27 50 a6
E: 8.663892 10 02 e0 5b 65 42 a6 00 27 d2 a6
E: 8.670886 10 02 e0 5a f3 42 43 00 27 d5 a4
E: 8.671878 10 0c 00 00 00 00 00 40 00 00 00
E: 8.677884 10 02 e0 5a 63 41 f0 00 28 58 a4
E: 8.684885 10 02 e0 59 b6 41 b0 00 29 5a a4
E: 8.691889 10 02 e0 58 f3 41 7c 00 28 dd aa
E: 8.698891 10 02 e0 58 2f 41 61 00 28 df aa
E: 8.699887 10 0c 00 00 00 00 00 00 00 00 00
E: 8.705885 10 02 e0 57 76 41 5d 00 29 61 aa
E: 8.712883 10 02 e0 56 ba 41 7e 00 29 e2 a6
E: 8.720888 10 02 e0 55 e7 41 b7 00 2b 63 a2
E: 8.727886 10 02 e0 55 1b 42 0f 00 2c 63 9c
E: 8.734891 10 02 e0 54 43 42 7e 00 2c e2 97
E: 8.741885 10 02 e0 53 94 42 ff 00 2d 64 8c
E: 8.748884 10 02 e0 52 fe 43 9f 00 2d e5 89
E: 8.755906 10 02 e0 52 74 44 74 00 2e 64 8b
E: 8.762891 10 02 e0 52 0a 45 7a 00 2f 63 8e
E: 8.769886 10 02 e0 51 cb 46 65 00 2f e3 78
E: 8.776884 10 02 e0 51 b2 47 56 00 30 62 74
E: 8.784883 10 02 e0 51 c0 48 54 00 30 60 74
E: 8.791887 10 02 e0 51 f0 49 67 00 30 5e 7b
E: 8.798891 10 02 e0 52 45 4a 3a 00 30 5d 79
E: 8.805880 10 02 e0 52 b8 4b 04 00 31 5b 78
E: 8.812884 10 02 e0 53 46 4b be 00 31 d8 83
E: 8.819898 10 02 e0 53 ee 4c 6a 00 31 55 88
E: 8.826887 10 02 e0 54 c7 4c f9 00 30 d1 95
E: 8.831891 10 0c 00 00 00 00 00 80 00 00 00
E: 8.833888 10 02 e0 55 ac 4d 65 00 2f ce a0
E: 8.840884 10 02 e0 56 8e 4d 88 00 2f 4d a6
E: 8.847877 10 02 e0 57 6f 4d cb 00 2f cd a6
E: 8.855888 10 02 e0 58 5c 4d d9 00 2f 4d a7
E: 8.862889 10 02 e0 59 6a 4d d4 00 2e ce aa
E: 8.869885 10 02 e0 5a 58 4d c0 00 2e cf ad
E: 8.876876 10 02 e0 5b 3e 4d 9c 00 2e 50 ad
E: 8.883880 10 02 e0 5c 16 4d 68 00 2d d0 b3
E: 8.890893 10 02 e0 5d 08 4d 1c 00 2c 4e b3
E: 8.897892 10 02 e0 5d ed 4c c5 00 2c cd ae
E: 8.904878 10 02 e0 5e c2 4c 5e 00 2c 4c a8
E: 8.911886 10 02 e0 5f 7d 4b f0 00 2c 4a a7
E: 8.913876 10 0c 00 00 00 00 00 c0 00 00 00
E: 8.919888 10 02 e0 60 1b 4b 7e 00 2b ca a6
E: 8.926887 10 02 e0 60 bf 4b 01 00 2b 4a a6
E: 8.933892 10 02 e0 61 6f 4a 79 00 2a 4c a4
E: 8.940884 10 02 e0 61 fd 49 ea 00 2b 4e aa
E: 8.947882 10 02 e0 62 77 49 5d 00 2c 51 ae
E: 8.954887 10 02 e0 62 e4 48 c3 00 2c 4f a8
E: 8.961889 10 02 e0 63 48 48 38 00 2c 4e a7
E: 8.968890 10 02 e0 63 a6 47 bd 00 2c 4c a7
E: 8.975884 10 02 e0 63 f2 47 46 00 2c 4c a2
E: 8.983875 10 02 e0 64 40 46 c0 00 2b cb a1
E: 8.990903 10 02 e0 64 a0 46 20 00 2a cc a6
E: 8.997891 10 02 e0 65 1c 45 7e 00 2a 4c a9
E: 9.004885 10 02 e0 65 be 44 cf 00 29 ce b1
E: 9.011882 10 02 e0 66 62 44 2f 00 29 cf ad
E: 9.018906 10 02 e0 67 2b 43 a4 00 29 51 ae
E: 9.019905 10 0c 00 00 00 00 00 80 00 00 00
E: 9.025887 10 02 e0 67 fa 43 2c 00 28 d3 b2
E: 9.032890 10 02 e0 68 ef 42 b3 00 28 55 b7
E: 9.039884 10 02 e0 6a 1a 42 3f 00 27 d7 cb
E: 9.046881 10 02 e0 6b 59 41 de 00 28 d9 cf
E: 9.054889 10 02 e0 6c ab 41 82 00 27 5a da
E: 9.061889 10 02 e0 6e 62 41 39 00 25 db e9
E: 9.063886 10 0c 00 00 00 00 00 00 00 00 00
E: 9.068889 10 02 e0 70 17 41 08 00 25 5f ec
E: 9.075884 10 02 e0 72 07 40 d8 00 23 e3 f1
E: 9.083880 10 02 80 00 00 00 00 00 00 00 00
E: 9.475885 10 0c 00 00 00 00 00 00 00 20 00
E: 9.529887 10 0c 00 00 00 00 00 00 00 00 00
E: 9.559885 10 0c 00 00 00 00 00 00 00 20 00
E: 9.631890 10 0c 00 00 00 00 00 00 00 30 00
E: 9.676879 10 0c 00 00 00 00 00 00 00 10 00
E: 9.888882 10 0c 00 00 00 00 00 00 00 00 00
E: 10.132881 10 0c 00 00 00 00 00 00 00 20 00
E: 10.244880 10 0c 00 00 00 00 00 00 00 00 00
E: 10.397880 10 0c 00 00 00 00 00 00 00 40 00
E: 10.534880 10 0c 00 00 00 00 00 00 00 00 00
E: 10.698879 10 0c 00 00 00 00 00 00 00 80 00
E: 10.820892 10 0c 00 00 00 00 00 00 00 00 00
E: 11.127877 10 0c 00 00 00 00 00 00 01 00 00
E: 11.331876 10 0c 00 00 00 00 00 00 00 00 00
E: 11.520889 10 0c 00 00 00 00 00 00 00 08 00
E: 11.721875 10 0c 00 00 00 00 00 00 00 00 00
E: 11.908872 10 0c 00 00 00 00 00 00 00 04 00
E: 12.043872 10 0c 00 00 00 00 00 00 00 00 00
E: 12.181869 10 0c 00 00 00 00 00 00 00 02 00
E: 12.267873 10 0c 00 00 00 00 00 00 00 00 00
E: 12.378870 10 0c 00 00 00 00 00 00 00 01 00
E: 12.487868 10 0c 00 00 00 00 00 00 00 00 00
E: 13.371880 10 0c 00 00 00 01 00 00 00 00 00
E: 13.436943 10 0c 00 00 00 02 00 00 00 00 00
E: 13.476865 10 0c 00 00 00 04 00 00 00 00 00
E: 13.496872 10 0c 00 00 00 08 00 00 00 00 00
E: 13.511865 10 0c 00 00 00 10 00 00 00 00 00
E: 13.708865 10 0c 00 00 00 20 00 00 00 00 00
E: 13.752878 10 0c 00 00 00 40 00 00 00 00 00
E: 13.772864 10 0c 00 00 00 80 00 00 00 00 00
E: 13.787877 10 0c 00 00 01 00 00 00 00 00 00
E: 14.061863 10 0c 00 00 00 80 00 00 00 00 00
E: 14.086876 10 0c 00 00 00 40 00 00 00 00 00
E: 14.105862 10 0c 00 00 00 10 00 00 00 00 00
E: 14.126855 10 0c 00 00 00 08 00 00 00 00 00
E: 14.145860 10 0c 00 00 00 40 00 00 00 00 00
E: 14.165867 10 0c 00 00 00 01 00 00 00 00 00
E: 14.362862 10 0c 00 00 00 02 00 00 00 00 00
E: 14.382860 10 0c 00 00 00 04 00 00 00 00 00
E: 14.402860 10 0c 00 00 00 08 00 00 00 00 00
E: 14.422860 10 0c 00 00 00 10 00 00 00 00 00
E: 14.442859 10 0c 00 00 00 20 00 00 00 00 00
E: 14.462866 10 0c 00 00 10 00 00 00 00 00 00
E: 14.482854 10 0c 00 00 01 00 00 00 00 00 00
E: 14.537858 10 0c 00 00 02 00 00 00 00 00 00
E: 14.601860 10 0c 00 00 00 00 00 00 00 00 00
E: 17.109920 10 02 c2 80 42 48 0d e2 11 00 00
E: 17.120916 10 02 ea 60 32 30 43 18 00 00 bd
E: 17.128853 10 02 e0 60 37 30 5d 00 29 56 c2
E: 17.139917 10 02 ea 60 46 30 84 16 80 00 c1
E: 17.146916 10 02 e0 60 57 30 91 00 29 54 c8
E: 17.158917 10 02 ea 60 5f 30 da 15 c0 00 ca
E: 17.165919 10 02 e0 60 65 31 1c 00 29 55 c7
E: 17.177917 10 02 ea 60 5f 31 ad 14 c0 00 c7
E: 17.184917 10 02 e0 60 53 32 04 00 29 56 c3
E: 17.196916 10 02 ea 60 41 32 90 13 80 00 c0
E: 17.203874 10 02 e0 60 28 32 d2 00 29 56 bf
E: 17.214916 10 02 ea 60 03 33 3c 12 00 00 bc
E: 17.221916 10 02 e0 5f f0 33 7f 00 29 55 b8
E: 17.233917 10 02 ea 5f c3 33 ea 10 40 00 bb
E: 17.240873 10 02 e0 5f a5 34 2a 00 29 d3 b0
E: 17.252915 10 02 ea 5f 6e 34 89 0e 80 00 b1
E: 17.259916 10 02 e0 5f 4c 34 c8 00 29 d1 b3
E: 17.271916 10 02 ea 5e fb 35 13 0c 40 00 b2
E: 17.278917 10 02 e0 5e c4 35 35 00 2a 52 aa
E: 17.289916 10 02 ea 5e 71 35 6d 0b 40 00 a8
E: 17.297916 10 02 e0 5e 42 35 8d 00 2b 54 a4
E: 17.308915 10 02 ea 5e 15 35 bd 09 00 00 a5
E: 17.315916 10 02 e0 5e 05 35 d7 00 2c 54 a1
E: 17.327915 10 02 ea 5d e7 35 fb 06 80 00 a2
E: 17.334915 10 02 e0 5d cc 36 06 00 2d d1 9e
E: 17.346914 10 02 ea 5d 96 36 06 03 c0 00 9c
E: 17.353876 10 02 e0 5d 60 35 f4 00 2f 50 a4
E: 17.365916 10 02 ea 5d 19 35 e1 00 40 00 a5
E: 17.372916 10 02 e0 5c f4 35 de 00 2f cf b2
E: 17.383915 10 02 ea 5c bd 35 ee 04 e0 00 b3
E: 17.391915 10 02 e0 5c aa 35 ff 00 2f d0 bb
E: 17.402917 10 02 ea 5c ae 36 31 0b a0 00 b9
E: 17.409917 10 02 e0 5c cc 36 4b 00 2f 50 b5
E: 17.421914 10 02 ea 5d 1a 36 65 14 a0 00 b7
E: 17.428915 10 02 e0 5d 57 36 74 00 2e ce a8
E: 17.440872 10 02 ea 5d bd 36 ab 20 60 00 a8
E: 17.447915 10 02 e0 5d dc 36 b7 00 2f 4b 9f
E: 17.459915 10 02 ea 5e 07 36 c6 2e 60 00 9f
E: 17.466915 10 02 e0 5e 1e 36 c5 00 2f 48 93
E: 17.477914 10 02 ea 5e 39 36 b2 3e e0 00 90
E: 17.485881 10 02 e0 5e 36 36 9b 00 2e c6 8e
E: 17.496914 10 02 ea 5e 31 36 6b 51 e0 00 8c
E: 17.503883 10 02 e0 5e 35 36 54 00 2e 44 86
E: 17.515915 10 02 ea 5e 43 36 4e 66 e0 00 87
E: 17.522916 10 02 e0 5e 47 36 45 00 2e c3 82
E: 17.534914 10 02 ea 5e 56 36 28 7d 20 00 81
E: 17.541915 10 02 e0 5e 63 36 12 00 2f c1 82
E: 17.553882 10 02 ea 5e 78 35 e7 93 20 00 82
E: 17.560914 10 02 e0 5e 88 35 d1 00 30 c1 87
E: 17.571915 10 02 ea 5e 95 35 b8 a8 60 00 84
E: 17.579915 10 02 e0 5e 93 35 b2 00 31 c2 92
E: 17.590872 10 02 ea 5e 92 35 af bc 20 00 93
E: 17.597914 10 02 e0 5e 96 35 ae 00 31 c4 94
E: 17.609915 10 02 ea 5e 95 35 ab cf 20 00 95
E: 17.616915 10 02 e0 5e 91 35 ad 00 32 45 95
E: 17.628913 10 02 ea 5e 9b 35 9f df e0 00 95
E: 17.635913 10 02 e0 5e 9c 35 8f 00 32 47 95
E: 17.647914 10 02 ea 5e b1 35 68 d3 c0 00 97
E: 17.654915 10 02 e0 5e bd 35 48 00 32 c8 97
E: 17.666913 10 02 ea 5e d3 35 20 c7 c0 00 94
E: 17.673914 10 02 e0 5e dd 35 11 00 32 c9 92
E: 17.684914 10 02 ea 5e d3 35 06 bd c0 00 90
E: 17.692915 10 02 e0 5e c3 35 08 00 32 cb 86
E: 17.703909 10 02 ea 5e 9a 35 01 b6 00 00 86
E: 17.710913 10 02 e1 5e 87 35 19 4c b2 cb 80
E: 17.722913 10 02 ea 5e 89 35 20 dc 20 00 81
E: 17.729912 10 02 e1 5e 8c 35 21 38 b2 cc 7c
E: 17.741914 10 02 ea 5e 91 35 11 db a0 00 7c
E: 17.748913 10 02 e0 5e 97 35 09 00 32 4c 85
E: 17.760913 10 02 ea 5e 9c 34 f8 da 20 00 84
E: 17.767913 10 02 e0 5e a1 34 f3 00 31 cd 8a
E: 17.778914 10 02 ea 5e a5 34 f9 d7 60 00 88
E: 17.786913 10 02 e0 5e 97 34 fd 00 31 4f 88
E: 17.797913 10 02 ea 5e 7d 34 ff d3 60 00 89
E: 17.804914 10 02 e0 5e 64 35 07 00 31 50 8b
E: 17.816915 10 02 ea 5e 17 34 f7 cd 60 00 8b
E: 17.823914 10 02 e0 5d ce 34 fa 00 30 d2 93
E: 17.835914 10 02 ea 5d 4d 35 2f c6 60 00 92
E: 17.842914 10 02 e0 5d 1d 35 64 00 30 54 9a
E: 17.854912 10 02 ea 5c e3 35 c0 bd e0 00 99
E: 17.861913 10 02 e0 5c c7 35 f2 00 2f 56 9d
E: 17.872913 10 02 ea 5c a9 36 40 b2 a0 00 9c
E: 17.880913 10 02 e0 5c b6 36 59 00 2e d8 a7
E: 17.891914 10 02 ea 5c e9 36 74 a5 20 00 a7
E: 17.898913 10 02 e0 5d 10 36 72 00 2d 59 a8
E: 17.910913 10 02 ea 5d 32 36 7e 95 20 00 a9
E: 17.917913 10 02 e0 5d 3d 36 94 00 2b d9 a8
E: 17.929913 10 02 ea 5d 46 36 d4 82 a0 00 a9
E: 17.936913 10 02 e0 5d 3c 37 08 00 2a 58 a7
E: 17.947913 10 02 ea 5d 25 37 59 6d e0 00 a5
E: 17.955913 10 02 e0 5d 1d 37 85 00 29 57 a9
E: 17.966913 10 02 ea 5d 32 37 a3 57 60 00 a9
E: 17.973913 10 02 e0 5d 46 37 9e 00 27 54 b2
E: 17.985912 10 02 ea 5d 5b 37 99 3f a0 00 b2
E: 17.992911 10 02 e0 5d 6f 37 a2 00 27 51 b8
E: 18.004912 10 02 ea 5d 87 37 b9 25 e0 00 b8
E: 18.011912 10 02 e0 5d 90 37 ce 00 28 4e b8
E: 18.023912 10 02 ea 5d 88 37 f8 0c 60 00 b8
E: 18.030911 10 02 e0 5d 7c 38 0f 00 29 cb b9
E: 18.041911 10 02 ea 5d 4c 38 37 0d 40 00 ba
E: 18.049912 10 02 e0 5d 27 38 4b 00 2b 47 b9
E: 18.060913 10 02 ea 5c ff 38 38 25 40 00 b8
E: 18.067912 10 02 e0 5c f5 38 0b 00 2b c4 bd
E: 18.079911 10 02 ea 5d 18 37 a3 3c 40 00 bd
E: 18.086913 10 02 e0 5d 2e 37 61 00 2b c3 bc
E: 18.098911 10 02 ea 5d 68 37 04 51 40 00 be
E: 18.105912 10 02 e0 5d 76 36 cd 00 2c c2 c2
E: 18.117911 10 02 ea 5d 99 36 7e 63 c0 00 c3
E: 18.124911 10 02 e0 5d af 36 4d 00 2f 43 c5
E: 18.135913 10 02 ea 5d d1 36 02 74 40 00 c4
E: 18.143912 10 02 e0 5d db 35 cb 00 30 46 c5
E: 18.154911 10 02 ea 5d e5 35 78 81 80 00 c4
E: 18.161911 10 02 e0 5d e8 35 4b 00 30 c9 c5
E: 18.173911 10 02 ea 5d e8 35 40 8b 00 00 c4
E: 18.180912 10 02 e0 5d cb 35 5f 00 30 cc bf
E: 18.192912 10 02 ea 5d 78 35 cc 91 00 00 bc
E: 18.199910 10 02 e0 5d 2e 36 1b 00 2f ce bd
E: 18.211910 10 02 ea 5c b3 36 99 92 40 00 bf
E: 18.218910 10 02 e0 5c 69 36 d6 00 30 4f c2
E: 18.229912 10 02 ea 5c 14 37 2f 8f 40 00 c3
E: 18.236912 10 02 e0 5b de 37 55 00 31 4e c9
E: 18.248913 10 02 ea 5b 97 37 8c 87 c0 00 c9
E: 18.255913 10 02 e0 5b 73 37 a4 00 31 4c d3
E: 18.267912 10 02 ea 5b 45 37 da 7c c0 00 d2
E: 18.274914 10 02 e0 5b 2f 38 00 00 30 c8 db
E: 18.286913 10 02 ea 5b 1e 38 37 6e 00 00 db
E: 18.293910 10 02 e0 5b 24 38 5c 00 30 43 da
E: 18.304911 10 02 ea 5b 1e 38 89 5b 40 00 da
E: 18.312910 10 02 e0 5b 2f 38 8a 00 2f be d8
E: 18.323911 10 02 ea 5b 50 38 80 45 40 00 d9
E: 18.330912 10 02 e0 5b 6a 38 71 00 2f 38 cf
E: 18.342911 10 02 ea 5b a7 38 46 2d 40 00 cc
E: 18.349910 10 02 e0 5b c4 38 20 00 2f 35 c4
E: 18.361910 10 02 ea 5c 08 37 d1 14 c0 00 c6
E: 18.368911 10 02 e0 5c 40 37 9d 00 2f b4 b9
E: 18.380909 10 02 ea 5c c2 37 52 03 60 00 b9
E: 18.387911 10 02 e0 5d 02 37 20 00 2f 35 b9
E: 18.398911 10 02 ea 5d 6c 36 c8 19 e0 00 ba
E: 18.405910 10 02 e0 5d 92 36 93 00 2f 38 b5
E: 18.417910 10 02 ea 5d d0 36 61 2d e0 00 b4
E: 18.424910 10 02 e0 5d f7 36 42 00 2f bb b0
E: 18.436911 10 02 ea 5e 33 36 10 3e 60 00 b2
E: 18.443910 10 02 e0 5e 48 35 f2 00 2f c0 a4
E: 18.455910 10 02 ea 5e 5d 35 bc 4a e0 00 a5
E: 18.462910 10 02 e0 5e 62 35 8c 00 2f 45 a3
E: 18.474909 10 02 ea 5e 59 35 24 52 60 00 a2
E: 18.481910 10 02 e0 5e 54 34 ce 00 2f 49 ac
E: 18.492910 10 02 ea 5e 4d 34 2c 55 a0 00 af
E: 18.499910 10 02 e0 5e 4c 33 c6 00 2f cb b1
E: 18.511909 10 02 ea 5e 58 33 21 56 20 00 b2
E: 18.518909 10 02 e0 5e 63 32 d7 00 30 ce b9
E: 18.530911 10 02 ea 5e 6b 32 75 54 60 00 ba
E: 18.537910 10 02 e0 5e 63 32 3b 00 31 d2 bc
E: 18.549909 10 02 ea 5e 53 31 dc 50 a0 00 bf
E: 18.556910 10 02 e0 5e 38 31 93 00 32 55 bf
E: 18.567909 10 02 ea 5d fd 31 20 4c 20 00 bd
E: 18.575909 10 02 e0 5d d2 30 ce 00 32 58 c0
E: 18.586910 10 02 ea 5d 85 30 32 47 20 00 c2
E: 18.593911 10 02 e0 5d 50 2f db 00 32 d7 c2
E: 18.605909 10 02 ea 5d 01 2f 62 41 60 00 c2
E: 18.612910 10 02 e0 5c ca 2f 29 00 32 d7 bd
E: 18.624909 10 02 ea 5c 7d 2e f2 3a a0 00 bd
E: 18.631909 10 02 e0 5c 53 2e d9 00 31 d8 ba
E: 18.642909 10 02 ea 5c 19 2e b7 33 e0 00 bb
E: 18.650911 10 02 e0 5b f3 2e a6 00 30 da b8
E: 18.661909 10 02 ea 5b af 2e 9b 2c 60 00 ba
E: 18.668910 10 02 e0 5b 88 2e 8b 00 30 5b b9
E: 18.680910 10 02 ea 5b 51 2e 83 24 e0 00 b9
E: 18.687910 10 02 e0 5b 2f 2e 7a 00 30 5a bb
E: 18.699914 10 02 ea 5b 02 2e 6b 1d 20 00 bb
E: 18.706911 10 02 e0 5a ec 2e 63 00 2f d9 be
E: 18.718910 10 02 ea 5a bd 2e 6d 15 20 00 bd
E: 18.725909 10 02 e0 5a ab 2e 7b 00 2f 58 bb
E: 18.736909 10 02 ea 5a 84 2e 9b 0d a0 00 ba
E: 18.743909 10 02 e0 5a 7d 2e b0 00 2e d9 ba
E: 18.755908 10 02 ea 5a 5f 2e cf 06 a0 00 b9
E: 18.762908 10 02 e0 5a 58 2e eb 00 2f 5a bb
E: 18.774908 10 02 ea 5a 3c 2f 11 01 20 00 b8
E: 18.781908 10 02 e0 5a 2d 2f 26 00 30 da be
E: 18.793908 10 02 ea 5a 1f 2f 41 03 40 00 bc
E: 18.800909 10 02 e0 5a 17 2f 4e 00 32 59 c1
E: 18.811909 10 02 ea 5a 04 2f 61 06 40 00 c0
E: 18.819909 10 02 e0 59 f5 2f 68 00 33 58 c0
E: 18.830909 10 02 ea 59 e3 2f 7f 08 00 00 c0
E: 18.837908 10 02 e0 59 d3 2f 81 00 34 57 c1
E: 18.849909 10 02 ea 59 c2 2f 8a 08 80 00 c1
E: 18.856908 10 02 e0 59 b1 2f 8d 00 34 d6 c1
E: 18.868907 10 02 ea 59 9b 2f 98 07 c0 00 c3
E: 18.875909 10 02 e0 59 8c 2f 9c 00 35 54 bf
E: 18.886901 10 02 ea 59 80 2f a2 06 00 00 bf
E: 18.894908 10 02 e0 59 84 2f a1 00 35 d3 bc
E: 18.905909 10 02 ea 59 86 2f 98 03 80 00 bd
E: 18.912907 10 02 e0 59 8e 2f 8f 00 36 52 b9
E: 18.924907 10 02 ea 59 95 2f 7c 00 c0 00 b8
E: 18.931907 10 02 e0 59 9d 2f 68 00 36 d1 b5
E: 18.943907 10 02 ea 59 ab 2f 47 02 a0 00 b5
E: 18.950907 10 02 e2 59 b0 2f 39 00 36 d1 b1
E: 18.962908 10 02 ea 59 be 2f 26 05 a0 00 b0
E: 18.969907 10 02 e2 59 c5 2f 18 00 36 d2 af
E: 18.980906 10 02 ea 59 de 2f 0f 08 60 00 ad
E: 18.987907 10 02 e2 59 f0 2f 09 00 36 52 a8
E: 18.999907 10 02 ea 5a 14 2e f7 0b 20 00 aa
E: 19.006908 10 02 e2 5a 28 2e ea 00 35 d3 a6
E: 19.018908 10 02 ea 5a 43 2e d6 0d a0 00 a7
E: 19.025908 10 02 e2 5a 49 2e d2 00 34 d4 a3
E: 19.037907 10 02 ea 5a 4d 2e d2 0f 20 00 a1
E: 19.044907 10 02 e2 5a 50 2e db 00 34 55 a3
E: 19.055907 10 02 ea 5a 48 2e f0 10 20 00 a3
E: 19.063907 10 02 e2 5a 40 2f 06 00 33 d6 a1
E: 19.074908 10 02 ea 5a 1c 2f 34 10 60 00 a0
E: 19.081908 10 02 e2 5a 04 2f 57 00 33 56 a1
E: 19.093906 10 02 ea 59 cc 2f 9f 0f e0 00 a1
E: 19.100908 10 02 e2 59 aa 2f c9 00 33 56 a4
E: 19.112907 10 02 ea 59 75 30 1a 0f 20 00 a7
E: 19.119909 10 02 e2 59 4f 30 47 00 32 d5 ab
E: 19.130906 10 02 ea 59 15 30 a5 0e 20 00 a8
E: 19.138907 10 02 e2 58 eb 30 e3 00 32 53 ae
E: 19.149906 10 02 ea 58 a5 31 55 0c e0 00 ad
E: 19.156906 10 02 e2 58 6f 31 a3 00 31 54 a7
E: 19.168907 10 02 ea 58 14 32 34 0b 60 00 a4
E: 19.175908 10 02 e2 57 e6 32 90 00 30 d5 9d
E: 19.187907 10 02 ea 57 a4 33 20 0a 20 00 9d
E: 19.194906 10 02 e2 57 91 33 71 00 30 54 9f
E: 19.206906 10 02 ea 57 80 33 f8 08 a0 00 9d
E: 19.213906 10 02 e2 57 89 34 4a 00 2f d3 a0
E: 19.224904 10 02 ea 57 93 34 c7 07 20 00 a1
E: 19.231906 10 02 e2 57 aa 35 13 00 2f 52 a9
E: 19.243907 10 02 ea 57 e6 35 7f 06 60 00 a8
E: 19.250906 10 02 e2 58 17 35 bb 00 2e d3 9b
E: 19.262906 10 02 ea 58 6f 36 0c 05 a0 00 9a
E: 19.269905 10 02 e2 58 b5 36 2d 00 2d d5 91
E: 19.281905 10 02 ea 59 28 36 50 04 e0 00 93
E: 19.288905 10 02 e2 59 6f 36 59 00 2d 57 92
E: 19.300905 10 02 ea 59 db 36 53 04 60 00 90
E: 19.307905 10 02 e2 5a 23 36 44 00 2d d6 91
E: 19.318906 10 02 ea 5a 88 36 20 03 e0 00 93
E: 19.325905 10 02 e2 5a bb 36 0e 00 2e 56 8e
E: 19.337905 10 02 ea 5a f5 35 e4 03 20 00 8c
E: 19.344906 10 02 e2 5b 15 35 c8 00 2e 57 92
E: 19.356905 10 02 ea 5b 34 35 97 02 a0 00 91
E: 19.363906 10 02 e2 5b 3f 35 75 00 2e d9 94
E: 19.375906 10 02 ea 5b 40 35 39 02 60 00 94
E: 19.382904 10 02 e0 5b 36 35 16 00 2e db 9e
E: 19.393905 10 02 ea 5b 20 34 d1 01 60 00 9c
E: 19.401906 10 02 e0 5b 09 34 a7 00 2f 5a a5
E: 19.412906 10 02 ea 5a db 34 78 00 60 00 a5
E: 19.419905 10 02 e0 5a ad 34 6c 00 2f d9 a7
E: 19.431905 10 02 ea 5a 58 34 6f 01 00 00 a5
E: 19.438904 10 02 e0 5a 20 34 74 00 30 d7 a9
E: 19.450872 10 02 ea 59 d0 34 71 02 00 00 a8
E: 19.457904 10 02 e0 59 a4 34 69 00 31 56 b0
E: 19.468904 10 02 ea 59 65 34 6f 03 40 00 b0
E: 19.476906 10 02 e0 59 48 34 7e 00 31 d4 bb
E: 19.487905 10 02 ea 59 2d 34 96 04 80 00 b8
E: 19.494905 10 02 e0 59 28 34 a7 00 32 d2 bc
E: 19.506903 10 02 ea 59 29 34 c9 05 80 00 be
E: 19.513903 10 02 e0 59 2f 34 da 00 33 cf bc
E: 19.525904 10 02 ea 59 38 35 00 06 c0 00 bc
E: 19.532905 10 02 e0 59 3c 35 12 00 34 d0 b6
E: 19.544908 10 02 ea 59 4b 35 34 07 80 00 b7
E: 19.551906 10 02 e0 59 58 35 47 00 35 52 b1
E: 19.562907 10 02 ea 59 67 35 4f 07 c0 00 b2
E: 19.569905 10 02 e0 59 75 35 45 00 35 d5 ac
E: 19.581905 10 02 ea 59 86 35 32 07 c0 00 ac
E: 19.588904 10 02 e0 59 95 35 23 00 35 d8 b3
E: 19.600905 10 02 ea 59 ae 35 08 08 00 00 b1
E: 19.607904 10 02 e0 59 ba 34 fa 00 35 db b1
E: 19.619904 10 02 ea 59 d2 34 da 08 00 00 b1
E: 19.626904 10 02 e0 59 e5 34 c2 00 35 de b5
E: 19.637904 10 02 ea 59 ff 34 a8 08 40 00 b7
E: 19.645903 10 02 e4 5a 12 34 99 00 35 5e b1
E: 19.656903 10 02 ea 5a 20 34 81 08 40 00 b1
E: 19.663904 10 02 e4 5a 23 34 6d 00 34 de ac
E: 19.675903 10 02 ea 5a 38 34 43 08 40 00 ac
E: 19.682905 10 02 e4 5a 45 34 27 00 34 5b ab
E: 19.694904 10 02 ea 5a 5b 33 f3 08 80 00 a8
E: 19.701863 10 02 e4 5a 6e 33 d8 00 34 59 ab
E: 19.712903 10 02 ea 5a 93 33 a8 09 40 00 a8
E: 19.720904 10 02 e4 5a ab 33 88 00 33 d7 a4
E: 19.731903 10 02 ea 5a dc 33 5b 09 c0 00 a4
E: 19.738903 10 02 e4 5a f8 33 3c 00 33 55 a3
E: 19.750904 10 02 ea 5b 24 33 0f 0a 00 00 a2
E: 19.757902 10 02 e4 5b 3a 32 f6 00 32 54 a0
E: 19.769904 10 02 ea 5b 50 32 d1 0a 40 00 a3
E: 19.776903 10 02 e4 5b 5b 32 bb 00 31 d3 a1
E: 19.787903 10 02 ea 5b 5e 32 99 0a 40 00 a2
E: 19.795903 10 02 e4 5b 5a 32 7e 00 31 55 9f
E: 19.806902 10 02 ea 5b 53 32 50 0a 00 00 9e
E: 19.813904 10 02 e4 5b 4b 32 33 00 30 d7 9e
E: 19.825903 10 02 ea 5b 49 31 f8 09 c0 00 9f
E: 19.832903 10 02 e4 5b 49 31 d3 00 30 59 9e
E: 19.844902 10 02 ea 5b 47 31 82 09 40 00 9f
E: 19.851904 10 02 e4 5b 4b 31 4e 00 2f dc a2
E: 19.863903 10 02 ea 5b 3f 30 fe 08 c0 00 a3
E: 19.870903 10 02 e4 5b 35 30 c7 00 2f dd a9
E: 19.881903 10 02 ea 5b 11 30 6d 08 40 00 a9
E: 19.889904 10 02 e4 5a f8 30 33 00 2f 5e a2
E: 19.900903 10 02 ea 5a b8 2f d8 07 80 00 a3
E: 19.907903 10 02 e4 5a 8c 2f a6 00 2f dc 9c
E: 19.919903 10 02 ea 5a 2e 2f 5d 07 00 00 9f
E: 19.926903 10 02 e0 59 e9 2f 3e 00 2f dc 9d
E: 19.938903 10 02 ea 59 6d 2f 1a 06 80 00 9e
E: 19.945902 10 02 e0 59 12 2f 0d 00 2f db 9c
E: 19.956902 10 02 ea 58 67 2f 10 06 00 00 9c
E: 19.964902 10 02 e0 58 07 2f 1c 00 2f 5a 9f
E: 19.975905 10 02 ea 57 78 2f 43 06 00 00 9c
E: 19.982905 10 02 e0 57 2b 2f 63 00 2f 58 a3
E: 19.994902 10 02 ea 56 ae 2f 94 06 40 00 a1
E: 20.001906 10 02 e0 56 69 2f bb 00 2f 55 a1
E: 20.013902 10 02 ea 56 04 2f fd 06 80 00 a1
E: 20.020902 10 02 e0 55 d7 30 2c 00 2f d2 a9
E: 20.032902 10 02 ea 55 9d 30 7c 07 40 00 a8
E: 20.039902 10 02 e0 55 83 30 ae 00 30 50 b4
E: 20.051903 10 02 ea 55 6b 31 12 08 40 00 b4
E: 20.058902 10 02 e0 55 5e 31 56 00 30 d2 b3
E: 20.069902 10 02 ea 55 68 31 d5 09 c0 00 b3
E: 20.076902 10 02 e0 55 85 32 2a 00 31 53 ab
E: 20.088902 10 02 ea 55 d2 32 b6 0b 80 00 aa
E: 20.095903 10 02 e0 56 0d 33 09 00 31 d3 a6
E: 20.107901 10 02 ea 56 82 33 88 0c c0 00 a4
E: 20.114903 10 02 e0 56 d4 33 cf 00 32 52 a2
E: 20.126901 10 02 ea 57 72 34 1f 0d c0 00 a2
E: 20.133902 10 02 e0 57 dc 34 46 00 31 d1 a4
E: 20.144902 10 02 ea 58 ab 34 7e 0e 40 00 a7
E: 20.152901 10 02 e0 59 37 34 97 00 30 d0 b1
E: 20.163902 10 02 ea 59 fc 34 b1 0d c0 00 b3
E: 20.170901 10 02 e0 5a 72 34 ab 00 30 cf b6
E: 20.182866 10 02 ea 5b 10 34 90 0c c0 00 b5
E: 20.189900 10 02 e0 5b 65 34 6b 00 2f ce ba
E: 20.201836 10 02 ea 5b d7 34 19 0a c0 00 bb
E: 20.208902 10 02 e0 5c 14 33 e1 00 2e 4b be
E: 20.219901 10 02 ea 5c 7c 33 77 08 40 00 be
E: 20.227901 10 02 e0 5c c5 33 3e 00 2c c9 cc
E: 20.238901 10 02 ea 5d 75 32 ea 05 c0 00 cd
E: 20.245901 10 02 e0 5d e2 32 c5 00 2b c9 de
E: 20.257901 10 02 ea 5e 7e 32 9c 03 c0 00 de
E: 20.264901 10 02 e0 5e b8 32 91 00 2c 4b e8
E: 20.276901 10 02 ea 5e af 32 b9 02 80 00 e8
E: 20.283901 10 02 e0 5e 5f 33 01 00 2c cc f0
E: 20.295901 10 02 ea 5d 91 33 c3 01 c0 00 f0
E: 20.303900 10 02 80 00 00 00 00 00 00 00 00
E: 20.605899 10 02 c2 80 c2 48 0d e2 11 00 00
E: 20.612899 10 02 e0 5a b1 2a 82 00 36 f1 c7
E: 20.619830 10 02 e0 5a ad 2b 2f 00 36 70 c5
E: 20.626822 10 02 e0 5a b5 2b e3 00 35 ee cd
E: 20.633901 10 02 e0 5a b4 2c 79 00 35 6c d7
E: 20.640899 10 02 e0 5a ab 2c ea 00 34 6a e2
E: 20.648899 10 02 e0 5a b3 2d 3d 00 33 ea e6
E: 20.655899 10 02 e0 5a d4 2d 95 00 33 6a e9
E: 20.662896 10 02 e0 5b 0e 2d f2 00 32 6a ef
E: 20.669899 10 02 e0 5b 56 2e 61 00 31 e9 f0
E: 20.676899 10 02 e0 5b e5 2e fa 00 30 68 ef
E: 20.683898 10 02 e0 5c bb 2f ce 00 2e e5 e9
E: 20.690897 10 02 e0 5d ac 30 ee 00 2d 63 e5
E: 20.697898 10 02 e0 5e 87 31 f2 00 2c e3 d7
E: 20.704898 10 02 e0 5f 4d 32 dc 00 2d 62 bc
E: 20.712900 10 02 e0 5f e1 33 cc 00 2c e1 b5
E: 20.719899 10 02 e0 60 62 34 e2 00 2c 5f b0
E: 20.726900 10 02 e4 60 ba 35 bb 00 2b 60 a1
E: 20.733899 10 02 e4 60 ea 36 5d 00 2a 60 95
E: 20.740898 10 02 e4 61 0d 36 c8 00 29 60 8a
E: 20.747899 10 02 e4 61 2e 37 12 00 28 e1 81
E: 20.754898 10 02 e4 61 6c 37 54 00 27 e1 75
E: 20.761897 10 02 e4 61 dd 37 a6 00 26 df 75
E: 20.768901 10 02 e4 62 6a 38 08 00 26 5d 70
E: 20.776899 10 02 e4 63 13 38 7a 00 26 5b 69
E: 20.783899 10 02 e4 63 ca 38 9f 00 25 da 62
E: 20.790899 10 02 e4 63 b4 38 38 7d e5 d9 5a
E: 20.797898 10 02 e0 63 77 37 82 7f 26 5a 58
E: 20.804899 10 02 e0 63 32 36 e8 7d e6 da 57
E: 20.811900 10 02 e1 63 0c 36 56 7e 66 59 52
E: 20.818898 10 02 e1 62 e8 35 bc 80 e5 d8 50
E: 20.825900 10 02 e0 62 c9 35 1e 81 a5 d9 55
E: 20.832897 10 02 e1 62 a6 34 64 81 e6 59 55
E: 20.840899 10 02 e0 62 8b 33 b8 82 66 d8 56
E: 20.847899 10 02 e1 62 70 33 1b 82 67 58 53
E: 20.854900 10 02 e0 62 54 32 83 82 e7 d7 52
E: 20.861899 10 02 e1 62 30 31 eb 82 67 d8 55
E: 20.868899 10 02 e0 61 f0 31 62 82 e8 58 55
E: 20.875898 10 02 e1 61 95 30 ef 82 68 d8 59
E: 20.882898 10 02 e0 61 12 30 85 82 a8 59 5a
E: 20.889898 10 02 e1 60 7c 30 37 82 a8 59 5a
E: 20.896897 10 02 e0 5f cf 30 03 82 28 59 57
E: 20.904897 10 02 e0 5e f1 2f fb 80 28 5a 56
E: 20.911898 10 02 e1 5e 00 30 2c 7b a8 5a 55
E: 20.918898 10 02 e0 5c f3 30 99 79 a8 5a 5b
E: 20.925898 10 02 e1 5b df 31 34 77 a8 5a 5a
E: 20.932898 10 02 e0 5a e0 31 c5 77 28 da 51
E: 20.939898 10 02 e0 5a 06 32 79 76 a8 da 50
E: 20.946898 10 02 e0 59 4c 33 38 76 a8 da 50
E: 20.953897 10 02 e0 58 a3 34 07 76 a8 da 4e
E: 20.960898 10 02 e1 58 2a 34 ed 76 28 db 50
E: 20.968897 10 02 e0 57 e6 35 bf 76 28 db 4c
E: 20.975898 10 02 e0 57 cd 36 9e 75 e8 da 4f
E: 20.982898 10 02 e0 57 dd 37 75 75 a9 5a 4c
E: 20.989897 10 02 e0 58 11 38 51 75 69 5a 4d
E: 20.996897 10 02 e0 58 5c 39 2f 75 69 5a 51
E: 21.003897 10 02 e0 58 b8 39 ec 75 29 59 4f
E: 21.010898 10 02 e1 59 25 3a ad 74 a9 59 4d
E: 21.017899 10 02 e1 59 98 3b 5e 74 a9 59 4f
E: 21.024899 10 02 e0 5a 17 3b f8 74 a9 58 4c
E: 21.032899 10 02 e0 5a a9 3c 7a 74 29 58 4d
E: 21.039899 10 02 e1 5b 4c 3c e1 73 e9 58 52
E: 21.046897 10 02 e1 5b f1 3d 2c 73 a9 57 53
E: 21.053897 10 02 e0 5c a3 3d 52 74 69 57 52
E: 21.060897 10 02 e0 5d 56 3d 5d 77 29 56 52
E: 21.067898 10 02 e1 5d ff 3d 4b 7b 29 56 56
E: 21.074897 10 02 e1 5e af 3d 20 80 69 55 54
E: 21.081899 10 02 e0 5f 4c 3c ce 84 29 54 54
E: 21.088898 10 02 e0 5f e2 3c 56 8a a9 54 4e
E: 21.096897 10 02 e0 60 6d 3b c0 91 69 54 4e
E: 21.103859 10 02 e1 60 e5 3b 0c 95 a8 d4 4f
E: 21.110896 10 02 e0 61 5a 3a 24 96 e8 d4 4e
E: 21.117898 10 02 e1 61 cf 39 2c 96 68 d4 54
E: 21.124896 10 02 e0 62 1c 38 17 95 68 d4 59
E: 21.131897 10 02 e1 62 4b 37 1c 94 68 d4 55
E: 21.138896 10 02 e0 62 49 36 31 93 e8 d4 53
E: 21.145897 10 02 e0 62 29 35 54 93 e8 d4 56
E: 21.152896 10 02 e1 61 ee 34 6d 94 28 d5 59
E: 21.159897 10 02 e1 61 98 33 95 94 68 d5 55
E: 21.167898 10 02 e1 61 14 32 d1 94 68 d6 50
E: 21.174896 10 02 e1 60 70 32 0b 93 a8 d6 53
E: 21.181896 10 02 e1 5f b6 31 62 8f 28 57 57
E: 21.188897 10 02 e0 5e ea 30 e9 88 e8 58 5b
E: 21.195900 10 02 e1 5e 16 30 90 84 68 58 5a
E: 21.202897 10 02 e0 5d 48 30 53 82 e8 58 59
E: 21.209898 10 02 e0 5c 95 30 36 82 28 59 54
E: 21.216896 10 02 e1 5b ff 30 34 81 a8 59 57
E: 21.223897 10 02 e0 5b 86 30 4f 82 28 da 56
E: 21.231896 10 02 e0 5b 19 30 89 82 28 da 55
E: 21.238896 10 02 e1 5a ae 30 f1 82 28 da 58
E: 21.245898 10 02 e1 5a 4c 31 78 81 a8 da 50
E: 21.252897 10 02 e0 59 f5 32 23 82 29 5b 4f
E: 21.259895 10 02 e1 59 bf 32 eb 81 e9 5b 4e
E: 21.266896 10 02 e1 59 a7 33 b3 81 a9 5b 4e
E: 21.273897 10 02 e0 59 b4 34 8f 80 29 db 51
E: 21.280898 10 02 e0 59 e4 35 72 7a a9 db 53
E: 21.287896 10 02 e1 5a 3a 36 5e 72 29 dc 4c
E: 21.294898 10 02 e0 5a b8 37 4f 61 2a 5b 4c
E: 21.302841 10 02 e1 5b 68 38 48 45 ea 5b 50
E: 21.309896 10 02 e0 5c 4b 39 44 00 29 db 58
E: 21.316897 10 02 e0 5d 37 3a 10 00 29 db 5b
E: 21.323896 10 02 e0 5d fb 3a 6a 00 2a 5a 60
E: 21.330897 10 02 e0 5e 83 3a 5b 00 2a 5a 69
E: 21.337896 10 02 e0 5e c4 39 e1 00 2a 5a 77
E: 21.344897 10 02 e0 5e c6 39 07 00 2a 5c 96
E: 21.351894 10 02 e0 5e 9a 37 ad 00 2a db b7
E: 21.358896 10 02 e0 5e 3d 36 79 00 2b 5b d9
E: 21.367896 10 02 80 00 00 00 00 00 00 00 00
E: 22.503891 10 0c 00 00 00 00 01 00 00 00 00
E: 22.707820 10 0c 00 00 00 00 00 00 00 00 00
E: 23.854885 10 0c 00 00 00 00 00 01 00 00 00
E: 24.078812 10 0c 00 00 00 00 00 00 00 00 00
