R: 139 05 01 09 02 a1 01 85 02 09 01 a1 00 05 09 19 01 29 03 15 00 25 01 95 03 75 01 81 02 95 01 75 05 81 01 05 01 09 30 09 31 09 38 15 81 25 7f 75 08 95 03 81 06 c0 c0 05 0d 09 01 a1 01 85 03 a1 00 06 00 ff 09 01 15 00 26 ff 00 75 08 95 07 81 02 c0 09 02 85 03 95 01 b1 02 09 03 85 04 95 01 b1 02 09 04 85 05 95 01 b1 02 09 05 85 06 95 01 b1 02 09 06 85 07 95 01 b1 02 09 07 85 08 95 01 b1 02 09 08 85 09 95 01 b1 02 c0 00
N: WACOM Pen Tablet
P: 5c:51:4f:e6:db:6e
I: 5 056a 0081
E: 0.000000 8 03 90 2c 21 b2 0d 00 1c
E: 0.001113 8 03 90 4e 20 9d 0d 00 1c
E: 0.002367 8 03 90 c4 1f 9d 0d 00 1c
E: 0.003601 8 03 90 3e 1f a6 0d 00 1c
E: 0.004682 8 03 90 96 1e bb 0d 00 1c
E: 0.007345 8 03 90 d7 1d e6 0d 00 1c
E: 0.008594 8 03 90 09 1d 2a 0e 00 1c
E: 0.024861 8 03 90 09 1c 98 0e 00 1c
E: 0.031211 8 03 90 39 1b 0b 0f 00 1c
E: 0.047446 8 03 90 4e 1a 71 0f 00 1c
E: 0.058709 8 03 90 57 19 ed 0f 00 1c
E: 0.078709 8 03 90 6d 18 71 10 00 1c
E: 0.098712 8 03 90 be 17 19 11 00 1c
E: 0.099844 8 03 90 0d 17 d5 11 00 1c
E: 0.118703 8 03 90 6c 16 b6 12 00 1c
E: 0.138702 8 03 90 bb 15 7d 13 00 1c
E: 0.158707 8 03 90 10 15 4d 14 00 1c
E: 0.159868 8 03 90 a5 14 35 15 00 1c
E: 0.168705 8 03 90 4f 14 41 16 00 1c
E: 0.178708 8 03 90 31 14 06 18 00 1c
E: 0.188693 8 03 90 31 14 06 18 00 1c
E: 0.189940 8 03 90 61 14 ce 18 00 1c
E: 0.198702 8 03 90 b6 14 a1 19 00 1c
E: 0.208708 8 03 90 1b 15 46 1a 00 1c
E: 0.209863 8 03 90 c4 15 e4 1a 00 1c
E: 0.228704 8 03 90 6d 16 68 1b 00 1c
E: 0.229843 8 03 90 12 17 e0 1b 00 1c
E: 0.231087 8 03 90 e3 17 3f 1c 00 1c
E: 0.248708 8 03 90 bb 18 96 1c 00 1c
E: 0.249939 8 03 90 d9 19 e0 1c 00 1c
E: 0.258778 8 03 90 da 1a 17 1d 00 1c
E: 0.268705 8 03 90 ef 1b 36 1d 00 1c
E: 0.269932 8 03 90 16 1d 32 1d 00 1c
E: 0.288707 8 03 90 3d 1e 16 1d 00 1c
E: 0.289934 8 03 90 66 1f dd 1c 00 1c
E: 0.291196 8 03 90 78 20 9a 1c 00 1c
E: 0.308708 8 03 90 83 21 4e 1c 00 1c
E: 0.309935 8 03 90 73 22 ee 1b 00 1c
E: 0.318707 8 03 90 44 23 7f 1b 00 1c
E: 0.328705 8 03 90 01 24 ff 1a 00 1c
E: 0.338707 8 03 90 b6 24 74 1a 00 1c
E: 0.348709 8 03 90 3f 25 e6 19 00 1c
E: 0.358707 8 03 90 a8 25 4b 19 00 1c
E: 0.368709 8 03 90 f3 25 ba 18 00 1c
E: 0.378706 8 03 90 1b 26 38 18 00 1c
E: 0.388708 8 03 90 26 26 b3 17 00 1c
E: 0.398706 8 03 90 1f 26 38 17 00 1c
E: 0.408707 8 03 90 fc 25 bc 16 00 1c
E: 0.418708 8 03 90 be 25 3a 16 00 1c
E: 0.428708 8 03 90 6b 25 b2 15 00 1c
E: 0.438709 8 03 90 ff 24 30 15 00 1c
E: 0.448703 8 03 90 87 24 d6 14 00 1c
E: 0.458704 8 03 90 f2 23 8e 14 00 1c
E: 0.468706 8 03 90 66 23 5b 14 00 1c
E: 0.478642 8 03 90 db 22 36 14 00 1c
E: 0.488709 8 03 90 37 22 20 14 00 1c
E: 0.508720 8 03 90 93 21 1c 14 00 1c
E: 0.509856 8 03 90 f3 20 23 14 00 1c
E: 0.518713 8 03 90 28 20 3e 14 00 1c
E: 0.528717 8 03 90 82 1f 6b 14 00 1c
E: 0.538706 8 03 90 cd 1e a6 14 00 1c
E: 0.548704 8 03 90 27 1e f3 14 00 1c
E: 0.558699 8 03 90 96 1d 4b 15 00 1c
E: 0.568638 8 03 90 fc 1c d3 15 00 1c
E: 0.578704 8 03 90 70 1c 53 16 00 1c
E: 0.588706 8 03 90 04 1c d9 16 00 1c
E: 0.598704 8 03 90 a8 1b 64 17 00 1c
E: 0.608710 8 03 90 5b 1b ed 17 00 1c
E: 0.618705 8 03 90 1b 1b 80 18 00 1c
E: 0.628703 8 03 90 f7 1a 13 19 00 1c
E: 0.638703 8 03 90 d6 1a bd 19 00 1c
E: 0.648703 8 03 90 dc 1a 4f 1a 00 1c
E: 0.698714 8 03 90 56 1b 27 1b 00 1c
E: 0.699847 8 03 90 0d 1c 44 1c 00 1c
E: 0.708710 8 03 90 68 1c 62 1c 00 1c
E: 0.718703 8 03 90 cf 1c 6f 1c 00 1c
E: 0.728702 8 03 90 46 1d 61 1c 00 1c
E: 0.738702 8 03 90 9e 1d 49 1c 00 1c
E: 0.748701 8 03 90 e5 1d 27 1c 00 1c
E: 0.758707 8 03 90 28 1e f0 1b 00 1c
E: 0.768699 8 03 90 55 1e b0 1b 00 1c
E: 0.788710 8 03 90 6f 1e 6b 1b 00 1c
E: 0.789928 8 03 90 78 1e 18 1b 00 1c
E: 0.798707 8 03 90 77 1e c4 1a 00 1c
E: 0.808700 8 03 90 6d 1e 68 1a 00 1c
E: 0.818702 8 03 90 52 1e 07 1a 00 1c
E: 0.828702 8 03 90 25 1e bc 19 00 1c
E: 0.838699 8 03 90 ed 1d 7c 19 00 1c
E: 0.848704 8 03 90 9e 1d 5d 19 00 1c
E: 0.858706 8 03 90 3a 1d 64 19 00 1c
E: 0.868702 8 03 90 ab 1c 66 19 00 1c
E: 0.888710 8 03 90 37 1c 80 19 00 1c
E: 0.889866 8 03 90 e1 1b 7f 19 00 1c
E: 0.908703 8 03 90 8c 1b 89 19 00 1c
E: 0.909866 8 03 90 2d 1b 99 19 00 1c
E: 0.918706 8 03 90 c2 1a a2 19 00 1c
E: 0.928698 8 03 90 4d 1a ba 19 00 1c
E: 0.938702 8 03 90 f8 19 d0 19 00 1c
E: 0.958677 8 03 90 8f 19 de 19 00 1c
E: 0.959910 8 03 90 20 19 0b 1a 00 1c
E: 0.978710 8 03 90 c3 18 4e 1a 00 1c
E: 0.979934 8 03 90 86 18 bb 1a 00 1c
E: 0.988684 8 03 90 3b 18 2f 1b 00 1c
E: 0.999943 8 03 90 f5 17 a7 1b 00 1c
E: 1.018709 8 03 90 b1 17 13 1c 00 1c
E: 1.019931 8 03 90 72 17 6d 1c 00 1c
E: 1.038712 8 03 90 43 17 d8 1c 00 1c
E: 1.039937 8 03 90 25 17 4b 1d 00 1c
E: 1.058708 8 03 90 10 17 96 1d 00 1c
E: 1.059950 8 03 90 10 17 cf 1d 00 1c
E: 1.078656 8 03 90 19 17 00 1e 00 1c
E: 1.079850 8 03 90 2d 17 30 1e 00 1c
E: 1.098649 8 03 90 3e 17 7a 1e 00 1c
E: 1.099835 8 03 90 4c 17 c7 1e 00 1c
E: 1.118706 8 03 90 50 17 1b 1f 00 1c
E: 1.119934 8 03 90 56 17 5d 1f 00 1c
E: 1.138631 8 03 90 66 17 89 1f 00 1c
E: 1.139919 8 03 90 80 17 a1 1f 00 1c
E: 1.148703 8 03 90 9c 17 b8 1f 00 1c
E: 1.158702 8 03 90 b7 17 c5 1f 00 1c
E: 1.178696 8 03 90 cd 17 d6 1f 00 1c
E: 1.188702 8 03 90 d0 17 cb 1f 00 1c
E: 1.198700 8 03 90 cc 17 b8 1f 00 1c
E: 1.199929 8 03 90 bc 17 9e 1f 00 1c
E: 1.208712 8 03 90 a2 17 7f 1f 00 1c
E: 1.218700 8 03 90 82 17 72 1f 00 1c
E: 1.228705 8 03 90 75 17 64 1f 00 1c
E: 1.248709 8 03 90 69 17 56 1f 00 1c
E: 1.249928 8 03 90 68 17 41 1f 00 1c
E: 1.268714 8 03 90 67 17 28 1f 00 1c
E: 1.269930 8 03 90 65 17 0f 1f 00 1c
E: 1.288710 8 03 90 61 17 05 1f 00 1c
E: 1.298709 8 03 90 4f 17 0f 1f 00 1c
E: 1.299933 8 03 90 39 17 1f 1f 00 1c
E: 1.308708 8 03 90 1d 17 39 1f 00 1c
E: 1.328710 8 03 90 0b 17 4a 1f 00 1c
E: 1.329935 8 03 90 f8 16 5c 1f 00 1c
E: 1.338711 8 03 90 f1 16 68 1f 00 1c
E: 1.358708 8 03 90 e0 16 77 1f 00 1c
E: 1.368705 8 03 90 d2 16 8e 1f 00 1c
E: 1.369957 8 03 90 c0 16 9d 1f 00 1c
E: 1.388710 8 03 90 b4 16 ad 1f 00 1c
E: 1.398710 8 03 90 b2 16 b4 1f 00 1c
E: 1.399934 8 03 90 a5 16 c6 1f 00 1c
E: 1.418709 8 03 90 9e 16 d3 1f 00 1c
E: 1.419931 8 03 90 85 16 f9 1f 00 1c
E: 1.448710 8 03 90 77 16 1b 20 00 1c
E: 1.449864 8 03 90 6b 16 2f 20 00 1c
E: 1.458666 8 03 90 67 16 42 20 00 1c
E: 1.468707 8 03 90 6f 16 3c 20 00 1c
E: 1.469938 8 03 90 6f 16 3b 20 00 1c
E: 1.488705 8 03 90 79 16 3c 20 00 1c
E: 1.498651 8 03 90 7c 16 3e 20 00 1c
E: 1.508703 8 03 90 82 16 4c 20 00 1c
E: 1.518711 8 03 90 8b 16 6d 20 00 1c
E: 1.528703 8 03 90 8f 16 9e 20 00 1c
E: 1.538703 8 03 90 96 16 bd 20 00 1c
E: 1.539879 8 03 90 96 16 d5 20 00 1c
E: 1.558696 8 03 90 9d 16 e9 20 00 1c
E: 1.568705 8 03 90 9d 16 ef 20 00 1c
E: 1.569926 8 03 90 a0 16 fc 20 00 1c
E: 1.588700 8 03 90 aa 16 fd 20 00 1c
E: 1.598700 8 03 90 b3 16 fe 20 00 1c
E: 1.599958 8 03 90 be 16 f7 20 00 1c
E: 1.618686 8 03 90 c0 16 f8 20 00 1c
E: 1.619936 8 03 90 c6 16 f9 20 00 1c
E: 1.638701 8 03 90 c6 16 f7 20 00 1c
E: 1.648701 8 03 90 c8 16 03 21 00 1c
E: 1.658700 8 03 90 c9 16 fc 20 00 1c
E: 1.668684 8 03 90 c8 16 01 21 00 1c
E: 1.678691 8 03 90 cc 16 f9 20 00 1c
E: 1.688700 8 03 90 ca 16 ea 20 00 1c
E: 1.698617 8 03 90 d5 16 ec 20 00 1c
E: 1.708648 8 03 90 e0 16 cb 20 00 1c
E: 1.709931 8 03 90 ea 16 bb 20 00 1c
E: 1.728638 8 03 90 fc 16 9c 20 00 1c
E: 1.738698 8 03 90 03 17 7f 20 00 1c
E: 1.748697 8 03 90 11 17 4f 20 00 1c
E: 1.758694 8 03 90 18 17 37 20 00 1c
E: 1.759873 8 03 90 23 17 1c 20 00 1c
E: 1.778698 8 03 90 22 17 fd 1f 00 1c
E: 1.779958 8 03 90 23 17 e8 1f 00 1c
E: 1.798696 8 03 90 1f 17 db 1f 00 1c
E: 1.808702 8 03 90 1e 17 d3 1f 00 1c
E: 1.818699 8 03 90 2e 17 c5 1f 00 1c
E: 1.828701 8 03 90 40 17 bb 1f 00 1c
E: 1.838699 8 03 90 54 17 a6 1f 00 1c
E: 1.848697 8 03 90 67 17 91 1f 00 1c
E: 1.858697 8 03 90 8f 17 6e 1f 00 1c
E: 1.868698 8 03 90 b6 17 30 1f 00 1c
E: 1.878692 8 03 90 df 17 f0 1e 00 1c
E: 1.888700 8 03 90 05 18 a6 1e 00 1c
E: 1.898706 8 03 90 2c 18 69 1e 00 1c
E: 1.908693 8 03 90 4c 18 40 1e 00 1c
E: 1.918697 8 03 90 5d 18 2d 1e 00 1c
E: 1.928699 8 03 90 6d 18 2c 1e 00 1c
E: 1.938695 8 03 90 78 18 26 1e 00 1c
E: 1.948699 8 03 90 7b 18 21 1e 00 1c
E: 1.958694 8 03 90 86 18 1c 1e 00 1c
E: 1.959951 8 03 90 8c 18 0d 1e 00 1c
E: 1.978706 8 03 90 9e 18 00 1e 00 1c
E: 1.979950 8 03 90 a3 18 ed 1d 00 1c
E: 1.998679 8 03 90 a2 18 ee 1d 00 1c
E: 2.008700 8 03 90 93 18 f9 1d 00 1c
E: 2.018705 8 03 90 87 18 0a 1e 00 1c
E: 2.028702 8 03 90 7c 18 22 1e 00 1c
E: 2.038700 8 03 90 68 18 37 1e 00 1c
E: 2.039911 8 03 90 59 18 52 1e 00 1c
E: 2.058704 8 03 90 4a 18 64 1e 00 1c
E: 2.068703 8 03 90 39 18 79 1e 00 1c
E: 2.078671 8 03 90 32 18 81 1e 00 1c
E: 2.088697 8 03 90 1e 18 89 1e 00 1c
E: 2.098697 8 03 90 1b 18 8b 1e 00 1c
E: 2.108697 8 03 90 13 18 8c 1e 00 1c
E: 2.118693 8 03 90 11 18 95 1e 00 1c
E: 2.119954 8 03 90 fe 17 97 1e 00 1c
E: 2.138705 8 03 90 f5 17 99 1e 00 1c
E: 2.139907 8 03 90 ee 17 9f 1e 00 1c
E: 2.158701 8 03 90 d5 17 9a 1e 00 1c
E: 2.168705 8 03 90 d2 17 9e 1e 00 1c
E: 2.178697 8 03 90 c8 17 a1 1e 00 1c
E: 2.188700 8 03 90 ba 17 aa 1e 00 1c
E: 2.198694 8 03 10 b2 17 ac 1e 00 1c
E: 2.199952 8 03 10 a7 17 ae 1e 00 1c
E: 2.218706 8 03 10 a4 17 a9 1e 00 1c
E: 2.228706 8 03 10 9c 17 a0 1e 00 1c
E: 2.238698 8 03 90 a4 17 8a 1e 00 1c
E: 2.248699 8 03 90 a8 17 6c 1e 00 1c
E: 2.258695 8 03 90 af 17 4d 1e 00 1c
E: 2.268696 8 03 90 b4 17 2f 1e 00 1c
E: 2.278697 8 03 90 ae 17 2f 1e 00 1c
E: 2.288696 8 03 90 a7 17 33 1e 00 1c
E: 2.298696 8 03 90 98 17 4d 1e 00 1c
E: 2.308638 8 03 90 8e 17 64 1e 00 1c
E: 2.318696 8 03 90 83 17 7b 1e 00 1c
E: 2.328620 8 03 90 69 17 8f 1e 00 1c
E: 2.338698 8 03 10 5e 17 95 1e 00 1c
E: 2.348697 8 03 10 4a 17 9a 1e 00 1c
E: 2.358696 8 03 10 3f 17 a1 1e 00 1c
E: 2.359872 8 03 10 2e 17 96 1e 00 1c
E: 2.378693 8 03 10 19 17 9f 1e 00 1c
E: 2.388696 8 03 10 0a 17 a6 1e 00 1c
E: 2.398693 8 03 10 f3 16 b1 1e 00 1c
E: 2.408694 8 03 10 d2 16 ce 1e 00 1c
E: 2.418696 8 03 10 c3 16 df 1e 00 1c
E: 2.428695 8 03 10 a8 16 f2 1e 00 1c
E: 2.438696 8 03 10 80 16 0a 1f 00 1c
E: 2.448679 8 03 10 68 16 0d 1f 00 1c
E: 2.458690 8 03 10 4c 16 25 1f 00 1c
E: 2.468696 8 03 10 38 16 32 1f 00 1c
E: 2.478697 8 03 10 15 16 38 1f 00 1c
E: 2.488697 8 03 10 e1 15 41 1f 00 1c
E: 2.489951 8 03 00 00 00 00 00 00 1c
E: 2.728707 8 03 90 b1 14 fb 1e 00 1c
E: 2.729859 8 03 90 9e 14 0a 1f 00 1c
E: 2.748692 8 03 90 89 14 0c 1f 00 1c
E: 2.749966 8 03 90 7d 14 04 1f 00 1c
E: 2.768701 8 03 90 70 14 05 1f 00 1c
E: 2.769951 8 03 90 62 14 09 1f 00 1c
E: 2.788704 8 03 90 52 14 15 1f 00 1c
E: 2.798702 8 03 90 45 14 26 1f 00 1c
E: 2.808699 8 03 92 3d 14 29 1f 00 1c
E: 2.818696 8 03 92 32 14 33 1f 00 1c
E: 2.828689 8 03 92 34 14 39 1f 00 1c
E: 2.838690 8 03 92 27 14 40 1f 00 1c
E: 2.848690 8 03 92 14 14 5e 1f 00 1c
E: 2.849952 8 03 92 f6 13 76 1f 00 1c
E: 2.868702 8 03 92 d3 13 8e 1f 00 1c
E: 2.878695 8 03 92 c2 13 a3 1f 00 1c
E: 2.888696 8 03 92 b4 13 a6 1f 00 1c
E: 2.898625 8 03 92 ab 13 b0 1f 00 1c
E: 2.908606 8 03 92 ac 13 af 1f 00 1c
E: 2.909951 8 03 92 ab 13 b5 1f 00 1c
E: 2.928593 8 03 92 af 13 b8 1f 00 1c
E: 2.938560 8 03 92 bb 13 ba 1f 00 1c
E: 2.948694 8 03 92 c2 13 ca 1f 00 1c
E: 2.958692 8 03 92 cc 13 d7 1f 00 1c
E: 2.968717 8 03 92 c9 13 e2 1f 00 1c
E: 2.978692 8 03 92 c4 13 f1 1f 00 1c
E: 2.988692 8 03 92 c3 13 fe 1f 00 1c
E: 3.008703 8 03 92 c0 13 02 20 00 1c
E: 3.009948 8 03 92 be 13 0a 20 00 1c
E: 3.018700 8 03 92 be 13 0e 20 00 1c
E: 3.028691 8 03 92 bc 13 05 20 00 1c
E: 3.038712 8 03 92 ba 13 fe 1f 00 1c
E: 3.048718 8 03 92 b7 13 f0 1f 00 1c
E: 3.058717 8 03 92 af 13 ed 1f 00 1c
E: 3.068692 8 03 92 ac 13 e2 1f 00 1c
E: 3.078739 8 03 92 ab 13 cc 1f 00 1c
E: 3.088604 8 03 92 ae 13 af 1f 00 1c
E: 3.098689 8 03 92 bb 13 81 1f 00 1c
E: 3.108688 8 03 92 cb 13 54 1f 00 1c
E: 3.118694 8 03 92 d4 13 35 1f 00 1c
E: 3.128691 8 03 90 d9 13 2d 1f 00 1c
E: 3.138690 8 03 10 d8 13 23 1f 00 1c
E: 3.148690 8 03 10 cb 13 2d 1f 00 1c
E: 3.158685 8 03 10 c5 13 36 1f 00 1c
E: 3.168714 8 03 10 b5 13 3d 1f 00 1c
E: 3.178694 8 03 10 b1 13 48 1f 00 1c
E: 3.188718 8 03 10 b9 13 3e 1f 00 1c
E: 3.198693 8 03 10 c3 13 38 1f 00 1c
E: 3.208691 8 03 10 d3 13 29 1f 00 1c
E: 3.218692 8 03 10 e1 13 0d 1f 00 1c
E: 3.228715 8 03 10 e6 13 02 1f 00 1c
E: 3.238717 8 03 10 e9 13 ff 1e 00 1c
E: 3.248718 8 03 10 dd 13 f7 1e 00 1c
E: 3.258701 8 03 10 d3 13 ee 1e 00 1c
E: 3.268715 8 03 10 bb 13 e7 1e 00 1c
E: 3.278691 8 03 10 a6 13 ef 1e 00 1c
E: 3.288710 8 03 10 98 13 f7 1e 00 1c
E: 3.298691 8 03 10 8f 13 f1 1e 00 1c
E: 3.308691 8 03 10 84 13 f6 1e 00 1c
E: 3.318695 8 03 10 80 13 eb 1e 00 1c
E: 3.328676 8 03 10 84 13 dd 1e 00 1c
E: 3.338716 8 03 10 93 13 c6 1e 00 1c
E: 3.348690 8 03 10 b2 13 a5 1e 00 1c
E: 3.358711 8 03 10 c9 13 8d 1e 00 1c
E: 3.368717 8 03 10 d9 13 84 1e 00 1c
E: 3.378691 8 03 10 d0 13 8b 1e 00 1c
E: 3.388700 8 03 10 c5 13 a1 1e 00 1c
E: 3.408728 8 03 10 b0 13 c3 1e 00 1c
E: 3.409945 8 03 10 92 13 ec 1e 00 1c
E: 3.418702 8 03 10 78 13 17 1f 00 1c
E: 3.428596 8 03 10 67 13 35 1f 00 1c
E: 3.438587 8 03 10 64 13 4e 1f 00 1c
E: 3.448532 8 03 10 6a 13 58 1f 00 1c
E: 3.458681 8 03 90 76 13 64 1f 00 1c
E: 3.468660 8 03 90 80 13 80 1f 00 1c
E: 3.478711 8 03 90 87 13 8d 1f 00 1c
E: 3.488648 8 03 90 84 13 a3 1f 00 1c
E: 3.498694 8 03 90 84 13 aa 1f 00 1c
E: 3.508630 8 03 90 84 13 b3 1f 00 1c
E: 3.518689 8 03 90 89 13 b0 1f 00 1c
E: 3.528678 8 03 90 91 13 aa 1f 00 1c
E: 3.538702 8 03 90 94 13 ad 1f 00 1c
E: 3.548714 8 03 90 9c 13 ac 1f 00 1c
E: 3.558712 8 03 90 9a 13 a6 1f 00 1c
E: 3.568714 8 03 90 96 13 a9 1f 00 1c
E: 3.578715 8 03 90 94 13 a6 1f 00 1c
E: 3.588698 8 03 90 95 13 aa 1f 00 1c
E: 3.599946 8 03 90 a0 13 aa 1f 00 1c
E: 3.608712 8 03 94 a8 13 9e 1f 00 1c
E: 3.618688 8 03 94 a5 13 a0 1f 00 1c
E: 3.628715 8 03 94 a9 13 a2 1f 00 1c
E: 3.638717 8 03 94 ad 13 a1 1f 00 1c
E: 3.648690 8 03 94 b1 13 a1 1f 00 1c
E: 3.658688 8 03 94 b9 13 9c 1f 00 1c
E: 3.668713 8 03 94 bd 13 92 1f 00 1c
E: 3.678709 8 03 94 be 13 8d 1f 00 1c
E: 3.688713 8 03 94 c1 13 81 1f 00 1c
E: 3.698686 8 03 94 c2 13 78 1f 00 1c
E: 3.708681 8 03 94 cb 13 6e 1f 00 1c
E: 3.718716 8 03 94 dd 13 5b 1f 00 1c
E: 3.728713 8 03 94 ec 13 4e 1f 00 1c
E: 3.738710 8 03 90 f3 13 54 1f 00 1c
E: 3.748625 8 03 90 e3 13 69 1f 00 1c
E: 3.758618 8 03 90 c3 13 93 1f 00 1c
E: 3.768625 8 03 90 a0 13 be 1f 00 1c
E: 3.778641 8 03 90 7d 13 e1 1f 00 1c
E: 3.788717 8 03 90 64 13 fd 1f 00 1c
E: 3.798714 8 03 90 59 13 0b 20 00 1c
E: 3.808705 8 03 90 55 13 0d 20 00 1c
E: 3.818696 8 03 90 56 13 0a 20 00 1c
E: 3.828728 8 03 90 59 13 07 20 00 1c
E: 3.838719 8 03 90 5c 13 00 20 00 1c
E: 3.848713 8 03 90 5e 13 fb 1f 00 1c
E: 3.858713 8 03 90 60 13 f7 1f 00 1c
E: 3.868693 8 03 90 5f 13 fa 1f 00 1c
E: 3.878722 8 03 90 5a 13 fd 1f 00 1c
E: 3.888722 8 03 90 57 13 ff 1f 00 1c
E: 3.898715 8 03 90 53 13 0d 20 00 1c
E: 3.908713 8 03 90 52 13 10 20 00 1c
E: 3.918715 8 03 90 52 13 11 20 00 1c
E: 3.928713 8 03 90 54 13 17 20 00 1c
E: 3.938713 8 03 90 5a 13 15 20 00 1c
E: 3.948713 8 03 90 5d 13 12 20 00 1c
E: 3.958676 8 03 90 68 13 0f 20 00 1c
E: 3.968717 8 03 90 72 13 0c 20 00 1c
E: 3.978718 8 03 90 7b 13 08 20 00 1c
E: 3.988713 8 03 90 83 13 03 20 00 1c
E: 3.998707 8 03 90 85 13 ff 1f 00 1c
E: 4.008673 8 03 90 8a 13 f8 1f 00 1c
E: 4.018762 8 03 90 98 13 f1 1f 00 1c
E: 4.028713 8 03 90 a9 13 eb 1f 00 1c
E: 4.038719 8 03 90 c2 13 d6 1f 00 1c
E: 4.048715 8 03 90 d9 13 c7 1f 00 1c
E: 4.058711 8 03 90 fc 13 ae 1f 00 1c
E: 4.068721 8 03 90 20 14 88 1f 00 1c
E: 4.078713 8 03 90 46 14 65 1f 00 1c
E: 4.088706 8 03 90 6d 14 46 1f 00 1c
E: 4.098712 8 03 90 91 14 2b 1f 00 1c
E: 4.108714 8 03 90 ad 14 10 1f 00 1c
E: 4.118710 8 03 90 c7 14 ee 1e 00 1c
E: 4.138721 8 03 90 d5 14 cf 1e 00 1c
E: 4.139861 8 03 90 eb 14 ae 1e 00 1c
E: 4.148708 8 03 90 f6 14 86 1e 00 1c
E: 4.158712 8 03 90 06 15 69 1e 00 1c
E: 4.168710 8 03 90 01 15 56 1e 00 1c
E: 4.178710 8 03 90 ea 14 55 1e 00 1c
E: 4.188649 8 03 90 c9 14 55 1e 00 1c
E: 4.198712 8 03 90 92 14 5a 1e 00 1c
E: 4.208712 8 03 90 5c 14 64 1e 00 1c
E: 4.218712 8 03 90 30 14 69 1e 00 1c
E: 4.228711 8 03 90 08 14 67 1e 00 1c
E: 4.238668 8 03 90 e8 13 57 1e 00 1c
E: 4.248711 8 03 90 c5 13 44 1e 00 1c
E: 4.258709 8 03 90 a3 13 3a 1e 00 1c
E: 4.268712 8 03 90 80 13 27 1e 00 1c
E: 4.278712 8 03 90 5b 13 1c 1e 00 1c
E: 4.288711 8 03 90 31 13 0c 1e 00 1c
E: 4.308720 8 03 90 00 13 f3 1d 00 1c
E: 4.309946 8 03 90 d4 12 d4 1d 00 1c
E: 4.318655 8 03 90 a8 12 af 1d 00 1c
E: 4.328711 8 03 90 81 12 96 1d 00 1c
E: 4.338711 8 03 90 56 12 7a 1d 00 1c
E: 4.348712 8 03 90 30 12 6b 1d 18 1c
E: 4.358655 8 03 91 19 12 5f 1d 52 1c
E: 4.368644 8 03 91 ec 11 55 1d 64 1c
E: 4.378706 8 03 91 cd 11 53 1d 76 1c
E: 4.388711 8 03 91 b7 11 4c 1d 81 1c
E: 4.398708 8 03 91 a5 11 48 1d 84 1c
E: 4.408711 8 03 91 a2 11 4c 1d 88 1c
E: 4.418709 8 03 91 98 11 49 1d 87 1c
E: 4.428655 8 03 91 91 11 4a 1d 8a 1c
E: 4.438708 8 03 91 92 11 49 1d 86 1c
E: 4.448713 8 03 91 90 11 46 1d 6b 1c
E: 4.458708 8 03 91 8f 11 4c 1d 46 1c
E: 4.468709 8 03 90 94 11 5e 1d 00 1c
E: 4.488639 8 03 90 9d 11 7e 1d 00 1c
E: 4.489832 8 03 90 ac 11 a0 1d 00 1c
E: 4.508611 8 03 90 b8 11 ad 1d 00 1c
E: 4.509836 8 03 90 c2 11 bd 1d 00 1c
E: 4.518596 8 03 90 d2 11 cf 1d 00 1c
E: 4.538601 8 03 90 d0 11 e1 1d 00 1c
E: 4.539852 8 03 90 db 11 f9 1d 00 1c
E: 4.548617 8 03 90 dd 11 0a 1e 00 1c
E: 4.558614 8 03 10 d7 11 24 1e 00 1c
E: 4.578613 8 03 10 d7 11 3e 1e 00 1c
E: 4.579842 8 03 10 df 11 52 1e 00 1c
E: 4.598611 8 03 10 ea 11 72 1e 00 1c
E: 4.599845 8 03 00 00 00 00 00 00 1c
E: 5.598705 8 03 b1 ec 1c 56 14 ce 1c
E: 5.618714 8 03 b1 43 1c 9f 14 cd 1c
E: 5.628711 8 03 b1 71 1b 14 15 d7 1c
E: 5.629858 8 03 b1 9e 1a 98 15 d4 1c
E: 5.648645 8 03 b1 dc 19 37 16 dc 1c
E: 5.649867 8 03 b1 0e 19 cb 16 eb 1c
E: 5.668702 8 03 b1 95 18 41 17 e8 1c
E: 5.669876 8 03 b1 45 18 a0 17 f3 1c
E: 5.688700 8 03 b1 03 18 0a 18 e8 1c
E: 5.689847 8 03 b1 c7 17 99 18 ea 1c
E: 5.708700 8 03 b1 a5 17 23 19 ed 1c
E: 5.709852 8 03 b1 9e 17 97 19 e9 1c
E: 5.728623 8 03 b1 a1 17 fc 19 f3 1c
E: 5.729929 8 03 b1 b4 17 73 1a e8 1c
E: 5.748701 8 03 b1 da 17 dd 1a e8 1c
E: 5.758699 8 03 b1 19 18 40 1b ed 1c
E: 5.759954 8 03 b1 67 18 a2 1b e8 1c
E: 5.768698 8 03 b1 c6 18 f3 1b f4 1c
E: 5.788699 8 03 b1 51 19 33 1c ef 1c
E: 5.789953 8 03 b1 f6 19 56 1c f1 1c
E: 5.808700 8 03 b1 9b 1a 61 1c f4 1c
E: 5.818717 8 03 b1 49 1b 51 1c ef 1c
E: 5.819956 8 03 b1 ef 1b 24 1c fb 1c
E: 5.838717 8 03 b1 84 1c ed 1b f2 1c
E: 5.839957 8 03 b1 29 1d a2 1b f3 1c
E: 5.858626 8 03 b1 8f 1d 56 1b f6 1c
E: 5.859960 8 03 b1 c2 1d 23 1b fc 1c
E: 5.878709 8 03 b9 cf 1d 12 1b 1a 1c
E: 5.888709 8 03 b9 c3 1d 0f 1b 19 1c
E: 5.898755 8 03 b9 ac 1d ea 1a 25 1c
E: 5.908703 8 03 b9 80 1d ce 1a 2c 1c
E: 5.909955 8 03 b9 46 1d c7 1a 28 1c
E: 5.928711 8 03 b9 fe 1c c8 1a 35 1c
E: 5.929952 8 03 b9 c0 1c d6 1a 28 1c
E: 5.948626 8 03 b9 9f 1c dd 1a 1f 1c
E: 5.958709 8 03 b9 7f 1c e9 1a 1d 1c
E: 5.959955 8 03 b9 60 1c f3 1a 0e 1c
E: 5.968712 8 03 b9 3a 1c fe 1a 18 1c
E: 5.988705 8 03 b9 10 1c 17 1b 12 1c
E: 5.998709 8 03 b9 c2 1b 3d 1b 10 1c
E: 6.008701 8 03 b9 68 1b 79 1b 15 1c
E: 6.009955 8 03 b9 0e 1b ba 1b 09 1c
E: 6.028710 8 03 b9 b1 1a 07 1c 17 1c
E: 6.029957 8 03 b9 65 1a 4c 1c 13 1c
E: 6.048712 8 03 b9 24 1a 92 1c 10 1c
E: 6.058708 8 03 b9 00 1a cb 1c 15 1c
E: 6.068702 8 03 b9 fb 19 f8 1c 09 1c
E: 6.069956 8 03 b9 ff 19 2e 1d 16 1c
E: 6.088697 8 03 b9 16 1a 6b 1d 15 1c
E: 6.098711 8 03 b9 36 1a 94 1d 11 1c
E: 6.108698 8 03 b9 50 1a b2 1d 16 1c
E: 6.109954 8 03 b9 6a 1a c2 1d 0b 1c
E: 6.128709 8 03 b9 7a 1a cc 1d 17 1c
E: 6.138708 8 03 b9 8c 1a d9 1d 15 1c
E: 6.148701 8 03 b9 99 1a de 1d 11 1c
E: 6.149953 8 03 b9 a8 1a ed 1d 16 1c
E: 6.168701 8 03 b9 b9 1a f2 1d 0b 1c
E: 6.169954 8 03 b9 be 1a f8 1d 16 1c
E: 6.188705 8 03 b9 c1 1a fa 1d 14 1c
E: 6.189951 8 03 b9 bd 1a f8 1d 15 1c
E: 6.208706 8 03 b9 bf 1a fd 1d 25 1c
E: 6.218706 8 03 b9 b9 1a fa 1d 16 1c
E: 6.228630 8 03 b9 8e 1a 00 1e 1a 1c
E: 6.238700 8 03 b9 49 1a 13 1e 16 1c
E: 6.248703 8 03 b9 e5 19 39 1e 13 1c
E: 6.249953 8 03 b9 6c 19 77 1e 17 1c
E: 6.268707 8 03 b9 eb 18 c3 1e 0b 1c
E: 6.278706 8 03 b9 83 18 1d 1f 1b 1c
E: 6.279953 8 03 b9 2d 18 67 1f 19 1c
E: 6.298705 8 03 b9 e2 17 ac 1f 12 1c
E: 6.308703 8 03 b9 ac 17 df 1f 1a 1c
E: 6.309950 8 03 b9 7d 17 05 20 0e 1c
E: 6.328705 8 03 b9 69 17 1d 20 1b 1c
E: 6.338706 8 03 b9 69 17 1a 20 18 1c
E: 6.339953 8 03 b9 64 17 21 20 11 1c
E: 6.358704 8 03 b9 65 17 22 20 09 1c
E: 6.368702 8 03 b1 64 17 21 20 db 1c
E: 6.378700 8 03 b1 64 17 1c 20 88 1c
E: 6.388701 8 03 b0 5a 17 18 20 00 1c
E: 6.389878 8 03 b0 47 17 4a 20 00 1c
E: 6.408641 8 03 b0 13 17 4a 20 00 1c
E: 6.418706 8 03 b0 d0 16 14 20 00 1c
E: 6.428700 8 03 b0 9d 16 df 1f 00 1c
E: 6.438628 8 03 30 92 16 b6 1f 00 1c
E: 6.448699 8 03 30 9d 16 94 1f 00 1c
E: 6.449953 8 03 00 00 00 00 00 00 1c
E: 6.588701 8 03 b9 1b 18 5d 21 78 1c
E: 6.598697 8 03 b9 e7 17 55 21 5a 1c
E: 6.608698 8 03 b9 b8 17 6c 21 49 1c
E: 6.618698 8 03 b1 b6 17 6d 21 de 1c
E: 6.628691 8 03 b1 d0 17 5f 21 86 1c
E: 6.638661 8 03 b0 06 18 5d 21 00 1c
E: 6.648696 8 03 b0 44 18 57 21 00 1c
E: 6.658699 8 03 b0 49 18 3e 21 00 1c
E: 6.668700 8 03 b0 2f 18 17 21 00 1c
E: 6.678697 8 03 b0 f4 17 f0 20 00 1c
E: 6.688667 8 03 30 b1 17 9e 20 00 1c
E: 6.708695 8 03 30 8e 17 3b 20 00 1c
E: 6.709952 8 03 00 00 00 00 00 00 1c
E: 8.068721 8 03 90 5a 17 b7 25 00 1c
E: 8.078600 8 03 90 af 17 bc 25 00 1c
E: 8.088697 8 03 90 33 18 b8 25 00 1c
E: 8.098713 8 03 90 bc 18 a2 25 00 1c
E: 8.108698 8 03 90 63 19 a3 25 00 1c
E: 8.118715 8 03 90 f8 19 8d 25 00 1c
E: 8.128713 8 03 90 79 1a 61 25 00 1c
E: 8.138711 8 03 90 08 1b 2f 25 00 1c
E: 8.148715 8 03 90 9c 1b e9 24 00 1c
E: 8.158645 8 03 90 27 1c aa 24 00 1c
E: 8.168709 8 03 90 98 1c 54 24 00 1c
E: 8.178715 8 03 90 09 1d f4 23 00 1c
E: 8.188714 8 03 90 57 1d 94 23 00 1c
E: 8.198712 8 03 90 92 1d 32 23 00 1c
E: 8.208717 8 03 90 c6 1d b9 22 00 1c
E: 8.218714 8 03 90 e4 1d 39 22 00 1c
E: 8.228715 8 03 90 fd 1d ba 21 00 1c
E: 8.238709 8 03 90 09 1e 36 21 00 1c
E: 8.248712 8 03 90 03 1e a2 20 00 1c
E: 8.258712 8 03 90 f2 1d 0c 20 00 1c
E: 8.268712 8 03 90 d2 1d 9d 1f 00 1c
E: 8.278713 8 03 90 a3 1d 2f 1f 00 1c
E: 8.288687 8 03 90 64 1d d5 1e 00 1c
E: 8.298708 8 03 90 02 1d 90 1e 00 1c
E: 8.308712 8 03 90 9f 1c 4e 1e 00 1c
E: 8.318712 8 03 90 42 1c 1a 1e 00 1c
E: 8.328713 8 03 90 f0 1b f5 1d 00 1c
E: 8.338710 8 03 90 8a 1b e2 1d 00 1c
E: 8.348710 8 03 90 28 1b e4 1d 00 1c
E: 8.358711 8 03 90 b2 1a ed 1d 00 1c
E: 8.368709 8 03 90 3a 1a 13 1e 00 1c
E: 8.378711 8 03 90 d1 19 41 1e 00 1c
E: 8.388709 8 03 90 56 19 7b 1e 00 1c
E: 8.398711 8 03 90 dc 18 c5 1e 00 1c
E: 8.408711 8 03 90 80 18 15 1f 00 1c
E: 8.418709 8 03 90 35 18 72 1f 00 1c
E: 8.428706 8 03 90 fb 17 d1 1f 00 1c
E: 8.438711 8 03 90 ce 17 48 20 00 1c
E: 8.448710 8 03 90 b7 17 cf 20 00 1c
E: 8.458709 8 03 90 ac 17 3f 21 00 1c
E: 8.468686 8 03 90 b8 17 af 21 00 1c
E: 8.478710 8 03 90 dc 17 12 22 00 1c
E: 8.488704 8 03 90 12 18 6a 22 00 1c
E: 8.498710 8 03 90 59 18 ae 22 00 1c
E: 8.508709 8 03 90 b1 18 dc 22 00 1c
E: 8.528722 8 03 90 34 19 f7 22 00 1c
E: 8.529943 8 03 90 bf 19 fa 22 00 1c
E: 8.538721 8 03 90 41 1a ef 22 00 1c
E: 8.548710 8 03 90 d7 1a ca 22 00 1c
E: 8.568644 8 03 90 68 1b 9c 22 00 1c
E: 8.569819 8 03 90 e8 1b 59 22 00 1c
E: 8.578717 8 03 90 50 1c 09 22 00 1c
E: 8.588709 8 03 90 b5 1c bc 21 00 1c
E: 8.598709 8 03 90 ff 1c 6c 21 00 1c
E: 8.608692 8 03 90 2c 1d 29 21 00 1c
E: 8.618705 8 03 90 43 1d ec 20 00 1c
E: 8.628706 8 03 90 35 1d be 20 00 1c
E: 8.638709 8 03 90 10 1d a1 20 00 1c
E: 8.648711 8 03 90 d3 1c 79 20 00 1c
E: 8.658695 8 03 90 a4 1c 60 20 00 1c
E: 8.678717 8 03 90 70 1c 45 20 00 1c
E: 8.679936 8 03 90 46 1c 37 20 00 1c
E: 8.688709 8 03 90 20 1c 25 20 00 1c
E: 8.698710 8 03 90 f7 1b 0d 20 00 1c
E: 8.708687 8 03 90 d6 1b 00 20 00 1c
E: 8.718813 8 03 90 b2 1b f5 1f 00 1c
E: 8.728709 8 03 90 93 1b f5 1f 00 1c
E: 8.738705 8 03 90 7c 1b ef 1f 00 1c
E: 8.748703 8 03 90 60 1b ea 1f 00 1c
E: 8.758692 8 03 90 56 1b e4 1f 00 1c
E: 8.768711 8 03 90 52 1b d5 1f 00 1c
E: 8.778707 8 03 90 47 1b d4 1f 00 1c
E: 8.788707 8 03 90 4c 1b c4 1f 00 1c
E: 8.798706 8 03 90 46 1b be 1f 00 1c
E: 8.808704 8 03 90 4c 1b b4 1f 00 1c
E: 8.818708 8 03 90 4e 1b ad 1f 00 1c
E: 8.828709 8 03 90 4f 1b a2 1f 00 1c
E: 8.848716 8 03 90 5c 1b 92 1f 00 1c
E: 8.849963 8 03 90 5d 1b 8e 1f 00 1c
E: 8.858716 8 03 90 63 1b 7f 1f 00 1c
E: 8.868707 8 03 90 5e 1b 6f 1f 00 1c
E: 8.878703 8 03 90 5a 1b 67 1f 00 1c
E: 8.888708 8 03 90 5a 1b 57 1f 00 1c
E: 8.898711 8 03 90 4d 1b 50 1f 00 1c
E: 8.908708 8 03 90 4b 1b 48 1f 00 1c
E: 8.918708 8 03 90 3d 1b 3e 1f 00 1c
E: 8.928705 8 03 90 31 1b 44 1f 00 1c
E: 8.938676 8 03 90 29 1b 41 1f 00 1c
E: 8.948701 8 03 90 1a 1b 4b 1f 00 1c
E: 8.958709 8 03 90 15 1b 4f 1f 00 1c
E: 8.968708 8 03 90 0c 1b 54 1f 00 1c
E: 8.978710 8 03 90 05 1b 5f 1f 00 1c
E: 8.988704 8 03 90 ff 1a 63 1f 00 1c
E: 8.998707 8 03 90 fc 1a 66 1f 00 1c
E: 9.008707 8 03 90 fc 1a 71 1f 00 1c
E: 9.018711 8 03 90 f7 1a 6f 1f 00 1c
E: 9.028706 8 03 90 f8 1a 72 1f 00 1c
E: 9.038707 8 03 90 fd 1a 72 1f 00 1c
E: 9.058716 8 03 90 00 1b 74 1f 00 1c
E: 9.059858 8 03 90 02 1b 73 1f 00 1c
E: 9.068690 8 03 90 ff 1a 72 1f 00 1c
E: 9.088717 8 03 90 fd 1a 74 1f 00 1c
E: 9.098716 8 03 90 fe 1a 76 1f 00 1c
E: 9.138715 8 03 90 f1 1a 7e 1f 00 1e
E: 9.148717 8 03 90 e6 1a 7e 1f 00 1e
E: 9.168654 8 03 90 e1 1a 83 1f 00 1e
E: 9.169901 8 03 90 e4 1a 82 1f 00 1e
E: 9.178720 8 03 90 e8 1a 82 1f 00 1e
E: 9.188706 8 03 90 e2 1a 8a 1f 00 1e
E: 9.208712 8 03 90 ea 1a 84 1f 00 1e
E: 9.209969 8 03 90 ec 1a 84 1f 00 1e
E: 9.228713 8 03 90 f3 1a 88 1f 00 1e
E: 9.229967 8 03 90 f6 1a 83 1f 00 1e
E: 9.258713 8 03 90 f0 1a 8a 1f 00 1e
E: 9.259969 8 03 90 f2 1a 8b 1f 00 1e
E: 9.268690 8 03 90 f1 1a 88 1f 00 1e
E: 9.278689 8 03 90 f2 1a 8b 1f 00 1e
E: 9.288715 8 03 90 f8 1a 88 1f 00 1e
E: 9.298689 8 03 90 f7 1a 89 1f 00 1e
E: 9.299974 8 03 90 fc 1a 8c 1f 00 1e
E: 9.308712 8 03 90 04 1b 84 1f 00 1e
E: 9.358719 8 03 90 06 1b 7d 1f 00 1e
E: 9.368711 8 03 90 0c 1b 75 1f 00 1e
E: 9.408717 8 03 00 00 00 00 00 00 1e
E: 9.438614 8 03 00 00 00 00 00 00 1c
E: 9.518711 8 03 90 2d 1b 45 1f 00 1c
E: 9.528594 8 03 90 21 1b 4b 1f 00 1c
E: 9.538712 8 03 90 26 1b 4c 1f 00 1c
E: 9.549966 8 03 90 20 1b 4b 1f 00 1c
E: 9.558713 8 03 90 23 1b 4e 1f 00 1c
E: 9.568657 8 03 90 21 1b 4f 1f 00 1c
E: 9.578713 8 03 90 1c 1b 5a 1f 00 1c
E: 9.588711 8 03 90 20 1b 58 1f 00 1c
E: 9.638728 8 03 90 1a 1b 6c 1f 00 1d
E: 9.648711 8 03 90 1a 1b 75 1f 00 1d
E: 9.658704 8 03 90 1b 1b 81 1f 00 1d
E: 9.659955 8 03 90 1d 1b 8f 1f 00 1d
E: 9.678712 8 03 90 1d 1b 9a 1f 00 1d
E: 9.688711 8 03 90 1e 1b a5 1f 00 1d
E: 9.698706 8 03 90 23 1b ad 1f 00 1d
E: 9.708704 8 03 90 25 1b b8 1f 00 1d
E: 9.718699 8 03 90 32 1b c4 1f 00 1d
E: 9.728659 8 03 90 38 1b cd 1f 00 1d
E: 9.738667 8 03 90 44 1b d5 1f 00 1d
E: 9.748703 8 03 90 52 1b e0 1f 00 1d
E: 9.758703 8 03 90 5a 1b ec 1f 00 1d
E: 9.768702 8 03 90 6b 1b e3 1f 00 1d
E: 9.778701 8 03 90 74 1b de 1f 00 1d
E: 9.788700 8 03 90 81 1b d0 1f 00 1d
E: 9.798702 8 03 90 7e 1b c4 1f 00 1d
E: 9.808682 8 03 90 77 1b b7 1f 00 1d
E: 9.818704 8 03 90 6c 1b a7 1f 00 1d
E: 9.828703 8 03 90 53 1b 93 1f 00 1d
E: 9.838702 8 03 90 39 1b 81 1f 00 1d
E: 9.878710 8 03 90 dc 1a 79 1f 00 1d
E: 9.888709 8 03 90 8b 1a 86 1f 00 1d
E: 9.938720 8 03 90 8f 1a b7 1f 00 1c
E: 9.948709 8 03 90 93 1a f4 1f 00 1c
E: 9.949963 8 03 90 ad 1a fd 1f 00 1c
E: 9.968709 8 03 90 bf 1a 09 20 00 1c
E: 9.978704 8 03 90 db 1a 0a 20 00 1c
E: 9.988702 8 03 90 e8 1a 0d 20 00 1c
E: 9.998701 8 03 90 ed 1a 0b 20 00 1c
E: 10.008686 8 03 90 e9 1a 05 20 00 1c
E: 10.018704 8 03 10 d3 1a 01 20 00 1c
E: 10.028704 8 03 10 c9 1a e9 1f 00 1c
E: 10.029957 8 03 00 00 00 00 00 00 1c
E: 10.628713 8 03 00 00 00 00 00 00 1e
E: 10.788706 8 03 00 00 00 00 00 00 1c
E: 10.998733 8 03 00 00 00 00 00 00 1d
E: 11.188683 8 03 00 00 00 00 00 00 1c
E: 24.630016 8 03 d0 4c 27 f3 20 6c 1c
E: 24.631168 8 03 d0 82 25 f5 1f 70 1c
E: 24.632400 8 03 d0 30 24 a8 1f 74 1c
E: 24.633573 8 03 d0 c1 22 65 1f 78 1c
E: 24.657492 8 03 d0 52 21 29 1f 78 1c
E: 24.673724 8 03 d0 3d 1f 6c 1e 70 1c
E: 24.691277 8 03 d0 d0 1e b4 1d 5c 1c
E: 24.708716 8 03 50 d1 1e 70 1c 44 1c
E: 24.709896 8 03 00 00 00 00 00 00 1c
E: 26.258755 8 03 d0 88 28 89 18 60 1c
E: 26.259936 8 03 d0 f7 28 e1 17 64 1c
E: 26.278748 8 03 d0 1e 29 30 17 68 1c
E: 26.279937 8 03 d0 fc 28 a1 16 6c 1c
E: 26.298742 8 03 d0 95 28 29 16 74 1c
E: 26.308745 8 03 d0 cb 27 c5 15 78 1c
E: 26.318736 8 03 d0 bf 26 80 15 78 1c
E: 26.328736 8 03 d0 60 25 76 15 7c 1c
E: 26.338733 8 03 d0 0a 24 9e 15 84 1c
E: 26.339998 8 03 d0 ae 22 02 16 84 1c
E: 26.358716 8 03 d0 68 21 78 16 84 1c
E: 26.368721 8 03 d0 5f 20 0e 17 84 1c
E: 26.378722 8 03 d0 a2 1f be 17 88 1c
E: 26.388719 8 03 d0 30 1f 6a 18 8c 1c
E: 26.398721 8 03 d0 05 1f f5 18 90 1c
E: 26.408719 8 03 d0 23 1f 6f 19 94 1c
E: 26.409982 8 03 d0 7a 1f b7 19 8c 1c
E: 26.428718 8 03 d0 fb 1f c0 19 80 1c
E: 26.429982 8 03 d0 b6 20 78 19 70 1c
E: 26.448720 8 03 d0 9b 21 ba 18 54 1c
E: 26.458720 8 03 50 89 22 b6 17 40 1c
E: 26.459980 8 03 00 00 00 00 00 00 1c
E: 30.338723 8 03 d0 db 1c e7 17 48 1c
E: 30.348681 8 03 d0 f1 1c 7d 18 58 1c
E: 30.358729 8 03 d0 36 1d 0c 19 64 1c
E: 30.368704 8 03 d0 90 1d a6 19 68 1c
E: 30.378720 8 03 d0 fc 1d 1c 1a 6c 1c
E: 30.388717 8 03 d0 a3 1e 77 1a 70 1c
E: 30.408721 8 03 d0 6c 1f c1 1a 74 1c
E: 30.409956 8 03 d0 31 20 fb 1a 78 1c
E: 30.428720 8 03 d0 18 21 12 1b 7c 1c
E: 30.429956 8 03 d0 f3 21 08 1b 80 1c
E: 30.448720 8 03 d0 ed 22 ec 1a 84 1c
E: 30.449957 8 03 d0 b2 23 b5 1a 88 1c
E: 30.468721 8 03 d0 6e 24 6d 1a 88 1c
E: 30.469956 8 03 d0 f7 24 14 1a 94 1c
E: 30.478724 8 03 d0 57 25 b4 19 90 1c
E: 30.488719 8 03 d0 a0 25 3c 19 90 1c
E: 30.508722 8 03 d0 be 25 ce 18 98 1c
E: 30.509957 8 03 d0 b9 25 59 18 94 1c
E: 30.528720 8 03 d0 8c 25 e4 17 94 1c
E: 30.529866 8 03 d0 3a 25 7c 17 94 1c
E: 30.538647 8 03 d0 cd 24 16 17 98 1c
E: 30.548717 8 03 d0 2f 24 be 16 98 1c
E: 30.568739 8 03 d0 75 23 81 16 a0 1c
E: 30.578737 8 03 d0 a5 22 63 16 a0 1c
E: 30.579905 8 03 d0 c2 21 66 16 a0 1c
E: 30.598744 8 03 d0 fe 20 83 16 9c 1c
E: 30.599896 8 03 d0 2b 20 c2 16 9c 1c
E: 30.618743 8 03 d0 81 1f 1f 17 9c 1c
E: 30.619920 8 03 d0 dd 1e 92 17 9c 1c
E: 30.638744 8 03 d0 4f 1e 15 18 9c 1c
E: 30.648741 8 03 d0 f3 1d 9f 18 a4 1c
E: 30.658731 8 03 d0 b6 1d 27 19 a4 1c
E: 30.659900 8 03 d0 a3 1d b5 19 a0 1c
E: 30.668740 8 03 d0 ad 1d 30 1a 9c 1c
E: 30.678737 8 03 d0 db 1d a7 1a 9c 1c
E: 30.688735 8 03 d0 20 1e 04 1b 9c 1c
E: 30.708739 8 03 d0 82 1e 4b 1b 9c 1c
E: 30.709868 8 03 d0 ff 1e 7a 1b a0 1c
E: 30.728732 8 03 d0 84 1f 94 1b a0 1c
E: 30.729970 8 03 d0 13 20 96 1b a0 1c
E: 30.748737 8 03 d0 a2 20 86 1b a0 1c
E: 30.758739 8 03 d0 3b 21 65 1b 9c 1c
E: 30.759972 8 03 d0 cd 21 31 1b a0 1c
E: 30.768737 8 03 d0 57 22 f1 1a a0 1c
E: 30.788739 8 03 d0 d4 22 a7 1a 9c 1c
E: 30.789905 8 03 d0 29 23 4f 1a a0 1c
E: 30.808739 8 03 d0 62 23 f5 19 a4 1c
E: 30.818743 8 03 d0 79 23 9f 19 a8 1c
E: 30.828732 8 03 d0 74 23 38 19 a0 1c
E: 30.838729 8 03 d0 62 23 e2 18 a4 1c
E: 30.839928 8 03 d0 3d 23 8d 18 9c 1c
E: 30.848738 8 03 d0 0a 23 3c 18 9c 1c
E: 30.858732 8 03 d0 d0 22 ef 17 9c 1c
E: 30.878734 8 03 d0 88 22 b1 17 9c 1c
E: 30.879971 8 03 d0 40 22 86 17 9c 1c
E: 30.898741 8 03 d0 f4 21 6a 17 a0 1c
E: 30.899857 8 03 d0 a0 21 5f 17 9c 1c
E: 30.918740 8 03 d0 5a 21 6d 17 9c 1c
E: 30.928746 8 03 d0 0d 21 86 17 9c 1c
E: 30.938730 8 03 d0 c5 20 b5 17 a0 1c
E: 30.939899 8 03 d0 68 20 f2 17 a0 1c
E: 30.958735 8 03 d0 2f 20 44 18 a0 1c
E: 30.959891 8 03 d0 08 20 a0 18 a4 1c
E: 30.978737 8 03 d0 f6 1f fd 18 a0 1c
E: 30.988738 8 03 d0 f6 1f 75 19 9c 1c
E: 30.998730 8 03 d0 0d 20 e3 19 a4 1c
E: 31.008731 8 03 d0 3a 20 53 1a 9c 1c
E: 31.018726 8 03 d0 84 20 c8 1a 9c 1c
E: 31.019966 8 03 d0 e7 20 2e 1b 9c 1c
E: 31.038742 8 03 d0 48 21 8b 1b a0 1c
E: 31.048739 8 03 d0 bd 21 d8 1b a0 1c
E: 31.058730 8 03 d0 38 22 17 1c 9c 1c
E: 31.059898 8 03 d0 b5 22 41 1c a4 1c
E: 31.078737 8 03 d0 2c 23 56 1c a4 1c
E: 31.088731 8 03 d0 91 23 60 1c a4 1c
E: 31.098729 8 03 d0 df 23 5a 1c a4 1c
E: 31.108729 8 03 d0 0b 24 46 1c 9c 1c
E: 31.109968 8 03 d0 39 24 37 1c a0 1c
E: 31.128736 8 03 d0 44 24 32 1c a0 1c
E: 31.129890 8 03 d0 40 24 33 1c 9c 1c
E: 31.148738 8 03 d0 42 24 32 1c a0 1c
E: 31.158738 8 03 d0 41 24 34 1c 9c 1c
E: 31.168730 8 03 d0 44 24 32 1c a0 1c
E: 31.178730 8 03 d0 42 24 32 1c 9c 1c
E: 31.179954 8 03 d0 45 24 34 1c 9c 1c
E: 31.198736 8 03 d0 42 24 31 1c a0 1c
E: 31.208737 8 03 d0 4d 24 34 1c 9c 1c
E: 31.218729 8 03 d0 49 24 33 1c a0 1c
E: 31.228731 8 03 d0 44 24 33 1c 9c 1c
E: 31.238730 8 03 d0 41 24 33 1c 9c 1c
E: 31.248730 8 03 d0 46 24 32 1c a0 1c
E: 31.258729 8 03 d0 40 24 34 1c 9c 1c
E: 31.268730 8 03 d0 43 24 34 1c a0 1c
E: 31.278710 8 03 d0 45 24 33 1c a0 1c
E: 31.288733 8 03 d0 3e 24 33 1c 9c 1c
E: 31.298744 8 03 d0 48 24 31 1c 9c 1c
E: 31.308729 8 03 d0 44 24 32 1c a0 1c
E: 31.318712 8 03 d0 45 24 33 1c a0 1c
E: 31.319963 8 03 d0 41 24 32 1c 9c 1c
E: 31.338739 8 03 d0 3e 24 33 1c 9c 1c
E: 31.339970 8 03 d0 3d 24 30 1c a0 1c
E: 31.358732 8 03 d0 3c 24 33 1c 9c 1c
E: 31.368738 8 03 d0 43 24 32 1c a0 1c
E: 31.378730 8 03 d0 44 24 33 1c 9c 1c
E: 31.388727 8 03 d0 46 24 32 1c a0 1c
E: 31.398711 8 03 d0 45 24 32 1c a0 1c
E: 31.408737 8 03 d0 3d 24 33 1c a0 1c
E: 31.418730 8 03 d0 46 24 33 1c 9c 1c
E: 31.428712 8 03 d0 42 24 32 1c 9c 1c
E: 31.438739 8 03 d0 45 24 31 1c a0 1c
E: 31.448736 8 03 d0 41 24 31 1c 9c 1c
E: 31.458709 8 03 d0 41 24 33 1c 9c 1c
E: 31.468735 8 03 d0 48 24 33 1c 9c 1c
E: 31.478735 8 03 d0 36 24 34 1c 9c 1c
E: 31.488748 8 03 d0 13 24 33 1c 9c 1c
E: 31.489907 8 03 d0 d7 23 33 1c 9c 1c
E: 31.508734 8 03 d0 8d 23 33 1c 9c 1c
E: 31.509973 8 03 d0 37 23 27 1c a0 1c
E: 31.528734 8 03 d0 dd 22 24 1c 9c 1c
E: 31.538725 8 03 d0 7d 22 1f 1c 9c 1c
E: 31.548726 8 03 d0 0f 22 2a 1c 9c 1c
E: 31.558738 8 03 d0 99 21 3a 1c 9c 1c
E: 31.568727 8 03 d0 25 21 56 1c a4 1c
E: 31.569963 8 03 d0 97 20 76 1c a4 1c
E: 31.588732 8 03 d0 1e 20 97 1c a0 1c
E: 31.598729 8 03 d0 ac 1f c1 1c a4 1c
E: 31.608731 8 03 d0 45 1f f6 1c a4 1c
E: 31.618728 8 03 d0 ed 1e 36 1d a0 1c
E: 31.628727 8 03 d0 b6 1e 74 1d a0 1c
E: 31.638712 8 03 d0 97 1e b8 1d 9c 1c
E: 31.648728 8 03 d0 95 1e fe 1d 9c 1c
E: 31.658730 8 03 d0 ab 1e 45 1e 9c 1c
E: 31.668728 8 03 d0 d4 1e 88 1e 9c 1c
E: 31.678727 8 03 d0 14 1f c5 1e 9c 1c
E: 31.688695 8 03 d0 6f 1f f5 1e 9c 1c
E: 31.698723 8 03 d0 d3 1f 1f 1f a0 1c
E: 31.708713 8 03 d0 54 20 3d 1f a0 1c
E: 31.718725 8 03 d0 f5 20 5c 1f 9c 1c
E: 31.728730 8 03 d0 94 21 73 1f a0 1c
E: 31.729962 8 03 d0 46 22 7f 1f a0 1c
E: 31.748731 8 03 d0 f5 22 84 1f a0 1c
E: 31.758720 8 03 d0 94 23 7b 1f a0 1c
E: 31.768710 8 03 d0 14 24 6a 1f 9c 1c
E: 31.778727 8 03 d0 93 24 4c 1f a0 1c
E: 31.779965 8 03 d0 e3 24 29 1f a0 1c
E: 31.798732 8 03 d0 1a 25 02 1f a0 1c
E: 31.808728 8 03 d0 3a 25 d5 1e a0 1c
E: 31.818726 8 03 d0 43 25 a4 1e a0 1c
E: 31.828723 8 03 d0 3b 25 74 1e a0 1c
E: 31.829950 8 03 d0 21 25 3f 1e a0 1c
E: 31.848731 8 03 d0 f8 24 0b 1e a0 1c
E: 31.858729 8 03 d0 c2 24 d4 1d a0 1c
E: 31.868725 8 03 d0 79 24 a0 1d a4 1c
E: 31.869963 8 03 d0 0f 24 71 1d a4 1c
E: 31.888728 8 03 d0 b3 23 46 1d a0 1c
E: 31.898688 8 03 d0 4e 23 26 1d a4 1c
E: 31.908722 8 03 d0 e3 22 14 1d a4 1c
E: 31.918724 8 03 d0 73 22 08 1d a4 1c
E: 31.928727 8 03 d0 08 22 0c 1d a4 1c
E: 31.938723 8 03 d0 b2 21 1a 1d a4 1c
E: 31.948725 8 03 d0 6f 21 2e 1d 9c 1c
E: 31.958723 8 03 d0 46 21 51 1d a0 1c
E: 31.968742 8 03 d0 37 21 6b 1d a0 1c
E: 31.969962 8 03 d0 36 21 84 1d a0 1c
E: 31.988726 8 03 d0 4c 21 a2 1d a4 1c
E: 31.998725 8 03 d0 67 21 b9 1d 9c 1c
E: 32.008723 8 03 d0 8f 21 d8 1d 9c 1c
E: 32.018723 8 03 d0 bf 21 ed 1d a0 1c
E: 32.028719 8 03 d0 f5 21 05 1e a0 1c
E: 32.038725 8 03 d0 2e 22 16 1e a0 1c
E: 32.048722 8 03 d0 5a 22 23 1e a0 1c
E: 32.058724 8 03 d0 7e 22 2c 1e 9c 1c
E: 32.068724 8 03 d0 8f 22 32 1e a0 1c
E: 32.078708 8 03 d0 90 22 30 1e 9c 1c
E: 32.088706 8 03 d0 90 22 31 1e 9c 1c
E: 32.098724 8 03 d0 88 22 2e 1e 9c 1c
E: 32.108724 8 03 d0 7f 22 2e 1e 9c 1c
E: 32.118725 8 03 d0 74 22 2b 1e 9c 1c
E: 32.128722 8 03 d0 6c 22 27 1e a0 1c
E: 32.138722 8 03 d0 68 22 24 1e a0 1c
E: 32.148725 8 03 d0 5d 22 1e 1e a0 1c
E: 32.158721 8 03 d0 56 22 1c 1e a0 1c
E: 32.168718 8 03 d0 4d 22 15 1e a0 1c
E: 32.178724 8 03 d0 43 22 10 1e a0 1c
E: 32.188724 8 03 d0 3e 22 08 1e a0 1c
E: 32.198722 8 03 d0 32 22 01 1e a0 1c
E: 32.208706 8 03 d0 29 22 fe 1d a0 1c
E: 32.218749 8 03 d0 1f 22 f9 1d a0 1c
E: 32.228723 8 03 d0 10 22 f7 1d a0 1c
E: 32.238723 8 03 d0 09 22 f1 1d a0 1c
E: 32.248720 8 03 d0 fa 21 ec 1d a0 1c
E: 32.258723 8 03 d0 f3 21 e6 1d a0 1c
E: 32.268722 8 03 d0 ea 21 e0 1d a0 1c
E: 32.278722 8 03 d0 e3 21 d9 1d a0 1c
E: 32.288723 8 03 d0 db 21 d2 1d a0 1c
E: 32.298720 8 03 d0 d1 21 cd 1d 9c 1c
E: 32.308717 8 03 d0 cd 21 ca 1d 9c 1c
E: 32.318721 8 03 d0 cb 21 c8 1d 9c 1c
E: 32.328724 8 03 d0 ca 21 ca 1d a0 1c
E: 32.338707 8 03 d0 cc 21 c8 1d a0 1c
E: 32.348721 8 03 d0 cd 21 cd 1d a0 1c
E: 32.358723 8 03 d1 cf 21 cd 1d a0 1c
E: 32.368717 8 03 d1 c9 21 cd 1d a0 1c
E: 32.378741 8 03 d1 cf 21 cc 1d a0 1c
E: 32.388721 8 03 d1 cb 21 c9 1d a0 1c
E: 32.398720 8 03 d1 ca 21 cc 1d a0 1c
E: 32.408704 8 03 d1 cc 21 ca 1d a0 1c
E: 32.418703 8 03 d1 ca 21 cb 1d a0 1c
E: 32.428703 8 03 d1 cb 21 cb 1d a0 1c
E: 32.438697 8 03 d1 cd 21 ca 1d a0 1c
E: 32.448703 8 03 d1 ca 21 cb 1d a0 1c
E: 32.458726 8 03 d0 cc 21 cb 1d a0 1c
E: 32.468723 8 03 d0 cd 21 c7 1d a0 1c
E: 32.478703 8 03 d0 cc 21 cc 1d a0 1c
E: 32.488703 8 03 d0 cd 21 cc 1d a0 1c
E: 32.498724 8 03 d0 ca 21 cf 1d a0 1c
E: 32.508703 8 03 d0 ca 21 cf 1d a0 1c
E: 32.518725 8 03 d0 c9 21 cf 1d a0 1c
E: 32.528701 8 03 d0 ca 21 cf 1d a0 1c
E: 32.538719 8 03 d0 c8 21 cf 1d a0 1c
E: 32.548722 8 03 d0 ca 21 d0 1d a0 1c
E: 32.558701 8 03 d0 c8 21 ce 1d a0 1c
E: 32.568727 8 03 d0 c2 21 ce 1d a0 1c
E: 32.578739 8 03 d0 bd 21 cc 1d a0 1c
E: 32.588724 8 03 d0 b2 21 c7 1d a0 1c
E: 32.598720 8 03 d0 a8 21 c7 1d a0 1c
E: 32.608719 8 03 d0 9c 21 c4 1d a0 1c
E: 32.618720 8 03 d0 96 21 c6 1d a0 1c
E: 32.628702 8 03 d0 97 21 c5 1d a0 1c
E: 32.648704 8 03 d0 97 21 c6 1d a0 1c
E: 32.649946 8 03 d0 99 21 c6 1d a0 1c
E: 32.668746 8 03 d0 96 21 c6 1d a0 1c
E: 32.669860 8 03 d0 98 21 c7 1d a0 1c
E: 32.678704 8 03 d0 97 21 c6 1d a0 1c
E: 32.688706 8 03 d0 96 21 c7 1d a0 1c
E: 32.698710 8 03 d0 98 21 c4 1d a0 1c
E: 32.708711 8 03 d0 98 21 c0 1d 9c 1c
E: 32.718734 8 03 d0 96 21 bf 1d a0 1c
E: 32.728708 8 03 d0 91 21 b8 1d a4 1c
E: 32.738710 8 03 d0 90 21 b9 1d a0 1c
E: 32.748709 8 03 d0 93 21 b8 1d a8 1c
E: 32.758708 8 03 d0 8f 21 b8 1d a4 1c
E: 32.768742 8 03 d2 94 21 b6 1d a4 1c
E: 32.778729 8 03 d2 8f 21 b4 1d a4 1c
E: 32.788725 8 03 d2 92 21 b7 1d a4 1c
E: 32.798707 8 03 d2 93 21 b5 1d a4 1c
E: 32.808716 8 03 d2 91 21 ba 1d 9c 1c
E: 32.818736 8 03 d2 94 21 b8 1d a4 1c
E: 32.828703 8 03 d2 94 21 b8 1d a4 1c
E: 32.838710 8 03 d2 96 21 bd 1d a0 1c
E: 32.848727 8 03 d2 96 21 ba 1d a0 1c
E: 32.858708 8 03 d2 94 21 ba 1d 9c 1c
E: 32.868734 8 03 d2 97 21 bc 1d a0 1c
E: 32.878709 8 03 d2 94 21 bb 1d 9c 1c
E: 32.888734 8 03 d2 94 21 c0 1d a0 1c
E: 32.898734 8 03 d2 95 21 bd 1d 9c 1c
E: 32.908709 8 03 d0 95 21 bf 1d a0 1c
E: 32.918649 8 03 d0 94 21 bd 1d 9c 1c
E: 32.928618 8 03 d0 91 21 bd 1d a0 1c
E: 32.938614 8 03 d0 97 21 bf 1d a0 1c
E: 32.948591 8 03 d0 97 21 be 1d a0 1c
E: 32.958585 8 03 d0 95 21 bc 1d 9c 1c
E: 32.968737 8 03 d0 96 21 bd 1d a0 1c
E: 32.978723 8 03 d0 8f 21 b6 1d a4 1c
E: 32.988741 8 03 d0 87 21 b0 1d a4 1c
E: 32.998719 8 03 d0 7e 21 9f 1d a4 1c
E: 33.008647 8 03 d0 6d 21 8f 1d a4 1c
E: 33.018733 8 03 d0 63 21 7e 1d a4 1c
E: 33.028736 8 03 d0 54 21 69 1d a0 1c
E: 33.038713 8 03 d0 48 21 51 1d a0 1c
E: 33.048729 8 03 d0 3e 21 32 1d a8 1c
E: 33.058733 8 03 d0 28 21 08 1d a4 1c
E: 33.068737 8 03 d0 10 21 dd 1c a8 1c
E: 33.078738 8 03 d0 fa 20 b3 1c a0 1c
E: 33.088714 8 03 d0 d6 20 96 1c a0 1c
E: 33.108733 8 03 d0 bc 20 71 1c a4 1c
E: 33.109971 8 03 d0 98 20 54 1c a4 1c
E: 33.118738 8 03 d0 79 20 37 1c 9c 1c
E: 33.128708 8 03 d0 63 20 20 1c a0 1c
E: 33.138734 8 03 d0 60 20 16 1c a0 1c
E: 33.148707 8 03 d0 57 20 09 1c a0 1c
E: 33.158733 8 03 d0 54 20 05 1c a0 1c
E: 33.168731 8 03 d0 55 20 06 1c a0 1c
E: 33.178732 8 03 d0 57 20 04 1c a0 1c
E: 33.188668 8 03 d0 52 20 05 1c a0 1c
E: 33.198729 8 03 d0 56 20 06 1c a0 1c
E: 33.208741 8 03 d0 4f 20 0a 1c a0 1c
E: 33.218737 8 03 d0 52 20 0d 1c a0 1c
E: 33.228707 8 03 d0 50 20 10 1c a0 1c
E: 33.238733 8 03 d0 4f 20 15 1c a0 1c
E: 33.258726 8 03 d0 49 20 1a 1c a0 1c
E: 33.259973 8 03 d0 48 20 1e 1c a0 1c
E: 33.268730 8 03 d0 4a 20 1a 1c a0 1c
E: 33.278732 8 03 d0 4a 20 19 1c a0 1c
E: 33.288729 8 03 d0 49 20 1d 1c a0 1c
E: 33.298729 8 03 d0 4b 20 1c 1c a0 1c
E: 33.308729 8 03 d0 4a 20 1a 1c a0 1c
E: 33.318733 8 03 d1 4c 20 1d 1c a0 1c
E: 33.328652 8 03 d1 49 20 19 1c a0 1c
E: 33.338641 8 03 d1 4c 20 1b 1c a0 1c
E: 33.348630 8 03 d1 4e 20 1c 1c a0 1c
E: 33.358729 8 03 d1 4f 20 1a 1c a0 1c
E: 33.368775 8 03 d1 4c 20 1c 1c a0 1c
E: 33.378732 8 03 d1 49 20 1f 1c a0 1c
E: 33.388722 8 03 d1 4a 20 1c 1c a0 1c
E: 33.398725 8 03 d0 4d 20 1c 1c a0 1c
E: 33.408630 8 03 d0 4d 20 1a 1c a0 1c
E: 33.418725 8 03 d0 4a 20 1a 1c a0 1c
E: 33.428750 8 03 d0 51 20 1b 1c a0 1c
E: 33.438746 8 03 d0 4a 20 1a 1c a0 1c
E: 33.448725 8 03 d0 4b 20 1d 1c a0 1c
E: 33.458725 8 03 d0 49 20 1b 1c a0 1c
E: 33.468750 8 03 d0 48 20 1b 1c a0 1c
E: 33.478741 8 03 d0 4f 20 1a 1c a0 1c
E: 33.488739 8 03 d0 4d 20 19 1c a0 1c
E: 33.498665 8 03 d0 49 20 1c 1c a0 1c
E: 33.518723 8 03 d0 4b 20 1c 1c a0 1c
E: 33.519993 8 03 d0 47 20 1c 1c a0 1c
E: 33.528748 8 03 d0 52 20 1a 1c a0 1c
E: 33.538741 8 03 d0 4d 20 1a 1c a0 1c
E: 33.548742 8 03 d0 4b 20 1b 1c a0 1c
E: 33.558725 8 03 d0 4c 20 1b 1c a0 1c
E: 33.568749 8 03 d0 47 20 1b 1c a0 1c
E: 33.578747 8 03 d0 48 20 1c 1c a0 1c
E: 33.598744 8 03 d0 4d 20 1c 1c a0 1c
E: 33.599966 8 03 d0 4a 20 1c 1c a0 1c
E: 33.618727 8 03 d0 4d 20 1c 1c a0 1c
E: 33.619987 8 03 d0 4d 20 17 1c a0 1c
E: 33.638727 8 03 d0 4d 20 1c 1c a0 1c
E: 33.639985 8 03 d0 4e 20 1d 1c a2 1c
E: 33.658734 8 03 d0 49 20 1b 1c a0 1c
E: 33.659982 8 03 d0 4e 20 1c 1c a0 1c
E: 33.678725 8 03 d0 4d 20 1a 1c a0 1c
E: 33.679994 8 03 d0 49 20 1c 1c a2 1c
E: 33.698725 8 03 d0 4b 20 1d 1c a0 1c
E: 33.699986 8 03 d0 4b 20 18 1c a2 1c
E: 33.718739 8 03 d0 49 20 1b 1c a0 1c
E: 33.719886 8 03 d0 4b 20 1d 1c a0 1c
E: 33.738740 8 03 d0 4a 20 1a 1c a2 1c
E: 33.739919 8 03 d0 4b 20 1f 1c a0 1c
E: 33.758715 8 03 d0 49 20 1e 1c a0 1c
E: 33.759964 8 03 d0 4d 20 1c 1c a0 1c
E: 33.778748 8 03 d0 50 20 20 1c a2 1c
E: 33.779919 8 03 d0 4e 20 1f 1c a0 1c
E: 33.798717 8 03 d0 4f 20 20 1c a0 1c
E: 33.799965 8 03 d0 4f 20 1f 1c a0 1c
E: 33.818740 8 03 d0 49 20 21 1c a0 1c
E: 33.819884 8 03 d0 4c 20 21 1c a0 1c
E: 33.838728 8 03 d0 4b 20 1e 1c a0 1c
E: 33.839967 8 03 d0 4c 20 1f 1c a0 1c
E: 33.858725 8 03 d0 4b 20 21 1c a0 1c
E: 33.859965 8 03 d0 4b 20 20 1c a0 1c
E: 33.868730 8 03 d0 51 20 20 1c a0 1c
E: 33.888723 8 03 d0 50 20 1e 1c a0 1c
E: 33.889978 8 03 d0 49 20 1f 1c a0 1c
E: 33.908722 8 03 d0 4e 20 1e 1c a0 1c
E: 33.909981 8 03 d0 4d 20 20 1c a1 1c
E: 33.918721 8 03 d0 4e 20 21 1c a0 1c
E: 33.928680 8 03 d0 4c 20 1e 1c a1 1c
E: 33.938678 8 03 d0 49 20 23 1c a1 1c
E: 33.948726 8 03 d0 4d 20 21 1c a0 1c
E: 33.968738 8 03 d0 49 20 1e 1c a1 1c
E: 33.969896 8 03 d0 50 20 20 1c a1 1c
E: 33.988728 8 03 d0 4f 20 1f 1c a0 1c
E: 33.989978 8 03 d0 4a 20 22 1c a1 1c
E: 34.008737 8 03 d0 50 20 20 1c a1 1c
E: 34.009878 8 03 d0 4e 20 1f 1c a0 1c
E: 34.028737 8 03 d0 4e 20 23 1c a1 1c
E: 34.038737 8 03 d0 4c 20 21 1c a0 1c
E: 34.039901 8 03 d0 47 20 24 1c a1 1c
E: 34.058739 8 03 d0 51 20 25 1c a0 1c
E: 34.059967 8 03 d0 50 20 22 1c a0 1c
E: 34.078738 8 03 d0 51 20 24 1c a0 1c
E: 34.088717 8 03 d0 50 20 26 1c a0 1c
E: 34.089975 8 03 d0 4d 20 25 1c a0 1c
E: 34.108724 8 03 d0 51 20 25 1c a0 1c
E: 34.109980 8 03 d0 4b 20 22 1c a0 1c
E: 34.128726 8 03 d0 4d 20 24 1c a0 1c
E: 34.129980 8 03 d0 51 20 22 1c a0 1c
E: 34.148723 8 03 d0 4e 20 23 1c a0 1c
E: 34.149967 8 03 d0 4f 20 25 1c a0 1c
E: 34.168720 8 03 d0 4e 20 22 1c a0 1c
E: 34.169963 8 03 d0 4e 20 23 1c a0 1c
E: 34.188724 8 03 d0 51 20 24 1c a0 1c
E: 34.198737 8 03 d0 4b 20 22 1c a0 1c
E: 34.208734 8 03 d0 52 20 24 1c a0 1c
E: 34.209979 8 03 d0 4c 20 23 1c a0 1c
E: 34.228722 8 03 d0 51 20 24 1c a0 1c
E: 34.238720 8 03 d0 50 20 24 1c a0 1c
E: 34.239963 8 03 d0 50 20 22 1c a0 1c
E: 34.248722 8 03 d0 4d 20 26 1c a0 1c
E: 34.268730 8 03 d0 4e 20 23 1c a0 1c
E: 34.278741 8 03 d0 4c 20 25 1c a0 1c
E: 34.288740 8 03 d0 52 20 24 1c a0 1c
E: 34.289976 8 03 d0 4f 20 21 1c a0 1c
E: 34.298741 8 03 d0 53 20 22 1c a0 1c
E: 34.318739 8 03 d0 5b 20 1e 1c a0 1c
E: 34.328739 8 03 d0 5a 20 1a 1c a0 1c
E: 34.329979 8 03 d0 69 20 15 1c a0 1c
E: 34.348744 8 03 d0 74 20 0a 1c a0 1c
E: 34.349978 8 03 d0 7e 20 f9 1b a0 1c
E: 34.368742 8 03 d0 a3 20 e9 1b a0 1c
E: 34.378743 8 03 d0 bc 20 cf 1b a0 1c
E: 34.379973 8 03 d0 cf 20 b5 1b a0 1c
E: 34.398742 8 03 d0 e9 20 92 1b a0 1c
E: 34.408742 8 03 d0 f7 20 69 1b a0 1c
E: 34.409974 8 03 d0 06 21 3a 1b a0 1c
E: 34.428742 8 03 d0 06 21 04 1b a0 1c
E: 34.438741 8 03 d0 02 21 d2 1a a0 1c
E: 34.448736 8 03 d0 fb 20 96 1a a0 1c
E: 34.458735 8 03 d0 e0 20 55 1a a0 1c
E: 34.468729 8 03 d0 c2 20 18 1a a8 1c
E: 34.478734 8 03 d0 7c 20 dc 19 a4 1c
E: 34.488736 8 03 d0 3b 20 b1 19 a0 1c
E: 34.498736 8 03 d0 e8 1f 84 19 a8 1c
E: 34.499971 8 03 d0 85 1f 5b 19 a4 1c
E: 34.508740 8 03 d0 15 1f 45 19 a8 1c
E: 34.528659 8 03 d0 8d 1e 37 19 a8 1c
E: 34.538644 8 03 d0 04 1e 3e 19 a4 1c
E: 34.548738 8 03 d0 86 1d 56 19 a4 1c
E: 34.558734 8 03 d0 f8 1c 84 19 a4 1c
E: 34.559976 8 03 d0 7b 1c b9 19 a0 1c
E: 34.578753 8 03 d0 16 1c ee 19 a4 1c
E: 34.588732 8 03 d0 c7 1b 37 1a 9c 1c
E: 34.598736 8 03 d0 99 1b 8f 1a 9c 1c
E: 34.608735 8 03 d0 85 1b ed 1a 9c 1c
E: 34.618734 8 03 d0 93 1b 52 1b a0 1c
E: 34.628733 8 03 d0 b6 1b b9 1b a0 1c
E: 34.638717 8 03 d0 f8 1b 24 1c a0 1c
E: 34.648736 8 03 d0 51 1c 83 1c a4 1c
E: 34.658733 8 03 d0 b9 1c dc 1c a8 1c
E: 34.668730 8 03 d0 55 1d 3a 1d a0 1c
E: 34.678730 8 03 d0 ee 1d 6c 1d a4 1c
E: 34.688712 8 03 d0 9b 1e 87 1d a4 1c
E: 34.698733 8 03 d0 58 1f 93 1d a4 1c
E: 34.708735 8 03 d0 01 20 8a 1d a4 1c
E: 34.718734 8 03 d0 9c 20 75 1d a4 1c
E: 34.728735 8 03 d0 2f 21 55 1d a0 1c
E: 34.729974 8 03 d0 a3 21 25 1d a8 1c
E: 34.748732 8 03 d0 0d 22 e9 1c a8 1c
E: 34.758730 8 03 d0 64 22 a3 1c a4 1c
E: 34.768733 8 03 d0 99 22 69 1c a4 1c
E: 34.778738 8 03 d0 b8 22 25 1c a0 1c
E: 34.779972 8 03 d0 c4 22 d9 1b a0 1c
E: 34.798733 8 03 d0 ba 22 8a 1b a0 1c
E: 34.808732 8 03 d0 a1 22 3c 1b a0 1c
E: 34.818736 8 03 d0 75 22 f3 1a a0 1c
E: 34.828682 8 03 d0 3e 22 b0 1a a0 1c
E: 34.829958 8 03 d0 f2 21 6d 1a a0 1c
E: 34.848676 8 03 d0 9b 21 34 1a a0 1c
E: 34.858743 8 03 d0 4b 21 ff 19 a4 1c
E: 34.868736 8 03 d0 ee 20 d7 19 a4 1c
E: 34.878727 8 03 d0 7c 20 bf 19 a4 1c
E: 34.888735 8 03 d0 21 20 b0 19 a4 1c
E: 34.889970 8 03 d0 c6 1f ac 19 a0 1c
E: 34.908746 8 03 d0 6b 1f b7 19 a0 1c
E: 34.909971 8 03 d0 0e 1f c8 19 a4 1c
E: 34.928740 8 03 d0 bd 1e f1 19 a4 1c
E: 34.938740 8 03 d0 73 1e 1b 1a a0 1c
E: 34.948732 8 03 d0 31 1e 5d 1a a0 1c
E: 34.958731 8 03 d0 03 1e a4 1a a0 1c
E: 34.968735 8 03 d0 db 1d ee 1a a0 1c
E: 34.969974 8 03 d0 c4 1d 3f 1b a0 1c
E: 34.988743 8 03 d0 ba 1d 8a 1b a0 1c
E: 34.998741 8 03 d0 be 1d d8 1b a0 1c
E: 35.008734 8 03 d0 d6 1d 1f 1c a0 1c
E: 35.018730 8 03 d0 fd 1d 60 1c a4 1c
E: 35.028731 8 03 d0 33 1e 99 1c a4 1c
E: 35.029973 8 03 d0 79 1e c8 1c a8 1c
E: 35.048740 8 03 d0 cc 1e fb 1c a4 1c
E: 35.058739 8 03 d0 24 1f 13 1d a8 1c
E: 35.068732 8 03 d0 79 1f 1c 1d a4 1c
E: 35.069972 8 03 d0 c8 1f 19 1d a4 1c
E: 35.088741 8 03 d0 0c 20 07 1d a4 1c
E: 35.098723 8 03 d0 3c 20 e8 1c a4 1c
E: 35.108733 8 03 d0 6c 20 cd 1c a0 1c
E: 35.118730 8 03 d0 87 20 ac 1c a0 1c
E: 35.128693 8 03 d0 9e 20 96 1c a4 1c
E: 35.138727 8 03 d0 a3 20 74 1c a4 1c
E: 35.148730 8 03 d0 9f 20 53 1c a4 1c
E: 35.149972 8 03 d0 93 20 35 1c a0 1c
E: 35.168733 8 03 d0 73 20 16 1c a0 1c
E: 35.178733 8 03 d0 60 20 fa 1b a0 1c
E: 35.188707 8 03 d0 4d 20 e5 1b a0 1c
E: 35.189969 8 03 d0 44 20 d9 1b a0 1c
E: 35.208711 8 03 d0 45 20 db 1b a0 1c
E: 35.218733 8 03 d0 48 20 d9 1b a0 1c
E: 35.228734 8 03 d0 44 20 da 1b a0 1c
E: 35.238730 8 03 d1 49 20 db 1b a0 1c
E: 35.248838 8 03 d1 43 20 dd 1b a0 1c
E: 35.258734 8 03 d1 43 20 de 1b a0 1c
E: 35.268715 8 03 d1 47 20 dc 1b a0 1c
E: 35.278728 8 03 d1 41 20 dd 1b a0 1c
E: 35.288695 8 03 d1 4c 20 de 1b a0 1c
E: 35.298732 8 03 d1 43 20 dd 1b a0 1c
E: 35.308735 8 03 d1 49 20 df 1b a0 1c
E: 35.318736 8 03 d0 47 20 de 1b a0 1c
E: 35.328719 8 03 d0 48 20 e1 1b a0 1c
E: 35.338732 8 03 d0 51 20 e7 1b a0 1c
E: 35.348713 8 03 d0 51 20 e9 1b a0 1c
E: 35.358741 8 03 d0 53 20 ee 1b a0 1c
E: 35.368747 8 03 d0 51 20 ee 1b a0 1c
E: 35.378714 8 03 d0 52 20 ef 1b a0 1c
E: 35.388739 8 03 d0 4f 20 ee 1b a0 1c
E: 35.398715 8 03 d0 53 20 ed 1b a0 1c
E: 35.408716 8 03 d0 50 20 ef 1b a0 1c
E: 35.418745 8 03 d0 50 20 f0 1b a0 1c
E: 35.428714 8 03 d0 4f 20 ed 1b a0 1c
E: 35.438713 8 03 d0 53 20 ee 1b a0 1c
E: 35.448735 8 03 d0 52 20 ec 1b a0 1c
E: 35.458713 8 03 d0 53 20 ef 1b a0 1c
E: 35.468753 8 03 d0 54 20 f0 1b a0 1c
E: 35.478729 8 03 d0 50 20 ee 1b a0 1c
E: 35.488711 8 03 d0 52 20 ef 1b a0 1c
E: 35.498742 8 03 d0 4f 20 e9 1b a4 1c
E: 35.508738 8 03 d0 4d 20 e3 1b a0 1c
E: 35.518743 8 03 d0 4f 20 d6 1b a0 1c
E: 35.528731 8 03 d0 4c 20 c9 1b a0 1c
E: 35.538731 8 03 d0 42 20 b9 1b a0 1c
E: 35.548715 8 03 d0 42 20 a6 1b a0 1c
E: 35.558720 8 03 d0 3c 20 98 1b a0 1c
E: 35.568741 8 03 d0 3d 20 8a 1b a0 1c
E: 35.578735 8 03 d0 35 20 7e 1b a0 1c
E: 35.588733 8 03 d0 35 20 75 1b a0 1c
E: 35.598732 8 03 d0 2e 20 75 1b 9c 1c
E: 35.608653 8 03 d0 25 20 7a 1b 9c 1c
E: 35.618734 8 03 d0 05 20 71 1b 90 1c
E: 35.628730 8 03 d0 ca 1f 4f 1b 78 1c
E: 35.638731 8 03 d0 9c 1f 12 1b 5c 1c
E: 35.648732 8 03 50 64 1f bb 1a 40 1c
E: 35.658734 8 03 00 00 00 00 00 00 1c
