# 046:0 -> 056A:003F / Tablet | DTZ-2100
D:0
R: 170 05 01 09 02 a1 01 85 01 09 01 a1 00 05 09 19 01 29 03 15 00 25 01 95 03 75 01 81 02 95 05 81 03 05 01 09 30 09 31 09 38 15 81 25 7f 75 08 95 03 81 06 c0 c0 05 0d 09 01 a1 01 85 02 09 00 75 08 95 09 15 00 26 ff 00 81 02 09 3a 25 02 95 01 b1 02 85 03 09 00 26 ff 00 b1 02 85 04 09 3a 25 01 b1 02 85 05 09 00 26 ff 00 95 08 b1 02 85 06 09 00 b1 02 85 07 09 00 95 04 b1 02 85 08 09 00 b1 02 85 09 09 00 95 01 b1 02 85 0a 09 00 95 02 b1 02 85 0b 09 00 95 01 b1 02 85 0c 09 00 95 09 81 02 85 0d 09 00 95 01 b1 02 c0
N: Tablet DTZ-2100
P: usb-0000:00:14.0-6.0/input0
I: 3 056A 003F
# SET_REPORT (Feature) ID: 02 -> 02 02 (length 2)
# SET_REPORT (Feature) ID: 02 -> 02 02 (length 2)
E: 0.000000 10 02 c2 82 30 47 5d f5 00 00 00
E: 0.007999 10 02 e0 42 14 35 51 00 2e d4 9d
E: 0.019996 10 02 e0 41 88 36 2d 00 2e 54 94
E: 0.027999 10 02 e0 41 23 37 25 00 2e 52 8c
E: 0.036000 10 02 e0 40 ca 38 2b 00 2f d1 8c
E: 0.043999 10 02 e0 40 93 39 0d 00 2e d3 83
E: 0.055998 10 02 e0 40 7d 39 f8 00 2d d2 83
E: 0.063998 10 02 e0 40 80 3a d0 00 2e d0 82
E: 0.071998 10 02 e0 40 ad 3b 8a 00 2e 51 7e
E: 0.079998 10 02 e0 40 ed 3c 2a 00 2f 4e 83
E: 0.087999 10 02 e0 41 64 3c ab 00 2f 50 7c
E: 0.100000 10 02 e0 42 03 3d 26 00 2e 4f 7d
E: 0.107998 10 02 e0 42 c2 3d a6 00 2d cc 7a
E: 0.116001 10 02 e0 43 7b 3d fb 00 30 cf 7a
E: 0.123999 10 02 e0 44 4c 3e 49 00 2f 4d 7f
E: 0.135998 10 02 e0 45 24 3e 96 00 2e cf 7f
E: 0.143997 10 02 e0 46 2e 3e c3 00 2e 4f 7f
E: 0.151993 10 02 e0 47 38 3e f0 00 32 4d 80
E: 0.159998 10 02 e0 48 5b 3f 03 00 2f 4d 81
E: 0.171998 10 02 e0 49 90 3f 0c 00 2e 4c 80
E: 0.179997 10 02 e0 4b 04 3f 03 00 2c 4c 81
E: 0.187999 10 02 e0 4c 4b 3e e6 00 2f 4e 83
E: 0.195999 10 02 e0 4d b5 3e b2 00 2d cf 83
E: 0.203993 10 02 e0 4f 48 3e 6b 00 2d cf 7c
E: 0.215998 10 02 e0 50 a5 3e 19 00 2e cf 7e
E: 0.223999 10 02 e0 52 1e 3d c0 00 2d cd 7f
E: 0.231998 10 02 e0 53 89 3d 4b 00 2f 50 7a
E: 0.239997 10 02 e0 54 dd 3c c9 00 2d d0 77
E: 0.251994 10 02 e0 56 20 3c 3d 00 2c d1 72
E: 0.259997 10 02 e0 57 4d 3b a8 00 2f d7 7b
E: 0.267999 10 02 e0 58 4e 3b 0b 00 2e d1 79
E: 0.275997 10 02 e0 59 2a 3a 62 00 2d 52 76
E: 0.287998 10 02 e0 59 eb 39 b2 00 2c 52 70
E: 0.295996 10 02 e0 5a 8f 38 ec 00 2c d1 6a
E: 0.303997 10 02 e0 5a fc 38 30 00 31 54 67
E: 0.311998 10 02 e0 5b 5c 37 6b 00 2e d8 72
E: 0.319998 10 02 e0 5b 80 36 8e 00 2e d5 74
E: 0.331997 10 02 e0 5b 8f 35 bc 00 2e 56 73
E: 0.339998 10 02 e0 5b 80 34 ed 00 2e 57 72
E: 0.347997 10 02 e0 5b 55 34 21 00 2f d7 71
E: 0.355996 10 02 e0 5a fa 33 64 00 30 df 7c
E: 0.367998 10 02 e0 5a 7e 32 8b 00 35 52 83
E: 0.375996 10 02 e0 59 f9 31 ca 00 2d 55 85
E: 0.383996 10 02 e0 59 52 30 ee 00 2e 56 83
E: 0.391993 10 02 e0 58 a6 30 47 00 2f 5a 85
E: 0.403997 10 02 e0 57 dc 2f a7 00 31 de 8b
E: 0.411996 10 02 e0 56 f9 2f 1c 00 32 e4 95
E: 0.419996 10 02 e0 55 e7 2e b9 00 2d d4 92
E: 0.427997 10 02 e0 54 e2 2e 68 00 2e 54 92
E: 0.435996 10 02 e0 53 c4 2e 35 00 30 d6 92
E: 0.447998 10 02 e0 52 87 2e 2a 00 36 54 91
E: 0.455932 10 02 e0 51 3d 2e 37 00 2e d6 90
E: 0.463996 10 02 e0 50 0d 2e 75 00 30 d4 92
E: 0.471997 10 02 e0 4e e4 2e cf 00 33 d2 90
E: 0.483997 10 02 e0 4d b5 2f 4d 00 2d d5 90
E: 0.491991 10 02 e0 4c c3 2f e1 00 2f 51 90
E: 0.499996 10 02 e0 4b f3 30 50 00 31 d8 93
E: 0.507996 10 02 e0 4b 4c 30 fc 00 32 55 92
E: 0.519996 10 02 e0 4a b9 31 c7 00 34 53 8d
E: 0.527997 10 02 e0 4a 3d 32 aa 00 2d d1 89
E: 0.535996 10 02 e0 49 d9 33 90 00 2d d1 88
E: 0.543996 10 02 e0 49 86 34 7a 00 2d d1 97
E: 0.551994 10 02 e0 49 52 35 68 00 2e 4e 8a
E: 0.563996 10 02 e0 49 3b 36 44 00 2e 4f 84
E: 0.571996 10 02 e0 49 40 37 13 00 2d ce 87
E: 0.579996 10 02 e0 49 65 37 d9 00 2d 4f 85
E: 0.587995 10 02 e0 49 a8 38 88 00 2d 4f 91
E: 0.599995 10 02 e0 4a 0b 39 2c 00 2d 50 80
E: 0.607995 10 02 e0 4a 7f 39 c7 00 2d 50 7d
E: 0.615997 10 02 e0 4a fb 3a 4e 00 32 4e 7f
E: 0.623995 10 02 e0 4b 75 3a b8 00 2f ce 7d
E: 0.635995 10 02 e0 4b f2 3a f9 00 2f 4f 7f
E: 0.643995 10 02 e0 4c 78 3b 25 00 2e ce 7f
E: 0.651991 10 02 e0 4c f4 3b 3b 00 2d d0 7d
E: 0.659996 10 02 e0 4d 60 3b 44 00 2d cf 7e
E: 0.667994 10 02 e0 4d c5 3b 4c 00 2d 51 81
E: 0.679995 10 02 e0 4e 1a 3b 4b 00 2e 4e 80
E: 0.687994 10 02 e0 4e 64 3b 3e 00 2e d0 85
E: 0.695996 10 02 e0 4e a1 3b 33 00 2e d0 80
E: 0.703992 10 02 e0 4e d3 3b 26 00 34 ce 85
E: 0.715994 10 02 e0 4f 0d 3b 18 00 33 cf 86
E: 0.723996 10 02 e0 4f 28 3b 0d 00 32 50 84
E: 0.731996 10 02 e0 4f 2b 3b 0c 00 32 4f 86
E: 0.739995 10 02 e0 4f 28 3b 11 00 32 d0 86
E: 0.747995 10 02 e0 4f 1d 3b 00 00 34 4e 85
E: 0.759995 10 02 e0 4f 0f 3a f6 00 33 4f 88
E: 0.767997 10 02 e0 4e f2 3a fb 00 33 cf 88
E: 0.775994 10 02 e0 4e e8 3a fb 00 34 4e 88
E: 0.783994 10 02 e0 4e d6 3a f5 00 34 4e 87
E: 0.795994 10 02 e0 4e ca 3a f6 00 34 ce 80
E: 0.803995 10 02 e0 4e b9 3b 05 00 34 ce 80
E: 0.811994 10 02 e0 4e a1 3b 1e 00 34 ce 7d
E: 0.819996 10 02 e0 4e 99 3b 33 00 34 ce 7d
E: 0.831994 10 02 e2 4e 8e 3b 46 00 34 ce 79
E: 0.839993 10 02 e2 4e 89 3b 54 00 2e d4 79
E: 0.847995 10 02 e2 4e 85 3b 61 00 2f 53 77
E: 0.855994 10 02 e2 4e 87 3b 70 00 2f 52 71
E: 0.863994 10 02 e2 4e 87 3b 7a 00 2e d3 70
E: 0.875995 10 02 e2 4e 88 3b 86 00 2e 53 6c
E: 0.883995 10 02 e2 4e 84 3b 8f 00 2f 52 6e
E: 0.891991 10 02 e2 4e 86 3b 91 00 2f 52 6d
E: 0.899994 10 02 e2 4e 88 3b 9a 00 2f 52 6d
E: 0.911994 10 02 e2 4e 8c 3b 90 00 2f 54 73
E: 0.919994 10 02 e2 4e 93 3b 9f 00 2e d3 72
E: 0.927994 10 02 e2 4e 9a 3b 9a 00 2f 53 6d
E: 0.935993 10 02 e2 4e 99 3b 9b 00 2e d4 71
E: 0.947994 10 02 e2 4e 94 3b 9f 00 2f 53 70
E: 0.955994 10 02 e2 4e 94 3b 99 00 2e d3 71
E: 0.963995 10 02 e2 4e 8c 3b 94 00 2f 53 72
E: 0.971993 10 02 e2 4e 87 3b 8e 00 2e d3 6e
E: 0.979996 10 02 e2 4e 84 3b 76 00 2e d4 6d
E: 0.991992 10 02 e2 4e 83 3b 65 00 2e 54 70
E: 0.999995 10 02 e0 4e 7b 3b 49 00 2e d2 71
E: 1.007994 10 02 e0 4e 6c 3b 3b 00 2e 54 76
E: 1.015994 10 02 e0 4e 60 3b 41 00 2e d2 75
E: 1.027994 10 02 e0 4e 50 3b 4e 00 2e d3 74
E: 1.035992 10 02 e0 4e 3c 3b 6b 00 2e 51 79
E: 1.043993 10 02 e0 4e 27 3b 7a 00 2e 50 75
E: 1.051992 10 02 e0 4e 19 3b 92 00 2e 51 7a
E: 1.063948 10 02 e0 4e 0f 3b a0 00 2f 50 79
E: 1.071993 10 02 e0 4e 08 3b b2 00 2e 50 7e
E: 1.079994 10 02 e0 4e 06 3b bb 00 2e d0 7a
E: 1.087995 10 02 e0 4e 13 3b bd 00 2d cf 7d
E: 1.095994 10 02 e0 4e 1e 3b bf 00 2e 50 7c
E: 1.107993 10 02 e0 4e 2b 3b d3 00 2e 50 83
E: 1.115994 10 02 e0 4e 3f 3b e2 00 2e 50 7c
E: 1.123992 10 02 e0 4e 58 3b ea 00 2e 52 7d
E: 1.131993 10 02 e0 4e 71 3b f1 00 2d d2 7d
E: 1.143992 10 02 e0 4e 7c 3c 0a 00 2d d2 7a
E: 1.151992 10 02 e0 4e 8d 3c 20 00 2d d1 79
E: 1.159993 10 02 e0 4e 9b 3c 36 00 2e 52 7b
E: 1.167993 10 02 e0 4e a5 3c 48 00 2d cf 78
E: 1.179993 10 02 e0 4e ac 3c 5c 00 35 51 7a
E: 1.187994 10 02 e0 4e c3 3c 66 00 35 51 79
E: 1.195995 10 02 e0 4e d7 3c 66 00 35 51 7b
E: 1.203989 10 02 e0 4e ef 3c 5e 00 34 d1 7b
E: 1.211992 10 02 e0 4f 0e 3c 53 00 32 d4 7c
E: 1.223992 10 02 e0 4f 1e 3c 3b 00 33 54 75
E: 1.231993 10 02 e0 4f 33 3c 26 00 32 d4 7a
E: 1.239994 10 02 e0 4f 4a 3c 11 00 32 d4 7d
E: 1.247993 10 02 e0 4f 59 3b ea 00 32 d5 79
E: 1.259992 10 02 e0 4f 61 3b c8 00 31 58 7c
E: 1.267992 10 02 e0 4f 67 3b a8 00 31 d7 83
E: 1.275991 10 02 e0 4f 67 3b 77 00 30 53 7d
E: 1.283992 10 02 e0 4f 5c 3b 58 00 31 52 7b
E: 1.295992 10 02 e0 4f 4a 3b 26 00 30 d2 7a
E: 1.303993 10 02 e0 4f 36 3b 04 00 31 51 7b
E: 1.311994 10 02 e0 4f 26 3a db 00 31 d2 79
E: 1.319992 10 02 e0 4f 15 3a ae 00 31 d3 78
E: 1.327992 10 02 e0 4f 0d 3a 88 00 31 52 7b
E: 1.339992 10 02 e0 4f 00 3a 54 00 30 d3 75
E: 1.347992 10 02 e0 4e f7 3a 34 00 31 52 77
E: 1.355991 10 02 e0 4e f1 3a 13 00 31 54 70
E: 1.363992 10 02 e0 4e f0 39 f2 00 31 54 6d
E: 1.375992 10 02 e4 4e ee 39 de 00 30 52 6c
E: 1.383992 10 02 e4 4e e8 39 b9 00 30 53 69
E: 1.391989 10 02 e4 4e e0 39 9d 00 30 54 6b
E: 1.399994 10 02 e4 4e d7 39 82 00 31 d4 6b
E: 1.411995 10 02 e4 4e dc 39 5f 00 30 d4 6b
E: 1.419993 10 02 e4 4e d8 39 4a 00 31 55 67
E: 1.427997 10 02 e4 4e d7 39 30 00 31 54 64
E: 1.435991 10 02 e4 4e d1 39 29 00 30 d4 66
E: 1.443991 10 02 e4 4e cf 39 20 00 31 54 66
E: 1.455991 10 02 e4 4e c6 39 14 00 31 55 64
E: 1.463992 10 02 e4 4e c9 39 10 00 31 54 60
E: 1.471990 10 02 e4 4e cc 39 02 00 31 56 65
E: 1.479992 10 02 e4 4e cf 39 04 00 31 d4 65
E: 1.491987 10 02 e4 4e ce 38 fe 00 30 d6 67
E: 1.499991 10 02 e4 4e cb 38 f8 00 30 d5 63
E: 1.507991 10 02 e4 4e c8 38 ff 00 30 d5 63
E: 1.515991 10 02 e4 4e c4 38 f0 00 30 d5 61
E: 1.527989 10 02 e4 4e b0 38 f2 00 31 55 62
E: 1.535991 10 02 e4 4e a4 38 eb 00 31 d4 61
E: 1.543991 10 02 e4 4e 99 38 e4 00 31 d3 61
E: 1.551991 10 02 e4 4e 94 38 e2 00 2d 54 66
E: 1.559993 10 02 e4 4e 83 38 db 00 2d d4 63
E: 1.571986 10 02 e4 4e 75 38 d6 00 2d d4 61
E: 1.579991 10 02 e4 4e 6c 38 cc 00 2d 53 60
E: 1.587991 10 02 e4 4e 5e 38 be 00 2e 55 66
E: 1.595990 10 02 e4 4e 59 38 ac 00 2d d4 60
E: 1.607991 10 02 e4 4e 5e 38 99 00 2d d5 66
E: 1.615991 10 02 e4 4e 66 38 7e 00 2d 54 67
E: 1.623991 10 02 e0 4e 6d 38 61 00 2c d3 63
E: 1.631992 10 02 e0 4e 6f 38 33 00 2d d4 64
E: 1.639991 10 02 e0 4e 77 38 10 00 2d 55 62
E: 1.651990 10 02 e0 4e 78 37 d2 00 2c 55 64
E: 1.659948 10 02 e0 4e 72 37 90 00 2c 56 6e
E: 1.667991 10 02 e0 4e 66 37 3c 00 2c d8 6e
E: 1.675953 10 02 e0 4e 4e 36 e5 00 2d 54 6d
E: 1.687990 10 02 e0 4e 30 36 93 00 2c d6 6b
E: 1.695990 10 02 e0 4d ff 36 34 00 2d 55 69
E: 1.703988 10 02 e0 4d cd 35 d4 00 2d 55 6b
E: 1.711990 10 02 e0 4d 97 35 77 00 2d 53 64
E: 1.723990 10 02 e0 4d 54 35 0f 00 2d 54 68
E: 1.731990 10 02 e0 4d 08 34 b2 00 2d 54 6a
E: 1.739990 10 02 e0 4c b3 34 56 00 2d d3 66
E: 1.747990 10 02 e0 4c 5a 34 0a 00 2d d5 69
E: 1.755940 10 02 e0 4b f0 33 c2 00 2e 57 6f
E: 1.767990 10 02 e0 4b 7d 33 85 00 2e 5b 75
E: 1.775990 10 02 e0 4b 04 33 56 00 30 59 7c
E: 1.783990 10 02 e0 4a 5d 33 2b 00 33 d1 7b
E: 1.791986 10 02 e0 49 bd 33 0e 00 2d d3 79
E: 1.803989 10 02 e0 49 18 33 0d 00 2d d3 79
E: 1.811991 10 02 e0 48 75 33 22 00 2e d3 79
E: 1.819990 10 02 e0 47 c8 33 4e 00 2f 53 79
E: 1.827957 10 02 e0 47 21 33 9a 00 30 d2 7b
E: 1.839991 10 02 e0 46 5e 33 f2 00 34 cc 80
E: 1.847990 10 02 e0 45 99 34 62 00 2f d3 78
E: 1.855991 10 02 e0 44 e2 34 f5 00 2f d1 7b
E: 1.863990 10 02 e0 44 30 35 b2 00 2f 50 76
E: 1.871990 10 02 e0 43 7e 36 88 00 30 50 77
E: 1.883986 10 02 e0 42 e6 37 64 00 31 d1 73
E: 1.891986 10 02 e0 42 46 38 52 00 31 d1 7f
E: 1.899988 10 02 e0 41 be 39 44 00 2f 4f 73
E: 1.907990 10 02 e0 41 56 3a 5b 00 2f 4e 73
E: 1.919988 10 02 e0 41 09 3b 7d 00 2f cc 69
E: 1.927979 10 02 e0 40 cd 3c 9d 00 2f cc 7a
E: 1.935988 10 02 e0 40 a9 3d cc 00 2f cb 69
E: 1.943988 10 02 e0 40 96 3f 17 00 2f ca 67
E: 1.955989 10 02 e0 40 a4 40 50 00 30 47 6b
E: 1.963990 10 02 e0 40 d8 41 6b 00 30 49 70
E: 1.971988 10 02 e0 41 2f 42 7d 00 2f 49 72
E: 1.979990 10 02 e0 41 b4 43 75 00 2f 48 72
E: 1.987990 10 02 e0 42 6d 44 2e 00 30 47 74
E: 1.999989 10 02 e0 43 32 44 9a 00 32 c9 71
E: 2.007989 10 02 e0 44 12 45 00 00 30 49 6c
E: 2.015933 10 02 e0 44 fc 45 35 00 2f c9 6f
E: 2.023938 10 02 e0 46 0b 45 45 00 2f 49 68
E: 2.035998 10 02 e0 47 1c 45 3b 00 31 49 6b
E: 2.043929 10 02 e0 48 23 45 0a 00 2e cb 69
E: 2.051924 10 02 e0 49 25 44 c2 00 2f 49 6a
E: 2.059942 10 02 e0 4a 45 44 5a 00 2e 49 67
E: 2.071990 10 02 e0 4b 48 43 ed 00 31 4d 6d
E: 2.075933 10 02 e0 4c 3c 43 64 00 31 4d 7f
E: 2.087986 10 02 e0 4d 28 42 a5 00 2e cf 72
E: 2.095988 10 02 e0 4e 12 41 ef 00 2e cd 72
E: 2.103929 10 02 e0 4e f7 41 21 00 2d 4c 6e
E: 2.115986 10 02 e0 4f a9 40 48 00 30 d1 6d
E: 2.123989 10 02 e0 50 4a 3f 72 00 30 d1 79
E: 2.131926 10 02 e0 50 cf 3e 71 00 2f d2 6f
E: 2.139986 10 02 e0 51 29 3d ae 00 2e d2 6d
E: 2.151928 10 02 e0 51 61 3d 13 00 2f 52 6a
E: 2.159921 10 02 e0 51 7e 3c 7e 00 2f d2 67
E: 2.168038 10 02 e0 51 87 3c 28 00 30 52 67
E: 2.175928 10 02 e0 51 7c 3b d8 00 2f d5 6b
E: 2.183921 10 02 e0 51 6a 3b a5 00 2f d5 6e
E: 2.195998 10 02 e0 51 4a 3b 7e 00 2f d3 6c
E: 2.203928 10 02 e0 51 1e 3b 66 00 2f d2 6e
E: 2.211960 10 02 e0 50 e1 3b 60 00 2f d2 6c
E: 2.219988 10 02 e0 50 a6 3b 62 00 2f d2 6e
E: 2.231927 10 02 e0 50 66 3b 77 00 30 52 6c
E: 2.239986 10 02 e0 50 21 3b a2 00 2f d1 70
E: 2.247988 10 02 e0 4f df 3b db 00 30 51 73
E: 2.255927 10 02 e0 4f ae 3c 20 00 31 d4 6c
E: 2.267947 10 02 e0 4f 87 3c 5f 00 32 51 6d
E: 2.275942 10 02 e0 4f 6a 3c b3 00 32 53 6f
E: 2.283941 10 02 e0 4f 57 3d 06 00 32 51 6c
E: 2.291951 10 02 e0 4f 4e 3d 5e 00 32 51 6c
E: 2.303989 10 02 e0 4f 54 3d c4 00 32 4f 68
E: 2.311987 10 02 e0 4f 61 3e 20 00 31 d0 6a
E: 2.319987 10 02 e0 4f 75 3e 90 00 31 50 69
E: 2.327987 10 02 e0 4f 90 3e f7 00 31 50 64
E: 2.335987 10 02 e0 4f b5 3f 65 00 30 cf 6b
E: 2.347989 10 02 e0 4f ea 3f c3 00 30 4e 65
E: 2.355988 10 02 e0 50 37 40 0a 00 2f ce 6a
E: 2.363987 10 02 e0 50 91 40 32 00 2f cf 6f
E: 2.371988 10 02 e0 51 00 40 58 00 2f 4f 6b
E: 2.383988 10 02 e0 51 80 40 70 00 2e ce 6f
E: 2.391983 10 02 e0 52 0c 40 79 00 2e 4e 6a
E: 2.399986 10 02 e0 52 9c 40 6e 00 2d cd 6f
E: 2.407987 10 02 e0 53 1b 40 54 00 30 d0 69
E: 2.419987 10 02 e0 53 8c 40 40 00 30 4f 6b
E: 2.427987 10 02 e0 53 f4 40 17 00 2e d0 68
E: 2.435987 10 02 e0 54 53 3f eb 00 2e d1 6f
E: 2.443986 10 02 e0 54 a1 3f ba 00 2e d2 75
E: 2.451987 10 02 e0 54 d8 3f 85 00 2f 4c 6d
E: 2.463987 10 02 e0 54 fe 3f 51 00 2e cd 6e
E: 2.471986 10 02 e0 55 13 3f 1b 00 2f 4e 6c
E: 2.479987 10 02 e0 55 1d 3e f2 00 2e cf 73
E: 2.487987 10 02 e0 55 12 3e ce 00 2e 50 73
E: 2.499987 10 02 e0 55 00 3e af 00 2f 4e 70
E: 2.507986 10 02 e0 54 ea 3e 92 00 2f 50 73
E: 2.515987 10 02 e0 54 d2 3e 6a 00 2f 4f 74
E: 2.523988 10 02 e0 54 ac 3e 53 00 2f cd 76
E: 2.531986 10 02 e0 54 89 3e 32 00 2f cf 7a
E: 2.543986 10 02 e0 54 63 3e 18 00 2f cf 7a
E: 2.551985 10 02 e0 54 36 3e 09 00 30 4f 79
E: 2.559987 10 02 e0 54 01 3d f8 00 30 d1 7d
E: 2.567920 10 02 e0 53 cd 3d f6 00 31 4f 80
E: 2.579987 10 02 e0 53 92 3d f1 00 32 cf 83
E: 2.587986 10 02 e0 53 54 3d ed 00 33 4d 89
E: 2.595986 10 02 e0 53 1f 3d ee 00 34 ce 8c
E: 2.603985 10 02 e0 52 df 3d e0 00 36 4e 93
E: 2.615985 10 02 e0 52 ac 3d e3 00 37 4c 96
E: 2.623987 10 02 e0 52 83 3d e1 00 38 ce 9b
E: 2.631986 10 02 e0 52 66 3d da 00 2e 4e 9e
E: 2.639985 10 02 e0 52 47 3d e4 00 2e 4d a2
E: 2.647985 10 02 e0 52 1f 3d dc 00 2e 4e a4
E: 2.659985 10 02 e0 51 ff 3d bf 00 2e cc aa
E: 2.667917 10 02 e0 51 e6 3d d2 00 2e 4f a9
E: 2.675987 10 02 e0 51 d9 3d d0 00 2e 4f af
E: 2.683985 10 02 e0 51 c7 3d c6 00 2e ce ad
E: 2.695986 10 02 e0 51 b7 3d b9 00 2e d0 af
E: 2.703983 10 02 e0 51 b5 3d b0 00 2e cf af
E: 2.711988 10 02 e0 51 b8 3d aa 00 2e cf ae
E: 2.719986 10 02 e0 51 c3 3d 8a 00 2e d0 ac
E: 2.731986 10 02 e0 51 c4 3d 84 00 2e d0 b6
E: 2.739986 10 02 e0 51 db 3d 66 00 2e cf ac
E: 2.747986 10 02 e0 51 e4 3d 4f 00 2e 4f b1
E: 2.755986 10 02 e0 51 ed 3d 4f 00 2e cf af
E: 2.763986 10 02 e0 51 f5 3d 40 00 2d d0 ad
E: 2.767928 10 0c 00 01 00 00 00 00 00 00 00
E: 2.775921 10 02 e0 52 02 3d 39 00 2e d0 ae
E: 2.783986 10 02 e0 52 0c 3d 2b 00 2d d0 af
E: 2.791919 10 02 e0 52 0a 3d 1a 00 2e cf af
E: 2.799985 10 02 e0 52 07 3d 34 00 2d d0 ac
E: 2.811985 10 02 e0 52 07 3d 3a 00 2d d3 af
E: 2.819985 10 02 e0 52 06 3d 3b 00 2e 50 af
E: 2.827985 10 02 e0 52 0a 3d 47 00 2d d2 ac
E: 2.835985 10 02 e0 52 06 3d 5d 00 2e 50 ad
E: 2.839985 10 0c 00 02 00 00 00 00 00 00 00
E: 2.847921 10 02 e0 52 09 3d 6a 00 2e 4e af
E: 2.855929 10 02 e0 52 09 3d 80 00 2e 4e b0
E: 2.863921 10 02 e0 51 ff 3d 8a 00 2e d0 af
E: 2.871935 10 02 e0 51 f4 3d 9d 00 2e 50 b5
E: 2.879985 10 0c 00 04 00 00 00 00 00 00 00
E: 2.891923 10 02 e0 51 f3 3d c6 00 2e ce b0
E: 2.899918 10 02 e0 51 f2 3d de 00 2e ce ad
E: 2.903947 10 0c 00 10 00 00 00 00 00 00 00
E: 2.907926 10 02 e0 51 ea 3d e9 00 2f ce af
E: 2.915928 10 02 e0 51 fb 3e 0b 00 2f 4d af
E: 2.919923 10 0c 00 20 00 00 00 00 00 00 00
E: 2.927944 10 02 e0 51 f9 3e 17 00 2e cd af
E: 2.935984 10 02 e0 51 fa 3e 2f 00 2e cd ac
E: 2.943984 10 02 e0 51 f2 3e 38 00 2f 4e ae
E: 2.947986 10 0c 00 80 00 00 00 00 00 00 00
E: 2.951919 10 02 e0 51 fb 3e 59 00 2e cd ad
E: 2.963985 10 02 e0 51 f6 3e 6e 00 2e 4d ac
E: 2.967923 10 0c 01 00 00 00 00 00 00 00 00
E: 2.971922 10 02 e0 51 ee 3e 6e 00 2f 4c ad
E: 2.979981 10 02 e0 51 ea 3e 79 00 2f 4d ae
E: 2.983988 10 0c 04 00 00 00 00 00 00 00 00
E: 2.987925 10 02 e0 51 e2 3e 78 00 2f 4d af
E: 2.995981 10 02 e0 51 d9 3e 7b 00 2f 4b b1
E: 3.007981 10 02 e0 51 d6 3e 82 00 2f cd b3
E: 3.011954 10 0c 08 00 00 00 00 00 00 00 00
E: 3.015925 10 02 e0 51 d6 3e 80 00 2f cb ac
E: 3.023982 10 02 e0 51 d2 3e 8e 00 2f 4c b1
E: 3.027924 10 0c 10 00 00 00 00 00 00 00 00
E: 3.031923 10 02 e0 51 d1 3e 90 00 2f 4d b1
E: 3.043930 10 02 e0 51 c8 3e 78 00 2f 4c ac
E: 3.051983 10 02 e0 51 c2 3e 9b 00 2f cb ae
E: 3.059983 10 02 e0 51 ba 3e 90 00 30 4d ad
E: 3.067945 10 02 e0 51 ac 3e 9f 00 30 4a af
E: 3.071988 10 0c 00 00 00 00 00 00 00 00 00
E: 3.079918 10 02 e0 51 a3 3e 99 00 2f cc ac
E: 3.087984 10 02 e0 51 92 3e 98 00 31 4b ac
E: 3.095920 10 02 e0 51 85 3e 9b 00 30 cc a9
E: 3.103985 10 02 e0 51 77 3e 97 00 30 ca ab
E: 3.111984 10 02 e0 51 73 3e 94 00 30 4c aa
E: 3.123984 10 02 e0 51 68 3e 90 00 30 cb a8
E: 3.131979 10 02 e0 51 5e 3e 8f 00 31 cb a9
E: 3.135990 10 0c 10 00 00 00 00 00 00 00 00
E: 3.139926 10 02 e0 51 57 3e 82 00 31 4a ab
E: 3.147983 10 02 e0 51 54 3e 82 00 31 4d a9
E: 3.159981 10 02 e0 51 4c 3e 6d 00 30 cc a9
E: 3.167941 10 02 e0 51 41 3e 74 00 31 4d aa
E: 3.175982 10 02 e0 51 36 3e 6c 00 31 4c ab
E: 3.183983 10 02 e0 51 2d 3e 6b 00 32 4a aa
E: 3.195984 10 02 e0 51 2f 3e 6d 00 31 4d a8
E: 3.203980 10 02 e0 51 29 3e 71 00 31 4b a9
E: 3.211983 10 02 e0 51 1c 3e 6f 00 32 4b aa
E: 3.215983 10 0c 04 00 00 00 00 00 00 00 00
E: 3.219919 10 02 e0 51 22 3e 6b 00 30 cc ab
E: 3.227980 10 02 e0 51 1a 3e 70 00 31 cc aa
E: 3.235921 10 0c 02 00 00 00 00 00 00 00 00
E: 3.239922 10 02 e0 51 15 3e 7c 00 32 4c a9
E: 3.247979 10 02 e0 51 13 3e 7a 00 31 4d aa
E: 3.255919 10 02 e0 51 06 3e 7d 00 31 cc a8
E: 3.259944 10 0c 00 80 00 00 00 00 00 00 00
E: 3.263915 10 02 e0 50 fe 3e 79 00 31 ca ab
E: 3.275983 10 02 e0 50 f1 3e 8b 00 31 cb a8
E: 3.283919 10 02 e0 50 e8 3e 85 00 31 cb a9
E: 3.291980 10 02 e0 50 ee 3e 76 00 30 cb a9
E: 3.299984 10 02 e0 50 e9 3e 6f 00 31 4b ae
E: 3.303987 10 0c 00 10 00 00 00 00 00 00 00
E: 3.311920 10 02 e0 50 e3 3e 77 00 31 cd ab
E: 3.319983 10 02 e0 50 e7 3e 75 00 30 cd ab
E: 3.327917 10 02 e0 50 e9 3e 68 00 32 4b aa
E: 3.335983 10 02 e0 50 ed 3e 6c 00 32 4c a8
E: 3.339987 10 0c 00 04 00 00 00 00 00 00 00
E: 3.343921 10 02 e0 50 e5 3e 7c 00 31 cd a4
E: 3.355982 10 02 e0 50 e4 3e 67 00 32 4c aa
E: 3.363918 10 02 e0 50 ee 3e 71 00 31 4d a8
E: 3.371982 10 02 e0 50 eb 3e 79 00 31 4b a9
E: 3.379982 10 02 e0 50 ee 3e 71 00 32 4d aa
E: 3.383988 10 0c 00 02 00 00 00 00 00 00 00
E: 3.391907 10 02 e0 50 f7 3e 77 00 31 cb a8
E: 3.399982 10 02 e0 51 05 3e 73 00 31 4b a8
E: 3.407917 10 02 e0 51 0c 3e 6c 00 31 4a aa
E: 3.415982 10 02 e0 51 0f 3e 6f 00 31 cc a8
E: 3.423982 10 02 e0 51 1d 3e 67 00 31 cc ab
E: 3.435983 10 02 e0 51 1c 3e 77 00 31 4c ab
E: 3.443982 10 02 e0 51 1a 3e 78 00 31 4e af
E: 3.451982 10 02 e0 51 24 3e 78 00 30 cc af
E: 3.459924 10 02 e0 51 26 3e 85 00 31 ca af
E: 3.467933 10 0c 00 00 00 00 00 00 00 00 00
E: 3.471920 10 02 e0 51 32 3e 8d 00 30 cb af
E: 3.479978 10 02 e0 51 34 3e 9b 00 30 cb ae
E: 3.487919 10 02 e0 51 46 3e 8e 00 30 4c ae
E: 3.495982 10 02 e0 51 54 3e 98 00 32 4b b4
E: 3.507981 10 02 e0 51 6b 3e a6 00 30 cb ad
E: 3.515982 10 02 e0 51 7f 3e aa 00 30 4c b1
E: 3.523982 10 02 e0 51 8e 3e ac 00 30 4b b2
E: 3.531982 10 02 e0 51 9c 3e b2 00 30 c9 b3
E: 3.539981 10 02 e0 51 b0 3e a6 00 30 48 b0
E: 3.551982 10 02 e0 51 c4 3e c4 00 30 c9 b3
E: 3.559982 10 02 e0 51 d1 3e c5 00 2f ca b2
E: 3.567991 10 02 e0 51 e0 3e e3 00 30 4a b1
E: 3.575983 10 02 e0 51 f0 3e ef 00 2f cb b3
E: 3.587983 10 02 e0 51 fd 3e f6 00 2e cb b4
E: 3.595981 10 02 e0 52 08 3f 06 00 2e c9 b3
E: 3.603983 10 02 e0 52 0d 3f 09 00 2f 4a b4
E: 3.611981 10 02 e0 52 12 3f 14 00 2f 48 b9
E: 3.623981 10 02 e0 52 0f 3f 0d 00 2f c8 b6
E: 3.631982 10 02 e0 52 0b 3f 18 00 2e c8 b8
E: 3.639982 10 02 e0 52 02 3f 16 00 2f 49 b6
E: 3.647980 10 02 e0 51 fc 3f 22 00 2f c9 bd
E: 3.655981 10 02 e0 51 f5 3f 1f 00 2f c7 b6
E: 3.667977 10 02 e0 51 f3 3f 24 00 2f c8 b5
E: 3.675981 10 02 e0 51 f1 3e f3 00 30 48 b5
E: 3.683980 10 02 e0 51 e5 3f 2b 00 2f c9 b9
E: 3.691977 10 02 e0 51 e4 3f 1a 00 30 48 ba
E: 3.703978 10 02 e0 51 dd 3f 29 00 2f c8 b9
E: 3.711980 10 02 e0 51 d3 3f 2d 00 30 c7 b9
E: 3.719981 10 02 e0 51 ca 3f 25 00 2f 49 bb
E: 3.727979 10 02 e0 51 bf 3f 22 00 30 c8 bb
E: 3.739980 10 02 e0 51 bc 3f 2c 00 30 49 b9
E: 3.743985 10 0c 00 00 00 00 04 00 00 00 00
E: 3.747916 10 02 e0 51 b4 3f 24 00 2f c9 be
E: 3.755978 10 02 e0 51 b2 3f 21 00 30 c9 ba
E: 3.763915 10 02 e0 51 ac 3f 21 00 30 c7 b8
E: 3.771980 10 02 e0 51 ac 3f 1e 00 30 c7 ba
E: 3.783980 10 02 e0 51 a3 3f 19 00 2f ca b9
E: 3.791976 10 02 e0 51 9d 3f 0b 00 30 4a bd
E: 3.799980 10 02 e0 51 9b 3f 24 00 30 49 b9
E: 3.807981 10 02 e0 51 8c 3f 13 00 31 c7 b8
E: 3.819981 10 02 e0 51 8d 3f 31 00 30 4a ba
E: 3.827981 10 02 e0 51 8d 3f 32 00 30 4b bf
E: 3.835977 10 02 e0 51 92 3f 20 00 30 c8 c2
E: 3.843981 10 02 e0 51 93 3f 43 00 30 cb b8
E: 3.855979 10 02 e0 51 8f 3f 34 00 31 c5 b8
E: 3.863980 10 02 e0 51 8a 3f 3f 00 31 c7 ba
E: 3.871981 10 02 e0 51 8d 3f 3b 00 30 4b b8
E: 3.879922 10 02 e0 51 82 3f 3e 00 30 c7 bc
E: 3.887980 10 02 e0 51 75 3f 4c 00 31 c7 bb
E: 3.891975 10 0c 00 00 00 00 00 00 00 00 00
E: 3.899918 10 02 e0 51 6a 3f 43 00 31 48 b8
E: 3.907911 10 02 e0 51 62 3f 5a 00 31 47 c1
E: 3.915907 10 02 e0 51 59 3f 4d 00 31 4a bb
E: 3.923913 10 02 e0 51 5a 3f 30 00 30 c9 ba
E: 3.935913 10 02 e0 51 51 3f 43 00 32 c7 b8
E: 3.943911 10 02 e0 51 58 3f 4b 00 30 ca bb
E: 3.951913 10 02 e0 51 57 3f 55 00 31 49 b8
E: 3.959914 10 02 e0 51 54 3f 56 00 31 c6 b9
E: 3.971902 10 02 e0 51 60 3f 51 00 31 49 bb
E: 3.979910 10 02 e0 51 61 3f 69 00 31 c7 b8
E: 3.987919 10 02 e0 51 61 3f 56 00 32 47 b8
E: 3.995920 10 02 e0 51 65 3f 50 00 31 49 bf
E: 4.003974 10 02 e0 51 70 3f 5c 00 30 c7 b9
E: 4.015920 10 02 e0 51 74 3f 57 00 30 49 b8
E: 4.023922 10 02 e0 51 77 3f 69 00 31 48 ba
E: 4.031920 10 02 e0 51 71 3f 61 00 31 c6 b9
E: 4.039974 10 02 e0 51 7b 3f 46 00 31 46 b8
E: 4.051973 10 02 e0 51 86 3f 64 00 30 c6 b8
E: 4.059974 10 02 e0 51 88 3f 41 00 31 ca b9
E: 4.067972 10 02 e0 51 8b 3f 65 00 31 48 b9
E: 4.075975 10 02 e0 51 92 3f 75 00 31 c8 b9
E: 4.087974 10 02 e0 51 97 3f 66 00 30 c8 bb
E: 4.095974 10 02 e0 51 90 3f 7b 00 31 45 b6
E: 4.103979 10 02 e0 51 93 3f 66 00 30 c8 ba
E: 4.111979 10 02 e0 51 89 3f 83 00 31 46 b7
E: 4.119978 10 02 e0 51 85 3f 7b 00 31 c6 b9
E: 4.131979 10 02 e0 51 83 3f 82 00 30 49 bb
E: 4.139980 10 02 e0 51 7f 3f 94 00 31 c6 b4
E: 4.147978 10 02 e0 51 7c 3f 8d 00 30 c8 bb
E: 4.155979 10 02 e0 51 77 3f 95 00 30 c8 b7
E: 4.167973 10 02 e0 51 6e 3f 92 00 32 45 b7
E: 4.175979 10 02 e0 51 73 3f 85 00 30 48 bf
E: 4.183979 10 02 e0 51 6d 3f 9f 00 32 46 b6
E: 4.191974 10 02 e0 51 6d 3f 8e 00 31 46 b5
E: 4.203974 10 02 e0 51 66 3f a3 00 30 c5 b4
E: 4.211979 10 02 e0 51 68 3f 9e 00 30 47 b5
E: 4.219980 10 02 e0 51 69 3f 9a 00 31 c5 b4
E: 4.227979 10 02 e0 51 69 3f af 00 31 47 b7
E: 4.235979 10 02 e0 51 7b 3f 9b 00 2f c7 ba
E: 4.247979 10 02 e0 51 74 3f a4 00 31 c6 b7
E: 4.255978 10 02 e0 51 74 3f 90 00 32 45 b7
E: 4.263977 10 02 e0 51 79 3f a8 00 2f c6 bb
E: 4.271978 10 02 e0 51 78 3f 9d 00 30 c6 b5
E: 4.283978 10 02 e0 51 73 3f ac 00 31 47 b5
E: 4.291973 10 02 e0 51 7d 3f 98 00 2f c8 b9
E: 4.299977 10 02 e0 51 74 3f b0 00 30 c7 ba
E: 4.307979 10 02 e0 51 69 3f 7a 00 31 47 bb
E: 4.315977 10 02 e0 51 71 3f a5 00 31 45 b5
E: 4.327977 10 02 e0 51 6f 3f a3 00 30 c6 b4
E: 4.335976 10 02 e0 51 6f 3f aa 00 2f c8 b7
E: 4.343978 10 02 e0 51 69 3f b3 00 33 43 b7
E: 4.351977 10 02 e0 51 71 3f a0 00 31 45 b4
E: 4.363977 10 02 e0 51 6f 3f b0 00 32 45 b5
E: 4.371977 10 02 e0 51 76 3f a7 00 30 c7 bb
E: 4.379977 10 02 e0 51 77 3f ac 00 31 48 be
E: 4.387978 10 02 e0 51 76 3f 9f 00 31 c5 b7
E: 4.399977 10 02 e0 51 7a 3f 9c 00 30 c8 b6
E: 4.407980 10 02 e0 51 79 3f a1 00 30 c5 b4
E: 4.415977 10 02 e0 51 7e 3f ad 00 30 c7 b9
E: 4.423976 10 02 e0 51 7a 3f 80 00 30 c8 b8
E: 4.431979 10 02 e0 51 77 3f ad 00 31 46 bb
E: 4.443979 10 02 e0 51 71 3f 90 00 31 c5 b9
E: 4.451979 10 02 e0 51 6b 3f bd 00 31 44 ba
E: 4.455985 10 0c 00 00 00 00 01 00 00 00 00
E: 4.459917 10 02 e0 51 6a 3f b9 00 31 c3 b9
E: 4.467976 10 02 e0 51 6c 3f ca 00 31 42 ba
E: 4.479973 10 02 e0 51 5e 3f da 00 31 c2 b8
E: 4.487917 10 02 e0 51 5a 3f db 00 31 c2 b9
E: 4.495906 10 02 e0 51 5a 3f d8 00 31 be c1
E: 4.503931 10 02 e0 51 53 3f ee 00 31 bf bf
E: 4.515907 10 02 e0 51 54 3f ef 00 31 c2 c4
E: 4.523902 10 02 e0 51 46 3f ff 00 32 43 c1
E: 4.531913 10 02 e0 51 2d 40 06 00 32 c9 c7
E: 4.539977 10 02 e0 51 1b 40 15 00 33 cd ce
E: 4.547915 10 02 e0 51 0c 40 21 00 34 50 d3
E: 4.559900 10 02 e0 51 06 3f f9 00 33 73 d6
E: 4.567982 10 02 e0 51 03 40 22 00 34 f9 d4
E: 4.575919 10 02 e0 50 f7 40 0f 00 32 ff da
E: 4.583905 10 02 a0 50 f4 40 76 00 35 7f df
E: 4.595988 10 02 a0 50 fa 40 64 00 34 ff e0
E: 4.603985 10 02 a0 50 fe 40 fd 00 33 7f e7
E: 4.611910 10 02 a0 51 2f 41 6a 00 35 7f e4
E: 4.619904 10 02 a0 51 46 41 d6 00 34 ff e7
E: 4.631923 10 02 a0 51 80 41 eb 00 33 fd e4
E: 4.639914 10 02 a0 51 83 43 00 00 34 77 e8
E: 4.647909 10 02 a0 51 80 44 16 00 34 6f ef
E: 4.655927 10 02 a0 51 82 44 9f 00 33 ef ed
E: 4.663986 10 02 a0 51 c2 45 14 00 34 ee f1
E: 4.675912 10 02 a0 51 9c 45 88 00 37 6c f0
E: 4.683903 10 02 a0 51 c4 46 ef 00 37 6b f0
E: 4.687906 10 0c 00 00 00 00 00 00 00 00 00
E: 4.691907 10 02 a0 51 a7 47 d2 00 2e 7f ec
E: 4.699924 10 02 a0 51 b6 48 f2 00 32 ff ec
E: 4.711909 10 02 a0 51 9e 4a 40 00 32 7f ef
E: 4.719898 10 02 a0 51 e1 4b 56 00 32 79 ef
E: 4.727905 10 02 a0 52 53 4c d8 00 32 79 e8
E: 4.735981 10 02 a0 53 0d 4d 80 00 32 79 ed
E: 4.747907 10 02 a0 53 8f 4e 9e 00 38 77 e7
E: 4.755905 10 02 a0 54 20 4f ca 00 36 f0 e1
E: 4.763986 10 02 a0 54 b7 50 94 00 33 de e0
E: 4.771916 10 02 a0 55 56 51 87 00 32 d1 dc
E: 4.779903 10 02 e0 56 09 51 cf 00 2c 6e d2
E: 4.791904 10 02 e0 56 dc 52 99 00 27 df ca
E: 4.799972 10 02 e0 57 90 53 20 00 33 ce ca
E: 4.807911 10 02 e0 58 74 53 60 00 2f c7 bf
E: 4.815903 10 02 e0 59 44 53 87 00 2d cb b6
E: 4.827925 10 02 e0 5a 3f 53 8d 00 2a 4d b1
E: 4.835904 10 02 e0 5b 42 53 6a 00 26 ca ad
E: 4.843908 10 02 e0 5c 03 53 33 00 2e 4e ab
E: 4.851903 10 02 e0 5c bf 52 ce 00 2e 50 a5
E: 4.863927 10 02 e0 5d 68 52 67 00 2b d3 a2
E: 4.871907 10 02 e0 5e 10 51 ed 00 2a 55 9e
E: 4.879904 10 02 e0 5e a1 51 62 00 28 55 9a
E: 4.887905 10 02 e0 5f 1e 50 e0 00 26 d8 94
E: 4.895917 10 02 e0 5f 7a 50 43 00 2e 58 97
E: 4.907893 10 02 e0 5f c9 4f a6 00 2d 5b 98
E: 4.915903 10 02 e0 5f f9 4f 08 00 2d d3 9d
E: 4.923899 10 02 e0 60 0b 4e 6d 00 2d d2 9f
E: 4.931926 10 02 e0 5f fd 4d c4 00 2d d6 99
E: 4.943909 10 02 e0 5f d1 4d 17 00 2d d6 9f
E: 4.951903 10 02 e0 5f 82 4c 91 00 2e d8 9c
E: 4.959914 10 02 e0 5f 0d 4b f7 00 30 db aa
E: 4.967906 10 02 e0 5e 6b 4b 69 00 37 4a ad
E: 4.979903 10 02 e0 5d e1 4a f0 00 29 d1 b1
E: 4.987916 10 02 e0 5d 37 4a 7e 00 2c d1 b6
E: 4.995910 10 02 e0 5c 78 4a 29 00 30 50 b6
E: 5.003903 10 02 e0 5b be 49 e4 00 32 53 b8
E: 5.011913 10 02 e0 5a d7 49 ae 00 36 51 bf
E: 5.015928 10 0c 00 00 00 00 08 00 00 00 00
E: 5.023898 10 02 e0 59 d9 49 78 00 29 d6 ba
E: 5.031898 10 02 e0 58 e9 49 68 00 2e 55 c0
E: 5.039907 10 02 e0 58 07 49 53 00 31 54 c3
E: 5.047911 10 02 e0 57 11 49 7b 00 35 d2 c2
E: 5.051928 10 0c 00 00 00 00 0a 00 00 00 00
E: 5.059903 10 02 e0 56 04 49 6c 00 28 61 c9
E: 5.067901 10 02 e0 55 21 49 86 00 2d e2 ca
E: 5.075913 10 02 e0 54 62 49 b6 00 33 65 cf
E: 5.083925 10 02 e0 53 a8 4a 02 00 36 65 d2
E: 5.095908 10 02 e0 52 e3 4a 59 00 3a e6 d5
E: 5.103901 10 02 e0 52 26 4a bc 00 2d e7 d5
E: 5.111902 10 02 e0 51 71 4b 8f 00 32 63 db
E: 5.119911 10 02 e0 50 c4 4c 35 00 35 5d d9
E: 5.127907 10 02 a0 50 5a 4c b0 00 35 5d e3
E: 5.139918 10 02 a0 50 07 4d 4d 00 38 d5 e0
E: 5.147916 10 02 a0 4f a8 4d be 00 39 ff e0
E: 5.155905 10 02 a0 4f 48 4e 81 00 3b 7c e3
E: 5.163906 10 02 a0 4f 12 4f 82 00 3d 74 de
E: 5.175918 10 02 a0 4e d7 50 a1 00 3f e9 e5
E: 5.183915 10 02 a0 4e 9b 51 62 00 3f e3 e5
E: 5.191899 10 02 a0 4e 76 52 1c 00 3f e3 e6
E: 5.199900 10 02 a0 4e 49 52 84 00 3f ff e4
E: 5.207918 10 02 a0 4e 79 53 e5 00 2d 72 e6
E: 5.211902 10 0c 00 00 00 00 08 00 00 00 00
E: 5.219901 10 02 a0 4e 80 54 9e 00 2f 6d eb
E: 5.227897 10 02 a0 4e a5 55 1b 00 29 7f eb
E: 5.235924 10 02 a0 4f 0c 55 b4 00 27 ff e7
E: 5.243907 10 02 a0 4f 1d 55 cb 00 3d ff ea
E: 5.247901 10 0c 00 00 00 00 00 00 00 00 00
E: 5.255918 10 02 a0 4f 4e 57 29 00 3d ff e6
E: 5.263924 10 02 a0 4f 96 57 9d 00 3a f9 e5
E: 5.271905 10 02 a0 4f e8 58 59 00 39 67 e5
E: 5.279902 10 02 a0 50 2f 58 e4 00 39 67 e7
E: 5.291905 10 02 a0 50 89 59 43 00 35 5f e7
E: 5.299924 10 02 e0 50 d8 59 5f 00 32 7f df
E: 5.307909 10 02 a0 51 37 59 62 00 32 7f e0
E: 5.315900 10 02 a0 51 a7 59 9b 00 2f 7f e3
E: 5.323917 10 02 a0 51 fb 59 b1 00 2d 7e e1
E: 5.335912 10 02 a0 52 4f 59 b4 00 2b 7f e3
E: 5.343907 10 02 a0 52 92 59 a9 00 29 fb de
E: 5.351899 10 02 e0 53 2c 59 a4 00 29 fb dd
E: 5.359918 10 02 e0 53 4d 59 ac 00 39 7a dd
E: 5.371905 10 02 e0 53 9f 59 87 00 36 fa db
E: 5.379906 10 02 e0 53 d6 59 60 00 34 7b dd
E: 5.387903 10 02 e0 53 fb 59 43 00 35 78 dc
E: 5.395916 10 02 e0 54 0e 59 27 00 34 77 d9
E: 5.407898 10 02 e0 54 32 59 35 00 34 7b db
E: 5.415901 10 02 e0 54 46 59 1b 00 34 78 d7
E: 5.423915 10 02 e0 54 64 59 00 00 33 fa d8
E: 5.431923 10 02 e0 54 7a 58 ef 00 32 f9 d9
E: 5.439906 10 02 e0 54 9c 58 c8 00 31 75 d5
E: 5.451893 10 02 e0 54 ae 58 95 00 31 f2 d6
E: 5.459916 10 02 e0 54 c1 58 86 00 2f f5 d4
E: 5.467905 10 02 e0 54 c6 58 73 00 2f f7 d1
E: 5.475906 10 02 e0 54 d9 58 4c 00 2f f8 d6
E: 5.487899 10 02 e0 54 ff 58 24 00 2e 7c d6
E: 5.495914 10 02 e0 54 f1 57 d9 00 2e 7f d7
E: 5.503922 10 02 e0 54 e5 57 ef 00 2d ff db
E: 5.511906 10 02 e0 54 e8 57 ab 00 2d 7f d9
E: 5.523916 10 02 e0 54 ea 57 a4 00 2d ff d9
E: 5.527923 10 0c 01 00 00 00 00 00 00 00 00
E: 5.531909 10 02 e0 54 e8 57 73 00 2e ff de
E: 5.539905 10 02 e0 54 b3 57 cd 00 32 e2 da
E: 5.547895 10 02 e0 54 b1 57 dd 00 33 64 d5
E: 5.555894 10 02 e0 54 b7 57 ce 00 32 df d4
E: 5.567900 10 02 e0 54 ab 57 d9 00 33 62 d9
E: 5.571901 10 0c 00 80 00 00 00 00 00 00 00
E: 5.575906 10 02 e0 54 aa 57 ce 00 33 e2 d6
E: 5.583899 10 02 e0 54 a5 57 eb 00 32 e1 d3
E: 5.591896 10 02 e0 54 b2 57 fe 00 33 de d7
E: 5.603926 10 02 e0 54 a3 58 07 00 33 5f d3
E: 5.611907 10 02 e0 54 a3 58 07 00 32 db d1
E: 5.619897 10 02 e0 54 ac 58 29 00 33 5c d6
E: 5.627915 10 02 e0 54 a5 57 ff 00 32 58 d3
E: 5.639903 10 02 e0 54 8a 58 38 00 32 da d7
E: 5.647896 10 02 e0 54 8c 58 0c 00 33 57 d9
E: 5.655899 10 02 e0 54 89 58 34 00 32 d9 cc
E: 5.663922 10 02 e0 54 8d 58 29 00 33 d7 ce
E: 5.671903 10 02 e0 54 84 58 2e 00 32 56 cc
E: 5.683892 10 02 e0 54 8a 58 16 00 31 d8 ce
E: 5.691891 10 02 e0 54 8a 58 0e 00 32 56 cf
E: 5.699893 10 02 e0 54 90 58 0f 00 32 d4 c8
E: 5.707892 10 02 e0 54 9b 58 10 00 31 d7 c9
E: 5.711920 10 0c 00 40 00 00 00 00 00 00 00
E: 5.719909 10 02 e0 54 9b 57 f0 00 31 d3 cd
E: 5.727904 10 02 e0 54 a5 57 fa 00 31 d0 c9
E: 5.731903 10 0c 00 20 00 00 00 00 00 00 00
E: 5.735889 10 02 e0 54 9b 57 e7 00 31 51 cd
E: 5.743905 10 02 e0 54 9a 57 a5 00 31 51 cb
E: 5.755900 10 02 e0 54 97 57 b2 00 31 d2 ca
E: 5.759915 10 0c 00 10 00 00 00 00 00 00 00
E: 5.763904 10 02 e0 54 8f 57 96 00 31 54 ca
E: 5.771905 10 02 e0 54 91 57 86 00 31 d3 c9
E: 5.779903 10 02 e0 54 84 57 66 00 31 55 cd
E: 5.787894 10 02 e0 54 81 57 6a 00 31 d6 cf
E: 5.795913 10 0c 00 08 00 00 00 00 00 00 00
E: 5.799906 10 02 e0 54 82 57 82 00 31 54 c9
E: 5.807905 10 02 e0 54 77 57 72 00 31 d9 d2
E: 5.815900 10 02 e0 54 73 57 71 00 32 57 cf
E: 5.819900 10 0c 00 04 00 00 00 00 00 00 00
E: 5.823905 10 02 e0 54 6f 57 6c 00 32 59 c8
E: 5.835920 10 02 e0 54 64 57 8a 00 33 59 d0
E: 5.843904 10 02 e0 54 5d 57 a0 00 32 d6 cf
E: 5.851897 10 02 e0 54 5c 57 b1 00 33 5b d3
E: 5.859895 10 02 e0 54 75 57 c5 00 32 d8 cd
E: 5.871898 10 02 e0 54 71 57 a5 00 32 d8 cf
E: 5.879895 10 02 e0 54 71 57 9b 00 32 5a d2
E: 5.887888 10 02 e0 54 81 57 d3 00 32 5a cf
E: 5.895900 10 02 e0 54 85 57 a4 00 32 d9 cc
E: 5.903889 10 02 e0 54 7c 57 f7 00 33 5b d5
E: 5.915889 10 02 e0 54 6f 57 e2 00 33 56 cc
E: 5.919892 10 0c 00 10 00 00 00 00 00 00 00
E: 5.923899 10 02 e0 54 6f 58 11 00 33 da cd
E: 5.931914 10 02 e0 54 62 58 36 00 33 57 cd
E: 5.939899 10 02 e0 54 5b 58 2d 00 33 57 cd
E: 5.943900 10 0c 00 20 00 00 00 00 00 00 00
E: 5.951929 10 02 e0 54 54 58 44 00 33 d9 d2
E: 5.959905 10 02 e0 54 48 58 60 00 33 d7 d3
E: 5.963901 10 0c 01 00 00 00 00 00 00 00 00
E: 5.967908 10 02 e0 54 49 58 61 00 33 57 ce
E: 5.975903 10 02 e0 54 3c 58 73 00 32 d8 d1
E: 5.987902 10 02 e0 54 37 58 40 00 33 71 d7
E: 5.991910 10 0c 02 00 00 00 00 00 00 00 00
E: 5.995903 10 02 e0 54 40 58 61 00 32 72 d2
E: 6.003897 10 02 e0 54 3b 58 54 00 32 72 d6
E: 6.007906 10 0c 04 00 00 00 00 00 00 00 00
E: 6.011905 10 02 e0 54 3b 58 2f 00 32 75 d6
E: 6.019975 10 02 e0 54 2e 58 61 00 32 ee d3
E: 6.027902 10 0c 10 00 00 00 00 00 00 00 00
E: 6.031903 10 02 e0 54 36 58 21 00 34 70 d0
E: 6.039897 10 02 e0 54 2d 58 73 00 33 70 d1
E: 6.047926 10 02 e0 54 23 58 5c 00 33 6d d0
E: 6.055904 10 02 e0 54 31 58 82 00 31 ef d6
E: 6.067897 10 02 e0 54 27 58 84 00 32 ed d1
E: 6.075901 10 02 e0 54 17 58 7f 00 32 6f d0
E: 6.083971 10 02 e0 54 0d 58 82 00 34 e9 d2
E: 6.087918 10 0c 00 00 00 00 00 00 00 00 00
E: 6.091907 10 02 e0 53 fd 58 83 00 33 ed d3
E: 6.099897 10 02 e0 54 19 58 6f 00 34 6d d0
E: 6.111903 10 02 e0 54 17 58 85 00 33 6d d0
E: 6.119917 10 02 e0 54 16 58 8c 00 32 72 d1
E: 6.127905 10 02 e0 54 15 58 71 00 33 6c d1
E: 6.135891 10 02 e0 54 1c 58 6f 00 33 ef d0
E: 6.147927 10 02 e0 54 1b 58 3a 00 32 f3 d3
E: 6.155907 10 02 e0 54 29 58 54 00 31 73 d6
E: 6.163897 10 02 e0 54 28 58 21 00 33 75 d2
E: 6.171890 10 02 e0 54 2e 58 4f 00 32 f5 d5
E: 6.183893 10 02 e0 54 21 58 54 00 32 75 d5
E: 6.191906 10 02 e0 54 27 58 4a 00 33 f6 d6
E: 6.199898 10 02 e0 54 28 58 65 00 32 73 da
E: 6.207894 10 02 e0 54 39 58 6d 00 33 74 d6
E: 6.215978 10 02 e0 54 3c 58 8a 00 31 f9 d7
E: 6.227907 10 02 e0 54 4f 58 92 00 32 f9 da
E: 6.235892 10 02 e0 54 59 58 a2 00 33 77 d7
E: 6.243920 10 02 e0 54 5c 58 c5 00 31 f9 d5
E: 6.251979 10 02 e0 54 74 58 d3 00 32 f5 d6
E: 6.263899 10 02 e0 54 a4 58 dc 00 2f 79 d7
E: 6.271895 10 02 e0 54 c0 59 12 00 30 f8 d8
E: 6.279890 10 02 e0 54 cb 59 15 00 30 75 d7
E: 6.287901 10 02 e0 54 e9 59 45 00 30 74 d5
E: 6.299895 10 02 e0 55 0d 59 57 00 2f f1 d2
E: 6.307912 10 02 e0 55 23 59 99 00 2e ef d7
E: 6.315919 10 02 e0 55 3a 59 dc 00 2e 6e d5
E: 6.323903 10 02 e0 55 5f 59 ec 00 2d ea d7
E: 6.331892 10 02 e0 55 76 5a 1c 00 2c e7 d2
E: 6.343910 10 02 e0 55 84 5a 3d 00 2c 63 d6
E: 6.351918 10 02 e0 55 97 5a 80 00 2c 60 cc
E: 6.359902 10 02 e0 55 a6 5a 94 00 2b e0 cc
E: 6.367895 10 02 e0 55 b2 5a b2 00 2c 5e d1
E: 6.379919 10 02 e0 55 c0 5a b2 00 2b 5c ce
E: 6.387900 10 02 e0 55 bf 5a e3 00 2b 5f cc
E: 6.395898 10 02 e0 55 d2 5a cb 00 2b 5b d1
E: 6.403898 10 02 e0 55 dc 5a e5 00 2b 5b ce
E: 6.415919 10 02 e0 55 d4 5a b5 00 2c 57 ce
E: 6.423903 10 02 e0 55 cc 5a df 00 2c 59 ce
E: 6.427906 10 0c 00 00 00 00 08 00 00 00 00
E: 6.431900 10 02 e0 55 d8 5a aa 00 2b 5a c9
E: 6.439894 10 02 e0 55 c8 5a 9a 00 2a 5f cc
E: 6.447973 10 02 e0 55 c2 5a 6f 00 2a db d1
E: 6.459904 10 02 e0 55 ae 5a 58 00 2b 5c cd
E: 6.467894 10 02 e0 55 bd 5a 16 00 2a e2 d1
E: 6.475907 10 02 e0 55 9f 5a 01 00 2b 63 cd
E: 6.483922 10 02 e0 55 85 59 e4 00 2a e9 cd
E: 6.495898 10 02 e0 55 5a 59 9d 00 2d 6b d3
E: 6.503888 10 02 e0 55 24 59 70 00 2d 6c cc
E: 6.511896 10 02 e0 54 d5 59 26 00 30 6d d0
E: 6.519912 10 02 e0 54 86 59 2d 00 31 6f cc
E: 6.531898 10 02 e0 54 1b 59 0a 00 33 ee d3
E: 6.539915 10 02 e0 53 ba 59 13 00 35 6c d3
E: 6.547917 10 02 e0 53 4d 58 fe 00 37 eb d2
E: 6.555902 10 02 e0 52 8f 59 0b 00 3b eb d2
E: 6.563898 10 02 e0 51 ef 59 0f 00 2b 70 ce
E: 6.575973 10 02 e0 51 5a 59 45 00 2f 71 d7
E: 6.583967 10 02 e0 50 c7 59 6b 00 33 6a d3
E: 6.591903 10 02 e0 50 57 59 aa 00 34 ea d5
E: 6.599896 10 02 e0 4f e7 59 e5 00 36 ea d4
E: 6.611910 10 02 e0 4f 80 5a 24 00 38 e6 d7
E: 6.619918 10 02 e0 4f 2c 5a 71 00 3a 65 d6
E: 6.627901 10 02 e0 4e ce 5a 9c 00 3d 63 d4
E: 6.635894 10 02 e0 4e 97 5b 16 00 3f 64 d6
E: 6.647909 10 02 e0 4e 78 5b 19 00 3f e1 da
E: 6.655884 10 02 e0 4e 9b 5b cc 00 2d 5b d6
E: 6.663898 10 02 e0 4e c5 5c 0b 00 2d 5b d9
E: 6.671894 10 02 e0 4f 2a 5c 95 00 3b dc d4
E: 6.679916 10 02 e0 4f 7c 5c d5 00 39 d7 da
E: 6.691900 10 02 a0 50 07 5d 2e 00 36 d2 de
E: 6.699889 10 02 e0 50 a7 5d 38 00 33 eb d8
E: 6.707905 10 02 e0 51 ad 5d 45 00 2b 73 db
E: 6.715906 10 02 e0 53 09 5d 82 00 24 70 db
E: 6.727902 10 02 e0 54 3f 5d 9a 00 32 ed da
E: 6.735894 10 02 e0 55 d0 5d a2 00 27 ed d4
E: 6.743907 10 02 e0 57 82 5d b1 00 1f ea d7
E: 6.747901 10 0c 00 00 00 00 00 00 00 00 00
E: 6.751904 10 02 e0 58 d6 5d ab 00 2d 68 d5
E: 6.763902 10 02 e0 5a 40 5d 79 00 25 ef d4
E: 6.771894 10 02 e0 5b de 5d 82 00 1d 69 d5
E: 6.779935 10 02 e0 5c de 5d 47 00 2c 73 d6
E: 6.787905 10 02 e0 5e 2f 5d 78 00 25 f2 d6
E: 6.795902 10 02 e0 5f 79 5d 4e 00 33 eb d7
E: 6.807896 10 02 e0 60 ef 5d 42 00 2a f2 d7
E: 6.815975 10 02 e0 62 7c 5d 0e 00 21 f3 d0
E: 6.823901 10 02 e0 63 f3 5c f7 00 2f 6e d2
E: 6.831894 10 02 e0 65 7d 5c d8 00 24 72 d3
E: 6.843975 10 02 e0 66 b6 5c ae 00 1f 6e d2
E: 6.851963 10 02 e0 67 a7 5c 68 00 2c 69 cc
E: 6.859903 10 02 e0 68 73 5c 65 00 26 eb cf
E: 6.867895 10 02 e0 68 f2 5c 2c 00 24 70 cc
E: 6.875895 10 02 e0 69 4b 5c 1d 00 24 70 cf
E: 6.887906 10 02 e0 69 b9 5b eb 00 21 71 cc
E: 6.895900 10 02 e0 69 a8 5b 9a 00 20 f1 d3
E: 6.903888 10 02 e0 68 f3 5c 1e 00 25 cf cf
E: 6.911908 10 02 e0 68 0e 5c 42 00 2b cf cf
E: 6.923900 10 02 e0 67 0d 5c a3 00 31 4b c9
E: 6.931894 10 02 e0 66 09 5c c9 00 23 c4 c8
E: 6.939910 10 02 e0 65 41 5d 2d 00 26 c4 d4
E: 6.947915 10 02 e0 64 9e 5d 76 00 28 db cd
E: 6.959900 10 02 e0 63 f3 5d fa 00 2d d7 cc
E: 6.963897 10 02 e0 63 5f 5e 91 00 2d d7 d1
E: 6.975916 10 02 e0 62 bf 5f cd 00 20 cb d2
E: 6.983915 10 02 e0 62 10 61 01 00 24 c8 d5
E: 6.991898 10 02 e0 61 9d 62 2f 00 27 45 dd
E: 7.003891 10 02 e0 61 46 63 5f 00 27 d4 d9
E: 7.011907 10 02 e0 61 1a 64 e3 00 2c 55 dc
E: 7.019914 10 02 a0 60 ac 65 fc 00 2e db e5
E: 7.027900 10 02 a0 60 67 67 54 00 2c e9 e4
E: 7.039909 10 02 a0 60 79 68 cf 00 30 e8 eb
E: 7.043913 10 02 80 00 00 00 00 00 00 00 00
E: 7.519907 10 0c 00 00 00 00 00 01 00 00 00
E: 7.715908 10 0c 00 00 00 00 00 00 00 00 00
E: 7.851906 10 0c 00 00 00 00 00 04 00 00 00
E: 8.011904 10 0c 00 00 00 00 00 00 00 00 00
E: 8.251890 10 0c 00 00 00 00 00 02 00 00 00
E: 8.419887 10 0c 00 00 00 00 00 00 00 00 00
E: 8.539889 10 0c 00 00 00 00 00 08 00 00 00
E: 8.703901 10 0c 00 00 00 00 00 00 00 00 00
E: 8.987885 10 0c 00 00 10 00 00 00 00 00 00
E: 9.059887 10 0c 00 00 08 00 00 00 00 00 00
E: 9.099885 10 0c 00 00 04 00 00 00 00 00 00
E: 9.123881 10 0c 00 00 01 00 00 00 00 00 00
E: 9.143885 10 0c 00 00 00 80 00 00 00 00 00
E: 9.163900 10 0c 00 00 00 10 00 00 00 00 00
E: 9.207885 10 0c 00 00 00 08 00 00 00 00 00
E: 9.227885 10 0c 00 00 00 04 00 00 00 00 00
E: 9.247882 10 0c 00 00 00 02 00 00 00 00 00
E: 9.271881 10 0c 00 00 00 01 00 00 00 00 00
E: 9.351884 10 0c 00 00 00 04 00 00 00 00 00
E: 9.375885 10 0c 00 00 00 10 00 00 00 00 00
E: 9.395899 10 0c 00 00 00 20 00 00 00 00 00
E: 9.435882 10 0c 00 00 01 00 00 00 00 00 00
E: 9.459886 10 0c 00 00 02 00 00 00 00 00 00
E: 9.479882 10 0c 00 00 04 00 00 00 00 00 00
E: 9.499881 10 0c 00 00 08 00 00 00 00 00 00
E: 9.523881 10 0c 00 00 10 00 00 00 00 00 00
E: 9.543882 10 0c 00 00 00 00 00 00 00 00 00
E: 10.347878 10 02 c2 82 b0 47 5d f5 00 00 00
E: 10.355948 10 02 e0 61 c6 44 4e 6f 68 d5 5c
E: 10.367884 10 02 e0 61 56 43 db 71 e7 d6 57
E: 10.375944 10 02 e0 60 e4 43 54 72 e9 d5 54
E: 10.383945 10 02 e0 60 73 42 db 74 28 d7 50
E: 10.391944 10 02 e0 5f fc 42 57 73 e8 d6 4a
E: 10.399947 10 02 e0 5f 86 41 dc 74 28 d6 4b
E: 10.411948 10 02 e0 5f 00 41 5a 74 69 53 49
E: 10.419948 10 02 e0 5e 5e 40 e0 74 a8 52 44
E: 10.427949 10 02 e0 5d bb 40 75 74 27 52 47
E: 10.435949 10 02 e0 5d 17 40 22 72 66 d3 44
E: 10.447949 10 02 e0 5c 58 3f d6 71 a5 56 4c
E: 10.455947 10 02 e0 5b 7b 3f 87 71 67 d6 49
E: 10.463947 10 02 e0 5a 73 3f 59 71 28 55 4a
E: 10.471911 10 02 e0 59 73 3f 3e 70 e8 56 46
E: 10.483945 10 02 e0 58 89 3f 25 70 a8 58 47
E: 10.491943 10 02 e0 57 ae 3f 28 71 28 57 48
E: 10.499949 10 02 e0 56 f7 3f 3c 70 a8 57 44
E: 10.507949 10 02 e0 56 5a 3f 4e 6f a8 56 49
E: 10.515946 10 02 e0 55 d7 3f 8d 6d e8 54 45
E: 10.527947 10 02 e0 55 6b 3f e1 67 67 56 49
E: 10.535948 10 02 e0 55 0d 40 4f 65 e7 56 51
E: 10.543947 10 02 e0 54 d1 40 b3 64 66 55 4f
E: 10.551947 10 02 e0 54 98 41 36 64 a6 d6 4e
E: 10.563948 10 02 e0 54 65 41 d9 5d 26 d7 4f
E: 10.571947 10 02 e0 54 3a 42 9d 57 67 56 49
E: 10.579947 10 02 e0 54 10 43 78 56 27 d5 4d
E: 10.587947 10 02 e0 53 cc 44 68 55 67 d5 59
E: 10.599945 10 02 e0 53 56 45 88 54 a5 d5 4e
E: 10.607946 10 02 e0 52 d9 46 d2 54 a7 54 4b
E: 10.615947 10 02 e0 52 84 48 05 54 e7 d0 48
E: 10.623948 10 02 e0 52 64 49 00 54 e7 d0 67
E: 10.631946 10 02 e0 52 7e 49 f3 55 e7 d0 52
E: 10.643946 10 02 e0 52 b4 4a f5 59 28 50 4c
E: 10.651946 10 02 e0 53 02 4c 05 5f 28 50 4c
E: 10.659946 10 02 e0 53 66 4d 09 64 e8 50 66
E: 10.667946 10 02 e0 53 f0 4d fa 6a e7 4f 4d
E: 10.679948 10 02 e0 54 9b 4e f2 6e 68 50 48
E: 10.687946 10 02 e0 55 73 4f c9 6f e8 4d 47
E: 10.695946 10 02 e0 56 9b 50 6a 70 e8 cc 52
E: 10.703943 10 02 e0 57 e5 50 cd 73 e7 cd 48
E: 10.715947 10 02 e0 59 57 51 08 74 e6 cc 49
E: 10.723946 10 02 e0 5a ea 51 1e 75 a7 4a 49
E: 10.731946 10 02 e0 5c 70 51 05 76 a6 cd 4b
E: 10.739946 10 02 e0 5d fd 50 ce 77 26 4a 4a
E: 10.747947 10 02 e0 5f 92 50 76 77 62 c8 44
E: 10.759887 10 02 e0 60 f9 4f fa 77 24 d0 52
E: 10.767946 10 02 e0 62 60 4f 3a 77 65 cf 52
E: 10.775946 10 02 e0 63 d2 4e 5d 77 65 cf 4a
E: 10.783942 10 02 e0 65 05 4d 6f 76 e4 4e 46
E: 10.795945 10 02 e0 66 12 4c 73 77 e3 cc 44
E: 10.803947 10 02 e0 66 e6 4b 72 78 a3 cc 59
E: 10.811945 10 02 e0 67 85 4a 5a 7b 62 4d 4f
E: 10.819947 10 02 e0 67 d8 49 33 83 64 ce 49
E: 10.831947 10 02 e0 68 03 48 1f 8d a2 cf 47
E: 10.835951 10 02 e0 68 03 46 da 95 62 cf 67
E: 10.847946 10 02 e0 67 eb 45 5d 97 22 d1 44
E: 10.855946 10 02 e0 67 ac 44 19 97 e3 d0 3a
E: 10.863942 10 02 e0 67 49 42 dd 98 e3 d0 5c
E: 10.875945 10 02 e0 66 b7 41 a1 99 e4 53 40
E: 10.883942 10 02 e0 66 0c 40 94 9b e4 53 3a
E: 10.891941 10 02 e0 65 49 3f b1 9d 22 d5 44
E: 10.899945 10 02 e0 64 60 3e d8 9d e3 d9 42
E: 10.911945 10 02 e0 63 72 3e 20 9d a4 58 3a
E: 10.919948 10 02 e0 62 58 3d 8c 9e 64 d8 34
E: 10.927944 10 02 e0 61 3c 3d 1a 9f e3 58 33
E: 10.935945 10 02 e0 5f e6 3c da 9f 63 d9 35
E: 10.943949 10 02 e0 5e 91 3c c6 9f 63 d9 35
E: 10.955946 10 02 e0 5d 0d 3c e2 9f e4 58 35
E: 10.963945 10 02 e0 5b 7d 3d 3c 9f e6 5a 34
E: 10.971946 10 02 e0 59 c7 3d e6 9f e6 d6 39
E: 10.979944 10 02 e0 58 32 3e c0 9f a7 da 3c
E: 10.991942 10 02 e0 56 d1 3f c9 a0 29 55 3c
E: 10.999945 10 02 e0 55 a2 40 b2 9f e9 55 58
E: 11.007945 10 02 e0 54 d1 41 9f 9f 28 d6 4a
E: 11.015945 10 02 e0 54 1b 42 c1 9f e8 d6 46
E: 11.027944 10 02 e0 53 88 43 f4 9f e8 56 47
E: 11.035947 10 02 e0 53 18 45 1b 9c ea 55 49
E: 11.043945 10 02 e0 52 c6 46 65 9b ab d5 49
E: 11.051945 10 02 e0 52 91 47 a8 9f a9 d1 41
E: 11.059945 10 02 e0 52 80 48 cc 9d 29 d1 5f
E: 11.071941 10 02 e0 52 86 49 dc 9e ea d0 53
E: 11.079946 10 02 e0 52 a5 4b 08 9f ea d0 4d
E: 11.087944 10 02 e0 52 e6 4c 22 9f 6a ce 48
E: 11.095944 10 02 e0 53 45 4d 14 9b ea ce 68
E: 11.107945 10 02 e0 53 c3 4d e6 9e 6a 50 52
E: 11.115944 10 02 e0 54 64 4e a4 9d 2a 4f 4f
E: 11.123944 10 02 e0 55 1b 4f 3c 9b ea cf 49
E: 11.131946 10 02 e0 55 f7 4f a4 98 2a ce 53
E: 11.143945 10 02 e0 56 fc 4f ed 90 ea ce 4f
E: 11.151943 10 02 e0 58 02 50 12 8a 2a ce 50
E: 11.159944 10 02 e0 59 0f 50 2a 82 2a ce 57
E: 11.167944 10 02 e0 5a 2d 50 48 74 ea ce 50
E: 11.175944 10 02 e0 5b 4e 50 83 62 e8 cd 4f
E: 11.187944 10 02 e0 5c 3c 50 d2 44 e9 d1 52
E: 11.195944 10 02 e0 5d 16 51 51 19 e8 cf 52
E: 11.203940 10 02 e0 5d b8 51 bc 00 27 cd 52
E: 11.211944 10 02 e0 5d cb 51 ce 00 27 4e 60
E: 11.223943 10 02 e0 5d 2e 51 ad 00 28 51 78
E: 11.231944 10 02 e0 5c 01 51 27 00 2c de 96
E: 11.239943 10 02 e0 5a 19 50 a2 00 3b 6e af
E: 11.247944 10 02 e0 58 46 50 13 00 2f 7f c8
E: 11.259943 10 02 a0 55 fe 4f ab 00 3f ff dc
E: 11.267943 10 02 a0 54 12 4f 7a 00 34 7f e5
E: 11.275945 10 02 80 00 00 00 00 00 00 00 00
