# 034:0 -> 056A:0013 / WACOM | CTE-430-UV3.1-4
D:0
R: 98 05 01 09 02 a1 01 85 01 09 01 a1 00 05 09 19 01 29 03 15 00 25 01 95 03 75 01 81 02 95 01 75 05 81 01 05 01 09 30 09 31 09 38 15 81 25 7f 75 08 95 03 81 06 c0 c0 05 0d 09 01 a1 01 85 02 a1 00 06 00 ff 09 01 15 00 26 ff 00 75 08 95 07 81 02 c0 09 01 85 02 95 01 b1 02 09 01 85 03 95 01 b1 02 c0
N: WACOM CTE-430-UV3.1-4
P: usb-0000:00:14.0-6.0/input0
I: 3 056A 0013
# SET_REPORT (Feature) ID: 02 -> 02 02 (length 2)
E: 0.000000 8 02 00 00 00 00 00 00 00
E: 2.352052 8 02 d0 00 12 08 11 00 11
E: 2.360001 8 02 d0 35 12 f7 10 00 13
E: 2.368067 8 02 d0 62 12 ef 10 00 15
E: 2.384061 8 02 d0 88 12 ee 10 00 18
E: 2.392067 8 02 d0 96 12 e4 10 00 1b
E: 2.400067 8 02 d0 9d 12 bf 10 00 1d
E: 2.408068 8 02 d0 9f 12 95 10 00 1f
E: 2.424062 8 02 d0 a5 12 81 10 00 21
E: 2.432035 8 02 d0 a8 12 7d 10 00 21
E: 2.440067 8 02 d0 a9 12 7c 10 00 22
E: 2.448067 8 02 d0 a8 12 7c 10 00 22
E: 2.464062 8 02 d0 a7 12 7d 10 00 22
E: 2.472066 8 02 d0 a9 12 7d 10 00 23
E: 2.480065 8 02 d0 a7 12 7d 10 00 23
E: 2.496063 8 02 d0 a7 12 7e 10 00 23
E: 2.504068 8 02 d0 a7 12 7c 10 00 23
E: 2.512068 8 02 d0 a8 12 7d 10 00 23
E: 2.520067 8 02 d0 a7 12 7d 10 00 23
E: 2.536062 8 02 d0 a6 12 7d 10 00 23
E: 2.544066 8 02 d0 a6 12 7c 10 00 23
E: 2.552067 8 02 d0 a6 12 7e 10 00 23
E: 2.560062 8 02 d0 a7 12 7c 10 00 23
E: 2.576061 8 02 d0 a7 12 7d 10 00 23
E: 2.584067 8 02 d0 a6 12 7e 10 00 23
E: 2.592066 8 02 d0 a7 12 7e 10 00 23
E: 2.600066 8 02 d0 a7 12 7c 10 00 23
E: 2.616059 8 02 d0 a7 12 7d 10 00 23
E: 2.624066 8 02 d0 a6 12 7d 10 00 23
E: 2.632062 8 02 d0 a6 12 7d 10 00 23
E: 2.648061 8 02 d0 a5 12 7c 10 00 23
E: 2.656066 8 02 d0 a6 12 7d 10 00 23
E: 2.664065 8 02 d0 a7 12 7c 10 00 23
E: 2.672066 8 02 d0 a6 12 7d 10 00 23
E: 2.688058 8 02 d0 a7 12 7e 10 00 23
E: 2.696066 8 02 d0 a5 12 7d 10 00 23
E: 2.704066 8 02 d0 a6 12 7d 10 00 23
E: 2.712067 8 02 d0 a3 12 7b 10 00 23
E: 2.728061 8 02 d0 84 12 70 10 00 23
E: 2.736067 8 02 d0 49 12 60 10 00 23
E: 2.744067 8 02 d0 f1 11 59 10 00 23
E: 2.752068 8 02 d0 a0 11 5f 10 00 23
E: 2.768061 8 02 d0 5e 11 6e 10 00 23
E: 2.776066 8 02 d0 24 11 8c 10 00 23
E: 2.784065 8 02 d0 ee 10 b3 10 00 23
E: 2.800061 8 02 d0 bc 10 e3 10 00 23
E: 2.808065 8 02 d0 89 10 1b 11 00 24
E: 2.816005 8 02 d0 5a 10 5f 11 00 24
E: 2.824063 8 02 d0 30 10 aa 11 00 25
E: 2.840061 8 02 d0 15 10 fa 11 00 24
E: 2.848065 8 02 d0 0b 10 54 12 00 26
E: 2.856065 8 02 d0 11 10 a9 12 00 24
E: 2.864065 8 02 d0 26 10 02 13 00 23
E: 2.880060 8 02 d0 52 10 5d 13 00 23
E: 2.888065 8 02 d0 8e 10 bd 13 00 23
E: 2.896066 8 02 d0 df 10 1d 14 00 23
E: 2.904062 8 02 d0 40 11 74 14 00 24
E: 2.920061 8 02 d0 b0 11 bf 14 00 24
E: 2.928065 8 02 d0 38 12 00 15 00 24
E: 2.936062 8 02 d0 ca 12 30 15 00 25
E: 2.952055 8 02 d0 5e 13 56 15 00 25
E: 2.960065 8 02 d0 02 14 69 15 00 24
E: 2.968006 8 02 d0 a0 14 6e 15 00 24
E: 2.976063 8 02 d0 29 15 5d 15 00 24
E: 2.992060 8 02 d0 b2 15 3f 15 00 24
E: 3.000064 8 02 d0 24 16 0e 15 00 25
E: 3.008060 8 02 d0 87 16 d2 14 00 23
E: 3.016060 8 02 d0 ca 16 8d 14 00 24
E: 3.032055 8 02 d0 f7 16 3c 14 00 23
E: 3.040064 8 02 d0 10 17 e3 13 00 23
E: 3.048063 8 02 d0 16 17 8a 13 00 23
E: 3.056064 8 02 d0 0b 17 32 13 00 23
E: 3.072059 8 02 d0 ee 16 e2 12 00 24
E: 3.080063 8 02 d0 c2 16 97 12 00 25
E: 3.088064 8 02 d0 86 16 51 12 00 24
E: 3.104060 8 02 d0 3a 16 12 12 00 25
E: 3.112061 8 02 d0 ea 15 e3 11 00 26
E: 3.120065 8 02 d0 8a 15 c6 11 00 24
E: 3.128064 8 02 d0 33 15 ba 11 00 24
E: 3.144058 8 02 d0 db 14 bc 11 00 24
E: 3.152064 8 02 d0 91 14 c6 11 00 24
E: 3.160063 8 02 d0 48 14 df 11 00 24
E: 3.168066 8 02 d0 11 14 f9 11 00 26
E: 3.184060 8 02 d0 f2 13 16 12 00 26
E: 3.192065 8 02 d0 e3 13 38 12 00 25
E: 3.200063 8 02 d0 da 13 59 12 00 25
E: 3.208063 8 02 d0 db 13 75 12 00 24
E: 3.224059 8 02 d0 e0 13 8f 12 00 24
E: 3.232060 8 02 d0 e7 13 a0 12 00 24
E: 3.240064 8 02 d0 ed 13 ac 12 00 24
E: 3.256058 8 02 d0 ed 13 b1 12 00 24
E: 3.264062 8 02 d0 ed 13 b2 12 00 25
E: 3.272063 8 02 d0 ed 13 b1 12 00 25
E: 3.280063 8 02 d0 ec 13 b2 12 00 25
E: 3.296058 8 02 d0 ed 13 b1 12 00 25
E: 3.304063 8 02 d0 ef 13 b0 12 00 25
E: 3.312063 8 02 d0 ec 13 af 12 00 25
E: 3.320063 8 02 d0 ed 13 af 12 00 25
E: 3.336058 8 02 d0 ec 13 aa 12 00 25
E: 3.344062 8 02 d0 eb 13 a8 12 00 25
E: 3.352063 8 02 d0 ec 13 a8 12 00 25
E: 3.360064 8 02 d0 eb 13 a7 12 00 25
E: 3.376057 8 02 d0 ec 13 a4 12 00 25
E: 3.384062 8 02 d0 ec 13 a2 12 00 25
E: 3.392062 8 02 d0 eb 13 a0 12 00 25
E: 3.408057 8 02 d0 eb 13 9f 12 00 25
E: 3.415994 8 02 d0 e9 13 9d 12 00 25
E: 3.424016 8 02 d0 e8 13 9e 12 00 25
E: 3.432003 8 02 d0 e7 13 9b 12 00 25
E: 3.448058 8 02 d0 e6 13 9e 12 ff 24
E: 3.456062 8 02 d0 e6 13 9f 12 ff 25
E: 3.464061 8 02 d0 e5 13 a2 12 00 24
E: 3.472019 8 02 d0 e3 13 a3 12 ff 24
E: 3.488013 8 02 d0 e0 13 a2 12 ff 24
E: 3.495993 8 02 d0 dc 13 a5 12 ff 24
E: 3.504019 8 02 d0 d9 13 aa 12 00 24
E: 3.512062 8 02 d0 d8 13 ac 12 ff 25
E: 3.528015 8 02 d0 d5 13 ad 12 00 24
E: 3.536002 8 02 d0 d4 13 ae 12 00 25
E: 3.544063 8 02 d0 d5 13 ad 12 ff 24
E: 3.560015 8 02 d0 d6 13 ad 12 00 25
E: 3.568005 8 02 d0 d5 13 af 12 00 25
E: 3.576016 8 02 d0 d5 13 ab 12 ff 25
E: 3.584062 8 02 d0 d5 13 ac 12 00 25
E: 3.600055 8 02 d0 d5 13 ac 12 00 25
E: 3.608018 8 02 d0 d7 13 ad 12 00 25
E: 3.616065 8 02 d0 d3 13 ad 12 ff 25
E: 3.624017 8 02 d0 cf 13 af 12 00 25
E: 3.640013 8 02 d0 cf 13 ad 12 00 25
E: 3.648061 8 02 d0 d0 13 af 12 00 25
E: 3.656018 8 02 d0 d0 13 af 12 00 25
E: 3.664062 8 02 d0 cf 13 af 12 00 25
E: 3.680056 8 02 d0 d0 13 ae 12 00 25
E: 3.688058 8 02 d0 d1 13 ae 12 00 25
E: 3.696061 8 02 d0 cf 13 ae 12 ff 25
E: 3.712056 8 02 d0 ce 13 af 12 00 25
E: 3.719993 8 02 d0 cf 13 b0 12 00 25
E: 3.728015 8 02 d0 d0 13 ad 12 00 25
E: 3.736061 8 02 d0 d1 13 af 12 00 25
E: 3.752056 8 02 d0 cf 13 ae 12 00 25
E: 3.760060 8 02 d0 d1 13 ad 12 00 25
E: 3.768061 8 02 d0 cf 13 af 12 00 25
E: 3.776060 8 02 d0 d0 13 b0 12 00 25
E: 3.792056 8 02 d0 cf 13 ae 12 00 25
E: 3.800062 8 02 d0 cf 13 ae 12 01 24
E: 3.808062 8 02 d0 d1 13 ae 12 00 25
E: 3.816061 8 02 d0 cf 13 b1 12 00 25
E: 3.832051 8 02 d0 d1 13 ad 12 00 25
E: 3.840017 8 02 d0 d0 13 b0 12 01 25
E: 3.848060 8 02 d0 d2 13 af 12 00 24
E: 3.864055 8 02 d0 d2 13 ad 12 01 24
E: 3.872015 8 02 d0 d0 13 af 12 01 25
E: 3.880059 8 02 d0 d2 13 af 12 01 24
E: 3.888015 8 02 d0 d0 13 af 12 00 24
E: 3.903996 8 02 d0 d1 13 ae 12 01 25
E: 3.912061 8 02 d0 d0 13 b1 12 01 24
E: 3.920002 8 02 d0 d0 13 ae 12 01 24
E: 3.928012 8 02 d0 d3 13 b0 12 00 25
E: 3.944020 8 02 d0 d1 13 ae 12 00 25
E: 3.952002 8 02 d0 d0 13 b2 12 01 24
E: 3.960014 8 02 d0 d3 13 af 12 00 24
E: 3.967999 8 02 d0 d1 13 b1 12 00 25
E: 3.984056 8 02 d0 d1 13 b3 12 00 25
E: 3.992017 8 02 d0 d0 13 b2 12 00 25
E: 4.000059 8 02 d0 d2 13 b2 12 00 25
E: 4.016050 8 02 d0 d3 13 b2 12 00 25
E: 4.024061 8 02 d0 d3 13 b3 12 00 25
E: 4.032054 8 02 d0 d3 13 b3 12 00 25
E: 4.040061 8 02 d0 d3 13 b2 12 00 25
E: 4.056054 8 02 d0 d2 13 b2 12 00 25
E: 4.064059 8 02 d0 d4 13 b1 12 00 25
E: 4.072058 8 02 d0 d2 13 b1 12 00 25
E: 4.080057 8 02 d0 d2 13 b2 12 00 25
E: 4.096054 8 02 d0 d2 13 b1 12 00 25
E: 4.104058 8 02 d0 d2 13 b1 12 00 25
E: 4.112059 8 02 d0 d2 13 b2 12 00 25
E: 4.120060 8 02 d0 d2 13 b3 12 00 25
E: 4.135994 8 02 d0 d2 13 b1 12 00 25
E: 4.144060 8 02 d0 d3 13 b1 12 00 25
E: 4.152059 8 02 d0 d3 13 b2 12 00 25
E: 4.168054 8 02 d0 d1 13 b2 12 00 25
E: 4.176060 8 02 d0 d2 13 b4 12 00 25
E: 4.184059 8 02 d0 d1 13 b3 12 00 25
E: 4.192059 8 02 d0 cf 13 b6 12 00 25
E: 4.208054 8 02 d0 cd 13 b8 12 00 25
E: 4.216057 8 02 d0 cc 13 bc 12 00 25
E: 4.224058 8 02 d0 c9 13 be 12 00 25
E: 4.232054 8 02 d0 c6 13 c1 12 00 25
E: 4.248053 8 02 d0 c3 13 c2 12 00 25
E: 4.256060 8 02 d0 bf 13 c4 12 00 25
E: 4.264058 8 02 d0 bb 13 c6 12 00 25
E: 4.272058 8 02 d0 b9 13 ca 12 00 25
E: 4.288052 8 02 d0 b6 13 cb 12 00 25
E: 4.296058 8 02 d0 b3 13 cd 12 00 25
E: 4.304058 8 02 d0 b2 13 ce 12 00 25
E: 4.320053 8 02 d0 b2 13 cf 12 00 25
E: 4.328058 8 02 d0 b2 13 cf 12 00 25
E: 4.336057 8 02 d0 b2 13 ce 12 00 25
E: 4.344058 8 02 d1 b3 13 ce 12 00 25
E: 4.360052 8 02 d1 b2 13 ce 12 00 25
E: 4.368057 8 02 d1 b2 13 ce 12 00 25
E: 4.376057 8 02 d1 b1 13 ce 12 00 25
E: 4.384058 8 02 d1 b2 13 ce 12 00 25
E: 4.400053 8 02 d1 b2 13 cd 12 00 25
E: 4.408058 8 02 d1 b1 13 ce 12 00 25
E: 4.416056 8 02 d1 b1 13 ce 12 00 25
E: 4.424056 8 02 d1 b1 13 ce 12 00 25
E: 4.440052 8 02 d1 b2 13 ce 12 00 25
E: 4.448059 8 02 d1 b3 13 cd 12 00 25
E: 4.456055 8 02 d1 b1 13 ce 12 00 25
E: 4.472056 8 02 d1 b1 13 cf 12 00 25
E: 4.480059 8 02 d1 b2 13 cf 12 00 25
E: 4.488056 8 02 d1 b1 13 cc 12 00 25
E: 4.496057 8 02 d1 b1 13 ce 12 00 25
E: 4.512052 8 02 d1 b2 13 cf 12 00 25
E: 4.520057 8 02 d1 b0 13 d1 12 00 25
E: 4.528057 8 02 d1 ae 13 d6 12 00 25
E: 4.536056 8 02 d1 a6 13 de 12 00 24
E: 4.552053 8 02 d1 9e 13 e8 12 00 24
E: 4.560053 8 02 d1 92 13 f1 12 00 24
E: 4.568058 8 02 d1 84 13 01 13 00 24
E: 4.576012 8 02 d1 74 13 10 13 00 24
E: 4.592052 8 02 d1 66 13 23 13 00 24
E: 4.600057 8 02 d1 56 13 36 13 00 24
E: 4.608056 8 02 d1 47 13 4b 13 00 24
E: 4.624009 8 02 d1 39 13 62 13 00 24
E: 4.631997 8 02 d1 29 13 7a 13 00 24
E: 4.640013 8 02 d1 1e 13 92 13 00 24
E: 4.648056 8 02 d1 16 13 aa 13 00 24
E: 4.664050 8 02 d1 0e 13 c0 13 00 24
E: 4.672012 8 02 d1 08 13 d6 13 00 24
E: 4.680056 8 02 d1 04 13 ea 13 00 24
E: 4.687993 8 02 d1 01 13 fd 13 00 24
E: 4.703991 8 02 d1 fd 12 10 14 00 24
E: 4.712010 8 02 d1 fc 12 1e 14 00 24
E: 4.720055 8 02 d1 fc 12 2e 14 00 24
E: 4.735996 8 02 d1 fc 12 3b 14 00 24
E: 4.744010 8 02 d1 fd 12 46 14 00 24
E: 4.752056 8 02 d1 fc 12 4a 14 00 24
E: 4.760056 8 02 d1 fa 12 4c 14 00 24
E: 4.776008 8 02 d1 fb 12 4c 14 00 24
E: 4.784056 8 02 d1 fd 12 4d 14 00 24
E: 4.792056 8 02 d1 fc 12 4c 14 00 24
E: 4.800055 8 02 d1 fd 12 4d 14 00 24
E: 4.816049 8 02 d1 fa 12 4c 14 00 24
E: 4.824056 8 02 d1 fd 12 4c 14 00 24
E: 4.832010 8 02 d1 fc 12 4d 14 00 24
E: 4.840055 8 02 d1 fd 12 4c 14 00 24
E: 4.856051 8 02 d1 fd 12 4c 14 00 24
E: 4.864056 8 02 d1 fd 12 4c 14 00 24
E: 4.872051 8 02 d1 fc 12 4c 14 00 24
E: 4.888046 8 02 d1 fb 12 4b 14 00 24
E: 4.896058 8 02 d1 fc 12 4d 14 00 24
E: 4.904055 8 02 d0 fd 12 4c 14 00 24
E: 4.912059 8 02 d0 fc 12 4d 14 00 24
E: 4.928051 8 02 d0 fc 12 4c 14 00 24
E: 4.936047 8 02 d0 fc 12 4b 14 00 24
E: 4.944055 8 02 d0 fc 12 4d 14 00 24
E: 4.952055 8 02 d0 fc 12 4c 14 00 24
E: 4.968050 8 02 d0 fb 12 4c 14 00 24
E: 4.976054 8 02 d1 fa 12 4d 14 00 24
E: 4.984009 8 02 d1 fc 12 4d 14 00 24
E: 5.000048 8 02 d1 fd 12 4c 14 00 24
E: 5.008055 8 02 d1 fd 12 4c 14 00 24
E: 5.016054 8 02 d1 fb 12 4c 14 00 24
E: 5.024055 8 02 d1 fd 12 4c 14 00 24
E: 5.040050 8 02 d1 fc 12 4a 14 00 24
E: 5.048056 8 02 d1 fd 12 49 14 00 24
E: 5.056055 8 02 d1 fd 12 47 14 00 24
E: 5.064055 8 02 d0 fc 12 43 14 00 24
E: 5.080051 8 02 d0 00 13 40 14 00 24
E: 5.088054 8 02 d0 04 13 3a 14 00 24
E: 5.096054 8 02 d0 04 13 37 14 00 24
E: 5.104053 8 02 d0 04 13 36 14 00 24
E: 5.120049 8 02 d0 03 13 38 14 00 24
E: 5.128054 8 02 d0 02 13 38 14 00 24
E: 5.136054 8 02 d0 05 13 39 14 00 24
E: 5.152049 8 02 d0 04 13 37 14 00 24
E: 5.160054 8 02 d0 03 13 39 14 00 24
E: 5.168053 8 02 d0 04 13 38 14 00 24
E: 5.176054 8 02 d0 04 13 38 14 00 24
E: 5.192049 8 02 d0 05 13 39 14 00 24
E: 5.200053 8 02 d0 05 13 37 14 00 24
E: 5.208054 8 02 d0 04 13 35 14 00 24
E: 5.216050 8 02 d0 05 13 30 14 00 24
E: 5.232046 8 02 d0 05 13 2d 14 00 24
E: 5.240053 8 02 d0 08 13 28 14 00 24
E: 5.248052 8 02 d0 05 13 24 14 00 24
E: 5.256053 8 02 d0 06 13 1f 14 00 24
E: 5.272048 8 02 d0 05 13 18 14 00 24
E: 5.280053 8 02 d0 04 13 0f 14 00 24
E: 5.288048 8 02 d0 05 13 07 14 00 24
E: 5.304048 8 02 d0 05 13 fd 13 00 24
E: 5.312054 8 02 d0 04 13 f2 13 00 24
E: 5.320053 8 02 d0 02 13 e5 13 00 24
E: 5.328055 8 02 d0 ff 12 d9 13 00 24
E: 5.344049 8 02 d0 fc 12 ca 13 00 24
E: 5.352053 8 02 d0 f9 12 b8 13 00 24
E: 5.360052 8 02 d0 f3 12 a7 13 00 24
E: 5.368052 8 02 d0 f1 12 98 13 00 24
E: 5.384050 8 02 d0 ef 12 89 13 00 24
E: 5.392053 8 02 d0 ea 12 7b 13 00 24
E: 5.400052 8 02 d0 ea 12 6c 13 00 24
E: 5.408052 8 02 d0 e9 12 5e 13 00 24
E: 5.424048 8 02 d0 e9 12 50 13 00 24
E: 5.432047 8 02 d0 e6 12 46 13 00 24
E: 5.440052 8 02 d0 e3 12 37 13 00 24
E: 5.456047 8 02 d0 e0 12 2a 13 00 24
E: 5.464053 8 02 d0 df 12 1e 13 00 24
E: 5.472052 8 02 d0 dd 12 19 13 00 24
E: 5.480052 8 02 d0 da 12 15 13 00 24
E: 5.496047 8 02 d0 dc 12 13 13 00 24
E: 5.504052 8 02 d0 db 12 14 13 00 24
E: 5.512052 8 02 d0 db 12 14 13 00 24
E: 5.520052 8 02 d0 db 12 13 13 00 24
E: 5.536049 8 02 d0 db 12 13 13 00 24
E: 5.544053 8 02 d0 db 12 12 13 00 24
E: 5.552051 8 02 d0 dc 12 14 13 00 24
E: 5.568047 8 02 d2 db 12 12 13 00 24
E: 5.575982 8 02 d2 db 12 12 13 00 24
E: 5.583986 8 02 d2 dd 12 16 13 00 24
E: 5.591984 8 02 d2 db 12 13 13 00 24
E: 5.607983 8 02 d2 db 12 12 13 00 24
E: 5.616048 8 02 d2 dc 12 12 13 00 24
E: 5.624051 8 02 d2 db 12 11 13 00 24
E: 5.631988 8 02 d2 db 12 13 13 00 24
E: 5.648047 8 02 d2 db 12 11 13 00 24
E: 5.656051 8 02 d2 d9 12 0d 13 00 24
E: 5.664050 8 02 d2 d9 12 08 13 00 24
E: 5.672051 8 02 d2 d5 12 01 13 00 24
E: 5.688011 8 02 d2 d7 12 f9 12 00 24
E: 5.696051 8 02 d2 d4 12 ee 12 00 24
E: 5.704051 8 02 d2 d0 12 e3 12 00 24
E: 5.719995 8 02 d2 cb 12 d8 12 00 24
E: 5.728051 8 02 d2 c7 12 cb 12 00 25
E: 5.736050 8 02 d2 c4 12 ba 12 00 26
E: 5.743983 8 02 d2 bf 12 a7 12 00 25
E: 5.760047 8 02 d2 b9 12 96 12 00 25
E: 5.768051 8 02 d2 b2 12 81 12 00 25
E: 5.775982 8 02 d2 aa 12 6e 12 00 25
E: 5.784051 8 02 d2 a1 12 5c 12 00 25
E: 5.800046 8 02 d2 99 12 4a 12 00 27
E: 5.808050 8 02 d2 95 12 3a 12 00 26
E: 5.816050 8 02 d2 8f 12 2b 12 00 26
E: 5.832041 8 02 d2 89 12 1d 12 00 26
E: 5.840046 8 02 d2 85 12 09 12 00 26
E: 5.848001 8 02 d2 7f 12 ff 11 00 26
E: 5.856051 8 02 d2 78 12 f1 11 00 27
E: 5.872042 8 02 d2 70 12 e7 11 00 25
E: 5.880046 8 02 d2 6f 12 e2 11 00 25
E: 5.888047 8 02 d2 6d 12 de 11 00 25
E: 5.896051 8 02 d2 6f 12 de 11 00 25
E: 5.912045 8 02 d2 6c 12 dc 11 00 25
E: 5.919980 8 02 d2 6d 12 dd 11 00 25
E: 5.928050 8 02 d2 6e 12 df 11 00 25
E: 5.935989 8 02 d2 6e 12 e0 11 00 25
E: 5.952046 8 02 d2 6d 12 dc 11 00 25
E: 5.960051 8 02 d2 6e 12 de 11 00 25
E: 5.968050 8 02 d2 6e 12 de 11 00 25
E: 5.984046 8 02 d2 6e 12 df 11 00 25
E: 5.992050 8 02 d0 6e 12 e0 11 00 25
E: 6.000050 8 02 d0 6e 12 e0 11 00 25
E: 6.008049 8 02 d0 6e 12 df 11 00 25
E: 6.024045 8 02 d0 6e 12 df 11 00 25
E: 6.032045 8 02 d0 6e 12 db 11 00 25
E: 6.039977 8 02 d0 6f 12 dd 11 00 25
E: 6.047976 8 02 d0 6e 12 df 11 00 25
E: 6.064047 8 02 d0 6e 12 dd 11 00 25
E: 6.072049 8 02 d0 6f 12 dc 11 00 25
E: 6.080050 8 02 d0 6f 12 dd 11 00 25
E: 6.088050 8 02 d0 6f 12 dd 11 00 25
E: 6.104045 8 02 d0 6e 12 dd 11 00 25
E: 6.112050 8 02 d0 6e 12 dc 11 00 25
E: 6.120049 8 02 d0 6f 12 dd 11 00 25
E: 6.136044 8 02 d0 6e 12 dd 11 00 25
E: 6.144049 8 02 d0 6e 12 dd 11 00 25
E: 6.152050 8 02 d0 6f 12 dd 11 00 25
E: 6.160051 8 02 d0 6e 12 dc 11 00 25
E: 6.176046 8 02 d0 6e 12 dc 11 00 25
E: 6.184050 8 02 d0 6e 12 dd 11 00 25
E: 6.192051 8 02 d0 6f 12 dd 11 00 25
E: 6.200049 8 02 d0 6f 12 de 11 00 25
E: 6.216046 8 02 d0 6e 12 dd 11 00 25
E: 6.224048 8 02 d1 6d 12 df 11 00 25
E: 6.232044 8 02 d1 6e 12 e0 11 00 25
E: 6.248042 8 02 d1 6d 12 e0 11 00 25
E: 6.256049 8 02 d1 6f 12 df 11 00 25
E: 6.264048 8 02 d1 6d 12 dd 11 00 25
E: 6.272048 8 02 d1 6e 12 de 11 00 25
E: 6.288039 8 02 d1 6e 12 dc 11 00 25
E: 6.296048 8 02 d1 70 12 db 11 00 25
E: 6.304048 8 02 d0 6f 12 dc 11 00 25
E: 6.311985 8 02 d0 70 12 dd 11 00 25
E: 6.328044 8 02 d0 6d 12 dc 11 00 25
E: 6.335989 8 02 d0 6e 12 dc 11 00 25
E: 6.344000 8 02 d0 6f 12 dc 11 00 25
E: 6.352048 8 02 d0 71 12 dd 11 00 25
E: 6.368043 8 02 d0 6f 12 dc 11 00 25
E: 6.376048 8 02 d0 6e 12 dd 11 00 25
E: 6.384049 8 02 d0 6e 12 e1 11 00 25
E: 6.400042 8 02 d0 6d 12 e6 11 00 24
E: 6.408046 8 02 d0 6d 12 e9 11 00 24
E: 6.416044 8 02 d0 6a 12 e9 11 00 24
E: 6.424047 8 02 d0 6a 12 ea 11 00 24
E: 6.440043 8 02 d0 6a 12 eb 11 00 26
E: 6.448009 8 02 d0 6d 12 e9 11 00 24
E: 6.456047 8 02 d0 6b 12 eb 11 00 24
E: 6.464046 8 02 d0 6b 12 eb 11 00 26
E: 6.480044 8 02 d0 6c 12 e9 11 00 24
E: 6.487985 8 02 d0 67 12 f0 11 00 26
E: 6.496049 8 02 d0 5f 12 fc 11 00 26
E: 6.512042 8 02 d0 5c 12 0a 12 00 26
E: 6.520047 8 02 d0 55 12 1c 12 00 26
E: 6.528047 8 02 d0 52 12 31 12 00 26
E: 6.536048 8 02 d0 4f 12 3f 12 00 26
E: 6.552043 8 02 d0 4a 12 4e 12 00 26
E: 6.560046 8 02 d0 4b 12 60 12 00 24
E: 6.568047 8 02 d0 49 12 6b 12 00 24
E: 6.576047 8 02 d0 48 12 78 12 00 24
E: 6.592041 8 02 d0 42 12 8b 12 00 25
E: 6.600045 8 02 d0 3e 12 92 12 00 25
E: 6.608047 8 02 d0 37 12 a0 12 00 25
E: 6.616047 8 02 d0 30 12 ac 12 00 25
E: 6.632039 8 02 d0 2e 12 b9 12 00 25
E: 6.640048 8 02 d0 29 12 c2 12 00 25
E: 6.647990 8 02 d0 27 12 cd 12 00 25
E: 6.656048 8 02 d0 20 12 d7 12 00 25
E: 6.672041 8 02 d0 1a 12 e3 12 00 24
E: 6.680048 8 02 d0 14 12 ee 12 00 24
E: 6.688046 8 02 d0 10 12 f7 12 00 24
E: 6.704042 8 02 d0 09 12 01 13 00 24
E: 6.712045 8 02 d0 05 12 0b 13 00 24
E: 6.720044 8 02 d0 00 12 15 13 00 24
E: 6.728047 8 02 d0 fb 11 1d 13 00 24
E: 6.744041 8 02 d0 f6 11 24 13 00 24
E: 6.752047 8 02 d0 f3 11 2d 13 00 24
E: 6.760047 8 02 d0 ee 11 32 13 00 24
E: 6.776042 8 02 d0 f3 11 35 13 00 24
E: 6.784044 8 02 d0 ef 11 35 13 00 24
E: 6.792046 8 02 d0 ee 11 37 13 00 24
E: 6.800046 8 02 d0 ee 11 34 13 00 24
E: 6.816041 8 02 d0 ee 11 34 13 00 24
E: 6.824047 8 02 d0 ed 11 34 13 00 24
E: 6.832043 8 02 d0 ef 11 33 13 00 24
E: 6.840043 8 02 d0 ef 11 35 13 00 24
E: 6.856041 8 02 d0 ef 11 35 13 00 25
E: 6.864046 8 02 d0 ee 11 33 13 00 24
E: 6.871985 8 02 d0 ee 11 34 13 00 24
E: 6.880043 8 02 d0 ef 11 33 13 00 24
E: 6.896041 8 02 d4 f1 11 33 13 00 24
E: 6.904057 8 02 d4 ec 11 32 13 00 24
E: 6.911986 8 02 d4 ef 11 33 13 00 24
E: 6.927995 8 02 d4 ef 11 32 13 00 24
E: 6.936044 8 02 d4 ef 11 33 13 00 24
E: 6.944046 8 02 d4 ef 11 32 13 00 24
E: 6.952045 8 02 d4 f1 11 32 13 00 24
E: 6.968040 8 02 d4 ee 11 32 13 00 24
E: 6.976044 8 02 d4 f1 11 32 13 00 24
E: 6.984045 8 02 d4 f0 11 33 13 00 24
E: 6.992045 8 02 d4 ed 11 33 13 00 24
E: 7.008041 8 02 d4 ed 11 33 13 00 24
E: 7.016045 8 02 d4 ef 11 33 13 00 24
E: 7.024045 8 02 d4 f0 11 34 13 00 24
E: 7.040040 8 02 d4 f2 11 34 13 00 24
E: 7.048002 8 02 d4 ef 11 35 13 00 24
E: 7.056049 8 02 d4 ee 11 35 13 00 24
E: 7.064047 8 02 d4 ee 11 34 13 00 24
E: 7.080041 8 02 d0 ee 11 34 13 00 24
E: 7.088045 8 02 d0 ee 11 35 13 00 24
E: 7.096046 8 02 d0 f0 11 33 13 00 24
E: 7.104045 8 02 d0 ee 11 35 13 00 24
E: 7.120040 8 02 d0 ee 11 37 13 00 24
E: 7.128045 8 02 d0 ee 11 35 13 00 24
E: 7.136045 8 02 d0 ef 11 34 13 00 24
E: 7.144044 8 02 d0 ec 11 34 13 00 24
E: 7.160038 8 02 d0 ef 11 34 13 00 24
E: 7.168046 8 02 d0 ef 11 35 13 00 24
E: 7.176045 8 02 d0 ef 11 34 13 00 24
E: 7.192039 8 02 d0 ed 11 35 13 00 24
E: 7.200044 8 02 d0 ed 11 34 13 00 24
E: 7.208044 8 02 d0 ed 11 33 13 00 24
E: 7.216045 8 02 d0 ec 11 33 13 00 24
E: 7.232035 8 02 d0 ef 11 34 13 00 24
E: 7.240043 8 02 d0 ed 11 33 13 00 24
E: 7.248001 8 02 d0 ec 11 33 13 00 24
E: 7.256045 8 02 d0 ee 11 32 13 00 24
E: 7.272039 8 02 d0 ed 11 33 13 00 24
E: 7.280044 8 02 d0 ee 11 33 13 00 24
E: 7.288039 8 02 d0 ed 11 33 13 00 24
E: 7.304039 8 02 d0 f0 11 32 13 00 24
E: 7.312045 8 02 d0 ef 11 32 13 00 24
E: 7.320043 8 02 d0 ee 11 36 13 00 24
E: 7.328043 8 02 d0 ef 11 33 13 00 24
E: 7.344038 8 02 d0 ef 11 33 13 00 24
E: 7.352044 8 02 d0 ec 11 33 13 00 24
E: 7.360043 8 02 d0 e8 11 32 13 00 24
E: 7.368043 8 02 d0 e5 11 32 13 00 24
E: 7.384039 8 02 d0 e0 11 34 13 00 24
E: 7.392044 8 02 d0 d7 11 32 13 00 24
E: 7.400043 8 02 d0 cd 11 33 13 00 24
E: 7.408042 8 02 d0 bf 11 34 13 00 24
E: 7.423999 8 02 d0 b0 11 35 13 00 24
E: 7.432039 8 02 d0 a1 11 37 13 00 24
E: 7.440043 8 02 d0 91 11 3a 13 00 24
E: 7.456038 8 02 d0 7f 11 3c 13 00 24
E: 7.464042 8 02 d0 74 11 3d 13 00 24
E: 7.472043 8 02 d0 6d 11 41 13 00 24
E: 7.480042 8 02 d0 67 11 45 13 00 24
E: 7.496038 8 02 d0 62 11 47 13 00 24
E: 7.504045 8 02 d0 62 11 4a 13 00 24
E: 7.512043 8 02 d0 5f 11 4a 13 00 24
E: 7.520042 8 02 d0 5e 11 4a 13 00 24
E: 7.536038 8 02 d0 5e 11 47 13 00 24
E: 7.544043 8 02 d0 5f 11 49 13 00 24
E: 7.552043 8 02 d0 5e 11 4a 13 00 24
E: 7.568038 8 02 d0 60 11 49 13 00 24
E: 7.576043 8 02 d0 5f 11 48 13 00 24
E: 7.584042 8 02 d0 5f 11 4a 13 00 24
E: 7.592042 8 02 d0 5e 11 49 13 00 24
E: 7.608038 8 02 d0 5f 11 49 13 00 24
E: 7.616042 8 02 d0 5f 11 48 13 00 24
E: 7.624042 8 02 d0 5f 11 49 13 00 24
E: 7.632038 8 02 d0 5f 11 4a 13 00 24
E: 7.648007 8 02 d0 5f 11 4a 13 00 24
E: 7.656042 8 02 d0 5f 11 4a 13 00 24
E: 7.664042 8 02 d0 5f 11 4a 13 00 24
E: 7.672042 8 02 d0 61 11 49 13 00 24
E: 7.688033 8 02 d0 60 11 49 13 00 24
E: 7.696042 8 02 d0 60 11 49 13 00 24
E: 7.704041 8 02 d0 60 11 4a 13 00 24
E: 7.720037 8 02 d0 5e 11 49 13 00 24
E: 7.728042 8 02 d0 5f 11 49 13 00 24
E: 7.736041 8 02 d0 60 11 4a 13 00 24
E: 7.744037 8 02 d0 61 11 49 13 00 24
E: 7.760037 8 02 d0 5f 11 49 13 00 24
E: 7.768041 8 02 d0 61 11 49 13 00 24
E: 7.776041 8 02 d0 60 11 4a 13 00 24
E: 7.784042 8 02 d0 5f 11 49 13 00 24
E: 7.800036 8 02 d0 5f 11 48 13 00 24
E: 7.808041 8 02 d0 5f 11 4b 13 00 24
E: 7.816042 8 02 d0 61 11 4a 13 00 24
E: 7.832033 8 02 d0 63 11 4a 13 00 24
E: 7.839980 8 02 d0 60 11 49 13 00 24
E: 7.848038 8 02 d0 60 11 4b 13 00 24
E: 7.856041 8 02 d0 60 11 4a 13 00 24
E: 7.872036 8 02 d0 5f 11 4a 13 00 24
E: 7.880006 8 02 d0 5f 11 4a 13 00 24
E: 7.887999 8 02 d0 60 11 49 13 00 24
E: 7.896040 8 02 d0 60 11 48 13 00 24
E: 7.912037 8 02 d0 60 11 4a 13 00 24
E: 7.920041 8 02 d0 60 11 49 13 00 24
E: 7.928042 8 02 d0 5f 11 49 13 00 24
E: 7.936045 8 02 d0 5f 11 48 13 00 24
E: 7.952037 8 02 d0 5f 11 45 13 00 24
E: 7.960039 8 02 d0 5d 11 3d 13 00 24
E: 7.968039 8 02 d0 5b 11 2e 13 00 24
E: 7.984035 8 02 d0 57 11 13 13 00 24
E: 7.992040 8 02 d0 4d 11 ed 12 00 24
E: 8.000040 8 02 d0 3d 11 c3 12 00 25
E: 8.008039 8 02 d0 27 11 95 12 00 25
E: 8.024035 8 02 d0 04 11 64 12 00 25
E: 8.032034 8 02 d0 d8 10 2f 12 00 26
E: 8.040040 8 02 d0 a1 10 f5 11 00 26
E: 8.048035 8 02 d0 63 10 c4 11 00 24
E: 8.064036 8 02 d0 1a 10 9c 11 00 25
E: 8.072040 8 02 d0 d2 0f 80 11 00 25
E: 8.080040 8 02 d0 88 0f 6f 11 00 25
E: 8.096035 8 02 d0 44 0f 6a 11 00 25
E: 8.104040 8 02 d0 0a 0f 71 11 00 25
E: 8.112006 8 02 d0 d8 0e 88 11 00 25
E: 8.120039 8 02 d0 a9 0e ae 11 00 25
E: 8.136035 8 02 d0 79 0e dc 11 00 25
E: 8.144041 8 02 d0 57 0e 17 12 00 26
E: 8.152039 8 02 d0 45 0e 5d 12 00 26
E: 8.160039 8 02 d0 46 0e ac 12 00 25
E: 8.176035 8 02 d0 60 0e ff 12 00 24
E: 8.184038 8 02 d0 9a 0e 53 13 00 24
E: 8.192040 8 02 d0 e6 0e ab 13 00 24
E: 8.200040 8 02 d0 4f 0f fa 13 00 24
E: 8.216033 8 02 d0 e2 0f 40 14 00 24
E: 8.224038 8 02 d0 97 10 70 14 00 24
E: 8.232038 8 02 d0 4a 11 86 14 00 24
E: 8.248031 8 02 d0 ef 11 82 14 00 24
E: 8.256039 8 02 d0 80 12 68 14 00 24
E: 8.264038 8 02 d0 fb 12 3b 14 00 24
E: 8.272038 8 02 d0 5b 13 00 14 00 24
E: 8.288041 8 02 d0 9e 13 c4 13 00 24
E: 8.296038 8 02 d0 ba 13 91 13 00 23
E: 8.304039 8 02 d0 b3 13 65 13 00 24
E: 8.312040 8 02 d0 94 13 3b 13 00 24
E: 8.328034 8 02 d0 53 13 0e 13 00 24
E: 8.336037 8 02 d0 f3 12 da 12 00 24
E: 8.344038 8 02 d0 79 12 a4 12 00 25
E: 8.352039 8 02 d0 e2 11 71 12 00 24
E: 8.368036 8 02 d0 50 11 1f 12 00 24
E: 8.376042 8 02 d0 ce 10 9f 11 00 1f
E: 8.384037 8 02 d0 6e 10 f7 10 00 1a
E: 8.400034 8 02 d0 34 10 56 10 00 16
E: 8.408038 8 02 d0 11 10 b4 0f 00 11
E: 8.416038 8 02 50 f5 0f a6 0e 00 0e
E: 8.424039 8 02 50 dd 0f 8c 0d 00 0b
E: 8.432036 8 02 00 00 00 00 00 00 00
E: 10.632022 8 02 10 f2 10 a5 0d 00 00
E: 10.639968 8 02 10 c5 10 b0 0d 00 00
E: 10.656023 8 02 10 93 10 cb 0d 00 00
E: 10.664027 8 02 10 54 10 f1 0d 00 00
E: 10.672026 8 02 10 18 10 14 0e 00 00
E: 10.680027 8 02 10 db 0f 2d 0e 00 00
E: 10.696022 8 02 10 71 0f 2c 0e 00 00
E: 10.704027 8 02 10 1d 0f 1b 0e 00 00
E: 10.712026 8 02 10 d3 0e 02 0e 00 00
E: 10.728022 8 02 10 4d 0e f3 0d 00 00
E: 10.736026 8 02 10 c7 0d ef 0d 00 00
E: 10.744027 8 02 10 41 0d 07 0e 00 00
E: 10.752027 8 02 10 c2 0c 3e 0e 00 00
E: 10.768021 8 02 10 43 0c c8 0e 00 00
E: 10.776025 8 02 90 ad 0b 43 0f 00 00
E: 10.783962 8 02 90 e3 0a b4 0f 00 00
E: 10.791960 8 02 90 1a 0a 0c 10 00 00
E: 10.807954 8 02 90 af 09 5f 10 00 00
E: 10.816033 8 02 90 76 09 b6 10 00 00
E: 10.824034 8 02 90 5c 09 13 11 00 00
E: 10.832025 8 02 90 5b 09 6f 11 00 00
E: 10.848017 8 02 90 70 09 ce 11 00 00
E: 10.856028 8 02 90 98 09 75 12 00 00
E: 10.864026 8 02 90 de 09 ea 12 00 00
E: 10.880022 8 02 90 48 0a 4e 13 00 00
E: 10.888026 8 02 90 ea 0a a4 13 00 00
E: 10.896026 8 02 90 8a 0b ef 13 00 00
E: 10.904025 8 02 90 2c 0c 2b 14 00 00
E: 10.920021 8 02 90 db 0c 4e 14 00 00
E: 10.928026 8 02 90 8d 0d 5b 14 00 00
E: 10.936027 8 02 90 5d 0e 4c 14 00 00
E: 10.944026 8 02 90 26 0f 1e 14 00 00
E: 10.960023 8 02 90 d5 0f d1 13 00 00
E: 10.968028 8 02 90 89 10 75 13 00 00
E: 10.976027 8 02 90 3b 11 0d 13 00 00
E: 10.984028 8 02 90 04 12 96 12 00 00
E: 11.000020 8 02 90 c5 12 0b 12 00 00
E: 11.008025 8 02 90 62 13 8e 11 00 00
E: 11.016024 8 02 90 d7 13 0c 11 00 00
E: 11.032020 8 02 90 18 14 7e 10 00 00
E: 11.040026 8 02 90 29 14 f0 0f 00 00
E: 11.048022 8 02 90 12 14 6e 0f 00 00
E: 11.056025 8 02 90 d4 13 e7 0e 00 00
E: 11.072019 8 02 90 77 13 4b 0e 00 00
E: 11.080025 8 02 90 09 13 cd 0d 00 00
E: 11.088022 8 02 90 73 12 7c 0d 00 00
E: 11.096025 8 02 90 b1 11 4d 0d 00 00
E: 11.112020 8 02 90 0c 11 32 0d 00 00
E: 11.120024 8 02 90 96 10 24 0d 00 00
E: 11.128026 8 02 90 3f 10 21 0d 00 00
E: 11.136025 8 02 90 00 10 32 0d 00 00
E: 11.152021 8 02 90 dc 0f 3c 0d 00 00
E: 11.160025 8 02 90 cd 0f 30 0d 00 00
E: 11.168024 8 02 90 d3 0f 23 0d 00 00
E: 11.184021 8 02 90 d7 0f 1e 0d 00 00
E: 11.192025 8 02 90 de 0f 24 0d 00 00
E: 11.200026 8 02 90 e6 0f 35 0d 00 00
E: 11.208025 8 02 90 fd 0f 40 0d 00 00
E: 11.224019 8 02 90 1a 10 46 0d 00 00
E: 11.232025 8 02 90 32 10 4a 0d 00 00
E: 11.240024 8 02 90 50 10 58 0d 00 00
E: 11.248020 8 02 90 78 10 6b 0d 00 00
E: 11.264021 8 02 90 96 10 6e 0d 00 00
E: 11.272026 8 02 90 a8 10 7f 0d 00 00
E: 11.280023 8 02 90 b7 10 94 0d 00 00
E: 11.288024 8 02 90 af 10 be 0d 00 00
E: 11.304020 8 02 90 92 10 ef 0d 00 00
E: 11.312023 8 02 90 70 10 24 0e 00 00
E: 11.320024 8 02 90 4e 10 50 0e 00 00
E: 11.336014 8 02 90 1e 10 87 0e 00 00
E: 11.344025 8 02 90 e1 0f d3 0e 00 00
E: 11.352024 8 02 90 89 0f 19 0f 00 00
E: 11.360024 8 02 90 28 0f 70 0f 00 00
E: 11.376019 8 02 90 c0 0e c8 0f 00 00
E: 11.384025 8 02 90 6b 0e 00 10 00 00
E: 11.392024 8 02 10 3f 0e 15 10 00 00
E: 11.399956 8 02 10 2f 0e 19 10 00 00
E: 11.416019 8 02 10 53 0e 1e 10 00 00
E: 11.424023 8 02 10 91 0e 1d 10 00 00
E: 11.432023 8 02 10 d7 0e 13 10 00 00
E: 11.440023 8 02 10 0d 0f 02 10 00 00
E: 11.456018 8 02 10 3c 0f ee 0f 00 00
E: 11.464023 8 02 10 57 0f dd 0f 00 00
E: 11.472025 8 02 10 5e 0f d3 0f 00 00
E: 11.488019 8 02 10 5c 0f d4 0f 00 00
E: 11.496023 8 02 10 54 0f d8 0f 00 00
E: 11.504022 8 02 10 60 0f db 0f 00 00
E: 11.512025 8 02 10 72 0f df 0f 00 00
E: 11.528018 8 02 10 7b 0f db 0f 00 00
E: 11.535965 8 02 10 83 0f d1 0f 00 00
E: 11.544024 8 02 10 82 0f cb 0f 00 00
E: 11.552025 8 02 10 7d 0f cd 0f 00 00
E: 11.568018 8 02 10 85 0f c9 0f 00 00
E: 11.576023 8 02 10 8a 0f bf 0f 00 00
E: 11.584022 8 02 10 95 0f ae 0f 00 00
E: 11.592023 8 02 10 a2 0f ac 0f 00 00
E: 11.608018 8 02 90 af 0f b3 0f 00 00
E: 11.615953 8 02 90 b0 0f c0 0f 00 00
E: 11.623947 8 02 90 bd 0f c6 0f 00 00
E: 11.640021 8 02 90 c9 0f be 0f 00 00
E: 11.648019 8 02 90 d7 0f b6 0f 00 00
E: 11.656023 8 02 90 e1 0f b4 0f 00 00
E: 11.664012 8 02 90 e5 0f ad 0f 00 00
E: 11.680018 8 02 90 e9 0f ab 0f 00 00
E: 11.688019 8 02 90 e6 0f b1 0f 00 00
E: 11.696023 8 02 90 da 0f cc 0f 00 00
E: 11.704023 8 02 90 bf 0f fd 0f 00 00
E: 11.720016 8 02 90 a2 0f 31 10 00 00
E: 11.728022 8 02 90 95 0f 57 10 00 00
E: 11.736023 8 02 90 9d 0f 6c 10 00 00
E: 11.744019 8 02 90 a3 0f 84 10 00 00
E: 11.760016 8 02 90 9e 0f a4 10 00 00
E: 11.768021 8 02 90 9c 0f ce 10 00 00
E: 11.776021 8 02 90 9a 0f 06 11 00 00
E: 11.792017 8 02 90 8e 0f 4c 11 00 00
E: 11.800020 8 02 90 7d 0f 86 11 00 00
E: 11.808022 8 02 90 67 0f b6 11 00 00
E: 11.816023 8 02 90 52 0f d9 11 00 00
E: 11.832017 8 02 90 38 0f eb 11 00 00
E: 11.840024 8 02 90 2d 0f f3 11 00 00
E: 11.848019 8 02 90 27 0f 00 12 00 00
E: 11.856021 8 02 90 29 0f 05 12 00 00
E: 11.872016 8 02 90 29 0f 18 12 00 00
E: 11.880021 8 02 90 1e 0f 2a 12 00 00
E: 11.888021 8 02 90 1c 0f 2c 12 00 00
E: 11.896021 8 02 90 1c 0f 1b 12 00 00
E: 11.912016 8 02 90 17 0f 19 12 00 00
E: 11.920021 8 02 90 1c 0f ff 11 00 00
E: 11.928021 8 02 90 1c 0f eb 11 00 00
E: 11.944017 8 02 90 20 0f d8 11 00 00
E: 11.952021 8 02 90 1a 0f c0 11 00 00
E: 11.960019 8 02 90 0e 0f b7 11 00 00
E: 11.968021 8 02 90 01 0f b4 11 00 00
E: 11.984015 8 02 90 f4 0e b1 11 00 00
E: 11.992021 8 02 90 e6 0e a3 11 00 00
E: 12.000021 8 02 90 d5 0e 9a 11 00 00
E: 12.008020 8 02 90 ca 0e 8c 11 00 00
E: 12.024016 8 02 90 ba 0e 71 11 00 00
E: 12.032020 8 02 90 b0 0e 59 11 00 00
E: 12.040022 8 02 90 aa 0e 47 11 00 00
E: 12.048020 8 02 92 a7 0e 35 11 00 00
E: 12.063957 8 02 92 a8 0e 20 11 00 00
E: 12.071973 8 02 92 98 0e 07 11 00 00
E: 12.079971 8 02 92 93 0e ee 10 00 00
E: 12.087961 8 02 92 85 0e d2 10 00 00
E: 12.104016 8 02 92 6f 0e b7 10 00 00
E: 12.112020 8 02 92 5e 0e a1 10 00 00
E: 12.120019 8 02 92 42 0e 8f 10 00 00
E: 12.136015 8 02 92 2c 0e 80 10 00 00
E: 12.144021 8 02 92 0d 0e 73 10 00 00
E: 12.152020 8 02 92 e8 0d 6a 10 00 00
E: 12.160018 8 02 92 c6 0d 62 10 00 00
E: 12.176015 8 02 92 a2 0d 5a 10 00 00
E: 12.184018 8 02 92 81 0d 59 10 00 00
E: 12.192020 8 02 92 5a 0d 58 10 00 00
E: 12.208014 8 02 92 31 0d 59 10 00 00
E: 12.216019 8 02 92 07 0d 58 10 00 00
E: 12.224018 8 02 92 d5 0c 59 10 00 00
E: 12.232020 8 02 92 a1 0c 5d 10 00 00
E: 12.248010 8 02 92 63 0c 64 10 00 00
E: 12.256018 8 02 92 26 0c 71 10 00 00
E: 12.263955 8 02 92 de 0b 83 10 00 00
E: 12.272021 8 02 92 9d 0b 9d 10 00 00
E: 12.288017 8 02 92 5f 0b bf 10 00 00
E: 12.296019 8 02 92 22 0b e2 10 00 00
E: 12.304018 8 02 92 e1 0a 0a 11 00 00
E: 12.312018 8 02 92 ab 0a 38 11 00 00
E: 12.328013 8 02 92 85 0a 79 11 00 00
E: 12.336019 8 02 92 69 0a be 11 00 00
E: 12.344018 8 02 92 58 0a 19 12 00 00
E: 12.360014 8 02 92 56 0a 71 12 00 00
E: 12.368017 8 02 92 65 0a b4 12 00 00
E: 12.376018 8 02 92 8a 0a ef 12 00 00
E: 12.384019 8 02 92 c1 0a 23 13 00 00
E: 12.400015 8 02 92 06 0b 4f 13 00 00
E: 12.408018 8 02 92 53 0b 76 13 00 00
E: 12.416019 8 02 92 ab 0b 96 13 00 00
E: 12.424019 8 02 92 fd 0b ae 13 00 00
E: 12.440010 8 02 92 5d 0c b8 13 00 00
E: 12.448014 8 02 92 c4 0c b0 13 00 00
E: 12.456018 8 02 92 2b 0d 9b 13 00 00
E: 12.463945 8 02 92 92 0d 7c 13 00 00
E: 12.480014 8 02 92 ff 0d 53 13 00 00
E: 12.488018 8 02 92 7b 0e 29 13 00 00
E: 12.496018 8 02 92 dc 0e 00 13 00 00
E: 12.512013 8 02 92 26 0f ce 12 00 00
E: 12.520018 8 02 92 55 0f 9c 12 00 00
E: 12.528018 8 02 92 77 0f 5f 12 00 00
E: 12.536018 8 02 92 8e 0f 1f 12 00 00
E: 12.552013 8 02 90 94 0f da 11 00 00
E: 12.560015 8 02 90 88 0f a6 11 00 00
E: 12.568018 8 02 90 6b 0f 7e 11 00 00
E: 12.576017 8 02 90 41 0f 5c 11 00 00
E: 12.592013 8 02 90 08 0f 46 11 00 00
E: 12.600018 8 02 90 c4 0e 32 11 00 00
E: 12.608017 8 02 90 76 0e 24 11 00 00
E: 12.616017 8 02 90 2c 0e 1a 11 00 00
E: 12.632012 8 02 90 f1 0d 0f 11 00 00
E: 12.639992 8 02 90 c1 0d 11 11 00 00
E: 12.648013 8 02 90 97 0d 08 11 00 00
E: 12.663943 8 02 90 79 0d 03 11 00 00
E: 12.672019 8 02 90 5e 0d 00 11 00 00
E: 12.680016 8 02 90 49 0d fa 10 00 00
E: 12.688017 8 02 90 34 0d fb 10 00 00
E: 12.704015 8 02 90 26 0d fa 10 00 00
E: 12.712019 8 02 90 1c 0d f5 10 00 00
E: 12.720017 8 02 90 17 0d ed 10 00 00
E: 12.728017 8 02 90 13 0d da 10 00 00
E: 12.744012 8 02 90 13 0d c7 10 00 00
E: 12.752017 8 02 90 0e 0d b5 10 00 00
E: 12.760017 8 02 90 02 0d 9e 10 00 00
E: 12.768016 8 02 90 f4 0c 94 10 00 00
E: 12.784012 8 02 90 e7 0c 8b 10 00 00
E: 12.792017 8 02 90 e1 0c 7f 10 00 00
E: 12.800012 8 02 90 e0 0c 6d 10 00 00
E: 12.816012 8 02 90 e4 0c 58 10 00 00
E: 12.824016 8 02 90 eb 0c 42 10 00 00
E: 12.832017 8 02 90 ec 0c 30 10 00 00
E: 12.840015 8 02 90 f0 0c 20 10 00 00
E: 12.856011 8 02 90 ed 0c 0f 10 00 00
E: 12.863973 8 02 90 ee 0c fe 0f 00 00
E: 12.872016 8 02 90 ed 0c f2 0f 00 00
E: 12.880017 8 02 90 e6 0c e4 0f 00 00
E: 12.896012 8 02 90 e1 0c d8 0f 00 00
E: 12.904017 8 02 90 dc 0c d0 0f 00 00
E: 12.912016 8 02 90 da 0c c8 0f 00 00
E: 12.920012 8 02 94 da 0c c7 0f 00 00
E: 12.935950 8 02 94 d9 0c ca 0f 00 00
E: 12.944014 8 02 94 d9 0c d1 0f 00 00
E: 12.951951 8 02 94 db 0c d7 0f 00 00
E: 12.967944 8 02 94 dc 0c e0 0f 00 00
E: 12.975964 8 02 94 dd 0c e8 0f 00 00
E: 12.983955 8 02 94 df 0c f2 0f 00 00
E: 12.991950 8 02 94 e1 0c fb 0f 00 00
E: 13.007968 8 02 94 e3 0c 02 10 00 00
E: 13.016015 8 02 94 e3 0c 09 10 00 00
E: 13.024016 8 02 94 e8 0c 0b 10 00 00
E: 13.032014 8 02 94 ef 0c 0d 10 00 00
E: 13.048006 8 02 94 f2 0c 0d 10 00 00
E: 13.056015 8 02 94 f8 0c 0b 10 00 00
E: 13.063963 8 02 94 f9 0c 06 10 00 00
E: 13.072018 8 02 94 fd 0c ff 0f 00 00
E: 13.088011 8 02 94 fe 0c f3 0f 00 00
E: 13.096015 8 02 94 fa 0c e8 0f 00 00
E: 13.104015 8 02 94 f1 0c de 0f 00 00
E: 13.120013 8 02 94 e0 0c cd 0f 00 00
E: 13.128017 8 02 90 cc 0c c1 0f 00 00
E: 13.135951 8 02 90 b2 0c bb 0f 00 00
E: 13.143947 8 02 90 8e 0c b9 0f 00 00
E: 13.159942 8 02 90 62 0c bc 0f 00 00
E: 13.167944 8 02 94 33 0c c7 0f 00 00
E: 13.175937 8 02 94 08 0c d5 0f 00 00
E: 13.183944 8 02 94 db 0b e9 0f 00 00
E: 13.199941 8 02 94 ad 0b fb 0f 00 00
E: 13.207942 8 02 94 86 0b 0f 10 00 00
E: 13.215944 8 02 94 58 0b 2c 10 00 00
E: 13.223940 8 02 94 32 0b 48 10 00 00
E: 13.239930 8 02 94 11 0b 65 10 00 00
E: 13.247932 8 02 94 f3 0a 80 10 00 00
E: 13.255942 8 02 94 d5 0a 99 10 00 00
E: 13.263941 8 02 94 c6 0a b2 10 00 00
E: 13.279967 8 02 94 bc 0a cb 10 00 00
E: 13.287947 8 02 94 b1 0a e1 10 00 00
E: 13.295949 8 02 94 a7 0a fb 10 00 00
E: 13.311973 8 02 94 a6 0a 11 11 00 00
E: 13.319956 8 02 94 ac 0a 20 11 00 00
E: 13.327949 8 02 94 b2 0a 2e 11 00 00
E: 13.335937 8 02 94 b5 0a 37 11 00 00
E: 13.351952 8 02 94 b7 0a 39 11 00 00
E: 13.359952 8 02 94 b9 0a 3c 11 00 00
E: 13.367955 8 02 94 bc 0a 3b 11 00 00
E: 13.375942 8 02 94 bb 0a 39 11 00 00
E: 13.391948 8 02 94 ba 0a 35 11 00 00
E: 13.400014 8 02 94 b4 0a 32 11 00 00
E: 13.407953 8 02 94 a8 0a 29 11 00 00
E: 13.423951 8 02 94 9c 0a 22 11 00 00
E: 13.432013 8 02 94 96 0a 18 11 00 00
E: 13.439948 8 02 94 8f 0a 16 11 00 00
E: 13.448011 8 02 94 82 0a 14 11 00 00
E: 13.463946 8 02 94 78 0a 12 11 00 00
E: 13.471951 8 02 90 6f 0a 14 11 00 00
E: 13.479957 8 02 90 66 0a 13 11 00 00
E: 13.487949 8 02 90 61 0a 0d 11 00 00
E: 13.503950 8 02 90 5d 0a 07 11 00 00
E: 13.512014 8 02 90 5b 0a 02 11 00 00
E: 13.520009 8 02 90 60 0a fc 10 00 00
E: 13.536010 8 02 90 64 0a fb 10 00 00
E: 13.544011 8 02 90 68 0a f8 10 00 00
E: 13.552013 8 02 90 66 0a f9 10 00 00
E: 13.560014 8 02 90 6a 0a f8 10 00 00
E: 13.576007 8 02 90 6f 0a fa 10 00 00
E: 13.584013 8 02 90 72 0a f9 10 00 00
E: 13.592013 8 02 90 77 0a f6 10 00 00
E: 13.600012 8 02 90 79 0a f4 10 00 00
E: 13.616007 8 02 90 78 0a f0 10 00 00
E: 13.624012 8 02 90 76 0a ec 10 00 00
E: 13.632013 8 02 90 75 0a e7 10 00 00
E: 13.639972 8 02 90 6f 0a e2 10 00 00
E: 13.656007 8 02 90 6d 0a de 10 00 00
E: 13.664012 8 02 90 65 0a dd 10 00 00
E: 13.672012 8 02 90 60 0a da 10 00 00
E: 13.688008 8 02 90 58 0a d9 10 00 00
E: 13.696012 8 02 90 54 0a da 10 00 00
E: 13.704013 8 02 90 53 0a d9 10 00 00
E: 13.712008 8 02 90 52 0a d9 10 00 00
E: 13.728007 8 02 90 52 0a d6 10 00 00
E: 13.736012 8 02 90 4f 0a d3 10 00 00
E: 13.744013 8 02 90 4f 0a d2 10 00 00
E: 13.752013 8 02 90 5d 0a d2 10 00 00
E: 13.768007 8 02 90 70 0a d6 10 00 00
E: 13.776011 8 02 90 8b 0a e6 10 00 00
E: 13.784013 8 02 90 af 0a 03 11 00 00
E: 13.800003 8 02 90 ea 0a 34 11 00 00
E: 13.808010 8 02 90 27 0b 78 11 00 00
E: 13.816012 8 02 90 71 0b d6 11 00 00
E: 13.824013 8 02 90 c7 0b 46 12 00 00
E: 13.840008 8 02 90 21 0c b9 12 00 00
E: 13.847959 8 02 90 79 0c 21 13 00 00
E: 13.856011 8 02 90 cc 0c 86 13 00 00
E: 13.863943 8 02 90 1d 0d ea 13 00 00
E: 13.879939 8 02 90 6d 0d 4f 14 00 00
E: 13.887957 8 02 90 c2 0d bc 14 00 00
E: 13.895970 8 02 90 1a 0e 30 15 00 00
E: 13.903951 8 02 90 75 0e b8 15 00 00
E: 13.919945 8 02 90 cc 0e 31 16 00 00
E: 13.928011 8 02 90 0a 0f 99 16 00 00
E: 13.935951 8 02 90 40 0f ec 16 00 00
E: 13.952007 8 02 90 57 0f 2a 17 00 00
E: 13.960012 8 02 90 65 0f 5b 17 00 00
E: 13.967942 8 02 90 7f 0f 85 17 00 00
E: 13.976012 8 02 90 8a 0f a6 17 00 00
E: 13.992007 8 02 90 90 0f c5 17 00 00
E: 14.000011 8 02 90 8f 0f e0 17 00 00
E: 14.008013 8 02 90 85 0f fb 17 00 00
E: 14.016011 8 02 90 71 0f 1e 18 00 00
E: 14.032005 8 02 90 5e 0f 3c 18 00 00
E: 14.040010 8 02 90 4f 0f 5b 18 00 00
E: 14.048010 8 02 90 41 0f 74 18 00 00
E: 14.064001 8 02 90 34 0f 89 18 00 00
E: 14.072012 8 02 90 2b 0f 98 18 00 00
E: 14.080010 8 02 90 26 0f a1 18 00 00
E: 14.087942 8 02 90 23 0f ae 18 00 00
E: 14.104007 8 02 90 27 0f be 18 00 00
E: 14.112011 8 02 90 28 0f c3 18 00 00
E: 14.120009 8 02 90 33 0f c6 18 00 00
E: 14.127942 8 02 90 46 0f cc 18 00 00
E: 14.144002 8 02 90 57 0f cb 18 00 00
E: 14.152009 8 02 90 65 0f cb 18 00 00
E: 14.160009 8 02 90 70 0f cd 18 00 00
E: 14.167940 8 02 90 70 0f cc 18 00 00
E: 14.184005 8 02 91 6c 0f cd 18 8a 00
E: 14.192010 8 02 91 6a 0f d0 18 8f 00
E: 14.200008 8 02 91 69 0f cf 18 8e 00
E: 14.216005 8 02 91 67 0f cf 18 8e 00
E: 14.224010 8 02 91 67 0f d1 18 8f 00
E: 14.232009 8 02 91 65 0f d0 18 6e 00
E: 14.240009 8 02 90 68 0f d5 18 1e 00
E: 14.256004 8 02 90 6f 0f da 18 00 00
E: 14.263947 8 02 90 75 0f d7 18 00 00
E: 14.271944 8 02 90 70 0f d3 18 00 00
E: 14.279960 8 02 90 66 0f ca 18 00 00
E: 14.296004 8 02 90 58 0f bd 18 00 00
E: 14.304004 8 02 90 50 0f b6 18 00 00
E: 14.312009 8 02 90 4d 0f ac 18 00 00
E: 14.328003 8 02 90 4f 0f a8 18 00 00
E: 14.336009 8 02 90 53 0f a7 18 00 00
E: 14.343950 8 02 90 5b 0f a3 18 00 00
E: 14.352009 8 02 90 66 0f 9f 18 00 00
E: 14.368005 8 02 90 6e 0f 9c 18 00 00
E: 14.376009 8 02 90 72 0f 9a 18 00 00
E: 14.384009 8 02 90 75 0f 9f 18 00 00
E: 14.392008 8 02 90 75 0f a6 18 00 00
E: 14.408004 8 02 90 6e 0f ad 18 00 00
E: 14.416010 8 02 90 67 0f b7 18 00 00
E: 14.424009 8 02 90 5c 0f c1 18 00 00
E: 14.432010 8 02 90 4f 0f ca 18 00 00
E: 14.448003 8 02 90 48 0f d0 18 00 00
E: 14.456008 8 02 90 43 0f cf 18 00 00
E: 14.464004 8 02 90 41 0f c7 18 00 00
E: 14.480004 8 02 90 43 0f c2 18 00 00
E: 14.488007 8 02 90 48 0f bd 18 00 00
E: 14.496008 8 02 90 4e 0f bb 18 00 00
E: 14.504008 8 02 90 55 0f b6 18 00 00
E: 14.520002 8 02 90 62 0f b0 18 00 00
E: 14.528008 8 02 90 6e 0f a4 18 00 00
E: 14.536007 8 02 90 7d 0f 97 18 00 00
E: 14.544008 8 02 90 8f 0f 8e 18 00 00
E: 14.560003 8 02 90 9d 0f 88 18 00 00
E: 14.568008 8 02 90 a9 0f 88 18 00 00
E: 14.576008 8 02 90 b2 0f 84 18 00 00
E: 14.592002 8 02 90 b3 0f 89 18 00 00
E: 14.600007 8 02 90 b0 0f 92 18 00 00
E: 14.608007 8 02 90 ab 0f 99 18 00 00
E: 14.616008 8 02 90 a5 0f a2 18 00 00
E: 14.632003 8 02 90 a3 0f a6 18 00 00
E: 14.640007 8 02 90 a8 0f a1 18 00 00
E: 14.648009 8 02 90 af 0f 9d 18 00 00
E: 14.656008 8 02 90 be 0f 9b 18 00 00
E: 14.672003 8 02 90 bf 0f 96 18 00 00
E: 14.680008 8 02 91 bf 0f 98 18 c3 00
E: 14.687938 8 02 91 c0 0f 99 18 e6 00
E: 14.695945 8 02 91 be 0f 99 18 f0 00
E: 14.711938 8 02 91 bc 0f 97 18 fb 00
E: 14.719939 8 02 91 bd 0f 98 18 00 01
E: 14.727937 8 02 91 bb 0f 96 18 03 01
E: 14.743936 8 02 91 ba 0f 97 18 03 01
E: 14.751933 8 02 91 ba 0f 98 18 02 01
E: 14.759932 8 02 91 ba 0f 99 18 f6 00
E: 14.767940 8 02 91 b9 0f 9a 18 d6 00
E: 14.783940 8 02 91 b9 0f 9a 18 8a 00
E: 14.791935 8 02 90 b7 0f 94 18 00 00
E: 14.799938 8 02 90 b1 0f 8e 18 00 00
E: 14.807933 8 02 90 ab 0f 8d 18 00 00
E: 14.823935 8 02 90 a1 0f 8f 18 00 00
E: 14.831938 8 02 90 9a 0f 93 18 00 00
E: 14.839940 8 02 90 94 0f 98 18 00 00
E: 14.855933 8 02 90 95 0f 98 18 00 00
E: 14.863939 8 02 90 93 0f 95 18 00 00
E: 14.871940 8 02 90 93 0f 8e 18 00 00
E: 14.879935 8 02 90 94 0f 86 18 00 00
E: 14.895935 8 02 90 8e 0f 81 18 00 00
E: 14.903937 8 02 90 89 0f 7d 18 00 00
E: 14.911935 8 02 90 84 0f 81 18 00 00
E: 14.919938 8 02 90 7b 0f 8c 18 00 00
E: 14.935932 8 02 90 75 0f 8f 18 00 00
E: 14.943935 8 02 90 6c 0f 96 18 00 00
E: 14.951938 8 02 90 62 0f a1 18 00 00
E: 14.959935 8 02 90 5a 0f a7 18 00 00
E: 14.975941 8 02 90 51 0f a8 18 00 00
E: 14.984013 8 02 90 4b 0f ab 18 00 00
E: 14.992006 8 02 90 45 0f a7 18 00 00
E: 15.008001 8 02 90 41 0f a8 18 00 00
E: 15.016005 8 02 90 3c 0f a4 18 00 00
E: 15.024005 8 02 90 3b 0f 9c 18 00 00
E: 15.032006 8 02 90 41 0f 96 18 00 00
E: 15.047998 8 02 90 43 0f 8e 18 00 00
E: 15.056006 8 02 90 48 0f 83 18 00 00
E: 15.064000 8 02 90 49 0f 7b 18 00 00
E: 15.072006 8 02 90 4c 0f 75 18 00 00
E: 15.088000 8 02 90 4f 0f 6b 18 00 00
E: 15.096005 8 02 90 50 0f 66 18 00 00
E: 15.104005 8 02 90 55 0f 62 18 00 00
E: 15.120001 8 02 90 55 0f 5e 18 00 00
E: 15.128004 8 02 90 56 0f 5e 18 00 00
E: 15.136006 8 02 90 53 0f 5b 18 00 00
E: 15.144006 8 02 90 56 0f 5e 18 00 00
E: 15.160000 8 02 90 57 0f 62 18 00 00
E: 15.168004 8 02 90 55 0f 61 18 00 00
E: 15.176005 8 02 90 55 0f 63 18 00 00
E: 15.184005 8 02 90 51 0f 63 18 00 00
E: 15.200001 8 02 90 4d 0f 61 18 00 00
E: 15.208005 8 02 90 4b 0f 62 18 00 00
E: 15.216004 8 02 90 42 0f 60 18 00 00
E: 15.224005 8 02 90 3e 0f 60 18 00 00
E: 15.239996 8 02 90 37 0f 5c 18 00 00
E: 15.248004 8 02 90 2f 0f 5a 18 00 00
E: 15.256005 8 02 90 2d 0f 58 18 00 00
E: 15.272001 8 02 90 30 0f 58 18 00 00
E: 15.280005 8 02 90 31 0f 57 18 00 00
E: 15.287945 8 02 90 33 0f 54 18 00 00
E: 15.295958 8 02 90 3a 0f 57 18 00 00
E: 15.312000 8 02 90 3a 0f 56 18 00 00
E: 15.319944 8 02 90 3b 0f 54 18 00 00
E: 15.327928 8 02 90 3a 0f 57 18 00 00
E: 15.336005 8 02 90 3a 0f 55 18 00 00
E: 15.351999 8 02 90 3a 0f 56 18 00 00
E: 15.360004 8 02 90 39 0f 55 18 00 00
E: 15.368004 8 02 90 3b 0f 54 18 00 00
E: 15.383999 8 02 90 3c 0f 4c 18 00 00
E: 15.392005 8 02 90 46 0f 4a 18 00 00
E: 15.400004 8 02 90 45 0f 45 18 00 00
E: 15.408004 8 02 90 47 0f 3f 18 00 00
E: 15.423998 8 02 90 43 0f 39 18 00 00
E: 15.432004 8 02 90 3e 0f 37 18 00 00
E: 15.440007 8 02 90 3d 0f 2d 18 00 00
E: 15.448003 8 02 90 3a 0f 26 18 00 00
E: 15.463995 8 02 90 39 0f 1f 18 00 00
E: 15.472003 8 02 90 38 0f 19 18 00 00
E: 15.480004 8 02 90 3a 0f 13 18 00 00
E: 15.488004 8 02 90 3c 0f 0b 18 00 00
E: 15.503999 8 02 90 3d 0f 01 18 00 00
E: 15.512004 8 02 90 3d 0f fa 17 00 00
E: 15.520004 8 02 90 3e 0f f3 17 00 00
E: 15.535995 8 02 90 3c 0f ed 17 00 00
E: 15.543934 8 02 90 3c 0f e5 17 00 00
E: 15.551939 8 02 90 3d 0f e1 17 00 00
E: 15.559994 8 02 90 3a 0f dd 17 00 00
E: 15.575931 8 02 90 39 0f d9 17 00 00
E: 15.584004 8 02 90 38 0f d3 17 00 00
E: 15.592004 8 02 90 38 0f cf 17 00 00
E: 15.600003 8 02 90 32 0f c9 17 00 00
E: 15.615998 8 02 90 2f 0f c3 17 00 00
E: 15.624003 8 02 90 2b 0f c2 17 00 00
E: 15.631999 8 02 90 2d 0f be 17 00 00
E: 15.647993 8 02 90 2e 0f b8 17 00 00
E: 15.656004 8 02 90 32 0f b5 17 00 00
E: 15.663998 8 02 90 35 0f b2 17 00 00
E: 15.672002 8 02 90 36 0f af 17 00 00
E: 15.687994 8 02 90 36 0f b0 17 00 00
E: 15.696002 8 02 90 35 0f b1 17 00 00
E: 15.704002 8 02 90 35 0f b0 17 00 00
E: 15.712002 8 02 90 30 0f b3 17 00 00
E: 15.727998 8 02 90 28 0f b5 17 00 00
E: 15.736003 8 02 90 27 0f b6 17 00 00
E: 15.743999 8 02 90 2a 0f bd 17 00 00
E: 15.752002 8 02 90 25 0f c0 17 00 00
E: 15.767935 8 02 90 25 0f c1 17 00 00
E: 15.775934 8 02 90 22 0f c5 17 00 00
E: 15.783931 8 02 90 21 0f c9 17 00 00
E: 15.799933 8 02 90 1d 0f cc 17 00 00
E: 15.807929 8 02 90 1b 0f d1 17 00 00
E: 15.815929 8 02 90 1a 0f d2 17 00 00
E: 15.823932 8 02 90 17 0f d8 17 00 00
E: 15.839927 8 02 90 12 0f dc 17 00 00
E: 15.847921 8 02 90 15 0f e0 17 00 00
E: 15.855953 8 02 90 13 0f e2 17 00 00
E: 15.863932 8 02 90 0f 0f e8 17 00 00
E: 15.879927 8 02 90 0c 0f e8 17 00 00
E: 15.887934 8 02 90 0e 0f e9 17 00 00
E: 15.895934 8 02 90 0c 0f e9 17 00 00
E: 15.911934 8 02 90 13 0f ec 17 00 00
E: 15.919932 8 02 90 0b 0f ed 17 00 00
E: 15.927934 8 02 90 0d 0f ed 17 00 00
E: 15.935929 8 02 90 09 0f ee 17 00 00
E: 15.951931 8 02 90 0c 0f f1 17 00 00
E: 15.959935 8 02 90 0a 0f f1 17 00 00
E: 15.967934 8 02 90 0e 0f f4 17 00 00
E: 15.975936 8 02 90 0e 0f f7 17 00 00
E: 15.991925 8 02 90 13 0f f7 17 00 00
E: 15.999935 8 02 90 19 0f fb 17 00 00
E: 16.007928 8 02 90 20 0f fb 17 00 00
E: 16.015927 8 02 90 29 0f f8 17 00 00
E: 16.031928 8 02 90 35 0f f5 17 00 00
E: 16.039930 8 02 90 3d 0f f1 17 00 00
E: 16.047934 8 02 90 4a 0f e8 17 00 00
E: 16.063925 8 02 90 58 0f e2 17 00 00
E: 16.071929 8 02 90 66 0f d7 17 00 00
E: 16.079944 8 02 90 84 0f c8 17 00 00
E: 16.088006 8 02 90 a1 0f b3 17 00 00
E: 16.103997 8 02 90 b7 0f 9a 17 00 00
E: 16.112001 8 02 90 d0 0f 78 17 00 00
E: 16.120001 8 02 90 f2 0f 4d 17 00 00
E: 16.128001 8 02 90 22 10 15 17 00 00
E: 16.143996 8 02 90 59 10 c1 16 00 00
E: 16.152000 8 02 90 92 10 49 16 00 00
E: 16.160001 8 02 90 c6 10 84 15 00 00
E: 16.175995 8 02 90 ee 10 dc 14 00 00
E: 16.184001 8 02 90 00 11 53 14 00 00
E: 16.191999 8 02 90 04 11 d3 13 00 00
E: 16.200000 8 02 90 f1 10 3f 13 00 00
E: 16.215995 8 02 90 d3 10 a4 12 00 00
E: 16.224001 8 02 90 bf 10 16 12 00 00
E: 16.232000 8 02 90 9f 10 9a 11 00 00
E: 16.240000 8 02 90 72 10 4b 11 00 00
E: 16.255995 8 02 90 3c 10 12 11 00 00
E: 16.263995 8 02 90 f9 0f eb 10 00 00
E: 16.271999 8 02 90 a3 0f ca 10 00 00
E: 16.280000 8 02 90 31 0f bc 10 00 00
E: 16.295995 8 02 90 a7 0e c5 10 00 00
E: 16.304001 8 02 90 13 0e e1 10 00 00
E: 16.312000 8 02 90 b2 0d 11 11 00 00
E: 16.327995 8 02 90 82 0d 54 11 00 00
E: 16.335999 8 02 90 7a 0d a7 11 00 00
E: 16.344000 8 02 90 91 0d ed 11 00 00
E: 16.351999 8 02 90 ae 0d 4e 12 00 00
E: 16.367994 8 02 90 d7 0d ac 12 00 00
E: 16.376000 8 02 90 1a 0e 12 13 00 00
E: 16.384000 8 02 90 76 0e 78 13 00 00
E: 16.391999 8 02 90 e9 0e ce 13 00 00
E: 16.407996 8 02 90 6a 0f 0d 14 00 00
E: 16.416000 8 02 90 e6 0f 34 14 00 00
E: 16.424000 8 02 90 6f 10 3e 14 00 00
E: 16.439989 8 02 90 03 11 2e 14 00 00
E: 16.447999 8 02 90 ad 11 0d 14 00 00
E: 16.455999 8 02 90 5d 12 dc 13 00 00
E: 16.463994 8 02 90 cb 12 9e 13 00 00
E: 16.479994 8 02 90 06 13 5a 13 00 00
E: 16.487999 8 02 90 21 13 01 13 00 00
E: 16.495999 8 02 90 2e 13 8f 12 00 00
E: 16.503999 8 02 90 33 13 21 12 00 00
E: 16.519992 8 02 90 2c 13 d7 11 00 00
E: 16.527997 8 02 90 1a 13 99 11 00 00
E: 16.535998 8 02 90 fb 12 48 11 00 00
E: 16.543998 8 02 90 e2 12 09 11 00 00
E: 16.559990 8 02 90 df 12 da 10 00 00
E: 16.567999 8 02 90 da 12 bf 10 00 00
E: 16.575999 8 02 90 d3 12 ae 10 00 00
E: 16.591992 8 02 90 ca 12 a9 10 00 00
E: 16.599999 8 02 90 b7 12 a8 10 00 00
E: 16.608001 8 02 90 a3 12 a8 10 00 00
E: 16.615997 8 02 90 95 12 9e 10 00 00
E: 16.631993 8 02 90 6f 12 94 10 00 00
E: 16.639997 8 02 90 48 12 8e 10 00 00
E: 16.647998 8 02 90 27 12 8b 10 00 00
E: 16.655998 8 02 90 0c 12 92 10 00 00
E: 16.671992 8 02 90 ed 11 b7 10 00 00
E: 16.679999 8 02 90 cc 11 08 11 00 00
E: 16.687997 8 02 90 9e 11 9d 11 00 00
E: 16.695997 8 02 90 6f 11 66 12 00 00
E: 16.711992 8 02 90 47 11 0f 13 00 00
E: 16.719997 8 02 90 2f 11 91 13 00 00
E: 16.727997 8 02 90 24 11 0f 14 00 00
E: 16.743992 8 02 10 12 11 c1 14 00 00
E: 16.751928 8 02 10 df 10 ff 15 00 00
E: 16.839993 8 02 00 00 00 00 00 00 00
E: 17.063987 8 02 b0 9c 0a 04 16 00 00
E: 17.079924 8 02 b0 3e 0b 8b 17 00 00
E: 17.087925 8 02 b0 bd 0b ec 18 00 00
E: 17.096006 8 02 b0 1d 0c 45 1a 00 00
E: 17.111992 8 02 b0 53 0c 50 1b 00 00
E: 17.119995 8 02 b0 53 0c 18 1c 00 00
E: 17.127996 8 02 b0 28 0c 9f 1c 00 00
E: 17.135995 8 02 b0 c7 0b ba 1c 00 00
E: 17.151992 8 02 b0 fb 0a 35 1c 00 00
E: 17.159995 8 02 30 3c 0a 84 1b 00 00
E: 17.231991 8 02 30 3f 11 79 17 00 00
E: 17.239993 8 02 30 11 13 93 17 00 00
E: 17.255991 8 02 b0 19 14 af 17 00 00
E: 17.263990 8 02 b0 e4 14 cc 17 00 00
E: 17.271995 8 02 30 94 15 cf 17 00 00
E: 17.287986 8 02 30 01 16 6f 17 00 00
E: 17.295991 8 02 30 63 16 bd 16 00 00
E: 17.303993 8 02 30 20 17 ae 15 00 00
E: 17.311996 8 02 30 fa 17 8a 14 00 00
E: 17.327990 8 02 30 41 19 d2 13 00 00
E: 17.335995 8 02 30 17 1a 2e 13 00 00
E: 17.343994 8 02 30 67 1a a0 12 00 00
E: 17.351994 8 02 30 6c 1a 94 11 00 00
E: 17.367990 8 02 30 51 1a 29 11 00 00
E: 17.375994 8 02 b0 46 1a db 10 00 00
E: 17.383994 8 02 b0 64 1a 99 10 00 00
E: 17.391994 8 02 b0 a0 1a 55 10 00 00
E: 17.407990 8 02 b0 f2 1a fc 0f 00 00
E: 17.415995 8 02 b0 41 1b 84 0f 00 00
E: 17.423995 8 02 b0 6e 1b ec 0e 00 00
E: 17.439989 8 02 b0 78 1b 3f 0e 00 00
E: 17.447996 8 02 b0 52 1b c2 0d 00 00
E: 17.455996 8 02 b0 fa 1a 69 0d 00 00
E: 17.463991 8 02 b0 76 1a 20 0d 00 00
E: 17.479958 8 02 b1 d8 19 94 0c a8 00
E: 17.487994 8 02 b1 2d 19 16 0c a5 00
E: 17.495945 8 02 b1 76 18 c0 0b a8 00
E: 17.503990 8 02 b1 a6 17 84 0b a4 00
E: 17.519945 8 02 b1 cc 16 64 0b a0 00
E: 17.527993 8 02 b1 ee 15 6a 0b a1 00
E: 17.535929 8 02 b1 f6 14 94 0b a3 00
E: 17.543948 8 02 b1 34 14 c1 0b a1 00
E: 17.559945 8 02 b1 91 13 ed 0b a2 00
E: 17.567935 8 02 b1 2a 13 13 0c ab 00
E: 17.575944 8 02 b1 eb 12 39 0c af 00
E: 17.591988 8 02 b1 ad 12 73 0c b1 00
E: 17.599994 8 02 b1 69 12 cc 0c b9 00
E: 17.607947 8 02 b1 3b 12 38 0d bb 00
E: 17.615994 8 02 b1 1c 12 b1 0d bf 00
E: 17.631987 8 02 b1 29 12 31 0e c8 00
E: 17.639993 8 02 b1 56 12 b1 0e ca 00
E: 17.647993 8 02 b1 9a 12 1b 0f cd 00
E: 17.655948 8 02 b1 e0 12 6b 0f cc 00
E: 17.671944 8 02 b1 28 13 a2 0f cc 00
E: 17.679925 8 02 b1 6b 13 c6 0f ce 00
E: 17.687947 8 02 b1 a4 13 d3 0f cf 00
E: 17.695993 8 02 b1 d4 13 c9 0f cc 00
E: 17.711987 8 02 b1 06 14 a6 0f d0 00
E: 17.719946 8 02 b1 48 14 5f 0f d3 00
E: 17.727993 8 02 b1 92 14 f4 0e d5 00
E: 17.743992 8 02 b1 d3 14 67 0e d4 00
E: 17.751991 8 02 b1 0a 15 d3 0d d0 00
E: 17.759991 8 02 b1 22 15 56 0d ca 00
E: 17.767932 8 02 b1 15 15 e1 0c ce 00
E: 17.783930 8 02 b1 ec 14 78 0c d1 00
E: 17.791944 8 02 b1 a8 14 2e 0c d4 00
E: 17.799992 8 02 b1 3b 14 f6 0b d9 00
E: 17.807946 8 02 b1 b7 13 e0 0b d5 00
E: 17.823943 8 02 b1 3e 13 ef 0b d2 00
E: 17.831990 8 02 b1 cb 12 20 0c d3 00
E: 17.839948 8 02 b1 55 12 74 0c cd 00
E: 17.847989 8 02 b1 f0 11 da 0c cb 00
E: 17.863983 8 02 b1 ad 11 4a 0d cb 00
E: 17.871948 8 02 b1 7d 11 bb 0d cc 00
E: 17.879929 8 02 b1 5f 11 32 0e cc 00
E: 17.895989 8 02 b1 54 11 b5 0e cd 00
E: 17.903930 8 02 b1 5b 11 23 0f cc 00
E: 17.911993 8 02 b1 76 11 7c 0f cb 00
E: 17.919929 8 02 b1 9d 11 b2 0f c7 00
E: 17.935928 8 02 b1 c2 11 cc 0f c7 00
E: 17.943945 8 02 b1 d9 11 d5 0f c5 00
E: 17.951928 8 02 b1 e7 11 d0 0f c7 00
E: 17.959944 8 02 b1 f3 11 bf 0f cd 00
E: 17.975944 8 02 b1 f9 11 a3 0f d5 00
E: 17.983991 8 02 b1 f3 11 8b 0f dc 00
E: 17.991992 8 02 b1 ef 11 7f 0f e3 00
E: 17.999991 8 02 b1 ea 11 7c 0f dd 00
E: 18.015986 8 02 b1 f2 11 7d 0f bd 00
E: 18.023991 8 02 b1 18 12 8d 0f 4f 00
E: 18.031991 8 02 b0 64 12 93 0f 00 00
E: 18.047981 8 02 b0 7a 12 66 0f 00 00
E: 18.055947 8 02 b0 5c 12 48 0f 00 00
E: 18.063927 8 02 b0 23 12 35 0f 00 00
E: 18.071991 8 02 b0 f0 11 1e 0f 00 00
E: 18.087986 8 02 30 f0 11 f1 0e 00 00
E: 18.215986 8 02 30 8d 12 7d 0f 00 00
E: 18.223991 8 02 b0 b4 12 c0 0f 00 00
E: 18.231920 8 02 b0 cb 12 f4 0f 00 00
E: 18.239909 8 02 b0 46 12 ee 0f 02 00
E: 18.255986 8 02 b1 71 11 ad 0f 48 01
E: 18.263941 8 02 b1 0b 11 a9 0f 28 01
E: 18.271990 8 02 b1 f7 10 b1 0f f2 00
E: 18.279936 8 02 b1 12 11 bc 0f 9e 00
E: 18.295986 8 02 b0 7d 11 de 0f 1e 00
E: 18.303990 8 02 b0 1c 12 c7 0f 00 00
E: 18.311990 8 02 b0 8b 12 77 0f 00 00
E: 18.319990 8 02 b0 bf 12 28 0f 00 00
E: 18.335983 8 02 b0 a5 12 e5 0e 00 00
E: 18.343991 8 02 30 59 12 17 0e 00 00
E: 18.375983 8 02 00 00 00 00 00 00 00
