# 042:0 -> 056A:00CE / Wacom Co.,Ltd. | DTU-2231
D:0
R: 110 05 01 09 02 a1 01 85 01 09 01 a1 00 05 09 19 01 29 02 15 00 25 01 95 02 75 01 81 02 95 01 75 06 81 03 05 01 09 30 09 31 15 81 25 7f 75 08 95 02 81 06 c0 c0 05 0d 09 01 a1 01 85 02 a1 00 06 00 ff 09 01 15 00 26 ff 00 75 08 95 07 81 02 c0 09 01 95 01 b1 12 85 03 09 01 b1 12 85 04 09 01 b1 12 85 05 09 01 b1 12 85 06 09 01 b1 12 c0
N: Wacom Co.,Ltd. DTU-2231
P: usb-0000:00:14.0-6.0/input0
I: 3 056A 00CE
# SET_REPORT (Feature) ID: 02 -> 02 02 (length 2)
E: 0.000000 8 02 20 83 54 24 20 00 00
E: 0.006934 8 02 20 83 54 24 20 00 00
E: 0.013931 8 02 20 90 54 19 20 00 00
E: 0.021000 8 02 20 90 54 19 20 00 00
E: 0.027000 8 02 20 9c 54 09 20 00 00
E: 0.033998 8 02 20 99 54 00 20 00 00
E: 0.040999 8 02 20 92 54 f7 1f 00 00
E: 0.048001 8 02 20 81 54 ed 1f 00 00
E: 0.055000 8 02 20 68 54 e5 1f 00 00
E: 0.061998 8 02 20 43 54 df 1f 00 00
E: 0.068998 8 02 20 0d 54 dc 1f 00 00
E: 0.074999 8 02 20 d1 53 d8 1f 00 00
E: 0.082999 8 02 20 8a 53 d3 1f 00 00
E: 0.088998 8 02 20 40 53 cc 1f 00 00
E: 0.095998 8 02 20 ec 52 c5 1f 00 00
E: 0.102998 8 02 20 8f 52 c0 1f 00 00
E: 0.109998 8 02 20 25 52 be 1f 00 00
E: 0.116997 8 02 20 ae 51 c0 1f 00 00
E: 0.122998 8 02 20 2a 51 ca 1f 00 00
E: 0.130998 8 02 20 93 50 db 1f 00 00
E: 0.136997 8 02 20 ee 4f f7 1f 00 00
E: 0.144998 8 02 20 34 4f 1e 20 00 00
E: 0.150997 8 02 20 6a 4e 51 20 00 00
E: 0.157998 8 02 20 92 4d 8c 20 00 00
E: 0.164999 8 02 20 ad 4c d2 20 00 00
E: 0.171994 8 02 20 bb 4b 22 21 00 00
E: 0.178998 8 02 20 c0 4a 7c 21 00 00
E: 0.184997 8 02 20 bc 49 e1 21 00 00
E: 0.192998 8 02 20 af 48 51 22 00 00
E: 0.198998 8 02 20 9f 47 cf 22 00 00
E: 0.205997 8 02 20 86 46 58 23 00 00
E: 0.212998 8 02 20 6a 45 f2 23 00 00
E: 0.219998 8 02 20 49 44 95 24 00 00
E: 0.226998 8 02 20 31 43 4a 25 00 00
E: 0.233998 8 02 20 19 42 0a 26 00 00
E: 0.240998 8 02 20 0f 41 da 26 00 00
E: 0.246998 8 02 20 16 40 b6 27 00 00
E: 0.253998 8 02 20 2c 3f 9b 28 00 00
E: 0.260998 8 02 20 5e 3e 90 29 00 00
E: 0.267993 8 02 20 a3 3d 86 2a 00 00
E: 0.274998 8 02 20 09 3d 8a 2b 00 00
E: 0.281998 8 02 20 82 3c 8c 2c 00 00
E: 0.288997 8 02 20 1b 3c 92 2d 00 00
E: 0.295997 8 02 20 cf 3b 95 2e 00 00
E: 0.302998 8 02 20 9c 3b 96 2f 00 00
E: 0.308997 8 02 20 84 3b 94 30 00 00
E: 0.315998 8 02 20 88 3b 86 31 00 00
E: 0.322998 8 02 20 aa 3b 76 32 00 00
E: 0.329997 8 02 20 e8 3b 5b 33 00 00
E: 0.336994 8 02 20 3e 3c 37 34 00 00
E: 0.343997 8 02 20 ab 3c 05 35 00 00
E: 0.351000 8 02 20 2b 3d c7 35 00 00
E: 0.356997 8 02 20 c2 3d 7f 36 00 00
E: 0.363997 8 02 20 6d 3e 21 37 00 00
E: 0.370997 8 02 20 23 3f b4 37 00 00
E: 0.377998 8 02 20 ed 3f 32 38 00 00
E: 0.384938 8 02 20 c0 40 9a 38 00 00
E: 0.391998 8 02 20 a0 41 f0 38 00 00
E: 0.398997 8 02 20 87 42 30 39 00 00
E: 0.405997 8 02 20 7b 43 5b 39 00 00
E: 0.412997 8 02 20 74 44 6c 39 00 00
E: 0.418996 8 02 20 78 45 6a 39 00 00
E: 0.425997 8 02 20 84 46 51 39 00 00
E: 0.432997 8 02 20 97 47 26 39 00 00
E: 0.439997 8 02 20 b0 48 e7 38 00 00
E: 0.446996 8 02 20 d5 49 95 38 00 00
E: 0.453997 8 02 20 04 4b 34 38 00 00
E: 0.460997 8 02 20 34 4c c0 37 00 00
E: 0.466938 8 02 20 68 4d 43 37 00 00
E: 0.474951 8 02 20 95 4e b4 36 00 00
E: 0.480998 8 02 20 c3 4f 1c 36 00 00
E: 0.488000 8 02 20 eb 50 79 35 00 00
E: 0.494997 8 02 20 0d 52 ca 34 00 00
E: 0.501997 8 02 20 24 53 12 34 00 00
E: 0.508997 8 02 20 33 54 4f 33 00 00
E: 0.515995 8 02 20 38 55 83 32 00 00
E: 0.522997 8 02 20 35 56 ae 31 00 00
E: 0.529998 8 02 20 25 57 cf 30 00 00
E: 0.536997 8 02 20 0b 58 e9 2f 00 00
E: 0.542996 8 02 20 e0 58 fa 2e 00 00
E: 0.549996 8 02 20 a4 59 08 2e 00 00
E: 0.556996 8 02 20 54 5a 12 2d 00 00
E: 0.563996 8 02 20 ee 5a 19 2c 00 00
E: 0.570996 8 02 20 74 5b 20 2b 00 00
E: 0.577997 8 02 20 e2 5b 28 2a 00 00
E: 0.584995 8 02 20 3a 5c 35 29 00 00
E: 0.590996 8 02 20 78 5c 47 28 00 00
E: 0.598996 8 02 20 9f 5c 58 27 00 00
E: 0.604997 8 02 20 b2 5c 6e 26 00 00
E: 0.611996 8 02 20 ae 5c 85 25 00 00
E: 0.618996 8 02 20 93 5c 99 24 00 00
E: 0.625997 8 02 20 60 5c b1 23 00 00
E: 0.632996 8 02 20 14 5c c6 22 00 00
E: 0.639995 8 02 20 b1 5b e0 21 00 00
E: 0.646995 8 02 20 39 5b fc 20 00 00
E: 0.652995 8 02 20 aa 5a 22 20 00 00
E: 0.660996 8 02 20 08 5a 50 1f 00 00
E: 0.666996 8 02 20 52 59 8a 1e 00 00
E: 0.673995 8 02 20 8e 58 d7 1d 00 00
E: 0.680996 8 02 20 bc 57 33 1d 00 00
E: 0.687996 8 02 20 e3 56 a3 1c 00 00
E: 0.694996 8 02 20 04 56 22 1c 00 00
E: 0.701996 8 02 20 1c 55 b3 1b 00 00
E: 0.708995 8 02 20 3a 54 52 1b 00 00
E: 0.714997 8 02 20 52 53 ff 1a 00 00
E: 0.721995 8 02 20 71 52 b7 1a 00 00
E: 0.728995 8 02 20 95 51 7a 1a 00 00
E: 0.735995 8 02 20 c1 50 46 1a 00 00
E: 0.742995 8 02 20 f4 4f 1c 1a 00 00
E: 0.749995 8 02 20 36 4f fa 19 00 00
E: 0.756995 8 02 20 8a 4e e2 19 00 00
E: 0.763996 8 02 20 eb 4d d3 19 00 00
E: 0.769996 8 02 20 66 4d ce 19 00 00
E: 0.776995 8 02 20 f6 4c d2 19 00 00
E: 0.783994 8 02 20 9c 4c dc 19 00 00
E: 0.790995 8 02 20 5d 4c ee 19 00 00
E: 0.797995 8 02 20 31 4c 06 1a 00 00
E: 0.804995 8 02 20 1a 4c 20 1a 00 00
E: 0.811996 8 02 20 12 4c 38 1a 00 00
E: 0.818994 8 02 20 1a 4c 4f 1a 00 00
E: 0.825995 8 02 20 2e 4c 64 1a 00 00
E: 0.831994 8 02 20 4e 4c 75 1a 00 00
E: 0.838994 8 02 20 78 4c 82 1a 00 00
E: 0.845995 8 02 20 a8 4c 8e 1a 00 00
E: 0.852995 8 02 20 e0 4c 94 1a 00 00
E: 0.859996 8 02 20 20 4d 9a 1a 00 00
E: 0.866995 8 02 20 66 4d 9f 1a 00 00
E: 0.873995 8 02 20 b0 4d a5 1a 00 00
E: 0.879995 8 02 20 fa 4d a9 1a 00 00
E: 0.887998 8 02 20 45 4e ae 1a 00 00
E: 0.893995 8 02 20 8b 4e b2 1a 00 00
E: 0.900965 8 02 20 ce 4e b5 1a 00 00
E: 0.907995 8 02 20 0f 4f b8 1a 00 00
E: 0.914995 8 02 20 45 4f bb 1a 00 00
E: 0.921997 8 02 20 72 4f c0 1a 00 00
E: 0.927997 8 02 20 92 4f cb 1a 00 00
E: 0.935993 8 02 20 a4 4f d9 1a 00 00
E: 0.941993 8 02 20 a7 4f ed 1a 00 00
E: 0.948994 8 02 20 9e 4f 04 1b 00 00
E: 0.955994 8 02 20 88 4f 1f 1b 00 00
E: 0.962994 8 02 20 66 4f 3c 1b 00 00
E: 0.969995 8 02 20 3c 4f 5d 1b 00 00
E: 0.976994 8 02 20 0d 4f 7e 1b 00 00
E: 0.983994 8 02 20 e1 4e 9b 1b 00 00
E: 0.989934 8 02 20 b8 4e b6 1b 00 00
E: 0.996995 8 02 20 96 4e cd 1b 00 00
E: 1.003994 8 02 20 7a 4e e1 1b 00 00
E: 1.010994 8 02 20 65 4e f3 1b 00 00
E: 1.017989 8 02 20 56 4e 01 1c 00 00
E: 1.024994 8 02 20 4d 4e 32 1c 00 00
E: 1.031995 8 02 20 4b 4e 3c 1c 00 00
E: 1.038994 8 02 20 4b 4e 3c 1c 35 00
E: 1.044993 8 02 20 4b 4e 3c 1c 86 00
E: 1.051993 8 02 20 45 4e 45 1c d9 00
E: 1.058994 8 02 20 45 4e 45 1c 2f 01
E: 1.065932 8 02 21 45 4e 45 1c 85 01
E: 1.072948 8 02 21 41 4e 3a 1c dc 01
E: 1.079993 8 02 21 3d 4e 0e 1c ff 01
E: 1.086994 8 02 21 33 4e 03 1c ff 01
E: 1.093993 8 02 21 28 4e fa 1b ff 01
E: 1.099993 8 02 21 19 4e f1 1b ff 01
E: 1.106993 8 02 21 05 4e ea 1b ff 01
E: 1.113993 8 02 21 e8 4d e5 1b ff 01
E: 1.120995 8 02 21 c5 4d e3 1b ff 01
E: 1.127994 8 02 21 9a 4d e7 1b ff 01
E: 1.134990 8 02 21 64 4d f2 1b ff 01
E: 1.141993 8 02 21 26 4d 07 1c ff 01
E: 1.147993 8 02 21 df 4c 26 1c ff 01
E: 1.155933 8 02 21 90 4c 53 1c ff 01
E: 1.161946 8 02 21 39 4c 8d 1c ff 01
E: 1.168992 8 02 21 dc 4b d4 1c ff 01
E: 1.175993 8 02 21 79 4b 2b 1d ff 01
E: 1.182993 8 02 21 13 4b 90 1d ff 01
E: 1.189935 8 02 21 b0 4a 04 1e ff 01
E: 1.196946 8 02 21 4d 4a 82 1e ff 01
E: 1.203993 8 02 21 ee 49 0f 1f ff 01
E: 1.209992 8 02 21 95 49 a2 1f ff 01
E: 1.216994 8 02 21 43 49 41 20 ff 01
E: 1.223933 8 02 21 fd 48 e9 20 ff 01
E: 1.230947 8 02 21 c0 48 98 21 ff 01
E: 1.238005 8 02 21 97 48 52 22 ff 01
E: 1.244947 8 02 21 72 48 0d 23 ff 01
E: 1.251960 8 02 21 5f 48 cf 23 ff 01
E: 1.258950 8 02 21 5a 48 96 24 ff 01
E: 1.264946 8 02 21 64 48 5f 25 ff 01
E: 1.271936 8 02 21 7e 48 27 26 ff 01
E: 1.278946 8 02 21 a5 48 f0 26 ff 01
E: 1.285993 8 02 21 de 48 b4 27 ff 01
E: 1.292950 8 02 21 1e 49 6f 28 ff 01
E: 1.299993 8 02 21 71 49 29 29 ff 01
E: 1.306928 8 02 21 cf 49 dc 29 ff 01
E: 1.313947 8 02 21 40 4a 84 2a ff 01
E: 1.320992 8 02 21 bf 4a 21 2b ff 01
E: 1.326946 8 02 21 4c 4b b2 2b ff 01
E: 1.333993 8 02 21 e6 4b 34 2c ff 01
E: 1.340948 8 02 21 8e 4c a8 2c ff 01
E: 1.347947 8 02 21 47 4d 0e 2d ff 01
E: 1.354934 8 02 21 0d 4e 61 2d ff 01
E: 1.361948 8 02 21 dc 4e a2 2d ff 01
E: 1.368992 8 02 21 af 4f d2 2d ff 01
E: 1.374991 8 02 21 86 50 f1 2d ff 01
E: 1.382991 8 02 21 62 51 fd 2d ff 01
E: 1.388993 8 02 21 3d 52 f9 2d ff 01
E: 1.395992 8 02 21 15 53 e2 2d ff 01
E: 1.402992 8 02 21 e4 53 ba 2d ff 01
E: 1.409949 8 02 21 ac 54 84 2d ff 01
E: 1.416994 8 02 21 6b 55 39 2d ff 01
E: 1.422933 8 02 21 1e 56 e0 2c ff 01
E: 1.430945 8 02 21 c5 56 7c 2c ff 01
E: 1.436991 8 02 21 5d 57 10 2c ff 01
E: 1.443991 8 02 21 e6 57 9e 2b ff 01
E: 1.450924 8 02 21 5f 58 26 2b ff 01
E: 1.457948 8 02 21 cb 58 ae 2a ff 01
E: 1.464958 8 02 21 25 59 31 2a ff 01
E: 1.471991 8 02 21 73 59 b7 29 ff 01
E: 1.478992 8 02 21 b0 59 3c 29 ff 01
E: 1.484991 8 02 21 dc 59 bd 28 ff 01
E: 1.491948 8 02 21 f6 59 3b 28 ff 01
E: 1.498992 8 02 21 fe 59 b5 27 ff 01
E: 1.505926 8 02 21 f4 59 2d 27 ff 01
E: 1.512944 8 02 21 d7 59 a4 26 ff 01
E: 1.519990 8 02 21 a7 59 1d 26 ff 01
E: 1.526991 8 02 21 66 59 9b 25 ff 01
E: 1.533991 8 02 21 17 59 1f 25 ff 01
E: 1.539932 8 02 21 bd 58 ad 24 ff 01
E: 1.546945 8 02 21 59 58 46 24 ff 01
E: 1.553992 8 02 21 f0 57 e8 23 ff 01
E: 1.560945 8 02 21 82 57 94 23 ff 01
E: 1.567930 8 02 21 0f 57 49 23 ff 01
E: 1.574991 8 02 21 9c 56 09 23 ff 01
E: 1.580992 8 02 21 25 56 cf 22 ff 01
E: 1.588930 8 02 21 ae 55 9a 22 ff 01
E: 1.594945 8 02 21 39 55 69 22 ff 01
E: 1.601987 8 02 21 cb 54 40 22 f6 01
E: 1.608991 8 02 21 5e 54 19 22 df 01
E: 1.615991 8 02 21 f8 53 fb 21 b9 01
E: 1.622992 8 02 21 9c 53 e2 21 81 01
E: 1.629991 8 02 21 43 53 cb 21 38 01
E: 1.636990 8 02 21 fd 52 c2 21 e7 00
E: 1.642991 8 02 21 bd 52 bb 21 9a 00
E: 1.650945 8 02 21 8a 52 bf 21 50 00
E: 1.656992 8 02 21 57 52 bf 21 0b 00
E: 1.663990 8 02 21 32 52 cc 21 00 00
E: 1.670933 8 02 21 0e 52 d2 21 00 00
E: 1.677944 8 02 21 f5 51 df 21 00 00
E: 1.684928 8 02 20 e3 51 eb 21 00 00
E: 1.691988 8 02 20 d3 51 f5 21 00 00
E: 1.698990 8 02 20 c7 51 fc 21 00 00
E: 1.704991 8 02 20 bf 51 05 22 00 00
E: 1.711991 8 02 20 ba 51 11 22 00 00
E: 1.718990 8 02 20 b8 51 1f 22 00 00
E: 1.725990 8 02 20 b7 51 31 22 00 00
E: 1.732991 8 02 20 b6 51 48 22 00 00
E: 1.739990 8 02 20 b1 51 64 22 00 00
E: 1.746991 8 02 20 aa 51 86 22 00 00
E: 1.753991 8 02 20 9d 51 ae 22 00 00
E: 1.759990 8 02 20 8a 51 de 22 00 00
E: 1.766990 8 02 20 74 51 0f 23 00 00
E: 1.773992 8 02 20 58 51 44 23 00 00
E: 1.780992 8 02 20 3c 51 7a 23 00 00
E: 1.787990 8 02 20 20 51 b1 23 00 00
E: 1.794990 8 02 20 05 51 e8 23 00 00
E: 1.801989 8 02 20 eb 50 19 24 00 00
E: 1.808991 8 02 20 d6 50 4c 24 00 00
E: 1.815990 8 02 20 c1 50 78 24 00 00
E: 1.821990 8 02 20 b1 50 a5 24 00 00
E: 1.828990 8 02 20 a2 50 d0 24 00 00
E: 1.835989 8 02 20 94 50 fa 24 00 00
E: 1.842989 8 02 20 80 50 23 25 00 00
E: 1.849990 8 02 20 6a 50 4a 25 00 00
E: 1.856990 8 02 20 51 50 72 25 00 00
E: 1.863990 8 02 20 32 50 97 25 00 00
E: 1.870990 8 02 20 14 50 bd 25 00 00
E: 1.877990 8 02 20 f1 4f e0 25 00 00
E: 1.883990 8 02 20 d1 4f 01 26 00 00
E: 1.890990 8 02 20 b1 4f 1f 26 00 00
E: 1.897986 8 02 20 95 4f 3c 26 00 00
E: 1.904990 8 02 20 7e 4f 57 26 00 00
E: 1.911990 8 02 20 6c 4f 6f 26 00 00
E: 1.918989 8 02 20 5e 4f 84 26 00 00
E: 1.925990 8 02 20 53 4f 98 26 00 00
E: 1.931990 8 02 20 49 4f a8 26 00 00
E: 1.939990 8 02 20 3f 4f b8 26 00 00
E: 1.945990 8 02 20 35 4f c4 26 00 00
E: 1.952990 8 02 20 2a 4f d1 26 00 00
E: 1.959990 8 02 20 1e 4f dc 26 00 00
E: 1.966990 8 02 20 0d 4f e4 26 00 00
E: 1.973990 8 02 20 fc 4e ec 26 00 00
E: 1.979988 8 02 20 ea 4e f2 26 00 00
E: 1.987989 8 02 20 d8 4e f9 26 00 00
E: 1.993989 8 02 20 c6 4e ff 26 00 00
E: 2.000950 8 02 20 b5 4e 05 27 00 00
E: 2.007931 8 02 20 a5 4e 07 27 00 00
E: 2.014941 8 02 20 96 4e 0a 27 00 00
E: 2.021942 8 02 20 89 4e 0d 27 00 00
E: 2.028989 8 02 20 7c 4e 0f 27 00 00
E: 2.035930 8 02 20 70 4e 10 27 00 00
E: 2.041923 8 02 20 63 4e 11 27 00 00
E: 2.048937 8 02 20 55 4e 10 27 00 00
E: 2.055998 8 02 20 48 4e 0f 27 00 00
E: 2.062998 8 02 20 3a 4e 0e 27 00 00
E: 2.069928 8 02 20 2c 4e 0d 27 00 00
E: 2.076923 8 02 20 20 4e 0c 27 00 00
E: 2.083989 8 02 20 15 4e 0b 27 00 00
E: 2.090926 8 02 20 0a 4e 0c 27 00 00
E: 2.096923 8 02 20 0a 4e 0c 27 00 00
E: 2.103988 8 02 20 fb 4d 0c 27 00 00
E: 2.110925 8 02 20 fb 4d 0c 27 00 00
E: 2.117928 8 02 20 fb 4d 0c 27 00 00
E: 2.124930 8 02 20 fb 4d 0c 27 00 00
E: 2.131984 8 02 20 fb 4d 0c 27 00 00
E: 2.137930 8 02 20 fb 4d 0c 27 00 00
E: 2.145927 8 02 20 fc 4d 02 27 00 00
E: 2.151986 8 02 20 fc 4d 02 27 00 00
E: 2.158933 8 02 20 08 4e f9 26 00 00
E: 2.165987 8 02 20 08 4e f9 26 00 00
E: 2.172929 8 02 20 15 4e f4 26 00 00
E: 2.179922 8 02 20 15 4e f4 26 00 00
E: 2.186985 8 02 20 20 4e f2 26 00 00
E: 2.193924 8 02 20 20 4e f2 26 00 00
E: 2.199985 8 02 20 2a 4e ee 26 00 00
E: 2.206930 8 02 20 2a 4e ee 26 00 00
E: 2.213920 8 02 20 35 4e df 26 00 00
E: 2.220938 8 02 20 3a 4e d4 26 00 00
E: 2.227988 8 02 20 40 4e c8 26 00 00
E: 2.234987 8 02 20 45 4e b9 26 00 00
E: 2.241989 8 02 20 48 4e aa 26 00 00
E: 2.260987 8 02 20 4a 4e 96 26 00 00
E: 2.267927 8 02 20 47 4e 81 26 00 00
E: 2.274944 8 02 20 44 4e 71 26 00 00
E: 2.281941 8 02 20 3c 4e 5f 26 00 00
E: 2.287940 8 02 22 32 4e 52 26 00 00
E: 2.295988 8 02 22 22 4e 43 26 00 00
E: 2.301928 8 02 22 12 4e 37 26 00 00
E: 2.308947 8 02 22 fe 4d 2b 26 00 00
E: 2.315922 8 02 22 e9 4d 27 26 00 00
E: 2.322940 8 02 22 d3 4d 24 26 00 00
E: 2.329987 8 02 22 bc 4d 24 26 00 00
E: 2.335928 8 02 22 a2 4d 24 26 00 00
E: 2.343939 8 02 22 88 4d 25 26 00 00
E: 2.349988 8 02 22 6e 4d 27 26 00 00
E: 2.356987 8 02 22 51 4d 2a 26 00 00
E: 2.363930 8 02 22 35 4d 2d 26 00 00
E: 2.370928 8 02 22 17 4d 31 26 00 00
E: 2.377989 8 02 22 f8 4c 36 26 00 00
E: 2.384987 8 02 22 d9 4c 3b 26 00 00
E: 2.391988 8 02 22 bc 4c 43 26 00 00
E: 2.397987 8 02 22 a0 4c 4a 26 00 00
E: 2.404988 8 02 22 84 4c 52 26 00 00
E: 2.411986 8 02 22 6b 4c 5a 26 00 00
E: 2.418987 8 02 22 52 4c 62 26 00 00
E: 2.425987 8 02 22 3a 4c 6a 26 00 00
E: 2.432987 8 02 22 21 4c 72 26 00 00
E: 2.439986 8 02 22 09 4c 7a 26 00 00
E: 2.446987 8 02 22 f0 4b 83 26 00 00
E: 2.452987 8 02 22 d5 4b 8d 26 00 00
E: 2.459986 8 02 22 b7 4b 98 26 00 00
E: 2.466986 8 02 22 97 4b a5 26 00 00
E: 2.473986 8 02 22 75 4b b3 26 00 00
E: 2.480986 8 02 22 4f 4b c5 26 00 00
E: 2.487987 8 02 22 2a 4b d9 26 00 00
E: 2.494986 8 02 22 00 4b f1 26 00 00
E: 2.501986 8 02 22 d3 4a 0b 27 00 00
E: 2.507986 8 02 22 a4 4a 2a 27 00 00
E: 2.514987 8 02 22 74 4a 4a 27 00 00
E: 2.521986 8 02 22 44 4a 70 27 00 00
E: 2.528988 8 02 22 12 4a 97 27 00 00
E: 2.535986 8 02 22 e1 49 c1 27 00 00
E: 2.542986 8 02 22 ae 49 eb 27 00 00
E: 2.549986 8 02 22 7f 49 16 28 00 00
E: 2.556986 8 02 22 51 49 43 28 00 00
E: 2.563986 8 02 22 27 49 6d 28 00 00
E: 2.569986 8 02 22 00 49 97 28 00 00
E: 2.576986 8 02 22 db 48 bd 28 00 00
E: 2.583986 8 02 22 bc 48 e3 28 00 00
E: 2.590986 8 02 22 a4 48 07 29 00 00
E: 2.597986 8 02 22 8e 48 2a 29 00 00
E: 2.604988 8 02 22 7a 48 4a 29 00 00
E: 2.611986 8 02 22 6d 48 69 29 00 00
E: 2.618986 8 02 22 62 48 86 29 00 00
E: 2.625986 8 02 22 5b 48 a0 29 00 00
E: 2.631987 8 02 22 55 48 ba 29 00 00
E: 2.638987 8 02 22 53 48 d1 29 00 00
E: 2.645986 8 02 22 4e 48 e7 29 00 00
E: 2.652989 8 02 22 50 48 fb 29 00 00
E: 2.659986 8 02 22 51 48 0e 2a 00 00
E: 2.666986 8 02 22 54 48 1f 2a 00 00
E: 2.673986 8 02 22 59 48 2f 2a 00 00
E: 2.679986 8 02 22 5d 48 3e 2a 00 00
E: 2.686986 8 02 22 64 48 4d 2a 00 00
E: 2.693986 8 02 22 6b 48 5c 2a 00 00
E: 2.700981 8 02 22 75 48 6b 2a 00 00
E: 2.707985 8 02 22 7e 48 7b 2a 00 00
E: 2.714986 8 02 22 87 48 8a 2a 00 00
E: 2.721986 8 02 22 8f 48 9a 2a 00 00
E: 2.728986 8 02 22 96 48 ac 2a 00 00
E: 2.734927 8 02 22 9f 48 be 2a 00 00
E: 2.741987 8 02 22 a6 48 d2 2a 00 00
E: 2.748986 8 02 22 ac 48 e6 2a 00 00
E: 2.755986 8 02 22 b1 48 fb 2a 00 00
E: 2.762986 8 02 22 b6 48 0f 2b 00 00
E: 2.769987 8 02 22 bb 48 25 2b 00 00
E: 2.776985 8 02 22 c0 48 3a 2b 00 00
E: 2.783986 8 02 22 c4 48 4c 2b 00 00
E: 2.790985 8 02 22 c7 48 5e 2b 00 00
E: 2.796984 8 02 22 c9 48 6c 2b 00 00
E: 2.803985 8 02 22 ca 48 78 2b 00 00
E: 2.823985 8 02 22 ca 48 78 2b 00 00
E: 2.830985 8 02 22 c6 48 87 2b 00 00
E: 2.837985 8 02 22 c6 48 87 2b 00 00
E: 2.844987 8 02 22 c6 48 87 2b 00 00
E: 2.851985 8 02 20 b9 48 7e 2b 00 00
E: 2.858984 8 02 20 b6 48 75 2b 00 00
E: 2.864985 8 02 20 b2 48 68 2b 00 00
E: 2.871926 8 02 20 af 48 5a 2b 00 00
E: 2.878938 8 02 20 ae 48 4a 2b 00 00
E: 2.885982 8 02 20 ad 48 37 2b 00 00
E: 2.892985 8 02 20 ae 48 24 2b 00 00
E: 2.899984 8 02 20 ae 48 10 2b 00 00
E: 2.906985 8 02 20 b2 48 fc 2a 00 00
E: 2.912985 8 02 20 b4 48 e9 2a 00 00
E: 2.920985 8 02 20 b9 48 d5 2a 00 00
E: 2.926984 8 02 20 bd 48 c2 2a 00 00
E: 2.933940 8 02 20 c2 48 b0 2a 00 00
E: 2.940984 8 02 20 c8 48 9d 2a 00 00
E: 2.947985 8 02 20 cc 48 8a 2a 00 00
E: 2.954984 8 02 20 d1 48 77 2a 00 00
E: 2.961985 8 02 20 d3 48 63 2a 00 00
E: 2.968984 8 02 20 d5 48 4d 2a 00 00
E: 2.974984 8 02 20 d6 48 35 2a 00 00
E: 2.981985 8 02 20 d7 48 19 2a 00 00
E: 2.988984 8 02 20 d6 48 fd 29 00 00
E: 2.995984 8 02 20 d2 48 de 29 00 00
E: 3.002984 8 02 20 cf 48 bc 29 00 00
E: 3.009984 8 02 20 cc 48 9d 29 00 00
E: 3.016985 8 02 20 c8 48 7b 29 00 00
E: 3.023984 8 02 20 c2 48 59 29 00 00
E: 3.029984 8 02 20 bc 48 36 29 00 00
E: 3.036982 8 02 20 b3 48 14 29 00 00
E: 3.043984 8 02 20 aa 48 ef 28 00 00
E: 3.050981 8 02 20 a4 48 ca 28 00 00
E: 3.057984 8 02 20 9c 48 a3 28 00 00
E: 3.064984 8 02 20 94 48 79 28 00 00
E: 3.071983 8 02 20 8d 48 4e 28 00 00
E: 3.077985 8 02 20 86 48 21 28 00 00
E: 3.085984 8 02 20 81 48 f4 27 00 00
E: 3.091983 8 02 20 7d 48 c7 27 00 00
E: 3.098984 8 02 20 7b 48 9a 27 00 00
E: 3.105984 8 02 20 78 48 6e 27 00 00
E: 3.112984 8 02 20 75 48 44 27 00 00
E: 3.119983 8 02 20 72 48 1e 27 00 00
E: 3.125983 8 02 20 6f 48 f9 26 00 00
E: 3.133986 8 02 20 6d 48 d8 26 00 00
E: 3.139984 8 02 20 6b 48 b9 26 00 00
E: 3.146984 8 02 20 6a 48 9e 26 00 00
E: 3.153983 8 02 20 68 48 85 26 00 00
E: 3.160983 8 02 20 68 48 6e 26 00 00
E: 3.167983 8 02 20 69 48 5a 26 00 00
E: 3.174984 8 02 20 6a 48 47 26 00 00
E: 3.181983 8 02 20 6c 48 38 26 00 00
E: 3.187952 8 02 20 70 48 2a 26 00 00
E: 3.194984 8 02 20 74 48 1f 26 00 00
E: 3.201983 8 02 20 79 48 14 26 00 00
E: 3.208983 8 02 20 79 48 14 26 00 00
E: 3.215983 8 02 20 84 48 09 26 00 00
E: 3.222983 8 02 20 84 48 09 26 00 00
E: 3.229983 8 02 20 8e 48 0b 26 00 00
E: 3.235983 8 02 20 8e 48 0b 26 00 00
E: 3.242983 8 02 20 95 48 a7 26 00 00
E: 3.262983 8 02 20 95 48 b5 26 00 00
E: 3.268984 8 02 20 95 48 d4 26 00 00
E: 3.275984 8 02 20 94 48 e5 26 00 00
E: 3.282984 8 02 20 93 48 fa 26 00 00
E: 3.289950 8 02 30 92 48 0c 27 00 00
E: 3.296913 8 02 30 92 48 20 27 00 00
E: 3.303920 8 02 30 93 48 31 27 00 00
E: 3.310920 8 02 30 94 48 b4 26 00 00
E: 3.317921 8 02 30 96 48 bf 26 00 00
E: 3.324913 8 02 30 96 48 bf 26 00 00
E: 3.330917 8 02 30 96 48 ca 26 00 00
E: 3.337980 8 02 30 94 48 d6 26 00 00
E: 3.344947 8 02 30 91 48 e2 26 00 00
E: 3.351919 8 02 30 8b 48 f1 26 00 00
E: 3.358935 8 02 30 84 48 ff 26 00 00
E: 3.365947 8 02 30 7b 48 0c 27 00 00
E: 3.372919 8 02 30 72 48 1b 27 00 00
E: 3.379923 8 02 30 6b 48 29 27 00 00
E: 3.386932 8 02 30 60 48 38 27 00 00
E: 3.392915 8 02 30 56 48 46 27 00 00
E: 3.399906 8 02 30 4b 48 57 27 00 00
E: 3.406913 8 02 30 42 48 65 27 00 00
E: 3.413983 8 02 30 37 48 76 27 00 00
E: 3.420981 8 02 30 30 48 88 27 00 00
E: 3.427982 8 02 30 26 48 9c 27 00 00
E: 3.434980 8 02 30 1e 48 b2 27 00 00
E: 3.441983 8 02 30 17 48 c7 27 00 00
E: 3.447982 8 02 30 13 48 dd 27 00 00
E: 3.454914 8 02 30 11 48 f5 27 00 00
E: 3.461983 8 02 30 11 48 0e 28 00 00
E: 3.468982 8 02 30 16 48 28 28 00 00
E: 3.475982 8 02 30 1f 48 42 28 00 00
E: 3.482982 8 02 30 2d 48 5d 28 00 00
E: 3.489913 8 02 30 3d 48 78 28 00 00
E: 3.496979 8 02 30 54 48 93 28 00 00
E: 3.503984 8 02 30 6f 48 ad 28 00 00
E: 3.509983 8 02 30 8f 48 c5 28 00 00
E: 3.516986 8 02 30 b2 48 db 28 00 00
E: 3.523914 8 02 30 d9 48 ec 28 00 00
E: 3.530927 8 02 30 ff 48 fb 28 00 00
E: 3.537922 8 02 30 27 49 06 29 00 00
E: 3.544982 8 02 30 50 49 0d 29 00 00
E: 3.551981 8 02 30 76 49 0f 29 00 00
E: 3.558981 8 02 30 9c 49 0d 29 00 00
E: 3.565982 8 02 30 bc 49 07 29 00 00
E: 3.571983 8 02 30 db 49 fb 28 00 00
E: 3.578982 8 02 30 f5 49 ec 28 00 00
E: 3.585981 8 02 30 0b 4a d8 28 00 00
E: 3.592982 8 02 30 1d 4a c0 28 00 00
E: 3.599981 8 02 30 2c 4a a5 28 00 00
E: 3.606981 8 02 30 35 4a 88 28 00 00
E: 3.613982 8 02 30 3b 4a 67 28 00 00
E: 3.620981 8 02 30 3a 4a 44 28 00 00
E: 3.627981 8 02 30 35 4a 1f 28 00 00
E: 3.633953 8 02 30 2b 4a f9 27 00 00
E: 3.640981 8 02 30 1a 4a d3 27 00 00
E: 3.647981 8 02 30 08 4a ab 27 00 00
E: 3.654981 8 02 30 e9 49 84 27 00 00
E: 3.661983 8 02 30 c7 49 5b 27 00 00
E: 3.668981 8 02 30 9f 49 34 27 00 00
E: 3.675981 8 02 30 73 49 0b 27 00 00
E: 3.681982 8 02 30 41 49 e4 26 00 00
E: 3.689980 8 02 30 0c 49 ba 26 00 00
E: 3.695981 8 02 30 d6 48 91 26 00 00
E: 3.702980 8 02 30 98 48 68 26 00 00
E: 3.709980 8 02 30 5b 48 3f 26 00 00
E: 3.716981 8 02 30 1a 48 17 26 00 00
E: 3.723981 8 02 30 d4 47 ee 25 00 00
E: 3.730913 8 02 30 8a 47 c5 25 00 00
E: 3.737909 8 02 30 3c 47 9e 25 00 00
E: 3.743982 8 02 30 ec 46 79 25 00 00
E: 3.751979 8 02 30 99 46 55 25 00 00
E: 3.757913 8 02 30 45 46 32 25 00 00
E: 3.764981 8 02 30 ee 45 12 25 00 00
E: 3.771912 8 02 30 94 45 f4 24 00 00
E: 3.778981 8 02 30 39 45 d9 24 00 00
E: 3.785981 8 02 30 df 44 c5 24 00 00
E: 3.791913 8 02 30 84 44 b2 24 00 00
E: 3.799982 8 02 30 29 44 a4 24 00 00
E: 3.805980 8 02 30 cc 43 9d 24 00 00
E: 3.813909 8 02 30 70 43 9c 24 00 00
E: 3.819907 8 02 30 0f 43 a3 24 00 00
E: 3.826981 8 02 30 b4 42 b0 24 00 00
E: 3.833939 8 02 30 5d 42 c2 24 00 00
E: 3.840980 8 02 30 0b 42 d7 24 00 00
E: 3.847980 8 02 30 bc 41 f2 24 00 00
E: 3.853910 8 02 30 71 41 0f 25 00 00
E: 3.861904 8 02 30 2b 41 2f 25 00 00
E: 3.867980 8 02 30 ee 40 50 25 00 00
E: 3.875980 8 02 30 be 40 6e 25 00 00
E: 3.881913 8 02 30 92 40 8c 25 00 00
E: 3.888908 8 02 30 6e 40 a9 25 00 00
E: 3.895909 8 02 30 4e 40 c6 25 00 00
E: 3.902906 8 02 30 38 40 e1 25 00 00
E: 3.909907 8 02 30 2a 40 fa 25 00 00
E: 3.915981 8 02 30 23 40 10 26 00 00
E: 3.923981 8 02 30 20 40 22 26 00 00
E: 3.929914 8 02 30 22 40 32 26 00 00
E: 3.936908 8 02 30 27 40 3f 26 00 00
E: 3.943909 8 02 30 2f 40 48 26 00 00
E: 3.950905 8 02 30 38 40 4e 26 00 00
E: 3.957902 8 02 30 44 40 83 26 00 00
E: 3.971905 8 02 30 50 40 84 26 00 00
E: 3.977907 8 02 30 5b 40 80 26 00 00
E: 3.985904 8 02 30 66 40 80 26 00 00
E: 3.991905 8 02 30 71 40 7b 26 00 00
E: 3.998906 8 02 20 7d 40 7b 26 00 00
E: 4.005908 8 02 20 8b 40 78 26 00 00
E: 4.012904 8 02 20 9c 40 7b 26 00 00
E: 4.019905 8 02 20 a9 40 44 26 00 00
E: 4.025933 8 02 20 b4 40 44 26 11 00
E: 4.033916 8 02 20 c2 40 45 26 5c 00
E: 4.039910 8 02 20 cc 40 42 26 aa 00
E: 4.046931 8 02 20 d7 40 3f 26 f9 00
E: 4.053932 8 02 20 d7 40 3f 26 4c 01
E: 4.060980 8 02 21 e2 40 33 26 9f 01
E: 4.067919 8 02 21 e1 40 27 26 f2 01
E: 4.074933 8 02 21 e1 40 27 26 ff 01
E: 4.081932 8 02 21 e3 40 1b 26 ff 01
E: 4.087980 8 02 21 e3 40 1b 26 ff 01
E: 4.094979 8 02 21 e2 40 11 26 ff 01
E: 4.101979 8 02 21 e2 40 11 26 ff 01
E: 4.108979 8 02 21 e2 40 11 26 fe 01
E: 4.115978 8 02 21 e2 40 11 26 e0 01
E: 4.122978 8 02 21 e2 40 11 26 a3 01
E: 4.129979 8 02 21 d9 40 1b 26 50 01
E: 4.136978 8 02 21 de 40 27 26 fe 00
E: 4.142980 8 02 21 de 40 27 26 ad 00
E: 4.149978 8 02 21 e3 40 3b 26 5c 00
E: 4.156979 8 02 21 e3 40 3b 26 10 00
E: 4.163979 8 02 21 ef 40 4f 26 00 00
E: 4.170978 8 02 21 ef 40 4f 26 00 00
E: 4.177979 8 02 21 ef 40 4f 26 00 00
E: 4.184979 8 02 20 00 41 54 26 00 00
E: 4.191979 8 02 20 00 41 54 26 00 00
E: 4.197979 8 02 20 00 41 54 26 00 00
E: 4.204979 8 02 20 07 41 4a 26 00 00
E: 4.211979 8 02 20 07 41 4a 26 00 00
E: 4.218979 8 02 20 07 41 4a 26 00 00
E: 4.225978 8 02 20 07 41 4a 26 00 00
E: 4.232978 8 02 20 13 41 4e 26 00 00
E: 4.239978 8 02 20 13 41 4e 26 00 00
E: 4.245979 8 02 20 1e 41 5f 26 00 00
E: 4.253978 8 02 20 25 41 6c 26 00 00
E: 4.259977 8 02 20 2d 41 7b 26 00 00
E: 4.266979 8 02 20 37 41 8b 26 00 00
E: 4.273978 8 02 20 41 41 9e 26 00 00
E: 4.280978 8 02 20 4d 41 b2 26 00 00
E: 4.287978 8 02 20 5c 41 c6 26 00 00
E: 4.294978 8 02 20 6f 41 d9 26 00 00
E: 4.301977 8 02 20 88 41 eb 26 00 00
E: 4.307977 8 02 20 a4 41 f9 26 00 00
E: 4.314978 8 02 20 c7 41 05 27 00 00
E: 4.321978 8 02 20 ee 41 09 27 00 00
E: 4.328978 8 02 20 15 42 10 27 00 00
E: 4.335977 8 02 20 41 42 0c 27 00 00
E: 4.342978 8 02 20 6b 42 0d 27 00 00
E: 4.349978 8 02 20 96 42 04 27 00 00
E: 4.356977 8 02 20 c3 42 fb 26 00 00
E: 4.362979 8 02 20 ed 42 eb 26 00 00
E: 4.369978 8 02 20 16 43 dc 26 00 00
E: 4.376979 8 02 20 3e 43 c9 26 00 00
E: 4.383915 8 02 20 69 43 ab 26 00 00
E: 4.390979 8 02 20 92 43 8a 26 00 00
E: 4.397978 8 02 20 bd 43 5f 26 00 00
E: 4.404977 8 02 20 e9 43 2e 26 00 00
E: 4.411977 8 02 20 16 44 f7 25 00 00
E: 4.418977 8 02 20 44 44 bb 25 00 00
E: 4.424978 8 02 20 6f 44 77 25 00 00
E: 4.431978 8 02 20 8c 44 2c 25 00 00
E: 4.438978 8 02 20 a7 44 e0 24 00 00
E: 4.445978 8 02 20 b5 44 94 24 00 00
E: 4.452977 8 02 20 b0 44 4b 24 00 00
E: 4.459978 8 02 20 99 44 09 24 00 00
E: 4.466977 8 02 20 6d 44 c6 23 00 00
E: 4.472977 8 02 20 30 44 8c 23 00 00
E: 4.480978 8 02 20 e2 43 59 23 00 00
E: 4.486977 8 02 20 92 43 2e 23 00 00
E: 4.493978 8 02 20 30 43 04 23 00 00
E: 4.500976 8 02 20 cd 42 dd 22 00 00
E: 4.507978 8 02 20 6c 42 b5 22 00 00
E: 4.514977 8 02 20 09 42 8c 22 00 00
E: 4.520977 8 02 20 af 41 66 22 00 00
E: 4.528977 8 02 20 56 41 3e 22 00 00
E: 4.534935 8 02 20 00 41 11 22 00 00
E: 4.541976 8 02 20 aa 40 e6 21 00 00
E: 4.548978 8 02 20 58 40 bc 21 00 00
E: 4.555977 8 02 20 04 40 91 21 00 00
E: 4.562976 8 02 20 b0 3f 64 21 00 00
E: 4.569977 8 02 20 5f 3f 37 21 00 00
E: 4.576976 8 02 20 0a 3f 04 21 00 00
E: 4.582978 8 02 20 b8 3e d0 20 00 00
E: 4.589977 8 02 20 6d 3e 97 20 00 00
E: 4.596977 8 02 20 23 3e 5b 20 00 00
E: 4.603916 8 02 20 db 3d 1b 20 00 00
E: 4.610931 8 02 20 98 3d d9 1f 00 00
E: 4.617914 8 02 20 59 3d 97 1f 00 00
E: 4.624977 8 02 20 1f 3d 54 1f 00 00
E: 4.631976 8 02 20 e6 3c 0e 1f 00 00
E: 4.637976 8 02 20 b0 3c c9 1e 00 00
E: 4.644976 8 02 20 78 3c 82 1e 00 00
E: 4.651976 8 02 20 42 3c 41 1e 00 00
E: 4.658976 8 02 20 12 3c fc 1d 00 00
E: 4.665976 8 02 20 e5 3b ba 1d 00 00
E: 4.672976 8 02 20 ba 3b 76 1d 00 00
E: 4.679976 8 02 20 90 3b 34 1d 00 00
E: 4.686975 8 02 20 69 3b ef 1c 00 00
E: 4.692976 8 02 20 43 3b a6 1c 00 00
E: 4.699915 8 02 20 20 3b 58 1c 00 00
E: 4.706977 8 02 20 fa 3a 01 1c 00 00
E: 4.713977 8 02 20 d1 3a a2 1b 00 00
E: 4.720976 8 02 20 a1 3a 37 1b 00 00
E: 4.727976 8 02 20 6d 3a c3 1a 00 00
E: 4.734975 8 02 20 2c 3a 40 1a 00 00
E: 4.741976 8 02 20 e6 39 b8 19 00 00
E: 4.748976 8 02 20 8c 39 24 19 00 00
E: 4.754976 8 02 20 2a 39 8c 18 00 00
E: 4.761975 8 02 20 be 38 ef 17 00 00
E: 4.768976 8 02 20 4c 38 4f 17 00 00
E: 4.775975 8 02 20 cf 37 af 16 00 00
E: 4.782976 8 02 20 4b 37 0b 16 00 00
E: 4.789976 8 02 20 c1 36 67 15 00 00
E: 4.796976 8 02 20 29 36 c3 14 00 00
E: 4.803976 8 02 20 90 35 1f 14 00 00
E: 4.810977 8 02 20 ec 34 7e 13 00 00
E: 4.816976 8 02 20 39 34 dd 12 00 00
E: 4.823976 8 02 20 76 33 44 12 00 00
E: 4.830975 8 02 20 a2 32 b3 11 00 00
E: 4.837975 8 02 20 bb 31 31 11 00 00
E: 4.844975 8 02 20 c1 30 bd 10 00 00
E: 4.851975 8 02 20 b1 2f 5e 10 00 00
E: 4.858975 8 02 20 8e 2e 15 10 00 00
E: 4.865974 8 02 20 51 2d e4 0f 00 00
E: 4.872975 8 02 20 07 2c cf 0f 00 00
E: 4.878975 8 02 20 a7 2a d9 0f 00 00
E: 4.885974 8 02 20 47 29 01 10 00 00
E: 4.892973 8 02 20 dd 27 45 10 00 00
E: 4.899976 8 02 20 7c 26 aa 10 00 00
E: 4.906975 8 02 20 23 25 2b 11 00 00
E: 4.913974 8 02 20 db 23 c9 11 00 00
E: 4.920974 8 02 20 ad 22 7f 12 00 00
E: 4.927976 8 02 20 97 21 4f 13 00 00
E: 4.934974 8 02 20 a5 20 35 14 00 00
E: 4.940974 8 02 20 c9 1f 33 15 00 00
E: 4.947975 8 02 20 17 1f 41 16 00 00
E: 4.954975 8 02 20 7f 1e 8c 17 00 00
E: 4.961975 8 02 20 06 1e c4 18 00 00
E: 4.968975 8 02 20 ab 1d 0f 1a 00 00
E: 4.975974 8 02 20 73 1d 6c 1b 00 00
E: 4.982974 8 02 20 58 1d d4 1c 00 00
E: 4.988974 8 02 20 60 1d 69 1e 00 00
E: 4.995974 8 02 20 8c 1d dd 1f 00 00
E: 5.002975 8 02 20 dc 1d 52 21 00 00
E: 5.009975 8 02 20 51 1e 99 22 00 00
E: 5.016974 8 02 20 e8 1e 1e 24 00 00
E: 5.023974 8 02 20 aa 1f 76 25 00 00
E: 5.030974 8 02 20 84 20 be 26 00 00
E: 5.037974 8 02 20 88 21 f9 27 00 00
E: 5.043974 8 02 20 a8 22 01 29 00 00
E: 5.050973 8 02 20 ea 23 17 2a 00 00
E: 5.057974 8 02 20 3c 25 1c 2b 00 00
E: 5.064974 8 02 20 ab 26 0f 2c 00 00
E: 5.071974 8 02 20 31 28 c6 2c 00 00
E: 5.078974 8 02 20 c3 29 87 2d 00 00
E: 5.085974 8 02 20 67 2b 2a 2e 00 00
E: 5.091974 8 02 20 3a 2d ab 2e 00 00
E: 5.099973 8 02 20 f7 2e 0c 2f 00 00
E: 5.105974 8 02 20 b9 30 4d 2f 00 00
E: 5.112974 8 02 20 88 32 6f 2f 00 00
E: 5.119974 8 02 20 7b 34 6e 2f 00 00
E: 5.126974 8 02 20 4e 36 53 2f 00 00
E: 5.133972 8 02 20 1f 38 1e 2f 00 00
E: 5.139974 8 02 20 12 3a d2 2e 00 00
E: 5.146973 8 02 20 bf 3b 76 2e 00 00
E: 5.153974 8 02 20 84 3d 05 2e 00 00
E: 5.160974 8 02 20 60 3f 87 2d 00 00
E: 5.167974 8 02 20 15 41 f7 2c 00 00
E: 5.174974 8 02 20 9a 42 5b 2c 00 00
E: 5.181973 8 02 20 32 44 ad 2b 00 00
E: 5.188973 8 02 20 bc 45 ef 2a 00 00
E: 5.195974 8 02 20 17 47 25 2a 00 00
E: 5.201973 8 02 20 76 48 4a 29 00 00
E: 5.208915 8 02 20 c5 49 68 28 00 00
E: 5.215927 8 02 20 d9 4a 72 27 00 00
E: 5.222970 8 02 20 f8 4b 7a 26 00 00
E: 5.229978 8 02 20 f8 4c 78 25 00 00
E: 5.236975 8 02 20 e1 4d 73 24 00 00
E: 5.243973 8 02 20 ad 4e 69 23 00 00
E: 5.249973 8 02 20 5b 4f 5b 22 00 00
E: 5.256973 8 02 20 ef 4f 4e 21 00 00
E: 5.263974 8 02 20 64 50 40 20 00 00
E: 5.270973 8 02 20 bb 50 35 1f 00 00
E: 5.277973 8 02 20 eb 50 2a 1e 00 00
E: 5.284973 8 02 20 f1 50 20 1d 00 00
E: 5.291973 8 02 20 d7 50 1d 1c 00 00
E: 5.298972 8 02 20 92 50 1c 1b 00 00
E: 5.305974 8 02 20 2e 50 28 1a 00 00
E: 5.311973 8 02 20 9f 4f 3b 19 00 00
E: 5.318973 8 02 20 f1 4e 5a 18 00 00
E: 5.325971 8 02 20 20 4e 8a 17 00 00
E: 5.332973 8 02 20 37 4d ca 16 00 00
E: 5.339973 8 02 20 3b 4c 1a 16 00 00
E: 5.346973 8 02 20 27 4b 7b 15 00 00
E: 5.353973 8 02 20 04 4a f2 14 00 00
E: 5.360973 8 02 20 c9 48 7b 14 00 00
E: 5.367973 8 02 20 83 47 18 14 00 00
E: 5.373912 8 02 20 29 46 c7 13 00 00
E: 5.380973 8 02 20 ca 44 88 13 00 00
E: 5.387973 8 02 20 58 43 5d 13 00 00
E: 5.394973 8 02 20 df 41 48 13 00 00
E: 5.401935 8 02 20 63 40 48 13 00 00
E: 5.408972 8 02 20 e1 3e 5c 13 00 00
E: 5.415972 8 02 20 63 3d 86 13 00 00
E: 5.422972 8 02 20 e6 3b c5 13 00 00
E: 5.429972 8 02 20 6f 3a 1c 14 00 00
E: 5.436973 8 02 20 00 39 89 14 00 00
E: 5.442972 8 02 20 9d 37 0b 15 00 00
E: 5.449973 8 02 20 40 36 a6 15 00 00
E: 5.456974 8 02 20 ed 34 55 16 00 00
E: 5.463973 8 02 20 a4 33 18 17 00 00
E: 5.470972 8 02 20 60 32 ea 17 00 00
E: 5.477973 8 02 20 33 31 c9 18 00 00
E: 5.484912 8 02 20 16 30 af 19 00 00
E: 5.491973 8 02 20 0d 2f a2 1a 00 00
E: 5.497972 8 02 20 15 2e 97 1b 00 00
E: 5.504972 8 02 20 37 2d 90 1c 00 00
E: 5.511971 8 02 20 72 2c 89 1d 00 00
E: 5.518972 8 02 20 ca 2b 88 1e 00 00
E: 5.525971 8 02 20 48 2b 8d 1f 00 00
E: 5.532972 8 02 20 de 2a 95 20 00 00
E: 5.539972 8 02 20 90 2a a0 21 00 00
E: 5.546972 8 02 20 54 2a ad 22 00 00
E: 5.553972 8 02 20 34 2a c0 23 00 00
E: 5.559972 8 02 20 29 2a d1 24 00 00
E: 5.566972 8 02 20 34 2a df 25 00 00
E: 5.573971 8 02 20 57 2a e8 26 00 00
E: 5.580972 8 02 20 8e 2a e4 27 00 00
E: 5.587972 8 02 20 d9 2a d8 28 00 00
E: 5.594972 8 02 20 40 2b c4 29 00 00
E: 5.601972 8 02 20 bf 2b 9d 2a 00 00
E: 5.607971 8 02 20 5b 2c 6b 2b 00 00
E: 5.615971 8 02 20 0c 2d 2c 2c 00 00
E: 5.621972 8 02 20 d6 2d e3 2c 00 00
E: 5.628971 8 02 20 b3 2e 8c 2d 00 00
E: 5.635969 8 02 20 a0 2f 2b 2e 00 00
E: 5.642971 8 02 20 9f 30 bd 2e 00 00
E: 5.649971 8 02 20 a7 31 42 2f 00 00
E: 5.656972 8 02 20 c3 32 c0 2f 00 00
E: 5.663972 8 02 20 e8 33 2e 30 00 00
E: 5.669973 8 02 20 1d 35 8d 30 00 00
E: 5.676975 8 02 20 59 36 df 30 00 00
E: 5.683972 8 02 20 a1 37 21 31 00 00
E: 5.690972 8 02 20 f0 38 55 31 00 00
E: 5.697971 8 02 20 47 3a 7c 31 00 00
E: 5.704971 8 02 20 a5 3b 95 31 00 00
E: 5.711971 8 02 20 07 3d 9d 31 00 00
E: 5.718970 8 02 20 71 3e 97 31 00 00
E: 5.725971 8 02 20 da 3f 83 31 00 00
E: 5.731970 8 02 20 4f 41 65 31 00 00
E: 5.739971 8 02 20 c5 42 37 31 00 00
E: 5.745971 8 02 20 42 44 ff 30 00 00
E: 5.752970 8 02 20 bc 45 b9 30 00 00
E: 5.759970 8 02 20 5c 47 67 30 00 00
E: 5.766972 8 02 20 d2 48 07 30 00 00
E: 5.773971 8 02 20 44 4a 9f 2f 00 00
E: 5.780971 8 02 20 b2 4b 2f 2f 00 00
E: 5.786971 8 02 20 11 4d b3 2e 00 00
E: 5.793970 8 02 20 6a 4e 31 2e 00 00
E: 5.800970 8 02 20 b7 4f a1 2d 00 00
E: 5.807912 8 02 20 fe 50 0d 2d 00 00
E: 5.814925 8 02 20 13 52 74 2c 00 00
E: 5.821971 8 02 20 3e 53 d8 2b 00 00
E: 5.828970 8 02 20 57 54 35 2b 00 00
E: 5.834970 8 02 20 5c 55 90 2a 00 00
E: 5.842970 8 02 20 52 56 eb 29 00 00
E: 5.848971 8 02 20 30 57 44 29 00 00
E: 5.855970 8 02 20 fb 57 a5 28 00 00
E: 5.862971 8 02 20 a7 58 06 28 00 00
E: 5.869970 8 02 20 39 59 6e 27 00 00
E: 5.876972 8 02 20 ad 59 db 26 00 00
E: 5.882971 8 02 20 08 5a 4f 26 00 00
E: 5.890971 8 02 20 47 5a c6 25 00 00
E: 5.896970 8 02 20 6b 5a 41 25 00 00
E: 5.903969 8 02 20 74 5a c0 24 00 00
E: 5.910970 8 02 20 61 5a 3f 24 00 00
E: 5.917970 8 02 20 3a 5a c4 23 00 00
E: 5.924969 8 02 20 fc 59 49 23 00 00
E: 5.931969 8 02 20 ab 59 d5 22 00 00
E: 5.938970 8 02 20 47 59 66 22 00 00
E: 5.944969 8 02 20 ce 58 03 22 00 00
E: 5.952969 8 02 20 44 58 aa 21 00 00
E: 5.958969 8 02 20 a7 57 5c 21 00 00
E: 5.965969 8 02 20 fa 56 1b 21 00 00
E: 5.972970 8 02 20 3f 56 e5 20 00 00
E: 5.979970 8 02 20 77 55 bc 20 00 00
E: 5.986910 8 02 20 a9 54 9f 20 00 00
E: 5.993970 8 02 20 d0 53 90 20 00 00
E: 6.000971 8 02 20 f5 52 8f 20 00 00
E: 6.006970 8 02 20 1a 52 9a 20 00 00
E: 6.013970 8 02 20 40 51 b2 20 00 00
E: 6.020968 8 02 20 6c 50 d9 20 00 00
E: 6.027971 8 02 20 9d 4f 0e 21 00 00
E: 6.034970 8 02 20 dd 4e 50 21 00 00
E: 6.041970 8 02 20 21 4e a1 21 00 00
E: 6.048970 8 02 20 71 4d 00 22 00 00
E: 6.054969 8 02 20 cc 4c 6f 22 00 00
E: 6.061968 8 02 20 35 4c f1 22 00 00
E: 6.068969 8 02 20 a6 4b 83 23 00 00
E: 6.075969 8 02 20 22 4b 22 24 00 00
E: 6.082970 8 02 20 af 4a d5 24 00 00
E: 6.089972 8 02 20 4a 4a 93 25 00 00
E: 6.096971 8 02 20 ff 49 5f 26 00 00
E: 6.102971 8 02 20 cd 49 35 27 00 00
E: 6.110971 8 02 20 b1 49 12 28 00 00
E: 6.116969 8 02 20 ad 49 ef 28 00 00
E: 6.123969 8 02 20 cd 49 cf 29 00 00
E: 6.130968 8 02 20 0c 4a b0 2a 00 00
E: 6.137969 8 02 20 6e 4a 87 2b 00 00
E: 6.144969 8 02 20 f2 4a 5e 2c 00 00
E: 6.151969 8 02 20 97 4b 25 2d 00 00
E: 6.158969 8 02 20 58 4c dd 2d 00 00
E: 6.164970 8 02 20 68 4d 85 2e 00 00
E: 6.171969 8 02 20 67 4e 1d 2f 00 00
E: 6.178967 8 02 20 a6 4f 9f 2f 00 00
E: 6.185968 8 02 20 d2 50 0d 30 00 00
E: 6.192969 8 02 20 0e 52 66 30 00 00
E: 6.199969 8 02 20 53 53 a8 30 00 00
E: 6.206968 8 02 20 a0 54 da 30 00 00
E: 6.213968 8 02 20 f4 55 fc 30 00 00
E: 6.219969 8 02 20 21 57 0e 31 00 00
E: 6.226969 8 02 20 7e 58 13 31 00 00
E: 6.233964 8 02 20 b7 59 0b 31 00 00
E: 6.240968 8 02 20 42 5b f8 30 00 00
E: 6.247968 8 02 20 aa 5c da 30 00 00
E: 6.254968 8 02 20 15 5e ae 30 00 00
E: 6.261968 8 02 20 82 5f 72 30 00 00
E: 6.268968 8 02 20 ee 60 28 30 00 00
E: 6.275968 8 02 20 5b 62 c9 2f 00 00
E: 6.281968 8 02 20 c3 63 5a 2f 00 00
E: 6.288968 8 02 20 27 65 dc 2e 00 00
E: 6.295969 8 02 20 55 66 4c 2e 00 00
E: 6.302969 8 02 20 9d 67 ae 2d 00 00
E: 6.309968 8 02 20 d8 68 05 2d 00 00
E: 6.316960 8 02 20 01 6a 50 2c 00 00
E: 6.323970 8 02 20 1f 6b 95 2b 00 00
E: 6.329968 8 02 20 26 6c d3 2a 00 00
E: 6.337967 8 02 20 20 6d 0e 2a 00 00
E: 6.343967 8 02 20 04 6e 40 29 00 00
E: 6.350968 8 02 20 e4 6e 70 28 00 00
E: 6.357968 8 02 20 b9 6f 97 27 00 00
E: 6.364968 8 02 20 89 70 ba 26 00 00
E: 6.371910 8 02 20 50 71 d7 25 00 00
E: 6.377969 8 02 20 10 72 ee 24 00 00
E: 6.385969 8 02 20 d1 72 03 24 00 00
E: 6.391968 8 02 20 88 73 15 23 00 00
E: 6.398968 8 02 20 3e 74 2a 22 00 00
E: 6.405967 8 02 20 e3 74 3f 21 00 00
E: 6.412922 8 02 20 7d 75 5b 20 00 00
E: 6.419968 8 02 20 06 76 7a 1f 00 00
E: 6.426968 8 02 20 7d 76 99 1e 00 00
E: 6.433901 8 02 20 e1 76 bf 1d 00 00
E: 6.439969 8 02 20 1b 77 da 1c 00 00
E: 6.447968 8 02 20 48 77 f6 1b 00 00
E: 6.453967 8 02 20 50 77 fa 1a 00 00
E: 6.460968 8 02 20 41 77 03 1a 00 00
E: 6.467967 8 02 20 0f 77 f9 18 00 00
E: 6.474967 8 02 20 bf 76 f5 17 00 00
E: 6.481967 8 02 20 53 76 ec 16 00 00
E: 6.488967 8 02 20 c7 75 ec 15 00 00
E: 6.495967 8 02 20 2a 75 f7 14 00 00
E: 6.501968 8 02 20 6d 74 18 14 00 00
E: 6.509967 8 02 20 93 73 57 13 00 00
E: 6.515968 8 02 20 a6 72 ae 12 00 00
E: 6.522970 8 02 00 a6 72 ae 12 00 00
