# 039:0 -> 056A:00C6 / Tablet | DTZ-1200W
D:0
R: 170 05 01 09 02 a1 01 85 01 09 01 a1 00 05 09 19 01 29 03 15 00 25 01 95 03 75 01 81 02 95 05 81 03 05 01 09 30 09 31 09 38 15 81 25 7f 75 08 95 03 81 06 c0 c0 05 0d 09 01 a1 01 85 02 09 00 75 08 95 09 15 00 26 ff 00 81 02 09 3a 25 02 95 01 b1 02 85 03 09 00 26 ff 00 b1 02 85 04 09 3a 25 01 b1 02 85 05 09 00 26 ff 00 95 08 b1 02 85 06 09 00 b1 02 85 07 09 00 95 04 b1 02 85 08 09 00 b1 02 85 09 09 00 95 01 b1 02 85 0a 09 00 95 02 b1 02 85 0b 09 00 95 01 b1 02 85 0c 09 00 95 09 81 02 85 0d 09 00 95 01 b1 02 c0
N: Tablet DTZ-1200W
P: usb-0000:00:14.0-6.0/input0
I: 3 056A 00C6
# SET_REPORT (Feature) ID: 02 -> 02 02 (length 2)
# SET_REPORT (Feature) ID: 02 -> 02 02 (length 2)
E: 0.000000 10 0c 00 80 00 00 00 00 00 00 00
E: 5.235976 10 0c 01 00 00 00 00 00 00 00 00
E: 5.339973 10 0c 00 00 00 00 00 00 00 00 00
E: 14.211932 10 02 c2 82 30 89 06 42 70 00 00
E: 14.219932 10 02 e0 2c fb 21 30 00 2b 50 80
E: 14.227867 10 02 e0 2c ce 21 3e 00 29 4e 73
E: 14.235866 10 02 e0 2c a5 21 43 00 2b 4e 66
E: 14.243943 10 02 e0 2c 8e 21 41 00 2b cf 5e
E: 14.247947 10 02 e0 2c 87 21 3d 00 2c 4e 5a
E: 14.255943 10 02 e0 2c 86 21 39 00 2c ce 59
E: 14.263942 10 02 e0 2c 83 21 28 00 2c 4e 5a
E: 14.267943 10 02 e0 2c 6c 21 16 00 2c cd 50
E: 14.275942 10 02 e0 2c 4e 21 13 00 2c cb 51
E: 14.283942 10 02 e0 2c 27 21 10 00 2d 4a 56
E: 14.287947 10 02 e0 2b fa 21 0e 00 2d ca 5c
E: 14.295942 10 02 e0 2b c8 21 11 00 2f 4a 62
E: 14.303941 10 02 e0 2b 96 21 18 00 2e ca 6b
E: 14.307946 10 02 e0 2b 62 21 1e 00 2f cb 72
E: 14.315944 10 02 e0 2b 34 21 16 00 2f cb 73
E: 14.323941 10 02 e0 2b 0d 21 0f 00 31 cc 74
E: 14.327942 10 02 e0 2a e9 21 0d 00 32 cc 7a
E: 14.335942 10 02 e0 2a c7 21 1f 00 34 4d 7a
E: 14.339947 10 02 e0 2a a9 21 35 00 34 4e 7a
E: 14.347942 10 02 e0 2a 98 21 58 00 33 cd 73
E: 14.355943 10 02 e0 2a 7d 21 89 00 34 4c 73
E: 14.359947 10 02 e0 2a 5e 21 cd 00 34 4d 6f
E: 14.367941 10 02 e0 2a 40 22 21 00 34 cb 6d
E: 14.375943 10 02 e0 2a 20 22 7e 00 34 c8 6a
E: 14.383942 10 02 e0 29 f9 22 cd 00 35 c9 6e
E: 14.391911 10 02 e0 29 d3 23 16 00 36 d7 5c
E: 14.395948 10 02 e0 29 b1 23 6c 00 36 d7 59
E: 14.403942 10 02 e0 29 9b 23 c1 00 2c d5 59
E: 14.411941 10 02 e0 29 8a 24 0e 00 2d 53 56
E: 14.419943 10 02 e0 29 89 24 5e 00 2c d1 53
E: 14.427943 10 02 e0 29 9a 24 b5 00 2c 50 53
E: 14.435943 10 02 e0 29 bc 25 0e 00 2c ce 53
E: 14.439949 10 02 e0 29 ec 25 67 00 2c 4e 50
E: 14.447942 10 02 e0 2a 24 25 b2 00 34 4c 4c
E: 14.455942 10 02 e0 2a 55 25 f9 00 33 cb 4c
E: 14.463941 10 02 e0 2a 8d 26 3f 00 32 cc 4a
E: 14.471940 10 02 e0 2a b7 26 7e 00 32 cc 4d
E: 14.475946 10 02 e0 2a e8 26 aa 00 32 cf 49
E: 14.483941 10 02 e0 2b 1c 26 d8 00 32 ce 47
E: 14.491941 10 02 e0 2b 54 27 0c 00 32 4d 45
E: 14.499941 10 02 e0 2b 91 27 3f 00 32 4d 41
E: 14.507942 10 02 e0 2b d1 27 72 00 31 cd 42
E: 14.515942 10 02 e0 2c 1b 27 9b 00 31 4e 42
E: 14.519941 10 02 e0 2c 69 27 b9 00 31 4e 47
E: 14.527942 10 02 e0 2c ce 27 c8 00 30 cd 40
E: 14.535941 10 02 e0 2d 38 27 cb 00 30 cd 44
E: 14.543942 10 02 e0 2d a6 27 c8 00 2f 4d 45
E: 14.547946 10 02 e0 2e 0c 27 ce 00 2f 4d 45
E: 14.555940 10 02 e0 2e 63 27 c4 00 34 cf 47
E: 14.563941 10 02 e0 2e c2 27 af 00 34 50 45
E: 14.571941 10 02 e0 2f 20 27 9b 00 34 4e 46
E: 14.579941 10 02 e0 2f 7b 27 7b 00 34 4f 49
E: 14.587940 10 02 e0 2f d2 27 6a 00 34 50 49
E: 14.595940 10 02 e0 30 2f 27 59 00 33 4f 4e
E: 14.599945 10 02 e0 30 89 27 47 00 32 d0 53
E: 14.607941 10 02 e0 30 e6 27 33 00 32 d2 53
E: 14.615939 10 02 e0 31 42 27 10 00 32 d2 51
E: 14.623940 10 02 e0 31 9d 26 f5 00 32 51 54
E: 14.631942 10 02 e0 31 e7 26 d5 00 36 d0 57
E: 14.635944 10 02 e0 32 38 26 b9 00 35 d1 5e
E: 14.643940 10 02 e0 32 89 26 9b 00 35 52 5d
E: 14.651941 10 02 e0 32 d9 26 80 00 35 d2 66
E: 14.659940 10 02 e0 33 25 26 68 00 35 d1 61
E: 14.667940 10 02 e0 33 75 26 4f 00 35 55 67
E: 14.671945 10 02 e0 33 bc 26 40 00 35 55 69
E: 14.679939 10 02 e0 34 04 26 34 00 34 51 6e
E: 14.687940 10 02 e0 34 4c 26 19 00 34 52 68
E: 14.695940 10 02 e0 34 8e 26 0a 00 34 52 66
E: 14.703939 10 02 e0 34 d4 25 f5 00 33 d1 63
E: 14.711942 10 02 e0 35 15 25 e8 00 33 52 60
E: 14.715945 10 02 e0 35 53 25 e2 00 33 52 64
E: 14.723940 10 02 e0 35 85 25 e3 00 38 d0 63
E: 14.731940 10 02 e0 35 ba 25 e9 00 37 d0 63
E: 14.739939 10 02 e0 35 e8 25 ef 00 37 d1 67
E: 14.747939 10 02 e0 36 11 25 f6 00 37 50 60
E: 14.751944 10 02 e0 36 35 25 ff 00 37 50 66
E: 14.759940 10 02 e0 36 57 26 05 00 36 d0 64
E: 14.767941 10 02 e0 36 74 26 02 00 37 50 67
E: 14.775939 10 02 e0 36 8f 26 05 00 36 d1 65
E: 14.783940 10 02 e0 36 9f 25 fc 00 36 d1 67
E: 14.787945 10 02 e0 36 b0 25 f1 00 36 d1 6b
E: 14.795940 10 02 e0 36 c4 25 df 00 36 52 6b
E: 14.803939 10 02 e0 36 da 25 c6 00 36 d2 68
E: 14.811940 10 02 e0 36 f1 25 9d 00 36 d1 64
E: 14.819940 10 02 e0 37 0d 25 7a 00 36 d2 64
E: 14.827941 10 02 e0 37 25 25 53 00 36 d1 63
E: 14.831945 10 02 e0 37 3c 25 32 00 36 d2 61
E: 14.839938 10 02 e0 37 50 25 17 00 36 52 63
E: 14.847938 10 02 e0 37 5f 24 fe 00 36 54 62
E: 14.855940 10 02 e0 37 66 24 e1 00 36 56 63
E: 14.863941 10 02 e0 37 6a 24 c2 00 36 56 5d
E: 14.867946 10 02 e0 37 69 24 98 00 36 54 5f
E: 14.875943 10 02 e0 37 6d 24 79 00 36 56 5f
E: 14.883942 10 02 e0 37 6b 24 4a 00 36 56 5c
E: 14.891938 10 02 e0 37 68 24 1b 00 36 57 5f
E: 14.899940 10 02 e0 37 5d 23 d9 00 36 d7 5e
E: 14.903944 10 02 e0 37 51 23 a2 00 36 d7 62
E: 14.911939 10 02 e0 37 37 23 69 00 36 d7 63
E: 14.919939 10 02 e0 37 1d 23 2f 00 36 d9 63
E: 14.927940 10 02 e0 37 01 22 f5 00 36 da 68
E: 14.935939 10 02 e0 36 d7 22 ae 00 37 5b 68
E: 14.939944 10 02 e0 36 b2 22 75 00 37 5b 73
E: 14.947938 10 02 e0 36 89 22 24 00 37 5b 73
E: 14.955929 10 02 e0 36 5b 21 d7 00 36 d2 67
E: 14.963928 10 02 e0 36 2a 21 8a 00 36 55 60
E: 14.971929 10 02 e0 35 f4 21 44 00 37 54 5d
E: 14.979928 10 02 e0 35 b6 20 fc 00 38 54 58
E: 14.983933 10 02 e0 35 64 20 bb 00 38 54 58
E: 14.991928 10 02 e0 35 0d 20 89 00 38 54 58
E: 14.999928 10 02 e0 34 ae 20 4e 00 34 54 58
E: 15.007928 10 02 e0 34 49 20 14 00 35 58 57
E: 15.015929 10 02 e0 33 dd 1f d8 00 36 55 54
E: 15.019933 10 02 e0 33 6b 1f a5 00 36 57 55
E: 15.027930 10 02 e0 32 e9 1f 79 00 35 d7 5c
E: 15.035928 10 02 e0 32 68 1f 50 00 35 d7 5a
E: 15.043929 10 02 e0 31 ef 1f 34 00 36 d7 5b
E: 15.051929 10 02 e0 31 66 1f 16 00 39 57 5a
E: 15.059928 10 02 e0 30 d5 1f 04 00 34 53 5e
E: 15.063933 10 02 e0 30 45 1f 00 00 34 53 5d
E: 15.071928 10 02 e0 2f ac 1e ff 00 35 57 63
E: 15.079929 10 02 e0 2f 08 1f 0b 00 35 d9 63
E: 15.087866 10 02 e0 2e 76 1f 20 00 35 58 63
E: 15.095928 10 02 e0 2d f5 1f 41 00 36 57 5b
E: 15.099934 10 02 e0 2d 67 1f 6a 00 38 d7 59
E: 15.107928 10 02 e0 2c e2 1f a8 00 34 52 55
E: 15.115928 10 02 e0 2c 6e 1f ec 00 33 d2 51
E: 15.123927 10 02 e0 2c 02 20 3e 00 34 52 4f
E: 15.131927 10 02 e0 2b 9c 20 9c 00 34 d3 51
E: 15.139927 10 02 e0 2b 41 20 fd 00 35 53 51
E: 15.143933 10 02 e0 2a f3 21 6f 00 34 d1 50
E: 15.151928 10 02 e0 2a aa 21 ea 00 34 cf 57
E: 15.159929 10 02 e0 2a 6a 22 7d 00 35 4d 5c
E: 15.163933 10 02 e0 2a 35 23 0b 00 35 4d 6b
E: 15.175927 10 02 e0 2a 09 23 99 00 36 53 57
E: 15.179933 10 02 e0 29 ef 24 4d 00 36 51 52
E: 15.187927 10 02 e0 29 ed 25 08 00 37 4e 56
E: 15.195929 10 02 e0 2a 03 25 c7 00 35 ce 55
E: 15.203928 10 02 e0 2a 24 26 8c 00 36 ca 5f
E: 15.211927 10 02 e0 2a 5f 27 3e 00 35 4f 52
E: 15.215932 10 02 e0 2a ad 28 05 00 35 4c 46
E: 15.223927 10 02 e0 2b 0b 28 be 00 34 47 44
E: 15.231928 10 02 e0 2b 9f 29 8a 00 32 c5 4a
E: 15.239927 10 02 e0 2c 46 2a 31 00 31 46 4c
E: 15.243930 10 02 e0 2c f1 2a aa 00 31 46 51
E: 15.255927 10 02 e0 2d b7 2b 0b 00 30 c6 55
E: 15.259925 10 02 e0 2e 68 2b 5c 00 33 c7 50
E: 15.267927 10 02 e0 2f 46 2b a5 00 32 46 4c
E: 15.275927 10 02 e0 30 39 2b d1 00 30 46 51
E: 15.283928 10 02 e0 31 2d 2b f7 00 2f 48 52
E: 15.291868 10 02 e0 32 07 2c 07 00 33 c8 4f
E: 15.295933 10 02 e0 33 14 2c 01 00 31 c7 4e
E: 15.303932 10 02 e0 34 36 2b ef 00 30 46 4f
E: 15.311929 10 02 e0 35 58 2b c8 00 2d c6 4c
E: 15.319928 10 02 e0 36 5a 2b 92 00 32 46 4d
E: 15.327927 10 02 e0 37 8c 2b 56 00 30 c7 50
E: 15.331933 10 02 e0 38 b0 2a f6 00 2f 48 52
E: 15.339862 10 02 e0 39 bc 2a 81 00 2a c8 55
E: 15.347928 10 02 e0 3a 95 2a 17 00 2a c8 5b
E: 15.355926 10 02 e0 3b 6c 29 6a 00 2f c8 4c
E: 15.363927 10 02 e0 3c 1e 28 cd 00 2e c8 4a
E: 15.371927 10 02 e0 3c ac 28 2b 00 2d 4b 48
E: 15.375931 10 02 e0 3d 18 27 99 00 2c 4e 4c
E: 15.383928 10 02 e0 3d 5f 27 0b 00 2a d1 5b
E: 15.391927 10 02 e0 3d 7c 26 8c 00 35 d3 69
E: 15.399927 10 02 e0 3d 73 26 12 00 37 d4 74
E: 15.407926 10 02 e0 3d 31 25 87 00 39 cc 77
E: 15.411932 10 02 e0 3c c7 25 20 00 3d cd 77
E: 15.419928 10 02 e0 3c 4f 24 dd 00 30 ce 82
E: 15.427927 10 02 e0 3b b7 24 ac 00 33 50 8d
E: 15.435927 10 02 e0 3b 1a 24 94 00 37 d1 94
E: 15.443925 10 02 e0 3a 74 24 70 00 3b 50 9a
E: 15.447930 10 02 e0 39 ef 24 53 00 3c cf 9d
E: 15.455927 10 02 e0 39 8e 24 0b 00 3e d0 a1
E: 15.463926 10 02 e0 39 27 23 8d 00 3f d0 9d
E: 15.471927 10 02 e0 38 c8 22 f5 00 3f d7 9d
E: 15.479926 10 02 e0 38 7e 22 5b 00 33 62 9d
E: 15.487927 10 02 e0 38 28 21 a3 00 32 c7 95
E: 15.491931 10 02 e0 37 c1 20 f8 00 35 4a 92
E: 15.499926 10 02 e0 37 57 20 5f 00 36 cc 8e
E: 15.507927 10 02 e0 36 de 1f ca 00 37 d2 8a
E: 15.515927 10 02 e0 36 5f 1f 3d 00 38 d7 8b
E: 15.523927 10 02 e0 35 e2 1e c9 00 39 db 8c
E: 15.527932 10 02 e0 35 56 1e 46 00 3c e0 88
E: 15.535926 10 02 e0 34 c4 1d db 00 2e c6 84
E: 15.543926 10 02 e0 34 33 1d 6a 00 30 49 80
E: 15.551928 10 02 e0 33 a3 1d 01 00 32 c9 83
E: 15.559926 10 02 e0 33 0e 1c 7e 00 35 cc 83
E: 15.563931 10 02 e0 32 80 1c 06 00 37 52 7d
E: 15.571926 10 02 e0 32 00 1b 99 00 39 58 7f
E: 15.579926 10 02 e0 31 7c 1b 49 00 3c dd 7f
E: 15.587926 10 02 e0 30 e4 1b 07 00 30 58 7c
E: 15.595926 10 02 e0 30 36 1a da 00 31 58 80
E: 15.603927 10 02 e0 2f 73 1a d0 00 33 e0 7f
E: 15.607929 10 02 e0 2e 9e 1a cd 00 35 61 81
E: 15.615924 10 02 e0 2d e1 1a d7 00 39 61 7d
E: 15.623925 10 02 e0 2d 20 1a e1 00 2f da 7e
E: 15.631922 10 02 e0 2c 6e 1b 01 00 32 5a 7f
E: 15.639926 10 02 e0 2b c2 1b 33 00 33 5a 7c
E: 15.643930 10 02 e0 2b 15 1b 7a 00 35 5a 80
E: 15.651925 10 02 e0 2a 7a 1b cd 00 37 d9 80
E: 15.659926 10 02 e0 29 f0 1c 2f 00 3a 57 7d
E: 15.667925 10 02 e0 29 56 1c a2 00 3e 55 7c
E: 15.675925 10 02 e0 28 ec 1d 27 00 30 cb 7f
E: 15.683924 10 02 e0 28 70 1d a4 00 31 c9 81
E: 15.687925 10 02 e0 28 05 1e 2e 00 32 c4 88
E: 15.695925 10 02 e0 27 a4 1e b7 00 33 bd 8c
E: 15.703924 10 02 e0 27 42 1f 31 00 36 5c 8f
E: 15.711926 10 02 e0 26 ff 1f cd 00 37 d6 89
E: 15.719926 10 02 e0 26 ca 20 6f 00 38 52 86
E: 15.723934 10 02 e0 26 a7 21 3c 00 38 4d 84
E: 15.731925 10 02 e0 26 91 22 0d 00 38 c8 8f
E: 15.739924 10 02 e0 26 8c 22 ce 00 39 43 93
E: 15.747926 10 02 e0 26 98 23 65 00 39 5a 8b
E: 15.755924 10 02 e0 26 b8 24 19 00 36 d4 87
E: 15.759929 10 02 e0 26 e4 24 c1 00 35 d0 84
E: 15.767924 10 02 e0 27 17 25 61 00 34 cc 80
E: 15.775925 10 02 e0 27 59 25 f0 00 33 4a 86
E: 15.783925 10 02 e0 27 ab 26 68 00 32 47 88
E: 15.791924 10 02 e0 28 0b 26 b7 00 30 d7 83
E: 15.799925 10 02 e0 28 70 27 0b 00 2f 53 82
E: 15.803930 10 02 e0 28 e5 27 53 00 2d d1 7c
E: 15.811925 10 02 e0 29 66 27 93 00 2b cf 79
E: 15.819924 10 02 e0 29 d4 27 d9 00 38 cd 76
E: 15.827925 10 02 e0 2a 4e 28 23 00 36 4c 74
E: 15.835925 10 02 e0 2a cf 28 60 00 34 4b 72
E: 15.839925 10 02 e0 2b 66 28 87 00 33 49 72
E: 15.847924 10 02 e0 2c 0b 28 9e 00 30 48 6c
E: 15.855924 10 02 e0 2c a1 28 a3 00 2d c8 6d
E: 15.863925 10 02 e0 2d 34 28 92 00 2c 48 6e
E: 15.871925 10 02 e0 2d bf 28 86 00 29 49 6f
E: 15.875928 10 02 e0 2e 27 28 70 00 35 ca 6c
E: 15.883924 10 02 e0 2e 89 28 56 00 34 49 73
E: 15.891923 10 02 e0 2e f6 28 32 00 32 4a 71
E: 15.899925 10 02 e0 2f 54 28 1f 00 31 c9 75
E: 15.907925 10 02 e0 2f ae 28 10 00 30 c9 76
E: 15.915864 10 02 e0 2f fe 27 fe 00 2f c8 7a
E: 15.919930 10 02 e0 30 3d 27 e6 00 2f c8 79
E: 15.927923 10 02 e0 30 78 27 e1 00 2e 46 7e
E: 15.935924 10 02 e0 30 a2 27 d7 00 2e c7 80
E: 15.943925 10 02 e0 30 bc 27 c9 00 2d c6 86
E: 15.951923 10 02 e0 30 c9 27 b5 00 2d c7 87
E: 15.955928 10 02 e0 30 d4 27 a4 00 2d c6 8a
E: 15.963924 10 02 e0 30 ce 27 8e 00 2e 47 8a
E: 15.971924 10 02 e0 30 c6 27 66 00 2e 47 88
E: 15.979924 10 02 e0 30 bb 27 39 00 2e 4a 87
E: 15.987924 10 02 e0 30 a7 27 03 00 2f 4c 8a
E: 15.991930 10 02 e0 30 97 26 be 00 2e cf 89
E: 15.999924 10 02 e0 30 87 26 79 00 2e 53 8f
E: 16.007883 10 02 e0 30 76 26 16 00 2e c3 88
E: 16.015923 10 02 e0 30 63 25 bc 00 2e c5 83
E: 16.023924 10 02 e0 30 4a 25 67 00 2e c9 78
E: 16.031924 10 02 e0 30 2a 25 0a 00 2e 4a 71
E: 16.035928 10 02 e0 2f ff 24 be 00 2e ca 70
E: 16.043923 10 02 e0 2f c9 24 67 00 2f 4b 69
E: 16.051924 10 02 e0 2f 8b 24 1a 00 2f ce 6b
E: 16.059923 10 02 e0 2f 42 23 d7 00 30 50 67
E: 16.067923 10 02 e0 2f 02 23 94 00 30 50 66
E: 16.071928 10 02 e0 2e c2 23 4e 00 31 53 66
E: 16.079924 10 02 e0 2e 89 23 0f 00 32 55 6a
E: 16.087923 10 02 e0 2e 52 22 c6 00 32 58 6e
E: 16.095924 10 02 e0 2e 1a 22 8e 00 33 da 73
E: 16.103924 10 02 e0 2d e0 22 43 00 33 c9 6d
E: 16.107929 10 02 e0 2d 96 21 fd 00 35 4c 6a
E: 16.115924 10 02 e0 2d 53 21 bd 00 2a 4c 65
E: 16.123924 10 02 e0 2d 15 21 8d 00 2b 4b 64
E: 16.131923 10 02 e0 2c d1 21 65 00 2b cc 5c
E: 16.139923 10 02 e0 2c 8c 21 4d 00 2b cc 5b
E: 16.147923 10 02 e0 2c 4c 21 3b 00 2c cd 5b
E: 16.151923 10 02 e0 2c 0f 21 34 00 2d 4d 56
E: 16.159923 10 02 e0 2b da 21 2a 00 2d 4e 50
E: 16.167924 10 02 e0 2b a0 21 2e 00 2d 4d 54
E: 16.175923 10 02 e0 2b 67 21 30 00 2e 4e 50
E: 16.183924 10 02 e0 2b 38 21 2d 00 2e 4f 51
E: 16.187929 10 02 e0 2b 0c 21 2e 00 2e d0 50
E: 16.195921 10 02 e0 2a e4 21 27 00 2f 51 55
E: 16.203923 10 02 e0 2a c2 21 13 00 2f 51 50
E: 16.211922 10 02 e0 2a a7 21 06 00 2f d2 55
E: 16.219923 10 02 e0 2a 90 20 fa 00 2f d2 50
E: 16.227864 10 02 e0 2a 7f 20 e7 00 2f d1 53
E: 16.231926 10 02 e0 2a 73 20 d3 00 30 d2 4c
E: 16.239922 10 02 e0 2a 6e 20 bb 00 30 d2 48
E: 16.247922 10 02 e0 2a 67 20 a3 00 31 52 46
E: 16.255923 10 02 e0 2a 64 20 81 00 30 d4 45
E: 16.263922 10 02 e0 2a 60 20 66 00 30 54 44
E: 16.267928 10 02 e0 2a 5d 20 57 00 30 d5 46
E: 16.275922 10 02 e0 2a 5f 20 50 00 30 d7 47
E: 16.283922 10 02 e0 2a 5f 20 51 00 30 56 42
E: 16.291921 10 02 e0 2a 63 20 5b 00 2f d7 45
E: 16.299922 10 02 e0 2a 62 20 6e 00 30 57 42
E: 16.303928 10 02 e0 2a 6a 20 73 00 2f d8 40
E: 16.311922 10 02 e0 2a 6f 20 72 00 30 58 43
E: 16.319922 10 02 e0 2a 7a 20 73 00 2f d7 40
E: 16.327922 10 02 e0 2a 84 20 66 00 2f d8 42
E: 16.335923 10 02 e0 2a 8a 20 5c 1c 2f d6 40
E: 16.343922 10 02 e0 2a 92 20 4d 25 ef d7 41
E: 16.347926 10 02 e0 2a 9a 20 42 2e 30 57 40
E: 16.355922 10 02 e0 2a a3 20 37 3a 70 56 43
E: 16.363922 10 02 e0 2a ae 20 2b 47 70 d5 42
E: 16.371923 10 02 e0 2a b8 20 26 52 b0 55 41
E: 16.379925 10 02 e0 2a c1 20 20 5e 30 d5 43
E: 16.383927 10 02 e0 2a cb 20 1b 69 2f d6 41
E: 16.391920 10 02 e0 2a d4 20 14 73 f0 56 41
E: 16.399922 10 02 e0 2a db 20 0f 7d 70 56 41
E: 16.407921 10 02 e0 2a e1 20 0a 84 30 56 43
E: 16.415922 10 02 e0 2a e6 20 0a 89 b0 56 41
E: 16.419927 10 02 e0 2a e9 20 09 8d 30 d4 43
E: 16.427923 10 02 e0 2a ee 20 07 8f 70 56 43
E: 16.435921 10 02 e0 2a f5 20 05 90 30 56 40
E: 16.443921 10 02 e0 2a fc 20 06 90 30 d5 40
E: 16.451923 10 02 e0 2b 09 20 06 90 70 d4 41
E: 16.459921 10 02 e0 2b 1e 20 08 90 70 54 42
E: 16.463927 10 02 e0 2b 3c 20 12 90 b0 d4 43
E: 16.471921 10 02 e0 2b 5e 20 18 90 70 54 40
E: 16.479922 10 02 e0 2b 89 20 27 90 b0 54 40
E: 16.487921 10 02 e0 2b b9 20 34 90 f0 52 42
E: 16.495921 10 02 e0 2b eb 20 4e 91 30 51 42
E: 16.499926 10 02 e0 2c 28 20 70 91 6f ce 40
E: 16.507921 10 02 e0 2c 67 20 9d 91 6f 4d 43
E: 16.515923 10 02 e0 2c ac 20 c4 91 ae ce 42
E: 16.523921 10 02 e0 2c f8 20 ee 91 ee cc 43
E: 16.531921 10 02 e0 2d 44 21 19 92 2e 4c 41
E: 16.535927 10 02 e0 2d 9b 21 49 92 ae 4c 42
E: 16.543921 10 02 e0 2d fb 21 72 92 ac cb 41
E: 16.551921 10 02 e0 2e 40 21 a0 92 b2 ce 41
E: 16.559920 10 02 e0 2e 93 21 d0 92 72 4e 43
E: 16.567922 10 02 e0 2e ec 22 04 92 71 4d 43
E: 16.575921 10 02 e0 2f 48 22 3b 92 31 4d 41
E: 16.579922 10 02 e0 2f a9 22 75 92 70 ca 42
E: 16.587922 10 02 e0 30 02 22 a7 92 30 ca 47
E: 16.595920 10 02 e0 30 60 22 de 92 2f 53 45
E: 16.603921 10 02 e0 30 bd 23 1c 92 2f 53 40
E: 16.611922 10 02 e0 31 1a 23 5a 92 2e 52 40
E: 16.615929 10 02 e0 31 7c 23 98 91 ee 53 43
E: 16.623920 10 02 e0 31 dd 23 db 92 2d 53 42
E: 16.631920 10 02 e0 32 2d 24 14 92 32 d3 41
E: 16.639921 10 02 e0 32 85 24 5f 91 f2 53 43
E: 16.647920 10 02 e0 32 df 24 a2 92 32 51 41
E: 16.651925 10 02 e0 33 3c 24 e5 92 31 50 42
E: 16.659921 10 02 e0 33 97 25 2d 91 f0 cf 42
E: 16.667920 10 02 e0 33 f1 25 78 92 30 4e 43
E: 16.675920 10 02 e0 34 49 25 c5 91 b0 4e 40
E: 16.683920 10 02 e0 34 9f 26 19 91 ef ce 41
E: 16.691921 10 02 e0 34 f4 26 75 92 2f ce 41
E: 16.695925 10 02 e0 35 4e 26 b9 92 2e 4e 40
E: 16.703920 10 02 e0 35 a3 27 0f 91 ed cd 43
E: 16.711922 10 02 e0 35 e9 27 65 91 b1 cf 40
E: 16.719921 10 02 e0 36 2e 27 b4 91 f1 ce 42
E: 16.727921 10 02 e0 36 79 27 fe 91 f1 4f 42
E: 16.731921 10 02 e0 36 c6 28 44 91 b1 4e 43
E: 16.739920 10 02 e0 37 14 28 87 91 f1 4d 40
E: 16.747919 10 02 e0 37 63 28 c2 91 b1 4c 40
E: 16.755920 10 02 e0 37 b3 28 f7 91 b0 4c 40
E: 16.763921 10 02 e0 37 ff 29 31 91 f0 ca 42
E: 16.771920 10 02 e0 38 4b 29 65 91 af cb 40
E: 16.775925 10 02 e0 38 8e 29 96 91 af ca 42
E: 16.783919 10 02 e0 38 ce 29 c9 91 ef 49 43
E: 16.791920 10 02 e0 39 0f 2a 03 91 af 49 42
E: 16.799919 10 02 e0 39 4b 2a 34 91 ee ca 46
E: 16.803924 10 02 e0 39 82 2a 5e 92 2e ca 49
E: 16.811920 10 02 e0 39 b1 2a 77 91 b3 cf 54
E: 16.819920 10 02 e0 39 df 2a 9d 91 f3 4e 51
E: 16.827920 10 02 e0 3a 10 2a c1 91 b2 ce 52
E: 16.835919 10 02 e0 3a 41 2a e5 91 b1 ce 52
E: 16.843919 10 02 e0 3a 74 2b 07 91 72 4e 4d
E: 16.847924 10 02 e0 3a a4 2b 25 91 71 4e 4c
E: 16.855920 10 02 e0 3a d5 2b 45 91 b0 cc 4e
E: 16.863919 10 02 e0 3b 01 2b 65 91 70 4c 4c
E: 16.871919 10 02 e0 3b 27 2b 81 91 b0 cc 4f
E: 16.879920 10 02 e0 3b 4a 2b 9d 91 b0 cb 48
E: 16.887919 10 02 e0 3b 6b 2b b6 91 b0 cc 49
E: 16.891919 10 02 e0 3b 87 2b cd 91 f0 cc 49
E: 16.899919 10 02 e0 3b 9c 2b db 91 b1 4c 4a
E: 16.907921 10 02 e0 3b a9 2b dc 91 f1 4d 47
E: 16.915919 10 02 e0 3b b6 2b dc 91 f0 cb 44
E: 16.923919 10 02 e0 3b bc 2b e0 92 70 cc 44
E: 16.927924 10 02 e0 3b bd 2b d4 92 70 cc 4b
E: 16.935919 10 02 e0 3b c2 2b cf 93 70 cb 46
E: 16.943919 10 02 e0 3b c7 2b bd 93 f0 cc 4a
E: 16.951919 10 02 e0 3b ca 2b a7 94 b0 4c 4b
E: 16.959920 10 02 e0 3b ce 2b 97 94 b0 4b 49
E: 16.963923 10 02 e0 3b d0 2b 80 94 f0 4b 4b
E: 16.971919 10 02 e0 3b d4 2b 6b 95 2f cc 48
E: 16.979919 10 02 e0 3b d6 2b 5b 94 70 4c 4a
E: 16.987919 10 02 e0 3b d5 2b 60 95 2f cb 4a
E: 16.995920 10 02 e0 3b d7 2b 60 94 ef cc 4b
E: 17.003919 10 02 e0 3b d4 2b 60 94 6f 4c 4b
E: 17.007922 10 02 e0 3b d7 2b 5e 92 af 4c 48
E: 17.015919 10 02 e0 3b d6 2b 61 8f ef cc 48
E: 17.023920 10 02 e0 3b d5 2b 5b 8c 2f 4a 4c
E: 17.031920 10 02 e0 3b d1 2b 4f 88 2f cc 4e
E: 17.039919 10 02 e0 3b c9 2b 3b 84 2f 4b 4e
E: 17.043920 10 02 e0 3b be 2b 22 7f af 4b 4c
E: 17.051919 10 02 e0 3b b3 2b 00 7b 6f 4b 4d
E: 17.059918 10 02 e0 3b a4 2a d7 77 6f 4b 4d
E: 17.067919 10 02 e0 3b 95 2a b2 74 ef 4b 53
E: 17.075918 10 02 e0 3b 82 2a 8a 73 6e ca 53
E: 17.079923 10 02 e0 3b 68 2a 62 71 ee cc 56
E: 17.087918 10 02 e0 3b 48 2a 29 70 b0 4b 49
E: 17.095917 10 02 e0 3b 20 29 e5 6f b0 4a 4b
E: 17.103918 10 02 e0 3a f7 29 9e 6f 70 49 44
E: 17.111919 10 02 e0 3a cc 29 4e 6f 30 49 40
E: 17.119919 10 02 e0 3a 9c 28 f2 6e f0 cb 43
E: 17.123923 10 02 e0 3a 62 28 93 6e f0 cd 43
E: 17.131918 10 02 e0 3a 24 28 28 6e 30 ce 40
E: 17.139918 10 02 e0 39 e7 27 ba 6d 70 ce 41
E: 17.147917 10 02 e0 39 a7 27 4d 6c f1 4e 40
E: 17.155918 10 02 e0 39 57 26 e0 6a b3 4c 41
E: 17.159918 10 02 e0 38 f9 26 72 67 2e cc 40
E: 17.167917 10 02 e0 38 97 25 fe 63 6e cc 46
E: 17.175918 10 02 e0 38 2c 25 89 60 6f 4e 43
E: 17.183918 10 02 e0 37 c5 25 2f 5d b0 4f 40
E: 17.191918 10 02 e0 37 55 24 cc 5b b0 d1 40
E: 17.195921 10 02 e0 36 e4 24 74 5a b1 53 41
E: 17.203918 10 02 e0 36 79 24 1f 58 b1 d2 41
E: 17.211917 10 02 e0 36 17 23 cc 56 f1 d1 42
E: 17.219918 10 02 e0 35 b8 23 77 56 72 d1 41
E: 17.227917 10 02 e0 35 43 23 23 55 75 d1 40
E: 17.235882 10 02 e0 34 d6 22 d2 50 af 50 42
E: 17.239923 10 02 e0 34 6e 22 8a 44 ef d1 44
E: 17.247917 10 02 e0 34 06 22 34 31 30 c9 41
E: 17.255918 10 02 e0 33 9d 21 ec 08 70 ca 42
E: 17.263918 10 02 e0 33 2f 21 a7 00 31 4b 42
E: 17.271919 10 02 e0 32 c1 21 67 00 31 cb 42
E: 17.275922 10 02 e0 32 61 21 2d 00 32 4c 46
E: 17.283917 10 02 e0 32 08 20 fe 00 32 cc 47
E: 17.291917 10 02 e0 31 b2 20 db 00 33 cb 49
E: 17.299917 10 02 e0 31 65 20 b7 00 35 4c 4b
E: 17.307917 10 02 e0 31 27 20 a3 00 2e 4a 4d
E: 17.315918 10 02 e0 30 fd 20 95 00 2e c9 52
E: 17.319923 10 02 e0 30 dc 20 94 00 2e ca 4f
E: 17.327917 10 02 e0 30 c4 20 a1 00 2f 49 51
E: 17.335918 10 02 e0 30 b3 20 c0 00 2f 49 54
E: 17.343918 10 02 e0 30 a4 20 e3 00 2e c9 56
E: 17.351917 10 02 e0 30 9a 21 11 00 2e c9 56
E: 17.355922 10 02 e0 30 8b 21 38 00 2e 48 59
E: 17.363916 10 02 e0 30 83 21 67 00 2e 49 66
E: 17.371917 10 02 e0 30 7c 21 91 00 2e c9 6c
E: 17.379916 10 02 e0 30 78 21 b4 00 2e c8 72
E: 17.387855 10 02 e0 30 77 21 e0 00 2f 47 79
E: 17.391922 10 02 e0 30 77 22 02 00 2e c8 82
E: 17.399918 10 02 e0 30 81 22 35 00 2e c7 8a
E: 17.407916 10 02 e0 30 88 22 52 00 2e c6 89
E: 17.415917 10 02 e0 30 95 22 7b 00 2e 47 8c
E: 17.423916 10 02 e0 30 99 22 90 00 2f e6 91
E: 17.431915 10 02 e0 30 a6 22 b9 00 2e e5 91
E: 17.435922 10 02 e0 30 ac 22 d9 00 2f 63 8d
E: 17.443916 10 02 e0 30 af 22 f9 00 2f 63 8d
E: 17.451917 10 02 e0 30 ae 23 20 00 2f 60 93
E: 17.459909 10 02 e0 30 a9 23 3b 00 2e e0 92
E: 17.467908 10 02 e0 30 a4 23 4c 00 2e df 8d
E: 17.471907 10 02 e0 30 9b 23 5f 00 2e df 8f
E: 17.479910 10 02 e0 30 92 23 6f 00 2f 5f 93
E: 17.487905 10 02 e0 30 8c 23 7b 00 2f 5f 91
E: 17.495908 10 02 e0 30 7f 23 7f 00 2f e0 97
E: 17.503907 10 02 e0 30 76 23 7e 00 30 60 96
E: 17.507911 10 02 e0 30 71 23 7f 00 30 62 9a
E: 17.515905 10 02 e0 30 71 23 7d 00 30 e5 9c
E: 17.523905 10 02 e0 30 76 23 6b 00 30 e4 9c
E: 17.531906 10 02 e0 30 7a 23 53 00 30 e5 9f
E: 17.539905 10 02 e0 30 89 23 48 00 2f e5 9d
E: 17.547906 10 02 e0 30 97 23 30 00 2f 67 a0
E: 17.551910 10 02 e0 30 a9 23 18 00 30 68 a1
E: 17.559906 10 02 e0 30 be 23 03 00 2f e8 9f
E: 17.567906 10 02 e0 30 d8 22 f2 00 2f 68 a2
E: 17.575905 10 02 e0 30 ec 22 e4 00 2e e9 a0
E: 17.583905 10 02 e0 31 04 22 d3 00 2e ec a3
E: 17.587910 10 02 e0 31 1b 22 ca 00 2d ea a6
E: 17.595905 10 02 e0 31 2e 22 b8 00 2d 6e a4
E: 17.603905 10 02 e0 31 47 22 bb 00 2d 6e ab
E: 17.611905 10 02 e0 31 4d 22 b6 00 3f e2 ad
E: 17.619904 10 02 e0 31 83 22 b0 00 2a f1 ae
E: 17.623906 10 02 e0 31 93 22 ab 00 3f 67 ac
E: 17.631904 10 02 e0 31 b7 22 91 00 3d e8 b3
E: 17.639906 10 02 e0 31 e2 22 7c 00 3d 67 b2
E: 17.647905 10 02 e0 32 0d 22 67 00 3d 67 ac
E: 17.655906 10 02 e0 32 38 22 49 00 3b 4c ac
E: 17.663905 10 02 e2 32 65 22 25 00 3a cd ad
E: 17.667909 10 02 e2 32 95 22 07 00 3a 4e a9
E: 17.675905 10 02 e2 32 c9 22 07 00 39 4f a9
E: 17.683904 10 02 e2 32 fd 21 f7 00 38 4f aa
E: 17.691907 10 02 e2 33 31 22 04 00 37 cf a6
E: 17.699905 10 02 e2 33 60 21 fd 00 36 ce a4
E: 17.703910 10 02 e2 33 86 22 04 00 36 4e a6
E: 17.711904 10 02 e2 33 ac 21 f6 00 35 4d a5
E: 17.719904 10 02 e2 33 cf 21 fe 00 35 4d a5
E: 17.727904 10 02 e2 33 e8 22 00 00 34 4d a5
E: 17.735905 10 02 e2 33 fc 22 02 00 34 4e ab
E: 17.739910 10 02 e2 34 09 22 05 00 33 cf a9
E: 17.747904 10 02 e2 34 13 21 f5 00 33 cd ab
E: 17.755905 10 02 e2 34 1b 21 f4 00 32 cd ad
E: 17.763904 10 02 e2 34 23 21 ef 00 33 4d a9
E: 17.771904 10 02 e2 34 30 21 ee 00 32 cf aa
E: 17.779904 10 02 e2 34 40 21 f7 00 33 4e aa
E: 17.783908 10 02 e2 34 4e 21 e1 00 32 4f ab
E: 17.791904 10 02 e2 34 57 21 d3 00 32 4f aa
E: 17.799905 10 02 e2 34 60 21 c2 00 32 4e a6
E: 17.807904 10 02 e2 34 67 21 ba 00 32 4f a4
E: 17.815905 10 02 e2 34 72 21 be 00 31 ce a4
E: 17.819909 10 02 e2 34 7f 21 a8 00 31 cf a7
E: 17.827904 10 02 e2 34 87 21 ad 00 31 4f a4
E: 17.835904 10 02 e2 34 8d 21 b0 00 31 d0 a4
E: 17.843904 10 02 e2 34 93 21 b0 00 31 4f a4
E: 17.851904 10 02 e2 34 9b 21 aa 00 30 d0 ab
E: 17.859905 10 02 e2 34 a6 21 ae 00 30 d0 a3
E: 17.863908 10 02 e2 34 ae 21 b3 00 30 4f a7
E: 17.871905 10 02 e2 34 b6 21 aa 00 30 4e a1
E: 17.879907 10 02 e2 34 bc 21 a4 00 2f d0 a1
E: 17.887904 10 02 e2 34 bd 21 9e 00 2f d0 a4
E: 17.895902 10 02 e2 34 ba 21 a3 00 30 50 a7
E: 17.899909 10 02 e2 34 b9 21 8b 00 30 51 a0
E: 17.907906 10 02 e2 34 b9 21 88 00 2f d0 a3
E: 17.915842 10 02 e2 34 b7 21 86 00 30 51 a2
E: 17.923837 10 02 e2 34 b8 21 86 00 30 50 a7
E: 17.931903 10 02 e2 34 bb 21 83 00 30 d2 a5
E: 17.935910 10 02 e2 34 b8 21 70 00 31 51 a1
E: 17.943903 10 02 e2 34 b5 21 6e 00 30 d1 a0
E: 17.951903 10 02 e2 34 ad 21 68 00 31 51 a0
E: 17.959905 10 02 e2 34 a6 21 66 00 31 4f 9c
E: 17.967903 10 02 e2 34 9c 21 7e 00 31 d1 a3
E: 17.975903 10 02 e2 34 94 21 77 00 31 51 9f
E: 17.979908 10 02 e2 34 8b 21 7f 00 31 52 a3
E: 17.987905 10 02 e2 34 81 21 83 00 31 d1 9f
E: 17.995902 10 02 e2 34 72 21 79 00 31 cf 9d
E: 18.003904 10 02 e2 34 6a 21 87 00 32 ce 9d
E: 18.011900 10 02 e2 34 59 21 89 00 33 4f 9e
E: 18.015909 10 02 e2 34 4e 21 83 00 32 cd 9a
E: 18.023904 10 02 e2 34 47 21 97 00 32 4e 98
E: 18.031903 10 02 e2 34 39 21 9b 00 32 d0 9f
E: 18.039903 10 02 e2 34 2e 21 9a 00 32 d0 99
E: 18.047903 10 02 e2 34 28 21 a4 00 33 51 9b
E: 18.051908 10 02 e2 34 1e 21 90 00 32 cf 9a
E: 18.059903 10 02 e2 34 14 21 88 00 33 50 94
E: 18.067902 10 02 e2 34 09 21 81 00 34 51 9a
E: 18.075903 10 02 e2 33 fa 21 6b 00 34 ce 98
E: 18.083904 10 02 e0 33 f4 21 71 00 34 d0 9a
E: 18.091902 10 02 e0 33 ee 21 75 00 34 d2 98
E: 18.095851 10 02 e0 33 e9 21 67 00 34 50 9d
E: 18.103902 10 02 e0 33 e1 21 5b 00 34 d3 9d
E: 18.111902 10 02 e0 33 db 21 52 00 35 52 a2
E: 18.119907 10 02 e0 33 d4 21 48 00 35 52 a2
E: 18.127903 10 02 e0 33 c9 21 39 00 36 54 a3
E: 18.131908 10 02 e0 33 c2 21 30 00 36 d3 a0
E: 18.139904 10 02 e0 33 c2 21 26 00 36 54 a2
E: 18.147902 10 02 e0 33 c2 21 1c 00 36 54 a3
E: 18.155903 10 02 e0 33 bb 21 14 00 36 d4 a5
E: 18.163902 10 02 e0 33 bb 21 04 00 36 d4 a6
E: 18.167907 10 02 e0 33 c7 20 d3 00 35 d6 a0
E: 18.175904 10 02 e0 33 d3 20 bb 00 36 58 a1
E: 18.183902 10 02 e0 33 da 20 ab 00 35 58 a1
E: 18.191901 10 02 e0 33 d6 20 95 00 36 59 a3
E: 18.199905 10 02 e0 33 d3 20 80 00 36 5a a3
E: 18.207901 10 02 e0 33 d1 20 74 00 36 5b a5
E: 18.211907 10 02 e0 33 cb 20 66 00 36 dc a6
E: 18.219902 10 02 e0 33 d0 20 63 00 36 5a a6
E: 18.227904 10 02 e0 33 cd 20 50 00 37 5b a4
E: 18.235900 10 02 e0 33 d9 20 50 00 36 db a6
E: 18.243849 10 02 e0 33 e8 20 5c 00 35 5a a8
E: 18.247907 10 02 e0 33 ff 20 6c 00 34 dc ad
E: 18.255901 10 02 e0 34 0a 20 76 00 35 5d ad
E: 18.263902 10 02 e0 34 23 20 91 00 34 dd a9
E: 18.271903 10 02 e0 34 34 20 a1 00 33 db a9
E: 18.279910 10 02 e0 34 43 20 a6 00 33 d8 ab
E: 18.283914 10 02 e0 34 55 20 b1 00 33 d8 ab
E: 18.291911 10 02 e0 34 6e 20 bd 00 32 da a9
E: 18.299912 10 02 e0 34 84 20 c7 00 32 5a a9
E: 18.307911 10 02 e0 34 9d 20 c3 00 31 58 a8
E: 18.315914 10 02 e0 34 b0 20 c9 00 30 db ac
E: 18.323912 10 02 e0 34 c2 20 c2 00 30 5a a8
E: 18.327918 10 02 e0 34 d8 20 d4 00 30 59 ad
E: 18.335913 10 02 e0 34 e9 20 d1 00 2f 59 a8
E: 18.343913 10 02 e0 34 fe 20 de 00 2e 59 ac
E: 18.351914 10 02 e0 35 0c 20 d8 00 2e 59 ad
E: 18.359914 10 02 e0 35 20 20 d5 00 2d d9 af
E: 18.363912 10 02 e0 35 33 20 cf 00 2d 58 ab
E: 18.371913 10 02 e0 35 3a 20 c8 00 3f da a9
E: 18.379912 10 02 e0 35 49 20 c6 00 3f db a8
E: 18.387912 10 02 e0 35 51 20 af 00 3f dc aa
E: 18.395912 10 02 e0 35 5d 20 ad 00 3f dc a4
E: 18.403911 10 02 e0 35 6d 20 a8 00 3f dd a6
E: 18.407917 10 02 e0 35 78 20 9b 00 3f dc a1
E: 18.415912 10 02 e0 35 83 20 7c 00 3f dd a0
E: 18.423912 10 02 e0 35 89 20 75 00 3f dd a2
E: 18.431913 10 02 e0 35 93 20 7c 00 3f dd a3
E: 18.439913 10 02 e0 35 a6 20 89 00 3f df a0
E: 18.443917 10 02 e0 35 af 20 82 00 3f 5e a3
E: 18.451912 10 02 e0 35 ba 20 7e 00 3f e0 a1
E: 18.459911 10 02 e0 35 bc 20 82 00 3f df a2
E: 18.467912 10 02 e0 35 c3 20 78 00 3f 5e 9d
E: 18.475912 10 02 e0 35 ce 20 8b 00 3e de 9c
E: 18.479874 10 02 e0 35 d8 20 a7 00 3e e1 9f
E: 18.487907 10 02 e0 35 e4 20 90 00 3d dc 99
E: 18.495911 10 02 e0 35 f3 20 8f 00 3c dd 9a
E: 18.503911 10 02 e0 35 fe 20 8d 00 3c db 90
E: 18.511911 10 02 e0 36 0c 20 91 00 3c 5b 95
E: 18.519911 10 02 e0 36 17 20 96 00 3c 5d 93
E: 18.523912 10 02 e0 36 24 20 87 00 3b 5b 8f
E: 18.531911 10 02 e0 36 26 20 8b 00 3b 5b 8f
E: 18.539912 10 02 e0 36 2b 20 88 00 3b 5b 8b
E: 18.547912 10 02 e0 36 2d 20 8b 00 3b 59 88
E: 18.555912 10 02 e0 36 35 20 85 00 39 d8 87
E: 18.559916 10 02 e4 36 43 20 8f 00 3a 59 87
E: 18.567910 10 02 e4 36 55 20 91 00 38 d9 82
E: 18.575911 10 02 e4 36 6a 20 92 00 38 d9 80
E: 18.583912 10 02 e4 36 7c 20 98 00 37 d7 7e
E: 18.591911 10 02 e4 36 8c 20 95 00 37 d6 7b
E: 18.595916 10 02 e4 36 99 20 9a 00 36 d7 75
E: 18.603911 10 02 e4 36 a5 20 9f 00 36 52 70
E: 18.611911 10 02 e4 36 a8 20 a1 00 36 d3 73
E: 18.619911 10 02 e4 36 a8 20 99 00 36 d4 73
E: 18.627912 10 02 e4 36 a6 20 94 00 35 d4 6f
E: 18.635879 10 02 e4 36 a9 20 95 00 35 d4 6d
E: 18.639915 10 02 e4 36 a7 20 95 00 36 54 70
E: 18.647910 10 02 e4 36 ab 20 95 00 35 d4 6f
E: 18.655910 10 02 e4 36 ab 20 93 00 36 55 70
E: 18.663910 10 02 e4 36 ac 20 88 00 35 d4 6f
E: 18.671911 10 02 e4 36 b0 20 89 00 36 55 73
E: 18.675911 10 02 e4 36 b4 20 82 00 36 d6 71
E: 18.683877 10 02 e4 36 b5 20 82 00 36 55 71
E: 18.691907 10 02 e4 36 ba 20 87 00 36 d5 6e
E: 18.699906 10 02 e4 36 ba 20 85 00 36 54 70
E: 18.707909 10 02 e4 36 b6 20 7c 00 36 d5 73
E: 18.711915 10 02 e4 36 b4 20 82 00 36 55 72
E: 18.719910 10 02 e4 36 af 20 81 00 36 d4 71
E: 18.727911 10 02 e4 36 ac 20 86 00 36 55 72
E: 18.735910 10 02 e4 36 aa 20 87 00 36 54 71
E: 18.743910 10 02 e4 36 a7 20 82 00 36 d6 73
E: 18.751910 10 02 e4 36 a5 20 82 00 36 d6 73
E: 18.755915 10 02 e4 36 a0 20 7d 00 36 d6 72
E: 18.763910 10 02 e4 36 9d 20 70 00 36 54 75
E: 18.771911 10 02 e4 36 98 20 6e 00 36 d5 77
E: 18.779912 10 02 e4 36 98 20 65 00 36 d5 73
E: 18.787910 10 02 e4 36 99 20 64 00 36 d5 6c
E: 18.791915 10 02 e4 36 94 20 60 00 37 55 72
E: 18.799910 10 02 e4 36 94 20 5c 00 37 55 6c
E: 18.807909 10 02 e4 36 93 20 5a 00 37 56 73
E: 18.815910 10 02 e4 36 93 20 5b 00 37 d7 70
E: 18.823910 10 02 e4 36 91 20 62 00 36 d6 70
E: 18.827915 10 02 e4 36 8c 20 56 00 36 d5 73
E: 18.835909 10 02 e4 36 87 20 50 00 36 d6 71
E: 18.843910 10 02 e4 36 83 20 47 00 36 d7 6c
E: 18.851911 10 02 e4 36 7c 20 43 00 37 56 70
E: 18.859909 10 02 e4 36 74 20 36 00 36 d6 71
E: 18.867911 10 02 e4 36 68 20 27 00 37 57 71
E: 18.871915 10 02 e4 36 5f 20 1a 00 37 59 70
E: 18.879909 10 02 e4 36 4f 20 0d 00 37 d8 76
E: 18.887909 10 02 e4 36 3d 1f f6 00 37 d8 77
E: 18.895910 10 02 e4 36 28 1f ea 00 37 da 74
E: 18.903908 10 02 e4 36 06 1f c6 00 38 da 78
E: 18.907915 10 02 e4 35 d9 1f b3 00 39 5a 77
E: 18.915909 10 02 e4 35 a1 1f a2 00 3a 5a 78
E: 18.923909 10 02 e4 35 53 1f 99 00 3b d9 7b
E: 18.931909 10 02 e4 34 f9 1f 90 00 3c dd 79
E: 18.939911 10 02 e4 34 a6 1f 99 00 31 d8 7e
E: 18.947909 10 02 e4 34 4a 1f a7 00 32 59 7d
E: 18.951914 10 02 e4 33 ed 1f ae 00 33 d6 7b
E: 18.959909 10 02 e4 33 8a 1f bd 00 35 58 7f
E: 18.967909 10 02 e4 33 2b 1f d5 00 36 58 79
E: 18.975909 10 02 e4 32 cf 1f f5 00 37 5a 75
E: 18.983908 10 02 e4 32 74 20 20 00 37 d9 76
E: 18.987915 10 02 e4 32 1c 20 4f 00 38 56 70
E: 18.995908 10 02 e4 31 c4 20 8e 00 39 56 6f
E: 19.003908 10 02 e4 31 59 20 d0 00 3b d6 6e
E: 19.011908 10 02 e4 30 fc 21 19 00 30 4f 6b
E: 19.019909 10 02 e4 30 9d 21 6b 00 30 ce 6d
E: 19.023914 10 02 e4 30 41 21 c0 00 30 cf 6d
E: 19.031909 10 02 e4 2f ec 22 22 00 31 cc 72
E: 19.039909 10 02 e4 2f a9 22 83 00 32 c9 7b
E: 19.047908 10 02 e4 2f 75 22 bf 00 34 48 7f
E: 19.055910 10 02 e4 2f 58 22 ed 00 34 de 70
E: 19.063908 10 02 e4 2f 57 23 12 00 34 dc 73
E: 19.067913 10 02 e4 2f 6a 23 34 00 34 dc 71
E: 19.075909 10 02 e4 2f 83 23 4a 00 33 da 71
E: 19.083908 10 02 e4 2f a3 23 70 00 34 5a 6c
E: 19.091908 10 02 e4 2f d0 23 91 00 33 59 68
E: 19.099911 10 02 e4 30 00 23 a6 00 32 d7 68
E: 19.103915 10 02 e4 30 3d 23 b0 00 32 55 68
E: 19.111909 10 02 e4 30 7c 23 af 00 31 d6 66
E: 19.119909 10 02 e4 30 ba 23 a4 00 30 d6 61
E: 19.127908 10 02 e4 30 ff 23 9c 00 30 58 67
E: 19.135909 10 02 e4 31 45 23 82 00 2f d9 6b
E: 19.139913 10 02 e4 31 8a 23 64 00 2e d9 6f
E: 19.147908 10 02 e4 31 c2 23 4f 00 38 58 6e
E: 19.155909 10 02 e4 31 f9 23 2d 00 37 58 6f
E: 19.163907 10 02 e4 32 28 23 0e 00 37 59 6f
E: 19.171909 10 02 e4 32 4b 22 ea 00 36 59 73
E: 19.179911 10 02 e4 32 68 22 c4 00 36 59 70
E: 19.183913 10 02 e4 32 7d 22 ad 00 35 db 75
E: 19.191908 10 02 e4 32 81 22 93 00 36 5c 76
E: 19.199910 10 02 e4 32 84 22 86 00 36 5c 79
E: 19.207907 10 02 e0 32 7a 22 72 00 36 5d 7e
E: 19.215865 10 02 e0 32 72 22 64 00 36 4a 7e
E: 19.219887 10 02 e0 32 64 22 64 00 36 49 7c
E: 19.227856 10 02 e0 32 53 22 64 00 36 ca 81
E: 19.235864 10 02 e0 32 3b 22 68 00 37 4a 83
E: 19.243880 10 02 e0 32 2a 22 6f 00 38 4a 81
E: 19.251908 10 02 e0 32 17 22 75 00 37 c9 82
E: 19.255908 10 02 e0 32 01 22 7d 00 38 c9 81
E: 19.263907 10 02 e0 31 eb 22 83 00 39 c9 87
E: 19.271908 10 02 e0 31 dc 22 7e 00 39 ca 8a
E: 19.279908 10 02 e0 31 c8 22 7b 00 39 de 84
E: 19.283913 10 02 e0 31 bd 22 85 00 39 de 88
E: 19.295908 10 02 e0 31 b2 22 61 00 3b 5e 8d
E: 19.299911 10 02 e0 31 af 22 56 00 3b 4a 89
E: 19.307908 10 02 e0 31 b1 22 39 00 3b cc 8b
E: 19.315908 10 02 e0 31 b5 22 22 00 3b 4c 88
E: 19.323908 10 02 e0 31 b8 22 09 00 3b ce 8b
E: 19.331907 10 02 e0 31 c4 21 f5 00 3b d0 88
E: 19.335912 10 02 e0 31 c4 21 ea 00 3b cf 8d
E: 19.343907 10 02 e0 31 c2 21 e0 00 3b 4e 87
E: 19.351907 10 02 e0 31 be 21 e6 00 3b ce 89
E: 19.359907 10 02 e0 31 b4 21 ec 00 3c 4e 88
E: 19.367907 10 02 e0 31 aa 21 fc 00 3b ce 8e
E: 19.371912 10 02 e0 31 9c 22 0a 00 3c 4d 8f
E: 19.379907 10 02 e0 31 95 22 1d 00 3c 4c 8d
E: 19.387907 10 02 e0 31 94 22 2d 00 3b cb 8d
E: 19.395907 10 02 e0 31 90 22 38 00 3c 4c 8b
E: 19.403907 10 02 e0 31 88 22 43 00 3c cc 8a
E: 19.411907 10 02 e0 31 7e 22 55 00 3c cc 88
E: 19.415907 10 02 e0 31 79 22 6e 00 3c cc 8a
E: 19.423907 10 02 e0 31 6d 22 7e 00 3c cc 8c
E: 19.431907 10 02 e0 31 61 22 8f 00 3c ca 8d
E: 19.439907 10 02 e0 31 59 22 8a 00 2f e4 8a
E: 19.447907 10 02 e0 31 41 22 9b 00 3d dd 87
E: 19.451912 10 02 e0 31 48 22 ab 00 2f e4 8a
E: 19.459906 10 02 e0 31 44 22 ba 00 2f e5 84
E: 19.467907 10 02 e0 31 47 22 cb 00 2f e4 86
E: 19.475906 10 02 e0 31 47 22 d7 00 2f e4 8a
E: 19.483906 10 02 e0 31 49 22 e1 00 2e e3 89
E: 19.491907 10 02 e0 31 4c 22 ee 00 2f 60 84
E: 19.495911 10 02 e0 31 4c 22 fe 00 2f e0 87
E: 19.503906 10 02 e0 31 4d 23 15 00 2f df 85
E: 19.511907 10 02 e0 31 49 23 2f 00 2f de 8a
E: 19.519908 10 02 e0 31 39 23 3c 00 2f 5f 8e
E: 19.527906 10 02 e0 31 1f 23 3c 00 2f 5e 93
E: 19.531911 10 02 e0 31 07 23 33 00 2f df 97
E: 19.539906 10 02 e0 30 e7 23 23 00 31 61 9b
E: 19.547906 10 02 e0 30 ca 23 12 00 32 61 9b
E: 19.555906 10 02 e0 30 b6 23 0f 00 32 e1 9c
E: 19.563854 10 02 e0 30 a0 23 0b 00 33 e3 9d
E: 19.567857 10 02 e0 30 87 23 0e 00 33 e5 a1
E: 19.575850 10 02 e0 30 77 23 09 00 34 65 a5
E: 19.583908 10 02 e0 30 52 23 0f 00 33 e5 a6
E: 19.591906 10 02 e0 30 2c 23 02 00 35 e4 a7
E: 19.599907 10 02 e0 30 16 23 08 00 35 e5 ad
E: 19.607907 10 02 e0 2f ee 23 12 00 38 65 aa
E: 19.611911 10 02 e0 2f ca 23 1b 00 39 67 ab
E: 19.619907 10 02 e0 2f ac 23 23 00 39 67 b1
E: 19.627906 10 02 e0 2f 82 23 20 00 39 e8 b3
E: 19.635908 10 02 e0 2f 58 22 fd 00 3a e6 b5
E: 19.643846 10 02 e0 2f 3b 23 0f 00 3b 65 ba
E: 19.647914 10 02 e0 2f 1d 23 11 00 3c e3 b6
E: 19.655908 10 02 e0 2f 0c 23 1e 00 3d 66 b6
E: 19.663906 10 02 e0 2f 07 23 3b 00 3c 68 ba
E: 19.671906 10 02 e0 2f 06 23 3c 00 3c e7 b8
E: 19.679906 10 02 e0 2f 08 23 39 00 3c 66 b9
E: 19.683911 10 02 e0 2f 0f 23 3c 00 3c 64 b9
E: 19.691906 10 02 e0 2f 1e 23 5d 00 3c 65 b5
E: 19.699905 10 02 e0 2f 2c 23 4b 00 3c 63 b4
E: 19.707905 10 02 e0 2f 30 23 59 00 3d 64 b7
E: 19.715906 10 02 e0 2f 3d 23 68 00 3c e5 b8
E: 19.723905 10 02 e0 2f 46 23 7a 00 3c e6 ba
E: 19.727906 10 02 e0 2f 54 23 8f 00 3b 69 b9
E: 19.735906 10 02 e0 2f 4d 23 9d 00 3b 67 b9
E: 19.743906 10 02 e0 2f 50 23 b1 00 3b e6 bb
E: 19.751906 10 02 e0 2f 4b 23 c3 00 3b 62 b4
E: 19.759905 10 02 e0 2f 41 23 d9 00 3b e0 b7
E: 19.763909 10 02 e0 2f 3d 23 f1 00 3b de b2
E: 19.771905 10 02 e0 2f 42 24 22 00 3b e0 b3
E: 19.779906 10 02 e0 2f 4c 24 2a 00 3b 60 b4
E: 19.787905 10 02 e0 2f 69 24 1d 00 39 df b2
E: 19.795905 10 02 e0 2f 8c 24 09 00 39 dd ac
E: 19.799910 10 02 e0 2f b6 23 fb 00 39 5e ab
E: 19.807905 10 02 e0 2f f3 23 f1 00 37 e1 a9
E: 19.815905 10 02 e0 30 3f 23 da 00 34 e2 a4
E: 19.823906 10 02 e0 30 96 23 b5 00 32 e2 a1
E: 19.831905 10 02 e0 30 f5 23 7b 00 2f e1 9f
E: 19.839904 10 02 e0 31 42 23 59 00 2e 64 95
E: 19.843911 10 02 e0 31 70 23 4f 00 2e 64 96
E: 19.851907 10 02 e0 31 7a 23 2f 00 3e e4 94
E: 19.859905 10 02 e0 31 8a 23 13 00 3f 65 92
E: 19.867905 10 02 e0 31 9c 23 13 00 3e e5 91
E: 19.875904 10 02 e0 31 a7 23 1d 00 3f 66 92
E: 19.879905 10 02 e0 31 b4 23 30 00 3e 67 95
E: 19.887905 10 02 e0 31 c2 23 38 00 3e 66 96
E: 19.895904 10 02 e0 31 cd 23 42 00 3d e5 93
E: 19.903904 10 02 e0 31 db 23 65 00 3d 63 94
E: 19.911906 10 02 e0 31 de 23 6d 00 3d e4 92
E: 19.915850 10 02 e0 31 ea 23 92 00 3e 63 90
E: 19.923843 10 02 e0 31 ef 23 b4 00 3d 63 90
E: 19.931905 10 02 e0 31 ef 23 d7 00 3d 61 96
E: 19.939905 10 02 e0 31 eb 23 e9 00 3d 5f 97
E: 19.947905 10 02 e0 31 e9 24 02 00 3d 5c 93
E: 19.955904 10 02 e0 31 e0 24 1a 00 3d dc 90
E: 19.959909 10 02 e0 31 d5 24 42 00 3e 5b 90
E: 19.967905 10 02 e0 31 cc 24 52 00 3e db 92
E: 19.975904 10 02 e0 31 c0 24 76 00 3f 5a 98
E: 19.983904 10 02 e0 31 ac 24 97 00 3f 59 96
E: 19.991904 10 02 e0 31 9b 24 ad 00 3f d8 9a
E: 19.995908 10 02 e0 31 85 24 b7 00 3f d8 9b
E: 20.003903 10 02 e0 31 76 24 c7 00 3f d7 9a
E: 20.011904 10 02 e0 31 68 24 ea 00 3f d6 9d
E: 20.019905 10 02 e0 31 5e 24 f6 00 3f d8 9f
E: 20.027839 10 02 e0 31 59 24 fc 00 3f d5 a3
E: 20.035904 10 02 e0 31 5a 25 0b 00 3f d6 a3
E: 20.039904 10 02 e0 31 58 24 ee 00 3f d6 a2
E: 20.047903 10 02 e0 31 56 24 e3 00 3f d4 9e
E: 20.055905 10 02 e0 31 59 24 e0 00 3f d6 9c
E: 20.063904 10 02 e0 31 5b 24 d8 00 3f d7 9c
E: 20.071905 10 02 e0 31 5c 24 da 00 3f d7 a2
E: 20.075908 10 02 e0 31 5b 24 db 00 3f d7 a2
E: 20.083904 10 02 e0 31 59 24 d6 00 3f d7 a0
E: 20.091903 10 02 e0 31 58 24 cd 00 3f d7 a4
E: 20.099904 10 02 e0 31 4e 24 c5 00 3f d7 a7
E: 20.107904 10 02 e0 31 56 24 bb 00 2d d8 a0
E: 20.111910 10 02 e0 31 40 24 b2 00 3f d7 a7
E: 20.119904 10 02 e0 31 52 24 a5 00 2d d7 a5
E: 20.127903 10 02 e0 31 3d 24 9e 00 3f d6 a6
E: 20.135904 10 02 e0 31 51 24 aa 00 2e 58 a5
E: 20.143902 10 02 e0 31 3b 24 ae 00 3f d7 aa
E: 20.151903 10 02 e0 31 4a 24 ae 00 2e da a9
E: 20.155911 10 02 e0 31 39 24 bf 00 3f d7 ab
E: 20.163903 10 02 e0 31 3c 24 ab 00 2d 5b aa
E: 20.171846 10 02 e0 31 38 24 a0 00 2e 5b ac
E: 20.179831 10 02 e0 31 2f 24 9c 00 2f 59 a8
E: 20.187831 10 02 e0 31 2c 24 8f 00 2f 5a ad
E: 20.191828 10 02 e0 31 28 24 93 00 2e d9 ab
E: 20.199823 10 02 e0 31 24 24 92 00 2f 5a ae
E: 20.207822 10 02 e0 31 26 24 91 00 2e dc ae
E: 20.215829 10 02 e0 31 24 24 7c 00 2e da b1
E: 20.223829 10 02 e0 31 24 24 74 00 2f 5b ad
E: 20.227833 10 0c 00 00 00 00 10 00 00 00 00
E: 20.235824 10 02 e0 31 17 24 78 00 2f 5d b0
E: 20.243830 10 02 e0 31 17 24 7a 00 2f 5e b1
E: 20.251827 10 02 e0 30 ff 24 7a 00 2f 5d b2
E: 20.259827 10 02 e0 30 f3 24 72 00 30 5c b2
E: 20.267822 10 02 e0 30 e1 24 76 00 30 5d b5
E: 20.271831 10 02 e0 30 d4 24 8a 00 31 de b0
E: 20.279821 10 02 e0 30 c3 24 9d 00 31 5e b6
E: 20.287821 10 02 e0 30 b4 24 8d 00 31 dc b6
E: 20.295821 10 02 e0 30 b2 24 9d 00 32 5c b7
E: 20.303820 10 02 e0 30 a2 24 b1 00 32 5b b4
E: 20.307820 10 02 e0 30 9e 24 b3 00 31 de bb
E: 20.315821 10 02 e0 30 9c 24 cc 00 31 5b bb
E: 20.323820 10 02 e0 30 97 24 ca 00 31 db b9
E: 20.331820 10 02 e0 30 97 24 cc 00 32 d9 b6
E: 20.339819 10 02 e0 30 9b 24 d7 00 33 5a b1
E: 20.343823 10 02 e0 30 9d 24 d7 00 32 5a b4
E: 20.351820 10 02 e0 30 ac 24 ea 00 32 d9 b7
E: 20.359820 10 02 e0 30 b5 24 f0 00 31 5b bb
E: 20.367819 10 02 e0 30 b4 24 e6 00 31 dc b7
E: 20.375819 10 02 e0 30 c2 24 e6 00 31 5b b6
E: 20.383818 10 02 e0 30 c6 24 dd 00 30 db b6
E: 20.387823 10 02 e0 30 d2 24 d9 00 30 da b4
E: 20.395818 10 02 e0 30 da 24 d5 00 30 d9 b8
E: 20.403819 10 02 e0 30 ec 24 dd 00 30 5a bb
E: 20.411818 10 02 e0 30 f1 24 c0 00 30 59 b6
E: 20.419818 10 02 e0 30 fc 24 c6 00 2f d9 b7
E: 20.423823 10 02 e0 31 03 24 d7 00 2f dc b6
E: 20.431818 10 02 e0 31 0b 24 c5 00 2e d9 bb
E: 20.439818 10 02 e0 31 20 24 ce 00 2f db b5
E: 20.447818 10 02 e0 31 25 24 d7 00 2f dc b5
E: 20.451822 10 0c 00 00 00 00 00 00 00 00 00
E: 20.455821 10 02 e0 31 2c 24 d1 00 2f db b5
E: 20.459824 10 02 e0 31 31 24 ce 00 2e db b4
E: 20.467837 10 02 e0 31 32 24 cd 00 2f 5d b6
E: 20.475821 10 02 e0 31 3a 24 d2 00 2e dd b5
E: 20.483830 10 02 e0 31 3c 24 c7 00 2e 5d b7
E: 20.491854 10 02 e0 31 40 24 c8 00 2e 5b b9
E: 20.499848 10 02 e0 31 47 24 bb 00 2e 5a b5
E: 20.503900 10 02 e0 31 43 24 c6 00 2d dc b4
E: 20.511892 10 02 e0 31 2d 24 b3 00 3f d8 b7
E: 20.519850 10 02 e0 31 44 24 bc 00 2e 5b b5
E: 20.527849 10 02 e0 31 45 24 c0 00 2f 59 b1
E: 20.535891 10 02 e0 31 38 24 cc 00 3f da b0
E: 20.539896 10 02 e0 31 2b 24 cf 00 3f da b4
E: 20.547890 10 02 e0 31 45 24 e4 00 2e 5c b6
E: 20.555890 10 02 e0 31 48 24 c5 00 2e 59 b3
E: 20.563889 10 02 e0 31 48 24 db 00 2e db b3
E: 20.571891 10 02 e0 31 37 24 e2 00 3f db b3
E: 20.579890 10 02 e0 31 4b 24 dc 00 2e 59 b4
E: 20.583895 10 02 e0 31 2e 24 d6 00 3f db b1
E: 20.591889 10 02 e0 31 38 24 f8 00 3f da b4
E: 20.599889 10 02 e0 31 48 24 d0 00 2e d6 b6
E: 20.607890 10 02 e0 31 50 24 e3 00 2e 5b b3
E: 20.615891 10 02 e0 31 37 24 de 00 3f da b4
E: 20.619896 10 02 e0 31 4b 24 d7 00 2d d9 b3
E: 20.627891 10 02 e0 31 3a 24 eb 00 3f db b1
E: 20.635890 10 02 e0 31 35 24 db 00 3f db b3
E: 20.643889 10 02 e0 31 4e 24 e2 00 2e 59 b2
E: 20.651890 10 02 e0 31 3a 24 ef 00 3f db b0
E: 20.655894 10 02 e0 31 51 24 e8 00 2d d8 b1
E: 20.663888 10 02 e0 31 3b 24 de 00 3f da b0
E: 20.671890 10 02 e0 31 3d 24 f0 00 3f db b2
E: 20.679890 10 02 e0 31 3f 24 f9 00 3f dc b3
E: 20.687890 10 02 e0 31 56 24 e0 00 2e 58 ae
E: 20.695889 10 02 e0 31 40 24 e9 00 3f da b3
E: 20.699893 10 02 e0 31 3a 24 f8 00 3f da b0
E: 20.707891 10 02 e0 31 54 24 e6 00 2e d8 ac
E: 20.715890 10 02 e0 31 3e 25 02 00 3f db b0
E: 20.723893 10 02 e0 31 48 24 ef 00 2d db b2
E: 20.731891 10 02 e0 31 40 24 ec 00 3f d8 b3
E: 20.735895 10 02 e0 31 44 24 f2 00 3f da ac
E: 20.743890 10 02 e0 31 46 24 f8 00 3f db b2
E: 20.751891 10 02 e0 31 57 24 e8 00 2e 59 b0
E: 20.759889 10 02 e0 31 45 24 f2 00 3f db ad
E: 20.763895 10 02 e0 31 4a 24 da 00 3f db af
E: 20.771894 10 02 e0 31 48 25 01 00 3f db b3
E: 20.779891 10 02 e0 31 4d 24 e9 00 3f da b2
E: 20.787891 10 02 e0 31 48 24 f0 00 3f da b2
E: 20.795892 10 02 e0 31 45 24 d5 00 3f da ad
E: 20.799896 10 02 e0 31 48 24 f0 00 3f da b5
E: 20.811891 10 02 e0 31 4b 24 f3 00 3f d9 b0
E: 20.815896 10 02 e0 31 48 24 ef 00 3f d9 b1
E: 20.823891 10 02 e0 31 55 24 f9 00 2e 5a af
E: 20.831891 10 02 e0 31 3e 24 fb 00 3f da b2
E: 20.839893 10 02 e0 31 3d 24 e7 00 3f d8 ae
E: 20.847890 10 02 e0 31 3d 25 09 00 3f da b1
E: 20.851896 10 02 e0 31 4c 24 fe 00 2d d8 b3
E: 20.859891 10 02 e0 31 50 25 00 00 2e d7 ae
E: 20.867892 10 02 e0 31 3c 25 0f 00 3f da b3
E: 20.875890 10 02 e0 31 4c 24 fa 00 2d d8 b3
E: 20.883892 10 02 e0 31 3e 25 1c 00 3f da b0
E: 20.887896 10 02 e0 31 49 25 0c 00 2d 58 b2
E: 20.895890 10 02 e0 31 3a 25 0d 00 3f d9 b3
E: 20.903889 10 02 e0 31 4d 25 17 00 2d d9 b2
E: 20.911890 10 02 e0 31 41 25 09 00 2e d8 b6
E: 20.919893 10 02 e0 31 3d 25 18 00 2e 59 b4
E: 20.927893 10 02 e0 31 35 25 13 00 2f 58 b6
E: 20.931894 10 02 e0 31 2c 25 17 00 2f 59 b5
E: 20.939891 10 02 e0 31 2f 25 1f 00 2e 5a bb
E: 20.947894 10 02 e0 31 2a 25 15 00 2e d9 b8
E: 20.955890 10 02 e0 31 36 25 18 00 2e d9 b9
E: 20.963889 10 02 e0 31 3a 25 13 00 2e 5a bc
E: 20.967895 10 02 e0 31 43 25 04 00 2d d8 bc
E: 20.975890 10 02 e0 31 38 25 0c 00 3f dc c3
E: 20.983890 10 02 e0 31 50 24 f6 00 3f dc c0
E: 20.991892 10 02 e0 31 69 25 05 00 3f dc c0
E: 20.999889 10 02 e0 31 82 24 ee 00 3f dc c7
E: 21.003894 10 02 e0 31 ac 24 cd 00 3f dd c0
E: 21.011890 10 02 e0 31 c9 24 cf 00 3f dd c4
E: 21.019891 10 02 e0 31 ed 24 b3 00 3f de c5
E: 21.027891 10 02 e0 32 13 24 a8 00 3f df c5
E: 21.035891 10 02 e0 32 3f 24 a2 00 3f e1 c8
E: 21.043891 10 02 e0 32 6a 24 86 00 3f e2 c4
E: 21.047894 10 02 e0 32 98 24 85 00 3f e4 c7
E: 21.055890 10 02 e0 32 b0 24 66 00 3f e5 ca
E: 21.063888 10 02 e0 32 d5 24 31 00 3e e2 cb
E: 21.071891 10 02 e0 32 fe 24 40 00 3e e4 c6
E: 21.079889 10 02 e0 33 14 24 26 00 3e 68 c9
E: 21.083894 10 02 e0 33 37 23 fe 00 3c e7 c9
E: 21.091889 10 02 e0 33 4c 24 05 00 3c e8 c9
E: 21.099849 10 02 e0 33 5c 23 dd 00 3b e9 ca
E: 21.107889 10 02 e0 33 69 23 ca 00 3b e7 cf
E: 21.115890 10 02 e0 33 77 23 ea 00 3b eb ca
E: 21.123889 10 02 e0 33 80 23 b4 00 3b 68 cf
E: 21.127894 10 02 e0 33 89 23 e5 00 3b 6c cb
E: 21.135889 10 02 e0 33 87 23 ba 00 3a eb c8
E: 21.143891 10 02 e0 33 89 23 bb 00 3b ea c9
E: 21.151890 10 02 e0 33 8a 23 d1 00 3b 6b c8
E: 21.159890 10 02 e0 33 83 23 be 00 3b 69 c8
E: 21.163892 10 02 e0 33 7a 23 e2 00 3b 6a cb
E: 21.171888 10 02 e0 33 6b 23 d7 00 3c 6a cd
E: 21.179889 10 02 e0 33 65 23 f8 00 3b e9 cb
E: 21.187888 10 02 e0 33 58 24 0b 00 3c 6a c8
E: 21.195888 10 02 e0 33 42 23 f6 00 3d 68 c8
E: 21.199834 10 02 e0 33 3b 24 24 00 3c e7 c7
E: 21.207889 10 02 e0 33 21 24 22 00 3d e9 c9
E: 21.215890 10 02 e0 33 07 24 19 00 3d 65 ca
E: 21.223889 10 02 e0 32 fc 24 3a 00 3e e5 c5
E: 21.231890 10 02 e0 32 f0 24 61 00 3e e7 c5
E: 21.239889 10 02 e0 32 d3 24 5c 00 3e e7 c9
E: 21.243894 10 02 e0 32 c5 24 4f 00 3d e5 c7
E: 21.251890 10 02 e0 32 b9 24 72 00 3f 65 c5
E: 21.259889 10 02 e0 32 a2 24 6f 00 3f 64 c8
E: 21.267889 10 02 e0 32 9a 24 75 00 3f e1 c6
E: 21.275888 10 02 e0 32 90 24 8d 00 3f e4 c4
E: 21.279893 10 02 e0 32 7f 24 66 00 3f e0 c8
E: 21.287888 10 02 e0 32 7b 24 a4 00 3f e2 c6
E: 21.295888 10 02 e0 32 6c 24 89 00 3f e2 c8
E: 21.303887 10 02 e0 32 6d 24 9d 00 3f e1 c2
E: 21.311888 10 02 e0 32 60 24 a7 00 3f e3 c7
E: 21.315894 10 02 e0 32 5d 24 8c 00 3f e0 c7
E: 21.323888 10 02 e0 32 5a 24 b1 00 3f e3 c7
E: 21.331889 10 02 e0 32 5a 24 a5 00 3f e0 c7
E: 21.339887 10 02 e0 32 51 24 a5 00 3f e1 c3
E: 21.347889 10 02 e0 32 4b 24 a1 00 3f e1 c5
E: 21.355889 10 02 e0 32 41 24 b8 00 3f e1 c3
E: 21.359889 10 02 e0 32 3e 24 b5 00 3f e1 c6
E: 21.367888 10 02 e0 32 38 24 ad 00 3f e1 c2
E: 21.375892 10 02 e0 32 34 24 ad 00 3f e2 c6
E: 21.383891 10 02 e0 32 2f 24 aa 00 3f e1 c3
E: 21.391888 10 02 e0 32 29 24 c2 00 3f e3 c6
E: 21.395892 10 02 e0 32 2a 24 ad 00 3f e0 c2
E: 21.403887 10 02 e0 32 22 24 ce 00 3f e1 c7
E: 21.411888 10 02 e0 32 1d 24 a9 00 3f e2 c1
E: 21.419889 10 02 e0 32 20 24 e7 00 3f e3 c1
E: 21.427887 10 02 e0 32 1b 24 c6 00 3f e1 c0
E: 21.431893 10 02 e0 32 17 24 de 00 3f e1 c2
E: 21.439889 10 02 e0 32 10 24 cd 00 3f e1 c2
E: 21.447888 10 02 e0 32 0d 24 dc 00 3f e0 c1
E: 21.455887 10 02 e0 32 03 24 e0 00 3f e1 c3
E: 21.463887 10 02 e0 32 04 24 d6 00 3f df c3
E: 21.471887 10 02 e0 31 ff 24 f9 00 3f e1 c0
E: 21.475896 10 02 e0 31 fc 24 e2 00 3f df c0
E: 21.483817 10 02 e0 31 fd 24 ec 00 3f e1 c3
E: 21.491888 10 02 e0 31 f5 24 ed 00 3f e1 c5
E: 21.495893 10 0c 00 00 00 00 04 00 00 00 00
E: 21.499853 10 02 e0 31 f6 24 eb 00 3f e0 c3
E: 21.507890 10 02 e0 31 fe 25 0a 00 3f e3 c6
E: 21.511892 10 02 e0 31 f3 24 e2 00 3f de c2
E: 21.519888 10 02 e0 31 f7 24 f4 00 3f e1 c2
E: 21.527817 10 02 e0 31 ec 24 e7 00 3f df c1
E: 21.535815 10 02 e0 31 e9 24 e4 00 3f df c3
E: 21.543816 10 02 e0 31 e3 24 f7 00 3f e1 c3
E: 21.547818 10 02 e0 31 e7 24 ea 00 3f e1 c1
E: 21.555816 10 02 e0 31 e7 24 f4 00 3f e0 bd
E: 21.563813 10 02 e0 31 e5 24 f6 00 3f e1 c2
E: 21.571816 10 02 e0 31 e3 24 d3 00 3f de c0
E: 21.579823 10 02 e0 31 e2 24 fd 00 3f e3 c3
E: 21.587815 10 02 e0 31 e7 24 e8 00 3f e1 c3
E: 21.591835 10 02 e0 31 e4 24 f7 00 3f e4 c1
E: 21.599886 10 02 e0 31 e7 24 e5 00 3f e0 bd
E: 21.607831 10 02 e0 31 de 24 ef 00 3f e3 c3
E: 21.615829 10 02 e0 31 e9 24 ec 00 3f e1 bf
E: 21.623907 10 02 e0 31 e0 24 e5 00 3f e1 c3
E: 21.627911 10 02 e0 31 e4 24 e8 00 3f e0 bd
E: 21.635837 10 02 e0 31 e0 24 f6 00 3f e1 c2
E: 21.643829 10 02 e0 31 e0 24 e1 00 3f e0 bf
E: 21.651824 10 02 e0 31 e4 24 ef 00 3f e2 c1
E: 21.659835 10 02 e0 31 e3 24 e7 00 3f e0 c0
E: 21.667823 10 02 e0 31 de 24 ed 00 3f e0 c2
E: 21.671815 10 02 e0 31 e2 24 e5 00 3f e0 bd
E: 21.679824 10 02 e0 31 dc 24 f3 00 3f e2 c3
E: 21.687819 10 02 e0 31 e1 24 e1 00 3f e0 be
E: 21.691841 10 0c 00 00 00 00 00 00 00 00 00
E: 21.695833 10 02 e0 31 d9 24 f6 00 3f e3 c2
E: 21.703831 10 02 e0 31 db 24 dc 00 3f e1 c2
E: 21.707833 10 02 e0 31 d7 24 f9 00 3f e3 be
E: 21.715823 10 02 e0 31 dd 24 e4 00 3f e0 be
E: 21.723829 10 02 e0 31 de 24 fd 00 3f e2 bc
E: 21.731856 10 02 e0 31 dd 24 e8 00 3f e0 bd
E: 21.739829 10 02 e0 31 d8 24 f6 00 3f e3 c0
E: 21.743832 10 02 e0 31 dd 24 e7 00 3f df bd
E: 21.751819 10 02 e0 31 db 24 fb 00 3f e1 bc
E: 21.759827 10 02 e0 31 d9 24 e3 00 3f e1 bc
E: 21.767826 10 02 e0 31 d6 24 f7 00 3f e2 bc
E: 21.775823 10 02 e0 31 d1 24 e4 00 3f e2 be
E: 21.783823 10 02 e0 31 d5 24 f6 00 3f e1 bc
E: 21.787826 10 02 e0 31 db 24 ea 00 3f e1 be
E: 21.795825 10 02 e0 31 c9 24 e7 00 3f e3 c1
E: 21.803824 10 02 e0 31 d4 24 f8 00 3f e2 bc
E: 21.811822 10 02 e0 31 d6 24 de 00 3f e2 c2
E: 21.819823 10 02 e0 31 d2 24 e7 00 3f e4 c2
E: 21.823839 10 02 e0 31 d6 24 d0 00 3f e2 c3
E: 21.831820 10 02 e0 31 d2 24 dd 00 3f e4 c3
E: 21.839827 10 02 e0 31 dd 24 dc 00 3f e2 bc
E: 21.847818 10 02 e0 31 d3 24 c7 00 3f e3 c0
E: 21.855822 10 02 e0 31 dc 24 e8 00 3f e3 be
E: 21.859829 10 02 e0 31 db 24 c4 00 3f e2 bc
E: 21.867820 10 02 e0 31 dd 24 e0 00 3f e4 c1
E: 21.875828 10 02 e0 31 e3 24 bb 00 3f e2 bd
E: 21.883820 10 02 e0 31 e1 24 dd 00 3f e5 c2
E: 21.891839 10 02 e0 31 e9 24 d4 00 3f e0 c1
E: 21.899841 10 02 e0 31 e4 24 db 00 3f e3 bd
E: 21.903832 10 02 e0 31 e0 24 bb 00 3f e2 c2
E: 21.911817 10 02 e0 31 e3 24 e0 00 3f e4 bf
E: 21.919822 10 02 e0 31 db 24 c3 00 3f e2 c2
E: 21.927822 10 02 e0 31 dd 24 d6 00 3f e1 bc
E: 21.935848 10 02 e0 31 ce 24 d4 00 3f e3 c3
E: 21.939825 10 02 e0 31 d4 24 e6 00 3f e3 bc
E: 21.947822 10 02 e0 31 c2 24 d9 00 3f e2 c3
E: 21.955817 10 02 e0 31 ca 24 f7 00 3f e3 bf
E: 21.963823 10 02 e0 31 b5 24 d3 00 3f e2 be
E: 21.971825 10 02 e0 31 ba 24 e3 00 3f e1 bf
E: 21.975829 10 02 e0 31 ab 24 e0 00 3f e3 bc
E: 21.983822 10 02 e0 31 ad 24 f7 00 3f e3 be
E: 21.991838 10 02 e0 31 b0 24 f0 00 3f e1 c2
E: 21.999865 10 02 e0 31 9f 24 f4 00 3f e1 be
E: 22.007830 10 02 e0 31 9d 24 e9 00 3f e2 c0
E: 22.015823 10 02 e0 31 a2 24 e4 00 3f e0 bd
E: 22.019830 10 02 e0 31 9b 24 f2 00 3f e2 c1
E: 22.027821 10 02 e0 31 99 24 d6 00 3f e0 be
E: 22.035827 10 02 e0 31 9d 25 05 00 3f e1 bc
E: 22.043823 10 02 e0 31 94 24 da 00 3f e1 bf
E: 22.051820 10 02 e0 31 99 24 f3 00 3f e3 b8
E: 22.055822 10 02 e0 31 97 24 e8 00 3f e2 c3
E: 22.063896 10 02 e0 31 9b 24 de 00 3f e1 bd
E: 22.071831 10 02 e0 31 93 24 f4 00 3f e1 be
E: 22.079822 10 02 e0 31 8f 24 e5 00 3f e1 bd
E: 22.087839 10 02 e0 31 86 24 ff 00 3f e2 be
E: 22.091838 10 02 e0 31 8d 24 ea 00 3f df b8
E: 22.099819 10 02 e0 31 81 24 f0 00 3f e1 bc
E: 22.107824 10 02 e0 31 85 24 e9 00 3f e1 bc
E: 22.115822 10 02 e0 31 7d 24 fb 00 3f e3 bc
E: 22.123823 10 02 e0 31 7c 24 ea 00 3f e0 bf
E: 22.131819 10 02 e0 31 6f 25 02 00 3f e3 bc
E: 22.135818 10 02 e0 31 6f 24 ef 00 3f df bc
E: 22.143821 10 02 e0 31 6e 25 0d 00 3f e2 bc
E: 22.151821 10 02 e0 31 64 25 09 00 3f e3 bd
E: 22.159819 10 02 e0 31 61 25 09 00 3f e0 b9
E: 22.167818 10 02 e0 31 5b 25 0b 00 3f e1 c0
E: 22.171822 10 02 e0 31 5a 25 02 00 3f e0 bb
E: 22.179820 10 02 e0 31 58 25 0d 00 3f e0 bc
E: 22.187823 10 02 e0 31 51 25 1b 00 3f e0 bd
E: 22.195824 10 02 e0 31 4b 25 14 00 3f e2 bc
E: 22.203820 10 02 e0 31 43 25 0f 00 3f e1 be
E: 22.207833 10 0c 00 00 00 00 01 00 00 00 00
E: 22.211830 10 02 e0 31 37 25 23 00 3f e5 be
E: 22.215838 10 02 e0 31 46 25 16 00 2d dd bb
E: 22.223819 10 02 e0 31 31 25 23 00 3f df be
E: 22.231823 10 02 e0 31 3f 25 28 00 2e 5d b8
E: 22.239827 10 02 e0 31 39 25 25 00 2d 5a bc
E: 22.247820 10 02 e0 31 32 25 36 00 2e 5e ba
E: 22.251811 10 02 e0 31 2f 25 38 00 2e 5b ba
E: 22.259824 10 02 e0 31 35 25 43 00 2f 5a ba
E: 22.267818 10 02 e0 31 22 25 39 00 2d dc bf
E: 22.275826 10 02 e0 31 21 25 32 00 2f 5b bb
E: 22.283820 10 02 e0 31 1e 25 3a 00 2e 5b b8
E: 22.287826 10 02 e0 31 1f 25 39 00 2e 5b b9
E: 22.295818 10 02 e0 31 1c 25 30 00 2d db ba
E: 22.303823 10 02 e0 31 1f 25 46 00 2e dc ba
E: 22.311813 10 02 e0 31 17 25 47 00 2f 5a b8
E: 22.319812 10 02 e0 31 1c 25 45 00 2f 5c b9
E: 22.327814 10 02 e0 31 14 25 2d 00 2f 5a b9
E: 22.331846 10 02 e0 31 19 25 41 00 2e 5b b9
E: 22.339814 10 02 e0 31 18 25 33 00 2f 5a bb
E: 22.347808 10 02 e0 31 19 25 41 00 2e dc b9
E: 22.355818 10 02 e0 31 11 25 37 00 2f 5b b4
E: 22.363812 10 02 e0 31 18 25 35 00 2e db b8
E: 22.367816 10 02 e0 31 1f 25 3d 00 2e dc b9
E: 22.375822 10 02 e0 31 1a 25 40 00 2f 5a bf
E: 22.383812 10 02 e0 31 17 25 38 00 2e dd ba
E: 22.391810 10 02 e0 31 18 25 2a 00 2f 5c bb
E: 22.399821 10 02 e0 31 1b 25 33 00 2e 5d b8
E: 22.403824 10 02 e0 31 1c 25 26 00 2f 5a b9
E: 22.411811 10 02 e0 31 22 25 30 00 2f db b8
E: 22.419841 10 02 e0 31 1f 25 1d 00 2f 5b b9
E: 22.427813 10 02 e0 31 23 25 29 00 2e 5b ba
E: 22.435809 10 02 e0 31 23 25 2a 00 2f 5c b9
E: 22.443808 10 02 e0 31 1e 25 24 00 2e 5d b9
E: 22.447815 10 02 e0 31 29 25 2a 00 2e 5e ba
E: 22.455812 10 02 e0 31 2d 25 22 00 2d dc bf
E: 22.459814 10 0c 00 00 00 00 00 00 00 00 00
E: 22.463847 10 02 e0 31 26 25 1d 00 2e 5b b9
E: 22.471839 10 02 e0 31 2b 25 19 00 2e 5c bd
E: 22.479825 10 02 e0 31 30 25 1f 00 2e dd b5
E: 22.483823 10 02 e0 31 2f 25 14 00 2d dd b8
E: 22.491817 10 02 e0 31 2b 25 09 00 2e dc b6
E: 22.499822 10 02 e0 31 33 25 1e 00 2d de b8
E: 22.507826 10 02 e0 31 33 25 09 00 2e 5b b9
E: 22.515819 10 02 e0 31 33 25 0f 00 2e 5e b9
E: 22.519816 10 02 e0 31 2d 25 04 00 2d dc bc
E: 22.527820 10 02 e0 31 38 25 09 00 2e dd b6
E: 22.535824 10 02 e0 31 35 25 1a 00 2d de b8
E: 22.543819 10 02 e0 31 34 25 03 00 2e dc bb
E: 22.551819 10 02 e0 31 30 25 13 00 2d dd b8
E: 22.559816 10 02 e0 31 2f 25 10 00 2e dd bb
E: 22.563816 10 02 e0 31 32 25 10 00 2e dd be
E: 22.571810 10 02 e0 31 2e 24 fe 00 2e dd bf
E: 22.579811 10 02 e0 31 32 25 0b 00 2e 5f bc
E: 22.587830 10 02 e0 31 2e 24 fd 00 2e dc ba
E: 22.595835 10 02 e0 31 2e 25 0f 00 2d de bc
E: 22.599839 10 02 e0 31 33 24 fb 00 2e dc b9
E: 22.607824 10 02 e0 31 35 25 15 00 2d de b9
E: 22.615812 10 02 e0 31 35 24 fc 00 2d db ba
E: 22.623830 10 02 e0 31 2c 25 0b 00 2e 5f bf
E: 22.631835 10 02 e0 31 2e 25 06 00 2d dd bd
E: 22.635829 10 02 e0 31 2f 25 17 00 2e 5f b8
E: 22.643819 10 02 e0 31 32 25 09 00 2e 5e bc
E: 22.651811 10 02 e0 31 2d 25 0a 00 2e 5d bf
E: 22.655835 10 0c 00 00 00 00 02 00 00 00 00
E: 22.659822 10 02 e0 31 2e 25 17 00 2e de ba
E: 22.667824 10 02 e0 31 2b 24 fe 00 2e dc bd
E: 22.675824 10 02 e0 31 26 24 fd 00 2e 5d bb
E: 22.679823 10 02 e0 31 33 25 09 00 2d dd bd
E: 22.687810 10 02 e0 31 2b 24 f7 00 2f 5a b9
E: 22.695840 10 02 e0 31 29 25 18 00 2e dd bd
E: 22.703824 10 02 e0 31 2e 25 00 00 2e 5b b9
E: 22.711818 10 02 e0 31 2a 25 10 00 2e 5f bc
E: 22.715817 10 02 e0 31 2a 25 00 00 2e db b8
E: 22.723815 10 02 e0 31 26 25 12 00 2e de ba
E: 22.731902 10 02 e0 31 28 25 0f 00 2e dc bd
E: 22.739827 10 02 e0 31 22 25 14 00 2f 5d b8
E: 22.747818 10 02 e0 31 1d 25 09 00 2e 5c b9
E: 22.755832 10 02 e0 31 21 25 05 00 2f 5d b8
E: 22.759819 10 02 e0 31 25 25 1d 00 2e e0 bc
E: 22.767832 10 02 e0 31 1f 25 03 00 2f 5b b8
E: 22.775824 10 02 e0 31 21 25 11 00 2e 5e bd
E: 22.783818 10 02 e0 31 24 25 04 00 2e 5d bc
E: 22.791815 10 02 e0 31 24 25 08 00 2f 5c bb
E: 22.795822 10 02 e0 31 23 25 0b 00 2e 5e bd
E: 22.803826 10 02 e0 31 1e 24 f5 00 2f 5b be
E: 22.811820 10 02 e0 31 24 25 15 00 2e dd ba
E: 22.819818 10 02 e0 31 1d 25 09 00 2e 5a bf
E: 22.827831 10 02 e0 31 1e 25 0a 00 2e 5d bb
E: 22.831839 10 02 e0 31 1f 25 14 00 2f 5d be
E: 22.839826 10 02 e0 31 18 25 0d 00 2f dd b9
E: 22.847818 10 02 e0 31 1c 25 15 00 2f dd bd
E: 22.855817 10 02 e0 31 17 25 08 00 2f 5d b9
E: 22.863898 10 02 e0 31 1b 25 1c 00 2e de ba
E: 22.871826 10 02 e0 31 15 25 0d 00 2f 5c be
E: 22.875823 10 02 e0 31 18 25 16 00 2e de bb
E: 22.879817 10 0c 00 00 00 00 00 00 00 00 00
E: 22.883820 10 02 e0 31 19 25 01 00 2e dc b8
E: 22.891822 10 02 e0 31 16 25 16 00 2f 5e bb
E: 22.899829 10 02 e0 31 16 25 0a 00 2e dc b9
E: 22.907819 10 02 e0 31 13 25 11 00 2e dd b8
E: 22.911822 10 02 e0 31 0f 24 ff 00 2f 5b be
E: 22.919815 10 02 e0 31 14 25 11 00 2f 5e bd
E: 22.927841 10 02 e0 31 17 24 fe 00 2f 5c b9
E: 22.935819 10 02 e0 31 15 25 11 00 2f 5f b9
E: 22.943816 10 02 e0 31 13 24 fe 00 2e db bc
E: 22.947824 10 02 e0 31 14 25 15 00 2f 5e b9
E: 22.955830 10 02 e0 31 0e 25 0a 00 2f 5c be
E: 22.963839 10 02 e0 31 13 25 12 00 2f de bc
E: 22.971823 10 02 e0 31 0e 24 fe 00 2f 5c be
E: 22.979816 10 02 e0 31 1a 25 0a 00 2f dd bc
E: 22.987814 10 02 e0 31 19 25 08 00 2f 5d bd
E: 22.991812 10 02 e0 31 19 25 09 00 2f de b8
E: 22.999834 10 02 e0 31 1c 25 13 00 2e dd be
E: 23.007823 10 02 e0 31 19 24 fb 00 2f 5c bb
E: 23.015812 10 02 e0 31 28 24 f9 00 2e de ba
E: 23.023814 10 02 e0 31 1b 24 f1 00 2f 5d be
E: 23.027807 10 02 e0 31 24 25 10 00 2f 5f be
E: 23.035820 10 02 e0 31 1c 24 fa 00 2e de bc
E: 23.043816 10 02 e0 31 1c 25 0d 00 2e df bd
E: 23.051831 10 02 e0 31 1e 24 fe 00 2f 5c bf
E: 23.059901 10 02 e0 31 1c 25 12 00 2f 5e b8
E: 23.063900 10 02 e0 31 1b 25 0c 00 2e 5c bd
E: 23.071826 10 02 e0 31 1d 25 05 00 2f db b8
E: 23.079817 10 02 e0 31 16 25 0c 00 2e dc bd
E: 23.087808 10 02 e0 31 1a 25 0d 00 2f dd b8
E: 23.095827 10 02 e0 31 1c 25 19 00 2f 5e be
E: 23.103820 10 02 e0 31 17 24 ff 00 2f 5a bb
E: 23.107825 10 02 e0 31 18 25 1d 00 2f 5e bf
E: 23.115812 10 02 e0 31 14 25 07 00 2e dc bf
E: 23.123827 10 02 e0 31 19 25 0b 00 2e de bd
E: 23.131899 10 02 e0 31 12 25 09 00 2f 5c ba
E: 23.139826 10 02 e0 31 19 25 06 00 2e 5b bf
E: 23.143817 10 02 e0 31 1c 25 20 00 2f 5e bc
E: 23.151815 10 02 e0 31 1b 25 0d 00 2e 5d bf
E: 23.159815 10 02 e0 31 1f 25 0f 00 2f 5c bc
E: 23.167817 10 02 e0 31 18 25 07 00 2e db be
E: 23.175813 10 02 e0 31 1d 25 1f 00 2f dd bd
E: 23.179820 10 02 e0 31 16 25 06 00 2e dd bd
E: 23.187835 10 02 e0 31 1e 25 16 00 2e df bc
E: 23.195831 10 02 e0 31 16 25 09 00 2f dc b8
E: 23.203818 10 02 e0 31 1b 25 0a 00 2f 5c bf
E: 23.211811 10 02 e0 31 1a 25 18 00 2f 5d be
E: 23.219812 10 02 e0 31 24 25 11 00 2e 5c bd
E: 23.223831 10 02 e0 31 20 25 07 00 2f dc b9
E: 23.231830 10 02 e0 31 1f 25 14 00 2e de bc
E: 23.239825 10 02 e0 31 1c 25 0d 00 2f dc ba
E: 23.247816 10 02 e0 31 20 25 03 00 2e dc bd
E: 23.255815 10 02 e0 31 2c 25 0f 00 2e 5f bd
E: 23.259812 10 02 e0 31 29 25 03 00 2e da bf
E: 23.267821 10 02 e0 31 2b 25 0e 00 2e 5e bd
E: 23.275811 10 02 e0 31 2a 25 04 00 2e dd c0
E: 23.283815 10 02 e0 31 2b 25 0f 00 2e 5f bc
E: 23.291828 10 02 e0 31 2d 24 fd 00 2e 5c bf
E: 23.299846 10 02 e0 31 30 25 08 00 2e de bf
E: 23.303820 10 02 e0 31 30 24 f9 00 2e dc bc
E: 23.311815 10 02 e0 31 37 25 1c 00 2e 5f bc
E: 23.319816 10 02 e0 31 2f 24 f5 00 2f 5d bc
E: 23.327814 10 02 e0 31 35 25 03 00 2e 5f be
E: 23.335812 10 02 e0 31 2b 24 e7 00 2e dc bf
E: 23.339822 10 02 e0 31 39 25 07 00 2e df bf
E: 23.347812 10 02 e0 31 37 24 f1 00 2e 5d c2
E: 23.355816 10 02 e0 31 40 24 f5 00 2e 5f bd
E: 23.363899 10 02 e0 31 38 24 fd 00 2d 5c bc
E: 23.371809 10 02 e0 31 33 24 fd 00 2e e0 bc
E: 23.375823 10 02 e0 31 33 24 e7 00 2e 5a be
E: 23.383816 10 02 e0 31 35 24 fe 00 2d df bc
E: 23.391831 10 02 e0 31 39 24 ee 00 2e 5d bc
E: 23.399812 10 02 e0 31 3d 25 04 00 2e 60 bd
E: 23.407821 10 02 e0 31 33 24 e4 00 2e db bd
E: 23.415816 10 02 e0 31 38 25 01 00 2d e0 bf
E: 23.419823 10 02 e0 31 3b 24 ef 00 2e 5d bf
E: 23.427831 10 02 e0 31 36 24 f3 00 2d df c0
E: 23.435816 10 02 e0 31 39 24 e6 00 2f 5d bc
E: 23.443816 10 02 e0 31 43 25 02 00 2e e1 bf
E: 23.451819 10 02 e0 31 38 24 e0 00 2e 5d c2
E: 23.455842 10 02 e0 31 3c 24 f8 00 2e df bf
E: 23.463896 10 02 e0 31 3c 24 fb 00 2d e1 c0
E: 23.471819 10 02 e0 31 24 24 eb 00 3f e0 be
E: 23.479811 10 02 e0 31 3c 24 f7 00 2d de bf
E: 23.487814 10 02 e0 31 39 24 ed 00 2e e0 bc
E: 23.491833 10 0c 00 00 00 00 01 00 00 00 00
E: 23.499823 10 02 e0 31 36 24 fc 00 2d df bf
E: 23.507821 10 02 e0 31 1c 24 e2 00 3f e0 c0
E: 23.515831 10 02 e0 31 30 24 fa 00 2e e0 bf
E: 23.523821 10 02 e0 31 30 24 ea 00 2e dc c0
E: 23.531814 10 02 e0 31 30 24 f2 00 2d df bf
E: 23.535810 10 02 e0 31 2f 24 f4 00 2e 5d c2
E: 23.543828 10 02 e0 31 32 25 04 00 2e de bf
E: 23.551825 10 02 e0 31 32 24 f7 00 2e 5e bc
E: 23.559820 10 02 e0 31 2f 24 f8 00 2f df bd
E: 23.567814 10 02 e0 31 30 24 fa 00 2e dc bd
E: 23.571820 10 02 e0 31 2e 25 08 00 2f 5e bd
E: 23.579805 10 02 e0 31 2f 24 eb 00 2e 5c bf
E: 23.587811 10 02 e0 31 36 24 fd 00 2e 5e bc
E: 23.595813 10 02 e0 31 2a 24 ed 00 2e dc bf
E: 23.603814 10 02 e0 31 2f 25 00 00 2e df bf
E: 23.607813 10 02 e0 31 2f 25 04 00 2d de c0
E: 23.615815 10 02 e0 31 26 24 ef 00 2f dc be
E: 23.623813 10 02 e0 31 2f 25 0e 00 2e 60 bd
E: 23.631814 10 02 e0 31 21 24 ee 00 2e 5c bf
E: 23.639829 10 02 e0 31 25 25 0c 00 2f 61 bc
E: 23.647826 10 02 e0 31 22 24 f1 00 2f 5d bc
E: 23.651809 10 02 e0 31 21 25 06 00 2f 5e bc
E: 23.659814 10 02 e0 31 24 24 f4 00 2f dc bd
E: 23.667813 10 02 e0 31 24 25 0f 00 2f 5e c0
E: 23.675815 10 02 e0 31 1d 24 fd 00 30 5c bc
E: 23.683808 10 02 e0 31 1e 25 0f 00 2e de bf
E: 23.687819 10 02 e0 31 1a 24 f2 00 2e dc c3
E: 23.695814 10 02 e0 31 19 25 0c 00 2f df be
E: 23.703815 10 02 e0 31 1a 24 ff 00 2f dd bc
E: 23.711826 10 02 e0 31 1c 25 0b 00 2f 5c be
E: 23.719812 10 02 e0 31 18 24 fc 00 2f 5e c2
E: 23.723810 10 02 e0 31 19 25 04 00 2f dd be
E: 23.731813 10 02 e0 31 1e 25 06 00 2e de bf
E: 23.739812 10 02 e0 31 19 25 04 00 2f df bf
E: 23.747811 10 02 e0 31 16 24 fe 00 2f 5d c3
E: 23.751816 10 0c 00 00 00 00 00 00 00 00 00
E: 23.755824 10 02 e0 31 1b 25 08 00 2f 5d be
E: 23.763813 10 02 e0 31 18 24 fd 00 2e dd c2
E: 23.767810 10 02 e0 31 12 24 f8 00 2f dd bf
E: 23.775814 10 02 e0 31 14 25 08 00 2e de c1
E: 23.783821 10 02 e0 31 0f 25 00 00 2f da bd
E: 23.791819 10 02 e0 31 11 25 12 00 2f 5f bd
E: 23.799813 10 02 e0 31 0d 24 fd 00 2f dc bf
E: 23.803815 10 02 e0 31 0b 25 12 00 2f 5d c2
E: 23.811815 10 02 e0 31 0d 25 18 00 2f de ba
E: 23.819812 10 02 e0 31 0a 25 0f 00 2f 5e c2
E: 23.827814 10 02 e0 31 09 25 0a 00 30 dc be
E: 23.835805 10 02 e0 31 05 25 19 00 2f dd c0
E: 23.843806 10 02 e0 31 0c 25 10 00 2f de bc
E: 23.847818 10 02 e0 31 06 25 1b 00 2f dd c2
E: 23.855812 10 02 e0 31 0a 25 15 00 2f dc b8
E: 23.863811 10 02 e0 31 0c 25 18 00 2f 5c bc
E: 23.871809 10 02 e0 31 09 25 18 00 30 5d bd
E: 23.879812 10 02 e0 31 07 25 19 00 30 5e c1
E: 23.883808 10 02 e0 31 07 25 1a 00 30 5d bc
E: 23.891811 10 02 e0 31 0c 25 1c 00 2f db c2
E: 23.899813 10 02 e0 31 11 25 2a 00 2f df be
E: 23.907805 10 02 e0 31 10 25 0c 00 2f dc bc
E: 23.915812 10 02 e0 31 0f 25 20 00 2f 5e be
E: 23.919810 10 02 e0 31 11 25 1a 00 2f dc bc
E: 23.927812 10 02 e0 31 0e 25 16 00 2e db bd
E: 23.935817 10 02 e0 31 16 25 2d 00 2f df bd
E: 23.943835 10 02 e0 31 0f 25 12 00 2f 5c bd
E: 23.951812 10 02 e0 31 0a 25 0e 00 2e dc c2
E: 23.959812 10 02 e0 31 11 25 0b 00 2f dd bd
E: 23.963815 10 02 e0 31 08 25 1a 00 2f dc c2
E: 23.971812 10 02 e0 31 12 25 20 00 2f 5e be
E: 23.979812 10 02 e0 31 10 25 11 00 2f 5b be
E: 23.987811 10 02 e0 31 0e 25 1b 00 2f de bd
E: 23.995812 10 02 e0 31 10 25 17 00 2f 5c c1
E: 23.999808 10 02 e0 31 0c 25 0c 00 2f db bc
E: 24.007812 10 02 e0 31 11 25 1c 00 30 5e bd
E: 24.015813 10 02 e0 31 0c 25 0e 00 2f 5b be
E: 24.023811 10 02 e0 31 10 25 2d 00 2f df c1
E: 24.031812 10 02 e0 31 0b 25 11 00 2f dc bd
E: 24.035817 10 02 e0 31 10 25 24 00 2f 5e be
E: 24.043827 10 02 e0 31 10 25 0c 00 2f da bc
E: 24.047829 10 0c 00 00 00 00 10 00 00 00 00
E: 24.051823 10 02 e0 31 0f 25 29 00 2f dc c2
E: 24.059815 10 02 e0 31 10 25 1f 00 2f dd bc
E: 24.067812 10 02 e0 31 0f 25 12 00 2e dd bf
E: 24.075813 10 02 e0 31 0f 25 19 00 2e dc c1
E: 24.079817 10 02 e0 31 0f 25 14 00 2f de bc
E: 24.087817 10 02 e0 31 10 25 19 00 2f 5c c3
E: 24.095812 10 02 e0 31 13 25 1c 00 30 5e bd
E: 24.103808 10 02 e0 31 0d 25 16 00 2f db c3
E: 24.111823 10 02 e0 31 10 25 22 00 2f dd be
E: 24.115827 10 02 e0 31 0e 25 09 00 2f dc bc
E: 24.123813 10 02 e0 31 1b 25 29 00 2f 5c be
E: 24.131811 10 02 e0 31 14 25 16 00 2f dc bc
E: 24.139822 10 02 e0 31 09 25 17 00 30 5c c3
E: 24.147827 10 02 e0 31 10 25 28 00 2f de bf
E: 24.151817 10 02 e0 31 04 25 0b 00 2f d9 bc
E: 24.159808 10 02 e0 31 09 25 2b 00 2f 5e bc
E: 24.167804 10 02 e0 31 07 25 19 00 30 5b bd
E: 24.175822 10 02 e0 31 05 25 24 00 2f 5c bd
E: 24.183815 10 02 e0 31 01 25 1d 00 30 5c be
E: 24.191812 10 02 e0 31 04 25 1d 00 2f 5c bc
E: 24.195816 10 02 e0 31 03 25 1a 00 30 dc bc
E: 24.203808 10 02 e0 31 00 25 2a 00 30 5d bc
E: 24.211827 10 02 e0 31 07 25 2a 00 30 5d bf
E: 24.219813 10 02 e0 31 02 25 14 00 30 5b c3
E: 24.227817 10 02 e0 31 07 25 2d 00 2f df bc
E: 24.231814 10 0c 00 00 00 00 00 00 00 00 00
E: 24.239810 10 02 e0 31 07 25 25 00 30 5d c3
E: 24.247872 10 02 e0 31 02 25 13 00 2f df bf
E: 24.255820 10 02 e0 31 00 25 0e 00 2f 5b bd
E: 24.263835 10 02 e0 31 08 25 1b 00 2f 5e bd
E: 24.267840 10 02 e0 31 06 25 10 00 2f db bc
E: 24.275835 10 02 e0 31 07 25 19 00 2f dc c2
E: 24.283883 10 02 e0 31 06 25 08 00 30 5d bc
E: 24.291883 10 02 e0 31 08 25 1a 00 2f 5b c1
E: 24.299842 10 02 e0 31 08 25 0d 00 30 5d bc
E: 24.307885 10 02 e0 31 0b 25 18 00 2f df bf
E: 24.311888 10 02 e0 31 0b 25 0d 00 30 5b bf
E: 24.319882 10 02 e0 31 07 25 0e 00 30 5d bc
E: 24.327883 10 02 e0 31 09 25 1b 00 2f 5c bc
E: 24.335884 10 02 e0 31 05 25 12 00 2f 5d bc
E: 24.343882 10 02 e0 31 07 25 13 00 30 dd bd
E: 24.347888 10 02 e0 31 09 25 17 00 2f 5e c2
E: 24.355883 10 02 e0 31 03 25 1c 00 2f db bf
E: 24.363882 10 02 e0 31 07 25 08 00 2f dc bc
E: 24.371883 10 02 e0 31 0d 25 26 00 30 5e bf
E: 24.379880 10 02 e0 31 03 25 2d 00 2f 5e bc
E: 24.387884 10 02 e0 31 06 25 16 00 30 5a be
E: 24.391889 10 02 e0 30 fe 25 15 00 30 da bc
E: 24.399885 10 02 e0 30 ff 25 1b 00 30 dc bf
E: 24.407885 10 02 e0 31 04 25 28 00 2f dd c0
E: 24.415883 10 02 e0 30 f8 25 1a 00 2f d9 bc
E: 24.423883 10 02 e0 30 fa 25 25 00 30 da bc
E: 24.427888 10 02 e0 30 fb 25 2e 00 31 5c bf
E: 24.435883 10 02 e0 30 ff 25 3e 00 30 5e bd
E: 24.443881 10 02 e0 30 fd 25 2e 00 2f 5b bf
E: 24.451883 10 02 e0 30 f9 25 24 00 30 d8 bb
E: 24.459883 10 02 e0 30 ff 25 2b 00 30 5b bf
E: 24.463887 10 02 e0 30 f8 25 2f 00 2f 5f bd
E: 24.471883 10 02 e0 30 fe 25 2b 00 2f db bc
E: 24.479880 10 02 e0 31 00 25 1e 00 30 d9 bf
E: 24.487881 10 02 e0 31 08 25 1b 00 30 db bb
E: 24.495883 10 02 e0 31 03 25 2a 00 2f dd c3
E: 24.503882 10 02 e0 31 0b 25 22 00 2e db bc
E: 24.507887 10 02 e0 31 15 25 22 00 2f db b9
E: 24.515882 10 02 e0 31 15 25 2e 00 2f 5d bc
E: 24.523881 10 02 e0 31 1c 25 1e 00 2e 5c c1
E: 24.531882 10 02 e0 31 18 25 13 00 2f 5a bf
E: 24.539882 10 02 e0 31 1c 25 15 00 2f dc be
E: 24.543903 10 02 e0 31 1e 25 35 00 2d de be
E: 24.551882 10 02 e0 31 1c 25 1a 00 2f 5b bf
E: 24.559882 10 02 e0 31 18 25 2e 00 2f 5d ba
E: 24.567882 10 02 e0 31 10 25 28 00 2e de be
E: 24.575882 10 02 e0 31 0f 25 25 00 2f dc be
E: 24.579884 10 02 e0 31 0d 25 1c 00 30 5a ba
E: 24.587881 10 02 e0 31 06 25 32 00 30 5e be
E: 24.595882 10 02 e0 31 00 25 28 00 2f 5e bf
E: 24.603879 10 02 e0 31 02 25 37 00 2f 5e be
E: 24.611880 10 02 e0 30 fe 25 1e 00 30 5a bf
E: 24.619811 10 02 e0 30 ff 25 18 00 2f 5a b9
E: 24.623886 10 02 e0 30 fe 25 23 00 30 5a b9
E: 24.631881 10 02 e0 30 f9 25 2d 00 2f dd bc
E: 24.635887 10 0c 00 00 00 00 10 00 00 00 00
E: 24.639821 10 02 e0 30 fb 25 30 00 30 5c bf
E: 24.647851 10 02 e0 30 f7 25 2f 00 2f db be
E: 24.655818 10 02 e0 30 fa 25 21 00 30 da b9
E: 24.659850 10 02 e0 30 fe 25 26 00 30 dc b8
E: 24.667881 10 02 e0 31 00 25 29 00 2f de bf
E: 24.675881 10 02 e0 31 0a 25 48 00 2f dd c2
E: 24.683881 10 02 e0 30 fc 25 21 00 2f dc be
E: 24.691881 10 02 e0 31 0b 25 21 00 2f da ba
E: 24.695885 10 02 e0 31 0b 25 2a 00 2f dc be
E: 24.703880 10 02 e0 31 09 25 2c 00 2f df bd
E: 24.711820 10 02 e0 31 09 25 1d 00 2e dc be
E: 24.719816 10 02 e0 31 09 25 1c 00 30 5a be
E: 24.727881 10 02 e0 31 0b 25 1e 00 30 5d bb
E: 24.735881 10 02 e0 31 0b 25 31 00 2e de bc
E: 24.739886 10 02 e0 31 0e 25 16 00 2f da bd
E: 24.747879 10 02 e0 31 08 25 18 00 2f d9 bd
E: 24.755881 10 02 e0 31 0c 25 13 00 2f dc bb
E: 24.763883 10 02 e0 31 0a 25 1e 00 2f 5d bd
E: 24.771881 10 02 e0 31 08 25 20 00 2f 5d bd
E: 24.775885 10 02 e0 31 06 25 17 00 30 5a bf
E: 24.783881 10 02 e0 31 0a 25 1f 00 2f dc be
E: 24.791881 10 02 e0 31 09 25 1b 00 2e dd bc
E: 24.799881 10 02 e0 31 0b 25 0d 00 2f 59 bd
E: 24.807882 10 02 e0 31 0a 25 0b 00 2f dc be
E: 24.811887 10 0c 00 00 00 00 00 00 00 00 00
E: 24.819817 10 02 e0 31 14 25 15 00 2e 5d c1
E: 24.827812 10 02 e0 31 14 25 0a 00 2f db bf
E: 24.835804 10 02 e0 31 1a 25 10 00 2e df bf
E: 24.843816 10 02 e0 31 18 25 08 00 2e dc be
E: 24.851815 10 02 e0 31 1a 25 09 00 2f 5d be
E: 24.855819 10 02 e0 31 23 24 ff 00 2e de bc
E: 24.863814 10 02 e0 31 23 25 09 00 2e 5d bc
E: 24.871815 10 02 e0 31 24 24 fc 00 2e 5c bf
E: 24.879812 10 02 e0 31 29 24 f8 00 2f 5c b9
E: 24.887810 10 02 e0 31 24 24 fc 00 2e df be
E: 24.891812 10 02 e0 31 2a 25 03 00 2e 5f bc
E: 24.899825 10 02 e0 31 27 24 ed 00 2e 5c b9
E: 24.907835 10 02 e0 31 2b 24 fa 00 2f 5d ba
E: 24.915890 10 02 e0 31 2c 25 01 00 2e 5f bc
E: 24.923819 10 02 e0 31 29 24 e2 00 2e dc bc
E: 24.931832 10 02 e0 31 2b 24 f8 00 2f 5f bf
E: 24.935835 10 02 e0 31 35 25 04 00 2e e3 bf
E: 24.943833 10 02 e0 31 31 24 f7 00 2e dc bc
E: 24.951880 10 02 e0 31 33 24 ea 00 2e 5a bc
E: 24.959880 10 02 e0 31 34 24 f1 00 2f de b8
E: 24.967880 10 02 e0 31 36 24 ef 00 2e 5e bd
E: 24.971880 10 02 e0 31 35 24 f5 00 2f de b8
E: 24.979878 10 02 e0 31 3f 24 ef 00 2d de bc
E: 24.987880 10 02 e0 31 3f 24 e5 00 2e 5e be
E: 24.995877 10 02 e0 31 35 24 e0 00 2e 5c bd
E: 25.003879 10 02 e0 31 3f 25 01 00 2e e0 be
E: 25.007886 10 02 e0 31 2b 24 e4 00 3f e0 be
E: 25.015880 10 02 e0 31 41 24 f5 00 2e 60 bf
E: 25.023879 10 02 e0 31 2e 24 d7 00 3f e1 bd
E: 25.031879 10 02 e0 31 42 24 e4 00 2e 5f bc
E: 25.039880 10 02 e0 31 40 24 d5 00 2e 5f bc
E: 25.047880 10 02 e0 31 30 24 ea 00 3f e2 be
E: 25.051885 10 02 e0 31 41 24 c5 00 2e dd bc
E: 25.059880 10 02 e0 31 41 24 d8 00 2d e1 bd
E: 25.067879 10 02 e0 31 2c 24 c2 00 3f e0 be
E: 25.075879 10 02 e0 31 3d 24 d0 00 2e 60 b9
E: 25.083880 10 02 e0 31 1f 24 ae 00 3f e2 bf
E: 25.087886 10 02 e0 31 34 24 c4 00 2f 60 ba
E: 25.095877 10 02 e0 31 2d 24 cc 00 2e e1 c3
E: 25.103876 10 02 e0 31 2a 24 b6 00 2e df bb
E: 25.111879 10 02 e0 31 2c 24 bd 00 2e 60 bf
E: 25.119881 10 02 e0 31 25 24 c5 00 2f e1 bb
E: 25.123884 10 02 e0 31 1a 24 b6 00 2e e2 bf
E: 25.131879 10 02 e0 31 1c 24 b4 00 2f e0 bc
E: 25.139878 10 02 e0 31 17 24 ad 00 2f 5f bc
E: 25.147880 10 02 e0 31 12 24 b2 00 2f df ba
E: 25.155879 10 02 e0 31 14 24 c8 00 2f e3 bc
E: 25.163878 10 02 e0 31 0b 24 a9 00 2f df bc
E: 25.167885 10 02 e0 31 0e 24 bf 00 30 62 bf
E: 25.175879 10 02 e0 31 03 24 a0 00 30 5f be
E: 25.183878 10 02 e0 31 05 24 c2 00 2f e2 ba
E: 25.191879 10 02 e0 31 09 24 a7 00 2f e0 bf
E: 25.199879 10 02 e0 31 0a 24 ac 00 2f 62 bc
E: 25.203878 10 02 e0 31 06 24 a6 00 2f e0 bf
E: 25.211880 10 02 e0 31 08 24 b0 00 2f 60 bf
E: 25.219879 10 02 e0 31 09 24 ae 00 30 e2 b9
E: 25.227879 10 02 e0 31 08 24 ab 00 2f 61 bf
E: 25.235881 10 02 e0 31 10 24 ac 00 30 60 be
E: 25.239884 10 02 e0 31 14 24 a7 00 2f 5f bf
E: 25.247879 10 02 e0 31 0d 24 b6 00 2f e1 b8
E: 25.255878 10 02 e0 31 0c 24 c0 00 2e e1 be
E: 25.263879 10 02 e0 31 0f 24 ae 00 2f 5f b8
E: 25.271879 10 02 e0 31 10 24 c2 00 2f 61 bc
E: 25.279879 10 02 e0 31 14 24 b7 00 2e e0 bf
E: 25.283881 10 02 e0 31 10 24 ac 00 2f df bc
E: 25.291880 10 02 e0 31 14 24 b4 00 2f e0 bf
E: 25.299878 10 02 e0 31 0d 24 a9 00 2f dc bd
E: 25.307879 10 02 e0 31 17 24 c4 00 2f 62 b9
E: 25.315879 10 02 e0 31 0b 24 b8 00 2f 5f bc
E: 25.319882 10 02 e0 31 09 24 bb 00 2f e0 b9
E: 25.327877 10 02 e0 31 09 24 c9 00 2f e2 bc
E: 25.335880 10 02 e0 31 05 24 b6 00 2f 5d bb
E: 25.343819 10 02 e0 31 03 24 c7 00 30 60 b8
E: 25.351878 10 02 e0 30 fb 24 c5 00 2f df bd
E: 25.355883 10 02 e0 31 00 24 cb 00 2f df b9
E: 25.363878 10 02 e0 30 f9 24 d1 00 2f df ba
E: 25.367883 10 0c 00 00 00 00 08 00 00 00 00
E: 25.371819 10 02 e0 30 f6 24 bf 00 30 dd b9
E: 25.379836 10 02 e0 30 f4 24 dd 00 2f e0 be
E: 25.387815 10 02 e0 30 f4 24 c5 00 30 5e bb
E: 25.395819 10 02 e0 30 f6 24 dc 00 2f df b9
E: 25.399814 10 02 e0 30 f0 24 d0 00 30 dd b9
E: 25.407804 10 02 e0 30 f3 24 e7 00 30 e0 bc
E: 25.415799 10 02 e0 30 e9 24 ce 00 2f df be
E: 25.423802 10 02 e0 30 ee 24 da 00 31 5e ba
E: 25.431799 10 02 e0 30 ef 24 dd 00 30 5e bf
E: 25.435801 10 02 e0 30 f6 24 e3 00 30 df bb
E: 25.443816 10 02 e0 30 ee 24 dd 00 30 5e be
E: 25.451887 10 02 e0 30 ef 24 e6 00 31 de b8
E: 25.459815 10 02 e0 30 ed 24 f6 00 30 5f bd
E: 25.467807 10 02 e0 30 ee 24 dd 00 30 dd ba
E: 25.475805 10 02 e0 30 ea 24 f4 00 30 5f be
E: 25.479822 10 02 e0 30 f1 24 e4 00 2f de b9
E: 25.487805 10 02 e0 30 ed 24 f1 00 2f df ba
E: 25.495806 10 02 e0 30 ef 24 e1 00 31 5c ba
E: 25.503818 10 02 e0 30 ed 24 f3 00 30 60 b9
E: 25.511814 10 02 e0 30 f2 24 df 00 31 5d bb
E: 25.515826 10 02 e0 30 f0 24 ea 00 2f df bd
E: 25.523802 10 02 e0 30 f5 24 e2 00 30 5e b8
E: 25.531804 10 02 e0 30 f1 24 e1 00 2f de bd
E: 25.539821 10 02 e0 30 f1 24 e5 00 30 de bb
E: 25.547887 10 02 e0 30 f9 24 e3 00 30 5f bf
E: 25.551816 10 02 e0 30 fa 24 ea 00 30 60 b9
E: 25.559810 10 02 e0 30 f8 24 e0 00 2f df bf
E: 25.567804 10 02 e0 30 f6 24 f1 00 30 5f b8
E: 25.575820 10 02 e0 30 f9 24 e2 00 30 5d bc
E: 25.583798 10 02 e0 30 f6 24 f2 00 30 60 ba
E: 25.591812 10 02 e0 30 f9 24 de 00 2f de bc
E: 25.595808 10 0c 00 00 00 00 00 00 00 00 00
E: 25.603803 10 02 e0 30 fa 24 dd 00 30 5d bc
E: 25.611838 10 02 e0 30 fd 24 f4 00 30 5e ba
E: 25.619811 10 02 e0 30 fa 24 e5 00 2f de bd
E: 25.627800 10 02 e0 31 0b 24 f5 00 2f df b9
E: 25.631809 10 02 e0 31 09 24 ed 00 30 dd b8
E: 25.639820 10 02 e0 31 0a 24 eb 00 2e e0 c0
E: 25.647833 10 02 e0 31 0d 24 f1 00 30 5f bd
E: 25.655815 10 02 e0 31 0b 24 e3 00 2f 5e bd
E: 25.663803 10 02 e0 31 1a 24 ef 00 2e e0 bd
E: 25.667801 10 02 e0 31 16 24 e0 00 2e dd bc
E: 25.675803 10 02 e0 31 16 24 e5 00 2f 5e be
E: 25.683795 10 02 e0 31 22 24 ee 00 2e df be
E: 25.691811 10 02 e0 31 21 24 e5 00 2e df bd
E: 25.699804 10 02 e0 31 24 24 e7 00 2e e0 c3
E: 25.707805 10 02 e0 31 28 24 ea 00 2f 5d be
E: 25.711805 10 02 e0 31 21 24 d9 00 2e 5c c1
E: 25.719801 10 02 e0 31 30 24 f3 00 2f 60 bd
E: 25.727799 10 02 e0 31 32 24 e4 00 2e df c3
E: 25.735795 10 02 e0 31 36 24 f3 00 2d df c2
E: 25.743819 10 02 e0 31 2c 24 ec 00 2f 5e bd
E: 25.747817 10 02 e0 31 3c 24 fa 00 2e 60 c0
E: 25.755805 10 02 e0 31 38 24 fa 00 2e e0 bf
E: 25.763803 10 02 e0 31 1d 24 ee 00 3f df c2
E: 25.771805 10 02 e0 31 3b 25 0d 00 2e 60 bc
E: 25.779805 10 02 e0 31 32 24 e0 00 2e 5d bc
E: 25.783799 10 0c 01 00 00 00 00 00 00 00 00
E: 25.791806 10 02 e0 31 30 24 e3 00 2e de bd
E: 25.799803 10 02 e0 31 36 25 0a 00 2e e2 c1
E: 25.807807 10 02 e0 31 2b 24 d1 00 2e 5d be
E: 25.815820 10 02 e0 31 30 24 f5 00 2e 5f c3
E: 25.823811 10 02 e0 31 2f 24 e5 00 2f dc bd
E: 25.827802 10 02 e0 31 2b 24 ea 00 2e 60 c1
E: 25.835801 10 02 e0 31 24 24 e2 00 2e 5f c1
E: 25.843820 10 02 e0 31 26 24 f1 00 2e df c3
E: 25.851813 10 02 e0 31 1a 24 ce 00 2f 5e bf
E: 25.859804 10 02 e0 31 1c 24 f3 00 2f 5f c2
E: 25.863800 10 02 e0 31 11 24 dc 00 2e 5e c0
E: 25.871800 10 02 e0 31 0b 24 df 00 2f df bc
E: 25.879832 10 0c 00 80 00 00 00 00 00 00 00
E: 25.887809 10 02 e0 31 05 24 f5 00 30 df bf
E: 25.895805 10 02 e0 30 fe 24 e9 00 30 5f c3
E: 25.899805 10 02 e0 30 fc 24 ed 00 30 5d be
E: 25.907806 10 02 e0 30 f5 25 08 00 30 5f c0
E: 25.915843 10 02 e0 30 eb 24 ef 00 30 dd be
E: 25.923809 10 02 e0 30 ea 25 12 00 30 df bf
E: 25.931803 10 02 e0 30 de 24 fd 00 30 db bf
E: 25.939804 10 02 e0 30 e6 25 14 00 31 60 c1
E: 25.943808 10 0c 00 10 00 00 00 00 00 00 00
E: 25.951810 10 02 e0 30 de 25 13 00 31 de bc
E: 25.959805 10 02 e0 30 d6 24 f7 00 30 dc c0
E: 25.967803 10 02 e0 30 e1 25 25 00 30 de bc
E: 25.975808 10 02 e0 30 df 25 11 00 30 da bc
E: 25.979850 10 02 e0 30 df 25 28 00 30 de bc
E: 25.983819 10 0c 00 08 00 00 00 00 00 00 00
E: 25.987813 10 02 e0 30 de 25 1c 00 31 da c2
E: 25.995804 10 02 e0 30 df 25 24 00 30 5c c2
E: 26.003802 10 02 e0 30 e3 25 29 00 31 5e be
E: 26.011825 10 02 e0 30 e0 25 2a 00 30 5c c2
E: 26.019813 10 02 e0 30 e5 25 22 00 30 da c1
E: 26.023812 10 02 e0 30 e5 25 36 00 30 5d c3
E: 26.027797 10 0c 00 04 00 00 00 00 00 00 00
E: 26.031806 10 02 e0 30 ea 25 16 00 31 5a c0
E: 26.039808 10 02 e0 30 f3 25 35 00 30 5c c2
E: 26.043834 10 0c 00 02 00 00 00 00 00 00 00
E: 26.047814 10 02 e0 30 f2 25 12 00 30 db c2
E: 26.055811 10 02 e0 30 fa 25 29 00 30 dc c2
E: 26.059812 10 02 e0 30 f6 25 1a 00 2f dd c0
E: 26.063807 10 0c 00 01 00 00 00 00 00 00 00
E: 26.067808 10 02 e0 31 01 25 19 00 2f db bd
E: 26.075807 10 02 e0 31 00 25 2a 00 2f dd c3
E: 26.083809 10 02 e0 30 fd 25 10 00 30 5b c3
E: 26.091808 10 02 e0 31 04 25 29 00 30 5e c3
E: 26.095807 10 02 e0 31 00 25 25 00 2f dd c6
E: 26.099806 10 0c 00 00 00 00 00 00 00 00 00
E: 26.103810 10 02 e0 31 0e 25 1d 00 30 5e bd
E: 26.111796 10 02 e0 31 0c 25 14 00 2e dc c5
E: 26.119807 10 02 e0 31 14 25 1d 00 2f de c3
E: 26.127802 10 02 e0 31 11 25 09 00 2f 5c c3
E: 26.135801 10 02 e0 31 1f 25 1a 00 2f 5e c0
E: 26.139820 10 02 e0 31 11 24 fd 00 2f 5e c3
E: 26.143816 10 0c 00 01 00 00 00 00 00 00 00
E: 26.147810 10 02 e0 31 18 25 0b 00 30 de c2
E: 26.155803 10 02 e0 31 1b 24 fa 00 2e de c4
E: 26.163802 10 02 e0 31 23 25 07 00 2f de c1
E: 26.171803 10 02 e0 31 21 24 ef 00 2e dd c5
E: 26.175810 10 02 e0 31 26 24 ea 00 2f 5f c3
E: 26.183812 10 02 e0 31 2b 24 ec 00 2e de c0
E: 26.191808 10 02 e0 31 31 24 e2 00 2e de c1
E: 26.199798 10 02 e0 31 31 24 e5 00 2e 5f c0
E: 26.207798 10 02 e0 31 38 24 e5 00 2e e0 c3
E: 26.211808 10 02 e0 31 45 24 d7 00 2d de c2
E: 26.219802 10 02 e0 31 5f 24 db 00 2e 60 c2
E: 26.223797 10 0c 00 02 00 00 00 00 00 00 00
E: 26.227801 10 02 e0 31 7b 24 c6 00 3f e1 c0
E: 26.235803 10 02 e0 31 a8 24 b8 00 3f e4 be
E: 26.243841 10 02 e0 31 db 24 96 00 3f e3 bc
E: 26.247810 10 0c 00 04 00 00 00 00 00 00 00
E: 26.251809 10 02 e0 32 04 24 99 00 3f e8 bb
E: 26.255810 10 02 e0 32 2b 24 65 00 3f e6 b4
E: 26.263800 10 02 e0 32 4c 24 65 00 3e 65 b6
E: 26.271798 10 02 e0 32 68 24 42 00 3d e2 b1
E: 26.279871 10 02 e0 32 80 24 43 00 3c e4 b1
E: 26.287811 10 02 e0 32 a0 24 3c 00 3b e4 ae
E: 26.291806 10 0c 00 10 00 00 00 00 00 00 00
E: 26.299803 10 02 e0 32 ca 24 13 00 3a e5 ac
E: 26.307807 10 02 e0 32 e8 24 0c 00 39 e3 a5
E: 26.311822 10 0c 00 20 00 00 00 00 00 00 00
E: 26.315810 10 02 e0 33 03 23 ed 00 38 e2 a9
E: 26.323808 10 02 e0 33 1f 23 eb 00 39 64 a7
E: 26.327806 10 0c 00 40 00 00 00 00 00 00 00
E: 26.335802 10 02 e0 33 55 23 bf 00 37 e3 a2
E: 26.343803 10 02 e0 33 74 23 a7 00 37 63 9d
E: 26.351814 10 02 e0 33 84 23 98 00 36 63 9f
E: 26.359801 10 02 e0 33 94 23 91 00 36 65 99
E: 26.363805 10 0c 00 80 00 00 00 00 00 00 00
E: 26.367804 10 02 e0 33 9c 23 7d 00 34 e3 9f
E: 26.371808 10 02 e0 33 a5 23 87 00 35 65 99
E: 26.379843 10 02 e0 33 a6 23 78 00 35 65 98
E: 26.383814 10 0c 01 00 00 00 00 00 00 00 00
E: 26.387812 10 02 e0 33 a5 23 71 00 34 e6 99
E: 26.395801 10 02 e0 33 9f 23 60 00 34 e6 94
E: 26.403803 10 02 e0 33 82 23 49 00 35 67 9e
E: 26.407822 10 02 e0 33 65 23 46 00 36 e9 a3
E: 26.415792 10 02 e0 33 3e 23 34 00 37 e9 ab
E: 26.423805 10 02 e0 33 09 23 1b 00 39 e5 b6
E: 26.431801 10 02 e0 32 ed 23 2d 00 3b ea be
E: 26.439798 10 02 e0 32 d1 23 01 00 3d e9 c7
E: 26.443806 10 02 e0 32 cf 23 01 00 3d 6c cc
E: 26.451799 10 02 e0 32 ca 22 ef 00 3d e9 d7
E: 26.459802 10 02 a0 32 c2 23 32 00 3c ea df
E: 26.467791 10 02 a0 32 c4 23 06 00 3d e6 dd
E: 26.475792 10 02 a0 32 9f 22 bb 00 3c 62 e9
E: 26.479803 10 02 80 00 00 00 00 00 00 00 00
E: 26.691802 10 0c 00 00 00 00 00 00 00 00 00
E: 27.415799 10 0c 00 00 00 00 00 10 00 00 00
E: 27.611797 10 0c 00 00 00 00 00 00 00 00 00
E: 27.923790 10 0c 00 00 00 00 00 01 00 00 00
E: 28.119796 10 0c 00 00 00 00 00 00 00 00 00
E: 28.283792 10 0c 00 00 00 00 00 04 00 00 00
E: 28.419796 10 0c 00 00 00 00 00 00 00 00 00
E: 28.703794 10 0c 00 00 00 00 00 02 00 00 00
E: 28.883790 10 0c 00 00 00 00 00 00 00 00 00
E: 29.019792 10 0c 00 00 00 00 00 08 00 00 00
E: 29.167789 10 0c 00 00 00 00 00 00 00 00 00
E: 29.411787 10 0c 00 00 10 00 00 00 00 00 00
E: 29.431785 10 0c 00 00 08 00 00 00 00 00 00
E: 29.511788 10 0c 00 00 04 00 00 00 00 00 00
E: 29.551787 10 0c 00 00 02 00 00 00 00 00 00
E: 29.571784 10 0c 00 00 01 00 00 00 00 00 00
E: 29.595789 10 0c 00 00 00 80 00 00 00 00 00
E: 29.639785 10 0c 00 00 00 10 00 00 00 00 00
E: 29.695787 10 0c 00 00 00 08 00 00 00 00 00
E: 29.735786 10 0c 00 00 00 04 00 00 00 00 00
E: 29.899783 10 0c 00 00 00 08 00 00 00 00 00
E: 29.923783 10 0c 00 00 00 10 00 00 00 00 00
E: 29.939780 10 0c 00 00 00 20 00 00 00 00 00
E: 29.963785 10 0c 00 00 00 40 00 00 00 00 00
E: 30.007787 10 0c 00 00 01 00 00 00 00 00 00
E: 30.047783 10 0c 00 00 04 00 00 00 00 00 00
E: 30.083784 10 0c 00 00 08 00 00 00 00 00 00
E: 30.183781 10 0c 00 00 10 00 00 00 00 00 00
E: 30.371783 10 0c 00 00 00 00 00 00 00 00 00
E: 30.831782 10 02 c2 82 30 89 06 42 70 00 00
E: 30.839769 10 02 e0 36 68 24 e2 00 39 e4 99
E: 30.847783 10 02 e0 35 d2 25 3c 00 3b e1 93
E: 30.855851 10 02 e0 35 36 25 ae 00 3f dc 92
E: 30.863850 10 02 e0 34 c4 26 09 00 31 df 8c
E: 30.867857 10 02 e0 34 5d 26 4b 00 34 6e 89
E: 30.875783 10 02 e0 33 fe 26 9b 00 34 e8 7e
E: 30.883853 10 02 e0 33 93 26 f9 00 36 e3 74
E: 30.887857 10 02 e0 33 30 27 6f 00 35 dd 6e
E: 30.895852 10 02 e0 32 c8 27 e8 00 37 5a 6a
E: 30.903855 10 02 e0 32 6e 28 5a 00 37 d8 61
E: 30.907859 10 02 e0 32 2e 28 c7 00 37 d5 63
E: 30.915851 10 02 e0 32 0a 29 34 00 37 d6 6a
E: 30.923851 10 02 e0 32 00 29 aa 00 37 53 69
E: 30.927856 10 02 e0 32 04 2a 27 00 36 d1 76
E: 30.935851 10 02 e0 32 1a 2a 9c 00 36 d1 74
E: 30.943852 10 02 e0 32 38 2b 13 00 39 5b 5c
E: 30.947855 10 02 e0 32 59 2b b3 00 37 d4 59
E: 30.955809 10 02 e0 32 7c 2c 66 00 36 d3 5a
E: 30.959849 10 02 e0 32 ac 2d 0f 00 36 d2 55
E: 30.967851 10 02 e0 32 ee 2d ab 00 35 d0 59
E: 30.975851 10 02 e0 33 49 2e 38 00 34 4d 5a
E: 30.979855 10 02 e0 33 b9 2e c6 00 34 4d 5c
E: 30.987850 10 02 e0 34 47 2f 41 00 32 50 4f
E: 30.995848 10 02 e0 34 d0 2f ca 00 32 4f 4b
E: 31.003850 10 02 e0 35 71 30 48 00 30 ce 49
E: 31.011789 10 02 e0 35 ea 30 a3 1f b3 cb 4b
E: 31.019851 10 02 e0 36 58 30 f5 2f b3 4a 46
E: 31.023855 10 02 e0 36 e3 31 40 32 f3 ca 48
E: 31.031850 10 02 e0 37 83 31 82 33 b3 ca 48
E: 31.039851 10 02 e0 38 26 31 b1 34 72 ca 49
E: 31.047850 10 02 e0 38 c0 31 ca 34 71 ca 4d
E: 31.055851 10 02 e0 39 60 31 e6 34 70 4b 4a
E: 31.059853 10 02 e0 39 eb 31 ed 34 33 48 4c
E: 31.067850 10 02 e0 3a 74 31 de 31 f3 c8 4d
E: 31.075850 10 02 e0 3b 05 31 c9 31 33 48 48
E: 31.083851 10 02 e0 3b 89 31 aa 2f f3 48 4f
E: 31.091850 10 02 e0 3c 03 31 82 27 32 c7 4f
E: 31.099850 10 02 e0 3c 5b 31 3e 00 31 c8 4a
E: 31.103856 10 02 e0 3c 82 30 e1 00 31 48 49
E: 31.111850 10 02 e0 3c 86 30 7e 00 30 c8 4f
E: 31.119802 10 02 e0 3c 6d 30 05 00 30 cc 50
E: 31.127850 10 02 e0 3c 51 2f 95 00 32 50 5f
E: 31.135850 10 02 e0 3c 31 2f 27 00 32 50 71
E: 31.139855 10 02 e0 3c 15 2e c1 00 32 55 81
E: 31.147850 10 02 e0 3b f6 2e 65 00 32 d9 8d
E: 31.155850 10 02 e0 3b c0 2e 0d 00 35 5f 9a
E: 31.163849 10 02 e0 3b 89 2d da 00 36 4c 9f
E: 31.171849 10 02 e0 3b 47 2d 94 00 38 4b a3
E: 31.175855 10 02 e0 3b 10 2d 65 00 39 4d a8
E: 31.183850 10 02 e0 3a d3 2d 40 00 3b 4e b1
E: 31.191850 10 02 e0 3a b2 2d 20 00 3c 50 ac
E: 31.199850 10 02 e0 3a 93 2c e5 00 3d 53 b0
E: 31.207851 10 02 e0 3a 74 2c a0 00 3d 54 bb
E: 31.215849 10 02 e0 3a 63 2c 70 00 3e 58 b7
E: 31.219850 10 02 e0 3a 4d 2c 04 00 3f 5a b4
E: 31.227848 10 02 e0 3a 38 2b b9 00 3e 5b bd
E: 31.235850 10 02 e0 3a 23 2b 84 00 3f de be
E: 31.243852 10 02 e0 3a 08 2b 2c 00 3f dc be
E: 31.251850 10 02 e0 39 ef 2a f0 00 3f dd c1
E: 31.255854 10 02 e0 39 d9 2a cb 00 3f dd bf
E: 31.263849 10 02 e0 39 be 2a a4 00 3f df c5
E: 31.271850 10 02 e0 39 9a 2a ae 00 3f de c2
E: 31.279848 10 02 e0 39 5e 2a 8a 00 3f dd be
E: 31.283854 10 02 e0 39 18 2a 91 00 3f dd c1
E: 31.291850 10 02 e0 38 e0 2a a1 00 3f de b9
E: 31.299850 10 02 e0 38 ba 2a a8 00 31 64 b4
E: 31.307849 10 02 e0 38 81 2a 95 00 32 63 b6
E: 31.315849 10 02 e0 38 60 2a a6 00 32 63 b7
E: 31.323850 10 02 e0 38 40 2a b4 00 33 62 ad
E: 31.331852 10 02 e0 38 29 2a b4 00 33 63 b1
E: 31.335857 10 02 e0 38 1c 2a ad 00 33 61 ad
E: 31.343850 10 02 e0 38 23 2a bf 00 33 e3 aa
E: 31.351849 10 02 e0 38 30 2a cb 00 33 e0 a7
E: 31.359847 10 02 e0 38 4d 2a c6 00 33 5c a1
E: 31.367849 10 02 e0 38 6e 2a d7 00 32 dc 9d
E: 31.371850 10 02 e0 38 97 2a d9 00 32 58 91
E: 31.379849 10 02 e0 38 cd 2a d8 00 32 57 84
E: 31.387849 10 02 e0 39 0b 2a ce 00 31 54 7e
E: 31.395846 10 02 e0 39 55 2a d3 00 31 52 6f
E: 31.403849 10 02 e0 39 95 2a d5 00 37 d3 5f
E: 31.407853 10 02 e0 39 d2 2a e2 00 37 55 56
E: 31.415849 10 02 e0 39 c9 2a ca 83 75 4f 50
E: 31.423848 10 02 e0 39 b6 2a c1 7d b6 50 53
E: 31.431849 10 02 e0 39 b8 2a c5 7c f6 4e 50
E: 31.439848 10 02 e0 39 c2 2a c8 79 b6 cf 53
E: 31.447849 10 02 e0 39 cf 2a cf 78 f6 4e 51
E: 31.451853 10 02 e0 39 dd 2a da 79 36 4e 51
E: 31.459847 10 02 e0 39 f0 2a e8 79 36 4e 4f
E: 31.467848 10 02 e0 3a 07 2a f3 78 75 4d 52
E: 31.475850 10 02 e0 3a 1d 2a f0 70 35 4d 53
E: 31.483847 10 02 e0 3a 34 2a f4 5d 35 4c 4c
E: 31.487853 10 02 e0 3a 49 2a f4 36 f4 cc 53
E: 31.495847 10 02 e0 3a 43 2a dd 00 34 4a 56
E: 31.503848 10 02 e0 3a 23 2a c5 00 34 ca 56
E: 31.511848 10 02 e0 39 f7 2a a5 00 35 cb 5a
E: 31.519848 10 02 e0 39 cb 2a 91 00 39 4b 63
E: 31.523853 10 02 e0 39 af 2a 85 00 3b d0 6e
E: 31.531847 10 02 e0 39 98 2a 8a 00 3c ce 77
E: 31.539849 10 02 e0 39 7b 2a 78 00 3d cd 85
E: 31.547849 10 02 e0 39 65 2a 65 00 3e d1 89
E: 31.555849 10 02 e0 39 59 2a 54 00 3f d1 90
E: 31.563848 10 02 e0 39 5f 2a 41 00 3f d6 97
E: 31.567852 10 02 e0 39 67 2a 1b 00 3c c5 9c
E: 31.575848 10 02 e0 39 77 2a 06 00 3d 48 9c
E: 31.583846 10 02 e0 39 8b 29 e1 00 3c c9 a1
E: 31.591849 10 02 e0 39 a1 29 c0 00 3c cb a2
E: 31.599847 10 02 e0 39 ae 29 97 00 3c 4a a0
E: 31.603852 10 02 e0 39 bb 29 6e 00 3c cc a0
E: 31.611848 10 02 e0 39 c2 29 4f 00 3d ce a2
E: 31.619848 10 02 e0 39 c2 29 22 00 3d 4f a7
E: 31.627847 10 02 e0 39 cc 29 10 00 3e 4f a7
E: 31.635847 10 02 e0 39 d4 28 f4 00 3e d1 a7
E: 31.643845 10 02 e0 39 df 28 e4 00 3e d3 ab
E: 31.647852 10 02 e0 39 f0 28 d1 00 3e d3 a8
E: 31.655848 10 02 e0 39 fc 28 b1 00 3e d3 ae
E: 31.663848 10 02 e0 3a 04 28 93 00 3e 54 ad
E: 31.671847 10 02 e0 3a 0e 28 96 00 3e 56 b2
E: 31.679847 10 02 e0 3a 21 28 8c 00 3e d6 ac
E: 31.683853 10 02 e0 3a 27 28 7b 00 3e d5 ae
E: 31.691848 10 02 e0 3a 2d 28 76 00 3e 56 ad
E: 31.699847 10 02 e0 3a 3a 28 83 00 3e d7 a8
E: 31.707847 10 02 e0 3a 3c 28 79 00 3e 56 a8
E: 31.715847 10 02 e0 3a 3f 28 7f 00 3e 57 ad
E: 31.719851 10 02 e0 3a 41 28 94 00 3e 57 ae
E: 31.727846 10 02 e0 3a 43 28 9a 00 3e 56 a8
E: 31.735846 10 02 e0 3a 42 28 9c 00 3e d6 aa
E: 31.743851 10 02 e0 3a 44 28 9f 00 3e d7 ad
E: 31.751847 10 02 e0 3a 4c 28 b0 00 3d d8 af
E: 31.759848 10 02 e0 3a 51 28 a1 00 3d 55 af
E: 31.763854 10 02 e0 3a 48 28 93 00 3e d6 b1
E: 31.771848 10 02 e0 3a 49 28 90 00 3e d9 b2
E: 31.779846 10 02 e0 3a 43 28 96 00 3e 58 b3
E: 31.787847 10 02 e0 3a 3a 28 99 00 3f 5a b0
E: 31.795845 10 02 e0 3a 2a 28 94 00 3f 5a b6
E: 31.799847 10 02 e0 3a 11 28 95 00 3f da bb
E: 31.807847 10 02 e0 3a 03 28 a6 00 3f da b8
E: 31.815848 10 02 e0 39 f0 28 9c 00 3f d9 ba
E: 31.823847 10 02 e0 39 d8 28 a6 00 3f d8 bc
E: 31.831847 10 02 e0 39 ce 28 a8 00 3f da bf
E: 31.835852 10 02 e0 39 c1 28 b6 00 3f d9 bd
E: 31.843844 10 02 e0 39 b4 28 b3 00 3f db c1
E: 31.851846 10 02 e0 39 a9 28 c3 00 3f dc c0
E: 31.859846 10 02 e0 39 a1 28 d9 00 3f dc c0
E: 31.867847 10 02 e0 39 9b 28 e7 00 3f da c1
E: 31.875847 10 02 e0 39 85 28 d5 00 3f d8 c0
E: 31.879851 10 02 e0 39 78 28 e3 00 3f d8 c3
E: 31.887848 10 02 e0 39 61 28 f1 00 3f da c0
E: 31.895845 10 02 e0 39 4f 29 0d 00 3f da c0
E: 31.903846 10 02 e0 39 3e 29 19 00 3f d9 c0
E: 31.911846 10 02 e0 39 20 28 fd 00 3f d7 c4
E: 31.915789 10 02 e0 39 10 29 08 00 3f d7 cb
E: 31.923786 10 02 e0 39 03 29 1d 00 3f d7 c9
E: 31.931846 10 02 e0 39 09 29 31 00 3f d7 c7
E: 31.939846 10 02 e0 39 05 28 ff 00 3f d7 c5
E: 31.947845 10 02 e0 38 fa 28 e8 00 3f d9 cf
E: 31.951851 10 0c 00 00 00 00 10 00 00 00 00
E: 31.959780 10 02 e0 39 01 29 08 00 3f db cb
E: 31.967846 10 02 e0 39 04 28 d6 00 3f db ca
E: 31.975782 10 02 e0 38 ff 28 c3 00 3f da cf
E: 31.979785 10 02 e0 39 08 28 db 00 3f da c9
E: 31.991773 10 02 e0 39 05 28 b7 00 3f dc cc
E: 31.995778 10 02 e0 38 fe 28 b5 00 3f dd cc
E: 32.003777 10 02 e0 39 03 28 c2 00 3f dd cc
E: 32.011779 10 02 e0 39 13 28 b5 00 3f db cb
E: 32.019773 10 02 e0 39 18 28 a4 00 3f dc cd
E: 32.027786 10 02 e0 39 25 28 99 00 3f dc cc
E: 32.031862 10 02 e0 39 31 28 96 00 3f de ca
E: 32.039777 10 02 e0 39 3d 28 7c 00 3f dd cf
E: 32.047774 10 02 e0 39 3d 28 6f 00 3f dc cf
E: 32.055773 10 02 e0 39 36 28 89 00 3f de cc
E: 32.063783 10 02 e0 39 3c 28 81 00 3f dc cc
E: 32.067775 10 02 e0 39 20 28 49 00 3f da cf
E: 32.075775 10 02 e0 39 10 28 70 00 3f dc d2
E: 32.083767 10 02 e0 39 13 28 82 00 3f df ce
E: 32.091773 10 02 e0 38 fb 28 5f 00 3f df d1
E: 32.099772 10 02 e0 38 d7 28 64 00 3f df d6
E: 32.103773 10 0c 00 00 00 00 00 00 00 00 00
E: 32.107780 10 02 e0 38 d8 28 56 00 35 e9 d2
E: 32.111773 10 02 e0 38 bf 28 5e 00 35 e6 d7
E: 32.119774 10 02 e0 38 a5 28 35 00 36 e6 db
E: 32.127776 10 02 a0 38 91 28 39 00 37 e8 dc
E: 32.135779 10 02 a0 38 76 28 28 00 37 ea d8
E: 32.143776 10 02 a0 38 6a 28 43 00 38 e9 e3
E: 32.147801 10 02 a0 38 5f 28 11 00 39 e9 e0
E: 32.155798 10 02 a0 38 59 28 0b 00 39 ed e5
E: 32.163845 10 02 a0 38 6a 28 34 00 38 eb e0
E: 32.171846 10 02 a0 38 69 27 e3 00 37 e6 e6
E: 32.179782 10 02 a0 38 69 27 b1 00 37 67 eb
E: 32.187847 10 02 a0 38 77 27 e9 00 39 69 e5
E: 32.191850 10 02 a0 38 73 27 8e 00 36 de e8
E: 32.199847 10 02 80 00 00 00 00 00 00 00 00
