R: 42 05 0c 09 01 a1 01 15 00 26 ff 00 75 08 95 04 85 24 09 00 81 22 75 08 95 04 85 25 09 00 81 22 75 08 95 04 85 26 09 00 81 22 c0
N: Apple Computer, Inc. IR Receiver
P: usb-0000:00:06.0-2/input0
I: 3 05ac 8242
# up
E: 0.000022 5 25 87 ee a3 0b
E: 0.028987 5 26 87 ee a3 0b
# left
E: 1.772058 5 25 87 ee a3 08
E: 1.813401 5 26 87 ee a3 08
# right
E: 3.183290 5 25 87 ee a3 07
E: 3.227822 5 26 87 ee a3 07
# down
E: 4.575890 5 25 87 ee a3 0d
E: 4.607399 5 26 87 ee a3 0d
# center
E: 9.835993 5 25 87 ee a3 5d
E: 9.937965 5 25 87 ee a3 04
# menu
E: 11.797644 5 25 87 ee a3 02
E: 11.828746 5 26 87 ee a3 02
# play/pause
E: 13.507948 5 25 87 ee a3 5e
E: 13.602045 5 25 87 ee a3 04
