R: 2580 05 20 09 01 a1 01 85 01 05 20 09 73 a1 00 05 20 0a 09 03 15 00 25 02 75 08 95 01 a1 02 0a 30 08 0a 31 08 0a 32 08 b1 00 c0 0a 16 03 15 00 25 05 75 08 95 01 a1 02 0a 40 08 0a 41 08 0a 42 08 0a 43 08 0a 44 08 0a 45 08 b1 00 c0 0a 19 03 15 00 25 05 75 08 95 01 a1 02 0a 50 08 0a 51 08 0a 52 08 0a 53 08 0a 54 08 0a 55 08 b1 00 c0 0a 01 02 15 00 25 06 75 08 95 01 a1 02 0a 00 08 0a 01 08 0a 02 08 0a 03 08 0a 04 08 0a 05 08 0a 06 08 b1 00 c0 0a 0e 03 15 00 27 ff ff ff ff 75 20 95 01 55 00 b1 02 0a 52 14 15 00 26 ff ff 75 10 95 01 55 0e b1 02 05 20 0a 01 02 15 00 25 06 75 08 95 01 a1 02 0a 00 08 0a 01 08 0a 02 08 0a 03 08 0a 04 08 0a 05 08 0a 06 08 81 00 c0 0a 02 02 15 00 25 05 75 08 95 01 a1 02 0a 10 08 0a 11 08 0a 12 08 0a 13 08 0a 14 08 0a 15 08 81 00 c0 0a 53 04 16 01 80 26 ff 7f 75 10 95 01 55 0e 81 02 0a 54 04 16 01 80 26 ff 7f 75 10 95 01 55 0e 81 02 0a 55 04 16 01 80 26 ff 7f 75 10 95 01 55 0e 81 02 0a 44 05 15 00 25 ff 75 08 95 01 55 00 81 02 c0 85 02 05 20 09 76 a1 00 05 20 0a 09 03 15 00 25 02 75 08 95 01 a1 02 0a 30 08 0a 31 08 0a 32 08 b1 00 c0 0a 16 03 15 00 25 05 75 08 95 01 a1 02 0a 40 08 0a 41 08 0a 42 08 0a 43 08 0a 44 08 0a 45 08 b1 00 c0 0a 19 03 15 00 25 05 75 08 95 01 a1 02 0a 50 08 0a 51 08 0a 52 08 0a 53 08 0a 54 08 0a 55 08 b1 00 c0 0a 01 02 15 00 25 06 75 08 95 01 a1 02 0a 00 08 0a 01 08 0a 02 08 0a 03 08 0a 04 08 0a 05 08 0a 06 08 b1 00 c0 0a 0e 03 15 00 27 ff ff ff ff 75 20 95 01 55 00 b1 02 0a 56 14 15 00 26 ff ff 75 10 95 01 55 0e b1 02 05 20 0a 01 02 15 00 25 06 75 08 95 01 a1 02 0a 00 08 0a 01 08 0a 02 08 0a 03 08 0a 04 08 0a 05 08 0a 06 08 81 00 c0 0a 02 02 15 00 25 05 75 08 95 01 a1 02 0a 10 08 0a 11 08 0a 12 08 0a 13 08 0a 14 08 0a 15 08 81 00 c0 0a 57 04 17 ff ff 01 80 27 00 00 ff 7f 75 20 95 01 55 0e 81 02 0a 58 04 17 ff ff 01 80 27 00 00 ff 7f 75 20 95 01 55 0e 81 02 0a 59 04 17 ff ff 01 80 27 00 00 ff 7f 75 20 95 01 55 0e 81 02 0a 44 05 15 00 25 ff 75 08 95 01 55 00 81 02 c0 85 03 05 20 09 83 a1 00 05 20 0a 09 03 15 00 25 02 75 08 95 01 a1 02 0a 30 08 0a 31 08 0a 32 08 b1 00 c0 0a 16 03 15 00 25 05 75 08 95 01 a1 02 0a 40 08 0a 41 08 0a 42 08 0a 43 08 0a 44 08 0a 45 08 b1 00 c0 0a 19 03 15 00 25 05 75 08 95 01 a1 02 0a 50 08 0a 51 08 0a 52 08 0a 53 08 0a 54 08 0a 55 08 b1 00 c0 0a 01 02 15 00 25 06 75 08 95 01 a1 02 0a 00 08 0a 01 08 0a 02 08 0a 03 08 0a 04 08 0a 05 08 0a 06 08 b1 00 c0 0a 0e 03 15 00 27 ff ff ff ff 75 20 95 01 55 00 b1 02 0a 71 14 15 00 26 ff ff 75 10 95 01 55 0e b1 02 05 20 0a 01 02 15 00 25 06 75 08 95 01 a1 02 0a 00 08 0a 01 08 0a 02 08 0a 03 08 0a 04 08 0a 05 08 0a 06 08 81 00 c0 0a 02 02 15 00 25 05 75 08 95 01 a1 02 0a 10 08 0a 11 08 0a 12 08 0a 13 08 0a 14 08 0a 15 08 81 00 c0 0a 75 04 16 00 00 26 ff ff 75 10 95 01 55 0e 81 02 0a 85 04 16 01 80 26 ff 7f 75 10 95 01 55 0f 81 02 0a 86 04 16 01 80 26 ff 7f 75 10 95 01 55 0f 81 02 0a 87 04 16 01 80 26 ff 7f 75 10 95 01 55 0f 81 02 0a 44 05 15 00 25 ff 75 08 95 01 55 00 81 02 c0 85 04 05 20 09 86 a1 00 05 20 0a 09 03 15 00 25 02 75 08 95 01 a1 02 0a 30 08 0a 31 08 0a 32 08 b1 00 c0 0a 16 03 15 00 25 05 75 08 95 01 a1 02 0a 40 08 0a 41 08 0a 42 08 0a 43 08 0a 44 08 0a 45 08 b1 00 c0 0a 19 03 15 00 25 05 75 08 95 01 a1 02 0a 50 08 0a 51 08 0a 52 08 0a 53 08 0a 54 08 0a 55 08 b1 00 c0 0a 01 02 15 00 25 06 75 08 95 01 a1 02 0a 00 08 0a 01 08 0a 02 08 0a 03 08 0a 04 08 0a 05 08 0a 06 08 b1 00 c0 0a 0e 03 15 00 27 ff ff ff ff 75 20 95 01 55 00 b1 02 0a 7e 14 15 00 26 ff ff 75 10 95 01 55 0e b1 02 05 20 0a 01 02 15 00 25 06 75 08 95 01 a1 02 0a 00 08 0a 01 08 0a 02 08 0a 03 08 0a 04 08 0a 05 08 0a 06 08 81 00 c0 0a 02 02 15 00 25 05 75 08 95 01 a1 02 0a 10 08 0a 11 08 0a 12 08 0a 13 08 0a 14 08 0a 15 08 81 00 c0 0a 7f 04 16 01 80 26 ff 7f 75 10 95 01 55 0e 81 02 0a 80 04 16 01 80 26 ff 7f 75 10 95 01 55 0e 81 02 0a 81 04 16 00 00 26 68 01 75 10 95 01 55 0e 81 02 0a 44 05 15 00 25 ff 75 08 95 01 55 00 81 02 c0 85 05 05 20 09 8a a1 00 05 20 0a 09 03 15 00 25 02 75 08 95 01 a1 02 0a 30 08 0a 31 08 0a 32 08 b1 00 c0 0a 16 03 15 00 25 05 75 08 95 01 a1 02 0a 40 08 0a 41 08 0a 42 08 0a 43 08 0a 44 08 0a 45 08 b1 00 c0 0a 19 03 15 00 25 05 75 08 95 01 a1 02 0a 50 08 0a 51 08 0a 52 08 0a 53 08 0a 54 08 0a 55 08 b1 00 c0 0a 01 02 15 00 25 06 75 08 95 01 a1 02 0a 00 08 0a 01 08 0a 02 08 0a 03 08 0a 04 08 0a 05 08 0a 06 08 b1 00 c0 0a 0e 03 15 00 27 ff ff ff ff 75 20 95 01 55 00 b1 02 0a 83 14 17 00 00 00 80 27 ff ff ff 7f 75 20 95 01 55 08 b1 02 05 20 0a 01 02 15 00 25 06 75 08 95 01 a1 02 0a 00 08 0a 01 08 0a 02 08 0a 03 08 0a 04 08 0a 05 08 0a 06 08 81 00 c0 0a 02 02 15 00 25 05 75 08 95 01 a1 02 0a 10 08 0a 11 08 0a 12 08 0a 13 08 0a 14 08 0a 15 08 81 00 c0 0a 83 04 17 00 00 00 80 27 ff ff ff 7f 75 20 95 04 55 08 81 02 0a 44 05 15 00 25 ff 75 08 95 01 55 00 81 02 c0 85 06 05 20 09 e1 a1 00 05 20 0a 09 03 15 00 25 02 75 08 95 01 a1 02 0a 30 08 0a 31 08 0a 32 08 b1 00 c0 0a 16 03 15 00 25 05 75 08 95 01 a1 02 0a 40 08 0a 41 08 0a 42 08 0a 43 08 0a 44 08 0a 45 08 b1 00 c0 0a 19 03 15 00 25 05 75 08 95 01 a1 02 0a 50 08 0a 51 08 0a 52 08 0a 53 08 0a 54 08 0a 55 08 b1 00 c0 0a 01 02 15 00 25 06 75 08 95 01 a1 02 0a 00 08 0a 01 08 0a 02 08 0a 03 08 0a 04 08 0a 05 08 0a 06 08 b1 00 c0 0a 0e 03 15 00 27 ff ff ff ff 75 20 95 01 55 00 b1 02 0a 44 15 17 01 00 00 80 27 ff ff ff 7f 75 20 95 01 55 0d b1 02 0a 45 15 17 01 00 00 80 27 ff ff ff 7f 75 20 95 01 55 0d b1 02 0a 46 15 17 01 00 00 80 27 ff ff ff 7f 75 20 95 01 55 0d b1 02 05 20 0a 01 02 15 00 25 06 75 08 95 01 a1 02 0a 00 08 0a 01 08 0a 02 08 0a 03 08 0a 04 08 0a 05 08 0a 06 08 81 00 c0 0a 02 02 15 00 25 05 75 08 95 01 a1 02 0a 10 08 0a 11 08 0a 12 08 0a 13 08 0a 14 08 0a 15 08 81 00 c0 0a 44 05 17 01 00 00 80 27 ff ff ff 7f 75 20 95 01 55 0d 81 02 0a 45 05 17 01 00 00 80 27 ff ff ff 7f 75 20 95 01 55 0d 81 02 0a 46 05 17 01 00 00 80 27 ff ff ff 7f 75 20 95 01 55 0d 81 02 0a 47 05 17 01 00 00 80 27 ff ff ff 7f 75 20 95 01 55 0d 81 02 0a 48 05 17 01 00 00 80 27 ff ff ff 7f 75 20 95 01 55 0d 81 02 0a 49 05 17 01 00 00 80 27 ff ff ff 7f 75 20 95 01 55 0d 81 02 c0 85 07 05 20 09 e2 a1 00 05 20 0a 09 03 15 00 25 02 75 08 95 01 a1 02 0a 30 08 0a 31 08 0a 32 08 b1 00 c0 0a 16 03 15 00 25 05 75 08 95 01 a1 02 0a 40 08 0a 41 08 0a 42 08 0a 43 08 0a 44 08 0a 45 08 b1 00 c0 0a 19 03 15 00 25 05 75 08 95 01 a1 02 0a 50 08 0a 51 08 0a 52 08 0a 53 08 0a 54 08 0a 55 08 b1 00 c0 0a 01 02 15 00 25 06 75 08 95 01 a1 02 0a 00 08 0a 01 08 0a 02 08 0a 03 08 0a 04 08 0a 05 08 0a 06 08 b1 00 c0 0a 0e 03 15 00 27 ff ff ff ff 75 20 95 01 55 00 b1 02 0a 62 05 75 08 95 10 b1 00 0a 63 05 75 08 95 10 b1 00 0a 0f 03 17 01 00 00 80 27 ff ff ff 7f 75 20 95 01 55 0d b1 02 05 20 0a 01 02 15 00 25 06 75 08 95 01 a1 02 0a 00 08 0a 01 08 0a 02 08 0a 03 08 0a 04 08 0a 05 08 0a 06 08 81 00 c0 0a 02 02 15 00 25 05 75 08 95 01 a1 02 0a 10 08 0a 11 08 0a 12 08 0a 13 08 0a 14 08 0a 15 08 81 00 c0 0a 66 05 17 01 00 00 80 27 ff ff ff 7f 75 08 95 18 55 0d 81 02 c0 85 08 05 20 09 41 a1 00 05 20 0a 09 03 15 00 25 02 75 08 95 01 a1 02 0a 30 08 0a 31 08 0a 32 08 b1 00 c0 0a 16 03 15 00 25 05 75 08 95 01 a1 02 0a 40 08 0a 41 08 0a 42 08 0a 43 08 0a 44 08 0a 45 08 b1 00 c0 0a 19 03 15 00 25 05 75 08 95 01 a1 02 0a 50 08 0a 51 08 0a 52 08 0a 53 08 0a 54 08 0a 55 08 b1 00 c0 0a 01 02 15 00 25 06 75 08 95 01 a1 02 0a 00 08 0a 01 08 0a 02 08 0a 03 08 0a 04 08 0a 05 08 0a 06 08 b1 00 c0 0a 0e 03 15 00 27 ff ff ff ff 75 20 95 01 55 00 b1 02 0a d1 e4 15 00 26 10 27 75 10 95 01 55 0e b1 02 0a 18 03 16 00 00 26 ff ff 75 10 95 06 55 00 b1 02 05 20 0a 01 02 15 00 25 06 75 08 95 01 a1 02 0a 00 08 0a 01 08 0a 02 08 0a 03 08 0a 04 08 0a 05 08 0a 06 08 81 00 c0 0a 02 02 15 00 25 05 75 08 95 01 a1 02 0a 10 08 0a 11 08 0a 12 08 0a 13 08 0a 14 08 0a 15 08 81 00 c0 0a d1 04 17 00 00 00 00 27 ff ff ff 7f 75 20 95 01 55 0f 81 02 c0 c0
N: Lenovo Miix 2 Sensors
I: 18 2047 0855
