R: 62 05 01 09 02 a1 01 09 01 a1 00 05 09 19 01 29 03 95 03 75 01 81 02 95 01 75 05 81 03 05 01 09 30 09 31 26 ff 0f 46 ff 0f 75 10 95 02 81 02 75 08 95 03 81 03 c0 09 ff 75 08 95 10 b1 02 c0
N: Posiflex Inc. USB TOUCH V390
P: usb-0000:00:1a.0-1/input0
I: 3 0d3a a000
E: 0.000000 8 01 96 07 38 08 00 00 00
E: 0.015967 8 01 96 07 38 08 00 00 00
E: 0.031942 8 01 96 07 38 08 00 00 00
E: 0.047960 8 01 96 07 38 08 00 00 00
E: 0.055965 8 01 96 07 38 08 00 00 00
E: 0.071942 8 01 96 07 38 08 00 00 00
E: 0.087936 8 01 96 07 38 08 00 00 00
E: 0.103945 8 01 96 07 38 08 00 00 00
E: 0.119953 8 01 96 07 38 08 00 00 00
E: 0.135959 8 00 96 07 38 08 00 00 00
E: 7.351993 8 01 1a 0f f8 0d 00 00 00
E: 7.359976 8 01 1a 0f f8 0d 00 00 00
E: 7.375941 8 01 1a 0f f8 0d 00 00 00
E: 7.391967 8 01 1a 0f f8 0d 00 00 00
E: 7.407950 8 01 1a 0f f8 0d 00 00 00
E: 7.415937 8 01 1a 0f f8 0d 00 00 00
E: 7.431973 8 01 1a 0f f8 0d 00 00 00
E: 7.447944 8 01 1a 0f f8 0d 00 00 00
E: 7.471964 8 00 1a 0f f8 0d 00 00 00
E: 12.431979 8 01 3b 01 2a 03 00 00 00
E: 12.447950 8 01 3b 01 2a 03 00 00 00
E: 12.455966 8 01 3b 01 2a 03 00 00 00
E: 12.471945 8 01 3b 01 2a 03 00 00 00
E: 12.487953 8 01 3b 01 2a 03 00 00 00
E: 12.503942 8 01 3b 01 2a 03 00 00 00
E: 12.520004 8 01 58 01 de 02 00 00 00
E: 12.527974 8 01 58 01 de 02 00 00 00
E: 12.543961 8 01 7e 01 9c 02 00 00 00
E: 12.559945 8 01 7e 01 9c 02 00 00 00
E: 12.575976 8 01 c0 01 38 02 00 00 00
E: 12.583978 8 01 c0 01 38 02 00 00 00
E: 12.599967 8 01 16 02 cf 01 00 00 00
E: 12.615946 8 01 16 02 cf 01 00 00 00
E: 12.631985 8 01 6b 02 78 01 00 00 00
E: 12.647962 8 01 6b 02 78 01 00 00 00
E: 12.655960 8 01 c6 02 4d 01 00 00 00
E: 12.671952 8 01 c6 02 4d 01 00 00 00
E: 12.687994 8 01 12 03 3a 01 00 00 00
E: 12.703963 8 01 12 03 3a 01 00 00 00
E: 12.719961 8 01 54 03 4d 01 00 00 00
E: 12.727945 8 01 54 03 4d 01 00 00 00
E: 12.743966 8 01 54 03 4d 01 00 00 00
E: 12.759958 8 01 92 03 a7 01 00 00 00
E: 12.775949 8 01 92 03 a7 01 00 00 00
E: 12.783959 8 01 9b 03 06 02 00 00 00
E: 12.799979 8 01 9b 03 06 02 00 00 00
E: 12.815963 8 01 91 03 78 02 00 00 00
E: 12.831964 8 01 88 03 ba 02 00 00 00
E: 12.847988 8 01 71 03 fd 02 00 00 00
E: 12.855987 8 01 58 03 52 03 00 00 00
E: 12.871993 8 01 3c 03 ad 03 00 00 00
E: 12.887962 8 01 1f 03 0c 04 00 00 00
E: 12.903953 8 01 fe 02 6c 04 00 00 00
E: 12.919991 8 01 dd 02 d0 04 00 00 00
E: 12.927976 8 01 c5 02 2f 05 00 00 00
E: 12.943957 8 01 a8 02 84 05 00 00 00
E: 12.959950 8 01 9f 02 e3 05 00 00 00
E: 12.975981 8 01 87 02 39 06 00 00 00
E: 12.983948 8 01 7d 02 85 06 00 00 00
E: 12.999960 8 01 8c 02 c7 06 00 00 00
E: 13.015945 8 01 8c 02 c7 06 00 00 00
E: 13.031990 8 01 9a 02 22 07 00 00 00
E: 13.047962 8 01 9a 02 22 07 00 00 00
E: 13.055944 8 01 9a 02 22 07 00 00 00
E: 13.071954 8 01 ef 02 55 07 00 00 00
E: 13.087984 8 01 ef 02 55 07 00 00 00
E: 13.103991 8 01 36 03 2a 07 00 00 00
E: 13.119953 8 01 36 03 2a 07 00 00 00
E: 13.127950 8 01 91 03 cb 06 00 00 00
E: 13.143976 8 01 ca 03 7a 06 00 00 00
E: 13.159972 8 01 fa 03 33 06 00 00 00
E: 13.175958 8 01 32 04 dc 05 00 00 00
E: 13.183950 8 01 67 04 87 05 00 00 00
E: 13.199985 8 01 96 04 3f 05 00 00 00
E: 13.215977 8 01 c6 04 f8 04 00 00 00
E: 13.231948 8 01 c6 04 f8 04 00 00 00
E: 13.247949 8 01 20 05 8f 04 00 00 00
E: 13.255977 8 01 20 05 8f 04 00 00 00
E: 13.271957 8 01 6c 05 4c 04 00 00 00
E: 13.287947 8 01 6c 05 4c 04 00 00 00
E: 13.303281 8 01 b3 05 2b 04 00 00 00
E: 13.319971 8 01 b3 05 2b 04 00 00 00
E: 13.327947 8 01 b3 05 2b 04 00 00 00
E: 13.343965 8 01 ff 05 2a 04 00 00 00
E: 13.359946 8 01 ff 05 2a 04 00 00 00
E: 13.375967 8 01 ff 05 2a 04 00 00 00
E: 13.383958 8 01 20 06 76 04 00 00 00
E: 13.399949 8 01 20 06 76 04 00 00 00
E: 13.415949 8 01 12 06 da 04 00 00 00
E: 13.431945 8 01 12 06 da 04 00 00 00
E: 13.447952 8 01 e3 05 56 05 00 00 00
E: 13.455988 8 01 c6 05 9d 05 00 00 00
E: 13.471974 8 01 aa 05 f3 05 00 00 00
E: 13.487951 8 01 88 05 48 06 00 00 00
E: 13.503953 8 01 67 05 a7 06 00 00 00
E: 13.520003 8 01 41 05 0c 07 00 00 00
E: 13.527999 8 01 16 05 74 07 00 00 00
E: 13.543962 8 01 fe 04 e2 07 00 00 00
E: 13.559949 8 01 e2 04 4d 08 00 00 00
E: 13.575981 8 01 cb 04 b6 08 00 00 00
E: 13.583968 8 01 c1 04 10 09 00 00 00
E: 13.599969 8 01 bc 04 61 09 00 00 00
E: 13.615973 8 01 bc 04 61 09 00 00 00
E: 13.631990 8 01 ca 04 c4 09 00 00 00
E: 13.647968 8 01 ca 04 c4 09 00 00 00
E: 13.655950 8 01 ca 04 c4 09 00 00 00
E: 13.671957 8 01 11 05 fd 09 00 00 00
E: 13.687969 8 01 11 05 fd 09 00 00 00
E: 13.703976 8 01 11 05 fd 09 00 00 00
E: 13.719986 8 01 79 05 c4 09 00 00 00
E: 13.727945 8 01 79 05 c4 09 00 00 00
E: 13.743988 8 01 cf 05 56 09 00 00 00
E: 13.759977 8 01 fa 05 06 09 00 00 00
E: 13.775960 8 01 2e 06 b5 08 00 00 00
E: 13.791951 8 01 62 06 5f 08 00 00 00
E: 13.799987 8 01 9b 06 04 08 00 00 00
E: 13.815981 8 01 d0 06 b5 07 00 00 00
E: 13.831962 8 01 ff 06 69 07 00 00 00
E: 13.847951 8 01 34 07 26 07 00 00 00
E: 13.855963 8 01 34 07 26 07 00 00 00
E: 13.871983 8 01 89 07 c6 06 00 00 00
E: 13.887951 8 01 89 07 c6 06 00 00 00
E: 13.903952 8 01 cb 07 96 06 00 00 00
E: 13.919976 8 01 cb 07 96 06 00 00 00
E: 13.927948 8 01 cb 07 96 06 00 00 00
E: 13.943957 8 01 1b 08 85 06 00 00 00
E: 13.959953 8 01 1b 08 85 06 00 00 00
E: 13.975969 8 01 1b 08 85 06 00 00 00
E: 13.991944 8 01 1b 08 85 06 00 00 00
E: 13.999955 8 01 1b 08 85 06 00 00 00
E: 14.015953 8 01 45 08 d1 06 00 00 00
E: 14.031975 8 01 45 08 d1 06 00 00 00
E: 14.047991 8 01 45 08 14 07 00 00 00
E: 14.055947 8 01 45 08 14 07 00 00 00
E: 14.071953 8 01 28 08 78 07 00 00 00
E: 14.087976 8 01 28 08 78 07 00 00 00
E: 14.103952 8 01 fd 07 e5 07 00 00 00
E: 14.119962 8 01 dd 07 29 08 00 00 00
E: 14.127951 8 01 ca 07 70 08 00 00 00
E: 14.143991 8 01 ad 07 b8 08 00 00 00
E: 14.159967 8 01 9b 07 0d 09 00 00 00
E: 14.175960 8 01 83 07 63 09 00 00 00
E: 14.191953 8 01 6b 07 bd 09 00 00 00
E: 14.199977 8 01 4e 07 13 0a 00 00 00
E: 14.215994 8 01 40 07 6d 0a 00 00 00
E: 14.231956 8 01 37 07 b9 0a 00 00 00
E: 14.247954 8 01 2d 07 01 0b 00 00 00
E: 14.255966 8 01 2d 07 01 0b 00 00 00
E: 14.271961 8 01 32 07 64 0b 00 00 00
E: 14.287954 8 01 32 07 64 0b 00 00 00
E: 14.303285 8 01 32 07 64 0b 00 00 00
E: 14.319992 8 01 5c 07 ba 0b 00 00 00
E: 14.327962 8 01 5c 07 ba 0b 00 00 00
E: 14.343953 8 01 5c 07 ba 0b 00 00 00
E: 14.359955 8 01 a3 07 ba 0b 00 00 00
E: 14.375962 8 01 a3 07 ba 0b 00 00 00
E: 14.391959 8 01 eb 07 6d 0b 00 00 00
E: 14.399949 8 01 eb 07 6d 0b 00 00 00
E: 14.415954 8 01 44 08 ee 0a 00 00 00
E: 14.431950 8 01 73 08 9d 0a 00 00 00
E: 14.447987 8 01 a3 08 47 0a 00 00 00
E: 14.455990 8 01 e6 08 ed 09 00 00 00
E: 14.471972 8 01 24 09 93 09 00 00 00
E: 14.487964 8 01 58 09 38 09 00 00 00
E: 14.503952 8 01 9b 09 f5 08 00 00 00
E: 14.519991 8 01 d4 09 ad 08 00 00 00
E: 14.527968 8 01 d4 09 ad 08 00 00 00
E: 14.543955 8 01 3c 0a 4e 08 00 00 00
E: 14.559945 8 01 3c 0a 4e 08 00 00 00
E: 14.575996 8 01 9c 0a 15 08 00 00 00
E: 14.591961 8 01 9c 0a 15 08 00 00 00
E: 14.599985 8 01 e7 0a 01 08 00 00 00
E: 14.615944 8 01 e7 0a 01 08 00 00 00
E: 14.631982 8 01 e7 0a 01 08 00 00 00
E: 14.647949 8 01 e7 0a 01 08 00 00 00
E: 14.655961 8 01 29 0b 3a 08 00 00 00
E: 14.671945 8 01 29 0b 3a 08 00 00 00
E: 14.687968 8 01 29 0b 3a 08 00 00 00
E: 14.703961 8 01 29 0b a3 08 00 00 00
E: 14.719953 8 01 29 0b a3 08 00 00 00
E: 14.727956 8 01 07 0b 0b 09 00 00 00
E: 14.743981 8 01 07 0b 0b 09 00 00 00
E: 14.759958 8 01 d8 0a 7e 09 00 00 00
E: 14.775952 8 01 d8 0a 7e 09 00 00 00
E: 14.791961 8 01 b1 0a fa 09 00 00 00
E: 14.799979 8 01 b1 0a fa 09 00 00 00
E: 14.815961 8 01 7d 0a 7f 0a 00 00 00
E: 14.831960 8 01 69 0a c6 0a 00 00 00
E: 14.847953 8 01 52 0a 0d 0b 00 00 00
E: 14.855988 8 01 3e 0a 55 0b 00 00 00
E: 14.871991 8 01 35 0a 97 0b 00 00 00
E: 14.887952 8 01 35 0a 97 0b 00 00 00
E: 14.903950 8 01 26 0a 13 0c 00 00 00
E: 14.919981 8 01 26 0a 13 0c 00 00 00
E: 14.927960 8 01 2f 0a 69 0c 00 00 00
E: 14.943953 8 01 2f 0a 69 0c 00 00 00
E: 14.959947 8 01 2f 0a 69 0c 00 00 00
E: 14.975969 8 01 2f 0a 69 0c 00 00 00
E: 14.991947 8 01 2f 0a 69 0c 00 00 00
E: 14.999958 8 01 89 0a ab 0c 00 00 00
E: 15.015947 8 01 89 0a ab 0c 00 00 00
E: 15.031993 8 01 d1 0a 85 0c 00 00 00
E: 15.047965 8 01 d1 0a 85 0c 00 00 00
E: 15.055956 8 01 21 0b 2f 0c 00 00 00
E: 15.071942 8 01 21 0b 2f 0c 00 00 00
E: 15.087982 8 01 7c 0b b8 0b 00 00 00
E: 15.103964 8 01 7c 0b b8 0b 00 00 00
E: 15.119962 8 01 df 0b 3c 0b 00 00 00
E: 15.127996 8 01 0a 0c f9 0a 00 00 00
E: 15.143974 8 01 0a 0c f9 0a 00 00 00
E: 15.159965 8 01 73 0c 82 0a 00 00 00
E: 15.175970 8 01 73 0c 82 0a 00 00 00
E: 15.191957 8 01 e0 0c 1d 0a 00 00 00
E: 15.199967 8 01 e0 0c 1d 0a 00 00 00
E: 15.215989 8 01 3f 0d da 09 00 00 00
E: 15.231980 8 01 3f 0d da 09 00 00 00
E: 15.247964 8 01 8b 0d c2 09 00 00 00
E: 15.263973 8 01 8b 0d c2 09 00 00 00
E: 15.271948 8 01 8b 0d c2 09 00 00 00
E: 15.287950 8 01 8b 0d c2 09 00 00 00
E: 15.303286 8 01 d2 0d 00 0a 00 00 00
E: 15.319973 8 01 d2 0d 00 0a 00 00 00
E: 15.327983 8 01 cd 0d 5f 0a 00 00 00
E: 15.343976 8 01 cd 0d 5f 0a 00 00 00
E: 15.359960 8 01 b0 0d e0 0a 00 00 00
E: 15.375990 8 01 93 0d 2c 0b 00 00 00
E: 15.391975 8 01 72 0d 82 0b 00 00 00
E: 15.399963 8 01 56 0d d7 0b 00 00 00
E: 15.415953 8 01 39 0d 2d 0c 00 00 00
E: 15.431956 8 01 1c 0d 87 0c 00 00 00
E: 15.447990 8 01 0e 0d d8 0c 00 00 00
E: 15.463990 8 01 ff 0c 29 0d 00 00 00
E: 15.471949 8 01 ff 0c 29 0d 00 00 00
E: 15.487986 8 01 ec 0c 97 0d 00 00 00
E: 15.503958 8 01 ec 0c 97 0d 00 00 00
E: 15.519953 8 01 ec 0c 97 0d 00 00 00
E: 15.527942 8 01 ec 0c 97 0d 00 00 00
E: 15.543975 8 01 ec 0c 97 0d 00 00 00
E: 15.559954 8 01 ec 0c 97 0d 00 00 00
E: 15.575974 8 01 ec 0c 97 0d 00 00 00
E: 15.591961 8 01 3c 0d c6 0d 00 00 00
E: 15.599963 8 01 3c 0d c6 0d 00 00 00
E: 15.615960 8 01 7f 0d 9b 0d 00 00 00
E: 15.631952 8 01 7f 0d 9b 0d 00 00 00
E: 15.647984 8 01 ca 0d 6b 0d 00 00 00
E: 15.663978 8 01 ca 0d 6b 0d 00 00 00
E: 15.671959 8 01 20 0e 31 0d 00 00 00
E: 15.687957 8 01 20 0e 31 0d 00 00 00
E: 15.703955 8 01 8d 0e 01 0d 00 00 00
E: 15.719978 8 01 8d 0e 01 0d 00 00 00
E: 15.727964 8 01 f1 0e f8 0c 00 00 00
E: 15.743977 8 01 f1 0e f8 0c 00 00 00
E: 15.759964 8 01 37 0f 01 0d 00 00 00
E: 15.775979 8 01 37 0f 01 0d 00 00 00
E: 15.791947 8 01 37 0f 01 0d 00 00 00
E: 15.799962 8 01 58 0f 48 0d 00 00 00
E: 15.815944 8 01 58 0f 48 0d 00 00 00
E: 15.839972 8 00 58 0f 48 0d 00 00 00
E: 16.663994 8 01 b7 01 dd 0d 00 00 00
E: 16.679982 8 01 b7 01 dd 0d 00 00 00
E: 16.695951 8 01 b7 01 dd 0d 00 00 00
E: 16.711970 8 01 b7 01 dd 0d 00 00 00
E: 16.719947 8 01 b7 01 dd 0d 00 00 00
E: 16.735968 8 01 75 01 cb 0d 00 00 00
E: 16.751943 8 01 75 01 cb 0d 00 00 00
E: 16.767977 8 01 75 01 cb 0d 00 00 00
E: 16.783965 8 01 29 01 4f 0d 00 00 00
E: 16.791995 8 01 12 01 03 0d 00 00 00
E: 16.807958 8 01 03 01 bc 0c 00 00 00
E: 16.823980 8 01 f1 00 75 0c 00 00 00
E: 16.839980 8 01 ec 00 24 0c 00 00 00
E: 16.855991 8 01 e7 00 d8 0b 00 00 00
E: 16.863951 8 01 e7 00 d8 0b 00 00 00
E: 16.879989 8 01 f5 00 6a 0b 00 00 00
E: 16.895976 8 01 f5 00 6a 0b 00 00 00
E: 16.911955 8 01 f5 00 6a 0b 00 00 00
E: 16.919943 8 01 f5 00 6a 0b 00 00 00
E: 16.935966 8 01 46 01 57 0b 00 00 00
E: 16.951966 8 01 46 01 57 0b 00 00 00
E: 16.967987 8 01 97 01 8b 0b 00 00 00
E: 16.983953 8 01 97 01 8b 0b 00 00 00
E: 16.991990 8 01 e7 01 ef 0b 00 00 00
E: 17.007966 8 01 e7 01 ef 0b 00 00 00
E: 17.023963 8 01 37 02 5b 0c 00 00 00
E: 17.039949 8 01 37 02 5b 0c 00 00 00
E: 17.055976 8 01 8d 02 ba 0c 00 00 00
E: 17.063970 8 01 8d 02 ba 0c 00 00 00
E: 17.079992 8 01 e2 02 fd 0c 00 00 00
E: 17.095950 8 01 e2 02 fd 0c 00 00 00
E: 17.111982 8 01 2e 03 22 0d 00 00 00
E: 17.119962 8 01 2e 03 22 0d 00 00 00
E: 17.135962 8 01 70 03 27 0d 00 00 00
E: 17.151949 8 01 70 03 27 0d 00 00 00
E: 17.167986 8 01 b2 03 14 0d 00 00 00
E: 17.183965 8 01 b2 03 14 0d 00 00 00
E: 17.191997 8 01 dd 03 d1 0c 00 00 00
E: 17.207948 8 01 dd 03 d1 0c 00 00 00
E: 17.223983 8 01 fe 03 55 0c 00 00 00
E: 17.239977 8 01 0c 04 09 0c 00 00 00
E: 17.255961 8 01 11 04 af 0b 00 00 00
E: 17.263996 8 01 11 04 5a 0b 00 00 00
E: 17.279990 8 01 16 04 0d 0b 00 00 00
E: 17.295974 8 01 1b 04 cb 0a 00 00 00
E: 17.311965 8 01 1b 04 7f 0a 00 00 00
E: 17.319948 8 01 1b 04 7f 0a 00 00 00
E: 17.335981 8 01 24 04 03 0a 00 00 00
E: 17.351978 8 01 24 04 03 0a 00 00 00
E: 17.367999 8 01 33 04 91 09 00 00 00
E: 17.383955 8 01 33 04 91 09 00 00 00
E: 17.391992 8 01 46 04 37 09 00 00 00
E: 17.407966 8 01 46 04 37 09 00 00 00
E: 17.423952 8 01 46 04 37 09 00 00 00
E: 17.439950 8 01 46 04 37 09 00 00 00
E: 17.455947 8 01 46 04 37 09 00 00 00
E: 17.463999 8 01 9b 04 1a 09 00 00 00
E: 17.479981 8 01 9b 04 1a 09 00 00 00
E: 17.495947 8 01 9b 04 1a 09 00 00 00
E: 17.511987 8 01 e7 04 6a 09 00 00 00
E: 17.519947 8 01 e7 04 6a 09 00 00 00
E: 17.535973 8 01 e7 04 6a 09 00 00 00
E: 17.551993 8 01 37 05 c9 09 00 00 00
E: 17.567951 8 01 37 05 c9 09 00 00 00
E: 17.583969 8 01 37 05 c9 09 00 00 00
E: 17.591990 8 01 91 05 2c 0a 00 00 00
E: 17.607968 8 01 91 05 2c 0a 00 00 00
E: 17.623958 8 01 91 05 2c 0a 00 00 00
E: 17.639959 8 01 eb 05 86 0a 00 00 00
E: 17.655970 8 01 eb 05 86 0a 00 00 00
E: 17.663946 8 01 eb 05 86 0a 00 00 00
E: 17.679996 8 01 3c 06 d2 0a 00 00 00
E: 17.695951 8 01 3c 06 d2 0a 00 00 00
E: 17.711976 8 01 3c 06 d2 0a 00 00 00
E: 17.719962 8 01 87 06 f8 0a 00 00 00
E: 17.735951 8 01 87 06 f8 0a 00 00 00
E: 17.751946 8 01 87 06 f8 0a 00 00 00
E: 17.767988 8 01 ca 06 e9 0a 00 00 00
E: 17.783971 8 01 ca 06 e9 0a 00 00 00
E: 17.791978 8 01 ca 06 e9 0a 00 00 00
E: 17.807958 8 01 08 07 7c 0a 00 00 00
E: 17.823984 8 01 16 07 39 0a 00 00 00
E: 17.839978 8 01 24 07 f7 09 00 00 00
E: 17.855962 8 01 37 07 a1 09 00 00 00
E: 17.863954 8 01 40 07 50 09 00 00 00
E: 17.879996 8 01 45 07 04 09 00 00 00
E: 17.895996 8 01 4f 07 bd 08 00 00 00
E: 17.911977 8 01 4f 07 bd 08 00 00 00
E: 17.927965 8 01 58 07 38 08 00 00 00
E: 17.935973 8 01 58 07 38 08 00 00 00
E: 17.951960 8 01 5e 07 be 07 00 00 00
E: 17.967955 8 01 5e 07 be 07 00 00 00
E: 17.983998 8 01 6c 07 5a 07 00 00 00
E: 17.991976 8 01 6c 07 5a 07 00 00 00
E: 18.007949 8 01 6c 07 5a 07 00 00 00
E: 18.023953 8 01 6c 07 5a 07 00 00 00
E: 18.039962 8 01 92 07 12 07 00 00 00
E: 18.055969 8 01 92 07 12 07 00 00 00
E: 18.063951 8 01 92 07 12 07 00 00 00
E: 18.079982 8 01 92 07 12 07 00 00 00
E: 18.095964 8 01 da 07 17 07 00 00 00
E: 18.111976 8 01 da 07 17 07 00 00 00
E: 18.127949 8 01 da 07 17 07 00 00 00
E: 18.135964 8 01 24 08 3a 07 00 00 00
E: 18.151946 8 01 24 08 3a 07 00 00 00
E: 18.167968 8 01 24 08 3a 07 00 00 00
E: 18.183987 8 01 61 08 86 07 00 00 00
E: 18.191979 8 01 61 08 86 07 00 00 00
E: 18.207951 8 01 61 08 86 07 00 00 00
E: 18.223980 8 01 a9 08 e0 07 00 00 00
E: 18.239979 8 01 a9 08 e0 07 00 00 00
E: 18.255969 8 01 d9 08 29 08 00 00 00
E: 18.263946 8 01 d9 08 29 08 00 00 00
E: 18.279983 8 01 d9 08 29 08 00 00 00
E: 18.295965 8 01 20 09 7f 08 00 00 00
E: 18.311971 8 01 20 09 7f 08 00 00 00
E: 18.327950 8 01 20 09 7f 08 00 00 00
E: 18.335982 8 01 67 09 b7 08 00 00 00
E: 18.351962 8 01 67 09 b7 08 00 00 00
E: 18.367955 8 01 67 09 b7 08 00 00 00
E: 18.383988 8 01 bc 09 d3 08 00 00 00
E: 18.391978 8 01 bc 09 d3 08 00 00 00
E: 18.407947 8 01 bc 09 d3 08 00 00 00
E: 18.423968 8 01 fe 09 c0 08 00 00 00
E: 18.439949 8 01 fe 09 c0 08 00 00 00
E: 18.455946 8 01 fe 09 c0 08 00 00 00
E: 18.463956 8 01 2e 0a 6f 08 00 00 00
E: 18.479952 8 01 2e 0a 6f 08 00 00 00
E: 18.495985 8 01 46 0a 07 08 00 00 00
E: 18.511993 8 01 55 0a bc 07 00 00 00
E: 18.527956 8 01 5e 0a 70 07 00 00 00
E: 18.535986 8 01 6d 0a 28 07 00 00 00
E: 18.551994 8 01 6d 0a dc 06 00 00 00
E: 18.567960 8 01 72 0a 90 06 00 00 00
E: 18.583999 8 01 73 0a 44 06 00 00 00
E: 18.591987 8 01 73 0a f3 05 00 00 00
E: 18.607996 8 01 73 0a 9d 05 00 00 00
E: 18.623992 8 01 7d 0a 56 05 00 00 00
E: 18.639970 8 01 86 0a 13 05 00 00 00
E: 18.655980 8 01 86 0a 13 05 00 00 00
E: 18.663963 8 01 a3 0a b9 04 00 00 00
E: 18.679957 8 01 a3 0a b9 04 00 00 00
E: 18.695982 8 01 a3 0a b9 04 00 00 00
E: 18.711993 8 01 d8 0a 76 04 00 00 00
E: 18.727978 8 01 d8 0a 76 04 00 00 00
E: 18.735973 8 01 d8 0a 76 04 00 00 00
E: 18.751964 8 01 24 0b 5e 04 00 00 00
E: 18.767970 8 01 24 0b 5e 04 00 00 00
E: 18.783950 8 01 24 0b 5e 04 00 00 00
E: 18.791956 8 01 7e 0b 75 04 00 00 00
E: 18.807971 8 01 7e 0b 75 04 00 00 00
E: 18.823975 8 01 7e 0b 75 04 00 00 00
E: 18.839961 8 01 cf 0b c1 04 00 00 00
E: 18.855968 8 01 cf 0b c1 04 00 00 00
E: 18.863947 8 01 cf 0b c1 04 00 00 00
E: 18.879977 8 01 1b 0c 1b 05 00 00 00
E: 18.895954 8 01 1b 0c 1b 05 00 00 00
E: 18.911980 8 01 1b 0c 1b 05 00 00 00
E: 18.927965 8 01 67 0c 67 05 00 00 00
E: 18.935973 8 01 67 0c 67 05 00 00 00
E: 18.951951 8 01 67 0c 67 05 00 00 00
E: 18.967978 8 01 b3 0c 96 05 00 00 00
E: 18.983963 8 01 b3 0c 96 05 00 00 00
E: 18.991955 8 01 b3 0c 96 05 00 00 00
E: 19.007962 8 01 f6 0c 9f 05 00 00 00
E: 19.023983 8 01 f6 0c 9f 05 00 00 00
E: 19.039959 8 01 f6 0c 9f 05 00 00 00
E: 19.055974 8 01 f6 0c 9f 05 00 00 00
E: 19.063968 8 01 38 0d 4e 05 00 00 00
E: 19.079956 8 01 38 0d 4e 05 00 00 00
E: 19.095976 8 01 5f 0d f3 04 00 00 00
E: 19.111961 8 01 77 0d b1 04 00 00 00
E: 19.127980 8 01 77 0d b1 04 00 00 00
E: 19.135964 8 01 9d 0d 39 04 00 00 00
E: 19.151962 8 01 9d 0d 39 04 00 00 00
E: 19.167960 8 01 ac 0d cc 03 00 00 00
E: 19.183979 8 01 ba 0d 84 03 00 00 00
E: 19.199995 8 01 c4 0d 33 03 00 00 00
E: 19.207974 8 01 c0 0d ec 02 00 00 00
E: 19.223952 8 01 c0 0d ec 02 00 00 00
E: 19.239985 8 01 d3 0d 6c 02 00 00 00
E: 19.255964 8 01 d3 0d 6c 02 00 00 00
E: 19.263969 8 01 e2 0d 0d 02 00 00 00
E: 19.279951 8 01 e2 0d 0d 02 00 00 00
E: 19.295970 8 01 f5 0d bc 01 00 00 00
E: 19.311971 8 01 f5 0d bc 01 00 00 00
E: 19.327981 8 01 12 0e 6b 01 00 00 00
E: 19.335952 8 01 12 0e 6b 01 00 00 00
E: 19.351986 8 01 41 0e 23 01 00 00 00
E: 19.367959 8 01 41 0e 23 01 00 00 00
E: 19.383959 8 01 41 0e 23 01 00 00 00
E: 19.399962 8 01 93 0e e0 00 00 00 00
E: 19.407976 8 01 93 0e e0 00 00 00 00
E: 19.423951 8 01 93 0e e0 00 00 00 00
E: 19.439957 8 01 93 0e e0 00 00 00 00
E: 19.455975 8 01 93 0e e0 00 00 00 00
E: 19.463969 8 01 93 0e e0 00 00 00 00
E: 19.479964 8 01 e8 0e e4 00 00 00 00
E: 19.503984 8 00 e8 0e e4 00 00 00 00
