R: 370 05 01 09 07 a1 01 85 01 05 07 19 e0 29 e7 15 00 25 01 75 01 95 08 81 02 95 01 75 08 81 01 95 03 75 01 05 08 19 01 29 03 91 02 95 05 75 01 91 01 95 04 75 08 15 00 26 ff 00 05 07 19 00 2a ff 00 81 00 c0 05 01 09 80 a1 01 85 03 09 81 25 01 15 00 75 01 95 01 81 06 95 07 81 01 c0 05 0c 09 01 a1 01 85 04 15 00 25 01 75 01 09 b7 09 b6 09 cd 09 b5 09 ea 09 e9 09 e2 95 07 81 06 95 01 81 01 c0 05 01 09 02 a1 01 85 05 09 01 a1 00 05 09 19 01 29 05 15 00 25 01 75 01 95 05 81 02 95 03 81 01 05 01 09 30 09 31 09 38 15 81 25 7f 75 08 95 03 81 06 c0 c0 05 0d 09 04 a1 01 85 02 09 22 a1 02 09 42 15 00 25 01 75 01 95 01 81 02 09 32 81 02 09 47 81 02 95 05 81 03 75 08 09 51 95 01 81 02 05 01 55 00 65 00 09 30 16 00 00 26 ff 01 35 00 46 00 00 75 10 81 02 09 31 46 00 00 81 02 c0 a1 02 05 0d 09 42 15 00 25 01 75 01 95 01 81 02 09 32 81 02 09 47 81 02 95 05 81 03 75 08 09 51 95 01 81 02 05 01 55 00 65 00 09 30 16 00 00 26 ff 01 35 00 46 00 00 75 10 81 02 09 31 46 00 00 81 02 c0 05 0d 09 54 09 01 75 08 15 00 25 08 81 02 09 55 b1 02 c0 05 0d 09 0e a1 01 85 06 09 23 a1 02 09 52 09 53 15 00 25 0a 75 08 95 02 b1 02 c0 c0
N: Anton Touch Pad
P: usb-0000:02:00.0-2.3/input0
I: 3 1130 3101
E: 0.000000 5 05 00 00 fb 00
E: 0.015944 5 05 00 00 f9 00
E: 0.023855 5 05 00 00 fa 00
E: 0.039902 5 05 00 00 f9 00
E: 0.055894 5 05 00 00 f9 00
E: 0.063857 5 05 00 00 f9 00
E: 0.079948 5 05 00 00 fa 00
E: 0.103945 5 05 00 00 fc 00
E: 0.111934 5 05 00 00 fc 00
E: 0.135945 5 05 00 00 fe 00
E: 0.151926 5 05 00 00 fc 00
E: 0.175928 5 05 00 00 fc 00
E: 0.199947 5 05 00 00 fe 00
E: 0.311995 5 05 00 00 00 00
E: 0.927970 5 05 00 00 02 00
E: 0.943945 5 05 00 00 04 00
E: 0.951933 5 05 00 01 05 00
E: 0.967929 5 05 00 00 05 00
E: 0.975935 5 05 00 00 06 00
E: 0.991961 5 05 00 01 05 00
E: 1.007944 5 05 00 01 07 00
E: 1.015926 5 05 00 01 06 00
E: 1.031976 5 05 00 00 06 00
E: 1.039967 5 05 00 00 02 00
E: 1.055933 5 05 00 00 02 00
E: 1.063950 5 05 00 01 05 00
E: 1.087951 5 05 00 00 02 00
E: 1.135937 5 05 00 01 02 00
E: 1.175933 5 05 00 00 02 00
E: 1.207965 5 05 00 ff 04 00
E: 1.248004 5 05 00 00 00 00
E: 1.671986 5 05 00 08 00 00
E: 1.687924 5 05 00 08 00 00
E: 1.695918 5 05 00 04 00 00
E: 1.711947 5 05 00 06 00 00
E: 1.719930 5 05 00 08 00 00
E: 1.735932 5 05 00 0a 00 00
E: 1.751960 5 05 00 0a 00 00
E: 1.759846 5 05 00 0a 01 00
E: 1.775883 5 05 00 0b 00 00
E: 1.783841 5 05 00 0a 01 00
E: 1.799850 5 05 00 0a 00 00
E: 1.807883 5 05 00 08 00 00
E: 1.823846 5 05 00 08 00 00
E: 1.831879 5 05 00 04 00 00
E: 1.847851 5 05 00 02 00 00
E: 1.895968 5 05 00 02 ff 00
E: 1.927972 5 05 00 02 00 00
E: 1.959928 5 05 00 00 00 00
E: 2.367964 5 05 00 fe 01 00
E: 2.391947 5 05 00 fe 01 00
E: 2.415954 5 05 00 fe 01 00
E: 2.431924 5 05 00 fe 01 00
E: 2.439936 5 05 00 fe 01 00
E: 2.455922 5 05 00 fe 01 00
E: 2.471919 5 05 00 fe ff 00
E: 2.479924 5 05 00 fe 00 00
E: 2.495934 5 05 00 fc ff 00
E: 2.503941 5 05 00 f8 00 00
E: 2.519960 5 05 00 f6 00 00
E: 2.527921 5 05 00 f6 00 00
E: 2.543931 5 05 00 f5 00 00
E: 2.551926 5 05 00 f5 00 00
E: 2.567894 5 05 00 f5 00 00
E: 2.575932 5 05 00 f5 00 00
E: 2.591946 5 05 00 f8 ff 00
E: 2.599929 5 05 00 f8 00 00
E: 2.615935 5 05 00 f8 00 00
E: 2.623930 5 05 00 f8 ff 00
E: 2.639969 5 05 00 fc 00 00
E: 2.647933 5 05 00 fc ff 00
E: 2.663997 5 05 00 fe ff 00
E: 2.671922 5 05 00 fe ff 00
E: 2.687932 5 05 00 fe 00 00
E: 2.695933 5 05 00 fc ff 00
E: 2.711937 5 05 00 fe ff 00
E: 2.727928 5 05 00 fc ff 00
E: 2.735927 5 05 00 fe ff 00
E: 2.751934 5 05 00 fe 00 00
E: 2.759984 5 05 00 fc 00 00
E: 2.783928 5 05 00 fe 00 00
E: 2.799891 5 05 00 fe 00 00
E: 2.823901 5 05 00 fc 00 00
E: 2.847915 5 05 00 00 00 00
E: 5.111988 5 05 01 00 00 00
E: 5.367997 5 05 00 00 00 00
E: 6.919991 5 05 02 00 00 00
E: 6.935934 5 05 02 00 00 00
E: 6.943920 5 05 02 00 00 00
E: 6.959920 5 05 02 00 00 00
E: 6.967927 5 05 02 00 00 00
E: 6.983912 5 05 02 00 00 00
E: 6.991912 5 05 02 00 00 00
E: 7.007923 5 05 02 00 00 00
E: 7.023920 5 05 02 00 00 00
E: 7.031925 5 05 02 00 00 00
E: 7.047962 5 05 02 00 00 00
E: 7.055929 5 05 02 00 00 00
E: 7.071927 5 05 02 00 00 00
E: 7.079939 5 05 02 00 00 00
E: 7.095911 5 05 02 00 00 00
E: 7.103919 5 05 02 00 00 00
E: 7.119917 5 05 00 00 00 00
E: 8.791910 5 05 01 00 00 00
E: 8.799882 5 05 01 00 00 00
E: 8.815916 5 05 01 00 00 00
E: 8.823909 5 05 01 00 00 00
E: 8.839918 5 05 01 00 00 00
E: 8.847915 5 05 01 00 00 00
E: 8.863956 5 05 01 00 00 00
E: 8.871916 5 05 01 00 00 00
E: 8.887947 5 05 01 00 00 00
E: 8.895920 5 05 01 00 00 00
E: 8.911916 5 05 01 00 00 00
E: 8.919924 5 05 01 00 00 00
E: 8.935929 5 05 01 00 00 00
E: 8.943927 5 05 01 00 00 00
E: 8.959913 5 05 01 00 00 00
E: 8.975910 5 05 01 00 00 00
E: 8.983916 5 05 01 00 00 00
E: 8.999917 5 05 01 00 00 00
E: 9.007910 5 05 01 00 00 00
E: 9.023914 5 05 01 00 00 00
E: 9.031913 5 05 00 00 00 00
