R: 370 05 01 09 07 a1 01 85 01 05 07 19 e0 29 e7 15 00 25 01 75 01 95 08 81 02 95 01 75 08 81 01 95 03 75 01 05 08 19 01 29 03 91 02 95 05 75 01 91 01 95 04 75 08 15 00 26 ff 00 05 07 19 00 2a ff 00 81 00 c0 05 01 09 80 a1 01 85 03 09 81 25 01 15 00 75 01 95 01 81 06 95 07 81 01 c0 05 0c 09 01 a1 01 85 04 15 00 25 01 75 01 09 b7 09 b6 09 cd 09 b5 09 ea 09 e9 09 e2 95 07 81 06 95 01 81 01 c0 05 01 09 02 a1 01 85 05 09 01 a1 00 05 09 19 01 29 05 15 00 25 01 75 01 95 05 81 02 95 03 81 01 05 01 09 30 09 31 09 38 15 81 25 7f 75 08 95 03 81 06 c0 c0 05 0d 09 04 a1 01 85 02 09 22 a1 02 09 42 15 00 25 01 75 01 95 01 81 02 09 32 81 02 09 47 81 02 95 05 81 03 75 08 09 51 95 01 81 02 05 01 55 00 65 00 09 30 16 00 00 26 ff 01 35 00 46 00 00 75 10 81 02 09 31 46 00 00 81 02 c0 a1 02 05 0d 09 42 15 00 25 01 75 01 95 01 81 02 09 32 81 02 09 47 81 02 95 05 81 03 75 08 09 51 95 01 81 02 05 01 55 00 65 00 09 30 16 00 00 26 ff 01 35 00 46 00 00 75 10 81 02 09 31 46 00 00 81 02 c0 05 0d 09 54 09 01 75 08 15 00 25 08 81 02 09 55 b1 02 c0 05 0d 09 0e a1 01 85 06 09 23 a1 02 09 52 09 53 15 00 25 0a 75 08 95 02 b1 02 c0 c0
N: Anton Touch Pad
P: usb-0000:02:00.0-2.3/input0
I: 3 1130 3101
E: 0.000000 14 02 07 00 12 01 2c 01 07 01 ca 00 2c 01 02
E: 0.015977 14 02 07 00 12 01 2c 01 07 01 ca 00 2c 01 02
E: 0.031916 14 02 07 00 12 01 2c 01 07 01 ca 00 2c 01 02
E: 0.047934 14 02 07 00 12 01 2c 01 07 01 ca 00 2c 01 02
E: 0.064103 14 02 07 00 12 01 2c 01 07 01 ca 00 2c 01 02
E: 0.080026 14 02 07 00 12 01 2c 01 07 01 ca 00 2c 01 02
E: 0.096153 14 02 07 00 12 01 2c 01 07 01 ca 00 2c 01 02
E: 0.111888 14 02 07 00 12 01 24 01 07 01 ca 00 2c 01 02
E: 0.127883 14 02 07 00 12 01 24 01 07 01 ca 00 2c 01 02
E: 0.143886 14 02 07 00 12 01 16 01 07 01 c7 00 29 01 02
E: 0.160009 14 02 07 00 12 01 16 01 07 01 bf 00 25 01 02
E: 0.175919 14 02 07 00 12 01 16 01 07 01 bf 00 25 01 02
E: 0.191957 14 02 07 00 13 01 09 01 07 01 bf 00 25 01 02
E: 0.207993 14 02 07 00 14 01 fc 00 07 01 b8 00 24 01 02
E: 0.223887 14 02 07 00 14 01 fc 00 07 01 b8 00 24 01 02
E: 0.239894 14 02 07 00 14 01 fc 00 07 01 b0 00 21 01 02
E: 0.255832 14 02 07 00 14 01 f1 00 07 01 b0 00 21 01 02
E: 0.271904 14 02 07 00 14 01 f1 00 07 01 a9 00 20 01 02
E: 0.287874 14 02 07 00 14 01 f1 00 07 01 a9 00 20 01 02
E: 0.304111 14 02 07 00 14 01 f1 00 07 01 a9 00 20 01 02
E: 0.319855 14 02 07 00 14 01 f1 00 07 01 a9 00 20 01 02
E: 0.335882 14 02 07 00 14 01 f1 00 07 01 a9 00 20 01 02
E: 0.352099 14 02 07 00 15 01 e6 00 07 01 a9 00 20 01 02
E: 0.367972 14 02 07 00 15 01 e6 00 07 01 a9 00 20 01 02
E: 0.383896 14 02 07 00 15 01 e6 00 07 01 a3 00 20 01 02
E: 0.399878 14 02 07 00 15 01 e6 00 07 01 a3 00 20 01 02
E: 0.415878 14 02 07 00 15 01 e6 00 07 01 a3 00 20 01 02
E: 0.431887 14 02 07 00 15 01 e6 00 07 01 a3 00 20 01 02
E: 0.447858 14 02 07 00 15 01 e6 00 07 01 a3 00 20 01 02
E: 0.463868 14 02 07 00 15 01 e6 00 07 01 a3 00 20 01 02
E: 0.479866 14 02 07 00 15 01 e6 00 07 01 a3 00 20 01 02
E: 0.495884 14 02 07 00 15 01 e6 00 07 01 9d 00 1a 01 02
E: 0.511889 14 02 07 00 15 01 e6 00 07 01 99 00 fc 00 02
E: 0.543857 14 02 00 00 15 01 e6 00 00 01 99 00 fc 00 02
E: 3.967983 14 02 07 00 f9 00 b0 00 00 01 99 00 fc 00 01
E: 3.983913 14 02 07 00 f9 00 b0 00 00 01 99 00 fc 00 01
E: 3.999895 14 02 07 00 f9 00 b0 00 00 01 99 00 fc 00 01
E: 4.015892 14 02 07 00 f9 00 b0 00 00 01 99 00 fc 00 01
E: 4.031926 14 02 07 00 f9 00 b0 00 07 01 00 01 3c 01 02
E: 4.048105 14 02 07 00 f9 00 b0 00 07 01 00 01 3c 01 02
E: 4.063936 14 02 07 00 f9 00 b0 00 07 01 00 01 3c 01 02
E: 4.079919 14 02 07 00 f9 00 b0 00 07 01 00 01 3c 01 02
E: 4.095949 14 02 07 00 f8 00 a8 00 07 01 00 01 3c 01 02
E: 4.111921 14 02 07 00 f8 00 a8 00 07 01 00 01 3c 01 02
E: 4.127945 14 02 07 00 f7 00 99 00 07 01 fb 00 3d 01 02
E: 4.143965 14 02 07 00 f7 00 99 00 07 01 f4 00 44 01 02
E: 4.159877 14 02 07 00 f7 00 99 00 07 01 f4 00 44 01 02
E: 4.175831 14 02 07 00 f7 00 99 00 07 01 f4 00 44 01 02
E: 4.191852 14 02 07 00 f7 00 99 00 07 01 f4 00 44 01 02
E: 4.207855 14 02 07 00 f7 00 99 00 07 01 f4 00 44 01 02
E: 4.224068 14 02 07 00 f8 00 8d 00 07 01 ee 00 4c 01 02
E: 4.240608 14 02 07 00 f8 00 8d 00 07 01 ee 00 4c 01 02
E: 4.263871 14 02 07 00 f8 00 8d 00 07 01 ee 00 4c 01 02
E: 4.279899 14 02 07 00 f8 00 8d 00 07 01 ee 00 4c 01 02
E: 4.319902 14 02 00 00 f8 00 8d 00 00 01 ee 00 4c 01 02
E: 5.447972 14 02 07 00 88 00 30 01 00 01 ee 00 4c 01 01
E: 5.463949 14 02 07 00 88 00 29 01 00 01 ee 00 4c 01 01
E: 5.479912 14 02 07 00 88 00 29 01 00 01 ee 00 4c 01 01
E: 5.496116 14 02 07 00 90 00 25 01 00 01 ee 00 4c 01 01
E: 5.512099 14 02 07 00 94 00 25 01 00 01 ee 00 4c 01 01
E: 5.527928 14 02 07 00 98 00 25 01 00 01 ee 00 4c 01 01
E: 5.543882 14 02 07 00 a4 00 25 01 00 01 ee 00 4c 01 01
E: 5.559913 14 02 07 00 ab 00 25 01 00 01 ee 00 4c 01 01
E: 5.575857 14 02 07 00 b1 00 24 01 00 01 ee 00 4c 01 01
E: 5.592100 14 02 07 00 c1 00 22 01 00 01 ee 00 4c 01 01
E: 5.607934 14 02 07 00 c8 00 21 01 00 01 ee 00 4c 01 01
E: 5.623923 14 02 07 00 cf 00 21 01 00 01 ee 00 4c 01 01
E: 5.639926 14 02 07 00 dc 00 20 01 00 01 ee 00 4c 01 01
E: 5.655972 14 02 07 00 e2 00 20 01 00 01 ee 00 4c 01 01
E: 5.671958 14 02 07 00 e8 00 1e 01 00 01 ee 00 4c 01 01
E: 5.687936 14 02 07 00 ec 00 1e 01 00 01 ee 00 4c 01 01
E: 5.704013 14 02 07 00 f6 00 1d 01 00 01 ee 00 4c 01 01
E: 5.720105 14 02 07 00 fa 00 1d 01 00 01 ee 00 4c 01 01
E: 5.735920 14 02 07 00 fa 00 1d 01 00 01 ee 00 4c 01 01
E: 5.752343 14 02 07 00 fe 00 1d 01 00 01 ee 00 4c 01 01
E: 5.768184 14 02 00 00 fe 00 1d 01 00 01 ee 00 4c 01 02
E: 7.607968 14 02 07 00 18 01 35 01 00 01 ee 00 4c 01 01
E: 7.623918 14 02 07 00 18 01 35 01 00 01 ee 00 4c 01 01
E: 7.639922 14 02 07 00 15 01 34 01 00 01 ee 00 4c 01 01
E: 7.655907 14 02 07 00 09 01 31 01 00 01 ee 00 4c 01 01
E: 7.671936 14 02 07 00 04 01 31 01 00 01 ee 00 4c 01 01
E: 7.688049 14 02 07 00 fe 00 31 01 00 01 ee 00 4c 01 01
E: 7.703934 14 02 07 00 f3 00 31 01 00 01 ee 00 4c 01 01
E: 7.719938 14 02 07 00 ed 00 30 01 00 01 ee 00 4c 01 01
E: 7.735979 14 02 07 00 e8 00 30 01 00 01 ee 00 4c 01 01
E: 7.751962 14 02 07 00 dc 00 2e 01 00 01 ee 00 4c 01 01
E: 7.767953 14 02 07 00 d6 00 2d 01 00 01 ee 00 4c 01 01
E: 7.783946 14 02 07 00 d0 00 2d 01 00 01 ee 00 4c 01 01
E: 7.799934 14 02 07 00 c4 00 2c 01 00 01 ee 00 4c 01 01
E: 7.816133 14 02 07 00 be 00 2a 01 00 01 ee 00 4c 01 01
E: 7.832338 14 02 07 00 b8 00 29 01 00 01 ee 00 4c 01 01
E: 7.847918 14 02 07 00 b4 00 28 01 00 01 ee 00 4c 01 01
E: 7.863951 14 02 07 00 ab 00 26 01 00 01 ee 00 4c 01 01
E: 7.879941 14 02 07 00 ab 00 26 01 00 01 ee 00 4c 01 01
E: 7.895900 14 02 07 00 ab 00 26 01 00 01 ee 00 4c 01 01
E: 7.912375 14 02 07 00 a8 00 26 01 00 01 ee 00 4c 01 01
E: 7.927908 14 02 07 00 a8 00 26 01 00 01 ee 00 4c 01 01
E: 7.943890 14 02 07 00 a8 00 26 01 00 01 ee 00 4c 01 01
E: 7.983922 14 02 00 00 a8 00 26 01 00 01 ee 00 4c 01 02
E: 8.399960 14 02 07 00 d8 00 81 01 00 01 ee 00 4c 01 01
E: 8.415873 14 02 07 00 d8 00 81 01 00 01 ee 00 4c 01 01
E: 8.431882 14 02 07 00 d8 00 7a 01 00 01 ee 00 4c 01 01
E: 8.447863 14 02 07 00 d8 00 5c 01 00 01 ee 00 4c 01 01
E: 8.463830 14 02 07 00 d8 00 4e 01 00 01 ee 00 4c 01 01
E: 8.480058 14 02 07 00 d8 00 41 01 00 01 ee 00 4c 01 01
E: 8.495949 14 02 07 00 d6 00 26 01 00 01 ee 00 4c 01 01
E: 8.511884 14 02 07 00 d6 00 19 01 00 01 ee 00 4c 01 01
E: 8.527871 14 02 07 00 d6 00 0c 01 00 01 ee 00 4c 01 01
E: 8.543954 14 02 07 00 d6 00 f2 00 00 01 ee 00 4c 01 01
E: 8.560092 14 02 07 00 d6 00 e8 00 00 01 ee 00 4c 01 01
E: 8.575961 14 02 07 00 d6 00 e0 00 00 01 ee 00 4c 01 01
E: 8.591859 14 02 07 00 d6 00 e0 00 00 01 ee 00 4c 01 01
E: 8.607883 14 02 07 00 d6 00 d9 00 00 01 ee 00 4c 01 01
E: 8.623880 14 02 07 00 d6 00 d9 00 00 01 ee 00 4c 01 01
E: 8.639886 14 02 07 00 d6 00 d9 00 00 01 ee 00 4c 01 01
E: 8.655880 14 02 07 00 d6 00 d9 00 00 01 ee 00 4c 01 01
E: 8.671886 14 02 07 00 d6 00 d9 00 00 01 ee 00 4c 01 01
E: 8.719919 14 02 00 00 d6 00 d9 00 00 01 ee 00 4c 01 02
E: 9.191859 14 02 07 00 dd 00 dd 00 00 01 ee 00 4c 01 01
E: 9.207846 14 02 07 00 dd 00 dd 00 00 01 ee 00 4c 01 01
E: 9.223836 14 02 07 00 dd 00 dd 00 00 01 ee 00 4c 01 01
E: 9.239825 14 02 07 00 dd 00 dd 00 00 01 ee 00 4c 01 01
E: 9.255853 14 02 07 00 dd 00 dd 00 00 01 ee 00 4c 01 01
E: 9.271841 14 02 07 00 dd 00 dd 00 00 01 ee 00 4c 01 01
E: 9.287844 14 02 07 00 dd 00 dd 00 00 01 ee 00 4c 01 01
E: 9.303838 14 02 07 00 dd 00 dd 00 00 01 ee 00 4c 01 01
E: 9.319796 14 02 07 00 dd 00 dd 00 00 01 ee 00 4c 01 01
E: 9.335829 14 02 07 00 dd 00 dd 00 00 01 ee 00 4c 01 01
E: 9.351827 14 02 07 00 dd 00 dd 00 00 01 ee 00 4c 01 01
E: 9.367835 14 02 07 00 dd 00 dd 00 00 01 ee 00 4c 01 01
E: 9.383827 14 02 07 00 dd 00 dd 00 00 01 ee 00 4c 01 01
E: 9.399857 14 02 07 00 dd 00 e0 00 00 01 ee 00 4c 01 01
E: 9.415825 14 02 07 00 dd 00 e0 00 00 01 ee 00 4c 01 01
E: 9.431849 14 02 07 00 dd 00 e6 00 00 01 ee 00 4c 01 01
E: 9.447851 14 02 07 00 dd 00 e6 00 00 01 ee 00 4c 01 01
E: 9.463852 14 02 07 00 dd 00 ed 00 00 01 ee 00 4c 01 01
E: 9.479810 14 02 07 00 dd 00 f4 00 00 01 ee 00 4c 01 01
E: 9.495849 14 02 07 00 dd 00 fa 00 00 01 ee 00 4c 01 01
E: 9.511848 14 02 07 00 de 00 01 01 00 01 ee 00 4c 01 01
E: 9.527836 14 02 07 00 df 00 09 01 00 01 ee 00 4c 01 01
E: 9.543836 14 02 07 00 e0 00 18 01 00 01 ee 00 4c 01 01
E: 9.559838 14 02 07 00 e0 00 1e 01 00 01 ee 00 4c 01 01
E: 9.575850 14 02 07 00 e0 00 25 01 00 01 ee 00 4c 01 01
E: 9.591837 14 02 07 00 e0 00 25 01 00 01 ee 00 4c 01 01
E: 9.607837 14 02 07 00 e1 00 34 01 00 01 ee 00 4c 01 01
E: 9.623838 14 02 07 00 e1 00 3c 01 00 01 ee 00 4c 01 01
E: 9.639837 14 02 07 00 e1 00 41 01 00 01 ee 00 4c 01 01
E: 9.655834 14 02 07 00 e2 00 46 01 00 01 ee 00 4c 01 01
E: 9.671848 14 02 07 00 e2 00 4c 01 00 01 ee 00 4c 01 01
E: 9.687848 14 02 07 00 e2 00 4c 01 00 01 ee 00 4c 01 01
E: 9.703835 14 02 07 00 e2 00 52 01 00 01 ee 00 4c 01 01
E: 9.719820 14 02 07 00 e2 00 52 01 00 01 ee 00 4c 01 01
E: 9.735828 14 02 07 00 e2 00 52 01 00 01 ee 00 4c 01 01
E: 9.751834 14 02 07 00 e2 00 52 01 00 01 ee 00 4c 01 01
E: 9.767821 14 02 07 00 e2 00 52 01 00 01 ee 00 4c 01 01
E: 9.783814 14 02 07 00 e2 00 52 01 00 01 ee 00 4c 01 01
E: 9.823835 14 02 00 00 e2 00 52 01 00 01 ee 00 4c 01 02
