R: 411 05 0d 09 04 a1 01 85 01 09 22 a1 02 09 42 15 00 25 01 75 01 95 01 81 02 95 02 81 03 09 51 25 1f 75 05 95 01 81 02 05 01 26 ff 7f 75 10 55 0e 65 11 09 30 35 00 46 f6 13 81 02 46 40 0b 09 31 81 02 45 00 c0 05 0d 09 22 a1 02 09 42 15 00 25 01 75 01 95 01 81 02 95 02 81 03 09 51 25 1f 75 05 95 01 81 02 05 01 26 ff 7f 75 10 55 0e 65 11 09 30 35 00 46 f6 13 81 02 46 40 0b 09 31 81 02 45 00 c0 05 0d 09 22 a1 02 09 42 15 00 25 01 75 01 95 01 81 02 95 02 81 03 09 51 25 1f 75 05 95 01 81 02 05 01 26 ff 7f 75 10 55 0e 65 11 09 30 35 00 46 f6 13 81 02 46 40 0b 09 31 81 02 45 00 c0 05 0d 09 22 a1 02 09 42 15 00 25 01 75 01 95 01 81 02 95 02 81 03 09 51 25 1f 75 05 95 01 81 02 05 01 26 ff 7f 75 10 55 0e 65 11 09 30 35 00 46 f6 13 81 02 46 40 0b 09 31 81 02 45 00 c0 05 0d 09 22 a1 02 09 42 15 00 25 01 75 01 95 01 81 02 95 02 81 03 09 51 25 1f 75 05 95 01 81 02 05 01 26 ff 7f 75 10 55 0e 65 11 09 30 35 00 46 f6 13 81 02 46 40 0b 09 31 81 02 45 00 c0 05 0d 15 00 27 ff ff 00 00 75 10 95 01 09 56 81 02 25 0a 75 08 09 54 81 02 85 44 09 55 b1 02 85 44 06 00 ff 09 c5 26 ff 00 96 00 01 b1 02 85 f0 09 01 95 04 81 02 85 f2 09 03 b1 02 09 04 b1 02 09 05 b1 02 95 01 09 06 b1 02 09 07 b1 02 85 f1 09 02 95 07 91 02 85 f3 09 08 95 3d b1 02 c0
N: Advanced Silicon S.A CoolTouch(TM) System
I: 3 2149 230a
