R: 639 05 0d 09 04 a1 01 85 01 09 22 a1 02 09 42 15 00 25 01 75 01 95 01 81 02 95 01 81 03 95 01 81 03 25 1f 75 05 09 51 81 02 05 01 55 0e 65 11 35 00 75 10 95 02 46 c8 0a 26 6f 08 09 30 81 02 35 00 35 00 46 18 06 26 77 0f 09 31 81 02 35 00 35 00 05 0d 95 01 75 08 15 00 26 ff 00 46 ff 00 09 48 81 02 09 49 81 02 c0 09 22 a1 02 09 42 15 00 25 01 75 01 95 01 81 02 95 01 81 03 95 01 81 03 25 1f 75 05 09 51 81 02 05 01 55 0e 65 11 35 00 75 10 95 02 46 c8 0a 26 6f 08 09 30 81 02 35 00 35 00 46 18 06 26 77 0f 09 31 81 02 35 00 35 00 05 0d 95 01 75 08 15 00 26 ff 00 46 ff 00 09 48 81 02 09 49 81 02 c0 09 22 a1 02 09 42 15 00 25 01 75 01 95 01 81 02 95 01 81 03 95 01 81 03 25 1f 75 05 09 51 81 02 05 01 55 0e 65 11 35 00 75 10 95 02 46 c8 0a 26 6f 08 09 30 81 02 35 00 35 00 46 18 06 26 77 0f 09 31 81 02 35 00 35 00 05 0d 95 01 75 08 15 00 26 ff 00 46 ff 00 09 48 81 02 09 49 81 02 c0 09 22 a1 02 09 42 15 00 25 01 75 01 95 01 81 02 95 01 81 03 95 01 81 03 25 1f 75 05 09 51 81 02 05 01 55 0e 65 11 35 00 75 10 95 02 46 c8 0a 26 6f 08 09 30 81 02 35 00 35 00 46 18 06 26 77 0f 09 31 81 02 35 00 35 00 05 0d 95 01 75 08 15 00 26 ff 00 46 ff 00 09 48 81 02 09 49 81 02 c0 09 22 a1 02 09 42 15 00 25 01 75 01 95 01 81 02 95 01 81 03 95 01 81 03 25 1f 75 05 09 51 81 02 05 01 55 0e 65 11 35 00 75 10 95 02 46 c8 0a 26 6f 08 09 30 81 02 35 00 35 00 46 18 06 26 77 0f 09 31 81 02 35 00 35 00 05 0d 95 01 75 08 15 00 26 ff 00 46 ff 00 09 48 81 02 09 49 81 02 c0 05 0d 27 ff ff 00 00 75 10 95 01 09 56 81 02 15 00 25 1f 75 05 09 54 95 01 81 02 75 03 25 01 95 01 81 03 75 08 85 02 09 55 25 10 b1 02 06 00 ff 85 05 09 c5 15 00 26 ff 00 75 08 96 00 01 b1 02 c0 05 0d 09 00 a1 01 85 03 09 20 a1 00 15 00 25 01 75 01 95 01 09 42 81 02 09 44 81 02 09 45 81 02 81 03 09 32 81 02 95 03 81 03 05 01 55 0e 65 11 35 00 75 10 95 02 46 c8 0a 26 6f 08 09 30 81 02 46 18 06 26 77 0f 09 31 81 02 05 0d 09 30 15 01 26 ff 00 75 08 95 01 81 02 c0 c0
N: Atmel Atmel maXTouch Digitizer
I: 3 03eb 8409
