R: 557 05 0d 09 04 a1 01 85 06 05 0d 09 54 75 08 15 00 25 0c 95 01 81 02 09 22 a1 02 09 42 15 00 25 01 75 01 95 01 81 02 95 07 81 03 75 08 09 51 95 01 15 00 25 20 81 02 05 01 26 ff 0f 75 10 55 0e 65 11 09 30 35 00 46 13 0c 81 02 46 cb 06 09 31 81 02 75 08 95 02 81 03 81 03 c0 05 0d 09 22 a1 02 09 42 15 00 25 01 75 01 95 01 81 02 95 07 81 03 75 08 09 51 95 01 15 00 25 20 81 02 05 01 26 ff 0f 75 10 55 0e 65 11 09 30 35 00 46 13 0c 81 02 46 cb 06 09 31 81 02 75 08 95 02 81 03 81 03 c0 05 0d 09 22 a1 02 09 42 15 00 25 01 75 01 95 01 81 02 95 07 81 03 75 08 09 51 95 01 15 00 25 20 81 02 05 01 26 ff 0f 75 10 55 0e 65 11 09 30 35 00 46 13 0c 81 02 46 cb 06 09 31 81 02 75 08 95 02 81 03 81 03 c0 05 0d 09 22 a1 02 09 42 15 00 25 01 75 01 95 01 81 02 95 07 81 03 75 08 09 51 95 01 15 00 25 20 81 02 05 01 26 ff 0f 75 10 55 0e 65 11 09 30 35 00 46 13 0c 81 02 46 cb 06 09 31 81 02 75 08 95 02 81 03 81 03 c0 05 0d 09 22 a1 02 09 42 15 00 25 01 75 01 95 01 81 02 95 07 81 03 75 08 09 51 95 01 15 00 25 20 81 02 05 01 26 ff 0f 75 10 55 0e 65 11 09 30 35 00 46 13 0c 81 02 46 cb 06 09 31 81 02 75 08 95 02 81 03 81 03 c0 05 0d 17 00 00 00 00 27 ff ff ff 7f 75 20 95 01 55 00 65 00 09 56 81 02 09 55 09 53 75 08 95 02 26 ff 00 b1 02 06 00 ff 09 c5 85 07 15 00 26 ff 00 75 08 96 00 01 b1 02 c0 05 01 09 01 a1 01 85 01 09 01 a1 02 05 09 19 01 29 02 15 00 25 01 95 02 75 01 81 02 95 01 75 06 81 01 05 01 09 30 09 31 16 00 00 26 ff 0f 36 00 00 46 ff 0f 66 00 00 75 10 95 02 81 02 c0 c0 06 00 ff 09 01 a1 01 09 01 15 00 26 ff 00 85 03 75 08 95 3f 81 02 06 00 ff 09 01 15 00 26 ff 00 75 08 95 3f 91 02 c0 05 0d 09 0e a1 01 85 05 09 23 a1 02 09 52 09 53 15 00 25 0a 75 08 95 02 b1 02 c0 c0
N: eGalax Inc. eGalaxTouch EXC7903-66v03_T1
I: 3 0eef 790a
