R: 219 05 0d 09 04 a1 01 85 01 09 22 a1 02 05 0d 09 42 15 00 25 01 75 01 95 01 81 02 09 32 81 02 75 06 09 51 25 3f 81 02 26 ff 00 75 08 09 48 81 02 09 49 81 02 95 01 05 01 26 c0 0e 75 10 55 0f 65 11 09 30 35 00 46 26 01 95 02 81 02 26 40 08 46 a6 00 09 31 81 02 c0 a1 02 05 0d 09 42 15 00 25 01 75 01 95 01 81 02 09 32 81 02 75 06 09 51 25 3f 81 02 26 ff 00 75 08 09 48 81 02 09 49 81 02 95 01 05 01 26 c0 0e 75 10 55 0f 65 11 09 30 35 00 46 26 01 95 02 81 02 26 40 08 46 a6 00 09 31 81 02 c0 05 0d 09 56 55 00 65 00 27 ff ff 00 00 95 01 75 20 81 02 09 54 25 7f 95 01 75 08 81 02 85 0a 09 55 25 0a b1 02 85 0e 06 00 ff 09 c5 15 00 26 ff 00 75 08 96 00 01 b1 02 c0
N: i2c_hid 04F3:200A
P: 
I: 18 04f3 200a
