R: 270 05 0d 09 04 a1 01 85 01 09 22 a1 02 09 42 15 00 25 01 75 01 95 01 81 02 95 01 81 03 95 06 81 03 75 08 09 51 95 01 81 02 05 01 26 ff 0f 75 10 55 0e 65 11 09 30 35 00 46 c0 08 95 01 81 02 09 00 81 03 46 ec 04 26 ff 0f 09 31 81 02 09 00 81 03 05 0d 26 ff 00 46 ff 00 95 01 09 00 81 03 09 00 81 03 c0 05 0d 27 ff ff 00 00 75 10 95 01 09 56 81 02 09 54 25 10 95 01 75 08 81 02 85 02 09 55 95 01 25 0a b1 02 06 00 ff 09 c5 85 05 15 00 26 ff 00 75 08 96 00 01 b1 02 c0 06 00 ff 09 01 a1 01 15 00 26 ff 00 75 08 85 06 95 11 09 01 81 02 09 01 91 02 c0 05 0d 09 00 a1 01 85 07 09 20 a1 02 09 42 09 44 09 45 15 00 25 01 75 01 95 03 81 02 95 01 81 03 09 32 81 02 95 03 81 03 05 01 55 0e 65 11 35 00 75 10 95 02 46 c0 08 26 ff 0f 09 30 81 02 46 ec 04 26 ff 0f 09 31 81 02 05 0d 09 30 15 01 26 ff 00 75 08 95 01 81 02 c0 c0
N: atmel_mxt_ts
I: 18 03eb 212c
E: 0.000000 18 01 01 00 a2 0d a2 0d 41 06 41 06 07 00 03 00 00 00 01
E: 0.100000 18 01 01 00 a2 0d a2 0d 41 06 41 06 07 00 03 00 3d 00 01
E: 0.200000 18 01 01 00 a2 0d a2 0d 41 06 41 06 07 00 03 00 95 00 01
E: 0.300000 18 01 01 00 a2 0d a2 0d 41 06 41 06 07 00 03 00 ef 00 01
E: 0.400000 18 01 01 00 a2 0d a2 0d 41 06 41 06 07 00 03 00 49 01 01
E: 0.500000 18 01 01 00 a2 0d a2 0d 41 06 41 06 07 00 03 00 a3 01 01
E: 0.600000 18 01 01 00 a2 0d a2 0d 41 06 41 06 07 00 03 00 fd 01 01
E: 0.700000 18 01 01 00 a2 0d a2 0d 41 06 41 06 07 00 03 00 57 02 01
E: 0.800000 18 01 01 00 a2 0d a2 0d 41 06 41 06 07 00 03 00 b0 02 01
E: 0.900000 18 01 01 00 a2 0d a2 0d 41 06 41 06 07 00 03 00 f7 02 01
E: 1.000000 18 01 01 00 a2 0d a2 0d 41 06 41 06 07 00 03 00 34 03 01
E: 1.100000 18 01 01 00 a2 0d a2 0d 41 06 41 06 02 00 01 00 e0 03 01
# touch top left
E: 1.200000 18 01 00 00 a2 0d a2 0d 41 06 41 06 02 00 01 00 e1 03 01
E: 1.300000 18 01 01 00 66 01 66 01 a1 01 a1 01 06 00 06 00 00 00 01
E: 1.400000 18 01 01 00 66 01 66 01 a1 01 a1 01 06 00 06 00 3d 00 01
E: 1.500000 18 01 01 00 66 01 66 01 a1 01 a1 01 06 00 06 00 95 00 01
E: 1.600000 18 01 01 00 66 01 66 01 a1 01 a1 01 06 00 06 00 ef 00 01
E: 1.700000 18 01 01 00 66 01 66 01 a1 01 a1 01 06 00 06 00 49 01 01
E: 1.800000 18 01 01 00 66 01 66 01 a1 01 a1 01 06 00 06 00 a3 01 01
E: 1.900000 18 01 01 00 66 01 66 01 a1 01 a1 01 06 00 06 00 fd 01 01
E: 2.000000 18 01 01 00 66 01 66 01 a1 01 a1 01 06 00 06 00 57 02 01
E: 2.100000 18 01 01 00 66 01 66 01 a1 01 a1 01 06 00 06 00 b0 02 01
E: 2.200000 18 01 01 00 66 01 66 01 a1 01 a1 01 06 00 06 00 f7 02 01
E: 2.300000 18 01 01 00 66 01 66 01 a1 01 a1 01 01 00 03 00 a3 03 01
# touch bottom left
E: 2.400000 18 01 00 00 66 01 66 01 a1 01 a1 01 01 00 03 00 a4 03 01
E: 2.500000 18 01 01 00 74 01 74 01 1e 0f 1e 0f 07 00 05 00 9d 99 01
E: 2.600000 18 01 01 00 74 01 74 01 1e 0f 1e 0f 07 00 05 00 da 99 01
E: 2.700000 18 01 01 00 74 01 74 01 1e 0f 1e 0f 07 00 05 00 32 9a 01
E: 2.800000 18 01 01 00 74 01 74 01 1e 0f 1e 0f 07 00 05 00 8c 9a 01
E: 2.900000 18 01 01 00 74 01 74 01 1e 0f 1e 0f 07 00 05 00 e6 9a 01
E: 3.000000 18 01 01 00 74 01 74 01 1e 0f 1e 0f 07 00 05 00 3f 9b 01
E: 3.100000 18 01 01 00 74 01 74 01 1e 0f 1e 0f 07 00 05 00 9a 9b 01
E: 3.200000 18 01 01 00 74 01 74 01 1e 0f 1e 0f 07 00 05 00 f5 9b 01
E: 3.300000 18 01 01 00 74 01 74 01 1e 0f 1e 0f 01 00 02 00 c5 9c 01
# touch bottom right
E: 3.400000 18 01 00 00 74 01 74 01 1e 0f 1e 0f 01 00 02 00 c6 9c 01
E: 3.500000 18 01 01 00 1c 0f 1c 0f 6b 0e 6b 0e 04 00 03 00 a7 01 01
E: 3.600000 18 01 01 00 1c 0f 1c 0f 6b 0e 6b 0e 04 00 03 00 e4 01 01
E: 3.700000 18 01 01 00 1c 0f 1c 0f 6b 0e 6b 0e 04 00 03 00 3d 02 01
E: 3.800000 18 01 01 00 1c 0f 1c 0f 6b 0e 6b 0e 04 00 03 00 97 02 01
E: 3.900000 18 01 01 00 1c 0f 1c 0f 6b 0e 6b 0e 04 00 03 00 f1 02 01
E: 4.000000 18 01 01 00 1c 0f 1c 0f 6b 0e 6b 0e 04 00 03 00 4b 03 01
E: 4.100000 18 01 01 00 1c 0f 1c 0f 6b 0e 6b 0e 04 00 03 00 a5 03 01
E: 4.200000 18 01 01 00 1c 0f 1c 0f 6b 0e 6b 0e 04 00 03 00 fe 03 01
E: 4.300000 18 01 01 00 1c 0f 1c 0f 6b 0e 6b 0e 04 00 03 00 58 04 01
E: 4.400000 18 01 01 00 1c 0f 1c 0f 6b 0e 6b 0e 04 00 03 00 9f 04 01
E: 4.500000 18 01 01 00 1c 0f 1c 0f 6b 0e 6b 0e 03 00 05 00 4c 05 01
# touch middle of the panel
E: 4.600000 18 01 00 00 1c 0f 1c 0f 6b 0e 6b 0e 03 00 05 00 4d 05 01
E: 4.700000 18 01 01 00 c6 08 c6 08 d7 06 d7 06 05 00 04 00 f3 54 01
E: 4.800000 18 01 01 00 c6 08 c6 08 d7 06 d7 06 05 00 04 00 30 55 01
E: 4.900000 18 01 01 00 c6 08 c6 08 d7 06 d7 06 05 00 04 00 89 55 01
E: 5.000000 18 01 01 00 c6 08 c6 08 d7 06 d7 06 05 00 04 00 e3 55 01
E: 5.100000 18 01 01 00 c6 08 c6 08 d7 06 d7 06 04 00 03 00 ab 56 01
E: 5.200000 18 01 00 00 c6 08 c6 08 d7 06 d7 06 04 00 03 00 ab 56 01

E: 10.000000 18 01 01 00 ab 03 00 00 bb 01 00 00 00 00 00 00 00 00 01
E: 10.100000 18 01 01 00 ab 03 00 00 bb 01 00 00 00 00 00 00 41 00 01
E: 10.200000 18 01 01 00 ab 03 00 00 bb 01 00 00 00 00 00 00 7f 00 01
E: 10.300000 18 01 01 00 9a 03 00 00 bb 01 00 00 00 00 00 00 cd 00 01
E: 10.400000 18 01 01 00 97 03 00 00 bb 01 00 00 00 00 00 00 27 01 01
E: 10.500000 18 01 01 00 94 03 00 00 bb 01 00 00 00 00 00 00 80 01 01
E: 10.600000 18 01 01 00 91 03 00 00 bb 01 00 00 00 00 00 00 da 01 01
E: 10.700000 18 01 01 00 8e 03 00 00 bb 01 00 00 00 00 00 00 35 02 01
E: 10.800000 18 01 01 00 8d 03 00 00 bb 01 00 00 00 00 00 00 8d 02 01
E: 10.900000 18 01 01 00 8e 03 00 00 bb 01 00 00 00 00 00 00 f1 02 01
E: 11.000000 18 01 00 00 8e 03 00 00 bb 01 00 00 00 00 00 00 48 03 01
E: 11.100000 18 01 01 00 a1 0c 00 00 84 0d 00 00 00 00 00 00 29 46 01
E: 11.200000 18 01 01 00 a1 0c 00 00 84 0d 00 00 00 00 00 00 66 46 01
E: 11.300000 18 01 01 00 a1 0c 00 00 84 0d 00 00 00 00 00 00 be 46 01
E: 11.400000 18 01 01 00 a1 0c 00 00 84 0d 00 00 00 00 00 00 18 47 01
E: 11.500000 18 01 01 00 a1 0c 00 00 84 0d 00 00 00 00 00 00 72 47 01
E: 11.600000 18 01 01 00 a1 0c 00 00 84 0d 00 00 00 00 00 00 cc 47 01
E: 11.700000 18 01 01 00 a1 0c 00 00 84 0d 00 00 00 00 00 00 27 48 01
E: 11.800000 18 01 01 00 a1 0c 00 00 84 0d 00 00 00 00 00 00 7f 48 01
E: 11.900000 18 01 01 00 a1 0c 00 00 84 0d 00 00 00 00 00 00 d9 48 01
E: 12.000000 18 01 01 00 a1 0c 00 00 84 0d 00 00 00 00 00 00 3d 49 01
E: 12.100000 18 01 00 00 a1 0c 00 00 84 0d 00 00 00 00 00 00 94 49 01
E: 12.200000 18 01 01 00 b0 02 00 00 c3 0d 00 00 00 00 00 00 da 73 01
E: 12.300000 18 01 01 00 b0 02 00 00 c3 0d 00 00 00 00 00 00 17 74 01
E: 12.400000 18 01 01 00 b0 02 00 00 c3 0d 00 00 00 00 00 00 6f 74 01
E: 12.500000 18 01 01 00 b0 02 00 00 c3 0d 00 00 00 00 00 00 c9 74 01
E: 12.600000 18 01 01 00 c4 02 00 00 c3 0d 00 00 00 00 00 00 23 75 01
E: 12.700000 18 01 01 00 d5 02 00 00 b4 0d 00 00 00 00 00 00 7d 75 01
E: 12.800000 18 01 01 00 e7 02 00 00 a9 0d 00 00 00 00 00 00 d7 75 01
E: 12.900000 18 01 01 00 00 03 00 00 9a 0d 00 00 00 00 00 00 30 76 01
E: 13.000000 18 01 01 00 22 03 00 00 86 0d 00 00 00 00 00 00 8a 76 01
E: 13.100000 18 01 01 00 40 03 00 00 6f 0d 00 00 00 00 00 00 d5 76 01
E: 13.200000 18 01 01 00 5f 03 00 00 5a 0d 00 00 00 00 00 00 12 77 01
E: 13.300000 18 01 01 00 81 03 00 00 48 0d 00 00 00 00 00 00 50 77 01
E: 13.400000 18 01 01 00 a2 03 00 00 36 0d 00 00 00 00 00 00 96 77 01
E: 13.500000 18 01 01 00 a2 03 00 00 36 0d 00 00 00 00 00 00 fa 77 01
E: 13.600000 18 01 00 00 a2 03 00 00 36 0d 00 00 00 00 00 00 fa 77 01
