R: 361 05 01 09 02 a1 01 85 01 09 01 a1 00 05 09 19 01 29 02 15 00 25 01 75 01 95 02 81 02 95 06 81 03 05 01 09 30 09 31 09 38 15 81 25 7f 75 08 95 03 81 06 05 0c 0a 38 02 95 01 81 06 75 08 95 03 81 03 c0 06 00 ff 85 0d 09 c5 15 00 26 ff 00 75 08 95 04 b1 02 85 0c 09 c6 96 76 02 75 08 b1 02 85 0b 09 c7 95 42 75 08 b1 02 09 01 85 5d 95 1f 75 08 81 06 c0 05 0d 09 05 a1 01 85 04 09 22 a1 02 15 00 25 01 09 47 09 42 95 02 75 01 81 02 95 01 75 02 25 02 09 51 81 02 75 01 95 04 81 03 05 01 15 00 26 a7 0c 75 10 55 0e 65 13 09 30 35 00 46 9d 01 95 01 81 02 46 25 01 26 2b 09 26 2b 09 09 31 81 02 05 0d 15 00 25 64 95 03 c0 55 0c 66 01 10 47 ff ff 00 00 27 ff ff 00 00 75 10 95 01 09 56 81 02 09 54 25 7f 95 01 75 08 81 02 05 09 09 01 25 01 75 01 95 01 81 02 95 07 81 03 05 0d 85 02 09 55 09 59 75 04 95 02 25 0f b1 02 85 07 09 60 75 01 95 01 15 00 25 01 b1 02 95 0f b1 03 06 00 ff 06 00 ff 85 06 09 c5 15 00 26 ff 00 75 08 96 00 01 b1 02 c0 05 0d 09 0e a1 01 85 03 09 22 a1 00 09 52 15 00 25 0a 75 08 95 02 b1 02 c0 09 22 a1 00 85 05 09 57 09 58 15 00 75 01 95 02 25 03 b1 02 95 0e b1 03 c0 c0
N: ELAN0501:00 04F3:300B
P: 
I: 18 04f3 300b
D: 0
E: 0.000000 10 04 03 f1 04 60 05 bc cd 01 80
E: 0.001746 10 04 03 f1 04 60 05 98 ce 03 80
E: 0.003393 10 04 07 cd 04 01 02 98 ce 00 80
E: 0.005041 10 04 0b 1d 07 50 01 98 ce 00 80
E: 0.008196 10 04 03 f1 04 60 05 d4 ce 03 80
E: 0.009843 10 04 07 cd 04 01 02 d4 ce 00 80
E: 0.011490 10 04 0b 1d 07 50 01 d4 ce 00 80
E: 0.014834 10 04 01 f1 04 60 05 1a cf 03 80
E: 0.016479 10 04 07 80 04 14 02 1a cf 00 80
E: 0.018124 10 04 0b 1d 07 50 01 1a cf 00 80
E: 0.021674 10 04 07 17 04 4b 02 60 cf 02 80
E: 0.023327 10 04 09 1d 07 50 01 60 cf 00 80
E: 0.030354 10 04 07 01 04 5a 02 ba cf 01 80
E: 0.036953 10 04 07 f1 03 6b 02 f6 cf 01 80
E: 0.043338 10 04 07 e4 03 7b 02 3c d0 01 80
E: 0.049939 10 04 07 d7 03 8b 02 78 d0 01 80
E: 0.056539 10 04 07 cd 03 9e 02 be d0 01 80
E: 0.061968 10 04 07 c4 03 b2 02 f0 d0 01 80
E: 0.067708 10 04 03 44 06 4e 02 2c d1 02 80
E: 0.069351 10 04 07 bb 03 c1 02 2c d1 00 80
E: 0.075259 10 04 03 44 06 4e 02 7c d1 02 80
E: 0.076903 10 04 07 b4 03 d1 02 7c d1 00 80
E: 0.080720 10 04 03 44 06 4e 02 ae d1 02 80
E: 0.082368 10 04 07 ae 03 e5 02 ae d1 00 80
E: 0.086191 10 04 03 44 06 4e 02 ea d1 02 80
E: 0.087839 10 04 07 a9 03 f6 02 ea d1 00 80
E: 0.091414 10 04 03 44 06 4e 02 1c d2 02 80
E: 0.092563 10 04 07 a5 03 05 03 1c d2 00 80
E: 0.096639 10 04 03 44 06 4e 02 58 d2 02 80
E: 0.097793 10 04 07 a2 03 12 03 58 d2 00 80
E: 0.102106 10 04 03 3b 06 68 02 8a d2 02 80
E: 0.103267 10 04 07 a0 03 1c 03 8a d2 00 80
E: 0.107581 10 04 03 31 06 8c 02 c6 d2 02 80
E: 0.108734 10 04 07 9d 03 24 03 c6 d2 00 80
E: 0.113050 10 04 03 2d 06 9e 02 f8 d2 02 80
E: 0.114203 10 04 07 9a 03 2b 03 f8 d2 00 80
E: 0.119046 10 04 03 2c 06 a9 02 34 d3 02 80
E: 0.120469 10 04 07 97 03 31 03 34 d3 00 80
E: 0.126602 10 04 03 2c 06 b3 02 84 d3 03 80
E: 0.127752 10 04 05 97 03 31 03 84 d3 00 80
E: 0.129168 10 04 0b 58 0a 4c 03 84 d3 00 80
E: 0.132713 10 04 03 2d 06 be 02 c0 d3 02 80
E: 0.134134 10 04 0b 58 0a 4c 03 c0 d3 00 80
E: 0.138417 10 04 03 30 06 c7 02 fc d3 02 80
E: 0.139837 10 04 0b 58 0a 4c 03 fc d3 00 80
E: 0.144111 10 04 03 34 06 d0 02 2e d4 02 80
E: 0.145257 10 04 0b 58 0a 4c 03 2e d4 00 80
E: 0.149805 10 04 03 39 06 d8 02 6a d4 02 80
E: 0.151228 10 04 0b 58 0a 4c 03 6a d4 00 80
E: 0.155466 10 04 01 39 06 d8 02 a6 d4 02 80
E: 0.156884 10 04 0b 62 0a 5c 03 a6 d4 00 80
E: 0.161363 10 04 0b 78 0a 75 03 e2 d4 01 80
E: 0.167715 10 04 0b 9c 0a 8e 03 1e d5 01 80
E: 0.176015 10 04 0b cb 0a a1 03 6e d5 01 80
E: 0.182170 10 04 0b fc 0a ad 03 aa d5 01 80
E: 0.187338 10 04 03 7a 02 f0 06 e6 d5 02 80
E: 0.188488 10 04 09 fc 0a ad 03 e6 d5 00 80
E: 0.192968 10 04 03 7a 02 f0 06 18 d6 01 80
E: 0.199363 10 04 03 7a 02 f0 06 5e d6 01 80
E: 0.205492 10 04 03 7a 02 f0 06 9a d6 01 80
E: 0.211581 10 04 03 7a 02 07 07 d6 d6 01 80
E: 0.217954 10 04 03 7b 02 34 07 12 d7 01 80
E: 0.226001 10 04 03 7b 02 5d 07 62 d7 01 80
E: 0.232353 10 04 03 77 02 79 07 a8 d7 01 80
E: 0.238932 10 04 03 73 02 8c 07 e4 d7 01 80
E: 0.245538 10 04 03 6f 02 9c 07 2a d8 02 80
E: 0.246895 10 04 07 c5 03 3c 04 2a d8 00 80
E: 0.252187 10 04 03 6a 02 a7 07 70 d8 02 80
E: 0.253529 10 04 07 c5 03 3c 04 70 d8 00 80
E: 0.258777 10 04 03 61 02 ae 07 ac d8 02 80
E: 0.260137 10 04 07 c5 03 3c 04 ac d8 00 80
E: 0.265445 10 04 03 56 02 b1 07 f2 d8 02 80
E: 0.266810 10 04 07 c5 03 3c 04 f2 d8 00 80
E: 0.273973 10 04 03 48 02 b0 07 42 d9 02 80
E: 0.275379 10 04 07 c5 03 3c 04 42 d9 00 80
E: 0.280590 10 04 03 34 02 ad 07 88 d9 02 80
E: 0.281988 10 04 07 c5 03 3c 04 88 d9 00 80
E: 0.286989 10 04 03 1b 02 a8 07 ce d9 02 80
E: 0.288394 10 04 07 af 03 36 04 ce d9 00 80
E: 0.293377 10 04 01 1b 02 a8 07 0a da 03 80
E: 0.294783 10 04 07 8c 03 26 04 0a da 00 80
E: 0.296187 10 04 0b 1e 06 5d 03 0a da 00 80
E: 0.299131 10 04 07 69 03 0a 04 46 da 02 80
E: 0.300261 10 04 0b 1e 06 5d 03 46 da 00 80
E: 0.305065 10 04 07 4a 03 e8 03 82 da 02 80
E: 0.306181 10 04 0b 14 06 51 03 82 da 00 80
E: 0.310777 10 04 07 31 03 c5 03 be da 02 80
E: 0.311882 10 04 0b fb 05 30 03 be da 00 80
E: 0.316608 10 04 07 1a 03 9d 03 f0 da 02 80
E: 0.317692 10 04 0b e3 05 0a 03 f0 da 00 80
E: 0.324629 10 04 07 06 03 70 03 4a db 02 80
E: 0.325777 10 04 0b c8 05 dd 02 4a db 00 80
E: 0.331494 10 04 07 f1 02 34 03 86 db 02 80
E: 0.332844 10 04 0b a6 05 99 02 86 db 00 80
E: 0.337895 10 04 03 a2 0a a8 02 cc db 03 80
E: 0.339266 10 04 07 e3 02 f8 02 cc db 00 80
E: 0.340623 10 04 0b 94 05 5a 02 cc db 00 80
E: 0.344893 10 04 03 a2 0a a8 02 12 dc 03 80
E: 0.345999 10 04 07 d1 02 b4 02 12 dc 00 80
E: 0.347380 10 04 0b 8f 05 22 02 12 dc 00 80
E: 0.351037 10 04 03 a2 0a a8 02 4e dc 03 80
E: 0.352148 10 04 07 d1 02 b4 02 4e dc 00 80
E: 0.353249 10 04 0b 8f 05 22 02 4e dc 00 80
E: 0.356607 10 04 03 a2 0a a8 02 80 dc 03 80
E: 0.357966 10 04 07 d1 02 b4 02 80 dc 00 80
E: 0.359324 10 04 0b 8f 05 22 02 80 dc 00 80
E: 0.361959 10 04 03 a2 0a a8 02 bc dc 03 80
E: 0.363309 10 04 05 d1 02 b4 02 bc dc 00 80
E: 0.364429 10 04 09 8f 05 22 02 bc dc 00 80
E: 0.367864 10 04 03 89 0a 3e 02 f8 dc 01 80
E: 0.375592 10 04 03 7b 0a ad 01 48 dd 01 80
E: 0.381172 10 04 03 8f 0a 6e 01 7a dd 01 80
E: 0.387470 10 04 03 a2 0a 38 01 c0 dd 01 80
E: 0.393634 10 04 03 d2 0a 22 01 fc dd 01 80
E: 0.398802 10 04 03 d2 0a 22 01 2e de 01 80
E: 0.404440 10 04 01 d2 0a 22 01 6a de 02 80
E: 0.405586 10 04 07 6d 01 10 04 6a de 00 80
E: 0.410366 10 04 07 6d 01 10 04 9c de 01 80
E: 0.415767 10 04 07 6d 01 10 04 d8 de 01 80
E: 0.423157 10 04 07 80 01 ec 03 1e df 01 80
E: 0.428589 10 04 07 bc 01 97 03 5a df 01 80
E: 0.433960 10 04 07 e6 01 6e 03 8c df 01 80
E: 0.439421 10 04 07 ff 01 5e 03 c8 df 01 80
E: 0.445478 10 04 07 12 02 5a 03 04 e0 01 80
E: 0.451713 10 04 07 28 02 5a 03 40 e0 01 80
E: 0.458045 10 04 03 f7 03 65 00 7c e0 02 80
E: 0.459440 10 04 07 42 02 5e 03 7c e0 00 80
E: 0.464585 10 04 03 f7 03 65 00 c2 e0 02 80
E: 0.465974 10 04 07 55 02 63 03 c2 e0 00 80
E: 0.473020 10 04 03 f7 03 65 00 12 e1 02 80
E: 0.474414 10 04 07 61 02 6d 03 12 e1 00 80
E: 0.479078 10 04 03 f7 03 65 00 4e e1 02 80
E: 0.480730 10 04 07 6d 02 83 03 4e e1 00 80
E: 0.484911 10 04 03 f7 03 65 00 8a e1 02 80
E: 0.486561 10 04 07 79 02 a0 03 8a e1 00 80
E: 0.490279 10 04 03 10 04 b6 00 bc e1 02 80
E: 0.491933 10 04 07 86 02 c0 03 bc e1 00 80
E: 0.495441 10 04 03 2c 04 20 01 f8 e1 02 80
E: 0.497089 10 04 05 86 02 c0 03 f8 e1 00 80
E: 0.500818 10 04 03 34 04 48 01 2a e2 01 80
E: 0.506193 10 04 03 39 04 6b 01 5c e2 01 80
E: 0.511630 10 04 03 3d 04 93 01 98 e2 02 80
E: 0.513279 10 04 07 c8 06 3e 01 98 e2 00 80
E: 0.517231 10 04 03 3d 04 bd 01 ca e2 02 80
E: 0.518858 10 04 07 c8 06 3e 01 ca e2 00 80
E: 0.524978 10 04 03 3f 04 e3 01 1a e3 02 80
E: 0.526638 10 04 07 ca 06 56 01 1a e3 00 80
E: 0.530601 10 04 03 41 04 17 02 56 e3 02 80
E: 0.532249 10 04 07 cb 06 8c 01 56 e3 00 80
E: 0.536133 10 04 03 41 04 3d 02 88 e3 02 80
E: 0.537781 10 04 07 cd 06 bd 01 88 e3 00 80
E: 0.541795 10 04 03 43 04 5e 02 c4 e3 02 80
E: 0.543411 10 04 07 cd 06 e2 01 c4 e3 00 80
E: 0.547425 10 04 03 47 04 7c 02 00 e4 02 80
E: 0.549028 10 04 07 cd 06 04 02 00 e4 00 80
E: 0.553133 10 04 03 47 04 93 02 32 e4 02 80
E: 0.554735 10 04 07 ce 06 24 02 32 e4 00 80
E: 0.559511 10 04 03 4d 04 ad 02 78 e4 02 80
E: 0.561113 10 04 07 cf 06 3e 02 78 e4 00 80
E: 0.565975 10 04 03 51 04 c3 02 b4 e4 03 80
E: 0.567581 10 04 07 d1 06 53 02 b4 e4 00 80
E: 0.569180 10 04 0b 3a 0b 08 03 b4 e4 00 80
E: 0.573591 10 04 03 5b 04 dc 02 04 e5 03 80
E: 0.575203 10 04 07 d9 06 72 02 04 e5 00 80
E: 0.576803 10 04 0b 3a 0b 08 03 04 e5 00 80
E: 0.579559 10 04 03 5b 04 dc 02 40 e5 03 80
E: 0.581197 10 04 07 d9 06 72 02 40 e5 00 80
E: 0.582835 10 04 0b 3a 0b 08 03 40 e5 00 80
E: 0.585074 10 04 03 5b 04 dc 02 72 e5 03 80
E: 0.586710 10 04 07 d9 06 72 02 72 e5 00 80
E: 0.588346 10 04 0b 3a 0b 08 03 72 e5 00 80
E: 0.590506 10 04 01 5b 04 dc 02 ae e5 03 80
E: 0.592165 10 04 05 d9 06 72 02 ae e5 00 80
E: 0.593820 10 04 0b 3a 0b 08 03 ae e5 00 80
E: 0.595965 10 04 0b 44 0b 26 03 e0 e5 01 80
E: 0.601388 10 04 0b 58 0b 4f 03 1c e6 01 80
E: 0.606816 10 04 0b 73 0b 6d 03 58 e6 01 80
E: 0.611800 10 04 0b 73 0b 6d 03 80 e6 01 80
E: 0.616948 10 04 09 73 0b 6d 03 bc e6 01 80
E: 0.635125 10 04 03 c6 02 a8 06 70 e7 01 80
E: 0.640775 10 04 03 c6 02 a8 06 a2 e7 01 80
E: 0.646195 10 04 03 c6 02 a8 06 de e7 01 80
E: 0.651615 10 04 03 c6 02 a8 06 10 e8 01 80
E: 0.657045 10 04 03 c6 02 a8 06 4c e8 01 80
E: 0.662466 10 04 03 c6 02 a8 06 7e e8 01 80
E: 0.667891 10 04 03 c6 02 a8 06 ba e8 01 80
E: 0.675307 10 04 03 c6 02 a8 06 00 e9 01 80
E: 0.680729 10 04 03 c6 02 a8 06 3c e9 01 80
E: 0.686150 10 04 03 bf 02 97 06 6e e9 01 80
E: 0.691815 10 04 03 b4 02 75 06 aa e9 01 80
E: 0.697467 10 04 03 ac 02 4c 06 dc e9 01 80
E: 0.703986 10 04 03 a8 02 24 06 22 ea 01 80
E: 0.710805 10 04 03 a9 02 fa 05 68 ea 01 80
E: 0.717887 10 04 03 ad 02 d4 05 ae ea 02 80
E: 0.719482 10 04 07 79 04 87 02 ae ea 00 80
E: 0.726620 10 04 03 bc 02 9d 05 08 eb 02 80
E: 0.728262 10 04 07 79 04 87 02 08 eb 00 80
E: 0.733272 10 04 03 d1 02 55 05 44 eb 02 80
E: 0.734925 10 04 07 76 04 7a 02 44 eb 00 80
E: 0.740078 10 04 03 e4 02 1d 05 8a eb 02 80
E: 0.741734 10 04 07 77 04 5b 02 8a eb 00 80
E: 0.746665 10 04 03 f6 02 f5 04 d0 eb 02 80
E: 0.748265 10 04 07 7f 04 37 02 d0 eb 00 80
E: 0.753194 10 04 03 08 03 ca 04 0c ec 02 80
E: 0.754796 10 04 07 8e 04 0a 02 0c ec 00 80
E: 0.759573 10 04 03 20 03 a1 04 52 ec 02 80
E: 0.761170 10 04 07 a6 04 d9 01 52 ec 00 80
E: 0.765660 10 04 03 45 03 79 04 8e ec 02 80
E: 0.767298 10 04 07 c4 04 ac 01 8e ec 00 80
E: 0.774305 10 04 03 6d 03 5f 04 de ec 02 80
E: 0.775957 10 04 07 e3 04 7f 01 de ec 00 80
E: 0.780094 10 04 03 94 03 48 04 24 ed 02 80
E: 0.781222 10 04 07 e3 04 7f 01 24 ed 00 80
E: 0.785750 10 04 03 bb 03 31 04 56 ed 02 80
E: 0.786903 10 04 07 5d 05 22 01 56 ed 00 80
E: 0.790925 10 04 01 bb 03 31 04 92 ed 02 80
E: 0.792067 10 04 07 5d 05 22 01 92 ed 00 80
E: 0.795144 10 04 05 5d 05 22 01 ba ed 01 80
E: 0.958805 10 04 03 8a 03 81 03 22 f4 01 80
E: 0.964212 10 04 03 8a 03 81 03 5e f4 01 80
E: 0.971578 10 04 03 77 03 82 03 a4 f4 01 80
E: 0.977021 10 04 03 51 03 7f 03 d6 f4 01 80
E: 0.982233 10 04 03 28 03 75 03 12 f5 01 80
E: 0.987441 10 04 03 09 03 66 03 44 f5 01 80
E: 0.992617 10 04 03 f3 02 54 03 76 f5 01 80
E: 0.997787 10 04 03 e4 02 3f 03 a8 f5 01 80
E: 1.003022 10 04 03 d9 02 27 03 e4 f5 01 80
E: 1.008226 10 04 03 d5 02 0b 03 16 f6 01 80
E: 1.013398 10 04 03 d6 02 eb 02 48 f6 01 80
E: 1.020566 10 04 03 de 02 c7 02 8e f6 01 80
E: 1.026001 10 04 03 f1 02 9a 02 ca f6 01 80
E: 1.031445 10 04 03 08 03 69 02 fc f6 01 80
E: 1.036618 10 04 03 28 03 3f 02 2e f7 01 80
E: 1.041585 10 04 03 54 03 10 02 60 f7 01 80
E: 1.046553 10 04 03 85 03 df 01 92 f7 01 80
E: 1.052364 10 04 01 85 03 df 01 ce f7 01 80
E: 1.072942 10 04 03 ec 01 e7 04 a0 f8 01 80
E: 1.079481 10 04 03 f6 01 dc 04 dc f8 02 80
E: 1.080636 10 04 07 a3 06 dc 00 dc f8 00 80
E: 1.086290 10 04 03 1a 02 b7 04 22 f9 03 80
E: 1.087461 10 04 07 a3 06 dc 00 22 f9 00 80
E: 1.088608 10 04 0b aa 0a 72 01 22 f9 00 80
E: 1.093188 10 04 03 4f 02 7e 04 68 f9 03 80
E: 1.094336 10 04 07 a3 06 dc 00 68 f9 00 80
E: 1.095488 10 04 0b aa 0a 72 01 68 f9 00 80
E: 1.100315 10 04 03 7b 02 58 04 ae f9 03 80
E: 1.101735 10 04 07 f3 06 b2 00 ae f9 00 80
E: 1.102879 10 04 0b aa 0a 72 01 ae f9 00 80
E: 1.107364 10 04 03 a0 02 40 04 f4 f9 03 80
E: 1.108509 10 04 07 5e 07 83 00 f4 f9 00 80
E: 1.109660 10 04 0b aa 0a 72 01 f4 f9 00 80
E: 1.114560 10 04 03 cf 02 2e 04 3a fa 03 80
E: 1.115707 10 04 07 80 07 79 00 3a fa 00 80
E: 1.117128 10 04 0b aa 0a 72 01 3a fa 00 80
E: 1.123081 10 04 03 cf 02 2e 04 94 fa 03 80
E: 1.124226 10 04 07 80 07 79 00 94 fa 00 80
E: 1.125647 10 04 0b aa 0a 72 01 94 fa 00 80
E: 1.129994 10 04 03 21 03 19 04 da fa 03 80
E: 1.131136 10 04 07 80 07 79 00 da fa 00 80
E: 1.132284 10 04 0b e7 0a 7c 01 da fa 00 80
E: 1.136759 10 04 03 47 03 19 04 20 fb 03 80
E: 1.137904 10 04 07 b4 07 9d 00 20 fb 00 80
E: 1.139056 10 04 0b 29 0b 8b 01 20 fb 00 80
E: 1.143675 10 04 03 63 03 1f 04 66 fb 03 80
E: 1.144821 10 04 07 c4 07 b0 00 66 fb 00 80
E: 1.145975 10 04 0b 46 0b 98 01 66 fb 00 80
E: 1.150917 10 04 03 7e 03 28 04 ac fb 03 80
E: 1.152064 10 04 07 cc 07 c0 00 ac fb 00 80
E: 1.153211 10 04 0b 57 0b a4 01 ac fb 00 80
E: 1.157085 10 04 03 7e 03 28 04 e8 fb 03 80
E: 1.158232 10 04 07 cc 07 c0 00 e8 fb 00 80
E: 1.159386 10 04 0b 57 0b a4 01 e8 fb 00 80
E: 1.163657 10 04 01 7e 03 28 04 2e fc 03 80
E: 1.164801 10 04 05 cc 07 c0 00 2e fc 00 80
E: 1.165947 10 04 09 57 0b a4 01 2e fc 00 80
E: 1.274541 10 04 03 5b 02 54 05 84 00 01 80
E: 1.280105 10 04 03 5b 02 54 05 c0 00 01 80
E: 1.286458 10 04 03 5b 02 54 05 fc 00 01 80
E: 1.293230 10 04 03 4c 02 51 05 42 01 01 80
E: 1.300012 10 04 03 32 02 4a 05 88 01 01 80
E: 1.306838 10 04 03 1d 02 40 05 c4 01 02 80
E: 1.307993 10 04 07 b3 03 b6 01 c4 01 00 80
E: 1.313651 10 04 03 0f 02 37 05 0a 02 02 80
E: 1.314807 10 04 07 b3 03 b6 01 0a 02 00 80
E: 1.322116 10 04 03 05 02 2b 05 64 02 02 80
E: 1.323274 10 04 07 b3 03 b6 01 64 02 00 80
E: 1.328942 10 04 03 03 02 1c 05 aa 02 02 80
E: 1.330097 10 04 07 b3 03 b6 01 aa 02 00 80
E: 1.335338 10 04 03 09 02 10 05 e6 02 03 80
E: 1.336492 10 04 07 b3 03 b6 01 e6 02 00 80
E: 1.337648 10 04 0b 59 06 3f 01 e6 02 00 80
E: 1.341087 10 04 03 09 02 10 05 22 03 03 80
E: 1.342243 10 04 07 b3 03 b6 01 22 03 00 80
E: 1.343406 10 04 0b 59 06 3f 01 22 03 00 80
E: 1.346962 10 04 03 09 02 10 05 5e 03 03 80
E: 1.348118 10 04 07 b3 03 b6 01 5e 03 00 80
E: 1.349274 10 04 0b 59 06 3f 01 5e 03 00 80
E: 1.352843 10 04 01 09 02 10 05 9a 03 03 80
E: 1.353996 10 04 07 b3 03 b6 01 9a 03 00 80
E: 1.355154 10 04 0b 59 06 3f 01 9a 03 00 80
E: 1.358704 10 04 07 b3 03 b6 01 d6 03 02 80
E: 1.359862 10 04 0b 59 06 3f 01 d6 03 00 80
E: 1.364384 10 04 07 bf 03 b1 01 08 04 02 80
E: 1.365538 10 04 0b 59 06 3f 01 08 04 00 80
E: 1.371933 10 04 07 d5 03 a9 01 58 04 02 80
E: 1.373088 10 04 0b 67 06 3f 01 58 04 00 80
E: 1.378100 10 04 07 f9 03 9f 01 94 04 02 80
E: 1.379259 10 04 0b 84 06 3d 01 94 04 00 80
E: 1.384386 10 04 03 e0 0a bb 01 d0 04 03 80
E: 1.385540 10 04 07 22 04 97 01 d0 04 00 80
E: 1.386698 10 04 0b 9d 06 3a 01 d0 04 00 80
E: 1.391027 10 04 03 e0 0a bb 01 16 05 03 80
E: 1.392183 10 04 07 47 04 96 01 16 05 00 80
E: 1.393348 10 04 0b b5 06 36 01 16 05 00 80
E: 1.396831 10 04 03 e0 0a bb 01 52 05 03 80
E: 1.397987 10 04 07 47 04 96 01 52 05 00 80
E: 1.399145 10 04 0b b5 06 36 01 52 05 00 80
E: 1.402759 10 04 03 e0 0a bb 01 8e 05 03 80
E: 1.403913 10 04 07 47 04 96 01 8e 05 00 80
E: 1.405072 10 04 0b e0 06 31 01 8e 05 00 80
E: 1.408045 10 04 03 e0 0a bb 01 c0 05 03 80
E: 1.409199 10 04 07 47 04 96 01 c0 05 00 80
E: 1.410361 10 04 0b e0 06 31 01 c0 05 00 80
E: 1.413313 10 04 03 e0 0a bb 01 f2 05 03 80
E: 1.414471 10 04 05 47 04 96 01 f2 05 00 80
E: 1.415624 10 04 0b e0 06 31 01 f2 05 00 80
E: 1.420892 10 04 03 e0 0a bb 01 42 06 02 80
E: 1.422047 10 04 09 e0 06 31 01 42 06 00 80
E: 1.426351 10 04 03 e0 0a bb 01 74 06 01 80
E: 1.431761 10 04 03 f4 0a d4 01 b0 06 01 80
E: 1.437207 10 04 03 21 0b 0a 02 e2 06 01 80
E: 1.441203 10 04 03 21 0b 0a 02 0a 07 01 80
E: 1.445528 10 04 01 21 0b 0a 02 3c 07 01 80
E: 1.483897 10 04 03 db 02 53 05 b8 08 01 80
E: 1.489281 10 04 03 db 02 53 05 f4 08 01 80
E: 1.494935 10 04 03 db 02 53 05 26 09 01 80
E: 1.500590 10 04 03 cd 02 54 05 62 09 01 80
E: 1.506250 10 04 03 b7 02 53 05 9e 09 01 80
E: 1.511920 10 04 03 a2 02 4d 05 d0 09 01 80
E: 1.519522 10 04 03 90 02 43 05 20 0a 01 80
E: 1.525413 10 04 03 82 02 35 05 5c 0a 01 80
E: 1.532197 10 04 03 77 02 22 05 a2 0a 01 80
E: 1.539391 10 04 03 6f 02 04 05 e8 0a 01 80
E: 1.546165 10 04 03 6c 02 dd 04 2e 0b 02 80
E: 1.547323 10 04 07 15 04 69 01 2e 0b 00 80
E: 1.552939 10 04 03 6d 02 ab 04 74 0b 02 80
E: 1.554093 10 04 07 15 04 69 01 74 0b 00 80
E: 1.559490 10 04 03 79 02 70 04 b0 0b 02 80
E: 1.560648 10 04 07 15 04 5b 01 b0 0b 00 80
E: 1.565359 10 04 03 8a 02 34 04 ec 0b 02 80
E: 1.566522 10 04 07 1a 04 34 01 ec 0b 00 80
E: 1.572675 10 04 01 8a 02 34 04 32 0c 03 80
E: 1.573765 10 04 07 25 04 0b 01 32 0c 00 80
E: 1.574869 10 04 0b d3 06 9e 00 32 0c 00 80
E: 1.578469 10 04 07 35 04 de 00 6e 0c 02 80
E: 1.579568 10 04 0b d3 06 9e 00 6e 0c 00 80
E: 1.584315 10 04 07 48 04 bb 00 aa 0c 02 80
E: 1.585436 10 04 0b d3 06 9e 00 aa 0c 00 80
E: 1.590328 10 04 07 5f 04 97 00 e6 0c 02 80
E: 1.591478 10 04 0b e1 06 87 00 e6 0c 00 80
E: 1.596805 10 04 03 6e 0b 19 01 22 0d 03 80
E: 1.598197 10 04 07 7d 04 7d 00 22 0d 00 80
E: 1.599592 10 04 0b 01 07 65 00 22 0d 00 80
E: 1.603214 10 04 03 6e 0b 19 01 68 0d 03 80
E: 1.604620 10 04 07 a1 04 65 00 68 0d 00 80
E: 1.605981 10 04 0b 22 07 4b 00 68 0d 00 80
E: 1.608966 10 04 03 6e 0b 19 01 a4 0d 03 80
E: 1.610320 10 04 07 a1 04 65 00 a4 0d 00 80
E: 1.611720 10 04 0b 22 07 4b 00 a4 0d 00 80
E: 1.614967 10 04 03 6e 0b 19 01 e0 0d 03 80
E: 1.616359 10 04 07 a1 04 65 00 e0 0d 00 80
E: 1.617751 10 04 0b 6c 07 3f 00 e0 0d 00 80
E: 1.622755 10 04 03 6e 0b 19 01 26 0e 03 80
E: 1.624403 10 04 07 a1 04 65 00 26 0e 00 80
E: 1.626049 10 04 0b 6c 07 3f 00 26 0e 00 80
E: 1.628157 10 04 03 6e 0b 19 01 62 0e 03 80
E: 1.629799 10 04 05 a1 04 65 00 62 0e 00 80
E: 1.631431 10 04 0b 6c 07 3f 00 62 0e 00 80
E: 1.633476 10 04 03 6e 0b 19 01 94 0e 02 80
E: 1.635122 10 04 09 6c 07 3f 00 94 0e 00 80
E: 1.638824 10 04 03 6e 0b 19 01 c6 0e 01 80
E: 1.644163 10 04 03 73 0b 19 01 02 0f 01 80
E: 1.649492 10 04 03 7d 0b 19 01 34 0f 01 80
E: 1.654822 10 04 03 87 0b 1a 01 66 0f 01 80
E: 1.660095 10 04 03 93 0b 1b 01 a2 0f 01 80
E: 1.667249 10 04 03 a6 0b 1d 01 e8 0f 01 80
E: 1.672012 10 04 03 bd 0b 24 01 1a 10 01 80
E: 1.676214 10 04 03 bd 0b 24 01 42 10 01 80
E: 1.680500 10 04 01 bd 0b 24 01 6a 10 01 80
E: 1.711163 10 04 03 d0 03 2f 04 a0 11 01 80
E: 1.718589 10 04 03 d0 03 2f 04 e6 11 01 80
E: 1.723727 10 04 03 cb 03 44 04 22 12 01 80
E: 1.729387 10 04 03 bc 03 80 04 5e 12 01 80
E: 1.735083 10 04 03 aa 03 d4 04 90 12 01 80
E: 1.740182 10 04 03 9d 03 0e 05 cc 12 01 80
E: 1.746794 10 04 03 8b 03 2f 05 08 13 01 80
E: 1.753383 10 04 03 73 03 4b 05 4e 13 01 80
E: 1.759966 10 04 03 57 03 6d 05 8a 13 01 80
E: 1.768308 10 04 03 37 03 90 05 e4 13 02 80
E: 1.769669 10 04 07 f3 04 3e 02 e4 13 00 80
E: 1.774279 10 04 03 16 03 b4 05 20 14 02 80
E: 1.775704 10 04 07 f3 04 3e 02 20 14 00 80
E: 1.780437 10 04 03 f5 02 d6 05 5c 14 02 80
E: 1.781578 10 04 07 f3 04 3e 02 5c 14 00 80
E: 1.785859 10 04 01 f5 02 d6 05 8e 14 02 80
E: 1.787272 10 04 07 f3 04 3e 02 8e 14 00 80
E: 1.791559 10 04 07 d1 04 59 02 ca 14 01 80
E: 1.796984 10 04 07 88 04 84 02 fc 14 01 80
E: 1.802418 10 04 07 67 04 92 02 38 15 01 80
E: 1.807537 10 04 07 52 04 97 02 6a 15 01 80
E: 1.812472 10 04 07 43 04 99 02 9c 15 01 80
E: 1.819850 10 04 07 35 04 97 02 ec 15 01 80
E: 1.825280 10 04 07 1f 04 94 02 1e 16 01 80
E: 1.831015 10 04 03 85 06 4b 02 50 16 02 80
E: 1.832375 10 04 07 0b 04 92 02 50 16 00 80
E: 1.836327 10 04 03 85 06 4b 02 8c 16 02 80
E: 1.837465 10 04 07 f9 03 90 02 8c 16 00 80
E: 1.842378 10 04 03 85 06 4b 02 c8 16 02 80
E: 1.843515 10 04 07 e7 03 8f 02 c8 16 00 80
E: 1.847764 10 04 03 85 06 4b 02 04 17 02 80
E: 1.848905 10 04 05 e7 03 8f 02 04 17 00 80
E: 1.853732 10 04 03 85 06 4b 02 36 17 02 80
E: 1.854869 10 04 0b a0 0a ea 02 36 17 00 80
E: 1.859426 10 04 03 85 06 4b 02 72 17 02 80
E: 1.860559 10 04 0b a0 0a ea 02 72 17 00 80
E: 1.866964 10 04 03 85 06 4b 02 c2 17 02 80
E: 1.868382 10 04 0b a0 0a ea 02 c2 17 00 80
E: 1.872698 10 04 03 85 06 4b 02 f4 17 02 80
E: 1.873836 10 04 0b a0 0a ea 02 f4 17 00 80
E: 1.877859 10 04 01 85 06 4b 02 30 18 02 80
E: 1.879272 10 04 0b 9c 0a e6 02 30 18 00 80
E: 1.883284 10 04 0b 96 0a de 02 62 18 01 80
E: 1.888990 10 04 0b 92 0a d2 02 9e 18 01 80
E: 1.894417 10 04 0b 93 0a bc 02 d0 18 01 80
E: 1.899100 10 04 0b a1 0a a8 02 02 19 01 80
E: 1.904021 10 04 0b ba 0a 97 02 34 19 01 80
E: 1.908953 10 04 09 ba 0a 97 02 66 19 01 80
E: 1.927733 10 04 03 f5 01 1d 05 24 1a 01 80
E: 1.933386 10 04 03 f5 01 1d 05 56 1a 01 80
E: 1.939037 10 04 03 02 02 24 05 92 1a 01 80
E: 1.944422 10 04 03 20 02 2d 05 ce 1a 01 80
E: 1.950349 10 04 03 42 02 31 05 00 1b 01 80
E: 1.955933 10 04 03 5f 02 32 05 3c 1b 01 80
E: 1.961336 10 04 03 80 02 39 05 78 1b 01 80
E: 1.969015 10 04 03 a0 02 40 05 be 1b 01 80
E: 1.974929 10 04 03 c5 02 49 05 fa 1b 01 80
E: 1.980518 10 04 03 e5 02 55 05 36 1c 01 80
E: 1.986384 10 04 03 fb 02 61 05 72 1c 01 80
E: 1.993225 10 04 03 11 03 70 05 ae 1c 01 80
E: 1.999808 10 04 03 27 03 82 05 f4 1c 01 80
E: 2.006442 10 04 03 3f 03 99 05 3a 1d 02 80
E: 2.007802 10 04 07 25 05 66 02 3a 1d 00 80
E: 2.012903 10 04 03 54 03 ad 05 76 1d 02 80
E: 2.014040 10 04 07 25 05 66 02 76 1d 00 80
E: 2.021409 10 04 03 66 03 c5 05 d0 1d 02 80
E: 2.022571 10 04 07 25 05 66 02 d0 1d 00 80
E: 2.027777 10 04 03 76 03 de 05 0c 1e 02 80
E: 2.028923 10 04 07 25 05 66 02 0c 1e 00 80
E: 2.033938 10 04 03 86 03 f7 05 48 1e 02 80
E: 2.035087 10 04 07 25 05 66 02 48 1e 00 80
E: 2.039868 10 04 01 86 03 f7 05 84 1e 03 80
E: 2.041013 10 04 07 25 05 66 02 84 1e 00 80
E: 2.042160 10 04 0b dd 07 97 02 84 1e 00 80
E: 2.046157 10 04 07 32 05 a6 02 c0 1e 02 80
E: 2.047569 10 04 0b dd 07 97 02 c0 1e 00 80
E: 2.051742 10 04 07 3f 05 f0 02 fc 1e 02 80
E: 2.053150 10 04 0b dd 07 97 02 fc 1e 00 80
E: 2.057284 10 04 07 44 05 02 03 38 1f 02 80
E: 2.058421 10 04 0b dd 07 97 02 38 1f 00 80
E: 2.062995 10 04 07 4a 05 0f 03 6a 1f 02 80
E: 2.064373 10 04 0b dd 07 97 02 6a 1f 00 80
E: 2.071189 10 04 07 4b 05 0e 03 c4 1f 02 80
E: 2.072587 10 04 0b dd 07 97 02 c4 1f 00 80
E: 2.077627 10 04 03 19 0c d7 03 00 20 03 80
E: 2.079031 10 04 07 4d 05 10 03 00 20 00 80
E: 2.080434 10 04 0b dd 07 97 02 00 20 00 80
E: 2.084425 10 04 03 19 0c d7 03 46 20 03 80
E: 2.085556 10 04 07 4d 05 11 03 46 20 00 80
E: 2.086964 10 04 0b dd 07 97 02 46 20 00 80
E: 2.091133 10 04 03 19 0c d7 03 8c 20 03 80
E: 2.092537 10 04 07 4a 05 0f 03 8c 20 00 80
E: 2.093669 10 04 0b dd 07 97 02 8c 20 00 80
E: 2.096871 10 04 03 19 0c d7 03 be 20 03 80
E: 2.098275 10 04 07 4a 05 0f 03 be 20 00 80
E: 2.099679 10 04 0b dd 07 97 02 be 20 00 80
E: 2.102605 10 04 03 19 0c d7 03 fa 20 03 80
E: 2.104009 10 04 07 4a 05 0f 03 fa 20 00 80
E: 2.105413 10 04 0b dd 07 97 02 fa 20 00 80
E: 2.107994 10 04 03 19 0c d7 03 36 21 03 80
E: 2.109399 10 04 05 4a 05 0f 03 36 21 00 80
E: 2.110805 10 04 09 dd 07 97 02 36 21 00 80
E: 2.116043 10 04 03 19 0c d7 03 86 21 01 80
E: 2.121894 10 04 03 19 0c d7 03 c2 21 01 80
E: 2.127355 10 04 03 19 0c d7 03 f4 21 01 80
E: 2.132776 10 04 03 19 0c d7 03 26 22 01 80
E: 2.138202 10 04 03 19 0c d7 03 62 22 01 80
E: 2.143588 10 04 01 19 0c d7 03 94 22 01 80
E: 2.149238 10 04 07 1e 03 67 06 d0 22 01 80
E: 2.154901 10 04 07 1e 03 67 06 0c 23 01 80
E: 2.160551 10 04 07 1e 03 67 06 3e 23 01 80
E: 2.168143 10 04 07 1e 03 67 06 8e 23 01 80
E: 2.173804 10 04 07 1c 03 59 06 ca 23 01 80
E: 2.179462 10 04 07 1c 03 3b 06 fc 23 01 80
E: 2.185118 10 04 07 1f 03 19 06 38 24 01 80
E: 2.191010 10 04 07 27 03 fd 05 74 24 01 80
E: 2.196907 10 04 07 31 03 e5 05 b0 24 01 80
E: 2.202553 10 04 07 40 03 cb 05 e2 24 01 80
E: 2.209067 10 04 07 4f 03 b6 05 28 25 01 80
E: 2.217549 10 04 07 60 03 a1 05 82 25 01 80
E: 2.224573 10 04 03 9a 05 f7 01 c8 25 02 80
E: 2.225929 10 04 07 78 03 84 05 c8 25 00 80
E: 2.231431 10 04 03 9a 05 f7 01 0e 26 02 80
E: 2.232835 10 04 07 9b 03 63 05 0e 26 00 80
E: 2.238745 10 04 03 9a 05 f7 01 54 26 02 80
E: 2.240152 10 04 07 bf 03 42 05 54 26 00 80
E: 2.245794 10 04 03 ba 05 e8 01 9a 26 02 80
E: 2.247201 10 04 07 e6 03 23 05 9a 26 00 80
E: 2.252836 10 04 03 fd 05 c9 01 e0 26 02 80
E: 2.254237 10 04 07 1c 04 fc 04 e0 26 00 80
E: 2.260124 10 04 03 3f 06 ae 01 26 27 02 80
E: 2.261773 10 04 07 5e 04 c6 04 26 27 00 80
E: 2.268844 10 04 03 7d 06 9e 01 80 27 03 80
E: 2.270498 10 04 07 a7 04 9f 04 80 27 00 80
E: 2.272145 10 04 0b 2e 09 82 01 80 27 00 80
E: 2.275997 10 04 03 a5 06 8d 01 c6 27 03 80
E: 2.277656 10 04 07 f2 04 8a 04 c6 27 00 80
E: 2.279308 10 04 0b 2e 09 82 01 c6 27 00 80
E: 2.282337 10 04 03 a5 06 8d 01 02 28 03 80
E: 2.283987 10 04 07 f2 04 8a 04 02 28 00 80
E: 2.285633 10 04 0b 2e 09 82 01 02 28 00 80
E: 2.288683 10 04 03 f2 06 77 01 48 28 03 80
E: 2.290330 10 04 07 f2 04 8a 04 48 28 00 80
E: 2.291978 10 04 0b 2e 09 82 01 48 28 00 80
E: 2.294945 10 04 03 1d 07 72 01 84 28 03 80
E: 2.296589 10 04 05 f2 04 8a 04 84 28 00 80
E: 2.298237 10 04 0b 8a 09 74 01 84 28 00 80
E: 2.301158 10 04 03 3f 07 69 01 c0 28 02 80
E: 2.302809 10 04 0b 01 0a 66 01 c0 28 00 80
E: 2.306885 10 04 03 64 07 62 01 fc 28 02 80
E: 2.308539 10 04 0b 2a 0a 67 01 fc 28 00 80
E: 2.312408 10 04 03 8d 07 58 01 2e 29 02 80
E: 2.314051 10 04 0b 3f 0a 66 01 2e 29 00 80
E: 2.319664 10 04 03 b0 07 53 01 7e 29 02 80
E: 2.321317 10 04 0b 4c 0a 62 01 7e 29 00 80
E: 2.324629 10 04 03 c5 07 50 01 b0 29 02 80
E: 2.325775 10 04 0b 61 0a 64 01 b0 29 00 80
E: 2.329582 10 04 03 c5 07 50 01 e2 29 02 80
E: 2.330742 10 04 0b 78 0a 68 01 e2 29 00 80
E: 2.333815 10 04 01 c5 07 50 01 0a 2a 02 80
E: 2.334972 10 04 09 78 0a 68 01 0a 2a 00 80
E: 2.434697 10 04 03 4a 03 79 06 06 2e 01 80
E: 2.440339 10 04 03 39 03 80 06 38 2e 01 80
E: 2.445997 10 04 03 0a 03 95 06 74 2e 01 80
E: 2.452593 10 04 03 c3 02 b9 06 ba 2e 01 80
E: 2.459805 10 04 03 99 02 ce 06 00 2f 01 80
E: 2.468912 10 04 03 85 02 d6 06 5a 2f 02 80
E: 2.470067 10 04 07 41 04 56 03 5a 2f 00 80
E: 2.476003 10 04 03 70 02 d4 06 a0 2f 02 80
E: 2.477157 10 04 07 41 04 56 03 a0 2f 00 80
E: 2.483089 10 04 03 63 02 d1 06 e6 2f 02 80
E: 2.484244 10 04 07 3c 04 53 03 e6 2f 00 80
E: 2.490224 10 04 03 5c 02 c7 06 2c 30 03 80
E: 2.491382 10 04 07 35 04 4e 03 2c 30 00 80
E: 2.492544 10 04 0b b0 06 f5 02 2c 30 00 80
E: 2.497615 10 04 03 59 02 bb 06 7c 30 03 80
E: 2.498773 10 04 07 30 04 4a 03 7c 30 00 80
E: 2.499928 10 04 0b b0 06 f5 02 7c 30 00 80
E: 2.504923 10 04 03 5d 02 ab 06 c2 30 03 80
E: 2.506077 10 04 07 2c 04 46 03 c2 30 00 80
E: 2.507235 10 04 0b b0 06 f5 02 c2 30 00 80
E: 2.511945 10 04 03 66 02 93 06 08 31 03 80
E: 2.513102 10 04 07 2b 04 42 03 08 31 00 80
E: 2.514257 10 04 0b b0 06 f5 02 08 31 00 80
E: 2.519838 10 04 03 66 02 93 06 58 31 03 80
E: 2.520996 10 04 07 31 04 38 03 58 31 00 80
E: 2.522154 10 04 0b b0 06 f5 02 58 31 00 80
E: 2.526723 10 04 01 66 02 93 06 9e 31 03 80
E: 2.527876 10 04 07 45 04 23 03 9e 31 00 80
E: 2.529036 10 04 0b b0 06 f5 02 9e 31 00 80
E: 2.533725 10 04 07 7f 04 fe 02 e4 31 02 80
E: 2.534882 10 04 0b d4 06 df 02 e4 31 00 80
E: 2.540250 10 04 07 c7 04 d1 02 2a 32 02 80
E: 2.541356 10 04 0b 2f 07 b8 02 2a 32 00 80
E: 2.546618 10 04 07 0a 05 b0 02 66 32 02 80
E: 2.547743 10 04 0b 77 07 a0 02 66 32 00 80
E: 2.553024 10 04 07 4b 05 9f 02 a2 32 02 80
E: 2.554180 10 04 0b c4 07 8d 02 a2 32 00 80
E: 2.559479 10 04 07 70 05 95 02 e8 32 02 80
E: 2.560611 10 04 0b eb 07 7f 02 e8 32 00 80
E: 2.567307 10 04 07 70 05 95 02 38 33 02 80
E: 2.568437 10 04 0b eb 07 7f 02 38 33 00 80
E: 2.573260 10 04 07 70 05 95 02 74 33 02 80
E: 2.574389 10 04 0b eb 07 7f 02 74 33 00 80
E: 2.578902 10 04 05 70 05 95 02 b0 33 02 80
E: 2.580030 10 04 09 eb 07 7f 02 b0 33 00 80
E: 2.649512 10 04 03 da 04 88 06 6c 36 01 80
E: 2.654946 10 04 03 da 04 88 06 a8 36 01 80
E: 2.660367 10 04 03 d7 04 97 06 da 36 01 80
E: 2.667742 10 04 03 d2 04 be 06 2a 37 01 80
E: 2.673176 10 04 03 c1 04 f8 06 5c 37 01 80
E: 2.678783 10 04 03 b0 04 23 07 98 37 01 80
E: 2.684489 10 04 03 9d 04 41 07 ca 37 01 80
E: 2.690139 10 04 03 88 04 59 07 06 38 01 80
E: 2.695831 10 04 03 6f 04 6f 07 42 38 01 80
E: 2.702183 10 04 03 54 04 81 07 7e 38 01 80
E: 2.708773 10 04 03 39 04 8f 07 c4 38 01 80
E: 2.717071 10 04 03 19 04 9c 07 14 39 01 80
E: 2.723704 10 04 03 f4 03 9f 07 5a 39 02 80
E: 2.724850 10 04 07 bb 05 49 04 5a 39 00 80
E: 2.730575 10 04 03 d9 03 98 07 a0 39 02 80
E: 2.731721 10 04 07 bb 05 49 04 a0 39 00 80
E: 2.737200 10 04 03 c3 03 86 07 dc 39 02 80
E: 2.738353 10 04 07 bb 05 49 04 dc 39 00 80
E: 2.744023 10 04 03 b9 03 70 07 22 3a 03 80
E: 2.745169 10 04 07 bb 05 49 04 22 3a 00 80
E: 2.746329 10 04 0b 15 08 cc 03 22 3a 00 80
E: 2.751243 10 04 03 af 03 4f 07 68 3a 03 80
E: 2.752391 10 04 07 bb 05 49 04 68 3a 00 80
E: 2.753543 10 04 0b 15 08 cc 03 68 3a 00 80
E: 2.758386 10 04 03 af 03 4f 07 b8 3a 03 80
E: 2.759533 10 04 07 8f 05 fe 03 b8 3a 00 80
E: 2.760686 10 04 0b 15 08 cc 03 b8 3a 00 80
E: 2.766508 10 04 01 af 03 4f 07 08 3b 03 80
E: 2.767655 10 04 07 68 05 8e 03 08 3b 00 80
E: 2.768803 10 04 0b 0d 08 a7 03 08 3b 00 80
E: 2.773553 10 04 07 67 05 50 03 4e 3b 02 80
E: 2.774704 10 04 0b 04 08 54 03 4e 3b 00 80
E: 2.780204 10 04 07 67 05 2a 03 94 3b 02 80
E: 2.781350 10 04 0b ff 07 17 03 94 3b 00 80
E: 2.786684 10 04 07 67 05 05 03 d0 3b 02 80
E: 2.787832 10 04 0b 02 08 e9 02 d0 3b 00 80
E: 2.792701 10 04 07 67 05 05 03 0c 3c 02 80
E: 2.793847 10 04 0b 02 08 e9 02 0c 3c 00 80
E: 2.798872 10 04 07 67 05 05 03 48 3c 02 80
E: 2.799995 10 04 0b 02 08 e9 02 48 3c 00 80
E: 2.804291 10 04 05 67 05 05 03 84 3c 02 80
E: 2.805427 10 04 09 02 08 e9 02 84 3c 00 80
E: 2.873416 10 04 03 94 03 44 05 36 3f 01 80
E: 2.879280 10 04 03 94 03 44 05 72 3f 01 80
E: 2.884677 10 04 03 94 03 44 05 a4 3f 01 80
E: 2.890331 10 04 03 94 03 44 05 e0 3f 01 80
E: 2.896247 10 04 03 94 03 44 05 1c 40 01 80
E: 2.901651 10 04 03 94 03 44 05 58 40 01 80
E: 2.907308 10 04 03 a5 03 49 05 8a 40 01 80
E: 2.914937 10 04 03 c1 03 56 05 da 40 01 80
E: 2.921071 10 04 03 e0 03 76 05 16 41 01 80
E: 2.927662 10 04 03 ef 03 99 05 5c 41 01 80
E: 2.934493 10 04 03 f3 03 c1 05 98 41 01 80
E: 2.940897 10 04 03 e8 03 f5 05 de 41 02 80
E: 2.942012 10 04 07 03 06 ea 02 de 41 00 80
E: 2.947082 10 04 03 df 03 41 06 1a 42 02 80
E: 2.948177 10 04 07 de 05 21 03 1a 42 00 80
E: 2.953223 10 04 03 d8 03 93 06 56 42 02 80
E: 2.954322 10 04 07 b9 05 58 03 56 42 00 80
E: 2.959130 10 04 03 d2 03 de 06 92 42 02 80
E: 2.960232 10 04 07 8a 05 99 03 92 42 00 80
E: 2.966440 10 04 01 d2 03 de 06 e2 42 02 80
E: 2.967532 10 04 07 65 05 cd 03 e2 42 00 80
E: 2.972315 10 04 07 2e 05 13 04 14 43 01 80
E: 2.978220 10 04 07 f9 04 3a 04 50 43 01 80
E: 2.984111 10 04 07 d7 04 67 04 8c 43 01 80
E: 2.990041 10 04 03 3e 07 3c 04 c8 43 02 80
E: 2.991139 10 04 07 c4 04 8c 04 c8 43 00 80
E: 2.996487 10 04 03 3e 07 3c 04 0e 44 02 80
E: 2.997662 10 04 07 90 04 a0 04 0e 44 00 80
E: 3.002978 10 04 03 3e 07 3c 04 4a 44 03 80
E: 3.004090 10 04 07 70 04 b1 04 4a 44 00 80
E: 3.005201 10 04 0b 6c 0b 20 05 4a 44 00 80
E: 3.009898 10 04 03 3e 07 3c 04 90 44 03 80
E: 3.011010 10 04 07 52 04 c1 04 90 44 00 80
E: 3.012131 10 04 0b 6c 0b 20 05 90 44 00 80
E: 3.017794 10 04 03 3e 07 3c 04 e0 44 03 80
E: 3.018909 10 04 07 40 04 c7 04 e0 44 00 80
E: 3.020023 10 04 0b 6c 0b 20 05 e0 44 00 80
E: 3.024762 10 04 03 3e 07 3c 04 26 45 03 80
E: 3.025874 10 04 07 2f 04 c2 04 26 45 00 80
E: 3.026989 10 04 0b 6c 0b 20 05 26 45 00 80
E: 3.031641 10 04 03 3e 07 3c 04 6c 45 03 80
E: 3.032755 10 04 07 24 04 b6 04 6c 45 00 80
E: 3.033867 10 04 0b 6c 0b 20 05 6c 45 00 80
E: 3.038548 10 04 03 3e 07 3c 04 b2 45 03 80
E: 3.039659 10 04 07 1d 04 a1 04 b2 45 00 80
E: 3.040771 10 04 0b 6c 0b 20 05 b2 45 00 80
E: 3.045761 10 04 03 3e 07 3c 04 f8 45 03 80
E: 3.046862 10 04 07 23 04 82 04 f8 45 00 80
E: 3.047976 10 04 0b 6c 0b 20 05 f8 45 00 80
E: 3.053053 10 04 01 3e 07 3c 04 3e 46 03 80
E: 3.054163 10 04 07 33 04 3d 04 3e 46 00 80
E: 3.055275 10 04 0b 6c 0b 20 05 3e 46 00 80
E: 3.060415 10 04 07 33 04 3d 04 8e 46 02 80
E: 3.061532 10 04 0b 6c 0b 20 05 8e 46 00 80
E: 3.069417 10 04 07 33 04 3d 04 e8 46 02 80
E: 3.070782 10 04 0b 99 0b c6 04 e8 46 00 80
E: 3.075843 10 04 07 33 04 3d 04 24 47 02 80
E: 3.077219 10 04 0b 99 0b c6 04 24 47 00 80
E: 3.082195 10 04 05 33 04 3d 04 6a 47 02 80
E: 3.083301 10 04 0b 99 0b c6 04 6a 47 00 80
E: 3.089492 10 04 09 99 0b c6 04 b0 47 01 80
E: 3.096570 10 04 03 95 04 d6 02 f6 47 01 80
E: 3.103618 10 04 03 95 04 d6 02 3c 48 01 80
E: 3.110445 10 04 03 9e 04 b1 02 82 48 01 80
E: 3.119236 10 04 03 b8 04 4c 02 dc 48 01 80
E: 3.125392 10 04 03 d7 04 d4 01 18 49 01 80
E: 3.131233 10 04 01 d7 04 d4 01 54 49 01 80
E: 3.191736 10 04 03 da 05 90 01 b6 4b 01 80
E: 3.197106 10 04 03 da 05 90 01 e8 4b 01 80
E: 3.202330 10 04 03 e1 05 9c 01 1a 4c 01 80
E: 3.207740 10 04 03 e7 05 b2 01 4c 4c 01 80
E: 3.214440 10 04 03 ea 05 cd 01 92 4c 01 80
E: 3.219012 10 04 01 ea 05 cd 01 c4 4c 01 80
E: 3.322187 10 04 03 b9 02 f2 07 ca 50 01 80
E: 3.327473 10 04 03 b9 02 f2 07 06 51 01 80
E: 3.335130 10 04 03 b9 02 f2 07 4c 51 01 80
E: 3.342171 10 04 03 b9 02 f2 07 92 51 01 80
E: 3.349261 10 04 03 b6 02 e3 07 d8 51 02 80
E: 3.350677 10 04 07 c1 04 18 04 d8 51 00 80
E: 3.356354 10 04 03 b4 02 ba 07 28 52 02 80
E: 3.357769 10 04 07 c1 04 18 04 28 52 00 80
E: 3.365332 10 04 03 bb 02 6e 07 82 52 02 80
E: 3.366743 10 04 07 bf 04 14 04 82 52 00 80
E: 3.372204 10 04 03 d6 02 fb 06 c8 52 02 80
E: 3.373616 10 04 07 bc 04 0a 04 c8 52 00 80
E: 3.378676 10 04 03 f8 02 a8 06 04 53 03 80
E: 3.379823 10 04 07 bc 04 ee 03 04 53 00 80
E: 3.380972 10 04 0b 7b 07 76 03 04 53 00 80
E: 3.384858 10 04 03 f8 02 a8 06 40 53 03 80
E: 3.385991 10 04 07 bc 04 ee 03 40 53 00 80
E: 3.387419 10 04 0b 7b 07 76 03 40 53 00 80
E: 3.390861 10 04 03 f8 02 a8 06 7c 53 03 80
E: 3.392013 10 04 07 c9 04 aa 03 7c 53 00 80
E: 3.393166 10 04 0b 7b 07 76 03 7c 53 00 80
E: 3.396301 10 04 01 f8 02 a8 06 b8 53 03 80
E: 3.397444 10 04 07 dc 04 66 03 b8 53 00 80
E: 3.398595 10 04 09 7b 07 76 03 b8 53 00 80
E: 3.401724 10 04 07 f2 04 34 03 ea 53 01 80
E: 3.407121 10 04 07 0a 05 09 03 26 54 01 80
E: 3.414509 10 04 07 29 05 da 02 6c 54 01 80
E: 3.419961 10 04 07 5a 05 99 02 a8 54 01 80
E: 3.425368 10 04 07 84 05 65 02 da 54 01 80
E: 3.430551 10 04 07 c0 05 2f 02 0c 55 01 80
E: 3.435974 10 04 07 fd 05 ff 01 48 55 01 80
E: 3.441359 10 04 07 3d 06 ce 01 7a 55 01 80
E: 3.446996 10 04 07 8d 06 99 01 b6 55 01 80
E: 3.452060 10 04 07 b4 06 67 01 e8 55 01 80
E: 3.457438 10 04 07 fe 06 36 01 1a 56 01 80
E: 3.464716 10 04 07 47 07 09 01 6a 56 01 80
E: 3.470051 10 04 07 b3 07 d6 00 9c 56 01 80
E: 3.475750 10 04 07 dc 07 bd 00 ce 56 01 80
E: 3.480736 10 04 07 12 08 a2 00 0a 57 01 80
E: 3.486151 10 04 07 4c 08 8e 00 3c 57 01 80
E: 3.491868 10 04 07 7c 08 88 00 78 57 01 80
E: 3.497919 10 04 07 ac 08 80 00 b4 57 01 80
E: 3.503964 10 04 07 db 08 7d 00 f0 57 01 80
E: 3.511958 10 04 03 a3 06 e8 02 40 58 02 80
E: 3.513315 10 04 07 fd 08 7f 00 40 58 00 80
E: 3.517720 10 04 03 a3 06 e8 02 7c 58 02 80
E: 3.519108 10 04 07 12 09 84 00 7c 58 00 80
E: 3.523689 10 04 03 a3 06 e8 02 b8 58 02 80
E: 3.525095 10 04 07 12 09 84 00 b8 58 00 80
E: 3.529528 10 04 03 a3 06 e8 02 ea 58 02 80
E: 3.530935 10 04 07 43 09 84 00 ea 58 00 80
E: 3.534580 10 04 01 a3 06 e8 02 26 59 02 80
E: 3.535683 10 04 07 5f 09 88 00 26 59 00 80
E: 3.539716 10 04 07 6f 09 95 00 58 59 01 80
E: 3.544452 10 04 07 6f 09 95 00 80 59 01 80
E: 3.548685 10 04 05 6f 09 95 00 b2 59 01 80
E: 3.633200 10 04 03 29 04 0c 06 04 5d 01 80
E: 3.638604 10 04 03 29 04 0c 06 36 5d 01 80
E: 3.644035 10 04 03 0d 04 17 06 72 5d 01 80
E: 3.649465 10 04 03 d7 03 30 06 a4 5d 01 80
E: 3.656111 10 04 03 af 03 44 06 e0 5d 01 80
E: 3.664622 10 04 03 96 03 52 06 3a 5e 01 80
E: 3.671292 10 04 03 7e 03 55 06 80 5e 02 80
E: 3.672665 10 04 07 5d 05 58 03 80 5e 00 80
E: 3.677588 10 04 03 6f 03 4f 06 bc 5e 02 80
E: 3.678698 10 04 07 5d 05 58 03 bc 5e 00 80
E: 3.684215 10 04 03 6a 03 43 06 02 5f 02 80
E: 3.685327 10 04 07 5d 05 58 03 02 5f 00 80
E: 3.690874 10 04 03 69 03 37 06 3e 5f 02 80
E: 3.691984 10 04 07 5d 05 58 03 3e 5f 00 80
E: 3.696083 10 04 03 69 03 29 06 7a 5f 02 80
E: 3.697448 10 04 07 5d 05 58 03 7a 5f 00 80
E: 3.701752 10 04 01 69 03 29 06 b6 5f 02 80
E: 3.702865 10 04 07 5d 05 58 03 b6 5f 00 80
E: 3.709529 10 04 07 5d 05 58 03 fc 5f 01 80
E: 3.714464 10 04 07 5d 05 58 03 2e 60 01 80
E: 3.720150 10 04 07 5d 05 58 03 6a 60 01 80
E: 3.725573 10 04 07 61 05 53 03 9c 60 01 80
E: 3.730755 10 04 07 6e 05 4a 03 d8 60 01 80
E: 3.736198 10 04 07 8d 05 3b 03 0a 61 01 80
E: 3.741628 10 04 07 c5 05 26 03 46 61 01 80
E: 3.747053 10 04 07 ff 05 17 03 78 61 01 80
E: 3.752782 10 04 03 04 09 c9 02 b4 61 02 80
E: 3.753890 10 04 07 38 06 0a 03 b4 61 00 80
E: 3.759838 10 04 03 04 09 c9 02 fa 61 02 80
E: 3.761209 10 04 07 6b 06 01 03 fa 61 00 80
E: 3.765105 10 04 03 04 09 c9 02 2c 62 02 80
E: 3.766472 10 04 07 8a 06 00 03 2c 62 00 80
E: 3.770610 10 04 03 04 09 c9 02 5e 62 02 80
E: 3.771979 10 04 07 a4 06 01 03 5e 62 00 80
E: 3.776077 10 04 03 23 09 d4 02 9a 62 02 80
E: 3.777188 10 04 07 bc 06 03 03 9a 62 00 80
E: 3.781505 10 04 03 56 09 e4 02 cc 62 02 80
E: 3.782875 10 04 05 bc 06 03 03 cc 62 00 80
E: 3.786710 10 04 03 79 09 f6 02 08 63 01 80
E: 3.791901 10 04 03 8e 09 05 03 3a 63 01 80
E: 3.797117 10 04 03 9d 09 11 03 6c 63 01 80
E: 3.802321 10 04 03 a7 09 1b 03 9e 63 01 80
E: 3.809193 10 04 03 b1 09 26 03 e4 63 01 80
E: 3.814391 10 04 03 bf 09 36 03 20 64 01 80
E: 3.820772 10 04 03 cc 09 47 03 5c 64 01 80
E: 3.827119 10 04 03 db 09 5b 03 98 64 01 80
E: 3.833476 10 04 03 eb 09 70 03 de 64 01 80
E: 3.839646 10 04 03 f7 09 85 03 1a 65 02 80
E: 3.841016 10 04 07 8c 04 09 07 1a 65 00 80
E: 3.845525 10 04 03 fb 09 98 03 56 65 02 80
E: 3.846895 10 04 07 8c 04 09 07 56 65 00 80
E: 3.851232 10 04 03 fc 09 a9 03 92 65 02 80
E: 3.852598 10 04 07 8c 04 09 07 92 65 00 80
E: 3.858817 10 04 03 fc 09 bb 03 d8 65 02 80
E: 3.859926 10 04 07 79 04 2d 07 d8 65 00 80
E: 3.863758 10 04 01 fc 09 bb 03 0a 66 02 80
E: 3.864862 10 04 07 5e 04 6c 07 0a 66 00 80
E: 3.869450 10 04 07 50 04 8e 07 46 66 01 80
E: 3.874620 10 04 07 46 04 a7 07 78 66 01 80
E: 3.880072 10 04 07 3f 04 ba 07 b4 66 01 80
E: 3.885754 10 04 07 3a 04 c9 07 e6 66 01 80
E: 3.891217 10 04 07 35 04 d3 07 18 67 01 80
E: 3.896677 10 04 07 31 04 db 07 54 67 01 80
E: 3.902015 10 04 07 2f 04 e0 07 86 67 01 80
E: 3.909390 10 04 07 2d 04 e2 07 d6 67 01 80
E: 3.914565 10 04 07 2b 04 e3 07 08 68 01 80
E: 3.920482 10 04 07 2a 04 e3 07 44 68 01 80
E: 3.926561 10 04 07 29 04 e3 07 80 68 01 80
E: 3.932724 10 04 07 29 04 e1 07 bc 68 01 80
E: 3.938615 10 04 07 29 04 e1 07 f8 68 01 80
E: 3.944085 10 04 03 98 06 cf 04 34 69 02 80
E: 3.945233 10 04 07 29 04 e1 07 34 69 00 80
E: 3.949517 10 04 03 98 06 cf 04 66 69 02 80
E: 3.950674 10 04 05 29 04 e1 07 66 69 00 80
E: 3.954947 10 04 03 98 06 cf 04 a2 69 01 80
E: 3.962617 10 04 03 98 06 cf 04 e8 69 01 80
E: 3.968010 10 04 03 98 06 cf 04 24 6a 01 80
E: 3.972935 10 04 03 98 06 cf 04 56 6a 01 80
E: 3.978360 10 04 03 98 06 cf 04 88 6a 01 80
E: 3.984011 10 04 03 98 06 cf 04 c4 6a 01 80
E: 3.989993 10 04 03 82 06 de 04 00 6b 02 80
E: 3.991145 10 04 07 d7 08 b3 04 00 6b 00 80
E: 3.995450 10 04 03 58 06 f5 04 32 6b 02 80
E: 3.996599 10 04 07 d7 08 b3 04 32 6b 00 80
E: 4.000715 10 04 03 2e 06 05 05 6e 6b 02 80
E: 4.001867 10 04 07 d7 08 b3 04 6e 6b 00 80
E: 4.008308 10 04 03 0f 06 0d 05 b4 6b 02 80
E: 4.009459 10 04 07 be 08 b8 04 b4 6b 00 80
E: 4.013841 10 04 03 ed 05 13 05 f0 6b 02 80
E: 4.014996 10 04 07 91 08 c2 04 f0 6b 00 80
E: 4.019307 10 04 03 cf 05 15 05 22 6c 02 80
E: 4.020457 10 04 07 70 08 c7 04 22 6c 00 80
E: 4.024781 10 04 03 b3 05 15 05 5e 6c 02 80
E: 4.025934 10 04 07 53 08 c8 04 5e 6c 00 80
E: 4.030250 10 04 03 9b 05 10 05 90 6c 02 80
E: 4.031400 10 04 07 38 08 c4 04 90 6c 00 80
E: 4.035724 10 04 03 8b 05 09 05 cc 6c 02 80
E: 4.036874 10 04 07 20 08 bf 04 cc 6c 00 80
E: 4.041192 10 04 03 7e 05 ff 04 fe 6c 02 80
E: 4.042348 10 04 07 0e 08 b7 04 fe 6c 00 80
E: 4.046667 10 04 03 73 05 f5 04 3a 6d 02 80
E: 4.047821 10 04 07 01 08 ac 04 3a 6d 00 80
E: 4.052135 10 04 03 6b 05 e6 04 6c 6d 02 80
E: 4.053288 10 04 07 f8 07 a0 04 6c 6d 00 80
E: 4.060431 10 04 03 64 05 d4 04 c6 6d 02 80
E: 4.061582 10 04 07 f0 07 92 04 c6 6d 00 80
E: 4.066826 10 04 03 5f 05 b4 04 02 6e 02 80
E: 4.067978 10 04 07 e9 07 7e 04 02 6e 00 80
E: 4.073682 10 04 03 5f 05 94 04 48 6e 02 80
E: 4.074836 10 04 07 e5 07 6b 04 48 6e 00 80
E: 4.080588 10 04 03 5f 05 78 04 8e 6e 03 80
E: 4.081738 10 04 07 e8 07 55 04 8e 6e 00 80
E: 4.082895 10 04 0b b7 02 a4 07 8e 6e 00 80
E: 4.087262 10 04 03 5f 05 78 04 d4 6e 03 80
E: 4.088414 10 04 07 e8 07 55 04 d4 6e 00 80
E: 4.089563 10 04 0b b7 02 a4 07 d4 6e 00 80
E: 4.093926 10 04 03 5d 05 66 04 10 6f 03 80
E: 4.095078 10 04 07 e8 07 55 04 10 6f 00 80
E: 4.096231 10 04 0b b7 02 a4 07 10 6f 00 80
E: 4.100551 10 04 03 5c 05 5f 04 56 6f 03 80
E: 4.101701 10 04 05 e8 07 55 04 56 6f 00 80
E: 4.102851 10 04 0b b7 02 a4 07 56 6f 00 80
E: 4.109373 10 04 03 5c 05 5c 04 b0 6f 02 80
E: 4.110525 10 04 0b b7 02 a4 07 b0 6f 00 80
E: 4.115995 10 04 03 5b 05 5d 04 ec 6f 02 80
E: 4.117146 10 04 0b b7 02 a4 07 ec 6f 00 80
E: 4.122622 10 04 03 5b 05 62 04 32 70 02 80
E: 4.123790 10 04 0b b7 02 a4 07 32 70 00 80
E: 4.128980 10 04 03 5c 05 6b 04 6e 70 02 80
E: 4.130092 10 04 0b b7 02 a4 07 6e 70 00 80
E: 4.135377 10 04 03 5e 05 77 04 b4 70 02 80
E: 4.136503 10 04 0b c1 02 9e 07 b4 70 00 80
E: 4.141574 10 04 03 62 05 88 04 f0 70 02 80
E: 4.142724 10 04 0b d1 02 99 07 f0 70 00 80
E: 4.147975 10 04 03 67 05 9c 04 2c 71 02 80
E: 4.149123 10 04 0b e0 02 96 07 2c 71 00 80
E: 4.153912 10 04 03 74 05 b1 04 68 71 02 80
E: 4.155064 10 04 0b ee 02 96 07 68 71 00 80
E: 4.161239 10 04 03 89 05 c8 04 b8 71 02 80
E: 4.162393 10 04 09 ee 02 96 07 b8 71 00 80
E: 4.166434 10 04 03 ab 05 dc 04 ea 71 01 80
E: 4.171629 10 04 03 d0 05 eb 04 1c 72 01 80
E: 4.176807 10 04 03 ee 05 f3 04 4e 72 01 80
E: 4.182129 10 04 03 06 06 fb 04 8a 72 01 80
E: 4.187197 10 04 03 24 06 ff 04 bc 72 01 80
E: 4.192391 10 04 03 4a 06 02 05 ee 72 01 80
E: 4.197591 10 04 03 6d 06 03 05 20 73 01 80
E: 4.202766 10 04 03 85 06 03 05 5c 73 01 80
E: 4.209975 10 04 03 93 06 02 05 a2 73 01 80
E: 4.215171 10 04 03 9f 06 02 05 d4 73 01 80
E: 4.220339 10 04 03 a9 06 02 05 06 74 01 80
E: 4.225564 10 04 03 b1 06 03 05 38 74 01 80
E: 4.231697 10 04 03 b7 06 04 05 7e 74 01 80
E: 4.238053 10 04 03 bc 06 05 05 ba 74 01 80
E: 4.244408 10 04 03 bf 06 07 05 f6 74 01 80
E: 4.250808 10 04 03 c2 06 09 05 3c 75 02 80
E: 4.251949 10 04 07 c1 04 c7 07 3c 75 00 80
E: 4.259576 10 04 03 c4 06 0a 05 8c 75 02 80
E: 4.260719 10 04 07 c1 04 c7 07 8c 75 00 80
E: 4.265711 10 04 03 c5 06 0c 05 d2 75 02 80
E: 4.266854 10 04 07 c1 04 c7 07 d2 75 00 80
E: 4.272102 10 04 03 c4 06 0e 05 0e 76 02 80
E: 4.273244 10 04 07 c1 04 c7 07 0e 76 00 80
E: 4.278761 10 04 03 c1 06 11 05 54 76 02 80
E: 4.280172 10 04 07 c1 04 c7 07 54 76 00 80
E: 4.284888 10 04 03 bc 06 14 05 90 76 02 80
E: 4.286031 10 04 07 c1 04 c7 07 90 76 00 80
E: 4.291307 10 04 03 b7 06 17 05 cc 76 02 80
E: 4.292453 10 04 07 ad 04 d2 07 cc 76 00 80
E: 4.296516 10 04 03 b7 06 17 05 08 77 02 80
E: 4.297933 10 04 07 ad 04 d2 07 08 77 00 80
E: 4.301977 10 04 03 b7 06 17 05 3a 77 02 80
E: 4.303119 10 04 07 7e 04 db 07 3a 77 00 80
E: 4.309799 10 04 01 b7 06 17 05 8a 77 02 80
E: 4.311219 10 04 07 56 04 db 07 8a 77 00 80
E: 4.315224 10 04 07 38 04 cd 07 bc 77 01 80
E: 4.320887 10 04 07 24 04 bc 07 f8 77 01 80
E: 4.326334 10 04 07 15 04 a9 07 2a 78 01 80
E: 4.332172 10 04 07 09 04 91 07 66 78 01 80
E: 4.337345 10 04 07 00 04 6d 07 a2 78 01 80
E: 4.342751 10 04 07 fc 03 49 07 d4 78 01 80
E: 4.349397 10 04 07 fa 03 26 07 1a 79 01 80
E: 4.357928 10 04 07 fb 03 02 07 6a 79 01 80
E: 4.364488 10 04 07 00 04 cf 06 b0 79 01 80
E: 4.371151 10 04 03 01 06 cd 03 f6 79 02 80
E: 4.372307 10 04 07 04 04 a7 06 f6 79 00 80
E: 4.377783 10 04 03 01 06 cd 03 32 7a 02 80
E: 4.378932 10 04 07 06 04 88 06 32 7a 00 80
E: 4.384411 10 04 03 01 06 cd 03 78 7a 02 80
E: 4.385558 10 04 07 07 04 77 06 78 7a 00 80
E: 4.391054 10 04 03 01 06 cd 03 b4 7a 02 80
E: 4.392205 10 04 07 06 04 6c 06 b4 7a 00 80
E: 4.397899 10 04 03 01 06 cd 03 fa 7a 03 80
E: 4.399049 10 04 07 03 04 64 06 fa 7a 00 80
E: 4.400201 10 04 0b 18 09 5b 03 fa 7a 00 80
E: 4.405097 10 04 03 01 06 cd 03 4a 7b 03 80
E: 4.406244 10 04 07 02 04 5f 06 4a 7b 00 80
E: 4.407396 10 04 0b 18 09 5b 03 4a 7b 00 80
E: 4.413693 10 04 03 01 06 cd 03 9a 7b 03 80
E: 4.415109 10 04 07 03 04 5a 06 9a 7b 00 80
E: 4.416257 10 04 0b 18 09 5b 03 9a 7b 00 80
E: 4.420816 10 04 03 01 06 cd 03 e0 7b 03 80
E: 4.421957 10 04 07 06 04 58 06 e0 7b 00 80
E: 4.423099 10 04 0b 18 09 5b 03 e0 7b 00 80
E: 4.428137 10 04 03 01 06 cd 03 26 7c 03 80
E: 4.429276 10 04 07 0a 04 57 06 26 7c 00 80
E: 4.430654 10 04 0b 18 09 5b 03 26 7c 00 80
E: 4.435129 10 04 03 01 06 cd 03 6c 7c 03 80
E: 4.436514 10 04 07 0f 04 57 06 6c 7c 00 80
E: 4.437897 10 04 0b 18 09 5b 03 6c 7c 00 80
E: 4.441948 10 04 03 01 06 cd 03 bc 7c 03 80
E: 4.443357 10 04 07 15 04 58 06 bc 7c 00 80
E: 4.444769 10 04 0b 18 09 5b 03 bc 7c 00 80
E: 4.449242 10 04 03 01 06 cd 03 02 7d 03 80
E: 4.450653 10 04 07 1c 04 5a 06 02 7d 00 80
E: 4.452064 10 04 0b 18 09 5b 03 02 7d 00 80
E: 4.457782 10 04 03 01 06 cd 03 52 7d 03 80
E: 4.459195 10 04 07 24 04 5d 06 52 7d 00 80
E: 4.460606 10 04 0b 18 09 5b 03 52 7d 00 80
E: 4.464707 10 04 03 3a 06 c7 03 98 7d 03 80
E: 4.466116 10 04 07 2f 04 61 06 98 7d 00 80
E: 4.467529 10 04 0b 18 09 5b 03 98 7d 00 80
E: 4.472001 10 04 03 81 06 c1 03 de 7d 03 80
E: 4.473412 10 04 07 3f 04 67 06 de 7d 00 80
E: 4.474825 10 04 0b 53 09 76 03 de 7d 00 80
E: 4.478663 10 04 03 81 06 c1 03 24 7e 03 80
E: 4.480076 10 04 07 3f 04 67 06 24 7e 00 80
E: 4.481488 10 04 0b 53 09 76 03 24 7e 00 80
E: 4.485101 10 04 03 99 06 c1 03 6a 7e 03 80
E: 4.486240 10 04 07 3f 04 67 06 6a 7e 00 80
E: 4.487651 10 04 0b 9a 09 95 03 6a 7e 00 80
E: 4.491491 10 04 03 a2 06 c3 03 a6 7e 03 80
E: 4.492902 10 04 05 3f 04 67 06 a6 7e 00 80
E: 4.494315 10 04 0b a8 09 9c 03 a6 7e 00 80
E: 4.497594 10 04 03 a4 06 c6 03 e2 7e 02 80
E: 4.499006 10 04 0b ac 09 a0 03 e2 7e 00 80
E: 4.503519 10 04 03 a5 06 cb 03 1e 7f 02 80
E: 4.504931 10 04 0b ad 09 a3 03 1e 7f 00 80
E: 4.511101 10 04 03 a4 06 d0 03 6e 7f 02 80
E: 4.512514 10 04 0b ae 09 a5 03 6e 7f 00 80
E: 4.516979 10 04 03 a1 06 d6 03 aa 7f 02 80
E: 4.518118 10 04 0b ae 09 a6 03 aa 7f 00 80
E: 4.522729 10 04 03 9b 06 dd 03 dc 7f 02 80
E: 4.524140 10 04 0b ae 09 a7 03 dc 7f 00 80
E: 4.528155 10 04 03 92 06 e4 03 18 80 02 80
E: 4.529564 10 04 0b ad 09 a7 03 18 80 00 80
E: 4.534160 10 04 03 88 06 ea 03 54 80 02 80
E: 4.535572 10 04 0b aa 09 a7 03 54 80 00 80
E: 4.539653 10 04 03 7d 06 ef 03 90 80 02 80
E: 4.541063 10 04 0b a5 09 a7 03 90 80 00 80
E: 4.545695 10 04 03 72 06 f3 03 c2 80 02 80
E: 4.547107 10 04 0b 9f 09 a7 03 c2 80 00 80
E: 4.551423 10 04 03 69 06 f5 03 fe 80 02 80
E: 4.552837 10 04 0b 98 09 a6 03 fe 80 00 80
E: 4.559234 10 04 03 60 06 f5 03 4e 81 02 80
E: 4.560648 10 04 0b 98 09 a6 03 4e 81 00 80
E: 4.564933 10 04 03 57 06 f4 03 8a 81 02 80
E: 4.566349 10 04 0b 98 09 a6 03 8a 81 00 80
E: 4.570594 10 04 03 4f 06 f2 03 bc 81 02 80
E: 4.571982 10 04 09 98 09 a6 03 bc 81 00 80
E: 4.576252 10 04 03 47 06 ef 03 f8 81 01 80
E: 4.582581 10 04 03 41 06 ec 03 3e 82 01 80
E: 4.589672 10 04 03 3b 06 e7 03 84 82 01 80
E: 4.596502 10 04 03 35 06 e2 03 c0 82 01 80
E: 4.603293 10 04 03 30 06 dc 03 06 83 02 80
E: 4.604659 10 04 07 8e 03 da 06 06 83 00 80
E: 4.612377 10 04 03 2d 06 d8 03 60 83 02 80
E: 4.613793 10 04 07 8e 03 da 06 60 83 00 80
E: 4.619152 10 04 03 2a 06 d4 03 a6 83 02 80
E: 4.620564 10 04 07 8e 03 da 06 a6 83 00 80
E: 4.625999 10 04 03 28 06 d0 03 ec 83 02 80
E: 4.627416 10 04 07 8e 03 da 06 ec 83 00 80
E: 4.632579 10 04 03 27 06 cd 03 32 84 02 80
E: 4.633984 10 04 07 8e 03 da 06 32 84 00 80
E: 4.639713 10 04 03 27 06 ca 03 78 84 02 80
E: 4.641121 10 04 07 8e 03 da 06 78 84 00 80
E: 4.646571 10 04 03 28 06 c7 03 be 84 02 80
E: 4.647987 10 04 07 8e 03 da 06 be 84 00 80
E: 4.653427 10 04 03 2b 06 c5 03 04 85 02 80
E: 4.654841 10 04 07 8e 03 da 06 04 85 00 80
E: 4.662408 10 04 03 2f 06 c2 03 5e 85 02 80
E: 4.663541 10 04 07 8e 03 da 06 5e 85 00 80
E: 4.668980 10 04 03 34 06 c1 03 a4 85 02 80
E: 4.670340 10 04 07 8e 03 da 06 a4 85 00 80
E: 4.675838 10 04 03 39 06 c1 03 e0 85 02 80
E: 4.677244 10 04 07 8e 03 da 06 e0 85 00 80
E: 4.682325 10 04 03 3c 06 c1 03 26 86 02 80
E: 4.683460 10 04 07 8e 03 da 06 26 86 00 80
E: 4.689335 10 04 03 3f 06 c2 03 6c 86 03 80
E: 4.690753 10 04 07 8e 03 da 06 6c 86 00 80
E: 4.692161 10 04 0b b7 09 78 03 6c 86 00 80
E: 4.695170 10 04 03 3f 06 c2 03 a8 86 03 80
E: 4.696576 10 04 07 8e 03 da 06 a8 86 00 80
E: 4.697716 10 04 0b b7 09 78 03 a8 86 00 80
E: 4.701834 10 04 03 42 06 c4 03 e4 86 03 80
E: 4.703241 10 04 07 8e 03 da 06 e4 86 00 80
E: 4.704653 10 04 0b b7 09 78 03 e4 86 00 80
E: 4.709411 10 04 03 44 06 c5 03 34 87 03 80
E: 4.710817 10 04 05 8e 03 da 06 34 87 00 80
E: 4.712224 10 04 0b b7 09 78 03 34 87 00 80
E: 4.715391 10 04 03 46 06 c6 03 70 87 02 80
E: 4.716798 10 04 0b b7 09 78 03 70 87 00 80
E: 4.721481 10 04 03 47 06 c7 03 ac 87 02 80
E: 4.722894 10 04 0b b7 09 78 03 ac 87 00 80
E: 4.727255 10 04 03 48 06 c7 03 e8 87 02 80
E: 4.728667 10 04 0b b7 09 78 03 e8 87 00 80
E: 4.732982 10 04 03 49 06 c7 03 1a 88 02 80
E: 4.734401 10 04 0b b7 09 78 03 1a 88 00 80
E: 4.738549 10 04 03 4a 06 c6 03 56 88 02 80
E: 4.739963 10 04 0b b7 09 78 03 56 88 00 80
E: 4.744017 10 04 03 4a 06 c6 03 92 88 02 80
E: 4.745421 10 04 0b b7 09 78 03 92 88 00 80
E: 4.749476 10 04 03 4b 06 c4 03 c4 88 02 80
E: 4.750882 10 04 0b b7 09 78 03 c4 88 00 80
E: 4.757015 10 04 03 4b 06 c2 03 14 89 02 80
E: 4.758144 10 04 09 b7 09 78 03 14 89 00 80
E: 4.763361 10 04 03 4b 06 c0 03 50 89 01 80
E: 4.770168 10 04 03 4b 06 be 03 96 89 01 80
E: 4.776989 10 04 03 4b 06 bc 03 dc 89 01 80
E: 4.783849 10 04 03 4b 06 ba 03 22 8a 02 80
E: 4.785258 10 04 07 9e 03 d1 06 22 8a 00 80
E: 4.790704 10 04 03 4b 06 b8 03 5e 8a 02 80
E: 4.792116 10 04 07 9e 03 d1 06 5e 8a 00 80
E: 4.797556 10 04 03 4b 06 b7 03 a4 8a 02 80
E: 4.798960 10 04 07 9e 03 d1 06 a4 8a 00 80
E: 4.804134 10 04 03 4b 06 b6 03 ea 8a 02 80
E: 4.805538 10 04 07 9e 03 d1 06 ea 8a 00 80
E: 4.813112 10 04 03 4b 06 b5 03 44 8b 02 80
E: 4.814519 10 04 07 9e 03 d1 06 44 8b 00 80
E: 4.819945 10 04 03 4b 06 b5 03 8a 8b 02 80
E: 4.821351 10 04 07 9e 03 d1 06 8a 8b 00 80
E: 4.826808 10 04 03 4b 06 b5 03 d0 8b 02 80
E: 4.828215 10 04 07 9e 03 d1 06 d0 8b 00 80
E: 4.833941 10 04 03 4b 06 b5 03 16 8c 02 80
E: 4.835357 10 04 07 9e 03 d1 06 16 8c 00 80
E: 4.840796 10 04 03 4b 06 b4 03 5c 8c 02 80
E: 4.842209 10 04 07 9e 03 d1 06 5c 8c 00 80
E: 4.847673 10 04 03 4b 06 b3 03 a2 8c 02 80
E: 4.849082 10 04 07 9e 03 d1 06 a2 8c 00 80
E: 4.856405 10 04 03 4b 06 b2 03 f2 8c 02 80
E: 4.857815 10 04 07 9e 03 d1 06 f2 8c 00 80
E: 4.862809 10 04 03 4b 06 b1 03 38 8d 02 80
E: 4.864217 10 04 07 9e 03 d1 06 38 8d 00 80
E: 4.868921 10 04 03 4b 06 b0 03 74 8d 02 80
E: 4.870060 10 04 07 9e 03 d1 06 74 8d 00 80
E: 4.875373 10 04 03 4b 06 af 03 b0 8d 02 80
E: 4.876781 10 04 07 9e 03 d1 06 b0 8d 00 80
E: 4.881293 10 04 03 4b 06 af 03 ec 8d 02 80
E: 4.882701 10 04 07 9e 03 d1 06 ec 8d 00 80
E: 4.886953 10 04 03 4b 06 ae 03 28 8e 02 80
E: 4.888365 10 04 07 9e 03 d1 06 28 8e 00 80
E: 4.893350 10 04 03 4c 06 ad 03 6e 8e 02 80
E: 4.894763 10 04 05 9e 03 d1 06 6e 8e 00 80
E: 4.899231 10 04 03 4c 06 ad 03 a0 8e 01 80
E: 4.906618 10 04 03 4c 06 ad 03 f0 8e 01 80
E: 4.912960 10 04 03 4c 06 ad 03 2c 8f 01 80
E: 4.919500 10 04 03 4c 06 ad 03 72 8f 01 80
E: 4.926570 10 04 03 4c 06 ad 03 b8 8f 01 80
E: 4.933682 10 04 03 4c 06 ae 03 fe 8f 02 80
E: 4.935079 10 04 07 bb 03 c6 06 fe 8f 00 80
E: 4.940273 10 04 03 4c 06 af 03 44 90 02 80
E: 4.941933 10 04 07 bb 03 c6 06 44 90 00 80
E: 4.947396 10 04 03 4c 06 b0 03 8a 90 02 80
E: 4.949052 10 04 07 bb 03 c6 06 8a 90 00 80
E: 4.956086 10 04 03 4c 06 b0 03 da 90 02 80
E: 4.957472 10 04 07 bb 03 c6 06 da 90 00 80
E: 4.962937 10 04 03 4c 06 b0 03 20 91 02 80
E: 4.964592 10 04 07 bb 03 c6 06 20 91 00 80
E: 4.970120 10 04 03 4c 06 b0 03 66 91 02 80
E: 4.971508 10 04 07 bb 03 c6 06 66 91 00 80
E: 4.976862 10 04 03 4c 06 b0 03 ac 91 03 80
E: 4.978258 10 04 07 bb 03 c6 06 ac 91 00 80
E: 4.979647 10 04 0b 97 09 8b 03 ac 91 00 80
E: 4.984238 10 04 03 4c 06 af 03 f2 91 03 80
E: 4.985890 10 04 07 bb 03 c6 06 f2 91 00 80
E: 4.987279 10 04 0b 97 09 8b 03 f2 91 00 80
E: 4.990907 10 04 03 4c 06 ae 03 38 92 03 80
E: 4.992275 10 04 07 bb 03 c6 06 38 92 00 80
E: 4.993665 10 04 0b 97 09 8b 03 38 92 00 80
E: 4.997302 10 04 03 4c 06 ae 03 7e 92 03 80
E: 4.998956 10 04 07 bb 03 c6 06 7e 92 00 80
E: 5.000344 10 04 0b 97 09 8b 03 7e 92 00 80
E: 5.004629 10 04 03 4e 06 ac 03 c4 92 03 80
E: 5.006020 10 04 07 bb 03 c6 06 c4 92 00 80
E: 5.007678 10 04 0b 97 09 8b 03 c4 92 00 80
E: 5.010894 10 04 03 53 06 a9 03 0a 93 03 80
E: 5.012281 10 04 05 bb 03 c6 06 0a 93 00 80
E: 5.013668 10 04 0b 97 09 8b 03 0a 93 00 80
E: 5.016989 10 04 03 59 06 a6 03 46 93 02 80
E: 5.018655 10 04 0b 97 09 8b 03 46 93 00 80
E: 5.022696 10 04 03 5f 06 a3 03 78 93 02 80
E: 5.024348 10 04 0b 97 09 8b 03 78 93 00 80
E: 5.028634 10 04 03 65 06 a0 03 b4 93 02 80
E: 5.030027 10 04 0b 97 09 8b 03 b4 93 00 80
E: 5.034038 10 04 03 68 06 9d 03 f0 93 02 80
E: 5.035431 10 04 0b 97 09 8b 03 f0 93 00 80
E: 5.039970 10 04 03 6a 06 9a 03 2c 94 02 80
E: 5.041361 10 04 0b 97 09 8b 03 2c 94 00 80
E: 5.046170 10 04 03 6a 06 98 03 68 94 02 80
E: 5.047826 10 04 0b 97 09 8b 03 68 94 00 80
E: 5.051846 10 04 03 69 06 95 03 a4 94 02 80
E: 5.053498 10 04 0b 97 09 8b 03 a4 94 00 80
E: 5.060535 10 04 03 68 06 92 03 f4 94 02 80
E: 5.061923 10 04 0b 97 09 8b 03 f4 94 00 80
E: 5.067425 10 04 03 65 06 8f 03 3a 95 02 80
E: 5.068817 10 04 0b 97 09 8b 03 3a 95 00 80
E: 5.074623 10 04 03 62 06 8d 03 80 95 03 80
E: 5.076019 10 04 07 92 03 d1 06 80 95 00 80
E: 5.077406 10 04 0b 97 09 8b 03 80 95 00 80
E: 5.082184 10 04 03 5f 06 8b 03 d0 95 03 80
E: 5.083839 10 04 07 92 03 d1 06 d0 95 00 80
E: 5.085226 10 04 0b 97 09 8b 03 d0 95 00 80
E: 5.090079 10 04 03 5d 06 8a 03 20 96 03 80
E: 5.091735 10 04 07 92 03 d1 06 20 96 00 80
E: 5.093127 10 04 0b 97 09 8b 03 20 96 00 80
E: 5.097364 10 04 03 5c 06 89 03 66 96 03 80
E: 5.098753 10 04 07 92 03 d1 06 66 96 00 80
E: 5.100139 10 04 0b 97 09 8b 03 66 96 00 80
E: 5.106372 10 04 03 5b 06 88 03 c0 96 03 80
E: 5.107762 10 04 07 92 03 d1 06 c0 96 00 80
E: 5.109151 10 04 0b 97 09 8b 03 c0 96 00 80
E: 5.113698 10 04 03 5a 06 87 03 10 97 03 80
E: 5.115356 10 04 07 92 03 d1 06 10 97 00 80
E: 5.116743 10 04 0b 97 09 8b 03 10 97 00 80
E: 5.120598 10 04 03 5a 06 87 03 56 97 03 80
E: 5.121984 10 04 07 92 03 d1 06 56 97 00 80
E: 5.123372 10 04 0b 97 09 8b 03 56 97 00 80
E: 5.127497 10 04 03 5b 06 87 03 9c 97 03 80
E: 5.128889 10 04 07 92 03 d1 06 9c 97 00 80
E: 5.130281 10 04 0b 97 09 8b 03 9c 97 00 80
E: 5.133659 10 04 03 5d 06 87 03 d8 97 03 80
E: 5.134818 10 04 07 92 03 d1 06 d8 97 00 80
E: 5.135981 10 04 09 97 09 8b 03 d8 97 00 80
E: 5.139908 10 04 03 61 06 87 03 14 98 02 80
E: 5.141062 10 04 07 92 03 d1 06 14 98 00 80
E: 5.146077 10 04 03 61 06 87 03 50 98 02 80
E: 5.147235 10 04 07 92 03 d1 06 50 98 00 80
E: 5.153657 10 04 03 67 06 87 03 a0 98 02 80
E: 5.154816 10 04 07 92 03 d1 06 a0 98 00 80
E: 5.159780 10 04 03 6d 06 88 03 dc 98 02 80
E: 5.160934 10 04 05 92 03 d1 06 dc 98 00 80
E: 5.165901 10 04 03 71 06 89 03 18 99 01 80
E: 5.171792 10 04 03 74 06 8a 03 54 99 01 80
E: 5.177688 10 04 03 76 06 8b 03 90 99 01 80
E: 5.183678 10 04 03 77 06 8c 03 cc 99 01 80
E: 5.189494 10 04 03 78 06 8e 03 08 9a 01 80
E: 5.195360 10 04 03 78 06 90 03 44 9a 01 80
E: 5.201246 10 04 03 78 06 92 03 80 9a 01 80
E: 5.208620 10 04 03 78 06 94 03 c6 9a 01 80
E: 5.214740 10 04 03 79 06 97 03 02 9b 01 80
E: 5.220679 10 04 03 7a 06 9a 03 3e 9b 02 80
E: 5.221832 10 04 07 a1 09 8b 03 3e 9b 00 80
E: 5.226849 10 04 03 7b 06 9d 03 84 9b 02 80
E: 5.228003 10 04 07 a1 09 8b 03 84 9b 00 80
E: 5.233022 10 04 03 7c 06 9f 03 c0 9b 02 80
E: 5.234179 10 04 07 a1 09 8b 03 c0 9b 00 80
E: 5.239182 10 04 03 7d 06 a1 03 fc 9b 02 80
E: 5.240338 10 04 07 a1 09 8b 03 fc 9b 00 80
E: 5.244966 10 04 03 7e 06 a3 03 38 9c 02 80
E: 5.246121 10 04 07 a1 09 8b 03 38 9c 00 80
E: 5.250905 10 04 03 7f 06 a4 03 74 9c 02 80
E: 5.252060 10 04 07 a1 09 8b 03 74 9c 00 80
E: 5.258486 10 04 03 81 06 a5 03 ba 9c 02 80
E: 5.259639 10 04 07 a1 09 8b 03 ba 9c 00 80
E: 5.264660 10 04 03 83 06 a6 03 00 9d 02 80
E: 5.265814 10 04 07 a1 09 8b 03 00 9d 00 80
E: 5.271048 10 04 03 83 06 a6 03 3c 9d 02 80
E: 5.272203 10 04 07 a1 09 8b 03 3c 9d 00 80
E: 5.277912 10 04 03 85 06 a6 03 82 9d 02 80
E: 5.279069 10 04 07 a1 09 8b 03 82 9d 00 80
E: 5.284740 10 04 03 86 06 a6 03 c8 9d 02 80
E: 5.285897 10 04 05 a1 09 8b 03 c8 9d 00 80
E: 5.291617 10 04 03 87 06 a5 03 0e 9e 02 80
E: 5.292762 10 04 0b b3 03 db 06 0e 9e 00 80
E: 5.298699 10 04 03 88 06 a4 03 54 9e 02 80
E: 5.299852 10 04 0b b3 03 db 06 54 9e 00 80
E: 5.307956 10 04 03 89 06 a2 03 ae 9e 03 80
E: 5.309387 10 04 07 d0 09 67 03 ae 9e 00 80
E: 5.310546 10 04 0b b3 03 db 06 ae 9e 00 80
E: 5.315452 10 04 03 8a 06 a0 03 f4 9e 03 80
E: 5.316606 10 04 07 d0 09 67 03 f4 9e 00 80
E: 5.317761 10 04 0b b3 03 db 06 f4 9e 00 80
E: 5.323086 10 04 03 8a 06 9e 03 44 9f 03 80
E: 5.324242 10 04 07 d0 09 67 03 44 9f 00 80
E: 5.325398 10 04 0b b3 03 db 06 44 9f 00 80
E: 5.330745 10 04 03 8b 06 9c 03 94 9f 03 80
E: 5.331900 10 04 07 d0 09 67 03 94 9f 00 80
E: 5.333062 10 04 0b b3 03 db 06 94 9f 00 80
E: 5.338385 10 04 03 8c 06 9a 03 e4 9f 03 80
E: 5.339542 10 04 07 d0 09 67 03 e4 9f 00 80
E: 5.340698 10 04 0b b3 03 db 06 e4 9f 00 80
E: 5.345963 10 04 03 8d 06 99 03 2a a0 03 80
E: 5.347119 10 04 07 d0 09 67 03 2a a0 00 80
E: 5.348274 10 04 0b b3 03 db 06 2a a0 00 80
E: 5.354557 10 04 03 8e 06 98 03 84 a0 03 80
E: 5.355713 10 04 07 d0 09 67 03 84 a0 00 80
E: 5.356869 10 04 0b b3 03 db 06 84 a0 00 80
E: 5.361932 10 04 03 8f 06 98 03 ca a0 03 80
E: 5.363088 10 04 07 d0 09 67 03 ca a0 00 80
E: 5.364247 10 04 0b b3 03 db 06 ca a0 00 80
E: 5.368935 10 04 03 91 06 99 03 10 a1 03 80
E: 5.370092 10 04 07 d0 09 67 03 10 a1 00 80
E: 5.371250 10 04 0b b3 03 db 06 10 a1 00 80
E: 5.375460 10 04 03 92 06 9a 03 56 a1 03 80
E: 5.376617 10 04 07 d0 09 67 03 56 a1 00 80
E: 5.377781 10 04 0b b3 03 db 06 56 a1 00 80
E: 5.380012 10 04 03 92 06 9a 03 7e a1 03 80
E: 5.381168 10 04 07 d0 09 67 03 7e a1 00 80
E: 5.382342 10 04 0b b3 03 db 06 7e a1 00 80
E: 5.384312 10 04 01 92 06 9a 03 b0 a1 03 80
E: 5.385467 10 04 05 d0 09 67 03 b0 a1 00 80
E: 5.386624 10 04 09 b3 03 db 06 b0 a1 00 80
